No.,Time,Source,Destination,Protocol,Length,Info
1,0.0,100.86.121.59,172.66.164.67,TLSv1.2,362,Application Data
2,0.012845,172.66.164.67,100.86.121.59,TCP,66,443  >  53635 [ACK] Seq=1 Ack=297 Win=18 Len=0 TSval=868396040 TSecr=600692835
3,0.035785,172.66.164.67,100.86.121.59,TLSv1.2,232,Application Data
4,0.035788,172.66.164.67,100.86.121.59,TLSv1.2,108,Application Data
5,0.035932,100.86.121.59,172.66.164.67,TCP,66,53635  >  443 [ACK] Seq=297 Ack=209 Win=2045 Len=0 TSval=600692871 TSecr=868396063
6,0.036347,172.66.164.67,100.86.121.59,TLSv1.2,97,Application Data
7,0.036426,100.86.121.59,172.66.164.67,TCP,66,53635  >  443 [ACK] Seq=297 Ack=240 Win=2048 Len=0 TSval=600692872 TSecr=868396063
8,0.037732,100.86.121.59,172.66.164.67,TLSv1.2,101,Application Data
9,0.090805,172.66.164.67,100.86.121.59,TCP,66,443  >  53635 [ACK] Seq=240 Ack=332 Win=18 Len=0 TSval=868396118 TSecr=600692873
10,10.121804,100.86.121.59,172.66.164.67,TLSv1.2,404,Application Data
11,10.121861,100.86.121.59,172.66.164.67,TLSv1.2,105,Application Data
12,10.173023,172.66.164.67,100.86.121.59,TCP,66,443  >  53635 [ACK] Seq=240 Ack=709 Win=18 Len=0 TSval=868406178 TSecr=600702957
13,10.173386,172.66.164.67,100.86.121.59,TLSv1.2,105,Application Data
14,10.17347,100.86.121.59,172.66.164.67,TCP,66,53635  >  443 [ACK] Seq=709 Ack=279 Win=2048 Len=0 TSval=600703009 TSecr=868406178
15,10.382134,172.66.164.67,100.86.121.59,TLSv1.2,240,Application Data
16,10.382237,100.86.121.59,172.66.164.67,TCP,66,53635  >  443 [ACK] Seq=709 Ack=453 Win=2046 Len=0 TSval=600703218 TSecr=868406362
17,10.389093,100.86.121.59,172.66.164.67,TLSv1.2,521,Application Data
18,10.554952,172.66.164.67,100.86.121.59,TCP,66,443  >  53635 [ACK] Seq=453 Ack=1164 Win=18 Len=0 TSval=868406530 TSecr=600703224
19,11.627177,172.66.164.67,100.86.121.59,TLSv1.2,300,Application Data
20,11.627182,172.66.164.67,100.86.121.59,TCP,1514,443  >  53635 [ACK] Seq=687 Ack=1164 Win=18 Len=1448 TSval=868407599 TSecr=600703224 [TCP PDU reassembled in 32]
21,11.627185,172.66.164.67,100.86.121.59,TCP,1514,443  >  53635 [ACK] Seq=2135 Ack=1164 Win=18 Len=1448 TSval=868407599 TSecr=600703224 [TCP PDU reassembled in 32]
22,11.627191,172.66.164.67,100.86.121.59,TCP,1514,443  >  53635 [ACK] Seq=3583 Ack=1164 Win=18 Len=1448 TSval=868407599 TSecr=600703224 [TCP PDU reassembled in 32]
23,11.627195,172.66.164.67,100.86.121.59,TCP,1514,443  >  53635 [ACK] Seq=5031 Ack=1164 Win=18 Len=1448 TSval=868407599 TSecr=600703224 [TCP PDU reassembled in 32]
24,11.627198,172.66.164.67,100.86.121.59,TCP,1514,443  >  53635 [ACK] Seq=6479 Ack=1164 Win=18 Len=1448 TSval=868407599 TSecr=600703224 [TCP PDU reassembled in 32]
25,11.627201,172.66.164.67,100.86.121.59,TCP,1514,443  >  53635 [ACK] Seq=7927 Ack=1164 Win=18 Len=1448 TSval=868407599 TSecr=600703224 [TCP PDU reassembled in 32]
26,11.627204,172.66.164.67,100.86.121.59,TCP,1514,443  >  53635 [ACK] Seq=9375 Ack=1164 Win=18 Len=1448 TSval=868407599 TSecr=600703224 [TCP PDU reassembled in 32]
27,11.627206,172.66.164.67,100.86.121.59,TCP,1514,443  >  53635 [ACK] Seq=10823 Ack=1164 Win=18 Len=1448 TSval=868407599 TSecr=600703224 [TCP PDU reassembled in 32]
28,11.62721,172.66.164.67,100.86.121.59,TCP,1514,443  >  53635 [ACK] Seq=12271 Ack=1164 Win=18 Len=1448 TSval=868407599 TSecr=600703224 [TCP PDU reassembled in 32]
29,11.62738,172.66.164.67,100.86.121.59,TCP,1514,"443  >  53635 [PSH, ACK] Seq=13719 Ack=1164 Win=18 Len=1448 TSval=868407599 TSecr=600703224 [TCP PDU reassembled in 32]"
30,11.627388,172.66.164.67,100.86.121.59,TCP,1514,443  >  53635 [ACK] Seq=15167 Ack=1164 Win=18 Len=1448 TSval=868407600 TSecr=600703224 [TCP PDU reassembled in 32]
31,11.627486,100.86.121.59,172.66.164.67,TCP,66,53635  >  443 [ACK] Seq=1164 Ack=13719 Win=1841 Len=0 TSval=600704463 TSecr=868407599
32,11.627487,172.66.164.67,100.86.121.59,TLSv1.2,544,Application Data
33,11.62749,172.66.164.67,100.86.121.59,TCP,1514,443  >  53635 [ACK] Seq=17093 Ack=1164 Win=18 Len=1448 TSval=868407600 TSecr=600703224 [TCP PDU reassembled in 46]
34,11.627494,172.66.164.67,100.86.121.59,TCP,1514,443  >  53635 [ACK] Seq=18541 Ack=1164 Win=18 Len=1448 TSval=868407600 TSecr=600703224 [TCP PDU reassembled in 46]
35,11.627497,172.66.164.67,100.86.121.59,TCP,1514,443  >  53635 [ACK] Seq=19989 Ack=1164 Win=18 Len=1448 TSval=868407600 TSecr=600703224 [TCP PDU reassembled in 46]
36,11.627595,100.86.121.59,172.66.164.67,TCP,66,53635  >  443 [ACK] Seq=1164 Ack=16615 Win=1796 Len=0 TSval=600704463 TSecr=868407600
37,11.627602,172.66.164.67,100.86.121.59,TCP,1514,443  >  53635 [ACK] Seq=21437 Ack=1164 Win=18 Len=1448 TSval=868407600 TSecr=600703224 [TCP PDU reassembled in 46]
38,11.627605,172.66.164.67,100.86.121.59,TCP,1514,443  >  53635 [ACK] Seq=22885 Ack=1164 Win=18 Len=1448 TSval=868407600 TSecr=600703224 [TCP PDU reassembled in 46]
39,11.627613,100.86.121.59,172.66.164.67,TCP,66,53635  >  443 [ACK] Seq=1164 Ack=21437 Win=1721 Len=0 TSval=600704463 TSecr=868407600
40,11.62769,100.86.121.59,172.66.164.67,TCP,66,53635  >  443 [ACK] Seq=1164 Ack=24333 Win=1676 Len=0 TSval=600704463 TSecr=868407600
41,11.628301,100.86.121.59,172.66.164.67,TCP,66,[TCP Window Update] 53635  >  443 [ACK] Seq=1164 Ack=24333 Win=2048 Len=0 TSval=600704464 TSecr=868407600
42,11.628998,172.66.164.67,100.86.121.59,TCP,1514,443  >  53635 [ACK] Seq=24333 Ack=1164 Win=18 Len=1448 TSval=868407600 TSecr=600703224 [TCP PDU reassembled in 46]
43,11.629001,172.66.164.67,100.86.121.59,TCP,1514,443  >  53635 [ACK] Seq=25781 Ack=1164 Win=18 Len=1448 TSval=868407600 TSecr=600703224 [TCP PDU reassembled in 46]
44,11.629003,172.66.164.67,100.86.121.59,TCP,1514,443  >  53635 [ACK] Seq=27229 Ack=1164 Win=18 Len=1448 TSval=868407600 TSecr=600703224 [TCP PDU reassembled in 46]
45,11.629006,172.66.164.67,100.86.121.59,TCP,1514,443  >  53635 [ACK] Seq=28677 Ack=1164 Win=18 Len=1448 TSval=868407600 TSecr=600703224 [TCP PDU reassembled in 46]
46,11.629009,172.66.164.67,100.86.121.59,TLSv1.2,145,Application Data
47,11.629011,172.66.164.67,100.86.121.59,TLSv1.2,97,Application Data
48,11.629115,100.86.121.59,172.66.164.67,TCP,66,53635  >  443 [ACK] Seq=1164 Ack=30235 Win=1956 Len=0 TSval=600704464 TSecr=868407601
49,11.632822,100.86.121.59,172.66.164.67,TCP,66,[TCP Window Update] 53635  >  443 [ACK] Seq=1164 Ack=30235 Win=2048 Len=0 TSval=600704467 TSecr=868407601
50,11.633499,100.86.121.59,172.66.164.67,TLSv1.2,101,Application Data
51,11.685471,172.66.164.67,100.86.121.59,TCP,97,"[TCP Spurious Retransmission] 443  >  53635 [PSH, ACK] Seq=30204 Ack=1164 Win=18 Len=31 TSval=868407679 TSecr=600703224"
52,11.685555,100.86.121.59,172.66.164.67,TCP,78,[TCP Dup ACK 48#1] 53635  >  443 [ACK] Seq=1199 Ack=30235 Win=2048 Len=0 TSval=600704521 TSecr=868407679 SLE=30204 SRE=30235
53,11.704321,100.86.121.59,172.66.164.67,TLSv1.2,299,Application Data
54,11.710744,172.66.164.67,100.86.121.59,TCP,66,443  >  53635 [ACK] Seq=30235 Ack=1199 Win=18 Len=0 TSval=868407697 TSecr=600704469
55,11.809205,172.66.164.67,100.86.121.59,TCP,66,443  >  53635 [ACK] Seq=30235 Ack=1432 Win=18 Len=0 TSval=868407770 TSecr=600704540
56,11.851677,172.66.164.67,100.86.121.59,TLSv1.2,371,Application Data
57,11.851679,172.66.164.67,100.86.121.59,TLSv1.2,524,Application Data
58,11.85168,172.66.164.67,100.86.121.59,TLSv1.2,97,Application Data
59,11.851842,100.86.121.59,172.66.164.67,TCP,66,53635  >  443 [ACK] Seq=1432 Ack=31029 Win=2036 Len=0 TSval=600704687 TSecr=868407787
60,11.855498,100.86.121.59,172.66.164.67,TLSv1.2,254,Application Data
61,11.87055,100.86.121.59,172.66.164.67,TLSv1.2,987,Application Data
62,11.870642,100.86.121.59,172.66.164.67,TLSv1.2,147,Application Data
63,11.885362,172.66.164.67,100.86.121.59,TCP,97,"[TCP Spurious Retransmission] 443  >  53635 [PSH, ACK] Seq=30998 Ack=1432 Win=18 Len=31 TSval=868407887 TSecr=600704540"
64,11.885439,100.86.121.59,172.66.164.67,TCP,78,[TCP Dup ACK 59#1] 53635  >  443 [ACK] Seq=2622 Ack=31029 Win=2048 Len=0 TSval=600704721 TSecr=868407887 SLE=30998 SRE=31029
65,11.898744,100.86.121.59,172.66.164.67,TLSv1.2,518,Application Data
66,11.898843,100.86.121.59,172.66.164.67,TLSv1.2,197,Application Data
67,11.899138,100.86.121.59,172.66.164.67,TLSv1.2,199,Application Data
68,11.899756,100.86.121.59,172.66.164.67,TLSv1.2,198,Application Data
69,11.899846,100.86.121.59,172.66.164.67,TLSv1.2,564,Application Data
70,11.918098,172.66.164.67,100.86.121.59,TCP,66,443  >  53635 [ACK] Seq=31029 Ack=2622 Win=18 Len=0 TSval=868407924 TSecr=600704691
71,11.920692,172.66.164.67,100.86.121.59,TCP,66,443  >  53635 [ACK] Seq=31029 Ack=3968 Win=18 Len=0 TSval=868407944 TSecr=600704734
72,11.947352,172.66.164.67,100.86.121.59,TLSv1.2,128,Application Data
73,11.947353,172.66.164.67,100.86.121.59,TLSv1.2,108,Application Data
74,11.947354,172.66.164.67,100.86.121.59,TLSv1.2,97,Application Data
75,11.947357,172.66.164.67,100.86.121.59,TLSv1.2,160,Application Data
76,11.947358,172.66.164.67,100.86.121.59,TLSv1.2,145,Application Data
77,11.947445,100.86.121.59,172.66.164.67,TCP,66,53635  >  443 [ACK] Seq=3968 Ack=31337 Win=2044 Len=0 TSval=600704783 TSecr=868407954
78,11.961732,172.66.164.67,100.86.121.59,TLSv1.2,130,Application Data
79,11.961734,172.66.164.67,100.86.121.59,TLSv1.2,290,Application Data
80,11.961735,172.66.164.67,100.86.121.59,TLSv1.2,97,Application Data
81,11.961737,172.66.164.67,100.86.121.59,TLSv1.2,127,Application Data
82,11.961739,172.66.164.67,100.86.121.59,TLSv1.2,290,Application Data
83,11.96183,100.86.121.59,172.66.164.67,TCP,66,53635  >  443 [ACK] Seq=3968 Ack=31941 Win=2039 Len=0 TSval=600704797 TSecr=868407973
84,11.962416,172.66.164.67,100.86.121.59,TLSv1.2,97,Application Data
85,11.96242,172.66.164.67,100.86.121.59,TLSv1.2,214,Application Data
86,11.962421,172.66.164.67,100.86.121.59,TLSv1.2,290,Application Data
87,11.962422,172.66.164.67,100.86.121.59,TLSv1.2,97,Application Data
88,11.962425,172.66.164.67,100.86.121.59,TLSv1.2,127,Application Data
89,11.962425,172.66.164.67,100.86.121.59,TLSv1.2,290,Application Data
90,11.962426,172.66.164.67,100.86.121.59,TLSv1.2,97,Application Data
91,11.962429,172.66.164.67,100.86.121.59,TLSv1.2,127,Application Data
92,11.96243,172.66.164.67,100.86.121.59,TLSv1.2,290,Application Data
93,11.962479,100.86.121.59,172.66.164.67,TCP,66,53635  >  443 [ACK] Seq=3968 Ack=32976 Win=2032 Len=0 TSval=600704798 TSecr=868407976
94,11.96278,172.66.164.67,100.86.121.59,TLSv1.2,97,Application Data
95,11.962858,100.86.121.59,172.66.164.67,TCP,66,53635  >  443 [ACK] Seq=3968 Ack=33007 Win=2048 Len=0 TSval=600704798 TSecr=868407976
96,13.533278,100.86.121.59,172.66.164.67,TCP,54,[TCP Keep-Alive] 53635  >  443 [ACK] Seq=3967 Ack=33007 Win=2048 Len=0
97,13.546225,172.66.164.67,100.86.121.59,TCP,66,[TCP Keep-Alive ACK] 443  >  53635 [ACK] Seq=33007 Ack=3968 Win=18 Len=0 TSval=868409572 TSecr=600704798
98,14.999532,100.86.121.59,172.66.164.67,TLSv1.2,1304,Application Data
99,15.037239,172.66.164.67,100.86.121.59,TLSv1.2,200,Application Data
100,15.037243,172.66.164.67,100.86.121.59,TLSv1.2,108,Application Data
101,15.037289,172.66.164.67,100.86.121.59,TLSv1.2,97,Application Data
102,15.037448,100.86.121.59,172.66.164.67,TCP,66,53635  >  443 [ACK] Seq=5206 Ack=33183 Win=2046 Len=0 TSval=600707873 TSecr=868411064
103,15.03751,100.86.121.59,172.66.164.67,TCP,66,53635  >  443 [ACK] Seq=5206 Ack=33214 Win=2046 Len=0 TSval=600707873 TSecr=868411064
104,15.420774,100.86.121.59,172.66.164.67,TCP,54,[TCP Keep-Alive] 53635  >  443 [ACK] Seq=5205 Ack=33214 Win=2048 Len=0
105,15.434681,172.66.164.67,100.86.121.59,TCP,66,[TCP Keep-Alive ACK] 443  >  53635 [ACK] Seq=33214 Ack=5206 Win=18 Len=0 TSval=868411461 TSecr=600707873
106,16.491828,100.86.121.59,172.66.164.67,TLSv1.2,464,Application Data
107,16.543393,172.66.164.67,100.86.121.59,TCP,66,443  >  53635 [ACK] Seq=33214 Ack=5604 Win=18 Len=0 TSval=868412570 TSecr=600709327
108,16.973831,100.86.121.59,172.66.164.67,TLSv1.2,884,Application Data
109,16.985393,172.66.164.67,100.86.121.59,TCP,66,443  >  53635 [ACK] Seq=33214 Ack=6422 Win=18 Len=0 TSval=868413011 TSecr=600709809
110,17.010958,172.66.164.67,100.86.121.59,TLSv1.2,177,Application Data
111,17.010962,172.66.164.67,100.86.121.59,TLSv1.2,290,Application Data
112,17.010965,172.66.164.67,100.86.121.59,TLSv1.2,97,Application Data
113,17.01113,100.86.121.59,172.66.164.67,TCP,66,53635  >  443 [ACK] Seq=6422 Ack=33580 Win=2043 Len=0 TSval=600709846 TSecr=868413038
114,17.013416,100.86.121.59,172.66.164.67,TLSv1.2,101,Application Data
115,17.065922,172.66.164.67,100.86.121.59,TCP,66,443  >  53635 [ACK] Seq=33580 Ack=6457 Win=18 Len=0 TSval=868413093 TSecr=600709849
116,17.665999,172.66.164.67,100.86.121.59,TLSv1.2,233,Application Data
117,17.666002,172.66.164.67,100.86.121.59,TCP,1514,443  >  53635 [ACK] Seq=33747 Ack=6457 Win=18 Len=1448 TSval=868413632 TSecr=600709849 [TCP PDU reassembled in 132]
118,17.666077,172.66.164.67,100.86.121.59,TCP,1514,443  >  53635 [ACK] Seq=35195 Ack=6457 Win=18 Len=1448 TSval=868413632 TSecr=600709849 [TCP PDU reassembled in 132]
119,17.666081,172.66.164.67,100.86.121.59,TCP,1514,443  >  53635 [ACK] Seq=36643 Ack=6457 Win=18 Len=1448 TSval=868413632 TSecr=600709849 [TCP PDU reassembled in 132]
120,17.666085,172.66.164.67,100.86.121.59,TCP,1514,443  >  53635 [ACK] Seq=38091 Ack=6457 Win=18 Len=1448 TSval=868413632 TSecr=600709849 [TCP PDU reassembled in 132]
121,17.666089,172.66.164.67,100.86.121.59,TCP,1514,443  >  53635 [ACK] Seq=39539 Ack=6457 Win=18 Len=1448 TSval=868413632 TSecr=600709849 [TCP PDU reassembled in 132]
122,17.666092,172.66.164.67,100.86.121.59,TCP,1514,443  >  53635 [ACK] Seq=40987 Ack=6457 Win=18 Len=1448 TSval=868413632 TSecr=600709849 [TCP PDU reassembled in 132]
123,17.666095,172.66.164.67,100.86.121.59,TCP,1514,443  >  53635 [ACK] Seq=42435 Ack=6457 Win=18 Len=1448 TSval=868413632 TSecr=600709849 [TCP PDU reassembled in 132]
124,17.66624,100.86.121.59,172.66.164.67,TCP,66,53635  >  443 [ACK] Seq=6457 Ack=35195 Win=2023 Len=0 TSval=600710501 TSecr=868413632
125,17.666277,172.66.164.67,100.86.121.59,TCP,1514,443  >  53635 [ACK] Seq=43883 Ack=6457 Win=18 Len=1448 TSval=868413632 TSecr=600709849 [TCP PDU reassembled in 132]
126,17.66628,172.66.164.67,100.86.121.59,TCP,1514,443  >  53635 [ACK] Seq=45331 Ack=6457 Win=18 Len=1448 TSval=868413632 TSecr=600709849 [TCP PDU reassembled in 132]
127,17.666346,100.86.121.59,172.66.164.67,TCP,66,53635  >  443 [ACK] Seq=6457 Ack=43883 Win=1888 Len=0 TSval=600710502 TSecr=868413632
128,17.66637,100.86.121.59,172.66.164.67,TCP,66,53635  >  443 [ACK] Seq=6457 Ack=46779 Win=1843 Len=0 TSval=600710502 TSecr=868413632
129,17.666433,100.86.121.59,172.66.164.67,TCP,66,[TCP Window Update] 53635  >  443 [ACK] Seq=6457 Ack=46779 Win=2048 Len=0 TSval=600710502 TSecr=868413632
130,17.666468,172.66.164.67,100.86.121.59,TCP,1514,"443  >  53635 [PSH, ACK] Seq=46779 Ack=6457 Win=18 Len=1448 TSval=868413632 TSecr=600709849 [TCP PDU reassembled in 132]"
131,17.66647,172.66.164.67,100.86.121.59,TCP,1514,443  >  53635 [ACK] Seq=48227 Ack=6457 Win=18 Len=1448 TSval=868413633 TSecr=600709849 [TCP PDU reassembled in 132]
132,17.666473,172.66.164.67,100.86.121.59,TLSv1.2,544,Application Data
133,17.666476,172.66.164.67,100.86.121.59,TCP,1514,443  >  53635 [ACK] Seq=50153 Ack=6457 Win=18 Len=1448 TSval=868413633 TSecr=600709849 [TCP PDU reassembled in 151]
134,17.666527,172.66.164.67,100.86.121.59,TCP,1514,443  >  53635 [ACK] Seq=51601 Ack=6457 Win=18 Len=1448 TSval=868413633 TSecr=600709849 [TCP PDU reassembled in 151]
135,17.66653,172.66.164.67,100.86.121.59,TCP,1514,443  >  53635 [ACK] Seq=53049 Ack=6457 Win=18 Len=1448 TSval=868413633 TSecr=600709849 [TCP PDU reassembled in 151]
136,17.666547,100.86.121.59,172.66.164.67,TCP,66,53635  >  443 [ACK] Seq=6457 Ack=51601 Win=1973 Len=0 TSval=600710502 TSecr=868413633
137,17.666563,100.86.121.59,172.66.164.67,TCP,66,53635  >  443 [ACK] Seq=6457 Ack=54497 Win=1928 Len=0 TSval=600710502 TSecr=868413633
138,17.666632,172.66.164.67,100.86.121.59,TCP,1514,443  >  53635 [ACK] Seq=54497 Ack=6457 Win=18 Len=1448 TSval=868413633 TSecr=600709849 [TCP PDU reassembled in 151]
139,17.666635,172.66.164.67,100.86.121.59,TCP,1514,443  >  53635 [ACK] Seq=55945 Ack=6457 Win=18 Len=1448 TSval=868413633 TSecr=600709849 [TCP PDU reassembled in 151]
140,17.666661,100.86.121.59,172.66.164.67,TCP,66,53635  >  443 [ACK] Seq=6457 Ack=57393 Win=1883 Len=0 TSval=600710502 TSecr=868413633
141,17.666752,172.66.164.67,100.86.121.59,TCP,1514,443  >  53635 [ACK] Seq=57393 Ack=6457 Win=18 Len=1448 TSval=868413633 TSecr=600709849 [TCP PDU reassembled in 151]
142,17.666754,172.66.164.67,100.86.121.59,TCP,1514,443  >  53635 [ACK] Seq=58841 Ack=6457 Win=18 Len=1448 TSval=868413633 TSecr=600709849 [TCP PDU reassembled in 151]
143,17.666794,100.86.121.59,172.66.164.67,TCP,66,53635  >  443 [ACK] Seq=6457 Ack=60289 Win=1838 Len=0 TSval=600710502 TSecr=868413633
144,17.666891,100.86.121.59,172.66.164.67,TCP,66,[TCP Window Update] 53635  >  443 [ACK] Seq=6457 Ack=60289 Win=2048 Len=0 TSval=600710502 TSecr=868413633
145,17.667183,172.66.164.67,100.86.121.59,TCP,1514,443  >  53635 [ACK] Seq=60289 Ack=6457 Win=18 Len=1448 TSval=868413633 TSecr=600709849 [TCP PDU reassembled in 151]
146,17.667186,172.66.164.67,100.86.121.59,TCP,1514,443  >  53635 [ACK] Seq=61737 Ack=6457 Win=18 Len=1448 TSval=868413633 TSecr=600709849 [TCP PDU reassembled in 151]
147,17.667213,100.86.121.59,172.66.164.67,TCP,66,53635  >  443 [ACK] Seq=6457 Ack=63185 Win=2003 Len=0 TSval=600710503 TSecr=868413633
148,17.667241,100.86.121.59,172.66.164.67,TCP,66,[TCP Window Update] 53635  >  443 [ACK] Seq=6457 Ack=63185 Win=2048 Len=0 TSval=600710503 TSecr=868413633
149,17.668435,172.66.164.67,100.86.121.59,TCP,1514,"443  >  53635 [PSH, ACK] Seq=63185 Ack=6457 Win=18 Len=1448 TSval=868413633 TSecr=600709849 [TCP PDU reassembled in 151]"
150,17.668438,172.66.164.67,100.86.121.59,TCP,1514,443  >  53635 [ACK] Seq=64633 Ack=6457 Win=18 Len=1448 TSval=868413634 TSecr=600709849 [TCP PDU reassembled in 151]
151,17.66844,172.66.164.67,100.86.121.59,TLSv1.2,1514,Application Data
152,17.668443,172.66.164.67,100.86.121.59,TLSv1.2,1029,"Application Data, Application Data"
153,17.668522,100.86.121.59,172.66.164.67,TCP,66,53635  >  443 [ACK] Seq=6457 Ack=68492 Win=1966 Len=0 TSval=600710504 TSecr=868413634
154,17.670072,100.86.121.59,172.66.164.67,TCP,66,[TCP Window Update] 53635  >  443 [ACK] Seq=6457 Ack=68492 Win=2048 Len=0 TSval=600710505 TSecr=868413634
155,17.741471,100.86.121.59,172.66.164.67,TLSv1.2,252,Application Data
156,17.757393,100.86.121.59,172.66.164.67,TLSv1.2,183,Application Data
157,17.757569,100.86.121.59,172.66.164.67,TLSv1.2,958,Application Data
158,17.765538,172.66.164.67,100.86.121.59,TCP,66,443  >  53635 [ACK] Seq=68492 Ack=6643 Win=18 Len=0 TSval=868413779 TSecr=600710577
159,17.768368,100.86.121.59,172.66.164.67,TLSv1.2,472,Application Data
160,17.768742,100.86.121.59,172.66.164.67,TLSv1.2,197,Application Data
161,17.768913,100.86.121.59,172.66.164.67,TLSv1.2,289,Application Data
162,17.76898,100.86.121.59,172.66.164.67,TLSv1.2,198,Application Data
163,17.769047,100.86.121.59,172.66.164.67,TLSv1.2,196,Application Data
164,17.777932,172.66.164.67,100.86.121.59,TLSv1.2,151,Application Data
165,17.778059,100.86.121.59,172.66.164.67,TCP,66,53635  >  443 [ACK] Seq=8674 Ack=68577 Win=2047 Len=0 TSval=600710613 TSecr=868413799
166,17.778104,172.66.164.67,100.86.121.59,TLSv1.2,108,Application Data
167,17.778105,172.66.164.67,100.86.121.59,TLSv1.2,97,Application Data
168,17.778141,100.86.121.59,172.66.164.67,TCP,66,53635  >  443 [ACK] Seq=8674 Ack=68650 Win=2046 Len=0 TSval=600710614 TSecr=868413799
169,17.781806,172.66.164.67,100.86.121.59,TCP,66,443  >  53635 [ACK] Seq=68650 Ack=8674 Win=18 Len=0 TSval=868413808 TSecr=600710604
170,17.807361,172.66.164.67,100.86.121.59,TLSv1.2,128,Application Data
171,17.807364,172.66.164.67,100.86.121.59,TLSv1.2,209,Application Data
172,17.807516,100.86.121.59,172.66.164.67,TCP,66,53635  >  443 [ACK] Seq=8674 Ack=68855 Win=2045 Len=0 TSval=600710643 TSecr=868413822
173,17.820429,172.66.164.67,100.86.121.59,TLSv1.2,127,Application Data
174,17.820431,172.66.164.67,100.86.121.59,TLSv1.2,290,Application Data
175,17.820432,172.66.164.67,100.86.121.59,TLSv1.2,97,Application Data
176,17.820432,172.66.164.67,100.86.121.59,TLSv1.2,127,Application Data
177,17.820433,172.66.164.67,100.86.121.59,TLSv1.2,290,Application Data
178,17.820434,172.66.164.67,100.86.121.59,TLSv1.2,97,Application Data
179,17.820435,172.66.164.67,100.86.121.59,TLSv1.2,127,Application Data
180,17.820435,172.66.164.67,100.86.121.59,TLSv1.2,290,Application Data
181,17.820436,172.66.164.67,100.86.121.59,TLSv1.2,97,Application Data
182,17.820437,172.66.164.67,100.86.121.59,TLSv1.2,127,Application Data
183,17.820438,172.66.164.67,100.86.121.59,TLSv1.2,290,Application Data
184,17.820439,172.66.164.67,100.86.121.59,TLSv1.2,97,Application Data
185,17.820439,172.66.164.67,100.86.121.59,TLSv1.2,135,Application Data
186,17.82044,172.66.164.67,100.86.121.59,TLSv1.2,290,Application Data
187,17.82044,172.66.164.67,100.86.121.59,TLSv1.2,97,Application Data
188,17.820501,100.86.121.59,172.66.164.67,TCP,66,53635  >  443 [ACK] Seq=8674 Ack=70443 Win=2024 Len=0 TSval=600710656 TSecr=868413832
189,22.8331,100.86.121.59,172.66.164.67,TLSv1.2,616,Application Data
190,22.833529,100.86.121.59,172.66.164.67,TLSv1.2,299,Application Data
191,22.833866,100.86.121.59,172.66.164.67,TLSv1.2,1010,Application Data
192,22.922988,100.86.121.59,172.66.164.67,TCP,1454,"[TCP Retransmission] 53635  >  443 [PSH, ACK] Seq=9013 Ack=70443 Win=2048 Len=1388 TSval=600715758 TSecr=868413832"
193,22.946878,172.66.164.67,100.86.121.59,TCP,66,443  >  53635 [ACK] Seq=70443 Ack=10401 Win=18 Len=0 TSval=868418909 TSecr=600715668
194,22.982215,172.66.164.67,100.86.121.59,TLSv1.2,150,Application Data
195,22.982219,172.66.164.67,100.86.121.59,TLSv1.2,290,Application Data
196,22.982443,100.86.121.59,172.66.164.67,TCP,66,53635  >  443 [ACK] Seq=10401 Ack=70751 Win=2044 Len=0 TSval=600715818 TSecr=868418930
197,22.983943,172.66.164.67,100.86.121.59,TLSv1.2,97,Application Data
198,22.983946,172.66.164.67,100.86.121.59,TLSv1.2,127,Application Data
199,22.983948,172.66.164.67,100.86.121.59,TLSv1.2,290,Application Data
200,22.98395,172.66.164.67,100.86.121.59,TLSv1.2,97,Application Data
201,22.983953,172.66.164.67,100.86.121.59,TLSv1.2,127,Application Data
202,22.983956,172.66.164.67,100.86.121.59,TLSv1.2,290,Application Data
203,22.983959,172.66.164.67,100.86.121.59,TLSv1.2,97,Application Data
204,22.984053,100.86.121.59,172.66.164.67,TCP,66,53635  >  443 [ACK] Seq=10401 Ack=71414 Win=2038 Len=0 TSval=600715819 TSecr=868418935
205,22.985399,100.86.121.59,172.66.164.67,TLSv1.2,101,Application Data
206,23.025623,172.66.164.67,100.86.121.59,TCP,78,[TCP Dup ACK 193#1] 443  >  53635 [ACK] Seq=71414 Ack=10401 Win=18 Len=0 TSval=868419016 TSecr=600715758 SLE=9013 SRE=10401
207,23.124587,172.66.164.67,100.86.121.59,TCP,66,443  >  53635 [ACK] Seq=71414 Ack=10436 Win=18 Len=0 TSval=868419060 TSecr=600715821
208,27.832176,100.86.121.59,172.66.164.67,TLSv1.2,502,Application Data
209,27.832287,100.86.121.59,172.66.164.67,TLSv1.2,197,Application Data
210,27.846108,172.66.164.67,100.86.121.59,TCP,66,443  >  53635 [ACK] Seq=71414 Ack=11003 Win=18 Len=0 TSval=868423873 TSecr=600720668
211,27.873386,172.66.164.67,100.86.121.59,TLSv1.2,247,Application Data
212,27.873389,172.66.164.67,100.86.121.59,TLSv1.2,290,Application Data
213,27.873616,100.86.121.59,172.66.164.67,TCP,66,53635  >  443 [ACK] Seq=11003 Ack=71819 Win=2042 Len=0 TSval=600720709 TSecr=868423900
214,27.873861,172.66.164.67,100.86.121.59,TLSv1.2,97,Application Data
215,27.873864,172.66.164.67,100.86.121.59,TLSv1.2,127,Application Data
216,27.873972,100.86.121.59,172.66.164.67,TCP,66,53635  >  443 [ACK] Seq=11003 Ack=71911 Win=2047 Len=0 TSval=600720709 TSecr=868423901
217,27.874188,172.66.164.67,100.86.121.59,TLSv1.2,290,Application Data
218,27.874194,172.66.164.67,100.86.121.59,TLSv1.2,97,Application Data
219,27.87426,100.86.121.59,172.66.164.67,TCP,66,53635  >  443 [ACK] Seq=11003 Ack=72166 Win=2045 Len=0 TSval=600720710 TSecr=868423901
220,28.412684,100.86.121.59,172.66.164.67,TLSv1.2,338,Application Data
221,28.464583,172.66.164.67,100.86.121.59,TCP,66,443  >  53635 [ACK] Seq=72166 Ack=11275 Win=18 Len=0 TSval=868424492 TSecr=600721248
222,28.508861,172.66.164.67,100.86.121.59,TLSv1.2,201,Application Data
223,28.508864,172.66.164.67,100.86.121.59,TCP,1514,443  >  53635 [ACK] Seq=72301 Ack=11275 Win=18 Len=1448 TSval=868424535 TSecr=600721248 [TCP PDU reassembled in 233]
224,28.508952,100.86.121.59,172.66.164.67,TCP,66,53635  >  443 [ACK] Seq=11275 Ack=73749 Win=2024 Len=0 TSval=600721344 TSecr=868424535
225,28.509133,172.66.164.67,100.86.121.59,TCP,1514,443  >  53635 [ACK] Seq=73749 Ack=11275 Win=18 Len=1448 TSval=868424535 TSecr=600721248 [TCP PDU reassembled in 233]
226,28.509135,172.66.164.67,100.86.121.59,TCP,1514,443  >  53635 [ACK] Seq=75197 Ack=11275 Win=18 Len=1448 TSval=868424535 TSecr=600721248 [TCP PDU reassembled in 233]
227,28.509185,100.86.121.59,172.66.164.67,TCP,66,53635  >  443 [ACK] Seq=11275 Ack=76645 Win=2003 Len=0 TSval=600721344 TSecr=868424535
228,28.509238,100.86.121.59,172.66.164.67,TCP,66,[TCP Window Update] 53635  >  443 [ACK] Seq=11275 Ack=76645 Win=2048 Len=0 TSval=600721345 TSecr=868424535
229,28.51046,172.66.164.67,100.86.121.59,TCP,1514,443  >  53635 [ACK] Seq=76645 Ack=11275 Win=18 Len=1448 TSval=868424535 TSecr=600721248 [TCP PDU reassembled in 233]
230,28.510462,172.66.164.67,100.86.121.59,TCP,1514,443  >  53635 [ACK] Seq=78093 Ack=11275 Win=18 Len=1448 TSval=868424535 TSecr=600721248 [TCP PDU reassembled in 233]
231,28.510465,172.66.164.67,100.86.121.59,TCP,1514,443  >  53635 [ACK] Seq=79541 Ack=11275 Win=18 Len=1448 TSval=868424535 TSecr=600721248 [TCP PDU reassembled in 233]
232,28.510467,172.66.164.67,100.86.121.59,TCP,1514,443  >  53635 [ACK] Seq=80989 Ack=11275 Win=18 Len=1448 TSval=868424535 TSecr=600721248 [TCP PDU reassembled in 233]
233,28.510469,172.66.164.67,100.86.121.59,TLSv1.2,894,Application Data
234,28.510566,100.86.121.59,172.66.164.67,TCP,66,53635  >  443 [ACK] Seq=11275 Ack=83265 Win=1945 Len=0 TSval=600721346 TSecr=868424535
235,28.510752,100.86.121.59,172.66.164.67,TCP,66,[TCP Window Update] 53635  >  443 [ACK] Seq=11275 Ack=83265 Win=2048 Len=0 TSval=600721346 TSecr=868424535
236,28.512439,100.86.121.59,172.66.164.67,TLSv1.2,101,Application Data
237,28.513742,172.66.164.67,100.86.121.59,TCP,1514,443  >  53635 [ACK] Seq=83265 Ack=11275 Win=18 Len=1448 TSval=868424540 TSecr=600721248 [TCP PDU reassembled in 254]
238,28.513744,172.66.164.67,100.86.121.59,TCP,1514,443  >  53635 [ACK] Seq=84713 Ack=11275 Win=18 Len=1448 TSval=868424540 TSecr=600721248 [TCP PDU reassembled in 254]
239,28.513838,100.86.121.59,172.66.164.67,TCP,66,53635  >  443 [ACK] Seq=11310 Ack=86161 Win=2003 Len=0 TSval=600721349 TSecr=868424540
240,28.51389,100.86.121.59,172.66.164.67,TCP,66,[TCP Window Update] 53635  >  443 [ACK] Seq=11310 Ack=86161 Win=2048 Len=0 TSval=600721349 TSecr=868424540
241,28.514727,172.66.164.67,100.86.121.59,TCP,1514,443  >  53635 [ACK] Seq=86161 Ack=11275 Win=18 Len=1448 TSval=868424540 TSecr=600721248 [TCP PDU reassembled in 254]
242,28.514729,172.66.164.67,100.86.121.59,TCP,1514,443  >  53635 [ACK] Seq=87609 Ack=11275 Win=18 Len=1448 TSval=868424540 TSecr=600721248 [TCP PDU reassembled in 254]
243,28.514744,172.66.164.67,100.86.121.59,TCP,1514,443  >  53635 [ACK] Seq=89057 Ack=11275 Win=18 Len=1448 TSval=868424540 TSecr=600721248 [TCP PDU reassembled in 254]
244,28.514746,172.66.164.67,100.86.121.59,TCP,1514,443  >  53635 [ACK] Seq=90505 Ack=11275 Win=18 Len=1448 TSval=868424540 TSecr=600721248 [TCP PDU reassembled in 254]
245,28.514807,100.86.121.59,172.66.164.67,TCP,66,53635  >  443 [ACK] Seq=11310 Ack=91953 Win=1958 Len=0 TSval=600721350 TSecr=868424540
246,28.514858,100.86.121.59,172.66.164.67,TCP,66,[TCP Window Update] 53635  >  443 [ACK] Seq=11310 Ack=91953 Win=2048 Len=0 TSval=600721350 TSecr=868424540
247,28.515038,172.66.164.67,100.86.121.59,TCP,1514,443  >  53635 [ACK] Seq=91953 Ack=11275 Win=18 Len=1448 TSval=868424540 TSecr=600721248 [TCP PDU reassembled in 254]
248,28.51504,172.66.164.67,100.86.121.59,TCP,1514,443  >  53635 [ACK] Seq=93401 Ack=11275 Win=18 Len=1448 TSval=868424540 TSecr=600721248 [TCP PDU reassembled in 254]
249,28.515096,100.86.121.59,172.66.164.67,TCP,66,53635  >  443 [ACK] Seq=11310 Ack=94849 Win=2003 Len=0 TSval=600721350 TSecr=868424540
250,28.515127,100.86.121.59,172.66.164.67,TCP,66,[TCP Window Update] 53635  >  443 [ACK] Seq=11310 Ack=94849 Win=2048 Len=0 TSval=600721350 TSecr=868424540
251,28.516129,172.66.164.67,100.86.121.59,TCP,1514,443  >  53635 [ACK] Seq=94849 Ack=11275 Win=18 Len=1448 TSval=868424540 TSecr=600721248 [TCP PDU reassembled in 254]
252,28.516131,172.66.164.67,100.86.121.59,TCP,1514,"443  >  53635 [PSH, ACK] Seq=96297 Ack=11275 Win=18 Len=1448 TSval=868424540 TSecr=600721248 [TCP PDU reassembled in 254]"
253,28.516134,172.66.164.67,100.86.121.59,TCP,1514,443  >  53635 [ACK] Seq=97745 Ack=11275 Win=18 Len=1448 TSval=868424540 TSecr=600721248 [TCP PDU reassembled in 254]
254,28.516136,172.66.164.67,100.86.121.59,TLSv1.2,1514,Application Data
255,28.516166,172.66.164.67,100.86.121.59,TLSv1.2,619,"Application Data, Application Data"
256,28.51622,100.86.121.59,172.66.164.67,TCP,66,53635  >  443 [ACK] Seq=11310 Ack=101194 Win=1949 Len=0 TSval=600721352 TSecr=868424540
257,28.516258,100.86.121.59,172.66.164.67,TCP,66,[TCP Window Update] 53635  >  443 [ACK] Seq=11310 Ack=101194 Win=2048 Len=0 TSval=600721352 TSecr=868424540
258,28.522441,172.66.164.67,100.86.121.59,TCP,66,443  >  53635 [ACK] Seq=101194 Ack=11310 Win=18 Len=0 TSval=868424550 TSecr=600721348
259,28.545527,100.86.121.59,172.66.164.67,TLSv1.2,695,Application Data
260,28.55631,172.66.164.67,100.86.121.59,TCP,66,443  >  53635 [ACK] Seq=101194 Ack=11939 Win=18 Len=0 TSval=868424583 TSecr=600721381
261,28.576807,100.86.121.59,172.66.164.67,TLSv1.2,1262,Application Data
262,28.57694,100.86.121.59,172.66.164.67,TLSv1.2,299,Application Data
263,28.577162,100.86.121.59,172.66.164.67,TLSv1.2,201,Application Data
264,28.577251,100.86.121.59,172.66.164.67,TLSv1.2,199,Application Data
265,28.577338,100.86.121.59,172.66.164.67,TLSv1.2,197,Application Data
266,28.602405,172.66.164.67,100.86.121.59,TLSv1.2,128,Application Data
267,28.602406,172.66.164.67,100.86.121.59,TLSv1.2,108,Application Data
268,28.602407,172.66.164.67,100.86.121.59,TLSv1.2,97,Application Data
269,28.602506,100.86.121.59,172.66.164.67,TCP,66,53635  >  443 [ACK] Seq=13767 Ack=101329 Win=2046 Len=0 TSval=600721438 TSecr=868424611
270,28.639708,172.66.164.67,100.86.121.59,TCP,66,443  >  53635 [ACK] Seq=101329 Ack=13368 Win=18 Len=0 TSval=868424666 TSecr=600721412
271,28.646048,172.66.164.67,100.86.121.59,TCP,66,443  >  53635 [ACK] Seq=101329 Ack=13767 Win=18 Len=0 TSval=868424667 TSecr=600721412
272,28.675383,172.66.164.67,100.86.121.59,TLSv1.2,127,Application Data
273,28.675385,172.66.164.67,100.86.121.59,TLSv1.2,290,Application Data
274,28.675387,172.66.164.67,100.86.121.59,TLSv1.2,97,Application Data
275,28.675388,172.66.164.67,100.86.121.59,TLSv1.2,127,Application Data
276,28.675389,172.66.164.67,100.86.121.59,TLSv1.2,290,Application Data
277,28.675391,172.66.164.67,100.86.121.59,TLSv1.2,97,Application Data
278,28.675392,172.66.164.67,100.86.121.59,TLSv1.2,127,Application Data
279,28.675393,172.66.164.67,100.86.121.59,TLSv1.2,290,Application Data
280,28.675394,172.66.164.67,100.86.121.59,TLSv1.2,97,Application Data
281,28.675401,172.66.164.67,100.86.121.59,TLSv1.2,127,Application Data
282,28.675402,172.66.164.67,100.86.121.59,TLSv1.2,290,Application Data
283,28.675403,172.66.164.67,100.86.121.59,TLSv1.2,97,Application Data
284,28.675596,100.86.121.59,172.66.164.67,TCP,66,53635  >  443 [ACK] Seq=13767 Ack=102593 Win=2029 Len=0 TSval=600721511 TSecr=868424696
285,28.676561,172.66.164.67,100.86.121.59,TLSv1.2,127,Application Data
286,28.676562,172.66.164.67,100.86.121.59,TLSv1.2,290,Application Data
287,28.676563,172.66.164.67,100.86.121.59,TLSv1.2,97,Application Data
288,28.676631,100.86.121.59,172.66.164.67,TCP,66,53635  >  443 [ACK] Seq=13767 Ack=102909 Win=2044 Len=0 TSval=600721512 TSecr=868424696
289,33.685032,100.86.121.59,172.66.164.67,TLSv1.2,196,Application Data
290,33.685476,100.86.121.59,172.66.164.67,TLSv1.2,196,Application Data
291,33.685776,100.86.121.59,172.66.164.67,TLSv1.2,200,Application Data
292,33.697038,172.66.164.67,100.86.121.59,TCP,66,443  >  53635 [ACK] Seq=102909 Ack=14027 Win=18 Len=0 TSval=868429724 TSecr=600726520
293,33.724467,172.66.164.67,100.86.121.59,TLSv1.2,150,Application Data
294,33.72447,172.66.164.67,100.86.121.59,TLSv1.2,290,Application Data
295,33.724473,172.66.164.67,100.86.121.59,TLSv1.2,97,Application Data
296,33.724664,100.86.121.59,172.66.164.67,TCP,66,53635  >  443 [ACK] Seq=14161 Ack=103248 Win=2043 Len=0 TSval=600726560 TSecr=868429751
297,33.725106,172.66.164.67,100.86.121.59,TLSv1.2,127,Application Data
298,33.725109,172.66.164.67,100.86.121.59,TLSv1.2,290,Application Data
299,33.725187,100.86.121.59,172.66.164.67,TCP,66,53635  >  443 [ACK] Seq=14161 Ack=103533 Win=2044 Len=0 TSval=600726560 TSecr=868429752
300,33.725391,172.66.164.67,100.86.121.59,TLSv1.2,97,Application Data
301,33.725438,100.86.121.59,172.66.164.67,TCP,66,53635  >  443 [ACK] Seq=14161 Ack=103564 Win=2048 Len=0 TSval=600726561 TSecr=868429752
302,33.72638,100.86.121.59,172.66.164.67,TLSv1.2,101,Application Data
303,33.729343,172.66.164.67,100.86.121.59,TLSv1.2,127,Application Data
304,33.729347,172.66.164.67,100.86.121.59,TLSv1.2,290,Application Data
305,33.729463,172.66.164.67,100.86.121.59,TLSv1.2,97,Application Data
306,33.729522,100.86.121.59,172.66.164.67,TCP,66,53635  >  443 [ACK] Seq=14196 Ack=103849 Win=2044 Len=0 TSval=600726565 TSecr=868429756
307,33.729611,100.86.121.59,172.66.164.67,TCP,66,53635  >  443 [ACK] Seq=14196 Ack=103880 Win=2044 Len=0 TSval=600726565 TSecr=868429756
308,33.778961,172.66.164.67,100.86.121.59,TCP,66,443  >  53635 [ACK] Seq=103880 Ack=14196 Win=18 Len=0 TSval=868429806 TSecr=600726562
309,38.685839,100.86.121.59,172.66.164.67,TLSv1.2,748,Application Data
310,38.686257,100.86.121.59,172.66.164.67,TLSv1.2,1269,Application Data
311,38.696441,172.66.164.67,100.86.121.59,TCP,66,443  >  53635 [ACK] Seq=103880 Ack=16081 Win=18 Len=0 TSval=868434723 TSecr=600731521
312,38.720513,172.66.164.67,100.86.121.59,TLSv1.2,150,Application Data
313,38.720517,172.66.164.67,100.86.121.59,TLSv1.2,290,Application Data
314,38.720623,172.66.164.67,100.86.121.59,TLSv1.2,97,Application Data
315,38.720642,100.86.121.59,172.66.164.67,TCP,66,53635  >  443 [ACK] Seq=16081 Ack=104188 Win=2044 Len=0 TSval=600731556 TSecr=868434747
316,38.720706,100.86.121.59,172.66.164.67,TCP,66,53635  >  443 [ACK] Seq=16081 Ack=104219 Win=2044 Len=0 TSval=600731556 TSecr=868434748
317,38.725482,172.66.164.67,100.86.121.59,TLSv1.2,127,Application Data
318,38.725485,172.66.164.67,100.86.121.59,TLSv1.2,290,Application Data
319,38.725488,172.66.164.67,100.86.121.59,TLSv1.2,97,Application Data
320,38.725669,100.86.121.59,172.66.164.67,TCP,66,53635  >  443 [ACK] Seq=16081 Ack=104535 Win=2044 Len=0 TSval=600731561 TSecr=868434752
321,38.7269,100.86.121.59,172.66.164.67,TLSv1.2,101,Application Data
322,38.778704,172.66.164.67,100.86.121.59,TCP,66,443  >  53635 [ACK] Seq=104535 Ack=16116 Win=18 Len=0 TSval=868434806 TSecr=600731562
323,40.004215,100.86.121.59,172.66.164.67,TLSv1.2,553,Application Data
324,40.017563,172.66.164.67,100.86.121.59,TCP,66,443  >  53635 [ACK] Seq=104535 Ack=16603 Win=18 Len=0 TSval=868436044 TSecr=600732839
325,40.042006,172.66.164.67,100.86.121.59,TLSv1.2,150,Application Data
326,40.042013,172.66.164.67,100.86.121.59,TLSv1.2,290,Application Data
327,40.042017,172.66.164.67,100.86.121.59,TLSv1.2,97,Application Data
328,40.042259,100.86.121.59,172.66.164.67,TCP,66,53635  >  443 [ACK] Seq=16603 Ack=104874 Win=2043 Len=0 TSval=600732877 TSecr=868436068
329,41.998521,100.86.121.59,172.66.164.67,TLSv1.2,196,Application Data
330,42.036808,172.66.164.67,100.86.121.59,TLSv1.2,150,Application Data
331,42.036811,172.66.164.67,100.86.121.59,TLSv1.2,290,Application Data
332,42.03695,100.86.121.59,172.66.164.67,TCP,66,53635  >  443 [ACK] Seq=16733 Ack=105182 Win=2044 Len=0 TSval=600734872 TSecr=868438063
333,42.037271,172.66.164.67,100.86.121.59,TLSv1.2,97,Application Data
334,42.037352,100.86.121.59,172.66.164.67,TCP,66,53635  >  443 [ACK] Seq=16733 Ack=105213 Win=2048 Len=0 TSval=600734873 TSecr=868438063
335,43.551269,100.86.121.59,172.66.164.67,TLSv1.2,741,Application Data
336,43.587423,172.66.164.67,100.86.121.59,TLSv1.2,151,Application Data
337,43.587431,172.66.164.67,100.86.121.59,TLSv1.2,108,Application Data
338,43.587434,172.66.164.67,100.86.121.59,TLSv1.2,97,Application Data
339,43.58771,100.86.121.59,172.66.164.67,TCP,66,53635  >  443 [ACK] Seq=17408 Ack=105371 Win=2046 Len=0 TSval=600736423 TSecr=868439614
340,43.735235,100.86.121.59,172.66.164.67,TLSv1.2,1266,Application Data
341,43.735848,100.86.121.59,172.66.164.67,TLSv1.2,197,Application Data
342,43.74639,172.66.164.67,100.86.121.59,TCP,66,443  >  53635 [ACK] Seq=105371 Ack=18739 Win=18 Len=0 TSval=868439773 TSecr=600736570
343,43.770557,172.66.164.67,100.86.121.59,TLSv1.2,159,Application Data
344,43.770561,172.66.164.67,100.86.121.59,TLSv1.2,290,Application Data
345,43.770601,172.66.164.67,100.86.121.59,TLSv1.2,97,Application Data
346,43.770748,100.86.121.59,172.66.164.67,TCP,66,53635  >  443 [ACK] Seq=18739 Ack=105688 Win=2044 Len=0 TSval=600736606 TSecr=868439797
347,43.770833,100.86.121.59,172.66.164.67,TCP,66,53635  >  443 [ACK] Seq=18739 Ack=105719 Win=2044 Len=0 TSval=600736606 TSecr=868439798
348,43.773091,100.86.121.59,172.66.164.67,TLSv1.2,101,Application Data
349,43.774731,172.66.164.67,100.86.121.59,TLSv1.2,127,Application Data
350,43.774733,172.66.164.67,100.86.121.59,TLSv1.2,290,Application Data
351,43.774832,172.66.164.67,100.86.121.59,TLSv1.2,97,Application Data
352,43.774859,100.86.121.59,172.66.164.67,TCP,66,53635  >  443 [ACK] Seq=18774 Ack=106004 Win=2044 Len=0 TSval=600736610 TSecr=868439802
353,43.774914,100.86.121.59,172.66.164.67,TCP,66,53635  >  443 [ACK] Seq=18774 Ack=106035 Win=2044 Len=0 TSval=600736610 TSecr=868439802
354,43.827761,172.66.164.67,100.86.121.59,TCP,66,443  >  53635 [ACK] Seq=106035 Ack=18774 Win=18 Len=0 TSval=868439855 TSecr=600736610
355,46.183567,100.86.121.59,172.66.164.67,TLSv1.2,322,Application Data
356,46.27917,172.66.164.67,100.86.121.59,TCP,66,443  >  53635 [ACK] Seq=106035 Ack=19030 Win=18 Len=0 TSval=868442265 TSecr=600739019
357,46.809018,172.66.164.67,100.86.121.59,TLSv1.2,175,Application Data
358,46.809259,100.86.121.59,172.66.164.67,TCP,66,53635  >  443 [ACK] Seq=19030 Ack=106144 Win=2047 Len=0 TSval=600739644 TSecr=868442782
359,46.80929,172.66.164.67,100.86.121.59,TCP,1514,443  >  53635 [ACK] Seq=106144 Ack=19030 Win=18 Len=1448 TSval=868442782 TSecr=600739019 [TCP PDU reassembled in 373]
360,46.80937,100.86.121.59,172.66.164.67,TCP,66,53635  >  443 [ACK] Seq=19030 Ack=107592 Win=2025 Len=0 TSval=600739645 TSecr=868442782
361,46.80961,172.66.164.67,100.86.121.59,TCP,1514,443  >  53635 [ACK] Seq=107592 Ack=19030 Win=18 Len=1448 TSval=868442782 TSecr=600739019 [TCP PDU reassembled in 373]
362,46.809612,172.66.164.67,100.86.121.59,TCP,1514,443  >  53635 [ACK] Seq=109040 Ack=19030 Win=18 Len=1448 TSval=868442782 TSecr=600739019 [TCP PDU reassembled in 373]
363,46.809617,172.66.164.67,100.86.121.59,TCP,1514,443  >  53635 [ACK] Seq=110488 Ack=19030 Win=18 Len=1448 TSval=868442782 TSecr=600739019 [TCP PDU reassembled in 373]
364,46.809619,172.66.164.67,100.86.121.59,TCP,1514,443  >  53635 [ACK] Seq=111936 Ack=19030 Win=18 Len=1448 TSval=868442782 TSecr=600739019 [TCP PDU reassembled in 373]
365,46.809707,100.86.121.59,172.66.164.67,TCP,66,53635  >  443 [ACK] Seq=19030 Ack=113384 Win=1958 Len=0 TSval=600739645 TSecr=868442782
366,46.809933,100.86.121.59,172.66.164.67,TCP,66,[TCP Window Update] 53635  >  443 [ACK] Seq=19030 Ack=113384 Win=2048 Len=0 TSval=600739645 TSecr=868442782
367,46.811082,172.66.164.67,100.86.121.59,TCP,1514,443  >  53635 [ACK] Seq=113384 Ack=19030 Win=18 Len=1448 TSval=868442782 TSecr=600739019 [TCP PDU reassembled in 373]
368,46.811084,172.66.164.67,100.86.121.59,TCP,1514,443  >  53635 [ACK] Seq=114832 Ack=19030 Win=18 Len=1448 TSval=868442782 TSecr=600739019 [TCP PDU reassembled in 373]
369,46.811086,172.66.164.67,100.86.121.59,TCP,1514,443  >  53635 [ACK] Seq=116280 Ack=19030 Win=18 Len=1448 TSval=868442782 TSecr=600739019 [TCP PDU reassembled in 373]
370,46.81109,172.66.164.67,100.86.121.59,TCP,1514,443  >  53635 [ACK] Seq=117728 Ack=19030 Win=18 Len=1448 TSval=868442782 TSecr=600739019 [TCP PDU reassembled in 373]
371,46.811093,172.66.164.67,100.86.121.59,TCP,1514,"443  >  53635 [PSH, ACK] Seq=119176 Ack=19030 Win=18 Len=1448 TSval=868442782 TSecr=600739019 [TCP PDU reassembled in 373]"
372,46.811095,172.66.164.67,100.86.121.59,TCP,1514,443  >  53635 [ACK] Seq=120624 Ack=19030 Win=18 Len=1448 TSval=868442783 TSecr=600739019 [TCP PDU reassembled in 373]
373,46.811098,172.66.164.67,100.86.121.59,TLSv1.2,544,Application Data
374,46.811101,172.66.164.67,100.86.121.59,TCP,1514,443  >  53635 [ACK] Seq=122550 Ack=19030 Win=18 Len=1448 TSval=868442783 TSecr=600739019 [TCP PDU reassembled in 382]
375,46.811104,172.66.164.67,100.86.121.59,TCP,1514,443  >  53635 [ACK] Seq=123998 Ack=19030 Win=18 Len=1448 TSval=868442783 TSecr=600739019 [TCP PDU reassembled in 382]
376,46.811107,172.66.164.67,100.86.121.59,TCP,1514,443  >  53635 [ACK] Seq=125446 Ack=19030 Win=18 Len=1448 TSval=868442783 TSecr=600739019 [TCP PDU reassembled in 382]
377,46.811109,172.66.164.67,100.86.121.59,TCP,1514,443  >  53635 [ACK] Seq=126894 Ack=19030 Win=18 Len=1448 TSval=868442783 TSecr=600739019 [TCP PDU reassembled in 382]
378,46.811112,172.66.164.67,100.86.121.59,TCP,1514,443  >  53635 [ACK] Seq=128342 Ack=19030 Win=18 Len=1448 TSval=868442783 TSecr=600739019 [TCP PDU reassembled in 382]
379,46.811115,172.66.164.67,100.86.121.59,TCP,1514,443  >  53635 [ACK] Seq=129790 Ack=19030 Win=18 Len=1448 TSval=868442783 TSecr=600739019 [TCP PDU reassembled in 382]
380,46.811118,172.66.164.67,100.86.121.59,TCP,1514,443  >  53635 [ACK] Seq=131238 Ack=19030 Win=18 Len=1448 TSval=868442783 TSecr=600739019 [TCP PDU reassembled in 382]
381,46.811121,172.66.164.67,100.86.121.59,TCP,1514,443  >  53635 [ACK] Seq=132686 Ack=19030 Win=18 Len=1448 TSval=868442783 TSecr=600739019 [TCP PDU reassembled in 382]
382,46.811123,172.66.164.67,100.86.121.59,TLSv1.2,170,Application Data
383,46.811126,172.66.164.67,100.86.121.59,TLSv1.2,97,Application Data
384,46.811228,100.86.121.59,172.66.164.67,TCP,66,53635  >  443 [ACK] Seq=19030 Ack=128342 Win=1815 Len=0 TSval=600739646 TSecr=868442783
385,46.811263,100.86.121.59,172.66.164.67,TCP,66,53635  >  443 [ACK] Seq=19030 Ack=134269 Win=1723 Len=0 TSval=600739646 TSecr=868442784
386,46.811446,100.86.121.59,172.66.164.67,TCP,66,[TCP Window Update] 53635  >  443 [ACK] Seq=19030 Ack=134269 Win=2048 Len=0 TSval=600739647 TSecr=868442784
387,46.86259,100.86.121.59,172.66.164.67,TLSv1.2,302,Application Data
388,46.880877,100.86.121.59,172.66.164.67,TLSv1.2,650,Application Data
389,46.880985,100.86.121.59,172.66.164.67,TLSv1.2,191,Application Data
390,46.8915,100.86.121.59,172.66.164.67,TLSv1.2,1230,Application Data
391,46.892353,100.86.121.59,172.66.164.67,TLSv1.2,197,Application Data
392,46.892619,100.86.121.59,172.66.164.67,TLSv1.2,199,Application Data
393,46.892709,100.86.121.59,172.66.164.67,TLSv1.2,198,Application Data
394,46.892916,100.86.121.59,172.66.164.67,TLSv1.2,196,Application Data
395,46.90257,172.66.164.67,100.86.121.59,TCP,97,"[TCP Spurious Retransmission] 443  >  53635 [PSH, ACK] Seq=134238 Ack=19030 Win=18 Len=31 TSval=868442819 TSecr=600739019"
396,46.902647,100.86.121.59,172.66.164.67,TCP,78,[TCP Dup ACK 385#1] 53635  >  443 [ACK] Seq=21665 Ack=134269 Win=2048 Len=0 TSval=600739738 TSecr=868442819 SLE=134238 SRE=134269
397,46.913929,172.66.164.67,100.86.121.59,TCP,66,443  >  53635 [ACK] Seq=134269 Ack=19266 Win=18 Len=0 TSval=868442941 TSecr=600739698
398,46.915648,172.66.164.67,100.86.121.59,TCP,66,443  >  53635 [ACK] Seq=134269 Ack=19975 Win=18 Len=0 TSval=868442942 TSecr=600739716
399,46.916028,172.66.164.67,100.86.121.59,TCP,66,443  >  53635 [ACK] Seq=134269 Ack=21665 Win=18 Len=0 TSval=868442943 TSecr=600739728
400,46.953564,172.66.164.67,100.86.121.59,TLSv1.2,177,Application Data
401,46.953566,172.66.164.67,100.86.121.59,TLSv1.2,108,Application Data
402,46.953566,172.66.164.67,100.86.121.59,TLSv1.2,97,Application Data
403,46.953567,172.66.164.67,100.86.121.59,TLSv1.2,158,Application Data
404,46.953568,172.66.164.67,100.86.121.59,TLSv1.2,230,Application Data
405,46.953632,100.86.121.59,172.66.164.67,TCP,66,53635  >  443 [ACK] Seq=21665 Ack=134709 Win=2042 Len=0 TSval=600739789 TSecr=868442969
406,46.955265,172.66.164.67,100.86.121.59,TLSv1.2,235,Application Data
407,46.955266,172.66.164.67,100.86.121.59,TLSv1.2,290,Application Data
408,46.955267,172.66.164.67,100.86.121.59,TLSv1.2,97,Application Data
409,46.95527,172.66.164.67,100.86.121.59,TLSv1.2,127,Application Data
410,46.955271,172.66.164.67,100.86.121.59,TLSv1.2,290,Application Data
411,46.955271,172.66.164.67,100.86.121.59,TLSv1.2,97,Application Data
412,46.955272,172.66.164.67,100.86.121.59,TLSv1.2,208,Application Data
413,46.955273,172.66.164.67,100.86.121.59,TLSv1.2,290,Application Data
414,46.955274,172.66.164.67,100.86.121.59,TLSv1.2,97,Application Data
415,46.955274,172.66.164.67,100.86.121.59,TLSv1.2,135,Application Data
416,46.955275,172.66.164.67,100.86.121.59,TLSv1.2,290,Application Data
417,46.955276,172.66.164.67,100.86.121.59,TLSv1.2,97,Application Data
418,46.955277,172.66.164.67,100.86.121.59,TLSv1.2,127,Application Data
419,46.955277,172.66.164.67,100.86.121.59,TLSv1.2,290,Application Data
420,46.955321,100.86.121.59,172.66.164.67,TCP,66,53635  >  443 [ACK] Seq=21665 Ack=136455 Win=2021 Len=0 TSval=600739790 TSecr=868442977
421,46.956126,172.66.164.67,100.86.121.59,TLSv1.2,97,Application Data
422,46.956158,100.86.121.59,172.66.164.67,TCP,66,53635  >  443 [ACK] Seq=21665 Ack=136486 Win=2048 Len=0 TSval=600739791 TSecr=868442977
423,51.969248,100.86.121.59,172.66.164.67,TLSv1.2,352,Application Data
424,51.969722,100.86.121.59,172.66.164.67,TLSv1.2,297,Application Data
425,51.982389,172.66.164.67,100.86.121.59,TCP,66,443  >  53635 [ACK] Seq=136486 Ack=22182 Win=18 Len=0 TSval=868448008 TSecr=600744804
426,52.006676,172.66.164.67,100.86.121.59,TLSv1.2,150,Application Data
427,52.006681,172.66.164.67,100.86.121.59,TLSv1.2,290,Application Data
428,52.006743,172.66.164.67,100.86.121.59,TLSv1.2,97,Application Data
429,52.006905,100.86.121.59,172.66.164.67,TCP,66,53635  >  443 [ACK] Seq=22182 Ack=136794 Win=2044 Len=0 TSval=600744842 TSecr=868448034
430,52.007005,100.86.121.59,172.66.164.67,TCP,66,53635  >  443 [ACK] Seq=22182 Ack=136825 Win=2044 Len=0 TSval=600744842 TSecr=868448034
431,52.008419,100.86.121.59,172.66.164.67,TLSv1.2,101,Application Data
432,52.010087,172.66.164.67,100.86.121.59,TLSv1.2,127,Application Data
433,52.010237,100.86.121.59,172.66.164.67,TCP,66,53635  >  443 [ACK] Seq=22217 Ack=136886 Win=2048 Len=0 TSval=600744845 TSecr=868448037
434,52.010274,172.66.164.67,100.86.121.59,TLSv1.2,290,Application Data
435,52.010276,172.66.164.67,100.86.121.59,TLSv1.2,97,Application Data
436,52.010341,100.86.121.59,172.66.164.67,TCP,66,53635  >  443 [ACK] Seq=22217 Ack=137141 Win=2045 Len=0 TSval=600744845 TSecr=868448037
437,52.060786,172.66.164.67,100.86.121.59,TCP,66,443  >  53635 [ACK] Seq=137141 Ack=22217 Win=18 Len=0 TSval=868448088 TSecr=600744844
438,54.18402,100.86.121.59,172.66.164.67,TLSv1.2,580,Application Data
439,54.193424,172.66.164.67,100.86.121.59,TCP,66,443  >  53635 [ACK] Seq=137141 Ack=22731 Win=18 Len=0 TSval=868450220 TSecr=600747019
440,54.200962,100.86.121.59,172.66.164.67,TLSv1.2,1281,Application Data
441,54.201209,100.86.121.59,172.66.164.67,TLSv1.2,197,Application Data
442,54.201282,100.86.121.59,172.66.164.67,TLSv1.2,200,Application Data
443,54.201349,100.86.121.59,172.66.164.67,TLSv1.2,199,Application Data
444,54.201414,100.86.121.59,172.66.164.67,TLSv1.2,197,Application Data
445,54.210835,172.66.164.67,100.86.121.59,TCP,66,443  >  53635 [ACK] Seq=137141 Ack=23946 Win=18 Len=0 TSval=868450238 TSecr=600747036
446,54.21264,172.66.164.67,100.86.121.59,TLSv1.2,248,Application Data
447,54.212642,172.66.164.67,100.86.121.59,TLSv1.2,108,Application Data
448,54.212709,100.86.121.59,172.66.164.67,TCP,66,53635  >  443 [ACK] Seq=24475 Ack=137365 Win=2045 Len=0 TSval=600747048 TSecr=868450240
449,54.212788,172.66.164.67,100.86.121.59,TLSv1.2,97,Application Data
450,54.212826,100.86.121.59,172.66.164.67,TCP,66,53635  >  443 [ACK] Seq=24475 Ack=137396 Win=2045 Len=0 TSval=600747048 TSecr=868450240
451,54.231965,172.66.164.67,100.86.121.59,TLSv1.2,127,Application Data
452,54.231966,172.66.164.67,100.86.121.59,TLSv1.2,290,Application Data
453,54.232053,100.86.121.59,172.66.164.67,TCP,66,53635  >  443 [ACK] Seq=24475 Ack=137681 Win=2044 Len=0 TSval=600747067 TSecr=868450259
454,54.232364,172.66.164.67,100.86.121.59,TLSv1.2,158,"Application Data, Application Data"
455,54.232366,172.66.164.67,100.86.121.59,TLSv1.2,290,Application Data
456,54.23241,100.86.121.59,172.66.164.67,TCP,66,53635  >  443 [ACK] Seq=24475 Ack=137997 Win=2044 Len=0 TSval=600747068 TSecr=868450259
457,54.232511,172.66.164.67,100.86.121.59,TLSv1.2,97,Application Data
458,54.232533,100.86.121.59,172.66.164.67,TCP,66,53635  >  443 [ACK] Seq=24475 Ack=138028 Win=2044 Len=0 TSval=600747068 TSecr=868450259
459,54.236086,172.66.164.67,100.86.121.59,TLSv1.2,127,Application Data
460,54.236087,172.66.164.67,100.86.121.59,TLSv1.2,290,Application Data
461,54.236121,100.86.121.59,172.66.164.67,TCP,66,53635  >  443 [ACK] Seq=24475 Ack=138313 Win=2044 Len=0 TSval=600747071 TSecr=868450263
462,54.236482,172.66.164.67,100.86.121.59,TLSv1.2,97,Application Data
463,54.236522,100.86.121.59,172.66.164.67,TCP,66,53635  >  443 [ACK] Seq=24475 Ack=138344 Win=2048 Len=0 TSval=600747072 TSecr=868450263
464,54.239382,172.66.164.67,100.86.121.59,TLSv1.2,127,Application Data
465,54.239383,172.66.164.67,100.86.121.59,TLSv1.2,290,Application Data
466,54.239437,100.86.121.59,172.66.164.67,TCP,66,53635  >  443 [ACK] Seq=24475 Ack=138629 Win=2044 Len=0 TSval=600747075 TSecr=868450266
467,54.239491,172.66.164.67,100.86.121.59,TLSv1.2,97,Application Data
468,54.239515,100.86.121.59,172.66.164.67,TCP,66,53635  >  443 [ACK] Seq=24475 Ack=138660 Win=2048 Len=0 TSval=600747075 TSecr=868450266
469,54.24113,172.66.164.67,100.86.121.59,TLSv1.2,127,Application Data
470,54.241132,172.66.164.67,100.86.121.59,TLSv1.2,290,Application Data
471,54.241179,100.86.121.59,172.66.164.67,TCP,66,53635  >  443 [ACK] Seq=24475 Ack=138945 Win=2044 Len=0 TSval=600747076 TSecr=868450268
472,54.241683,172.66.164.67,100.86.121.59,TLSv1.2,97,Application Data
473,54.2417,100.86.121.59,172.66.164.67,TCP,66,53635  >  443 [ACK] Seq=24475 Ack=138976 Win=2048 Len=0 TSval=600747077 TSecr=868450268
474,56.965202,100.86.121.59,172.66.164.67,TLSv1.2,546,Application Data
475,56.9654,100.86.121.59,172.66.164.67,TLSv1.2,663,Application Data
476,56.965553,100.86.121.59,172.66.164.67,TLSv1.2,251,Application Data
477,57.058297,172.66.164.67,100.86.121.59,TCP,66,443  >  53635 [ACK] Seq=138976 Ack=25737 Win=18 Len=0 TSval=868453043 TSecr=600749800
478,57.083704,172.66.164.67,100.86.121.59,TLSv1.2,150,Application Data
479,57.083708,172.66.164.67,100.86.121.59,TLSv1.2,290,Application Data
480,57.08371,172.66.164.67,100.86.121.59,TLSv1.2,97,Application Data
481,57.083906,100.86.121.59,172.66.164.67,TCP,66,53635  >  443 [ACK] Seq=25737 Ack=139315 Win=2043 Len=0 TSval=600749919 TSecr=868453085
482,57.0895,100.86.121.59,172.66.164.67,TLSv1.2,101,Application Data
483,57.107278,172.66.164.67,100.86.121.59,TLSv1.2,127,Application Data
484,57.107283,172.66.164.67,100.86.121.59,TLSv1.2,290,Application Data
485,57.107342,172.66.164.67,100.86.121.59,TLSv1.2,97,Application Data
486,57.107344,172.66.164.67,100.86.121.59,TLSv1.2,127,Application Data
487,57.107347,172.66.164.67,100.86.121.59,TLSv1.2,290,Application Data
488,57.107506,100.86.121.59,172.66.164.67,TCP,66,53635  >  443 [ACK] Seq=25772 Ack=139600 Win=2044 Len=0 TSval=600749942 TSecr=868453090
489,57.107597,100.86.121.59,172.66.164.67,TCP,66,53635  >  443 [ACK] Seq=25772 Ack=139916 Win=2040 Len=0 TSval=600749943 TSecr=868453093
490,57.10781,172.66.164.67,100.86.121.59,TLSv1.2,97,Application Data
491,57.107884,100.86.121.59,172.66.164.67,TCP,66,53635  >  443 [ACK] Seq=25772 Ack=139947 Win=2048 Len=0 TSval=600749943 TSecr=868453093
492,57.133002,172.66.164.67,100.86.121.59,TCP,97,"[TCP Spurious Retransmission] 443  >  53635 [PSH, ACK] Seq=139916 Ack=25737 Win=18 Len=31 TSval=868453134 TSecr=600749800"
493,57.133179,100.86.121.59,172.66.164.67,TCP,78,[TCP Dup ACK 491#1] 53635  >  443 [ACK] Seq=25772 Ack=139947 Win=2048 Len=0 TSval=600749968 TSecr=868453134 SLE=139916 SRE=139947
494,57.206824,172.66.164.67,100.86.121.59,TCP,66,443  >  53635 [ACK] Seq=139947 Ack=25772 Win=18 Len=0 TSval=868453208 TSecr=600749925
495,58.297821,100.86.121.59,172.66.164.67,TLSv1.2,1152,Application Data
496,58.389175,172.66.164.67,100.86.121.59,TCP,66,443  >  53635 [ACK] Seq=139947 Ack=26858 Win=18 Len=0 TSval=868454376 TSecr=600751133
497,58.619583,172.66.164.67,100.86.121.59,TLSv1.2,224,Application Data
498,58.619586,172.66.164.67,100.86.121.59,TCP,1514,443  >  53635 [ACK] Seq=140105 Ack=26858 Win=18 Len=1448 TSval=868454646 TSecr=600751133 [TCP PDU reassembled in 513]
499,58.619686,100.86.121.59,172.66.164.67,TCP,66,53635  >  443 [ACK] Seq=26858 Ack=141553 Win=2023 Len=0 TSval=600751455 TSecr=868454646
500,58.619893,172.66.164.67,100.86.121.59,TCP,1514,443  >  53635 [ACK] Seq=141553 Ack=26858 Win=18 Len=1448 TSval=868454646 TSecr=600751133 [TCP PDU reassembled in 513]
501,58.619949,100.86.121.59,172.66.164.67,TCP,66,53635  >  443 [ACK] Seq=26858 Ack=143001 Win=2026 Len=0 TSval=600751455 TSecr=868454646
502,58.620424,172.66.164.67,100.86.121.59,TCP,1514,443  >  53635 [ACK] Seq=143001 Ack=26858 Win=18 Len=1448 TSval=868454646 TSecr=600751133 [TCP PDU reassembled in 513]
503,58.620427,172.66.164.67,100.86.121.59,TCP,1514,443  >  53635 [ACK] Seq=144449 Ack=26858 Win=18 Len=1448 TSval=868454646 TSecr=600751133 [TCP PDU reassembled in 513]
504,58.62043,172.66.164.67,100.86.121.59,TCP,1514,443  >  53635 [ACK] Seq=145897 Ack=26858 Win=18 Len=1448 TSval=868454646 TSecr=600751133 [TCP PDU reassembled in 513]
505,58.620433,172.66.164.67,100.86.121.59,TCP,1514,443  >  53635 [ACK] Seq=147345 Ack=26858 Win=18 Len=1448 TSval=868454646 TSecr=600751133 [TCP PDU reassembled in 513]
506,58.620478,100.86.121.59,172.66.164.67,TCP,66,53635  >  443 [ACK] Seq=26858 Ack=148793 Win=1958 Len=0 TSval=600751456 TSecr=868454646
507,58.620516,100.86.121.59,172.66.164.67,TCP,66,[TCP Window Update] 53635  >  443 [ACK] Seq=26858 Ack=148793 Win=2048 Len=0 TSval=600751456 TSecr=868454646
508,58.621752,172.66.164.67,100.86.121.59,TCP,1514,443  >  53635 [ACK] Seq=148793 Ack=26858 Win=18 Len=1448 TSval=868454646 TSecr=600751133 [TCP PDU reassembled in 513]
509,58.621755,172.66.164.67,100.86.121.59,TCP,1514,443  >  53635 [ACK] Seq=150241 Ack=26858 Win=18 Len=1448 TSval=868454646 TSecr=600751133 [TCP PDU reassembled in 513]
510,58.621757,172.66.164.67,100.86.121.59,TCP,1514,443  >  53635 [ACK] Seq=151689 Ack=26858 Win=18 Len=1448 TSval=868454646 TSecr=600751133 [TCP PDU reassembled in 513]
511,58.621759,172.66.164.67,100.86.121.59,TCP,1514,"443  >  53635 [PSH, ACK] Seq=153137 Ack=26858 Win=18 Len=1448 TSval=868454646 TSecr=600751133 [TCP PDU reassembled in 513]"
512,58.621762,172.66.164.67,100.86.121.59,TCP,1514,443  >  53635 [ACK] Seq=154585 Ack=26858 Win=18 Len=1448 TSval=868454647 TSecr=600751133 [TCP PDU reassembled in 513]
513,58.621764,172.66.164.67,100.86.121.59,TLSv1.2,544,Application Data
514,58.621767,172.66.164.67,100.86.121.59,TCP,1514,443  >  53635 [ACK] Seq=156511 Ack=26858 Win=18 Len=1448 TSval=868454647 TSecr=600751133 [TCP PDU reassembled in 520]
515,58.62177,172.66.164.67,100.86.121.59,TCP,1514,443  >  53635 [ACK] Seq=157959 Ack=26858 Win=18 Len=1448 TSval=868454647 TSecr=600751133 [TCP PDU reassembled in 520]
516,58.621772,172.66.164.67,100.86.121.59,TCP,1514,443  >  53635 [ACK] Seq=159407 Ack=26858 Win=18 Len=1448 TSval=868454647 TSecr=600751133 [TCP PDU reassembled in 520]
517,58.621775,172.66.164.67,100.86.121.59,TCP,1514,443  >  53635 [ACK] Seq=160855 Ack=26858 Win=18 Len=1448 TSval=868454647 TSecr=600751133 [TCP PDU reassembled in 520]
518,58.621778,172.66.164.67,100.86.121.59,TCP,1514,443  >  53635 [ACK] Seq=162303 Ack=26858 Win=18 Len=1448 TSval=868454647 TSecr=600751133 [TCP PDU reassembled in 520]
519,58.62178,172.66.164.67,100.86.121.59,TCP,1514,443  >  53635 [ACK] Seq=163751 Ack=26858 Win=18 Len=1448 TSval=868454647 TSecr=600751133 [TCP PDU reassembled in 520]
520,58.621783,172.66.164.67,100.86.121.59,TLSv1.2,787,Application Data
521,58.621785,172.66.164.67,100.86.121.59,TLSv1.2,97,Application Data
522,58.621873,100.86.121.59,172.66.164.67,TCP,66,53635  >  443 [ACK] Seq=26858 Ack=163751 Win=1815 Len=0 TSval=600751457 TSecr=868454647
523,58.621898,100.86.121.59,172.66.164.67,TCP,66,53635  >  443 [ACK] Seq=26858 Ack=165951 Win=1781 Len=0 TSval=600751457 TSecr=868454648
524,58.622044,100.86.121.59,172.66.164.67,TCP,66,[TCP Window Update] 53635  >  443 [ACK] Seq=26858 Ack=165951 Win=2048 Len=0 TSval=600751457 TSecr=868454648
525,58.668856,100.86.121.59,172.66.164.67,TLSv1.2,225,Application Data
526,58.697907,100.86.121.59,172.66.164.67,TLSv1.2,503,Application Data
527,58.698147,100.86.121.59,172.66.164.67,TLSv1.2,664,Application Data
528,58.698266,100.86.121.59,172.66.164.67,TLSv1.2,253,Application Data
529,58.698354,100.86.121.59,172.66.164.67,TLSv1.2,198,Application Data
530,58.698434,100.86.121.59,172.66.164.67,TLSv1.2,196,Application Data
531,58.701562,172.66.164.67,100.86.121.59,TCP,66,443  >  53635 [ACK] Seq=165951 Ack=27017 Win=18 Len=0 TSval=868454712 TSecr=600751504
532,58.723922,172.66.164.67,100.86.121.59,TLSv1.2,128,Application Data
533,58.723923,172.66.164.67,100.86.121.59,TLSv1.2,108,Application Data
534,58.723924,172.66.164.67,100.86.121.59,TLSv1.2,97,Application Data
535,58.723924,172.66.164.67,100.86.121.59,TCP,66,443  >  53635 [ACK] Seq=166086 Ack=28501 Win=18 Len=0 TSval=868454748 TSecr=600751533
536,58.724003,100.86.121.59,172.66.164.67,TCP,66,53635  >  443 [ACK] Seq=28501 Ack=166086 Win=2046 Len=0 TSval=600751559 TSecr=868454733
537,58.750445,172.66.164.67,100.86.121.59,TLSv1.2,150,Application Data
538,58.750447,172.66.164.67,100.86.121.59,TLSv1.2,290,Application Data
539,58.750491,100.86.121.59,172.66.164.67,TCP,66,53635  >  443 [ACK] Seq=28501 Ack=166394 Win=2044 Len=0 TSval=600751586 TSecr=868454776
540,58.750744,172.66.164.67,100.86.121.59,TLSv1.2,97,Application Data
541,58.750745,172.66.164.67,100.86.121.59,TLSv1.2,127,Application Data
542,58.750746,172.66.164.67,100.86.121.59,TLSv1.2,290,Application Data
543,58.750768,100.86.121.59,172.66.164.67,TCP,66,53635  >  443 [ACK] Seq=28501 Ack=166710 Win=2044 Len=0 TSval=600751586 TSecr=868454777
544,58.751086,172.66.164.67,100.86.121.59,TLSv1.2,97,Application Data
545,58.751112,100.86.121.59,172.66.164.67,TCP,66,53635  >  443 [ACK] Seq=28501 Ack=166741 Win=2048 Len=0 TSval=600751586 TSecr=868454777
546,58.752129,172.66.164.67,100.86.121.59,TLSv1.2,127,Application Data
547,58.75213,172.66.164.67,100.86.121.59,TLSv1.2,290,Application Data
548,58.752164,100.86.121.59,172.66.164.67,TCP,66,53635  >  443 [ACK] Seq=28501 Ack=167026 Win=2044 Len=0 TSval=600751587 TSecr=868454779
549,58.752384,172.66.164.67,100.86.121.59,TLSv1.2,97,Application Data
550,58.752408,100.86.121.59,172.66.164.67,TCP,66,53635  >  443 [ACK] Seq=28501 Ack=167057 Win=2048 Len=0 TSval=600751588 TSecr=868454779
551,58.752475,172.66.164.67,100.86.121.59,TLSv1.2,127,Application Data
552,58.752476,172.66.164.67,100.86.121.59,TLSv1.2,290,Application Data
553,58.752477,172.66.164.67,100.86.121.59,TLSv1.2,97,Application Data
554,58.752495,100.86.121.59,172.66.164.67,TCP,66,53635  >  443 [ACK] Seq=28501 Ack=167373 Win=2044 Len=0 TSval=600751588 TSecr=868454779
555,58.754243,172.66.164.67,100.86.121.59,TLSv1.2,127,Application Data
556,58.754243,172.66.164.67,100.86.121.59,TLSv1.2,290,Application Data
557,58.754288,100.86.121.59,172.66.164.67,TCP,66,53635  >  443 [ACK] Seq=28501 Ack=167658 Win=2044 Len=0 TSval=600751589 TSecr=868454781
558,58.75459,172.66.164.67,100.86.121.59,TLSv1.2,97,Application Data
559,58.754659,100.86.121.59,172.66.164.67,TCP,66,53635  >  443 [ACK] Seq=28501 Ack=167689 Win=2048 Len=0 TSval=600751590 TSecr=868454781
