No.,Time,Source,Destination,Protocol,Length,Info
1,0.0,2600:4040:231a:b800:3c9e:c12c:139a:9787,2606:4700::6812:562a,TCP,74,53729  >  443 [ACK] Seq=1 Ack=1 Win=2048 Len=0
2,0.012954,2606:4700::6812:562a,2600:4040:231a:b800:3c9e:c12c:139a:9787,TCP,86,[TCP ACKed unseen segment] 443  >  53729 [ACK] Seq=1 Ack=2 Win=17 Len=0 TSval=660029736 TSecr=4120568977
3,0.651345,WNC_46:a8:04,Broadcast,ARP,42,Who has 192.168.1.210? Tell 192.168.1.1
4,1.188752,2600:4040:231a:b800:3c9e:c12c:139a:9787,2600:4040:231a:b800::1,ICMPv6,86,Neighbor Solicitation for 2600:4040:231a:b800::1 from ce:f6:1b:97:2c:c9
5,1.196428,2600:4040:231a:b800::1,2600:4040:231a:b800:3c9e:c12c:139a:9787,ICMPv6,78,"Neighbor Advertisement 2600:4040:231a:b800::1 (rtr, sol)"
6,1.265713,192.168.1.210,224.0.0.251,MDNS,103,"Standard query 0x0004 PTR _googlecast._tcp.local, ""QM"" question PTR _233637DE._sub._googlecast._tcp.local, ""QM"" question"
7,1.265717,fe80::18:46ff:fe60:c130,ff02::fb,MDNS,123,"Standard query 0x0004 PTR _googlecast._tcp.local, ""QM"" question PTR _233637DE._sub._googlecast._tcp.local, ""QM"" question"
8,1.265763,WNC_46:a8:04,Broadcast,ARP,42,Who has 192.168.1.100? Tell 192.168.1.1
9,1.982591,WNC_46:a8:04,Broadcast,ARP,42,Who has 192.168.1.228? Tell 192.168.1.1
10,1.982595,fe80::2641:feff:fe46:a804,ff02::1:ff99:850a,ICMPv6,86,Neighbor Solicitation for fe80::1097:88a0:4399:850a from 24:41:fe:46:a8:04
11,1.982597,WNC_46:a8:04,Broadcast,ARP,42,Who has 192.168.1.195? Tell 192.168.1.1
12,1.982704,ce:f6:1b:97:2c:c9,WNC_46:a8:04,ARP,42,192.168.1.228 is at ce:f6:1b:97:2c:c9
13,1.982814,fe80::1097:88a0:4399:850a,fe80::2641:feff:fe46:a804,ICMPv6,86,"Neighbor Advertisement fe80::1097:88a0:4399:850a (sol, ovr) is at ce:f6:1b:97:2c:c9"
14,3.220578,35.153.195.153,192.168.1.228,TLSv1.2,112,Application Data
15,3.220582,35.153.195.153,192.168.1.228,TLSv1.2,97,Encrypted Alert
16,3.220585,35.153.195.153,192.168.1.228,TCP,66,"443  >  53771 [FIN, ACK] Seq=78 Ack=1 Win=201 Len=0 TSval=2617920733 TSecr=2811782518"
17,3.220588,35.153.195.153,192.168.1.228,TCP,66,"[TCP Retransmission] 443  >  53771 [FIN, ACK] Seq=78 Ack=1 Win=201 Len=0 TSval=2617920757 TSecr=2811782518"
18,3.22088,192.168.1.228,35.153.195.153,TCP,66,53771  >  443 [ACK] Seq=1 Ack=78 Win=2047 Len=0 TSval=2811842604 TSecr=2617920733
19,3.220991,192.168.1.228,35.153.195.153,TCP,66,53771  >  443 [ACK] Seq=1 Ack=79 Win=2047 Len=0 TSval=2811842604 TSecr=2617920733
20,3.221019,192.168.1.228,35.153.195.153,TCP,66,[TCP Dup ACK 19#1] 53771  >  443 [ACK] Seq=1 Ack=79 Win=2047 Len=0 TSval=2811842604 TSecr=2617920733
21,3.221467,192.168.1.228,35.153.195.153,TCP,66,"53771  >  443 [FIN, ACK] Seq=1 Ack=79 Win=2048 Len=0 TSval=2811842604 TSecr=2617920733"
22,3.233803,35.153.195.153,192.168.1.228,TCP,66,443  >  53771 [ACK] Seq=79 Ack=2 Win=201 Len=0 TSval=2617920829 TSecr=2811842604
23,3.523778,2603:1036:302:4154::2,2600:4040:231a:b800:3c9e:c12c:139a:9787,UDP,101,443  >  59908 Len=39
24,3.526023,2600:4040:231a:b800:3c9e:c12c:139a:9787,2603:1036:302:4154::2,UDP,101,59908  >  443 Len=39
25,4.473849,2600:4040:231a:b800:3c9e:c12c:139a:9787,2001:4860:482d:7700::,UDP,91,51922  >  443 Len=29
26,4.518694,2600:4040:231a:b800:3c9e:c12c:139a:9787,2001:4860:482d:7700::,UDP,91,51922  >  443 Len=29
27,4.587909,2001:4860:482d:7700::,2600:4040:231a:b800:3c9e:c12c:139a:9787,UDP,86,443  >  51922 Len=24
28,4.592618,2001:4860:482d:7700::,2600:4040:231a:b800:3c9e:c12c:139a:9787,UDP,87,443  >  51922 Len=25
29,4.747261,WNC_46:a8:04,Broadcast,ARP,42,Who has 192.168.1.221? Tell 192.168.1.1
30,6.771708,2600:4040:231a:b800:3c9e:c12c:139a:9787,2001:4860:482d:7700::,UDP,91,55692  >  443 Len=29
31,6.785896,2001:4860:482d:7700::,2600:4040:231a:b800:3c9e:c12c:139a:9787,UDP,87,443  >  55692 Len=25
32,7.1026,WNC_46:a8:04,Broadcast,ARP,42,Who has 192.168.1.178? Tell 192.168.1.1
33,7.10286,WNC_46:a8:04,Broadcast,ARP,42,Who has 192.168.1.161? Tell 192.168.1.1
34,8.742046,192.168.1.205,224.0.0.251,MDNS,79,"Standard query 0x0000 A Pantum-164FF6.local, ""QM"" question"
35,8.74205,fe80::cfda:5f45:41bc:9216,ff02::fb,MDNS,99,"Standard query 0x0000 A Pantum-164FF6.local, ""QM"" question"
36,8.742171,192.168.1.205,224.0.0.251,MDNS,79,"Standard query 0x0000 AAAA Pantum-164FF6.local, ""QU"" question"
37,8.742392,fe80::cfda:5f45:41bc:9216,ff02::fb,MDNS,99,"Standard query 0x0000 AAAA Pantum-164FF6.local, ""QU"" question"
38,8.742566,192.168.1.175,224.0.0.251,MDNS,92,"Standard query response 0x0000 A, cache flush 192.168.1.175"
39,8.743133,192.168.1.183,224.0.0.251,MDNS,89,"Standard query response 0x0000 A, cache flush 192.168.1.183"
40,9.051004,fe80::3ebd:c5ff:fed5:e174,fe80::1097:88a0:4399:850a,ICMPv6,86,Neighbor Solicitation for fe80::1097:88a0:4399:850a from 3c:bd:c5:d5:e1:74
41,9.051268,fe80::1097:88a0:4399:850a,fe80::3ebd:c5ff:fed5:e174,ICMPv6,78,Neighbor Advertisement fe80::1097:88a0:4399:850a (sol)
42,9.150653,192.168.1.205,192.168.1.255,NBNS,92,Name query NB PANTUM-164FF6<00>
43,9.150658,192.168.1.205,224.0.0.251,MDNS,79,"Standard query 0x0000 A Pantum-164FF6.local, ""QM"" question"
44,9.150878,fe80::cfda:5f45:41bc:9216,ff02::fb,MDNS,99,"Standard query 0x0000 A Pantum-164FF6.local, ""QM"" question"
45,9.150883,192.168.1.205,224.0.0.251,MDNS,79,"Standard query 0x0000 AAAA Pantum-164FF6.local, ""QM"" question"
46,9.151972,fe80::cfda:5f45:41bc:9216,ff02::fb,MDNS,99,"Standard query 0x0000 AAAA Pantum-164FF6.local, ""QM"" question"
47,9.152708,192.168.1.183,224.0.0.251,MDNS,89,"Standard query response 0x0000 A, cache flush 192.168.1.183"
48,9.153251,192.168.1.178,224.0.0.251,MDNS,89,"Standard query response 0x0000 A, cache flush 192.168.1.178"
49,9.153254,192.168.1.175,224.0.0.251,MDNS,92,"Standard query response 0x0000 A, cache flush 192.168.1.175"
50,9.153469,WNC_46:a8:04,Broadcast,ARP,42,Who has 192.168.1.171? Tell 192.168.1.1
51,9.457849,192.168.1.205,224.0.0.251,MDNS,79,"Standard query 0x0000 A Pantum-164FF6.local, ""QM"" question"
52,9.458684,fe80::cfda:5f45:41bc:9216,ff02::fb,MDNS,99,"Standard query 0x0000 A Pantum-164FF6.local, ""QM"" question"
53,9.458686,192.168.1.205,224.0.0.251,MDNS,79,"Standard query 0x0000 AAAA Pantum-164FF6.local, ""QU"" question"
54,9.459046,fe80::cfda:5f45:41bc:9216,ff02::fb,MDNS,99,"Standard query 0x0000 AAAA Pantum-164FF6.local, ""QU"" question"
55,9.459201,192.168.1.178,224.0.0.251,MDNS,89,"Standard query response 0x0000 A, cache flush 192.168.1.178"
56,9.459485,192.168.1.175,224.0.0.251,MDNS,92,"Standard query response 0x0000 A, cache flush 192.168.1.175"
57,9.764941,192.168.1.183,224.0.0.251,MDNS,89,"Standard query response 0x0000 A, cache flush 192.168.1.183"
58,9.764943,192.168.1.205,192.168.1.255,NBNS,92,Name query NB PANTUM-164FF6<00>
59,9.765331,192.168.1.178,224.0.0.251,MDNS,89,"Standard query response 0x0000 A, cache flush 192.168.1.178"
60,10.073081,192.168.1.210,224.0.0.251,MDNS,612,"Standard query response 0x0000 PTR, cache flush Android_SJA2XOSW.local AAAA, cache flush fe80::18:46ff:fe60:c130 PTR, cache flush Android_SJA2XOSW.local AAAA, cache flush 2600:4040:231a:b800:18:46ff:fe60:c130 PTR, cache flush Android_SJA2XOSW.local A, cache flush 192.168.1.210 PTR I1pMSU_8n14AAA._FC9F5ED42C8A._tcp.local SRV, cache flush 0 0 53601 Android_SJA2XOSW.local TXT, cache flush PTR _FC9F5ED42C8A._tcp.local NSEC, cache flush 0.3.1.C.0.6.E.F.F.F.6.4.8.1.0.0.0.0.0.0.0.0.0.0.0.0.0.0.0.8.E.F.ip6.arpa NSEC, cache flush Android_SJA2XOSW.local NSEC, cache flush 0.3.1.C.0.6.E.F.F.F.6.4.8.1.0.0.0.0.8.B.A.1.3.2.0.4.0.4.0.0.6.2.ip6.arpa NSEC, cache flush 210.1.168.192.in-addr.arpa NSEC, cache flush I1pMSU_8n14AAA._FC9F5ED42C8A._tcp.local"
61,10.073661,fe80::18:46ff:fe60:c130,ff02::fb,MDNS,632,"Standard query response 0x0000 PTR, cache flush Android_SJA2XOSW.local AAAA, cache flush fe80::18:46ff:fe60:c130 PTR, cache flush Android_SJA2XOSW.local AAAA, cache flush 2600:4040:231a:b800:18:46ff:fe60:c130 PTR, cache flush Android_SJA2XOSW.local A, cache flush 192.168.1.210 PTR I1pMSU_8n14AAA._FC9F5ED42C8A._tcp.local SRV, cache flush 0 0 53601 Android_SJA2XOSW.local TXT, cache flush PTR _FC9F5ED42C8A._tcp.local NSEC, cache flush 0.3.1.C.0.6.E.F.F.F.6.4.8.1.0.0.0.0.0.0.0.0.0.0.0.0.0.0.0.8.E.F.ip6.arpa NSEC, cache flush Android_SJA2XOSW.local NSEC, cache flush 0.3.1.C.0.6.E.F.F.F.6.4.8.1.0.0.0.0.8.B.A.1.3.2.0.4.0.4.0.0.6.2.ip6.arpa NSEC, cache flush 210.1.168.192.in-addr.arpa NSEC, cache flush I1pMSU_8n14AAA._FC9F5ED42C8A._tcp.local"
62,10.380564,192.168.1.205,192.168.1.255,NBNS,92,Name query NB PANTUM-164FF6<00>
63,10.404992,192.168.1.228,3.171.86.171,TCP,54,53778  >  443 [ACK] Seq=1 Ack=1 Win=2048 Len=0
64,10.412526,3.171.86.171,192.168.1.228,TCP,66,[TCP ACKed unseen segment] 443  >  53778 [ACK] Seq=1 Ack=2 Win=136 Len=0 TSval=2030955108 TSecr=3321620412
65,10.906251,2600:4040:231a:b800:3c9e:c12c:139a:9787,2a04:4e42:77::84,TCP,74,53782  >  443 [ACK] Seq=1 Ack=1 Win=2048 Len=0
66,10.906351,2600:4040:231a:b800:3c9e:c12c:139a:9787,2620:1ec:33:1::10,TCP,74,53781  >  443 [ACK] Seq=1 Ack=1 Win=4096 Len=0
67,10.90642,192.168.1.228,20.209.184.129,TCP,54,53780  >  443 [ACK] Seq=1 Ack=1 Win=2048 Len=0
68,10.916876,2a04:4e42:77::84,2600:4040:231a:b800:3c9e:c12c:139a:9787,TCP,86,[TCP ACKed unseen segment] 443  >  53782 [ACK] Seq=1 Ack=2 Win=263 Len=0 TSval=3158918806 TSecr=2941717819
69,10.916881,2620:1ec:33:1::10,2600:4040:231a:b800:3c9e:c12c:139a:9787,TCP,74,[TCP ACKed unseen segment] 443  >  53781 [ACK] Seq=1 Ack=2 Win=49152 Len=0
70,10.950096,20.209.184.129,192.168.1.228,TCP,66,[TCP ACKed unseen segment] 443  >  53780 [ACK] Seq=1 Ack=2 Win=49149 Len=0 TSval=518220552 TSecr=1036635891
71,10.992621,2600:4040:231a:b800:3c9e:c12c:139a:9787,2606:4700:10::ac42:a443,TLSv1.2,209,Application Data
72,10.992723,2600:4040:231a:b800:3c9e:c12c:139a:9787,2606:4700:10::ac42:a443,TLSv1.2,125,Application Data
73,10.993554,AmazonTechno_2a:1c:1d,Broadcast,ARP,60,Who has 192.168.1.201? Tell 192.168.1.175
74,11.000651,2606:4700:10::ac42:a443,2600:4040:231a:b800:3c9e:c12c:139a:9787,TCP,86,443  >  53676 [ACK] Seq=1 Ack=163 Win=16 Len=0 TSval=3383479066 TSecr=239087409
75,11.000654,2606:4700:10::ac42:a443,2600:4040:231a:b800:3c9e:c12c:139a:9787,TLSv1.2,125,Application Data
76,11.00086,2600:4040:231a:b800:3c9e:c12c:139a:9787,2606:4700:10::ac42:a443,TCP,86,53676  >  443 [ACK] Seq=163 Ack=40 Win=2048 Len=0 TSval=239087418 TSecr=3383479066
77,11.015953,2606:4700:10::ac42:a443,2600:4040:231a:b800:3c9e:c12c:139a:9787,TLSv1.2,252,Application Data
78,11.015956,2606:4700:10::ac42:a443,2600:4040:231a:b800:3c9e:c12c:139a:9787,TLSv1.2,128,Application Data
79,11.015958,2606:4700:10::ac42:a443,2600:4040:231a:b800:3c9e:c12c:139a:9787,TLSv1.2,117,Application Data
80,11.016102,2600:4040:231a:b800:3c9e:c12c:139a:9787,2606:4700:10::ac42:a443,TCP,86,53676  >  443 [ACK] Seq=163 Ack=279 Win=2045 Len=0 TSval=239087433 TSecr=3383479082
81,11.01843,2600:4040:231a:b800:3c9e:c12c:139a:9787,2606:4700:10::ac42:a443,TLSv1.2,121,Application Data
82,11.065597,2606:4700:10::ac42:a443,2600:4040:231a:b800:3c9e:c12c:139a:9787,TCP,86,443  >  53676 [ACK] Seq=279 Ack=198 Win=16 Len=0 TSval=3383479131 TSecr=239087435
83,11.104942,192.168.1.228,146.75.28.233,TCP,54,53694  >  443 [ACK] Seq=1 Ack=1 Win=2048 Len=0
84,11.105031,192.168.1.228,57.150.26.33,TCP,54,53693  >  443 [ACK] Seq=1 Ack=1 Win=13204 Len=0
85,11.105055,192.168.1.228,20.209.184.129,TCP,54,53690  >  443 [ACK] Seq=1 Ack=1 Win=2048 Len=0
86,11.105076,192.168.1.228,57.150.26.33,TCP,54,53689  >  443 [ACK] Seq=1 Ack=1 Win=16104 Len=0
87,11.105093,192.168.1.228,57.150.26.33,TCP,54,53688  >  443 [ACK] Seq=1 Ack=1 Win=8050 Len=0
88,11.105109,192.168.1.228,57.150.26.33,TCP,54,53687  >  443 [ACK] Seq=1 Ack=1 Win=11664 Len=0
89,11.130077,146.75.28.233,192.168.1.228,TCP,66,[TCP ACKed unseen segment] 443  >  53694 [ACK] Seq=1 Ack=2 Win=267 Len=0 TSval=2943275781 TSecr=4064093365
90,11.131038,57.150.26.33,192.168.1.228,TCP,66,[TCP ACKed unseen segment] 443  >  53687 [ACK] Seq=1 Ack=2 Win=49150 Len=0 TSval=1639036786 TSecr=3864389151
91,11.131229,57.150.26.33,192.168.1.228,TCP,66,[TCP ACKed unseen segment] 443  >  53689 [ACK] Seq=1 Ack=2 Win=49150 Len=0 TSval=1971598885 TSecr=4194170536
92,11.131231,57.150.26.33,192.168.1.228,TCP,66,[TCP ACKed unseen segment] 443  >  53688 [ACK] Seq=1 Ack=2 Win=49150 Len=0 TSval=1651220073 TSecr=750150864
93,11.131883,57.150.26.33,192.168.1.228,TCP,66,[TCP ACKed unseen segment] 443  >  53693 [ACK] Seq=1 Ack=2 Win=49147 Len=0 TSval=1651371764 TSecr=2679180442
94,11.139974,2600:4040:231a:b800:3c9e:c12c:139a:9787,2606:4700:10::ac42:a443,TLSv1.2,253,Application Data
95,11.152179,2606:4700:10::ac42:a443,2600:4040:231a:b800:3c9e:c12c:139a:9787,TCP,86,443  >  53676 [ACK] Seq=279 Ack=365 Win=16 Len=0 TSval=3383479218 TSecr=239087557
96,11.15548,20.209.184.129,192.168.1.228,TCP,66,[TCP ACKed unseen segment] 443  >  53690 [ACK] Seq=1 Ack=2 Win=49150 Len=0 TSval=511984763 TSecr=1988896031
97,11.172126,2606:4700:10::ac42:a443,2600:4040:231a:b800:3c9e:c12c:139a:9787,TLSv1.2,147,Application Data
98,11.172128,2606:4700:10::ac42:a443,2600:4040:231a:b800:3c9e:c12c:139a:9787,TLSv1.2,310,Application Data
99,11.172131,2606:4700:10::ac42:a443,2600:4040:231a:b800:3c9e:c12c:139a:9787,TLSv1.2,117,Application Data
100,11.172257,2600:4040:231a:b800:3c9e:c12c:139a:9787,2606:4700:10::ac42:a443,TCP,86,53676  >  443 [ACK] Seq=365 Ack=595 Win=2044 Len=0 TSval=239087589 TSecr=3383479238
101,11.206292,2600:4040:231a:b800:3c9e:c12c:139a:9787,2607:f8b0:4004:c17::5b,TCP,74,53783  >  443 [ACK] Seq=1 Ack=1 Win=2048 Len=0
102,11.206386,2600:4040:231a:b800:3c9e:c12c:139a:9787,2606:4700:4403::6812:22d6,TCP,74,53700  >  443 [ACK] Seq=1 Ack=1 Win=2048 Len=0
103,11.206413,2600:4040:231a:b800:3c9e:c12c:139a:9787,2606:4700:10::ac42:ab44,TCP,74,53698  >  443 [ACK] Seq=1 Ack=1 Win=2048 Len=0
104,11.206433,2600:4040:231a:b800:3c9e:c12c:139a:9787,2606:4700::6811:1fae,TCP,74,53696  >  443 [ACK] Seq=1 Ack=1 Win=2048 Len=0
105,11.206486,192.168.1.228,57.150.26.33,TCP,54,53691  >  443 [ACK] Seq=1 Ack=1 Win=13561 Len=0
106,11.206513,2600:4040:231a:b800:3c9e:c12c:139a:9787,2620:1ec:33::10,TCP,74,53686  >  443 [ACK] Seq=1 Ack=1 Win=4096 Len=0
107,11.206543,192.168.1.228,37.19.207.37,TCP,54,53679  >  443 [ACK] Seq=1 Ack=1 Win=2048 Len=0
108,11.215715,2606:4700:4403::6812:22d6,2600:4040:231a:b800:3c9e:c12c:139a:9787,TCP,86,[TCP ACKed unseen segment] 443  >  53700 [ACK] Seq=1 Ack=2 Win=16 Len=0 TSval=2686161483 TSecr=2857078545
109,11.215717,2607:f8b0:4004:c17::5b,2600:4040:231a:b800:3c9e:c12c:139a:9787,TCP,86,[TCP ACKed unseen segment] 443  >  53783 [ACK] Seq=1 Ack=2 Win=1041 Len=0 TSval=162521754 TSecr=2630173173
110,11.218241,37.19.207.37,192.168.1.228,TCP,66,[TCP ACKed unseen segment] 443  >  53679 [ACK] Seq=1 Ack=2 Win=62 Len=0 TSval=1267875907 TSecr=481312005
111,11.218244,2606:4700:10::ac42:ab44,2600:4040:231a:b800:3c9e:c12c:139a:9787,TCP,86,[TCP ACKed unseen segment] 443  >  53698 [ACK] Seq=1 Ack=2 Win=16 Len=0 TSval=1439409740 TSecr=3540593148
112,11.218247,57.150.26.33,192.168.1.228,TCP,66,[TCP ACKed unseen segment] 443  >  53691 [ACK] Seq=1 Ack=2 Win=49150 Len=0 TSval=1644819882 TSecr=1394763563
113,11.218251,2620:1ec:33::10,2600:4040:231a:b800:3c9e:c12c:139a:9787,TCP,74,[TCP ACKed unseen segment] 443  >  53686 [ACK] Seq=1 Ack=2 Win=16381 Len=0
114,11.218253,2606:4700::6811:1fae,2600:4040:231a:b800:3c9e:c12c:139a:9787,TCP,86,[TCP ACKed unseen segment] 443  >  53696 [ACK] Seq=1 Ack=2 Win=16 Len=0 TSval=992198229 TSecr=1184555056
115,11.307774,192.168.1.228,13.35.78.98,TCP,54,53699  >  443 [ACK] Seq=1 Ack=1 Win=2048 Len=0
116,11.314732,13.35.78.98,192.168.1.228,TCP,66,[TCP ACKed unseen segment] 443  >  53699 [ACK] Seq=1 Ack=2 Win=164 Len=0 TSval=255177637 TSecr=2562351891
117,11.408376,2600:4040:231a:b800:3c9e:c12c:139a:9787,2607:f8b0:4004:c06::9d,TCP,74,53785  >  443 [ACK] Seq=1 Ack=1 Win=2048 Len=0
118,11.418236,2607:f8b0:4004:c06::9d,2600:4040:231a:b800:3c9e:c12c:139a:9787,TCP,86,[TCP ACKed unseen segment] 443  >  53785 [ACK] Seq=1 Ack=2 Win=1046 Len=0 TSval=637370313 TSecr=2260745113
119,11.509665,192.168.1.228,57.150.26.33,TCP,54,53692  >  443 [ACK] Seq=1 Ack=1 Win=12758 Len=0
120,11.521762,57.150.26.33,192.168.1.228,TCP,66,[TCP ACKed unseen segment] 443  >  53692 [ACK] Seq=1 Ack=2 Win=49147 Len=0 TSval=1964571517 TSecr=2101992594
121,11.610931,192.168.1.228,104.17.208.240,TCP,54,53702  >  443 [ACK] Seq=1 Ack=1 Win=2048 Len=0
122,11.618389,104.17.208.240,192.168.1.228,TCP,66,[TCP ACKed unseen segment] 443  >  53702 [ACK] Seq=1 Ack=2 Win=16 Len=0 TSval=3017758802 TSecr=2827674058
123,11.683653,192.168.1.228,54.227.187.23,TCP,54,"53747  >  443 [RST, ACK] Seq=1 Ack=1 Win=2048 Len=0"
124,11.683964,192.168.1.228,23.22.254.206,TCP,54,"53756  >  443 [RST, ACK] Seq=1 Ack=1 Win=2048 Len=0"
125,11.684411,192.168.1.228,162.247.243.29,TLSv1.2,774,Application Data
126,11.68445,192.168.1.228,162.247.243.29,TLSv1.2,921,Application Data
127,11.685295,192.168.1.228,162.247.243.29,TCP,78,"53790  >  443 [SYN, ECE, CWR] Seq=0 Win=65535 Len=0 MSS=1460 WS=64 TSval=3433930503 TSecr=0 SACK_PERM"
128,11.695653,162.247.243.29,192.168.1.228,TCP,74,"443  >  53790 [SYN, ACK] Seq=0 Ack=1 Win=65535 Len=0 MSS=1396 SACK_PERM TSval=137770250 TSecr=3433930503 WS=512"
129,11.695804,192.168.1.228,162.247.243.29,TCP,66,53790  >  443 [ACK] Seq=1 Ack=1 Win=131520 Len=0 TSval=3433930514 TSecr=137770250
130,11.696372,192.168.1.228,162.247.243.29,TCP,1450,53790  >  443 [ACK] Seq=1 Ack=1 Win=131520 Len=1384 TSval=3433930514 TSecr=137770250 [TCP PDU reassembled in 131]
131,11.696387,192.168.1.228,162.247.243.29,TLSv1.3,630,Client Hello (SNI=bam.nr-data.net)
132,11.696668,162.247.243.29,192.168.1.228,TCP,66,443  >  53773 [ACK] Seq=1 Ack=709 Win=262 Len=0 TSval=2418687583 TSecr=3917384183
133,11.69667,162.247.243.29,192.168.1.228,TCP,66,443  >  53773 [ACK] Seq=1 Ack=1564 Win=261 Len=0 TSval=2418687583 TSecr=3917384183
134,11.705957,162.247.243.29,192.168.1.228,TCP,66,443  >  53790 [ACK] Seq=1 Ack=1949 Win=136704 Len=0 TSval=137770262 TSecr=3433930514
135,11.706308,162.247.243.29,192.168.1.228,TLSv1.3,1446,"Server Hello, Change Cipher Spec, Application Data, Application Data"
136,11.706312,162.247.243.29,192.168.1.228,TLSv1.3,233,Application Data
137,11.70637,192.168.1.228,162.247.243.29,TCP,66,53790  >  443 [ACK] Seq=1949 Ack=1548 Win=129984 Len=0 TSval=3433930524 TSecr=137770262
138,11.707198,192.168.1.228,162.247.243.29,TLSv1.3,130,"Change Cipher Spec, Application Data"
139,11.707827,192.168.1.228,162.247.243.29,TLSv1.3,1234,Application Data
140,11.718567,162.247.243.29,192.168.1.228,TCP,66,443  >  53790 [ACK] Seq=1548 Ack=2013 Win=136704 Len=0 TSval=137770274 TSecr=3433930525
141,11.718569,162.247.243.29,192.168.1.228,TCP,66,443  >  53790 [ACK] Seq=1548 Ack=3181 Win=135680 Len=0 TSval=137770274 TSecr=3433930526
142,11.723051,162.247.243.29,192.168.1.228,TLSv1.2,460,Application Data
143,11.723053,162.247.243.29,192.168.1.228,TLSv1.2,112,Application Data
144,11.723095,192.168.1.228,162.247.243.29,TCP,66,53773  >  443 [ACK] Seq=1564 Ack=441 Win=2042 Len=0 TSval=3917384222 TSecr=2418687611
145,11.744962,162.247.243.29,192.168.1.228,TLSv1.3,506,"Application Data, Application Data"
146,11.745156,192.168.1.228,162.247.243.29,TCP,66,53790  >  443 [ACK] Seq=3181 Ack=1988 Win=130688 Len=0 TSval=3433930563 TSecr=137770301
147,12.722934,2600:4040:231a:b800:3c9e:c12c:139a:9787,2600:1901:0:5e8a::,UDP,91,54263  >  443 Len=29
148,12.738089,2600:1901:0:5e8a::,2600:4040:231a:b800:3c9e:c12c:139a:9787,UDP,88,443  >  54263 Len=26
149,13.144186,WNC_46:a8:04,Broadcast,ARP,42,Who has 192.168.1.225? Tell 192.168.1.1
150,14.330455,fe80::1097:88a0:4399:850a,fe80::3ebd:c5ff:fed5:e174,ICMPv6,86,Neighbor Solicitation for fe80::3ebd:c5ff:fed5:e174 from ce:f6:1b:97:2c:c9
151,14.340025,fe80::3ebd:c5ff:fed5:e174,fe80::1097:88a0:4399:850a,ICMPv6,78,"Neighbor Advertisement fe80::3ebd:c5ff:fed5:e174 (rtr, sol)"
152,14.372907,WNC_46:a8:04,Broadcast,ARP,42,Who has 192.168.1.175? Tell 192.168.1.1
153,14.514655,2600:4040:231a:b800:3c9e:c12c:139a:9787,2607:f8b0:4006:812::200a,TCP,74,53786  >  443 [ACK] Seq=1 Ack=1 Win=2048 Len=0
154,14.528734,2607:f8b0:4006:812::200a,2600:4040:231a:b800:3c9e:c12c:139a:9787,TCP,86,[TCP ACKed unseen segment] 443  >  53786 [ACK] Seq=1 Ack=2 Win=1046 Len=0 TSval=2830017799 TSecr=2556171881
155,14.987573,RealtekSemic_68:0a:41,Broadcast,ARP,60,Who has 192.168.1.1? Tell 192.168.1.224
156,14.987577,RealtekSemic_68:0a:41,Broadcast,ARP,60,Who has 192.168.1.224? (ARP Probe)
157,16.216538,RealtekSemic_68:0a:41,Broadcast,ARP,60,Who has 192.168.1.224? (ARP Probe)
158,16.216574,fe80::cfda:5f45:41bc:9216,ff02::fb,MDNS,99,"Standard query 0x0000 A Pantum-164FF6.local, ""QM"" question"
159,16.216709,192.168.1.205,224.0.0.251,MDNS,79,"Standard query 0x0000 A Pantum-164FF6.local, ""QM"" question"
160,16.216819,fe80::cfda:5f45:41bc:9216,ff02::fb,MDNS,99,"Standard query 0x0000 AAAA Pantum-164FF6.local, ""QU"" question"
161,16.217227,192.168.1.205,224.0.0.251,MDNS,79,"Standard query 0x0000 AAAA Pantum-164FF6.local, ""QU"" question"
162,16.21723,192.168.1.175,224.0.0.251,MDNS,92,"Standard query response 0x0000 A, cache flush 192.168.1.175"
163,16.217468,WNC_46:a8:04,Broadcast,ARP,42,Who has 192.168.1.167? Tell 192.168.1.1
164,16.523555,192.168.1.183,224.0.0.251,MDNS,89,"Standard query response 0x0000 A, cache flush 192.168.1.183"
165,16.523908,0.0.0.0,255.255.255.255,DHCP,342,DHCP Request  - Transaction ID 0x9392c1b5
166,16.523912,192.168.1.178,224.0.0.251,MDNS,89,"Standard query response 0x0000 A, cache flush 192.168.1.178"
167,16.524424,192.168.1.205,224.0.0.251,MDNS,79,"Standard query 0x0000 A Pantum-164FF6.local, ""QM"" question"
168,16.524427,192.168.1.205,192.168.1.255,NBNS,92,Name query NB PANTUM-164FF6<00>
169,16.524538,fe80::cfda:5f45:41bc:9216,ff02::fb,MDNS,99,"Standard query 0x0000 A Pantum-164FF6.local, ""QM"" question"
170,16.525389,fe80::cfda:5f45:41bc:9216,ff02::fb,MDNS,99,"Standard query 0x0000 AAAA Pantum-164FF6.local, ""QM"" question"
171,16.525393,192.168.1.205,224.0.0.251,MDNS,79,"Standard query 0x0000 AAAA Pantum-164FF6.local, ""QM"" question"
172,16.526388,192.168.1.175,224.0.0.251,MDNS,92,"Standard query response 0x0000 A, cache flush 192.168.1.175"
173,16.832579,192.168.1.178,224.0.0.251,MDNS,89,"Standard query response 0x0000 A, cache flush 192.168.1.178"
174,16.832584,192.168.1.183,224.0.0.251,MDNS,89,"Standard query response 0x0000 A, cache flush 192.168.1.183"
175,17.138838,192.168.1.205,224.0.0.251,MDNS,79,"Standard query 0x0000 A Pantum-164FF6.local, ""QM"" question"
176,17.138842,fe80::cfda:5f45:41bc:9216,ff02::fb,MDNS,99,"Standard query 0x0000 A Pantum-164FF6.local, ""QM"" question"
177,17.138891,192.168.1.205,224.0.0.251,MDNS,79,"Standard query 0x0000 AAAA Pantum-164FF6.local, ""QU"" question"
178,17.139206,fe80::cfda:5f45:41bc:9216,ff02::fb,MDNS,99,"Standard query 0x0000 AAAA Pantum-164FF6.local, ""QU"" question"
179,17.139209,RealtekSemic_68:0a:41,Broadcast,ARP,60,Who has 192.168.1.224? (ARP Probe)
180,17.139483,192.168.1.175,224.0.0.251,MDNS,92,"Standard query response 0x0000 A, cache flush 192.168.1.175"
181,17.445245,192.168.1.183,224.0.0.251,MDNS,89,"Standard query response 0x0000 A, cache flush 192.168.1.183"
182,17.445249,192.168.1.205,192.168.1.255,NBNS,92,Name query NB PANTUM-164FF6<00>
183,17.445305,192.168.1.178,224.0.0.251,MDNS,89,"Standard query response 0x0000 A, cache flush 192.168.1.178"
184,17.445308,WNC_46:a8:04,Broadcast,ARP,42,Who has 192.168.1.224? Tell 192.168.1.1
185,17.445471,WNC_46:a8:04,Broadcast,ARP,42,Who has 192.168.1.210? Tell 192.168.1.1
186,17.445999,WNC_46:a8:04,Broadcast,ARP,42,Who has 192.168.1.159? Tell 192.168.1.1
187,18.059616,WNC_46:a8:04,Broadcast,ARP,42,Who has 192.168.1.183? Tell 192.168.1.1
188,18.05962,RealtekSemic_68:0a:41,Broadcast,ARP,60,ARP Announcement for 192.168.1.224
189,18.059657,192.168.1.205,192.168.1.255,NBNS,92,Name query NB PANTUM-164FF6<00>
190,18.059833,192.168.1.224,192.168.1.255,NBNS,110,Registration NB AV<20>
191,18.366816,192.168.1.224,192.168.1.255,NBNS,110,Registration NB WORKGROUP<00>
192,18.36682,192.168.1.224,192.168.1.255,NBNS,110,Registration NB AV<00>
193,18.370382,2a06:98c1:3107::6812:2715,2600:4040:231a:b800:3c9e:c12c:139a:9787,TLSv1.2,110,Application Data
194,18.370758,2600:4040:231a:b800:3c9e:c12c:139a:9787,2a06:98c1:3107::6812:2715,TCP,86,53303  >  443 [ACK] Seq=1 Ack=25 Win=2048 Len=0 TSval=387885939 TSecr=4116614832
195,18.371003,2600:4040:231a:b800:3c9e:c12c:139a:9787,2a06:98c1:3107::6812:2715,TLSv1.2,114,Application Data
196,18.378724,2a06:98c1:3107::6812:2715,2600:4040:231a:b800:3c9e:c12c:139a:9787,TCP,86,443  >  53303 [ACK] Seq=25 Ack=29 Win=16 Len=0 TSval=4116614894 TSecr=387885940
197,18.527112,2600:4040:231a:b800:3c9e:c12c:139a:9787,2603:1036:302:4154::2,UDP,97,59908  >  443 Len=35
198,18.562319,2603:1036:302:4154::2,2600:4040:231a:b800:3c9e:c12c:139a:9787,UDP,90,443  >  59908 Len=28
199,18.774707,2600:4040:231a:b800:3c9e:c12c:139a:9787,2607:f8b0:4004:c25::5e,TCP,74,53704  >  443 [ACK] Seq=1 Ack=1 Win=2048 Len=0
200,18.785432,2607:f8b0:4004:c25::5e,2600:4040:231a:b800:3c9e:c12c:139a:9787,TCP,86,[TCP ACKed unseen segment] 443  >  53704 [ACK] Seq=1 Ack=2 Win=1046 Len=0 TSval=3490492527 TSecr=4254702350
201,18.87545,2600:4040:231a:b800:3c9e:c12c:139a:9787,2607:f8b0:4004:c1b::bc,TCP,74,53128  >  5228 [ACK] Seq=1 Ack=1 Win=2048 Len=0
202,18.883008,2607:f8b0:4004:c1b::bc,2600:4040:231a:b800:3c9e:c12c:139a:9787,TCP,86,[TCP ACKed unseen segment] 5228  >  53128 [ACK] Seq=1 Ack=2 Win=1047 Len=0 TSval=4273224903 TSecr=1510308129
203,18.981027,192.168.1.224,192.168.1.255,NBNS,110,Registration NB AV<20>
204,18.981071,192.168.1.224,192.168.1.255,NBNS,110,Registration NB AV<00>
205,18.981308,192.168.1.224,192.168.1.255,NBNS,110,Registration NB WORKGROUP<00>
206,19.383096,fe80::1097:88a0:4399:850a,fe80::2641:feff:fe46:a804,ICMPv6,86,Neighbor Solicitation for fe80::2641:feff:fe46:a804 from ce:f6:1b:97:2c:c9
207,19.392174,fe80::2641:feff:fe46:a804,fe80::1097:88a0:4399:850a,ICMPv6,78,"Neighbor Advertisement fe80::2641:feff:fe46:a804 (rtr, sol)"
208,19.595329,WNC_46:a8:04,Broadcast,ARP,42,Who has 192.168.1.228? Tell 192.168.1.1
209,19.595332,fe80::2641:feff:fe46:a804,ff02::1:ff99:850a,ICMPv6,86,Neighbor Solicitation for fe80::1097:88a0:4399:850a from 24:41:fe:46:a8:04
210,19.595431,ce:f6:1b:97:2c:c9,WNC_46:a8:04,ARP,42,192.168.1.228 is at ce:f6:1b:97:2c:c9
211,19.595501,WNC_46:a8:04,Broadcast,ARP,42,Who has 192.168.1.183? Tell 192.168.1.1
212,19.59556,fe80::1097:88a0:4399:850a,fe80::2641:feff:fe46:a804,ICMPv6,86,"Neighbor Advertisement fe80::1097:88a0:4399:850a (sol, ovr) is at ce:f6:1b:97:2c:c9"
213,19.596236,192.168.1.224,192.168.1.255,NBNS,110,Registration NB AV<20>
214,19.596422,192.168.1.224,192.168.1.255,NBNS,110,Registration NB WORKGROUP<00>
215,19.596424,192.168.1.224,192.168.1.255,NBNS,110,Registration NB AV<00>
216,20.209947,RealtekSemic_68:0a:41,Broadcast,ARP,60,ARP Announcement for 192.168.1.224
217,20.51735,192.168.1.224,192.168.1.255,NBNS,110,Registration NB AV<20>
218,20.517354,192.168.1.224,192.168.1.255,NBNS,110,Registration NB AV<00>
219,20.517358,192.168.1.224,192.168.1.255,NBNS,110,Registration NB WORKGROUP<00>
220,20.70673,2600:4040:231a:b800:3c9e:c12c:139a:9787,2600:1408:5400:1c::173d:b47,TCP,74,53731  >  443 [ACK] Seq=1 Ack=1 Win=2048 Len=0
221,20.719802,2600:1408:5400:1c::173d:b47,2600:4040:231a:b800:3c9e:c12c:139a:9787,TCP,86,[TCP ACKed unseen segment] 443  >  53731 [ACK] Seq=1 Ack=2 Win=565 Len=0 TSval=922026459 TSecr=3405414930
222,20.824238,WNC_46:a8:04,Broadcast,ARP,42,Who has 192.168.1.151? Tell 192.168.1.1
223,20.824441,WNC_46:a8:04,Broadcast,ARP,42,Who has 192.168.1.226? Tell 192.168.1.1
224,20.824821,192.168.1.210,224.0.0.251,MDNS,103,"Standard query 0x0005 PTR _googlecast._tcp.local, ""QM"" question PTR _233637DE._sub._googlecast._tcp.local, ""QM"" question"
225,20.824978,fe80::18:46ff:fe60:c130,ff02::fb,MDNS,123,"Standard query 0x0005 PTR _googlecast._tcp.local, ""QM"" question PTR _233637DE._sub._googlecast._tcp.local, ""QM"" question"
226,21.171035,2600:4040:231a:b800:3c9e:c12c:139a:9787,2606:4700:10::ac42:a443,TLSv1.2,217,Application Data
227,21.204298,2606:4700:10::ac42:a443,2600:4040:231a:b800:3c9e:c12c:139a:9787,TLSv1.2,170,Application Data
228,21.204301,2606:4700:10::ac42:a443,2600:4040:231a:b800:3c9e:c12c:139a:9787,TLSv1.2,310,Application Data
229,21.204305,2606:4700:10::ac42:a443,2600:4040:231a:b800:3c9e:c12c:139a:9787,TLSv1.2,117,Application Data
230,21.204522,2600:4040:231a:b800:3c9e:c12c:139a:9787,2606:4700:10::ac42:a443,TCP,86,53676  >  443 [ACK] Seq=496 Ack=934 Win=2043 Len=0 TSval=239097621 TSecr=3383489268
231,21.206652,2600:4040:231a:b800:3c9e:c12c:139a:9787,2606:4700:10::ac42:a443,TLSv1.2,121,Application Data
232,21.207454,2600:4040:231a:b800:3c9e:c12c:139a:9787,2607:f8b0:4004:c23::5e,TCP,74,53745  >  443 [ACK] Seq=1 Ack=1 Win=2048 Len=0
233,21.207512,2600:4040:231a:b800:3c9e:c12c:139a:9787,2607:f8b0:4004:c1f::94,TCP,74,53739  >  443 [ACK] Seq=1 Ack=1 Win=2048 Len=0
234,21.207543,2600:4040:231a:b800:3c9e:c12c:139a:9787,2600:1408:5400:22::b819:7f92,TCP,74,53737  >  443 [ACK] Seq=1 Ack=1 Win=2048 Len=0
235,21.207564,2600:4040:231a:b800:3c9e:c12c:139a:9787,2600:1408:5400:1c::173d:b38,TCP,74,53735  >  443 [ACK] Seq=1 Ack=1 Win=2048 Len=0
236,21.207584,2600:4040:231a:b800:3c9e:c12c:139a:9787,2607:f8b0:4004:c25::88,TCP,74,53732  >  443 [ACK] Seq=1 Ack=1 Win=2048 Len=0
237,21.214306,2600:1408:5400:22::b819:7f92,2600:4040:231a:b800:3c9e:c12c:139a:9787,TCP,86,[TCP ACKed unseen segment] 443  >  53737 [ACK] Seq=1 Ack=2 Win=579 Len=0 TSval=2716968285 TSecr=3342400830
238,21.21431,2600:1408:5400:1c::173d:b38,2600:4040:231a:b800:3c9e:c12c:139a:9787,TCP,86,[TCP ACKed unseen segment] 443  >  53735 [ACK] Seq=1 Ack=2 Win=497 Len=0 TSval=905234406 TSecr=4072620101
239,21.216861,2607:f8b0:4004:c25::88,2600:4040:231a:b800:3c9e:c12c:139a:9787,TCP,86,[TCP ACKed unseen segment] 443  >  53732 [ACK] Seq=1 Ack=2 Win=1043 Len=0 TSval=552561198 TSecr=3032665145
240,21.216864,2607:f8b0:4004:c23::5e,2600:4040:231a:b800:3c9e:c12c:139a:9787,TCP,86,[TCP ACKed unseen segment] 443  >  53745 [ACK] Seq=1 Ack=2 Win=1045 Len=0 TSval=1887066451 TSecr=2054374030
241,21.217425,2607:f8b0:4004:c1f::94,2600:4040:231a:b800:3c9e:c12c:139a:9787,TCP,86,[TCP ACKed unseen segment] 443  >  53739 [ACK] Seq=1 Ack=2 Win=1045 Len=0 TSval=1858712437 TSecr=4245623889
242,21.225757,2600:4040:231a:b800:3c9e:c12c:139a:9787,2600:1408:5400:193::11e2,TCP,74,53743  >  443 [ACK] Seq=1 Ack=1 Win=2048 Len=0
243,21.225865,192.168.1.228,162.159.140.165,TCP,54,53742  >  443 [ACK] Seq=1 Ack=1 Win=2048 Len=0
244,21.225894,2600:4040:231a:b800:3c9e:c12c:139a:9787,2600:1408:5400:193::11e2,TCP,74,53740  >  443 [ACK] Seq=1 Ack=1 Win=2048 Len=0
245,21.234304,2600:1408:5400:193::11e2,2600:4040:231a:b800:3c9e:c12c:139a:9787,TCP,86,[TCP ACKed unseen segment] 443  >  53743 [ACK] Seq=1 Ack=2 Win=467 Len=0 TSval=2653100193 TSecr=342158192
246,21.234306,2600:1408:5400:193::11e2,2600:4040:231a:b800:3c9e:c12c:139a:9787,TCP,86,[TCP ACKed unseen segment] 443  >  53740 [ACK] Seq=1 Ack=2 Win=485 Len=0 TSval=2653100194 TSecr=4176971269
247,21.234423,162.159.140.165,192.168.1.228,TCP,66,[TCP ACKed unseen segment] 443  >  53742 [ACK] Seq=1 Ack=2 Win=16 Len=0 TSval=3234523883 TSecr=2471404199
248,21.254851,2606:4700:10::ac42:a443,2600:4040:231a:b800:3c9e:c12c:139a:9787,TCP,86,443  >  53676 [ACK] Seq=934 Ack=531 Win=16 Len=0 TSval=3383489321 TSecr=239097623
249,21.32914,2600:4040:231a:b800:3c9e:c12c:139a:9787,2607:f8b0:4004:c17::77,TCP,74,53738  >  443 [ACK] Seq=1 Ack=1 Win=3163 Len=0
250,21.337485,2607:f8b0:4004:c17::77,2600:4040:231a:b800:3c9e:c12c:139a:9787,TCP,86,[TCP ACKed unseen segment] 443  >  53738 [ACK] Seq=1 Ack=2 Win=1045 Len=0 TSval=2398187185 TSecr=1204559258
251,21.430368,2600:4040:231a:b800:3c9e:c12c:139a:9787,2600:1408:5400:193::11e2,TCP,74,53746  >  443 [ACK] Seq=1 Ack=1 Win=2048 Len=0
252,21.438508,WNC_46:a8:04,Broadcast,ARP,42,Who has 192.168.1.159? Tell 192.168.1.1
253,21.441926,2600:1408:5400:193::11e2,2600:4040:231a:b800:3c9e:c12c:139a:9787,TCP,86,[TCP ACKed unseen segment] 443  >  53746 [ACK] Seq=1 Ack=2 Win=485 Len=0 TSval=2653100397 TSecr=422384587
254,21.531626,192.168.1.228,13.35.78.122,TCP,54,53749  >  443 [ACK] Seq=1 Ack=1 Win=2048 Len=0
255,21.531721,2600:4040:231a:b800:3c9e:c12c:139a:9787,2606:4700::6812:562a,TCP,74,53748  >  443 [ACK] Seq=1 Ack=1 Win=2048 Len=0
256,21.539823,2606:4700::6812:562a,2600:4040:231a:b800:3c9e:c12c:139a:9787,TCP,86,[TCP ACKed unseen segment] 443  >  53748 [ACK] Seq=1 Ack=2 Win=16 Len=0 TSval=4233921988 TSecr=3454617197
257,21.539826,13.35.78.122,192.168.1.228,TCP,66,[TCP ACKed unseen segment] 443  >  53749 [ACK] Seq=1 Ack=2 Win=141 Len=0 TSval=255187006 TSecr=3524054976
258,21.632909,2600:4040:231a:b800:3c9e:c12c:139a:9787,2607:f8b0:4004:c17::be,TCP,74,53734  >  443 [ACK] Seq=1 Ack=1 Win=2204 Len=0
259,21.641155,2607:f8b0:4004:c17::be,2600:4040:231a:b800:3c9e:c12c:139a:9787,TCP,86,[TCP ACKed unseen segment] 443  >  53734 [ACK] Seq=1 Ack=2 Win=1040 Len=0 TSval=2957026701 TSecr=4164536398
260,21.73417,2600:4040:231a:b800:3c9e:c12c:139a:9787,2607:f8b0:4004:c23::5f,TCP,74,53751  >  443 [ACK] Seq=1 Ack=1 Win=2048 Len=0
261,21.745223,2607:f8b0:4004:c23::5f,2600:4040:231a:b800:3c9e:c12c:139a:9787,TCP,86,[TCP ACKed unseen segment] 443  >  53751 [ACK] Seq=1 Ack=2 Win=1038 Len=0 TSval=1886684956 TSecr=422182702
262,21.835414,2600:4040:231a:b800:3c9e:c12c:139a:9787,2607:f8b0:4004:c19::5f,TCP,74,53758  >  443 [ACK] Seq=1 Ack=1 Win=2048 Len=0
263,21.835535,192.168.1.228,146.75.38.132,TCP,54,53755  >  443 [ACK] Seq=1 Ack=1 Win=2048 Len=0
264,21.84273,146.75.38.132,192.168.1.228,TCP,66,[TCP ACKed unseen segment] 443  >  53755 [ACK] Seq=1 Ack=2 Win=264 Len=0 TSval=2641557517 TSecr=964150607
265,21.843883,2607:f8b0:4004:c19::5f,2600:4040:231a:b800:3c9e:c12c:139a:9787,TCP,86,[TCP ACKed unseen segment] 443  >  53758 [ACK] Seq=1 Ack=2 Win=1046 Len=0 TSval=825468877 TSecr=724999375
266,21.935956,192.168.1.228,52.6.228.48,TCP,54,53759  >  443 [ACK] Seq=1 Ack=1 Win=2048 Len=0
267,21.936038,2600:4040:231a:b800:3c9e:c12c:139a:9787,2600:9000:28a0:0:19:9934:6a80:93a1,TCP,74,53754  >  443 [ACK] Seq=1 Ack=1 Win=2048 Len=0
268,21.93606,2600:4040:231a:b800:3c9e:c12c:139a:9787,2600:9000:2870:5200:11:f728:3040:93a1,TCP,74,53753  >  443 [ACK] Seq=1 Ack=1 Win=2048 Len=0
269,21.936081,192.168.1.228,162.159.140.165,TCP,54,53752  >  443 [ACK] Seq=1 Ack=1 Win=2048 Len=0
270,21.9361,2600:4040:231a:b800:3c9e:c12c:139a:9787,2600:1408:5400:190::1e80,TCP,74,53741  >  443 [ACK] Seq=1 Ack=1 Win=2851 Len=0
271,21.943668,2600:1408:5400:190::1e80,2600:4040:231a:b800:3c9e:c12c:139a:9787,TCP,86,[TCP ACKed unseen segment] 443  >  53741 [ACK] Seq=1 Ack=2 Win=485 Len=0 TSval=4130483942 TSecr=638162537
272,21.945362,52.6.228.48,192.168.1.228,TCP,66,[TCP ACKed unseen segment] 443  >  53759 [ACK] Seq=1 Ack=2 Win=625 Len=0 TSval=4197731566 TSecr=1488302726
273,21.945364,162.159.140.165,192.168.1.228,TCP,66,[TCP ACKed unseen segment] 443  >  53752 [ACK] Seq=1 Ack=2 Win=16 Len=0 TSval=614137327 TSecr=3880562094
274,21.945368,2600:9000:2870:5200:11:f728:3040:93a1,2600:4040:231a:b800:3c9e:c12c:139a:9787,TCP,86,[TCP ACKed unseen segment] 443  >  53753 [ACK] Seq=1 Ack=2 Win=156 Len=0 TSval=202506230 TSecr=2027453125
275,21.945371,2600:9000:28a0:0:19:9934:6a80:93a1,2600:4040:231a:b800:3c9e:c12c:139a:9787,TCP,86,[TCP ACKed unseen segment] 443  >  53754 [ACK] Seq=1 Ack=2 Win=140 Len=0 TSval=1550720650 TSecr=4075877217
276,22.13767,192.168.1.228,162.247.243.29,TCP,54,53762  >  443 [ACK] Seq=1 Ack=1 Win=2048 Len=0
277,22.151431,162.247.243.29,192.168.1.228,TCP,66,[TCP ACKed unseen segment] 443  >  53762 [ACK] Seq=1 Ack=2 Win=263 Len=0 TSval=4011526066 TSecr=3920086647
278,22.237968,192.168.1.228,162.247.243.29,TCP,54,53761  >  443 [ACK] Seq=1 Ack=1 Win=2048 Len=0
279,22.251067,162.247.243.29,192.168.1.228,TCP,66,[TCP ACKed unseen segment] 443  >  53761 [ACK] Seq=1 Ack=2 Win=265 Len=0 TSval=2975669496 TSecr=4032909556
280,22.840336,192.168.1.228,35.162.235.216,TCP,54,53763  >  443 [ACK] Seq=1 Ack=1 Win=2048 Len=0
281,22.840431,192.168.1.228,3.248.75.199,TCP,54,53757  >  443 [ACK] Seq=1 Ack=1 Win=2048 Len=0
282,22.840503,2600:4040:231a:b800:3c9e:c12c:139a:9787,2600:1408:5400:1c::173d:b47,TCP,74,53733  >  443 [ACK] Seq=1 Ack=1 Win=7729 Len=0
283,22.852269,2600:1408:5400:1c::173d:b47,2600:4040:231a:b800:3c9e:c12c:139a:9787,TCP,86,[TCP ACKed unseen segment] 443  >  53733 [ACK] Seq=1 Ack=2 Win=501 Len=0 TSval=922028591 TSecr=961629042
284,22.915202,35.162.235.216,192.168.1.228,TCP,66,[TCP ACKed unseen segment] 443  >  53763 [ACK] Seq=1 Ack=2 Win=338 Len=0 TSval=4246765023 TSecr=952917949
285,22.942441,3.248.75.199,192.168.1.228,TCP,66,[TCP ACKed unseen segment] 443  >  53757 [ACK] Seq=1 Ack=2 Win=338 Len=0 TSval=203157779 TSecr=343248482
286,23.387981,3.248.75.199,192.168.1.228,TCP,66,[TCP Keep-Alive] 443  >  53757 [ACK] Seq=0 Ack=2 Win=338 Len=0 TSval=203158130 TSecr=343248482
287,23.388219,192.168.1.228,3.248.75.199,TCP,66,[TCP Previous segment not captured] 53757  >  443 [ACK] Seq=2 Ack=1 Win=2048 Len=0 TSval=343339860 TSecr=203157779
288,23.434297,2603:1036:302:4154::2,2600:4040:231a:b800:3c9e:c12c:139a:9787,UDP,101,443  >  59908 Len=39
289,23.436467,2600:4040:231a:b800:3c9e:c12c:139a:9787,2603:1036:302:4154::2,UDP,101,59908  >  443 Len=39
290,23.518063,35.162.235.216,192.168.1.228,TCP,66,[TCP Keep-Alive] 443  >  53763 [ACK] Seq=0 Ack=2 Win=338 Len=0 TSval=4246765625 TSecr=952917949
291,23.518287,192.168.1.228,35.162.235.216,TCP,66,[TCP Previous segment not captured] 53763  >  443 [ACK] Seq=2 Ack=1 Win=2048 Len=0 TSval=953009363 TSecr=4246765023
292,23.898157,fe80::cfda:5f45:41bc:9216,ff02::fb,MDNS,99,"Standard query 0x0000 A Pantum-164FF6.local, ""QM"" question"
293,23.898163,192.168.1.205,224.0.0.251,MDNS,79,"Standard query 0x0000 A Pantum-164FF6.local, ""QM"" question"
294,23.898214,fe80::cfda:5f45:41bc:9216,ff02::fb,MDNS,99,"Standard query 0x0000 AAAA Pantum-164FF6.local, ""QU"" question"
295,23.898281,192.168.1.205,224.0.0.251,MDNS,79,"Standard query 0x0000 AAAA Pantum-164FF6.local, ""QU"" question"
296,23.898654,192.168.1.183,224.0.0.251,MDNS,89,"Standard query response 0x0000 A, cache flush 192.168.1.183"
297,23.898874,192.168.1.175,224.0.0.251,MDNS,92,"Standard query response 0x0000 A, cache flush 192.168.1.175"
298,24.160226,192.168.1.228,140.82.113.26,TCP,54,53382  >  443 [ACK] Seq=1 Ack=1 Win=2048 Len=0
299,24.172262,140.82.113.26,192.168.1.228,TCP,66,[TCP ACKed unseen segment] 443  >  53382 [ACK] Seq=1 Ack=2 Win=74 Len=0 TSval=1367960785 TSecr=1907044573
300,24.203481,AmazonTechno_2a:1c:1d,Broadcast,ARP,60,Who has 192.168.1.159? Tell 192.168.1.175
301,24.203485,192.168.1.178,224.0.0.251,MDNS,89,"Standard query response 0x0000 A, cache flush 192.168.1.178"
302,24.510861,192.168.1.205,224.0.0.251,MDNS,79,"Standard query 0x0000 A Pantum-164FF6.local, ""QM"" question"
303,24.510865,192.168.1.205,192.168.1.255,NBNS,92,Name query NB PANTUM-164FF6<00>
304,24.51149,192.168.1.205,224.0.0.251,MDNS,79,"Standard query 0x0000 AAAA Pantum-164FF6.local, ""QM"" question"
305,24.511905,fe80::cfda:5f45:41bc:9216,ff02::fb,MDNS,99,"Standard query 0x0000 A Pantum-164FF6.local, ""QM"" question"
306,24.512374,fe80::cfda:5f45:41bc:9216,ff02::fb,MDNS,99,"Standard query 0x0000 AAAA Pantum-164FF6.local, ""QM"" question"
307,24.512378,192.168.1.175,224.0.0.251,MDNS,92,"Standard query response 0x0000 A, cache flush 192.168.1.175"
308,24.512489,GlazeroTechn_6:41:b9,Broadcast,ARP,42,ARP Announcement for 192.168.1.159
309,24.512602,GlazeroTechn_6:41:b9,Broadcast,ARP,42,ARP Announcement for 192.168.1.159
310,24.51284,GlazeroTechn_6:41:b9,Broadcast,ARP,42,ARP Announcement for 192.168.1.159
311,24.516233,GlazeroTechn_6:41:b9,Broadcast,ARP,42,ARP Announcement for 192.168.1.159
312,24.819829,192.168.1.178,224.0.0.251,MDNS,89,"Standard query response 0x0000 A, cache flush 192.168.1.178"
313,24.819833,192.168.1.183,224.0.0.251,MDNS,89,"Standard query response 0x0000 A, cache flush 192.168.1.183"
314,24.819835,192.168.1.205,224.0.0.251,MDNS,79,"Standard query 0x0000 A Pantum-164FF6.local, ""QM"" question"
