"No.","Time","Source","Destination","Protocol","Length","Info"
"1","0.000000","100.86.121.59","172.66.164.67","TLSv1.2","310","Application Data"
"2","0.000114","100.86.121.59","172.66.164.67","TLSv1.2","349","Application Data"
"3","0.003474","100.86.121.59","172.66.164.67","TLSv1.2","102","Application Data"
"4","0.009790","172.66.164.67","100.86.121.59","TCP","66","443  >  53635 [ACK] Seq=1 Ack=245 Win=18 Len=0 TSval=868248068 TSecr=600544867"
"5","0.010960","172.66.164.67","100.86.121.59","TCP","66","443  >  53635 [ACK] Seq=1 Ack=528 Win=18 Len=0 TSval=868248069 TSecr=600544868"
"6","0.013035","172.66.164.67","100.86.121.59","TCP","66","443  >  53635 [ACK] Seq=1 Ack=564 Win=18 Len=0 TSval=868248071 TSecr=600544871"
"7","0.030894","172.66.164.67","100.86.121.59","TLSv1.2","274","Application Data"
"8","0.030897","172.66.164.67","100.86.121.59","TLSv1.2","357","Application Data"
"9","0.031001","100.86.121.59","172.66.164.67","TCP","66","53635  >  443 [ACK] Seq=564 Ack=500 Win=2041 Len=0 TSval=600544898 TSecr=868248089"
"10","0.031181","172.66.164.67","100.86.121.59","TLSv1.2","97","Application Data"
"11","0.031246","100.86.121.59","172.66.164.67","TCP","66","53635  >  443 [ACK] Seq=564 Ack=531 Win=2048 Len=0 TSval=600544899 TSecr=868248089"
"12","0.031602","100.86.121.59","172.66.164.67","TLSv1.2","101","Application Data"
"13","0.034732","172.66.164.67","100.86.121.59","TLSv1.2","236","Application Data"
"14","0.034801","100.86.121.59","172.66.164.67","TCP","66","53635  >  443 [ACK] Seq=599 Ack=701 Win=2046 Len=0 TSval=600544902 TSecr=868248093"
"15","0.034833","172.66.164.67","100.86.121.59","TLSv1.2","419","Application Data"
"16","0.034864","100.86.121.59","172.66.164.67","TCP","66","53635  >  443 [ACK] Seq=599 Ack=1054 Win=2043 Len=0 TSval=600544902 TSecr=868248093"
"17","0.035141","172.66.164.67","100.86.121.59","TLSv1.2","97","Application Data"
"18","0.035173","100.86.121.59","172.66.164.67","TCP","66","53635  >  443 [ACK] Seq=599 Ack=1085 Win=2048 Len=0 TSval=600544903 TSecr=868248093"
"19","0.081651","172.66.164.67","100.86.121.59","TCP","66","443  >  53635 [ACK] Seq=1085 Ack=599 Win=18 Len=0 TSval=868248140 TSecr=600544899"
"20","4.543094","100.86.121.59","172.66.164.67","TCP","1454","53635  >  443 [ACK] Seq=599 Ack=1085 Win=2048 Len=1388 TSval=600549410 TSecr=868248140 [TCP PDU reassembled in 21]"
"21","4.543108","100.86.121.59","172.66.164.67","TLSv1.2","160","Application Data"
"22","4.554593","172.66.164.67","100.86.121.59","TCP","66","443  >  53635 [ACK] Seq=1085 Ack=2081 Win=18 Len=0 TSval=868252612 TSecr=600549410"
"23","4.786459","172.66.164.67","100.86.121.59","TLSv1.2","329","Application Data"
"24","4.786468","172.66.164.67","100.86.121.59","TCP","1514","443  >  53635 [ACK] Seq=1348 Ack=2081 Win=18 Len=1448 TSval=868252844 TSecr=600549410 [TCP PDU reassembled in 27]"
"25","4.786600","100.86.121.59","172.66.164.67","TCP","66","53635  >  443 [ACK] Seq=2081 Ack=2796 Win=2022 Len=0 TSval=600549654 TSecr=868252844"
"26","4.788131","172.66.164.67","100.86.121.59","TCP","1514","443  >  53635 [ACK] Seq=2796 Ack=2081 Win=18 Len=1448 TSval=868252844 TSecr=600549410 [TCP PDU reassembled in 27]"
"27","4.788135","172.66.164.67","100.86.121.59","TLSv1.2","1421","Application Data"
"28","4.788138","172.66.164.67","100.86.121.59","TCP","1514","443  >  53635 [ACK] Seq=5599 Ack=2081 Win=18 Len=1448 TSval=868252845 TSecr=600549410 [TCP PDU reassembled in 30]"
"29","4.788140","172.66.164.67","100.86.121.59","TCP","1514","443  >  53635 [ACK] Seq=7047 Ack=2081 Win=18 Len=1448 TSval=868252845 TSecr=600549410 [TCP PDU reassembled in 30]"
"30","4.788143","172.66.164.67","100.86.121.59","TLSv1.2","1421","Application Data"
"31","4.788146","172.66.164.67","100.86.121.59","TCP","1514","443  >  53635 [ACK] Seq=9850 Ack=2081 Win=18 Len=1448 TSval=868252845 TSecr=600549410 [TCP PDU reassembled in 33]"
"32","4.788153","172.66.164.67","100.86.121.59","TCP","1514","443  >  53635 [ACK] Seq=11298 Ack=2081 Win=18 Len=1448 TSval=868252845 TSecr=600549410 [TCP PDU reassembled in 33]"
"33","4.788156","172.66.164.67","100.86.121.59","TLSv1.2","1514","Application Data"
"34","4.788158","172.66.164.67","100.86.121.59","TCP","1514","443  >  53635 [ACK] Seq=14194 Ack=2081 Win=18 Len=1448 TSval=868252845 TSecr=600549410 [TCP PDU reassembled in 36]"
"35","4.788160","172.66.164.67","100.86.121.59","TCP","1514","443  >  53635 [ACK] Seq=15642 Ack=2081 Win=18 Len=1448 TSval=868252845 TSecr=600549410 [TCP PDU reassembled in 36]"
"36","4.788163","172.66.164.67","100.86.121.59","TLSv1.2","1328","Application Data"
"37","4.788257","100.86.121.59","172.66.164.67","TCP","66","53635  >  443 [ACK] Seq=2081 Ack=18352 Win=1805 Len=0 TSval=600549656 TSecr=868252845"
"38","4.788508","100.86.121.59","172.66.164.67","TCP","66","[TCP Window Update] 53635  >  443 [ACK] Seq=2081 Ack=18352 Win=2048 Len=0 TSval=600549656 TSecr=868252845"
"39","4.789398","172.66.164.67","100.86.121.59","TCP","1514","443  >  53635 [ACK] Seq=18352 Ack=2081 Win=18 Len=1448 TSval=868252845 TSecr=600549410 [TCP PDU reassembled in 41]"
"40","4.789401","172.66.164.67","100.86.121.59","TCP","1514","443  >  53635 [ACK] Seq=19800 Ack=2081 Win=18 Len=1448 TSval=868252845 TSecr=600549410 [TCP PDU reassembled in 41]"
"41","4.789403","172.66.164.67","100.86.121.59","TLSv1.2","1514","Application Data"
"42","4.789406","172.66.164.67","100.86.121.59","TLSv1.2","656","Application Data, Application Data"
"43","4.789482","100.86.121.59","172.66.164.67","TCP","66","53635  >  443 [ACK] Seq=2081 Ack=23286 Win=1971 Len=0 TSval=600549657 TSecr=868252845"
"44","4.789533","100.86.121.59","172.66.164.67","TCP","66","[TCP Window Update] 53635  >  443 [ACK] Seq=2081 Ack=23286 Win=2048 Len=0 TSval=600549657 TSecr=868252845"
"45","4.866695","100.86.121.59","172.66.164.67","TLSv1.2","229","Application Data"
"46","4.876653","172.66.164.67","100.86.121.59","TCP","66","443  >  53635 [ACK] Seq=23286 Ack=2244 Win=18 Len=0 TSval=868252935 TSecr=600549734"
"47","4.878262","100.86.121.59","172.66.164.67","TLSv1.2","420","Application Data"
"48","4.878371","100.86.121.59","172.66.164.67","TLSv1.2","241","Application Data"
"49","4.879187","100.86.121.59","172.66.164.67","TLSv1.2","288","Application Data"
"50","4.879401","100.86.121.59","172.66.164.67","TLSv1.2","278","Application Data"
"51","4.879518","100.86.121.59","172.66.164.67","TLSv1.2","216","Application Data"
"52","4.889119","172.66.164.67","100.86.121.59","TCP","66","443  >  53635 [ACK] Seq=23286 Ack=2598 Win=18 Len=0 TSval=868252947 TSecr=600549746"
"53","4.889121","172.66.164.67","100.86.121.59","TCP","66","443  >  53635 [ACK] Seq=23286 Ack=2773 Win=18 Len=0 TSval=868252947 TSecr=600549746"
"54","4.889684","172.66.164.67","100.86.121.59","TCP","66","443  >  53635 [ACK] Seq=23286 Ack=3357 Win=18 Len=0 TSval=868252947 TSecr=600549747"
"55","4.906680","172.66.164.67","100.86.121.59","TLSv1.2","258","Application Data"
"56","4.906681","172.66.164.67","100.86.121.59","TLSv1.2","108","Application Data"
"57","4.906741","100.86.121.59","172.66.164.67","TCP","66","53635  >  443 [ACK] Seq=3357 Ack=23520 Win=2045 Len=0 TSval=600549774 TSecr=868252964"
"58","4.908223","172.66.164.67","100.86.121.59","TLSv1.2","97","Application Data"
"59","4.908289","100.86.121.59","172.66.164.67","TCP","66","53635  >  443 [ACK] Seq=3357 Ack=23551 Win=2048 Len=0 TSval=600549776 TSecr=868252964"
"60","4.913827","172.66.164.67","100.86.121.59","TLSv1.2","127","Application Data"
"61","4.913829","172.66.164.67","100.86.121.59","TLSv1.2","290","Application Data"
"62","4.913831","172.66.164.67","100.86.121.59","TLSv1.2","97","Application Data"
"63","4.913917","100.86.121.59","172.66.164.67","TCP","66","53635  >  443 [ACK] Seq=3357 Ack=23867 Win=2044 Len=0 TSval=600549781 TSecr=868252970"
"64","4.915657","172.66.164.67","100.86.121.59","TLSv1.2","128","Application Data"
"65","4.915658","172.66.164.67","100.86.121.59","TLSv1.2","290","Application Data"
"66","4.915746","100.86.121.59","172.66.164.67","TCP","66","53635  >  443 [ACK] Seq=3357 Ack=24153 Win=2044 Len=0 TSval=600549783 TSecr=868252973"
"67","4.916049","172.66.164.67","100.86.121.59","TLSv1.2","97","Application Data"
"68","4.916051","172.66.164.67","100.86.121.59","TLSv1.2","131","Application Data"
"69","4.916118","100.86.121.59","172.66.164.67","TCP","66","53635  >  443 [ACK] Seq=3357 Ack=24249 Win=2047 Len=0 TSval=600549783 TSecr=868252974"
"70","4.917894","172.66.164.67","100.86.121.59","TLSv1.2","290","Application Data"
"71","4.917895","172.66.164.67","100.86.121.59","TLSv1.2","97","Application Data"
"72","4.917896","172.66.164.67","100.86.121.59","TLSv1.2","210","Application Data"
"73","4.917898","172.66.164.67","100.86.121.59","TLSv1.2","290","Application Data"
"74","4.917899","172.66.164.67","100.86.121.59","TLSv1.2","97","Application Data"
"75","4.918091","100.86.121.59","172.66.164.67","TCP","66","53635  >  443 [ACK] Seq=3357 Ack=24903 Win=2038 Len=0 TSval=600549785 TSecr=868252974"
"76","4.921775","172.66.164.67","100.86.121.59","TLSv1.2","160","Application Data"
"77","4.921777","172.66.164.67","100.86.121.59","TLSv1.2","290","Application Data"
"78","4.921836","100.86.121.59","172.66.164.67","TCP","66","53635  >  443 [ACK] Seq=3357 Ack=25221 Win=2044 Len=0 TSval=600549789 TSecr=868252977"
"79","4.921983","172.66.164.67","100.86.121.59","TLSv1.2","97","Application Data"
"80","4.922016","100.86.121.59","172.66.164.67","TCP","66","53635  >  443 [ACK] Seq=3357 Ack=25252 Win=2048 Len=0 TSval=600549789 TSecr=868252977"
"81","9.920988","100.86.121.59","172.66.164.67","TLSv1.2","195","Application Data"
"82","9.921884","100.86.121.59","172.66.164.67","TLSv1.2","195","Application Data"
"83","9.922093","100.86.121.59","172.66.164.67","TLSv1.2","1341","Application Data"
"84","9.934386","172.66.164.67","100.86.121.59","TCP","66","443  >  53635 [ACK] Seq=25252 Ack=4890 Win=18 Len=0 TSval=868257992 TSecr=600554788"
"85","9.938868","100.86.121.59","172.66.164.67","TLSv1.2","299","Application Data"
"86","9.956621","172.66.164.67","100.86.121.59","TLSv1.2","150","Application Data"
"87","9.956623","172.66.164.67","100.86.121.59","TLSv1.2","290","Application Data"
"88","9.956624","172.66.164.67","100.86.121.59","TLSv1.2","97","Application Data"
"89","9.956625","172.66.164.67","100.86.121.59","TLSv1.2","127","Application Data"
"90","9.956707","172.66.164.67","100.86.121.59","TLSv1.2","290","Application Data"
"91","9.956730","100.86.121.59","172.66.164.67","TCP","66","53635  >  443 [ACK] Seq=5123 Ack=25652 Win=2042 Len=0 TSval=600554824 TSecr=868258015"
"92","9.956772","100.86.121.59","172.66.164.67","TCP","66","53635  >  443 [ACK] Seq=5123 Ack=25876 Win=2039 Len=0 TSval=600554824 TSecr=868258015"
"93","9.956836","172.66.164.67","100.86.121.59","TLSv1.2","97","Application Data"
"94","9.956862","100.86.121.59","172.66.164.67","TCP","66","53635  >  443 [ACK] Seq=5123 Ack=25907 Win=2048 Len=0 TSval=600554824 TSecr=868258015"
"95","9.957650","100.86.121.59","172.66.164.67","TLSv1.2","101","Application Data"
"96","9.958520","172.66.164.67","100.86.121.59","TLSv1.2","127","Application Data"
"97","9.958521","172.66.164.67","100.86.121.59","TLSv1.2","290","Application Data"
"98","9.958555","100.86.121.59","172.66.164.67","TCP","66","53635  >  443 [ACK] Seq=5158 Ack=26192 Win=2044 Len=0 TSval=600554826 TSecr=868258016"
"99","9.958926","172.66.164.67","100.86.121.59","TLSv1.2","97","Application Data"
"100","9.958956","100.86.121.59","172.66.164.67","TCP","66","53635  >  443 [ACK] Seq=5158 Ack=26223 Win=2048 Len=0 TSval=600554826 TSecr=868258017"
"101","9.971047","172.66.164.67","100.86.121.59","TLSv1.2","127","Application Data"
"102","9.971048","172.66.164.67","100.86.121.59","TLSv1.2","290","Application Data"
"103","9.971139","172.66.164.67","100.86.121.59","TLSv1.2","97","Application Data"
"104","9.971147","100.86.121.59","172.66.164.67","TCP","66","53635  >  443 [ACK] Seq=5158 Ack=26508 Win=2044 Len=0 TSval=600554838 TSecr=868258029"
"105","9.971186","100.86.121.59","172.66.164.67","TCP","66","53635  >  443 [ACK] Seq=5158 Ack=26539 Win=2044 Len=0 TSval=600554839 TSecr=868258029"
"106","10.217046","100.86.121.59","172.66.164.67","TLSv1.2","312","Application Data"
"107","10.267300","172.66.164.67","100.86.121.59","TCP","66","443  >  53635 [ACK] Seq=26539 Ack=5404 Win=18 Len=0 TSval=868258326 TSecr=600555084"
"108","10.301801","172.66.164.67","100.86.121.59","TLSv1.2","167","Application Data"
"109","10.301915","100.86.121.59","172.66.164.67","TCP","66","53635  >  443 [ACK] Seq=5404 Ack=26640 Win=2047 Len=0 TSval=600555169 TSecr=868258360"
"110","10.302383","172.66.164.67","100.86.121.59","TCP","1514","443  >  53635 [ACK] Seq=26640 Ack=5404 Win=18 Len=1448 TSval=868258360 TSecr=600555084 [TCP PDU reassembled in 123]"
"111","10.302385","172.66.164.67","100.86.121.59","TCP","1514","443  >  53635 [ACK] Seq=28088 Ack=5404 Win=18 Len=1448 TSval=868258360 TSecr=600555084 [TCP PDU reassembled in 123]"
"112","10.302457","100.86.121.59","172.66.164.67","TCP","66","53635  >  443 [ACK] Seq=5404 Ack=29536 Win=2003 Len=0 TSval=600555170 TSecr=868258360"
"113","10.302612","100.86.121.59","172.66.164.67","TCP","66","[TCP Window Update] 53635  >  443 [ACK] Seq=5404 Ack=29536 Win=2048 Len=0 TSval=600555170 TSecr=868258360"
"114","10.304131","172.66.164.67","100.86.121.59","TCP","1514","443  >  53635 [ACK] Seq=29536 Ack=5404 Win=18 Len=1448 TSval=868258360 TSecr=600555084 [TCP PDU reassembled in 123]"
"115","10.304133","172.66.164.67","100.86.121.59","TCP","1514","443  >  53635 [ACK] Seq=30984 Ack=5404 Win=18 Len=1448 TSval=868258360 TSecr=600555084 [TCP PDU reassembled in 123]"
"116","10.304135","172.66.164.67","100.86.121.59","TCP","1514","443  >  53635 [ACK] Seq=32432 Ack=5404 Win=18 Len=1448 TSval=868258360 TSecr=600555084 [TCP PDU reassembled in 123]"
"117","10.304136","172.66.164.67","100.86.121.59","TCP","1514","443  >  53635 [ACK] Seq=33880 Ack=5404 Win=18 Len=1448 TSval=868258360 TSecr=600555084 [TCP PDU reassembled in 123]"
"118","10.304138","172.66.164.67","100.86.121.59","TCP","1514","443  >  53635 [ACK] Seq=35328 Ack=5404 Win=18 Len=1448 TSval=868258360 TSecr=600555084 [TCP PDU reassembled in 123]"
"119","10.304139","172.66.164.67","100.86.121.59","TCP","1514","443  >  53635 [ACK] Seq=36776 Ack=5404 Win=18 Len=1448 TSval=868258360 TSecr=600555084 [TCP PDU reassembled in 123]"
"120","10.304141","172.66.164.67","100.86.121.59","TCP","1514","443  >  53635 [ACK] Seq=38224 Ack=5404 Win=18 Len=1448 TSval=868258360 TSecr=600555084 [TCP PDU reassembled in 123]"
"121","10.304142","172.66.164.67","100.86.121.59","TCP","1514","443  >  53635 [PSH, ACK] Seq=39672 Ack=5404 Win=18 Len=1448 TSval=868258360 TSecr=600555084 [TCP PDU reassembled in 123]"
"122","10.304144","172.66.164.67","100.86.121.59","TCP","1514","443  >  53635 [ACK] Seq=41120 Ack=5404 Win=18 Len=1448 TSval=868258361 TSecr=600555084 [TCP PDU reassembled in 123]"
"123","10.304145","172.66.164.67","100.86.121.59","TLSv1.2","1514","Application Data"
"124","10.304147","172.66.164.67","100.86.121.59","TCP","1514","443  >  53635 [ACK] Seq=44016 Ack=5404 Win=18 Len=1448 TSval=868258361 TSecr=600555084 [TCP PDU reassembled in 132]"
"125","10.304148","172.66.164.67","100.86.121.59","TCP","1514","443  >  53635 [ACK] Seq=45464 Ack=5404 Win=18 Len=1448 TSval=868258361 TSecr=600555084 [TCP PDU reassembled in 132]"
"126","10.304197","100.86.121.59","172.66.164.67","TCP","66","53635  >  443 [ACK] Seq=5404 Ack=45464 Win=1800 Len=0 TSval=600555172 TSecr=868258361"
"127","10.304213","100.86.121.59","172.66.164.67","TCP","66","53635  >  443 [ACK] Seq=5404 Ack=46912 Win=1778 Len=0 TSval=600555172 TSecr=868258361"
"128","10.304352","100.86.121.59","172.66.164.67","TCP","66","[TCP Window Update] 53635  >  443 [ACK] Seq=5404 Ack=46912 Win=2048 Len=0 TSval=600555172 TSecr=868258361"
"129","10.305234","172.66.164.67","100.86.121.59","TCP","1514","443  >  53635 [ACK] Seq=46912 Ack=5404 Win=18 Len=1448 TSval=868258361 TSecr=600555084 [TCP PDU reassembled in 132]"
"130","10.305235","172.66.164.67","100.86.121.59","TCP","1514","443  >  53635 [ACK] Seq=48360 Ack=5404 Win=18 Len=1448 TSval=868258361 TSecr=600555084 [TCP PDU reassembled in 132]"
"131","10.305237","172.66.164.67","100.86.121.59","TCP","1514","443  >  53635 [ACK] Seq=49808 Ack=5404 Win=18 Len=1448 TSval=868258361 TSecr=600555084 [TCP PDU reassembled in 132]"
"132","10.305238","172.66.164.67","100.86.121.59","TLSv1.2","733","Application Data, Application Data"
"133","10.305261","100.86.121.59","172.66.164.67","TCP","66","53635  >  443 [ACK] Seq=5404 Ack=51923 Win=1970 Len=0 TSval=600555173 TSecr=868258361"
"134","10.305300","100.86.121.59","172.66.164.67","TCP","66","[TCP Window Update] 53635  >  443 [ACK] Seq=5404 Ack=51923 Win=2048 Len=0 TSval=600555173 TSecr=868258361"
"135","10.356789","100.86.121.59","172.66.164.67","TLSv1.2","195","Application Data"
"136","10.367509","172.66.164.67","100.86.121.59","TCP","66","443  >  53635 [ACK] Seq=51923 Ack=5533 Win=18 Len=0 TSval=868258425 TSecr=600555224"
"137","10.370244","100.86.121.59","172.66.164.67","TLSv1.2","226","Application Data"
"138","10.370412","100.86.121.59","172.66.164.67","TLSv1.2","316","Application Data"
"139","10.380524","172.66.164.67","100.86.121.59","TCP","66","443  >  53635 [ACK] Seq=51923 Ack=5693 Win=18 Len=0 TSval=868258438 TSecr=600555238"
"140","10.380525","172.66.164.67","100.86.121.59","TCP","66","443  >  53635 [ACK] Seq=51923 Ack=5943 Win=18 Len=0 TSval=868258439 TSecr=600555238"
"141","10.389684","172.66.164.67","100.86.121.59","TLSv1.2","128","Application Data"
"142","10.389686","172.66.164.67","100.86.121.59","TLSv1.2","108","Application Data"
"143","10.389768","100.86.121.59","172.66.164.67","TCP","66","53635  >  443 [ACK] Seq=5943 Ack=52027 Win=2047 Len=0 TSval=600555257 TSecr=868258447"
"144","10.389953","172.66.164.67","100.86.121.59","TLSv1.2","97","Application Data"
"145","10.389995","100.86.121.59","172.66.164.67","TCP","66","53635  >  443 [ACK] Seq=5943 Ack=52058 Win=2047 Len=0 TSval=600555257 TSecr=868258447"
"146","10.390717","100.86.121.59","172.66.164.67","TCP","1454","53635  >  443 [ACK] Seq=5943 Ack=52058 Win=2048 Len=1388 TSval=600555258 TSecr=868258447 [TCP PDU reassembled in 147]"
"147","10.390723","100.86.121.59","172.66.164.67","TLSv1.2","187","Application Data"
"148","10.391343","100.86.121.59","172.66.164.67","TLSv1.2","215","Application Data"
"149","10.391469","100.86.121.59","172.66.164.67","TLSv1.2","199","Application Data"
"150","10.392049","100.86.121.59","172.66.164.67","TLSv1.2","198","Application Data"
"151","10.392126","100.86.121.59","172.66.164.67","TLSv1.2","196","Application Data"
"152","10.400580","172.66.164.67","100.86.121.59","TCP","66","443  >  53635 [ACK] Seq=52058 Ack=7452 Win=18 Len=0 TSval=868258459 TSecr=600555258"
"153","10.401925","172.66.164.67","100.86.121.59","TLSv1.2","162","Application Data"
"154","10.401988","100.86.121.59","172.66.164.67","TCP","66","53635  >  443 [ACK] Seq=7996 Ack=52154 Win=2047 Len=0 TSval=600555269 TSecr=868258460"
"155","10.402348","172.66.164.67","100.86.121.59","TLSv1.2","145","Application Data"
"156","10.402395","100.86.121.59","172.66.164.67","TCP","66","53635  >  443 [ACK] Seq=7996 Ack=52233 Win=2047 Len=0 TSval=600555270 TSecr=868258460"
"157","10.403832","172.66.164.67","100.86.121.59","TCP","66","443  >  53635 [ACK] Seq=52233 Ack=7734 Win=18 Len=0 TSval=868258462 TSecr=600555259"
"158","10.404435","172.66.164.67","100.86.121.59","TCP","66","443  >  53635 [ACK] Seq=52233 Ack=7996 Win=18 Len=0 TSval=868258462 TSecr=600555259"
"159","10.422157","172.66.164.67","100.86.121.59","TLSv1.2","127","Application Data"
"160","10.422159","172.66.164.67","100.86.121.59","TLSv1.2","290","Application Data"
"161","10.422247","172.66.164.67","100.86.121.59","TLSv1.2","97","Application Data"
"162","10.422259","100.86.121.59","172.66.164.67","TCP","66","53635  >  443 [ACK] Seq=7996 Ack=52518 Win=2048 Len=0 TSval=600555290 TSecr=868258480"
"163","10.422329","100.86.121.59","172.66.164.67","TCP","66","53635  >  443 [ACK] Seq=7996 Ack=52549 Win=2048 Len=0 TSval=600555290 TSecr=868258480"
"164","10.423521","172.66.164.67","100.86.121.59","TLSv1.2","127","Application Data"
"165","10.423522","172.66.164.67","100.86.121.59","TLSv1.2","290","Application Data"
"166","10.423576","100.86.121.59","172.66.164.67","TCP","66","53635  >  443 [ACK] Seq=7996 Ack=52834 Win=2048 Len=0 TSval=600555291 TSecr=868258482"
"167","10.423595","172.66.164.67","100.86.121.59","TLSv1.2","97","Application Data"
"168","10.423651","100.86.121.59","172.66.164.67","TCP","66","53635  >  443 [ACK] Seq=7996 Ack=52865 Win=2048 Len=0 TSval=600555291 TSecr=868258482"
"169","10.424809","172.66.164.67","100.86.121.59","TLSv1.2","127","Application Data"
"170","10.424811","172.66.164.67","100.86.121.59","TLSv1.2","290","Application Data"
"171","10.424873","100.86.121.59","172.66.164.67","TCP","66","53635  >  443 [ACK] Seq=7996 Ack=53150 Win=2048 Len=0 TSval=600555292 TSecr=868258483"
"172","10.425116","172.66.164.67","100.86.121.59","TLSv1.2","97","Application Data"
"173","10.425160","100.86.121.59","172.66.164.67","TCP","66","53635  >  443 [ACK] Seq=7996 Ack=53181 Win=2048 Len=0 TSval=600555292 TSecr=868258483"
"174","10.426246","172.66.164.67","100.86.121.59","TLSv1.2","127","Application Data"
"175","10.426247","172.66.164.67","100.86.121.59","TLSv1.2","290","Application Data"
"176","10.426304","100.86.121.59","172.66.164.67","TCP","66","53635  >  443 [ACK] Seq=7996 Ack=53466 Win=2048 Len=0 TSval=600555294 TSecr=868258484"
"177","10.426307","172.66.164.67","100.86.121.59","TLSv1.2","97","Application Data"
"178","10.426348","100.86.121.59","172.66.164.67","TCP","66","53635  >  443 [ACK] Seq=7996 Ack=53497 Win=2048 Len=0 TSval=600555294 TSecr=868258484"
"179","10.426536","172.66.164.67","100.86.121.59","TLSv1.2","127","Application Data"
"180","10.426538","172.66.164.67","100.86.121.59","TLSv1.2","290","Application Data"
"181","10.426539","172.66.164.67","100.86.121.59","TLSv1.2","97","Application Data"
"182","10.426591","100.86.121.59","172.66.164.67","TCP","66","53635  >  443 [ACK] Seq=7996 Ack=53813 Win=2048 Len=0 TSval=600555294 TSecr=868258484"
"183","10.495844","100.86.121.59","172.66.164.67","TLSv1.2","306","Application Data"
"184","10.495982","100.86.121.59","172.66.164.67","TCP","1454","53635  >  443 [ACK] Seq=8236 Ack=53813 Win=2048 Len=1388 TSval=600555363 TSecr=868258484 [TCP PDU reassembled in 195]"
"185","10.495984","100.86.121.59","172.66.164.67","TCP","1454","53635  >  443 [ACK] Seq=9624 Ack=53813 Win=2048 Len=1388 TSval=600555363 TSecr=868258484 [TCP PDU reassembled in 195]"
"186","10.495985","100.86.121.59","172.66.164.67","TCP","1454","53635  >  443 [ACK] Seq=11012 Ack=53813 Win=2048 Len=1388 TSval=600555363 TSecr=868258484 [TCP PDU reassembled in 195]"
"187","10.495986","100.86.121.59","172.66.164.67","TCP","1454","53635  >  443 [ACK] Seq=12400 Ack=53813 Win=2048 Len=1388 TSval=600555363 TSecr=868258484 [TCP PDU reassembled in 195]"
"188","10.495987","100.86.121.59","172.66.164.67","TCP","1454","53635  >  443 [ACK] Seq=13788 Ack=53813 Win=2048 Len=1388 TSval=600555363 TSecr=868258484 [TCP PDU reassembled in 195]"
"189","10.495988","100.86.121.59","172.66.164.67","TCP","1454","53635  >  443 [ACK] Seq=15176 Ack=53813 Win=2048 Len=1388 TSval=600555363 TSecr=868258484 [TCP PDU reassembled in 195]"
"190","10.495988","100.86.121.59","172.66.164.67","TCP","1454","53635  >  443 [ACK] Seq=16564 Ack=53813 Win=2048 Len=1388 TSval=600555363 TSecr=868258484 [TCP PDU reassembled in 195]"
"191","10.495989","100.86.121.59","172.66.164.67","TCP","1454","53635  >  443 [ACK] Seq=17952 Ack=53813 Win=2048 Len=1388 TSval=600555363 TSecr=868258484 [TCP PDU reassembled in 195]"
"192","10.495990","100.86.121.59","172.66.164.67","TCP","1454","53635  >  443 [ACK] Seq=19340 Ack=53813 Win=2048 Len=1388 TSval=600555363 TSecr=868258484 [TCP PDU reassembled in 195]"
"193","10.495991","100.86.121.59","172.66.164.67","TCP","1454","53635  >  443 [ACK] Seq=20728 Ack=53813 Win=2048 Len=1388 TSval=600555363 TSecr=868258484 [TCP PDU reassembled in 195]"
"194","10.495991","100.86.121.59","172.66.164.67","TCP","1454","53635  >  443 [ACK] Seq=22116 Ack=53813 Win=2048 Len=1388 TSval=600555363 TSecr=868258484 [TCP PDU reassembled in 195]"
"195","10.496017","100.86.121.59","172.66.164.67","TLSv1.2","1204","Application Data"
"196","10.496045","100.86.121.59","172.66.164.67","TLSv1.2","960","Application Data"
"197","10.496592","100.86.121.59","172.66.164.67","TLSv1.2","180","Application Data"
"198","10.507929","172.66.164.67","100.86.121.59","TCP","66","443  >  53635 [ACK] Seq=53813 Ack=15176 Win=18 Len=0 TSval=868258566 TSecr=600555363"
"199","10.507931","172.66.164.67","100.86.121.59","TCP","66","443  >  53635 [ACK] Seq=53813 Ack=25650 Win=18 Len=0 TSval=868258566 TSecr=600555363"
"200","10.511959","172.66.164.67","100.86.121.59","TLSv1.2","224","Application Data"
"201","10.512095","100.86.121.59","172.66.164.67","TCP","66","53635  >  443 [ACK] Seq=25650 Ack=53971 Win=2048 Len=0 TSval=600555379 TSecr=868258570"
"202","10.515819","172.66.164.67","100.86.121.59","TLSv1.2","671","Application Data"
"203","10.515886","100.86.121.59","172.66.164.67","TCP","66","53635  >  443 [ACK] Seq=25650 Ack=54576 Win=2048 Len=0 TSval=600555383 TSecr=868258574"
"204","10.710605","100.86.121.59","172.66.164.67","TLSv1.2","737","Application Data"
"205","10.760479","172.66.164.67","100.86.121.59","TCP","66","443  >  53635 [ACK] Seq=54576 Ack=26321 Win=18 Len=0 TSval=868258819 TSecr=600555578"
"206","10.943016","172.66.164.67","100.86.121.59","TLSv1.2","306","Application Data"
"207","10.943018","172.66.164.67","100.86.121.59","TCP","1514","443  >  53635 [ACK] Seq=54816 Ack=26321 Win=18 Len=1448 TSval=868259001 TSecr=600555578 [TCP PDU reassembled in 209]"
"208","10.943157","100.86.121.59","172.66.164.67","TCP","66","53635  >  443 [ACK] Seq=26321 Ack=56264 Win=2022 Len=0 TSval=600555810 TSecr=868259001"
"209","10.943557","172.66.164.67","100.86.121.59","TLSv1.2","928","Application Data"
"210","10.943559","172.66.164.67","100.86.121.59","TLSv1.2","97","Application Data"
"211","10.943627","100.86.121.59","172.66.164.67","TCP","66","53635  >  443 [ACK] Seq=26321 Ack=57157 Win=2035 Len=0 TSval=600555811 TSecr=868259001"
"212","15.505400","100.86.121.59","172.66.164.67","TLSv1.2","1375","Application Data"
"213","15.505838","100.86.121.59","172.66.164.67","TLSv1.2","220","Application Data"
"214","15.506165","100.86.121.59","172.66.164.67","TLSv1.2","197","Application Data"
"215","15.516527","172.66.164.67","100.86.121.59","TCP","66","443  >  53635 [ACK] Seq=57157 Ack=27630 Win=18 Len=0 TSval=868263573 TSecr=600560373"
"216","15.516530","172.66.164.67","100.86.121.59","TCP","66","443  >  53635 [ACK] Seq=57157 Ack=27915 Win=18 Len=0 TSval=868263574 TSecr=600560373"
"217","15.538309","172.66.164.67","100.86.121.59","TLSv1.2","150","Application Data"
"218","15.538314","172.66.164.67","100.86.121.59","TLSv1.2","290","Application Data"
"219","15.538505","100.86.121.59","172.66.164.67","TCP","66","53635  >  443 [ACK] Seq=27915 Ack=57465 Win=2044 Len=0 TSval=600560406 TSecr=868263596"
"220","15.538696","172.66.164.67","100.86.121.59","TLSv1.2","97","Application Data"
"221","15.538790","100.86.121.59","172.66.164.67","TCP","66","53635  >  443 [ACK] Seq=27915 Ack=57496 Win=2048 Len=0 TSval=600560406 TSecr=868263596"
"222","15.540093","100.86.121.59","172.66.164.67","TLSv1.2","101","Application Data"
"223","15.541329","172.66.164.67","100.86.121.59","TLSv1.2","208","Application Data"
"224","15.541332","172.66.164.67","100.86.121.59","TLSv1.2","290","Application Data"
"225","15.541477","100.86.121.59","172.66.164.67","TCP","66","53635  >  443 [ACK] Seq=27950 Ack=57862 Win=2043 Len=0 TSval=600560409 TSecr=868263599"
"226","15.541620","172.66.164.67","100.86.121.59","TLSv1.2","97","Application Data"
"227","15.541708","100.86.121.59","172.66.164.67","TCP","66","53635  >  443 [ACK] Seq=27950 Ack=57893 Win=2048 Len=0 TSval=600560409 TSecr=868263599"
"228","15.542421","172.66.164.67","100.86.121.59","TLSv1.2","127","Application Data"
"229","15.542423","172.66.164.67","100.86.121.59","TLSv1.2","290","Application Data"
"230","15.542500","100.86.121.59","172.66.164.67","TCP","66","53635  >  443 [ACK] Seq=27950 Ack=58178 Win=2044 Len=0 TSval=600560410 TSecr=868263600"
"231","15.543017","172.66.164.67","100.86.121.59","TLSv1.2","97","Application Data"
"232","15.543107","100.86.121.59","172.66.164.67","TCP","66","53635  >  443 [ACK] Seq=27950 Ack=58209 Win=2048 Len=0 TSval=600560410 TSecr=868263601"
"233","15.591836","172.66.164.67","100.86.121.59","TCP","66","443  >  53635 [ACK] Seq=58209 Ack=27950 Win=18 Len=0 TSval=868263650 TSecr=600560407"
"234","20.503398","100.86.121.59","172.66.164.67","TLSv1.2","195","Application Data"
"235","20.503803","100.86.121.59","172.66.164.67","TLSv1.2","199","Application Data"
"236","20.516664","172.66.164.67","100.86.121.59","TCP","66","443  >  53635 [ACK] Seq=58209 Ack=28212 Win=18 Len=0 TSval=868268575 TSecr=600565371"
"237","20.538236","172.66.164.67","100.86.121.59","TLSv1.2","150","Application Data"
"238","20.538242","172.66.164.67","100.86.121.59","TLSv1.2","290","Application Data"
"239","20.538396","100.86.121.59","172.66.164.67","TCP","66","53635  >  443 [ACK] Seq=28212 Ack=58517 Win=2044 Len=0 TSval=600565406 TSecr=868268596"
"240","20.538633","172.66.164.67","100.86.121.59","TLSv1.2","97","Application Data"
"241","20.538719","100.86.121.59","172.66.164.67","TCP","66","53635  >  443 [ACK] Seq=28212 Ack=58548 Win=2048 Len=0 TSval=600565406 TSecr=868268596"
"242","20.539504","172.66.164.67","100.86.121.59","TLSv1.2","130","Application Data"
"243","20.539507","172.66.164.67","100.86.121.59","TLSv1.2","290","Application Data"
"244","20.539585","100.86.121.59","172.66.164.67","TCP","66","53635  >  443 [ACK] Seq=28212 Ack=58836 Win=2044 Len=0 TSval=600565407 TSecr=868268597"
"245","20.539854","172.66.164.67","100.86.121.59","TLSv1.2","97","Application Data"
"246","20.539921","100.86.121.59","172.66.164.67","TCP","66","53635  >  443 [ACK] Seq=28212 Ack=58867 Win=2044 Len=0 TSval=600565407 TSecr=868268597"
"247","20.540783","100.86.121.59","172.66.164.67","TLSv1.2","101","Application Data"
"248","20.591961","172.66.164.67","100.86.121.59","TCP","66","443  >  53635 [ACK] Seq=58867 Ack=28247 Win=18 Len=0 TSval=868268650 TSecr=600565408"
"249","21.519684","100.86.121.59","172.66.164.67","TLSv1.2","321","Application Data"
"250","21.529563","172.66.164.67","100.86.121.59","TCP","66","443  >  53635 [ACK] Seq=58867 Ack=28502 Win=18 Len=0 TSval=868269588 TSecr=600566387"
"251","23.195704","172.66.164.67","100.86.121.59","TLSv1.2","273","Application Data"
"252","23.195708","172.66.164.67","100.86.121.59","TCP","1514","443  >  53635 [ACK] Seq=59074 Ack=28502 Win=18 Len=1448 TSval=868271183 TSecr=600566387 [TCP PDU reassembled in 263]"
"253","23.195712","172.66.164.67","100.86.121.59","TCP","1514","443  >  53635 [ACK] Seq=60522 Ack=28502 Win=18 Len=1448 TSval=868271183 TSecr=600566387 [TCP PDU reassembled in 263]"
"254","23.195715","172.66.164.67","100.86.121.59","TCP","1514","443  >  53635 [ACK] Seq=61970 Ack=28502 Win=18 Len=1448 TSval=868271183 TSecr=600566387 [TCP PDU reassembled in 263]"
"255","23.195718","172.66.164.67","100.86.121.59","TCP","1514","443  >  53635 [ACK] Seq=63418 Ack=28502 Win=18 Len=1448 TSval=868271183 TSecr=600566387 [TCP PDU reassembled in 263]"
"256","23.195721","172.66.164.67","100.86.121.59","TCP","1514","443  >  53635 [ACK] Seq=64866 Ack=28502 Win=18 Len=1448 TSval=868271183 TSecr=600566387 [TCP PDU reassembled in 263]"
"257","23.195727","172.66.164.67","100.86.121.59","TCP","1514","443  >  53635 [ACK] Seq=66314 Ack=28502 Win=18 Len=1448 TSval=868271183 TSecr=600566387 [TCP PDU reassembled in 263]"
"258","23.195731","172.66.164.67","100.86.121.59","TCP","1514","443  >  53635 [ACK] Seq=67762 Ack=28502 Win=18 Len=1448 TSval=868271183 TSecr=600566387 [TCP PDU reassembled in 263]"
"259","23.195804","172.66.164.67","100.86.121.59","TCP","1514","443  >  53635 [ACK] Seq=69210 Ack=28502 Win=18 Len=1448 TSval=868271183 TSecr=600566387 [TCP PDU reassembled in 263]"
"260","23.195807","172.66.164.67","100.86.121.59","TCP","1514","443  >  53635 [ACK] Seq=70658 Ack=28502 Win=18 Len=1448 TSval=868271183 TSecr=600566387 [TCP PDU reassembled in 263]"
"261","23.195810","172.66.164.67","100.86.121.59","TCP","1514","443  >  53635 [PSH, ACK] Seq=72106 Ack=28502 Win=18 Len=1448 TSval=868271183 TSecr=600566387 [TCP PDU reassembled in 263]"
"262","23.195813","172.66.164.67","100.86.121.59","TCP","1514","443  >  53635 [ACK] Seq=73554 Ack=28502 Win=18 Len=1448 TSval=868271184 TSecr=600566387 [TCP PDU reassembled in 263]"
"263","23.195816","172.66.164.67","100.86.121.59","TLSv1.2","1514","Application Data"
"264","23.195820","172.66.164.67","100.86.121.59","TCP","1514","443  >  53635 [ACK] Seq=76450 Ack=28502 Win=18 Len=1448 TSval=868271184 TSecr=600566387 [TCP PDU reassembled in 272]"
"265","23.195967","100.86.121.59","172.66.164.67","TCP","66","53635  >  443 [ACK] Seq=28502 Ack=69210 Win=1887 Len=0 TSval=600568063 TSecr=868271183"
"266","23.196060","100.86.121.59","172.66.164.67","TCP","66","53635  >  443 [ACK] Seq=28502 Ack=77898 Win=1752 Len=0 TSval=600568063 TSecr=868271184"
"267","23.196697","100.86.121.59","172.66.164.67","TCP","66","[TCP Window Update] 53635  >  443 [ACK] Seq=28502 Ack=77898 Win=2048 Len=0 TSval=600568064 TSecr=868271184"
"268","23.197391","172.66.164.67","100.86.121.59","TCP","1514","443  >  53635 [ACK] Seq=77898 Ack=28502 Win=18 Len=1448 TSval=868271184 TSecr=600566387 [TCP PDU reassembled in 272]"
"269","23.197394","172.66.164.67","100.86.121.59","TCP","1514","443  >  53635 [ACK] Seq=79346 Ack=28502 Win=18 Len=1448 TSval=868271184 TSecr=600566387 [TCP PDU reassembled in 272]"
"270","23.197397","172.66.164.67","100.86.121.59","TCP","1514","443  >  53635 [ACK] Seq=80794 Ack=28502 Win=18 Len=1448 TSval=868271184 TSecr=600566387 [TCP PDU reassembled in 272]"
"271","23.197401","172.66.164.67","100.86.121.59","TCP","1514","443  >  53635 [ACK] Seq=82242 Ack=28502 Win=18 Len=1448 TSval=868271184 TSecr=600566387 [TCP PDU reassembled in 272]"
"272","23.197403","172.66.164.67","100.86.121.59","TLSv1.2","1140","Application Data"
"273","23.197407","172.66.164.67","100.86.121.59","TLSv1.2","97","Application Data"
"274","23.197409","172.66.164.67","100.86.121.59","TCP","97","[TCP Retransmission] 443  >  53635 [PSH, ACK] Seq=84764 Ack=28502 Win=18 Len=31 TSval=868271209 TSecr=600566387"
"275","23.197499","100.86.121.59","172.66.164.67","TCP","66","53635  >  443 [ACK] Seq=28502 Ack=84795 Win=1941 Len=0 TSval=600568065 TSecr=868271185"
"276","23.197549","100.86.121.59","172.66.164.67","TCP","78","[TCP Dup ACK 275#1] 53635  >  443 [ACK] Seq=28502 Ack=84795 Win=1941 Len=0 TSval=600568065 TSecr=868271209 SLE=84764 SRE=84795"
"277","23.197609","100.86.121.59","172.66.164.67","TCP","66","[TCP Window Update] 53635  >  443 [ACK] Seq=28502 Ack=84795 Win=2048 Len=0 TSval=600568065 TSecr=868271209"
"278","23.244326","100.86.121.59","172.66.164.67","TLSv1.2","706","Application Data"
"279","23.255498","172.66.164.67","100.86.121.59","TCP","66","443  >  53635 [ACK] Seq=84795 Ack=29142 Win=18 Len=0 TSval=868271313 TSecr=600568112"
"280","23.268335","100.86.121.59","172.66.164.67","TLSv1.2","1332","Application Data"
"281","23.268965","100.86.121.59","172.66.164.67","TLSv1.2","209","Application Data"
"282","23.269274","100.86.121.59","172.66.164.67","TLSv1.2","201","Application Data"
"283","23.269389","100.86.121.59","172.66.164.67","TLSv1.2","199","Application Data"
"284","23.269471","100.86.121.59","172.66.164.67","TLSv1.2","197","Application Data"
"285","23.276401","172.66.164.67","100.86.121.59","TLSv1.2","177","Application Data"
"286","23.276403","172.66.164.67","100.86.121.59","TLSv1.2","108","Application Data"
"287","23.276491","100.86.121.59","172.66.164.67","TCP","66","53635  >  443 [ACK] Seq=30950 Ack=84948 Win=2046 Len=0 TSval=600568144 TSecr=868271334"
"288","23.276660","172.66.164.67","100.86.121.59","TLSv1.2","97","Application Data"
"289","23.276719","100.86.121.59","172.66.164.67","TCP","66","53635  >  443 [ACK] Seq=30950 Ack=84979 Win=2048 Len=0 TSval=600568144 TSecr=868271334"
"290","23.279923","172.66.164.67","100.86.121.59","TCP","66","443  >  53635 [ACK] Seq=84979 Ack=30551 Win=18 Len=0 TSval=868271338 TSecr=600568136"
"291","23.281652","172.66.164.67","100.86.121.59","TCP","66","443  >  53635 [ACK] Seq=84979 Ack=30950 Win=18 Len=0 TSval=868271340 TSecr=600568137"
"292","23.305786","172.66.164.67","100.86.121.59","TLSv1.2","160","Application Data"
"293","23.305789","172.66.164.67","100.86.121.59","TLSv1.2","290","Application Data"
"294","23.305874","100.86.121.59","172.66.164.67","TCP","66","53635  >  443 [ACK] Seq=30950 Ack=85297 Win=2044 Len=0 TSval=600568173 TSecr=868271364"
"295","23.306077","172.66.164.67","100.86.121.59","TLSv1.2","97","Application Data"
"296","23.306138","100.86.121.59","172.66.164.67","TCP","66","53635  >  443 [ACK] Seq=30950 Ack=85328 Win=2048 Len=0 TSval=600568173 TSecr=868271364"
"297","23.306549","172.66.164.67","100.86.121.59","TLSv1.2","127","Application Data"
"298","23.306550","172.66.164.67","100.86.121.59","TLSv1.2","290","Application Data"
"299","23.306551","172.66.164.67","100.86.121.59","TLSv1.2","97","Application Data"
"300","23.306581","100.86.121.59","172.66.164.67","TCP","66","53635  >  443 [ACK] Seq=30950 Ack=85644 Win=2044 Len=0 TSval=600568174 TSecr=868271364"
"301","23.307799","172.66.164.67","100.86.121.59","TLSv1.2","208","Application Data"
"302","23.307800","172.66.164.67","100.86.121.59","TLSv1.2","290","Application Data"
"303","23.307821","100.86.121.59","172.66.164.67","TCP","66","53635  >  443 [ACK] Seq=30950 Ack=86010 Win=2043 Len=0 TSval=600568175 TSecr=868271366"
"304","23.308005","172.66.164.67","100.86.121.59","TLSv1.2","97","Application Data"
"305","23.308006","172.66.164.67","100.86.121.59","TLSv1.2","127","Application Data"
"306","23.308007","172.66.164.67","100.86.121.59","TLSv1.2","290","Application Data"
"307","23.308051","100.86.121.59","172.66.164.67","TCP","66","53635  >  443 [ACK] Seq=30950 Ack=86326 Win=2044 Len=0 TSval=600568175 TSecr=868271366"
"308","23.308522","172.66.164.67","100.86.121.59","TLSv1.2","97","Application Data"
"309","23.308539","100.86.121.59","172.66.164.67","TCP","66","53635  >  443 [ACK] Seq=30950 Ack=86357 Win=2048 Len=0 TSval=600568176 TSecr=868271366"
"310","23.309480","172.66.164.67","100.86.121.59","TLSv1.2","127","Application Data"
"311","23.309481","172.66.164.67","100.86.121.59","TLSv1.2","290","Application Data"
"312","23.309501","100.86.121.59","172.66.164.67","TCP","66","53635  >  443 [ACK] Seq=30950 Ack=86642 Win=2044 Len=0 TSval=600568177 TSecr=868271367"
"313","23.310295","172.66.164.67","100.86.121.59","TLSv1.2","97","Application Data"
"314","23.310334","100.86.121.59","172.66.164.67","TCP","66","53635  >  443 [ACK] Seq=30950 Ack=86673 Win=2048 Len=0 TSval=600568178 TSecr=868271367"
"315","28.320041","100.86.121.59","172.66.164.67","TLSv1.2","196","Application Data"
"316","28.320326","100.86.121.59","172.66.164.67","TLSv1.2","199","Application Data"
"317","28.332010","172.66.164.67","100.86.121.59","TCP","66","443  >  53635 [ACK] Seq=86673 Ack=31213 Win=18 Len=0 TSval=868276389 TSecr=600573187"
"318","28.352913","172.66.164.67","100.86.121.59","TLSv1.2","150","Application Data"
"319","28.352916","172.66.164.67","100.86.121.59","TLSv1.2","290","Application Data"
"320","28.353098","100.86.121.59","172.66.164.67","TCP","66","53635  >  443 [ACK] Seq=31213 Ack=86981 Win=2044 Len=0 TSval=600573220 TSecr=868276410"
"321","28.353923","172.66.164.67","100.86.121.59","TLSv1.2","97","Application Data"
"322","28.353924","172.66.164.67","100.86.121.59","TLSv1.2","127","Application Data"
"323","28.353925","172.66.164.67","100.86.121.59","TLSv1.2","290","Application Data"
"324","28.354014","100.86.121.59","172.66.164.67","TCP","66","53635  >  443 [ACK] Seq=31213 Ack=87297 Win=2044 Len=0 TSval=600573221 TSecr=868276411"
"325","28.354145","172.66.164.67","100.86.121.59","TLSv1.2","97","Application Data"
"326","28.354192","100.86.121.59","172.66.164.67","TCP","66","53635  >  443 [ACK] Seq=31213 Ack=87328 Win=2048 Len=0 TSval=600573221 TSecr=868276411"
"327","28.355544","100.86.121.59","172.66.164.67","TLSv1.2","101","Application Data"
"328","28.407082","172.66.164.67","100.86.121.59","TCP","66","443  >  53635 [ACK] Seq=87328 Ack=31248 Win=18 Len=0 TSval=868276465 TSecr=600573223"
"329","29.539395","100.86.121.59","172.66.164.67","TLSv1.2","728","Application Data"
"330","29.615213","172.66.164.67","100.86.121.59","TCP","66","443  >  53635 [ACK] Seq=87328 Ack=31910 Win=18 Len=0 TSval=868277632 TSecr=600574407"
"331","29.686550","172.66.164.67","100.86.121.59","TLSv1.2","190","Application Data"
"332","29.686552","172.66.164.67","100.86.121.59","TCP","1514","443  >  53635 [ACK] Seq=87452 Ack=31910 Win=18 Len=1448 TSval=868277706 TSecr=600574407 [TCP PDU reassembled in 346]"
"333","29.686658","100.86.121.59","172.66.164.67","TCP","66","53635  >  443 [ACK] Seq=31910 Ack=88900 Win=2024 Len=0 TSval=600574554 TSecr=868277706"
"334","29.687720","172.66.164.67","100.86.121.59","TCP","1514","443  >  53635 [ACK] Seq=88900 Ack=31910 Win=18 Len=1448 TSval=868277706 TSecr=600574407 [TCP PDU reassembled in 346]"
"335","29.687722","172.66.164.67","100.86.121.59","TCP","1514","443  >  53635 [ACK] Seq=90348 Ack=31910 Win=18 Len=1448 TSval=868277706 TSecr=600574407 [TCP PDU reassembled in 346]"
"336","29.687723","172.66.164.67","100.86.121.59","TCP","1514","443  >  53635 [ACK] Seq=91796 Ack=31910 Win=18 Len=1448 TSval=868277706 TSecr=600574407 [TCP PDU reassembled in 346]"
"337","29.687724","172.66.164.67","100.86.121.59","TCP","1514","443  >  53635 [ACK] Seq=93244 Ack=31910 Win=18 Len=1448 TSval=868277706 TSecr=600574407 [TCP PDU reassembled in 346]"
"338","29.687798","100.86.121.59","172.66.164.67","TCP","66","53635  >  443 [ACK] Seq=31910 Ack=94692 Win=1958 Len=0 TSval=600574555 TSecr=868277706"
"339","29.687983","172.66.164.67","100.86.121.59","TCP","1514","443  >  53635 [ACK] Seq=94692 Ack=31910 Win=18 Len=1448 TSval=868277706 TSecr=600574407 [TCP PDU reassembled in 346]"
"340","29.687985","172.66.164.67","100.86.121.59","TCP","1514","443  >  53635 [ACK] Seq=96140 Ack=31910 Win=18 Len=1448 TSval=868277706 TSecr=600574407 [TCP PDU reassembled in 346]"
"341","29.687986","172.66.164.67","100.86.121.59","TCP","1514","443  >  53635 [ACK] Seq=97588 Ack=31910 Win=18 Len=1448 TSval=868277706 TSecr=600574407 [TCP PDU reassembled in 346]"
"342","29.687987","172.66.164.67","100.86.121.59","TCP","1514","443  >  53635 [ACK] Seq=99036 Ack=31910 Win=18 Len=1448 TSval=868277706 TSecr=600574407 [TCP PDU reassembled in 346]"
"343","29.688029","100.86.121.59","172.66.164.67","TCP","66","53635  >  443 [ACK] Seq=31910 Ack=100484 Win=1868 Len=0 TSval=600574555 TSecr=868277706"
"344","29.688120","172.66.164.67","100.86.121.59","TCP","1514","443  >  53635 [PSH, ACK] Seq=100484 Ack=31910 Win=18 Len=1448 TSval=868277706 TSecr=600574407 [TCP PDU reassembled in 346]"
"345","29.688122","172.66.164.67","100.86.121.59","TCP","1514","443  >  53635 [ACK] Seq=101932 Ack=31910 Win=18 Len=1448 TSval=868277707 TSecr=600574407 [TCP PDU reassembled in 346]"
"346","29.688123","172.66.164.67","100.86.121.59","TLSv1.2","544","Application Data"
"347","29.688124","172.66.164.67","100.86.121.59","TCP","1514","443  >  53635 [ACK] Seq=103858 Ack=31910 Win=18 Len=1448 TSval=868277707 TSecr=600574407 [TCP PDU reassembled in 357]"
"348","29.688217","172.66.164.67","100.86.121.59","TCP","1514","443  >  53635 [ACK] Seq=105306 Ack=31910 Win=18 Len=1448 TSval=868277707 TSecr=600574407 [TCP PDU reassembled in 357]"
"349","29.688218","172.66.164.67","100.86.121.59","TCP","1514","443  >  53635 [ACK] Seq=106754 Ack=31910 Win=18 Len=1448 TSval=868277707 TSecr=600574407 [TCP PDU reassembled in 357]"
"350","29.688227","100.86.121.59","172.66.164.67","TCP","66","[TCP Window Update] 53635  >  443 [ACK] Seq=31910 Ack=100484 Win=2048 Len=0 TSval=600574555 TSecr=868277706"
"351","29.688236","100.86.121.59","172.66.164.67","TCP","66","53635  >  443 [ACK] Seq=31910 Ack=105306 Win=1973 Len=0 TSval=600574555 TSecr=868277707"
"352","29.688242","100.86.121.59","172.66.164.67","TCP","66","53635  >  443 [ACK] Seq=31910 Ack=108202 Win=1928 Len=0 TSval=600574555 TSecr=868277707"
"353","29.688267","100.86.121.59","172.66.164.67","TCP","66","[TCP Window Update] 53635  >  443 [ACK] Seq=31910 Ack=108202 Win=2048 Len=0 TSval=600574555 TSecr=868277707"
"354","29.689662","172.66.164.67","100.86.121.59","TCP","1514","443  >  53635 [ACK] Seq=108202 Ack=31910 Win=18 Len=1448 TSval=868277707 TSecr=600574407 [TCP PDU reassembled in 357]"
"355","29.689663","172.66.164.67","100.86.121.59","TCP","1514","443  >  53635 [ACK] Seq=109650 Ack=31910 Win=18 Len=1448 TSval=868277707 TSecr=600574407 [TCP PDU reassembled in 357]"
"356","29.689665","172.66.164.67","100.86.121.59","TCP","1514","443  >  53635 [ACK] Seq=111098 Ack=31910 Win=18 Len=1448 TSval=868277707 TSecr=600574407 [TCP PDU reassembled in 357]"
"357","29.689666","172.66.164.67","100.86.121.59","TLSv1.2","644","Application Data"
"358","29.689669","172.66.164.67","100.86.121.59","TLSv1.2","97","Application Data"
"359","29.689771","100.86.121.59","172.66.164.67","TCP","66","53635  >  443 [ACK] Seq=31910 Ack=113155 Win=1971 Len=0 TSval=600574557 TSecr=868277708"
"360","29.691014","100.86.121.59","172.66.164.67","TCP","66","[TCP Window Update] 53635  >  443 [ACK] Seq=31910 Ack=113155 Win=2048 Len=0 TSval=600574558 TSecr=868277708"
"361","29.710579","172.66.164.67","100.86.121.59","TCP","97","[TCP Spurious Retransmission] 443  >  53635 [PSH, ACK] Seq=113124 Ack=31910 Win=18 Len=31 TSval=868277741 TSecr=600574407"
"362","29.710640","100.86.121.59","172.66.164.67","TCP","78","[TCP Dup ACK 359#1] 53635  >  443 [ACK] Seq=31910 Ack=113155 Win=2048 Len=0 TSval=600574578 TSecr=868277741 SLE=113124 SRE=113155"
"363","29.715224","100.86.121.59","172.66.164.67","TLSv1.2","1261","Application Data"
"364","29.810400","172.66.164.67","100.86.121.59","TCP","66","443  >  53635 [ACK] Seq=113155 Ack=33105 Win=18 Len=0 TSval=868277825 TSecr=600574582"
"365","29.822607","172.66.164.67","100.86.121.59","TLSv1.2","369","Application Data"
"366","29.822609","172.66.164.67","100.86.121.59","TLSv1.2","537","Application Data"
"367","29.822610","172.66.164.67","100.86.121.59","TLSv1.2","97","Application Data"
"368","29.822710","100.86.121.59","172.66.164.67","TCP","66","53635  >  443 [ACK] Seq=33105 Ack=113960 Win=2036 Len=0 TSval=600574690 TSecr=868277845"
"369","29.825210","100.86.121.59","172.66.164.67","TLSv1.2","176","Application Data"
"370","29.840646","100.86.121.59","172.66.164.67","TLSv1.2","423","Application Data"
"371","29.840903","100.86.121.59","172.66.164.67","TLSv1.2","198","Application Data"
"372","29.841004","100.86.121.59","172.66.164.67","TLSv1.2","200","Application Data"
"373","29.841087","100.86.121.59","172.66.164.67","TLSv1.2","199","Application Data"
"374","29.841161","100.86.121.59","172.66.164.67","TLSv1.2","197","Application Data"
"375","29.886232","172.66.164.67","100.86.121.59","TCP","97","[TCP Spurious Retransmission] 443  >  53635 [PSH, ACK] Seq=113929 Ack=33105 Win=18 Len=31 TSval=868277919 TSecr=600574582"
"376","29.886315","100.86.121.59","172.66.164.67","TCP","78","[TCP Dup ACK 368#1] 53635  >  443 [ACK] Seq=34102 Ack=113960 Win=2048 Len=0 TSval=600574753 TSecr=868277919 SLE=113929 SRE=113960"
"377","29.939766","172.66.164.67","100.86.121.59","TCP","66","443  >  53635 [ACK] Seq=113960 Ack=34102 Win=18 Len=0 TSval=868277951 TSecr=600574692"
"378","29.939777","172.66.164.67","100.86.121.59","TLSv1.2","128","Application Data"
"379","29.939778","172.66.164.67","100.86.121.59","TLSv1.2","108","Application Data"
"380","29.939779","172.66.164.67","100.86.121.59","TLSv1.2","97","Application Data"
"381","29.939956","100.86.121.59","172.66.164.67","TCP","66","53635  >  443 [ACK] Seq=34102 Ack=114095 Win=2046 Len=0 TSval=600574807 TSecr=868277958"
"382","29.957395","172.66.164.67","100.86.121.59","TLSv1.2","127","Application Data"
"383","29.957396","172.66.164.67","100.86.121.59","TLSv1.2","290","Application Data"
"384","29.957397","172.66.164.67","100.86.121.59","TLSv1.2","97","Application Data"
"385","29.957452","100.86.121.59","172.66.164.67","TCP","66","53635  >  443 [ACK] Seq=34102 Ack=114411 Win=2044 Len=0 TSval=600574825 TSecr=868277977"
"386","29.958972","172.66.164.67","100.86.121.59","TLSv1.2","135","Application Data"
"387","29.958973","172.66.164.67","100.86.121.59","TLSv1.2","290","Application Data"
"388","29.958974","172.66.164.67","100.86.121.59","TLSv1.2","97","Application Data"
"389","29.958974","172.66.164.67","100.86.121.59","TLSv1.2","127","Application Data"
"390","29.958975","172.66.164.67","100.86.121.59","TLSv1.2","290","Application Data"
"391","29.958975","172.66.164.67","100.86.121.59","TLSv1.2","97","Application Data"
"392","29.958976","172.66.164.67","100.86.121.59","TLSv1.2","127","Application Data"
"393","29.958977","172.66.164.67","100.86.121.59","TLSv1.2","290","Application Data"
"394","29.958977","172.66.164.67","100.86.121.59","TLSv1.2","97","Application Data"
"395","29.958979","172.66.164.67","100.86.121.59","TLSv1.2","127","Application Data"
"396","29.958979","172.66.164.67","100.86.121.59","TLSv1.2","290","Application Data"
"397","29.958980","172.66.164.67","100.86.121.59","TLSv1.2","97","Application Data"
"398","29.959058","100.86.121.59","172.66.164.67","TCP","66","53635  >  443 [ACK] Seq=34102 Ack=115683 Win=2029 Len=0 TSval=600574826 TSecr=868277984"
"399","31.704688","100.86.121.59","172.66.164.67","TCP","54","[TCP Keep-Alive] 53635  >  443 [ACK] Seq=34101 Ack=115683 Win=2048 Len=0"
"400","31.718040","172.66.164.67","100.86.121.59","TCP","66","[TCP Keep-Alive ACK] 443  >  53635 [ACK] Seq=115683 Ack=34102 Win=18 Len=0 TSval=868279774 TSecr=600574826"
"401","33.228546","100.86.121.59","172.66.164.67","TLSv1.2","645","Application Data"
"402","33.260090","172.66.164.67","100.86.121.59","TLSv1.2","280","Application Data"
"403","33.260092","172.66.164.67","100.86.121.59","TLSv1.2","97","[TCP Previous segment not captured] , Application Data"
"404","33.260164","100.86.121.59","172.66.164.67","TCP","66","53635  >  443 [ACK] Seq=34681 Ack=115897 Win=2045 Len=0 TSval=600578127 TSecr=868281318"
"405","33.260206","100.86.121.59","172.66.164.67","TCP","78","[TCP Dup ACK 404#1] 53635  >  443 [ACK] Seq=34681 Ack=115897 Win=2045 Len=0 TSval=600578127 TSecr=868281318 SLE=116347 SRE=116378"
"406","33.276445","172.66.164.67","100.86.121.59","TCP","516","[TCP Retransmission] 443  >  53635 [PSH, ACK] Seq=115897 Ack=34681 Win=18 Len=450 TSval=868281335 TSecr=600578127"
"407","33.276515","100.86.121.59","172.66.164.67","TCP","66","53635  >  443 [ACK] Seq=34681 Ack=116378 Win=2041 Len=0 TSval=600578144 TSecr=868281335"
"408","33.680519","100.86.121.59","172.66.164.67","TCP","54","[TCP Keep-Alive] 53635  >  443 [ACK] Seq=34680 Ack=116378 Win=2048 Len=0"
"409","33.694226","172.66.164.67","100.86.121.59","TCP","66","[TCP Keep-Alive ACK] 443  >  53635 [ACK] Seq=116378 Ack=34681 Win=18 Len=0 TSval=868281752 TSecr=600578144"
"410","34.967344","100.86.121.59","172.66.164.67","TLSv1.2","1274","Application Data"
"411","34.967455","100.86.121.59","172.66.164.67","TLSv1.2","457","Application Data"
"412","34.981099","172.66.164.67","100.86.121.59","TCP","66","443  >  53635 [ACK] Seq=116378 Ack=36280 Win=18 Len=0 TSval=868283039 TSecr=600579834"
"413","35.004308","172.66.164.67","100.86.121.59","TLSv1.2","158","Application Data"
"414","35.004502","100.86.121.59","172.66.164.67","TCP","66","53635  >  443 [ACK] Seq=36280 Ack=116470 Win=2047 Len=0 TSval=600579872 TSecr=868283062"
"415","35.004731","172.66.164.67","100.86.121.59","TLSv1.2","290","Application Data"
"416","35.004734","172.66.164.67","100.86.121.59","TLSv1.2","97","Application Data"
"417","35.004867","100.86.121.59","172.66.164.67","TCP","66","53635  >  443 [ACK] Seq=36280 Ack=116725 Win=2045 Len=0 TSval=600579872 TSecr=868283062"
"418","35.006417","100.86.121.59","172.66.164.67","TLSv1.2","101","Application Data"
"419","35.006710","172.66.164.67","100.86.121.59","TLSv1.2","208","Application Data"
"420","35.006713","172.66.164.67","100.86.121.59","TLSv1.2","290","Application Data"
"421","35.006814","172.66.164.67","100.86.121.59","TLSv1.2","97","Application Data"
"422","35.006820","100.86.121.59","172.66.164.67","TCP","66","53635  >  443 [ACK] Seq=36315 Ack=117091 Win=2043 Len=0 TSval=600579874 TSecr=868283065"
"423","35.006848","100.86.121.59","172.66.164.67","TCP","66","53635  >  443 [ACK] Seq=36315 Ack=117122 Win=2043 Len=0 TSval=600579874 TSecr=868283065"
"424","35.057610","172.66.164.67","100.86.121.59","TCP","66","443  >  53635 [ACK] Seq=117122 Ack=36315 Win=18 Len=0 TSval=868283116 TSecr=600579874"
"425","39.964995","100.86.121.59","172.66.164.67","TLSv1.2","197","Application Data"
"426","39.965546","100.86.121.59","172.66.164.67","TLSv1.2","197","Application Data"
"427","39.965927","100.86.121.59","172.66.164.67","TLSv1.2","199","Application Data"
"428","39.975027","172.66.164.67","100.86.121.59","TCP","66","443  >  53635 [ACK] Seq=117122 Ack=36446 Win=18 Len=0 TSval=868288033 TSecr=600584832"
"429","39.975543","172.66.164.67","100.86.121.59","TCP","66","443  >  53635 [ACK] Seq=117122 Ack=36710 Win=18 Len=0 TSval=868288034 TSecr=600584833"
"430","40.000588","172.66.164.67","100.86.121.59","TLSv1.2","150","Application Data"
"431","40.000593","172.66.164.67","100.86.121.59","TLSv1.2","290","Application Data"
"432","40.000595","172.66.164.67","100.86.121.59","TLSv1.2","97","Application Data"
"433","40.000795","100.86.121.59","172.66.164.67","TCP","66","53635  >  443 [ACK] Seq=36710 Ack=117461 Win=2043 Len=0 TSval=600584868 TSecr=868288058"
"434","40.001510","172.66.164.67","100.86.121.59","TLSv1.2","130","Application Data"
"435","40.001513","172.66.164.67","100.86.121.59","TLSv1.2","290","Application Data"
"436","40.001607","100.86.121.59","172.66.164.67","TCP","66","53635  >  443 [ACK] Seq=36710 Ack=117749 Win=2044 Len=0 TSval=600584869 TSecr=868288059"
"437","40.001667","172.66.164.67","100.86.121.59","TLSv1.2","97","Application Data"
"438","40.001738","100.86.121.59","172.66.164.67","TCP","66","53635  >  443 [ACK] Seq=36710 Ack=117780 Win=2048 Len=0 TSval=600584869 TSecr=868288059"
"439","40.002571","172.66.164.67","100.86.121.59","TLSv1.2","127","Application Data"
"440","40.002574","172.66.164.67","100.86.121.59","TLSv1.2","290","Application Data"
"441","40.002577","172.66.164.67","100.86.121.59","TLSv1.2","97","Application Data"
"442","40.002658","100.86.121.59","172.66.164.67","TCP","66","53635  >  443 [ACK] Seq=36710 Ack=118096 Win=2044 Len=0 TSval=600584870 TSecr=868288060"
"443","44.828299","100.86.121.59","172.66.164.67","TLSv1.2","192","Application Data"
"444","44.862862","172.66.164.67","100.86.121.59","TLSv1.2","151","Application Data"
"445","44.862867","172.66.164.67","100.86.121.59","TLSv1.2","108","Application Data"
"446","44.863119","100.86.121.59","172.66.164.67","TCP","66","53635  >  443 [ACK] Seq=36836 Ack=118223 Win=2047 Len=0 TSval=600589730 TSecr=868292921"
"447","44.863395","172.66.164.67","100.86.121.59","TLSv1.2","97","Application Data"
"448","44.863504","100.86.121.59","172.66.164.67","TCP","66","53635  >  443 [ACK] Seq=36836 Ack=118254 Win=2048 Len=0 TSval=600589731 TSecr=868292921"
"449","44.865843","100.86.121.59","172.66.164.67","TLSv1.2","101","Application Data"
"450","44.915961","172.66.164.67","100.86.121.59","TCP","66","443  >  53635 [ACK] Seq=118254 Ack=36871 Win=18 Len=0 TSval=868292974 TSecr=600589733"
"451","45.012198","100.86.121.59","172.66.164.67","TLSv1.2","198","Application Data"
"452","45.022019","172.66.164.67","100.86.121.59","TCP","66","443  >  53635 [ACK] Seq=118254 Ack=37003 Win=18 Len=0 TSval=868293080 TSecr=600589879"
"453","45.046579","172.66.164.67","100.86.121.59","TLSv1.2","127","Application Data"
"454","45.046583","172.66.164.67","100.86.121.59","TLSv1.2","290","Application Data"
"455","45.046586","172.66.164.67","100.86.121.59","TLSv1.2","97","Application Data"
"456","45.046805","100.86.121.59","172.66.164.67","TCP","66","53635  >  443 [ACK] Seq=37003 Ack=118570 Win=2044 Len=0 TSval=600589914 TSecr=868293104"
"457","45.333349","100.86.121.59","172.66.164.67","TLSv1.2","699","Application Data"
"458","45.383356","172.66.164.67","100.86.121.59","TCP","66","443  >  53635 [ACK] Seq=118570 Ack=37636 Win=18 Len=0 TSval=868293442 TSecr=600590200"
"459","45.420890","172.66.164.67","100.86.121.59","TLSv1.2","186","Application Data"
"460","45.420892","172.66.164.67","100.86.121.59","TCP","1514","443  >  53635 [ACK] Seq=118690 Ack=37636 Win=18 Len=1448 TSval=868293479 TSecr=600590200 [TCP PDU reassembled in 472]"
"461","45.420945","100.86.121.59","172.66.164.67","TCP","66","53635  >  443 [ACK] Seq=37636 Ack=120138 Win=2024 Len=0 TSval=600590288 TSecr=868293479"
"462","45.422544","172.66.164.67","100.86.121.59","TCP","1514","443  >  53635 [ACK] Seq=120138 Ack=37636 Win=18 Len=1448 TSval=868293479 TSecr=600590200 [TCP PDU reassembled in 472]"
"463","45.422545","172.66.164.67","100.86.121.59","TCP","1514","443  >  53635 [ACK] Seq=121586 Ack=37636 Win=18 Len=1448 TSval=868293479 TSecr=600590200 [TCP PDU reassembled in 472]"
"464","45.422546","172.66.164.67","100.86.121.59","TCP","1514","443  >  53635 [ACK] Seq=123034 Ack=37636 Win=18 Len=1448 TSval=868293479 TSecr=600590200 [TCP PDU reassembled in 472]"
"465","45.422547","172.66.164.67","100.86.121.59","TCP","1514","443  >  53635 [ACK] Seq=124482 Ack=37636 Win=18 Len=1448 TSval=868293479 TSecr=600590200 [TCP PDU reassembled in 472]"
"466","45.422548","172.66.164.67","100.86.121.59","TCP","1514","443  >  53635 [ACK] Seq=125930 Ack=37636 Win=18 Len=1448 TSval=868293479 TSecr=600590200 [TCP PDU reassembled in 472]"
"467","45.422549","172.66.164.67","100.86.121.59","TCP","1514","443  >  53635 [ACK] Seq=127378 Ack=37636 Win=18 Len=1448 TSval=868293479 TSecr=600590200 [TCP PDU reassembled in 472]"
"468","45.422550","172.66.164.67","100.86.121.59","TCP","1514","443  >  53635 [ACK] Seq=128826 Ack=37636 Win=18 Len=1448 TSval=868293479 TSecr=600590200 [TCP PDU reassembled in 472]"
"469","45.422551","172.66.164.67","100.86.121.59","TCP","1514","443  >  53635 [ACK] Seq=130274 Ack=37636 Win=18 Len=1448 TSval=868293479 TSecr=600590200 [TCP PDU reassembled in 472]"
"470","45.422553","172.66.164.67","100.86.121.59","TCP","1514","443  >  53635 [PSH, ACK] Seq=131722 Ack=37636 Win=18 Len=1448 TSval=868293479 TSecr=600590200 [TCP PDU reassembled in 472]"
"471","45.422554","172.66.164.67","100.86.121.59","TCP","1514","443  >  53635 [ACK] Seq=133170 Ack=37636 Win=18 Len=1448 TSval=868293480 TSecr=600590200 [TCP PDU reassembled in 472]"
"472","45.422555","172.66.164.67","100.86.121.59","TLSv1.2","544","Application Data"
"473","45.422556","172.66.164.67","100.86.121.59","TCP","1514","443  >  53635 [ACK] Seq=135096 Ack=37636 Win=18 Len=1448 TSval=868293480 TSecr=600590200 [TCP PDU reassembled in 486]"
"474","45.422557","172.66.164.67","100.86.121.59","TCP","1514","443  >  53635 [ACK] Seq=136544 Ack=37636 Win=18 Len=1448 TSval=868293480 TSecr=600590200 [TCP PDU reassembled in 486]"
"475","45.422557","172.66.164.67","100.86.121.59","TCP","1514","443  >  53635 [ACK] Seq=137992 Ack=37636 Win=18 Len=1448 TSval=868293480 TSecr=600590200 [TCP PDU reassembled in 486]"
"476","45.422558","172.66.164.67","100.86.121.59","TCP","1514","443  >  53635 [ACK] Seq=139440 Ack=37636 Win=18 Len=1448 TSval=868293480 TSecr=600590200 [TCP PDU reassembled in 486]"
"477","45.422559","172.66.164.67","100.86.121.59","TCP","1514","443  >  53635 [ACK] Seq=140888 Ack=37636 Win=18 Len=1448 TSval=868293480 TSecr=600590200 [TCP PDU reassembled in 486]"
"478","45.422561","172.66.164.67","100.86.121.59","TCP","1514","443  >  53635 [ACK] Seq=142336 Ack=37636 Win=18 Len=1448 TSval=868293480 TSecr=600590200 [TCP PDU reassembled in 486]"
"479","45.422602","100.86.121.59","172.66.164.67","TCP","66","53635  >  443 [ACK] Seq=37636 Ack=135096 Win=1815 Len=0 TSval=600590290 TSecr=868293480"
"480","45.422617","100.86.121.59","172.66.164.67","TCP","66","53635  >  443 [ACK] Seq=37636 Ack=143784 Win=1680 Len=0 TSval=600590290 TSecr=868293480"
"481","45.422672","100.86.121.59","172.66.164.67","TCP","66","[TCP Window Update] 53635  >  443 [ACK] Seq=37636 Ack=143784 Win=2048 Len=0 TSval=600590290 TSecr=868293480"
"482","45.423585","172.66.164.67","100.86.121.59","TCP","1514","443  >  53635 [ACK] Seq=143784 Ack=37636 Win=18 Len=1448 TSval=868293480 TSecr=600590200 [TCP PDU reassembled in 486]"
"483","45.423586","172.66.164.67","100.86.121.59","TCP","1514","443  >  53635 [ACK] Seq=145232 Ack=37636 Win=18 Len=1448 TSval=868293480 TSecr=600590200 [TCP PDU reassembled in 486]"
"484","45.423587","172.66.164.67","100.86.121.59","TCP","1514","443  >  53635 [ACK] Seq=146680 Ack=37636 Win=18 Len=1448 TSval=868293480 TSecr=600590200 [TCP PDU reassembled in 486]"
"485","45.423588","172.66.164.67","100.86.121.59","TCP","1514","443  >  53635 [PSH, ACK] Seq=148128 Ack=37636 Win=18 Len=1448 TSval=868293480 TSecr=600590200 [TCP PDU reassembled in 486]"
"486","45.423590","172.66.164.67","100.86.121.59","TLSv1.2","193","Application Data, Application Data"
"487","45.423617","100.86.121.59","172.66.164.67","TCP","66","53635  >  443 [ACK] Seq=37636 Ack=149703 Win=1956 Len=0 TSval=600590291 TSecr=868293481"
"488","45.423648","100.86.121.59","172.66.164.67","TCP","66","[TCP Window Update] 53635  >  443 [ACK] Seq=37636 Ack=149703 Win=2048 Len=0 TSval=600590291 TSecr=868293481"
"489","45.506488","100.86.121.59","172.66.164.67","TLSv1.2","1243","Application Data"
"490","45.519995","172.66.164.67","100.86.121.59","TCP","66","443  >  53635 [ACK] Seq=149703 Ack=38813 Win=18 Len=0 TSval=868293575 TSecr=600590374"
"491","45.535364","100.86.121.59","172.66.164.67","TLSv1.2","183","Application Data"
"492","45.535466","100.86.121.59","172.66.164.67","TLSv1.2","167","Application Data"
"493","45.545070","172.66.164.67","100.86.121.59","TLSv1.2","177","Application Data"
"494","45.545071","172.66.164.67","100.86.121.59","TLSv1.2","108","Application Data"
"495","45.545098","100.86.121.59","172.66.164.67","TCP","66","53635  >  443 [ACK] Seq=39031 Ack=149856 Win=2046 Len=0 TSval=600590412 TSecr=868293603"
"496","45.545180","172.66.164.67","100.86.121.59","TLSv1.2","97","Application Data"
"497","45.545197","100.86.121.59","172.66.164.67","TCP","66","53635  >  443 [ACK] Seq=39031 Ack=149887 Win=2046 Len=0 TSval=600590412 TSecr=868293603"
"498","45.547870","172.66.164.67","100.86.121.59","TCP","66","443  >  53635 [ACK] Seq=149887 Ack=39031 Win=18 Len=0 TSval=868293604 TSecr=600590402"
"499","45.560885","100.86.121.59","172.66.164.67","TLSv1.2","423","Application Data"
"500","45.561390","100.86.121.59","172.66.164.67","TLSv1.2","197","Application Data"
"501","45.561537","100.86.121.59","172.66.164.67","TLSv1.2","199","Application Data"
"502","45.561712","100.86.121.59","172.66.164.67","TLSv1.2","198","Application Data"
"503","45.561957","100.86.121.59","172.66.164.67","TLSv1.2","564","Application Data"
"504","45.574282","172.66.164.67","100.86.121.59","TLSv1.2","249","Application Data"
"505","45.574284","172.66.164.67","100.86.121.59","TCP","66","443  >  53635 [ACK] Seq=150070 Ack=40282 Win=18 Len=0 TSval=868293631 TSecr=600590428"
"506","45.574324","100.86.121.59","172.66.164.67","TCP","66","53635  >  443 [ACK] Seq=40282 Ack=150070 Win=2046 Len=0 TSval=600590441 TSecr=868293630"
"507","45.576660","172.66.164.67","100.86.121.59","TLSv1.2","145","Application Data"
"508","45.576706","100.86.121.59","172.66.164.67","TCP","66","53635  >  443 [ACK] Seq=40282 Ack=150149 Win=2047 Len=0 TSval=600590444 TSecr=868293634"
"509","45.614972","172.66.164.67","100.86.121.59","TLSv1.2","154","Application Data"
"510","45.614973","172.66.164.67","100.86.121.59","TLSv1.2","290","Application Data"
"511","45.614975","172.66.164.67","100.86.121.59","TLSv1.2","97","Application Data"
"512","45.615039","100.86.121.59","172.66.164.67","TCP","66","53635  >  443 [ACK] Seq=40282 Ack=150492 Win=2043 Len=0 TSval=600590482 TSecr=868293657"
"513","45.618307","172.66.164.67","100.86.121.59","TLSv1.2","127","Application Data"
"514","45.618308","172.66.164.67","100.86.121.59","TLSv1.2","290","Application Data"
"515","45.618309","172.66.164.67","100.86.121.59","TLSv1.2","97","Application Data"
"516","45.618309","172.66.164.67","100.86.121.59","TLSv1.2","127","Application Data"
"517","45.618314","172.66.164.67","100.86.121.59","TLSv1.2","290","Application Data"
"518","45.618397","100.86.121.59","172.66.164.67","TCP","66","53635  >  443 [ACK] Seq=40282 Ack=151093 Win=2039 Len=0 TSval=600590485 TSecr=868293659"
"519","45.619730","172.66.164.67","100.86.121.59","TLSv1.2","97","Application Data"
"520","45.619731","172.66.164.67","100.86.121.59","TLSv1.2","127","Application Data"
"521","45.619732","172.66.164.67","100.86.121.59","TLSv1.2","290","Application Data"
"522","45.619733","172.66.164.67","100.86.121.59","TLSv1.2","97","Application Data"
"523","45.619829","100.86.121.59","172.66.164.67","TCP","66","53635  >  443 [ACK] Seq=40282 Ack=151440 Win=2043 Len=0 TSval=600590487 TSecr=868293659"
"524","45.671688","172.66.164.67","100.86.121.59","TLSv1.2","127","Application Data"
"525","45.671690","172.66.164.67","100.86.121.59","TLSv1.2","290","Application Data"
"526","45.671691","172.66.164.67","100.86.121.59","TLSv1.2","97","Application Data"
"527","45.672180","100.86.121.59","172.66.164.67","TCP","66","53635  >  443 [ACK] Seq=40282 Ack=151756 Win=2044 Len=0 TSval=600590539 TSecr=868293724"
"528","50.626542","100.86.121.59","172.66.164.67","TLSv1.2","197","Application Data"
"529","50.627340","100.86.121.59","172.66.164.67","TLSv1.2","330","Application Data"
"530","50.627623","100.86.121.59","172.66.164.67","TLSv1.2","1167","Application Data"
"531","50.640338","172.66.164.67","100.86.121.59","TCP","66","443  >  53635 [ACK] Seq=151756 Ack=40677 Win=18 Len=0 TSval=868298698 TSecr=600595493"
"532","50.658062","172.66.164.67","100.86.121.59","TLSv1.2","150","Application Data"
"533","50.658065","172.66.164.67","100.86.121.59","TLSv1.2","290","Application Data"
"534","50.658170","172.66.164.67","100.86.121.59","TLSv1.2","97","Application Data"
"535","50.658253","100.86.121.59","172.66.164.67","TCP","66","53635  >  443 [ACK] Seq=41778 Ack=152064 Win=2044 Len=0 TSval=600595525 TSecr=868298716"
"536","50.658335","100.86.121.59","172.66.164.67","TCP","66","53635  >  443 [ACK] Seq=41778 Ack=152095 Win=2044 Len=0 TSval=600595525 TSecr=868298716"
"537","50.659806","172.66.164.67","100.86.121.59","TLSv1.2","127","Application Data"
"538","50.659808","172.66.164.67","100.86.121.59","TLSv1.2","290","Application Data"
"539","50.659914","100.86.121.59","172.66.164.67","TCP","66","53635  >  443 [ACK] Seq=41778 Ack=152380 Win=2044 Len=0 TSval=600595527 TSecr=868298718"
"540","50.660110","172.66.164.67","100.86.121.59","TLSv1.2","97","Application Data"
"541","50.660161","100.86.121.59","172.66.164.67","TCP","66","53635  >  443 [ACK] Seq=41778 Ack=152411 Win=2044 Len=0 TSval=600595527 TSecr=868298718"
"542","50.660365","100.86.121.59","172.66.164.67","TLSv1.2","101","Application Data"
"543","50.660656","172.66.164.67","100.86.121.59","TLSv1.2","127","Application Data"
"544","50.660659","172.66.164.67","100.86.121.59","TLSv1.2","290","Application Data"
"545","50.660708","100.86.121.59","172.66.164.67","TCP","66","53635  >  443 [ACK] Seq=41813 Ack=152696 Win=2044 Len=0 TSval=600595528 TSecr=868298718"
"546","50.660800","172.66.164.67","100.86.121.59","TLSv1.2","97","Application Data"
"547","50.660828","100.86.121.59","172.66.164.67","TCP","66","53635  >  443 [ACK] Seq=41813 Ack=152727 Win=2044 Len=0 TSval=600595528 TSecr=868298718"
"548","50.678296","100.86.121.59","172.66.164.67","TLSv1.2","220","Application Data"
"549","50.688488","172.66.164.67","100.86.121.59","TCP","66","443  >  53635 [ACK] Seq=152727 Ack=41967 Win=18 Len=0 TSval=868298746 TSecr=600595528"
"550","50.713158","172.66.164.67","100.86.121.59","TLSv1.2","127","Application Data"
"551","50.713163","172.66.164.67","100.86.121.59","TLSv1.2","290","Application Data"
"552","50.713415","100.86.121.59","172.66.164.67","TCP","66","53635  >  443 [ACK] Seq=41967 Ack=153012 Win=2044 Len=0 TSval=600595580 TSecr=868298771"
"553","50.713540","172.66.164.67","100.86.121.59","TLSv1.2","97","Application Data"
"554","50.713607","100.86.121.59","172.66.164.67","TCP","66","53635  >  443 [ACK] Seq=41967 Ack=153043 Win=2044 Len=0 TSval=600595581 TSecr=868298771"
