No.,Time,Source,Destination,Protocol,Length,Info
1,0.0,100.86.121.59,172.66.164.67,TLSv1.2,405,Application Data
2,4.1e-05,100.86.121.59,172.66.164.67,TLSv1.2,105,Application Data
3,0.010049,172.66.164.67,100.86.121.59,TCP,66,443  >  53996 [ACK] Seq=1 Ack=379 Win=17 Len=0 TSval=1715260967 TSecr=1969352552
4,0.010408,172.66.164.67,100.86.121.59,TLSv1.2,105,Application Data
5,0.010458,100.86.121.59,172.66.164.67,TCP,66,53996  >  443 [ACK] Seq=379 Ack=40 Win=2048 Len=0 TSval=1969352562 TSecr=1715260967
6,0.070252,172.66.164.67,100.86.121.59,TLSv1.2,190,Application Data
7,0.070254,172.66.164.67,100.86.121.59,TCP,1514,443  >  53996 [ACK] Seq=164 Ack=379 Win=17 Len=1448 TSval=1715261027 TSecr=1969352562 [TCP PDU reassembled in 19]
8,0.070366,100.86.121.59,172.66.164.67,TCP,66,53996  >  443 [ACK] Seq=379 Ack=1612 Win=2024 Len=0 TSval=1969352622 TSecr=1715261027
9,0.07228,172.66.164.67,100.86.121.59,TCP,1514,443  >  53996 [ACK] Seq=1612 Ack=379 Win=17 Len=1448 TSval=1715261027 TSecr=1969352562 [TCP PDU reassembled in 19]
10,0.072282,172.66.164.67,100.86.121.59,TCP,1514,443  >  53996 [ACK] Seq=3060 Ack=379 Win=17 Len=1448 TSval=1715261027 TSecr=1969352562 [TCP PDU reassembled in 19]
11,0.072283,172.66.164.67,100.86.121.59,TCP,1514,443  >  53996 [ACK] Seq=4508 Ack=379 Win=17 Len=1448 TSval=1715261027 TSecr=1969352562 [TCP PDU reassembled in 19]
12,0.072285,172.66.164.67,100.86.121.59,TCP,1514,443  >  53996 [ACK] Seq=5956 Ack=379 Win=17 Len=1448 TSval=1715261027 TSecr=1969352562 [TCP PDU reassembled in 19]
13,0.072287,172.66.164.67,100.86.121.59,TCP,1514,443  >  53996 [ACK] Seq=7404 Ack=379 Win=17 Len=1448 TSval=1715261027 TSecr=1969352562 [TCP PDU reassembled in 19]
14,0.072288,172.66.164.67,100.86.121.59,TCP,1514,443  >  53996 [ACK] Seq=8852 Ack=379 Win=17 Len=1448 TSval=1715261027 TSecr=1969352562 [TCP PDU reassembled in 19]
15,0.07229,172.66.164.67,100.86.121.59,TCP,1514,"443  >  53996 [PSH, ACK] Seq=10300 Ack=379 Win=17 Len=1448 TSval=1715261027 TSecr=1969352562 [TCP PDU reassembled in 19]"
16,0.072291,172.66.164.67,100.86.121.59,TCP,1514,443  >  53996 [ACK] Seq=11748 Ack=379 Win=17 Len=1448 TSval=1715261028 TSecr=1969352562 [TCP PDU reassembled in 19]
17,0.072293,172.66.164.67,100.86.121.59,TCP,1514,443  >  53996 [ACK] Seq=13196 Ack=379 Win=17 Len=1448 TSval=1715261028 TSecr=1969352562 [TCP PDU reassembled in 19]
18,0.072294,172.66.164.67,100.86.121.59,TCP,1514,443  >  53996 [ACK] Seq=14644 Ack=379 Win=17 Len=1448 TSval=1715261028 TSecr=1969352562 [TCP PDU reassembled in 19]
19,0.072296,172.66.164.67,100.86.121.59,TLSv1.2,1514,Application Data
20,0.072297,172.66.164.67,100.86.121.59,TCP,1514,443  >  53996 [ACK] Seq=17540 Ack=379 Win=17 Len=1448 TSval=1715261028 TSecr=1969352562 [TCP PDU reassembled in 36]
21,0.072299,172.66.164.67,100.86.121.59,TCP,1514,443  >  53996 [ACK] Seq=18988 Ack=379 Win=17 Len=1448 TSval=1715261028 TSecr=1969352562 [TCP PDU reassembled in 36]
22,0.0723,172.66.164.67,100.86.121.59,TCP,1514,443  >  53996 [ACK] Seq=20436 Ack=379 Win=17 Len=1448 TSval=1715261028 TSecr=1969352562 [TCP PDU reassembled in 36]
23,0.072302,172.66.164.67,100.86.121.59,TCP,1514,"443  >  53996 [PSH, ACK] Seq=21884 Ack=379 Win=17 Len=1448 TSval=1715261028 TSecr=1969352562 [TCP PDU reassembled in 36]"
24,0.072364,100.86.121.59,172.66.164.67,TCP,66,53996  >  443 [ACK] Seq=379 Ack=17540 Win=1800 Len=0 TSval=1969352624 TSecr=1715261028
25,0.072382,100.86.121.59,172.66.164.67,TCP,66,53996  >  443 [ACK] Seq=379 Ack=23332 Win=1710 Len=0 TSval=1969352624 TSecr=1715261028
26,0.072417,100.86.121.59,172.66.164.67,TCP,66,[TCP Window Update] 53996  >  443 [ACK] Seq=379 Ack=23332 Win=2048 Len=0 TSval=1969352624 TSecr=1715261028
27,0.073187,172.66.164.67,100.86.121.59,TCP,1514,443  >  53996 [ACK] Seq=23332 Ack=379 Win=17 Len=1448 TSval=1715261029 TSecr=1969352562 [TCP PDU reassembled in 36]
28,0.073188,172.66.164.67,100.86.121.59,TCP,1514,443  >  53996 [ACK] Seq=24780 Ack=379 Win=17 Len=1448 TSval=1715261029 TSecr=1969352562 [TCP PDU reassembled in 36]
29,0.073232,100.86.121.59,172.66.164.67,TCP,66,53996  >  443 [ACK] Seq=379 Ack=26228 Win=2003 Len=0 TSval=1969352625 TSecr=1715261029
30,0.073267,100.86.121.59,172.66.164.67,TCP,66,[TCP Window Update] 53996  >  443 [ACK] Seq=379 Ack=26228 Win=2048 Len=0 TSval=1969352625 TSecr=1715261029
31,0.074524,100.86.121.59,172.66.164.67,TLSv1.2,101,Application Data
32,0.075484,172.66.164.67,100.86.121.59,TCP,1514,443  >  53996 [ACK] Seq=26228 Ack=379 Win=17 Len=1448 TSval=1715261029 TSecr=1969352562 [TCP PDU reassembled in 36]
33,0.075486,172.66.164.67,100.86.121.59,TCP,1514,443  >  53996 [ACK] Seq=27676 Ack=379 Win=17 Len=1448 TSval=1715261029 TSecr=1969352562 [TCP PDU reassembled in 36]
34,0.075487,172.66.164.67,100.86.121.59,TCP,1514,443  >  53996 [ACK] Seq=29124 Ack=379 Win=17 Len=1448 TSval=1715261029 TSecr=1969352562 [TCP PDU reassembled in 36]
35,0.075488,172.66.164.67,100.86.121.59,TCP,1514,443  >  53996 [ACK] Seq=30572 Ack=379 Win=17 Len=1448 TSval=1715261029 TSecr=1969352562 [TCP PDU reassembled in 36]
36,0.075489,172.66.164.67,100.86.121.59,TLSv1.2,306,Application Data
37,0.075489,172.66.164.67,100.86.121.59,TLSv1.2,97,Application Data
38,0.075563,100.86.121.59,172.66.164.67,TCP,66,53996  >  443 [ACK] Seq=414 Ack=32291 Win=1954 Len=0 TSval=1969352627 TSecr=1715261030
39,0.075641,100.86.121.59,172.66.164.67,TCP,66,[TCP Window Update] 53996  >  443 [ACK] Seq=414 Ack=32291 Win=2048 Len=0 TSval=1969352627 TSecr=1715261030
40,0.123795,100.86.121.59,172.66.164.67,TLSv1.2,328,Application Data
41,0.124132,172.66.164.67,100.86.121.59,TCP,66,443  >  53996 [ACK] Seq=32291 Ack=414 Win=17 Len=0 TSval=1715261082 TSecr=1969352626
42,0.133245,172.66.164.67,100.86.121.59,TCP,66,443  >  53996 [ACK] Seq=32291 Ack=676 Win=17 Len=0 TSval=1715261091 TSecr=1969352676
43,0.154073,172.66.164.67,100.86.121.59,TLSv1.2,229,Application Data
44,0.154107,100.86.121.59,172.66.164.67,TCP,66,53996  >  443 [ACK] Seq=676 Ack=32454 Win=2046 Len=0 TSval=1969352706 TSecr=1715261111
45,0.155112,100.86.121.59,172.66.164.67,TLSv1.2,1237,Application Data
46,0.156614,172.66.164.67,100.86.121.59,TCP,1514,443  >  53996 [ACK] Seq=32454 Ack=676 Win=17 Len=1448 TSval=1715261111 TSecr=1969352676 [TCP PDU reassembled in 59]
47,0.156615,172.66.164.67,100.86.121.59,TCP,1514,443  >  53996 [ACK] Seq=33902 Ack=676 Win=17 Len=1448 TSval=1715261111 TSecr=1969352676 [TCP PDU reassembled in 59]
48,0.156674,100.86.121.59,172.66.164.67,TCP,66,53996  >  443 [ACK] Seq=1847 Ack=35350 Win=2003 Len=0 TSval=1969352708 TSecr=1715261111
49,0.156719,100.86.121.59,172.66.164.67,TCP,66,[TCP Window Update] 53996  >  443 [ACK] Seq=1847 Ack=35350 Win=2048 Len=0 TSval=1969352708 TSecr=1715261111
50,0.159387,172.66.164.67,100.86.121.59,TCP,1514,443  >  53996 [ACK] Seq=35350 Ack=676 Win=17 Len=1448 TSval=1715261111 TSecr=1969352676 [TCP PDU reassembled in 59]
51,0.159388,172.66.164.67,100.86.121.59,TCP,1514,443  >  53996 [ACK] Seq=36798 Ack=676 Win=17 Len=1448 TSval=1715261111 TSecr=1969352676 [TCP PDU reassembled in 59]
52,0.159389,172.66.164.67,100.86.121.59,TCP,1514,443  >  53996 [ACK] Seq=38246 Ack=676 Win=17 Len=1448 TSval=1715261111 TSecr=1969352676 [TCP PDU reassembled in 59]
53,0.15939,172.66.164.67,100.86.121.59,TCP,1514,443  >  53996 [ACK] Seq=39694 Ack=676 Win=17 Len=1448 TSval=1715261111 TSecr=1969352676 [TCP PDU reassembled in 59]
54,0.159391,172.66.164.67,100.86.121.59,TCP,1514,443  >  53996 [ACK] Seq=41142 Ack=676 Win=17 Len=1448 TSval=1715261111 TSecr=1969352676 [TCP PDU reassembled in 59]
55,0.159391,172.66.164.67,100.86.121.59,TCP,1514,"443  >  53996 [PSH, ACK] Seq=42590 Ack=676 Win=17 Len=1448 TSval=1715261111 TSecr=1969352676 [TCP PDU reassembled in 59]"
56,0.159392,172.66.164.67,100.86.121.59,TCP,1514,443  >  53996 [ACK] Seq=44038 Ack=676 Win=17 Len=1448 TSval=1715261112 TSecr=1969352676 [TCP PDU reassembled in 59]
57,0.159393,172.66.164.67,100.86.121.59,TCP,1514,443  >  53996 [ACK] Seq=45486 Ack=676 Win=17 Len=1448 TSval=1715261112 TSecr=1969352676 [TCP PDU reassembled in 59]
58,0.159394,172.66.164.67,100.86.121.59,TCP,1514,443  >  53996 [ACK] Seq=46934 Ack=676 Win=17 Len=1448 TSval=1715261112 TSecr=1969352676 [TCP PDU reassembled in 59]
59,0.159395,172.66.164.67,100.86.121.59,TLSv1.2,1514,Application Data
60,0.159396,172.66.164.67,100.86.121.59,TCP,1514,443  >  53996 [ACK] Seq=49830 Ack=676 Win=17 Len=1448 TSval=1715261112 TSecr=1969352676 [TCP PDU reassembled in 62]
61,0.159396,172.66.164.67,100.86.121.59,TCP,1514,443  >  53996 [ACK] Seq=51278 Ack=676 Win=17 Len=1448 TSval=1715261112 TSecr=1969352676 [TCP PDU reassembled in 62]
62,0.159397,172.66.164.67,100.86.121.59,TLSv1.2,1052,Application Data
63,0.159398,172.66.164.67,100.86.121.59,TLSv1.2,97,Application Data
64,0.159442,100.86.121.59,172.66.164.67,TCP,66,53996  >  443 [ACK] Seq=1847 Ack=51278 Win=1800 Len=0 TSval=1969352711 TSecr=1715261112
65,0.15946,100.86.121.59,172.66.164.67,TCP,66,53996  >  443 [ACK] Seq=1847 Ack=53743 Win=1762 Len=0 TSval=1969352711 TSecr=1715261113
66,0.159485,100.86.121.59,172.66.164.67,TCP,66,[TCP Window Update] 53996  >  443 [ACK] Seq=1847 Ack=53743 Win=2048 Len=0 TSval=1969352711 TSecr=1715261113
67,0.190329,172.66.164.67,100.86.121.59,TLSv1.2,177,Application Data
68,0.190331,172.66.164.67,100.86.121.59,TLSv1.2,108,Application Data
69,0.190416,100.86.121.59,172.66.164.67,TCP,66,53996  >  443 [ACK] Seq=1847 Ack=53896 Win=2046 Len=0 TSval=1969352742 TSecr=1715261147
70,0.190692,172.66.164.67,100.86.121.59,TLSv1.2,97,Application Data
71,0.190727,100.86.121.59,172.66.164.67,TCP,66,53996  >  443 [ACK] Seq=1847 Ack=53927 Win=2048 Len=0 TSval=1969352742 TSecr=1715261148
72,0.193995,100.86.121.59,172.66.164.67,TLSv1.2,502,Application Data
73,0.194694,100.86.121.59,172.66.164.67,TLSv1.2,198,Application Data
74,0.194719,100.86.121.59,172.66.164.67,TLSv1.2,290,Application Data
75,0.194801,100.86.121.59,172.66.164.67,TLSv1.2,352,Application Data
76,0.194871,100.86.121.59,172.66.164.67,TLSv1.2,242,Application Data
77,0.205145,172.66.164.67,100.86.121.59,TCP,66,443  >  53996 [ACK] Seq=53927 Ack=2639 Win=17 Len=0 TSval=1715261162 TSecr=1969352746
78,0.207224,172.66.164.67,100.86.121.59,TCP,66,443  >  53996 [ACK] Seq=53927 Ack=3101 Win=17 Len=0 TSval=1715261164 TSecr=1969352747
79,0.228069,172.66.164.67,100.86.121.59,TLSv1.2,127,Application Data
80,0.228072,172.66.164.67,100.86.121.59,TLSv1.2,290,Application Data
81,0.228073,172.66.164.67,100.86.121.59,TLSv1.2,97,Application Data
82,0.228073,172.66.164.67,100.86.121.59,TLSv1.2,127,Application Data
83,0.228074,172.66.164.67,100.86.121.59,TLSv1.2,290,Application Data
84,0.228074,172.66.164.67,100.86.121.59,TLSv1.2,97,Application Data
85,0.228075,172.66.164.67,100.86.121.59,TLSv1.2,127,Application Data
86,0.228076,172.66.164.67,100.86.121.59,TLSv1.2,290,Application Data
87,0.228076,172.66.164.67,100.86.121.59,TLSv1.2,97,Application Data
88,0.228188,100.86.121.59,172.66.164.67,TCP,66,53996  >  443 [ACK] Seq=3101 Ack=54875 Win=2034 Len=0 TSval=1969352780 TSecr=1715261185
89,0.228391,172.66.164.67,100.86.121.59,TLSv1.2,127,Application Data
90,0.228392,172.66.164.67,100.86.121.59,TLSv1.2,290,Application Data
91,0.228446,100.86.121.59,172.66.164.67,TCP,66,53996  >  443 [ACK] Seq=3101 Ack=55160 Win=2030 Len=0 TSval=1969352780 TSecr=1715261186
92,0.228727,172.66.164.67,100.86.121.59,TLSv1.2,97,Application Data
93,0.228773,100.86.121.59,172.66.164.67,TCP,66,53996  >  443 [ACK] Seq=3101 Ack=55191 Win=2030 Len=0 TSval=1969352780 TSecr=1715261186
94,0.232438,172.66.164.67,100.86.121.59,TLSv1.2,127,Application Data
95,0.232439,172.66.164.67,100.86.121.59,TLSv1.2,290,Application Data
96,0.23244,172.66.164.67,100.86.121.59,TLSv1.2,97,Application Data
97,0.2325,100.86.121.59,172.66.164.67,TCP,66,53996  >  443 [ACK] Seq=3101 Ack=55507 Win=2044 Len=0 TSval=1969352784 TSecr=1715261189
98,1.863934,100.86.121.59,172.66.164.67,TLSv1.2,312,Application Data
99,1.919667,172.66.164.67,100.86.121.59,TCP,66,443  >  53996 [ACK] Seq=55507 Ack=3347 Win=17 Len=0 TSval=1715262875 TSecr=1969354416
100,3.132788,172.66.164.67,100.86.121.59,TLSv1.2,223,Application Data
101,3.13279,172.66.164.67,100.86.121.59,TCP,1514,443  >  53996 [ACK] Seq=55664 Ack=3347 Win=17 Len=1448 TSval=1715264090 TSecr=1969354416 [TCP PDU reassembled in 104]
102,3.132851,100.86.121.59,172.66.164.67,TCP,66,53996  >  443 [ACK] Seq=3347 Ack=57112 Win=2023 Len=0 TSval=1969355685 TSecr=1715264090
103,3.133185,172.66.164.67,100.86.121.59,TCP,1514,443  >  53996 [ACK] Seq=57112 Ack=3347 Win=17 Len=1448 TSval=1715264090 TSecr=1969354416 [TCP PDU reassembled in 104]
104,3.133186,172.66.164.67,100.86.121.59,TLSv1.2,1323,Application Data
105,3.13322,100.86.121.59,172.66.164.67,TCP,66,53996  >  443 [ACK] Seq=3347 Ack=59817 Win=2006 Len=0 TSval=1969355685 TSecr=1715264090
106,3.139584,172.66.164.67,100.86.121.59,TCP,1514,443  >  53996 [ACK] Seq=59817 Ack=3347 Win=17 Len=1448 TSval=1715264096 TSecr=1969354416 [TCP PDU reassembled in 113]
107,3.139586,172.66.164.67,100.86.121.59,TCP,1514,443  >  53996 [ACK] Seq=61265 Ack=3347 Win=17 Len=1448 TSval=1715264096 TSecr=1969354416 [TCP PDU reassembled in 113]
108,3.139658,100.86.121.59,172.66.164.67,TCP,66,53996  >  443 [ACK] Seq=3347 Ack=62713 Win=2003 Len=0 TSval=1969355691 TSecr=1715264096
109,3.13981,100.86.121.59,172.66.164.67,TCP,66,[TCP Window Update] 53996  >  443 [ACK] Seq=3347 Ack=62713 Win=2048 Len=0 TSval=1969355692 TSecr=1715264096
110,3.141221,172.66.164.67,100.86.121.59,TCP,1514,443  >  53996 [ACK] Seq=62713 Ack=3347 Win=17 Len=1448 TSval=1715264096 TSecr=1969354416 [TCP PDU reassembled in 113]
111,3.141223,172.66.164.67,100.86.121.59,TCP,1514,443  >  53996 [ACK] Seq=64161 Ack=3347 Win=17 Len=1448 TSval=1715264096 TSecr=1969354416 [TCP PDU reassembled in 113]
112,3.141225,172.66.164.67,100.86.121.59,TCP,1514,443  >  53996 [ACK] Seq=65609 Ack=3347 Win=17 Len=1448 TSval=1715264096 TSecr=1969354416 [TCP PDU reassembled in 113]
113,3.141227,172.66.164.67,100.86.121.59,TLSv1.2,1022,Application Data
114,3.141231,172.66.164.67,100.86.121.59,TLSv1.2,1470,Application Data
115,3.141312,100.86.121.59,172.66.164.67,TCP,66,53996  >  443 [ACK] Seq=3347 Ack=69417 Win=1944 Len=0 TSval=1969355693 TSecr=1715264097
116,3.141359,100.86.121.59,172.66.164.67,TCP,66,[TCP Window Update] 53996  >  443 [ACK] Seq=3347 Ack=69417 Win=2048 Len=0 TSval=1969355693 TSecr=1715264097
117,3.143332,172.66.164.67,100.86.121.59,TCP,1514,443  >  53996 [ACK] Seq=69417 Ack=3347 Win=17 Len=1448 TSval=1715264100 TSecr=1969355685 [TCP PDU reassembled in 118]
118,3.143333,172.66.164.67,100.86.121.59,TLSv1.2,1197,Application Data
119,3.143362,100.86.121.59,172.66.164.67,TCP,66,53996  >  443 [ACK] Seq=3347 Ack=71996 Win=2008 Len=0 TSval=1969355695 TSecr=1715264100
120,3.145551,172.66.164.67,100.86.121.59,TLSv1.2,110,Application Data
121,3.145585,100.86.121.59,172.66.164.67,TCP,66,53996  >  443 [ACK] Seq=3347 Ack=72040 Win=2048 Len=0 TSval=1969355697 TSecr=1715264101
122,3.146787,172.66.164.67,100.86.121.59,TCP,1514,443  >  53996 [ACK] Seq=72040 Ack=3347 Win=17 Len=1448 TSval=1715264104 TSecr=1969355685 [TCP PDU reassembled in 135]
123,3.146826,100.86.121.59,172.66.164.67,TCP,66,53996  >  443 [ACK] Seq=3347 Ack=73488 Win=2026 Len=0 TSval=1969355699 TSecr=1715264104
124,3.147209,172.66.164.67,100.86.121.59,TCP,1514,443  >  53996 [ACK] Seq=73488 Ack=3347 Win=17 Len=1448 TSval=1715264104 TSecr=1969355685 [TCP PDU reassembled in 135]
125,3.147211,172.66.164.67,100.86.121.59,TCP,1514,443  >  53996 [ACK] Seq=74936 Ack=3347 Win=17 Len=1448 TSval=1715264104 TSecr=1969355685 [TCP PDU reassembled in 135]
126,3.147226,100.86.121.59,172.66.164.67,TCP,66,53996  >  443 [ACK] Seq=3347 Ack=76384 Win=2003 Len=0 TSval=1969355699 TSecr=1715264104
127,3.147279,100.86.121.59,172.66.164.67,TCP,66,[TCP Window Update] 53996  >  443 [ACK] Seq=3347 Ack=76384 Win=2048 Len=0 TSval=1969355699 TSecr=1715264104
128,3.148287,172.66.164.67,100.86.121.59,TCP,1514,443  >  53996 [ACK] Seq=76384 Ack=3347 Win=17 Len=1448 TSval=1715264104 TSecr=1969355685 [TCP PDU reassembled in 135]
129,3.148289,172.66.164.67,100.86.121.59,TCP,1514,443  >  53996 [ACK] Seq=77832 Ack=3347 Win=17 Len=1448 TSval=1715264104 TSecr=1969355685 [TCP PDU reassembled in 135]
130,3.14829,172.66.164.67,100.86.121.59,TCP,1514,443  >  53996 [ACK] Seq=79280 Ack=3347 Win=17 Len=1448 TSval=1715264104 TSecr=1969355685 [TCP PDU reassembled in 135]
131,3.148292,172.66.164.67,100.86.121.59,TCP,1514,443  >  53996 [ACK] Seq=80728 Ack=3347 Win=17 Len=1448 TSval=1715264104 TSecr=1969355685 [TCP PDU reassembled in 135]
132,3.148293,172.66.164.67,100.86.121.59,TCP,1514,"443  >  53996 [PSH, ACK] Seq=82176 Ack=3347 Win=17 Len=1448 TSval=1715264104 TSecr=1969355685 [TCP PDU reassembled in 135]"
133,3.148295,172.66.164.67,100.86.121.59,TCP,1514,443  >  53996 [ACK] Seq=83624 Ack=3347 Win=17 Len=1448 TSval=1715264104 TSecr=1969355685 [TCP PDU reassembled in 135]
134,3.148296,172.66.164.67,100.86.121.59,TCP,1514,443  >  53996 [ACK] Seq=85072 Ack=3347 Win=17 Len=1448 TSval=1715264104 TSecr=1969355685 [TCP PDU reassembled in 135]
135,3.148298,172.66.164.67,100.86.121.59,TLSv1.2,405,"Application Data, Application Data"
136,3.148343,100.86.121.59,172.66.164.67,TCP,66,53996  >  443 [ACK] Seq=3347 Ack=86859 Win=1885 Len=0 TSval=1969355700 TSecr=1715264104
137,3.148479,100.86.121.59,172.66.164.67,TCP,66,[TCP Window Update] 53996  >  443 [ACK] Seq=3347 Ack=86859 Win=2048 Len=0 TSval=1969355700 TSecr=1715264104
138,3.20964,100.86.121.59,172.66.164.67,TLSv1.2,1362,Application Data
139,3.219457,172.66.164.67,100.86.121.59,TCP,66,443  >  53996 [ACK] Seq=86859 Ack=4643 Win=17 Len=0 TSval=1715264177 TSecr=1969355761
140,3.233429,100.86.121.59,172.66.164.67,TLSv1.2,583,Application Data
141,3.234569,100.86.121.59,172.66.164.67,TLSv1.2,249,Application Data
142,3.234752,100.86.121.59,172.66.164.67,TLSv1.2,245,Application Data
143,3.234905,100.86.121.59,172.66.164.67,TLSv1.2,199,Application Data
144,3.235006,100.86.121.59,172.66.164.67,TLSv1.2,196,Application Data
145,3.243111,172.66.164.67,100.86.121.59,TLSv1.2,209,Application Data
146,3.243113,172.66.164.67,100.86.121.59,TLSv1.2,108,Application Data
147,3.243142,172.66.164.67,100.86.121.59,TLSv1.2,97,Application Data
148,3.243231,100.86.121.59,172.66.164.67,TCP,66,53996  >  443 [ACK] Seq=5785 Ack=87044 Win=2046 Len=0 TSval=1969355795 TSecr=1715264200
149,3.243299,100.86.121.59,172.66.164.67,TCP,66,53996  >  443 [ACK] Seq=5785 Ack=87075 Win=2046 Len=0 TSval=1969355795 TSecr=1715264200
150,3.24419,172.66.164.67,100.86.121.59,TCP,66,443  >  53996 [ACK] Seq=87075 Ack=5343 Win=17 Len=0 TSval=1715264201 TSecr=1969355785
151,3.244971,172.66.164.67,100.86.121.59,TCP,66,443  >  53996 [ACK] Seq=87075 Ack=5785 Win=17 Len=0 TSval=1715264202 TSecr=1969355786
152,3.267431,172.66.164.67,100.86.121.59,TLSv1.2,127,Application Data
153,3.267482,100.86.121.59,172.66.164.67,TCP,66,53996  >  443 [ACK] Seq=5785 Ack=87136 Win=2048 Len=0 TSval=1969355819 TSecr=1715264225
154,3.268152,172.66.164.67,100.86.121.59,TLSv1.2,290,Application Data
155,3.268153,172.66.164.67,100.86.121.59,TLSv1.2,97,Application Data
156,3.268183,100.86.121.59,172.66.164.67,TCP,66,53996  >  443 [ACK] Seq=5785 Ack=87391 Win=2045 Len=0 TSval=1969355820 TSecr=1715264225
157,3.270232,172.66.164.67,100.86.121.59,TLSv1.2,127,Application Data
158,3.270277,100.86.121.59,172.66.164.67,TCP,66,53996  >  443 [ACK] Seq=5785 Ack=87452 Win=2048 Len=0 TSval=1969355822 TSecr=1715264228
159,3.270897,172.66.164.67,100.86.121.59,TLSv1.2,290,Application Data
160,3.270898,172.66.164.67,100.86.121.59,TLSv1.2,97,Application Data
161,3.270935,100.86.121.59,172.66.164.67,TCP,66,53996  >  443 [ACK] Seq=5785 Ack=87707 Win=2045 Len=0 TSval=1969355823 TSecr=1715264228
162,3.272421,172.66.164.67,100.86.121.59,TLSv1.2,127,Application Data
163,3.272422,172.66.164.67,100.86.121.59,TLSv1.2,290,Application Data
164,3.272423,172.66.164.67,100.86.121.59,TLSv1.2,239,"Application Data, Application Data"
165,3.272424,172.66.164.67,100.86.121.59,TLSv1.2,290,Application Data
166,3.272425,172.66.164.67,100.86.121.59,TLSv1.2,97,Application Data
167,3.272425,172.66.164.67,100.86.121.59,TLSv1.2,135,Application Data
168,3.272426,172.66.164.67,100.86.121.59,TLSv1.2,290,Application Data
169,3.272476,100.86.121.59,172.66.164.67,TCP,66,53996  >  443 [ACK] Seq=5785 Ack=88713 Win=2033 Len=0 TSval=1969355824 TSecr=1715264228
170,3.273066,172.66.164.67,100.86.121.59,TLSv1.2,97,Application Data
171,3.273094,100.86.121.59,172.66.164.67,TCP,66,53996  >  443 [ACK] Seq=5785 Ack=88744 Win=2048 Len=0 TSval=1969355825 TSecr=1715264229
172,13.278448,100.86.121.59,172.66.164.67,TLSv1.2,197,Application Data
173,13.278519,100.86.121.59,172.66.164.67,TLSv1.2,105,Application Data
174,13.278782,100.86.121.59,172.66.164.67,TLSv1.2,199,Application Data
175,13.284483,100.86.121.59,172.66.164.67,TLSv1.2,1431,Application Data
176,13.284746,100.86.121.59,172.66.164.67,TLSv1.2,583,Application Data
177,13.284936,100.86.121.59,172.66.164.67,TLSv1.2,251,Application Data
178,13.290706,172.66.164.67,100.86.121.59,TCP,66,443  >  53996 [ACK] Seq=88744 Ack=6088 Win=17 Len=0 TSval=1715274248 TSecr=1969365830
179,13.290709,172.66.164.67,100.86.121.59,TLSv1.2,105,Application Data
180,13.290896,100.86.121.59,172.66.164.67,TCP,66,53996  >  443 [ACK] Seq=8155 Ack=88783 Win=2048 Len=0 TSval=1969365842 TSecr=1715274248
181,13.295392,172.66.164.67,100.86.121.59,TCP,66,443  >  53996 [ACK] Seq=88783 Ack=7970 Win=17 Len=0 TSval=1715274253 TSecr=1969365836
182,13.315106,172.66.164.67,100.86.121.59,TLSv1.2,150,Application Data
183,13.31524,100.86.121.59,172.66.164.67,TCP,66,53996  >  443 [ACK] Seq=8155 Ack=88867 Win=2047 Len=0 TSval=1969365867 TSecr=1715274272
184,13.316697,172.66.164.67,100.86.121.59,TLSv1.2,290,Application Data
185,13.316699,172.66.164.67,100.86.121.59,TLSv1.2,97,Application Data
186,13.31677,100.86.121.59,172.66.164.67,TCP,66,53996  >  443 [ACK] Seq=8155 Ack=89122 Win=2045 Len=0 TSval=1969365868 TSecr=1715274273
187,13.316897,172.66.164.67,100.86.121.59,TLSv1.2,127,Application Data
188,13.316899,172.66.164.67,100.86.121.59,TLSv1.2,290,Application Data
189,13.316938,100.86.121.59,172.66.164.67,TCP,66,53996  >  443 [ACK] Seq=8155 Ack=89407 Win=2044 Len=0 TSval=1969365869 TSecr=1715274274
190,13.31711,172.66.164.67,100.86.121.59,TLSv1.2,97,Application Data
191,13.317138,100.86.121.59,172.66.164.67,TCP,66,53996  >  443 [ACK] Seq=8155 Ack=89438 Win=2044 Len=0 TSval=1969365869 TSecr=1715274274
192,13.317297,172.66.164.67,100.86.121.59,TLSv1.2,163,Application Data
193,13.317298,172.66.164.67,100.86.121.59,TLSv1.2,290,Application Data
194,13.317299,172.66.164.67,100.86.121.59,TLSv1.2,97,Application Data
195,13.317333,100.86.121.59,172.66.164.67,TCP,66,53996  >  443 [ACK] Seq=8155 Ack=89790 Win=2039 Len=0 TSval=1969365869 TSecr=1715274274
196,13.317916,100.86.121.59,172.66.164.67,TLSv1.2,101,Application Data
197,13.318136,172.66.164.67,100.86.121.59,TLSv1.2,127,Application Data
198,13.318137,172.66.164.67,100.86.121.59,TLSv1.2,290,Application Data
199,13.318186,100.86.121.59,172.66.164.67,TCP,66,53996  >  443 [ACK] Seq=8190 Ack=90075 Win=2044 Len=0 TSval=1969365870 TSecr=1715274275
200,13.318383,172.66.164.67,100.86.121.59,TLSv1.2,97,Application Data
201,13.318435,100.86.121.59,172.66.164.67,TCP,66,53996  >  443 [ACK] Seq=8190 Ack=90106 Win=2044 Len=0 TSval=1969365870 TSecr=1715274276
202,13.322834,172.66.164.67,100.86.121.59,TLSv1.2,127,Application Data
203,13.322836,172.66.164.67,100.86.121.59,TLSv1.2,290,Application Data
204,13.322896,172.66.164.67,100.86.121.59,TLSv1.2,97,Application Data
205,13.322989,100.86.121.59,172.66.164.67,TCP,66,53996  >  443 [ACK] Seq=8190 Ack=90391 Win=2044 Len=0 TSval=1969365875 TSecr=1715274280
206,13.323044,100.86.121.59,172.66.164.67,TCP,66,53996  >  443 [ACK] Seq=8190 Ack=90422 Win=2044 Len=0 TSval=1969365875 TSecr=1715274280
207,13.368815,172.66.164.67,100.86.121.59,TCP,66,443  >  53996 [ACK] Seq=90422 Ack=8190 Win=17 Len=0 TSval=1715274326 TSecr=1969365870
208,15.809083,100.86.121.59,172.66.164.67,TLSv1.2,371,Application Data
209,15.894871,172.66.164.67,100.86.121.59,TCP,66,443  >  53996 [ACK] Seq=90422 Ack=8495 Win=17 Len=0 TSval=1715276812 TSecr=1969368361
210,16.642775,172.66.164.67,100.86.121.59,TLSv1.2,175,Application Data
211,16.642778,172.66.164.67,100.86.121.59,TCP,1514,443  >  53996 [ACK] Seq=90531 Ack=8495 Win=17 Len=1448 TSval=1715277545 TSecr=1969368361 [TCP PDU reassembled in 227]
212,16.642827,172.66.164.67,100.86.121.59,TCP,1514,443  >  53996 [ACK] Seq=91979 Ack=8495 Win=17 Len=1448 TSval=1715277545 TSecr=1969368361 [TCP PDU reassembled in 227]
213,16.642829,172.66.164.67,100.86.121.59,TCP,1514,443  >  53996 [ACK] Seq=93427 Ack=8495 Win=17 Len=1448 TSval=1715277545 TSecr=1969368361 [TCP PDU reassembled in 227]
214,16.642963,100.86.121.59,172.66.164.67,TCP,66,53996  >  443 [ACK] Seq=8495 Ack=91979 Win=2024 Len=0 TSval=1969369195 TSecr=1715277545
215,16.643051,100.86.121.59,172.66.164.67,TCP,66,53996  >  443 [ACK] Seq=8495 Ack=94875 Win=1979 Len=0 TSval=1969369195 TSecr=1715277545
216,16.64313,100.86.121.59,172.66.164.67,TCP,66,[TCP Window Update] 53996  >  443 [ACK] Seq=8495 Ack=94875 Win=2048 Len=0 TSval=1969369195 TSecr=1715277545
217,16.643918,172.66.164.67,100.86.121.59,TCP,1514,443  >  53996 [ACK] Seq=94875 Ack=8495 Win=17 Len=1448 TSval=1715277545 TSecr=1969368361 [TCP PDU reassembled in 227]
218,16.64392,172.66.164.67,100.86.121.59,TCP,1514,443  >  53996 [ACK] Seq=96323 Ack=8495 Win=17 Len=1448 TSval=1715277545 TSecr=1969368361 [TCP PDU reassembled in 227]
219,16.644016,100.86.121.59,172.66.164.67,TCP,66,53996  >  443 [ACK] Seq=8495 Ack=97771 Win=2003 Len=0 TSval=1969369196 TSecr=1715277545
220,16.644249,100.86.121.59,172.66.164.67,TCP,66,[TCP Window Update] 53996  >  443 [ACK] Seq=8495 Ack=97771 Win=2048 Len=0 TSval=1969369196 TSecr=1715277545
221,16.645693,172.66.164.67,100.86.121.59,TCP,1514,443  >  53996 [ACK] Seq=97771 Ack=8495 Win=17 Len=1448 TSval=1715277545 TSecr=1969368361 [TCP PDU reassembled in 227]
222,16.645696,172.66.164.67,100.86.121.59,TCP,1514,443  >  53996 [ACK] Seq=99219 Ack=8495 Win=17 Len=1448 TSval=1715277545 TSecr=1969368361 [TCP PDU reassembled in 227]
223,16.645699,172.66.164.67,100.86.121.59,TCP,1514,"443  >  53996 [PSH, ACK] Seq=100667 Ack=8495 Win=17 Len=1448 TSval=1715277545 TSecr=1969368361 [TCP PDU reassembled in 227]"
224,16.645701,172.66.164.67,100.86.121.59,TCP,1514,443  >  53996 [ACK] Seq=102115 Ack=8495 Win=17 Len=1448 TSval=1715277546 TSecr=1969368361 [TCP PDU reassembled in 227]
225,16.645703,172.66.164.67,100.86.121.59,TCP,1514,443  >  53996 [ACK] Seq=103563 Ack=8495 Win=17 Len=1448 TSval=1715277546 TSecr=1969368361 [TCP PDU reassembled in 227]
226,16.645705,172.66.164.67,100.86.121.59,TCP,1514,443  >  53996 [ACK] Seq=105011 Ack=8495 Win=17 Len=1448 TSval=1715277546 TSecr=1969368361 [TCP PDU reassembled in 227]
227,16.645707,172.66.164.67,100.86.121.59,TLSv1.2,544,Application Data
228,16.645709,172.66.164.67,100.86.121.59,TCP,1514,443  >  53996 [ACK] Seq=106937 Ack=8495 Win=17 Len=1448 TSval=1715277546 TSecr=1969368361 [TCP PDU reassembled in 238]
229,16.645711,172.66.164.67,100.86.121.59,TCP,1514,443  >  53996 [ACK] Seq=108385 Ack=8495 Win=17 Len=1448 TSval=1715277546 TSecr=1969368361 [TCP PDU reassembled in 238]
230,16.645713,172.66.164.67,100.86.121.59,TCP,1514,443  >  53996 [ACK] Seq=109833 Ack=8495 Win=17 Len=1448 TSval=1715277546 TSecr=1969368361 [TCP PDU reassembled in 238]
231,16.645716,172.66.164.67,100.86.121.59,TCP,1514,443  >  53996 [ACK] Seq=111281 Ack=8495 Win=17 Len=1448 TSval=1715277546 TSecr=1969368361 [TCP PDU reassembled in 238]
232,16.645717,172.66.164.67,100.86.121.59,TCP,1514,443  >  53996 [ACK] Seq=112729 Ack=8495 Win=17 Len=1448 TSval=1715277546 TSecr=1969368361 [TCP PDU reassembled in 238]
233,16.645719,172.66.164.67,100.86.121.59,TCP,1514,443  >  53996 [ACK] Seq=114177 Ack=8495 Win=17 Len=1448 TSval=1715277546 TSecr=1969368361 [TCP PDU reassembled in 238]
234,16.645721,172.66.164.67,100.86.121.59,TCP,1514,443  >  53996 [ACK] Seq=115625 Ack=8495 Win=17 Len=1448 TSval=1715277546 TSecr=1969368361 [TCP PDU reassembled in 238]
235,16.645723,172.66.164.67,100.86.121.59,TCP,1514,"443  >  53996 [PSH, ACK] Seq=117073 Ack=8495 Win=17 Len=1448 TSval=1715277546 TSecr=1969368361 [TCP PDU reassembled in 238]"
236,16.645724,172.66.164.67,100.86.121.59,TCP,1514,443  >  53996 [ACK] Seq=118521 Ack=8495 Win=17 Len=1448 TSval=1715277547 TSecr=1969368361 [TCP PDU reassembled in 238]
237,16.645726,172.66.164.67,100.86.121.59,TCP,1514,443  >  53996 [ACK] Seq=119969 Ack=8495 Win=17 Len=1448 TSval=1715277547 TSecr=1969368361 [TCP PDU reassembled in 238]
238,16.645728,172.66.164.67,100.86.121.59,TLSv1.2,970,"Application Data, Application Data"
239,16.64573,172.66.164.67,100.86.121.59,TCP,970,"[TCP Retransmission] 443  >  53996 [PSH, ACK] Seq=121417 Ack=8495 Win=17 Len=904 TSval=1715277573 TSecr=1969368361"
240,16.6459,100.86.121.59,172.66.164.67,TCP,66,53996  >  443 [ACK] Seq=8495 Ack=112729 Win=1815 Len=0 TSval=1969369197 TSecr=1715277546
241,16.645946,100.86.121.59,172.66.164.67,TCP,66,53996  >  443 [ACK] Seq=8495 Ack=122321 Win=1666 Len=0 TSval=1969369198 TSecr=1715277547
242,16.645966,100.86.121.59,172.66.164.67,TCP,78,[TCP Dup ACK 241#1] 53996  >  443 [ACK] Seq=8495 Ack=122321 Win=1666 Len=0 TSval=1969369198 TSecr=1715277573 SLE=121417 SRE=122321
243,16.648495,100.86.121.59,172.66.164.67,TCP,66,[TCP Window Update] 53996  >  443 [ACK] Seq=8495 Ack=122321 Win=2048 Len=0 TSval=1969369200 TSecr=1715277573
244,16.938511,100.86.121.59,172.66.164.67,TLSv1.2,210,Application Data
245,16.949062,172.66.164.67,100.86.121.59,TCP,66,443  >  53996 [ACK] Seq=122321 Ack=8639 Win=17 Len=0 TSval=1715277906 TSecr=1969369490
246,16.960314,100.86.121.59,172.66.164.67,TCP,1454,53996  >  443 [ACK] Seq=8639 Ack=122321 Win=2048 Len=1388 TSval=1969369512 TSecr=1715277906 [TCP PDU reassembled in 247]
247,16.960318,100.86.121.59,172.66.164.67,TLSv1.2,189,Application Data
248,16.960429,100.86.121.59,172.66.164.67,TLSv1.2,402,Application Data
249,16.960515,100.86.121.59,172.66.164.67,TLSv1.2,251,Application Data
250,16.960588,100.86.121.59,172.66.164.67,TLSv1.2,243,Application Data
251,16.960653,100.86.121.59,172.66.164.67,TLSv1.2,196,Application Data
252,16.970957,172.66.164.67,100.86.121.59,TCP,66,443  >  53996 [ACK] Seq=122321 Ack=10848 Win=17 Len=0 TSval=1715277928 TSecr=1969369512
253,16.970959,172.66.164.67,100.86.121.59,TCP,66,443  >  53996 [ACK] Seq=122321 Ack=10978 Win=17 Len=0 TSval=1715277928 TSecr=1969369512
254,16.977303,172.66.164.67,100.86.121.59,TLSv1.2,151,Application Data
255,16.977394,100.86.121.59,172.66.164.67,TCP,66,53996  >  443 [ACK] Seq=10978 Ack=122406 Win=2047 Len=0 TSval=1969369529 TSecr=1715277935
256,16.97749,172.66.164.67,100.86.121.59,TLSv1.2,108,Application Data
257,16.977491,172.66.164.67,100.86.121.59,TLSv1.2,97,Application Data
258,16.977511,100.86.121.59,172.66.164.67,TCP,66,53996  >  443 [ACK] Seq=10978 Ack=122479 Win=2047 Len=0 TSval=1969369529 TSecr=1715277935
259,16.995819,172.66.164.67,100.86.121.59,TLSv1.2,127,Application Data
260,16.995821,172.66.164.67,100.86.121.59,TLSv1.2,290,Application Data
261,16.995929,100.86.121.59,172.66.164.67,TCP,66,53996  >  443 [ACK] Seq=10978 Ack=122764 Win=2044 Len=0 TSval=1969369547 TSecr=1715277953
262,16.996275,172.66.164.67,100.86.121.59,TLSv1.2,97,Application Data
263,16.996302,100.86.121.59,172.66.164.67,TCP,66,53996  >  443 [ACK] Seq=10978 Ack=122795 Win=2048 Len=0 TSval=1969369548 TSecr=1715277953
264,17.001318,172.66.164.67,100.86.121.59,TLSv1.2,208,Application Data
265,17.00132,172.66.164.67,100.86.121.59,TLSv1.2,290,Application Data
266,17.001321,172.66.164.67,100.86.121.59,TLSv1.2,97,Application Data
267,17.001423,100.86.121.59,172.66.164.67,TCP,66,53996  >  443 [ACK] Seq=10978 Ack=123192 Win=2042 Len=0 TSval=1969369553 TSecr=1715277957
268,17.002351,172.66.164.67,100.86.121.59,TLSv1.2,127,Application Data
269,17.002351,172.66.164.67,100.86.121.59,TLSv1.2,290,Application Data
270,17.002352,172.66.164.67,100.86.121.59,TLSv1.2,97,Application Data
271,17.002391,100.86.121.59,172.66.164.67,TCP,66,53996  >  443 [ACK] Seq=10978 Ack=123508 Win=2044 Len=0 TSval=1969369554 TSecr=1715277958
272,17.004576,172.66.164.67,100.86.121.59,TLSv1.2,127,Application Data
273,17.004577,172.66.164.67,100.86.121.59,TLSv1.2,290,Application Data
274,17.004578,172.66.164.67,100.86.121.59,TLSv1.2,97,Application Data
275,17.004647,100.86.121.59,172.66.164.67,TCP,66,53996  >  443 [ACK] Seq=10978 Ack=123824 Win=2044 Len=0 TSval=1969369556 TSecr=1715277961
276,17.010126,172.66.164.67,100.86.121.59,TLSv1.2,127,Application Data
277,17.010127,172.66.164.67,100.86.121.59,TLSv1.2,290,Application Data
278,17.010194,100.86.121.59,172.66.164.67,TCP,66,53996  >  443 [ACK] Seq=10978 Ack=124109 Win=2044 Len=0 TSval=1969369562 TSecr=1715277967
279,17.010246,172.66.164.67,100.86.121.59,TLSv1.2,97,Application Data
280,17.010284,100.86.121.59,172.66.164.67,TCP,66,53996  >  443 [ACK] Seq=10978 Ack=124140 Win=2044 Len=0 TSval=1969369562 TSecr=1715277967
281,22.000995,100.86.121.59,172.66.164.67,TLSv1.2,195,Application Data
282,22.004425,100.86.121.59,172.66.164.67,TLSv1.2,199,Application Data
283,22.004647,100.86.121.59,172.66.164.67,TLSv1.2,253,Application Data
284,22.006896,100.86.121.59,172.66.164.67,TCP,1454,53996  >  443 [ACK] Seq=11427 Ack=124140 Win=2048 Len=1388 TSval=1969374558 TSecr=1715277967 [TCP PDU reassembled in 285]
285,22.006911,100.86.121.59,172.66.164.67,TLSv1.2,223,Application Data
286,22.012589,100.86.121.59,172.66.164.67,TLSv1.2,403,Application Data
287,22.014714,172.66.164.67,100.86.121.59,TCP,66,443  >  53996 [ACK] Seq=124140 Ack=11427 Win=17 Len=0 TSval=1715282972 TSecr=1969374553
288,22.016451,172.66.164.67,100.86.121.59,TCP,66,443  >  53996 [ACK] Seq=124140 Ack=12972 Win=17 Len=0 TSval=1715282974 TSecr=1969374558
289,22.03349,172.66.164.67,100.86.121.59,TLSv1.2,247,Application Data
290,22.033493,172.66.164.67,100.86.121.59,TLSv1.2,290,Application Data
291,22.033618,100.86.121.59,172.66.164.67,TCP,66,53996  >  443 [ACK] Seq=13309 Ack=124545 Win=2042 Len=0 TSval=1969374585 TSecr=1715282990
292,22.034246,172.66.164.67,100.86.121.59,TLSv1.2,97,Application Data
293,22.034285,100.86.121.59,172.66.164.67,TLSv1.2,101,Application Data
294,22.0343,100.86.121.59,172.66.164.67,TCP,66,53996  >  443 [ACK] Seq=13344 Ack=124576 Win=2048 Len=0 TSval=1969374586 TSecr=1715282990
295,22.034682,172.66.164.67,100.86.121.59,TLSv1.2,127,Application Data
296,22.034684,172.66.164.67,100.86.121.59,TLSv1.2,290,Application Data
297,22.034685,172.66.164.67,100.86.121.59,TLSv1.2,97,Application Data
298,22.034731,100.86.121.59,172.66.164.67,TCP,66,53996  >  443 [ACK] Seq=13344 Ack=124892 Win=2044 Len=0 TSval=1969374586 TSecr=1715282991
299,22.03628,172.66.164.67,100.86.121.59,TLSv1.2,127,Application Data
300,22.036282,172.66.164.67,100.86.121.59,TLSv1.2,290,Application Data
301,22.036346,100.86.121.59,172.66.164.67,TCP,66,53996  >  443 [ACK] Seq=13344 Ack=125177 Win=2044 Len=0 TSval=1969374588 TSecr=1715282993
302,22.03782,172.66.164.67,100.86.121.59,TLSv1.2,97,Application Data
303,22.037871,100.86.121.59,172.66.164.67,TCP,66,53996  >  443 [ACK] Seq=13344 Ack=125208 Win=2048 Len=0 TSval=1969374589 TSecr=1715282993
304,22.039557,172.66.164.67,100.86.121.59,TLSv1.2,208,Application Data
305,22.039561,172.66.164.67,100.86.121.59,TLSv1.2,290,Application Data
306,22.039617,100.86.121.59,172.66.164.67,TCP,66,53996  >  443 [ACK] Seq=13344 Ack=125574 Win=2043 Len=0 TSval=1969374591 TSecr=1715282995
307,22.039949,172.66.164.67,100.86.121.59,TLSv1.2,97,Application Data
308,22.039995,100.86.121.59,172.66.164.67,TCP,66,53996  >  443 [ACK] Seq=13344 Ack=125605 Win=2048 Len=0 TSval=1969374592 TSecr=1715282996
309,22.04677,172.66.164.67,100.86.121.59,TLSv1.2,127,Application Data
310,22.046774,172.66.164.67,100.86.121.59,TLSv1.2,290,Application Data
311,22.046977,100.86.121.59,172.66.164.67,TCP,66,53996  >  443 [ACK] Seq=13344 Ack=125890 Win=2044 Len=0 TSval=1969374598 TSecr=1715283003
312,22.047708,172.66.164.67,100.86.121.59,TLSv1.2,97,Application Data
313,22.047788,100.86.121.59,172.66.164.67,TCP,66,53996  >  443 [ACK] Seq=13344 Ack=125921 Win=2048 Len=0 TSval=1969374599 TSecr=1715283003
314,26.348368,100.86.121.59,172.66.164.67,TLSv1.2,382,Application Data
315,26.466218,172.66.164.67,100.86.121.59,TCP,66,443  >  53996 [ACK] Seq=125921 Ack=13660 Win=17 Len=0 TSval=1715287399 TSecr=1969378900
316,26.538255,172.66.164.67,100.86.121.59,TLSv1.2,271,Application Data
317,26.538378,100.86.121.59,172.66.164.67,TCP,66,53996  >  443 [ACK] Seq=13660 Ack=126126 Win=2045 Len=0 TSval=1969379090 TSecr=1715287466
318,26.538656,172.66.164.67,100.86.121.59,TCP,1514,443  >  53996 [ACK] Seq=126126 Ack=13660 Win=17 Len=1448 TSval=1715287466 TSecr=1969378900 [TCP PDU reassembled in 333]
319,26.538658,172.66.164.67,100.86.121.59,TCP,1514,443  >  53996 [ACK] Seq=127574 Ack=13660 Win=17 Len=1448 TSval=1715287466 TSecr=1969378900 [TCP PDU reassembled in 333]
320,26.53866,172.66.164.67,100.86.121.59,TCP,1514,443  >  53996 [ACK] Seq=129022 Ack=13660 Win=17 Len=1448 TSval=1715287466 TSecr=1969378900 [TCP PDU reassembled in 333]
321,26.538714,100.86.121.59,172.66.164.67,TCP,66,53996  >  443 [ACK] Seq=13660 Ack=130470 Win=1981 Len=0 TSval=1969379090 TSecr=1715287466
322,26.538749,100.86.121.59,172.66.164.67,TCP,66,[TCP Window Update] 53996  >  443 [ACK] Seq=13660 Ack=130470 Win=2048 Len=0 TSval=1969379090 TSecr=1715287466
323,26.539456,172.66.164.67,100.86.121.59,TCP,1514,443  >  53996 [ACK] Seq=130470 Ack=13660 Win=17 Len=1448 TSval=1715287466 TSecr=1969378900 [TCP PDU reassembled in 333]
324,26.539459,172.66.164.67,100.86.121.59,TCP,1514,443  >  53996 [ACK] Seq=131918 Ack=13660 Win=17 Len=1448 TSval=1715287466 TSecr=1969378900 [TCP PDU reassembled in 333]
325,26.53946,172.66.164.67,100.86.121.59,TCP,1514,443  >  53996 [ACK] Seq=133366 Ack=13660 Win=17 Len=1448 TSval=1715287466 TSecr=1969378900 [TCP PDU reassembled in 333]
326,26.539462,172.66.164.67,100.86.121.59,TCP,1514,443  >  53996 [ACK] Seq=134814 Ack=13660 Win=17 Len=1448 TSval=1715287466 TSecr=1969378900 [TCP PDU reassembled in 333]
327,26.539504,100.86.121.59,172.66.164.67,TCP,66,53996  >  443 [ACK] Seq=13660 Ack=136262 Win=1958 Len=0 TSval=1969379091 TSecr=1715287466
328,26.53967,100.86.121.59,172.66.164.67,TCP,66,[TCP Window Update] 53996  >  443 [ACK] Seq=13660 Ack=136262 Win=2048 Len=0 TSval=1969379091 TSecr=1715287466
329,26.541073,172.66.164.67,100.86.121.59,TCP,1514,"443  >  53996 [PSH, ACK] Seq=136262 Ack=13660 Win=17 Len=1448 TSval=1715287466 TSecr=1969378900 [TCP PDU reassembled in 333]"
330,26.541076,172.66.164.67,100.86.121.59,TCP,1514,443  >  53996 [ACK] Seq=137710 Ack=13660 Win=17 Len=1448 TSval=1715287467 TSecr=1969378900 [TCP PDU reassembled in 333]
331,26.541078,172.66.164.67,100.86.121.59,TCP,1514,443  >  53996 [ACK] Seq=139158 Ack=13660 Win=17 Len=1448 TSval=1715287467 TSecr=1969378900 [TCP PDU reassembled in 333]
332,26.54108,172.66.164.67,100.86.121.59,TCP,1514,443  >  53996 [ACK] Seq=140606 Ack=13660 Win=17 Len=1448 TSval=1715287467 TSecr=1969378900 [TCP PDU reassembled in 333]
333,26.541086,172.66.164.67,100.86.121.59,TLSv1.2,544,Application Data
334,26.541088,172.66.164.67,100.86.121.59,TCP,1514,443  >  53996 [ACK] Seq=142532 Ack=13660 Win=17 Len=1448 TSval=1715287467 TSecr=1969378900 [TCP PDU reassembled in 341]
335,26.54109,172.66.164.67,100.86.121.59,TCP,1514,443  >  53996 [ACK] Seq=143980 Ack=13660 Win=17 Len=1448 TSval=1715287467 TSecr=1969378900 [TCP PDU reassembled in 341]
336,26.541091,172.66.164.67,100.86.121.59,TCP,1514,443  >  53996 [ACK] Seq=145428 Ack=13660 Win=17 Len=1448 TSval=1715287467 TSecr=1969378900 [TCP PDU reassembled in 341]
337,26.541093,172.66.164.67,100.86.121.59,TCP,1514,443  >  53996 [ACK] Seq=146876 Ack=13660 Win=17 Len=1448 TSval=1715287467 TSecr=1969378900 [TCP PDU reassembled in 341]
338,26.541094,172.66.164.67,100.86.121.59,TCP,1514,443  >  53996 [ACK] Seq=148324 Ack=13660 Win=17 Len=1448 TSval=1715287467 TSecr=1969378900 [TCP PDU reassembled in 341]
339,26.541096,172.66.164.67,100.86.121.59,TCP,1514,443  >  53996 [ACK] Seq=149772 Ack=13660 Win=17 Len=1448 TSval=1715287467 TSecr=1969378900 [TCP PDU reassembled in 341]
340,26.541098,172.66.164.67,100.86.121.59,TCP,1514,443  >  53996 [ACK] Seq=151220 Ack=13660 Win=17 Len=1448 TSval=1715287467 TSecr=1969378900 [TCP PDU reassembled in 341]
341,26.5411,172.66.164.67,100.86.121.59,TLSv1.2,482,Application Data
342,26.541101,172.66.164.67,100.86.121.59,TLSv1.2,97,Application Data
343,26.541208,100.86.121.59,172.66.164.67,TCP,66,53996  >  443 [ACK] Seq=13660 Ack=151220 Win=1815 Len=0 TSval=1969379093 TSecr=1715287467
344,26.541243,100.86.121.59,172.66.164.67,TCP,66,53996  >  443 [ACK] Seq=13660 Ack=153115 Win=1786 Len=0 TSval=1969379093 TSecr=1715287468
345,26.541492,100.86.121.59,172.66.164.67,TCP,66,[TCP Window Update] 53996  >  443 [ACK] Seq=13660 Ack=153115 Win=2048 Len=0 TSval=1969379093 TSecr=1715287468
346,26.563421,172.66.164.67,100.86.121.59,TCP,97,"[TCP Spurious Retransmission] 443  >  53996 [PSH, ACK] Seq=153084 Ack=13660 Win=17 Len=31 TSval=1715287498 TSecr=1969378900"
347,26.563511,100.86.121.59,172.66.164.67,TCP,78,[TCP Dup ACK 344#1] 53996  >  443 [ACK] Seq=13660 Ack=153115 Win=2048 Len=0 TSval=1969379115 TSecr=1715287498 SLE=153084 SRE=153115
348,26.589195,100.86.121.59,172.66.164.67,TLSv1.2,258,Application Data
349,26.611528,100.86.121.59,172.66.164.67,TLSv1.2,373,Application Data
350,26.611673,100.86.121.59,172.66.164.67,TLSv1.2,1363,Application Data
351,26.611769,100.86.121.59,172.66.164.67,TLSv1.2,406,Application Data
352,26.611849,100.86.121.59,172.66.164.67,TLSv1.2,199,Application Data
353,26.611921,100.86.121.59,172.66.164.67,TLSv1.2,197,Application Data
354,26.679839,100.86.121.59,172.66.164.67,TCP,1454,"[TCP Retransmission] 53996  >  443 [PSH, ACK] Seq=14672 Ack=153115 Win=2048 Len=1388 TSval=1969379231 TSecr=1715287498"
355,26.682256,172.66.164.67,100.86.121.59,TCP,66,443  >  53996 [ACK] Seq=153115 Ack=13852 Win=17 Len=0 TSval=1715287598 TSecr=1969379141
356,26.709834,172.66.164.67,100.86.121.59,TCP,66,443  >  53996 [ACK] Seq=153115 Ack=16060 Win=17 Len=0 TSval=1715287622 TSecr=1969379163
357,26.725695,172.66.164.67,100.86.121.59,TLSv1.2,177,Application Data
358,26.725697,172.66.164.67,100.86.121.59,TLSv1.2,108,Application Data
359,26.725795,100.86.121.59,172.66.164.67,TCP,66,53996  >  443 [ACK] Seq=16060 Ack=153268 Win=2046 Len=0 TSval=1969379277 TSecr=1715287628
360,26.726156,172.66.164.67,100.86.121.59,TLSv1.2,97,Application Data
361,26.72618,100.86.121.59,172.66.164.67,TCP,66,53996  >  443 [ACK] Seq=16060 Ack=153299 Win=2048 Len=0 TSval=1969379278 TSecr=1715287628
362,26.731275,172.66.164.67,100.86.121.59,TLSv1.2,127,Application Data
363,26.731277,172.66.164.67,100.86.121.59,TLSv1.2,290,Application Data
364,26.731278,172.66.164.67,100.86.121.59,TLSv1.2,97,Application Data
365,26.73128,172.66.164.67,100.86.121.59,TLSv1.2,127,Application Data
366,26.731281,172.66.164.67,100.86.121.59,TLSv1.2,290,Application Data
367,26.731282,172.66.164.67,100.86.121.59,TLSv1.2,97,Application Data
368,26.731287,172.66.164.67,100.86.121.59,TLSv1.2,127,Application Data
369,26.731289,172.66.164.67,100.86.121.59,TLSv1.2,290,Application Data
370,26.73129,172.66.164.67,100.86.121.59,TLSv1.2,97,Application Data
371,26.731291,172.66.164.67,100.86.121.59,TLSv1.2,127,Application Data
372,26.731293,172.66.164.67,100.86.121.59,TLSv1.2,290,Application Data
373,26.731294,172.66.164.67,100.86.121.59,TLSv1.2,97,Application Data
374,26.731296,172.66.164.67,100.86.121.59,TLSv1.2,127,Application Data
375,26.731297,172.66.164.67,100.86.121.59,TLSv1.2,290,Application Data
376,26.731298,172.66.164.67,100.86.121.59,TLSv1.2,97,Application Data
377,26.73145,100.86.121.59,172.66.164.67,TCP,66,53996  >  443 [ACK] Seq=16060 Ack=154879 Win=2024 Len=0 TSval=1969379283 TSecr=1715287656
378,26.755581,172.66.164.67,100.86.121.59,TCP,78,[TCP Dup ACK 356#1] 443  >  53996 [ACK] Seq=154879 Ack=16060 Win=17 Len=0 TSval=1715287672 TSecr=1969379231 SLE=14672 SRE=16060
379,26.783266,172.66.164.67,100.86.121.59,TCP,97,"[TCP Spurious Retransmission] 443  >  53996 [PSH, ACK] Seq=154848 Ack=16060 Win=17 Len=31 TSval=1715287714 TSecr=1969379231"
380,26.783373,100.86.121.59,172.66.164.67,TCP,78,[TCP Dup ACK 377#1] 53996  >  443 [ACK] Seq=16060 Ack=154879 Win=2048 Len=0 TSval=1969379335 TSecr=1715287714 SLE=154848 SRE=154879
381,28.842797,100.86.121.59,172.66.164.67,TLSv1.2,401,Application Data
382,28.852392,172.66.164.67,100.86.121.59,TCP,66,443  >  53996 [ACK] Seq=154879 Ack=16395 Win=17 Len=0 TSval=1715289810 TSecr=1969381394
383,29.443083,172.66.164.67,100.86.121.59,TLSv1.2,209,Application Data
384,29.443087,172.66.164.67,100.86.121.59,TCP,1514,443  >  53996 [ACK] Seq=155022 Ack=16395 Win=17 Len=1448 TSval=1715290364 TSecr=1969381394 [TCP PDU reassembled in 402]
385,29.443089,172.66.164.67,100.86.121.59,TCP,1514,443  >  53996 [ACK] Seq=156470 Ack=16395 Win=17 Len=1448 TSval=1715290364 TSecr=1969381394 [TCP PDU reassembled in 402]
386,29.443092,172.66.164.67,100.86.121.59,TCP,1514,443  >  53996 [ACK] Seq=157918 Ack=16395 Win=17 Len=1448 TSval=1715290364 TSecr=1969381394 [TCP PDU reassembled in 402]
387,29.4433,100.86.121.59,172.66.164.67,TCP,66,53996  >  443 [ACK] Seq=16395 Ack=159366 Win=1978 Len=0 TSval=1969381995 TSecr=1715290364
388,29.443476,100.86.121.59,172.66.164.67,TCP,66,[TCP Window Update] 53996  >  443 [ACK] Seq=16395 Ack=159366 Win=2048 Len=0 TSval=1969381995 TSecr=1715290364
389,29.443551,172.66.164.67,100.86.121.59,TCP,1514,443  >  53996 [ACK] Seq=159366 Ack=16395 Win=17 Len=1448 TSval=1715290364 TSecr=1969381394 [TCP PDU reassembled in 402]
390,29.443554,172.66.164.67,100.86.121.59,TCP,1514,443  >  53996 [ACK] Seq=160814 Ack=16395 Win=17 Len=1448 TSval=1715290364 TSecr=1969381394 [TCP PDU reassembled in 402]
391,29.44363,100.86.121.59,172.66.164.67,TCP,66,53996  >  443 [ACK] Seq=16395 Ack=162262 Win=2003 Len=0 TSval=1969381995 TSecr=1715290364
392,29.444022,100.86.121.59,172.66.164.67,TCP,66,[TCP Window Update] 53996  >  443 [ACK] Seq=16395 Ack=162262 Win=2048 Len=0 TSval=1969381996 TSecr=1715290364
393,29.444302,172.66.164.67,100.86.121.59,TCP,1514,443  >  53996 [ACK] Seq=162262 Ack=16395 Win=17 Len=1448 TSval=1715290364 TSecr=1969381394 [TCP PDU reassembled in 402]
394,29.444305,172.66.164.67,100.86.121.59,TCP,1514,443  >  53996 [ACK] Seq=163710 Ack=16395 Win=17 Len=1448 TSval=1715290364 TSecr=1969381394 [TCP PDU reassembled in 402]
395,29.444353,100.86.121.59,172.66.164.67,TCP,66,53996  >  443 [ACK] Seq=16395 Ack=165158 Win=2003 Len=0 TSval=1969381996 TSecr=1715290364
396,29.444512,100.86.121.59,172.66.164.67,TCP,66,[TCP Window Update] 53996  >  443 [ACK] Seq=16395 Ack=165158 Win=2048 Len=0 TSval=1969381996 TSecr=1715290364
397,29.44476,172.66.164.67,100.86.121.59,TCP,1514,"443  >  53996 [PSH, ACK] Seq=165158 Ack=16395 Win=17 Len=1448 TSval=1715290364 TSecr=1969381394 [TCP PDU reassembled in 402]"
398,29.444763,172.66.164.67,100.86.121.59,TCP,1514,443  >  53996 [ACK] Seq=166606 Ack=16395 Win=17 Len=1448 TSval=1715290365 TSecr=1969381394 [TCP PDU reassembled in 402]
399,29.4454,172.66.164.67,100.86.121.59,TCP,1514,443  >  53996 [ACK] Seq=168054 Ack=16395 Win=17 Len=1448 TSval=1715290365 TSecr=1969381394 [TCP PDU reassembled in 402]
400,29.445402,172.66.164.67,100.86.121.59,TCP,1514,443  >  53996 [ACK] Seq=169502 Ack=16395 Win=17 Len=1448 TSval=1715290365 TSecr=1969381394 [TCP PDU reassembled in 402]
401,29.445491,100.86.121.59,172.66.164.67,TCP,66,53996  >  443 [ACK] Seq=16395 Ack=170950 Win=1958 Len=0 TSval=1969381997 TSecr=1715290365
402,29.446072,172.66.164.67,100.86.121.59,TLSv1.2,544,Application Data
403,29.446075,172.66.164.67,100.86.121.59,TCP,1514,443  >  53996 [ACK] Seq=171428 Ack=16395 Win=17 Len=1448 TSval=1715290366 TSecr=1969381394 [TCP PDU reassembled in 407]
404,29.446077,172.66.164.67,100.86.121.59,TCP,1514,443  >  53996 [ACK] Seq=172876 Ack=16395 Win=17 Len=1448 TSval=1715290366 TSecr=1969381394 [TCP PDU reassembled in 407]
405,29.446079,172.66.164.67,100.86.121.59,TCP,1514,443  >  53996 [ACK] Seq=174324 Ack=16395 Win=17 Len=1448 TSval=1715290366 TSecr=1969381394 [TCP PDU reassembled in 407]
406,29.446082,172.66.164.67,100.86.121.59,TCP,1514,443  >  53996 [ACK] Seq=175772 Ack=16395 Win=17 Len=1448 TSval=1715290366 TSecr=1969381394 [TCP PDU reassembled in 407]
407,29.446085,172.66.164.67,100.86.121.59,TLSv1.2,958,Application Data
408,29.446087,172.66.164.67,100.86.121.59,TLSv1.2,97,Application Data
409,29.446176,100.86.121.59,172.66.164.67,TCP,66,53996  >  443 [ACK] Seq=16395 Ack=178143 Win=1846 Len=0 TSval=1969381998 TSecr=1715290366
410,29.446772,100.86.121.59,172.66.164.67,TCP,66,[TCP Window Update] 53996  >  443 [ACK] Seq=16395 Ack=178143 Win=2048 Len=0 TSval=1969381998 TSecr=1715290366
411,29.44921,100.86.121.59,172.66.164.67,TLSv1.2,101,Application Data
412,29.45895,172.66.164.67,100.86.121.59,TCP,66,443  >  53996 [ACK] Seq=178143 Ack=16430 Win=17 Len=0 TSval=1715290416 TSecr=1969382001
413,29.493129,100.86.121.59,172.66.164.67,TLSv1.2,277,Application Data
414,29.503225,172.66.164.67,100.86.121.59,TCP,66,443  >  53996 [ACK] Seq=178143 Ack=16641 Win=17 Len=0 TSval=1715290460 TSecr=1969382045
415,29.516871,100.86.121.59,172.66.164.67,TCP,1454,53996  >  443 [ACK] Seq=16641 Ack=178143 Win=2048 Len=1388 TSval=1969382068 TSecr=1715290460 [TCP PDU reassembled in 416]
416,29.516876,100.86.121.59,172.66.164.67,TLSv1.2,157,Application Data
417,29.516994,100.86.121.59,172.66.164.67,TLSv1.2,403,Application Data
418,29.517117,100.86.121.59,172.66.164.67,TLSv1.2,200,Application Data
419,29.517216,100.86.121.59,172.66.164.67,TLSv1.2,198,Application Data
420,29.517329,100.86.121.59,172.66.164.67,TLSv1.2,197,Application Data
421,29.537125,172.66.164.67,100.86.121.59,TLSv1.2,128,Application Data
422,29.537126,172.66.164.67,100.86.121.59,TLSv1.2,108,Application Data
423,29.537127,172.66.164.67,100.86.121.59,TLSv1.2,97,Application Data
424,29.53713,172.66.164.67,100.86.121.59,TCP,66,443  >  53996 [ACK] Seq=178278 Ack=18854 Win=17 Len=0 TSval=1715290488 TSecr=1969382069
425,29.537214,100.86.121.59,172.66.164.67,TCP,66,53996  >  443 [ACK] Seq=18854 Ack=178278 Win=2046 Len=0 TSval=1969382089 TSecr=1715290482
426,29.550599,172.66.164.67,100.86.121.59,TLSv1.2,127,Application Data
427,29.550601,172.66.164.67,100.86.121.59,TLSv1.2,290,Application Data
428,29.550686,172.66.164.67,100.86.121.59,TLSv1.2,97,Application Data
429,29.550716,100.86.121.59,172.66.164.67,TCP,66,53996  >  443 [ACK] Seq=18854 Ack=178563 Win=2044 Len=0 TSval=1969382102 TSecr=1715290508
430,29.550767,100.86.121.59,172.66.164.67,TCP,66,53996  >  443 [ACK] Seq=18854 Ack=178594 Win=2044 Len=0 TSval=1969382102 TSecr=1715290508
431,29.553018,172.66.164.67,100.86.121.59,TLSv1.2,127,Application Data
432,29.553075,100.86.121.59,172.66.164.67,TCP,66,53996  >  443 [ACK] Seq=18854 Ack=178655 Win=2048 Len=0 TSval=1969382105 TSecr=1715290510
433,29.553195,172.66.164.67,100.86.121.59,TLSv1.2,290,Application Data
434,29.553196,172.66.164.67,100.86.121.59,TLSv1.2,97,Application Data
435,29.55325,100.86.121.59,172.66.164.67,TCP,66,53996  >  443 [ACK] Seq=18854 Ack=178910 Win=2045 Len=0 TSval=1969382105 TSecr=1715290510
436,29.553642,172.66.164.67,100.86.121.59,TLSv1.2,127,Application Data
437,29.553643,172.66.164.67,100.86.121.59,TLSv1.2,290,Application Data
438,29.553644,172.66.164.67,100.86.121.59,TLSv1.2,97,Application Data
439,29.553666,100.86.121.59,172.66.164.67,TCP,66,53996  >  443 [ACK] Seq=18854 Ack=179226 Win=2044 Len=0 TSval=1969382105 TSecr=1715290510
440,29.553735,172.66.164.67,100.86.121.59,TLSv1.2,127,Application Data
441,29.553736,172.66.164.67,100.86.121.59,TLSv1.2,290,Application Data
442,29.55375,100.86.121.59,172.66.164.67,TCP,66,53996  >  443 [ACK] Seq=18854 Ack=179511 Win=2044 Len=0 TSval=1969382105 TSecr=1715290511
443,29.553965,172.66.164.67,100.86.121.59,TLSv1.2,97,Application Data
444,29.55398,100.86.121.59,172.66.164.67,TCP,66,53996  >  443 [ACK] Seq=18854 Ack=179542 Win=2048 Len=0 TSval=1969382106 TSecr=1715290511
445,29.558804,172.66.164.67,100.86.121.59,TLSv1.2,127,Application Data
446,29.558806,172.66.164.67,100.86.121.59,TLSv1.2,290,Application Data
447,29.558873,172.66.164.67,100.86.121.59,TLSv1.2,97,Application Data
448,29.558893,100.86.121.59,172.66.164.67,TCP,66,53996  >  443 [ACK] Seq=18854 Ack=179827 Win=2044 Len=0 TSval=1969382110 TSecr=1715290516
449,29.558939,100.86.121.59,172.66.164.67,TCP,66,53996  >  443 [ACK] Seq=18854 Ack=179858 Win=2044 Len=0 TSval=1969382110 TSecr=1715290516
450,33.625844,100.86.121.59,172.66.164.67,TLSv1.2,424,Application Data
451,33.676163,172.66.164.67,100.86.121.59,TCP,66,443  >  53996 [ACK] Seq=179858 Ack=19212 Win=17 Len=0 TSval=1715294634 TSecr=1969386177
452,33.953704,172.66.164.67,100.86.121.59,TLSv1.2,175,Application Data
453,33.953708,172.66.164.67,100.86.121.59,TCP,1514,443  >  53996 [ACK] Seq=179967 Ack=19212 Win=17 Len=1448 TSval=1715294910 TSecr=1969386177 [TCP PDU reassembled in 467]
454,33.953922,100.86.121.59,172.66.164.67,TCP,66,53996  >  443 [ACK] Seq=19212 Ack=181415 Win=2024 Len=0 TSval=1969386505 TSecr=1715294910
455,33.955778,172.66.164.67,100.86.121.59,TCP,1514,443  >  53996 [ACK] Seq=181415 Ack=19212 Win=17 Len=1448 TSval=1715294910 TSecr=1969386177 [TCP PDU reassembled in 467]
456,33.955781,172.66.164.67,100.86.121.59,TCP,1514,443  >  53996 [ACK] Seq=182863 Ack=19212 Win=17 Len=1448 TSval=1715294910 TSecr=1969386177 [TCP PDU reassembled in 467]
457,33.955785,172.66.164.67,100.86.121.59,TCP,1514,443  >  53996 [ACK] Seq=184311 Ack=19212 Win=17 Len=1448 TSval=1715294910 TSecr=1969386177 [TCP PDU reassembled in 467]
458,33.955787,172.66.164.67,100.86.121.59,TCP,1514,443  >  53996 [ACK] Seq=185759 Ack=19212 Win=17 Len=1448 TSval=1715294910 TSecr=1969386177 [TCP PDU reassembled in 467]
459,33.955791,172.66.164.67,100.86.121.59,TCP,1514,443  >  53996 [ACK] Seq=187207 Ack=19212 Win=17 Len=1448 TSval=1715294910 TSecr=1969386177 [TCP PDU reassembled in 467]
460,33.955794,172.66.164.67,100.86.121.59,TCP,1514,443  >  53996 [ACK] Seq=188655 Ack=19212 Win=17 Len=1448 TSval=1715294910 TSecr=1969386177 [TCP PDU reassembled in 467]
461,33.955889,100.86.121.59,172.66.164.67,TCP,66,53996  >  443 [ACK] Seq=19212 Ack=190103 Win=1913 Len=0 TSval=1969386507 TSecr=1715294910
462,33.956126,100.86.121.59,172.66.164.67,TCP,66,[TCP Window Update] 53996  >  443 [ACK] Seq=19212 Ack=190103 Win=2048 Len=0 TSval=1969386508 TSecr=1715294910
463,33.957263,172.66.164.67,100.86.121.59,TCP,1514,"443  >  53996 [PSH, ACK] Seq=190103 Ack=19212 Win=17 Len=1448 TSval=1715294910 TSecr=1969386177 [TCP PDU reassembled in 467]"
464,33.957265,172.66.164.67,100.86.121.59,TCP,1514,443  >  53996 [ACK] Seq=191551 Ack=19212 Win=17 Len=1448 TSval=1715294911 TSecr=1969386177 [TCP PDU reassembled in 467]
465,33.957267,172.66.164.67,100.86.121.59,TCP,1514,443  >  53996 [ACK] Seq=192999 Ack=19212 Win=17 Len=1448 TSval=1715294911 TSecr=1969386177 [TCP PDU reassembled in 467]
466,33.957269,172.66.164.67,100.86.121.59,TCP,1514,443  >  53996 [ACK] Seq=194447 Ack=19212 Win=17 Len=1448 TSval=1715294911 TSecr=1969386177 [TCP PDU reassembled in 467]
467,33.957272,172.66.164.67,100.86.121.59,TLSv1.2,544,Application Data
468,33.957387,100.86.121.59,172.66.164.67,TCP,66,53996  >  443 [ACK] Seq=19212 Ack=196373 Win=1951 Len=0 TSval=1969386509 TSecr=1715294911
469,33.957452,100.86.121.59,172.66.164.67,TCP,66,[TCP Window Update] 53996  >  443 [ACK] Seq=19212 Ack=196373 Win=2048 Len=0 TSval=1969386509 TSecr=1715294911
470,33.958601,172.66.164.67,100.86.121.59,TCP,1514,443  >  53996 [ACK] Seq=196373 Ack=19212 Win=17 Len=1448 TSval=1715294911 TSecr=1969386177 [TCP PDU reassembled in 478]
471,33.958604,172.66.164.67,100.86.121.59,TCP,1514,443  >  53996 [ACK] Seq=197821 Ack=19212 Win=17 Len=1448 TSval=1715294911 TSecr=1969386177 [TCP PDU reassembled in 478]
472,33.958606,172.66.164.67,100.86.121.59,TCP,1514,443  >  53996 [ACK] Seq=199269 Ack=19212 Win=17 Len=1448 TSval=1715294911 TSecr=1969386177 [TCP PDU reassembled in 478]
473,33.958609,172.66.164.67,100.86.121.59,TCP,1514,443  >  53996 [ACK] Seq=200717 Ack=19212 Win=17 Len=1448 TSval=1715294911 TSecr=1969386177 [TCP PDU reassembled in 478]
474,33.958611,172.66.164.67,100.86.121.59,TCP,1514,443  >  53996 [ACK] Seq=202165 Ack=19212 Win=17 Len=1448 TSval=1715294911 TSecr=1969386177 [TCP PDU reassembled in 478]
475,33.958613,172.66.164.67,100.86.121.59,TCP,1514,443  >  53996 [ACK] Seq=203613 Ack=19212 Win=17 Len=1448 TSval=1715294911 TSecr=1969386177 [TCP PDU reassembled in 478]
476,33.958615,172.66.164.67,100.86.121.59,TCP,1514,443  >  53996 [ACK] Seq=205061 Ack=19212 Win=17 Len=1448 TSval=1715294911 TSecr=1969386177 [TCP PDU reassembled in 478]
477,33.958617,172.66.164.67,100.86.121.59,TCP,1514,"443  >  53996 [PSH, ACK] Seq=206509 Ack=19212 Win=17 Len=1448 TSval=1715294911 TSecr=1969386177 [TCP PDU reassembled in 478]"
478,33.958618,172.66.164.67,100.86.121.59,TLSv1.2,1339,"Application Data, Application Data"
479,33.95874,100.86.121.59,172.66.164.67,TCP,66,53996  >  443 [ACK] Seq=19212 Ack=209230 Win=1848 Len=0 TSval=1969386510 TSecr=1715294912
480,33.95882,100.86.121.59,172.66.164.67,TCP,66,[TCP Window Update] 53996  >  443 [ACK] Seq=19212 Ack=209230 Win=2048 Len=0 TSval=1969386510 TSecr=1715294912
481,34.003693,100.86.121.59,172.66.164.67,TLSv1.2,300,Application Data
482,34.010825,100.86.121.59,172.66.164.67,TCP,54,53996  >  443 [ACK] Seq=19211 Ack=209230 Win=2048 Len=0
483,34.019949,172.66.164.67,100.86.121.59,TCP,66,443  >  53996 [ACK] Seq=209230 Ack=19446 Win=17 Len=0 TSval=1715294971 TSecr=1969386555
484,34.024007,172.66.164.67,100.86.121.59,TCP,66,[TCP Dup ACK 483#1] 443  >  53996 [ACK] Seq=209230 Ack=19446 Win=17 Len=0 TSval=1715294980 TSecr=1969386555
485,34.029415,100.86.121.59,172.66.164.67,TCP,1454,53996  >  443 [ACK] Seq=19446 Ack=209230 Win=2048 Len=1388 TSval=1969386581 TSecr=1715294980 [TCP PDU reassembled in 486]
486,34.029428,100.86.121.59,172.66.164.67,TLSv1.2,156,Application Data
487,34.029894,100.86.121.59,172.66.164.67,TLSv1.2,402,Application Data
488,34.029995,100.86.121.59,172.66.164.67,TLSv1.2,201,Application Data
489,34.030073,100.86.121.59,172.66.164.67,TLSv1.2,198,Application Data
490,34.030141,100.86.121.59,172.66.164.67,TLSv1.2,196,Application Data
491,34.058475,172.66.164.67,100.86.121.59,TLSv1.2,146,Application Data
492,34.058477,172.66.164.67,100.86.121.59,TLSv1.2,108,Application Data
493,34.058477,172.66.164.67,100.86.121.59,TLSv1.2,97,Application Data
494,34.058558,100.86.121.59,172.66.164.67,TCP,66,53996  >  443 [ACK] Seq=21657 Ack=209383 Win=2046 Len=0 TSval=1969386610 TSecr=1715294994
495,34.059595,172.66.164.67,100.86.121.59,TCP,66,443  >  53996 [ACK] Seq=209383 Ack=20924 Win=17 Len=0 TSval=1715294997 TSecr=1969386581
496,34.059598,172.66.164.67,100.86.121.59,TCP,66,443  >  53996 [ACK] Seq=209383 Ack=21657 Win=17 Len=0 TSval=1715294998 TSecr=1969386581
497,34.064642,172.66.164.67,100.86.121.59,TLSv1.2,208,Application Data
498,34.064644,172.66.164.67,100.86.121.59,TLSv1.2,290,Application Data
499,34.064709,100.86.121.59,172.66.164.67,TCP,66,53996  >  443 [ACK] Seq=21657 Ack=209749 Win=2043 Len=0 TSval=1969386616 TSecr=1715295021
500,34.065197,172.66.164.67,100.86.121.59,TLSv1.2,97,Application Data
501,34.065219,100.86.121.59,172.66.164.67,TCP,66,53996  >  443 [ACK] Seq=21657 Ack=209780 Win=2048 Len=0 TSval=1969386617 TSecr=1715295021
502,34.065517,172.66.164.67,100.86.121.59,TLSv1.2,163,Application Data
503,34.065518,172.66.164.67,100.86.121.59,TLSv1.2,290,Application Data
504,34.065534,100.86.121.59,172.66.164.67,TCP,66,53996  >  443 [ACK] Seq=21657 Ack=210101 Win=2043 Len=0 TSval=1969386617 TSecr=1715295022
505,34.065686,172.66.164.67,100.86.121.59,TLSv1.2,97,Application Data
506,34.065706,100.86.121.59,172.66.164.67,TCP,66,53996  >  443 [ACK] Seq=21657 Ack=210132 Win=2048 Len=0 TSval=1969386617 TSecr=1715295023
507,34.067109,172.66.164.67,100.86.121.59,TLSv1.2,127,Application Data
508,34.06711,172.66.164.67,100.86.121.59,TLSv1.2,290,Application Data
509,34.067137,100.86.121.59,172.66.164.67,TCP,66,53996  >  443 [ACK] Seq=21657 Ack=210417 Win=2044 Len=0 TSval=1969386619 TSecr=1715295024
510,34.067201,172.66.164.67,100.86.121.59,TLSv1.2,97,Application Data
511,34.067216,100.86.121.59,172.66.164.67,TCP,66,53996  >  443 [ACK] Seq=21657 Ack=210448 Win=2048 Len=0 TSval=1969386619 TSecr=1715295024
512,34.072163,172.66.164.67,100.86.121.59,TLSv1.2,127,Application Data
513,34.072165,172.66.164.67,100.86.121.59,TLSv1.2,290,Application Data
514,34.072187,100.86.121.59,172.66.164.67,TCP,66,53996  >  443 [ACK] Seq=21657 Ack=210733 Win=2044 Len=0 TSval=1969386624 TSecr=1715295029
515,34.072261,172.66.164.67,100.86.121.59,TLSv1.2,97,Application Data
516,34.072272,100.86.121.59,172.66.164.67,TCP,66,53996  >  443 [ACK] Seq=21657 Ack=210764 Win=2048 Len=0 TSval=1969386624 TSecr=1715295029
517,34.07919,172.66.164.67,100.86.121.59,TLSv1.2,127,Application Data
518,34.079191,172.66.164.67,100.86.121.59,TLSv1.2,290,Application Data
519,34.079193,172.66.164.67,100.86.121.59,TLSv1.2,97,Application Data
520,34.079241,100.86.121.59,172.66.164.67,TCP,66,53996  >  443 [ACK] Seq=21657 Ack=211080 Win=2044 Len=0 TSval=1969386631 TSecr=1715295035
521,34.272964,100.86.121.59,172.66.164.67,TCP,54,[TCP Keep-Alive] 53996  >  443 [ACK] Seq=21656 Ack=211080 Win=2048 Len=0
522,34.465847,100.86.121.59,172.66.164.67,TCP,54,[TCP Keep-Alive] 53996  >  443 [ACK] Seq=21656 Ack=211080 Win=2048 Len=0
523,34.850097,100.86.121.59,172.66.164.67,TCP,54,[TCP Keep-Alive] 53996  >  443 [ACK] Seq=21656 Ack=211080 Win=2048 Len=0
524,34.859719,172.66.164.67,100.86.121.59,TCP,66,[TCP Keep-Alive ACK] 443  >  53996 [ACK] Seq=211080 Ack=21657 Win=17 Len=0 TSval=1715295817 TSecr=1969386631
525,39.079417,100.86.121.59,172.66.164.67,TLSv1.2,198,Application Data
526,39.079859,100.86.121.59,172.66.164.67,TLSv1.2,248,Application Data
527,39.080216,100.86.121.59,172.66.164.67,TLSv1.2,343,Application Data
528,39.091379,172.66.164.67,100.86.121.59,TCP,66,443  >  53996 [ACK] Seq=211080 Ack=22248 Win=17 Len=0 TSval=1715300048 TSecr=1969391631
529,39.116286,172.66.164.67,100.86.121.59,TLSv1.2,150,Application Data
530,39.11629,172.66.164.67,100.86.121.59,TLSv1.2,290,Application Data
531,39.116349,172.66.164.67,100.86.121.59,TLSv1.2,97,Application Data
532,39.11647,100.86.121.59,172.66.164.67,TCP,66,53996  >  443 [ACK] Seq=22248 Ack=211388 Win=2044 Len=0 TSval=1969391668 TSecr=1715300073
533,39.116541,100.86.121.59,172.66.164.67,TCP,66,53996  >  443 [ACK] Seq=22248 Ack=211419 Win=2044 Len=0 TSval=1969391668 TSecr=1715300073
534,39.118362,100.86.121.59,172.66.164.67,TLSv1.2,101,Application Data
535,39.119053,172.66.164.67,100.86.121.59,TLSv1.2,127,Application Data
536,39.119056,172.66.164.67,100.86.121.59,TLSv1.2,290,Application Data
537,39.119155,100.86.121.59,172.66.164.67,TCP,66,53996  >  443 [ACK] Seq=22283 Ack=211704 Win=2044 Len=0 TSval=1969391671 TSecr=1715300076
538,39.119173,172.66.164.67,100.86.121.59,TLSv1.2,97,Application Data
539,39.119223,100.86.121.59,172.66.164.67,TCP,66,53996  >  443 [ACK] Seq=22283 Ack=211735 Win=2044 Len=0 TSval=1969391671 TSecr=1715300076
540,39.120931,172.66.164.67,100.86.121.59,TLSv1.2,127,Application Data
541,39.120936,172.66.164.67,100.86.121.59,TLSv1.2,290,Application Data
542,39.120941,172.66.164.67,100.86.121.59,TLSv1.2,97,Application Data
543,39.121083,100.86.121.59,172.66.164.67,TCP,66,53996  >  443 [ACK] Seq=22283 Ack=212051 Win=2044 Len=0 TSval=1969391672 TSecr=1715300078
544,39.170374,172.66.164.67,100.86.121.59,TCP,66,443  >  53996 [ACK] Seq=212051 Ack=22283 Win=17 Len=0 TSval=1715300128 TSecr=1969391671
545,44.080581,100.86.121.59,172.66.164.67,TCP,1454,53996  >  443 [ACK] Seq=22283 Ack=212051 Win=2048 Len=1388 TSval=1969396632 TSecr=1715300128 [TCP PDU reassembled in 546]
546,44.080638,100.86.121.59,172.66.164.67,TLSv1.2,186,Application Data
547,44.083356,100.86.121.59,172.66.164.67,TLSv1.2,402,Application Data
548,44.095196,172.66.164.67,100.86.121.59,TCP,66,443  >  53996 [ACK] Seq=212051 Ack=23791 Win=17 Len=0 TSval=1715305051 TSecr=1969396632
549,44.097132,172.66.164.67,100.86.121.59,TCP,66,443  >  53996 [ACK] Seq=212051 Ack=24127 Win=17 Len=0 TSval=1715305054 TSecr=1969396635
550,44.119532,172.66.164.67,100.86.121.59,TLSv1.2,150,Application Data
551,44.119535,172.66.164.67,100.86.121.59,TLSv1.2,290,Application Data
552,44.11963,100.86.121.59,172.66.164.67,TCP,66,53996  >  443 [ACK] Seq=24127 Ack=212359 Win=2044 Len=0 TSval=1969396671 TSecr=1715305076
553,44.120442,172.66.164.67,100.86.121.59,TLSv1.2,97,Application Data
554,44.120444,172.66.164.67,100.86.121.59,TLSv1.2,127,Application Data
555,44.12049,100.86.121.59,172.66.164.67,TCP,66,53996  >  443 [ACK] Seq=24127 Ack=212451 Win=2047 Len=0 TSval=1969396672 TSecr=1715305077
556,44.12063,172.66.164.67,100.86.121.59,TLSv1.2,290,Application Data
557,44.120633,172.66.164.67,100.86.121.59,TLSv1.2,97,Application Data
558,44.120678,100.86.121.59,172.66.164.67,TCP,66,53996  >  443 [ACK] Seq=24127 Ack=212706 Win=2045 Len=0 TSval=1969396672 TSecr=1715305077
559,44.121434,100.86.121.59,172.66.164.67,TLSv1.2,101,Application Data
560,44.172277,172.66.164.67,100.86.121.59,TCP,66,443  >  53996 [ACK] Seq=212706 Ack=24162 Win=17 Len=0 TSval=1715305130 TSecr=1969396673
561,49.009132,100.86.121.59,172.66.164.67,TLSv1.2,193,Application Data
562,49.100951,172.66.164.67,100.86.121.59,TCP,66,443  >  53996 [ACK] Seq=212706 Ack=24289 Win=17 Len=0 TSval=1715310017 TSecr=1969401560
563,49.124961,172.66.164.67,100.86.121.59,TLSv1.2,151,Application Data
564,49.124965,172.66.164.67,100.86.121.59,TLSv1.2,108,Application Data
565,49.124967,172.66.164.67,100.86.121.59,TLSv1.2,97,Application Data
566,49.125159,100.86.121.59,172.66.164.67,TCP,66,53996  >  443 [ACK] Seq=24289 Ack=212864 Win=2046 Len=0 TSval=1969401676 TSecr=1715310047
567,49.127221,100.86.121.59,172.66.164.67,TLSv1.2,101,Application Data
568,49.149223,172.66.164.67,100.86.121.59,TCP,97,"[TCP Spurious Retransmission] 443  >  53996 [PSH, ACK] Seq=212833 Ack=24289 Win=17 Len=31 TSval=1715310077 TSecr=1969401560"
569,49.149445,100.86.121.59,172.66.164.67,TCP,78,[TCP Dup ACK 566#1] 53996  >  443 [ACK] Seq=24324 Ack=212864 Win=2048 Len=0 TSval=1969401701 TSecr=1715310077 SLE=212833 SRE=212864
570,49.251162,172.66.164.67,100.86.121.59,TCP,66,443  >  53996 [ACK] Seq=212864 Ack=24324 Win=17 Len=0 TSval=1715310179 TSecr=1969401678
571,54.129315,100.86.121.59,172.66.164.67,TLSv1.2,201,Application Data
572,54.14326,172.66.164.67,100.86.121.59,TCP,66,443  >  53996 [ACK] Seq=212864 Ack=24459 Win=17 Len=0 TSval=1715315100 TSecr=1969406681
573,54.179777,172.66.164.67,100.86.121.59,TLSv1.2,150,Application Data
574,54.179782,172.66.164.67,100.86.121.59,TLSv1.2,290,Application Data
575,54.180006,100.86.121.59,172.66.164.67,TCP,66,53996  >  443 [ACK] Seq=24459 Ack=213172 Win=2044 Len=0 TSval=1969406731 TSecr=1715315128
576,54.180715,172.66.164.67,100.86.121.59,TLSv1.2,97,Application Data
577,54.180831,100.86.121.59,172.66.164.67,TCP,66,53996  >  443 [ACK] Seq=24459 Ack=213203 Win=2048 Len=0 TSval=1969406732 TSecr=1715315128
578,54.183192,100.86.121.59,172.66.164.67,TLSv1.2,101,Application Data
579,54.234466,172.66.164.67,100.86.121.59,TCP,66,443  >  53996 [ACK] Seq=213203 Ack=24494 Win=17 Len=0 TSval=1715315192 TSecr=1969406734
580,54.528709,100.86.121.59,172.66.164.67,TLSv1.2,280,Application Data
581,54.539165,172.66.164.67,100.86.121.59,TCP,66,443  >  53996 [ACK] Seq=213203 Ack=24708 Win=17 Len=0 TSval=1715315497 TSecr=1969407080
582,54.546698,100.86.121.59,172.66.164.67,TLSv1.2,416,Application Data
583,54.547262,100.86.121.59,172.66.164.67,TLSv1.2,196,Application Data
584,54.547649,100.86.121.59,172.66.164.67,TLSv1.2,199,Application Data
585,54.547761,100.86.121.59,172.66.164.67,TLSv1.2,1391,Application Data
586,54.547924,100.86.121.59,172.66.164.67,TLSv1.2,402,Application Data
587,54.556175,172.66.164.67,100.86.121.59,TCP,66,443  >  53996 [ACK] Seq=213203 Ack=25058 Win=17 Len=0 TSval=1715315513 TSecr=1969407098
588,54.557455,172.66.164.67,100.86.121.59,TCP,66,443  >  53996 [ACK] Seq=213203 Ack=25188 Win=17 Len=0 TSval=1715315514 TSecr=1969407099
589,54.557457,172.66.164.67,100.86.121.59,TCP,66,443  >  53996 [ACK] Seq=213203 Ack=26646 Win=17 Len=0 TSval=1715315514 TSecr=1969407099
590,54.558096,172.66.164.67,100.86.121.59,TCP,66,443  >  53996 [ACK] Seq=213203 Ack=26982 Win=17 Len=0 TSval=1715315515 TSecr=1969407099
591,54.566051,172.66.164.67,100.86.121.59,TLSv1.2,128,Application Data
592,54.5661,100.86.121.59,172.66.164.67,TCP,66,53996  >  443 [ACK] Seq=26982 Ack=213265 Win=2048 Len=0 TSval=1969407117 TSecr=1715315523
593,54.56653,172.66.164.67,100.86.121.59,TLSv1.2,108,Application Data
594,54.566531,172.66.164.67,100.86.121.59,TLSv1.2,97,Application Data
595,54.566562,100.86.121.59,172.66.164.67,TCP,66,53996  >  443 [ACK] Seq=26982 Ack=213338 Win=2047 Len=0 TSval=1969407118 TSecr=1715315524
596,54.579857,172.66.164.67,100.86.121.59,TLSv1.2,224,Application Data
597,54.579859,172.66.164.67,100.86.121.59,TLSv1.2,290,Application Data
598,54.579948,100.86.121.59,172.66.164.67,TCP,66,53996  >  443 [ACK] Seq=26982 Ack=213720 Win=2043 Len=0 TSval=1969407131 TSecr=1715315537
599,54.58,172.66.164.67,100.86.121.59,TLSv1.2,97,Application Data
600,54.580002,172.66.164.67,100.86.121.59,TLSv1.2,127,Application Data
601,54.580004,172.66.164.67,100.86.121.59,TLSv1.2,290,Application Data
602,54.580052,100.86.121.59,172.66.164.67,TCP,66,53996  >  443 [ACK] Seq=26982 Ack=214036 Win=2044 Len=0 TSval=1969407131 TSecr=1715315537
603,54.580533,172.66.164.67,100.86.121.59,TLSv1.2,97,Application Data
604,54.580534,172.66.164.67,100.86.121.59,TLSv1.2,127,Application Data
605,54.580536,172.66.164.67,100.86.121.59,TLSv1.2,290,Application Data
606,54.580563,100.86.121.59,172.66.164.67,TCP,66,53996  >  443 [ACK] Seq=26982 Ack=214352 Win=2044 Len=0 TSval=1969407132 TSecr=1715315537
607,54.580712,172.66.164.67,100.86.121.59,TLSv1.2,97,Application Data
608,54.580731,100.86.121.59,172.66.164.67,TCP,66,53996  >  443 [ACK] Seq=26982 Ack=214383 Win=2048 Len=0 TSval=1969407132 TSecr=1715315538
609,54.582322,172.66.164.67,100.86.121.59,TLSv1.2,127,Application Data
610,54.582324,172.66.164.67,100.86.121.59,TLSv1.2,290,Application Data
611,54.582376,100.86.121.59,172.66.164.67,TCP,66,53996  >  443 [ACK] Seq=26982 Ack=214668 Win=2044 Len=0 TSval=1969407134 TSecr=1715315539
612,54.582408,172.66.164.67,100.86.121.59,TLSv1.2,97,Application Data
613,54.582434,100.86.121.59,172.66.164.67,TCP,66,53996  >  443 [ACK] Seq=26982 Ack=214699 Win=2048 Len=0 TSval=1969407134 TSecr=1715315539
614,54.584707,172.66.164.67,100.86.121.59,TLSv1.2,127,Application Data
615,54.584708,172.66.164.67,100.86.121.59,TLSv1.2,290,Application Data
616,54.584709,172.66.164.67,100.86.121.59,TLSv1.2,97,Application Data
617,54.584748,100.86.121.59,172.66.164.67,TCP,66,53996  >  443 [ACK] Seq=26982 Ack=215015 Win=2044 Len=0 TSval=1969407136 TSecr=1715315542
618,59.604106,100.86.121.59,172.66.164.67,TLSv1.2,197,Application Data
619,59.604529,100.86.121.59,172.66.164.67,TLSv1.2,196,Application Data
620,59.604838,100.86.121.59,172.66.164.67,TLSv1.2,329,Application Data
621,59.617855,172.66.164.67,100.86.121.59,TCP,66,443  >  53996 [ACK] Seq=215015 Ack=27506 Win=17 Len=0 TSval=1715320575 TSecr=1969412155
622,59.6432,172.66.164.67,100.86.121.59,TLSv1.2,231,Application Data
623,59.643205,172.66.164.67,100.86.121.59,TLSv1.2,290,Application Data
624,59.64341,100.86.121.59,172.66.164.67,TCP,66,53996  >  443 [ACK] Seq=27506 Ack=215404 Win=2042 Len=0 TSval=1969412195 TSecr=1715320600
625,59.643544,172.66.164.67,100.86.121.59,TLSv1.2,97,Application Data
626,59.643654,100.86.121.59,172.66.164.67,TCP,66,53996  >  443 [ACK] Seq=27506 Ack=215435 Win=2042 Len=0 TSval=1969412195 TSecr=1715320600
627,59.645384,172.66.164.67,100.86.121.59,TLSv1.2,208,Application Data
628,59.645418,172.66.164.67,100.86.121.59,TLSv1.2,290,Application Data
629,59.645525,100.86.121.59,172.66.164.67,TCP,66,53996  >  443 [ACK] Seq=27506 Ack=215577 Win=2046 Len=0 TSval=1969412197 TSecr=1715320603
630,59.645579,100.86.121.59,172.66.164.67,TCP,66,53996  >  443 [ACK] Seq=27506 Ack=215801 Win=2043 Len=0 TSval=1969412197 TSecr=1715320603
631,59.645604,172.66.164.67,100.86.121.59,TLSv1.2,97,Application Data
632,59.64565,100.86.121.59,172.66.164.67,TCP,66,53996  >  443 [ACK] Seq=27506 Ack=215832 Win=2043 Len=0 TSval=1969412197 TSecr=1715320603
633,59.64665,100.86.121.59,172.66.164.67,TLSv1.2,101,Application Data
634,59.646765,172.66.164.67,100.86.121.59,TLSv1.2,127,Application Data
635,59.64677,172.66.164.67,100.86.121.59,TLSv1.2,290,Application Data
636,59.64686,100.86.121.59,172.66.164.67,TCP,66,53996  >  443 [ACK] Seq=27541 Ack=216117 Win=2044 Len=0 TSval=1969412198 TSecr=1715320604
637,59.647694,172.66.164.67,100.86.121.59,TLSv1.2,97,Application Data
638,59.647815,100.86.121.59,172.66.164.67,TCP,66,53996  >  443 [ACK] Seq=27541 Ack=216148 Win=2044 Len=0 TSval=1969412199 TSecr=1715320604
639,59.69857,172.66.164.67,100.86.121.59,TCP,66,443  >  53996 [ACK] Seq=216148 Ack=27541 Win=17 Len=0 TSval=1715320656 TSecr=1969412198
