No.,Time,Source,Destination,Protocol,Length,Info
1,0.0,100.86.121.59,172.66.164.67,TLSv1.2,901,Application Data
2,0.013788,172.66.164.67,100.86.121.59,TCP,66,443  >  53996 [ACK] Seq=1 Ack=836 Win=17 Len=0 TSval=1715846247 TSecr=1969937824
3,0.048673,172.66.164.67,100.86.121.59,TLSv1.2,151,Application Data
4,0.048676,172.66.164.67,100.86.121.59,TLSv1.2,108,Application Data
5,0.048791,172.66.164.67,100.86.121.59,TLSv1.2,97,Application Data
6,0.048817,100.86.121.59,172.66.164.67,TCP,66,53996  >  443 [ACK] Seq=836 Ack=128 Win=2047 Len=0 TSval=1969937873 TSecr=1715846282
7,0.048881,100.86.121.59,172.66.164.67,TCP,66,53996  >  443 [ACK] Seq=836 Ack=159 Win=2047 Len=0 TSval=1969937873 TSecr=1715846282
8,0.183128,100.86.121.59,172.66.164.67,TLSv1.2,277,Application Data
9,0.227366,172.66.164.67,100.86.121.59,TLSv1.2,127,Application Data
10,0.227368,172.66.164.67,100.86.121.59,TLSv1.2,290,Application Data
11,0.227492,100.86.121.59,172.66.164.67,TCP,66,53996  >  443 [ACK] Seq=1047 Ack=444 Win=2044 Len=0 TSval=1969938052 TSecr=1715846460
12,0.228281,172.66.164.67,100.86.121.59,TLSv1.2,97,Application Data
13,0.228354,100.86.121.59,172.66.164.67,TCP,66,53996  >  443 [ACK] Seq=1047 Ack=475 Win=2048 Len=0 TSval=1969938053 TSecr=1715846460
14,5.192745,100.86.121.59,172.66.164.67,TLSv1.2,197,Application Data
15,5.231446,172.66.164.67,100.86.121.59,TLSv1.2,150,Application Data
16,5.231451,172.66.164.67,100.86.121.59,TLSv1.2,290,Application Data
17,5.231734,100.86.121.59,172.66.164.67,TCP,66,53996  >  443 [ACK] Seq=1178 Ack=783 Win=2044 Len=0 TSval=1969943056 TSecr=1715851465
18,5.231786,172.66.164.67,100.86.121.59,TLSv1.2,97,Application Data
19,5.231897,100.86.121.59,172.66.164.67,TCP,66,53996  >  443 [ACK] Seq=1178 Ack=814 Win=2044 Len=0 TSval=1969943056 TSecr=1715851465
20,5.233615,100.86.121.59,172.66.164.67,TLSv1.2,101,Application Data
21,5.284248,172.66.164.67,100.86.121.59,TCP,66,443  >  53996 [ACK] Seq=814 Ack=1213 Win=17 Len=0 TSval=1715851518 TSecr=1969943058
22,10.270265,100.86.121.59,172.66.164.67,TLSv1.2,199,Application Data
23,10.282282,172.66.164.67,100.86.121.59,TCP,66,443  >  53996 [ACK] Seq=814 Ack=1346 Win=17 Len=0 TSval=1715856516 TSecr=1969948094
24,10.308506,172.66.164.67,100.86.121.59,TLSv1.2,150,Application Data
25,10.308509,172.66.164.67,100.86.121.59,TLSv1.2,290,Application Data
26,10.308511,172.66.164.67,100.86.121.59,TLSv1.2,97,Application Data
27,10.308767,100.86.121.59,172.66.164.67,TCP,66,53996  >  443 [ACK] Seq=1346 Ack=1153 Win=2043 Len=0 TSval=1969948133 TSecr=1715856542
28,10.310924,100.86.121.59,172.66.164.67,TLSv1.2,101,Application Data
29,10.361643,172.66.164.67,100.86.121.59,TCP,66,443  >  53996 [ACK] Seq=1153 Ack=1381 Win=17 Len=0 TSval=1715856595 TSecr=1969948135
30,14.996706,100.86.121.59,172.66.164.67,TLSv1.2,189,Application Data
31,15.006644,172.66.164.67,100.86.121.59,TCP,66,443  >  53996 [ACK] Seq=1153 Ack=1504 Win=17 Len=0 TSval=1715861240 TSecr=1969952821
32,15.029172,172.66.164.67,100.86.121.59,TLSv1.2,151,Application Data
33,15.02929,100.86.121.59,172.66.164.67,TCP,66,53996  >  443 [ACK] Seq=1504 Ack=1238 Win=2047 Len=0 TSval=1969952854 TSecr=1715861263
34,15.029534,172.66.164.67,100.86.121.59,TLSv1.2,108,Application Data
35,15.029535,172.66.164.67,100.86.121.59,TLSv1.2,97,Application Data
36,15.029592,100.86.121.59,172.66.164.67,TCP,66,53996  >  443 [ACK] Seq=1504 Ack=1311 Win=2047 Len=0 TSval=1969952854 TSecr=1715861263
37,22.335587,100.86.121.59,172.66.164.67,TLSv1.2,385,Application Data
38,22.38714,172.66.164.67,100.86.121.59,TCP,66,443  >  53996 [ACK] Seq=1311 Ack=1823 Win=17 Len=0 TSval=1715868621 TSecr=1969960160
39,24.85095,172.66.164.67,100.86.121.59,TLSv1.2,224,Application Data
40,24.850954,172.66.164.67,100.86.121.59,TCP,1514,443  >  53996 [ACK] Seq=1469 Ack=1823 Win=17 Len=1448 TSval=1715871084 TSecr=1969960160 [TCP PDU reassembled in 54]
41,24.851183,100.86.121.59,172.66.164.67,TCP,66,53996  >  443 [ACK] Seq=1823 Ack=2917 Win=2023 Len=0 TSval=1969962675 TSecr=1715871084
42,24.851439,172.66.164.67,100.86.121.59,TCP,1514,443  >  53996 [ACK] Seq=2917 Ack=1823 Win=17 Len=1448 TSval=1715871084 TSecr=1969960160 [TCP PDU reassembled in 54]
43,24.851441,172.66.164.67,100.86.121.59,TCP,1514,443  >  53996 [ACK] Seq=4365 Ack=1823 Win=17 Len=1448 TSval=1715871084 TSecr=1969960160 [TCP PDU reassembled in 54]
44,24.851442,172.66.164.67,100.86.121.59,TCP,1514,443  >  53996 [ACK] Seq=5813 Ack=1823 Win=17 Len=1448 TSval=1715871084 TSecr=1969960160 [TCP PDU reassembled in 54]
45,24.851444,172.66.164.67,100.86.121.59,TCP,1514,443  >  53996 [ACK] Seq=7261 Ack=1823 Win=17 Len=1448 TSval=1715871084 TSecr=1969960160 [TCP PDU reassembled in 54]
46,24.85145,172.66.164.67,100.86.121.59,TCP,1514,443  >  53996 [ACK] Seq=8709 Ack=1823 Win=17 Len=1448 TSval=1715871084 TSecr=1969960160 [TCP PDU reassembled in 54]
47,24.851453,172.66.164.67,100.86.121.59,TCP,1514,443  >  53996 [ACK] Seq=10157 Ack=1823 Win=17 Len=1448 TSval=1715871084 TSecr=1969960160 [TCP PDU reassembled in 54]
48,24.851455,172.66.164.67,100.86.121.59,TCP,1514,"443  >  53996 [PSH, ACK] Seq=11605 Ack=1823 Win=17 Len=1448 TSval=1715871084 TSecr=1969960160 [TCP PDU reassembled in 54]"
49,24.851557,100.86.121.59,172.66.164.67,TCP,66,53996  >  443 [ACK] Seq=1823 Ack=13053 Win=1890 Len=0 TSval=1969962676 TSecr=1715871084
50,24.8519,100.86.121.59,172.66.164.67,TCP,66,[TCP Window Update] 53996  >  443 [ACK] Seq=1823 Ack=13053 Win=2048 Len=0 TSval=1969962676 TSecr=1715871084
51,24.853531,172.66.164.67,100.86.121.59,TCP,1514,443  >  53996 [ACK] Seq=13053 Ack=1823 Win=17 Len=1448 TSval=1715871085 TSecr=1969960160 [TCP PDU reassembled in 54]
52,24.853534,172.66.164.67,100.86.121.59,TCP,1514,443  >  53996 [ACK] Seq=14501 Ack=1823 Win=17 Len=1448 TSval=1715871085 TSecr=1969960160 [TCP PDU reassembled in 54]
53,24.853537,172.66.164.67,100.86.121.59,TCP,1514,443  >  53996 [ACK] Seq=15949 Ack=1823 Win=17 Len=1448 TSval=1715871085 TSecr=1969960160 [TCP PDU reassembled in 54]
54,24.853541,172.66.164.67,100.86.121.59,TLSv1.2,544,Application Data
55,24.853544,172.66.164.67,100.86.121.59,TCP,1514,443  >  53996 [ACK] Seq=17875 Ack=1823 Win=17 Len=1448 TSval=1715871086 TSecr=1969960160 [TCP PDU reassembled in 65]
56,24.853547,172.66.164.67,100.86.121.59,TCP,1514,443  >  53996 [ACK] Seq=19323 Ack=1823 Win=17 Len=1448 TSval=1715871086 TSecr=1969960160 [TCP PDU reassembled in 65]
57,24.853549,172.66.164.67,100.86.121.59,TCP,1514,443  >  53996 [ACK] Seq=20771 Ack=1823 Win=17 Len=1448 TSval=1715871086 TSecr=1969960160 [TCP PDU reassembled in 65]
58,24.853552,172.66.164.67,100.86.121.59,TCP,1514,443  >  53996 [ACK] Seq=22219 Ack=1823 Win=17 Len=1448 TSval=1715871086 TSecr=1969960160 [TCP PDU reassembled in 65]
59,24.853554,172.66.164.67,100.86.121.59,TCP,1514,443  >  53996 [ACK] Seq=23667 Ack=1823 Win=17 Len=1448 TSval=1715871086 TSecr=1969960160 [TCP PDU reassembled in 65]
60,24.853557,172.66.164.67,100.86.121.59,TCP,1514,443  >  53996 [ACK] Seq=25115 Ack=1823 Win=17 Len=1448 TSval=1715871086 TSecr=1969960160 [TCP PDU reassembled in 65]
61,24.853559,172.66.164.67,100.86.121.59,TCP,1514,443  >  53996 [ACK] Seq=26563 Ack=1823 Win=17 Len=1448 TSval=1715871086 TSecr=1969960160 [TCP PDU reassembled in 65]
62,24.853562,172.66.164.67,100.86.121.59,TCP,1514,"443  >  53996 [PSH, ACK] Seq=28011 Ack=1823 Win=17 Len=1448 TSval=1715871086 TSecr=1969960160 [TCP PDU reassembled in 65]"
63,24.853565,172.66.164.67,100.86.121.59,TCP,1514,443  >  53996 [ACK] Seq=29459 Ack=1823 Win=17 Len=1448 TSval=1715871086 TSecr=1969960160 [TCP PDU reassembled in 65]
64,24.853567,172.66.164.67,100.86.121.59,TCP,1514,443  >  53996 [ACK] Seq=30907 Ack=1823 Win=17 Len=1448 TSval=1715871086 TSecr=1969960160 [TCP PDU reassembled in 65]
65,24.853569,172.66.164.67,100.86.121.59,TLSv1.2,945,"Application Data, Application Data"
66,24.853751,100.86.121.59,172.66.164.67,TCP,66,53996  >  443 [ACK] Seq=1823 Ack=28011 Win=1815 Len=0 TSval=1969962678 TSecr=1715871086
67,24.853803,100.86.121.59,172.66.164.67,TCP,66,53996  >  443 [ACK] Seq=1823 Ack=33234 Win=1734 Len=0 TSval=1969962678 TSecr=1715871086
68,24.853984,100.86.121.59,172.66.164.67,TCP,66,[TCP Window Update] 53996  >  443 [ACK] Seq=1823 Ack=33234 Win=2048 Len=0 TSval=1969962678 TSecr=1715871086
69,24.858907,100.86.121.59,172.66.164.67,TLSv1.2,101,Application Data
70,24.868846,172.66.164.67,100.86.121.59,TCP,66,443  >  53996 [ACK] Seq=33234 Ack=1858 Win=17 Len=0 TSval=1715871102 TSecr=1969962683
71,24.933488,100.86.121.59,172.66.164.67,TLSv1.2,792,Application Data
72,24.943368,172.66.164.67,100.86.121.59,TCP,66,443  >  53996 [ACK] Seq=33234 Ack=2584 Win=17 Len=0 TSval=1715871177 TSecr=1969962758
73,24.965902,100.86.121.59,172.66.164.67,TLSv1.2,1053,Application Data
74,24.992818,172.66.164.67,100.86.121.59,TLSv1.2,158,Application Data
75,24.992819,172.66.164.67,100.86.121.59,TCP,1514,443  >  53996 [ACK] Seq=33326 Ack=2584 Win=17 Len=1448 TSval=1715871199 TSecr=1969962758 [TCP PDU reassembled in 86]
76,24.99282,172.66.164.67,100.86.121.59,TCP,1514,443  >  53996 [ACK] Seq=34774 Ack=2584 Win=17 Len=1448 TSval=1715871199 TSecr=1969962758 [TCP PDU reassembled in 86]
77,24.992821,172.66.164.67,100.86.121.59,TCP,1514,443  >  53996 [ACK] Seq=36222 Ack=2584 Win=17 Len=1448 TSval=1715871199 TSecr=1969962758 [TCP PDU reassembled in 86]
78,24.992822,172.66.164.67,100.86.121.59,TCP,1514,443  >  53996 [ACK] Seq=37670 Ack=2584 Win=17 Len=1448 TSval=1715871199 TSecr=1969962758 [TCP PDU reassembled in 86]
79,24.992823,172.66.164.67,100.86.121.59,TCP,1514,443  >  53996 [ACK] Seq=39118 Ack=2584 Win=17 Len=1448 TSval=1715871199 TSecr=1969962758 [TCP PDU reassembled in 86]
80,24.992824,172.66.164.67,100.86.121.59,TCP,1514,443  >  53996 [ACK] Seq=40566 Ack=2584 Win=17 Len=1448 TSval=1715871199 TSecr=1969962758 [TCP PDU reassembled in 86]
81,24.992825,172.66.164.67,100.86.121.59,TCP,1514,443  >  53996 [ACK] Seq=42014 Ack=2584 Win=17 Len=1448 TSval=1715871199 TSecr=1969962758 [TCP PDU reassembled in 86]
82,24.992826,172.66.164.67,100.86.121.59,TCP,1514,"443  >  53996 [PSH, ACK] Seq=43462 Ack=2584 Win=17 Len=1448 TSval=1715871199 TSecr=1969962758 [TCP PDU reassembled in 86]"
83,24.992827,172.66.164.67,100.86.121.59,TCP,1514,443  >  53996 [ACK] Seq=44910 Ack=2584 Win=17 Len=1448 TSval=1715871200 TSecr=1969962758 [TCP PDU reassembled in 86]
84,24.992828,172.66.164.67,100.86.121.59,TCP,1514,443  >  53996 [ACK] Seq=46358 Ack=2584 Win=17 Len=1448 TSval=1715871200 TSecr=1969962758 [TCP PDU reassembled in 86]
85,24.992829,172.66.164.67,100.86.121.59,TCP,1514,443  >  53996 [ACK] Seq=47806 Ack=2584 Win=17 Len=1448 TSval=1715871200 TSecr=1969962758 [TCP PDU reassembled in 86]
86,24.99283,172.66.164.67,100.86.121.59,TLSv1.2,1514,Application Data
87,24.992831,172.66.164.67,100.86.121.59,TCP,1514,443  >  53996 [ACK] Seq=50702 Ack=2584 Win=17 Len=1448 TSval=1715871200 TSecr=1969962758 [TCP PDU reassembled in 89]
88,24.992832,172.66.164.67,100.86.121.59,TCP,1514,443  >  53996 [ACK] Seq=52150 Ack=2584 Win=17 Len=1448 TSval=1715871200 TSecr=1969962758 [TCP PDU reassembled in 89]
89,24.992833,172.66.164.67,100.86.121.59,TLSv1.2,1052,Application Data
90,24.992834,172.66.164.67,100.86.121.59,TLSv1.2,97,Application Data
91,24.992885,100.86.121.59,172.66.164.67,TCP,66,53996  >  443 [ACK] Seq=3571 Ack=49254 Win=1798 Len=0 TSval=1969962817 TSecr=1715871200
92,24.992906,100.86.121.59,172.66.164.67,TCP,66,53996  >  443 [ACK] Seq=3571 Ack=54615 Win=1715 Len=0 TSval=1969962817 TSecr=1715871201
93,24.993407,100.86.121.59,172.66.164.67,TCP,66,[TCP Window Update] 53996  >  443 [ACK] Seq=3571 Ack=54615 Win=2048 Len=0 TSval=1969962818 TSecr=1715871201
94,24.995509,100.86.121.59,172.66.164.67,TLSv1.2,501,Application Data
95,24.995743,100.86.121.59,172.66.164.67,TLSv1.2,197,Application Data
96,24.996025,100.86.121.59,172.66.164.67,TLSv1.2,199,Application Data
97,24.996197,100.86.121.59,172.66.164.67,TLSv1.2,198,Application Data
98,24.99635,100.86.121.59,172.66.164.67,TLSv1.2,217,Application Data
99,25.007807,172.66.164.67,100.86.121.59,TCP,97,"[TCP Spurious Retransmission] 443  >  53996 [PSH, ACK] Seq=54584 Ack=3571 Win=17 Len=31 TSval=1715871234 TSecr=1969962790"
100,25.007857,100.86.121.59,172.66.164.67,TCP,78,[TCP Dup ACK 92#1] 53996  >  443 [ACK] Seq=4553 Ack=54615 Win=2048 Len=0 TSval=1969962832 TSecr=1715871234 SLE=54584 SRE=54615
101,25.024146,172.66.164.67,100.86.121.59,TLSv1.2,185,Application Data
102,25.024148,172.66.164.67,100.86.121.59,TLSv1.2,108,Application Data
103,25.024148,172.66.164.67,100.86.121.59,TLSv1.2,97,Application Data
104,25.024244,100.86.121.59,172.66.164.67,TCP,66,53996  >  443 [ACK] Seq=4553 Ack=54807 Win=2045 Len=0 TSval=1969962848 TSecr=1715871238
105,25.024887,172.66.164.67,100.86.121.59,TCP,66,443  >  53996 [ACK] Seq=54807 Ack=4553 Win=17 Len=0 TSval=1715871249 TSecr=1969962820
106,25.036626,172.66.164.67,100.86.121.59,TLSv1.2,127,Application Data
107,25.03668,100.86.121.59,172.66.164.67,TCP,66,53996  >  443 [ACK] Seq=4553 Ack=54868 Win=2048 Len=0 TSval=1969962861 TSecr=1715871270
108,25.036777,172.66.164.67,100.86.121.59,TLSv1.2,290,Application Data
109,25.036806,100.86.121.59,172.66.164.67,TCP,66,53996  >  443 [ACK] Seq=4553 Ack=55092 Win=2045 Len=0 TSval=1969962861 TSecr=1715871270
110,25.038403,172.66.164.67,100.86.121.59,TLSv1.2,97,Application Data
111,25.0385,100.86.121.59,172.66.164.67,TCP,66,53996  >  443 [ACK] Seq=4553 Ack=55123 Win=2048 Len=0 TSval=1969962863 TSecr=1715871270
112,25.050071,172.66.164.67,100.86.121.59,TLSv1.2,127,Application Data
113,25.050074,172.66.164.67,100.86.121.59,TLSv1.2,290,Application Data
114,25.050075,172.66.164.67,100.86.121.59,TLSv1.2,97,Application Data
115,25.050248,100.86.121.59,172.66.164.67,TCP,66,53996  >  443 [ACK] Seq=4553 Ack=55439 Win=2044 Len=0 TSval=1969962874 TSecr=1715871272
116,25.059255,172.66.164.67,100.86.121.59,TLSv1.2,208,Application Data
117,25.059256,172.66.164.67,100.86.121.59,TLSv1.2,290,Application Data
118,25.059258,172.66.164.67,100.86.121.59,TLSv1.2,97,Application Data
119,25.059259,172.66.164.67,100.86.121.59,TLSv1.2,127,Application Data
120,25.05926,172.66.164.67,100.86.121.59,TLSv1.2,290,Application Data
121,25.059261,172.66.164.67,100.86.121.59,TLSv1.2,97,Application Data
122,25.059409,100.86.121.59,172.66.164.67,TCP,66,53996  >  443 [ACK] Seq=4553 Ack=56152 Win=2037 Len=0 TSval=1969962884 TSecr=1715871277
123,25.071421,172.66.164.67,100.86.121.59,TLSv1.2,127,Application Data
124,25.071422,172.66.164.67,100.86.121.59,TLSv1.2,290,Application Data
125,25.071423,172.66.164.67,100.86.121.59,TLSv1.2,97,Application Data
126,25.071502,100.86.121.59,172.66.164.67,TCP,66,53996  >  443 [ACK] Seq=4553 Ack=56468 Win=2044 Len=0 TSval=1969962896 TSecr=1715871282
127,30.05036,100.86.121.59,172.66.164.67,TLSv1.2,197,Application Data
128,30.060937,100.86.121.59,172.66.164.67,TLSv1.2,200,Application Data
129,30.064458,100.86.121.59,172.66.164.67,TLSv1.2,684,Application Data
130,30.072377,172.66.164.67,100.86.121.59,TCP,66,443  >  53996 [ACK] Seq=56468 Ack=4818 Win=17 Len=0 TSval=1715876305 TSecr=1969967874
131,30.077653,100.86.121.59,172.66.164.67,TLSv1.2,1127,Application Data
132,30.087477,172.66.164.67,100.86.121.59,TLSv1.2,150,Application Data
133,30.08765,100.86.121.59,172.66.164.67,TCP,66,53996  >  443 [ACK] Seq=6497 Ack=56552 Win=2047 Len=0 TSval=1969967912 TSecr=1715876321
134,30.08797,172.66.164.67,100.86.121.59,TLSv1.2,290,Application Data
135,30.087972,172.66.164.67,100.86.121.59,TLSv1.2,97,Application Data
136,30.08805,100.86.121.59,172.66.164.67,TCP,66,53996  >  443 [ACK] Seq=6497 Ack=56807 Win=2045 Len=0 TSval=1969967912 TSecr=1715876321
137,30.089189,100.86.121.59,172.66.164.67,TLSv1.2,101,Application Data
138,30.0941,172.66.164.67,100.86.121.59,TLSv1.2,127,Application Data
139,30.094104,172.66.164.67,100.86.121.59,TLSv1.2,290,Application Data
140,30.094186,172.66.164.67,100.86.121.59,TLSv1.2,97,Application Data
141,30.094285,100.86.121.59,172.66.164.67,TCP,66,53996  >  443 [ACK] Seq=6532 Ack=57092 Win=2044 Len=0 TSval=1969967918 TSecr=1715876328
142,30.094346,100.86.121.59,172.66.164.67,TCP,66,53996  >  443 [ACK] Seq=6532 Ack=57123 Win=2044 Len=0 TSval=1969967919 TSecr=1715876328
143,30.100822,172.66.164.67,100.86.121.59,TLSv1.2,127,Application Data
144,30.100825,172.66.164.67,100.86.121.59,TLSv1.2,290,Application Data
145,30.100962,172.66.164.67,100.86.121.59,TLSv1.2,97,Application Data
146,30.100975,100.86.121.59,172.66.164.67,TCP,66,53996  >  443 [ACK] Seq=6532 Ack=57408 Win=2044 Len=0 TSval=1969967925 TSecr=1715876334
147,30.101026,100.86.121.59,172.66.164.67,TCP,66,53996  >  443 [ACK] Seq=6532 Ack=57439 Win=2044 Len=0 TSval=1969967925 TSecr=1715876334
148,30.1143,172.66.164.67,100.86.121.59,TLSv1.2,127,Application Data
149,30.114303,172.66.164.67,100.86.121.59,TLSv1.2,290,Application Data
150,30.114306,172.66.164.67,100.86.121.59,TLSv1.2,97,Application Data
151,30.11449,100.86.121.59,172.66.164.67,TCP,66,53996  >  443 [ACK] Seq=6532 Ack=57755 Win=2044 Len=0 TSval=1969967939 TSecr=1715876348
152,31.527705,100.86.121.59,172.66.164.67,TCP,54,[TCP Keep-Alive] 53996  >  443 [ACK] Seq=6531 Ack=57755 Win=2048 Len=0
153,31.543807,172.66.164.67,100.86.121.59,TCP,66,[TCP Keep-Alive ACK] 443  >  53996 [ACK] Seq=57755 Ack=6532 Win=17 Len=0 TSval=1715877775 TSecr=1969967939
154,35.068273,100.86.121.59,172.66.164.67,TLSv1.2,495,Application Data
155,35.112634,172.66.164.67,100.86.121.59,TLSv1.2,150,Application Data
156,35.112637,172.66.164.67,100.86.121.59,TLSv1.2,290,Application Data
157,35.11264,172.66.164.67,100.86.121.59,TLSv1.2,97,Application Data
158,35.112905,100.86.121.59,172.66.164.67,TCP,66,53996  >  443 [ACK] Seq=6961 Ack=58094 Win=2043 Len=0 TSval=1969972937 TSecr=1715881346
159,35.114448,100.86.121.59,172.66.164.67,TLSv1.2,101,Application Data
160,35.167342,172.66.164.67,100.86.121.59,TCP,66,443  >  53996 [ACK] Seq=58094 Ack=6996 Win=17 Len=0 TSval=1715881401 TSecr=1969972939
161,39.971081,100.86.121.59,172.66.164.67,TLSv1.2,194,Application Data
162,39.981065,172.66.164.67,100.86.121.59,TCP,66,443  >  53996 [ACK] Seq=58094 Ack=7124 Win=17 Len=0 TSval=1715886214 TSecr=1969977795
163,40.005471,172.66.164.67,100.86.121.59,TLSv1.2,151,Application Data
164,40.005475,172.66.164.67,100.86.121.59,TLSv1.2,108,Application Data
165,40.005595,172.66.164.67,100.86.121.59,TLSv1.2,97,Application Data
166,40.005623,100.86.121.59,172.66.164.67,TCP,66,53996  >  443 [ACK] Seq=7124 Ack=58221 Win=2047 Len=0 TSval=1969977830 TSecr=1715886239
167,40.005684,100.86.121.59,172.66.164.67,TCP,66,53996  >  443 [ACK] Seq=7124 Ack=58252 Win=2047 Len=0 TSval=1969977830 TSecr=1715886239
168,40.124183,100.86.121.59,172.66.164.67,TLSv1.2,197,Application Data
169,40.159181,172.66.164.67,100.86.121.59,TLSv1.2,127,Application Data
170,40.159184,172.66.164.67,100.86.121.59,TLSv1.2,290,Application Data
171,40.159235,172.66.164.67,100.86.121.59,TLSv1.2,97,Application Data
172,40.159356,100.86.121.59,172.66.164.67,TCP,66,53996  >  443 [ACK] Seq=7255 Ack=58537 Win=2044 Len=0 TSval=1969977983 TSecr=1715886393
173,40.159412,100.86.121.59,172.66.164.67,TCP,66,53996  >  443 [ACK] Seq=7255 Ack=58568 Win=2044 Len=0 TSval=1969977984 TSecr=1715886393
174,40.160661,100.86.121.59,172.66.164.67,TLSv1.2,101,Application Data
175,40.213433,172.66.164.67,100.86.121.59,TCP,66,443  >  53996 [ACK] Seq=58568 Ack=7290 Win=17 Len=0 TSval=1715886447 TSecr=1969977985
176,45.095487,100.86.121.59,172.66.164.67,TLSv1.2,216,Application Data
177,45.10567,100.86.121.59,172.66.164.67,TLSv1.2,198,Application Data
178,45.114155,172.66.164.67,100.86.121.59,TCP,66,443  >  53996 [ACK] Seq=58568 Ack=7440 Win=17 Len=0 TSval=1715891348 TSecr=1969982920
179,45.116225,172.66.164.67,100.86.121.59,TCP,66,443  >  53996 [ACK] Seq=58568 Ack=7572 Win=17 Len=0 TSval=1715891350 TSecr=1969982930
180,45.136341,172.66.164.67,100.86.121.59,TLSv1.2,150,Application Data
181,45.136415,100.86.121.59,172.66.164.67,TCP,66,53996  >  443 [ACK] Seq=7572 Ack=58652 Win=2047 Len=0 TSval=1969982960 TSecr=1715891370
182,45.136532,172.66.164.67,100.86.121.59,TLSv1.2,290,Application Data
183,45.136534,172.66.164.67,100.86.121.59,TLSv1.2,97,Application Data
184,45.136605,100.86.121.59,172.66.164.67,TCP,66,53996  >  443 [ACK] Seq=7572 Ack=58907 Win=2045 Len=0 TSval=1969982961 TSecr=1715891370
185,45.137419,172.66.164.67,100.86.121.59,TLSv1.2,127,Application Data
186,45.13742,172.66.164.67,100.86.121.59,TLSv1.2,290,Application Data
187,45.137421,172.66.164.67,100.86.121.59,TLSv1.2,97,Application Data
188,45.13745,100.86.121.59,172.66.164.67,TCP,66,53996  >  443 [ACK] Seq=7572 Ack=59223 Win=2044 Len=0 TSval=1969982962 TSecr=1715891371
189,54.968105,100.86.121.59,172.66.164.67,TLSv1.2,189,Application Data
190,55.002855,172.66.164.67,100.86.121.59,TLSv1.2,232,Application Data
191,55.002859,172.66.164.67,100.86.121.59,TLSv1.2,108,Application Data
192,55.002861,172.66.164.67,100.86.121.59,TLSv1.2,97,Application Data
193,55.003124,100.86.121.59,172.66.164.67,TCP,66,53996  >  443 [ACK] Seq=7695 Ack=59462 Win=2045 Len=0 TSval=1969992827 TSecr=1715901236
194,55.004979,100.86.121.59,172.66.164.67,TLSv1.2,101,Application Data
195,55.055369,172.66.164.67,100.86.121.59,TCP,66,443  >  53996 [ACK] Seq=59462 Ack=7730 Win=17 Len=0 TSval=1715901289 TSecr=1969992829
196,55.101726,100.86.121.59,172.66.164.67,TLSv1.2,687,Application Data
197,55.111435,172.66.164.67,100.86.121.59,TCP,66,443  >  53996 [ACK] Seq=59462 Ack=8351 Win=17 Len=0 TSval=1715901345 TSecr=1969992926
198,55.132145,172.66.164.67,100.86.121.59,TLSv1.2,127,Application Data
199,55.132149,172.66.164.67,100.86.121.59,TLSv1.2,290,Application Data
200,55.132203,172.66.164.67,100.86.121.59,TLSv1.2,97,Application Data
201,55.132357,100.86.121.59,172.66.164.67,TCP,66,53996  >  443 [ACK] Seq=8351 Ack=59747 Win=2044 Len=0 TSval=1969992956 TSecr=1715901365
202,55.132443,100.86.121.59,172.66.164.67,TCP,66,53996  >  443 [ACK] Seq=8351 Ack=59778 Win=2044 Len=0 TSval=1969992956 TSecr=1715901366
