"No.","Time","Source","Destination","Protocol","Length","Info"
"1","0.000000","100.86.121.59","172.66.164.67","TLSv1.2","369","Application Data"
"2","0.000088","100.86.121.59","172.66.164.67","TLSv1.2","105","Application Data"
"3","0.013792","172.66.164.67","100.86.121.59","TLSv1.2","105","Application Data"
"4","0.014055","100.86.121.59","172.66.164.67","TCP","66","53996  >  443 [ACK] Seq=343 Ack=40 Win=2048 Len=0 TSval=1969628576 TSecr=1715536983"
"5","0.038407","172.66.164.67","100.86.121.59","TLSv1.2","151","Application Data"
"6","0.038411","172.66.164.67","100.86.121.59","TLSv1.2","108","Application Data"
"7","0.038604","100.86.121.59","172.66.164.67","TCP","66","53996  >  443 [ACK] Seq=343 Ack=167 Win=2047 Len=0 TSval=1969628601 TSecr=1715537007"
"8","0.038861","172.66.164.67","100.86.121.59","TLSv1.2","97","Application Data"
"9","0.038949","100.86.121.59","172.66.164.67","TCP","66","53996  >  443 [ACK] Seq=343 Ack=198 Win=2048 Len=0 TSval=1969628601 TSecr=1715537007"
"10","0.040722","100.86.121.59","172.66.164.67","TLSv1.2","101","Application Data"
"11","0.091945","172.66.164.67","100.86.121.59","TCP","66","443  >  53996 [ACK] Seq=198 Ack=378 Win=17 Len=0 TSval=1715537062 TSecr=1969628603"
"12","0.232527","100.86.121.59","172.66.164.67","TLSv1.2","1203","Application Data"
"13","0.242321","172.66.164.67","100.86.121.59","TCP","66","443  >  53996 [ACK] Seq=198 Ack=1515 Win=17 Len=0 TSval=1715537211 TSecr=1969628795"
"14","0.272529","172.66.164.67","100.86.121.59","TLSv1.2","208","Application Data"
"15","0.272533","172.66.164.67","100.86.121.59","TLSv1.2","290","Application Data"
"16","0.272739","100.86.121.59","172.66.164.67","TCP","66","53996  >  443 [ACK] Seq=1515 Ack=564 Win=2043 Len=0 TSval=1969628835 TSecr=1715537241"
"17","0.272838","172.66.164.67","100.86.121.59","TLSv1.2","97","Application Data"
"18","0.272939","100.86.121.59","172.66.164.67","TCP","66","53996  >  443 [ACK] Seq=1515 Ack=595 Win=2043 Len=0 TSval=1969628835 TSecr=1715537241"
"19","0.472505","100.86.121.59","172.66.164.67","TCP","54","[TCP Keep-Alive] 53996  >  443 [ACK] Seq=1514 Ack=595 Win=2048 Len=0"
"20","0.484194","172.66.164.67","100.86.121.59","TCP","66","[TCP Keep-Alive ACK] 443  >  53996 [ACK] Seq=595 Ack=1515 Win=17 Len=0 TSval=1715537453 TSecr=1969628835"
"21","2.582259","100.86.121.59","172.66.164.67","TLSv1.2","396","Application Data"
"22","2.634658","172.66.164.67","100.86.121.59","TCP","66","443  >  53996 [ACK] Seq=595 Ack=1845 Win=17 Len=0 TSval=1715539604 TSecr=1969631144"
"23","2.677533","172.66.164.67","100.86.121.59","TLSv1.2","190","Application Data"
"24","2.677601","100.86.121.59","172.66.164.67","TCP","66","53996  >  443 [ACK] Seq=1845 Ack=719 Win=2047 Len=0 TSval=1969631240 TSecr=1715539647"
"25","2.678098","172.66.164.67","100.86.121.59","TCP","1514","443  >  53996 [ACK] Seq=719 Ack=1845 Win=17 Len=1448 TSval=1715539647 TSecr=1969631144 [TCP PDU reassembled in 40]"
"26","2.678143","100.86.121.59","172.66.164.67","TCP","66","53996  >  443 [ACK] Seq=1845 Ack=2167 Win=2026 Len=0 TSval=1969631240 TSecr=1715539647"
"27","2.678269","172.66.164.67","100.86.121.59","TCP","1514","443  >  53996 [ACK] Seq=2167 Ack=1845 Win=17 Len=1448 TSval=1715539647 TSecr=1969631144 [TCP PDU reassembled in 40]"
"28","2.678306","100.86.121.59","172.66.164.67","TCP","66","53996  >  443 [ACK] Seq=1845 Ack=3615 Win=2026 Len=0 TSval=1969631240 TSecr=1715539647"
"29","2.678681","172.66.164.67","100.86.121.59","TCP","1514","443  >  53996 [ACK] Seq=3615 Ack=1845 Win=17 Len=1448 TSval=1715539647 TSecr=1969631144 [TCP PDU reassembled in 40]"
"30","2.678684","172.66.164.67","100.86.121.59","TCP","1514","443  >  53996 [ACK] Seq=5063 Ack=1845 Win=17 Len=1448 TSval=1715539647 TSecr=1969631144 [TCP PDU reassembled in 40]"
"31","2.678734","100.86.121.59","172.66.164.67","TCP","66","53996  >  443 [ACK] Seq=1845 Ack=6511 Win=2003 Len=0 TSval=1969631241 TSecr=1715539647"
"32","2.678774","100.86.121.59","172.66.164.67","TCP","66","[TCP Window Update] 53996  >  443 [ACK] Seq=1845 Ack=6511 Win=2048 Len=0 TSval=1969631241 TSecr=1715539647"
"33","2.679908","172.66.164.67","100.86.121.59","TCP","1514","443  >  53996 [ACK] Seq=6511 Ack=1845 Win=17 Len=1448 TSval=1715539647 TSecr=1969631144 [TCP PDU reassembled in 40]"
"34","2.679910","172.66.164.67","100.86.121.59","TCP","1514","443  >  53996 [ACK] Seq=7959 Ack=1845 Win=17 Len=1448 TSval=1715539647 TSecr=1969631144 [TCP PDU reassembled in 40]"
"35","2.679911","172.66.164.67","100.86.121.59","TCP","1514","443  >  53996 [ACK] Seq=9407 Ack=1845 Win=17 Len=1448 TSval=1715539647 TSecr=1969631144 [TCP PDU reassembled in 40]"
"36","2.679912","172.66.164.67","100.86.121.59","TCP","1514","443  >  53996 [PSH, ACK] Seq=10855 Ack=1845 Win=17 Len=1448 TSval=1715539647 TSecr=1969631144 [TCP PDU reassembled in 40]"
"37","2.679913","172.66.164.67","100.86.121.59","TCP","1514","443  >  53996 [ACK] Seq=12303 Ack=1845 Win=17 Len=1448 TSval=1715539648 TSecr=1969631144 [TCP PDU reassembled in 40]"
"38","2.679914","172.66.164.67","100.86.121.59","TCP","1514","443  >  53996 [ACK] Seq=13751 Ack=1845 Win=17 Len=1448 TSval=1715539648 TSecr=1969631144 [TCP PDU reassembled in 40]"
"39","2.679916","172.66.164.67","100.86.121.59","TCP","1514","443  >  53996 [ACK] Seq=15199 Ack=1845 Win=17 Len=1448 TSval=1715539648 TSecr=1969631144 [TCP PDU reassembled in 40]"
"40","2.679917","172.66.164.67","100.86.121.59","TLSv1.2","544","Application Data"
"41","2.679948","100.86.121.59","172.66.164.67","TCP","66","53996  >  443 [ACK] Seq=1845 Ack=17125 Win=1883 Len=0 TSval=1969631242 TSecr=1715539648"
"42","2.680003","100.86.121.59","172.66.164.67","TCP","66","[TCP Window Update] 53996  >  443 [ACK] Seq=1845 Ack=17125 Win=2048 Len=0 TSval=1969631242 TSecr=1715539648"
"43","2.680472","172.66.164.67","100.86.121.59","TCP","1514","443  >  53996 [ACK] Seq=17125 Ack=1845 Win=17 Len=1448 TSval=1715539648 TSecr=1969631144 [TCP PDU reassembled in 55]"
"44","2.680473","172.66.164.67","100.86.121.59","TCP","1514","443  >  53996 [ACK] Seq=18573 Ack=1845 Win=17 Len=1448 TSval=1715539648 TSecr=1969631144 [TCP PDU reassembled in 55]"
"45","2.680474","172.66.164.67","100.86.121.59","TCP","1514","443  >  53996 [ACK] Seq=20021 Ack=1845 Win=17 Len=1448 TSval=1715539648 TSecr=1969631144 [TCP PDU reassembled in 55]"
"46","2.680476","172.66.164.67","100.86.121.59","TCP","1514","443  >  53996 [ACK] Seq=21469 Ack=1845 Win=17 Len=1448 TSval=1715539648 TSecr=1969631144 [TCP PDU reassembled in 55]"
"47","2.680496","100.86.121.59","172.66.164.67","TCP","66","53996  >  443 [ACK] Seq=1845 Ack=22917 Win=1958 Len=0 TSval=1969631243 TSecr=1715539648"
"48","2.680527","100.86.121.59","172.66.164.67","TCP","66","[TCP Window Update] 53996  >  443 [ACK] Seq=1845 Ack=22917 Win=2048 Len=0 TSval=1969631243 TSecr=1715539648"
"49","2.681818","172.66.164.67","100.86.121.59","TCP","1514","443  >  53996 [ACK] Seq=22917 Ack=1845 Win=17 Len=1448 TSval=1715539648 TSecr=1969631144 [TCP PDU reassembled in 55]"
"50","2.681820","172.66.164.67","100.86.121.59","TCP","1514","443  >  53996 [ACK] Seq=24365 Ack=1845 Win=17 Len=1448 TSval=1715539648 TSecr=1969631144 [TCP PDU reassembled in 55]"
"51","2.681822","172.66.164.67","100.86.121.59","TCP","1514","443  >  53996 [ACK] Seq=25813 Ack=1845 Win=17 Len=1448 TSval=1715539648 TSecr=1969631144 [TCP PDU reassembled in 55]"
"52","2.681824","172.66.164.67","100.86.121.59","TCP","1514","443  >  53996 [PSH, ACK] Seq=27261 Ack=1845 Win=17 Len=1448 TSval=1715539648 TSecr=1969631144 [TCP PDU reassembled in 55]"
"53","2.681826","172.66.164.67","100.86.121.59","TCP","1514","443  >  53996 [ACK] Seq=28709 Ack=1845 Win=17 Len=1448 TSval=1715539649 TSecr=1969631144 [TCP PDU reassembled in 55]"
"54","2.681828","172.66.164.67","100.86.121.59","TCP","1514","443  >  53996 [ACK] Seq=30157 Ack=1845 Win=17 Len=1448 TSval=1715539649 TSecr=1969631144 [TCP PDU reassembled in 55]"
"55","2.681830","172.66.164.67","100.86.121.59","TLSv1.2","1308","Application Data, Application Data"
"56","2.681881","100.86.121.59","172.66.164.67","TCP","66","53996  >  443 [ACK] Seq=1845 Ack=32847 Win=1893 Len=0 TSval=1969631244 TSecr=1715539649"
"57","2.681987","100.86.121.59","172.66.164.67","TCP","66","[TCP Window Update] 53996  >  443 [ACK] Seq=1845 Ack=32847 Win=2048 Len=0 TSval=1969631244 TSecr=1715539649"
"58","2.725124","100.86.121.59","172.66.164.67","TLSv1.2","621","Application Data"
"59","2.735965","172.66.164.67","100.86.121.59","TCP","66","443  >  53996 [ACK] Seq=32847 Ack=2400 Win=17 Len=0 TSval=1715539705 TSecr=1969631287"
"60","2.743690","100.86.121.59","172.66.164.67","TLSv1.2","225","Application Data"
"61","2.753447","172.66.164.67","100.86.121.59","TCP","66","443  >  53996 [ACK] Seq=32847 Ack=2559 Win=17 Len=0 TSval=1715539723 TSecr=1969631306"
"62","2.758801","172.66.164.67","100.86.121.59","TLSv1.2","149","Application Data"
"63","2.758803","172.66.164.67","100.86.121.59","TCP","1514","443  >  53996 [ACK] Seq=32930 Ack=2559 Win=17 Len=1448 TSval=1715539728 TSecr=1969631306 [TCP PDU reassembled in 77]"
"64","2.758855","100.86.121.59","172.66.164.67","TCP","66","53996  >  443 [ACK] Seq=2559 Ack=34378 Win=2025 Len=0 TSval=1969631321 TSecr=1715539728"
"65","2.759311","172.66.164.67","100.86.121.59","TCP","1514","443  >  53996 [ACK] Seq=34378 Ack=2559 Win=17 Len=1448 TSval=1715539728 TSecr=1969631306 [TCP PDU reassembled in 77]"
"66","2.759313","172.66.164.67","100.86.121.59","TCP","1514","443  >  53996 [ACK] Seq=35826 Ack=2559 Win=17 Len=1448 TSval=1715539728 TSecr=1969631306 [TCP PDU reassembled in 77]"
"67","2.759329","100.86.121.59","172.66.164.67","TCP","66","53996  >  443 [ACK] Seq=2559 Ack=37274 Win=2003 Len=0 TSval=1969631321 TSecr=1715539728"
"68","2.759349","100.86.121.59","172.66.164.67","TCP","66","[TCP Window Update] 53996  >  443 [ACK] Seq=2559 Ack=37274 Win=2048 Len=0 TSval=1969631321 TSecr=1715539728"
"69","2.760681","172.66.164.67","100.86.121.59","TCP","1514","443  >  53996 [ACK] Seq=37274 Ack=2559 Win=17 Len=1448 TSval=1715539728 TSecr=1969631306 [TCP PDU reassembled in 77]"
"70","2.760683","172.66.164.67","100.86.121.59","TCP","1514","443  >  53996 [ACK] Seq=38722 Ack=2559 Win=17 Len=1448 TSval=1715539728 TSecr=1969631306 [TCP PDU reassembled in 77]"
"71","2.760685","172.66.164.67","100.86.121.59","TCP","1514","443  >  53996 [ACK] Seq=40170 Ack=2559 Win=17 Len=1448 TSval=1715539728 TSecr=1969631306 [TCP PDU reassembled in 77]"
"72","2.760686","172.66.164.67","100.86.121.59","TCP","1514","443  >  53996 [ACK] Seq=41618 Ack=2559 Win=17 Len=1448 TSval=1715539728 TSecr=1969631306 [TCP PDU reassembled in 77]"
"73","2.760688","172.66.164.67","100.86.121.59","TCP","1514","443  >  53996 [PSH, ACK] Seq=43066 Ack=2559 Win=17 Len=1448 TSval=1715539728 TSecr=1969631306 [TCP PDU reassembled in 77]"
"74","2.760690","172.66.164.67","100.86.121.59","TCP","1514","443  >  53996 [ACK] Seq=44514 Ack=2559 Win=17 Len=1448 TSval=1715539729 TSecr=1969631306 [TCP PDU reassembled in 77]"
"75","2.760691","172.66.164.67","100.86.121.59","TCP","1514","443  >  53996 [ACK] Seq=45962 Ack=2559 Win=17 Len=1448 TSval=1715539729 TSecr=1969631306 [TCP PDU reassembled in 77]"
"76","2.760693","172.66.164.67","100.86.121.59","TCP","1514","443  >  53996 [ACK] Seq=47410 Ack=2559 Win=17 Len=1448 TSval=1715539729 TSecr=1969631306 [TCP PDU reassembled in 77]"
"77","2.760695","172.66.164.67","100.86.121.59","TLSv1.2","544","Application Data"
"78","2.760745","100.86.121.59","172.66.164.67","TCP","66","53996  >  443 [ACK] Seq=2559 Ack=49336 Win=1860 Len=0 TSval=1969631323 TSecr=1715539729"
"79","2.760778","100.86.121.59","172.66.164.67","TCP","66","[TCP Window Update] 53996  >  443 [ACK] Seq=2559 Ack=49336 Win=2048 Len=0 TSval=1969631323 TSecr=1715539729"
"80","2.762008","172.66.164.67","100.86.121.59","TCP","1514","443  >  53996 [ACK] Seq=49336 Ack=2559 Win=17 Len=1448 TSval=1715539730 TSecr=1969631306 [TCP PDU reassembled in 83]"
"81","2.762009","172.66.164.67","100.86.121.59","TCP","1514","443  >  53996 [ACK] Seq=50784 Ack=2559 Win=17 Len=1448 TSval=1715539730 TSecr=1969631306 [TCP PDU reassembled in 83]"
"82","2.762010","172.66.164.67","100.86.121.59","TCP","1514","443  >  53996 [ACK] Seq=52232 Ack=2559 Win=17 Len=1448 TSval=1715539730 TSecr=1969631306 [TCP PDU reassembled in 83]"
"83","2.762011","172.66.164.67","100.86.121.59","TLSv1.2","659","Application Data"
"84","2.762012","172.66.164.67","100.86.121.59","TLSv1.2","97","Application Data"
"85","2.762040","100.86.121.59","172.66.164.67","TCP","66","53996  >  443 [ACK] Seq=2559 Ack=54304 Win=1971 Len=0 TSval=1969631324 TSecr=1715539730"
"86","2.762070","100.86.121.59","172.66.164.67","TCP","66","[TCP Window Update] 53996  >  443 [ACK] Seq=2559 Ack=54304 Win=2048 Len=0 TSval=1969631324 TSecr=1715539730"
"87","2.779030","172.66.164.67","100.86.121.59","TLSv1.2","128","Application Data"
"88","2.779032","172.66.164.67","100.86.121.59","TLSv1.2","139","Application Data, Application Data"
"89","2.779137","100.86.121.59","172.66.164.67","TCP","66","53996  >  443 [ACK] Seq=2559 Ack=54439 Win=2046 Len=0 TSval=1969631341 TSecr=1715539748"
"90","2.783936","100.86.121.59","172.66.164.67","TLSv1.2","1375","Application Data"
"91","2.784312","100.86.121.59","172.66.164.67","TLSv1.2","297","Application Data"
"92","2.784510","100.86.121.59","172.66.164.67","TLSv1.2","199","Application Data"
"93","2.784593","100.86.121.59","172.66.164.67","TLSv1.2","198","Application Data"
"94","2.784665","100.86.121.59","172.66.164.67","TLSv1.2","196","Application Data"
"95","2.794248","172.66.164.67","100.86.121.59","TCP","66","443  >  53996 [ACK] Seq=54439 Ack=4099 Win=17 Len=0 TSval=1715539764 TSecr=1969631346"
"96","2.795660","172.66.164.67","100.86.121.59","TCP","66","443  >  53996 [ACK] Seq=54439 Ack=4494 Win=17 Len=0 TSval=1715539765 TSecr=1969631347"
"97","2.821101","172.66.164.67","100.86.121.59","TLSv1.2","244","Application Data"
"98","2.821181","100.86.121.59","172.66.164.67","TCP","66","53996  >  443 [ACK] Seq=4494 Ack=54617 Win=2046 Len=0 TSval=1969631383 TSecr=1715539790"
"99","2.821426","172.66.164.67","100.86.121.59","TLSv1.2","290","Application Data"
"100","2.821427","172.66.164.67","100.86.121.59","TLSv1.2","97","Application Data"
"101","2.821481","100.86.121.59","172.66.164.67","TCP","66","53996  >  443 [ACK] Seq=4494 Ack=54872 Win=2045 Len=0 TSval=1969631384 TSecr=1715539791"
"102","2.821823","172.66.164.67","100.86.121.59","TLSv1.2","127","Application Data"
"103","2.821824","172.66.164.67","100.86.121.59","TLSv1.2","290","Application Data"
"104","2.821864","100.86.121.59","172.66.164.67","TCP","66","53996  >  443 [ACK] Seq=4494 Ack=55157 Win=2044 Len=0 TSval=1969631384 TSecr=1715539791"
"105","2.822842","172.66.164.67","100.86.121.59","TLSv1.2","97","Application Data"
"106","2.822843","172.66.164.67","100.86.121.59","TLSv1.2","127","Application Data"
"107","2.822873","100.86.121.59","172.66.164.67","TCP","66","53996  >  443 [ACK] Seq=4494 Ack=55249 Win=2047 Len=0 TSval=1969631385 TSecr=1715539792"
"108","2.824905","172.66.164.67","100.86.121.59","TLSv1.2","290","Application Data"
"109","2.824907","172.66.164.67","100.86.121.59","TLSv1.2","97","Application Data"
"110","2.824908","172.66.164.67","100.86.121.59","TLSv1.2","208","Application Data"
"111","2.824909","172.66.164.67","100.86.121.59","TLSv1.2","290","Application Data"
"112","2.824910","172.66.164.67","100.86.121.59","TLSv1.2","97","Application Data"
"113","2.824912","172.66.164.67","100.86.121.59","TLSv1.2","127","Application Data"
"114","2.824913","172.66.164.67","100.86.121.59","TLSv1.2","290","Application Data"
"115","2.824914","172.66.164.67","100.86.121.59","TLSv1.2","97","Application Data"
"116","2.825161","100.86.121.59","172.66.164.67","TCP","66","53996  >  443 [ACK] Seq=4494 Ack=56217 Win=2048 Len=0 TSval=1969631387 TSecr=1715539793"
"117","3.004393","100.86.121.59","172.66.164.67","TCP","54","[TCP Keep-Alive] 53996  >  443 [ACK] Seq=4493 Ack=56217 Win=2048 Len=0"
"118","3.015395","172.66.164.67","100.86.121.59","TCP","66","[TCP Keep-Alive ACK] 443  >  53996 [ACK] Seq=56217 Ack=4494 Win=17 Len=0 TSval=1715539983 TSecr=1969631387"
"119","6.921769","100.86.121.59","172.66.164.67","TLSv1.2","818","Application Data"
"120","6.974225","172.66.164.67","100.86.121.59","TCP","66","443  >  53996 [ACK] Seq=56217 Ack=5246 Win=17 Len=0 TSval=1715543944 TSecr=1969635484"
"121","7.844899","100.86.121.59","172.66.164.67","TLSv1.2","1286","Application Data"
"122","7.845843","100.86.121.59","172.66.164.67","TLSv1.2","300","Application Data"
"123","7.846234","100.86.121.59","172.66.164.67","TLSv1.2","199","Application Data"
"124","7.846558","100.86.121.59","172.66.164.67","TLSv1.2","196","Application Data"
"125","7.855287","172.66.164.67","100.86.121.59","TCP","66","443  >  53996 [ACK] Seq=56217 Ack=6466 Win=17 Len=0 TSval=1715544824 TSecr=1969636407"
"126","7.855289","172.66.164.67","100.86.121.59","TCP","66","443  >  53996 [ACK] Seq=56217 Ack=6700 Win=17 Len=0 TSval=1715544825 TSecr=1969636408"
"127","7.856531","172.66.164.67","100.86.121.59","TCP","66","443  >  53996 [ACK] Seq=56217 Ack=6963 Win=17 Len=0 TSval=1715544826 TSecr=1969636409"
"128","7.880737","172.66.164.67","100.86.121.59","TLSv1.2","150","Application Data"
"129","7.880896","100.86.121.59","172.66.164.67","TCP","66","53996  >  443 [ACK] Seq=6963 Ack=56301 Win=2047 Len=0 TSval=1969636443 TSecr=1715544850"
"130","7.881101","172.66.164.67","100.86.121.59","TLSv1.2","290","Application Data"
"131","7.881104","172.66.164.67","100.86.121.59","TLSv1.2","97","Application Data"
"132","7.881106","172.66.164.67","100.86.121.59","TLSv1.2","127","Application Data"
"133","7.881108","172.66.164.67","100.86.121.59","TLSv1.2","290","Application Data"
"134","7.881110","172.66.164.67","100.86.121.59","TLSv1.2","97","Application Data"
"135","7.881174","100.86.121.59","172.66.164.67","TCP","66","53996  >  443 [ACK] Seq=6963 Ack=56872 Win=2040 Len=0 TSval=1969636443 TSecr=1715544851"
"136","7.882836","100.86.121.59","172.66.164.67","TLSv1.2","101","Application Data"
"137","7.884414","172.66.164.67","100.86.121.59","TLSv1.2","127","Application Data"
"138","7.884416","172.66.164.67","100.86.121.59","TLSv1.2","290","Application Data"
"139","7.884418","172.66.164.67","100.86.121.59","TLSv1.2","97","Application Data"
"140","7.884484","100.86.121.59","172.66.164.67","TCP","66","53996  >  443 [ACK] Seq=6998 Ack=57188 Win=2044 Len=0 TSval=1969636447 TSecr=1715544854"
"141","7.891334","172.66.164.67","100.86.121.59","TLSv1.2","135","Application Data"
"142","7.891386","100.86.121.59","172.66.164.67","TCP","66","53996  >  443 [ACK] Seq=6998 Ack=57257 Win=2047 Len=0 TSval=1969636453 TSecr=1715544860"
"143","7.891460","172.66.164.67","100.86.121.59","TLSv1.2","290","Application Data"
"144","7.891462","172.66.164.67","100.86.121.59","TLSv1.2","97","Application Data"
"145","7.891484","100.86.121.59","172.66.164.67","TCP","66","53996  >  443 [ACK] Seq=6998 Ack=57512 Win=2045 Len=0 TSval=1969636454 TSecr=1715544860"
"146","7.936707","172.66.164.67","100.86.121.59","TCP","66","443  >  53996 [ACK] Seq=57512 Ack=6998 Win=17 Len=0 TSval=1715544905 TSecr=1969636445"
"147","8.340067","172.66.164.67","100.86.121.59","TLSv1.2","362","Application Data"
"148","8.340237","100.86.121.59","172.66.164.67","TCP","66","53996  >  443 [ACK] Seq=6998 Ack=57808 Win=2044 Len=0 TSval=1969636902 TSecr=1715545309"
"149","8.340814","172.66.164.67","100.86.121.59","TCP","1514","443  >  53996 [ACK] Seq=57808 Ack=6998 Win=17 Len=1448 TSval=1715545309 TSecr=1969636445 [TCP PDU reassembled in 164]"
"150","8.340818","172.66.164.67","100.86.121.59","TCP","1514","443  >  53996 [ACK] Seq=59256 Ack=6998 Win=17 Len=1448 TSval=1715545309 TSecr=1969636445 [TCP PDU reassembled in 164]"
"151","8.340886","100.86.121.59","172.66.164.67","TCP","66","53996  >  443 [ACK] Seq=6998 Ack=60704 Win=2003 Len=0 TSval=1969636903 TSecr=1715545309"
"152","8.340931","100.86.121.59","172.66.164.67","TCP","66","[TCP Window Update] 53996  >  443 [ACK] Seq=6998 Ack=60704 Win=2048 Len=0 TSval=1969636903 TSecr=1715545309"
"153","8.341233","172.66.164.67","100.86.121.59","TCP","1514","443  >  53996 [ACK] Seq=60704 Ack=6998 Win=17 Len=1448 TSval=1715545309 TSecr=1969636445 [TCP PDU reassembled in 164]"
"154","8.341236","172.66.164.67","100.86.121.59","TCP","1514","443  >  53996 [ACK] Seq=62152 Ack=6998 Win=17 Len=1448 TSval=1715545309 TSecr=1969636445 [TCP PDU reassembled in 164]"
"155","8.341270","100.86.121.59","172.66.164.67","TCP","66","53996  >  443 [ACK] Seq=6998 Ack=63600 Win=2003 Len=0 TSval=1969636903 TSecr=1715545309"
"156","8.341328","100.86.121.59","172.66.164.67","TCP","66","[TCP Window Update] 53996  >  443 [ACK] Seq=6998 Ack=63600 Win=2048 Len=0 TSval=1969636903 TSecr=1715545309"
"157","8.342436","172.66.164.67","100.86.121.59","TCP","1514","443  >  53996 [ACK] Seq=63600 Ack=6998 Win=17 Len=1448 TSval=1715545309 TSecr=1969636445 [TCP PDU reassembled in 164]"
"158","8.342439","172.66.164.67","100.86.121.59","TCP","1514","443  >  53996 [ACK] Seq=65048 Ack=6998 Win=17 Len=1448 TSval=1715545309 TSecr=1969636445 [TCP PDU reassembled in 164]"
"159","8.342443","172.66.164.67","100.86.121.59","TCP","1514","443  >  53996 [ACK] Seq=66496 Ack=6998 Win=17 Len=1448 TSval=1715545309 TSecr=1969636445 [TCP PDU reassembled in 164]"
"160","8.342446","172.66.164.67","100.86.121.59","TCP","1514","443  >  53996 [PSH, ACK] Seq=67944 Ack=6998 Win=17 Len=1448 TSval=1715545309 TSecr=1969636445 [TCP PDU reassembled in 164]"
"161","8.342450","172.66.164.67","100.86.121.59","TCP","1514","443  >  53996 [ACK] Seq=69392 Ack=6998 Win=17 Len=1448 TSval=1715545310 TSecr=1969636445 [TCP PDU reassembled in 164]"
"162","8.342452","172.66.164.67","100.86.121.59","TCP","1514","443  >  53996 [ACK] Seq=70840 Ack=6998 Win=17 Len=1448 TSval=1715545310 TSecr=1969636445 [TCP PDU reassembled in 164]"
"163","8.342455","172.66.164.67","100.86.121.59","TCP","1514","443  >  53996 [ACK] Seq=72288 Ack=6998 Win=17 Len=1448 TSval=1715545310 TSecr=1969636445 [TCP PDU reassembled in 164]"
"164","8.342458","172.66.164.67","100.86.121.59","TLSv1.2","544","Application Data"
"165","8.342460","172.66.164.67","100.86.121.59","TCP","1514","443  >  53996 [ACK] Seq=74214 Ack=6998 Win=17 Len=1448 TSval=1715545311 TSecr=1969636445 [TCP PDU reassembled in 174]"
"166","8.342462","172.66.164.67","100.86.121.59","TCP","1514","443  >  53996 [ACK] Seq=75662 Ack=6998 Win=17 Len=1448 TSval=1715545311 TSecr=1969636445 [TCP PDU reassembled in 174]"
"167","8.342465","172.66.164.67","100.86.121.59","TCP","1514","443  >  53996 [ACK] Seq=77110 Ack=6998 Win=17 Len=1448 TSval=1715545311 TSecr=1969636445 [TCP PDU reassembled in 174]"
"168","8.342468","172.66.164.67","100.86.121.59","TCP","1514","443  >  53996 [ACK] Seq=78558 Ack=6998 Win=17 Len=1448 TSval=1715545311 TSecr=1969636445 [TCP PDU reassembled in 174]"
"169","8.342471","172.66.164.67","100.86.121.59","TCP","1514","443  >  53996 [ACK] Seq=80006 Ack=6998 Win=17 Len=1448 TSval=1715545311 TSecr=1969636445 [TCP PDU reassembled in 174]"
"170","8.342473","172.66.164.67","100.86.121.59","TCP","1514","443  >  53996 [ACK] Seq=81454 Ack=6998 Win=17 Len=1448 TSval=1715545311 TSecr=1969636445 [TCP PDU reassembled in 174]"
"171","8.342483","172.66.164.67","100.86.121.59","TCP","1514","443  >  53996 [ACK] Seq=82902 Ack=6998 Win=17 Len=1448 TSval=1715545311 TSecr=1969636445 [TCP PDU reassembled in 174]"
"172","8.342486","172.66.164.67","100.86.121.59","TCP","1514","443  >  53996 [PSH, ACK] Seq=84350 Ack=6998 Win=17 Len=1448 TSval=1715545311 TSecr=1969636445 [TCP PDU reassembled in 174]"
"173","8.342488","172.66.164.67","100.86.121.59","TCP","1514","443  >  53996 [ACK] Seq=85798 Ack=6998 Win=17 Len=1448 TSval=1715545312 TSecr=1969636445 [TCP PDU reassembled in 174]"
"174","8.342491","172.66.164.67","100.86.121.59","TLSv1.2","244","Application Data, Application Data"
"175","8.342608","100.86.121.59","172.66.164.67","TCP","66","53996  >  443 [ACK] Seq=6998 Ack=78558 Win=1815 Len=0 TSval=1969636905 TSecr=1715545311"
"176","8.342640","100.86.121.59","172.66.164.67","TCP","66","53996  >  443 [ACK] Seq=6998 Ack=87424 Win=1677 Len=0 TSval=1969636905 TSecr=1715545312"
"177","8.342750","100.86.121.59","172.66.164.67","TCP","66","[TCP Window Update] 53996  >  443 [ACK] Seq=6998 Ack=87424 Win=2048 Len=0 TSval=1969636905 TSecr=1715545312"
"178","8.397473","100.86.121.59","172.66.164.67","TLSv1.2","213","Application Data"
"179","8.411857","172.66.164.67","100.86.121.59","TCP","66","443  >  53996 [ACK] Seq=87424 Ack=7145 Win=17 Len=0 TSval=1715545376 TSecr=1969636960"
"180","8.421808","100.86.121.59","172.66.164.67","TLSv1.2","861","Application Data"
"181","8.422276","100.86.121.59","172.66.164.67","TLSv1.2","251","Application Data"
"182","8.422812","100.86.121.59","172.66.164.67","TLSv1.2","199","Application Data"
"183","8.422918","100.86.121.59","172.66.164.67","TLSv1.2","346","Application Data"
"184","8.423147","100.86.121.59","172.66.164.67","TLSv1.2","905","Application Data"
"185","8.432432","172.66.164.67","100.86.121.59","TLSv1.2","177","Application Data"
"186","8.432434","172.66.164.67","100.86.121.59","TLSv1.2","108","Application Data"
"187","8.432505","100.86.121.59","172.66.164.67","TCP","66","53996  >  443 [ACK] Seq=9377 Ack=87577 Win=2046 Len=0 TSval=1969636995 TSecr=1715545402"
"188","8.432538","172.66.164.67","100.86.121.59","TLSv1.2","97","Application Data"
"189","8.432572","100.86.121.59","172.66.164.67","TCP","66","53996  >  443 [ACK] Seq=9377 Ack=87608 Win=2046 Len=0 TSval=1969636995 TSecr=1715545402"
"190","8.433635","172.66.164.67","100.86.121.59","TCP","66","443  >  53996 [ACK] Seq=87608 Ack=8258 Win=17 Len=0 TSval=1715545403 TSecr=1969636984"
"191","8.436389","172.66.164.67","100.86.121.59","TCP","66","443  >  53996 [ACK] Seq=87608 Ack=9377 Win=17 Len=0 TSval=1715545405 TSecr=1969636985"
"192","8.456667","172.66.164.67","100.86.121.59","TLSv1.2","127","Application Data"
"193","8.456669","172.66.164.67","100.86.121.59","TLSv1.2","290","Application Data"
"194","8.456743","100.86.121.59","172.66.164.67","TCP","66","53996  >  443 [ACK] Seq=9377 Ack=87893 Win=2044 Len=0 TSval=1969637019 TSecr=1715545426"
"195","8.456757","172.66.164.67","100.86.121.59","TLSv1.2","97","Application Data"
"196","8.456791","100.86.121.59","172.66.164.67","TCP","66","53996  >  443 [ACK] Seq=9377 Ack=87924 Win=2044 Len=0 TSval=1969637019 TSecr=1715545426"
"197","8.457548","172.66.164.67","100.86.121.59","TLSv1.2","127","Application Data"
"198","8.457549","172.66.164.67","100.86.121.59","TLSv1.2","290","Application Data"
"199","8.457577","100.86.121.59","172.66.164.67","TCP","66","53996  >  443 [ACK] Seq=9377 Ack=88209 Win=2044 Len=0 TSval=1969637020 TSecr=1715545427"
"200","8.457651","172.66.164.67","100.86.121.59","TLSv1.2","97","Application Data"
"201","8.457673","100.86.121.59","172.66.164.67","TCP","66","53996  >  443 [ACK] Seq=9377 Ack=88240 Win=2048 Len=0 TSval=1969637020 TSecr=1715545427"
"202","8.460543","172.66.164.67","100.86.121.59","TLSv1.2","127","Application Data"
"203","8.460545","172.66.164.67","100.86.121.59","TLSv1.2","290","Application Data"
"204","8.460596","100.86.121.59","172.66.164.67","TCP","66","53996  >  443 [ACK] Seq=9377 Ack=88525 Win=2048 Len=0 TSval=1969637023 TSecr=1715545430"
"205","8.460673","172.66.164.67","100.86.121.59","TLSv1.2","97","Application Data"
"206","8.460711","100.86.121.59","172.66.164.67","TCP","66","53996  >  443 [ACK] Seq=9377 Ack=88556 Win=2048 Len=0 TSval=1969637023 TSecr=1715545430"
"207","8.461594","172.66.164.67","100.86.121.59","TLSv1.2","127","Application Data"
"208","8.461677","172.66.164.67","100.86.121.59","TLSv1.2","290","Application Data"
"209","8.461932","172.66.164.67","100.86.121.59","TLSv1.2","97","Application Data"
"210","8.462026","172.66.164.67","100.86.121.59","TLSv1.2","127","Application Data"
"211","8.462232","172.66.164.67","100.86.121.59","TLSv1.2","290","Application Data"
"212","8.462233","172.66.164.67","100.86.121.59","TLSv1.2","97","Application Data"
"213","8.462875","100.86.121.59","172.66.164.67","TCP","66","53996  >  443 [ACK] Seq=9377 Ack=89188 Win=2048 Len=0 TSval=1969637025 TSecr=1715545431"
"214","8.617726","100.86.121.59","172.66.164.67","TCP","54","[TCP Keep-Alive] 53996  >  443 [ACK] Seq=9376 Ack=89188 Win=2048 Len=0"
"215","8.630690","172.66.164.67","100.86.121.59","TCP","66","[TCP Keep-Alive ACK] 443  >  53996 [ACK] Seq=89188 Ack=9377 Win=17 Len=0 TSval=1715545598 TSecr=1969637025"
"216","15.452701","100.86.121.59","172.66.164.67","TLSv1.2","467","Application Data"
"217","15.503469","172.66.164.67","100.86.121.59","TCP","66","443  >  53996 [ACK] Seq=89188 Ack=9778 Win=17 Len=0 TSval=1715552473 TSecr=1969644015"
"218","15.549696","172.66.164.67","100.86.121.59","TLSv1.2","202","Application Data"
"219","15.549699","172.66.164.67","100.86.121.59","TCP","1514","443  >  53996 [ACK] Seq=89324 Ack=9778 Win=17 Len=1448 TSval=1715552519 TSecr=1969644015 [TCP PDU reassembled in 233]"
"220","15.549810","100.86.121.59","172.66.164.67","TCP","66","53996  >  443 [ACK] Seq=9778 Ack=90772 Win=2024 Len=0 TSval=1969644112 TSecr=1715552519"
"221","15.550244","172.66.164.67","100.86.121.59","TCP","1514","443  >  53996 [ACK] Seq=90772 Ack=9778 Win=17 Len=1448 TSval=1715552519 TSecr=1969644015 [TCP PDU reassembled in 233]"
"222","15.550246","172.66.164.67","100.86.121.59","TCP","1514","443  >  53996 [ACK] Seq=92220 Ack=9778 Win=17 Len=1448 TSval=1715552519 TSecr=1969644015 [TCP PDU reassembled in 233]"
"223","15.550303","100.86.121.59","172.66.164.67","TCP","66","53996  >  443 [ACK] Seq=9778 Ack=93668 Win=2003 Len=0 TSval=1969644112 TSecr=1715552519"
"224","15.550347","100.86.121.59","172.66.164.67","TCP","66","[TCP Window Update] 53996  >  443 [ACK] Seq=9778 Ack=93668 Win=2048 Len=0 TSval=1969644112 TSecr=1715552519"
"225","15.551323","172.66.164.67","100.86.121.59","TCP","1514","443  >  53996 [ACK] Seq=93668 Ack=9778 Win=17 Len=1448 TSval=1715552519 TSecr=1969644015 [TCP PDU reassembled in 233]"
"226","15.551325","172.66.164.67","100.86.121.59","TCP","1514","443  >  53996 [ACK] Seq=95116 Ack=9778 Win=17 Len=1448 TSval=1715552519 TSecr=1969644015 [TCP PDU reassembled in 233]"
"227","15.551327","172.66.164.67","100.86.121.59","TCP","1514","443  >  53996 [ACK] Seq=96564 Ack=9778 Win=17 Len=1448 TSval=1715552519 TSecr=1969644015 [TCP PDU reassembled in 233]"
"228","15.551328","172.66.164.67","100.86.121.59","TCP","1514","443  >  53996 [ACK] Seq=98012 Ack=9778 Win=17 Len=1448 TSval=1715552519 TSecr=1969644015 [TCP PDU reassembled in 233]"
"229","15.551330","172.66.164.67","100.86.121.59","TCP","1514","443  >  53996 [PSH, ACK] Seq=99460 Ack=9778 Win=17 Len=1448 TSval=1715552519 TSecr=1969644015 [TCP PDU reassembled in 233]"
"230","15.551331","172.66.164.67","100.86.121.59","TCP","1514","443  >  53996 [ACK] Seq=100908 Ack=9778 Win=17 Len=1448 TSval=1715552520 TSecr=1969644015 [TCP PDU reassembled in 233]"
"231","15.551333","172.66.164.67","100.86.121.59","TCP","1514","443  >  53996 [ACK] Seq=102356 Ack=9778 Win=17 Len=1448 TSval=1715552520 TSecr=1969644015 [TCP PDU reassembled in 233]"
"232","15.551334","172.66.164.67","100.86.121.59","TCP","1514","443  >  53996 [ACK] Seq=103804 Ack=9778 Win=17 Len=1448 TSval=1715552520 TSecr=1969644015 [TCP PDU reassembled in 233]"
"233","15.551336","172.66.164.67","100.86.121.59","TLSv1.2","544","Application Data"
"234","15.551393","100.86.121.59","172.66.164.67","TCP","66","53996  >  443 [ACK] Seq=9778 Ack=105730 Win=1860 Len=0 TSval=1969644113 TSecr=1715552520"
"235","15.551469","100.86.121.59","172.66.164.67","TCP","66","[TCP Window Update] 53996  >  443 [ACK] Seq=9778 Ack=105730 Win=2048 Len=0 TSval=1969644113 TSecr=1715552520"
"236","15.551757","172.66.164.67","100.86.121.59","TCP","1514","443  >  53996 [ACK] Seq=105730 Ack=9778 Win=17 Len=1448 TSval=1715552520 TSecr=1969644015 [TCP PDU reassembled in 248]"
"237","15.551758","172.66.164.67","100.86.121.59","TCP","1514","443  >  53996 [ACK] Seq=107178 Ack=9778 Win=17 Len=1448 TSval=1715552520 TSecr=1969644015 [TCP PDU reassembled in 248]"
"238","15.551759","172.66.164.67","100.86.121.59","TCP","1514","443  >  53996 [ACK] Seq=108626 Ack=9778 Win=17 Len=1448 TSval=1715552520 TSecr=1969644015 [TCP PDU reassembled in 248]"
"239","15.551760","172.66.164.67","100.86.121.59","TCP","1514","443  >  53996 [ACK] Seq=110074 Ack=9778 Win=17 Len=1448 TSval=1715552520 TSecr=1969644015 [TCP PDU reassembled in 248]"
"240","15.551789","100.86.121.59","172.66.164.67","TCP","66","53996  >  443 [ACK] Seq=9778 Ack=111522 Win=1958 Len=0 TSval=1969644114 TSecr=1715552520"
"241","15.551825","100.86.121.59","172.66.164.67","TCP","66","[TCP Window Update] 53996  >  443 [ACK] Seq=9778 Ack=111522 Win=2048 Len=0 TSval=1969644114 TSecr=1715552520"
"242","15.553247","172.66.164.67","100.86.121.59","TCP","1514","443  >  53996 [ACK] Seq=111522 Ack=9778 Win=17 Len=1448 TSval=1715552520 TSecr=1969644015 [TCP PDU reassembled in 248]"
"243","15.553248","172.66.164.67","100.86.121.59","TCP","1514","443  >  53996 [ACK] Seq=112970 Ack=9778 Win=17 Len=1448 TSval=1715552520 TSecr=1969644015 [TCP PDU reassembled in 248]"
"244","15.553249","172.66.164.67","100.86.121.59","TCP","1514","443  >  53996 [ACK] Seq=114418 Ack=9778 Win=17 Len=1448 TSval=1715552520 TSecr=1969644015 [TCP PDU reassembled in 248]"
"245","15.553250","172.66.164.67","100.86.121.59","TCP","1514","443  >  53996 [PSH, ACK] Seq=115866 Ack=9778 Win=17 Len=1448 TSval=1715552520 TSecr=1969644015 [TCP PDU reassembled in 248]"
"246","15.553251","172.66.164.67","100.86.121.59","TCP","1514","443  >  53996 [ACK] Seq=117314 Ack=9778 Win=17 Len=1448 TSval=1715552521 TSecr=1969644015 [TCP PDU reassembled in 248]"
"247","15.553252","172.66.164.67","100.86.121.59","TCP","1514","443  >  53996 [ACK] Seq=118762 Ack=9778 Win=17 Len=1448 TSval=1715552521 TSecr=1969644015 [TCP PDU reassembled in 248]"
"248","15.553253","172.66.164.67","100.86.121.59","TLSv1.2","1385","Application Data, Application Data"
"249","15.553287","100.86.121.59","172.66.164.67","TCP","66","53996  >  443 [ACK] Seq=9778 Ack=121529 Win=1892 Len=0 TSval=1969644115 TSecr=1715552521"
"250","15.553561","100.86.121.59","172.66.164.67","TLSv1.2","101","Application Data"
"251","15.553599","100.86.121.59","172.66.164.67","TCP","66","[TCP Window Update] 53996  >  443 [ACK] Seq=9813 Ack=121529 Win=2048 Len=0 TSval=1969644116 TSecr=1715552521"
"252","15.563622","172.66.164.67","100.86.121.59","TCP","66","443  >  53996 [ACK] Seq=121529 Ack=9813 Win=17 Len=0 TSval=1715552533 TSecr=1969644116"
"253","15.591270","100.86.121.59","172.66.164.67","TLSv1.2","190","Application Data"
"254","15.602551","172.66.164.67","100.86.121.59","TCP","66","443  >  53996 [ACK] Seq=121529 Ack=9937 Win=17 Len=0 TSval=1715552572 TSecr=1969644153"
"255","15.625430","100.86.121.59","172.66.164.67","TLSv1.2","865","Application Data"
"256","15.625895","100.86.121.59","172.66.164.67","TLSv1.2","1079","Application Data"
"257","15.626040","100.86.121.59","172.66.164.67","TLSv1.2","280","Application Data"
"258","15.626119","100.86.121.59","172.66.164.67","TLSv1.2","199","Application Data"
"259","15.626233","100.86.121.59","172.66.164.67","TLSv1.2","217","Application Data"
"260","15.638898","172.66.164.67","100.86.121.59","TLSv1.2","128","Application Data"
"261","15.638965","100.86.121.59","172.66.164.67","TCP","66","53996  >  443 [ACK] Seq=12247 Ack=121591 Win=2048 Len=0 TSval=1969644201 TSecr=1715552595"
"262","15.639111","172.66.164.67","100.86.121.59","TLSv1.2","108","Application Data"
"263","15.639112","172.66.164.67","100.86.121.59","TLSv1.2","97","Application Data"
"264","15.639158","100.86.121.59","172.66.164.67","TCP","66","53996  >  443 [ACK] Seq=12247 Ack=121664 Win=2047 Len=0 TSval=1969644201 TSecr=1715552595"
"265","15.642415","172.66.164.67","100.86.121.59","TCP","66","443  >  53996 [ACK] Seq=121664 Ack=11749 Win=17 Len=0 TSval=1715552612 TSecr=1969644187"
"266","15.642608","172.66.164.67","100.86.121.59","TCP","66","443  >  53996 [ACK] Seq=121664 Ack=12247 Win=17 Len=0 TSval=1715552612 TSecr=1969644188"
"267","15.701030","172.66.164.67","100.86.121.59","TLSv1.2","127","Application Data"
"268","15.701031","172.66.164.67","100.86.121.59","TLSv1.2","290","Application Data"
"269","15.701032","172.66.164.67","100.86.121.59","TLSv1.2","97","Application Data"
"270","15.701035","172.66.164.67","100.86.121.59","TLSv1.2","127","Application Data"
"271","15.701035","172.66.164.67","100.86.121.59","TLSv1.2","290","Application Data"
"272","15.701036","172.66.164.67","100.86.121.59","TLSv1.2","97","Application Data"
"273","15.701037","172.66.164.67","100.86.121.59","TLSv1.2","127","Application Data"
"274","15.701037","172.66.164.67","100.86.121.59","TLSv1.2","290","Application Data"
"275","15.701038","172.66.164.67","100.86.121.59","TLSv1.2","97","Application Data"
"276","15.701040","172.66.164.67","100.86.121.59","TLSv1.2","127","Application Data"
"277","15.701040","172.66.164.67","100.86.121.59","TLSv1.2","290","Application Data"
"278","15.701041","172.66.164.67","100.86.121.59","TLSv1.2","97","Application Data"
"279","15.701042","172.66.164.67","100.86.121.59","TLSv1.2","127","Application Data"
"280","15.701043","172.66.164.67","100.86.121.59","TLSv1.2","290","Application Data"
"281","15.701043","172.66.164.67","100.86.121.59","TLSv1.2","97","Application Data"
"282","15.701104","100.86.121.59","172.66.164.67","TCP","66","53996  >  443 [ACK] Seq=12247 Ack=122612 Win=2034 Len=0 TSval=1969644263 TSecr=1715552639"
"283","15.701156","100.86.121.59","172.66.164.67","TCP","66","53996  >  443 [ACK] Seq=12247 Ack=123244 Win=2025 Len=0 TSval=1969644263 TSecr=1715552643"
"284","15.719247","172.66.164.67","100.86.121.59","TCP","97","[TCP Spurious Retransmission] 443  >  53996 [PSH, ACK] Seq=123213 Ack=12247 Win=17 Len=31 TSval=1715552672 TSecr=1969644201"
"285","15.719332","100.86.121.59","172.66.164.67","TCP","78","[TCP Dup ACK 283#1] 53996  >  443 [ACK] Seq=12247 Ack=123244 Win=2048 Len=0 TSval=1969644281 TSecr=1715552672 SLE=123213 SRE=123244"
"286","18.662768","100.86.121.59","172.66.164.67","TCP","54","54220  >  443 [ACK] Seq=1 Ack=1 Win=2048 Len=0"
"287","18.674382","172.66.164.67","100.86.121.59","TCP","66","[TCP ACKed unseen segment] 443  >  54220 [ACK] Seq=1 Ack=2 Win=16 Len=0 TSval=1127028808 TSecr=579974848"
"288","20.708912","100.86.121.59","172.66.164.67","TLSv1.2","349","Application Data"
"289","20.709199","100.86.121.59","172.66.164.67","TLSv1.2","753","Application Data"
"290","20.723704","172.66.164.67","100.86.121.59","TCP","66","443  >  53996 [ACK] Seq=123244 Ack=13217 Win=17 Len=0 TSval=1715557693 TSecr=1969649271"
"291","20.757418","172.66.164.67","100.86.121.59","TLSv1.2","158","Application Data"
"292","20.757421","172.66.164.67","100.86.121.59","TLSv1.2","290","Application Data"
"293","20.757424","172.66.164.67","100.86.121.59","TLSv1.2","97","Application Data"
"294","20.757487","172.66.164.67","100.86.121.59","TLSv1.2","127","Application Data"
"295","20.757567","172.66.164.67","100.86.121.59","TLSv1.2","290","Application Data"
"296","20.757636","100.86.121.59","172.66.164.67","TCP","66","53996  >  443 [ACK] Seq=13217 Ack=123591 Win=2043 Len=0 TSval=1969649320 TSecr=1715557727"
"297","20.757696","100.86.121.59","172.66.164.67","TCP","66","53996  >  443 [ACK] Seq=13217 Ack=123652 Win=2043 Len=0 TSval=1969649320 TSecr=1715557727"
"298","20.757731","100.86.121.59","172.66.164.67","TCP","66","53996  >  443 [ACK] Seq=13217 Ack=123876 Win=2040 Len=0 TSval=1969649320 TSecr=1715557727"
"299","20.757812","172.66.164.67","100.86.121.59","TLSv1.2","97","Application Data"
"300","20.757857","100.86.121.59","172.66.164.67","TCP","66","53996  >  443 [ACK] Seq=13217 Ack=123907 Win=2048 Len=0 TSval=1969649320 TSecr=1715557727"
"301","20.759292","100.86.121.59","172.66.164.67","TLSv1.2","101","Application Data"
"302","20.809796","172.66.164.67","100.86.121.59","TCP","66","443  >  53996 [ACK] Seq=123907 Ack=13252 Win=17 Len=0 TSval=1715557779 TSecr=1969649321"
"303","25.712080","100.86.121.59","172.66.164.67","TLSv1.2","199","Application Data"
"304","25.712527","100.86.121.59","172.66.164.67","TLSv1.2","196","Application Data"
"305","25.712864","100.86.121.59","172.66.164.67","TLSv1.2","1108","Application Data"
"306","25.724264","172.66.164.67","100.86.121.59","TCP","66","443  >  53996 [ACK] Seq=123907 Ack=13385 Win=17 Len=0 TSval=1715562693 TSecr=1969654274"
"307","25.724266","172.66.164.67","100.86.121.59","TCP","66","443  >  53996 [ACK] Seq=123907 Ack=13515 Win=17 Len=0 TSval=1715562694 TSecr=1969654274"
"308","25.724979","172.66.164.67","100.86.121.59","TCP","66","443  >  53996 [ACK] Seq=123907 Ack=14557 Win=17 Len=0 TSval=1715562694 TSecr=1969654275"
"309","25.751171","172.66.164.67","100.86.121.59","TLSv1.2","150","Application Data"
"310","25.751174","172.66.164.67","100.86.121.59","TLSv1.2","290","Application Data"
"311","25.751258","100.86.121.59","172.66.164.67","TCP","66","53996  >  443 [ACK] Seq=14557 Ack=124215 Win=2044 Len=0 TSval=1969654313 TSecr=1715562720"
"312","25.751430","172.66.164.67","100.86.121.59","TLSv1.2","97","Application Data"
"313","25.751491","100.86.121.59","172.66.164.67","TCP","66","53996  >  443 [ACK] Seq=14557 Ack=124246 Win=2048 Len=0 TSval=1969654313 TSecr=1715562721"
"314","25.758888","172.66.164.67","100.86.121.59","TLSv1.2","127","Application Data"
"315","25.759015","100.86.121.59","172.66.164.67","TCP","66","53996  >  443 [ACK] Seq=14557 Ack=124307 Win=2048 Len=0 TSval=1969654321 TSecr=1715562728"
"316","25.759039","172.66.164.67","100.86.121.59","TLSv1.2","290","Application Data"
"317","25.759085","100.86.121.59","172.66.164.67","TCP","66","53996  >  443 [ACK] Seq=14557 Ack=124531 Win=2045 Len=0 TSval=1969654321 TSecr=1715562728"
"318","25.759605","172.66.164.67","100.86.121.59","TLSv1.2","97","Application Data"
"319","25.759640","100.86.121.59","172.66.164.67","TCP","66","53996  >  443 [ACK] Seq=14557 Ack=124562 Win=2045 Len=0 TSval=1969654322 TSecr=1715562728"
"320","25.761743","172.66.164.67","100.86.121.59","TLSv1.2","208","Application Data"
"321","25.761746","172.66.164.67","100.86.121.59","TLSv1.2","290","Application Data"
"322","25.761829","100.86.121.59","172.66.164.67","TCP","66","53996  >  443 [ACK] Seq=14557 Ack=124928 Win=2043 Len=0 TSval=1969654324 TSecr=1715562731"
"323","25.762009","172.66.164.67","100.86.121.59","TLSv1.2","97","Application Data"
"324","25.762047","100.86.121.59","172.66.164.67","TCP","66","53996  >  443 [ACK] Seq=14557 Ack=124959 Win=2043 Len=0 TSval=1969654324 TSecr=1715562731"
"325","25.762246","100.86.121.59","172.66.164.67","TLSv1.2","101","Application Data"
"326","25.814105","172.66.164.67","100.86.121.59","TCP","66","443  >  53996 [ACK] Seq=124959 Ack=14592 Win=17 Len=0 TSval=1715562784 TSecr=1969654324"
"327","30.594537","100.86.121.59","172.66.164.67","TLSv1.2","274","Application Data"
"328","30.611053","172.66.164.67","100.86.121.59","TCP","66","443  >  53996 [ACK] Seq=124959 Ack=14800 Win=17 Len=0 TSval=1715567580 TSecr=1969659156"
"329","30.634956","172.66.164.67","100.86.121.59","TLSv1.2","151","Application Data"
"330","30.634959","172.66.164.67","100.86.121.59","TLSv1.2","108","Application Data"
"331","30.635076","172.66.164.67","100.86.121.59","TLSv1.2","97","Application Data"
"332","30.635097","100.86.121.59","172.66.164.67","TCP","66","53996  >  443 [ACK] Seq=14800 Ack=125086 Win=2047 Len=0 TSval=1969659197 TSecr=1715567604"
"333","30.635178","100.86.121.59","172.66.164.67","TCP","66","53996  >  443 [ACK] Seq=14800 Ack=125117 Win=2047 Len=0 TSval=1969659197 TSecr=1715567604"
"334","30.766225","100.86.121.59","172.66.164.67","TLSv1.2","197","Application Data"
"335","30.800393","172.66.164.67","100.86.121.59","TLSv1.2","127","Application Data"
"336","30.800397","172.66.164.67","100.86.121.59","TLSv1.2","290","Application Data"
"337","30.800453","172.66.164.67","100.86.121.59","TLSv1.2","97","Application Data"
"338","30.800640","100.86.121.59","172.66.164.67","TCP","66","53996  >  443 [ACK] Seq=14931 Ack=125402 Win=2044 Len=0 TSval=1969659362 TSecr=1715567770"
"339","30.800719","100.86.121.59","172.66.164.67","TCP","66","53996  >  443 [ACK] Seq=14931 Ack=125433 Win=2044 Len=0 TSval=1969659363 TSecr=1715567770"
"340","30.803115","100.86.121.59","172.66.164.67","TLSv1.2","101","Application Data"
"341","30.853276","172.66.164.67","100.86.121.59","TCP","66","443  >  53996 [ACK] Seq=125433 Ack=14966 Win=17 Len=0 TSval=1715567823 TSecr=1969659365"
"342","45.594037","100.86.121.59","172.66.164.67","TLSv1.2","208","Application Data"
"343","45.594138","100.86.121.59","172.66.164.67","TLSv1.2","105","Application Data"
"344","45.604478","172.66.164.67","100.86.121.59","TCP","66","443  >  53996 [ACK] Seq=125433 Ack=15147 Win=17 Len=0 TSval=1715582574 TSecr=1969674156"
"345","45.604514","172.66.164.67","100.86.121.59","TLSv1.2","105","Application Data"
"346","45.604654","100.86.121.59","172.66.164.67","TCP","66","53996  >  443 [ACK] Seq=15147 Ack=125472 Win=2048 Len=0 TSval=1969674166 TSecr=1715582574"
"347","45.626872","172.66.164.67","100.86.121.59","TLSv1.2","151","Application Data"
"348","45.626876","172.66.164.67","100.86.121.59","TLSv1.2","108","Application Data"
"349","45.627091","172.66.164.67","100.86.121.59","TLSv1.2","97","Application Data"
"350","45.627094","100.86.121.59","172.66.164.67","TCP","66","53996  >  443 [ACK] Seq=15147 Ack=125599 Win=2047 Len=0 TSval=1969674189 TSecr=1715582595"
"351","45.627193","100.86.121.59","172.66.164.67","TCP","66","53996  >  443 [ACK] Seq=15147 Ack=125630 Win=2047 Len=0 TSval=1969674189 TSecr=1715582595"
"352","45.629465","100.86.121.59","172.66.164.67","TLSv1.2","101","Application Data"
"353","45.680594","172.66.164.67","100.86.121.59","TCP","66","443  >  53996 [ACK] Seq=125630 Ack=15182 Win=17 Len=0 TSval=1715582650 TSecr=1969674191"
"354","45.762157","100.86.121.59","172.66.164.67","TLSv1.2","348","Application Data"
"355","45.765129","100.86.121.59","172.66.164.67","TLSv1.2","753","Application Data"
"356","45.772358","172.66.164.67","100.86.121.59","TCP","66","443  >  53996 [ACK] Seq=125630 Ack=15464 Win=17 Len=0 TSval=1715582742 TSecr=1969674324"
"357","45.775127","172.66.164.67","100.86.121.59","TCP","66","443  >  53996 [ACK] Seq=125630 Ack=16151 Win=17 Len=0 TSval=1715582744 TSecr=1969674327"
"358","45.797888","172.66.164.67","100.86.121.59","TLSv1.2","127","Application Data"
"359","45.797892","172.66.164.67","100.86.121.59","TLSv1.2","290","Application Data"
"360","45.798088","100.86.121.59","172.66.164.67","TCP","66","53996  >  443 [ACK] Seq=16151 Ack=125915 Win=2044 Len=0 TSval=1969674360 TSecr=1715582767"
"361","45.798233","172.66.164.67","100.86.121.59","TLSv1.2","97","Application Data"
"362","45.798345","100.86.121.59","172.66.164.67","TCP","66","53996  >  443 [ACK] Seq=16151 Ack=125946 Win=2044 Len=0 TSval=1969674360 TSecr=1715582767"
"363","45.802007","172.66.164.67","100.86.121.59","TLSv1.2","127","Application Data"
"364","45.802010","172.66.164.67","100.86.121.59","TLSv1.2","290","Application Data"
"365","45.802011","172.66.164.67","100.86.121.59","TLSv1.2","97","Application Data"
"366","45.802133","100.86.121.59","172.66.164.67","TCP","66","53996  >  443 [ACK] Seq=16151 Ack=126262 Win=2044 Len=0 TSval=1969674364 TSecr=1715582771"
"367","48.062597","100.86.121.59","172.66.164.67","TLSv1.2","326","Application Data"
"368","48.115224","172.66.164.67","100.86.121.59","TCP","66","443  >  53996 [ACK] Seq=126262 Ack=16411 Win=17 Len=0 TSval=1715585085 TSecr=1969676624"
"369","48.550311","172.66.164.67","100.86.121.59","TLSv1.2","189","Application Data"
"370","48.550315","172.66.164.67","100.86.121.59","TCP","1514","443  >  53996 [ACK] Seq=126385 Ack=16411 Win=17 Len=1448 TSval=1715585414 TSecr=1969676624 [TCP PDU reassembled in 381]"
"371","48.550318","172.66.164.67","100.86.121.59","TCP","1514","443  >  53996 [ACK] Seq=127833 Ack=16411 Win=17 Len=1448 TSval=1715585414 TSecr=1969676624 [TCP PDU reassembled in 381]"
"372","48.550329","172.66.164.67","100.86.121.59","TCP","1514","443  >  53996 [ACK] Seq=129281 Ack=16411 Win=17 Len=1448 TSval=1715585414 TSecr=1969676624 [TCP PDU reassembled in 381]"
"373","48.550331","172.66.164.67","100.86.121.59","TCP","1514","443  >  53996 [ACK] Seq=130729 Ack=16411 Win=17 Len=1448 TSval=1715585414 TSecr=1969676624 [TCP PDU reassembled in 381]"
"374","48.550334","172.66.164.67","100.86.121.59","TCP","1514","443  >  53996 [ACK] Seq=132177 Ack=16411 Win=17 Len=1448 TSval=1715585414 TSecr=1969676624 [TCP PDU reassembled in 381]"
"375","48.550337","172.66.164.67","100.86.121.59","TCP","1514","443  >  53996 [ACK] Seq=133625 Ack=16411 Win=17 Len=1448 TSval=1715585414 TSecr=1969676624 [TCP PDU reassembled in 381]"
"376","48.550340","172.66.164.67","100.86.121.59","TCP","1514","443  >  53996 [ACK] Seq=135073 Ack=16411 Win=17 Len=1448 TSval=1715585414 TSecr=1969676624 [TCP PDU reassembled in 381]"
"377","48.550344","172.66.164.67","100.86.121.59","TCP","1514","443  >  53996 [PSH, ACK] Seq=136521 Ack=16411 Win=17 Len=1448 TSval=1715585414 TSecr=1969676624 [TCP PDU reassembled in 381]"
"378","48.550347","172.66.164.67","100.86.121.59","TCP","1514","443  >  53996 [ACK] Seq=137969 Ack=16411 Win=17 Len=1448 TSval=1715585415 TSecr=1969676624 [TCP PDU reassembled in 381]"
"379","48.550350","172.66.164.67","100.86.121.59","TCP","1514","443  >  53996 [ACK] Seq=139417 Ack=16411 Win=17 Len=1448 TSval=1715585415 TSecr=1969676624 [TCP PDU reassembled in 381]"
"380","48.550353","172.66.164.67","100.86.121.59","TCP","1514","443  >  53996 [ACK] Seq=140865 Ack=16411 Win=17 Len=1448 TSval=1715585415 TSecr=1969676624 [TCP PDU reassembled in 381]"
"381","48.550446","172.66.164.67","100.86.121.59","TLSv1.2","544","Application Data"
"382","48.550449","172.66.164.67","100.86.121.59","TCP","1514","443  >  53996 [ACK] Seq=142791 Ack=16411 Win=17 Len=1448 TSval=1715585415 TSecr=1969676624 [TCP PDU reassembled in 393]"
"383","48.550544","172.66.164.67","100.86.121.59","TCP","1514","443  >  53996 [ACK] Seq=144239 Ack=16411 Win=17 Len=1448 TSval=1715585415 TSecr=1969676624 [TCP PDU reassembled in 393]"
"384","48.550547","172.66.164.67","100.86.121.59","TCP","1514","443  >  53996 [ACK] Seq=145687 Ack=16411 Win=17 Len=1448 TSval=1715585415 TSecr=1969676624 [TCP PDU reassembled in 393]"
"385","48.550653","100.86.121.59","172.66.164.67","TCP","66","53996  >  443 [ACK] Seq=16411 Ack=142313 Win=1798 Len=0 TSval=1969677112 TSecr=1715585415"
"386","48.550760","100.86.121.59","172.66.164.67","TCP","66","53996  >  443 [ACK] Seq=16411 Ack=144239 Win=1768 Len=0 TSval=1969677113 TSecr=1715585415"
"387","48.550784","100.86.121.59","172.66.164.67","TCP","66","53996  >  443 [ACK] Seq=16411 Ack=147135 Win=1723 Len=0 TSval=1969677113 TSecr=1715585415"
"388","48.551449","100.86.121.59","172.66.164.67","TCP","66","[TCP Window Update] 53996  >  443 [ACK] Seq=16411 Ack=147135 Win=2048 Len=0 TSval=1969677113 TSecr=1715585415"
"389","48.551988","172.66.164.67","100.86.121.59","TCP","1514","443  >  53996 [ACK] Seq=147135 Ack=16411 Win=17 Len=1448 TSval=1715585415 TSecr=1969676624 [TCP PDU reassembled in 393]"
"390","48.551991","172.66.164.67","100.86.121.59","TCP","1514","443  >  53996 [ACK] Seq=148583 Ack=16411 Win=17 Len=1448 TSval=1715585415 TSecr=1969676624 [TCP PDU reassembled in 393]"
"391","48.551994","172.66.164.67","100.86.121.59","TCP","1514","443  >  53996 [ACK] Seq=150031 Ack=16411 Win=17 Len=1448 TSval=1715585415 TSecr=1969676624 [TCP PDU reassembled in 393]"
"392","48.551997","172.66.164.67","100.86.121.59","TCP","1514","443  >  53996 [ACK] Seq=151479 Ack=16411 Win=17 Len=1448 TSval=1715585415 TSecr=1969676624 [TCP PDU reassembled in 393]"
"393","48.552000","172.66.164.67","100.86.121.59","TLSv1.2","1125","Application Data"
"394","48.552002","172.66.164.67","100.86.121.59","TLSv1.2","97","Application Data"
"395","48.552003","172.66.164.67","100.86.121.59","TCP","97","[TCP Retransmission] 443  >  53996 [PSH, ACK] Seq=153986 Ack=16411 Win=17 Len=31 TSval=1715585444 TSecr=1969676624"
"396","48.552069","100.86.121.59","172.66.164.67","TCP","66","53996  >  443 [ACK] Seq=16411 Ack=154017 Win=1941 Len=0 TSval=1969677114 TSecr=1715585416"
"397","48.552095","100.86.121.59","172.66.164.67","TCP","78","[TCP Dup ACK 396#1] 53996  >  443 [ACK] Seq=16411 Ack=154017 Win=1941 Len=0 TSval=1969677114 TSecr=1715585444 SLE=153986 SRE=154017"
"398","48.552154","100.86.121.59","172.66.164.67","TCP","66","[TCP Window Update] 53996  >  443 [ACK] Seq=16411 Ack=154017 Win=2048 Len=0 TSval=1969677114 TSecr=1715585444"
"399","48.610158","100.86.121.59","172.66.164.67","TLSv1.2","1052","Application Data"
"400","48.630717","172.66.164.67","100.86.121.59","TCP","66","443  >  53996 [ACK] Seq=154017 Ack=17397 Win=17 Len=0 TSval=1715585590 TSecr=1969677172"
"401","48.639438","100.86.121.59","172.66.164.67","TLSv1.2","658","Application Data"
"402","48.639761","100.86.121.59","172.66.164.67","TLSv1.2","197","Application Data"
"403","48.639907","100.86.121.59","172.66.164.67","TLSv1.2","200","Application Data"
"404","48.640114","100.86.121.59","172.66.164.67","TLSv1.2","536","Application Data"
"405","48.640486","100.86.121.59","172.66.164.67","TLSv1.2","197","Application Data"
"406","48.659648","172.66.164.67","100.86.121.59","TLSv1.2","209","Application Data"
"407","48.659649","172.66.164.67","100.86.121.59","TLSv1.2","108","Application Data"
"408","48.659650","172.66.164.67","100.86.121.59","TLSv1.2","97","Application Data"
"409","48.659772","100.86.121.59","172.66.164.67","TCP","66","53996  >  443 [ACK] Seq=18855 Ack=154233 Win=2045 Len=0 TSval=1969677222 TSecr=1715585620"
"410","48.665245","172.66.164.67","100.86.121.59","TCP","66","443  >  53996 [ACK] Seq=154233 Ack=18855 Win=17 Len=0 TSval=1715585626 TSecr=1969677201"
"411","48.692511","172.66.164.67","100.86.121.59","TLSv1.2","244","Application Data"
"412","48.692514","172.66.164.67","100.86.121.59","TLSv1.2","290","Application Data"
"413","48.692515","172.66.164.67","100.86.121.59","TLSv1.2","97","Application Data"
"414","48.692515","172.66.164.67","100.86.121.59","TLSv1.2","127","Application Data"
"415","48.692516","172.66.164.67","100.86.121.59","TLSv1.2","290","Application Data"
"416","48.692517","172.66.164.67","100.86.121.59","TLSv1.2","97","Application Data"
"417","48.692518","172.66.164.67","100.86.121.59","TLSv1.2","127","Application Data"
"418","48.692601","100.86.121.59","172.66.164.67","TCP","66","53996  >  443 [ACK] Seq=18855 Ack=155043 Win=2036 Len=0 TSval=1969677254 TSecr=1715585658"
"419","48.693096","172.66.164.67","100.86.121.59","TLSv1.2","290","Application Data"
"420","48.693138","100.86.121.59","172.66.164.67","TCP","66","53996  >  443 [ACK] Seq=18855 Ack=155267 Win=2045 Len=0 TSval=1969677255 TSecr=1715585658"
"421","48.702723","172.66.164.67","100.86.121.59","TLSv1.2","97","Application Data"
"422","48.702811","100.86.121.59","172.66.164.67","TCP","66","53996  >  443 [ACK] Seq=18855 Ack=155298 Win=2048 Len=0 TSval=1969677265 TSecr=1715585658"
"423","48.703317","172.66.164.67","100.86.121.59","TLSv1.2","127","Application Data"
"424","48.703318","172.66.164.67","100.86.121.59","TLSv1.2","290","Application Data"
"425","48.703319","172.66.164.67","100.86.121.59","TLSv1.2","97","Application Data"
"426","48.703321","172.66.164.67","100.86.121.59","TLSv1.2","135","Application Data"
"427","48.703321","172.66.164.67","100.86.121.59","TLSv1.2","290","Application Data"
"428","48.703375","100.86.121.59","172.66.164.67","TCP","66","53996  >  443 [ACK] Seq=18855 Ack=155907 Win=2039 Len=0 TSval=1969677265 TSecr=1715585659"
"429","48.704502","172.66.164.67","100.86.121.59","TLSv1.2","97","Application Data"
"430","48.704602","100.86.121.59","172.66.164.67","TCP","66","53996  >  443 [ACK] Seq=18855 Ack=155938 Win=2048 Len=0 TSval=1969677266 TSecr=1715585659"
"431","53.703913","100.86.121.59","172.66.164.67","TLSv1.2","200","Application Data"
"432","53.713860","100.86.121.59","172.66.164.67","TLSv1.2","197","Application Data"
"433","53.714205","100.86.121.59","172.66.164.67","TLSv1.2","196","Application Data"
"434","53.724286","172.66.164.67","100.86.121.59","TCP","66","443  >  53996 [ACK] Seq=155938 Ack=19120 Win=17 Len=0 TSval=1715590693 TSecr=1969682266"
"435","53.741771","172.66.164.67","100.86.121.59","TLSv1.2","150","Application Data"
"436","53.741773","172.66.164.67","100.86.121.59","TLSv1.2","290","Application Data"
"437","53.741892","100.86.121.59","172.66.164.67","TCP","66","53996  >  443 [ACK] Seq=19250 Ack=156246 Win=2044 Len=0 TSval=1969682304 TSecr=1715590711"
"438","53.742567","172.66.164.67","100.86.121.59","TLSv1.2","97","Application Data"
"439","53.742625","100.86.121.59","172.66.164.67","TCP","66","53996  >  443 [ACK] Seq=19250 Ack=156277 Win=2048 Len=0 TSval=1969682304 TSecr=1715590711"
"440","53.743569","100.86.121.59","172.66.164.67","TLSv1.2","101","Application Data"
"441","53.751659","172.66.164.67","100.86.121.59","TLSv1.2","127","Application Data"
"442","53.751664","172.66.164.67","100.86.121.59","TLSv1.2","290","Application Data"
"443","53.751849","100.86.121.59","172.66.164.67","TCP","66","53996  >  443 [ACK] Seq=19285 Ack=156562 Win=2044 Len=0 TSval=1969682314 TSecr=1715590721"
"444","53.752101","172.66.164.67","100.86.121.59","TLSv1.2","97","Application Data"
"445","53.752197","100.86.121.59","172.66.164.67","TCP","66","53996  >  443 [ACK] Seq=19285 Ack=156593 Win=2048 Len=0 TSval=1969682314 TSecr=1715590721"
"446","53.752454","172.66.164.67","100.86.121.59","TLSv1.2","127","Application Data"
"447","53.752457","172.66.164.67","100.86.121.59","TLSv1.2","290","Application Data"
"448","53.752526","100.86.121.59","172.66.164.67","TCP","66","53996  >  443 [ACK] Seq=19285 Ack=156878 Win=2044 Len=0 TSval=1969682314 TSecr=1715590721"
"449","53.752607","172.66.164.67","100.86.121.59","TLSv1.2","97","Application Data"
"450","53.752658","100.86.121.59","172.66.164.67","TCP","66","53996  >  443 [ACK] Seq=19285 Ack=156909 Win=2048 Len=0 TSval=1969682314 TSecr=1715590721"
"451","53.795187","172.66.164.67","100.86.121.59","TCP","66","443  >  53996 [ACK] Seq=156909 Ack=19285 Win=17 Len=0 TSval=1715590765 TSecr=1969682305"
"452","58.703631","100.86.121.59","172.66.164.67","TLSv1.2","1128","Application Data"
"453","58.716153","100.86.121.59","172.66.164.67","TLSv1.2","665","Application Data"
"454","58.718131","172.66.164.67","100.86.121.59","TCP","66","443  >  53996 [ACK] Seq=156909 Ack=20347 Win=17 Len=0 TSval=1715595687 TSecr=1969687265"
"455","58.727015","172.66.164.67","100.86.121.59","TCP","66","443  >  53996 [ACK] Seq=156909 Ack=20946 Win=17 Len=0 TSval=1715595697 TSecr=1969687278"
"456","58.746226","172.66.164.67","100.86.121.59","TLSv1.2","150","Application Data"
"457","58.746229","172.66.164.67","100.86.121.59","TLSv1.2","290","Application Data"
"458","58.746394","100.86.121.59","172.66.164.67","TCP","66","53996  >  443 [ACK] Seq=20946 Ack=157217 Win=2044 Len=0 TSval=1969687308 TSecr=1715595715"
"459","58.746656","172.66.164.67","100.86.121.59","TLSv1.2","97","Application Data"
"460","58.746722","100.86.121.59","172.66.164.67","TCP","66","53996  >  443 [ACK] Seq=20946 Ack=157248 Win=2048 Len=0 TSval=1969687308 TSecr=1715595716"
"461","58.747791","100.86.121.59","172.66.164.67","TLSv1.2","101","Application Data"
"462","58.756821","172.66.164.67","100.86.121.59","TLSv1.2","216","Application Data"
"463","58.756825","172.66.164.67","100.86.121.59","TLSv1.2","290","Application Data"
"464","58.756911","172.66.164.67","100.86.121.59","TLSv1.2","97","Application Data"
"465","58.757066","100.86.121.59","172.66.164.67","TCP","66","53996  >  443 [ACK] Seq=20981 Ack=157622 Win=2043 Len=0 TSval=1969687319 TSecr=1715595726"
"466","58.757158","100.86.121.59","172.66.164.67","TCP","66","53996  >  443 [ACK] Seq=20981 Ack=157653 Win=2043 Len=0 TSval=1969687319 TSecr=1715595726"
"467","58.799379","172.66.164.67","100.86.121.59","TCP","66","443  >  53996 [ACK] Seq=157653 Ack=20981 Win=17 Len=0 TSval=1715595769 TSecr=1969687309"
