"No.","Time","Source","Destination","Protocol","Length","Info"
"1","0.000000","100.86.121.59","172.66.164.67","TLSv1.2","587","Application Data"
"2","0.013257","172.66.164.67","100.86.121.59","TCP","66","443  >  53635 [ACK] Seq=1 Ack=522 Win=18 Len=0 TSval=868479930 TSecr=600776725"
"3","0.036425","172.66.164.67","100.86.121.59","TLSv1.2","231","Application Data"
"4","0.036632","100.86.121.59","172.66.164.67","TCP","66","53635  >  443 [ACK] Seq=522 Ack=166 Win=2046 Len=0 TSval=600776762 TSecr=868479953"
"5","0.036680","172.66.164.67","100.86.121.59","TLSv1.2","290","Application Data"
"6","0.036683","172.66.164.67","100.86.121.59","TLSv1.2","97","Application Data"
"7","0.036799","100.86.121.59","172.66.164.67","TCP","66","53635  >  443 [ACK] Seq=522 Ack=421 Win=2043 Len=0 TSval=600776762 TSecr=868479954"
"8","0.039676","100.86.121.59","172.66.164.67","TLSv1.2","101","Application Data"
"9","0.090601","172.66.164.67","100.86.121.59","TCP","66","443  >  53635 [ACK] Seq=421 Ack=557 Win=18 Len=0 TSval=868480008 TSecr=600776765"
"10","1.117209","100.86.121.59","172.66.164.67","TLSv1.2","663","Application Data"
"11","1.127877","172.66.164.67","100.86.121.59","TCP","66","443  >  53635 [ACK] Seq=421 Ack=1154 Win=18 Len=0 TSval=868481045 TSecr=600777842"
"12","1.152058","172.66.164.67","100.86.121.59","TLSv1.2","258","Application Data"
"13","1.152061","172.66.164.67","100.86.121.59","TLSv1.2","290","Application Data"
"14","1.152220","100.86.121.59","172.66.164.67","TCP","66","53635  >  443 [ACK] Seq=1154 Ack=837 Win=2042 Len=0 TSval=600777877 TSecr=868481069"
"15","1.152564","172.66.164.67","100.86.121.59","TLSv1.2","97","Application Data"
"16","1.152620","100.86.121.59","172.66.164.67","TCP","66","53635  >  443 [ACK] Seq=1154 Ack=868 Win=2048 Len=0 TSval=600777878 TSecr=868481069"
"17","5.116577","100.86.121.59","172.66.164.67","TLSv1.2","412","Application Data"
"18","5.128605","100.86.121.59","172.66.164.67","TLSv1.2","206","Application Data"
"19","5.131598","100.86.121.59","172.66.164.67","TLSv1.2","1019","Application Data"
"20","5.131952","100.86.121.59","172.66.164.67","TLSv1.2","586","Application Data"
"21","5.141002","172.66.164.67","100.86.121.59","TCP","66","443  >  53635 [ACK] Seq=868 Ack=1640 Win=18 Len=0 TSval=868485057 TSecr=600781842"
"22","5.141903","172.66.164.67","100.86.121.59","TCP","66","443  >  53635 [ACK] Seq=868 Ack=3113 Win=18 Len=0 TSval=868485059 TSecr=600781857"
"23","5.152439","172.66.164.67","100.86.121.59","TLSv1.2","151","Application Data"
"24","5.152441","172.66.164.67","100.86.121.59","TLSv1.2","108","Application Data"
"25","5.152593","100.86.121.59","172.66.164.67","TCP","66","53635  >  443 [ACK] Seq=3113 Ack=995 Win=2047 Len=0 TSval=600781878 TSecr=868485068"
"26","5.152952","172.66.164.67","100.86.121.59","TLSv1.2","97","Application Data"
"27","5.152990","100.86.121.59","172.66.164.67","TCP","66","53635  >  443 [ACK] Seq=3113 Ack=1026 Win=2048 Len=0 TSval=600781878 TSecr=868485068"
"28","5.153276","100.86.121.59","172.66.164.67","TLSv1.2","656","Application Data"
"29","5.153578","100.86.121.59","172.66.164.67","TLSv1.2","101","Application Data"
"30","5.162784","172.66.164.67","100.86.121.59","TLSv1.2","208","Application Data"
"31","5.162787","172.66.164.67","100.86.121.59","TLSv1.2","290","Application Data"
"32","5.162959","100.86.121.59","172.66.164.67","TCP","66","53635  >  443 [ACK] Seq=3738 Ack=1392 Win=2043 Len=0 TSval=600781888 TSecr=868485078"
"33","5.163238","172.66.164.67","100.86.121.59","TLSv1.2","97","Application Data"
"34","5.163320","100.86.121.59","172.66.164.67","TCP","66","53635  >  443 [ACK] Seq=3738 Ack=1423 Win=2048 Len=0 TSval=600781888 TSecr=868485078"
"35","5.163548","172.66.164.67","100.86.121.59","TCP","66","443  >  53635 [ACK] Seq=1423 Ack=3738 Win=18 Len=0 TSval=868485080 TSecr=600781878"
"36","5.165380","172.66.164.67","100.86.121.59","TLSv1.2","135","Application Data"
"37","5.165438","100.86.121.59","172.66.164.67","TCP","66","53635  >  443 [ACK] Seq=3738 Ack=1492 Win=2047 Len=0 TSval=600781890 TSecr=868485082"
"38","5.165546","172.66.164.67","100.86.121.59","TLSv1.2","290","Application Data"
"39","5.165549","172.66.164.67","100.86.121.59","TLSv1.2","97","Application Data"
"40","5.165608","100.86.121.59","172.66.164.67","TCP","66","53635  >  443 [ACK] Seq=3738 Ack=1747 Win=2045 Len=0 TSval=600781891 TSecr=868485082"
"41","5.167884","172.66.164.67","100.86.121.59","TLSv1.2","127","Application Data"
"42","5.167886","172.66.164.67","100.86.121.59","TLSv1.2","290","Application Data"
"43","5.167963","172.66.164.67","100.86.121.59","TLSv1.2","97","Application Data"
"44","5.167975","100.86.121.59","172.66.164.67","TCP","66","53635  >  443 [ACK] Seq=3738 Ack=2032 Win=2044 Len=0 TSval=600781893 TSecr=868485085"
"45","5.168026","100.86.121.59","172.66.164.67","TCP","66","53635  >  443 [ACK] Seq=3738 Ack=2063 Win=2044 Len=0 TSval=600781893 TSecr=868485085"
"46","5.185262","172.66.164.67","100.86.121.59","TLSv1.2","128","Application Data"
"47","5.185265","172.66.164.67","100.86.121.59","TLSv1.2","108","Application Data"
"48","5.185426","100.86.121.59","172.66.164.67","TCP","66","53635  >  443 [ACK] Seq=3738 Ack=2167 Win=2047 Len=0 TSval=600781910 TSecr=868485102"
"49","5.186247","172.66.164.67","100.86.121.59","TLSv1.2","97","Application Data"
"50","5.186308","100.86.121.59","172.66.164.67","TCP","66","53635  >  443 [ACK] Seq=3738 Ack=2198 Win=2048 Len=0 TSval=600781911 TSecr=868485102"
"51","6.110505","100.86.121.59","172.66.164.67","TLSv1.2","281","Application Data"
"52","6.147264","172.66.164.67","100.86.121.59","TLSv1.2","257","Application Data"
"53","6.147268","172.66.164.67","100.86.121.59","TLSv1.2","290","Application Data"
"54","6.147507","100.86.121.59","172.66.164.67","TCP","66","53635  >  443 [ACK] Seq=3953 Ack=2613 Win=2042 Len=0 TSval=600782872 TSecr=868486064"
"55","6.147622","172.66.164.67","100.86.121.59","TLSv1.2","97","Application Data"
"56","6.147717","100.86.121.59","172.66.164.67","TCP","66","53635  >  443 [ACK] Seq=3953 Ack=2644 Win=2042 Len=0 TSval=600782873 TSecr=868486064"
"57","17.264810","100.86.121.59","172.66.164.67","TLSv1.2","1147","Application Data"
"58","17.264828","100.86.121.59","172.66.164.67","TLSv1.2","105","Application Data"
"59","17.277621","172.66.164.67","100.86.121.59","TCP","66","443  >  53635 [ACK] Seq=2644 Ack=5073 Win=18 Len=0 TSval=868497193 TSecr=600793990"
"60","17.279259","172.66.164.67","100.86.121.59","TLSv1.2","105","Application Data"
"61","17.279391","100.86.121.59","172.66.164.67","TCP","66","53635  >  443 [ACK] Seq=5073 Ack=2683 Win=2048 Len=0 TSval=600794004 TSecr=868497194"
"62","18.256497","172.66.164.67","100.86.121.59","TLSv1.2","175","Application Data"
"63","18.256501","172.66.164.67","100.86.121.59","TCP","1514","443  >  53635 [ACK] Seq=2792 Ack=5073 Win=18 Len=1448 TSval=868498126 TSecr=600794004 [TCP PDU reassembled in 74]"
"64","18.256504","172.66.164.67","100.86.121.59","TCP","1514","443  >  53635 [ACK] Seq=4240 Ack=5073 Win=18 Len=1448 TSval=868498126 TSecr=600794004 [TCP PDU reassembled in 74]"
"65","18.256507","172.66.164.67","100.86.121.59","TCP","1514","443  >  53635 [ACK] Seq=5688 Ack=5073 Win=18 Len=1448 TSval=868498126 TSecr=600794004 [TCP PDU reassembled in 74]"
"66","18.256511","172.66.164.67","100.86.121.59","TCP","1514","443  >  53635 [ACK] Seq=7136 Ack=5073 Win=18 Len=1448 TSval=868498126 TSecr=600794004 [TCP PDU reassembled in 74]"
"67","18.256515","172.66.164.67","100.86.121.59","TCP","1514","443  >  53635 [ACK] Seq=8584 Ack=5073 Win=18 Len=1448 TSval=868498126 TSecr=600794004 [TCP PDU reassembled in 74]"
"68","18.256592","172.66.164.67","100.86.121.59","TCP","1514","443  >  53635 [ACK] Seq=10032 Ack=5073 Win=18 Len=1448 TSval=868498126 TSecr=600794004 [TCP PDU reassembled in 74]"
"69","18.256596","172.66.164.67","100.86.121.59","TCP","1514","443  >  53635 [ACK] Seq=11480 Ack=5073 Win=18 Len=1448 TSval=868498126 TSecr=600794004 [TCP PDU reassembled in 74]"
"70","18.256599","172.66.164.67","100.86.121.59","TCP","1514","443  >  53635 [ACK] Seq=12928 Ack=5073 Win=18 Len=1448 TSval=868498126 TSecr=600794004 [TCP PDU reassembled in 74]"
"71","18.256602","172.66.164.67","100.86.121.59","TCP","1514","443  >  53635 [ACK] Seq=14376 Ack=5073 Win=18 Len=1448 TSval=868498126 TSecr=600794004 [TCP PDU reassembled in 74]"
"72","18.256605","172.66.164.67","100.86.121.59","TCP","1514","443  >  53635 [PSH, ACK] Seq=15824 Ack=5073 Win=18 Len=1448 TSval=868498126 TSecr=600794004 [TCP PDU reassembled in 74]"
"73","18.256608","172.66.164.67","100.86.121.59","TCP","1514","443  >  53635 [ACK] Seq=17272 Ack=5073 Win=18 Len=1448 TSval=868498127 TSecr=600794004 [TCP PDU reassembled in 74]"
"74","18.256712","172.66.164.67","100.86.121.59","TLSv1.2","544","Application Data"
"75","18.256716","172.66.164.67","100.86.121.59","TCP","1514","443  >  53635 [ACK] Seq=19198 Ack=5073 Win=18 Len=1448 TSval=868498127 TSecr=600794004 [TCP PDU reassembled in 89]"
"76","18.256732","100.86.121.59","172.66.164.67","TCP","66","53635  >  443 [ACK] Seq=5073 Ack=10032 Win=1934 Len=0 TSval=600794982 TSecr=868498126"
"77","18.256831","100.86.121.59","172.66.164.67","TCP","66","53635  >  443 [ACK] Seq=5073 Ack=18720 Win=1799 Len=0 TSval=600794982 TSecr=868498127"
"78","18.256849","100.86.121.59","172.66.164.67","TCP","66","53635  >  443 [ACK] Seq=5073 Ack=20646 Win=1769 Len=0 TSval=600794982 TSecr=868498127"
"79","18.257121","172.66.164.67","100.86.121.59","TCP","1514","443  >  53635 [ACK] Seq=20646 Ack=5073 Win=18 Len=1448 TSval=868498127 TSecr=600794004 [TCP PDU reassembled in 89]"
"80","18.257123","172.66.164.67","100.86.121.59","TCP","1514","443  >  53635 [ACK] Seq=22094 Ack=5073 Win=18 Len=1448 TSval=868498127 TSecr=600794004 [TCP PDU reassembled in 89]"
"81","18.257125","172.66.164.67","100.86.121.59","TCP","1514","443  >  53635 [ACK] Seq=23542 Ack=5073 Win=18 Len=1448 TSval=868498127 TSecr=600794004 [TCP PDU reassembled in 89]"
"82","18.257128","172.66.164.67","100.86.121.59","TCP","1514","443  >  53635 [ACK] Seq=24990 Ack=5073 Win=18 Len=1448 TSval=868498127 TSecr=600794004 [TCP PDU reassembled in 89]"
"83","18.257181","100.86.121.59","172.66.164.67","TCP","66","53635  >  443 [ACK] Seq=5073 Ack=26438 Win=1949 Len=0 TSval=600794982 TSecr=868498127"
"84","18.257368","100.86.121.59","172.66.164.67","TCP","66","[TCP Window Update] 53635  >  443 [ACK] Seq=5073 Ack=26438 Win=2048 Len=0 TSval=600794982 TSecr=868498127"
"85","18.258511","172.66.164.67","100.86.121.59","TCP","1514","443  >  53635 [ACK] Seq=26438 Ack=5073 Win=18 Len=1448 TSval=868498127 TSecr=600794004 [TCP PDU reassembled in 89]"
"86","18.258514","172.66.164.67","100.86.121.59","TCP","1514","443  >  53635 [ACK] Seq=27886 Ack=5073 Win=18 Len=1448 TSval=868498127 TSecr=600794004 [TCP PDU reassembled in 89]"
"87","18.258517","172.66.164.67","100.86.121.59","TCP","1514","443  >  53635 [ACK] Seq=29334 Ack=5073 Win=18 Len=1448 TSval=868498127 TSecr=600794004 [TCP PDU reassembled in 89]"
"88","18.258520","172.66.164.67","100.86.121.59","TCP","1514","443  >  53635 [ACK] Seq=30782 Ack=5073 Win=18 Len=1448 TSval=868498127 TSecr=600794004 [TCP PDU reassembled in 89]"
"89","18.258522","172.66.164.67","100.86.121.59","TLSv1.2","439","Application Data"
"90","18.258524","172.66.164.67","100.86.121.59","TLSv1.2","97","Application Data"
"91","18.258526","172.66.164.67","100.86.121.59","TCP","97","[TCP Retransmission] 443  >  53635 [PSH, ACK] Seq=32603 Ack=5073 Win=18 Len=31 TSval=868498156 TSecr=600794004"
"92","18.258626","100.86.121.59","172.66.164.67","TCP","66","53635  >  443 [ACK] Seq=5073 Ack=32634 Win=1952 Len=0 TSval=600794984 TSecr=868498128"
"93","18.258668","100.86.121.59","172.66.164.67","TCP","78","[TCP Dup ACK 92#1] 53635  >  443 [ACK] Seq=5073 Ack=32634 Win=1952 Len=0 TSval=600794984 TSecr=868498156 SLE=32603 SRE=32634"
"94","18.261018","100.86.121.59","172.66.164.67","TCP","66","[TCP Window Update] 53635  >  443 [ACK] Seq=5073 Ack=32634 Win=2048 Len=0 TSval=600794986 TSecr=868498156"
"95","18.261550","100.86.121.59","172.66.164.67","TLSv1.2","101","Application Data"
"96","18.347985","172.66.164.67","100.86.121.59","TCP","66","443  >  53635 [ACK] Seq=32634 Ack=5108 Win=18 Len=0 TSval=868498230 TSecr=600794986"
"97","18.359360","100.86.121.59","172.66.164.67","TLSv1.2","198","Application Data"
"98","18.368820","100.86.121.59","172.66.164.67","TLSv1.2","514","Application Data"
"99","18.369063","100.86.121.59","172.66.164.67","TLSv1.2","664","Application Data"
"100","18.369311","100.86.121.59","172.66.164.67","TLSv1.2","222","Application Data"
"101","18.369386","100.86.121.59","172.66.164.67","TLSv1.2","221","Application Data"
"102","18.369453","100.86.121.59","172.66.164.67","TLSv1.2","196","Application Data"
"103","18.406495","172.66.164.67","100.86.121.59","TCP","66","443  >  53635 [ACK] Seq=32634 Ack=5240 Win=18 Len=0 TSval=868498306 TSecr=600795084"
"104","18.450406","100.86.121.59","172.66.164.67","TCP","1454","[TCP Retransmission] 53635  >  443 [PSH, ACK] Seq=5339 Ack=32634 Win=2048 Len=1388 TSval=600795175 TSecr=868498306"
"105","18.455101","172.66.164.67","100.86.121.59","TCP","66","443  >  53635 [ACK] Seq=32634 Ack=6727 Win=18 Len=0 TSval=868498331 TSecr=600795094"
"106","18.455577","172.66.164.67","100.86.121.59","TLSv1.2","128","Application Data"
"107","18.455681","100.86.121.59","172.66.164.67","TCP","66","53635  >  443 [ACK] Seq=6727 Ack=32696 Win=2048 Len=0 TSval=600795181 TSecr=868498336"
"108","18.455912","172.66.164.67","100.86.121.59","TLSv1.2","108","Application Data"
"109","18.455914","172.66.164.67","100.86.121.59","TLSv1.2","97","Application Data"
"110","18.455952","100.86.121.59","172.66.164.67","TCP","66","53635  >  443 [ACK] Seq=6727 Ack=32769 Win=2047 Len=0 TSval=600795181 TSecr=868498337"
"111","18.481506","172.66.164.67","100.86.121.59","TLSv1.2","127","Application Data"
"112","18.481508","172.66.164.67","100.86.121.59","TLSv1.2","290","Application Data"
"113","18.481510","172.66.164.67","100.86.121.59","TLSv1.2","97","Application Data"
"114","18.481511","172.66.164.67","100.86.121.59","TLSv1.2","127","Application Data"
"115","18.481513","172.66.164.67","100.86.121.59","TLSv1.2","290","Application Data"
"116","18.481514","172.66.164.67","100.86.121.59","TLSv1.2","97","Application Data"
"117","18.481515","172.66.164.67","100.86.121.59","TLSv1.2","127","Application Data"
"118","18.481516","172.66.164.67","100.86.121.59","TLSv1.2","290","Application Data"
"119","18.481518","172.66.164.67","100.86.121.59","TLSv1.2","97","Application Data"
"120","18.481519","172.66.164.67","100.86.121.59","TLSv1.2","127","Application Data"
"121","18.481520","172.66.164.67","100.86.121.59","TLSv1.2","290","Application Data"
"122","18.481521","172.66.164.67","100.86.121.59","TLSv1.2","97","Application Data"
"123","18.481530","172.66.164.67","100.86.121.59","TLSv1.2","127","Application Data"
"124","18.481532","172.66.164.67","100.86.121.59","TLSv1.2","290","Application Data"
"125","18.481533","172.66.164.67","100.86.121.59","TLSv1.2","97","Application Data"
"126","18.481668","100.86.121.59","172.66.164.67","TCP","66","53635  >  443 [ACK] Seq=6727 Ack=34349 Win=2024 Len=0 TSval=600795207 TSecr=868498361"
"127","18.529598","172.66.164.67","100.86.121.59","TCP","78","[TCP Dup ACK 105#1] 443  >  53635 [ACK] Seq=34349 Ack=6727 Win=18 Len=0 TSval=868498405 TSecr=600795175 SLE=5339 SRE=6727"
"128","24.106809","100.86.121.59","172.66.164.67","TLSv1.2","199","Application Data"
"129","24.106939","100.86.121.59","172.66.164.67","TLSv1.2","199","Application Data"
"130","24.119725","172.66.164.67","100.86.121.59","TCP","66","443  >  53635 [ACK] Seq=34349 Ack=6993 Win=18 Len=0 TSval=868504037 TSecr=600800832"
"131","24.151273","172.66.164.67","100.86.121.59","TLSv1.2","150","Application Data"
"132","24.151274","172.66.164.67","100.86.121.59","TLSv1.2","290","Application Data"
"133","24.151328","100.86.121.59","172.66.164.67","TCP","66","53635  >  443 [ACK] Seq=6993 Ack=34657 Win=2044 Len=0 TSval=600800876 TSecr=868504065"
"134","24.151765","100.86.121.59","172.66.164.67","TLSv1.2","101","Application Data"
"135","24.151830","172.66.164.67","100.86.121.59","TLSv1.2","97","Application Data"
"136","24.151831","172.66.164.67","100.86.121.59","TLSv1.2","127","Application Data"
"137","24.151832","172.66.164.67","100.86.121.59","TLSv1.2","290","Application Data"
"138","24.151857","100.86.121.59","172.66.164.67","TCP","66","53635  >  443 [ACK] Seq=7028 Ack=34973 Win=2044 Len=0 TSval=600800877 TSecr=868504065"
"139","24.152234","172.66.164.67","100.86.121.59","TLSv1.2","97","Application Data"
"140","24.152258","100.86.121.59","172.66.164.67","TCP","66","53635  >  443 [ACK] Seq=7028 Ack=35004 Win=2048 Len=0 TSval=600800877 TSecr=868504065"
"141","24.202697","172.66.164.67","100.86.121.59","TCP","66","443  >  53635 [ACK] Seq=35004 Ack=7028 Win=18 Len=0 TSval=868504120 TSecr=600800877"
"142","29.112607","100.86.121.59","172.66.164.67","TLSv1.2","1006","Application Data"
"143","29.113047","100.86.121.59","172.66.164.67","TLSv1.2","248","Application Data"
"144","29.113341","100.86.121.59","172.66.164.67","TLSv1.2","534","Application Data"
"145","29.126419","172.66.164.67","100.86.121.59","TCP","66","443  >  53635 [ACK] Seq=35004 Ack=8150 Win=18 Len=0 TSval=868509043 TSecr=600805838"
"146","29.126422","172.66.164.67","100.86.121.59","TCP","66","443  >  53635 [ACK] Seq=35004 Ack=8618 Win=18 Len=0 TSval=868509043 TSecr=600805838"
"147","29.154965","172.66.164.67","100.86.121.59","TLSv1.2","150","Application Data"
"148","29.154969","172.66.164.67","100.86.121.59","TLSv1.2","290","Application Data"
"149","29.155164","100.86.121.59","172.66.164.67","TCP","66","53635  >  443 [ACK] Seq=8618 Ack=35312 Win=2044 Len=0 TSval=600805880 TSecr=868509069"
"150","29.155957","172.66.164.67","100.86.121.59","TLSv1.2","97","Application Data"
"151","29.155960","172.66.164.67","100.86.121.59","TLSv1.2","127","Application Data"
"152","29.155962","172.66.164.67","100.86.121.59","TLSv1.2","290","Application Data"
"153","29.156052","100.86.121.59","172.66.164.67","TCP","66","53635  >  443 [ACK] Seq=8618 Ack=35628 Win=2044 Len=0 TSval=600805881 TSecr=868509071"
"154","29.156107","172.66.164.67","100.86.121.59","TLSv1.2","97","Application Data"
"155","29.156158","100.86.121.59","172.66.164.67","TCP","66","53635  >  443 [ACK] Seq=8618 Ack=35659 Win=2044 Len=0 TSval=600805881 TSecr=868509071"
"156","29.157367","100.86.121.59","172.66.164.67","TLSv1.2","101","Application Data"
"157","29.213778","172.66.164.67","100.86.121.59","TCP","66","443  >  53635 [ACK] Seq=35659 Ack=8653 Win=18 Len=0 TSval=868509131 TSecr=600805882"
"158","29.219191","172.66.164.67","100.86.121.59","TLSv1.2","127","Application Data"
"159","29.219194","172.66.164.67","100.86.121.59","TLSv1.2","290","Application Data"
"160","29.219393","100.86.121.59","172.66.164.67","TCP","66","53635  >  443 [ACK] Seq=8653 Ack=35944 Win=2044 Len=0 TSval=600805944 TSecr=868509136"
"161","29.220643","172.66.164.67","100.86.121.59","TLSv1.2","97","Application Data"
"162","29.220735","100.86.121.59","172.66.164.67","TCP","66","53635  >  443 [ACK] Seq=8653 Ack=35975 Win=2048 Len=0 TSval=600805946 TSecr=868509136"
"163","31.046683","100.86.121.59","172.66.164.67","TCP","54","[TCP Keep-Alive] 53635  >  443 [ACK] Seq=8652 Ack=35975 Win=2048 Len=0"
"164","31.067036","172.66.164.67","100.86.121.59","TCP","66","[TCP Keep-Alive ACK] 443  >  53635 [ACK] Seq=35975 Ack=8653 Win=18 Len=0 TSval=868510983 TSecr=600805946"
"165","32.190284","100.86.121.59","172.66.164.67","TCP","66","53635  >  443 [FIN, ACK] Seq=8653 Ack=35975 Win=2048 Len=0 TSval=600808915 TSecr=868510983"
"166","32.205916","172.66.164.67","100.86.121.59","TCP","66","443  >  53635 [FIN, ACK] Seq=35975 Ack=8654 Win=18 Len=0 TSval=868512119 TSecr=600808915"
"167","32.205954","100.86.121.59","172.66.164.67","TCP","66","53635  >  443 [ACK] Seq=8654 Ack=35976 Win=2048 Len=0 TSval=600808931 TSecr=868512119"
"168","34.109727","100.86.121.59","172.66.164.67","TCP","78","53996  >  443 [SYN, ECE, CWR] Seq=0 Win=65535 Len=0 MSS=1460 WS=64 TSval=1968945648 TSecr=0 SACK_PERM"
"169","34.127677","172.66.164.67","100.86.121.59","TCP","74","443  >  53996 [SYN, ACK, ECE] Seq=0 Ack=1 Win=65535 Len=0 MSS=1400 SACK_PERM TSval=1714854065 TSecr=1968945648 WS=8192"
"170","34.127926","100.86.121.59","172.66.164.67","TCP","66","53996  >  443 [ACK] Seq=1 Ack=1 Win=131904 Len=0 TSval=1968945667 TSecr=1714854065"
"171","34.128868","100.86.121.59","172.66.164.67","TCP","1454","53996  >  443 [ACK] Seq=1 Ack=1 Win=131904 Len=1388 TSval=1968945668 TSecr=1714854065 [TCP PDU reassembled in 172]"
"172","34.128906","100.86.121.59","172.66.164.67","TLSv1.3","655","Client Hello (SNI=www.colonialwilliamsburg.org)"
"173","34.140136","172.66.164.67","100.86.121.59","TCP","66","443  >  53996 [ACK] Seq=1 Ack=1978 Win=139264 Len=0 TSval=1714854082 TSecr=1968945668"
"174","34.144480","172.66.164.67","100.86.121.59","TLSv1.3","1441","Server Hello, Change Cipher Spec, Application Data"
"175","34.144624","100.86.121.59","172.66.164.67","TCP","66","53996  >  443 [ACK] Seq=1978 Ack=1376 Win=130560 Len=0 TSval=1968945683 TSecr=1714854086"
"176","34.148503","100.86.121.59","172.66.164.67","TLSv1.3","130","Change Cipher Spec, Application Data"
"177","34.148766","100.86.121.59","172.66.164.67","TLSv1.3","158","Application Data"
"178","34.149101","100.86.121.59","172.66.164.67","TCP","1454","53996  >  443 [ACK] Seq=2134 Ack=1376 Win=131072 Len=1388 TSval=1968945688 TSecr=1714854086 [TCP PDU reassembled in 179]"
"179","34.149110","100.86.121.59","172.66.164.67","TLSv1.3","489","Application Data"
"180","34.158848","172.66.164.67","100.86.121.59","TLSv1.3","578","Application Data, Application Data"
"181","34.158852","172.66.164.67","100.86.121.59","TLSv1.3","97","Application Data"
"182","34.159023","100.86.121.59","172.66.164.67","TCP","66","53996  >  443 [ACK] Seq=3945 Ack=1919 Win=130560 Len=0 TSval=1968945698 TSecr=1714854101"
"183","34.159251","100.86.121.59","172.66.164.67","TLSv1.3","97","Application Data"
"184","34.192868","172.66.164.67","100.86.121.59","TLSv1.3","420","Application Data"
"185","34.192873","172.66.164.67","100.86.121.59","TLSv1.3","108","Application Data"
"186","34.192877","172.66.164.67","100.86.121.59","TLSv1.3","97","Application Data"
"187","34.193084","100.86.121.59","172.66.164.67","TCP","66","53996  >  443 [ACK] Seq=3976 Ack=2346 Win=130688 Len=0 TSval=1968945732 TSecr=1714854135"
"188","34.365106","100.86.121.59","172.66.164.67","TCP","54","[TCP Keep-Alive] 53996  >  443 [ACK] Seq=3975 Ack=2346 Win=131072 Len=0"
"189","34.375226","172.66.164.67","100.86.121.59","TCP","66","[TCP Keep-Alive ACK] 443  >  53996 [ACK] Seq=2346 Ack=3976 Win=139264 Len=0 TSval=1714854317 TSecr=1968945732"
"190","35.110541","100.86.121.59","172.66.164.67","TLSv1.3","235","Application Data"
"191","35.110909","100.86.121.59","172.66.164.67","TLSv1.3","200","Application Data"
"192","35.122763","172.66.164.67","100.86.121.59","TCP","66","443  >  53996 [ACK] Seq=2346 Ack=4279 Win=139264 Len=0 TSval=1714855064 TSecr=1968946649"
"193","35.148927","172.66.164.67","100.86.121.59","TLSv1.3","267","Application Data"
"194","35.148931","172.66.164.67","100.86.121.59","TLSv1.3","290","Application Data"
"195","35.148934","172.66.164.67","100.86.121.59","TLSv1.3","97","Application Data"
"196","35.149150","100.86.121.59","172.66.164.67","TCP","66","53996  >  443 [ACK] Seq=4279 Ack=2802 Win=130624 Len=0 TSval=1968946688 TSecr=1714855091"
"197","35.149891","172.66.164.67","100.86.121.59","TLSv1.3","208","Application Data"
"198","35.149894","172.66.164.67","100.86.121.59","TLSv1.3","290","Application Data"
"199","35.149898","172.66.164.67","100.86.121.59","TLSv1.3","97","Application Data"
"200","35.150024","100.86.121.59","172.66.164.67","TCP","66","53996  >  443 [ACK] Seq=4279 Ack=3199 Win=130688 Len=0 TSval=1968946689 TSecr=1714855091"
"201","40.114500","100.86.121.59","172.66.164.67","TLSv1.3","195","Application Data"
"202","40.115240","100.86.121.59","172.66.164.67","TLSv1.3","197","Application Data"
"203","40.127155","172.66.164.67","100.86.121.59","TCP","66","443  >  53996 [ACK] Seq=3199 Ack=4539 Win=139264 Len=0 TSval=1714860068 TSecr=1968951653"
"204","40.152259","172.66.164.67","100.86.121.59","TLSv1.3","150","Application Data"
"205","40.152263","172.66.164.67","100.86.121.59","TLSv1.3","290","Application Data"
"206","40.152484","100.86.121.59","172.66.164.67","TCP","66","53996  >  443 [ACK] Seq=4539 Ack=3507 Win=130816 Len=0 TSval=1968951691 TSecr=1714860094"
"207","40.152726","172.66.164.67","100.86.121.59","TLSv1.3","97","Application Data"
"208","40.152728","172.66.164.67","100.86.121.59","TLSv1.3","127","Application Data"
"209","40.152731","172.66.164.67","100.86.121.59","TLSv1.3","290","Application Data"
"210","40.152852","100.86.121.59","172.66.164.67","TCP","66","53996  >  443 [ACK] Seq=4539 Ack=3823 Win=130816 Len=0 TSval=1968951692 TSecr=1714860094"
"211","40.153183","172.66.164.67","100.86.121.59","TLSv1.3","97","Application Data"
"212","40.153249","100.86.121.59","172.66.164.67","TCP","66","53996  >  443 [ACK] Seq=4539 Ack=3854 Win=131072 Len=0 TSval=1968951692 TSecr=1714860094"
"213","40.154979","100.86.121.59","172.66.164.67","TLSv1.3","101","Application Data"
"214","40.224852","172.66.164.67","100.86.121.59","TCP","66","443  >  53996 [ACK] Seq=3854 Ack=4574 Win=139264 Len=0 TSval=1714860148 TSecr=1968951694"
"215","49.108447","100.86.121.59","172.66.164.67","TLSv1.3","188","Application Data"
"216","49.120668","172.66.164.67","100.86.121.59","TCP","66","443  >  53996 [ACK] Seq=3854 Ack=4696 Win=139264 Len=0 TSval=1714869062 TSecr=1968960647"
"217","49.144054","172.66.164.67","100.86.121.59","TLSv1.3","151","Application Data"
"218","49.144058","172.66.164.67","100.86.121.59","TLSv1.3","108","Application Data"
"219","49.144061","172.66.164.67","100.86.121.59","TLSv1.3","97","Application Data"
"220","49.144280","100.86.121.59","172.66.164.67","TCP","66","53996  >  443 [ACK] Seq=4696 Ack=4012 Win=130944 Len=0 TSval=1968960683 TSecr=1714869086"
"221","49.146255","100.86.121.59","172.66.164.67","TLSv1.3","101","Application Data"
"222","49.197214","172.66.164.67","100.86.121.59","TCP","66","443  >  53996 [ACK] Seq=4012 Ack=4731 Win=139264 Len=0 TSval=1714869139 TSecr=1968960685"
"223","55.111726","100.86.121.59","172.66.164.67","TLSv1.3","196","Application Data"
"224","55.125567","172.66.164.67","100.86.121.59","TCP","66","443  >  53996 [ACK] Seq=4012 Ack=4861 Win=139264 Len=0 TSval=1714875067 TSecr=1968966650"
"225","55.150169","172.66.164.67","100.86.121.59","TLSv1.3","150","Application Data"
"226","55.150172","172.66.164.67","100.86.121.59","TLSv1.3","290","Application Data"
"227","55.150294","100.86.121.59","172.66.164.67","TCP","66","53996  >  443 [ACK] Seq=4861 Ack=4320 Win=130816 Len=0 TSval=1968966689 TSecr=1714875092"
"228","55.150722","172.66.164.67","100.86.121.59","TLSv1.3","97","Application Data"
"229","55.150792","100.86.121.59","172.66.164.67","TCP","66","53996  >  443 [ACK] Seq=4861 Ack=4351 Win=131072 Len=0 TSval=1968966689 TSecr=1714875092"
"230","55.152199","100.86.121.59","172.66.164.67","TLSv1.3","101","Application Data"
"231","55.203862","172.66.164.67","100.86.121.59","TCP","66","443  >  53996 [ACK] Seq=4351 Ack=4896 Win=139264 Len=0 TSval=1714875146 TSecr=1968966691"
