"No.","Time","Source","Destination","Protocol","Length","Info"
"1","0.000000","100.86.121.59","172.66.164.67","TLSv1.2","836","Application Data"
"2","0.010273","172.66.164.67","100.86.121.59","TCP","66","443  >  54412 [ACK] Seq=1 Ack=771 Win=15 Len=0 TSval=1127806569 TSecr=1457609907"
"3","0.031414","172.66.164.67","100.86.121.59","TLSv1.2","150","Application Data"
"4","0.031416","172.66.164.67","100.86.121.59","TLSv1.2","290","Application Data"
"5","0.031443","172.66.164.67","100.86.121.59","TLSv1.2","97","Application Data"
"6","0.031519","100.86.121.59","172.66.164.67","TCP","66","54412  >  443 [ACK] Seq=771 Ack=309 Win=2044 Len=0 TSval=1457609938 TSecr=1127806590"
"7","0.031577","100.86.121.59","172.66.164.67","TCP","66","54412  >  443 [ACK] Seq=771 Ack=340 Win=2044 Len=0 TSval=1457609939 TSecr=1127806590"
"8","0.033021","100.86.121.59","172.66.164.67","TLSv1.2","101","Application Data"
"9","0.084698","172.66.164.67","100.86.121.59","TCP","66","443  >  54412 [ACK] Seq=340 Ack=806 Win=15 Len=0 TSval=1127806643 TSecr=1457609940"
"10","4.828674","100.86.121.59","172.66.164.67","TLSv1.2","1010","Application Data"
"11","4.842262","172.66.164.67","100.86.121.59","TCP","66","443  >  54412 [ACK] Seq=340 Ack=1750 Win=15 Len=0 TSval=1127811401 TSecr=1457614736"
"12","4.867405","172.66.164.67","100.86.121.59","TLSv1.2","151","Application Data"
"13","4.867409","172.66.164.67","100.86.121.59","TLSv1.2","108","Application Data"
"14","4.867411","172.66.164.67","100.86.121.59","TLSv1.2","97","Application Data"
"15","4.867562","100.86.121.59","172.66.164.67","TCP","66","54412  >  443 [ACK] Seq=1750 Ack=498 Win=2046 Len=0 TSval=1457614774 TSecr=1127811421"
"16","4.979576","100.86.121.59","172.66.164.67","TLSv1.2","192","Application Data"
"17","4.984030","100.86.121.59","172.66.164.67","TLSv1.2","192","Application Data"
"18","4.992831","100.86.121.59","172.66.164.67","TLSv1.2","205","Application Data"
"19","4.994383","172.66.164.67","100.86.121.59","TCP","66","443  >  54412 [ACK] Seq=498 Ack=2002 Win=15 Len=0 TSval=1127811553 TSecr=1457614886"
"20","5.010522","172.66.164.67","100.86.121.59","TLSv1.2","127","Application Data"
"21","5.010526","172.66.164.67","100.86.121.59","TLSv1.2","290","Application Data"
"22","5.010616","172.66.164.67","100.86.121.59","TLSv1.2","97","Application Data"
"23","5.010703","100.86.121.59","172.66.164.67","TCP","66","54412  >  443 [ACK] Seq=2141 Ack=783 Win=2044 Len=0 TSval=1457614918 TSecr=1127811569"
"24","5.010770","100.86.121.59","172.66.164.67","TCP","66","54412  >  443 [ACK] Seq=2141 Ack=814 Win=2044 Len=0 TSval=1457614918 TSecr=1127811569"
"25","5.011773","172.66.164.67","100.86.121.59","TLSv1.2","127","Application Data"
"26","5.011776","172.66.164.67","100.86.121.59","TLSv1.2","290","Application Data"
"27","5.011853","100.86.121.59","172.66.164.67","TCP","66","54412  >  443 [ACK] Seq=2141 Ack=1099 Win=2044 Len=0 TSval=1457614919 TSecr=1127811570"
"28","5.011874","172.66.164.67","100.86.121.59","TLSv1.2","97","Application Data"
"29","5.011960","100.86.121.59","172.66.164.67","TCP","66","54412  >  443 [ACK] Seq=2141 Ack=1130 Win=2044 Len=0 TSval=1457614919 TSecr=1127811570"
"30","5.026899","172.66.164.67","100.86.121.59","TLSv1.2","127","Application Data"
"31","5.026902","172.66.164.67","100.86.121.59","TLSv1.2","290","Application Data"
"32","5.027100","100.86.121.59","172.66.164.67","TCP","66","54412  >  443 [ACK] Seq=2141 Ack=1415 Win=2044 Len=0 TSval=1457614934 TSecr=1127811585"
"33","5.027701","172.66.164.67","100.86.121.59","TLSv1.2","97","Application Data"
"34","5.027795","100.86.121.59","172.66.164.67","TCP","66","54412  >  443 [ACK] Seq=2141 Ack=1446 Win=2048 Len=0 TSval=1457614935 TSecr=1127811585"
"35","8.347877","100.86.121.59","172.66.164.67","TCP","54","54413  >  443 [ACK] Seq=1 Ack=1 Win=2048 Len=0"
"36","8.438895","172.66.164.67","100.86.121.59","TCP","66","[TCP ACKed unseen segment] 443  >  54413 [ACK] Seq=1 Ack=2 Win=16 Len=0 TSval=1300812680 TSecr=4226003283"
"37","19.825523","100.86.121.59","172.66.164.67","TLSv1.2","185","Application Data"
"38","19.825583","100.86.121.59","172.66.164.67","TLSv1.2","105","Application Data"
"39","19.830078","100.86.121.59","172.66.164.67","TCP","54","[TCP Dup ACK 35#1] 54413  >  443 [ACK] Seq=1 Ack=1 Win=2048 Len=0"
"40","19.830094","100.86.121.59","172.66.164.67","TCP","54","54412  >  443 [ACK] Seq=2140 Ack=1446 Win=2048 Len=0"
"41","19.903469","172.66.164.67","100.86.121.59","TLSv1.2","105","Application Data"
"42","19.903749","100.86.121.59","172.66.164.67","TCP","66","54412  >  443 [ACK] Seq=2299 Ack=1485 Win=2048 Len=0 TSval=1457629811 TSecr=1127826421"
"43","19.929863","172.66.164.67","100.86.121.59","TCP","66","[TCP Dup ACK 41#1] 443  >  54412 [ACK] Seq=1485 Ack=2299 Win=15 Len=0 TSval=1127826444 TSecr=1457629732"
"44","19.929892","172.66.164.67","100.86.121.59","TCP","66","[TCP Dup ACK 36#1] 443  >  54413 [ACK] Seq=1 Ack=2 Win=16 Len=0 TSval=1300824168 TSecr=4226003283"
"45","19.929908","172.66.164.67","100.86.121.59","TLSv1.2","151","Application Data"
"46","19.929909","172.66.164.67","100.86.121.59","TLSv1.2","108","Application Data"
"47","19.930007","172.66.164.67","100.86.121.59","TLSv1.2","97","Application Data"
"48","19.930139","100.86.121.59","172.66.164.67","TCP","66","54412  >  443 [ACK] Seq=2299 Ack=1612 Win=2047 Len=0 TSval=1457629837 TSecr=1127826446"
"49","19.930343","100.86.121.59","172.66.164.67","TCP","66","54412  >  443 [ACK] Seq=2299 Ack=1643 Win=2048 Len=0 TSval=1457629837 TSecr=1127826446"
"50","19.933676","100.86.121.59","172.66.164.67","TLSv1.2","101","Application Data"
"51","19.953697","172.66.164.67","100.86.121.59","TCP","97","[TCP Spurious Retransmission] 443  >  54412 [PSH, ACK] Seq=1612 Ack=2299 Win=15 Len=31 TSval=1127826481 TSecr=1457629732"
"52","19.953954","100.86.121.59","172.66.164.67","TCP","78","[TCP Dup ACK 49#1] 54412  >  443 [ACK] Seq=2334 Ack=1643 Win=2048 Len=0 TSval=1457629861 TSecr=1127826481 SLE=1612 SRE=1643"
"53","20.024612","100.86.121.59","172.66.164.67","TLSv1.2","195","Application Data"
"54","20.053788","172.66.164.67","100.86.121.59","TCP","66","443  >  54412 [ACK] Seq=1643 Ack=2334 Win=15 Len=0 TSval=1127826585 TSecr=1457629841"
"55","20.101467","172.66.164.67","100.86.121.59","TCP","66","443  >  54412 [ACK] Seq=1643 Ack=2463 Win=15 Len=0 TSval=1127826620 TSecr=1457629931"
"56","20.115496","172.66.164.67","100.86.121.59","TLSv1.2","127","Application Data"
"57","20.115500","172.66.164.67","100.86.121.59","TLSv1.2","290","Application Data"
"58","20.115692","100.86.121.59","172.66.164.67","TCP","66","54412  >  443 [ACK] Seq=2463 Ack=1928 Win=2044 Len=0 TSval=1457630022 TSecr=1127826644"
"59","20.115924","172.66.164.67","100.86.121.59","TLSv1.2","97","Application Data"
"60","20.116011","100.86.121.59","172.66.164.67","TCP","66","54412  >  443 [ACK] Seq=2463 Ack=1959 Win=2048 Len=0 TSval=1457630023 TSecr=1127826644"
"61","20.523225","100.86.121.59","172.66.164.67","TCP","54","[TCP Keep-Alive] 54412  >  443 [ACK] Seq=2462 Ack=1959 Win=2048 Len=0"
"62","20.535081","172.66.164.67","100.86.121.59","TCP","66","[TCP Keep-Alive ACK] 443  >  54412 [ACK] Seq=1959 Ack=2463 Win=15 Len=0 TSval=1127827093 TSecr=1457630023"
"63","24.829942","100.86.121.59","172.66.164.67","TCP","66","[TCP Previous segment not captured] 54413  >  443 [FIN, ACK] Seq=2 Ack=1 Win=2048 Len=0 TSval=4226109858 TSecr=1300824168"
"64","24.845700","172.66.164.67","100.86.121.59","TCP","66","443  >  54413 [FIN, ACK] Seq=1 Ack=3 Win=16 Len=0 TSval=1300829126 TSecr=4226109858"
"65","24.845806","100.86.121.59","172.66.164.67","TCP","66","54413  >  443 [ACK] Seq=3 Ack=2 Win=2048 Len=0 TSval=4226109874 TSecr=1300829126"
"66","25.036229","100.86.121.59","172.66.164.67","TLSv1.2","192","Application Data"
"67","25.069395","172.66.164.67","100.86.121.59","TLSv1.2","150","Application Data"
"68","25.069400","172.66.164.67","100.86.121.59","TLSv1.2","290","Application Data"
"69","25.069402","172.66.164.67","100.86.121.59","TLSv1.2","97","Application Data"
"70","25.069702","100.86.121.59","172.66.164.67","TCP","66","54412  >  443 [ACK] Seq=2589 Ack=2298 Win=2043 Len=0 TSval=1457634976 TSecr=1127831628"
"71","25.072328","100.86.121.59","172.66.164.67","TLSv1.2","101","Application Data"
"72","25.124209","172.66.164.67","100.86.121.59","TCP","66","443  >  54412 [ACK] Seq=2298 Ack=2624 Win=15 Len=0 TSval=1127831683 TSecr=1457634979"
"73","30.024109","100.86.121.59","172.66.164.67","TLSv1.2","192","Application Data"
"74","30.036031","172.66.164.67","100.86.121.59","TCP","66","443  >  54412 [ACK] Seq=2298 Ack=2750 Win=15 Len=0 TSval=1127836594 TSecr=1457639931"
"75","30.057068","172.66.164.67","100.86.121.59","TLSv1.2","150","Application Data"
"76","30.057071","172.66.164.67","100.86.121.59","TLSv1.2","290","Application Data"
"77","30.057238","100.86.121.59","172.66.164.67","TCP","66","54412  >  443 [ACK] Seq=2750 Ack=2606 Win=2044 Len=0 TSval=1457639964 TSecr=1127836615"
"78","30.057473","172.66.164.67","100.86.121.59","TLSv1.2","97","Application Data"
"79","30.057564","100.86.121.59","172.66.164.67","TCP","66","54412  >  443 [ACK] Seq=2750 Ack=2637 Win=2048 Len=0 TSval=1457639964 TSecr=1127836616"
"80","34.825022","100.86.121.59","172.66.164.67","TLSv1.2","184","Application Data"
"81","34.857894","172.66.164.67","100.86.121.59","TLSv1.2","151","Application Data"
"82","34.857898","172.66.164.67","100.86.121.59","TLSv1.2","108","Application Data"
"83","34.857901","172.66.164.67","100.86.121.59","TLSv1.2","97","Application Data"
"84","34.858120","100.86.121.59","172.66.164.67","TCP","66","54412  >  443 [ACK] Seq=2868 Ack=2795 Win=2046 Len=0 TSval=1457644765 TSecr=1127841416"
"85","34.860201","100.86.121.59","172.66.164.67","TLSv1.2","101","Application Data"
"86","34.911307","172.66.164.67","100.86.121.59","TCP","66","443  >  54412 [ACK] Seq=2795 Ack=2903 Win=15 Len=0 TSval=1127841470 TSecr=1457644767"
"87","35.022155","100.86.121.59","172.66.164.67","TLSv1.2","191","Application Data"
"88","35.032575","172.66.164.67","100.86.121.59","TCP","66","443  >  54412 [ACK] Seq=2795 Ack=3028 Win=15 Len=0 TSval=1127841591 TSecr=1457644929"
"89","35.046212","172.66.164.67","100.86.121.59","TLSv1.2","127","Application Data"
"90","35.046216","172.66.164.67","100.86.121.59","TLSv1.2","290","Application Data"
"91","35.046273","172.66.164.67","100.86.121.59","TLSv1.2","97","Application Data"
"92","35.046419","100.86.121.59","172.66.164.67","TCP","66","54412  >  443 [ACK] Seq=3028 Ack=3080 Win=2044 Len=0 TSval=1457644953 TSecr=1127841605"
"93","35.046502","100.86.121.59","172.66.164.67","TCP","66","54412  >  443 [ACK] Seq=3028 Ack=3111 Win=2044 Len=0 TSval=1457644953 TSecr=1127841605"
"94","36.766715","100.86.121.59","172.66.164.67","TLSv1.2","392","Application Data"
"95","36.817959","172.66.164.67","100.86.121.59","TCP","66","443  >  54412 [ACK] Seq=3111 Ack=3354 Win=15 Len=0 TSval=1127843377 TSecr=1457646674"
"96","36.884201","172.66.164.67","100.86.121.59","TLSv1.2","175","Application Data"
"97","36.884203","172.66.164.67","100.86.121.59","TCP","1514","443  >  54412 [ACK] Seq=3220 Ack=3354 Win=15 Len=1448 TSval=1127843442 TSecr=1457646674 [TCP PDU reassembled in 118]"
"98","36.884268","100.86.121.59","172.66.164.67","TCP","66","54412  >  443 [ACK] Seq=3354 Ack=4668 Win=2024 Len=0 TSval=1457646791 TSecr=1127843442"
"99","36.884741","172.66.164.67","100.86.121.59","TCP","1514","443  >  54412 [PSH, ACK] Seq=4668 Ack=3354 Win=15 Len=1448 TSval=1127843442 TSecr=1457646674 [TCP PDU reassembled in 118]"
"100","36.884743","172.66.164.67","100.86.121.59","TCP","1514","443  >  54412 [ACK] Seq=6116 Ack=3354 Win=15 Len=1448 TSval=1127843443 TSecr=1457646674 [TCP PDU reassembled in 118]"
"101","36.884792","100.86.121.59","172.66.164.67","TCP","66","54412  >  443 [ACK] Seq=3354 Ack=7564 Win=2003 Len=0 TSval=1457646792 TSecr=1127843443"
"102","36.884965","100.86.121.59","172.66.164.67","TCP","66","[TCP Window Update] 54412  >  443 [ACK] Seq=3354 Ack=7564 Win=2048 Len=0 TSval=1457646792 TSecr=1127843443"
"103","36.885039","172.66.164.67","100.86.121.59","TCP","1514","443  >  54412 [PSH, ACK] Seq=7564 Ack=3354 Win=15 Len=1448 TSval=1127843443 TSecr=1457646674 [TCP PDU reassembled in 118]"
"104","36.885096","100.86.121.59","172.66.164.67","TCP","66","54412  >  443 [ACK] Seq=3354 Ack=9012 Win=2026 Len=0 TSval=1457646792 TSecr=1127843443"
"105","36.885947","172.66.164.67","100.86.121.59","TCP","1514","443  >  54412 [ACK] Seq=9012 Ack=3354 Win=15 Len=1448 TSval=1127843444 TSecr=1457646674 [TCP PDU reassembled in 118]"
"106","36.885948","172.66.164.67","100.86.121.59","TCP","1514","443  >  54412 [PSH, ACK] Seq=10460 Ack=3354 Win=15 Len=1448 TSval=1127843444 TSecr=1457646674 [TCP PDU reassembled in 118]"
"107","36.885967","100.86.121.59","172.66.164.67","TCP","66","54412  >  443 [ACK] Seq=3354 Ack=11908 Win=2003 Len=0 TSval=1457646793 TSecr=1127843444"
"108","36.886006","100.86.121.59","172.66.164.67","TCP","66","[TCP Window Update] 54412  >  443 [ACK] Seq=3354 Ack=11908 Win=2048 Len=0 TSval=1457646793 TSecr=1127843444"
"109","36.886618","172.66.164.67","100.86.121.59","TCP","1514","443  >  54412 [ACK] Seq=11908 Ack=3354 Win=15 Len=1448 TSval=1127843445 TSecr=1457646674 [TCP PDU reassembled in 118]"
"110","36.886620","172.66.164.67","100.86.121.59","TCP","1514","443  >  54412 [PSH, ACK] Seq=13356 Ack=3354 Win=15 Len=1448 TSval=1127843445 TSecr=1457646674 [TCP PDU reassembled in 118]"
"111","36.886664","100.86.121.59","172.66.164.67","TCP","66","54412  >  443 [ACK] Seq=3354 Ack=14804 Win=2003 Len=0 TSval=1457646793 TSecr=1127843445"
"112","36.886737","100.86.121.59","172.66.164.67","TCP","66","[TCP Window Update] 54412  >  443 [ACK] Seq=3354 Ack=14804 Win=2048 Len=0 TSval=1457646794 TSecr=1127843445"
"113","36.887572","172.66.164.67","100.86.121.59","TCP","1514","443  >  54412 [ACK] Seq=14804 Ack=3354 Win=15 Len=1448 TSval=1127843446 TSecr=1457646674 [TCP PDU reassembled in 118]"
"114","36.887573","172.66.164.67","100.86.121.59","TCP","1514","443  >  54412 [PSH, ACK] Seq=16252 Ack=3354 Win=15 Len=1448 TSval=1127843446 TSecr=1457646674 [TCP PDU reassembled in 118]"
"115","36.887591","100.86.121.59","172.66.164.67","TCP","66","54412  >  443 [ACK] Seq=3354 Ack=17700 Win=2003 Len=0 TSval=1457646794 TSecr=1127843446"
"116","36.887624","100.86.121.59","172.66.164.67","TCP","66","[TCP Window Update] 54412  >  443 [ACK] Seq=3354 Ack=17700 Win=2048 Len=0 TSval=1457646794 TSecr=1127843446"
"117","36.888468","172.66.164.67","100.86.121.59","TCP","1514","443  >  54412 [ACK] Seq=17700 Ack=3354 Win=15 Len=1448 TSval=1127843447 TSecr=1457646674 [TCP PDU reassembled in 118]"
"118","36.888469","172.66.164.67","100.86.121.59","TLSv1.2","1514","Application Data"
"119","36.888508","100.86.121.59","172.66.164.67","TCP","66","54412  >  443 [ACK] Seq=3354 Ack=20596 Win=2003 Len=0 TSval=1457646795 TSecr=1127843447"
"120","36.888540","100.86.121.59","172.66.164.67","TCP","66","[TCP Window Update] 54412  >  443 [ACK] Seq=3354 Ack=20596 Win=2048 Len=0 TSval=1457646795 TSecr=1127843447"
"121","36.889721","172.66.164.67","100.86.121.59","TCP","1514","443  >  54412 [ACK] Seq=20596 Ack=3354 Win=15 Len=1448 TSval=1127843448 TSecr=1457646674 [TCP PDU reassembled in 131]"
"122","36.889723","172.66.164.67","100.86.121.59","TCP","1514","443  >  54412 [PSH, ACK] Seq=22044 Ack=3354 Win=15 Len=1448 TSval=1127843448 TSecr=1457646674 [TCP PDU reassembled in 131]"
"123","36.889742","100.86.121.59","172.66.164.67","TCP","66","54412  >  443 [ACK] Seq=3354 Ack=23492 Win=2003 Len=0 TSval=1457646797 TSecr=1127843448"
"124","36.889786","100.86.121.59","172.66.164.67","TCP","66","[TCP Window Update] 54412  >  443 [ACK] Seq=3354 Ack=23492 Win=2048 Len=0 TSval=1457646797 TSecr=1127843448"
"125","36.890049","172.66.164.67","100.86.121.59","TCP","1514","443  >  54412 [ACK] Seq=23492 Ack=3354 Win=15 Len=1448 TSval=1127843449 TSecr=1457646674 [TCP PDU reassembled in 131]"
"126","36.890067","100.86.121.59","172.66.164.67","TCP","66","54412  >  443 [ACK] Seq=3354 Ack=24940 Win=2026 Len=0 TSval=1457646797 TSecr=1127843449"
"127","36.890767","172.66.164.67","100.86.121.59","TCP","1514","443  >  54412 [PSH, ACK] Seq=24940 Ack=3354 Win=15 Len=1448 TSval=1127843449 TSecr=1457646674 [TCP PDU reassembled in 131]"
"128","36.890790","100.86.121.59","172.66.164.67","TCP","66","54412  >  443 [ACK] Seq=3354 Ack=26388 Win=2004 Len=0 TSval=1457646798 TSecr=1127843449"
"129","36.890979","100.86.121.59","172.66.164.67","TCP","66","[TCP Window Update] 54412  >  443 [ACK] Seq=3354 Ack=26388 Win=2048 Len=0 TSval=1457646798 TSecr=1127843449"
"130","36.891608","172.66.164.67","100.86.121.59","TCP","1514","443  >  54412 [ACK] Seq=26388 Ack=3354 Win=15 Len=1448 TSval=1127843450 TSecr=1457646674 [TCP PDU reassembled in 131]"
"131","36.891609","172.66.164.67","100.86.121.59","TLSv1.2","290","Application Data, Application Data"
"132","36.891630","100.86.121.59","172.66.164.67","TCP","66","54412  >  443 [ACK] Seq=3354 Ack=28060 Win=2022 Len=0 TSval=1457646798 TSecr=1127843450"
"133","36.920614","100.86.121.59","172.66.164.67","TLSv1.2","188","Application Data"
"134","36.931580","172.66.164.67","100.86.121.59","TCP","66","443  >  54412 [ACK] Seq=28060 Ack=3476 Win=15 Len=0 TSval=1127843490 TSecr=1457646827"
"135","36.945585","100.86.121.59","172.66.164.67","TLSv1.2","830","Application Data"
"136","36.946054","100.86.121.59","172.66.164.67","TLSv1.2","1000","Application Data"
"137","36.946352","100.86.121.59","172.66.164.67","TLSv1.2","195","Application Data"
"138","36.946538","100.86.121.59","172.66.164.67","TLSv1.2","193","Application Data"
"139","36.946699","100.86.121.59","172.66.164.67","TLSv1.2","191","Application Data"
"140","36.948010","172.66.164.67","100.86.121.59","TLSv1.2","292","Application Data"
"141","36.948011","172.66.164.67","100.86.121.59","TLSv1.2","139","Application Data, Application Data"
"142","36.948069","100.86.121.59","172.66.164.67","TCP","66","54412  >  443 [ACK] Seq=5555 Ack=28359 Win=2044 Len=0 TSval=1457646855 TSecr=1127843506"
"143","36.955803","172.66.164.67","100.86.121.59","TCP","66","443  >  54412 [ACK] Seq=28359 Ack=5430 Win=15 Len=0 TSval=1127843515 TSecr=1457646852"
"144","36.974191","172.66.164.67","100.86.121.59","TLSv1.2","127","Application Data"
"145","36.974193","172.66.164.67","100.86.121.59","TLSv1.2","290","Application Data"
"146","36.974265","172.66.164.67","100.86.121.59","TLSv1.2","97","Application Data"
"147","36.974276","100.86.121.59","172.66.164.67","TCP","66","54412  >  443 [ACK] Seq=5555 Ack=28644 Win=2044 Len=0 TSval=1457646881 TSecr=1127843533"
"148","36.974308","100.86.121.59","172.66.164.67","TCP","66","54412  >  443 [ACK] Seq=5555 Ack=28675 Win=2044 Len=0 TSval=1457646881 TSecr=1127843533"
"149","36.974515","172.66.164.67","100.86.121.59","TLSv1.2","127","Application Data"
"150","36.974516","172.66.164.67","100.86.121.59","TLSv1.2","290","Application Data"
"151","36.974516","172.66.164.67","100.86.121.59","TLSv1.2","97","Application Data"
"152","36.974552","100.86.121.59","172.66.164.67","TCP","66","54412  >  443 [ACK] Seq=5555 Ack=28991 Win=2044 Len=0 TSval=1457646881 TSecr=1127843533"
"153","36.976106","172.66.164.67","100.86.121.59","TLSv1.2","127","Application Data"
"154","36.976108","172.66.164.67","100.86.121.59","TLSv1.2","321","Application Data, Application Data"
"155","36.976108","172.66.164.67","100.86.121.59","TLSv1.2","127","Application Data"
"156","36.976109","172.66.164.67","100.86.121.59","TLSv1.2","290","Application Data"
"157","36.976110","172.66.164.67","100.86.121.59","TLSv1.2","97","Application Data"
"158","36.976197","100.86.121.59","172.66.164.67","TCP","66","54412  >  443 [ACK] Seq=5555 Ack=29623 Win=2039 Len=0 TSval=1457646883 TSecr=1127843534"
"159","36.979748","172.66.164.67","100.86.121.59","TLSv1.2","127","Application Data"
"160","36.979749","172.66.164.67","100.86.121.59","TLSv1.2","290","Application Data"
"161","36.979817","100.86.121.59","172.66.164.67","TCP","66","54412  >  443 [ACK] Seq=5555 Ack=29908 Win=2044 Len=0 TSval=1457646887 TSecr=1127843538"
"162","36.980506","172.66.164.67","100.86.121.59","TLSv1.2","97","Application Data"
"163","36.980569","100.86.121.59","172.66.164.67","TCP","66","54412  >  443 [ACK] Seq=5555 Ack=29939 Win=2048 Len=0 TSval=1457646887 TSecr=1127843538"
"164","41.984232","100.86.121.59","172.66.164.67","TLSv1.2","193","Application Data"
"165","41.984643","100.86.121.59","172.66.164.67","TLSv1.2","194","Application Data"
"166","41.991963","100.86.121.59","172.66.164.67","TLSv1.2","191","Application Data"
"167","42.074374","172.66.164.67","100.86.121.59","TCP","66","443  >  54412 [ACK] Seq=29939 Ack=5810 Win=15 Len=0 TSval=1127848592 TSecr=1457651891"
"168","42.074881","172.66.164.67","100.86.121.59","TLSv1.2","150","Application Data"
"169","42.074885","172.66.164.67","100.86.121.59","TLSv1.2","290","Application Data"
"170","42.075064","100.86.121.59","172.66.164.67","TCP","66","54412  >  443 [ACK] Seq=5935 Ack=30247 Win=2044 Len=0 TSval=1457651982 TSecr=1127848609"
"171","42.075776","172.66.164.67","100.86.121.59","TLSv1.2","97","Application Data"
"172","42.075873","100.86.121.59","172.66.164.67","TCP","66","54412  >  443 [ACK] Seq=5935 Ack=30278 Win=2048 Len=0 TSval=1457651983 TSecr=1127848609"
"173","42.077217","100.86.121.59","172.66.164.67","TLSv1.2","101","Application Data"
"174","42.098004","172.66.164.67","100.86.121.59","TLSv1.2","127","Application Data"
"175","42.098008","172.66.164.67","100.86.121.59","TLSv1.2","290","Application Data"
"176","42.098100","172.66.164.67","100.86.121.59","TLSv1.2","97","Application Data"
"177","42.098102","172.66.164.67","100.86.121.59","TLSv1.2","127","Application Data"
"178","42.098104","172.66.164.67","100.86.121.59","TLSv1.2","290","Application Data"
"179","42.098183","100.86.121.59","172.66.164.67","TCP","66","54412  >  443 [ACK] Seq=5970 Ack=30563 Win=2044 Len=0 TSval=1457652005 TSecr=1127848610"
"180","42.098266","100.86.121.59","172.66.164.67","TCP","66","54412  >  443 [ACK] Seq=5970 Ack=30879 Win=2040 Len=0 TSval=1457652005 TSecr=1127848611"
"181","42.098994","172.66.164.67","100.86.121.59","TLSv1.2","97","Application Data"
"182","42.099084","100.86.121.59","172.66.164.67","TCP","66","54412  >  443 [ACK] Seq=5970 Ack=30910 Win=2048 Len=0 TSval=1457652006 TSecr=1127848611"
"183","42.122131","172.66.164.67","100.86.121.59","TCP","97","[TCP Spurious Retransmission] 443  >  54412 [PSH, ACK] Seq=30879 Ack=5935 Win=15 Len=31 TSval=1127848642 TSecr=1457651899"
"184","42.122331","100.86.121.59","172.66.164.67","TCP","78","[TCP Dup ACK 182#1] 54412  >  443 [ACK] Seq=5970 Ack=30910 Win=2048 Len=0 TSval=1457652029 TSecr=1127848642 SLE=30879 SRE=30910"
"185","42.194968","172.66.164.67","100.86.121.59","TCP","66","443  >  54412 [ACK] Seq=30910 Ack=5970 Win=15 Len=0 TSval=1127848729 TSecr=1457651984"
"186","43.122436","100.86.121.59","172.66.164.67","TLSv1.2","345","Application Data"
"187","43.132183","172.66.164.67","100.86.121.59","TCP","66","443  >  54412 [ACK] Seq=30910 Ack=6249 Win=15 Len=0 TSval=1127849691 TSecr=1457653029"
"188","43.217195","172.66.164.67","100.86.121.59","TLSv1.2","305","Application Data"
"189","43.217197","172.66.164.67","100.86.121.59","TCP","1514","443  >  54412 [ACK] Seq=31149 Ack=6249 Win=15 Len=1448 TSval=1127849775 TSecr=1457653029 [TCP PDU reassembled in 210]"
"190","43.217287","100.86.121.59","172.66.164.67","TCP","66","54412  >  443 [ACK] Seq=6249 Ack=32597 Win=2022 Len=0 TSval=1457653124 TSecr=1127849775"
"191","43.217670","172.66.164.67","100.86.121.59","TCP","1514","443  >  54412 [PSH, ACK] Seq=32597 Ack=6249 Win=15 Len=1448 TSval=1127849775 TSecr=1457653029 [TCP PDU reassembled in 210]"
"192","43.217712","100.86.121.59","172.66.164.67","TCP","66","54412  >  443 [ACK] Seq=6249 Ack=34045 Win=2026 Len=0 TSval=1457653124 TSecr=1127849775"
"193","43.218277","172.66.164.67","100.86.121.59","TCP","1514","443  >  54412 [ACK] Seq=34045 Ack=6249 Win=15 Len=1448 TSval=1127849776 TSecr=1457653029 [TCP PDU reassembled in 210]"
"194","43.218279","172.66.164.67","100.86.121.59","TCP","1514","443  >  54412 [PSH, ACK] Seq=35493 Ack=6249 Win=15 Len=1448 TSval=1127849776 TSecr=1457653029 [TCP PDU reassembled in 210]"
"195","43.218321","100.86.121.59","172.66.164.67","TCP","66","54412  >  443 [ACK] Seq=6249 Ack=36941 Win=2003 Len=0 TSval=1457653125 TSecr=1127849776"
"196","43.218369","100.86.121.59","172.66.164.67","TCP","66","[TCP Window Update] 54412  >  443 [ACK] Seq=6249 Ack=36941 Win=2048 Len=0 TSval=1457653125 TSecr=1127849776"
"197","43.218730","172.66.164.67","100.86.121.59","TCP","1514","443  >  54412 [ACK] Seq=36941 Ack=6249 Win=15 Len=1448 TSval=1127849777 TSecr=1457653029 [TCP PDU reassembled in 210]"
"198","43.218732","172.66.164.67","100.86.121.59","TCP","1514","443  >  54412 [PSH, ACK] Seq=38389 Ack=6249 Win=15 Len=1448 TSval=1127849777 TSecr=1457653029 [TCP PDU reassembled in 210]"
"199","43.218759","100.86.121.59","172.66.164.67","TCP","66","54412  >  443 [ACK] Seq=6249 Ack=39837 Win=2003 Len=0 TSval=1457653126 TSecr=1127849777"
"200","43.218804","100.86.121.59","172.66.164.67","TCP","66","[TCP Window Update] 54412  >  443 [ACK] Seq=6249 Ack=39837 Win=2048 Len=0 TSval=1457653126 TSecr=1127849777"
"201","43.219733","172.66.164.67","100.86.121.59","TCP","1514","443  >  54412 [ACK] Seq=39837 Ack=6249 Win=15 Len=1448 TSval=1127849777 TSecr=1457653029 [TCP PDU reassembled in 210]"
"202","43.219734","172.66.164.67","100.86.121.59","TCP","1514","443  >  54412 [PSH, ACK] Seq=41285 Ack=6249 Win=15 Len=1448 TSval=1127849777 TSecr=1457653029 [TCP PDU reassembled in 210]"
"203","43.219762","100.86.121.59","172.66.164.67","TCP","66","54412  >  443 [ACK] Seq=6249 Ack=42733 Win=2003 Len=0 TSval=1457653127 TSecr=1127849777"
"204","43.219888","100.86.121.59","172.66.164.67","TCP","66","[TCP Window Update] 54412  >  443 [ACK] Seq=6249 Ack=42733 Win=2048 Len=0 TSval=1457653127 TSecr=1127849777"
"205","43.220249","172.66.164.67","100.86.121.59","TCP","1514","443  >  54412 [ACK] Seq=42733 Ack=6249 Win=15 Len=1448 TSval=1127849778 TSecr=1457653029 [TCP PDU reassembled in 210]"
"206","43.220251","172.66.164.67","100.86.121.59","TCP","1514","443  >  54412 [PSH, ACK] Seq=44181 Ack=6249 Win=15 Len=1448 TSval=1127849778 TSecr=1457653029 [TCP PDU reassembled in 210]"
"207","43.220279","100.86.121.59","172.66.164.67","TCP","66","54412  >  443 [ACK] Seq=6249 Ack=45629 Win=2003 Len=0 TSval=1457653127 TSecr=1127849778"
"208","43.220327","100.86.121.59","172.66.164.67","TCP","66","[TCP Window Update] 54412  >  443 [ACK] Seq=6249 Ack=45629 Win=2048 Len=0 TSval=1457653127 TSecr=1127849778"
"209","43.220654","172.66.164.67","100.86.121.59","TCP","1514","443  >  54412 [ACK] Seq=45629 Ack=6249 Win=15 Len=1448 TSval=1127849779 TSecr=1457653029 [TCP PDU reassembled in 210]"
"210","43.220655","172.66.164.67","100.86.121.59","TLSv1.2","1514","Application Data"
"211","43.220679","100.86.121.59","172.66.164.67","TCP","66","54412  >  443 [ACK] Seq=6249 Ack=48525 Win=2003 Len=0 TSval=1457653127 TSecr=1127849779"
"212","43.220714","100.86.121.59","172.66.164.67","TCP","66","[TCP Window Update] 54412  >  443 [ACK] Seq=6249 Ack=48525 Win=2048 Len=0 TSval=1457653127 TSecr=1127849779"
"213","43.221731","172.66.164.67","100.86.121.59","TCP","1514","443  >  54412 [ACK] Seq=48525 Ack=6249 Win=15 Len=1448 TSval=1127849780 TSecr=1457653029 [TCP PDU reassembled in 218]"
"214","43.221732","172.66.164.67","100.86.121.59","TCP","1514","443  >  54412 [PSH, ACK] Seq=49973 Ack=6249 Win=15 Len=1448 TSval=1127849780 TSecr=1457653029 [TCP PDU reassembled in 218]"
"215","43.221768","100.86.121.59","172.66.164.67","TCP","66","54412  >  443 [ACK] Seq=6249 Ack=51421 Win=2003 Len=0 TSval=1457653129 TSecr=1127849780"
"216","43.221807","100.86.121.59","172.66.164.67","TCP","66","[TCP Window Update] 54412  >  443 [ACK] Seq=6249 Ack=51421 Win=2048 Len=0 TSval=1457653129 TSecr=1127849780"
"217","43.222285","172.66.164.67","100.86.121.59","TCP","1514","443  >  54412 [ACK] Seq=51421 Ack=6249 Win=15 Len=1448 TSval=1127849780 TSecr=1457653029 [TCP PDU reassembled in 218]"
"218","43.222286","172.66.164.67","100.86.121.59","TLSv1.2","791","Application Data, Application Data"
"219","43.222320","100.86.121.59","172.66.164.67","TCP","66","54412  >  443 [ACK] Seq=6249 Ack=53594 Win=2015 Len=0 TSval=1457653129 TSecr=1127849780"
"220","43.250991","100.86.121.59","172.66.164.67","TLSv1.2","228","Application Data"
"221","43.260049","172.66.164.67","100.86.121.59","TCP","66","443  >  54412 [ACK] Seq=53594 Ack=6411 Win=15 Len=0 TSval=1127849819 TSecr=1457653158"
"222","43.272766","100.86.121.59","172.66.164.67","TLSv1.2","830","Application Data"
"223","43.272901","100.86.121.59","172.66.164.67","TLSv1.2","1001","Application Data"
"224","43.272991","100.86.121.59","172.66.164.67","TLSv1.2","195","Application Data"
"225","43.273070","100.86.121.59","172.66.164.67","TLSv1.2","193","Application Data"
"226","43.273138","100.86.121.59","172.66.164.67","TLSv1.2","191","Application Data"
"227","43.284359","172.66.164.67","100.86.121.59","TLSv1.2","128","Application Data"
"228","43.284361","172.66.164.67","100.86.121.59","TLSv1.2","108","Application Data"
"229","43.284435","100.86.121.59","172.66.164.67","TCP","66","54412  >  443 [ACK] Seq=8491 Ack=53698 Win=2047 Len=0 TSval=1457653191 TSecr=1127849838"
"230","43.284486","172.66.164.67","100.86.121.59","TLSv1.2","97","Application Data"
"231","43.284521","100.86.121.59","172.66.164.67","TCP","66","54412  >  443 [ACK] Seq=8491 Ack=53729 Win=2047 Len=0 TSval=1457653191 TSecr=1127849838"
"232","43.285027","172.66.164.67","100.86.121.59","TCP","66","443  >  54412 [ACK] Seq=53729 Ack=8366 Win=15 Len=0 TSval=1127849842 TSecr=1457653180"
"233","43.302718","172.66.164.67","100.86.121.59","TLSv1.2","163","Application Data"
"234","43.302720","172.66.164.67","100.86.121.59","TLSv1.2","290","Application Data"
"235","43.302826","100.86.121.59","172.66.164.67","TCP","66","54412  >  443 [ACK] Seq=8491 Ack=54050 Win=2043 Len=0 TSval=1457653210 TSecr=1127849861"
"236","43.304475","172.66.164.67","100.86.121.59","TLSv1.2","97","Application Data"
"237","43.304476","172.66.164.67","100.86.121.59","TLSv1.2","127","Application Data"
"238","43.304476","172.66.164.67","100.86.121.59","TLSv1.2","290","Application Data"
"239","43.304477","172.66.164.67","100.86.121.59","TLSv1.2","97","Application Data"
"240","43.304478","172.66.164.67","100.86.121.59","TLSv1.2","208","Application Data"
"241","43.304479","172.66.164.67","100.86.121.59","TLSv1.2","290","Application Data"
"242","43.304479","172.66.164.67","100.86.121.59","TLSv1.2","97","Application Data"
"243","43.304525","100.86.121.59","172.66.164.67","TCP","66","54412  >  443 [ACK] Seq=8491 Ack=54794 Win=2037 Len=0 TSval=1457653211 TSecr=1127849862"
"244","43.304972","172.66.164.67","100.86.121.59","TLSv1.2","127","Application Data"
"245","43.304973","172.66.164.67","100.86.121.59","TLSv1.2","290","Application Data"
"246","43.304974","172.66.164.67","100.86.121.59","TLSv1.2","97","Application Data"
"247","43.305004","100.86.121.59","172.66.164.67","TCP","66","54412  >  443 [ACK] Seq=8491 Ack=55110 Win=2044 Len=0 TSval=1457653212 TSecr=1127849863"
"248","43.307363","172.66.164.67","100.86.121.59","TLSv1.2","127","Application Data"
"249","43.307365","172.66.164.67","100.86.121.59","TLSv1.2","290","Application Data"
"250","43.307441","100.86.121.59","172.66.164.67","TCP","66","54412  >  443 [ACK] Seq=8491 Ack=55395 Win=2044 Len=0 TSval=1457653214 TSecr=1127849866"
"251","43.307471","172.66.164.67","100.86.121.59","TLSv1.2","97","Application Data"
"252","43.307541","100.86.121.59","172.66.164.67","TCP","66","54412  >  443 [ACK] Seq=8491 Ack=55426 Win=2048 Len=0 TSval=1457653214 TSecr=1127849866"
"253","46.792951","100.86.121.59","172.66.164.67","TLSv1.2","204","Application Data"
"254","46.843960","172.66.164.67","100.86.121.59","TCP","66","443  >  54412 [ACK] Seq=55426 Ack=8629 Win=15 Len=0 TSval=1127853403 TSecr=1457656700"
"255","46.884024","172.66.164.67","100.86.121.59","TLSv1.2","175","Application Data"
"256","46.884135","100.86.121.59","172.66.164.67","TCP","66","54412  >  443 [ACK] Seq=8629 Ack=55535 Win=2047 Len=0 TSval=1457656791 TSecr=1127853442"
"257","46.884279","172.66.164.67","100.86.121.59","TCP","1514","443  >  54412 [ACK] Seq=55535 Ack=8629 Win=15 Len=1448 TSval=1127853442 TSecr=1457656700 [TCP PDU reassembled in 278]"
"258","46.884340","100.86.121.59","172.66.164.67","TCP","66","54412  >  443 [ACK] Seq=8629 Ack=56983 Win=2026 Len=0 TSval=1457656791 TSecr=1127853442"
"259","46.884570","172.66.164.67","100.86.121.59","TCP","1514","443  >  54412 [ACK] Seq=56983 Ack=8629 Win=15 Len=1448 TSval=1127853442 TSecr=1457656700 [TCP PDU reassembled in 278]"
"260","46.884572","172.66.164.67","100.86.121.59","TCP","1514","443  >  54412 [PSH, ACK] Seq=58431 Ack=8629 Win=15 Len=1448 TSval=1127853442 TSecr=1457656700 [TCP PDU reassembled in 278]"
"261","46.884622","100.86.121.59","172.66.164.67","TCP","66","54412  >  443 [ACK] Seq=8629 Ack=59879 Win=2003 Len=0 TSval=1457656791 TSecr=1127853442"
"262","46.884668","100.86.121.59","172.66.164.67","TCP","66","[TCP Window Update] 54412  >  443 [ACK] Seq=8629 Ack=59879 Win=2048 Len=0 TSval=1457656791 TSecr=1127853442"
"263","46.885273","172.66.164.67","100.86.121.59","TCP","1514","443  >  54412 [ACK] Seq=59879 Ack=8629 Win=15 Len=1448 TSval=1127853443 TSecr=1457656700 [TCP PDU reassembled in 278]"
"264","46.885275","172.66.164.67","100.86.121.59","TCP","1514","443  >  54412 [ACK] Seq=61327 Ack=8629 Win=15 Len=1448 TSval=1127853443 TSecr=1457656700 [TCP PDU reassembled in 278]"
"265","46.885293","172.66.164.67","100.86.121.59","TCP","1514","443  >  54412 [PSH, ACK] Seq=62775 Ack=8629 Win=15 Len=1448 TSval=1127853443 TSecr=1457656700 [TCP PDU reassembled in 278]"
"266","46.885331","100.86.121.59","172.66.164.67","TCP","66","54412  >  443 [ACK] Seq=8629 Ack=62775 Win=2003 Len=0 TSval=1457656792 TSecr=1127853443"
"267","46.885363","100.86.121.59","172.66.164.67","TCP","66","54412  >  443 [ACK] Seq=8629 Ack=64223 Win=1981 Len=0 TSval=1457656792 TSecr=1127853443"
"268","46.885386","100.86.121.59","172.66.164.67","TCP","66","[TCP Window Update] 54412  >  443 [ACK] Seq=8629 Ack=64223 Win=2048 Len=0 TSval=1457656792 TSecr=1127853443"
"269","46.886574","172.66.164.67","100.86.121.59","TCP","1514","443  >  54412 [ACK] Seq=64223 Ack=8629 Win=15 Len=1448 TSval=1127853444 TSecr=1457656700 [TCP PDU reassembled in 278]"
"270","46.886575","172.66.164.67","100.86.121.59","TCP","1514","443  >  54412 [ACK] Seq=65671 Ack=8629 Win=15 Len=1448 TSval=1127853444 TSecr=1457656700 [TCP PDU reassembled in 278]"
"271","46.886599","100.86.121.59","172.66.164.67","TCP","66","54412  >  443 [ACK] Seq=8629 Ack=67119 Win=2003 Len=0 TSval=1457656793 TSecr=1127853444"
"272","46.886655","100.86.121.59","172.66.164.67","TCP","66","[TCP Window Update] 54412  >  443 [ACK] Seq=8629 Ack=67119 Win=2048 Len=0 TSval=1457656793 TSecr=1127853444"
"273","46.887085","172.66.164.67","100.86.121.59","TCP","1514","443  >  54412 [PSH, ACK] Seq=67119 Ack=8629 Win=15 Len=1448 TSval=1127853444 TSecr=1457656700 [TCP PDU reassembled in 278]"
"274","46.887086","172.66.164.67","100.86.121.59","TCP","1514","443  >  54412 [ACK] Seq=68567 Ack=8629 Win=15 Len=1448 TSval=1127853445 TSecr=1457656700 [TCP PDU reassembled in 278]"
"275","46.887104","100.86.121.59","172.66.164.67","TCP","66","54412  >  443 [ACK] Seq=8629 Ack=70015 Win=2003 Len=0 TSval=1457656794 TSecr=1127853445"
"276","46.887129","100.86.121.59","172.66.164.67","TCP","66","[TCP Window Update] 54412  >  443 [ACK] Seq=8629 Ack=70015 Win=2048 Len=0 TSval=1457656794 TSecr=1127853445"
"277","46.887549","172.66.164.67","100.86.121.59","TCP","1514","443  >  54412 [ACK] Seq=70015 Ack=8629 Win=15 Len=1448 TSval=1127853445 TSecr=1457656700 [TCP PDU reassembled in 278]"
"278","46.887551","172.66.164.67","100.86.121.59","TLSv1.2","1514","Application Data"
"279","46.887586","100.86.121.59","172.66.164.67","TCP","66","54412  >  443 [ACK] Seq=8629 Ack=72911 Win=2003 Len=0 TSval=1457656794 TSecr=1127853445"
"280","46.887627","100.86.121.59","172.66.164.67","TCP","66","[TCP Window Update] 54412  >  443 [ACK] Seq=8629 Ack=72911 Win=2048 Len=0 TSval=1457656794 TSecr=1127853445"
"281","46.888331","172.66.164.67","100.86.121.59","TCP","1514","443  >  54412 [ACK] Seq=72911 Ack=8629 Win=15 Len=1448 TSval=1127853446 TSecr=1457656700 [TCP PDU reassembled in 286]"
"282","46.888333","172.66.164.67","100.86.121.59","TCP","1514","443  >  54412 [ACK] Seq=74359 Ack=8629 Win=15 Len=1448 TSval=1127853446 TSecr=1457656700 [TCP PDU reassembled in 286]"
"283","46.888377","100.86.121.59","172.66.164.67","TCP","66","54412  >  443 [ACK] Seq=8629 Ack=75807 Win=2003 Len=0 TSval=1457656795 TSecr=1127853446"
"284","46.888450","100.86.121.59","172.66.164.67","TCP","66","[TCP Window Update] 54412  >  443 [ACK] Seq=8629 Ack=75807 Win=2048 Len=0 TSval=1457656795 TSecr=1127853446"
"285","46.888714","172.66.164.67","100.86.121.59","TCP","1514","443  >  54412 [PSH, ACK] Seq=75807 Ack=8629 Win=15 Len=1448 TSval=1127853446 TSecr=1457656700 [TCP PDU reassembled in 286]"
"286","46.888715","172.66.164.67","100.86.121.59","TLSv1.2","584","Application Data, Application Data"
"287","46.888738","100.86.121.59","172.66.164.67","TCP","66","54412  >  443 [ACK] Seq=8629 Ack=77773 Win=2018 Len=0 TSval=1457656795 TSecr=1127853447"
"288","46.916479","100.86.121.59","172.66.164.67","TLSv1.2","199","Application Data"
"289","46.927207","172.66.164.67","100.86.121.59","TCP","66","443  >  54412 [ACK] Seq=77773 Ack=8762 Win=15 Len=0 TSval=1127853484 TSecr=1457656823"
"290","46.937046","100.86.121.59","172.66.164.67","TLSv1.2","366","Application Data"
"291","46.937493","100.86.121.59","172.66.164.67","TLSv1.2","191","Application Data"
"292","46.937816","100.86.121.59","172.66.164.67","TLSv1.2","194","Application Data"
"293","46.938137","100.86.121.59","172.66.164.67","TLSv1.2","193","Application Data"
"294","46.938308","100.86.121.59","172.66.164.67","TLSv1.2","201","Application Data"
"295","46.949429","172.66.164.67","100.86.121.59","TLSv1.2","128","Application Data"
"296","46.949430","172.66.164.67","100.86.121.59","TLSv1.2","108","Application Data"
"297","46.949554","172.66.164.67","100.86.121.59","TLSv1.2","97","Application Data"
"298","46.949563","100.86.121.59","172.66.164.67","TCP","66","54412  >  443 [ACK] Seq=9577 Ack=77877 Win=2047 Len=0 TSval=1457656856 TSecr=1127853502"
"299","46.949581","100.86.121.59","172.66.164.67","TCP","66","54412  >  443 [ACK] Seq=9577 Ack=77908 Win=2047 Len=0 TSval=1457656856 TSecr=1127853503"
"300","46.953037","172.66.164.67","100.86.121.59","TCP","66","443  >  54412 [ACK] Seq=77908 Ack=9577 Win=15 Len=0 TSval=1127853512 TSecr=1457656844"
"301","46.972389","172.66.164.67","100.86.121.59","TLSv1.2","127","Application Data"
"302","46.972390","172.66.164.67","100.86.121.59","TLSv1.2","290","Application Data"
"303","46.972448","100.86.121.59","172.66.164.67","TCP","66","54412  >  443 [ACK] Seq=9577 Ack=78193 Win=2044 Len=0 TSval=1457656879 TSecr=1127853531"
"304","46.972650","172.66.164.67","100.86.121.59","TLSv1.2","97","Application Data"
"305","46.972651","172.66.164.67","100.86.121.59","TLSv1.2","127","Application Data"
"306","46.972652","172.66.164.67","100.86.121.59","TLSv1.2","290","Application Data"
"307","46.972689","100.86.121.59","172.66.164.67","TCP","66","54412  >  443 [ACK] Seq=9577 Ack=78509 Win=2044 Len=0 TSval=1457656879 TSecr=1127853531"
"308","46.973039","172.66.164.67","100.86.121.59","TLSv1.2","97","Application Data"
"309","46.973040","172.66.164.67","100.86.121.59","TLSv1.2","127","Application Data"
"310","46.973041","172.66.164.67","100.86.121.59","TLSv1.2","290","Application Data"
"311","46.973071","100.86.121.59","172.66.164.67","TCP","66","54412  >  443 [ACK] Seq=9577 Ack=78825 Win=2044 Len=0 TSval=1457656880 TSecr=1127853531"
"312","46.973365","172.66.164.67","100.86.121.59","TLSv1.2","97","Application Data"
"313","46.973388","100.86.121.59","172.66.164.67","TCP","66","54412  >  443 [ACK] Seq=9577 Ack=78856 Win=2048 Len=0 TSval=1457656880 TSecr=1127853531"
"314","46.979112","172.66.164.67","100.86.121.59","TLSv1.2","127","Application Data"
"315","46.979114","172.66.164.67","100.86.121.59","TLSv1.2","290","Application Data"
"316","46.979178","100.86.121.59","172.66.164.67","TCP","66","54412  >  443 [ACK] Seq=9577 Ack=79141 Win=2048 Len=0 TSval=1457656886 TSecr=1127853536"
"317","46.979184","172.66.164.67","100.86.121.59","TLSv1.2","97","Application Data"
"318","46.979239","100.86.121.59","172.66.164.67","TCP","66","54412  >  443 [ACK] Seq=9577 Ack=79172 Win=2048 Len=0 TSval=1457656886 TSecr=1127853536"
"319","46.979266","172.66.164.67","100.86.121.59","TLSv1.2","127","Application Data"
"320","46.979267","172.66.164.67","100.86.121.59","TLSv1.2","290","Application Data"
"321","46.979295","100.86.121.59","172.66.164.67","TCP","66","54412  >  443 [ACK] Seq=9577 Ack=79457 Win=2048 Len=0 TSval=1457656886 TSecr=1127853537"
"322","46.979891","172.66.164.67","100.86.121.59","TLSv1.2","97","Application Data"
"323","46.979998","100.86.121.59","172.66.164.67","TCP","66","54412  >  443 [ACK] Seq=9577 Ack=79488 Win=2048 Len=0 TSval=1457656887 TSecr=1127853537"
"324","50.990763","100.86.121.59","172.66.164.67","TCP","54","[TCP Keep-Alive] 54412  >  443 [ACK] Seq=9576 Ack=79488 Win=2048 Len=0"
"325","51.003431","172.66.164.67","100.86.121.59","TCP","66","[TCP Keep-Alive ACK] 443  >  54412 [ACK] Seq=79488 Ack=9577 Win=15 Len=0 TSval=1127857560 TSecr=1457656887"
"326","51.998804","100.86.121.59","172.66.164.67","TLSv1.2","193","Application Data"
"327","51.999271","100.86.121.59","172.66.164.67","TLSv1.2","194","Application Data"
"328","51.999449","100.86.121.59","172.66.164.67","TLSv1.2","641","Application Data"
"329","51.999603","100.86.121.59","172.66.164.67","TLSv1.2","1026","Application Data"
"330","52.010409","172.66.164.67","100.86.121.59","TCP","66","443  >  54412 [ACK] Seq=79488 Ack=11367 Win=15 Len=0 TSval=1127858569 TSecr=1457661905"
"331","52.032958","172.66.164.67","100.86.121.59","TLSv1.2","150","Application Data"
"332","52.032960","172.66.164.67","100.86.121.59","TLSv1.2","290","Application Data"
"333","52.033011","172.66.164.67","100.86.121.59","TLSv1.2","97","Application Data"
"334","52.033088","100.86.121.59","172.66.164.67","TCP","66","54412  >  443 [ACK] Seq=11367 Ack=79796 Win=2044 Len=0 TSval=1457661940 TSecr=1127858591"
"335","52.033101","172.66.164.67","100.86.121.59","TLSv1.2","127","Application Data"
"336","52.033104","172.66.164.67","100.86.121.59","TLSv1.2","290","Application Data"
"337","52.033151","100.86.121.59","172.66.164.67","TCP","66","54412  >  443 [ACK] Seq=11367 Ack=79827 Win=2044 Len=0 TSval=1457661940 TSecr=1127858591"
"338","52.033170","100.86.121.59","172.66.164.67","TCP","66","54412  >  443 [ACK] Seq=11367 Ack=80112 Win=2040 Len=0 TSval=1457661940 TSecr=1127858591"
"339","52.033557","172.66.164.67","100.86.121.59","TLSv1.2","97","Application Data"
"340","52.033609","100.86.121.59","172.66.164.67","TCP","66","54412  >  443 [ACK] Seq=11367 Ack=80143 Win=2048 Len=0 TSval=1457661940 TSecr=1127858592"
"341","52.034238","100.86.121.59","172.66.164.67","TLSv1.2","101","Application Data"
"342","52.085138","172.66.164.67","100.86.121.59","TCP","66","443  >  54412 [ACK] Seq=80143 Ack=11402 Win=15 Len=0 TSval=1127858644 TSecr=1457661941"
"343","52.281214","172.66.164.67","100.86.121.59","TLSv1.2","127","Application Data"
"344","52.281217","172.66.164.67","100.86.121.59","TLSv1.2","290","Application Data"
"345","52.281266","172.66.164.67","100.86.121.59","TLSv1.2","97","Application Data"
"346","52.281376","100.86.121.59","172.66.164.67","TCP","66","54412  >  443 [ACK] Seq=11402 Ack=80428 Win=2044 Len=0 TSval=1457662188 TSecr=1127858840"
"347","52.281456","100.86.121.59","172.66.164.67","TCP","66","54412  >  443 [ACK] Seq=11402 Ack=80459 Win=2044 Len=0 TSval=1457662188 TSecr=1127858840"
"348","52.284900","172.66.164.67","100.86.121.59","TLSv1.2","127","Application Data"
"349","52.284902","172.66.164.67","100.86.121.59","TLSv1.2","290","Application Data"
"350","52.284956","172.66.164.67","100.86.121.59","TLSv1.2","97","Application Data"
"351","52.285058","100.86.121.59","172.66.164.67","TCP","66","54412  >  443 [ACK] Seq=11402 Ack=80744 Win=2044 Len=0 TSval=1457662192 TSecr=1127858843"
"352","52.285118","100.86.121.59","172.66.164.67","TCP","66","54412  >  443 [ACK] Seq=11402 Ack=80775 Win=2044 Len=0 TSval=1457662192 TSecr=1127858843"
"353","52.543308","100.86.121.59","172.66.164.67","TCP","54","[TCP Keep-Alive] 54412  >  443 [ACK] Seq=11401 Ack=80775 Win=2048 Len=0"
"354","52.555195","172.66.164.67","100.86.121.59","TCP","66","[TCP Keep-Alive ACK] 443  >  54412 [ACK] Seq=80775 Ack=11402 Win=15 Len=0 TSval=1127859114 TSecr=1457662192"
"355","56.997981","100.86.121.59","172.66.164.67","TLSv1.2","192","Application Data"
"356","57.010604","172.66.164.67","100.86.121.59","TCP","66","443  >  54412 [ACK] Seq=80775 Ack=11528 Win=15 Len=0 TSval=1127863568 TSecr=1457666905"
"357","57.031224","172.66.164.67","100.86.121.59","TLSv1.2","150","Application Data"
"358","57.031226","172.66.164.67","100.86.121.59","TLSv1.2","290","Application Data"
"359","57.031281","172.66.164.67","100.86.121.59","TLSv1.2","97","Application Data"
"360","57.031426","100.86.121.59","172.66.164.67","TCP","66","54412  >  443 [ACK] Seq=11528 Ack=81083 Win=2044 Len=0 TSval=1457666938 TSecr=1127863590"
"361","57.031503","100.86.121.59","172.66.164.67","TCP","66","54412  >  443 [ACK] Seq=11528 Ack=81114 Win=2044 Len=0 TSval=1457666938 TSecr=1127863590"
"362","61.921361","100.86.121.59","172.66.164.67","TLSv1.2","187","Application Data"
"363","61.955394","172.66.164.67","100.86.121.59","TLSv1.2","151","Application Data"
"364","61.955397","172.66.164.67","100.86.121.59","TLSv1.2","108","Application Data"
"365","61.955624","100.86.121.59","172.66.164.67","TCP","66","54412  >  443 [ACK] Seq=11649 Ack=81241 Win=2047 Len=0 TSval=1457671862 TSecr=1127868513"
"366","61.956481","172.66.164.67","100.86.121.59","TLSv1.2","97","Application Data"
"367","61.956559","100.86.121.59","172.66.164.67","TCP","66","54412  >  443 [ACK] Seq=11649 Ack=81272 Win=2048 Len=0 TSval=1457671863 TSecr=1127868513"
"368","61.959953","100.86.121.59","172.66.164.67","TLSv1.2","101","Application Data"
"369","62.012989","172.66.164.67","100.86.121.59","TCP","66","443  >  54412 [ACK] Seq=81272 Ack=11684 Win=15 Len=0 TSval=1127868570 TSecr=1457671867"
"370","62.042935","100.86.121.59","172.66.164.67","TLSv1.2","250","Application Data"
"371","62.053908","172.66.164.67","100.86.121.59","TCP","66","443  >  54412 [ACK] Seq=81272 Ack=11868 Win=15 Len=0 TSval=1127868612 TSecr=1457671950"
"372","62.076002","172.66.164.67","100.86.121.59","TLSv1.2","127","Application Data"
"373","62.076004","172.66.164.67","100.86.121.59","TLSv1.2","290","Application Data"
"374","62.076164","100.86.121.59","172.66.164.67","TCP","66","54412  >  443 [ACK] Seq=11868 Ack=81557 Win=2044 Len=0 TSval=1457671983 TSecr=1127868634"
"375","62.076908","172.66.164.67","100.86.121.59","TLSv1.2","97","Application Data"
"376","62.076989","100.86.121.59","172.66.164.67","TCP","66","54412  >  443 [ACK] Seq=11868 Ack=81588 Win=2048 Len=0 TSval=1457671984 TSecr=1127868634"
