"No.","Time","Source","Destination","Protocol","Length","Info"
"1","0.000000","100.86.121.59","172.66.164.67","TLSv1.2","369","Application Data"
"2","0.012920","172.66.164.67","100.86.121.59","TCP","66","443  >  53996 [ACK] Seq=1 Ack=304 Win=17 Len=0 TSval=1715118433 TSecr=1969210017"
"3","0.036071","172.66.164.67","100.86.121.59","TLSv1.2","232","Application Data"
"4","0.036073","172.66.164.67","100.86.121.59","TLSv1.2","108","Application Data"
"5","0.036221","100.86.121.59","172.66.164.67","TCP","66","53996  >  443 [ACK] Seq=304 Ack=209 Win=2045 Len=0 TSval=1969210053 TSecr=1715118457"
"6","0.037140","172.66.164.67","100.86.121.59","TLSv1.2","97","Application Data"
"7","0.037235","100.86.121.59","172.66.164.67","TCP","66","53996  >  443 [ACK] Seq=304 Ack=240 Win=2048 Len=0 TSval=1969210054 TSecr=1715118457"
"8","3.247992","100.86.121.59","172.66.164.67","TLSv1.2","411","Application Data"
"9","3.298616","172.66.164.67","100.86.121.59","TCP","66","443  >  53996 [ACK] Seq=240 Ack=649 Win=17 Len=0 TSval=1715121721 TSecr=1969213265"
"10","5.270261","172.66.164.67","100.86.121.59","TLSv1.2","273","Application Data"
"11","5.270263","172.66.164.67","100.86.121.59","TCP","1514","443  >  53996 [ACK] Seq=447 Ack=649 Win=17 Len=1448 TSval=1715123672 TSecr=1969213265 [TCP PDU reassembled in 26]"
"12","5.270265","172.66.164.67","100.86.121.59","TCP","1514","443  >  53996 [ACK] Seq=1895 Ack=649 Win=17 Len=1448 TSval=1715123672 TSecr=1969213265 [TCP PDU reassembled in 26]"
"13","5.270267","172.66.164.67","100.86.121.59","TCP","1514","443  >  53996 [ACK] Seq=3343 Ack=649 Win=17 Len=1448 TSval=1715123672 TSecr=1969213265 [TCP PDU reassembled in 26]"
"14","5.270269","172.66.164.67","100.86.121.59","TCP","1514","443  >  53996 [ACK] Seq=4791 Ack=649 Win=17 Len=1448 TSval=1715123672 TSecr=1969213265 [TCP PDU reassembled in 26]"
"15","5.270270","172.66.164.67","100.86.121.59","TCP","1514","443  >  53996 [ACK] Seq=6239 Ack=649 Win=17 Len=1448 TSval=1715123672 TSecr=1969213265 [TCP PDU reassembled in 26]"
"16","5.270337","172.66.164.67","100.86.121.59","TCP","1514","443  >  53996 [ACK] Seq=7687 Ack=649 Win=17 Len=1448 TSval=1715123672 TSecr=1969213265 [TCP PDU reassembled in 26]"
"17","5.270339","172.66.164.67","100.86.121.59","TCP","1514","443  >  53996 [ACK] Seq=9135 Ack=649 Win=17 Len=1448 TSval=1715123672 TSecr=1969213265 [TCP PDU reassembled in 26]"
"18","5.270362","172.66.164.67","100.86.121.59","TCP","1514","443  >  53996 [PSH, ACK] Seq=10583 Ack=649 Win=17 Len=1448 TSval=1715123672 TSecr=1969213265 [TCP PDU reassembled in 26]"
"19","5.270364","172.66.164.67","100.86.121.59","TCP","1514","443  >  53996 [ACK] Seq=12031 Ack=649 Win=17 Len=1448 TSval=1715123673 TSecr=1969213265 [TCP PDU reassembled in 26]"
"20","5.270366","172.66.164.67","100.86.121.59","TCP","1514","443  >  53996 [ACK] Seq=13479 Ack=649 Win=17 Len=1448 TSval=1715123673 TSecr=1969213265 [TCP PDU reassembled in 26]"
"21","5.270369","172.66.164.67","100.86.121.59","TCP","1514","443  >  53996 [ACK] Seq=14927 Ack=649 Win=17 Len=1448 TSval=1715123673 TSecr=1969213265 [TCP PDU reassembled in 26]"
"22","5.270446","100.86.121.59","172.66.164.67","TCP","66","53996  >  443 [ACK] Seq=649 Ack=7687 Win=1932 Len=0 TSval=1969215287 TSecr=1715123672"
"23","5.270509","100.86.121.59","172.66.164.67","TCP","66","53996  >  443 [ACK] Seq=649 Ack=10583 Win=1887 Len=0 TSval=1969215287 TSecr=1715123672"
"24","5.270522","100.86.121.59","172.66.164.67","TCP","66","53996  >  443 [ACK] Seq=649 Ack=16375 Win=1797 Len=0 TSval=1969215287 TSecr=1715123673"
"25","5.270572","100.86.121.59","172.66.164.67","TCP","66","[TCP Window Update] 53996  >  443 [ACK] Seq=649 Ack=16375 Win=2048 Len=0 TSval=1969215288 TSecr=1715123673"
"26","5.271749","172.66.164.67","100.86.121.59","TLSv1.2","544","Application Data"
"27","5.271751","172.66.164.67","100.86.121.59","TCP","1514","443  >  53996 [ACK] Seq=16853 Ack=649 Win=17 Len=1448 TSval=1715123674 TSecr=1969213265 [TCP PDU reassembled in 28]"
"28","5.271753","172.66.164.67","100.86.121.59","TLSv1.2","398","Application Data"
"29","5.271755","172.66.164.67","100.86.121.59","TCP","1514","443  >  53996 [ACK] Seq=18633 Ack=649 Win=17 Len=1448 TSval=1715123677 TSecr=1969213265 [TCP PDU reassembled in 40]"
"30","5.271756","172.66.164.67","100.86.121.59","TCP","1514","443  >  53996 [ACK] Seq=20081 Ack=649 Win=17 Len=1448 TSval=1715123677 TSecr=1969213265 [TCP PDU reassembled in 40]"
"31","5.271758","172.66.164.67","100.86.121.59","TCP","1514","443  >  53996 [ACK] Seq=21529 Ack=649 Win=17 Len=1448 TSval=1715123677 TSecr=1969213265 [TCP PDU reassembled in 40]"
"32","5.271760","172.66.164.67","100.86.121.59","TCP","1514","443  >  53996 [ACK] Seq=22977 Ack=649 Win=17 Len=1448 TSval=1715123677 TSecr=1969213265 [TCP PDU reassembled in 40]"
"33","5.271762","172.66.164.67","100.86.121.59","TCP","1514","443  >  53996 [ACK] Seq=24425 Ack=649 Win=17 Len=1448 TSval=1715123677 TSecr=1969213265 [TCP PDU reassembled in 40]"
"34","5.271764","172.66.164.67","100.86.121.59","TCP","1514","443  >  53996 [ACK] Seq=25873 Ack=649 Win=17 Len=1448 TSval=1715123677 TSecr=1969213265 [TCP PDU reassembled in 40]"
"35","5.271766","172.66.164.67","100.86.121.59","TCP","1514","443  >  53996 [ACK] Seq=27321 Ack=649 Win=17 Len=1448 TSval=1715123677 TSecr=1969213265 [TCP PDU reassembled in 40]"
"36","5.271768","172.66.164.67","100.86.121.59","TCP","1514","443  >  53996 [PSH, ACK] Seq=28769 Ack=649 Win=17 Len=1448 TSval=1715123677 TSecr=1969213265 [TCP PDU reassembled in 40]"
"37","5.271770","172.66.164.67","100.86.121.59","TCP","1514","443  >  53996 [ACK] Seq=30217 Ack=649 Win=17 Len=1448 TSval=1715123677 TSecr=1969213265 [TCP PDU reassembled in 40]"
"38","5.271772","172.66.164.67","100.86.121.59","TCP","1514","443  >  53996 [ACK] Seq=31665 Ack=649 Win=17 Len=1448 TSval=1715123677 TSecr=1969213265 [TCP PDU reassembled in 40]"
"39","5.271774","172.66.164.67","100.86.121.59","TCP","1514","443  >  53996 [ACK] Seq=33113 Ack=649 Win=17 Len=1448 TSval=1715123677 TSecr=1969213265 [TCP PDU reassembled in 40]"
"40","5.271776","172.66.164.67","100.86.121.59","TLSv1.2","544","Application Data"
"41","5.271778","172.66.164.67","100.86.121.59","TCP","1514","443  >  53996 [ACK] Seq=35039 Ack=649 Win=17 Len=1448 TSval=1715123678 TSecr=1969213265 [TCP PDU reassembled in 47]"
"42","5.271780","172.66.164.67","100.86.121.59","TCP","1514","443  >  53996 [ACK] Seq=36487 Ack=649 Win=17 Len=1448 TSval=1715123678 TSecr=1969213265 [TCP PDU reassembled in 47]"
"43","5.271782","172.66.164.67","100.86.121.59","TCP","1514","443  >  53996 [ACK] Seq=37935 Ack=649 Win=17 Len=1448 TSval=1715123678 TSecr=1969213265 [TCP PDU reassembled in 47]"
"44","5.271784","172.66.164.67","100.86.121.59","TCP","1514","443  >  53996 [ACK] Seq=39383 Ack=649 Win=17 Len=1448 TSval=1715123678 TSecr=1969213265 [TCP PDU reassembled in 47]"
"45","5.271786","172.66.164.67","100.86.121.59","TCP","1514","443  >  53996 [ACK] Seq=40831 Ack=649 Win=17 Len=1448 TSval=1715123678 TSecr=1969213265 [TCP PDU reassembled in 47]"
"46","5.271788","172.66.164.67","100.86.121.59","TCP","1514","443  >  53996 [ACK] Seq=42279 Ack=649 Win=17 Len=1448 TSval=1715123678 TSecr=1969213265 [TCP PDU reassembled in 47]"
"47","5.271790","172.66.164.67","100.86.121.59","TLSv1.2","138","Application Data"
"48","5.271791","172.66.164.67","100.86.121.59","TLSv1.2","97","Application Data"
"49","5.271886","100.86.121.59","172.66.164.67","TCP","66","53996  >  443 [ACK] Seq=649 Ack=31665 Win=1810 Len=0 TSval=1969215289 TSecr=1715123677"
"50","5.271914","100.86.121.59","172.66.164.67","TCP","66","53996  >  443 [ACK] Seq=649 Ack=43830 Win=1620 Len=0 TSval=1969215289 TSecr=1715123679"
"51","5.272647","100.86.121.59","172.66.164.67","TCP","66","[TCP Window Update] 53996  >  443 [ACK] Seq=649 Ack=43830 Win=2048 Len=0 TSval=1969215290 TSecr=1715123679"
"52","5.274970","100.86.121.59","172.66.164.67","TLSv1.2","101","Application Data"
"53","5.284281","172.66.164.67","100.86.121.59","TCP","66","443  >  53996 [ACK] Seq=43830 Ack=684 Win=17 Len=0 TSval=1715123706 TSecr=1969215292"
"54","5.349581","100.86.121.59","172.66.164.67","TLSv1.2","268","Application Data"
"55","5.375023","100.86.121.59","172.66.164.67","TCP","1454","53996  >  443 [ACK] Seq=886 Ack=43830 Win=2048 Len=1388 TSval=1969215392 TSecr=1715123706 [TCP PDU reassembled in 56]"
"56","5.375031","100.86.121.59","172.66.164.67","TLSv1.2","218","Application Data"
"57","5.375257","100.86.121.59","172.66.164.67","TLSv1.2","278","Application Data"
"58","5.375597","100.86.121.59","172.66.164.67","TLSv1.2","199","Application Data"
"59","5.375669","100.86.121.59","172.66.164.67","TLSv1.2","288","Application Data"
"60","5.375736","100.86.121.59","172.66.164.67","TLSv1.2","198","Application Data"
"61","5.379970","172.66.164.67","100.86.121.59","TCP","66","443  >  53996 [ACK] Seq=43830 Ack=886 Win=17 Len=0 TSval=1715123783 TSecr=1969215367"
"62","5.385830","172.66.164.67","100.86.121.59","TLSv1.2","151","Application Data"
"63","5.385831","172.66.164.67","100.86.121.59","TLSv1.2","108","Application Data"
"64","5.385833","172.66.164.67","100.86.121.59","TLSv1.2","97","Application Data"
"65","5.385891","100.86.121.59","172.66.164.67","TCP","66","53996  >  443 [ACK] Seq=3125 Ack=43988 Win=2046 Len=0 TSval=1969215403 TSecr=1715123804"
"66","5.386330","172.66.164.67","100.86.121.59","TCP","66","443  >  53996 [ACK] Seq=43988 Ack=2426 Win=17 Len=0 TSval=1715123808 TSecr=1969215392"
"67","5.386330","172.66.164.67","100.86.121.59","TCP","66","443  >  53996 [ACK] Seq=43988 Ack=3125 Win=17 Len=0 TSval=1715123808 TSecr=1969215392"
"68","5.438550","172.66.164.67","100.86.121.59","TLSv1.2","127","Application Data"
"69","5.438551","172.66.164.67","100.86.121.59","TLSv1.2","290","Application Data"
"70","5.438552","172.66.164.67","100.86.121.59","TLSv1.2","97","Application Data"
"71","5.438606","100.86.121.59","172.66.164.67","TCP","66","53996  >  443 [ACK] Seq=3125 Ack=44304 Win=2044 Len=0 TSval=1969215456 TSecr=1715123830"
"72","5.438805","172.66.164.67","100.86.121.59","TLSv1.2","127","Application Data"
"73","5.438806","172.66.164.67","100.86.121.59","TLSv1.2","290","Application Data"
"74","5.438807","172.66.164.67","100.86.121.59","TLSv1.2","97","Application Data"
"75","5.438807","172.66.164.67","100.86.121.59","TLSv1.2","226","Application Data"
"76","5.438808","172.66.164.67","100.86.121.59","TLSv1.2","290","Application Data"
"77","5.438809","172.66.164.67","100.86.121.59","TLSv1.2","97","Application Data"
"78","5.438810","172.66.164.67","100.86.121.59","TLSv1.2","163","Application Data"
"79","5.438810","172.66.164.67","100.86.121.59","TLSv1.2","290","Application Data"
"80","5.438811","172.66.164.67","100.86.121.59","TLSv1.2","97","Application Data"
"81","5.438812","172.66.164.67","100.86.121.59","TLSv1.2","127","Application Data"
"82","5.438813","172.66.164.67","100.86.121.59","TLSv1.2","290","Application Data"
"83","5.438814","172.66.164.67","100.86.121.59","TLSv1.2","97","Application Data"
"84","5.438869","100.86.121.59","172.66.164.67","TCP","66","53996  >  443 [ACK] Seq=3125 Ack=45703 Win=2023 Len=0 TSval=1969215456 TSecr=1715123835"
"85","10.460412","100.86.121.59","172.66.164.67","TLSv1.2","348","Application Data"
"86","10.461460","100.86.121.59","172.66.164.67","TLSv1.2","313","Application Data"
"87","10.461863","100.86.121.59","172.66.164.67","TCP","1454","53996  >  443 [ACK] Seq=3654 Ack=45703 Win=2048 Len=1388 TSval=1969220479 TSecr=1715123835 [TCP PDU reassembled in 88]"
"88","10.461878","100.86.121.59","172.66.164.67","TLSv1.2","84","Application Data"
"89","10.462321","100.86.121.59","172.66.164.67","TLSv1.2","212","Application Data"
"90","10.474448","172.66.164.67","100.86.121.59","TCP","66","443  >  53996 [ACK] Seq=45703 Ack=5060 Win=17 Len=0 TSval=1715128896 TSecr=1969220477"
"91","10.498646","172.66.164.67","100.86.121.59","TLSv1.2","150","Application Data"
"92","10.498651","172.66.164.67","100.86.121.59","TLSv1.2","290","Application Data"
"93","10.498893","100.86.121.59","172.66.164.67","TCP","66","53996  >  443 [ACK] Seq=5206 Ack=46011 Win=2044 Len=0 TSval=1969220516 TSecr=1715128919"
"94","10.498897","172.66.164.67","100.86.121.59","TLSv1.2","97","Application Data"
"95","10.498991","100.86.121.59","172.66.164.67","TCP","66","53996  >  443 [ACK] Seq=5206 Ack=46042 Win=2044 Len=0 TSval=1969220516 TSecr=1715128919"
"96","10.499295","172.66.164.67","100.86.121.59","TLSv1.2","127","Application Data"
"97","10.499360","100.86.121.59","172.66.164.67","TCP","66","53996  >  443 [ACK] Seq=5206 Ack=46103 Win=2048 Len=0 TSval=1969220516 TSecr=1715128921"
"98","10.499691","172.66.164.67","100.86.121.59","TLSv1.2","290","Application Data"
"99","10.499693","172.66.164.67","100.86.121.59","TLSv1.2","97","Application Data"
"100","10.499760","100.86.121.59","172.66.164.67","TCP","66","53996  >  443 [ACK] Seq=5206 Ack=46358 Win=2045 Len=0 TSval=1969220517 TSecr=1715128921"
"101","10.501600","172.66.164.67","100.86.121.59","TLSv1.2","127","Application Data"
"102","10.501604","172.66.164.67","100.86.121.59","TLSv1.2","290","Application Data"
"103","10.501725","172.66.164.67","100.86.121.59","TLSv1.2","97","Application Data"
"104","10.501751","100.86.121.59","172.66.164.67","TCP","66","53996  >  443 [ACK] Seq=5206 Ack=46643 Win=2044 Len=0 TSval=1969220519 TSecr=1715128923"
"105","10.501815","100.86.121.59","172.66.164.67","TCP","66","53996  >  443 [ACK] Seq=5206 Ack=46674 Win=2044 Len=0 TSval=1969220519 TSecr=1715128923"
"106","10.502577","172.66.164.67","100.86.121.59","TLSv1.2","127","Application Data"
"107","10.502672","100.86.121.59","172.66.164.67","TCP","66","53996  >  443 [ACK] Seq=5206 Ack=46735 Win=2044 Len=0 TSval=1969220520 TSecr=1715128924"
"108","10.502908","172.66.164.67","100.86.121.59","TLSv1.2","290","Application Data"
"109","10.502910","172.66.164.67","100.86.121.59","TLSv1.2","97","Application Data"
"110","10.502957","100.86.121.59","172.66.164.67","TCP","66","53996  >  443 [ACK] Seq=5206 Ack=46990 Win=2041 Len=0 TSval=1969220520 TSecr=1715128925"
"111","10.504110","100.86.121.59","172.66.164.67","TLSv1.2","101","Application Data"
"112","10.556169","172.66.164.67","100.86.121.59","TCP","66","443  >  53996 [ACK] Seq=46990 Ack=5241 Win=17 Len=0 TSval=1715128978 TSecr=1969220521"
"113","15.462019","100.86.121.59","172.66.164.67","TLSv1.2","280","Application Data"
"114","15.474091","172.66.164.67","100.86.121.59","TCP","66","443  >  53996 [ACK] Seq=46990 Ack=5455 Win=17 Len=0 TSval=1715133895 TSecr=1969225479"
"115","15.496621","172.66.164.67","100.86.121.59","TLSv1.2","150","Application Data"
"116","15.496626","172.66.164.67","100.86.121.59","TLSv1.2","290","Application Data"
"117","15.496824","100.86.121.59","172.66.164.67","TCP","66","53996  >  443 [ACK] Seq=5455 Ack=47298 Win=2044 Len=0 TSval=1969225514 TSecr=1715133918"
"118","15.497025","172.66.164.67","100.86.121.59","TLSv1.2","97","Application Data"
"119","15.497100","100.86.121.59","172.66.164.67","TCP","66","53996  >  443 [ACK] Seq=5455 Ack=47329 Win=2048 Len=0 TSval=1969225514 TSecr=1715133918"
"120","20.352006","100.86.121.59","172.66.164.67","TLSv1.2","193","Application Data"
"121","20.460854","172.66.164.67","100.86.121.59","TLSv1.2","151","Application Data"
"122","20.460977","100.86.121.59","172.66.164.67","TCP","66","53996  >  443 [ACK] Seq=5582 Ack=47414 Win=2047 Len=0 TSval=1969230478 TSecr=1715138832"
"123","20.461111","172.66.164.67","100.86.121.59","TLSv1.2","108","Application Data"
"124","20.461113","172.66.164.67","100.86.121.59","TLSv1.2","97","Application Data"
"125","20.461954","100.86.121.59","172.66.164.67","TCP","66","53996  >  443 [ACK] Seq=5582 Ack=47487 Win=2047 Len=0 TSval=1969230479 TSecr=1715138832"
"126","20.462950","100.86.121.59","172.66.164.67","TLSv1.2","101","Application Data"
"127","20.540707","172.66.164.67","100.86.121.59","TCP","97","[TCP Spurious Retransmission] 443  >  53996 [PSH, ACK] Seq=47456 Ack=5582 Win=17 Len=31 TSval=1715138869 TSecr=1969230369"
"128","20.540880","100.86.121.59","172.66.164.67","TCP","78","[TCP Dup ACK 125#1] 53996  >  443 [ACK] Seq=5617 Ack=47487 Win=2048 Len=0 TSval=1969230558 TSecr=1715138869 SLE=47456 SRE=47487"
"129","20.635331","172.66.164.67","100.86.121.59","TCP","66","443  >  53996 [ACK] Seq=47487 Ack=5617 Win=17 Len=0 TSval=1715139011 TSecr=1969230480"
"130","30.510741","100.86.121.59","172.66.164.67","TLSv1.2","290","Application Data"
"131","30.510790","100.86.121.59","172.66.164.67","TLSv1.2","105","Application Data"
"132","30.510987","100.86.121.59","172.66.164.67","TLSv1.2","198","Application Data"
"133","30.524875","172.66.164.67","100.86.121.59","TCP","66","443  >  53996 [ACK] Seq=47487 Ack=6012 Win=17 Len=0 TSval=1715148946 TSecr=1969240528"
"134","30.526606","172.66.164.67","100.86.121.59","TLSv1.2","105","Application Data"
"135","30.526714","100.86.121.59","172.66.164.67","TCP","66","53996  >  443 [ACK] Seq=6012 Ack=47526 Win=2048 Len=0 TSval=1969240543 TSecr=1715148948"
"136","30.552817","172.66.164.67","100.86.121.59","TLSv1.2","150","Application Data"
"137","30.552820","172.66.164.67","100.86.121.59","TLSv1.2","290","Application Data"
"138","30.552919","100.86.121.59","172.66.164.67","TCP","66","53996  >  443 [ACK] Seq=6012 Ack=47834 Win=2044 Len=0 TSval=1969240570 TSecr=1715148974"
"139","30.553213","172.66.164.67","100.86.121.59","TLSv1.2","97","Application Data"
"140","30.553246","100.86.121.59","172.66.164.67","TCP","66","53996  >  443 [ACK] Seq=6012 Ack=47865 Win=2048 Len=0 TSval=1969240570 TSecr=1715148974"
"141","30.554265","100.86.121.59","172.66.164.67","TLSv1.2","101","Application Data"
"142","30.555793","172.66.164.67","100.86.121.59","TLSv1.2","127","Application Data"
"143","30.555795","172.66.164.67","100.86.121.59","TLSv1.2","290","Application Data"
"144","30.555908","100.86.121.59","172.66.164.67","TCP","66","53996  >  443 [ACK] Seq=6047 Ack=48150 Win=2044 Len=0 TSval=1969240573 TSecr=1715148977"
"145","30.556066","172.66.164.67","100.86.121.59","TLSv1.2","97","Application Data"
"146","30.556121","100.86.121.59","172.66.164.67","TCP","66","53996  >  443 [ACK] Seq=6047 Ack=48181 Win=2048 Len=0 TSval=1969240573 TSecr=1715148977"
"147","30.606878","172.66.164.67","100.86.121.59","TCP","66","443  >  53996 [ACK] Seq=48181 Ack=6047 Win=17 Len=0 TSval=1715149028 TSecr=1969240571"
"148","35.354695","100.86.121.59","172.66.164.67","TLSv1.2","340","Application Data"
"149","35.364792","172.66.164.67","100.86.121.59","TCP","66","443  >  53996 [ACK] Seq=48181 Ack=6321 Win=17 Len=0 TSval=1715153786 TSecr=1969245371"
"150","35.393532","172.66.164.67","100.86.121.59","TLSv1.2","297","Application Data"
"151","35.393535","172.66.164.67","100.86.121.59","TLSv1.2","108","Application Data"
"152","35.393537","172.66.164.67","100.86.121.59","TLSv1.2","97","Application Data"
"153","35.393691","100.86.121.59","172.66.164.67","TCP","66","53996  >  443 [ACK] Seq=6321 Ack=48485 Win=2044 Len=0 TSval=1969245410 TSecr=1715153815"
"154","35.511781","100.86.121.59","172.66.164.67","TLSv1.2","311","Application Data"
"155","35.512226","100.86.121.59","172.66.164.67","TCP","1454","53996  >  443 [ACK] Seq=6566 Ack=48485 Win=2048 Len=1388 TSval=1969245529 TSecr=1715153815 [TCP PDU reassembled in 156]"
"156","35.512242","100.86.121.59","172.66.164.67","TLSv1.2","85","Application Data"
"157","35.523177","172.66.164.67","100.86.121.59","TCP","66","443  >  53996 [ACK] Seq=48485 Ack=7973 Win=17 Len=0 TSval=1715153944 TSecr=1969245528"
"158","35.545285","172.66.164.67","100.86.121.59","TLSv1.2","127","Application Data"
"159","35.545292","172.66.164.67","100.86.121.59","TLSv1.2","290","Application Data"
"160","35.545294","172.66.164.67","100.86.121.59","TLSv1.2","97","Application Data"
"161","35.545436","100.86.121.59","172.66.164.67","TCP","66","53996  >  443 [ACK] Seq=7973 Ack=48801 Win=2044 Len=0 TSval=1969245562 TSecr=1715153967"
"162","35.548730","172.66.164.67","100.86.121.59","TLSv1.2","208","Application Data"
"163","35.548733","172.66.164.67","100.86.121.59","TLSv1.2","290","Application Data"
"164","35.548868","100.86.121.59","172.66.164.67","TCP","66","53996  >  443 [ACK] Seq=7973 Ack=49167 Win=2043 Len=0 TSval=1969245566 TSecr=1715153970"
"165","35.549276","172.66.164.67","100.86.121.59","TLSv1.2","97","Application Data"
"166","35.549330","100.86.121.59","172.66.164.67","TCP","66","53996  >  443 [ACK] Seq=7973 Ack=49198 Win=2048 Len=0 TSval=1969245566 TSecr=1715153970"
"167","40.506893","100.86.121.59","172.66.164.67","TLSv1.2","213","Application Data"
"168","40.544604","172.66.164.67","100.86.121.59","TLSv1.2","150","Application Data"
"169","40.544607","172.66.164.67","100.86.121.59","TLSv1.2","290","Application Data"
"170","40.544693","172.66.164.67","100.86.121.59","TLSv1.2","97","Application Data"
"171","40.544803","100.86.121.59","172.66.164.67","TCP","66","53996  >  443 [ACK] Seq=8120 Ack=49506 Win=2044 Len=0 TSval=1969250561 TSecr=1715158966"
"172","40.544878","100.86.121.59","172.66.164.67","TCP","66","53996  >  443 [ACK] Seq=8120 Ack=49537 Win=2044 Len=0 TSval=1969250562 TSecr=1715158966"
"173","40.548342","100.86.121.59","172.66.164.67","TLSv1.2","101","Application Data"
"174","40.600667","172.66.164.67","100.86.121.59","TCP","66","443  >  53996 [ACK] Seq=49537 Ack=8155 Win=17 Len=0 TSval=1715159022 TSecr=1969250565"
"175","50.354297","100.86.121.59","172.66.164.67","TLSv1.2","269","Application Data"
"176","50.364159","172.66.164.67","100.86.121.59","TCP","66","443  >  53996 [ACK] Seq=49537 Ack=8358 Win=17 Len=0 TSval=1715168785 TSecr=1969260371"
"177","50.392859","172.66.164.67","100.86.121.59","TLSv1.2","151","Application Data"
"178","50.392863","172.66.164.67","100.86.121.59","TLSv1.2","108","Application Data"
"179","50.392951","172.66.164.67","100.86.121.59","TLSv1.2","97","Application Data"
"180","50.393024","100.86.121.59","172.66.164.67","TCP","66","53996  >  443 [ACK] Seq=8358 Ack=49664 Win=2047 Len=0 TSval=1969260410 TSecr=1715168814"
"181","50.393094","100.86.121.59","172.66.164.67","TCP","66","53996  >  443 [ACK] Seq=8358 Ack=49695 Win=2047 Len=0 TSval=1969260410 TSecr=1715168814"
"182","50.394935","100.86.121.59","172.66.164.67","TLSv1.2","101","Application Data"
"183","50.446507","172.66.164.67","100.86.121.59","TCP","66","443  >  53996 [ACK] Seq=49695 Ack=8393 Win=17 Len=0 TSval=1715168868 TSecr=1969260412"
"184","55.558089","100.86.121.59","172.66.164.67","TLSv1.2","198","Application Data"
"185","55.568124","172.66.164.67","100.86.121.59","TCP","66","443  >  53996 [ACK] Seq=49695 Ack=8525 Win=17 Len=0 TSval=1715173989 TSecr=1969265575"
"186","55.588357","172.66.164.67","100.86.121.59","TLSv1.2","150","Application Data"
"187","55.588359","172.66.164.67","100.86.121.59","TLSv1.2","290","Application Data"
"188","55.588361","172.66.164.67","100.86.121.59","TLSv1.2","97","Application Data"
"189","55.588460","100.86.121.59","172.66.164.67","TCP","66","53996  >  443 [ACK] Seq=8525 Ack=50034 Win=2043 Len=0 TSval=1969265605 TSecr=1715174010"
"190","55.588899","100.86.121.59","172.66.164.67","TLSv1.2","101","Application Data"
"191","55.639028","172.66.164.67","100.86.121.59","TCP","66","443  >  53996 [ACK] Seq=50034 Ack=8560 Win=17 Len=0 TSval=1715174061 TSecr=1969265606"
"192","59.743663","100.86.121.59","172.66.164.67","TLSv1.2","342","Application Data"
"193","59.754896","172.66.164.67","100.86.121.59","TCP","66","443  >  53996 [ACK] Seq=50034 Ack=8836 Win=17 Len=0 TSval=1715178177 TSecr=1969269760"
"194","59.982756","172.66.164.67","100.86.121.59","TLSv1.2","224","Application Data"
"195","59.982759","172.66.164.67","100.86.121.59","TCP","1514","443  >  53996 [ACK] Seq=50192 Ack=8836 Win=17 Len=1448 TSval=1715178404 TSecr=1969269760 [TCP PDU reassembled in 209]"
"196","59.982903","100.86.121.59","172.66.164.67","TCP","66","53996  >  443 [ACK] Seq=8836 Ack=51640 Win=2023 Len=0 TSval=1969269999 TSecr=1715178404"
"197","59.983262","172.66.164.67","100.86.121.59","TCP","1514","443  >  53996 [ACK] Seq=51640 Ack=8836 Win=17 Len=1448 TSval=1715178404 TSecr=1969269760 [TCP PDU reassembled in 209]"
"198","59.983265","172.66.164.67","100.86.121.59","TCP","1514","443  >  53996 [ACK] Seq=53088 Ack=8836 Win=17 Len=1448 TSval=1715178404 TSecr=1969269760 [TCP PDU reassembled in 209]"
"199","59.983334","100.86.121.59","172.66.164.67","TCP","66","53996  >  443 [ACK] Seq=8836 Ack=54536 Win=2003 Len=0 TSval=1969270000 TSecr=1715178404"
"200","59.983406","100.86.121.59","172.66.164.67","TCP","66","[TCP Window Update] 53996  >  443 [ACK] Seq=8836 Ack=54536 Win=2048 Len=0 TSval=1969270000 TSecr=1715178404"
"201","59.984382","172.66.164.67","100.86.121.59","TCP","1514","443  >  53996 [ACK] Seq=54536 Ack=8836 Win=17 Len=1448 TSval=1715178404 TSecr=1969269760 [TCP PDU reassembled in 209]"
"202","59.984385","172.66.164.67","100.86.121.59","TCP","1514","443  >  53996 [ACK] Seq=55984 Ack=8836 Win=17 Len=1448 TSval=1715178404 TSecr=1969269760 [TCP PDU reassembled in 209]"
"203","59.984387","172.66.164.67","100.86.121.59","TCP","1514","443  >  53996 [ACK] Seq=57432 Ack=8836 Win=17 Len=1448 TSval=1715178404 TSecr=1969269760 [TCP PDU reassembled in 209]"
"204","59.984389","172.66.164.67","100.86.121.59","TCP","1514","443  >  53996 [ACK] Seq=58880 Ack=8836 Win=17 Len=1448 TSval=1715178404 TSecr=1969269760 [TCP PDU reassembled in 209]"
"205","59.984391","172.66.164.67","100.86.121.59","TCP","1514","443  >  53996 [PSH, ACK] Seq=60328 Ack=8836 Win=17 Len=1448 TSval=1715178404 TSecr=1969269760 [TCP PDU reassembled in 209]"
"206","59.984394","172.66.164.67","100.86.121.59","TCP","1514","443  >  53996 [ACK] Seq=61776 Ack=8836 Win=17 Len=1448 TSval=1715178405 TSecr=1969269760 [TCP PDU reassembled in 209]"
"207","59.984396","172.66.164.67","100.86.121.59","TCP","1514","443  >  53996 [ACK] Seq=63224 Ack=8836 Win=17 Len=1448 TSval=1715178405 TSecr=1969269760 [TCP PDU reassembled in 209]"
"208","59.984398","172.66.164.67","100.86.121.59","TCP","1514","443  >  53996 [ACK] Seq=64672 Ack=8836 Win=17 Len=1448 TSval=1715178405 TSecr=1969269760 [TCP PDU reassembled in 209]"
"209","59.984400","172.66.164.67","100.86.121.59","TLSv1.2","544","Application Data"
"210","59.984494","100.86.121.59","172.66.164.67","TCP","66","53996  >  443 [ACK] Seq=8836 Ack=66598 Win=1860 Len=0 TSval=1969270001 TSecr=1715178405"
"211","59.985175","100.86.121.59","172.66.164.67","TCP","66","[TCP Window Update] 53996  >  443 [ACK] Seq=8836 Ack=66598 Win=2048 Len=0 TSval=1969270002 TSecr=1715178405"
"212","59.985753","172.66.164.67","100.86.121.59","TCP","1514","443  >  53996 [ACK] Seq=66598 Ack=8836 Win=17 Len=1448 TSval=1715178405 TSecr=1969269760 [TCP PDU reassembled in 216]"
"213","59.985755","172.66.164.67","100.86.121.59","TCP","1514","443  >  53996 [ACK] Seq=68046 Ack=8836 Win=17 Len=1448 TSval=1715178405 TSecr=1969269760 [TCP PDU reassembled in 216]"
"214","59.985757","172.66.164.67","100.86.121.59","TCP","1514","443  >  53996 [ACK] Seq=69494 Ack=8836 Win=17 Len=1448 TSval=1715178405 TSecr=1969269760 [TCP PDU reassembled in 216]"
"215","59.985760","172.66.164.67","100.86.121.59","TCP","1514","443  >  53996 [ACK] Seq=70942 Ack=8836 Win=17 Len=1448 TSval=1715178405 TSecr=1969269760 [TCP PDU reassembled in 216]"
"216","59.985762","172.66.164.67","100.86.121.59","TLSv1.2","1005","Application Data"
"217","59.985764","172.66.164.67","100.86.121.59","TLSv1.2","97","Application Data"
"218","59.985858","100.86.121.59","172.66.164.67","TCP","66","53996  >  443 [ACK] Seq=8836 Ack=73360 Win=1943 Len=0 TSval=1969270002 TSecr=1715178406"
"219","59.986025","100.86.121.59","172.66.164.67","TCP","66","[TCP Window Update] 53996  >  443 [ACK] Seq=8836 Ack=73360 Win=2048 Len=0 TSval=1969270003 TSecr=1715178406"
"220","60.066537","100.86.121.59","172.66.164.67","TLSv1.2","467","Application Data"
"221","60.087041","172.66.164.67","100.86.121.59","TCP","66","443  >  53996 [ACK] Seq=73360 Ack=9237 Win=17 Len=0 TSval=1715178498 TSecr=1969270083"
"222","60.101624","172.66.164.67","100.86.121.59","TLSv1.2","128","Application Data"
"223","60.101712","100.86.121.59","172.66.164.67","TCP","66","53996  >  443 [ACK] Seq=9237 Ack=73422 Win=2048 Len=0 TSval=1969270118 TSecr=1715178523"
"224","60.101835","100.86.121.59","172.66.164.67","TCP","1454","53996  >  443 [ACK] Seq=9237 Ack=73422 Win=2048 Len=1388 TSval=1969270118 TSecr=1715178523 [TCP PDU reassembled in 225]"
"225","60.101841","100.86.121.59","172.66.164.67","TLSv1.2","133","Application Data"
"226","60.101989","172.66.164.67","100.86.121.59","TLSv1.2","108","Application Data"
"227","60.101990","172.66.164.67","100.86.121.59","TLSv1.2","97","Application Data"
"228","60.102039","100.86.121.59","172.66.164.67","TCP","66","53996  >  443 [ACK] Seq=10692 Ack=73495 Win=2047 Len=0 TSval=1969270119 TSecr=1715178523"
"229","60.102872","100.86.121.59","172.66.164.67","TLSv1.2","198","Application Data"
"230","60.103528","100.86.121.59","172.66.164.67","TLSv1.2","280","Application Data"
"231","60.104168","100.86.121.59","172.66.164.67","TLSv1.2","198","Application Data"
"232","60.104396","100.86.121.59","172.66.164.67","TLSv1.2","196","Application Data"
"233","60.112277","172.66.164.67","100.86.121.59","TCP","66","443  >  53996 [ACK] Seq=73495 Ack=10692 Win=17 Len=0 TSval=1715178534 TSecr=1969270118"
"234","60.113303","172.66.164.67","100.86.121.59","TCP","66","443  >  53996 [ACK] Seq=73495 Ack=11038 Win=17 Len=0 TSval=1715178535 TSecr=1969270119"
"235","60.114485","172.66.164.67","100.86.121.59","TCP","66","443  >  53996 [ACK] Seq=73495 Ack=11300 Win=17 Len=0 TSval=1715178536 TSecr=1969270121"
"236","60.134199","172.66.164.67","100.86.121.59","TLSv1.2","127","Application Data"
"237","60.134200","172.66.164.67","100.86.121.59","TLSv1.2","290","Application Data"
"238","60.134270","100.86.121.59","172.66.164.67","TCP","66","53996  >  443 [ACK] Seq=11300 Ack=73780 Win=2044 Len=0 TSval=1969270151 TSecr=1715178556"
"239","60.134442","172.66.164.67","100.86.121.59","TLSv1.2","97","Application Data"
"240","60.134443","172.66.164.67","100.86.121.59","TLSv1.2","127","Application Data"
"241","60.134443","172.66.164.67","100.86.121.59","TLSv1.2","290","Application Data"
"242","60.134482","100.86.121.59","172.66.164.67","TCP","66","53996  >  443 [ACK] Seq=11300 Ack=74096 Win=2044 Len=0 TSval=1969270151 TSecr=1715178556"
"243","60.135222","172.66.164.67","100.86.121.59","TLSv1.2","97","Application Data"
"244","60.135254","100.86.121.59","172.66.164.67","TCP","66","53996  >  443 [ACK] Seq=11300 Ack=74127 Win=2048 Len=0 TSval=1969270152 TSecr=1715178556"
"245","60.135780","172.66.164.67","100.86.121.59","TLSv1.2","208","Application Data"
"246","60.135782","172.66.164.67","100.86.121.59","TLSv1.2","290","Application Data"
"247","60.135782","172.66.164.67","100.86.121.59","TLSv1.2","97","Application Data"
"248","60.135804","100.86.121.59","172.66.164.67","TCP","66","53996  >  443 [ACK] Seq=11300 Ack=74524 Win=2042 Len=0 TSval=1969270152 TSecr=1715178557"
"249","60.138488","172.66.164.67","100.86.121.59","TLSv1.2","127","Application Data"
"250","60.138489","172.66.164.67","100.86.121.59","TLSv1.2","290","Application Data"
"251","60.138490","172.66.164.67","100.86.121.59","TLSv1.2","97","Application Data"
"252","60.138492","172.66.164.67","100.86.121.59","TLSv1.2","127","Application Data"
"253","60.138494","172.66.164.67","100.86.121.59","TLSv1.2","290","Application Data"
"254","60.138495","172.66.164.67","100.86.121.59","TLSv1.2","97","Application Data"
"255","60.138541","100.86.121.59","172.66.164.67","TCP","66","53996  >  443 [ACK] Seq=11300 Ack=75156 Win=2039 Len=0 TSval=1969270155 TSecr=1715178559"
"256","65.245610","100.86.121.59","172.66.164.67","TLSv1.2","197","Application Data"
"257","65.245771","100.86.121.59","172.66.164.67","TLSv1.2","200","Application Data"
"258","65.336363","172.66.164.67","100.86.121.59","TCP","66","443  >  53996 [ACK] Seq=75156 Ack=11565 Win=17 Len=0 TSval=1715183718 TSecr=1969275262"
"259","65.362073","172.66.164.67","100.86.121.59","TLSv1.2","231","Application Data"
"260","65.362075","172.66.164.67","100.86.121.59","TLSv1.2","290","Application Data"
"261","65.362076","172.66.164.67","100.86.121.59","TLSv1.2","97","Application Data"
"262","65.362077","172.66.164.67","100.86.121.59","TLSv1.2","127","Application Data"
"263","65.362078","172.66.164.67","100.86.121.59","TLSv1.2","290","Application Data"
"264","65.362079","172.66.164.67","100.86.121.59","TLSv1.2","97","Application Data"
"265","65.362226","100.86.121.59","172.66.164.67","TCP","66","53996  >  443 [ACK] Seq=11565 Ack=75892 Win=2037 Len=0 TSval=1969275379 TSecr=1715183747"
"266","65.362963","100.86.121.59","172.66.164.67","TLSv1.2","101","Application Data"
"267","65.392872","172.66.164.67","100.86.121.59","TCP","97","[TCP Spurious Retransmission] 443  >  53996 [PSH, ACK] Seq=75861 Ack=11565 Win=17 Len=31 TSval=1715183778 TSecr=1969275262"
"268","65.392971","100.86.121.59","172.66.164.67","TCP","78","[TCP Dup ACK 265#1] 53996  >  443 [ACK] Seq=11600 Ack=75892 Win=2048 Len=0 TSval=1969275409 TSecr=1715183778 SLE=75861 SRE=75892"
"269","65.483172","172.66.164.67","100.86.121.59","TCP","66","443  >  53996 [ACK] Seq=75892 Ack=11600 Win=17 Len=0 TSval=1715183878 TSecr=1969275380"
"270","70.144761","100.86.121.59","172.66.164.67","TLSv1.2","512","Application Data"
"271","70.145316","100.86.121.59","172.66.164.67","TCP","1454","53996  >  443 [ACK] Seq=12046 Ack=75892 Win=2048 Len=1388 TSval=1969280162 TSecr=1715183878 [TCP PDU reassembled in 272]"
"272","70.145341","100.86.121.59","172.66.164.67","TLSv1.2","160","Application Data"
"273","70.146245","100.86.121.59","172.66.164.67","TLSv1.2","196","Application Data"
"274","70.158632","172.66.164.67","100.86.121.59","TCP","66","443  >  53996 [ACK] Seq=75892 Ack=12046 Win=17 Len=0 TSval=1715188580 TSecr=1969280161"
"275","70.158635","172.66.164.67","100.86.121.59","TCP","66","443  >  53996 [ACK] Seq=75892 Ack=13528 Win=17 Len=0 TSval=1715188580 TSecr=1969280162"
"276","70.158638","172.66.164.67","100.86.121.59","TCP","66","443  >  53996 [ACK] Seq=75892 Ack=13658 Win=17 Len=0 TSval=1715188580 TSecr=1969280163"
"277","70.181892","172.66.164.67","100.86.121.59","TLSv1.2","149","Application Data"
"278","70.181897","172.66.164.67","100.86.121.59","TLSv1.2","290","Application Data"
"279","70.182033","172.66.164.67","100.86.121.59","TLSv1.2","97","Application Data"
"280","70.182094","100.86.121.59","172.66.164.67","TCP","66","53996  >  443 [ACK] Seq=13658 Ack=76199 Win=2044 Len=0 TSval=1969280198 TSecr=1715188603"
"281","70.182174","100.86.121.59","172.66.164.67","TCP","66","53996  >  443 [ACK] Seq=13658 Ack=76230 Win=2044 Len=0 TSval=1969280199 TSecr=1715188604"
"282","70.186177","172.66.164.67","100.86.121.59","TLSv1.2","126","Application Data"
"283","70.186182","172.66.164.67","100.86.121.59","TLSv1.2","290","Application Data"
"284","70.186184","172.66.164.67","100.86.121.59","TLSv1.2","97","Application Data"
"285","70.186356","100.86.121.59","172.66.164.67","TCP","66","53996  >  443 [ACK] Seq=13658 Ack=76545 Win=2044 Len=0 TSval=1969280203 TSecr=1715188608"
"286","70.187583","172.66.164.67","100.86.121.59","TLSv1.2","126","Application Data"
"287","70.187586","172.66.164.67","100.86.121.59","TLSv1.2","290","Application Data"
"288","70.187672","172.66.164.67","100.86.121.59","TLSv1.2","97","Application Data"
"289","70.187748","100.86.121.59","172.66.164.67","TCP","66","53996  >  443 [ACK] Seq=13658 Ack=76829 Win=2044 Len=0 TSval=1969280204 TSecr=1715188609"
"290","70.187815","100.86.121.59","172.66.164.67","TCP","66","53996  >  443 [ACK] Seq=13658 Ack=76860 Win=2044 Len=0 TSval=1969280204 TSecr=1715188609"
"291","75.068928","100.86.121.59","172.66.164.67","TLSv1.2","272","Application Data"
"292","75.104810","172.66.164.67","100.86.121.59","TLSv1.2","151","Application Data"
"293","75.104834","172.66.164.67","100.86.121.59","TLSv1.2","108","Application Data"
"294","75.104931","100.86.121.59","172.66.164.67","TCP","66","53996  >  443 [ACK] Seq=13864 Ack=76945 Win=2047 Len=0 TSval=1969285121 TSecr=1715193526"
"295","75.104939","172.66.164.67","100.86.121.59","TLSv1.2","97","Application Data"
"296","75.105007","100.86.121.59","172.66.164.67","TCP","66","53996  >  443 [ACK] Seq=13864 Ack=76987 Win=2047 Len=0 TSval=1969285121 TSecr=1715193526"
"297","75.105027","100.86.121.59","172.66.164.67","TCP","66","53996  >  443 [ACK] Seq=13864 Ack=77018 Win=2047 Len=0 TSval=1969285122 TSecr=1715193526"
"298","75.106444","100.86.121.59","172.66.164.67","TLSv1.2","101","Application Data"
"299","75.151195","100.86.121.59","172.66.164.67","TLSv1.2","309","Application Data"
"300","75.158633","172.66.164.67","100.86.121.59","TCP","66","443  >  53996 [ACK] Seq=77018 Ack=13899 Win=17 Len=0 TSval=1715193580 TSecr=1969285123"
"301","75.160715","172.66.164.67","100.86.121.59","TCP","66","443  >  53996 [ACK] Seq=77018 Ack=14142 Win=17 Len=0 TSval=1715193582 TSecr=1969285168"
"302","75.369148","100.86.121.59","172.66.164.67","TLSv1.2","514","Application Data"
"303","75.379668","172.66.164.67","100.86.121.59","TCP","66","443  >  53996 [ACK] Seq=77018 Ack=14590 Win=17 Len=0 TSval=1715193801 TSecr=1969285386"
"304","75.405119","172.66.164.67","100.86.121.59","TLSv1.2","168","Application Data"
"305","75.405286","100.86.121.59","172.66.164.67","TCP","66","53996  >  443 [ACK] Seq=14590 Ack=77120 Win=2047 Len=0 TSval=1969285422 TSecr=1715193826"
"306","75.405481","172.66.164.67","100.86.121.59","TLSv1.2","290","Application Data"
"307","75.405484","172.66.164.67","100.86.121.59","TLSv1.2","97","Application Data"
"308","75.405573","100.86.121.59","172.66.164.67","TCP","66","53996  >  443 [ACK] Seq=14590 Ack=77375 Win=2045 Len=0 TSval=1969285422 TSecr=1715193827"
"309","75.419402","172.66.164.67","100.86.121.59","TLSv1.2","151","Application Data"
"310","75.419565","100.86.121.59","172.66.164.67","TCP","66","53996  >  443 [ACK] Seq=14590 Ack=77460 Win=2047 Len=0 TSval=1969285436 TSecr=1715193841"
"311","75.420673","172.66.164.67","100.86.121.59","TCP","1514","443  >  53996 [ACK] Seq=77460 Ack=14590 Win=17 Len=1448 TSval=1715193841 TSecr=1969285422 [TCP PDU reassembled in 326]"
"312","75.420705","172.66.164.67","100.86.121.59","TCP","1514","443  >  53996 [ACK] Seq=78908 Ack=14590 Win=17 Len=1448 TSval=1715193841 TSecr=1969285422 [TCP PDU reassembled in 326]"
"313","75.420708","172.66.164.67","100.86.121.59","TCP","1514","443  >  53996 [ACK] Seq=80356 Ack=14590 Win=17 Len=1448 TSval=1715193841 TSecr=1969285422 [TCP PDU reassembled in 326]"
"314","75.420710","172.66.164.67","100.86.121.59","TCP","1514","443  >  53996 [ACK] Seq=81804 Ack=14590 Win=17 Len=1448 TSval=1715193841 TSecr=1969285422 [TCP PDU reassembled in 326]"
"315","75.420712","172.66.164.67","100.86.121.59","TCP","1514","443  >  53996 [ACK] Seq=83252 Ack=14590 Win=17 Len=1448 TSval=1715193841 TSecr=1969285422 [TCP PDU reassembled in 326]"
"316","75.420809","100.86.121.59","172.66.164.67","TCP","66","53996  >  443 [ACK] Seq=14590 Ack=78908 Win=2026 Len=0 TSval=1969285437 TSecr=1715193841"
"317","75.420851","100.86.121.59","172.66.164.67","TCP","66","53996  >  443 [ACK] Seq=14590 Ack=84700 Win=1936 Len=0 TSval=1969285437 TSecr=1715193841"
"318","75.420943","172.66.164.67","100.86.121.59","TCP","1514","443  >  53996 [ACK] Seq=84700 Ack=14590 Win=17 Len=1448 TSval=1715193841 TSecr=1969285422 [TCP PDU reassembled in 326]"
"319","75.420946","172.66.164.67","100.86.121.59","TCP","1514","443  >  53996 [ACK] Seq=86148 Ack=14590 Win=17 Len=1448 TSval=1715193841 TSecr=1969285422 [TCP PDU reassembled in 326]"
"320","75.420949","172.66.164.67","100.86.121.59","TCP","1514","443  >  53996 [PSH, ACK] Seq=87596 Ack=14590 Win=17 Len=1448 TSval=1715193841 TSecr=1969285422 [TCP PDU reassembled in 326]"
"321","75.421008","100.86.121.59","172.66.164.67","TCP","66","53996  >  443 [ACK] Seq=14590 Ack=89044 Win=1869 Len=0 TSval=1969285437 TSecr=1715193841"
"322","75.421054","100.86.121.59","172.66.164.67","TCP","66","[TCP Window Update] 53996  >  443 [ACK] Seq=14590 Ack=89044 Win=2048 Len=0 TSval=1969285438 TSecr=1715193841"
"323","75.421503","172.66.164.67","100.86.121.59","TCP","1514","443  >  53996 [ACK] Seq=89044 Ack=14590 Win=17 Len=1448 TSval=1715193842 TSecr=1969285422 [TCP PDU reassembled in 326]"
"324","75.421505","172.66.164.67","100.86.121.59","TCP","1514","443  >  53996 [ACK] Seq=90492 Ack=14590 Win=17 Len=1448 TSval=1715193842 TSecr=1969285422 [TCP PDU reassembled in 326]"
"325","75.421508","172.66.164.67","100.86.121.59","TCP","1514","443  >  53996 [ACK] Seq=91940 Ack=14590 Win=17 Len=1448 TSval=1715193842 TSecr=1969285422 [TCP PDU reassembled in 326]"
"326","75.421510","172.66.164.67","100.86.121.59","TLSv1.2","1514","Application Data"
"327","75.421573","172.66.164.67","100.86.121.59","TCP","1514","443  >  53996 [ACK] Seq=94836 Ack=14590 Win=17 Len=1448 TSval=1715193842 TSecr=1969285422 [TCP PDU reassembled in 335]"
"328","75.421575","100.86.121.59","172.66.164.67","TCP","66","53996  >  443 [ACK] Seq=14590 Ack=94836 Win=1958 Len=0 TSval=1969285438 TSecr=1715193842"
"329","75.421576","172.66.164.67","100.86.121.59","TCP","1514","443  >  53996 [ACK] Seq=96284 Ack=14590 Win=17 Len=1448 TSval=1715193842 TSecr=1969285422 [TCP PDU reassembled in 335]"
"330","75.421632","100.86.121.59","172.66.164.67","TCP","66","53996  >  443 [ACK] Seq=14590 Ack=97732 Win=1913 Len=0 TSval=1969285438 TSecr=1715193842"
"331","75.421645","100.86.121.59","172.66.164.67","TCP","66","[TCP Window Update] 53996  >  443 [ACK] Seq=14590 Ack=97732 Win=2048 Len=0 TSval=1969285438 TSecr=1715193842"
"332","75.423284","172.66.164.67","100.86.121.59","TCP","1514","443  >  53996 [ACK] Seq=97732 Ack=14590 Win=17 Len=1448 TSval=1715193842 TSecr=1969285422 [TCP PDU reassembled in 335]"
"333","75.423288","172.66.164.67","100.86.121.59","TCP","1514","443  >  53996 [PSH, ACK] Seq=99180 Ack=14590 Win=17 Len=1448 TSval=1715193842 TSecr=1969285422 [TCP PDU reassembled in 335]"
"334","75.423291","172.66.164.67","100.86.121.59","TCP","1514","443  >  53996 [ACK] Seq=100628 Ack=14590 Win=17 Len=1448 TSval=1715193843 TSecr=1969285422 [TCP PDU reassembled in 335]"
"335","75.423294","172.66.164.67","100.86.121.59","TLSv1.2","1230","Application Data, Application Data"
"336","75.423420","100.86.121.59","172.66.164.67","TCP","66","53996  >  443 [ACK] Seq=14590 Ack=103240 Win=1962 Len=0 TSval=1969285440 TSecr=1715193843"
"337","75.424689","100.86.121.59","172.66.164.67","TCP","66","[TCP Window Update] 53996  >  443 [ACK] Seq=14590 Ack=103240 Win=2048 Len=0 TSval=1969285441 TSecr=1715193843"
"338","75.482376","100.86.121.59","172.66.164.67","TLSv1.2","232","Application Data"
"339","75.494634","100.86.121.59","172.66.164.67","TCP","1454","53996  >  443 [ACK] Seq=14756 Ack=103240 Win=2048 Len=1388 TSval=1969285511 TSecr=1715193843 [TCP PDU reassembled in 340]"
"340","75.494646","100.86.121.59","172.66.164.67","TLSv1.2","90","Application Data"
"341","75.494826","100.86.121.59","172.66.164.67","TLSv1.2","278","Application Data"
"342","75.494936","100.86.121.59","172.66.164.67","TLSv1.2","200","Application Data"
"343","75.496162","100.86.121.59","172.66.164.67","TLSv1.2","199","Application Data"
"344","75.496722","100.86.121.59","172.66.164.67","TLSv1.2","197","Application Data"
"345","75.504656","172.66.164.67","100.86.121.59","TCP","66","443  >  53996 [ACK] Seq=103240 Ack=16168 Win=17 Len=0 TSval=1715193926 TSecr=1969285499"
"346","75.505835","172.66.164.67","100.86.121.59","TCP","66","443  >  53996 [ACK] Seq=103240 Ack=16514 Win=17 Len=0 TSval=1715193927 TSecr=1969285511"
"347","75.507231","172.66.164.67","100.86.121.59","TCP","66","443  >  53996 [ACK] Seq=103240 Ack=16778 Win=17 Len=0 TSval=1715193929 TSecr=1969285513"
"348","75.516147","172.66.164.67","100.86.121.59","TLSv1.2","128","Application Data"
"349","75.516148","172.66.164.67","100.86.121.59","TLSv1.2","108","Application Data"
"350","75.516212","172.66.164.67","100.86.121.59","TLSv1.2","97","Application Data"
"351","75.516237","100.86.121.59","172.66.164.67","TCP","66","53996  >  443 [ACK] Seq=16778 Ack=103344 Win=2047 Len=0 TSval=1969285533 TSecr=1715193938"
"352","75.516282","100.86.121.59","172.66.164.67","TCP","66","53996  >  443 [ACK] Seq=16778 Ack=103375 Win=2047 Len=0 TSval=1969285533 TSecr=1715193938"
"353","75.527736","172.66.164.67","100.86.121.59","TLSv1.2","163","Application Data"
"354","75.527739","172.66.164.67","100.86.121.59","TLSv1.2","290","Application Data"
"355","75.527740","172.66.164.67","100.86.121.59","TLSv1.2","97","Application Data"
"356","75.527824","100.86.121.59","172.66.164.67","TCP","66","53996  >  443 [ACK] Seq=16778 Ack=103727 Win=2043 Len=0 TSval=1969285544 TSecr=1715193949"
"357","75.529783","172.66.164.67","100.86.121.59","TLSv1.2","208","Application Data"
"358","75.529785","172.66.164.67","100.86.121.59","TLSv1.2","290","Application Data"
"359","75.529848","100.86.121.59","172.66.164.67","TCP","66","53996  >  443 [ACK] Seq=16778 Ack=104093 Win=2043 Len=0 TSval=1969285546 TSecr=1715193951"
"360","75.529887","172.66.164.67","100.86.121.59","TLSv1.2","97","Application Data"
"361","75.529920","100.86.121.59","172.66.164.67","TCP","66","53996  >  443 [ACK] Seq=16778 Ack=104124 Win=2048 Len=0 TSval=1969285546 TSecr=1715193951"
"362","75.530344","172.66.164.67","100.86.121.59","TLSv1.2","127","Application Data"
"363","75.530345","172.66.164.67","100.86.121.59","TLSv1.2","290","Application Data"
"364","75.530346","172.66.164.67","100.86.121.59","TLSv1.2","97","Application Data"
"365","75.530388","100.86.121.59","172.66.164.67","TCP","66","53996  >  443 [ACK] Seq=16778 Ack=104440 Win=2048 Len=0 TSval=1969285547 TSecr=1715193952"
"366","75.530680","172.66.164.67","100.86.121.59","TLSv1.2","127","Application Data"
"367","75.530681","172.66.164.67","100.86.121.59","TLSv1.2","290","Application Data"
"368","75.530681","172.66.164.67","100.86.121.59","TLSv1.2","97","Application Data"
"369","75.530771","100.86.121.59","172.66.164.67","TCP","66","53996  >  443 [ACK] Seq=16778 Ack=104756 Win=2048 Len=0 TSval=1969285547 TSecr=1715193952"
"370","75.530984","172.66.164.67","100.86.121.59","TLSv1.2","208","Application Data"
"371","75.530985","172.66.164.67","100.86.121.59","TLSv1.2","290","Application Data"
"372","75.530986","172.66.164.67","100.86.121.59","TLSv1.2","97","Application Data"
"373","75.531157","100.86.121.59","172.66.164.67","TCP","66","53996  >  443 [ACK] Seq=16778 Ack=105153 Win=2048 Len=0 TSval=1969285548 TSecr=1715193952"
"374","80.721264","100.86.121.59","172.66.164.67","TLSv1.2","369","Application Data"
"375","80.771829","172.66.164.67","100.86.121.59","TCP","66","443  >  53996 [ACK] Seq=105153 Ack=17081 Win=17 Len=0 TSval=1715199194 TSecr=1969290738"
"376","80.802889","172.66.164.67","100.86.121.59","TLSv1.2","400","Application Data"
"377","80.802991","100.86.121.59","172.66.164.67","TCP","66","53996  >  443 [ACK] Seq=17081 Ack=105487 Win=2043 Len=0 TSval=1969290819 TSecr=1715199224"
