"No.","Time","Source","Destination","Protocol","Length","Info"
"1","0.000000","100.86.121.59","172.66.164.67","TLSv1.2","184","Application Data"
"2","0.011841","172.66.164.67","100.86.121.59","TCP","66","443  >  54412 [ACK] Seq=1 Ack=119 Win=15 Len=0 TSval=1127883493 TSecr=1457686830"
"3","0.031881","172.66.164.67","100.86.121.59","TLSv1.2","151","Application Data"
"4","0.031883","172.66.164.67","100.86.121.59","TLSv1.2","108","Application Data"
"5","0.031885","172.66.164.67","100.86.121.59","TLSv1.2","97","Application Data"
"6","0.032100","100.86.121.59","172.66.164.67","TCP","66","54412  >  443 [ACK] Seq=119 Ack=159 Win=2046 Len=0 TSval=1457686862 TSecr=1127883513"
"7","2.756780","100.86.121.59","172.66.164.67","TLSv1.2","321","Application Data"
"8","2.807908","172.66.164.67","100.86.121.59","TCP","66","443  >  54412 [ACK] Seq=159 Ack=374 Win=15 Len=0 TSval=1127886290 TSecr=1457689587"
"9","3.829589","172.66.164.67","100.86.121.59","TLSv1.2","175","Application Data"
"10","3.829593","172.66.164.67","100.86.121.59","TCP","1514","443  >  54412 [ACK] Seq=268 Ack=374 Win=15 Len=1448 TSval=1127887264 TSecr=1457689587 [TCP PDU reassembled in 25]"
"11","3.829596","172.66.164.67","100.86.121.59","TCP","1514","443  >  54412 [ACK] Seq=1716 Ack=374 Win=15 Len=1448 TSval=1127887264 TSecr=1457689587 [TCP PDU reassembled in 25]"
"12","3.829598","172.66.164.67","100.86.121.59","TCP","1514","443  >  54412 [PSH, ACK] Seq=3164 Ack=374 Win=15 Len=1448 TSval=1127887264 TSecr=1457689587 [TCP PDU reassembled in 25]"
"13","3.829821","100.86.121.59","172.66.164.67","TCP","66","54412  >  443 [ACK] Seq=374 Ack=4612 Win=1979 Len=0 TSval=1457690659 TSecr=1127887264"
"14","3.829905","172.66.164.67","100.86.121.59","TCP","1514","443  >  54412 [ACK] Seq=4612 Ack=374 Win=15 Len=1448 TSval=1127887264 TSecr=1457689587 [TCP PDU reassembled in 25]"
"15","3.829909","172.66.164.67","100.86.121.59","TCP","1514","443  >  54412 [ACK] Seq=6060 Ack=374 Win=15 Len=1448 TSval=1127887264 TSecr=1457689587 [TCP PDU reassembled in 25]"
"16","3.829912","172.66.164.67","100.86.121.59","TCP","1514","443  >  54412 [PSH, ACK] Seq=7508 Ack=374 Win=15 Len=1448 TSval=1127887264 TSecr=1457689587 [TCP PDU reassembled in 25]"
"17","3.829914","172.66.164.67","100.86.121.59","TCP","1514","443  >  54412 [ACK] Seq=8956 Ack=374 Win=15 Len=1448 TSval=1127887265 TSecr=1457689587 [TCP PDU reassembled in 25]"
"18","3.829917","172.66.164.67","100.86.121.59","TCP","1514","443  >  54412 [ACK] Seq=10404 Ack=374 Win=15 Len=1448 TSval=1127887265 TSecr=1457689587 [TCP PDU reassembled in 25]"
"19","3.829919","172.66.164.67","100.86.121.59","TCP","1514","443  >  54412 [PSH, ACK] Seq=11852 Ack=374 Win=15 Len=1448 TSval=1127887265 TSecr=1457689587 [TCP PDU reassembled in 25]"
"20","3.829922","172.66.164.67","100.86.121.59","TCP","1514","443  >  54412 [ACK] Seq=13300 Ack=374 Win=15 Len=1448 TSval=1127887266 TSecr=1457689587 [TCP PDU reassembled in 25]"
"21","3.829925","172.66.164.67","100.86.121.59","TCP","1514","443  >  54412 [ACK] Seq=14748 Ack=374 Win=15 Len=1448 TSval=1127887266 TSecr=1457689587 [TCP PDU reassembled in 25]"
"22","3.829974","100.86.121.59","172.66.164.67","TCP","66","[TCP Window Update] 54412  >  443 [ACK] Seq=374 Ack=4612 Win=2048 Len=0 TSval=1457690660 TSecr=1127887264"
"23","3.830029","100.86.121.59","172.66.164.67","TCP","66","54412  >  443 [ACK] Seq=374 Ack=16196 Win=1867 Len=0 TSval=1457690660 TSecr=1127887266"
"24","3.830043","100.86.121.59","172.66.164.67","TCP","66","[TCP Window Update] 54412  >  443 [ACK] Seq=374 Ack=16196 Win=2048 Len=0 TSval=1457690660 TSecr=1127887266"
"25","3.830102","172.66.164.67","100.86.121.59","TLSv1.2","1514","Application Data"
"26","3.830104","172.66.164.67","100.86.121.59","TCP","1514","443  >  54412 [ACK] Seq=17644 Ack=374 Win=15 Len=1448 TSval=1127887267 TSecr=1457689587 [TCP PDU reassembled in 41]"
"27","3.830159","100.86.121.59","172.66.164.67","TCP","66","54412  >  443 [ACK] Seq=374 Ack=19092 Win=2003 Len=0 TSval=1457690660 TSecr=1127887267"
"28","3.830205","172.66.164.67","100.86.121.59","TCP","1514","443  >  54412 [ACK] Seq=19092 Ack=374 Win=15 Len=1448 TSval=1127887267 TSecr=1457689587 [TCP PDU reassembled in 41]"
"29","3.830207","172.66.164.67","100.86.121.59","TCP","1514","443  >  54412 [PSH, ACK] Seq=20540 Ack=374 Win=15 Len=1448 TSval=1127887267 TSecr=1457689587 [TCP PDU reassembled in 41]"
"30","3.830209","172.66.164.67","100.86.121.59","TCP","1514","443  >  54412 [ACK] Seq=21988 Ack=374 Win=15 Len=1448 TSval=1127887268 TSecr=1457689587 [TCP PDU reassembled in 41]"
"31","3.830210","172.66.164.67","100.86.121.59","TCP","1514","443  >  54412 [ACK] Seq=23436 Ack=374 Win=15 Len=1448 TSval=1127887268 TSecr=1457689587 [TCP PDU reassembled in 41]"
"32","3.830254","100.86.121.59","172.66.164.67","TCP","66","54412  >  443 [ACK] Seq=374 Ack=24884 Win=1913 Len=0 TSval=1457690660 TSecr=1127887268"
"33","3.830521","100.86.121.59","172.66.164.67","TCP","66","[TCP Window Update] 54412  >  443 [ACK] Seq=374 Ack=24884 Win=2048 Len=0 TSval=1457690660 TSecr=1127887268"
"34","3.830554","172.66.164.67","100.86.121.59","TCP","1514","443  >  54412 [PSH, ACK] Seq=24884 Ack=374 Win=15 Len=1448 TSval=1127887268 TSecr=1457689587 [TCP PDU reassembled in 41]"
"35","3.830557","172.66.164.67","100.86.121.59","TCP","1514","443  >  54412 [ACK] Seq=26332 Ack=374 Win=15 Len=1448 TSval=1127887269 TSecr=1457689587 [TCP PDU reassembled in 41]"
"36","3.830619","100.86.121.59","172.66.164.67","TCP","66","54412  >  443 [ACK] Seq=374 Ack=27780 Win=2003 Len=0 TSval=1457690660 TSecr=1127887269"
"37","3.830633","100.86.121.59","172.66.164.67","TCP","66","[TCP Window Update] 54412  >  443 [ACK] Seq=374 Ack=27780 Win=2048 Len=0 TSval=1457690660 TSecr=1127887269"
"38","3.831832","172.66.164.67","100.86.121.59","TCP","1514","443  >  54412 [ACK] Seq=27780 Ack=374 Win=15 Len=1448 TSval=1127887269 TSecr=1457689587 [TCP PDU reassembled in 41]"
"39","3.831835","172.66.164.67","100.86.121.59","TCP","1514","443  >  54412 [PSH, ACK] Seq=29228 Ack=374 Win=15 Len=1448 TSval=1127887269 TSecr=1457689587 [TCP PDU reassembled in 41]"
"40","3.831837","172.66.164.67","100.86.121.59","TCP","1514","443  >  54412 [ACK] Seq=30676 Ack=374 Win=15 Len=1448 TSval=1127887270 TSecr=1457689587 [TCP PDU reassembled in 41]"
"41","3.831840","172.66.164.67","100.86.121.59","TLSv1.2","518","Application Data, Application Data"
"42","3.831843","172.66.164.67","100.86.121.59","TCP","518","[TCP Retransmission] 443  >  54412 [PSH, ACK] Seq=32124 Ack=374 Win=15 Len=452 TSval=1127887297 TSecr=1457689587"
"43","3.831921","100.86.121.59","172.66.164.67","TCP","66","54412  >  443 [ACK] Seq=374 Ack=32576 Win=1974 Len=0 TSval=1457690662 TSecr=1127887270"
"44","3.831961","100.86.121.59","172.66.164.67","TCP","78","[TCP Dup ACK 43#1] 54412  >  443 [ACK] Seq=374 Ack=32576 Win=1974 Len=0 TSval=1457690662 TSecr=1127887297 SLE=32124 SRE=32576"
"45","3.835674","100.86.121.59","172.66.164.67","TCP","66","[TCP Window Update] 54412  >  443 [ACK] Seq=374 Ack=32576 Win=2048 Len=0 TSval=1457690665 TSecr=1127887297"
"46","3.836011","100.86.121.59","172.66.164.67","TLSv1.2","101","Application Data"
"47","3.846166","172.66.164.67","100.86.121.59","TCP","66","443  >  54412 [ACK] Seq=32576 Ack=409 Win=15 Len=0 TSval=1127887328 TSecr=1457690666"
"48","3.887849","100.86.121.59","172.66.164.67","TLSv1.2","624","Application Data"
"49","3.897999","100.86.121.59","172.66.164.67","TLSv1.2","1069","Application Data"
"50","3.898015","172.66.164.67","100.86.121.59","TCP","66","443  >  54412 [ACK] Seq=32576 Ack=967 Win=15 Len=0 TSval=1127887379 TSecr=1457690718"
"51","3.913415","172.66.164.67","100.86.121.59","TCP","66","443  >  54412 [ACK] Seq=32576 Ack=1970 Win=15 Len=0 TSval=1127887390 TSecr=1457690728"
"52","3.917611","172.66.164.67","100.86.121.59","TLSv1.2","292","Application Data"
"53","3.917612","172.66.164.67","100.86.121.59","TLSv1.2","108","Application Data"
"54","3.917638","100.86.121.59","172.66.164.67","TCP","66","54412  >  443 [ACK] Seq=1970 Ack=32844 Win=2044 Len=0 TSval=1457690747 TSecr=1127887398"
"55","3.917946","172.66.164.67","100.86.121.59","TLSv1.2","97","Application Data"
"56","3.917963","100.86.121.59","172.66.164.67","TCP","66","54412  >  443 [ACK] Seq=1970 Ack=32875 Win=2048 Len=0 TSval=1457690748 TSecr=1127887398"
"57","3.925160","100.86.121.59","172.66.164.67","TLSv1.2","420","Application Data"
"58","3.926296","100.86.121.59","172.66.164.67","TLSv1.2","192","Application Data"
"59","3.926424","100.86.121.59","172.66.164.67","TLSv1.2","194","Application Data"
"60","3.926524","100.86.121.59","172.66.164.67","TLSv1.2","193","Application Data"
"61","3.926760","100.86.121.59","172.66.164.67","TLSv1.2","191","Application Data"
"62","3.957418","172.66.164.67","100.86.121.59","TCP","66","443  >  54412 [ACK] Seq=32875 Ack=2830 Win=15 Len=0 TSval=1127887418 TSecr=1457690755"
"63","3.967953","172.66.164.67","100.86.121.59","TLSv1.2","127","Application Data"
"64","3.967955","172.66.164.67","100.86.121.59","TLSv1.2","290","Application Data"
"65","3.967956","172.66.164.67","100.86.121.59","TLSv1.2","97","Application Data"
"66","3.967957","172.66.164.67","100.86.121.59","TLSv1.2","127","Application Data"
"67","3.967958","172.66.164.67","100.86.121.59","TLSv1.2","290","Application Data"
"68","3.967959","172.66.164.67","100.86.121.59","TLSv1.2","97","Application Data"
"69","3.967960","172.66.164.67","100.86.121.59","TLSv1.2","127","Application Data"
"70","3.967961","172.66.164.67","100.86.121.59","TLSv1.2","290","Application Data"
"71","3.967965","172.66.164.67","100.86.121.59","TLSv1.2","97","Application Data"
"72","3.968095","100.86.121.59","172.66.164.67","TCP","66","54412  >  443 [ACK] Seq=2830 Ack=33823 Win=2034 Len=0 TSval=1457690798 TSecr=1127887441"
"73","3.972165","172.66.164.67","100.86.121.59","TLSv1.2","127","Application Data"
"74","3.972166","172.66.164.67","100.86.121.59","TLSv1.2","290","Application Data"
"75","3.972167","172.66.164.67","100.86.121.59","TLSv1.2","97","Application Data"
"76","3.972248","100.86.121.59","172.66.164.67","TCP","66","54412  >  443 [ACK] Seq=2830 Ack=34139 Win=2044 Len=0 TSval=1457690802 TSecr=1127887442"
"77","3.978073","172.66.164.67","100.86.121.59","TLSv1.2","127","Application Data"
"78","3.978074","172.66.164.67","100.86.121.59","TLSv1.2","290","Application Data"
"79","3.978105","100.86.121.59","172.66.164.67","TCP","66","54412  >  443 [ACK] Seq=2830 Ack=34424 Win=2044 Len=0 TSval=1457690808 TSecr=1127887460"
"80","3.978184","172.66.164.67","100.86.121.59","TLSv1.2","97","Application Data"
"81","3.978197","100.86.121.59","172.66.164.67","TCP","66","54412  >  443 [ACK] Seq=2830 Ack=34455 Win=2048 Len=0 TSval=1457690808 TSecr=1127887460"
"82","4.129229","172.66.164.67","100.86.121.59","TLSv1.2","148","Application Data"
"83","4.129230","172.66.164.67","100.86.121.59","TCP","1514","443  >  54412 [ACK] Seq=34537 Ack=2830 Win=15 Len=1448 TSval=1127887601 TSecr=1457690808 [TCP PDU reassembled in 90]"
"84","4.129231","172.66.164.67","100.86.121.59","TCP","1514","443  >  54412 [ACK] Seq=35985 Ack=2830 Win=15 Len=1448 TSval=1127887601 TSecr=1457690808 [TCP PDU reassembled in 90]"
"85","4.129233","172.66.164.67","100.86.121.59","TCP","1514","443  >  54412 [PSH, ACK] Seq=37433 Ack=2830 Win=15 Len=1448 TSval=1127887601 TSecr=1457690808 [TCP PDU reassembled in 90]"
"86","4.129234","172.66.164.67","100.86.121.59","TCP","1514","443  >  54412 [ACK] Seq=38881 Ack=2830 Win=15 Len=1448 TSval=1127887602 TSecr=1457690808 [TCP PDU reassembled in 90]"
"87","4.129236","172.66.164.67","100.86.121.59","TCP","1514","443  >  54412 [ACK] Seq=40329 Ack=2830 Win=15 Len=1448 TSval=1127887602 TSecr=1457690808 [TCP PDU reassembled in 90]"
"88","4.129237","172.66.164.67","100.86.121.59","TCP","1514","443  >  54412 [PSH, ACK] Seq=41777 Ack=2830 Win=15 Len=1448 TSval=1127887602 TSecr=1457690808 [TCP PDU reassembled in 90]"
"89","4.129238","172.66.164.67","100.86.121.59","TCP","1514","443  >  54412 [ACK] Seq=43225 Ack=2830 Win=15 Len=1448 TSval=1127887603 TSecr=1457690808 [TCP PDU reassembled in 90]"
"90","4.129240","172.66.164.67","100.86.121.59","TLSv1.2","1208","Application Data"
"91","4.129431","100.86.121.59","172.66.164.67","TCP","66","54412  >  443 [ACK] Seq=2830 Ack=45815 Win=1871 Len=0 TSval=1457690959 TSecr=1127887603"
"92","4.129493","100.86.121.59","172.66.164.67","TCP","66","[TCP Window Update] 54412  >  443 [ACK] Seq=2830 Ack=45815 Win=2048 Len=0 TSval=1457690959 TSecr=1127887603"
"93","4.130890","100.86.121.59","172.66.164.67","TLSv1.2","101","Application Data"
"94","4.144152","172.66.164.67","100.86.121.59","TLSv1.2","578","Application Data"
"95","4.144154","172.66.164.67","100.86.121.59","TCP","1514","443  >  54412 [ACK] Seq=46327 Ack=2830 Win=15 Len=1448 TSval=1127887612 TSecr=1457690808 [TCP PDU reassembled in 101]"
"96","4.144155","172.66.164.67","100.86.121.59","TCP","1514","443  >  54412 [ACK] Seq=47775 Ack=2830 Win=15 Len=1448 TSval=1127887612 TSecr=1457690808 [TCP PDU reassembled in 101]"
"97","4.144156","172.66.164.67","100.86.121.59","TCP","1514","443  >  54412 [PSH, ACK] Seq=49223 Ack=2830 Win=15 Len=1448 TSval=1127887612 TSecr=1457690808 [TCP PDU reassembled in 101]"
"98","4.144157","172.66.164.67","100.86.121.59","TCP","1514","443  >  54412 [ACK] Seq=50671 Ack=2830 Win=15 Len=1448 TSval=1127887612 TSecr=1457690808 [TCP PDU reassembled in 101]"
"99","4.144158","172.66.164.67","100.86.121.59","TCP","1514","443  >  54412 [ACK] Seq=52119 Ack=2830 Win=15 Len=1448 TSval=1127887612 TSecr=1457690808 [TCP PDU reassembled in 101]"
"100","4.144159","172.66.164.67","100.86.121.59","TCP","1514","443  >  54412 [PSH, ACK] Seq=53567 Ack=2830 Win=15 Len=1448 TSval=1127887612 TSecr=1457690808 [TCP PDU reassembled in 101]"
"101","4.144160","172.66.164.67","100.86.121.59","TLSv1.2","1084","Application Data, Application Data"
"102","4.144255","100.86.121.59","172.66.164.67","TCP","66","54412  >  443 [ACK] Seq=2865 Ack=56033 Win=1889 Len=0 TSval=1457690974 TSecr=1127887613"
"103","4.144364","100.86.121.59","172.66.164.67","TCP","66","[TCP Window Update] 54412  >  443 [ACK] Seq=2865 Ack=56033 Win=2048 Len=0 TSval=1457690974 TSecr=1127887613"
"104","4.187056","172.66.164.67","100.86.121.59","TCP","66","443  >  54412 [ACK] Seq=56033 Ack=2865 Win=15 Len=0 TSval=1127887669 TSecr=1457690961"
"105","8.988741","100.86.121.59","172.66.164.67","TLSv1.2","193","Application Data"
"106","8.989597","100.86.121.59","172.66.164.67","TLSv1.2","195","Application Data"
"107","8.989900","100.86.121.59","172.66.164.67","TLSv1.2","191","Application Data"
"108","9.000460","172.66.164.67","100.86.121.59","TCP","66","443  >  54412 [ACK] Seq=56033 Ack=2992 Win=15 Len=0 TSval=1127892482 TSecr=1457695818"
"109","9.000464","172.66.164.67","100.86.121.59","TCP","66","443  >  54412 [ACK] Seq=56033 Ack=3121 Win=15 Len=0 TSval=1127892482 TSecr=1457695819"
"110","9.002003","172.66.164.67","100.86.121.59","TCP","66","443  >  54412 [ACK] Seq=56033 Ack=3246 Win=15 Len=0 TSval=1127892484 TSecr=1457695820"
"111","9.020372","172.66.164.67","100.86.121.59","TLSv1.2","150","Application Data"
"112","9.020376","172.66.164.67","100.86.121.59","TLSv1.2","290","Application Data"
"113","9.020540","100.86.121.59","172.66.164.67","TCP","66","54412  >  443 [ACK] Seq=3246 Ack=56341 Win=2044 Len=0 TSval=1457695850 TSecr=1127892502"
"114","9.020746","172.66.164.67","100.86.121.59","TLSv1.2","97","Application Data"
"115","9.020748","172.66.164.67","100.86.121.59","TLSv1.2","127","Application Data"
"116","9.020826","100.86.121.59","172.66.164.67","TCP","66","54412  >  443 [ACK] Seq=3246 Ack=56433 Win=2043 Len=0 TSval=1457695851 TSecr=1127892502"
"117","9.021098","172.66.164.67","100.86.121.59","TLSv1.2","290","Application Data"
"118","9.021101","172.66.164.67","100.86.121.59","TLSv1.2","97","Application Data"
"119","9.021144","100.86.121.59","172.66.164.67","TCP","66","54412  >  443 [ACK] Seq=3246 Ack=56688 Win=2045 Len=0 TSval=1457695851 TSecr=1127892502"
"120","9.022766","100.86.121.59","172.66.164.67","TLSv1.2","101","Application Data"
"121","9.023769","172.66.164.67","100.86.121.59","TLSv1.2","127","Application Data"
"122","9.023772","172.66.164.67","100.86.121.59","TLSv1.2","290","Application Data"
"123","9.023833","100.86.121.59","172.66.164.67","TCP","66","54412  >  443 [ACK] Seq=3281 Ack=56973 Win=2044 Len=0 TSval=1457695854 TSecr=1127892505"
"124","9.023909","172.66.164.67","100.86.121.59","TLSv1.2","97","Application Data"
"125","9.023951","100.86.121.59","172.66.164.67","TCP","66","54412  >  443 [ACK] Seq=3281 Ack=57004 Win=2048 Len=0 TSval=1457695854 TSecr=1127892506"
"126","9.072922","172.66.164.67","100.86.121.59","TCP","66","443  >  54412 [ACK] Seq=57004 Ack=3281 Win=15 Len=0 TSval=1127892555 TSecr=1457695852"
"127","13.254236","100.86.121.59","172.66.164.67","TCP","54","[TCP Keep-Alive] 54412  >  443 [ACK] Seq=3280 Ack=57004 Win=2048 Len=0"
"128","13.272121","172.66.164.67","100.86.121.59","TCP","66","[TCP Keep-Alive ACK] 443  >  54412 [ACK] Seq=57004 Ack=3281 Win=15 Len=0 TSval=1127896750 TSecr=1457695852"
"129","13.988763","100.86.121.59","172.66.164.67","TLSv1.2","671","Application Data"
"130","13.989187","100.86.121.59","172.66.164.67","TLSv1.2","335","Application Data"
"131","14.002009","172.66.164.67","100.86.121.59","TCP","66","443  >  54412 [ACK] Seq=57004 Ack=4155 Win=15 Len=0 TSval=1127897484 TSecr=1457700819"
"132","14.022863","172.66.164.67","100.86.121.59","TLSv1.2","150","Application Data"
"133","14.022868","172.66.164.67","100.86.121.59","TLSv1.2","290","Application Data"
"134","14.023082","172.66.164.67","100.86.121.59","TLSv1.2","97","Application Data"
"135","14.023085","172.66.164.67","100.86.121.59","TLSv1.2","208","Application Data"
"136","14.023088","172.66.164.67","100.86.121.59","TLSv1.2","290","Application Data"
"137","14.023092","100.86.121.59","172.66.164.67","TCP","66","54412  >  443 [ACK] Seq=4155 Ack=57312 Win=2044 Len=0 TSval=1457700853 TSecr=1127897504"
"138","14.023199","100.86.121.59","172.66.164.67","TCP","66","54412  >  443 [ACK] Seq=4155 Ack=57709 Win=2038 Len=0 TSval=1457700853 TSecr=1127897505"
"139","14.023521","172.66.164.67","100.86.121.59","TLSv1.2","97","Application Data"
"140","14.023603","100.86.121.59","172.66.164.67","TCP","66","54412  >  443 [ACK] Seq=4155 Ack=57740 Win=2048 Len=0 TSval=1457700853 TSecr=1127897505"
"141","14.026417","100.86.121.59","172.66.164.67","TLSv1.2","101","Application Data"
"142","14.078269","172.66.164.67","100.86.121.59","TCP","66","443  >  54412 [ACK] Seq=57740 Ack=4190 Win=15 Len=0 TSval=1127897560 TSecr=1457700856"
"143","18.892709","100.86.121.59","172.66.164.67","TLSv1.2","189","Application Data"
"144","18.903324","172.66.164.67","100.86.121.59","TCP","66","443  >  54412 [ACK] Seq=57740 Ack=4313 Win=15 Len=0 TSval=1127902384 TSecr=1457705722"
"145","18.924492","172.66.164.67","100.86.121.59","TLSv1.2","151","Application Data"
"146","18.924494","172.66.164.67","100.86.121.59","TLSv1.2","108","Application Data"
"147","18.924614","100.86.121.59","172.66.164.67","TCP","66","54412  >  443 [ACK] Seq=4313 Ack=57867 Win=2047 Len=0 TSval=1457705754 TSecr=1127902406"
"148","18.924809","172.66.164.67","100.86.121.59","TLSv1.2","97","Application Data"
"149","18.924873","100.86.121.59","172.66.164.67","TCP","66","54412  >  443 [ACK] Seq=4313 Ack=57898 Win=2048 Len=0 TSval=1457705755 TSecr=1127902406"
"150","20.443944","100.86.121.59","172.66.164.67","TLSv1.2","994","Application Data"
"151","20.496286","172.66.164.67","100.86.121.59","TCP","66","443  >  54412 [ACK] Seq=57898 Ack=5241 Win=15 Len=0 TSval=1127903978 TSecr=1457707274"
"152","21.135688","172.66.164.67","100.86.121.59","TLSv1.2","305","Application Data"
"153","21.135692","172.66.164.67","100.86.121.59","TCP","1514","443  >  54412 [ACK] Seq=58137 Ack=5241 Win=15 Len=1448 TSval=1127904581 TSecr=1457707274 [TCP PDU reassembled in 165]"
"154","21.135783","172.66.164.67","100.86.121.59","TCP","1514","443  >  54412 [ACK] Seq=59585 Ack=5241 Win=15 Len=1448 TSval=1127904581 TSecr=1457707274 [TCP PDU reassembled in 165]"
"155","21.135785","172.66.164.67","100.86.121.59","TCP","1514","443  >  54412 [PSH, ACK] Seq=61033 Ack=5241 Win=15 Len=1448 TSval=1127904581 TSecr=1457707274 [TCP PDU reassembled in 165]"
"156","21.135787","172.66.164.67","100.86.121.59","TCP","1514","443  >  54412 [ACK] Seq=62481 Ack=5241 Win=15 Len=1448 TSval=1127904582 TSecr=1457707274 [TCP PDU reassembled in 165]"
"157","21.135790","172.66.164.67","100.86.121.59","TCP","1514","443  >  54412 [ACK] Seq=63929 Ack=5241 Win=15 Len=1448 TSval=1127904582 TSecr=1457707274 [TCP PDU reassembled in 165]"
"158","21.135888","172.66.164.67","100.86.121.59","TCP","1514","443  >  54412 [PSH, ACK] Seq=65377 Ack=5241 Win=15 Len=1448 TSval=1127904582 TSecr=1457707274 [TCP PDU reassembled in 165]"
"159","21.135891","172.66.164.67","100.86.121.59","TCP","1514","443  >  54412 [ACK] Seq=66825 Ack=5241 Win=15 Len=1448 TSval=1127904583 TSecr=1457707274 [TCP PDU reassembled in 165]"
"160","21.135920","100.86.121.59","172.66.164.67","TCP","66","54412  >  443 [ACK] Seq=5241 Ack=59585 Win=2022 Len=0 TSval=1457707965 TSecr=1127904581"
"161","21.136006","100.86.121.59","172.66.164.67","TCP","66","54412  >  443 [ACK] Seq=5241 Ack=65377 Win=1932 Len=0 TSval=1457707966 TSecr=1127904582"
"162","21.136025","100.86.121.59","172.66.164.67","TCP","66","54412  >  443 [ACK] Seq=5241 Ack=68273 Win=1887 Len=0 TSval=1457707966 TSecr=1127904583"
"163","21.136084","100.86.121.59","172.66.164.67","TCP","66","[TCP Window Update] 54412  >  443 [ACK] Seq=5241 Ack=68273 Win=2048 Len=0 TSval=1457707966 TSecr=1127904583"
"164","21.137411","172.66.164.67","100.86.121.59","TCP","1514","443  >  54412 [ACK] Seq=68273 Ack=5241 Win=15 Len=1448 TSval=1127904583 TSecr=1457707274 [TCP PDU reassembled in 165]"
"165","21.137413","172.66.164.67","100.86.121.59","TLSv1.2","1479","Application Data"
"166","21.137416","172.66.164.67","100.86.121.59","TCP","1514","443  >  54412 [ACK] Seq=71134 Ack=5241 Win=15 Len=1448 TSval=1127904584 TSecr=1457707274 [TCP PDU reassembled in 168]"
"167","21.137418","172.66.164.67","100.86.121.59","TCP","1514","443  >  54412 [ACK] Seq=72582 Ack=5241 Win=15 Len=1448 TSval=1127904584 TSecr=1457707274 [TCP PDU reassembled in 168]"
"168","21.137421","172.66.164.67","100.86.121.59","TLSv1.2","509","Application Data"
"169","21.137423","172.66.164.67","100.86.121.59","TLSv1.2","110","Application Data"
"170","21.137425","172.66.164.67","100.86.121.59","TLSv1.2","137","Application Data"
"171","21.137427","172.66.164.67","100.86.121.59","TCP","1514","443  >  54412 [ACK] Seq=74588 Ack=5241 Win=15 Len=1448 TSval=1127904586 TSecr=1457707274 [TCP PDU reassembled in 174]"
"172","21.137429","172.66.164.67","100.86.121.59","TCP","1514","443  >  54412 [ACK] Seq=76036 Ack=5241 Win=15 Len=1448 TSval=1127904586 TSecr=1457707274 [TCP PDU reassembled in 174]"
"173","21.137431","172.66.164.67","100.86.121.59","TCP","1514","443  >  54412 [PSH, ACK] Seq=77484 Ack=5241 Win=15 Len=1448 TSval=1127904586 TSecr=1457707274 [TCP PDU reassembled in 174]"
"174","21.137433","172.66.164.67","100.86.121.59","TLSv1.2","1388","Application Data"
"175","21.137437","172.66.164.67","100.86.121.59","TCP","1514","443  >  54412 [ACK] Seq=80254 Ack=5241 Win=15 Len=1448 TSval=1127904588 TSecr=1457707274 [TCP PDU reassembled in 177]"
"176","21.137439","172.66.164.67","100.86.121.59","TCP","1514","443  >  54412 [ACK] Seq=81702 Ack=5241 Win=15 Len=1448 TSval=1127904588 TSecr=1457707274 [TCP PDU reassembled in 177]"
"177","21.137441","172.66.164.67","100.86.121.59","TLSv1.2","1425","Application Data"
"178","21.137444","172.66.164.67","100.86.121.59","TLSv1.2","97","Application Data"
"179","21.137558","100.86.121.59","172.66.164.67","TCP","66","54412  >  443 [ACK] Seq=5241 Ack=84540 Win=1794 Len=0 TSval=1457707967 TSecr=1127904588"
"180","21.137635","100.86.121.59","172.66.164.67","TCP","66","[TCP Window Update] 54412  >  443 [ACK] Seq=5241 Ack=84540 Win=2048 Len=0 TSval=1457707967 TSecr=1127904588"
"181","21.139122","172.66.164.67","100.86.121.59","TCP","97","[TCP Spurious Retransmission] 443  >  54412 [PSH, ACK] Seq=84509 Ack=5241 Win=15 Len=31 TSval=1127904621 TSecr=1457707274"
"182","21.139215","100.86.121.59","172.66.164.67","TCP","78","[TCP Dup ACK 179#1] 54412  >  443 [ACK] Seq=5241 Ack=84540 Win=2048 Len=0 TSval=1457707969 TSecr=1127904621 SLE=84509 SRE=84540"
"183","21.141278","100.86.121.59","172.66.164.67","TLSv1.2","101","Application Data"
"184","21.151406","172.66.164.67","100.86.121.59","TCP","66","443  >  54412 [ACK] Seq=84540 Ack=5276 Win=15 Len=0 TSval=1127904633 TSecr=1457707971"
"185","21.188984","100.86.121.59","172.66.164.67","TLSv1.2","227","Application Data"
"186","21.197405","100.86.121.59","172.66.164.67","TLSv1.2","279","Application Data"
"187","21.202896","172.66.164.67","100.86.121.59","TCP","66","443  >  54412 [ACK] Seq=84540 Ack=5437 Win=15 Len=0 TSval=1127904681 TSecr=1457708019"
"188","21.211277","172.66.164.67","100.86.121.59","TCP","66","443  >  54412 [ACK] Seq=84540 Ack=5650 Win=15 Len=0 TSval=1127904693 TSecr=1457708027"
"189","21.225548","100.86.121.59","172.66.164.67","TLSv1.2","424","Application Data"
"190","21.226176","100.86.121.59","172.66.164.67","TLSv1.2","617","Application Data"
"191","21.226579","100.86.121.59","172.66.164.67","TLSv1.2","339","Application Data"
"192","21.226873","100.86.121.59","172.66.164.67","TLSv1.2","194","Application Data"
"193","21.227004","100.86.121.59","172.66.164.67","TLSv1.2","192","Application Data"
"194","21.235544","172.66.164.67","100.86.121.59","TLSv1.2","128","Application Data"
"195","21.235546","172.66.164.67","100.86.121.59","TLSv1.2","108","Application Data"
"196","21.235547","172.66.164.67","100.86.121.59","TLSv1.2","97","Application Data"
"197","21.235747","100.86.121.59","172.66.164.67","TCP","66","54412  >  443 [ACK] Seq=7086 Ack=84675 Win=2046 Len=0 TSval=1457708065 TSecr=1127904703"
"198","21.251642","172.66.164.67","100.86.121.59","TLSv1.2","137","Application Data"
"199","21.251644","172.66.164.67","100.86.121.59","TCP","1514","443  >  54412 [ACK] Seq=84746 Ack=5650 Win=15 Len=1448 TSval=1127904710 TSecr=1457708027 [TCP PDU reassembled in 210]"
"200","21.251646","172.66.164.67","100.86.121.59","TCP","1514","443  >  54412 [ACK] Seq=86194 Ack=5650 Win=15 Len=1448 TSval=1127904710 TSecr=1457708027 [TCP PDU reassembled in 210]"
"201","21.251647","172.66.164.67","100.86.121.59","TCP","1514","443  >  54412 [PSH, ACK] Seq=87642 Ack=5650 Win=15 Len=1448 TSval=1127904710 TSecr=1457708027 [TCP PDU reassembled in 210]"
"202","21.251649","172.66.164.67","100.86.121.59","TCP","1514","443  >  54412 [ACK] Seq=89090 Ack=5650 Win=15 Len=1448 TSval=1127904711 TSecr=1457708027 [TCP PDU reassembled in 210]"
"203","21.251650","172.66.164.67","100.86.121.59","TCP","1514","443  >  54412 [ACK] Seq=90538 Ack=5650 Win=15 Len=1448 TSval=1127904711 TSecr=1457708027 [TCP PDU reassembled in 210]"
"204","21.251652","172.66.164.67","100.86.121.59","TCP","1514","443  >  54412 [PSH, ACK] Seq=91986 Ack=5650 Win=15 Len=1448 TSval=1127904711 TSecr=1457708027 [TCP PDU reassembled in 210]"
"205","21.251653","172.66.164.67","100.86.121.59","TCP","1514","443  >  54412 [ACK] Seq=93434 Ack=5650 Win=15 Len=1448 TSval=1127904712 TSecr=1457708027 [TCP PDU reassembled in 210]"
"206","21.251655","172.66.164.67","100.86.121.59","TCP","1514","443  >  54412 [ACK] Seq=94882 Ack=5650 Win=15 Len=1448 TSval=1127904712 TSecr=1457708027 [TCP PDU reassembled in 210]"
"207","21.251656","172.66.164.67","100.86.121.59","TCP","1514","443  >  54412 [PSH, ACK] Seq=96330 Ack=5650 Win=15 Len=1448 TSval=1127904712 TSecr=1457708027 [TCP PDU reassembled in 210]"
"208","21.251657","172.66.164.67","100.86.121.59","TCP","1514","443  >  54412 [ACK] Seq=97778 Ack=5650 Win=15 Len=1448 TSval=1127904713 TSecr=1457708027 [TCP PDU reassembled in 210]"
"209","21.251659","172.66.164.67","100.86.121.59","TCP","1514","443  >  54412 [ACK] Seq=99226 Ack=5650 Win=15 Len=1448 TSval=1127904713 TSecr=1457708027 [TCP PDU reassembled in 210]"
"210","21.251660","172.66.164.67","100.86.121.59","TLSv1.2","1514","Application Data"
"211","21.251662","172.66.164.67","100.86.121.59","TCP","1514","443  >  54412 [ACK] Seq=102122 Ack=5650 Win=15 Len=1448 TSval=1127904714 TSecr=1457708027 [TCP PDU reassembled in 214]"
"212","21.251664","172.66.164.67","100.86.121.59","TCP","1514","443  >  54412 [ACK] Seq=103570 Ack=5650 Win=15 Len=1448 TSval=1127904714 TSecr=1457708027 [TCP PDU reassembled in 214]"
"213","21.251808","100.86.121.59","172.66.164.67","TCP","66","54412  >  443 [ACK] Seq=7086 Ack=100674 Win=1799 Len=0 TSval=1457708081 TSecr=1127904713"
"214","21.251836","172.66.164.67","100.86.121.59","TLSv1.2","1083","Application Data, Application Data"
"215","21.251870","100.86.121.59","172.66.164.67","TCP","66","54412  >  443 [ACK] Seq=7086 Ack=105018 Win=1732 Len=0 TSval=1457708082 TSecr=1127904714"
"216","21.251901","100.86.121.59","172.66.164.67","TCP","66","54412  >  443 [ACK] Seq=7086 Ack=106035 Win=1717 Len=0 TSval=1457708082 TSecr=1127904714"
"217","21.252217","100.86.121.59","172.66.164.67","TCP","66","[TCP Window Update] 54412  >  443 [ACK] Seq=7086 Ack=106035 Win=2048 Len=0 TSval=1457708082 TSecr=1127904714"
"218","21.276493","172.66.164.67","100.86.121.59","TCP","66","443  >  54412 [ACK] Seq=106035 Ack=7086 Win=15 Len=0 TSval=1127904758 TSecr=1457708055"
"219","21.296575","172.66.164.67","100.86.121.59","TLSv1.2","163","Application Data"
"220","21.296576","172.66.164.67","100.86.121.59","TLSv1.2","290","Application Data"
"221","21.296632","100.86.121.59","172.66.164.67","TCP","66","54412  >  443 [ACK] Seq=7086 Ack=106356 Win=2043 Len=0 TSval=1457708126 TSecr=1127904778"
"222","21.297180","172.66.164.67","100.86.121.59","TLSv1.2","97","Application Data"
"223","21.297211","100.86.121.59","172.66.164.67","TCP","66","54412  >  443 [ACK] Seq=7086 Ack=106387 Win=2048 Len=0 TSval=1457708127 TSecr=1127904778"
"224","21.298857","172.66.164.67","100.86.121.59","TLSv1.2","127","Application Data"
"225","21.298858","172.66.164.67","100.86.121.59","TLSv1.2","290","Application Data"
"226","21.298901","100.86.121.59","172.66.164.67","TCP","66","54412  >  443 [ACK] Seq=7086 Ack=106672 Win=2044 Len=0 TSval=1457708129 TSecr=1127904780"
"227","21.298949","172.66.164.67","100.86.121.59","TLSv1.2","97","Application Data"
"228","21.298967","100.86.121.59","172.66.164.67","TCP","66","54412  >  443 [ACK] Seq=7086 Ack=106703 Win=2048 Len=0 TSval=1457708129 TSecr=1127904781"
"229","21.300830","172.66.164.67","100.86.121.59","TLSv1.2","127","Application Data"
"230","21.300832","172.66.164.67","100.86.121.59","TLSv1.2","290","Application Data"
"231","21.300833","172.66.164.67","100.86.121.59","TLSv1.2","97","Application Data"
"232","21.300833","172.66.164.67","100.86.121.59","TLSv1.2","127","Application Data"
"233","21.300834","172.66.164.67","100.86.121.59","TLSv1.2","290","Application Data"
"234","21.300835","172.66.164.67","100.86.121.59","TLSv1.2","97","Application Data"
"235","21.300836","172.66.164.67","100.86.121.59","TLSv1.2","127","Application Data"
"236","21.300837","172.66.164.67","100.86.121.59","TLSv1.2","290","Application Data"
"237","21.300905","100.86.121.59","172.66.164.67","TCP","66","54412  >  443 [ACK] Seq=7086 Ack=107620 Win=2034 Len=0 TSval=1457708131 TSecr=1127904781"
"238","21.301169","172.66.164.67","100.86.121.59","TLSv1.2","97","Application Data"
"239","21.301207","100.86.121.59","172.66.164.67","TCP","66","54412  >  443 [ACK] Seq=7086 Ack=107651 Win=2048 Len=0 TSval=1457708131 TSecr=1127904781"
"240","26.309913","100.86.121.59","172.66.164.67","TLSv1.2","194","Application Data"
"241","26.310373","100.86.121.59","172.66.164.67","TLSv1.2","190","Application Data"
"242","26.310703","100.86.121.59","172.66.164.67","TLSv1.2","837","Application Data"
"243","26.322700","172.66.164.67","100.86.121.59","TCP","66","443  >  54412 [ACK] Seq=107651 Ack=7338 Win=15 Len=0 TSval=1127909804 TSecr=1457713139"
"244","26.345489","172.66.164.67","100.86.121.59","TLSv1.2","150","Application Data"
"245","26.345493","172.66.164.67","100.86.121.59","TLSv1.2","290","Application Data"
"246","26.345549","172.66.164.67","100.86.121.59","TLSv1.2","97","Application Data"
"247","26.345703","172.66.164.67","100.86.121.59","TLSv1.2","127","Application Data"
"248","26.345706","172.66.164.67","100.86.121.59","TLSv1.2","290","Application Data"
"249","26.345709","100.86.121.59","172.66.164.67","TCP","66","54412  >  443 [ACK] Seq=8109 Ack=107959 Win=2044 Len=0 TSval=1457713175 TSecr=1127909827"
"250","26.345791","100.86.121.59","172.66.164.67","TCP","66","54412  >  443 [ACK] Seq=8109 Ack=107990 Win=2044 Len=0 TSval=1457713175 TSecr=1127909827"
"251","26.345820","100.86.121.59","172.66.164.67","TCP","66","54412  >  443 [ACK] Seq=8109 Ack=108275 Win=2040 Len=0 TSval=1457713175 TSecr=1127909828"
"252","26.345963","172.66.164.67","100.86.121.59","TLSv1.2","97","Application Data"
"253","26.346043","100.86.121.59","172.66.164.67","TCP","66","54412  >  443 [ACK] Seq=8109 Ack=108306 Win=2048 Len=0 TSval=1457713176 TSecr=1127909828"
"254","26.348483","100.86.121.59","172.66.164.67","TLSv1.2","101","Application Data"
"255","26.351083","172.66.164.67","100.86.121.59","TLSv1.2","127","Application Data"
"256","26.351086","172.66.164.67","100.86.121.59","TLSv1.2","290","Application Data"
"257","26.351164","172.66.164.67","100.86.121.59","TLSv1.2","97","Application Data"
"258","26.351217","100.86.121.59","172.66.164.67","TCP","66","54412  >  443 [ACK] Seq=8144 Ack=108591 Win=2044 Len=0 TSval=1457713181 TSecr=1127909833"
"259","26.351279","100.86.121.59","172.66.164.67","TCP","66","54412  >  443 [ACK] Seq=8144 Ack=108622 Win=2044 Len=0 TSval=1457713181 TSecr=1127909833"
"260","26.398780","172.66.164.67","100.86.121.59","TCP","66","443  >  54412 [ACK] Seq=108622 Ack=8144 Win=15 Len=0 TSval=1127909881 TSecr=1457713178"
"261","31.311198","100.86.121.59","172.66.164.67","TLSv1.2","277","Application Data"
"262","31.311602","100.86.121.59","172.66.164.67","TLSv1.2","192","Application Data"
"263","31.324411","172.66.164.67","100.86.121.59","TCP","66","443  >  54412 [ACK] Seq=108622 Ack=8481 Win=15 Len=0 TSval=1127914806 TSecr=1457718141"
"264","31.344549","172.66.164.67","100.86.121.59","TLSv1.2","150","Application Data"
"265","31.344552","172.66.164.67","100.86.121.59","TLSv1.2","290","Application Data"
"266","31.344674","100.86.121.59","172.66.164.67","TCP","66","54412  >  443 [ACK] Seq=8481 Ack=108930 Win=2044 Len=0 TSval=1457718174 TSecr=1127914826"
"267","31.344724","172.66.164.67","100.86.121.59","TLSv1.2","97","Application Data"
"268","31.344727","172.66.164.67","100.86.121.59","TLSv1.2","127","Application Data"
"269","31.344729","172.66.164.67","100.86.121.59","TLSv1.2","290","Application Data"
"270","31.344800","100.86.121.59","172.66.164.67","TCP","66","54412  >  443 [ACK] Seq=8481 Ack=109246 Win=2044 Len=0 TSval=1457718174 TSecr=1127914826"
"271","31.345254","172.66.164.67","100.86.121.59","TLSv1.2","97","Application Data"
"272","31.345300","100.86.121.59","172.66.164.67","TCP","66","54412  >  443 [ACK] Seq=8481 Ack=109277 Win=2048 Len=0 TSval=1457718175 TSecr=1127914827"
"273","36.193353","100.86.121.59","172.66.164.67","TLSv1.2","187","Application Data"
"274","36.224061","172.66.164.67","100.86.121.59","TLSv1.2","151","Application Data"
"275","36.224065","172.66.164.67","100.86.121.59","TLSv1.2","108","Application Data"
"276","36.224068","172.66.164.67","100.86.121.59","TLSv1.2","97","Application Data"
"277","36.224293","100.86.121.59","172.66.164.67","TCP","66","54412  >  443 [ACK] Seq=8602 Ack=109435 Win=2046 Len=0 TSval=1457723054 TSecr=1127919706"
"278","36.226135","100.86.121.59","172.66.164.67","TLSv1.2","101","Application Data"
"279","36.280695","172.66.164.67","100.86.121.59","TCP","66","443  >  54412 [ACK] Seq=109435 Ack=8637 Win=15 Len=0 TSval=1127919759 TSecr=1457723056"
"280","46.357541","100.86.121.59","172.66.164.67","TLSv1.2","191","Application Data"
"281","46.357605","100.86.121.59","172.66.164.67","TLSv1.2","105","Application Data"
"282","46.455932","172.66.164.67","100.86.121.59","TLSv1.2","105","Application Data"
"283","46.456127","100.86.121.59","172.66.164.67","TCP","66","54412  >  443 [ACK] Seq=8801 Ack=109474 Win=2048 Len=0 TSval=1457733286 TSecr=1127929897"
"284","46.479899","172.66.164.67","100.86.121.59","TLSv1.2","150","Application Data"
"285","46.479903","172.66.164.67","100.86.121.59","TLSv1.2","290","Application Data"
"286","46.479960","172.66.164.67","100.86.121.59","TLSv1.2","97","Application Data"
"287","46.480055","100.86.121.59","172.66.164.67","TCP","66","54412  >  443 [ACK] Seq=8801 Ack=109782 Win=2044 Len=0 TSval=1457733310 TSecr=1127929919"
"288","46.480119","100.86.121.59","172.66.164.67","TCP","66","54412  >  443 [ACK] Seq=8801 Ack=109813 Win=2044 Len=0 TSval=1457733310 TSecr=1127929919"
"289","46.482114","100.86.121.59","172.66.164.67","TLSv1.2","101","Application Data"
"290","46.503110","172.66.164.67","100.86.121.59","TCP","97","[TCP Spurious Retransmission] 443  >  54412 [PSH, ACK] Seq=109782 Ack=8801 Win=15 Len=31 TSval=1127929952 TSecr=1457733187"
"291","46.503261","100.86.121.59","172.66.164.67","TCP","78","[TCP Dup ACK 288#1] 54412  >  443 [ACK] Seq=8836 Ack=109813 Win=2048 Len=0 TSval=1457733333 TSecr=1127929952 SLE=109782 SRE=109813"
"292","46.598440","172.66.164.67","100.86.121.59","TCP","66","443  >  54412 [ACK] Seq=109813 Ack=8836 Win=15 Len=0 TSval=1127930056 TSecr=1457733312"
"293","47.583632","100.86.121.59","172.66.164.67","TLSv1.2","325","Application Data"
"294","47.594021","172.66.164.67","100.86.121.59","TCP","66","443  >  54412 [ACK] Seq=109813 Ack=9095 Win=15 Len=0 TSval=1127931076 TSecr=1457734413"
"295","48.989413","172.66.164.67","100.86.121.59","TLSv1.2","175","Application Data"
"296","48.989418","172.66.164.67","100.86.121.59","TCP","1514","443  >  54412 [ACK] Seq=109922 Ack=9095 Win=15 Len=1448 TSval=1127932395 TSecr=1457734413 [TCP PDU reassembled in 307]"
"297","48.989422","172.66.164.67","100.86.121.59","TCP","1514","443  >  54412 [ACK] Seq=111370 Ack=9095 Win=15 Len=1448 TSval=1127932395 TSecr=1457734413 [TCP PDU reassembled in 307]"
"298","48.989425","172.66.164.67","100.86.121.59","TCP","1514","443  >  54412 [PSH, ACK] Seq=112818 Ack=9095 Win=15 Len=1448 TSval=1127932395 TSecr=1457734413 [TCP PDU reassembled in 307]"
"299","48.989428","172.66.164.67","100.86.121.59","TCP","1514","443  >  54412 [ACK] Seq=114266 Ack=9095 Win=15 Len=1448 TSval=1127932396 TSecr=1457734413 [TCP PDU reassembled in 307]"
"300","48.989431","172.66.164.67","100.86.121.59","TCP","1514","443  >  54412 [ACK] Seq=115714 Ack=9095 Win=15 Len=1448 TSval=1127932396 TSecr=1457734413 [TCP PDU reassembled in 307]"
"301","48.989434","172.66.164.67","100.86.121.59","TCP","1514","443  >  54412 [PSH, ACK] Seq=117162 Ack=9095 Win=15 Len=1448 TSval=1127932396 TSecr=1457734413 [TCP PDU reassembled in 307]"
"302","48.989438","172.66.164.67","100.86.121.59","TCP","1514","443  >  54412 [ACK] Seq=118610 Ack=9095 Win=15 Len=1448 TSval=1127932397 TSecr=1457734413 [TCP PDU reassembled in 307]"
"303","48.989508","172.66.164.67","100.86.121.59","TCP","1514","443  >  54412 [ACK] Seq=120058 Ack=9095 Win=15 Len=1448 TSval=1127932397 TSecr=1457734413 [TCP PDU reassembled in 307]"
"304","48.989512","172.66.164.67","100.86.121.59","TCP","1514","443  >  54412 [PSH, ACK] Seq=121506 Ack=9095 Win=15 Len=1448 TSval=1127932397 TSecr=1457734413 [TCP PDU reassembled in 307]"
"305","48.989515","172.66.164.67","100.86.121.59","TCP","1514","443  >  54412 [ACK] Seq=122954 Ack=9095 Win=15 Len=1448 TSval=1127932398 TSecr=1457734413 [TCP PDU reassembled in 307]"
"306","48.989517","172.66.164.67","100.86.121.59","TCP","1514","443  >  54412 [ACK] Seq=124402 Ack=9095 Win=15 Len=1448 TSval=1127932398 TSecr=1457734413 [TCP PDU reassembled in 307]"
"307","48.989707","172.66.164.67","100.86.121.59","TLSv1.2","1514","Application Data"
"308","48.989712","100.86.121.59","172.66.164.67","TCP","66","54412  >  443 [ACK] Seq=9095 Ack=120058 Win=1888 Len=0 TSval=1457735819 TSecr=1127932397"
"309","48.989716","172.66.164.67","100.86.121.59","TCP","1514","443  >  54412 [ACK] Seq=127298 Ack=9095 Win=15 Len=1448 TSval=1127932399 TSecr=1457734413 [TCP PDU reassembled in 318]"
"310","48.989719","172.66.164.67","100.86.121.59","TCP","1514","443  >  54412 [ACK] Seq=128746 Ack=9095 Win=15 Len=1448 TSval=1127932399 TSecr=1457734413 [TCP PDU reassembled in 318]"
"311","48.989722","172.66.164.67","100.86.121.59","TCP","1514","443  >  54412 [PSH, ACK] Seq=130194 Ack=9095 Win=15 Len=1448 TSval=1127932399 TSecr=1457734413 [TCP PDU reassembled in 318]"
"312","48.989826","100.86.121.59","172.66.164.67","TCP","66","54412  >  443 [ACK] Seq=9095 Ack=125850 Win=1798 Len=0 TSval=1457735819 TSecr=1127932398"
"313","48.989847","100.86.121.59","172.66.164.67","TCP","66","54412  >  443 [ACK] Seq=9095 Ack=131642 Win=1708 Len=0 TSval=1457735819 TSecr=1127932399"
"314","48.990393","100.86.121.59","172.66.164.67","TCP","66","[TCP Window Update] 54412  >  443 [ACK] Seq=9095 Ack=131642 Win=2048 Len=0 TSval=1457735820 TSecr=1127932399"
"315","48.991196","172.66.164.67","100.86.121.59","TCP","1514","443  >  54412 [ACK] Seq=131642 Ack=9095 Win=15 Len=1448 TSval=1127932399 TSecr=1457734413 [TCP PDU reassembled in 318]"
"316","48.991199","172.66.164.67","100.86.121.59","TCP","1514","443  >  54412 [ACK] Seq=133090 Ack=9095 Win=15 Len=1448 TSval=1127932399 TSecr=1457734413 [TCP PDU reassembled in 318]"
"317","48.991202","172.66.164.67","100.86.121.59","TCP","1514","443  >  54412 [PSH, ACK] Seq=134538 Ack=9095 Win=15 Len=1448 TSval=1127932399 TSecr=1457734413 [TCP PDU reassembled in 318]"
"318","48.991204","172.66.164.67","100.86.121.59","TLSv1.2","668","Application Data, Application Data"
"319","48.991271","100.86.121.59","172.66.164.67","TCP","66","54412  >  443 [ACK] Seq=9095 Ack=136588 Win=1971 Len=0 TSval=1457735821 TSecr=1127932400"
"320","48.991312","100.86.121.59","172.66.164.67","TCP","66","[TCP Window Update] 54412  >  443 [ACK] Seq=9095 Ack=136588 Win=2048 Len=0 TSval=1457735821 TSecr=1127932400"
"321","48.996510","172.66.164.67","100.86.121.59","TCP","668","[TCP Spurious Retransmission] 443  >  54412 [PSH, ACK] Seq=135986 Ack=9095 Win=15 Len=602 TSval=1127932477 TSecr=1457734413"
"322","48.996673","100.86.121.59","172.66.164.67","TCP","78","[TCP Dup ACK 319#1] 54412  >  443 [ACK] Seq=9095 Ack=136588 Win=2048 Len=0 TSval=1457735826 TSecr=1127932477 SLE=135986 SRE=136588"
"323","49.045184","100.86.121.59","172.66.164.67","TLSv1.2","211","Application Data"
"324","49.055460","172.66.164.67","100.86.121.59","TCP","66","443  >  54412 [ACK] Seq=136588 Ack=9240 Win=15 Len=0 TSval=1127932537 TSecr=1457735875"
"325","49.078061","100.86.121.59","172.66.164.67","TLSv1.2","841","Application Data"
"326","49.078292","100.86.121.59","172.66.164.67","TLSv1.2","982","Application Data"
"327","49.078409","100.86.121.59","172.66.164.67","TLSv1.2","195","Application Data"
"328","49.078530","100.86.121.59","172.66.164.67","TLSv1.2","192","Application Data"
"329","49.078603","100.86.121.59","172.66.164.67","TLSv1.2","191","Application Data"
"330","49.113714","172.66.164.67","100.86.121.59","TLSv1.2","128","Application Data"
"331","49.113716","172.66.164.67","100.86.121.59","TLSv1.2","139","Application Data, Application Data"
"332","49.113837","100.86.121.59","172.66.164.67","TCP","66","54412  >  443 [ACK] Seq=11311 Ack=136723 Win=2046 Len=0 TSval=1457735943 TSecr=1127932558"
"333","49.152678","172.66.164.67","100.86.121.59","TCP","66","443  >  54412 [ACK] Seq=136723 Ack=10931 Win=15 Len=0 TSval=1127932600 TSecr=1457735908"
"334","49.161176","100.86.121.59","172.66.164.67","TCP","446","[TCP Retransmission] 54412  >  443 [PSH, ACK] Seq=10931 Ack=136723 Win=2048 Len=380 TSval=1457735991 TSecr=1127932600"
"335","49.163461","172.66.164.67","100.86.121.59","TLSv1.2","127","Application Data"
"336","49.163463","172.66.164.67","100.86.121.59","TLSv1.2","290","Application Data"
"337","49.163464","172.66.164.67","100.86.121.59","TLSv1.2","97","Application Data"
"338","49.163465","172.66.164.67","100.86.121.59","TLSv1.2","127","Application Data"
"339","49.163465","172.66.164.67","100.86.121.59","TLSv1.2","290","Application Data"
"340","49.163466","172.66.164.67","100.86.121.59","TLSv1.2","97","Application Data"
"341","49.163467","172.66.164.67","100.86.121.59","TLSv1.2","127","Application Data"
"342","49.163468","172.66.164.67","100.86.121.59","TLSv1.2","290","Application Data"
"343","49.163469","172.66.164.67","100.86.121.59","TLSv1.2","97","Application Data"
"344","49.163471","172.66.164.67","100.86.121.59","TLSv1.2","128","Application Data"
"345","49.163472","172.66.164.67","100.86.121.59","TLSv1.2","290","Application Data"
"346","49.163473","172.66.164.67","100.86.121.59","TLSv1.2","97","Application Data"
"347","49.163474","172.66.164.67","100.86.121.59","TLSv1.2","128","Application Data"
"348","49.163474","172.66.164.67","100.86.121.59","TLSv1.2","290","Application Data"
"349","49.163571","100.86.121.59","172.66.164.67","TCP","66","54412  >  443 [ACK] Seq=11311 Ack=138274 Win=2024 Len=0 TSval=1457735993 TSecr=1127932624"
"350","49.165702","172.66.164.67","100.86.121.59","TLSv1.2","97","Application Data"
"351","49.165830","100.86.121.59","172.66.164.67","TCP","66","54412  >  443 [ACK] Seq=11311 Ack=138305 Win=2048 Len=0 TSval=1457735995 TSecr=1127932624"
"352","49.212687","172.66.164.67","100.86.121.59","TCP","78","[TCP Dup ACK 335#1] 443  >  54412 [ACK] Seq=138305 Ack=11311 Win=15 Len=0 TSval=1127932672 TSecr=1457735995 SLE=10931 SRE=11311"
"353","54.179887","100.86.121.59","172.66.164.67","TLSv1.2","190","Application Data"
"354","54.180321","100.86.121.59","172.66.164.67","TLSv1.2","190","Application Data"
"355","54.180633","100.86.121.59","172.66.164.67","TLSv1.2","192","Application Data"
"356","54.193225","172.66.164.67","100.86.121.59","TCP","66","443  >  54412 [ACK] Seq=138305 Ack=11685 Win=15 Len=0 TSval=1127937675 TSecr=1457741010"
"357","54.212674","172.66.164.67","100.86.121.59","TLSv1.2","255","Application Data"
"358","54.212677","172.66.164.67","100.86.121.59","TLSv1.2","290","Application Data"
"359","54.212680","172.66.164.67","100.86.121.59","TLSv1.2","97","Application Data"
"360","54.212884","100.86.121.59","172.66.164.67","TCP","66","54412  >  443 [ACK] Seq=11685 Ack=138749 Win=2042 Len=0 TSval=1457741042 TSecr=1127937694"
"361","54.212914","172.66.164.67","100.86.121.59","TLSv1.2","127","Application Data"
"362","54.213033","100.86.121.59","172.66.164.67","TCP","66","54412  >  443 [ACK] Seq=11685 Ack=138810 Win=2042 Len=0 TSval=1457741042 TSecr=1127937695"
"363","54.213133","172.66.164.67","100.86.121.59","TLSv1.2","290","Application Data"
"364","54.213136","172.66.164.67","100.86.121.59","TLSv1.2","97","Application Data"
"365","54.213196","100.86.121.59","172.66.164.67","TCP","66","54412  >  443 [ACK] Seq=11685 Ack=139065 Win=2045 Len=0 TSval=1457741043 TSecr=1127937695"
"366","54.214251","172.66.164.67","100.86.121.59","TLSv1.2","127","Application Data"
"367","54.214254","172.66.164.67","100.86.121.59","TLSv1.2","290","Application Data"
"368","54.214317","100.86.121.59","172.66.164.67","TCP","66","54412  >  443 [ACK] Seq=11685 Ack=139350 Win=2044 Len=0 TSval=1457741044 TSecr=1127937696"
"369","54.214595","172.66.164.67","100.86.121.59","TLSv1.2","97","Application Data"
"370","54.214636","100.86.121.59","172.66.164.67","TCP","66","54412  >  443 [ACK] Seq=11685 Ack=139381 Win=2048 Len=0 TSval=1457741044 TSecr=1127937696"
"371","54.215493","100.86.121.59","172.66.164.67","TLSv1.2","101","Application Data"
"372","54.266916","172.66.164.67","100.86.121.59","TCP","66","443  >  54412 [ACK] Seq=139381 Ack=11720 Win=15 Len=0 TSval=1127937749 TSecr=1457741045"
"373","59.178004","100.86.121.59","172.66.164.67","TLSv1.2","193","Application Data"
"374","59.178395","100.86.121.59","172.66.164.67","TLSv1.2","189","Application Data"
"375","59.191372","172.66.164.67","100.86.121.59","TCP","66","443  >  54412 [ACK] Seq=139381 Ack=11970 Win=15 Len=0 TSval=1127942673 TSecr=1457746008"
"376","59.212090","172.66.164.67","100.86.121.59","TLSv1.2","150","Application Data"
"377","59.212095","172.66.164.67","100.86.121.59","TLSv1.2","290","Application Data"
"378","59.212097","172.66.164.67","100.86.121.59","TLSv1.2","97","Application Data"
"379","59.212321","100.86.121.59","172.66.164.67","TCP","66","54412  >  443 [ACK] Seq=11970 Ack=139720 Win=2043 Len=0 TSval=1457746042 TSecr=1127942693"
"380","59.212678","172.66.164.67","100.86.121.59","TLSv1.2","127","Application Data"
"381","59.212783","100.86.121.59","172.66.164.67","TCP","66","54412  >  443 [ACK] Seq=11970 Ack=139781 Win=2048 Len=0 TSval=1457746042 TSecr=1127942694"
"382","59.213142","172.66.164.67","100.86.121.59","TLSv1.2","290","Application Data"
"383","59.213145","172.66.164.67","100.86.121.59","TLSv1.2","97","Application Data"
"384","59.213235","100.86.121.59","172.66.164.67","TCP","66","54412  >  443 [ACK] Seq=11970 Ack=140036 Win=2045 Len=0 TSval=1457746043 TSecr=1127942694"
"385","59.216378","100.86.121.59","172.66.164.67","TLSv1.2","101","Application Data"
"386","59.269960","172.66.164.67","100.86.121.59","TCP","66","443  >  54412 [ACK] Seq=140036 Ack=12005 Win=15 Len=0 TSval=1127942752 TSecr=1457746046"
