"No.","Time","Source","Destination","Protocol","Length","Info"
"1","0.000000","100.86.121.59","172.66.164.67","TCP","78","53561  >  443 [SYN, ECE, CWR] Seq=0 Win=65535 Len=0 MSS=1460 WS=64 TSval=2120826233 TSecr=0 SACK_PERM"
"2","0.014027","172.66.164.67","100.86.121.59","TCP","74","443  >  53561 [SYN, ACK, ECE] Seq=0 Ack=1 Win=65535 Len=0 MSS=1400 SACK_PERM TSval=800539429 TSecr=2120826233 WS=8192"
"3","0.014279","100.86.121.59","172.66.164.67","TCP","66","53561  >  443 [ACK] Seq=1 Ack=1 Win=131904 Len=0 TSval=2120826247 TSecr=800539429"
"4","0.015174","100.86.121.59","172.66.164.67","TCP","1454","53561  >  443 [ACK] Seq=1 Ack=1 Win=131904 Len=1388 TSval=2120826248 TSecr=800539429 [TCP PDU reassembled in 5]"
"5","0.015207","100.86.121.59","172.66.164.67","TLSv1.3","416","Client Hello (SNI=www.colonialwilliamsburg.org)"
"6","0.025901","172.66.164.67","100.86.121.59","TCP","66","443  >  53561 [ACK] Seq=1 Ack=1739 Win=131072 Len=0 TSval=800539443 TSecr=2120826248"
"7","0.031732","172.66.164.67","100.86.121.59","TLSv1.3","1514","Server Hello, Change Cipher Spec"
"8","0.031736","172.66.164.67","100.86.121.59","TCP","1514","443  >  53561 [ACK] Seq=1449 Ack=1739 Win=131072 Len=1448 TSval=800539448 TSecr=2120826248 [TCP PDU reassembled in 10]"
"9","0.031904","100.86.121.59","172.66.164.67","TCP","66","53561  >  443 [ACK] Seq=1739 Ack=2897 Win=129024 Len=0 TSval=2120826265 TSecr=800539448"
"10","0.031910","172.66.164.67","100.86.121.59","TLSv1.3","644","Application Data"
"11","0.031966","100.86.121.59","172.66.164.67","TCP","66","53561  >  443 [ACK] Seq=1739 Ack=3475 Win=128448 Len=0 TSval=2120826265 TSecr=800539448"
"12","0.037080","100.86.121.59","172.66.164.67","TLSv1.3","130","Change Cipher Spec, Application Data"
"13","0.047147","172.66.164.67","100.86.121.59","TLSv1.3","578","Application Data, Application Data"
"14","0.047283","100.86.121.59","172.66.164.67","TCP","66","53561  >  443 [ACK] Seq=1803 Ack=3987 Win=130560 Len=0 TSval=2120826280 TSecr=800539464"
"15","0.084728","100.86.121.59","172.66.164.67","TCP","78","53562  >  443 [SYN, ECE, CWR] Seq=0 Win=65535 Len=0 MSS=1460 WS=64 TSval=1001388022 TSecr=0 SACK_PERM"
"16","0.097521","172.66.164.67","100.86.121.59","TCP","74","443  >  53562 [SYN, ACK, ECE] Seq=0 Ack=1 Win=65535 Len=0 MSS=1400 SACK_PERM TSval=1086885930 TSecr=1001388022 WS=8192"
"17","0.097642","100.86.121.59","172.66.164.67","TCP","66","53562  >  443 [ACK] Seq=1 Ack=1 Win=131904 Len=0 TSval=1001388034 TSecr=1086885930"
"18","0.097826","100.86.121.59","172.66.164.67","TCP","1454","53562  >  443 [ACK] Seq=1 Ack=1 Win=131904 Len=1388 TSval=1001388035 TSecr=1086885930 [TCP PDU reassembled in 19]"
"19","0.097832","100.86.121.59","172.66.164.67","TLSv1.3","448","Client Hello (SNI=www.colonialwilliamsburg.org)"
"20","0.108688","172.66.164.67","100.86.121.59","TCP","66","443  >  53562 [ACK] Seq=1 Ack=1771 Win=139264 Len=0 TSval=1086885943 TSecr=1001388035"
"21","0.114289","172.66.164.67","100.86.121.59","TLSv1.3","1514","Server Hello, Change Cipher Spec"
"22","0.114349","100.86.121.59","172.66.164.67","TCP","66","53562  >  443 [ACK] Seq=1771 Ack=1449 Win=130496 Len=0 TSval=1001388051 TSecr=1086885948"
"23","0.114762","172.66.164.67","100.86.121.59","TCP","1514","443  >  53562 [ACK] Seq=1449 Ack=1771 Win=139264 Len=1448 TSval=1086885948 TSecr=1001388035 [TCP PDU reassembled in 24]"
"24","0.114764","172.66.164.67","100.86.121.59","TLSv1.3","644","Application Data"
"25","0.114828","100.86.121.59","172.66.164.67","TCP","66","53562  >  443 [ACK] Seq=1771 Ack=3475 Win=129088 Len=0 TSval=1001388052 TSecr=1086885948"
"26","0.115094","100.86.121.59","172.66.164.67","TLSv1.3","130","Change Cipher Spec, Application Data"
"27","0.125191","172.66.164.67","100.86.121.59","TLSv1.3","578","Application Data, Application Data"
"28","0.125310","100.86.121.59","172.66.164.67","TCP","66","53562  >  443 [ACK] Seq=1835 Ack=3987 Win=130560 Len=0 TSval=1001388062 TSecr=1086885959"
"29","0.235592","100.86.121.59","172.66.164.67","TLSv1.3","158","Application Data"
"30","0.235774","100.86.121.59","172.66.164.67","TCP","1454","53561  >  443 [ACK] Seq=1895 Ack=3987 Win=131072 Len=1388 TSval=2120826469 TSecr=800539464 [TCP PDU reassembled in 31]"
"31","0.235785","100.86.121.59","172.66.164.67","TLSv1.3","442","Application Data"
"32","0.235859","100.86.121.59","172.66.164.67","TLSv1.3","97","Application Data"
"33","0.245222","172.66.164.67","100.86.121.59","TLSv1.3","97","Application Data"
"34","0.245329","100.86.121.59","172.66.164.67","TCP","66","53561  >  443 [ACK] Seq=3690 Ack=4018 Win=131072 Len=0 TSval=2120826478 TSecr=800539662"
"35","0.246104","172.66.164.67","100.86.121.59","TCP","66","443  >  53561 [ACK] Seq=4018 Ack=3690 Win=131072 Len=0 TSval=800539663 TSecr=2120826469"
"36","1.032214","172.66.164.67","100.86.121.59","TLSv1.3","444","Application Data"
"37","1.032221","172.66.164.67","100.86.121.59","TLSv1.3","1457","Application Data"
"38","1.032466","100.86.121.59","172.66.164.67","TCP","66","53561  >  443 [ACK] Seq=3690 Ack=5787 Win=129344 Len=0 TSval=2120827265 TSecr=800540449"
"39","1.032697","172.66.164.67","100.86.121.59","TLSv1.3","1514","Application Data"
"40","1.032701","172.66.164.67","100.86.121.59","TLSv1.3","1400","Application Data"
"41","1.032783","100.86.121.59","172.66.164.67","TCP","66","53561  >  443 [ACK] Seq=3690 Ack=8569 Win=128320 Len=0 TSval=2120827266 TSecr=800540449"
"42","1.033822","172.66.164.67","100.86.121.59","TLSv1.3","1514","Application Data"
"43","1.033825","172.66.164.67","100.86.121.59","TLSv1.3","1514","Application Data"
"44","1.033828","172.66.164.67","100.86.121.59","TLSv1.3","1514","Application Data"
"45","1.033832","172.66.164.67","100.86.121.59","TLSv1.3","1286","Application Data"
"46","1.033835","172.66.164.67","100.86.121.59","TLSv1.3","1514","Application Data"
"47","1.033837","172.66.164.67","100.86.121.59","TLSv1.3","1514","Application Data"
"48","1.033840","172.66.164.67","100.86.121.59","TLSv1.3","1514","Application Data"
"49","1.033842","172.66.164.67","100.86.121.59","TLSv1.3","1514","Application Data"
"50","1.033845","172.66.164.67","100.86.121.59","TLSv1.3","1229","Application Data"
"51","1.033848","172.66.164.67","100.86.121.59","TLSv1.3","1514","Application Data"
"52","1.033851","172.66.164.67","100.86.121.59","TLSv1.3","1514","Application Data"
"53","1.033854","172.66.164.67","100.86.121.59","TLSv1.3","1514","Application Data"
"54","1.033857","172.66.164.67","100.86.121.59","TLSv1.3","1514","Application Data"
"55","1.033860","172.66.164.67","100.86.121.59","TLSv1.3","1514","Application Data"
"56","1.033863","172.66.164.67","100.86.121.59","TLSv1.3","1172","Application Data"
"57","1.033977","100.86.121.59","172.66.164.67","TCP","66","53561  >  443 [ACK] Seq=3690 Ack=23984 Win=115712 Len=0 TSval=2120827267 TSecr=800540450"
"58","1.034018","100.86.121.59","172.66.164.67","TCP","66","53561  >  443 [ACK] Seq=3690 Ack=29434 Win=110272 Len=0 TSval=2120827267 TSecr=800540450"
"59","1.034409","172.66.164.67","100.86.121.59","TLSv1.3","1514","Application Data"
"60","1.034411","172.66.164.67","100.86.121.59","TLSv1.3","1514","Application Data"
"61","1.034414","172.66.164.67","100.86.121.59","TLSv1.3","1514","Application Data"
"62","1.034428","172.66.164.67","100.86.121.59","TLSv1.3","1514","Application Data"
"63","1.034432","172.66.164.67","100.86.121.59","TLSv1.3","1514","Application Data"
"64","1.034434","172.66.164.67","100.86.121.59","TLSv1.3","1514","Application Data"
"65","1.034436","172.66.164.67","100.86.121.59","TLSv1.3","1235","Application Data, Application Data, Application Data"
"66","1.034496","100.86.121.59","172.66.164.67","TCP","66","53561  >  443 [ACK] Seq=3690 Ack=39291 Win=117760 Len=0 TSval=2120827267 TSecr=800540450"
"67","1.034616","100.86.121.59","172.66.164.67","TCP","66","[TCP Window Update] 53561  >  443 [ACK] Seq=3690 Ack=39291 Win=131072 Len=0 TSval=2120827267 TSecr=800540450"
"68","1.063897","100.86.121.59","172.66.164.67","TLSv1.3","465","Application Data"
"69","1.064307","100.86.121.59","172.66.164.67","TLSv1.3","168","Application Data"
"70","1.074626","172.66.164.67","100.86.121.59","TCP","66","443  >  53561 [ACK] Seq=39291 Ack=4191 Win=131072 Len=0 TSval=800540492 TSecr=2120827297"
"71","1.088604","100.86.121.59","172.66.164.67","TLSv1.3","182","Application Data"
"72","1.092685","172.66.164.67","100.86.121.59","TLSv1.3","349","Application Data"
"73","1.092715","100.86.121.59","172.66.164.67","TLSv1.3","179","Application Data"
"74","1.092753","100.86.121.59","172.66.164.67","TCP","66","53561  >  443 [ACK] Seq=4420 Ack=39574 Win=133568 Len=0 TSval=2120827326 TSecr=800540510"
"75","1.093051","172.66.164.67","100.86.121.59","TLSv1.3","1457","Application Data"
"76","1.093052","172.66.164.67","100.86.121.59","TLSv1.3","1514","Application Data"
"77","1.093054","172.66.164.67","100.86.121.59","TLSv1.3","1400","Application Data"
"78","1.093093","100.86.121.59","172.66.164.67","TCP","66","53561  >  443 [ACK] Seq=4420 Ack=43747 Win=129408 Len=0 TSval=2120827326 TSecr=800540510"
"79","1.093626","100.86.121.59","172.66.164.67","TCP","66","[TCP Window Update] 53561  >  443 [ACK] Seq=4420 Ack=43747 Win=133888 Len=0 TSval=2120827326 TSecr=800540510"
"80","1.095352","172.66.164.67","100.86.121.59","TLSv1.3","1514","Application Data"
"81","1.095354","172.66.164.67","100.86.121.59","TLSv1.3","1514","Application Data"
"82","1.095356","172.66.164.67","100.86.121.59","TLSv1.3","1514","Application Data"
"83","1.095357","172.66.164.67","100.86.121.59","TLSv1.3","1514","Application Data"
"84","1.095411","100.86.121.59","172.66.164.67","TCP","66","53561  >  443 [ACK] Seq=4420 Ack=49539 Win=128128 Len=0 TSval=2120827328 TSecr=800540510"
"85","1.095440","100.86.121.59","172.66.164.67","TCP","66","[TCP Window Update] 53561  >  443 [ACK] Seq=4420 Ack=49539 Win=133888 Len=0 TSval=2120827328 TSecr=800540510"
"86","1.097283","172.66.164.67","100.86.121.59","TLSv1.3","1229","Application Data"
"87","1.097284","172.66.164.67","100.86.121.59","TLSv1.3","1514","Application Data"
"88","1.097285","172.66.164.67","100.86.121.59","TLSv1.3","1514","Application Data"
"89","1.097287","172.66.164.67","100.86.121.59","TCP","1514","443  >  53561 [ACK] Seq=53598 Ack=4191 Win=131072 Len=1448 TSval=800540510 TSecr=2120827297 [TCP PDU reassembled in 91]"
"90","1.097288","172.66.164.67","100.86.121.59","TCP","1514","443  >  53561 [ACK] Seq=55046 Ack=4191 Win=131072 Len=1448 TSval=800540510 TSecr=2120827297 [TCP PDU reassembled in 91]"
"91","1.097289","172.66.164.67","100.86.121.59","TLSv1.3","1514","Application Data"
"92","1.097290","172.66.164.67","100.86.121.59","TCP","1514","443  >  53561 [ACK] Seq=57942 Ack=4191 Win=131072 Len=1448 TSval=800540510 TSecr=2120827297 [TCP PDU reassembled in 94]"
"93","1.097292","172.66.164.67","100.86.121.59","TCP","1514","443  >  53561 [ACK] Seq=59390 Ack=4191 Win=131072 Len=1448 TSval=800540510 TSecr=2120827297 [TCP PDU reassembled in 94]"
"94","1.097293","172.66.164.67","100.86.121.59","TLSv1.3","1514","Application Data"
"95","1.097295","172.66.164.67","100.86.121.59","TCP","1514","443  >  53561 [ACK] Seq=62286 Ack=4191 Win=131072 Len=1448 TSval=800540510 TSecr=2120827297 [TCP PDU reassembled in 96]"
"96","1.097296","172.66.164.67","100.86.121.59","TLSv1.3","1514","Application Data"
"97","1.097299","172.66.164.67","100.86.121.59","TCP","1514","443  >  53561 [ACK] Seq=65182 Ack=4191 Win=131072 Len=1448 TSval=800540511 TSecr=2120827297 [TCP PDU reassembled in 99]"
"98","1.097300","172.66.164.67","100.86.121.59","TCP","1514","443  >  53561 [ACK] Seq=66630 Ack=4191 Win=131072 Len=1448 TSval=800540511 TSecr=2120827297 [TCP PDU reassembled in 99]"
"99","1.097301","172.66.164.67","100.86.121.59","TLSv1.3","1514","Application Data"
"100","1.097302","172.66.164.67","100.86.121.59","TCP","1514","443  >  53561 [ACK] Seq=69526 Ack=4191 Win=131072 Len=1448 TSval=800540511 TSecr=2120827297 [TCP PDU reassembled in 127]"
"101","1.097304","172.66.164.67","100.86.121.59","TCP","1514","[TCP Previous segment not captured] 443  >  53561 [ACK] Seq=72422 Ack=4191 Win=131072 Len=1448 TSval=800540511 TSecr=2120827297 [TCP PDU reassembled in 127]"
"102","1.097305","172.66.164.67","100.86.121.59","TCP","1514","443  >  53561 [ACK] Seq=73870 Ack=4191 Win=131072 Len=1448 TSval=800540511 TSecr=2120827297 [TCP PDU reassembled in 104]"
"103","1.097306","172.66.164.67","100.86.121.59","TCP","1514","443  >  53561 [ACK] Seq=75318 Ack=4191 Win=131072 Len=1448 TSval=800540511 TSecr=2120827297 [TCP PDU reassembled in 104]"
"104","1.097307","172.66.164.67","100.86.121.59","TLSv1.3","1514","Application Data"
"105","1.097309","172.66.164.67","100.86.121.59","TCP","1514","443  >  53561 [PSH, ACK] Seq=78214 Ack=4191 Win=131072 Len=1448 TSval=800540511 TSecr=2120827297 [TCP PDU reassembled in 107]"
"106","1.097310","172.66.164.67","100.86.121.59","TCP","1514","443  >  53561 [ACK] Seq=79662 Ack=4191 Win=131072 Len=1448 TSval=800540512 TSecr=2120827297 [TCP PDU reassembled in 107]"
"107","1.097312","172.66.164.67","100.86.121.59","TLSv1.3","1514","Application Data"
"108","1.097313","172.66.164.67","100.86.121.59","TLSv1.3","361","Application Data, Application Data"
"109","1.097314","172.66.164.67","100.86.121.59","TLSv1.3","1514","Application Data"
"110","1.097315","172.66.164.67","100.86.121.59","TCP","1514","443  >  53561 [ACK] Seq=84301 Ack=4191 Win=131072 Len=1448 TSval=800540513 TSecr=2120827297 [TCP PDU reassembled in 111]"
"111","1.097316","172.66.164.67","100.86.121.59","TLSv1.3","1513","Application Data"
"112","1.097318","172.66.164.67","100.86.121.59","TCP","1514","443  >  53561 [ACK] Seq=87196 Ack=4191 Win=131072 Len=1448 TSval=800540513 TSecr=2120827297 [TCP PDU reassembled in 119]"
"113","1.097319","172.66.164.67","100.86.121.59","TCP","1514","443  >  53561 [ACK] Seq=88644 Ack=4191 Win=131072 Len=1448 TSval=800540513 TSecr=2120827297 [TCP PDU reassembled in 119]"
"114","1.097419","100.86.121.59","172.66.164.67","TCP","66","53561  >  443 [ACK] Seq=4420 Ack=65182 Win=118272 Len=0 TSval=2120827330 TSecr=800540510"
"115","1.097440","100.86.121.59","172.66.164.67","TCP","66","53561  >  443 [ACK] Seq=4420 Ack=70974 Win=112512 Len=0 TSval=2120827330 TSecr=800540511"
"116","1.097453","100.86.121.59","172.66.164.67","TCP","78","[TCP Dup ACK 115#1] 53561  >  443 [ACK] Seq=4420 Ack=70974 Win=112512 Len=0 TSval=2120827330 TSecr=800540511 SLE=72422 SRE=88644"
"117","1.097459","100.86.121.59","172.66.164.67","TCP","78","[TCP Dup ACK 115#2] 53561  >  443 [ACK] Seq=4420 Ack=70974 Win=112512 Len=0 TSval=2120827330 TSecr=800540511 SLE=72422 SRE=90092"
"118","1.097718","100.86.121.59","172.66.164.67","TCP","78","[TCP Dup ACK 115#3] 53561  >  443 [ACK] Seq=4420 Ack=70974 Win=133888 Len=0 TSval=2120827331 TSecr=800540511 SLE=72422 SRE=90092"
"119","1.098567","172.66.164.67","100.86.121.59","TLSv1.3","1514","Application Data"
"120","1.098568","172.66.164.67","100.86.121.59","TCP","1514","443  >  53561 [ACK] Seq=91540 Ack=4191 Win=131072 Len=1448 TSval=800540513 TSecr=2120827297 [TCP PDU reassembled in 122]"
"121","1.098569","172.66.164.67","100.86.121.59","TCP","1514","443  >  53561 [ACK] Seq=92988 Ack=4191 Win=131072 Len=1448 TSval=800540513 TSecr=2120827297 [TCP PDU reassembled in 122]"
"122","1.098570","172.66.164.67","100.86.121.59","TLSv1.3","1514","Application Data"
"123","1.098571","172.66.164.67","100.86.121.59","TLSv1.3","244","Application Data"
"124","1.098572","172.66.164.67","100.86.121.59","TLSv1.3","97","Application Data"
"125","1.098615","100.86.121.59","172.66.164.67","TCP","78","[TCP Dup ACK 115#4] 53561  >  443 [ACK] Seq=4420 Ack=70974 Win=133888 Len=0 TSval=2120827331 TSecr=800540511 SLE=72422 SRE=96093"
"126","1.103962","172.66.164.67","100.86.121.59","TCP","66","443  >  53561 [ACK] Seq=96093 Ack=4420 Win=131072 Len=0 TSval=800540521 TSecr=2120827321"
"127","1.108131","172.66.164.67","100.86.121.59","TLSv1.3","1514","[TCP Fast Retransmission] , Application Data"
"128","1.108176","100.86.121.59","172.66.164.67","TCP","66","53561  >  443 [ACK] Seq=4420 Ack=96093 Win=200384 Len=0 TSval=2120827341 TSecr=800540525"
"129","1.108887","100.86.121.59","172.66.164.67","TCP","66","[TCP Window Update] 53561  >  443 [ACK] Seq=4420 Ack=96093 Win=225472 Len=0 TSval=2120827342 TSecr=800540525"
"130","1.109773","172.66.164.67","100.86.121.59","TLSv1.3","261","Application Data"
"131","1.109827","100.86.121.59","172.66.164.67","TCP","66","53561  >  443 [ACK] Seq=4420 Ack=96288 Win=225280 Len=0 TSval=2120827343 TSecr=800540527"
"132","1.109942","172.66.164.67","100.86.121.59","TCP","1514","443  >  53561 [ACK] Seq=96288 Ack=4420 Win=131072 Len=1448 TSval=800540527 TSecr=2120827331 [TCP PDU reassembled in 133]"
"133","1.109943","172.66.164.67","100.86.121.59","TLSv1.3","295","Application Data"
"134","1.109973","100.86.121.59","172.66.164.67","TCP","66","53561  >  443 [ACK] Seq=4420 Ack=97965 Win=223616 Len=0 TSval=2120827343 TSecr=800540527"
"135","1.110059","172.66.164.67","100.86.121.59","TLSv1.3","97","Application Data"
"136","1.110075","100.86.121.59","172.66.164.67","TCP","66","53561  >  443 [ACK] Seq=4420 Ack=97996 Win=223616 Len=0 TSval=2120827343 TSecr=800540527"
"137","1.119795","172.66.164.67","100.86.121.59","TLSv1.3","156","Application Data"
"138","1.119796","172.66.164.67","100.86.121.59","TLSv1.3","456","Application Data"
"139","1.119836","100.86.121.59","172.66.164.67","TCP","66","53561  >  443 [ACK] Seq=4420 Ack=98476 Win=225024 Len=0 TSval=2120827353 TSecr=800540537"
"140","1.119933","172.66.164.67","100.86.121.59","TLSv1.3","97","Application Data"
"141","1.119954","100.86.121.59","172.66.164.67","TCP","66","53561  >  443 [ACK] Seq=4420 Ack=98507 Win=225472 Len=0 TSval=2120827353 TSecr=800540537"
"142","1.160983","100.86.121.59","172.66.164.67","TLSv1.3","193","Application Data"
"143","1.161088","100.86.121.59","172.66.164.67","TLSv1.3","180","Application Data"
"144","1.171461","100.86.121.59","172.66.164.67","TLSv1.3","183","Application Data"
"145","1.171490","100.86.121.59","172.66.164.67","TLSv1.3","177","Application Data"
"146","1.171496","172.66.164.67","100.86.121.59","TCP","66","443  >  53561 [ACK] Seq=98507 Ack=4661 Win=131072 Len=0 TSval=800540588 TSecr=2120827394"
"147","1.171985","100.86.121.59","172.66.164.67","TLSv1.3","160","Application Data"
"148","1.172083","100.86.121.59","172.66.164.67","TLSv1.3","168","Application Data"
"149","1.176508","100.86.121.59","172.66.164.67","TLSv1.3","278","Application Data"
"150","1.181422","172.66.164.67","100.86.121.59","TCP","66","443  >  53561 [ACK] Seq=98507 Ack=4889 Win=131072 Len=0 TSval=800540599 TSecr=2120827404"
"151","1.183133","172.66.164.67","100.86.121.59","TLSv1.3","260","Application Data"
"152","1.183135","172.66.164.67","100.86.121.59","TLSv1.3","879","Application Data"
"153","1.183220","100.86.121.59","172.66.164.67","TCP","66","53561  >  443 [ACK] Seq=5297 Ack=99514 Win=224512 Len=0 TSval=2120827416 TSecr=800540600"
"154","1.183501","172.66.164.67","100.86.121.59","TLSv1.3","97","Application Data"
"155","1.183544","100.86.121.59","172.66.164.67","TCP","66","53561  >  443 [ACK] Seq=5297 Ack=99545 Win=225472 Len=0 TSval=2120827416 TSecr=800540600"
"156","1.188105","172.66.164.67","100.86.121.59","TLSv1.3","180","Application Data"
"157","1.188106","172.66.164.67","100.86.121.59","TLSv1.3","801","Application Data"
"158","1.188170","100.86.121.59","172.66.164.67","TCP","66","53561  >  443 [ACK] Seq=5297 Ack=100394 Win=224640 Len=0 TSval=2120827421 TSecr=800540605"
"159","1.188244","172.66.164.67","100.86.121.59","TLSv1.3","97","Application Data"
"160","1.188298","100.86.121.59","172.66.164.67","TCP","66","53561  >  443 [ACK] Seq=5297 Ack=100425 Win=225472 Len=0 TSval=2120827421 TSecr=800540605"
"161","1.192962","172.66.164.67","100.86.121.59","TLSv1.3","258","Application Data"
"162","1.192964","172.66.164.67","100.86.121.59","TCP","1514","443  >  53561 [ACK] Seq=100617 Ack=5297 Win=131072 Len=1448 TSval=800540608 TSecr=2120827409 [TCP PDU reassembled in 163]"
"163","1.192965","172.66.164.67","100.86.121.59","TLSv1.3","1500","Application Data"
"164","1.193046","100.86.121.59","172.66.164.67","TCP","66","53561  >  443 [ACK] Seq=5297 Ack=103499 Win=222400 Len=0 TSval=2120827426 TSecr=800540608"
"165","1.193122","100.86.121.59","172.66.164.67","TCP","66","[TCP Window Update] 53561  >  443 [ACK] Seq=5297 Ack=103499 Win=225472 Len=0 TSval=2120827426 TSecr=800540608"
"166","1.193322","172.66.164.67","100.86.121.59","TLSv1.3","97","Application Data"
"167","1.193324","172.66.164.67","100.86.121.59","TLSv1.3","157","Application Data"
"168","1.193325","172.66.164.67","100.86.121.59","TLSv1.3","512","Application Data"
"169","1.193362","100.86.121.59","172.66.164.67","TCP","66","53561  >  443 [ACK] Seq=5297 Ack=104067 Win=224960 Len=0 TSval=2120827426 TSecr=800540610"
"170","1.194145","172.66.164.67","100.86.121.59","TLSv1.3","97","Application Data"
"171","1.194147","172.66.164.67","100.86.121.59","TLSv1.3","237","Application Data"
"172","1.194185","100.86.121.59","172.66.164.67","TCP","66","53561  >  443 [ACK] Seq=5297 Ack=104269 Win=225280 Len=0 TSval=2120827427 TSecr=800540610"
"173","1.194516","172.66.164.67","100.86.121.59","TLSv1.3","345","Application Data"
"174","1.194538","100.86.121.59","172.66.164.67","TCP","66","53561  >  443 [ACK] Seq=5297 Ack=104548 Win=225024 Len=0 TSval=2120827427 TSecr=800540610"
"175","1.195668","172.66.164.67","100.86.121.59","TLSv1.3","97","Application Data"
"176","1.195670","172.66.164.67","100.86.121.59","TLSv1.3","165","Application Data"
"177","1.195671","172.66.164.67","100.86.121.59","TCP","1514","443  >  53561 [ACK] Seq=104678 Ack=5297 Win=131072 Len=1448 TSval=800540611 TSecr=2120827416 [TCP PDU reassembled in 179]"
"178","1.195672","172.66.164.67","100.86.121.59","TCP","1514","443  >  53561 [ACK] Seq=106126 Ack=5297 Win=131072 Len=1448 TSval=800540611 TSecr=2120827416 [TCP PDU reassembled in 179]"
"179","1.195674","172.66.164.67","100.86.121.59","TLSv1.3","1421","Application Data"
"180","1.195675","172.66.164.67","100.86.121.59","TLSv1.3","724","Application Data, Application Data"
"181","1.195741","100.86.121.59","172.66.164.67","TCP","66","53561  >  443 [ACK] Seq=5297 Ack=109587 Win=220480 Len=0 TSval=2120827429 TSecr=800540611"
"182","1.196120","100.86.121.59","172.66.164.67","TCP","66","[TCP Window Update] 53561  >  443 [ACK] Seq=5297 Ack=109587 Win=225472 Len=0 TSval=2120827429 TSecr=800540611"
"183","1.201370","172.66.164.67","100.86.121.59","TLSv1.3","256","Application Data"
"184","1.201372","172.66.164.67","100.86.121.59","TLSv1.3","518","Application Data"
"185","1.201443","100.86.121.59","172.66.164.67","TCP","66","53561  >  443 [ACK] Seq=5297 Ack=110229 Win=224832 Len=0 TSval=2120827434 TSecr=800540618"
"186","1.201457","172.66.164.67","100.86.121.59","TLSv1.3","97","Application Data"
"187","1.201492","100.86.121.59","172.66.164.67","TCP","66","53561  >  443 [ACK] Seq=5297 Ack=110260 Win=224832 Len=0 TSval=2120827434 TSecr=800540618"
"188","1.208011","100.86.121.59","172.66.164.67","TLSv1.3","163","Application Data"
"189","1.221848","100.86.121.59","172.66.164.67","TLSv1.3","185","Application Data"
"190","1.226771","100.86.121.59","172.66.164.67","TLSv1.3","151","Application Data"
"191","1.226870","100.86.121.59","172.66.164.67","TLSv1.3","233","Application Data"
"192","1.235718","172.66.164.67","100.86.121.59","TCP","66","443  >  53561 [ACK] Seq=110260 Ack=5513 Win=131072 Len=0 TSval=800540651 TSecr=2120827441"
"193","1.238376","172.66.164.67","100.86.121.59","TLSv1.3","185","Application Data"
"194","1.238377","172.66.164.67","100.86.121.59","TLSv1.3","108","Application Data"
"195","1.238442","100.86.121.59","172.66.164.67","TCP","66","53561  >  443 [ACK] Seq=5765 Ack=110421 Win=225344 Len=0 TSval=2120827471 TSecr=800540655"
"196","1.238505","172.66.164.67","100.86.121.59","TLSv1.3","97","Application Data"
"197","1.238506","172.66.164.67","100.86.121.59","TLSv1.3","229","Application Data"
"198","1.238654","100.86.121.59","172.66.164.67","TCP","66","53561  >  443 [ACK] Seq=5765 Ack=110615 Win=225472 Len=0 TSval=2120827471 TSecr=800540655"
"199","1.250717","100.86.121.59","172.66.164.67","TLSv1.3","418","Application Data"
"200","1.250821","100.86.121.59","172.66.164.67","TLSv1.3","194","Application Data"
"201","1.250924","100.86.121.59","172.66.164.67","TLSv1.3","1211","Application Data"
"202","1.251029","100.86.121.59","172.66.164.67","TLSv1.3","508","Application Data"
"203","1.251099","100.86.121.59","172.66.164.67","TLSv1.3","194","Application Data"
"204","1.258568","172.66.164.67","100.86.121.59","TLSv1.3","263","Application Data"
"205","1.258634","100.86.121.59","172.66.164.67","TCP","66","53561  >  443 [ACK] Seq=7960 Ack=110812 Win=225280 Len=0 TSval=2120827491 TSecr=800540672"
"206","1.269072","172.66.164.67","100.86.121.59","TCP","66","443  >  53561 [ACK] Seq=110812 Ack=7390 Win=131072 Len=0 TSval=800540681 TSecr=2120827484"
"207","1.272091","172.66.164.67","100.86.121.59","TLSv1.3","226","Application Data"
"208","1.272230","100.86.121.59","172.66.164.67","TCP","66","53561  >  443 [ACK] Seq=7960 Ack=110972 Win=225344 Len=0 TSval=2120827505 TSecr=800540689"
"209","1.289009","172.66.164.67","100.86.121.59","TLSv1.3","157","Application Data"
"210","1.289010","172.66.164.67","100.86.121.59","TLSv1.3","290","Application Data"
"211","1.289012","172.66.164.67","100.86.121.59","TLSv1.3","97","Application Data"
"212","1.289013","172.66.164.67","100.86.121.59","TLSv1.3","150","Application Data"
"213","1.289017","172.66.164.67","100.86.121.59","TLSv1.3","290","Application Data"
"214","1.289018","172.66.164.67","100.86.121.59","TLSv1.3","97","Application Data"
"215","1.289019","172.66.164.67","100.86.121.59","TLSv1.3","127","Application Data"
"216","1.289021","172.66.164.67","100.86.121.59","TLSv1.3","290","Application Data"
"217","1.289022","172.66.164.67","100.86.121.59","TLSv1.3","97","Application Data"
"218","1.289024","172.66.164.67","100.86.121.59","TLSv1.3","127","Application Data"
"219","1.289025","172.66.164.67","100.86.121.59","TLSv1.3","290","Application Data"
"220","1.289026","172.66.164.67","100.86.121.59","TLSv1.3","97","Application Data"
"221","1.289110","100.86.121.59","172.66.164.67","TCP","66","53561  >  443 [ACK] Seq=7960 Ack=112289 Win=225472 Len=0 TSval=2120827522 TSecr=800540704"
"222","1.290218","172.66.164.67","100.86.121.59","TLSv1.3","127","Application Data"
"223","1.290219","172.66.164.67","100.86.121.59","TLSv1.3","290","Application Data"
"224","1.290220","172.66.164.67","100.86.121.59","TLSv1.3","97","Application Data"
"225","1.290297","100.86.121.59","172.66.164.67","TCP","66","53561  >  443 [ACK] Seq=7960 Ack=112605 Win=225472 Len=0 TSval=2120827523 TSecr=800540704"
"226","1.380720","100.86.121.59","172.66.164.67","TLSv1.3","303","Application Data"
"227","1.380753","100.86.121.59","172.66.164.67","TCP","1454","53561  >  443 [ACK] Seq=8197 Ack=112605 Win=225472 Len=1388 TSval=2120827614 TSecr=800540704 [TCP PDU reassembled in 238]"
"228","1.380754","100.86.121.59","172.66.164.67","TCP","1454","53561  >  443 [ACK] Seq=9585 Ack=112605 Win=225472 Len=1388 TSval=2120827614 TSecr=800540704 [TCP PDU reassembled in 238]"
"229","1.380754","100.86.121.59","172.66.164.67","TCP","1454","53561  >  443 [ACK] Seq=10973 Ack=112605 Win=225472 Len=1388 TSval=2120827614 TSecr=800540704 [TCP PDU reassembled in 238]"
"230","1.380755","100.86.121.59","172.66.164.67","TCP","1454","53561  >  443 [ACK] Seq=12361 Ack=112605 Win=225472 Len=1388 TSval=2120827614 TSecr=800540704 [TCP PDU reassembled in 238]"
"231","1.380755","100.86.121.59","172.66.164.67","TCP","1454","53561  >  443 [ACK] Seq=13749 Ack=112605 Win=225472 Len=1388 TSval=2120827614 TSecr=800540704 [TCP PDU reassembled in 238]"
"232","1.380756","100.86.121.59","172.66.164.67","TCP","1454","53561  >  443 [ACK] Seq=15137 Ack=112605 Win=225472 Len=1388 TSval=2120827614 TSecr=800540704 [TCP PDU reassembled in 238]"
"233","1.380756","100.86.121.59","172.66.164.67","TCP","1454","53561  >  443 [ACK] Seq=16525 Ack=112605 Win=225472 Len=1388 TSval=2120827614 TSecr=800540704 [TCP PDU reassembled in 238]"
"234","1.380757","100.86.121.59","172.66.164.67","TCP","1454","53561  >  443 [ACK] Seq=17913 Ack=112605 Win=225472 Len=1388 TSval=2120827614 TSecr=800540704 [TCP PDU reassembled in 238]"
"235","1.380757","100.86.121.59","172.66.164.67","TCP","1454","53561  >  443 [ACK] Seq=19301 Ack=112605 Win=225472 Len=1388 TSval=2120827614 TSecr=800540704 [TCP PDU reassembled in 238]"
"236","1.380758","100.86.121.59","172.66.164.67","TCP","1454","53561  >  443 [ACK] Seq=20689 Ack=112605 Win=225472 Len=1388 TSval=2120827614 TSecr=800540704 [TCP PDU reassembled in 238]"
"237","1.380758","100.86.121.59","172.66.164.67","TCP","1454","53561  >  443 [ACK] Seq=22077 Ack=112605 Win=225472 Len=1388 TSval=2120827614 TSecr=800540704 [TCP PDU reassembled in 238]"
"238","1.380761","100.86.121.59","172.66.164.67","TLSv1.3","1204","Application Data"
"239","1.380769","100.86.121.59","172.66.164.67","TLSv1.3","1398","Application Data"
"240","1.380863","100.86.121.59","172.66.164.67","TLSv1.3","179","Application Data"
"241","1.380966","100.86.121.59","172.66.164.67","TLSv1.3","147","Application Data"
"242","1.395740","172.66.164.67","100.86.121.59","TCP","66","443  >  53561 [ACK] Seq=112605 Ack=22077 Win=122880 Len=0 TSval=800540810 TSecr=2120827614"
"243","1.396284","172.66.164.67","100.86.121.59","TLSv1.3","101","Application Data"
"244","1.396317","100.86.121.59","172.66.164.67","TCP","66","53561  >  443 [ACK] Seq=26129 Ack=112640 Win=225472 Len=0 TSval=2120827629 TSecr=800540811"
"245","1.401909","172.66.164.67","100.86.121.59","TLSv1.3","662","Application Data"
"246","1.401998","100.86.121.59","172.66.164.67","TCP","66","53561  >  443 [ACK] Seq=26129 Ack=113236 Win=225472 Len=0 TSval=2120827635 TSecr=800540819"
"247","1.412770","172.66.164.67","100.86.121.59","TLSv1.3","315","Application Data"
"248","1.412771","172.66.164.67","100.86.121.59","TLSv1.3","335","Application Data"
"249","1.412772","172.66.164.67","100.86.121.59","TLSv1.3","97","Application Data"
"250","1.412773","172.66.164.67","100.86.121.59","TLSv1.3","248","Application Data"
"251","1.412934","100.86.121.59","172.66.164.67","TCP","66","53561  >  443 [ACK] Seq=26129 Ack=113967 Win=225472 Len=0 TSval=2120827646 TSecr=800540824"
"252","1.414062","172.66.164.67","100.86.121.59","TCP","1514","443  >  53561 [ACK] Seq=113967 Ack=26129 Win=122880 Len=1448 TSval=800540824 TSecr=2120827629 [TCP PDU reassembled in 253]"
"253","1.414064","172.66.164.67","100.86.121.59","TLSv1.3","1500","Application Data"
"254","1.414565","172.66.164.67","100.86.121.59","TLSv1.3","97","Application Data"
"255","1.414647","100.86.121.59","172.66.164.67","TCP","66","53561  >  443 [ACK] Seq=26129 Ack=116880 Win=225472 Len=0 TSval=2120827647 TSecr=800540824"
"256","1.585926","100.86.121.59","172.66.164.67","TCP","54","[TCP Keep-Alive] 53562  >  443 [ACK] Seq=1834 Ack=3987 Win=131072 Len=0"
"257","1.585938","100.86.121.59","172.66.164.67","TCP","54","[TCP Keep-Alive] 53561  >  443 [ACK] Seq=26128 Ack=116880 Win=225408 Len=0"
"258","1.617088","172.66.164.67","100.86.121.59","TCP","66","[TCP Keep-Alive ACK] 443  >  53562 [ACK] Seq=3987 Ack=1835 Win=139264 Len=0 TSval=1086887438 TSecr=1001388062"
"259","1.617094","172.66.164.67","100.86.121.59","TCP","66","[TCP Keep-Alive ACK] 443  >  53561 [ACK] Seq=116880 Ack=26129 Win=122880 Len=0 TSval=800541021 TSecr=2120827647"
"260","6.387643","100.86.121.59","172.66.164.67","TLSv1.3","764","Application Data"
"261","6.421391","172.66.164.67","100.86.121.59","TLSv1.3","150","Application Data"
"262","6.421394","172.66.164.67","100.86.121.59","TLSv1.3","290","Application Data"
"263","6.421618","100.86.121.59","172.66.164.67","TCP","66","53561  >  443 [ACK] Seq=26827 Ack=117188 Win=225216 Len=0 TSval=2120832654 TSecr=800545837"
"264","6.421843","172.66.164.67","100.86.121.59","TLSv1.3","97","Application Data"
"265","6.421915","100.86.121.59","172.66.164.67","TCP","66","53561  >  443 [ACK] Seq=26827 Ack=117219 Win=225472 Len=0 TSval=2120832655 TSecr=800545837"
"266","6.425078","100.86.121.59","172.66.164.67","TLSv1.3","101","Application Data"
"267","6.477821","172.66.164.67","100.86.121.59","TCP","66","443  >  53561 [ACK] Seq=117219 Ack=26862 Win=122880 Len=0 TSval=800545895 TSecr=2120832658"
"268","11.390525","100.86.121.59","172.66.164.67","TLSv1.3","1207","Application Data"
"269","11.391398","100.86.121.59","172.66.164.67","TLSv1.3","512","Application Data"
"270","11.391695","100.86.121.59","172.66.164.67","TLSv1.3","197","Application Data"
"271","11.391954","100.86.121.59","172.66.164.67","TLSv1.3","196","Application Data"
"272","11.406590","172.66.164.67","100.86.121.59","TCP","66","443  >  53561 [ACK] Seq=117219 Ack=28710 Win=122880 Len=0 TSval=800550821 TSecr=2120837625"
"273","11.423115","172.66.164.67","100.86.121.59","TLSv1.3","150","Application Data"
"274","11.423119","172.66.164.67","100.86.121.59","TLSv1.3","290","Application Data"
"275","11.423307","100.86.121.59","172.66.164.67","TCP","66","53561  >  443 [ACK] Seq=28710 Ack=117527 Win=225216 Len=0 TSval=2120837656 TSecr=800550840"
"276","11.423786","172.66.164.67","100.86.121.59","TLSv1.3","97","Application Data"
"277","11.423902","100.86.121.59","172.66.164.67","TCP","66","53561  >  443 [ACK] Seq=28710 Ack=117558 Win=225472 Len=0 TSval=2120837657 TSecr=800550840"
"278","11.424257","172.66.164.67","100.86.121.59","TLSv1.3","216","Application Data"
"279","11.424260","172.66.164.67","100.86.121.59","TLSv1.3","290","Application Data"
"280","11.424263","172.66.164.67","100.86.121.59","TLSv1.3","97","Application Data"
"281","11.424334","100.86.121.59","172.66.164.67","TCP","66","53561  >  443 [ACK] Seq=28710 Ack=117963 Win=225088 Len=0 TSval=2120837657 TSecr=800550841"
"282","11.425151","172.66.164.67","100.86.121.59","TLSv1.3","127","Application Data"
"283","11.425154","172.66.164.67","100.86.121.59","TLSv1.3","321","Application Data, Application Data"
"284","11.425252","100.86.121.59","172.66.164.67","TCP","66","53561  >  443 [ACK] Seq=28710 Ack=118279 Win=225152 Len=0 TSval=2120837658 TSecr=800550841"
"285","11.425846","100.86.121.59","172.66.164.67","TLSv1.3","101","Application Data"
"286","11.427644","172.66.164.67","100.86.121.59","TLSv1.3","127","Application Data"
"287","11.427647","172.66.164.67","100.86.121.59","TLSv1.3","290","Application Data"
"288","11.427803","100.86.121.59","172.66.164.67","TCP","66","53561  >  443 [ACK] Seq=28745 Ack=118564 Win=224896 Len=0 TSval=2120837660 TSecr=800550844"
"289","11.427939","172.66.164.67","100.86.121.59","TLSv1.3","97","Application Data"
"290","11.428005","100.86.121.59","172.66.164.67","TCP","66","53561  >  443 [ACK] Seq=28745 Ack=118595 Win=224896 Len=0 TSval=2120837661 TSecr=800550844"
"291","11.477806","172.66.164.67","100.86.121.59","TCP","66","443  >  53561 [ACK] Seq=118595 Ack=28745 Win=122880 Len=0 TSval=800550895 TSecr=2120837659"
"292","12.389900","100.86.121.59","172.66.164.67","TLSv1.3","906","Application Data"
"293","12.400848","172.66.164.67","100.86.121.59","TCP","66","443  >  53561 [ACK] Seq=118595 Ack=29585 Win=122880 Len=0 TSval=800551818 TSecr=2120838623"
"294","13.351915","172.66.164.67","100.86.121.59","TLSv1.3","205","Application Data"
"295","13.351919","172.66.164.67","100.86.121.59","TCP","1514","443  >  53561 [ACK] Seq=118734 Ack=29585 Win=122880 Len=1448 TSval=800552690 TSecr=2120838623 [TCP PDU reassembled in 309]"
"296","13.351922","172.66.164.67","100.86.121.59","TCP","1514","443  >  53561 [ACK] Seq=120182 Ack=29585 Win=122880 Len=1448 TSval=800552690 TSecr=2120838623 [TCP PDU reassembled in 309]"
"297","13.351925","172.66.164.67","100.86.121.59","TCP","1514","443  >  53561 [ACK] Seq=121630 Ack=29585 Win=122880 Len=1448 TSval=800552690 TSecr=2120838623 [TCP PDU reassembled in 309]"
"298","13.351928","172.66.164.67","100.86.121.59","TCP","1514","443  >  53561 [ACK] Seq=123078 Ack=29585 Win=122880 Len=1448 TSval=800552690 TSecr=2120838623 [TCP PDU reassembled in 309]"
"299","13.351931","172.66.164.67","100.86.121.59","TCP","1514","443  >  53561 [ACK] Seq=124526 Ack=29585 Win=122880 Len=1448 TSval=800552690 TSecr=2120838623 [TCP PDU reassembled in 309]"
"300","13.352120","100.86.121.59","172.66.164.67","TCP","66","53561  >  443 [ACK] Seq=29585 Ack=125974 Win=218112 Len=0 TSval=2120839585 TSecr=800552690"
"301","13.352194","172.66.164.67","100.86.121.59","TCP","1514","443  >  53561 [ACK] Seq=125974 Ack=29585 Win=122880 Len=1448 TSval=800552690 TSecr=2120838623 [TCP PDU reassembled in 309]"
"302","13.352197","172.66.164.67","100.86.121.59","TCP","1514","443  >  53561 [ACK] Seq=127422 Ack=29585 Win=122880 Len=1448 TSval=800552690 TSecr=2120838623 [TCP PDU reassembled in 309]"
"303","13.352260","100.86.121.59","172.66.164.67","TCP","66","53561  >  443 [ACK] Seq=29585 Ack=128870 Win=215232 Len=0 TSval=2120839585 TSecr=800552690"
"304","13.352466","100.86.121.59","172.66.164.67","TCP","66","[TCP Window Update] 53561  >  443 [ACK] Seq=29585 Ack=128870 Win=225472 Len=0 TSval=2120839585 TSecr=800552690"
"305","13.353228","172.66.164.67","100.86.121.59","TCP","1514","443  >  53561 [ACK] Seq=128870 Ack=29585 Win=122880 Len=1448 TSval=800552690 TSecr=2120838623 [TCP PDU reassembled in 309]"
"306","13.353230","172.66.164.67","100.86.121.59","TCP","1514","443  >  53561 [ACK] Seq=130318 Ack=29585 Win=122880 Len=1448 TSval=800552690 TSecr=2120838623 [TCP PDU reassembled in 309]"
"307","13.353233","172.66.164.67","100.86.121.59","TCP","1514","443  >  53561 [PSH, ACK] Seq=131766 Ack=29585 Win=122880 Len=1448 TSval=800552690 TSecr=2120838623 [TCP PDU reassembled in 309]"
"308","13.353235","172.66.164.67","100.86.121.59","TCP","1514","443  >  53561 [ACK] Seq=133214 Ack=29585 Win=122880 Len=1448 TSval=800552691 TSecr=2120838623 [TCP PDU reassembled in 309]"
"309","13.353237","172.66.164.67","100.86.121.59","TLSv1.3","1514","Application Data"
"310","13.353240","172.66.164.67","100.86.121.59","TLSv1.3","137","Application Data"
"311","13.353242","172.66.164.67","100.86.121.59","TCP","1514","443  >  53561 [ACK] Seq=136181 Ack=29585 Win=122880 Len=1448 TSval=800552691 TSecr=2120838623 [TCP PDU reassembled in 313]"
"312","13.353245","172.66.164.67","100.86.121.59","TCP","1514","443  >  53561 [ACK] Seq=137629 Ack=29585 Win=122880 Len=1448 TSval=800552691 TSecr=2120838623 [TCP PDU reassembled in 313]"
"313","13.353247","172.66.164.67","100.86.121.59","TLSv1.3","753","Application Data"
"314","13.353249","172.66.164.67","100.86.121.59","TCP","1514","443  >  53561 [ACK] Seq=139764 Ack=29585 Win=122880 Len=1448 TSval=800552693 TSecr=2120838623 [TCP PDU reassembled in 317]"
"315","13.353252","172.66.164.67","100.86.121.59","TCP","1514","443  >  53561 [ACK] Seq=141212 Ack=29585 Win=122880 Len=1448 TSval=800552693 TSecr=2120838623 [TCP PDU reassembled in 317]"
"316","13.353256","172.66.164.67","100.86.121.59","TCP","1514","443  >  53561 [ACK] Seq=142660 Ack=29585 Win=122880 Len=1448 TSval=800552693 TSecr=2120838623 [TCP PDU reassembled in 317]"
"317","13.353259","172.66.164.67","100.86.121.59","TLSv1.3","302","Application Data"
"318","13.353261","172.66.164.67","100.86.121.59","TLSv1.3","97","Application Data"
"319","13.353263","172.66.164.67","100.86.121.59","TCP","97","[TCP Retransmission] 443  >  53561 [PSH, ACK] Seq=144344 Ack=29585 Win=122880 Len=31 TSval=800552724 TSecr=2120838623"
"320","13.353385","100.86.121.59","172.66.164.67","TCP","66","53561  >  443 [ACK] Seq=29585 Ack=144375 Win=209984 Len=0 TSval=2120839586 TSecr=800552693"
"321","13.353414","100.86.121.59","172.66.164.67","TCP","78","[TCP Dup ACK 320#1] 53561  >  443 [ACK] Seq=29585 Ack=144375 Win=209984 Len=0 TSval=2120839586 TSecr=800552724 SLE=144344 SRE=144375"
"322","13.353867","100.86.121.59","172.66.164.67","TCP","66","[TCP Window Update] 53561  >  443 [ACK] Seq=29585 Ack=144375 Win=225472 Len=0 TSval=2120839587 TSecr=800552724"
"323","13.378614","100.86.121.59","172.66.164.67","TLSv1.3","358","Application Data"
"324","13.380016","100.86.121.59","172.66.164.67","TLSv1.3","276","Application Data"
