No.,Time,Source,Destination,Protocol,Length,Info
1,0.0,100.86.121.59,172.66.164.67,TLSv1.2,1454,Application Data
2,1.9e-05,100.86.121.59,172.66.164.67,TLSv1.2,105,Application Data
3,0.011188,172.66.164.67,100.86.121.59,TCP,66,443  >  53996 [ACK] Seq=1 Ack=1428 Win=17 Len=0 TSval=1715458123 TSecr=1969549705
4,0.011743,172.66.164.67,100.86.121.59,TLSv1.2,105,Application Data
5,0.011782,100.86.121.59,172.66.164.67,TCP,66,53996  >  443 [ACK] Seq=1428 Ack=40 Win=2048 Len=0 TSval=1969549717 TSecr=1715458123
6,1.148114,172.66.164.67,100.86.121.59,TLSv1.2,242,Application Data
7,1.148117,172.66.164.67,100.86.121.59,TCP,1514,443  >  53996 [ACK] Seq=216 Ack=1428 Win=17 Len=1448 TSval=1715459231 TSecr=1969549717 [TCP PDU reassembled in 18]
8,1.14812,172.66.164.67,100.86.121.59,TCP,1514,443  >  53996 [ACK] Seq=1664 Ack=1428 Win=17 Len=1448 TSval=1715459231 TSecr=1969549717 [TCP PDU reassembled in 18]
9,1.148122,172.66.164.67,100.86.121.59,TCP,1514,443  >  53996 [ACK] Seq=3112 Ack=1428 Win=17 Len=1448 TSval=1715459231 TSecr=1969549717 [TCP PDU reassembled in 18]
10,1.148125,172.66.164.67,100.86.121.59,TCP,1514,443  >  53996 [ACK] Seq=4560 Ack=1428 Win=17 Len=1448 TSval=1715459231 TSecr=1969549717 [TCP PDU reassembled in 18]
11,1.148127,172.66.164.67,100.86.121.59,TCP,1514,443  >  53996 [ACK] Seq=6008 Ack=1428 Win=17 Len=1448 TSval=1715459231 TSecr=1969549717 [TCP PDU reassembled in 18]
12,1.14813,172.66.164.67,100.86.121.59,TCP,1514,443  >  53996 [ACK] Seq=7456 Ack=1428 Win=17 Len=1448 TSval=1715459231 TSecr=1969549717 [TCP PDU reassembled in 18]
13,1.148132,172.66.164.67,100.86.121.59,TCP,1514,443  >  53996 [ACK] Seq=8904 Ack=1428 Win=17 Len=1448 TSval=1715459231 TSecr=1969549717 [TCP PDU reassembled in 18]
14,1.148135,172.66.164.67,100.86.121.59,TCP,1514,"443  >  53996 [PSH, ACK] Seq=10352 Ack=1428 Win=17 Len=1448 TSval=1715459231 TSecr=1969549717 [TCP PDU reassembled in 18]"
15,1.148138,172.66.164.67,100.86.121.59,TCP,1514,443  >  53996 [ACK] Seq=11800 Ack=1428 Win=17 Len=1448 TSval=1715459232 TSecr=1969549717 [TCP PDU reassembled in 18]
16,1.148401,172.66.164.67,100.86.121.59,TCP,1514,443  >  53996 [ACK] Seq=13248 Ack=1428 Win=17 Len=1448 TSval=1715459232 TSecr=1969549717 [TCP PDU reassembled in 18]
17,1.148404,172.66.164.67,100.86.121.59,TCP,1514,443  >  53996 [ACK] Seq=14696 Ack=1428 Win=17 Len=1448 TSval=1715459232 TSecr=1969549717 [TCP PDU reassembled in 18]
18,1.148407,172.66.164.67,100.86.121.59,TLSv1.2,1514,Application Data
19,1.148409,172.66.164.67,100.86.121.59,TCP,1514,443  >  53996 [ACK] Seq=17592 Ack=1428 Win=17 Len=1448 TSval=1715459232 TSecr=1969549717 [TCP PDU reassembled in 33]
20,1.148425,100.86.121.59,172.66.164.67,TCP,66,53996  >  443 [ACK] Seq=1428 Ack=13248 Win=1842 Len=0 TSval=1969550853 TSecr=1715459232
21,1.14856,100.86.121.59,172.66.164.67,TCP,66,53996  >  443 [ACK] Seq=1428 Ack=19040 Win=1752 Len=0 TSval=1969550853 TSecr=1715459232
22,1.148703,172.66.164.67,100.86.121.59,TCP,1514,443  >  53996 [ACK] Seq=19040 Ack=1428 Win=17 Len=1448 TSval=1715459232 TSecr=1969549717 [TCP PDU reassembled in 33]
23,1.148705,172.66.164.67,100.86.121.59,TCP,1514,443  >  53996 [ACK] Seq=20488 Ack=1428 Win=17 Len=1448 TSval=1715459232 TSecr=1969549717 [TCP PDU reassembled in 33]
24,1.148708,172.66.164.67,100.86.121.59,TCP,1514,"443  >  53996 [PSH, ACK] Seq=21936 Ack=1428 Win=17 Len=1448 TSval=1715459232 TSecr=1969549717 [TCP PDU reassembled in 33]"
25,1.14871,172.66.164.67,100.86.121.59,TCP,1514,443  >  53996 [ACK] Seq=23384 Ack=1428 Win=17 Len=1448 TSval=1715459233 TSecr=1969549717 [TCP PDU reassembled in 33]
26,1.148727,172.66.164.67,100.86.121.59,TCP,1514,443  >  53996 [ACK] Seq=24832 Ack=1428 Win=17 Len=1448 TSval=1715459233 TSecr=1969549717 [TCP PDU reassembled in 33]
27,1.148729,172.66.164.67,100.86.121.59,TCP,1514,443  >  53996 [ACK] Seq=26280 Ack=1428 Win=17 Len=1448 TSval=1715459233 TSecr=1969549717 [TCP PDU reassembled in 33]
28,1.14876,172.66.164.67,100.86.121.59,TCP,1514,443  >  53996 [ACK] Seq=27728 Ack=1428 Win=17 Len=1448 TSval=1715459233 TSecr=1969549717 [TCP PDU reassembled in 33]
29,1.148762,172.66.164.67,100.86.121.59,TCP,1514,443  >  53996 [ACK] Seq=29176 Ack=1428 Win=17 Len=1448 TSval=1715459233 TSecr=1969549717 [TCP PDU reassembled in 33]
30,1.148821,100.86.121.59,172.66.164.67,TCP,66,53996  >  443 [ACK] Seq=1428 Ack=27728 Win=1888 Len=0 TSval=1969550854 TSecr=1715459233
31,1.148849,100.86.121.59,172.66.164.67,TCP,66,53996  >  443 [ACK] Seq=1428 Ack=30624 Win=1843 Len=0 TSval=1969550854 TSecr=1715459233
32,1.148966,172.66.164.67,100.86.121.59,TCP,1514,443  >  53996 [ACK] Seq=30624 Ack=1428 Win=17 Len=1448 TSval=1715459233 TSecr=1969549717 [TCP PDU reassembled in 33]
33,1.148969,172.66.164.67,100.86.121.59,TLSv1.2,1022,Application Data
34,1.148972,172.66.164.67,100.86.121.59,TLSv1.2,1421,"Application Data, Application Data"
35,1.149028,100.86.121.59,172.66.164.67,TCP,66,53996  >  443 [ACK] Seq=1428 Ack=34383 Win=1785 Len=0 TSval=1969550854 TSecr=1715459233
36,1.149208,100.86.121.59,172.66.164.67,TCP,66,[TCP Window Update] 53996  >  443 [ACK] Seq=1428 Ack=34383 Win=2048 Len=0 TSval=1969550854 TSecr=1715459233
37,1.15639,100.86.121.59,172.66.164.67,TLSv1.2,101,Application Data
38,1.20687,172.66.164.67,100.86.121.59,TCP,66,443  >  53996 [ACK] Seq=34383 Ack=1463 Win=17 Len=0 TSval=1715459319 TSecr=1969550861
39,1.279199,100.86.121.59,172.66.164.67,TLSv1.2,852,Application Data
40,1.289289,172.66.164.67,100.86.121.59,TCP,66,443  >  53996 [ACK] Seq=34383 Ack=2249 Win=17 Len=0 TSval=1715459401 TSecr=1969550984
41,1.291836,100.86.121.59,172.66.164.67,TLSv1.2,317,Application Data
42,1.291945,100.86.121.59,172.66.164.67,TLSv1.2,198,Application Data
43,1.301624,172.66.164.67,100.86.121.59,TCP,66,443  >  53996 [ACK] Seq=34383 Ack=2500 Win=17 Len=0 TSval=1715459413 TSecr=1969550997
44,1.302568,172.66.164.67,100.86.121.59,TCP,66,443  >  53996 [ACK] Seq=34383 Ack=2632 Win=17 Len=0 TSval=1715459414 TSecr=1969550997
45,1.31677,100.86.121.59,172.66.164.67,TLSv1.2,439,Application Data
46,1.317194,100.86.121.59,172.66.164.67,TLSv1.2,994,Application Data
47,1.31739,100.86.121.59,172.66.164.67,TLSv1.2,200,Application Data
48,1.31748,100.86.121.59,172.66.164.67,TLSv1.2,908,Application Data
49,1.317655,100.86.121.59,172.66.164.67,TLSv1.2,382,Application Data
50,1.318495,172.66.164.67,100.86.121.59,TLSv1.2,177,Application Data
51,1.318496,172.66.164.67,100.86.121.59,TLSv1.2,108,Application Data
52,1.318535,100.86.121.59,172.66.164.67,TCP,66,53996  >  443 [ACK] Seq=5225 Ack=34536 Win=2046 Len=0 TSval=1969551023 TSecr=1715459429
53,1.318835,172.66.164.67,100.86.121.59,TLSv1.2,97,Application Data
54,1.318863,100.86.121.59,172.66.164.67,TCP,66,53996  >  443 [ACK] Seq=5225 Ack=34567 Win=2048 Len=0 TSval=1969551024 TSecr=1715459430
55,1.327248,172.66.164.67,100.86.121.59,TLSv1.2,159,Application Data
56,1.327356,100.86.121.59,172.66.164.67,TCP,66,53996  >  443 [ACK] Seq=5225 Ack=34660 Win=2047 Len=0 TSval=1969551032 TSecr=1715459439
57,1.327858,172.66.164.67,100.86.121.59,TLSv1.2,149,Application Data
58,1.327924,100.86.121.59,172.66.164.67,TCP,66,53996  >  443 [ACK] Seq=5225 Ack=34743 Win=2047 Len=0 TSval=1969551033 TSecr=1715459439
59,1.327998,172.66.164.67,100.86.121.59,TCP,66,443  >  53996 [ACK] Seq=34743 Ack=4909 Win=17 Len=0 TSval=1715459439 TSecr=1969551022
60,1.353113,172.66.164.67,100.86.121.59,TLSv1.2,157,Application Data
61,1.353185,100.86.121.59,172.66.164.67,TCP,66,53996  >  443 [ACK] Seq=5225 Ack=34834 Win=2047 Len=0 TSval=1969551058 TSecr=1715459463
62,1.353259,172.66.164.67,100.86.121.59,TLSv1.2,290,Application Data
63,1.35326,172.66.164.67,100.86.121.59,TLSv1.2,97,Application Data
64,1.353301,100.86.121.59,172.66.164.67,TCP,66,53996  >  443 [ACK] Seq=5225 Ack=35089 Win=2044 Len=0 TSval=1969551058 TSecr=1715459464
65,1.354009,172.66.164.67,100.86.121.59,TLSv1.2,208,Application Data
66,1.35401,172.66.164.67,100.86.121.59,TLSv1.2,290,Application Data
67,1.35401,172.66.164.67,100.86.121.59,TLSv1.2,97,Application Data
68,1.354059,100.86.121.59,172.66.164.67,TCP,66,53996  >  443 [ACK] Seq=5225 Ack=35486 Win=2042 Len=0 TSval=1969551059 TSecr=1715459465
69,1.355208,172.66.164.67,100.86.121.59,TLSv1.2,127,Application Data
70,1.355289,100.86.121.59,172.66.164.67,TCP,66,53996  >  443 [ACK] Seq=5225 Ack=35547 Win=2048 Len=0 TSval=1969551060 TSecr=1715459466
71,1.355317,172.66.164.67,100.86.121.59,TLSv1.2,290,Application Data
72,1.355318,172.66.164.67,100.86.121.59,TLSv1.2,97,Application Data
73,1.355367,100.86.121.59,172.66.164.67,TCP,66,53996  >  443 [ACK] Seq=5225 Ack=35802 Win=2045 Len=0 TSval=1969551060 TSecr=1715459467
74,1.355841,172.66.164.67,100.86.121.59,TLSv1.2,127,Application Data
75,1.355842,172.66.164.67,100.86.121.59,TLSv1.2,290,Application Data
76,1.355843,172.66.164.67,100.86.121.59,TLSv1.2,97,Application Data
77,1.355891,100.86.121.59,172.66.164.67,TCP,66,53996  >  443 [ACK] Seq=5225 Ack=36118 Win=2044 Len=0 TSval=1969551061 TSecr=1715459467
78,1.358058,172.66.164.67,100.86.121.59,TLSv1.2,127,Application Data
79,1.358059,172.66.164.67,100.86.121.59,TLSv1.2,290,Application Data
80,1.358129,100.86.121.59,172.66.164.67,TCP,66,53996  >  443 [ACK] Seq=5225 Ack=36403 Win=2048 Len=0 TSval=1969551063 TSecr=1715459469
81,1.358762,172.66.164.67,100.86.121.59,TLSv1.2,97,Application Data
82,1.358801,100.86.121.59,172.66.164.67,TCP,66,53996  >  443 [ACK] Seq=5225 Ack=36434 Win=2048 Len=0 TSval=1969551064 TSecr=1715459469
83,6.367897,100.86.121.59,172.66.164.67,TLSv1.2,460,Application Data
84,6.368987,100.86.121.59,172.66.164.67,TLSv1.2,993,Application Data
85,6.369529,100.86.121.59,172.66.164.67,TLSv1.2,199,Application Data
86,6.380805,172.66.164.67,100.86.121.59,TCP,66,443  >  53996 [ACK] Seq=36434 Ack=6679 Win=17 Len=0 TSval=1715464492 TSecr=1969556073
87,6.408148,172.66.164.67,100.86.121.59,TLSv1.2,150,Application Data
88,6.408152,172.66.164.67,100.86.121.59,TLSv1.2,290,Application Data
89,6.408155,172.66.164.67,100.86.121.59,TLSv1.2,97,Application Data
90,6.40835,100.86.121.59,172.66.164.67,TCP,66,53996  >  443 [ACK] Seq=6679 Ack=36773 Win=2043 Len=0 TSval=1969556113 TSecr=1715464520
91,6.410325,100.86.121.59,172.66.164.67,TLSv1.2,101,Application Data
92,6.412986,172.66.164.67,100.86.121.59,TLSv1.2,127,Application Data
93,6.412989,172.66.164.67,100.86.121.59,TLSv1.2,290,Application Data
94,6.413099,172.66.164.67,100.86.121.59,TLSv1.2,97,Application Data
95,6.413139,100.86.121.59,172.66.164.67,TCP,66,53996  >  443 [ACK] Seq=6714 Ack=37058 Win=2044 Len=0 TSval=1969556118 TSecr=1715464525
96,6.413209,100.86.121.59,172.66.164.67,TCP,66,53996  >  443 [ACK] Seq=6714 Ack=37089 Win=2044 Len=0 TSval=1969556118 TSecr=1715464525
97,6.414016,172.66.164.67,100.86.121.59,TLSv1.2,127,Application Data
98,6.414019,172.66.164.67,100.86.121.59,TLSv1.2,290,Application Data
99,6.414021,172.66.164.67,100.86.121.59,TLSv1.2,97,Application Data
100,6.414094,100.86.121.59,172.66.164.67,TCP,66,53996  >  443 [ACK] Seq=6714 Ack=37405 Win=2044 Len=0 TSval=1969556119 TSecr=1715464526
101,6.461371,172.66.164.67,100.86.121.59,TCP,66,443  >  53996 [ACK] Seq=37405 Ack=6714 Win=17 Len=0 TSval=1715464573 TSecr=1969556115
102,6.624971,100.86.121.59,172.66.164.67,TLSv1.2,1045,Application Data
103,6.635195,172.66.164.67,100.86.121.59,TCP,66,443  >  53996 [ACK] Seq=37405 Ack=7693 Win=17 Len=0 TSval=1715464747 TSecr=1969556330
104,7.291399,172.66.164.67,100.86.121.59,TLSv1.2,175,Application Data
105,7.291402,172.66.164.67,100.86.121.59,TCP,1514,443  >  53996 [ACK] Seq=37514 Ack=7693 Win=17 Len=1448 TSval=1715465387 TSecr=1969556330 [TCP PDU reassembled in 121]
106,7.291404,172.66.164.67,100.86.121.59,TCP,1514,443  >  53996 [ACK] Seq=38962 Ack=7693 Win=17 Len=1448 TSval=1715465387 TSecr=1969556330 [TCP PDU reassembled in 121]
107,7.291405,172.66.164.67,100.86.121.59,TCP,1514,443  >  53996 [ACK] Seq=40410 Ack=7693 Win=17 Len=1448 TSval=1715465387 TSecr=1969556330 [TCP PDU reassembled in 121]
108,7.291559,100.86.121.59,172.66.164.67,TCP,66,53996  >  443 [ACK] Seq=7693 Ack=41858 Win=1979 Len=0 TSval=1969556996 TSecr=1715465387
109,7.291689,100.86.121.59,172.66.164.67,TCP,66,[TCP Window Update] 53996  >  443 [ACK] Seq=7693 Ack=41858 Win=2048 Len=0 TSval=1969556996 TSecr=1715465387
110,7.291972,172.66.164.67,100.86.121.59,TCP,1514,443  >  53996 [ACK] Seq=41858 Ack=7693 Win=17 Len=1448 TSval=1715465387 TSecr=1969556330 [TCP PDU reassembled in 121]
111,7.291974,172.66.164.67,100.86.121.59,TCP,1514,443  >  53996 [ACK] Seq=43306 Ack=7693 Win=17 Len=1448 TSval=1715465387 TSecr=1969556330 [TCP PDU reassembled in 121]
112,7.292049,100.86.121.59,172.66.164.67,TCP,66,53996  >  443 [ACK] Seq=7693 Ack=44754 Win=2003 Len=0 TSval=1969556997 TSecr=1715465387
113,7.292199,100.86.121.59,172.66.164.67,TCP,66,[TCP Window Update] 53996  >  443 [ACK] Seq=7693 Ack=44754 Win=2048 Len=0 TSval=1969556997 TSecr=1715465387
114,7.293167,172.66.164.67,100.86.121.59,TCP,1514,443  >  53996 [ACK] Seq=44754 Ack=7693 Win=17 Len=1448 TSval=1715465387 TSecr=1969556330 [TCP PDU reassembled in 121]
115,7.29317,172.66.164.67,100.86.121.59,TCP,1514,443  >  53996 [ACK] Seq=46202 Ack=7693 Win=17 Len=1448 TSval=1715465387 TSecr=1969556330 [TCP PDU reassembled in 121]
116,7.293251,100.86.121.59,172.66.164.67,TCP,66,53996  >  443 [ACK] Seq=7693 Ack=47650 Win=2003 Len=0 TSval=1969556998 TSecr=1715465387
117,7.294285,172.66.164.67,100.86.121.59,TCP,1514,"443  >  53996 [PSH, ACK] Seq=47650 Ack=7693 Win=17 Len=1448 TSval=1715465387 TSecr=1969556330 [TCP PDU reassembled in 121]"
118,7.294289,172.66.164.67,100.86.121.59,TCP,1514,443  >  53996 [ACK] Seq=49098 Ack=7693 Win=17 Len=1448 TSval=1715465388 TSecr=1969556330 [TCP PDU reassembled in 121]
119,7.294291,172.66.164.67,100.86.121.59,TCP,1514,443  >  53996 [ACK] Seq=50546 Ack=7693 Win=17 Len=1448 TSval=1715465388 TSecr=1969556330 [TCP PDU reassembled in 121]
120,7.294293,172.66.164.67,100.86.121.59,TCP,1514,443  >  53996 [ACK] Seq=51994 Ack=7693 Win=17 Len=1448 TSval=1715465388 TSecr=1969556330 [TCP PDU reassembled in 121]
121,7.294296,172.66.164.67,100.86.121.59,TLSv1.2,544,Application Data
122,7.294298,172.66.164.67,100.86.121.59,TCP,1514,443  >  53996 [ACK] Seq=53920 Ack=7693 Win=17 Len=1448 TSval=1715465388 TSecr=1969556330 [TCP PDU reassembled in 130]
123,7.2943,172.66.164.67,100.86.121.59,TCP,1514,443  >  53996 [ACK] Seq=55368 Ack=7693 Win=17 Len=1448 TSval=1715465388 TSecr=1969556330 [TCP PDU reassembled in 130]
124,7.294303,172.66.164.67,100.86.121.59,TCP,1514,443  >  53996 [ACK] Seq=56816 Ack=7693 Win=17 Len=1448 TSval=1715465388 TSecr=1969556330 [TCP PDU reassembled in 130]
125,7.294305,172.66.164.67,100.86.121.59,TCP,1514,443  >  53996 [ACK] Seq=58264 Ack=7693 Win=17 Len=1448 TSval=1715465388 TSecr=1969556330 [TCP PDU reassembled in 130]
126,7.294308,172.66.164.67,100.86.121.59,TCP,1514,443  >  53996 [ACK] Seq=59712 Ack=7693 Win=17 Len=1448 TSval=1715465388 TSecr=1969556330 [TCP PDU reassembled in 130]
127,7.29431,172.66.164.67,100.86.121.59,TCP,1514,443  >  53996 [ACK] Seq=61160 Ack=7693 Win=17 Len=1448 TSval=1715465388 TSecr=1969556330 [TCP PDU reassembled in 130]
128,7.294312,172.66.164.67,100.86.121.59,TCP,1514,443  >  53996 [ACK] Seq=62608 Ack=7693 Win=17 Len=1448 TSval=1715465388 TSecr=1969556330 [TCP PDU reassembled in 130]
129,7.294314,172.66.164.67,100.86.121.59,TCP,1514,"443  >  53996 [PSH, ACK] Seq=64056 Ack=7693 Win=17 Len=1448 TSval=1715465388 TSecr=1969556330 [TCP PDU reassembled in 130]"
130,7.294317,172.66.164.67,100.86.121.59,TLSv1.2,1267,"Application Data, Application Data"
131,7.294361,100.86.121.59,172.66.164.67,TCP,66,[TCP Window Update] 53996  >  443 [ACK] Seq=7693 Ack=47650 Win=2048 Len=0 TSval=1969556999 TSecr=1715465387
132,7.294425,100.86.121.59,172.66.164.67,TCP,66,53996  >  443 [ACK] Seq=7693 Ack=62608 Win=1815 Len=0 TSval=1969556999 TSecr=1715465388
133,7.294432,100.86.121.59,172.66.164.67,TCP,66,53996  >  443 [ACK] Seq=7693 Ack=66705 Win=1751 Len=0 TSval=1969556999 TSecr=1715465389
134,7.294533,100.86.121.59,172.66.164.67,TCP,66,[TCP Window Update] 53996  >  443 [ACK] Seq=7693 Ack=66705 Win=2048 Len=0 TSval=1969556999 TSecr=1715465389
135,7.342617,100.86.121.59,172.66.164.67,TLSv1.2,404,Application Data
136,7.358075,172.66.164.67,100.86.121.59,TCP,66,443  >  53996 [ACK] Seq=66705 Ack=8031 Win=17 Len=0 TSval=1715465464 TSecr=1969557047
137,7.360734,100.86.121.59,172.66.164.67,TLSv1.2,183,Application Data
138,7.360836,100.86.121.59,172.66.164.67,TLSv1.2,147,Application Data
139,7.382592,100.86.121.59,172.66.164.67,TLSv1.2,1224,Application Data
140,7.383026,100.86.121.59,172.66.164.67,TLSv1.2,298,Application Data
141,7.383285,100.86.121.59,172.66.164.67,TLSv1.2,200,Application Data
142,7.383381,100.86.121.59,172.66.164.67,TLSv1.2,198,Application Data
143,7.383637,100.86.121.59,172.66.164.67,TLSv1.2,533,Application Data
144,7.396852,172.66.164.67,100.86.121.59,TCP,66,443  >  53996 [ACK] Seq=66705 Ack=8229 Win=17 Len=0 TSval=1715465486 TSecr=1969557066
145,7.435367,172.66.164.67,100.86.121.59,TLSv1.2,128,Application Data
146,7.435425,100.86.121.59,172.66.164.67,TCP,66,53996  >  443 [ACK] Seq=10352 Ack=66767 Win=2048 Len=0 TSval=1969557140 TSecr=1715465497
147,7.436671,172.66.164.67,100.86.121.59,TLSv1.2,108,Application Data
148,7.436672,172.66.164.67,100.86.121.59,TLSv1.2,97,Application Data
149,7.436762,100.86.121.59,172.66.164.67,TCP,66,53996  >  443 [ACK] Seq=10352 Ack=66840 Win=2047 Len=0 TSval=1969557142 TSecr=1715465498
150,7.437361,100.86.121.59,172.66.164.67,TCP,1454,"[TCP Retransmission] 53996  >  443 [PSH, ACK] Seq=8964 Ack=66840 Win=2048 Len=1388 TSval=1969557142 TSecr=1715465498"
151,7.439517,172.66.164.67,100.86.121.59,TCP,66,443  >  53996 [ACK] Seq=66840 Ack=10352 Win=17 Len=0 TSval=1715465511 TSecr=1969557088
152,7.443962,172.66.164.67,100.86.121.59,TLSv1.2,133,Application Data
153,7.443963,172.66.164.67,100.86.121.59,TLSv1.2,128,Application Data
154,7.44404,100.86.121.59,172.66.164.67,TCP,66,53996  >  443 [ACK] Seq=10352 Ack=66969 Win=2046 Len=0 TSval=1969557149 TSecr=1715465519
155,7.45112,172.66.164.67,100.86.121.59,TLSv1.2,127,Application Data
156,7.451121,172.66.164.67,100.86.121.59,TLSv1.2,290,Application Data
157,7.451122,172.66.164.67,100.86.121.59,TLSv1.2,97,Application Data
158,7.451123,172.66.164.67,100.86.121.59,TLSv1.2,135,Application Data
159,7.451124,172.66.164.67,100.86.121.59,TLSv1.2,290,Application Data
160,7.451124,172.66.164.67,100.86.121.59,TLSv1.2,97,Application Data
161,7.451125,172.66.164.67,100.86.121.59,TLSv1.2,127,Application Data
162,7.451126,172.66.164.67,100.86.121.59,TLSv1.2,290,Application Data
163,7.451196,100.86.121.59,172.66.164.67,TCP,66,53996  >  443 [ACK] Seq=10352 Ack=67894 Win=2034 Len=0 TSval=1969557156 TSecr=1715465536
164,7.45136,172.66.164.67,100.86.121.59,TLSv1.2,97,Application Data
165,7.451361,172.66.164.67,100.86.121.59,TLSv1.2,127,Application Data
166,7.451361,172.66.164.67,100.86.121.59,TLSv1.2,290,Application Data
167,7.451362,172.66.164.67,100.86.121.59,TLSv1.2,97,Application Data
168,7.451363,172.66.164.67,100.86.121.59,TLSv1.2,127,Application Data
169,7.451364,172.66.164.67,100.86.121.59,TLSv1.2,290,Application Data
170,7.451365,172.66.164.67,100.86.121.59,TLSv1.2,97,Application Data
171,7.451384,100.86.121.59,172.66.164.67,TCP,66,53996  >  443 [ACK] Seq=10352 Ack=68557 Win=2024 Len=0 TSval=1969557156 TSecr=1715465537
172,7.459886,172.66.164.67,100.86.121.59,TCP,78,[TCP Dup ACK 151#1] 443  >  53996 [ACK] Seq=68557 Ack=10352 Win=17 Len=0 TSval=1715465571 TSecr=1969557142 SLE=8964 SRE=10352
173,11.368067,100.86.121.59,172.66.164.67,TLSv1.2,830,Application Data
174,11.368501,100.86.121.59,172.66.164.67,TLSv1.2,1073,Application Data
175,11.380951,172.66.164.67,100.86.121.59,TCP,66,443  >  53996 [ACK] Seq=68557 Ack=11116 Win=17 Len=0 TSval=1715469492 TSecr=1969561073
176,11.380957,172.66.164.67,100.86.121.59,TCP,66,443  >  53996 [ACK] Seq=68557 Ack=12123 Win=17 Len=0 TSval=1715469493 TSecr=1969561073
177,11.407721,172.66.164.67,100.86.121.59,TLSv1.2,239,Application Data
178,11.407874,100.86.121.59,172.66.164.67,TCP,66,53996  >  443 [ACK] Seq=12123 Ack=68730 Win=2046 Len=0 TSval=1969561113 TSecr=1715469519
179,11.408062,172.66.164.67,100.86.121.59,TLSv1.2,290,Application Data
180,11.408064,172.66.164.67,100.86.121.59,TLSv1.2,97,Application Data
181,11.408141,100.86.121.59,172.66.164.67,TCP,66,53996  >  443 [ACK] Seq=12123 Ack=68985 Win=2045 Len=0 TSval=1969561113 TSecr=1715469520
182,11.408422,172.66.164.67,100.86.121.59,TLSv1.2,127,Application Data
183,11.408472,100.86.121.59,172.66.164.67,TCP,66,53996  >  443 [ACK] Seq=12123 Ack=69046 Win=2048 Len=0 TSval=1969561113 TSecr=1715469520
184,11.408785,172.66.164.67,100.86.121.59,TLSv1.2,290,Application Data
185,11.408787,172.66.164.67,100.86.121.59,TLSv1.2,97,Application Data
186,11.408828,100.86.121.59,172.66.164.67,TCP,66,53996  >  443 [ACK] Seq=12123 Ack=69301 Win=2045 Len=0 TSval=1969561114 TSecr=1715469520
187,11.411019,100.86.121.59,172.66.164.67,TLSv1.2,101,Application Data
188,11.461307,172.66.164.67,100.86.121.59,TCP,66,443  >  53996 [ACK] Seq=69301 Ack=12158 Win=17 Len=0 TSval=1715469573 TSecr=1969561116
189,12.018392,100.86.121.59,172.66.164.67,TLSv1.2,737,Application Data
190,12.0314,172.66.164.67,100.86.121.59,TCP,66,443  >  53996 [ACK] Seq=69301 Ack=12829 Win=17 Len=0 TSval=1715470143 TSecr=1969561723
191,12.059484,172.66.164.67,100.86.121.59,TLSv1.2,357,Application Data
192,12.05949,172.66.164.67,100.86.121.59,TLSv1.2,473,Application Data
193,12.059581,100.86.121.59,172.66.164.67,TCP,66,53996  >  443 [ACK] Seq=12829 Ack=69999 Win=2038 Len=0 TSval=1969561764 TSecr=1715470161
194,12.059668,172.66.164.67,100.86.121.59,TLSv1.2,97,Application Data
195,12.05971,100.86.121.59,172.66.164.67,TCP,66,53996  >  443 [ACK] Seq=12829 Ack=70030 Win=2038 Len=0 TSval=1969561764 TSecr=1715470161
196,14.314253,100.86.121.59,172.66.164.67,TLSv1.2,380,Application Data
197,14.364928,172.66.164.67,100.86.121.59,TCP,66,443  >  53996 [ACK] Seq=70030 Ack=13143 Win=17 Len=0 TSval=1715472477 TSecr=1969564019
198,15.362059,172.66.164.67,100.86.121.59,TLSv1.2,177,Application Data
199,15.362311,100.86.121.59,172.66.164.67,TCP,66,53996  >  443 [ACK] Seq=13143 Ack=70141 Win=2047 Len=0 TSval=1969565067 TSecr=1715473449
200,15.362558,172.66.164.67,100.86.121.59,TCP,1514,443  >  53996 [ACK] Seq=70141 Ack=13143 Win=17 Len=1448 TSval=1715473449 TSecr=1969564019 [TCP PDU reassembled in 215]
201,15.362563,172.66.164.67,100.86.121.59,TCP,1514,443  >  53996 [ACK] Seq=71589 Ack=13143 Win=17 Len=1448 TSval=1715473449 TSecr=1969564019 [TCP PDU reassembled in 215]
202,15.362661,100.86.121.59,172.66.164.67,TCP,66,53996  >  443 [ACK] Seq=13143 Ack=73037 Win=2003 Len=0 TSval=1969565067 TSecr=1715473449
203,15.363005,100.86.121.59,172.66.164.67,TCP,66,[TCP Window Update] 53996  >  443 [ACK] Seq=13143 Ack=73037 Win=2048 Len=0 TSval=1969565068 TSecr=1715473449
204,15.363236,172.66.164.67,100.86.121.59,TCP,1514,443  >  53996 [ACK] Seq=73037 Ack=13143 Win=17 Len=1448 TSval=1715473449 TSecr=1969564019 [TCP PDU reassembled in 215]
205,15.363239,172.66.164.67,100.86.121.59,TCP,1514,443  >  53996 [ACK] Seq=74485 Ack=13143 Win=17 Len=1448 TSval=1715473449 TSecr=1969564019 [TCP PDU reassembled in 215]
206,15.363296,100.86.121.59,172.66.164.67,TCP,66,53996  >  443 [ACK] Seq=13143 Ack=75933 Win=2003 Len=0 TSval=1969565068 TSecr=1715473449
207,15.363532,100.86.121.59,172.66.164.67,TCP,66,[TCP Window Update] 53996  >  443 [ACK] Seq=13143 Ack=75933 Win=2048 Len=0 TSval=1969565068 TSecr=1715473449
208,15.364547,172.66.164.67,100.86.121.59,TCP,1514,443  >  53996 [ACK] Seq=75933 Ack=13143 Win=17 Len=1448 TSval=1715473449 TSecr=1969564019 [TCP PDU reassembled in 215]
209,15.364549,172.66.164.67,100.86.121.59,TCP,1514,443  >  53996 [ACK] Seq=77381 Ack=13143 Win=17 Len=1448 TSval=1715473449 TSecr=1969564019 [TCP PDU reassembled in 215]
210,15.364552,172.66.164.67,100.86.121.59,TCP,1514,443  >  53996 [ACK] Seq=78829 Ack=13143 Win=17 Len=1448 TSval=1715473449 TSecr=1969564019 [TCP PDU reassembled in 215]
211,15.364554,172.66.164.67,100.86.121.59,TCP,1514,"443  >  53996 [PSH, ACK] Seq=80277 Ack=13143 Win=17 Len=1448 TSval=1715473449 TSecr=1969564019 [TCP PDU reassembled in 215]"
212,15.364557,172.66.164.67,100.86.121.59,TCP,1514,443  >  53996 [ACK] Seq=81725 Ack=13143 Win=17 Len=1448 TSval=1715473450 TSecr=1969564019 [TCP PDU reassembled in 215]
213,15.364559,172.66.164.67,100.86.121.59,TCP,1514,443  >  53996 [ACK] Seq=83173 Ack=13143 Win=17 Len=1448 TSval=1715473450 TSecr=1969564019 [TCP PDU reassembled in 215]
214,15.364562,172.66.164.67,100.86.121.59,TCP,1514,443  >  53996 [ACK] Seq=84621 Ack=13143 Win=17 Len=1448 TSval=1715473450 TSecr=1969564019 [TCP PDU reassembled in 215]
215,15.364565,172.66.164.67,100.86.121.59,TLSv1.2,544,Application Data
216,15.364568,172.66.164.67,100.86.121.59,TCP,1514,443  >  53996 [ACK] Seq=86547 Ack=13143 Win=17 Len=1448 TSval=1715473450 TSecr=1969564019 [TCP PDU reassembled in 222]
217,15.364571,172.66.164.67,100.86.121.59,TCP,1514,443  >  53996 [ACK] Seq=87995 Ack=13143 Win=17 Len=1448 TSval=1715473450 TSecr=1969564019 [TCP PDU reassembled in 222]
218,15.364573,172.66.164.67,100.86.121.59,TCP,1514,443  >  53996 [ACK] Seq=89443 Ack=13143 Win=17 Len=1448 TSval=1715473450 TSecr=1969564019 [TCP PDU reassembled in 222]
219,15.364576,172.66.164.67,100.86.121.59,TCP,1514,443  >  53996 [ACK] Seq=90891 Ack=13143 Win=17 Len=1448 TSval=1715473450 TSecr=1969564019 [TCP PDU reassembled in 222]
220,15.36458,172.66.164.67,100.86.121.59,TCP,1514,443  >  53996 [ACK] Seq=92339 Ack=13143 Win=17 Len=1448 TSval=1715473450 TSecr=1969564019 [TCP PDU reassembled in 222]
221,15.364582,172.66.164.67,100.86.121.59,TCP,1514,443  >  53996 [ACK] Seq=93787 Ack=13143 Win=17 Len=1448 TSval=1715473450 TSecr=1969564019 [TCP PDU reassembled in 222]
222,15.364585,172.66.164.67,100.86.121.59,TLSv1.2,513,Application Data
223,15.364587,172.66.164.67,100.86.121.59,TLSv1.2,97,Application Data
224,15.364705,100.86.121.59,172.66.164.67,TCP,66,53996  >  443 [ACK] Seq=13143 Ack=90891 Win=1815 Len=0 TSval=1969565069 TSecr=1715473450
225,15.364733,100.86.121.59,172.66.164.67,TCP,66,53996  >  443 [ACK] Seq=13143 Ack=95713 Win=1740 Len=0 TSval=1969565069 TSecr=1715473451
226,15.364867,100.86.121.59,172.66.164.67,TCP,66,[TCP Window Update] 53996  >  443 [ACK] Seq=13143 Ack=95713 Win=2048 Len=0 TSval=1969565070 TSecr=1715473451
227,15.416649,100.86.121.59,172.66.164.67,TLSv1.2,309,Application Data
228,15.442869,100.86.121.59,172.66.164.67,TLSv1.2,1276,Application Data
229,15.443287,100.86.121.59,172.66.164.67,TLSv1.2,306,Application Data
230,15.443493,100.86.121.59,172.66.164.67,TLSv1.2,537,Application Data
231,15.443595,100.86.121.59,172.66.164.67,TLSv1.2,243,Application Data
232,15.443677,100.86.121.59,172.66.164.67,TLSv1.2,196,Application Data
233,15.446693,172.66.164.67,100.86.121.59,TCP,97,"[TCP Spurious Retransmission] 443  >  53996 [PSH, ACK] Seq=95682 Ack=13143 Win=17 Len=31 TSval=1715473506 TSecr=1969564019"
234,15.446757,100.86.121.59,172.66.164.67,TCP,78,[TCP Dup ACK 225#1] 53996  >  443 [ACK] Seq=15614 Ack=95713 Win=2048 Len=0 TSval=1969565151 TSecr=1715473506 SLE=95682 SRE=95713
235,15.505398,100.86.121.59,172.66.164.67,TCP,1454,"[TCP Retransmission] 53996  >  443 [PSH, ACK] Seq=14226 Ack=95713 Win=2048 Len=1388 TSval=1969565210 TSecr=1715473506"
236,15.522711,172.66.164.67,100.86.121.59,TCP,66,443  >  53996 [ACK] Seq=95713 Ack=13386 Win=17 Len=0 TSval=1715473589 TSecr=1969565121
237,15.522714,172.66.164.67,100.86.121.59,TCP,66,443  >  53996 [ACK] Seq=95713 Ack=15614 Win=17 Len=0 TSval=1715473590 TSecr=1969565148
238,15.540793,172.66.164.67,100.86.121.59,TLSv1.2,128,Application Data
239,15.540795,172.66.164.67,100.86.121.59,TLSv1.2,108,Application Data
240,15.540867,100.86.121.59,172.66.164.67,TCP,66,53996  >  443 [ACK] Seq=15614 Ack=95817 Win=2047 Len=0 TSval=1969565246 TSecr=1715473611
241,15.542219,172.66.164.67,100.86.121.59,TLSv1.2,97,Application Data
242,15.54222,172.66.164.67,100.86.121.59,TLSv1.2,216,Application Data
243,15.542221,172.66.164.67,100.86.121.59,TLSv1.2,290,Application Data
244,15.542222,172.66.164.67,100.86.121.59,TLSv1.2,97,Application Data
245,15.542224,172.66.164.67,100.86.121.59,TLSv1.2,208,Application Data
246,15.542224,172.66.164.67,100.86.121.59,TLSv1.2,290,Application Data
247,15.542225,172.66.164.67,100.86.121.59,TLSv1.2,97,Application Data
248,15.542228,172.66.164.67,100.86.121.59,TLSv1.2,127,Application Data
249,15.542229,172.66.164.67,100.86.121.59,TLSv1.2,290,Application Data
250,15.54223,172.66.164.67,100.86.121.59,TLSv1.2,97,Application Data
251,15.542231,172.66.164.67,100.86.121.59,TLSv1.2,127,Application Data
252,15.542232,172.66.164.67,100.86.121.59,TLSv1.2,290,Application Data
253,15.542233,172.66.164.67,100.86.121.59,TLSv1.2,97,Application Data
254,15.542234,172.66.164.67,100.86.121.59,TLSv1.2,127,Application Data
255,15.542235,172.66.164.67,100.86.121.59,TLSv1.2,290,Application Data
256,15.542236,172.66.164.67,100.86.121.59,TLSv1.2,97,Application Data
257,15.54238,100.86.121.59,172.66.164.67,TCP,66,53996  >  443 [ACK] Seq=15614 Ack=97598 Win=2021 Len=0 TSval=1969565247 TSecr=1715473618
258,15.573348,172.66.164.67,100.86.121.59,TCP,78,[TCP Dup ACK 237#1] 443  >  53996 [ACK] Seq=97598 Ack=15614 Win=17 Len=0 TSval=1715473660 TSecr=1969565210 SLE=14226 SRE=15614
259,20.550984,100.86.121.59,172.66.164.67,TLSv1.2,195,Application Data
260,20.551791,100.86.121.59,172.66.164.67,TLSv1.2,200,Application Data
261,20.552101,100.86.121.59,172.66.164.67,TLSv1.2,352,Application Data
262,20.552426,100.86.121.59,172.66.164.67,TLSv1.2,1294,Application Data
263,20.552734,100.86.121.59,172.66.164.67,TLSv1.2,308,Application Data
264,20.560811,172.66.164.67,100.86.121.59,TCP,66,443  >  53996 [ACK] Seq=97598 Ack=15743 Win=17 Len=0 TSval=1715478672 TSecr=1969570256
265,20.561277,172.66.164.67,100.86.121.59,TCP,66,443  >  53996 [ACK] Seq=97598 Ack=15877 Win=17 Len=0 TSval=1715478673 TSecr=1969570256
266,20.562599,172.66.164.67,100.86.121.59,TCP,66,443  >  53996 [ACK] Seq=97598 Ack=17633 Win=17 Len=0 TSval=1715478674 TSecr=1969570257
267,20.58546,172.66.164.67,100.86.121.59,TLSv1.2,156,Application Data
268,20.58569,100.86.121.59,172.66.164.67,TCP,66,53996  >  443 [ACK] Seq=17633 Ack=97688 Win=2047 Len=0 TSval=1969570290 TSecr=1715478697
269,20.585743,172.66.164.67,100.86.121.59,TLSv1.2,290,Application Data
270,20.585745,172.66.164.67,100.86.121.59,TLSv1.2,97,Application Data
271,20.585855,100.86.121.59,172.66.164.67,TCP,66,53996  >  443 [ACK] Seq=17633 Ack=97943 Win=2044 Len=0 TSval=1969570290 TSecr=1715478697
272,20.586372,172.66.164.67,100.86.121.59,TLSv1.2,127,Application Data
273,20.586434,100.86.121.59,172.66.164.67,TCP,66,53996  >  443 [ACK] Seq=17633 Ack=98004 Win=2048 Len=0 TSval=1969570291 TSecr=1715478698
274,20.586517,172.66.164.67,100.86.121.59,TLSv1.2,290,Application Data
275,20.586519,172.66.164.67,100.86.121.59,TLSv1.2,97,Application Data
276,20.586564,100.86.121.59,172.66.164.67,TCP,66,53996  >  443 [ACK] Seq=17633 Ack=98259 Win=2045 Len=0 TSval=1969570291 TSecr=1715478698
277,20.58783,172.66.164.67,100.86.121.59,TLSv1.2,127,Application Data
278,20.587833,172.66.164.67,100.86.121.59,TLSv1.2,290,Application Data
279,20.587932,172.66.164.67,100.86.121.59,TLSv1.2,97,Application Data
280,20.588001,100.86.121.59,172.66.164.67,TCP,66,53996  >  443 [ACK] Seq=17633 Ack=98544 Win=2044 Len=0 TSval=1969570293 TSecr=1715478700
281,20.588063,100.86.121.59,172.66.164.67,TCP,66,53996  >  443 [ACK] Seq=17633 Ack=98575 Win=2044 Len=0 TSval=1969570293 TSecr=1715478700
282,20.588715,172.66.164.67,100.86.121.59,TLSv1.2,157,Application Data
283,20.588717,172.66.164.67,100.86.121.59,TLSv1.2,290,Application Data
284,20.588821,100.86.121.59,172.66.164.67,TCP,66,53996  >  443 [ACK] Seq=17633 Ack=98890 Win=2040 Len=0 TSval=1969570293 TSecr=1715478700
285,20.58951,172.66.164.67,100.86.121.59,TLSv1.2,97,Application Data
286,20.589512,172.66.164.67,100.86.121.59,TLSv1.2,127,Application Data
287,20.589513,172.66.164.67,100.86.121.59,TLSv1.2,290,Application Data
288,20.589638,100.86.121.59,172.66.164.67,TCP,66,53996  >  443 [ACK] Seq=17633 Ack=99206 Win=2036 Len=0 TSval=1969570294 TSecr=1715478701
289,20.589846,172.66.164.67,100.86.121.59,TLSv1.2,97,Application Data
290,20.589901,100.86.121.59,172.66.164.67,TCP,66,53996  >  443 [ACK] Seq=17633 Ack=99237 Win=2048 Len=0 TSval=1969570295 TSecr=1715478701
291,20.5906,100.86.121.59,172.66.164.67,TLSv1.2,101,Application Data
292,20.643981,172.66.164.67,100.86.121.59,TCP,66,443  >  53996 [ACK] Seq=99237 Ack=17668 Win=17 Len=0 TSval=1715478756 TSecr=1969570295
293,25.24646,100.86.121.59,172.66.164.67,TCP,54,54220  >  443 [ACK] Seq=1 Ack=1 Win=2048 Len=0
294,25.246921,100.86.121.59,172.66.164.67,TCP,54,[TCP Keep-Alive] 53996  >  443 [ACK] Seq=17667 Ack=99237 Win=2048 Len=0
295,25.259743,172.66.164.67,100.86.121.59,TCP,66,[TCP ACKed unseen segment] 443  >  54220 [ACK] Seq=1 Ack=2 Win=16 Len=0 TSval=1126956534 TSecr=579974848
296,25.259758,172.66.164.67,100.86.121.59,TCP,66,[TCP Keep-Alive ACK] 443  >  53996 [ACK] Seq=99237 Ack=17668 Win=17 Len=0 TSval=1715483370 TSecr=1969570295
297,25.623744,100.86.121.59,172.66.164.67,TLSv1.2,641,Application Data
298,25.633608,172.66.164.67,100.86.121.59,TCP,66,443  >  53996 [ACK] Seq=99237 Ack=18243 Win=17 Len=0 TSval=1715483745 TSecr=1969575328
299,25.711044,172.66.164.67,100.86.121.59,TLSv1.2,305,Application Data
300,25.711134,100.86.121.59,172.66.164.67,TCP,66,53996  >  443 [ACK] Seq=18243 Ack=99476 Win=2045 Len=0 TSval=1969575416 TSecr=1715483822
301,25.71152,172.66.164.67,100.86.121.59,TCP,1514,443  >  53996 [ACK] Seq=99476 Ack=18243 Win=17 Len=1448 TSval=1715483823 TSecr=1969575328 [TCP PDU reassembled in 317]
302,25.711568,100.86.121.59,172.66.164.67,TCP,66,53996  >  443 [ACK] Seq=18243 Ack=100924 Win=2026 Len=0 TSval=1969575416 TSecr=1715483823
303,25.711881,172.66.164.67,100.86.121.59,TCP,1514,443  >  53996 [ACK] Seq=100924 Ack=18243 Win=17 Len=1448 TSval=1715483823 TSecr=1969575328 [TCP PDU reassembled in 317]
304,25.711883,172.66.164.67,100.86.121.59,TCP,1514,443  >  53996 [ACK] Seq=102372 Ack=18243 Win=17 Len=1448 TSval=1715483823 TSecr=1969575328 [TCP PDU reassembled in 317]
305,25.711909,100.86.121.59,172.66.164.67,TCP,66,53996  >  443 [ACK] Seq=18243 Ack=103820 Win=2003 Len=0 TSval=1969575417 TSecr=1715483823
306,25.71213,100.86.121.59,172.66.164.67,TCP,66,[TCP Window Update] 53996  >  443 [ACK] Seq=18243 Ack=103820 Win=2048 Len=0 TSval=1969575417 TSecr=1715483823
307,25.713925,172.66.164.67,100.86.121.59,TCP,1514,443  >  53996 [ACK] Seq=103820 Ack=18243 Win=17 Len=1448 TSval=1715483823 TSecr=1969575328 [TCP PDU reassembled in 317]
308,25.713926,172.66.164.67,100.86.121.59,TCP,1514,443  >  53996 [ACK] Seq=105268 Ack=18243 Win=17 Len=1448 TSval=1715483823 TSecr=1969575328 [TCP PDU reassembled in 317]
309,25.713928,172.66.164.67,100.86.121.59,TCP,1514,443  >  53996 [ACK] Seq=106716 Ack=18243 Win=17 Len=1448 TSval=1715483823 TSecr=1969575328 [TCP PDU reassembled in 317]
310,25.713929,172.66.164.67,100.86.121.59,TCP,1514,443  >  53996 [ACK] Seq=108164 Ack=18243 Win=17 Len=1448 TSval=1715483823 TSecr=1969575328 [TCP PDU reassembled in 317]
311,25.71393,172.66.164.67,100.86.121.59,TCP,1514,"443  >  53996 [PSH, ACK] Seq=109612 Ack=18243 Win=17 Len=1448 TSval=1715483823 TSecr=1969575328 [TCP PDU reassembled in 317]"
312,25.713956,100.86.121.59,172.66.164.67,TCP,66,53996  >  443 [ACK] Seq=18243 Ack=111060 Win=1935 Len=0 TSval=1969575419 TSecr=1715483823
313,25.714012,100.86.121.59,172.66.164.67,TCP,66,[TCP Window Update] 53996  >  443 [ACK] Seq=18243 Ack=111060 Win=2048 Len=0 TSval=1969575419 TSecr=1715483823
314,25.715792,172.66.164.67,100.86.121.59,TCP,1514,443  >  53996 [ACK] Seq=111060 Ack=18243 Win=17 Len=1448 TSval=1715483823 TSecr=1969575328 [TCP PDU reassembled in 317]
315,25.715794,172.66.164.67,100.86.121.59,TCP,1514,443  >  53996 [ACK] Seq=112508 Ack=18243 Win=17 Len=1448 TSval=1715483823 TSecr=1969575328 [TCP PDU reassembled in 317]
316,25.715796,172.66.164.67,100.86.121.59,TCP,1514,443  >  53996 [ACK] Seq=113956 Ack=18243 Win=17 Len=1448 TSval=1715483823 TSecr=1969575328 [TCP PDU reassembled in 317]
317,25.715798,172.66.164.67,100.86.121.59,TLSv1.2,544,Application Data
318,25.715799,172.66.164.67,100.86.121.59,TCP,1514,443  >  53996 [ACK] Seq=115882 Ack=18243 Win=17 Len=1448 TSval=1715483824 TSecr=1969575328 [TCP PDU reassembled in 326]
319,25.715801,172.66.164.67,100.86.121.59,TCP,1514,443  >  53996 [ACK] Seq=117330 Ack=18243 Win=17 Len=1448 TSval=1715483824 TSecr=1969575328 [TCP PDU reassembled in 326]
320,25.715803,172.66.164.67,100.86.121.59,TCP,1514,443  >  53996 [ACK] Seq=118778 Ack=18243 Win=17 Len=1448 TSval=1715483824 TSecr=1969575328 [TCP PDU reassembled in 326]
321,25.715805,172.66.164.67,100.86.121.59,TCP,1514,443  >  53996 [ACK] Seq=120226 Ack=18243 Win=17 Len=1448 TSval=1715483824 TSecr=1969575328 [TCP PDU reassembled in 326]
322,25.715807,172.66.164.67,100.86.121.59,TCP,1514,443  >  53996 [ACK] Seq=121674 Ack=18243 Win=17 Len=1448 TSval=1715483824 TSecr=1969575328 [TCP PDU reassembled in 326]
323,25.715809,172.66.164.67,100.86.121.59,TCP,1514,443  >  53996 [ACK] Seq=123122 Ack=18243 Win=17 Len=1448 TSval=1715483824 TSecr=1969575328 [TCP PDU reassembled in 326]
324,25.71581,172.66.164.67,100.86.121.59,TCP,1514,443  >  53996 [ACK] Seq=124570 Ack=18243 Win=17 Len=1448 TSval=1715483824 TSecr=1969575328 [TCP PDU reassembled in 326]
325,25.715812,172.66.164.67,100.86.121.59,TCP,1514,"443  >  53996 [PSH, ACK] Seq=126018 Ack=18243 Win=17 Len=1448 TSval=1715483824 TSecr=1969575328 [TCP PDU reassembled in 326]"
326,25.715814,172.66.164.67,100.86.121.59,TLSv1.2,924,"Application Data, Application Data"
327,25.71587,100.86.121.59,172.66.164.67,TCP,66,53996  >  443 [ACK] Seq=18243 Ack=126018 Win=1815 Len=0 TSval=1969575421 TSecr=1715483824
328,25.7159,100.86.121.59,172.66.164.67,TCP,66,53996  >  443 [ACK] Seq=18243 Ack=128324 Win=1779 Len=0 TSval=1969575421 TSecr=1715483825
329,25.715919,100.86.121.59,172.66.164.67,TCP,66,[TCP Window Update] 53996  >  443 [ACK] Seq=18243 Ack=128324 Win=2048 Len=0 TSval=1969575421 TSecr=1715483825
330,25.717789,100.86.121.59,172.66.164.67,TLSv1.2,101,Application Data
331,25.727571,172.66.164.67,100.86.121.59,TCP,66,443  >  53996 [ACK] Seq=128324 Ack=18278 Win=17 Len=0 TSval=1715483839 TSecr=1969575422
332,25.749355,100.86.121.59,172.66.164.67,TLSv1.2,231,Application Data
333,25.762414,172.66.164.67,100.86.121.59,TCP,66,443  >  53996 [ACK] Seq=128324 Ack=18443 Win=17 Len=0 TSval=1715483874 TSecr=1969575454
334,25.782895,100.86.121.59,172.66.164.67,TLSv1.2,463,Application Data
335,25.783096,100.86.121.59,172.66.164.67,TLSv1.2,197,Application Data
336,25.783205,100.86.121.59,172.66.164.67,TLSv1.2,1091,Application Data
337,25.78339,100.86.121.59,172.66.164.67,TLSv1.2,309,Application Data
338,25.783545,100.86.121.59,172.66.164.67,TLSv1.2,198,Application Data
339,25.80551,172.66.164.67,100.86.121.59,TLSv1.2,177,Application Data
340,25.805511,172.66.164.67,100.86.121.59,TLSv1.2,108,Application Data
341,25.805512,172.66.164.67,100.86.121.59,TLSv1.2,97,Application Data
342,25.805614,100.86.121.59,172.66.164.67,TCP,66,53996  >  443 [ACK] Seq=20371 Ack=128508 Win=2046 Len=0 TSval=1969575510 TSecr=1715483899
343,25.807983,172.66.164.67,100.86.121.59,TCP,66,443  >  53996 [ACK] Seq=128508 Ack=20371 Win=17 Len=0 TSval=1715483911 TSecr=1969575488
344,25.827764,172.66.164.67,100.86.121.59,TLSv1.2,127,Application Data
345,25.827766,172.66.164.67,100.86.121.59,TLSv1.2,290,Application Data
346,25.827801,100.86.121.59,172.66.164.67,TCP,66,53996  >  443 [ACK] Seq=20371 Ack=128793 Win=2044 Len=0 TSval=1969575532 TSecr=1715483939
347,25.828153,172.66.164.67,100.86.121.59,TLSv1.2,97,Application Data
348,25.828173,100.86.121.59,172.66.164.67,TCP,66,53996  >  443 [ACK] Seq=20371 Ack=128824 Win=2048 Len=0 TSval=1969575533 TSecr=1715483939
349,25.832639,172.66.164.67,100.86.121.59,TLSv1.2,127,Application Data
350,25.832641,172.66.164.67,100.86.121.59,TLSv1.2,290,Application Data
351,25.832717,100.86.121.59,172.66.164.67,TCP,66,53996  >  443 [ACK] Seq=20371 Ack=129109 Win=2044 Len=0 TSval=1969575537 TSecr=1715483943
352,25.832868,172.66.164.67,100.86.121.59,TLSv1.2,97,Application Data
353,25.832918,100.86.121.59,172.66.164.67,TCP,66,53996  >  443 [ACK] Seq=20371 Ack=129140 Win=2048 Len=0 TSval=1969575538 TSecr=1715483943
354,25.876149,172.66.164.67,100.86.121.59,TLSv1.2,127,Application Data
355,25.876206,100.86.121.59,172.66.164.67,TCP,66,53996  >  443 [ACK] Seq=20371 Ack=129201 Win=2048 Len=0 TSval=1969575581 TSecr=1715483952
356,25.877591,172.66.164.67,100.86.121.59,TLSv1.2,290,Application Data
357,25.877654,100.86.121.59,172.66.164.67,TCP,66,53996  >  443 [ACK] Seq=20371 Ack=129425 Win=2045 Len=0 TSval=1969575582 TSecr=1715483952
358,25.880762,172.66.164.67,100.86.121.59,TLSv1.2,97,Application Data
359,25.880875,100.86.121.59,172.66.164.67,TCP,66,53996  >  443 [ACK] Seq=20371 Ack=129456 Win=2048 Len=0 TSval=1969575586 TSecr=1715483952
360,25.902319,172.66.164.67,100.86.121.59,TLSv1.2,97,"[TCP Previous segment not captured] , Application Data"
361,25.902551,100.86.121.59,172.66.164.67,TCP,78,[TCP Dup ACK 359#1] 53996  >  443 [ACK] Seq=20371 Ack=129456 Win=2048 Len=0 TSval=1969575607 TSecr=1715483952 SLE=130065 SRE=130096
362,25.913749,172.66.164.67,100.86.121.59,TCP,675,"[TCP Retransmission] 443  >  53996 [PSH, ACK] Seq=129456 Ack=20371 Win=17 Len=609 TSval=1715484025 TSecr=1969575607"
363,25.913832,100.86.121.59,172.66.164.67,TCP,66,53996  >  443 [ACK] Seq=20371 Ack=130096 Win=2038 Len=0 TSval=1969575618 TSecr=1715484025
364,26.122483,100.86.121.59,172.66.164.67,TCP,54,[TCP Keep-Alive] 53996  >  443 [ACK] Seq=20370 Ack=130096 Win=2048 Len=0
365,26.158204,172.66.164.67,100.86.121.59,TCP,66,[TCP Keep-Alive ACK] 443  >  53996 [ACK] Seq=130096 Ack=20371 Win=17 Len=0 TSval=1715484253 TSecr=1969575618
366,30.922233,100.86.121.59,172.66.164.67,TLSv1.2,198,Application Data
367,30.957031,172.66.164.67,100.86.121.59,TLSv1.2,150,Application Data
368,30.957036,172.66.164.67,100.86.121.59,TLSv1.2,290,Application Data
369,30.957039,172.66.164.67,100.86.121.59,TLSv1.2,97,Application Data
370,30.957306,100.86.121.59,172.66.164.67,TCP,66,53996  >  443 [ACK] Seq=20503 Ack=130180 Win=2047 Len=0 TSval=1969580662 TSecr=1715489068
371,30.957405,100.86.121.59,172.66.164.67,TCP,66,53996  >  443 [ACK] Seq=20503 Ack=130435 Win=2044 Len=0 TSval=1969580662 TSecr=1715489068
372,30.959408,100.86.121.59,172.66.164.67,TLSv1.2,101,Application Data
373,31.010187,172.66.164.67,100.86.121.59,TCP,66,443  >  53996 [ACK] Seq=130435 Ack=20538 Win=17 Len=0 TSval=1715489122 TSecr=1969580664
374,33.4049,100.86.121.59,172.66.164.67,TLSv1.2,671,Application Data
375,33.416289,172.66.164.67,100.86.121.59,TCP,66,443  >  53996 [ACK] Seq=130435 Ack=21143 Win=17 Len=0 TSval=1715491527 TSecr=1969583110
376,33.802702,172.66.164.67,100.86.121.59,TLSv1.2,264,Application Data
377,33.802849,100.86.121.59,172.66.164.67,TCP,66,53996  >  443 [ACK] Seq=21143 Ack=130633 Win=2045 Len=0 TSval=1969583507 TSecr=1715491913
378,33.804538,172.66.164.67,100.86.121.59,TCP,1514,443  >  53996 [ACK] Seq=130633 Ack=21143 Win=17 Len=1448 TSval=1715491913 TSecr=1969583110 [TCP PDU reassembled in 393]
379,33.804542,172.66.164.67,100.86.121.59,TCP,1514,443  >  53996 [ACK] Seq=132081 Ack=21143 Win=17 Len=1448 TSval=1715491913 TSecr=1969583110 [TCP PDU reassembled in 393]
380,33.804545,172.66.164.67,100.86.121.59,TCP,1514,443  >  53996 [ACK] Seq=133529 Ack=21143 Win=17 Len=1448 TSval=1715491913 TSecr=1969583110 [TCP PDU reassembled in 393]
381,33.804635,100.86.121.59,172.66.164.67,TCP,66,53996  >  443 [ACK] Seq=21143 Ack=134977 Win=1981 Len=0 TSval=1969583509 TSecr=1715491913
382,33.804778,100.86.121.59,172.66.164.67,TCP,66,[TCP Window Update] 53996  >  443 [ACK] Seq=21143 Ack=134977 Win=2048 Len=0 TSval=1969583509 TSecr=1715491913
383,33.804923,172.66.164.67,100.86.121.59,TCP,1514,443  >  53996 [ACK] Seq=134977 Ack=21143 Win=17 Len=1448 TSval=1715491913 TSecr=1969583110 [TCP PDU reassembled in 393]
384,33.804926,172.66.164.67,100.86.121.59,TCP,1514,443  >  53996 [ACK] Seq=136425 Ack=21143 Win=17 Len=1448 TSval=1715491913 TSecr=1969583110 [TCP PDU reassembled in 393]
385,33.804929,172.66.164.67,100.86.121.59,TCP,1514,443  >  53996 [ACK] Seq=137873 Ack=21143 Win=17 Len=1448 TSval=1715491913 TSecr=1969583110 [TCP PDU reassembled in 393]
386,33.804933,172.66.164.67,100.86.121.59,TCP,1514,443  >  53996 [ACK] Seq=139321 Ack=21143 Win=17 Len=1448 TSval=1715491913 TSecr=1969583110 [TCP PDU reassembled in 393]
387,33.805001,100.86.121.59,172.66.164.67,TCP,66,53996  >  443 [ACK] Seq=21143 Ack=140769 Win=1958 Len=0 TSval=1969583510 TSecr=1715491913
388,33.805545,100.86.121.59,172.66.164.67,TCP,66,[TCP Window Update] 53996  >  443 [ACK] Seq=21143 Ack=140769 Win=2048 Len=0 TSval=1969583510 TSecr=1715491913
389,33.806794,172.66.164.67,100.86.121.59,TCP,1514,"443  >  53996 [PSH, ACK] Seq=140769 Ack=21143 Win=17 Len=1448 TSval=1715491913 TSecr=1969583110 [TCP PDU reassembled in 393]"
390,33.806797,172.66.164.67,100.86.121.59,TCP,1514,443  >  53996 [ACK] Seq=142217 Ack=21143 Win=17 Len=1448 TSval=1715491914 TSecr=1969583110 [TCP PDU reassembled in 393]
391,33.8068,172.66.164.67,100.86.121.59,TCP,1514,443  >  53996 [ACK] Seq=143665 Ack=21143 Win=17 Len=1448 TSval=1715491914 TSecr=1969583110 [TCP PDU reassembled in 393]
392,33.806802,172.66.164.67,100.86.121.59,TCP,1514,443  >  53996 [ACK] Seq=145113 Ack=21143 Win=17 Len=1448 TSval=1715491914 TSecr=1969583110 [TCP PDU reassembled in 393]
393,33.806805,172.66.164.67,100.86.121.59,TLSv1.2,544,Application Data
394,33.806894,100.86.121.59,172.66.164.67,TCP,66,53996  >  443 [ACK] Seq=21143 Ack=147039 Win=1951 Len=0 TSval=1969583511 TSecr=1715491914
395,33.806948,100.86.121.59,172.66.164.67,TCP,66,[TCP Window Update] 53996  >  443 [ACK] Seq=21143 Ack=147039 Win=2048 Len=0 TSval=1969583512 TSecr=1715491914
396,33.807201,172.66.164.67,100.86.121.59,TCP,1514,443  >  53996 [ACK] Seq=147039 Ack=21143 Win=17 Len=1448 TSval=1715491914 TSecr=1969583110 [TCP PDU reassembled in 404]
397,33.807203,172.66.164.67,100.86.121.59,TCP,1514,443  >  53996 [ACK] Seq=148487 Ack=21143 Win=17 Len=1448 TSval=1715491914 TSecr=1969583110 [TCP PDU reassembled in 404]
398,33.807241,100.86.121.59,172.66.164.67,TCP,66,53996  >  443 [ACK] Seq=21143 Ack=149935 Win=2003 Len=0 TSval=1969583512 TSecr=1715491914
399,33.807267,100.86.121.59,172.66.164.67,TCP,66,[TCP Window Update] 53996  >  443 [ACK] Seq=21143 Ack=149935 Win=2048 Len=0 TSval=1969583512 TSecr=1715491914
400,33.80841,172.66.164.67,100.86.121.59,TCP,1514,443  >  53996 [ACK] Seq=149935 Ack=21143 Win=17 Len=1448 TSval=1715491914 TSecr=1969583110 [TCP PDU reassembled in 404]
401,33.808412,172.66.164.67,100.86.121.59,TCP,1514,443  >  53996 [ACK] Seq=151383 Ack=21143 Win=17 Len=1448 TSval=1715491914 TSecr=1969583110 [TCP PDU reassembled in 404]
402,33.808414,172.66.164.67,100.86.121.59,TCP,1514,443  >  53996 [ACK] Seq=152831 Ack=21143 Win=17 Len=1448 TSval=1715491914 TSecr=1969583110 [TCP PDU reassembled in 404]
403,33.808417,172.66.164.67,100.86.121.59,TCP,1514,443  >  53996 [ACK] Seq=154279 Ack=21143 Win=17 Len=1448 TSval=1715491914 TSecr=1969583110 [TCP PDU reassembled in 404]
404,33.80842,172.66.164.67,100.86.121.59,TLSv1.2,472,Application Data
405,33.808422,172.66.164.67,100.86.121.59,TLSv1.2,97,Application Data
406,33.808475,100.86.121.59,172.66.164.67,TCP,66,53996  >  443 [ACK] Seq=21143 Ack=156164 Win=1951 Len=0 TSval=1969583513 TSecr=1715491915
407,33.810822,100.86.121.59,172.66.164.67,TCP,66,[TCP Window Update] 53996  >  443 [ACK] Seq=21143 Ack=156164 Win=2048 Len=0 TSval=1969583515 TSecr=1715491915
408,33.859286,100.86.121.59,172.66.164.67,TLSv1.2,261,Application Data
409,33.868752,172.66.164.67,100.86.121.59,TCP,66,443  >  53996 [ACK] Seq=156164 Ack=21338 Win=17 Len=0 TSval=1715491980 TSecr=1969583564
410,33.881918,100.86.121.59,172.66.164.67,TLSv1.2,1357,Application Data
411,33.882359,100.86.121.59,172.66.164.67,TLSv1.2,306,Application Data
412,33.882613,100.86.121.59,172.66.164.67,TLSv1.2,200,Application Data
413,33.882854,100.86.121.59,172.66.164.67,TLSv1.2,198,Application Data
414,33.882952,100.86.121.59,172.66.164.67,TLSv1.2,196,Application Data
415,33.897381,172.66.164.67,100.86.121.59,TLSv1.2,128,Application Data
416,33.897464,100.86.121.59,172.66.164.67,TCP,66,53996  >  443 [ACK] Seq=23265 Ack=156226 Win=2048 Len=0 TSval=1969583602 TSecr=1715492002
417,33.897931,172.66.164.67,100.86.121.59,TLSv1.2,108,Application Data
418,33.897932,172.66.164.67,100.86.121.59,TLSv1.2,97,Application Data
419,33.897967,100.86.121.59,172.66.164.67,TCP,66,53996  >  443 [ACK] Seq=23265 Ack=156299 Win=2047 Len=0 TSval=1969583603 TSecr=1715492002
420,33.905013,172.66.164.67,100.86.121.59,TCP,66,443  >  53996 [ACK] Seq=156299 Ack=22869 Win=17 Len=0 TSval=1715492017 TSecr=1969583586
421,33.905267,172.66.164.67,100.86.121.59,TCP,66,443  >  53996 [ACK] Seq=156299 Ack=23265 Win=17 Len=0 TSval=1715492017 TSecr=1969583587
422,33.929466,172.66.164.67,100.86.121.59,TLSv1.2,127,Application Data
423,33.929468,172.66.164.67,100.86.121.59,TLSv1.2,290,Application Data
424,33.929532,100.86.121.59,172.66.164.67,TCP,66,53996  >  443 [ACK] Seq=23265 Ack=156584 Win=2044 Len=0 TSval=1969583634 TSecr=1715492041
425,33.929629,172.66.164.67,100.86.121.59,TLSv1.2,97,Application Data
426,33.929649,100.86.121.59,172.66.164.67,TCP,66,53996  >  443 [ACK] Seq=23265 Ack=156615 Win=2048 Len=0 TSval=1969583634 TSecr=1715492041
427,33.92984,172.66.164.67,100.86.121.59,TLSv1.2,127,Application Data
428,33.929841,172.66.164.67,100.86.121.59,TLSv1.2,290,Application Data
429,33.929842,172.66.164.67,100.86.121.59,TLSv1.2,97,Application Data
430,33.929864,100.86.121.59,172.66.164.67,TCP,66,53996  >  443 [ACK] Seq=23265 Ack=156931 Win=2044 Len=0 TSval=1969583634 TSecr=1715492041
431,33.931179,172.66.164.67,100.86.121.59,TLSv1.2,127,Application Data
432,33.93118,172.66.164.67,100.86.121.59,TLSv1.2,290,Application Data
433,33.931206,100.86.121.59,172.66.164.67,TCP,66,53996  >  443 [ACK] Seq=23265 Ack=157216 Win=2044 Len=0 TSval=1969583636 TSecr=1715492042
434,33.931584,172.66.164.67,100.86.121.59,TLSv1.2,97,Application Data
435,33.931585,172.66.164.67,100.86.121.59,TLSv1.2,127,Application Data
436,33.931586,172.66.164.67,100.86.121.59,TLSv1.2,290,Application Data
437,33.931604,100.86.121.59,172.66.164.67,TCP,66,53996  >  443 [ACK] Seq=23265 Ack=157532 Win=2044 Len=0 TSval=1969583636 TSecr=1715492043
438,33.932148,172.66.164.67,100.86.121.59,TLSv1.2,97,Application Data
439,33.932149,172.66.164.67,100.86.121.59,TLSv1.2,127,Application Data
440,33.932165,100.86.121.59,172.66.164.67,TCP,66,53996  >  443 [ACK] Seq=23265 Ack=157624 Win=2047 Len=0 TSval=1969583637 TSecr=1715492044
441,33.934027,172.66.164.67,100.86.121.59,TLSv1.2,290,Application Data
442,33.934029,172.66.164.67,100.86.121.59,TLSv1.2,97,Application Data
443,33.934131,100.86.121.59,172.66.164.67,TCP,66,53996  >  443 [ACK] Seq=23265 Ack=157879 Win=2045 Len=0 TSval=1969583639 TSecr=1715492044
444,38.943421,100.86.121.59,172.66.164.67,TLSv1.2,196,Application Data
445,38.982205,172.66.164.67,100.86.121.59,TLSv1.2,150,Application Data
446,38.982209,172.66.164.67,100.86.121.59,TLSv1.2,290,Application Data
447,38.982213,172.66.164.67,100.86.121.59,TLSv1.2,97,Application Data
448,38.982498,100.86.121.59,172.66.164.67,TCP,66,53996  >  443 [ACK] Seq=23395 Ack=158218 Win=2043 Len=0 TSval=1969588687 TSecr=1715497094
449,38.984391,100.86.121.59,172.66.164.67,TLSv1.2,101,Application Data
450,39.03627,172.66.164.67,100.86.121.59,TCP,66,443  >  53996 [ACK] Seq=158218 Ack=23430 Win=17 Len=0 TSval=1715497148 TSecr=1969588689
451,43.942172,100.86.121.59,172.66.164.67,TLSv1.2,533,Application Data
452,43.943027,100.86.121.59,172.66.164.67,TLSv1.2,199,Application Data
453,43.943367,100.86.121.59,172.66.164.67,TLSv1.2,304,Application Data
454,43.943737,100.86.121.59,172.66.164.67,TLSv1.2,1387,Application Data
455,43.955149,172.66.164.67,100.86.121.59,TCP,66,443  >  53996 [ACK] Seq=158218 Ack=24030 Win=17 Len=0 TSval=1715502066 TSecr=1969593648
456,43.955734,172.66.164.67,100.86.121.59,TCP,66,443  >  53996 [ACK] Seq=158218 Ack=25589 Win=17 Len=0 TSval=1715502067 TSecr=1969593648
457,43.977412,172.66.164.67,100.86.121.59,TLSv1.2,150,Application Data
458,43.977417,172.66.164.67,100.86.121.59,TLSv1.2,290,Application Data
459,43.977614,100.86.121.59,172.66.164.67,TCP,66,53996  >  443 [ACK] Seq=25589 Ack=158526 Win=2044 Len=0 TSval=1969593682 TSecr=1715502089
460,43.977733,172.66.164.67,100.86.121.59,TLSv1.2,97,Application Data
461,43.97783,100.86.121.59,172.66.164.67,TCP,66,53996  >  443 [ACK] Seq=25589 Ack=158557 Win=2044 Len=0 TSval=1969593682 TSecr=1715502089
462,43.978303,172.66.164.67,100.86.121.59,TLSv1.2,127,Application Data
463,43.978306,172.66.164.67,100.86.121.59,TLSv1.2,290,Application Data
464,43.97837,100.86.121.59,172.66.164.67,TCP,66,53996  >  443 [ACK] Seq=25589 Ack=158842 Win=2044 Len=0 TSval=1969593683 TSecr=1715502089
465,43.979394,172.66.164.67,100.86.121.59,TLSv1.2,97,Application Data
466,43.979524,100.86.121.59,172.66.164.67,TCP,66,53996  >  443 [ACK] Seq=25589 Ack=158873 Win=2048 Len=0 TSval=1969593684 TSecr=1715502089
467,43.984489,172.66.164.67,100.86.121.59,TLSv1.2,127,Application Data
468,43.984601,100.86.121.59,172.66.164.67,TCP,66,53996  >  443 [ACK] Seq=25589 Ack=158934 Win=2048 Len=0 TSval=1969593689 TSecr=1715502096
469,43.984649,172.66.164.67,100.86.121.59,TLSv1.2,290,Application Data
470,43.984652,172.66.164.67,100.86.121.59,TLSv1.2,97,Application Data
471,43.984702,100.86.121.59,172.66.164.67,TCP,66,53996  >  443 [ACK] Seq=25589 Ack=159189 Win=2045 Len=0 TSval=1969593689 TSecr=1715502096
472,43.987212,100.86.121.59,172.66.164.67,TLSv1.2,101,Application Data
473,43.993014,172.66.164.67,100.86.121.59,TLSv1.2,127,Application Data
474,43.993016,172.66.164.67,100.86.121.59,TLSv1.2,290,Application Data
475,43.993139,172.66.164.67,100.86.121.59,TLSv1.2,97,Application Data
476,43.99314,100.86.121.59,172.66.164.67,TCP,66,53996  >  443 [ACK] Seq=25624 Ack=159474 Win=2044 Len=0 TSval=1969593698 TSecr=1715502105
477,43.993189,100.86.121.59,172.66.164.67,TCP,66,53996  >  443 [ACK] Seq=25624 Ack=159505 Win=2044 Len=0 TSval=1969593698 TSecr=1715502105
478,44.039137,172.66.164.67,100.86.121.59,TCP,66,443  >  53996 [ACK] Seq=159505 Ack=25624 Win=17 Len=0 TSval=1715502151 TSecr=1969593692
479,48.859732,100.86.121.59,172.66.164.67,TLSv1.2,293,Application Data
480,48.869849,172.66.164.67,100.86.121.59,TCP,66,443  >  53996 [ACK] Seq=159505 Ack=25851 Win=17 Len=0 TSval=1715506981 TSecr=1969598564
481,48.895083,172.66.164.67,100.86.121.59,TLSv1.2,151,Application Data
482,48.895087,172.66.164.67,100.86.121.59,TLSv1.2,108,Application Data
483,48.89529,100.86.121.59,172.66.164.67,TCP,66,53996  >  443 [ACK] Seq=25851 Ack=159632 Win=2047 Len=0 TSval=1969598600 TSecr=1715507006
484,48.895494,172.66.164.67,100.86.121.59,TLSv1.2,97,Application Data
485,48.895599,100.86.121.59,172.66.164.67,TCP,66,53996  >  443 [ACK] Seq=25851 Ack=159663 Win=2047 Len=0 TSval=1969598600 TSecr=1715507006
486,52.465437,100.86.121.59,172.66.164.67,TCP,54,[TCP Dup ACK 293#1] 54220  >  443 [ACK] Seq=1 Ack=1 Win=2048 Len=0
487,52.466146,100.86.121.59,172.66.164.67,TCP,54,[TCP Keep-Alive] 53996  >  443 [ACK] Seq=25850 Ack=159663 Win=2048 Len=0
488,52.479577,172.66.164.67,100.86.121.59,TCP,66,[TCP Dup ACK 295#1] 443  >  54220 [ACK] Seq=1 Ack=2 Win=16 Len=0 TSval=1126983753 TSecr=579974848
489,52.480047,172.66.164.67,100.86.121.59,TCP,66,[TCP Keep-Alive ACK] 443  >  53996 [ACK] Seq=159663 Ack=25851 Win=17 Len=0 TSval=1715510589 TSecr=1969598600
490,53.991459,100.86.121.59,172.66.164.67,TLSv1.2,206,Application Data
491,54.028041,172.66.164.67,100.86.121.59,TLSv1.2,150,Application Data
492,54.028045,172.66.164.67,100.86.121.59,TLSv1.2,290,Application Data
493,54.028047,172.66.164.67,100.86.121.59,TLSv1.2,97,Application Data
494,54.028282,100.86.121.59,172.66.164.67,TCP,66,53996  >  443 [ACK] Seq=25991 Ack=160002 Win=2043 Len=0 TSval=1969603733 TSecr=1715512140
495,54.031138,100.86.121.59,172.66.164.67,TLSv1.2,101,Application Data
496,54.082642,172.66.164.67,100.86.121.59,TCP,66,443  >  53996 [ACK] Seq=160002 Ack=26026 Win=17 Len=0 TSval=1715512194 TSecr=1969603735
497,58.988074,100.86.121.59,172.66.164.67,TLSv1.2,196,Application Data
498,58.990998,100.86.121.59,172.66.164.67,TLSv1.2,199,Application Data
499,59.001012,100.86.121.59,172.66.164.67,TLSv1.2,532,Application Data
500,59.003034,172.66.164.67,100.86.121.59,TCP,66,443  >  53996 [ACK] Seq=160002 Ack=26156 Win=17 Len=0 TSval=1715517114 TSecr=1969608692
501,59.003037,172.66.164.67,100.86.121.59,TCP,66,443  >  53996 [ACK] Seq=160002 Ack=26289 Win=17 Len=0 TSval=1715517114 TSecr=1969608695
502,59.011874,172.66.164.67,100.86.121.59,TCP,66,443  >  53996 [ACK] Seq=160002 Ack=26755 Win=17 Len=0 TSval=1715517123 TSecr=1969608705
503,59.076045,172.66.164.67,100.86.121.59,TLSv1.2,150,Application Data
504,59.076049,172.66.164.67,100.86.121.59,TLSv1.2,290,Application Data
505,59.076213,100.86.121.59,172.66.164.67,TCP,66,53996  >  443 [ACK] Seq=26755 Ack=160310 Win=2044 Len=0 TSval=1969608781 TSecr=1715517136
506,59.077335,172.66.164.67,100.86.121.59,TLSv1.2,97,Application Data
507,59.077337,172.66.164.67,100.86.121.59,TLSv1.2,127,Application Data
508,59.077339,172.66.164.67,100.86.121.59,TLSv1.2,290,Application Data
509,59.077341,172.66.164.67,100.86.121.59,TLSv1.2,97,Application Data
510,59.077343,172.66.164.67,100.86.121.59,TLSv1.2,127,Application Data
511,59.077345,172.66.164.67,100.86.121.59,TLSv1.2,290,Application Data
512,59.077348,172.66.164.67,100.86.121.59,TLSv1.2,97,Application Data
513,59.077436,100.86.121.59,172.66.164.67,TCP,66,53996  >  443 [ACK] Seq=26755 Ack=160973 Win=2038 Len=0 TSval=1969608782 TSecr=1715517146
514,59.07757,172.66.164.67,100.86.121.59,TCP,97,"[TCP Spurious Retransmission] 443  >  53996 [PSH, ACK] Seq=160942 Ack=26755 Win=17 Len=31 TSval=1715517174 TSecr=1969608705"
515,59.077625,100.86.121.59,172.66.164.67,TCP,78,[TCP Dup ACK 513#1] 53996  >  443 [ACK] Seq=26755 Ack=160973 Win=2038 Len=0 TSval=1969608782 TSecr=1715517174 SLE=160942 SRE=160973
516,59.078883,100.86.121.59,172.66.164.67,TLSv1.2,101,Application Data
517,59.13284,172.66.164.67,100.86.121.59,TCP,66,443  >  53996 [ACK] Seq=160973 Ack=26790 Win=17 Len=0 TSval=1715517244 TSecr=1969608783
