"No.","Time","Source","Destination","Protocol","Length","Info"
"1","0.000000","WNC_46:a8:04","Broadcast","ARP","42","Who has 192.168.1.201? Tell 192.168.1.1"
"2","0.413851","34.4.35.11","192.168.1.228","TCP","66","443  >  53292 [ACK] Seq=1 Ack=1 Win=1041 Len=0 TSval=3207037179 TSecr=518277738"
"3","0.413854","3.237.56.7","192.168.1.228","TLSv1.2","112","Application Data"
"4","0.413857","3.237.56.7","192.168.1.228","TLSv1.2","97","Encrypted Alert"
"5","0.413859","3.237.56.7","192.168.1.228","TCP","66","443  >  53416 [FIN, ACK] Seq=78 Ack=1 Win=187 Len=0 TSval=3096924058 TSecr=1208493431"
"6","0.413861","3.237.56.7","192.168.1.228","TCP","66","[TCP Retransmission] 443  >  53416 [FIN, ACK] Seq=78 Ack=1 Win=187 Len=0 TSval=3096924089 TSecr=1208493431"
"7","0.414095","192.168.1.228","34.4.35.11","TCP","66","[TCP ACKed unseen segment] 53292  >  443 [ACK] Seq=1 Ack=2 Win=2048 Len=0 TSval=518337887 TSecr=3207028008"
"8","0.414195","192.168.1.228","3.237.56.7","TCP","66","53416  >  443 [ACK] Seq=1 Ack=78 Win=2047 Len=0 TSval=1208553526 TSecr=3096924058"
"9","0.414237","192.168.1.228","3.237.56.7","TCP","66","53416  >  443 [ACK] Seq=1 Ack=79 Win=2047 Len=0 TSval=1208553526 TSecr=3096924058"
"10","0.414251","192.168.1.228","3.237.56.7","TCP","66","[TCP Dup ACK 9#1] 53416  >  443 [ACK] Seq=1 Ack=79 Win=2047 Len=0 TSval=1208553526 TSecr=3096924058"
"11","0.414883","192.168.1.228","3.237.56.7","TCP","66","53416  >  443 [FIN, ACK] Seq=1 Ack=79 Win=2048 Len=0 TSval=1208553527 TSecr=3096924058"
"12","0.424212","3.237.56.7","192.168.1.228","TCP","66","443  >  53416 [ACK] Seq=79 Ack=2 Win=187 Len=0 TSval=3096924167 TSecr=1208553527"
"13","0.485841","192.168.1.226","224.0.0.251","MDNS","154","Standard query 0x0000 PTR _rdlink._tcp.local, ""QM"" question PTR _companion-link._tcp.local, ""QM"" question PTR lb._dns-sd._udp.local, ""QM"" question PTR Jue\347\232\204MacBook Air._companion-link._tcp.local"
"14","0.485983","fe80::1811:28e7:20a1:c13a","ff02::fb","MDNS","174","Standard query 0x0000 PTR _rdlink._tcp.local, ""QM"" question PTR _companion-link._tcp.local, ""QM"" question PTR lb._dns-sd._udp.local, ""QM"" question PTR Jue\347\232\204MacBook Air._companion-link._tcp.local"
"15","0.487706","fe80::1811:28e7:20a1:c13a","ff02::fb","MDNS","330","Standard query response 0x0000 TXT, cache flush PTR _asquic._udp.local PTR 2BDB6A65-364A-41F1-A35D-C2676FDF5B5D._asquic._udp.local SRV, cache flush 0 0 62652 iPhone-2.local AAAA, cache flush fe80::1811:28e7:20a1:c13a A, cache flush 192.168.1.226 AAAA, cache flush 2600:4040:231a:b800:1cfd:1169:f973:6182 NSEC, cache flush 2BDB6A65-364A-41F1-A35D-C2676FDF5B5D._asquic._udp.local NSEC, cache flush iPhone-2.local"
"16","0.570489","3.23.42.231","192.168.1.228","TLSv1.2","112","Application Data"
"17","0.570494","3.23.42.231","192.168.1.228","TLSv1.2","97","Encrypted Alert"
"18","0.570495","3.23.42.231","192.168.1.228","TCP","66","443  >  53432 [FIN, ACK] Seq=78 Ack=1 Win=279 Len=0 TSval=231935474 TSecr=3602139161"
"19","0.570742","192.168.1.228","3.23.42.231","TCP","66","53432  >  443 [ACK] Seq=1 Ack=78 Win=2047 Len=0 TSval=3602199139 TSecr=231935474"
"20","0.570845","192.168.1.228","3.23.42.231","TCP","66","53432  >  443 [ACK] Seq=1 Ack=79 Win=2047 Len=0 TSval=3602199139 TSecr=231935474"
"21","0.571342","192.168.1.228","3.23.42.231","TCP","66","53432  >  443 [FIN, ACK] Seq=1 Ack=79 Win=2048 Len=0 TSval=3602199139 TSecr=231935474"
"22","0.589334","3.23.42.231","192.168.1.228","TCP","66","443  >  53432 [ACK] Seq=79 Ack=2 Win=279 Len=0 TSval=231935494 TSecr=3602199139"
"23","0.614103","44.194.163.1","192.168.1.228","TLSv1.2","112","Application Data"
"24","0.614106","44.194.163.1","192.168.1.228","TLSv1.2","97","Encrypted Alert"
"25","0.614109","44.194.163.1","192.168.1.228","TCP","66","443  >  53389 [FIN, ACK] Seq=78 Ack=1 Win=141 Len=0 TSval=3571959677 TSecr=1668752320"
"26","0.614331","192.168.1.228","44.194.163.1","TCP","66","53389  >  443 [ACK] Seq=1 Ack=78 Win=2047 Len=0 TSval=1668812320 TSecr=3571959677"
"27","0.614424","192.168.1.228","44.194.163.1","TCP","66","53389  >  443 [ACK] Seq=1 Ack=79 Win=2047 Len=0 TSval=1668812320 TSecr=3571959677"
"28","0.615431","192.168.1.228","44.194.163.1","TCP","66","53389  >  443 [FIN, ACK] Seq=1 Ack=79 Win=2048 Len=0 TSval=1668812321 TSecr=3571959677"
"29","0.624985","44.194.163.1","192.168.1.228","TCP","66","443  >  53389 [ACK] Seq=79 Ack=2 Win=141 Len=0 TSval=3571959688 TSecr=1668812321"
"30","0.663311","34.4.35.11","192.168.1.228","TCP","66","443  >  53293 [ACK] Seq=1 Ack=1 Win=1041 Len=0 TSval=581446805 TSecr=1251626726"
"31","0.663449","192.168.1.228","34.4.35.11","TCP","66","[TCP ACKed unseen segment] 53293  >  443 [ACK] Seq=1 Ack=2 Win=2048 Len=0 TSval=1251689772 TSecr=581437281"
"32","0.716319","2602:803:c007:ffff::6","2600:4040:231a:b800:3c9e:c12c:139a:9787","TCP","86","443  >  53537 [FIN, ACK] Seq=1 Ack=1 Win=30702 Len=0 TSval=4282627947 TSecr=1071258421"
"33","0.716453","2600:4040:231a:b800:3c9e:c12c:139a:9787","2602:803:c007:ffff::6","TCP","86","53537  >  443 [ACK] Seq=1 Ack=2 Win=2048 Len=0 TSval=1071273419 TSecr=4282627947"
"34","0.758889","35.212.59.62","192.168.1.228","TCP","66","443  >  53353 [ACK] Seq=1 Ack=1 Win=1095 Len=0 TSval=1159796294 TSecr=1613552994"
"35","0.759014","192.168.1.228","35.212.59.62","TCP","66","[TCP ACKed unseen segment] 53353  >  443 [ACK] Seq=1 Ack=2 Win=2048 Len=0 TSval=1613615961 TSecr=1159786683"
"36","1.018419","2600:4040:231a:b800:3c9e:c12c:139a:9787","2602:803:c007:ffff::6","TCP","86","53537  >  443 [FIN, ACK] Seq=1 Ack=2 Win=2048 Len=0 TSval=1071273721 TSecr=4282627947"
"37","1.019142","192.168.1.228","3.91.171.213","TLSv1.2","1237","Application Data"
"38","1.019222","192.168.1.228","3.91.171.213","TCP","1514","53548  >  443 [ACK] Seq=1172 Ack=1 Win=2048 Len=1448 TSval=1913187303 TSecr=1315109020 [TCP PDU reassembled in 40]"
"39","1.019224","192.168.1.228","3.91.171.213","TCP","1514","53548  >  443 [ACK] Seq=2620 Ack=1 Win=2048 Len=1448 TSval=1913187303 TSecr=1315109020 [TCP PDU reassembled in 40]"
"40","1.019238","192.168.1.228","3.91.171.213","TLSv1.2","1385","Application Data"
"41","1.029602","2602:803:c007:ffff::6","2600:4040:231a:b800:3c9e:c12c:139a:9787","TCP","86","443  >  53537 [ACK] Seq=2 Ack=2 Win=31416 Len=0 TSval=4282628025 TSecr=1071273721"
"42","1.029605","3.91.171.213","192.168.1.228","TCP","66","443  >  53548 [ACK] Seq=1 Ack=2620 Win=443 Len=0 TSval=1315110764 TSecr=1913187303"
"43","1.032019","3.91.171.213","192.168.1.228","TCP","66","443  >  53548 [ACK] Seq=1 Ack=5387 Win=443 Len=0 TSval=1315110768 TSecr=1913187303"
"44","1.038961","3.91.171.213","192.168.1.228","TLSv1.2","548","Application Data"
"45","1.038964","3.91.171.213","192.168.1.228","TLSv1.2","221","Application Data"
"46","1.039137","192.168.1.228","3.91.171.213","TCP","66","53548  >  443 [ACK] Seq=5387 Ack=638 Win=2039 Len=0 TSval=1913187323 TSecr=1315110775"
"47","1.047658","2600:1f16:e61:3f02:6475:4cc9:ee4a:68a5","2600:4040:231a:b800:3c9e:c12c:139a:9787","TCP","86","443  >  53313 [ACK] Seq=1 Ack=1 Win=22 Len=0 TSval=3101918053 TSecr=2444632516"
"48","1.047932","2600:4040:231a:b800:3c9e:c12c:139a:9787","2600:1f16:e61:3f02:6475:4cc9:ee4a:68a5","TCP","86","[TCP ACKed unseen segment] 53313  >  443 [ACK] Seq=1 Ack=2 Win=2048 Len=0 TSval=2444652912 TSecr=3101863139"
"49","1.100455","192.168.1.228","3.91.171.213","TCP","54","[TCP Keep-Alive] 53548  >  443 [ACK] Seq=5386 Ack=638 Win=2048 Len=0"
"50","1.108033","3.91.171.213","192.168.1.228","TCP","66","[TCP Keep-Alive ACK] 443  >  53548 [ACK] Seq=638 Ack=5387 Win=443 Len=0 TSval=1315110844 TSecr=1913187323"
"51","1.155165","99.83.128.14","192.168.1.228","TLSv1.2","143","Application Data, Encrypted Alert"
"52","1.155169","99.83.128.14","192.168.1.228","TCP","66","443  >  53439 [FIN, ACK] Seq=78 Ack=1 Win=421 Len=0 TSval=726784821 TSecr=2749895664"
"53","1.155369","192.168.1.228","99.83.128.14","TCP","66","53439  >  443 [ACK] Seq=1 Ack=78 Win=2047 Len=0 TSval=2749955673 TSecr=726784821"
"54","1.155451","192.168.1.228","99.83.128.14","TCP","66","53439  >  443 [ACK] Seq=1 Ack=79 Win=2047 Len=0 TSval=2749955673 TSecr=726784821"
"55","1.155910","192.168.1.228","99.83.128.14","TCP","66","53439  >  443 [FIN, ACK] Seq=1 Ack=79 Win=2048 Len=0 TSval=2749955674 TSecr=726784821"
"56","1.163991","99.83.128.14","192.168.1.228","TCP","66","443  >  53439 [ACK] Seq=79 Ack=2 Win=421 Len=0 TSval=726784831 TSecr=2749955674"
"57","1.369011","2600:1f16:e61:3f02:6475:4cc9:ee4a:68a5","2600:4040:231a:b800:3c9e:c12c:139a:9787","TCP","86","443  >  53340 [ACK] Seq=1 Ack=1 Win=23 Len=0 TSval=2791873540 TSecr=3297587281"
"58","1.369248","2600:4040:231a:b800:3c9e:c12c:139a:9787","2600:1f16:e61:3f02:6475:4cc9:ee4a:68a5","TCP","86","[TCP ACKed unseen segment] 53340  >  443 [ACK] Seq=1 Ack=2 Win=2048 Len=0 TSval=3297607693 TSecr=2791818304"
"59","1.452471","192.168.1.228","3.171.85.70","TLSv1.2","511","Application Data"
"60","1.459692","3.171.85.70","192.168.1.228","TCP","66","443  >  53456 [ACK] Seq=1 Ack=446 Win=246 Len=0 TSval=462360816 TSecr=3485824939"
"61","1.469879","3.171.85.70","192.168.1.228","TLSv1.2","408","Application Data"
"62","1.469882","3.171.85.70","192.168.1.228","TLSv1.2","97","Application Data"
"63","1.470043","192.168.1.228","3.171.85.70","TCP","66","53456  >  443 [ACK] Seq=446 Ack=374 Win=2043 Len=0 TSval=3485824957 TSecr=462360825"
"64","1.489491","34.203.159.188","192.168.1.228","TLSv1.2","112","Application Data"
"65","1.489494","34.203.159.188","192.168.1.228","TLSv1.2","97","Encrypted Alert"
"66","1.489497","34.203.159.188","192.168.1.228","TCP","66","443  >  53409 [FIN, ACK] Seq=78 Ack=1 Win=397 Len=0 TSval=1095428599 TSecr=3959418780"
"67","1.489700","192.168.1.228","34.203.159.188","TCP","66","53409  >  443 [ACK] Seq=1 Ack=78 Win=2047 Len=0 TSval=3959478780 TSecr=1095428599"
"68","1.489788","192.168.1.228","34.203.159.188","TCP","66","53409  >  443 [ACK] Seq=1 Ack=79 Win=2047 Len=0 TSval=3959478780 TSecr=1095428599"
"69","1.490074","192.168.1.228","34.203.159.188","TCP","66","53409  >  443 [FIN, ACK] Seq=1 Ack=79 Win=2048 Len=0 TSval=3959478780 TSecr=1095428599"
"70","1.500717","34.203.159.188","192.168.1.228","TCP","66","443  >  53409 [ACK] Seq=79 Ack=2 Win=397 Len=0 TSval=1095428610 TSecr=3959478780"
"71","1.583118","fe80::1097:88a0:4399:850a","fe80::1811:28e7:20a1:c13a","ICMPv6","86","Neighbor Solicitation for fe80::1811:28e7:20a1:c13a from ce:f6:1b:97:2c:c9"
"72","1.623215","192.168.1.228","3.171.85.70","TCP","54","[TCP Keep-Alive] 53456  >  443 [ACK] Seq=445 Ack=374 Win=2048 Len=0"
"73","1.633235","3.171.85.70","192.168.1.228","TCP","66","[TCP Keep-Alive ACK] 443  >  53456 [ACK] Seq=374 Ack=446 Win=246 Len=0 TSval=462360989 TSecr=3485824957"
"74","1.650346","fe80::1811:28e7:20a1:c13a","fe80::1097:88a0:4399:850a","ICMPv6","78","Neighbor Advertisement fe80::1811:28e7:20a1:c13a (sol)"
"75","1.817080","2600:4040:231a:b800:3c9e:c12c:139a:9787","2001:4860:482a:7700::","UDP","91","61899  >  443 Len=29"
"76","1.817395","2600:4040:231a:b800:3c9e:c12c:139a:9787","2001:4860:482a:7700::","UDP","91","61899  >  443 Len=29"
"77","1.818186","192.168.1.228","3.91.171.213","TLSv1.2","1237","Application Data"
"78","1.818337","192.168.1.228","3.91.171.213","TCP","1514","53548  >  443 [ACK] Seq=6558 Ack=638 Win=2048 Len=1448 TSval=1913188102 TSecr=1315110844 [TCP PDU reassembled in 79]"
"79","1.818343","192.168.1.228","3.91.171.213","TLSv1.2","1031","Application Data"
"80","1.820262","2600:4040:231a:b800:3c9e:c12c:139a:9787","2606:4700:10::6814:1566","TLSv1.2","208","Application Data"
"81","1.820308","2600:4040:231a:b800:3c9e:c12c:139a:9787","2606:4700:10::6814:1566","TLSv1.2","125","Application Data"
"82","1.820641","2600:4040:231a:b800:3c9e:c12c:139a:9787","2a00:1450:4010:c0b::78","UDP","376","57052  >  443 Len=314"
"83","1.824542","2600:4040:231a:b800:3c9e:c12c:139a:9787","2606:4700::6812:41d","QUIC","1292","Initial, DCID=b27297d47f61e803, PKN: 1, PADDING, PING, PING, PADDING, CRYPTO, CRYPTO, PING, PING, PADDING, PING, PING, PADDING, CRYPTO, CRYPTO, PADDING, CRYPTO, PADDING, PING, PADDING, PING, PADDING, CRYPTO, CRYPTO, CRYPTO"
"84","1.824637","2600:4040:231a:b800:3c9e:c12c:139a:9787","2606:4700::6812:41d","QUIC","1292","Initial, DCID=b27297d47f61e803, PKN: 2, PADDING, CRYPTO, PING, PING, CRYPTO, CRYPTO, CRYPTO, PADDING, CRYPTO, PADDING, CRYPTO, PING, PING, PADDING, CRYPTO, PADDING"
"85","1.825227","2600:4040:231a:b800:3c9e:c12c:139a:9787","2606:4700::6812:41d","QUIC","141","0-RTT, DCID=b27297d47f61e803"
"86","1.828852","2001:4860:482a:7700::","2600:4040:231a:b800:3c9e:c12c:139a:9787","UDP","88","443  >  61899 Len=26"
"87","1.830562","2600:4040:231a:b800:3c9e:c12c:139a:9787","2606:4700:3030::6815:2829","QUIC","1292","Initial, DCID=6c1e38794996bb1f, PKN: 1, PADDING, PING, PADDING, PING, PING, PADDING, CRYPTO, CRYPTO, PING, PING, PING, PING, CRYPTO, CRYPTO, CRYPTO, PING, CRYPTO, PING, CRYPTO, CRYPTO, CRYPTO, CRYPTO, PADDING, PING, CRYPTO, CRYPTO"
"88","1.830615","2600:4040:231a:b800:3c9e:c12c:139a:9787","2606:4700:3030::6815:2829","QUIC","1292","Initial, DCID=6c1e38794996bb1f, PKN: 2, PADDING, CRYPTO, PADDING, PING, PING, CRYPTO, CRYPTO, PING, CRYPTO, PADDING, PING, CRYPTO, PING"
"89","1.830902","2606:4700:10::6814:1566","2600:4040:231a:b800:3c9e:c12c:139a:9787","TCP","86","443  >  53130 [ACK] Seq=1 Ack=123 Win=16 Len=0 TSval=390148176 TSecr=3655324361"
"90","1.830903","2606:4700:10::6814:1566","2600:4040:231a:b800:3c9e:c12c:139a:9787","TCP","86","443  >  53130 [ACK] Seq=1 Ack=162 Win=16 Len=0 TSval=390148176 TSecr=3655324361"
"91","1.830904","2606:4700:10::6814:1566","2600:4040:231a:b800:3c9e:c12c:139a:9787","TLSv1.2","125","Application Data"
"92","1.830905","3.91.171.213","192.168.1.228","TCP","66","443  >  53548 [ACK] Seq=638 Ack=8971 Win=443 Len=0 TSval=1315111564 TSecr=1913188102"
"93","1.830906","2001:4860:482a:7700::","2600:4040:231a:b800:3c9e:c12c:139a:9787","UDP","88","443  >  61899 Len=26"
"94","1.831010","2600:4040:231a:b800:3c9e:c12c:139a:9787","2606:4700:10::6814:1566","TCP","86","53130  >  443 [ACK] Seq=162 Ack=40 Win=2048 Len=0 TSval=3655324372 TSecr=390148176"
"95","1.831769","2600:4040:231a:b800:3c9e:c12c:139a:9787","2606:4700:10::ac42:a2fe","QUIC","1292","Initial, DCID=c0f6ad6822a9353b, PKN: 1, PING, PADDING, PING, PING, PADDING, PING, PADDING, CRYPTO, CRYPTO, PADDING, PING, PADDING, PING, PING, CRYPTO, PING, CRYPTO, PING, PADDING, PING"
"96","1.831781","2600:4040:231a:b800:3c9e:c12c:139a:9787","2606:4700:10::ac42:a2fe","QUIC","1292","Initial, DCID=c0f6ad6822a9353b, PKN: 2, PING, CRYPTO, CRYPTO, PADDING, CRYPTO, CRYPTO, CRYPTO, PING, CRYPTO, PADDING, CRYPTO, CRYPTO, PADDING, PING, CRYPTO, CRYPTO, CRYPTO"
"97","1.832225","2600:4040:231a:b800:3c9e:c12c:139a:9787","2a00:1450:4010:c0b::78","UDP","243","64442  >  443 Len=181"
"98","1.832306","3.91.171.213","192.168.1.228","TLSv1.2","548","Application Data"
"99","1.832308","3.91.171.213","192.168.1.228","TLSv1.2","221","Application Data"
"100","1.832309","2606:4700::6812:41d","2600:4040:231a:b800:3c9e:c12c:139a:9787","QUIC","1262","Initial, SCID=01b8ac958d13ec3a80baf5954c13ead79140b7c6, PKN: 0, ACK"
"101","1.832372","192.168.1.228","3.91.171.213","TCP","66","53548  >  443 [ACK] Seq=8971 Ack=1275 Win=2039 Len=0 TSval=1913188116 TSecr=1315111569"
"102","1.832626","192.168.1.228","172.253.122.155","UDP","445","53224  >  443 Len=403"
"103","1.832695","2606:4700::6812:41d","2600:4040:231a:b800:3c9e:c12c:139a:9787","QUIC","1262","Initial, SCID=01b8ac958d13ec3a80baf5954c13ead79140b7c6, PKN: 1, ACK"
"104","1.833474","192.168.1.228","104.18.26.216","TLSv1.2","149","Application Data"
"105","1.833514","192.168.1.228","104.18.26.216","TLSv1.2","105","Application Data"
"106","1.833562","192.168.1.228","104.18.26.216","TLSv1.2","766","Application Data"
"107","1.833732","192.168.1.228","104.18.34.190","TCP","1454","53412  >  443 [ACK] Seq=1 Ack=1 Win=2048 Len=1388 TSval=2557380530 TSecr=3429535171 [TCP PDU reassembled in 109]"
"108","1.833772","192.168.1.228","104.18.34.190","TCP","1454","53412  >  443 [ACK] Seq=1389 Ack=1 Win=2048 Len=1388 TSval=2557380530 TSecr=3429535171 [TCP PDU reassembled in 109]"
"109","1.833782","192.168.1.228","104.18.34.190","TLSv1.2","521","Application Data"
"110","1.833808","192.168.1.228","104.18.34.190","TLSv1.2","105","Application Data"
"111","1.833838","192.168.1.228","104.18.34.190","TLSv1.2","705","Application Data"
"112","1.834035","192.168.1.228","34.110.210.66","UDP","1292","56611  >  443 Len=1250"
"113","1.834053","192.168.1.228","34.110.210.66","UDP","1098","56611  >  443 Len=1056"
"114","1.834604","2600:4040:231a:b800:3c9e:c12c:139a:9787","2607:f8b0:4004:c1b::9d","UDP","1292","53358  >  443 Len=1230"
"115","1.834613","2600:4040:231a:b800:3c9e:c12c:139a:9787","2607:f8b0:4004:c1b::9d","UDP","926","53358  >  443 Len=864"
"116","1.835312","192.168.1.228","172.253.122.155","UDP","1292","53224  >  443 Len=1250"
"117","1.835322","192.168.1.228","172.253.122.155","UDP","417","53224  >  443 Len=375"
"118","1.835566","2600:4040:231a:b800:3c9e:c12c:139a:9787","2607:f8b0:4004:c1b::9d","UDP","1292","53358  >  443 Len=1230"
"119","1.835572","2600:4040:231a:b800:3c9e:c12c:139a:9787","2607:f8b0:4004:c1b::9d","UDP","866","53358  >  443 Len=804"
"120","1.835659","192.168.1.228","172.253.122.155","UDP","1292","53224  >  443 Len=1250"
"121","1.835661","192.168.1.228","172.253.122.155","UDP","363","53224  >  443 Len=321"
"122","1.836575","192.168.1.228","104.18.26.193","UDP","1286","62260  >  443 Len=1244"
"123","1.836599","192.168.1.228","104.18.26.193","UDP","1292","62260  >  443 Len=1250"
"124","1.836600","192.168.1.228","104.18.26.193","UDP","1292","62260  >  443 Len=1250"
"125","1.836601","192.168.1.228","104.18.26.193","UDP","1292","62260  >  443 Len=1250"
"126","1.836602","192.168.1.228","104.18.26.193","UDP","1292","62260  >  443 Len=1250"
"127","1.836606","192.168.1.228","104.18.26.193","UDP","1292","62260  >  443 Len=1250"
"128","1.836606","192.168.1.228","104.18.26.193","UDP","1292","62260  >  443 Len=1250"
"129","1.836609","192.168.1.228","104.18.26.193","UDP","1292","62260  >  443 Len=1250"
"130","1.836622","192.168.1.228","104.18.26.193","UDP","1147","62260  >  443 Len=1105"
"131","1.836629","2606:4700::6812:41d","2600:4040:231a:b800:3c9e:c12c:139a:9787","QUIC","1262","Initial, SCID=01b8ac958d13ec3a80baf5954c13ead79140b7c6, PKN: 2, CRYPTO"
"132","1.836631","2606:4700::6812:41d","2600:4040:231a:b800:3c9e:c12c:139a:9787","QUIC","1262","Protected Payload (KP0)"
"133","1.836923","2600:4040:231a:b800:3c9e:c12c:139a:9787","2606:4700::6812:41d","QUIC","1292","Handshake, DCID=01b8ac958d13ec3a80baf5954c13ead79140b7c6"
"134","1.837125","2600:4040:231a:b800:3c9e:c12c:139a:9787","2606:4700::6812:41d","QUIC","1292","Protected Payload (KP0), DCID=01b8ac958d13ec3a80baf5954c13ead79140b7c6"
"135","1.837140","2600:4040:231a:b800:3c9e:c12c:139a:9787","2606:4700::6812:41d","QUIC","1014","Protected Payload (KP0), DCID=01b8ac958d13ec3a80baf5954c13ead79140b7c6"
"136","1.837205","2600:4040:231a:b800:3c9e:c12c:139a:9787","2606:4700::6812:41d","QUIC","1287","Protected Payload (KP0), DCID=01b8ac958d13ec3a80baf5954c13ead79140b7c6"
"137","1.837207","2600:4040:231a:b800:3c9e:c12c:139a:9787","2606:4700::6812:41d","QUIC","331","Protected Payload (KP0), DCID=01b8ac958d13ec3a80baf5954c13ead79140b7c6"
"138","1.838915","192.168.1.228","192.168.1.1","DNS","91","Standard query 0x5926 HTTPS web.ads.aps.amazon-adsystem.com"
"139","1.839121","192.168.1.228","192.168.1.1","DNS","91","Standard query 0x482d AAAA web.ads.aps.amazon-adsystem.com"
"140","1.839190","192.168.1.228","192.168.1.1","DNS","91","Standard query 0x3b0f A web.ads.aps.amazon-adsystem.com"
"141","1.839327","192.168.1.228","3.167.100.35","TLSv1.2","133","Application Data"
"142","1.839355","192.168.1.228","3.167.100.35","TCP","1494","53233  >  443 [ACK] Seq=68 Ack=1 Win=2048 Len=1428 TSval=4225690515 TSecr=1636770645 [TCP PDU reassembled in 147]"
"143","1.839356","192.168.1.228","3.167.100.35","TCP","1494","53233  >  443 [ACK] Seq=1496 Ack=1 Win=2048 Len=1428 TSval=4225690515 TSecr=1636770645 [TCP PDU reassembled in 147]"
"144","1.839357","192.168.1.228","3.167.100.35","TCP","1494","53233  >  443 [ACK] Seq=2924 Ack=1 Win=2048 Len=1428 TSval=4225690515 TSecr=1636770645 [TCP PDU reassembled in 147]"
"145","1.839357","192.168.1.228","3.167.100.35","TCP","1494","53233  >  443 [ACK] Seq=4352 Ack=1 Win=2048 Len=1428 TSval=4225690515 TSecr=1636770645 [TCP PDU reassembled in 147]"
"146","1.839358","192.168.1.228","3.167.100.35","TCP","1494","53233  >  443 [ACK] Seq=5780 Ack=1 Win=2048 Len=1428 TSval=4225690515 TSecr=1636770645 [TCP PDU reassembled in 147]"
"147","1.839360","192.168.1.228","3.167.100.35","TLSv1.2","467","Application Data"
"148","1.841603","192.168.1.228","192.168.1.1","DNS","92","Standard query 0x1dba HTTPS prebid-server.rubiconproject.com"
"149","1.841824","192.168.1.228","192.168.1.1","DNS","92","Standard query 0x1825 AAAA prebid-server.rubiconproject.com"
"150","1.842016","2606:4700:3030::6815:2829","2600:4040:231a:b800:3c9e:c12c:139a:9787","QUIC","1262","Initial, SCID=0122196298f080caf522096676f303caf50a8cf8, PKN: 0, ACK, CRYPTO"
"151","1.842018","2606:4700:3030::6815:2829","2600:4040:231a:b800:3c9e:c12c:139a:9787","QUIC","1262","Handshake, SCID=0122196298f080caf522096676f303caf50a8cf8"
"152","1.842019","2606:4700:10::ac42:a2fe","2600:4040:231a:b800:3c9e:c12c:139a:9787","QUIC","1262","Initial, SCID=011b0fb2d9c59e989a1f0eb2f3c2bc989afb6c3a, PKN: 0, ACK, CRYPTO"
"153","1.842021","2606:4700:10::ac42:a2fe","2600:4040:231a:b800:3c9e:c12c:139a:9787","QUIC","1262","Handshake, SCID=011b0fb2d9c59e989a1f0eb2f3c2bc989afb6c3a"
"154","1.842040","192.168.1.228","192.168.1.1","DNS","92","Standard query 0xed5d A prebid-server.rubiconproject.com"
"155","1.842428","192.168.1.228","192.168.1.1","DNS","73","Standard query 0x6a63 HTTPS tlx.3lift.com"
"156","1.842534","192.168.1.228","192.168.1.1","DNS","73","Standard query 0xe5e8 AAAA tlx.3lift.com"
"157","1.842603","192.168.1.228","192.168.1.1","DNS","73","Standard query 0x2be7 A tlx.3lift.com"
"158","1.843346","2600:4040:231a:b800:3c9e:c12c:139a:9787","2606:4700:3030::6815:2829","QUIC","1292","Protected Payload (KP0), DCID=0122196298f080caf522096676f303caf50a8cf8"
"159","1.844900","2600:4040:231a:b800:3c9e:c12c:139a:9787","2606:4700:3030::6815:2829","QUIC","418","Protected Payload (KP0), DCID=0122196298f080caf522096676f303caf50a8cf8"
"160","1.845193","104.18.26.216","192.168.1.228","TCP","66","443  >  53220 [ACK] Seq=1 Ack=823 Win=17 Len=0 TSval=3903254231 TSecr=2600723603"
"161","1.845194","104.18.26.216","192.168.1.228","TLSv1.2","105","Application Data"
"162","1.845196","104.18.34.190","192.168.1.228","TCP","66","443  >  53412 [ACK] Seq=1 Ack=2777 Win=17 Len=0 TSval=3429545877 TSecr=2557380530"
"163","1.845197","104.18.34.190","192.168.1.228","TCP","66","443  >  53412 [ACK] Seq=1 Ack=3232 Win=17 Len=0 TSval=3429545877 TSecr=2557380530"
"164","1.845198","104.18.34.190","192.168.1.228","TCP","66","443  >  53412 [ACK] Seq=1 Ack=3910 Win=17 Len=0 TSval=3429545877 TSecr=2557380530"
"165","1.845199","104.18.34.190","192.168.1.228","TLSv1.2","105","Application Data"
"166","1.845199","104.18.26.216","192.168.1.228","TLSv1.2","179","Application Data"
"167","1.845292","192.168.1.228","104.18.26.216","TCP","66","53220  >  443 [ACK] Seq=823 Ack=153 Win=2046 Len=0 TSval=2600723615 TSecr=3903254233"
"168","1.845319","192.168.1.228","104.18.34.190","TCP","66","53412  >  443 [ACK] Seq=3910 Ack=40 Win=2048 Len=0 TSval=2557380541 TSecr=3429545877"
"169","1.845933","2600:4040:231a:b800:3c9e:c12c:139a:9787","2606:4700:10::ac42:a2fe","QUIC","1292","Protected Payload (KP0), DCID=011b0fb2d9c59e989a1f0eb2f3c2bc989afb6c3a"
"170","1.846023","2600:4040:231a:b800:3c9e:c12c:139a:9787","2606:4700:10::ac42:a2fe","QUIC","1286","Protected Payload (KP0), DCID=011b0fb2d9c59e989a1f0eb2f3c2bc989afb6c3a"
"171","1.846024","2600:4040:231a:b800:3c9e:c12c:139a:9787","2606:4700:10::ac42:a2fe","QUIC","1203","Protected Payload (KP0), DCID=011b0fb2d9c59e989a1f0eb2f3c2bc989afb6c3a"
"172","1.846083","34.110.210.66","192.168.1.228","UDP","69","443  >  56611 Len=27"
"173","1.846546","172.253.122.155","192.168.1.228","UDP","74","443  >  53224 Len=32"
"174","1.846547","2607:f8b0:4004:c1b::9d","2600:4040:231a:b800:3c9e:c12c:139a:9787","UDP","93","443  >  53358 Len=31"
"175","1.848186","104.18.34.190","192.168.1.228","TLSv1.2","148","Application Data"
"176","1.848243","192.168.1.228","104.18.34.190","TCP","66","53412  >  443 [ACK] Seq=3910 Ack=122 Win=2047 Len=0 TSval=2557380544 TSecr=3429545881"
"177","1.849285","192.168.1.228","35.227.252.103","UDP","1287","61722  >  443 Len=1245"
"178","1.849297","192.168.1.228","35.227.252.103","UDP","1292","61722  >  443 Len=1250"
"179","1.849319","192.168.1.228","35.227.252.103","UDP","1292","61722  >  443 Len=1250"
"180","1.849382","192.168.1.228","35.227.252.103","UDP","1292","61722  >  443 Len=1250"
"181","1.849383","192.168.1.228","35.227.252.103","UDP","1292","61722  >  443 Len=1250"
"182","1.849444","192.168.1.228","35.227.252.103","UDP","448","61722  >  443 Len=406"
"183","1.849471","192.168.1.228","172.253.122.155","UDP","75","53224  >  443 Len=33"
"184","1.849502","2600:4040:231a:b800:3c9e:c12c:139a:9787","2607:f8b0:4004:c1b::9d","UDP","95","53358  >  443 Len=33"
"185","1.849669","104.18.26.193","192.168.1.228","UDP","66","443  >  62260 Len=24"
"186","1.850711","192.168.1.228","35.227.252.103","UDP","1287","61722  >  443 Len=1245"
"187","1.850713","192.168.1.228","35.227.252.103","UDP","1292","61722  >  443 Len=1250"
"188","1.850724","192.168.1.228","35.227.252.103","UDP","1292","61722  >  443 Len=1250"
"189","1.850728","192.168.1.228","35.227.252.103","UDP","1292","61722  >  443 Len=1250"
"190","1.850739","192.168.1.228","35.227.252.103","UDP","1292","61722  >  443 Len=1250"
"191","1.850740","192.168.1.228","35.227.252.103","UDP","450","61722  >  443 Len=408"
"192","1.850837","2607:f8b0:4004:c1b::9d","2600:4040:231a:b800:3c9e:c12c:139a:9787","UDP","93","443  >  53358 Len=31"
"193","1.850838","172.253.122.155","192.168.1.228","UDP","72","443  >  53224 Len=30"
"194","1.851828","192.168.1.228","35.227.252.103","UDP","1287","61722  >  443 Len=1245"
"195","1.851842","192.168.1.228","35.227.252.103","UDP","1292","61722  >  443 Len=1250"
"196","1.851843","192.168.1.228","35.227.252.103","UDP","1292","61722  >  443 Len=1250"
"197","1.851844","192.168.1.228","35.227.252.103","UDP","1292","61722  >  443 Len=1250"
"198","1.851845","192.168.1.228","35.227.252.103","UDP","1292","61722  >  443 Len=1250"
"199","1.851848","192.168.1.228","35.227.252.103","UDP","450","61722  >  443 Len=408"
"200","1.852182","192.168.1.228","192.168.1.1","DNS","85","Standard query 0x3c0f HTTPS elb.the-ozone-project.com"
"201","1.852302","192.168.1.228","192.168.1.1","DNS","85","Standard query 0xf392 AAAA elb.the-ozone-project.com"
"202","1.852395","192.168.1.228","192.168.1.1","DNS","85","Standard query 0x008f A elb.the-ozone-project.com"
"203","1.852624","2600:4040:231a:b800:3c9e:c12c:139a:9787","2606:4700::6812:41d","QUIC","1292","Protected Payload (KP0), DCID=01b8ac958d13ec3a80baf5954c13ead79140b7c6"
"204","1.852703","192.168.1.228","104.18.34.190","TLSv1.2","139","Application Data"
"205","1.852799","192.168.1.228","104.18.34.190","TCP","1454","53244  >  443 [ACK] Seq=74 Ack=1 Win=2048 Len=1388 TSval=59871901 TSecr=3616766478 [TCP PDU reassembled in 212]"
"206","1.852800","192.168.1.228","104.18.34.190","TCP","1454","53244  >  443 [ACK] Seq=1462 Ack=1 Win=2048 Len=1388 TSval=59871901 TSecr=3616766478 [TCP PDU reassembled in 212]"
"207","1.852801","192.168.1.228","104.18.34.190","TCP","1454","53244  >  443 [ACK] Seq=2850 Ack=1 Win=2048 Len=1388 TSval=59871901 TSecr=3616766478 [TCP PDU reassembled in 212]"
"208","1.852802","192.168.1.228","104.18.34.190","TCP","1454","53244  >  443 [ACK] Seq=4238 Ack=1 Win=2048 Len=1388 TSval=59871901 TSecr=3616766478 [TCP PDU reassembled in 212]"
"209","1.852803","192.168.1.228","104.18.34.190","TCP","1454","53244  >  443 [ACK] Seq=5626 Ack=1 Win=2048 Len=1388 TSval=59871901 TSecr=3616766478 [TCP PDU reassembled in 212]"
"210","1.852804","192.168.1.228","104.18.34.190","TCP","1454","53244  >  443 [ACK] Seq=7014 Ack=1 Win=2048 Len=1388 TSval=59871901 TSecr=3616766478 [TCP PDU reassembled in 212]"
"211","1.852804","192.168.1.228","104.18.34.190","TCP","1454","53244  >  443 [ACK] Seq=8402 Ack=1 Win=2048 Len=1388 TSval=59871901 TSecr=3616766478 [TCP PDU reassembled in 212]"
"212","1.852812","192.168.1.228","104.18.34.190","TLSv1.2","242","Application Data"
"213","1.853111","192.168.1.228","192.168.1.1","DNS","74","Standard query 0xda7d HTTPS krk2.kargo.com"
"214","1.853116","3.167.100.35","192.168.1.228","TCP","66","443  >  53233 [ACK] Seq=1 Ack=68 Win=476 Len=0 TSval=1636779193 TSecr=4225690515"
"215","1.853117","3.167.100.35","192.168.1.228","TCP","66","443  >  53233 [ACK] Seq=1 Ack=2924 Win=487 Len=0 TSval=1636779193 TSecr=4225690515"
"216","1.853118","3.167.100.35","192.168.1.228","TCP","66","443  >  53233 [ACK] Seq=1 Ack=4352 Win=493 Len=0 TSval=1636779193 TSecr=4225690515"
"217","1.853119","3.167.100.35","192.168.1.228","TCP","66","443  >  53233 [ACK] Seq=1 Ack=5780 Win=498 Len=0 TSval=1636779193 TSecr=4225690515"
"218","1.853120","192.168.1.1","192.168.1.228","DNS","172","Standard query response 0x5926 HTTPS web.ads.aps.amazon-adsystem.com CNAME d1jvc9b8z3vcjs.cloudfront.net HTTPS A 3.167.100.35"
"219","1.853121","104.18.26.193","192.168.1.228","UDP","66","443  >  62260 Len=24"
"220","1.853245","192.168.1.228","192.168.1.1","DNS","74","Standard query 0xfb52 AAAA krk2.kargo.com"
"221","1.853310","192.168.1.228","192.168.1.1","DNS","74","Standard query 0x4557 A krk2.kargo.com"
"222","1.853405","192.168.1.228","172.253.122.155","UDP","75","53224  >  443 Len=33"
"223","1.853426","2600:4040:231a:b800:3c9e:c12c:139a:9787","2607:f8b0:4004:c1b::9d","UDP","95","53358  >  443 Len=33"
"224","1.853445","192.168.1.228","32.193.35.92","TLSv1.2","148","Application Data"
"225","1.853469","192.168.1.228","32.193.35.92","TCP","1514","53243  >  443 [ACK] Seq=83 Ack=1 Win=2048 Len=1448 TSval=3028959406 TSecr=213072002 [TCP PDU reassembled in 232]"
"226","1.853470","192.168.1.228","32.193.35.92","TCP","1514","53243  >  443 [ACK] Seq=1531 Ack=1 Win=2048 Len=1448 TSval=3028959406 TSecr=213072002 [TCP PDU reassembled in 232]"
"227","1.853470","192.168.1.228","32.193.35.92","TCP","1514","53243  >  443 [ACK] Seq=2979 Ack=1 Win=2048 Len=1448 TSval=3028959406 TSecr=213072002 [TCP PDU reassembled in 232]"
"228","1.853470","192.168.1.228","32.193.35.92","TCP","1514","53243  >  443 [ACK] Seq=4427 Ack=1 Win=2048 Len=1448 TSval=3028959406 TSecr=213072002 [TCP PDU reassembled in 232]"
"229","1.853471","192.168.1.228","32.193.35.92","TCP","1514","53243  >  443 [ACK] Seq=5875 Ack=1 Win=2048 Len=1448 TSval=3028959406 TSecr=213072002 [TCP PDU reassembled in 232]"
"230","1.853471","192.168.1.228","32.193.35.92","TCP","1514","53243  >  443 [ACK] Seq=7323 Ack=1 Win=2048 Len=1448 TSval=3028959406 TSecr=213072002 [TCP PDU reassembled in 232]"
"231","1.853472","192.168.1.228","32.193.35.92","TCP","1514","53243  >  443 [ACK] Seq=8771 Ack=1 Win=2048 Len=1448 TSval=3028959406 TSecr=213072002 [TCP PDU reassembled in 232]"
"232","1.853479","192.168.1.228","32.193.35.92","TLSv1.2","628","Application Data"
"233","1.853594","192.168.1.228","192.168.1.1","DNS","80","Standard query 0x86ae HTTPS prebid.ad.smaato.net"
"234","1.853641","192.168.1.228","192.168.1.1","DNS","80","Standard query 0xe3dd AAAA prebid.ad.smaato.net"
"235","1.853691","192.168.1.228","192.168.1.1","DNS","80","Standard query 0x363a A prebid.ad.smaato.net"
"236","1.853973","192.168.1.228","35.212.101.38","TCP","1474","53253  >  443 [ACK] Seq=1 Ack=1 Win=2048 Len=1408 TSval=1916544098 TSecr=4024578757 [TCP PDU reassembled in 237]"
"237","1.853977","192.168.1.228","35.212.101.38","TLSv1.2","837","Application Data"
"238","1.853993","192.168.1.228","35.212.101.38","TCP","1474","53253  >  443 [ACK] Seq=2180 Ack=1 Win=2048 Len=1408 TSval=1916544098 TSecr=4024578757 [TCP PDU reassembled in 242]"
"239","1.853994","192.168.1.228","35.212.101.38","TCP","1474","53253  >  443 [ACK] Seq=3588 Ack=1 Win=2048 Len=1408 TSval=1916544098 TSecr=4024578757 [TCP PDU reassembled in 242]"
"240","1.853994","192.168.1.228","35.212.101.38","TCP","1474","53253  >  443 [ACK] Seq=4996 Ack=1 Win=2048 Len=1408 TSval=1916544098 TSecr=4024578757 [TCP PDU reassembled in 242]"
"241","1.853995","192.168.1.228","35.212.101.38","TCP","1474","53253  >  443 [ACK] Seq=6404 Ack=1 Win=2048 Len=1408 TSval=1916544098 TSecr=4024578757 [TCP PDU reassembled in 242]"
"242","1.853997","192.168.1.228","35.212.101.38","TLSv1.2","798","Application Data"
"243","1.855122","192.168.1.228","35.212.101.38","TCP","1474","53252  >  443 [ACK] Seq=1 Ack=1 Win=2048 Len=1408 TSval=3435907903 TSecr=4024578773 [TCP PDU reassembled in 244]"
"244","1.855145","192.168.1.228","35.212.101.38","TLSv1.2","837","Application Data"
"245","1.855167","192.168.1.228","35.212.101.38","TCP","1474","53252  >  443 [ACK] Seq=2180 Ack=1 Win=2048 Len=1408 TSval=3435907903 TSecr=4024578773 [TCP PDU reassembled in 249]"
"246","1.855168","192.168.1.228","35.212.101.38","TCP","1474","53252  >  443 [ACK] Seq=3588 Ack=1 Win=2048 Len=1408 TSval=3435907903 TSecr=4024578773 [TCP PDU reassembled in 249]"
"247","1.855168","192.168.1.228","35.212.101.38","TCP","1474","53252  >  443 [ACK] Seq=4996 Ack=1 Win=2048 Len=1408 TSval=3435907903 TSecr=4024578773 [TCP PDU reassembled in 249]"
"248","1.855169","192.168.1.228","35.212.101.38","TCP","1474","53252  >  443 [ACK] Seq=6404 Ack=1 Win=2048 Len=1408 TSval=3435907903 TSecr=4024578773 [TCP PDU reassembled in 249]"
"249","1.855171","192.168.1.228","35.212.101.38","TLSv1.2","800","Application Data"
"250","1.855396","192.168.1.228","35.212.101.38","TCP","1474","53254  >  443 [ACK] Seq=1 Ack=1 Win=2048 Len=1408 TSval=342580907 TSecr=4024578773 [TCP PDU reassembled in 251]"
"251","1.855400","192.168.1.228","35.212.101.38","TLSv1.2","837","Application Data"
"252","1.855412","192.168.1.228","35.212.101.38","TCP","1474","53254  >  443 [ACK] Seq=2180 Ack=1 Win=2048 Len=1408 TSval=342580907 TSecr=4024578773 [TCP PDU reassembled in 256]"
"253","1.855412","192.168.1.228","35.212.101.38","TCP","1474","53254  >  443 [ACK] Seq=3588 Ack=1 Win=2048 Len=1408 TSval=342580907 TSecr=4024578773 [TCP PDU reassembled in 256]"
"254","1.855412","192.168.1.228","35.212.101.38","TCP","1474","53254  >  443 [ACK] Seq=4996 Ack=1 Win=2048 Len=1408 TSval=342580907 TSecr=4024578773 [TCP PDU reassembled in 256]"
"255","1.855412","192.168.1.228","35.212.101.38","TCP","1474","53254  >  443 [ACK] Seq=6404 Ack=1 Win=2048 Len=1408 TSval=342580907 TSecr=4024578773 [TCP PDU reassembled in 256]"
"256","1.855414","192.168.1.228","35.212.101.38","TLSv1.2","800","Application Data"
"257","1.855721","192.168.1.228","107.22.42.189","TLSv1.2","160","Application Data"
"258","1.855744","192.168.1.228","107.22.42.189","TCP","1514","53153  >  443 [ACK] Seq=95 Ack=1 Win=10578 Len=1448 TSval=1830768024 TSecr=2351057323 [TCP PDU reassembled in 269]"
"259","1.855744","192.168.1.228","107.22.42.189","TCP","1514","53153  >  443 [ACK] Seq=1543 Ack=1 Win=10578 Len=1448 TSval=1830768024 TSecr=2351057323 [TCP PDU reassembled in 269]"
"260","1.855744","192.168.1.228","107.22.42.189","TCP","1514","53153  >  443 [ACK] Seq=2991 Ack=1 Win=10578 Len=1448 TSval=1830768024 TSecr=2351057323 [TCP PDU reassembled in 269]"
"261","1.855745","192.168.1.228","107.22.42.189","TCP","1514","53153  >  443 [ACK] Seq=4439 Ack=1 Win=10578 Len=1448 TSval=1830768024 TSecr=2351057323 [TCP PDU reassembled in 269]"
"262","1.855745","192.168.1.228","107.22.42.189","TCP","1514","53153  >  443 [ACK] Seq=5887 Ack=1 Win=10578 Len=1448 TSval=1830768024 TSecr=2351057323 [TCP PDU reassembled in 269]"
"263","1.855746","192.168.1.228","107.22.42.189","TCP","1514","53153  >  443 [ACK] Seq=7335 Ack=1 Win=10578 Len=1448 TSval=1830768024 TSecr=2351057323 [TCP PDU reassembled in 269]"
"264","1.855746","192.168.1.228","107.22.42.189","TCP","1514","53153  >  443 [ACK] Seq=8783 Ack=1 Win=10578 Len=1448 TSval=1830768024 TSecr=2351057323 [TCP PDU reassembled in 269]"
"265","1.855747","192.168.1.228","107.22.42.189","TCP","1514","53153  >  443 [ACK] Seq=10231 Ack=1 Win=10578 Len=1448 TSval=1830768024 TSecr=2351057323 [TCP PDU reassembled in 269]"
"266","1.855747","192.168.1.228","107.22.42.189","TCP","1514","53153  >  443 [ACK] Seq=11679 Ack=1 Win=10578 Len=1448 TSval=1830768024 TSecr=2351057323 [TCP PDU reassembled in 269]"
"267","1.855748","192.168.1.228","107.22.42.189","TCP","1514","53153  >  443 [ACK] Seq=13127 Ack=1 Win=10578 Len=1448 TSval=1830768024 TSecr=2351057323 [TCP PDU reassembled in 269]"
"268","1.855748","192.168.1.228","107.22.42.189","TCP","1514","53153  >  443 [ACK] Seq=14575 Ack=1 Win=10578 Len=1448 TSval=1830768024 TSecr=2351057323 [TCP PDU reassembled in 269]"
"269","1.855750","192.168.1.228","107.22.42.189","TLSv1.2","544","Application Data"
"270","1.855756","192.168.1.228","107.22.42.189","TLSv1.2","951","Application Data"
"271","1.855937","192.168.1.228","207.65.37.179","TCP","1514","53248  >  443 [ACK] Seq=1 Ack=1 Win=2048 Len=1448 TSval=658090423 TSecr=2748900018 [TCP PDU reassembled in 274]"
"272","1.855938","192.168.1.228","207.65.37.179","TCP","1514","53248  >  443 [ACK] Seq=1449 Ack=1 Win=2048 Len=1448 TSval=658090423 TSecr=2748900018 [TCP PDU reassembled in 274]"
"273","1.855938","192.168.1.228","207.65.37.179","TCP","1514","53248  >  443 [ACK] Seq=2897 Ack=1 Win=2048 Len=1448 TSval=658090423 TSecr=2748900018 [TCP PDU reassembled in 274]"
"274","1.855940","192.168.1.228","207.65.37.179","TLSv1.2","1084","Application Data"
"275","1.855950","192.168.1.228","207.65.37.179","TCP","1514","53248  >  443 [ACK] Seq=5363 Ack=1 Win=2048 Len=1448 TSval=658090423 TSecr=2748900018 [TCP PDU reassembled in 277]"
"276","1.855950","192.168.1.228","207.65.37.179","TCP","1514","53248  >  443 [ACK] Seq=6811 Ack=1 Win=2048 Len=1448 TSval=658090423 TSecr=2748900018 [TCP PDU reassembled in 277]"
"277","1.855952","192.168.1.228","207.65.37.179","TLSv1.2","1391","Application Data"
"278","1.856704","3.167.100.35","192.168.1.228","TCP","66","443  >  53233 [ACK] Seq=1 Ack=7208 Win=504 Len=0 TSval=1636779197 TSecr=4225690515"
"279","1.856705","3.167.100.35","192.168.1.228","TCP","66","443  >  53233 [ACK] Seq=1 Ack=7609 Win=509 Len=0 TSval=1636779197 TSecr=4225690515"
"280","1.856706","2606:4700::6812:41d","2600:4040:231a:b800:3c9e:c12c:139a:9787","QUIC","115","Protected Payload (KP0)"
"281","1.856707","2606:4700::6812:41d","2600:4040:231a:b800:3c9e:c12c:139a:9787","QUIC","86","Protected Payload (KP0)"
"282","1.856707","2606:4700::6812:41d","2600:4040:231a:b800:3c9e:c12c:139a:9787","QUIC","86","Protected Payload (KP0)"
"283","1.856708","2606:4700::6812:41d","2600:4040:231a:b800:3c9e:c12c:139a:9787","QUIC","111","Protected Payload (KP0)"
"284","1.856709","192.168.1.1","192.168.1.228","DNS","248","Standard query response 0x1dba HTTPS prebid-server.rubiconproject.com CNAME prebid-server-new.rubiconproject.net.akadns.net CNAME prebid-server-ips.rubiconproject.net.akadns.net SOA internal.akadns.net"
"285","1.856710","192.168.1.1","192.168.1.228","DNS","150","Standard query response 0x3b0f A web.ads.aps.amazon-adsystem.com CNAME d1jvc9b8z3vcjs.cloudfront.net A 18.160.23.182"
"286","1.856710","192.168.1.1","192.168.1.228","DNS","183","Standard query response 0x6a63 HTTPS tlx.3lift.com CNAME us-east-tlx.3lift.com SOA ns-1640.awsdns-13.co.uk"
"287","1.856711","192.168.1.1","192.168.1.228","DNS","183","Standard query response 0xe5e8 AAAA tlx.3lift.com CNAME us-east-tlx.3lift.com SOA ns-1640.awsdns-13.co.uk"
"288","1.856712","192.168.1.1","192.168.1.228","DNS","213","Standard query response 0x1825 AAAA prebid-server.rubiconproject.com CNAME prebid-server-new.rubiconproject.net.akadns.net CNAME prebid-server-ips.rubiconproject.net.akadns.net AAAA 2602:803:c007:ffff::6"
"289","1.856712","2606:4700:10::ac42:a2fe","2600:4040:231a:b800:3c9e:c12c:139a:9787","QUIC","526","Protected Payload (KP0)"
