"No.","Time","Source","Destination","Protocol","Length","Info"
"1","0.000000","100.86.121.59","172.66.164.67","TLSv1.2","208","Application Data"
"2","0.000107","100.86.121.59","172.66.164.67","TLSv1.2","105","Application Data"
"3","0.077155","172.66.164.67","100.86.121.59","TLSv1.2","105","Application Data"
"4","0.077471","100.86.121.59","172.66.164.67","TCP","66","54412  >  443 [ACK] Seq=182 Ack=40 Win=2048 Len=0 TSval=1457851114 TSecr=1128047726"
"5","0.102105","172.66.164.67","100.86.121.59","TLSv1.2","231","Application Data"
"6","0.102109","172.66.164.67","100.86.121.59","TLSv1.2","290","Application Data"
"7","0.102302","100.86.121.59","172.66.164.67","TCP","66","54412  >  443 [ACK] Seq=182 Ack=429 Win=2042 Len=0 TSval=1457851139 TSecr=1128047746"
"8","0.102530","172.66.164.67","100.86.121.59","TLSv1.2","97","Application Data"
"9","0.102611","100.86.121.59","172.66.164.67","TCP","66","54412  >  443 [ACK] Seq=182 Ack=460 Win=2048 Len=0 TSval=1457851139 TSecr=1128047746"
"10","0.104831","100.86.121.59","172.66.164.67","TLSv1.2","101","Application Data"
"11","0.126596","172.66.164.67","100.86.121.59","TCP","97","[TCP Spurious Retransmission] 443  >  54412 [PSH, ACK] Seq=429 Ack=182 Win=15 Len=31 TSval=1128047789 TSecr=1457851037"
"12","0.126809","100.86.121.59","172.66.164.67","TCP","78","[TCP Dup ACK 9#1] 54412  >  443 [ACK] Seq=217 Ack=460 Win=2048 Len=0 TSval=1457851164 TSecr=1128047789 SLE=429 SRE=460"
"13","0.222858","172.66.164.67","100.86.121.59","TCP","66","443  >  54412 [ACK] Seq=460 Ack=217 Win=15 Len=0 TSval=1128047888 TSecr=1457851142"
"14","1.297905","100.86.121.59","172.66.164.67","TLSv1.2","340","Application Data"
"15","1.309517","172.66.164.67","100.86.121.59","TCP","66","443  >  54412 [ACK] Seq=460 Ack=491 Win=15 Len=0 TSval=1128048998 TSecr=1457852335"
"16","1.380204","100.86.121.59","172.66.164.67","TLSv1.2","101","Application Data"
"17","1.384915","100.86.121.59","172.66.164.67","TLSv1.2","603","Application Data"
"18","1.390792","172.66.164.67","100.86.121.59","TCP","66","443  >  54412 [ACK] Seq=460 Ack=526 Win=15 Len=0 TSval=1128049080 TSecr=1457852417"
"19","1.394372","172.66.164.67","100.86.121.59","TCP","66","443  >  54412 [ACK] Seq=460 Ack=1063 Win=15 Len=0 TSval=1128049084 TSecr=1457852422"
"20","2.234150","172.66.164.67","100.86.121.59","TLSv1.2","224","Application Data"
"21","2.234154","172.66.164.67","100.86.121.59","TCP","1514","443  >  54412 [ACK] Seq=618 Ack=1063 Win=15 Len=1448 TSval=1128049815 TSecr=1457852422 [TCP PDU reassembled in 33]"
"22","2.234157","172.66.164.67","100.86.121.59","TCP","1514","443  >  54412 [ACK] Seq=2066 Ack=1063 Win=15 Len=1448 TSval=1128049815 TSecr=1457852422 [TCP PDU reassembled in 33]"
"23","2.234160","172.66.164.67","100.86.121.59","TCP","1514","443  >  54412 [PSH, ACK] Seq=3514 Ack=1063 Win=15 Len=1448 TSval=1128049815 TSecr=1457852422 [TCP PDU reassembled in 33]"
"24","2.234206","172.66.164.67","100.86.121.59","TCP","1514","443  >  54412 [ACK] Seq=4962 Ack=1063 Win=15 Len=1448 TSval=1128049816 TSecr=1457852422 [TCP PDU reassembled in 33]"
"25","2.234209","172.66.164.67","100.86.121.59","TCP","1514","443  >  54412 [ACK] Seq=6410 Ack=1063 Win=15 Len=1448 TSval=1128049816 TSecr=1457852422 [TCP PDU reassembled in 33]"
"26","2.234212","172.66.164.67","100.86.121.59","TCP","1514","443  >  54412 [PSH, ACK] Seq=7858 Ack=1063 Win=15 Len=1448 TSval=1128049816 TSecr=1457852422 [TCP PDU reassembled in 33]"
"27","2.234214","172.66.164.67","100.86.121.59","TCP","1514","443  >  54412 [ACK] Seq=9306 Ack=1063 Win=15 Len=1448 TSval=1128049817 TSecr=1457852422 [TCP PDU reassembled in 33]"
"28","2.234368","100.86.121.59","172.66.164.67","TCP","66","54412  >  443 [ACK] Seq=1063 Ack=4962 Win=1978 Len=0 TSval=1457853271 TSecr=1128049815"
"29","2.234465","100.86.121.59","172.66.164.67","TCP","66","54412  >  443 [ACK] Seq=1063 Ack=10754 Win=1888 Len=0 TSval=1457853271 TSecr=1128049817"
"30","2.234513","100.86.121.59","172.66.164.67","TCP","66","[TCP Window Update] 54412  >  443 [ACK] Seq=1063 Ack=10754 Win=2048 Len=0 TSval=1457853271 TSecr=1128049817"
"31","2.235512","172.66.164.67","100.86.121.59","TCP","1514","443  >  54412 [ACK] Seq=10754 Ack=1063 Win=15 Len=1448 TSval=1128049817 TSecr=1457852422 [TCP PDU reassembled in 33]"
"32","2.235515","172.66.164.67","100.86.121.59","TCP","1514","443  >  54412 [PSH, ACK] Seq=12202 Ack=1063 Win=15 Len=1448 TSval=1128049817 TSecr=1457852422 [TCP PDU reassembled in 33]"
"33","2.235517","172.66.164.67","100.86.121.59","TLSv1.2","70","Application Data"
"34","2.235520","172.66.164.67","100.86.121.59","TCP","1514","443  >  54412 [ACK] Seq=13654 Ack=1063 Win=15 Len=1448 TSval=1128049818 TSecr=1457852422 [TCP PDU reassembled in 36]"
"35","2.235523","172.66.164.67","100.86.121.59","TCP","1514","443  >  54412 [ACK] Seq=15102 Ack=1063 Win=15 Len=1448 TSval=1128049818 TSecr=1457852422 [TCP PDU reassembled in 36]"
"36","2.235526","172.66.164.67","100.86.121.59","TLSv1.2","374","Application Data"
"37","2.235529","172.66.164.67","100.86.121.59","TLSv1.2","175","Application Data"
"38","2.235531","172.66.164.67","100.86.121.59","TCP","1514","443  >  54412 [ACK] Seq=16967 Ack=1063 Win=15 Len=1448 TSval=1128049820 TSecr=1457852422 [TCP PDU reassembled in 42]"
"39","2.235534","172.66.164.67","100.86.121.59","TCP","1514","443  >  54412 [ACK] Seq=18415 Ack=1063 Win=15 Len=1448 TSval=1128049820 TSecr=1457852422 [TCP PDU reassembled in 42]"
"40","2.235538","172.66.164.67","100.86.121.59","TCP","1514","443  >  54412 [PSH, ACK] Seq=19863 Ack=1063 Win=15 Len=1448 TSval=1128049820 TSecr=1457852422 [TCP PDU reassembled in 42]"
"41","2.235541","172.66.164.67","100.86.121.59","TCP","1514","443  >  54412 [ACK] Seq=21311 Ack=1063 Win=15 Len=1448 TSval=1128049820 TSecr=1457852422 [TCP PDU reassembled in 42]"
"42","2.235544","172.66.164.67","100.86.121.59","TLSv1.2","1502","Application Data"
"43","2.236286","172.66.164.67","100.86.121.59","TLSv1.2","97","Application Data"
"44","2.236287","172.66.164.67","100.86.121.59","TCP","97","[TCP Retransmission] 443  >  54412 [PSH, ACK] Seq=24195 Ack=1063 Win=15 Len=31 TSval=1128049910 TSecr=1457852422"
"45","2.236354","100.86.121.59","172.66.164.67","TCP","66","54412  >  443 [ACK] Seq=1063 Ack=24226 Win=1838 Len=0 TSval=1457853273 TSecr=1128049821"
"46","2.236399","100.86.121.59","172.66.164.67","TCP","78","[TCP Dup ACK 45#1] 54412  >  443 [ACK] Seq=1063 Ack=24226 Win=1838 Len=0 TSval=1457853273 TSecr=1128049910 SLE=24195 SRE=24226"
"47","2.236419","100.86.121.59","172.66.164.67","TCP","66","[TCP Window Update] 54412  >  443 [ACK] Seq=1063 Ack=24226 Win=2048 Len=0 TSval=1457853273 TSecr=1128049910"
"48","2.316580","100.86.121.59","172.66.164.67","TLSv1.2","256","Application Data"
"49","2.329468","172.66.164.67","100.86.121.59","TCP","66","443  >  54412 [ACK] Seq=24226 Ack=1253 Win=15 Len=0 TSval=1128050019 TSecr=1457853353"
"50","2.349045","172.66.164.67","100.86.121.59","TLSv1.2","151","Application Data"
"51","2.349047","172.66.164.67","100.86.121.59","TLSv1.2","108","Application Data"
"52","2.349121","172.66.164.67","100.86.121.59","TLSv1.2","97","Application Data"
"53","2.349131","100.86.121.59","172.66.164.67","TCP","66","54412  >  443 [ACK] Seq=1253 Ack=24353 Win=2047 Len=0 TSval=1457853386 TSecr=1128050039"
"54","2.349165","100.86.121.59","172.66.164.67","TCP","66","54412  >  443 [ACK] Seq=1253 Ack=24384 Win=2047 Len=0 TSval=1457853386 TSecr=1128050039"
"55","2.398434","100.86.121.59","172.66.164.67","TLSv1.2","1373","Application Data"
"56","2.400675","100.86.121.59","172.66.164.67","TLSv1.2","198","Application Data"
"57","2.401868","100.86.121.59","172.66.164.67","TLSv1.2","209","Application Data"
"58","2.401988","100.86.121.59","172.66.164.67","TLSv1.2","198","Application Data"
"59","2.402323","100.86.121.59","172.66.164.67","TLSv1.2","197","Application Data"
"60","2.410026","172.66.164.67","100.86.121.59","TCP","66","443  >  54412 [ACK] Seq=24384 Ack=2692 Win=15 Len=0 TSval=1128050100 TSecr=1457853435"
"61","2.412927","172.66.164.67","100.86.121.59","TCP","66","443  >  54412 [ACK] Seq=24384 Ack=3098 Win=15 Len=0 TSval=1128050103 TSecr=1457853439"
"62","2.430763","172.66.164.67","100.86.121.59","TLSv1.2","127","Application Data"
"63","2.430766","172.66.164.67","100.86.121.59","TLSv1.2","290","Application Data"
"64","2.430865","100.86.121.59","172.66.164.67","TCP","66","54412  >  443 [ACK] Seq=3098 Ack=24669 Win=2044 Len=0 TSval=1457853468 TSecr=1128050120"
"65","2.431223","172.66.164.67","100.86.121.59","TLSv1.2","97","Application Data"
"66","2.431224","172.66.164.67","100.86.121.59","TLSv1.2","127","Application Data"
"67","2.431226","172.66.164.67","100.86.121.59","TLSv1.2","290","Application Data"
"68","2.431282","100.86.121.59","172.66.164.67","TCP","66","54412  >  443 [ACK] Seq=3098 Ack=24985 Win=2044 Len=0 TSval=1457853468 TSecr=1128050121"
"69","2.431521","172.66.164.67","100.86.121.59","TLSv1.2","97","Application Data"
"70","2.431554","100.86.121.59","172.66.164.67","TCP","66","54412  >  443 [ACK] Seq=3098 Ack=25016 Win=2048 Len=0 TSval=1457853468 TSecr=1128050121"
"71","2.438154","172.66.164.67","100.86.121.59","TLSv1.2","127","Application Data"
"72","2.438155","172.66.164.67","100.86.121.59","TLSv1.2","290","Application Data"
"73","2.438222","100.86.121.59","172.66.164.67","TCP","66","54412  >  443 [ACK] Seq=3098 Ack=25301 Win=2044 Len=0 TSval=1457853475 TSecr=1128050127"
"74","2.438484","172.66.164.67","100.86.121.59","TLSv1.2","97","Application Data"
"75","2.438485","172.66.164.67","100.86.121.59","TLSv1.2","128","Application Data"
"76","2.438487","172.66.164.67","100.86.121.59","TLSv1.2","290","Application Data"
"77","2.438528","100.86.121.59","172.66.164.67","TCP","66","54412  >  443 [ACK] Seq=3098 Ack=25618 Win=2044 Len=0 TSval=1457853475 TSecr=1128050128"
"78","2.438781","172.66.164.67","100.86.121.59","TLSv1.2","97","Application Data"
"79","2.438782","172.66.164.67","100.86.121.59","TLSv1.2","163","Application Data"
"80","2.438783","172.66.164.67","100.86.121.59","TLSv1.2","321","Application Data, Application Data"
"81","2.438815","100.86.121.59","172.66.164.67","TCP","66","54412  >  443 [ACK] Seq=3098 Ack=26001 Win=2043 Len=0 TSval=1457853476 TSecr=1128050128"
"82","7.439259","100.86.121.59","172.66.164.67","TLSv1.2","196","Application Data"
"83","7.447264","100.86.121.59","172.66.164.67","TLSv1.2","196","Application Data"
"84","7.530587","172.66.164.67","100.86.121.59","TCP","66","443  >  54412 [ACK] Seq=26001 Ack=3358 Win=15 Len=0 TSval=1128055179 TSecr=1457858476"
"85","7.541939","172.66.164.67","100.86.121.59","TLSv1.2","231","Application Data"
"86","7.541944","172.66.164.67","100.86.121.59","TLSv1.2","290","Application Data"
"87","7.541947","172.66.164.67","100.86.121.59","TLSv1.2","97","Application Data"
"88","7.542169","100.86.121.59","172.66.164.67","TCP","66","54412  >  443 [ACK] Seq=3358 Ack=26421 Win=2042 Len=0 TSval=1457858579 TSecr=1128055203"
"89","7.542231","172.66.164.67","100.86.121.59","TLSv1.2","127","Application Data"
"90","7.542233","172.66.164.67","100.86.121.59","TLSv1.2","290","Application Data"
"91","7.542235","172.66.164.67","100.86.121.59","TLSv1.2","97","Application Data"
"92","7.542353","100.86.121.59","172.66.164.67","TCP","66","54412  >  443 [ACK] Seq=3358 Ack=26737 Win=2038 Len=0 TSval=1457858579 TSecr=1128055219"
"93","7.544477","100.86.121.59","172.66.164.67","TLSv1.2","101","Application Data"
"94","7.594987","172.66.164.67","100.86.121.59","TCP","66","443  >  54412 [ACK] Seq=26737 Ack=3393 Win=15 Len=0 TSval=1128055285 TSecr=1457858581"
"95","12.438896","100.86.121.59","172.66.164.67","TLSv1.2","624","Application Data"
"96","12.447432","100.86.121.59","172.66.164.67","TLSv1.2","320","Application Data"
"97","12.447794","100.86.121.59","172.66.164.67","TLSv1.2","1386","Application Data"
"98","12.449394","172.66.164.67","100.86.121.59","TCP","66","443  >  54412 [ACK] Seq=26737 Ack=3951 Win=15 Len=0 TSval=1128060139 TSecr=1457863476"
"99","12.457284","172.66.164.67","100.86.121.59","TCP","66","443  >  54412 [ACK] Seq=26737 Ack=4205 Win=15 Len=0 TSval=1128060147 TSecr=1457863484"
"100","12.458178","172.66.164.67","100.86.121.59","TCP","66","443  >  54412 [ACK] Seq=26737 Ack=5525 Win=15 Len=0 TSval=1128060148 TSecr=1457863485"
"101","12.467110","172.66.164.67","100.86.121.59","TLSv1.2","150","Application Data"
"102","12.467113","172.66.164.67","100.86.121.59","TLSv1.2","290","Application Data"
"103","12.467243","100.86.121.59","172.66.164.67","TCP","66","54412  >  443 [ACK] Seq=5525 Ack=27045 Win=2044 Len=0 TSval=1457863504 TSecr=1128060157"
"104","12.467662","172.66.164.67","100.86.121.59","TLSv1.2","97","Application Data"
"105","12.467731","100.86.121.59","172.66.164.67","TCP","66","54412  >  443 [ACK] Seq=5525 Ack=27076 Win=2048 Len=0 TSval=1457863504 TSecr=1128060157"
"106","12.474927","172.66.164.67","100.86.121.59","TLSv1.2","127","Application Data"
"107","12.474930","172.66.164.67","100.86.121.59","TLSv1.2","290","Application Data"
"108","12.475039","172.66.164.67","100.86.121.59","TLSv1.2","97","Application Data"
"109","12.475074","100.86.121.59","172.66.164.67","TCP","66","54412  >  443 [ACK] Seq=5525 Ack=27361 Win=2044 Len=0 TSval=1457863512 TSecr=1128060164"
"110","12.475136","100.86.121.59","172.66.164.67","TCP","66","54412  >  443 [ACK] Seq=5525 Ack=27392 Win=2044 Len=0 TSval=1457863512 TSecr=1128060164"
"111","12.475956","172.66.164.67","100.86.121.59","TLSv1.2","127","Application Data"
"112","12.475958","172.66.164.67","100.86.121.59","TLSv1.2","290","Application Data"
"113","12.476019","100.86.121.59","172.66.164.67","TCP","66","54412  >  443 [ACK] Seq=5525 Ack=27677 Win=2044 Len=0 TSval=1457863513 TSecr=1128060166"
"114","12.476122","172.66.164.67","100.86.121.59","TLSv1.2","97","Application Data"
"115","12.476159","100.86.121.59","172.66.164.67","TCP","66","54412  >  443 [ACK] Seq=5525 Ack=27708 Win=2048 Len=0 TSval=1457863513 TSecr=1128060166"
"116","15.665428","100.86.121.59","172.66.164.67","TLSv1.2","302","Application Data"
"117","15.717002","172.66.164.67","100.86.121.59","TCP","66","443  >  54412 [ACK] Seq=27708 Ack=5761 Win=15 Len=0 TSval=1128063407 TSecr=1457866702"
"118","15.740318","172.66.164.67","100.86.121.59","TLSv1.2","175","Application Data"
"119","15.740381","100.86.121.59","172.66.164.67","TCP","66","54412  >  443 [ACK] Seq=5761 Ack=27817 Win=2047 Len=0 TSval=1457866777 TSecr=1128063430"
"120","15.741132","172.66.164.67","100.86.121.59","TCP","1514","443  >  54412 [ACK] Seq=27817 Ack=5761 Win=15 Len=1448 TSval=1128063430 TSecr=1457866702 [TCP PDU reassembled in 137]"
"121","15.741134","172.66.164.67","100.86.121.59","TCP","1514","443  >  54412 [ACK] Seq=29265 Ack=5761 Win=15 Len=1448 TSval=1128063430 TSecr=1457866702 [TCP PDU reassembled in 137]"
"122","15.741169","100.86.121.59","172.66.164.67","TCP","66","54412  >  443 [ACK] Seq=5761 Ack=30713 Win=2003 Len=0 TSval=1457866778 TSecr=1128063430"
"123","15.741209","100.86.121.59","172.66.164.67","TCP","66","[TCP Window Update] 54412  >  443 [ACK] Seq=5761 Ack=30713 Win=2048 Len=0 TSval=1457866778 TSecr=1128063430"
"124","15.741578","172.66.164.67","100.86.121.59","TCP","1514","443  >  54412 [PSH, ACK] Seq=30713 Ack=5761 Win=15 Len=1448 TSval=1128063430 TSecr=1457866702 [TCP PDU reassembled in 137]"
"125","15.741605","100.86.121.59","172.66.164.67","TCP","66","54412  >  443 [ACK] Seq=5761 Ack=32161 Win=2026 Len=0 TSval=1457866778 TSecr=1128063430"
"126","15.742208","172.66.164.67","100.86.121.59","TCP","1514","443  >  54412 [ACK] Seq=32161 Ack=5761 Win=15 Len=1448 TSval=1128063431 TSecr=1457866702 [TCP PDU reassembled in 137]"
"127","15.742239","100.86.121.59","172.66.164.67","TCP","66","54412  >  443 [ACK] Seq=5761 Ack=33609 Win=2026 Len=0 TSval=1457866779 TSecr=1128063431"
"128","15.743157","172.66.164.67","100.86.121.59","TCP","1514","443  >  54412 [ACK] Seq=33609 Ack=5761 Win=15 Len=1448 TSval=1128063431 TSecr=1457866702 [TCP PDU reassembled in 137]"
"129","15.743158","172.66.164.67","100.86.121.59","TCP","1514","443  >  54412 [PSH, ACK] Seq=35057 Ack=5761 Win=15 Len=1448 TSval=1128063431 TSecr=1457866702 [TCP PDU reassembled in 137]"
"130","15.743160","172.66.164.67","100.86.121.59","TCP","1514","443  >  54412 [ACK] Seq=36505 Ack=5761 Win=15 Len=1448 TSval=1128063432 TSecr=1457866702 [TCP PDU reassembled in 137]"
"131","15.743208","100.86.121.59","172.66.164.67","TCP","66","54412  >  443 [ACK] Seq=5761 Ack=37953 Win=1981 Len=0 TSval=1457866780 TSecr=1128063432"
"132","15.743272","100.86.121.59","172.66.164.67","TCP","66","[TCP Window Update] 54412  >  443 [ACK] Seq=5761 Ack=37953 Win=2048 Len=0 TSval=1457866780 TSecr=1128063432"
"133","15.745303","172.66.164.67","100.86.121.59","TCP","1514","443  >  54412 [ACK] Seq=37953 Ack=5761 Win=15 Len=1448 TSval=1128063432 TSecr=1457866702 [TCP PDU reassembled in 137]"
"134","15.745305","172.66.164.67","100.86.121.59","TCP","1514","443  >  54412 [PSH, ACK] Seq=39401 Ack=5761 Win=15 Len=1448 TSval=1128063432 TSecr=1457866702 [TCP PDU reassembled in 137]"
"135","15.745306","172.66.164.67","100.86.121.59","TCP","1514","443  >  54412 [ACK] Seq=40849 Ack=5761 Win=15 Len=1448 TSval=1128063433 TSecr=1457866702 [TCP PDU reassembled in 137]"
"136","15.745308","172.66.164.67","100.86.121.59","TCP","1514","443  >  54412 [ACK] Seq=42297 Ack=5761 Win=15 Len=1448 TSval=1128063433 TSecr=1457866702 [TCP PDU reassembled in 137]"
"137","15.745309","172.66.164.67","100.86.121.59","TLSv1.2","1514","Application Data"
"138","15.745311","172.66.164.67","100.86.121.59","TCP","1514","443  >  54412 [ACK] Seq=45193 Ack=5761 Win=15 Len=1448 TSval=1128063434 TSecr=1457866702 [TCP PDU reassembled in 145]"
"139","15.745312","172.66.164.67","100.86.121.59","TCP","1514","443  >  54412 [ACK] Seq=46641 Ack=5761 Win=15 Len=1448 TSval=1128063434 TSecr=1457866702 [TCP PDU reassembled in 145]"
"140","15.745314","172.66.164.67","100.86.121.59","TCP","1514","443  >  54412 [PSH, ACK] Seq=48089 Ack=5761 Win=15 Len=1448 TSval=1128063434 TSecr=1457866702 [TCP PDU reassembled in 145]"
"141","15.745367","100.86.121.59","172.66.164.67","TCP","66","54412  >  443 [ACK] Seq=5761 Ack=49537 Win=1867 Len=0 TSval=1457866782 TSecr=1128063434"
"142","15.745425","100.86.121.59","172.66.164.67","TCP","66","[TCP Window Update] 54412  >  443 [ACK] Seq=5761 Ack=49537 Win=2048 Len=0 TSval=1457866782 TSecr=1128063434"
"143","15.745619","172.66.164.67","100.86.121.59","TCP","1514","443  >  54412 [ACK] Seq=49537 Ack=5761 Win=15 Len=1448 TSval=1128063435 TSecr=1457866702 [TCP PDU reassembled in 145]"
"144","15.745621","172.66.164.67","100.86.121.59","TCP","1514","443  >  54412 [ACK] Seq=50985 Ack=5761 Win=15 Len=1448 TSval=1128063435 TSecr=1457866702 [TCP PDU reassembled in 145]"
"145","15.745623","172.66.164.67","100.86.121.59","TLSv1.2","896","Application Data, Application Data"
"146","15.745656","100.86.121.59","172.66.164.67","TCP","66","54412  >  443 [ACK] Seq=5761 Ack=53263 Win=1990 Len=0 TSval=1457866782 TSecr=1128063435"
"147","15.745693","100.86.121.59","172.66.164.67","TCP","66","[TCP Window Update] 54412  >  443 [ACK] Seq=5761 Ack=53263 Win=2048 Len=0 TSval=1457866782 TSecr=1128063435"
"148","15.746899","100.86.121.59","172.66.164.67","TLSv1.2","101","Application Data"
"149","15.756640","172.66.164.67","100.86.121.59","TCP","66","443  >  54412 [ACK] Seq=53263 Ack=5796 Win=15 Len=0 TSval=1128063446 TSecr=1457866784"
"150","15.780674","100.86.121.59","172.66.164.67","TLSv1.2","185","Application Data"
"151","15.801607","172.66.164.67","100.86.121.59","TCP","66","443  >  54412 [ACK] Seq=53263 Ack=5915 Win=15 Len=0 TSval=1128063480 TSecr=1457866817"
"152","15.815337","100.86.121.59","172.66.164.67","TLSv1.2","806","Application Data"
"153","15.816079","100.86.121.59","172.66.164.67","TLSv1.2","333","Application Data"
"154","15.816463","100.86.121.59","172.66.164.67","TLSv1.2","201","Application Data"
"155","15.816606","100.86.121.59","172.66.164.67","TLSv1.2","1097","Application Data"
"156","15.816691","100.86.121.59","172.66.164.67","TLSv1.2","198","Application Data"
"157","15.841738","172.66.164.67","100.86.121.59","TLSv1.2","128","Application Data"
"158","15.841740","172.66.164.67","100.86.121.59","TLSv1.2","108","Application Data"
"159","15.841741","172.66.164.67","100.86.121.59","TLSv1.2","97","Application Data"
"160","15.841745","172.66.164.67","100.86.121.59","TCP","66","443  >  54412 [ACK] Seq=53398 Ack=8220 Win=15 Len=0 TSval=1128063520 TSecr=1457866852"
"161","15.841845","100.86.121.59","172.66.164.67","TCP","66","54412  >  443 [ACK] Seq=8220 Ack=53398 Win=2046 Len=0 TSval=1457866879 TSecr=1128063505"
"162","15.858644","172.66.164.67","100.86.121.59","TLSv1.2","127","Application Data"
"163","15.858645","172.66.164.67","100.86.121.59","TLSv1.2","290","Application Data"
"164","15.858646","172.66.164.67","100.86.121.59","TLSv1.2","97","Application Data"
"165","15.858647","172.66.164.67","100.86.121.59","TLSv1.2","127","Application Data"
"166","15.858648","172.66.164.67","100.86.121.59","TLSv1.2","290","Application Data"
"167","15.858649","172.66.164.67","100.86.121.59","TLSv1.2","97","Application Data"
"168","15.858652","172.66.164.67","100.86.121.59","TLSv1.2","127","Application Data"
"169","15.858653","172.66.164.67","100.86.121.59","TLSv1.2","290","Application Data"
"170","15.858654","172.66.164.67","100.86.121.59","TLSv1.2","97","Application Data"
"171","15.858800","100.86.121.59","172.66.164.67","TCP","66","54412  >  443 [ACK] Seq=8220 Ack=54346 Win=2034 Len=0 TSval=1457866896 TSecr=1128063545"
"172","15.859173","172.66.164.67","100.86.121.59","TLSv1.2","127","Application Data"
"173","15.859174","172.66.164.67","100.86.121.59","TLSv1.2","290","Application Data"
"174","15.859175","172.66.164.67","100.86.121.59","TLSv1.2","97","Application Data"
"175","15.859204","100.86.121.59","172.66.164.67","TCP","66","54412  >  443 [ACK] Seq=8220 Ack=54662 Win=2044 Len=0 TSval=1457866896 TSecr=1128063545"
"176","15.860450","172.66.164.67","100.86.121.59","TLSv1.2","127","Application Data"
"177","15.860451","172.66.164.67","100.86.121.59","TLSv1.2","290","Application Data"
"178","15.860452","172.66.164.67","100.86.121.59","TLSv1.2","97","Application Data"
"179","15.860513","100.86.121.59","172.66.164.67","TCP","66","54412  >  443 [ACK] Seq=8220 Ack=54978 Win=2044 Len=0 TSval=1457866897 TSecr=1128063547"
"180","16.055414","100.86.121.59","172.66.164.67","TCP","54","[TCP Keep-Alive] 54412  >  443 [ACK] Seq=8219 Ack=54978 Win=2048 Len=0"
"181","16.065991","172.66.164.67","100.86.121.59","TCP","66","[TCP Keep-Alive ACK] 443  >  54412 [ACK] Seq=54978 Ack=8220 Win=15 Len=0 TSval=1128063756 TSecr=1457866897"
"182","20.869525","100.86.121.59","172.66.164.67","TLSv1.2","197","Application Data"
"183","20.870015","100.86.121.59","172.66.164.67","TLSv1.2","196","Application Data"
"184","20.870329","100.86.121.59","172.66.164.67","TLSv1.2","199","Application Data"
"185","20.883494","172.66.164.67","100.86.121.59","TCP","66","443  >  54412 [ACK] Seq=54978 Ack=8614 Win=15 Len=0 TSval=1128068573 TSecr=1457871906"
"186","20.900889","172.66.164.67","100.86.121.59","TLSv1.2","150","Application Data"
"187","20.900892","172.66.164.67","100.86.121.59","TLSv1.2","290","Application Data"
"188","20.900894","172.66.164.67","100.86.121.59","TLSv1.2","97","Application Data"
"189","20.901070","100.86.121.59","172.66.164.67","TCP","66","54412  >  443 [ACK] Seq=8614 Ack=55317 Win=2043 Len=0 TSval=1457871938 TSecr=1128068591"
"190","20.902523","100.86.121.59","172.66.164.67","TLSv1.2","101","Application Data"
"191","20.904745","172.66.164.67","100.86.121.59","TLSv1.2","242","Application Data"
"192","20.904884","100.86.121.59","172.66.164.67","TCP","66","54412  >  443 [ACK] Seq=8649 Ack=55493 Win=2046 Len=0 TSval=1457871942 TSecr=1128068595"
"193","20.905199","172.66.164.67","100.86.121.59","TLSv1.2","290","Application Data"
"194","20.905201","172.66.164.67","100.86.121.59","TLSv1.2","97","Application Data"
"195","20.905272","100.86.121.59","172.66.164.67","TCP","66","54412  >  443 [ACK] Seq=8649 Ack=55748 Win=2045 Len=0 TSval=1457871942 TSecr=1128068595"
"196","20.906703","172.66.164.67","100.86.121.59","TLSv1.2","127","Application Data"
"197","20.906833","172.66.164.67","100.86.121.59","TLSv1.2","290","Application Data"
"198","20.906848","100.86.121.59","172.66.164.67","TCP","66","54412  >  443 [ACK] Seq=8649 Ack=55809 Win=2048 Len=0 TSval=1457871944 TSecr=1128068596"
"199","20.906914","100.86.121.59","172.66.164.67","TCP","66","54412  >  443 [ACK] Seq=8649 Ack=56033 Win=2045 Len=0 TSval=1457871944 TSecr=1128068597"
"200","20.906968","172.66.164.67","100.86.121.59","TLSv1.2","97","Application Data"
"201","20.907018","100.86.121.59","172.66.164.67","TCP","66","54412  >  443 [ACK] Seq=8649 Ack=56064 Win=2045 Len=0 TSval=1457871944 TSecr=1128068597"
"202","20.952892","172.66.164.67","100.86.121.59","TCP","66","443  >  54412 [ACK] Seq=56064 Ack=8649 Win=15 Len=0 TSval=1128068643 TSecr=1457871939"
"203","25.868565","100.86.121.59","172.66.164.67","TLSv1.2","232","Application Data"
"204","25.868973","100.86.121.59","172.66.164.67","TLSv1.2","812","Application Data"
"205","25.879108","172.66.164.67","100.86.121.59","TCP","66","443  >  54412 [ACK] Seq=56064 Ack=8815 Win=15 Len=0 TSval=1128073569 TSecr=1457876905"
"206","25.879110","172.66.164.67","100.86.121.59","TCP","66","443  >  54412 [ACK] Seq=56064 Ack=9561 Win=15 Len=0 TSval=1128073569 TSecr=1457876906"
"207","25.901424","172.66.164.67","100.86.121.59","TLSv1.2","150","Application Data"
"208","25.901426","172.66.164.67","100.86.121.59","TLSv1.2","290","Application Data"
"209","25.901534","100.86.121.59","172.66.164.67","TCP","66","54412  >  443 [ACK] Seq=9561 Ack=56372 Win=2044 Len=0 TSval=1457876938 TSecr=1128073591"
"210","25.901561","172.66.164.67","100.86.121.59","TLSv1.2","97","Application Data"
"211","25.901615","100.86.121.59","172.66.164.67","TCP","66","54412  >  443 [ACK] Seq=9561 Ack=56403 Win=2044 Len=0 TSval=1457876938 TSecr=1128073591"
"212","25.902837","172.66.164.67","100.86.121.59","TLSv1.2","127","Application Data"
"213","25.902839","172.66.164.67","100.86.121.59","TLSv1.2","290","Application Data"
"214","25.902910","100.86.121.59","172.66.164.67","TCP","66","54412  >  443 [ACK] Seq=9561 Ack=56688 Win=2044 Len=0 TSval=1457876940 TSecr=1128073593"
"215","25.903020","172.66.164.67","100.86.121.59","TLSv1.2","97","Application Data"
"216","25.903068","100.86.121.59","172.66.164.67","TCP","66","54412  >  443 [ACK] Seq=9561 Ack=56719 Win=2044 Len=0 TSval=1457876940 TSecr=1128073593"
"217","25.903784","100.86.121.59","172.66.164.67","TLSv1.2","101","Application Data"
"218","25.956986","172.66.164.67","100.86.121.59","TCP","66","443  >  54412 [ACK] Seq=56719 Ack=9596 Win=15 Len=0 TSval=1128073647 TSecr=1457876940"
"219","30.787646","100.86.121.59","172.66.164.67","TLSv1.2","349","Application Data"
"220","30.800923","172.66.164.67","100.86.121.59","TCP","66","443  >  54412 [ACK] Seq=56719 Ack=9879 Win=15 Len=0 TSval=1128078491 TSecr=1457881824"
"221","30.819871","172.66.164.67","100.86.121.59","TLSv1.2","151","Application Data"
"222","30.819873","172.66.164.67","100.86.121.59","TLSv1.2","108","Application Data"
"223","30.819987","172.66.164.67","100.86.121.59","TLSv1.2","97","Application Data"
"224","30.820019","100.86.121.59","172.66.164.67","TCP","66","54412  >  443 [ACK] Seq=9879 Ack=56846 Win=2047 Len=0 TSval=1457881857 TSecr=1128078509"
"225","30.820080","100.86.121.59","172.66.164.67","TCP","66","54412  >  443 [ACK] Seq=9879 Ack=56877 Win=2047 Len=0 TSval=1457881857 TSecr=1128078510"
"226","30.913110","100.86.121.59","172.66.164.67","TLSv1.2","1104","Application Data"
"227","30.914524","100.86.121.59","172.66.164.67","TLSv1.2","197","Application Data"
"228","30.924609","172.66.164.67","100.86.121.59","TCP","66","443  >  54412 [ACK] Seq=56877 Ack=11048 Win=15 Len=0 TSval=1128078614 TSecr=1457881950"
"229","30.943845","172.66.164.67","100.86.121.59","TLSv1.2","127","Application Data"
"230","30.943849","172.66.164.67","100.86.121.59","TLSv1.2","290","Application Data"
"231","30.943927","172.66.164.67","100.86.121.59","TLSv1.2","97","Application Data"
"232","30.944019","100.86.121.59","172.66.164.67","TCP","66","54412  >  443 [ACK] Seq=11048 Ack=57162 Win=2044 Len=0 TSval=1457881981 TSecr=1128078634"
"233","30.944101","100.86.121.59","172.66.164.67","TCP","66","54412  >  443 [ACK] Seq=11048 Ack=57193 Win=2044 Len=0 TSval=1457881981 TSecr=1128078634"
"234","30.946183","100.86.121.59","172.66.164.67","TLSv1.2","101","Application Data"
"235","30.953743","172.66.164.67","100.86.121.59","TLSv1.2","127","Application Data"
"236","30.953745","172.66.164.67","100.86.121.59","TLSv1.2","290","Application Data"
"237","30.953865","100.86.121.59","172.66.164.67","TCP","66","54412  >  443 [ACK] Seq=11083 Ack=57478 Win=2044 Len=0 TSval=1457881991 TSecr=1128078644"
"238","30.954092","172.66.164.67","100.86.121.59","TLSv1.2","97","Application Data"
"239","30.954159","100.86.121.59","172.66.164.67","TCP","66","54412  >  443 [ACK] Seq=11083 Ack=57509 Win=2048 Len=0 TSval=1457881991 TSecr=1128078644"
"240","30.997934","172.66.164.67","100.86.121.59","TCP","66","443  >  54412 [ACK] Seq=57509 Ack=11083 Win=15 Len=0 TSval=1128078688 TSecr=1457881983"
"241","37.431783","100.86.121.59","172.66.164.67","TLSv1.2","345","Application Data"
"242","37.442320","172.66.164.67","100.86.121.59","TCP","66","443  >  54412 [ACK] Seq=57509 Ack=11362 Win=15 Len=0 TSval=1128085132 TSecr=1457888468"
"243","37.518709","172.66.164.67","100.86.121.59","TLSv1.2","175","Application Data"
"244","37.518711","172.66.164.67","100.86.121.59","TCP","1514","443  >  54412 [ACK] Seq=57618 Ack=11362 Win=15 Len=1448 TSval=1128085208 TSecr=1457888468 [TCP PDU reassembled in 264]"
"245","37.518786","100.86.121.59","172.66.164.67","TCP","66","54412  >  443 [ACK] Seq=11362 Ack=59066 Win=2024 Len=0 TSval=1457888555 TSecr=1128085208"
"246","37.519083","172.66.164.67","100.86.121.59","TCP","1514","443  >  54412 [ACK] Seq=59066 Ack=11362 Win=15 Len=1448 TSval=1128085208 TSecr=1457888468 [TCP PDU reassembled in 264]"
"247","37.519085","172.66.164.67","100.86.121.59","TCP","1514","443  >  54412 [PSH, ACK] Seq=60514 Ack=11362 Win=15 Len=1448 TSval=1128085208 TSecr=1457888468 [TCP PDU reassembled in 264]"
"248","37.519122","100.86.121.59","172.66.164.67","TCP","66","54412  >  443 [ACK] Seq=11362 Ack=61962 Win=2003 Len=0 TSval=1457888556 TSecr=1128085208"
"249","37.519163","100.86.121.59","172.66.164.67","TCP","66","[TCP Window Update] 54412  >  443 [ACK] Seq=11362 Ack=61962 Win=2048 Len=0 TSval=1457888556 TSecr=1128085208"
"250","37.519621","172.66.164.67","100.86.121.59","TCP","1514","443  >  54412 [ACK] Seq=61962 Ack=11362 Win=15 Len=1448 TSval=1128085209 TSecr=1457888468 [TCP PDU reassembled in 264]"
"251","37.519623","172.66.164.67","100.86.121.59","TCP","1514","443  >  54412 [ACK] Seq=63410 Ack=11362 Win=15 Len=1448 TSval=1128085209 TSecr=1457888468 [TCP PDU reassembled in 264]"
"252","37.519665","100.86.121.59","172.66.164.67","TCP","66","54412  >  443 [ACK] Seq=11362 Ack=64858 Win=2003 Len=0 TSval=1457888556 TSecr=1128085209"
"253","37.519695","100.86.121.59","172.66.164.67","TCP","66","[TCP Window Update] 54412  >  443 [ACK] Seq=11362 Ack=64858 Win=2048 Len=0 TSval=1457888556 TSecr=1128085209"
"254","37.519905","172.66.164.67","100.86.121.59","TCP","1514","443  >  54412 [PSH, ACK] Seq=64858 Ack=11362 Win=15 Len=1448 TSval=1128085209 TSecr=1457888468 [TCP PDU reassembled in 264]"
"255","37.519927","100.86.121.59","172.66.164.67","TCP","66","54412  >  443 [ACK] Seq=11362 Ack=66306 Win=2026 Len=0 TSval=1457888557 TSecr=1128085209"
"256","37.520830","172.66.164.67","100.86.121.59","TCP","1514","443  >  54412 [ACK] Seq=66306 Ack=11362 Win=15 Len=1448 TSval=1128085210 TSecr=1457888468 [TCP PDU reassembled in 264]"
"257","37.520831","172.66.164.67","100.86.121.59","TCP","1514","443  >  54412 [ACK] Seq=67754 Ack=11362 Win=15 Len=1448 TSval=1128085210 TSecr=1457888468 [TCP PDU reassembled in 264]"
"258","37.520852","100.86.121.59","172.66.164.67","TCP","66","54412  >  443 [ACK] Seq=11362 Ack=69202 Win=2003 Len=0 TSval=1457888558 TSecr=1128085210"
"259","37.520946","100.86.121.59","172.66.164.67","TCP","66","[TCP Window Update] 54412  >  443 [ACK] Seq=11362 Ack=69202 Win=2048 Len=0 TSval=1457888558 TSecr=1128085210"
"260","37.521141","172.66.164.67","100.86.121.59","TCP","1514","443  >  54412 [PSH, ACK] Seq=69202 Ack=11362 Win=15 Len=1448 TSval=1128085210 TSecr=1457888468 [TCP PDU reassembled in 264]"
"261","37.521163","100.86.121.59","172.66.164.67","TCP","66","54412  >  443 [ACK] Seq=11362 Ack=70650 Win=2026 Len=0 TSval=1457888558 TSecr=1128085210"
"262","37.521467","172.66.164.67","100.86.121.59","TCP","1514","443  >  54412 [ACK] Seq=70650 Ack=11362 Win=15 Len=1448 TSval=1128085211 TSecr=1457888468 [TCP PDU reassembled in 264]"
"263","37.521468","172.66.164.67","100.86.121.59","TCP","1514","443  >  54412 [ACK] Seq=72098 Ack=11362 Win=15 Len=1448 TSval=1128085211 TSecr=1457888468 [TCP PDU reassembled in 264]"
"264","37.521469","172.66.164.67","100.86.121.59","TLSv1.2","1514","Application Data"
"265","37.521490","100.86.121.59","172.66.164.67","TCP","66","54412  >  443 [ACK] Seq=11362 Ack=74994 Win=1981 Len=0 TSval=1457888558 TSecr=1128085211"
"266","37.521515","100.86.121.59","172.66.164.67","TCP","66","[TCP Window Update] 54412  >  443 [ACK] Seq=11362 Ack=74994 Win=2048 Len=0 TSval=1457888558 TSecr=1128085211"
"267","37.522477","172.66.164.67","100.86.121.59","TCP","1514","443  >  54412 [ACK] Seq=74994 Ack=11362 Win=15 Len=1448 TSval=1128085212 TSecr=1457888468 [TCP PDU reassembled in 273]"
"268","37.522479","172.66.164.67","100.86.121.59","TCP","1514","443  >  54412 [ACK] Seq=76442 Ack=11362 Win=15 Len=1448 TSval=1128085212 TSecr=1457888468 [TCP PDU reassembled in 273]"
"269","37.522500","100.86.121.59","172.66.164.67","TCP","66","54412  >  443 [ACK] Seq=11362 Ack=77890 Win=2003 Len=0 TSval=1457888559 TSecr=1128085212"
"270","37.522619","100.86.121.59","172.66.164.67","TCP","66","[TCP Window Update] 54412  >  443 [ACK] Seq=11362 Ack=77890 Win=2048 Len=0 TSval=1457888559 TSecr=1128085212"
"271","37.523037","172.66.164.67","100.86.121.59","TCP","1514","443  >  54412 [PSH, ACK] Seq=77890 Ack=11362 Win=15 Len=1448 TSval=1128085212 TSecr=1457888468 [TCP PDU reassembled in 273]"
"272","37.523038","172.66.164.67","100.86.121.59","TCP","1514","443  >  54412 [ACK] Seq=79338 Ack=11362 Win=15 Len=1448 TSval=1128085213 TSecr=1457888468 [TCP PDU reassembled in 273]"
"273","37.523039","172.66.164.67","100.86.121.59","TLSv1.2","118","Application Data, Application Data"
"274","37.523061","100.86.121.59","172.66.164.67","TCP","66","54412  >  443 [ACK] Seq=11362 Ack=80838 Win=2002 Len=0 TSval=1457888560 TSecr=1128085213"
"275","37.523379","100.86.121.59","172.66.164.67","TLSv1.2","101","Application Data"
"276","37.523405","100.86.121.59","172.66.164.67","TCP","66","[TCP Window Update] 54412  >  443 [ACK] Seq=11397 Ack=80838 Win=2048 Len=0 TSval=1457888560 TSecr=1128085213"
"277","37.533989","172.66.164.67","100.86.121.59","TCP","66","443  >  54412 [ACK] Seq=80838 Ack=11397 Win=15 Len=0 TSval=1128085224 TSecr=1457888560"
"278","37.556298","100.86.121.59","172.66.164.67","TLSv1.2","192","Application Data"
"279","37.575774","172.66.164.67","100.86.121.59","TCP","66","443  >  54412 [ACK] Seq=80838 Ack=11523 Win=15 Len=0 TSval=1128085259 TSecr=1457888593"
"280","37.579097","100.86.121.59","172.66.164.67","TLSv1.2","811","Application Data"
"281","37.579453","100.86.121.59","172.66.164.67","TLSv1.2","333","Application Data"
"282","37.579603","100.86.121.59","172.66.164.67","TLSv1.2","1099","Application Data"
"283","37.579687","100.86.121.59","172.66.164.67","TLSv1.2","200","Application Data"
"284","37.579759","100.86.121.59","172.66.164.67","TLSv1.2","197","Application Data"
"285","37.590483","172.66.164.67","100.86.121.59","TLSv1.2","177","Application Data"
"286","37.590484","172.66.164.67","100.86.121.59","TLSv1.2","108","Application Data"
"287","37.590485","172.66.164.67","100.86.121.59","TLSv1.2","97","Application Data"
"288","37.590544","100.86.121.59","172.66.164.67","TCP","66","54412  >  443 [ACK] Seq=13833 Ack=81022 Win=2046 Len=0 TSval=1457888627 TSecr=1128085278"
"289","37.590734","172.66.164.67","100.86.121.59","TCP","66","443  >  54412 [ACK] Seq=81022 Ack=13702 Win=15 Len=0 TSval=1128085280 TSecr=1457888616"
"290","37.608281","172.66.164.67","100.86.121.59","TLSv1.2","127","Application Data"
"291","37.608283","172.66.164.67","100.86.121.59","TLSv1.2","290","Application Data"
"292","37.608365","100.86.121.59","172.66.164.67","TCP","66","54412  >  443 [ACK] Seq=13833 Ack=81307 Win=2044 Len=0 TSval=1457888645 TSecr=1128085298"
"293","37.608383","172.66.164.67","100.86.121.59","TLSv1.2","97","Application Data"
"294","37.608415","100.86.121.59","172.66.164.67","TCP","66","54412  >  443 [ACK] Seq=13833 Ack=81338 Win=2044 Len=0 TSval=1457888645 TSecr=1128085298"
"295","37.608790","172.66.164.67","100.86.121.59","TLSv1.2","127","Application Data"
"296","37.608819","100.86.121.59","172.66.164.67","TCP","66","54412  >  443 [ACK] Seq=13833 Ack=81399 Win=2048 Len=0 TSval=1457888645 TSecr=1128085299"
"297","37.609667","172.66.164.67","100.86.121.59","TLSv1.2","290","Application Data"
"298","37.609668","172.66.164.67","100.86.121.59","TLSv1.2","97","Application Data"
"299","37.609729","100.86.121.59","172.66.164.67","TCP","66","54412  >  443 [ACK] Seq=13833 Ack=81654 Win=2045 Len=0 TSval=1457888646 TSecr=1128085299"
"300","37.610478","172.66.164.67","100.86.121.59","TLSv1.2","127","Application Data"
"301","37.610539","100.86.121.59","172.66.164.67","TCP","66","54412  >  443 [ACK] Seq=13833 Ack=81715 Win=2045 Len=0 TSval=1457888647 TSecr=1128085300"
"302","37.610623","172.66.164.67","100.86.121.59","TLSv1.2","290","Application Data"
"303","37.610655","100.86.121.59","172.66.164.67","TCP","66","54412  >  443 [ACK] Seq=13833 Ack=81939 Win=2042 Len=0 TSval=1457888647 TSecr=1128085300"
"304","37.610767","172.66.164.67","100.86.121.59","TLSv1.2","97","Application Data"
"305","37.610786","100.86.121.59","172.66.164.67","TCP","66","54412  >  443 [ACK] Seq=13833 Ack=81970 Win=2048 Len=0 TSval=1457888647 TSecr=1128085300"
"306","37.611310","172.66.164.67","100.86.121.59","TLSv1.2","127","Application Data"
"307","37.611311","172.66.164.67","100.86.121.59","TLSv1.2","290","Application Data"
"308","37.611428","172.66.164.67","100.86.121.59","TLSv1.2","97","Application Data"
"309","37.611477","100.86.121.59","172.66.164.67","TCP","66","54412  >  443 [ACK] Seq=13833 Ack=82286 Win=2048 Len=0 TSval=1457888648 TSecr=1128085301"
"310","37.613379","172.66.164.67","100.86.121.59","TLSv1.2","127","Application Data"
"311","37.613381","172.66.164.67","100.86.121.59","TLSv1.2","290","Application Data"
"312","37.613441","172.66.164.67","100.86.121.59","TLSv1.2","97","Application Data"
"313","37.613491","100.86.121.59","172.66.164.67","TCP","66","54412  >  443 [ACK] Seq=13833 Ack=82571 Win=2048 Len=0 TSval=1457888650 TSecr=1128085303"
"314","37.613616","100.86.121.59","172.66.164.67","TCP","66","54412  >  443 [ACK] Seq=13833 Ack=82602 Win=2048 Len=0 TSval=1457888650 TSecr=1128085303"
"315","42.622705","100.86.121.59","172.66.164.67","TLSv1.2","200","Application Data"
"316","42.654890","172.66.164.67","100.86.121.59","TLSv1.2","150","Application Data"
"317","42.654894","172.66.164.67","100.86.121.59","TLSv1.2","290","Application Data"
"318","42.655173","100.86.121.59","172.66.164.67","TCP","66","54412  >  443 [ACK] Seq=13967 Ack=82910 Win=2044 Len=0 TSval=1457893692 TSecr=1128090344"
"319","42.655181","172.66.164.67","100.86.121.59","TLSv1.2","97","Application Data"
"320","42.655268","100.86.121.59","172.66.164.67","TCP","66","54412  >  443 [ACK] Seq=13967 Ack=82941 Win=2044 Len=0 TSval=1457893692 TSecr=1128090344"
"321","42.656558","100.86.121.59","172.66.164.67","TLSv1.2","101","Application Data"
"322","42.707798","172.66.164.67","100.86.121.59","TCP","66","443  >  54412 [ACK] Seq=82941 Ack=14002 Win=15 Len=0 TSval=1128090398 TSecr=1457893693"
