"No.","Time","Source","Destination","Protocol","Length","Info"
"1","0.000000","100.86.121.59","172.66.164.67","TLSv1.2","195","Application Data"
"2","0.043734","172.66.164.67","100.86.121.59","TCP","66","443  >  53996 [ACK] Seq=1 Ack=130 Win=17 Len=0 TSval=1714962065 TSecr=1969053650"
"3","0.061035","172.66.164.67","100.86.121.59","TLSv1.2","150","Application Data"
"4","0.061218","100.86.121.59","172.66.164.67","TCP","66","53996  >  443 [ACK] Seq=130 Ack=85 Win=2047 Len=0 TSval=1969053711 TSecr=1714962088"
"5","0.069824","172.66.164.67","100.86.121.59","TLSv1.2","290","Application Data"
"6","0.069985","100.86.121.59","172.66.164.67","TCP","66","53996  >  443 [ACK] Seq=130 Ack=309 Win=2045 Len=0 TSval=1969053720 TSecr=1714962088"
"7","0.071732","100.86.121.59","172.66.164.67","TLSv1.2","101","Application Data"
"8","0.087671","172.66.164.67","100.86.121.59","TLSv1.2","97","Application Data"
"9","0.087867","100.86.121.59","172.66.164.67","TCP","66","53996  >  443 [ACK] Seq=165 Ack=340 Win=2048 Len=0 TSval=1969053737 TSecr=1714962088"
"10","0.146726","172.66.164.67","100.86.121.59","TCP","97","[TCP Spurious Retransmission] 443  >  53996 [PSH, ACK] Seq=309 Ack=130 Win=17 Len=31 TSval=1714962135 TSecr=1969053650"
"11","0.146959","100.86.121.59","172.66.164.67","TCP","78","[TCP Dup ACK 9#1] 53996  >  443 [ACK] Seq=165 Ack=340 Win=2048 Len=0 TSval=1969053796 TSecr=1714962135 SLE=309 SRE=340"
"12","0.254720","100.86.121.59","172.66.164.67","TCP","101","[TCP Retransmission] 53996  >  443 [PSH, ACK] Seq=130 Ack=340 Win=2048 Len=35 TSval=1969053904 TSecr=1714962135"
"13","0.291431","172.66.164.67","100.86.121.59","TCP","66","443  >  53996 [ACK] Seq=340 Ack=165 Win=17 Len=0 TSval=1714962321 TSecr=1969053737"
"14","0.378448","172.66.164.67","100.86.121.59","TCP","78","[TCP Dup ACK 13#1] 443  >  53996 [ACK] Seq=340 Ack=165 Win=17 Len=0 TSval=1714962376 TSecr=1969053904 SLE=130 SRE=165"
"15","5.331126","100.86.121.59","172.66.164.67","TCP","54","[TCP Keep-Alive] 53996  >  443 [ACK] Seq=164 Ack=340 Win=2048 Len=0"
"16","5.344528","172.66.164.67","100.86.121.59","TCP","66","[TCP Keep-Alive ACK] 443  >  53996 [ACK] Seq=340 Ack=165 Win=17 Len=0 TSval=1714967396 TSecr=1969053904"
"17","8.317835","100.86.121.59","104.20.21.102","TCP","78","54030  >  443 [SYN, ECE, CWR] Seq=0 Win=65535 Len=0 MSS=1460 WS=64 TSval=3252907461 TSecr=0 SACK_PERM"
"18","8.332190","104.20.21.102","100.86.121.59","TCP","74","443  >  54030 [SYN, ACK, ECE] Seq=0 Ack=1 Win=65535 Len=0 MSS=1400 SACK_PERM TSval=4040479683 TSecr=3252907461 WS=8192"
"19","8.332464","100.86.121.59","104.20.21.102","TCP","66","54030  >  443 [ACK] Seq=1 Ack=1 Win=131904 Len=0 TSval=3252907476 TSecr=4040479683"
"20","8.333690","100.86.121.59","104.20.21.102","TCP","1454","54030  >  443 [ACK] Seq=1 Ack=1 Win=131904 Len=1388 TSval=3252907477 TSecr=4040479683 [TCP PDU reassembled in 21]"
"21","8.333786","100.86.121.59","104.20.21.102","TLSv1.3","476","Client Hello (SNI=colonialwilliamsburg.org)"
"22","8.343669","104.20.21.102","100.86.121.59","TCP","66","443  >  54030 [ACK] Seq=1 Ack=1389 Win=131072 Len=0 TSval=4040479697 TSecr=3252907477"
"23","8.343673","104.20.21.102","100.86.121.59","TCP","66","443  >  54030 [ACK] Seq=1 Ack=1799 Win=131072 Len=0 TSval=4040479697 TSecr=3252907477"
"24","8.351551","104.20.21.102","100.86.121.59","TLSv1.3","1514","Server Hello, Change Cipher Spec"
"25","8.351554","104.20.21.102","100.86.121.59","TCP","1514","443  >  54030 [ACK] Seq=1449 Ack=1799 Win=131072 Len=1448 TSval=4040479705 TSecr=3252907477 [TCP PDU reassembled in 26]"
"26","8.351556","104.20.21.102","100.86.121.59","TLSv1.3","643","Application Data"
"27","8.351690","100.86.121.59","104.20.21.102","TCP","66","54030  >  443 [ACK] Seq=1799 Ack=3474 Win=128448 Len=0 TSval=3252907495 TSecr=4040479705"
"28","8.381232","100.86.121.59","104.20.21.102","TLSv1.3","130","Change Cipher Spec, Application Data"
"29","8.382011","100.86.121.59","172.66.164.67","TLSv1.2","344","Application Data"
"30","8.397143","172.66.164.67","100.86.121.59","TCP","66","443  >  53996 [ACK] Seq=340 Ack=443 Win=17 Len=0 TSval=1714970450 TSecr=1969062032"
"31","8.397826","104.20.21.102","100.86.121.59","TLSv1.3","578","Application Data, Application Data"
"32","8.397903","100.86.121.59","104.20.21.102","TCP","66","54030  >  443 [ACK] Seq=1863 Ack=3986 Win=130560 Len=0 TSval=3252907541 TSecr=4040479751"
"33","8.408780","172.66.164.67","100.86.121.59","TLSv1.2","176","Application Data"
"34","8.408846","100.86.121.59","172.66.164.67","TCP","66","53996  >  443 [ACK] Seq=443 Ack=450 Win=2047 Len=0 TSval=1969062058 TSecr=1714970462"
"35","8.410967","100.86.121.59","172.66.164.67","TLSv1.2","270","Application Data"
"36","8.461378","172.66.164.67","100.86.121.59","TCP","66","443  >  53996 [ACK] Seq=450 Ack=647 Win=17 Len=0 TSval=1714970515 TSecr=1969062061"
"37","8.468719","100.86.121.59","104.20.21.102","TCP","54","[TCP Keep-Alive] 54030  >  443 [ACK] Seq=1862 Ack=3986 Win=131072 Len=0"
"38","8.478651","104.20.21.102","100.86.121.59","TCP","66","[TCP Keep-Alive ACK] 443  >  54030 [ACK] Seq=3986 Ack=1863 Win=131072 Len=0 TSval=4040479832 TSecr=3252907541"
"39","8.491862","172.66.164.67","100.86.121.59","TLSv1.2","298","Application Data"
"40","8.491864","172.66.164.67","100.86.121.59","TCP","1514","443  >  53996 [ACK] Seq=682 Ack=647 Win=17 Len=1448 TSval=1714970545 TSecr=1969062061 [TCP PDU reassembled in 43]"
"41","8.491970","100.86.121.59","172.66.164.67","TCP","66","53996  >  443 [ACK] Seq=647 Ack=2130 Win=2022 Len=0 TSval=1969062142 TSecr=1714970545"
"42","8.493571","172.66.164.67","100.86.121.59","TCP","1514","443  >  53996 [ACK] Seq=2130 Ack=647 Win=17 Len=1448 TSval=1714970545 TSecr=1969062061 [TCP PDU reassembled in 43]"
"43","8.493573","172.66.164.67","100.86.121.59","TLSv1.2","1421","Application Data"
"44","8.493574","172.66.164.67","100.86.121.59","TCP","1514","443  >  53996 [ACK] Seq=4933 Ack=647 Win=17 Len=1448 TSval=1714970545 TSecr=1969062061 [TCP PDU reassembled in 46]"
"45","8.493576","172.66.164.67","100.86.121.59","TCP","1514","443  >  53996 [ACK] Seq=6381 Ack=647 Win=17 Len=1448 TSval=1714970545 TSecr=1969062061 [TCP PDU reassembled in 46]"
"46","8.493589","172.66.164.67","100.86.121.59","TLSv1.2","1421","Application Data"
"47","8.493590","172.66.164.67","100.86.121.59","TCP","1514","443  >  53996 [ACK] Seq=9184 Ack=647 Win=17 Len=1448 TSval=1714970546 TSecr=1969062061 [TCP PDU reassembled in 49]"
"48","8.493591","172.66.164.67","100.86.121.59","TCP","1514","443  >  53996 [ACK] Seq=10632 Ack=647 Win=17 Len=1448 TSval=1714970546 TSecr=1969062061 [TCP PDU reassembled in 49]"
"49","8.493593","172.66.164.67","100.86.121.59","TLSv1.2","1514","Application Data"
"50","8.493594","172.66.164.67","100.86.121.59","TCP","1514","443  >  53996 [ACK] Seq=13528 Ack=647 Win=17 Len=1448 TSval=1714970546 TSecr=1969062061 [TCP PDU reassembled in 52]"
"51","8.493595","172.66.164.67","100.86.121.59","TCP","1514","443  >  53996 [ACK] Seq=14976 Ack=647 Win=17 Len=1448 TSval=1714970546 TSecr=1969062061 [TCP PDU reassembled in 52]"
"52","8.493597","172.66.164.67","100.86.121.59","TLSv1.2","1328","Application Data"
"53","8.493599","172.66.164.67","100.86.121.59","TCP","1514","443  >  53996 [ACK] Seq=17686 Ack=647 Win=17 Len=1448 TSval=1714970546 TSecr=1969062061 [TCP PDU reassembled in 58]"
"54","8.493600","172.66.164.67","100.86.121.59","TCP","1514","443  >  53996 [ACK] Seq=19134 Ack=647 Win=17 Len=1448 TSval=1714970546 TSecr=1969062061 [TCP PDU reassembled in 58]"
"55","8.493653","100.86.121.59","172.66.164.67","TCP","66","53996  >  443 [ACK] Seq=647 Ack=17686 Win=1805 Len=0 TSval=1969062143 TSecr=1714970546"
"56","8.493673","100.86.121.59","172.66.164.67","TCP","66","53996  >  443 [ACK] Seq=647 Ack=20582 Win=1760 Len=0 TSval=1969062143 TSecr=1714970546"
"57","8.493733","100.86.121.59","172.66.164.67","TCP","66","[TCP Window Update] 53996  >  443 [ACK] Seq=647 Ack=20582 Win=2048 Len=0 TSval=1969062143 TSecr=1714970546"
"58","8.494049","172.66.164.67","100.86.121.59","TLSv1.2","1514","Application Data"
"59","8.494051","172.66.164.67","100.86.121.59","TCP","1514","443  >  53996 [ACK] Seq=22030 Ack=647 Win=17 Len=1448 TSval=1714970546 TSecr=1969062061 [TCP PDU reassembled in 63]"
"60","8.494080","100.86.121.59","172.66.164.67","TCP","66","53996  >  443 [ACK] Seq=647 Ack=23478 Win=2003 Len=0 TSval=1969062144 TSecr=1714970546"
"61","8.494104","100.86.121.59","172.66.164.67","TCP","66","[TCP Window Update] 53996  >  443 [ACK] Seq=647 Ack=23478 Win=2048 Len=0 TSval=1969062144 TSecr=1714970546"
"62","8.495256","172.66.164.67","100.86.121.59","TCP","1514","443  >  53996 [ACK] Seq=23478 Ack=647 Win=17 Len=1448 TSval=1714970546 TSecr=1969062061 [TCP PDU reassembled in 63]"
"63","8.495258","172.66.164.67","100.86.121.59","TLSv1.2","1514","Application Data"
"64","8.495259","172.66.164.67","100.86.121.59","TCP","1514","443  >  53996 [ACK] Seq=26374 Ack=647 Win=17 Len=1448 TSval=1714970546 TSecr=1969062061 [TCP PDU reassembled in 68]"
"65","8.495261","172.66.164.67","100.86.121.59","TCP","1514","443  >  53996 [PSH, ACK] Seq=27822 Ack=647 Win=17 Len=1448 TSval=1714970546 TSecr=1969062061 [TCP PDU reassembled in 68]"
"66","8.495262","172.66.164.67","100.86.121.59","TCP","1514","443  >  53996 [ACK] Seq=29270 Ack=647 Win=17 Len=1448 TSval=1714970547 TSecr=1969062061 [TCP PDU reassembled in 68]"
"67","8.495263","172.66.164.67","100.86.121.59","TCP","1514","443  >  53996 [ACK] Seq=30718 Ack=647 Win=17 Len=1448 TSval=1714970547 TSecr=1969062061 [TCP PDU reassembled in 68]"
"68","8.495264","172.66.164.67","100.86.121.59","TLSv1.2","818","Application Data, Application Data"
"69","8.495309","100.86.121.59","172.66.164.67","TCP","66","53996  >  443 [ACK] Seq=647 Ack=32918 Win=1901 Len=0 TSval=1969062145 TSecr=1714970547"
"70","8.496983","100.86.121.59","172.66.164.67","TLSv1.2","101","Application Data"
"71","8.497056","100.86.121.59","172.66.164.67","TCP","66","[TCP Window Update] 53996  >  443 [ACK] Seq=682 Ack=32918 Win=2048 Len=0 TSval=1969062147 TSecr=1714970547"
"72","8.506980","172.66.164.67","100.86.121.59","TCP","66","443  >  53996 [ACK] Seq=32918 Ack=682 Win=17 Len=0 TSval=1714970560 TSecr=1969062147"
"73","8.543896","100.86.121.59","172.66.164.67","TLSv1.2","313","Application Data"
"74","8.546334","100.86.121.59","172.66.164.67","TLSv1.2","188","Application Data"
"75","8.547125","100.86.121.59","172.66.164.67","TLSv1.2","174","Application Data"
"76","8.553726","172.66.164.67","100.86.121.59","TCP","66","443  >  53996 [ACK] Seq=32918 Ack=929 Win=17 Len=0 TSval=1714970607 TSecr=1969062194"
"77","8.556362","100.86.121.59","172.66.164.67","TLSv1.2","304","Application Data"
"78","8.556591","100.86.121.59","172.66.164.67","TLSv1.2","1345","Application Data"
"79","8.557217","172.66.164.67","100.86.121.59","TCP","66","443  >  53996 [ACK] Seq=32918 Ack=1159 Win=17 Len=0 TSval=1714970610 TSecr=1969062197"
"80","8.566056","172.66.164.67","100.86.121.59","TCP","66","443  >  53996 [ACK] Seq=32918 Ack=1397 Win=17 Len=0 TSval=1714970619 TSecr=1969062206"
"81","8.566627","172.66.164.67","100.86.121.59","TCP","66","443  >  53996 [ACK] Seq=32918 Ack=2676 Win=17 Len=0 TSval=1714970620 TSecr=1969062206"
"82","8.567020","172.66.164.67","100.86.121.59","TLSv1.2","356","Application Data"
"83","8.567022","172.66.164.67","100.86.121.59","TLSv1.2","401","Application Data"
"84","8.567103","100.86.121.59","172.66.164.67","TCP","66","53996  >  443 [ACK] Seq=2676 Ack=33543 Win=2039 Len=0 TSval=1969062217 TSecr=1714970620"
"85","8.567152","172.66.164.67","100.86.121.59","TLSv1.2","97","Application Data"
"86","8.567207","100.86.121.59","172.66.164.67","TCP","66","53996  >  443 [ACK] Seq=2676 Ack=33574 Win=2048 Len=0 TSval=1969062217 TSecr=1714970620"
"87","8.572183","172.66.164.67","100.86.121.59","TLSv1.2","237","Application Data"
"88","8.572185","172.66.164.67","100.86.121.59","TLSv1.2","576","Application Data"
"89","8.572265","100.86.121.59","172.66.164.67","TCP","66","53996  >  443 [ACK] Seq=2676 Ack=34255 Win=2038 Len=0 TSval=1969062222 TSecr=1714970625"
"90","8.572470","172.66.164.67","100.86.121.59","TLSv1.2","97","Application Data"
"91","8.572504","100.86.121.59","172.66.164.67","TCP","66","53996  >  443 [ACK] Seq=2676 Ack=34286 Win=2048 Len=0 TSval=1969062222 TSecr=1714970625"
"92","8.573558","172.66.164.67","100.86.121.59","TLSv1.2","261","Application Data"
"93","8.573560","172.66.164.67","100.86.121.59","TLSv1.2","952","Application Data"
"94","8.573562","172.66.164.67","100.86.121.59","TLSv1.2","97","Application Data"
"95","8.573613","100.86.121.59","172.66.164.67","TCP","66","53996  >  443 [ACK] Seq=2676 Ack=35398 Win=2031 Len=0 TSval=1969062223 TSecr=1714970626"
"96","8.581757","172.66.164.67","100.86.121.59","TLSv1.2","249","Application Data"
"97","8.581758","172.66.164.67","100.86.121.59","TLSv1.2","439","Application Data"
"98","8.581759","172.66.164.67","100.86.121.59","TLSv1.2","97","Application Data"
"99","8.581836","100.86.121.59","172.66.164.67","TCP","66","53996  >  443 [ACK] Seq=2676 Ack=35985 Win=2039 Len=0 TSval=1969062231 TSecr=1714970635"
"100","8.582738","100.86.121.59","172.66.164.67","TLSv1.2","167","Application Data"
"101","8.611780","172.66.164.67","100.86.121.59","TLSv1.2","266","Application Data"
"102","8.611838","100.86.121.59","172.66.164.67","TCP","66","53996  >  443 [ACK] Seq=2777 Ack=36185 Win=2045 Len=0 TSval=1969062261 TSecr=1714970665"
"103","8.611979","172.66.164.67","100.86.121.59","TLSv1.2","108","Application Data"
"104","8.611981","172.66.164.67","100.86.121.59","TLSv1.2","97","Application Data"
"105","8.612019","100.86.121.59","172.66.164.67","TCP","66","53996  >  443 [ACK] Seq=2777 Ack=36258 Win=2047 Len=0 TSval=1969062262 TSecr=1714970665"
"106","8.616448","100.86.121.59","172.66.164.67","TLSv1.2","422","Application Data"
"107","8.617545","100.86.121.59","172.66.164.67","TLSv1.2","197","Application Data"
"108","8.618240","100.86.121.59","172.66.164.67","TLSv1.2","200","Application Data"
"109","8.618339","100.86.121.59","172.66.164.67","TLSv1.2","311","Application Data"
"110","8.618414","100.86.121.59","172.66.164.67","TLSv1.2","327","Application Data"
"111","8.628174","172.66.164.67","100.86.121.59","TCP","66","443  >  53996 [ACK] Seq=36258 Ack=3904 Win=17 Len=0 TSval=1714970682 TSecr=1969062266"
"112","8.646182","172.66.164.67","100.86.121.59","TLSv1.2","163","Application Data"
"113","8.646183","172.66.164.67","100.86.121.59","TLSv1.2","290","Application Data"
"114","8.646241","100.86.121.59","172.66.164.67","TCP","66","53996  >  443 [ACK] Seq=3904 Ack=36579 Win=2043 Len=0 TSval=1969062296 TSecr=1714970700"
"115","8.646324","172.66.164.67","100.86.121.59","TLSv1.2","97","Application Data"
"116","8.646371","100.86.121.59","172.66.164.67","TCP","66","53996  >  443 [ACK] Seq=3904 Ack=36610 Win=2048 Len=0 TSval=1969062296 TSecr=1714970700"
"117","8.648003","172.66.164.67","100.86.121.59","TLSv1.2","127","Application Data"
"118","8.648103","172.66.164.67","100.86.121.59","TLSv1.2","290","Application Data"
"119","8.648223","172.66.164.67","100.86.121.59","TLSv1.2","97","Application Data"
"120","8.648257","100.86.121.59","172.66.164.67","TCP","66","53996  >  443 [ACK] Seq=3904 Ack=36895 Win=2048 Len=0 TSval=1969062298 TSecr=1714970702"
"121","8.648383","100.86.121.59","172.66.164.67","TCP","66","53996  >  443 [ACK] Seq=3904 Ack=36926 Win=2048 Len=0 TSval=1969062298 TSecr=1714970702"
"122","8.652458","172.66.164.67","100.86.121.59","TLSv1.2","127","Application Data"
"123","8.652459","172.66.164.67","100.86.121.59","TLSv1.2","290","Application Data"
"124","8.652461","172.66.164.67","100.86.121.59","TLSv1.2","97","Application Data"
"125","8.652464","172.66.164.67","100.86.121.59","TLSv1.2","127","Application Data"
"126","8.652465","172.66.164.67","100.86.121.59","TLSv1.2","290","Application Data"
"127","8.652466","172.66.164.67","100.86.121.59","TLSv1.2","97","Application Data"
"128","8.652467","172.66.164.67","100.86.121.59","TLSv1.2","127","Application Data"
"129","8.652468","172.66.164.67","100.86.121.59","TLSv1.2","290","Application Data"
"130","8.652469","172.66.164.67","100.86.121.59","TLSv1.2","97","Application Data"
"131","8.653102","100.86.121.59","172.66.164.67","TCP","66","53996  >  443 [ACK] Seq=3904 Ack=37874 Win=2048 Len=0 TSval=1969062303 TSecr=1714970705"
"132","8.775517","172.66.164.67","100.86.121.59","TLSv1.2","171","Application Data"
"133","8.775518","172.66.164.67","100.86.121.59","TCP","1514","443  >  53996 [ACK] Seq=37979 Ack=3904 Win=17 Len=1448 TSval=1714970827 TSecr=1969062303 [TCP PDU reassembled in 146]"
"134","8.775519","172.66.164.67","100.86.121.59","TCP","1514","443  >  53996 [ACK] Seq=39427 Ack=3904 Win=17 Len=1448 TSval=1714970827 TSecr=1969062303 [TCP PDU reassembled in 146]"
"135","8.775520","172.66.164.67","100.86.121.59","TCP","1514","443  >  53996 [ACK] Seq=40875 Ack=3904 Win=17 Len=1448 TSval=1714970827 TSecr=1969062303 [TCP PDU reassembled in 146]"
"136","8.775635","100.86.121.59","172.66.164.67","TCP","66","53996  >  443 [ACK] Seq=3904 Ack=42323 Win=1979 Len=0 TSval=1969062425 TSecr=1714970827"
"137","8.775987","100.86.121.59","172.66.164.67","TCP","66","[TCP Window Update] 53996  >  443 [ACK] Seq=3904 Ack=42323 Win=2048 Len=0 TSval=1969062426 TSecr=1714970827"
"138","8.776751","172.66.164.67","100.86.121.59","TCP","1514","443  >  53996 [ACK] Seq=42323 Ack=3904 Win=17 Len=1448 TSval=1714970827 TSecr=1969062303 [TCP PDU reassembled in 146]"
"139","8.776752","172.66.164.67","100.86.121.59","TCP","1514","443  >  53996 [ACK] Seq=43771 Ack=3904 Win=17 Len=1448 TSval=1714970827 TSecr=1969062303 [TCP PDU reassembled in 146]"
"140","8.776753","172.66.164.67","100.86.121.59","TCP","1514","443  >  53996 [ACK] Seq=45219 Ack=3904 Win=17 Len=1448 TSval=1714970827 TSecr=1969062303 [TCP PDU reassembled in 146]"
"141","8.776755","172.66.164.67","100.86.121.59","TCP","1514","443  >  53996 [ACK] Seq=46667 Ack=3904 Win=17 Len=1448 TSval=1714970827 TSecr=1969062303 [TCP PDU reassembled in 146]"
"142","8.776756","172.66.164.67","100.86.121.59","TCP","1514","443  >  53996 [PSH, ACK] Seq=48115 Ack=3904 Win=17 Len=1448 TSval=1714970827 TSecr=1969062303 [TCP PDU reassembled in 146]"
"143","8.776757","172.66.164.67","100.86.121.59","TCP","1514","443  >  53996 [ACK] Seq=49563 Ack=3904 Win=17 Len=1448 TSval=1714970828 TSecr=1969062303 [TCP PDU reassembled in 146]"
"144","8.776758","172.66.164.67","100.86.121.59","TCP","1514","443  >  53996 [ACK] Seq=51011 Ack=3904 Win=17 Len=1448 TSval=1714970828 TSecr=1969062303 [TCP PDU reassembled in 146]"
"145","8.776760","172.66.164.67","100.86.121.59","TCP","1514","443  >  53996 [ACK] Seq=52459 Ack=3904 Win=17 Len=1448 TSval=1714970828 TSecr=1969062303 [TCP PDU reassembled in 146]"
"146","8.776761","172.66.164.67","100.86.121.59","TLSv1.2","1514","Application Data"
"147","8.776762","172.66.164.67","100.86.121.59","TCP","1514","443  >  53996 [ACK] Seq=55355 Ack=3904 Win=17 Len=1448 TSval=1714970828 TSecr=1969062303 [TCP PDU reassembled in 149]"
"148","8.776764","172.66.164.67","100.86.121.59","TCP","1514","443  >  53996 [ACK] Seq=56803 Ack=3904 Win=17 Len=1448 TSval=1714970828 TSecr=1969062303 [TCP PDU reassembled in 149]"
"149","8.776765","172.66.164.67","100.86.121.59","TLSv1.2","1081","Application Data"
"150","8.776767","172.66.164.67","100.86.121.59","TLSv1.2","97","Application Data"
"151","8.776838","100.86.121.59","172.66.164.67","TCP","66","53996  >  443 [ACK] Seq=3904 Ack=58251 Win=1800 Len=0 TSval=1969062426 TSecr=1714970828"
"152","8.777075","100.86.121.59","172.66.164.67","TCP","66","53996  >  443 [ACK] Seq=3904 Ack=59297 Win=2048 Len=0 TSval=1969062427 TSecr=1714970829"
"153","9.134396","100.86.121.59","172.66.164.67","TCP","54","[TCP Keep-Alive] 53996  >  443 [ACK] Seq=3903 Ack=59297 Win=2048 Len=0"
"154","9.144619","172.66.164.67","100.86.121.59","TCP","66","[TCP Keep-Alive ACK] 443  >  53996 [ACK] Seq=59297 Ack=3904 Win=17 Len=0 TSval=1714971198 TSecr=1969062427"
"155","11.783774","100.86.121.59","172.66.164.67","TLSv1.2","724","Application Data"
"156","11.895935","172.66.164.67","100.86.121.59","TCP","66","443  >  53996 [ACK] Seq=59297 Ack=4562 Win=17 Len=0 TSval=1714973924 TSecr=1969065433"
"157","12.861772","172.66.164.67","100.86.121.59","TLSv1.2","190","Application Data"
"158","12.861775","172.66.164.67","100.86.121.59","TCP","1514","443  >  53996 [ACK] Seq=59421 Ack=4562 Win=17 Len=1448 TSval=1714974868 TSecr=1969065433 [TCP PDU reassembled in 172]"
"159","12.861972","100.86.121.59","172.66.164.67","TCP","66","53996  >  443 [ACK] Seq=4562 Ack=60869 Win=2024 Len=0 TSval=1969066511 TSecr=1714974868"
"160","12.862445","172.66.164.67","100.86.121.59","TCP","1514","443  >  53996 [ACK] Seq=60869 Ack=4562 Win=17 Len=1448 TSval=1714974868 TSecr=1969065433 [TCP PDU reassembled in 172]"
"161","12.862448","172.66.164.67","100.86.121.59","TCP","1514","443  >  53996 [ACK] Seq=62317 Ack=4562 Win=17 Len=1448 TSval=1714974868 TSecr=1969065433 [TCP PDU reassembled in 172]"
"162","12.862541","100.86.121.59","172.66.164.67","TCP","66","53996  >  443 [ACK] Seq=4562 Ack=63765 Win=2003 Len=0 TSval=1969066512 TSecr=1714974868"
"163","12.862670","100.86.121.59","172.66.164.67","TCP","66","[TCP Window Update] 53996  >  443 [ACK] Seq=4562 Ack=63765 Win=2048 Len=0 TSval=1969066512 TSecr=1714974868"
"164","12.863647","172.66.164.67","100.86.121.59","TCP","1514","443  >  53996 [ACK] Seq=63765 Ack=4562 Win=17 Len=1448 TSval=1714974868 TSecr=1969065433 [TCP PDU reassembled in 172]"
"165","12.863652","172.66.164.67","100.86.121.59","TCP","1514","443  >  53996 [ACK] Seq=65213 Ack=4562 Win=17 Len=1448 TSval=1714974868 TSecr=1969065433 [TCP PDU reassembled in 172]"
"166","12.863654","172.66.164.67","100.86.121.59","TCP","1514","443  >  53996 [ACK] Seq=66661 Ack=4562 Win=17 Len=1448 TSval=1714974868 TSecr=1969065433 [TCP PDU reassembled in 172]"
"167","12.863657","172.66.164.67","100.86.121.59","TCP","1514","443  >  53996 [ACK] Seq=68109 Ack=4562 Win=17 Len=1448 TSval=1714974868 TSecr=1969065433 [TCP PDU reassembled in 172]"
"168","12.863660","172.66.164.67","100.86.121.59","TCP","1514","443  >  53996 [PSH, ACK] Seq=69557 Ack=4562 Win=17 Len=1448 TSval=1714974868 TSecr=1969065433 [TCP PDU reassembled in 172]"
"169","12.863663","172.66.164.67","100.86.121.59","TCP","1514","443  >  53996 [ACK] Seq=71005 Ack=4562 Win=17 Len=1448 TSval=1714974869 TSecr=1969065433 [TCP PDU reassembled in 172]"
"170","12.863665","172.66.164.67","100.86.121.59","TCP","1514","443  >  53996 [ACK] Seq=72453 Ack=4562 Win=17 Len=1448 TSval=1714974869 TSecr=1969065433 [TCP PDU reassembled in 172]"
"171","12.863667","172.66.164.67","100.86.121.59","TCP","1514","443  >  53996 [ACK] Seq=73901 Ack=4562 Win=17 Len=1448 TSval=1714974869 TSecr=1969065433 [TCP PDU reassembled in 172]"
"172","12.863670","172.66.164.67","100.86.121.59","TLSv1.2","1514","Application Data"
"173","12.863672","172.66.164.67","100.86.121.59","TCP","1514","443  >  53996 [ACK] Seq=76797 Ack=4562 Win=17 Len=1448 TSval=1714974869 TSecr=1969065433 [TCP PDU reassembled in 183]"
"174","12.863675","172.66.164.67","100.86.121.59","TCP","1514","443  >  53996 [ACK] Seq=78245 Ack=4562 Win=17 Len=1448 TSval=1714974869 TSecr=1969065433 [TCP PDU reassembled in 183]"
"175","12.863677","172.66.164.67","100.86.121.59","TCP","1514","443  >  53996 [ACK] Seq=79693 Ack=4562 Win=17 Len=1448 TSval=1714974869 TSecr=1969065433 [TCP PDU reassembled in 183]"
"176","12.863679","172.66.164.67","100.86.121.59","TCP","1514","443  >  53996 [PSH, ACK] Seq=81141 Ack=4562 Win=17 Len=1448 TSval=1714974869 TSecr=1969065433 [TCP PDU reassembled in 183]"
"177","12.863682","172.66.164.67","100.86.121.59","TCP","1514","443  >  53996 [ACK] Seq=82589 Ack=4562 Win=17 Len=1448 TSval=1714974870 TSecr=1969065433 [TCP PDU reassembled in 183]"
"178","12.863685","172.66.164.67","100.86.121.59","TCP","1514","443  >  53996 [ACK] Seq=84037 Ack=4562 Win=17 Len=1448 TSval=1714974870 TSecr=1969065433 [TCP PDU reassembled in 183]"
"179","12.863687","172.66.164.67","100.86.121.59","TCP","1514","443  >  53996 [ACK] Seq=85485 Ack=4562 Win=17 Len=1448 TSval=1714974870 TSecr=1969065433 [TCP PDU reassembled in 183]"
"180","12.863690","172.66.164.67","100.86.121.59","TCP","1514","443  >  53996 [ACK] Seq=86933 Ack=4562 Win=17 Len=1448 TSval=1714974870 TSecr=1969065433 [TCP PDU reassembled in 183]"
"181","12.863692","172.66.164.67","100.86.121.59","TCP","1514","443  >  53996 [ACK] Seq=88381 Ack=4562 Win=17 Len=1448 TSval=1714974870 TSecr=1969065433 [TCP PDU reassembled in 183]"
"182","12.863695","172.66.164.67","100.86.121.59","TCP","1514","443  >  53996 [ACK] Seq=89829 Ack=4562 Win=17 Len=1448 TSval=1714974870 TSecr=1969065433 [TCP PDU reassembled in 183]"
"183","12.863698","172.66.164.67","100.86.121.59","TLSv1.2","167","Application Data"
"184","12.863701","172.66.164.67","100.86.121.59","TLSv1.2","97","Application Data"
"185","12.863875","100.86.121.59","172.66.164.67","TCP","66","53996  >  443 [ACK] Seq=4562 Ack=79693 Win=1800 Len=0 TSval=1969066513 TSecr=1714974869"
"186","12.863921","100.86.121.59","172.66.164.67","TCP","66","53996  >  443 [ACK] Seq=4562 Ack=91409 Win=1617 Len=0 TSval=1969066513 TSecr=1714974871"
"187","12.864397","100.86.121.59","172.66.164.67","TCP","66","[TCP Window Update] 53996  >  443 [ACK] Seq=4562 Ack=91409 Win=2048 Len=0 TSval=1969066514 TSecr=1714974871"
"188","12.886741","172.66.164.67","100.86.121.59","TCP","97","[TCP Spurious Retransmission] 443  >  53996 [PSH, ACK] Seq=91378 Ack=4562 Win=17 Len=31 TSval=1714974902 TSecr=1969065433"
"189","12.886804","100.86.121.59","172.66.164.67","TCP","78","[TCP Dup ACK 186#1] 53996  >  443 [ACK] Seq=4562 Ack=91409 Win=2048 Len=0 TSval=1969066536 TSecr=1714974902 SLE=91378 SRE=91409"
"190","12.926354","100.86.121.59","172.66.164.67","TLSv1.2","1019","Application Data"
"191","13.013614","172.66.164.67","100.86.121.59","TCP","66","443  >  53996 [ACK] Seq=91409 Ack=5515 Win=17 Len=0 TSval=1714975023 TSecr=1969066576"
"192","13.034313","172.66.164.67","100.86.121.59","TLSv1.2","245","Application Data"
"193","13.034315","172.66.164.67","100.86.121.59","TLSv1.2","864","Application Data"
"194","13.034317","172.66.164.67","100.86.121.59","TLSv1.2","97","Application Data"
"195","13.034442","100.86.121.59","172.66.164.67","TCP","66","53996  >  443 [ACK] Seq=5515 Ack=92417 Win=2033 Len=0 TSval=1969066684 TSecr=1714975041"
"196","13.037847","100.86.121.59","172.66.164.67","TLSv1.2","167","Application Data"
"197","13.061166","100.86.121.59","172.66.164.67","TLSv1.2","411","Application Data"
"198","13.061596","100.86.121.59","172.66.164.67","TLSv1.2","310","Application Data"
"199","13.061689","100.86.121.59","172.66.164.67","TLSv1.2","302","Application Data"
"200","13.061814","100.86.121.59","172.66.164.67","TLSv1.2","218","Application Data"
"201","13.061886","100.86.121.59","172.66.164.67","TLSv1.2","197","Application Data"
"202","13.113363","172.66.164.67","100.86.121.59","TCP","97","[TCP Spurious Retransmission] 443  >  53996 [PSH, ACK] Seq=92386 Ack=5515 Win=17 Len=31 TSval=1714975120 TSecr=1969066576"
"203","13.113487","100.86.121.59","172.66.164.67","TCP","78","[TCP Dup ACK 195#1] 53996  >  443 [ACK] Seq=6724 Ack=92417 Win=2048 Len=0 TSval=1969066763 TSecr=1714975120 SLE=92386 SRE=92417"
"204","13.137967","172.66.164.67","100.86.121.59","TCP","66","443  >  53996 [ACK] Seq=92417 Ack=5961 Win=17 Len=0 TSval=1714975149 TSecr=1969066687"
"205","13.163185","172.66.164.67","100.86.121.59","TLSv1.2","216","Application Data"
"206","13.163187","172.66.164.67","100.86.121.59","TLSv1.2","290","Application Data"
"207","13.163188","172.66.164.67","100.86.121.59","TLSv1.2","97","Application Data"
"208","13.163196","172.66.164.67","100.86.121.59","TLSv1.2","128","Application Data"
"209","13.163197","172.66.164.67","100.86.121.59","TLSv1.2","108","Application Data"
"210","13.163198","172.66.164.67","100.86.121.59","TLSv1.2","97","Application Data"
"211","13.163426","100.86.121.59","172.66.164.67","TCP","66","53996  >  443 [ACK] Seq=6724 Ack=92957 Win=2040 Len=0 TSval=1969066813 TSecr=1714975183"
"212","13.196774","172.66.164.67","100.86.121.59","TLSv1.2","127","Application Data"
"213","13.196909","100.86.121.59","172.66.164.67","TCP","66","53996  >  443 [ACK] Seq=6724 Ack=93018 Win=2048 Len=0 TSval=1969066846 TSecr=1714975193"
"214","13.198055","172.66.164.67","100.86.121.59","TLSv1.2","290","Application Data"
"215","13.198056","172.66.164.67","100.86.121.59","TLSv1.2","97","Application Data"
"216","13.198058","172.66.164.67","100.86.121.59","TLSv1.2","127","Application Data"
"217","13.198059","172.66.164.67","100.86.121.59","TLSv1.2","290","Application Data"
"218","13.198060","172.66.164.67","100.86.121.59","TLSv1.2","97","Application Data"
"219","13.198061","172.66.164.67","100.86.121.59","TLSv1.2","127","Application Data"
"220","13.198062","172.66.164.67","100.86.121.59","TLSv1.2","290","Application Data"
"221","13.198063","172.66.164.67","100.86.121.59","TLSv1.2","97","Application Data"
"222","13.198064","172.66.164.67","100.86.121.59","TLSv1.2","127","Application Data"
"223","13.198133","100.86.121.59","172.66.164.67","TCP","66","53996  >  443 [ACK] Seq=6724 Ack=93966 Win=2034 Len=0 TSval=1969066848 TSecr=1714975198"
"224","13.199021","172.66.164.67","100.86.121.59","TLSv1.2","290","Application Data"
"225","13.199022","172.66.164.67","100.86.121.59","TLSv1.2","97","Application Data"
"226","13.199139","100.86.121.59","172.66.164.67","TCP","66","53996  >  443 [ACK] Seq=6724 Ack=94221 Win=2045 Len=0 TSval=1969066849 TSecr=1714975198"
"227","13.300548","172.66.164.67","100.86.121.59","TCP","97","[TCP Spurious Retransmission] 443  >  53996 [PSH, ACK] Seq=94190 Ack=6724 Win=17 Len=31 TSval=1714975295 TSecr=1969066763"
"228","13.300710","100.86.121.59","172.66.164.67","TCP","78","[TCP Dup ACK 226#1] 53996  >  443 [ACK] Seq=6724 Ack=94221 Win=2048 Len=0 TSval=1969066950 TSecr=1714975295 SLE=94190 SRE=94221"
"229","15.003945","100.86.121.59","172.66.164.67","TLSv1.2","811","Application Data"
"230","15.040112","172.66.164.67","100.86.121.59","TLSv1.2","150","Application Data"
"231","15.040114","172.66.164.67","100.86.121.59","TLSv1.2","290","Application Data"
"232","15.040225","100.86.121.59","172.66.164.67","TCP","66","53996  >  443 [ACK] Seq=7469 Ack=94529 Win=2044 Len=0 TSval=1969068690 TSecr=1714977092"
"233","15.040787","172.66.164.67","100.86.121.59","TLSv1.2","97","Application Data"
"234","15.040835","100.86.121.59","172.66.164.67","TCP","66","53996  >  443 [ACK] Seq=7469 Ack=94560 Win=2048 Len=0 TSval=1969068690 TSecr=1714977092"
"235","15.040908","100.86.121.59","172.66.164.67","TLSv1.2","101","Application Data"
"236","15.106495","172.66.164.67","100.86.121.59","TCP","66","443  >  53996 [ACK] Seq=94560 Ack=7504 Win=17 Len=0 TSval=1714977159 TSecr=1969068690"
"237","18.204866","100.86.121.59","172.66.164.67","TLSv1.2","1028","Application Data"
"238","18.205252","100.86.121.59","172.66.164.67","TLSv1.2","439","Application Data"
"239","18.214576","172.66.164.67","100.86.121.59","TCP","66","443  >  53996 [ACK] Seq=94560 Ack=8466 Win=17 Len=0 TSval=1714980268 TSecr=1969071854"
"240","18.215325","172.66.164.67","100.86.121.59","TCP","66","443  >  53996 [ACK] Seq=94560 Ack=8839 Win=17 Len=0 TSval=1714980269 TSecr=1969071855"
"241","18.240689","172.66.164.67","100.86.121.59","TLSv1.2","150","Application Data"
"242","18.240694","172.66.164.67","100.86.121.59","TLSv1.2","290","Application Data"
"243","18.240884","100.86.121.59","172.66.164.67","TCP","66","53996  >  443 [ACK] Seq=8839 Ack=94868 Win=2044 Len=0 TSval=1969071890 TSecr=1714980294"
"244","18.241180","172.66.164.67","100.86.121.59","TLSv1.2","97","Application Data"
"245","18.241182","172.66.164.67","100.86.121.59","TLSv1.2","208","Application Data"
"246","18.241274","100.86.121.59","172.66.164.67","TCP","66","53996  >  443 [ACK] Seq=8839 Ack=95041 Win=2046 Len=0 TSval=1969071891 TSecr=1714980294"
"247","18.241561","172.66.164.67","100.86.121.59","TLSv1.2","290","Application Data"
"248","18.241576","172.66.164.67","100.86.121.59","TLSv1.2","97","Application Data"
"249","18.241643","100.86.121.59","172.66.164.67","TCP","66","53996  >  443 [ACK] Seq=8839 Ack=95296 Win=2045 Len=0 TSval=1969071891 TSecr=1714980294"
"250","19.023252","100.86.121.59","172.66.164.67","TLSv1.2","473","Application Data"
"251","19.074480","172.66.164.67","100.86.121.59","TCP","66","443  >  53996 [ACK] Seq=95296 Ack=9246 Win=17 Len=0 TSval=1714981128 TSecr=1969072673"
"252","20.008299","100.86.121.59","172.66.164.67","TLSv1.2","892","Application Data"
"253","20.020319","172.66.164.67","100.86.121.59","TCP","66","443  >  53996 [ACK] Seq=95296 Ack=10072 Win=17 Len=0 TSval=1714982073 TSecr=1969073658"
"254","20.044039","172.66.164.67","100.86.121.59","TLSv1.2","150","Application Data"
"255","20.044242","100.86.121.59","172.66.164.67","TCP","66","53996  >  443 [ACK] Seq=10072 Ack=95380 Win=2047 Len=0 TSval=1969073694 TSecr=1714982097"
"256","20.044410","172.66.164.67","100.86.121.59","TLSv1.2","290","Application Data"
"257","20.044412","172.66.164.67","100.86.121.59","TLSv1.2","97","Application Data"
"258","20.044496","100.86.121.59","172.66.164.67","TCP","66","53996  >  443 [ACK] Seq=10072 Ack=95635 Win=2045 Len=0 TSval=1969073694 TSecr=1714982098"
"259","20.046106","100.86.121.59","172.66.164.67","TLSv1.2","101","Application Data"
"260","20.096376","172.66.164.67","100.86.121.59","TCP","66","443  >  53996 [ACK] Seq=95635 Ack=10107 Win=17 Len=0 TSval=1714982150 TSecr=1969073696"
"261","20.531618","172.66.164.67","100.86.121.59","TLSv1.2","186","Application Data"
"262","20.531625","172.66.164.67","100.86.121.59","TCP","1514","443  >  53996 [ACK] Seq=95755 Ack=10107 Win=17 Len=1448 TSval=1714982570 TSecr=1969073696 [TCP PDU reassembled in 276]"
"263","20.531629","172.66.164.67","100.86.121.59","TCP","1514","443  >  53996 [ACK] Seq=97203 Ack=10107 Win=17 Len=1448 TSval=1714982570 TSecr=1969073696 [TCP PDU reassembled in 276]"
"264","20.531633","172.66.164.67","100.86.121.59","TCP","1514","443  >  53996 [ACK] Seq=98651 Ack=10107 Win=17 Len=1448 TSval=1714982570 TSecr=1969073696 [TCP PDU reassembled in 276]"
"265","20.531636","172.66.164.67","100.86.121.59","TCP","1514","443  >  53996 [ACK] Seq=100099 Ack=10107 Win=17 Len=1448 TSval=1714982570 TSecr=1969073696 [TCP PDU reassembled in 276]"
"266","20.531639","172.66.164.67","100.86.121.59","TCP","1514","443  >  53996 [ACK] Seq=101547 Ack=10107 Win=17 Len=1448 TSval=1714982570 TSecr=1969073696 [TCP PDU reassembled in 276]"
"267","20.531642","172.66.164.67","100.86.121.59","TCP","1514","443  >  53996 [ACK] Seq=102995 Ack=10107 Win=17 Len=1448 TSval=1714982570 TSecr=1969073696 [TCP PDU reassembled in 276]"
"268","20.531645","172.66.164.67","100.86.121.59","TCP","1514","443  >  53996 [ACK] Seq=104443 Ack=10107 Win=17 Len=1448 TSval=1714982570 TSecr=1969073696 [TCP PDU reassembled in 276]"
"269","20.531648","172.66.164.67","100.86.121.59","TCP","1514","443  >  53996 [PSH, ACK] Seq=105891 Ack=10107 Win=17 Len=1448 TSval=1714982570 TSecr=1969073696 [TCP PDU reassembled in 276]"
"270","20.531652","172.66.164.67","100.86.121.59","TCP","1514","443  >  53996 [ACK] Seq=107339 Ack=10107 Win=17 Len=1448 TSval=1714982571 TSecr=1969073696 [TCP PDU reassembled in 276]"
"271","20.531743","172.66.164.67","100.86.121.59","TCP","1514","443  >  53996 [ACK] Seq=108787 Ack=10107 Win=17 Len=1448 TSval=1714982571 TSecr=1969073696 [TCP PDU reassembled in 276]"
"272","20.531746","172.66.164.67","100.86.121.59","TCP","1514","443  >  53996 [ACK] Seq=110235 Ack=10107 Win=17 Len=1448 TSval=1714982571 TSecr=1969073696 [TCP PDU reassembled in 276]"
"273","20.531939","100.86.121.59","172.66.164.67","TCP","66","53996  >  443 [ACK] Seq=10107 Ack=108787 Win=1843 Len=0 TSval=1969074181 TSecr=1714982571"
"274","20.532047","100.86.121.59","172.66.164.67","TCP","66","53996  >  443 [ACK] Seq=10107 Ack=111683 Win=1798 Len=0 TSval=1969074182 TSecr=1714982571"
"275","20.532147","100.86.121.59","172.66.164.67","TCP","66","[TCP Window Update] 53996  >  443 [ACK] Seq=10107 Ack=111683 Win=2048 Len=0 TSval=1969074182 TSecr=1714982571"
"276","20.533326","172.66.164.67","100.86.121.59","TLSv1.2","544","Application Data"
"277","20.533329","172.66.164.67","100.86.121.59","TCP","1514","443  >  53996 [ACK] Seq=112161 Ack=10107 Win=17 Len=1448 TSval=1714982571 TSecr=1969073696 [TCP PDU reassembled in 285]"
"278","20.533332","172.66.164.67","100.86.121.59","TCP","1514","443  >  53996 [ACK] Seq=113609 Ack=10107 Win=17 Len=1448 TSval=1714982571 TSecr=1969073696 [TCP PDU reassembled in 285]"
"279","20.533336","172.66.164.67","100.86.121.59","TCP","1514","443  >  53996 [ACK] Seq=115057 Ack=10107 Win=17 Len=1448 TSval=1714982571 TSecr=1969073696 [TCP PDU reassembled in 285]"
"280","20.533339","172.66.164.67","100.86.121.59","TCP","1514","443  >  53996 [ACK] Seq=116505 Ack=10107 Win=17 Len=1448 TSval=1714982571 TSecr=1969073696 [TCP PDU reassembled in 285]"
"281","20.533342","172.66.164.67","100.86.121.59","TCP","1514","443  >  53996 [ACK] Seq=117953 Ack=10107 Win=17 Len=1448 TSval=1714982571 TSecr=1969073696 [TCP PDU reassembled in 285]"
"282","20.533346","172.66.164.67","100.86.121.59","TCP","1514","443  >  53996 [ACK] Seq=119401 Ack=10107 Win=17 Len=1448 TSval=1714982571 TSecr=1969073696 [TCP PDU reassembled in 285]"
"283","20.533349","172.66.164.67","100.86.121.59","TCP","1514","443  >  53996 [ACK] Seq=120849 Ack=10107 Win=17 Len=1448 TSval=1714982571 TSecr=1969073696 [TCP PDU reassembled in 285]"
"284","20.533352","172.66.164.67","100.86.121.59","TCP","1514","443  >  53996 [PSH, ACK] Seq=122297 Ack=10107 Win=17 Len=1448 TSval=1714982571 TSecr=1969073696 [TCP PDU reassembled in 285]"
"285","20.533355","172.66.164.67","100.86.121.59","TLSv1.2","1391","Application Data, Application Data"
"286","20.533465","100.86.121.59","172.66.164.67","TCP","66","53996  >  443 [ACK] Seq=10107 Ack=125070 Win=1839 Len=0 TSval=1969074183 TSecr=1714982572"
"287","20.533539","100.86.121.59","172.66.164.67","TCP","66","[TCP Window Update] 53996  >  443 [ACK] Seq=10107 Ack=125070 Win=2048 Len=0 TSval=1969074183 TSecr=1714982572"
"288","20.648716","100.86.121.59","172.66.164.67","TLSv1.2","989","Application Data"
"289","20.671210","172.66.164.67","100.86.121.59","TCP","66","443  >  53996 [ACK] Seq=125070 Ack=11030 Win=17 Len=0 TSval=1714982712 TSecr=1969074298"
"290","20.679849","100.86.121.59","172.66.164.67","TLSv1.2","418","Application Data"
"291","20.680281","100.86.121.59","172.66.164.67","TLSv1.2","352","Application Data"
"292","20.680484","100.86.121.59","172.66.164.67","TLSv1.2","201","Application Data"
"293","20.680568","100.86.121.59","172.66.164.67","TLSv1.2","280","Application Data"
"294","20.680641","100.86.121.59","172.66.164.67","TLSv1.2","197","Application Data"
"295","20.680983","172.66.164.67","100.86.121.59","TLSv1.2","128","Application Data"
"296","20.680985","172.66.164.67","100.86.121.59","TLSv1.2","108","Application Data"
"297","20.681063","100.86.121.59","172.66.164.67","TCP","66","53996  >  443 [ACK] Seq=12148 Ack=125174 Win=2047 Len=0 TSval=1969074331 TSecr=1714982734"
"298","20.682509","172.66.164.67","100.86.121.59","TLSv1.2","97","Application Data"
"299","20.682558","100.86.121.59","172.66.164.67","TCP","66","53996  >  443 [ACK] Seq=12148 Ack=125205 Win=2048 Len=0 TSval=1969074332 TSecr=1714982734"
"300","20.713116","172.66.164.67","100.86.121.59","TCP","66","443  >  53996 [ACK] Seq=125205 Ack=12148 Win=17 Len=0 TSval=1714982745 TSecr=1969074329"
"301","20.718360","172.66.164.67","100.86.121.59","TLSv1.2","127","Application Data"
"302","20.718362","172.66.164.67","100.86.121.59","TLSv1.2","290","Application Data"
"303","20.718442","100.86.121.59","172.66.164.67","TCP","66","53996  >  443 [ACK] Seq=12148 Ack=125490 Win=2044 Len=0 TSval=1969074368 TSecr=1714982771"
"304","20.719159","172.66.164.67","100.86.121.59","TLSv1.2","97","Application Data"
"305","20.719160","172.66.164.67","100.86.121.59","TLSv1.2","127","Application Data"
"306","20.719161","172.66.164.67","100.86.121.59","TLSv1.2","290","Application Data"
"307","20.719163","172.66.164.67","100.86.121.59","TLSv1.2","97","Application Data"
"308","20.719228","100.86.121.59","172.66.164.67","TCP","66","53996  >  443 [ACK] Seq=12148 Ack=125837 Win=2043 Len=0 TSval=1969074369 TSecr=1714982772"
"309","20.720807","172.66.164.67","100.86.121.59","TLSv1.2","127","Application Data"
"310","20.720894","100.86.121.59","172.66.164.67","TCP","66","53996  >  443 [ACK] Seq=12148 Ack=125898 Win=2048 Len=0 TSval=1969074370 TSecr=1714982774"
"311","20.721373","172.66.164.67","100.86.121.59","TLSv1.2","290","Application Data"
"312","20.721375","172.66.164.67","100.86.121.59","TLSv1.2","97","Application Data"
"313","20.721416","100.86.121.59","172.66.164.67","TCP","66","53996  >  443 [ACK] Seq=12148 Ack=126153 Win=2045 Len=0 TSval=1969074371 TSecr=1714982774"
"314","20.721596","172.66.164.67","100.86.121.59","TLSv1.2","127","Application Data"
"315","20.721597","172.66.164.67","100.86.121.59","TLSv1.2","290","Application Data"
"316","20.721598","172.66.164.67","100.86.121.59","TLSv1.2","97","Application Data"
"317","20.721632","100.86.121.59","172.66.164.67","TCP","66","53996  >  443 [ACK] Seq=12148 Ack=126469 Win=2044 Len=0 TSval=1969074371 TSecr=1714982775"
"318","20.753970","172.66.164.67","100.86.121.59","TLSv1.2","208","Application Data"
"319","20.753972","172.66.164.67","100.86.121.59","TLSv1.2","290","Application Data"
"320","20.754109","100.86.121.59","172.66.164.67","TCP","66","53996  >  443 [ACK] Seq=12148 Ack=126835 Win=2043 Len=0 TSval=1969074404 TSecr=1714982781"
"321","20.754181","172.66.164.67","100.86.121.59","TLSv1.2","97","Application Data"
"322","20.754259","100.86.121.59","172.66.164.67","TCP","66","53996  >  443 [ACK] Seq=12148 Ack=126866 Win=2043 Len=0 TSval=1969074404 TSecr=1714982781"
"323","24.007552","100.86.121.59","172.66.164.67","TLSv1.2","806","Application Data"
"324","24.008186","100.86.121.59","172.66.164.67","TLSv1.2","992","Application Data"
"325","24.009097","100.86.121.59","172.66.164.67","TLSv1.2","206","Application Data"
"326","24.019469","172.66.164.67","100.86.121.59","TCP","66","443  >  53996 [ACK] Seq=126866 Ack=13814 Win=17 Len=0 TSval=1714986073 TSecr=1969077657"
"327","24.045528","172.66.164.67","100.86.121.59","TLSv1.2","231","Application Data"
"328","24.045533","172.66.164.67","100.86.121.59","TLSv1.2","290","Application Data"
"329","24.045537","172.66.164.67","100.86.121.59","TLSv1.2","97","Application Data"
"330","24.045762","100.86.121.59","172.66.164.67","TCP","66","53996  >  443 [ACK] Seq=13954 Ack=127286 Win=2042 Len=0 TSval=1969077695 TSecr=1714986099"
"331","24.047500","172.66.164.67","100.86.121.59","TLSv1.2","127","Application Data"
"332","24.047506","172.66.164.67","100.86.121.59","TLSv1.2","290","Application Data"
"333","24.047545","172.66.164.67","100.86.121.59","TLSv1.2","97","Application Data"
"334","24.047654","100.86.121.59","172.66.164.67","TCP","66","53996  >  443 [ACK] Seq=13954 Ack=127571 Win=2044 Len=0 TSval=1969077697 TSecr=1714986101"
"335","24.047722","100.86.121.59","172.66.164.67","TCP","66","53996  >  443 [ACK] Seq=13954 Ack=127602 Win=2044 Len=0 TSval=1969077697 TSecr=1714986101"
"336","24.052881","172.66.164.67","100.86.121.59","TLSv1.2","127","Application Data"
"337","24.052994","100.86.121.59","172.66.164.67","TCP","66","53996  >  443 [ACK] Seq=13954 Ack=127663 Win=2048 Len=0 TSval=1969077702 TSecr=1714986106"
"338","24.053228","172.66.164.67","100.86.121.59","TLSv1.2","290","Application Data"
"339","24.053230","172.66.164.67","100.86.121.59","TLSv1.2","97","Application Data"
"340","24.053286","100.86.121.59","172.66.164.67","TCP","66","53996  >  443 [ACK] Seq=13954 Ack=127918 Win=2045 Len=0 TSval=1969077703 TSecr=1714986106"
"341","25.005764","100.86.121.59","172.66.164.67","TLSv1.2","471","Application Data"
"342","25.089684","172.66.164.67","100.86.121.59","TLSv1.2","150","Application Data"
"343","25.089784","172.66.164.67","100.86.121.59","TLSv1.2","290","Application Data"
"344","25.089787","172.66.164.67","100.86.121.59","TLSv1.2","97","Application Data"
"345","25.089855","100.86.121.59","172.66.164.67","TCP","66","53996  >  443 [ACK] Seq=14359 Ack=128002 Win=2047 Len=0 TSval=1969078739 TSecr=1714987127"
"346","25.089917","100.86.121.59","172.66.164.67","TCP","66","53996  >  443 [ACK] Seq=14359 Ack=128257 Win=2044 Len=0 TSval=1969078739 TSecr=1714987127"
"347","25.093374","100.86.121.59","172.66.164.67","TLSv1.2","101","Application Data"
"348","25.171168","172.66.164.67","100.86.121.59","TCP","97","[TCP Spurious Retransmission] 443  >  53996 [PSH, ACK] Seq=128226 Ack=14359 Win=17 Len=31 TSval=1714987166 TSecr=1969078655"
"349","25.171386","100.86.121.59","172.66.164.67","TCP","78","[TCP Dup ACK 346#1] 53996  >  443 [ACK] Seq=14394 Ack=128257 Win=2048 Len=0 TSval=1969078821 TSecr=1714987166 SLE=128226 SRE=128257"
"350","25.219048","172.66.164.67","100.86.121.59","TCP","66","443  >  53996 [ACK] Seq=128257 Ack=14394 Win=17 Len=0 TSval=1714987242 TSecr=1969078743"
"351","25.737324","100.86.121.59","172.66.164.67","TLSv1.2","580","Application Data"
"352","25.737746","100.86.121.59","172.66.164.67","TLSv1.2","678","Application Data"
"353","25.738061","100.86.121.59","172.66.164.67","TLSv1.2","991","Application Data"
"354","25.825984","172.66.164.67","100.86.121.59","TCP","66","443  >  53996 [ACK] Seq=128257 Ack=16445 Win=17 Len=0 TSval=1714987837 TSecr=1969079388"
"355","25.850637","172.66.164.67","100.86.121.59","TLSv1.2","150","Application Data"
"356","25.850848","100.86.121.59","172.66.164.67","TCP","66","53996  >  443 [ACK] Seq=16445 Ack=128341 Win=2047 Len=0 TSval=1969079500 TSecr=1714987858"
"357","25.851906","172.66.164.67","100.86.121.59","TLSv1.2","290","Application Data"
"358","25.851909","172.66.164.67","100.86.121.59","TLSv1.2","97","Application Data"
"359","25.851911","172.66.164.67","100.86.121.59","TLSv1.2","135","Application Data"
"360","25.851914","172.66.164.67","100.86.121.59","TLSv1.2","290","Application Data"
"361","25.851916","172.66.164.67","100.86.121.59","TLSv1.2","97","Application Data"
"362","25.851917","172.66.164.67","100.86.121.59","TLSv1.2","244","Application Data"
"363","25.851920","172.66.164.67","100.86.121.59","TLSv1.2","290","Application Data"
"364","25.851922","172.66.164.67","100.86.121.59","TLSv1.2","97","Application Data"
"365","25.852012","100.86.121.59","172.66.164.67","TCP","66","53996  >  443 [ACK] Seq=16445 Ack=129353 Win=2033 Len=0 TSval=1969079501 TSecr=1714987862"
"366","25.909920","172.66.164.67","100.86.121.59","TCP","97","[TCP Spurious Retransmission] 443  >  53996 [PSH, ACK] Seq=129322 Ack=16445 Win=17 Len=31 TSval=1714987927 TSecr=1969079388"
"367","25.910173","100.86.121.59","172.66.164.67","TCP","78","[TCP Dup ACK 365#1] 53996  >  443 [ACK] Seq=16445 Ack=129353 Win=2048 Len=0 TSval=1969079560 TSecr=1714987927 SLE=129322 SRE=129353"
"368","29.001154","100.86.121.59","172.66.164.67","TLSv1.2","402","Application Data"
"369","29.038965","172.66.164.67","100.86.121.59","TLSv1.2","200","Application Data"
"370","29.038970","172.66.164.67","100.86.121.59","TLSv1.2","108","Application Data"
"371","29.039258","100.86.121.59","172.66.164.67","TCP","66","53996  >  443 [ACK] Seq=16781 Ack=129529 Win=2046 Len=0 TSval=1969082689 TSecr=1714991090"
"372","29.039858","172.66.164.67","100.86.121.59","TLSv1.2","97","Application Data"
"373","29.039953","100.86.121.59","172.66.164.67","TCP","66","53996  >  443 [ACK] Seq=16781 Ack=129560 Win=2048 Len=0 TSval=1969082689 TSecr=1714991090"
"374","30.733193","100.86.121.59","172.66.164.67","TLSv1.2","263","Application Data"
"375","30.773654","172.66.164.67","100.86.121.59","TLSv1.2","231","Application Data"
"376","30.773657","172.66.164.67","100.86.121.59","TLSv1.2","290","Application Data"
"377","30.773660","172.66.164.67","100.86.121.59","TLSv1.2","97","Application Data"
"378","30.773885","100.86.121.59","172.66.164.67","TCP","66","53996  >  443 [ACK] Seq=16978 Ack=129980 Win=2042 Len=0 TSval=1969084423 TSecr=1714992827"
"379","30.775844","100.86.121.59","172.66.164.67","TLSv1.2","101","Application Data"
"380","30.779953","100.86.121.59","172.66.164.67","TLSv1.2","578","Application Data"
"381","30.789355","172.66.164.67","100.86.121.59","TCP","66","443  >  53996 [ACK] Seq=129980 Ack=17525 Win=17 Len=0 TSval=1714992843 TSecr=1969084425"
"382","30.812452","172.66.164.67","100.86.121.59","TLSv1.2","135","Application Data"
"383","30.812456","172.66.164.67","100.86.121.59","TLSv1.2","290","Application Data"
"384","30.812459","172.66.164.67","100.86.121.59","TLSv1.2","97","Application Data"
"385","30.812642","100.86.121.59","172.66.164.67","TCP","66","53996  >  443 [ACK] Seq=17525 Ack=130304 Win=2043 Len=0 TSval=1969084462 TSecr=1714992866"
"386","35.001920","100.86.121.59","172.66.164.67","TLSv1.2","678","Application Data"
"387","35.035032","172.66.164.67","100.86.121.59","TLSv1.2","150","Application Data"
"388","35.035036","172.66.164.67","100.86.121.59","TLSv1.2","290","Application Data"
"389","35.035331","100.86.121.59","172.66.164.67","TCP","66","53996  >  443 [ACK] Seq=18137 Ack=130612 Win=2044 Len=0 TSval=1969088685 TSecr=1714997087"
"390","35.035418","172.66.164.67","100.86.121.59","TLSv1.2","97","Application Data"
"391","35.035514","100.86.121.59","172.66.164.67","TCP","66","53996  >  443 [ACK] Seq=18137 Ack=130643 Win=2044 Len=0 TSval=1969088685 TSecr=1714997087"
"392","35.653980","100.86.121.59","172.66.164.67","TLSv1.2","983","Application Data"
"393","35.694610","172.66.164.67","100.86.121.59","TLSv1.2","128","Application Data"
"394","35.694615","172.66.164.67","100.86.121.59","TLSv1.2","108","Application Data"
"395","35.694618","172.66.164.67","100.86.121.59","TLSv1.2","97","Application Data"
"396","35.694876","100.86.121.59","172.66.164.67","TCP","66","53996  >  443 [ACK] Seq=19054 Ack=130778 Win=2046 Len=0 TSval=1969089344 TSecr=1714997748"
"397","35.860888","100.86.121.59","172.66.164.67","TLSv1.2","200","Application Data"
"398","35.861547","100.86.121.59","172.66.164.67","TLSv1.2","197","Application Data"
"399","35.872123","172.66.164.67","100.86.121.59","TCP","66","443  >  53996 [ACK] Seq=130778 Ack=19319 Win=17 Len=0 TSval=1714997925 TSecr=1969089510"
"400","35.900528","172.66.164.67","100.86.121.59","TLSv1.2","239","Application Data"
"401","35.900724","100.86.121.59","172.66.164.67","TCP","66","53996  >  443 [ACK] Seq=19319 Ack=130951 Win=2046 Len=0 TSval=1969089550 TSecr=1714997954"
"402","35.900975","172.66.164.67","100.86.121.59","TLSv1.2","290","Application Data"
"403","35.900978","172.66.164.67","100.86.121.59","TLSv1.2","97","Application Data"
"404","35.901083","100.86.121.59","172.66.164.67","TCP","66","53996  >  443 [ACK] Seq=19319 Ack=131206 Win=2045 Len=0 TSval=1969089550 TSecr=1714997954"
"405","35.902639","100.86.121.59","172.66.164.67","TLSv1.2","101","Application Data"
"406","35.904959","172.66.164.67","100.86.121.59","TLSv1.2","127","Application Data"
"407","35.904962","172.66.164.67","100.86.121.59","TLSv1.2","290","Application Data"
"408","35.904964","172.66.164.67","100.86.121.59","TLSv1.2","97","Application Data"
"409","35.905132","100.86.121.59","172.66.164.67","TCP","66","53996  >  443 [ACK] Seq=19354 Ack=131522 Win=2044 Len=0 TSval=1969089554 TSecr=1714997958"
"410","35.954310","172.66.164.67","100.86.121.59","TCP","66","443  >  53996 [ACK] Seq=131522 Ack=19354 Win=17 Len=0 TSval=1714998008 TSecr=1969089552"
"411","39.518335","100.86.121.59","104.20.21.102","TCP","54","[TCP Keep-Alive] 54030  >  443 [ACK] Seq=1862 Ack=3986 Win=131072 Len=0"
"412","39.518800","100.86.121.59","172.66.164.67","TCP","54","[TCP Keep-Alive] 53996  >  443 [ACK] Seq=19353 Ack=131522 Win=2048 Len=0"
"413","39.532230","104.20.21.102","100.86.121.59","TCP","66","[TCP Keep-Alive ACK] 443  >  54030 [ACK] Seq=3986 Ack=1863 Win=131072 Len=0 TSval=4040510885 TSecr=3252907541"
"414","39.534107","172.66.164.67","100.86.121.59","TCP","66","[TCP Keep-Alive ACK] 443  >  53996 [ACK] Seq=131522 Ack=19354 Win=17 Len=0 TSval=1715001586 TSecr=1969089552"
"415","40.009814","100.86.121.59","172.66.164.67","TLSv1.2","489","Application Data"
"416","40.023475","172.66.164.67","100.86.121.59","TCP","66","443  >  53996 [ACK] Seq=131522 Ack=19777 Win=17 Len=0 TSval=1715002076 TSecr=1969093659"
"417","40.046452","172.66.164.67","100.86.121.59","TLSv1.2","150","Application Data"
"418","40.046455","172.66.164.67","100.86.121.59","TLSv1.2","290","Application Data"
"419","40.046457","172.66.164.67","100.86.121.59","TLSv1.2","97","Application Data"
"420","40.046644","100.86.121.59","172.66.164.67","TCP","66","53996  >  443 [ACK] Seq=19777 Ack=131861 Win=2043 Len=0 TSval=1969093696 TSecr=1715002100"
"421","40.309376","100.86.121.59","172.66.164.67","TCP","54","[TCP Keep-Alive] 53996  >  443 [ACK] Seq=19776 Ack=131861 Win=2048 Len=0"
"422","40.323311","172.66.164.67","100.86.121.59","TCP","66","[TCP Keep-Alive ACK] 443  >  53996 [ACK] Seq=131861 Ack=19777 Win=17 Len=0 TSval=1715002376 TSecr=1969093696"
"423","40.823363","100.86.121.59","172.66.164.67","TLSv1.2","588","Application Data"
"424","40.854804","172.66.164.67","100.86.121.59","TLSv1.2","150","Application Data"
"425","40.854808","172.66.164.67","100.86.121.59","TLSv1.2","290","Application Data"
"426","40.854811","172.66.164.67","100.86.121.59","TLSv1.2","97","Application Data"
"427","40.855040","100.86.121.59","172.66.164.67","TCP","66","53996  >  443 [ACK] Seq=20299 Ack=132200 Win=2043 Len=0 TSval=1969094504 TSecr=1715002908"
"428","41.088011","100.86.121.59","172.66.164.67","TCP","54","[TCP Keep-Alive] 53996  >  443 [ACK] Seq=20298 Ack=132200 Win=2048 Len=0"
"429","41.099871","172.66.164.67","100.86.121.59","TCP","66","[TCP Keep-Alive ACK] 443  >  53996 [ACK] Seq=132200 Ack=20299 Win=17 Len=0 TSval=1715003152 TSecr=1969094504"
"430","43.000484","100.86.121.59","172.66.164.67","TCP","1454","53996  >  443 [ACK] Seq=20299 Ack=132200 Win=2048 Len=1388 TSval=1969096650 TSecr=1715003152 [TCP PDU reassembled in 431]"
"431","43.000514","100.86.121.59","172.66.164.67","TLSv1.2","78","Application Data"
"432","43.011023","172.66.164.67","100.86.121.59","TCP","66","443  >  53996 [ACK] Seq=132200 Ack=21699 Win=17 Len=0 TSval=1715005064 TSecr=1969096650"
"433","43.035856","172.66.164.67","100.86.121.59","TLSv1.2","151","Application Data"
"434","43.035858","172.66.164.67","100.86.121.59","TLSv1.2","108","Application Data"
"435","43.035926","100.86.121.59","172.66.164.67","TCP","66","53996  >  443 [ACK] Seq=21699 Ack=132327 Win=2047 Len=0 TSval=1969096685 TSecr=1715005088"
"436","43.036559","100.86.121.59","172.66.164.67","TLSv1.2","403","Application Data"
"437","43.036866","172.66.164.67","100.86.121.59","TLSv1.2","97","Application Data"
"438","43.036900","100.86.121.59","172.66.164.67","TCP","66","53996  >  443 [ACK] Seq=22036 Ack=132358 Win=2048 Len=0 TSval=1969096686 TSecr=1715005088"
"439","43.037086","100.86.121.59","172.66.164.67","TLSv1.2","101","Application Data"
"440","43.048105","172.66.164.67","100.86.121.59","TCP","66","443  >  53996 [ACK] Seq=132358 Ack=22071 Win=17 Len=0 TSval=1715005101 TSecr=1969096686"
"441","43.060269","100.86.121.59","172.66.164.67","TLSv1.2","359","Application Data"
"442","43.077944","172.66.164.67","100.86.121.59","TLSv1.2","128","Application Data"
"443","43.077946","172.66.164.67","100.86.121.59","TLSv1.2","108","Application Data"
"444","43.077950","172.66.164.67","100.86.121.59","TLSv1.2","97","Application Data"
"445","43.078022","100.86.121.59","172.66.164.67","TCP","66","53996  >  443 [ACK] Seq=22364 Ack=132493 Win=2046 Len=0 TSval=1969096727 TSecr=1715005130"
"446","43.298493","100.86.121.59","172.66.164.67","TCP","54","[TCP Keep-Alive] 53996  >  443 [ACK] Seq=22363 Ack=132493 Win=2048 Len=0"
"447","43.308409","172.66.164.67","100.86.121.59","TCP","66","[TCP Keep-Alive ACK] 443  >  53996 [ACK] Seq=132493 Ack=22364 Win=17 Len=0 TSval=1715005362 TSecr=1969096727"
"448","44.000069","100.86.121.59","172.66.164.67","TLSv1.2","474","Application Data"
"449","44.002562","100.86.121.59","172.66.164.67","TCP","1454","53996  >  443 [ACK] Seq=22772 Ack=132493 Win=2048 Len=1388 TSval=1969097652 TSecr=1715005362 [TCP PDU reassembled in 450]"
"450","44.002605","100.86.121.59","172.66.164.67","TLSv1.2","201","Application Data"
"451","44.003668","100.86.121.59","172.66.164.67","TLSv1.2","201","Application Data"
"452","44.014370","172.66.164.67","100.86.121.59","TCP","66","443  >  53996 [ACK] Seq=132493 Ack=24295 Win=17 Len=0 TSval=1715006068 TSecr=1969097649"
"453","44.033790","172.66.164.67","100.86.121.59","TLSv1.2","151","Application Data"
"454","44.033794","172.66.164.67","100.86.121.59","TLSv1.2","108","Application Data"
"455","44.033797","172.66.164.67","100.86.121.59","TLSv1.2","97","Application Data"
"456","44.034024","100.86.121.59","172.66.164.67","TCP","66","53996  >  443 [ACK] Seq=24430 Ack=132651 Win=2046 Len=0 TSval=1969097683 TSecr=1715006087"
"457","44.036299","172.66.164.67","100.86.121.59","TLSv1.2","127","Application Data"
"458","44.036303","172.66.164.67","100.86.121.59","TLSv1.2","290","Application Data"
"459","44.036453","100.86.121.59","172.66.164.67","TCP","66","53996  >  443 [ACK] Seq=24430 Ack=132936 Win=2044 Len=0 TSval=1969097686 TSecr=1715006089"
"460","44.036456","172.66.164.67","100.86.121.59","TLSv1.2","97","Application Data"
"461","44.036458","172.66.164.67","100.86.121.59","TLSv1.2","127","Application Data"
"462","44.036461","172.66.164.67","100.86.121.59","TLSv1.2","290","Application Data"
"463","44.036525","100.86.121.59","172.66.164.67","TCP","66","53996  >  443 [ACK] Seq=24430 Ack=133252 Win=2040 Len=0 TSval=1969097686 TSecr=1715006090"
"464","44.037033","172.66.164.67","100.86.121.59","TLSv1.2","97","Application Data"
"465","44.037099","100.86.121.59","172.66.164.67","TCP","66","53996  >  443 [ACK] Seq=24430 Ack=133283 Win=2040 Len=0 TSval=1969097686 TSecr=1715006090"
"466","44.212019","100.86.121.59","172.66.164.67","TCP","54","[TCP Keep-Alive] 53996  >  443 [ACK] Seq=24429 Ack=133283 Win=2048 Len=0"
"467","44.222199","172.66.164.67","100.86.121.59","TCP","66","[TCP Keep-Alive ACK] 443  >  53996 [ACK] Seq=133283 Ack=24430 Win=17 Len=0 TSval=1715006275 TSecr=1969097686"
"468","44.335661","172.66.164.67","100.86.121.59","TLSv1.2","167","Application Data"
"469","44.335664","172.66.164.67","100.86.121.59","TLSv1.2","1514","[TCP Previous segment not captured] , Ignored Unknown Record"
"470","44.335875","100.86.121.59","172.66.164.67","TCP","66","53996  >  443 [ACK] Seq=24430 Ack=133384 Win=2047 Len=0 TSval=1969097985 TSecr=1715006388"
"471","44.335983","100.86.121.59","172.66.164.67","TCP","78","[TCP Dup ACK 470#1] 53996  >  443 [ACK] Seq=24430 Ack=133384 Win=2047 Len=0 TSval=1969097985 TSecr=1715006388 SLE=134832 SRE=136280"
"472","44.337395","172.66.164.67","100.86.121.59","TLSv1.2","1514","Ignored Unknown Record"
"473","44.337399","172.66.164.67","100.86.121.59","TLSv1.2","1514","Ignored Unknown Record"
"474","44.337404","172.66.164.67","100.86.121.59","TLSv1.2","1514","Ignored Unknown Record"
"475","44.337406","172.66.164.67","100.86.121.59","TLSv1.2","1514","[TCP Previous segment not captured] , Ignored Unknown Record"
"476","44.337410","172.66.164.67","100.86.121.59","TLSv1.2","1514","Ignored Unknown Record"
"477","44.337413","172.66.164.67","100.86.121.59","TLSv1.2","1514","Ignored Unknown Record"
"478","44.337417","172.66.164.67","100.86.121.59","TLSv1.2","1514","Ignored Unknown Record"
"479","44.337420","172.66.164.67","100.86.121.59","TLSv1.2","1514","Ignored Unknown Record"
"480","44.337422","172.66.164.67","100.86.121.59","TLSv1.2","544","Ignored Unknown Record"
"481","44.337426","172.66.164.67","100.86.121.59","TCP","1514","443  >  53996 [ACK] Seq=149790 Ack=24430 Win=17 Len=1448 TSval=1715006390 TSecr=1969097686 [TCP PDU reassembled in 487]"
"482","44.337429","172.66.164.67","100.86.121.59","TCP","1514","443  >  53996 [ACK] Seq=151238 Ack=24430 Win=17 Len=1448 TSval=1715006390 TSecr=1969097686 [TCP PDU reassembled in 487]"
"483","44.337432","172.66.164.67","100.86.121.59","TCP","1514","443  >  53996 [ACK] Seq=152686 Ack=24430 Win=17 Len=1448 TSval=1715006390 TSecr=1969097686 [TCP PDU reassembled in 487]"
"484","44.337435","172.66.164.67","100.86.121.59","TCP","1514","443  >  53996 [ACK] Seq=154134 Ack=24430 Win=17 Len=1448 TSval=1715006390 TSecr=1969097686 [TCP PDU reassembled in 487]"
"485","44.337439","172.66.164.67","100.86.121.59","TCP","1514","443  >  53996 [ACK] Seq=155582 Ack=24430 Win=17 Len=1448 TSval=1715006390 TSecr=1969097686 [TCP PDU reassembled in 487]"
"486","44.337442","172.66.164.67","100.86.121.59","TCP","1514","443  >  53996 [ACK] Seq=157030 Ack=24430 Win=17 Len=1448 TSval=1715006390 TSecr=1969097686 [TCP PDU reassembled in 487]"
"487","44.337447","172.66.164.67","100.86.121.59","TLSv1.2","887","Application Data"
"488","44.337578","100.86.121.59","172.66.164.67","TCP","78","[TCP Dup ACK 470#2] 53996  >  443 [ACK] Seq=24430 Ack=133384 Win=2048 Len=0 TSval=1969097987 TSecr=1715006388 SLE=134832 SRE=140624"
"489","44.337619","100.86.121.59","172.66.164.67","TCP","86","[TCP Dup ACK 470#3] 53996  >  443 [ACK] Seq=24430 Ack=133384 Win=2048 Len=0 TSval=1969097987 TSecr=1715006388 SLE=142072 SRE=157030 SLE=134832 SRE=140624"
"490","44.337634","100.86.121.59","172.66.164.67","TCP","86","[TCP Dup ACK 470#4] 53996  >  443 [ACK] Seq=24430 Ack=133384 Win=2048 Len=0 TSval=1969097987 TSecr=1715006388 SLE=142072 SRE=159299 SLE=134832 SRE=140624"
"491","44.337938","172.66.164.67","100.86.121.59","TLSv1.2","97","Application Data"
"492","44.338017","100.86.121.59","172.66.164.67","TCP","86","[TCP Dup ACK 470#5] 53996  >  443 [ACK] Seq=24430 Ack=133384 Win=2048 Len=0 TSval=1969097987 TSecr=1715006388 SLE=142072 SRE=159330 SLE=134832 SRE=140624"
"493","44.347807","172.66.164.67","100.86.121.59","TCP","1514","[TCP Fast Retransmission] 443  >  53996 [ACK] Seq=133384 Ack=24430 Win=17 Len=1448 TSval=1715006401 TSecr=1969097987"
"494","44.347812","172.66.164.67","100.86.121.59","TCP","1514","[TCP Fast Retransmission] 443  >  53996 [ACK] Seq=140624 Ack=24430 Win=17 Len=1448 TSval=1715006401 TSecr=1969097987"
"495","44.347989","100.86.121.59","172.66.164.67","TCP","78","53996  >  443 [ACK] Seq=24430 Ack=140624 Win=1935 Len=0 TSval=1969097997 TSecr=1715006401 SLE=142072 SRE=159330"
"496","44.348072","100.86.121.59","172.66.164.67","TCP","66","53996  >  443 [ACK] Seq=24430 Ack=159330 Win=1643 Len=0 TSval=1969097997 TSecr=1715006401"
"497","44.348669","100.86.121.59","172.66.164.67","TCP","66","[TCP Window Update] 53996  >  443 [ACK] Seq=24430 Ack=159330 Win=2048 Len=0 TSval=1969097998 TSecr=1715006401"
"498","44.418187","100.86.121.59","172.66.164.67","TLSv1.2","284","Application Data"
"499","44.447023","100.86.121.59","172.66.164.67","TLSv1.2","222","Application Data"
"500","44.452999","172.66.164.67","100.86.121.59","TLSv1.2","170","Application Data"
"501","44.453023","100.86.121.59","172.66.164.67","TCP","66","53996  >  443 [ACK] Seq=24804 Ack=159434 Win=2047 Len=0 TSval=1969098102 TSecr=1715006506"
"502","44.453348","172.66.164.67","100.86.121.59","TCP","1514","443  >  53996 [ACK] Seq=159434 Ack=24648 Win=17 Len=1448 TSval=1715006506 TSecr=1969098068 [TCP PDU reassembled in 516]"
"503","44.453377","100.86.121.59","172.66.164.67","TCP","66","53996  >  443 [ACK] Seq=24804 Ack=160882 Win=2026 Len=0 TSval=1969098103 TSecr=1715006506"
"504","44.453792","172.66.164.67","100.86.121.59","TCP","1514","443  >  53996 [ACK] Seq=160882 Ack=24648 Win=17 Len=1448 TSval=1715006506 TSecr=1969098068 [TCP PDU reassembled in 516]"
"505","44.453794","172.66.164.67","100.86.121.59","TCP","1514","443  >  53996 [ACK] Seq=162330 Ack=24648 Win=17 Len=1448 TSval=1715006506 TSecr=1969098068 [TCP PDU reassembled in 516]"
"506","44.453826","100.86.121.59","172.66.164.67","TCP","66","53996  >  443 [ACK] Seq=24804 Ack=163778 Win=1981 Len=0 TSval=1969098103 TSecr=1715006506"
"507","44.454054","100.86.121.59","172.66.164.67","TCP","66","[TCP Window Update] 53996  >  443 [ACK] Seq=24804 Ack=163778 Win=2048 Len=0 TSval=1969098103 TSecr=1715006506"
"508","44.454946","172.66.164.67","100.86.121.59","TCP","1514","443  >  53996 [ACK] Seq=163778 Ack=24648 Win=17 Len=1448 TSval=1715006506 TSecr=1969098068 [TCP PDU reassembled in 516]"
"509","44.454947","172.66.164.67","100.86.121.59","TCP","1514","443  >  53996 [ACK] Seq=165226 Ack=24648 Win=17 Len=1448 TSval=1715006506 TSecr=1969098068 [TCP PDU reassembled in 516]"
"510","44.454948","172.66.164.67","100.86.121.59","TCP","1514","443  >  53996 [ACK] Seq=166674 Ack=24648 Win=17 Len=1448 TSval=1715006506 TSecr=1969098068 [TCP PDU reassembled in 516]"
"511","44.454950","172.66.164.67","100.86.121.59","TCP","1514","443  >  53996 [ACK] Seq=168122 Ack=24648 Win=17 Len=1448 TSval=1715006506 TSecr=1969098068 [TCP PDU reassembled in 516]"
"512","44.454951","172.66.164.67","100.86.121.59","TCP","1514","443  >  53996 [PSH, ACK] Seq=169570 Ack=24648 Win=17 Len=1448 TSval=1715006506 TSecr=1969098068 [TCP PDU reassembled in 516]"
"513","44.454952","172.66.164.67","100.86.121.59","TCP","1514","443  >  53996 [ACK] Seq=171018 Ack=24648 Win=17 Len=1448 TSval=1715006507 TSecr=1969098068 [TCP PDU reassembled in 516]"
"514","44.454953","172.66.164.67","100.86.121.59","TCP","1514","443  >  53996 [ACK] Seq=172466 Ack=24648 Win=17 Len=1448 TSval=1715006507 TSecr=1969098068 [TCP PDU reassembled in 516]"
"515","44.454955","172.66.164.67","100.86.121.59","TCP","1514","443  >  53996 [ACK] Seq=173914 Ack=24648 Win=17 Len=1448 TSval=1715006507 TSecr=1969098068 [TCP PDU reassembled in 516]"
"516","44.454956","172.66.164.67","100.86.121.59","TLSv1.2","1514","Application Data"
"517","44.454957","172.66.164.67","100.86.121.59","TCP","1514","443  >  53996 [ACK] Seq=176810 Ack=24648 Win=17 Len=1448 TSval=1715006507 TSecr=1969098068 [TCP PDU reassembled in 519]"
"518","44.454958","172.66.164.67","100.86.121.59","TCP","1514","443  >  53996 [ACK] Seq=178258 Ack=24648 Win=17 Len=1448 TSval=1715006507 TSecr=1969098068 [TCP PDU reassembled in 519]"
"519","44.454960","172.66.164.67","100.86.121.59","TLSv1.2","1137","Application Data"
"520","44.454993","100.86.121.59","172.66.164.67","TCP","66","53996  >  443 [ACK] Seq=24804 Ack=179706 Win=1800 Len=0 TSval=1969098104 TSecr=1715006507"
"521","44.455009","100.86.121.59","172.66.164.67","TCP","66","53996  >  443 [ACK] Seq=24804 Ack=180777 Win=1784 Len=0 TSval=1969098104 TSecr=1715006507"
"522","44.455017","100.86.121.59","172.66.164.67","TCP","66","[TCP Window Update] 53996  >  443 [ACK] Seq=24804 Ack=180777 Win=2048 Len=0 TSval=1969098104 TSecr=1715006507"
"523","44.455257","172.66.164.67","100.86.121.59","TLSv1.2","97","Application Data"
"524","44.455275","100.86.121.59","172.66.164.67","TCP","66","53996  >  443 [ACK] Seq=24804 Ack=180808 Win=2048 Len=0 TSval=1969098105 TSecr=1715006508"
"525","44.477064","100.86.121.59","172.66.164.67","TLSv1.2","393","Application Data"
"526","44.477806","100.86.121.59","172.66.164.67","TLSv1.2","251","Application Data"
"527","44.478207","100.86.121.59","172.66.164.67","TCP","1454","53996  >  443 [ACK] Seq=25316 Ack=180808 Win=2048 Len=1388 TSval=1969098128 TSecr=1715006508 [TCP PDU reassembled in 528]"
"528","44.478212","100.86.121.59","172.66.164.67","TLSv1.2","204","Application Data"
"529","44.478742","100.86.121.59","172.66.164.67","TLSv1.2","199","Application Data"
"530","44.478937","100.86.121.59","172.66.164.67","TLSv1.2","196","Application Data"
"531","44.487679","172.66.164.67","100.86.121.59","TCP","66","443  >  53996 [ACK] Seq=180808 Ack=25131 Win=17 Len=0 TSval=1715006541 TSecr=1969098096"
"532","44.490898","172.66.164.67","100.86.121.59","TCP","66","443  >  53996 [ACK] Seq=180808 Ack=26842 Win=17 Len=0 TSval=1715006542 TSecr=1969098127"
"533","44.491219","172.66.164.67","100.86.121.59","TCP","66","443  >  53996 [ACK] Seq=180808 Ack=27105 Win=17 Len=0 TSval=1715006543 TSecr=1969098128"
"534","44.513555","172.66.164.67","100.86.121.59","TLSv1.2","127","Application Data"
"535","44.513557","172.66.164.67","100.86.121.59","TLSv1.2","290","Application Data"
"536","44.513645","100.86.121.59","172.66.164.67","TCP","66","53996  >  443 [ACK] Seq=27105 Ack=181093 Win=2044 Len=0 TSval=1969098163 TSecr=1715006567"
"537","44.515395","172.66.164.67","100.86.121.59","TLSv1.2","97","Application Data"
"538","44.515398","172.66.164.67","100.86.121.59","TLSv1.2","208","Application Data"
"539","44.515399","172.66.164.67","100.86.121.59","TLSv1.2","290","Application Data"
"540","44.515400","172.66.164.67","100.86.121.59","TLSv1.2","97","Application Data"
"541","44.515515","100.86.121.59","172.66.164.67","TCP","66","53996  >  443 [ACK] Seq=27105 Ack=181521 Win=2038 Len=0 TSval=1969098165 TSecr=1715006567"
"542","44.515859","172.66.164.67","100.86.121.59","TLSv1.2","127","Application Data"
"543","44.515860","172.66.164.67","100.86.121.59","TLSv1.2","290","Application Data"
"544","44.515896","100.86.121.59","172.66.164.67","TCP","66","53996  >  443 [ACK] Seq=27105 Ack=181806 Win=2044 Len=0 TSval=1969098165 TSecr=1715006569"
"545","44.515981","172.66.164.67","100.86.121.59","TLSv1.2","97","Application Data"
"546","44.516025","100.86.121.59","172.66.164.67","TCP","66","53996  >  443 [ACK] Seq=27105 Ack=181837 Win=2044 Len=0 TSval=1969098165 TSecr=1715006569"
"547","44.520177","172.66.164.67","100.86.121.59","TLSv1.2","127","Application Data"
"548","44.520256","100.86.121.59","172.66.164.67","TCP","66","53996  >  443 [ACK] Seq=27105 Ack=181898 Win=2048 Len=0 TSval=1969098170 TSecr=1715006574"
"549","44.520561","172.66.164.67","100.86.121.59","TLSv1.2","290","Application Data"
"550","44.520562","172.66.164.67","100.86.121.59","TLSv1.2","97","Application Data"
"551","44.520612","100.86.121.59","172.66.164.67","TCP","66","53996  >  443 [ACK] Seq=27105 Ack=182153 Win=2045 Len=0 TSval=1969098170 TSecr=1715006574"
"552","44.530534","172.66.164.67","100.86.121.59","TLSv1.2","127","Application Data"
"553","44.530536","172.66.164.67","100.86.121.59","TLSv1.2","290","Application Data"
"554","44.530607","100.86.121.59","172.66.164.67","TCP","66","53996  >  443 [ACK] Seq=27105 Ack=182438 Win=2044 Len=0 TSval=1969098180 TSecr=1715006584"
"555","44.530627","172.66.164.67","100.86.121.59","TLSv1.2","97","Application Data"
"556","44.530663","100.86.121.59","172.66.164.67","TCP","66","53996  >  443 [ACK] Seq=27105 Ack=182469 Win=2044 Len=0 TSval=1969098180 TSecr=1715006584"
"557","44.677880","172.66.164.67","100.86.121.59","TLSv1.2","209","Application Data"
"558","44.677883","172.66.164.67","100.86.121.59","TLSv1.2","108","Application Data"
"559","44.677930","100.86.121.59","172.66.164.67","TCP","66","53996  >  443 [ACK] Seq=27105 Ack=182654 Win=2046 Len=0 TSval=1969098327 TSecr=1715006731"
"560","44.678046","172.66.164.67","100.86.121.59","TLSv1.2","97","Application Data"
"561","44.678096","100.86.121.59","172.66.164.67","TCP","66","53996  >  443 [ACK] Seq=27105 Ack=182685 Win=2048 Len=0 TSval=1969098327 TSecr=1715006731"
"562","44.933202","100.86.121.59","172.66.164.67","TCP","54","[TCP Keep-Alive] 53996  >  443 [ACK] Seq=27104 Ack=182685 Win=2048 Len=0"
"563","44.944162","172.66.164.67","100.86.121.59","TCP","66","[TCP Keep-Alive ACK] 443  >  53996 [ACK] Seq=182685 Ack=27105 Win=17 Len=0 TSval=1715006997 TSecr=1969098327"
"564","49.532225","100.86.121.59","172.66.164.67","TLSv1.2","196","Application Data"
"565","49.532628","100.86.121.59","172.66.164.67","TLSv1.2","198","Application Data"
"566","49.546088","172.66.164.67","100.86.121.59","TCP","66","443  >  53996 [ACK] Seq=182685 Ack=27367 Win=17 Len=0 TSval=1715011599 TSecr=1969103182"
"567","49.569921","172.66.164.67","100.86.121.59","TLSv1.2","150","Application Data"
"568","49.569924","172.66.164.67","100.86.121.59","TLSv1.2","290","Application Data"
"569","49.569927","172.66.164.67","100.86.121.59","TLSv1.2","97","Application Data"
"570","49.570101","100.86.121.59","172.66.164.67","TCP","66","53996  >  443 [ACK] Seq=27367 Ack=183024 Win=2043 Len=0 TSval=1969103219 TSecr=1715011623"
"571","49.570461","172.66.164.67","100.86.121.59","TLSv1.2","127","Application Data"
"572","49.570553","100.86.121.59","172.66.164.67","TCP","66","53996  >  443 [ACK] Seq=27367 Ack=183085 Win=2043 Len=0 TSval=1969103220 TSecr=1715011624"
"573","49.570796","172.66.164.67","100.86.121.59","TLSv1.2","290","Application Data"
"574","49.570800","172.66.164.67","100.86.121.59","TLSv1.2","97","Application Data"
"575","49.570860","100.86.121.59","172.66.164.67","TCP","66","53996  >  443 [ACK] Seq=27367 Ack=183340 Win=2045 Len=0 TSval=1969103220 TSecr=1715011624"
"576","49.573687","100.86.121.59","172.66.164.67","TLSv1.2","101","Application Data"
"577","49.624459","172.66.164.67","100.86.121.59","TCP","66","443  >  53996 [ACK] Seq=183340 Ack=27402 Win=17 Len=0 TSval=1715011678 TSecr=1969103223"
"578","50.007961","100.86.121.59","172.66.164.67","TLSv1.2","409","Application Data"
"579","50.008352","100.86.121.59","172.66.164.67","TLSv1.2","219","Application Data"
"580","50.021287","172.66.164.67","100.86.121.59","TCP","66","443  >  53996 [ACK] Seq=183340 Ack=27898 Win=17 Len=0 TSval=1715012075 TSecr=1969103658"
"581","50.047818","172.66.164.67","100.86.121.59","TLSv1.2","150","Application Data"
"582","50.047822","172.66.164.67","100.86.121.59","TLSv1.2","290","Application Data"
"583","50.047824","172.66.164.67","100.86.121.59","TLSv1.2","97","Application Data"
"584","50.048008","100.86.121.59","172.66.164.67","TCP","66","53996  >  443 [ACK] Seq=27898 Ack=183679 Win=2043 Len=0 TSval=1969103697 TSecr=1715012101"
"585","50.048132","172.66.164.67","100.86.121.59","TLSv1.2","216","Application Data"
"586","50.048134","172.66.164.67","100.86.121.59","TLSv1.2","290","Application Data"
"587","50.048136","172.66.164.67","100.86.121.59","TLSv1.2","97","Application Data"
"588","50.048200","100.86.121.59","172.66.164.67","TCP","66","53996  >  443 [ACK] Seq=27898 Ack=184084 Win=2042 Len=0 TSval=1969103698 TSecr=1715012101"
"589","50.998581","100.86.121.59","172.66.164.67","TLSv1.2","491","Application Data"
"590","51.001774","100.86.121.59","172.66.164.67","TCP","1454","53996  >  443 [ACK] Seq=28323 Ack=184084 Win=2048 Len=1388 TSval=1969104651 TSecr=1715012101 [TCP PDU reassembled in 591]"
"591","51.001823","100.86.121.59","172.66.164.67","TLSv1.2","208","Application Data"
"592","51.012725","172.66.164.67","100.86.121.59","TCP","66","443  >  53996 [ACK] Seq=184084 Ack=29853 Win=17 Len=0 TSval=1715013066 TSecr=1969104648"
"593","51.038294","172.66.164.67","100.86.121.59","TLSv1.2","186","Application Data"
"594","51.038297","172.66.164.67","100.86.121.59","TLSv1.2","290","Application Data"
"595","51.038343","172.66.164.67","100.86.121.59","TLSv1.2","97","Application Data"
"596","51.038472","100.86.121.59","172.66.164.67","TCP","66","53996  >  443 [ACK] Seq=29853 Ack=184428 Win=2043 Len=0 TSval=1969104688 TSecr=1715013091"
"597","51.038546","100.86.121.59","172.66.164.67","TCP","66","53996  >  443 [ACK] Seq=29853 Ack=184459 Win=2043 Len=0 TSval=1969104688 TSecr=1715013092"
"598","51.038757","172.66.164.67","100.86.121.59","TLSv1.2","128","Application Data"
"599","51.038759","172.66.164.67","100.86.121.59","TLSv1.2","108","Application Data"
"600","51.038820","100.86.121.59","172.66.164.67","TCP","66","53996  >  443 [ACK] Seq=29853 Ack=184563 Win=2047 Len=0 TSval=1969104688 TSecr=1715013092"
"601","51.038941","172.66.164.67","100.86.121.59","TLSv1.2","97","Application Data"
"602","51.038982","100.86.121.59","172.66.164.67","TCP","66","53996  >  443 [ACK] Seq=29853 Ack=184594 Win=2047 Len=0 TSval=1969104688 TSecr=1715013092"
"603","54.531658","100.86.121.59","172.66.164.67","TLSv1.2","441","Application Data"
"604","54.532057","100.86.121.59","172.66.164.67","TLSv1.2","223","Application Data"
"605","54.545201","172.66.164.67","100.86.121.59","TCP","66","443  >  53996 [ACK] Seq=184594 Ack=30385 Win=17 Len=0 TSval=1715016598 TSecr=1969108181"
"606","54.552465","100.86.121.59","172.66.164.67","TLSv1.2","218","Application Data"
"607","54.568870","172.66.164.67","100.86.121.59","TLSv1.2","150","Application Data"
"608","54.568874","172.66.164.67","100.86.121.59","TLSv1.2","290","Application Data"
"609","54.569091","100.86.121.59","172.66.164.67","TCP","66","53996  >  443 [ACK] Seq=30537 Ack=184902 Win=2044 Len=0 TSval=1969108218 TSecr=1715016622"
"610","54.569377","172.66.164.67","100.86.121.59","TLSv1.2","97","Application Data"
"611","54.569379","172.66.164.67","100.86.121.59","TLSv1.2","127","Application Data"
"612","54.569457","100.86.121.59","172.66.164.67","TCP","66","53996  >  443 [ACK] Seq=30537 Ack=184994 Win=2047 Len=0 TSval=1969108219 TSecr=1715016623"
"613","54.569623","172.66.164.67","100.86.121.59","TLSv1.2","290","Application Data"
"614","54.569677","100.86.121.59","172.66.164.67","TCP","66","53996  >  443 [ACK] Seq=30537 Ack=185218 Win=2045 Len=0 TSval=1969108219 TSecr=1715016623"
"615","54.569696","172.66.164.67","100.86.121.59","TLSv1.2","97","Application Data"
"616","54.569724","100.86.121.59","172.66.164.67","TCP","66","53996  >  443 [ACK] Seq=30537 Ack=185249 Win=2045 Len=0 TSval=1969108219 TSecr=1715016623"
"617","54.584684","172.66.164.67","100.86.121.59","TLSv1.2","127","Application Data"
"618","54.584687","172.66.164.67","100.86.121.59","TLSv1.2","290","Application Data"
"619","54.584838","100.86.121.59","172.66.164.67","TCP","66","53996  >  443 [ACK] Seq=30537 Ack=185534 Win=2044 Len=0 TSval=1969108234 TSecr=1715016638"
"620","54.585124","172.66.164.67","100.86.121.59","TLSv1.2","97","Application Data"
"621","54.585206","100.86.121.59","172.66.164.67","TCP","66","53996  >  443 [ACK] Seq=30537 Ack=185565 Win=2048 Len=0 TSval=1969108234 TSecr=1715016638"
"622","54.587056","100.86.121.59","172.66.164.67","TLSv1.2","101","Application Data"
"623","54.638454","172.66.164.67","100.86.121.59","TCP","66","443  >  53996 [ACK] Seq=185565 Ack=30572 Win=17 Len=0 TSval=1715016692 TSecr=1969108236"
"624","56.003605","100.86.121.59","172.66.164.67","TLSv1.2","473","Application Data"
"625","56.017038","172.66.164.67","100.86.121.59","TCP","66","443  >  53996 [ACK] Seq=185565 Ack=30979 Win=17 Len=0 TSval=1715018070 TSecr=1969109653"
"626","56.037918","172.66.164.67","100.86.121.59","TLSv1.2","150","Application Data"
"627","56.037922","172.66.164.67","100.86.121.59","TLSv1.2","290","Application Data"
"628","56.037925","172.66.164.67","100.86.121.59","TLSv1.2","97","Application Data"
"629","56.038144","100.86.121.59","172.66.164.67","TCP","66","53996  >  443 [ACK] Seq=30979 Ack=185904 Win=2043 Len=0 TSval=1969109687 TSecr=1715018091"
"630","59.000236","100.86.121.59","172.66.164.67","TCP","1454","53996  >  443 [ACK] Seq=30979 Ack=185904 Win=2048 Len=1388 TSval=1969112649 TSecr=1715018091 [TCP PDU reassembled in 631]"
"631","59.000288","100.86.121.59","172.66.164.67","TLSv1.2","288","Application Data"
"632","59.051088","100.86.121.59","172.66.164.67","TCP","1454","[TCP Retransmission] 53996  >  443 [PSH, ACK] Seq=31201 Ack=185904 Win=2048 Len=1388 TSval=1969112700 TSecr=1715018091 [TCP PDU reassembled in 631]"
"633","59.088941","172.66.164.67","100.86.121.59","TCP","66","443  >  53996 [ACK] Seq=185904 Ack=32589 Win=17 Len=0 TSval=1715021102 TSecr=1969112649"
"634","59.112872","172.66.164.67","100.86.121.59","TLSv1.2","200","Application Data"
"635","59.112875","172.66.164.67","100.86.121.59","TLSv1.2","108","Application Data"
"636","59.112878","172.66.164.67","100.86.121.59","TLSv1.2","97","Application Data"
"637","59.113060","100.86.121.59","172.66.164.67","TCP","66","53996  >  443 [ACK] Seq=32589 Ack=186111 Win=2045 Len=0 TSval=1969112762 TSecr=1715021126"
"638","59.136886","172.66.164.67","100.86.121.59","TCP","78","[TCP Dup ACK 633#1] 443  >  53996 [ACK] Seq=186111 Ack=32589 Win=17 Len=0 TSval=1715021149 TSecr=1969112700 SLE=31201 SRE=32589"
"639","59.136890","172.66.164.67","100.86.121.59","TCP","97","[TCP Spurious Retransmission] 443  >  53996 [PSH, ACK] Seq=186080 Ack=32589 Win=17 Len=31 TSval=1715021151 TSecr=1969112700"
"640","59.137075","100.86.121.59","172.66.164.67","TCP","78","[TCP Dup ACK 637#1] 53996  >  443 [ACK] Seq=32589 Ack=186111 Win=2048 Len=0 TSval=1969112786 TSecr=1715021151 SLE=186080 SRE=186111"
"641","59.451880","100.86.121.59","172.66.164.67","TLSv1.2","523","Application Data"
"642","59.546518","172.66.164.67","100.86.121.59","TCP","66","443  >  53996 [ACK] Seq=186111 Ack=33046 Win=17 Len=0 TSval=1715021558 TSecr=1969113101"
"643","59.572282","172.66.164.67","100.86.121.59","TLSv1.2","136","Application Data"
"644","59.572285","172.66.164.67","100.86.121.59","TLSv1.2","108","Application Data"
"645","59.572435","100.86.121.59","172.66.164.67","TCP","66","53996  >  443 [ACK] Seq=33046 Ack=186223 Win=2047 Len=0 TSval=1969113222 TSecr=1715021587"
"646","59.572810","172.66.164.67","100.86.121.59","TLSv1.2","97","Application Data"
"647","59.572901","100.86.121.59","172.66.164.67","TCP","66","53996  >  443 [ACK] Seq=33046 Ack=186254 Win=2048 Len=0 TSval=1969113222 TSecr=1715021587"
"648","59.621162","172.66.164.67","100.86.121.59","TCP","97","[TCP Spurious Retransmission] 443  >  53996 [PSH, ACK] Seq=186223 Ack=33046 Win=17 Len=31 TSval=1715021633 TSecr=1969113101"
"649","59.621379","100.86.121.59","172.66.164.67","TCP","78","[TCP Dup ACK 647#1] 53996  >  443 [ACK] Seq=33046 Ack=186254 Win=2048 Len=0 TSval=1969113271 TSecr=1715021633 SLE=186223 SRE=186254"
"650","60.003484","100.86.121.59","172.66.164.67","TLSv1.2","564","Application Data"
"651","60.058140","172.66.164.67","100.86.121.59","TLSv1.2","150","Application Data"
"652","60.058144","172.66.164.67","100.86.121.59","TLSv1.2","290","Application Data"
"653","60.058147","172.66.164.67","100.86.121.59","TLSv1.2","97","Application Data"
"654","60.058428","100.86.121.59","172.66.164.67","TCP","66","53996  >  443 [ACK] Seq=33544 Ack=186593 Win=2043 Len=0 TSval=1969113708 TSecr=1715022111"
"655","60.060527","100.86.121.59","172.66.164.67","TLSv1.2","101","Application Data"
"656","60.110609","172.66.164.67","100.86.121.59","TCP","66","443  >  53996 [ACK] Seq=186593 Ack=33579 Win=17 Len=0 TSval=1715022164 TSecr=1969113710"
"657","60.999038","100.86.121.59","172.66.164.67","TCP","1454","53996  >  443 [ACK] Seq=33579 Ack=186593 Win=2048 Len=1388 TSval=1969114648 TSecr=1715022164 [TCP PDU reassembled in 658]"
"658","60.999083","100.86.121.59","172.66.164.67","TLSv1.2","292","Application Data"
"659","60.999449","100.86.121.59","172.66.164.67","TLSv1.2","513","Application Data"
"660","61.011464","172.66.164.67","100.86.121.59","TCP","66","443  >  53996 [ACK] Seq=186593 Ack=35640 Win=17 Len=0 TSval=1715023064 TSecr=1969114649"
"661","61.033770","172.66.164.67","100.86.121.59","TLSv1.2","239","Application Data"
"662","61.033773","172.66.164.67","100.86.121.59","TLSv1.2","290","Application Data"
"663","61.033805","172.66.164.67","100.86.121.59","TLSv1.2","97","Application Data"
"664","61.033909","100.86.121.59","172.66.164.67","TCP","66","53996  >  443 [ACK] Seq=35640 Ack=186990 Win=2042 Len=0 TSval=1969114683 TSecr=1715023087"
"665","61.033971","100.86.121.59","172.66.164.67","TCP","66","53996  >  443 [ACK] Seq=35640 Ack=187021 Win=2042 Len=0 TSval=1969114683 TSecr=1715023087"
"666","61.035902","172.66.164.67","100.86.121.59","TLSv1.2","127","Application Data"
"667","61.035906","172.66.164.67","100.86.121.59","TLSv1.2","290","Application Data"
"668","61.036010","100.86.121.59","172.66.164.67","TCP","66","53996  >  443 [ACK] Seq=35640 Ack=187306 Win=2044 Len=0 TSval=1969114685 TSecr=1715023089"
"669","61.036265","172.66.164.67","100.86.121.59","TLSv1.2","97","Application Data"
"670","61.036326","100.86.121.59","172.66.164.67","TCP","66","53996  >  443 [ACK] Seq=35640 Ack=187337 Win=2044 Len=0 TSval=1969114686 TSecr=1715023089"
