"No.","Time","Source","Destination","Protocol","Length","Info"
"1","0.000000000","100.84.170.161","151.101.2.187","TCP","55","63540  >  443 [ACK] Seq=1 Ack=1 Win=509 Len=1"
"2","0.010717600","151.101.2.187","100.84.170.161","TCP","66","443  >  63540 [ACK] Seq=1 Ack=2 Win=285 Len=0 SLE=1 SRE=2"
"3","6.936638400","100.84.170.161","151.101.2.187","TLSv1.2","1736","Application Data"
"4","6.936759300","100.84.170.161","151.101.2.187","TLSv1.2","93","Application Data"
"5","6.945667600","151.101.2.187","100.84.170.161","TCP","56","443  >  55283 [ACK] Seq=1 Ack=1722 Win=3239 Len=0"
"6","6.946203100","151.101.2.187","100.84.170.161","TLSv1.2","93","Application Data"
"7","6.946516300","100.84.170.161","151.101.2.187","TLSv1.2","1033","Application Data"
"8","6.947353700","100.84.170.161","151.101.2.187","TLSv1.2","1698","Application Data"
"9","6.948713700","151.101.2.187","100.84.170.161","TLSv1.2","240","Application Data"
"10","6.955676400","151.101.2.187","100.84.170.161","TCP","56","443  >  55283 [ACK] Seq=226 Ack=2701 Win=3244 Len=0"
"11","6.956580300","151.101.2.187","100.84.170.161","TCP","56","443  >  55283 [ACK] Seq=226 Ack=4345 Win=3250 Len=0"
"12","6.957059700","100.84.170.161","151.101.2.187","TLSv1.2","1027","Application Data"
"13","6.958408900","151.101.2.187","100.84.170.161","TLSv1.2","213","Application Data"
"14","6.958467000","100.84.170.161","151.101.2.187","TCP","54","55283  >  443 [ACK] Seq=5318 Ack=385 Win=513 Len=0"
"15","6.958694600","151.101.2.187","100.84.170.161","TLSv1.2","131","Application Data"
"16","6.958738700","100.84.170.161","151.101.2.187","TCP","54","55283  >  443 [ACK] Seq=5318 Ack=462 Win=512 Len=0"
"17","6.966264100","151.101.2.187","100.84.170.161","TCP","56","443  >  55283 [ACK] Seq=462 Ack=5318 Win=3256 Len=0"
"18","6.968732500","151.101.2.187","100.84.170.161","TLSv1.2","103","Application Data"
"19","6.983849500","100.84.170.161","151.101.2.187","TLSv1.2","1698","Application Data"
"20","6.992665900","151.101.2.187","100.84.170.161","TCP","56","443  >  55283 [ACK] Seq=511 Ack=6962 Win=3262 Len=0"
"21","6.995305000","151.101.2.187","100.84.170.161","TLSv1.2","130","Application Data"
"22","7.012590400","100.84.170.161","151.101.2.187","TLSv1.2","990","Application Data"
"23","7.021368900","151.101.2.187","100.84.170.161","TCP","56","443  >  55283 [ACK] Seq=587 Ack=7898 Win=3267 Len=0"
"24","7.024474900","151.101.2.187","100.84.170.161","TLSv1.2","300","Application Data"
"25","7.024722200","151.101.2.187","100.84.170.161","TLSv1.2","273","Application Data"
"26","7.024788900","100.84.170.161","151.101.2.187","TCP","54","55283  >  443 [ACK] Seq=7898 Ack=1052 Win=510 Len=0"
"27","7.027238300","100.84.170.161","151.101.2.187","TLSv1.2","89","Application Data"
"28","7.035678800","151.101.2.187","100.84.170.161","TCP","56","443  >  55283 [ACK] Seq=1052 Ack=7933 Win=3267 Len=0"
"29","7.079530700","100.84.170.161","151.101.2.187","TLSv1.2","1718","Application Data"
"30","7.087669300","100.84.170.161","151.101.2.187","TLSv1.2","1041","Application Data"
"31","7.088958100","151.101.2.187","100.84.170.161","TCP","56","443  >  55283 [ACK] Seq=1052 Ack=9597 Win=3273 Len=0"
"32","7.092092300","151.101.2.187","100.84.170.161","TLSv1.2","130","Application Data"
"33","7.096514000","151.101.2.187","100.84.170.161","TCP","56","443  >  55283 [ACK] Seq=1128 Ack=10584 Win=3279 Len=0"
"34","7.099290000","151.101.2.187","100.84.170.161","TLSv1.2","130","Application Data"
"35","7.099355200","100.84.170.161","151.101.2.187","TCP","54","55283  >  443 [ACK] Seq=10584 Ack=1204 Win=510 Len=0"
"36","7.127448100","100.84.170.161","151.101.2.187","TLSv1.2","1712","Application Data"
"37","7.136972500","151.101.2.187","100.84.170.161","TCP","56","443  >  55283 [ACK] Seq=1204 Ack=12242 Win=3284 Len=0"
"38","7.139590700","151.101.2.187","100.84.170.161","TLSv1.2","130","Application Data"
"39","7.173309600","151.101.2.187","100.84.170.161","TCP","130","[TCP Retransmission] 443  >  55283 [PSH, ACK] Seq=1204 Ack=12242 Win=3284 Len=76"
"40","7.173363800","100.84.170.161","151.101.2.187","TCP","66","55283  >  443 [ACK] Seq=12242 Ack=1280 Win=509 Len=0 SLE=1204 SRE=1280"
"41","7.416102300","100.84.170.161","151.101.2.187","TLSv1.2","1036","Application Data"
"42","7.437570100","151.101.2.187","100.84.170.161","TCP","56","443  >  55283 [ACK] Seq=1280 Ack=13224 Win=3290 Len=0"
"43","7.440775500","151.101.2.187","100.84.170.161","TLSv1.2","241","Application Data"
"44","7.475353700","151.101.2.187","100.84.170.161","TCP","241","[TCP Retransmission] 443  >  55283 [PSH, ACK] Seq=1280 Ack=13224 Win=3290 Len=187"
"45","7.475412800","100.84.170.161","151.101.2.187","TCP","66","55283  >  443 [ACK] Seq=13224 Ack=1467 Win=509 Len=0 SLE=1280 SRE=1467"
"46","7.761011500","100.84.170.161","151.101.2.187","TLSv1.2","2026","Application Data"
"47","7.769743900","151.101.2.187","100.84.170.161","TCP","56","443  >  55283 [ACK] Seq=1467 Ack=15196 Win=3296 Len=0"
"48","7.773053300","151.101.2.187","100.84.170.161","TLSv1.2","130","Application Data"
"49","7.778092200","100.84.170.161","151.101.2.187","TLSv1.2","717","Application Data"
"50","7.779665600","100.84.170.161","151.101.2.187","TLSv1.2","2030","Application Data"
"51","7.779861000","100.84.170.161","151.101.2.187","TLSv1.2","708","Application Data"
"52","7.787041300","151.101.2.187","100.84.170.161","TCP","56","443  >  55283 [ACK] Seq=1543 Ack=15859 Win=3296 Len=0"
"53","7.788478500","151.101.2.187","100.84.170.161","TCP","56","443  >  55283 [ACK] Seq=1543 Ack=17835 Win=3301 Len=0"
"54","7.788723400","151.101.2.187","100.84.170.161","TCP","56","443  >  55283 [ACK] Seq=1543 Ack=18489 Win=3301 Len=0"
"55","7.789839000","151.101.2.187","100.84.170.161","TLSv1.2","130","Application Data"
"56","7.791836800","151.101.2.187","100.84.170.161","TLSv1.2","268","Application Data"
"57","7.791895800","100.84.170.161","151.101.2.187","TCP","54","55283  >  443 [ACK] Seq=18489 Ack=1833 Win=507 Len=0"
"58","13.840299600","100.84.170.161","151.101.2.187","TLSv1.2","2034","Application Data"
"59","13.842547300","100.84.170.161","151.101.2.187","TLSv1.2","717","Application Data"
"60","13.853774200","100.84.170.161","151.101.2.187","TLSv1.2","2040","Application Data"
"61","13.858767000","100.84.170.161","151.101.2.187","TLSv1.2","726","Application Data"
"62","13.859078600","151.101.2.187","100.84.170.161","TCP","56","443  >  55283 [ACK] Seq=1833 Ack=21132 Win=3307 Len=0"
"63","13.861201300","151.101.2.187","100.84.170.161","TLSv1.2","213","Application Data"
"64","13.861263400","100.84.170.161","151.101.2.187","TCP","54","55283  >  443 [ACK] Seq=23790 Ack=1992 Win=513 Len=0"
"65","13.861514100","151.101.2.187","100.84.170.161","TLSv1.2","131","Application Data"
"66","13.861549800","100.84.170.161","151.101.2.187","TCP","54","55283  >  443 [ACK] Seq=23790 Ack=2069 Win=512 Len=0"
"67","13.862659200","151.101.2.187","100.84.170.161","TCP","56","443  >  55283 [ACK] Seq=2069 Ack=23118 Win=3313 Len=0"
"68","13.865396200","151.101.2.187","100.84.170.161","TLSv1.2","130","Application Data"
"69","13.867910500","151.101.2.187","100.84.170.161","TCP","56","443  >  55283 [ACK] Seq=2145 Ack=23790 Win=3313 Len=0"
"70","13.870435400","151.101.2.187","100.84.170.161","TLSv1.2","256","Application Data"
"71","13.870551200","100.84.170.161","151.101.2.187","TCP","54","55283  >  443 [ACK] Seq=23790 Ack=2347 Win=511 Len=0"
"72","14.164462300","100.84.170.161","151.101.2.187","TLSv1.2","2026","Application Data"
"73","14.187406600","100.84.170.161","151.101.2.187","TCP","1514","[TCP Retransmission] 55283  >  443 [PSH, ACK] Seq=24302 Ack=2347 Win=511 Len=1460"
"74","14.201709000","151.101.2.187","100.84.170.161","TCP","56","443  >  55283 [ACK] Seq=2347 Ack=25762 Win=3319 Len=0"
"75","14.202042400","151.101.2.187","100.84.170.161","TCP","66","[TCP Dup ACK 74#1] 443  >  55283 [ACK] Seq=2347 Ack=25762 Win=3319 Len=0 SLE=24302 SRE=25762"
"76","14.204693500","151.101.2.187","100.84.170.161","TLSv1.2","130","Application Data"
"77","14.246456500","100.84.170.161","151.101.2.187","TCP","54","55283  >  443 [ACK] Seq=25762 Ack=2423 Win=511 Len=0"
"78","14.262242100","151.101.2.187","100.84.170.161","TCP","130","[TCP Spurious Retransmission] 443  >  55283 [PSH, ACK] Seq=2347 Ack=25762 Win=3319 Len=76"
"79","14.262354500","100.84.170.161","151.101.2.187","TCP","66","[TCP Dup ACK 77#1] 55283  >  443 [ACK] Seq=25762 Ack=2423 Win=511 Len=0 SLE=2347 SRE=2423"
"80","17.853104500","100.84.170.161","151.101.2.187","TCP","55","56939  >  443 [ACK] Seq=1 Ack=1 Win=508 Len=1"
"81","17.899761900","151.101.2.187","100.84.170.161","TCP","66","443  >  56939 [ACK] Seq=1 Ack=2 Win=285 Len=0 SLE=1 SRE=2"
"82","23.111653400","100.84.170.161","151.101.2.187","TLSv1.2","726","Application Data"
"83","23.120916500","151.101.2.187","100.84.170.161","TCP","56","443  >  55283 [ACK] Seq=2423 Ack=26434 Win=3319 Len=0"
"84","23.124523700","151.101.2.187","100.84.170.161","TLSv1.2","213","Application Data"
"85","23.155405700","151.101.2.187","100.84.170.161","TCP","213","[TCP Retransmission] 443  >  55283 [PSH, ACK] Seq=2423 Ack=26434 Win=3319 Len=159"
"86","23.155445300","100.84.170.161","151.101.2.187","TCP","66","55283  >  443 [ACK] Seq=26434 Ack=2582 Win=510 Len=0 SLE=2423 SRE=2582"
"87","31.491849900","100.84.170.161","151.101.2.187","TLSv1.2","2039","Application Data"
"88","31.501232600","151.101.2.187","100.84.170.161","TCP","56","443  >  55283 [ACK] Seq=2582 Ack=28419 Win=3324 Len=0"
"89","31.505687000","151.101.2.187","100.84.170.161","TLSv1.2","240","Application Data"
"90","31.513843300","100.84.170.161","151.101.2.187","TLSv1.2","738","Application Data"
"91","31.523676800","151.101.2.187","100.84.170.161","TCP","56","443  >  55283 [ACK] Seq=2768 Ack=29103 Win=3324 Len=0"
"92","31.527409500","151.101.2.187","100.84.170.161","TLSv1.2","131","Application Data"
"93","31.560826600","151.101.2.187","100.84.170.161","TCP","131","[TCP Retransmission] 443  >  55283 [PSH, ACK] Seq=2768 Ack=29103 Win=3324 Len=77"
"94","31.560870600","100.84.170.161","151.101.2.187","TCP","66","55283  >  443 [ACK] Seq=29103 Ack=2845 Win=509 Len=0 SLE=2768 SRE=2845"
"95","31.750893000","100.84.170.161","151.101.2.187","TLSv1.2","2040","Application Data"
"96","31.763090100","151.101.2.187","100.84.170.161","TCP","56","443  >  55283 [ACK] Seq=2845 Ack=31089 Win=3330 Len=0"
"97","31.764307000","151.101.2.187","100.84.170.161","TLSv1.2","103","Application Data"
"98","31.796657100","151.101.2.187","100.84.170.161","TCP","103","[TCP Retransmission] 443  >  55283 [PSH, ACK] Seq=2845 Ack=31089 Win=3330 Len=49"
"99","31.796709300","100.84.170.161","151.101.2.187","TCP","66","55283  >  443 [ACK] Seq=31089 Ack=2894 Win=509 Len=0 SLE=2845 SRE=2894"
"100","35.409378400","100.84.170.161","151.101.2.187","TLSv1.2","726","Application Data"
"101","35.418180700","151.101.2.187","100.84.170.161","TCP","56","443  >  55283 [ACK] Seq=2894 Ack=31761 Win=3330 Len=0"
"102","35.422122200","151.101.2.187","100.84.170.161","TLSv1.2","323","Application Data"
"103","35.452303800","151.101.2.187","100.84.170.161","TCP","323","[TCP Retransmission] 443  >  55283 [PSH, ACK] Seq=2894 Ack=31761 Win=3330 Len=269"
"104","35.452337200","100.84.170.161","151.101.2.187","TCP","66","55283  >  443 [ACK] Seq=31761 Ack=3163 Win=508 Len=0 SLE=2894 SRE=3163"
"105","35.520755600","100.84.170.161","151.101.2.187","TLSv1.2","2028","Application Data"
"106","35.537678100","151.101.2.187","100.84.170.161","TCP","56","443  >  55283 [ACK] Seq=3163 Ack=33735 Win=3336 Len=0"
"107","35.537678100","151.101.2.187","100.84.170.161","TLSv1.2","130","Application Data"
"108","35.537675300","100.84.170.161","151.101.2.187","TCP","1514","[TCP Spurious Retransmission] 55283  >  443 [PSH, ACK] Seq=32275 Ack=3163 Win=508 Len=1460"
"109","35.547217200","151.101.2.187","100.84.170.161","TCP","66","[TCP Dup ACK 106#1] 443  >  55283 [ACK] Seq=3239 Ack=33735 Win=3336 Len=0 SLE=32275 SRE=33735"
"110","35.556611400","100.84.170.161","151.101.2.187","TLSv1.2","708","Application Data"
"111","35.569738900","151.101.2.187","100.84.170.161","TCP","130","[TCP Spurious Retransmission] 443  >  55283 [PSH, ACK] Seq=3163 Ack=33735 Win=3336 Len=76"
"112","35.569738900","151.101.2.187","100.84.170.161","TCP","56","443  >  55283 [ACK] Seq=3239 Ack=34389 Win=3336 Len=0"
"113","35.569738900","151.101.2.187","100.84.170.161","TLSv1.2","130","Application Data"
"114","35.569779600","100.84.170.161","151.101.2.187","TCP","66","[TCP Dup ACK 110#1] 55283  >  443 [ACK] Seq=34389 Ack=3239 Win=508 Len=0 SLE=3163 SRE=3239"
"115","35.600828400","151.101.2.187","100.84.170.161","TCP","130","[TCP Retransmission] 443  >  55283 [PSH, ACK] Seq=3239 Ack=34389 Win=3336 Len=76"
"116","35.600871200","100.84.170.161","151.101.2.187","TCP","66","55283  >  443 [ACK] Seq=34389 Ack=3315 Win=508 Len=0 SLE=3239 SRE=3315"
"117","38.236889800","100.84.170.161","151.101.2.187","TLSv1.2","2034","Application Data"
"118","38.237083800","100.84.170.161","151.101.2.187","TLSv1.2","718","Application Data"
"119","38.250355200","151.101.2.187","100.84.170.161","TCP","56","443  >  55283 [ACK] Seq=3315 Ack=37033 Win=3341 Len=0"
"120","38.250692700","151.101.2.187","100.84.170.161","TLSv1.2","241","Application Data"
"121","38.251014600","151.101.2.187","100.84.170.161","TLSv1.2","257","Application Data"
"122","38.251048300","100.84.170.161","151.101.2.187","TCP","54","55283  >  443 [ACK] Seq=37033 Ack=3705 Win=513 Len=0"
"123","38.299654400","100.84.170.161","151.101.2.187","TLSv1.2","2028","Application Data"
"124","38.299831300","100.84.170.161","151.101.2.187","TLSv1.2","706","Application Data"
"125","38.311416600","151.101.2.187","100.84.170.161","TCP","56","443  >  55283 [ACK] Seq=3705 Ack=39659 Win=3347 Len=0"
"126","38.312897300","151.101.2.187","100.84.170.161","TLSv1.2","184","Application Data"
"127","38.343838300","151.101.2.187","100.84.170.161","TCP","184","[TCP Retransmission] 443  >  55283 [PSH, ACK] Seq=3705 Ack=39659 Win=3347 Len=130"
"128","38.343875200","100.84.170.161","151.101.2.187","TCP","66","55283  >  443 [ACK] Seq=39659 Ack=3835 Win=512 Len=0 SLE=3705 SRE=3835"
"129","40.837183600","100.84.170.161","151.101.2.187","TLSv1.2","2039","Application Data"
"130","40.846103000","151.101.2.187","100.84.170.161","TCP","56","443  >  55283 [ACK] Seq=3835 Ack=41644 Win=3353 Len=0"
"131","40.848363300","151.101.2.187","100.84.170.161","TLSv1.2","240","Application Data"
"132","40.880164600","151.101.2.187","100.84.170.161","TCP","240","[TCP Retransmission] 443  >  55283 [PSH, ACK] Seq=3835 Ack=41644 Win=3353 Len=186"
"133","40.880210200","100.84.170.161","151.101.2.187","TCP","66","55283  >  443 [ACK] Seq=41644 Ack=4021 Win=512 Len=0 SLE=3835 SRE=4021"
"134","40.886598700","100.84.170.161","151.101.2.187","TLSv1.2","718","Application Data"
"135","40.895384400","151.101.2.187","100.84.170.161","TCP","56","443  >  55283 [ACK] Seq=4021 Ack=42308 Win=3353 Len=0"
"136","40.906435300","151.101.2.187","100.84.170.161","TLSv1.2","103","Application Data"
"137","40.937007400","151.101.2.187","100.84.170.161","TCP","103","[TCP Retransmission] 443  >  55283 [PSH, ACK] Seq=4021 Ack=42308 Win=3353 Len=49"
"138","40.937061800","100.84.170.161","151.101.2.187","TCP","66","55283  >  443 [ACK] Seq=42308 Ack=4070 Win=511 Len=0 SLE=4021 SRE=4070"
"139","41.136844900","100.84.170.161","151.101.2.187","TLSv1.2","2005","Application Data"
"140","41.151417600","151.101.2.187","100.84.170.161","TCP","56","443  >  55283 [ACK] Seq=4070 Ack=44259 Win=3358 Len=0"
"141","41.158947500","151.101.2.187","100.84.170.161","TLSv1.2","129","Application Data"
"142","41.208001800","100.84.170.161","151.101.2.187","TCP","54","55283  >  443 [ACK] Seq=44259 Ack=4145 Win=511 Len=0"
"143","41.209414100","151.101.2.187","100.84.170.161","TCP","129","[TCP Spurious Retransmission] 443  >  55283 [PSH, ACK] Seq=4070 Ack=44259 Win=3358 Len=75"
"144","41.209479900","100.84.170.161","151.101.2.187","TCP","66","[TCP Dup ACK 142#1] 55283  >  443 [ACK] Seq=44259 Ack=4145 Win=511 Len=0 SLE=4070 SRE=4145"
"145","43.024030600","100.84.170.161","151.101.2.187","TLSv1.2","1045","Application Data"
"146","43.034434700","151.101.2.187","100.84.170.161","TCP","56","443  >  55283 [ACK] Seq=4145 Ack=45250 Win=3364 Len=0"
"147","43.040858100","151.101.2.187","100.84.170.161","TLSv1.2","213","Application Data"
"148","43.059578300","100.84.170.161","151.101.2.187","TLSv1.2","1615","Application Data"
"149","43.068515500","151.101.2.187","100.84.170.161","TCP","56","443  >  55283 [ACK] Seq=4304 Ack=46811 Win=3370 Len=0"
"150","43.071517100","151.101.2.187","100.84.170.161","TLSv1.2","186","Application Data"
"151","43.105163700","151.101.2.187","100.84.170.161","TCP","186","[TCP Retransmission] 443  >  55283 [PSH, ACK] Seq=4304 Ack=46811 Win=3370 Len=132"
"152","43.105221600","100.84.170.161","151.101.2.187","TCP","66","55283  >  443 [ACK] Seq=46811 Ack=4436 Win=510 Len=0 SLE=4304 SRE=4436"
"153","43.579024700","100.84.170.161","151.101.2.187","TLSv1.2","1058","Application Data"
"154","43.589935400","151.101.2.187","100.84.170.161","TCP","56","443  >  55283 [ACK] Seq=4436 Ack=47815 Win=3376 Len=0"
"155","43.592418200","151.101.2.187","100.84.170.161","TLSv1.2","241","Application Data"
"156","43.627137400","151.101.2.187","100.84.170.161","TCP","241","[TCP Retransmission] 443  >  55283 [PSH, ACK] Seq=4436 Ack=47815 Win=3376 Len=187"
"157","43.627175200","100.84.170.161","151.101.2.187","TCP","66","55283  >  443 [ACK] Seq=47815 Ack=4623 Win=509 Len=0 SLE=4436 SRE=4623"
"158","43.816339800","100.84.170.161","151.101.2.187","TLSv1.2","1647","Application Data"
"159","43.816598200","100.84.170.161","151.101.2.187","TLSv1.2","1020","Application Data"
"160","43.826561300","151.101.2.187","100.84.170.161","TCP","56","443  >  55283 [ACK] Seq=4623 Ack=50374 Win=3387 Len=0"
"161","43.829491000","151.101.2.187","100.84.170.161","TLSv1.2","130","Application Data"
"162","43.829817100","151.101.2.187","100.84.170.161","TLSv1.2","103","Application Data"
"163","43.829844500","100.84.170.161","151.101.2.187","TCP","54","55283  >  443 [ACK] Seq=50374 Ack=4748 Win=509 Len=0"
"164","44.110180400","100.84.170.161","151.101.2.187","TLSv1.2","1658","Application Data"
"165","44.112203800","100.84.170.161","151.101.2.187","TLSv1.2","1028","Application Data"
"166","44.113851000","100.84.170.161","151.101.2.187","TLSv1.2","1640","Application Data"
"167","44.114419000","100.84.170.161","151.101.2.187","TLSv1.2","1041","Application Data"
"168","44.119372700","151.101.2.187","100.84.170.161","TCP","56","443  >  55283 [ACK] Seq=4748 Ack=51978 Win=3393 Len=0"
"169","44.121255500","151.101.2.187","100.84.170.161","TCP","56","443  >  55283 [ACK] Seq=4748 Ack=52952 Win=3398 Len=0"
"170","44.122798700","151.101.2.187","100.84.170.161","TLSv1.2","103","Application Data"
"171","44.123071600","151.101.2.187","100.84.170.161","TCP","56","443  >  55283 [ACK] Seq=4797 Ack=54538 Win=3404 Len=0"
"172","44.123709400","151.101.2.187","100.84.170.161","TCP","56","443  >  55283 [ACK] Seq=4797 Ack=55525 Win=3410 Len=0"
"173","44.125540400","151.101.2.187","100.84.170.161","TLSv1.2","257","Application Data"
"174","44.125593600","100.84.170.161","151.101.2.187","TCP","54","55283  >  443 [ACK] Seq=55525 Ack=5000 Win=508 Len=0"
"175","44.125908600","151.101.2.187","100.84.170.161","TLSv1.2","130","Application Data"
"176","44.126530500","151.101.2.187","100.84.170.161","TLSv1.2","130","Application Data"
"177","44.126576800","100.84.170.161","151.101.2.187","TCP","54","55283  >  443 [ACK] Seq=55525 Ack=5152 Win=507 Len=0"
"178","44.254546700","100.84.170.161","151.101.2.187","TLSv1.2","1662","Application Data"
"179","44.269687800","100.84.170.161","151.101.2.187","TLSv1.2","1035","Application Data"
"180","44.274297000","151.101.2.187","100.84.170.161","TCP","56","443  >  55283 [ACK] Seq=5152 Ack=57133 Win=3416 Len=0"
"181","44.277267500","151.101.2.187","100.84.170.161","TLSv1.2","130","Application Data"
"182","44.277324700","100.84.170.161","151.101.2.187","TCP","54","55283  >  443 [ACK] Seq=58114 Ack=5228 Win=513 Len=0"
"183","44.279027200","151.101.2.187","100.84.170.161","TCP","56","443  >  55283 [ACK] Seq=5228 Ack=58114 Win=3421 Len=0"
"184","44.282098400","151.101.2.187","100.84.170.161","TLSv1.2","130","Application Data"
"185","44.282173000","100.84.170.161","151.101.2.187","TCP","54","55283  >  443 [ACK] Seq=58114 Ack=5304 Win=512 Len=0"
"186","44.330384100","100.84.170.161","151.101.2.187","TLSv1.2","1650","Application Data"
"187","44.330554600","100.84.170.161","151.101.2.187","TLSv1.2","1003","Application Data"
"188","44.340533500","151.101.2.187","100.84.170.161","TCP","56","443  >  55283 [ACK] Seq=5304 Ack=60659 Win=3433 Len=0"
"189","44.343410300","151.101.2.187","100.84.170.161","TLSv1.2","240","Application Data"
"190","44.344085600","151.101.2.187","100.84.170.161","TLSv1.2","130","Application Data"
"191","44.344167400","100.84.170.161","151.101.2.187","TCP","54","55283  >  443 [ACK] Seq=60659 Ack=5566 Win=511 Len=0"
"192","44.424202600","100.84.170.161","151.101.2.187","TLSv1.2","1726","Application Data"
"193","44.425719000","100.84.170.161","151.101.2.187","TLSv1.2","953","Application Data"
"194","44.435506100","151.101.2.187","100.84.170.161","TCP","56","443  >  55283 [ACK] Seq=5566 Ack=62331 Win=3438 Len=0"
"195","44.435830900","151.101.2.187","100.84.170.161","TCP","56","443  >  55283 [ACK] Seq=5566 Ack=63230 Win=3444 Len=0"
"196","44.440752000","151.101.2.187","100.84.170.161","TLSv1.2","213","Application Data"
"197","44.441090500","151.101.2.187","100.84.170.161","TLSv1.2","129","Application Data"
"198","44.441125800","100.84.170.161","151.101.2.187","TCP","54","55283  >  443 [ACK] Seq=63230 Ack=5800 Win=511 Len=0"
"199","45.016932300","100.84.170.161","151.101.2.187","TCP","55","[TCP Keep-Alive] 63540  >  443 [ACK] Seq=1 Ack=1 Win=509 Len=1"
"200","45.027998600","151.101.2.187","100.84.170.161","TCP","66","[TCP Keep-Alive ACK] 443  >  63540 [ACK] Seq=1 Ack=2 Win=285 Len=0 SLE=1 SRE=2"
"201","47.078987000","100.84.170.161","151.101.2.187","TLSv1.2","1935","Application Data"
"202","47.088949900","151.101.2.187","100.84.170.161","TCP","56","443  >  55283 [ACK] Seq=5800 Ack=65111 Win=3450 Len=0"
"203","47.091705600","151.101.2.187","100.84.170.161","TLSv1.2","213","Application Data"
"204","47.103688400","100.84.170.161","151.101.2.187","TLSv1.2","717","Application Data"
"205","47.112551400","151.101.2.187","100.84.170.161","TCP","56","443  >  55283 [ACK] Seq=5959 Ack=65774 Win=3450 Len=0"
"206","47.115286700","151.101.2.187","100.84.170.161","TLSv1.2","130","Application Data"
"207","47.145122600","151.101.2.187","100.84.170.161","TCP","130","[TCP Retransmission] 443  >  55283 [PSH, ACK] Seq=5959 Ack=65774 Win=3450 Len=76"
"208","47.145163100","100.84.170.161","151.101.2.187","TCP","66","55283  >  443 [ACK] Seq=65774 Ack=6035 Win=510 Len=0 SLE=5959 SRE=6035"
"209","47.555884600","100.84.170.161","151.101.2.187","TLSv1.2","1932","Application Data"
"210","47.564833600","151.101.2.187","100.84.170.161","TCP","56","443  >  55283 [ACK] Seq=6035 Ack=67652 Win=3455 Len=0"
"211","47.567924800","151.101.2.187","100.84.170.161","TLSv1.2","368","Application Data"
"212","47.597281600","151.101.2.187","100.84.170.161","TCP","368","[TCP Retransmission] 443  >  55283 [PSH, ACK] Seq=6035 Ack=67652 Win=3455 Len=314"
"213","47.597317800","100.84.170.161","151.101.2.187","TCP","66","55283  >  443 [ACK] Seq=67652 Ack=6349 Win=508 Len=0 SLE=6035 SRE=6349"
"214","47.856014400","100.84.170.161","151.101.2.187","TLSv1.2","804","Application Data"
"215","47.856175700","100.84.170.161","151.101.2.187","TLSv1.2","1848","Application Data"
"216","47.865520300","151.101.2.187","100.84.170.161","TCP","56","443  >  55283 [ACK] Seq=6349 Ack=70196 Win=3467 Len=0"
"217","47.889366700","151.101.2.187","100.84.170.161","TLSv1.2","183","Application Data"
"218","47.916204100","151.101.2.187","100.84.170.161","TCP","183","[TCP Retransmission] 443  >  55283 [PSH, ACK] Seq=6349 Ack=70196 Win=3467 Len=129"
"219","47.916248600","100.84.170.161","151.101.2.187","TCP","66","55283  >  443 [ACK] Seq=70196 Ack=6478 Win=508 Len=0 SLE=6349 SRE=6478"
"220","48.008316400","100.84.170.161","151.101.2.187","TLSv1.2","805","Application Data"
"221","48.008461600","100.84.170.161","151.101.2.187","TLSv1.2","1857","Application Data"
"222","48.008833900","100.84.170.161","151.101.2.187","TLSv1.2","787","Application Data"
"223","48.013233700","100.84.170.161","151.101.2.187","TLSv1.2","1870","Application Data"
"224","48.017054200","151.101.2.187","100.84.170.161","TCP","56","443  >  55283 [ACK] Seq=6478 Ack=70947 Win=3473 Len=0"
"225","48.017475900","151.101.2.187","100.84.170.161","TCP","56","443  >  55283 [ACK] Seq=6478 Ack=72750 Win=3478 Len=0"
"226","48.018716300","151.101.2.187","100.84.170.161","TCP","56","443  >  55283 [ACK] Seq=6478 Ack=73483 Win=3484 Len=0"
"227","48.020666500","151.101.2.187","100.84.170.161","TLSv1.2","103","Application Data"
"228","48.020858300","151.101.2.187","100.84.170.161","TLSv1.2","130","Application Data"
"229","48.020887200","100.84.170.161","151.101.2.187","TCP","54","55283  >  443 [ACK] Seq=75299 Ack=6603 Win=507 Len=0"
"230","48.021175000","151.101.2.187","100.84.170.161","TLSv1.2","130","Application Data"
"231","48.021993300","151.101.2.187","100.84.170.161","TCP","56","443  >  55283 [ACK] Seq=6679 Ack=75299 Win=3490 Len=0"
"232","48.025066100","151.101.2.187","100.84.170.161","TLSv1.2","130","Application Data"
"233","48.025143900","100.84.170.161","151.101.2.187","TCP","54","55283  >  443 [ACK] Seq=75299 Ack=6755 Win=513 Len=0"
"234","48.124949200","100.84.170.161","151.101.2.187","TLSv1.2","800","Application Data"
"235","48.134822100","151.101.2.187","100.84.170.161","TCP","56","443  >  55283 [ACK] Seq=6755 Ack=76045 Win=3495 Len=0"
"236","48.137608200","151.101.2.187","100.84.170.161","TLSv1.2","130","Application Data"
"237","48.165085000","151.101.2.187","100.84.170.161","TCP","130","[TCP Retransmission] 443  >  55283 [PSH, ACK] Seq=6755 Ack=76045 Win=3495 Len=76"
"238","48.165122800","100.84.170.161","151.101.2.187","TCP","66","55283  >  443 [ACK] Seq=76045 Ack=6831 Win=512 Len=0 SLE=6755 SRE=6831"
"239","48.189896400","100.84.170.161","151.101.2.187","TLSv1.2","1868","Application Data"
"240","48.191186600","100.84.170.161","151.101.2.187","TLSv1.2","751","Application Data"
"241","48.199203000","151.101.2.187","100.84.170.161","TCP","56","443  >  55283 [ACK] Seq=6831 Ack=77859 Win=3501 Len=0"
"242","48.200063000","151.101.2.187","100.84.170.161","TCP","56","443  >  55283 [ACK] Seq=6831 Ack=78556 Win=3501 Len=0"
"243","48.202823800","151.101.2.187","100.84.170.161","TLSv1.2","213","Application Data"
"244","48.203361700","151.101.2.187","100.84.170.161","TLSv1.2","130","Application Data"
"245","48.203412600","100.84.170.161","151.101.2.187","TCP","54","55283  >  443 [ACK] Seq=78556 Ack=7066 Win=512 Len=0"
"246","48.336950000","100.84.170.161","151.101.2.187","TLSv1.2","1935","Application Data"
"247","48.339696600","100.84.170.161","151.101.2.187","TLSv1.2","703","Application Data"
"248","48.345656200","151.101.2.187","100.84.170.161","TCP","56","443  >  55283 [ACK] Seq=7066 Ack=80437 Win=3507 Len=0"
"249","48.348380000","151.101.2.187","100.84.170.161","TCP","56","443  >  55283 [ACK] Seq=7066 Ack=81086 Win=3507 Len=0"
"250","48.352351700","151.101.2.187","100.84.170.161","TLSv1.2","240","Application Data"
"251","48.352896300","151.101.2.187","100.84.170.161","TLSv1.2","174","Application Data"
"252","48.352984300","100.84.170.161","151.101.2.187","TCP","54","55283  >  443 [ACK] Seq=81086 Ack=7372 Win=510 Len=0"
"253","48.391727200","100.84.170.161","151.101.2.187","TLSv1.2","1935","Application Data"
"254","48.394960200","100.84.170.161","151.101.2.187","TLSv1.2","726","Application Data"
"255","48.401056200","151.101.2.187","100.84.170.161","TCP","56","443  >  55283 [ACK] Seq=7372 Ack=82967 Win=3512 Len=0"
"256","48.402892300","151.101.2.187","100.84.170.161","TLSv1.2","214","Application Data"
"257","48.403672400","151.101.2.187","100.84.170.161","TCP","56","443  >  55283 [ACK] Seq=7532 Ack=83639 Win=3512 Len=0"
"258","48.406211100","151.101.2.187","100.84.170.161","TLSv1.2","131","Application Data"
"259","48.406271200","100.84.170.161","151.101.2.187","TCP","54","55283  >  443 [ACK] Seq=83639 Ack=7609 Win=509 Len=0"
"260","48.439375600","100.84.170.161","151.101.2.187","TLSv1.2","1936","Application Data"
"261","48.440587200","100.84.170.161","151.101.2.187","TLSv1.2","720","Application Data"
"262","48.448084400","151.101.2.187","100.84.170.161","TCP","56","443  >  55283 [ACK] Seq=7609 Ack=85521 Win=3518 Len=0"
"263","48.449253000","151.101.2.187","100.84.170.161","TCP","56","443  >  55283 [ACK] Seq=7609 Ack=86187 Win=3518 Len=0"
"264","48.452120600","151.101.2.187","100.84.170.161","TLSv1.2","129","Application Data"
"265","48.453506200","151.101.2.187","100.84.170.161","TLSv1.2","130","Application Data"
"266","48.453568500","100.84.170.161","151.101.2.187","TCP","54","55283  >  443 [ACK] Seq=86187 Ack=7760 Win=509 Len=0"
"267","48.704265500","100.84.170.161","151.101.2.187","TLSv1.2","1937","Application Data"
"268","48.714241200","151.101.2.187","100.84.170.161","TCP","56","443  >  55283 [ACK] Seq=7760 Ack=88070 Win=3524 Len=0"
"269","48.717840400","151.101.2.187","100.84.170.161","TLSv1.2","130","Application Data"
"270","48.725551000","100.84.170.161","151.101.2.187","TLSv1.2","738","Application Data"
"271","48.734406200","151.101.2.187","100.84.170.161","TCP","56","443  >  55283 [ACK] Seq=7836 Ack=88754 Win=3524 Len=0"
"272","48.737778800","151.101.2.187","100.84.170.161","TLSv1.2","104","Application Data"
"273","48.764835400","151.101.2.187","100.84.170.161","TCP","104","[TCP Retransmission] 443  >  55283 [PSH, ACK] Seq=7836 Ack=88754 Win=3524 Len=50"
"274","48.764885400","100.84.170.161","151.101.2.187","TCP","66","55283  >  443 [ACK] Seq=88754 Ack=7886 Win=508 Len=0 SLE=7836 SRE=7886"
"275","48.866491400","100.84.170.161","151.101.2.187","TLSv1.2","1938","Application Data"
"276","48.876585200","151.101.2.187","100.84.170.161","TCP","56","443  >  55283 [ACK] Seq=7886 Ack=90638 Win=3530 Len=0"
"277","48.879515600","151.101.2.187","100.84.170.161","TLSv1.2","130","Application Data"
"278","48.906987400","151.101.2.187","100.84.170.161","TCP","130","[TCP Retransmission] 443  >  55283 [PSH, ACK] Seq=7886 Ack=90638 Win=3530 Len=76"
"279","48.907030100","100.84.170.161","151.101.2.187","TCP","66","55283  >  443 [ACK] Seq=90638 Ack=7962 Win=508 Len=0 SLE=7886 SRE=7962"
"280","49.121174800","100.84.170.161","151.101.2.187","TLSv1.2","757","Application Data"
"281","49.130710200","151.101.2.187","100.84.170.161","TCP","56","443  >  55283 [ACK] Seq=7962 Ack=91341 Win=3530 Len=0"
"282","49.133592400","151.101.2.187","100.84.170.161","TLSv1.2","104","Application Data"
"283","49.161137300","151.101.2.187","100.84.170.161","TCP","104","[TCP Retransmission] 443  >  55283 [PSH, ACK] Seq=7962 Ack=91341 Win=3530 Len=50"
"284","49.161191200","100.84.170.161","151.101.2.187","TCP","66","55283  >  443 [ACK] Seq=91341 Ack=8012 Win=508 Len=0 SLE=7962 SRE=8012"
"285","52.954984500","100.84.170.161","151.101.2.187","TLSv1.2","1919","Application Data"
"286","52.965227300","151.101.2.187","100.84.170.161","TCP","56","443  >  55283 [ACK] Seq=8012 Ack=93206 Win=3535 Len=0"
"287","52.968257300","151.101.2.187","100.84.170.161","TLSv1.2","214","Application Data"
"288","52.969589200","100.84.170.161","151.101.2.187","TLSv1.2","726","Application Data"
"289","52.978287600","151.101.2.187","100.84.170.161","TCP","56","443  >  55283 [ACK] Seq=8172 Ack=93878 Win=3535 Len=0"
"290","52.981112500","151.101.2.187","100.84.170.161","TLSv1.2","187","Application Data"
"291","53.009475500","151.101.2.187","100.84.170.161","TCP","187","[TCP Retransmission] 443  >  55283 [PSH, ACK] Seq=8172 Ack=93878 Win=3535 Len=133"
"292","53.009669600","100.84.170.161","151.101.2.187","TCP","66","55283  >  443 [ACK] Seq=93878 Ack=8305 Win=513 Len=0 SLE=8172 SRE=8305"
"293","54.511651900","100.84.170.161","151.101.2.187","TLSv1.2","1873","Application Data"
"294","54.521458500","100.84.170.161","151.101.2.187","TLSv1.2","738","Application Data"
"295","54.522071200","151.101.2.187","100.84.170.161","TCP","56","443  >  55283 [ACK] Seq=8305 Ack=95697 Win=3541 Len=0"
"296","54.525293600","151.101.2.187","100.84.170.161","TLSv1.2","214","Application Data"
"297","54.530589600","151.101.2.187","100.84.170.161","TCP","56","443  >  55283 [ACK] Seq=8465 Ack=96381 Win=3541 Len=0"
"298","54.533638100","151.101.2.187","100.84.170.161","TLSv1.2","104","Application Data"
"299","54.533732000","100.84.170.161","151.101.2.187","TCP","54","55283  >  443 [ACK] Seq=96381 Ack=8515 Win=512 Len=0"
"300","54.553777000","100.84.170.161","151.101.2.187","TLSv1.2","1937","Application Data"
"301","54.563442300","151.101.2.187","100.84.170.161","TCP","56","443  >  55283 [ACK] Seq=8515 Ack=98264 Win=3547 Len=0"
"302","54.565558100","151.101.2.187","100.84.170.161","TLSv1.2","104","Application Data"
"303","54.594874800","151.101.2.187","100.84.170.161","TCP","104","[TCP Retransmission] 443  >  55283 [PSH, ACK] Seq=8515 Ack=98264 Win=3547 Len=50"
"304","54.594914500","100.84.170.161","151.101.2.187","TCP","66","55283  >  443 [ACK] Seq=98264 Ack=8565 Win=512 Len=0 SLE=8515 SRE=8565"
"305","61.266615300","100.84.170.161","151.101.2.187","TLSv1.2","846","Application Data"
"306","61.277585900","151.101.2.187","100.84.170.161","TCP","56","443  >  55283 [ACK] Seq=8565 Ack=99056 Win=3552 Len=0"
"307","61.280354000","151.101.2.187","100.84.170.161","TLSv1.2","257","Application Data"
"308","61.281356500","100.84.170.161","151.101.2.187","TLSv1.2","1845","Application Data"
"309","61.283116900","100.84.170.161","151.101.2.187","TLSv1.2","824","Application Data"
"310","61.288419000","100.84.170.161","151.101.2.187","TLSv1.2","1845","Application Data"
"311","61.290214900","151.101.2.187","100.84.170.161","TCP","56","443  >  55283 [ACK] Seq=8768 Ack=100847 Win=3558 Len=0"
"312","61.291754200","151.101.2.187","100.84.170.161","TCP","56","443  >  55283 [ACK] Seq=8768 Ack=101617 Win=3564 Len=0"
"313","61.293181500","151.101.2.187","100.84.170.161","TLSv1.2","187","Application Data"
"314","61.301634500","151.101.2.187","100.84.170.161","TLSv1.2","130","Application Data"
"315","61.301696500","100.84.170.161","151.101.2.187","TCP","54","55283  >  443 [ACK] Seq=103408 Ack=8977 Win=510 Len=0"
"316","61.302227000","151.101.2.187","100.84.170.161","TLSv1.2","129","Application Data"
"317","61.341986700","151.101.2.187","100.84.170.161","TCP","129","[TCP Retransmission] 443  >  55283 [PSH, ACK] Seq=8977 Ack=103408 Win=3570 Len=75"
"318","61.342030100","100.84.170.161","151.101.2.187","TCP","66","55283  >  443 [ACK] Seq=103408 Ack=9052 Win=510 Len=0 SLE=8977 SRE=9052"
"319","61.361868900","100.84.170.161","151.101.2.187","TLSv1.2","818","Application Data"
"320","61.370859400","151.101.2.187","100.84.170.161","TCP","56","443  >  55283 [ACK] Seq=9052 Ack=104172 Win=3575 Len=0"
"321","61.372705700","151.101.2.187","100.84.170.161","TLSv1.2","240","Application Data"
"322","61.402038500","151.101.2.187","100.84.170.161","TCP","240","[TCP Retransmission] 443  >  55283 [PSH, ACK] Seq=9052 Ack=104172 Win=3575 Len=186"
"323","61.402080300","100.84.170.161","151.101.2.187","TCP","66","55283  >  443 [ACK] Seq=104172 Ack=9238 Win=509 Len=0 SLE=9052 SRE=9238"
"324","61.484626200","100.84.170.161","151.101.2.187","TLSv1.2","1842","Application Data"
"325","61.493645100","151.101.2.187","100.84.170.161","TCP","56","443  >  55283 [ACK] Seq=9238 Ack=105960 Win=3581 Len=0"
"326","61.495691700","151.101.2.187","100.84.170.161","TLSv1.2","130","Application Data"
"327","61.497637600","100.84.170.161","151.101.2.187","TLSv1.2","855","Application Data"
"328","61.506388200","151.101.2.187","100.84.170.161","TCP","56","443  >  55283 [ACK] Seq=9314 Ack=106761 Win=3587 Len=0"
"329","61.509778800","151.101.2.187","100.84.170.161","TLSv1.2","130","Application Data"
"330","61.537787400","100.84.170.161","151.101.2.187","TLSv1.2","1836","Application Data"
"331","61.538944500","151.101.2.187","100.84.170.161","TCP","130","[TCP Spurious Retransmission] 443  >  55283 [PSH, ACK] Seq=9314 Ack=106761 Win=3587 Len=76"
"332","61.538986100","100.84.170.161","151.101.2.187","TCP","66","[TCP Dup ACK 330#1] 55283  >  443 [ACK] Seq=108543 Ack=9390 Win=509 Len=0 SLE=9314 SRE=9390"
"333","61.546830500","151.101.2.187","100.84.170.161","TCP","56","443  >  55283 [ACK] Seq=9390 Ack=108543 Win=3592 Len=0"
"334","61.549766900","151.101.2.187","100.84.170.161","TLSv1.2","130","Application Data"
"335","61.579101300","151.101.2.187","100.84.170.161","TCP","130","[TCP Retransmission] 443  >  55283 [PSH, ACK] Seq=9390 Ack=108543 Win=3592 Len=76"
"336","61.579146500","100.84.170.161","151.101.2.187","TCP","66","55283  >  443 [ACK] Seq=108543 Ack=9466 Win=508 Len=0 SLE=9390 SRE=9466"
"337","61.702914100","100.84.170.161","151.101.2.187","TLSv1.2","850","Application Data"
"338","61.711457100","151.101.2.187","100.84.170.161","TCP","56","443  >  55283 [ACK] Seq=9466 Ack=109339 Win=3598 Len=0"
"339","61.714424500","151.101.2.187","100.84.170.161","TLSv1.2","214","Application Data"
"340","61.742784900","151.101.2.187","100.84.170.161","TCP","214","[TCP Retransmission] 443  >  55283 [PSH, ACK] Seq=9466 Ack=109339 Win=3598 Len=160"
"341","61.742823400","100.84.170.161","151.101.2.187","TCP","66","55283  >  443 [ACK] Seq=109339 Ack=9626 Win=508 Len=0 SLE=9466 SRE=9626"
"342","61.812415800","100.84.170.161","151.101.2.187","TLSv1.2","1869","Application Data"
"343","61.812574500","100.84.170.161","151.101.2.187","TLSv1.2","843","Application Data"
"344","61.812681400","100.84.170.161","151.101.2.187","TLSv1.2","1880","Application Data"
"345","61.812762900","100.84.170.161","151.101.2.187","TLSv1.2","812","Application Data"
"346","61.812841500","100.84.170.161","151.101.2.187","TLSv1.2","1868","Application Data"
"347","61.813292400","100.84.170.161","151.101.2.187","TLSv1.2","803","Application Data"
"348","61.821139300","151.101.2.187","100.84.170.161","TCP","56","443  >  55283 [ACK] Seq=9626 Ack=111943 Win=3609 Len=0"
"349","61.821537400","151.101.2.187","100.84.170.161","TCP","56","443  >  55283 [ACK] Seq=9626 Ack=116341 Win=3627 Len=0"
"350","61.824393800","151.101.2.187","100.84.170.161","TCP","56","443  >  55283 [ACK] Seq=9626 Ack=117090 Win=3632 Len=0"
"351","61.826243500","151.101.2.187","100.84.170.161","TLSv1.2","131","Application Data"
"352","61.826243500","151.101.2.187","100.84.170.161","TLSv1.2","130","Application Data"
"353","61.826306200","100.84.170.161","151.101.2.187","TCP","54","55283  >  443 [ACK] Seq=117090 Ack=9779 Win=513 Len=0"
"354","61.826588400","151.101.2.187","100.84.170.161","TLSv1.2","129","Application Data"
"355","61.826588400","151.101.2.187","100.84.170.161","TLSv1.2","312","Application Data"
"356","61.826630500","100.84.170.161","151.101.2.187","TCP","54","55283  >  443 [ACK] Seq=117090 Ack=10112 Win=511 Len=0"
"357","61.827149600","151.101.2.187","100.84.170.161","TLSv1.2","130","Application Data"
"358","61.863969900","151.101.2.187","100.84.170.161","TCP","130","[TCP Retransmission] 443  >  55283 [PSH, ACK] Seq=10112 Ack=117090 Win=3632 Len=76"
"359","61.863997000","100.84.170.161","151.101.2.187","TCP","66","55283  >  443 [ACK] Seq=117090 Ack=10188 Win=511 Len=0 SLE=10112 SRE=10188"
"360","62.035110500","100.84.170.161","151.101.2.187","TLSv1.2","2007","Application Data"
"361","62.037009500","100.84.170.161","151.101.2.187","TLSv1.2","769","Application Data"
"362","62.039057900","100.84.170.161","151.101.2.187","TLSv1.2","1991","Application Data"
"363","62.044198400","151.101.2.187","100.84.170.161","TCP","56","443  >  55283 [ACK] Seq=10188 Ack=119043 Win=3638 Len=0"
"364","62.045419300","151.101.2.187","100.84.170.161","TCP","56","443  >  55283 [ACK] Seq=10188 Ack=119758 Win=3638 Len=0"
"365","62.047650500","151.101.2.187","100.84.170.161","TCP","56","443  >  55283 [ACK] Seq=10188 Ack=121695 Win=3644 Len=0"
"366","62.048499000","151.101.2.187","100.84.170.161","TLSv1.2","131","Application Data"
"367","62.049016400","151.101.2.187","100.84.170.161","TLSv1.2","240","Application Data"
"368","62.049047600","100.84.170.161","151.101.2.187","TCP","54","55283  >  443 [ACK] Seq=121695 Ack=10451 Win=510 Len=0"
"369","62.050978400","151.101.2.187","100.84.170.161","TLSv1.2","130","Application Data"
"370","62.084989400","151.101.2.187","100.84.170.161","TCP","130","[TCP Retransmission] 443  >  55283 [PSH, ACK] Seq=10451 Ack=121695 Win=3644 Len=76"
"371","62.085033200","100.84.170.161","151.101.2.187","TCP","66","55283  >  443 [ACK] Seq=121695 Ack=10527 Win=510 Len=0 SLE=10451 SRE=10527"
"372","62.908574200","100.84.170.161","151.101.2.187","TCP","55","[TCP Keep-Alive] 56939  >  443 [ACK] Seq=1 Ack=1 Win=508 Len=1"
"373","62.917770100","151.101.2.187","100.84.170.161","TCP","66","[TCP Keep-Alive ACK] 443  >  56939 [ACK] Seq=1 Ack=2 Win=285 Len=0 SLE=1 SRE=2"
