No.,Time,Source,Destination,Protocol,Length,Info
1,0.0,172.20.40.110,151.101.194.187,TCP,54,"60246  >  443 [FIN, ACK] Seq=1 Ack=1 Win=258 Len=0"
2,0.009065,151.101.194.187,172.20.40.110,TCP,60,443  >  60246 [ACK] Seq=1 Ack=2 Win=198 Len=0
3,0.009065,151.101.194.187,172.20.40.110,TLSv1.2,78,Application Data
4,0.009065,151.101.194.187,172.20.40.110,TCP,60,"443  >  60246 [FIN, ACK] Seq=25 Ack=2 Win=198 Len=0"
5,0.0092917,172.20.40.110,151.101.194.187,TCP,54,"60246  >  443 [RST, ACK] Seq=2 Ack=25 Win=0 Len=0"
6,5.8198749,172.20.40.110,151.101.66.187,TCP,66,57039  >  443 [SYN] Seq=0 Win=64240 Len=0 MSS=1460 WS=256 SACK_PERM
7,5.8277979,151.101.66.187,172.20.40.110,TCP,66,"443  >  57039 [SYN, ACK] Seq=0 Ack=1 Win=65535 Len=0 MSS=1380 SACK_PERM WS=512"
8,5.8282623,172.20.40.110,151.101.66.187,TCP,54,57039  >  443 [ACK] Seq=1 Ack=1 Win=66048 Len=0
9,5.8302203,172.20.40.110,151.101.66.187,TLSv1.3,2097,Client Hello (SNI=www.target.com)
10,5.8393224,151.101.66.187,172.20.40.110,TCP,60,443  >  57039 [ACK] Seq=1 Ack=2044 Win=144384 Len=0
11,5.8423936,151.101.66.187,172.20.40.110,TLSv1.3,1434,"Server Hello, Change Cipher Spec, Application Data, Application Data"
12,5.8423936,151.101.66.187,172.20.40.110,TLSv1.3,215,Application Data
13,5.8424998,172.20.40.110,151.101.66.187,TCP,54,57039  >  443 [ACK] Seq=2044 Ack=1542 Win=66048 Len=0
14,5.8449062,172.20.40.110,151.101.66.187,TLSv1.3,118,"Change Cipher Spec, Application Data"
15,5.8460357,172.20.40.110,151.101.66.187,TLSv1.3,146,Application Data
16,5.846647,172.20.40.110,151.101.66.187,TLSv1.3,2789,Application Data
17,5.8526969,151.101.66.187,172.20.40.110,TCP,60,443  >  57039 [ACK] Seq=1542 Ack=2108 Win=144384 Len=0
18,5.855127,151.101.66.187,172.20.40.110,TCP,60,443  >  57039 [ACK] Seq=1542 Ack=2200 Win=144384 Len=0
19,5.855127,151.101.66.187,172.20.40.110,TLSv1.3,119,Application Data
20,5.8558414,172.20.40.110,151.101.66.187,TLSv1.3,85,Application Data
21,5.8563971,151.101.66.187,172.20.40.110,TCP,60,443  >  57039 [ACK] Seq=1607 Ack=4935 Win=141824 Len=0
22,5.8597495,151.101.66.187,172.20.40.110,TLSv1.3,451,Application Data
23,5.8640741,151.101.66.187,172.20.40.110,TCP,60,443  >  57039 [ACK] Seq=2004 Ack=4966 Win=141824 Len=0
24,5.8893246,151.101.66.187,172.20.40.110,TCP,451,"[TCP Retransmission] 443  >  57039 [PSH, ACK] Seq=1607 Ack=4966 Win=141824 Len=397"
25,5.8894065,172.20.40.110,151.101.66.187,TCP,66,57039  >  443 [ACK] Seq=4966 Ack=2004 Win=65536 Len=0 SLE=1607 SRE=2004
26,7.1164363,172.20.40.110,151.101.66.187,TLSv1.3,2788,Application Data
27,7.1192642,172.20.40.110,151.101.66.187,TLSv1.3,2776,Application Data
28,7.1204911,172.20.40.110,151.101.66.187,TLSv1.3,2770,Application Data
29,7.1250324,172.20.40.110,151.101.66.187,TLSv1.3,2789,Application Data
30,7.1295788,151.101.66.187,172.20.40.110,TCP,60,443  >  57039 [ACK] Seq=2004 Ack=7700 Win=139264 Len=0
31,7.1295788,151.101.66.187,172.20.40.110,TCP,60,443  >  57039 [ACK] Seq=2004 Ack=10422 Win=136704 Len=0
32,7.1303712,151.101.66.187,172.20.40.110,TLSv1.3,241,Application Data
33,7.1304926,172.20.40.110,151.101.66.187,TLSv1.3,2771,Application Data
34,7.1322805,151.101.66.187,172.20.40.110,TCP,60,443  >  57039 [ACK] Seq=2191 Ack=13138 Win=134144 Len=0
35,7.1322805,151.101.66.187,172.20.40.110,TLSv1.3,130,Application Data
36,7.1348742,151.101.66.187,172.20.40.110,TLSv1.3,130,Application Data
37,7.1349661,172.20.40.110,151.101.66.187,TCP,54,57039  >  443 [ACK] Seq=18590 Ack=2343 Win=65280 Len=0
38,7.136661,151.101.66.187,172.20.40.110,TCP,60,443  >  57039 [ACK] Seq=2343 Ack=15873 Win=131584 Len=0
39,7.1397062,151.101.66.187,172.20.40.110,TLSv1.3,98,Application Data
40,7.141819,151.101.66.187,172.20.40.110,TCP,60,443  >  57039 [ACK] Seq=2387 Ack=18590 Win=129024 Len=0
41,7.1525395,151.101.66.187,172.20.40.110,TLSv1.3,130,Application Data
42,7.1526224,172.20.40.110,151.101.66.187,TCP,54,57039  >  443 [ACK] Seq=18590 Ack=2463 Win=65280 Len=0
43,7.3017741,172.20.40.110,151.101.66.187,TLSv1.3,2792,Application Data
44,7.3151207,151.101.66.187,172.20.40.110,TCP,60,443  >  57039 [ACK] Seq=2463 Ack=21328 Win=126464 Len=0
45,7.3201002,151.101.66.187,172.20.40.110,TLSv1.3,130,Application Data
46,7.3307864,172.20.40.110,151.101.66.187,TLSv1.3,2772,Application Data
47,7.3410798,151.101.66.187,172.20.40.110,TCP,60,443  >  57039 [ACK] Seq=2539 Ack=24046 Win=123904 Len=0
48,7.348526,151.101.66.187,172.20.40.110,TLSv1.3,241,Application Data
49,7.3834288,151.101.66.187,172.20.40.110,TCP,241,"[TCP Retransmission] 443  >  57039 [PSH, ACK] Seq=2539 Ack=24046 Win=123904 Len=187"
50,7.3835546,172.20.40.110,151.101.66.187,TCP,66,57039  >  443 [ACK] Seq=24046 Ack=2726 Win=65024 Len=0 SLE=2539 SRE=2726
51,7.4123707,172.20.40.110,151.101.66.187,TLSv1.3,2777,Application Data
52,7.4126334,172.20.40.110,151.101.66.187,TLSv1.3,2780,Application Data
53,7.412778,172.20.40.110,151.101.66.187,TLSv1.3,2774,Application Data
54,7.4129109,172.20.40.110,151.101.66.187,TLSv1.3,2771,Application Data
55,7.4224867,151.101.66.187,172.20.40.110,TCP,60,443  >  57039 [ACK] Seq=2726 Ack=26769 Win=121344 Len=0
56,7.4241017,151.101.66.187,172.20.40.110,TLSv1.3,130,Application Data
57,7.4294024,151.101.66.187,172.20.40.110,TCP,60,443  >  57039 [ACK] Seq=2802 Ack=29495 Win=118784 Len=0
58,7.4294024,151.101.66.187,172.20.40.110,TCP,60,443  >  57039 [ACK] Seq=2802 Ack=32215 Win=116224 Len=0
59,7.4294024,151.101.66.187,172.20.40.110,TCP,60,443  >  57039 [ACK] Seq=2802 Ack=34932 Win=113664 Len=0
60,7.4316965,151.101.66.187,172.20.40.110,TLSv1.3,206,"Application Data, Application Data"
61,7.4317674,172.20.40.110,151.101.66.187,TCP,54,57039  >  443 [ACK] Seq=34932 Ack=2954 Win=66048 Len=0
62,7.4327754,151.101.66.187,172.20.40.110,TLSv1.3,173,Application Data
63,7.4328372,172.20.40.110,151.101.66.187,TCP,54,57039  >  443 [ACK] Seq=34932 Ack=3073 Win=66048 Len=0
64,7.7904993,172.20.40.110,151.101.66.187,TLSv1.3,2872,Application Data
65,7.8004109,151.101.66.187,172.20.40.110,TCP,60,443  >  57039 [ACK] Seq=3073 Ack=37750 Win=111104 Len=0
66,7.8029042,172.20.40.110,151.101.66.187,TLSv1.3,2872,Application Data
67,7.805522,151.101.66.187,172.20.40.110,TLSv1.3,292,Application Data
68,7.8121235,151.101.66.187,172.20.40.110,TCP,60,443  >  57039 [ACK] Seq=3311 Ack=40568 Win=108544 Len=0
69,7.8226917,151.101.66.187,172.20.40.110,TLSv1.3,131,Application Data
70,7.8227858,172.20.40.110,151.101.66.187,TCP,54,57039  >  443 [ACK] Seq=40568 Ack=3388 Win=65792 Len=0
71,7.9006173,172.20.40.110,151.101.66.187,TLSv1.3,2886,Application Data
72,7.9107998,151.101.66.187,172.20.40.110,TCP,60,443  >  57039 [ACK] Seq=3388 Ack=43400 Win=105984 Len=0
73,7.9172044,151.101.66.187,172.20.40.110,TLSv1.3,130,Application Data
74,7.9483649,151.101.66.187,172.20.40.110,TCP,130,"[TCP Retransmission] 443  >  57039 [PSH, ACK] Seq=3388 Ack=43400 Win=105984 Len=76"
75,7.9484269,172.20.40.110,151.101.66.187,TCP,66,57039  >  443 [ACK] Seq=43400 Ack=3464 Win=65536 Len=0 SLE=3388 SRE=3464
76,12.7984328,172.20.40.110,151.101.66.187,TLSv1.3,2910,Application Data
77,12.8000551,172.20.40.110,151.101.66.187,TLSv1.3,2895,Application Data
78,12.8023213,172.20.40.110,151.101.66.187,TLSv1.3,2901,Application Data
79,12.8027569,172.20.40.110,151.101.66.187,TLSv1.3,2896,Application Data
80,12.8077647,151.101.66.187,172.20.40.110,TCP,60,443  >  57039 [ACK] Seq=3464 Ack=46256 Win=103424 Len=0
81,12.8101576,151.101.66.187,172.20.40.110,TCP,60,443  >  57039 [ACK] Seq=3464 Ack=49097 Win=101888 Len=0
82,12.8148806,151.101.66.187,172.20.40.110,TLSv1.3,241,Application Data
83,12.8148806,151.101.66.187,172.20.40.110,TLSv1.3,104,Application Data
84,12.8148806,151.101.66.187,172.20.40.110,TCP,60,443  >  57039 [ACK] Seq=3701 Ack=51944 Win=101888 Len=0
85,12.8148806,151.101.66.187,172.20.40.110,TCP,60,443  >  57039 [ACK] Seq=3701 Ack=54786 Win=99328 Len=0
86,12.8150102,172.20.40.110,151.101.66.187,TCP,54,57039  >  443 [ACK] Seq=54786 Ack=3701 Win=65280 Len=0
87,12.8202359,151.101.66.187,172.20.40.110,TLSv1.3,130,Application Data
88,12.8202359,151.101.66.187,172.20.40.110,TLSv1.3,130,Application Data
89,12.820364,172.20.40.110,151.101.66.187,TCP,54,57039  >  443 [ACK] Seq=54786 Ack=3853 Win=65280 Len=0
90,12.88502,172.20.40.110,151.101.66.187,TLSv1.3,2895,Application Data
91,12.8963629,151.101.66.187,172.20.40.110,TCP,60,443  >  57039 [ACK] Seq=3853 Ack=57627 Win=101888 Len=0
92,12.9024868,151.101.66.187,172.20.40.110,TLSv1.3,130,Application Data
93,12.9342692,151.101.66.187,172.20.40.110,TCP,130,"[TCP Retransmission] 443  >  57039 [PSH, ACK] Seq=3853 Ack=57627 Win=104448 Len=76"
94,12.9343268,172.20.40.110,151.101.66.187,TCP,66,57039  >  443 [ACK] Seq=57627 Ack=3929 Win=65024 Len=0 SLE=3853 SRE=3929
95,12.9617651,172.20.40.110,151.101.66.187,TLSv1.3,2909,Application Data
96,12.9738055,151.101.66.187,172.20.40.110,TCP,60,443  >  57039 [ACK] Seq=3929 Ack=60482 Win=101888 Len=0
97,12.9759594,151.101.66.187,172.20.40.110,TLSv1.3,125,Application Data
98,13.0078757,151.101.66.187,172.20.40.110,TCP,125,"[TCP Retransmission] 443  >  57039 [PSH, ACK] Seq=3929 Ack=60482 Win=104448 Len=71"
99,13.0079273,172.20.40.110,151.101.66.187,TCP,66,57039  >  443 [ACK] Seq=60482 Ack=4000 Win=65024 Len=0 SLE=3929 SRE=4000
100,13.0288654,172.20.40.110,151.101.66.187,TLSv1.3,2892,Application Data
101,13.0453779,172.20.40.110,151.101.66.187,TLSv1.3,2909,Application Data
102,13.0534502,151.101.66.187,172.20.40.110,TCP,60,443  >  57039 [ACK] Seq=4000 Ack=63320 Win=101888 Len=0
103,13.0534502,151.101.66.187,172.20.40.110,TLSv1.3,125,Application Data
104,13.0555701,151.101.66.187,172.20.40.110,TCP,60,443  >  57039 [ACK] Seq=4071 Ack=66175 Win=101888 Len=0
105,13.0621805,151.101.66.187,172.20.40.110,TLSv1.3,130,Application Data
106,13.0622692,172.20.40.110,151.101.66.187,TCP,54,57039  >  443 [ACK] Seq=66175 Ack=4147 Win=65024 Len=0
107,13.356146,172.20.40.110,151.101.66.187,TLSv1.3,2903,Application Data
108,13.3564156,172.20.40.110,151.101.66.187,TLSv1.3,2898,Application Data
109,13.3565984,172.20.40.110,151.101.66.187,TLSv1.3,2895,Application Data
110,13.3567683,172.20.40.110,151.101.66.187,TLSv1.3,2898,Application Data
111,13.356958,172.20.40.110,151.101.66.187,TLSv1.3,2896,Application Data
112,13.3571532,172.20.40.110,151.101.66.187,TLSv1.3,2897,Application Data
113,13.3573594,172.20.40.110,151.101.66.187,TLSv1.3,2894,Application Data
114,13.3875384,172.20.40.110,151.101.66.187,TCP,1434,"[TCP Retransmission] 57039  >  443 [PSH, ACK] Seq=84698 Ack=4147 Win=65024 Len=1380"
115,13.4798689,151.101.66.187,172.20.40.110,TCP,60,443  >  57039 [ACK] Seq=4147 Ack=69024 Win=101888 Len=0
116,13.4798689,151.101.66.187,172.20.40.110,TCP,60,443  >  57039 [ACK] Seq=4147 Ack=71868 Win=99328 Len=0
117,13.4957907,151.101.66.187,172.20.40.110,TLSv1.3,130,"[TCP Previous segment not captured] , Application Data"
118,13.4959683,172.20.40.110,151.101.66.187,TCP,66,[TCP Dup ACK 106#1] 57039  >  443 [ACK] Seq=86078 Ack=4147 Win=65024 Len=0 SLE=4814 SRE=4890
119,13.5275948,151.101.66.187,172.20.40.110,TCP,60,443  >  57039 [ACK] Seq=4890 Ack=86078 Win=102400 Len=0
120,13.5275948,151.101.66.187,172.20.40.110,TCP,66,[TCP Dup ACK 119#1] 443  >  57039 [ACK] Seq=4890 Ack=86078 Win=102400 Len=0 SLE=84698 SRE=86078
121,13.5275948,151.101.66.187,172.20.40.110,TLSv1.3,124,Application Data
122,13.5277937,172.20.40.110,151.101.66.187,TCP,66,[TCP Dup ACK 106#2] 57039  >  443 [ACK] Seq=86078 Ack=4147 Win=65024 Len=0 SLE=4814 SRE=4960
123,13.5350736,151.101.66.187,172.20.40.110,TCP,124,"[TCP Fast Retransmission] 443  >  57039 [PSH, ACK] Seq=4890 Ack=86078 Win=104448 Len=70"
124,13.5353687,172.20.40.110,151.101.66.187,TCP,74,[TCP Dup ACK 106#3] 57039  >  443 [ACK] Seq=86078 Ack=4147 Win=65024 Len=0 SLE=4890 SRE=4960 SLE=4814 SRE=4960
125,13.5464912,151.101.66.187,172.20.40.110,TCP,721,"[TCP Fast Retransmission] 443  >  57039 [PSH, ACK] Seq=4147 Ack=86078 Win=104448 Len=667"
126,13.5469548,172.20.40.110,151.101.66.187,TCP,54,57039  >  443 [ACK] Seq=86078 Ack=4960 Win=66048 Len=0
127,13.5633743,172.20.40.110,151.101.66.187,TLSv1.3,2896,Application Data
128,13.5639294,172.20.40.110,151.101.66.187,TLSv1.3,2882,Application Data
129,13.6399739,151.101.66.187,172.20.40.110,TCP,60,443  >  57039 [ACK] Seq=4960 Ack=88920 Win=101888 Len=0
130,13.6399739,151.101.66.187,172.20.40.110,TCP,60,443  >  57039 [ACK] Seq=4960 Ack=90300 Win=103424 Len=0
131,13.6399739,151.101.66.187,172.20.40.110,TLSv1.3,130,Application Data
132,13.6429568,151.101.66.187,172.20.40.110,TCP,60,443  >  57039 [ACK] Seq=5036 Ack=91748 Win=103424 Len=0
133,13.6429568,151.101.66.187,172.20.40.110,TLSv1.3,130,Application Data
134,13.6431394,172.20.40.110,151.101.66.187,TCP,54,57039  >  443 [ACK] Seq=91748 Ack=5112 Win=66048 Len=0
135,17.1855994,172.20.40.110,151.101.66.187,TLSv1.3,2902,Application Data
136,17.1966176,151.101.66.187,172.20.40.110,TCP,60,443  >  57039 [ACK] Seq=5112 Ack=94596 Win=102400 Len=0
137,17.2000585,151.101.66.187,172.20.40.110,TLSv1.3,240,Application Data
138,17.201163,172.20.40.110,151.101.66.187,TLSv1.3,2897,Application Data
139,17.2051811,172.20.40.110,151.101.66.187,TLSv1.3,2896,Application Data
140,17.2116593,151.101.66.187,172.20.40.110,TCP,60,443  >  57039 [ACK] Seq=5298 Ack=97439 Win=102400 Len=0
141,17.2168444,151.101.66.187,172.20.40.110,TLSv1.3,130,Application Data
142,17.2168444,151.101.66.187,172.20.40.110,TCP,60,443  >  57039 [ACK] Seq=5374 Ack=100281 Win=103424 Len=0
143,17.2195074,151.101.66.187,172.20.40.110,TLSv1.3,131,Application Data
144,17.2195712,172.20.40.110,151.101.66.187,TCP,54,57039  >  443 [ACK] Seq=100281 Ack=5451 Win=65536 Len=0
145,17.3788754,172.20.40.110,151.101.66.187,TLSv1.3,2879,Application Data
146,17.3914161,151.101.66.187,172.20.40.110,TCP,60,443  >  57039 [ACK] Seq=5451 Ack=103106 Win=101888 Len=0
147,17.3936003,151.101.66.187,172.20.40.110,TLSv1.3,240,Application Data
148,17.435953,172.20.40.110,151.101.66.187,TCP,54,57039  >  443 [ACK] Seq=103106 Ack=5637 Win=65536 Len=0
149,17.4464995,151.101.66.187,172.20.40.110,TCP,240,"[TCP Spurious Retransmission] 443  >  57039 [PSH, ACK] Seq=5451 Ack=103106 Win=104448 Len=186"
150,17.4465628,172.20.40.110,151.101.66.187,TCP,66,[TCP Dup ACK 148#1] 57039  >  443 [ACK] Seq=103106 Ack=5637 Win=65536 Len=0 SLE=5451 SRE=5637
151,19.4058328,172.20.40.110,151.101.66.187,TLSv1.3,2895,Application Data
152,19.4090868,172.20.40.110,151.101.66.187,TLSv1.3,2893,Application Data
153,19.4108198,172.20.40.110,151.101.66.187,TLSv1.3,2898,Application Data
154,19.4192667,151.101.66.187,172.20.40.110,TCP,60,443  >  57039 [ACK] Seq=5637 Ack=105947 Win=101888 Len=0
155,19.4192667,151.101.66.187,172.20.40.110,TCP,60,443  >  57039 [ACK] Seq=5637 Ack=108786 Win=101888 Len=0
156,19.4216701,151.101.66.187,172.20.40.110,TLSv1.3,451,Application Data
157,19.4216701,151.101.66.187,172.20.40.110,TCP,60,443  >  57039 [ACK] Seq=6034 Ack=111630 Win=101888 Len=0
158,19.4216701,151.101.66.187,172.20.40.110,TLSv1.3,129,Application Data
159,19.4217802,172.20.40.110,151.101.66.187,TCP,54,57039  >  443 [ACK] Seq=111630 Ack=6109 Win=65024 Len=0
160,19.4247028,151.101.66.187,172.20.40.110,TLSv1.3,131,Application Data
161,19.474419,172.20.40.110,151.101.66.187,TCP,54,57039  >  443 [ACK] Seq=111630 Ack=6186 Win=64768 Len=0
162,19.4755826,151.101.66.187,172.20.40.110,TCP,131,"[TCP Spurious Retransmission] 443  >  57039 [PSH, ACK] Seq=6109 Ack=111630 Win=104448 Len=77"
163,19.4756597,172.20.40.110,151.101.66.187,TCP,66,[TCP Dup ACK 161#1] 57039  >  443 [ACK] Seq=111630 Ack=6186 Win=64768 Len=0 SLE=6109 SRE=6186
164,20.6384992,172.20.40.110,151.101.66.187,TLSv1.3,2910,Application Data
165,20.6494643,151.101.66.187,172.20.40.110,TCP,60,443  >  57039 [ACK] Seq=6186 Ack=114486 Win=101888 Len=0
166,20.6527731,151.101.66.187,172.20.40.110,TLSv1.3,241,Application Data
167,20.6733721,172.20.40.110,151.101.66.187,TLSv1.3,2911,Application Data
168,20.6837578,151.101.66.187,172.20.40.110,TCP,60,443  >  57039 [ACK] Seq=6373 Ack=117343 Win=101888 Len=0
169,20.6883222,151.101.66.187,172.20.40.110,TLSv1.3,131,Application Data
170,20.7322721,172.20.40.110,151.101.66.187,TLSv1.3,2910,Application Data
171,20.735994,151.101.66.187,172.20.40.110,TCP,131,"[TCP Spurious Retransmission] 443  >  57039 [PSH, ACK] Seq=6373 Ack=117343 Win=104448 Len=77"
172,20.7360487,172.20.40.110,151.101.66.187,TCP,66,[TCP Dup ACK 170#1] 57039  >  443 [ACK] Seq=120199 Ack=6450 Win=66048 Len=0 SLE=6373 SRE=6450
173,20.7470218,151.101.66.187,172.20.40.110,TCP,60,443  >  57039 [ACK] Seq=6450 Ack=120199 Win=101888 Len=0
174,20.7495468,151.101.66.187,172.20.40.110,TLSv1.3,130,Application Data
175,20.7910617,172.20.40.110,151.101.66.187,TCP,54,57039  >  443 [ACK] Seq=120199 Ack=6526 Win=66048 Len=0
176,21.4243466,172.20.40.110,151.101.66.187,TLSv1.3,2896,Application Data
177,21.4328921,151.101.66.187,172.20.40.110,TCP,60,443  >  57039 [ACK] Seq=6526 Ack=123041 Win=101888 Len=0
178,21.4383308,151.101.66.187,172.20.40.110,TLSv1.3,240,Application Data
179,21.4887435,172.20.40.110,151.101.66.187,TCP,54,57039  >  443 [ACK] Seq=123041 Ack=6712 Win=65792 Len=0
180,21.4923436,151.101.66.187,172.20.40.110,TCP,240,"[TCP Spurious Retransmission] 443  >  57039 [PSH, ACK] Seq=6526 Ack=123041 Win=104448 Len=186"
181,21.4924047,172.20.40.110,151.101.66.187,TCP,66,[TCP Dup ACK 179#1] 57039  >  443 [ACK] Seq=123041 Ack=6712 Win=65792 Len=0 SLE=6526 SRE=6712
182,21.5190351,172.20.40.110,151.101.66.187,TLSv1.3,2899,Application Data
183,21.5287341,151.101.66.187,172.20.40.110,TCP,60,443  >  57039 [ACK] Seq=6712 Ack=125886 Win=101888 Len=0
184,21.5318249,151.101.66.187,172.20.40.110,TLSv1.3,130,Application Data
185,21.5413186,172.20.40.110,151.101.66.187,TLSv1.3,2901,Application Data
186,21.5508502,151.101.66.187,172.20.40.110,TCP,60,443  >  57039 [ACK] Seq=6788 Ack=128733 Win=101888 Len=0
187,21.5540471,151.101.66.187,172.20.40.110,TLSv1.3,130,Application Data
188,21.6012558,172.20.40.110,151.101.66.187,TCP,54,57039  >  443 [ACK] Seq=128733 Ack=6864 Win=65536 Len=0
189,21.6097477,151.101.66.187,172.20.40.110,TCP,130,"[TCP Spurious Retransmission] 443  >  57039 [PSH, ACK] Seq=6788 Ack=128733 Win=104448 Len=76"
190,21.6098204,172.20.40.110,151.101.66.187,TCP,66,[TCP Dup ACK 188#1] 57039  >  443 [ACK] Seq=128733 Ack=6864 Win=65536 Len=0 SLE=6788 SRE=6864
191,23.3511349,172.20.40.110,151.101.66.187,TCP,66,51833  >  443 [SYN] Seq=0 Win=64240 Len=0 MSS=1460 WS=256 SACK_PERM
192,23.3622539,151.101.66.187,172.20.40.110,TCP,66,"443  >  51833 [SYN, ACK] Seq=0 Ack=1 Win=65535 Len=0 MSS=1380 SACK_PERM WS=512"
193,23.3625976,172.20.40.110,151.101.66.187,TCP,54,51833  >  443 [ACK] Seq=1 Ack=1 Win=66048 Len=0
194,23.3652105,172.20.40.110,151.101.66.187,TLSv1.3,2034,Client Hello (SNI=r2d2.target.com)
195,23.3755138,151.101.66.187,172.20.40.110,TCP,60,443  >  51833 [ACK] Seq=1 Ack=1981 Win=144384 Len=0
196,23.3766321,151.101.66.187,172.20.40.110,TLSv1.3,1434,"Server Hello, Change Cipher Spec, Application Data, Application Data"
197,23.3766321,151.101.66.187,172.20.40.110,TLSv1.3,215,Application Data
198,23.3767427,172.20.40.110,151.101.66.187,TCP,54,51833  >  443 [ACK] Seq=1981 Ack=1542 Win=66048 Len=0
199,23.3796572,172.20.40.110,151.101.66.187,TLSv1.3,118,"Change Cipher Spec, Application Data"
200,23.380975,172.20.40.110,151.101.66.187,TLSv1.3,146,Application Data
201,23.3817607,172.20.40.110,151.101.66.187,TLSv1.3,597,Application Data
202,23.3883793,151.101.66.187,172.20.40.110,TCP,60,443  >  51833 [ACK] Seq=1542 Ack=2045 Win=144384 Len=0
203,23.3883793,151.101.66.187,172.20.40.110,TCP,60,443  >  51833 [ACK] Seq=1542 Ack=2137 Win=144384 Len=0
204,23.3883793,151.101.66.187,172.20.40.110,TLSv1.3,119,Application Data
205,23.3887455,172.20.40.110,151.101.66.187,TLSv1.3,85,Application Data
206,23.3895777,151.101.66.187,172.20.40.110,TCP,60,443  >  51833 [ACK] Seq=1607 Ack=2680 Win=143872 Len=0
207,23.3968961,151.101.66.187,172.20.40.110,TCP,60,443  >  51833 [ACK] Seq=1607 Ack=2711 Win=143872 Len=0
208,23.4491767,151.101.66.187,172.20.40.110,TLSv1.3,522,Application Data
209,23.4491767,151.101.66.187,172.20.40.110,TLSv1.3,87,Application Data
210,23.4493264,172.20.40.110,151.101.66.187,TCP,54,51833  >  443 [ACK] Seq=2711 Ack=2108 Win=65536 Len=0
211,23.4519664,151.101.66.187,172.20.40.110,TLSv1.3,918,Application Data
212,23.4519664,151.101.66.187,172.20.40.110,TLSv1.3,87,Application Data
213,23.4519664,151.101.66.187,172.20.40.110,TLSv1.3,86,Application Data
214,23.4519664,151.101.66.187,172.20.40.110,TLSv1.3,271,Application Data
215,23.4519664,151.101.66.187,172.20.40.110,TLSv1.3,85,Application Data
216,23.4521031,172.20.40.110,151.101.66.187,TCP,54,51833  >  443 [ACK] Seq=2711 Ack=3285 Win=66048 Len=0
217,26.0943474,172.20.40.110,151.101.66.187,TLSv1.3,2975,Application Data
218,26.1075117,151.101.66.187,172.20.40.110,TCP,60,443  >  57039 [ACK] Seq=6864 Ack=131654 Win=101888 Len=0
219,26.9480288,151.101.66.187,172.20.40.110,TLSv1.3,366,Application Data
220,26.9480288,151.101.66.187,172.20.40.110,TLSv1.3,9714,"Application Data, Application Data, Application Data, Application Data, Application Data, Application Data"
221,26.9481666,172.20.40.110,151.101.66.187,TCP,54,57039  >  443 [ACK] Seq=131654 Ack=16836 Win=66048 Len=0
222,26.9503219,151.101.66.187,172.20.40.110,TLSv1.3,1434,Application Data
223,26.9529,151.101.66.187,172.20.40.110,TLSv1.3,1434,Application Data
224,26.9529,151.101.66.187,172.20.40.110,TLSv1.3,11094,"Application Data, Application Data, Application Data, Application Data, Application Data, Application Data, Application Data, Application Data"
225,26.953051,172.20.40.110,151.101.66.187,TCP,54,57039  >  443 [ACK] Seq=131654 Ack=30636 Win=66048 Len=0
226,26.9532162,172.20.40.110,151.101.66.187,TLSv1.3,89,Application Data
227,26.9543133,151.101.66.187,172.20.40.110,TLSv1.3,5574,"Application Data, Application Data, Application Data, Application Data"
228,26.9544194,172.20.40.110,151.101.66.187,TCP,54,57039  >  443 [ACK] Seq=131689 Ack=36156 Win=66048 Len=0
229,26.9586966,151.101.66.187,172.20.40.110,TLSv1.3,8334,"Application Data, Application Data, Application Data, Application Data, Application Data, Application Data"
230,26.9588438,172.20.40.110,151.101.66.187,TCP,54,57039  >  443 [ACK] Seq=131689 Ack=44436 Win=66048 Len=0
231,26.9603748,151.101.66.187,172.20.40.110,TLSv1.3,5574,"Application Data, Application Data, Application Data, Application Data"
232,26.9605457,172.20.40.110,151.101.66.187,TCP,54,57039  >  443 [ACK] Seq=131689 Ack=49956 Win=66048 Len=0
233,26.9648777,151.101.66.187,172.20.40.110,TLSv1.3,1434,Application Data
234,26.9648777,151.101.66.187,172.20.40.110,TLSv1.3,1434,Application Data
235,26.9648777,151.101.66.187,172.20.40.110,TLSv1.3,1434,Application Data
236,26.9648777,151.101.66.187,172.20.40.110,TLSv1.3,1434,Application Data
237,26.9648777,151.101.66.187,172.20.40.110,TLSv1.3,1007,"Application Data, Application Data"
238,26.9648777,151.101.66.187,172.20.40.110,TCP,60,443  >  57039 [ACK] Seq=56429 Ack=131689 Win=104448 Len=0
239,26.9650287,172.20.40.110,151.101.66.187,TCP,54,57039  >  443 [ACK] Seq=131689 Ack=56429 Win=66048 Len=0
240,27.4052951,172.20.40.110,151.101.66.187,TLSv1.3,2910,Application Data
241,27.4065512,172.20.40.110,151.101.66.187,TLSv1.3,2912,Application Data
242,27.4115595,172.20.40.110,151.101.66.187,TLSv1.3,2910,Application Data
243,27.4119044,172.20.40.110,151.101.66.187,TLSv1.3,2908,Application Data
244,27.412803,172.20.40.110,151.101.66.187,TLSv1.3,2916,Application Data
245,27.4252725,172.20.40.110,151.101.66.187,TLSv1.3,2861,Application Data
246,27.4319252,151.101.66.187,172.20.40.110,TCP,60,443  >  57039 [ACK] Seq=56429 Ack=134545 Win=101888 Len=0
247,27.4319252,151.101.66.187,172.20.40.110,TCP,60,443  >  57039 [ACK] Seq=56429 Ack=137403 Win=99328 Len=0
248,27.4343272,151.101.66.187,172.20.40.110,TLSv1.3,447,Application Data
249,27.4343272,151.101.66.187,172.20.40.110,TLSv1.3,104,Application Data
250,27.4346351,172.20.40.110,151.101.66.187,TCP,54,57039  >  443 [ACK] Seq=148782 Ack=56872 Win=65792 Len=0
251,27.4374705,151.101.66.187,172.20.40.110,TCP,60,443  >  57039 [ACK] Seq=56872 Ack=140259 Win=103424 Len=0
252,27.4374705,151.101.66.187,172.20.40.110,TCP,60,443  >  57039 [ACK] Seq=56872 Ack=145975 Win=102400 Len=0
253,27.4374705,151.101.66.187,172.20.40.110,TCP,60,443  >  57039 [ACK] Seq=56872 Ack=148782 Win=99840 Len=0
254,27.4405964,151.101.66.187,172.20.40.110,TLSv1.3,130,Application Data
255,27.441735,151.101.66.187,172.20.40.110,TLSv1.3,174,Application Data
256,27.441735,151.101.66.187,172.20.40.110,TLSv1.3,310,Application Data
257,27.4418078,172.20.40.110,151.101.66.187,TCP,54,57039  >  443 [ACK] Seq=148782 Ack=57324 Win=65280 Len=0
258,27.4427442,151.101.66.187,172.20.40.110,TLSv1.3,130,Application Data
259,27.4428098,172.20.40.110,151.101.66.187,TCP,54,57039  >  443 [ACK] Seq=148782 Ack=57400 Win=65024 Len=0
260,27.4750576,172.20.40.110,151.101.66.187,TLSv1.3,2910,Application Data
261,27.4873195,151.101.66.187,172.20.40.110,TCP,60,443  >  57039 [ACK] Seq=57400 Ack=151638 Win=110080 Len=0
262,27.4921958,151.101.66.187,172.20.40.110,TLSv1.3,124,Application Data
263,27.5360442,172.20.40.110,151.101.66.187,TCP,54,57039  >  443 [ACK] Seq=151638 Ack=57470 Win=65024 Len=0
264,27.542148,151.101.66.187,172.20.40.110,TCP,124,"[TCP Spurious Retransmission] 443  >  57039 [PSH, ACK] Seq=57400 Ack=151638 Win=110080 Len=70"
265,27.5422543,172.20.40.110,151.101.66.187,TCP,66,[TCP Dup ACK 263#1] 57039  >  443 [ACK] Seq=151638 Ack=57470 Win=65024 Len=0 SLE=57400 SRE=57470
266,28.5622214,172.20.40.110,151.101.66.187,TLSv1.3,248,Application Data
267,28.5690913,151.101.66.187,172.20.40.110,TCP,60,443  >  51833 [ACK] Seq=3285 Ack=2905 Win=143872 Len=0
268,28.5709712,172.20.40.110,151.101.66.187,TLSv1.3,2489,Application Data
269,28.5810413,151.101.66.187,172.20.40.110,TCP,60,443  >  57039 [ACK] Seq=57470 Ack=154073 Win=115200 Len=0
270,28.6561104,151.101.66.187,172.20.40.110,TLSv1.3,451,Application Data
271,28.6561104,151.101.66.187,172.20.40.110,TLSv1.3,353,Application Data
272,28.6561893,172.20.40.110,151.101.66.187,TCP,54,57039  >  443 [ACK] Seq=154073 Ack=58166 Win=66048 Len=0
273,28.6658184,151.101.66.187,172.20.40.110,TLSv1.3,218,Application Data
274,28.6723398,151.101.66.187,172.20.40.110,TLSv1.3,86,Application Data
275,28.6724326,172.20.40.110,151.101.66.187,TCP,54,51833  >  443 [ACK] Seq=2905 Ack=3481 Win=65792 Len=0
276,28.6849134,172.20.40.110,151.101.66.187,TLSv1.3,89,Application Data
277,28.690041,151.101.66.187,172.20.40.110,TLSv1.3,87,Application Data
278,28.6938175,151.101.66.187,172.20.40.110,TCP,60,443  >  51833 [ACK] Seq=3514 Ack=2940 Win=143872 Len=0
279,28.7023377,151.101.66.187,172.20.40.110,TLSv1.3,87,Application Data
280,28.7024081,172.20.40.110,151.101.66.187,TCP,54,51833  >  443 [ACK] Seq=2940 Ack=3547 Win=65792 Len=0
281,28.7063584,151.101.66.187,172.20.40.110,TLSv1.3,87,Application Data
282,28.7107918,151.101.66.187,172.20.40.110,TLSv1.3,86,Application Data
283,28.7108939,172.20.40.110,151.101.66.187,TCP,54,51833  >  443 [ACK] Seq=2940 Ack=3612 Win=65792 Len=0
284,28.7224618,151.101.66.187,172.20.40.110,TLSv1.3,86,Application Data
285,28.7224618,151.101.66.187,172.20.40.110,TLSv1.3,86,Application Data
286,28.7224618,151.101.66.187,172.20.40.110,TLSv1.3,86,Application Data
287,28.7224618,151.101.66.187,172.20.40.110,TLSv1.3,913,Application Data
288,28.7225447,172.20.40.110,151.101.66.187,TCP,54,51833  >  443 [ACK] Seq=2940 Ack=4567 Win=64768 Len=0
289,28.7233212,151.101.66.187,172.20.40.110,TLSv1.3,86,Application Data
290,28.7244769,151.101.66.187,172.20.40.110,TLSv1.3,100,Application Data
291,28.7244769,151.101.66.187,172.20.40.110,TLSv1.3,88,Application Data
292,28.7244769,151.101.66.187,172.20.40.110,TLSv1.3,251,Application Data
293,28.7245475,172.20.40.110,151.101.66.187,TCP,54,51833  >  443 [ACK] Seq=2940 Ack=4876 Win=66048 Len=0
294,28.7254643,151.101.66.187,172.20.40.110,TLSv1.3,85,Application Data
295,28.7599309,151.101.66.187,172.20.40.110,TCP,85,"[TCP Retransmission] 443  >  51833 [PSH, ACK] Seq=4876 Ack=2940 Win=143872 Len=31"
296,28.7599927,172.20.40.110,151.101.66.187,TCP,66,51833  >  443 [ACK] Seq=2940 Ack=4907 Win=66048 Len=0 SLE=4876 SRE=4907
297,29.0123555,172.20.40.110,151.101.66.187,TLSv1.3,2914,Application Data
298,29.0142459,172.20.40.110,151.101.66.187,TLSv1.3,2910,Application Data
299,29.0212935,151.101.66.187,172.20.40.110,TCP,60,443  >  57039 [ACK] Seq=58166 Ack=156933 Win=120832 Len=0
300,29.0236838,151.101.66.187,172.20.40.110,TCP,60,443  >  57039 [ACK] Seq=58166 Ack=159789 Win=126464 Len=0
301,29.0259154,151.101.66.187,172.20.40.110,TLSv1.3,422,Application Data
302,29.029161,151.101.66.187,172.20.40.110,TLSv1.3,131,Application Data
303,29.0292391,172.20.40.110,151.101.66.187,TCP,54,57039  >  443 [ACK] Seq=159789 Ack=58611 Win=65792 Len=0
304,29.8649701,172.20.40.110,151.101.66.187,TLSv1.3,2489,Application Data
305,29.8763727,151.101.66.187,172.20.40.110,TCP,60,443  >  57039 [ACK] Seq=58611 Ack=162224 Win=131584 Len=0
306,29.9613323,151.101.66.187,172.20.40.110,TLSv1.3,227,Application Data
307,29.9613323,151.101.66.187,172.20.40.110,TLSv1.3,353,Application Data
308,29.9614059,172.20.40.110,151.101.66.187,TCP,54,57039  >  443 [ACK] Seq=162224 Ack=59083 Win=65280 Len=0
309,30.1725264,172.20.40.110,151.101.66.187,TLSv1.3,2918,Application Data
310,30.172739,172.20.40.110,151.101.66.187,TLSv1.3,2920,Application Data
311,30.1728715,172.20.40.110,151.101.66.187,TLSv1.3,2914,Application Data
312,30.1729904,172.20.40.110,151.101.66.187,TLSv1.3,2916,Application Data
313,30.1736089,172.20.40.110,151.101.66.187,TLSv1.3,2914,Application Data
314,30.174131,172.20.40.110,151.101.66.187,TLSv1.3,2912,Application Data
315,30.1743376,172.20.40.110,151.101.66.187,TLSv1.3,2917,Application Data
316,30.1745247,172.20.40.110,151.101.66.187,TLSv1.3,2914,Application Data
317,30.2106818,172.20.40.110,151.101.66.187,TCP,1434,"[TCP Retransmission] 57039  >  443 [PSH, ACK] Seq=183737 Ack=59083 Win=65280 Len=1380"
318,30.216867,172.20.40.110,151.101.66.187,TLSv1.3,2914,Application Data
319,30.2222077,151.101.66.187,172.20.40.110,TCP,60,443  >  57039 [ACK] Seq=59083 Ack=165088 Win=137216 Len=0
320,30.2222077,151.101.66.187,172.20.40.110,TCP,60,443  >  57039 [ACK] Seq=59083 Ack=167954 Win=142848 Len=0
321,30.2222077,151.101.66.187,172.20.40.110,TCP,60,443  >  57039 [ACK] Seq=59083 Ack=170814 Win=148480 Len=0
322,30.2222077,151.101.66.187,172.20.40.110,TCP,60,443  >  57039 [ACK] Seq=59083 Ack=173676 Win=154624 Len=0
323,30.2222077,151.101.66.187,172.20.40.110,TCP,60,443  >  57039 [ACK] Seq=59083 Ack=176536 Win=160256 Len=0
324,30.2239511,151.101.66.187,172.20.40.110,TLSv1.3,217,Application Data
325,30.2239511,151.101.66.187,172.20.40.110,TLSv1.3,130,Application Data
326,30.2239511,151.101.66.187,172.20.40.110,TLSv1.3,104,Application Data
327,30.2239511,151.101.66.187,172.20.40.110,TCP,60,443  >  57039 [ACK] Seq=59372 Ack=179394 Win=165888 Len=0
328,30.2239511,151.101.66.187,172.20.40.110,TCP,60,443  >  57039 [ACK] Seq=59372 Ack=185117 Win=177664 Len=0
329,30.2239511,151.101.66.187,172.20.40.110,TCP,66,[TCP Dup ACK 328#1] 443  >  57039 [ACK] Seq=59372 Ack=185117 Win=177664 Len=0 SLE=183737 SRE=185117
330,30.2240732,172.20.40.110,151.101.66.187,TCP,54,57039  >  443 [ACK] Seq=187977 Ack=59372 Win=65024 Len=0
331,30.2249301,151.101.66.187,172.20.40.110,TLSv1.3,192,Application Data
332,30.2250116,172.20.40.110,151.101.66.187,TCP,54,57039  >  443 [ACK] Seq=187977 Ack=59510 Win=64768 Len=0
333,30.2262858,151.101.66.187,172.20.40.110,TCP,60,443  >  57039 [ACK] Seq=59510 Ack=187977 Win=183296 Len=0
334,30.2262858,151.101.66.187,172.20.40.110,TLSv1.3,130,Application Data
335,30.2274118,151.101.66.187,172.20.40.110,TLSv1.3,124,Application Data
336,30.2274118,151.101.66.187,172.20.40.110,TLSv1.3,131,Application Data
337,30.227506,172.20.40.110,151.101.66.187,TCP,54,57039  >  443 [ACK] Seq=187977 Ack=59733 Win=66048 Len=0
338,30.2295771,151.101.66.187,172.20.40.110,TLSv1.3,148,Application Data
339,30.2296489,172.20.40.110,151.101.66.187,TCP,54,57039  >  443 [ACK] Seq=187977 Ack=59827 Win=66048 Len=0
340,33.2034987,172.20.40.110,151.101.66.187,TLSv1.3,254,Application Data
341,33.2146847,151.101.66.187,172.20.40.110,TCP,60,443  >  51833 [ACK] Seq=4907 Ack=3140 Win=143872 Len=0
342,33.2675946,151.101.66.187,172.20.40.110,TLSv1.3,1243,Application Data
343,33.2675946,151.101.66.187,172.20.40.110,TLSv1.3,85,Application Data
344,33.2677236,172.20.40.110,151.101.66.187,TCP,54,51833  >  443 [ACK] Seq=3140 Ack=6127 Win=64768 Len=0
345,35.8464918,172.20.40.110,151.101.66.187,TLSv1.3,250,Application Data
346,35.8566736,151.101.66.187,172.20.40.110,TCP,60,443  >  51833 [ACK] Seq=6127 Ack=3336 Win=143872 Len=0
347,35.9163765,151.101.66.187,172.20.40.110,TLSv1.3,205,Application Data
348,35.9163765,151.101.66.187,172.20.40.110,TLSv1.3,932,Application Data
349,35.9163765,151.101.66.187,172.20.40.110,TLSv1.3,120,"Application Data, Application Data"
350,35.9163765,151.101.66.187,172.20.40.110,TLSv1.3,124,"Application Data, Application Data"
351,35.9163765,151.101.66.187,172.20.40.110,TLSv1.3,86,Application Data
352,35.9163765,151.101.66.187,172.20.40.110,TLSv1.3,249,Application Data
353,35.9164884,172.20.40.110,151.101.66.187,TCP,54,51833  >  443 [ACK] Seq=3336 Ack=7519 Win=66048 Len=0
354,35.9177477,172.20.40.110,151.101.66.187,TLSv1.3,89,Application Data
355,35.9247473,151.101.66.187,172.20.40.110,TCP,60,443  >  51833 [ACK] Seq=7519 Ack=3371 Win=143872 Len=0
356,37.6742999,172.20.40.110,151.101.66.187,TLSv1.3,2681,Application Data
357,37.6884959,151.101.66.187,172.20.40.110,TCP,60,443  >  57039 [ACK] Seq=59827 Ack=190604 Win=188416 Len=0
358,37.7437311,151.101.66.187,172.20.40.110,TLSv1.3,494,Application Data
359,37.7437311,151.101.66.187,172.20.40.110,TLSv1.3,357,Application Data
360,37.7438407,172.20.40.110,151.101.66.187,TCP,54,57039  >  443 [ACK] Seq=190604 Ack=60570 Win=65280 Len=0
361,37.7479619,172.20.40.110,151.101.66.187,TLSv1.3,89,Application Data
362,37.7482776,172.20.40.110,151.101.66.187,TLSv1.3,247,Application Data
363,37.7553955,151.101.66.187,172.20.40.110,TCP,60,443  >  57039 [ACK] Seq=60570 Ack=190639 Win=188416 Len=0
364,37.7575884,151.101.66.187,172.20.40.110,TCP,60,443  >  51833 [ACK] Seq=7519 Ack=3564 Win=143872 Len=0
365,37.813991,151.101.66.187,172.20.40.110,TLSv1.3,1238,Application Data
366,37.813991,151.101.66.187,172.20.40.110,TLSv1.3,85,Application Data
367,37.8140998,172.20.40.110,151.101.66.187,TCP,54,51833  >  443 [ACK] Seq=3564 Ack=8734 Win=65024 Len=0
368,40.4997317,172.20.40.110,151.101.66.187,TLSv1.3,2934,Application Data
369,40.5083587,172.20.40.110,151.101.66.187,TLSv1.3,2928,Application Data
370,40.5157433,151.101.66.187,172.20.40.110,TCP,60,443  >  57039 [ACK] Seq=60570 Ack=193519 Win=194048 Len=0
371,40.5174512,151.101.66.187,172.20.40.110,TLSv1.3,246,Application Data
372,40.5219257,151.101.66.187,172.20.40.110,TCP,60,443  >  57039 [ACK] Seq=60762 Ack=196393 Win=199680 Len=0
373,40.5222814,172.20.40.110,151.101.66.187,TLSv1.3,2935,Application Data
374,40.5225434,172.20.40.110,151.101.66.187,TLSv1.3,2934,Application Data
375,40.5228404,172.20.40.110,151.101.66.187,TLSv1.3,2928,Application Data
376,40.5241849,151.101.66.187,172.20.40.110,TLSv1.3,131,Application Data
377,40.525566,172.20.40.110,151.101.66.187,TLSv1.3,2931,Application Data
378,40.5258704,172.20.40.110,151.101.66.187,TLSv1.3,2928,Application Data
379,40.5260822,172.20.40.110,151.101.66.187,TLSv1.3,2934,Application Data
380,40.5347706,172.20.40.110,151.101.66.187,TLSv1.3,2927,Application Data
381,40.5350343,172.20.40.110,151.101.66.187,TLSv1.3,2928,Application Data
382,40.5362682,172.20.40.110,151.101.66.187,TLSv1.3,2925,Application Data
383,40.5540447,151.101.66.187,172.20.40.110,TCP,131,"[TCP Spurious Retransmission] 443  >  57039 [PSH, ACK] Seq=60762 Ack=196393 Win=199680 Len=77"
384,40.5541165,172.20.40.110,151.101.66.187,TCP,66,[TCP Dup ACK 377#1] 57039  >  443 [ACK] Seq=222277 Ack=60839 Win=65024 Len=0 SLE=60762 SRE=60839
385,40.5553649,151.101.66.187,172.20.40.110,TCP,60,443  >  57039 [ACK] Seq=60839 Ack=199274 Win=205824 Len=0
386,40.5553649,151.101.66.187,172.20.40.110,TCP,60,443  >  57039 [ACK] Seq=60839 Ack=202154 Win=211456 Len=0
387,40.5553649,151.101.66.187,172.20.40.110,TCP,60,443  >  57039 [ACK] Seq=60839 Ack=205028 Win=217088 Len=0
388,40.5553649,151.101.66.187,172.20.40.110,TCP,60,443  >  57039 [ACK] Seq=60839 Ack=207905 Win=222720 Len=0
389,40.5553649,151.101.66.187,172.20.40.110,TCP,60,443  >  57039 [ACK] Seq=60839 Ack=210779 Win=228864 Len=0
390,40.5553649,151.101.66.187,172.20.40.110,TCP,60,443  >  57039 [ACK] Seq=60839 Ack=213659 Win=234496 Len=0
391,40.5553649,151.101.66.187,172.20.40.110,TCP,60,443  >  57039 [ACK] Seq=60839 Ack=216532 Win=240128 Len=0
392,40.5592587,151.101.66.187,172.20.40.110,TCP,60,443  >  57039 [ACK] Seq=60839 Ack=219406 Win=245760 Len=0
393,40.5592587,151.101.66.187,172.20.40.110,TCP,60,443  >  57039 [ACK] Seq=60839 Ack=222277 Win=251904 Len=0
394,40.5592587,151.101.66.187,172.20.40.110,TLSv1.3,206,"Application Data, Application Data"
395,40.5593522,172.20.40.110,151.101.66.187,TCP,54,57039  >  443 [ACK] Seq=222277 Ack=60991 Win=64768 Len=0
396,40.5604553,151.101.66.187,172.20.40.110,TLSv1.3,131,Application Data
397,40.5604553,151.101.66.187,172.20.40.110,TLSv1.3,125,Application Data
398,40.5604553,151.101.66.187,172.20.40.110,TLSv1.3,130,Application Data
399,40.5606147,172.20.40.110,151.101.66.187,TCP,54,57039  >  443 [ACK] Seq=222277 Ack=61215 Win=66048 Len=0
400,40.5616681,151.101.66.187,172.20.40.110,TLSv1.3,229,Application Data
401,40.5616681,151.101.66.187,172.20.40.110,TLSv1.3,206,"Application Data, Application Data"
402,40.5617585,172.20.40.110,151.101.66.187,TCP,54,57039  >  443 [ACK] Seq=222277 Ack=61542 Win=65792 Len=0
403,43.8839766,172.20.40.110,151.101.66.187,TLSv1.3,2931,Application Data
404,43.893836,151.101.66.187,172.20.40.110,TCP,60,443  >  57039 [ACK] Seq=61542 Ack=225154 Win=257536 Len=0
405,43.895004,151.101.66.187,172.20.40.110,TLSv1.3,415,Application Data
406,43.9228842,172.20.40.110,151.101.66.187,TLSv1.3,2945,Application Data
407,43.9262948,151.101.66.187,172.20.40.110,TCP,415,"[TCP Spurious Retransmission] 443  >  57039 [PSH, ACK] Seq=61542 Ack=225154 Win=257536 Len=361"
408,43.9263963,172.20.40.110,151.101.66.187,TCP,66,[TCP Dup ACK 406#1] 57039  >  443 [ACK] Seq=228045 Ack=61903 Win=65536 Len=0 SLE=61542 SRE=61903
409,43.931705,151.101.66.187,172.20.40.110,TCP,60,443  >  57039 [ACK] Seq=61903 Ack=228045 Win=263168 Len=0
410,44.1545585,151.101.66.187,172.20.40.110,TLSv1.3,251,Application Data
411,44.1545585,151.101.66.187,172.20.40.110,TCP,1434,443  >  57039 [ACK] Seq=62100 Ack=228045 Win=263168 Len=1380 [TCP PDU reassembled in 412]
412,44.1545585,151.101.66.187,172.20.40.110,TLSv1.3,1434,Application Data
413,44.1545585,151.101.66.187,172.20.40.110,TLSv1.3,1434,Application Data
414,44.1545585,151.101.66.187,172.20.40.110,TLSv1.3,1434,Application Data
415,44.1545585,151.101.66.187,172.20.40.110,TLSv1.3,1245,"Application Data, Application Data"
416,44.1545585,151.101.66.187,172.20.40.110,TCP,2814,443  >  57039 [ACK] Seq=68811 Ack=228045 Win=263168 Len=2760 [TCP PDU reassembled in 419]
417,44.154714,172.20.40.110,151.101.66.187,TCP,54,57039  >  443 [ACK] Seq=228045 Ack=71571 Win=66048 Len=0
418,44.1574725,151.101.66.187,172.20.40.110,TCP,4194,443  >  57039 [ACK] Seq=71571 Ack=228045 Win=263168 Len=4140 [TCP PDU reassembled in 419]
419,44.1574725,151.101.66.187,172.20.40.110,TLSv1.3,1377,Application Data
420,44.1574725,151.101.66.187,172.20.40.110,TCP,4194,443  >  57039 [ACK] Seq=77034 Ack=228045 Win=263168 Len=4140 [TCP PDU reassembled in 432]
421,44.1576338,172.20.40.110,151.101.66.187,TCP,54,57039  >  443 [ACK] Seq=228045 Ack=81174 Win=66048 Len=0
422,44.1585559,172.20.40.110,151.101.66.187,TLSv1.3,89,Application Data
423,44.1632216,151.101.66.187,172.20.40.110,TCP,1434,443  >  57039 [ACK] Seq=81174 Ack=228045 Win=263168 Len=1380 [TCP PDU reassembled in 432]
424,44.1632216,151.101.66.187,172.20.40.110,TCP,1434,443  >  57039 [ACK] Seq=82554 Ack=228045 Win=263168 Len=1380 [TCP PDU reassembled in 432]
425,44.1632216,151.101.66.187,172.20.40.110,TCP,1434,443  >  57039 [ACK] Seq=83934 Ack=228045 Win=263168 Len=1380 [TCP PDU reassembled in 432]
426,44.1632216,151.101.66.187,172.20.40.110,TCP,1434,443  >  57039 [ACK] Seq=85314 Ack=228045 Win=263168 Len=1380 [TCP PDU reassembled in 432]
427,44.1632216,151.101.66.187,172.20.40.110,TCP,1434,"443  >  57039 [PSH, ACK] Seq=86694 Ack=228045 Win=263168 Len=1380 [TCP PDU reassembled in 432]"
428,44.1632216,151.101.66.187,172.20.40.110,TCP,1434,443  >  57039 [ACK] Seq=88074 Ack=228045 Win=263168 Len=1380 [TCP PDU reassembled in 432]
429,44.1632216,151.101.66.187,172.20.40.110,TCP,1434,443  >  57039 [ACK] Seq=89454 Ack=228045 Win=263168 Len=1380 [TCP PDU reassembled in 432]
430,44.1634453,172.20.40.110,151.101.66.187,TCP,54,57039  >  443 [ACK] Seq=228080 Ack=90834 Win=66048 Len=0
431,44.1659588,151.101.66.187,172.20.40.110,TCP,1434,443  >  57039 [ACK] Seq=90834 Ack=228045 Win=263168 Len=1380 [TCP PDU reassembled in 432]
432,44.1659588,151.101.66.187,172.20.40.110,TLSv1.3,1311,"Application Data, Application Data"
433,44.1659588,151.101.66.187,172.20.40.110,TCP,6954,443  >  57039 [ACK] Seq=93471 Ack=228045 Win=263168 Len=6900 [TCP PDU reassembled in 437]
434,44.1662738,172.20.40.110,151.101.66.187,TCP,54,57039  >  443 [ACK] Seq=228080 Ack=100371 Win=66048 Len=0
435,44.1679779,151.101.66.187,172.20.40.110,TCP,5574,"443  >  57039 [PSH, ACK] Seq=100371 Ack=228045 Win=263168 Len=5520 [TCP PDU reassembled in 437]"
436,44.1681074,172.20.40.110,151.101.66.187,TCP,54,57039  >  443 [ACK] Seq=228080 Ack=105891 Win=132352 Len=0
437,44.1738944,151.101.66.187,172.20.40.110,TLSv1.3,437,Application Data
438,44.1738944,151.101.66.187,172.20.40.110,TCP,437,"[TCP Retransmission] 443  >  57039 [PSH, ACK] Seq=105891 Ack=228045 Win=263168 Len=383 [TCP PDU reassembled in 437]"
439,44.1738944,151.101.66.187,172.20.40.110,TCP,60,443  >  57039 [ACK] Seq=106274 Ack=228080 Win=263168 Len=0
440,44.1740194,172.20.40.110,151.101.66.187,TCP,66,57039  >  443 [ACK] Seq=228080 Ack=106274 Win=132096 Len=0 SLE=105891 SRE=106274
441,44.4204129,172.20.40.110,151.101.66.187,TLSv1.3,2864,Application Data
442,44.4211258,172.20.40.110,151.101.66.187,TLSv1.3,2866,Application Data
443,44.4265245,172.20.40.110,151.101.66.187,TLSv1.3,2864,Application Data
444,44.428025,172.20.40.110,151.101.66.187,TLSv1.3,2862,Application Data
445,44.4287069,172.20.40.110,151.101.66.187,TLSv1.3,2870,Application Data
446,44.4653331,172.20.40.110,151.101.66.187,TCP,1434,"[TCP Retransmission] 57039  >  443 [PSH, ACK] Seq=240756 Ack=106274 Win=132096 Len=1380"
447,44.4802248,172.20.40.110,151.101.66.187,TLSv1.3,2881,Application Data
448,44.4879044,172.20.40.110,151.101.66.187,TLSv1.3,2864,Application Data
449,44.4887364,172.20.40.110,151.101.66.187,TLSv1.3,2868,Application Data
450,44.5676926,151.101.66.187,172.20.40.110,TCP,60,443  >  57039 [ACK] Seq=106274 Ack=230890 Win=268800 Len=0
451,44.5676926,151.101.66.187,172.20.40.110,TCP,60,443  >  57039 [ACK] Seq=106274 Ack=233702 Win=274432 Len=0
452,44.5805889,151.101.66.187,172.20.40.110,TLSv1.3,251,Application Data
453,44.583255,151.101.66.187,172.20.40.110,TLSv1.3,132,Application Data
454,44.583255,151.101.66.187,172.20.40.110,TCP,60,443  >  57039 [ACK] Seq=106549 Ack=236512 Win=280064 Len=0
455,44.583255,151.101.66.187,172.20.40.110,TCP,60,443  >  57039 [ACK] Seq=106549 Ack=239320 Win=285696 Len=0
456,44.583255,151.101.66.187,172.20.40.110,TCP,60,443  >  57039 [ACK] Seq=106549 Ack=242136 Win=291328 Len=0
457,44.583255,151.101.66.187,172.20.40.110,TLSv1.3,130,Application Data
458,44.583255,151.101.66.187,172.20.40.110,TLSv1.3,175,Application Data
459,44.5836948,172.20.40.110,151.101.66.187,TCP,54,57039  >  443 [ACK] Seq=250587 Ack=106746 Win=131584 Len=0
460,44.5856603,151.101.66.187,172.20.40.110,TLSv1.3,130,Application Data
461,44.5923381,151.101.66.187,172.20.40.110,TCP,130,"[TCP Retransmission] 443  >  57039 [PSH, ACK] Seq=106746 Ack=242136 Win=291328 Len=76"
462,44.5923381,151.101.66.187,172.20.40.110,TCP,66,[TCP Dup ACK 456#1] 443  >  57039 [ACK] Seq=106822 Ack=242136 Win=291328 Len=0 SLE=240756 SRE=242136
463,44.5923381,151.101.66.187,172.20.40.110,TCP,60,443  >  57039 [ACK] Seq=106822 Ack=244963 Win=296960 Len=0
464,44.5923381,151.101.66.187,172.20.40.110,TCP,60,443  >  57039 [ACK] Seq=106822 Ack=247773 Win=302592 Len=0
465,44.5923381,151.101.66.187,172.20.40.110,TCP,60,443  >  57039 [ACK] Seq=106822 Ack=249153 Win=305664 Len=0
466,44.5923381,151.101.66.187,172.20.40.110,TCP,60,443  >  57039 [ACK] Seq=106822 Ack=250587 Win=308224 Len=0
467,44.5923381,151.101.66.187,172.20.40.110,TLSv1.3,124,Application Data
468,44.5926822,172.20.40.110,151.101.66.187,TCP,66,57039  >  443 [ACK] Seq=250587 Ack=106822 Win=131328 Len=0 SLE=106746 SRE=106822
469,44.5929881,172.20.40.110,151.101.66.187,TCP,54,57039  >  443 [ACK] Seq=250587 Ack=106892 Win=131328 Len=0
470,44.6112583,151.101.66.187,172.20.40.110,TLSv1.3,125,Application Data
471,44.6112583,151.101.66.187,172.20.40.110,TLSv1.3,131,Application Data
472,44.6114624,172.20.40.110,151.101.66.187,TCP,54,57039  >  443 [ACK] Seq=250587 Ack=107040 Win=131328 Len=0
473,45.9462848,172.20.40.110,151.101.66.187,TLSv1.3,2864,Application Data
474,45.9472238,172.20.40.110,151.101.66.187,TLSv1.3,2866,Application Data
475,45.9588857,172.20.40.110,151.101.66.187,TLSv1.3,2864,Application Data
476,45.9592859,172.20.40.110,151.101.66.187,TLSv1.3,2862,Application Data
477,45.9664768,151.101.66.187,172.20.40.110,TCP,60,443  >  57039 [ACK] Seq=107040 Ack=253397 Win=313856 Len=0
478,45.9664768,151.101.66.187,172.20.40.110,TCP,60,443  >  57039 [ACK] Seq=107040 Ack=256209 Win=319488 Len=0
479,45.9664768,151.101.66.187,172.20.40.110,TLSv1.3,369,Application Data
480,45.9664768,151.101.66.187,172.20.40.110,TLSv1.3,104,Application Data
481,45.9665798,172.20.40.110,151.101.66.187,TCP,54,57039  >  443 [ACK] Seq=261827 Ack=107405 Win=132352 Len=0
482,45.9716057,151.101.66.187,172.20.40.110,TCP,60,443  >  57039 [ACK] Seq=107405 Ack=259019 Win=325120 Len=0
483,45.9716057,151.101.66.187,172.20.40.110,TCP,60,443  >  57039 [ACK] Seq=107405 Ack=261827 Win=330752 Len=0
484,46.0124689,151.101.66.187,172.20.40.110,TLSv1.3,154,"Application Data, Application Data"
485,46.0125372,172.20.40.110,151.101.66.187,TCP,54,57039  >  443 [ACK] Seq=261827 Ack=107505 Win=132352 Len=0
486,46.1612726,172.20.40.110,151.101.66.187,TLSv1.3,2864,Application Data
487,46.2184133,151.101.66.187,172.20.40.110,TCP,60,443  >  57039 [ACK] Seq=107505 Ack=264637 Win=336384 Len=0
488,46.22032,151.101.66.187,172.20.40.110,TLSv1.3,98,Application Data
489,46.2612823,172.20.40.110,151.101.66.187,TCP,54,57039  >  443 [ACK] Seq=264637 Ack=107549 Win=132096 Len=0
490,46.3286937,172.20.40.110,151.101.66.187,TLSv1.3,2874,Application Data
491,46.3978723,151.101.66.187,172.20.40.110,TCP,60,443  >  57039 [ACK] Seq=107549 Ack=267457 Win=342016 Len=0
492,46.3985101,151.101.66.187,172.20.40.110,TLSv1.3,214,Application Data
493,46.4437178,172.20.40.110,151.101.66.187,TCP,54,57039  >  443 [ACK] Seq=267457 Ack=107709 Win=132096 Len=0
494,46.62533,172.20.40.110,151.101.66.187,TLSv1.3,2868,Application Data
495,46.6284243,172.20.40.110,151.101.66.187,TLSv1.3,2864,Application Data
496,46.63561,151.101.66.187,172.20.40.110,TCP,60,443  >  57039 [ACK] Seq=107709 Ack=270271 Win=347648 Len=0
497,46.6376869,151.101.66.187,172.20.40.110,TCP,60,443  >  57039 [ACK] Seq=107709 Ack=273081 Win=353280 Len=0
498,46.6390141,151.101.66.187,172.20.40.110,TLSv1.3,135,Application Data
499,46.64329,151.101.66.187,172.20.40.110,TLSv1.3,137,Application Data
500,46.6433725,172.20.40.110,151.101.66.187,TCP,54,57039  >  443 [ACK] Seq=273081 Ack=107873 Win=131840 Len=0
501,48.5109455,172.20.40.110,151.101.66.187,TLSv1.3,2882,Application Data
502,48.5224239,151.101.66.187,172.20.40.110,TCP,60,443  >  57039 [ACK] Seq=107873 Ack=275909 Win=358912 Len=0
503,48.5250776,151.101.66.187,172.20.40.110,TLSv1.3,214,Application Data
504,48.5686603,172.20.40.110,151.101.66.187,TCP,54,57039  >  443 [ACK] Seq=275909 Ack=108033 Win=131840 Len=0
505,48.9641178,172.20.40.110,151.101.66.187,TLSv1.3,2772,Application Data
506,48.9729871,151.101.66.187,172.20.40.110,TCP,60,443  >  57039 [ACK] Seq=108033 Ack=278627 Win=364544 Len=0
507,48.975169,172.20.40.110,151.101.66.187,TLSv1.3,2768,Application Data
508,48.9770202,151.101.66.187,172.20.40.110,TLSv1.3,104,Application Data
509,48.9799083,172.20.40.110,151.101.66.187,TLSv1.3,2770,Application Data
510,48.9856406,151.101.66.187,172.20.40.110,TCP,60,443  >  57039 [ACK] Seq=108083 Ack=281341 Win=370176 Len=0
511,48.9881081,151.101.66.187,172.20.40.110,TLSv1.3,176,Application Data
512,48.9895191,151.101.66.187,172.20.40.110,TCP,60,443  >  57039 [ACK] Seq=108205 Ack=284057 Win=375296 Len=0
513,48.9931221,151.101.66.187,172.20.40.110,TLSv1.3,130,Application Data
514,48.9931905,172.20.40.110,151.101.66.187,TCP,54,57039  >  443 [ACK] Seq=284057 Ack=108281 Win=131584 Len=0
515,48.9933978,172.20.40.110,151.101.66.187,TLSv1.3,2768,Application Data
516,49.002416,172.20.40.110,151.101.66.187,TLSv1.3,2766,Application Data
517,49.0028874,151.101.66.187,172.20.40.110,TCP,60,443  >  57039 [ACK] Seq=108281 Ack=286771 Win=381440 Len=0
518,49.0074734,151.101.66.187,172.20.40.110,TLSv1.3,130,Application Data
519,49.0119575,151.101.66.187,172.20.40.110,TCP,60,443  >  57039 [ACK] Seq=108357 Ack=289483 Win=386560 Len=0
520,49.0151894,151.101.66.187,172.20.40.110,TLSv1.3,130,Application Data
521,49.0152728,172.20.40.110,151.101.66.187,TCP,54,57039  >  443 [ACK] Seq=289483 Ack=108433 Win=131328 Len=0
522,49.0209399,172.20.40.110,151.101.66.187,TLSv1.3,2785,Application Data
523,49.0312023,151.101.66.187,172.20.40.110,TCP,60,443  >  57039 [ACK] Seq=108433 Ack=292214 Win=392192 Len=0
524,49.0358007,151.101.66.187,172.20.40.110,TLSv1.3,125,Application Data
525,49.0792522,172.20.40.110,151.101.66.187,TCP,54,57039  >  443 [ACK] Seq=292214 Ack=108504 Win=131328 Len=0
526,49.1746157,172.20.40.110,151.101.66.187,TLSv1.3,2768,Application Data
527,49.1878424,151.101.66.187,172.20.40.110,TCP,60,443  >  57039 [ACK] Seq=108504 Ack=294928 Win=397312 Len=0
528,49.1908919,151.101.66.187,172.20.40.110,TLSv1.3,279,Application Data
529,49.2342373,172.20.40.110,151.101.66.187,TCP,54,57039  >  443 [ACK] Seq=294928 Ack=108729 Win=131072 Len=0
530,49.5630305,172.20.40.110,151.101.66.187,TLSv1.3,2768,Application Data
531,49.5752687,151.101.66.187,172.20.40.110,TCP,60,443  >  57039 [ACK] Seq=108729 Ack=297642 Win=402944 Len=0
532,49.5781055,151.101.66.187,172.20.40.110,TLSv1.3,214,Application Data
533,49.6195952,172.20.40.110,151.101.66.187,TCP,54,57039  >  443 [ACK] Seq=297642 Ack=108889 Win=132352 Len=0
534,49.693763,172.20.40.110,151.101.66.187,TLSv1.3,2774,Application Data
535,49.7053118,151.101.66.187,172.20.40.110,TCP,60,443  >  57039 [ACK] Seq=108889 Ack=300362 Win=408576 Len=0
536,49.7099733,151.101.66.187,172.20.40.110,TLSv1.3,131,Application Data
537,49.7589066,172.20.40.110,151.101.66.187,TCP,54,57039  >  443 [ACK] Seq=300362 Ack=108966 Win=132352 Len=0
538,52.3600191,172.20.40.110,151.101.66.187,TLSv1.3,2777,Application Data
539,52.3706114,151.101.66.187,172.20.40.110,TCP,60,443  >  57039 [ACK] Seq=108966 Ack=303085 Win=413696 Len=0
540,52.3715349,151.101.66.187,172.20.40.110,TLSv1.3,241,Application Data
541,52.4192287,172.20.40.110,151.101.66.187,TCP,54,57039  >  443 [ACK] Seq=303085 Ack=109153 Win=132096 Len=0
542,54.4329949,172.20.40.110,151.101.66.187,TLSv1.3,2590,Application Data
543,54.4452395,151.101.66.187,172.20.40.110,TCP,60,443  >  57039 [ACK] Seq=109153 Ack=305621 Win=418816 Len=0
544,54.5055635,151.101.66.187,172.20.40.110,TLSv1.3,344,Application Data
545,54.5055635,151.101.66.187,172.20.40.110,TLSv1.3,357,Application Data
546,54.5056824,172.20.40.110,151.101.66.187,TCP,54,57039  >  443 [ACK] Seq=305621 Ack=109746 Win=131584 Len=0
547,54.50768,172.20.40.110,151.101.66.187,TLSv1.3,89,Application Data
548,54.5165092,151.101.66.187,172.20.40.110,TCP,60,443  >  57039 [ACK] Seq=109746 Ack=305656 Win=418816 Len=0
549,55.6321367,172.20.40.110,151.101.66.187,TLSv1.3,2781,Application Data
550,55.6358529,172.20.40.110,151.101.66.187,TLSv1.3,2775,Application Data
551,55.6361636,172.20.40.110,151.101.66.187,TLSv1.3,2782,Application Data
552,55.6364026,172.20.40.110,151.101.66.187,TLSv1.3,2781,Application Data
553,55.6371184,172.20.40.110,151.101.66.187,TLSv1.3,2775,Application Data
554,55.6431124,172.20.40.110,151.101.66.187,TLSv1.3,2775,Application Data
555,55.6457189,151.101.66.187,172.20.40.110,TCP,60,443  >  57039 [ACK] Seq=109746 Ack=308383 Win=424448 Len=0
556,55.6457668,172.20.40.110,151.101.66.187,TLSv1.3,2778,Application Data
557,55.6460092,172.20.40.110,151.101.66.187,TLSv1.3,2775,Application Data
558,55.6474693,172.20.40.110,151.101.66.187,TLSv1.3,2781,Application Data
559,55.6481954,172.20.40.110,151.101.66.187,TLSv1.3,2772,Application Data
560,55.6511451,172.20.40.110,151.101.66.187,TLSv1.3,2774,Application Data
561,55.6624152,151.101.66.187,172.20.40.110,TLSv1.3,290,Application Data
562,55.6624152,151.101.66.187,172.20.40.110,TCP,60,443  >  57039 [ACK] Seq=109982 Ack=311104 Win=429568 Len=0
563,55.6624152,151.101.66.187,172.20.40.110,TCP,60,443  >  57039 [ACK] Seq=109982 Ack=313832 Win=435200 Len=0
564,55.6652345,151.101.66.187,172.20.40.110,TLSv1.3,131,Application Data
565,55.6652345,151.101.66.187,172.20.40.110,TLSv1.3,286,Application Data
566,55.6653147,172.20.40.110,151.101.66.187,TCP,54,57039  >  443 [ACK] Seq=335611 Ack=110291 Win=132352 Len=0
567,55.6686939,151.101.66.187,172.20.40.110,TCP,60,443  >  57039 [ACK] Seq=110291 Ack=316559 Win=440832 Len=0
568,55.6686939,151.101.66.187,172.20.40.110,TCP,60,443  >  57039 [ACK] Seq=110291 Ack=322001 Win=451584 Len=0
569,55.6686939,151.101.66.187,172.20.40.110,TCP,60,443  >  57039 [ACK] Seq=110291 Ack=324725 Win=457216 Len=0
570,55.6686939,151.101.66.187,172.20.40.110,TLSv1.3,130,Application Data
571,55.6686939,151.101.66.187,172.20.40.110,TLSv1.3,130,Application Data
572,55.6686939,151.101.66.187,172.20.40.110,TLSv1.3,130,Application Data
573,55.6686939,151.101.66.187,172.20.40.110,TLSv1.3,131,Application Data
574,55.6686939,151.101.66.187,172.20.40.110,TCP,60,443  >  57039 [ACK] Seq=110596 Ack=327446 Win=462336 Len=0
575,55.6686939,151.101.66.187,172.20.40.110,TCP,60,443  >  57039 [ACK] Seq=110596 Ack=330173 Win=467968 Len=0
576,55.6686939,151.101.66.187,172.20.40.110,TCP,60,443  >  57039 [ACK] Seq=110596 Ack=332891 Win=473600 Len=0
577,55.668828,172.20.40.110,151.101.66.187,TCP,54,57039  >  443 [ACK] Seq=335611 Ack=110596 Win=132096 Len=0
578,55.6709878,151.101.66.187,172.20.40.110,TCP,60,443  >  57039 [ACK] Seq=110596 Ack=335611 Win=478720 Len=0
579,55.6709878,151.101.66.187,172.20.40.110,TLSv1.3,130,Application Data
580,55.6709878,151.101.66.187,172.20.40.110,TLSv1.3,125,Application Data
581,55.6710918,172.20.40.110,151.101.66.187,TCP,54,57039  >  443 [ACK] Seq=335611 Ack=110743 Win=131840 Len=0
582,55.6721531,151.101.66.187,172.20.40.110,TLSv1.3,135,Application Data
583,55.6722544,172.20.40.110,151.101.66.187,TCP,54,57039  >  443 [ACK] Seq=335611 Ack=110824 Win=131840 Len=0
584,55.6744504,151.101.66.187,172.20.40.110,TLSv1.3,125,Application Data
585,55.7173628,172.20.40.110,151.101.66.187,TCP,54,57039  >  443 [ACK] Seq=335611 Ack=110895 Win=131840 Len=0
586,57.0186199,172.20.40.110,151.101.66.187,TLSv1.3,2781,Application Data
587,57.0274348,151.101.66.187,172.20.40.110,TCP,60,443  >  57039 [ACK] Seq=110895 Ack=338338 Win=484352 Len=0
588,57.3627861,151.101.66.187,172.20.40.110,TLSv1.3,365,Application Data
589,57.3627861,151.101.66.187,172.20.40.110,TCP,9714,"443  >  57039 [PSH, ACK] Seq=111206 Ack=338338 Win=484352 Len=9660 [TCP PDU reassembled in 594]"
590,57.3628925,172.20.40.110,151.101.66.187,TCP,54,57039  >  443 [ACK] Seq=338338 Ack=120866 Win=132352 Len=0
591,57.3646699,151.101.66.187,172.20.40.110,TCP,1434,"443  >  57039 [PSH, ACK] Seq=120866 Ack=338338 Win=484352 Len=1380 [TCP PDU reassembled in 594]"
592,57.3678605,151.101.66.187,172.20.40.110,TCP,1434,443  >  57039 [ACK] Seq=122246 Ack=338338 Win=484352 Len=1380 [TCP PDU reassembled in 594]
593,57.3678605,151.101.66.187,172.20.40.110,TCP,1434,443  >  57039 [ACK] Seq=123626 Ack=338338 Win=484352 Len=1380 [TCP PDU reassembled in 594]
594,57.3678605,151.101.66.187,172.20.40.110,TLSv1.3,8334,Application Data
595,57.3679988,172.20.40.110,151.101.66.187,TCP,54,57039  >  443 [ACK] Seq=338338 Ack=133286 Win=132352 Len=0
596,57.3702307,151.101.66.187,172.20.40.110,TCP,9714,"443  >  57039 [PSH, ACK] Seq=133286 Ack=338338 Win=484352 Len=9660 [TCP PDU reassembled in 598]"
597,57.3703312,172.20.40.110,151.101.66.187,TCP,54,57039  >  443 [ACK] Seq=338338 Ack=142946 Win=132352 Len=0
598,57.371565,151.101.66.187,172.20.40.110,TLSv1.3,2814,Application Data
599,57.371565,151.101.66.187,172.20.40.110,TLSv1.3,685,Application Data
600,57.37171,172.20.40.110,151.101.66.187,TCP,54,57039  >  443 [ACK] Seq=338338 Ack=146337 Win=132352 Len=0
601,57.5120314,172.20.40.110,151.101.66.187,TLSv1.3,2768,Application Data
602,57.5195754,172.20.40.110,151.101.66.187,TLSv1.3,2762,Application Data
603,57.5197656,172.20.40.110,151.101.66.187,TLSv1.3,2764,Application Data
604,57.5199263,172.20.40.110,151.101.66.187,TLSv1.3,2762,Application Data
605,57.5584473,172.20.40.110,151.101.66.187,TCP,1434,"[TCP Retransmission] 57039  >  443 [PSH, ACK] Seq=347798 Ack=146337 Win=132352 Len=1380"
606,57.5664108,172.20.40.110,151.101.66.187,TLSv1.3,2760,Application Data
607,57.5666639,172.20.40.110,151.101.66.187,TLSv1.3,2762,Application Data
608,57.5700857,172.20.40.110,151.101.66.187,TLSv1.3,2711,Application Data
609,57.5706091,172.20.40.110,151.101.66.187,TLSv1.3,2718,Application Data
610,57.5957571,172.20.40.110,151.101.66.187,TLSv1.3,2717,Application Data
611,57.6415899,151.101.66.187,172.20.40.110,TCP,60,443  >  57039 [ACK] Seq=146337 Ack=341052 Win=489472 Len=0
612,57.6415899,151.101.66.187,172.20.40.110,TLSv1.3,446,Application Data
613,57.6464878,151.101.66.187,172.20.40.110,TCP,60,443  >  57039 [ACK] Seq=146729 Ack=343760 Win=495104 Len=0
614,57.6464878,151.101.66.187,172.20.40.110,TCP,60,443  >  57039 [ACK] Seq=146729 Ack=346470 Win=500736 Len=0
615,57.6464878,151.101.66.187,172.20.40.110,TCP,60,443  >  57039 [ACK] Seq=146729 Ack=349178 Win=505856 Len=0
616,57.6464878,151.101.66.187,172.20.40.110,TLSv1.3,130,Application Data
617,57.6464878,151.101.66.187,172.20.40.110,TLSv1.3,132,Application Data
618,57.6464878,151.101.66.187,172.20.40.110,TLSv1.3,130,Application Data
619,57.6466787,172.20.40.110,151.101.66.187,TCP,54,57039  >  443 [ACK] Seq=362576 Ack=146959 Win=131840 Len=0
620,57.6762456,151.101.66.187,172.20.40.110,TCP,66,[TCP Dup ACK 615#1] 443  >  57039 [ACK] Seq=146959 Ack=349178 Win=505856 Len=0 SLE=347798 SRE=349178
621,57.6762456,151.101.66.187,172.20.40.110,TCP,60,443  >  57039 [ACK] Seq=146959 Ack=351884 Win=511488 Len=0
622,57.6762456,151.101.66.187,172.20.40.110,TCP,60,443  >  57039 [ACK] Seq=146959 Ack=354592 Win=516608 Len=0
623,57.6762456,151.101.66.187,172.20.40.110,TLSv1.3,124,Application Data
624,57.6762456,151.101.66.187,172.20.40.110,TLSv1.3,130,Application Data
625,57.6762456,151.101.66.187,172.20.40.110,TCP,60,443  >  57039 [ACK] Seq=147105 Ack=357249 Win=522240 Len=0
626,57.6762456,151.101.66.187,172.20.40.110,TCP,60,443  >  57039 [ACK] Seq=147105 Ack=359913 Win=527360 Len=0
627,57.6762456,151.101.66.187,172.20.40.110,TLSv1.3,178,Application Data
628,57.6762456,151.101.66.187,172.20.40.110,TLSv1.3,297,Application Data
629,57.6762456,151.101.66.187,172.20.40.110,TLSv1.3,139,Application Data
630,57.6762456,151.101.66.187,172.20.40.110,TLSv1.3,224,Application Data
631,57.6762456,151.101.66.187,172.20.40.110,TCP,60,443  >  57039 [ACK] Seq=147727 Ack=362576 Win=532480 Len=0
632,57.6765594,172.20.40.110,151.101.66.187,TCP,54,57039  >  443 [ACK] Seq=362576 Ack=147727 Win=132352 Len=0
633,57.6878557,151.101.66.187,172.20.40.110,TLSv1.3,160,Application Data
634,57.6878557,151.101.66.187,172.20.40.110,TLSv1.3,590,Application Data
635,57.6881091,172.20.40.110,151.101.66.187,TCP,54,57039  >  443 [ACK] Seq=362576 Ack=148369 Win=131584 Len=0
636,57.8023736,172.20.40.110,151.101.66.187,TLSv1.3,2764,Application Data
637,57.8026247,172.20.40.110,151.101.66.187,TLSv1.3,2770,Application Data
638,57.8046145,172.20.40.110,151.101.66.187,TLSv1.3,2778,Application Data
639,57.807798,172.20.40.110,151.101.66.187,TLSv1.3,2720,Application Data
640,57.8193939,151.101.66.187,172.20.40.110,TCP,60,443  >  57039 [ACK] Seq=148369 Ack=365286 Win=538112 Len=0
641,57.8193939,151.101.66.187,172.20.40.110,TCP,60,443  >  57039 [ACK] Seq=148369 Ack=368002 Win=543744 Len=0
642,57.8193939,151.101.66.187,172.20.40.110,TCP,60,443  >  57039 [ACK] Seq=148369 Ack=370726 Win=548864 Len=0
643,57.8193939,151.101.66.187,172.20.40.110,TCP,60,443  >  57039 [ACK] Seq=148369 Ack=373392 Win=554496 Len=0
644,57.8193939,151.101.66.187,172.20.40.110,TLSv1.3,125,Application Data
645,57.820439,151.101.66.187,172.20.40.110,TLSv1.3,130,Application Data
646,57.8205035,172.20.40.110,151.101.66.187,TCP,54,57039  >  443 [ACK] Seq=373392 Ack=148516 Win=131584 Len=0
647,57.8216114,151.101.66.187,172.20.40.110,TLSv1.3,445,Application Data
648,57.8282082,151.101.66.187,172.20.40.110,TLSv1.3,137,Application Data
649,57.8282082,151.101.66.187,172.20.40.110,TLSv1.3,1365,Application Data
650,57.828287,172.20.40.110,151.101.66.187,TCP,54,57039  >  443 [ACK] Seq=373392 Ack=150301 Win=132352 Len=0
651,57.9402147,172.20.40.110,151.101.66.187,TLSv1.3,2766,Application Data
652,57.9539457,151.101.66.187,172.20.40.110,TCP,60,443  >  57039 [ACK] Seq=150301 Ack=376104 Win=559616 Len=0
653,57.9547205,151.101.66.187,172.20.40.110,TLSv1.3,104,Application Data
654,58.0073002,172.20.40.110,151.101.66.187,TCP,54,57039  >  443 [ACK] Seq=376104 Ack=150351 Win=132352 Len=0
655,58.9117632,172.20.40.110,151.101.66.187,TLSv1.3,2784,Application Data
656,58.9162836,172.20.40.110,151.101.66.187,TLSv1.3,2780,Application Data
657,58.9202204,151.101.66.187,172.20.40.110,TCP,60,443  >  57039 [ACK] Seq=150351 Ack=378834 Win=565248 Len=0
658,58.9246926,151.101.66.187,172.20.40.110,TCP,60,443  >  57039 [ACK] Seq=150351 Ack=381560 Win=570880 Len=0
659,58.927956,151.101.66.187,172.20.40.110,TLSv1.3,240,Application Data
660,58.9290208,151.101.66.187,172.20.40.110,TLSv1.3,131,Application Data
661,58.9290972,172.20.40.110,151.101.66.187,TCP,54,57039  >  443 [ACK] Seq=381560 Ack=150614 Win=132096 Len=0
662,58.952322,172.20.40.110,151.101.66.187,TLSv1.3,2780,Application Data
663,58.9614385,151.101.66.187,172.20.40.110,TCP,60,443  >  57039 [ACK] Seq=150614 Ack=384286 Win=576000 Len=0
664,58.9657996,151.101.66.187,172.20.40.110,TLSv1.3,130,Application Data
665,59.0100163,172.20.40.110,151.101.66.187,TCP,54,57039  >  443 [ACK] Seq=384286 Ack=150690 Win=131840 Len=0
666,59.119334,172.20.40.110,151.101.66.187,TLSv1.3,2786,Application Data
667,59.1221078,172.20.40.110,151.101.66.187,TLSv1.3,2800,Application Data
668,59.1293618,151.101.66.187,172.20.40.110,TCP,60,443  >  57039 [ACK] Seq=150690 Ack=387018 Win=581632 Len=0
669,59.1334219,151.101.66.187,172.20.40.110,TCP,60,443  >  57039 [ACK] Seq=150690 Ack=389764 Win=587264 Len=0
670,59.1396192,151.101.66.187,172.20.40.110,TLSv1.3,135,Application Data
671,59.1396192,151.101.66.187,172.20.40.110,TLSv1.3,104,Application Data
672,59.1397186,172.20.40.110,151.101.66.187,TCP,54,57039  >  443 [ACK] Seq=389764 Ack=150821 Win=131840 Len=0
673,59.2795287,172.20.40.110,151.101.66.187,TLSv1.3,2782,Application Data
674,59.2885929,151.101.66.187,172.20.40.110,TCP,60,443  >  57039 [ACK] Seq=150821 Ack=392492 Win=592384 Len=0
675,59.290961,151.101.66.187,172.20.40.110,TLSv1.3,98,Application Data
676,59.3126281,172.20.40.110,151.101.66.187,TLSv1.3,2796,Application Data
677,59.3217712,151.101.66.187,172.20.40.110,TCP,60,443  >  57039 [ACK] Seq=150865 Ack=395234 Win=598016 Len=0
678,59.3250222,151.101.66.187,172.20.40.110,TLSv1.3,208,Application Data
679,59.372575,172.20.40.110,151.101.66.187,TCP,54,57039  >  443 [ACK] Seq=395234 Ack=151019 Win=131584 Len=0
680,59.4687507,172.20.40.110,151.101.66.187,TLSv1.3,2788,Application Data
681,59.4694465,172.20.40.110,151.101.66.187,TLSv1.3,2790,Application Data
682,59.4776222,151.101.66.187,172.20.40.110,TCP,60,443  >  57039 [ACK] Seq=151019 Ack=397968 Win=603648 Len=0
683,59.4812621,151.101.66.187,172.20.40.110,TCP,60,443  >  57039 [ACK] Seq=151019 Ack=400704 Win=608768 Len=0
684,59.4812621,151.101.66.187,172.20.40.110,TLSv1.3,104,Application Data
685,59.4825368,172.20.40.110,151.101.66.187,TLSv1.3,2784,Application Data
686,59.4842369,172.20.40.110,151.101.66.187,TLSv1.3,2784,Application Data
687,59.4844391,151.101.66.187,172.20.40.110,TLSv1.3,131,Application Data
688,59.4866916,172.20.40.110,151.101.66.187,TLSv1.3,2782,Application Data
689,59.4961165,151.101.66.187,172.20.40.110,TCP,60,443  >  57039 [ACK] Seq=151146 Ack=403434 Win=614400 Len=0
690,59.4961165,151.101.66.187,172.20.40.110,TCP,60,443  >  57039 [ACK] Seq=151146 Ack=406164 Win=620032 Len=0
691,59.4984299,151.101.66.187,172.20.40.110,TLSv1.3,130,Application Data
692,59.4984299,151.101.66.187,172.20.40.110,TCP,60,443  >  57039 [ACK] Seq=151222 Ack=408892 Win=625152 Len=0
693,59.5005285,151.101.66.187,172.20.40.110,TLSv1.3,170,Application Data
694,59.5006058,172.20.40.110,151.101.66.187,TCP,54,57039  >  443 [ACK] Seq=408892 Ack=151338 Win=131328 Len=0
695,59.503401,151.101.66.187,172.20.40.110,TLSv1.3,291,Application Data
696,59.5059545,172.20.40.110,151.101.66.187,TLSv1.3,2790,Application Data
697,59.5191291,151.101.66.187,172.20.40.110,TCP,60,443  >  57039 [ACK] Seq=151575 Ack=411628 Win=630784 Len=0
698,59.5223432,151.101.66.187,172.20.40.110,TLSv1.3,129,Application Data
699,59.5353365,172.20.40.110,151.101.66.187,TLSv1.3,2784,Application Data
700,59.5356607,172.20.40.110,151.101.66.187,TLSv1.3,2792,Application Data
701,59.5475411,151.101.66.187,172.20.40.110,TCP,60,443  >  57039 [ACK] Seq=151650 Ack=414358 Win=636416 Len=0
702,59.5475411,151.101.66.187,172.20.40.110,TCP,60,443  >  57039 [ACK] Seq=151650 Ack=417096 Win=641536 Len=0
703,59.5504499,172.20.40.110,151.101.66.187,TLSv1.3,2786,Application Data
704,59.550775,172.20.40.110,151.101.66.187,TLSv1.3,2793,Application Data
705,59.5509846,151.101.66.187,172.20.40.110,TLSv1.3,131,Application Data
706,59.5509846,151.101.66.187,172.20.40.110,TLSv1.3,130,Application Data
707,59.5511017,172.20.40.110,151.101.66.187,TLSv1.3,2792,Application Data
708,59.5525422,172.20.40.110,151.101.66.187,TLSv1.3,2784,Application Data
709,59.5614783,151.101.66.187,172.20.40.110,TCP,60,443  >  57039 [ACK] Seq=151803 Ack=419828 Win=647168 Len=0
710,59.5614783,151.101.66.187,172.20.40.110,TCP,60,443  >  57039 [ACK] Seq=151803 Ack=422567 Win=652800 Len=0
711,59.5640037,151.101.66.187,172.20.40.110,TLSv1.3,182,Application Data
712,59.5653027,151.101.66.187,172.20.40.110,TCP,60,443  >  57039 [ACK] Seq=151931 Ack=425305 Win=658432 Len=0
713,59.5653027,151.101.66.187,172.20.40.110,TCP,60,443  >  57039 [ACK] Seq=151931 Ack=428035 Win=663552 Len=0
714,59.5674617,151.101.66.187,172.20.40.110,TLSv1.3,131,Application Data
715,59.5675444,172.20.40.110,151.101.66.187,TCP,54,57039  >  443 [ACK] Seq=428035 Ack=152008 Win=132096 Len=0
716,59.5688549,151.101.66.187,172.20.40.110,TLSv1.3,124,Application Data
717,59.5966587,172.20.40.110,151.101.66.187,TLSv1.3,2784,Application Data
718,59.6051545,151.101.66.187,172.20.40.110,TCP,60,443  >  57039 [ACK] Seq=152078 Ack=430765 Win=669184 Len=0
719,59.61131,151.101.66.187,172.20.40.110,TLSv1.3,246,Application Data
720,59.6599658,172.20.40.110,151.101.66.187,TCP,54,57039  >  443 [ACK] Seq=430765 Ack=152270 Win=131840 Len=0
