No.,Time,Source,Destination,Protocol,Length,Info
1,0.0,172.20.40.110,151.101.66.187,TCP,55,51833  >  443 [ACK] Seq=1 Ack=1 Win=258 Len=1 [TCP PDU reassembled in 3]
2,0.0081596,151.101.66.187,172.20.40.110,TCP,66,443  >  51833 [ACK] Seq=1 Ack=2 Win=281 Len=0 SLE=1 SRE=2
3,3.4009919,172.20.40.110,151.101.66.187,TLSv1.2,175,Ignored Unknown Record
4,3.4010787,172.20.40.110,151.101.66.187,TLSv1.2,93,Application Data
5,3.411515,151.101.66.187,172.20.40.110,TCP,60,443  >  51833 [ACK] Seq=1 Ack=123 Win=281 Len=0
6,3.4128404,151.101.66.187,172.20.40.110,TCP,60,443  >  51833 [ACK] Seq=1 Ack=162 Win=281 Len=0
7,3.4128404,151.101.66.187,172.20.40.110,TLSv1.2,93,Application Data
8,3.4147546,172.20.40.110,151.101.66.187,TLSv1.2,2620,Application Data
9,3.4148906,172.20.40.110,151.101.66.187,TLSv1.2,93,Application Data
10,3.4267505,151.101.66.187,172.20.40.110,TCP,60,443  >  57039 [ACK] Seq=1 Ack=2567 Win=2788 Len=0
11,3.4267505,151.101.66.187,172.20.40.110,TCP,60,443  >  57039 [ACK] Seq=1 Ack=2606 Win=2788 Len=0
12,3.4267505,151.101.66.187,172.20.40.110,TLSv1.2,93,Application Data
13,3.4381524,151.101.66.187,172.20.40.110,TCP,93,"[TCP Retransmission] 443  >  51833 [PSH, ACK] Seq=1 Ack=162 Win=281 Len=39"
14,3.4382248,172.20.40.110,151.101.66.187,TCP,66,51833  >  443 [ACK] Seq=162 Ack=40 Win=258 Len=0 SLE=1 SRE=40
15,3.4593648,151.101.66.187,172.20.40.110,TCP,93,"[TCP Retransmission] 443  >  57039 [PSH, ACK] Seq=1 Ack=2606 Win=2788 Len=39"
16,3.4594423,172.20.40.110,151.101.66.187,TCP,66,57039  >  443 [ACK] Seq=2606 Ack=40 Win=517 Len=0 SLE=1 SRE=40
17,3.4650252,151.101.66.187,172.20.40.110,TLSv1.2,396,Application Data
18,3.4931159,151.101.66.187,172.20.40.110,TCP,396,"[TCP Retransmission] 443  >  51833 [PSH, ACK] Seq=40 Ack=162 Win=281 Len=342"
19,3.4931836,172.20.40.110,151.101.66.187,TCP,66,51833  >  443 [ACK] Seq=162 Ack=382 Win=257 Len=0 SLE=40 SRE=382
20,3.5072198,151.101.66.187,172.20.40.110,TLSv1.2,512,Application Data
21,3.5072198,151.101.66.187,172.20.40.110,TCP,4194,443  >  57039 [ACK] Seq=498 Ack=2606 Win=2788 Len=4140 [TCP PDU reassembled in 22]
22,3.5072198,151.101.66.187,172.20.40.110,TLSv1.2,702,Application Data
23,3.5073489,172.20.40.110,151.101.66.187,TCP,54,57039  >  443 [ACK] Seq=2606 Ack=5286 Win=517 Len=0
24,3.5084773,151.101.66.187,172.20.40.110,TLSv1.2,86,Application Data
25,3.5084773,151.101.66.187,172.20.40.110,TLSv1.2,701,Application Data
26,3.5085669,172.20.40.110,151.101.66.187,TCP,54,57039  >  443 [ACK] Seq=2606 Ack=5965 Win=514 Len=0
27,3.50947,151.101.66.187,172.20.40.110,TLSv1.2,85,Application Data
28,3.5095353,172.20.40.110,151.101.66.187,TCP,54,57039  >  443 [ACK] Seq=2606 Ack=5996 Win=514 Len=0
29,3.510895,172.20.40.110,151.101.66.187,TLSv1.2,89,Application Data
30,3.5203434,151.101.66.187,172.20.40.110,TCP,60,443  >  57039 [ACK] Seq=5996 Ack=2641 Win=2788 Len=0
31,4.1415213,172.20.40.110,151.101.66.187,TLSv1.2,2889,Application Data
32,4.151671,151.101.66.187,172.20.40.110,TCP,60,443  >  57039 [ACK] Seq=5996 Ack=5476 Win=2799 Len=0
33,4.173673,151.101.66.187,172.20.40.110,TLSv1.2,439,Application Data
34,4.2008919,151.101.66.187,172.20.40.110,TCP,439,"[TCP Retransmission] 443  >  57039 [PSH, ACK] Seq=5996 Ack=5476 Win=2799 Len=385"
35,4.2009611,172.20.40.110,151.101.66.187,TCP,66,57039  >  443 [ACK] Seq=5476 Ack=6381 Win=513 Len=0 SLE=5996 SRE=6381
36,4.5151138,172.20.40.110,151.101.66.187,TLSv1.2,2889,Application Data
37,4.5162033,172.20.40.110,151.101.66.187,TLSv1.2,2890,Application Data
38,4.528335,151.101.66.187,172.20.40.110,TCP,60,443  >  57039 [ACK] Seq=6381 Ack=8311 Win=2810 Len=0
39,4.528335,151.101.66.187,172.20.40.110,TCP,60,443  >  57039 [ACK] Seq=6381 Ack=11147 Win=2821 Len=0
40,4.5319783,151.101.66.187,172.20.40.110,TLSv1.2,131,Application Data
41,4.5319783,151.101.66.187,172.20.40.110,TLSv1.2,125,Application Data
42,4.532064,172.20.40.110,151.101.66.187,TCP,54,57039  >  443 [ACK] Seq=11147 Ack=6529 Win=512 Len=0
43,4.8859348,172.20.40.110,151.101.66.187,TLSv1.2,2885,Application Data
44,4.8867434,172.20.40.110,151.101.66.187,TLSv1.2,2886,Application Data
45,4.9064584,151.101.66.187,172.20.40.110,TCP,60,443  >  57039 [ACK] Seq=6529 Ack=13978 Win=2832 Len=0
46,4.9064584,151.101.66.187,172.20.40.110,TLSv1.2,240,Application Data
47,4.9064584,151.101.66.187,172.20.40.110,TCP,60,443  >  57039 [ACK] Seq=6715 Ack=16810 Win=2844 Len=0
48,4.9064584,151.101.66.187,172.20.40.110,TLSv1.2,131,Application Data
49,4.9067601,172.20.40.110,151.101.66.187,TCP,54,57039  >  443 [ACK] Seq=16810 Ack=6792 Win=517 Len=0
50,5.1539755,172.20.40.110,151.101.66.187,TLSv1.2,2889,Application Data
51,5.1640966,151.101.66.187,172.20.40.110,TCP,60,443  >  57039 [ACK] Seq=6792 Ack=19645 Win=2855 Len=0
52,5.1662587,151.101.66.187,172.20.40.110,TLSv1.2,98,Application Data
53,5.1946172,151.101.66.187,172.20.40.110,TCP,98,"[TCP Retransmission] 443  >  57039 [PSH, ACK] Seq=6792 Ack=19645 Win=2855 Len=44"
54,5.1946833,172.20.40.110,151.101.66.187,TCP,66,57039  >  443 [ACK] Seq=19645 Ack=6836 Win=517 Len=0 SLE=6792 SRE=6836
55,5.2036473,172.20.40.110,151.101.66.187,TLSv1.2,2887,Application Data
56,5.2131764,151.101.66.187,172.20.40.110,TCP,60,443  >  57039 [ACK] Seq=6836 Ack=22478 Win=2866 Len=0
57,5.215452,151.101.66.187,172.20.40.110,TLSv1.2,125,Application Data
58,5.2437408,151.101.66.187,172.20.40.110,TCP,125,"[TCP Retransmission] 443  >  57039 [PSH, ACK] Seq=6836 Ack=22478 Win=2866 Len=71"
59,5.2438348,172.20.40.110,151.101.66.187,TCP,66,57039  >  443 [ACK] Seq=22478 Ack=6907 Win=517 Len=0 SLE=6836 SRE=6907
60,5.2785331,172.20.40.110,151.101.66.187,TLSv1.2,2890,Application Data
61,5.291733,151.101.66.187,172.20.40.110,TCP,60,443  >  57039 [ACK] Seq=6907 Ack=25314 Win=2877 Len=0
62,5.291733,151.101.66.187,172.20.40.110,TLSv1.2,104,Application Data
63,5.3187441,151.101.66.187,172.20.40.110,TCP,104,"[TCP Retransmission] 443  >  57039 [PSH, ACK] Seq=6907 Ack=25314 Win=2877 Len=50"
64,5.3188197,172.20.40.110,151.101.66.187,TCP,66,57039  >  443 [ACK] Seq=25314 Ack=6957 Win=516 Len=0 SLE=6907 SRE=6957
65,8.5505359,172.20.40.110,151.101.66.187,TLSv1.2,2884,Application Data
66,8.5578842,172.20.40.110,151.101.66.187,TLSv1.2,2880,Application Data
67,8.5643994,151.101.66.187,172.20.40.110,TCP,60,443  >  57039 [ACK] Seq=6957 Ack=28144 Win=2888 Len=0
68,8.5658079,151.101.66.187,172.20.40.110,TLSv1.2,246,Application Data
69,8.5747009,151.101.66.187,172.20.40.110,TCP,60,443  >  57039 [ACK] Seq=7149 Ack=30970 Win=2899 Len=0
70,8.5768232,151.101.66.187,172.20.40.110,TLSv1.2,130,Application Data
71,8.5769089,172.20.40.110,151.101.66.187,TCP,54,57039  >  443 [ACK] Seq=30970 Ack=7225 Win=515 Len=0
72,8.6036829,172.20.40.110,151.101.66.187,TLSv1.2,2873,Application Data
73,8.6039736,172.20.40.110,151.101.66.187,TLSv1.2,2874,Application Data
74,8.615611,151.101.66.187,172.20.40.110,TCP,60,443  >  57039 [ACK] Seq=7225 Ack=33789 Win=2910 Len=0
75,8.615611,151.101.66.187,172.20.40.110,TCP,60,443  >  57039 [ACK] Seq=7225 Ack=36609 Win=2921 Len=0
76,8.6166788,151.101.66.187,172.20.40.110,TLSv1.2,103,Application Data
77,8.6188285,151.101.66.187,172.20.40.110,TLSv1.2,110,Application Data
78,8.6189137,172.20.40.110,151.101.66.187,TCP,54,57039  >  443 [ACK] Seq=36609 Ack=7330 Win=515 Len=0
79,22.2927929,172.20.40.110,151.101.66.187,TLSv1.2,2912,Application Data
80,22.2929236,172.20.40.110,151.101.66.187,TLSv1.2,93,Application Data
81,22.3056501,151.101.66.187,172.20.40.110,TCP,60,443  >  57039 [ACK] Seq=7330 Ack=39467 Win=2932 Len=0
82,22.3056501,151.101.66.187,172.20.40.110,TCP,60,443  >  57039 [ACK] Seq=7330 Ack=39506 Win=2932 Len=0
83,22.3067689,151.101.66.187,172.20.40.110,TLSv1.2,93,Application Data
84,22.3359643,151.101.66.187,172.20.40.110,TCP,93,"[TCP Retransmission] 443  >  57039 [PSH, ACK] Seq=7330 Ack=39506 Win=2932 Len=39"
85,22.3360231,172.20.40.110,151.101.66.187,TCP,66,57039  >  443 [ACK] Seq=39506 Ack=7369 Win=515 Len=0 SLE=7330 SRE=7369
86,22.7973512,151.101.66.187,172.20.40.110,TCP,2814,443  >  57039 [ACK] Seq=7369 Ack=39506 Win=2932 Len=2760 [TCP PDU reassembled in 95]
87,22.7974697,172.20.40.110,151.101.66.187,TCP,54,57039  >  443 [ACK] Seq=39506 Ack=10129 Win=517 Len=0
88,22.799907,151.101.66.187,172.20.40.110,TCP,1434,443  >  57039 [ACK] Seq=10129 Ack=39506 Win=2932 Len=1380 [TCP PDU reassembled in 95]
89,22.799907,151.101.66.187,172.20.40.110,TCP,1434,443  >  57039 [ACK] Seq=11509 Ack=39506 Win=2932 Len=1380 [TCP PDU reassembled in 95]
90,22.799907,151.101.66.187,172.20.40.110,TCP,2814,443  >  57039 [ACK] Seq=12889 Ack=39506 Win=2932 Len=2760 [TCP PDU reassembled in 95]
91,22.7999885,172.20.40.110,151.101.66.187,TCP,54,57039  >  443 [ACK] Seq=39506 Ack=15649 Win=517 Len=0
92,22.8022128,151.101.66.187,172.20.40.110,TCP,5574,443  >  57039 [ACK] Seq=15649 Ack=39506 Win=2932 Len=5520 [TCP PDU reassembled in 95]
93,22.8022736,172.20.40.110,151.101.66.187,TCP,54,57039  >  443 [ACK] Seq=39506 Ack=21169 Win=517 Len=0
94,22.8044969,151.101.66.187,172.20.40.110,TCP,1434,443  >  57039 [ACK] Seq=21169 Ack=39506 Win=2932 Len=1380 [TCP PDU reassembled in 95]
95,22.8044969,151.101.66.187,172.20.40.110,TLSv1.2,285,Application Data
96,22.8044969,151.101.66.187,172.20.40.110,TCP,4194,443  >  57039 [ACK] Seq=22780 Ack=39506 Win=2932 Len=4140 [TCP PDU reassembled in 102]
97,22.8046063,172.20.40.110,151.101.66.187,TCP,54,57039  >  443 [ACK] Seq=39506 Ack=26920 Win=517 Len=0
98,22.8080503,151.101.66.187,172.20.40.110,TCP,5574,443  >  57039 [ACK] Seq=26920 Ack=39506 Win=2932 Len=5520 [TCP PDU reassembled in 102]
99,22.808124,172.20.40.110,151.101.66.187,TCP,54,57039  >  443 [ACK] Seq=39506 Ack=32440 Win=517 Len=0
100,22.8108388,151.101.66.187,172.20.40.110,TCP,5574,443  >  57039 [ACK] Seq=32440 Ack=39506 Win=2932 Len=5520 [TCP PDU reassembled in 102]
101,22.810917,172.20.40.110,151.101.66.187,TCP,54,57039  >  443 [ACK] Seq=39506 Ack=37960 Win=517 Len=0
102,22.8155376,151.101.66.187,172.20.40.110,TLSv1.2,1434,Application Data
103,22.8155376,151.101.66.187,172.20.40.110,TCP,1434,443  >  57039 [ACK] Seq=39340 Ack=39506 Win=2932 Len=1380 [TCP PDU reassembled in 116]
104,22.8155376,151.101.66.187,172.20.40.110,TCP,1434,"443  >  57039 [PSH, ACK] Seq=40720 Ack=39506 Win=2932 Len=1380 [TCP PDU reassembled in 116]"
105,22.8155376,151.101.66.187,172.20.40.110,TCP,4194,443  >  57039 [ACK] Seq=42100 Ack=39506 Win=2932 Len=4140 [TCP PDU reassembled in 116]
106,22.8156338,172.20.40.110,151.101.66.187,TCP,54,57039  >  443 [ACK] Seq=39506 Ack=46240 Win=517 Len=0
107,22.8164307,172.20.40.110,151.101.66.187,TLSv1.2,89,Application Data
108,22.8202847,151.101.66.187,172.20.40.110,TCP,1434,443  >  57039 [ACK] Seq=46240 Ack=39506 Win=2932 Len=1380 [TCP PDU reassembled in 116]
109,22.8202847,151.101.66.187,172.20.40.110,TCP,1434,443  >  57039 [ACK] Seq=47620 Ack=39506 Win=2932 Len=1380 [TCP PDU reassembled in 116]
110,22.8202847,151.101.66.187,172.20.40.110,TCP,1434,443  >  57039 [ACK] Seq=49000 Ack=39506 Win=2932 Len=1380 [TCP PDU reassembled in 116]
111,22.8202847,151.101.66.187,172.20.40.110,TCP,1434,443  >  57039 [ACK] Seq=50380 Ack=39506 Win=2932 Len=1380 [TCP PDU reassembled in 116]
112,22.8203735,172.20.40.110,151.101.66.187,TCP,54,57039  >  443 [ACK] Seq=39541 Ack=51760 Win=517 Len=0
113,22.8227242,151.101.66.187,172.20.40.110,TCP,1434,443  >  57039 [ACK] Seq=51760 Ack=39506 Win=2932 Len=1380 [TCP PDU reassembled in 116]
114,22.8227865,172.20.40.110,151.101.66.187,TCP,54,57039  >  443 [ACK] Seq=39541 Ack=53140 Win=517 Len=0
115,22.8253006,151.101.66.187,172.20.40.110,TCP,1434,443  >  57039 [ACK] Seq=53140 Ack=39506 Win=2932 Len=1380 [TCP PDU reassembled in 116]
116,22.8253006,151.101.66.187,172.20.40.110,TLSv1.2,1434,Application Data
117,22.8253006,151.101.66.187,172.20.40.110,TCP,1434,443  >  57039 [ACK] Seq=55900 Ack=39506 Win=2932 Len=1380 [TCP PDU reassembled in 127]
118,22.8253006,151.101.66.187,172.20.40.110,TCP,1434,443  >  57039 [ACK] Seq=57280 Ack=39506 Win=2932 Len=1380 [TCP PDU reassembled in 127]
119,22.8253821,172.20.40.110,151.101.66.187,TCP,54,57039  >  443 [ACK] Seq=39541 Ack=58660 Win=517 Len=0
120,22.8304551,151.101.66.187,172.20.40.110,TCP,1434,443  >  57039 [ACK] Seq=58660 Ack=39506 Win=2932 Len=1380 [TCP PDU reassembled in 127]
121,22.8304551,151.101.66.187,172.20.40.110,TCP,1434,"443  >  57039 [PSH, ACK] Seq=60040 Ack=39506 Win=2932 Len=1380 [TCP PDU reassembled in 127]"
122,22.8304551,151.101.66.187,172.20.40.110,TCP,1434,443  >  57039 [ACK] Seq=61420 Ack=39506 Win=2932 Len=1380 [TCP PDU reassembled in 127]
123,22.8304551,151.101.66.187,172.20.40.110,TCP,2814,443  >  57039 [ACK] Seq=62800 Ack=39506 Win=2932 Len=2760 [TCP PDU reassembled in 127]
124,22.830537,172.20.40.110,151.101.66.187,TCP,54,57039  >  443 [ACK] Seq=39541 Ack=65560 Win=517 Len=0
125,22.8331005,151.101.66.187,172.20.40.110,TCP,5574,443  >  57039 [ACK] Seq=65560 Ack=39506 Win=2932 Len=5520 [TCP PDU reassembled in 127]
126,22.8332158,172.20.40.110,151.101.66.187,TCP,54,57039  >  443 [ACK] Seq=39541 Ack=71080 Win=517 Len=0
127,22.8354388,151.101.66.187,172.20.40.110,TLSv1.2,4194,Application Data
128,22.8355228,172.20.40.110,151.101.66.187,TCP,54,57039  >  443 [ACK] Seq=39541 Ack=75220 Win=517 Len=0
129,22.8379121,151.101.66.187,172.20.40.110,TCP,1434,443  >  57039 [ACK] Seq=75220 Ack=39506 Win=2932 Len=1380 [TCP PDU reassembled in 130]
130,22.8379121,151.101.66.187,172.20.40.110,TLSv1.2,2814,Application Data
131,22.8379121,151.101.66.187,172.20.40.110,TLSv1.2,505,"Application Data, Application Data"
132,22.8379121,151.101.66.187,172.20.40.110,TCP,505,"[TCP Retransmission] 443  >  57039 [PSH, ACK] Seq=79360 Ack=39506 Win=2932 Len=451"
133,22.8380073,172.20.40.110,151.101.66.187,TCP,66,57039  >  443 [ACK] Seq=39541 Ack=79811 Win=517 Len=0 SLE=79360 SRE=79811
134,22.8403113,151.101.66.187,172.20.40.110,TCP,60,443  >  57039 [ACK] Seq=79811 Ack=39541 Win=2932 Len=0
135,23.3812545,172.20.40.110,151.101.66.187,TLSv1.2,2868,Application Data
136,23.3829281,172.20.40.110,151.101.66.187,TLSv1.2,2866,Application Data
137,23.3843289,172.20.40.110,151.101.66.187,TLSv1.2,2866,Application Data
138,23.3851396,172.20.40.110,151.101.66.187,TLSv1.2,2872,Application Data
139,23.3900828,151.101.66.187,172.20.40.110,TCP,60,443  >  57039 [ACK] Seq=79811 Ack=42355 Win=2943 Len=0
140,23.3927546,151.101.66.187,172.20.40.110,TCP,60,443  >  57039 [ACK] Seq=79811 Ack=45167 Win=2954 Len=0
141,23.3938169,151.101.66.187,172.20.40.110,TLSv1.2,361,Application Data
142,23.3948627,151.101.66.187,172.20.40.110,TLSv1.2,137,Application Data
143,23.3949386,172.20.40.110,151.101.66.187,TCP,54,57039  >  443 [ACK] Seq=50797 Ack=80201 Win=515 Len=0
144,23.3959906,151.101.66.187,172.20.40.110,TCP,60,443  >  57039 [ACK] Seq=80201 Ack=47979 Win=2965 Len=0
145,23.3959906,151.101.66.187,172.20.40.110,TCP,60,443  >  57039 [ACK] Seq=80201 Ack=50797 Win=2976 Len=0
146,23.3995056,151.101.66.187,172.20.40.110,TLSv1.2,130,Application Data
147,23.4006511,151.101.66.187,172.20.40.110,TLSv1.2,131,Application Data
148,23.4007236,172.20.40.110,151.101.66.187,TCP,54,57039  >  443 [ACK] Seq=50797 Ack=80354 Win=515 Len=0
149,23.4375349,172.20.40.110,151.101.66.187,TLSv1.2,2864,Application Data
150,23.441669,172.20.40.110,151.101.66.187,TLSv1.2,2883,Application Data
151,23.4453823,172.20.40.110,151.101.66.187,TLSv1.2,2882,Application Data
152,23.4462712,172.20.40.110,151.101.66.187,TLSv1.2,2880,Application Data
153,23.4464629,172.20.40.110,151.101.66.187,TLSv1.2,2882,Application Data
154,23.4541047,151.101.66.187,172.20.40.110,TCP,60,443  >  57039 [ACK] Seq=80354 Ack=53607 Win=2987 Len=0
155,23.4541047,151.101.66.187,172.20.40.110,TLSv1.2,130,Application Data
156,23.4604297,151.101.66.187,172.20.40.110,TCP,60,443  >  57039 [ACK] Seq=80430 Ack=56436 Win=2999 Len=0
157,23.4604297,151.101.66.187,172.20.40.110,TCP,60,443  >  57039 [ACK] Seq=80430 Ack=59264 Win=3010 Len=0
158,23.4604297,151.101.66.187,172.20.40.110,TLSv1.2,131,Application Data
159,23.4604297,151.101.66.187,172.20.40.110,TLSv1.2,130,Application Data
160,23.4604297,151.101.66.187,172.20.40.110,TCP,60,443  >  57039 [ACK] Seq=80583 Ack=62090 Win=3021 Len=0
161,23.4604297,151.101.66.187,172.20.40.110,TCP,60,443  >  57039 [ACK] Seq=80583 Ack=64918 Win=3032 Len=0
162,23.4605578,172.20.40.110,151.101.66.187,TCP,54,57039  >  443 [ACK] Seq=64918 Ack=80583 Win=514 Len=0
163,23.4625649,151.101.66.187,172.20.40.110,TLSv1.2,131,Application Data
164,23.4626296,172.20.40.110,151.101.66.187,TCP,54,57039  >  443 [ACK] Seq=64918 Ack=80660 Win=514 Len=0
165,23.4661493,151.101.66.187,172.20.40.110,TLSv1.2,131,Application Data
166,23.5189185,172.20.40.110,151.101.66.187,TCP,54,57039  >  443 [ACK] Seq=64918 Ack=80737 Win=513 Len=0
167,23.6022964,172.20.40.110,151.101.66.187,TLSv1.2,2870,Application Data
168,23.60277,172.20.40.110,151.101.66.187,TLSv1.2,2872,Application Data
169,23.6159024,151.101.66.187,172.20.40.110,TCP,60,443  >  57039 [ACK] Seq=80737 Ack=67734 Win=3043 Len=0
170,23.6159024,151.101.66.187,172.20.40.110,TCP,60,443  >  57039 [ACK] Seq=80737 Ack=70552 Win=3054 Len=0
171,23.6159024,151.101.66.187,172.20.40.110,TLSv1.2,98,Application Data
172,23.6168515,151.101.66.187,172.20.40.110,TLSv1.2,98,Application Data
173,23.6169409,172.20.40.110,151.101.66.187,TCP,54,57039  >  443 [ACK] Seq=70552 Ack=80825 Win=513 Len=0
174,23.6170885,172.20.40.110,151.101.66.187,TLSv1.2,2877,Application Data
175,23.6286861,151.101.66.187,172.20.40.110,TCP,60,443  >  57039 [ACK] Seq=80825 Ack=73375 Win=3065 Len=0
176,23.6321978,151.101.66.187,172.20.40.110,TLSv1.2,128,Application Data
177,23.6666072,172.20.40.110,151.101.66.187,TLSv1.2,2886,Application Data
178,23.6673671,172.20.40.110,151.101.66.187,TLSv1.2,2884,Application Data
179,23.6695302,172.20.40.110,151.101.66.187,TLSv1.2,2886,Application Data
180,23.6759441,172.20.40.110,151.101.66.187,TLSv1.2,2877,Application Data
181,23.6832216,151.101.66.187,172.20.40.110,TCP,60,443  >  57039 [ACK] Seq=80899 Ack=76207 Win=3076 Len=0
182,23.6832216,151.101.66.187,172.20.40.110,TCP,60,443  >  57039 [ACK] Seq=80899 Ack=79037 Win=3087 Len=0
183,23.6832216,151.101.66.187,172.20.40.110,TLSv1.2,98,Application Data
184,23.6832216,151.101.66.187,172.20.40.110,TLSv1.2,98,Application Data
185,23.6832216,151.101.66.187,172.20.40.110,TCP,60,443  >  57039 [ACK] Seq=80987 Ack=81869 Win=3098 Len=0
186,23.6833421,172.20.40.110,151.101.66.187,TCP,54,57039  >  443 [ACK] Seq=84692 Ack=80987 Win=512 Len=0
187,23.6869661,151.101.66.187,172.20.40.110,TLSv1.2,98,Application Data
188,23.6869661,151.101.66.187,172.20.40.110,TCP,60,443  >  57039 [ACK] Seq=81031 Ack=84692 Win=3109 Len=0
189,23.6925183,151.101.66.187,172.20.40.110,TLSv1.2,209,Application Data
190,23.6926212,172.20.40.110,151.101.66.187,TCP,54,57039  >  443 [ACK] Seq=84692 Ack=81186 Win=512 Len=0
191,23.6966612,172.20.40.110,151.101.66.187,TLSv1.2,2868,Application Data
192,23.6969633,172.20.40.110,151.101.66.187,TLSv1.2,2875,Application Data
193,23.6971569,172.20.40.110,151.101.66.187,TLSv1.2,2874,Application Data
194,23.6973292,172.20.40.110,151.101.66.187,TLSv1.2,2868,Application Data
195,23.6975029,172.20.40.110,151.101.66.187,TLSv1.2,2868,Application Data
196,23.6976851,172.20.40.110,151.101.66.187,TLSv1.2,2866,Application Data
197,23.7074489,172.20.40.110,151.101.66.187,TLSv1.2,2874,Application Data
198,23.7106314,151.101.66.187,172.20.40.110,TCP,60,443  >  57039 [ACK] Seq=81186 Ack=87506 Win=3120 Len=0
199,23.7106314,151.101.66.187,172.20.40.110,TLSv1.2,131,Application Data
200,23.7107106,172.20.40.110,151.101.66.187,TCP,54,57039  >  443 [ACK] Seq=104407 Ack=81263 Win=517 Len=0
201,23.7168532,151.101.66.187,172.20.40.110,TCP,60,443  >  57039 [ACK] Seq=81263 Ack=90327 Win=3131 Len=0
202,23.7168532,151.101.66.187,172.20.40.110,TCP,60,443  >  57039 [ACK] Seq=81263 Ack=93147 Win=3142 Len=0
203,23.7168532,151.101.66.187,172.20.40.110,TCP,60,443  >  57039 [ACK] Seq=81263 Ack=95961 Win=3153 Len=0
204,23.7168532,151.101.66.187,172.20.40.110,TLSv1.2,362,Application Data
205,23.716963,172.20.40.110,151.101.66.187,TCP,54,57039  >  443 [ACK] Seq=104407 Ack=81571 Win=516 Len=0
206,23.7179372,151.101.66.187,172.20.40.110,TLSv1.2,135,Application Data
207,23.7179372,151.101.66.187,172.20.40.110,TCP,60,443  >  57039 [ACK] Seq=81652 Ack=98775 Win=3164 Len=0
208,23.7179372,151.101.66.187,172.20.40.110,TCP,60,443  >  57039 [ACK] Seq=81652 Ack=101587 Win=3175 Len=0
209,23.7179372,151.101.66.187,172.20.40.110,TLSv1.2,131,Application Data
210,23.7179372,151.101.66.187,172.20.40.110,TCP,60,443  >  57039 [ACK] Seq=81729 Ack=104407 Win=3186 Len=0
211,23.7180442,172.20.40.110,151.101.66.187,TCP,54,57039  >  443 [ACK] Seq=104407 Ack=81729 Win=515 Len=0
212,23.7197944,151.101.66.187,172.20.40.110,TLSv1.2,206,"Application Data, Application Data"
213,23.7197944,151.101.66.187,172.20.40.110,TLSv1.2,136,Application Data
214,23.7198752,172.20.40.110,151.101.66.187,TCP,54,57039  >  443 [ACK] Seq=104407 Ack=81963 Win=514 Len=0
215,23.7822698,172.20.40.110,151.101.66.187,TLSv1.2,2887,Application Data
216,23.7885418,172.20.40.110,151.101.66.187,TLSv1.2,2871,Application Data
217,23.7896237,172.20.40.110,151.101.66.187,TLSv1.2,2874,Application Data
218,23.7898247,172.20.40.110,151.101.66.187,TLSv1.2,2865,Application Data
219,23.7899358,172.20.40.110,151.101.66.187,TLSv1.2,2868,Application Data
220,23.7922862,172.20.40.110,151.101.66.187,TLSv1.2,2867,Application Data
221,23.7965219,151.101.66.187,172.20.40.110,TCP,60,443  >  57039 [ACK] Seq=81963 Ack=107240 Win=3197 Len=0
222,23.7989592,151.101.66.187,172.20.40.110,TLSv1.2,125,Application Data
223,23.7989592,151.101.66.187,172.20.40.110,TCP,60,443  >  57039 [ACK] Seq=82034 Ack=110057 Win=3208 Len=0
224,23.8016549,151.101.66.187,172.20.40.110,TLSv1.2,240,Application Data
225,23.8017279,172.20.40.110,151.101.66.187,TCP,54,57039  >  443 [ACK] Seq=121315 Ack=82220 Win=513 Len=0
226,23.8050053,151.101.66.187,172.20.40.110,TCP,60,443  >  57039 [ACK] Seq=82220 Ack=112877 Win=3219 Len=0
227,23.8050053,151.101.66.187,172.20.40.110,TCP,60,443  >  57039 [ACK] Seq=82220 Ack=115688 Win=3230 Len=0
228,23.8050053,151.101.66.187,172.20.40.110,TCP,60,443  >  57039 [ACK] Seq=82220 Ack=118502 Win=3241 Len=0
229,23.8050053,151.101.66.187,172.20.40.110,TCP,60,443  >  57039 [ACK] Seq=82220 Ack=121315 Win=3252 Len=0
230,23.8086115,151.101.66.187,172.20.40.110,TLSv1.2,125,Application Data
231,23.8086115,151.101.66.187,172.20.40.110,TLSv1.2,130,Application Data
232,23.8086115,151.101.66.187,172.20.40.110,TLSv1.2,208,Application Data
233,23.8086115,151.101.66.187,172.20.40.110,TLSv1.2,125,Application Data
234,23.8086955,172.20.40.110,151.101.66.187,TCP,54,57039  >  443 [ACK] Seq=121315 Ack=82592 Win=512 Len=0
235,25.1969948,172.20.40.110,151.101.66.187,TLSv1.2,3202,Application Data
236,25.19722,172.20.40.110,151.101.66.187,TLSv1.2,3164,Application Data
237,25.1973657,172.20.40.110,151.101.66.187,TLSv1.2,3184,Application Data
238,25.1995318,172.20.40.110,151.101.66.187,TLSv1.2,3182,Application Data
239,25.1997384,172.20.40.110,151.101.66.187,TLSv1.2,3167,Application Data
240,25.2170865,151.101.66.187,172.20.40.110,TCP,60,443  >  57039 [ACK] Seq=82592 Ack=122695 Win=3258 Len=0
241,25.2205312,151.101.66.187,172.20.40.110,TCP,60,443  >  57039 [ACK] Seq=82592 Ack=124463 Win=3265 Len=0
242,25.2205312,151.101.66.187,172.20.40.110,TCP,60,443  >  57039 [ACK] Seq=82592 Ack=127573 Win=3277 Len=0
243,25.2205312,151.101.66.187,172.20.40.110,TCP,60,443  >  57039 [ACK] Seq=82592 Ack=130703 Win=3289 Len=0
244,25.2205312,151.101.66.187,172.20.40.110,TCP,60,443  >  57039 [ACK] Seq=82592 Ack=133831 Win=3302 Len=0
245,25.2205312,151.101.66.187,172.20.40.110,TCP,60,443  >  57039 [ACK] Seq=82592 Ack=136944 Win=3314 Len=0
246,25.2311872,172.20.40.110,151.101.66.187,TLSv1.2,2870,Application Data
247,25.2367661,172.20.40.110,151.101.66.187,TLSv1.2,2866,Application Data
248,25.2406407,151.101.66.187,172.20.40.110,TCP,60,443  >  57039 [ACK] Seq=82592 Ack=139760 Win=3325 Len=0
249,25.2439453,151.101.66.187,172.20.40.110,TLSv1.2,360,Application Data
250,25.2440408,172.20.40.110,151.101.66.187,TCP,54,57039  >  443 [ACK] Seq=142572 Ack=82898 Win=517 Len=0
251,25.2460763,151.101.66.187,172.20.40.110,TCP,60,443  >  57039 [ACK] Seq=82898 Ack=142572 Win=3336 Len=0
252,25.2541269,151.101.66.187,172.20.40.110,TLSv1.2,136,Application Data
253,25.2543734,172.20.40.110,151.101.66.187,TCP,54,57039  >  443 [ACK] Seq=142572 Ack=82980 Win=517 Len=0
254,25.2609037,172.20.40.110,151.101.66.187,TLSv1.2,2883,Application Data
255,25.2714292,151.101.66.187,172.20.40.110,TCP,60,443  >  57039 [ACK] Seq=82980 Ack=145401 Win=3347 Len=0
256,25.2730844,151.101.66.187,172.20.40.110,TLSv1.2,104,Application Data
257,25.3140403,151.101.66.187,172.20.40.110,TCP,104,"[TCP Retransmission] 443  >  57039 [PSH, ACK] Seq=82980 Ack=145401 Win=3347 Len=50"
258,25.3140943,172.20.40.110,151.101.66.187,TCP,66,57039  >  443 [ACK] Seq=145401 Ack=83030 Win=516 Len=0 SLE=82980 SRE=83030
259,25.3528215,172.20.40.110,151.101.66.187,TLSv1.2,2870,Application Data
260,25.3565795,172.20.40.110,151.101.66.187,TLSv1.2,2866,Application Data
261,25.3656393,151.101.66.187,172.20.40.110,TCP,60,443  >  57039 [ACK] Seq=83030 Ack=148217 Win=3358 Len=0
262,25.3661376,151.101.66.187,172.20.40.110,TCP,60,443  >  57039 [ACK] Seq=83030 Ack=151029 Win=3369 Len=0
263,25.3683352,151.101.66.187,172.20.40.110,TLSv1.2,98,Application Data
264,25.3694771,151.101.66.187,172.20.40.110,TLSv1.2,98,Application Data
265,25.3695565,172.20.40.110,151.101.66.187,TCP,54,57039  >  443 [ACK] Seq=151029 Ack=83118 Win=516 Len=0
266,25.3738049,172.20.40.110,151.101.66.187,TLSv1.2,2883,Application Data
267,25.3847786,151.101.66.187,172.20.40.110,TCP,60,443  >  57039 [ACK] Seq=83118 Ack=153858 Win=3380 Len=0
268,25.3861995,151.101.66.187,172.20.40.110,TLSv1.2,98,Application Data
269,25.4158006,151.101.66.187,172.20.40.110,TLSv1.2,434,Application Data
270,25.4158006,151.101.66.187,172.20.40.110,TLSv1.2,85,Application Data
271,25.415874,172.20.40.110,151.101.66.187,TCP,54,57039  >  443 [ACK] Seq=153858 Ack=83573 Win=514 Len=0
272,25.439806,172.20.40.110,151.101.66.187,TLSv1.2,2870,Application Data
273,25.4440938,172.20.40.110,151.101.66.187,TLSv1.2,2866,Application Data
274,25.4496034,151.101.66.187,172.20.40.110,TCP,9714,"443  >  57039 [PSH, ACK] Seq=83573 Ack=153858 Win=3380 Len=9660 [TCP PDU reassembled in 277]"
275,25.4496907,172.20.40.110,151.101.66.187,TCP,54,57039  >  443 [ACK] Seq=159486 Ack=93233 Win=517 Len=0
276,25.4521484,151.101.66.187,172.20.40.110,TCP,5574,443  >  57039 [ACK] Seq=93233 Ack=153858 Win=3380 Len=5520 [TCP PDU reassembled in 277]
277,25.4521484,151.101.66.187,172.20.40.110,TLSv1.2,481,Application Data
278,25.4521484,151.101.66.187,172.20.40.110,TCP,4194,443  >  57039 [ACK] Seq=99180 Ack=153858 Win=3380 Len=4140 [TCP PDU reassembled in 281]
279,25.4522705,172.20.40.110,151.101.66.187,TCP,54,57039  >  443 [ACK] Seq=159486 Ack=103320 Win=517 Len=0
280,25.4538372,151.101.66.187,172.20.40.110,TCP,4194,"443  >  57039 [PSH, ACK] Seq=103320 Ack=153858 Win=3380 Len=4140 [TCP PDU reassembled in 281]"
281,25.4538372,151.101.66.187,172.20.40.110,TLSv1.2,625,Application Data
282,25.4538372,151.101.66.187,172.20.40.110,TCP,60,443  >  57039 [ACK] Seq=108031 Ack=156674 Win=3391 Len=0
283,25.4538372,151.101.66.187,172.20.40.110,TLSv1.2,104,Application Data
284,25.4538372,151.101.66.187,172.20.40.110,TCP,60,443  >  57039 [ACK] Seq=108081 Ack=159486 Win=3402 Len=0
285,25.4539663,172.20.40.110,151.101.66.187,TCP,54,57039  >  443 [ACK] Seq=159486 Ack=108081 Win=517 Len=0
286,25.4550797,151.101.66.187,172.20.40.110,TLSv1.2,98,Application Data
287,25.460666,151.101.66.187,172.20.40.110,TCP,5574,443  >  57039 [ACK] Seq=108125 Ack=159486 Win=3402 Len=5520 [TCP PDU reassembled in 288]
288,25.460666,151.101.66.187,172.20.40.110,TLSv1.2,1165,Application Data
289,25.460666,151.101.66.187,172.20.40.110,TCP,2814,443  >  57039 [ACK] Seq=114756 Ack=159486 Win=3402 Len=2760 [TCP PDU reassembled in 293]
290,25.4609748,172.20.40.110,151.101.66.187,TCP,54,57039  >  443 [ACK] Seq=159486 Ack=117516 Win=517 Len=0
291,25.4630153,151.101.66.187,172.20.40.110,TCP,9714,"443  >  57039 [PSH, ACK] Seq=117516 Ack=159486 Win=3402 Len=9660 [TCP PDU reassembled in 293]"
292,25.4630953,172.20.40.110,151.101.66.187,TCP,54,57039  >  443 [ACK] Seq=159486 Ack=127176 Win=517 Len=0
293,25.4654509,151.101.66.187,172.20.40.110,TLSv1.2,6954,Application Data
294,25.4654509,151.101.66.187,172.20.40.110,TLSv1.2,249,Application Data
295,25.4655777,172.20.40.110,151.101.66.187,TCP,54,57039  >  443 [ACK] Seq=159486 Ack=134271 Win=517 Len=0
296,25.4845862,172.20.40.110,151.101.66.187,TLSv1.2,2883,Application Data
297,25.4957275,151.101.66.187,172.20.40.110,TCP,60,443  >  57039 [ACK] Seq=134271 Ack=162315 Win=3413 Len=0
298,25.4981157,151.101.66.187,172.20.40.110,TLSv1.2,125,Application Data
299,25.5346257,151.101.66.187,172.20.40.110,TCP,125,"[TCP Retransmission] 443  >  57039 [PSH, ACK] Seq=134271 Ack=162315 Win=3413 Len=71"
300,25.5347484,172.20.40.110,151.101.66.187,TCP,66,57039  >  443 [ACK] Seq=162315 Ack=134342 Win=517 Len=0 SLE=134271 SRE=134342
301,25.5409172,172.20.40.110,151.101.66.187,TLSv1.2,2870,Application Data
302,25.5415119,172.20.40.110,151.101.66.187,TLSv1.2,2866,Application Data
303,25.5526755,151.101.66.187,172.20.40.110,TCP,60,443  >  57039 [ACK] Seq=134342 Ack=165131 Win=3424 Len=0
304,25.5540057,151.101.66.187,172.20.40.110,TCP,60,443  >  57039 [ACK] Seq=134342 Ack=167943 Win=3435 Len=0
305,25.5564515,151.101.66.187,172.20.40.110,TLSv1.2,98,Application Data
306,25.5612827,151.101.66.187,172.20.40.110,TLSv1.2,98,Application Data
307,25.5613569,172.20.40.110,151.101.66.187,TCP,54,57039  >  443 [ACK] Seq=167943 Ack=134430 Win=516 Len=0
308,25.6979395,151.101.66.187,172.20.40.110,TCP,6954,443  >  57039 [ACK] Seq=134430 Ack=167943 Win=3435 Len=6900 [TCP PDU reassembled in 309]
309,25.6979395,151.101.66.187,172.20.40.110,TLSv1.2,1084,Application Data
310,25.6979395,151.101.66.187,172.20.40.110,TCP,1434,443  >  57039 [ACK] Seq=142360 Ack=167943 Win=3435 Len=1380 [TCP PDU reassembled in 318]
311,25.6980527,172.20.40.110,151.101.66.187,TCP,54,57039  >  443 [ACK] Seq=167943 Ack=143740 Win=517 Len=0
312,25.7029521,151.101.66.187,172.20.40.110,TCP,1434,443  >  57039 [ACK] Seq=143740 Ack=167943 Win=3435 Len=1380 [TCP PDU reassembled in 318]
313,25.7029521,151.101.66.187,172.20.40.110,TCP,1434,443  >  57039 [ACK] Seq=145120 Ack=167943 Win=3435 Len=1380 [TCP PDU reassembled in 318]
314,25.7029521,151.101.66.187,172.20.40.110,TCP,1434,443  >  57039 [ACK] Seq=146500 Ack=167943 Win=3435 Len=1380 [TCP PDU reassembled in 318]
315,25.7029521,151.101.66.187,172.20.40.110,TCP,1434,443  >  57039 [ACK] Seq=147880 Ack=167943 Win=3435 Len=1380 [TCP PDU reassembled in 318]
316,25.7029521,151.101.66.187,172.20.40.110,TCP,4194,"443  >  57039 [PSH, ACK] Seq=149260 Ack=167943 Win=3435 Len=4140 [TCP PDU reassembled in 318]"
317,25.7030632,172.20.40.110,151.101.66.187,TCP,54,57039  >  443 [ACK] Seq=167943 Ack=153400 Win=517 Len=0
318,25.7060944,151.101.66.187,172.20.40.110,TLSv1.2,9714,"Application Data, Application Data, Application Data"
319,25.7061781,172.20.40.110,151.101.66.187,TCP,54,57039  >  443 [ACK] Seq=167943 Ack=163060 Win=517 Len=0
320,25.70888,151.101.66.187,172.20.40.110,TLSv1.2,9714,"Application Data, Application Data, Application Data, Application Data, Application Data"
321,25.7089683,172.20.40.110,151.101.66.187,TCP,54,57039  >  443 [ACK] Seq=167943 Ack=172720 Win=517 Len=0
322,25.7120793,151.101.66.187,172.20.40.110,TLSv1.2,9714,"Application Data, Application Data, Application Data, Application Data, Application Data, Application Data, Application Data"
323,25.7122104,172.20.40.110,151.101.66.187,TCP,54,57039  >  443 [ACK] Seq=167943 Ack=182380 Win=517 Len=0
324,25.7193003,151.101.66.187,172.20.40.110,TCP,1434,443  >  57039 [ACK] Seq=182380 Ack=167943 Win=3435 Len=1380 [TCP PDU reassembled in 325]
325,25.7193003,151.101.66.187,172.20.40.110,TLSv1.2,1434,Application Data
326,25.7193003,151.101.66.187,172.20.40.110,TLSv1.2,1434,Application Data
327,25.7193003,151.101.66.187,172.20.40.110,TLSv1.2,1434,Application Data
328,25.7193003,151.101.66.187,172.20.40.110,TLSv1.2,1434,Application Data
329,25.7193003,151.101.66.187,172.20.40.110,TLSv1.2,1434,Application Data
330,25.7193003,151.101.66.187,172.20.40.110,TLSv1.2,1434,Application Data
331,25.7194193,172.20.40.110,151.101.66.187,TCP,54,57039  >  443 [ACK] Seq=167943 Ack=192040 Win=517 Len=0
332,25.7216842,151.101.66.187,172.20.40.110,TLSv1.2,4194,"Application Data, Application Data"
333,25.7216842,151.101.66.187,172.20.40.110,TLSv1.2,1149,Application Data
334,25.7217924,172.20.40.110,151.101.66.187,TCP,54,57039  >  443 [ACK] Seq=167943 Ack=197275 Win=517 Len=0
335,25.8836788,151.101.66.187,172.20.40.110,TCP,9714,"443  >  57039 [PSH, ACK] Seq=197275 Ack=167943 Win=3435 Len=9660 [TCP PDU reassembled in 338]"
336,25.8838109,172.20.40.110,151.101.66.187,TCP,54,57039  >  443 [ACK] Seq=167943 Ack=206935 Win=517 Len=0
337,25.8865833,151.101.66.187,172.20.40.110,TCP,5574,443  >  57039 [ACK] Seq=206935 Ack=167943 Win=3435 Len=5520 [TCP PDU reassembled in 338]
338,25.8865833,151.101.66.187,172.20.40.110,TLSv1.2,462,Application Data
339,25.8865833,151.101.66.187,172.20.40.110,TCP,4194,443  >  57039 [ACK] Seq=212863 Ack=167943 Win=3435 Len=4140 [TCP PDU reassembled in 345]
340,25.8866805,172.20.40.110,151.101.66.187,TCP,54,57039  >  443 [ACK] Seq=167943 Ack=217003 Win=517 Len=0
341,25.8879005,151.101.66.187,172.20.40.110,TCP,2814,443  >  57039 [ACK] Seq=217003 Ack=167943 Win=3435 Len=2760 [TCP PDU reassembled in 345]
342,25.8879692,172.20.40.110,151.101.66.187,TCP,54,57039  >  443 [ACK] Seq=167943 Ack=219763 Win=517 Len=0
343,25.8943845,151.101.66.187,172.20.40.110,TCP,1434,"443  >  57039 [PSH, ACK] Seq=219763 Ack=167943 Win=3435 Len=1380 [TCP PDU reassembled in 345]"
344,25.8943845,151.101.66.187,172.20.40.110,TCP,1434,443  >  57039 [ACK] Seq=221143 Ack=167943 Win=3435 Len=1380 [TCP PDU reassembled in 345]
345,25.8943845,151.101.66.187,172.20.40.110,TLSv1.2,13854,Application Data
346,25.8944994,172.20.40.110,151.101.66.187,TCP,54,57039  >  443 [ACK] Seq=167943 Ack=236323 Win=517 Len=0
347,25.8981835,151.101.66.187,172.20.40.110,TLSv1.2,9714,Application Data
348,25.8982804,172.20.40.110,151.101.66.187,TCP,54,57039  >  443 [ACK] Seq=167943 Ack=245983 Win=517 Len=0
349,25.9007545,151.101.66.187,172.20.40.110,TCP,9714,"443  >  57039 [PSH, ACK] Seq=245983 Ack=167943 Win=3435 Len=9660 [TCP PDU reassembled in 352]"
350,25.9008405,172.20.40.110,151.101.66.187,TCP,54,57039  >  443 [ACK] Seq=167943 Ack=255643 Win=517 Len=0
351,25.9024113,151.101.66.187,172.20.40.110,TCP,1434,443  >  57039 [ACK] Seq=255643 Ack=167943 Win=3435 Len=1380 [TCP PDU reassembled in 352]
352,25.9024113,151.101.66.187,172.20.40.110,TLSv1.2,1051,Application Data
353,25.902542,172.20.40.110,151.101.66.187,TCP,54,57039  >  443 [ACK] Seq=167943 Ack=258020 Win=517 Len=0
354,25.9154578,172.20.40.110,151.101.66.187,TLSv1.2,2870,Application Data
355,25.9251682,151.101.66.187,172.20.40.110,TCP,60,443  >  57039 [ACK] Seq=258020 Ack=170759 Win=3446 Len=0
356,25.9275203,151.101.66.187,172.20.40.110,TLSv1.2,190,Application Data
357,25.9468436,172.20.40.110,151.101.66.187,TLSv1.2,2866,Application Data
358,25.9471529,172.20.40.110,151.101.66.187,TLSv1.2,2868,Application Data
359,25.9557991,151.101.66.187,172.20.40.110,TCP,60,443  >  57039 [ACK] Seq=258156 Ack=173571 Win=3457 Len=0
360,25.9582673,151.101.66.187,172.20.40.110,TCP,60,443  >  57039 [ACK] Seq=258156 Ack=176385 Win=3468 Len=0
361,25.959681,151.101.66.187,172.20.40.110,TLSv1.2,204,Application Data
362,25.9608063,151.101.66.187,172.20.40.110,TLSv1.2,174,Application Data
363,25.9608793,172.20.40.110,151.101.66.187,TCP,54,57039  >  443 [ACK] Seq=176385 Ack=258426 Win=515 Len=0
364,25.9857317,172.20.40.110,151.101.66.187,TLSv1.2,2866,Application Data
365,25.9866462,172.20.40.110,151.101.66.187,TLSv1.2,2864,Application Data
366,25.9869455,172.20.40.110,151.101.66.187,TLSv1.2,2883,Application Data
367,25.9948031,172.20.40.110,151.101.66.187,TLSv1.2,2880,Application Data
368,25.9954671,151.101.66.187,172.20.40.110,TCP,60,443  >  57039 [ACK] Seq=258426 Ack=179197 Win=3479 Len=0
369,25.9985038,151.101.66.187,172.20.40.110,TLSv1.2,207,Application Data
370,25.9985038,151.101.66.187,172.20.40.110,TCP,60,443  >  57039 [ACK] Seq=258579 Ack=182007 Win=3490 Len=0
371,25.9985038,151.101.66.187,172.20.40.110,TCP,60,443  >  57039 [ACK] Seq=258579 Ack=184836 Win=3501 Len=0
372,25.999492,172.20.40.110,151.101.66.187,TLSv1.2,2882,Application Data
373,26.0020314,151.101.66.187,172.20.40.110,TLSv1.2,98,Application Data
374,26.0026641,151.101.66.187,172.20.40.110,TLSv1.2,135,Application Data
375,26.0027244,172.20.40.110,151.101.66.187,TCP,54,57039  >  443 [ACK] Seq=190490 Ack=258704 Win=514 Len=0
376,26.002975,172.20.40.110,151.101.66.187,TLSv1.2,2882,Application Data
377,26.0049896,151.101.66.187,172.20.40.110,TCP,60,443  >  57039 [ACK] Seq=258704 Ack=187662 Win=3512 Len=0
378,26.007661,151.101.66.187,172.20.40.110,TLSv1.2,131,Application Data
379,26.0094347,151.101.66.187,172.20.40.110,TCP,60,443  >  57039 [ACK] Seq=258781 Ack=190490 Win=3523 Len=0
380,26.0112473,151.101.66.187,172.20.40.110,TLSv1.2,131,Application Data
381,26.0112473,151.101.66.187,172.20.40.110,TCP,60,443  >  57039 [ACK] Seq=258858 Ack=193318 Win=3534 Len=0
382,26.0113346,172.20.40.110,151.101.66.187,TCP,54,57039  >  443 [ACK] Seq=193318 Ack=258858 Win=514 Len=0
383,26.0144673,151.101.66.187,172.20.40.110,TLSv1.2,130,Application Data
384,26.0269016,172.20.40.110,151.101.66.187,TLSv1.2,2877,Application Data
385,26.0275109,172.20.40.110,151.101.66.187,TLSv1.2,2877,Application Data
386,26.0335048,172.20.40.110,151.101.66.187,TLSv1.2,2866,Application Data
387,26.040404,151.101.66.187,172.20.40.110,TCP,60,443  >  57039 [ACK] Seq=258934 Ack=196141 Win=3545 Len=0
388,26.040404,151.101.66.187,172.20.40.110,TCP,60,443  >  57039 [ACK] Seq=258934 Ack=198964 Win=3556 Len=0
389,26.0441133,151.101.66.187,172.20.40.110,TCP,60,443  >  57039 [ACK] Seq=258934 Ack=201776 Win=3567 Len=0
390,26.054746,151.101.66.187,172.20.40.110,TLSv1.2,128,Application Data
391,26.054746,151.101.66.187,172.20.40.110,TLSv1.2,136,Application Data
392,26.0548441,172.20.40.110,151.101.66.187,TCP,54,57039  >  443 [ACK] Seq=201776 Ack=259090 Win=513 Len=0
393,26.0579225,151.101.66.187,172.20.40.110,TLSv1.2,131,Application Data
394,26.0995458,172.20.40.110,151.101.66.187,TCP,54,57039  >  443 [ACK] Seq=201776 Ack=259167 Win=513 Len=0
395,26.1040824,151.101.66.187,172.20.40.110,TCP,131,"[TCP Spurious Retransmission] 443  >  57039 [PSH, ACK] Seq=259090 Ack=201776 Win=3567 Len=77"
396,26.1041408,172.20.40.110,151.101.66.187,TCP,66,[TCP Dup ACK 394#1] 57039  >  443 [ACK] Seq=201776 Ack=259167 Win=513 Len=0 SLE=259090 SRE=259167
397,26.1452191,172.20.40.110,151.101.66.187,TLSv1.2,2866,Application Data
398,26.155049,151.101.66.187,172.20.40.110,TCP,60,443  >  57039 [ACK] Seq=259167 Ack=204588 Win=3578 Len=0
399,26.1586198,151.101.66.187,172.20.40.110,TLSv1.2,131,Application Data
400,26.2016352,172.20.40.110,151.101.66.187,TCP,54,57039  >  443 [ACK] Seq=204588 Ack=259244 Win=512 Len=0
401,26.2018284,151.101.66.187,172.20.40.110,TCP,131,"[TCP Spurious Retransmission] 443  >  57039 [PSH, ACK] Seq=259167 Ack=204588 Win=3578 Len=77"
402,26.2018889,172.20.40.110,151.101.66.187,TCP,66,[TCP Dup ACK 400#1] 57039  >  443 [ACK] Seq=204588 Ack=259244 Win=512 Len=0 SLE=259167 SRE=259244
403,26.2875186,172.20.40.110,151.101.66.187,TLSv1.2,2876,Application Data
404,26.2955526,172.20.40.110,151.101.66.187,TLSv1.2,2878,Application Data
405,26.2981505,151.101.66.187,172.20.40.110,TCP,60,443  >  57039 [ACK] Seq=259244 Ack=207410 Win=3589 Len=0
