"No.","Time","Source","Destination","Protocol","Length","Info"
"1","0.000000000","172.20.40.110","151.101.130.187","TCP","66","63075  >  443 [SYN] Seq=0 Win=64240 Len=0 MSS=1460 WS=256 SACK_PERM"
"2","0.007741000","151.101.130.187","172.20.40.110","TCP","66","443  >  63075 [SYN, ACK] Seq=0 Ack=1 Win=65535 Len=0 MSS=1380 SACK_PERM WS=512"
"3","0.007864400","172.20.40.110","151.101.130.187","TCP","54","63075  >  443 [ACK] Seq=1 Ack=1 Win=66048 Len=0"
"4","0.008599700","172.20.40.110","151.101.130.187","TLSv1.3","1874","Client Hello (SNI=www.target.com)"
"5","0.027976500","172.20.40.110","151.101.130.187","TCP","1434","[TCP Retransmission] 63075  >  443 [PSH, ACK] Seq=441 Ack=1 Win=66048 Len=1380"
"6","0.028185300","151.101.130.187","172.20.40.110","TCP","60","443  >  63075 [ACK] Seq=1 Ack=1381 Win=144896 Len=0"
"7","0.036401600","151.101.130.187","172.20.40.110","TCP","60","443  >  63075 [ACK] Seq=1 Ack=1821 Win=144896 Len=0"
"8","0.038727100","151.101.130.187","172.20.40.110","TLSv1.3","1434","Server Hello, Change Cipher Spec, Application Data"
"9","0.038727100","151.101.130.187","172.20.40.110","TCP","1434","443  >  63075 [ACK] Seq=1381 Ack=1821 Win=144896 Len=1380 [TCP PDU reassembled in 15]"
"10","0.038779300","172.20.40.110","151.101.130.187","TCP","54","63075  >  443 [ACK] Seq=1821 Ack=2761 Win=66048 Len=0"
"11","0.040714100","151.101.130.187","172.20.40.110","TCP","1434","443  >  63075 [ACK] Seq=2761 Ack=1821 Win=144896 Len=1380 [TCP PDU reassembled in 15]"
"12","0.093700700","172.20.40.110","151.101.130.187","TCP","54","63075  >  443 [ACK] Seq=1821 Ack=4141 Win=66048 Len=0"
"13","0.152478500","151.101.130.187","172.20.40.110","TCP","1434","443  >  63075 [ACK] Seq=4141 Ack=1821 Win=144896 Len=1380 [TCP PDU reassembled in 15]"
"14","0.152478500","151.101.130.187","172.20.40.110","TCP","1434","443  >  63075 [PSH, ACK] Seq=5521 Ack=1821 Win=144896 Len=1380 [TCP PDU reassembled in 15]"
"15","0.152478500","151.101.130.187","172.20.40.110","TLSv1.3","1055","Application Data, Application Data, Application Data, Application Data"
"16","0.152478500","151.101.130.187","172.20.40.110","TCP","66","[TCP Dup ACK 7#1] 443  >  63075 [ACK] Seq=7902 Ack=1821 Win=144896 Len=0 SLE=441 SRE=1821"
"17","0.152478500","151.101.130.187","172.20.40.110","TCP","1055","[TCP Retransmission] 443  >  63075 [PSH, ACK] Seq=6901 Ack=1821 Win=144896 Len=1001"
"18","0.152615800","172.20.40.110","151.101.130.187","TCP","54","63075  >  443 [ACK] Seq=1821 Ack=7902 Win=66048 Len=0"
"19","0.152812900","172.20.40.110","151.101.130.187","TCP","66","[TCP Dup ACK 18#1] 63075  >  443 [ACK] Seq=1821 Ack=7902 Win=66048 Len=0 SLE=6901 SRE=7902"
"20","0.160099400","172.20.40.110","151.101.130.187","TLSv1.3","118","Change Cipher Spec, Application Data"
"21","0.160761600","172.20.40.110","151.101.130.187","TLSv1.3","146","Application Data"
"22","0.161408700","172.20.40.110","151.101.130.187","TLSv1.3","1097","Application Data"
"23","0.168811600","151.101.130.187","172.20.40.110","TCP","60","443  >  63075 [ACK] Seq=7902 Ack=1885 Win=144896 Len=0"
"24","0.168811600","151.101.130.187","172.20.40.110","TCP","60","443  >  63075 [ACK] Seq=7902 Ack=1977 Win=144896 Len=0"
"25","0.168811600","151.101.130.187","172.20.40.110","TLSv1.3","119","Application Data"
"26","0.169197200","172.20.40.110","151.101.130.187","TLSv1.3","85","Application Data"
"27","0.172481200","151.101.130.187","172.20.40.110","TCP","60","443  >  63075 [ACK] Seq=7967 Ack=3020 Win=143872 Len=0"
"28","0.210317200","151.101.130.187","172.20.40.110","TCP","60","443  >  63075 [ACK] Seq=7967 Ack=3051 Win=143872 Len=0"
"29","0.696833400","151.101.130.187","172.20.40.110","TCP","1434","443  >  63075 [ACK] Seq=7967 Ack=3051 Win=143872 Len=1380 [TCP PDU reassembled in 30]"
"30","0.696833400","151.101.130.187","172.20.40.110","TLSv1.3","620","Application Data, Application Data"
"31","0.696833400","151.101.130.187","172.20.40.110","TLSv1.3","4194","Application Data, Application Data"
"32","0.697411900","172.20.40.110","151.101.130.187","TCP","54","63075  >  443 [ACK] Seq=3051 Ack=14053 Win=66048 Len=0"
"33","0.705043100","151.101.130.187","172.20.40.110","TLSv1.3","1434","Application Data"
"34","0.705043100","151.101.130.187","172.20.40.110","TLSv1.3","1434","Application Data"
"35","0.705043100","151.101.130.187","172.20.40.110","TLSv1.3","1434","Application Data"
"36","0.705043100","151.101.130.187","172.20.40.110","TLSv1.3","6954","Application Data, Application Data, Application Data, Application Data, Application Data"
"37","0.705233500","172.20.40.110","151.101.130.187","TCP","54","63075  >  443 [ACK] Seq=3051 Ack=25093 Win=66048 Len=0"
"38","0.707240400","151.101.130.187","172.20.40.110","TLSv1.3","5574","Application Data, Application Data, Application Data, Application Data"
"39","0.707345400","172.20.40.110","151.101.130.187","TCP","54","63075  >  443 [ACK] Seq=3051 Ack=30613 Win=66048 Len=0"
"40","0.709678900","151.101.130.187","172.20.40.110","TLSv1.3","5574","Application Data, Application Data, Application Data, Application Data"
"41","0.709785600","172.20.40.110","151.101.130.187","TCP","54","63075  >  443 [ACK] Seq=3051 Ack=36133 Win=66048 Len=0"
"42","0.712764100","151.101.130.187","172.20.40.110","TLSv1.3","5574","Application Data, Application Data, Application Data, Application Data"
"43","0.712880700","172.20.40.110","151.101.130.187","TCP","54","63075  >  443 [ACK] Seq=3051 Ack=41653 Win=66048 Len=0"
"44","0.715014600","151.101.130.187","172.20.40.110","TLSv1.3","5574","Application Data, Application Data, Application Data, Application Data"
"45","0.715117100","172.20.40.110","151.101.130.187","TCP","54","63075  >  443 [ACK] Seq=3051 Ack=47173 Win=66048 Len=0"
"46","0.717438500","151.101.130.187","172.20.40.110","TLSv1.3","1434","Application Data"
"47","0.717561900","172.20.40.110","151.101.130.187","TCP","54","63075  >  443 [ACK] Seq=3051 Ack=48553 Win=66048 Len=0"
"48","0.720568400","151.101.130.187","172.20.40.110","TLSv1.3","1434","Application Data"
"49","0.720568400","151.101.130.187","172.20.40.110","TLSv1.3","6954","Application Data, Application Data, Application Data, Application Data, Application Data"
"50","0.720697700","172.20.40.110","151.101.130.187","TCP","54","63075  >  443 [ACK] Seq=3051 Ack=56833 Win=66048 Len=0"
"51","0.725004900","151.101.130.187","172.20.40.110","TLSv1.3","1434","Application Data"
"52","0.729466400","151.101.130.187","172.20.40.110","TLSv1.3","1434","Application Data"
"53","0.729573800","172.20.40.110","151.101.130.187","TCP","54","63075  >  443 [ACK] Seq=3051 Ack=59593 Win=66048 Len=0"
"54","0.743854400","151.101.130.187","172.20.40.110","TLSv1.3","1434","Application Data"
"55","0.743854400","151.101.130.187","172.20.40.110","TLSv1.3","1434","Application Data"
"56","0.743854400","151.101.130.187","172.20.40.110","TLSv1.3","1434","Application Data"
"57","0.743950700","172.20.40.110","151.101.130.187","TCP","54","63075  >  443 [ACK] Seq=3051 Ack=63733 Win=66048 Len=0"
"58","0.745976500","151.101.130.187","172.20.40.110","TLSv1.3","1434","Application Data"
"59","0.745976500","151.101.130.187","172.20.40.110","TLSv1.3","2814","Application Data, Application Data"
"60","0.746077100","172.20.40.110","151.101.130.187","TCP","54","63075  >  443 [ACK] Seq=3051 Ack=67873 Win=66048 Len=0"
"61","0.748273400","151.101.130.187","172.20.40.110","TLSv1.3","4194","Application Data, Application Data, Application Data"
"62","0.748366700","172.20.40.110","151.101.130.187","TCP","54","63075  >  443 [ACK] Seq=3051 Ack=72013 Win=66048 Len=0"
"63","0.749392700","151.101.130.187","172.20.40.110","TLSv1.3","1009","Application Data, Application Data"
"64","0.749462400","172.20.40.110","151.101.130.187","TCP","54","63075  >  443 [ACK] Seq=3051 Ack=72968 Win=65280 Len=0"
"65","1.282774400","172.20.40.110","151.101.130.187","TLSv1.3","1386","Application Data"
"66","1.282907300","172.20.40.110","151.101.130.187","TLSv1.3","289","Application Data"
"67","1.283041300","172.20.40.110","151.101.130.187","TLSv1.3","552","Application Data"
"68","1.286611200","172.20.40.110","151.101.130.187","TLSv1.3","435","Application Data"
"69","1.286796500","172.20.40.110","151.101.130.187","TLSv1.3","1387","Application Data"
"70","1.286902700","172.20.40.110","151.101.130.187","TLSv1.3","313","Application Data"
"71","1.287011900","172.20.40.110","151.101.130.187","TLSv1.3","552","Application Data"
"72","1.287113600","172.20.40.110","151.101.130.187","TLSv1.3","429","Application Data"
"73","1.300337100","151.101.130.187","172.20.40.110","TCP","60","443  >  63075 [ACK] Seq=72968 Ack=4383 Win=142848 Len=0"
"74","1.300337100","151.101.130.187","172.20.40.110","TLSv1.3","269","Application Data"
"75","1.300337100","151.101.130.187","172.20.40.110","TCP","60","443  >  63075 [ACK] Seq=73183 Ack=4618 Win=142848 Len=0"
"76","1.300337100","151.101.130.187","172.20.40.110","TCP","60","443  >  63075 [ACK] Seq=73183 Ack=5116 Win=142848 Len=0"
"77","1.300337100","151.101.130.187","172.20.40.110","TCP","60","443  >  63075 [ACK] Seq=73183 Ack=5497 Win=142848 Len=0"
"78","1.300337100","151.101.130.187","172.20.40.110","TCP","60","443  >  63075 [ACK] Seq=73183 Ack=6830 Win=141824 Len=0"
"79","1.300337100","151.101.130.187","172.20.40.110","TCP","60","443  >  63075 [ACK] Seq=73183 Ack=7962 Win=140800 Len=0"
"80","1.308283900","151.101.130.187","172.20.40.110","TLSv1.3","185","Application Data"
"81","1.308283900","151.101.130.187","172.20.40.110","TLSv1.3","130","Application Data"
"82","1.308349200","172.20.40.110","151.101.130.187","TCP","54","63075  >  443 [ACK] Seq=7962 Ack=73390 Win=64768 Len=0"
"83","1.309341500","151.101.130.187","172.20.40.110","TLSv1.3","152","Application Data"
"84","1.309341500","151.101.130.187","172.20.40.110","TLSv1.3","239","Application Data"
"85","1.309341500","151.101.130.187","172.20.40.110","TLSv1.3","226","Application Data"
"86","1.309411300","172.20.40.110","151.101.130.187","TCP","54","63075  >  443 [ACK] Seq=7962 Ack=73845 Win=66048 Len=0"
"87","1.756398900","172.20.40.110","151.101.130.187","TLSv1.3","1387","Application Data"
"88","1.756534500","172.20.40.110","151.101.130.187","TLSv1.3","146","Application Data"
"89","1.756602200","172.20.40.110","151.101.130.187","TLSv1.3","158","Application Data"
"90","1.765710500","151.101.130.187","172.20.40.110","TCP","60","443  >  63075 [ACK] Seq=73845 Ack=9295 Win=139776 Len=0"
"91","1.767029500","151.101.130.187","172.20.40.110","TCP","60","443  >  63075 [ACK] Seq=73845 Ack=9387 Win=139776 Len=0"
"92","1.767029500","151.101.130.187","172.20.40.110","TCP","60","443  >  63075 [ACK] Seq=73845 Ack=9491 Win=139776 Len=0"
"93","1.772708900","151.101.130.187","172.20.40.110","TLSv1.3","208","Application Data"
"94","1.772708900","151.101.130.187","172.20.40.110","TLSv1.3","142","Application Data, Application Data"
"95","1.772786800","172.20.40.110","151.101.130.187","TCP","54","63075  >  443 [ACK] Seq=9491 Ack=74087 Win=65792 Len=0"
"96","1.808095000","172.20.40.110","151.101.130.187","TLSv1.3","195","Application Data"
"97","1.815882700","151.101.130.187","172.20.40.110","TCP","60","443  >  63075 [ACK] Seq=74087 Ack=9632 Win=139776 Len=0"
"98","1.818727000","151.101.130.187","172.20.40.110","TLSv1.3","124","Application Data"
"99","1.863130400","172.20.40.110","151.101.130.187","TCP","54","63075  >  443 [ACK] Seq=9632 Ack=74157 Win=65792 Len=0"
"100","2.910330900","172.20.40.110","151.101.130.187","TLSv1.3","346","Application Data"
"101","2.918030200","151.101.130.187","172.20.40.110","TCP","60","443  >  63075 [ACK] Seq=74157 Ack=9924 Win=139776 Len=0"
"102","2.920350200","151.101.130.187","172.20.40.110","TLSv1.3","241","Application Data"
"103","2.964400500","172.20.40.110","151.101.130.187","TCP","54","63075  >  443 [ACK] Seq=9924 Ack=74344 Win=65536 Len=0"
"104","2.969278100","172.20.40.110","151.101.130.187","TLSv1.3","540","Application Data"
"105","2.976899400","151.101.130.187","172.20.40.110","TCP","60","443  >  63075 [ACK] Seq=74344 Ack=10410 Win=139776 Len=0"
"106","2.980338600","151.101.130.187","172.20.40.110","TLSv1.3","104","Application Data"
"107","2.988992800","172.20.40.110","151.101.130.187","TLSv1.3","452","Application Data"
"108","2.990431000","172.20.40.110","151.101.130.187","TLSv1.3","1417","Application Data"
"109","2.996240200","151.101.130.187","172.20.40.110","TCP","60","443  >  63075 [ACK] Seq=74394 Ack=10808 Win=139776 Len=0"
"110","2.998535000","151.101.130.187","172.20.40.110","TCP","60","443  >  63075 [ACK] Seq=74394 Ack=12171 Win=138752 Len=0"
"111","2.998535000","151.101.130.187","172.20.40.110","TLSv1.3","98","Application Data"
"112","3.000604000","151.101.130.187","172.20.40.110","TLSv1.3","98","Application Data"
"113","3.000676300","172.20.40.110","151.101.130.187","TCP","54","63075  >  443 [ACK] Seq=12171 Ack=74482 Win=65536 Len=0"
"114","3.232289400","172.20.40.110","151.101.130.187","TLSv1.3","393","Application Data"
"115","3.233888100","172.20.40.110","151.101.130.187","TLSv1.3","759","Application Data"
"116","3.241313200","151.101.130.187","172.20.40.110","TCP","60","443  >  63075 [ACK] Seq=74482 Ack=12510 Win=138752 Len=0"
"117","3.242342600","151.101.130.187","172.20.40.110","TCP","60","443  >  63075 [ACK] Seq=74482 Ack=13215 Win=138240 Len=0"
"118","3.243751600","151.101.130.187","172.20.40.110","TLSv1.3","130","Application Data"
"119","3.244844300","151.101.130.187","172.20.40.110","TLSv1.3","181","Application Data"
"120","3.244929700","172.20.40.110","151.101.130.187","TCP","54","63075  >  443 [ACK] Seq=13215 Ack=74685 Win=65280 Len=0"
"121","3.337035900","172.20.40.110","151.101.130.187","TLSv1.3","1465","Application Data"
"122","3.348713700","151.101.130.187","172.20.40.110","TCP","60","443  >  63075 [ACK] Seq=74685 Ack=14626 Win=137728 Len=0"
"123","3.349725500","151.101.130.187","172.20.40.110","TLSv1.3","131","Application Data"
"124","3.398041900","172.20.40.110","151.101.130.187","TCP","54","63075  >  443 [ACK] Seq=14626 Ack=74762 Win=65280 Len=0"
"125","9.508005900","172.20.40.110","151.101.130.187","TLSv1.3","678","Application Data"
"126","9.508873300","172.20.40.110","151.101.130.187","TLSv1.3","1740","Application Data"
"127","9.515037400","172.20.40.110","151.101.130.187","TLSv1.3","817","Application Data"
"128","9.515280100","172.20.40.110","151.101.130.187","TLSv1.3","1710","Application Data"
"129","9.524184100","172.20.40.110","151.101.130.187","TLSv1.3","817","Application Data"
"130","9.525462100","172.20.40.110","151.101.130.187","TLSv1.3","1706","Application Data"
"131","9.525687200","172.20.40.110","151.101.130.187","TLSv1.3","817","Application Data"
"132","9.541464500","151.101.130.187","172.20.40.110","TCP","60","443  >  63075 [ACK] Seq=74762 Ack=15250 Win=138240 Len=0"
"133","9.544199900","151.101.130.187","172.20.40.110","TCP","60","443  >  63075 [ACK] Seq=74762 Ack=16936 Win=137216 Len=0"
"134","9.546359800","151.101.130.187","172.20.40.110","TLSv1.3","214","Application Data"
"135","9.546359800","151.101.130.187","172.20.40.110","TLSv1.3","131","Application Data"
"136","9.546359800","151.101.130.187","172.20.40.110","TCP","60","443  >  63075 [ACK] Seq=74999 Ack=17699 Win=138240 Len=0"
"137","9.546359800","151.101.130.187","172.20.40.110","TCP","60","443  >  63075 [ACK] Seq=74999 Ack=19355 Win=137216 Len=0"
"138","9.546459300","172.20.40.110","151.101.130.187","TCP","54","63075  >  443 [ACK] Seq=22533 Ack=74999 Win=65024 Len=0"
"139","9.548942900","151.101.130.187","172.20.40.110","TLSv1.3","152","Application Data"
"140","9.548942900","151.101.130.187","172.20.40.110","TLSv1.3","192","Application Data"
"141","9.549267700","172.20.40.110","151.101.130.187","TCP","54","63075  >  443 [ACK] Seq=22533 Ack=75235 Win=66048 Len=0"
"142","9.559350400","151.101.130.187","172.20.40.110","TCP","60","443  >  63075 [ACK] Seq=75235 Ack=20118 Win=138240 Len=0"
"143","9.559350400","151.101.130.187","172.20.40.110","TCP","60","443  >  63075 [ACK] Seq=75235 Ack=22533 Win=137216 Len=0"
"144","9.562411500","151.101.130.187","172.20.40.110","TLSv1.3","98","Application Data"
"145","9.562411500","151.101.130.187","172.20.40.110","TLSv1.3","208","Application Data"
"146","9.562555300","172.20.40.110","151.101.130.187","TCP","54","63075  >  443 [ACK] Seq=22533 Ack=75433 Win=65792 Len=0"
"147","9.564422200","151.101.130.187","172.20.40.110","TLSv1.3","130","Application Data"
"148","9.656848800","151.101.130.187","172.20.40.110","TCP","130","[TCP Retransmission] 443  >  63075 [PSH, ACK] Seq=75433 Ack=22533 Win=138752 Len=76"
"149","9.656973100","172.20.40.110","151.101.130.187","TCP","66","63075  >  443 [ACK] Seq=22533 Ack=75509 Win=65792 Len=0 SLE=75433 SRE=75509"
"150","9.844717000","172.20.40.110","151.101.130.187","TLSv1.3","1708","Application Data"
"151","9.846526000","172.20.40.110","151.101.130.187","TLSv1.3","834","Application Data"
"152","9.848157500","172.20.40.110","151.101.130.187","TLSv1.3","1752","Application Data"
"153","9.849286100","172.20.40.110","151.101.130.187","TLSv1.3","800","Application Data"
"154","9.853665800","172.20.40.110","151.101.130.187","TLSv1.3","1767","Application Data"
"155","9.854023800","172.20.40.110","151.101.130.187","TLSv1.3","791","Application Data"
"156","9.876278900","151.101.130.187","172.20.40.110","TCP","60","443  >  63075 [ACK] Seq=75509 Ack=24187 Win=137216 Len=0"
"157","9.881459000","151.101.130.187","172.20.40.110","TCP","60","443  >  63075 [ACK] Seq=75509 Ack=24967 Win=137216 Len=0"
"158","9.881459000","151.101.130.187","172.20.40.110","TCP","60","443  >  63075 [ACK] Seq=75509 Ack=26665 Win=136192 Len=0"
"159","9.881459000","151.101.130.187","172.20.40.110","TLSv1.3","104","Application Data"
"160","9.881459000","151.101.130.187","172.20.40.110","TLSv1.3","125","Application Data"
"161","9.881459000","151.101.130.187","172.20.40.110","TCP","60","443  >  63075 [ACK] Seq=75630 Ack=27411 Win=138240 Len=0"
"162","9.881459000","151.101.130.187","172.20.40.110","TLSv1.3","104","Application Data"
"163","9.881577100","172.20.40.110","151.101.130.187","TCP","54","63075  >  443 [ACK] Seq=29861 Ack=75680 Win=65792 Len=0"
"164","9.883592700","151.101.130.187","172.20.40.110","TLSv1.3","124","Application Data"
"165","9.883592700","151.101.130.187","172.20.40.110","TCP","60","443  >  63075 [ACK] Seq=75750 Ack=29124 Win=137216 Len=0"
"166","9.883592700","151.101.130.187","172.20.40.110","TCP","60","443  >  63075 [ACK] Seq=75750 Ack=29861 Win=136704 Len=0"
"167","9.883797900","172.20.40.110","151.101.130.187","TCP","54","63075  >  443 [ACK] Seq=29861 Ack=75750 Win=65536 Len=0"
"168","9.890926000","151.101.130.187","172.20.40.110","TLSv1.3","196","Application Data, Application Data"
"169","9.891088000","172.20.40.110","151.101.130.187","TCP","54","63075  >  443 [ACK] Seq=29861 Ack=75892 Win=65536 Len=0"
"170","14.184157200","172.20.40.110","151.101.130.187","TLSv1.3","1918","Application Data"
"171","14.195244500","151.101.130.187","172.20.40.110","TCP","60","443  >  63075 [ACK] Seq=75892 Ack=31725 Win=137216 Len=0"
"172","14.203256400","151.101.130.187","172.20.40.110","TLSv1.3","241","Application Data"
"173","14.284491000","151.101.130.187","172.20.40.110","TCP","241","[TCP Retransmission] 443  >  63075 [PSH, ACK] Seq=75892 Ack=31725 Win=138752 Len=187"
"174","14.284543800","172.20.40.110","151.101.130.187","TCP","66","63075  >  443 [ACK] Seq=31725 Ack=76079 Win=65280 Len=0 SLE=75892 SRE=76079"
"175","14.863786400","172.20.40.110","151.101.130.187","TLSv1.3","636","Application Data"
"176","14.863954900","172.20.40.110","151.101.130.187","TLSv1.3","1886","Application Data"
"177","14.871879300","151.101.130.187","172.20.40.110","TCP","60","443  >  63075 [ACK] Seq=76079 Ack=32307 Win=138240 Len=0"
"178","14.874214400","151.101.130.187","172.20.40.110","TCP","60","443  >  63075 [ACK] Seq=76079 Ack=34139 Win=136704 Len=0"
"179","14.874214400","151.101.130.187","172.20.40.110","TLSv1.3","284","Application Data"
"180","14.876290900","151.101.130.187","172.20.40.110","TLSv1.3","130","Application Data"
"181","14.876367000","172.20.40.110","151.101.130.187","TCP","54","63075  >  443 [ACK] Seq=34139 Ack=76385 Win=65024 Len=0"
"182","17.806843100","172.20.40.110","151.101.130.187","TLSv1.3","728","Application Data"
"183","17.815031400","151.101.130.187","172.20.40.110","TCP","60","443  >  63075 [ACK] Seq=76385 Ack=34813 Win=138240 Len=0"
"184","17.818249700","151.101.130.187","172.20.40.110","TLSv1.3","214","Application Data"
"185","17.864930800","172.20.40.110","151.101.130.187","TLSv1.3","1812","Application Data"
"186","17.867507500","172.20.40.110","151.101.130.187","TLSv1.3","719","Application Data"
"187","17.873846800","151.101.130.187","172.20.40.110","TCP","60","443  >  63075 [ACK] Seq=76545 Ack=36571 Win=137216 Len=0"
"188","17.876161500","151.101.130.187","172.20.40.110","TCP","60","443  >  63075 [ACK] Seq=76545 Ack=37236 Win=137216 Len=0"
"189","17.876161500","151.101.130.187","172.20.40.110","TLSv1.3","98","Application Data"
"190","17.877409100","151.101.130.187","172.20.40.110","TLSv1.3","98","Application Data"
"191","17.877667500","172.20.40.110","151.101.130.187","TCP","54","63075  >  443 [ACK] Seq=37236 Ack=76633 Win=66048 Len=0"
"192","18.885289600","172.20.40.110","151.101.130.187","TLSv1.3","1812","Application Data"
"193","18.886642800","172.20.40.110","151.101.130.187","TLSv1.3","729","Application Data"
"194","18.887968600","172.20.40.110","151.101.130.187","TLSv1.3","1794","Application Data"
"195","18.897658100","172.20.40.110","151.101.130.187","TLSv1.3","742","Application Data"
"196","18.910455900","151.101.130.187","172.20.40.110","TCP","60","443  >  63075 [ACK] Seq=76633 Ack=38994 Win=137216 Len=0"
"197","18.910455900","151.101.130.187","172.20.40.110","TCP","60","443  >  63075 [ACK] Seq=76633 Ack=39669 Win=136704 Len=0"
"198","18.910455900","151.101.130.187","172.20.40.110","TCP","60","443  >  63075 [ACK] Seq=76633 Ack=41409 Win=135168 Len=0"
"199","18.914704900","151.101.130.187","172.20.40.110","TLSv1.3","262","Application Data"
"200","18.918980000","151.101.130.187","172.20.40.110","TLSv1.3","217","Application Data"
"201","18.918980000","151.101.130.187","172.20.40.110","TLSv1.3","155","Application Data"
"202","18.918980000","151.101.130.187","172.20.40.110","TCP","60","443  >  63075 [ACK] Seq=77105 Ack=42097 Win=138240 Len=0"
"203","18.919081000","172.20.40.110","151.101.130.187","TCP","54","63075  >  443 [ACK] Seq=42097 Ack=77105 Win=65536 Len=0"
"204","18.921525700","151.101.130.187","172.20.40.110","TLSv1.3","98","Application Data"
"205","18.921684200","172.20.40.110","151.101.130.187","TCP","54","63075  >  443 [ACK] Seq=42097 Ack=77149 Win=65536 Len=0"
"206","19.126925800","172.20.40.110","151.101.130.187","TLSv1.3","1816","Application Data"
"207","19.141068100","151.101.130.187","172.20.40.110","TCP","60","443  >  63075 [ACK] Seq=77149 Ack=43859 Win=137216 Len=0"
"208","19.146122200","151.101.130.187","172.20.40.110","TLSv1.3","130","Application Data"
"209","19.209037400","151.101.130.187","172.20.40.110","TCP","130","[TCP Retransmission] 443  >  63075 [PSH, ACK] Seq=77149 Ack=43859 Win=138752 Len=76"
"210","19.209119700","172.20.40.110","151.101.130.187","TCP","66","63075  >  443 [ACK] Seq=43859 Ack=77225 Win=65536 Len=0 SLE=77149 SRE=77225"
"211","19.264676100","172.20.40.110","151.101.130.187","TLSv1.3","678","Application Data"
"212","19.268968500","172.20.40.110","151.101.130.187","TLSv1.3","1807","Application Data"
"213","19.269213600","172.20.40.110","151.101.130.187","TLSv1.3","730","Application Data"
"214","19.269366400","172.20.40.110","151.101.130.187","TLSv1.3","1798","Application Data"
"215","19.269697400","172.20.40.110","151.101.130.187","TLSv1.3","727","Application Data"
"216","19.309601300","151.101.130.187","172.20.40.110","TCP","60","443  >  63075 [ACK] Seq=77225 Ack=44483 Win=138240 Len=0"
"217","19.315475200","151.101.130.187","172.20.40.110","TLSv1.3","173","Application Data"
"218","19.315475200","151.101.130.187","172.20.40.110","TLSv1.3","463","Application Data"
"219","19.315785100","172.20.40.110","151.101.130.187","TCP","54","63075  >  443 [ACK] Seq=49329 Ack=77753 Win=65024 Len=0"
"220","19.317374600","151.101.130.187","172.20.40.110","TCP","60","443  >  63075 [ACK] Seq=77753 Ack=46236 Win=137216 Len=0"
"221","19.317374600","151.101.130.187","172.20.40.110","TCP","60","443  >  63075 [ACK] Seq=77753 Ack=46912 Win=136704 Len=0"
"222","19.317374600","151.101.130.187","172.20.40.110","TCP","60","443  >  63075 [ACK] Seq=77753 Ack=48656 Win=136192 Len=0"
"223","19.317374600","151.101.130.187","172.20.40.110","TCP","60","443  >  63075 [ACK] Seq=77753 Ack=49329 Win=135680 Len=0"
"224","19.317829000","172.20.40.110","151.101.130.187","TLSv1.3","89","Application Data"
"225","19.319848500","151.101.130.187","172.20.40.110","TLSv1.3","130","Application Data"
"226","19.319848500","151.101.130.187","172.20.40.110","TLSv1.3","124","Application Data"
"227","19.319934200","172.20.40.110","151.101.130.187","TCP","54","63075  >  443 [ACK] Seq=49364 Ack=77899 Win=64768 Len=0"
"228","19.321979900","151.101.130.187","172.20.40.110","TLSv1.3","130","Application Data"
"229","19.321979900","151.101.130.187","172.20.40.110","TLSv1.3","180","Application Data"
"230","19.322060200","172.20.40.110","151.101.130.187","TCP","54","63075  >  443 [ACK] Seq=49364 Ack=78101 Win=66048 Len=0"
"231","19.355495700","151.101.130.187","172.20.40.110","TCP","60","443  >  63075 [ACK] Seq=78101 Ack=49364 Win=138752 Len=0"
"232","24.604346200","172.20.40.110","151.101.130.187","TLSv1.3","1771","Application Data"
"233","24.631772800","151.101.130.187","172.20.40.110","TCP","60","443  >  63075 [ACK] Seq=78101 Ack=51081 Win=137216 Len=0"
"234","24.698966800","151.101.130.187","172.20.40.110","TLSv1.3","620","Application Data"
"235","24.702215700","172.20.40.110","151.101.130.187","TLSv1.3","89","Application Data"
"236","24.728258100","151.101.130.187","172.20.40.110","TCP","60","443  >  63075 [ACK] Seq=78667 Ack=51116 Win=138752 Len=0"
"237","32.860727300","172.20.40.110","151.101.130.187","TLSv1.3","1167","Application Data"
"238","32.897381800","151.101.130.187","172.20.40.110","TCP","60","443  >  63075 [ACK] Seq=78667 Ack=52229 Win=137728 Len=0"
"239","32.905688900","151.101.130.187","172.20.40.110","TLSv1.3","263","Application Data"
"240","32.954371500","172.20.40.110","151.101.130.187","TCP","54","63075  >  443 [ACK] Seq=52229 Ack=78876 Win=65280 Len=0"
"241","32.993320000","151.101.130.187","172.20.40.110","TCP","263","[TCP Spurious Retransmission] 443  >  63075 [PSH, ACK] Seq=78667 Ack=52229 Win=138752 Len=209"
"242","32.993402800","172.20.40.110","151.101.130.187","TCP","66","[TCP Dup ACK 240#1] 63075  >  443 [ACK] Seq=52229 Ack=78876 Win=65280 Len=0 SLE=78667 SRE=78876"
"243","33.064466000","172.20.40.110","151.101.130.187","TLSv1.3","1519","Application Data"
"244","33.113328300","151.101.130.187","172.20.40.110","TCP","60","443  >  63075 [ACK] Seq=78876 Ack=53694 Win=137728 Len=0"
"245","33.115883200","151.101.130.187","172.20.40.110","TLSv1.3","299","Application Data"
"246","33.115883200","151.101.130.187","172.20.40.110","TLSv1.3","367","Application Data"
"247","33.116159700","172.20.40.110","151.101.130.187","TCP","54","63075  >  443 [ACK] Seq=53694 Ack=79434 Win=64768 Len=0"
"248","33.129205800","172.20.40.110","151.101.130.187","TLSv1.3","89","Application Data"
"249","33.173434400","151.101.130.187","172.20.40.110","TCP","60","443  >  63075 [ACK] Seq=79434 Ack=53729 Win=138752 Len=0"
"250","33.346300600","172.20.40.110","151.101.130.187","TLSv1.3","1176","Application Data"
"251","33.378867500","151.101.130.187","172.20.40.110","TCP","60","443  >  63075 [ACK] Seq=79434 Ack=54851 Win=137728 Len=0"
"252","33.381699000","151.101.130.187","172.20.40.110","TLSv1.3","131","Application Data"
"253","33.426436300","172.20.40.110","151.101.130.187","TCP","54","63075  >  443 [ACK] Seq=54851 Ack=79511 Win=66048 Len=0"
"254","33.456136200","172.20.40.110","151.101.130.187","TLSv1.3","1562","Application Data"
"255","33.460578100","172.20.40.110","151.101.130.187","TLSv1.3","1146","Application Data"
"256","33.491706800","151.101.130.187","172.20.40.110","TCP","60","443  >  63075 [ACK] Seq=79511 Ack=56359 Win=137728 Len=0"
"257","33.494468100","151.101.130.187","172.20.40.110","TLSv1.3","240","Application Data"
"258","33.494468100","151.101.130.187","172.20.40.110","TCP","60","443  >  63075 [ACK] Seq=79697 Ack=57451 Win=137728 Len=0"
"259","33.494468100","151.101.130.187","172.20.40.110","TLSv1.3","131","Application Data"
"260","33.494618000","172.20.40.110","151.101.130.187","TCP","54","63075  >  443 [ACK] Seq=57451 Ack=79774 Win=65792 Len=0"
"261","33.696962100","172.20.40.110","151.101.130.187","TLSv1.3","1553","Application Data"
"262","33.759569800","151.101.130.187","172.20.40.110","TCP","60","443  >  63075 [ACK] Seq=79774 Ack=58950 Win=137728 Len=0"
"263","33.759569800","151.101.130.187","172.20.40.110","TLSv1.3","169","Application Data"
"264","33.814185600","172.20.40.110","151.101.130.187","TCP","54","63075  >  443 [ACK] Seq=58950 Ack=79889 Win=65792 Len=0"
"265","33.849429200","151.101.130.187","172.20.40.110","TCP","169","[TCP Spurious Retransmission] 443  >  63075 [PSH, ACK] Seq=79774 Ack=58950 Win=138752 Len=115"
"266","33.849533900","172.20.40.110","151.101.130.187","TCP","66","[TCP Dup ACK 264#1] 63075  >  443 [ACK] Seq=58950 Ack=79889 Win=65792 Len=0 SLE=79774 SRE=79889"
"267","33.860399900","172.20.40.110","151.101.130.187","TLSv1.3","1183","Application Data"
"268","33.885926000","172.20.40.110","151.101.130.187","TLSv1.3","1548","Application Data"
"269","33.930813900","151.101.130.187","172.20.40.110","TCP","60","443  >  63075 [ACK] Seq=79889 Ack=60079 Win=137728 Len=0"
"270","33.930813900","151.101.130.187","172.20.40.110","TLSv1.3","131","Application Data"
"271","33.953911900","151.101.130.187","172.20.40.110","TCP","60","443  >  63075 [ACK] Seq=79966 Ack=61573 Win=137728 Len=0"
"272","33.955869900","151.101.130.187","172.20.40.110","TLSv1.3","98","Application Data"
"273","33.955990700","172.20.40.110","151.101.130.187","TCP","54","63075  >  443 [ACK] Seq=61573 Ack=80010 Win=65536 Len=0"
"274","34.275566600","172.20.40.110","151.101.130.187","TLSv1.3","1157","Application Data"
"275","34.299083800","151.101.130.187","172.20.40.110","TCP","60","443  >  63075 [ACK] Seq=80010 Ack=62676 Win=137728 Len=0"
"276","34.304121600","151.101.130.187","172.20.40.110","TLSv1.3","104","Application Data"
"277","34.346186700","172.20.40.110","151.101.130.187","TCP","54","63075  >  443 [ACK] Seq=62676 Ack=80060 Win=65536 Len=0"
"278","34.391118800","172.20.40.110","151.101.130.187","TLSv1.3","1547","Application Data"
"279","34.411446500","151.101.130.187","172.20.40.110","TCP","60","443  >  63075 [ACK] Seq=80060 Ack=64169 Win=137728 Len=0"
"280","34.417061700","151.101.130.187","172.20.40.110","TLSv1.3","130","Application Data"
"281","34.459173800","172.20.40.110","151.101.130.187","TCP","54","63075  >  443 [ACK] Seq=64169 Ack=80136 Win=65536 Len=0"
"282","34.629604800","172.20.40.110","151.101.130.187","TLSv1.3","1157","Application Data"
"283","34.656926400","151.101.130.187","172.20.40.110","TCP","60","443  >  63075 [ACK] Seq=80136 Ack=65272 Win=137728 Len=0"
"284","34.659012600","151.101.130.187","172.20.40.110","TLSv1.3","208","Application Data"
"285","34.693925500","172.20.40.110","151.101.130.187","TLSv1.3","1554","Application Data"
"286","34.732182700","151.101.130.187","172.20.40.110","TCP","60","443  >  63075 [ACK] Seq=80290 Ack=66772 Win=137728 Len=0"
"287","34.734539800","151.101.130.187","172.20.40.110","TLSv1.3","98","Application Data"
"288","34.774704400","172.20.40.110","151.101.130.187","TCP","54","63075  >  443 [ACK] Seq=66772 Ack=80334 Win=65280 Len=0"
"289","35.130878300","172.20.40.110","151.101.130.187","TLSv1.3","1173","Application Data"
"290","35.159533600","151.101.130.187","172.20.40.110","TCP","60","443  >  63075 [ACK] Seq=80334 Ack=67891 Win=137728 Len=0"
"291","35.161510300","151.101.130.187","172.20.40.110","TLSv1.3","130","Application Data"
"292","35.217009400","172.20.40.110","151.101.130.187","TCP","54","63075  >  443 [ACK] Seq=67891 Ack=80410 Win=65280 Len=0"
"293","35.594153500","172.20.40.110","151.101.130.187","TLSv1.3","1550","Application Data"
"294","35.639096800","151.101.130.187","172.20.40.110","TCP","60","443  >  63075 [ACK] Seq=80410 Ack=69387 Win=137728 Len=0"
"295","35.644043300","151.101.130.187","172.20.40.110","TLSv1.3","214","Application Data"
"296","35.699098900","172.20.40.110","151.101.130.187","TCP","54","63075  >  443 [ACK] Seq=69387 Ack=80570 Win=65024 Len=0"
"297","36.396429400","172.20.40.110","151.101.130.187","TLSv1.3","1184","Application Data"
"298","36.436851800","151.101.130.187","172.20.40.110","TCP","60","443  >  63075 [ACK] Seq=80570 Ack=70517 Win=137728 Len=0"
"299","36.445288200","151.101.130.187","172.20.40.110","TLSv1.3","152","Application Data"
"300","36.498162400","172.20.40.110","151.101.130.187","TCP","54","63075  >  443 [ACK] Seq=70517 Ack=80668 Win=65024 Len=0"
"301","37.998478300","172.20.40.110","151.101.130.187","TLSv1.3","1560","Application Data"
"302","37.998698800","172.20.40.110","151.101.130.187","TLSv1.3","1161","Application Data"
"303","38.036612800","151.101.130.187","172.20.40.110","TCP","60","443  >  63075 [ACK] Seq=80668 Ack=72023 Win=137728 Len=0"
"304","38.036612800","151.101.130.187","172.20.40.110","TCP","60","443  >  63075 [ACK] Seq=80668 Ack=73130 Win=136704 Len=0"
"305","38.039037300","151.101.130.187","172.20.40.110","TLSv1.3","379","Application Data"
"306","38.040986100","151.101.130.187","172.20.40.110","TLSv1.3","98","Application Data"
"307","38.041120500","172.20.40.110","151.101.130.187","TCP","54","63075  >  443 [ACK] Seq=73130 Ack=81037 Win=66048 Len=0"
"308","38.141925400","172.20.40.110","151.101.130.187","TLSv1.3","1570","Application Data"
"309","38.146992500","172.20.40.110","151.101.130.187","TLSv1.3","1161","Application Data"
"310","38.197105500","151.101.130.187","172.20.40.110","TCP","60","443  >  63075 [ACK] Seq=81037 Ack=74646 Win=137728 Len=0"
"311","38.197105500","151.101.130.187","172.20.40.110","TCP","60","443  >  63075 [ACK] Seq=81037 Ack=75753 Win=136704 Len=0"
"312","38.199500000","151.101.130.187","172.20.40.110","TLSv1.3","104","Application Data"
"313","38.199500000","151.101.130.187","172.20.40.110","TLSv1.3","98","Application Data"
"314","38.199645400","172.20.40.110","151.101.130.187","TCP","54","63075  >  443 [ACK] Seq=75753 Ack=81131 Win=66048 Len=0"
"315","38.285383800","172.20.40.110","151.101.130.187","TLSv1.3","1570","Application Data"
"316","38.331748300","151.101.130.187","172.20.40.110","TCP","60","443  >  63075 [ACK] Seq=81131 Ack=77269 Win=137728 Len=0"
"317","38.331748300","151.101.130.187","172.20.40.110","TLSv1.3","98","Application Data"
"318","38.396319400","172.20.40.110","151.101.130.187","TLSv1.3","1161","Application Data"
"319","38.430555400","151.101.130.187","172.20.40.110","TCP","60","443  >  63075 [ACK] Seq=81175 Ack=78376 Win=137728 Len=0"
"320","38.432856800","151.101.130.187","172.20.40.110","TLSv1.3","98","Application Data"
"321","38.546235100","151.101.130.187","172.20.40.110","TCP","98","[TCP Retransmission] 443  >  63075 [PSH, ACK] Seq=81175 Ack=78376 Win=138752 Len=44"
"322","38.546305900","172.20.40.110","151.101.130.187","TCP","66","63075  >  443 [ACK] Seq=78376 Ack=81219 Win=66048 Len=0 SLE=81175 SRE=81219"
"323","38.810499100","172.20.40.110","151.101.130.187","TLSv1.3","1570","Application Data"
"324","38.844127100","151.101.130.187","172.20.40.110","TCP","60","443  >  63075 [ACK] Seq=81219 Ack=79892 Win=137728 Len=0"
"325","38.846197000","151.101.130.187","172.20.40.110","TLSv1.3","208","Application Data"
"326","38.863786400","172.20.40.110","151.101.130.187","TLSv1.3","1181","Application Data"
"327","38.920766000","151.101.130.187","172.20.40.110","TCP","60","443  >  63075 [ACK] Seq=81373 Ack=81019 Win=137728 Len=0"
"328","38.922958200","151.101.130.187","172.20.40.110","TLSv1.3","131","Application Data"
"329","38.935323300","172.20.40.110","151.101.130.187","TLSv1.3","1571","Application Data"
"330","38.984812600","151.101.130.187","172.20.40.110","TCP","60","443  >  63075 [ACK] Seq=81450 Ack=82536 Win=137728 Len=0"
"331","38.991990700","151.101.130.187","172.20.40.110","TLSv1.3","98","Application Data"
"332","39.087311000","172.20.40.110","151.101.130.187","TCP","54","63075  >  443 [ACK] Seq=82536 Ack=81494 Win=65536 Len=0"
"333","39.136625900","151.101.130.187","172.20.40.110","TCP","98","[TCP Spurious Retransmission] 443  >  63075 [PSH, ACK] Seq=81450 Ack=82536 Win=138752 Len=44"
"334","39.136724000","172.20.40.110","151.101.130.187","TCP","66","[TCP Dup ACK 332#1] 63075  >  443 [ACK] Seq=82536 Ack=81494 Win=65536 Len=0 SLE=81450 SRE=81494"
"335","39.598682000","172.20.40.110","151.101.130.187","TLSv1.3","1160","Application Data"
"336","39.609682500","151.101.130.187","172.20.40.110","TCP","60","443  >  63075 [ACK] Seq=81494 Ack=83642 Win=137728 Len=0"
"337","39.613576100","151.101.130.187","172.20.40.110","TLSv1.3","208","Application Data"
"338","39.651119900","172.20.40.110","151.101.130.187","TLSv1.3","1571","Application Data"
"339","39.685829400","151.101.130.187","172.20.40.110","TCP","60","443  >  63075 [ACK] Seq=81648 Ack=85159 Win=137728 Len=0"
"340","39.685829400","151.101.130.187","172.20.40.110","TLSv1.3","142","Application Data"
"341","39.837549000","151.101.130.187","172.20.40.110","TCP","142","[TCP Retransmission] 443  >  63075 [PSH, ACK] Seq=81648 Ack=85159 Win=138752 Len=88"
"342","39.837605700","172.20.40.110","151.101.130.187","TCP","66","63075  >  443 [ACK] Seq=85159 Ack=81736 Win=65536 Len=0 SLE=81648 SRE=81736"
"343","43.579756800","172.20.40.110","151.101.130.187","TLSv1.3","1130","Application Data"
"344","43.590187200","151.101.130.187","172.20.40.110","TCP","60","443  >  63075 [ACK] Seq=81736 Ack=86235 Win=137728 Len=0"
"345","43.601063500","172.20.40.110","151.101.130.187","TLSv1.3","1571","Application Data"
"346","43.607542100","151.101.130.187","172.20.40.110","TLSv1.3","246","Application Data"
"347","43.618660100","151.101.130.187","172.20.40.110","TLSv1.3","131","Application Data"
"348","43.618747800","172.20.40.110","151.101.130.187","TCP","54","63075  >  443 [ACK] Seq=87752 Ack=82005 Win=65024 Len=0"
"349","43.645248100","172.20.40.110","151.101.130.187","TLSv1.3","1141","Application Data"
"350","43.654552700","151.101.130.187","172.20.40.110","TCP","60","443  >  63075 [ACK] Seq=82005 Ack=88839 Win=137728 Len=0"
"351","43.656621800","151.101.130.187","172.20.40.110","TLSv1.3","98","Application Data"
"352","43.705884500","172.20.40.110","151.101.130.187","TCP","54","63075  >  443 [ACK] Seq=88839 Ack=82049 Win=65024 Len=0"
"353","44.107239700","172.20.40.110","151.101.130.187","TLSv1.3","1572","Application Data"
"354","44.116724400","151.101.130.187","172.20.40.110","TCP","60","443  >  63075 [ACK] Seq=82049 Ack=90357 Win=137728 Len=0"
"355","44.118853400","151.101.130.187","172.20.40.110","TLSv1.3","104","Application Data"
"356","44.160332700","172.20.40.110","151.101.130.187","TCP","54","63075  >  443 [ACK] Seq=90357 Ack=82099 Win=65024 Len=0"
"357","44.417526000","172.20.40.110","151.101.130.187","TLSv1.3","1152","Application Data"
"358","44.419016600","172.20.40.110","151.101.130.187","TLSv1.3","1531","Application Data"
"359","44.425633000","151.101.130.187","172.20.40.110","TCP","60","443  >  63075 [ACK] Seq=82099 Ack=91455 Win=137728 Len=0"
"360","44.428026000","151.101.130.187","172.20.40.110","TCP","60","443  >  63075 [ACK] Seq=82099 Ack=92932 Win=136704 Len=0"
"361","44.430285800","151.101.130.187","172.20.40.110","TLSv1.3","234","Application Data"
"362","44.430285800","151.101.130.187","172.20.40.110","TLSv1.3","130","Application Data"
"363","44.430383600","172.20.40.110","151.101.130.187","TCP","54","63075  >  443 [ACK] Seq=92932 Ack=82355 Win=64768 Len=0"
"364","48.155211200","172.20.40.110","151.101.130.187","TLSv1.3","1152","Application Data"
"365","48.167233600","151.101.130.187","172.20.40.110","TCP","60","443  >  63075 [ACK] Seq=82355 Ack=94030 Win=137728 Len=0"
"366","48.170493500","151.101.130.187","172.20.40.110","TLSv1.3","236","Application Data"
"367","48.187348000","172.20.40.110","151.101.130.187","TLSv1.3","1543","Application Data"
"368","48.197618600","151.101.130.187","172.20.40.110","TCP","60","443  >  63075 [ACK] Seq=82537 Ack=95519 Win=137728 Len=0"
"369","48.198477800","172.20.40.110","151.101.130.187","TLSv1.3","1114","Application Data"
"370","48.204572600","151.101.130.187","172.20.40.110","TLSv1.3","129","Application Data"
"371","48.205945900","151.101.130.187","172.20.40.110","TCP","60","443  >  63075 [ACK] Seq=82612 Ack=96579 Win=137728 Len=0"
"372","48.209753800","151.101.130.187","172.20.40.110","TLSv1.3","264","Application Data"
"373","48.209820300","172.20.40.110","151.101.130.187","TCP","54","63075  >  443 [ACK] Seq=96579 Ack=82822 Win=65792 Len=0"
"374","48.233813400","172.20.40.110","151.101.130.187","TLSv1.3","1537","Application Data"
"375","48.242372300","151.101.130.187","172.20.40.110","TCP","60","443  >  63075 [ACK] Seq=82822 Ack=98062 Win=137728 Len=0"
"376","48.245832000","151.101.130.187","172.20.40.110","TLSv1.3","130","Application Data"
"377","48.298151300","172.20.40.110","151.101.130.187","TCP","54","63075  >  443 [ACK] Seq=98062 Ack=82898 Win=65792 Len=0"
"378","48.468197900","172.20.40.110","151.101.130.187","TLSv1.3","1151","Application Data"
"379","48.478436700","172.20.40.110","151.101.130.187","TLSv1.3","1534","Application Data"
"380","48.478787500","151.101.130.187","172.20.40.110","TCP","60","443  >  63075 [ACK] Seq=82898 Ack=99159 Win=137728 Len=0"
"381","48.481299300","151.101.130.187","172.20.40.110","TLSv1.3","240","Application Data"
"382","48.486494600","151.101.130.187","172.20.40.110","TCP","60","443  >  63075 [ACK] Seq=83084 Ack=100639 Win=137728 Len=0"
"383","48.488598600","151.101.130.187","172.20.40.110","TLSv1.3","131","Application Data"
"384","48.488674600","172.20.40.110","151.101.130.187","TCP","54","63075  >  443 [ACK] Seq=100639 Ack=83161 Win=65536 Len=0"
"385","48.589990600","172.20.40.110","151.101.130.187","TLSv1.3","1151","Application Data"
"386","48.598020000","151.101.130.187","172.20.40.110","TCP","60","443  >  63075 [ACK] Seq=83161 Ack=101736 Win=137728 Len=0"
"387","48.604892400","151.101.130.187","172.20.40.110","TLSv1.3","142","Application Data"
"388","48.653176900","172.20.40.110","151.101.130.187","TCP","54","63075  >  443 [ACK] Seq=101736 Ack=83249 Win=65280 Len=0"
"389","48.878067400","172.20.40.110","151.101.130.187","TLSv1.3","1501","Application Data"
"390","48.888007300","151.101.130.187","172.20.40.110","TCP","60","443  >  63075 [ACK] Seq=83249 Ack=103183 Win=137728 Len=0"
"391","48.891704900","151.101.130.187","172.20.40.110","TLSv1.3","796","Application Data"
"392","48.899985200","172.20.40.110","151.101.130.187","TLSv1.3","89","Application Data"
"393","48.900150500","172.20.40.110","151.101.130.187","TLSv1.3","1123","Application Data"
"394","48.900626400","172.20.40.110","151.101.130.187","TLSv1.3","1536","Application Data"
"395","48.908270900","151.101.130.187","172.20.40.110","TCP","60","443  >  63075 [ACK] Seq=83991 Ack=103218 Win=138752 Len=0"
"396","48.912838800","151.101.130.187","172.20.40.110","TCP","60","443  >  63075 [ACK] Seq=83991 Ack=104287 Win=137728 Len=0"
"397","48.912838800","151.101.130.187","172.20.40.110","TCP","60","443  >  63075 [ACK] Seq=83991 Ack=105769 Win=137216 Len=0"
"398","48.913949000","151.101.130.187","172.20.40.110","TLSv1.3","124","Application Data"
"399","48.913949000","151.101.130.187","172.20.40.110","TLSv1.3","131","Application Data"
"400","48.914011500","172.20.40.110","151.101.130.187","TCP","54","63075  >  443 [ACK] Seq=105769 Ack=84138 Win=66048 Len=0"
"401","49.038166300","172.20.40.110","151.101.130.187","TLSv1.3","1119","Application Data"
"402","49.046332100","151.101.130.187","172.20.40.110","TCP","60","443  >  63075 [ACK] Seq=84138 Ack=106834 Win=137728 Len=0"
"403","49.048427000","151.101.130.187","172.20.40.110","TLSv1.3","124","Application Data"
"404","49.095077800","172.20.40.110","151.101.130.187","TCP","54","63075  >  443 [ACK] Seq=106834 Ack=84208 Win=65792 Len=0"
"405","49.224497600","172.20.40.110","151.101.130.187","TLSv1.3","1595","Application Data"
"406","49.235781500","151.101.130.187","172.20.40.110","TCP","60","443  >  63075 [ACK] Seq=84208 Ack=108375 Win=137216 Len=0"
"407","49.240427400","151.101.130.187","172.20.40.110","TLSv1.3","130","Application Data"
"408","49.281580500","172.20.40.110","151.101.130.187","TLSv1.3","1093","Application Data"
"409","49.282501600","172.20.40.110","151.101.130.187","TLSv1.3","1567","Application Data"
"410","49.285579700","172.20.40.110","151.101.130.187","TLSv1.3","1118","Application Data"
"411","49.285962300","172.20.40.110","151.101.130.187","TLSv1.3","1571","Application Data"
"412","49.289019600","151.101.130.187","172.20.40.110","TCP","60","443  >  63075 [ACK] Seq=84284 Ack=109414 Win=137728 Len=0"
"413","49.291100600","151.101.130.187","172.20.40.110","TCP","60","443  >  63075 [ACK] Seq=84284 Ack=110927 Win=136704 Len=0"
"414","49.291100600","151.101.130.187","172.20.40.110","TLSv1.3","130","Application Data"
"415","49.293250100","151.101.130.187","172.20.40.110","TLSv1.3","152","Application Data"
"416","49.293317000","172.20.40.110","151.101.130.187","TCP","54","63075  >  443 [ACK] Seq=113508 Ack=84458 Win=65536 Len=0"
"417","49.294303000","151.101.130.187","172.20.40.110","TCP","60","443  >  63075 [ACK] Seq=84458 Ack=111991 Win=137728 Len=0"
"418","49.297571700","151.101.130.187","172.20.40.110","TLSv1.3","135","Application Data"
"419","49.297571700","151.101.130.187","172.20.40.110","TCP","60","443  >  63075 [ACK] Seq=84539 Ack=113508 Win=137728 Len=0"
"420","49.299979300","151.101.130.187","172.20.40.110","TLSv1.3","257","Application Data"
"421","49.300039600","172.20.40.110","151.101.130.187","TCP","54","63075  >  443 [ACK] Seq=113508 Ack=84742 Win=65280 Len=0"
"422","51.274062100","172.20.40.110","151.101.130.187","TLSv1.3","1068","Application Data"
"423","51.277210300","172.20.40.110","151.101.130.187","TLSv1.3","1483","Application Data"
"424","51.280831800","172.20.40.110","151.101.130.187","TLSv1.3","1087","Application Data"
"425","51.283687900","151.101.130.187","172.20.40.110","TCP","60","443  >  63075 [ACK] Seq=84742 Ack=114522 Win=138240 Len=0"
"426","51.285785300","151.101.130.187","172.20.40.110","TCP","60","443  >  63075 [ACK] Seq=84742 Ack=115951 Win=137216 Len=0"
"427","51.287495800","151.101.130.187","172.20.40.110","TLSv1.3","272","Application Data"
"428","51.287495800","151.101.130.187","172.20.40.110","TLSv1.3","1046","Application Data"
"429","51.287594200","172.20.40.110","151.101.130.187","TCP","54","63075  >  443 [ACK] Seq=116984 Ack=85952 Win=66048 Len=0"
"430","51.289180400","151.101.130.187","172.20.40.110","TLSv1.3","155","Application Data"
"431","51.289180400","151.101.130.187","172.20.40.110","TLSv1.3","820","Application Data"
"432","51.289180400","151.101.130.187","172.20.40.110","TCP","60","443  >  63075 [ACK] Seq=86819 Ack=116984 Win=137728 Len=0"
"433","51.289623700","172.20.40.110","151.101.130.187","TCP","54","63075  >  443 [ACK] Seq=116984 Ack=86819 Win=65280 Len=0"
"434","51.291235600","151.101.130.187","172.20.40.110","TLSv1.3","183","Application Data"
"435","51.291235600","151.101.130.187","172.20.40.110","TLSv1.3","479","Application Data"
"436","51.291348900","172.20.40.110","151.101.130.187","TCP","54","63075  >  443 [ACK] Seq=116984 Ack=87373 Win=66048 Len=0"
"437","53.662349400","172.20.40.110","151.101.130.187","TLSv1.3","1546","Application Data"
"438","53.670763600","151.101.130.187","172.20.40.110","TCP","60","443  >  63075 [ACK] Seq=87373 Ack=118476 Win=137728 Len=0"
"439","53.673958200","151.101.130.187","172.20.40.110","TLSv1.3","247","Application Data"
"440","53.718539600","172.20.40.110","151.101.130.187","TCP","54","63075  >  443 [ACK] Seq=118476 Ack=87566 Win=65792 Len=0"
"441","56.857152700","172.20.40.110","151.101.130.187","TLSv1.3","1096","Application Data"
"442","56.879457700","151.101.130.187","172.20.40.110","TCP","60","443  >  63075 [ACK] Seq=87566 Ack=119518 Win=137728 Len=0"
"443","56.879457700","151.101.130.187","172.20.40.110","TLSv1.3","214","Application Data"
"444","56.925091600","172.20.40.110","151.101.130.187","TCP","54","63075  >  443 [ACK] Seq=119518 Ack=87726 Win=65792 Len=0"
"445","59.924271100","172.20.40.110","151.101.130.187","TLSv1.3","1487","Application Data"
"446","59.925011500","172.20.40.110","151.101.130.187","TLSv1.3","1143","Application Data"
"447","59.952337400","172.20.40.110","151.101.130.187","TCP","1434","[TCP Retransmission] 63075  >  443 [PSH, ACK] Seq=120660 Ack=87726 Win=65792 Len=1380"
"448","59.965970100","151.101.130.187","172.20.40.110","TCP","60","443  >  63075 [ACK] Seq=87726 Ack=120951 Win=137728 Len=0"
"449","59.965970100","151.101.130.187","172.20.40.110","TCP","60","443  >  63075 [ACK] Seq=87726 Ack=122040 Win=136704 Len=0"
"450","59.965970100","151.101.130.187","172.20.40.110","TLSv1.3","260","Application Data"
"451","59.965970100","151.101.130.187","172.20.40.110","TLSv1.3","471","Application Data"
"452","59.965970100","151.101.130.187","172.20.40.110","TLSv1.3","152","Application Data"
"453","59.965970100","151.101.130.187","172.20.40.110","TCP","66","[TCP Dup ACK 449#1] 443  >  63075 [ACK] Seq=88447 Ack=122040 Win=138752 Len=0 SLE=120660 SRE=122040"
"454","59.966239700","172.20.40.110","151.101.130.187","TCP","54","63075  >  443 [ACK] Seq=122040 Ack=88447 Win=65024 Len=0"
"455","59.971412100","172.20.40.110","151.101.130.187","TLSv1.3","89","Application Data"
"456","59.979321600","151.101.130.187","172.20.40.110","TCP","60","443  >  63075 [ACK] Seq=88447 Ack=122075 Win=138752 Len=0"
"457","63.096842100","172.20.40.110","151.101.130.187","TLSv1.3","1583","Application Data"
"458","63.104949400","172.20.40.110","151.101.130.187","TLSv1.3","1129","Application Data"
"459","63.109501100","151.101.130.187","172.20.40.110","TCP","60","443  >  63075 [ACK] Seq=88447 Ack=123604 Win=137728 Len=0"
"460","63.109501100","151.101.130.187","172.20.40.110","TLSv1.3","352","Application Data"
"461","63.115849200","172.20.40.110","151.101.130.187","TLSv1.3","1589","Application Data"
"462","63.116235300","151.101.130.187","172.20.40.110","TCP","60","443  >  63075 [ACK] Seq=88745 Ack=124679 Win=137728 Len=0"
"463","63.122199500","151.101.130.187","172.20.40.110","TLSv1.3","125","Application Data"
"464","63.122420600","172.20.40.110","151.101.130.187","TCP","54","63075  >  443 [ACK] Seq=126214 Ack=88816 Win=66048 Len=0"
"465","63.126216800","151.101.130.187","172.20.40.110","TCP","60","443  >  63075 [ACK] Seq=88816 Ack=126214 Win=137728 Len=0"
"466","63.134697200","151.101.130.187","172.20.40.110","TLSv1.3","131","Application Data"
"467","63.134764600","172.20.40.110","151.101.130.187","TCP","54","63075  >  443 [ACK] Seq=126214 Ack=88893 Win=66048 Len=0"
