No.,Time,Source,Destination,Protocol,Length,Info
1,0.0,172.20.40.110,151.101.194.187,TLSv1.2,2629,Application Data
2,0.0002529,172.20.40.110,151.101.194.187,TLSv1.2,93,Application Data
3,0.02079,151.101.194.187,172.20.40.110,TCP,60,443  >  50060 [ACK] Seq=1 Ack=2576 Win=3924 Len=0
4,0.02079,151.101.194.187,172.20.40.110,TCP,60,443  >  50060 [ACK] Seq=1 Ack=2615 Win=3924 Len=0
5,0.02079,151.101.194.187,172.20.40.110,TLSv1.2,93,Application Data
6,0.0559754,151.101.194.187,172.20.40.110,TCP,93,"[TCP Retransmission] 443  >  50060 [PSH, ACK] Seq=1 Ack=2615 Win=3924 Len=39"
7,0.0560697,172.20.40.110,151.101.194.187,TCP,66,50060  >  443 [ACK] Seq=2615 Ack=40 Win=256 Len=0 SLE=1 SRE=40
8,0.0808643,151.101.194.187,172.20.40.110,TLSv1.2,512,Application Data
9,0.0808643,151.101.194.187,172.20.40.110,TLSv1.2,94,Application Data
10,0.0809947,172.20.40.110,151.101.194.187,TCP,54,50060  >  443 [ACK] Seq=2615 Ack=538 Win=254 Len=0
11,0.0827794,172.20.40.110,151.101.194.187,TLSv1.2,89,Application Data
12,0.0838257,151.101.194.187,172.20.40.110,TLSv1.2,86,Application Data
13,0.0838257,151.101.194.187,172.20.40.110,TLSv1.2,87,Application Data
14,0.0838257,151.101.194.187,172.20.40.110,TLSv1.2,118,"Application Data, Application Data"
15,0.0838257,151.101.194.187,172.20.40.110,TLSv1.2,120,"Application Data, Application Data"
16,0.0838257,151.101.194.187,172.20.40.110,TLSv1.2,86,Application Data
17,0.0838257,151.101.194.187,172.20.40.110,TLSv1.2,87,Application Data
18,0.0838257,151.101.194.187,172.20.40.110,TLSv1.2,648,Application Data
19,0.0838257,151.101.194.187,172.20.40.110,TCP,1434,443  >  50060 [ACK] Seq=1392 Ack=2615 Win=3924 Len=1380 [TCP PDU reassembled in 20]
20,0.0838257,151.101.194.187,172.20.40.110,TLSv1.2,76,Application Data
21,0.0838257,151.101.194.187,172.20.40.110,TLSv1.2,604,"Application Data, Application Data"
22,0.0838257,151.101.194.187,172.20.40.110,TLSv1.2,85,Application Data
23,0.0841341,172.20.40.110,151.101.194.187,TCP,54,50060  >  443 [ACK] Seq=2650 Ack=3375 Win=258 Len=0
24,0.0924882,151.101.194.187,172.20.40.110,TCP,60,443  >  50060 [ACK] Seq=3375 Ack=2650 Win=3924 Len=0
25,0.8106885,172.20.40.110,151.101.194.187,TLSv1.2,2941,Application Data
26,0.8256616,151.101.194.187,172.20.40.110,TCP,60,443  >  50060 [ACK] Seq=3375 Ack=5537 Win=3924 Len=0
27,0.828981,151.101.194.187,172.20.40.110,TLSv1.2,439,Application Data
28,0.8595836,151.101.194.187,172.20.40.110,TCP,439,"[TCP Retransmission] 443  >  50060 [PSH, ACK] Seq=3375 Ack=5537 Win=3924 Len=385"
29,0.8596717,172.20.40.110,151.101.194.187,TCP,66,50060  >  443 [ACK] Seq=5537 Ack=3760 Win=257 Len=0 SLE=3375 SRE=3760
30,1.0145642,172.20.40.110,151.101.194.187,TLSv1.2,2942,Application Data
31,1.0157065,172.20.40.110,151.101.194.187,TLSv1.2,2941,Application Data
32,1.0254351,151.101.194.187,172.20.40.110,TCP,60,443  >  50060 [ACK] Seq=3760 Ack=8425 Win=3924 Len=0
33,1.0254351,151.101.194.187,172.20.40.110,TCP,60,443  >  50060 [ACK] Seq=3760 Ack=11312 Win=3924 Len=0
34,1.0266602,151.101.194.187,172.20.40.110,TLSv1.2,131,Application Data
35,1.0288391,151.101.194.187,172.20.40.110,TLSv1.2,125,Application Data
36,1.0289473,172.20.40.110,151.101.194.187,TCP,54,50060  >  443 [ACK] Seq=11312 Ack=3908 Win=256 Len=0
37,1.1694607,172.20.40.110,151.101.194.187,TLSv1.2,2941,Application Data
38,1.1797597,151.101.194.187,172.20.40.110,TCP,60,443  >  50060 [ACK] Seq=3908 Ack=14199 Win=3924 Len=0
39,1.1829426,151.101.194.187,172.20.40.110,TLSv1.2,98,Application Data
40,1.201791,172.20.40.110,151.101.194.187,TLSv1.2,2939,Application Data
41,1.2133238,151.101.194.187,172.20.40.110,TCP,60,443  >  50060 [ACK] Seq=3952 Ack=17084 Win=3924 Len=0
42,1.2133238,151.101.194.187,172.20.40.110,TLSv1.2,131,Application Data
43,1.2476722,151.101.194.187,172.20.40.110,TCP,131,"[TCP Retransmission] 443  >  50060 [PSH, ACK] Seq=3952 Ack=17084 Win=3924 Len=77"
44,1.2477558,172.20.40.110,151.101.194.187,TCP,66,50060  >  443 [ACK] Seq=17084 Ack=4029 Win=256 Len=0 SLE=3952 SRE=4029
45,1.3533136,172.20.40.110,151.101.194.187,TLSv1.2,2942,Application Data
46,1.3664236,151.101.194.187,172.20.40.110,TCP,60,443  >  50060 [ACK] Seq=4029 Ack=19972 Win=3929 Len=0
47,1.3771897,151.101.194.187,172.20.40.110,TLSv1.2,98,Application Data
48,1.4157073,151.101.194.187,172.20.40.110,TCP,98,"[TCP Retransmission] 443  >  50060 [PSH, ACK] Seq=4029 Ack=19972 Win=3929 Len=44"
49,1.4157755,172.20.40.110,151.101.194.187,TCP,66,50060  >  443 [ACK] Seq=19972 Ack=4073 Win=256 Len=0 SLE=4029 SRE=4073
50,2.1776962,172.20.40.110,151.101.194.187,TLSv1.2,2926,Application Data
51,2.1782323,172.20.40.110,151.101.194.187,TLSv1.2,2941,Application Data
52,2.1816294,172.20.40.110,151.101.194.187,TLSv1.2,2929,Application Data
53,2.182067,172.20.40.110,151.101.194.187,TLSv1.2,2925,Application Data
54,2.1938145,151.101.194.187,172.20.40.110,TCP,60,443  >  50060 [ACK] Seq=4073 Ack=22844 Win=3929 Len=0
55,2.1938145,151.101.194.187,172.20.40.110,TLSv1.2,241,Application Data
56,2.1997645,151.101.194.187,172.20.40.110,TCP,60,443  >  50060 [ACK] Seq=4260 Ack=25731 Win=3929 Len=0
57,2.1997645,151.101.194.187,172.20.40.110,TCP,60,443  >  50060 [ACK] Seq=4260 Ack=28606 Win=3929 Len=0
58,2.1997645,151.101.194.187,172.20.40.110,TCP,60,443  >  50060 [ACK] Seq=4260 Ack=31477 Win=3929 Len=0
59,2.20623,151.101.194.187,172.20.40.110,TLSv1.2,129,Application Data
60,2.20623,151.101.194.187,172.20.40.110,TLSv1.2,135,Application Data
61,2.2063451,172.20.40.110,151.101.194.187,TCP,54,50060  >  443 [ACK] Seq=31477 Ack=4416 Win=254 Len=0
62,2.207207,151.101.194.187,172.20.40.110,TLSv1.2,130,Application Data
63,2.2073054,172.20.40.110,151.101.194.187,TCP,54,50060  >  443 [ACK] Seq=31477 Ack=4492 Win=254 Len=0
64,5.7321639,172.20.40.110,151.101.194.187,TLSv1.2,2941,Application Data
65,5.7326242,172.20.40.110,151.101.194.187,TLSv1.2,2942,Application Data
66,5.7410228,151.101.194.187,172.20.40.110,TCP,60,443  >  50060 [ACK] Seq=4492 Ack=34364 Win=3929 Len=0
67,5.7435197,151.101.194.187,172.20.40.110,TCP,60,443  >  50060 [ACK] Seq=4492 Ack=37252 Win=3929 Len=0
68,5.7495868,151.101.194.187,172.20.40.110,TLSv1.2,214,Application Data
69,5.7526438,151.101.194.187,172.20.40.110,TLSv1.2,98,Application Data
70,5.7527499,172.20.40.110,151.101.194.187,TCP,54,50060  >  443 [ACK] Seq=37252 Ack=4696 Win=253 Len=0
71,5.8567277,172.20.40.110,151.101.194.187,TLSv1.2,2941,Application Data
72,5.866889,172.20.40.110,151.101.194.187,TLSv1.2,2942,Application Data
73,5.8717285,151.101.194.187,172.20.40.110,TCP,60,443  >  50060 [ACK] Seq=4696 Ack=40139 Win=3929 Len=0
74,5.8724851,151.101.194.187,172.20.40.110,TLSv1.2,98,Application Data
75,5.876532,151.101.194.187,172.20.40.110,TCP,60,443  >  50060 [ACK] Seq=4740 Ack=42899 Win=3940 Len=0
76,5.8800485,151.101.194.187,172.20.40.110,TCP,60,443  >  50060 [ACK] Seq=4740 Ack=43027 Win=3940 Len=0
77,5.8856799,151.101.194.187,172.20.40.110,TLSv1.2,98,Application Data
78,5.8857662,172.20.40.110,151.101.194.187,TCP,54,50060  >  443 [ACK] Seq=43027 Ack=4784 Win=258 Len=0
79,6.2418459,172.20.40.110,151.101.194.187,TLSv1.2,2941,Application Data
80,6.2517109,151.101.194.187,172.20.40.110,TCP,60,443  >  50060 [ACK] Seq=4784 Ack=45914 Win=3940 Len=0
81,6.2551487,151.101.194.187,172.20.40.110,TLSv1.2,98,Application Data
82,6.2589436,172.20.40.110,151.101.194.187,TLSv1.2,2939,Application Data
83,6.2695167,151.101.194.187,172.20.40.110,TCP,60,443  >  50060 [ACK] Seq=4828 Ack=48799 Win=3940 Len=0
84,6.2739968,151.101.194.187,172.20.40.110,TLSv1.2,110,Application Data
85,6.3085143,151.101.194.187,172.20.40.110,TCP,110,"[TCP Retransmission] 443  >  50060 [PSH, ACK] Seq=4828 Ack=48799 Win=3940 Len=56"
86,6.3085752,172.20.40.110,151.101.194.187,TCP,66,50060  >  443 [ACK] Seq=48799 Ack=4884 Win=258 Len=0 SLE=4828 SRE=4884
87,6.31787,172.20.40.110,151.101.194.187,TLSv1.2,2942,Application Data
88,6.3311873,151.101.194.187,172.20.40.110,TCP,60,443  >  50060 [ACK] Seq=4884 Ack=51687 Win=3940 Len=0
89,6.3361761,151.101.194.187,172.20.40.110,TLSv1.2,98,Application Data
90,6.3685587,151.101.194.187,172.20.40.110,TCP,98,"[TCP Retransmission] 443  >  50060 [PSH, ACK] Seq=4884 Ack=51687 Win=3940 Len=44"
91,6.3686251,172.20.40.110,151.101.194.187,TCP,66,50060  >  443 [ACK] Seq=51687 Ack=4928 Win=258 Len=0 SLE=4884 SRE=4928
92,7.2132663,172.20.40.110,151.101.194.187,TLSv1.2,2941,Application Data
93,7.2258134,172.20.40.110,151.101.194.187,TLSv1.2,2939,Application Data
94,7.2278099,151.101.194.187,172.20.40.110,TCP,60,443  >  50060 [ACK] Seq=4928 Ack=54574 Win=3940 Len=0
95,7.2304199,151.101.194.187,172.20.40.110,TLSv1.2,208,Application Data
96,7.2362664,151.101.194.187,172.20.40.110,TCP,60,443  >  50060 [ACK] Seq=5082 Ack=57459 Win=3940 Len=0
97,7.240618,151.101.194.187,172.20.40.110,TLSv1.2,148,Application Data
98,7.2407014,172.20.40.110,151.101.194.187,TCP,54,50060  >  443 [ACK] Seq=57459 Ack=5176 Win=257 Len=0
99,7.2563879,172.20.40.110,151.101.194.187,TLSv1.2,2942,Application Data
100,7.2679211,151.101.194.187,172.20.40.110,TCP,60,443  >  50060 [ACK] Seq=5176 Ack=60347 Win=3940 Len=0
101,7.2701411,151.101.194.187,172.20.40.110,TLSv1.2,98,Application Data
102,7.307038,151.101.194.187,172.20.40.110,TCP,98,"[TCP Retransmission] 443  >  50060 [PSH, ACK] Seq=5176 Ack=60347 Win=3940 Len=44"
103,7.3071026,172.20.40.110,151.101.194.187,TCP,66,50060  >  443 [ACK] Seq=60347 Ack=5220 Win=257 Len=0 SLE=5176 SRE=5220
104,13.5790839,172.20.40.110,151.101.194.187,TLSv1.2,2895,Application Data
105,13.5924437,151.101.194.187,172.20.40.110,TCP,60,443  >  50060 [ACK] Seq=5220 Ack=63188 Win=3940 Len=0
106,13.594899,151.101.194.187,172.20.40.110,TLSv1.2,395,Application Data
107,13.6015073,172.20.40.110,151.101.194.187,TLSv1.2,2897,Application Data
108,13.6127249,151.101.194.187,172.20.40.110,TCP,60,443  >  50060 [ACK] Seq=5561 Ack=66031 Win=3940 Len=0
109,13.6162021,151.101.194.187,172.20.40.110,TLSv1.2,241,Application Data
110,13.6339058,172.20.40.110,151.101.194.187,TLSv1.2,2891,Application Data
111,13.6408088,172.20.40.110,151.101.194.187,TLSv1.2,2893,Application Data
112,13.644171,151.101.194.187,172.20.40.110,TCP,60,443  >  50060 [ACK] Seq=5748 Ack=68868 Win=3940 Len=0
113,13.6485903,151.101.194.187,172.20.40.110,TLSv1.2,126,Application Data
114,13.6493894,172.20.40.110,151.101.194.187,TLSv1.2,2891,Application Data
115,13.6496153,151.101.194.187,172.20.40.110,TCP,60,443  >  50060 [ACK] Seq=5820 Ack=71707 Win=3940 Len=0
116,13.6557919,151.101.194.187,172.20.40.110,TLSv1.2,130,Application Data
117,13.6586078,151.101.194.187,172.20.40.110,TCP,60,443  >  50060 [ACK] Seq=5896 Ack=74467 Win=3952 Len=0
118,13.662842,151.101.194.187,172.20.40.110,TCP,60,443  >  50060 [ACK] Seq=5896 Ack=74544 Win=3952 Len=0
119,13.6664947,172.20.40.110,151.101.194.187,TLSv1.2,2889,Application Data
120,13.6691294,151.101.194.187,172.20.40.110,TLSv1.2,130,Application Data
121,13.6750564,151.101.194.187,172.20.40.110,TCP,60,443  >  50060 [ACK] Seq=5972 Ack=77379 Win=3952 Len=0
122,13.6782836,151.101.194.187,172.20.40.110,TLSv1.2,130,Application Data
123,13.6783666,172.20.40.110,151.101.194.187,TCP,54,50060  >  443 [ACK] Seq=77379 Ack=6048 Win=253 Len=0
124,13.7411652,172.20.40.110,151.101.194.187,TLSv1.2,2891,Application Data
125,13.7500263,151.101.194.187,172.20.40.110,TCP,60,443  >  50060 [ACK] Seq=6048 Ack=80216 Win=3952 Len=0
126,13.7579338,151.101.194.187,172.20.40.110,TLSv1.2,129,Application Data
127,13.7942304,151.101.194.187,172.20.40.110,TCP,129,"[TCP Retransmission] 443  >  50060 [PSH, ACK] Seq=6048 Ack=80216 Win=3952 Len=75"
128,13.7942895,172.20.40.110,151.101.194.187,TCP,66,50060  >  443 [ACK] Seq=80216 Ack=6123 Win=253 Len=0 SLE=6048 SRE=6123
129,14.0099615,172.20.40.110,151.101.194.187,TLSv1.2,2891,Application Data
130,14.0221743,151.101.194.187,172.20.40.110,TCP,60,443  >  50060 [ACK] Seq=6123 Ack=83053 Win=3952 Len=0
131,14.0233038,151.101.194.187,172.20.40.110,TLSv1.2,131,Application Data
132,14.0611707,151.101.194.187,172.20.40.110,TCP,131,"[TCP Retransmission] 443  >  50060 [PSH, ACK] Seq=6123 Ack=83053 Win=3952 Len=77"
133,14.0612246,172.20.40.110,151.101.194.187,TCP,66,50060  >  443 [ACK] Seq=83053 Ack=6200 Win=258 Len=0 SLE=6123 SRE=6200
134,16.1571322,172.20.40.110,151.101.194.187,TLSv1.2,2907,Application Data
135,16.1634254,172.20.40.110,151.101.194.187,TLSv1.2,2895,Application Data
136,16.1716692,172.20.40.110,151.101.194.187,TLSv1.2,2908,Application Data
137,16.1733462,172.20.40.110,151.101.194.187,TLSv1.2,2889,Application Data
138,16.1830238,151.101.194.187,172.20.40.110,TCP,60,443  >  50060 [ACK] Seq=6200 Ack=85906 Win=3952 Len=0
139,16.1830238,151.101.194.187,172.20.40.110,TCP,60,443  >  50060 [ACK] Seq=6200 Ack=88747 Win=3952 Len=0
140,16.1830238,151.101.194.187,172.20.40.110,TLSv1.2,241,Application Data
141,16.1845698,151.101.194.187,172.20.40.110,TLSv1.2,136,Application Data
142,16.1849768,172.20.40.110,151.101.194.187,TCP,54,50060  >  443 [ACK] Seq=94436 Ack=6469 Win=257 Len=0
143,16.1854922,151.101.194.187,172.20.40.110,TCP,60,443  >  50060 [ACK] Seq=6469 Ack=91601 Win=3952 Len=0
144,16.1854922,151.101.194.187,172.20.40.110,TCP,60,443  >  50060 [ACK] Seq=6469 Ack=94436 Win=3952 Len=0
145,16.1907717,151.101.194.187,172.20.40.110,TLSv1.2,174,Application Data
146,16.1907717,151.101.194.187,172.20.40.110,TLSv1.2,125,Application Data
147,16.190867,172.20.40.110,151.101.194.187,TCP,54,50060  >  443 [ACK] Seq=94436 Ack=6660 Win=256 Len=0
148,16.3715779,172.20.40.110,151.101.194.187,TLSv1.2,2911,Application Data
149,16.3823545,151.101.194.187,172.20.40.110,TCP,60,443  >  50060 [ACK] Seq=6660 Ack=97293 Win=3952 Len=0
150,16.3856782,151.101.194.187,172.20.40.110,TLSv1.2,285,Application Data
151,16.4224306,151.101.194.187,172.20.40.110,TCP,285,"[TCP Retransmission] 443  >  50060 [PSH, ACK] Seq=6660 Ack=97293 Win=3952 Len=231"
152,16.4225722,172.20.40.110,151.101.194.187,TCP,66,50060  >  443 [ACK] Seq=97293 Ack=6891 Win=256 Len=0 SLE=6660 SRE=6891
153,16.4769286,172.20.40.110,151.101.194.187,TLSv1.2,2893,Application Data
154,16.4771752,172.20.40.110,151.101.194.187,TLSv1.2,2890,Application Data
155,16.4773245,172.20.40.110,151.101.194.187,TLSv1.2,2896,Application Data
156,16.4867651,151.101.194.187,172.20.40.110,TCP,60,443  >  50060 [ACK] Seq=6891 Ack=100132 Win=3952 Len=0
157,16.489819,151.101.194.187,172.20.40.110,TLSv1.2,124,Application Data
158,16.4938935,151.101.194.187,172.20.40.110,TCP,60,443  >  50060 [ACK] Seq=6961 Ack=102968 Win=3952 Len=0
159,16.4938935,151.101.194.187,172.20.40.110,TCP,60,443  >  50060 [ACK] Seq=6961 Ack=105810 Win=3952 Len=0
160,16.4938935,151.101.194.187,172.20.40.110,TLSv1.2,206,"Application Data, Application Data"
161,16.4939838,172.20.40.110,151.101.194.187,TCP,54,50060  >  443 [ACK] Seq=105810 Ack=7113 Win=255 Len=0
162,16.5553988,172.20.40.110,151.101.194.187,TLSv1.2,2937,Application Data
163,16.5662678,151.101.194.187,172.20.40.110,TCP,60,443  >  50060 [ACK] Seq=7113 Ack=108693 Win=3952 Len=0
164,16.5706938,151.101.194.187,172.20.40.110,TLSv1.2,130,Application Data
165,16.6073403,151.101.194.187,172.20.40.110,TCP,130,"[TCP Retransmission] 443  >  50060 [PSH, ACK] Seq=7113 Ack=108693 Win=3952 Len=76"
166,16.6074006,172.20.40.110,151.101.194.187,TCP,66,50060  >  443 [ACK] Seq=108693 Ack=7189 Win=254 Len=0 SLE=7113 SRE=7189
167,16.6384425,172.20.40.110,151.101.194.187,TLSv1.2,2893,Application Data
168,16.6472879,151.101.194.187,172.20.40.110,TCP,60,443  >  50060 [ACK] Seq=7189 Ack=111532 Win=3952 Len=0
169,16.6519939,151.101.194.187,172.20.40.110,TLSv1.2,235,Application Data
170,16.659207,172.20.40.110,151.101.194.187,TLSv1.2,2905,Application Data
171,16.6685049,151.101.194.187,172.20.40.110,TCP,60,443  >  50060 [ACK] Seq=7370 Ack=114383 Win=3952 Len=0
172,16.6753206,151.101.194.187,172.20.40.110,TLSv1.2,125,Application Data
173,16.7076098,151.101.194.187,172.20.40.110,TCP,125,"[TCP Retransmission] 443  >  50060 [PSH, ACK] Seq=7370 Ack=114383 Win=3952 Len=71"
174,16.7076735,172.20.40.110,151.101.194.187,TCP,66,50060  >  443 [ACK] Seq=114383 Ack=7441 Win=253 Len=0 SLE=7370 SRE=7441
175,17.3308156,172.20.40.110,151.101.194.187,TLSv1.2,2889,Application Data
176,17.3370884,172.20.40.110,151.101.194.187,TLSv1.2,2838,Application Data
177,17.3469297,151.101.194.187,172.20.40.110,TCP,60,443  >  50060 [ACK] Seq=7441 Ack=117218 Win=3952 Len=0
178,17.3591404,151.101.194.187,172.20.40.110,TLSv1.2,135,Application Data
179,17.3591404,151.101.194.187,172.20.40.110,TCP,60,443  >  50060 [ACK] Seq=7522 Ack=120002 Win=3957 Len=0
180,17.3621655,151.101.194.187,172.20.40.110,TLSv1.2,130,Application Data
181,17.3622398,172.20.40.110,151.101.194.187,TCP,54,50060  >  443 [ACK] Seq=120002 Ack=7598 Win=258 Len=0
182,17.5037942,172.20.40.110,151.101.194.187,TLSv1.2,2852,Application Data
183,17.5048959,172.20.40.110,151.101.194.187,TLSv1.2,2850,Application Data
184,17.5331523,151.101.194.187,172.20.40.110,TCP,60,443  >  50060 [ACK] Seq=7598 Ack=122800 Win=3957 Len=0
185,17.5331523,151.101.194.187,172.20.40.110,TCP,60,443  >  50060 [ACK] Seq=7598 Ack=125596 Win=3957 Len=0
186,17.5331523,151.101.194.187,172.20.40.110,TLSv1.2,125,Application Data
187,17.5331523,151.101.194.187,172.20.40.110,TLSv1.2,98,Application Data
188,17.5333272,172.20.40.110,151.101.194.187,TCP,54,50060  >  443 [ACK] Seq=125596 Ack=7713 Win=258 Len=0
189,17.7922906,172.20.40.110,151.101.194.187,TLSv1.2,2853,Application Data
190,17.8023933,151.101.194.187,172.20.40.110,TCP,60,443  >  50060 [ACK] Seq=7713 Ack=128395 Win=3957 Len=0
191,17.8060442,151.101.194.187,172.20.40.110,TLSv1.2,208,Application Data
192,17.8430037,151.101.194.187,172.20.40.110,TCP,208,"[TCP Retransmission] 443  >  50060 [PSH, ACK] Seq=7713 Ack=128395 Win=3957 Len=154"
193,17.8430932,172.20.40.110,151.101.194.187,TCP,66,50060  >  443 [ACK] Seq=128395 Ack=7867 Win=257 Len=0 SLE=7713 SRE=7867
194,27.6754042,172.20.40.110,151.101.194.187,TLSv1.2,2870,Application Data
195,27.6818043,172.20.40.110,151.101.194.187,TLSv1.2,2866,Application Data
196,27.6921448,172.20.40.110,151.101.194.187,TLSv1.2,2846,Application Data
197,27.6941012,151.101.194.187,172.20.40.110,TCP,60,443  >  50060 [ACK] Seq=7867 Ack=131211 Win=3957 Len=0
198,27.6941012,151.101.194.187,172.20.40.110,TCP,60,443  >  50060 [ACK] Seq=7867 Ack=134023 Win=3957 Len=0
199,27.6944042,172.20.40.110,151.101.194.187,TLSv1.2,2868,Application Data
200,27.7002234,151.101.194.187,172.20.40.110,TLSv1.2,246,Application Data
201,27.7002234,151.101.194.187,172.20.40.110,TLSv1.2,176,Application Data
202,27.7003184,172.20.40.110,151.101.194.187,TCP,54,50060  >  443 [ACK] Seq=139629 Ack=8181 Win=256 Len=0
203,27.7014636,151.101.194.187,172.20.40.110,TCP,60,443  >  50060 [ACK] Seq=8181 Ack=136815 Win=3957 Len=0
204,27.7118298,151.101.194.187,172.20.40.110,TLSv1.2,280,Application Data
205,27.7118298,151.101.194.187,172.20.40.110,TCP,60,443  >  50060 [ACK] Seq=8407 Ack=139629 Win=3957 Len=0
206,27.7118298,151.101.194.187,172.20.40.110,TLSv1.2,130,Application Data
207,27.7120417,172.20.40.110,151.101.194.187,TCP,54,50060  >  443 [ACK] Seq=139629 Ack=8483 Win=255 Len=0
208,27.7274876,172.20.40.110,151.101.194.187,TLSv1.2,2866,Application Data
209,27.7299429,172.20.40.110,151.101.194.187,TLSv1.2,2864,Application Data
210,27.7419648,151.101.194.187,172.20.40.110,TCP,60,443  >  50060 [ACK] Seq=8483 Ack=142441 Win=3957 Len=0
211,27.7419648,151.101.194.187,172.20.40.110,TCP,60,443  >  50060 [ACK] Seq=8483 Ack=145251 Win=3957 Len=0
212,27.7443195,151.101.194.187,172.20.40.110,TLSv1.2,206,"Application Data, Application Data"
213,27.744398,172.20.40.110,151.101.194.187,TCP,54,50060  >  443 [ACK] Seq=145251 Ack=8635 Win=254 Len=0
214,27.7851048,172.20.40.110,151.101.194.187,TLSv1.2,2870,Application Data
215,27.7938966,151.101.194.187,172.20.40.110,TCP,60,443  >  50060 [ACK] Seq=8635 Ack=148067 Win=3957 Len=0
216,27.800482,151.101.194.187,172.20.40.110,TLSv1.2,98,Application Data
217,27.8089139,172.20.40.110,151.101.194.187,TLSv1.2,2866,Application Data
218,27.8163817,172.20.40.110,151.101.194.187,TLSv1.2,2868,Application Data
219,27.8166587,172.20.40.110,151.101.194.187,TLSv1.2,2872,Application Data
220,27.8190688,151.101.194.187,172.20.40.110,TCP,60,443  >  50060 [ACK] Seq=8679 Ack=150879 Win=3957 Len=0
221,27.8255408,151.101.194.187,172.20.40.110,TCP,60,443  >  50060 [ACK] Seq=8679 Ack=153693 Win=3957 Len=0
222,27.8276091,151.101.194.187,172.20.40.110,TCP,60,443  >  50060 [ACK] Seq=8679 Ack=156511 Win=3957 Len=0
223,27.8321322,151.101.194.187,172.20.40.110,TLSv1.2,186,"Application Data, Application Data, Application Data"
224,27.8322188,172.20.40.110,151.101.194.187,TCP,54,50060  >  443 [ACK] Seq=156511 Ack=8811 Win=254 Len=0
225,28.0423027,172.20.40.110,151.101.194.187,TLSv1.2,2866,Application Data
226,28.0426308,172.20.40.110,151.101.194.187,TLSv1.2,2868,Application Data
227,28.0546186,151.101.194.187,172.20.40.110,TCP,60,443  >  50060 [ACK] Seq=8811 Ack=159323 Win=3957 Len=0
228,28.0546186,151.101.194.187,172.20.40.110,TCP,60,443  >  50060 [ACK] Seq=8811 Ack=162137 Win=3957 Len=0
229,28.0580923,172.20.40.110,151.101.194.187,TLSv1.2,2864,Application Data
230,28.05846,151.101.194.187,172.20.40.110,TLSv1.2,98,Application Data
231,28.0603173,151.101.194.187,172.20.40.110,TLSv1.2,98,Application Data
232,28.0604117,172.20.40.110,151.101.194.187,TCP,54,50060  >  443 [ACK] Seq=164947 Ack=8899 Win=253 Len=0
233,28.0691885,151.101.194.187,172.20.40.110,TCP,60,443  >  50060 [ACK] Seq=8899 Ack=164947 Win=3957 Len=0
234,28.0734954,151.101.194.187,172.20.40.110,TLSv1.2,104,Application Data
235,28.1048758,151.101.194.187,172.20.40.110,TCP,104,"[TCP Retransmission] 443  >  50060 [PSH, ACK] Seq=8899 Ack=164947 Win=3957 Len=50"
236,28.1049611,172.20.40.110,151.101.194.187,TCP,66,50060  >  443 [ACK] Seq=164947 Ack=8949 Win=253 Len=0 SLE=8899 SRE=8949
237,28.1458649,172.20.40.110,151.101.194.187,TLSv1.2,2866,Application Data
238,28.1616907,151.101.194.187,172.20.40.110,TCP,60,443  >  50060 [ACK] Seq=8949 Ack=167759 Win=3957 Len=0
239,28.1616907,151.101.194.187,172.20.40.110,TLSv1.2,124,Application Data
240,28.1916345,151.101.194.187,172.20.40.110,TCP,124,"[TCP Retransmission] 443  >  50060 [PSH, ACK] Seq=8949 Ack=167759 Win=3957 Len=70"
241,28.191662,172.20.40.110,151.101.194.187,TCP,66,50060  >  443 [ACK] Seq=167759 Ack=9019 Win=258 Len=0 SLE=8949 SRE=9019
242,28.3179063,172.20.40.110,151.101.194.187,TLSv1.2,2866,Application Data
243,28.3289381,151.101.194.187,172.20.40.110,TCP,60,443  >  50060 [ACK] Seq=9019 Ack=170571 Win=3957 Len=0
244,28.3322062,151.101.194.187,172.20.40.110,TLSv1.2,131,Application Data
245,28.3648988,151.101.194.187,172.20.40.110,TCP,131,"[TCP Retransmission] 443  >  50060 [PSH, ACK] Seq=9019 Ack=170571 Win=3957 Len=77"
246,28.3649715,172.20.40.110,151.101.194.187,TCP,66,50060  >  443 [ACK] Seq=170571 Ack=9096 Win=258 Len=0 SLE=9019 SRE=9096
247,29.0343188,172.20.40.110,151.101.194.187,TLSv1.2,2883,Application Data
248,29.0395046,172.20.40.110,151.101.194.187,TLSv1.2,2868,Application Data
249,29.0412096,172.20.40.110,151.101.194.187,TLSv1.2,2874,Application Data
250,29.0463754,151.101.194.187,172.20.40.110,TCP,60,443  >  50060 [ACK] Seq=9096 Ack=173400 Win=3957 Len=0
251,29.0502641,151.101.194.187,172.20.40.110,TLSv1.2,241,Application Data
252,29.0535081,151.101.194.187,172.20.40.110,TCP,60,443  >  50060 [ACK] Seq=9283 Ack=176214 Win=3963 Len=0
253,29.0535081,151.101.194.187,172.20.40.110,TCP,60,443  >  50060 [ACK] Seq=9283 Ack=179034 Win=3963 Len=0
254,29.0567854,151.101.194.187,172.20.40.110,TLSv1.2,136,Application Data
255,29.0568895,172.20.40.110,151.101.194.187,TCP,54,50060  >  443 [ACK] Seq=179034 Ack=9365 Win=257 Len=0
256,29.0578537,151.101.194.187,172.20.40.110,TLSv1.2,124,Application Data
257,29.0897984,172.20.40.110,151.101.194.187,TLSv1.2,2868,Application Data
258,29.0967086,151.101.194.187,172.20.40.110,TCP,124,"[TCP Spurious Retransmission] 443  >  50060 [PSH, ACK] Seq=9365 Ack=179034 Win=3963 Len=70"
259,29.0967666,172.20.40.110,151.101.194.187,TCP,66,[TCP Dup ACK 257#1] 50060  >  443 [ACK] Seq=181848 Ack=9435 Win=257 Len=0 SLE=9365 SRE=9435
260,29.1001714,151.101.194.187,172.20.40.110,TCP,60,443  >  50060 [ACK] Seq=9435 Ack=181848 Win=3963 Len=0
261,29.1047628,151.101.194.187,172.20.40.110,TLSv1.2,104,Application Data
262,29.1343014,151.101.194.187,172.20.40.110,TCP,104,"[TCP Retransmission] 443  >  50060 [PSH, ACK] Seq=9435 Ack=181848 Win=3963 Len=50"
263,29.1343529,172.20.40.110,151.101.194.187,TCP,66,50060  >  443 [ACK] Seq=181848 Ack=9485 Win=256 Len=0 SLE=9435 SRE=9485
264,29.1532291,172.20.40.110,151.101.194.187,TLSv1.2,2882,Application Data
265,29.1636845,151.101.194.187,172.20.40.110,TCP,60,443  >  50060 [ACK] Seq=9485 Ack=184676 Win=3963 Len=0
266,29.1650594,151.101.194.187,172.20.40.110,TLSv1.2,125,Application Data
267,29.1965617,151.101.194.187,172.20.40.110,TCP,125,"[TCP Retransmission] 443  >  50060 [PSH, ACK] Seq=9485 Ack=184676 Win=3963 Len=71"
268,29.1966223,172.20.40.110,151.101.194.187,TCP,66,50060  >  443 [ACK] Seq=184676 Ack=9556 Win=256 Len=0 SLE=9485 SRE=9556
269,29.2609531,172.20.40.110,151.101.194.187,TLSv1.2,2865,Application Data
270,29.2702908,151.101.194.187,172.20.40.110,TCP,60,443  >  50060 [ACK] Seq=9556 Ack=187487 Win=3963 Len=0
271,29.2737683,172.20.40.110,151.101.194.187,TLSv1.2,2882,Application Data
272,29.276364,151.101.194.187,172.20.40.110,TLSv1.2,125,Application Data
273,29.2827606,151.101.194.187,172.20.40.110,TCP,60,443  >  50060 [ACK] Seq=9627 Ack=190315 Win=3963 Len=0
274,29.2851906,151.101.194.187,172.20.40.110,TLSv1.2,136,Application Data
275,29.2853141,172.20.40.110,151.101.194.187,TCP,54,50060  >  443 [ACK] Seq=190315 Ack=9709 Win=256 Len=0
276,29.3887712,172.20.40.110,151.101.194.187,TLSv1.2,2869,Application Data
277,29.3980689,151.101.194.187,172.20.40.110,TCP,60,443  >  50060 [ACK] Seq=9709 Ack=193130 Win=3963 Len=0
278,29.4012045,151.101.194.187,172.20.40.110,TLSv1.2,174,Application Data
279,29.4342085,151.101.194.187,172.20.40.110,TCP,174,"[TCP Retransmission] 443  >  50060 [PSH, ACK] Seq=9709 Ack=193130 Win=3963 Len=120"
280,29.4342679,172.20.40.110,151.101.194.187,TCP,66,50060  >  443 [ACK] Seq=193130 Ack=9829 Win=255 Len=0 SLE=9709 SRE=9829
281,29.4798264,172.20.40.110,151.101.194.187,TLSv1.2,2868,Application Data
282,29.4800523,172.20.40.110,151.101.194.187,TLSv1.2,2869,Application Data
283,29.4904029,151.101.194.187,172.20.40.110,TCP,60,443  >  50060 [ACK] Seq=9829 Ack=195944 Win=3963 Len=0
284,29.4919039,151.101.194.187,172.20.40.110,TCP,60,443  >  50060 [ACK] Seq=9829 Ack=198759 Win=3963 Len=0
285,29.4919039,151.101.194.187,172.20.40.110,TLSv1.2,285,Application Data
286,29.493925,151.101.194.187,172.20.40.110,TLSv1.2,124,Application Data
287,29.4939938,172.20.40.110,151.101.194.187,TCP,54,50060  >  443 [ACK] Seq=198759 Ack=10130 Win=254 Len=0
288,29.7756056,172.20.40.110,151.101.194.187,TLSv1.2,2950,Application Data
289,29.7758762,172.20.40.110,151.101.194.187,TLSv1.2,2905,Application Data
290,29.7761706,172.20.40.110,151.101.194.187,TLSv1.2,2899,Application Data
291,29.7860646,151.101.194.187,172.20.40.110,TCP,60,443  >  50060 [ACK] Seq=10130 Ack=201655 Win=3963 Len=0
292,29.7876603,151.101.194.187,172.20.40.110,TLSv1.2,240,Application Data
293,29.7885226,151.101.194.187,172.20.40.110,TCP,60,443  >  50060 [ACK] Seq=10316 Ack=204506 Win=3963 Len=0
294,29.7885226,151.101.194.187,172.20.40.110,TCP,60,443  >  50060 [ACK] Seq=10316 Ack=207351 Win=3963 Len=0
295,29.7919358,151.101.194.187,172.20.40.110,TLSv1.2,130,Application Data
296,29.7920351,172.20.40.110,151.101.194.187,TCP,54,50060  >  443 [ACK] Seq=207351 Ack=10392 Win=253 Len=0
297,29.7943571,151.101.194.187,172.20.40.110,TLSv1.2,130,Application Data
298,29.8116846,172.20.40.110,151.101.194.187,TLSv1.2,2942,Application Data
299,29.8197158,172.20.40.110,151.101.194.187,TLSv1.2,2938,Application Data
300,29.8200593,172.20.40.110,151.101.194.187,TLSv1.2,2939,Application Data
301,29.8223369,151.101.194.187,172.20.40.110,TCP,60,443  >  50060 [ACK] Seq=10468 Ack=210239 Win=3963 Len=0
302,29.8248381,151.101.194.187,172.20.40.110,TLSv1.2,131,Application Data
303,29.8288876,151.101.194.187,172.20.40.110,TCP,60,443  >  50060 [ACK] Seq=10545 Ack=213123 Win=3963 Len=0
304,29.8329283,151.101.194.187,172.20.40.110,TCP,60,443  >  50060 [ACK] Seq=10545 Ack=216008 Win=3963 Len=0
305,29.834232,151.101.194.187,172.20.40.110,TLSv1.2,130,Application Data
306,29.8343204,172.20.40.110,151.101.194.187,TCP,54,50060  >  443 [ACK] Seq=216008 Ack=10621 Win=258 Len=0
307,29.8352957,151.101.194.187,172.20.40.110,TLSv1.2,125,Application Data
308,29.8456177,172.20.40.110,151.101.194.187,TLSv1.2,2935,Application Data
309,29.8548538,151.101.194.187,172.20.40.110,TCP,60,443  >  50060 [ACK] Seq=10692 Ack=218889 Win=3963 Len=0
310,29.8582712,151.101.194.187,172.20.40.110,TLSv1.2,129,Application Data
311,29.8936749,151.101.194.187,172.20.40.110,TCP,129,"[TCP Retransmission] 443  >  50060 [PSH, ACK] Seq=10692 Ack=218889 Win=3963 Len=75"
312,29.8937312,172.20.40.110,151.101.194.187,TCP,66,50060  >  443 [ACK] Seq=218889 Ack=10767 Win=257 Len=0 SLE=10692 SRE=10767
313,34.5794673,172.20.40.110,151.101.194.187,TLSv1.2,2942,Application Data
314,34.582237,172.20.40.110,151.101.194.187,TLSv1.2,2940,Application Data
315,34.5929564,151.101.194.187,172.20.40.110,TCP,60,443  >  50060 [ACK] Seq=10767 Ack=221777 Win=3963 Len=0
316,34.5955396,151.101.194.187,172.20.40.110,TLSv1.2,214,Application Data
317,34.598826,151.101.194.187,172.20.40.110,TCP,60,443  >  50060 [ACK] Seq=10927 Ack=224663 Win=3963 Len=0
318,34.6022343,151.101.194.187,172.20.40.110,TLSv1.2,125,Application Data
319,34.6023226,172.20.40.110,151.101.194.187,TCP,54,50060  >  443 [ACK] Seq=224663 Ack=10998 Win=256 Len=0
320,34.6164793,172.20.40.110,151.101.194.187,TLSv1.2,2943,Application Data
321,34.6325723,151.101.194.187,172.20.40.110,TCP,60,443  >  50060 [ACK] Seq=10998 Ack=227552 Win=3963 Len=0
322,34.6345384,151.101.194.187,172.20.40.110,TLSv1.2,241,Application Data
323,34.6671902,172.20.40.110,151.101.194.187,TLSv1.2,2941,Application Data
324,34.6704659,151.101.194.187,172.20.40.110,TCP,241,"[TCP Spurious Retransmission] 443  >  50060 [PSH, ACK] Seq=10998 Ack=227552 Win=3963 Len=187"
325,34.6705327,172.20.40.110,151.101.194.187,TCP,66,[TCP Dup ACK 323#1] 50060  >  443 [ACK] Seq=230439 Ack=11185 Win=255 Len=0 SLE=10998 SRE=11185
326,34.6759943,151.101.194.187,172.20.40.110,TCP,60,443  >  50060 [ACK] Seq=11185 Ack=230439 Win=3963 Len=0
327,34.6801069,151.101.194.187,172.20.40.110,TLSv1.2,168,Application Data
328,34.7146246,151.101.194.187,172.20.40.110,TCP,168,"[TCP Retransmission] 443  >  50060 [PSH, ACK] Seq=11185 Ack=230439 Win=3963 Len=114"
329,34.7148386,172.20.40.110,151.101.194.187,TCP,66,50060  >  443 [ACK] Seq=230439 Ack=11299 Win=255 Len=0 SLE=11185 SRE=11299
330,40.9467004,172.20.40.110,151.101.194.187,TLSv1.2,2947,Application Data
331,40.9553477,172.20.40.110,151.101.194.187,TLSv1.2,2938,Application Data
332,40.956378,172.20.40.110,151.101.194.187,TLSv1.2,2932,Application Data
333,40.9618754,151.101.194.187,172.20.40.110,TCP,60,443  >  50060 [ACK] Seq=11299 Ack=233332 Win=3963 Len=0
334,40.9633235,151.101.194.187,172.20.40.110,TLSv1.2,369,Application Data
335,40.9645425,151.101.194.187,172.20.40.110,TCP,60,443  >  50060 [ACK] Seq=11614 Ack=236216 Win=3963 Len=0
336,40.9669254,151.101.194.187,172.20.40.110,TCP,60,443  >  50060 [ACK] Seq=11614 Ack=239094 Win=3963 Len=0
337,40.9683,151.101.194.187,172.20.40.110,TLSv1.2,124,Application Data
338,40.968374,172.20.40.110,151.101.194.187,TCP,54,50060  >  443 [ACK] Seq=239094 Ack=11684 Win=254 Len=0
339,40.9726337,151.101.194.187,172.20.40.110,TLSv1.2,131,Application Data
340,41.009438,151.101.194.187,172.20.40.110,TCP,131,"[TCP Retransmission] 443  >  50060 [PSH, ACK] Seq=11684 Ack=239094 Win=3963 Len=77"
341,41.0094927,172.20.40.110,151.101.194.187,TCP,66,50060  >  443 [ACK] Seq=239094 Ack=11761 Win=253 Len=0 SLE=11684 SRE=11761
342,41.1412684,172.20.40.110,151.101.194.187,TLSv1.2,2946,Application Data
343,41.1520113,151.101.194.187,172.20.40.110,TCP,60,443  >  50060 [ACK] Seq=11761 Ack=241986 Win=3963 Len=0
344,41.1567758,151.101.194.187,172.20.40.110,TLSv1.2,130,Application Data
345,41.1772056,172.20.40.110,151.101.194.187,TLSv1.2,2946,Application Data
346,41.1860501,151.101.194.187,172.20.40.110,TCP,60,443  >  50060 [ACK] Seq=11837 Ack=244878 Win=3963 Len=0
347,41.1903136,151.101.194.187,172.20.40.110,TLSv1.2,125,Application Data
348,41.228107,151.101.194.187,172.20.40.110,TCP,125,"[TCP Retransmission] 443  >  50060 [PSH, ACK] Seq=11837 Ack=244878 Win=3963 Len=71"
349,41.2282182,172.20.40.110,151.101.194.187,TCP,66,50060  >  443 [ACK] Seq=244878 Ack=11908 Win=258 Len=0 SLE=11837 SRE=11908
350,41.2920145,172.20.40.110,151.101.194.187,TLSv1.2,2933,Application Data
351,41.2956794,172.20.40.110,151.101.194.187,TLSv1.2,2929,Application Data
352,41.3033125,151.101.194.187,172.20.40.110,TCP,60,443  >  50060 [ACK] Seq=11908 Ack=247757 Win=3963 Len=0
353,41.3065681,151.101.194.187,172.20.40.110,TLSv1.2,130,Application Data
354,41.3065681,151.101.194.187,172.20.40.110,TCP,60,443  >  50060 [ACK] Seq=11984 Ack=250632 Win=3963 Len=0
355,41.3082694,151.101.194.187,172.20.40.110,TLSv1.2,125,Application Data
356,41.3083422,172.20.40.110,151.101.194.187,TCP,54,50060  >  443 [ACK] Seq=250632 Ack=12055 Win=258 Len=0
357,41.3402775,172.20.40.110,151.101.194.187,TLSv1.2,2938,Application Data
358,41.3405311,172.20.40.110,151.101.194.187,TLSv1.2,2929,Application Data
359,41.3526249,151.101.194.187,172.20.40.110,TCP,60,443  >  50060 [ACK] Seq=12055 Ack=253516 Win=3963 Len=0
360,41.3526249,151.101.194.187,172.20.40.110,TCP,60,443  >  50060 [ACK] Seq=12055 Ack=256391 Win=3963 Len=0
361,41.3569524,151.101.194.187,172.20.40.110,TLSv1.2,130,Application Data
362,41.3582997,151.101.194.187,172.20.40.110,TLSv1.2,131,Application Data
363,41.3583781,172.20.40.110,151.101.194.187,TCP,54,50060  >  443 [ACK] Seq=256391 Ack=12208 Win=257 Len=0
364,41.4799208,172.20.40.110,151.101.194.187,TLSv1.2,2938,Application Data
365,41.4827808,172.20.40.110,151.101.194.187,TLSv1.2,2946,Application Data
366,41.4873382,172.20.40.110,151.101.194.187,TLSv1.2,2934,Application Data
367,41.4879507,172.20.40.110,151.101.194.187,TLSv1.2,2935,Application Data
368,41.4898998,151.101.194.187,172.20.40.110,TCP,60,443  >  50060 [ACK] Seq=12208 Ack=259275 Win=3963 Len=0
369,41.492871,151.101.194.187,172.20.40.110,TCP,60,443  >  50060 [ACK] Seq=12208 Ack=262167 Win=3963 Len=0
370,41.4977468,151.101.194.187,172.20.40.110,TLSv1.2,130,Application Data
371,41.5033583,151.101.194.187,172.20.40.110,TLSv1.2,124,Application Data
372,41.5033583,151.101.194.187,172.20.40.110,TCP,60,443  >  50060 [ACK] Seq=12354 Ack=265047 Win=3963 Len=0
373,41.5033583,151.101.194.187,172.20.40.110,TCP,60,443  >  50060 [ACK] Seq=12354 Ack=267928 Win=3963 Len=0
374,41.5033583,151.101.194.187,172.20.40.110,TLSv1.2,130,Application Data
375,41.5033583,151.101.194.187,172.20.40.110,TLSv1.2,124,Application Data
376,41.5035912,172.20.40.110,151.101.194.187,TCP,54,50060  >  443 [ACK] Seq=267928 Ack=12500 Win=256 Len=0
377,47.0752712,172.20.40.110,151.101.194.187,TLSv1.2,2946,Application Data
378,47.0862096,172.20.40.110,151.101.194.187,TLSv1.2,2944,Application Data
379,47.0892156,151.101.194.187,172.20.40.110,TCP,60,443  >  50060 [ACK] Seq=12500 Ack=270820 Win=3963 Len=0
380,47.0903588,151.101.194.187,172.20.40.110,TLSv1.2,220,Application Data
381,47.0961257,151.101.194.187,172.20.40.110,TCP,60,443  >  50060 [ACK] Seq=12666 Ack=273710 Win=3963 Len=0
382,47.0993856,151.101.194.187,172.20.40.110,TLSv1.2,169,Application Data
383,47.0994786,172.20.40.110,151.101.194.187,TCP,54,50060  >  443 [ACK] Seq=273710 Ack=12781 Win=255 Len=0
384,47.1145413,172.20.40.110,151.101.194.187,TLSv1.2,2947,Application Data
385,47.1238558,151.101.194.187,172.20.40.110,TCP,60,443  >  50060 [ACK] Seq=12781 Ack=276603 Win=3963 Len=0
386,47.1273689,151.101.194.187,172.20.40.110,TLSv1.2,125,Application Data
387,47.1640652,151.101.194.187,172.20.40.110,TCP,125,"[TCP Retransmission] 443  >  50060 [PSH, ACK] Seq=12781 Ack=276603 Win=3963 Len=71"
388,47.1641259,172.20.40.110,151.101.194.187,TCP,66,50060  >  443 [ACK] Seq=276603 Ack=12852 Win=255 Len=0 SLE=12781 SRE=12852
389,47.181017,172.20.40.110,151.101.194.187,TLSv1.2,2945,Application Data
390,47.1895682,151.101.194.187,172.20.40.110,TCP,60,443  >  50060 [ACK] Seq=12852 Ack=279494 Win=3963 Len=0
391,47.1966045,151.101.194.187,172.20.40.110,TLSv1.2,279,Application Data
392,47.2322353,151.101.194.187,172.20.40.110,TCP,279,"[TCP Retransmission] 443  >  50060 [PSH, ACK] Seq=12852 Ack=279494 Win=3963 Len=225"
393,47.2322987,172.20.40.110,151.101.194.187,TCP,66,50060  >  443 [ACK] Seq=279494 Ack=13077 Win=254 Len=0 SLE=12852 SRE=13077
394,52.9945598,172.20.40.110,151.101.194.187,TLSv1.2,2954,Application Data
395,53.0022313,172.20.40.110,151.101.194.187,TLSv1.2,2945,Application Data
396,53.0056149,172.20.40.110,151.101.194.187,TLSv1.2,2939,Application Data
397,53.0082661,151.101.194.187,172.20.40.110,TCP,60,443  >  50060 [ACK] Seq=13077 Ack=282394 Win=3963 Len=0
398,53.0101041,151.101.194.187,172.20.40.110,TLSv1.2,214,Application Data
399,53.0111145,151.101.194.187,172.20.40.110,TCP,60,443  >  50060 [ACK] Seq=13237 Ack=285285 Win=3963 Len=0
400,53.0135164,151.101.194.187,172.20.40.110,TLSv1.2,124,Application Data
401,53.0135981,172.20.40.110,151.101.194.187,TCP,54,50060  >  443 [ACK] Seq=288170 Ack=13307 Win=258 Len=0
402,53.0145855,151.101.194.187,172.20.40.110,TCP,60,443  >  50060 [ACK] Seq=13307 Ack=288170 Win=3963 Len=0
403,53.0170285,151.101.194.187,172.20.40.110,TLSv1.2,131,Application Data
404,53.0559125,151.101.194.187,172.20.40.110,TCP,131,"[TCP Retransmission] 443  >  50060 [PSH, ACK] Seq=13307 Ack=288170 Win=3963 Len=77"
405,53.0559983,172.20.40.110,151.101.194.187,TCP,66,50060  >  443 [ACK] Seq=288170 Ack=13384 Win=258 Len=0 SLE=13307 SRE=13384
406,53.0662404,172.20.40.110,151.101.194.187,TLSv1.2,2939,Application Data
407,53.0748116,151.101.194.187,172.20.40.110,TCP,60,443  >  50060 [ACK] Seq=13384 Ack=291055 Win=3963 Len=0
408,53.0795965,151.101.194.187,172.20.40.110,TLSv1.2,130,Application Data
409,53.1013147,172.20.40.110,151.101.194.187,TLSv1.2,2951,Application Data
410,53.1107834,151.101.194.187,172.20.40.110,TCP,60,443  >  50060 [ACK] Seq=13460 Ack=293952 Win=3963 Len=0
411,53.1134333,151.101.194.187,172.20.40.110,TLSv1.2,104,Application Data
412,53.1526591,151.101.194.187,172.20.40.110,TCP,104,"[TCP Retransmission] 443  >  50060 [PSH, ACK] Seq=13460 Ack=293952 Win=3963 Len=50"
413,53.1527406,172.20.40.110,151.101.194.187,TCP,66,50060  >  443 [ACK] Seq=293952 Ack=13510 Win=257 Len=0 SLE=13460 SRE=13510
414,53.1995485,172.20.40.110,151.101.194.187,TLSv1.2,2936,Application Data
415,53.2092428,151.101.194.187,172.20.40.110,TCP,60,443  >  50060 [ACK] Seq=13510 Ack=296834 Win=3963 Len=0
416,53.2119045,151.101.194.187,172.20.40.110,TLSv1.2,125,Application Data
417,53.2160956,172.20.40.110,151.101.194.187,TLSv1.2,2953,Application Data
418,53.2254727,151.101.194.187,172.20.40.110,TCP,60,443  >  50060 [ACK] Seq=13581 Ack=299733 Win=3963 Len=0
419,53.2278465,151.101.194.187,172.20.40.110,TLSv1.2,130,Application Data
420,53.2454771,172.20.40.110,151.101.194.187,TLSv1.2,2953,Application Data
421,53.2559875,151.101.194.187,172.20.40.110,TCP,60,443  >  50060 [ACK] Seq=13657 Ack=302632 Win=3963 Len=0
422,53.2573371,151.101.194.187,172.20.40.110,TLSv1.2,125,Application Data
423,53.2970821,151.101.194.187,172.20.40.110,TCP,125,"[TCP Retransmission] 443  >  50060 [PSH, ACK] Seq=13657 Ack=302632 Win=3963 Len=71"
424,53.2971466,172.20.40.110,151.101.194.187,TCP,66,50060  >  443 [ACK] Seq=302632 Ack=13728 Win=257 Len=0 SLE=13657 SRE=13728
425,53.3849169,172.20.40.110,151.101.194.187,TLSv1.2,2940,Application Data
426,53.3958587,151.101.194.187,172.20.40.110,TCP,60,443  >  50060 [ACK] Seq=13728 Ack=305518 Win=3963 Len=0
427,53.3990528,151.101.194.187,172.20.40.110,TLSv1.2,124,Application Data
428,53.4372773,151.101.194.187,172.20.40.110,TCP,124,"[TCP Retransmission] 443  >  50060 [PSH, ACK] Seq=13728 Ack=305518 Win=3963 Len=70"
429,53.4373381,172.20.40.110,151.101.194.187,TCP,66,50060  >  443 [ACK] Seq=305518 Ack=13798 Win=256 Len=0 SLE=13728 SRE=13798
430,53.5074597,172.20.40.110,151.101.194.187,TLSv1.2,2943,Application Data
431,53.5089695,172.20.40.110,151.101.194.187,TLSv1.2,2942,Application Data
432,53.5092036,172.20.40.110,151.101.194.187,TLSv1.2,2939,Application Data
433,53.5093158,172.20.40.110,151.101.194.187,TLSv1.2,2940,Application Data
434,53.5094029,172.20.40.110,151.101.194.187,TLSv1.2,2942,Application Data
435,53.5100507,172.20.40.110,151.101.194.187,TLSv1.2,2941,Application Data
436,53.5105736,172.20.40.110,151.101.194.187,TLSv1.2,2938,Application Data
437,53.5235223,151.101.194.187,172.20.40.110,TCP,60,443  >  50060 [ACK] Seq=13798 Ack=308407 Win=3963 Len=0
438,53.5235223,151.101.194.187,172.20.40.110,TCP,60,443  >  50060 [ACK] Seq=13798 Ack=311295 Win=3963 Len=0
439,53.5472618,151.101.194.187,172.20.40.110,TLSv1.2,135,Application Data
440,53.5472618,151.101.194.187,172.20.40.110,TLSv1.2,125,Application Data
441,53.5472618,151.101.194.187,172.20.40.110,TCP,60,443  >  50060 [ACK] Seq=13950 Ack=314180 Win=3963 Len=0
442,53.5473593,172.20.40.110,151.101.194.187,TCP,54,50060  >  443 [ACK] Seq=325725 Ack=13950 Win=256 Len=0
443,53.5511232,151.101.194.187,172.20.40.110,TLSv1.2,130,Application Data
444,53.5528305,151.101.194.187,172.20.40.110,TCP,60,443  >  50060 [ACK] Seq=14026 Ack=317066 Win=3969 Len=0
445,53.5528305,151.101.194.187,172.20.40.110,TCP,60,443  >  50060 [ACK] Seq=14026 Ack=319954 Win=3969 Len=0
446,53.5528305,151.101.194.187,172.20.40.110,TCP,60,443  >  50060 [ACK] Seq=14026 Ack=322841 Win=3969 Len=0
447,53.5528305,151.101.194.187,172.20.40.110,TCP,60,443  >  50060 [ACK] Seq=14026 Ack=325725 Win=3969 Len=0
448,53.5582926,151.101.194.187,172.20.40.110,TLSv1.2,179,Application Data
449,53.5583874,172.20.40.110,151.101.194.187,TCP,54,50060  >  443 [ACK] Seq=325725 Ack=14151 Win=255 Len=0
450,53.5593084,151.101.194.187,172.20.40.110,TLSv1.2,124,Application Data
451,53.5604579,151.101.194.187,172.20.40.110,TLSv1.2,168,Application Data
452,53.5605291,172.20.40.110,151.101.194.187,TCP,54,50060  >  443 [ACK] Seq=325725 Ack=14335 Win=254 Len=0
453,53.7332118,172.20.40.110,151.101.194.187,TLSv1.2,2904,Application Data
454,53.7390943,172.20.40.110,151.101.194.187,TLSv1.2,2933,Application Data
455,53.7425535,151.101.194.187,172.20.40.110,TCP,60,443  >  50060 [ACK] Seq=14335 Ack=328575 Win=3969 Len=0
456,53.7470373,151.101.194.187,172.20.40.110,TLSv1.2,389,Application Data
457,53.7491,151.101.194.187,172.20.40.110,TCP,60,443  >  50060 [ACK] Seq=14670 Ack=331454 Win=3969 Len=0
458,53.7536218,151.101.194.187,172.20.40.110,TLSv1.2,130,Application Data
459,53.753721,172.20.40.110,151.101.194.187,TCP,54,50060  >  443 [ACK] Seq=331454 Ack=14746 Win=258 Len=0
