"No.","Time","Source","Destination","Protocol","Length","Info"
"1","0.000000000","172.20.40.110","151.101.66.187","TCP","66","53333  >  443 [SYN] Seq=0 Win=64240 Len=0 MSS=1460 WS=256 SACK_PERM"
"2","0.007455600","151.101.66.187","172.20.40.110","TCP","66","443  >  53333 [SYN, ACK] Seq=0 Ack=1 Win=65535 Len=0 MSS=1380 SACK_PERM WS=512"
"3","0.007599200","172.20.40.110","151.101.66.187","TCP","54","53333  >  443 [ACK] Seq=1 Ack=1 Win=131072 Len=0"
"4","0.009476300","172.20.40.110","151.101.66.187","TLSv1.3","2001","Client Hello (SNI=www.target.com)"
"5","0.017888700","151.101.66.187","172.20.40.110","TCP","60","443  >  53333 [ACK] Seq=1 Ack=1381 Win=144896 Len=0"
"6","0.020772700","151.101.66.187","172.20.40.110","TCP","60","443  >  53333 [ACK] Seq=1 Ack=1948 Win=144384 Len=0"
"7","0.020772700","151.101.66.187","172.20.40.110","TLSv1.3","1434","Server Hello, Change Cipher Spec, Application Data, Application Data"
"8","0.020772700","151.101.66.187","172.20.40.110","TLSv1.3","215","Application Data"
"9","0.020917600","172.20.40.110","151.101.66.187","TCP","54","53333  >  443 [ACK] Seq=1948 Ack=1542 Win=131072 Len=0"
"10","0.023311000","172.20.40.110","151.101.66.187","TLSv1.3","118","Change Cipher Spec, Application Data"
"11","0.024309700","172.20.40.110","151.101.66.187","TLSv1.3","146","Application Data"
"12","0.024838400","172.20.40.110","151.101.66.187","TLSv1.3","2813","Application Data"
"13","0.030239800","151.101.66.187","172.20.40.110","TCP","60","443  >  53333 [ACK] Seq=1542 Ack=2012 Win=144384 Len=0"
"14","0.031363300","151.101.66.187","172.20.40.110","TCP","60","443  >  53333 [ACK] Seq=1542 Ack=2104 Win=144384 Len=0"
"15","0.031363300","151.101.66.187","172.20.40.110","TLSv1.3","119","Application Data"
"16","0.031950100","172.20.40.110","151.101.66.187","TLSv1.3","85","Application Data"
"17","0.034611200","151.101.66.187","172.20.40.110","TCP","60","443  >  53333 [ACK] Seq=1607 Ack=4863 Win=141824 Len=0"
"18","0.038746300","151.101.66.187","172.20.40.110","TCP","60","443  >  53333 [ACK] Seq=1607 Ack=4894 Win=141824 Len=0"
"19","0.152431800","151.101.66.187","172.20.40.110","TCP","1434","443  >  53333 [ACK] Seq=1607 Ack=4894 Win=141824 Len=1380 [TCP PDU reassembled in 20]"
"20","0.152431800","151.101.66.187","172.20.40.110","TLSv1.3","377","Application Data, Application Data"
"21","0.152431800","151.101.66.187","172.20.40.110","TLSv1.3","4194","Application Data, Application Data"
"22","0.152560800","172.20.40.110","151.101.66.187","TCP","54","53333  >  443 [ACK] Seq=4894 Ack=7450 Win=131072 Len=0"
"23","0.156759500","151.101.66.187","172.20.40.110","TLSv1.3","1434","Application Data"
"24","0.156759500","151.101.66.187","172.20.40.110","TLSv1.3","1434","Application Data"
"25","0.156884800","172.20.40.110","151.101.66.187","TCP","54","53333  >  443 [ACK] Seq=4894 Ack=10210 Win=131072 Len=0"
"26","0.159021000","151.101.66.187","172.20.40.110","TLSv1.3","1434","Application Data"
"27","0.159021000","151.101.66.187","172.20.40.110","TLSv1.3","8334","Application Data, Application Data, Application Data, Application Data, Application Data, Application Data"
"28","0.159140600","172.20.40.110","151.101.66.187","TCP","54","53333  >  443 [ACK] Seq=4894 Ack=19870 Win=131072 Len=0"
"29","0.163481100","151.101.66.187","172.20.40.110","TLSv1.3","1434","Application Data"
"30","0.163481100","151.101.66.187","172.20.40.110","TLSv1.3","1434","Application Data"
"31","0.163481100","151.101.66.187","172.20.40.110","TLSv1.3","1434","Application Data"
"32","0.163481100","151.101.66.187","172.20.40.110","TLSv1.3","1434","Application Data"
"33","0.163616600","172.20.40.110","151.101.66.187","TCP","54","53333  >  443 [ACK] Seq=4894 Ack=25390 Win=131072 Len=0"
"34","0.174970800","151.101.66.187","172.20.40.110","TLSv1.3","1434","Application Data"
"35","0.174970800","151.101.66.187","172.20.40.110","TLSv1.3","1434","Application Data"
"36","0.174970800","151.101.66.187","172.20.40.110","TLSv1.3","1434","Application Data"
"37","0.174970800","151.101.66.187","172.20.40.110","TLSv1.3","1434","Application Data"
"38","0.175102700","172.20.40.110","151.101.66.187","TCP","54","53333  >  443 [ACK] Seq=4894 Ack=30910 Win=131072 Len=0"
"39","0.181870400","151.101.66.187","172.20.40.110","TLSv1.3","1434","Application Data"
"40","0.181870400","151.101.66.187","172.20.40.110","TLSv1.3","1434","Application Data"
"41","0.181870400","151.101.66.187","172.20.40.110","TLSv1.3","1434","Application Data"
"42","0.181870400","151.101.66.187","172.20.40.110","TLSv1.3","1434","Application Data"
"43","0.182010100","172.20.40.110","151.101.66.187","TCP","54","53333  >  443 [ACK] Seq=4894 Ack=36430 Win=131072 Len=0"
"44","0.185112500","172.20.40.110","151.101.66.187","TLSv1.2","89","Application Data"
"45","0.186034200","172.20.40.110","151.101.66.187","TLSv1.2","90","Application Data"
"46","0.186179200","172.20.40.110","151.101.66.187","TLSv1.2","90","Application Data"
"47","0.186425600","172.20.40.110","151.101.66.187","TLSv1.2","89","Application Data"
"48","0.190140100","151.101.66.187","172.20.40.110","TLSv1.3","1434","Application Data"
"49","0.191934600","172.20.40.110","151.101.66.187","TLSv1.2","89","Application Data"
"50","0.192113400","151.101.66.187","172.20.40.110","TLSv1.3","1434","Application Data"
"51","0.192206700","172.20.40.110","151.101.66.187","TCP","54","53333  >  443 [ACK] Seq=4894 Ack=39190 Win=131072 Len=0"
"52","0.193438000","172.20.40.110","151.101.66.187","TLSv1.2","89","Application Data"
"53","0.193637200","172.20.40.110","151.101.66.187","TCP","54","62303  >  443 [FIN, ACK] Seq=213 Ack=1 Win=506 Len=0"
"54","0.195308800","151.101.66.187","172.20.40.110","TLSv1.3","1434","Application Data"
"55","0.195308800","151.101.66.187","172.20.40.110","TLSv1.3","1434","Application Data"
"56","0.195308800","151.101.66.187","172.20.40.110","TLSv1.3","1434","Application Data"
"57","0.195308800","151.101.66.187","172.20.40.110","TLSv1.3","1434","Application Data"
"58","0.195439600","172.20.40.110","151.101.66.187","TCP","54","53333  >  443 [ACK] Seq=4894 Ack=44710 Win=131072 Len=0"
"59","0.207565100","151.101.66.187","172.20.40.110","TLSv1.3","1434","Application Data"
"60","0.207565100","151.101.66.187","172.20.40.110","TLSv1.3","1434","Application Data"
"61","0.207565100","151.101.66.187","172.20.40.110","TLSv1.3","1434","Application Data"
"62","0.207791800","172.20.40.110","151.101.66.187","TCP","54","53333  >  443 [ACK] Seq=4894 Ack=48850 Win=131072 Len=0"
"63","0.212002800","151.101.66.187","172.20.40.110","TLSv1.3","1434","Application Data"
"64","0.212002800","151.101.66.187","172.20.40.110","TLSv1.3","1434","Application Data"
"65","0.212002800","151.101.66.187","172.20.40.110","TLSv1.3","1434","Application Data"
"66","0.212002800","151.101.66.187","172.20.40.110","TLSv1.3","2814","Application Data, Application Data"
"67","0.212105100","172.20.40.110","151.101.66.187","TCP","54","53333  >  443 [ACK] Seq=4894 Ack=55750 Win=131072 Len=0"
"68","0.214015000","151.101.66.187","172.20.40.110","TLSv1.3","1434","Application Data"
"69","0.215657800","151.101.66.187","172.20.40.110","TLSv1.3","1434","Application Data"
"70","0.215657800","151.101.66.187","172.20.40.110","TLSv1.3","426","Application Data"
"71","0.215657800","151.101.66.187","172.20.40.110","TCP","60","443  >  62303 [ACK] Seq=21985 Ack=36 Win=204 Len=0"
"72","0.215657800","151.101.66.187","172.20.40.110","TCP","60","443  >  62303 [ACK] Seq=21985 Ack=72 Win=204 Len=0"
"73","0.215657800","151.101.66.187","172.20.40.110","TCP","60","443  >  62303 [ACK] Seq=21985 Ack=108 Win=204 Len=0"
"74","0.215657800","151.101.66.187","172.20.40.110","TCP","60","443  >  62303 [ACK] Seq=21985 Ack=143 Win=204 Len=0"
"75","0.215657800","151.101.66.187","172.20.40.110","TCP","60","443  >  62303 [ACK] Seq=21985 Ack=178 Win=204 Len=0"
"76","0.215657800","151.101.66.187","172.20.40.110","TCP","60","443  >  62303 [ACK] Seq=21985 Ack=213 Win=204 Len=0"
"77","0.215657800","151.101.66.187","172.20.40.110","TCP","60","443  >  62303 [ACK] Seq=21985 Ack=214 Win=204 Len=0"
"78","0.215877000","172.20.40.110","151.101.66.187","TCP","54","53333  >  443 [ACK] Seq=4894 Ack=58882 Win=131072 Len=0"
"79","0.332331100","172.20.40.110","151.101.66.187","TLSv1.3","2728","Application Data"
"80","0.341520400","151.101.66.187","172.20.40.110","TCP","60","443  >  53333 [ACK] Seq=58882 Ack=7568 Win=139264 Len=0"
"81","0.344994500","151.101.66.187","172.20.40.110","TLSv1.3","224","Application Data"
"82","0.344994500","151.101.66.187","172.20.40.110","TLSv1.3","407","Application Data"
"83","0.345178100","172.20.40.110","151.101.66.187","TCP","54","53333  >  443 [ACK] Seq=7568 Ack=59405 Win=130560 Len=0"
"84","0.352048100","172.20.40.110","151.101.66.187","TLSv1.3","2772","Application Data"
"85","0.353320600","172.20.40.110","151.101.66.187","TLSv1.3","2791","Application Data"
"86","0.362886800","151.101.66.187","172.20.40.110","TCP","60","443  >  53333 [ACK] Seq=59405 Ack=10286 Win=137216 Len=0"
"87","0.365879700","172.20.40.110","151.101.66.187","TLSv1.3","2788","Application Data"
"88","0.366054400","151.101.66.187","172.20.40.110","TLSv1.3","124","Application Data"
"89","0.366142300","172.20.40.110","151.101.66.187","TLSv1.3","2790","Application Data"
"90","0.366500300","172.20.40.110","151.101.66.187","TLSv1.3","2785","Application Data"
"91","0.366810500","172.20.40.110","151.101.66.187","TLSv1.3","2785","Application Data"
"92","0.367840600","172.20.40.110","151.101.66.187","TLSv1.3","2723","Application Data"
"93","0.370554700","151.101.66.187","172.20.40.110","TCP","60","443  >  53333 [ACK] Seq=59475 Ack=13023 Win=137216 Len=0"
"94","0.372110700","151.101.66.187","172.20.40.110","TLSv1.3","131","Application Data"
"95","0.379912000","151.101.66.187","172.20.40.110","TCP","60","443  >  53333 [ACK] Seq=59552 Ack=15757 Win=137216 Len=0"
"96","0.386260700","151.101.66.187","172.20.40.110","TLSv1.3","124","Application Data"
"97","0.386260700","151.101.66.187","172.20.40.110","TCP","60","443  >  53333 [ACK] Seq=59622 Ack=18493 Win=137216 Len=0"
"98","0.386260700","151.101.66.187","172.20.40.110","TLSv1.3","124","Application Data"
"99","0.386358900","172.20.40.110","151.101.66.187","TCP","54","53333  >  443 [ACK] Seq=26624 Ack=59692 Win=130048 Len=0"
"100","0.389961500","151.101.66.187","172.20.40.110","TCP","60","443  >  53333 [ACK] Seq=59692 Ack=21224 Win=137216 Len=0"
"101","0.391953600","151.101.66.187","172.20.40.110","TCP","60","443  >  53333 [ACK] Seq=59692 Ack=23955 Win=137216 Len=0"
"102","0.391953600","151.101.66.187","172.20.40.110","TLSv1.3","128","Application Data"
"103","0.392023800","172.20.40.110","151.101.66.187","TCP","54","53333  >  443 [ACK] Seq=26624 Ack=59766 Win=130048 Len=0"
"104","0.393436400","151.101.66.187","172.20.40.110","TLSv1.3","125","Application Data"
"105","0.397613500","151.101.66.187","172.20.40.110","TCP","60","443  >  53333 [ACK] Seq=59837 Ack=26624 Win=137216 Len=0"
"106","0.400088500","151.101.66.187","172.20.40.110","TLSv1.3","393","Application Data"
"107","0.400151300","172.20.40.110","151.101.66.187","TCP","54","53333  >  443 [ACK] Seq=26624 Ack=60176 Win=129792 Len=0"
"108","0.464050700","172.20.40.110","151.101.66.187","TLSv1.3","2774","Application Data"
"109","0.464545800","172.20.40.110","151.101.66.187","TLSv1.3","2776","Application Data"
"110","0.464778700","172.20.40.110","151.101.66.187","TLSv1.3","2774","Application Data"
"111","0.474375000","151.101.66.187","172.20.40.110","TCP","60","443  >  53333 [ACK] Seq=60176 Ack=29344 Win=137216 Len=0"
"112","0.477177700","151.101.66.187","172.20.40.110","TCP","60","443  >  53333 [ACK] Seq=60176 Ack=32066 Win=137216 Len=0"
"113","0.480206000","151.101.66.187","172.20.40.110","TLSv1.3","126","Application Data"
"114","0.480206000","151.101.66.187","172.20.40.110","TLSv1.3","146","Application Data"
"115","0.480206000","151.101.66.187","172.20.40.110","TCP","60","443  >  53333 [ACK] Seq=60340 Ack=34786 Win=137216 Len=0"
"116","0.480317700","172.20.40.110","151.101.66.187","TCP","54","53333  >  443 [ACK] Seq=34786 Ack=60340 Win=131072 Len=0"
"117","0.481315000","151.101.66.187","172.20.40.110","TLSv1.3","156","Application Data"
"118","0.482419400","172.20.40.110","151.101.66.187","TLSv1.3","2731","Application Data"
"119","0.482992200","172.20.40.110","151.101.66.187","TLSv1.3","2724","Application Data"
"120","0.483405100","172.20.40.110","151.101.66.187","TLSv1.3","2731","Application Data"
"121","0.491657800","151.101.66.187","172.20.40.110","TCP","60","443  >  53333 [ACK] Seq=60442 Ack=37463 Win=137216 Len=0"
"122","0.495413500","151.101.66.187","172.20.40.110","TCP","60","443  >  53333 [ACK] Seq=60442 Ack=40133 Win=137216 Len=0"
"123","0.495413500","151.101.66.187","172.20.40.110","TLSv1.3","288","Application Data"
"124","0.495413500","151.101.66.187","172.20.40.110","TLSv1.3","517","Application Data"
"125","0.495501700","172.20.40.110","151.101.66.187","TCP","54","53333  >  443 [ACK] Seq=42810 Ack=61139 Win=130048 Len=0"
"126","0.497070000","151.101.66.187","172.20.40.110","TLSv1.3","139","Application Data"
"127","0.497070000","151.101.66.187","172.20.40.110","TCP","1434","443  >  53333 [ACK] Seq=61224 Ack=41513 Win=138752 Len=1380 [TCP PDU reassembled in 128]"
"128","0.497070000","151.101.66.187","172.20.40.110","TLSv1.3","1423","Application Data, Application Data"
"129","0.497070000","151.101.66.187","172.20.40.110","TCP","60","443  >  53333 [ACK] Seq=63973 Ack=42810 Win=137728 Len=0"
"130","0.497195400","172.20.40.110","151.101.66.187","TCP","54","53333  >  443 [ACK] Seq=42810 Ack=63973 Win=131072 Len=0"
"131","0.499876400","151.101.66.187","172.20.40.110","TLSv1.3","629","Application Data"
"132","0.499936600","172.20.40.110","151.101.66.187","TCP","54","53333  >  443 [ACK] Seq=42810 Ack=64548 Win=130304 Len=0"
"133","0.516264600","172.20.40.110","151.101.66.187","TLSv1.3","2730","Application Data"
"134","0.518217000","172.20.40.110","151.101.66.187","TLSv1.3","2725","Application Data"
"135","0.527360200","151.101.66.187","172.20.40.110","TCP","60","443  >  53333 [ACK] Seq=64548 Ack=45486 Win=137216 Len=0"
"136","0.528504200","172.20.40.110","151.101.66.187","TLSv1.3","2725","Application Data"
"137","0.531240900","172.20.40.110","151.101.66.187","TLSv1.3","2728","Application Data"
"138","0.533266100","151.101.66.187","172.20.40.110","TLSv1.3","768","Application Data"
"139","0.533266100","151.101.66.187","172.20.40.110","TCP","60","443  >  53333 [ACK] Seq=65262 Ack=48157 Win=137216 Len=0"
"140","0.537040200","151.101.66.187","172.20.40.110","TLSv1.3","1023","Application Data"
"141","0.537109300","172.20.40.110","151.101.66.187","TCP","54","53333  >  443 [ACK] Seq=53502 Ack=66231 Win=131072 Len=0"
"142","0.538179100","151.101.66.187","172.20.40.110","TCP","60","443  >  53333 [ACK] Seq=66231 Ack=50828 Win=137216 Len=0"
"143","0.541853900","172.20.40.110","151.101.66.187","TLSv1.3","2725","Application Data"
"144","0.545932400","151.101.66.187","172.20.40.110","TCP","60","443  >  53333 [ACK] Seq=66231 Ack=53502 Win=137216 Len=0"
"145","0.545932400","151.101.66.187","172.20.40.110","TLSv1.3","828","Application Data"
"146","0.546259400","172.20.40.110","151.101.66.187","TLSv1.3","2730","Application Data"
"147","0.548171200","151.101.66.187","172.20.40.110","TLSv1.3","132","Application Data"
"148","0.549976700","151.101.66.187","172.20.40.110","TLSv1.3","798","Application Data"
"149","0.550215500","172.20.40.110","151.101.66.187","TCP","54","53333  >  443 [ACK] Seq=58849 Ack=67827 Win=131072 Len=0"
"150","0.551598900","151.101.66.187","172.20.40.110","TCP","60","443  >  53333 [ACK] Seq=67827 Ack=56173 Win=137216 Len=0"
"151","0.552841400","172.20.40.110","151.101.66.187","TLSv1.3","2722","Application Data"
"152","0.553420500","172.20.40.110","151.101.66.187","TLSv1.3","2723","Application Data"
"153","0.560773500","151.101.66.187","172.20.40.110","TCP","1434","443  >  53333 [ACK] Seq=67827 Ack=56173 Win=138752 Len=1380 [TCP PDU reassembled in 154]"
"154","0.560773500","151.101.66.187","172.20.40.110","TLSv1.3","65","Application Data"
"155","0.560773500","151.101.66.187","172.20.40.110","TCP","60","443  >  53333 [ACK] Seq=69218 Ack=58849 Win=137216 Len=0"
"156","0.560878100","172.20.40.110","151.101.66.187","TCP","54","53333  >  443 [ACK] Seq=64186 Ack=69218 Win=131072 Len=0"
"157","0.565612300","151.101.66.187","172.20.40.110","TLSv1.3","133","Application Data"
"158","0.565612300","151.101.66.187","172.20.40.110","TLSv1.3","651","Application Data"
"159","0.565612300","151.101.66.187","172.20.40.110","TCP","60","443  >  53333 [ACK] Seq=69894 Ack=61517 Win=137216 Len=0"
"160","0.565612300","151.101.66.187","172.20.40.110","TLSv1.3","132","Application Data"
"161","0.565728300","172.20.40.110","151.101.66.187","TCP","54","53333  >  443 [ACK] Seq=64186 Ack=69972 Win=130304 Len=0"
"162","0.566544400","151.101.66.187","172.20.40.110","TLSv1.3","556","Application Data"
"163","0.566618100","172.20.40.110","151.101.66.187","TCP","54","53333  >  443 [ACK] Seq=64186 Ack=70474 Win=129792 Len=0"
"164","0.568358900","151.101.66.187","172.20.40.110","TCP","60","443  >  53333 [ACK] Seq=70474 Ack=64186 Win=137216 Len=0"
"165","0.571205200","151.101.66.187","172.20.40.110","TLSv1.3","156","Application Data"
"166","0.571205200","151.101.66.187","172.20.40.110","TLSv1.3","751","Application Data"
"167","0.571319500","172.20.40.110","151.101.66.187","TCP","54","53333  >  443 [ACK] Seq=64186 Ack=71273 Win=131072 Len=0"
"168","1.507417500","172.20.40.110","151.101.66.187","TLSv1.3","2722","Application Data"
"169","1.508710800","172.20.40.110","151.101.66.187","TLSv1.3","2778","Application Data"
"170","1.516382400","151.101.66.187","172.20.40.110","TCP","60","443  >  53333 [ACK] Seq=71273 Ack=66854 Win=137216 Len=0"
"171","1.520546600","151.101.66.187","172.20.40.110","TLSv1.3","249","Application Data"
"172","1.523869700","151.101.66.187","172.20.40.110","TLSv1.3","474","Application Data"
"173","1.523956000","172.20.40.110","151.101.66.187","TCP","54","53333  >  443 [ACK] Seq=69578 Ack=71888 Win=130304 Len=0"
"174","1.527024700","151.101.66.187","172.20.40.110","TCP","60","443  >  53333 [ACK] Seq=71888 Ack=68234 Win=138752 Len=0"
"175","1.527024700","151.101.66.187","172.20.40.110","TCP","60","443  >  53333 [ACK] Seq=71888 Ack=69578 Win=137728 Len=0"
"176","1.529221800","151.101.66.187","172.20.40.110","TLSv1.3","124","Application Data"
"177","1.561422200","151.101.66.187","172.20.40.110","TCP","124","[TCP Retransmission] 443  >  53333 [PSH, ACK] Seq=71888 Ack=69578 Win=138752 Len=70"
"178","1.561492300","172.20.40.110","151.101.66.187","TCP","66","53333  >  443 [ACK] Seq=69578 Ack=71958 Win=130304 Len=0 SLE=71888 SRE=71958"
"179","1.641037400","172.20.40.110","151.101.66.187","TCP","54","53333  >  443 [FIN, ACK] Seq=69578 Ack=71958 Win=130304 Len=0"
"180","1.648690400","151.101.66.187","172.20.40.110","TCP","60","443  >  53333 [ACK] Seq=71958 Ack=69579 Win=138752 Len=0"
"181","1.648690400","151.101.66.187","172.20.40.110","TLSv1.3","78","Application Data"
"182","1.648690400","151.101.66.187","172.20.40.110","TCP","60","443  >  53333 [FIN, ACK] Seq=71982 Ack=69579 Win=138752 Len=0"
"183","1.648794800","172.20.40.110","151.101.66.187","TCP","54","53333  >  443 [RST, ACK] Seq=69579 Ack=71982 Win=0 Len=0"
"184","3.696634200","172.20.40.110","151.101.130.187","TCP","66","62995  >  443 [SYN] Seq=0 Win=64240 Len=0 MSS=1460 WS=256 SACK_PERM"
"185","3.706990400","151.101.130.187","172.20.40.110","TCP","66","443  >  62995 [SYN, ACK] Seq=0 Ack=1 Win=65535 Len=0 MSS=1380 SACK_PERM WS=512"
"186","3.707224800","172.20.40.110","151.101.130.187","TCP","54","62995  >  443 [ACK] Seq=1 Ack=1 Win=131072 Len=0"
"187","3.710673300","172.20.40.110","151.101.130.187","TLSv1.3","2065","Client Hello (SNI=www.target.com)"
"188","3.745250000","172.20.40.110","151.101.130.187","TCP","1434","[TCP Retransmission] 62995  >  443 [PSH, ACK] Seq=632 Ack=1 Win=131072 Len=1380"
"189","3.775806200","151.101.130.187","172.20.40.110","TCP","60","443  >  62995 [ACK] Seq=1 Ack=1381 Win=144896 Len=0"
"190","3.775806200","151.101.130.187","172.20.40.110","TCP","60","443  >  62995 [ACK] Seq=1 Ack=2012 Win=144384 Len=0"
"191","3.775806200","151.101.130.187","172.20.40.110","TLSv1.3","1434","Server Hello, Change Cipher Spec, Application Data, Application Data"
"192","3.775806200","151.101.130.187","172.20.40.110","TLSv1.3","215","Application Data"
"193","3.776053900","172.20.40.110","151.101.130.187","TCP","54","62995  >  443 [ACK] Seq=2012 Ack=1542 Win=131072 Len=0"
"194","3.778101200","172.20.40.110","151.101.130.187","TLSv1.3","118","Change Cipher Spec, Application Data"
"195","3.779137100","172.20.40.110","151.101.130.187","TLSv1.3","146","Application Data"
"196","3.785614700","172.20.40.110","151.101.130.187","TLSv1.3","2778","Application Data"
"197","3.785900200","172.20.40.110","151.101.130.187","TLSv1.3","2959","Application Data"
"198","3.786106600","172.20.40.110","151.101.130.187","TLSv1.3","2994","Application Data"
"199","3.786335200","172.20.40.110","151.101.130.187","TLSv1.3","2789","Application Data"
"200","3.786753400","172.20.40.110","151.101.130.187","TLSv1.3","2792","Application Data"
"201","3.787075500","172.20.40.110","151.101.130.187","TCP","1434","62995  >  443 [ACK] Seq=16210 Ack=1542 Win=131072 Len=1380 [TCP PDU reassembled in 209]"
"202","3.817412700","151.101.130.187","172.20.40.110","TCP","66","[TCP Dup ACK 190#1] 443  >  62995 [ACK] Seq=1542 Ack=2012 Win=144384 Len=0 SLE=632 SRE=2012"
"203","3.817412700","151.101.130.187","172.20.40.110","TCP","215","[TCP Spurious Retransmission] 443  >  62995 [PSH, ACK] Seq=1381 Ack=2012 Win=144384 Len=161 [TCP PDU reassembled in 192]"
"204","3.817412700","151.101.130.187","172.20.40.110","TCP","60","443  >  62995 [ACK] Seq=1542 Ack=2076 Win=144384 Len=0"
"205","3.817412700","151.101.130.187","172.20.40.110","TCP","60","443  >  62995 [ACK] Seq=1542 Ack=2168 Win=144384 Len=0"
"206","3.817412700","151.101.130.187","172.20.40.110","TLSv1.3","119","Application Data"
"207","3.817892600","172.20.40.110","151.101.130.187","TCP","66","[TCP Dup ACK 193#1] 62995  >  443 [ACK] Seq=17590 Ack=1542 Win=131072 Len=0 SLE=1381 SRE=1542"
"208","3.818082600","151.101.130.187","172.20.40.110","TCP","60","443  >  62995 [ACK] Seq=1607 Ack=4892 Win=141824 Len=0"
"209","3.818141100","172.20.40.110","151.101.130.187","TLSv1.3","5574","Application Data, Application Data"
"210","3.818779600","151.101.130.187","172.20.40.110","TLSv1.3","450","Application Data"
"211","3.818779600","151.101.130.187","172.20.40.110","TCP","60","443  >  62995 [ACK] Seq=2003 Ack=7797 Win=139776 Len=0"
"212","3.818830400","172.20.40.110","151.101.130.187","TLSv1.3","5574","Application Data, Application Data"
"213","3.836649600","151.101.130.187","172.20.40.110","TCP","60","443  >  62995 [ACK] Seq=2003 Ack=10737 Win=137216 Len=0"
"214","3.836649600","151.101.130.187","172.20.40.110","TCP","60","443  >  62995 [ACK] Seq=2003 Ack=13472 Win=137216 Len=0"
"215","3.836649600","151.101.130.187","172.20.40.110","TLSv1.3","131","Application Data"
"216","3.836649600","151.101.130.187","172.20.40.110","TCP","60","443  >  62995 [ACK] Seq=2080 Ack=16210 Win=137216 Len=0"
"217","3.836888000","172.20.40.110","151.101.130.187","TLSv1.3","11094","Application Data, Application Data, Application Data, Application Data"
"218","3.837090300","172.20.40.110","151.101.130.187","TLSv1.3","5574","Application Data, Application Data"
"219","3.837203300","151.101.130.187","172.20.40.110","TLSv1.3","131","Application Data"
"220","3.847189300","151.101.130.187","172.20.40.110","TCP","60","443  >  62995 [ACK] Seq=2157 Ack=17590 Win=138752 Len=0"
"221","3.847470800","172.20.40.110","151.101.130.187","TLSv1.3","2814","Application Data"
"222","3.849676900","151.101.130.187","172.20.40.110","TCP","60","443  >  62995 [ACK] Seq=2157 Ack=18970 Win=137728 Len=0"
"223","3.849765700","172.20.40.110","151.101.130.187","TLSv1.3","2814","Application Data"
"224","3.851289500","151.101.130.187","172.20.40.110","TLSv1.3","130","Application Data"
"225","3.856566000","151.101.130.187","172.20.40.110","TCP","60","443  >  62995 [ACK] Seq=2233 Ack=20350 Win=138752 Len=0"
"226","3.856566000","151.101.130.187","172.20.40.110","TCP","60","443  >  62995 [ACK] Seq=2233 Ack=21730 Win=137728 Len=0"
"227","3.856644400","172.20.40.110","151.101.130.187","TLSv1.3","5574","Application Data, Application Data"
"228","3.859060500","151.101.130.187","172.20.40.110","TLSv1.3","130","Application Data"
"229","3.862170600","151.101.130.187","172.20.40.110","TCP","60","443  >  62995 [ACK] Seq=2309 Ack=24490 Win=137216 Len=0"
"230","3.862244400","172.20.40.110","151.101.130.187","TLSv1.3","5574","Application Data, Application Data"
"231","3.866842700","151.101.130.187","172.20.40.110","TCP","60","443  >  62995 [ACK] Seq=2309 Ack=27250 Win=137216 Len=0"
"232","3.866914200","172.20.40.110","151.101.130.187","TLSv1.3","5574","Application Data, Application Data"
"233","3.874395500","151.101.130.187","172.20.40.110","TLSv1.3","130","Application Data"
"234","3.874470600","172.20.40.110","151.101.130.187","TLSv1.3","2814","Application Data"
"235","3.885916600","151.101.130.187","172.20.40.110","TCP","60","443  >  62995 [ACK] Seq=2385 Ack=31390 Win=138752 Len=0"
"236","3.885982900","172.20.40.110","151.101.130.187","TLSv1.3","5574","Application Data, Application Data"
"237","3.888652900","151.101.130.187","172.20.40.110","TLSv1.3","126","Application Data"
"238","3.888744700","172.20.40.110","151.101.130.187","TLSv1.3","2814","Application Data"
"239","3.892763000","151.101.130.187","172.20.40.110","TCP","60","443  >  62995 [ACK] Seq=2457 Ack=35530 Win=138752 Len=0"
"240","3.892845200","172.20.40.110","151.101.130.187","TLSv1.3","1160","Application Data, Application Data"
"241","3.895690300","151.101.130.187","172.20.40.110","TCP","60","443  >  62995 [ACK] Seq=2457 Ack=38290 Win=138752 Len=0"
"242","3.897192800","151.101.130.187","172.20.40.110","TLSv1.3","131","Application Data"
"243","3.898776600","151.101.130.187","172.20.40.110","TLSv1.3","124","Application Data"
"244","3.898879000","172.20.40.110","151.101.130.187","TCP","54","62995  >  443 [ACK] Seq=79416 Ack=2604 Win=129792 Len=0"
"245","3.908732400","151.101.130.187","172.20.40.110","TCP","60","443  >  62995 [ACK] Seq=2604 Ack=41050 Win=138752 Len=0"
"246","3.915449100","151.101.130.187","172.20.40.110","TCP","60","443  >  62995 [ACK] Seq=2604 Ack=43810 Win=138752 Len=0"
"247","3.915449100","151.101.130.187","172.20.40.110","TLSv1.3","131","Application Data"
"248","3.919858300","151.101.130.187","172.20.40.110","TCP","60","443  >  62995 [ACK] Seq=2681 Ack=46570 Win=137216 Len=0"
"249","3.919858300","151.101.130.187","172.20.40.110","TLSv1.3","128","Application Data"
"250","3.919966100","172.20.40.110","151.101.130.187","TCP","54","62995  >  443 [ACK] Seq=79416 Ack=2755 Win=129792 Len=0"
"251","3.921371700","151.101.130.187","172.20.40.110","TCP","60","443  >  62995 [ACK] Seq=2755 Ack=49330 Win=137216 Len=0"
"252","3.921371700","151.101.130.187","172.20.40.110","TLSv1.3","131","Application Data"
"253","3.933103200","151.101.130.187","172.20.40.110","TLSv1.3","125","Application Data"
"254","3.933103200","151.101.130.187","172.20.40.110","TCP","60","443  >  62995 [ACK] Seq=2903 Ack=53470 Win=138752 Len=0"
"255","3.933295400","172.20.40.110","151.101.130.187","TCP","54","62995  >  443 [ACK] Seq=79416 Ack=2903 Win=129536 Len=0"
"256","3.938996500","151.101.130.187","172.20.40.110","TLSv1.3","169","Application Data"
"257","3.938996500","151.101.130.187","172.20.40.110","TCP","60","443  >  62995 [ACK] Seq=3018 Ack=56230 Win=138752 Len=0"
"258","3.938996500","151.101.130.187","172.20.40.110","TLSv1.3","406","Application Data"
"259","3.939108100","172.20.40.110","151.101.130.187","TCP","54","62995  >  443 [ACK] Seq=79416 Ack=3370 Win=131072 Len=0"
"260","3.946318000","151.101.130.187","172.20.40.110","TLSv1.3","131","Application Data"
"261","3.950051600","151.101.130.187","172.20.40.110","TCP","60","443  >  62995 [ACK] Seq=3447 Ack=60370 Win=137216 Len=0"
"262","3.952770900","151.101.130.187","172.20.40.110","TLSv1.3","130","Application Data"
"263","3.952848300","172.20.40.110","151.101.130.187","TCP","54","62995  >  443 [ACK] Seq=79416 Ack=3523 Win=130816 Len=0"
"264","3.960202600","151.101.130.187","172.20.40.110","TCP","60","443  >  62995 [ACK] Seq=3523 Ack=64510 Win=138752 Len=0"
"265","3.960655700","151.101.130.187","172.20.40.110","TLSv1.3","131","Application Data"
"266","3.964001800","151.101.130.187","172.20.40.110","TLSv1.3","280","Application Data"
"267","3.964063200","172.20.40.110","151.101.130.187","TCP","54","62995  >  443 [ACK] Seq=79416 Ack=3826 Win=130560 Len=0"
"268","3.966408800","151.101.130.187","172.20.40.110","TCP","60","443  >  62995 [ACK] Seq=3826 Ack=67270 Win=138752 Len=0"
"269","3.969649900","151.101.130.187","172.20.40.110","TLSv1.3","130","Application Data"
"270","3.993867600","151.101.130.187","172.20.40.110","TCP","60","443  >  62995 [ACK] Seq=3902 Ack=70030 Win=138752 Len=0"
"271","3.993867600","151.101.130.187","172.20.40.110","TLSv1.3","206","Application Data, Application Data"
"272","3.993867600","151.101.130.187","172.20.40.110","TCP","60","443  >  62995 [ACK] Seq=4054 Ack=74170 Win=138752 Len=0"
"273","3.993867600","151.101.130.187","172.20.40.110","TLSv1.3","130","Application Data"
"274","3.993867600","151.101.130.187","172.20.40.110","TCP","60","443  >  62995 [ACK] Seq=4130 Ack=78310 Win=138752 Len=0"
"275","3.993867600","151.101.130.187","172.20.40.110","TCP","60","443  >  62995 [ACK] Seq=4130 Ack=79416 Win=137728 Len=0"
"276","3.993867600","151.101.130.187","172.20.40.110","TLSv1.3","131","Application Data"
"277","3.993867600","151.101.130.187","172.20.40.110","TLSv1.3","451","Application Data"
"278","3.994262300","172.20.40.110","151.101.130.187","TCP","54","62995  >  443 [ACK] Seq=79416 Ack=4604 Win=129792 Len=0"
"279","4.008627300","151.101.130.187","172.20.40.110","TLSv1.3","113","Application Data"
"280","4.051746400","172.20.40.110","151.101.130.187","TCP","54","62995  >  443 [ACK] Seq=79416 Ack=4663 Win=129792 Len=0"
"281","4.233157700","151.101.130.187","172.20.40.110","TLSv1.3","157","Application Data"
"282","4.233157700","151.101.130.187","172.20.40.110","TLSv1.3","2814","Application Data"
"283","4.233217600","172.20.40.110","151.101.130.187","TCP","54","62995  >  443 [ACK] Seq=79416 Ack=7526 Win=131072 Len=0"
"284","4.234664800","151.101.130.187","172.20.40.110","TLSv1.3","2814","Application Data, Application Data"
"285","4.234743300","172.20.40.110","151.101.130.187","TCP","54","62995  >  443 [ACK] Seq=79416 Ack=10286 Win=131072 Len=0"
"286","4.242198100","151.101.130.187","172.20.40.110","TLSv1.3","1434","Application Data"
"287","4.242198100","151.101.130.187","172.20.40.110","TLSv1.3","5574","Application Data, Application Data, Application Data, Application Data"
"288","4.242421000","172.20.40.110","151.101.130.187","TCP","54","62995  >  443 [ACK] Seq=79416 Ack=17186 Win=131072 Len=0"
"289","4.243986400","151.101.130.187","172.20.40.110","TLSv1.3","1434","Application Data"
"290","4.246468200","151.101.130.187","172.20.40.110","TLSv1.3","1434","Application Data"
"291","4.246468200","151.101.130.187","172.20.40.110","TLSv1.3","6954","Application Data, Application Data, Application Data, Application Data, Application Data"
"292","4.246553600","172.20.40.110","151.101.130.187","TCP","54","62995  >  443 [ACK] Seq=79416 Ack=26846 Win=131072 Len=0"
"293","4.248514600","151.101.130.187","172.20.40.110","TLSv1.3","5574","Application Data, Application Data, Application Data, Application Data"
"294","4.248602100","172.20.40.110","151.101.130.187","TCP","54","62995  >  443 [ACK] Seq=79416 Ack=32366 Win=131072 Len=0"
"295","4.250816400","151.101.130.187","172.20.40.110","TLSv1.3","5574","Application Data, Application Data, Application Data, Application Data"
"296","4.250865700","172.20.40.110","151.101.130.187","TCP","54","62995  >  443 [ACK] Seq=79416 Ack=37886 Win=131072 Len=0"
"297","4.254095300","151.101.130.187","172.20.40.110","TLSv1.3","1434","Application Data"
"298","4.254202100","172.20.40.110","151.101.130.187","TCP","54","62995  >  443 [ACK] Seq=79416 Ack=39266 Win=131072 Len=0"
"299","4.256682700","151.101.130.187","172.20.40.110","TLSv1.3","1434","Application Data"
"300","4.256682700","151.101.130.187","172.20.40.110","TLSv1.3","1434","Application Data"
"301","4.256682700","151.101.130.187","172.20.40.110","TLSv1.3","1434","Application Data"
"302","4.256682700","151.101.130.187","172.20.40.110","TLSv1.3","1434","Application Data"
"303","4.257086700","172.20.40.110","151.101.130.187","TCP","54","62995  >  443 [ACK] Seq=79416 Ack=44786 Win=131072 Len=0"
"304","4.263820500","151.101.130.187","172.20.40.110","TLSv1.3","1434","Application Data"
"305","4.263820500","151.101.130.187","172.20.40.110","TLSv1.3","1434","Application Data"
"306","4.263820500","151.101.130.187","172.20.40.110","TLSv1.3","1434","Application Data"
"307","4.263820500","151.101.130.187","172.20.40.110","TLSv1.3","1434","Application Data"
"308","4.263820500","151.101.130.187","172.20.40.110","TLSv1.3","1434","Application Data"
"309","4.264019000","172.20.40.110","151.101.130.187","TCP","54","62995  >  443 [ACK] Seq=79416 Ack=51686 Win=131072 Len=0"
"310","4.266053400","151.101.130.187","172.20.40.110","TLSv1.3","5574","Application Data, Application Data, Application Data, Application Data"
"311","4.266170600","172.20.40.110","151.101.130.187","TCP","54","62995  >  443 [ACK] Seq=79416 Ack=57206 Win=131072 Len=0"
"312","4.268385100","151.101.130.187","172.20.40.110","TLSv1.3","1434","Application Data, Application Data"
"313","4.268472400","172.20.40.110","151.101.130.187","TCP","54","62995  >  443 [ACK] Seq=79416 Ack=58586 Win=131072 Len=0"
"314","4.270949400","151.101.130.187","172.20.40.110","TLSv1.3","1434","Application Data"
"315","4.270949400","151.101.130.187","172.20.40.110","TLSv1.3","1434","Application Data"
"316","4.270949400","151.101.130.187","172.20.40.110","TLSv1.3","1434","Application Data"
"317","4.270949400","151.101.130.187","172.20.40.110","TLSv1.3","1434","Application Data"
"318","4.271101800","172.20.40.110","151.101.130.187","TCP","54","62995  >  443 [ACK] Seq=79416 Ack=64106 Win=131072 Len=0"
"319","4.273482100","151.101.130.187","172.20.40.110","TLSv1.3","2814","Application Data"
"320","4.273482100","151.101.130.187","172.20.40.110","TLSv1.3","1022","Application Data, Application Data"
"321","4.273784800","172.20.40.110","151.101.130.187","TCP","54","62995  >  443 [ACK] Seq=79416 Ack=67834 Win=131072 Len=0"
"322","4.647110500","172.20.40.110","151.101.130.187","TLSv1.3","2781","Application Data"
"323","4.660808800","151.101.130.187","172.20.40.110","TCP","60","443  >  62995 [ACK] Seq=67834 Ack=82143 Win=137216 Len=0"
"324","4.664186000","151.101.130.187","172.20.40.110","TLSv1.3","241","Application Data"
"325","4.712962800","151.101.130.187","172.20.40.110","TCP","241","[TCP Retransmission] 443  >  62995 [PSH, ACK] Seq=67834 Ack=82143 Win=138752 Len=187"
"326","4.713054700","172.20.40.110","151.101.130.187","TCP","66","62995  >  443 [ACK] Seq=82143 Ack=68021 Win=130816 Len=0 SLE=67834 SRE=68021"
"327","4.733677000","151.101.130.187","172.20.40.110","TLSv1.3","285","Application Data"
"328","4.735921400","151.101.130.187","172.20.40.110","TCP","1434","443  >  62995 [ACK] Seq=68252 Ack=82143 Win=138752 Len=1380 [TCP PDU reassembled in 341]"
"329","4.736072100","172.20.40.110","151.101.130.187","TCP","54","62995  >  443 [ACK] Seq=82143 Ack=69632 Win=131072 Len=0"
"330","4.738621900","151.101.130.187","172.20.40.110","TCP","1434","443  >  62995 [ACK] Seq=69632 Ack=82143 Win=138752 Len=1380 [TCP PDU reassembled in 341]"
"331","4.738621900","151.101.130.187","172.20.40.110","TCP","1434","443  >  62995 [ACK] Seq=71012 Ack=82143 Win=138752 Len=1380 [TCP PDU reassembled in 341]"
"332","4.738621900","151.101.130.187","172.20.40.110","TCP","1434","443  >  62995 [PSH, ACK] Seq=72392 Ack=82143 Win=138752 Len=1380 [TCP PDU reassembled in 341]"
"333","4.738752600","172.20.40.110","151.101.130.187","TCP","54","62995  >  443 [ACK] Seq=82143 Ack=73772 Win=131072 Len=0"
"334","4.746911800","151.101.130.187","172.20.40.110","TCP","1434","443  >  62995 [ACK] Seq=73772 Ack=82143 Win=138752 Len=1380 [TCP PDU reassembled in 341]"
"335","4.746911800","151.101.130.187","172.20.40.110","TCP","2814","443  >  62995 [ACK] Seq=75152 Ack=82143 Win=138752 Len=2760 [TCP PDU reassembled in 341]"
"336","4.747045900","172.20.40.110","151.101.130.187","TCP","54","62995  >  443 [ACK] Seq=82143 Ack=77912 Win=131072 Len=0"
"337","4.754108700","151.101.130.187","172.20.40.110","TCP","1434","443  >  62995 [PSH, ACK] Seq=77912 Ack=82143 Win=138752 Len=1380 [TCP PDU reassembled in 341]"
"338","4.754108700","151.101.130.187","172.20.40.110","TCP","1434","443  >  62995 [ACK] Seq=79292 Ack=82143 Win=138752 Len=1380 [TCP PDU reassembled in 341]"
"339","4.754108700","151.101.130.187","172.20.40.110","TCP","1434","443  >  62995 [ACK] Seq=80672 Ack=82143 Win=138752 Len=1380 [TCP PDU reassembled in 341]"
"340","4.754108700","151.101.130.187","172.20.40.110","TCP","1434","443  >  62995 [ACK] Seq=82052 Ack=82143 Win=138752 Len=1380 [TCP PDU reassembled in 341]"
"341","4.754108700","151.101.130.187","172.20.40.110","TLSv1.3","1434","Application Data"
"342","4.754268000","172.20.40.110","151.101.130.187","TCP","54","62995  >  443 [ACK] Seq=82143 Ack=84812 Win=131072 Len=0"
"343","4.759047000","151.101.130.187","172.20.40.110","TCP","1434","443  >  62995 [ACK] Seq=84812 Ack=82143 Win=138752 Len=1380 [TCP PDU reassembled in 357]"
"344","4.759283400","172.20.40.110","151.101.130.187","TCP","54","62995  >  443 [ACK] Seq=82143 Ack=86192 Win=131072 Len=0"
"345","4.763685400","151.101.130.187","172.20.40.110","TCP","1434","443  >  62995 [ACK] Seq=86192 Ack=82143 Win=138752 Len=1380 [TCP PDU reassembled in 357]"
"346","4.763685400","151.101.130.187","172.20.40.110","TCP","1434","443  >  62995 [ACK] Seq=87572 Ack=82143 Win=138752 Len=1380 [TCP PDU reassembled in 357]"
"347","4.763685400","151.101.130.187","172.20.40.110","TCP","1434","443  >  62995 [PSH, ACK] Seq=88952 Ack=82143 Win=138752 Len=1380 [TCP PDU reassembled in 357]"
"348","4.763685400","151.101.130.187","172.20.40.110","TCP","1434","443  >  62995 [ACK] Seq=90332 Ack=82143 Win=138752 Len=1380 [TCP PDU reassembled in 357]"
"349","4.763972200","172.20.40.110","151.101.130.187","TCP","54","62995  >  443 [ACK] Seq=82143 Ack=91712 Win=131072 Len=0"
"350","4.765763900","151.101.130.187","172.20.40.110","TCP","1434","443  >  62995 [ACK] Seq=91712 Ack=82143 Win=138752 Len=1380 [TCP PDU reassembled in 357]"
"351","4.768450000","151.101.130.187","172.20.40.110","TCP","1434","443  >  62995 [ACK] Seq=93092 Ack=82143 Win=138752 Len=1380 [TCP PDU reassembled in 357]"
"352","4.768450000","151.101.130.187","172.20.40.110","TCP","1434","443  >  62995 [PSH, ACK] Seq=94472 Ack=82143 Win=138752 Len=1380 [TCP PDU reassembled in 357]"
"353","4.768543600","172.20.40.110","151.101.130.187","TCP","54","62995  >  443 [ACK] Seq=82143 Ack=95852 Win=131072 Len=0"
"354","4.775517000","151.101.130.187","172.20.40.110","TCP","1434","443  >  62995 [ACK] Seq=95852 Ack=82143 Win=138752 Len=1380 [TCP PDU reassembled in 357]"
"355","4.775517000","151.101.130.187","172.20.40.110","TCP","1434","443  >  62995 [ACK] Seq=97232 Ack=82143 Win=138752 Len=1380 [TCP PDU reassembled in 357]"
"356","4.775517000","151.101.130.187","172.20.40.110","TCP","1434","443  >  62995 [ACK] Seq=98612 Ack=82143 Win=138752 Len=1380 [TCP PDU reassembled in 357]"
"357","4.775517000","151.101.130.187","172.20.40.110","TLSv1.3","1434","Application Data"
