No.,Time,Source,Destination,Protocol,Length,Info
1,0.0,100.84.170.161,151.101.66.187,TLSv1.2,2485,Application Data
2,0.0001302,100.84.170.161,151.101.66.187,TLSv1.2,93,Application Data
3,0.0047586,100.84.170.161,151.101.66.187,TLSv1.2,2486,Application Data
4,0.009358,151.101.66.187,100.84.170.161,TCP,56,443  >  59747 [ACK] Seq=1 Ack=2471 Win=4381 Len=0
5,0.0099099,151.101.66.187,100.84.170.161,TLSv1.2,93,Application Data
6,0.0114366,151.101.66.187,100.84.170.161,TLSv1.2,264,Application Data
7,0.0115746,100.84.170.161,151.101.66.187,TCP,54,59747  >  443 [ACK] Seq=4903 Ack=250 Win=4104 Len=0
8,0.0138981,151.101.66.187,100.84.170.161,TCP,56,443  >  59747 [ACK] Seq=250 Ack=4903 Win=4390 Len=0
9,0.0160846,151.101.66.187,100.84.170.161,TLSv1.2,98,Application Data
10,0.051044,151.101.66.187,100.84.170.161,TCP,98,"[TCP Retransmission] 443  >  59747 [PSH, ACK] Seq=250 Ack=4903 Win=4390 Len=44"
11,0.0510835,100.84.170.161,151.101.66.187,TCP,66,59747  >  443 [ACK] Seq=4903 Ack=294 Win=4104 Len=0 SLE=250 SRE=294
12,1.8217366,100.84.170.161,151.101.66.187,TLSv1.2,2417,Application Data
13,1.8323437,151.101.66.187,100.84.170.161,TCP,56,443  >  59747 [ACK] Seq=294 Ack=7266 Win=4400 Len=0
14,1.8347831,151.101.66.187,100.84.170.161,TLSv1.2,277,Application Data
15,1.8664155,151.101.66.187,100.84.170.161,TCP,277,"[TCP Retransmission] 443  >  59747 [PSH, ACK] Seq=294 Ack=7266 Win=4400 Len=223"
16,1.8664649,100.84.170.161,151.101.66.187,TCP,66,59747  >  443 [ACK] Seq=7266 Ack=517 Win=4103 Len=0 SLE=294 SRE=517
17,1.9830716,100.84.170.161,151.101.66.187,TLSv1.2,2415,Application Data
18,1.991921,151.101.66.187,100.84.170.161,TCP,56,443  >  59747 [ACK] Seq=517 Ack=9627 Win=4409 Len=0
19,1.9952916,151.101.66.187,100.84.170.161,TLSv1.2,98,Application Data
20,2.0281299,151.101.66.187,100.84.170.161,TCP,98,"[TCP Retransmission] 443  >  59747 [PSH, ACK] Seq=517 Ack=9627 Win=4409 Len=44"
21,2.0281837,100.84.170.161,151.101.66.187,TCP,66,59747  >  443 [ACK] Seq=9627 Ack=561 Win=4103 Len=0 SLE=517 SRE=561
22,2.5204562,100.84.170.161,151.101.66.187,TLSv1.2,2416,Application Data
23,2.5317075,151.101.66.187,100.84.170.161,TCP,56,443  >  59747 [ACK] Seq=561 Ack=11989 Win=4418 Len=0
24,2.5341287,151.101.66.187,100.84.170.161,TLSv1.2,234,Application Data
25,2.5657965,151.101.66.187,100.84.170.161,TCP,234,"[TCP Retransmission] 443  >  59747 [PSH, ACK] Seq=561 Ack=11989 Win=4418 Len=180"
26,2.5658452,100.84.170.161,151.101.66.187,TCP,66,59747  >  443 [ACK] Seq=11989 Ack=741 Win=4102 Len=0 SLE=561 SRE=741
27,2.6172698,100.84.170.161,151.101.66.187,TLSv1.2,2415,Application Data
28,2.6260492,151.101.66.187,100.84.170.161,TCP,56,443  >  59747 [ACK] Seq=741 Ack=14350 Win=4427 Len=0
29,2.6286004,151.101.66.187,100.84.170.161,TLSv1.2,98,Application Data
30,2.6593998,151.101.66.187,100.84.170.161,TCP,98,"[TCP Retransmission] 443  >  59747 [PSH, ACK] Seq=741 Ack=14350 Win=4427 Len=44"
31,2.6594382,100.84.170.161,151.101.66.187,TCP,66,59747  >  443 [ACK] Seq=14350 Ack=785 Win=4102 Len=0 SLE=741 SRE=785
32,3.7175421,100.84.170.161,151.101.66.187,TLSv1.2,2417,Application Data
33,3.7177596,100.84.170.161,151.101.66.187,TLSv1.2,2418,Application Data
34,3.727789,151.101.66.187,100.84.170.161,TCP,56,443  >  59747 [ACK] Seq=785 Ack=19077 Win=4446 Len=0
35,3.7300192,151.101.66.187,100.84.170.161,TLSv1.2,241,Application Data
36,3.7303054,151.101.66.187,100.84.170.161,TLSv1.2,98,Application Data
37,3.7303512,100.84.170.161,151.101.66.187,TCP,54,59747  >  443 [ACK] Seq=19077 Ack=1016 Win=4101 Len=0
38,4.1149804,100.84.170.161,151.101.66.187,TLSv1.2,2415,Application Data
39,4.124907,151.101.66.187,100.84.170.161,TCP,56,443  >  59747 [ACK] Seq=1016 Ack=21438 Win=4455 Len=0
40,4.1287409,151.101.66.187,100.84.170.161,TLSv1.2,98,Application Data
41,4.1589826,151.101.66.187,100.84.170.161,TCP,98,"[TCP Retransmission] 443  >  59747 [PSH, ACK] Seq=1016 Ack=21438 Win=4455 Len=44"
42,4.1590545,100.84.170.161,151.101.66.187,TCP,66,59747  >  443 [ACK] Seq=21438 Ack=1060 Win=4101 Len=0 SLE=1016 SRE=1060
43,4.957473,100.84.170.161,151.101.66.187,TLSv1.2,2471,Application Data
44,4.9664384,151.101.66.187,100.84.170.161,TCP,56,443  >  59747 [ACK] Seq=1060 Ack=23855 Win=4464 Len=0
45,4.9706782,151.101.66.187,100.84.170.161,TLSv1.2,286,Application Data
46,5.0004776,151.101.66.187,100.84.170.161,TCP,286,"[TCP Retransmission] 443  >  59747 [PSH, ACK] Seq=1060 Ack=23855 Win=4464 Len=232"
47,5.000526,100.84.170.161,151.101.66.187,TCP,66,59747  >  443 [ACK] Seq=23855 Ack=1292 Win=4100 Len=0 SLE=1060 SRE=1292
48,5.4075396,100.84.170.161,151.101.66.187,TLSv1.2,2415,Application Data
49,5.4219952,151.101.66.187,100.84.170.161,TCP,56,443  >  59747 [ACK] Seq=1292 Ack=26216 Win=4474 Len=0
50,5.4255524,151.101.66.187,100.84.170.161,TLSv1.2,292,Application Data
51,5.4554053,151.101.66.187,100.84.170.161,TCP,292,"[TCP Retransmission] 443  >  59747 [PSH, ACK] Seq=1292 Ack=26216 Win=4474 Len=238"
52,5.4554457,100.84.170.161,151.101.66.187,TCP,66,59747  >  443 [ACK] Seq=26216 Ack=1530 Win=4106 Len=0 SLE=1292 SRE=1530
53,9.0204184,100.84.170.161,151.101.66.187,TLSv1.2,2482,Application Data
54,9.0302106,151.101.66.187,100.84.170.161,TCP,56,443  >  59747 [ACK] Seq=1530 Ack=28644 Win=4483 Len=0
55,9.0325657,151.101.66.187,100.84.170.161,TLSv1.2,214,Application Data
56,9.0329756,100.84.170.161,151.101.66.187,TLSv1.2,2473,Application Data
57,9.0373499,100.84.170.161,151.101.66.187,TLSv1.2,2467,Application Data
58,9.0423392,151.101.66.187,100.84.170.161,TCP,56,443  >  59747 [ACK] Seq=1690 Ack=31063 Win=4492 Len=0
59,9.0447525,151.101.66.187,100.84.170.161,TLSv1.2,124,Application Data
60,9.046739,151.101.66.187,100.84.170.161,TCP,56,443  >  59747 [ACK] Seq=1760 Ack=33476 Win=4502 Len=0
61,9.0493316,151.101.66.187,100.84.170.161,TLSv1.2,181,Application Data
62,9.0494104,100.84.170.161,151.101.66.187,TCP,54,59747  >  443 [ACK] Seq=33476 Ack=1887 Win=4104 Len=0
63,9.4210712,100.84.170.161,151.101.66.187,TLSv1.2,2464,Application Data
64,9.4316682,151.101.66.187,100.84.170.161,TCP,56,443  >  59747 [ACK] Seq=1887 Ack=35886 Win=4511 Len=0
65,9.4339253,151.101.66.187,100.84.170.161,TLSv1.2,235,Application Data
66,9.4613857,100.84.170.161,151.101.66.187,TLSv1.2,2481,Application Data
67,9.4627945,151.101.66.187,100.84.170.161,TCP,235,"[TCP Spurious Retransmission] 443  >  59747 [PSH, ACK] Seq=1887 Ack=35886 Win=4511 Len=181"
68,9.4628328,100.84.170.161,151.101.66.187,TCP,66,[TCP Dup ACK 66#1] 59747  >  443 [ACK] Seq=38313 Ack=2068 Win=4104 Len=0 SLE=1887 SRE=2068
69,9.4707422,151.101.66.187,100.84.170.161,TCP,56,443  >  59747 [ACK] Seq=2068 Ack=38313 Win=4521 Len=0
70,9.473787,151.101.66.187,100.84.170.161,TLSv1.2,161,Application Data
71,9.5025621,151.101.66.187,100.84.170.161,TCP,161,"[TCP Retransmission] 443  >  59747 [PSH, ACK] Seq=2068 Ack=38313 Win=4521 Len=107"
72,9.5026278,100.84.170.161,151.101.66.187,TCP,66,59747  >  443 [ACK] Seq=38313 Ack=2175 Win=4103 Len=0 SLE=2068 SRE=2175
73,9.5367508,100.84.170.161,151.101.66.187,TLSv1.2,2481,Application Data
74,9.5462297,151.101.66.187,100.84.170.161,TCP,56,443  >  59747 [ACK] Seq=2175 Ack=40740 Win=4530 Len=0
75,9.5483467,151.101.66.187,100.84.170.161,TLSv1.2,98,Application Data
76,9.5765865,151.101.66.187,100.84.170.161,TCP,98,"[TCP Retransmission] 443  >  59747 [PSH, ACK] Seq=2175 Ack=40740 Win=4530 Len=44"
77,9.5766435,100.84.170.161,151.101.66.187,TCP,66,59747  >  443 [ACK] Seq=40740 Ack=2219 Win=4103 Len=0 SLE=2175 SRE=2219
78,9.9365074,100.84.170.161,151.101.66.187,TLSv1.2,2476,Application Data
79,9.9473887,151.101.66.187,100.84.170.161,TCP,56,443  >  59747 [ACK] Seq=2219 Ack=43162 Win=4540 Len=0
80,9.9511282,151.101.66.187,100.84.170.161,TLSv1.2,131,Application Data
81,9.9800086,151.101.66.187,100.84.170.161,TCP,131,"[TCP Retransmission] 443  >  59747 [PSH, ACK] Seq=2219 Ack=43162 Win=4540 Len=77"
82,9.9800541,100.84.170.161,151.101.66.187,TCP,66,59747  >  443 [ACK] Seq=43162 Ack=2296 Win=4103 Len=0 SLE=2219 SRE=2296
83,10.0436261,100.84.170.161,151.101.66.187,TLSv1.2,2486,Application Data
84,10.0439402,100.84.170.161,151.101.66.187,TLSv1.2,2478,Application Data
85,10.0465784,100.84.170.161,151.101.66.187,TLSv1.2,2482,Application Data
86,10.0667853,100.84.170.161,151.101.66.187,TCP,1514,"[TCP Retransmission] 59747  >  443 [PSH, ACK] Seq=48986 Ack=2296 Win=4103 Len=1460"
87,10.128639,151.101.66.187,100.84.170.161,TCP,56,443  >  59747 [ACK] Seq=2296 Ack=50446 Win=4568 Len=0
88,10.1288946,151.101.66.187,100.84.170.161,TLSv1.2,130,Application Data
89,10.1311006,151.101.66.187,100.84.170.161,TLSv1.2,131,Application Data
90,10.1311006,151.101.66.187,100.84.170.161,TLSv1.2,130,Application Data
91,10.131184,100.84.170.161,151.101.66.187,TCP,54,59747  >  443 [ACK] Seq=50446 Ack=2525 Win=4102 Len=0
92,10.1517233,151.101.66.187,100.84.170.161,TCP,66,[TCP Dup ACK 87#1] 443  >  59747 [ACK] Seq=2525 Ack=50446 Win=4568 Len=0 SLE=48986 SRE=50446
93,10.1550628,151.101.66.187,100.84.170.161,TCP,130,"[TCP Spurious Retransmission] 443  >  59747 [PSH, ACK] Seq=2449 Ack=50446 Win=4568 Len=76"
94,10.1551268,100.84.170.161,151.101.66.187,TCP,66,[TCP Dup ACK 91#1] 59747  >  443 [ACK] Seq=50446 Ack=2525 Win=4102 Len=0 SLE=2449 SRE=2525
95,10.8884381,100.84.170.161,151.101.66.187,TLSv1.2,2558,Application Data
96,10.8987859,151.101.66.187,100.84.170.161,TCP,56,443  >  59747 [ACK] Seq=2525 Ack=52950 Win=4578 Len=0
97,10.9019993,151.101.66.187,100.84.170.161,TLSv1.2,286,Application Data
98,10.912594,100.84.170.161,151.101.66.187,TLSv1.2,2546,Application Data
99,10.9128638,100.84.170.161,151.101.66.187,TLSv1.2,2547,Application Data
100,10.9130255,100.84.170.161,151.101.66.187,TLSv1.2,2557,Application Data
101,10.9171807,100.84.170.161,151.101.66.187,TLSv1.2,2543,Application Data
102,10.9217202,151.101.66.187,100.84.170.161,TCP,56,443  >  59747 [ACK] Seq=2757 Ack=55442 Win=4588 Len=0
103,10.9220544,151.101.66.187,100.84.170.161,TCP,56,443  >  59747 [ACK] Seq=2757 Ack=60438 Win=4607 Len=0
104,10.9247906,151.101.66.187,100.84.170.161,TLSv1.2,124,Application Data
105,10.9265344,151.101.66.187,100.84.170.161,TLSv1.2,208,Application Data
106,10.9266106,100.84.170.161,151.101.66.187,TCP,54,59747  >  443 [ACK] Seq=62927 Ack=2981 Win=4100 Len=0
107,10.927402,151.101.66.187,100.84.170.161,TCP,56,443  >  59747 [ACK] Seq=2981 Ack=62927 Win=4619 Len=0
108,10.9298234,151.101.66.187,100.84.170.161,TLSv1.2,125,Application Data
109,10.9301077,151.101.66.187,100.84.170.161,TLSv1.2,124,Application Data
110,10.9301594,100.84.170.161,151.101.66.187,TCP,54,59747  >  443 [ACK] Seq=62927 Ack=3122 Win=4106 Len=0
111,14.6074832,100.84.170.161,151.101.66.187,TLSv1.2,2571,Application Data
112,14.6152059,100.84.170.161,151.101.66.187,TLSv1.2,2569,Application Data
113,14.6163678,151.101.66.187,100.84.170.161,TCP,56,443  >  59747 [ACK] Seq=3122 Ack=65444 Win=4628 Len=0
114,14.619733,151.101.66.187,100.84.170.161,TLSv1.2,241,Application Data
115,14.6241281,151.101.66.187,100.84.170.161,TCP,56,443  >  59747 [ACK] Seq=3309 Ack=67959 Win=4638 Len=0
116,14.6272127,151.101.66.187,100.84.170.161,TLSv1.2,175,Application Data
117,14.6272769,100.84.170.161,151.101.66.187,TCP,54,59747  >  443 [ACK] Seq=67959 Ack=3430 Win=4105 Len=0
118,14.8335587,100.84.170.161,151.101.66.187,TLSv1.2,2572,Application Data
119,14.843755,151.101.66.187,100.84.170.161,TCP,56,443  >  59747 [ACK] Seq=3430 Ack=70477 Win=4648 Len=0
120,14.846735,151.101.66.187,100.84.170.161,TLSv1.2,131,Application Data
121,14.887598,151.101.66.187,100.84.170.161,TCP,131,"[TCP Retransmission] 443  >  59747 [PSH, ACK] Seq=3430 Ack=70477 Win=4648 Len=77"
122,14.8876454,100.84.170.161,151.101.66.187,TCP,66,59747  >  443 [ACK] Seq=70477 Ack=3507 Win=4104 Len=0 SLE=3430 SRE=3507
123,15.3468788,100.84.170.161,151.101.66.187,TLSv1.2,2557,Application Data
124,15.3570181,151.101.66.187,100.84.170.161,TCP,56,443  >  59747 [ACK] Seq=3507 Ack=72980 Win=4658 Len=0
125,15.358997,151.101.66.187,100.84.170.161,TLSv1.2,271,Application Data
126,15.4035955,100.84.170.161,151.101.66.187,TCP,54,59747  >  443 [ACK] Seq=72980 Ack=3724 Win=4103 Len=0
127,15.4138468,151.101.66.187,100.84.170.161,TCP,271,"[TCP Spurious Retransmission] 443  >  59747 [PSH, ACK] Seq=3507 Ack=72980 Win=4658 Len=217"
128,15.4138907,100.84.170.161,151.101.66.187,TCP,66,[TCP Dup ACK 126#1] 59747  >  443 [ACK] Seq=72980 Ack=3724 Win=4103 Len=0 SLE=3507 SRE=3724
129,15.5107719,100.84.170.161,151.101.66.187,TLSv1.2,2560,Application Data
130,15.5240023,151.101.66.187,100.84.170.161,TCP,56,443  >  59747 [ACK] Seq=3724 Ack=75486 Win=4668 Len=0
131,15.5333699,151.101.66.187,100.84.170.161,TLSv1.2,124,Application Data
132,15.5565609,151.101.66.187,100.84.170.161,TCP,124,"[TCP Retransmission] 443  >  59747 [PSH, ACK] Seq=3724 Ack=75486 Win=4668 Len=70"
133,15.556603,100.84.170.161,151.101.66.187,TCP,66,59747  >  443 [ACK] Seq=75486 Ack=3794 Win=4103 Len=0 SLE=3724 SRE=3794
134,15.5762554,100.84.170.161,151.101.66.187,TLSv1.2,2562,Application Data
135,15.5934704,151.101.66.187,100.84.170.161,TCP,56,443  >  59747 [ACK] Seq=3794 Ack=77994 Win=4677 Len=0
136,15.5985001,151.101.66.187,100.84.170.161,TLSv1.2,124,Application Data
137,15.6194023,151.101.66.187,100.84.170.161,TCP,124,"[TCP Retransmission] 443  >  59747 [PSH, ACK] Seq=3794 Ack=77994 Win=4677 Len=70"
138,15.619438,100.84.170.161,151.101.66.187,TCP,66,59747  >  443 [ACK] Seq=77994 Ack=3864 Win=4103 Len=0 SLE=3794 SRE=3864
139,17.5559612,100.84.170.161,151.101.66.187,TLSv1.2,2571,Application Data
140,17.564566,151.101.66.187,100.84.170.161,TCP,56,443  >  59747 [ACK] Seq=3864 Ack=80511 Win=4687 Len=0
141,17.5681438,151.101.66.187,100.84.170.161,TLSv1.2,214,Application Data
142,17.582103,100.84.170.161,151.101.66.187,TLSv1.2,2569,Application Data
143,17.5909689,151.101.66.187,100.84.170.161,TCP,56,443  >  59747 [ACK] Seq=4024 Ack=83026 Win=4697 Len=0
144,17.5935658,151.101.66.187,100.84.170.161,TLSv1.2,98,Application Data
145,17.5937114,100.84.170.161,151.101.66.187,TLSv1.2,2572,Application Data
146,17.6025767,151.101.66.187,100.84.170.161,TCP,56,443  >  59747 [ACK] Seq=4068 Ack=85544 Win=4707 Len=0
147,17.6054103,151.101.66.187,100.84.170.161,TLSv1.2,104,Application Data
148,17.6374979,151.101.66.187,100.84.170.161,TCP,104,"[TCP Retransmission] 443  >  59747 [PSH, ACK] Seq=4068 Ack=85544 Win=4707 Len=50"
149,17.6375379,100.84.170.161,151.101.66.187,TCP,66,59747  >  443 [ACK] Seq=85544 Ack=4118 Win=4102 Len=0 SLE=4068 SRE=4118
150,18.4384533,100.84.170.161,151.101.66.187,TLSv1.2,2571,Application Data
151,18.4472385,151.101.66.187,100.84.170.161,TCP,56,443  >  59747 [ACK] Seq=4118 Ack=88061 Win=4717 Len=0
152,18.4501426,151.101.66.187,100.84.170.161,TLSv1.2,208,Application Data
153,18.4613626,100.84.170.161,151.101.66.187,TLSv1.2,2569,Application Data
154,18.470163,151.101.66.187,100.84.170.161,TCP,56,443  >  59747 [ACK] Seq=4272 Ack=90576 Win=4727 Len=0
155,18.4730905,151.101.66.187,100.84.170.161,TLSv1.2,98,Application Data
156,18.5053521,151.101.66.187,100.84.170.161,TCP,98,"[TCP Retransmission] 443  >  59747 [PSH, ACK] Seq=4272 Ack=90576 Win=4727 Len=44"
157,18.505389,100.84.170.161,151.101.66.187,TCP,66,59747  >  443 [ACK] Seq=90576 Ack=4316 Win=4101 Len=0 SLE=4272 SRE=4316
158,18.7077749,100.84.170.161,151.101.66.187,TLSv1.2,2572,Application Data
159,18.7182222,151.101.66.187,100.84.170.161,TCP,56,443  >  59747 [ACK] Seq=4316 Ack=93094 Win=4736 Len=0
160,18.7217516,151.101.66.187,100.84.170.161,TLSv1.2,149,Application Data
161,18.7541878,151.101.66.187,100.84.170.161,TCP,149,"[TCP Retransmission] 443  >  59747 [PSH, ACK] Seq=4316 Ack=93094 Win=4736 Len=95"
162,18.7542162,100.84.170.161,151.101.66.187,TCP,66,59747  >  443 [ACK] Seq=93094 Ack=4411 Win=4101 Len=0 SLE=4316 SRE=4411
163,19.0961033,100.84.170.161,151.101.66.187,TLSv1.2,2511,Application Data
164,19.1047264,151.101.66.187,100.84.170.161,TCP,56,443  >  59747 [ACK] Seq=4411 Ack=95551 Win=4746 Len=0
165,19.107664,151.101.66.187,100.84.170.161,TLSv1.2,124,Application Data
166,19.1391748,151.101.66.187,100.84.170.161,TCP,124,"[TCP Retransmission] 443  >  59747 [PSH, ACK] Seq=4411 Ack=95551 Win=4746 Len=70"
167,19.1392175,100.84.170.161,151.101.66.187,TCP,66,59747  >  443 [ACK] Seq=95551 Ack=4481 Win=4100 Len=0 SLE=4411 SRE=4481
168,22.5732411,100.84.170.161,151.101.66.187,TLSv1.2,2575,Application Data
169,22.5822167,151.101.66.187,100.84.170.161,TCP,56,443  >  59747 [ACK] Seq=4481 Ack=98072 Win=4756 Len=0
170,22.5852087,151.101.66.187,100.84.170.161,TLSv1.2,214,Application Data
171,22.5909347,100.84.170.161,151.101.66.187,TLSv1.2,2566,Application Data
172,22.5913257,100.84.170.161,151.101.66.187,TLSv1.2,2560,Application Data
173,22.594752,100.84.170.161,151.101.66.187,TLSv1.2,2560,Application Data
174,22.6014049,151.101.66.187,100.84.170.161,TCP,56,443  >  59747 [ACK] Seq=4641 Ack=103090 Win=4777 Len=0
175,22.6035747,151.101.66.187,100.84.170.161,TCP,56,443  >  59747 [ACK] Seq=4641 Ack=105596 Win=4787 Len=0
176,22.6044404,151.101.66.187,100.84.170.161,TLSv1.2,202,Application Data
177,22.6047878,151.101.66.187,100.84.170.161,TLSv1.2,131,Application Data
178,22.6048272,100.84.170.161,151.101.66.187,TCP,54,59747  >  443 [ACK] Seq=105596 Ack=4866 Win=4105 Len=0
179,22.6055695,151.101.66.187,100.84.170.161,TLSv1.2,124,Application Data
180,22.6452695,151.101.66.187,100.84.170.161,TCP,124,"[TCP Retransmission] 443  >  59747 [PSH, ACK] Seq=4866 Ack=105596 Win=4787 Len=70"
181,22.6453073,100.84.170.161,151.101.66.187,TCP,66,59747  >  443 [ACK] Seq=105596 Ack=4936 Win=4105 Len=0 SLE=4866 SRE=4936
182,22.6658353,100.84.170.161,151.101.66.187,TLSv1.2,2560,Application Data
183,22.6745655,151.101.66.187,100.84.170.161,TCP,56,443  >  59747 [ACK] Seq=4936 Ack=108102 Win=4797 Len=0
184,22.6771181,151.101.66.187,100.84.170.161,TLSv1.2,98,Application Data
185,22.7071888,151.101.66.187,100.84.170.161,TCP,98,"[TCP Retransmission] 443  >  59747 [PSH, ACK] Seq=4936 Ack=108102 Win=4797 Len=44"
186,22.7072252,100.84.170.161,151.101.66.187,TCP,66,59747  >  443 [ACK] Seq=108102 Ack=4980 Win=4104 Len=0 SLE=4936 SRE=4980
187,22.8030784,100.84.170.161,151.101.66.187,TLSv1.2,2557,Application Data
188,22.8133867,151.101.66.187,100.84.170.161,TCP,56,443  >  59747 [ACK] Seq=4980 Ack=110605 Win=4806 Len=0
189,22.8152353,151.101.66.187,100.84.170.161,TLSv1.2,131,Application Data
190,22.8168552,100.84.170.161,151.101.66.187,TLSv1.2,2574,Application Data
191,22.8273098,151.101.66.187,100.84.170.161,TCP,56,443  >  59747 [ACK] Seq=5057 Ack=113125 Win=4816 Len=0
192,22.8294052,151.101.66.187,100.84.170.161,TLSv1.2,174,Application Data
193,22.8442714,100.84.170.161,151.101.66.187,TLSv1.2,2574,Application Data
194,22.8559489,151.101.66.187,100.84.170.161,TCP,56,443  >  59747 [ACK] Seq=5177 Ack=115645 Win=4826 Len=0
195,22.8577018,151.101.66.187,100.84.170.161,TLSv1.2,125,Application Data
196,22.8923548,151.101.66.187,100.84.170.161,TCP,125,"[TCP Retransmission] 443  >  59747 [PSH, ACK] Seq=5177 Ack=115645 Win=4826 Len=71"
197,22.8923922,100.84.170.161,151.101.66.187,TCP,66,59747  >  443 [ACK] Seq=115645 Ack=5248 Win=4103 Len=0 SLE=5177 SRE=5248
198,22.9820164,100.84.170.161,151.101.66.187,TLSv1.2,2569,Application Data
199,22.9928354,151.101.66.187,100.84.170.161,TCP,56,443  >  59747 [ACK] Seq=5248 Ack=118160 Win=4836 Len=0
200,22.9963525,151.101.66.187,100.84.170.161,TLSv1.2,136,Application Data
201,23.030593,151.101.66.187,100.84.170.161,TCP,136,"[TCP Retransmission] 443  >  59747 [PSH, ACK] Seq=5248 Ack=118160 Win=4836 Len=82"
202,23.0306316,100.84.170.161,151.101.66.187,TCP,66,59747  >  443 [ACK] Seq=118160 Ack=5330 Win=4103 Len=0 SLE=5248 SRE=5330
203,23.0733326,100.84.170.161,151.101.66.187,TLSv1.2,2575,Application Data
204,23.0736376,100.84.170.161,151.101.66.187,TLSv1.2,2563,Application Data
205,23.0745486,100.84.170.161,151.101.66.187,TLSv1.2,2574,Application Data
206,23.0746785,100.84.170.161,151.101.66.187,TLSv1.2,2562,Application Data
207,23.0748346,100.84.170.161,151.101.66.187,TLSv1.2,2559,Application Data
208,23.0839537,151.101.66.187,100.84.170.161,TCP,56,443  >  59747 [ACK] Seq=5330 Ack=123190 Win=4856 Len=0
209,23.0839537,151.101.66.187,100.84.170.161,TCP,56,443  >  59747 [ACK] Seq=5330 Ack=128218 Win=4875 Len=0
210,23.0859488,151.101.66.187,100.84.170.161,TCP,56,443  >  59747 [ACK] Seq=5330 Ack=130723 Win=4885 Len=0
211,23.087811,151.101.66.187,100.84.170.161,TLSv1.2,157,Application Data
212,23.0880655,151.101.66.187,100.84.170.161,TLSv1.2,124,Application Data
213,23.0881194,100.84.170.161,151.101.66.187,TCP,54,59747  >  443 [ACK] Seq=130723 Ack=5503 Win=4102 Len=0
214,23.0925696,151.101.66.187,100.84.170.161,TLSv1.2,178,Application Data
215,23.0953838,151.101.66.187,100.84.170.161,TLSv1.2,125,Application Data
216,23.0954331,100.84.170.161,151.101.66.187,TCP,54,59747  >  443 [ACK] Seq=130723 Ack=5698 Win=4102 Len=0
217,23.2409993,100.84.170.161,151.101.66.187,TCP,55,55359  >  443 [ACK] Seq=1 Ack=1 Win=513 Len=1 [TCP PDU reassembled in 233]
218,23.2501296,151.101.66.187,100.84.170.161,TCP,66,443  >  55359 [ACK] Seq=1 Ack=2 Win=281 Len=0 SLE=1 SRE=2
219,23.2913015,100.84.170.161,151.101.66.187,TLSv1.2,2592,Application Data
220,23.2922557,100.84.170.161,151.101.66.187,TLSv1.2,2588,Application Data
221,23.2924781,100.84.170.161,151.101.66.187,TLSv1.2,2574,Application Data
222,23.292637,100.84.170.161,151.101.66.187,TLSv1.2,2584,Application Data
223,23.3006602,151.101.66.187,100.84.170.161,TCP,56,443  >  59747 [ACK] Seq=5698 Ack=133261 Win=4895 Len=0
224,23.3020528,151.101.66.187,100.84.170.161,TCP,56,443  >  59747 [ACK] Seq=5698 Ack=140845 Win=4925 Len=0
225,23.303894,151.101.66.187,100.84.170.161,TLSv1.2,240,Application Data
226,23.3046007,151.101.66.187,100.84.170.161,TLSv1.2,175,Application Data
227,23.3046581,100.84.170.161,151.101.66.187,TCP,54,59747  >  443 [ACK] Seq=140845 Ack=6005 Win=4100 Len=0
228,23.3051103,151.101.66.187,100.84.170.161,TLSv1.2,131,Application Data
229,23.3051103,151.101.66.187,100.84.170.161,TLSv1.2,208,Application Data
230,23.3051493,100.84.170.161,151.101.66.187,TCP,54,59747  >  443 [ACK] Seq=140845 Ack=6236 Win=4106 Len=0
231,31.7891019,100.84.170.161,151.101.66.187,TLSv1.2,2111,Application Data
232,31.7988564,151.101.66.187,100.84.170.161,TCP,56,443  >  59747 [ACK] Seq=6236 Ack=142902 Win=4933 Len=0
233,31.8274537,100.84.170.161,151.101.66.187,TLSv1.2,175,Ignored Unknown Record
234,31.8276399,100.84.170.161,151.101.66.187,TLSv1.2,93,Application Data
235,31.8363374,151.101.66.187,100.84.170.161,TCP,56,443  >  55359 [ACK] Seq=1 Ack=123 Win=281 Len=0
236,31.8365438,151.101.66.187,100.84.170.161,TLSv1.2,93,Application Data
237,31.8524878,151.101.66.187,100.84.170.161,TLSv1.2,506,Application Data
238,31.8529311,151.101.66.187,100.84.170.161,TLSv1.2,99,Application Data
239,31.8529678,100.84.170.161,151.101.66.187,TCP,54,59747  >  443 [ACK] Seq=142902 Ack=6733 Win=4104 Len=0
240,31.8533366,151.101.66.187,100.84.170.161,TCP,1510,443  >  59747 [ACK] Seq=6733 Ack=142902 Win=4933 Len=1456 [TCP PDU reassembled in 242]
241,31.8537365,100.84.170.161,151.101.66.187,TLSv1.2,89,Application Data
242,31.8538763,151.101.66.187,100.84.170.161,TLSv1.2,947,Application Data
243,31.8627619,151.101.66.187,100.84.170.161,TCP,56,443  >  59747 [ACK] Seq=9082 Ack=142937 Win=4933 Len=0
244,31.8648704,151.101.66.187,100.84.170.161,TCP,93,"[TCP Retransmission] 443  >  55359 [PSH, ACK] Seq=1 Ack=162 Win=281 Len=39"
245,31.8649007,100.84.170.161,151.101.66.187,TCP,66,55359  >  443 [ACK] Seq=162 Ack=40 Win=513 Len=0 SLE=1 SRE=40
246,31.8879115,151.101.66.187,100.84.170.161,TLSv1.2,245,Application Data
247,31.8880042,100.84.170.161,151.101.66.187,TCP,54,55359  >  443 [ACK] Seq=162 Ack=231 Win=512 Len=0
248,31.8935919,151.101.66.187,100.84.170.161,TCP,947,"[TCP Retransmission] 443  >  59747 [PSH, ACK] Seq=8189 Ack=142937 Win=4933 Len=893 [TCP PDU reassembled in 242]"
249,31.8938716,100.84.170.161,151.101.66.187,TCP,66,59747  >  443 [ACK] Seq=142937 Ack=9082 Win=4102 Len=0 SLE=8189 SRE=9082
250,31.9186034,100.84.170.161,151.101.66.187,TLSv1.2,881,Application Data
251,31.9212624,100.84.170.161,151.101.66.187,TLSv1.2,1860,Application Data
252,31.9278308,151.101.66.187,100.84.170.161,TCP,56,443  >  59747 [ACK] Seq=9082 Ack=143764 Win=4933 Len=0
253,31.9301662,151.101.66.187,100.84.170.161,TCP,56,443  >  59747 [ACK] Seq=9082 Ack=145570 Win=4933 Len=0
254,31.9320401,151.101.66.187,100.84.170.161,TLSv1.2,299,Application Data
255,31.9321502,100.84.170.161,151.101.66.187,TLSv1.2,907,Application Data
256,31.9336265,151.101.66.187,100.84.170.161,TLSv1.2,125,Application Data
257,31.940716,151.101.66.187,100.84.170.161,TCP,56,443  >  59747 [ACK] Seq=9398 Ack=146423 Win=4933 Len=0
258,31.9455914,151.101.66.187,100.84.170.161,TLSv1.2,174,Application Data
259,31.9456824,100.84.170.161,151.101.66.187,TCP,54,59747  >  443 [ACK] Seq=146423 Ack=9518 Win=4101 Len=0
260,31.9864196,100.84.170.161,151.101.66.187,TLSv1.2,1876,Application Data
261,31.9867005,100.84.170.161,151.101.66.187,TLSv1.2,862,Application Data
262,31.995523,151.101.66.187,100.84.170.161,TCP,56,443  >  59747 [ACK] Seq=9518 Ack=148245 Win=4933 Len=0
263,31.9958322,151.101.66.187,100.84.170.161,TCP,56,443  >  59747 [ACK] Seq=9518 Ack=149053 Win=4933 Len=0
264,31.9987361,151.101.66.187,100.84.170.161,TLSv1.2,130,Application Data
265,31.9990062,151.101.66.187,100.84.170.161,TLSv1.2,209,Application Data
266,31.9990606,100.84.170.161,151.101.66.187,TCP,54,59747  >  443 [ACK] Seq=149053 Ack=9749 Win=4106 Len=0
267,32.1415202,100.84.170.161,151.101.66.187,TLSv1.2,1902,Application Data
268,32.1510123,151.101.66.187,100.84.170.161,TCP,56,443  >  59747 [ACK] Seq=9749 Ack=150901 Win=4933 Len=0
269,32.1526192,151.101.66.187,100.84.170.161,TLSv1.2,98,Application Data
270,32.1556205,100.84.170.161,151.101.66.187,TLSv1.2,895,Application Data
271,32.1645226,151.101.66.187,100.84.170.161,TCP,56,443  >  59747 [ACK] Seq=9793 Ack=151742 Win=4933 Len=0
272,32.1674814,151.101.66.187,100.84.170.161,TLSv1.2,125,Application Data
273,32.196226,151.101.66.187,100.84.170.161,TCP,125,"[TCP Retransmission] 443  >  59747 [PSH, ACK] Seq=9793 Ack=151742 Win=4933 Len=71"
274,32.1962693,100.84.170.161,151.101.66.187,TCP,66,59747  >  443 [ACK] Seq=151742 Ack=9864 Win=4105 Len=0 SLE=9793 SRE=9864
275,32.3444686,100.84.170.161,151.101.66.187,TLSv1.2,1903,Application Data
276,32.3535539,151.101.66.187,100.84.170.161,TCP,56,443  >  59747 [ACK] Seq=9864 Ack=153591 Win=4933 Len=0
277,32.3582805,151.101.66.187,100.84.170.161,TLSv1.2,208,Application Data
278,32.387457,151.101.66.187,100.84.170.161,TCP,208,"[TCP Retransmission] 443  >  59747 [PSH, ACK] Seq=9864 Ack=153591 Win=4933 Len=154"
279,32.3874879,100.84.170.161,151.101.66.187,TCP,66,59747  >  443 [ACK] Seq=153591 Ack=10018 Win=4105 Len=0 SLE=9864 SRE=10018
280,32.4625019,100.84.170.161,151.101.66.187,TLSv1.2,907,Application Data
281,32.472373,151.101.66.187,100.84.170.161,TCP,56,443  >  59747 [ACK] Seq=10018 Ack=154444 Win=4933 Len=0
282,32.4742868,151.101.66.187,100.84.170.161,TLSv1.2,124,Application Data
283,32.5022147,151.101.66.187,100.84.170.161,TCP,124,"[TCP Retransmission] 443  >  59747 [PSH, ACK] Seq=10018 Ack=154444 Win=4933 Len=70"
284,32.5022601,100.84.170.161,151.101.66.187,TCP,66,59747  >  443 [ACK] Seq=154444 Ack=10088 Win=4104 Len=0 SLE=10018 SRE=10088
285,34.2613699,100.84.170.161,151.101.66.187,TLSv1.2,1892,Application Data
286,34.2720616,151.101.66.187,100.84.170.161,TCP,56,443  >  59747 [ACK] Seq=10088 Ack=156282 Win=4933 Len=0
287,34.2745655,151.101.66.187,100.84.170.161,TLSv1.2,240,Application Data
288,34.3032314,151.101.66.187,100.84.170.161,TCP,240,"[TCP Retransmission] 443  >  59747 [PSH, ACK] Seq=10088 Ack=156282 Win=4933 Len=186"
289,34.3032715,100.84.170.161,151.101.66.187,TCP,66,59747  >  443 [ACK] Seq=156282 Ack=10274 Win=4104 Len=0 SLE=10088 SRE=10274
290,34.7437018,100.84.170.161,151.101.66.187,TLSv1.2,899,Application Data
291,34.7440733,100.84.170.161,151.101.66.187,TLSv1.2,1871,Application Data
292,34.7443816,100.84.170.161,151.101.66.187,TLSv1.2,886,Application Data
293,34.744729,100.84.170.161,151.101.66.187,TLSv1.2,1871,Application Data
294,34.745,100.84.170.161,151.101.66.187,TLSv1.2,903,Application Data
295,34.7452003,100.84.170.161,151.101.66.187,TLSv1.2,1878,Application Data
296,34.7469147,100.84.170.161,151.101.66.187,TLSv1.2,906,Application Data
297,34.7470587,100.84.170.161,151.101.66.187,TLSv1.2,1848,Application Data
298,34.747139,100.84.170.161,151.101.66.187,TLSv1.2,909,Application Data
299,34.7496602,100.84.170.161,151.101.66.187,TLSv1.2,1845,Application Data
300,34.7497975,100.84.170.161,151.101.66.187,TLSv1.2,915,Application Data
301,34.7541424,151.101.66.187,100.84.170.161,TCP,56,443  >  59747 [ACK] Seq=10274 Ack=162442 Win=4940 Len=0
302,34.7544015,151.101.66.187,100.84.170.161,TCP,56,443  >  59747 [ACK] Seq=10274 Ack=164266 Win=4940 Len=0
303,34.7558554,151.101.66.187,100.84.170.161,TCP,56,443  >  59747 [ACK] Seq=10274 Ack=165118 Win=4940 Len=0
304,34.7569908,151.101.66.187,100.84.170.161,TCP,56,443  >  59747 [ACK] Seq=10274 Ack=167767 Win=4940 Len=0
305,34.7577329,151.101.66.187,100.84.170.161,TLSv1.2,124,Application Data
306,34.7581192,151.101.66.187,100.84.170.161,TLSv1.2,131,Application Data
307,34.7581523,100.84.170.161,151.101.66.187,TCP,54,59747  >  443 [ACK] Seq=170419 Ack=10421 Win=4103 Len=0
308,34.7589208,151.101.66.187,100.84.170.161,TCP,56,443  >  59747 [ACK] Seq=10421 Ack=170419 Win=4940 Len=0
309,34.7592752,151.101.66.187,100.84.170.161,TLSv1.2,180,Application Data
310,34.759959,151.101.66.187,100.84.170.161,TLSv1.2,130,Application Data
311,34.7600137,100.84.170.161,151.101.66.187,TCP,54,59747  >  443 [ACK] Seq=170419 Ack=10623 Win=4102 Len=0
312,34.7606633,151.101.66.187,100.84.170.161,TLSv1.2,169,Application Data
313,34.7616577,151.101.66.187,100.84.170.161,TLSv1.2,161,Application Data
314,34.7617071,100.84.170.161,151.101.66.187,TCP,54,59747  >  443 [ACK] Seq=170419 Ack=10845 Win=4101 Len=0
315,34.7619143,151.101.66.187,100.84.170.161,TLSv1.2,124,Application Data
316,34.7622237,151.101.66.187,100.84.170.161,TLSv1.2,130,Application Data
317,34.7622572,100.84.170.161,151.101.66.187,TCP,54,59747  >  443 [ACK] Seq=170419 Ack=10991 Win=4101 Len=0
318,34.7624913,151.101.66.187,100.84.170.161,TLSv1.2,176,Application Data
319,34.763795,151.101.66.187,100.84.170.161,TLSv1.2,124,Application Data
320,34.763851,100.84.170.161,151.101.66.187,TCP,54,59747  >  443 [ACK] Seq=170419 Ack=11183 Win=4100 Len=0
321,35.978949,100.84.170.161,151.101.66.187,TLSv1.2,1883,Application Data
322,35.9810968,100.84.170.161,151.101.66.187,TLSv1.2,864,Application Data
323,35.9888845,151.101.66.187,100.84.170.161,TCP,56,443  >  59747 [ACK] Seq=11183 Ack=172248 Win=4940 Len=0
324,35.9897273,151.101.66.187,100.84.170.161,TCP,56,443  >  59747 [ACK] Seq=11183 Ack=173058 Win=4940 Len=0
325,35.9918096,151.101.66.187,100.84.170.161,TLSv1.2,317,Application Data
326,35.9929869,151.101.66.187,100.84.170.161,TLSv1.2,130,Application Data
327,35.9930532,100.84.170.161,151.101.66.187,TCP,54,59747  >  443 [ACK] Seq=173058 Ack=11522 Win=4106 Len=0
328,36.0462567,100.84.170.161,151.101.66.187,TLSv1.2,1893,Application Data
329,36.0501132,100.84.170.161,151.101.66.187,TLSv1.2,853,Application Data
330,36.0555664,151.101.66.187,100.84.170.161,TCP,56,443  >  59747 [ACK] Seq=11522 Ack=174897 Win=4940 Len=0
331,36.0582256,151.101.66.187,100.84.170.161,TLSv1.2,130,Application Data
332,36.0590571,151.101.66.187,100.84.170.161,TCP,56,443  >  59747 [ACK] Seq=11598 Ack=175696 Win=4940 Len=0
333,36.0610063,151.101.66.187,100.84.170.161,TLSv1.2,131,Application Data
334,36.0610645,100.84.170.161,151.101.66.187,TCP,54,59747  >  443 [ACK] Seq=175696 Ack=11675 Win=4105 Len=0
335,44.8204159,100.84.170.161,151.101.66.187,TLSv1.2,1912,Application Data
336,44.8206074,100.84.170.161,151.101.66.187,TLSv1.2,860,Application Data
337,44.8312709,151.101.66.187,100.84.170.161,TCP,56,443  >  59747 [ACK] Seq=11675 Ack=178360 Win=4940 Len=0
338,44.8339644,151.101.66.187,100.84.170.161,TLSv1.2,241,Application Data
339,44.8342125,151.101.66.187,100.84.170.161,TLSv1.2,137,Application Data
340,44.8342546,100.84.170.161,151.101.66.187,TCP,54,59747  >  443 [ACK] Seq=178360 Ack=11945 Win=4104 Len=0
341,44.9554676,100.84.170.161,151.101.66.187,TLSv1.2,1904,Application Data
342,44.9557507,100.84.170.161,151.101.66.187,TLSv1.2,854,Application Data
343,44.9642732,151.101.66.187,100.84.170.161,TCP,56,443  >  59747 [ACK] Seq=11945 Ack=180210 Win=4940 Len=0
344,44.9646529,151.101.66.187,100.84.170.161,TCP,56,443  >  59747 [ACK] Seq=11945 Ack=181010 Win=4940 Len=0
345,44.9671144,151.101.66.187,100.84.170.161,TLSv1.2,104,Application Data
346,44.9681201,151.101.66.187,100.84.170.161,TLSv1.2,142,Application Data
347,44.9681917,100.84.170.161,151.101.66.187,TCP,54,59747  >  443 [ACK] Seq=181010 Ack=12083 Win=4104 Len=0
348,46.6797463,100.84.170.161,151.101.66.187,TLSv1.2,1959,Application Data
349,46.6904246,151.101.66.187,100.84.170.161,TCP,56,443  >  59747 [ACK] Seq=12083 Ack=182915 Win=4940 Len=0
350,46.8630009,151.101.66.187,100.84.170.161,TCP,14614,443  >  59747 [ACK] Seq=12083 Ack=182915 Win=4940 Len=14560 [TCP PDU reassembled in 351]
351,46.8630009,151.101.66.187,100.84.170.161,TLSv1.2,1466,Application Data
352,46.8630009,151.101.66.187,100.84.170.161,TCP,7334,443  >  59747 [ACK] Seq=28055 Ack=182915 Win=4940 Len=7280 [TCP PDU reassembled in 353]
353,46.8630009,151.101.66.187,100.84.170.161,TLSv1.2,1349,Application Data
354,46.8631205,100.84.170.161,151.101.66.187,TCP,54,59747  >  443 [ACK] Seq=182915 Ack=36630 Win=4106 Len=0
355,46.8652938,151.101.66.187,100.84.170.161,TCP,1349,"[TCP Spurious Retransmission] 443  >  59747 [PSH, ACK] Seq=35335 Ack=182915 Win=4940 Len=1295 [TCP PDU reassembled in 353]"
356,46.8653485,100.84.170.161,151.101.66.187,TCP,66,[TCP Dup ACK 354#1] 59747  >  443 [ACK] Seq=182915 Ack=36630 Win=4106 Len=0 SLE=35335 SRE=36630
357,46.865631,100.84.170.161,151.101.66.187,TLSv1.2,89,Application Data
358,46.8752148,151.101.66.187,100.84.170.161,TCP,56,443  >  59747 [ACK] Seq=36630 Ack=182950 Win=4940 Len=0
359,47.4618424,100.84.170.161,151.101.66.187,TLSv1.2,815,Application Data
360,47.4659881,100.84.170.161,151.101.66.187,TLSv1.2,1845,Application Data
361,47.4664559,100.84.170.161,151.101.66.187,TLSv1.2,841,Application Data
362,47.4666096,100.84.170.161,151.101.66.187,TLSv1.2,1841,Application Data
363,47.4717253,151.101.66.187,100.84.170.161,TCP,56,443  >  59747 [ACK] Seq=36630 Ack=183711 Win=4940 Len=0
364,47.474983,151.101.66.187,100.84.170.161,TCP,56,443  >  59747 [ACK] Seq=36630 Ack=185502 Win=4940 Len=0
365,47.4780559,151.101.66.187,100.84.170.161,TCP,56,443  >  59747 [ACK] Seq=36630 Ack=186289 Win=4940 Len=0
366,47.4780559,151.101.66.187,100.84.170.161,TLSv1.2,365,Application Data
367,47.4783471,151.101.66.187,100.84.170.161,TLSv1.2,130,Application Data
368,47.4783788,100.84.170.161,151.101.66.187,TCP,54,59747  >  443 [ACK] Seq=188076 Ack=37017 Win=4104 Len=0
369,47.4792041,151.101.66.187,100.84.170.161,TLSv1.2,194,"Application Data, Application Data"
370,47.479261,100.84.170.161,151.101.66.187,TCP,54,59747  >  443 [ACK] Seq=188076 Ack=37157 Win=4104 Len=0
371,47.5172338,100.84.170.161,151.101.66.187,TLSv1.2,789,Application Data
372,47.524522,100.84.170.161,151.101.66.187,TLSv1.2,1828,Application Data
373,47.5257404,151.101.66.187,100.84.170.161,TCP,56,443  >  59747 [ACK] Seq=37157 Ack=188811 Win=4940 Len=0
374,47.5279668,151.101.66.187,100.84.170.161,TLSv1.2,168,Application Data
375,47.5283313,151.101.66.187,100.84.170.161,TLSv1.2,306,Application Data
376,47.5283842,100.84.170.161,151.101.66.187,TCP,54,59747  >  443 [ACK] Seq=190585 Ack=37523 Win=4102 Len=0
377,47.5292041,100.84.170.161,151.101.66.187,TLSv1.2,831,Application Data
378,47.5293272,100.84.170.161,151.101.66.187,TLSv1.2,1882,Application Data
379,47.5329779,151.101.66.187,100.84.170.161,TCP,56,443  >  59747 [ACK] Seq=37523 Ack=190585 Win=4940 Len=0
380,47.535994,151.101.66.187,100.84.170.161,TLSv1.2,161,Application Data
381,47.5363095,151.101.66.187,100.84.170.161,TLSv1.2,482,Application Data
382,47.5364571,100.84.170.161,151.101.66.187,TCP,54,59747  >  443 [ACK] Seq=193190 Ack=38058 Win=4100 Len=0
383,47.538453,151.101.66.187,100.84.170.161,TCP,56,443  >  59747 [ACK] Seq=38058 Ack=193190 Win=4940 Len=0
384,47.5405472,151.101.66.187,100.84.170.161,TLSv1.2,131,Application Data
385,47.5408166,151.101.66.187,100.84.170.161,TLSv1.2,124,Application Data
386,47.5408867,100.84.170.161,151.101.66.187,TCP,54,59747  >  443 [ACK] Seq=193190 Ack=38205 Win=4106 Len=0
387,49.0551224,100.84.170.161,151.101.66.187,TLSv1.2,840,Application Data
388,49.0590618,100.84.170.161,151.101.66.187,TLSv1.2,1866,Application Data
389,49.0638718,151.101.66.187,100.84.170.161,TCP,56,443  >  59747 [ACK] Seq=38205 Ack=193976 Win=4940 Len=0
390,49.066358,151.101.66.187,100.84.170.161,TLSv1.2,316,Application Data
391,49.0677052,151.101.66.187,100.84.170.161,TCP,56,443  >  59747 [ACK] Seq=38467 Ack=195788 Win=4940 Len=0
392,49.0700491,151.101.66.187,100.84.170.161,TLSv1.2,136,Application Data
393,49.0701217,100.84.170.161,151.101.66.187,TCP,54,59747  >  443 [ACK] Seq=195788 Ack=38549 Win=4104 Len=0
394,50.6754562,100.84.170.161,151.101.66.187,TLSv1.2,854,Application Data
395,50.6757861,100.84.170.161,151.101.66.187,TLSv1.2,1907,Application Data
396,50.6850446,151.101.66.187,100.84.170.161,TCP,56,443  >  59747 [ACK] Seq=38549 Ack=198441 Win=4940 Len=0
397,50.68812,100.84.170.161,151.101.66.187,TLSv1.2,810,Application Data
398,50.6882563,151.101.66.187,100.84.170.161,TLSv1.2,214,Application Data
399,50.6888921,151.101.66.187,100.84.170.161,TLSv1.2,104,Application Data
400,50.6889363,100.84.170.161,151.101.66.187,TCP,54,59747  >  443 [ACK] Seq=199197 Ack=38759 Win=4104 Len=0
401,50.6969506,151.101.66.187,100.84.170.161,TCP,56,443  >  59747 [ACK] Seq=38759 Ack=199197 Win=4940 Len=0
402,50.698867,100.84.170.161,151.101.66.187,TLSv1.2,1870,Application Data
403,50.6990752,100.84.170.161,151.101.66.187,TLSv1.2,820,Application Data
404,50.6999486,151.101.66.187,100.84.170.161,TLSv1.2,126,Application Data
405,50.7026468,100.84.170.161,151.101.66.187,TLSv1.2,1866,Application Data
406,50.7031931,100.84.170.161,151.101.66.187,TLSv1.2,823,Application Data
407,50.7074349,151.101.66.187,100.84.170.161,TCP,56,443  >  59747 [ACK] Seq=38831 Ack=201013 Win=4940 Len=0
408,50.7079544,100.84.170.161,151.101.66.187,TLSv1.2,1901,Application Data
409,50.7082381,100.84.170.161,151.101.66.187,TLSv1.2,777,Application Data
410,50.7099068,151.101.66.187,100.84.170.161,TCP,56,443  >  59747 [ACK] Seq=38831 Ack=201779 Win=4940 Len=0
411,50.710156,151.101.66.187,100.84.170.161,TLSv1.2,227,Application Data
412,50.7114605,151.101.66.187,100.84.170.161,TLSv1.2,98,Application Data
413,50.7115191,100.84.170.161,151.101.66.187,TCP,54,59747  >  443 [ACK] Seq=206930 Ack=39048 Win=4102 Len=0
414,50.7118107,151.101.66.187,100.84.170.161,TCP,56,443  >  59747 [ACK] Seq=39048 Ack=203591 Win=4940 Len=0
415,50.7124816,151.101.66.187,100.84.170.161,TCP,56,443  >  59747 [ACK] Seq=39048 Ack=204360 Win=4940 Len=0
416,50.7136768,151.101.66.187,100.84.170.161,TLSv1.2,98,Application Data
417,50.7151034,151.101.66.187,100.84.170.161,TLSv1.2,104,Application Data
418,50.7151525,100.84.170.161,151.101.66.187,TCP,54,59747  >  443 [ACK] Seq=206930 Ack=39142 Win=4102 Len=0
419,50.7171341,151.101.66.187,100.84.170.161,TCP,56,443  >  59747 [ACK] Seq=39142 Ack=206930 Win=4940 Len=0
420,50.7196754,151.101.66.187,100.84.170.161,TLSv1.2,120,Application Data
421,50.7508912,151.101.66.187,100.84.170.161,TCP,120,"[TCP Retransmission] 443  >  59747 [PSH, ACK] Seq=39142 Ack=206930 Win=4940 Len=66"
422,50.7509389,100.84.170.161,151.101.66.187,TCP,66,59747  >  443 [ACK] Seq=206930 Ack=39208 Win=4102 Len=0 SLE=39142 SRE=39208
423,50.8107212,100.84.170.161,151.101.66.187,TLSv1.2,1916,Application Data
424,50.8205073,151.101.66.187,100.84.170.161,TCP,56,443  >  59747 [ACK] Seq=39208 Ack=208792 Win=4940 Len=0
425,50.8223488,151.101.66.187,100.84.170.161,TLSv1.2,104,Application Data
426,50.8474865,151.101.66.187,100.84.170.161,TCP,104,"[TCP Retransmission] 443  >  59747 [PSH, ACK] Seq=39208 Ack=208792 Win=4940 Len=50"
427,50.8475292,100.84.170.161,151.101.66.187,TCP,66,59747  >  443 [ACK] Seq=208792 Ack=39258 Win=4102 Len=0 SLE=39208 SRE=39258
428,52.0782642,100.84.170.161,151.101.66.187,TLSv1.2,916,Application Data
429,52.0812964,100.84.170.161,151.101.66.187,TLSv1.2,1762,Application Data
430,52.0888585,151.101.66.187,100.84.170.161,TCP,56,443  >  59747 [ACK] Seq=39258 Ack=209654 Win=4940 Len=0
431,52.0901865,151.101.66.187,100.84.170.161,TCP,56,443  >  59747 [ACK] Seq=39258 Ack=211362 Win=4940 Len=0
432,52.0915382,151.101.66.187,100.84.170.161,TLSv1.2,448,Application Data
433,52.0919289,151.101.66.187,100.84.170.161,TLSv1.2,131,Application Data
434,52.0919723,100.84.170.161,151.101.66.187,TCP,54,59747  >  443 [ACK] Seq=211362 Ack=39729 Win=4106 Len=0
435,52.0948494,100.84.170.161,151.101.66.187,TLSv1.2,89,Application Data
436,52.1036515,151.101.66.187,100.84.170.161,TCP,56,443  >  59747 [ACK] Seq=39729 Ack=211397 Win=4940 Len=0
437,52.2984235,100.84.170.161,151.101.66.187,TLSv1.2,915,Application Data
438,52.2992729,100.84.170.161,151.101.66.187,TLSv1.2,1767,Application Data
439,52.3077832,151.101.66.187,100.84.170.161,TCP,56,443  >  59747 [ACK] Seq=39729 Ack=212258 Win=4940 Len=0
440,52.3084534,151.101.66.187,100.84.170.161,TCP,56,443  >  59747 [ACK] Seq=39729 Ack=213971 Win=4940 Len=0
441,52.3100591,151.101.66.187,100.84.170.161,TLSv1.2,437,Application Data
442,52.3112854,151.101.66.187,100.84.170.161,TLSv1.2,206,Application Data
443,52.3113501,100.84.170.161,151.101.66.187,TCP,54,59747  >  443 [ACK] Seq=213971 Ack=40264 Win=4104 Len=0
444,53.6493105,100.84.170.161,151.101.66.187,TLSv1.2,982,Application Data
445,53.6526342,100.84.170.161,151.101.66.187,TLSv1.2,1744,Application Data
446,53.6528839,100.84.170.161,151.101.66.187,TLSv1.2,970,Application Data
447,53.6530603,100.84.170.161,151.101.66.187,TLSv1.2,1750,Application Data
448,53.6547471,100.84.170.161,151.101.66.187,TLSv1.2,986,Application Data
449,53.6550204,100.84.170.161,151.101.66.187,TLSv1.2,1744,Application Data
450,53.6552533,100.84.170.161,151.101.66.187,TLSv1.2,966,Application Data
451,53.6555391,100.84.170.161,151.101.66.187,TLSv1.2,1744,Application Data
452,53.6560395,100.84.170.161,151.101.66.187,TLSv1.2,992,Application Data
453,53.6562606,100.84.170.161,151.101.66.187,TLSv1.2,1718,Application Data
454,53.6585315,151.101.66.187,100.84.170.161,TCP,56,443  >  59747 [ACK] Seq=40264 Ack=214899 Win=4940 Len=0
455,53.6596168,100.84.170.161,151.101.66.187,TLSv1.2,985,Application Data
456,53.6608861,151.101.66.187,100.84.170.161,TLSv1.2,240,Application Data
457,53.6617144,151.101.66.187,100.84.170.161,TCP,56,443  >  59747 [ACK] Seq=40450 Ack=216589 Win=4940 Len=0
458,53.6619731,151.101.66.187,100.84.170.161,TCP,56,443  >  59747 [ACK] Seq=40450 Ack=219201 Win=4940 Len=0
459,53.663479,151.101.66.187,100.84.170.161,TCP,56,443  >  59747 [ACK] Seq=40450 Ack=220133 Win=4940 Len=0
460,53.6637544,151.101.66.187,100.84.170.161,TCP,56,443  >  59747 [ACK] Seq=40450 Ack=221823 Win=4940 Len=0
461,53.6640224,151.101.66.187,100.84.170.161,TCP,56,443  >  59747 [ACK] Seq=40450 Ack=222735 Win=4940 Len=0
462,53.6647863,151.101.66.187,100.84.170.161,TCP,56,443  >  59747 [ACK] Seq=40450 Ack=224425 Win=4940 Len=0
463,53.665154,151.101.66.187,100.84.170.161,TLSv1.2,130,Application Data
464,53.6652021,100.84.170.161,151.101.66.187,TCP,54,59747  >  443 [ACK] Seq=227958 Ack=40526 Win=4103 Len=0
465,53.6663443,151.101.66.187,100.84.170.161,TCP,56,443  >  59747 [ACK] Seq=40526 Ack=227027 Win=4940 Len=0
466,53.6663443,151.101.66.187,100.84.170.161,TLSv1.2,180,Application Data
467,53.6670642,151.101.66.187,100.84.170.161,TLSv1.2,253,Application Data
468,53.6671161,100.84.170.161,151.101.66.187,TCP,54,59747  >  443 [ACK] Seq=227958 Ack=40851 Win=4101 Len=0
469,53.6678738,151.101.66.187,100.84.170.161,TLSv1.2,130,Application Data
470,53.6693677,151.101.66.187,100.84.170.161,TLSv1.2,124,Application Data
471,53.6694373,100.84.170.161,151.101.66.187,TCP,54,59747  >  443 [ACK] Seq=227958 Ack=40997 Win=4101 Len=0
472,53.6696489,151.101.66.187,100.84.170.161,TLSv1.2,124,Application Data
473,53.6702926,151.101.66.187,100.84.170.161,TLSv1.2,125,Application Data
474,53.6702926,151.101.66.187,100.84.170.161,TLSv1.2,124,Application Data
475,53.6703522,100.84.170.161,151.101.66.187,TCP,54,59747  >  443 [ACK] Seq=227958 Ack=41208 Win=4106 Len=0
476,53.6717549,151.101.66.187,100.84.170.161,TLSv1.2,125,Application Data
477,53.671805,100.84.170.161,151.101.66.187,TCP,54,59747  >  443 [ACK] Seq=227958 Ack=41279 Win=4105 Len=0
478,56.5979502,100.84.170.161,151.101.66.187,TLSv1.2,1683,Application Data
479,56.6089787,151.101.66.187,100.84.170.161,TCP,56,443  >  59747 [ACK] Seq=41279 Ack=229587 Win=4940 Len=0
480,56.6632967,151.101.66.187,100.84.170.161,TLSv1.2,339,Application Data
481,56.6635234,151.101.66.187,100.84.170.161,TLSv1.2,357,Application Data
482,56.6635615,100.84.170.161,151.101.66.187,TCP,54,59747  >  443 [ACK] Seq=229587 Ack=41867 Win=4103 Len=0
