"No.","Time","Source","Destination","Protocol","Length","Info"
"1","0.000000000","172.20.40.110","151.101.194.187","TCP","66","64055  >  443 [SYN] Seq=0 Win=64240 Len=0 MSS=1460 WS=256 SACK_PERM"
"2","0.009156300","151.101.194.187","172.20.40.110","TCP","66","443  >  64055 [SYN, ACK] Seq=0 Ack=1 Win=65535 Len=0 MSS=1380 SACK_PERM WS=512"
"3","0.009279000","172.20.40.110","151.101.194.187","TCP","54","64055  >  443 [ACK] Seq=1 Ack=1 Win=131072 Len=0"
"4","0.010855400","172.20.40.110","151.101.194.187","TLSv1.3","2001","Client Hello (SNI=www.target.com)"
"5","0.024547200","151.101.194.187","172.20.40.110","TCP","60","443  >  64055 [ACK] Seq=1 Ack=1948 Win=144384 Len=0"
"6","0.026073400","151.101.194.187","172.20.40.110","TLSv1.3","1434","Server Hello, Change Cipher Spec, Application Data, Application Data"
"7","0.026073400","151.101.194.187","172.20.40.110","TLSv1.3","215","Application Data"
"8","0.026187600","172.20.40.110","151.101.194.187","TCP","54","64055  >  443 [ACK] Seq=1948 Ack=1542 Win=131072 Len=0"
"9","0.027429400","172.20.40.110","151.101.194.187","TLSv1.3","118","Change Cipher Spec, Application Data"
"10","0.027803000","172.20.40.110","151.101.194.187","TLSv1.3","146","Application Data"
"11","0.028666600","172.20.40.110","151.101.194.187","TLSv1.3","2852","Application Data"
"12","0.028936500","172.20.40.110","151.101.194.187","TLSv1.3","2853","Application Data"
"13","0.029132400","172.20.40.110","151.101.194.187","TLSv1.3","2858","Application Data"
"14","0.029411800","172.20.40.110","151.101.194.187","TLSv1.3","2867","Application Data"
"15","0.040407700","151.101.194.187","172.20.40.110","TCP","60","443  >  64055 [ACK] Seq=1542 Ack=2012 Win=144384 Len=0"
"16","0.040407700","151.101.194.187","172.20.40.110","TCP","60","443  >  64055 [ACK] Seq=1542 Ack=2104 Win=144384 Len=0"
"17","0.044077700","151.101.194.187","172.20.40.110","TLSv1.3","119","Application Data"
"18","0.044420200","172.20.40.110","151.101.194.187","TLSv1.3","85","Application Data"
"19","0.047595700","151.101.194.187","172.20.40.110","TCP","60","443  >  64055 [ACK] Seq=1607 Ack=4902 Win=141824 Len=0"
"20","0.047595700","151.101.194.187","172.20.40.110","TCP","60","443  >  64055 [ACK] Seq=1607 Ack=7701 Win=139264 Len=0"
"21","0.051876500","151.101.194.187","172.20.40.110","TLSv1.3","451","Application Data"
"22","0.051876500","151.101.194.187","172.20.40.110","TLSv1.3","130","Application Data"
"23","0.051983800","172.20.40.110","151.101.194.187","TCP","54","64055  >  443 [ACK] Seq=13349 Ack=2080 Win=130560 Len=0"
"24","0.055017400","151.101.194.187","172.20.40.110","TCP","60","443  >  64055 [ACK] Seq=2080 Ack=10505 Win=137216 Len=0"
"25","0.055017400","151.101.194.187","172.20.40.110","TCP","60","443  >  64055 [ACK] Seq=2080 Ack=13318 Win=134656 Len=0"
"26","0.055017400","151.101.194.187","172.20.40.110","TCP","60","443  >  64055 [ACK] Seq=2080 Ack=13349 Win=134656 Len=0"
"27","0.056258500","172.20.40.110","151.101.194.187","TLSv1.3","2852","Application Data"
"28","0.061321000","151.101.194.187","172.20.40.110","TLSv1.3","206","Application Data, Application Data"
"29","0.061411000","172.20.40.110","151.101.194.187","TCP","54","64055  >  443 [ACK] Seq=16147 Ack=2232 Win=130304 Len=0"
"30","0.070261000","151.101.194.187","172.20.40.110","TCP","60","443  >  64055 [ACK] Seq=2232 Ack=16147 Win=132096 Len=0"
"31","0.073900700","151.101.194.187","172.20.40.110","TLSv1.3","130","Application Data"
"32","0.108467100","151.101.194.187","172.20.40.110","TCP","130","[TCP Retransmission] 443  >  64055 [PSH, ACK] Seq=2232 Ack=16147 Win=132096 Len=76"
"33","0.108545000","172.20.40.110","151.101.194.187","TCP","66","64055  >  443 [ACK] Seq=16147 Ack=2308 Win=130304 Len=0 SLE=2232 SRE=2308"
"34","0.151265400","172.20.40.110","151.101.194.187","TLSv1.3","2866","Application Data"
"35","0.160774400","151.101.194.187","172.20.40.110","TCP","60","443  >  64055 [ACK] Seq=2308 Ack=18959 Win=129536 Len=0"
"36","0.172546600","151.101.194.187","172.20.40.110","TLSv1.3","131","Application Data"
"37","0.205831400","151.101.194.187","172.20.40.110","TCP","131","[TCP Retransmission] 443  >  64055 [PSH, ACK] Seq=2308 Ack=18959 Win=129536 Len=77"
"38","0.205897800","172.20.40.110","151.101.194.187","TCP","66","64055  >  443 [ACK] Seq=18959 Ack=2385 Win=130048 Len=0 SLE=2308 SRE=2385"
"39","0.257982400","172.20.40.110","151.101.194.187","TLSv1.3","2849","Application Data"
"40","0.271173200","151.101.194.187","172.20.40.110","TCP","60","443  >  64055 [ACK] Seq=2385 Ack=21754 Win=126976 Len=0"
"41","0.271173200","151.101.194.187","172.20.40.110","TLSv1.3","131","Application Data"
"42","0.273916600","172.20.40.110","151.101.194.187","TLSv1.3","2866","Application Data"
"43","0.283691700","151.101.194.187","172.20.40.110","TCP","60","443  >  64055 [ACK] Seq=2462 Ack=24566 Win=124416 Len=0"
"44","0.288022000","151.101.194.187","172.20.40.110","TLSv1.3","130","Application Data"
"45","0.321441300","151.101.194.187","172.20.40.110","TCP","130","[TCP Retransmission] 443  >  64055 [PSH, ACK] Seq=2462 Ack=24566 Win=124416 Len=76"
"46","0.321511700","172.20.40.110","151.101.194.187","TCP","66","64055  >  443 [ACK] Seq=24566 Ack=2538 Win=130048 Len=0 SLE=2462 SRE=2538"
"47","0.538314900","172.20.40.110","151.101.194.187","TLSv1.3","2804","Application Data"
"48","0.543607200","172.20.40.110","151.101.194.187","TLSv1.3","2866","Application Data"
"49","0.543838400","172.20.40.110","151.101.194.187","TLSv1.3","2858","Application Data"
"50","0.544781300","172.20.40.110","151.101.194.187","TLSv1.3","2849","Application Data"
"51","0.544975200","172.20.40.110","151.101.194.187","TLSv1.3","2852","Application Data"
"52","0.546083200","172.20.40.110","151.101.194.187","TLSv1.3","2851","Application Data"
"53","0.546328200","172.20.40.110","151.101.194.187","TLSv1.3","2855","Application Data"
"54","0.546488300","172.20.40.110","151.101.194.187","TLSv1.3","2853","Application Data"
"55","0.547505600","172.20.40.110","151.101.194.187","TLSv1.3","2854","Application Data"
"56","0.549643100","151.101.194.187","172.20.40.110","TCP","60","443  >  64055 [ACK] Seq=2538 Ack=27316 Win=121856 Len=0"
"57","0.560341500","151.101.194.187","172.20.40.110","TLSv1.3","173","Application Data"
"58","0.560341500","151.101.194.187","172.20.40.110","TLSv1.3","798","Application Data"
"59","0.560434800","172.20.40.110","151.101.194.187","TCP","54","64055  >  443 [ACK] Seq=49722 Ack=3401 Win=131072 Len=0"
"60","0.565813300","151.101.194.187","172.20.40.110","TCP","60","443  >  64055 [ACK] Seq=3401 Ack=30128 Win=119296 Len=0"
"61","0.565813300","151.101.194.187","172.20.40.110","TCP","60","443  >  64055 [ACK] Seq=3401 Ack=32932 Win=116736 Len=0"
"62","0.565813300","151.101.194.187","172.20.40.110","TLSv1.3","130","Application Data"
"63","0.565813300","151.101.194.187","172.20.40.110","TCP","60","443  >  64055 [ACK] Seq=3477 Ack=35727 Win=114176 Len=0"
"64","0.565813300","151.101.194.187","172.20.40.110","TCP","60","443  >  64055 [ACK] Seq=3477 Ack=38525 Win=111616 Len=0"
"65","0.568027800","151.101.194.187","172.20.40.110","TLSv1.3","130","Application Data"
"66","0.568027800","151.101.194.187","172.20.40.110","TLSv1.3","450","Application Data"
"67","0.568027800","151.101.194.187","172.20.40.110","TLSv1.3","130","Application Data"
"68","0.568121400","172.20.40.110","151.101.194.187","TCP","54","64055  >  443 [ACK] Seq=49722 Ack=4025 Win=130304 Len=0"
"69","0.572222500","151.101.194.187","172.20.40.110","TCP","60","443  >  64055 [ACK] Seq=4025 Ack=41322 Win=109568 Len=0"
"70","0.572222500","151.101.194.187","172.20.40.110","TCP","60","443  >  64055 [ACK] Seq=4025 Ack=44123 Win=107008 Len=0"
"71","0.572222500","151.101.194.187","172.20.40.110","TCP","60","443  >  64055 [ACK] Seq=4025 Ack=46922 Win=104448 Len=0"
"72","0.573161600","151.101.194.187","172.20.40.110","TCP","60","443  >  64055 [ACK] Seq=4025 Ack=49722 Win=101888 Len=0"
"73","0.593147100","151.101.194.187","172.20.40.110","TLSv1.3","130","Application Data"
"74","0.595874600","151.101.194.187","172.20.40.110","TLSv1.3","130","Application Data"
"75","0.596042100","172.20.40.110","151.101.194.187","TCP","54","64055  >  443 [ACK] Seq=49722 Ack=4177 Win=130304 Len=0"
"76","0.600523200","151.101.194.187","172.20.40.110","TLSv1.3","129","Application Data"
"77","0.608041700","151.101.194.187","172.20.40.110","TLSv1.3","130","Application Data"
"78","0.608240100","172.20.40.110","151.101.194.187","TCP","54","64055  >  443 [ACK] Seq=49722 Ack=4328 Win=130048 Len=0"
"79","0.651860100","151.101.194.187","172.20.40.110","TCP","130","[TCP Spurious Retransmission] 443  >  64055 [PSH, ACK] Seq=4252 Ack=49722 Win=101888 Len=76"
"80","0.651966700","172.20.40.110","151.101.194.187","TCP","66","[TCP Dup ACK 78#1] 64055  >  443 [ACK] Seq=49722 Ack=4328 Win=130048 Len=0 SLE=4252 SRE=4328"
"81","0.991852400","172.20.40.110","151.101.194.187","TLSv1.3","2896","Application Data"
"82","1.003421900","151.101.194.187","172.20.40.110","TCP","60","443  >  64055 [ACK] Seq=4328 Ack=52564 Win=99328 Len=0"
"83","1.008314500","151.101.194.187","172.20.40.110","TLSv1.3","241","Application Data"
"84","1.027376200","172.20.40.110","151.101.194.187","TLSv1.3","2897","Application Data"
"85","1.038481800","151.101.194.187","172.20.40.110","TCP","60","443  >  64055 [ACK] Seq=4515 Ack=55407 Win=98816 Len=0"
"86","1.041963400","151.101.194.187","172.20.40.110","TLSv1.3","130","Application Data"
"87","1.085127100","172.20.40.110","151.101.194.187","TCP","54","64055  >  443 [ACK] Seq=55407 Ack=4591 Win=129792 Len=0"
"88","1.085529600","151.101.194.187","172.20.40.110","TCP","130","[TCP Spurious Retransmission] 443  >  64055 [PSH, ACK] Seq=4515 Ack=55407 Win=101376 Len=76"
"89","1.085592100","172.20.40.110","151.101.194.187","TCP","66","[TCP Dup ACK 87#1] 64055  >  443 [ACK] Seq=55407 Ack=4591 Win=129792 Len=0 SLE=4515 SRE=4591"
"90","6.785910800","172.20.40.110","151.101.194.187","TLSv1.3","2896","Application Data"
"91","6.801623200","151.101.194.187","172.20.40.110","TCP","60","443  >  64055 [ACK] Seq=4591 Ack=58249 Win=98816 Len=0"
"92","6.805000000","151.101.194.187","172.20.40.110","TLSv1.3","214","Application Data"
"93","6.811944100","172.20.40.110","151.101.194.187","TLSv1.3","2897","Application Data"
"94","6.829484400","151.101.194.187","172.20.40.110","TCP","60","443  >  64055 [ACK] Seq=4751 Ack=61092 Win=99328 Len=0"
"95","6.830044400","151.101.194.187","172.20.40.110","TLSv1.3","103","Application Data"
"96","6.870929300","151.101.194.187","172.20.40.110","TCP","103","[TCP Retransmission] 443  >  64055 [PSH, ACK] Seq=4751 Ack=61092 Win=101376 Len=49"
"97","6.870978600","172.20.40.110","151.101.194.187","TCP","66","64055  >  443 [ACK] Seq=61092 Ack=4800 Win=131072 Len=0 SLE=4751 SRE=4800"
"98","8.729929300","172.20.40.110","151.101.194.187","TLSv1.3","2896","Application Data"
"99","8.747488600","151.101.194.187","172.20.40.110","TCP","60","443  >  64055 [ACK] Seq=4800 Ack=63934 Win=98816 Len=0"
"100","8.749784700","151.101.194.187","172.20.40.110","TLSv1.3","214","Application Data"
"101","8.755954400","172.20.40.110","151.101.194.187","TLSv1.3","2894","Application Data"
"102","8.773911500","151.101.194.187","172.20.40.110","TCP","60","443  >  64055 [ACK] Seq=4960 Ack=66774 Win=98816 Len=0"
"103","8.774026900","172.20.40.110","151.101.194.187","TLSv1.3","2897","Application Data"
"104","8.776910300","151.101.194.187","172.20.40.110","TLSv1.3","340","Application Data"
"105","8.789935600","151.101.194.187","172.20.40.110","TCP","60","443  >  64055 [ACK] Seq=5246 Ack=69617 Win=98816 Len=0"
"106","8.793366500","151.101.194.187","172.20.40.110","TLSv1.3","103","Application Data"
"107","8.793445400","172.20.40.110","151.101.194.187","TCP","54","64055  >  443 [ACK] Seq=69617 Ack=5295 Win=130560 Len=0"
"108","8.915329400","172.20.40.110","151.101.194.187","TLSv1.3","2900","Application Data"
"109","8.931397600","151.101.194.187","172.20.40.110","TCP","60","443  >  64055 [ACK] Seq=5295 Ack=72463 Win=98816 Len=0"
"110","8.934818500","151.101.194.187","172.20.40.110","TLSv1.3","130","Application Data"
"111","8.978050400","172.20.40.110","151.101.194.187","TCP","54","64055  >  443 [ACK] Seq=72463 Ack=5371 Win=130304 Len=0"
"112","8.979981400","151.101.194.187","172.20.40.110","TCP","130","[TCP Spurious Retransmission] 443  >  64055 [PSH, ACK] Seq=5295 Ack=72463 Win=101376 Len=76"
"113","8.980044800","172.20.40.110","151.101.194.187","TCP","66","[TCP Dup ACK 111#1] 64055  >  443 [ACK] Seq=72463 Ack=5371 Win=130304 Len=0 SLE=5295 SRE=5371"
"114","14.875431400","172.20.40.110","151.101.194.187","TLSv1.3","2896","Application Data"
"115","14.894204200","151.101.194.187","172.20.40.110","TCP","60","443  >  64055 [ACK] Seq=5371 Ack=75305 Win=98816 Len=0"
"116","14.896651100","151.101.194.187","172.20.40.110","TLSv1.3","214","Application Data"
"117","14.943708800","151.101.194.187","172.20.40.110","TCP","214","[TCP Retransmission] 443  >  64055 [PSH, ACK] Seq=5371 Ack=75305 Win=101376 Len=160"
"118","14.943823900","172.20.40.110","151.101.194.187","TCP","66","64055  >  443 [ACK] Seq=75305 Ack=5531 Win=130304 Len=0 SLE=5371 SRE=5531"
"119","16.693539900","172.20.40.110","151.101.194.187","TLSv1.3","2900","Application Data"
"120","16.704643300","151.101.194.187","172.20.40.110","TCP","60","443  >  64055 [ACK] Seq=5531 Ack=78151 Win=98816 Len=0"
"121","16.705176900","151.101.194.187","172.20.40.110","TLSv1.3","214","Application Data"
"122","16.752854800","151.101.194.187","172.20.40.110","TCP","214","[TCP Retransmission] 443  >  64055 [PSH, ACK] Seq=5531 Ack=78151 Win=101376 Len=160"
"123","16.752902000","172.20.40.110","151.101.194.187","TCP","66","64055  >  443 [ACK] Seq=78151 Ack=5691 Win=130048 Len=0 SLE=5531 SRE=5691"
"124","23.766514100","172.20.40.110","151.101.194.187","TLSv1.3","2896","Application Data"
"125","23.810350800","172.20.40.110","151.101.194.187","TCP","1434","[TCP Retransmission] 64055  >  443 [PSH, ACK] Seq=79613 Ack=5691 Win=130048 Len=1380"
"126","23.813594900","151.101.194.187","172.20.40.110","TCP","60","443  >  64055 [ACK] Seq=5691 Ack=80993 Win=98816 Len=0"
"127","23.817264400","151.101.194.187","172.20.40.110","TLSv1.3","214","Application Data"
"128","23.823714100","151.101.194.187","172.20.40.110","TCP","66","[TCP Dup ACK 126#1] 443  >  64055 [ACK] Seq=5851 Ack=80993 Win=101376 Len=0 SLE=79613 SRE=80993"
"129","23.863081100","172.20.40.110","151.101.194.187","TCP","54","64055  >  443 [ACK] Seq=80993 Ack=5851 Win=130048 Len=0"
"130","23.945103600","151.101.194.187","172.20.40.110","TCP","214","[TCP Spurious Retransmission] 443  >  64055 [PSH, ACK] Seq=5691 Ack=80993 Win=101376 Len=160"
"131","23.945174900","172.20.40.110","151.101.194.187","TCP","66","[TCP Dup ACK 129#1] 64055  >  443 [ACK] Seq=80993 Ack=5851 Win=130048 Len=0 SLE=5691 SRE=5851"
"132","27.527953700","172.20.40.110","151.101.194.187","TLSv1.3","2892","Application Data"
"133","27.534162400","172.20.40.110","151.101.194.187","TLSv1.3","2883","Application Data"
"134","27.538478000","151.101.194.187","172.20.40.110","TCP","60","443  >  64055 [ACK] Seq=5851 Ack=83831 Win=98816 Len=0"
"135","27.544042900","151.101.194.187","172.20.40.110","TLSv1.3","213","Application Data"
"136","27.545127400","151.101.194.187","172.20.40.110","TCP","60","443  >  64055 [ACK] Seq=6010 Ack=86660 Win=98816 Len=0"
"137","27.547310100","151.101.194.187","172.20.40.110","TLSv1.3","130","Application Data"
"138","27.547391100","172.20.40.110","151.101.194.187","TCP","54","64055  >  443 [ACK] Seq=86660 Ack=6086 Win=129792 Len=0"
"139","27.553398200","172.20.40.110","151.101.194.187","TLSv1.3","2877","Application Data"
"140","27.554783400","172.20.40.110","151.101.194.187","TLSv1.3","2877","Application Data"
"141","27.565922300","151.101.194.187","172.20.40.110","TCP","60","443  >  64055 [ACK] Seq=6086 Ack=89483 Win=98816 Len=0"
"142","27.565922300","151.101.194.187","172.20.40.110","TCP","60","443  >  64055 [ACK] Seq=6086 Ack=92306 Win=96256 Len=0"
"143","27.570571000","151.101.194.187","172.20.40.110","TLSv1.3","130","Application Data"
"144","27.570571000","151.101.194.187","172.20.40.110","TLSv1.3","130","Application Data"
"145","27.570649100","172.20.40.110","151.101.194.187","TCP","54","64055  >  443 [ACK] Seq=92306 Ack=6238 Win=131072 Len=0"
"146","27.642949200","172.20.40.110","151.101.194.187","TLSv1.3","2891","Application Data"
"147","27.651580400","151.101.194.187","172.20.40.110","TCP","60","443  >  64055 [ACK] Seq=6238 Ack=95143 Win=98816 Len=0"
"148","27.656144200","151.101.194.187","172.20.40.110","TLSv1.3","241","Application Data"
"149","27.695091700","151.101.194.187","172.20.40.110","TCP","241","[TCP Retransmission] 443  >  64055 [PSH, ACK] Seq=6238 Ack=95143 Win=101376 Len=187"
"150","27.695153500","172.20.40.110","151.101.194.187","TCP","66","64055  >  443 [ACK] Seq=95143 Ack=6425 Win=130816 Len=0 SLE=6238 SRE=6425"
"151","27.748668200","172.20.40.110","151.101.194.187","TLSv1.3","2874","Application Data"
"152","27.748927700","172.20.40.110","151.101.194.187","TLSv1.3","2891","Application Data"
"153","27.759378300","151.101.194.187","172.20.40.110","TCP","60","443  >  64055 [ACK] Seq=6425 Ack=97963 Win=98816 Len=0"
"154","27.760013000","151.101.194.187","172.20.40.110","TCP","60","443  >  64055 [ACK] Seq=6425 Ack=100800 Win=98304 Len=0"
"155","27.762469100","151.101.194.187","172.20.40.110","TLSv1.3","341","Application Data"
"156","27.763533900","151.101.194.187","172.20.40.110","TLSv1.3","130","Application Data"
"157","27.763662700","172.20.40.110","151.101.194.187","TCP","54","64055  >  443 [ACK] Seq=100800 Ack=6788 Win=130304 Len=0"
"158","27.935480500","172.20.40.110","151.101.194.187","TLSv1.3","2885","Application Data"
"159","27.944355700","151.101.194.187","172.20.40.110","TCP","60","443  >  64055 [ACK] Seq=6788 Ack=103631 Win=98816 Len=0"
"160","27.947887800","151.101.194.187","172.20.40.110","TLSv1.3","130","Application Data"
"161","27.985081600","151.101.194.187","172.20.40.110","TCP","130","[TCP Retransmission] 443  >  64055 [PSH, ACK] Seq=6788 Ack=103631 Win=101376 Len=76"
"162","27.985126600","172.20.40.110","151.101.194.187","TCP","66","64055  >  443 [ACK] Seq=103631 Ack=6864 Win=130304 Len=0 SLE=6788 SRE=6864"
"163","28.110667900","172.20.40.110","151.101.194.187","TLSv1.3","2892","Application Data"
"164","28.120101200","151.101.194.187","172.20.40.110","TCP","60","443  >  64055 [ACK] Seq=6864 Ack=106469 Win=98816 Len=0"
"165","28.120223700","172.20.40.110","151.101.194.187","TLSv1.3","2885","Application Data"
"166","28.126968300","151.101.194.187","172.20.40.110","TLSv1.3","131","Application Data"
"167","28.133335500","151.101.194.187","172.20.40.110","TCP","60","443  >  64055 [ACK] Seq=6941 Ack=109300 Win=99328 Len=0"
"168","28.136573400","172.20.40.110","151.101.194.187","TLSv1.3","2883","Application Data"
"169","28.136758600","151.101.194.187","172.20.40.110","TLSv1.3","130","Application Data"
"170","28.137098100","172.20.40.110","151.101.194.187","TLSv1.3","2886","Application Data"
"171","28.137410200","172.20.40.110","151.101.194.187","TLSv1.3","2887","Application Data"
"172","28.139521300","172.20.40.110","151.101.194.187","TLSv1.3","2889","Application Data"
"173","28.139828900","172.20.40.110","151.101.194.187","TLSv1.3","2888","Application Data"
"174","28.147674400","151.101.194.187","172.20.40.110","TCP","60","443  >  64055 [ACK] Seq=7017 Ack=112129 Win=98816 Len=0"
"175","28.151074600","151.101.194.187","172.20.40.110","TCP","60","443  >  64055 [ACK] Seq=7017 Ack=114961 Win=98304 Len=0"
"176","28.151074600","151.101.194.187","172.20.40.110","TCP","60","443  >  64055 [ACK] Seq=7017 Ack=117794 Win=95744 Len=0"
"177","28.152277800","151.101.194.187","172.20.40.110","TLSv1.3","130","Application Data"
"178","28.153609000","151.101.194.187","172.20.40.110","TLSv1.3","124","Application Data"
"179","28.153684500","172.20.40.110","151.101.194.187","TCP","54","64055  >  443 [ACK] Seq=123463 Ack=7163 Win=130048 Len=0"
"180","28.154720900","151.101.194.187","172.20.40.110","TLSv1.3","130","Application Data"
"181","28.157097100","151.101.194.187","172.20.40.110","TCP","60","443  >  64055 [ACK] Seq=7239 Ack=120629 Win=98816 Len=0"
"182","28.157097100","151.101.194.187","172.20.40.110","TCP","60","443  >  64055 [ACK] Seq=7239 Ack=123463 Win=98304 Len=0"
"183","28.160635800","151.101.194.187","172.20.40.110","TLSv1.3","129","Application Data"
"184","28.160635800","151.101.194.187","172.20.40.110","TLSv1.3","130","Application Data"
"185","28.160727800","172.20.40.110","151.101.194.187","TCP","54","64055  >  443 [ACK] Seq=123463 Ack=7390 Win=129792 Len=0"
"186","28.498714900","172.20.40.110","151.101.194.187","TLSv1.3","2886","Application Data"
"187","28.509823900","151.101.194.187","172.20.40.110","TCP","60","443  >  64055 [ACK] Seq=7390 Ack=126295 Win=98816 Len=0"
"188","28.513181000","151.101.194.187","172.20.40.110","TLSv1.3","104","Application Data"
"189","28.548295500","151.101.194.187","172.20.40.110","TCP","104","[TCP Retransmission] 443  >  64055 [PSH, ACK] Seq=7390 Ack=126295 Win=101376 Len=50"
"190","28.548362600","172.20.40.110","151.101.194.187","TCP","66","64055  >  443 [ACK] Seq=126295 Ack=7440 Win=129792 Len=0 SLE=7390 SRE=7440"
"191","28.594461800","172.20.40.110","151.101.194.187","TLSv1.3","2887","Application Data"
"192","28.605498900","151.101.194.187","172.20.40.110","TCP","60","443  >  64055 [ACK] Seq=7440 Ack=129128 Win=98816 Len=0"
"193","28.610139900","151.101.194.187","172.20.40.110","TLSv1.3","130","Application Data"
"194","28.645225700","151.101.194.187","172.20.40.110","TCP","130","[TCP Retransmission] 443  >  64055 [PSH, ACK] Seq=7440 Ack=129128 Win=101376 Len=76"
"195","28.645455900","172.20.40.110","151.101.194.187","TCP","66","64055  >  443 [ACK] Seq=129128 Ack=7516 Win=129792 Len=0 SLE=7440 SRE=7516"
"196","34.298116100","172.20.40.110","151.101.194.187","TLSv1.3","2886","Application Data"
"197","34.307461000","151.101.194.187","172.20.40.110","TCP","60","443  >  64055 [ACK] Seq=7516 Ack=131960 Win=98816 Len=0"
"198","34.310897400","151.101.194.187","172.20.40.110","TLSv1.3","241","Application Data"
"199","34.345325000","151.101.194.187","172.20.40.110","TCP","241","[TCP Retransmission] 443  >  64055 [PSH, ACK] Seq=7516 Ack=131960 Win=101376 Len=187"
"200","34.345393500","172.20.40.110","151.101.194.187","TCP","66","64055  >  443 [ACK] Seq=131960 Ack=7703 Win=131072 Len=0 SLE=7516 SRE=7703"
"201","34.381962700","172.20.40.110","151.101.194.187","TLSv1.3","2887","Application Data"
"202","34.400137400","151.101.194.187","172.20.40.110","TCP","60","443  >  64055 [ACK] Seq=7703 Ack=134793 Win=98816 Len=0"
"203","34.402397400","151.101.194.187","172.20.40.110","TLSv1.3","313","Application Data"
"204","34.436780400","151.101.194.187","172.20.40.110","TCP","313","[TCP Retransmission] 443  >  64055 [PSH, ACK] Seq=7703 Ack=134793 Win=101376 Len=259"
"205","34.436841200","172.20.40.110","151.101.194.187","TCP","66","64055  >  443 [ACK] Seq=134793 Ack=7962 Win=130816 Len=0 SLE=7703 SRE=7962"
"206","34.513328300","172.20.40.110","151.101.194.187","TLSv1.3","2895","Application Data"
"207","34.522721300","151.101.194.187","172.20.40.110","TCP","60","443  >  64055 [ACK] Seq=7962 Ack=137634 Win=98816 Len=0"
"208","34.525156900","151.101.194.187","172.20.40.110","TLSv1.3","130","Application Data"
"209","34.561582900","151.101.194.187","172.20.40.110","TCP","130","[TCP Retransmission] 443  >  64055 [PSH, ACK] Seq=7962 Ack=137634 Win=101376 Len=76"
"210","34.561671500","172.20.40.110","151.101.194.187","TCP","66","64055  >  443 [ACK] Seq=137634 Ack=8038 Win=130560 Len=0 SLE=7962 SRE=8038"
"211","39.065322000","172.20.40.110","151.101.130.187","TCP","66","57648  >  443 [SYN] Seq=0 Win=64240 Len=0 MSS=1460 WS=256 SACK_PERM"
"212","39.073118000","151.101.130.187","172.20.40.110","TCP","66","443  >  57648 [SYN, ACK] Seq=0 Ack=1 Win=65535 Len=0 MSS=1380 SACK_PERM WS=512"
"213","39.073226700","172.20.40.110","151.101.130.187","TCP","54","57648  >  443 [ACK] Seq=1 Ack=1 Win=66048 Len=0"
"214","39.074037700","172.20.40.110","151.101.130.187","TLSv1.3","2002","Client Hello (SNI=r2d2.target.com)"
"215","39.082684600","151.101.130.187","172.20.40.110","TCP","60","443  >  57648 [ACK] Seq=1 Ack=1949 Win=144384 Len=0"
"216","39.084307900","151.101.130.187","172.20.40.110","TLSv1.3","1434","Server Hello, Change Cipher Spec, Application Data, Application Data"
"217","39.084307900","151.101.130.187","172.20.40.110","TLSv1.3","215","Application Data"
"218","39.084406800","172.20.40.110","151.101.130.187","TCP","54","57648  >  443 [ACK] Seq=1949 Ack=1542 Win=66048 Len=0"
"219","39.085073100","172.20.40.110","151.101.130.187","TLSv1.3","118","Change Cipher Spec, Application Data"
"220","39.085394900","172.20.40.110","151.101.130.187","TLSv1.3","146","Application Data"
"221","39.085716600","172.20.40.110","151.101.130.187","TLSv1.3","597","Application Data"
"222","39.096857600","151.101.130.187","172.20.40.110","TCP","60","443  >  57648 [ACK] Seq=1542 Ack=2013 Win=144384 Len=0"
"223","39.096857600","151.101.130.187","172.20.40.110","TCP","60","443  >  57648 [ACK] Seq=1542 Ack=2105 Win=144384 Len=0"
"224","39.096857600","151.101.130.187","172.20.40.110","TLSv1.3","119","Application Data"
"225","39.096857600","151.101.130.187","172.20.40.110","TCP","60","443  >  57648 [ACK] Seq=1607 Ack=2648 Win=143872 Len=0"
"226","39.097136900","172.20.40.110","151.101.130.187","TLSv1.3","85","Application Data"
"227","39.108085900","151.101.130.187","172.20.40.110","TCP","60","443  >  57648 [ACK] Seq=1607 Ack=2679 Win=143872 Len=0"
"228","39.493491200","151.101.130.187","172.20.40.110","TLSv1.3","523","Application Data"
"229","39.493491200","151.101.130.187","172.20.40.110","TLSv1.3","86","Application Data"
"230","39.493491200","151.101.130.187","172.20.40.110","TLSv1.3","86","Application Data"
"231","39.493491200","151.101.130.187","172.20.40.110","TLSv1.3","87","Application Data"
"232","39.493491200","151.101.130.187","172.20.40.110","TLSv1.3","86","Application Data"
"233","39.493491200","151.101.130.187","172.20.40.110","TLSv1.3","86","Application Data"
"234","39.493491200","151.101.130.187","172.20.40.110","TLSv1.3","86","Application Data"
"235","39.493491200","151.101.130.187","172.20.40.110","TLSv1.3","919","Application Data"
"236","39.493491200","151.101.130.187","172.20.40.110","TLSv1.3","86","Application Data"
"237","39.493491200","151.101.130.187","172.20.40.110","TLSv1.3","86","Application Data"
"238","39.493491200","151.101.130.187","172.20.40.110","TLSv1.3","86","Application Data"
"239","39.493491200","151.101.130.187","172.20.40.110","TCP","86","[TCP Retransmission] 443  >  57648 [PSH, ACK] Seq=3198 Ack=2679 Win=143872 Len=32"
"240","39.493491200","151.101.130.187","172.20.40.110","TLSv1.3","87","Application Data"
"241","39.493491200","151.101.130.187","172.20.40.110","TLSv1.3","1020","Application Data"
"242","39.493491200","151.101.130.187","172.20.40.110","TLSv1.3","85","Application Data"
"243","39.493954000","172.20.40.110","151.101.130.187","TCP","66","57648  >  443 [ACK] Seq=2679 Ack=3230 Win=66048 Len=0 SLE=3198 SRE=3230"
"244","39.494086000","172.20.40.110","151.101.130.187","TCP","54","57648  >  443 [ACK] Seq=2679 Ack=4260 Win=65024 Len=0"
"245","43.263742600","172.20.40.110","151.101.194.187","TLSv1.3","2886","Application Data"
"246","43.274655300","151.101.194.187","172.20.40.110","TCP","60","443  >  64055 [ACK] Seq=8038 Ack=140466 Win=98816 Len=0"
"247","43.276058000","151.101.194.187","172.20.40.110","TLSv1.3","214","Application Data"
"248","43.300981000","172.20.40.110","151.101.194.187","TLSv1.3","2884","Application Data"
"249","43.310685300","151.101.194.187","172.20.40.110","TCP","214","[TCP Spurious Retransmission] 443  >  64055 [PSH, ACK] Seq=8038 Ack=140466 Win=101376 Len=160"
"250","43.310685300","151.101.194.187","172.20.40.110","TCP","60","443  >  64055 [ACK] Seq=8198 Ack=143296 Win=98816 Len=0"
"251","43.310765800","172.20.40.110","151.101.194.187","TCP","66","[TCP Dup ACK 248#1] 64055  >  443 [ACK] Seq=143296 Ack=8198 Win=130560 Len=0 SLE=8038 SRE=8198"
"252","43.312618000","172.20.40.110","151.101.194.187","TLSv1.3","2887","Application Data"
"253","43.312730200","151.101.194.187","172.20.40.110","TLSv1.3","130","Application Data"
"254","43.321866200","151.101.194.187","172.20.40.110","TCP","60","443  >  64055 [ACK] Seq=8274 Ack=146129 Win=98816 Len=0"
"255","43.325016500","151.101.194.187","172.20.40.110","TLSv1.3","103","Application Data"
"256","43.325121700","172.20.40.110","151.101.194.187","TCP","54","64055  >  443 [ACK] Seq=146129 Ack=8323 Win=130304 Len=0"
"257","48.771073900","172.20.40.110","151.101.194.187","TLSv1.3","2967","Application Data"
"258","48.783602600","151.101.194.187","172.20.40.110","TCP","60","443  >  64055 [ACK] Seq=8323 Ack=149042 Win=98816 Len=0"
"259","48.791791500","151.101.194.187","172.20.40.110","TLSv1.3","213","Application Data"
"260","48.824656700","151.101.194.187","172.20.40.110","TCP","213","[TCP Retransmission] 443  >  64055 [PSH, ACK] Seq=8323 Ack=149042 Win=101376 Len=159"
"261","48.824712400","172.20.40.110","151.101.194.187","TCP","66","64055  >  443 [ACK] Seq=149042 Ack=8482 Win=130304 Len=0 SLE=8323 SRE=8482"
"262","48.835308600","172.20.40.110","151.101.194.187","TLSv1.3","2958","Application Data"
"263","48.835627100","172.20.40.110","151.101.194.187","TLSv1.3","2952","Application Data"
"264","48.844734700","151.101.194.187","172.20.40.110","TCP","60","443  >  64055 [ACK] Seq=8482 Ack=151946 Win=107008 Len=0"
"265","48.845449300","172.20.40.110","151.101.194.187","TLSv1.3","2952","Application Data"
"266","48.848291200","151.101.194.187","172.20.40.110","TCP","60","443  >  64055 [ACK] Seq=8482 Ack=154844 Win=112640 Len=0"
"267","48.848291200","151.101.194.187","172.20.40.110","TLSv1.3","130","Application Data"
"268","48.850649200","151.101.194.187","172.20.40.110","TLSv1.3","130","Application Data"
"269","48.850728600","172.20.40.110","151.101.194.187","TCP","54","64055  >  443 [ACK] Seq=157742 Ack=8634 Win=130048 Len=0"
"270","48.856544300","151.101.194.187","172.20.40.110","TCP","60","443  >  64055 [ACK] Seq=8634 Ack=157742 Win=118784 Len=0"
"271","48.856544300","151.101.194.187","172.20.40.110","TLSv1.3","130","Application Data"
"272","48.893974900","151.101.194.187","172.20.40.110","TCP","130","[TCP Retransmission] 443  >  64055 [PSH, ACK] Seq=8634 Ack=157742 Win=118784 Len=76"
"273","48.894030800","172.20.40.110","151.101.194.187","TCP","66","64055  >  443 [ACK] Seq=157742 Ack=8710 Win=130048 Len=0 SLE=8634 SRE=8710"
"274","48.925210800","172.20.40.110","151.101.194.187","TLSv1.3","2966","Application Data"
"275","48.937275900","151.101.194.187","172.20.40.110","TCP","60","443  >  64055 [ACK] Seq=8710 Ack=160654 Win=124416 Len=0"
"276","48.940468200","151.101.194.187","172.20.40.110","TLSv1.3","104","Application Data"
"277","48.974307200","151.101.194.187","172.20.40.110","TCP","104","[TCP Retransmission] 443  >  64055 [PSH, ACK] Seq=8710 Ack=160654 Win=124416 Len=50"
"278","48.974406500","172.20.40.110","151.101.194.187","TCP","66","64055  >  443 [ACK] Seq=160654 Ack=8760 Win=129792 Len=0 SLE=8710 SRE=8760"
"279","49.006309200","172.20.40.110","151.101.194.187","TLSv1.3","2949","Application Data"
"280","49.018011600","151.101.194.187","172.20.40.110","TCP","60","443  >  64055 [ACK] Seq=8760 Ack=163549 Win=130048 Len=0"
"281","49.020298900","151.101.194.187","172.20.40.110","TLSv1.3","131","Application Data"
"282","49.054830600","151.101.194.187","172.20.40.110","TCP","131","[TCP Retransmission] 443  >  64055 [PSH, ACK] Seq=8760 Ack=163549 Win=130048 Len=77"
"283","49.054882300","172.20.40.110","151.101.194.187","TCP","66","64055  >  443 [ACK] Seq=163549 Ack=8837 Win=129792 Len=0 SLE=8760 SRE=8837"
"284","49.058867700","172.20.40.110","151.101.194.187","TLSv1.3","2966","Application Data"
"285","49.074384900","151.101.194.187","172.20.40.110","TCP","60","443  >  64055 [ACK] Seq=8837 Ack=166461 Win=136192 Len=0"
"286","49.075773300","151.101.194.187","172.20.40.110","TLSv1.3","130","Application Data"
"287","49.112020700","151.101.194.187","172.20.40.110","TCP","130","[TCP Retransmission] 443  >  64055 [PSH, ACK] Seq=8837 Ack=166461 Win=136192 Len=76"
"288","49.112091100","172.20.40.110","151.101.194.187","TCP","66","64055  >  443 [ACK] Seq=166461 Ack=8913 Win=129792 Len=0 SLE=8837 SRE=8913"
"289","49.294898500","172.20.40.110","151.101.194.187","TLSv1.3","2949","Application Data"
"290","49.297472800","172.20.40.110","151.101.194.187","TLSv1.3","2958","Application Data"
"291","49.297691500","172.20.40.110","151.101.194.187","TLSv1.3","2952","Application Data"
"292","49.297867600","172.20.40.110","151.101.194.187","TLSv1.3","2953","Application Data"
"293","49.298004800","172.20.40.110","151.101.194.187","TLSv1.3","2954","Application Data"
"294","49.298134300","172.20.40.110","151.101.194.187","TLSv1.3","2955","Application Data"
"295","49.298328800","172.20.40.110","151.101.194.187","TLSv1.3","2951","Application Data"
"296","49.316800300","151.101.194.187","172.20.40.110","TCP","60","443  >  64055 [ACK] Seq=8913 Ack=169356 Win=141824 Len=0"
"297","49.316800300","151.101.194.187","172.20.40.110","TCP","60","443  >  64055 [ACK] Seq=8913 Ack=172260 Win=147456 Len=0"
"298","49.316800300","151.101.194.187","172.20.40.110","TCP","60","443  >  64055 [ACK] Seq=8913 Ack=175158 Win=153600 Len=0"
"299","49.316800300","151.101.194.187","172.20.40.110","TLSv1.3","131","Application Data"
"300","49.316800300","151.101.194.187","172.20.40.110","TLSv1.3","340","Application Data"
"301","49.316800300","151.101.194.187","172.20.40.110","TLSv1.3","130","Application Data"
"302","49.316800300","151.101.194.187","172.20.40.110","TCP","60","443  >  64055 [ACK] Seq=9352 Ack=178057 Win=159232 Len=0"
"303","49.316800300","151.101.194.187","172.20.40.110","TCP","60","443  >  64055 [ACK] Seq=9352 Ack=180957 Win=165376 Len=0"
"304","49.316922400","172.20.40.110","151.101.194.187","TCP","54","64055  >  443 [ACK] Seq=186755 Ack=9352 Win=131072 Len=0"
"305","49.322184800","151.101.194.187","172.20.40.110","TCP","60","443  >  64055 [ACK] Seq=9352 Ack=183858 Win=171008 Len=0"
"306","49.322184800","151.101.194.187","172.20.40.110","TLSv1.3","206","Application Data, Application Data"
"307","49.322184800","151.101.194.187","172.20.40.110","TLSv1.3","239","Application Data"
"308","49.322376700","172.20.40.110","151.101.194.187","TCP","54","64055  >  443 [ACK] Seq=186755 Ack=9689 Win=130560 Len=0"
"309","49.326288600","151.101.194.187","172.20.40.110","TCP","60","443  >  64055 [ACK] Seq=9689 Ack=186755 Win=176640 Len=0"
"310","49.326288600","151.101.194.187","172.20.40.110","TLSv1.3","130","Application Data"
"311","49.362797200","151.101.194.187","172.20.40.110","TCP","130","[TCP Retransmission] 443  >  64055 [PSH, ACK] Seq=9689 Ack=186755 Win=176640 Len=76"
"312","49.362841700","172.20.40.110","151.101.194.187","TCP","66","64055  >  443 [ACK] Seq=186755 Ack=9765 Win=130560 Len=0 SLE=9689 SRE=9765"
"313","49.495674700","172.20.40.110","151.101.194.187","TLSv1.3","2924","Application Data"
"314","49.509602000","151.101.194.187","172.20.40.110","TCP","60","443  >  64055 [ACK] Seq=9765 Ack=189625 Win=182272 Len=0"
"315","49.516298900","151.101.194.187","172.20.40.110","TLSv1.3","130","Application Data"
"316","49.549211200","151.101.194.187","172.20.40.110","TCP","130","[TCP Retransmission] 443  >  64055 [PSH, ACK] Seq=9765 Ack=189625 Win=182272 Len=76"
"317","49.549270100","172.20.40.110","151.101.194.187","TCP","66","64055  >  443 [ACK] Seq=189625 Ack=9841 Win=130560 Len=0 SLE=9765 SRE=9841"
"318","49.731348900","172.20.40.110","151.101.194.187","TLSv1.3","2966","Application Data"
"319","49.745160600","151.101.194.187","172.20.40.110","TCP","60","443  >  64055 [ACK] Seq=9841 Ack=192537 Win=188416 Len=0"
"320","49.747661400","172.20.40.110","151.101.194.187","TLSv1.3","2967","Application Data"
"321","49.750562000","151.101.194.187","172.20.40.110","TLSv1.3","241","Application Data"
"322","49.756521200","151.101.194.187","172.20.40.110","TCP","60","443  >  64055 [ACK] Seq=10028 Ack=195450 Win=194560 Len=0"
"323","49.761059800","151.101.194.187","172.20.40.110","TLSv1.3","130","Application Data"
"324","49.761138700","172.20.40.110","151.101.194.187","TCP","54","64055  >  443 [ACK] Seq=195450 Ack=10104 Win=130304 Len=0"
"325","53.335154900","172.20.40.110","151.101.194.187","TLSv1.3","2980","Application Data"
"326","53.346630900","151.101.194.187","172.20.40.110","TCP","60","443  >  64055 [ACK] Seq=10104 Ack=198376 Win=200192 Len=0"
"327","53.351213900","151.101.194.187","172.20.40.110","TLSv1.3","214","Application Data"
"328","53.365160500","172.20.40.110","151.101.194.187","TLSv1.3","2981","Application Data"
"329","53.374129300","151.101.194.187","172.20.40.110","TCP","60","443  >  64055 [ACK] Seq=10264 Ack=201303 Win=205824 Len=0"
"330","53.376344100","151.101.194.187","172.20.40.110","TLSv1.3","147","Application Data"
"331","53.412689100","151.101.194.187","172.20.40.110","TCP","147","[TCP Retransmission] 443  >  64055 [PSH, ACK] Seq=10264 Ack=201303 Win=205824 Len=93"
"332","53.412742800","172.20.40.110","151.101.194.187","TCP","66","64055  >  443 [ACK] Seq=201303 Ack=10357 Win=130048 Len=0 SLE=10264 SRE=10357"
