"No.","Time","Source","Destination","Protocol","Length","Info"
"1","0.000000000","100.84.170.161","151.101.66.187","TLSv1.2","2545","Application Data"
"2","0.000157700","100.84.170.161","151.101.66.187","TLSv1.2","93","Application Data"
"3","0.009528700","151.101.66.187","100.84.170.161","TCP","56","443  >  59747 [ACK] Seq=1 Ack=2531 Win=565 Len=0"
"4","0.010919500","151.101.66.187","100.84.170.161","TLSv1.2","93","Application Data"
"5","0.013279500","151.101.66.187","100.84.170.161","TLSv1.2","214","Application Data"
"6","0.013367900","100.84.170.161","151.101.66.187","TCP","54","59747  >  443 [ACK] Seq=2531 Ack=200 Win=510 Len=0"
"7","0.238988600","100.84.170.161","151.101.66.187","TLSv1.2","2543","Application Data"
"8","0.249499600","151.101.66.187","100.84.170.161","TCP","56","443  >  59747 [ACK] Seq=200 Ack=5020 Win=575 Len=0"
"9","0.254289100","151.101.66.187","100.84.170.161","TLSv1.2","235","Application Data"
"10","0.284740600","151.101.66.187","100.84.170.161","TCP","235","[TCP Retransmission] 443  >  59747 [PSH, ACK] Seq=200 Ack=5020 Win=575 Len=181"
"11","0.284783700","100.84.170.161","151.101.66.187","TCP","66","59747  >  443 [ACK] Seq=5020 Ack=381 Win=510 Len=0 SLE=200 SRE=381"
"12","0.350522100","100.84.170.161","151.101.66.187","TLSv1.2","2546","Application Data"
"13","0.359893300","151.101.66.187","100.84.170.161","TCP","56","443  >  59747 [ACK] Seq=381 Ack=7512 Win=585 Len=0"
"14","0.362232900","151.101.66.187","100.84.170.161","TLSv1.2","98","Application Data"
"15","0.391892600","151.101.66.187","100.84.170.161","TCP","98","[TCP Retransmission] 443  >  59747 [PSH, ACK] Seq=381 Ack=7512 Win=585 Len=44"
"16","0.391956400","100.84.170.161","151.101.66.187","TCP","66","59747  >  443 [ACK] Seq=7512 Ack=425 Win=510 Len=0 SLE=381 SRE=425"
"17","1.434599800","100.84.170.161","151.101.66.187","TCP","66","55359  >  443 [SYN] Seq=0 Win=64240 Len=0 MSS=1460 WS=256 SACK_PERM"
"18","1.447506800","151.101.66.187","100.84.170.161","TCP","66","443  >  55359 [SYN, ACK] Seq=0 Ack=1 Win=65535 Len=0 MSS=1460 SACK_PERM WS=512"
"19","1.447573000","100.84.170.161","151.101.66.187","TCP","54","55359  >  443 [ACK] Seq=1 Ack=1 Win=131328 Len=0"
"20","1.454803200","100.84.170.161","151.101.66.187","TLSv1.3","2098","Client Hello (SNI=r2d2.target.com)"
"21","1.464259100","151.101.66.187","100.84.170.161","TCP","56","443  >  55359 [ACK] Seq=1 Ack=2045 Win=144384 Len=0"
"22","1.464611800","151.101.66.187","100.84.170.161","TLSv1.3","1510","Server Hello, Change Cipher Spec, Application Data, Application Data"
"23","1.465132600","151.101.66.187","100.84.170.161","TLSv1.3","139","Application Data"
"24","1.465172600","100.84.170.161","151.101.66.187","TCP","54","55359  >  443 [ACK] Seq=2045 Ack=1542 Win=131328 Len=0"
"25","1.465349900","100.84.170.161","151.101.66.187","TLSv1.3","118","Change Cipher Spec, Application Data"
"26","1.465580300","100.84.170.161","151.101.66.187","TLSv1.3","146","Application Data"
"27","1.465868800","100.84.170.161","151.101.66.187","TLSv1.3","597","Application Data"
"28","1.474990200","151.101.66.187","100.84.170.161","TCP","56","443  >  55359 [ACK] Seq=1542 Ack=2744 Win=143872 Len=0"
"29","1.475340500","151.101.66.187","100.84.170.161","TLSv1.3","119","Application Data"
"30","1.475648300","100.84.170.161","151.101.66.187","TLSv1.3","85","Application Data"
"31","1.484257000","151.101.66.187","100.84.170.161","TCP","56","443  >  55359 [ACK] Seq=1607 Ack=2775 Win=143872 Len=0"
"32","1.528505000","151.101.66.187","100.84.170.161","TLSv1.3","512","Application Data"
"33","1.528687000","151.101.66.187","100.84.170.161","TLSv1.3","94","Application Data"
"34","1.528716700","100.84.170.161","151.101.66.187","TCP","54","55359  >  443 [ACK] Seq=2775 Ack=2105 Win=130816 Len=0"
"35","1.529531900","151.101.66.187","100.84.170.161","TLSv1.3","86","Application Data"
"36","1.529945400","151.101.66.187","100.84.170.161","TLSv1.3","1510","Application Data"
"37","1.529993900","100.84.170.161","151.101.66.187","TCP","54","55359  >  443 [ACK] Seq=2775 Ack=3593 Win=131328 Len=0"
"38","1.530837900","151.101.66.187","100.84.170.161","TLSv1.3","2966","Application Data, Application Data"
"39","1.530837900","151.101.66.187","100.84.170.161","TLSv1.3","580","Application Data"
"40","1.530899300","100.84.170.161","151.101.66.187","TCP","54","55359  >  443 [ACK] Seq=2775 Ack=7031 Win=131328 Len=0"
"41","5.637877500","100.84.170.161","151.101.66.187","TLSv1.2","2545","Application Data"
"42","5.646437300","151.101.66.187","100.84.170.161","TCP","56","443  >  59747 [ACK] Seq=425 Ack=10003 Win=594 Len=0"
"43","5.649940200","151.101.66.187","100.84.170.161","TLSv1.2","241","Application Data"
"44","5.678904300","151.101.66.187","100.84.170.161","TCP","241","[TCP Retransmission] 443  >  59747 [PSH, ACK] Seq=425 Ack=10003 Win=594 Len=187"
"45","5.678948800","100.84.170.161","151.101.66.187","TCP","66","59747  >  443 [ACK] Seq=10003 Ack=612 Win=509 Len=0 SLE=425 SRE=612"
"46","5.707849300","100.84.170.161","151.101.66.187","TLSv1.2","2543","Application Data"
"47","5.716788700","151.101.66.187","100.84.170.161","TCP","56","443  >  59747 [ACK] Seq=612 Ack=12492 Win=604 Len=0"
"48","5.720608900","151.101.66.187","100.84.170.161","TLSv1.2","148","Application Data"
"49","5.742747600","100.84.170.161","151.101.66.187","TLSv1.2","2546","Application Data"
"50","5.749961700","151.101.66.187","100.84.170.161","TCP","148","[TCP Spurious Retransmission] 443  >  59747 [PSH, ACK] Seq=612 Ack=12492 Win=604 Len=94"
"51","5.750007900","100.84.170.161","151.101.66.187","TCP","66","[TCP Dup ACK 49#1] 59747  >  443 [ACK] Seq=14984 Ack=706 Win=508 Len=0 SLE=612 SRE=706"
"52","5.751371100","151.101.66.187","100.84.170.161","TCP","56","443  >  59747 [ACK] Seq=706 Ack=14984 Win=614 Len=0"
"53","5.754418900","151.101.66.187","100.84.170.161","TLSv1.2","98","Application Data"
"54","5.784874200","151.101.66.187","100.84.170.161","TCP","98","[TCP Retransmission] 443  >  59747 [PSH, ACK] Seq=706 Ack=14984 Win=614 Len=44"
"55","5.784924900","100.84.170.161","151.101.66.187","TCP","66","59747  >  443 [ACK] Seq=14984 Ack=750 Win=508 Len=0 SLE=706 SRE=750"
"56","9.275844200","100.84.170.161","151.101.66.187","TLSv1.2","2536","Application Data"
"57","9.284541600","100.84.170.161","151.101.66.187","TLSv1.2","2527","Application Data"
"58","9.286173300","151.101.66.187","100.84.170.161","TCP","56","443  >  59747 [ACK] Seq=750 Ack=17466 Win=624 Len=0"
"59","9.288182000","100.84.170.161","151.101.66.187","TLSv1.2","2522","Application Data"
"60","9.288810500","100.84.170.161","151.101.66.187","TLSv1.2","2521","Application Data"
"61","9.290737200","151.101.66.187","100.84.170.161","TLSv1.2","214","Application Data"
"62","9.293521000","151.101.66.187","100.84.170.161","TCP","56","443  >  59747 [ACK] Seq=910 Ack=19939 Win=633 Len=0"
"63","9.296122000","151.101.66.187","100.84.170.161","TLSv1.2","290","Application Data"
"64","9.296191800","100.84.170.161","151.101.66.187","TCP","54","59747  >  443 [ACK] Seq=24874 Ack=1146 Win=513 Len=0"
"65","9.297516600","151.101.66.187","100.84.170.161","TCP","56","443  >  59747 [ACK] Seq=1146 Ack=22407 Win=643 Len=0"
"66","9.298947200","151.101.66.187","100.84.170.161","TCP","56","443  >  59747 [ACK] Seq=1146 Ack=24874 Win=652 Len=0"
"67","9.300119400","151.101.66.187","100.84.170.161","TLSv1.2","130","Application Data"
"68","9.300927500","151.101.66.187","100.84.170.161","TLSv1.2","131","Application Data"
"69","9.300993400","100.84.170.161","151.101.66.187","TCP","54","59747  >  443 [ACK] Seq=24874 Ack=1299 Win=512 Len=0"
"70","9.376905000","100.84.170.161","151.101.66.187","TLSv1.2","2521","Application Data"
"71","9.386102900","151.101.66.187","100.84.170.161","TCP","56","443  >  59747 [ACK] Seq=1299 Ack=27341 Win=662 Len=0"
"72","9.389500000","151.101.66.187","100.84.170.161","TLSv1.2","124","Application Data"
"73","9.418875100","151.101.66.187","100.84.170.161","TCP","124","[TCP Retransmission] 443  >  59747 [PSH, ACK] Seq=1299 Ack=27341 Win=662 Len=70"
"74","9.418923200","100.84.170.161","151.101.66.187","TCP","66","59747  >  443 [ACK] Seq=27341 Ack=1369 Win=512 Len=0 SLE=1299 SRE=1369"
"75","9.428792500","100.84.170.161","151.101.66.187","TLSv1.2","2535","Application Data"
"76","9.437906800","151.101.66.187","100.84.170.161","TCP","56","443  >  59747 [ACK] Seq=1369 Ack=29822 Win=672 Len=0"
"77","9.441029900","151.101.66.187","100.84.170.161","TLSv1.2","98","Application Data"
"78","9.470988600","151.101.66.187","100.84.170.161","TCP","98","[TCP Retransmission] 443  >  59747 [PSH, ACK] Seq=1369 Ack=29822 Win=672 Len=44"
"79","9.471042300","100.84.170.161","151.101.66.187","TCP","66","59747  >  443 [ACK] Seq=29822 Ack=1413 Win=512 Len=0 SLE=1369 SRE=1413"
"80","9.531784900","100.84.170.161","151.101.66.187","TLSv1.2","2518","Application Data"
"81","9.540763400","151.101.66.187","100.84.170.161","TCP","56","443  >  59747 [ACK] Seq=1413 Ack=32286 Win=681 Len=0"
"82","9.543275500","151.101.66.187","100.84.170.161","TLSv1.2","131","Application Data"
"83","9.553626800","100.84.170.161","151.101.66.187","TLSv1.2","2535","Application Data"
"84","9.562718000","151.101.66.187","100.84.170.161","TCP","56","443  >  59747 [ACK] Seq=1490 Ack=34767 Win=691 Len=0"
"85","9.565201200","151.101.66.187","100.84.170.161","TLSv1.2","124","Application Data"
"86","9.597229300","151.101.66.187","100.84.170.161","TCP","124","[TCP Retransmission] 443  >  59747 [PSH, ACK] Seq=1490 Ack=34767 Win=691 Len=70"
"87","9.597290400","100.84.170.161","151.101.66.187","TCP","66","59747  >  443 [ACK] Seq=34767 Ack=1560 Win=511 Len=0 SLE=1490 SRE=1560"
"88","9.789697600","100.84.170.161","151.101.66.187","TLSv1.2","2522","Application Data"
"89","9.795048200","100.84.170.161","151.101.66.187","TLSv1.2","2530","Application Data"
"90","9.798823300","151.101.66.187","100.84.170.161","TCP","56","443  >  59747 [ACK] Seq=1560 Ack=37235 Win=701 Len=0"
"91","9.802168600","151.101.66.187","100.84.170.161","TLSv1.2","124","Application Data"
"92","9.803748100","151.101.66.187","100.84.170.161","TCP","56","443  >  59747 [ACK] Seq=1630 Ack=39711 Win=710 Len=0"
"93","9.806479700","151.101.66.187","100.84.170.161","TLSv1.2","131","Application Data"
"94","9.806554700","100.84.170.161","151.101.66.187","TCP","54","59747  >  443 [ACK] Seq=39711 Ack=1707 Win=511 Len=0"
"95","9.882244600","100.84.170.161","151.101.66.187","TLSv1.2","2536","Application Data"
"96","9.882999900","100.84.170.161","151.101.66.187","TLSv1.2","2520","Application Data"
"97","9.891330000","151.101.66.187","100.84.170.161","TCP","56","443  >  59747 [ACK] Seq=1707 Ack=42193 Win=720 Len=0"
"98","9.891593900","151.101.66.187","100.84.170.161","TCP","56","443  >  59747 [ACK] Seq=1707 Ack=44659 Win=730 Len=0"
"99","9.893906900","151.101.66.187","100.84.170.161","TLSv1.2","125","Application Data"
"100","9.894799700","151.101.66.187","100.84.170.161","TLSv1.2","124","Application Data"
"101","9.894859000","100.84.170.161","151.101.66.187","TCP","54","59747  >  443 [ACK] Seq=44659 Ack=1848 Win=510 Len=0"
"102","10.090150400","100.84.170.161","151.101.66.187","TLSv1.2","2544","Application Data"
"103","10.090376400","100.84.170.161","151.101.66.187","TLSv1.2","2544","Application Data"
"104","10.091426500","100.84.170.161","151.101.66.187","TLSv1.2","2540","Application Data"
"105","10.092516300","100.84.170.161","151.101.66.187","TLSv1.2","2536","Application Data"
"106","10.098142000","100.84.170.161","151.101.66.187","TLSv1.2","2527","Application Data"
"107","10.099209800","151.101.66.187","100.84.170.161","TCP","56","443  >  59747 [ACK] Seq=1848 Ack=49639 Win=749 Len=0"
"108","10.099894100","100.84.170.161","151.101.66.187","TLSv1.2","2528","Application Data"
"109","10.101191700","151.101.66.187","100.84.170.161","TCP","56","443  >  59747 [ACK] Seq=1848 Ack=52125 Win=759 Len=0"
"110","10.101737600","151.101.66.187","100.84.170.161","TLSv1.2","240","Application Data"
"111","10.103348000","151.101.66.187","100.84.170.161","TLSv1.2","131","Application Data"
"112","10.103395000","100.84.170.161","151.101.66.187","TCP","54","59747  >  443 [ACK] Seq=59554 Ack=2111 Win=509 Len=0"
"113","10.103684800","151.101.66.187","100.84.170.161","TLSv1.2","130","Application Data"
"114","10.104333100","151.101.66.187","100.84.170.161","TLSv1.2","174","Application Data"
"115","10.104373800","100.84.170.161","151.101.66.187","TCP","54","59747  >  443 [ACK] Seq=59554 Ack=2307 Win=508 Len=0"
"116","10.107040400","151.101.66.187","100.84.170.161","TCP","56","443  >  59747 [ACK] Seq=2307 Ack=57080 Win=778 Len=0"
"117","10.108734800","151.101.66.187","100.84.170.161","TCP","56","443  >  59747 [ACK] Seq=2307 Ack=59554 Win=788 Len=0"
"118","10.109232700","151.101.66.187","100.84.170.161","TLSv1.2","124","Application Data"
"119","10.112273200","151.101.66.187","100.84.170.161","TLSv1.2","291","Application Data"
"120","10.112328000","100.84.170.161","151.101.66.187","TCP","54","59747  >  443 [ACK] Seq=59554 Ack=2614 Win=513 Len=0"
"121","10.440341500","100.84.170.161","151.101.66.187","TLSv1.2","2525","Application Data"
"122","10.450621700","151.101.66.187","100.84.170.161","TCP","56","443  >  59747 [ACK] Seq=2614 Ack=62025 Win=798 Len=0"
"123","10.452694400","151.101.66.187","100.84.170.161","TLSv1.2","125","Application Data"
"124","10.477628100","100.84.170.161","151.101.66.187","TLSv1.2","2526","Application Data"
"125","10.479911700","151.101.66.187","100.84.170.161","TCP","125","[TCP Spurious Retransmission] 443  >  59747 [PSH, ACK] Seq=2614 Ack=62025 Win=798 Len=71"
"126","10.480022200","100.84.170.161","151.101.66.187","TCP","66","[TCP Dup ACK 124#1] 59747  >  443 [ACK] Seq=64497 Ack=2685 Win=513 Len=0 SLE=2614 SRE=2685"
"127","10.486458600","151.101.66.187","100.84.170.161","TCP","56","443  >  59747 [ACK] Seq=2685 Ack=64497 Win=807 Len=0"
"128","10.489379400","151.101.66.187","100.84.170.161","TLSv1.2","131","Application Data"
"129","10.516936100","151.101.66.187","100.84.170.161","TCP","131","[TCP Retransmission] 443  >  59747 [PSH, ACK] Seq=2685 Ack=64497 Win=807 Len=77"
"130","10.516976600","100.84.170.161","151.101.66.187","TCP","66","59747  >  443 [ACK] Seq=64497 Ack=2762 Win=512 Len=0 SLE=2685 SRE=2762"
"131","17.169669500","100.84.170.161","151.101.66.187","TLSv1.2","2525","Application Data"
"132","17.178789000","151.101.66.187","100.84.170.161","TCP","56","443  >  59747 [ACK] Seq=2762 Ack=66968 Win=817 Len=0"
"133","17.181227100","151.101.66.187","100.84.170.161","TLSv1.2","214","Application Data"
"134","17.209104100","151.101.66.187","100.84.170.161","TCP","214","[TCP Retransmission] 443  >  59747 [PSH, ACK] Seq=2762 Ack=66968 Win=817 Len=160"
"135","17.209148800","100.84.170.161","151.101.66.187","TCP","66","59747  >  443 [ACK] Seq=66968 Ack=2922 Win=512 Len=0 SLE=2762 SRE=2922"
"136","17.445007900","100.84.170.161","151.101.66.187","TLSv1.2","2526","Application Data"
"137","17.455415900","151.101.66.187","100.84.170.161","TCP","56","443  >  59747 [ACK] Seq=2922 Ack=69440 Win=827 Len=0"
"138","17.458676300","151.101.66.187","100.84.170.161","TLSv1.2","104","Application Data"
"139","17.486111500","151.101.66.187","100.84.170.161","TCP","104","[TCP Retransmission] 443  >  59747 [PSH, ACK] Seq=2922 Ack=69440 Win=827 Len=50"
"140","17.486163200","100.84.170.161","151.101.66.187","TCP","66","59747  >  443 [ACK] Seq=69440 Ack=2972 Win=511 Len=0 SLE=2922 SRE=2972"
"141","18.390377500","100.84.170.161","151.101.66.187","TLSv1.2","2525","Application Data"
"142","18.399254000","151.101.66.187","100.84.170.161","TCP","56","443  >  59747 [ACK] Seq=2972 Ack=71911 Win=836 Len=0"
"143","18.402682500","151.101.66.187","100.84.170.161","TLSv1.2","208","Application Data"
"144","18.426727100","100.84.170.161","151.101.66.187","TLSv1.2","2523","Application Data"
"145","18.430968700","151.101.66.187","100.84.170.161","TCP","208","[TCP Spurious Retransmission] 443  >  59747 [PSH, ACK] Seq=2972 Ack=71911 Win=836 Len=154"
"146","18.431058200","100.84.170.161","151.101.66.187","TCP","66","[TCP Dup ACK 144#1] 59747  >  443 [ACK] Seq=74380 Ack=3126 Win=511 Len=0 SLE=2972 SRE=3126"
"147","18.435678700","151.101.66.187","100.84.170.161","TCP","56","443  >  59747 [ACK] Seq=3126 Ack=74380 Win=846 Len=0"
"148","18.438127400","151.101.66.187","100.84.170.161","TLSv1.2","125","Application Data"
"149","18.438836700","100.84.170.161","151.101.66.187","TLSv1.2","2526","Application Data"
"150","18.447726700","151.101.66.187","100.84.170.161","TCP","56","443  >  59747 [ACK] Seq=3197 Ack=76852 Win=856 Len=0"
"151","18.450145900","151.101.66.187","100.84.170.161","TLSv1.2","104","Application Data"
"152","18.478010900","151.101.66.187","100.84.170.161","TCP","104","[TCP Retransmission] 443  >  59747 [PSH, ACK] Seq=3197 Ack=76852 Win=856 Len=50"
"153","18.478063200","100.84.170.161","151.101.66.187","TCP","66","59747  >  443 [ACK] Seq=76852 Ack=3247 Win=510 Len=0 SLE=3197 SRE=3247"
"154","22.998155900","100.84.170.161","151.101.66.187","TLSv1.2","2582","Application Data"
"155","23.008242200","151.101.66.187","100.84.170.161","TCP","56","443  >  59747 [ACK] Seq=3247 Ack=79380 Win=865 Len=0"
"156","23.011615200","100.84.170.161","151.101.66.187","TLSv1.2","2573","Application Data"
"157","23.011728100","151.101.66.187","100.84.170.161","TLSv1.2","214","Application Data"
"158","23.016393000","100.84.170.161","151.101.66.187","TLSv1.2","2567","Application Data"
"159","23.020335500","151.101.66.187","100.84.170.161","TCP","56","443  >  59747 [ACK] Seq=3407 Ack=81899 Win=875 Len=0"
"160","23.022381100","100.84.170.161","151.101.66.187","TLSv1.2","2567","Application Data"
"161","23.023399900","151.101.66.187","100.84.170.161","TLSv1.2","124","Application Data"
"162","23.026025500","151.101.66.187","100.84.170.161","TCP","56","443  >  59747 [ACK] Seq=3477 Ack=84412 Win=885 Len=0"
"163","23.029807200","151.101.66.187","100.84.170.161","TLSv1.2","131","Application Data"
"164","23.029878500","100.84.170.161","151.101.66.187","TCP","54","59747  >  443 [ACK] Seq=86925 Ack=3554 Win=509 Len=0"
"165","23.031129500","151.101.66.187","100.84.170.161","TCP","56","443  >  59747 [ACK] Seq=3554 Ack=86925 Win=895 Len=0"
"166","23.033575300","151.101.66.187","100.84.170.161","TLSv1.2","124","Application Data"
"167","23.067135400","151.101.66.187","100.84.170.161","TCP","124","[TCP Retransmission] 443  >  59747 [PSH, ACK] Seq=3554 Ack=86925 Win=895 Len=70"
"168","23.067191800","100.84.170.161","151.101.66.187","TCP","66","59747  >  443 [ACK] Seq=86925 Ack=3624 Win=509 Len=0 SLE=3554 SRE=3624"
"169","23.110943200","100.84.170.161","151.101.66.187","TLSv1.2","2567","Application Data"
"170","23.120232700","151.101.66.187","100.84.170.161","TCP","56","443  >  59747 [ACK] Seq=3624 Ack=89438 Win=905 Len=0"
"171","23.122006100","151.101.66.187","100.84.170.161","TLSv1.2","240","Application Data"
"172","23.150949600","151.101.66.187","100.84.170.161","TCP","240","[TCP Retransmission] 443  >  59747 [PSH, ACK] Seq=3624 Ack=89438 Win=905 Len=186"
"173","23.151003600","100.84.170.161","151.101.66.187","TCP","66","59747  >  443 [ACK] Seq=89438 Ack=3810 Win=508 Len=0 SLE=3624 SRE=3810"
"174","23.163952700","100.84.170.161","151.101.66.187","TLSv1.2","2581","Application Data"
"175","23.172803800","151.101.66.187","100.84.170.161","TCP","56","443  >  59747 [ACK] Seq=3810 Ack=91965 Win=915 Len=0"
"176","23.175919900","151.101.66.187","100.84.170.161","TLSv1.2","142","Application Data"
"177","23.204841500","151.101.66.187","100.84.170.161","TCP","142","[TCP Retransmission] 443  >  59747 [PSH, ACK] Seq=3810 Ack=91965 Win=915 Len=88"
"178","23.204895500","100.84.170.161","151.101.66.187","TCP","66","59747  >  443 [ACK] Seq=91965 Ack=3898 Win=508 Len=0 SLE=3810 SRE=3898"
"179","23.277683400","100.84.170.161","151.101.66.187","TLSv1.2","2564","Application Data"
"180","23.286472700","151.101.66.187","100.84.170.161","TCP","56","443  >  59747 [ACK] Seq=3898 Ack=94475 Win=924 Len=0"
"181","23.289715800","151.101.66.187","100.84.170.161","TLSv1.2","125","Application Data"
"182","23.292995400","100.84.170.161","151.101.66.187","TLSv1.2","2581","Application Data"
"183","23.302457400","151.101.66.187","100.84.170.161","TCP","56","443  >  59747 [ACK] Seq=3969 Ack=97002 Win=934 Len=0"
"184","23.304730500","151.101.66.187","100.84.170.161","TLSv1.2","124","Application Data"
"185","23.333822900","151.101.66.187","100.84.170.161","TCP","124","[TCP Retransmission] 443  >  59747 [PSH, ACK] Seq=3969 Ack=97002 Win=934 Len=70"
"186","23.333863300","100.84.170.161","151.101.66.187","TCP","66","59747  >  443 [ACK] Seq=97002 Ack=4039 Win=507 Len=0 SLE=3969 SRE=4039"
"187","23.494671200","100.84.170.161","151.101.66.187","TLSv1.2","2576","Application Data"
"188","23.505295100","151.101.66.187","100.84.170.161","TCP","56","443  >  59747 [ACK] Seq=4039 Ack=99524 Win=944 Len=0"
"189","23.508358100","151.101.66.187","100.84.170.161","TLSv1.2","297","Application Data"
"190","23.536804000","151.101.66.187","100.84.170.161","TCP","297","[TCP Retransmission] 443  >  59747 [PSH, ACK] Seq=4039 Ack=99524 Win=944 Len=243"
"191","23.536853300","100.84.170.161","151.101.66.187","TCP","66","59747  >  443 [ACK] Seq=99524 Ack=4282 Win=513 Len=0 SLE=4039 SRE=4282"
"192","23.590742300","100.84.170.161","151.101.66.187","TLSv1.2","2586","Application Data"
"193","23.590995700","100.84.170.161","151.101.66.187","TLSv1.2","2586","Application Data"
"194","23.591132900","100.84.170.161","151.101.66.187","TLSv1.2","2582","Application Data"
"195","23.591240000","100.84.170.161","151.101.66.187","TLSv1.2","2578","Application Data"
"196","23.592121000","100.84.170.161","151.101.66.187","TLSv1.2","2570","Application Data"
"197","23.592346700","100.84.170.161","151.101.66.187","TLSv1.2","2569","Application Data"
"198","23.599626300","151.101.66.187","100.84.170.161","TCP","56","443  >  59747 [ACK] Seq=4282 Ack=102056 Win=954 Len=0"
"199","23.599872100","151.101.66.187","100.84.170.161","TCP","56","443  >  59747 [ACK] Seq=4282 Ack=104588 Win=964 Len=0"
"200","23.600169000","151.101.66.187","100.84.170.161","TCP","56","443  >  59747 [ACK] Seq=4282 Ack=107116 Win=974 Len=0"
"201","23.600496700","151.101.66.187","100.84.170.161","TCP","56","443  >  59747 [ACK] Seq=4282 Ack=109640 Win=984 Len=0"
"202","23.601219000","151.101.66.187","100.84.170.161","TCP","56","443  >  59747 [ACK] Seq=4282 Ack=114671 Win=1003 Len=0"
"203","23.602359700","151.101.66.187","100.84.170.161","TLSv1.2","130","Application Data"
"204","23.602936500","151.101.66.187","100.84.170.161","TLSv1.2","130","Application Data"
"205","23.602982900","100.84.170.161","151.101.66.187","TCP","54","59747  >  443 [ACK] Seq=114671 Ack=4434 Win=512 Len=0"
"206","23.603278700","151.101.66.187","100.84.170.161","TLSv1.2","131","Application Data"
"207","23.604137400","151.101.66.187","100.84.170.161","TLSv1.2","233","Application Data"
"208","23.604193800","100.84.170.161","151.101.66.187","TCP","54","59747  >  443 [ACK] Seq=114671 Ack=4690 Win=511 Len=0"
"209","23.792047500","100.84.170.161","151.101.66.187","TLSv1.2","2558","Application Data"
"210","23.794798900","100.84.170.161","151.101.66.187","TLSv1.2","2542","Application Data"
"211","23.816941100","100.84.170.161","151.101.66.187","TCP","1514","[TCP Retransmission] 59747  >  443 [PSH, ACK] Seq=118203 Ack=4690 Win=511 Len=1460"
"212","23.818157400","151.101.66.187","100.84.170.161","TCP","56","443  >  59747 [ACK] Seq=4690 Ack=119663 Win=1023 Len=0"
"213","23.821346600","151.101.66.187","100.84.170.161","TLSv1.2","173","Application Data"
"214","23.825775400","151.101.66.187","100.84.170.161","TCP","66","[TCP Dup ACK 212#1] 443  >  59747 [ACK] Seq=4809 Ack=119663 Win=1023 Len=0 SLE=118203 SRE=119663"
"215","23.847916700","151.101.66.187","100.84.170.161","TCP","173","[TCP Retransmission] 443  >  59747 [PSH, ACK] Seq=4690 Ack=119663 Win=1023 Len=119"
"216","23.847956800","100.84.170.161","151.101.66.187","TCP","66","59747  >  443 [ACK] Seq=119663 Ack=4809 Win=511 Len=0 SLE=4690 SRE=4809"
"217","24.289626600","100.84.170.161","151.101.66.187","TLSv1.2","2581","Application Data"
"218","24.299395000","151.101.66.187","100.84.170.161","TCP","56","443  >  59747 [ACK] Seq=4809 Ack=122190 Win=1033 Len=0"
"219","24.302467400","151.101.66.187","100.84.170.161","TLSv1.2","241","Application Data"
"220","24.328663000","151.101.66.187","100.84.170.161","TCP","241","[TCP Retransmission] 443  >  59747 [PSH, ACK] Seq=4809 Ack=122190 Win=1033 Len=187"
"221","24.328703000","100.84.170.161","151.101.66.187","TCP","66","59747  >  443 [ACK] Seq=122190 Ack=4996 Win=510 Len=0 SLE=4809 SRE=4996"
"222","24.330704900","100.84.170.161","151.101.66.187","TLSv1.2","2582","Application Data"
"223","24.339852700","151.101.66.187","100.84.170.161","TCP","56","443  >  59747 [ACK] Seq=4996 Ack=124718 Win=1042 Len=0"
"224","24.342465800","151.101.66.187","100.84.170.161","TLSv1.2","125","Application Data"
"225","24.369923700","151.101.66.187","100.84.170.161","TCP","125","[TCP Retransmission] 443  >  59747 [PSH, ACK] Seq=4996 Ack=124718 Win=1042 Len=71"
"226","24.369966000","100.84.170.161","151.101.66.187","TCP","66","59747  >  443 [ACK] Seq=124718 Ack=5067 Win=510 Len=0 SLE=4996 SRE=5067"
"227","28.758137300","100.84.170.161","151.101.66.187","TLSv1.2","2581","Application Data"
"228","28.767786700","151.101.66.187","100.84.170.161","TCP","56","443  >  59747 [ACK] Seq=5067 Ack=127245 Win=1054 Len=0"
"229","28.772095900","151.101.66.187","100.84.170.161","TLSv1.2","214","Application Data"
"230","28.799887300","151.101.66.187","100.84.170.161","TCP","214","[TCP Retransmission] 443  >  59747 [PSH, ACK] Seq=5067 Ack=127245 Win=1054 Len=160"
"231","28.799956900","100.84.170.161","151.101.66.187","TCP","66","59747  >  443 [ACK] Seq=127245 Ack=5227 Win=509 Len=0 SLE=5067 SRE=5227"
"232","28.867608100","100.84.170.161","151.101.66.187","TLSv1.2","2579","Application Data"
"233","28.877520000","151.101.66.187","100.84.170.161","TCP","56","443  >  59747 [ACK] Seq=5227 Ack=129770 Win=1064 Len=0"
"234","28.880771400","151.101.66.187","100.84.170.161","TLSv1.2","169","Application Data"
"235","28.906751300","151.101.66.187","100.84.170.161","TCP","169","[TCP Retransmission] 443  >  59747 [PSH, ACK] Seq=5227 Ack=129770 Win=1064 Len=115"
"236","28.906781700","100.84.170.161","151.101.66.187","TCP","66","59747  >  443 [ACK] Seq=129770 Ack=5342 Win=509 Len=0 SLE=5227 SRE=5342"
"237","29.031691500","100.84.170.161","151.101.66.187","TLSv1.2","2582","Application Data"
"238","29.042861000","151.101.66.187","100.84.170.161","TCP","56","443  >  59747 [ACK] Seq=5342 Ack=132298 Win=1074 Len=0"
"239","29.049442100","151.101.66.187","100.84.170.161","TLSv1.2","98","Application Data"
"240","29.075967600","151.101.66.187","100.84.170.161","TCP","98","[TCP Retransmission] 443  >  59747 [PSH, ACK] Seq=5342 Ack=132298 Win=1074 Len=44"
"241","29.076060600","100.84.170.161","151.101.66.187","TCP","66","59747  >  443 [ACK] Seq=132298 Ack=5386 Win=508 Len=0 SLE=5342 SRE=5386"
"242","29.279021500","100.84.170.161","151.101.66.187","TLSv1.2","2581","Application Data"
"243","29.289474800","151.101.66.187","100.84.170.161","TCP","56","443  >  59747 [ACK] Seq=5386 Ack=134825 Win=1083 Len=0"
"244","29.292097600","151.101.66.187","100.84.170.161","TLSv1.2","234","Application Data"
"245","29.319083600","151.101.66.187","100.84.170.161","TCP","234","[TCP Retransmission] 443  >  59747 [PSH, ACK] Seq=5386 Ack=134825 Win=1083 Len=180"
"246","29.319207100","100.84.170.161","151.101.66.187","TCP","66","59747  >  443 [ACK] Seq=134825 Ack=5566 Win=508 Len=0 SLE=5386 SRE=5566"
"247","29.906803200","100.84.170.161","151.101.66.187","TLSv1.2","2581","Application Data"
"248","29.915872400","151.101.66.187","100.84.170.161","TCP","56","443  >  59747 [ACK] Seq=5566 Ack=137352 Win=1093 Len=0"
"249","29.918738900","151.101.66.187","100.84.170.161","TLSv1.2","270","Application Data"
"250","29.928111100","100.84.170.161","151.101.66.187","TLSv1.2","2582","Application Data"
"251","29.936823300","151.101.66.187","100.84.170.161","TCP","56","443  >  59747 [ACK] Seq=5782 Ack=139880 Win=1103 Len=0"
"252","29.939787400","151.101.66.187","100.84.170.161","TLSv1.2","98","Application Data"
"253","29.968988100","151.101.66.187","100.84.170.161","TCP","98","[TCP Retransmission] 443  >  59747 [PSH, ACK] Seq=5782 Ack=139880 Win=1103 Len=44"
"254","29.969054100","100.84.170.161","151.101.66.187","TCP","66","59747  >  443 [ACK] Seq=139880 Ack=5826 Win=513 Len=0 SLE=5782 SRE=5826"
"255","35.922515000","100.84.170.161","151.101.66.187","TLSv1.2","2550","Application Data"
"256","35.927743000","100.84.170.161","151.101.66.187","TLSv1.2","2541","Application Data"
"257","35.931581100","151.101.66.187","100.84.170.161","TCP","56","443  >  59747 [ACK] Seq=5826 Ack=142376 Win=1113 Len=0"
"258","35.934845000","151.101.66.187","100.84.170.161","TLSv1.2","214","Application Data"
"259","35.936574400","151.101.66.187","100.84.170.161","TCP","56","443  >  59747 [ACK] Seq=5986 Ack=144863 Win=1123 Len=0"
"260","35.939417900","151.101.66.187","100.84.170.161","TLSv1.2","124","Application Data"
"261","35.939498900","100.84.170.161","151.101.66.187","TCP","54","59747  >  443 [ACK] Seq=144863 Ack=6056 Win=512 Len=0"
"262","35.943501400","100.84.170.161","151.101.66.187","TLSv1.2","2535","Application Data"
"263","35.946351000","100.84.170.161","151.101.66.187","TLSv1.2","2535","Application Data"
"264","35.952423300","151.101.66.187","100.84.170.161","TCP","56","443  >  59747 [ACK] Seq=6056 Ack=147344 Win=1132 Len=0"
"265","35.955174400","151.101.66.187","100.84.170.161","TLSv1.2","131","Application Data"
"266","35.957527900","151.101.66.187","100.84.170.161","TLSv1.2","124","Application Data"
"267","35.957587600","100.84.170.161","151.101.66.187","TCP","54","59747  >  443 [ACK] Seq=149825 Ack=6203 Win=511 Len=0"
"268","36.028401800","100.84.170.161","151.101.66.187","TLSv1.2","2535","Application Data"
"269","36.037245500","151.101.66.187","100.84.170.161","TCP","56","443  >  59747 [ACK] Seq=6203 Ack=152306 Win=1152 Len=0"
"270","36.041499600","151.101.66.187","100.84.170.161","TLSv1.2","130","Application Data"
"271","36.069553900","151.101.66.187","100.84.170.161","TCP","130","[TCP Retransmission] 443  >  59747 [PSH, ACK] Seq=6203 Ack=152306 Win=1152 Len=76"
"272","36.069602300","100.84.170.161","151.101.66.187","TCP","66","59747  >  443 [ACK] Seq=152306 Ack=6279 Win=511 Len=0 SLE=6203 SRE=6279"
"273","36.069844200","100.84.170.161","151.101.66.187","TLSv1.2","2549","Application Data"
"274","36.078923200","151.101.66.187","100.84.170.161","TCP","56","443  >  59747 [ACK] Seq=6279 Ack=154801 Win=1162 Len=0"
"275","36.081501400","151.101.66.187","100.84.170.161","TLSv1.2","208","Application Data"
"276","36.109848200","151.101.66.187","100.84.170.161","TCP","208","[TCP Retransmission] 443  >  59747 [PSH, ACK] Seq=6279 Ack=154801 Win=1162 Len=154"
"277","36.109891300","100.84.170.161","151.101.66.187","TCP","66","59747  >  443 [ACK] Seq=154801 Ack=6433 Win=510 Len=0 SLE=6279 SRE=6433"
"278","36.164034300","100.84.170.161","151.101.66.187","TLSv1.2","2532","Application Data"
"279","36.172895700","151.101.66.187","100.84.170.161","TCP","56","443  >  59747 [ACK] Seq=6433 Ack=157279 Win=1171 Len=0"
"280","36.175423400","151.101.66.187","100.84.170.161","TLSv1.2","125","Application Data"
"281","36.178381200","100.84.170.161","151.101.66.187","TLSv1.2","2549","Application Data"
"282","36.187874300","151.101.66.187","100.84.170.161","TCP","56","443  >  59747 [ACK] Seq=6504 Ack=159774 Win=1181 Len=0"
"283","36.189759200","151.101.66.187","100.84.170.161","TLSv1.2","124","Application Data"
"284","36.217957500","151.101.66.187","100.84.170.161","TCP","124","[TCP Retransmission] 443  >  59747 [PSH, ACK] Seq=6504 Ack=159774 Win=1181 Len=70"
"285","36.218004100","100.84.170.161","151.101.66.187","TCP","66","59747  >  443 [ACK] Seq=159774 Ack=6574 Win=510 Len=0 SLE=6504 SRE=6574"
"286","36.371139100","100.84.170.161","151.101.66.187","TLSv1.2","2536","Application Data"
"287","36.372104300","100.84.170.161","151.101.66.187","TLSv1.2","2544","Application Data"
"288","36.382018700","151.101.66.187","100.84.170.161","TCP","56","443  >  59747 [ACK] Seq=6574 Ack=162256 Win=1191 Len=0"
"289","36.382727500","151.101.66.187","100.84.170.161","TCP","56","443  >  59747 [ACK] Seq=6574 Ack=164746 Win=1200 Len=0"
"290","36.383108800","151.101.66.187","100.84.170.161","TLSv1.2","124","Application Data"
"291","36.383467700","151.101.66.187","100.84.170.161","TLSv1.2","131","Application Data"
"292","36.383498600","100.84.170.161","151.101.66.187","TCP","54","59747  >  443 [ACK] Seq=164746 Ack=6721 Win=509 Len=0"
"293","36.466783900","100.84.170.161","151.101.66.187","TLSv1.2","2550","Application Data"
"294","36.467209800","100.84.170.161","151.101.66.187","TLSv1.2","2534","Application Data"
"295","36.476753300","151.101.66.187","100.84.170.161","TCP","56","443  >  59747 [ACK] Seq=6721 Ack=169722 Win=1220 Len=0"
"296","36.479915200","151.101.66.187","100.84.170.161","TLSv1.2","173","Application Data"
"297","36.507858200","151.101.66.187","100.84.170.161","TCP","173","[TCP Retransmission] 443  >  59747 [PSH, ACK] Seq=6721 Ack=169722 Win=1220 Len=119"
"298","36.507915200","100.84.170.161","151.101.66.187","TCP","66","59747  >  443 [ACK] Seq=169722 Ack=6840 Win=509 Len=0 SLE=6721 SRE=6840"
"299","36.654622400","100.84.170.161","151.101.66.187","TLSv1.2","2574","Application Data"
"300","36.654943100","100.84.170.161","151.101.66.187","TLSv1.2","2574","Application Data"
"301","36.657727500","100.84.170.161","151.101.66.187","TLSv1.2","2570","Application Data"
"302","36.661082200","100.84.170.161","151.101.66.187","TLSv1.2","2566","Application Data"
"303","36.663573600","151.101.66.187","100.84.170.161","TCP","56","443  >  59747 [ACK] Seq=6840 Ack=172242 Win=1230 Len=0"
"304","36.663861300","151.101.66.187","100.84.170.161","TCP","56","443  >  59747 [ACK] Seq=6840 Ack=174762 Win=1240 Len=0"
"305","36.664154200","100.84.170.161","151.101.66.187","TLSv1.2","2558","Application Data"
"306","36.665479900","100.84.170.161","151.101.66.187","TLSv1.2","2557","Application Data"
"307","36.666440500","151.101.66.187","100.84.170.161","TLSv1.2","130","Application Data"
"308","36.666702000","151.101.66.187","100.84.170.161","TLSv1.2","173","Application Data"
"309","36.666733800","100.84.170.161","151.101.66.187","TCP","54","59747  >  443 [ACK] Seq=184797 Ack=7035 Win=508 Len=0"
"310","36.669397000","151.101.66.187","100.84.170.161","TLSv1.2","131","Application Data"
"311","36.670127200","151.101.66.187","100.84.170.161","TCP","56","443  >  59747 [ACK] Seq=7112 Ack=179790 Win=1259 Len=0"
"312","36.672854700","151.101.66.187","100.84.170.161","TLSv1.2","296","Application Data"
"313","36.672909400","100.84.170.161","151.101.66.187","TCP","54","59747  >  443 [ACK] Seq=184797 Ack=7354 Win=513 Len=0"
"314","36.673152800","151.101.66.187","100.84.170.161","TCP","56","443  >  59747 [ACK] Seq=7354 Ack=182294 Win=1269 Len=0"
"315","36.674264400","151.101.66.187","100.84.170.161","TCP","56","443  >  59747 [ACK] Seq=7354 Ack=184797 Win=1279 Len=0"
"316","36.676496100","151.101.66.187","100.84.170.161","TLSv1.2","131","Application Data"
"317","36.677135400","151.101.66.187","100.84.170.161","TLSv1.2","124","Application Data"
"318","36.677184900","100.84.170.161","151.101.66.187","TCP","54","59747  >  443 [ACK] Seq=184797 Ack=7501 Win=512 Len=0"
"319","42.126745700","100.84.170.161","151.101.66.187","TLSv1.2","2549","Application Data"
"320","42.131600100","100.84.170.161","151.101.66.187","TLSv1.2","2547","Application Data"
"321","42.135814600","151.101.66.187","100.84.170.161","TCP","56","443  >  59747 [ACK] Seq=7501 Ack=187292 Win=1288 Len=0"
"322","42.138657900","151.101.66.187","100.84.170.161","TLSv1.2","241","Application Data"
"323","42.140300000","151.101.66.187","100.84.170.161","TCP","56","443  >  59747 [ACK] Seq=7688 Ack=189785 Win=1298 Len=0"
"324","42.143455100","151.101.66.187","100.84.170.161","TLSv1.2","125","Application Data"
"325","42.143526500","100.84.170.161","151.101.66.187","TCP","54","59747  >  443 [ACK] Seq=189785 Ack=7759 Win=511 Len=0"
"326","42.396835600","100.84.170.161","151.101.66.187","TLSv1.2","2550","Application Data"
"327","42.406973800","151.101.66.187","100.84.170.161","TCP","56","443  >  59747 [ACK] Seq=7759 Ack=192281 Win=1308 Len=0"
"328","42.410201400","151.101.66.187","100.84.170.161","TLSv1.2","131","Application Data"
"329","42.437719600","151.101.66.187","100.84.170.161","TCP","131","[TCP Retransmission] 443  >  59747 [PSH, ACK] Seq=7759 Ack=192281 Win=1308 Len=77"
"330","42.437756600","100.84.170.161","151.101.66.187","TCP","66","59747  >  443 [ACK] Seq=192281 Ack=7836 Win=511 Len=0 SLE=7759 SRE=7836"
"331","42.642626900","100.84.170.161","151.101.66.187","TLSv1.2","2569","Application Data"
"332","42.669511900","100.84.170.161","151.101.66.187","TCP","1514","[TCP Retransmission] 59747  >  443 [PSH, ACK] Seq=193336 Ack=7836 Win=511 Len=1460"
"333","42.673074200","151.101.66.187","100.84.170.161","TCP","56","443  >  59747 [ACK] Seq=7836 Ack=194796 Win=1318 Len=0"
"334","42.675893800","151.101.66.187","100.84.170.161","TLSv1.2","124","Application Data"
"335","42.678614900","151.101.66.187","100.84.170.161","TCP","66","[TCP Dup ACK 333#1] 443  >  59747 [ACK] Seq=7906 Ack=194796 Win=1318 Len=0 SLE=193336 SRE=194796"
"336","42.702736300","151.101.66.187","100.84.170.161","TCP","124","[TCP Retransmission] 443  >  59747 [PSH, ACK] Seq=7836 Ack=194796 Win=1318 Len=70"
"337","42.702767900","100.84.170.161","151.101.66.187","TCP","66","59747  >  443 [ACK] Seq=194796 Ack=7906 Win=511 Len=0 SLE=7836 SRE=7906"
"338","43.846182000","100.84.170.161","151.101.66.187","TLSv1.2","2549","Application Data"
"339","43.855031600","151.101.66.187","100.84.170.161","TCP","56","443  >  59747 [ACK] Seq=7906 Ack=197291 Win=1328 Len=0"
"340","43.857868100","151.101.66.187","100.84.170.161","TLSv1.2","214","Application Data"
"341","43.876742400","100.84.170.161","151.101.66.187","TLSv1.2","2547","Application Data"
"342","43.883720400","100.84.170.161","151.101.66.187","TLSv1.2","2550","Application Data"
"343","43.885500500","151.101.66.187","100.84.170.161","TCP","56","443  >  59747 [ACK] Seq=8066 Ack=199784 Win=1337 Len=0"
"344","43.888346700","151.101.66.187","100.84.170.161","TLSv1.2","98","Application Data"
"345","43.892884800","151.101.66.187","100.84.170.161","TCP","56","443  >  59747 [ACK] Seq=8110 Ack=202280 Win=1347 Len=0"
"346","43.895334400","151.101.66.187","100.84.170.161","TLSv1.2","98","Application Data"
"347","43.895400600","100.84.170.161","151.101.66.187","TCP","54","59747  >  443 [ACK] Seq=202280 Ack=8154 Win=510 Len=0"
"348","46.538360100","100.84.170.161","151.101.66.187","TCP","55","[TCP Keep-Alive] 55359  >  443 [ACK] Seq=2774 Ack=7031 Win=131328 Len=1"
"349","46.548620100","151.101.66.187","100.84.170.161","TCP","66","[TCP Keep-Alive ACK] 443  >  55359 [ACK] Seq=7031 Ack=2775 Win=143872 Len=0 SLE=2774 SRE=2775"
"350","53.045379900","100.84.170.161","151.101.66.187","TLSv1.2","2549","Application Data"
"351","53.054634200","151.101.66.187","100.84.170.161","TCP","56","443  >  59747 [ACK] Seq=8154 Ack=204775 Win=1357 Len=0"
"352","53.057801000","151.101.66.187","100.84.170.161","TLSv1.2","214","Application Data"
"353","53.089215800","100.84.170.161","151.101.66.187","TLSv1.2","2547","Application Data"
"354","53.089644300","151.101.66.187","100.84.170.161","TCP","214","[TCP Spurious Retransmission] 443  >  59747 [PSH, ACK] Seq=8154 Ack=204775 Win=1357 Len=160"
"355","53.089777400","100.84.170.161","151.101.66.187","TCP","66","[TCP Dup ACK 353#1] 59747  >  443 [ACK] Seq=207268 Ack=8314 Win=509 Len=0 SLE=8154 SRE=8314"
"356","53.098619600","151.101.66.187","100.84.170.161","TCP","56","443  >  59747 [ACK] Seq=8314 Ack=207268 Win=1366 Len=0"
"357","53.101688700","151.101.66.187","100.84.170.161","TLSv1.2","208","Application Data"
"358","53.133778500","151.101.66.187","100.84.170.161","TCP","208","[TCP Retransmission] 443  >  59747 [PSH, ACK] Seq=8314 Ack=207268 Win=1366 Len=154"
"359","53.133829600","100.84.170.161","151.101.66.187","TCP","66","59747  >  443 [ACK] Seq=207268 Ack=8468 Win=508 Len=0 SLE=8314 SRE=8468"
"360","53.135443300","100.84.170.161","151.101.66.187","TLSv1.2","2550","Application Data"
"361","53.144784200","151.101.66.187","100.84.170.161","TCP","56","443  >  59747 [ACK] Seq=8468 Ack=209764 Win=1376 Len=0"
"362","53.146985300","151.101.66.187","100.84.170.161","TLSv1.2","142","Application Data"
"363","53.178573500","151.101.66.187","100.84.170.161","TCP","142","[TCP Retransmission] 443  >  59747 [PSH, ACK] Seq=8468 Ack=209764 Win=1376 Len=88"
"364","53.178609400","100.84.170.161","151.101.66.187","TCP","66","59747  >  443 [ACK] Seq=209764 Ack=8556 Win=508 Len=0 SLE=8468 SRE=8556"
"365","53.498847700","100.84.170.161","151.101.66.187","TLSv1.2","2549","Application Data"
"366","53.499093000","100.84.170.161","151.101.66.187","TLSv1.2","2550","Application Data"
"367","53.508385000","151.101.66.187","100.84.170.161","TCP","56","443  >  59747 [ACK] Seq=8556 Ack=214755 Win=1396 Len=0"
"368","53.510737300","151.101.66.187","100.84.170.161","TLSv1.2","98","Application Data"
"369","53.512414300","151.101.66.187","100.84.170.161","TLSv1.2","104","Application Data"
"370","53.512497500","100.84.170.161","151.101.66.187","TCP","54","59747  >  443 [ACK] Seq=214755 Ack=8650 Win=508 Len=0"
"371","53.647677200","100.84.170.161","151.101.66.187","TLSv1.2","2549","Application Data"
"372","53.655790000","100.84.170.161","151.101.66.187","TLSv1.2","2550","Application Data"
"373","53.656723300","151.101.66.187","100.84.170.161","TCP","56","443  >  59747 [ACK] Seq=8650 Ack=217250 Win=1405 Len=0"
"374","53.660103100","151.101.66.187","100.84.170.161","TLSv1.2","98","Application Data"
"375","53.664666900","151.101.66.187","100.84.170.161","TCP","56","443  >  59747 [ACK] Seq=8694 Ack=219746 Win=1415 Len=0"
"376","53.667042900","151.101.66.187","100.84.170.161","TLSv1.2","98","Application Data"
"377","53.667110400","100.84.170.161","151.101.66.187","TCP","54","59747  >  443 [ACK] Seq=219746 Ack=8738 Win=507 Len=0"
"378","57.471674600","100.84.170.161","151.101.66.187","TLSv1.2","2544","Application Data"
"379","57.477151800","100.84.170.161","151.101.66.187","TLSv1.2","2535","Application Data"
"380","57.479536000","100.84.170.161","151.101.66.187","TLSv1.2","2529","Application Data"
"381","57.481822800","151.101.66.187","100.84.170.161","TCP","56","443  >  59747 [ACK] Seq=8738 Ack=222236 Win=1425 Len=0"
"382","57.483452900","100.84.170.161","151.101.66.187","TLSv1.2","2529","Application Data"
"383","57.484468000","151.101.66.187","100.84.170.161","TLSv1.2","214","Application Data"
"384","57.484546000","100.84.170.161","151.101.66.187","TCP","54","59747  >  443 [ACK] Seq=229667 Ack=8898 Win=513 Len=0"
"385","57.486305100","151.101.66.187","100.84.170.161","TCP","56","443  >  59747 [ACK] Seq=8898 Ack=224717 Win=1435 Len=0"
"386","57.488124000","151.101.66.187","100.84.170.161","TLSv1.2","124","Application Data"
"387","57.488203900","100.84.170.161","151.101.66.187","TCP","54","59747  >  443 [ACK] Seq=229667 Ack=8968 Win=513 Len=0"
"388","57.490376000","151.101.66.187","100.84.170.161","TLSv1.2","297","Application Data"
"389","57.493255500","151.101.66.187","100.84.170.161","TCP","56","443  >  59747 [ACK] Seq=9211 Ack=229667 Win=1454 Len=0"
"390","57.496313900","151.101.66.187","100.84.170.161","TLSv1.2","130","Application Data"
"391","57.496385500","100.84.170.161","151.101.66.187","TCP","54","59747  >  443 [ACK] Seq=229667 Ack=9287 Win=511 Len=0"
"392","57.568316900","100.84.170.161","151.101.66.187","TLSv1.2","2529","Application Data"
"393","57.577823200","151.101.66.187","100.84.170.161","TCP","56","443  >  59747 [ACK] Seq=9287 Ack=232142 Win=1464 Len=0"
"394","57.580468800","151.101.66.187","100.84.170.161","TLSv1.2","124","Application Data"
"395","57.609800300","151.101.66.187","100.84.170.161","TCP","124","[TCP Retransmission] 443  >  59747 [PSH, ACK] Seq=9287 Ack=232142 Win=1464 Len=70"
"396","57.609850700","100.84.170.161","151.101.66.187","TCP","66","59747  >  443 [ACK] Seq=232142 Ack=9357 Win=511 Len=0 SLE=9287 SRE=9357"
"397","57.625864900","100.84.170.161","151.101.66.187","TLSv1.2","2543","Application Data"
"398","57.635462000","151.101.66.187","100.84.170.161","TCP","56","443  >  59747 [ACK] Seq=9357 Ack=234631 Win=1473 Len=0"
"399","57.637853600","151.101.66.187","100.84.170.161","TLSv1.2","125","Application Data"
"400","57.669460400","151.101.66.187","100.84.170.161","TCP","125","[TCP Retransmission] 443  >  59747 [PSH, ACK] Seq=9357 Ack=234631 Win=1473 Len=71"
"401","57.669504900","100.84.170.161","151.101.66.187","TCP","66","59747  >  443 [ACK] Seq=234631 Ack=9428 Win=511 Len=0 SLE=9357 SRE=9428"
"402","57.725342600","100.84.170.161","151.101.66.187","TLSv1.2","2526","Application Data"
"403","57.734472700","151.101.66.187","100.84.170.161","TCP","56","443  >  59747 [ACK] Seq=9428 Ack=237103 Win=1483 Len=0"
"404","57.735645900","100.84.170.161","151.101.66.187","TLSv1.2","2543","Application Data"
"405","57.737000900","151.101.66.187","100.84.170.161","TLSv1.2","125","Application Data"
"406","57.744420300","151.101.66.187","100.84.170.161","TCP","56","443  >  59747 [ACK] Seq=9499 Ack=239592 Win=1493 Len=0"
"407","57.747034600","151.101.66.187","100.84.170.161","TLSv1.2","124","Application Data"
"408","57.747090300","100.84.170.161","151.101.66.187","TCP","54","59747  >  443 [ACK] Seq=239592 Ack=9569 Win=510 Len=0"
"409","57.872286800","100.84.170.161","151.101.66.187","TLSv1.2","2538","Application Data"
"410","57.880888600","151.101.66.187","100.84.170.161","TCP","56","443  >  59747 [ACK] Seq=9569 Ack=242076 Win=1502 Len=0"
"411","57.883687900","151.101.66.187","100.84.170.161","TLSv1.2","131","Application Data"
"412","57.917196200","151.101.66.187","100.84.170.161","TCP","131","[TCP Retransmission] 443  >  59747 [PSH, ACK] Seq=9569 Ack=242076 Win=1502 Len=77"
"413","57.917233700","100.84.170.161","151.101.66.187","TCP","66","59747  >  443 [ACK] Seq=242076 Ack=9646 Win=510 Len=0 SLE=9569 SRE=9646"
"414","57.940452000","100.84.170.161","151.101.66.187","TLSv1.2","2548","Application Data"
"415","57.941543600","100.84.170.161","151.101.66.187","TLSv1.2","2544","Application Data"
"416","57.944415700","100.84.170.161","151.101.66.187","TLSv1.2","2540","Application Data"
"417","57.944609500","100.84.170.161","151.101.66.187","TLSv1.2","2532","Application Data"
"418","57.945415100","100.84.170.161","151.101.66.187","TLSv1.2","2531","Application Data"
"419","57.945535400","100.84.170.161","151.101.66.187","TLSv1.2","2542","Application Data"
"420","57.949250400","151.101.66.187","100.84.170.161","TCP","56","443  >  59747 [ACK] Seq=9646 Ack=244570 Win=1512 Len=0"
"421","57.950329900","151.101.66.187","100.84.170.161","TCP","56","443  >  59747 [ACK] Seq=9646 Ack=247060 Win=1522 Len=0"
"422","57.952229800","151.101.66.187","100.84.170.161","TLSv1.2","130","Application Data"
"423","57.952641100","151.101.66.187","100.84.170.161","TLSv1.2","131","Application Data"
"424","57.952682100","100.84.170.161","151.101.66.187","TCP","54","59747  >  443 [ACK] Seq=256989 Ack=9799 Win=509 Len=0"
"425","57.953156200","151.101.66.187","100.84.170.161","TCP","56","443  >  59747 [ACK] Seq=9799 Ack=249546 Win=1532 Len=0"
"426","57.953823300","151.101.66.187","100.84.170.161","TCP","56","443  >  59747 [ACK] Seq=9799 Ack=252024 Win=1541 Len=0"
"427","57.954266900","151.101.66.187","100.84.170.161","TCP","56","443  >  59747 [ACK] Seq=9799 Ack=254501 Win=1551 Len=0"
"428","57.954937900","151.101.66.187","100.84.170.161","TCP","56","443  >  59747 [ACK] Seq=9799 Ack=256989 Win=1561 Len=0"
"429","57.955503700","151.101.66.187","100.84.170.161","TLSv1.2","130","Application Data"
"430","57.955702300","151.101.66.187","100.84.170.161","TLSv1.2","125","Application Data"
"431","57.955743200","100.84.170.161","151.101.66.187","TCP","54","59747  >  443 [ACK] Seq=256989 Ack=9946 Win=509 Len=0"
"432","57.956697100","151.101.66.187","100.84.170.161","TLSv1.2","124","Application Data"
"433","57.957754000","151.101.66.187","100.84.170.161","TLSv1.2","130","Application Data"
"434","57.957849100","100.84.170.161","151.101.66.187","TCP","54","59747  >  443 [ACK] Seq=256989 Ack=10092 Win=508 Len=0"
"435","58.124308300","100.84.170.161","151.101.66.187","TLSv1.2","2547","Application Data"
"436","58.128372300","100.84.170.161","151.101.66.187","TLSv1.2","2531","Application Data"
"437","58.133516900","151.101.66.187","100.84.170.161","TCP","56","443  >  59747 [ACK] Seq=10092 Ack=259482 Win=1570 Len=0"
"438","58.135682500","151.101.66.187","100.84.170.161","TLSv1.2","279","Application Data"
"439","58.137334100","151.101.66.187","100.84.170.161","TCP","56","443  >  59747 [ACK] Seq=10317 Ack=261959 Win=1580 Len=0"
"440","58.139238700","151.101.66.187","100.84.170.161","TLSv1.2","130","Application Data"
"441","58.139348300","100.84.170.161","151.101.66.187","TCP","54","59747  >  443 [ACK] Seq=261959 Ack=10393 Win=513 Len=0"
