No.,Time,Source,Destination,Protocol,Length,Info
1,0.0,100.84.170.161,151.101.2.187,TLSv1.2,2495,Application Data
2,0.0001627,100.84.170.161,151.101.2.187,TLSv1.2,93,Application Data
3,0.0222194,100.84.170.161,151.101.2.187,TLSv1.2,2486,Application Data
4,0.0254986,100.84.170.161,151.101.2.187,TLSv1.2,2480,Application Data
5,0.0287075,100.84.170.161,151.101.2.187,TCP,1514,"[TCP Retransmission] 64433  >  443 [PSH, ACK] Seq=5879 Ack=1 Win=8209 Len=1460"
6,0.0366756,151.101.2.187,100.84.170.161,TCP,56,443  >  64433 [ACK] Seq=1 Ack=4913 Win=5695 Len=0
7,0.0369468,151.101.2.187,100.84.170.161,TLSv1.2,93,Application Data
8,0.0377632,151.101.2.187,100.84.170.161,TCP,56,443  >  64433 [ACK] Seq=40 Ack=7339 Win=5701 Len=0
9,0.0389676,151.101.2.187,100.84.170.161,TLSv1.2,240,Application Data
10,0.0390497,100.84.170.161,151.101.2.187,TCP,54,64433  >  443 [ACK] Seq=7339 Ack=226 Win=8208 Len=0
11,0.0393107,151.101.2.187,100.84.170.161,TLSv1.2,104,Application Data
12,0.0393107,151.101.2.187,100.84.170.161,TLSv1.2,125,Application Data
13,0.0393606,100.84.170.161,151.101.2.187,TCP,54,64433  >  443 [ACK] Seq=7339 Ack=347 Win=8207 Len=0
14,0.0403188,151.101.2.187,100.84.170.161,TCP,66,[TCP Dup ACK 8#1] 443  >  64433 [ACK] Seq=347 Ack=7339 Win=5701 Len=0 SLE=5879 SRE=7339
15,0.2815408,100.84.170.161,151.101.2.187,TLSv1.2,2480,Application Data
16,0.313924,100.84.170.161,151.101.2.187,TCP,1514,"[TCP Retransmission] 64433  >  443 [PSH, ACK] Seq=8305 Ack=347 Win=8207 Len=1460"
17,0.3291131,151.101.2.187,100.84.170.161,TCP,56,443  >  64433 [ACK] Seq=347 Ack=9765 Win=5706 Len=0
18,0.3293914,151.101.2.187,100.84.170.161,TCP,66,[TCP Dup ACK 17#1] 443  >  64433 [ACK] Seq=347 Ack=9765 Win=5706 Len=0 SLE=8305 SRE=9765
19,0.330828,151.101.2.187,100.84.170.161,TLSv1.2,240,Application Data
20,0.3340846,100.84.170.161,151.101.2.187,TLSv1.2,2489,Application Data
21,0.3374034,100.84.170.161,151.101.2.187,TLSv1.2,2494,Application Data
22,0.3438319,151.101.2.187,100.84.170.161,TCP,56,443  >  64433 [ACK] Seq=533 Ack=12200 Win=5712 Len=0
23,0.3449229,100.84.170.161,151.101.2.187,TLSv1.2,2495,Application Data
24,0.3690442,100.84.170.161,151.101.2.187,TCP,1514,"[TCP Retransmission] 64433  >  443 [PSH, ACK] Seq=15621 Ack=533 Win=8207 Len=1460"
25,0.391144,151.101.2.187,100.84.170.161,TLSv1.2,131,Application Data
26,0.391144,151.101.2.187,100.84.170.161,TCP,56,443  >  64433 [ACK] Seq=610 Ack=14640 Win=5718 Len=0
27,0.391144,151.101.2.187,100.84.170.161,TLSv1.2,169,Application Data
28,0.391144,151.101.2.187,100.84.170.161,TCP,169,"[TCP Retransmission] 443  >  64433 [PSH, ACK] Seq=610 Ack=14640 Win=5718 Len=115"
29,0.3914353,100.84.170.161,151.101.2.187,TCP,66,64433  >  443 [ACK] Seq=17081 Ack=725 Win=8212 Len=0 SLE=610 SRE=725
30,0.3952433,151.101.2.187,100.84.170.161,TCP,56,443  >  64433 [ACK] Seq=725 Ack=17081 Win=5724 Len=0
31,0.3967322,151.101.2.187,100.84.170.161,TCP,66,[TCP Dup ACK 30#1] 443  >  64433 [ACK] Seq=725 Ack=17081 Win=5724 Len=0 SLE=15621 SRE=17081
32,0.3992001,151.101.2.187,100.84.170.161,TLSv1.2,98,Application Data
33,0.447208,100.84.170.161,151.101.2.187,TCP,54,64433  >  443 [ACK] Seq=17081 Ack=769 Win=8212 Len=0
34,0.4556341,151.101.2.187,100.84.170.161,TCP,98,"[TCP Spurious Retransmission] 443  >  64433 [PSH, ACK] Seq=725 Ack=17081 Win=5724 Len=44"
35,0.4556726,100.84.170.161,151.101.2.187,TCP,66,[TCP Dup ACK 33#1] 64433  >  443 [ACK] Seq=17081 Ack=769 Win=8212 Len=0 SLE=725 SRE=769
36,0.6164286,100.84.170.161,151.101.2.187,TLSv1.2,2477,Application Data
37,0.6386399,100.84.170.161,151.101.2.187,TLSv1.2,2483,Application Data
38,0.6410458,100.84.170.161,151.101.2.187,TLSv1.2,2479,Application Data
39,0.6413089,100.84.170.161,151.101.2.187,TLSv1.2,2482,Application Data
40,0.6532427,100.84.170.161,151.101.2.187,TCP,1514,"[TCP Retransmission] 64433  >  443 [PSH, ACK] Seq=25326 Ack=769 Win=8212 Len=1460"
41,0.6537167,151.101.2.187,100.84.170.161,TCP,56,443  >  64433 [ACK] Seq=769 Ack=19504 Win=5729 Len=0
42,0.6537167,151.101.2.187,100.84.170.161,TLSv1.2,297,Application Data
43,0.6625602,151.101.2.187,100.84.170.161,TCP,297,"[TCP Retransmission] 443  >  64433 [PSH, ACK] Seq=769 Ack=19504 Win=5729 Len=243"
44,0.662614,100.84.170.161,151.101.2.187,TCP,66,64433  >  443 [ACK] Seq=26786 Ack=1012 Win=8211 Len=0 SLE=769 SRE=1012
45,0.6629394,151.101.2.187,100.84.170.161,TCP,56,443  >  64433 [ACK] Seq=1012 Ack=26786 Win=5750 Len=0
46,0.663948,151.101.2.187,100.84.170.161,TCP,66,[TCP Dup ACK 45#1] 443  >  64433 [ACK] Seq=1012 Ack=26786 Win=5750 Len=0 SLE=25326 SRE=26786
47,0.6662758,151.101.2.187,100.84.170.161,TLSv1.2,125,Application Data
48,0.6664309,100.84.170.161,151.101.2.187,TCP,54,64433  >  443 [ACK] Seq=26786 Ack=1083 Win=8211 Len=0
49,0.6673323,151.101.2.187,100.84.170.161,TLSv1.2,124,Application Data
50,0.6681119,151.101.2.187,100.84.170.161,TLSv1.2,124,Application Data
51,0.6682376,100.84.170.161,151.101.2.187,TCP,54,64433  >  443 [ACK] Seq=26786 Ack=1223 Win=8210 Len=0
52,1.1543135,100.84.170.161,151.101.2.187,TLSv1.2,2495,Application Data
53,1.2028435,100.84.170.161,151.101.2.187,TCP,1514,"[TCP Retransmission] 64433  >  443 [PSH, ACK] Seq=27767 Ack=1223 Win=8210 Len=1460"
54,1.2128697,100.84.170.161,151.101.2.187,TLSv1.2,2494,Application Data
55,1.2631663,100.84.170.161,151.101.2.187,TLSv1.2,2494,Application Data
56,1.3626215,151.101.2.187,100.84.170.161,TCP,56,443  >  64433 [ACK] Seq=1223 Ack=29227 Win=5756 Len=0
57,1.3626215,151.101.2.187,100.84.170.161,TLSv1.2,131,Application Data
58,1.3626215,151.101.2.187,100.84.170.161,TCP,131,"[TCP Retransmission] 443  >  64433 [PSH, ACK] Seq=1223 Ack=29227 Win=5756 Len=77"
59,1.3626215,151.101.2.187,100.84.170.161,TCP,66,[TCP Dup ACK 56#1] 443  >  64433 [ACK] Seq=1300 Ack=29227 Win=5756 Len=0 SLE=27767 SRE=29227
60,1.3626215,151.101.2.187,100.84.170.161,TCP,56,443  >  64433 [ACK] Seq=1300 Ack=31667 Win=5762 Len=0
61,1.3626215,151.101.2.187,100.84.170.161,TLSv1.2,130,Application Data
62,1.3626215,151.101.2.187,100.84.170.161,TCP,56,443  >  64433 [ACK] Seq=1376 Ack=34107 Win=5767 Len=0
63,1.3626215,151.101.2.187,100.84.170.161,TLSv1.2,208,Application Data
64,1.3627815,100.84.170.161,151.101.2.187,TCP,66,64433  >  443 [ACK] Seq=34107 Ack=1300 Win=8210 Len=0 SLE=1223 SRE=1300
65,1.3630085,100.84.170.161,151.101.2.187,TCP,54,64433  >  443 [ACK] Seq=34107 Ack=1530 Win=8209 Len=0
66,1.396932,100.84.170.161,151.101.2.187,TLSv1.2,2495,Application Data
67,1.4202339,151.101.2.187,100.84.170.161,TCP,56,443  >  64433 [ACK] Seq=1530 Ack=36548 Win=5773 Len=0
68,1.4221065,151.101.2.187,100.84.170.161,TLSv1.2,98,Application Data
69,1.4692968,100.84.170.161,151.101.2.187,TCP,54,64433  >  443 [ACK] Seq=36548 Ack=1574 Win=8209 Len=0
70,1.488658,151.101.2.187,100.84.170.161,TCP,98,"[TCP Spurious Retransmission] 443  >  64433 [PSH, ACK] Seq=1530 Ack=36548 Win=5773 Len=44"
71,1.4887056,100.84.170.161,151.101.2.187,TCP,66,[TCP Dup ACK 69#1] 64433  >  443 [ACK] Seq=36548 Ack=1574 Win=8209 Len=0 SLE=1530 SRE=1574
72,1.5779225,100.84.170.161,151.101.2.187,TLSv1.2,2494,Application Data
73,1.5787163,100.84.170.161,151.101.2.187,TLSv1.2,2495,Application Data
74,1.625761,151.101.2.187,100.84.170.161,TCP,56,443  >  64433 [ACK] Seq=1574 Ack=41429 Win=5788 Len=0
75,1.628373,151.101.2.187,100.84.170.161,TLSv1.2,98,Application Data
76,1.628712,151.101.2.187,100.84.170.161,TLSv1.2,98,Application Data
77,1.6287543,100.84.170.161,151.101.2.187,TCP,54,64433  >  443 [ACK] Seq=41429 Ack=1662 Win=8208 Len=0
78,1.6795966,100.84.170.161,151.101.2.187,TLSv1.2,2499,Application Data
79,1.6798302,100.84.170.161,151.101.2.187,TLSv1.2,2499,Application Data
80,1.6799837,100.84.170.161,151.101.2.187,TLSv1.2,2501,Application Data
81,1.6942957,151.101.2.187,100.84.170.161,TCP,56,443  >  64433 [ACK] Seq=1662 Ack=48766 Win=5805 Len=0
82,1.6970924,151.101.2.187,100.84.170.161,TLSv1.2,130,Application Data
83,1.6974706,151.101.2.187,100.84.170.161,TLSv1.2,130,Application Data
84,1.6975342,100.84.170.161,151.101.2.187,TCP,54,64433  >  443 [ACK] Seq=48766 Ack=1814 Win=8208 Len=0
85,1.6982347,151.101.2.187,100.84.170.161,TLSv1.2,131,Application Data
86,1.7392879,100.84.170.161,151.101.2.187,TCP,54,64433  >  443 [ACK] Seq=48766 Ack=1891 Win=8207 Len=0
87,1.7625198,151.101.2.187,100.84.170.161,TCP,131,"[TCP Spurious Retransmission] 443  >  64433 [PSH, ACK] Seq=1814 Ack=48766 Win=5805 Len=77"
88,1.7625613,100.84.170.161,151.101.2.187,TCP,66,[TCP Dup ACK 86#1] 64433  >  443 [ACK] Seq=48766 Ack=1891 Win=8207 Len=0 SLE=1814 SRE=1891
89,1.7968201,100.84.170.161,151.101.2.187,TLSv1.2,2480,Application Data
90,1.8316256,151.101.2.187,100.84.170.161,TCP,56,443  >  64433 [ACK] Seq=1891 Ack=51192 Win=5811 Len=0
91,1.8340791,151.101.2.187,100.84.170.161,TLSv1.2,104,Application Data
92,1.880272,100.84.170.161,151.101.2.187,TCP,54,64433  >  443 [ACK] Seq=51192 Ack=1941 Win=8207 Len=0
93,1.8914778,151.101.2.187,100.84.170.161,TCP,104,"[TCP Spurious Retransmission] 443  >  64433 [PSH, ACK] Seq=1891 Ack=51192 Win=5811 Len=50"
94,1.891515,100.84.170.161,151.101.2.187,TCP,66,[TCP Dup ACK 92#1] 64433  >  443 [ACK] Seq=51192 Ack=1941 Win=8207 Len=0 SLE=1891 SRE=1941
95,2.1057801,100.84.170.161,151.101.2.187,TLSv1.2,1936,Application Data
96,2.115439,151.101.2.187,100.84.170.161,TCP,56,443  >  64433 [ACK] Seq=1941 Ack=53074 Win=5817 Len=0
97,2.1872304,151.101.2.187,100.84.170.161,TLSv1.2,484,Application Data
98,2.187581,151.101.2.187,100.84.170.161,TCP,1510,443  >  64433 [ACK] Seq=2371 Ack=53074 Win=5817 Len=1456 [TCP PDU reassembled in 100]
99,2.1876239,100.84.170.161,151.101.2.187,TCP,54,64433  >  443 [ACK] Seq=53074 Ack=3827 Win=8212 Len=0
100,2.1878733,151.101.2.187,100.84.170.161,TLSv1.2,523,Application Data
101,2.1884616,100.84.170.161,151.101.2.187,TLSv1.2,89,Application Data
102,2.2343538,151.101.2.187,100.84.170.161,TCP,56,443  >  64433 [ACK] Seq=4296 Ack=53109 Win=5817 Len=0
103,2.2411721,100.84.170.161,151.101.2.187,TLSv1.2,964,Application Data
104,2.2508168,151.101.2.187,100.84.170.161,TCP,56,443  >  64433 [ACK] Seq=4296 Ack=54019 Win=5817 Len=0
105,2.2537191,151.101.2.187,100.84.170.161,TLSv1.2,445,Application Data
106,2.3032067,100.84.170.161,151.101.2.187,TCP,54,64433  >  443 [ACK] Seq=54019 Ack=4687 Win=8209 Len=0
107,2.3032151,151.101.2.187,100.84.170.161,TCP,445,"[TCP Spurious Retransmission] 443  >  64433 [PSH, ACK] Seq=4296 Ack=54019 Win=5817 Len=391"
108,2.3032475,100.84.170.161,151.101.2.187,TCP,66,[TCP Dup ACK 106#1] 64433  >  443 [ACK] Seq=54019 Ack=4687 Win=8209 Len=0 SLE=4296 SRE=4687
109,2.3547548,100.84.170.161,151.101.2.187,TLSv1.2,1684,Application Data
110,2.4247723,100.84.170.161,151.101.2.187,TCP,1514,"[TCP Retransmission] 64433  >  443 [PSH, ACK] Seq=54189 Ack=4687 Win=8209 Len=1460"
111,2.4365169,151.101.2.187,100.84.170.161,TCP,56,443  >  64433 [ACK] Seq=4687 Ack=55649 Win=5822 Len=0
112,2.4368071,151.101.2.187,100.84.170.161,TLSv1.2,125,Application Data
113,2.4441367,151.101.2.187,100.84.170.161,TCP,66,[TCP Dup ACK 111#1] 443  >  64433 [ACK] Seq=4758 Ack=55649 Win=5822 Len=0 SLE=54189 SRE=55649
114,2.4893438,100.84.170.161,151.101.2.187,TCP,54,64433  >  443 [ACK] Seq=55649 Ack=4758 Win=8208 Len=0
115,2.4949643,151.101.2.187,100.84.170.161,TCP,125,"[TCP Spurious Retransmission] 443  >  64433 [PSH, ACK] Seq=4687 Ack=55649 Win=5822 Len=71"
116,2.4950137,100.84.170.161,151.101.2.187,TCP,66,[TCP Dup ACK 114#1] 64433  >  443 [ACK] Seq=55649 Ack=4758 Win=8208 Len=0 SLE=4687 SRE=4758
117,2.5977485,100.84.170.161,151.101.2.187,TLSv1.2,1000,Application Data
118,2.6082849,151.101.2.187,100.84.170.161,TCP,56,443  >  64433 [ACK] Seq=4758 Ack=56595 Win=5822 Len=0
119,2.6111445,151.101.2.187,100.84.170.161,TLSv1.2,98,Application Data
120,2.6416847,100.84.170.161,151.101.2.187,TLSv1.2,1704,Application Data
121,2.6511615,151.101.2.187,100.84.170.161,TCP,56,443  >  64433 [ACK] Seq=4802 Ack=58245 Win=5828 Len=0
122,2.6552845,151.101.2.187,100.84.170.161,TLSv1.2,125,Application Data
123,2.7063086,100.84.170.161,151.101.2.187,TCP,54,64433  >  443 [ACK] Seq=58245 Ack=4873 Win=8208 Len=0
124,2.7064691,151.101.2.187,100.84.170.161,TCP,125,"[TCP Spurious Retransmission] 443  >  64433 [PSH, ACK] Seq=4802 Ack=58245 Win=5828 Len=71"
125,2.7065048,100.84.170.161,151.101.2.187,TCP,66,[TCP Dup ACK 123#1] 64433  >  443 [ACK] Seq=58245 Ack=4873 Win=8208 Len=0 SLE=4802 SRE=4873
126,2.8940766,100.84.170.161,151.101.2.187,TLSv1.2,1001,Application Data
127,2.9038784,151.101.2.187,100.84.170.161,TCP,56,443  >  64433 [ACK] Seq=4873 Ack=59192 Win=5828 Len=0
128,2.906961,151.101.2.187,100.84.170.161,TLSv1.2,104,Application Data
129,2.9526614,100.84.170.161,151.101.2.187,TCP,54,64433  >  443 [ACK] Seq=59192 Ack=4923 Win=8208 Len=0
130,2.9588178,151.101.2.187,100.84.170.161,TCP,104,"[TCP Spurious Retransmission] 443  >  64433 [PSH, ACK] Seq=4873 Ack=59192 Win=5828 Len=50"
131,2.9589537,100.84.170.161,151.101.2.187,TCP,66,[TCP Dup ACK 129#1] 64433  >  443 [ACK] Seq=59192 Ack=4923 Win=8208 Len=0 SLE=4873 SRE=4923
132,3.4206021,100.84.170.161,151.101.2.187,TLSv1.2,1715,Application Data
133,3.4207274,100.84.170.161,151.101.2.187,TLSv1.2,960,Application Data
134,3.4312163,151.101.2.187,100.84.170.161,TCP,56,443  >  64433 [ACK] Seq=4923 Ack=61759 Win=5834 Len=0
135,3.4336931,151.101.2.187,100.84.170.161,TLSv1.2,234,Application Data
136,3.4339032,151.101.2.187,100.84.170.161,TLSv1.2,130,Application Data
137,3.4339296,100.84.170.161,151.101.2.187,TCP,54,64433  >  443 [ACK] Seq=61759 Ack=5179 Win=8207 Len=0
138,3.6202695,100.84.170.161,151.101.66.187,TLSv1.2,175,Application Data
139,3.6203882,100.84.170.161,151.101.66.187,TLSv1.2,93,Application Data
140,3.6315772,151.101.66.187,100.84.170.161,TCP,56,443  >  50935 [ACK] Seq=1 Ack=161 Win=281 Len=0
141,3.6318835,151.101.66.187,100.84.170.161,TLSv1.2,93,Application Data
142,3.6334096,151.101.66.187,100.84.170.161,TLSv1.2,409,Application Data
143,3.6334722,100.84.170.161,151.101.66.187,TCP,54,50935  >  443 [ACK] Seq=161 Ack=395 Win=510 Len=0
144,3.6652747,100.84.170.161,151.101.2.187,TLSv1.2,1723,Application Data
145,3.674864,151.101.2.187,100.84.170.161,TCP,56,443  >  64433 [ACK] Seq=5179 Ack=63428 Win=5840 Len=0
146,3.6778005,151.101.2.187,100.84.170.161,TLSv1.2,130,Application Data
147,3.7264102,151.101.2.187,100.84.170.161,TCP,130,"[TCP Retransmission] 443  >  64433 [PSH, ACK] Seq=5179 Ack=63428 Win=5840 Len=76"
148,3.7264481,100.84.170.161,151.101.2.187,TCP,66,64433  >  443 [ACK] Seq=63428 Ack=5255 Win=8206 Len=0 SLE=5179 SRE=5255
149,3.7968727,100.84.170.161,151.101.2.187,TLSv1.2,990,Application Data
150,3.8015067,100.84.170.161,151.101.2.187,TLSv1.2,1684,Application Data
151,3.8067392,151.101.2.187,100.84.170.161,TCP,56,443  >  64433 [ACK] Seq=5255 Ack=64364 Win=5840 Len=0
152,3.8071146,100.84.170.161,151.101.2.187,TLSv1.2,991,Application Data
153,3.8092074,151.101.2.187,100.84.170.161,TLSv1.2,104,Application Data
154,3.8092746,100.84.170.161,151.101.2.187,TCP,54,64433  >  443 [ACK] Seq=66931 Ack=5305 Win=8212 Len=0
155,3.8105106,151.101.2.187,100.84.170.161,TCP,56,443  >  64433 [ACK] Seq=5305 Ack=65994 Win=5845 Len=0
156,3.8133577,151.101.2.187,100.84.170.161,TLSv1.2,98,Application Data
157,3.813414,100.84.170.161,151.101.2.187,TCP,54,64433  >  443 [ACK] Seq=66931 Ack=5349 Win=8212 Len=0
158,3.816057,151.101.2.187,100.84.170.161,TCP,56,443  >  64433 [ACK] Seq=5349 Ack=66931 Win=5845 Len=0
159,3.8192757,100.84.170.161,151.101.2.187,TLSv1.2,1673,Application Data
160,3.8193247,151.101.2.187,100.84.170.161,TLSv1.2,129,Application Data
161,3.8283865,151.101.2.187,100.84.170.161,TCP,56,443  >  64433 [ACK] Seq=5424 Ack=68550 Win=5851 Len=0
162,3.8310861,151.101.2.187,100.84.170.161,TLSv1.2,129,Application Data
163,3.8312276,100.84.170.161,151.101.2.187,TCP,54,64433  >  443 [ACK] Seq=68550 Ack=5499 Win=8211 Len=0
164,3.8518767,100.84.170.161,151.101.2.187,TLSv1.2,985,Application Data
165,3.8520802,100.84.170.161,151.101.2.187,TLSv1.2,1670,Application Data
166,3.8610558,151.101.2.187,100.84.170.161,TCP,56,443  >  64433 [ACK] Seq=5499 Ack=69481 Win=5851 Len=0
167,3.8615674,151.101.2.187,100.84.170.161,TCP,56,443  >  64433 [ACK] Seq=5499 Ack=71097 Win=5857 Len=0
168,3.8635358,151.101.2.187,100.84.170.161,TLSv1.2,125,Application Data
169,3.8641001,151.101.2.187,100.84.170.161,TLSv1.2,130,Application Data
170,3.8641606,100.84.170.161,151.101.2.187,TCP,54,64433  >  443 [ACK] Seq=71097 Ack=5646 Win=8211 Len=0
171,9.6551156,100.84.170.161,151.101.2.187,TLSv1.2,1030,Application Data
172,9.663725,100.84.170.161,151.101.2.187,TLSv1.2,1698,Application Data
173,9.6655096,151.101.2.187,100.84.170.161,TCP,56,443  >  64433 [ACK] Seq=5646 Ack=72073 Win=5857 Len=0
174,9.6660727,100.84.170.161,151.101.2.187,TLSv1.2,992,Application Data
175,9.6671041,151.101.2.187,100.84.170.161,TLSv1.2,220,Application Data
176,9.6729948,151.101.2.187,100.84.170.161,TCP,56,443  >  64433 [ACK] Seq=5812 Ack=73717 Win=5862 Len=0
177,9.6753523,151.101.2.187,100.84.170.161,TCP,56,443  >  64433 [ACK] Seq=5812 Ack=74655 Win=5862 Len=0
178,9.6758541,151.101.2.187,100.84.170.161,TLSv1.2,168,Application Data
179,9.675906,100.84.170.161,151.101.2.187,TCP,54,64433  >  443 [ACK] Seq=74655 Ack=5926 Win=8210 Len=0
180,9.6781644,151.101.2.187,100.84.170.161,TLSv1.2,291,Application Data
181,9.7251946,100.84.170.161,151.101.2.187,TCP,54,64433  >  443 [ACK] Seq=74655 Ack=6163 Win=8209 Len=0
182,9.7254783,151.101.2.187,100.84.170.161,TCP,291,"[TCP Spurious Retransmission] 443  >  64433 [PSH, ACK] Seq=5926 Ack=74655 Win=5862 Len=237"
183,9.7255185,100.84.170.161,151.101.2.187,TCP,66,[TCP Dup ACK 181#1] 64433  >  443 [ACK] Seq=74655 Ack=6163 Win=8209 Len=0 SLE=5926 SRE=6163
184,9.7742242,100.84.170.161,151.101.2.187,TLSv1.2,1706,Application Data
185,9.7836965,151.101.2.187,100.84.170.161,TCP,56,443  >  64433 [ACK] Seq=6163 Ack=76307 Win=5868 Len=0
186,9.7877641,151.101.2.187,100.84.170.161,TLSv1.2,131,Application Data
187,9.8286055,151.101.2.187,100.84.170.161,TCP,131,"[TCP Retransmission] 443  >  64433 [PSH, ACK] Seq=6163 Ack=76307 Win=5868 Len=77"
188,9.82869,100.84.170.161,151.101.2.187,TCP,66,64433  >  443 [ACK] Seq=76307 Ack=6240 Win=8208 Len=0 SLE=6163 SRE=6240
189,9.877633,100.84.170.161,151.101.2.187,TLSv1.2,1012,Application Data
190,9.8873542,151.101.2.187,100.84.170.161,TCP,56,443  >  64433 [ACK] Seq=6240 Ack=77265 Win=5868 Len=0
191,9.888268,100.84.170.161,151.101.2.187,TLSv1.2,1706,Application Data
192,9.8897112,151.101.2.187,100.84.170.161,TLSv1.2,125,Application Data
193,9.8975258,151.101.2.187,100.84.170.161,TCP,56,443  >  64433 [ACK] Seq=6311 Ack=78917 Win=5874 Len=0
194,9.9002576,151.101.2.187,100.84.170.161,TLSv1.2,130,Application Data
195,9.9003114,100.84.170.161,151.101.2.187,TCP,54,64433  >  443 [ACK] Seq=78917 Ack=6387 Win=8208 Len=0
196,10.1074426,100.84.170.161,151.101.2.187,TLSv1.2,965,Application Data
197,10.1188199,151.101.2.187,100.84.170.161,TCP,56,443  >  64433 [ACK] Seq=6387 Ack=79828 Win=5874 Len=0
198,10.1229979,151.101.2.187,100.84.170.161,TLSv1.2,167,Application Data
199,10.1229979,151.101.2.187,100.84.170.161,TLSv1.2,471,Application Data
200,10.123075,100.84.170.161,151.101.2.187,TCP,54,64433  >  443 [ACK] Seq=79828 Ack=6917 Win=8212 Len=0
201,10.1248446,100.84.170.161,151.101.2.187,TLSv1.2,89,Application Data
202,10.1346383,151.101.2.187,100.84.170.161,TCP,56,443  >  64433 [ACK] Seq=6917 Ack=79863 Win=5874 Len=0
203,10.1410202,100.84.170.161,151.101.2.187,TLSv1.2,1701,Application Data
204,10.151404,151.101.2.187,100.84.170.161,TCP,56,443  >  64433 [ACK] Seq=6917 Ack=81510 Win=5879 Len=0
205,10.1543822,151.101.2.187,100.84.170.161,TLSv1.2,131,Application Data
206,10.1932473,151.101.2.187,100.84.170.161,TCP,131,"[TCP Retransmission] 443  >  64433 [PSH, ACK] Seq=6917 Ack=81510 Win=5879 Len=77"
207,10.1932941,100.84.170.161,151.101.2.187,TCP,66,64433  >  443 [ACK] Seq=81510 Ack=6994 Win=8212 Len=0 SLE=6917 SRE=6994
208,10.215911,100.84.170.161,151.101.2.187,TLSv1.2,978,Application Data
209,10.2160747,100.84.170.161,151.101.2.187,TLSv1.2,1649,Application Data
210,10.2252957,151.101.2.187,100.84.170.161,TCP,56,443  >  64433 [ACK] Seq=6994 Ack=82434 Win=5879 Len=0
211,10.2260198,151.101.2.187,100.84.170.161,TCP,56,443  >  64433 [ACK] Seq=6994 Ack=84029 Win=5885 Len=0
212,10.2275141,151.101.2.187,100.84.170.161,TLSv1.2,162,Application Data
213,10.2278466,151.101.2.187,100.84.170.161,TCP,1510,443  >  64433 [ACK] Seq=7102 Ack=84029 Win=5885 Len=1456 [TCP PDU reassembled in 215]
214,10.2278852,100.84.170.161,151.101.2.187,TCP,54,64433  >  443 [ACK] Seq=84029 Ack=8558 Win=8212 Len=0
215,10.2288695,151.101.2.187,100.84.170.161,TLSv1.2,883,Application Data
216,10.2288695,151.101.2.187,100.84.170.161,TLSv1.2,155,Application Data
217,10.2288695,151.101.2.187,100.84.170.161,TLSv1.2,452,Application Data
218,10.2289496,100.84.170.161,151.101.2.187,TCP,54,64433  >  443 [ACK] Seq=84029 Ack=9886 Win=8207 Len=0
219,10.3463999,100.84.170.161,151.101.2.187,TLSv1.2,1005,Application Data
220,10.3508025,100.84.170.161,151.101.2.187,TLSv1.2,1683,Application Data
221,10.3512695,100.84.170.161,151.101.2.187,TLSv1.2,993,Application Data
222,10.351594,100.84.170.161,151.101.2.187,TLSv1.2,1694,Application Data
223,10.3518909,100.84.170.161,151.101.2.187,TLSv1.2,992,Application Data
224,10.3560607,151.101.2.187,100.84.170.161,TCP,56,443  >  64433 [ACK] Seq=9886 Ack=84980 Win=5885 Len=0
225,10.3588108,151.101.2.187,100.84.170.161,TLSv1.2,241,Application Data
226,10.3588661,100.84.170.161,151.101.2.187,TCP,54,64433  >  443 [ACK] Seq=90126 Ack=10073 Win=8212 Len=0
227,10.3602305,151.101.2.187,100.84.170.161,TCP,56,443  >  64433 [ACK] Seq=10073 Ack=86609 Win=5891 Len=0
228,10.3608367,151.101.2.187,100.84.170.161,TCP,56,443  >  64433 [ACK] Seq=10073 Ack=89188 Win=5897 Len=0
229,10.361563,151.101.2.187,100.84.170.161,TCP,56,443  >  64433 [ACK] Seq=10073 Ack=90126 Win=5897 Len=0
230,10.3712332,151.101.2.187,100.84.170.161,TLSv1.2,179,Application Data
231,10.3712934,100.84.170.161,151.101.2.187,TCP,54,64433  >  443 [ACK] Seq=90126 Ack=10198 Win=8212 Len=0
232,10.3714746,151.101.2.187,100.84.170.161,TLSv1.2,124,Application Data
233,10.3717805,151.101.2.187,100.84.170.161,TLSv1.2,174,Application Data
234,10.3718077,100.84.170.161,151.101.2.187,TCP,54,64433  >  443 [ACK] Seq=90126 Ack=10388 Win=8211 Len=0
235,16.1043577,100.84.170.161,151.101.2.187,TLSv1.2,2385,Application Data
236,16.1067997,100.84.170.161,151.101.2.187,TLSv1.2,2553,Application Data
237,16.1141544,151.101.2.187,100.84.170.161,TCP,56,443  >  64433 [ACK] Seq=10388 Ack=92457 Win=5902 Len=0
238,16.1169296,151.101.2.187,100.84.170.161,TCP,56,443  >  64433 [ACK] Seq=10388 Ack=94956 Win=5908 Len=0
239,16.1171981,151.101.2.187,100.84.170.161,TLSv1.2,401,Application Data
240,16.1193148,151.101.2.187,100.84.170.161,TLSv1.2,125,Application Data
241,16.1193832,100.84.170.161,151.101.2.187,TCP,54,64433  >  443 [ACK] Seq=94956 Ack=10806 Win=8209 Len=0
242,16.1635805,100.84.170.161,151.101.2.187,TLSv1.2,2541,Application Data
243,16.16835,100.84.170.161,151.101.2.187,TLSv1.2,2538,Application Data
244,16.1740992,151.101.2.187,100.84.170.161,TCP,56,443  >  64433 [ACK] Seq=10806 Ack=97443 Win=5914 Len=0
245,16.1763595,151.101.2.187,100.84.170.161,TLSv1.2,130,Application Data
246,16.1775255,151.101.2.187,100.84.170.161,TCP,56,443  >  64433 [ACK] Seq=10882 Ack=99927 Win=5919 Len=0
247,16.1796511,151.101.2.187,100.84.170.161,TLSv1.2,124,Application Data
248,16.1797057,100.84.170.161,151.101.2.187,TCP,54,64433  >  443 [ACK] Seq=99927 Ack=10952 Win=8209 Len=0
249,20.47089,100.84.170.161,151.101.2.187,TLSv1.2,2438,Application Data
250,20.4822523,151.101.2.187,100.84.170.161,TCP,56,443  >  64433 [ACK] Seq=10952 Ack=102311 Win=5925 Len=0
251,20.4849543,151.101.2.187,100.84.170.161,TLSv1.2,214,Application Data
252,20.5160211,151.101.2.187,100.84.170.161,TCP,214,"[TCP Retransmission] 443  >  64433 [PSH, ACK] Seq=10952 Ack=102311 Win=5925 Len=160"
253,20.5160668,100.84.170.161,151.101.2.187,TCP,66,64433  >  443 [ACK] Seq=102311 Ack=11112 Win=8208 Len=0 SLE=10952 SRE=11112
254,20.5178259,100.84.170.161,151.101.2.187,TLSv1.2,2423,Application Data
255,20.5271586,151.101.2.187,100.84.170.161,TCP,56,443  >  64433 [ACK] Seq=11112 Ack=104680 Win=5931 Len=0
256,20.5296706,151.101.2.187,100.84.170.161,TLSv1.2,130,Application Data
257,20.5346082,100.84.170.161,151.101.2.187,TLSv1.2,2437,Application Data
258,20.5440282,151.101.2.187,100.84.170.161,TCP,56,443  >  64433 [ACK] Seq=11188 Ack=107063 Win=5936 Len=0
259,20.5466148,151.101.2.187,100.84.170.161,TLSv1.2,125,Application Data
260,20.5775289,151.101.2.187,100.84.170.161,TCP,125,"[TCP Retransmission] 443  >  64433 [PSH, ACK] Seq=11188 Ack=107063 Win=5936 Len=71"
261,20.5775699,100.84.170.161,151.101.2.187,TCP,66,64433  >  443 [ACK] Seq=107063 Ack=11259 Win=8207 Len=0 SLE=11188 SRE=11259
262,21.3057101,100.84.170.161,151.101.2.187,TLSv1.2,2441,Application Data
263,21.315145,151.101.2.187,100.84.170.161,TCP,56,443  >  64433 [ACK] Seq=11259 Ack=109450 Win=5942 Len=0
264,21.317603,151.101.2.187,100.84.170.161,TLSv1.2,241,Application Data
265,21.3493044,151.101.2.187,100.84.170.161,TCP,241,"[TCP Retransmission] 443  >  64433 [PSH, ACK] Seq=11259 Ack=109450 Win=5942 Len=187"
266,21.3493435,100.84.170.161,151.101.2.187,TCP,66,64433  >  443 [ACK] Seq=109450 Ack=11446 Win=8207 Len=0 SLE=11259 SRE=11446
267,21.4544735,100.84.170.161,151.101.2.187,TLSv1.2,2443,Application Data
268,21.4567847,100.84.170.161,151.101.2.187,TLSv1.2,2429,Application Data
269,21.4641944,100.84.170.161,151.101.2.187,TLSv1.2,2444,Application Data
270,21.4654856,151.101.2.187,100.84.170.161,TCP,56,443  >  64433 [ACK] Seq=11446 Ack=111839 Win=5948 Len=0
271,21.4660308,151.101.2.187,100.84.170.161,TCP,56,443  >  64433 [ACK] Seq=11446 Ack=114214 Win=5954 Len=0
272,21.4680274,151.101.2.187,100.84.170.161,TLSv1.2,98,Application Data
273,21.4692156,151.101.2.187,100.84.170.161,TLSv1.2,104,Application Data
274,21.4692708,100.84.170.161,151.101.2.187,TCP,54,64433  >  443 [ACK] Seq=116604 Ack=11540 Win=8212 Len=0
275,21.4733087,151.101.2.187,100.84.170.161,TCP,56,443  >  64433 [ACK] Seq=11540 Ack=116604 Win=5959 Len=0
276,21.4763506,151.101.2.187,100.84.170.161,TLSv1.2,98,Application Data
277,21.5094352,151.101.2.187,100.84.170.161,TCP,98,"[TCP Retransmission] 443  >  64433 [PSH, ACK] Seq=11540 Ack=116604 Win=5959 Len=44"
278,21.5094808,100.84.170.161,151.101.2.187,TCP,66,64433  >  443 [ACK] Seq=116604 Ack=11584 Win=8212 Len=0 SLE=11540 SRE=11584
279,22.0486521,100.84.170.161,151.101.2.187,TLSv1.2,2446,Application Data
280,22.0595477,151.101.2.187,100.84.170.161,TCP,56,443  >  64433 [ACK] Seq=11584 Ack=118996 Win=5965 Len=0
281,22.0620042,151.101.2.187,100.84.170.161,TLSv1.2,131,Application Data
282,22.0922731,151.101.2.187,100.84.170.161,TCP,131,"[TCP Retransmission] 443  >  64433 [PSH, ACK] Seq=11584 Ack=118996 Win=5965 Len=77"
283,22.0923786,100.84.170.161,151.101.2.187,TCP,66,64433  >  443 [ACK] Seq=118996 Ack=11661 Win=8212 Len=0 SLE=11584 SRE=11661
284,23.4149037,100.84.170.161,151.101.2.187,TLSv1.2,2378,Application Data
285,23.4245345,151.101.2.187,100.84.170.161,TCP,56,443  >  64433 [ACK] Seq=11661 Ack=121320 Win=5971 Len=0
286,23.4370317,151.101.2.187,100.84.170.161,TLSv1.2,481,Application Data
287,23.4395748,100.84.170.161,151.101.2.187,TLSv1.2,89,Application Data
288,23.44981,151.101.2.187,100.84.170.161,TCP,56,443  >  64433 [ACK] Seq=12088 Ack=121355 Win=5971 Len=0
289,28.5300756,100.84.170.161,151.101.2.187,TLSv1.2,2429,Application Data
290,28.5332589,100.84.170.161,151.101.2.187,TLSv1.2,2379,Application Data
291,28.5392996,151.101.2.187,100.84.170.161,TCP,56,443  >  64433 [ACK] Seq=12088 Ack=123730 Win=5976 Len=0
292,28.5420187,151.101.2.187,100.84.170.161,TLSv1.2,373,Application Data
293,28.5432675,151.101.2.187,100.84.170.161,TCP,56,443  >  64433 [ACK] Seq=12407 Ack=126055 Win=5982 Len=0
294,28.5467541,151.101.2.187,100.84.170.161,TLSv1.2,138,Application Data
295,28.5468226,100.84.170.161,151.101.2.187,TCP,54,64433  >  443 [ACK] Seq=126055 Ack=12491 Win=8208 Len=0
296,28.5470691,151.101.2.187,100.84.170.161,TLSv1.2,301,Application Data
297,28.5492223,100.84.170.161,151.101.2.187,TLSv1.2,89,Application Data
298,28.5587525,151.101.2.187,100.84.170.161,TCP,56,443  >  64433 [ACK] Seq=12738 Ack=126090 Win=5982 Len=0
299,43.1650236,100.84.170.161,151.101.2.187,TLSv1.2,2461,Application Data
300,43.165144,100.84.170.161,151.101.2.187,TLSv1.2,93,Application Data
301,43.1735468,100.84.170.161,151.101.2.187,TLSv1.2,2452,Application Data
302,43.1750514,151.101.2.187,100.84.170.161,TCP,56,443  >  64433 [ACK] Seq=12738 Ack=128536 Win=5988 Len=0
303,43.1752692,151.101.2.187,100.84.170.161,TLSv1.2,93,Application Data
304,43.1773002,100.84.170.161,151.101.2.187,TLSv1.2,2396,Application Data
305,43.1781857,151.101.2.187,100.84.170.161,TLSv1.2,241,Application Data
306,43.1783301,100.84.170.161,151.101.2.187,TLSv1.2,2446,Application Data
307,43.1829558,151.101.2.187,100.84.170.161,TCP,56,443  >  64433 [ACK] Seq=12964 Ack=130934 Win=5993 Len=0
308,43.1853415,151.101.2.187,100.84.170.161,TLSv1.2,124,Application Data
309,43.1854246,100.84.170.161,151.101.2.187,TCP,54,64433  >  443 [ACK] Seq=135668 Ack=13034 Win=8212 Len=0
310,43.1864158,151.101.2.187,100.84.170.161,TCP,56,443  >  64433 [ACK] Seq=13034 Ack=133276 Win=5999 Len=0
311,43.1875539,151.101.2.187,100.84.170.161,TCP,56,443  >  64433 [ACK] Seq=13034 Ack=135668 Win=6005 Len=0
312,43.1898217,151.101.2.187,100.84.170.161,TLSv1.2,161,Application Data
313,43.1898958,100.84.170.161,151.101.2.187,TCP,54,64433  >  443 [ACK] Seq=135668 Ack=13141 Win=8212 Len=0
314,43.1902066,151.101.2.187,100.84.170.161,TLSv1.2,318,Application Data
315,43.1908755,151.101.2.187,100.84.170.161,TLSv1.2,131,Application Data
316,43.1909289,100.84.170.161,151.101.2.187,TCP,54,64433  >  443 [ACK] Seq=135668 Ack=13482 Win=8210 Len=0
317,43.19216,100.84.170.161,151.101.2.187,TLSv1.2,89,Application Data
318,43.2012977,151.101.2.187,100.84.170.161,TCP,56,443  >  64433 [ACK] Seq=13482 Ack=135703 Win=6005 Len=0
319,43.2696715,100.84.170.161,151.101.2.187,TLSv1.2,2446,Application Data
320,43.2801686,151.101.2.187,100.84.170.161,TCP,56,443  >  64433 [ACK] Seq=13482 Ack=138095 Win=6011 Len=0
321,43.2822709,151.101.2.187,100.84.170.161,TLSv1.2,240,Application Data
322,43.3093373,151.101.2.187,100.84.170.161,TCP,240,"[TCP Retransmission] 443  >  64433 [PSH, ACK] Seq=13482 Ack=138095 Win=6011 Len=186"
323,43.3093893,100.84.170.161,151.101.2.187,TCP,66,64433  >  443 [ACK] Seq=138095 Ack=13668 Win=8210 Len=0 SLE=13482 SRE=13668
324,43.3136048,100.84.170.161,151.101.2.187,TLSv1.2,2460,Application Data
325,43.323488,151.101.2.187,100.84.170.161,TCP,56,443  >  64433 [ACK] Seq=13668 Ack=140501 Win=6016 Len=0
326,43.326204,151.101.2.187,100.84.170.161,TLSv1.2,125,Application Data
327,43.3521841,151.101.2.187,100.84.170.161,TCP,125,"[TCP Retransmission] 443  >  64433 [PSH, ACK] Seq=13668 Ack=140501 Win=6016 Len=71"
328,43.3522218,100.84.170.161,151.101.2.187,TCP,66,64433  >  443 [ACK] Seq=140501 Ack=13739 Win=8209 Len=0 SLE=13668 SRE=13739
329,43.3973101,100.84.170.161,151.101.2.187,TLSv1.2,2443,Application Data
330,43.4071684,151.101.2.187,100.84.170.161,TCP,56,443  >  64433 [ACK] Seq=13739 Ack=142890 Win=6022 Len=0
331,43.4098526,151.101.2.187,100.84.170.161,TLSv1.2,125,Application Data
332,43.4140237,100.84.170.161,151.101.2.187,TLSv1.2,2460,Application Data
333,43.4237019,151.101.2.187,100.84.170.161,TCP,56,443  >  64433 [ACK] Seq=13810 Ack=145296 Win=6028 Len=0
334,43.426225,151.101.2.187,100.84.170.161,TLSv1.2,130,Application Data
335,43.4533489,151.101.2.187,100.84.170.161,TCP,130,"[TCP Retransmission] 443  >  64433 [PSH, ACK] Seq=13810 Ack=145296 Win=6028 Len=76"
336,43.4533917,100.84.170.161,151.101.2.187,TCP,66,64433  >  443 [ACK] Seq=145296 Ack=13886 Win=8209 Len=0 SLE=13810 SRE=13886
337,43.5389439,100.84.170.161,151.101.2.187,TLSv1.2,2455,Application Data
338,43.5482204,151.101.2.187,100.84.170.161,TCP,56,443  >  64433 [ACK] Seq=13886 Ack=147697 Win=6033 Len=0
339,43.5504677,151.101.2.187,100.84.170.161,TLSv1.2,181,Application Data
340,43.5774532,151.101.2.187,100.84.170.161,TCP,181,"[TCP Retransmission] 443  >  64433 [PSH, ACK] Seq=13886 Ack=147697 Win=6033 Len=127"
341,43.5775407,100.84.170.161,151.101.2.187,TCP,66,64433  >  443 [ACK] Seq=147697 Ack=14013 Win=8208 Len=0 SLE=13886 SRE=14013
342,43.6277983,100.84.170.161,151.101.2.187,TLSv1.2,2461,Application Data
343,43.6280742,100.84.170.161,151.101.2.187,TLSv1.2,2457,Application Data
344,43.6286562,100.84.170.161,151.101.2.187,TLSv1.2,2449,Application Data
345,43.6288712,100.84.170.161,151.101.2.187,TLSv1.2,2445,Application Data
346,43.6290726,100.84.170.161,151.101.2.187,TLSv1.2,2448,Application Data
347,43.6372686,151.101.2.187,100.84.170.161,TCP,56,443  >  64433 [ACK] Seq=14013 Ack=150104 Win=6039 Len=0
348,43.6375851,151.101.2.187,100.84.170.161,TCP,56,443  >  64433 [ACK] Seq=14013 Ack=152507 Win=6045 Len=0
349,43.6378917,151.101.2.187,100.84.170.161,TCP,56,443  >  64433 [ACK] Seq=14013 Ack=154902 Win=6051 Len=0
350,43.6383261,151.101.2.187,100.84.170.161,TCP,56,443  >  64433 [ACK] Seq=14013 Ack=159687 Win=6062 Len=0
351,43.6400542,151.101.2.187,100.84.170.161,TLSv1.2,291,Application Data
352,43.6405892,151.101.2.187,100.84.170.161,TLSv1.2,130,Application Data
353,43.6406427,100.84.170.161,151.101.2.187,TCP,54,64433  >  443 [ACK] Seq=159687 Ack=14326 Win=8207 Len=0
354,43.6408873,151.101.2.187,100.84.170.161,TLSv1.2,131,Application Data
355,43.6412142,151.101.2.187,100.84.170.161,TLSv1.2,130,Application Data
356,43.6412566,100.84.170.161,151.101.2.187,TCP,54,64433  >  443 [ACK] Seq=159687 Ack=14479 Win=8206 Len=0
357,43.6415219,151.101.2.187,100.84.170.161,TLSv1.2,124,Application Data
358,43.6772658,151.101.2.187,100.84.170.161,TCP,124,"[TCP Retransmission] 443  >  64433 [PSH, ACK] Seq=14479 Ack=159687 Win=6062 Len=70"
359,43.677303,100.84.170.161,151.101.2.187,TCP,66,64433  >  443 [ACK] Seq=159687 Ack=14549 Win=8212 Len=0 SLE=14479 SRE=14549
360,43.7960024,100.84.170.161,151.101.2.187,TLSv1.2,2489,Application Data
361,43.7962641,100.84.170.161,151.101.2.187,TLSv1.2,2510,Application Data
362,43.7973333,100.84.170.161,151.101.2.187,TLSv1.2,2512,Application Data
363,43.8053212,151.101.2.187,100.84.170.161,TCP,56,443  >  64433 [ACK] Seq=14549 Ack=162122 Win=6068 Len=0
364,43.8056222,151.101.2.187,100.84.170.161,TCP,56,443  >  64433 [ACK] Seq=14549 Ack=164578 Win=6073 Len=0
365,43.8063718,151.101.2.187,100.84.170.161,TCP,56,443  >  64433 [ACK] Seq=14549 Ack=167036 Win=6079 Len=0
366,43.808412,151.101.2.187,100.84.170.161,TLSv1.2,130,Application Data
367,43.8092334,151.101.2.187,100.84.170.161,TLSv1.2,131,Application Data
368,43.8092893,100.84.170.161,151.101.2.187,TCP,54,64433  >  443 [ACK] Seq=167036 Ack=14702 Win=8211 Len=0
369,43.8096887,151.101.2.187,100.84.170.161,TLSv1.2,130,Application Data
370,43.8462462,151.101.2.187,100.84.170.161,TCP,130,"[TCP Retransmission] 443  >  64433 [PSH, ACK] Seq=14702 Ack=167036 Win=6079 Len=76"
371,43.8462839,100.84.170.161,151.101.2.187,TCP,66,64433  >  443 [ACK] Seq=167036 Ack=14778 Win=8211 Len=0 SLE=14702 SRE=14778
372,46.8237035,100.84.170.161,151.101.2.187,TLSv1.2,2504,Application Data
373,46.8332992,151.101.2.187,100.84.170.161,TCP,56,443  >  64433 [ACK] Seq=14778 Ack=169486 Win=6085 Len=0
374,46.8361772,151.101.2.187,100.84.170.161,TLSv1.2,240,Application Data
375,46.8493602,100.84.170.161,151.101.2.187,TLSv1.2,2499,Application Data
376,46.8504855,100.84.170.161,151.101.2.187,TLSv1.2,2498,Application Data
377,46.8584751,151.101.2.187,100.84.170.161,TCP,56,443  >  64433 [ACK] Seq=14964 Ack=171931 Win=6090 Len=0
378,46.8599177,151.101.2.187,100.84.170.161,TCP,56,443  >  64433 [ACK] Seq=14964 Ack=174375 Win=6096 Len=0
379,46.8613165,151.101.2.187,100.84.170.161,TLSv1.2,130,Application Data
380,46.8636023,151.101.2.187,100.84.170.161,TLSv1.2,131,Application Data
381,46.8636831,100.84.170.161,151.101.2.187,TCP,54,64433  >  443 [ACK] Seq=174375 Ack=15117 Win=8210 Len=0
382,46.9789468,100.84.170.161,151.101.2.187,TLSv1.2,2512,Application Data
383,46.9794653,100.84.170.161,151.101.2.187,TLSv1.2,2513,Application Data
384,46.9896446,151.101.2.187,100.84.170.161,TCP,56,443  >  64433 [ACK] Seq=15117 Ack=179292 Win=6108 Len=0
385,46.9923425,151.101.2.187,100.84.170.161,TLSv1.2,169,Application Data
386,46.992638,151.101.2.187,100.84.170.161,TLSv1.2,131,Application Data
387,46.9926732,100.84.170.161,151.101.2.187,TCP,54,64433  >  443 [ACK] Seq=179292 Ack=15309 Win=8209 Len=0
388,47.0934978,100.84.170.161,151.101.2.187,TLSv1.2,2513,Application Data
389,47.1027003,151.101.2.187,100.84.170.161,TCP,56,443  >  64433 [ACK] Seq=15309 Ack=181751 Win=6113 Len=0
390,47.105495,151.101.2.187,100.84.170.161,TLSv1.2,125,Application Data
391,47.1331586,151.101.2.187,100.84.170.161,TCP,125,"[TCP Retransmission] 443  >  64433 [PSH, ACK] Seq=15309 Ack=181751 Win=6113 Len=71"
392,47.1332043,100.84.170.161,151.101.2.187,TCP,66,64433  >  443 [ACK] Seq=181751 Ack=15380 Win=8209 Len=0 SLE=15309 SRE=15380
393,47.1804354,100.84.170.161,151.101.2.187,TLSv1.2,2534,Application Data
394,47.1896553,151.101.2.187,100.84.170.161,TCP,56,443  >  64433 [ACK] Seq=15380 Ack=184231 Win=6119 Len=0
395,47.1924292,151.101.2.187,100.84.170.161,TLSv1.2,290,Application Data
396,47.2202073,151.101.2.187,100.84.170.161,TCP,290,"[TCP Retransmission] 443  >  64433 [PSH, ACK] Seq=15380 Ack=184231 Win=6119 Len=236"
397,47.220252,100.84.170.161,151.101.2.187,TCP,66,64433  >  443 [ACK] Seq=184231 Ack=15616 Win=8208 Len=0 SLE=15380 SRE=15616
398,48.6340582,100.84.170.161,151.101.66.187,TCP,55,[TCP Keep-Alive] 50935  >  443 [ACK] Seq=160 Ack=395 Win=510 Len=1
399,48.6447193,151.101.66.187,100.84.170.161,TCP,66,[TCP Keep-Alive ACK] 443  >  50935 [ACK] Seq=395 Ack=161 Win=281 Len=0 SLE=160 SRE=161
400,50.2785407,100.84.170.161,151.101.2.187,TLSv1.2,2511,Application Data
401,50.2910514,151.101.2.187,100.84.170.161,TCP,56,443  >  64433 [ACK] Seq=15616 Ack=186688 Win=6125 Len=0
402,50.2931254,151.101.2.187,100.84.170.161,TLSv1.2,214,Application Data
403,50.3211155,151.101.2.187,100.84.170.161,TCP,214,"[TCP Retransmission] 443  >  64433 [PSH, ACK] Seq=15616 Ack=186688 Win=6125 Len=160"
404,50.3211619,100.84.170.161,151.101.2.187,TCP,66,64433  >  443 [ACK] Seq=186688 Ack=15776 Win=8207 Len=0 SLE=15616 SRE=15776
405,51.2734877,100.84.170.161,151.101.2.187,TLSv1.2,2504,Application Data
406,51.2796029,100.84.170.161,151.101.2.187,TLSv1.2,2499,Application Data
407,51.2803261,100.84.170.161,151.101.2.187,TLSv1.2,2498,Application Data
408,51.2825108,151.101.2.187,100.84.170.161,TCP,56,443  >  64433 [ACK] Seq=15776 Ack=189138 Win=6130 Len=0
409,51.285852,151.101.2.187,100.84.170.161,TLSv1.2,214,Application Data
410,51.288872,151.101.2.187,100.84.170.161,TCP,56,443  >  64433 [ACK] Seq=15936 Ack=191583 Win=6136 Len=0
411,51.2894222,151.101.2.187,100.84.170.161,TCP,56,443  >  64433 [ACK] Seq=15936 Ack=194027 Win=6142 Len=0
412,51.2916802,151.101.2.187,100.84.170.161,TLSv1.2,104,Application Data
413,51.2917324,100.84.170.161,151.101.2.187,TCP,54,64433  >  443 [ACK] Seq=194027 Ack=15986 Win=8206 Len=0
414,51.2919109,151.101.2.187,100.84.170.161,TLSv1.2,104,Application Data
415,51.3285997,100.84.170.161,151.101.2.187,TLSv1.2,2512,Application Data
416,51.3288375,100.84.170.161,151.101.2.187,TLSv1.2,2513,Application Data
417,51.3294109,151.101.2.187,100.84.170.161,TCP,104,"[TCP Spurious Retransmission] 443  >  64433 [PSH, ACK] Seq=15986 Ack=194027 Win=6142 Len=50"
418,51.3294441,100.84.170.161,151.101.2.187,TCP,66,[TCP Dup ACK 415#1] 64433  >  443 [ACK] Seq=198944 Ack=16036 Win=8212 Len=0 SLE=15986 SRE=16036
419,51.3378238,151.101.2.187,100.84.170.161,TCP,56,443  >  64433 [ACK] Seq=16036 Ack=196485 Win=6147 Len=0
420,51.3383056,151.101.2.187,100.84.170.161,TCP,56,443  >  64433 [ACK] Seq=16036 Ack=198944 Win=6153 Len=0
421,51.3409112,151.101.2.187,100.84.170.161,TLSv1.2,98,Application Data
422,51.3416613,151.101.2.187,100.84.170.161,TLSv1.2,98,Application Data
423,51.341716,100.84.170.161,151.101.2.187,TCP,54,64433  >  443 [ACK] Seq=198944 Ack=16124 Win=8212 Len=0
424,51.4513802,100.84.170.161,151.101.2.187,TLSv1.2,2517,Application Data
425,51.45188,100.84.170.161,151.101.2.187,TLSv1.2,2517,Application Data
426,51.4520144,100.84.170.161,151.101.2.187,TLSv1.2,2519,Application Data
427,51.4629123,151.101.2.187,100.84.170.161,TCP,56,443  >  64433 [ACK] Seq=16124 Ack=206335 Win=6170 Len=0
428,51.4656472,151.101.2.187,100.84.170.161,TLSv1.2,131,Application Data
429,51.4659898,151.101.2.187,100.84.170.161,TLSv1.2,184,Application Data
430,51.4660326,100.84.170.161,151.101.2.187,TCP,54,64433  >  443 [ACK] Seq=206335 Ack=16331 Win=8211 Len=0
431,54.0161525,100.84.170.161,151.101.2.187,TLSv1.2,2511,Application Data
432,54.0163837,100.84.170.161,151.101.2.187,TLSv1.2,2512,Application Data
433,54.0256088,151.101.2.187,100.84.170.161,TCP,56,443  >  64433 [ACK] Seq=16331 Ack=208792 Win=6176 Len=0
434,54.0260468,151.101.2.187,100.84.170.161,TCP,56,443  >  64433 [ACK] Seq=16331 Ack=211250 Win=6182 Len=0
435,54.0292381,151.101.2.187,100.84.170.161,TLSv1.2,214,Application Data
436,54.0295922,151.101.2.187,100.84.170.161,TLSv1.2,98,Application Data
437,54.0296304,100.84.170.161,151.101.2.187,TCP,54,64433  >  443 [ACK] Seq=211250 Ack=16535 Win=8210 Len=0
438,54.2269436,100.84.170.161,151.101.2.187,TLSv1.2,2515,Application Data
439,54.2271374,100.84.170.161,151.101.2.187,TLSv1.2,2517,Application Data
440,54.2366052,151.101.2.187,100.84.170.161,TCP,56,443  >  64433 [ACK] Seq=16535 Ack=216174 Win=6193 Len=0
441,54.2394107,151.101.2.187,100.84.170.161,TLSv1.2,104,Application Data
442,54.2398273,151.101.2.187,100.84.170.161,TLSv1.2,98,Application Data
443,54.2399201,100.84.170.161,151.101.2.187,TCP,54,64433  >  443 [ACK] Seq=216174 Ack=16629 Win=8210 Len=0
444,56.5387019,100.84.170.161,151.101.2.187,TLSv1.2,2459,Application Data
445,56.5478867,151.101.2.187,100.84.170.161,TCP,56,443  >  64433 [ACK] Seq=16629 Ack=218579 Win=6199 Len=0
446,56.5505257,151.101.2.187,100.84.170.161,TLSv1.2,955,Application Data
447,56.5526299,100.84.170.161,151.101.2.187,TLSv1.2,89,Application Data
448,56.5615607,151.101.2.187,100.84.170.161,TCP,56,443  >  64433 [ACK] Seq=17530 Ack=218614 Win=6199 Len=0
449,59.2139839,100.84.170.161,151.101.2.187,TLSv1.2,2512,Application Data
450,59.2255071,151.101.2.187,100.84.170.161,TCP,56,443  >  64433 [ACK] Seq=17530 Ack=221072 Win=6205 Len=0
451,59.227475,151.101.2.187,100.84.170.161,TLSv1.2,400,Application Data
452,59.2552595,151.101.2.187,100.84.170.161,TCP,400,"[TCP Retransmission] 443  >  64433 [PSH, ACK] Seq=17530 Ack=221072 Win=6205 Len=346"
453,59.2553015,100.84.170.161,151.101.2.187,TCP,66,64433  >  443 [ACK] Seq=221072 Ack=17876 Win=8211 Len=0 SLE=17530 SRE=17876
