"No.","Time","Source","Destination","Protocol","Length","Info"
"1","0.000000000","100.84.170.161","151.101.66.187","TLSv1.2","2485","Application Data"
"2","0.000130200","100.84.170.161","151.101.66.187","TLSv1.2","93","Application Data"
"3","0.004758600","100.84.170.161","151.101.66.187","TLSv1.2","2486","Application Data"
"4","0.009358000","151.101.66.187","100.84.170.161","TCP","56","443  >  59747 [ACK] Seq=1 Ack=2471 Win=4381 Len=0"
"5","0.009909900","151.101.66.187","100.84.170.161","TLSv1.2","93","Application Data"
"6","0.011436600","151.101.66.187","100.84.170.161","TLSv1.2","264","Application Data"
"7","0.011574600","100.84.170.161","151.101.66.187","TCP","54","59747  >  443 [ACK] Seq=4903 Ack=250 Win=4104 Len=0"
"8","0.013898100","151.101.66.187","100.84.170.161","TCP","56","443  >  59747 [ACK] Seq=250 Ack=4903 Win=4390 Len=0"
"9","0.016084600","151.101.66.187","100.84.170.161","TLSv1.2","98","Application Data"
"10","0.051044000","151.101.66.187","100.84.170.161","TCP","98","[TCP Retransmission] 443  >  59747 [PSH, ACK] Seq=250 Ack=4903 Win=4390 Len=44"
"11","0.051083500","100.84.170.161","151.101.66.187","TCP","66","59747  >  443 [ACK] Seq=4903 Ack=294 Win=4104 Len=0 SLE=250 SRE=294"
"12","1.821736600","100.84.170.161","151.101.66.187","TLSv1.2","2417","Application Data"
"13","1.832343700","151.101.66.187","100.84.170.161","TCP","56","443  >  59747 [ACK] Seq=294 Ack=7266 Win=4400 Len=0"
"14","1.834783100","151.101.66.187","100.84.170.161","TLSv1.2","277","Application Data"
"15","1.866415500","151.101.66.187","100.84.170.161","TCP","277","[TCP Retransmission] 443  >  59747 [PSH, ACK] Seq=294 Ack=7266 Win=4400 Len=223"
"16","1.866464900","100.84.170.161","151.101.66.187","TCP","66","59747  >  443 [ACK] Seq=7266 Ack=517 Win=4103 Len=0 SLE=294 SRE=517"
"17","1.983071600","100.84.170.161","151.101.66.187","TLSv1.2","2415","Application Data"
"18","1.991921000","151.101.66.187","100.84.170.161","TCP","56","443  >  59747 [ACK] Seq=517 Ack=9627 Win=4409 Len=0"
"19","1.995291600","151.101.66.187","100.84.170.161","TLSv1.2","98","Application Data"
"20","2.028129900","151.101.66.187","100.84.170.161","TCP","98","[TCP Retransmission] 443  >  59747 [PSH, ACK] Seq=517 Ack=9627 Win=4409 Len=44"
"21","2.028183700","100.84.170.161","151.101.66.187","TCP","66","59747  >  443 [ACK] Seq=9627 Ack=561 Win=4103 Len=0 SLE=517 SRE=561"
"22","2.520456200","100.84.170.161","151.101.66.187","TLSv1.2","2416","Application Data"
"23","2.531707500","151.101.66.187","100.84.170.161","TCP","56","443  >  59747 [ACK] Seq=561 Ack=11989 Win=4418 Len=0"
"24","2.534128700","151.101.66.187","100.84.170.161","TLSv1.2","234","Application Data"
"25","2.565796500","151.101.66.187","100.84.170.161","TCP","234","[TCP Retransmission] 443  >  59747 [PSH, ACK] Seq=561 Ack=11989 Win=4418 Len=180"
"26","2.565845200","100.84.170.161","151.101.66.187","TCP","66","59747  >  443 [ACK] Seq=11989 Ack=741 Win=4102 Len=0 SLE=561 SRE=741"
"27","2.617269800","100.84.170.161","151.101.66.187","TLSv1.2","2415","Application Data"
"28","2.626049200","151.101.66.187","100.84.170.161","TCP","56","443  >  59747 [ACK] Seq=741 Ack=14350 Win=4427 Len=0"
"29","2.628600400","151.101.66.187","100.84.170.161","TLSv1.2","98","Application Data"
"30","2.659399800","151.101.66.187","100.84.170.161","TCP","98","[TCP Retransmission] 443  >  59747 [PSH, ACK] Seq=741 Ack=14350 Win=4427 Len=44"
"31","2.659438200","100.84.170.161","151.101.66.187","TCP","66","59747  >  443 [ACK] Seq=14350 Ack=785 Win=4102 Len=0 SLE=741 SRE=785"
"32","3.717542100","100.84.170.161","151.101.66.187","TLSv1.2","2417","Application Data"
"33","3.717759600","100.84.170.161","151.101.66.187","TLSv1.2","2418","Application Data"
"34","3.727789000","151.101.66.187","100.84.170.161","TCP","56","443  >  59747 [ACK] Seq=785 Ack=19077 Win=4446 Len=0"
"35","3.730019200","151.101.66.187","100.84.170.161","TLSv1.2","241","Application Data"
"36","3.730305400","151.101.66.187","100.84.170.161","TLSv1.2","98","Application Data"
"37","3.730351200","100.84.170.161","151.101.66.187","TCP","54","59747  >  443 [ACK] Seq=19077 Ack=1016 Win=4101 Len=0"
"38","4.114980400","100.84.170.161","151.101.66.187","TLSv1.2","2415","Application Data"
"39","4.124907000","151.101.66.187","100.84.170.161","TCP","56","443  >  59747 [ACK] Seq=1016 Ack=21438 Win=4455 Len=0"
"40","4.128740900","151.101.66.187","100.84.170.161","TLSv1.2","98","Application Data"
"41","4.158982600","151.101.66.187","100.84.170.161","TCP","98","[TCP Retransmission] 443  >  59747 [PSH, ACK] Seq=1016 Ack=21438 Win=4455 Len=44"
"42","4.159054500","100.84.170.161","151.101.66.187","TCP","66","59747  >  443 [ACK] Seq=21438 Ack=1060 Win=4101 Len=0 SLE=1016 SRE=1060"
"43","4.957473000","100.84.170.161","151.101.66.187","TLSv1.2","2471","Application Data"
"44","4.966438400","151.101.66.187","100.84.170.161","TCP","56","443  >  59747 [ACK] Seq=1060 Ack=23855 Win=4464 Len=0"
"45","4.970678200","151.101.66.187","100.84.170.161","TLSv1.2","286","Application Data"
"46","5.000477600","151.101.66.187","100.84.170.161","TCP","286","[TCP Retransmission] 443  >  59747 [PSH, ACK] Seq=1060 Ack=23855 Win=4464 Len=232"
"47","5.000526000","100.84.170.161","151.101.66.187","TCP","66","59747  >  443 [ACK] Seq=23855 Ack=1292 Win=4100 Len=0 SLE=1060 SRE=1292"
"48","5.407539600","100.84.170.161","151.101.66.187","TLSv1.2","2415","Application Data"
"49","5.421995200","151.101.66.187","100.84.170.161","TCP","56","443  >  59747 [ACK] Seq=1292 Ack=26216 Win=4474 Len=0"
"50","5.425552400","151.101.66.187","100.84.170.161","TLSv1.2","292","Application Data"
"51","5.455405300","151.101.66.187","100.84.170.161","TCP","292","[TCP Retransmission] 443  >  59747 [PSH, ACK] Seq=1292 Ack=26216 Win=4474 Len=238"
"52","5.455445700","100.84.170.161","151.101.66.187","TCP","66","59747  >  443 [ACK] Seq=26216 Ack=1530 Win=4106 Len=0 SLE=1292 SRE=1530"
"53","9.020418400","100.84.170.161","151.101.66.187","TLSv1.2","2482","Application Data"
"54","9.030210600","151.101.66.187","100.84.170.161","TCP","56","443  >  59747 [ACK] Seq=1530 Ack=28644 Win=4483 Len=0"
"55","9.032565700","151.101.66.187","100.84.170.161","TLSv1.2","214","Application Data"
"56","9.032975600","100.84.170.161","151.101.66.187","TLSv1.2","2473","Application Data"
"57","9.037349900","100.84.170.161","151.101.66.187","TLSv1.2","2467","Application Data"
"58","9.042339200","151.101.66.187","100.84.170.161","TCP","56","443  >  59747 [ACK] Seq=1690 Ack=31063 Win=4492 Len=0"
"59","9.044752500","151.101.66.187","100.84.170.161","TLSv1.2","124","Application Data"
"60","9.046739000","151.101.66.187","100.84.170.161","TCP","56","443  >  59747 [ACK] Seq=1760 Ack=33476 Win=4502 Len=0"
"61","9.049331600","151.101.66.187","100.84.170.161","TLSv1.2","181","Application Data"
"62","9.049410400","100.84.170.161","151.101.66.187","TCP","54","59747  >  443 [ACK] Seq=33476 Ack=1887 Win=4104 Len=0"
"63","9.421071200","100.84.170.161","151.101.66.187","TLSv1.2","2464","Application Data"
"64","9.431668200","151.101.66.187","100.84.170.161","TCP","56","443  >  59747 [ACK] Seq=1887 Ack=35886 Win=4511 Len=0"
"65","9.433925300","151.101.66.187","100.84.170.161","TLSv1.2","235","Application Data"
"66","9.461385700","100.84.170.161","151.101.66.187","TLSv1.2","2481","Application Data"
"67","9.462794500","151.101.66.187","100.84.170.161","TCP","235","[TCP Spurious Retransmission] 443  >  59747 [PSH, ACK] Seq=1887 Ack=35886 Win=4511 Len=181"
"68","9.462832800","100.84.170.161","151.101.66.187","TCP","66","[TCP Dup ACK 66#1] 59747  >  443 [ACK] Seq=38313 Ack=2068 Win=4104 Len=0 SLE=1887 SRE=2068"
"69","9.470742200","151.101.66.187","100.84.170.161","TCP","56","443  >  59747 [ACK] Seq=2068 Ack=38313 Win=4521 Len=0"
"70","9.473787000","151.101.66.187","100.84.170.161","TLSv1.2","161","Application Data"
"71","9.502562100","151.101.66.187","100.84.170.161","TCP","161","[TCP Retransmission] 443  >  59747 [PSH, ACK] Seq=2068 Ack=38313 Win=4521 Len=107"
"72","9.502627800","100.84.170.161","151.101.66.187","TCP","66","59747  >  443 [ACK] Seq=38313 Ack=2175 Win=4103 Len=0 SLE=2068 SRE=2175"
"73","9.536750800","100.84.170.161","151.101.66.187","TLSv1.2","2481","Application Data"
"74","9.546229700","151.101.66.187","100.84.170.161","TCP","56","443  >  59747 [ACK] Seq=2175 Ack=40740 Win=4530 Len=0"
"75","9.548346700","151.101.66.187","100.84.170.161","TLSv1.2","98","Application Data"
"76","9.576586500","151.101.66.187","100.84.170.161","TCP","98","[TCP Retransmission] 443  >  59747 [PSH, ACK] Seq=2175 Ack=40740 Win=4530 Len=44"
"77","9.576643500","100.84.170.161","151.101.66.187","TCP","66","59747  >  443 [ACK] Seq=40740 Ack=2219 Win=4103 Len=0 SLE=2175 SRE=2219"
"78","9.936507400","100.84.170.161","151.101.66.187","TLSv1.2","2476","Application Data"
"79","9.947388700","151.101.66.187","100.84.170.161","TCP","56","443  >  59747 [ACK] Seq=2219 Ack=43162 Win=4540 Len=0"
"80","9.951128200","151.101.66.187","100.84.170.161","TLSv1.2","131","Application Data"
"81","9.980008600","151.101.66.187","100.84.170.161","TCP","131","[TCP Retransmission] 443  >  59747 [PSH, ACK] Seq=2219 Ack=43162 Win=4540 Len=77"
"82","9.980054100","100.84.170.161","151.101.66.187","TCP","66","59747  >  443 [ACK] Seq=43162 Ack=2296 Win=4103 Len=0 SLE=2219 SRE=2296"
"83","10.043626100","100.84.170.161","151.101.66.187","TLSv1.2","2486","Application Data"
"84","10.043940200","100.84.170.161","151.101.66.187","TLSv1.2","2478","Application Data"
"85","10.046578400","100.84.170.161","151.101.66.187","TLSv1.2","2482","Application Data"
"86","10.066785300","100.84.170.161","151.101.66.187","TCP","1514","[TCP Retransmission] 59747  >  443 [PSH, ACK] Seq=48986 Ack=2296 Win=4103 Len=1460"
"87","10.128639000","151.101.66.187","100.84.170.161","TCP","56","443  >  59747 [ACK] Seq=2296 Ack=50446 Win=4568 Len=0"
"88","10.128894600","151.101.66.187","100.84.170.161","TLSv1.2","130","Application Data"
"89","10.131100600","151.101.66.187","100.84.170.161","TLSv1.2","131","Application Data"
"90","10.131100600","151.101.66.187","100.84.170.161","TLSv1.2","130","Application Data"
"91","10.131184000","100.84.170.161","151.101.66.187","TCP","54","59747  >  443 [ACK] Seq=50446 Ack=2525 Win=4102 Len=0"
"92","10.151723300","151.101.66.187","100.84.170.161","TCP","66","[TCP Dup ACK 87#1] 443  >  59747 [ACK] Seq=2525 Ack=50446 Win=4568 Len=0 SLE=48986 SRE=50446"
"93","10.155062800","151.101.66.187","100.84.170.161","TCP","130","[TCP Spurious Retransmission] 443  >  59747 [PSH, ACK] Seq=2449 Ack=50446 Win=4568 Len=76"
"94","10.155126800","100.84.170.161","151.101.66.187","TCP","66","[TCP Dup ACK 91#1] 59747  >  443 [ACK] Seq=50446 Ack=2525 Win=4102 Len=0 SLE=2449 SRE=2525"
"95","10.888438100","100.84.170.161","151.101.66.187","TLSv1.2","2558","Application Data"
"96","10.898785900","151.101.66.187","100.84.170.161","TCP","56","443  >  59747 [ACK] Seq=2525 Ack=52950 Win=4578 Len=0"
"97","10.901999300","151.101.66.187","100.84.170.161","TLSv1.2","286","Application Data"
"98","10.912594000","100.84.170.161","151.101.66.187","TLSv1.2","2546","Application Data"
"99","10.912863800","100.84.170.161","151.101.66.187","TLSv1.2","2547","Application Data"
"100","10.913025500","100.84.170.161","151.101.66.187","TLSv1.2","2557","Application Data"
"101","10.917180700","100.84.170.161","151.101.66.187","TLSv1.2","2543","Application Data"
"102","10.921720200","151.101.66.187","100.84.170.161","TCP","56","443  >  59747 [ACK] Seq=2757 Ack=55442 Win=4588 Len=0"
"103","10.922054400","151.101.66.187","100.84.170.161","TCP","56","443  >  59747 [ACK] Seq=2757 Ack=60438 Win=4607 Len=0"
"104","10.924790600","151.101.66.187","100.84.170.161","TLSv1.2","124","Application Data"
"105","10.926534400","151.101.66.187","100.84.170.161","TLSv1.2","208","Application Data"
"106","10.926610600","100.84.170.161","151.101.66.187","TCP","54","59747  >  443 [ACK] Seq=62927 Ack=2981 Win=4100 Len=0"
"107","10.927402000","151.101.66.187","100.84.170.161","TCP","56","443  >  59747 [ACK] Seq=2981 Ack=62927 Win=4619 Len=0"
"108","10.929823400","151.101.66.187","100.84.170.161","TLSv1.2","125","Application Data"
"109","10.930107700","151.101.66.187","100.84.170.161","TLSv1.2","124","Application Data"
"110","10.930159400","100.84.170.161","151.101.66.187","TCP","54","59747  >  443 [ACK] Seq=62927 Ack=3122 Win=4106 Len=0"
"111","14.607483200","100.84.170.161","151.101.66.187","TLSv1.2","2571","Application Data"
"112","14.615205900","100.84.170.161","151.101.66.187","TLSv1.2","2569","Application Data"
"113","14.616367800","151.101.66.187","100.84.170.161","TCP","56","443  >  59747 [ACK] Seq=3122 Ack=65444 Win=4628 Len=0"
"114","14.619733000","151.101.66.187","100.84.170.161","TLSv1.2","241","Application Data"
"115","14.624128100","151.101.66.187","100.84.170.161","TCP","56","443  >  59747 [ACK] Seq=3309 Ack=67959 Win=4638 Len=0"
"116","14.627212700","151.101.66.187","100.84.170.161","TLSv1.2","175","Application Data"
"117","14.627276900","100.84.170.161","151.101.66.187","TCP","54","59747  >  443 [ACK] Seq=67959 Ack=3430 Win=4105 Len=0"
"118","14.833558700","100.84.170.161","151.101.66.187","TLSv1.2","2572","Application Data"
"119","14.843755000","151.101.66.187","100.84.170.161","TCP","56","443  >  59747 [ACK] Seq=3430 Ack=70477 Win=4648 Len=0"
"120","14.846735000","151.101.66.187","100.84.170.161","TLSv1.2","131","Application Data"
"121","14.887598000","151.101.66.187","100.84.170.161","TCP","131","[TCP Retransmission] 443  >  59747 [PSH, ACK] Seq=3430 Ack=70477 Win=4648 Len=77"
"122","14.887645400","100.84.170.161","151.101.66.187","TCP","66","59747  >  443 [ACK] Seq=70477 Ack=3507 Win=4104 Len=0 SLE=3430 SRE=3507"
"123","15.346878800","100.84.170.161","151.101.66.187","TLSv1.2","2557","Application Data"
"124","15.357018100","151.101.66.187","100.84.170.161","TCP","56","443  >  59747 [ACK] Seq=3507 Ack=72980 Win=4658 Len=0"
"125","15.358997000","151.101.66.187","100.84.170.161","TLSv1.2","271","Application Data"
"126","15.403595500","100.84.170.161","151.101.66.187","TCP","54","59747  >  443 [ACK] Seq=72980 Ack=3724 Win=4103 Len=0"
"127","15.413846800","151.101.66.187","100.84.170.161","TCP","271","[TCP Spurious Retransmission] 443  >  59747 [PSH, ACK] Seq=3507 Ack=72980 Win=4658 Len=217"
"128","15.413890700","100.84.170.161","151.101.66.187","TCP","66","[TCP Dup ACK 126#1] 59747  >  443 [ACK] Seq=72980 Ack=3724 Win=4103 Len=0 SLE=3507 SRE=3724"
"129","15.510771900","100.84.170.161","151.101.66.187","TLSv1.2","2560","Application Data"
"130","15.524002300","151.101.66.187","100.84.170.161","TCP","56","443  >  59747 [ACK] Seq=3724 Ack=75486 Win=4668 Len=0"
"131","15.533369900","151.101.66.187","100.84.170.161","TLSv1.2","124","Application Data"
"132","15.556560900","151.101.66.187","100.84.170.161","TCP","124","[TCP Retransmission] 443  >  59747 [PSH, ACK] Seq=3724 Ack=75486 Win=4668 Len=70"
"133","15.556603000","100.84.170.161","151.101.66.187","TCP","66","59747  >  443 [ACK] Seq=75486 Ack=3794 Win=4103 Len=0 SLE=3724 SRE=3794"
"134","15.576255400","100.84.170.161","151.101.66.187","TLSv1.2","2562","Application Data"
"135","15.593470400","151.101.66.187","100.84.170.161","TCP","56","443  >  59747 [ACK] Seq=3794 Ack=77994 Win=4677 Len=0"
"136","15.598500100","151.101.66.187","100.84.170.161","TLSv1.2","124","Application Data"
"137","15.619402300","151.101.66.187","100.84.170.161","TCP","124","[TCP Retransmission] 443  >  59747 [PSH, ACK] Seq=3794 Ack=77994 Win=4677 Len=70"
"138","15.619438000","100.84.170.161","151.101.66.187","TCP","66","59747  >  443 [ACK] Seq=77994 Ack=3864 Win=4103 Len=0 SLE=3794 SRE=3864"
"139","17.555961200","100.84.170.161","151.101.66.187","TLSv1.2","2571","Application Data"
"140","17.564566000","151.101.66.187","100.84.170.161","TCP","56","443  >  59747 [ACK] Seq=3864 Ack=80511 Win=4687 Len=0"
"141","17.568143800","151.101.66.187","100.84.170.161","TLSv1.2","214","Application Data"
"142","17.582103000","100.84.170.161","151.101.66.187","TLSv1.2","2569","Application Data"
"143","17.590968900","151.101.66.187","100.84.170.161","TCP","56","443  >  59747 [ACK] Seq=4024 Ack=83026 Win=4697 Len=0"
"144","17.593565800","151.101.66.187","100.84.170.161","TLSv1.2","98","Application Data"
"145","17.593711400","100.84.170.161","151.101.66.187","TLSv1.2","2572","Application Data"
"146","17.602576700","151.101.66.187","100.84.170.161","TCP","56","443  >  59747 [ACK] Seq=4068 Ack=85544 Win=4707 Len=0"
"147","17.605410300","151.101.66.187","100.84.170.161","TLSv1.2","104","Application Data"
"148","17.637497900","151.101.66.187","100.84.170.161","TCP","104","[TCP Retransmission] 443  >  59747 [PSH, ACK] Seq=4068 Ack=85544 Win=4707 Len=50"
"149","17.637537900","100.84.170.161","151.101.66.187","TCP","66","59747  >  443 [ACK] Seq=85544 Ack=4118 Win=4102 Len=0 SLE=4068 SRE=4118"
"150","18.438453300","100.84.170.161","151.101.66.187","TLSv1.2","2571","Application Data"
"151","18.447238500","151.101.66.187","100.84.170.161","TCP","56","443  >  59747 [ACK] Seq=4118 Ack=88061 Win=4717 Len=0"
"152","18.450142600","151.101.66.187","100.84.170.161","TLSv1.2","208","Application Data"
"153","18.461362600","100.84.170.161","151.101.66.187","TLSv1.2","2569","Application Data"
"154","18.470163000","151.101.66.187","100.84.170.161","TCP","56","443  >  59747 [ACK] Seq=4272 Ack=90576 Win=4727 Len=0"
"155","18.473090500","151.101.66.187","100.84.170.161","TLSv1.2","98","Application Data"
"156","18.505352100","151.101.66.187","100.84.170.161","TCP","98","[TCP Retransmission] 443  >  59747 [PSH, ACK] Seq=4272 Ack=90576 Win=4727 Len=44"
"157","18.505389000","100.84.170.161","151.101.66.187","TCP","66","59747  >  443 [ACK] Seq=90576 Ack=4316 Win=4101 Len=0 SLE=4272 SRE=4316"
"158","18.707774900","100.84.170.161","151.101.66.187","TLSv1.2","2572","Application Data"
"159","18.718222200","151.101.66.187","100.84.170.161","TCP","56","443  >  59747 [ACK] Seq=4316 Ack=93094 Win=4736 Len=0"
"160","18.721751600","151.101.66.187","100.84.170.161","TLSv1.2","149","Application Data"
"161","18.754187800","151.101.66.187","100.84.170.161","TCP","149","[TCP Retransmission] 443  >  59747 [PSH, ACK] Seq=4316 Ack=93094 Win=4736 Len=95"
"162","18.754216200","100.84.170.161","151.101.66.187","TCP","66","59747  >  443 [ACK] Seq=93094 Ack=4411 Win=4101 Len=0 SLE=4316 SRE=4411"
"163","19.096103300","100.84.170.161","151.101.66.187","TLSv1.2","2511","Application Data"
"164","19.104726400","151.101.66.187","100.84.170.161","TCP","56","443  >  59747 [ACK] Seq=4411 Ack=95551 Win=4746 Len=0"
"165","19.107664000","151.101.66.187","100.84.170.161","TLSv1.2","124","Application Data"
"166","19.139174800","151.101.66.187","100.84.170.161","TCP","124","[TCP Retransmission] 443  >  59747 [PSH, ACK] Seq=4411 Ack=95551 Win=4746 Len=70"
"167","19.139217500","100.84.170.161","151.101.66.187","TCP","66","59747  >  443 [ACK] Seq=95551 Ack=4481 Win=4100 Len=0 SLE=4411 SRE=4481"
"168","22.573241100","100.84.170.161","151.101.66.187","TLSv1.2","2575","Application Data"
"169","22.582216700","151.101.66.187","100.84.170.161","TCP","56","443  >  59747 [ACK] Seq=4481 Ack=98072 Win=4756 Len=0"
"170","22.585208700","151.101.66.187","100.84.170.161","TLSv1.2","214","Application Data"
"171","22.590934700","100.84.170.161","151.101.66.187","TLSv1.2","2566","Application Data"
"172","22.591325700","100.84.170.161","151.101.66.187","TLSv1.2","2560","Application Data"
"173","22.594752000","100.84.170.161","151.101.66.187","TLSv1.2","2560","Application Data"
"174","22.601404900","151.101.66.187","100.84.170.161","TCP","56","443  >  59747 [ACK] Seq=4641 Ack=103090 Win=4777 Len=0"
"175","22.603574700","151.101.66.187","100.84.170.161","TCP","56","443  >  59747 [ACK] Seq=4641 Ack=105596 Win=4787 Len=0"
"176","22.604440400","151.101.66.187","100.84.170.161","TLSv1.2","202","Application Data"
"177","22.604787800","151.101.66.187","100.84.170.161","TLSv1.2","131","Application Data"
"178","22.604827200","100.84.170.161","151.101.66.187","TCP","54","59747  >  443 [ACK] Seq=105596 Ack=4866 Win=4105 Len=0"
"179","22.605569500","151.101.66.187","100.84.170.161","TLSv1.2","124","Application Data"
"180","22.645269500","151.101.66.187","100.84.170.161","TCP","124","[TCP Retransmission] 443  >  59747 [PSH, ACK] Seq=4866 Ack=105596 Win=4787 Len=70"
"181","22.645307300","100.84.170.161","151.101.66.187","TCP","66","59747  >  443 [ACK] Seq=105596 Ack=4936 Win=4105 Len=0 SLE=4866 SRE=4936"
"182","22.665835300","100.84.170.161","151.101.66.187","TLSv1.2","2560","Application Data"
"183","22.674565500","151.101.66.187","100.84.170.161","TCP","56","443  >  59747 [ACK] Seq=4936 Ack=108102 Win=4797 Len=0"
"184","22.677118100","151.101.66.187","100.84.170.161","TLSv1.2","98","Application Data"
"185","22.707188800","151.101.66.187","100.84.170.161","TCP","98","[TCP Retransmission] 443  >  59747 [PSH, ACK] Seq=4936 Ack=108102 Win=4797 Len=44"
"186","22.707225200","100.84.170.161","151.101.66.187","TCP","66","59747  >  443 [ACK] Seq=108102 Ack=4980 Win=4104 Len=0 SLE=4936 SRE=4980"
"187","22.803078400","100.84.170.161","151.101.66.187","TLSv1.2","2557","Application Data"
"188","22.813386700","151.101.66.187","100.84.170.161","TCP","56","443  >  59747 [ACK] Seq=4980 Ack=110605 Win=4806 Len=0"
"189","22.815235300","151.101.66.187","100.84.170.161","TLSv1.2","131","Application Data"
"190","22.816855200","100.84.170.161","151.101.66.187","TLSv1.2","2574","Application Data"
"191","22.827309800","151.101.66.187","100.84.170.161","TCP","56","443  >  59747 [ACK] Seq=5057 Ack=113125 Win=4816 Len=0"
"192","22.829405200","151.101.66.187","100.84.170.161","TLSv1.2","174","Application Data"
"193","22.844271400","100.84.170.161","151.101.66.187","TLSv1.2","2574","Application Data"
"194","22.855948900","151.101.66.187","100.84.170.161","TCP","56","443  >  59747 [ACK] Seq=5177 Ack=115645 Win=4826 Len=0"
"195","22.857701800","151.101.66.187","100.84.170.161","TLSv1.2","125","Application Data"
"196","22.892354800","151.101.66.187","100.84.170.161","TCP","125","[TCP Retransmission] 443  >  59747 [PSH, ACK] Seq=5177 Ack=115645 Win=4826 Len=71"
"197","22.892392200","100.84.170.161","151.101.66.187","TCP","66","59747  >  443 [ACK] Seq=115645 Ack=5248 Win=4103 Len=0 SLE=5177 SRE=5248"
"198","22.982016400","100.84.170.161","151.101.66.187","TLSv1.2","2569","Application Data"
"199","22.992835400","151.101.66.187","100.84.170.161","TCP","56","443  >  59747 [ACK] Seq=5248 Ack=118160 Win=4836 Len=0"
"200","22.996352500","151.101.66.187","100.84.170.161","TLSv1.2","136","Application Data"
"201","23.030593000","151.101.66.187","100.84.170.161","TCP","136","[TCP Retransmission] 443  >  59747 [PSH, ACK] Seq=5248 Ack=118160 Win=4836 Len=82"
"202","23.030631600","100.84.170.161","151.101.66.187","TCP","66","59747  >  443 [ACK] Seq=118160 Ack=5330 Win=4103 Len=0 SLE=5248 SRE=5330"
"203","23.073332600","100.84.170.161","151.101.66.187","TLSv1.2","2575","Application Data"
"204","23.073637600","100.84.170.161","151.101.66.187","TLSv1.2","2563","Application Data"
"205","23.074548600","100.84.170.161","151.101.66.187","TLSv1.2","2574","Application Data"
"206","23.074678500","100.84.170.161","151.101.66.187","TLSv1.2","2562","Application Data"
"207","23.074834600","100.84.170.161","151.101.66.187","TLSv1.2","2559","Application Data"
"208","23.083953700","151.101.66.187","100.84.170.161","TCP","56","443  >  59747 [ACK] Seq=5330 Ack=123190 Win=4856 Len=0"
"209","23.083953700","151.101.66.187","100.84.170.161","TCP","56","443  >  59747 [ACK] Seq=5330 Ack=128218 Win=4875 Len=0"
"210","23.085948800","151.101.66.187","100.84.170.161","TCP","56","443  >  59747 [ACK] Seq=5330 Ack=130723 Win=4885 Len=0"
"211","23.087811000","151.101.66.187","100.84.170.161","TLSv1.2","157","Application Data"
"212","23.088065500","151.101.66.187","100.84.170.161","TLSv1.2","124","Application Data"
"213","23.088119400","100.84.170.161","151.101.66.187","TCP","54","59747  >  443 [ACK] Seq=130723 Ack=5503 Win=4102 Len=0"
"214","23.092569600","151.101.66.187","100.84.170.161","TLSv1.2","178","Application Data"
"215","23.095383800","151.101.66.187","100.84.170.161","TLSv1.2","125","Application Data"
"216","23.095433100","100.84.170.161","151.101.66.187","TCP","54","59747  >  443 [ACK] Seq=130723 Ack=5698 Win=4102 Len=0"
"217","23.240999300","100.84.170.161","151.101.66.187","TCP","55","55359  >  443 [ACK] Seq=1 Ack=1 Win=513 Len=1 [TCP PDU reassembled in 233]"
"218","23.250129600","151.101.66.187","100.84.170.161","TCP","66","443  >  55359 [ACK] Seq=1 Ack=2 Win=281 Len=0 SLE=1 SRE=2"
"219","23.291301500","100.84.170.161","151.101.66.187","TLSv1.2","2592","Application Data"
"220","23.292255700","100.84.170.161","151.101.66.187","TLSv1.2","2588","Application Data"
"221","23.292478100","100.84.170.161","151.101.66.187","TLSv1.2","2574","Application Data"
"222","23.292637000","100.84.170.161","151.101.66.187","TLSv1.2","2584","Application Data"
"223","23.300660200","151.101.66.187","100.84.170.161","TCP","56","443  >  59747 [ACK] Seq=5698 Ack=133261 Win=4895 Len=0"
"224","23.302052800","151.101.66.187","100.84.170.161","TCP","56","443  >  59747 [ACK] Seq=5698 Ack=140845 Win=4925 Len=0"
"225","23.303894000","151.101.66.187","100.84.170.161","TLSv1.2","240","Application Data"
"226","23.304600700","151.101.66.187","100.84.170.161","TLSv1.2","175","Application Data"
"227","23.304658100","100.84.170.161","151.101.66.187","TCP","54","59747  >  443 [ACK] Seq=140845 Ack=6005 Win=4100 Len=0"
"228","23.305110300","151.101.66.187","100.84.170.161","TLSv1.2","131","Application Data"
"229","23.305110300","151.101.66.187","100.84.170.161","TLSv1.2","208","Application Data"
"230","23.305149300","100.84.170.161","151.101.66.187","TCP","54","59747  >  443 [ACK] Seq=140845 Ack=6236 Win=4106 Len=0"
"231","31.789101900","100.84.170.161","151.101.66.187","TLSv1.2","2111","Application Data"
"232","31.798856400","151.101.66.187","100.84.170.161","TCP","56","443  >  59747 [ACK] Seq=6236 Ack=142902 Win=4933 Len=0"
"233","31.827453700","100.84.170.161","151.101.66.187","TLSv1.2","175","Ignored Unknown Record"
"234","31.827639900","100.84.170.161","151.101.66.187","TLSv1.2","93","Application Data"
"235","31.836337400","151.101.66.187","100.84.170.161","TCP","56","443  >  55359 [ACK] Seq=1 Ack=123 Win=281 Len=0"
"236","31.836543800","151.101.66.187","100.84.170.161","TLSv1.2","93","Application Data"
"237","31.852487800","151.101.66.187","100.84.170.161","TLSv1.2","506","Application Data"
"238","31.852931100","151.101.66.187","100.84.170.161","TLSv1.2","99","Application Data"
"239","31.852967800","100.84.170.161","151.101.66.187","TCP","54","59747  >  443 [ACK] Seq=142902 Ack=6733 Win=4104 Len=0"
"240","31.853336600","151.101.66.187","100.84.170.161","TCP","1510","443  >  59747 [ACK] Seq=6733 Ack=142902 Win=4933 Len=1456 [TCP PDU reassembled in 242]"
"241","31.853736500","100.84.170.161","151.101.66.187","TLSv1.2","89","Application Data"
"242","31.853876300","151.101.66.187","100.84.170.161","TLSv1.2","947","Application Data"
"243","31.862761900","151.101.66.187","100.84.170.161","TCP","56","443  >  59747 [ACK] Seq=9082 Ack=142937 Win=4933 Len=0"
"244","31.864870400","151.101.66.187","100.84.170.161","TCP","93","[TCP Retransmission] 443  >  55359 [PSH, ACK] Seq=1 Ack=162 Win=281 Len=39"
"245","31.864900700","100.84.170.161","151.101.66.187","TCP","66","55359  >  443 [ACK] Seq=162 Ack=40 Win=513 Len=0 SLE=1 SRE=40"
"246","31.887911500","151.101.66.187","100.84.170.161","TLSv1.2","245","Application Data"
"247","31.888004200","100.84.170.161","151.101.66.187","TCP","54","55359  >  443 [ACK] Seq=162 Ack=231 Win=512 Len=0"
"248","31.893591900","151.101.66.187","100.84.170.161","TCP","947","[TCP Retransmission] 443  >  59747 [PSH, ACK] Seq=8189 Ack=142937 Win=4933 Len=893 [TCP PDU reassembled in 242]"
"249","31.893871600","100.84.170.161","151.101.66.187","TCP","66","59747  >  443 [ACK] Seq=142937 Ack=9082 Win=4102 Len=0 SLE=8189 SRE=9082"
"250","31.918603400","100.84.170.161","151.101.66.187","TLSv1.2","881","Application Data"
"251","31.921262400","100.84.170.161","151.101.66.187","TLSv1.2","1860","Application Data"
"252","31.927830800","151.101.66.187","100.84.170.161","TCP","56","443  >  59747 [ACK] Seq=9082 Ack=143764 Win=4933 Len=0"
"253","31.930166200","151.101.66.187","100.84.170.161","TCP","56","443  >  59747 [ACK] Seq=9082 Ack=145570 Win=4933 Len=0"
"254","31.932040100","151.101.66.187","100.84.170.161","TLSv1.2","299","Application Data"
"255","31.932150200","100.84.170.161","151.101.66.187","TLSv1.2","907","Application Data"
"256","31.933626500","151.101.66.187","100.84.170.161","TLSv1.2","125","Application Data"
"257","31.940716000","151.101.66.187","100.84.170.161","TCP","56","443  >  59747 [ACK] Seq=9398 Ack=146423 Win=4933 Len=0"
"258","31.945591400","151.101.66.187","100.84.170.161","TLSv1.2","174","Application Data"
"259","31.945682400","100.84.170.161","151.101.66.187","TCP","54","59747  >  443 [ACK] Seq=146423 Ack=9518 Win=4101 Len=0"
"260","31.986419600","100.84.170.161","151.101.66.187","TLSv1.2","1876","Application Data"
"261","31.986700500","100.84.170.161","151.101.66.187","TLSv1.2","862","Application Data"
"262","31.995523000","151.101.66.187","100.84.170.161","TCP","56","443  >  59747 [ACK] Seq=9518 Ack=148245 Win=4933 Len=0"
"263","31.995832200","151.101.66.187","100.84.170.161","TCP","56","443  >  59747 [ACK] Seq=9518 Ack=149053 Win=4933 Len=0"
"264","31.998736100","151.101.66.187","100.84.170.161","TLSv1.2","130","Application Data"
"265","31.999006200","151.101.66.187","100.84.170.161","TLSv1.2","209","Application Data"
"266","31.999060600","100.84.170.161","151.101.66.187","TCP","54","59747  >  443 [ACK] Seq=149053 Ack=9749 Win=4106 Len=0"
"267","32.141520200","100.84.170.161","151.101.66.187","TLSv1.2","1902","Application Data"
"268","32.151012300","151.101.66.187","100.84.170.161","TCP","56","443  >  59747 [ACK] Seq=9749 Ack=150901 Win=4933 Len=0"
"269","32.152619200","151.101.66.187","100.84.170.161","TLSv1.2","98","Application Data"
"270","32.155620500","100.84.170.161","151.101.66.187","TLSv1.2","895","Application Data"
"271","32.164522600","151.101.66.187","100.84.170.161","TCP","56","443  >  59747 [ACK] Seq=9793 Ack=151742 Win=4933 Len=0"
"272","32.167481400","151.101.66.187","100.84.170.161","TLSv1.2","125","Application Data"
"273","32.196226000","151.101.66.187","100.84.170.161","TCP","125","[TCP Retransmission] 443  >  59747 [PSH, ACK] Seq=9793 Ack=151742 Win=4933 Len=71"
"274","32.196269300","100.84.170.161","151.101.66.187","TCP","66","59747  >  443 [ACK] Seq=151742 Ack=9864 Win=4105 Len=0 SLE=9793 SRE=9864"
"275","32.344468600","100.84.170.161","151.101.66.187","TLSv1.2","1903","Application Data"
"276","32.353553900","151.101.66.187","100.84.170.161","TCP","56","443  >  59747 [ACK] Seq=9864 Ack=153591 Win=4933 Len=0"
"277","32.358280500","151.101.66.187","100.84.170.161","TLSv1.2","208","Application Data"
"278","32.387457000","151.101.66.187","100.84.170.161","TCP","208","[TCP Retransmission] 443  >  59747 [PSH, ACK] Seq=9864 Ack=153591 Win=4933 Len=154"
"279","32.387487900","100.84.170.161","151.101.66.187","TCP","66","59747  >  443 [ACK] Seq=153591 Ack=10018 Win=4105 Len=0 SLE=9864 SRE=10018"
"280","32.462501900","100.84.170.161","151.101.66.187","TLSv1.2","907","Application Data"
"281","32.472373000","151.101.66.187","100.84.170.161","TCP","56","443  >  59747 [ACK] Seq=10018 Ack=154444 Win=4933 Len=0"
"282","32.474286800","151.101.66.187","100.84.170.161","TLSv1.2","124","Application Data"
"283","32.502214700","151.101.66.187","100.84.170.161","TCP","124","[TCP Retransmission] 443  >  59747 [PSH, ACK] Seq=10018 Ack=154444 Win=4933 Len=70"
"284","32.502260100","100.84.170.161","151.101.66.187","TCP","66","59747  >  443 [ACK] Seq=154444 Ack=10088 Win=4104 Len=0 SLE=10018 SRE=10088"
"285","34.261369900","100.84.170.161","151.101.66.187","TLSv1.2","1892","Application Data"
"286","34.272061600","151.101.66.187","100.84.170.161","TCP","56","443  >  59747 [ACK] Seq=10088 Ack=156282 Win=4933 Len=0"
"287","34.274565500","151.101.66.187","100.84.170.161","TLSv1.2","240","Application Data"
"288","34.303231400","151.101.66.187","100.84.170.161","TCP","240","[TCP Retransmission] 443  >  59747 [PSH, ACK] Seq=10088 Ack=156282 Win=4933 Len=186"
"289","34.303271500","100.84.170.161","151.101.66.187","TCP","66","59747  >  443 [ACK] Seq=156282 Ack=10274 Win=4104 Len=0 SLE=10088 SRE=10274"
"290","34.743701800","100.84.170.161","151.101.66.187","TLSv1.2","899","Application Data"
"291","34.744073300","100.84.170.161","151.101.66.187","TLSv1.2","1871","Application Data"
"292","34.744381600","100.84.170.161","151.101.66.187","TLSv1.2","886","Application Data"
"293","34.744729000","100.84.170.161","151.101.66.187","TLSv1.2","1871","Application Data"
"294","34.745000000","100.84.170.161","151.101.66.187","TLSv1.2","903","Application Data"
"295","34.745200300","100.84.170.161","151.101.66.187","TLSv1.2","1878","Application Data"
"296","34.746914700","100.84.170.161","151.101.66.187","TLSv1.2","906","Application Data"
"297","34.747058700","100.84.170.161","151.101.66.187","TLSv1.2","1848","Application Data"
"298","34.747139000","100.84.170.161","151.101.66.187","TLSv1.2","909","Application Data"
"299","34.749660200","100.84.170.161","151.101.66.187","TLSv1.2","1845","Application Data"
"300","34.749797500","100.84.170.161","151.101.66.187","TLSv1.2","915","Application Data"
"301","34.754142400","151.101.66.187","100.84.170.161","TCP","56","443  >  59747 [ACK] Seq=10274 Ack=162442 Win=4940 Len=0"
"302","34.754401500","151.101.66.187","100.84.170.161","TCP","56","443  >  59747 [ACK] Seq=10274 Ack=164266 Win=4940 Len=0"
"303","34.755855400","151.101.66.187","100.84.170.161","TCP","56","443  >  59747 [ACK] Seq=10274 Ack=165118 Win=4940 Len=0"
"304","34.756990800","151.101.66.187","100.84.170.161","TCP","56","443  >  59747 [ACK] Seq=10274 Ack=167767 Win=4940 Len=0"
"305","34.757732900","151.101.66.187","100.84.170.161","TLSv1.2","124","Application Data"
"306","34.758119200","151.101.66.187","100.84.170.161","TLSv1.2","131","Application Data"
"307","34.758152300","100.84.170.161","151.101.66.187","TCP","54","59747  >  443 [ACK] Seq=170419 Ack=10421 Win=4103 Len=0"
"308","34.758920800","151.101.66.187","100.84.170.161","TCP","56","443  >  59747 [ACK] Seq=10421 Ack=170419 Win=4940 Len=0"
"309","34.759275200","151.101.66.187","100.84.170.161","TLSv1.2","180","Application Data"
"310","34.759959000","151.101.66.187","100.84.170.161","TLSv1.2","130","Application Data"
"311","34.760013700","100.84.170.161","151.101.66.187","TCP","54","59747  >  443 [ACK] Seq=170419 Ack=10623 Win=4102 Len=0"
"312","34.760663300","151.101.66.187","100.84.170.161","TLSv1.2","169","Application Data"
"313","34.761657700","151.101.66.187","100.84.170.161","TLSv1.2","161","Application Data"
"314","34.761707100","100.84.170.161","151.101.66.187","TCP","54","59747  >  443 [ACK] Seq=170419 Ack=10845 Win=4101 Len=0"
"315","34.761914300","151.101.66.187","100.84.170.161","TLSv1.2","124","Application Data"
"316","34.762223700","151.101.66.187","100.84.170.161","TLSv1.2","130","Application Data"
"317","34.762257200","100.84.170.161","151.101.66.187","TCP","54","59747  >  443 [ACK] Seq=170419 Ack=10991 Win=4101 Len=0"
"318","34.762491300","151.101.66.187","100.84.170.161","TLSv1.2","176","Application Data"
"319","34.763795000","151.101.66.187","100.84.170.161","TLSv1.2","124","Application Data"
"320","34.763851000","100.84.170.161","151.101.66.187","TCP","54","59747  >  443 [ACK] Seq=170419 Ack=11183 Win=4100 Len=0"
"321","35.978949000","100.84.170.161","151.101.66.187","TLSv1.2","1883","Application Data"
"322","35.981096800","100.84.170.161","151.101.66.187","TLSv1.2","864","Application Data"
"323","35.988884500","151.101.66.187","100.84.170.161","TCP","56","443  >  59747 [ACK] Seq=11183 Ack=172248 Win=4940 Len=0"
"324","35.989727300","151.101.66.187","100.84.170.161","TCP","56","443  >  59747 [ACK] Seq=11183 Ack=173058 Win=4940 Len=0"
"325","35.991809600","151.101.66.187","100.84.170.161","TLSv1.2","317","Application Data"
"326","35.992986900","151.101.66.187","100.84.170.161","TLSv1.2","130","Application Data"
"327","35.993053200","100.84.170.161","151.101.66.187","TCP","54","59747  >  443 [ACK] Seq=173058 Ack=11522 Win=4106 Len=0"
"328","36.046256700","100.84.170.161","151.101.66.187","TLSv1.2","1893","Application Data"
"329","36.050113200","100.84.170.161","151.101.66.187","TLSv1.2","853","Application Data"
"330","36.055566400","151.101.66.187","100.84.170.161","TCP","56","443  >  59747 [ACK] Seq=11522 Ack=174897 Win=4940 Len=0"
"331","36.058225600","151.101.66.187","100.84.170.161","TLSv1.2","130","Application Data"
"332","36.059057100","151.101.66.187","100.84.170.161","TCP","56","443  >  59747 [ACK] Seq=11598 Ack=175696 Win=4940 Len=0"
"333","36.061006300","151.101.66.187","100.84.170.161","TLSv1.2","131","Application Data"
"334","36.061064500","100.84.170.161","151.101.66.187","TCP","54","59747  >  443 [ACK] Seq=175696 Ack=11675 Win=4105 Len=0"
"335","44.820415900","100.84.170.161","151.101.66.187","TLSv1.2","1912","Application Data"
"336","44.820607400","100.84.170.161","151.101.66.187","TLSv1.2","860","Application Data"
"337","44.831270900","151.101.66.187","100.84.170.161","TCP","56","443  >  59747 [ACK] Seq=11675 Ack=178360 Win=4940 Len=0"
"338","44.833964400","151.101.66.187","100.84.170.161","TLSv1.2","241","Application Data"
"339","44.834212500","151.101.66.187","100.84.170.161","TLSv1.2","137","Application Data"
"340","44.834254600","100.84.170.161","151.101.66.187","TCP","54","59747  >  443 [ACK] Seq=178360 Ack=11945 Win=4104 Len=0"
"341","44.955467600","100.84.170.161","151.101.66.187","TLSv1.2","1904","Application Data"
"342","44.955750700","100.84.170.161","151.101.66.187","TLSv1.2","854","Application Data"
"343","44.964273200","151.101.66.187","100.84.170.161","TCP","56","443  >  59747 [ACK] Seq=11945 Ack=180210 Win=4940 Len=0"
"344","44.964652900","151.101.66.187","100.84.170.161","TCP","56","443  >  59747 [ACK] Seq=11945 Ack=181010 Win=4940 Len=0"
"345","44.967114400","151.101.66.187","100.84.170.161","TLSv1.2","104","Application Data"
"346","44.968120100","151.101.66.187","100.84.170.161","TLSv1.2","142","Application Data"
"347","44.968191700","100.84.170.161","151.101.66.187","TCP","54","59747  >  443 [ACK] Seq=181010 Ack=12083 Win=4104 Len=0"
"348","46.679746300","100.84.170.161","151.101.66.187","TLSv1.2","1959","Application Data"
"349","46.690424600","151.101.66.187","100.84.170.161","TCP","56","443  >  59747 [ACK] Seq=12083 Ack=182915 Win=4940 Len=0"
"350","46.863000900","151.101.66.187","100.84.170.161","TCP","14614","443  >  59747 [ACK] Seq=12083 Ack=182915 Win=4940 Len=14560 [TCP PDU reassembled in 351]"
"351","46.863000900","151.101.66.187","100.84.170.161","TLSv1.2","1466","Application Data"
"352","46.863000900","151.101.66.187","100.84.170.161","TCP","7334","443  >  59747 [ACK] Seq=28055 Ack=182915 Win=4940 Len=7280 [TCP PDU reassembled in 353]"
"353","46.863000900","151.101.66.187","100.84.170.161","TLSv1.2","1349","Application Data"
"354","46.863120500","100.84.170.161","151.101.66.187","TCP","54","59747  >  443 [ACK] Seq=182915 Ack=36630 Win=4106 Len=0"
"355","46.865293800","151.101.66.187","100.84.170.161","TCP","1349","[TCP Spurious Retransmission] 443  >  59747 [PSH, ACK] Seq=35335 Ack=182915 Win=4940 Len=1295 [TCP PDU reassembled in 353]"
"356","46.865348500","100.84.170.161","151.101.66.187","TCP","66","[TCP Dup ACK 354#1] 59747  >  443 [ACK] Seq=182915 Ack=36630 Win=4106 Len=0 SLE=35335 SRE=36630"
"357","46.865631000","100.84.170.161","151.101.66.187","TLSv1.2","89","Application Data"
"358","46.875214800","151.101.66.187","100.84.170.161","TCP","56","443  >  59747 [ACK] Seq=36630 Ack=182950 Win=4940 Len=0"
"359","47.461842400","100.84.170.161","151.101.66.187","TLSv1.2","815","Application Data"
"360","47.465988100","100.84.170.161","151.101.66.187","TLSv1.2","1845","Application Data"
"361","47.466455900","100.84.170.161","151.101.66.187","TLSv1.2","841","Application Data"
"362","47.466609600","100.84.170.161","151.101.66.187","TLSv1.2","1841","Application Data"
"363","47.471725300","151.101.66.187","100.84.170.161","TCP","56","443  >  59747 [ACK] Seq=36630 Ack=183711 Win=4940 Len=0"
"364","47.474983000","151.101.66.187","100.84.170.161","TCP","56","443  >  59747 [ACK] Seq=36630 Ack=185502 Win=4940 Len=0"
"365","47.478055900","151.101.66.187","100.84.170.161","TCP","56","443  >  59747 [ACK] Seq=36630 Ack=186289 Win=4940 Len=0"
"366","47.478055900","151.101.66.187","100.84.170.161","TLSv1.2","365","Application Data"
"367","47.478347100","151.101.66.187","100.84.170.161","TLSv1.2","130","Application Data"
"368","47.478378800","100.84.170.161","151.101.66.187","TCP","54","59747  >  443 [ACK] Seq=188076 Ack=37017 Win=4104 Len=0"
"369","47.479204100","151.101.66.187","100.84.170.161","TLSv1.2","194","Application Data, Application Data"
"370","47.479261000","100.84.170.161","151.101.66.187","TCP","54","59747  >  443 [ACK] Seq=188076 Ack=37157 Win=4104 Len=0"
"371","47.517233800","100.84.170.161","151.101.66.187","TLSv1.2","789","Application Data"
"372","47.524522000","100.84.170.161","151.101.66.187","TLSv1.2","1828","Application Data"
"373","47.525740400","151.101.66.187","100.84.170.161","TCP","56","443  >  59747 [ACK] Seq=37157 Ack=188811 Win=4940 Len=0"
"374","47.527966800","151.101.66.187","100.84.170.161","TLSv1.2","168","Application Data"
"375","47.528331300","151.101.66.187","100.84.170.161","TLSv1.2","306","Application Data"
"376","47.528384200","100.84.170.161","151.101.66.187","TCP","54","59747  >  443 [ACK] Seq=190585 Ack=37523 Win=4102 Len=0"
"377","47.529204100","100.84.170.161","151.101.66.187","TLSv1.2","831","Application Data"
"378","47.529327200","100.84.170.161","151.101.66.187","TLSv1.2","1882","Application Data"
"379","47.532977900","151.101.66.187","100.84.170.161","TCP","56","443  >  59747 [ACK] Seq=37523 Ack=190585 Win=4940 Len=0"
"380","47.535994000","151.101.66.187","100.84.170.161","TLSv1.2","161","Application Data"
"381","47.536309500","151.101.66.187","100.84.170.161","TLSv1.2","482","Application Data"
"382","47.536457100","100.84.170.161","151.101.66.187","TCP","54","59747  >  443 [ACK] Seq=193190 Ack=38058 Win=4100 Len=0"
"383","47.538453000","151.101.66.187","100.84.170.161","TCP","56","443  >  59747 [ACK] Seq=38058 Ack=193190 Win=4940 Len=0"
"384","47.540547200","151.101.66.187","100.84.170.161","TLSv1.2","131","Application Data"
"385","47.540816600","151.101.66.187","100.84.170.161","TLSv1.2","124","Application Data"
"386","47.540886700","100.84.170.161","151.101.66.187","TCP","54","59747  >  443 [ACK] Seq=193190 Ack=38205 Win=4106 Len=0"
"387","49.055122400","100.84.170.161","151.101.66.187","TLSv1.2","840","Application Data"
"388","49.059061800","100.84.170.161","151.101.66.187","TLSv1.2","1866","Application Data"
"389","49.063871800","151.101.66.187","100.84.170.161","TCP","56","443  >  59747 [ACK] Seq=38205 Ack=193976 Win=4940 Len=0"
"390","49.066358000","151.101.66.187","100.84.170.161","TLSv1.2","316","Application Data"
"391","49.067705200","151.101.66.187","100.84.170.161","TCP","56","443  >  59747 [ACK] Seq=38467 Ack=195788 Win=4940 Len=0"
"392","49.070049100","151.101.66.187","100.84.170.161","TLSv1.2","136","Application Data"
"393","49.070121700","100.84.170.161","151.101.66.187","TCP","54","59747  >  443 [ACK] Seq=195788 Ack=38549 Win=4104 Len=0"
"394","50.675456200","100.84.170.161","151.101.66.187","TLSv1.2","854","Application Data"
"395","50.675786100","100.84.170.161","151.101.66.187","TLSv1.2","1907","Application Data"
"396","50.685044600","151.101.66.187","100.84.170.161","TCP","56","443  >  59747 [ACK] Seq=38549 Ack=198441 Win=4940 Len=0"
"397","50.688120000","100.84.170.161","151.101.66.187","TLSv1.2","810","Application Data"
"398","50.688256300","151.101.66.187","100.84.170.161","TLSv1.2","214","Application Data"
"399","50.688892100","151.101.66.187","100.84.170.161","TLSv1.2","104","Application Data"
"400","50.688936300","100.84.170.161","151.101.66.187","TCP","54","59747  >  443 [ACK] Seq=199197 Ack=38759 Win=4104 Len=0"
"401","50.696950600","151.101.66.187","100.84.170.161","TCP","56","443  >  59747 [ACK] Seq=38759 Ack=199197 Win=4940 Len=0"
"402","50.698867000","100.84.170.161","151.101.66.187","TLSv1.2","1870","Application Data"
"403","50.699075200","100.84.170.161","151.101.66.187","TLSv1.2","820","Application Data"
"404","50.699948600","151.101.66.187","100.84.170.161","TLSv1.2","126","Application Data"
"405","50.702646800","100.84.170.161","151.101.66.187","TLSv1.2","1866","Application Data"
"406","50.703193100","100.84.170.161","151.101.66.187","TLSv1.2","823","Application Data"
"407","50.707434900","151.101.66.187","100.84.170.161","TCP","56","443  >  59747 [ACK] Seq=38831 Ack=201013 Win=4940 Len=0"
"408","50.707954400","100.84.170.161","151.101.66.187","TLSv1.2","1901","Application Data"
"409","50.708238100","100.84.170.161","151.101.66.187","TLSv1.2","777","Application Data"
"410","50.709906800","151.101.66.187","100.84.170.161","TCP","56","443  >  59747 [ACK] Seq=38831 Ack=201779 Win=4940 Len=0"
"411","50.710156000","151.101.66.187","100.84.170.161","TLSv1.2","227","Application Data"
"412","50.711460500","151.101.66.187","100.84.170.161","TLSv1.2","98","Application Data"
"413","50.711519100","100.84.170.161","151.101.66.187","TCP","54","59747  >  443 [ACK] Seq=206930 Ack=39048 Win=4102 Len=0"
"414","50.711810700","151.101.66.187","100.84.170.161","TCP","56","443  >  59747 [ACK] Seq=39048 Ack=203591 Win=4940 Len=0"
"415","50.712481600","151.101.66.187","100.84.170.161","TCP","56","443  >  59747 [ACK] Seq=39048 Ack=204360 Win=4940 Len=0"
"416","50.713676800","151.101.66.187","100.84.170.161","TLSv1.2","98","Application Data"
"417","50.715103400","151.101.66.187","100.84.170.161","TLSv1.2","104","Application Data"
"418","50.715152500","100.84.170.161","151.101.66.187","TCP","54","59747  >  443 [ACK] Seq=206930 Ack=39142 Win=4102 Len=0"
"419","50.717134100","151.101.66.187","100.84.170.161","TCP","56","443  >  59747 [ACK] Seq=39142 Ack=206930 Win=4940 Len=0"
"420","50.719675400","151.101.66.187","100.84.170.161","TLSv1.2","120","Application Data"
"421","50.750891200","151.101.66.187","100.84.170.161","TCP","120","[TCP Retransmission] 443  >  59747 [PSH, ACK] Seq=39142 Ack=206930 Win=4940 Len=66"
"422","50.750938900","100.84.170.161","151.101.66.187","TCP","66","59747  >  443 [ACK] Seq=206930 Ack=39208 Win=4102 Len=0 SLE=39142 SRE=39208"
"423","50.810721200","100.84.170.161","151.101.66.187","TLSv1.2","1916","Application Data"
"424","50.820507300","151.101.66.187","100.84.170.161","TCP","56","443  >  59747 [ACK] Seq=39208 Ack=208792 Win=4940 Len=0"
"425","50.822348800","151.101.66.187","100.84.170.161","TLSv1.2","104","Application Data"
"426","50.847486500","151.101.66.187","100.84.170.161","TCP","104","[TCP Retransmission] 443  >  59747 [PSH, ACK] Seq=39208 Ack=208792 Win=4940 Len=50"
"427","50.847529200","100.84.170.161","151.101.66.187","TCP","66","59747  >  443 [ACK] Seq=208792 Ack=39258 Win=4102 Len=0 SLE=39208 SRE=39258"
"428","52.078264200","100.84.170.161","151.101.66.187","TLSv1.2","916","Application Data"
"429","52.081296400","100.84.170.161","151.101.66.187","TLSv1.2","1762","Application Data"
"430","52.088858500","151.101.66.187","100.84.170.161","TCP","56","443  >  59747 [ACK] Seq=39258 Ack=209654 Win=4940 Len=0"
"431","52.090186500","151.101.66.187","100.84.170.161","TCP","56","443  >  59747 [ACK] Seq=39258 Ack=211362 Win=4940 Len=0"
"432","52.091538200","151.101.66.187","100.84.170.161","TLSv1.2","448","Application Data"
"433","52.091928900","151.101.66.187","100.84.170.161","TLSv1.2","131","Application Data"
"434","52.091972300","100.84.170.161","151.101.66.187","TCP","54","59747  >  443 [ACK] Seq=211362 Ack=39729 Win=4106 Len=0"
"435","52.094849400","100.84.170.161","151.101.66.187","TLSv1.2","89","Application Data"
"436","52.103651500","151.101.66.187","100.84.170.161","TCP","56","443  >  59747 [ACK] Seq=39729 Ack=211397 Win=4940 Len=0"
"437","52.298423500","100.84.170.161","151.101.66.187","TLSv1.2","915","Application Data"
"438","52.299272900","100.84.170.161","151.101.66.187","TLSv1.2","1767","Application Data"
"439","52.307783200","151.101.66.187","100.84.170.161","TCP","56","443  >  59747 [ACK] Seq=39729 Ack=212258 Win=4940 Len=0"
"440","52.308453400","151.101.66.187","100.84.170.161","TCP","56","443  >  59747 [ACK] Seq=39729 Ack=213971 Win=4940 Len=0"
"441","52.310059100","151.101.66.187","100.84.170.161","TLSv1.2","437","Application Data"
"442","52.311285400","151.101.66.187","100.84.170.161","TLSv1.2","206","Application Data"
"443","52.311350100","100.84.170.161","151.101.66.187","TCP","54","59747  >  443 [ACK] Seq=213971 Ack=40264 Win=4104 Len=0"
"444","53.649310500","100.84.170.161","151.101.66.187","TLSv1.2","982","Application Data"
"445","53.652634200","100.84.170.161","151.101.66.187","TLSv1.2","1744","Application Data"
"446","53.652883900","100.84.170.161","151.101.66.187","TLSv1.2","970","Application Data"
"447","53.653060300","100.84.170.161","151.101.66.187","TLSv1.2","1750","Application Data"
"448","53.654747100","100.84.170.161","151.101.66.187","TLSv1.2","986","Application Data"
"449","53.655020400","100.84.170.161","151.101.66.187","TLSv1.2","1744","Application Data"
"450","53.655253300","100.84.170.161","151.101.66.187","TLSv1.2","966","Application Data"
"451","53.655539100","100.84.170.161","151.101.66.187","TLSv1.2","1744","Application Data"
"452","53.656039500","100.84.170.161","151.101.66.187","TLSv1.2","992","Application Data"
"453","53.656260600","100.84.170.161","151.101.66.187","TLSv1.2","1718","Application Data"
"454","53.658531500","151.101.66.187","100.84.170.161","TCP","56","443  >  59747 [ACK] Seq=40264 Ack=214899 Win=4940 Len=0"
"455","53.659616800","100.84.170.161","151.101.66.187","TLSv1.2","985","Application Data"
"456","53.660886100","151.101.66.187","100.84.170.161","TLSv1.2","240","Application Data"
"457","53.661714400","151.101.66.187","100.84.170.161","TCP","56","443  >  59747 [ACK] Seq=40450 Ack=216589 Win=4940 Len=0"
"458","53.661973100","151.101.66.187","100.84.170.161","TCP","56","443  >  59747 [ACK] Seq=40450 Ack=219201 Win=4940 Len=0"
"459","53.663479000","151.101.66.187","100.84.170.161","TCP","56","443  >  59747 [ACK] Seq=40450 Ack=220133 Win=4940 Len=0"
"460","53.663754400","151.101.66.187","100.84.170.161","TCP","56","443  >  59747 [ACK] Seq=40450 Ack=221823 Win=4940 Len=0"
"461","53.664022400","151.101.66.187","100.84.170.161","TCP","56","443  >  59747 [ACK] Seq=40450 Ack=222735 Win=4940 Len=0"
"462","53.664786300","151.101.66.187","100.84.170.161","TCP","56","443  >  59747 [ACK] Seq=40450 Ack=224425 Win=4940 Len=0"
"463","53.665154000","151.101.66.187","100.84.170.161","TLSv1.2","130","Application Data"
"464","53.665202100","100.84.170.161","151.101.66.187","TCP","54","59747  >  443 [ACK] Seq=227958 Ack=40526 Win=4103 Len=0"
"465","53.666344300","151.101.66.187","100.84.170.161","TCP","56","443  >  59747 [ACK] Seq=40526 Ack=227027 Win=4940 Len=0"
"466","53.666344300","151.101.66.187","100.84.170.161","TLSv1.2","180","Application Data"
"467","53.667064200","151.101.66.187","100.84.170.161","TLSv1.2","253","Application Data"
"468","53.667116100","100.84.170.161","151.101.66.187","TCP","54","59747  >  443 [ACK] Seq=227958 Ack=40851 Win=4101 Len=0"
"469","53.667873800","151.101.66.187","100.84.170.161","TLSv1.2","130","Application Data"
"470","53.669367700","151.101.66.187","100.84.170.161","TLSv1.2","124","Application Data"
"471","53.669437300","100.84.170.161","151.101.66.187","TCP","54","59747  >  443 [ACK] Seq=227958 Ack=40997 Win=4101 Len=0"
"472","53.669648900","151.101.66.187","100.84.170.161","TLSv1.2","124","Application Data"
"473","53.670292600","151.101.66.187","100.84.170.161","TLSv1.2","125","Application Data"
"474","53.670292600","151.101.66.187","100.84.170.161","TLSv1.2","124","Application Data"
"475","53.670352200","100.84.170.161","151.101.66.187","TCP","54","59747  >  443 [ACK] Seq=227958 Ack=41208 Win=4106 Len=0"
"476","53.671754900","151.101.66.187","100.84.170.161","TLSv1.2","125","Application Data"
"477","53.671805000","100.84.170.161","151.101.66.187","TCP","54","59747  >  443 [ACK] Seq=227958 Ack=41279 Win=4105 Len=0"
"478","56.597950200","100.84.170.161","151.101.66.187","TLSv1.2","1683","Application Data"
"479","56.608978700","151.101.66.187","100.84.170.161","TCP","56","443  >  59747 [ACK] Seq=41279 Ack=229587 Win=4940 Len=0"
"480","56.663296700","151.101.66.187","100.84.170.161","TLSv1.2","339","Application Data"
"481","56.663523400","151.101.66.187","100.84.170.161","TLSv1.2","357","Application Data"
"482","56.663561500","100.84.170.161","151.101.66.187","TCP","54","59747  >  443 [ACK] Seq=229587 Ack=41867 Win=4103 Len=0"
"483","60.157384100","100.84.170.161","151.101.66.187","TLSv1.2","1025","Application Data"
"484","60.166263300","151.101.66.187","100.84.170.161","TCP","56","443  >  59747 [ACK] Seq=41867 Ack=230558 Win=4940 Len=0"
"485","60.170036100","151.101.66.187","100.84.170.161","TLSv1.2","322","Application Data"
"486","60.195224700","151.101.66.187","100.84.170.161","TCP","322","[TCP Retransmission] 443  >  59747 [PSH, ACK] Seq=41867 Ack=230558 Win=4940 Len=268"
"487","60.195272300","100.84.170.161","151.101.66.187","TCP","66","59747  >  443 [ACK] Seq=230558 Ack=42135 Win=4102 Len=0 SLE=41867 SRE=42135"
