No.,Time,Source,Destination,Protocol,Length,Info
1,0.0,100.84.170.161,151.101.2.187,TLSv1.2,2632,Application Data
2,0.0001767,100.84.170.161,151.101.2.187,TLSv1.2,93,Application Data
3,0.010162,151.101.2.187,100.84.170.161,TCP,56,443  >  64433 [ACK] Seq=1 Ack=2618 Win=3992 Len=0
4,0.0103691,151.101.2.187,100.84.170.161,TLSv1.2,93,Application Data
5,0.0390852,151.101.2.187,100.84.170.161,TCP,93,"[TCP Retransmission] 443  >  64433 [PSH, ACK] Seq=1 Ack=2618 Win=3992 Len=39"
6,0.0391396,100.84.170.161,151.101.2.187,TCP,66,64433  >  443 [ACK] Seq=2618 Ack=40 Win=8207 Len=0 SLE=1 SRE=40
7,0.2631832,151.101.2.187,100.84.170.161,TCP,1510,443  >  64433 [ACK] Seq=40 Ack=2618 Win=3992 Len=1456 [TCP PDU reassembled in 8]
8,0.2631832,151.101.2.187,100.84.170.161,TLSv1.2,198,Application Data
9,0.2631832,151.101.2.187,100.84.170.161,TCP,198,"[TCP Retransmission] 443  >  64433 [PSH, ACK] Seq=1496 Ack=2618 Win=3992 Len=144 [TCP PDU reassembled in 8]"
10,0.2631832,151.101.2.187,100.84.170.161,TLSv1.2,116,Application Data
11,0.2631832,151.101.2.187,100.84.170.161,TLSv1.2,725,Application Data
12,0.2631832,151.101.2.187,100.84.170.161,TCP,1510,443  >  64433 [ACK] Seq=2373 Ack=2618 Win=3992 Len=1456 [TCP PDU reassembled in 13]
13,0.2631832,151.101.2.187,100.84.170.161,TLSv1.2,512,Application Data
14,0.2631832,151.101.2.187,100.84.170.161,TCP,1510,443  >  64433 [ACK] Seq=4287 Ack=2618 Win=3992 Len=1456 [TCP PDU reassembled in 15]
15,0.2631832,151.101.2.187,100.84.170.161,TLSv1.2,412,Application Data
16,0.2631832,151.101.2.187,100.84.170.161,TCP,1510,443  >  64433 [ACK] Seq=6101 Ack=2618 Win=3992 Len=1456 [TCP PDU reassembled in 17]
17,0.2631832,151.101.2.187,100.84.170.161,TLSv1.2,146,Application Data
18,0.2631832,151.101.2.187,100.84.170.161,TLSv1.2,355,Application Data
19,0.2631832,151.101.2.187,100.84.170.161,TLSv1.2,497,Application Data
20,0.2633871,100.84.170.161,151.101.2.187,TCP,66,64433  >  443 [ACK] Seq=2618 Ack=1640 Win=8212 Len=0 SLE=1496 SRE=1640
21,0.2635434,100.84.170.161,151.101.2.187,TCP,54,64433  >  443 [ACK] Seq=2618 Ack=8393 Win=8212 Len=0
22,0.2637552,151.101.2.187,100.84.170.161,TLSv1.2,85,Application Data
23,0.2664812,100.84.170.161,151.101.2.187,TLSv1.2,89,Application Data
24,0.275653,151.101.2.187,100.84.170.161,TCP,56,443  >  64433 [ACK] Seq=8424 Ack=2653 Win=3992 Len=0
25,0.4102042,100.84.170.161,151.101.2.187,TLSv1.2,2454,Application Data
26,0.4201593,151.101.2.187,100.84.170.161,TCP,56,443  >  64433 [ACK] Seq=8424 Ack=5053 Win=4003 Len=0
27,0.4254345,151.101.2.187,100.84.170.161,TLSv1.2,181,Application Data
28,0.4503963,100.84.170.161,151.101.2.187,TLSv1.2,2453,Application Data
29,0.4511349,100.84.170.161,151.101.2.187,TLSv1.2,2451,Application Data
30,0.4516674,100.84.170.161,151.101.2.187,TLSv1.2,2448,Application Data
31,0.4609736,151.101.2.187,100.84.170.161,TCP,56,443  >  64433 [ACK] Seq=8551 Ack=7452 Win=4015 Len=0
32,0.4612368,151.101.2.187,100.84.170.161,TCP,56,443  >  64433 [ACK] Seq=8551 Ack=9849 Win=4026 Len=0
33,0.4614142,100.84.170.161,151.101.2.187,TLSv1.2,2448,Application Data
34,0.4615387,151.101.2.187,100.84.170.161,TCP,56,443  >  64433 [ACK] Seq=8551 Ack=12243 Win=4038 Len=0
35,0.4629065,151.101.2.187,100.84.170.161,TLSv1.2,130,Application Data
36,0.4632989,151.101.2.187,100.84.170.161,TLSv1.2,131,Application Data
37,0.4633451,100.84.170.161,151.101.2.187,TCP,54,64433  >  443 [ACK] Seq=14637 Ack=8704 Win=8211 Len=0
38,0.4636631,151.101.2.187,100.84.170.161,TLSv1.2,130,Application Data
39,0.471015,151.101.2.187,100.84.170.161,TCP,56,443  >  64433 [ACK] Seq=8780 Ack=14637 Win=4049 Len=0
40,0.4741197,151.101.2.187,100.84.170.161,TLSv1.2,125,Application Data
41,0.4742104,100.84.170.161,151.101.2.187,TCP,54,64433  >  443 [ACK] Seq=14637 Ack=8851 Win=8210 Len=0
42,5.9337398,100.84.170.161,151.101.2.187,TLSv1.2,2429,Application Data
43,5.9431464,151.101.2.187,100.84.170.161,TCP,56,443  >  64433 [ACK] Seq=8851 Ack=17012 Win=4061 Len=0
44,5.9458807,151.101.2.187,100.84.170.161,TLSv1.2,241,Application Data
45,5.9877199,151.101.2.187,100.84.170.161,TCP,241,"[TCP Retransmission] 443  >  64433 [PSH, ACK] Seq=8851 Ack=17012 Win=4061 Len=187"
46,5.9877651,100.84.170.161,151.101.2.187,TCP,66,64433  >  443 [ACK] Seq=17012 Ack=9038 Win=8209 Len=0 SLE=8851 SRE=9038
47,10.9417665,100.84.170.161,151.101.2.187,TLSv1.2,2434,Application Data
48,10.9515742,151.101.2.187,100.84.170.161,TCP,56,443  >  64433 [ACK] Seq=9038 Ack=19392 Win=4072 Len=0
49,10.9540447,151.101.2.187,100.84.170.161,TLSv1.2,219,Application Data
50,10.9953622,100.84.170.161,151.101.2.187,TCP,54,64433  >  443 [ACK] Seq=19392 Ack=9203 Win=8209 Len=0
51,10.996282,151.101.2.187,100.84.170.161,TCP,219,"[TCP Spurious Retransmission] 443  >  64433 [PSH, ACK] Seq=9038 Ack=19392 Win=4072 Len=165"
52,10.9963458,100.84.170.161,151.101.2.187,TCP,66,[TCP Dup ACK 50#1] 64433  >  443 [ACK] Seq=19392 Ack=9203 Win=8209 Len=0 SLE=9038 SRE=9203
53,17.0613198,100.84.170.161,151.101.2.187,TLSv1.2,2375,Application Data
54,17.061722,100.84.170.161,151.101.2.187,TLSv1.2,2434,Application Data
55,17.0706985,151.101.2.187,100.84.170.161,TCP,56,443  >  64433 [ACK] Seq=9203 Ack=24093 Win=4095 Len=0
56,17.0735313,151.101.2.187,100.84.170.161,TLSv1.2,439,Application Data
57,17.0738545,151.101.2.187,100.84.170.161,TLSv1.2,258,Application Data
58,17.0738953,100.84.170.161,151.101.2.187,TCP,54,64433  >  443 [ACK] Seq=24093 Ack=9792 Win=8207 Len=0
59,17.0741605,151.101.2.187,100.84.170.161,TLSv1.2,104,Application Data
60,17.0786755,100.84.170.161,151.101.2.187,TLSv1.2,89,Application Data
61,17.0876793,151.101.2.187,100.84.170.161,TCP,56,443  >  64433 [ACK] Seq=9842 Ack=24128 Win=4095 Len=0
62,17.08826,100.84.170.161,151.101.2.187,TLSv1.2,2428,Application Data
63,17.0884136,100.84.170.161,151.101.2.187,TLSv1.2,2425,Application Data
64,17.0975035,151.101.2.187,100.84.170.161,TCP,56,443  >  64433 [ACK] Seq=9842 Ack=26502 Win=4106 Len=0
65,17.0979773,151.101.2.187,100.84.170.161,TCP,56,443  >  64433 [ACK] Seq=9842 Ack=28873 Win=4118 Len=0
66,17.101731,151.101.2.187,100.84.170.161,TLSv1.2,124,Application Data
67,17.1020796,151.101.2.187,100.84.170.161,TLSv1.2,130,Application Data
68,17.1021226,100.84.170.161,151.101.2.187,TCP,54,64433  >  443 [ACK] Seq=28873 Ack=9988 Win=8212 Len=0
69,17.1651163,100.84.170.161,151.101.2.187,TLSv1.2,2631,Application Data
70,17.1660036,100.84.170.161,151.101.2.187,TLSv1.2,2622,Application Data
71,17.1662892,100.84.170.161,151.101.2.187,TLSv1.2,2621,Application Data
72,17.1663856,100.84.170.161,151.101.2.187,TLSv1.2,2620,Application Data
73,17.167816,100.84.170.161,151.101.2.187,TLSv1.2,2620,Application Data
74,17.1746261,151.101.2.187,100.84.170.161,TCP,56,443  >  64433 [ACK] Seq=9988 Ack=31450 Win=4129 Len=0
75,17.1752251,151.101.2.187,100.84.170.161,TCP,56,443  >  64433 [ACK] Seq=9988 Ack=34018 Win=4140 Len=0
76,17.1758415,151.101.2.187,100.84.170.161,TCP,56,443  >  64433 [ACK] Seq=9988 Ack=39151 Win=4163 Len=0
77,17.1771917,151.101.2.187,100.84.170.161,TCP,56,443  >  64433 [ACK] Seq=9988 Ack=41717 Win=4175 Len=0
78,17.7777987,151.101.2.187,100.84.170.161,TCP,14614,443  >  64433 [ACK] Seq=9988 Ack=41717 Win=4175 Len=14560 [TCP PDU reassembled in 79]
79,17.7777987,151.101.2.187,100.84.170.161,TLSv1.2,1350,Application Data
80,17.7777987,151.101.2.187,100.84.170.161,TLSv1.2,32086,Application Data
81,17.7777987,151.101.2.187,100.84.170.161,TLSv1.2,656,Application Data
82,17.7777987,151.101.2.187,100.84.170.161,TLSv1.2,29174,Application Data
83,17.7777987,151.101.2.187,100.84.170.161,TLSv1.2,91,Application Data
84,17.7777987,151.101.2.187,100.84.170.161,TLSv1.2,46646,"Application Data, Application Data"
85,17.7777987,151.101.2.187,100.84.170.161,TLSv1.2,923,Application Data
86,17.7777987,151.101.2.187,100.84.170.161,TCP,923,"[TCP Retransmission] 443  >  64433 [PSH, ACK] Seq=134227 Ack=41717 Win=4175 Len=869 [TCP PDU reassembled in 85]"
87,17.7780578,100.84.170.161,151.101.2.187,TCP,66,64433  >  443 [ACK] Seq=41717 Ack=135096 Win=8212 Len=0 SLE=134227 SRE=135096
88,17.8244686,151.101.2.187,100.84.170.161,TLSv1.2,114,Application Data
89,17.8250338,151.101.2.187,100.84.170.161,TCP,1510,443  >  64433 [ACK] Seq=135156 Ack=41717 Win=4175 Len=1456 [TCP PDU reassembled in 91]
90,17.8250831,100.84.170.161,151.101.2.187,TCP,54,64433  >  443 [ACK] Seq=41717 Ack=136612 Win=8212 Len=0
91,17.8279527,151.101.2.187,100.84.170.161,TLSv1.2,53926,"Application Data, Application Data, Application Data"
92,17.8279527,151.101.2.187,100.84.170.161,TLSv1.2,365,Application Data
93,17.8279527,151.101.2.187,100.84.170.161,TLSv1.2,8790,Application Data
94,17.8279527,151.101.2.187,100.84.170.161,TLSv1.2,970,"Application Data, Application Data"
95,17.8280665,100.84.170.161,151.101.2.187,TCP,54,64433  >  443 [ACK] Seq=41717 Ack=200447 Win=8212 Len=0
96,17.830284,151.101.2.187,100.84.170.161,TLSv1.2,114,Application Data
97,17.830284,151.101.2.187,100.84.170.161,TLSv1.2,61206,"Application Data, Application Data, Application Data"
98,17.830284,151.101.2.187,100.84.170.161,TLSv1.2,1062,Application Data
99,17.830284,151.101.2.187,100.84.170.161,TCP,1510,443  >  64433 [ACK] Seq=262667 Ack=41717 Win=4175 Len=1456 [TCP PDU reassembled in 100]
100,17.830284,151.101.2.187,100.84.170.161,TLSv1.2,107,Application Data
101,17.8304093,100.84.170.161,151.101.2.187,TCP,54,64433  >  443 [ACK] Seq=41717 Ack=264176 Win=8212 Len=0
102,17.8306353,151.101.2.187,100.84.170.161,TLSv1.2,85,Application Data
103,17.8306747,100.84.170.161,151.101.2.187,TCP,54,64433  >  443 [ACK] Seq=41717 Ack=264207 Win=8212 Len=0
104,17.8385333,100.84.170.161,151.101.2.187,TLSv1.2,2625,Application Data
105,17.8388234,100.84.170.161,151.101.2.187,TLSv1.2,2637,Application Data
106,17.8479476,151.101.2.187,100.84.170.161,TCP,56,443  >  64433 [ACK] Seq=264207 Ack=44288 Win=4186 Len=0
107,17.8483026,151.101.2.187,100.84.170.161,TCP,56,443  >  64433 [ACK] Seq=264207 Ack=46871 Win=4197 Len=0
108,17.8701364,100.84.170.161,151.101.2.187,TLSv1.2,2626,Application Data
109,17.8736389,100.84.170.161,151.101.2.187,TLSv1.2,2630,Application Data
110,17.8799976,151.101.2.187,100.84.170.161,TCP,56,443  >  64433 [ACK] Seq=264207 Ack=49443 Win=4209 Len=0
111,17.8848534,151.101.2.187,100.84.170.161,TCP,56,443  >  64433 [ACK] Seq=264207 Ack=52019 Win=4220 Len=0
112,17.9230548,151.101.2.187,100.84.170.161,TLSv1.2,115,Application Data
113,17.9237455,151.101.2.187,100.84.170.161,TCP,1510,443  >  64433 [ACK] Seq=264268 Ack=52019 Win=4220 Len=1456 [TCP PDU reassembled in 115]
114,17.9237927,100.84.170.161,151.101.2.187,TCP,54,64433  >  443 [ACK] Seq=52019 Ack=265724 Win=8212 Len=0
115,17.9270627,151.101.2.187,100.84.170.161,TLSv1.2,33542,"Application Data, Application Data"
116,17.9270627,151.101.2.187,100.84.170.161,TLSv1.2,756,Application Data
117,17.9270627,151.101.2.187,100.84.170.161,TCP,2966,443  >  64433 [ACK] Seq=299914 Ack=52019 Win=4220 Len=2912 [TCP PDU reassembled in 118]
118,17.9270627,151.101.2.187,100.84.170.161,TLSv1.2,1252,Application Data
119,17.9270627,151.101.2.187,100.84.170.161,TCP,8790,443  >  64433 [ACK] Seq=304024 Ack=52019 Win=4220 Len=8736 [TCP PDU reassembled in 120]
120,17.9270627,151.101.2.187,100.84.170.161,TLSv1.2,869,Application Data
121,17.9270627,151.101.2.187,100.84.170.161,TCP,7334,443  >  64433 [ACK] Seq=313575 Ack=52019 Win=4220 Len=7280 [TCP PDU reassembled in 122]
122,17.9270627,151.101.2.187,100.84.170.161,TLSv1.2,892,Application Data
123,17.9270627,151.101.2.187,100.84.170.161,TCP,7334,443  >  64433 [ACK] Seq=321693 Ack=52019 Win=4220 Len=7280 [TCP PDU reassembled in 124]
124,17.9270627,151.101.2.187,100.84.170.161,TLSv1.2,120,Application Data
125,17.9272492,100.84.170.161,151.101.2.187,TCP,54,64433  >  443 [ACK] Seq=52019 Ack=329039 Win=8212 Len=0
126,17.9366838,100.84.170.161,151.101.2.187,TLSv1.2,2613,Application Data
127,17.9493006,151.101.2.187,100.84.170.161,TLSv1.2,158,Application Data
128,17.9563818,100.84.170.161,151.101.2.187,TLSv1.2,2626,Application Data
129,17.9663545,151.101.2.187,100.84.170.161,TCP,56,443  >  64433 [ACK] Seq=329143 Ack=57150 Win=4243 Len=0
130,18.4979026,151.101.2.187,100.84.170.161,TLSv1.2,218,Application Data
131,18.4979026,151.101.2.187,100.84.170.161,TLSv1.2,43734,"Application Data, Application Data"
132,18.4979026,151.101.2.187,100.84.170.161,TLSv1.2,466,Application Data
133,18.4979026,151.101.2.187,100.84.170.161,TLSv1.2,114,Application Data
134,18.4979026,151.101.2.187,100.84.170.161,TLSv1.2,34998,"Application Data, Application Data"
135,18.4979026,151.101.2.187,100.84.170.161,TLSv1.2,628,Application Data
136,18.4979026,151.101.2.187,100.84.170.161,TLSv1.2,115,Application Data
137,18.4979026,151.101.2.187,100.84.170.161,TLSv1.2,39366,"Application Data, Application Data"
138,18.4979026,151.101.2.187,100.84.170.161,TLSv1.2,721,Application Data
139,18.4979026,151.101.2.187,100.84.170.161,TCP,7334,443  >  64433 [ACK] Seq=449017 Ack=57150 Win=4243 Len=7280 [TCP PDU reassembled in 140]
140,18.4979026,151.101.2.187,100.84.170.161,TLSv1.2,1030,Application Data
141,18.4979026,151.101.2.187,100.84.170.161,TCP,16070,443  >  64433 [ACK] Seq=457273 Ack=57150 Win=4243 Len=16016 [TCP PDU reassembled in 142]
142,18.4979026,151.101.2.187,100.84.170.161,TLSv1.2,475,"Application Data, Application Data"
143,18.4979026,151.101.2.187,100.84.170.161,TCP,16070,443  >  64433 [ACK] Seq=473710 Ack=57150 Win=4243 Len=16016 [TCP PDU reassembled in 144]
144,18.4979026,151.101.2.187,100.84.170.161,TLSv1.2,475,"Application Data, Application Data"
145,18.4979026,151.101.2.187,100.84.170.161,TCP,16070,443  >  64433 [ACK] Seq=490147 Ack=57150 Win=4243 Len=16016 [TCP PDU reassembled in 147]
146,18.4983796,100.84.170.161,151.101.2.187,TCP,54,64433  >  443 [ACK] Seq=57150 Ack=506163 Win=8212 Len=0
147,18.4995035,151.101.2.187,100.84.170.161,TLSv1.2,329,Application Data
148,18.4995035,151.101.2.187,100.84.170.161,TCP,11702,443  >  64433 [ACK] Seq=506438 Ack=57150 Win=4243 Len=11648 [TCP PDU reassembled in 149]
149,18.4995035,151.101.2.187,100.84.170.161,TLSv1.2,439,Application Data
150,18.4995035,151.101.2.187,100.84.170.161,TLSv1.2,188,Application Data
151,18.4995035,151.101.2.187,100.84.170.161,TLSv1.2,21894,Application Data
152,18.4995035,151.101.2.187,100.84.170.161,TLSv1.2,895,Application Data
153,18.4995035,151.101.2.187,100.84.170.161,TCP,2966,443  >  64433 [ACK] Seq=541286 Ack=57150 Win=4243 Len=2912 [TCP PDU reassembled in 154]
154,18.4995035,151.101.2.187,100.84.170.161,TLSv1.2,68,Application Data
155,18.4995035,151.101.2.187,100.84.170.161,TCP,16070,443  >  64433 [ACK] Seq=544212 Ack=57150 Win=4243 Len=16016 [TCP PDU reassembled in 156]
156,18.4995035,151.101.2.187,100.84.170.161,TLSv1.2,334,Application Data
157,18.4995035,151.101.2.187,100.84.170.161,TCP,334,"[TCP Retransmission] 443  >  64433 [PSH, ACK] Seq=560228 Ack=57150 Win=4243 Len=280 [TCP PDU reassembled in 156]"
158,18.4997513,100.84.170.161,151.101.2.187,TCP,66,64433  >  443 [ACK] Seq=57150 Ack=560508 Win=8000 Len=0 SLE=560228 SRE=560508
159,18.5016897,100.84.170.161,151.101.2.187,TCP,54,[TCP Window Update] 64433  >  443 [ACK] Seq=57150 Ack=560508 Win=8212 Len=0
160,18.5436011,100.84.170.161,151.101.2.187,TLSv1.2,2622,Application Data
161,18.5507005,100.84.170.161,151.101.2.187,TLSv1.2,2635,Application Data
162,18.5532622,100.84.170.161,151.101.2.187,TLSv1.2,2624,Application Data
163,18.5534872,151.101.2.187,100.84.170.161,TCP,56,443  >  64433 [ACK] Seq=560508 Ack=59718 Win=4254 Len=0
164,18.5603243,151.101.2.187,100.84.170.161,TCP,56,443  >  64433 [ACK] Seq=560508 Ack=62299 Win=4266 Len=0
165,18.5627612,151.101.2.187,100.84.170.161,TCP,56,443  >  64433 [ACK] Seq=560508 Ack=64869 Win=4277 Len=0
166,18.7513491,100.84.170.161,151.101.2.187,TLSv1.2,2623,Application Data
167,18.7621586,151.101.2.187,100.84.170.161,TCP,56,443  >  64433 [ACK] Seq=560508 Ack=67438 Win=4289 Len=0
168,19.107271,151.101.2.187,100.84.170.161,TLSv1.2,394,Application Data
169,19.107271,151.101.2.187,100.84.170.161,TLSv1.2,23350,Application Data
170,19.107271,151.101.2.187,100.84.170.161,TLSv1.2,1368,Application Data
171,19.107271,151.101.2.187,100.84.170.161,TCP,16070,443  >  64433 [ACK] Seq=585458 Ack=67438 Win=4289 Len=16016 [TCP PDU reassembled in 172]
172,19.107271,151.101.2.187,100.84.170.161,TLSv1.2,475,"Application Data, Application Data"
173,19.107271,151.101.2.187,100.84.170.161,TLSv1.2,29174,Application Data
174,19.107271,151.101.2.187,100.84.170.161,TLSv1.2,317,Application Data
175,19.1075611,100.84.170.161,151.101.2.187,TCP,54,64433  >  443 [ACK] Seq=67438 Ack=631278 Win=8212 Len=0
176,19.1858054,151.101.2.187,100.84.170.161,TCP,1510,443  >  64433 [ACK] Seq=631278 Ack=67438 Win=4289 Len=1456 [TCP PDU reassembled in 180]
177,19.185911,151.101.2.187,100.84.170.161,TCP,1510,443  >  64433 [ACK] Seq=632734 Ack=67438 Win=4289 Len=1456 [TCP PDU reassembled in 180]
178,19.1859382,100.84.170.161,151.101.2.187,TCP,54,64433  >  443 [ACK] Seq=67438 Ack=634190 Win=8212 Len=0
179,19.1886752,151.101.2.187,100.84.170.161,TCP,11702,443  >  64433 [ACK] Seq=634190 Ack=67438 Win=4289 Len=11648 [TCP PDU reassembled in 180]
180,19.1886752,151.101.2.187,100.84.170.161,TLSv1.2,1046,Application Data
181,19.1886752,151.101.2.187,100.84.170.161,TLSv1.2,20438,Application Data
182,19.1886752,151.101.2.187,100.84.170.161,TLSv1.2,1116,Application Data
183,19.1886752,151.101.2.187,100.84.170.161,TCP,16070,443  >  64433 [ACK] Seq=668276 Ack=67438 Win=4289 Len=16016 [TCP PDU reassembled in 184]
184,19.1886752,151.101.2.187,100.84.170.161,TLSv1.2,475,"Application Data, Application Data"
185,19.1886752,151.101.2.187,100.84.170.161,TLSv1.2,21894,"Application Data, Application Data"
186,19.1886752,151.101.2.187,100.84.170.161,TLSv1.2,1112,Application Data
187,19.1886752,151.101.2.187,100.84.170.161,TLSv1.2,85,Application Data
188,19.1889041,100.84.170.161,151.101.2.187,TCP,54,64433  >  443 [ACK] Seq=67438 Ack=707642 Win=8212 Len=0
189,19.1934353,151.101.2.187,100.84.170.161,TLSv1.2,151,Application Data
190,19.1935227,100.84.170.161,151.101.2.187,TCP,54,64433  >  443 [ACK] Seq=67438 Ack=707739 Win=8212 Len=0
191,19.1944362,151.101.2.187,100.84.170.161,TCP,1510,443  >  64433 [ACK] Seq=707739 Ack=67438 Win=4289 Len=1456 [TCP PDU reassembled in 192]
192,19.195755,151.101.2.187,100.84.170.161,TLSv1.2,24806,Application Data
193,19.195755,151.101.2.187,100.84.170.161,TLSv1.2,569,Application Data
194,19.1958633,100.84.170.161,151.101.2.187,TCP,54,64433  >  443 [ACK] Seq=67438 Ack=734462 Win=8212 Len=0
195,19.1969365,151.101.2.187,100.84.170.161,TCP,16070,443  >  64433 [ACK] Seq=734462 Ack=67438 Win=4289 Len=16016 [TCP PDU reassembled in 196]
196,19.1969365,151.101.2.187,100.84.170.161,TLSv1.2,475,"Application Data, Application Data"
197,19.1969365,151.101.2.187,100.84.170.161,TCP,11702,443  >  64433 [ACK] Seq=750899 Ack=67438 Win=4289 Len=11648 [TCP PDU reassembled in 198]
198,19.1969365,151.101.2.187,100.84.170.161,TLSv1.2,1353,Application Data
199,19.1970543,100.84.170.161,151.101.2.187,TCP,54,64433  >  443 [ACK] Seq=67438 Ack=763846 Win=8212 Len=0
200,19.1999511,151.101.2.187,100.84.170.161,TCP,1510,443  >  64433 [ACK] Seq=763846 Ack=67438 Win=4289 Len=1456 [TCP PDU reassembled in 203]
201,19.2002748,151.101.2.187,100.84.170.161,TCP,1510,443  >  64433 [ACK] Seq=765302 Ack=67438 Win=4289 Len=1456 [TCP PDU reassembled in 203]
202,19.2003345,100.84.170.161,151.101.2.187,TCP,54,64433  >  443 [ACK] Seq=67438 Ack=766758 Win=8212 Len=0
203,19.200567,151.101.2.187,100.84.170.161,TLSv1.2,650,Application Data
204,19.217048,151.101.2.187,100.84.170.161,TLSv1.2,184,Application Data
205,19.2171427,100.84.170.161,151.101.2.187,TCP,54,64433  >  443 [ACK] Seq=67438 Ack=767484 Win=8209 Len=0
206,19.2173687,151.101.2.187,100.84.170.161,TCP,1510,443  >  64433 [ACK] Seq=767484 Ack=67438 Win=4289 Len=1456 [TCP PDU reassembled in 207]
207,19.2190157,151.101.2.187,100.84.170.161,TLSv1.2,29174,Application Data
208,19.2190157,151.101.2.187,100.84.170.161,TLSv1.2,841,Application Data
209,19.2190157,151.101.2.187,100.84.170.161,TCP,5878,443  >  64433 [ACK] Seq=798847 Ack=67438 Win=4289 Len=5824 [TCP PDU reassembled in 210]
210,19.2190157,151.101.2.187,100.84.170.161,TLSv1.2,372,Application Data
211,19.2190157,151.101.2.187,100.84.170.161,TCP,1510,443  >  64433 [ACK] Seq=804989 Ack=67438 Win=4289 Len=1456 [TCP PDU reassembled in 212]
212,19.2190157,151.101.2.187,100.84.170.161,TLSv1.2,1109,Application Data
213,19.2190157,151.101.2.187,100.84.170.161,TLSv1.2,85,Application Data
214,19.2191737,100.84.170.161,151.101.2.187,TCP,54,64433  >  443 [ACK] Seq=67438 Ack=807531 Win=8212 Len=0
215,19.323329,100.84.170.161,151.101.2.187,TLSv1.2,2453,Application Data
216,19.335204,151.101.2.187,100.84.170.161,TCP,56,443  >  64433 [ACK] Seq=807531 Ack=69837 Win=4300 Len=0
217,20.1306124,151.101.2.187,100.84.170.161,TLSv1.2,237,Application Data
218,20.1306124,151.101.2.187,100.84.170.161,TLSv1.2,39366,"Application Data, Application Data"
219,20.1306124,151.101.2.187,100.84.170.161,TLSv1.2,694,Application Data
220,20.1306124,151.101.2.187,100.84.170.161,TCP,694,"[TCP Retransmission] 443  >  64433 [PSH, ACK] Seq=847026 Ack=69837 Win=4300 Len=640 [TCP PDU reassembled in 219]"
221,20.1308285,100.84.170.161,151.101.2.187,TCP,66,64433  >  443 [ACK] Seq=69837 Ack=847666 Win=8212 Len=0 SLE=847026 SRE=847666
222,20.9419919,100.84.170.161,151.101.2.187,TLSv1.2,2447,Application Data
223,20.9514257,151.101.2.187,100.84.170.161,TCP,56,443  >  64433 [ACK] Seq=847666 Ack=72230 Win=4311 Len=0
224,20.9539937,151.101.2.187,100.84.170.161,TLSv1.2,290,Application Data
225,21.0049986,151.101.2.187,100.84.170.161,TCP,290,"[TCP Retransmission] 443  >  64433 [PSH, ACK] Seq=847666 Ack=72230 Win=4311 Len=236"
226,21.0050883,100.84.170.161,151.101.2.187,TCP,66,64433  >  443 [ACK] Seq=72230 Ack=847902 Win=8211 Len=0 SLE=847666 SRE=847902
227,21.0319072,100.84.170.161,151.101.2.187,TLSv1.2,2447,Application Data
228,21.0344038,100.84.170.161,151.101.2.187,TLSv1.2,2453,Application Data
229,21.0346292,100.84.170.161,151.101.2.187,TLSv1.2,2450,Application Data
230,21.036092,100.84.170.161,151.101.2.187,TLSv1.2,2453,Application Data
231,21.0362641,100.84.170.161,151.101.2.187,TLSv1.2,2454,Application Data
232,21.0412031,151.101.2.187,100.84.170.161,TCP,56,443  >  64433 [ACK] Seq=847902 Ack=74623 Win=4323 Len=0
233,21.043933,151.101.2.187,100.84.170.161,TCP,56,443  >  64433 [ACK] Seq=847902 Ack=77022 Win=4334 Len=0
234,21.0442228,151.101.2.187,100.84.170.161,TCP,56,443  >  64433 [ACK] Seq=847902 Ack=79418 Win=4346 Len=0
235,21.0452222,151.101.2.187,100.84.170.161,TLSv1.2,135,Application Data
236,21.0455396,151.101.2.187,100.84.170.161,TCP,56,443  >  64433 [ACK] Seq=847983 Ack=81817 Win=4357 Len=0
237,21.0463424,151.101.2.187,100.84.170.161,TCP,56,443  >  64433 [ACK] Seq=847983 Ack=84217 Win=4368 Len=0
238,21.0480782,151.101.2.187,100.84.170.161,TLSv1.2,131,Application Data
239,21.0481398,100.84.170.161,151.101.2.187,TCP,54,64433  >  443 [ACK] Seq=84217 Ack=848060 Win=8210 Len=0
240,21.0484159,151.101.2.187,100.84.170.161,TLSv1.2,203,Application Data
241,21.0502614,151.101.2.187,100.84.170.161,TLSv1.2,212,Application Data
242,21.0502614,151.101.2.187,100.84.170.161,TLSv1.2,131,Application Data
243,21.0503314,100.84.170.161,151.101.2.187,TCP,54,64433  >  443 [ACK] Seq=84217 Ack=848444 Win=8209 Len=0
244,21.2532528,100.84.170.161,151.101.2.187,TLSv1.2,2451,Application Data
245,21.2637265,151.101.2.187,100.84.170.161,TCP,56,443  >  64433 [ACK] Seq=848444 Ack=86614 Win=4380 Len=0
246,21.2660053,151.101.2.187,100.84.170.161,TLSv1.2,131,Application Data
247,21.3117773,151.101.2.187,100.84.170.161,TCP,131,"[TCP Retransmission] 443  >  64433 [PSH, ACK] Seq=848444 Ack=86614 Win=4380 Len=77"
248,21.3118315,100.84.170.161,151.101.2.187,TCP,66,64433  >  443 [ACK] Seq=86614 Ack=848521 Win=8209 Len=0 SLE=848444 SRE=848521
249,21.3143739,100.84.170.161,151.101.2.187,TLSv1.2,2453,Application Data
250,21.323834,151.101.2.187,100.84.170.161,TCP,56,443  >  64433 [ACK] Seq=848521 Ack=89013 Win=4391 Len=0
251,21.3270816,151.101.2.187,100.84.170.161,TLSv1.2,125,Application Data
252,21.3722613,151.101.2.187,100.84.170.161,TCP,125,"[TCP Retransmission] 443  >  64433 [PSH, ACK] Seq=848521 Ack=89013 Win=4391 Len=71"
253,21.3723832,100.84.170.161,151.101.2.187,TCP,66,64433  >  443 [ACK] Seq=89013 Ack=848592 Win=8208 Len=0 SLE=848521 SRE=848592
254,23.426862,100.84.170.161,151.101.2.187,TLSv1.2,2448,Application Data
255,23.4367279,151.101.2.187,100.84.170.161,TCP,56,443  >  64433 [ACK] Seq=848592 Ack=91407 Win=4403 Len=0
256,23.4396408,151.101.2.187,100.84.170.161,TLSv1.2,241,Application Data
257,23.4821291,100.84.170.161,151.101.2.187,TCP,54,64433  >  443 [ACK] Seq=91407 Ack=848779 Win=8208 Len=0
258,23.4849956,151.101.2.187,100.84.170.161,TCP,241,"[TCP Spurious Retransmission] 443  >  64433 [PSH, ACK] Seq=848592 Ack=91407 Win=4403 Len=187"
259,23.4850635,100.84.170.161,151.101.2.187,TCP,66,[TCP Dup ACK 257#1] 64433  >  443 [ACK] Seq=91407 Ack=848779 Win=8208 Len=0 SLE=848592 SRE=848779
260,23.7574933,100.84.170.161,151.101.2.187,TLSv1.2,2449,Application Data
261,23.7586283,100.84.170.161,151.101.2.187,TLSv1.2,2447,Application Data
262,23.7699612,151.101.2.187,100.84.170.161,TCP,56,443  >  64433 [ACK] Seq=848779 Ack=96195 Win=4426 Len=0
263,23.7726143,151.101.2.187,100.84.170.161,TLSv1.2,240,Application Data
264,23.7727876,151.101.2.187,100.84.170.161,TLSv1.2,168,Application Data
265,23.772821,100.84.170.161,151.101.2.187,TCP,54,64433  >  443 [ACK] Seq=96195 Ack=849079 Win=8206 Len=0
266,23.9822793,100.84.170.161,151.101.2.187,TLSv1.2,2454,Application Data
267,23.9915832,151.101.2.187,100.84.170.161,TCP,56,443  >  64433 [ACK] Seq=849079 Ack=98595 Win=4437 Len=0
268,23.994982,151.101.2.187,100.84.170.161,TLSv1.2,125,Application Data
269,24.0431819,151.101.2.187,100.84.170.161,TCP,125,"[TCP Retransmission] 443  >  64433 [PSH, ACK] Seq=849079 Ack=98595 Win=4437 Len=71"
270,24.0432233,100.84.170.161,151.101.2.187,TCP,66,64433  >  443 [ACK] Seq=98595 Ack=849150 Win=8212 Len=0 SLE=849079 SRE=849150
271,26.0420003,100.84.170.161,151.101.2.187,TLSv1.2,2411,Application Data
272,26.042655,100.84.170.161,151.101.2.187,TLSv1.2,2415,Application Data
273,26.0430276,100.84.170.161,151.101.2.187,TLSv1.2,2409,Application Data
274,26.0445454,100.84.170.161,151.101.2.187,TLSv1.2,2415,Application Data
275,26.0457806,100.84.170.161,151.101.2.187,TLSv1.2,2412,Application Data
276,26.0460752,100.84.170.161,151.101.2.187,TLSv1.2,2409,Application Data
277,26.0487362,100.84.170.161,151.101.2.187,TLSv1.2,2413,Application Data
278,26.05295,151.101.2.187,100.84.170.161,TCP,56,443  >  64433 [ACK] Seq=849150 Ack=105668 Win=4471 Len=0
279,26.0539479,151.101.2.187,100.84.170.161,TCP,56,443  >  64433 [ACK] Seq=849150 Ack=108029 Win=4483 Len=0
280,26.0553285,151.101.2.187,100.84.170.161,TLSv1.2,220,Application Data
281,26.0557235,151.101.2.187,100.84.170.161,TCP,56,443  >  64433 [ACK] Seq=849316 Ack=112742 Win=4505 Len=0
282,26.0561151,151.101.2.187,100.84.170.161,TLSv1.2,163,Application Data
283,26.0562414,100.84.170.161,151.101.2.187,TCP,54,64433  >  443 [ACK] Seq=115101 Ack=849425 Win=8211 Len=0
284,26.0568351,151.101.2.187,100.84.170.161,TLSv1.2,203,Application Data
285,26.0574883,151.101.2.187,100.84.170.161,TLSv1.2,213,Application Data
286,26.0575436,100.84.170.161,151.101.2.187,TCP,54,64433  >  443 [ACK] Seq=115101 Ack=849733 Win=8210 Len=0
287,26.0583333,151.101.2.187,100.84.170.161,TCP,56,443  >  64433 [ACK] Seq=849733 Ack=115101 Win=4517 Len=0
288,26.0586043,151.101.2.187,100.84.170.161,TLSv1.2,130,Application Data
289,26.0611772,151.101.2.187,100.84.170.161,TLSv1.2,131,Application Data
290,26.0612439,100.84.170.161,151.101.2.187,TCP,54,64433  >  443 [ACK] Seq=115101 Ack=849886 Win=8209 Len=0
291,26.0715468,100.84.170.161,151.101.2.187,TLSv1.2,2409,Application Data
292,26.0719656,100.84.170.161,151.101.2.187,TLSv1.2,2416,Application Data
293,26.0729656,100.84.170.161,151.101.2.187,TLSv1.2,2410,Application Data
294,26.0808749,151.101.2.187,100.84.170.161,TCP,56,443  >  64433 [ACK] Seq=849886 Ack=117456 Win=4528 Len=0
295,26.0812776,151.101.2.187,100.84.170.161,TCP,56,443  >  64433 [ACK] Seq=849886 Ack=119818 Win=4540 Len=0
296,26.0822968,151.101.2.187,100.84.170.161,TCP,56,443  >  64433 [ACK] Seq=849886 Ack=122174 Win=4551 Len=0
297,26.0835045,151.101.2.187,100.84.170.161,TLSv1.2,104,Application Data
298,26.0838288,151.101.2.187,100.84.170.161,TLSv1.2,98,Application Data
299,26.0838685,100.84.170.161,151.101.2.187,TCP,54,64433  >  443 [ACK] Seq=122174 Ack=849980 Win=8209 Len=0
300,26.0845938,151.101.2.187,100.84.170.161,TLSv1.2,125,Application Data
301,26.128509,151.101.2.187,100.84.170.161,TCP,125,"[TCP Retransmission] 443  >  64433 [PSH, ACK] Seq=849980 Ack=122174 Win=4551 Len=71"
302,26.1285372,100.84.170.161,151.101.2.187,TCP,66,64433  >  443 [ACK] Seq=122174 Ack=850051 Win=8208 Len=0 SLE=849980 SRE=850051
303,28.0780178,100.84.170.161,151.101.2.187,TLSv1.2,2416,Application Data
304,28.0802647,100.84.170.161,151.101.2.187,TLSv1.2,2415,Application Data
305,28.0873309,151.101.2.187,100.84.170.161,TCP,56,443  >  64433 [ACK] Seq=850051 Ack=124536 Win=4562 Len=0
306,28.0897353,151.101.2.187,100.84.170.161,TCP,56,443  >  64433 [ACK] Seq=850051 Ack=126897 Win=4574 Len=0
307,28.0900473,151.101.2.187,100.84.170.161,TLSv1.2,241,Application Data
308,28.0918295,151.101.2.187,100.84.170.161,TLSv1.2,125,Application Data
309,28.0919007,100.84.170.161,151.101.2.187,TCP,54,64433  >  443 [ACK] Seq=126897 Ack=850309 Win=8207 Len=0
310,28.4420672,100.84.170.161,151.101.2.187,TLSv1.2,2411,Application Data
311,28.4440349,100.84.170.161,151.101.2.187,TLSv1.2,2399,Application Data
312,28.4448935,100.84.170.161,151.101.2.187,TLSv1.2,2393,Application Data
313,28.4489053,100.84.170.161,151.101.2.187,TLSv1.2,2412,Application Data
314,28.4530331,151.101.2.187,100.84.170.161,TCP,56,443  >  64433 [ACK] Seq=850309 Ack=129254 Win=4585 Len=0
315,28.4532634,151.101.2.187,100.84.170.161,TCP,56,443  >  64433 [ACK] Seq=850309 Ack=131599 Win=4597 Len=0
316,28.4541757,151.101.2.187,100.84.170.161,TCP,56,443  >  64433 [ACK] Seq=850309 Ack=133938 Win=4608 Len=0
317,28.4563893,151.101.2.187,100.84.170.161,TLSv1.2,98,Application Data
318,28.4570801,151.101.2.187,100.84.170.161,TLSv1.2,130,Application Data
319,28.4571681,100.84.170.161,151.101.2.187,TCP,54,64433  >  443 [ACK] Seq=136296 Ack=850429 Win=8207 Len=0
320,28.4573365,151.101.2.187,100.84.170.161,TLSv1.2,174,Application Data
321,28.4581579,151.101.2.187,100.84.170.161,TCP,56,443  >  64433 [ACK] Seq=850549 Ack=136296 Win=4619 Len=0
322,28.4608783,151.101.2.187,100.84.170.161,TLSv1.2,98,Application Data
323,28.4609389,100.84.170.161,151.101.2.187,TCP,54,64433  >  443 [ACK] Seq=136296 Ack=850593 Win=8206 Len=0
324,28.5270781,100.84.170.161,151.101.2.187,TLSv1.2,2400,Application Data
325,28.5340722,100.84.170.161,151.101.2.187,TLSv1.2,2397,Application Data
326,28.5363999,151.101.2.187,100.84.170.161,TCP,56,443  >  64433 [ACK] Seq=850593 Ack=138642 Win=4631 Len=0
327,28.5389661,151.101.2.187,100.84.170.161,TLSv1.2,136,Application Data
328,28.5390383,100.84.170.161,151.101.2.187,TCP,54,64433  >  443 [ACK] Seq=140985 Ack=850675 Win=8212 Len=0
329,28.5432875,151.101.2.187,100.84.170.161,TCP,56,443  >  64433 [ACK] Seq=850675 Ack=140985 Win=4642 Len=0
330,28.5457684,151.101.2.187,100.84.170.161,TLSv1.2,234,Application Data
331,28.5458414,100.84.170.161,151.101.2.187,TCP,54,64433  >  443 [ACK] Seq=140985 Ack=850855 Win=8211 Len=0
332,28.6863642,100.84.170.161,151.101.2.187,TLSv1.2,2415,Application Data
333,28.6986667,151.101.2.187,100.84.170.161,TCP,56,443  >  64433 [ACK] Seq=850855 Ack=143346 Win=4654 Len=0
334,28.7011455,151.101.2.187,100.84.170.161,TLSv1.2,135,Application Data
335,28.70436,100.84.170.161,151.101.2.187,TLSv1.2,2406,Application Data
336,28.7142316,151.101.2.187,100.84.170.161,TCP,56,443  >  64433 [ACK] Seq=850936 Ack=145698 Win=4665 Len=0
337,28.7189292,151.101.2.187,100.84.170.161,TLSv1.2,203,Application Data
338,28.7494956,151.101.2.187,100.84.170.161,TCP,203,"[TCP Retransmission] 443  >  64433 [PSH, ACK] Seq=850936 Ack=145698 Win=4665 Len=149"
339,28.7495337,100.84.170.161,151.101.2.187,TCP,66,64433  >  443 [ACK] Seq=145698 Ack=851085 Win=8210 Len=0 SLE=850936 SRE=851085
340,28.7943073,100.84.170.161,151.101.2.187,TLSv1.2,2403,Application Data
341,28.7945259,100.84.170.161,151.101.2.187,TLSv1.2,2394,Application Data
342,28.8045563,151.101.2.187,100.84.170.161,TCP,56,443  >  64433 [ACK] Seq=851085 Ack=150387 Win=4688 Len=0
343,28.8077496,151.101.2.187,100.84.170.161,TLSv1.2,206,Application Data
344,28.8077496,151.101.2.187,100.84.170.161,TLSv1.2,130,Application Data
345,28.8078323,100.84.170.161,151.101.2.187,TCP,54,64433  >  443 [ACK] Seq=150387 Ack=851313 Win=8210 Len=0
346,29.2739798,100.84.170.161,151.101.2.187,TLSv1.2,2409,Application Data
347,29.284052,151.101.2.187,100.84.170.161,TCP,56,443  >  64433 [ACK] Seq=851313 Ack=152742 Win=4699 Len=0
348,29.2869086,151.101.2.187,100.84.170.161,TLSv1.2,131,Application Data
349,29.3158833,151.101.2.187,100.84.170.161,TCP,131,"[TCP Retransmission] 443  >  64433 [PSH, ACK] Seq=851313 Ack=152742 Win=4699 Len=77"
350,29.3159434,100.84.170.161,151.101.2.187,TCP,66,64433  >  443 [ACK] Seq=152742 Ack=851390 Win=8209 Len=0 SLE=851313 SRE=851390
351,29.6259275,100.84.170.161,151.101.2.187,TLSv1.2,2410,Application Data
352,29.6261813,100.84.170.161,151.101.2.187,TLSv1.2,2411,Application Data
353,29.6371001,151.101.2.187,100.84.170.161,TCP,56,443  >  64433 [ACK] Seq=851390 Ack=157455 Win=4722 Len=0
354,29.640459,151.101.2.187,100.84.170.161,TLSv1.2,240,Application Data
355,29.6416362,151.101.2.187,100.84.170.161,TLSv1.2,124,Application Data
356,29.6418494,100.84.170.161,151.101.2.187,TCP,54,64433  >  443 [ACK] Seq=157455 Ack=851646 Win=8208 Len=0
357,30.0591802,100.84.170.161,151.101.2.187,TLSv1.2,2301,Application Data
358,30.0713013,151.101.2.187,100.84.170.161,TCP,56,443  >  64433 [ACK] Seq=851646 Ack=159702 Win=4733 Len=0
359,30.0745185,151.101.2.187,100.84.170.161,TLSv1.2,104,Application Data
360,30.1018217,151.101.2.187,100.84.170.161,TCP,104,"[TCP Retransmission] 443  >  64433 [PSH, ACK] Seq=851646 Ack=159702 Win=4733 Len=50"
361,30.1018723,100.84.170.161,151.101.2.187,TCP,66,64433  >  443 [ACK] Seq=159702 Ack=851696 Win=8208 Len=0 SLE=851646 SRE=851696
362,30.5393015,100.84.170.161,151.101.2.187,TLSv1.2,2433,Application Data
363,30.5503918,151.101.2.187,100.84.170.161,TCP,56,443  >  64433 [ACK] Seq=851696 Ack=162081 Win=4745 Len=0
364,30.5527659,151.101.2.187,100.84.170.161,TLSv1.2,208,Application Data
365,30.5808194,151.101.2.187,100.84.170.161,TCP,208,"[TCP Retransmission] 443  >  64433 [PSH, ACK] Seq=851696 Ack=162081 Win=4745 Len=154"
366,30.5808561,100.84.170.161,151.101.2.187,TCP,66,64433  >  443 [ACK] Seq=162081 Ack=851850 Win=8207 Len=0 SLE=851696 SRE=851850
367,31.6185685,100.84.170.161,151.101.2.187,TLSv1.2,2416,Application Data
368,31.6285268,151.101.2.187,100.84.170.161,TCP,56,443  >  64433 [ACK] Seq=851850 Ack=164443 Win=4756 Len=0
369,31.6327982,151.101.2.187,100.84.170.161,TLSv1.2,241,Application Data
370,31.6607093,151.101.2.187,100.84.170.161,TCP,241,"[TCP Retransmission] 443  >  64433 [PSH, ACK] Seq=851850 Ack=164443 Win=4756 Len=187"
371,31.6607579,100.84.170.161,151.101.2.187,TCP,66,64433  >  443 [ACK] Seq=164443 Ack=852037 Win=8207 Len=0 SLE=851850 SRE=852037
372,34.7808306,100.84.170.161,151.101.2.187,TLSv1.2,303,Application Data
373,34.7929615,151.101.2.187,100.84.170.161,TCP,56,443  >  64433 [ACK] Seq=852037 Ack=164692 Win=4756 Len=0
374,34.8449015,151.101.2.187,100.84.170.161,TLSv1.2,339,Application Data
375,34.8451661,151.101.2.187,100.84.170.161,TLSv1.2,357,Application Data
376,34.8452165,100.84.170.161,151.101.2.187,TCP,54,64433  >  443 [ACK] Seq=164692 Ack=852625 Win=8212 Len=0
377,34.8486936,100.84.170.161,151.101.2.187,TLSv1.2,89,Application Data
378,34.8583465,151.101.2.187,100.84.170.161,TCP,56,443  >  64433 [ACK] Seq=852625 Ack=164727 Win=4756 Len=0
379,35.1420945,100.84.170.161,151.101.2.187,TLSv1.2,2320,Application Data
380,35.1533547,151.101.2.187,100.84.170.161,TCP,56,443  >  64433 [ACK] Seq=852625 Ack=166993 Win=4768 Len=0
381,35.1558746,151.101.2.187,100.84.170.161,TLSv1.2,314,Application Data
382,35.1594347,100.84.170.161,151.101.2.187,TLSv1.2,2416,Application Data
383,35.1694627,151.101.2.187,100.84.170.161,TCP,56,443  >  64433 [ACK] Seq=852885 Ack=169355 Win=4779 Len=0
384,35.1724095,151.101.2.187,100.84.170.161,TLSv1.2,104,Application Data
385,35.1984719,100.84.170.161,151.101.2.187,TLSv1.2,2429,Application Data
386,35.224185,100.84.170.161,151.101.2.187,TCP,1514,"[TCP Retransmission] 64433  >  443 [PSH, ACK] Seq=170270 Ack=852935 Win=8211 Len=1460"
387,35.2538168,151.101.2.187,100.84.170.161,TCP,104,"[TCP Spurious Retransmission] 443  >  64433 [PSH, ACK] Seq=852885 Ack=169355 Win=4779 Len=50"
388,35.2538532,100.84.170.161,151.101.2.187,TCP,66,[TCP Dup ACK 385#1] 64433  >  443 [ACK] Seq=171730 Ack=852935 Win=8211 Len=0 SLE=852885 SRE=852935
389,35.2961685,151.101.2.187,100.84.170.161,TCP,56,443  >  64433 [ACK] Seq=852935 Ack=171730 Win=4791 Len=0
390,35.2964223,151.101.2.187,100.84.170.161,TCP,66,[TCP Dup ACK 389#1] 443  >  64433 [ACK] Seq=852935 Ack=171730 Win=4791 Len=0 SLE=170270 SRE=171730
391,35.2968159,151.101.2.187,100.84.170.161,TLSv1.2,104,Application Data
392,35.3194939,151.101.2.187,100.84.170.161,TCP,104,"[TCP Retransmission] 443  >  64433 [PSH, ACK] Seq=852935 Ack=171730 Win=4791 Len=50"
393,35.3195356,100.84.170.161,151.101.2.187,TCP,66,64433  >  443 [ACK] Seq=171730 Ack=852985 Win=8211 Len=0 SLE=852935 SRE=852985
394,35.7922337,100.84.170.161,151.101.2.187,TLSv1.2,2428,Application Data
395,35.8023499,151.101.2.187,100.84.170.161,TCP,56,443  >  64433 [ACK] Seq=852985 Ack=174104 Win=4802 Len=0
396,35.8039309,100.84.170.161,151.101.2.187,TLSv1.2,2416,Application Data
397,35.8058708,151.101.2.187,100.84.170.161,TLSv1.2,235,Application Data
398,35.8131284,151.101.2.187,100.84.170.161,TCP,56,443  >  64433 [ACK] Seq=853166 Ack=176466 Win=4813 Len=0
399,35.8160071,151.101.2.187,100.84.170.161,TLSv1.2,98,Application Data
400,35.8161895,100.84.170.161,151.101.2.187,TCP,54,64433  >  443 [ACK] Seq=176466 Ack=853210 Win=8210 Len=0
401,35.855367,100.84.170.161,151.101.2.187,TLSv1.2,2433,Application Data
402,35.8646982,151.101.2.187,100.84.170.161,TCP,56,443  >  64433 [ACK] Seq=853210 Ack=178845 Win=4825 Len=0
403,35.8674134,151.101.2.187,100.84.170.161,TLSv1.2,98,Application Data
404,35.897766,151.101.2.187,100.84.170.161,TCP,98,"[TCP Retransmission] 443  >  64433 [PSH, ACK] Seq=853210 Ack=178845 Win=4825 Len=44"
405,35.8978124,100.84.170.161,151.101.2.187,TCP,66,64433  >  443 [ACK] Seq=178845 Ack=853254 Win=8210 Len=0 SLE=853210 SRE=853254
406,36.1095408,100.84.170.161,151.101.2.187,TLSv1.2,2428,Application Data
407,36.1189443,151.101.2.187,100.84.170.161,TCP,56,443  >  64433 [ACK] Seq=853254 Ack=181219 Win=4836 Len=0
408,36.121622,151.101.2.187,100.84.170.161,TLSv1.2,104,Application Data
409,36.1334796,100.84.170.161,151.101.2.187,TLSv1.2,2416,Application Data
410,36.1432018,151.101.2.187,100.84.170.161,TCP,56,443  >  64433 [ACK] Seq=853304 Ack=183581 Win=4848 Len=0
411,36.1463677,151.101.2.187,100.84.170.161,TLSv1.2,104,Application Data
412,36.1778082,151.101.2.187,100.84.170.161,TCP,104,"[TCP Retransmission] 443  >  64433 [PSH, ACK] Seq=853304 Ack=183581 Win=4848 Len=50"
413,36.1778683,100.84.170.161,151.101.2.187,TCP,66,64433  >  443 [ACK] Seq=183581 Ack=853354 Win=8209 Len=0 SLE=853304 SRE=853354
414,37.0022631,100.84.170.161,151.101.2.187,TLSv1.2,2428,Application Data
415,37.013895,151.101.2.187,100.84.170.161,TCP,56,443  >  64433 [ACK] Seq=853354 Ack=185955 Win=4859 Len=0
416,37.0153529,100.84.170.161,151.101.2.187,TLSv1.2,2416,Application Data
417,37.0163598,151.101.2.187,100.84.170.161,TLSv1.2,208,Application Data
418,37.0255921,151.101.2.187,100.84.170.161,TCP,56,443  >  64433 [ACK] Seq=853508 Ack=188317 Win=4870 Len=0
419,37.0284292,151.101.2.187,100.84.170.161,TLSv1.2,104,Application Data
420,37.0285046,100.84.170.161,151.101.2.187,TCP,54,64433  >  443 [ACK] Seq=188317 Ack=853558 Win=8208 Len=0
421,37.0541673,100.84.170.161,151.101.2.187,TLSv1.2,2429,Application Data
422,37.0639246,151.101.2.187,100.84.170.161,TCP,56,443  >  64433 [ACK] Seq=853558 Ack=190692 Win=4882 Len=0
423,37.0664057,151.101.2.187,100.84.170.161,TLSv1.2,124,Application Data
424,37.0997805,151.101.2.187,100.84.170.161,TCP,124,"[TCP Retransmission] 443  >  64433 [PSH, ACK] Seq=853558 Ack=190692 Win=4882 Len=70"
425,37.0998171,100.84.170.161,151.101.2.187,TCP,66,64433  >  443 [ACK] Seq=190692 Ack=853628 Win=8208 Len=0 SLE=853558 SRE=853628
426,37.7161578,100.84.170.161,151.101.2.187,TLSv1.2,2428,Application Data
427,37.7270098,151.101.2.187,100.84.170.161,TCP,56,443  >  64433 [ACK] Seq=853628 Ack=193066 Win=4893 Len=0
428,37.7299657,151.101.2.187,100.84.170.161,TLSv1.2,214,Application Data
429,37.7340801,100.84.170.161,151.101.2.187,TLSv1.2,2416,Application Data
430,37.7439883,151.101.2.187,100.84.170.161,TCP,56,443  >  64433 [ACK] Seq=853788 Ack=195428 Win=4905 Len=0
431,37.7482056,151.101.2.187,100.84.170.161,TLSv1.2,125,Application Data
432,37.7819269,151.101.2.187,100.84.170.161,TCP,125,"[TCP Retransmission] 443  >  64433 [PSH, ACK] Seq=853788 Ack=195428 Win=4905 Len=71"
433,37.7820166,100.84.170.161,151.101.2.187,TCP,66,64433  >  443 [ACK] Seq=195428 Ack=853859 Win=8207 Len=0 SLE=853788 SRE=853859
434,38.130543,100.84.170.161,151.101.2.187,TLSv1.2,2428,Application Data
435,38.1315619,100.84.170.161,151.101.2.187,TLSv1.2,2416,Application Data
436,38.1400925,151.101.2.187,100.84.170.161,TCP,56,443  >  64433 [ACK] Seq=853859 Ack=197802 Win=4916 Len=0
437,38.1407582,151.101.2.187,100.84.170.161,TCP,56,443  >  64433 [ACK] Seq=853859 Ack=200164 Win=4927 Len=0
438,38.1423471,151.101.2.187,100.84.170.161,TLSv1.2,104,Application Data
439,38.1428798,151.101.2.187,100.84.170.161,TLSv1.2,104,Application Data
440,38.1429212,100.84.170.161,151.101.2.187,TCP,54,64433  >  443 [ACK] Seq=200164 Ack=853959 Win=8207 Len=0
441,38.1857247,100.84.170.161,151.101.2.187,TLSv1.2,2433,Application Data
442,38.1949417,151.101.2.187,100.84.170.161,TCP,56,443  >  64433 [ACK] Seq=853959 Ack=202543 Win=4939 Len=0
443,38.1986619,151.101.2.187,100.84.170.161,TLSv1.2,98,Application Data
444,38.2315152,151.101.2.187,100.84.170.161,TCP,98,"[TCP Retransmission] 443  >  64433 [PSH, ACK] Seq=853959 Ack=202543 Win=4939 Len=44"
445,38.2315554,100.84.170.161,151.101.2.187,TCP,66,64433  >  443 [ACK] Seq=202543 Ack=854003 Win=8207 Len=0 SLE=853959 SRE=854003
446,40.8657823,100.84.170.161,151.101.2.187,TLSv1.2,2453,Application Data
447,40.8667112,100.84.170.161,151.101.2.187,TLSv1.2,2441,Application Data
448,40.8681646,100.84.170.161,151.101.2.187,TLSv1.2,2435,Application Data
449,40.8741721,100.84.170.161,151.101.2.187,TLSv1.2,2454,Application Data
450,40.8777631,151.101.2.187,100.84.170.161,TCP,56,443  >  64433 [ACK] Seq=854003 Ack=207329 Win=4962 Len=0
451,40.8782683,151.101.2.187,100.84.170.161,TCP,56,443  >  64433 [ACK] Seq=854003 Ack=209710 Win=4973 Len=0
452,40.8806815,151.101.2.187,100.84.170.161,TLSv1.2,295,Application Data
453,40.8807673,100.84.170.161,151.101.2.187,TCP,54,64433  >  443 [ACK] Seq=212110 Ack=854244 Win=8212 Len=0
454,40.8809461,151.101.2.187,100.84.170.161,TLSv1.2,130,Application Data
455,40.880977,100.84.170.161,151.101.2.187,TCP,54,64433  >  443 [ACK] Seq=212110 Ack=854320 Win=8212 Len=0
456,40.8836194,151.101.2.187,100.84.170.161,TCP,56,443  >  64433 [ACK] Seq=854320 Ack=212110 Win=4984 Len=0
457,40.8854787,151.101.2.187,100.84.170.161,TLSv1.2,335,Application Data
458,40.920591,151.101.2.187,100.84.170.161,TCP,335,"[TCP Retransmission] 443  >  64433 [PSH, ACK] Seq=854320 Ack=212110 Win=4984 Len=281"
459,40.9206316,100.84.170.161,151.101.2.187,TCP,66,64433  >  443 [ACK] Seq=212110 Ack=854601 Win=8211 Len=0 SLE=854320 SRE=854601
460,41.0090075,100.84.170.161,151.101.2.187,TLSv1.2,2457,Application Data
461,41.018539,151.101.2.187,100.84.170.161,TCP,56,443  >  64433 [ACK] Seq=854601 Ack=214513 Win=4996 Len=0
462,41.0230143,151.101.2.187,100.84.170.161,TLSv1.2,130,Application Data
463,41.0642497,151.101.2.187,100.84.170.161,TCP,130,"[TCP Retransmission] 443  >  64433 [PSH, ACK] Seq=854601 Ack=214513 Win=4996 Len=76"
464,41.0642911,100.84.170.161,151.101.2.187,TCP,66,64433  >  443 [ACK] Seq=214513 Ack=854677 Win=8210 Len=0 SLE=854601 SRE=854677
465,41.358806,100.84.170.161,151.101.2.187,TLSv1.2,2423,Application Data
466,41.3589795,100.84.170.161,151.101.2.187,TLSv1.2,2426,Application Data
467,41.3590744,100.84.170.161,151.101.2.187,TLSv1.2,2420,Application Data
468,41.3594636,100.84.170.161,151.101.2.187,TLSv1.2,2417,Application Data
469,41.3685305,151.101.2.187,100.84.170.161,TCP,56,443  >  64433 [ACK] Seq=854677 Ack=216882 Win=5007 Len=0
470,41.3688228,151.101.2.187,100.84.170.161,TCP,56,443  >  64433 [ACK] Seq=854677 Ack=221620 Win=5030 Len=0
471,41.3694631,151.101.2.187,100.84.170.161,TCP,56,443  >  64433 [ACK] Seq=854677 Ack=223983 Win=5041 Len=0
472,41.3713358,151.101.2.187,100.84.170.161,TLSv1.2,130,Application Data
473,41.3715919,151.101.2.187,100.84.170.161,TLSv1.2,124,Application Data
474,41.3716352,100.84.170.161,151.101.2.187,TCP,54,64433  >  443 [ACK] Seq=223983 Ack=854823 Win=8210 Len=0
475,41.3719971,151.101.2.187,100.84.170.161,TLSv1.2,130,Application Data
476,41.3723296,151.101.2.187,100.84.170.161,TLSv1.2,130,Application Data
477,41.3723635,100.84.170.161,151.101.2.187,TCP,54,64433  >  443 [ACK] Seq=223983 Ack=854975 Win=8209 Len=0
478,41.4680277,100.84.170.161,151.101.2.187,TLSv1.2,2453,Application Data
479,41.4710751,100.84.170.161,151.101.2.187,TLSv1.2,2462,Application Data
480,41.4780108,151.101.2.187,100.84.170.161,TCP,56,443  >  64433 [ACK] Seq=854975 Ack=226382 Win=5053 Len=0
481,41.480415,151.101.2.187,100.84.170.161,TLSv1.2,125,Application Data
482,41.4808276,151.101.2.187,100.84.170.161,TCP,56,443  >  64433 [ACK] Seq=855046 Ack=228790 Win=5064 Len=0
483,41.4839798,151.101.2.187,100.84.170.161,TLSv1.2,104,Application Data
484,41.4840402,100.84.170.161,151.101.2.187,TCP,54,64433  >  443 [ACK] Seq=228790 Ack=855096 Win=8209 Len=0
485,41.6260872,100.84.170.161,151.101.2.187,TLSv1.2,2475,Application Data
486,41.6368191,151.101.2.187,100.84.170.161,TCP,56,443  >  64433 [ACK] Seq=855096 Ack=231211 Win=5076 Len=0
487,41.6405003,151.101.2.187,100.84.170.161,TLSv1.2,234,Application Data
488,41.6686021,151.101.2.187,100.84.170.161,TCP,234,"[TCP Retransmission] 443  >  64433 [PSH, ACK] Seq=855096 Ack=231211 Win=5076 Len=180"
489,41.6686389,100.84.170.161,151.101.2.187,TCP,66,64433  >  443 [ACK] Seq=231211 Ack=855276 Win=8208 Len=0 SLE=855096 SRE=855276
490,41.8754914,100.84.170.161,151.101.2.187,TLSv1.2,2477,Application Data
491,41.8852878,151.101.2.187,100.84.170.161,TCP,56,443  >  64433 [ACK] Seq=855276 Ack=233634 Win=5087 Len=0
492,41.8879383,151.101.2.187,100.84.170.161,TLSv1.2,98,Application Data
493,41.9166119,151.101.2.187,100.84.170.161,TCP,98,"[TCP Retransmission] 443  >  64433 [PSH, ACK] Seq=855276 Ack=233634 Win=5087 Len=44"
494,41.9166571,100.84.170.161,151.101.2.187,TCP,66,64433  >  443 [ACK] Seq=233634 Ack=855320 Win=8208 Len=0 SLE=855276 SRE=855320
495,41.9260244,100.84.170.161,151.101.2.187,TLSv1.2,2476,Application Data
496,41.9288844,100.84.170.161,151.101.2.187,TLSv1.2,2474,Application Data
497,41.9351365,151.101.2.187,100.84.170.161,TCP,56,443  >  64433 [ACK] Seq=855320 Ack=236056 Win=5098 Len=0
498,41.9380148,151.101.2.187,100.84.170.161,TLSv1.2,98,Application Data
499,41.9394212,151.101.2.187,100.84.170.161,TCP,56,443  >  64433 [ACK] Seq=855364 Ack=238476 Win=5110 Len=0
500,41.9406496,151.101.2.187,100.84.170.161,TLSv1.2,98,Application Data
501,41.9407284,100.84.170.161,151.101.2.187,TCP,54,64433  >  443 [ACK] Seq=238476 Ack=855408 Win=8207 Len=0
502,42.1426351,100.84.170.161,151.101.2.187,TLSv1.2,2464,Application Data
503,42.1434515,100.84.170.161,151.101.2.187,TLSv1.2,2458,Application Data
504,42.1535966,151.101.2.187,100.84.170.161,TCP,56,443  >  64433 [ACK] Seq=855408 Ack=243290 Win=5133 Len=0
505,42.1568525,151.101.2.187,100.84.170.161,TLSv1.2,104,Application Data
506,42.1570254,151.101.2.187,100.84.170.161,TLSv1.2,104,Application Data
507,42.1570508,100.84.170.161,151.101.2.187,TCP,54,64433  >  443 [ACK] Seq=243290 Ack=855508 Win=8207 Len=0
508,42.2735728,100.84.170.161,151.101.2.187,TLSv1.2,2480,Application Data
509,42.2846705,151.101.2.187,100.84.170.161,TCP,56,443  >  64433 [ACK] Seq=855508 Ack=245716 Win=5144 Len=0
510,42.2876765,151.101.2.187,100.84.170.161,TLSv1.2,104,Application Data
511,42.2986812,100.84.170.161,151.101.2.187,TLSv1.2,2471,Application Data
512,42.3083742,151.101.2.187,100.84.170.161,TCP,56,443  >  64433 [ACK] Seq=855558 Ack=248133 Win=5156 Len=0
513,42.3112085,151.101.2.187,100.84.170.161,TLSv1.2,130,Application Data
514,42.3405158,151.101.2.187,100.84.170.161,TCP,130,"[TCP Retransmission] 443  >  64433 [PSH, ACK] Seq=855558 Ack=248133 Win=5156 Len=76"
515,42.3405533,100.84.170.161,151.101.2.187,TCP,66,64433  >  443 [ACK] Seq=248133 Ack=855634 Win=8207 Len=0 SLE=855558 SRE=855634
516,42.5407481,100.84.170.161,151.101.2.187,TLSv1.2,2465,Application Data
517,42.5409641,100.84.170.161,151.101.2.187,TLSv1.2,2468,Application Data
518,42.5410675,100.84.170.161,151.101.2.187,TLSv1.2,2462,Application Data
519,42.5414484,100.84.170.161,151.101.2.187,TLSv1.2,2459,Application Data
520,42.55396,151.101.2.187,100.84.170.161,TCP,56,443  >  64433 [ACK] Seq=855634 Ack=257771 Win=5199 Len=0
521,42.5559104,151.101.2.187,100.84.170.161,TLSv1.2,242,Application Data
522,42.5562862,151.101.2.187,100.84.170.161,TLSv1.2,104,Application Data
523,42.5563255,100.84.170.161,151.101.2.187,TCP,54,64433  >  443 [ACK] Seq=257771 Ack=855872 Win=8212 Len=0
524,42.5565411,151.101.2.187,100.84.170.161,TLSv1.2,142,Application Data
525,42.5956475,151.101.2.187,100.84.170.161,TCP,142,"[TCP Retransmission] 443  >  64433 [PSH, ACK] Seq=855872 Ack=257771 Win=5199 Len=88"
526,42.5956881,100.84.170.161,151.101.2.187,TCP,66,64433  >  443 [ACK] Seq=257771 Ack=855960 Win=8212 Len=0 SLE=855872 SRE=855960
527,42.6425518,100.84.170.161,151.101.2.187,TLSv1.2,2457,Application Data
528,42.6521754,151.101.2.187,100.84.170.161,TCP,56,443  >  64433 [ACK] Seq=855960 Ack=260174 Win=5211 Len=0
529,42.6553138,151.101.2.187,100.84.170.161,TLSv1.2,296,Application Data
530,42.684625,151.101.2.187,100.84.170.161,TCP,296,"[TCP Retransmission] 443  >  64433 [PSH, ACK] Seq=855960 Ack=260174 Win=5211 Len=242"
531,42.6846615,100.84.170.161,151.101.2.187,TCP,66,64433  >  443 [ACK] Seq=260174 Ack=856202 Win=8211 Len=0 SLE=855960 SRE=856202
532,42.6901816,100.84.170.161,151.101.2.187,TLSv1.2,2479,Application Data
533,42.69947,151.101.2.187,100.84.170.161,TCP,56,443  >  64433 [ACK] Seq=856202 Ack=262599 Win=5222 Len=0
534,42.7028767,151.101.2.187,100.84.170.161,TLSv1.2,98,Application Data
535,42.7316973,151.101.2.187,100.84.170.161,TCP,98,"[TCP Retransmission] 443  >  64433 [PSH, ACK] Seq=856202 Ack=262599 Win=5222 Len=44"
536,42.7318,100.84.170.161,151.101.2.187,TCP,66,64433  >  443 [ACK] Seq=262599 Ack=856246 Win=8211 Len=0 SLE=856202 SRE=856246
537,42.8327373,100.84.170.161,151.101.2.187,TLSv1.2,2474,Application Data
538,42.8426196,151.101.2.187,100.84.170.161,TCP,56,443  >  64433 [ACK] Seq=856246 Ack=265019 Win=5233 Len=0
539,42.8452384,151.101.2.187,100.84.170.161,TLSv1.2,98,Application Data
540,42.8481504,100.84.170.161,151.101.2.187,TLSv1.2,2462,Application Data
541,42.8572473,151.101.2.187,100.84.170.161,TCP,56,443  >  64433 [ACK] Seq=856290 Ack=267427 Win=5245 Len=0
542,42.8610921,151.101.2.187,100.84.170.161,TLSv1.2,131,Application Data
543,42.889759,151.101.2.187,100.84.170.161,TCP,131,"[TCP Retransmission] 443  >  64433 [PSH, ACK] Seq=856290 Ack=267427 Win=5245 Len=77"
544,42.8898173,100.84.170.161,151.101.2.187,TCP,66,64433  >  443 [ACK] Seq=267427 Ack=856367 Win=8210 Len=0 SLE=856290 SRE=856367
545,42.9979416,100.84.170.161,151.101.2.187,TLSv1.2,2475,Application Data
546,42.9982546,100.84.170.161,151.101.2.187,TLSv1.2,2476,Application Data
547,43.008864,151.101.2.187,100.84.170.161,TCP,56,443  >  64433 [ACK] Seq=856367 Ack=272270 Win=5268 Len=0
548,43.0113806,151.101.2.187,100.84.170.161,TLSv1.2,98,Application Data
549,43.0117183,151.101.2.187,100.84.170.161,TLSv1.2,98,Application Data
550,43.0117649,100.84.170.161,151.101.2.187,TCP,54,64433  >  443 [ACK] Seq=272270 Ack=856455 Win=8210 Len=0
551,43.2107255,100.84.170.161,151.101.2.187,TLSv1.2,2462,Application Data
552,43.2113149,100.84.170.161,151.101.2.187,TLSv1.2,2468,Application Data
553,43.2114383,100.84.170.161,151.101.2.187,TLSv1.2,2469,Application Data
554,43.2115319,100.84.170.161,151.101.2.187,TLSv1.2,2462,Application Data
555,43.2116698,100.84.170.161,151.101.2.187,TLSv1.2,2462,Application Data
556,43.2117983,100.84.170.161,151.101.2.187,TLSv1.2,2468,Application Data
557,43.2123311,100.84.170.161,151.101.2.187,TLSv1.2,2474,Application Data
558,43.2237076,151.101.2.187,100.84.170.161,TCP,56,443  >  64433 [ACK] Seq=856455 Ack=284323 Win=5321 Len=0
559,43.22401,151.101.2.187,100.84.170.161,TCP,56,443  >  64433 [ACK] Seq=856455 Ack=289157 Win=5343 Len=0
560,43.226794,151.101.2.187,100.84.170.161,TLSv1.2,131,Application Data
561,43.2284493,151.101.2.187,100.84.170.161,TLSv1.2,282,Application Data
562,43.2285208,100.84.170.161,151.101.2.187,TCP,54,64433  >  443 [ACK] Seq=289157 Ack=856760 Win=8209 Len=0
563,43.2287968,151.101.2.187,100.84.170.161,TLSv1.2,131,Application Data
564,43.2294054,151.101.2.187,100.84.170.161,TLSv1.2,125,Application Data
565,43.2294486,100.84.170.161,151.101.2.187,TCP,54,64433  >  443 [ACK] Seq=289157 Ack=856908 Win=8208 Len=0
566,43.3398213,100.84.170.161,151.101.2.187,TLSv1.2,2472,Application Data
567,43.3400182,100.84.170.161,151.101.2.187,TLSv1.2,2466,Application Data
568,43.3401914,100.84.170.161,151.101.2.187,TLSv1.2,2469,Application Data
569,43.3405266,100.84.170.161,151.101.2.187,TLSv1.2,2463,Application Data
570,43.3496497,151.101.2.187,100.84.170.161,TCP,56,443  >  64433 [ACK] Seq=856908 Ack=291575 Win=5355 Len=0
571,43.3499152,151.101.2.187,100.84.170.161,TCP,56,443  >  64433 [ACK] Seq=856908 Ack=296402 Win=5378 Len=0
572,43.3502338,151.101.2.187,100.84.170.161,TCP,56,443  >  64433 [ACK] Seq=856908 Ack=298811 Win=5389 Len=0
573,43.3522252,151.101.2.187,100.84.170.161,TLSv1.2,178,Application Data
574,43.3531474,151.101.2.187,100.84.170.161,TLSv1.2,124,Application Data
575,43.353203,100.84.170.161,151.101.2.187,TCP,54,64433  >  443 [ACK] Seq=298811 Ack=857102 Win=8207 Len=0
576,43.3535142,151.101.2.187,100.84.170.161,TLSv1.2,240,Application Data
577,43.3913487,151.101.2.187,100.84.170.161,TCP,240,"[TCP Retransmission] 443  >  64433 [PSH, ACK] Seq=857102 Ack=298811 Win=5389 Len=186"
578,43.3913783,100.84.170.161,151.101.2.187,TCP,66,64433  >  443 [ACK] Seq=298811 Ack=857288 Win=8206 Len=0 SLE=857102 SRE=857288
579,43.6595796,100.84.170.161,151.101.66.187,TCP,55,50935  >  443 [ACK] Seq=1 Ack=1 Win=512 Len=1
580,43.6695905,151.101.66.187,100.84.170.161,TCP,66,443  >  50935 [ACK] Seq=1 Ack=2 Win=281 Len=0 SLE=1 SRE=2
581,47.0409482,100.84.170.161,151.101.2.187,TLSv1.2,2474,Application Data
582,47.0522072,151.101.2.187,100.84.170.161,TCP,56,443  >  64433 [ACK] Seq=857288 Ack=301231 Win=5400 Len=0
583,47.0533015,100.84.170.161,151.101.2.187,TLSv1.2,2462,Application Data
584,47.0559787,151.101.2.187,100.84.170.161,TLSv1.2,241,Application Data
585,47.05608,100.84.170.161,151.101.2.187,TCP,54,64433  >  443 [ACK] Seq=303639 Ack=857475 Win=8212 Len=0
586,47.0625876,151.101.2.187,100.84.170.161,TCP,56,443  >  64433 [ACK] Seq=857475 Ack=303639 Win=5412 Len=0
587,47.0903163,151.101.2.187,100.84.170.161,TLSv1.2,314,Application Data
588,47.0903755,100.84.170.161,151.101.2.187,TCP,54,64433  >  443 [ACK] Seq=303639 Ack=857735 Win=8211 Len=0
589,47.5468328,100.84.170.161,151.101.2.187,TLSv1.2,2474,Application Data
590,47.5561966,151.101.2.187,100.84.170.161,TCP,56,443  >  64433 [ACK] Seq=857735 Ack=306059 Win=5423 Len=0
591,47.5576208,100.84.170.161,151.101.2.187,TLSv1.2,2462,Application Data
592,47.5610375,151.101.2.187,100.84.170.161,TLSv1.2,214,Application Data
593,47.5668471,151.101.2.187,100.84.170.161,TCP,56,443  >  64433 [ACK] Seq=857895 Ack=308467 Win=5435 Len=0
594,47.5717058,151.101.2.187,100.84.170.161,TLSv1.2,125,Application Data
595,47.5717856,100.84.170.161,151.101.2.187,TCP,54,64433  >  443 [ACK] Seq=308467 Ack=857966 Win=8210 Len=0
596,48.5030715,100.84.170.161,151.101.2.187,TLSv1.2,2474,Application Data
597,48.5156547,151.101.2.187,100.84.170.161,TCP,56,443  >  64433 [ACK] Seq=857966 Ack=310887 Win=5446 Len=0
598,48.5188932,151.101.2.187,100.84.170.161,TLSv1.2,104,Application Data
599,48.5335259,100.84.170.161,151.101.2.187,TLSv1.2,2462,Application Data
600,48.5428554,151.101.2.187,100.84.170.161,TCP,56,443  >  64433 [ACK] Seq=858016 Ack=313295 Win=5452 Len=0
601,48.5457679,151.101.2.187,100.84.170.161,TLSv1.2,214,Application Data
602,48.5787161,151.101.2.187,100.84.170.161,TCP,214,"[TCP Retransmission] 443  >  64433 [PSH, ACK] Seq=858016 Ack=313295 Win=5452 Len=160"
603,48.57876,100.84.170.161,151.101.2.187,TCP,66,64433  >  443 [ACK] Seq=313295 Ack=858176 Win=8209 Len=0 SLE=858016 SRE=858176
604,49.0236579,100.84.170.161,151.101.2.187,TLSv1.2,2474,Application Data
605,49.0350212,151.101.2.187,100.84.170.161,TCP,56,443  >  64433 [ACK] Seq=858176 Ack=315715 Win=5458 Len=0
606,49.0408275,100.84.170.161,151.101.2.187,TLSv1.2,2462,Application Data
607,49.0507896,151.101.2.187,100.84.170.161,TCP,56,443  >  64433 [ACK] Seq=858176 Ack=318123 Win=5463 Len=0
608,49.0528924,151.101.2.187,100.84.170.161,TLSv1.2,98,Application Data
609,49.0555871,151.101.2.187,100.84.170.161,TLSv1.2,104,Application Data
610,49.0556761,100.84.170.161,151.101.2.187,TCP,54,64433  >  443 [ACK] Seq=318123 Ack=858270 Win=8209 Len=0
611,53.8132576,100.84.170.161,151.101.2.187,TLSv1.2,2477,Application Data
612,53.8168555,100.84.170.161,151.101.2.187,TLSv1.2,2465,Application Data
613,53.8172182,100.84.170.161,151.101.2.187,TLSv1.2,2459,Application Data
614,53.8199828,100.84.170.161,151.101.2.187,TLSv1.2,2478,Application Data
615,53.8250893,151.101.2.187,100.84.170.161,TCP,56,443  >  64433 [ACK] Seq=858270 Ack=320546 Win=5469 Len=0
616,53.8273642,151.101.2.187,100.84.170.161,TCP,56,443  >  64433 [ACK] Seq=858270 Ack=325362 Win=5484 Len=0
617,53.8279733,151.101.2.187,100.84.170.161,TLSv1.2,241,Application Data
618,53.8293077,151.101.2.187,100.84.170.161,TCP,56,443  >  64433 [ACK] Seq=858457 Ack=327786 Win=5490 Len=0
619,53.8296258,151.101.2.187,100.84.170.161,TLSv1.2,130,Application Data
620,53.8296668,100.84.170.161,151.101.2.187,TCP,54,64433  >  443 [ACK] Seq=327786 Ack=858533 Win=8208 Len=0
621,53.830671,151.101.2.187,100.84.170.161,TLSv1.2,130,Application Data
622,53.8312599,151.101.2.187,100.84.170.161,TLSv1.2,125,Application Data
623,53.8313051,100.84.170.161,151.101.2.187,TCP,54,64433  >  443 [ACK] Seq=327786 Ack=858680 Win=8207 Len=0
624,53.9423525,100.84.170.161,151.101.2.187,TLSv1.2,2481,Application Data
625,53.9531847,151.101.2.187,100.84.170.161,TCP,56,443  >  64433 [ACK] Seq=858680 Ack=330213 Win=5495 Len=0
626,53.9557848,151.101.2.187,100.84.170.161,TLSv1.2,130,Application Data
627,53.9850524,151.101.2.187,100.84.170.161,TCP,130,"[TCP Retransmission] 443  >  64433 [PSH, ACK] Seq=858680 Ack=330213 Win=5495 Len=76"
628,53.9850921,100.84.170.161,151.101.2.187,TCP,66,64433  >  443 [ACK] Seq=330213 Ack=858756 Win=8207 Len=0 SLE=858680 SRE=858756
629,54.2170965,100.84.170.161,151.101.2.187,TLSv1.2,2466,Application Data
630,54.217297,100.84.170.161,151.101.2.187,TLSv1.2,2469,Application Data
631,54.2174272,100.84.170.161,151.101.2.187,TLSv1.2,2463,Application Data
632,54.2178146,100.84.170.161,151.101.2.187,TLSv1.2,2460,Application Data
633,54.2275727,151.101.2.187,100.84.170.161,TCP,56,443  >  64433 [ACK] Seq=858756 Ack=332625 Win=5501 Len=0
634,54.2275727,151.101.2.187,100.84.170.161,TCP,56,443  >  64433 [ACK] Seq=858756 Ack=337449 Win=5513 Len=0
635,54.2281923,151.101.2.187,100.84.170.161,TCP,56,443  >  64433 [ACK] Seq=858756 Ack=339855 Win=5518 Len=0
636,54.2294405,151.101.2.187,100.84.170.161,TLSv1.2,124,Application Data
637,54.2297459,151.101.2.187,100.84.170.161,TLSv1.2,130,Application Data
638,54.22978,100.84.170.161,151.101.2.187,TCP,54,64433  >  443 [ACK] Seq=339855 Ack=858902 Win=8206 Len=0
639,54.2299942,151.101.2.187,100.84.170.161,TLSv1.2,124,Application Data
640,54.2306942,151.101.2.187,100.84.170.161,TLSv1.2,340,Application Data
641,54.2307442,100.84.170.161,151.101.2.187,TCP,54,64433  >  443 [ACK] Seq=339855 Ack=859258 Win=8212 Len=0
642,54.4440254,100.84.170.161,151.101.2.187,TLSv1.2,2475,Application Data
643,54.4518564,100.84.170.161,151.101.2.187,TLSv1.2,2463,Application Data
644,54.4556575,151.101.2.187,100.84.170.161,TCP,56,443  >  64433 [ACK] Seq=859258 Ack=342276 Win=5524 Len=0
645,54.4583438,151.101.2.187,100.84.170.161,TLSv1.2,131,Application Data
646,54.4615276,151.101.2.187,100.84.170.161,TCP,56,443  >  64433 [ACK] Seq=859335 Ack=344685 Win=5530 Len=0
647,54.4639562,151.101.2.187,100.84.170.161,TLSv1.2,131,Application Data
648,54.464039,100.84.170.161,151.101.2.187,TCP,54,64433  >  443 [ACK] Seq=344685 Ack=859412 Win=8211 Len=0
649,54.8602978,100.84.170.161,151.101.2.187,TLSv1.2,2478,Application Data
650,54.8699448,151.101.2.187,100.84.170.161,TCP,56,443  >  64433 [ACK] Seq=859412 Ack=347109 Win=5535 Len=0
651,54.8726375,151.101.2.187,100.84.170.161,TLSv1.2,208,Application Data
652,54.8796166,100.84.170.161,151.101.2.187,TLSv1.2,2477,Application Data
653,54.8818328,100.84.170.161,151.101.2.187,TLSv1.2,2475,Application Data
654,54.8889494,151.101.2.187,100.84.170.161,TCP,56,443  >  64433 [ACK] Seq=859566 Ack=349532 Win=5541 Len=0
655,54.8912057,151.101.2.187,100.84.170.161,TCP,56,443  >  64433 [ACK] Seq=859566 Ack=351953 Win=5547 Len=0
656,54.8923797,151.101.2.187,100.84.170.161,TLSv1.2,98,Application Data
657,54.893484,151.101.2.187,100.84.170.161,TLSv1.2,98,Application Data
658,54.8935446,100.84.170.161,151.101.2.187,TCP,54,64433  >  443 [ACK] Seq=351953 Ack=859654 Win=8210 Len=0
659,55.1151938,100.84.170.161,151.101.2.187,TLSv1.2,2465,Application Data
660,55.1175195,100.84.170.161,151.101.2.187,TLSv1.2,2459,Application Data
661,55.1261532,151.101.2.187,100.84.170.161,TCP,56,443  >  64433 [ACK] Seq=859654 Ack=354364 Win=5552 Len=0
662,55.1267316,151.101.2.187,100.84.170.161,TCP,56,443  >  64433 [ACK] Seq=859654 Ack=356769 Win=5558 Len=0
663,55.1283544,151.101.2.187,100.84.170.161,TLSv1.2,104,Application Data
664,55.1286502,151.101.2.187,100.84.170.161,TLSv1.2,104,Application Data
665,55.1286864,100.84.170.161,151.101.2.187,TCP,54,64433  >  443 [ACK] Seq=356769 Ack=859754 Win=8210 Len=0
666,55.2813922,100.84.170.161,151.101.2.187,TLSv1.2,2481,Application Data
667,55.2924972,151.101.2.187,100.84.170.161,TCP,56,443  >  64433 [ACK] Seq=859754 Ack=359196 Win=5564 Len=0
668,55.2950291,151.101.2.187,100.84.170.161,TLSv1.2,104,Application Data
669,55.3138043,100.84.170.161,151.101.2.187,TLSv1.2,2472,Application Data
670,55.3234266,151.101.2.187,100.84.170.161,TCP,56,443  >  64433 [ACK] Seq=859804 Ack=361614 Win=5570 Len=0
671,55.3257366,151.101.2.187,100.84.170.161,TLSv1.2,130,Application Data
672,55.3600695,151.101.2.187,100.84.170.161,TCP,130,"[TCP Retransmission] 443  >  64433 [PSH, ACK] Seq=859804 Ack=361614 Win=5570 Len=76"
673,55.3601072,100.84.170.161,151.101.2.187,TCP,66,64433  >  443 [ACK] Seq=361614 Ack=859880 Win=8210 Len=0 SLE=859804 SRE=859880
674,55.6380771,100.84.170.161,151.101.2.187,TLSv1.2,2479,Application Data
675,55.6549613,151.101.2.187,100.84.170.161,TCP,56,443  >  64433 [ACK] Seq=859880 Ack=364039 Win=5575 Len=0
676,55.6554022,151.101.2.187,100.84.170.161,TLSv1.2,240,Application Data
677,55.6622976,100.84.170.161,151.101.2.187,TLSv1.2,2480,Application Data
678,55.6649982,100.84.170.161,151.101.2.187,TLSv1.2,2470,Application Data
679,55.6657148,100.84.170.161,151.101.2.187,TLSv1.2,2473,Application Data
680,55.668135,100.84.170.161,151.101.2.187,TLSv1.2,2467,Application Data
681,55.6683178,100.84.170.161,151.101.2.187,TLSv1.2,2464,Application Data
682,55.6720266,151.101.2.187,100.84.170.161,TCP,56,443  >  64433 [ACK] Seq=860066 Ack=366465 Win=5581 Len=0
683,55.6745864,151.101.2.187,100.84.170.161,TLSv1.2,130,Application Data
684,55.6749124,151.101.2.187,100.84.170.161,TCP,56,443  >  64433 [ACK] Seq=860142 Ack=368881 Win=5587 Len=0
685,55.6756935,151.101.2.187,100.84.170.161,TCP,56,443  >  64433 [ACK] Seq=860142 Ack=371300 Win=5592 Len=0
686,55.6768176,151.101.2.187,100.84.170.161,TLSv1.2,104,Application Data
687,55.6768755,100.84.170.161,151.101.2.187,TCP,54,64433  >  443 [ACK] Seq=376123 Ack=860192 Win=8208 Len=0
688,55.6780843,151.101.2.187,100.84.170.161,TLSv1.2,98,Application Data
689,55.6803813,151.101.2.187,100.84.170.161,TLSv1.2,98,Application Data
690,55.6804426,100.84.170.161,151.101.2.187,TCP,54,64433  >  443 [ACK] Seq=376123 Ack=860280 Win=8208 Len=0
691,55.6806934,151.101.2.187,100.84.170.161,TLSv1.2,104,Application Data
692,55.722927,151.101.2.187,100.84.170.161,TCP,104,"[TCP Retransmission] 443  >  64433 [PSH, ACK] Seq=860280 Ack=376123 Win=5604 Len=50"
693,55.7229668,100.84.170.161,151.101.2.187,TCP,66,64433  >  443 [ACK] Seq=376123 Ack=860330 Win=8208 Len=0 SLE=860280 SRE=860330
694,55.832904,100.84.170.161,151.101.2.187,TLSv1.2,2475,Application Data
695,55.8429674,100.84.170.161,151.101.2.187,TLSv1.2,2463,Application Data
696,55.843937,151.101.2.187,100.84.170.161,TCP,56,443  >  64433 [ACK] Seq=860330 Ack=378544 Win=5609 Len=0
697,55.846534,151.101.2.187,100.84.170.161,TLSv1.2,98,Application Data
698,55.852201,151.101.2.187,100.84.170.161,TCP,56,443  >  64433 [ACK] Seq=860374 Ack=380953 Win=5615 Len=0
699,55.8548934,151.101.2.187,100.84.170.161,TLSv1.2,104,Application Data
700,55.8549569,100.84.170.161,151.101.2.187,TCP,54,64433  >  443 [ACK] Seq=380953 Ack=860424 Win=8207 Len=0
701,55.9994513,100.84.170.161,151.101.2.187,TLSv1.2,2476,Application Data
702,56.0109176,151.101.2.187,100.84.170.161,TCP,56,443  >  64433 [ACK] Seq=860424 Ack=383375 Win=5621 Len=0
703,56.0282997,151.101.2.187,100.84.170.161,TLSv1.2,98,Application Data
704,56.0617611,151.101.2.187,100.84.170.161,TCP,98,"[TCP Retransmission] 443  >  64433 [PSH, ACK] Seq=860424 Ack=383375 Win=5621 Len=44"
705,56.0618317,100.84.170.161,151.101.2.187,TCP,66,64433  >  443 [ACK] Seq=383375 Ack=860468 Win=8207 Len=0 SLE=860424 SRE=860468
706,59.8162915,100.84.170.161,151.101.2.187,TLSv1.2,2475,Application Data
707,59.8277643,151.101.2.187,100.84.170.161,TCP,56,443  >  64433 [ACK] Seq=860468 Ack=385796 Win=5627 Len=0
708,59.8298455,151.101.2.187,100.84.170.161,TLSv1.2,214,Application Data
709,59.8369308,100.84.170.161,151.101.2.187,TLSv1.2,2463,Application Data
710,59.8467557,151.101.2.187,100.84.170.161,TCP,56,443  >  64433 [ACK] Seq=860628 Ack=388205 Win=5632 Len=0
711,59.849246,151.101.2.187,100.84.170.161,TLSv1.2,148,Application Data
712,59.8736725,100.84.170.161,151.101.2.187,TLSv1.2,2477,Application Data
713,59.8826489,151.101.2.187,100.84.170.161,TCP,148,"[TCP Spurious Retransmission] 443  >  64433 [PSH, ACK] Seq=860628 Ack=388205 Win=5632 Len=94"
714,59.8826873,100.84.170.161,151.101.2.187,TCP,66,[TCP Dup ACK 712#1] 64433  >  443 [ACK] Seq=390628 Ack=860722 Win=8212 Len=0 SLE=860628 SRE=860722
715,59.8829324,151.101.2.187,100.84.170.161,TCP,56,443  >  64433 [ACK] Seq=860722 Ack=390628 Win=5638 Len=0
716,59.8859151,151.101.2.187,100.84.170.161,TLSv1.2,270,Application Data
717,59.9205861,151.101.2.187,100.84.170.161,TCP,270,"[TCP Retransmission] 443  >  64433 [PSH, ACK] Seq=860722 Ack=390628 Win=5638 Len=216"
718,59.9206239,100.84.170.161,151.101.2.187,TCP,66,64433  >  443 [ACK] Seq=390628 Ack=860938 Win=8211 Len=0 SLE=860722 SRE=860938
