No.,Time,Source,Destination,Protocol,Length,Info
1,0.0,172.20.40.110,151.101.130.187,TLSv1.2,2794,Application Data
2,0.0001879,172.20.40.110,151.101.130.187,TLSv1.2,93,Application Data
3,0.0144432,151.101.130.187,172.20.40.110,TCP,60,443  >  62995 [ACK] Seq=1 Ack=2741 Win=5859 Len=0
4,0.0144432,151.101.130.187,172.20.40.110,TCP,60,443  >  62995 [ACK] Seq=1 Ack=2780 Win=5859 Len=0
5,0.0144432,151.101.130.187,172.20.40.110,TLSv1.2,93,Application Data
6,0.0144715,172.20.40.110,151.101.130.187,TLSv1.2,2794,Application Data
7,0.0232289,151.101.130.187,172.20.40.110,TLSv1.2,241,Application Data
8,0.0246092,151.101.130.187,172.20.40.110,TCP,60,443  >  62995 [ACK] Seq=227 Ack=5520 Win=5870 Len=0
9,0.0289135,172.20.40.110,151.101.130.187,TLSv1.2,2806,Application Data
10,0.0292937,151.101.130.187,172.20.40.110,TLSv1.2,131,Application Data
11,0.0479826,151.101.130.187,172.20.40.110,TCP,60,443  >  62995 [ACK] Seq=304 Ack=8272 Win=5876 Len=0
12,0.0511742,151.101.130.187,172.20.40.110,TLSv1.2,131,Application Data
13,0.0512492,172.20.40.110,151.101.130.187,TCP,54,62995  >  443 [ACK] Seq=8272 Ack=381 Win=508 Len=0
14,0.17963,172.20.40.110,151.101.130.187,TLSv1.2,2811,Application Data
15,0.190042,151.101.130.187,172.20.40.110,TCP,60,443  >  62995 [ACK] Seq=381 Ack=11029 Win=5886 Len=0
16,0.1933325,151.101.130.187,172.20.40.110,TLSv1.2,214,Application Data
17,0.2340289,151.101.130.187,172.20.40.110,TCP,214,"[TCP Retransmission] 443  >  62995 [PSH, ACK] Seq=381 Ack=11029 Win=5886 Len=160"
18,0.2341355,172.20.40.110,151.101.130.187,TCP,66,62995  >  443 [ACK] Seq=11029 Ack=541 Win=508 Len=0 SLE=381 SRE=541
19,1.9889211,172.20.40.110,151.101.130.187,TLSv1.2,2787,Application Data
20,1.9926548,172.20.40.110,151.101.130.187,TLSv1.2,2789,Application Data
21,2.0000128,151.101.130.187,172.20.40.110,TCP,60,443  >  62995 [ACK] Seq=541 Ack=13762 Win=5897 Len=0
22,2.0019515,172.20.40.110,151.101.130.187,TLSv1.2,2783,Application Data
23,2.0020146,151.101.130.187,172.20.40.110,TLSv1.2,372,Application Data
24,2.0022212,172.20.40.110,151.101.130.187,TLSv1.2,2785,Application Data
25,2.0036146,151.101.130.187,172.20.40.110,TCP,60,443  >  62995 [ACK] Seq=859 Ack=16497 Win=5908 Len=0
26,2.0074818,151.101.130.187,172.20.40.110,TLSv1.2,131,Application Data
27,2.0139259,151.101.130.187,172.20.40.110,TCP,60,443  >  62995 [ACK] Seq=936 Ack=19226 Win=5918 Len=0
28,2.0139259,151.101.130.187,172.20.40.110,TCP,60,443  >  62995 [ACK] Seq=936 Ack=21957 Win=5929 Len=0
29,2.0155979,172.20.40.110,151.101.130.187,TLSv1.2,2783,Application Data
30,2.0176021,151.101.130.187,172.20.40.110,TLSv1.2,132,Application Data
31,2.0176021,151.101.130.187,172.20.40.110,TLSv1.2,207,Application Data
32,2.0176876,172.20.40.110,151.101.130.187,TCP,54,62995  >  443 [ACK] Seq=24686 Ack=1167 Win=512 Len=0
33,2.0266426,172.20.40.110,151.101.130.187,TLSv1.2,2781,Application Data
34,2.0282985,151.101.130.187,172.20.40.110,TCP,60,443  >  62995 [ACK] Seq=1167 Ack=24686 Win=5940 Len=0
35,2.0307647,151.101.130.187,172.20.40.110,TLSv1.2,130,Application Data
36,2.0371437,151.101.130.187,172.20.40.110,TCP,60,443  >  62995 [ACK] Seq=1243 Ack=27413 Win=5950 Len=0
37,2.0414929,151.101.130.187,172.20.40.110,TLSv1.2,130,Application Data
38,2.0415759,172.20.40.110,151.101.130.187,TCP,54,62995  >  443 [ACK] Seq=27413 Ack=1319 Win=511 Len=0
39,2.0692083,172.20.40.110,151.101.130.187,TLSv1.2,2783,Application Data
40,2.0798502,151.101.130.187,172.20.40.110,TCP,60,443  >  62995 [ACK] Seq=1319 Ack=30142 Win=5961 Len=0
41,2.0814457,151.101.130.187,172.20.40.110,TLSv1.2,234,Application Data
42,2.1190126,151.101.130.187,172.20.40.110,TCP,234,"[TCP Retransmission] 443  >  62995 [PSH, ACK] Seq=1319 Ack=30142 Win=5961 Len=180"
43,2.1191381,172.20.40.110,151.101.130.187,TCP,66,62995  >  443 [ACK] Seq=30142 Ack=1499 Win=510 Len=0 SLE=1319 SRE=1499
44,2.6153577,172.20.40.110,151.101.130.187,TLSv1.2,2783,Application Data
45,2.627222,151.101.130.187,172.20.40.110,TCP,60,443  >  62995 [ACK] Seq=1499 Ack=32871 Win=5967 Len=0
46,2.6315445,151.101.130.187,172.20.40.110,TLSv1.2,131,Application Data
47,2.6656198,151.101.130.187,172.20.40.110,TCP,131,"[TCP Retransmission] 443  >  62995 [PSH, ACK] Seq=1499 Ack=32871 Win=5967 Len=77"
48,2.665669,172.20.40.110,151.101.130.187,TCP,66,62995  >  443 [ACK] Seq=32871 Ack=1576 Win=510 Len=0 SLE=1499 SRE=1576
49,4.9259191,172.20.40.110,151.101.130.187,TLSv1.2,2799,Application Data
50,4.9263284,172.20.40.110,151.101.130.187,TLSv1.2,2787,Application Data
51,4.9294823,172.20.40.110,151.101.130.187,TLSv1.2,2781,Application Data
52,4.9328058,172.20.40.110,151.101.130.187,TLSv1.2,2800,Application Data
53,4.9379414,151.101.130.187,172.20.40.110,TCP,60,443  >  62995 [ACK] Seq=1576 Ack=35616 Win=5977 Len=0
54,4.9379414,151.101.130.187,172.20.40.110,TCP,60,443  >  62995 [ACK] Seq=1576 Ack=38349 Win=5988 Len=0
55,4.9403871,151.101.130.187,172.20.40.110,TCP,60,443  >  62995 [ACK] Seq=1576 Ack=41076 Win=5999 Len=0
56,4.9415519,151.101.130.187,172.20.40.110,TLSv1.2,240,Application Data
57,4.9427847,151.101.130.187,172.20.40.110,TLSv1.2,130,Application Data
58,4.9427847,151.101.130.187,172.20.40.110,TLSv1.2,131,Application Data
59,4.9427847,151.101.130.187,172.20.40.110,TCP,60,443  >  62995 [ACK] Seq=1915 Ack=43822 Win=6009 Len=0
60,4.9429261,172.20.40.110,151.101.130.187,TCP,54,62995  >  443 [ACK] Seq=43822 Ack=1915 Win=509 Len=0
61,4.9491782,151.101.130.187,172.20.40.110,TLSv1.2,264,Application Data
62,4.949279,172.20.40.110,151.101.130.187,TCP,54,62995  >  443 [ACK] Seq=43822 Ack=2125 Win=508 Len=0
63,5.1193613,172.20.40.110,151.101.130.187,TLSv1.2,2803,Application Data
64,5.1306122,151.101.130.187,172.20.40.110,TCP,60,443  >  62995 [ACK] Seq=2125 Ack=46571 Win=6020 Len=0
65,5.1360791,151.101.130.187,172.20.40.110,TLSv1.2,239,Application Data
66,5.1693891,151.101.130.187,172.20.40.110,TCP,239,"[TCP Retransmission] 443  >  62995 [PSH, ACK] Seq=2125 Ack=46571 Win=6020 Len=185"
67,5.1694454,172.20.40.110,151.101.130.187,TCP,66,62995  >  443 [ACK] Seq=46571 Ack=2310 Win=507 Len=0 SLE=2125 SRE=2310
68,5.2154767,172.20.40.110,151.101.130.187,TLSv1.2,2791,Application Data
69,5.2275907,151.101.130.187,172.20.40.110,TCP,60,443  >  62995 [ACK] Seq=2310 Ack=49308 Win=6031 Len=0
70,5.2302667,151.101.130.187,172.20.40.110,TLSv1.2,207,Application Data
71,5.2669814,151.101.130.187,172.20.40.110,TCP,207,"[TCP Retransmission] 443  >  62995 [PSH, ACK] Seq=2310 Ack=49308 Win=6031 Len=153"
72,5.2671544,172.20.40.110,151.101.130.187,TCP,66,62995  >  443 [ACK] Seq=49308 Ack=2463 Win=507 Len=0 SLE=2310 SRE=2463
73,5.2703727,172.20.40.110,151.101.130.187,TLSv1.2,2801,Application Data
74,5.2710941,172.20.40.110,151.101.130.187,TLSv1.2,2798,Application Data
75,5.2712539,172.20.40.110,151.101.130.187,TLSv1.2,2795,Application Data
76,5.2792897,151.101.130.187,172.20.40.110,TCP,60,443  >  62995 [ACK] Seq=2463 Ack=52055 Win=6042 Len=0
77,5.2817725,151.101.130.187,172.20.40.110,TLSv1.2,129,Application Data
78,5.2830034,151.101.130.187,172.20.40.110,TCP,60,443  >  62995 [ACK] Seq=2538 Ack=54799 Win=6052 Len=0
79,5.2830034,151.101.130.187,172.20.40.110,TCP,60,443  >  62995 [ACK] Seq=2538 Ack=57540 Win=6063 Len=0
80,5.2851403,151.101.130.187,172.20.40.110,TLSv1.2,184,Application Data
81,5.2852232,172.20.40.110,151.101.130.187,TCP,54,62995  >  443 [ACK] Seq=57540 Ack=2668 Win=512 Len=0
82,5.3071592,172.20.40.110,151.101.130.187,TLSv1.2,2785,Application Data
83,5.3162847,151.101.130.187,172.20.40.110,TCP,60,443  >  62995 [ACK] Seq=2668 Ack=60271 Win=6074 Len=0
84,5.3168165,172.20.40.110,151.101.130.187,TLSv1.2,2785,Application Data
85,5.3231117,151.101.130.187,172.20.40.110,TLSv1.2,131,Application Data
86,5.325222,151.101.130.187,172.20.40.110,TCP,60,443  >  62995 [ACK] Seq=2745 Ack=63002 Win=6084 Len=0
87,5.3286539,151.101.130.187,172.20.40.110,TLSv1.2,131,Application Data
88,5.3287287,172.20.40.110,151.101.130.187,TCP,54,62995  >  443 [ACK] Seq=63002 Ack=2822 Win=511 Len=0
89,5.3821935,172.20.40.110,151.101.130.187,TLSv1.2,2797,Application Data
90,5.3915271,151.101.130.187,172.20.40.110,TCP,60,443  >  62995 [ACK] Seq=2822 Ack=65745 Win=6095 Len=0
91,5.3958621,151.101.130.187,172.20.40.110,TLSv1.2,125,Application Data
92,5.4258243,151.101.130.187,172.20.40.110,TCP,125,"[TCP Retransmission] 443  >  62995 [PSH, ACK] Seq=2822 Ack=65745 Win=6095 Len=71"
93,5.4258811,172.20.40.110,151.101.130.187,TCP,66,62995  >  443 [ACK] Seq=65745 Ack=2893 Win=511 Len=0 SLE=2822 SRE=2893
94,6.8090831,172.20.40.110,151.101.130.187,TLSv1.2,2763,Application Data
95,6.8113221,172.20.40.110,151.101.130.187,TLSv1.2,2761,Application Data
96,6.8208725,151.101.130.187,172.20.40.110,TCP,60,443  >  62995 [ACK] Seq=2893 Ack=68454 Win=6106 Len=0
97,6.8247407,151.101.130.187,172.20.40.110,TLSv1.2,214,Application Data
98,6.8247407,151.101.130.187,172.20.40.110,TCP,60,443  >  62995 [ACK] Seq=3053 Ack=71161 Win=6111 Len=0
99,6.8247407,151.101.130.187,172.20.40.110,TLSv1.2,104,Application Data
100,6.8248262,172.20.40.110,151.101.130.187,TCP,54,62995  >  443 [ACK] Seq=71161 Ack=3103 Win=510 Len=0
101,7.0348406,172.20.40.110,151.101.130.187,TLSv1.2,2764,Application Data
102,7.0525087,151.101.130.187,172.20.40.110,TCP,60,443  >  62995 [ACK] Seq=3103 Ack=73871 Win=6122 Len=0
103,7.0525087,151.101.130.187,172.20.40.110,TLSv1.2,104,Application Data
104,7.0804723,151.101.130.187,172.20.40.110,TCP,104,"[TCP Retransmission] 443  >  62995 [PSH, ACK] Seq=3103 Ack=73871 Win=6122 Len=50"
105,7.0805302,172.20.40.110,151.101.130.187,TCP,66,62995  >  443 [ACK] Seq=73871 Ack=3153 Win=510 Len=0 SLE=3103 SRE=3153
106,15.8010651,172.20.40.110,151.101.130.187,TLSv1.2,2758,Application Data
107,15.8135808,151.101.130.187,172.20.40.110,TCP,60,443  >  62995 [ACK] Seq=3153 Ack=76575 Win=6133 Len=0
108,15.8154314,151.101.130.187,172.20.40.110,TLSv1.2,374,Application Data
109,15.847305,151.101.130.187,172.20.40.110,TCP,374,"[TCP Retransmission] 443  >  62995 [PSH, ACK] Seq=3153 Ack=76575 Win=6133 Len=320"
110,15.847393,172.20.40.110,151.101.130.187,TCP,66,62995  >  443 [ACK] Seq=76575 Ack=3473 Win=508 Len=0 SLE=3153 SRE=3473
111,16.0236385,172.20.40.110,151.101.130.187,TLSv1.2,2749,Application Data
112,16.0328012,151.101.130.187,172.20.40.110,TCP,60,443  >  62995 [ACK] Seq=3473 Ack=79270 Win=6143 Len=0
113,16.0372452,151.101.130.187,172.20.40.110,TLSv1.2,104,Application Data
114,16.0701022,151.101.130.187,172.20.40.110,TCP,104,"[TCP Retransmission] 443  >  62995 [PSH, ACK] Seq=3473 Ack=79270 Win=6143 Len=50"
115,16.0702631,172.20.40.110,151.101.130.187,TCP,66,62995  >  443 [ACK] Seq=79270 Ack=3523 Win=508 Len=0 SLE=3473 SRE=3523
116,22.713492,172.20.40.110,151.101.2.187,TCP,55,54874  >  443 [ACK] Seq=1 Ack=1 Win=256 Len=1
117,22.7243622,151.101.2.187,172.20.40.110,TCP,66,443  >  54874 [ACK] Seq=1 Ack=2 Win=282 Len=0 SLE=1 SRE=2
118,30.4359211,172.20.40.110,151.101.130.187,TLSv1.2,2755,Application Data
119,30.4360298,172.20.40.110,151.101.130.187,TLSv1.2,93,Application Data
120,30.4464513,151.101.130.187,172.20.40.110,TCP,60,443  >  62995 [ACK] Seq=3523 Ack=81971 Win=6154 Len=0
121,30.4464513,151.101.130.187,172.20.40.110,TCP,60,443  >  62995 [ACK] Seq=3523 Ack=82010 Win=6154 Len=0
122,30.4464513,151.101.130.187,172.20.40.110,TLSv1.2,93,Application Data
123,30.4495072,172.20.40.110,151.101.130.187,TLSv1.2,2751,Application Data
124,30.4496894,151.101.130.187,172.20.40.110,TLSv1.2,239,Application Data
125,30.453326,172.20.40.110,151.101.130.187,TLSv1.2,2753,Application Data
126,30.4594865,172.20.40.110,151.101.130.187,TLSv1.2,2757,Application Data
127,30.4611867,151.101.130.187,172.20.40.110,TCP,60,443  >  62995 [ACK] Seq=3747 Ack=84707 Win=6159 Len=0
128,30.464576,151.101.130.187,172.20.40.110,TLSv1.2,209,Application Data
129,30.4649966,151.101.130.187,172.20.40.110,TCP,60,443  >  62995 [ACK] Seq=3902 Ack=87406 Win=6170 Len=0
130,30.4686073,151.101.130.187,172.20.40.110,TLSv1.2,130,Application Data
131,30.4686936,172.20.40.110,151.101.130.187,TCP,54,62995  >  443 [ACK] Seq=90109 Ack=3978 Win=506 Len=0
132,30.4700425,151.101.130.187,172.20.40.110,TCP,60,443  >  62995 [ACK] Seq=3978 Ack=90109 Win=6180 Len=0
133,30.4730287,151.101.130.187,172.20.40.110,TLSv1.2,131,Application Data
134,30.4833435,172.20.40.110,151.101.130.187,TLSv1.2,2751,Application Data
135,30.485309,172.20.40.110,151.101.130.187,TLSv1.2,2753,Application Data
136,30.4870835,172.20.40.110,151.101.130.187,TLSv1.2,2749,Application Data
137,30.4920378,151.101.130.187,172.20.40.110,TCP,60,443  >  62995 [ACK] Seq=4055 Ack=92806 Win=6191 Len=0
138,30.4942614,151.101.130.187,172.20.40.110,TCP,60,443  >  62995 [ACK] Seq=4055 Ack=95505 Win=6201 Len=0
139,30.4964165,151.101.130.187,172.20.40.110,TCP,60,443  >  62995 [ACK] Seq=4055 Ack=98200 Win=6212 Len=0
140,30.4964165,151.101.130.187,172.20.40.110,TLSv1.2,130,Application Data
141,30.498684,151.101.130.187,172.20.40.110,TLSv1.2,98,Application Data
142,30.498684,151.101.130.187,172.20.40.110,TLSv1.2,130,Application Data
143,30.4987662,172.20.40.110,151.101.130.187,TCP,54,62995  >  443 [ACK] Seq=98200 Ack=4251 Win=511 Len=0
144,30.5161523,172.20.40.110,151.101.130.187,TLSv1.2,2755,Application Data
145,30.5249839,151.101.130.187,172.20.40.110,TCP,60,443  >  62995 [ACK] Seq=4251 Ack=100901 Win=6223 Len=0
146,30.5283803,151.101.130.187,172.20.40.110,TLSv1.2,103,Application Data
147,30.5394005,172.20.40.110,151.101.130.187,TLSv1.2,2751,Application Data
148,30.5415166,172.20.40.110,151.101.130.187,TLSv1.2,2757,Application Data
149,30.5490882,172.20.40.110,151.101.130.187,TLSv1.2,2753,Application Data
150,30.5520005,151.101.130.187,172.20.40.110,TCP,60,443  >  62995 [ACK] Seq=4300 Ack=103598 Win=6233 Len=0
151,30.5520005,151.101.130.187,172.20.40.110,TCP,60,443  >  62995 [ACK] Seq=4300 Ack=106301 Win=6244 Len=0
152,30.5529577,151.101.130.187,172.20.40.110,TLSv1.2,142,"Application Data, Application Data"
153,30.5530758,172.20.40.110,151.101.130.187,TCP,54,62995  >  443 [ACK] Seq=109000 Ack=4388 Win=510 Len=0
154,30.5593882,151.101.130.187,172.20.40.110,TCP,60,443  >  62995 [ACK] Seq=4388 Ack=109000 Win=6254 Len=0
155,30.5618981,151.101.130.187,172.20.40.110,TLSv1.2,98,Application Data
156,30.5748114,172.20.40.110,151.101.130.187,TLSv1.2,2751,Application Data
157,30.5778619,172.20.40.110,151.101.130.187,TLSv1.2,2749,Application Data
158,30.5835858,151.101.130.187,172.20.40.110,TCP,60,443  >  62995 [ACK] Seq=4432 Ack=111697 Win=6265 Len=0
159,30.5868618,151.101.130.187,172.20.40.110,TLSv1.2,98,Application Data
160,30.5868618,151.101.130.187,172.20.40.110,TCP,60,443  >  62995 [ACK] Seq=4476 Ack=114392 Win=6275 Len=0
161,30.5888652,151.101.130.187,172.20.40.110,TLSv1.2,98,Application Data
162,30.5889417,172.20.40.110,151.101.130.187,TCP,54,62995  >  443 [ACK] Seq=114392 Ack=4520 Win=510 Len=0
163,30.8249736,172.20.40.110,151.101.130.187,TLSv1.2,2751,Application Data
164,30.8340272,151.101.130.187,172.20.40.110,TCP,60,443  >  62995 [ACK] Seq=4520 Ack=117089 Win=6286 Len=0
165,30.8374374,151.101.130.187,172.20.40.110,TLSv1.2,124,Application Data
166,30.8704551,151.101.130.187,172.20.40.110,TCP,124,"[TCP Retransmission] 443  >  62995 [PSH, ACK] Seq=4520 Ack=117089 Win=6286 Len=70"
167,30.8705325,172.20.40.110,151.101.130.187,TCP,66,62995  >  443 [ACK] Seq=117089 Ack=4590 Win=510 Len=0 SLE=4520 SRE=4590
168,31.0828564,172.20.40.110,151.101.130.187,TLSv1.2,2751,Application Data
169,31.0939098,151.101.130.187,172.20.40.110,TCP,60,443  >  62995 [ACK] Seq=4590 Ack=119786 Win=6296 Len=0
170,31.0977466,151.101.130.187,172.20.40.110,TLSv1.2,241,Application Data
171,31.1292746,151.101.130.187,172.20.40.110,TCP,241,"[TCP Retransmission] 443  >  62995 [PSH, ACK] Seq=4590 Ack=119786 Win=6296 Len=187"
172,31.1293319,172.20.40.110,151.101.130.187,TCP,66,62995  >  443 [ACK] Seq=119786 Ack=4777 Win=509 Len=0 SLE=4590 SRE=4777
173,31.2496835,172.20.40.110,151.101.66.187,TCP,55,56717  >  443 [ACK] Seq=1 Ack=1 Win=254 Len=1
174,31.2661406,151.101.66.187,172.20.40.110,TCP,66,443  >  56717 [ACK] Seq=1 Ack=2 Win=198 Len=0 SLE=1 SRE=2
175,31.8402968,172.20.40.110,151.101.130.187,TLSv1.2,2797,Application Data
176,31.85093,151.101.130.187,172.20.40.110,TCP,60,443  >  62995 [ACK] Seq=4777 Ack=122529 Win=6307 Len=0
177,31.851851,172.20.40.110,151.101.130.187,TLSv1.2,2782,Application Data
178,31.8531146,172.20.40.110,151.101.130.187,TLSv1.2,2788,Application Data
179,31.854321,151.101.130.187,172.20.40.110,TLSv1.2,131,Application Data
180,31.8617013,151.101.130.187,172.20.40.110,TCP,60,443  >  62995 [ACK] Seq=4854 Ack=125257 Win=6318 Len=0
181,31.8630486,151.101.130.187,172.20.40.110,TCP,60,443  >  62995 [ACK] Seq=4854 Ack=127991 Win=6328 Len=0
182,31.8641762,151.101.130.187,172.20.40.110,TLSv1.2,263,Application Data
183,31.8642471,172.20.40.110,151.101.130.187,TCP,54,62995  >  443 [ACK] Seq=127991 Ack=5063 Win=508 Len=0
184,31.8663126,151.101.130.187,172.20.40.110,TLSv1.2,130,Application Data
185,31.9054261,151.101.130.187,172.20.40.110,TCP,130,"[TCP Retransmission] 443  >  62995 [PSH, ACK] Seq=5063 Ack=127991 Win=6328 Len=76"
186,31.9054803,172.20.40.110,151.101.130.187,TCP,66,62995  >  443 [ACK] Seq=127991 Ack=5139 Win=507 Len=0 SLE=5063 SRE=5139
187,31.9141314,172.20.40.110,151.101.130.187,TLSv1.2,2782,Application Data
188,31.9245757,151.101.130.187,172.20.40.110,TCP,60,443  >  62995 [ACK] Seq=5139 Ack=130719 Win=6339 Len=0
189,31.9270092,151.101.130.187,172.20.40.110,TLSv1.2,104,Application Data
190,31.9603729,151.101.130.187,172.20.40.110,TCP,104,"[TCP Retransmission] 443  >  62995 [PSH, ACK] Seq=5139 Ack=130719 Win=6339 Len=50"
191,31.9604386,172.20.40.110,151.101.130.187,TCP,66,62995  >  443 [ACK] Seq=130719 Ack=5189 Win=507 Len=0 SLE=5139 SRE=5189
192,32.062381,172.20.40.110,151.101.130.187,TLSv1.2,2779,Application Data
193,32.0726047,151.101.130.187,172.20.40.110,TCP,60,443  >  62995 [ACK] Seq=5189 Ack=133444 Win=6350 Len=0
194,32.0758317,151.101.130.187,172.20.40.110,TLSv1.2,241,Application Data
195,32.0772239,172.20.40.110,151.101.130.187,TLSv1.2,2796,Application Data
196,32.0935015,151.101.130.187,172.20.40.110,TCP,60,443  >  62995 [ACK] Seq=5376 Ack=136186 Win=6360 Len=0
197,32.0935015,151.101.130.187,172.20.40.110,TLSv1.2,207,Application Data
198,32.1154511,172.20.40.110,151.101.130.187,TLSv1.2,2796,Application Data
199,32.1225893,151.101.130.187,172.20.40.110,TCP,207,"[TCP Spurious Retransmission] 443  >  62995 [PSH, ACK] Seq=5376 Ack=136186 Win=6360 Len=153"
200,32.1226476,172.20.40.110,151.101.130.187,TCP,66,[TCP Dup ACK 198#1] 62995  >  443 [ACK] Seq=138928 Ack=5529 Win=512 Len=0 SLE=5376 SRE=5529
201,32.1260591,151.101.130.187,172.20.40.110,TCP,60,443  >  62995 [ACK] Seq=5529 Ack=138928 Win=6371 Len=0
202,32.128425,151.101.130.187,172.20.40.110,TLSv1.2,131,Application Data
203,32.1626577,151.101.130.187,172.20.40.110,TCP,131,"[TCP Retransmission] 443  >  62995 [PSH, ACK] Seq=5529 Ack=138928 Win=6371 Len=77"
204,32.1627243,172.20.40.110,151.101.130.187,TCP,66,62995  >  443 [ACK] Seq=138928 Ack=5606 Win=511 Len=0 SLE=5529 SRE=5606
205,32.3058173,172.20.40.110,151.101.130.187,TLSv1.2,2739,Application Data
206,32.3067208,172.20.40.110,151.101.130.187,TLSv1.2,2782,Application Data
207,32.3176748,151.101.130.187,172.20.40.110,TCP,60,443  >  62995 [ACK] Seq=5606 Ack=141613 Win=6382 Len=0
208,32.3209645,151.101.130.187,172.20.40.110,TLSv1.2,174,Application Data
209,32.3209645,151.101.130.187,172.20.40.110,TCP,2814,443  >  62995 [ACK] Seq=5726 Ack=141613 Win=6382 Len=2760 [TCP PDU reassembled in 210]
210,32.3209645,151.101.130.187,172.20.40.110,TLSv1.2,151,Application Data
211,32.3209645,151.101.130.187,172.20.40.110,TCP,60,443  >  62995 [ACK] Seq=8583 Ack=144341 Win=6392 Len=0
212,32.3210787,172.20.40.110,151.101.130.187,TCP,54,62995  >  443 [ACK] Seq=144341 Ack=8583 Win=512 Len=0
213,32.3223138,151.101.130.187,172.20.40.110,TLSv1.2,130,Application Data
214,32.3237309,172.20.40.110,151.101.130.187,TLSv1.2,89,Application Data
215,32.3317412,151.101.130.187,172.20.40.110,TCP,60,443  >  62995 [ACK] Seq=8659 Ack=144376 Win=6392 Len=0
216,32.4568389,172.20.40.110,151.101.130.187,TLSv1.2,2826,Application Data
217,32.4619071,172.20.40.110,151.101.130.187,TLSv1.2,2828,Application Data
218,32.4630532,172.20.40.110,151.101.130.187,TLSv1.2,2827,Application Data
219,32.4633044,172.20.40.110,151.101.130.187,TLSv1.2,2824,Application Data
220,32.4808945,151.101.130.187,172.20.40.110,TCP,60,443  >  62995 [ACK] Seq=8659 Ack=147148 Win=6392 Len=0
221,32.4828371,151.101.130.187,172.20.40.110,TLSv1.2,130,Application Data
222,32.4828371,151.101.130.187,172.20.40.110,TCP,60,443  >  62995 [ACK] Seq=8735 Ack=149922 Win=6392 Len=0
223,32.4828371,151.101.130.187,172.20.40.110,TCP,60,443  >  62995 [ACK] Seq=8735 Ack=152695 Win=6392 Len=0
224,32.4828371,151.101.130.187,172.20.40.110,TCP,60,443  >  62995 [ACK] Seq=8735 Ack=155465 Win=6392 Len=0
225,32.4845186,151.101.130.187,172.20.40.110,TLSv1.2,177,Application Data
226,32.4845959,172.20.40.110,151.101.130.187,TCP,54,62995  >  443 [ACK] Seq=155465 Ack=8858 Win=511 Len=0
227,32.4858482,151.101.130.187,172.20.40.110,TLSv1.2,130,Application Data
228,32.5239207,151.101.130.187,172.20.40.110,TCP,130,"[TCP Retransmission] 443  >  62995 [PSH, ACK] Seq=8858 Ack=155465 Win=6392 Len=76"
229,32.5240263,172.20.40.110,151.101.130.187,TCP,66,62995  >  443 [ACK] Seq=155465 Ack=8934 Win=510 Len=0 SLE=8858 SRE=8934
230,37.8606887,172.20.40.110,151.101.130.187,TLSv1.2,2796,Application Data
231,37.8713625,151.101.130.187,172.20.40.110,TCP,60,443  >  62995 [ACK] Seq=8934 Ack=158207 Win=6403 Len=0
232,37.872577,151.101.130.187,172.20.40.110,TLSv1.2,347,Application Data
233,37.9062705,151.101.130.187,172.20.40.110,TCP,347,"[TCP Retransmission] 443  >  62995 [PSH, ACK] Seq=8934 Ack=158207 Win=6403 Len=293"
234,37.9064922,172.20.40.110,151.101.130.187,TCP,66,62995  >  443 [ACK] Seq=158207 Ack=9227 Win=509 Len=0 SLE=8934 SRE=9227
235,37.9099388,172.20.40.110,151.101.130.187,TLSv1.2,2797,Application Data
236,37.9200768,151.101.130.187,172.20.40.110,TCP,60,443  >  62995 [ACK] Seq=9227 Ack=160950 Win=6414 Len=0
237,37.9219471,151.101.130.187,172.20.40.110,TLSv1.2,131,Application Data
238,37.9552868,151.101.130.187,172.20.40.110,TCP,131,"[TCP Retransmission] 443  >  62995 [PSH, ACK] Seq=9227 Ack=160950 Win=6414 Len=77"
239,37.9553584,172.20.40.110,151.101.130.187,TCP,66,62995  >  443 [ACK] Seq=160950 Ack=9304 Win=509 Len=0 SLE=9227 SRE=9304
240,38.7059087,172.20.40.110,151.101.130.187,TLSv1.2,2782,Application Data
241,38.7150768,151.101.130.187,172.20.40.110,TCP,60,443  >  62995 [ACK] Seq=9304 Ack=163678 Win=6424 Len=0
242,38.7242007,151.101.130.187,172.20.40.110,TLSv1.2,240,Application Data
243,38.7552975,151.101.130.187,172.20.40.110,TCP,240,"[TCP Retransmission] 443  >  62995 [PSH, ACK] Seq=9304 Ack=163678 Win=6424 Len=186"
244,38.7553499,172.20.40.110,151.101.130.187,TCP,66,62995  >  443 [ACK] Seq=163678 Ack=9490 Win=508 Len=0 SLE=9304 SRE=9490
245,38.8287856,172.20.40.110,151.101.130.187,TLSv1.2,2785,Application Data
246,38.8470106,151.101.130.187,172.20.40.110,TCP,60,443  >  62995 [ACK] Seq=9490 Ack=166409 Win=6435 Len=0
247,38.8470106,151.101.130.187,172.20.40.110,TLSv1.2,207,Application Data
248,38.8716508,172.20.40.110,151.101.130.187,TLSv1.2,2787,Application Data
249,38.874162,151.101.130.187,172.20.40.110,TCP,207,"[TCP Spurious Retransmission] 443  >  62995 [PSH, ACK] Seq=9490 Ack=166409 Win=6435 Len=153"
250,38.8742138,172.20.40.110,151.101.130.187,TCP,66,[TCP Dup ACK 248#1] 62995  >  443 [ACK] Seq=169142 Ack=9643 Win=507 Len=0 SLE=9490 SRE=9643
251,38.8850749,151.101.130.187,172.20.40.110,TCP,60,443  >  62995 [ACK] Seq=9643 Ack=169142 Win=6446 Len=0
252,38.8850749,151.101.130.187,172.20.40.110,TLSv1.2,130,Application Data
253,38.9159849,151.101.130.187,172.20.40.110,TCP,130,"[TCP Retransmission] 443  >  62995 [PSH, ACK] Seq=9643 Ack=169142 Win=6446 Len=76"
254,38.916073,172.20.40.110,151.101.130.187,TCP,66,62995  >  443 [ACK] Seq=169142 Ack=9719 Win=507 Len=0 SLE=9643 SRE=9719
255,44.1046422,172.20.40.110,151.101.130.187,TLSv1.2,2845,Application Data
256,44.1159495,151.101.130.187,172.20.40.110,TCP,60,443  >  62995 [ACK] Seq=9719 Ack=171933 Win=6446 Len=0
257,44.8854464,151.101.130.187,172.20.40.110,TCP,4194,443  >  62995 [ACK] Seq=9719 Ack=171933 Win=6446 Len=4140 [TCP PDU reassembled in 261]
258,44.8855607,172.20.40.110,151.101.130.187,TCP,54,62995  >  443 [ACK] Seq=171933 Ack=13859 Win=512 Len=0
259,44.8906073,151.101.130.187,172.20.40.110,TCP,1434,443  >  62995 [ACK] Seq=13859 Ack=171933 Win=6446 Len=1380 [TCP PDU reassembled in 261]
260,44.8906073,151.101.130.187,172.20.40.110,TCP,1434,443  >  62995 [ACK] Seq=15239 Ack=171933 Win=6446 Len=1380 [TCP PDU reassembled in 261]
261,44.8906073,151.101.130.187,172.20.40.110,TLSv1.2,1320,Application Data
262,44.8906073,151.101.130.187,172.20.40.110,TCP,1434,443  >  62995 [ACK] Seq=17885 Ack=171933 Win=6446 Len=1380 [TCP PDU reassembled in 270]
263,44.8906073,151.101.130.187,172.20.40.110,TCP,1434,443  >  62995 [ACK] Seq=19265 Ack=171933 Win=6446 Len=1380 [TCP PDU reassembled in 270]
264,44.8907445,172.20.40.110,151.101.130.187,TCP,54,62995  >  443 [ACK] Seq=171933 Ack=20645 Win=512 Len=0
265,44.8934824,151.101.130.187,172.20.40.110,TCP,5574,443  >  62995 [ACK] Seq=20645 Ack=171933 Win=6446 Len=5520 [TCP PDU reassembled in 270]
266,44.8935967,172.20.40.110,151.101.130.187,TCP,54,62995  >  443 [ACK] Seq=171933 Ack=26165 Win=512 Len=0
267,44.8956561,151.101.130.187,172.20.40.110,TCP,5574,"443  >  62995 [PSH, ACK] Seq=26165 Ack=171933 Win=6446 Len=5520 [TCP PDU reassembled in 270]"
268,44.8957612,172.20.40.110,151.101.130.187,TCP,54,62995  >  443 [ACK] Seq=171933 Ack=31685 Win=512 Len=0
269,44.8966547,172.20.40.110,151.101.130.187,TLSv1.2,89,Application Data
270,44.8983146,151.101.130.187,172.20.40.110,TLSv1.2,2814,Application Data
271,44.8983146,151.101.130.187,172.20.40.110,TLSv1.2,1386,Application Data
272,44.8983146,151.101.130.187,172.20.40.110,TCP,2814,443  >  62995 [ACK] Seq=35777 Ack=171933 Win=6446 Len=2760 [TCP PDU reassembled in 277]
273,44.8984398,172.20.40.110,151.101.130.187,TCP,54,62995  >  443 [ACK] Seq=171968 Ack=38537 Win=512 Len=0
274,44.9033352,151.101.130.187,172.20.40.110,TCP,1434,443  >  62995 [ACK] Seq=38537 Ack=171933 Win=6446 Len=1380 [TCP PDU reassembled in 277]
275,44.9033352,151.101.130.187,172.20.40.110,TCP,1434,443  >  62995 [ACK] Seq=39917 Ack=171933 Win=6446 Len=1380 [TCP PDU reassembled in 277]
276,44.9033352,151.101.130.187,172.20.40.110,TCP,1434,443  >  62995 [ACK] Seq=41297 Ack=171933 Win=6446 Len=1380 [TCP PDU reassembled in 277]
277,44.9033352,151.101.130.187,172.20.40.110,TLSv1.2,1434,"Application Data, Application Data"
278,44.9034689,172.20.40.110,151.101.130.187,TCP,54,62995  >  443 [ACK] Seq=171968 Ack=44057 Win=512 Len=0
279,44.908169,151.101.130.187,172.20.40.110,TLSv1.2,1434,Application Data
280,44.908169,151.101.130.187,172.20.40.110,TLSv1.2,8334,Application Data
281,44.9082985,172.20.40.110,151.101.130.187,TCP,54,62995  >  443 [ACK] Seq=171968 Ack=53717 Win=512 Len=0
282,44.9103449,151.101.130.187,172.20.40.110,TCP,5574,"443  >  62995 [PSH, ACK] Seq=53717 Ack=171933 Win=6446 Len=5520 [TCP PDU reassembled in 284]"
283,44.9104597,172.20.40.110,151.101.130.187,TCP,54,62995  >  443 [ACK] Seq=171968 Ack=59237 Win=512 Len=0
284,44.9130371,151.101.130.187,172.20.40.110,TLSv1.2,4194,Application Data
285,44.9130371,151.101.130.187,172.20.40.110,TLSv1.2,569,"Application Data, Application Data"
286,44.9130371,151.101.130.187,172.20.40.110,TCP,569,"[TCP Retransmission] 443  >  62995 [PSH, ACK] Seq=63377 Ack=171933 Win=6446 Len=515"
287,44.9130371,151.101.130.187,172.20.40.110,TCP,60,443  >  62995 [ACK] Seq=63892 Ack=171968 Win=6446 Len=0
288,44.9132032,172.20.40.110,151.101.130.187,TCP,66,62995  >  443 [ACK] Seq=171968 Ack=63892 Win=512 Len=0 SLE=63377 SRE=63892
289,45.316491,172.20.40.110,151.101.130.187,TLSv1.2,2834,Application Data
290,45.3256981,151.101.130.187,172.20.40.110,TCP,60,443  >  62995 [ACK] Seq=63892 Ack=174748 Win=6446 Len=0
291,45.3317965,172.20.40.110,151.101.130.187,TLSv1.2,2828,Application Data
292,45.3338047,172.20.40.110,151.101.130.187,TLSv1.2,2830,Application Data
293,45.3343339,172.20.40.110,151.101.130.187,TLSv1.2,2828,Application Data
294,45.3366034,151.101.130.187,172.20.40.110,TLSv1.2,241,Application Data
295,45.3404986,172.20.40.110,151.101.130.187,TLSv1.2,2826,Application Data
296,45.3409917,151.101.130.187,172.20.40.110,TCP,60,443  >  62995 [ACK] Seq=64079 Ack=177522 Win=6446 Len=0
297,45.342696,172.20.40.110,151.101.130.187,TLSv1.2,2845,Application Data
298,45.3429517,172.20.40.110,151.101.130.187,TLSv1.2,2836,Application Data
299,45.3434072,151.101.130.187,172.20.40.110,TCP,60,443  >  62995 [ACK] Seq=64079 Ack=180298 Win=6446 Len=0
300,45.3483317,151.101.130.187,172.20.40.110,TLSv1.2,265,Application Data
301,45.3497384,151.101.130.187,172.20.40.110,TLSv1.2,104,Application Data
302,45.3497384,151.101.130.187,172.20.40.110,TCP,60,443  >  62995 [ACK] Seq=64340 Ack=183072 Win=6446 Len=0
303,45.3497384,151.101.130.187,172.20.40.110,TLSv1.2,130,Application Data
304,45.3497384,151.101.130.187,172.20.40.110,TCP,60,443  >  62995 [ACK] Seq=64416 Ack=185844 Win=6446 Len=0
305,45.3498394,172.20.40.110,151.101.130.187,TCP,54,62995  >  443 [ACK] Seq=191417 Ack=64416 Win=510 Len=0
306,45.352871,151.101.130.187,172.20.40.110,TLSv1.2,130,Application Data
307,45.3529452,172.20.40.110,151.101.130.187,TCP,54,62995  >  443 [ACK] Seq=191417 Ack=64492 Win=509 Len=0
308,45.3541059,151.101.130.187,172.20.40.110,TCP,60,443  >  62995 [ACK] Seq=64492 Ack=188635 Win=6446 Len=0
309,45.3541059,151.101.130.187,172.20.40.110,TCP,60,443  >  62995 [ACK] Seq=64492 Ack=191417 Win=6446 Len=0
310,45.3726472,151.101.130.187,172.20.40.110,TLSv1.2,125,Application Data
311,45.3726472,151.101.130.187,172.20.40.110,TLSv1.2,130,Application Data
312,45.3728172,172.20.40.110,151.101.130.187,TCP,54,62995  >  443 [ACK] Seq=191417 Ack=64639 Win=509 Len=0
313,45.3957636,172.20.40.110,151.101.130.187,TLSv1.2,2830,Application Data
314,45.400017,172.20.40.110,151.101.130.187,TLSv1.2,2830,Application Data
315,45.4002724,172.20.40.110,151.101.130.187,TLSv1.2,2844,Application Data
316,45.4172242,151.101.130.187,172.20.40.110,TCP,60,443  >  62995 [ACK] Seq=64639 Ack=194193 Win=6446 Len=0
317,45.4224433,151.101.130.187,172.20.40.110,TLSv1.2,208,Application Data
318,45.4244989,151.101.130.187,172.20.40.110,TCP,60,443  >  62995 [ACK] Seq=64793 Ack=196969 Win=6446 Len=0
319,45.4244989,151.101.130.187,172.20.40.110,TCP,60,443  >  62995 [ACK] Seq=64793 Ack=199759 Win=6446 Len=0
320,45.4269735,151.101.130.187,172.20.40.110,TLSv1.2,206,"Application Data, Application Data"
321,45.4271286,172.20.40.110,151.101.130.187,TCP,54,62995  >  443 [ACK] Seq=199759 Ack=64945 Win=507 Len=0
322,45.4322807,172.20.40.110,151.101.130.187,TLSv1.2,2838,Application Data
323,45.4440943,172.20.40.110,151.101.130.187,TLSv1.2,2836,Application Data
324,45.4443748,172.20.40.110,151.101.130.187,TLSv1.2,2833,Application Data
325,45.45272,151.101.130.187,172.20.40.110,TCP,60,443  >  62995 [ACK] Seq=64945 Ack=202543 Win=6446 Len=0
326,45.4554588,151.101.130.187,172.20.40.110,TLSv1.2,124,Application Data
327,45.4625459,151.101.130.187,172.20.40.110,TCP,60,443  >  62995 [ACK] Seq=65015 Ack=205325 Win=6446 Len=0
328,45.4625459,151.101.130.187,172.20.40.110,TCP,60,443  >  62995 [ACK] Seq=65015 Ack=208104 Win=6446 Len=0
329,45.4646403,151.101.130.187,172.20.40.110,TLSv1.2,129,Application Data
330,45.4646403,151.101.130.187,172.20.40.110,TLSv1.2,131,Application Data
331,45.4647351,172.20.40.110,151.101.130.187,TCP,54,62995  >  443 [ACK] Seq=208104 Ack=65167 Win=507 Len=0
332,45.4946311,172.20.40.110,151.101.130.187,TLSv1.2,2828,Application Data
333,45.5128553,151.101.130.187,172.20.40.110,TCP,60,443  >  62995 [ACK] Seq=65167 Ack=210878 Win=6446 Len=0
334,45.5154269,151.101.130.187,172.20.40.110,TLSv1.2,124,Application Data
335,45.5557713,172.20.40.110,151.101.130.187,TCP,54,62995  >  443 [ACK] Seq=210878 Ack=65237 Win=506 Len=0
336,47.7274394,172.20.40.110,151.101.130.187,TLSv1.2,2840,Application Data
337,47.727742,172.20.40.110,151.101.130.187,TLSv1.2,2834,Application Data
338,47.7365822,151.101.130.187,172.20.40.110,TCP,60,443  >  62995 [ACK] Seq=65237 Ack=213664 Win=6446 Len=0
339,47.7392191,151.101.130.187,172.20.40.110,TLSv1.2,214,Application Data
340,47.7394622,172.20.40.110,151.101.130.187,TCP,54,62995  >  443 [ACK] Seq=216444 Ack=65397 Win=512 Len=0
341,47.7400974,151.101.130.187,172.20.40.110,TCP,60,443  >  62995 [ACK] Seq=65397 Ack=216444 Win=6446 Len=0
342,47.7421213,151.101.130.187,172.20.40.110,TLSv1.2,104,Application Data
343,47.7421987,172.20.40.110,151.101.130.187,TCP,54,62995  >  443 [ACK] Seq=216444 Ack=65447 Win=511 Len=0
344,48.0365705,172.20.40.110,151.101.130.187,TLSv1.2,2832,Application Data
345,48.0377692,172.20.40.110,151.101.130.187,TLSv1.2,2828,Application Data
346,48.0492874,151.101.130.187,172.20.40.110,TCP,60,443  >  62995 [ACK] Seq=65447 Ack=219222 Win=6446 Len=0
347,48.0492874,151.101.130.187,172.20.40.110,TCP,60,443  >  62995 [ACK] Seq=65447 Ack=221996 Win=6446 Len=0
348,48.0532948,151.101.130.187,172.20.40.110,TLSv1.2,263,Application Data
349,48.0532948,151.101.130.187,172.20.40.110,TLSv1.2,131,Application Data
350,48.0533894,172.20.40.110,151.101.130.187,TCP,54,62995  >  443 [ACK] Seq=221996 Ack=65733 Win=510 Len=0
351,48.7827637,172.20.40.110,151.101.130.187,TLSv1.2,2831,Application Data
352,48.7940318,151.101.130.187,172.20.40.110,TCP,60,443  >  62995 [ACK] Seq=65733 Ack=224773 Win=6446 Len=0
353,48.7971221,151.101.130.187,172.20.40.110,TLSv1.2,240,Application Data
354,48.8470514,151.101.130.187,172.20.40.110,TCP,240,"[TCP Retransmission] 443  >  62995 [PSH, ACK] Seq=65733 Ack=224773 Win=6446 Len=186"
355,48.8471069,172.20.40.110,151.101.130.187,TCP,66,62995  >  443 [ACK] Seq=224773 Ack=65919 Win=510 Len=0 SLE=65733 SRE=65919
356,49.584212,172.20.40.110,151.101.130.187,TLSv1.2,2826,Application Data
357,49.5941898,151.101.130.187,172.20.40.110,TCP,60,443  >  62995 [ACK] Seq=65919 Ack=227545 Win=6446 Len=0
358,49.5990951,151.101.130.187,172.20.40.110,TLSv1.2,241,Application Data
359,49.6481051,151.101.130.187,172.20.40.110,TCP,241,"[TCP Retransmission] 443  >  62995 [PSH, ACK] Seq=65919 Ack=227545 Win=6446 Len=187"
360,49.64816,172.20.40.110,151.101.130.187,TCP,66,62995  >  443 [ACK] Seq=227545 Ack=66106 Win=509 Len=0 SLE=65919 SRE=66106
361,49.71298,172.20.40.110,151.101.130.187,TLSv1.2,2843,Application Data
362,49.7216191,151.101.130.187,172.20.40.110,TCP,60,443  >  62995 [ACK] Seq=66106 Ack=230334 Win=6446 Len=0
363,49.7251275,151.101.130.187,172.20.40.110,TLSv1.2,208,Application Data
364,49.7709605,172.20.40.110,151.101.130.187,TCP,54,62995  >  443 [ACK] Seq=230334 Ack=66260 Win=508 Len=0
365,49.7762608,151.101.130.187,172.20.40.110,TCP,208,"[TCP Spurious Retransmission] 443  >  62995 [PSH, ACK] Seq=66106 Ack=230334 Win=6446 Len=154"
366,49.776319,172.20.40.110,151.101.130.187,TCP,66,[TCP Dup ACK 364#1] 62995  >  443 [ACK] Seq=230334 Ack=66260 Win=508 Len=0 SLE=66106 SRE=66260
367,49.9983544,172.20.40.110,151.101.130.187,TLSv1.2,2832,Application Data
368,49.9996291,172.20.40.110,151.101.130.187,TLSv1.2,2831,Application Data
369,49.9997867,172.20.40.110,151.101.130.187,TLSv1.2,2828,Application Data
370,50.0173832,151.101.130.187,172.20.40.110,TCP,60,443  >  62995 [ACK] Seq=66260 Ack=233112 Win=6446 Len=0
371,50.0173832,151.101.130.187,172.20.40.110,TCP,60,443  >  62995 [ACK] Seq=66260 Ack=235889 Win=6446 Len=0
372,50.0173832,151.101.130.187,172.20.40.110,TCP,60,443  >  62995 [ACK] Seq=66260 Ack=238663 Win=6446 Len=0
373,50.0228257,151.101.130.187,172.20.40.110,TLSv1.2,206,"Application Data, Application Data"
374,50.0228257,151.101.130.187,172.20.40.110,TLSv1.2,130,Application Data
375,50.0229281,172.20.40.110,151.101.130.187,TCP,54,62995  >  443 [ACK] Seq=238663 Ack=66488 Win=507 Len=0
376,50.7457681,172.20.40.110,151.101.130.187,TLSv1.2,2848,Application Data
377,50.7567076,151.101.130.187,172.20.40.110,TCP,60,443  >  62995 [ACK] Seq=66488 Ack=241457 Win=6446 Len=0
378,50.7593374,151.101.130.187,172.20.40.110,TLSv1.2,235,Application Data
379,50.8074502,172.20.40.110,151.101.130.187,TCP,54,62995  >  443 [ACK] Seq=241457 Ack=66669 Win=507 Len=0
380,50.8078728,151.101.130.187,172.20.40.110,TCP,235,"[TCP Spurious Retransmission] 443  >  62995 [PSH, ACK] Seq=66488 Ack=241457 Win=6446 Len=181"
381,50.8079284,172.20.40.110,151.101.130.187,TCP,66,[TCP Dup ACK 379#1] 62995  >  443 [ACK] Seq=241457 Ack=66669 Win=507 Len=0 SLE=66488 SRE=66669
382,50.9840837,172.20.40.110,151.101.130.187,TLSv1.2,2835,Application Data
383,50.9842356,172.20.40.110,151.101.130.187,TLSv1.2,2837,Application Data
384,50.9849605,172.20.40.110,151.101.130.187,TLSv1.2,2831,Application Data
385,50.9852141,172.20.40.110,151.101.130.187,TLSv1.2,2833,Application Data
386,50.9855475,172.20.40.110,151.101.130.187,TLSv1.2,2831,Application Data
387,50.9879028,172.20.40.110,151.101.130.187,TLSv1.2,2829,Application Data
388,50.9880875,172.20.40.110,151.101.130.187,TLSv1.2,2831,Application Data
389,50.9973674,151.101.130.187,172.20.40.110,TCP,60,443  >  62995 [ACK] Seq=66669 Ack=244238 Win=6446 Len=0
390,50.9982539,151.101.130.187,172.20.40.110,TLSv1.2,103,Application Data
391,50.9982539,151.101.130.187,172.20.40.110,TCP,60,443  >  62995 [ACK] Seq=66718 Ack=247021 Win=6446 Len=0
392,50.9982539,151.101.130.187,172.20.40.110,TCP,60,443  >  62995 [ACK] Seq=66718 Ack=249798 Win=6446 Len=0
393,50.9982539,151.101.130.187,172.20.40.110,TCP,60,443  >  62995 [ACK] Seq=66718 Ack=252577 Win=6446 Len=0
394,51.0014314,172.20.40.110,151.101.130.187,TLSv1.2,2831,Application Data
395,51.0049634,151.101.130.187,172.20.40.110,TLSv1.2,131,Application Data
396,51.0049634,151.101.130.187,172.20.40.110,TLSv1.2,263,Application Data
397,51.0049634,151.101.130.187,172.20.40.110,TLSv1.2,132,Application Data
398,51.0049634,151.101.130.187,172.20.40.110,TCP,60,443  >  62995 [ACK] Seq=67082 Ack=255354 Win=6446 Len=0
399,51.0049634,151.101.130.187,172.20.40.110,TCP,60,443  >  62995 [ACK] Seq=67082 Ack=258129 Win=6446 Len=0
400,51.0049634,151.101.130.187,172.20.40.110,TCP,60,443  >  62995 [ACK] Seq=67082 Ack=260906 Win=6446 Len=0
401,51.0050844,172.20.40.110,151.101.130.187,TCP,54,62995  >  443 [ACK] Seq=263683 Ack=67082 Win=512 Len=0
402,51.0079762,151.101.130.187,172.20.40.110,TLSv1.2,130,Application Data
403,51.0079762,151.101.130.187,172.20.40.110,TLSv1.2,124,Application Data
404,51.0080503,172.20.40.110,151.101.130.187,TCP,54,62995  >  443 [ACK] Seq=263683 Ack=67228 Win=511 Len=0
405,51.0092364,151.101.130.187,172.20.40.110,TLSv1.2,130,Application Data
406,51.0093441,172.20.40.110,151.101.130.187,TCP,54,62995  >  443 [ACK] Seq=263683 Ack=67304 Win=511 Len=0
407,51.0105894,151.101.130.187,172.20.40.110,TCP,60,443  >  62995 [ACK] Seq=67304 Ack=263683 Win=6446 Len=0
408,51.0213149,151.101.130.187,172.20.40.110,TLSv1.2,131,Application Data
409,51.0566526,151.101.130.187,172.20.40.110,TCP,131,"[TCP Retransmission] 443  >  62995 [PSH, ACK] Seq=67304 Ack=263683 Win=6446 Len=77"
410,51.0567339,172.20.40.110,151.101.130.187,TCP,66,62995  >  443 [ACK] Seq=263683 Ack=67381 Win=510 Len=0 SLE=67304 SRE=67381
411,51.2679248,172.20.40.110,151.101.130.187,TLSv1.2,2835,Application Data
412,51.278348,151.101.130.187,172.20.40.110,TCP,60,443  >  62995 [ACK] Seq=67381 Ack=266464 Win=6446 Len=0
413,51.2809315,172.20.40.110,151.101.130.187,TLSv1.2,2829,Application Data
414,51.2811849,172.20.40.110,151.101.130.187,TLSv1.2,2836,Application Data
415,51.282031,172.20.40.110,151.101.130.187,TLSv1.2,2835,Application Data
416,51.2860624,172.20.40.110,151.101.130.187,TLSv1.2,2829,Application Data
417,51.287193,151.101.130.187,172.20.40.110,TLSv1.2,317,Application Data
418,51.2905228,151.101.130.187,172.20.40.110,TCP,60,443  >  62995 [ACK] Seq=67644 Ack=269239 Win=6446 Len=0
419,51.2931926,151.101.130.187,172.20.40.110,TLSv1.2,131,Application Data
420,51.2931926,151.101.130.187,172.20.40.110,TCP,60,443  >  62995 [ACK] Seq=67721 Ack=272021 Win=6446 Len=0
421,51.2931926,151.101.130.187,172.20.40.110,TCP,60,443  >  62995 [ACK] Seq=67721 Ack=274802 Win=6446 Len=0
422,51.2932901,172.20.40.110,151.101.130.187,TCP,54,62995  >  443 [ACK] Seq=277577 Ack=67721 Win=509 Len=0
423,51.2963835,151.101.130.187,172.20.40.110,TCP,60,443  >  62995 [ACK] Seq=67721 Ack=277577 Win=6446 Len=0
424,51.2963835,151.101.130.187,172.20.40.110,TLSv1.2,131,Application Data
425,51.2974476,172.20.40.110,151.101.130.187,TLSv1.2,2835,Application Data
426,51.2992092,151.101.130.187,172.20.40.110,TLSv1.2,131,Application Data
427,51.3015932,151.101.130.187,172.20.40.110,TLSv1.2,130,Application Data
428,51.3016772,172.20.40.110,151.101.130.187,TCP,54,62995  >  443 [ACK] Seq=280358 Ack=67951 Win=508 Len=0
429,51.3066742,172.20.40.110,151.101.130.187,TLSv1.2,2828,Application Data
430,51.3069329,172.20.40.110,151.101.130.187,TLSv1.2,2829,Application Data
431,51.3079931,172.20.40.110,151.101.130.187,TLSv1.2,2826,Application Data
432,51.3082395,172.20.40.110,151.101.130.187,TLSv1.2,2832,Application Data
433,51.3083333,151.101.130.187,172.20.40.110,TCP,60,443  >  62995 [ACK] Seq=67951 Ack=280358 Win=6446 Len=0
434,51.3141828,151.101.130.187,172.20.40.110,TLSv1.2,125,Application Data
435,51.3205766,151.101.130.187,172.20.40.110,TCP,60,443  >  62995 [ACK] Seq=68022 Ack=283132 Win=6446 Len=0
436,51.3205766,151.101.130.187,172.20.40.110,TCP,60,443  >  62995 [ACK] Seq=68022 Ack=285907 Win=6446 Len=0
437,51.3205766,151.101.130.187,172.20.40.110,TCP,60,443  >  62995 [ACK] Seq=68022 Ack=288679 Win=6446 Len=0
438,51.3227894,151.101.130.187,172.20.40.110,TCP,60,443  >  62995 [ACK] Seq=68022 Ack=291457 Win=6446 Len=0
439,51.3251067,151.101.130.187,172.20.40.110,TLSv1.2,125,Application Data
440,51.3251067,151.101.130.187,172.20.40.110,TLSv1.2,263,Application Data
441,51.3252984,172.20.40.110,151.101.130.187,TCP,54,62995  >  443 [ACK] Seq=291457 Ack=68302 Win=507 Len=0
442,51.3262944,151.101.130.187,172.20.40.110,TLSv1.2,206,"Application Data, Application Data"
443,51.3263917,172.20.40.110,151.101.130.187,TCP,54,62995  >  443 [ACK] Seq=291457 Ack=68454 Win=506 Len=0
444,51.5375207,172.20.40.110,151.101.130.187,TLSv1.2,2833,Application Data
445,51.5490672,151.101.130.187,172.20.40.110,TCP,60,443  >  62995 [ACK] Seq=68454 Ack=294236 Win=6446 Len=0
446,51.5506464,151.101.130.187,172.20.40.110,TLSv1.2,130,Application Data
447,51.5853948,151.101.130.187,172.20.40.110,TCP,130,"[TCP Retransmission] 443  >  62995 [PSH, ACK] Seq=68454 Ack=294236 Win=6446 Len=76"
448,51.5854645,172.20.40.110,151.101.130.187,TCP,66,62995  >  443 [ACK] Seq=294236 Ack=68530 Win=512 Len=0 SLE=68454 SRE=68530
449,51.9839461,172.20.40.110,151.101.130.187,TLSv1.2,2844,Application Data
450,51.98928,172.20.40.110,151.101.130.187,TLSv1.2,2835,Application Data
451,51.9918768,172.20.40.110,151.101.130.187,TLSv1.2,2829,Application Data
452,51.9965982,151.101.130.187,172.20.40.110,TCP,60,443  >  62995 [ACK] Seq=68530 Ack=297026 Win=6446 Len=0
453,52.004753,151.101.130.187,172.20.40.110,TLSv1.2,131,Application Data
454,52.004753,151.101.130.187,172.20.40.110,TCP,60,443  >  62995 [ACK] Seq=68607 Ack=299807 Win=6446 Len=0
455,52.004753,151.101.130.187,172.20.40.110,TLSv1.2,130,Application Data
456,52.004753,151.101.130.187,172.20.40.110,TCP,60,443  >  62995 [ACK] Seq=68683 Ack=302582 Win=6446 Len=0
457,52.004753,151.101.130.187,172.20.40.110,TLSv1.2,318,Application Data
458,52.0048434,172.20.40.110,151.101.130.187,TCP,54,62995  >  443 [ACK] Seq=302582 Ack=68947 Win=510 Len=0
459,52.0122448,172.20.40.110,151.101.130.187,TLSv1.2,2829,Application Data
460,52.0217516,151.101.130.187,172.20.40.110,TCP,60,443  >  62995 [ACK] Seq=68947 Ack=305357 Win=6446 Len=0
461,52.0242157,151.101.130.187,172.20.40.110,TLSv1.2,130,Application Data
462,52.0599216,151.101.130.187,172.20.40.110,TCP,130,"[TCP Retransmission] 443  >  62995 [PSH, ACK] Seq=68947 Ack=305357 Win=6446 Len=76"
463,52.0599968,172.20.40.110,151.101.130.187,TCP,66,62995  >  443 [ACK] Seq=305357 Ack=69023 Win=510 Len=0 SLE=68947 SRE=69023
464,53.0164922,172.20.40.110,151.101.130.187,TLSv1.2,2829,Application Data
465,53.0270272,151.101.130.187,172.20.40.110,TCP,60,443  >  62995 [ACK] Seq=69023 Ack=308132 Win=6446 Len=0
466,53.033014,151.101.130.187,172.20.40.110,TLSv1.2,214,Application Data
467,53.0655267,151.101.130.187,172.20.40.110,TCP,214,"[TCP Retransmission] 443  >  62995 [PSH, ACK] Seq=69023 Ack=308132 Win=6446 Len=160"
468,53.0655827,172.20.40.110,151.101.130.187,TCP,66,62995  >  443 [ACK] Seq=308132 Ack=69183 Win=509 Len=0 SLE=69023 SRE=69183
469,54.4904821,172.20.40.110,151.101.130.187,TLSv1.2,2834,Application Data
470,54.4990342,172.20.40.110,151.101.130.187,TLSv1.2,2836,Application Data
471,54.4993381,172.20.40.110,151.101.130.187,TLSv1.2,2830,Application Data
472,54.5007927,172.20.40.110,151.101.130.187,TLSv1.2,2835,Application Data
473,54.5010242,172.20.40.110,151.101.130.187,TLSv1.2,2832,Application Data
474,54.5012221,172.20.40.110,151.101.130.187,TLSv1.2,2847,Application Data
475,54.5013959,172.20.40.110,151.101.130.187,TLSv1.2,2847,Application Data
476,54.5051412,151.101.130.187,172.20.40.110,TCP,60,443  >  62995 [ACK] Seq=69183 Ack=310912 Win=6446 Len=0
477,54.5159483,151.101.130.187,172.20.40.110,TLSv1.2,240,Application Data
478,54.5193945,151.101.130.187,172.20.40.110,TCP,60,443  >  62995 [ACK] Seq=69369 Ack=313694 Win=6446 Len=0
479,54.5193945,151.101.130.187,172.20.40.110,TCP,60,443  >  62995 [ACK] Seq=69369 Ack=316470 Win=6446 Len=0
480,54.5193945,151.101.130.187,172.20.40.110,TCP,60,443  >  62995 [ACK] Seq=69369 Ack=319230 Win=6457 Len=0
481,54.5193945,151.101.130.187,172.20.40.110,TLSv1.2,263,Application Data
482,54.5193945,151.101.130.187,172.20.40.110,TLSv1.2,131,Application Data
483,54.5194913,172.20.40.110,151.101.130.187,TCP,54,62995  >  443 [ACK] Seq=327615 Ack=69655 Win=507 Len=0
484,54.5227312,151.101.130.187,172.20.40.110,TCP,60,443  >  62995 [ACK] Seq=69655 Ack=319251 Win=6457 Len=0
485,54.5227312,151.101.130.187,172.20.40.110,TCP,60,443  >  62995 [ACK] Seq=69655 Ack=322029 Win=6457 Len=0
486,54.5227312,151.101.130.187,172.20.40.110,TCP,60,443  >  62995 [ACK] Seq=69655 Ack=324822 Win=6457 Len=0
487,54.5227312,151.101.130.187,172.20.40.110,TCP,60,443  >  62995 [ACK] Seq=69655 Ack=327615 Win=6457 Len=0
488,54.52711,151.101.130.187,172.20.40.110,TLSv1.2,124,Application Data
489,54.5271812,172.20.40.110,151.101.130.187,TCP,54,62995  >  443 [ACK] Seq=327615 Ack=69725 Win=507 Len=0
490,54.5293813,151.101.130.187,172.20.40.110,TLSv1.2,130,Application Data
491,54.5293813,151.101.130.187,172.20.40.110,TLSv1.2,131,Application Data
492,54.5293813,151.101.130.187,172.20.40.110,TLSv1.2,130,Application Data
493,54.5294774,172.20.40.110,151.101.130.187,TCP,54,62995  >  443 [ACK] Seq=327615 Ack=69954 Win=512 Len=0
