"No.","Time","Source","Destination","Protocol","Length","Info"
"1","0.000000000","172.20.40.110","151.101.130.187","TLSv1.2","2808","Application Data"
"2","0.000120100","172.20.40.110","151.101.130.187","TLSv1.2","93","Application Data"
"3","0.012343000","151.101.130.187","172.20.40.110","TCP","60","443  >  62995 [ACK] Seq=1 Ack=2755 Win=5347 Len=0"
"4","0.012343000","151.101.130.187","172.20.40.110","TCP","60","443  >  62995 [ACK] Seq=1 Ack=2794 Win=5347 Len=0"
"5","0.013688000","151.101.130.187","172.20.40.110","TLSv1.2","93","Application Data"
"6","0.015024700","151.101.130.187","172.20.40.110","TLSv1.2","265","Application Data"
"7","0.015108100","172.20.40.110","151.101.130.187","TCP","54","62995  >  443 [ACK] Seq=2794 Ack=251 Win=511 Len=0"
"8","0.031651400","172.20.40.110","151.101.130.187","TLSv1.2","2794","Application Data"
"9","0.041145800","151.101.130.187","172.20.40.110","TCP","60","443  >  62995 [ACK] Seq=251 Ack=5534 Win=5358 Len=0"
"10","0.044180200","151.101.130.187","172.20.40.110","TLSv1.2","129","Application Data"
"11","0.050322200","172.20.40.110","151.101.130.187","TLSv1.2","2807","Application Data"
"12","0.059783700","151.101.130.187","172.20.40.110","TCP","60","443  >  62995 [ACK] Seq=326 Ack=8287 Win=5368 Len=0"
"13","0.064571700","151.101.130.187","172.20.40.110","TLSv1.2","109","Application Data"
"14","0.098655900","151.101.130.187","172.20.40.110","TCP","109","[TCP Retransmission] 443  >  62995 [PSH, ACK] Seq=326 Ack=8287 Win=5368 Len=55"
"15","0.098731100","172.20.40.110","151.101.130.187","TCP","66","62995  >  443 [ACK] Seq=8287 Ack=381 Win=510 Len=0 SLE=326 SRE=381"
"16","1.736312100","172.20.40.110","151.101.130.187","TLSv1.2","2807","Application Data"
"17","1.737121800","172.20.40.110","151.101.130.187","TLSv1.2","2789","Application Data"
"18","1.737325400","172.20.40.110","151.101.130.187","TLSv1.2","2808","Application Data"
"19","1.738228000","172.20.40.110","151.101.130.187","TLSv1.2","2795","Application Data"
"20","1.773925600","172.20.40.110","151.101.130.187","TCP","1434","[TCP Retransmission] 62995  >  443 [PSH, ACK] Seq=17890 Ack=381 Win=510 Len=1380"
"21","1.784215900","151.101.130.187","172.20.40.110","TCP","60","443  >  62995 [ACK] Seq=381 Ack=11040 Win=5379 Len=0"
"22","1.784215900","151.101.130.187","172.20.40.110","TCP","60","443  >  62995 [ACK] Seq=381 Ack=13775 Win=5390 Len=0"
"23","1.784215900","151.101.130.187","172.20.40.110","TCP","60","443  >  62995 [ACK] Seq=381 Ack=16529 Win=5401 Len=0"
"24","1.784215900","151.101.130.187","172.20.40.110","TLSv1.2","258","Application Data"
"25","1.784215900","151.101.130.187","172.20.40.110","TLSv1.2","158","Application Data"
"26","1.784215900","151.101.130.187","172.20.40.110","TLSv1.2","131","Application Data"
"27","1.784215900","151.101.130.187","172.20.40.110","TCP","60","443  >  62995 [ACK] Seq=766 Ack=19270 Win=5411 Len=0"
"28","1.784413700","172.20.40.110","151.101.130.187","TCP","54","62995  >  443 [ACK] Seq=19270 Ack=766 Win=509 Len=0"
"29","1.789255800","151.101.130.187","172.20.40.110","TLSv1.2","130","Application Data"
"30","1.789415600","172.20.40.110","151.101.130.187","TCP","54","62995  >  443 [ACK] Seq=19270 Ack=842 Win=508 Len=0"
"31","1.811640400","151.101.130.187","172.20.40.110","TCP","66","[TCP Dup ACK 27#1] 443  >  62995 [ACK] Seq=842 Ack=19270 Win=5411 Len=0 SLE=17890 SRE=19270"
"32","1.839188900","172.20.40.110","151.101.130.187","TLSv1.2","2796","Application Data"
"33","1.839404500","172.20.40.110","151.101.130.187","TLSv1.2","2793","Application Data"
"34","1.839605400","172.20.40.110","151.101.130.187","TLSv1.2","2790","Application Data"
"35","1.839756100","172.20.40.110","151.101.130.187","TLSv1.2","2799","Application Data"
"36","1.892518400","172.20.40.110","151.101.130.187","TCP","1434","[TCP Retransmission] 62995  >  443 [PSH, ACK] Seq=28852 Ack=842 Win=508 Len=1380"
"37","1.893199200","151.101.130.187","172.20.40.110","TCP","60","443  >  62995 [ACK] Seq=842 Ack=22012 Win=5422 Len=0"
"38","1.893199200","151.101.130.187","172.20.40.110","TCP","60","443  >  62995 [ACK] Seq=842 Ack=24751 Win=5433 Len=0"
"39","1.893199200","151.101.130.187","172.20.40.110","TCP","60","443  >  62995 [ACK] Seq=842 Ack=27487 Win=5443 Len=0"
"40","1.893199200","151.101.130.187","172.20.40.110","TCP","60","443  >  62995 [ACK] Seq=842 Ack=30232 Win=5454 Len=0"
"41","1.896415300","151.101.130.187","172.20.40.110","TLSv1.2","240","Application Data"
"42","1.896415300","151.101.130.187","172.20.40.110","TLSv1.2","206","Application Data, Application Data"
"43","1.896415300","151.101.130.187","172.20.40.110","TLSv1.2","212","Application Data"
"44","1.896491700","172.20.40.110","151.101.130.187","TCP","54","62995  >  443 [ACK] Seq=30232 Ack=1338 Win=506 Len=0"
"45","1.932828300","151.101.130.187","172.20.40.110","TCP","212","[TCP Spurious Retransmission] 443  >  62995 [PSH, ACK] Seq=1180 Ack=30232 Win=5454 Len=158"
"46","1.932828300","151.101.130.187","172.20.40.110","TCP","66","[TCP Dup ACK 40#1] 443  >  62995 [ACK] Seq=1338 Ack=30232 Win=5454 Len=0 SLE=28852 SRE=30232"
"47","1.932940900","172.20.40.110","151.101.130.187","TCP","66","[TCP Dup ACK 44#1] 62995  >  443 [ACK] Seq=30232 Ack=1338 Win=506 Len=0 SLE=1180 SRE=1338"
"48","2.236651500","172.20.40.110","151.101.130.187","TLSv1.2","2811","Application Data"
"49","2.263747900","151.101.130.187","172.20.40.110","TCP","60","443  >  62995 [ACK] Seq=1338 Ack=32989 Win=5465 Len=0"
"50","2.266739300","151.101.130.187","172.20.40.110","TLSv1.2","98","Application Data"
"51","2.311925000","172.20.40.110","151.101.130.187","TCP","54","62995  >  443 [ACK] Seq=32989 Ack=1382 Win=512 Len=0"
"52","2.312607600","151.101.130.187","172.20.40.110","TCP","98","[TCP Spurious Retransmission] 443  >  62995 [PSH, ACK] Seq=1338 Ack=32989 Win=5465 Len=44"
"53","2.312677300","172.20.40.110","151.101.130.187","TCP","66","[TCP Dup ACK 51#1] 62995  >  443 [ACK] Seq=32989 Ack=1382 Win=512 Len=0 SLE=1338 SRE=1382"
"54","2.325709400","172.20.40.110","151.101.130.187","TLSv1.2","2812","Application Data"
"55","2.369313600","151.101.130.187","172.20.40.110","TCP","60","443  >  62995 [ACK] Seq=1382 Ack=34369 Win=5471 Len=0"
"56","2.369313600","151.101.130.187","172.20.40.110","TCP","60","443  >  62995 [ACK] Seq=1382 Ack=35747 Win=5476 Len=0"
"57","2.371822100","151.101.130.187","172.20.40.110","TLSv1.2","125","Application Data"
"58","2.413571100","151.101.130.187","172.20.40.110","TCP","125","[TCP Retransmission] 443  >  62995 [PSH, ACK] Seq=1382 Ack=35747 Win=5476 Len=71"
"59","2.413680300","172.20.40.110","151.101.130.187","TCP","66","62995  >  443 [ACK] Seq=35747 Ack=1453 Win=511 Len=0 SLE=1382 SRE=1453"
"60","16.508304600","172.20.40.110","151.101.130.187","TLSv1.2","2847","Application Data"
"61","16.508485000","172.20.40.110","151.101.130.187","TLSv1.2","93","Application Data"
"62","16.522253900","151.101.130.187","172.20.40.110","TCP","60","443  >  62995 [ACK] Seq=1453 Ack=38540 Win=5476 Len=0"
"63","16.522253900","151.101.130.187","172.20.40.110","TCP","60","443  >  62995 [ACK] Seq=1453 Ack=38579 Win=5476 Len=0"
"64","16.522253900","151.101.130.187","172.20.40.110","TLSv1.2","93","Application Data"
"65","16.523883100","151.101.130.187","172.20.40.110","TLSv1.2","265","Application Data"
"66","16.524086400","172.20.40.110","151.101.130.187","TCP","54","62995  >  443 [ACK] Seq=38579 Ack=1703 Win=510 Len=0"
"67","16.815985900","172.20.40.110","151.101.130.187","TLSv1.2","2838","Application Data"
"68","16.819065500","172.20.40.110","151.101.130.187","TLSv1.2","2832","Application Data"
"69","16.827959900","151.101.130.187","172.20.40.110","TCP","60","443  >  62995 [ACK] Seq=1703 Ack=41363 Win=5476 Len=0"
"70","16.830484400","151.101.130.187","172.20.40.110","TLSv1.2","135","Application Data"
"71","16.831891800","151.101.130.187","172.20.40.110","TCP","60","443  >  62995 [ACK] Seq=1784 Ack=44141 Win=5476 Len=0"
"72","16.833077800","151.101.130.187","172.20.40.110","TLSv1.2","174","Application Data"
"73","16.833175100","172.20.40.110","151.101.130.187","TCP","54","62995  >  443 [ACK] Seq=44141 Ack=1904 Win=510 Len=0"
"74","16.842119800","172.20.40.110","151.101.130.187","TLSv1.2","2832","Application Data"
"75","16.851260200","151.101.130.187","172.20.40.110","TCP","60","443  >  62995 [ACK] Seq=1904 Ack=46919 Win=5476 Len=0"
"76","16.854468700","151.101.130.187","172.20.40.110","TLSv1.2","268","Application Data"
"77","16.894411100","151.101.130.187","172.20.40.110","TCP","268","[TCP Retransmission] 443  >  62995 [PSH, ACK] Seq=1904 Ack=46919 Win=5476 Len=214"
"78","16.894486700","172.20.40.110","151.101.130.187","TCP","66","62995  >  443 [ACK] Seq=46919 Ack=2118 Win=509 Len=0 SLE=1904 SRE=2118"
"79","17.038729900","172.20.40.110","151.101.130.187","TLSv1.2","2832","Application Data"
"80","17.048878900","151.101.130.187","172.20.40.110","TCP","60","443  >  62995 [ACK] Seq=2118 Ack=49697 Win=5476 Len=0"
"81","17.053377100","151.101.130.187","172.20.40.110","TLSv1.2","130","Application Data"
"82","17.091021200","151.101.130.187","172.20.40.110","TCP","130","[TCP Retransmission] 443  >  62995 [PSH, ACK] Seq=2118 Ack=49697 Win=5476 Len=76"
"83","17.091080500","172.20.40.110","151.101.130.187","TCP","66","62995  >  443 [ACK] Seq=49697 Ack=2194 Win=508 Len=0 SLE=2118 SRE=2194"
"84","17.091148900","172.20.40.110","151.101.130.187","TLSv1.2","2829","Application Data"
"85","17.101431500","151.101.130.187","172.20.40.110","TCP","60","443  >  62995 [ACK] Seq=2194 Ack=52472 Win=5476 Len=0"
"86","17.102533300","151.101.130.187","172.20.40.110","TLSv1.2","131","Application Data"
"87","17.141817200","151.101.130.187","172.20.40.110","TCP","131","[TCP Retransmission] 443  >  62995 [PSH, ACK] Seq=2194 Ack=52472 Win=5476 Len=77"
"88","17.141896900","172.20.40.110","151.101.130.187","TCP","66","62995  >  443 [ACK] Seq=52472 Ack=2271 Win=508 Len=0 SLE=2194 SRE=2271"
"89","17.228392600","172.20.40.110","151.101.130.187","TLSv1.2","2829","Application Data"
"90","17.237777400","151.101.130.187","172.20.40.110","TCP","60","443  >  62995 [ACK] Seq=2271 Ack=55247 Win=5476 Len=0"
"91","17.242436400","151.101.130.187","172.20.40.110","TLSv1.2","98","Application Data"
"92","17.244735700","172.20.40.110","151.101.130.187","TLSv1.2","2835","Application Data"
"93","17.245375600","172.20.40.110","151.101.130.187","TLSv1.2","2834","Application Data"
"94","17.248530800","172.20.40.110","151.101.130.187","TLSv1.2","2831","Application Data"
"95","17.253327300","151.101.130.187","172.20.40.110","TCP","60","443  >  62995 [ACK] Seq=2315 Ack=58028 Win=5476 Len=0"
"96","17.255416600","151.101.130.187","172.20.40.110","TCP","60","443  >  62995 [ACK] Seq=2315 Ack=60808 Win=5476 Len=0"
"97","17.257880200","151.101.130.187","172.20.40.110","TLSv1.2","130","Application Data"
"98","17.257880200","151.101.130.187","172.20.40.110","TCP","60","443  >  62995 [ACK] Seq=2391 Ack=63585 Win=5476 Len=0"
"99","17.257880200","151.101.130.187","172.20.40.110","TLSv1.2","130","Application Data"
"100","17.257980800","172.20.40.110","151.101.130.187","TCP","54","62995  >  443 [ACK] Seq=63585 Ack=2467 Win=507 Len=0"
"101","17.260462300","151.101.130.187","172.20.40.110","TLSv1.2","129","Application Data"
"102","17.285645500","172.20.40.110","151.101.130.187","TLSv1.2","2846","Application Data"
"103","17.304115800","151.101.130.187","172.20.40.110","TCP","60","443  >  62995 [ACK] Seq=2542 Ack=66377 Win=5476 Len=0"
"104","17.306535000","151.101.130.187","172.20.40.110","TLSv1.2","130","Application Data"
"105","17.342048400","151.101.130.187","172.20.40.110","TCP","130","[TCP Retransmission] 443  >  62995 [PSH, ACK] Seq=2542 Ack=66377 Win=5476 Len=76"
"106","17.342106300","172.20.40.110","151.101.130.187","TCP","66","62995  >  443 [ACK] Seq=66377 Ack=2618 Win=507 Len=0 SLE=2542 SRE=2618"
"107","17.515736300","172.20.40.110","151.101.130.187","TLSv1.2","2846","Application Data"
"108","17.516913800","172.20.40.110","151.101.130.187","TLSv1.2","2847","Application Data"
"109","17.530806000","151.101.130.187","172.20.40.110","TCP","60","443  >  62995 [ACK] Seq=2618 Ack=69169 Win=5476 Len=0"
"110","17.530806000","151.101.130.187","172.20.40.110","TCP","60","443  >  62995 [ACK] Seq=2618 Ack=71962 Win=5476 Len=0"
"111","17.530806000","151.101.130.187","172.20.40.110","TLSv1.2","213","Application Data"
"112","17.530977500","172.20.40.110","151.101.130.187","TCP","54","62995  >  443 [ACK] Seq=71962 Ack=2777 Win=512 Len=0"
"113","17.533168900","151.101.130.187","172.20.40.110","TLSv1.2","125","Application Data"
"114","17.533276100","172.20.40.110","151.101.130.187","TCP","54","62995  >  443 [ACK] Seq=71962 Ack=2848 Win=511 Len=0"
"115","17.856819000","172.20.40.110","151.101.130.187","TLSv1.2","2832","Application Data"
"116","17.866943400","151.101.130.187","172.20.40.110","TCP","60","443  >  62995 [ACK] Seq=2848 Ack=74740 Win=5476 Len=0"
"117","17.887324600","151.101.130.187","172.20.40.110","TLSv1.2","265","Application Data"
"118","17.928117500","151.101.130.187","172.20.40.110","TCP","265","[TCP Retransmission] 443  >  62995 [PSH, ACK] Seq=2848 Ack=74740 Win=5476 Len=211"
"119","17.928173800","172.20.40.110","151.101.130.187","TCP","66","62995  >  443 [ACK] Seq=74740 Ack=3059 Win=511 Len=0 SLE=2848 SRE=3059"
"120","18.215400800","172.20.40.110","151.101.130.187","TLSv1.2","2804","Application Data"
"121","18.215624300","172.20.40.110","151.101.130.187","TLSv1.2","2801","Application Data"
"122","18.216363500","172.20.40.110","151.101.130.187","TLSv1.2","2798","Application Data"
"123","18.224912900","151.101.130.187","172.20.40.110","TCP","60","443  >  62995 [ACK] Seq=3059 Ack=77490 Win=5487 Len=0"
"124","18.230401700","151.101.130.187","172.20.40.110","TLSv1.2","135","Application Data"
"125","18.230401700","151.101.130.187","172.20.40.110","TCP","60","443  >  62995 [ACK] Seq=3140 Ack=80237 Win=5498 Len=0"
"126","18.230401700","151.101.130.187","172.20.40.110","TCP","60","443  >  62995 [ACK] Seq=3140 Ack=82981 Win=5508 Len=0"
"127","18.230401700","151.101.130.187","172.20.40.110","TLSv1.2","174","Application Data"
"128","18.230401700","151.101.130.187","172.20.40.110","TLSv1.2","158","Application Data"
"129","18.230669500","172.20.40.110","151.101.130.187","TCP","54","62995  >  443 [ACK] Seq=82981 Ack=3364 Win=509 Len=0"
"130","18.249616500","172.20.40.110","151.101.130.187","TLSv1.2","2802","Application Data"
"131","18.260239800","151.101.130.187","172.20.40.110","TCP","60","443  >  62995 [ACK] Seq=3364 Ack=85729 Win=5519 Len=0"
"132","18.262706300","151.101.130.187","172.20.40.110","TLSv1.2","130","Application Data"
"133","18.284712100","172.20.40.110","151.101.130.187","TLSv1.2","2567","Application Data"
"134","18.285524700","172.20.40.110","151.101.130.187","TLSv1.2","2833","Application Data"
"135","18.295000700","151.101.130.187","172.20.40.110","TCP","130","[TCP Spurious Retransmission] 443  >  62995 [PSH, ACK] Seq=3364 Ack=85729 Win=5519 Len=76"
"136","18.295100000","172.20.40.110","151.101.130.187","TCP","66","[TCP Dup ACK 133#1] 62995  >  443 [ACK] Seq=91021 Ack=3440 Win=509 Len=0 SLE=3364 SRE=3440"
"137","18.299510300","151.101.130.187","172.20.40.110","TCP","60","443  >  62995 [ACK] Seq=3440 Ack=88242 Win=5519 Len=0"
"138","18.299510300","151.101.130.187","172.20.40.110","TCP","60","443  >  62995 [ACK] Seq=3440 Ack=91021 Win=5519 Len=0"
"139","18.301785000","151.101.130.187","172.20.40.110","TLSv1.2","130","Application Data"
"140","18.336450300","151.101.130.187","172.20.40.110","TCP","130","[TCP Retransmission] 443  >  62995 [PSH, ACK] Seq=3440 Ack=91021 Win=5519 Len=76"
"141","18.336516700","172.20.40.110","151.101.130.187","TCP","66","62995  >  443 [ACK] Seq=91021 Ack=3516 Win=509 Len=0 SLE=3440 SRE=3516"
"142","18.351942800","151.101.130.187","172.20.40.110","TLSv1.2","478","Application Data"
"143","18.351942800","151.101.130.187","172.20.40.110","TLSv1.2","814","Application Data"
"144","18.351942800","151.101.130.187","172.20.40.110","TCP","4194","443  >  62995 [ACK] Seq=4700 Ack=91021 Win=5519 Len=4140 [TCP PDU reassembled in 145]"
"145","18.351942800","151.101.130.187","172.20.40.110","TLSv1.2","717","Application Data"
"146","18.352070100","172.20.40.110","151.101.130.187","TCP","54","62995  >  443 [ACK] Seq=91021 Ack=9503 Win=512 Len=0"
"147","18.352830600","172.20.40.110","151.101.130.187","TLSv1.2","89","Application Data"
"148","18.363342900","151.101.130.187","172.20.40.110","TCP","60","443  >  62995 [ACK] Seq=9503 Ack=91056 Win=5519 Len=0"
"149","18.448009800","172.20.40.110","151.101.2.187","TLSv1.2","175","Application Data"
"150","18.448119700","172.20.40.110","151.101.2.187","TLSv1.2","93","Application Data"
"151","18.458523500","151.101.2.187","172.20.40.110","TCP","60","443  >  54874 [ACK] Seq=1 Ack=122 Win=282 Len=0"
"152","18.458523500","151.101.2.187","172.20.40.110","TCP","60","443  >  54874 [ACK] Seq=1 Ack=161 Win=282 Len=0"
"153","18.458523500","151.101.2.187","172.20.40.110","TLSv1.2","93","Application Data"
"154","18.462048600","151.101.2.187","172.20.40.110","TLSv1.2","249","Application Data"
"155","18.462140000","172.20.40.110","151.101.2.187","TCP","54","54874  >  443 [ACK] Seq=161 Ack=235 Win=256 Len=0"
"156","18.653053900","172.20.40.110","151.101.130.187","TLSv1.2","2850","Application Data"
"157","18.662475300","151.101.130.187","172.20.40.110","TCP","60","443  >  62995 [ACK] Seq=9503 Ack=93852 Win=5519 Len=0"
"158","18.664663500","151.101.130.187","172.20.40.110","TLSv1.2","373","Application Data"
"159","18.690476400","172.20.40.110","151.101.130.187","TLSv1.2","2853","Application Data"
"160","18.692535100","172.20.40.110","151.101.130.187","TLSv1.2","2855","Application Data"
"161","18.698511200","151.101.130.187","172.20.40.110","TCP","373","[TCP Spurious Retransmission] 443  >  62995 [PSH, ACK] Seq=9503 Ack=93852 Win=5519 Len=319"
"162","18.698559200","172.20.40.110","151.101.130.187","TCP","66","[TCP Dup ACK 159#1] 62995  >  443 [ACK] Seq=99452 Ack=9822 Win=510 Len=0 SLE=9503 SRE=9822"
"163","18.700389200","151.101.130.187","172.20.40.110","TCP","60","443  >  62995 [ACK] Seq=9822 Ack=96651 Win=5519 Len=0"
"164","18.704283000","151.101.130.187","172.20.40.110","TCP","60","443  >  62995 [ACK] Seq=9822 Ack=99452 Win=5519 Len=0"
"165","18.707522700","151.101.130.187","172.20.40.110","TLSv1.2","207","Application Data"
"166","18.707522700","151.101.130.187","172.20.40.110","TLSv1.2","130","Application Data"
"167","18.707593300","172.20.40.110","151.101.130.187","TCP","54","62995  >  443 [ACK] Seq=99452 Ack=10051 Win=509 Len=0"
"168","18.742294100","172.20.40.110","151.101.130.187","TLSv1.2","2864","Application Data"
"169","18.747472000","172.20.40.110","151.101.130.187","TLSv1.2","2865","Application Data"
"170","18.750904400","172.20.40.110","151.101.130.187","TLSv1.2","2854","Application Data"
"171","18.754780700","151.101.130.187","172.20.40.110","TCP","60","443  >  62995 [ACK] Seq=10051 Ack=102262 Win=5519 Len=0"
"172","18.756067500","151.101.130.187","172.20.40.110","TLSv1.2","131","Application Data"
"173","18.758424800","151.101.130.187","172.20.40.110","TCP","60","443  >  62995 [ACK] Seq=10128 Ack=105073 Win=5519 Len=0"
"174","18.761952900","151.101.130.187","172.20.40.110","TLSv1.2","131","Application Data"
"175","18.761952900","151.101.130.187","172.20.40.110","TCP","60","443  >  62995 [ACK] Seq=10205 Ack=107873 Win=5519 Len=0"
"176","18.762049200","172.20.40.110","151.101.130.187","TCP","54","62995  >  443 [ACK] Seq=107873 Ack=10205 Win=509 Len=0"
"177","18.764042300","151.101.130.187","172.20.40.110","TLSv1.2","130","Application Data"
"178","18.795911700","172.20.40.110","151.101.130.187","TLSv1.2","2848","Application Data"
"179","18.800429400","172.20.40.110","151.101.130.187","TLSv1.2","2849","Application Data"
"180","18.804487800","151.101.130.187","172.20.40.110","TCP","130","[TCP Spurious Retransmission] 443  >  62995 [PSH, ACK] Seq=10205 Ack=107873 Win=5519 Len=76"
"181","18.804487800","151.101.130.187","172.20.40.110","TCP","60","443  >  62995 [ACK] Seq=10281 Ack=110667 Win=5519 Len=0"
"182","18.804544600","172.20.40.110","151.101.130.187","TCP","66","[TCP Dup ACK 178#1] 62995  >  443 [ACK] Seq=113462 Ack=10281 Win=509 Len=0 SLE=10205 SRE=10281"
"183","18.808786300","151.101.130.187","172.20.40.110","TLSv1.2","130","Application Data"
"184","18.809889700","151.101.130.187","172.20.40.110","TCP","60","443  >  62995 [ACK] Seq=10357 Ack=113462 Win=5519 Len=0"
"185","18.813352100","151.101.130.187","172.20.40.110","TLSv1.2","131","Application Data"
"186","18.813433100","172.20.40.110","151.101.130.187","TCP","54","62995  >  443 [ACK] Seq=113462 Ack=10434 Win=508 Len=0"
"187","26.992956700","172.20.40.110","151.101.66.187","TCP","55","56717  >  443 [ACK] Seq=1 Ack=1 Win=254 Len=1"
"188","27.005553800","151.101.66.187","172.20.40.110","TCP","66","443  >  56717 [ACK] Seq=1 Ack=2 Win=198 Len=0 SLE=1 SRE=2"
"189","46.066834300","172.20.40.110","151.101.130.187","TLSv1.2","2830","Application Data"
"190","46.066982100","172.20.40.110","151.101.130.187","TLSv1.2","93","Application Data"
"191","46.080827300","151.101.130.187","172.20.40.110","TCP","60","443  >  62995 [ACK] Seq=10434 Ack=116238 Win=5519 Len=0"
"192","46.080827300","151.101.130.187","172.20.40.110","TCP","60","443  >  62995 [ACK] Seq=10434 Ack=116277 Win=5519 Len=0"
"193","46.080827300","151.101.130.187","172.20.40.110","TLSv1.2","93","Application Data"
"194","46.083268700","151.101.130.187","172.20.40.110","TLSv1.2","214","Application Data"
"195","46.083375900","172.20.40.110","151.101.130.187","TCP","54","62995  >  443 [ACK] Seq=116277 Ack=10633 Win=507 Len=0"
"196","46.186536200","172.20.40.110","151.101.130.187","TLSv1.2","2816","Application Data"
"197","46.201698000","151.101.130.187","172.20.40.110","TCP","60","443  >  62995 [ACK] Seq=10633 Ack=119037 Win=5530 Len=0"
"198","46.201698000","151.101.130.187","172.20.40.110","TCP","60","443  >  62995 [ACK] Seq=10633 Ack=119039 Win=5530 Len=0"
"199","46.202933600","151.101.130.187","172.20.40.110","TLSv1.2","130","Application Data"
"200","46.231142500","172.20.40.110","151.101.130.187","TLSv1.2","2829","Application Data"
"201","46.233697400","151.101.130.187","172.20.40.110","TCP","130","[TCP Spurious Retransmission] 443  >  62995 [PSH, ACK] Seq=10633 Ack=119039 Win=5530 Len=76"
"202","46.233771200","172.20.40.110","151.101.130.187","TCP","66","[TCP Dup ACK 200#1] 62995  >  443 [ACK] Seq=121814 Ack=10709 Win=507 Len=0 SLE=10633 SRE=10709"
"203","46.241502400","151.101.130.187","172.20.40.110","TCP","60","443  >  62995 [ACK] Seq=10709 Ack=121814 Win=5530 Len=0"
"204","46.243883700","151.101.130.187","172.20.40.110","TLSv1.2","104","Application Data"
"205","46.275340800","151.101.130.187","172.20.40.110","TCP","104","[TCP Retransmission] 443  >  62995 [PSH, ACK] Seq=10709 Ack=121814 Win=5530 Len=50"
"206","46.275417600","172.20.40.110","151.101.130.187","TCP","66","62995  >  443 [ACK] Seq=121814 Ack=10759 Win=507 Len=0 SLE=10709 SRE=10759"
"207","46.728133200","172.20.40.110","151.101.130.187","TLSv1.2","2811","Application Data"
"208","46.728449600","172.20.40.110","151.101.130.187","TLSv1.2","2817","Application Data"
"209","46.741386700","151.101.130.187","172.20.40.110","TCP","60","443  >  62995 [ACK] Seq=10759 Ack=124571 Win=5541 Len=0"
"210","46.741386700","151.101.130.187","172.20.40.110","TCP","60","443  >  62995 [ACK] Seq=10759 Ack=127331 Win=5551 Len=0"
"211","46.741386700","151.101.130.187","172.20.40.110","TCP","60","443  >  62995 [ACK] Seq=10759 Ack=127334 Win=5551 Len=0"
"212","46.746554100","151.101.130.187","172.20.40.110","TLSv1.2","130","Application Data"
"213","46.746554100","151.101.130.187","172.20.40.110","TLSv1.2","263","Application Data"
"214","46.746683300","172.20.40.110","151.101.130.187","TCP","54","62995  >  443 [ACK] Seq=127334 Ack=11044 Win=512 Len=0"
"215","47.998466500","172.20.40.110","151.101.130.187","TLSv1.2","2818","Application Data"
"216","47.998848700","172.20.40.110","151.101.130.187","TLSv1.2","2815","Application Data"
"217","47.999106100","172.20.40.110","151.101.130.187","TLSv1.2","2812","Application Data"
"218","48.013583300","151.101.130.187","172.20.40.110","TCP","60","443  >  62995 [ACK] Seq=11044 Ack=130094 Win=5562 Len=0"
"219","48.013583300","151.101.130.187","172.20.40.110","TCP","60","443  >  62995 [ACK] Seq=11044 Ack=130098 Win=5562 Len=0"
"220","48.013583300","151.101.130.187","172.20.40.110","TCP","60","443  >  62995 [ACK] Seq=11044 Ack=132858 Win=5573 Len=0"
"221","48.013583300","151.101.130.187","172.20.40.110","TCP","60","443  >  62995 [ACK] Seq=11044 Ack=132859 Win=5573 Len=0"
"222","48.013583300","151.101.130.187","172.20.40.110","TCP","60","443  >  62995 [ACK] Seq=11044 Ack=135617 Win=5584 Len=0"
"223","48.017836700","151.101.130.187","172.20.40.110","TLSv1.2","240","Application Data"
"224","48.017836700","151.101.130.187","172.20.40.110","TLSv1.2","207","Application Data"
"225","48.017836700","151.101.130.187","172.20.40.110","TLSv1.2","130","Application Data"
"226","48.017945400","172.20.40.110","151.101.130.187","TCP","54","62995  >  443 [ACK] Seq=135617 Ack=11459 Win=510 Len=0"
"227","48.638309600","172.20.40.110","151.101.130.187","TLSv1.2","2825","Application Data"
"228","48.649865700","151.101.130.187","172.20.40.110","TCP","60","443  >  62995 [ACK] Seq=11459 Ack=138388 Win=5584 Len=0"
"229","48.653667300","151.101.130.187","172.20.40.110","TLSv1.2","130","Application Data"
"230","48.680139100","151.101.130.187","172.20.40.110","TCP","130","[TCP Retransmission] 443  >  62995 [PSH, ACK] Seq=11459 Ack=138388 Win=5584 Len=76"
"231","48.680230600","172.20.40.110","151.101.130.187","TCP","66","62995  >  443 [ACK] Seq=138388 Ack=11535 Win=510 Len=0 SLE=11459 SRE=11535"
"232","49.646043300","172.20.40.110","151.101.130.187","TLSv1.2","2797","Application Data"
"233","49.667453600","151.101.130.187","172.20.40.110","TCP","60","443  >  62995 [ACK] Seq=11535 Ack=141131 Win=5595 Len=0"
"234","49.667453600","151.101.130.187","172.20.40.110","TLSv1.2","241","Application Data"
"235","49.687926800","151.101.130.187","172.20.40.110","TCP","241","[TCP Retransmission] 443  >  62995 [PSH, ACK] Seq=11535 Ack=141131 Win=5595 Len=187"
"236","49.688006500","172.20.40.110","151.101.130.187","TCP","66","62995  >  443 [ACK] Seq=141131 Ack=11722 Win=509 Len=0 SLE=11535 SRE=11722"
"237","49.957942700","172.20.40.110","151.101.130.187","TLSv1.2","2797","Application Data"
"238","49.968166700","151.101.130.187","172.20.40.110","TCP","60","443  >  62995 [ACK] Seq=11722 Ack=143874 Win=5605 Len=0"
"239","49.970142800","151.101.130.187","172.20.40.110","TLSv1.2","240","Application Data"
"240","50.000112700","151.101.130.187","172.20.40.110","TCP","240","[TCP Retransmission] 443  >  62995 [PSH, ACK] Seq=11722 Ack=143874 Win=5605 Len=186"
"241","50.000254500","172.20.40.110","151.101.130.187","TCP","66","62995  >  443 [ACK] Seq=143874 Ack=11908 Win=508 Len=0 SLE=11722 SRE=11908"
"242","50.712018300","172.20.40.110","151.101.130.187","TLSv1.2","2797","Application Data"
"243","50.726018700","151.101.130.187","172.20.40.110","TCP","60","443  >  62995 [ACK] Seq=11908 Ack=146617 Win=5616 Len=0"
"244","50.727530800","172.20.40.110","151.101.130.187","TLSv1.2","2797","Application Data"
"245","50.731188000","151.101.130.187","172.20.40.110","TLSv1.2","104","Application Data"
"246","50.742341900","151.101.130.187","172.20.40.110","TCP","60","443  >  62995 [ACK] Seq=11958 Ack=149360 Win=5627 Len=0"
"247","50.748599000","151.101.130.187","172.20.40.110","TLSv1.2","104","Application Data"
"248","50.748697600","172.20.40.110","151.101.130.187","TCP","54","62995  >  443 [ACK] Seq=149360 Ack=12008 Win=508 Len=0"
"249","54.047774200","172.20.40.110","151.101.130.187","TLSv1.2","2812","Application Data"
"250","54.050249000","172.20.40.110","151.101.130.187","TLSv1.2","2800","Application Data"
"251","54.051147700","172.20.40.110","151.101.130.187","TLSv1.2","2794","Application Data"
"252","54.057352300","172.20.40.110","151.101.130.187","TLSv1.2","2813","Application Data"
"253","54.063666300","151.101.130.187","172.20.40.110","TCP","60","443  >  62995 [ACK] Seq=12008 Ack=152118 Win=5637 Len=0"
"254","54.063666300","151.101.130.187","172.20.40.110","TCP","60","443  >  62995 [ACK] Seq=12008 Ack=154864 Win=5648 Len=0"
"255","54.063666300","151.101.130.187","172.20.40.110","TLSv1.2","241","Application Data"
"256","54.068052000","151.101.130.187","172.20.40.110","TLSv1.2","263","Application Data"
"257","54.068052000","151.101.130.187","172.20.40.110","TCP","60","443  >  62995 [ACK] Seq=12404 Ack=157604 Win=5654 Len=0"
"258","54.068052000","151.101.130.187","172.20.40.110","TLSv1.2","130","Application Data"
"259","54.068172200","172.20.40.110","151.101.130.187","TCP","54","62995  >  443 [ACK] Seq=160363 Ack=12480 Win=512 Len=0"
"260","54.073923700","151.101.130.187","172.20.40.110","TCP","60","443  >  62995 [ACK] Seq=12480 Ack=160363 Win=5665 Len=0"
"261","54.073923700","151.101.130.187","172.20.40.110","TLSv1.2","131","Application Data"
"262","54.074053500","172.20.40.110","151.101.130.187","TCP","54","62995  >  443 [ACK] Seq=160363 Ack=12557 Win=511 Len=0"
"263","54.246558900","172.20.40.110","151.101.130.187","TLSv1.2","2816","Application Data"
"264","54.262665300","151.101.130.187","172.20.40.110","TCP","60","443  >  62995 [ACK] Seq=12557 Ack=163123 Win=5676 Len=0"
"265","54.262665300","151.101.130.187","172.20.40.110","TCP","60","443  >  62995 [ACK] Seq=12557 Ack=163125 Win=5676 Len=0"
"266","54.262665300","151.101.130.187","172.20.40.110","TLSv1.2","207","Application Data"
"267","54.293498000","151.101.130.187","172.20.40.110","TCP","207","[TCP Retransmission] 443  >  62995 [PSH, ACK] Seq=12557 Ack=163125 Win=5676 Len=153"
"268","54.293571600","172.20.40.110","151.101.130.187","TCP","66","62995  >  443 [ACK] Seq=163125 Ack=12710 Win=511 Len=0 SLE=12557 SRE=12710"
"269","54.752110400","172.20.40.110","151.101.130.187","TLSv1.2","2804","Application Data"
"270","54.763978400","151.101.130.187","172.20.40.110","TCP","60","443  >  62995 [ACK] Seq=12710 Ack=165875 Win=5687 Len=0"
"271","54.766726500","151.101.130.187","172.20.40.110","TLSv1.2","104","Application Data"
"272","54.799632400","151.101.130.187","172.20.40.110","TCP","104","[TCP Retransmission] 443  >  62995 [PSH, ACK] Seq=12710 Ack=165875 Win=5687 Len=50"
"273","54.799729700","172.20.40.110","151.101.130.187","TCP","66","62995  >  443 [ACK] Seq=165875 Ack=12760 Win=511 Len=0 SLE=12710 SRE=12760"
"274","54.876105600","172.20.40.110","151.101.130.187","TLSv1.2","2804","Application Data"
"275","54.876358100","172.20.40.110","151.101.130.187","TLSv1.2","2801","Application Data"
"276","54.887822800","151.101.130.187","172.20.40.110","TCP","60","443  >  62995 [ACK] Seq=12760 Ack=168625 Win=5698 Len=0"
"277","54.887822800","151.101.130.187","172.20.40.110","TCP","60","443  >  62995 [ACK] Seq=12760 Ack=171372 Win=5708 Len=0"
"278","54.887822800","151.101.130.187","172.20.40.110","TLSv1.2","239","Application Data"
"279","54.889177700","151.101.130.187","172.20.40.110","TLSv1.2","130","Application Data"
"280","54.889245300","172.20.40.110","151.101.130.187","TCP","54","62995  >  443 [ACK] Seq=171372 Ack=13021 Win=509 Len=0"
"281","54.892626800","172.20.40.110","151.101.130.187","TLSv1.2","2798","Application Data"
"282","54.901929500","151.101.130.187","172.20.40.110","TCP","60","443  >  62995 [ACK] Seq=13021 Ack=174116 Win=5719 Len=0"
"283","54.908568800","151.101.130.187","172.20.40.110","TLSv1.2","130","Application Data"
"284","54.937624100","151.101.130.187","172.20.40.110","TCP","130","[TCP Retransmission] 443  >  62995 [PSH, ACK] Seq=13021 Ack=174116 Win=5719 Len=76"
"285","54.937756500","172.20.40.110","151.101.130.187","TCP","66","62995  >  443 [ACK] Seq=174116 Ack=13097 Win=509 Len=0 SLE=13021 SRE=13097"
"286","55.062338200","172.20.40.110","151.101.130.187","TLSv1.2","2809","Application Data"
"287","55.073682200","151.101.130.187","172.20.40.110","TCP","60","443  >  62995 [ACK] Seq=13097 Ack=176871 Win=5730 Len=0"
"288","55.075244600","151.101.130.187","172.20.40.110","TLSv1.2","104","Application Data"
"289","55.093809700","172.20.40.110","151.101.130.187","TLSv1.2","2808","Application Data"
"290","55.103593400","151.101.130.187","172.20.40.110","TCP","60","443  >  62995 [ACK] Seq=13147 Ack=179625 Win=5741 Len=0"
"291","55.106813700","151.101.130.187","172.20.40.110","TLSv1.2","104","Application Data"
"292","55.139172900","151.101.130.187","172.20.40.110","TCP","104","[TCP Retransmission] 443  >  62995 [PSH, ACK] Seq=13147 Ack=179625 Win=5741 Len=50"
"293","55.139229800","172.20.40.110","151.101.130.187","TCP","66","62995  >  443 [ACK] Seq=179625 Ack=13197 Win=509 Len=0 SLE=13147 SRE=13197"
"294","55.201912200","172.20.40.110","151.101.130.187","TLSv1.2","2806","Application Data"
"295","55.213101800","151.101.130.187","172.20.40.110","TCP","60","443  >  62995 [ACK] Seq=13197 Ack=182377 Win=5751 Len=0"
"296","55.214799400","151.101.130.187","172.20.40.110","TLSv1.2","125","Application Data"
"297","55.250163400","151.101.130.187","172.20.40.110","TCP","125","[TCP Retransmission] 443  >  62995 [PSH, ACK] Seq=13197 Ack=182377 Win=5751 Len=71"
"298","55.250222700","172.20.40.110","151.101.130.187","TCP","66","62995  >  443 [ACK] Seq=182377 Ack=13268 Win=509 Len=0 SLE=13197 SRE=13268"
"299","55.697492300","172.20.40.110","151.101.130.187","TLSv1.2","2796","Application Data"
"300","55.697697400","172.20.40.110","151.101.130.187","TLSv1.2","2790","Application Data"
"301","55.714762300","151.101.130.187","172.20.40.110","TCP","60","443  >  62995 [ACK] Seq=13268 Ack=185119 Win=5757 Len=0"
"302","55.714762300","151.101.130.187","172.20.40.110","TCP","60","443  >  62995 [ACK] Seq=13268 Ack=187855 Win=5768 Len=0"
"303","55.717737900","151.101.130.187","172.20.40.110","TLSv1.2","154","Application Data, Application Data"
"304","55.717803800","172.20.40.110","151.101.130.187","TCP","54","62995  >  443 [ACK] Seq=187855 Ack=13368 Win=508 Len=0"
"305","55.844888800","172.20.40.110","151.101.130.187","TLSv1.2","2812","Application Data"
"306","55.857072900","151.101.130.187","172.20.40.110","TCP","60","443  >  62995 [ACK] Seq=13368 Ack=190613 Win=5778 Len=0"
"307","55.861157900","151.101.130.187","172.20.40.110","TLSv1.2","214","Application Data"
"308","55.892493500","151.101.130.187","172.20.40.110","TCP","214","[TCP Retransmission] 443  >  62995 [PSH, ACK] Seq=13368 Ack=190613 Win=5778 Len=160"
"309","55.892559800","172.20.40.110","151.101.130.187","TCP","66","62995  >  443 [ACK] Seq=190613 Ack=13528 Win=508 Len=0 SLE=13368 SRE=13528"
"310","56.121470700","172.20.40.110","151.101.130.187","TLSv1.2","2792","Application Data"
"311","56.132109500","151.101.130.187","172.20.40.110","TCP","60","443  >  62995 [ACK] Seq=13528 Ack=193351 Win=5789 Len=0"
"312","56.135225900","151.101.130.187","172.20.40.110","TLSv1.2","264","Application Data"
"313","56.168475600","151.101.130.187","172.20.40.110","TCP","264","[TCP Retransmission] 443  >  62995 [PSH, ACK] Seq=13528 Ack=193351 Win=5789 Len=210"
"314","56.168527900","172.20.40.110","151.101.130.187","TCP","66","62995  >  443 [ACK] Seq=193351 Ack=13738 Win=507 Len=0 SLE=13528 SRE=13738"
"315","56.744860600","172.20.40.110","151.101.130.187","TLSv1.2","2808","Application Data"
"316","56.745702000","172.20.40.110","151.101.130.187","TLSv1.2","2797","Application Data"
"317","56.745874100","172.20.40.110","151.101.130.187","TLSv1.2","2794","Application Data"
"318","56.745971600","172.20.40.110","151.101.130.187","TLSv1.2","2807","Application Data"
"319","56.747718500","172.20.40.110","151.101.130.187","TLSv1.2","2791","Application Data"
"320","56.759897400","151.101.130.187","172.20.40.110","TCP","60","443  >  62995 [ACK] Seq=13738 Ack=196105 Win=5800 Len=0"
"321","56.760418000","151.101.130.187","172.20.40.110","TCP","60","443  >  62995 [ACK] Seq=13738 Ack=198848 Win=5811 Len=0"
"322","56.760418000","151.101.130.187","172.20.40.110","TCP","60","443  >  62995 [ACK] Seq=13738 Ack=201588 Win=5821 Len=0"
"323","56.761812600","151.101.130.187","172.20.40.110","TCP","60","443  >  62995 [ACK] Seq=13738 Ack=204341 Win=5832 Len=0"
"324","56.761812600","151.101.130.187","172.20.40.110","TCP","60","443  >  62995 [ACK] Seq=13738 Ack=207078 Win=5843 Len=0"
"325","56.765139800","151.101.130.187","172.20.40.110","TLSv1.2","104","Application Data"
"326","56.765139800","151.101.130.187","172.20.40.110","TLSv1.2","130","Application Data"
"327","56.765231300","172.20.40.110","151.101.130.187","TCP","54","62995  >  443 [ACK] Seq=207078 Ack=13864 Win=512 Len=0"
"328","56.767972400","151.101.130.187","172.20.40.110","TLSv1.2","104","Application Data"
"329","56.767972400","151.101.130.187","172.20.40.110","TLSv1.2","148","Application Data"
"330","56.767972400","151.101.130.187","172.20.40.110","TLSv1.2","163","Application Data"
"331","56.768078800","172.20.40.110","151.101.130.187","TCP","54","62995  >  443 [ACK] Seq=207078 Ack=14117 Win=511 Len=0"
"332","57.023573000","172.20.40.110","151.101.130.187","TLSv1.2","2804","Application Data"
"333","57.037367800","151.101.130.187","172.20.40.110","TCP","60","443  >  62995 [ACK] Seq=14117 Ack=209828 Win=5848 Len=0"
"334","57.044987500","151.101.130.187","172.20.40.110","TLSv1.2","240","Application Data"
"335","57.067892600","151.101.130.187","172.20.40.110","TCP","240","[TCP Retransmission] 443  >  62995 [PSH, ACK] Seq=14117 Ack=209828 Win=5848 Len=186"
"336","57.067955000","172.20.40.110","151.101.130.187","TCP","66","62995  >  443 [ACK] Seq=209828 Ack=14303 Win=510 Len=0 SLE=14117 SRE=14303"
