"No.","Time","Source","Destination","Protocol","Length","Info"
"1","0.000000000","172.20.40.110","151.101.66.187","TLSv1.2","2861","Application Data"
"2","0.000410100","172.20.40.110","151.101.66.187","TLSv1.2","93","Application Data"
"3","0.018079600","151.101.66.187","172.20.40.110","TCP","60","443  >  57039 [ACK] Seq=1 Ack=2808 Win=4355 Len=0"
"4","0.018079600","151.101.66.187","172.20.40.110","TCP","60","443  >  57039 [ACK] Seq=1 Ack=2847 Win=4355 Len=0"
"5","0.020177300","151.101.66.187","172.20.40.110","TLSv1.2","93","Application Data"
"6","0.022229800","151.101.66.187","172.20.40.110","TLSv1.2","241","Application Data"
"7","0.022311700","172.20.40.110","151.101.66.187","TCP","54","57039  >  443 [ACK] Seq=2847 Ack=227 Win=515 Len=0"
"8","2.273856100","172.20.40.110","151.101.66.187","TLSv1.2","2861","Application Data"
"9","2.283902800","151.101.66.187","172.20.40.110","TCP","60","443  >  57039 [ACK] Seq=227 Ack=5654 Win=4355 Len=0"
"10","2.286770300","151.101.66.187","172.20.40.110","TLSv1.2","214","Application Data"
"11","2.318559000","151.101.66.187","172.20.40.110","TCP","214","[TCP Retransmission] 443  >  57039 [PSH, ACK] Seq=227 Ack=5654 Win=4355 Len=160"
"12","2.318617300","172.20.40.110","151.101.66.187","TCP","66","57039  >  443 [ACK] Seq=5654 Ack=387 Win=514 Len=0 SLE=227 SRE=387"
"13","5.133667200","172.20.40.110","151.101.66.187","TLSv1.2","2861","Application Data"
"14","5.148108200","151.101.66.187","172.20.40.110","TCP","60","443  >  57039 [ACK] Seq=387 Ack=8461 Win=4355 Len=0"
"15","5.150540400","151.101.66.187","172.20.40.110","TLSv1.2","214","Application Data"
"16","5.184096500","151.101.66.187","172.20.40.110","TCP","214","[TCP Retransmission] 443  >  57039 [PSH, ACK] Seq=387 Ack=8461 Win=4355 Len=160"
"17","5.184248700","172.20.40.110","151.101.66.187","TCP","66","57039  >  443 [ACK] Seq=8461 Ack=547 Win=514 Len=0 SLE=387 SRE=547"
"18","8.095433100","172.20.40.110","151.101.66.187","TLSv1.2","2825","Application Data"
"19","8.105390900","151.101.66.187","172.20.40.110","TCP","60","443  >  57039 [ACK] Seq=547 Ack=11232 Win=4355 Len=0"
"20","8.107442000","172.20.40.110","151.101.66.187","TLSv1.2","2821","Application Data"
"21","8.108863300","172.20.40.110","151.101.66.187","TLSv1.2","2823","Application Data"
"22","8.109952700","151.101.66.187","172.20.40.110","TLSv1.2","245","Application Data"
"23","8.109989300","172.20.40.110","151.101.66.187","TLSv1.2","2827","Application Data"
"24","8.116528800","151.101.66.187","172.20.40.110","TCP","60","443  >  57039 [ACK] Seq=738 Ack=13999 Win=4355 Len=0"
"25","8.119846300","151.101.66.187","172.20.40.110","TLSv1.2","176","Application Data"
"26","8.121951800","151.101.66.187","172.20.40.110","TCP","60","443  >  57039 [ACK] Seq=860 Ack=16768 Win=4355 Len=0"
"27","8.121951800","151.101.66.187","172.20.40.110","TCP","60","443  >  57039 [ACK] Seq=860 Ack=19541 Win=4355 Len=0"
"28","8.122784200","172.20.40.110","151.101.66.187","TCP","54","57039  >  443 [ACK] Seq=19541 Ack=860 Win=512 Len=0"
"29","8.125225500","151.101.66.187","172.20.40.110","TLSv1.2","263","Application Data"
"30","8.125225500","151.101.66.187","172.20.40.110","TLSv1.2","130","Application Data"
"31","8.125321500","172.20.40.110","151.101.66.187","TCP","54","57039  >  443 [ACK] Seq=19541 Ack=1145 Win=517 Len=0"
"32","8.240081900","172.20.40.110","151.101.66.187","TLSv1.2","2823","Application Data"
"33","8.254078300","151.101.66.187","172.20.40.110","TCP","60","443  >  57039 [ACK] Seq=1145 Ack=22310 Win=4360 Len=0"
"34","8.256758800","151.101.66.187","172.20.40.110","TLSv1.2","98","Application Data"
"35","8.268172200","172.20.40.110","151.101.66.187","TLSv1.2","2831","Application Data"
"36","8.279110800","151.101.66.187","172.20.40.110","TCP","60","443  >  57039 [ACK] Seq=1189 Ack=25087 Win=4360 Len=0"
"37","8.281543500","151.101.66.187","172.20.40.110","TLSv1.2","98","Application Data"
"38","8.301246800","172.20.40.110","151.101.66.187","TLSv1.2","2821","Application Data"
"39","8.309874900","151.101.66.187","172.20.40.110","TCP","60","443  >  57039 [ACK] Seq=1233 Ack=27854 Win=4360 Len=0"
"40","8.315092400","151.101.66.187","172.20.40.110","TLSv1.2","158","Application Data"
"41","8.318265000","172.20.40.110","151.101.66.187","TLSv1.2","2823","Application Data"
"42","8.328001600","151.101.66.187","172.20.40.110","TCP","60","443  >  57039 [ACK] Seq=1337 Ack=30623 Win=4360 Len=0"
"43","8.331362300","151.101.66.187","172.20.40.110","TLSv1.2","98","Application Data"
"44","8.333313700","172.20.40.110","151.101.66.187","TLSv1.2","2819","Application Data"
"45","8.346981700","151.101.66.187","172.20.40.110","TCP","60","443  >  57039 [ACK] Seq=1381 Ack=33383 Win=4371 Len=0"
"46","8.348315400","151.101.66.187","172.20.40.110","TCP","60","443  >  57039 [ACK] Seq=1381 Ack=33388 Win=4371 Len=0"
"47","8.348315400","151.101.66.187","172.20.40.110","TLSv1.2","130","Application Data"
"48","8.382724800","151.101.66.187","172.20.40.110","TCP","130","[TCP Retransmission] 443  >  57039 [PSH, ACK] Seq=1381 Ack=33388 Win=4371 Len=76"
"49","8.382798900","172.20.40.110","151.101.66.187","TCP","66","57039  >  443 [ACK] Seq=33388 Ack=1457 Win=516 Len=0 SLE=1381 SRE=1457"
"50","8.449746100","172.20.40.110","151.101.66.187","TLSv1.2","2821","Application Data"
"51","8.459316500","151.101.66.187","172.20.40.110","TCP","60","443  >  57039 [ACK] Seq=1457 Ack=36155 Win=4371 Len=0"
"52","8.462050400","151.101.66.187","172.20.40.110","TLSv1.2","124","Application Data"
"53","8.497567600","151.101.66.187","172.20.40.110","TCP","124","[TCP Retransmission] 443  >  57039 [PSH, ACK] Seq=1457 Ack=36155 Win=4371 Len=70"
"54","8.497665900","172.20.40.110","151.101.66.187","TCP","66","57039  >  443 [ACK] Seq=36155 Ack=1527 Win=516 Len=0 SLE=1457 SRE=1527"
"55","8.626856400","172.20.40.110","151.101.66.187","TLSv1.2","2821","Application Data"
"56","8.638865400","151.101.66.187","172.20.40.110","TCP","60","443  >  57039 [ACK] Seq=1527 Ack=38922 Win=4371 Len=0"
"57","8.641271300","151.101.66.187","172.20.40.110","TLSv1.2","241","Application Data"
"58","8.677987200","151.101.66.187","172.20.40.110","TCP","241","[TCP Retransmission] 443  >  57039 [PSH, ACK] Seq=1527 Ack=38922 Win=4371 Len=187"
"59","8.678042600","172.20.40.110","151.101.66.187","TCP","66","57039  >  443 [ACK] Seq=38922 Ack=1714 Win=515 Len=0 SLE=1527 SRE=1714"
"60","10.413045500","172.20.40.110","151.101.66.187","TLSv1.2","2837","Application Data"
"61","10.422214200","172.20.40.110","151.101.66.187","TLSv1.2","2825","Application Data"
"62","10.422462400","172.20.40.110","151.101.66.187","TLSv1.2","2819","Application Data"
"63","10.424620400","151.101.66.187","172.20.40.110","TCP","60","443  >  57039 [ACK] Seq=1714 Ack=41705 Win=4371 Len=0"
"64","10.428467700","151.101.66.187","172.20.40.110","TLSv1.2","241","Application Data"
"65","10.434052400","151.101.66.187","172.20.40.110","TCP","60","443  >  57039 [ACK] Seq=1901 Ack=44476 Win=4377 Len=0"
"66","10.434052400","151.101.66.187","172.20.40.110","TCP","60","443  >  57039 [ACK] Seq=1901 Ack=47236 Win=4388 Len=0"
"67","10.434052400","151.101.66.187","172.20.40.110","TCP","60","443  >  57039 [ACK] Seq=1901 Ack=47241 Win=4388 Len=0"
"68","10.436618600","151.101.66.187","172.20.40.110","TLSv1.2","130","Application Data"
"69","10.436728200","172.20.40.110","151.101.66.187","TCP","54","57039  >  443 [ACK] Seq=47241 Ack=1977 Win=514 Len=0"
"70","10.437465000","151.101.66.187","172.20.40.110","TLSv1.2","130","Application Data"
"71","10.443439100","172.20.40.110","151.101.66.187","TLSv1.2","2838","Application Data"
"72","10.454591600","151.101.66.187","172.20.40.110","TCP","60","443  >  57039 [ACK] Seq=2053 Ack=50025 Win=4393 Len=0"
"73","10.456748600","151.101.66.187","172.20.40.110","TLSv1.2","131","Application Data"
"74","10.492101900","151.101.66.187","172.20.40.110","TCP","131","[TCP Retransmission] 443  >  57039 [PSH, ACK] Seq=2053 Ack=50025 Win=4393 Len=77"
"75","10.492162100","172.20.40.110","151.101.66.187","TCP","66","57039  >  443 [ACK] Seq=50025 Ack=2130 Win=513 Len=0 SLE=2053 SRE=2130"
"76","10.687943200","172.20.40.110","151.101.66.187","TLSv1.2","2823","Application Data"
"77","10.690804500","172.20.40.110","151.101.66.187","TLSv1.2","2826","Application Data"
"78","10.691288400","172.20.40.110","151.101.66.187","TLSv1.2","2820","Application Data"
"79","10.699388400","151.101.66.187","172.20.40.110","TCP","60","443  >  57039 [ACK] Seq=2130 Ack=52794 Win=4393 Len=0"
"80","10.699388400","151.101.66.187","172.20.40.110","TCP","60","443  >  57039 [ACK] Seq=2130 Ack=55566 Win=4393 Len=0"
"81","10.703196800","151.101.66.187","172.20.40.110","TLSv1.2","240","Application Data"
"82","10.704514300","151.101.66.187","172.20.40.110","TLSv1.2","305","Application Data"
"83","10.704629800","172.20.40.110","151.101.66.187","TCP","54","57039  >  443 [ACK] Seq=58332 Ack=2567 Win=517 Len=0"
"84","10.712486900","151.101.66.187","172.20.40.110","TCP","60","443  >  57039 [ACK] Seq=2567 Ack=58332 Win=4393 Len=0"
"85","10.712958500","151.101.66.187","172.20.40.110","TLSv1.2","130","Application Data"
"86","10.747019900","151.101.66.187","172.20.40.110","TCP","130","[TCP Retransmission] 443  >  57039 [PSH, ACK] Seq=2567 Ack=58332 Win=4393 Len=76"
"87","10.747085900","172.20.40.110","151.101.66.187","TCP","66","57039  >  443 [ACK] Seq=58332 Ack=2643 Win=517 Len=0 SLE=2567 SRE=2643"
"88","10.750054700","172.20.40.110","151.101.66.187","TLSv1.2","2837","Application Data"
"89","10.754213400","172.20.40.110","151.101.66.187","TLSv1.2","2841","Application Data"
"90","10.761100800","151.101.66.187","172.20.40.110","TCP","60","443  >  57039 [ACK] Seq=2643 Ack=61115 Win=4399 Len=0"
"91","10.764502500","151.101.66.187","172.20.40.110","TCP","60","443  >  57039 [ACK] Seq=2643 Ack=63902 Win=4399 Len=0"
"92","10.765615400","151.101.66.187","172.20.40.110","TLSv1.2","158","Application Data"
"93","10.770176500","151.101.66.187","172.20.40.110","TLSv1.2","124","Application Data"
"94","10.770485000","172.20.40.110","151.101.66.187","TCP","54","57039  >  443 [ACK] Seq=63902 Ack=2817 Win=516 Len=0"
"95","10.816978700","172.20.40.110","151.101.66.187","TLSv1.2","2823","Application Data"
"96","10.825587800","151.101.66.187","172.20.40.110","TCP","60","443  >  57039 [ACK] Seq=2817 Ack=66671 Win=4399 Len=0"
"97","10.829512400","151.101.66.187","172.20.40.110","TLSv1.2","131","Application Data"
"98","10.837240600","172.20.40.110","151.101.66.187","TLSv1.2","2823","Application Data"
"99","10.846233300","151.101.66.187","172.20.40.110","TCP","60","443  >  57039 [ACK] Seq=2894 Ack=69440 Win=4399 Len=0"
"100","10.850723000","151.101.66.187","172.20.40.110","TLSv1.2","131","Application Data"
"101","10.882884700","151.101.66.187","172.20.40.110","TCP","131","[TCP Retransmission] 443  >  57039 [PSH, ACK] Seq=2894 Ack=69440 Win=4399 Len=77"
"102","10.882942800","172.20.40.110","151.101.66.187","TCP","66","57039  >  443 [ACK] Seq=69440 Ack=2971 Win=515 Len=0 SLE=2894 SRE=2971"
"103","11.875202300","172.20.40.110","151.101.66.187","TLSv1.2","2793","Application Data"
"104","11.891075100","151.101.66.187","172.20.40.110","TCP","60","443  >  57039 [ACK] Seq=2971 Ack=72179 Win=4410 Len=0"
"105","11.896370700","151.101.66.187","172.20.40.110","TLSv1.2","214","Application Data"
"106","11.927683200","151.101.66.187","172.20.40.110","TCP","214","[TCP Retransmission] 443  >  57039 [PSH, ACK] Seq=2971 Ack=72179 Win=4410 Len=160"
"107","11.927753600","172.20.40.110","151.101.66.187","TCP","66","57039  >  443 [ACK] Seq=72179 Ack=3131 Win=515 Len=0 SLE=2971 SRE=3131"
"108","12.027863300","172.20.40.110","151.101.66.187","TLSv1.2","2794","Application Data"
"109","12.048026000","151.101.66.187","172.20.40.110","TCP","60","443  >  57039 [ACK] Seq=3131 Ack=73559 Win=4415 Len=0"
"110","12.063695900","151.101.66.187","172.20.40.110","TCP","60","443  >  57039 [ACK] Seq=3131 Ack=74919 Win=4421 Len=0"
"111","12.068239400","151.101.66.187","172.20.40.110","TLSv1.2","98","Application Data"
"112","12.099350500","151.101.66.187","172.20.40.110","TCP","98","[TCP Retransmission] 443  >  57039 [PSH, ACK] Seq=3131 Ack=74919 Win=4421 Len=44"
"113","12.099419200","172.20.40.110","151.101.66.187","TCP","66","57039  >  443 [ACK] Seq=74919 Ack=3175 Win=515 Len=0 SLE=3131 SRE=3175"
"114","12.190169500","172.20.40.110","151.101.66.187","TLSv1.2","2781","Application Data"
"115","12.199145000","151.101.66.187","172.20.40.110","TCP","60","443  >  57039 [ACK] Seq=3175 Ack=76299 Win=4427 Len=0"
"116","12.201031000","151.101.66.187","172.20.40.110","TCP","60","443  >  57039 [ACK] Seq=3175 Ack=77646 Win=4433 Len=0"
"117","12.208882400","151.101.66.187","172.20.40.110","TLSv1.2","104","Application Data"
"118","12.238395600","151.101.66.187","172.20.40.110","TCP","104","[TCP Retransmission] 443  >  57039 [PSH, ACK] Seq=3175 Ack=77646 Win=4433 Len=50"
"119","12.238449500","172.20.40.110","151.101.66.187","TCP","66","57039  >  443 [ACK] Seq=77646 Ack=3225 Win=514 Len=0 SLE=3175 SRE=3225"
"120","12.649740100","172.20.40.110","151.101.66.187","TCP","54","51833  >  443 [FIN, ACK] Seq=1 Ack=1 Win=256 Len=0"
"121","12.651735400","172.20.40.110","151.101.66.187","TCP","54","57039  >  443 [FIN, ACK] Seq=77646 Ack=3225 Win=514 Len=0"
"122","12.659386600","151.101.66.187","172.20.40.110","TCP","60","443  >  51833 [ACK] Seq=1 Ack=2 Win=281 Len=0"
"123","12.659386600","151.101.66.187","172.20.40.110","TLSv1.2","78","Application Data"
"124","12.659941200","172.20.40.110","151.101.66.187","TCP","54","51833  >  443 [RST, ACK] Seq=2 Ack=25 Win=0 Len=0"
"125","12.665187700","151.101.66.187","172.20.40.110","TCP","60","443  >  51833 [FIN, ACK] Seq=25 Ack=2 Win=281 Len=0"
"126","12.665187700","151.101.66.187","172.20.40.110","TCP","60","443  >  57039 [ACK] Seq=3225 Ack=77647 Win=4433 Len=0"
"127","12.665187700","151.101.66.187","172.20.40.110","TLSv1.2","78","Application Data"
"128","12.665187700","151.101.66.187","172.20.40.110","TCP","60","443  >  57039 [FIN, ACK] Seq=3249 Ack=77647 Win=4433 Len=0"
"129","12.666550100","172.20.40.110","151.101.66.187","TCP","54","57039  >  443 [RST, ACK] Seq=77647 Ack=3249 Win=0 Len=0"
"130","17.746454000","172.20.40.110","151.101.194.187","TCP","66","50060  >  443 [SYN] Seq=0 Win=64240 Len=0 MSS=1460 WS=256 SACK_PERM"
"131","17.754341300","151.101.194.187","172.20.40.110","TCP","66","443  >  50060 [SYN, ACK] Seq=0 Ack=1 Win=65535 Len=0 MSS=1380 SACK_PERM WS=512"
"132","17.754483600","172.20.40.110","151.101.194.187","TCP","54","50060  >  443 [ACK] Seq=1 Ack=1 Win=66048 Len=0"
"133","17.755426700","172.20.40.110","151.101.194.187","TLSv1.3","2065","Client Hello (SNI=www.target.com)"
"134","17.764312400","151.101.194.187","172.20.40.110","TCP","60","443  >  50060 [ACK] Seq=1 Ack=2012 Win=144384 Len=0"
"135","17.779594200","151.101.194.187","172.20.40.110","TLSv1.3","1434","Server Hello, Change Cipher Spec, Application Data, Application Data"
"136","17.779594200","151.101.194.187","172.20.40.110","TLSv1.3","215","Application Data"
"137","17.779671400","172.20.40.110","151.101.194.187","TCP","54","50060  >  443 [ACK] Seq=2012 Ack=1542 Win=66048 Len=0"
"138","17.782778500","172.20.40.110","151.101.194.187","TLSv1.3","118","Change Cipher Spec, Application Data"
"139","17.783234500","172.20.40.110","151.101.194.187","TLSv1.3","146","Application Data"
"140","17.784148600","172.20.40.110","151.101.194.187","TLSv1.3","2809","Application Data"
"141","17.784589700","172.20.40.110","151.101.194.187","TLSv1.3","2805","Application Data"
"142","17.784974500","172.20.40.110","151.101.194.187","TLSv1.3","2805","Application Data"
"143","17.785190500","172.20.40.110","151.101.194.187","TLSv1.3","2811","Application Data"
"144","17.785347600","172.20.40.110","151.101.194.187","TLSv1.3","2807","Application Data"
"145","17.787975300","172.20.40.110","151.101.194.187","TCP","1434","50060  >  443 [ACK] Seq=15935 Ack=1542 Win=66048 Len=1380 [TCP PDU reassembled in 151]"
"146","17.797527500","151.101.194.187","172.20.40.110","TCP","60","443  >  50060 [ACK] Seq=1542 Ack=2076 Win=144384 Len=0"
"147","17.797527500","151.101.194.187","172.20.40.110","TCP","60","443  >  50060 [ACK] Seq=1542 Ack=2168 Win=144384 Len=0"
"148","17.797527500","151.101.194.187","172.20.40.110","TLSv1.3","119","Application Data"
"149","17.797527500","151.101.194.187","172.20.40.110","TCP","60","443  >  50060 [ACK] Seq=1607 Ack=4923 Win=141824 Len=0"
"150","17.797527500","151.101.194.187","172.20.40.110","TLSv1.3","450","Application Data"
"151","17.797656600","172.20.40.110","151.101.194.187","TLSv1.3","1423","Application Data"
"152","17.798199900","172.20.40.110","151.101.194.187","TLSv1.3","85","Application Data"
"153","17.798505300","151.101.194.187","172.20.40.110","TCP","60","443  >  50060 [ACK] Seq=2003 Ack=7674 Win=139264 Len=0"
"154","17.798505300","151.101.194.187","172.20.40.110","TCP","60","443  >  50060 [ACK] Seq=2003 Ack=10425 Win=136704 Len=0"
"155","17.798505300","151.101.194.187","172.20.40.110","TCP","60","443  >  50060 [ACK] Seq=2003 Ack=13182 Win=134144 Len=0"
"156","17.804008900","151.101.194.187","172.20.40.110","TLSv1.3","132","Application Data"
"157","17.804008900","151.101.194.187","172.20.40.110","TCP","60","443  >  50060 [ACK] Seq=2081 Ack=15935 Win=131584 Len=0"
"158","17.804008900","151.101.194.187","172.20.40.110","TLSv1.3","125","Application Data"
"159","17.804122300","172.20.40.110","151.101.194.187","TCP","54","50060  >  443 [ACK] Seq=18715 Ack=2152 Win=65536 Len=0"
"160","17.805070100","151.101.194.187","172.20.40.110","TLSv1.3","130","Application Data"
"161","17.807261700","151.101.194.187","172.20.40.110","TCP","60","443  >  50060 [ACK] Seq=2228 Ack=18684 Win=129536 Len=0"
"162","17.807261700","151.101.194.187","172.20.40.110","TCP","60","443  >  50060 [ACK] Seq=2228 Ack=18715 Win=129536 Len=0"
"163","17.808390100","151.101.194.187","172.20.40.110","TLSv1.3","130","Application Data"
"164","17.808463000","172.20.40.110","151.101.194.187","TCP","54","50060  >  443 [ACK] Seq=18715 Ack=2304 Win=65280 Len=0"
"165","17.811635600","151.101.194.187","172.20.40.110","TLSv1.3","130","Application Data"
"166","17.840540600","151.101.194.187","172.20.40.110","TCP","130","[TCP Retransmission] 443  >  50060 [PSH, ACK] Seq=2304 Ack=18715 Win=129536 Len=76"
"167","17.840600100","172.20.40.110","151.101.194.187","TCP","66","50060  >  443 [ACK] Seq=18715 Ack=2380 Win=65280 Len=0 SLE=2304 SRE=2380"
"168","17.925278200","172.20.40.110","151.101.194.187","TLSv1.3","2809","Application Data"
"169","17.930631700","172.20.40.110","151.101.194.187","TLSv1.3","2805","Application Data"
"170","17.933731000","172.20.40.110","151.101.194.187","TLSv1.3","2815","Application Data"
"171","17.936121400","172.20.40.110","151.101.194.187","TLSv1.3","2807","Application Data"
"172","17.939136600","151.101.194.187","172.20.40.110","TCP","60","443  >  50060 [ACK] Seq=2380 Ack=21470 Win=126976 Len=0"
"173","17.939136600","151.101.194.187","172.20.40.110","TLSv1.3","98","Application Data"
"174","17.940421600","151.101.194.187","172.20.40.110","TCP","60","443  >  50060 [ACK] Seq=2424 Ack=24221 Win=124416 Len=0"
"175","17.942562400","151.101.194.187","172.20.40.110","TCP","60","443  >  50060 [ACK] Seq=2424 Ack=26982 Win=121856 Len=0"
"176","17.944972100","151.101.194.187","172.20.40.110","TCP","60","443  >  50060 [ACK] Seq=2424 Ack=29735 Win=119296 Len=0"
"177","17.949592100","151.101.194.187","172.20.40.110","TLSv1.3","98","Application Data"
"178","17.949673100","172.20.40.110","151.101.194.187","TCP","54","50060  >  443 [ACK] Seq=29735 Ack=2468 Win=65280 Len=0"
"179","17.953041300","151.101.194.187","172.20.40.110","TLSv1.3","98","Application Data"
"180","17.955229200","151.101.194.187","172.20.40.110","TLSv1.3","98","Application Data"
"181","17.955308300","172.20.40.110","151.101.194.187","TCP","54","50060  >  443 [ACK] Seq=29735 Ack=2556 Win=65024 Len=0"
"182","17.958032800","172.20.40.110","151.101.194.187","TLSv1.3","2805","Application Data"
"183","17.962090100","172.20.40.110","151.101.194.187","TLSv1.3","2803","Application Data"
"184","17.968140100","151.101.194.187","172.20.40.110","TCP","60","443  >  50060 [ACK] Seq=2556 Ack=32486 Win=116736 Len=0"
"185","17.972705100","151.101.194.187","172.20.40.110","TLSv1.3","98","Application Data"
"186","17.972705100","151.101.194.187","172.20.40.110","TCP","60","443  >  50060 [ACK] Seq=2600 Ack=35235 Win=114176 Len=0"
"187","17.973814000","151.101.194.187","172.20.40.110","TLSv1.3","98","Application Data"
"188","17.973908100","172.20.40.110","151.101.194.187","TCP","54","50060  >  443 [ACK] Seq=35235 Ack=2644 Win=65024 Len=0"
"189","18.038499600","172.20.40.110","151.101.194.187","TLSv1.3","2805","Application Data"
"190","18.047987700","151.101.194.187","172.20.40.110","TCP","60","443  >  50060 [ACK] Seq=2644 Ack=37986 Win=111616 Len=0"
"191","18.051694400","151.101.194.187","172.20.40.110","TLSv1.3","124","Application Data"
"192","18.078277400","151.101.194.187","172.20.40.110","TCP","124","[TCP Retransmission] 443  >  50060 [PSH, ACK] Seq=2644 Ack=37986 Win=111616 Len=70"
"193","18.078341900","172.20.40.110","151.101.194.187","TCP","66","50060  >  443 [ACK] Seq=37986 Ack=2714 Win=65024 Len=0 SLE=2644 SRE=2714"
"194","18.202221100","172.20.40.110","151.101.194.187","TLSv1.3","2805","Application Data"
"195","18.214520100","151.101.194.187","172.20.40.110","TCP","60","443  >  50060 [ACK] Seq=2714 Ack=40737 Win=109056 Len=0"
"196","18.218472500","151.101.194.187","172.20.40.110","TLSv1.3","131","Application Data"
"197","18.245257200","151.101.194.187","172.20.40.110","TCP","131","[TCP Retransmission] 443  >  50060 [PSH, ACK] Seq=2714 Ack=40737 Win=109056 Len=77"
"198","18.245335000","172.20.40.110","151.101.194.187","TCP","66","50060  >  443 [ACK] Seq=40737 Ack=2791 Win=64768 Len=0 SLE=2714 SRE=2791"
"199","18.438523500","172.20.40.110","151.101.194.187","TLSv1.3","2809","Application Data"
"200","18.452579800","151.101.194.187","172.20.40.110","TCP","60","443  >  50060 [ACK] Seq=2791 Ack=43492 Win=106496 Len=0"
"201","18.456489300","151.101.194.187","172.20.40.110","TLSv1.3","131","Application Data"
"202","18.483496800","151.101.194.187","172.20.40.110","TCP","131","[TCP Retransmission] 443  >  50060 [PSH, ACK] Seq=2791 Ack=43492 Win=106496 Len=77"
"203","18.483592000","172.20.40.110","151.101.194.187","TCP","66","50060  >  443 [ACK] Seq=43492 Ack=2868 Win=64768 Len=0 SLE=2791 SRE=2868"
"204","19.032650400","172.20.40.110","151.101.194.187","TLSv1.3","2822","Application Data"
"205","19.043392400","172.20.40.110","151.101.194.187","TLSv1.3","2813","Application Data"
"206","19.044322000","151.101.194.187","172.20.40.110","TCP","60","443  >  50060 [ACK] Seq=2868 Ack=46260 Win=103936 Len=0"
"207","19.045428400","172.20.40.110","151.101.194.187","TLSv1.3","2807","Application Data"
"208","19.048834200","151.101.194.187","172.20.40.110","TLSv1.3","241","Application Data"
"209","19.048945400","172.20.40.110","151.101.194.187","TCP","54","50060  >  443 [ACK] Seq=51772 Ack=3055 Win=66048 Len=0"
"210","19.052952100","172.20.40.110","151.101.194.187","TLSv1.3","2807","Application Data"
"211","19.055438200","151.101.194.187","172.20.40.110","TCP","60","443  >  50060 [ACK] Seq=3055 Ack=49019 Win=101376 Len=0"
"212","19.057174800","151.101.194.187","172.20.40.110","TCP","60","443  >  50060 [ACK] Seq=3055 Ack=51772 Win=100864 Len=0"
"213","19.057174800","151.101.194.187","172.20.40.110","TLSv1.3","124","Application Data"
"214","19.058239600","151.101.194.187","172.20.40.110","TLSv1.3","131","Application Data"
"215","19.058302700","172.20.40.110","151.101.194.187","TCP","54","50060  >  443 [ACK] Seq=54525 Ack=3202 Win=66048 Len=0"
"216","19.061365400","151.101.194.187","172.20.40.110","TCP","60","443  >  50060 [ACK] Seq=3202 Ack=54525 Win=100864 Len=0"
"217","19.064790400","151.101.194.187","172.20.40.110","TLSv1.3","179","Application Data"
"218","19.091509500","151.101.194.187","172.20.40.110","TCP","179","[TCP Retransmission] 443  >  50060 [PSH, ACK] Seq=3202 Ack=54525 Win=102912 Len=125"
"219","19.091561700","172.20.40.110","151.101.194.187","TCP","66","50060  >  443 [ACK] Seq=54525 Ack=3327 Win=65792 Len=0 SLE=3202 SRE=3327"
"220","19.100839600","172.20.40.110","151.101.194.187","TLSv1.3","2807","Application Data"
"221","19.109775200","151.101.194.187","172.20.40.110","TCP","60","443  >  50060 [ACK] Seq=3327 Ack=57278 Win=100864 Len=0"
"222","19.112966100","151.101.194.187","172.20.40.110","TLSv1.3","265","Application Data"
"223","19.138042600","151.101.194.187","172.20.40.110","TCP","265","[TCP Retransmission] 443  >  50060 [PSH, ACK] Seq=3327 Ack=57278 Win=102912 Len=211"
"224","19.138119500","172.20.40.110","151.101.194.187","TCP","66","50060  >  443 [ACK] Seq=57278 Ack=3538 Win=65536 Len=0 SLE=3327 SRE=3538"
"225","19.283595500","172.20.40.110","151.101.194.187","TLSv1.3","2804","Application Data"
"226","19.292110300","151.101.194.187","172.20.40.110","TCP","60","443  >  50060 [ACK] Seq=3538 Ack=60028 Win=100864 Len=0"
"227","19.295381500","151.101.194.187","172.20.40.110","TLSv1.3","125","Application Data"
"228","19.321055200","151.101.194.187","172.20.40.110","TCP","125","[TCP Retransmission] 443  >  50060 [PSH, ACK] Seq=3538 Ack=60028 Win=102912 Len=71"
"229","19.321114800","172.20.40.110","151.101.194.187","TCP","66","50060  >  443 [ACK] Seq=60028 Ack=3609 Win=65536 Len=0 SLE=3538 SRE=3609"
"230","19.337381800","172.20.40.110","151.101.194.187","TLSv1.3","2821","Application Data"
"231","19.348756800","151.101.194.187","172.20.40.110","TCP","60","443  >  50060 [ACK] Seq=3609 Ack=62795 Win=100352 Len=0"
"232","19.349924200","151.101.194.187","172.20.40.110","TLSv1.3","130","Application Data"
"233","19.364685100","172.20.40.110","151.101.194.187","TLSv1.3","2821","Application Data"
"234","19.375248800","151.101.194.187","172.20.40.110","TCP","130","[TCP Spurious Retransmission] 443  >  50060 [PSH, ACK] Seq=3609 Ack=62795 Win=102912 Len=76"
"235","19.375248800","151.101.194.187","172.20.40.110","TCP","60","443  >  50060 [ACK] Seq=3685 Ack=65562 Win=100352 Len=0"
"236","19.375307200","172.20.40.110","151.101.194.187","TCP","66","[TCP Dup ACK 233#1] 50060  >  443 [ACK] Seq=65562 Ack=3685 Win=65536 Len=0 SLE=3609 SRE=3685"
"237","19.378120100","151.101.194.187","172.20.40.110","TLSv1.3","125","Application Data"
"238","19.405604800","151.101.194.187","172.20.40.110","TCP","125","[TCP Retransmission] 443  >  50060 [PSH, ACK] Seq=3685 Ack=65562 Win=102912 Len=71"
"239","19.405662600","172.20.40.110","151.101.194.187","TCP","66","50060  >  443 [ACK] Seq=65562 Ack=3756 Win=65536 Len=0 SLE=3685 SRE=3756"
"240","19.575401800","172.20.40.110","151.101.194.187","TLSv1.3","2807","Application Data"
"241","19.591113900","151.101.194.187","172.20.40.110","TCP","60","443  >  50060 [ACK] Seq=3756 Ack=68315 Win=100864 Len=0"
"242","19.591113900","151.101.194.187","172.20.40.110","TLSv1.3","240","Application Data"
"243","19.627506200","151.101.194.187","172.20.40.110","TCP","240","[TCP Retransmission] 443  >  50060 [PSH, ACK] Seq=3756 Ack=68315 Win=102912 Len=186"
"244","19.627580300","172.20.40.110","151.101.194.187","TCP","66","50060  >  443 [ACK] Seq=68315 Ack=3942 Win=65280 Len=0 SLE=3756 SRE=3942"
"245","19.838132000","172.20.40.110","151.101.194.187","TLSv1.3","2786","Application Data"
"246","19.838903700","172.20.40.110","151.101.194.187","TLSv1.3","2783","Application Data"
"247","19.848091200","151.101.194.187","172.20.40.110","TCP","60","443  >  50060 [ACK] Seq=3942 Ack=71047 Win=100864 Len=0"
"248","19.850928400","151.101.194.187","172.20.40.110","TCP","60","443  >  50060 [ACK] Seq=3942 Ack=73776 Win=100864 Len=0"
"249","19.850928400","151.101.194.187","172.20.40.110","TLSv1.3","129","Application Data"
"250","19.851967200","151.101.194.187","172.20.40.110","TLSv1.3","130","Application Data"
"251","19.852073000","172.20.40.110","151.101.194.187","TCP","54","50060  >  443 [ACK] Seq=73776 Ack=4093 Win=65024 Len=0"
"252","19.864255700","172.20.40.110","151.101.194.187","TLSv1.3","2815","Application Data"
"253","19.864928700","172.20.40.110","151.101.194.187","TLSv1.3","2811","Application Data"
"254","19.870642800","172.20.40.110","151.101.194.187","TLSv1.3","2780","Application Data"
"255","19.870893700","172.20.40.110","151.101.194.187","TLSv1.3","2813","Application Data"
"256","19.872634200","172.20.40.110","151.101.194.187","TLSv1.3","2814","Application Data"
"257","19.878453400","151.101.194.187","172.20.40.110","TCP","60","443  >  50060 [ACK] Seq=4093 Ack=76537 Win=100352 Len=0"
"258","19.878453400","151.101.194.187","172.20.40.110","TCP","60","443  >  50060 [ACK] Seq=4093 Ack=79294 Win=100864 Len=0"
"259","19.878453400","151.101.194.187","172.20.40.110","TLSv1.3","125","Application Data"
"260","19.880213700","151.101.194.187","172.20.40.110","TLSv1.3","124","Application Data"
"261","19.880213700","151.101.194.187","172.20.40.110","TCP","60","443  >  50060 [ACK] Seq=4234 Ack=82020 Win=100864 Len=0"
"262","19.880295800","172.20.40.110","151.101.194.187","TCP","54","50060  >  443 [ACK] Seq=87539 Ack=4234 Win=65024 Len=0"
"263","19.881209100","151.101.194.187","172.20.40.110","TCP","60","443  >  50060 [ACK] Seq=4234 Ack=84779 Win=100864 Len=0"
"264","19.883401100","151.101.194.187","172.20.40.110","TLSv1.3","130","Application Data"
"265","19.883401100","151.101.194.187","172.20.40.110","TCP","60","443  >  50060 [ACK] Seq=4310 Ack=87539 Win=102912 Len=0"
"266","19.884474100","151.101.194.187","172.20.40.110","TLSv1.3","130","Application Data"
"267","19.884537100","172.20.40.110","151.101.194.187","TCP","54","50060  >  443 [ACK] Seq=87539 Ack=4386 Win=64768 Len=0"
"268","19.887673900","151.101.194.187","172.20.40.110","TLSv1.3","124","Application Data"
"269","19.913289000","172.20.40.110","151.101.194.187","TLSv1.3","2785","Application Data"
"270","19.917738600","151.101.194.187","172.20.40.110","TCP","124","[TCP Spurious Retransmission] 443  >  50060 [PSH, ACK] Seq=4386 Ack=87539 Win=102912 Len=70"
"271","19.917802000","172.20.40.110","151.101.194.187","TCP","66","[TCP Dup ACK 269#1] 50060  >  443 [ACK] Seq=90270 Ack=4456 Win=66048 Len=0 SLE=4386 SRE=4456"
"272","19.926228300","151.101.194.187","172.20.40.110","TCP","60","443  >  50060 [ACK] Seq=4456 Ack=90270 Win=101888 Len=0"
"273","19.929672600","151.101.194.187","172.20.40.110","TLSv1.3","130","Application Data"
"274","19.954960200","151.101.194.187","172.20.40.110","TCP","130","[TCP Retransmission] 443  >  50060 [PSH, ACK] Seq=4456 Ack=90270 Win=102912 Len=76"
"275","19.955025300","172.20.40.110","151.101.194.187","TCP","66","50060  >  443 [ACK] Seq=90270 Ack=4532 Win=66048 Len=0 SLE=4456 SRE=4532"
"276","20.132528400","172.20.40.110","151.101.194.187","TLSv1.3","2862","Application Data"
"277","20.142456700","151.101.194.187","172.20.40.110","TCP","60","443  >  50060 [ACK] Seq=4532 Ack=93078 Win=100352 Len=0"
"278","20.145444700","151.101.194.187","172.20.40.110","TLSv1.3","104","Application Data"
"279","20.170277300","151.101.194.187","172.20.40.110","TCP","104","[TCP Retransmission] 443  >  50060 [PSH, ACK] Seq=4532 Ack=93078 Win=102912 Len=50"
"280","20.170333000","172.20.40.110","151.101.194.187","TCP","66","50060  >  443 [ACK] Seq=93078 Ack=4582 Win=66048 Len=0 SLE=4532 SRE=4582"
"281","24.643985700","172.20.40.110","151.101.194.187","TLSv1.3","2874","Application Data"
"282","24.655159400","151.101.194.187","172.20.40.110","TCP","60","443  >  50060 [ACK] Seq=4582 Ack=95898 Win=100352 Len=0"
"283","24.657724300","151.101.194.187","172.20.40.110","TLSv1.3","258","Application Data"
"284","24.675459100","172.20.40.110","151.101.194.187","TLSv1.3","2875","Application Data"
"285","24.682002500","151.101.194.187","172.20.40.110","TCP","258","[TCP Spurious Retransmission] 443  >  50060 [PSH, ACK] Seq=4582 Ack=95898 Win=102912 Len=204"
"286","24.682072200","172.20.40.110","151.101.194.187","TCP","66","[TCP Dup ACK 284#1] 50060  >  443 [ACK] Seq=98719 Ack=4786 Win=65792 Len=0 SLE=4582 SRE=4786"
"287","24.686291300","151.101.194.187","172.20.40.110","TCP","60","443  >  50060 [ACK] Seq=4786 Ack=98719 Win=100352 Len=0"
"288","24.689637200","151.101.194.187","172.20.40.110","TLSv1.3","291","Application Data"
"289","24.713631900","151.101.194.187","172.20.40.110","TCP","291","[TCP Retransmission] 443  >  50060 [PSH, ACK] Seq=4786 Ack=98719 Win=102912 Len=237"
"290","24.713682000","172.20.40.110","151.101.194.187","TCP","66","50060  >  443 [ACK] Seq=98719 Ack=5023 Win=65536 Len=0 SLE=4786 SRE=5023"
"291","24.897966500","172.20.40.110","151.101.194.187","TLSv1.3","2866","Application Data"
"292","24.907655900","151.101.194.187","172.20.40.110","TCP","60","443  >  50060 [ACK] Seq=5023 Ack=101531 Win=100352 Len=0"
"293","24.911225500","151.101.194.187","172.20.40.110","TLSv1.3","104","Application Data"
"294","24.938599700","151.101.194.187","172.20.40.110","TCP","104","[TCP Retransmission] 443  >  50060 [PSH, ACK] Seq=5023 Ack=101531 Win=102912 Len=50"
"295","24.938682900","172.20.40.110","151.101.194.187","TCP","66","50060  >  443 [ACK] Seq=101531 Ack=5073 Win=65536 Len=0 SLE=5023 SRE=5073"
"296","25.403353700","172.20.40.110","151.101.194.187","TLSv1.3","2874","Application Data"
"297","25.409007000","172.20.40.110","151.101.194.187","TLSv1.3","2875","Application Data"
"298","25.414148100","151.101.194.187","172.20.40.110","TCP","60","443  >  50060 [ACK] Seq=5073 Ack=104351 Win=100352 Len=0"
"299","25.417729000","151.101.194.187","172.20.40.110","TLSv1.3","98","Application Data"
"300","25.418663800","151.101.194.187","172.20.40.110","TCP","60","443  >  50060 [ACK] Seq=5117 Ack=107172 Win=100352 Len=0"
"301","25.424018000","151.101.194.187","172.20.40.110","TLSv1.3","98","Application Data"
"302","25.424093000","172.20.40.110","151.101.194.187","TCP","54","50060  >  443 [ACK] Seq=107172 Ack=5161 Win=65280 Len=0"
"303","25.562662500","172.20.40.110","151.101.194.187","TLSv1.3","2874","Application Data"
"304","25.569616600","172.20.40.110","151.101.194.187","TLSv1.3","2875","Application Data"
"305","25.572170900","151.101.194.187","172.20.40.110","TCP","60","443  >  50060 [ACK] Seq=5161 Ack=109992 Win=100352 Len=0"
"306","25.575618800","151.101.194.187","172.20.40.110","TLSv1.3","214","Application Data"
"307","25.579147100","151.101.194.187","172.20.40.110","TCP","60","443  >  50060 [ACK] Seq=5321 Ack=112813 Win=100352 Len=0"
"308","25.581599600","151.101.194.187","172.20.40.110","TLSv1.3","98","Application Data"
"309","25.581679200","172.20.40.110","151.101.194.187","TCP","54","50060  >  443 [ACK] Seq=112813 Ack=5365 Win=65280 Len=0"
"310","25.645805500","172.20.40.110","151.101.194.187","TLSv1.3","2874","Application Data"
"311","25.657806600","151.101.194.187","172.20.40.110","TCP","60","443  >  50060 [ACK] Seq=5365 Ack=115633 Win=100352 Len=0"
"312","25.658357800","151.101.194.187","172.20.40.110","TLSv1.3","125","Application Data"
"313","25.672407400","172.20.40.110","151.101.194.187","TLSv1.3","2872","Application Data"
"314","25.681623900","151.101.194.187","172.20.40.110","TCP","60","443  >  50060 [ACK] Seq=5436 Ack=118451 Win=100352 Len=0"
"315","25.686006000","151.101.194.187","172.20.40.110","TLSv1.3","125","Application Data"
"316","25.713758100","151.101.194.187","172.20.40.110","TCP","125","[TCP Retransmission] 443  >  50060 [PSH, ACK] Seq=5436 Ack=118451 Win=102912 Len=71"
"317","25.713817000","172.20.40.110","151.101.194.187","TCP","66","50060  >  443 [ACK] Seq=118451 Ack=5507 Win=65024 Len=0 SLE=5436 SRE=5507"
"318","25.719808900","172.20.40.110","151.101.194.187","TLSv1.3","2875","Application Data"
"319","25.728976600","151.101.194.187","172.20.40.110","TCP","60","443  >  50060 [ACK] Seq=5507 Ack=121272 Win=100352 Len=0"
"320","25.742857100","151.101.194.187","172.20.40.110","TLSv1.3","98","Application Data"
"321","25.771307500","151.101.194.187","172.20.40.110","TCP","98","[TCP Retransmission] 443  >  50060 [PSH, ACK] Seq=5507 Ack=121272 Win=102912 Len=44"
"322","25.771370700","172.20.40.110","151.101.194.187","TCP","66","50060  >  443 [ACK] Seq=121272 Ack=5551 Win=65024 Len=0 SLE=5507 SRE=5551"
"323","26.040533300","172.20.40.110","151.101.194.187","TLSv1.3","2862","Application Data"
"324","26.042300000","172.20.40.110","151.101.194.187","TLSv1.3","2874","Application Data"
"325","26.051410600","151.101.194.187","172.20.40.110","TCP","60","443  >  50060 [ACK] Seq=5551 Ack=124080 Win=100352 Len=0"
"326","26.061622200","151.101.194.187","172.20.40.110","TCP","60","443  >  50060 [ACK] Seq=5551 Ack=126900 Win=99840 Len=0"
"327","26.061622200","151.101.194.187","172.20.40.110","TLSv1.3","104","Application Data"
"328","26.061622200","151.101.194.187","172.20.40.110","TLSv1.3","130","Application Data"
"329","26.061748000","172.20.40.110","151.101.194.187","TCP","54","50060  >  443 [ACK] Seq=126900 Ack=5677 Win=64768 Len=0"
"330","26.269888100","172.20.40.110","151.101.194.187","TLSv1.3","2857","Application Data"
"331","26.280895000","151.101.194.187","172.20.40.110","TCP","60","443  >  50060 [ACK] Seq=5677 Ack=129703 Win=100352 Len=0"
"332","26.289829500","151.101.194.187","172.20.40.110","TLSv1.3","130","Application Data"
"333","26.312422200","151.101.194.187","172.20.40.110","TCP","130","[TCP Retransmission] 443  >  50060 [PSH, ACK] Seq=5677 Ack=129703 Win=102912 Len=76"
"334","26.312496900","172.20.40.110","151.101.194.187","TCP","66","50060  >  443 [ACK] Seq=129703 Ack=5753 Win=64768 Len=0 SLE=5677 SRE=5753"
"335","30.707569400","172.20.40.110","151.101.194.187","TLSv1.3","2896","Application Data"
"336","30.715279200","172.20.40.110","151.101.194.187","TLSv1.3","2887","Application Data"
"337","30.717171800","172.20.40.110","151.101.194.187","TLSv1.3","2881","Application Data"
"338","30.720910200","172.20.40.110","151.101.194.187","TLSv1.3","2881","Application Data"
"339","30.720931700","151.101.194.187","172.20.40.110","TCP","60","443  >  50060 [ACK] Seq=5753 Ack=132545 Win=100352 Len=0"
"340","30.724707800","151.101.194.187","172.20.40.110","TCP","60","443  >  50060 [ACK] Seq=5753 Ack=135378 Win=99840 Len=0"
"341","30.725867500","151.101.194.187","172.20.40.110","TLSv1.3","214","Application Data"
"342","30.726901700","151.101.194.187","172.20.40.110","TCP","60","443  >  50060 [ACK] Seq=5913 Ack=138205 Win=100352 Len=0"
"343","30.729061700","151.101.194.187","172.20.40.110","TLSv1.3","124","Application Data"
"344","30.730097100","151.101.194.187","172.20.40.110","TCP","60","443  >  50060 [ACK] Seq=5983 Ack=141032 Win=100352 Len=0"
"345","30.733360800","151.101.194.187","172.20.40.110","TLSv1.3","131","Application Data"
"346","30.733360800","151.101.194.187","172.20.40.110","TLSv1.3","130","Application Data"
"347","30.733521900","172.20.40.110","151.101.194.187","TCP","54","50060  >  443 [ACK] Seq=141032 Ack=6136 Win=66048 Len=0"
"348","30.769749100","172.20.40.110","151.101.194.187","TLSv1.3","2881","Application Data"
"349","30.779560900","151.101.194.187","172.20.40.110","TCP","60","443  >  50060 [ACK] Seq=6136 Ack=143859 Win=100352 Len=0"
"350","30.785196200","151.101.194.187","172.20.40.110","TLSv1.3","130","Application Data"
"351","30.812892700","151.101.194.187","172.20.40.110","TCP","130","[TCP Retransmission] 443  >  50060 [PSH, ACK] Seq=6136 Ack=143859 Win=102912 Len=76"
"352","30.812971300","172.20.40.110","151.101.194.187","TCP","66","50060  >  443 [ACK] Seq=143859 Ack=6212 Win=66048 Len=0 SLE=6136 SRE=6212"
"353","30.817123300","172.20.40.110","151.101.194.187","TLSv1.3","2895","Application Data"
"354","30.829923600","151.101.194.187","172.20.40.110","TCP","60","443  >  50060 [ACK] Seq=6212 Ack=146700 Win=100352 Len=0"
"355","30.834170100","151.101.194.187","172.20.40.110","TLSv1.3","142","Application Data"
"356","30.864207100","151.101.194.187","172.20.40.110","TCP","142","[TCP Retransmission] 443  >  50060 [PSH, ACK] Seq=6212 Ack=146700 Win=102912 Len=88"
"357","30.864259400","172.20.40.110","151.101.194.187","TCP","66","50060  >  443 [ACK] Seq=146700 Ack=6300 Win=66048 Len=0 SLE=6212 SRE=6300"
"358","30.919301300","172.20.40.110","151.101.194.187","TLSv1.3","2878","Application Data"
"359","30.930309400","172.20.40.110","151.101.194.187","TLSv1.3","2895","Application Data"
"360","30.930501400","151.101.194.187","172.20.40.110","TCP","60","443  >  50060 [ACK] Seq=6300 Ack=149524 Win=100352 Len=0"
"361","30.935422400","151.101.194.187","172.20.40.110","TLSv1.3","125","Application Data"
"362","30.941941500","151.101.194.187","172.20.40.110","TCP","60","443  >  50060 [ACK] Seq=6371 Ack=152365 Win=108544 Len=0"
"363","30.946668300","151.101.194.187","172.20.40.110","TLSv1.3","130","Application Data"
"364","30.946746400","172.20.40.110","151.101.194.187","TCP","54","50060  >  443 [ACK] Seq=152365 Ack=6447 Win=65792 Len=0"
"365","31.109618300","172.20.40.110","151.101.194.187","TLSv1.3","2894","Application Data"
"366","31.109867600","172.20.40.110","151.101.194.187","TLSv1.3","2884","Application Data"
"367","31.110044500","172.20.40.110","151.101.194.187","TLSv1.3","2881","Application Data"
"368","31.110174400","172.20.40.110","151.101.194.187","TLSv1.3","2878","Application Data"
"369","31.110393900","172.20.40.110","151.101.194.187","TLSv1.3","2882","Application Data"
"370","31.111579900","172.20.40.110","151.101.194.187","TLSv1.3","2884","Application Data"
"371","31.111856200","172.20.40.110","151.101.194.187","TLSv1.3","2880","Application Data"
"372","31.114011200","172.20.40.110","151.101.194.187","TLSv1.3","2883","Application Data"
"373","31.127321100","151.101.194.187","172.20.40.110","TCP","60","443  >  50060 [ACK] Seq=6447 Ack=155205 Win=114176 Len=0"
"374","31.127321100","151.101.194.187","172.20.40.110","TCP","60","443  >  50060 [ACK] Seq=6447 Ack=158035 Win=119808 Len=0"
"375","31.127321100","151.101.194.187","172.20.40.110","TCP","60","443  >  50060 [ACK] Seq=6447 Ack=160862 Win=125440 Len=0"
"376","31.130167400","151.101.194.187","172.20.40.110","TCP","60","443  >  50060 [ACK] Seq=6447 Ack=163686 Win=131072 Len=0"
"377","31.130167400","151.101.194.187","172.20.40.110","TCP","60","443  >  50060 [ACK] Seq=6447 Ack=166514 Win=136704 Len=0"
"378","31.130167400","151.101.194.187","172.20.40.110","TCP","60","443  >  50060 [ACK] Seq=6447 Ack=169344 Win=142336 Len=0"
"379","31.131513700","151.101.194.187","172.20.40.110","TLSv1.3","290","Application Data"
"380","31.131513700","151.101.194.187","172.20.40.110","TLSv1.3","157","Application Data"
"381","31.131594900","172.20.40.110","151.101.194.187","TCP","54","50060  >  443 [ACK] Seq=174999 Ack=6786 Win=65536 Len=0"
"382","31.133467300","151.101.194.187","172.20.40.110","TCP","60","443  >  50060 [ACK] Seq=6786 Ack=172170 Win=147968 Len=0"
"383","31.133467300","151.101.194.187","172.20.40.110","TCP","60","443  >  50060 [ACK] Seq=6786 Ack=174999 Win=154112 Len=0"
"384","31.135637900","151.101.194.187","172.20.40.110","TLSv1.3","125","Application Data"
"385","31.137836600","151.101.194.187","172.20.40.110","TLSv1.3","130","Application Data"
"386","31.137836600","151.101.194.187","172.20.40.110","TLSv1.3","124","Application Data"
"387","31.137975700","172.20.40.110","151.101.194.187","TCP","54","50060  >  443 [ACK] Seq=174999 Ack=7003 Win=65280 Len=0"
"388","31.138906600","151.101.194.187","172.20.40.110","TLSv1.3","124","Application Data"
"389","31.138972000","172.20.40.110","151.101.194.187","TCP","54","50060  >  443 [ACK] Seq=174999 Ack=7073 Win=65280 Len=0"
"390","31.140014400","151.101.194.187","172.20.40.110","TLSv1.3","124","Application Data"
"391","31.181526800","172.20.40.110","151.101.194.187","TCP","54","50060  >  443 [ACK] Seq=174999 Ack=7143 Win=65024 Len=0"
"392","31.184511000","151.101.194.187","172.20.40.110","TCP","124","[TCP Spurious Retransmission] 443  >  50060 [PSH, ACK] Seq=7073 Ack=174999 Win=154112 Len=70"
"393","31.184604900","172.20.40.110","151.101.194.187","TCP","66","[TCP Dup ACK 391#1] 50060  >  443 [ACK] Seq=174999 Ack=7143 Win=65024 Len=0 SLE=7073 SRE=7143"
"394","31.381134600","172.20.40.110","151.101.194.187","TLSv1.3","2885","Application Data"
"395","31.382077800","172.20.40.110","151.101.194.187","TLSv1.3","2887","Application Data"
"396","31.395943400","151.101.194.187","172.20.40.110","TCP","60","443  >  50060 [ACK] Seq=7143 Ack=177830 Win=159744 Len=0"
"397","31.395943400","151.101.194.187","172.20.40.110","TCP","60","443  >  50060 [ACK] Seq=7143 Ack=180663 Win=165376 Len=0"
"398","31.404974300","151.101.194.187","172.20.40.110","TLSv1.3","130","Application Data"
"399","31.404974300","151.101.194.187","172.20.40.110","TLSv1.3","240","Application Data"
"400","31.405059500","172.20.40.110","151.101.194.187","TCP","54","50060  >  443 [ACK] Seq=180663 Ack=7405 Win=64768 Len=0"
"401","33.065361400","172.20.40.110","151.101.194.187","TLSv1.3","2917","Application Data"
"402","33.066168800","172.20.40.110","151.101.194.187","TLSv1.3","2918","Application Data"
"403","33.088497300","151.101.194.187","172.20.40.110","TCP","60","443  >  50060 [ACK] Seq=7405 Ack=183526 Win=171008 Len=0"
"404","33.088497300","151.101.194.187","172.20.40.110","TCP","60","443  >  50060 [ACK] Seq=7405 Ack=186390 Win=176640 Len=0"
"405","33.088497300","151.101.194.187","172.20.40.110","TLSv1.3","241","Application Data"
"406","33.088578400","172.20.40.110","151.101.194.187","TCP","54","50060  >  443 [ACK] Seq=186390 Ack=7592 Win=66048 Len=0"
"407","33.089835900","151.101.194.187","172.20.40.110","TLSv1.3","125","Application Data"
"408","33.089891700","172.20.40.110","151.101.194.187","TCP","54","50060  >  443 [ACK] Seq=186390 Ack=7663 Win=66048 Len=0"
"409","38.150295300","172.20.40.110","151.101.194.187","TLSv1.3","2917","Application Data"
"410","38.158434500","151.101.194.187","172.20.40.110","TCP","60","443  >  50060 [ACK] Seq=7663 Ack=189253 Win=182272 Len=0"
"411","38.164732100","151.101.194.187","172.20.40.110","TLSv1.3","214","Application Data"
"412","38.188127400","151.101.194.187","172.20.40.110","TCP","214","[TCP Retransmission] 443  >  50060 [PSH, ACK] Seq=7663 Ack=189253 Win=182272 Len=160"
"413","38.188382700","172.20.40.110","151.101.194.187","TCP","66","50060  >  443 [ACK] Seq=189253 Ack=7823 Win=65792 Len=0 SLE=7663 SRE=7823"
"414","38.196317100","172.20.40.110","151.101.194.187","TLSv1.3","2915","Application Data"
"415","38.204671500","151.101.194.187","172.20.40.110","TCP","60","443  >  50060 [ACK] Seq=7823 Ack=192114 Win=187904 Len=0"
"416","38.208660600","151.101.194.187","172.20.40.110","TLSv1.3","341","Application Data"
"417","38.233177700","172.20.40.110","151.101.194.187","TLSv1.3","2918","Application Data"
"418","38.235351700","151.101.194.187","172.20.40.110","TCP","341","[TCP Spurious Retransmission] 443  >  50060 [PSH, ACK] Seq=7823 Ack=192114 Win=187904 Len=287"
"419","38.235476700","172.20.40.110","151.101.194.187","TCP","66","[TCP Dup ACK 417#1] 50060  >  443 [ACK] Seq=194978 Ack=8110 Win=65536 Len=0 SLE=7823 SRE=8110"
"420","38.241788800","151.101.194.187","172.20.40.110","TCP","60","443  >  50060 [ACK] Seq=8110 Ack=194978 Win=194048 Len=0"
"421","38.250522100","151.101.194.187","172.20.40.110","TLSv1.3","98","Application Data"
"422","38.274666500","151.101.194.187","172.20.40.110","TCP","98","[TCP Retransmission] 443  >  50060 [PSH, ACK] Seq=8110 Ack=194978 Win=194048 Len=44"
"423","38.274725100","172.20.40.110","151.101.194.187","TCP","66","50060  >  443 [ACK] Seq=194978 Ack=8154 Win=65536 Len=0 SLE=8110 SRE=8154"
"424","38.327719800","172.20.40.110","151.101.194.187","TLSv1.3","2905","Application Data"
"425","38.327968500","172.20.40.110","151.101.194.187","TLSv1.3","2917","Application Data"
"426","38.341388000","151.101.194.187","172.20.40.110","TCP","60","443  >  50060 [ACK] Seq=8154 Ack=197829 Win=199680 Len=0"
"427","38.341388000","151.101.194.187","172.20.40.110","TCP","60","443  >  50060 [ACK] Seq=8154 Ack=200692 Win=205312 Len=0"
"428","38.346267200","151.101.194.187","172.20.40.110","TLSv1.3","130","Application Data"
"429","38.346267200","151.101.194.187","172.20.40.110","TLSv1.3","104","Application Data"
"430","38.346361700","172.20.40.110","151.101.194.187","TCP","54","50060  >  443 [ACK] Seq=200692 Ack=8280 Win=65536 Len=0"
"431","39.903624000","172.20.40.110","151.101.194.187","TLSv1.3","2917","Application Data"
"432","39.914601500","151.101.194.187","172.20.40.110","TCP","60","443  >  50060 [ACK] Seq=8280 Ack=203555 Win=210944 Len=0"
"433","39.915145800","151.101.194.187","172.20.40.110","TLSv1.3","214","Application Data"
"434","39.931049800","172.20.40.110","151.101.194.187","TLSv1.3","2915","Application Data"
"435","39.940835900","151.101.194.187","172.20.40.110","TCP","60","443  >  50060 [ACK] Seq=8440 Ack=206416 Win=217088 Len=0"
"436","39.944607000","151.101.194.187","172.20.40.110","TLSv1.3","98","Application Data"
"437","39.961536200","172.20.40.110","151.101.194.187","TLSv1.3","2918","Application Data"
"438","39.972032600","151.101.194.187","172.20.40.110","TCP","60","443  >  50060 [ACK] Seq=8484 Ack=209280 Win=222720 Len=0"
"439","39.973095000","151.101.194.187","172.20.40.110","TLSv1.3","98","Application Data"
"440","40.005987300","151.101.194.187","172.20.40.110","TCP","98","[TCP Retransmission] 443  >  50060 [PSH, ACK] Seq=8484 Ack=209280 Win=222720 Len=44"
"441","40.006056700","172.20.40.110","151.101.194.187","TCP","66","50060  >  443 [ACK] Seq=209280 Ack=8528 Win=65280 Len=0 SLE=8484 SRE=8528"
"442","40.369972600","172.20.40.110","151.101.194.187","TLSv1.3","2920","Application Data"
"443","40.370456700","172.20.40.110","151.101.194.187","TLSv1.3","2909","Application Data"
"444","40.385700100","151.101.194.187","172.20.40.110","TCP","60","443  >  50060 [ACK] Seq=8528 Ack=212146 Win=228352 Len=0"
"445","40.385700100","151.101.194.187","172.20.40.110","TCP","60","443  >  50060 [ACK] Seq=8528 Ack=215001 Win=233984 Len=0"
"446","40.386413900","151.101.194.187","172.20.40.110","TLSv1.3","104","Application Data"
"447","40.388456600","151.101.194.187","172.20.40.110","TLSv1.3","130","Application Data"
"448","40.388542000","172.20.40.110","151.101.194.187","TCP","54","50060  >  443 [ACK] Seq=215001 Ack=8654 Win=65024 Len=0"
"449","43.117931900","172.20.40.110","151.101.194.187","TLSv1.3","2898","Application Data"
"450","43.126979300","172.20.40.110","151.101.194.187","TLSv1.3","2889","Application Data"
"451","43.127659600","172.20.40.110","151.101.194.187","TLSv1.3","2883","Application Data"
"452","43.130242600","172.20.40.110","151.101.194.187","TLSv1.3","2883","Application Data"
"453","43.134526700","151.101.194.187","172.20.40.110","TCP","60","443  >  50060 [ACK] Seq=8654 Ack=217845 Win=239616 Len=0"
"454","43.147078700","151.101.194.187","172.20.40.110","TLSv1.3","214","Application Data"
"455","43.147078700","151.101.194.187","172.20.40.110","TCP","60","443  >  50060 [ACK] Seq=8814 Ack=220680 Win=245248 Len=0"
"456","43.147078700","151.101.194.187","172.20.40.110","TCP","60","443  >  50060 [ACK] Seq=8814 Ack=223509 Win=250880 Len=0"
"457","43.147078700","151.101.194.187","172.20.40.110","TCP","60","443  >  50060 [ACK] Seq=8814 Ack=226338 Win=256512 Len=0"
"458","43.147078700","151.101.194.187","172.20.40.110","TLSv1.3","124","Application Data"
"459","43.147078700","151.101.194.187","172.20.40.110","TLSv1.3","130","Application Data"
"460","43.147206600","172.20.40.110","151.101.194.187","TCP","54","50060  >  443 [ACK] Seq=226338 Ack=8960 Win=64768 Len=0"
"461","43.148123100","151.101.194.187","172.20.40.110","TLSv1.3","131","Application Data"
"462","43.148201400","172.20.40.110","151.101.194.187","TCP","54","50060  >  443 [ACK] Seq=226338 Ack=9037 Win=66048 Len=0"
"463","43.177263900","172.20.40.110","151.101.194.187","TLSv1.3","2883","Application Data"
"464","43.191142400","151.101.194.187","172.20.40.110","TCP","60","443  >  50060 [ACK] Seq=9037 Ack=229167 Win=262144 Len=0"
"465","43.198977500","151.101.194.187","172.20.40.110","TLSv1.3","130","Application Data"
"466","43.223571200","151.101.194.187","172.20.40.110","TCP","130","[TCP Retransmission] 443  >  50060 [PSH, ACK] Seq=9037 Ack=229167 Win=262144 Len=76"
"467","43.223631300","172.20.40.110","151.101.194.187","TCP","66","50060  >  443 [ACK] Seq=229167 Ack=9113 Win=66048 Len=0 SLE=9037 SRE=9113"
"468","43.329829900","172.20.40.110","151.101.194.187","TLSv1.3","2880","Application Data"
"469","43.342714000","151.101.194.187","172.20.40.110","TCP","60","443  >  50060 [ACK] Seq=9113 Ack=231993 Win=267776 Len=0"
"470","43.343310200","172.20.40.110","151.101.194.187","TLSv1.3","2897","Application Data"
"471","43.347529800","151.101.194.187","172.20.40.110","TLSv1.3","125","Application Data"
"472","43.353988100","151.101.194.187","172.20.40.110","TCP","60","443  >  50060 [ACK] Seq=9184 Ack=234836 Win=273920 Len=0"
"473","43.359141200","151.101.194.187","172.20.40.110","TLSv1.3","130","Application Data"
"474","43.359217700","172.20.40.110","151.101.194.187","TCP","54","50060  >  443 [ACK] Seq=234836 Ack=9260 Win=65792 Len=0"
"475","43.365909900","172.20.40.110","151.101.194.187","TLSv1.3","2897","Application Data"
"476","43.376606000","151.101.194.187","172.20.40.110","TCP","60","443  >  50060 [ACK] Seq=9260 Ack=237679 Win=279552 Len=0"
"477","43.378703000","151.101.194.187","172.20.40.110","TLSv1.3","125","Application Data"
"478","43.414147400","151.101.194.187","172.20.40.110","TCP","125","[TCP Retransmission] 443  >  50060 [PSH, ACK] Seq=9260 Ack=237679 Win=279552 Len=71"
"479","43.414195000","172.20.40.110","151.101.194.187","TCP","66","50060  >  443 [ACK] Seq=237679 Ack=9331 Win=65792 Len=0 SLE=9260 SRE=9331"
"480","43.503918500","172.20.40.110","151.101.194.187","TLSv1.3","2883","Application Data"
"481","43.504184600","172.20.40.110","151.101.194.187","TLSv1.3","2885","Application Data"
"482","43.514667400","151.101.194.187","172.20.40.110","TCP","60","443  >  50060 [ACK] Seq=9331 Ack=240508 Win=285184 Len=0"
"483","43.514667400","151.101.194.187","172.20.40.110","TCP","60","443  >  50060 [ACK] Seq=9331 Ack=243339 Win=290816 Len=0"
"484","43.518722100","151.101.194.187","172.20.40.110","TLSv1.3","450","Application Data"
"485","43.520027800","151.101.194.187","172.20.40.110","TLSv1.3","130","Application Data"
"486","43.520108700","172.20.40.110","151.101.194.187","TCP","54","50060  >  443 [ACK] Seq=243339 Ack=9803 Win=65280 Len=0"
"487","43.749720800","172.20.40.110","151.101.194.187","TLSv1.3","2889","Application Data"
"488","43.750043800","172.20.40.110","151.101.194.187","TLSv1.3","2886","Application Data"
"489","43.750737100","172.20.40.110","151.101.194.187","TLSv1.3","2883","Application Data"
"490","43.757531900","172.20.40.110","151.101.194.187","TLSv1.3","2887","Application Data"
"491","43.763593500","172.20.40.110","151.101.194.187","TLSv1.3","2889","Application Data"
"492","43.766447200","172.20.40.110","151.101.194.187","TLSv1.3","2885","Application Data"
"493","43.768637800","172.20.40.110","151.101.194.187","TLSv1.3","2888","Application Data"
"494","43.774176800","151.101.194.187","172.20.40.110","TCP","60","443  >  50060 [ACK] Seq=9803 Ack=244719 Win=293376 Len=0"
"495","43.779394000","151.101.194.187","172.20.40.110","TCP","60","443  >  50060 [ACK] Seq=9803 Ack=246174 Win=296448 Len=0"
"496","43.779394000","151.101.194.187","172.20.40.110","TCP","60","443  >  50060 [ACK] Seq=9803 Ack=249006 Win=302080 Len=0"
"497","43.780674800","151.101.194.187","172.20.40.110","TLSv1.3","130","Application Data"
"498","43.780674800","151.101.194.187","172.20.40.110","TCP","60","443  >  50060 [ACK] Seq=9879 Ack=251835 Win=307712 Len=0"
"499","43.783078100","151.101.194.187","172.20.40.110","TLSv1.3","129","Application Data"
"500","43.783078100","151.101.194.187","172.20.40.110","TLSv1.3","130","Application Data"
"501","43.783152000","172.20.40.110","151.101.194.187","TCP","54","50060  >  443 [ACK] Seq=263168 Ack=10030 Win=65024 Len=0"
"502","43.786527600","151.101.194.187","172.20.40.110","TCP","60","443  >  50060 [ACK] Seq=10030 Ack=254668 Win=313344 Len=0"
"503","43.786527600","151.101.194.187","172.20.40.110","TCP","60","443  >  50060 [ACK] Seq=10030 Ack=257503 Win=318976 Len=0"
"504","43.786527600","151.101.194.187","172.20.40.110","TCP","60","443  >  50060 [ACK] Seq=10030 Ack=260334 Win=324608 Len=0"
"505","43.786527600","151.101.194.187","172.20.40.110","TCP","60","443  >  50060 [ACK] Seq=10030 Ack=263168 Win=330752 Len=0"
"506","43.788646100","151.101.194.187","172.20.40.110","TLSv1.3","194","Application Data, Application Data"
"507","43.788721300","172.20.40.110","151.101.194.187","TCP","54","50060  >  443 [ACK] Seq=263168 Ack=10170 Win=65024 Len=0"
"508","43.790836400","151.101.194.187","172.20.40.110","TLSv1.3","124","Application Data"
"509","43.790836400","151.101.194.187","172.20.40.110","TLSv1.3","125","Application Data"
"510","43.790922700","172.20.40.110","151.101.194.187","TCP","54","50060  >  443 [ACK] Seq=263168 Ack=10311 Win=64768 Len=0"
"511","50.624389200","172.20.40.110","151.101.194.187","TLSv1.3","2866","Application Data"
"512","50.641556200","151.101.194.187","172.20.40.110","TCP","60","443  >  50060 [ACK] Seq=10311 Ack=265980 Win=336384 Len=0"
"513","50.645794900","172.20.40.110","151.101.194.187","TLSv1.3","2865","Application Data"
"514","50.649381300","151.101.194.187","172.20.40.110","TLSv1.3","241","Application Data"
"515","50.649488900","172.20.40.110","151.101.194.187","TCP","54","50060  >  443 [ACK] Seq=268791 Ack=10498 Win=66048 Len=0"
"516","50.658294400","151.101.194.187","172.20.40.110","TCP","60","443  >  50060 [ACK] Seq=10498 Ack=268791 Win=342016 Len=0"
"517","50.662365000","151.101.194.187","172.20.40.110","TLSv1.3","98","Application Data"
"518","50.662440000","172.20.40.110","151.101.194.187","TCP","54","50060  >  443 [ACK] Seq=268791 Ack=10542 Win=66048 Len=0"
"519","51.821196600","172.20.40.110","151.101.194.187","TLSv1.3","2865","Application Data"
"520","51.822006300","172.20.40.110","151.101.194.187","TLSv1.3","2853","Application Data"
"521","51.826357600","172.20.40.110","151.101.194.187","TLSv1.3","2847","Application Data"
"522","51.830949300","172.20.40.110","151.101.194.187","TLSv1.3","2866","Application Data"
"523","51.836325500","151.101.194.187","172.20.40.110","TCP","60","443  >  50060 [ACK] Seq=10542 Ack=271602 Win=347136 Len=0"
"524","51.836325500","151.101.194.187","172.20.40.110","TCP","60","443  >  50060 [ACK] Seq=10542 Ack=274401 Win=352768 Len=0"
"525","51.839713800","151.101.194.187","172.20.40.110","TCP","60","443  >  50060 [ACK] Seq=10542 Ack=277194 Win=358400 Len=0"
"526","51.839713800","151.101.194.187","172.20.40.110","TLSv1.3","214","Application Data"
"527","51.840848300","151.101.194.187","172.20.40.110","TLSv1.3","130","Application Data"
"528","51.840848300","151.101.194.187","172.20.40.110","TCP","60","443  >  50060 [ACK] Seq=10778 Ack=280006 Win=364544 Len=0"
"529","51.840971900","172.20.40.110","151.101.194.187","TCP","54","50060  >  443 [ACK] Seq=280006 Ack=10778 Win=65792 Len=0"
"530","51.842462000","151.101.194.187","172.20.40.110","TLSv1.3","179","Application Data"
"531","51.843247200","151.101.194.187","172.20.40.110","TLSv1.3","98","Application Data"
"532","51.843320700","172.20.40.110","151.101.194.187","TCP","54","50060  >  443 [ACK] Seq=280006 Ack=10947 Win=65536 Len=0"
"533","51.962420600","172.20.40.110","151.101.194.187","TLSv1.3","2869","Application Data"
"534","51.973958100","172.20.40.110","151.101.194.187","TLSv1.3","2849","Application Data"
"535","51.974097800","151.101.194.187","172.20.40.110","TCP","60","443  >  50060 [ACK] Seq=10947 Ack=282766 Win=370176 Len=0"
"536","51.976557400","151.101.194.187","172.20.40.110","TCP","60","443  >  50060 [ACK] Seq=10947 Ack=282821 Win=370176 Len=0"
"537","51.980246900","151.101.194.187","172.20.40.110","TLSv1.3","291","Application Data"
"538","51.982642900","151.101.194.187","172.20.40.110","TCP","60","443  >  50060 [ACK] Seq=11184 Ack=285616 Win=375808 Len=0"
"539","51.985906600","151.101.194.187","172.20.40.110","TLSv1.3","125","Application Data"
"540","51.985986400","172.20.40.110","151.101.194.187","TCP","54","50060  >  443 [ACK] Seq=285616 Ack=11255 Win=65280 Len=0"
"541","52.044445600","172.20.40.110","151.101.194.187","TLSv1.3","2854","Application Data"
"542","52.044605600","172.20.40.110","151.101.194.187","TLSv1.3","2851","Application Data"
"543","52.044691500","172.20.40.110","151.101.194.187","TLSv1.3","2857","Application Data"
"544","52.046434200","172.20.40.110","151.101.194.187","TLSv1.3","2848","Application Data"
"545","52.053632800","151.101.194.187","172.20.40.110","TCP","60","443  >  50060 [ACK] Seq=11255 Ack=288416 Win=381440 Len=0"
"546","52.059400300","151.101.194.187","172.20.40.110","TLSv1.3","103","Application Data"
"547","52.060336300","151.101.194.187","172.20.40.110","TCP","60","443  >  50060 [ACK] Seq=11304 Ack=291213 Win=387072 Len=0"
"548","52.060336300","151.101.194.187","172.20.40.110","TCP","60","443  >  50060 [ACK] Seq=11304 Ack=294016 Win=392704 Len=0"
"549","52.060336300","151.101.194.187","172.20.40.110","TCP","60","443  >  50060 [ACK] Seq=11304 Ack=296810 Win=398336 Len=0"
"550","52.065088200","151.101.194.187","172.20.40.110","TLSv1.3","206","Application Data"
"551","52.065160600","172.20.40.110","151.101.194.187","TCP","54","50060  >  443 [ACK] Seq=296810 Ack=11456 Win=65280 Len=0"
"552","52.150792300","172.20.40.110","151.101.194.187","TLSv1.3","2868","Application Data"
"553","52.160273200","151.101.194.187","172.20.40.110","TCP","60","443  >  50060 [ACK] Seq=11456 Ack=299624 Win=403968 Len=0"
"554","52.165934600","151.101.194.187","172.20.40.110","TLSv1.3","130","Application Data"
"555","52.193614000","151.101.194.187","172.20.40.110","TCP","130","[TCP Retransmission] 443  >  50060 [PSH, ACK] Seq=11456 Ack=299624 Win=403968 Len=76"
"556","52.193679200","172.20.40.110","151.101.194.187","TCP","66","50060  >  443 [ACK] Seq=299624 Ack=11532 Win=65024 Len=0 SLE=11456 SRE=11532"
"557","52.555364400","172.20.40.110","151.101.194.187","TLSv1.3","2841","Application Data"
"558","52.561632300","172.20.40.110","151.101.194.187","TLSv1.3","2841","Application Data"
"559","52.566395400","151.101.194.187","172.20.40.110","TCP","60","443  >  50060 [ACK] Seq=11532 Ack=302411 Win=409600 Len=0"
"560","52.569170700","151.101.194.187","172.20.40.110","TLSv1.3","235","Application Data"
"561","52.571415100","151.101.194.187","172.20.40.110","TCP","60","443  >  50060 [ACK] Seq=11713 Ack=305198 Win=414720 Len=0"
"562","52.576119300","151.101.194.187","172.20.40.110","TLSv1.3","131","Application Data"
"563","52.576214400","172.20.40.110","151.101.194.187","TCP","54","50060  >  443 [ACK] Seq=305198 Ack=11790 Win=64768 Len=0"
"564","52.636592800","172.20.40.110","151.101.194.187","TLSv1.3","2843","Application Data"
"565","52.637001300","172.20.40.110","151.101.194.187","TLSv1.3","2854","Application Data"
"566","52.645733000","151.101.194.187","172.20.40.110","TCP","60","443  >  50060 [ACK] Seq=11790 Ack=307987 Win=420352 Len=0"
"567","52.649289200","151.101.194.187","172.20.40.110","TCP","60","443  >  50060 [ACK] Seq=11790 Ack=310787 Win=425984 Len=0"
"568","52.650570900","151.101.194.187","172.20.40.110","TLSv1.3","98","Application Data"
"569","52.653317600","151.101.194.187","172.20.40.110","TLSv1.3","124","Application Data"
"570","52.653413900","172.20.40.110","151.101.194.187","TCP","54","50060  >  443 [ACK] Seq=310787 Ack=11904 Win=66048 Len=0"
"571","52.869264300","172.20.40.110","151.101.194.187","TLSv1.3","2855","Application Data"
"572","52.873192600","172.20.40.110","151.101.194.187","TLSv1.3","2853","Application Data"
"573","52.880479600","151.101.194.187","172.20.40.110","TCP","60","443  >  50060 [ACK] Seq=11904 Ack=313588 Win=431616 Len=0"
"574","52.883409600","151.101.194.187","172.20.40.110","TCP","60","443  >  50060 [ACK] Seq=11904 Ack=316387 Win=437248 Len=0"
"575","52.884607600","151.101.194.187","172.20.40.110","TLSv1.3","125","Application Data"
"576","52.886983300","151.101.194.187","172.20.40.110","TLSv1.3","125","Application Data"
"577","52.887056000","172.20.40.110","151.101.194.187","TCP","54","50060  >  443 [ACK] Seq=316387 Ack=12046 Win=66048 Len=0"
"578","53.042844900","172.20.40.110","151.101.194.187","TLSv1.3","2856","Application Data"
"579","53.053688200","151.101.194.187","172.20.40.110","TCP","60","443  >  50060 [ACK] Seq=12046 Ack=319189 Win=442880 Len=0"
"580","53.058229900","151.101.194.187","172.20.40.110","TLSv1.3","125","Application Data"
"581","53.084162900","151.101.194.187","172.20.40.110","TCP","125","[TCP Retransmission] 443  >  50060 [PSH, ACK] Seq=12046 Ack=319189 Win=442880 Len=71"
"582","53.084215300","172.20.40.110","151.101.194.187","TCP","66","50060  >  443 [ACK] Seq=319189 Ack=12117 Win=65792 Len=0 SLE=12046 SRE=12117"
"583","53.319661600","172.20.40.110","151.101.194.187","TLSv1.3","2890","Application Data"
"584","53.331921300","151.101.194.187","172.20.40.110","TCP","60","443  >  50060 [ACK] Seq=12117 Ack=322025 Win=448512 Len=0"
"585","53.333280200","151.101.194.187","172.20.40.110","TLSv1.3","129","Application Data"
"586","53.361540100","151.101.194.187","172.20.40.110","TCP","129","[TCP Retransmission] 443  >  50060 [PSH, ACK] Seq=12117 Ack=322025 Win=448512 Len=75"
"587","53.361605400","172.20.40.110","151.101.194.187","TCP","66","50060  >  443 [ACK] Seq=322025 Ack=12192 Win=65792 Len=0 SLE=12117 SRE=12192"
"588","53.365607700","172.20.40.110","151.101.194.187","TLSv1.3","2847","Application Data"
"589","53.368059600","172.20.40.110","151.101.194.187","TLSv1.3","2858","Application Data"
"590","53.375928100","151.101.194.187","172.20.40.110","TCP","60","443  >  50060 [ACK] Seq=12192 Ack=324818 Win=454144 Len=0"
"591","53.381596900","151.101.194.187","172.20.40.110","TLSv1.3","104","Application Data"
"592","53.384778700","151.101.194.187","172.20.40.110","TCP","60","443  >  50060 [ACK] Seq=12242 Ack=327622 Win=459776 Len=0"
"593","53.385877300","151.101.194.187","172.20.40.110","TLSv1.3","104","Application Data"
"594","53.385983000","172.20.40.110","151.101.194.187","TCP","54","50060  >  443 [ACK] Seq=327622 Ack=12292 Win=65792 Len=0"
"595","56.104687400","172.20.40.110","151.101.194.187","TLSv1.3","2880","Application Data"
"596","56.116662000","151.101.194.187","172.20.40.110","TCP","60","443  >  50060 [ACK] Seq=12292 Ack=330448 Win=465408 Len=0"
"597","56.120115100","151.101.194.187","172.20.40.110","TLSv1.3","258","Application Data"
"598","56.147215400","151.101.194.187","172.20.40.110","TCP","258","[TCP Retransmission] 443  >  50060 [PSH, ACK] Seq=12292 Ack=330448 Win=465408 Len=204"
"599","56.147278900","172.20.40.110","151.101.194.187","TCP","66","50060  >  443 [ACK] Seq=330448 Ack=12496 Win=65536 Len=0 SLE=12292 SRE=12496"
"600","56.153652300","172.20.40.110","151.101.194.187","TLSv1.3","2879","Application Data"
"601","56.162672600","151.101.194.187","172.20.40.110","TCP","60","443  >  50060 [ACK] Seq=12496 Ack=333273 Win=471040 Len=0"
"602","56.166731300","151.101.194.187","172.20.40.110","TLSv1.3","103","Application Data"
"603","56.192405000","151.101.194.187","172.20.40.110","TCP","103","[TCP Retransmission] 443  >  50060 [PSH, ACK] Seq=12496 Ack=333273 Win=471040 Len=49"
"604","56.192469100","172.20.40.110","151.101.194.187","TCP","66","50060  >  443 [ACK] Seq=333273 Ack=12545 Win=65536 Len=0 SLE=12496 SRE=12545"
"605","56.221451900","172.20.40.110","151.101.194.187","TLSv1.3","2877","Application Data"
"606","56.230899500","151.101.194.187","172.20.40.110","TCP","60","443  >  50060 [ACK] Seq=12545 Ack=336096 Win=476672 Len=0"
"607","56.233193000","151.101.194.187","172.20.40.110","TLSv1.3","265","Application Data"
"608","56.262567100","151.101.194.187","172.20.40.110","TCP","265","[TCP Retransmission] 443  >  50060 [PSH, ACK] Seq=12545 Ack=336096 Win=476672 Len=211"
"609","56.262678900","172.20.40.110","151.101.194.187","TCP","66","50060  >  443 [ACK] Seq=336096 Ack=12756 Win=65280 Len=0 SLE=12545 SRE=12756"
"610","56.672039100","172.20.40.110","151.101.194.187","TLSv1.3","2867","Application Data"
"611","56.672289600","172.20.40.110","151.101.194.187","TLSv1.3","2878","Application Data"
"612","56.672579100","172.20.40.110","151.101.194.187","TLSv1.3","2879","Application Data"
"613","56.687931700","151.101.194.187","172.20.40.110","TCP","60","443  >  50060 [ACK] Seq=12756 Ack=338909 Win=482304 Len=0"
"614","56.689109100","151.101.194.187","172.20.40.110","TCP","60","443  >  50060 [ACK] Seq=12756 Ack=341733 Win=487936 Len=0"
"615","56.689109100","151.101.194.187","172.20.40.110","TCP","60","443  >  50060 [ACK] Seq=12756 Ack=344558 Win=494080 Len=0"
"616","56.689109100","151.101.194.187","172.20.40.110","TLSv1.3","214","Application Data"
"617","56.691193700","151.101.194.187","172.20.40.110","TLSv1.3","98","Application Data"
"618","56.691273100","172.20.40.110","151.101.194.187","TCP","54","50060  >  443 [ACK] Seq=344558 Ack=12960 Win=65024 Len=0"
"619","56.692601600","151.101.194.187","172.20.40.110","TLSv1.3","104","Application Data"
"620","56.725171700","151.101.194.187","172.20.40.110","TCP","104","[TCP Retransmission] 443  >  50060 [PSH, ACK] Seq=12960 Ack=344558 Win=494080 Len=50"
"621","56.725259500","172.20.40.110","151.101.194.187","TCP","66","50060  >  443 [ACK] Seq=344558 Ack=13010 Win=65024 Len=0 SLE=12960 SRE=13010"
"622","57.881689800","172.20.40.110","151.101.194.187","TLSv1.3","2879","Application Data"
"623","57.882016400","172.20.40.110","151.101.194.187","TLSv1.3","2867","Application Data"
"624","57.882352200","172.20.40.110","151.101.194.187","TLSv1.3","2861","Application Data"
"625","57.899539200","172.20.40.110","151.101.194.187","TLSv1.3","2880","Application Data"
"626","57.900685900","172.20.40.110","151.101.194.187","TLSv1.3","2862","Application Data"
"627","57.908382400","151.101.194.187","172.20.40.110","TCP","60","443  >  50060 [ACK] Seq=13010 Ack=347383 Win=499712 Len=0"
"628","57.908382400","151.101.194.187","172.20.40.110","TCP","60","443  >  50060 [ACK] Seq=13010 Ack=350196 Win=505344 Len=0"
"629","57.908382400","151.101.194.187","172.20.40.110","TCP","60","443  >  50060 [ACK] Seq=13010 Ack=353003 Win=510464 Len=0"
"630","57.911173200","151.101.194.187","172.20.40.110","TLSv1.3","214","Application Data"
"631","57.912617600","151.101.194.187","172.20.40.110","TLSv1.3","130","Application Data"
"632","57.912617600","151.101.194.187","172.20.40.110","TCP","60","443  >  50060 [ACK] Seq=13246 Ack=355763 Win=516096 Len=0"
"633","57.912846900","172.20.40.110","151.101.194.187","TCP","54","50060  >  443 [ACK] Seq=358637 Ack=13246 Win=64768 Len=0"
"634","57.913901200","151.101.194.187","172.20.40.110","TLSv1.3","130","Application Data"
"635","57.913983400","172.20.40.110","151.101.194.187","TCP","54","50060  >  443 [ACK] Seq=358637 Ack=13322 Win=66048 Len=0"
"636","57.915218300","151.101.194.187","172.20.40.110","TCP","60","443  >  50060 [ACK] Seq=13322 Ack=355829 Win=516096 Len=0"
"637","57.916364100","151.101.194.187","172.20.40.110","TCP","60","443  >  50060 [ACK] Seq=13322 Ack=358637 Win=521728 Len=0"
"638","57.919554200","151.101.194.187","172.20.40.110","TLSv1.3","124","Application Data"
"639","57.919629800","172.20.40.110","151.101.194.187","TCP","54","50060  >  443 [ACK] Seq=358637 Ack=13392 Win=66048 Len=0"
"640","57.920907300","151.101.194.187","172.20.40.110","TLSv1.3","98","Application Data"
"641","57.951283500","151.101.194.187","172.20.40.110","TCP","98","[TCP Retransmission] 443  >  50060 [PSH, ACK] Seq=13392 Ack=358637 Win=521728 Len=44"
"642","57.951342300","172.20.40.110","151.101.194.187","TCP","66","50060  >  443 [ACK] Seq=358637 Ack=13436 Win=66048 Len=0 SLE=13392 SRE=13436"
"643","58.029723500","172.20.40.110","151.101.194.187","TLSv1.3","2883","Application Data"
"644","58.040440900","151.101.194.187","172.20.40.110","TCP","60","443  >  50060 [ACK] Seq=13436 Ack=361466 Win=527360 Len=0"
"645","58.043500800","172.20.40.110","151.101.194.187","TLSv1.3","2863","Application Data"
"646","58.047163000","151.101.194.187","172.20.40.110","TLSv1.3","130","Application Data"
"647","58.052657600","151.101.194.187","172.20.40.110","TCP","60","443  >  50060 [ACK] Seq=13512 Ack=364275 Win=532992 Len=0"
"648","58.056411900","151.101.194.187","172.20.40.110","TLSv1.3","125","Application Data"
"649","58.056522700","172.20.40.110","151.101.194.187","TCP","54","50060  >  443 [ACK] Seq=364275 Ack=13583 Win=65792 Len=0"
"650","58.195516200","172.20.40.110","151.101.194.187","TLSv1.3","2871","Application Data"
"651","58.199930500","172.20.40.110","151.101.194.187","TLSv1.3","2849","Application Data"
"652","58.200631900","172.20.40.110","151.101.194.187","TLSv1.3","2852","Application Data"
"653","58.201015700","172.20.40.110","151.101.194.187","TLSv1.3","2846","Application Data"
"654","58.203209600","172.20.40.110","151.101.194.187","TLSv1.3","2843","Application Data"
"655","58.206352700","151.101.194.187","172.20.40.110","TCP","60","443  >  50060 [ACK] Seq=13583 Ack=367092 Win=538624 Len=0"
"656","58.210114900","151.101.194.187","172.20.40.110","TLSv1.3","130","Application Data"
"657","58.211136600","151.101.194.187","172.20.40.110","TCP","60","443  >  50060 [ACK] Seq=13659 Ack=369887 Win=544256 Len=0"
"658","58.212404400","151.101.194.187","172.20.40.110","TCP","60","443  >  50060 [ACK] Seq=13659 Ack=372685 Win=549888 Len=0"
"659","58.212404400","151.101.194.187","172.20.40.110","TCP","60","443  >  50060 [ACK] Seq=13659 Ack=375477 Win=555520 Len=0"
"660","58.214800900","151.101.194.187","172.20.40.110","TLSv1.3","129","Application Data"
"661","58.214898200","172.20.40.110","151.101.194.187","TCP","54","50060  >  443 [ACK] Seq=378266 Ack=13734 Win=65792 Len=0"
"662","58.215841200","151.101.194.187","172.20.40.110","TCP","60","443  >  50060 [ACK] Seq=13734 Ack=378266 Win=561152 Len=0"
"663","58.219093700","151.101.194.187","172.20.40.110","TLSv1.3","130","Application Data"
"664","58.221257600","151.101.194.187","172.20.40.110","TLSv1.3","227","Application Data"
"665","58.221347900","172.20.40.110","151.101.194.187","TCP","54","50060  >  443 [ACK] Seq=378266 Ack=13983 Win=65536 Len=0"
"666","58.504373900","172.20.40.110","151.101.194.187","TLSv1.3","2909","Application Data"
"667","58.511808900","172.20.40.110","151.101.194.187","TLSv1.3","2909","Application Data"
"668","58.514973400","151.101.194.187","172.20.40.110","TCP","60","443  >  50060 [ACK] Seq=13983 Ack=381121 Win=566784 Len=0"
"669","58.519655800","151.101.194.187","172.20.40.110","TLSv1.3","396","Application Data"
"670","58.522893700","151.101.194.187","172.20.40.110","TCP","60","443  >  50060 [ACK] Seq=14325 Ack=383976 Win=572416 Len=0"
"671","58.525161800","151.101.194.187","172.20.40.110","TLSv1.3","131","Application Data"
"672","58.525234200","172.20.40.110","151.101.194.187","TCP","54","50060  >  443 [ACK] Seq=383976 Ack=14402 Win=65024 Len=0"
"673","58.572047100","172.20.40.110","151.101.194.187","TLSv1.3","2921","Application Data"
"674","58.580855600","151.101.194.187","172.20.40.110","TCP","60","443  >  50060 [ACK] Seq=14402 Ack=386843 Win=578048 Len=0"
"675","58.584334500","151.101.194.187","172.20.40.110","TLSv1.3","125","Application Data"
"676","58.590807900","172.20.40.110","151.101.194.187","TLSv1.3","2911","Application Data"
"677","58.599531400","151.101.194.187","172.20.40.110","TCP","60","443  >  50060 [ACK] Seq=14473 Ack=389700 Win=584192 Len=0"
"678","58.602966700","151.101.194.187","172.20.40.110","TLSv1.3","98","Application Data"
"679","58.632200400","151.101.194.187","172.20.40.110","TCP","98","[TCP Retransmission] 443  >  50060 [PSH, ACK] Seq=14473 Ack=389700 Win=584192 Len=44"
"680","58.632284900","172.20.40.110","151.101.194.187","TCP","66","50060  >  443 [ACK] Seq=389700 Ack=14517 Win=65024 Len=0 SLE=14473 SRE=14517"
"681","58.859060000","172.20.40.110","151.101.194.187","TLSv1.3","2926","Application Data"
"682","58.860073300","172.20.40.110","151.101.194.187","TLSv1.3","2927","Application Data"
"683","58.871263400","151.101.194.187","172.20.40.110","TCP","60","443  >  50060 [ACK] Seq=14517 Ack=392572 Win=589824 Len=0"
"684","58.871263400","151.101.194.187","172.20.40.110","TCP","60","443  >  50060 [ACK] Seq=14517 Ack=395445 Win=595456 Len=0"
"685","58.877835900","151.101.194.187","172.20.40.110","TLSv1.3","124","Application Data"
"686","58.877835900","151.101.194.187","172.20.40.110","TLSv1.3","130","Application Data"
"687","58.877921600","172.20.40.110","151.101.194.187","TCP","54","50060  >  443 [ACK] Seq=395445 Ack=14663 Win=64768 Len=0"
