No.,Time,Source,Destination,Protocol,Length,Info
1,0.0,172.20.40.110,151.101.194.187,TLSv1.2,2851,Application Data
2,0.0002264,172.20.40.110,151.101.194.187,TLSv1.2,93,Application Data
3,0.0176321,151.101.194.187,172.20.40.110,TCP,60,443  >  50060 [ACK] Seq=1 Ack=2798 Win=3367 Len=0
4,0.0176321,151.101.194.187,172.20.40.110,TCP,60,443  >  50060 [ACK] Seq=1 Ack=2837 Win=3367 Len=0
5,0.0176321,151.101.194.187,172.20.40.110,TLSv1.2,93,Application Data
6,0.0199404,151.101.194.187,172.20.40.110,TLSv1.2,368,Application Data
7,0.020046,172.20.40.110,151.101.194.187,TCP,54,50060  >  443 [ACK] Seq=2837 Ack=354 Win=257 Len=0
8,0.4306319,172.20.40.110,151.101.194.187,TLSv1.2,2842,Application Data
9,0.4481282,151.101.194.187,172.20.40.110,TCP,60,443  >  50060 [ACK] Seq=354 Ack=5625 Win=3378 Len=0
10,0.451541,151.101.194.187,172.20.40.110,TLSv1.2,153,Application Data
11,0.4838823,151.101.194.187,172.20.40.110,TCP,153,"[TCP Retransmission] 443  >  50060 [PSH, ACK] Seq=354 Ack=5625 Win=3378 Len=99"
12,0.4839451,172.20.40.110,151.101.194.187,TCP,66,50060  >  443 [ACK] Seq=5625 Ack=453 Win=256 Len=0 SLE=354 SRE=453
13,3.9408305,172.20.40.110,151.101.194.187,TLSv1.2,2873,Application Data
14,3.9521416,151.101.194.187,172.20.40.110,TCP,60,443  >  50060 [ACK] Seq=453 Ack=8444 Win=3389 Len=0
15,3.9554768,172.20.40.110,151.101.194.187,TLSv1.2,2864,Application Data
16,3.9580005,172.20.40.110,151.101.194.187,TLSv1.2,2858,Application Data
17,3.9582487,151.101.194.187,172.20.40.110,TLSv1.2,214,Application Data
18,3.9649987,151.101.194.187,172.20.40.110,TCP,60,443  >  50060 [ACK] Seq=613 Ack=11254 Win=3400 Len=0
19,3.9671741,151.101.194.187,172.20.40.110,TCP,60,443  >  50060 [ACK] Seq=613 Ack=14058 Win=3411 Len=0
20,3.9695354,151.101.194.187,172.20.40.110,TLSv1.2,185,Application Data
21,3.9696177,172.20.40.110,151.101.194.187,TCP,54,50060  >  443 [ACK] Seq=14058 Ack=744 Win=255 Len=0
22,3.9719599,151.101.194.187,172.20.40.110,TLSv1.2,103,Application Data
23,4.0114027,151.101.194.187,172.20.40.110,TCP,103,"[TCP Retransmission] 443  >  50060 [PSH, ACK] Seq=744 Ack=14058 Win=3411 Len=49"
24,4.0114696,172.20.40.110,151.101.194.187,TCP,66,50060  >  443 [ACK] Seq=14058 Ack=793 Win=255 Len=0 SLE=744 SRE=793
25,4.0206786,172.20.40.110,151.101.194.187,TLSv1.2,2858,Application Data
26,4.0318259,151.101.194.187,172.20.40.110,TCP,60,443  >  50060 [ACK] Seq=793 Ack=16862 Win=3422 Len=0
27,4.0363103,151.101.194.187,172.20.40.110,TLSv1.2,130,Application Data
28,4.07058,151.101.194.187,172.20.40.110,TCP,130,"[TCP Retransmission] 443  >  50060 [PSH, ACK] Seq=793 Ack=16862 Win=3422 Len=76"
29,4.0706626,172.20.40.110,151.101.194.187,TCP,66,50060  >  443 [ACK] Seq=16862 Ack=869 Win=255 Len=0 SLE=793 SRE=869
30,4.1509383,172.20.40.110,151.101.194.187,TLSv1.2,2855,Application Data
31,4.1620407,151.101.194.187,172.20.40.110,TCP,60,443  >  50060 [ACK] Seq=869 Ack=19663 Win=3433 Len=0
32,4.1663486,151.101.194.187,172.20.40.110,TLSv1.2,125,Application Data
33,4.1690775,172.20.40.110,151.101.194.187,TLSv1.2,2872,Application Data
34,4.1759137,172.20.40.110,151.101.194.187,TLSv1.2,2872,Application Data
35,4.1825446,151.101.194.187,172.20.40.110,TCP,60,443  >  50060 [ACK] Seq=940 Ack=22481 Win=3444 Len=0
36,4.1847863,151.101.194.187,172.20.40.110,TCP,60,443  >  50060 [ACK] Seq=940 Ack=25299 Win=3455 Len=0
37,4.1858084,151.101.194.187,172.20.40.110,TLSv1.2,130,Application Data
38,4.187959,151.101.194.187,172.20.40.110,TLSv1.2,125,Application Data
39,4.1880336,172.20.40.110,151.101.194.187,TCP,54,50060  >  443 [ACK] Seq=25299 Ack=1087 Win=254 Len=0
40,4.4480199,172.20.40.110,151.101.194.187,TLSv1.2,2866,Application Data
41,4.4482996,172.20.40.110,151.101.194.187,TLSv1.2,2864,Application Data
42,4.4485274,172.20.40.110,151.101.194.187,TLSv1.2,2861,Application Data
43,4.4575046,151.101.194.187,172.20.40.110,TCP,60,443  >  50060 [ACK] Seq=1087 Ack=28111 Win=3466 Len=0
44,4.4607576,151.101.194.187,172.20.40.110,TLSv1.2,130,Application Data
45,4.4618532,151.101.194.187,172.20.40.110,TCP,60,443  >  50060 [ACK] Seq=1163 Ack=30921 Win=3477 Len=0
46,4.4618532,151.101.194.187,172.20.40.110,TCP,60,443  >  50060 [ACK] Seq=1163 Ack=33728 Win=3487 Len=0
47,4.4640974,151.101.194.187,172.20.40.110,TLSv1.2,130,Application Data
48,4.4641718,172.20.40.110,151.101.194.187,TCP,54,50060  >  443 [ACK] Seq=33728 Ack=1239 Win=253 Len=0
49,4.4664825,151.101.194.187,172.20.40.110,TLSv1.2,131,Application Data
50,4.5038863,151.101.194.187,172.20.40.110,TCP,131,"[TCP Retransmission] 443  >  50060 [PSH, ACK] Seq=1239 Ack=33728 Win=3487 Len=77"
51,4.5039324,172.20.40.110,151.101.194.187,TCP,66,50060  >  443 [ACK] Seq=33728 Ack=1316 Win=253 Len=0 SLE=1239 SRE=1316
52,4.5837825,172.20.40.110,151.101.194.187,TLSv1.2,2914,Application Data
53,4.5905723,172.20.40.110,151.101.194.187,TLSv1.2,2915,Application Data
54,4.5927771,172.20.40.110,151.101.194.187,TLSv1.2,2917,Application Data
55,4.5938226,172.20.40.110,151.101.194.187,TLSv1.2,2916,Application Data
56,4.5940969,172.20.40.110,151.101.194.187,TLSv1.2,2913,Application Data
57,4.6118944,151.101.194.187,172.20.40.110,TCP,60,443  >  50060 [ACK] Seq=1316 Ack=36588 Win=3499 Len=0
58,4.6118944,151.101.194.187,172.20.40.110,TLSv1.2,240,Application Data
59,4.6119868,172.20.40.110,151.101.194.187,TCP,54,50060  >  443 [ACK] Seq=48033 Ack=1502 Win=258 Len=0
60,4.633674,151.101.194.187,172.20.40.110,TCP,60,443  >  50060 [ACK] Seq=1502 Ack=39449 Win=3510 Len=0
61,4.633674,151.101.194.187,172.20.40.110,TCP,60,443  >  50060 [ACK] Seq=1502 Ack=42312 Win=3521 Len=0
62,4.633674,151.101.194.187,172.20.40.110,TCP,60,443  >  50060 [ACK] Seq=1502 Ack=45174 Win=3533 Len=0
63,4.633674,151.101.194.187,172.20.40.110,TLSv1.2,251,Application Data
64,4.633674,151.101.194.187,172.20.40.110,TLSv1.2,125,Application Data
65,4.633674,151.101.194.187,172.20.40.110,TLSv1.2,124,Application Data
66,4.633674,151.101.194.187,172.20.40.110,TCP,60,443  >  50060 [ACK] Seq=1840 Ack=46554 Win=3538 Len=0
67,4.6337882,172.20.40.110,151.101.194.187,TCP,54,50060  >  443 [ACK] Seq=48033 Ack=1840 Win=257 Len=0
68,4.6415555,151.101.194.187,172.20.40.110,TCP,60,443  >  50060 [ACK] Seq=1840 Ack=48033 Win=3544 Len=0
69,4.6427772,151.101.194.187,172.20.40.110,TLSv1.2,146,Application Data
70,4.6839498,151.101.194.187,172.20.40.110,TCP,146,"[TCP Retransmission] 443  >  50060 [PSH, ACK] Seq=1840 Ack=48033 Win=3544 Len=92"
71,4.6840836,172.20.40.110,151.101.194.187,TCP,66,50060  >  443 [ACK] Seq=48033 Ack=1932 Win=257 Len=0 SLE=1840 SRE=1932
72,5.2647715,172.20.40.110,151.101.194.187,TLSv1.2,2911,Application Data
73,5.2658999,172.20.40.110,151.101.194.187,TLSv1.2,2909,Application Data
74,5.2738187,151.101.194.187,172.20.40.110,TCP,60,443  >  50060 [ACK] Seq=1932 Ack=50890 Win=3555 Len=0
75,5.2751041,151.101.194.187,172.20.40.110,TCP,60,443  >  50060 [ACK] Seq=1932 Ack=53745 Win=3566 Len=0
76,5.2761856,151.101.194.187,172.20.40.110,TLSv1.2,98,Application Data
77,5.2773431,151.101.194.187,172.20.40.110,TLSv1.2,131,Application Data
78,5.2774201,172.20.40.110,151.101.194.187,TCP,54,50060  >  443 [ACK] Seq=53745 Ack=2053 Win=256 Len=0
79,5.3268593,172.20.40.110,151.101.194.187,TLSv1.2,2912,Application Data
80,5.3421535,151.101.194.187,172.20.40.110,TCP,60,443  >  50060 [ACK] Seq=2053 Ack=55125 Win=3572 Len=0
81,5.3421535,151.101.194.187,172.20.40.110,TCP,60,443  >  50060 [ACK] Seq=2053 Ack=56603 Win=3578 Len=0
82,5.3455142,151.101.194.187,172.20.40.110,TLSv1.2,125,Application Data
83,5.3819124,151.101.194.187,172.20.40.110,TCP,125,"[TCP Retransmission] 443  >  50060 [PSH, ACK] Seq=2053 Ack=56603 Win=3578 Len=71"
84,5.3819707,172.20.40.110,151.101.194.187,TCP,66,50060  >  443 [ACK] Seq=56603 Ack=2124 Win=256 Len=0 SLE=2053 SRE=2124
85,5.4239751,172.20.40.110,151.101.194.187,TLSv1.2,2911,Application Data
86,5.4359492,151.101.194.187,172.20.40.110,TCP,60,443  >  50060 [ACK] Seq=2124 Ack=59460 Win=3589 Len=0
87,5.4383466,151.101.194.187,172.20.40.110,TLSv1.2,191,Application Data
88,5.4741319,151.101.194.187,172.20.40.110,TCP,191,"[TCP Retransmission] 443  >  50060 [PSH, ACK] Seq=2124 Ack=59460 Win=3589 Len=137"
89,5.4742626,172.20.40.110,151.101.194.187,TCP,66,50060  >  443 [ACK] Seq=59460 Ack=2261 Win=255 Len=0 SLE=2124 SRE=2261
90,16.0449206,172.20.40.110,151.101.194.187,TLSv1.2,2933,Application Data
91,16.0450451,172.20.40.110,151.101.194.187,TLSv1.2,93,Application Data
92,16.0515171,172.20.40.110,151.101.194.187,TLSv1.2,2924,Application Data
93,16.0519165,172.20.40.110,151.101.194.187,TLSv1.2,2918,Application Data
94,16.0645587,151.101.194.187,172.20.40.110,TCP,60,443  >  50060 [ACK] Seq=2261 Ack=62339 Win=3600 Len=0
95,16.0645587,151.101.194.187,172.20.40.110,TCP,60,443  >  50060 [ACK] Seq=2261 Ack=62378 Win=3600 Len=0
96,16.0645587,151.101.194.187,172.20.40.110,TLSv1.2,93,Application Data
97,16.0697509,151.101.194.187,172.20.40.110,TLSv1.2,214,Application Data
98,16.0698305,172.20.40.110,151.101.194.187,TCP,54,50060  >  443 [ACK] Seq=68112 Ack=2460 Win=255 Len=0
99,16.0708234,151.101.194.187,172.20.40.110,TCP,60,443  >  50060 [ACK] Seq=2460 Ack=65248 Win=3611 Len=0
100,16.0708234,151.101.194.187,172.20.40.110,TCP,60,443  >  50060 [ACK] Seq=2460 Ack=68112 Win=3623 Len=0
101,16.0760721,151.101.194.187,172.20.40.110,TLSv1.2,124,Application Data
102,16.0773988,151.101.194.187,172.20.40.110,TLSv1.2,130,Application Data
103,16.0774925,172.20.40.110,151.101.194.187,TCP,54,50060  >  443 [ACK] Seq=68112 Ack=2606 Win=254 Len=0
104,16.0974502,172.20.40.110,151.101.194.187,TLSv1.2,2918,Application Data
105,16.1064933,151.101.194.187,172.20.40.110,TCP,60,443  >  50060 [ACK] Seq=2606 Ack=70976 Win=3634 Len=0
106,16.1120052,151.101.194.187,172.20.40.110,TLSv1.2,130,Application Data
107,16.1321867,172.20.40.110,151.101.194.187,TLSv1.2,2930,Application Data
108,16.1418515,151.101.194.187,172.20.40.110,TCP,60,443  >  50060 [ACK] Seq=2682 Ack=73852 Win=3645 Len=0
109,16.1473176,151.101.194.187,172.20.40.110,TLSv1.2,104,Application Data
110,16.1865577,151.101.194.187,172.20.40.110,TCP,104,"[TCP Retransmission] 443  >  50060 [PSH, ACK] Seq=2682 Ack=73852 Win=3645 Len=50"
111,16.1866166,172.20.40.110,151.101.194.187,TCP,66,50060  >  443 [ACK] Seq=73852 Ack=2732 Win=253 Len=0 SLE=2682 SRE=2732
112,16.2351157,172.20.40.110,151.101.194.187,TLSv1.2,2915,Application Data
113,16.246879,172.20.40.110,151.101.194.187,TLSv1.2,2932,Application Data
114,16.2470435,151.101.194.187,172.20.40.110,TCP,60,443  >  50060 [ACK] Seq=2732 Ack=76713 Win=3656 Len=0
115,16.2526327,151.101.194.187,172.20.40.110,TLSv1.2,125,Application Data
116,16.2558225,151.101.194.187,172.20.40.110,TCP,60,443  >  50060 [ACK] Seq=2803 Ack=79591 Win=3667 Len=0
117,16.2610774,151.101.194.187,172.20.40.110,TLSv1.2,130,Application Data
118,16.2611578,172.20.40.110,151.101.194.187,TCP,54,50060  >  443 [ACK] Seq=79591 Ack=2879 Win=253 Len=0
119,16.2770657,172.20.40.110,151.101.194.187,TLSv1.2,2932,Application Data
120,16.2857808,151.101.194.187,172.20.40.110,TCP,60,443  >  50060 [ACK] Seq=2879 Ack=82469 Win=3679 Len=0
121,16.2924252,151.101.194.187,172.20.40.110,TLSv1.2,125,Application Data
122,16.3351069,172.20.40.110,151.101.194.187,TCP,54,50060  >  443 [ACK] Seq=82469 Ack=2950 Win=258 Len=0
123,16.3389488,151.101.194.187,172.20.40.110,TCP,125,"[TCP Spurious Retransmission] 443  >  50060 [PSH, ACK] Seq=2879 Ack=82469 Win=3679 Len=71"
124,16.3390048,172.20.40.110,151.101.194.187,TCP,66,[TCP Dup ACK 122#1] 50060  >  443 [ACK] Seq=82469 Ack=2950 Win=258 Len=0 SLE=2879 SRE=2950
125,16.3567835,172.20.40.110,151.101.194.187,TLSv1.2,2919,Application Data
126,16.3661425,151.101.194.187,172.20.40.110,TCP,60,443  >  50060 [ACK] Seq=2950 Ack=85334 Win=3690 Len=0
127,16.372685,151.101.194.187,172.20.40.110,TLSv1.2,124,Application Data
128,16.4196706,172.20.40.110,151.101.194.187,TCP,54,50060  >  443 [ACK] Seq=85334 Ack=3020 Win=258 Len=0
129,16.4230947,151.101.194.187,172.20.40.110,TCP,124,"[TCP Spurious Retransmission] 443  >  50060 [PSH, ACK] Seq=2950 Ack=85334 Win=3690 Len=70"
130,16.4231844,172.20.40.110,151.101.194.187,TCP,66,[TCP Dup ACK 128#1] 50060  >  443 [ACK] Seq=85334 Ack=3020 Win=258 Len=0 SLE=2950 SRE=3020
131,16.4329246,172.20.40.110,151.101.194.187,TLSv1.2,2918,Application Data
132,16.4388252,172.20.40.110,151.101.194.187,TLSv1.2,2919,Application Data
133,16.4390799,172.20.40.110,151.101.194.187,TLSv1.2,2921,Application Data
134,16.4392593,172.20.40.110,151.101.194.187,TLSv1.2,2920,Application Data
135,16.4394234,172.20.40.110,151.101.194.187,TLSv1.2,2917,Application Data
136,16.4428352,172.20.40.110,151.101.194.187,TLSv1.2,2922,Application Data
137,16.4526537,151.101.194.187,172.20.40.110,TCP,60,443  >  50060 [ACK] Seq=3020 Ack=88198 Win=3701 Len=0
138,16.4526537,151.101.194.187,172.20.40.110,TLSv1.2,130,Application Data
139,16.4591908,151.101.194.187,172.20.40.110,TCP,60,443  >  50060 [ACK] Seq=3096 Ack=91063 Win=3712 Len=0
140,16.4591908,151.101.194.187,172.20.40.110,TCP,60,443  >  50060 [ACK] Seq=3096 Ack=93930 Win=3723 Len=0
141,16.4591908,151.101.194.187,172.20.40.110,TCP,60,443  >  50060 [ACK] Seq=3096 Ack=96796 Win=3735 Len=0
142,16.4591908,151.101.194.187,172.20.40.110,TCP,60,443  >  50060 [ACK] Seq=3096 Ack=99659 Win=3746 Len=0
143,16.4613421,151.101.194.187,172.20.40.110,TCP,60,443  >  50060 [ACK] Seq=3096 Ack=102527 Win=3757 Len=0
144,16.465331,151.101.194.187,172.20.40.110,TLSv1.2,251,Application Data
145,16.465331,151.101.194.187,172.20.40.110,TLSv1.2,125,Application Data
146,16.465331,151.101.194.187,172.20.40.110,TLSv1.2,98,Application Data
147,16.465331,151.101.194.187,172.20.40.110,TLSv1.2,124,Application Data
148,16.4657694,172.20.40.110,151.101.194.187,TCP,54,50060  >  443 [ACK] Seq=102527 Ack=3478 Win=256 Len=0
149,16.4662715,151.101.194.187,172.20.40.110,TLSv1.2,147,Application Data
150,16.4664415,172.20.40.110,151.101.194.187,TCP,54,50060  >  443 [ACK] Seq=102527 Ack=3571 Win=256 Len=0
151,16.6085506,172.20.40.110,151.101.194.187,TLSv1.2,2889,Application Data
152,16.6088487,172.20.40.110,151.101.194.187,TLSv1.2,2908,Application Data
153,16.6090846,172.20.40.110,151.101.194.187,TLSv1.2,2883,Application Data
154,16.623289,151.101.194.187,172.20.40.110,TCP,60,443  >  50060 [ACK] Seq=3571 Ack=103907 Win=3763 Len=0
155,16.623289,151.101.194.187,172.20.40.110,TCP,60,443  >  50060 [ACK] Seq=3571 Ack=105362 Win=3769 Len=0
156,16.623289,151.101.194.187,172.20.40.110,TCP,60,443  >  50060 [ACK] Seq=3571 Ack=108216 Win=3780 Len=0
157,16.623289,151.101.194.187,172.20.40.110,TCP,60,443  >  50060 [ACK] Seq=3571 Ack=111045 Win=3791 Len=0
158,16.6276973,151.101.194.187,172.20.40.110,TLSv1.2,241,Application Data
159,16.6287013,151.101.194.187,172.20.40.110,TLSv1.2,191,Application Data
160,16.6287013,151.101.194.187,172.20.40.110,TLSv1.2,130,Application Data
161,16.6288117,172.20.40.110,151.101.194.187,TCP,54,50060  >  443 [ACK] Seq=111045 Ack=3971 Win=254 Len=0
162,20.5388299,172.20.40.110,151.101.194.187,TLSv1.2,2953,Application Data
163,20.5502381,151.101.194.187,172.20.40.110,TCP,60,443  >  50060 [ACK] Seq=3971 Ack=113944 Win=3802 Len=0
164,20.5515902,151.101.194.187,172.20.40.110,TLSv1.2,214,Application Data
165,20.5894772,151.101.194.187,172.20.40.110,TCP,214,"[TCP Retransmission] 443  >  50060 [PSH, ACK] Seq=3971 Ack=113944 Win=3802 Len=160"
166,20.5895362,172.20.40.110,151.101.194.187,TCP,66,50060  >  443 [ACK] Seq=113944 Ack=4131 Win=254 Len=0 SLE=3971 SRE=4131
167,20.5997766,172.20.40.110,151.101.194.187,TLSv1.2,2954,Application Data
168,20.6099014,151.101.194.187,172.20.40.110,TCP,60,443  >  50060 [ACK] Seq=4131 Ack=116844 Win=3814 Len=0
169,20.6120992,151.101.194.187,172.20.40.110,TLSv1.2,241,Application Data
170,20.6475568,151.101.194.187,172.20.40.110,TCP,241,"[TCP Retransmission] 443  >  50060 [PSH, ACK] Seq=4131 Ack=116844 Win=3814 Len=187"
171,20.6477036,172.20.40.110,151.101.194.187,TCP,66,50060  >  443 [ACK] Seq=116844 Ack=4318 Win=253 Len=0 SLE=4131 SRE=4318
172,20.6543256,172.20.40.110,151.101.194.187,TLSv1.2,2953,Application Data
173,20.6657047,151.101.194.187,172.20.40.110,TCP,60,443  >  50060 [ACK] Seq=4318 Ack=119743 Win=3825 Len=0
174,20.668677,151.101.194.187,172.20.40.110,TLSv1.2,130,Application Data
175,20.704433,151.101.194.187,172.20.40.110,TCP,130,"[TCP Retransmission] 443  >  50060 [PSH, ACK] Seq=4318 Ack=119743 Win=3825 Len=76"
176,20.7045334,172.20.40.110,151.101.194.187,TCP,66,50060  >  443 [ACK] Seq=119743 Ack=4394 Win=258 Len=0 SLE=4318 SRE=4394
177,22.0873796,172.20.40.110,151.101.194.187,TLSv1.2,2939,Application Data
178,22.0997344,151.101.194.187,172.20.40.110,TCP,60,443  >  50060 [ACK] Seq=4394 Ack=122628 Win=3836 Len=0
179,22.1010883,151.101.194.187,172.20.40.110,TLSv1.2,240,Application Data
180,22.1381005,151.101.194.187,172.20.40.110,TCP,240,"[TCP Retransmission] 443  >  50060 [PSH, ACK] Seq=4394 Ack=122628 Win=3836 Len=186"
181,22.1381629,172.20.40.110,151.101.194.187,TCP,66,50060  >  443 [ACK] Seq=122628 Ack=4580 Win=258 Len=0 SLE=4394 SRE=4580
182,22.1812248,172.20.40.110,151.101.194.187,TLSv1.2,2942,Application Data
183,22.1982448,151.101.194.187,172.20.40.110,TCP,60,443  >  50060 [ACK] Seq=4580 Ack=125516 Win=3847 Len=0
184,22.200321,151.101.194.187,172.20.40.110,TLSv1.2,257,Application Data
185,22.2116025,172.20.40.110,151.101.194.187,TLSv1.2,2944,Application Data
186,22.2211684,151.101.194.187,172.20.40.110,TCP,60,443  >  50060 [ACK] Seq=4783 Ack=128406 Win=3847 Len=0
187,22.2290777,151.101.194.187,172.20.40.110,TLSv1.2,152,Application Data
188,22.2645919,151.101.194.187,172.20.40.110,TCP,152,"[TCP Retransmission] 443  >  50060 [PSH, ACK] Seq=4783 Ack=128406 Win=3847 Len=98"
189,22.264654,172.20.40.110,151.101.194.187,TCP,66,50060  >  443 [ACK] Seq=128406 Ack=4881 Win=256 Len=0 SLE=4783 SRE=4881
190,24.9586729,172.20.40.110,151.101.194.187,TLSv1.2,2959,Application Data
191,24.9660665,172.20.40.110,151.101.194.187,TLSv1.2,2950,Application Data
192,24.9662874,172.20.40.110,151.101.194.187,TLSv1.2,2944,Application Data
193,24.9682281,151.101.194.187,172.20.40.110,TCP,60,443  >  50060 [ACK] Seq=4881 Ack=131311 Win=3847 Len=0
194,24.973433,151.101.194.187,172.20.40.110,TLSv1.2,214,Application Data
195,24.9813645,151.101.194.187,172.20.40.110,TCP,60,443  >  50060 [ACK] Seq=5041 Ack=134207 Win=3847 Len=0
196,24.9813645,151.101.194.187,172.20.40.110,TCP,60,443  >  50060 [ACK] Seq=5041 Ack=137097 Win=3847 Len=0
197,24.9825121,151.101.194.187,172.20.40.110,TLSv1.2,130,Application Data
198,24.9825121,151.101.194.187,172.20.40.110,TLSv1.2,185,Application Data
199,24.9825606,172.20.40.110,151.101.194.187,TCP,54,50060  >  443 [ACK] Seq=137097 Ack=5248 Win=255 Len=0
200,25.023127,172.20.40.110,151.101.194.187,TLSv1.2,2944,Application Data
201,25.0346819,151.101.194.187,172.20.40.110,TCP,60,443  >  50060 [ACK] Seq=5248 Ack=139987 Win=3847 Len=0
202,25.0370908,151.101.194.187,172.20.40.110,TLSv1.2,104,Application Data
203,25.0757391,151.101.194.187,172.20.40.110,TCP,104,"[TCP Retransmission] 443  >  50060 [PSH, ACK] Seq=5248 Ack=139987 Win=3847 Len=50"
204,25.0758104,172.20.40.110,151.101.194.187,TCP,66,50060  >  443 [ACK] Seq=139987 Ack=5298 Win=255 Len=0 SLE=5248 SRE=5298
205,25.1640865,172.20.40.110,151.101.194.187,TLSv1.2,2941,Application Data
206,25.1749896,151.101.194.187,172.20.40.110,TCP,60,443  >  50060 [ACK] Seq=5298 Ack=142874 Win=3847 Len=0
207,25.1766188,172.20.40.110,151.101.194.187,TLSv1.2,2958,Application Data
208,25.1794633,151.101.194.187,172.20.40.110,TLSv1.2,125,Application Data
209,25.1860727,151.101.194.187,172.20.40.110,TCP,60,443  >  50060 [ACK] Seq=5369 Ack=145778 Win=3847 Len=0
210,25.1896301,151.101.194.187,172.20.40.110,TLSv1.2,130,Application Data
211,25.1897111,172.20.40.110,151.101.194.187,TCP,54,50060  >  443 [ACK] Seq=145778 Ack=5445 Win=254 Len=0
212,25.2090768,172.20.40.110,151.101.194.187,TLSv1.2,2958,Application Data
213,25.2183688,151.101.194.187,172.20.40.110,TCP,60,443  >  50060 [ACK] Seq=5445 Ack=148682 Win=3847 Len=0
214,25.2237514,151.101.194.187,172.20.40.110,TLSv1.2,125,Application Data
215,25.2617348,151.101.194.187,172.20.40.110,TCP,125,"[TCP Retransmission] 443  >  50060 [PSH, ACK] Seq=5445 Ack=148682 Win=3847 Len=71"
216,25.2617946,172.20.40.110,151.101.194.187,TCP,66,50060  >  443 [ACK] Seq=148682 Ack=5516 Win=254 Len=0 SLE=5445 SRE=5516
217,25.3848204,172.20.40.110,151.101.194.187,TLSv1.2,2952,Application Data
218,25.3854537,172.20.40.110,151.101.194.187,TLSv1.2,2950,Application Data
219,25.3862975,172.20.40.110,151.101.194.187,TLSv1.2,2941,Application Data
220,25.3988282,151.101.194.187,172.20.40.110,TCP,60,443  >  50060 [ACK] Seq=5516 Ack=151580 Win=3847 Len=0
221,25.3988282,151.101.194.187,172.20.40.110,TCP,60,443  >  50060 [ACK] Seq=5516 Ack=154476 Win=3847 Len=0
222,25.403865,151.101.194.187,172.20.40.110,TCP,60,443  >  50060 [ACK] Seq=5516 Ack=157363 Win=3853 Len=0
223,25.403865,151.101.194.187,172.20.40.110,TLSv1.2,130,Application Data
224,25.403865,151.101.194.187,172.20.40.110,TLSv1.2,131,Application Data
225,25.403865,151.101.194.187,172.20.40.110,TLSv1.2,130,Application Data
226,25.4039668,172.20.40.110,151.101.194.187,TCP,54,50060  >  443 [ACK] Seq=157363 Ack=5745 Win=253 Len=0
227,25.5292516,172.20.40.110,151.101.194.187,TLSv1.2,2947,Application Data
228,25.5295137,172.20.40.110,151.101.194.187,TLSv1.2,2943,Application Data
229,25.5296909,172.20.40.110,151.101.194.187,TLSv1.2,2944,Application Data
230,25.5298692,172.20.40.110,151.101.194.187,TLSv1.2,2946,Application Data
231,25.5302982,172.20.40.110,151.101.194.187,TLSv1.2,2945,Application Data
232,25.5304913,172.20.40.110,151.101.194.187,TLSv1.2,2942,Application Data
233,25.5538015,151.101.194.187,172.20.40.110,TCP,60,443  >  50060 [ACK] Seq=5745 Ack=160256 Win=3853 Len=0
234,25.5538015,151.101.194.187,172.20.40.110,TCP,60,443  >  50060 [ACK] Seq=5745 Ack=163145 Win=3853 Len=0
235,25.5538015,151.101.194.187,172.20.40.110,TCP,60,443  >  50060 [ACK] Seq=5745 Ack=166035 Win=3853 Len=0
236,25.5538015,151.101.194.187,172.20.40.110,TCP,60,443  >  50060 [ACK] Seq=5745 Ack=168927 Win=3853 Len=0
237,25.5538015,151.101.194.187,172.20.40.110,TCP,60,443  >  50060 [ACK] Seq=5745 Ack=171818 Win=3853 Len=0
238,25.5574802,151.101.194.187,172.20.40.110,TCP,60,443  >  50060 [ACK] Seq=5745 Ack=174706 Win=3853 Len=0
239,25.5574802,151.101.194.187,172.20.40.110,TLSv1.2,125,Application Data
240,25.5574802,151.101.194.187,172.20.40.110,TLSv1.2,194,"Application Data, Application Data"
241,25.5574802,151.101.194.187,172.20.40.110,TLSv1.2,125,Application Data
242,25.5574802,151.101.194.187,172.20.40.110,TLSv1.2,305,Application Data
243,25.5575948,172.20.40.110,151.101.194.187,TCP,54,50060  >  443 [ACK] Seq=174706 Ack=6278 Win=258 Len=0
244,32.7480584,172.20.40.110,151.101.194.187,TLSv1.2,2962,Application Data
245,32.7588926,151.101.194.187,172.20.40.110,TCP,60,443  >  50060 [ACK] Seq=6278 Ack=177614 Win=3853 Len=0
246,32.7633257,151.101.194.187,172.20.40.110,TLSv1.2,236,Application Data
247,32.7833484,172.20.40.110,151.101.194.187,TLSv1.2,2963,Application Data
248,32.7958421,151.101.194.187,172.20.40.110,TCP,60,443  >  50060 [ACK] Seq=6460 Ack=180523 Win=3853 Len=0
249,32.7969554,151.101.194.187,172.20.40.110,TLSv1.2,125,Application Data
250,32.8346404,151.101.194.187,172.20.40.110,TCP,125,"[TCP Retransmission] 443  >  50060 [PSH, ACK] Seq=6460 Ack=180523 Win=3853 Len=71"
251,32.8347081,172.20.40.110,151.101.194.187,TCP,66,50060  >  443 [ACK] Seq=180523 Ack=6531 Win=257 Len=0 SLE=6460 SRE=6531
252,39.3770429,172.20.40.110,151.101.194.187,TLSv1.2,2948,Application Data
253,39.3878766,151.101.194.187,172.20.40.110,TCP,60,443  >  50060 [ACK] Seq=6531 Ack=183417 Win=3853 Len=0
254,39.3920127,151.101.194.187,172.20.40.110,TLSv1.2,301,Application Data
255,39.430503,151.101.194.187,172.20.40.110,TCP,301,"[TCP Retransmission] 443  >  50060 [PSH, ACK] Seq=6531 Ack=183417 Win=3853 Len=247"
256,39.4305682,172.20.40.110,151.101.194.187,TCP,66,50060  >  443 [ACK] Seq=183417 Ack=6778 Win=256 Len=0 SLE=6531 SRE=6778
257,39.4787958,172.20.40.110,151.101.194.187,TLSv1.2,2951,Application Data
258,39.4878944,151.101.194.187,172.20.40.110,TCP,60,443  >  50060 [ACK] Seq=6778 Ack=186314 Win=3853 Len=0
259,39.4911018,151.101.194.187,172.20.40.110,TLSv1.2,130,Application Data
260,39.5168426,172.20.40.110,151.101.194.187,TLSv1.2,2953,Application Data
261,39.5277842,151.101.194.187,172.20.40.110,TCP,60,443  >  50060 [ACK] Seq=6854 Ack=189213 Win=3853 Len=0
262,39.5303763,151.101.194.187,172.20.40.110,TLSv1.2,130,Application Data
263,39.5737101,151.101.194.187,172.20.40.110,TCP,130,"[TCP Retransmission] 443  >  50060 [PSH, ACK] Seq=6854 Ack=189213 Win=3853 Len=76"
264,39.5737679,172.20.40.110,151.101.194.187,TCP,66,50060  >  443 [ACK] Seq=189213 Ack=6930 Win=256 Len=0 SLE=6854 SRE=6930
265,43.6703078,172.20.40.110,151.101.194.187,TLSv1.2,3004,Application Data
266,43.6789099,151.101.194.187,172.20.40.110,TCP,60,443  >  50060 [ACK] Seq=6930 Ack=192163 Win=3865 Len=0
267,44.3512743,151.101.194.187,172.20.40.110,TLSv1.2,360,Application Data
268,44.3512743,151.101.194.187,172.20.40.110,TCP,5574,"443  >  50060 [PSH, ACK] Seq=7236 Ack=192163 Win=3865 Len=5520 [TCP PDU reassembled in 270]"
269,44.3517169,172.20.40.110,151.101.194.187,TCP,54,50060  >  443 [ACK] Seq=192163 Ack=12756 Win=258 Len=0
270,44.3560063,151.101.194.187,172.20.40.110,TLSv1.2,1135,Application Data
271,44.3560063,151.101.194.187,172.20.40.110,TCP,1434,443  >  50060 [ACK] Seq=13837 Ack=192163 Win=3865 Len=1380 [TCP PDU reassembled in 272]
272,44.3560063,151.101.194.187,172.20.40.110,TLSv1.2,327,Application Data
273,44.3560063,151.101.194.187,172.20.40.110,TCP,1434,443  >  50060 [ACK] Seq=15490 Ack=192163 Win=3865 Len=1380 [TCP PDU reassembled in 281]
274,44.3560063,151.101.194.187,172.20.40.110,TCP,1434,443  >  50060 [ACK] Seq=16870 Ack=192163 Win=3865 Len=1380 [TCP PDU reassembled in 281]
275,44.3561237,172.20.40.110,151.101.194.187,TCP,54,50060  >  443 [ACK] Seq=192163 Ack=18250 Win=258 Len=0
276,44.358205,172.20.40.110,151.101.194.187,TLSv1.2,89,Application Data
277,44.3584774,151.101.194.187,172.20.40.110,TCP,5574,"443  >  50060 [PSH, ACK] Seq=18250 Ack=192163 Win=3865 Len=5520 [TCP PDU reassembled in 281]"
278,44.3585884,172.20.40.110,151.101.194.187,TCP,54,50060  >  443 [ACK] Seq=192198 Ack=23770 Win=258 Len=0
279,44.3608453,151.101.194.187,172.20.40.110,TCP,5574,"443  >  50060 [PSH, ACK] Seq=23770 Ack=192163 Win=3865 Len=5520 [TCP PDU reassembled in 281]"
280,44.360963,172.20.40.110,151.101.194.187,TCP,54,50060  >  443 [ACK] Seq=192198 Ack=29290 Win=258 Len=0
281,44.3631479,151.101.194.187,172.20.40.110,TLSv1.2,5574,"Application Data, Application Data"
282,44.3632689,172.20.40.110,151.101.194.187,TCP,54,50060  >  443 [ACK] Seq=192198 Ack=34810 Win=258 Len=0
283,44.3668474,151.101.194.187,172.20.40.110,TCP,5574,"443  >  50060 [PSH, ACK] Seq=34810 Ack=192163 Win=3865 Len=5520 [TCP PDU reassembled in 288]"
284,44.3669488,172.20.40.110,151.101.194.187,TCP,54,50060  >  443 [ACK] Seq=192198 Ack=40330 Win=258 Len=0
285,44.3705063,151.101.194.187,172.20.40.110,TCP,5574,"443  >  50060 [PSH, ACK] Seq=40330 Ack=192163 Win=3865 Len=5520 [TCP PDU reassembled in 288]"
286,44.3705904,172.20.40.110,151.101.194.187,TCP,54,50060  >  443 [ACK] Seq=192198 Ack=45850 Win=258 Len=0
287,44.3736229,151.101.194.187,172.20.40.110,TCP,1434,443  >  50060 [ACK] Seq=45850 Ack=192163 Win=3865 Len=1380 [TCP PDU reassembled in 288]
288,44.3736229,151.101.194.187,172.20.40.110,TLSv1.2,954,Application Data
289,44.3736229,151.101.194.187,172.20.40.110,TCP,4194,443  >  50060 [ACK] Seq=48130 Ack=192163 Win=3865 Len=4140 [TCP PDU reassembled in 291]
290,44.373725,172.20.40.110,151.101.194.187,TCP,54,50060  >  443 [ACK] Seq=192198 Ack=52270 Win=258 Len=0
291,44.376568,151.101.194.187,172.20.40.110,TLSv1.2,558,Application Data
292,44.376568,151.101.194.187,172.20.40.110,TCP,2814,443  >  50060 [ACK] Seq=52774 Ack=192163 Win=3865 Len=2760 [TCP PDU reassembled in 293]
293,44.376568,151.101.194.187,172.20.40.110,TLSv1.2,1174,Application Data
294,44.376568,151.101.194.187,172.20.40.110,TCP,1434,443  >  50060 [ACK] Seq=56654 Ack=192163 Win=3865 Len=1380 [TCP PDU reassembled in 297]
295,44.3766695,172.20.40.110,151.101.194.187,TCP,54,50060  >  443 [ACK] Seq=192198 Ack=58034 Win=258 Len=0
296,44.3793867,151.101.194.187,172.20.40.110,TCP,2814,443  >  50060 [ACK] Seq=58034 Ack=192163 Win=3865 Len=2760 [TCP PDU reassembled in 297]
297,44.3793867,151.101.194.187,172.20.40.110,TLSv1.2,266,Application Data
298,44.3793867,151.101.194.187,172.20.40.110,TCP,1434,443  >  50060 [ACK] Seq=61006 Ack=192163 Win=3865 Len=1380 [TCP PDU reassembled in 299]
299,44.3793867,151.101.194.187,172.20.40.110,TLSv1.2,830,Application Data
300,44.3793867,151.101.194.187,172.20.40.110,TLSv1.2,426,Application Data
301,44.3793867,151.101.194.187,172.20.40.110,TLSv1.2,85,Application Data
302,44.3793867,151.101.194.187,172.20.40.110,TCP,60,443  >  50060 [ACK] Seq=63565 Ack=192198 Win=3865 Len=0
303,44.379511,172.20.40.110,151.101.194.187,TCP,54,50060  >  443 [ACK] Seq=192198 Ack=63565 Win=258 Len=0
304,44.6625728,172.20.40.110,151.101.194.187,TLSv1.2,2942,Application Data
305,44.6702783,172.20.40.110,151.101.194.187,TLSv1.2,2957,Application Data
306,44.6744144,151.101.194.187,172.20.40.110,TCP,60,443  >  50060 [ACK] Seq=63565 Ack=195086 Win=3865 Len=0
307,44.6750696,172.20.40.110,151.101.194.187,TLSv1.2,2946,Application Data
308,44.6768768,151.101.194.187,172.20.40.110,TLSv1.2,214,Application Data
309,44.6803723,151.101.194.187,172.20.40.110,TCP,60,443  >  50060 [ACK] Seq=63725 Ack=197989 Win=3865 Len=0
310,44.6847136,151.101.194.187,172.20.40.110,TLSv1.2,231,Application Data
311,44.6847941,172.20.40.110,151.101.194.187,TCP,54,50060  >  443 [ACK] Seq=200881 Ack=63902 Win=257 Len=0
312,44.6861891,151.101.194.187,172.20.40.110,TCP,60,443  >  50060 [ACK] Seq=63902 Ack=200881 Win=3865 Len=0
313,44.6891983,151.101.194.187,172.20.40.110,TLSv1.2,125,Application Data
314,44.7070046,172.20.40.110,151.101.194.187,TLSv1.2,2948,Application Data
315,44.7072804,172.20.40.110,151.101.194.187,TLSv1.2,2942,Application Data
316,44.7079015,172.20.40.110,151.101.194.187,TLSv1.2,2950,Application Data
317,44.7121717,172.20.40.110,151.101.194.187,TLSv1.2,2948,Application Data
318,44.7124641,172.20.40.110,151.101.194.187,TLSv1.2,2956,Application Data
319,44.7139768,172.20.40.110,151.101.194.187,TLSv1.2,2945,Application Data
320,44.7149253,172.20.40.110,151.101.194.187,TLSv1.2,2942,Application Data
321,44.7352369,151.101.194.187,172.20.40.110,TCP,60,443  >  50060 [ACK] Seq=63973 Ack=203775 Win=3870 Len=0
322,44.7352369,151.101.194.187,172.20.40.110,TCP,60,443  >  50060 [ACK] Seq=63973 Ack=206663 Win=3870 Len=0
323,44.7352369,151.101.194.187,172.20.40.110,TCP,60,443  >  50060 [ACK] Seq=63973 Ack=209559 Win=3870 Len=0
324,44.7352369,151.101.194.187,172.20.40.110,TCP,60,443  >  50060 [ACK] Seq=63973 Ack=212453 Win=3870 Len=0
325,44.7352369,151.101.194.187,172.20.40.110,TCP,60,443  >  50060 [ACK] Seq=63973 Ack=215355 Win=3870 Len=0
326,44.7352369,151.101.194.187,172.20.40.110,TCP,60,443  >  50060 [ACK] Seq=63973 Ack=218246 Win=3870 Len=0
327,44.7395917,151.101.194.187,172.20.40.110,TCP,60,443  >  50060 [ACK] Seq=63973 Ack=221134 Win=3870 Len=0
328,44.7395917,151.101.194.187,172.20.40.110,TLSv1.2,152,Application Data
329,44.7434476,172.20.40.110,151.101.194.187,TLSv1.2,2946,Application Data
330,44.7476246,151.101.194.187,172.20.40.110,TLSv1.2,130,Application Data
331,44.7476246,151.101.194.187,172.20.40.110,TLSv1.2,131,Application Data
332,44.7476246,151.101.194.187,172.20.40.110,TLSv1.2,185,Application Data
333,44.7476246,151.101.194.187,172.20.40.110,TLSv1.2,124,Application Data
334,44.7476246,151.101.194.187,172.20.40.110,TLSv1.2,130,Application Data
335,44.7476246,151.101.194.187,172.20.40.110,TLSv1.2,131,Application Data
336,44.7477543,172.20.40.110,151.101.194.187,TCP,54,50060  >  443 [ACK] Seq=224026 Ack=64578 Win=254 Len=0
337,44.7525234,151.101.194.187,172.20.40.110,TCP,60,443  >  50060 [ACK] Seq=64578 Ack=224026 Win=3870 Len=0
338,44.7591185,151.101.194.187,172.20.40.110,TLSv1.2,124,Application Data
339,44.7996978,172.20.40.110,151.101.194.187,TCP,54,50060  >  443 [ACK] Seq=224026 Ack=64648 Win=254 Len=0
340,44.8057963,172.20.40.110,151.101.194.187,TLSv1.2,2940,Application Data
341,44.8164648,151.101.194.187,172.20.40.110,TCP,60,443  >  50060 [ACK] Seq=64648 Ack=226912 Win=3870 Len=0
342,44.8198816,151.101.194.187,172.20.40.110,TLSv1.2,126,Application Data
343,44.8608253,172.20.40.110,151.101.194.187,TCP,54,50060  >  443 [ACK] Seq=226912 Ack=64720 Win=254 Len=0
344,44.8757114,172.20.40.110,151.101.194.187,TLSv1.2,2940,Application Data
345,44.8808354,172.20.40.110,151.101.194.187,TLSv1.2,2938,Application Data
346,44.8902858,151.101.194.187,172.20.40.110,TCP,60,443  >  50060 [ACK] Seq=64720 Ack=229798 Win=3870 Len=0
347,44.8936927,151.101.194.187,172.20.40.110,TCP,60,443  >  50060 [ACK] Seq=64720 Ack=232682 Win=3876 Len=0
348,44.8972929,151.101.194.187,172.20.40.110,TLSv1.2,130,Application Data
349,44.9085107,151.101.194.187,172.20.40.110,TLSv1.2,130,Application Data
350,44.9087545,172.20.40.110,151.101.194.187,TCP,54,50060  >  443 [ACK] Seq=232682 Ack=64872 Win=253 Len=0
351,44.9186429,172.20.40.110,151.101.194.187,TLSv1.2,2940,Application Data
352,44.9280523,151.101.194.187,172.20.40.110,TCP,60,443  >  50060 [ACK] Seq=64872 Ack=235568 Win=3876 Len=0
353,44.9324212,151.101.194.187,172.20.40.110,TLSv1.2,124,Application Data
354,44.9809231,172.20.40.110,151.101.194.187,TCP,54,50060  >  443 [ACK] Seq=235568 Ack=64942 Win=253 Len=0
355,46.95031,172.20.40.110,151.101.194.187,TLSv1.2,2952,Application Data
356,46.9505635,172.20.40.110,151.101.194.187,TLSv1.2,2946,Application Data
357,46.9629094,151.101.194.187,172.20.40.110,TCP,60,443  >  50060 [ACK] Seq=64942 Ack=238466 Win=3876 Len=0
358,46.9629094,151.101.194.187,172.20.40.110,TCP,60,443  >  50060 [ACK] Seq=64942 Ack=241358 Win=3876 Len=0
359,46.9672256,151.101.194.187,172.20.40.110,TLSv1.2,214,Application Data
360,46.9683015,151.101.194.187,172.20.40.110,TLSv1.2,104,Application Data
361,46.9683758,172.20.40.110,151.101.194.187,TCP,54,50060  >  443 [ACK] Seq=241358 Ack=65152 Win=258 Len=0
362,47.2696048,172.20.40.110,151.101.194.187,TLSv1.2,2940,Application Data
363,47.2765608,172.20.40.110,151.101.194.187,TLSv1.2,2944,Application Data
364,47.2904554,151.101.194.187,172.20.40.110,TCP,60,443  >  50060 [ACK] Seq=65152 Ack=244244 Win=3876 Len=0
365,47.2904554,151.101.194.187,172.20.40.110,TLSv1.2,258,Application Data
366,47.2904554,151.101.194.187,172.20.40.110,TCP,60,443  >  50060 [ACK] Seq=65356 Ack=247134 Win=3876 Len=0
367,47.2917113,151.101.194.187,172.20.40.110,TLSv1.2,152,Application Data
368,47.2917902,172.20.40.110,151.101.194.187,TCP,54,50060  >  443 [ACK] Seq=247134 Ack=65454 Win=257 Len=0
369,48.4530487,172.20.40.110,151.101.194.187,TLSv1.2,2943,Application Data
370,48.4634023,151.101.194.187,172.20.40.110,TCP,60,443  >  50060 [ACK] Seq=65454 Ack=250023 Win=3876 Len=0
371,48.4693599,151.101.194.187,172.20.40.110,TLSv1.2,240,Application Data
372,48.535645,151.101.194.187,172.20.40.110,TCP,240,"[TCP Retransmission] 443  >  50060 [PSH, ACK] Seq=65454 Ack=250023 Win=3876 Len=186"
373,48.5357007,172.20.40.110,151.101.194.187,TCP,66,50060  >  443 [ACK] Seq=250023 Ack=65640 Win=256 Len=0 SLE=65454 SRE=65640
374,49.7384825,172.20.40.110,151.101.194.187,TLSv1.2,2942,Application Data
375,49.7510399,151.101.194.187,172.20.40.110,TCP,60,443  >  50060 [ACK] Seq=65640 Ack=252911 Win=3876 Len=0
376,49.7519284,151.101.194.187,172.20.40.110,TLSv1.2,275,Application Data
377,49.823899,151.101.194.187,172.20.40.110,TCP,275,"[TCP Retransmission] 443  >  50060 [PSH, ACK] Seq=65640 Ack=252911 Win=3876 Len=221"
378,49.8239522,172.20.40.110,151.101.194.187,TCP,66,50060  >  443 [ACK] Seq=252911 Ack=65861 Win=255 Len=0 SLE=65640 SRE=65861
379,50.7470858,172.20.40.110,151.101.194.187,TLSv1.2,2948,Application Data
380,50.7504218,172.20.40.110,151.101.194.187,TLSv1.2,2942,Application Data
381,50.7529214,172.20.40.110,151.101.194.187,TLSv1.2,2950,Application Data
382,50.7553791,172.20.40.110,151.101.194.187,TLSv1.2,2944,Application Data
383,50.757708,172.20.40.110,151.101.194.187,TLSv1.2,2944,Application Data
384,50.7579662,172.20.40.110,151.101.194.187,TLSv1.2,2944,Application Data
385,50.7672222,151.101.194.187,172.20.40.110,TCP,60,443  >  50060 [ACK] Seq=65861 Ack=255805 Win=3876 Len=0
386,50.7713885,151.101.194.187,172.20.40.110,TCP,60,443  >  50060 [ACK] Seq=65861 Ack=258565 Win=3887 Len=0
387,50.7765387,172.20.40.110,151.101.194.187,TLSv1.2,2944,Application Data
388,50.7798721,151.101.194.187,172.20.40.110,TLSv1.2,214,Application Data
389,50.7838623,151.101.194.187,172.20.40.110,TCP,60,443  >  50060 [ACK] Seq=66021 Ack=258693 Win=3887 Len=0
390,50.7838623,151.101.194.187,172.20.40.110,TCP,60,443  >  50060 [ACK] Seq=66021 Ack=261589 Win=3887 Len=0
391,50.7838623,151.101.194.187,172.20.40.110,TCP,60,443  >  50060 [ACK] Seq=66021 Ack=264479 Win=3887 Len=0
392,50.7838623,151.101.194.187,172.20.40.110,TCP,60,443  >  50060 [ACK] Seq=66021 Ack=267369 Win=3887 Len=0
393,50.7849156,151.101.194.187,172.20.40.110,TCP,60,443  >  50060 [ACK] Seq=66021 Ack=270129 Win=3898 Len=0
394,50.7863067,151.101.194.187,172.20.40.110,TCP,60,443  >  50060 [ACK] Seq=66021 Ack=270259 Win=3898 Len=0
395,50.7863067,151.101.194.187,172.20.40.110,TCP,60,443  >  50060 [ACK] Seq=66021 Ack=273149 Win=3898 Len=0
396,50.7874876,151.101.194.187,172.20.40.110,TLSv1.2,104,Application Data
397,50.7874876,151.101.194.187,172.20.40.110,TLSv1.2,131,Application Data
398,50.7875739,172.20.40.110,151.101.194.187,TCP,54,50060  >  443 [ACK] Seq=273149 Ack=66148 Win=254 Len=0
399,50.7885898,151.101.194.187,172.20.40.110,TLSv1.2,126,Application Data
400,50.7885898,151.101.194.187,172.20.40.110,TLSv1.2,98,Application Data
401,50.7886645,172.20.40.110,151.101.194.187,TCP,54,50060  >  443 [ACK] Seq=273149 Ack=66264 Win=254 Len=0
402,50.7910796,151.101.194.187,172.20.40.110,TLSv1.2,104,Application Data
403,50.7910796,151.101.194.187,172.20.40.110,TLSv1.2,130,Application Data
404,50.791179,172.20.40.110,151.101.194.187,TCP,54,50060  >  443 [ACK] Seq=273149 Ack=66390 Win=253 Len=0
405,52.689517,172.20.40.110,151.101.194.187,TLSv1.2,2948,Application Data
406,52.7016746,151.101.194.187,172.20.40.110,TCP,60,443  >  50060 [ACK] Seq=66390 Ack=276043 Win=3898 Len=0
407,52.7029879,151.101.194.187,172.20.40.110,TLSv1.2,240,Application Data
408,52.7580835,151.101.194.187,172.20.40.110,TCP,240,"[TCP Retransmission] 443  >  50060 [PSH, ACK] Seq=66390 Ack=276043 Win=3898 Len=186"
409,52.7581434,172.20.40.110,151.101.194.187,TCP,66,50060  >  443 [ACK] Seq=276043 Ack=66576 Win=258 Len=0 SLE=66390 SRE=66576
410,52.8848962,172.20.40.110,151.101.194.187,TLSv1.2,2939,Application Data
411,52.8878634,172.20.40.110,151.101.194.187,TLSv1.2,2942,Application Data
412,52.8881312,172.20.40.110,151.101.194.187,TLSv1.2,2942,Application Data
413,52.8883313,172.20.40.110,151.101.194.187,TLSv1.2,2949,Application Data
414,52.8888068,172.20.40.110,151.101.194.187,TLSv1.2,2948,Application Data
415,52.8890128,172.20.40.110,151.101.194.187,TLSv1.2,2945,Application Data
416,52.9022293,151.101.194.187,172.20.40.110,TCP,60,443  >  50060 [ACK] Seq=66576 Ack=278928 Win=3898 Len=0
417,52.9022293,151.101.194.187,172.20.40.110,TLSv1.2,257,Application Data
418,52.9098776,151.101.194.187,172.20.40.110,TCP,60,443  >  50060 [ACK] Seq=66779 Ack=281816 Win=3898 Len=0
419,52.9098776,151.101.194.187,172.20.40.110,TCP,60,443  >  50060 [ACK] Seq=66779 Ack=284704 Win=3898 Len=0
420,52.9119501,151.101.194.187,172.20.40.110,TLSv1.2,124,Application Data
421,52.9119501,151.101.194.187,172.20.40.110,TLSv1.2,153,Application Data
422,52.912014,172.20.40.110,151.101.194.187,TCP,54,50060  >  443 [ACK] Seq=293384 Ack=66948 Win=257 Len=0
423,52.9129811,151.101.194.187,172.20.40.110,TCP,60,443  >  50060 [ACK] Seq=66948 Ack=287599 Win=3903 Len=0
424,52.9129811,151.101.194.187,172.20.40.110,TCP,60,443  >  50060 [ACK] Seq=66948 Ack=290493 Win=3903 Len=0
425,52.9129811,151.101.194.187,172.20.40.110,TCP,60,443  >  50060 [ACK] Seq=66948 Ack=293384 Win=3903 Len=0
426,52.9164678,151.101.194.187,172.20.40.110,TLSv1.2,196,"Application Data, Application Data"
427,52.9165773,172.20.40.110,151.101.194.187,TCP,54,50060  >  443 [ACK] Seq=293384 Ack=67090 Win=256 Len=0
428,52.9196341,151.101.194.187,172.20.40.110,TLSv1.2,130,Application Data
429,52.9197315,172.20.40.110,151.101.194.187,TCP,54,50060  >  443 [ACK] Seq=293384 Ack=67166 Win=256 Len=0
430,52.9673047,172.20.40.110,151.101.194.187,TLSv1.2,2942,Application Data
431,52.9677881,172.20.40.110,151.101.194.187,TLSv1.2,2948,Application Data
432,52.9682827,172.20.40.110,151.101.194.187,TLSv1.2,2941,Application Data
433,52.9768879,151.101.194.187,172.20.40.110,TCP,60,443  >  50060 [ACK] Seq=67166 Ack=296272 Win=3903 Len=0
434,52.9798438,151.101.194.187,172.20.40.110,TLSv1.2,185,Application Data
435,52.9840944,151.101.194.187,172.20.40.110,TCP,60,443  >  50060 [ACK] Seq=67297 Ack=299166 Win=3903 Len=0
436,52.9840944,151.101.194.187,172.20.40.110,TCP,60,443  >  50060 [ACK] Seq=67297 Ack=302053 Win=3903 Len=0
437,52.9862177,151.101.194.187,172.20.40.110,TLSv1.2,125,Application Data
438,52.9862933,172.20.40.110,151.101.194.187,TCP,54,50060  >  443 [ACK] Seq=302053 Ack=67368 Win=255 Len=0
439,52.9884033,151.101.194.187,172.20.40.110,TLSv1.2,125,Application Data
440,53.0362699,151.101.194.187,172.20.40.110,TCP,125,"[TCP Retransmission] 443  >  50060 [PSH, ACK] Seq=67368 Ack=302053 Win=3903 Len=71"
441,53.0363311,172.20.40.110,151.101.194.187,TCP,66,50060  >  443 [ACK] Seq=302053 Ack=67439 Win=255 Len=0 SLE=67368 SRE=67439
442,53.6520672,172.20.40.110,151.101.194.187,TLSv1.2,2957,Application Data
443,53.6653834,151.101.194.187,172.20.40.110,TCP,60,443  >  50060 [ACK] Seq=67439 Ack=304956 Win=3903 Len=0
444,53.6676171,151.101.194.187,172.20.40.110,TLSv1.2,241,Application Data
445,53.7090162,172.20.40.110,151.101.194.187,TLSv1.2,2948,Application Data
446,53.709454,172.20.40.110,151.101.194.187,TLSv1.2,2942,Application Data
447,53.7116885,151.101.194.187,172.20.40.110,TCP,241,"[TCP Spurious Retransmission] 443  >  50060 [PSH, ACK] Seq=67439 Ack=304956 Win=3903 Len=187"
448,53.7117419,172.20.40.110,151.101.194.187,TCP,66,[TCP Dup ACK 445#1] 50060  >  443 [ACK] Seq=310738 Ack=67626 Win=254 Len=0 SLE=67439 SRE=67626
449,53.7183741,151.101.194.187,172.20.40.110,TCP,60,443  >  50060 [ACK] Seq=67626 Ack=307850 Win=3903 Len=0
450,53.7201637,172.20.40.110,151.101.194.187,TLSv1.2,2942,Application Data
451,53.7210535,172.20.40.110,151.101.194.187,TLSv1.2,2955,Application Data
452,53.7274832,151.101.194.187,172.20.40.110,TCP,60,443  >  50060 [ACK] Seq=67626 Ack=310738 Win=3903 Len=0
453,53.7274832,151.101.194.187,172.20.40.110,TLSv1.2,124,Application Data
454,53.7274832,151.101.194.187,172.20.40.110,TLSv1.2,130,Application Data
455,53.7275785,172.20.40.110,151.101.194.187,TCP,54,50060  >  443 [ACK] Seq=316527 Ack=67772 Win=254 Len=0
456,53.7327668,151.101.194.187,172.20.40.110,TCP,60,443  >  50060 [ACK] Seq=67772 Ack=313626 Win=3903 Len=0
457,53.7327668,151.101.194.187,172.20.40.110,TCP,60,443  >  50060 [ACK] Seq=67772 Ack=316527 Win=3903 Len=0
458,53.7371911,151.101.194.187,172.20.40.110,TLSv1.2,131,Application Data
459,53.7382258,151.101.194.187,172.20.40.110,TLSv1.2,124,Application Data
460,53.7383182,172.20.40.110,151.101.194.187,TCP,54,50060  >  443 [ACK] Seq=316527 Ack=67919 Win=253 Len=0
461,53.8632445,172.20.40.110,151.101.194.187,TLSv1.2,2939,Application Data
462,53.8745112,151.101.194.187,172.20.40.110,TCP,60,443  >  50060 [ACK] Seq=67919 Ack=319412 Win=3903 Len=0
463,53.8766284,151.101.194.187,172.20.40.110,TLSv1.2,125,Application Data
464,53.8821845,172.20.40.110,151.101.194.187,TLSv1.2,2956,Application Data
465,53.8918949,151.101.194.187,172.20.40.110,TCP,60,443  >  50060 [ACK] Seq=67990 Ack=322314 Win=3903 Len=0
466,53.8992905,151.101.194.187,172.20.40.110,TLSv1.2,130,Application Data
467,53.935905,151.101.194.187,172.20.40.110,TCP,130,"[TCP Retransmission] 443  >  50060 [PSH, ACK] Seq=67990 Ack=322314 Win=3903 Len=76"
468,53.9359802,172.20.40.110,151.101.194.187,TCP,66,50060  >  443 [ACK] Seq=322314 Ack=68066 Win=258 Len=0 SLE=67990 SRE=68066
469,53.9987082,172.20.40.110,151.101.194.187,TLSv1.2,2956,Application Data
470,54.0072838,151.101.194.187,172.20.40.110,TCP,60,443  >  50060 [ACK] Seq=68066 Ack=325216 Win=3903 Len=0
471,54.0125302,151.101.194.187,172.20.40.110,TLSv1.2,169,Application Data
472,54.0509695,151.101.194.187,172.20.40.110,TCP,169,"[TCP Retransmission] 443  >  50060 [PSH, ACK] Seq=68066 Ack=325216 Win=3903 Len=115"
473,54.05107,172.20.40.110,151.101.194.187,TCP,66,50060  >  443 [ACK] Seq=325216 Ack=68181 Win=258 Len=0 SLE=68066 SRE=68181
474,54.1875455,172.20.40.110,151.101.194.187,TLSv1.2,2943,Application Data
475,54.1996884,151.101.194.187,172.20.40.110,TCP,60,443  >  50060 [ACK] Seq=68181 Ack=328105 Win=3903 Len=0
476,54.2057891,151.101.194.187,172.20.40.110,TLSv1.2,213,Application Data
477,54.2384632,151.101.194.187,172.20.40.110,TCP,213,"[TCP Retransmission] 443  >  50060 [PSH, ACK] Seq=68181 Ack=328105 Win=3903 Len=159"
478,54.2385825,172.20.40.110,151.101.194.187,TCP,66,50060  >  443 [ACK] Seq=328105 Ack=68340 Win=257 Len=0 SLE=68181 SRE=68340
479,54.3535688,172.20.40.110,151.101.194.187,TLSv1.2,2946,Application Data
480,54.3586361,172.20.40.110,151.101.194.187,TLSv1.2,2945,Application Data
481,54.3650853,151.101.194.187,172.20.40.110,TCP,60,443  >  50060 [ACK] Seq=68340 Ack=330997 Win=3903 Len=0
482,54.3689179,151.101.194.187,172.20.40.110,TCP,60,443  >  50060 [ACK] Seq=68340 Ack=333888 Win=3903 Len=0
483,54.370385,151.101.194.187,172.20.40.110,TLSv1.2,125,Application Data
484,54.374586,151.101.194.187,172.20.40.110,TLSv1.2,147,Application Data
485,54.3746609,172.20.40.110,151.101.194.187,TCP,54,50060  >  443 [ACK] Seq=333888 Ack=68504 Win=256 Len=0
486,54.3934758,172.20.40.110,151.101.194.187,TLSv1.2,2944,Application Data
487,54.3977206,172.20.40.110,151.101.194.187,TLSv1.2,2941,Application Data
488,54.4035456,151.101.194.187,172.20.40.110,TCP,60,443  >  50060 [ACK] Seq=68504 Ack=336778 Win=3903 Len=0
489,54.4068189,151.101.194.187,172.20.40.110,TCP,60,443  >  50060 [ACK] Seq=68504 Ack=339665 Win=3903 Len=0
490,54.4068189,151.101.194.187,172.20.40.110,TLSv1.2,124,Application Data
491,54.4156135,151.101.194.187,172.20.40.110,TLSv1.2,124,Application Data
492,54.415685,172.20.40.110,151.101.194.187,TCP,54,50060  >  443 [ACK] Seq=339665 Ack=68644 Win=256 Len=0
493,54.87576,172.20.40.110,151.101.194.187,TLSv1.2,2946,Application Data
494,54.8892734,151.101.194.187,172.20.40.110,TCP,60,443  >  50060 [ACK] Seq=68644 Ack=342557 Win=3903 Len=0
495,54.8892734,151.101.194.187,172.20.40.110,TLSv1.2,301,Application Data
496,54.9311564,151.101.194.187,172.20.40.110,TCP,301,"[TCP Retransmission] 443  >  50060 [PSH, ACK] Seq=68644 Ack=342557 Win=3903 Len=247"
497,54.9312115,172.20.40.110,151.101.194.187,TCP,66,50060  >  443 [ACK] Seq=342557 Ack=68891 Win=255 Len=0 SLE=68644 SRE=68891
498,55.0481218,172.20.40.110,151.101.194.187,TLSv1.2,2949,Application Data
499,55.0489877,172.20.40.110,151.101.194.187,TLSv1.2,2946,Application Data
500,55.0492262,172.20.40.110,151.101.194.187,TLSv1.2,2943,Application Data
501,55.068436,151.101.194.187,172.20.40.110,TCP,60,443  >  50060 [ACK] Seq=68891 Ack=345452 Win=3903 Len=0
502,55.0698533,151.101.194.187,172.20.40.110,TCP,60,443  >  50060 [ACK] Seq=68891 Ack=348344 Win=3903 Len=0
503,55.0698533,151.101.194.187,172.20.40.110,TCP,60,443  >  50060 [ACK] Seq=68891 Ack=351233 Win=3903 Len=0
504,55.0698533,151.101.194.187,172.20.40.110,TLSv1.2,206,"Application Data, Application Data"
505,55.0699377,172.20.40.110,151.101.194.187,TCP,54,50060  >  443 [ACK] Seq=351233 Ack=69043 Win=254 Len=0
506,55.0755339,151.101.194.187,172.20.40.110,TLSv1.2,124,Application Data
507,55.0880432,172.20.40.110,151.101.194.187,TLSv1.2,2942,Application Data
508,55.0976887,151.101.194.187,172.20.40.110,TCP,60,443  >  50060 [ACK] Seq=69113 Ack=354121 Win=3903 Len=0
509,55.099986,151.101.194.187,172.20.40.110,TLSv1.2,104,Application Data
510,55.1381289,151.101.194.187,172.20.40.110,TCP,104,"[TCP Retransmission] 443  >  50060 [PSH, ACK] Seq=69113 Ack=354121 Win=3903 Len=50"
511,55.1381878,172.20.40.110,151.101.194.187,TCP,66,50060  >  443 [ACK] Seq=354121 Ack=69163 Win=254 Len=0 SLE=69113 SRE=69163
512,55.341176,172.20.40.110,151.101.194.187,TLSv1.2,2947,Application Data
513,55.3502607,151.101.194.187,172.20.40.110,TCP,60,443  >  50060 [ACK] Seq=69163 Ack=357014 Win=3903 Len=0
514,55.3548969,151.101.194.187,172.20.40.110,TLSv1.2,130,Application Data
515,55.3916587,151.101.194.187,172.20.40.110,TCP,130,"[TCP Retransmission] 443  >  50060 [PSH, ACK] Seq=69163 Ack=357014 Win=3903 Len=76"
516,55.3917272,172.20.40.110,151.101.194.187,TCP,66,50060  >  443 [ACK] Seq=357014 Ack=69239 Win=253 Len=0 SLE=69163 SRE=69239
517,56.215732,172.20.40.110,151.101.194.187,TLSv1.2,2950,Application Data
518,56.2271598,151.101.194.187,172.20.40.110,TCP,60,443  >  50060 [ACK] Seq=69239 Ack=359910 Win=3903 Len=0
519,56.2300592,151.101.194.187,172.20.40.110,TLSv1.2,208,Application Data
520,56.2676758,151.101.194.187,172.20.40.110,TCP,208,"[TCP Retransmission] 443  >  50060 [PSH, ACK] Seq=69239 Ack=359910 Win=3903 Len=154"
521,56.2677403,172.20.40.110,151.101.194.187,TCP,66,50060  >  443 [ACK] Seq=359910 Ack=69393 Win=258 Len=0 SLE=69239 SRE=69393
522,59.8754511,172.20.40.110,151.101.194.187,TLSv1.2,2703,Application Data
523,59.8875272,151.101.194.187,172.20.40.110,TCP,60,443  >  50060 [ACK] Seq=69393 Ack=362559 Win=3914 Len=0
524,59.9480848,151.101.194.187,172.20.40.110,TLSv1.2,339,Application Data
525,59.9480848,151.101.194.187,172.20.40.110,TLSv1.2,357,Application Data
526,59.9481722,172.20.40.110,151.101.194.187,TCP,54,50060  >  443 [ACK] Seq=362559 Ack=69981 Win=256 Len=0
527,59.9496447,172.20.40.110,151.101.194.187,TLSv1.2,89,Application Data
528,59.958655,151.101.194.187,172.20.40.110,TCP,60,443  >  50060 [ACK] Seq=69981 Ack=362594 Win=3914 Len=0
