"No.","Time","Source","Destination","Protocol","Length","Info"
"1","0.000000000","100.84.170.161","151.101.2.187","TLSv1.2","808","Application Data"
"2","0.000194500","100.84.170.161","151.101.2.187","TLSv1.2","93","Application Data"
"3","0.009338800","151.101.2.187","100.84.170.161","TCP","56","443  >  64433 [ACK] Seq=1 Ack=794 Win=1670 Len=0"
"4","0.009581400","151.101.2.187","100.84.170.161","TLSv1.2","93","Application Data"
"5","0.012448800","100.84.170.161","151.101.2.187","TLSv1.2","1865","Application Data"
"6","0.012811700","100.84.170.161","151.101.2.187","TLSv1.2","792","Application Data"
"7","0.013803600","151.101.2.187","100.84.170.161","TLSv1.2","214","Application Data"
"8","0.021833400","151.101.2.187","100.84.170.161","TCP","56","443  >  64433 [ACK] Seq=200 Ack=2605 Win=1676 Len=0"
"9","0.022048600","151.101.2.187","100.84.170.161","TCP","56","443  >  64433 [ACK] Seq=200 Ack=3343 Win=1682 Len=0"
"10","0.025804000","151.101.2.187","100.84.170.161","TLSv1.2","104","Application Data"
"11","0.025804000","151.101.2.187","100.84.170.161","TLSv1.2","124","Application Data"
"12","0.025881900","100.84.170.161","151.101.2.187","TCP","54","64433  >  443 [ACK] Seq=3343 Ack=320 Win=509 Len=0"
"13","0.129614800","100.84.170.161","151.101.2.187","TLSv1.2","1865","Application Data"
"14","0.140102900","151.101.2.187","100.84.170.161","TCP","56","443  >  64433 [ACK] Seq=320 Ack=5154 Win=1688 Len=0"
"15","0.142640300","151.101.2.187","100.84.170.161","TLSv1.2","174","Application Data"
"16","0.176829000","151.101.2.187","100.84.170.161","TCP","174","[TCP Retransmission] 443  >  64433 [PSH, ACK] Seq=320 Ack=5154 Win=1688 Len=120"
"17","0.176883400","100.84.170.161","151.101.2.187","TCP","66","64433  >  443 [ACK] Seq=5154 Ack=440 Win=509 Len=0 SLE=320 SRE=440"
"18","0.264123900","100.84.170.161","151.101.2.187","TLSv1.2","783","Application Data"
"19","0.273958200","151.101.2.187","100.84.170.161","TCP","56","443  >  64433 [ACK] Seq=440 Ack=5883 Win=1693 Len=0"
"20","0.276180300","151.101.2.187","100.84.170.161","TLSv1.2","125","Application Data"
"21","0.287089300","100.84.170.161","151.101.2.187","TLSv1.2","1879","Application Data"
"22","0.297100900","151.101.2.187","100.84.170.161","TCP","56","443  >  64433 [ACK] Seq=511 Ack=7708 Win=1705 Len=0"
"23","0.299269600","151.101.2.187","100.84.170.161","TLSv1.2","291","Application Data"
"24","0.333037800","100.84.170.161","151.101.2.187","TLSv1.2","800","Application Data"
"25","0.334863200","151.101.2.187","100.84.170.161","TCP","291","[TCP Spurious Retransmission] 443  >  64433 [PSH, ACK] Seq=511 Ack=7708 Win=1705 Len=237"
"26","0.334903000","100.84.170.161","151.101.2.187","TCP","66","[TCP Dup ACK 24#1] 64433  >  443 [ACK] Seq=8454 Ack=748 Win=507 Len=0 SLE=511 SRE=748"
"27","0.343052900","151.101.2.187","100.84.170.161","TCP","56","443  >  64433 [ACK] Seq=748 Ack=8454 Win=1710 Len=0"
"28","0.346053400","151.101.2.187","100.84.170.161","TLSv1.2","125","Application Data"
"29","0.382879400","151.101.2.187","100.84.170.161","TCP","125","[TCP Retransmission] 443  >  64433 [PSH, ACK] Seq=748 Ack=8454 Win=1710 Len=71"
"30","0.382933700","100.84.170.161","151.101.2.187","TCP","66","64433  >  443 [ACK] Seq=8454 Ack=819 Win=507 Len=0 SLE=748 SRE=819"
"31","0.631497300","100.84.170.161","151.101.2.187","TLSv1.2","1874","Application Data"
"32","0.642315200","151.101.2.187","100.84.170.161","TCP","56","443  >  64433 [ACK] Seq=819 Ack=10274 Win=1716 Len=0"
"33","0.644876400","151.101.2.187","100.84.170.161","TLSv1.2","246","Application Data"
"34","0.680871000","151.101.2.187","100.84.170.161","TCP","246","[TCP Retransmission] 443  >  64433 [PSH, ACK] Seq=819 Ack=10274 Win=1716 Len=192"
"35","0.680907800","100.84.170.161","151.101.2.187","TCP","66","64433  >  443 [ACK] Seq=10274 Ack=1011 Win=513 Len=0 SLE=819 SRE=1011"
"36","0.748838600","100.84.170.161","151.101.2.187","TLSv1.2","828","Application Data"
"37","0.749230400","100.84.170.161","151.101.2.187","TLSv1.2","1864","Application Data"
"38","0.749494800","100.84.170.161","151.101.2.187","TLSv1.2","824","Application Data"
"39","0.749879400","100.84.170.161","151.101.2.187","TLSv1.2","1856","Application Data"
"40","0.750120300","100.84.170.161","151.101.2.187","TLSv1.2","812","Application Data"
"41","0.750399600","100.84.170.161","151.101.2.187","TLSv1.2","1889","Application Data"
"42","0.751313600","100.84.170.161","151.101.2.187","TLSv1.2","808","Application Data"
"43","0.751778200","100.84.170.161","151.101.2.187","TLSv1.2","1870","Application Data"
"44","0.758618000","151.101.2.187","100.84.170.161","TCP","56","443  >  64433 [ACK] Seq=1011 Ack=11048 Win=1722 Len=0"
"45","0.759234600","151.101.2.187","100.84.170.161","TCP","56","443  >  64433 [ACK] Seq=1011 Ack=15430 Win=1739 Len=0"
"46","0.760392100","151.101.2.187","100.84.170.161","TCP","56","443  >  64433 [ACK] Seq=1011 Ack=18023 Win=1756 Len=0"
"47","0.760757400","151.101.2.187","100.84.170.161","TCP","56","443  >  64433 [ACK] Seq=1011 Ack=18777 Win=1762 Len=0"
"48","0.761218100","151.101.2.187","100.84.170.161","TCP","56","443  >  64433 [ACK] Seq=1011 Ack=20593 Win=1767 Len=0"
"49","0.762039000","151.101.2.187","100.84.170.161","TLSv1.2","130","Application Data"
"50","0.762348500","151.101.2.187","100.84.170.161","TLSv1.2","131","Application Data"
"51","0.762408800","100.84.170.161","151.101.2.187","TCP","54","64433  >  443 [ACK] Seq=20593 Ack=1164 Win=512 Len=0"
"52","0.762670600","151.101.2.187","100.84.170.161","TLSv1.2","130","Application Data"
"53","0.763369500","151.101.2.187","100.84.170.161","TLSv1.2","130","Application Data"
"54","0.763410000","100.84.170.161","151.101.2.187","TCP","54","64433  >  443 [ACK] Seq=20593 Ack=1316 Win=512 Len=0"
"55","0.763867400","151.101.2.187","100.84.170.161","TLSv1.2","125","Application Data"
"56","0.764146800","151.101.2.187","100.84.170.161","TLSv1.2","130","Application Data"
"57","0.764167000","100.84.170.161","151.101.2.187","TCP","54","64433  >  443 [ACK] Seq=20593 Ack=1463 Win=511 Len=0"
"58","0.764831600","151.101.2.187","100.84.170.161","TLSv1.2","131","Application Data"
"59","0.764831600","151.101.2.187","100.84.170.161","TLSv1.2","124","Application Data"
"60","0.764856600","100.84.170.161","151.101.2.187","TCP","54","64433  >  443 [ACK] Seq=20593 Ack=1610 Win=510 Len=0"
"61","6.429920300","100.84.170.161","151.101.66.187","TLSv1.2","175","Application Data"
"62","6.430028300","100.84.170.161","151.101.66.187","TLSv1.2","93","Application Data"
"63","6.440287800","151.101.66.187","100.84.170.161","TCP","56","443  >  50935 [ACK] Seq=1 Ack=161 Win=281 Len=0"
"64","6.440661700","151.101.66.187","100.84.170.161","TLSv1.2","93","Application Data"
"65","6.442438700","151.101.66.187","100.84.170.161","TLSv1.2","253","Application Data"
"66","6.442501100","100.84.170.161","151.101.66.187","TCP","54","50935  >  443 [ACK] Seq=161 Ack=239 Win=512 Len=0"
"67","6.445801200","100.84.170.161","151.101.2.187","TLSv1.2","922","Application Data"
"68","6.455845100","151.101.2.187","100.84.170.161","TCP","56","443  >  64433 [ACK] Seq=1610 Ack=21461 Win=1773 Len=0"
"69","6.513192000","151.101.2.187","100.84.170.161","TLSv1.2","534","Application Data"
"70","6.513698500","151.101.2.187","100.84.170.161","TCP","1510","443  >  64433 [ACK] Seq=2090 Ack=21461 Win=1773 Len=1456 [TCP PDU reassembled in 73]"
"71","6.513745200","100.84.170.161","151.101.2.187","TCP","54","64433  >  443 [ACK] Seq=21461 Ack=3546 Win=513 Len=0"
"72","6.513899300","151.101.2.187","100.84.170.161","TCP","1510","443  >  64433 [ACK] Seq=3546 Ack=21461 Win=1773 Len=1456 [TCP PDU reassembled in 73]"
"73","6.514585600","151.101.2.187","100.84.170.161","TLSv1.2","619","Application Data"
"74","6.514644200","100.84.170.161","151.101.2.187","TCP","54","64433  >  443 [ACK] Seq=21461 Ack=5567 Win=513 Len=0"
"75","6.518728900","100.84.170.161","151.101.2.187","TLSv1.2","89","Application Data"
"76","6.527903800","151.101.2.187","100.84.170.161","TCP","56","443  >  64433 [ACK] Seq=5567 Ack=21496 Win=1773 Len=0"
"77","6.571859400","100.84.170.161","151.101.2.187","TLSv1.2","1953","Application Data"
"78","6.581190800","151.101.2.187","100.84.170.161","TCP","56","443  >  64433 [ACK] Seq=5567 Ack=23395 Win=1784 Len=0"
"79","6.584264600","151.101.2.187","100.84.170.161","TLSv1.2","421","Application Data"
"80","6.612801700","151.101.2.187","100.84.170.161","TCP","421","[TCP Retransmission] 443  >  64433 [PSH, ACK] Seq=5567 Ack=23395 Win=1784 Len=367"
"81","6.612846200","100.84.170.161","151.101.2.187","TCP","66","64433  >  443 [ACK] Seq=23395 Ack=5934 Win=511 Len=0 SLE=5567 SRE=5934"
"82","6.646568000","100.84.170.161","151.101.2.187","TLSv1.2","683","Application Data"
"83","6.649235100","100.84.170.161","151.101.2.187","TLSv1.2","1990","Application Data"
"84","6.655551200","151.101.2.187","100.84.170.161","TCP","56","443  >  64433 [ACK] Seq=5934 Ack=24024 Win=1790 Len=0"
"85","6.658333000","151.101.2.187","100.84.170.161","TLSv1.2","131","Application Data"
"86","6.658593000","151.101.2.187","100.84.170.161","TCP","56","443  >  64433 [ACK] Seq=6011 Ack=25960 Win=1802 Len=0"
"87","6.660833800","151.101.2.187","100.84.170.161","TLSv1.2","125","Application Data"
"88","6.660936900","100.84.170.161","151.101.2.187","TCP","54","64433  >  443 [ACK] Seq=25960 Ack=6082 Win=511 Len=0"
"89","6.936935500","100.84.170.161","151.101.2.187","TLSv1.2","683","Application Data"
"90","6.943877900","100.84.170.161","151.101.2.187","TLSv1.2","1987","Application Data"
"91","6.947073400","151.101.2.187","100.84.170.161","TCP","56","443  >  64433 [ACK] Seq=6082 Ack=26589 Win=1807 Len=0"
"92","6.951102600","151.101.2.187","100.84.170.161","TLSv1.2","104","Application Data"
"93","6.953691500","151.101.2.187","100.84.170.161","TCP","56","443  >  64433 [ACK] Seq=6132 Ack=28522 Win=1819 Len=0"
"94","6.956426700","151.101.2.187","100.84.170.161","TLSv1.2","125","Application Data"
"95","6.956492600","100.84.170.161","151.101.2.187","TCP","54","64433  >  443 [ACK] Seq=28522 Ack=6203 Win=510 Len=0"
"96","7.203053700","100.84.170.161","151.101.2.187","TLSv1.2","707","Application Data"
"97","7.219924300","151.101.2.187","100.84.170.161","TCP","56","443  >  64433 [ACK] Seq=6203 Ack=29175 Win=1824 Len=0"
"98","7.222423500","151.101.2.187","100.84.170.161","TLSv1.2","98","Application Data"
"99","7.252587900","151.101.2.187","100.84.170.161","TCP","98","[TCP Retransmission] 443  >  64433 [PSH, ACK] Seq=6203 Ack=29175 Win=1824 Len=44"
"100","7.252627400","100.84.170.161","151.101.2.187","TCP","66","64433  >  443 [ACK] Seq=29175 Ack=6247 Win=510 Len=0 SLE=6203 SRE=6247"
"101","7.385318300","100.84.170.161","151.101.2.187","TLSv1.2","1988","Application Data"
"102","7.395607000","151.101.2.187","100.84.170.161","TCP","56","443  >  64433 [ACK] Seq=6247 Ack=31109 Win=1836 Len=0"
"103","7.398046500","151.101.2.187","100.84.170.161","TLSv1.2","234","Application Data"
"104","7.427610600","151.101.2.187","100.84.170.161","TCP","234","[TCP Retransmission] 443  >  64433 [PSH, ACK] Seq=6247 Ack=31109 Win=1836 Len=180"
"105","7.427646200","100.84.170.161","151.101.2.187","TCP","66","64433  >  443 [ACK] Seq=31109 Ack=6427 Win=509 Len=0 SLE=6247 SRE=6427"
"106","7.835009400","100.84.170.161","151.101.2.187","TLSv1.2","643","Application Data"
"107","7.836103500","100.84.170.161","151.101.2.187","TLSv1.2","1930","Application Data"
"108","7.836248700","100.84.170.161","151.101.2.187","TLSv1.2","649","Application Data"
"109","7.836395400","100.84.170.161","151.101.2.187","TLSv1.2","1924","Application Data"
"110","7.837686600","100.84.170.161","151.101.2.187","TLSv1.2","644","Application Data"
"111","7.837874800","100.84.170.161","151.101.2.187","TLSv1.2","1929","Application Data"
"112","7.837971100","100.84.170.161","151.101.2.187","TLSv1.2","655","Application Data"
"113","7.838378400","100.84.170.161","151.101.2.187","TLSv1.2","1981","Application Data"
"114","7.838477000","100.84.170.161","151.101.2.187","TLSv1.2","695","Application Data"
"115","7.838616100","100.84.170.161","151.101.2.187","TLSv1.2","1955","Application Data"
"116","7.844171500","151.101.2.187","100.84.170.161","TCP","56","443  >  64433 [ACK] Seq=6427 Ack=31698 Win=1841 Len=0"
"117","7.846270400","151.101.2.187","100.84.170.161","TCP","56","443  >  64433 [ACK] Seq=6427 Ack=36039 Win=1870 Len=0"
"118","7.847133700","151.101.2.187","100.84.170.161","TCP","1510","443  >  64433 [ACK] Seq=6427 Ack=36039 Win=1870 Len=1456 [TCP PDU reassembled in 120]"
"119","7.847206600","100.84.170.161","151.101.2.187","TCP","54","64433  >  443 [ACK] Seq=43574 Ack=7883 Win=513 Len=0"
"120","7.847409000","151.101.2.187","100.84.170.161","TLSv1.2","1424","Application Data"
"121","7.847443600","100.84.170.161","151.101.2.187","TCP","54","64433  >  443 [ACK] Seq=43574 Ack=9253 Win=507 Len=0"
"122","7.848345800","151.101.2.187","100.84.170.161","TCP","56","443  >  64433 [ACK] Seq=9253 Ack=36629 Win=1876 Len=0"
"123","7.848832100","151.101.2.187","100.84.170.161","TCP","56","443  >  64433 [ACK] Seq=9253 Ack=38504 Win=1887 Len=0"
"124","7.849157800","151.101.2.187","100.84.170.161","TCP","56","443  >  64433 [ACK] Seq=9253 Ack=43574 Win=1918 Len=0"
"125","7.849828600","151.101.2.187","100.84.170.161","TLSv1.2","1052","Application Data"
"126","7.850113200","151.101.2.187","100.84.170.161","TLSv1.2","768","Application Data"
"127","7.850156100","100.84.170.161","151.101.2.187","TCP","54","64433  >  443 [ACK] Seq=43574 Ack=10965 Win=513 Len=0"
"128","7.850980400","151.101.2.187","100.84.170.161","TLSv1.2","133","Application Data"
"129","7.851604200","151.101.2.187","100.84.170.161","TLSv1.2","494","Application Data"
"130","7.851656400","100.84.170.161","151.101.2.187","TCP","54","64433  >  443 [ACK] Seq=43574 Ack=11484 Win=511 Len=0"
"131","7.851966100","151.101.2.187","100.84.170.161","TLSv1.2","130","Application Data"
"132","7.852660800","151.101.2.187","100.84.170.161","TLSv1.2","1474","Application Data"
"133","7.852733900","100.84.170.161","151.101.2.187","TCP","54","64433  >  443 [ACK] Seq=43574 Ack=12980 Win=513 Len=0"
"134","7.852971900","151.101.2.187","100.84.170.161","TLSv1.2","758","Application Data"
"135","7.853639700","100.84.170.161","151.101.2.187","TLSv1.2","692","Application Data"
"136","7.853687300","151.101.2.187","100.84.170.161","TLSv1.2","284","Application Data"
"137","7.853687300","151.101.2.187","100.84.170.161","TLSv1.2","162","Application Data"
"138","7.853687300","151.101.2.187","100.84.170.161","TLSv1.2","714","Application Data"
"139","7.853747900","100.84.170.161","151.101.2.187","TCP","54","64433  >  443 [ACK] Seq=44212 Ack=14682 Win=513 Len=0"
"140","7.854050200","151.101.2.187","100.84.170.161","TLSv1.2","130","Application Data"
"141","7.854085700","100.84.170.161","151.101.2.187","TCP","54","64433  >  443 [ACK] Seq=44212 Ack=14758 Win=512 Len=0"
"142","7.863123800","151.101.2.187","100.84.170.161","TCP","56","443  >  64433 [ACK] Seq=14758 Ack=44212 Win=1924 Len=0"
"143","7.866388300","151.101.2.187","100.84.170.161","TLSv1.2","240","Application Data"
"144","7.894373400","151.101.2.187","100.84.170.161","TCP","240","[TCP Retransmission] 443  >  64433 [PSH, ACK] Seq=14758 Ack=44212 Win=1924 Len=186"
"145","7.894415500","100.84.170.161","151.101.2.187","TCP","66","64433  >  443 [ACK] Seq=44212 Ack=14944 Win=512 Len=0 SLE=14758 SRE=14944"
"146","8.642122800","100.84.170.161","151.101.2.187","TLSv1.2","1979","Application Data"
"147","8.643523700","100.84.170.161","151.101.2.187","TLSv1.2","674","Application Data"
"148","8.651470600","151.101.2.187","100.84.170.161","TCP","56","443  >  64433 [ACK] Seq=14944 Ack=46137 Win=1935 Len=0"
"149","8.652595200","151.101.2.187","100.84.170.161","TCP","56","443  >  64433 [ACK] Seq=14944 Ack=46757 Win=1941 Len=0"
"150","8.654183000","151.101.2.187","100.84.170.161","TLSv1.2","239","Application Data"
"151","8.654726000","151.101.2.187","100.84.170.161","TLSv1.2","129","Application Data"
"152","8.654769800","100.84.170.161","151.101.2.187","TCP","54","64433  >  443 [ACK] Seq=46757 Ack=15204 Win=511 Len=0"
"153","8.856226900","100.84.170.161","151.101.2.187","TLSv1.2","1989","Application Data"
"154","8.856507300","100.84.170.161","151.101.2.187","TLSv1.2","671","Application Data"
"155","8.867643600","151.101.2.187","100.84.170.161","TCP","56","443  >  64433 [ACK] Seq=15204 Ack=49309 Win=1958 Len=0"
"156","8.869999800","151.101.2.187","100.84.170.161","TLSv1.2","125","Application Data"
"157","8.870215700","151.101.2.187","100.84.170.161","TLSv1.2","130","Application Data"
"158","8.870241000","100.84.170.161","151.101.2.187","TCP","54","64433  >  443 [ACK] Seq=49309 Ack=15351 Win=510 Len=0"
"159","18.304685800","100.84.170.161","151.101.2.187","TLSv1.2","2012","Application Data"
"160","18.316131900","151.101.2.187","100.84.170.161","TCP","56","443  >  64433 [ACK] Seq=15351 Ack=51267 Win=1969 Len=0"
"161","18.923204100","151.101.2.187","100.84.170.161","TCP","1510","443  >  64433 [ACK] Seq=15351 Ack=51267 Win=1969 Len=1456 [TCP PDU reassembled in 162]"
"162","18.923204100","151.101.2.187","100.84.170.161","TLSv1.2","401","Application Data"
"163","18.923204100","151.101.2.187","100.84.170.161","TLSv1.2","64118","Application Data, Application Data, Application Data, Application Data"
"164","18.923204100","151.101.2.187","100.84.170.161","TLSv1.2","5878","Application Data, Application Data"
"165","18.923204100","151.101.2.187","100.84.170.161","TLSv1.2","804","Application Data, Application Data"
"166","18.923204100","151.101.2.187","100.84.170.161","TCP","804","[TCP Retransmission] 443  >  64433 [PSH, ACK] Seq=87042 Ack=51267 Win=1969 Len=750"
"167","18.923325800","100.84.170.161","151.101.2.187","TCP","66","64433  >  443 [ACK] Seq=51267 Ack=87792 Win=513 Len=0 SLE=87042 SRE=87792"
"168","18.942643600","100.84.170.161","151.101.2.187","TLSv1.2","89","Application Data"
"169","18.951613900","151.101.2.187","100.84.170.161","TCP","56","443  >  64433 [ACK] Seq=87792 Ack=51302 Win=1969 Len=0"
"170","19.827424200","100.84.170.161","151.101.2.187","TLSv1.2","762","Application Data"
"171","19.827621900","100.84.170.161","151.101.2.187","TLSv1.2","1782","Application Data"
"172","19.827734300","100.84.170.161","151.101.2.187","TLSv1.2","780","Application Data"
"173","19.827913700","100.84.170.161","151.101.2.187","TLSv1.2","1765","Application Data"
"174","19.828035800","100.84.170.161","151.101.2.187","TLSv1.2","803","Application Data"
"175","19.828141400","100.84.170.161","151.101.2.187","TLSv1.2","1782","Application Data"
"176","19.836334200","151.101.2.187","100.84.170.161","TCP","56","443  >  64433 [ACK] Seq=87792 Ack=52010 Win=1975 Len=0"
"177","19.837203700","151.101.2.187","100.84.170.161","TCP","56","443  >  64433 [ACK] Seq=87792 Ack=54464 Win=1986 Len=0"
"178","19.837573900","151.101.2.187","100.84.170.161","TCP","56","443  >  64433 [ACK] Seq=87792 Ack=56175 Win=1992 Len=0"
"179","19.837961500","151.101.2.187","100.84.170.161","TCP","56","443  >  64433 [ACK] Seq=87792 Ack=58652 Win=2004 Len=0"
"180","19.841740400","151.101.2.187","100.84.170.161","TLSv1.2","825","Application Data"
"181","19.841740400","151.101.2.187","100.84.170.161","TLSv1.2","659","Application Data"
"182","19.841740400","151.101.2.187","100.84.170.161","TLSv1.2","324","Application Data"
"183","19.841806500","100.84.170.161","151.101.2.187","TCP","54","64433  >  443 [ACK] Seq=58652 Ack=89438 Win=513 Len=0"
"184","19.842228800","151.101.2.187","100.84.170.161","TLSv1.2","482","Application Data"
"185","19.842228800","151.101.2.187","100.84.170.161","TLSv1.2","138","Application Data"
"186","19.842228800","151.101.2.187","100.84.170.161","TLSv1.2","494","Application Data"
"187","19.842295700","100.84.170.161","151.101.2.187","TCP","54","64433  >  443 [ACK] Seq=58652 Ack=90390 Win=509 Len=0"
"188","19.842833700","151.101.2.187","100.84.170.161","TLSv1.2","138","Application Data"
"189","19.842833700","151.101.2.187","100.84.170.161","TLSv1.2","415","Application Data"
"190","19.842897700","100.84.170.161","151.101.2.187","TCP","54","64433  >  443 [ACK] Seq=58652 Ack=90835 Win=507 Len=0"
"191","19.881820800","100.84.170.161","151.101.2.187","TLSv1.2","790","Application Data"
"192","19.890913900","151.101.2.187","100.84.170.161","TCP","56","443  >  64433 [ACK] Seq=90835 Ack=59388 Win=2009 Len=0"
"193","19.893481000","151.101.2.187","100.84.170.161","TLSv1.2","155","Application Data"
"194","19.893787600","151.101.2.187","100.84.170.161","TLSv1.2","314","Application Data"
"195","19.893818800","100.84.170.161","151.101.2.187","TCP","54","64433  >  443 [ACK] Seq=59388 Ack=91196 Win=513 Len=0"
"196","20.034965300","100.84.170.161","151.101.2.187","TLSv1.2","1836","Application Data"
"197","20.045256600","151.101.2.187","100.84.170.161","TCP","56","443  >  64433 [ACK] Seq=91196 Ack=61170 Win=2015 Len=0"
"198","20.047793200","151.101.2.187","100.84.170.161","TLSv1.2","124","Application Data"
"199","20.070847100","100.84.170.161","151.101.2.187","TLSv1.2","833","Application Data"
"200","20.073765200","151.101.2.187","100.84.170.161","TCP","124","[TCP Spurious Retransmission] 443  >  64433 [PSH, ACK] Seq=91196 Ack=61170 Win=2015 Len=70"
"201","20.073805700","100.84.170.161","151.101.2.187","TCP","66","[TCP Dup ACK 199#1] 64433  >  443 [ACK] Seq=61949 Ack=91266 Win=513 Len=0 SLE=91196 SRE=91266"
"202","20.073884000","100.84.170.161","151.101.2.187","TLSv1.2","1823","Application Data"
"203","20.074029300","100.84.170.161","151.101.2.187","TLSv1.2","826","Application Data"
"204","20.077527900","100.84.170.161","151.101.2.187","TLSv1.2","1840","Application Data"
"205","20.077708300","100.84.170.161","151.101.2.187","TLSv1.2","806","Application Data"
"206","20.081244600","151.101.2.187","100.84.170.161","TCP","56","443  >  64433 [ACK] Seq=91266 Ack=61949 Win=2021 Len=0"
"207","20.083793000","151.101.2.187","100.84.170.161","TLSv1.2","125","Application Data"
"208","20.084583400","151.101.2.187","100.84.170.161","TCP","56","443  >  64433 [ACK] Seq=91337 Ack=63718 Win=2026 Len=0"
"209","20.084915300","151.101.2.187","100.84.170.161","TCP","56","443  >  64433 [ACK] Seq=91337 Ack=64490 Win=2032 Len=0"
"210","20.086887000","151.101.2.187","100.84.170.161","TLSv1.2","125","Application Data"
"211","20.086940800","100.84.170.161","151.101.2.187","TCP","54","64433  >  443 [ACK] Seq=67028 Ack=91408 Win=512 Len=0"
"212","20.087141300","151.101.2.187","100.84.170.161","TCP","56","443  >  64433 [ACK] Seq=91408 Ack=66276 Win=2038 Len=0"
"213","20.089204400","151.101.2.187","100.84.170.161","TCP","56","443  >  64433 [ACK] Seq=91408 Ack=67028 Win=2043 Len=0"
"214","20.089579200","151.101.2.187","100.84.170.161","TLSv1.2","130","Application Data"
"215","20.089885800","151.101.2.187","100.84.170.161","TLSv1.2","124","Application Data"
"216","20.089922600","100.84.170.161","151.101.2.187","TCP","54","64433  >  443 [ACK] Seq=67028 Ack=91554 Win=511 Len=0"
"217","20.090288100","151.101.2.187","100.84.170.161","TLSv1.2","130","Application Data"
"218","20.126251300","151.101.2.187","100.84.170.161","TCP","130","[TCP Retransmission] 443  >  64433 [PSH, ACK] Seq=91554 Ack=67028 Win=2043 Len=76"
"219","20.126336300","100.84.170.161","151.101.2.187","TCP","66","64433  >  443 [ACK] Seq=67028 Ack=91630 Win=511 Len=0 SLE=91554 SRE=91630"
"220","20.186759700","100.84.170.161","151.101.2.187","TLSv1.2","1840","Application Data"
"221","20.189777900","100.84.170.161","151.101.2.187","TLSv1.2","838","Application Data"
"222","20.196237200","100.84.170.161","151.101.2.187","TLSv1.2","1831","Application Data"
"223","20.197021400","151.101.2.187","100.84.170.161","TCP","56","443  >  64433 [ACK] Seq=91630 Ack=68814 Win=2049 Len=0"
"224","20.198865400","151.101.2.187","100.84.170.161","TCP","56","443  >  64433 [ACK] Seq=91630 Ack=69598 Win=2055 Len=0"
"225","20.200133000","151.101.2.187","100.84.170.161","TLSv1.2","450","Application Data"
"226","20.202006600","151.101.2.187","100.84.170.161","TLSv1.2","131","Application Data"
"227","20.202066100","100.84.170.161","151.101.2.187","TCP","54","64433  >  443 [ACK] Seq=71375 Ack=92103 Win=509 Len=0"
"228","20.205581800","151.101.2.187","100.84.170.161","TCP","56","443  >  64433 [ACK] Seq=92103 Ack=71375 Win=2061 Len=0"
"229","20.208740100","151.101.2.187","100.84.170.161","TLSv1.2","130","Application Data"
"230","20.237145500","151.101.2.187","100.84.170.161","TCP","130","[TCP Retransmission] 443  >  64433 [PSH, ACK] Seq=92103 Ack=71375 Win=2061 Len=76"
"231","20.237192100","100.84.170.161","151.101.2.187","TCP","66","64433  >  443 [ACK] Seq=71375 Ack=92179 Win=509 Len=0 SLE=92103 SRE=92179"
"232","20.270976800","100.84.170.161","151.101.2.187","TLSv1.2","832","Application Data"
"233","20.271507400","100.84.170.161","151.101.2.187","TLSv1.2","1849","Application Data"
"234","20.271655400","100.84.170.161","151.101.2.187","TLSv1.2","833","Application Data"
"235","20.271769900","100.84.170.161","151.101.2.187","TLSv1.2","1770","Application Data"
"236","20.271856900","100.84.170.161","151.101.2.187","TLSv1.2","843","Application Data"
"237","20.272003100","100.84.170.161","151.101.2.187","TLSv1.2","1829","Application Data"
"238","20.280108400","151.101.2.187","100.84.170.161","TCP","56","443  >  64433 [ACK] Seq=92179 Ack=72153 Win=2066 Len=0"
"239","20.280482400","151.101.2.187","100.84.170.161","TCP","56","443  >  64433 [ACK] Seq=92179 Ack=73948 Win=2072 Len=0"
"240","20.281312900","151.101.2.187","100.84.170.161","TCP","56","443  >  64433 [ACK] Seq=92179 Ack=79007 Win=2095 Len=0"
"241","20.283875100","151.101.2.187","100.84.170.161","TLSv1.2","125","Application Data"
"242","20.284811000","151.101.2.187","100.84.170.161","TLSv1.2","130","Application Data"
"243","20.284858300","100.84.170.161","151.101.2.187","TCP","54","64433  >  443 [ACK] Seq=79007 Ack=92326 Win=508 Len=0"
"244","20.285226800","151.101.2.187","100.84.170.161","TLSv1.2","131","Application Data"
"245","20.285604700","151.101.2.187","100.84.170.161","TLSv1.2","124","Application Data"
"246","20.285633900","100.84.170.161","151.101.2.187","TCP","54","64433  >  443 [ACK] Seq=79007 Ack=92473 Win=508 Len=0"
"247","20.286190800","151.101.2.187","100.84.170.161","TLSv1.2","174","Application Data"
"248","20.287129500","151.101.2.187","100.84.170.161","TLSv1.2","751","Application Data"
"249","20.287129500","151.101.2.187","100.84.170.161","TLSv1.2","131","Application Data"
"250","20.287181500","100.84.170.161","151.101.2.187","TCP","54","64433  >  443 [ACK] Seq=79007 Ack=93367 Win=513 Len=0"
"251","20.306297300","100.84.170.161","151.101.2.187","TLSv1.2","817","Application Data"
"252","20.315845700","151.101.2.187","100.84.170.161","TCP","56","443  >  64433 [ACK] Seq=93367 Ack=79770 Win=2100 Len=0"
"253","20.318221600","151.101.2.187","100.84.170.161","TLSv1.2","130","Application Data"
"254","20.342745900","151.101.2.187","100.84.170.161","TCP","130","[TCP Retransmission] 443  >  64433 [PSH, ACK] Seq=93367 Ack=79770 Win=2100 Len=76"
"255","20.342790100","100.84.170.161","151.101.2.187","TCP","66","64433  >  443 [ACK] Seq=79770 Ack=93443 Win=512 Len=0 SLE=93367 SRE=93443"
"256","22.562557800","100.84.170.161","151.101.2.187","TLSv1.2","2617","Application Data"
"257","22.562819300","100.84.170.161","151.101.2.187","TLSv1.2","2761","Application Data"
"258","22.563029000","100.84.170.161","151.101.2.187","TLSv1.2","2781","Application Data"
"259","22.563237100","100.84.170.161","151.101.2.187","TLSv1.2","2779","Application Data"
"260","22.565919600","100.84.170.161","151.101.2.187","TLSv1.2","2764","Application Data"
"261","22.572031900","151.101.2.187","100.84.170.161","TCP","56","443  >  64433 [ACK] Seq=93443 Ack=82333 Win=2112 Len=0"
"262","22.572406800","151.101.2.187","100.84.170.161","TCP","56","443  >  64433 [ACK] Seq=93443 Ack=85040 Win=2123 Len=0"
"263","22.573082000","151.101.2.187","100.84.170.161","TCP","56","443  >  64433 [ACK] Seq=93443 Ack=87767 Win=2135 Len=0"
"264","22.573082000","151.101.2.187","100.84.170.161","TCP","56","443  >  64433 [ACK] Seq=93443 Ack=90492 Win=2146 Len=0"
"265","22.575373900","151.101.2.187","100.84.170.161","TCP","56","443  >  64433 [ACK] Seq=93443 Ack=93202 Win=2158 Len=0"
"266","22.586374400","100.84.170.161","151.101.2.187","TLSv1.2","2330","Application Data"
"267","22.594068000","100.84.170.161","151.101.2.187","TLSv1.2","2411","Application Data"
"268","22.595621700","151.101.2.187","100.84.170.161","TCP","56","443  >  64433 [ACK] Seq=93443 Ack=95478 Win=2169 Len=0"
"269","22.598575800","151.101.2.187","100.84.170.161","TLSv1.2","271","Application Data"
"270","22.598869200","151.101.2.187","100.84.170.161","TLSv1.2","604","Application Data"
"271","22.598911800","100.84.170.161","151.101.2.187","TCP","54","64433  >  443 [ACK] Seq=97835 Ack=94210 Win=509 Len=0"
"272","22.603475900","151.101.2.187","100.84.170.161","TCP","56","443  >  64433 [ACK] Seq=94210 Ack=97835 Win=2180 Len=0"
"273","22.606277600","151.101.2.187","100.84.170.161","TLSv1.2","372","Application Data"
"274","22.609220100","151.101.2.187","100.84.170.161","TLSv1.2","474","Application Data"
"275","22.609266200","100.84.170.161","151.101.2.187","TCP","54","64433  >  443 [ACK] Seq=97835 Ack=94948 Win=513 Len=0"
"276","22.630282500","100.84.170.161","151.101.2.187","TLSv1.2","2480","Application Data"
"277","22.639451800","151.101.2.187","100.84.170.161","TCP","56","443  >  64433 [ACK] Seq=94948 Ack=100261 Win=2192 Len=0"
"278","22.643731000","151.101.2.187","100.84.170.161","TLSv1.2","131","Application Data"
"279","22.668838900","151.101.2.187","100.84.170.161","TCP","131","[TCP Retransmission] 443  >  64433 [PSH, ACK] Seq=94948 Ack=100261 Win=2192 Len=77"
"280","22.669003700","100.84.170.161","151.101.2.187","TCP","66","64433  >  443 [ACK] Seq=100261 Ack=95025 Win=512 Len=0 SLE=94948 SRE=95025"
"281","22.735963400","151.101.2.187","100.84.170.161","TLSv1.2","283","Application Data"
"282","22.736286100","151.101.2.187","100.84.170.161","TLSv1.2","227","Application Data"
"283","22.736328400","100.84.170.161","151.101.2.187","TCP","54","64433  >  443 [ACK] Seq=100261 Ack=95427 Win=511 Len=0"
"284","22.773121400","151.101.2.187","100.84.170.161","TLSv1.2","142","Application Data"
"285","22.774160700","151.101.2.187","100.84.170.161","TCP","11702","443  >  64433 [ACK] Seq=95515 Ack=100261 Win=2192 Len=11648 [TCP PDU reassembled in 287]"
"286","22.774241700","100.84.170.161","151.101.2.187","TCP","54","64433  >  443 [ACK] Seq=100261 Ack=107163 Win=513 Len=0"
"287","22.774881000","151.101.2.187","100.84.170.161","TLSv1.2","11702","Application Data"
"288","22.774881000","151.101.2.187","100.84.170.161","TLSv1.2","1133","Application Data"
"289","22.774959900","100.84.170.161","151.101.2.187","TCP","54","64433  >  443 [ACK] Seq=100261 Ack=119890 Win=513 Len=0"
"290","22.794042600","100.84.170.161","151.101.2.187","TLSv1.2","2467","Application Data"
"291","22.798725800","151.101.2.187","100.84.170.161","TLSv1.2","123","Application Data"
"292","22.799344600","151.101.2.187","100.84.170.161","TCP","1510","443  >  64433 [ACK] Seq=119959 Ack=100261 Win=2192 Len=1456 [TCP PDU reassembled in 295]"
"293","22.799399000","100.84.170.161","151.101.2.187","TCP","54","64433  >  443 [ACK] Seq=102674 Ack=121415 Win=513 Len=0"
"294","22.799861900","100.84.170.161","151.101.2.187","TLSv1.2","2463","Application Data"
"295","22.800526600","151.101.2.187","100.84.170.161","TLSv1.2","23350","Application Data"
"296","22.800526600","151.101.2.187","100.84.170.161","TLSv1.2","1365","Application Data"
"297","22.800596000","100.84.170.161","151.101.2.187","TCP","54","64433  >  443 [ACK] Seq=105083 Ack=146022 Win=513 Len=0"
"298","22.803485300","151.101.2.187","100.84.170.161","TCP","56","443  >  64433 [ACK] Seq=146022 Ack=102674 Win=2203 Len=0"
"299","22.806016600","151.101.2.187","100.84.170.161","TLSv1.2","98","Application Data"
"300","22.806107100","100.84.170.161","151.101.2.187","TCP","54","64433  >  443 [ACK] Seq=105083 Ack=146066 Win=513 Len=0"
"301","22.810543400","151.101.2.187","100.84.170.161","TCP","56","443  >  64433 [ACK] Seq=146066 Ack=105083 Win=2215 Len=0"
"302","22.813536600","151.101.2.187","100.84.170.161","TLSv1.2","98","Application Data"
"303","22.840531100","151.101.2.187","100.84.170.161","TCP","98","[TCP Retransmission] 443  >  64433 [PSH, ACK] Seq=146066 Ack=105083 Win=2215 Len=44"
"304","22.840582900","100.84.170.161","151.101.2.187","TCP","66","64433  >  443 [ACK] Seq=105083 Ack=146110 Win=512 Len=0 SLE=146066 SRE=146110"
"305","22.847170300","100.84.170.161","151.101.2.187","TLSv1.2","2480","Application Data"
"306","22.856433700","151.101.2.187","100.84.170.161","TCP","56","443  >  64433 [ACK] Seq=146110 Ack=107509 Win=2226 Len=0"
"307","22.858940700","151.101.2.187","100.84.170.161","TLSv1.2","104","Application Data"
"308","22.884332100","151.101.2.187","100.84.170.161","TCP","104","[TCP Retransmission] 443  >  64433 [PSH, ACK] Seq=146110 Ack=107509 Win=2226 Len=50"
"309","22.884382800","100.84.170.161","151.101.2.187","TCP","66","64433  >  443 [ACK] Seq=107509 Ack=146160 Win=512 Len=0 SLE=146110 SRE=146160"
"310","22.905441000","100.84.170.161","151.101.2.187","TLSv1.2","2467","Application Data"
"311","22.907676000","100.84.170.161","151.101.2.187","TLSv1.2","2463","Application Data"
"312","22.914772400","151.101.2.187","100.84.170.161","TCP","56","443  >  64433 [ACK] Seq=146160 Ack=109922 Win=2237 Len=0"
"313","22.916958500","151.101.2.187","100.84.170.161","TCP","56","443  >  64433 [ACK] Seq=146160 Ack=112331 Win=2249 Len=0"
"314","22.918009300","151.101.2.187","100.84.170.161","TLSv1.2","98","Application Data"
"315","22.919210100","151.101.2.187","100.84.170.161","TLSv1.2","98","Application Data"
"316","22.919253900","100.84.170.161","151.101.2.187","TCP","54","64433  >  443 [ACK] Seq=112331 Ack=146248 Win=512 Len=0"
"317","22.985933700","151.101.2.187","100.84.170.161","TLSv1.2","198","Application Data"
"318","22.986243000","151.101.2.187","100.84.170.161","TCP","1510","443  >  64433 [ACK] Seq=146392 Ack=112331 Win=2249 Len=1456 [TCP PDU reassembled in 320]"
"319","22.986290400","100.84.170.161","151.101.2.187","TCP","54","64433  >  443 [ACK] Seq=112331 Ack=147848 Win=513 Len=0"
"320","22.987489300","151.101.2.187","100.84.170.161","TLSv1.2","27718","Application Data"
"321","22.987558000","100.84.170.161","151.101.2.187","TCP","54","64433  >  443 [ACK] Seq=112331 Ack=175512 Win=513 Len=0"
"322","22.988971000","151.101.2.187","100.84.170.161","TCP","1510","443  >  64433 [ACK] Seq=175512 Ack=112331 Win=2249 Len=1456 [TCP PDU reassembled in 323]"
"323","22.988971000","151.101.2.187","100.84.170.161","TLSv1.2","856","Application Data"
"324","22.988971000","151.101.2.187","100.84.170.161","TCP","1510","443  >  64433 [ACK] Seq=177770 Ack=112331 Win=2249 Len=1456 [TCP PDU reassembled in 325]"
"325","22.988971000","151.101.2.187","100.84.170.161","TLSv1.2","81","Application Data"
"326","22.988971000","151.101.2.187","100.84.170.161","TCP","16070","443  >  64433 [ACK] Seq=179253 Ack=112331 Win=2249 Len=16016 [TCP PDU reassembled in 327]"
"327","22.988971000","151.101.2.187","100.84.170.161","TLSv1.2","475","Application Data, Application Data"
"328","22.988971000","151.101.2.187","100.84.170.161","TCP","10246","443  >  64433 [ACK] Seq=195690 Ack=112331 Win=2249 Len=10192 [TCP PDU reassembled in 330]"
"329","22.989075900","100.84.170.161","151.101.2.187","TCP","54","64433  >  443 [ACK] Seq=112331 Ack=205882 Win=513 Len=0"
"330","22.989583900","151.101.2.187","100.84.170.161","TLSv1.2","616","Application Data"
"331","22.995096700","100.84.170.161","151.101.2.187","TLSv1.2","2467","Application Data"
"332","22.995935500","100.84.170.161","151.101.2.187","TLSv1.2","2463","Application Data"
"333","23.002154300","100.84.170.161","151.101.2.187","TLSv1.2","2480","Application Data"
"334","23.004414000","151.101.2.187","100.84.170.161","TCP","56","443  >  64433 [ACK] Seq=206444 Ack=114744 Win=2260 Len=0"
"335","23.005240800","151.101.2.187","100.84.170.161","TCP","56","443  >  64433 [ACK] Seq=206444 Ack=117153 Win=2272 Len=0"
"336","23.006823600","151.101.2.187","100.84.170.161","TLSv1.2","98","Application Data"
"337","23.007185200","151.101.2.187","100.84.170.161","TLSv1.2","98","Application Data"
"338","23.007221800","100.84.170.161","151.101.2.187","TCP","54","64433  >  443 [ACK] Seq=119579 Ack=206532 Win=510 Len=0"
"339","23.011456200","151.101.2.187","100.84.170.161","TCP","56","443  >  64433 [ACK] Seq=206532 Ack=119579 Win=2283 Len=0"
"340","23.013317900","151.101.2.187","100.84.170.161","TLSv1.2","98","Application Data"
"341","23.042643200","151.101.2.187","100.84.170.161","TCP","98","[TCP Retransmission] 443  >  64433 [PSH, ACK] Seq=206532 Ack=119579 Win=2283 Len=44"
"342","23.042680000","100.84.170.161","151.101.2.187","TCP","66","64433  >  443 [ACK] Seq=119579 Ack=206576 Win=510 Len=0 SLE=206532 SRE=206576"
"343","23.058961800","151.101.2.187","100.84.170.161","TLSv1.2","128","Application Data"
"344","23.059016000","100.84.170.161","151.101.2.187","TCP","54","64433  >  443 [ACK] Seq=119579 Ack=206650 Win=510 Len=0"
"345","23.059342100","151.101.2.187","100.84.170.161","TCP","1510","443  >  64433 [ACK] Seq=206650 Ack=119579 Win=2283 Len=1456 [TCP PDU reassembled in 346]"
"346","23.060513600","151.101.2.187","100.84.170.161","TLSv1.2","26262","Application Data"
"347","23.060593900","100.84.170.161","151.101.2.187","TCP","54","64433  >  443 [ACK] Seq=119579 Ack=234314 Win=513 Len=0"
"348","23.062038100","151.101.2.187","100.84.170.161","TLSv1.2","20438","Application Data, Application Data"
"349","23.062038100","151.101.2.187","100.84.170.161","TLSv1.2","1310","Application Data, Application Data"
"350","23.062038100","151.101.2.187","100.84.170.161","TCP","8790","443  >  64433 [ACK] Seq=255954 Ack=119579 Win=2283 Len=8736 [TCP PDU reassembled in 351]"
"351","23.062038100","151.101.2.187","100.84.170.161","TLSv1.2","1342","Application Data"
"352","23.062172000","100.84.170.161","151.101.2.187","TCP","54","64433  >  443 [ACK] Seq=119579 Ack=265978 Win=513 Len=0"
"353","23.267363200","100.84.170.161","151.101.2.187","TLSv1.2","2536","Application Data"
"354","23.320484700","151.101.2.187","100.84.170.161","TCP","56","443  >  64433 [ACK] Seq=265978 Ack=122061 Win=2294 Len=0"
"355","23.486263200","151.101.2.187","100.84.170.161","TLSv1.2","1377","Application Data"
"356","23.486577100","151.101.2.187","100.84.170.161","TCP","1510","443  >  64433 [ACK] Seq=267301 Ack=122061 Win=2294 Len=1456 [TCP PDU reassembled in 358]"
"357","23.486616700","100.84.170.161","151.101.2.187","TCP","54","64433  >  443 [ACK] Seq=122061 Ack=268757 Win=513 Len=0"
"358","23.487873100","151.101.2.187","100.84.170.161","TLSv1.2","26262","Application Data"
"359","23.487947900","100.84.170.161","151.101.2.187","TCP","54","64433  >  443 [ACK] Seq=122061 Ack=294965 Win=513 Len=0"
"360","23.489497700","151.101.2.187","100.84.170.161","TLSv1.2","10246","Application Data"
"361","23.489497700","151.101.2.187","100.84.170.161","TLSv1.2","168","Application Data"
"362","23.489497700","151.101.2.187","100.84.170.161","TLSv1.2","4422","Application Data, Application Data, Application Data, Application Data, Application Data"
"363","23.489497700","151.101.2.187","100.84.170.161","TLSv1.2","456","Application Data"
"364","23.489578300","100.84.170.161","151.101.2.187","TCP","54","64433  >  443 [ACK] Seq=122061 Ack=310041 Win=513 Len=0"
"365","23.489809500","151.101.2.187","100.84.170.161","TCP","2966","443  >  64433 [ACK] Seq=310041 Ack=122061 Win=2294 Len=2912 [TCP PDU reassembled in 366]"
"366","23.489809500","151.101.2.187","100.84.170.161","TLSv1.2","219","Application Data"
"367","23.489853600","100.84.170.161","151.101.2.187","TCP","54","64433  >  443 [ACK] Seq=122061 Ack=313118 Win=513 Len=0"
