No.,Time,Source,Destination,Protocol,Length,Info
1,0.0,100.84.170.161,151.101.2.187,TCP,55,63540  >  443 [ACK] Seq=1 Ack=1 Win=509 Len=1
2,0.0107176,151.101.2.187,100.84.170.161,TCP,66,443  >  63540 [ACK] Seq=1 Ack=2 Win=285 Len=0 SLE=1 SRE=2
3,6.9366384,100.84.170.161,151.101.2.187,TLSv1.2,1736,Application Data
4,6.9367593,100.84.170.161,151.101.2.187,TLSv1.2,93,Application Data
5,6.9456676,151.101.2.187,100.84.170.161,TCP,56,443  >  55283 [ACK] Seq=1 Ack=1722 Win=3239 Len=0
6,6.9462031,151.101.2.187,100.84.170.161,TLSv1.2,93,Application Data
7,6.9465163,100.84.170.161,151.101.2.187,TLSv1.2,1033,Application Data
8,6.9473537,100.84.170.161,151.101.2.187,TLSv1.2,1698,Application Data
9,6.9487137,151.101.2.187,100.84.170.161,TLSv1.2,240,Application Data
10,6.9556764,151.101.2.187,100.84.170.161,TCP,56,443  >  55283 [ACK] Seq=226 Ack=2701 Win=3244 Len=0
11,6.9565803,151.101.2.187,100.84.170.161,TCP,56,443  >  55283 [ACK] Seq=226 Ack=4345 Win=3250 Len=0
12,6.9570597,100.84.170.161,151.101.2.187,TLSv1.2,1027,Application Data
13,6.9584089,151.101.2.187,100.84.170.161,TLSv1.2,213,Application Data
14,6.958467,100.84.170.161,151.101.2.187,TCP,54,55283  >  443 [ACK] Seq=5318 Ack=385 Win=513 Len=0
15,6.9586946,151.101.2.187,100.84.170.161,TLSv1.2,131,Application Data
16,6.9587387,100.84.170.161,151.101.2.187,TCP,54,55283  >  443 [ACK] Seq=5318 Ack=462 Win=512 Len=0
17,6.9662641,151.101.2.187,100.84.170.161,TCP,56,443  >  55283 [ACK] Seq=462 Ack=5318 Win=3256 Len=0
18,6.9687325,151.101.2.187,100.84.170.161,TLSv1.2,103,Application Data
19,6.9838495,100.84.170.161,151.101.2.187,TLSv1.2,1698,Application Data
20,6.9926659,151.101.2.187,100.84.170.161,TCP,56,443  >  55283 [ACK] Seq=511 Ack=6962 Win=3262 Len=0
21,6.995305,151.101.2.187,100.84.170.161,TLSv1.2,130,Application Data
22,7.0125904,100.84.170.161,151.101.2.187,TLSv1.2,990,Application Data
23,7.0213689,151.101.2.187,100.84.170.161,TCP,56,443  >  55283 [ACK] Seq=587 Ack=7898 Win=3267 Len=0
24,7.0244749,151.101.2.187,100.84.170.161,TLSv1.2,300,Application Data
25,7.0247222,151.101.2.187,100.84.170.161,TLSv1.2,273,Application Data
26,7.0247889,100.84.170.161,151.101.2.187,TCP,54,55283  >  443 [ACK] Seq=7898 Ack=1052 Win=510 Len=0
27,7.0272383,100.84.170.161,151.101.2.187,TLSv1.2,89,Application Data
28,7.0356788,151.101.2.187,100.84.170.161,TCP,56,443  >  55283 [ACK] Seq=1052 Ack=7933 Win=3267 Len=0
29,7.0795307,100.84.170.161,151.101.2.187,TLSv1.2,1718,Application Data
30,7.0876693,100.84.170.161,151.101.2.187,TLSv1.2,1041,Application Data
31,7.0889581,151.101.2.187,100.84.170.161,TCP,56,443  >  55283 [ACK] Seq=1052 Ack=9597 Win=3273 Len=0
32,7.0920923,151.101.2.187,100.84.170.161,TLSv1.2,130,Application Data
33,7.096514,151.101.2.187,100.84.170.161,TCP,56,443  >  55283 [ACK] Seq=1128 Ack=10584 Win=3279 Len=0
34,7.09929,151.101.2.187,100.84.170.161,TLSv1.2,130,Application Data
35,7.0993552,100.84.170.161,151.101.2.187,TCP,54,55283  >  443 [ACK] Seq=10584 Ack=1204 Win=510 Len=0
36,7.1274481,100.84.170.161,151.101.2.187,TLSv1.2,1712,Application Data
37,7.1369725,151.101.2.187,100.84.170.161,TCP,56,443  >  55283 [ACK] Seq=1204 Ack=12242 Win=3284 Len=0
38,7.1395907,151.101.2.187,100.84.170.161,TLSv1.2,130,Application Data
39,7.1733096,151.101.2.187,100.84.170.161,TCP,130,"[TCP Retransmission] 443  >  55283 [PSH, ACK] Seq=1204 Ack=12242 Win=3284 Len=76"
40,7.1733638,100.84.170.161,151.101.2.187,TCP,66,55283  >  443 [ACK] Seq=12242 Ack=1280 Win=509 Len=0 SLE=1204 SRE=1280
41,7.4161023,100.84.170.161,151.101.2.187,TLSv1.2,1036,Application Data
42,7.4375701,151.101.2.187,100.84.170.161,TCP,56,443  >  55283 [ACK] Seq=1280 Ack=13224 Win=3290 Len=0
43,7.4407755,151.101.2.187,100.84.170.161,TLSv1.2,241,Application Data
44,7.4753537,151.101.2.187,100.84.170.161,TCP,241,"[TCP Retransmission] 443  >  55283 [PSH, ACK] Seq=1280 Ack=13224 Win=3290 Len=187"
45,7.4754128,100.84.170.161,151.101.2.187,TCP,66,55283  >  443 [ACK] Seq=13224 Ack=1467 Win=509 Len=0 SLE=1280 SRE=1467
46,7.7610115,100.84.170.161,151.101.2.187,TLSv1.2,2026,Application Data
47,7.7697439,151.101.2.187,100.84.170.161,TCP,56,443  >  55283 [ACK] Seq=1467 Ack=15196 Win=3296 Len=0
48,7.7730533,151.101.2.187,100.84.170.161,TLSv1.2,130,Application Data
49,7.7780922,100.84.170.161,151.101.2.187,TLSv1.2,717,Application Data
50,7.7796656,100.84.170.161,151.101.2.187,TLSv1.2,2030,Application Data
51,7.779861,100.84.170.161,151.101.2.187,TLSv1.2,708,Application Data
52,7.7870413,151.101.2.187,100.84.170.161,TCP,56,443  >  55283 [ACK] Seq=1543 Ack=15859 Win=3296 Len=0
53,7.7884785,151.101.2.187,100.84.170.161,TCP,56,443  >  55283 [ACK] Seq=1543 Ack=17835 Win=3301 Len=0
54,7.7887234,151.101.2.187,100.84.170.161,TCP,56,443  >  55283 [ACK] Seq=1543 Ack=18489 Win=3301 Len=0
55,7.789839,151.101.2.187,100.84.170.161,TLSv1.2,130,Application Data
56,7.7918368,151.101.2.187,100.84.170.161,TLSv1.2,268,Application Data
57,7.7918958,100.84.170.161,151.101.2.187,TCP,54,55283  >  443 [ACK] Seq=18489 Ack=1833 Win=507 Len=0
58,13.8402996,100.84.170.161,151.101.2.187,TLSv1.2,2034,Application Data
59,13.8425473,100.84.170.161,151.101.2.187,TLSv1.2,717,Application Data
60,13.8537742,100.84.170.161,151.101.2.187,TLSv1.2,2040,Application Data
61,13.858767,100.84.170.161,151.101.2.187,TLSv1.2,726,Application Data
62,13.8590786,151.101.2.187,100.84.170.161,TCP,56,443  >  55283 [ACK] Seq=1833 Ack=21132 Win=3307 Len=0
63,13.8612013,151.101.2.187,100.84.170.161,TLSv1.2,213,Application Data
64,13.8612634,100.84.170.161,151.101.2.187,TCP,54,55283  >  443 [ACK] Seq=23790 Ack=1992 Win=513 Len=0
65,13.8615141,151.101.2.187,100.84.170.161,TLSv1.2,131,Application Data
66,13.8615498,100.84.170.161,151.101.2.187,TCP,54,55283  >  443 [ACK] Seq=23790 Ack=2069 Win=512 Len=0
67,13.8626592,151.101.2.187,100.84.170.161,TCP,56,443  >  55283 [ACK] Seq=2069 Ack=23118 Win=3313 Len=0
68,13.8653962,151.101.2.187,100.84.170.161,TLSv1.2,130,Application Data
69,13.8679105,151.101.2.187,100.84.170.161,TCP,56,443  >  55283 [ACK] Seq=2145 Ack=23790 Win=3313 Len=0
70,13.8704354,151.101.2.187,100.84.170.161,TLSv1.2,256,Application Data
71,13.8705512,100.84.170.161,151.101.2.187,TCP,54,55283  >  443 [ACK] Seq=23790 Ack=2347 Win=511 Len=0
72,14.1644623,100.84.170.161,151.101.2.187,TLSv1.2,2026,Application Data
73,14.1874066,100.84.170.161,151.101.2.187,TCP,1514,"[TCP Retransmission] 55283  >  443 [PSH, ACK] Seq=24302 Ack=2347 Win=511 Len=1460"
74,14.201709,151.101.2.187,100.84.170.161,TCP,56,443  >  55283 [ACK] Seq=2347 Ack=25762 Win=3319 Len=0
75,14.2020424,151.101.2.187,100.84.170.161,TCP,66,[TCP Dup ACK 74#1] 443  >  55283 [ACK] Seq=2347 Ack=25762 Win=3319 Len=0 SLE=24302 SRE=25762
76,14.2046935,151.101.2.187,100.84.170.161,TLSv1.2,130,Application Data
77,14.2464565,100.84.170.161,151.101.2.187,TCP,54,55283  >  443 [ACK] Seq=25762 Ack=2423 Win=511 Len=0
78,14.2622421,151.101.2.187,100.84.170.161,TCP,130,"[TCP Spurious Retransmission] 443  >  55283 [PSH, ACK] Seq=2347 Ack=25762 Win=3319 Len=76"
79,14.2623545,100.84.170.161,151.101.2.187,TCP,66,[TCP Dup ACK 77#1] 55283  >  443 [ACK] Seq=25762 Ack=2423 Win=511 Len=0 SLE=2347 SRE=2423
80,17.8531045,100.84.170.161,151.101.2.187,TCP,55,56939  >  443 [ACK] Seq=1 Ack=1 Win=508 Len=1
81,17.8997619,151.101.2.187,100.84.170.161,TCP,66,443  >  56939 [ACK] Seq=1 Ack=2 Win=285 Len=0 SLE=1 SRE=2
82,23.1116534,100.84.170.161,151.101.2.187,TLSv1.2,726,Application Data
83,23.1209165,151.101.2.187,100.84.170.161,TCP,56,443  >  55283 [ACK] Seq=2423 Ack=26434 Win=3319 Len=0
84,23.1245237,151.101.2.187,100.84.170.161,TLSv1.2,213,Application Data
85,23.1554057,151.101.2.187,100.84.170.161,TCP,213,"[TCP Retransmission] 443  >  55283 [PSH, ACK] Seq=2423 Ack=26434 Win=3319 Len=159"
86,23.1554453,100.84.170.161,151.101.2.187,TCP,66,55283  >  443 [ACK] Seq=26434 Ack=2582 Win=510 Len=0 SLE=2423 SRE=2582
87,31.4918499,100.84.170.161,151.101.2.187,TLSv1.2,2039,Application Data
88,31.5012326,151.101.2.187,100.84.170.161,TCP,56,443  >  55283 [ACK] Seq=2582 Ack=28419 Win=3324 Len=0
89,31.505687,151.101.2.187,100.84.170.161,TLSv1.2,240,Application Data
90,31.5138433,100.84.170.161,151.101.2.187,TLSv1.2,738,Application Data
91,31.5236768,151.101.2.187,100.84.170.161,TCP,56,443  >  55283 [ACK] Seq=2768 Ack=29103 Win=3324 Len=0
92,31.5274095,151.101.2.187,100.84.170.161,TLSv1.2,131,Application Data
93,31.5608266,151.101.2.187,100.84.170.161,TCP,131,"[TCP Retransmission] 443  >  55283 [PSH, ACK] Seq=2768 Ack=29103 Win=3324 Len=77"
94,31.5608706,100.84.170.161,151.101.2.187,TCP,66,55283  >  443 [ACK] Seq=29103 Ack=2845 Win=509 Len=0 SLE=2768 SRE=2845
95,31.750893,100.84.170.161,151.101.2.187,TLSv1.2,2040,Application Data
96,31.7630901,151.101.2.187,100.84.170.161,TCP,56,443  >  55283 [ACK] Seq=2845 Ack=31089 Win=3330 Len=0
97,31.764307,151.101.2.187,100.84.170.161,TLSv1.2,103,Application Data
98,31.7966571,151.101.2.187,100.84.170.161,TCP,103,"[TCP Retransmission] 443  >  55283 [PSH, ACK] Seq=2845 Ack=31089 Win=3330 Len=49"
99,31.7967093,100.84.170.161,151.101.2.187,TCP,66,55283  >  443 [ACK] Seq=31089 Ack=2894 Win=509 Len=0 SLE=2845 SRE=2894
100,35.4093784,100.84.170.161,151.101.2.187,TLSv1.2,726,Application Data
101,35.4181807,151.101.2.187,100.84.170.161,TCP,56,443  >  55283 [ACK] Seq=2894 Ack=31761 Win=3330 Len=0
102,35.4221222,151.101.2.187,100.84.170.161,TLSv1.2,323,Application Data
103,35.4523038,151.101.2.187,100.84.170.161,TCP,323,"[TCP Retransmission] 443  >  55283 [PSH, ACK] Seq=2894 Ack=31761 Win=3330 Len=269"
104,35.4523372,100.84.170.161,151.101.2.187,TCP,66,55283  >  443 [ACK] Seq=31761 Ack=3163 Win=508 Len=0 SLE=2894 SRE=3163
105,35.5207556,100.84.170.161,151.101.2.187,TLSv1.2,2028,Application Data
106,35.5376781,151.101.2.187,100.84.170.161,TCP,56,443  >  55283 [ACK] Seq=3163 Ack=33735 Win=3336 Len=0
107,35.5376781,151.101.2.187,100.84.170.161,TLSv1.2,130,Application Data
108,35.5376753,100.84.170.161,151.101.2.187,TCP,1514,"[TCP Spurious Retransmission] 55283  >  443 [PSH, ACK] Seq=32275 Ack=3163 Win=508 Len=1460"
109,35.5472172,151.101.2.187,100.84.170.161,TCP,66,[TCP Dup ACK 106#1] 443  >  55283 [ACK] Seq=3239 Ack=33735 Win=3336 Len=0 SLE=32275 SRE=33735
110,35.5566114,100.84.170.161,151.101.2.187,TLSv1.2,708,Application Data
111,35.5697389,151.101.2.187,100.84.170.161,TCP,130,"[TCP Spurious Retransmission] 443  >  55283 [PSH, ACK] Seq=3163 Ack=33735 Win=3336 Len=76"
112,35.5697389,151.101.2.187,100.84.170.161,TCP,56,443  >  55283 [ACK] Seq=3239 Ack=34389 Win=3336 Len=0
113,35.5697389,151.101.2.187,100.84.170.161,TLSv1.2,130,Application Data
114,35.5697796,100.84.170.161,151.101.2.187,TCP,66,[TCP Dup ACK 110#1] 55283  >  443 [ACK] Seq=34389 Ack=3239 Win=508 Len=0 SLE=3163 SRE=3239
115,35.6008284,151.101.2.187,100.84.170.161,TCP,130,"[TCP Retransmission] 443  >  55283 [PSH, ACK] Seq=3239 Ack=34389 Win=3336 Len=76"
116,35.6008712,100.84.170.161,151.101.2.187,TCP,66,55283  >  443 [ACK] Seq=34389 Ack=3315 Win=508 Len=0 SLE=3239 SRE=3315
117,38.2368898,100.84.170.161,151.101.2.187,TLSv1.2,2034,Application Data
118,38.2370838,100.84.170.161,151.101.2.187,TLSv1.2,718,Application Data
119,38.2503552,151.101.2.187,100.84.170.161,TCP,56,443  >  55283 [ACK] Seq=3315 Ack=37033 Win=3341 Len=0
120,38.2506927,151.101.2.187,100.84.170.161,TLSv1.2,241,Application Data
121,38.2510146,151.101.2.187,100.84.170.161,TLSv1.2,257,Application Data
122,38.2510483,100.84.170.161,151.101.2.187,TCP,54,55283  >  443 [ACK] Seq=37033 Ack=3705 Win=513 Len=0
123,38.2996544,100.84.170.161,151.101.2.187,TLSv1.2,2028,Application Data
124,38.2998313,100.84.170.161,151.101.2.187,TLSv1.2,706,Application Data
125,38.3114166,151.101.2.187,100.84.170.161,TCP,56,443  >  55283 [ACK] Seq=3705 Ack=39659 Win=3347 Len=0
126,38.3128973,151.101.2.187,100.84.170.161,TLSv1.2,184,Application Data
127,38.3438383,151.101.2.187,100.84.170.161,TCP,184,"[TCP Retransmission] 443  >  55283 [PSH, ACK] Seq=3705 Ack=39659 Win=3347 Len=130"
128,38.3438752,100.84.170.161,151.101.2.187,TCP,66,55283  >  443 [ACK] Seq=39659 Ack=3835 Win=512 Len=0 SLE=3705 SRE=3835
129,40.8371836,100.84.170.161,151.101.2.187,TLSv1.2,2039,Application Data
130,40.846103,151.101.2.187,100.84.170.161,TCP,56,443  >  55283 [ACK] Seq=3835 Ack=41644 Win=3353 Len=0
131,40.8483633,151.101.2.187,100.84.170.161,TLSv1.2,240,Application Data
132,40.8801646,151.101.2.187,100.84.170.161,TCP,240,"[TCP Retransmission] 443  >  55283 [PSH, ACK] Seq=3835 Ack=41644 Win=3353 Len=186"
133,40.8802102,100.84.170.161,151.101.2.187,TCP,66,55283  >  443 [ACK] Seq=41644 Ack=4021 Win=512 Len=0 SLE=3835 SRE=4021
134,40.8865987,100.84.170.161,151.101.2.187,TLSv1.2,718,Application Data
135,40.8953844,151.101.2.187,100.84.170.161,TCP,56,443  >  55283 [ACK] Seq=4021 Ack=42308 Win=3353 Len=0
136,40.9064353,151.101.2.187,100.84.170.161,TLSv1.2,103,Application Data
137,40.9370074,151.101.2.187,100.84.170.161,TCP,103,"[TCP Retransmission] 443  >  55283 [PSH, ACK] Seq=4021 Ack=42308 Win=3353 Len=49"
138,40.9370618,100.84.170.161,151.101.2.187,TCP,66,55283  >  443 [ACK] Seq=42308 Ack=4070 Win=511 Len=0 SLE=4021 SRE=4070
139,41.1368449,100.84.170.161,151.101.2.187,TLSv1.2,2005,Application Data
140,41.1514176,151.101.2.187,100.84.170.161,TCP,56,443  >  55283 [ACK] Seq=4070 Ack=44259 Win=3358 Len=0
141,41.1589475,151.101.2.187,100.84.170.161,TLSv1.2,129,Application Data
142,41.2080018,100.84.170.161,151.101.2.187,TCP,54,55283  >  443 [ACK] Seq=44259 Ack=4145 Win=511 Len=0
143,41.2094141,151.101.2.187,100.84.170.161,TCP,129,"[TCP Spurious Retransmission] 443  >  55283 [PSH, ACK] Seq=4070 Ack=44259 Win=3358 Len=75"
144,41.2094799,100.84.170.161,151.101.2.187,TCP,66,[TCP Dup ACK 142#1] 55283  >  443 [ACK] Seq=44259 Ack=4145 Win=511 Len=0 SLE=4070 SRE=4145
145,43.0240306,100.84.170.161,151.101.2.187,TLSv1.2,1045,Application Data
146,43.0344347,151.101.2.187,100.84.170.161,TCP,56,443  >  55283 [ACK] Seq=4145 Ack=45250 Win=3364 Len=0
147,43.0408581,151.101.2.187,100.84.170.161,TLSv1.2,213,Application Data
148,43.0595783,100.84.170.161,151.101.2.187,TLSv1.2,1615,Application Data
149,43.0685155,151.101.2.187,100.84.170.161,TCP,56,443  >  55283 [ACK] Seq=4304 Ack=46811 Win=3370 Len=0
150,43.0715171,151.101.2.187,100.84.170.161,TLSv1.2,186,Application Data
151,43.1051637,151.101.2.187,100.84.170.161,TCP,186,"[TCP Retransmission] 443  >  55283 [PSH, ACK] Seq=4304 Ack=46811 Win=3370 Len=132"
152,43.1052216,100.84.170.161,151.101.2.187,TCP,66,55283  >  443 [ACK] Seq=46811 Ack=4436 Win=510 Len=0 SLE=4304 SRE=4436
153,43.5790247,100.84.170.161,151.101.2.187,TLSv1.2,1058,Application Data
154,43.5899354,151.101.2.187,100.84.170.161,TCP,56,443  >  55283 [ACK] Seq=4436 Ack=47815 Win=3376 Len=0
155,43.5924182,151.101.2.187,100.84.170.161,TLSv1.2,241,Application Data
156,43.6271374,151.101.2.187,100.84.170.161,TCP,241,"[TCP Retransmission] 443  >  55283 [PSH, ACK] Seq=4436 Ack=47815 Win=3376 Len=187"
157,43.6271752,100.84.170.161,151.101.2.187,TCP,66,55283  >  443 [ACK] Seq=47815 Ack=4623 Win=509 Len=0 SLE=4436 SRE=4623
158,43.8163398,100.84.170.161,151.101.2.187,TLSv1.2,1647,Application Data
159,43.8165982,100.84.170.161,151.101.2.187,TLSv1.2,1020,Application Data
160,43.8265613,151.101.2.187,100.84.170.161,TCP,56,443  >  55283 [ACK] Seq=4623 Ack=50374 Win=3387 Len=0
161,43.829491,151.101.2.187,100.84.170.161,TLSv1.2,130,Application Data
162,43.8298171,151.101.2.187,100.84.170.161,TLSv1.2,103,Application Data
163,43.8298445,100.84.170.161,151.101.2.187,TCP,54,55283  >  443 [ACK] Seq=50374 Ack=4748 Win=509 Len=0
164,44.1101804,100.84.170.161,151.101.2.187,TLSv1.2,1658,Application Data
165,44.1122038,100.84.170.161,151.101.2.187,TLSv1.2,1028,Application Data
166,44.113851,100.84.170.161,151.101.2.187,TLSv1.2,1640,Application Data
167,44.114419,100.84.170.161,151.101.2.187,TLSv1.2,1041,Application Data
168,44.1193727,151.101.2.187,100.84.170.161,TCP,56,443  >  55283 [ACK] Seq=4748 Ack=51978 Win=3393 Len=0
169,44.1212555,151.101.2.187,100.84.170.161,TCP,56,443  >  55283 [ACK] Seq=4748 Ack=52952 Win=3398 Len=0
170,44.1227987,151.101.2.187,100.84.170.161,TLSv1.2,103,Application Data
171,44.1230716,151.101.2.187,100.84.170.161,TCP,56,443  >  55283 [ACK] Seq=4797 Ack=54538 Win=3404 Len=0
172,44.1237094,151.101.2.187,100.84.170.161,TCP,56,443  >  55283 [ACK] Seq=4797 Ack=55525 Win=3410 Len=0
173,44.1255404,151.101.2.187,100.84.170.161,TLSv1.2,257,Application Data
174,44.1255936,100.84.170.161,151.101.2.187,TCP,54,55283  >  443 [ACK] Seq=55525 Ack=5000 Win=508 Len=0
175,44.1259086,151.101.2.187,100.84.170.161,TLSv1.2,130,Application Data
176,44.1265305,151.101.2.187,100.84.170.161,TLSv1.2,130,Application Data
177,44.1265768,100.84.170.161,151.101.2.187,TCP,54,55283  >  443 [ACK] Seq=55525 Ack=5152 Win=507 Len=0
178,44.2545467,100.84.170.161,151.101.2.187,TLSv1.2,1662,Application Data
179,44.2696878,100.84.170.161,151.101.2.187,TLSv1.2,1035,Application Data
180,44.274297,151.101.2.187,100.84.170.161,TCP,56,443  >  55283 [ACK] Seq=5152 Ack=57133 Win=3416 Len=0
181,44.2772675,151.101.2.187,100.84.170.161,TLSv1.2,130,Application Data
182,44.2773247,100.84.170.161,151.101.2.187,TCP,54,55283  >  443 [ACK] Seq=58114 Ack=5228 Win=513 Len=0
183,44.2790272,151.101.2.187,100.84.170.161,TCP,56,443  >  55283 [ACK] Seq=5228 Ack=58114 Win=3421 Len=0
184,44.2820984,151.101.2.187,100.84.170.161,TLSv1.2,130,Application Data
185,44.282173,100.84.170.161,151.101.2.187,TCP,54,55283  >  443 [ACK] Seq=58114 Ack=5304 Win=512 Len=0
186,44.3303841,100.84.170.161,151.101.2.187,TLSv1.2,1650,Application Data
187,44.3305546,100.84.170.161,151.101.2.187,TLSv1.2,1003,Application Data
188,44.3405335,151.101.2.187,100.84.170.161,TCP,56,443  >  55283 [ACK] Seq=5304 Ack=60659 Win=3433 Len=0
189,44.3434103,151.101.2.187,100.84.170.161,TLSv1.2,240,Application Data
190,44.3440856,151.101.2.187,100.84.170.161,TLSv1.2,130,Application Data
191,44.3441674,100.84.170.161,151.101.2.187,TCP,54,55283  >  443 [ACK] Seq=60659 Ack=5566 Win=511 Len=0
192,44.4242026,100.84.170.161,151.101.2.187,TLSv1.2,1726,Application Data
193,44.425719,100.84.170.161,151.101.2.187,TLSv1.2,953,Application Data
194,44.4355061,151.101.2.187,100.84.170.161,TCP,56,443  >  55283 [ACK] Seq=5566 Ack=62331 Win=3438 Len=0
195,44.4358309,151.101.2.187,100.84.170.161,TCP,56,443  >  55283 [ACK] Seq=5566 Ack=63230 Win=3444 Len=0
196,44.440752,151.101.2.187,100.84.170.161,TLSv1.2,213,Application Data
197,44.4410905,151.101.2.187,100.84.170.161,TLSv1.2,129,Application Data
198,44.4411258,100.84.170.161,151.101.2.187,TCP,54,55283  >  443 [ACK] Seq=63230 Ack=5800 Win=511 Len=0
199,45.0169323,100.84.170.161,151.101.2.187,TCP,55,[TCP Keep-Alive] 63540  >  443 [ACK] Seq=1 Ack=1 Win=509 Len=1
200,45.0279986,151.101.2.187,100.84.170.161,TCP,66,[TCP Keep-Alive ACK] 443  >  63540 [ACK] Seq=1 Ack=2 Win=285 Len=0 SLE=1 SRE=2
201,47.078987,100.84.170.161,151.101.2.187,TLSv1.2,1935,Application Data
202,47.0889499,151.101.2.187,100.84.170.161,TCP,56,443  >  55283 [ACK] Seq=5800 Ack=65111 Win=3450 Len=0
203,47.0917056,151.101.2.187,100.84.170.161,TLSv1.2,213,Application Data
204,47.1036884,100.84.170.161,151.101.2.187,TLSv1.2,717,Application Data
205,47.1125514,151.101.2.187,100.84.170.161,TCP,56,443  >  55283 [ACK] Seq=5959 Ack=65774 Win=3450 Len=0
206,47.1152867,151.101.2.187,100.84.170.161,TLSv1.2,130,Application Data
207,47.1451226,151.101.2.187,100.84.170.161,TCP,130,"[TCP Retransmission] 443  >  55283 [PSH, ACK] Seq=5959 Ack=65774 Win=3450 Len=76"
208,47.1451631,100.84.170.161,151.101.2.187,TCP,66,55283  >  443 [ACK] Seq=65774 Ack=6035 Win=510 Len=0 SLE=5959 SRE=6035
209,47.5558846,100.84.170.161,151.101.2.187,TLSv1.2,1932,Application Data
210,47.5648336,151.101.2.187,100.84.170.161,TCP,56,443  >  55283 [ACK] Seq=6035 Ack=67652 Win=3455 Len=0
211,47.5679248,151.101.2.187,100.84.170.161,TLSv1.2,368,Application Data
212,47.5972816,151.101.2.187,100.84.170.161,TCP,368,"[TCP Retransmission] 443  >  55283 [PSH, ACK] Seq=6035 Ack=67652 Win=3455 Len=314"
213,47.5973178,100.84.170.161,151.101.2.187,TCP,66,55283  >  443 [ACK] Seq=67652 Ack=6349 Win=508 Len=0 SLE=6035 SRE=6349
214,47.8560144,100.84.170.161,151.101.2.187,TLSv1.2,804,Application Data
215,47.8561757,100.84.170.161,151.101.2.187,TLSv1.2,1848,Application Data
216,47.8655203,151.101.2.187,100.84.170.161,TCP,56,443  >  55283 [ACK] Seq=6349 Ack=70196 Win=3467 Len=0
217,47.8893667,151.101.2.187,100.84.170.161,TLSv1.2,183,Application Data
218,47.9162041,151.101.2.187,100.84.170.161,TCP,183,"[TCP Retransmission] 443  >  55283 [PSH, ACK] Seq=6349 Ack=70196 Win=3467 Len=129"
219,47.9162486,100.84.170.161,151.101.2.187,TCP,66,55283  >  443 [ACK] Seq=70196 Ack=6478 Win=508 Len=0 SLE=6349 SRE=6478
220,48.0083164,100.84.170.161,151.101.2.187,TLSv1.2,805,Application Data
221,48.0084616,100.84.170.161,151.101.2.187,TLSv1.2,1857,Application Data
222,48.0088339,100.84.170.161,151.101.2.187,TLSv1.2,787,Application Data
223,48.0132337,100.84.170.161,151.101.2.187,TLSv1.2,1870,Application Data
224,48.0170542,151.101.2.187,100.84.170.161,TCP,56,443  >  55283 [ACK] Seq=6478 Ack=70947 Win=3473 Len=0
225,48.0174759,151.101.2.187,100.84.170.161,TCP,56,443  >  55283 [ACK] Seq=6478 Ack=72750 Win=3478 Len=0
226,48.0187163,151.101.2.187,100.84.170.161,TCP,56,443  >  55283 [ACK] Seq=6478 Ack=73483 Win=3484 Len=0
227,48.0206665,151.101.2.187,100.84.170.161,TLSv1.2,103,Application Data
228,48.0208583,151.101.2.187,100.84.170.161,TLSv1.2,130,Application Data
229,48.0208872,100.84.170.161,151.101.2.187,TCP,54,55283  >  443 [ACK] Seq=75299 Ack=6603 Win=507 Len=0
230,48.021175,151.101.2.187,100.84.170.161,TLSv1.2,130,Application Data
231,48.0219933,151.101.2.187,100.84.170.161,TCP,56,443  >  55283 [ACK] Seq=6679 Ack=75299 Win=3490 Len=0
232,48.0250661,151.101.2.187,100.84.170.161,TLSv1.2,130,Application Data
233,48.0251439,100.84.170.161,151.101.2.187,TCP,54,55283  >  443 [ACK] Seq=75299 Ack=6755 Win=513 Len=0
234,48.1249492,100.84.170.161,151.101.2.187,TLSv1.2,800,Application Data
235,48.1348221,151.101.2.187,100.84.170.161,TCP,56,443  >  55283 [ACK] Seq=6755 Ack=76045 Win=3495 Len=0
236,48.1376082,151.101.2.187,100.84.170.161,TLSv1.2,130,Application Data
237,48.165085,151.101.2.187,100.84.170.161,TCP,130,"[TCP Retransmission] 443  >  55283 [PSH, ACK] Seq=6755 Ack=76045 Win=3495 Len=76"
238,48.1651228,100.84.170.161,151.101.2.187,TCP,66,55283  >  443 [ACK] Seq=76045 Ack=6831 Win=512 Len=0 SLE=6755 SRE=6831
239,48.1898964,100.84.170.161,151.101.2.187,TLSv1.2,1868,Application Data
240,48.1911866,100.84.170.161,151.101.2.187,TLSv1.2,751,Application Data
241,48.199203,151.101.2.187,100.84.170.161,TCP,56,443  >  55283 [ACK] Seq=6831 Ack=77859 Win=3501 Len=0
242,48.200063,151.101.2.187,100.84.170.161,TCP,56,443  >  55283 [ACK] Seq=6831 Ack=78556 Win=3501 Len=0
243,48.2028238,151.101.2.187,100.84.170.161,TLSv1.2,213,Application Data
244,48.2033617,151.101.2.187,100.84.170.161,TLSv1.2,130,Application Data
245,48.2034126,100.84.170.161,151.101.2.187,TCP,54,55283  >  443 [ACK] Seq=78556 Ack=7066 Win=512 Len=0
246,48.33695,100.84.170.161,151.101.2.187,TLSv1.2,1935,Application Data
247,48.3396966,100.84.170.161,151.101.2.187,TLSv1.2,703,Application Data
248,48.3456562,151.101.2.187,100.84.170.161,TCP,56,443  >  55283 [ACK] Seq=7066 Ack=80437 Win=3507 Len=0
249,48.34838,151.101.2.187,100.84.170.161,TCP,56,443  >  55283 [ACK] Seq=7066 Ack=81086 Win=3507 Len=0
250,48.3523517,151.101.2.187,100.84.170.161,TLSv1.2,240,Application Data
251,48.3528963,151.101.2.187,100.84.170.161,TLSv1.2,174,Application Data
252,48.3529843,100.84.170.161,151.101.2.187,TCP,54,55283  >  443 [ACK] Seq=81086 Ack=7372 Win=510 Len=0
253,48.3917272,100.84.170.161,151.101.2.187,TLSv1.2,1935,Application Data
254,48.3949602,100.84.170.161,151.101.2.187,TLSv1.2,726,Application Data
255,48.4010562,151.101.2.187,100.84.170.161,TCP,56,443  >  55283 [ACK] Seq=7372 Ack=82967 Win=3512 Len=0
256,48.4028923,151.101.2.187,100.84.170.161,TLSv1.2,214,Application Data
257,48.4036724,151.101.2.187,100.84.170.161,TCP,56,443  >  55283 [ACK] Seq=7532 Ack=83639 Win=3512 Len=0
258,48.4062111,151.101.2.187,100.84.170.161,TLSv1.2,131,Application Data
259,48.4062712,100.84.170.161,151.101.2.187,TCP,54,55283  >  443 [ACK] Seq=83639 Ack=7609 Win=509 Len=0
260,48.4393756,100.84.170.161,151.101.2.187,TLSv1.2,1936,Application Data
261,48.4405872,100.84.170.161,151.101.2.187,TLSv1.2,720,Application Data
262,48.4480844,151.101.2.187,100.84.170.161,TCP,56,443  >  55283 [ACK] Seq=7609 Ack=85521 Win=3518 Len=0
263,48.449253,151.101.2.187,100.84.170.161,TCP,56,443  >  55283 [ACK] Seq=7609 Ack=86187 Win=3518 Len=0
264,48.4521206,151.101.2.187,100.84.170.161,TLSv1.2,129,Application Data
265,48.4535062,151.101.2.187,100.84.170.161,TLSv1.2,130,Application Data
266,48.4535685,100.84.170.161,151.101.2.187,TCP,54,55283  >  443 [ACK] Seq=86187 Ack=7760 Win=509 Len=0
267,48.7042655,100.84.170.161,151.101.2.187,TLSv1.2,1937,Application Data
268,48.7142412,151.101.2.187,100.84.170.161,TCP,56,443  >  55283 [ACK] Seq=7760 Ack=88070 Win=3524 Len=0
269,48.7178404,151.101.2.187,100.84.170.161,TLSv1.2,130,Application Data
270,48.725551,100.84.170.161,151.101.2.187,TLSv1.2,738,Application Data
271,48.7344062,151.101.2.187,100.84.170.161,TCP,56,443  >  55283 [ACK] Seq=7836 Ack=88754 Win=3524 Len=0
272,48.7377788,151.101.2.187,100.84.170.161,TLSv1.2,104,Application Data
273,48.7648354,151.101.2.187,100.84.170.161,TCP,104,"[TCP Retransmission] 443  >  55283 [PSH, ACK] Seq=7836 Ack=88754 Win=3524 Len=50"
274,48.7648854,100.84.170.161,151.101.2.187,TCP,66,55283  >  443 [ACK] Seq=88754 Ack=7886 Win=508 Len=0 SLE=7836 SRE=7886
275,48.8664914,100.84.170.161,151.101.2.187,TLSv1.2,1938,Application Data
276,48.8765852,151.101.2.187,100.84.170.161,TCP,56,443  >  55283 [ACK] Seq=7886 Ack=90638 Win=3530 Len=0
277,48.8795156,151.101.2.187,100.84.170.161,TLSv1.2,130,Application Data
278,48.9069874,151.101.2.187,100.84.170.161,TCP,130,"[TCP Retransmission] 443  >  55283 [PSH, ACK] Seq=7886 Ack=90638 Win=3530 Len=76"
279,48.9070301,100.84.170.161,151.101.2.187,TCP,66,55283  >  443 [ACK] Seq=90638 Ack=7962 Win=508 Len=0 SLE=7886 SRE=7962
280,49.1211748,100.84.170.161,151.101.2.187,TLSv1.2,757,Application Data
281,49.1307102,151.101.2.187,100.84.170.161,TCP,56,443  >  55283 [ACK] Seq=7962 Ack=91341 Win=3530 Len=0
282,49.1335924,151.101.2.187,100.84.170.161,TLSv1.2,104,Application Data
283,49.1611373,151.101.2.187,100.84.170.161,TCP,104,"[TCP Retransmission] 443  >  55283 [PSH, ACK] Seq=7962 Ack=91341 Win=3530 Len=50"
284,49.1611912,100.84.170.161,151.101.2.187,TCP,66,55283  >  443 [ACK] Seq=91341 Ack=8012 Win=508 Len=0 SLE=7962 SRE=8012
285,52.9549845,100.84.170.161,151.101.2.187,TLSv1.2,1919,Application Data
286,52.9652273,151.101.2.187,100.84.170.161,TCP,56,443  >  55283 [ACK] Seq=8012 Ack=93206 Win=3535 Len=0
287,52.9682573,151.101.2.187,100.84.170.161,TLSv1.2,214,Application Data
288,52.9695892,100.84.170.161,151.101.2.187,TLSv1.2,726,Application Data
289,52.9782876,151.101.2.187,100.84.170.161,TCP,56,443  >  55283 [ACK] Seq=8172 Ack=93878 Win=3535 Len=0
290,52.9811125,151.101.2.187,100.84.170.161,TLSv1.2,187,Application Data
291,53.0094755,151.101.2.187,100.84.170.161,TCP,187,"[TCP Retransmission] 443  >  55283 [PSH, ACK] Seq=8172 Ack=93878 Win=3535 Len=133"
292,53.0096696,100.84.170.161,151.101.2.187,TCP,66,55283  >  443 [ACK] Seq=93878 Ack=8305 Win=513 Len=0 SLE=8172 SRE=8305
293,54.5116519,100.84.170.161,151.101.2.187,TLSv1.2,1873,Application Data
294,54.5214585,100.84.170.161,151.101.2.187,TLSv1.2,738,Application Data
295,54.5220712,151.101.2.187,100.84.170.161,TCP,56,443  >  55283 [ACK] Seq=8305 Ack=95697 Win=3541 Len=0
296,54.5252936,151.101.2.187,100.84.170.161,TLSv1.2,214,Application Data
297,54.5305896,151.101.2.187,100.84.170.161,TCP,56,443  >  55283 [ACK] Seq=8465 Ack=96381 Win=3541 Len=0
298,54.5336381,151.101.2.187,100.84.170.161,TLSv1.2,104,Application Data
299,54.533732,100.84.170.161,151.101.2.187,TCP,54,55283  >  443 [ACK] Seq=96381 Ack=8515 Win=512 Len=0
300,54.553777,100.84.170.161,151.101.2.187,TLSv1.2,1937,Application Data
301,54.5634423,151.101.2.187,100.84.170.161,TCP,56,443  >  55283 [ACK] Seq=8515 Ack=98264 Win=3547 Len=0
302,54.5655581,151.101.2.187,100.84.170.161,TLSv1.2,104,Application Data
303,54.5948748,151.101.2.187,100.84.170.161,TCP,104,"[TCP Retransmission] 443  >  55283 [PSH, ACK] Seq=8515 Ack=98264 Win=3547 Len=50"
304,54.5949145,100.84.170.161,151.101.2.187,TCP,66,55283  >  443 [ACK] Seq=98264 Ack=8565 Win=512 Len=0 SLE=8515 SRE=8565
