"No.","Time","Source","Destination","Protocol","Length","Info"
"1","0.000000000","100.84.170.161","151.101.2.187","TLSv1.2","2495","Application Data"
"2","0.000162700","100.84.170.161","151.101.2.187","TLSv1.2","93","Application Data"
"3","0.022219400","100.84.170.161","151.101.2.187","TLSv1.2","2486","Application Data"
"4","0.025498600","100.84.170.161","151.101.2.187","TLSv1.2","2480","Application Data"
"5","0.028707500","100.84.170.161","151.101.2.187","TCP","1514","[TCP Retransmission] 64433  >  443 [PSH, ACK] Seq=5879 Ack=1 Win=8209 Len=1460"
"6","0.036675600","151.101.2.187","100.84.170.161","TCP","56","443  >  64433 [ACK] Seq=1 Ack=4913 Win=5695 Len=0"
"7","0.036946800","151.101.2.187","100.84.170.161","TLSv1.2","93","Application Data"
"8","0.037763200","151.101.2.187","100.84.170.161","TCP","56","443  >  64433 [ACK] Seq=40 Ack=7339 Win=5701 Len=0"
"9","0.038967600","151.101.2.187","100.84.170.161","TLSv1.2","240","Application Data"
"10","0.039049700","100.84.170.161","151.101.2.187","TCP","54","64433  >  443 [ACK] Seq=7339 Ack=226 Win=8208 Len=0"
"11","0.039310700","151.101.2.187","100.84.170.161","TLSv1.2","104","Application Data"
"12","0.039310700","151.101.2.187","100.84.170.161","TLSv1.2","125","Application Data"
"13","0.039360600","100.84.170.161","151.101.2.187","TCP","54","64433  >  443 [ACK] Seq=7339 Ack=347 Win=8207 Len=0"
"14","0.040318800","151.101.2.187","100.84.170.161","TCP","66","[TCP Dup ACK 8#1] 443  >  64433 [ACK] Seq=347 Ack=7339 Win=5701 Len=0 SLE=5879 SRE=7339"
"15","0.281540800","100.84.170.161","151.101.2.187","TLSv1.2","2480","Application Data"
"16","0.313924000","100.84.170.161","151.101.2.187","TCP","1514","[TCP Retransmission] 64433  >  443 [PSH, ACK] Seq=8305 Ack=347 Win=8207 Len=1460"
"17","0.329113100","151.101.2.187","100.84.170.161","TCP","56","443  >  64433 [ACK] Seq=347 Ack=9765 Win=5706 Len=0"
"18","0.329391400","151.101.2.187","100.84.170.161","TCP","66","[TCP Dup ACK 17#1] 443  >  64433 [ACK] Seq=347 Ack=9765 Win=5706 Len=0 SLE=8305 SRE=9765"
"19","0.330828000","151.101.2.187","100.84.170.161","TLSv1.2","240","Application Data"
"20","0.334084600","100.84.170.161","151.101.2.187","TLSv1.2","2489","Application Data"
"21","0.337403400","100.84.170.161","151.101.2.187","TLSv1.2","2494","Application Data"
"22","0.343831900","151.101.2.187","100.84.170.161","TCP","56","443  >  64433 [ACK] Seq=533 Ack=12200 Win=5712 Len=0"
"23","0.344922900","100.84.170.161","151.101.2.187","TLSv1.2","2495","Application Data"
"24","0.369044200","100.84.170.161","151.101.2.187","TCP","1514","[TCP Retransmission] 64433  >  443 [PSH, ACK] Seq=15621 Ack=533 Win=8207 Len=1460"
"25","0.391144000","151.101.2.187","100.84.170.161","TLSv1.2","131","Application Data"
"26","0.391144000","151.101.2.187","100.84.170.161","TCP","56","443  >  64433 [ACK] Seq=610 Ack=14640 Win=5718 Len=0"
"27","0.391144000","151.101.2.187","100.84.170.161","TLSv1.2","169","Application Data"
"28","0.391144000","151.101.2.187","100.84.170.161","TCP","169","[TCP Retransmission] 443  >  64433 [PSH, ACK] Seq=610 Ack=14640 Win=5718 Len=115"
"29","0.391435300","100.84.170.161","151.101.2.187","TCP","66","64433  >  443 [ACK] Seq=17081 Ack=725 Win=8212 Len=0 SLE=610 SRE=725"
"30","0.395243300","151.101.2.187","100.84.170.161","TCP","56","443  >  64433 [ACK] Seq=725 Ack=17081 Win=5724 Len=0"
"31","0.396732200","151.101.2.187","100.84.170.161","TCP","66","[TCP Dup ACK 30#1] 443  >  64433 [ACK] Seq=725 Ack=17081 Win=5724 Len=0 SLE=15621 SRE=17081"
"32","0.399200100","151.101.2.187","100.84.170.161","TLSv1.2","98","Application Data"
"33","0.447208000","100.84.170.161","151.101.2.187","TCP","54","64433  >  443 [ACK] Seq=17081 Ack=769 Win=8212 Len=0"
"34","0.455634100","151.101.2.187","100.84.170.161","TCP","98","[TCP Spurious Retransmission] 443  >  64433 [PSH, ACK] Seq=725 Ack=17081 Win=5724 Len=44"
"35","0.455672600","100.84.170.161","151.101.2.187","TCP","66","[TCP Dup ACK 33#1] 64433  >  443 [ACK] Seq=17081 Ack=769 Win=8212 Len=0 SLE=725 SRE=769"
"36","0.616428600","100.84.170.161","151.101.2.187","TLSv1.2","2477","Application Data"
"37","0.638639900","100.84.170.161","151.101.2.187","TLSv1.2","2483","Application Data"
"38","0.641045800","100.84.170.161","151.101.2.187","TLSv1.2","2479","Application Data"
"39","0.641308900","100.84.170.161","151.101.2.187","TLSv1.2","2482","Application Data"
"40","0.653242700","100.84.170.161","151.101.2.187","TCP","1514","[TCP Retransmission] 64433  >  443 [PSH, ACK] Seq=25326 Ack=769 Win=8212 Len=1460"
"41","0.653716700","151.101.2.187","100.84.170.161","TCP","56","443  >  64433 [ACK] Seq=769 Ack=19504 Win=5729 Len=0"
"42","0.653716700","151.101.2.187","100.84.170.161","TLSv1.2","297","Application Data"
"43","0.662560200","151.101.2.187","100.84.170.161","TCP","297","[TCP Retransmission] 443  >  64433 [PSH, ACK] Seq=769 Ack=19504 Win=5729 Len=243"
"44","0.662614000","100.84.170.161","151.101.2.187","TCP","66","64433  >  443 [ACK] Seq=26786 Ack=1012 Win=8211 Len=0 SLE=769 SRE=1012"
"45","0.662939400","151.101.2.187","100.84.170.161","TCP","56","443  >  64433 [ACK] Seq=1012 Ack=26786 Win=5750 Len=0"
"46","0.663948000","151.101.2.187","100.84.170.161","TCP","66","[TCP Dup ACK 45#1] 443  >  64433 [ACK] Seq=1012 Ack=26786 Win=5750 Len=0 SLE=25326 SRE=26786"
"47","0.666275800","151.101.2.187","100.84.170.161","TLSv1.2","125","Application Data"
"48","0.666430900","100.84.170.161","151.101.2.187","TCP","54","64433  >  443 [ACK] Seq=26786 Ack=1083 Win=8211 Len=0"
"49","0.667332300","151.101.2.187","100.84.170.161","TLSv1.2","124","Application Data"
"50","0.668111900","151.101.2.187","100.84.170.161","TLSv1.2","124","Application Data"
"51","0.668237600","100.84.170.161","151.101.2.187","TCP","54","64433  >  443 [ACK] Seq=26786 Ack=1223 Win=8210 Len=0"
"52","1.154313500","100.84.170.161","151.101.2.187","TLSv1.2","2495","Application Data"
"53","1.202843500","100.84.170.161","151.101.2.187","TCP","1514","[TCP Retransmission] 64433  >  443 [PSH, ACK] Seq=27767 Ack=1223 Win=8210 Len=1460"
"54","1.212869700","100.84.170.161","151.101.2.187","TLSv1.2","2494","Application Data"
"55","1.263166300","100.84.170.161","151.101.2.187","TLSv1.2","2494","Application Data"
"56","1.362621500","151.101.2.187","100.84.170.161","TCP","56","443  >  64433 [ACK] Seq=1223 Ack=29227 Win=5756 Len=0"
"57","1.362621500","151.101.2.187","100.84.170.161","TLSv1.2","131","Application Data"
"58","1.362621500","151.101.2.187","100.84.170.161","TCP","131","[TCP Retransmission] 443  >  64433 [PSH, ACK] Seq=1223 Ack=29227 Win=5756 Len=77"
"59","1.362621500","151.101.2.187","100.84.170.161","TCP","66","[TCP Dup ACK 56#1] 443  >  64433 [ACK] Seq=1300 Ack=29227 Win=5756 Len=0 SLE=27767 SRE=29227"
"60","1.362621500","151.101.2.187","100.84.170.161","TCP","56","443  >  64433 [ACK] Seq=1300 Ack=31667 Win=5762 Len=0"
"61","1.362621500","151.101.2.187","100.84.170.161","TLSv1.2","130","Application Data"
"62","1.362621500","151.101.2.187","100.84.170.161","TCP","56","443  >  64433 [ACK] Seq=1376 Ack=34107 Win=5767 Len=0"
"63","1.362621500","151.101.2.187","100.84.170.161","TLSv1.2","208","Application Data"
"64","1.362781500","100.84.170.161","151.101.2.187","TCP","66","64433  >  443 [ACK] Seq=34107 Ack=1300 Win=8210 Len=0 SLE=1223 SRE=1300"
"65","1.363008500","100.84.170.161","151.101.2.187","TCP","54","64433  >  443 [ACK] Seq=34107 Ack=1530 Win=8209 Len=0"
"66","1.396932000","100.84.170.161","151.101.2.187","TLSv1.2","2495","Application Data"
"67","1.420233900","151.101.2.187","100.84.170.161","TCP","56","443  >  64433 [ACK] Seq=1530 Ack=36548 Win=5773 Len=0"
"68","1.422106500","151.101.2.187","100.84.170.161","TLSv1.2","98","Application Data"
"69","1.469296800","100.84.170.161","151.101.2.187","TCP","54","64433  >  443 [ACK] Seq=36548 Ack=1574 Win=8209 Len=0"
"70","1.488658000","151.101.2.187","100.84.170.161","TCP","98","[TCP Spurious Retransmission] 443  >  64433 [PSH, ACK] Seq=1530 Ack=36548 Win=5773 Len=44"
"71","1.488705600","100.84.170.161","151.101.2.187","TCP","66","[TCP Dup ACK 69#1] 64433  >  443 [ACK] Seq=36548 Ack=1574 Win=8209 Len=0 SLE=1530 SRE=1574"
"72","1.577922500","100.84.170.161","151.101.2.187","TLSv1.2","2494","Application Data"
"73","1.578716300","100.84.170.161","151.101.2.187","TLSv1.2","2495","Application Data"
"74","1.625761000","151.101.2.187","100.84.170.161","TCP","56","443  >  64433 [ACK] Seq=1574 Ack=41429 Win=5788 Len=0"
"75","1.628373000","151.101.2.187","100.84.170.161","TLSv1.2","98","Application Data"
"76","1.628712000","151.101.2.187","100.84.170.161","TLSv1.2","98","Application Data"
"77","1.628754300","100.84.170.161","151.101.2.187","TCP","54","64433  >  443 [ACK] Seq=41429 Ack=1662 Win=8208 Len=0"
"78","1.679596600","100.84.170.161","151.101.2.187","TLSv1.2","2499","Application Data"
"79","1.679830200","100.84.170.161","151.101.2.187","TLSv1.2","2499","Application Data"
"80","1.679983700","100.84.170.161","151.101.2.187","TLSv1.2","2501","Application Data"
"81","1.694295700","151.101.2.187","100.84.170.161","TCP","56","443  >  64433 [ACK] Seq=1662 Ack=48766 Win=5805 Len=0"
"82","1.697092400","151.101.2.187","100.84.170.161","TLSv1.2","130","Application Data"
"83","1.697470600","151.101.2.187","100.84.170.161","TLSv1.2","130","Application Data"
"84","1.697534200","100.84.170.161","151.101.2.187","TCP","54","64433  >  443 [ACK] Seq=48766 Ack=1814 Win=8208 Len=0"
"85","1.698234700","151.101.2.187","100.84.170.161","TLSv1.2","131","Application Data"
"86","1.739287900","100.84.170.161","151.101.2.187","TCP","54","64433  >  443 [ACK] Seq=48766 Ack=1891 Win=8207 Len=0"
"87","1.762519800","151.101.2.187","100.84.170.161","TCP","131","[TCP Spurious Retransmission] 443  >  64433 [PSH, ACK] Seq=1814 Ack=48766 Win=5805 Len=77"
"88","1.762561300","100.84.170.161","151.101.2.187","TCP","66","[TCP Dup ACK 86#1] 64433  >  443 [ACK] Seq=48766 Ack=1891 Win=8207 Len=0 SLE=1814 SRE=1891"
"89","1.796820100","100.84.170.161","151.101.2.187","TLSv1.2","2480","Application Data"
"90","1.831625600","151.101.2.187","100.84.170.161","TCP","56","443  >  64433 [ACK] Seq=1891 Ack=51192 Win=5811 Len=0"
"91","1.834079100","151.101.2.187","100.84.170.161","TLSv1.2","104","Application Data"
"92","1.880272000","100.84.170.161","151.101.2.187","TCP","54","64433  >  443 [ACK] Seq=51192 Ack=1941 Win=8207 Len=0"
"93","1.891477800","151.101.2.187","100.84.170.161","TCP","104","[TCP Spurious Retransmission] 443  >  64433 [PSH, ACK] Seq=1891 Ack=51192 Win=5811 Len=50"
"94","1.891515000","100.84.170.161","151.101.2.187","TCP","66","[TCP Dup ACK 92#1] 64433  >  443 [ACK] Seq=51192 Ack=1941 Win=8207 Len=0 SLE=1891 SRE=1941"
"95","2.105780100","100.84.170.161","151.101.2.187","TLSv1.2","1936","Application Data"
"96","2.115439000","151.101.2.187","100.84.170.161","TCP","56","443  >  64433 [ACK] Seq=1941 Ack=53074 Win=5817 Len=0"
"97","2.187230400","151.101.2.187","100.84.170.161","TLSv1.2","484","Application Data"
"98","2.187581000","151.101.2.187","100.84.170.161","TCP","1510","443  >  64433 [ACK] Seq=2371 Ack=53074 Win=5817 Len=1456 [TCP PDU reassembled in 100]"
"99","2.187623900","100.84.170.161","151.101.2.187","TCP","54","64433  >  443 [ACK] Seq=53074 Ack=3827 Win=8212 Len=0"
"100","2.187873300","151.101.2.187","100.84.170.161","TLSv1.2","523","Application Data"
"101","2.188461600","100.84.170.161","151.101.2.187","TLSv1.2","89","Application Data"
"102","2.234353800","151.101.2.187","100.84.170.161","TCP","56","443  >  64433 [ACK] Seq=4296 Ack=53109 Win=5817 Len=0"
"103","2.241172100","100.84.170.161","151.101.2.187","TLSv1.2","964","Application Data"
"104","2.250816800","151.101.2.187","100.84.170.161","TCP","56","443  >  64433 [ACK] Seq=4296 Ack=54019 Win=5817 Len=0"
"105","2.253719100","151.101.2.187","100.84.170.161","TLSv1.2","445","Application Data"
"106","2.303206700","100.84.170.161","151.101.2.187","TCP","54","64433  >  443 [ACK] Seq=54019 Ack=4687 Win=8209 Len=0"
"107","2.303215100","151.101.2.187","100.84.170.161","TCP","445","[TCP Spurious Retransmission] 443  >  64433 [PSH, ACK] Seq=4296 Ack=54019 Win=5817 Len=391"
"108","2.303247500","100.84.170.161","151.101.2.187","TCP","66","[TCP Dup ACK 106#1] 64433  >  443 [ACK] Seq=54019 Ack=4687 Win=8209 Len=0 SLE=4296 SRE=4687"
"109","2.354754800","100.84.170.161","151.101.2.187","TLSv1.2","1684","Application Data"
"110","2.424772300","100.84.170.161","151.101.2.187","TCP","1514","[TCP Retransmission] 64433  >  443 [PSH, ACK] Seq=54189 Ack=4687 Win=8209 Len=1460"
"111","2.436516900","151.101.2.187","100.84.170.161","TCP","56","443  >  64433 [ACK] Seq=4687 Ack=55649 Win=5822 Len=0"
"112","2.436807100","151.101.2.187","100.84.170.161","TLSv1.2","125","Application Data"
"113","2.444136700","151.101.2.187","100.84.170.161","TCP","66","[TCP Dup ACK 111#1] 443  >  64433 [ACK] Seq=4758 Ack=55649 Win=5822 Len=0 SLE=54189 SRE=55649"
"114","2.489343800","100.84.170.161","151.101.2.187","TCP","54","64433  >  443 [ACK] Seq=55649 Ack=4758 Win=8208 Len=0"
"115","2.494964300","151.101.2.187","100.84.170.161","TCP","125","[TCP Spurious Retransmission] 443  >  64433 [PSH, ACK] Seq=4687 Ack=55649 Win=5822 Len=71"
"116","2.495013700","100.84.170.161","151.101.2.187","TCP","66","[TCP Dup ACK 114#1] 64433  >  443 [ACK] Seq=55649 Ack=4758 Win=8208 Len=0 SLE=4687 SRE=4758"
"117","2.597748500","100.84.170.161","151.101.2.187","TLSv1.2","1000","Application Data"
"118","2.608284900","151.101.2.187","100.84.170.161","TCP","56","443  >  64433 [ACK] Seq=4758 Ack=56595 Win=5822 Len=0"
"119","2.611144500","151.101.2.187","100.84.170.161","TLSv1.2","98","Application Data"
"120","2.641684700","100.84.170.161","151.101.2.187","TLSv1.2","1704","Application Data"
"121","2.651161500","151.101.2.187","100.84.170.161","TCP","56","443  >  64433 [ACK] Seq=4802 Ack=58245 Win=5828 Len=0"
"122","2.655284500","151.101.2.187","100.84.170.161","TLSv1.2","125","Application Data"
"123","2.706308600","100.84.170.161","151.101.2.187","TCP","54","64433  >  443 [ACK] Seq=58245 Ack=4873 Win=8208 Len=0"
"124","2.706469100","151.101.2.187","100.84.170.161","TCP","125","[TCP Spurious Retransmission] 443  >  64433 [PSH, ACK] Seq=4802 Ack=58245 Win=5828 Len=71"
"125","2.706504800","100.84.170.161","151.101.2.187","TCP","66","[TCP Dup ACK 123#1] 64433  >  443 [ACK] Seq=58245 Ack=4873 Win=8208 Len=0 SLE=4802 SRE=4873"
"126","2.894076600","100.84.170.161","151.101.2.187","TLSv1.2","1001","Application Data"
"127","2.903878400","151.101.2.187","100.84.170.161","TCP","56","443  >  64433 [ACK] Seq=4873 Ack=59192 Win=5828 Len=0"
"128","2.906961000","151.101.2.187","100.84.170.161","TLSv1.2","104","Application Data"
"129","2.952661400","100.84.170.161","151.101.2.187","TCP","54","64433  >  443 [ACK] Seq=59192 Ack=4923 Win=8208 Len=0"
"130","2.958817800","151.101.2.187","100.84.170.161","TCP","104","[TCP Spurious Retransmission] 443  >  64433 [PSH, ACK] Seq=4873 Ack=59192 Win=5828 Len=50"
"131","2.958953700","100.84.170.161","151.101.2.187","TCP","66","[TCP Dup ACK 129#1] 64433  >  443 [ACK] Seq=59192 Ack=4923 Win=8208 Len=0 SLE=4873 SRE=4923"
"132","3.420602100","100.84.170.161","151.101.2.187","TLSv1.2","1715","Application Data"
"133","3.420727400","100.84.170.161","151.101.2.187","TLSv1.2","960","Application Data"
"134","3.431216300","151.101.2.187","100.84.170.161","TCP","56","443  >  64433 [ACK] Seq=4923 Ack=61759 Win=5834 Len=0"
"135","3.433693100","151.101.2.187","100.84.170.161","TLSv1.2","234","Application Data"
"136","3.433903200","151.101.2.187","100.84.170.161","TLSv1.2","130","Application Data"
"137","3.433929600","100.84.170.161","151.101.2.187","TCP","54","64433  >  443 [ACK] Seq=61759 Ack=5179 Win=8207 Len=0"
"138","3.620269500","100.84.170.161","151.101.66.187","TLSv1.2","175","Application Data"
"139","3.620388200","100.84.170.161","151.101.66.187","TLSv1.2","93","Application Data"
"140","3.631577200","151.101.66.187","100.84.170.161","TCP","56","443  >  50935 [ACK] Seq=1 Ack=161 Win=281 Len=0"
"141","3.631883500","151.101.66.187","100.84.170.161","TLSv1.2","93","Application Data"
"142","3.633409600","151.101.66.187","100.84.170.161","TLSv1.2","409","Application Data"
"143","3.633472200","100.84.170.161","151.101.66.187","TCP","54","50935  >  443 [ACK] Seq=161 Ack=395 Win=510 Len=0"
"144","3.665274700","100.84.170.161","151.101.2.187","TLSv1.2","1723","Application Data"
"145","3.674864000","151.101.2.187","100.84.170.161","TCP","56","443  >  64433 [ACK] Seq=5179 Ack=63428 Win=5840 Len=0"
"146","3.677800500","151.101.2.187","100.84.170.161","TLSv1.2","130","Application Data"
"147","3.726410200","151.101.2.187","100.84.170.161","TCP","130","[TCP Retransmission] 443  >  64433 [PSH, ACK] Seq=5179 Ack=63428 Win=5840 Len=76"
"148","3.726448100","100.84.170.161","151.101.2.187","TCP","66","64433  >  443 [ACK] Seq=63428 Ack=5255 Win=8206 Len=0 SLE=5179 SRE=5255"
"149","3.796872700","100.84.170.161","151.101.2.187","TLSv1.2","990","Application Data"
"150","3.801506700","100.84.170.161","151.101.2.187","TLSv1.2","1684","Application Data"
"151","3.806739200","151.101.2.187","100.84.170.161","TCP","56","443  >  64433 [ACK] Seq=5255 Ack=64364 Win=5840 Len=0"
"152","3.807114600","100.84.170.161","151.101.2.187","TLSv1.2","991","Application Data"
"153","3.809207400","151.101.2.187","100.84.170.161","TLSv1.2","104","Application Data"
"154","3.809274600","100.84.170.161","151.101.2.187","TCP","54","64433  >  443 [ACK] Seq=66931 Ack=5305 Win=8212 Len=0"
"155","3.810510600","151.101.2.187","100.84.170.161","TCP","56","443  >  64433 [ACK] Seq=5305 Ack=65994 Win=5845 Len=0"
"156","3.813357700","151.101.2.187","100.84.170.161","TLSv1.2","98","Application Data"
"157","3.813414000","100.84.170.161","151.101.2.187","TCP","54","64433  >  443 [ACK] Seq=66931 Ack=5349 Win=8212 Len=0"
"158","3.816057000","151.101.2.187","100.84.170.161","TCP","56","443  >  64433 [ACK] Seq=5349 Ack=66931 Win=5845 Len=0"
"159","3.819275700","100.84.170.161","151.101.2.187","TLSv1.2","1673","Application Data"
"160","3.819324700","151.101.2.187","100.84.170.161","TLSv1.2","129","Application Data"
"161","3.828386500","151.101.2.187","100.84.170.161","TCP","56","443  >  64433 [ACK] Seq=5424 Ack=68550 Win=5851 Len=0"
"162","3.831086100","151.101.2.187","100.84.170.161","TLSv1.2","129","Application Data"
"163","3.831227600","100.84.170.161","151.101.2.187","TCP","54","64433  >  443 [ACK] Seq=68550 Ack=5499 Win=8211 Len=0"
"164","3.851876700","100.84.170.161","151.101.2.187","TLSv1.2","985","Application Data"
"165","3.852080200","100.84.170.161","151.101.2.187","TLSv1.2","1670","Application Data"
"166","3.861055800","151.101.2.187","100.84.170.161","TCP","56","443  >  64433 [ACK] Seq=5499 Ack=69481 Win=5851 Len=0"
"167","3.861567400","151.101.2.187","100.84.170.161","TCP","56","443  >  64433 [ACK] Seq=5499 Ack=71097 Win=5857 Len=0"
"168","3.863535800","151.101.2.187","100.84.170.161","TLSv1.2","125","Application Data"
"169","3.864100100","151.101.2.187","100.84.170.161","TLSv1.2","130","Application Data"
"170","3.864160600","100.84.170.161","151.101.2.187","TCP","54","64433  >  443 [ACK] Seq=71097 Ack=5646 Win=8211 Len=0"
"171","9.655115600","100.84.170.161","151.101.2.187","TLSv1.2","1030","Application Data"
"172","9.663725000","100.84.170.161","151.101.2.187","TLSv1.2","1698","Application Data"
"173","9.665509600","151.101.2.187","100.84.170.161","TCP","56","443  >  64433 [ACK] Seq=5646 Ack=72073 Win=5857 Len=0"
"174","9.666072700","100.84.170.161","151.101.2.187","TLSv1.2","992","Application Data"
"175","9.667104100","151.101.2.187","100.84.170.161","TLSv1.2","220","Application Data"
"176","9.672994800","151.101.2.187","100.84.170.161","TCP","56","443  >  64433 [ACK] Seq=5812 Ack=73717 Win=5862 Len=0"
"177","9.675352300","151.101.2.187","100.84.170.161","TCP","56","443  >  64433 [ACK] Seq=5812 Ack=74655 Win=5862 Len=0"
"178","9.675854100","151.101.2.187","100.84.170.161","TLSv1.2","168","Application Data"
"179","9.675906000","100.84.170.161","151.101.2.187","TCP","54","64433  >  443 [ACK] Seq=74655 Ack=5926 Win=8210 Len=0"
"180","9.678164400","151.101.2.187","100.84.170.161","TLSv1.2","291","Application Data"
"181","9.725194600","100.84.170.161","151.101.2.187","TCP","54","64433  >  443 [ACK] Seq=74655 Ack=6163 Win=8209 Len=0"
"182","9.725478300","151.101.2.187","100.84.170.161","TCP","291","[TCP Spurious Retransmission] 443  >  64433 [PSH, ACK] Seq=5926 Ack=74655 Win=5862 Len=237"
"183","9.725518500","100.84.170.161","151.101.2.187","TCP","66","[TCP Dup ACK 181#1] 64433  >  443 [ACK] Seq=74655 Ack=6163 Win=8209 Len=0 SLE=5926 SRE=6163"
"184","9.774224200","100.84.170.161","151.101.2.187","TLSv1.2","1706","Application Data"
"185","9.783696500","151.101.2.187","100.84.170.161","TCP","56","443  >  64433 [ACK] Seq=6163 Ack=76307 Win=5868 Len=0"
"186","9.787764100","151.101.2.187","100.84.170.161","TLSv1.2","131","Application Data"
"187","9.828605500","151.101.2.187","100.84.170.161","TCP","131","[TCP Retransmission] 443  >  64433 [PSH, ACK] Seq=6163 Ack=76307 Win=5868 Len=77"
"188","9.828690000","100.84.170.161","151.101.2.187","TCP","66","64433  >  443 [ACK] Seq=76307 Ack=6240 Win=8208 Len=0 SLE=6163 SRE=6240"
"189","9.877633000","100.84.170.161","151.101.2.187","TLSv1.2","1012","Application Data"
"190","9.887354200","151.101.2.187","100.84.170.161","TCP","56","443  >  64433 [ACK] Seq=6240 Ack=77265 Win=5868 Len=0"
"191","9.888268000","100.84.170.161","151.101.2.187","TLSv1.2","1706","Application Data"
"192","9.889711200","151.101.2.187","100.84.170.161","TLSv1.2","125","Application Data"
"193","9.897525800","151.101.2.187","100.84.170.161","TCP","56","443  >  64433 [ACK] Seq=6311 Ack=78917 Win=5874 Len=0"
"194","9.900257600","151.101.2.187","100.84.170.161","TLSv1.2","130","Application Data"
"195","9.900311400","100.84.170.161","151.101.2.187","TCP","54","64433  >  443 [ACK] Seq=78917 Ack=6387 Win=8208 Len=0"
"196","10.107442600","100.84.170.161","151.101.2.187","TLSv1.2","965","Application Data"
"197","10.118819900","151.101.2.187","100.84.170.161","TCP","56","443  >  64433 [ACK] Seq=6387 Ack=79828 Win=5874 Len=0"
"198","10.122997900","151.101.2.187","100.84.170.161","TLSv1.2","167","Application Data"
"199","10.122997900","151.101.2.187","100.84.170.161","TLSv1.2","471","Application Data"
"200","10.123075000","100.84.170.161","151.101.2.187","TCP","54","64433  >  443 [ACK] Seq=79828 Ack=6917 Win=8212 Len=0"
"201","10.124844600","100.84.170.161","151.101.2.187","TLSv1.2","89","Application Data"
"202","10.134638300","151.101.2.187","100.84.170.161","TCP","56","443  >  64433 [ACK] Seq=6917 Ack=79863 Win=5874 Len=0"
"203","10.141020200","100.84.170.161","151.101.2.187","TLSv1.2","1701","Application Data"
"204","10.151404000","151.101.2.187","100.84.170.161","TCP","56","443  >  64433 [ACK] Seq=6917 Ack=81510 Win=5879 Len=0"
"205","10.154382200","151.101.2.187","100.84.170.161","TLSv1.2","131","Application Data"
"206","10.193247300","151.101.2.187","100.84.170.161","TCP","131","[TCP Retransmission] 443  >  64433 [PSH, ACK] Seq=6917 Ack=81510 Win=5879 Len=77"
"207","10.193294100","100.84.170.161","151.101.2.187","TCP","66","64433  >  443 [ACK] Seq=81510 Ack=6994 Win=8212 Len=0 SLE=6917 SRE=6994"
"208","10.215911000","100.84.170.161","151.101.2.187","TLSv1.2","978","Application Data"
"209","10.216074700","100.84.170.161","151.101.2.187","TLSv1.2","1649","Application Data"
"210","10.225295700","151.101.2.187","100.84.170.161","TCP","56","443  >  64433 [ACK] Seq=6994 Ack=82434 Win=5879 Len=0"
"211","10.226019800","151.101.2.187","100.84.170.161","TCP","56","443  >  64433 [ACK] Seq=6994 Ack=84029 Win=5885 Len=0"
"212","10.227514100","151.101.2.187","100.84.170.161","TLSv1.2","162","Application Data"
"213","10.227846600","151.101.2.187","100.84.170.161","TCP","1510","443  >  64433 [ACK] Seq=7102 Ack=84029 Win=5885 Len=1456 [TCP PDU reassembled in 215]"
"214","10.227885200","100.84.170.161","151.101.2.187","TCP","54","64433  >  443 [ACK] Seq=84029 Ack=8558 Win=8212 Len=0"
"215","10.228869500","151.101.2.187","100.84.170.161","TLSv1.2","883","Application Data"
"216","10.228869500","151.101.2.187","100.84.170.161","TLSv1.2","155","Application Data"
"217","10.228869500","151.101.2.187","100.84.170.161","TLSv1.2","452","Application Data"
"218","10.228949600","100.84.170.161","151.101.2.187","TCP","54","64433  >  443 [ACK] Seq=84029 Ack=9886 Win=8207 Len=0"
"219","10.346399900","100.84.170.161","151.101.2.187","TLSv1.2","1005","Application Data"
"220","10.350802500","100.84.170.161","151.101.2.187","TLSv1.2","1683","Application Data"
"221","10.351269500","100.84.170.161","151.101.2.187","TLSv1.2","993","Application Data"
"222","10.351594000","100.84.170.161","151.101.2.187","TLSv1.2","1694","Application Data"
"223","10.351890900","100.84.170.161","151.101.2.187","TLSv1.2","992","Application Data"
"224","10.356060700","151.101.2.187","100.84.170.161","TCP","56","443  >  64433 [ACK] Seq=9886 Ack=84980 Win=5885 Len=0"
"225","10.358810800","151.101.2.187","100.84.170.161","TLSv1.2","241","Application Data"
"226","10.358866100","100.84.170.161","151.101.2.187","TCP","54","64433  >  443 [ACK] Seq=90126 Ack=10073 Win=8212 Len=0"
"227","10.360230500","151.101.2.187","100.84.170.161","TCP","56","443  >  64433 [ACK] Seq=10073 Ack=86609 Win=5891 Len=0"
"228","10.360836700","151.101.2.187","100.84.170.161","TCP","56","443  >  64433 [ACK] Seq=10073 Ack=89188 Win=5897 Len=0"
"229","10.361563000","151.101.2.187","100.84.170.161","TCP","56","443  >  64433 [ACK] Seq=10073 Ack=90126 Win=5897 Len=0"
"230","10.371233200","151.101.2.187","100.84.170.161","TLSv1.2","179","Application Data"
"231","10.371293400","100.84.170.161","151.101.2.187","TCP","54","64433  >  443 [ACK] Seq=90126 Ack=10198 Win=8212 Len=0"
"232","10.371474600","151.101.2.187","100.84.170.161","TLSv1.2","124","Application Data"
"233","10.371780500","151.101.2.187","100.84.170.161","TLSv1.2","174","Application Data"
"234","10.371807700","100.84.170.161","151.101.2.187","TCP","54","64433  >  443 [ACK] Seq=90126 Ack=10388 Win=8211 Len=0"
"235","16.104357700","100.84.170.161","151.101.2.187","TLSv1.2","2385","Application Data"
"236","16.106799700","100.84.170.161","151.101.2.187","TLSv1.2","2553","Application Data"
"237","16.114154400","151.101.2.187","100.84.170.161","TCP","56","443  >  64433 [ACK] Seq=10388 Ack=92457 Win=5902 Len=0"
"238","16.116929600","151.101.2.187","100.84.170.161","TCP","56","443  >  64433 [ACK] Seq=10388 Ack=94956 Win=5908 Len=0"
"239","16.117198100","151.101.2.187","100.84.170.161","TLSv1.2","401","Application Data"
"240","16.119314800","151.101.2.187","100.84.170.161","TLSv1.2","125","Application Data"
"241","16.119383200","100.84.170.161","151.101.2.187","TCP","54","64433  >  443 [ACK] Seq=94956 Ack=10806 Win=8209 Len=0"
"242","16.163580500","100.84.170.161","151.101.2.187","TLSv1.2","2541","Application Data"
"243","16.168350000","100.84.170.161","151.101.2.187","TLSv1.2","2538","Application Data"
"244","16.174099200","151.101.2.187","100.84.170.161","TCP","56","443  >  64433 [ACK] Seq=10806 Ack=97443 Win=5914 Len=0"
"245","16.176359500","151.101.2.187","100.84.170.161","TLSv1.2","130","Application Data"
"246","16.177525500","151.101.2.187","100.84.170.161","TCP","56","443  >  64433 [ACK] Seq=10882 Ack=99927 Win=5919 Len=0"
"247","16.179651100","151.101.2.187","100.84.170.161","TLSv1.2","124","Application Data"
"248","16.179705700","100.84.170.161","151.101.2.187","TCP","54","64433  >  443 [ACK] Seq=99927 Ack=10952 Win=8209 Len=0"
"249","20.470890000","100.84.170.161","151.101.2.187","TLSv1.2","2438","Application Data"
"250","20.482252300","151.101.2.187","100.84.170.161","TCP","56","443  >  64433 [ACK] Seq=10952 Ack=102311 Win=5925 Len=0"
"251","20.484954300","151.101.2.187","100.84.170.161","TLSv1.2","214","Application Data"
"252","20.516021100","151.101.2.187","100.84.170.161","TCP","214","[TCP Retransmission] 443  >  64433 [PSH, ACK] Seq=10952 Ack=102311 Win=5925 Len=160"
"253","20.516066800","100.84.170.161","151.101.2.187","TCP","66","64433  >  443 [ACK] Seq=102311 Ack=11112 Win=8208 Len=0 SLE=10952 SRE=11112"
"254","20.517825900","100.84.170.161","151.101.2.187","TLSv1.2","2423","Application Data"
"255","20.527158600","151.101.2.187","100.84.170.161","TCP","56","443  >  64433 [ACK] Seq=11112 Ack=104680 Win=5931 Len=0"
"256","20.529670600","151.101.2.187","100.84.170.161","TLSv1.2","130","Application Data"
"257","20.534608200","100.84.170.161","151.101.2.187","TLSv1.2","2437","Application Data"
"258","20.544028200","151.101.2.187","100.84.170.161","TCP","56","443  >  64433 [ACK] Seq=11188 Ack=107063 Win=5936 Len=0"
"259","20.546614800","151.101.2.187","100.84.170.161","TLSv1.2","125","Application Data"
"260","20.577528900","151.101.2.187","100.84.170.161","TCP","125","[TCP Retransmission] 443  >  64433 [PSH, ACK] Seq=11188 Ack=107063 Win=5936 Len=71"
"261","20.577569900","100.84.170.161","151.101.2.187","TCP","66","64433  >  443 [ACK] Seq=107063 Ack=11259 Win=8207 Len=0 SLE=11188 SRE=11259"
"262","21.305710100","100.84.170.161","151.101.2.187","TLSv1.2","2441","Application Data"
"263","21.315145000","151.101.2.187","100.84.170.161","TCP","56","443  >  64433 [ACK] Seq=11259 Ack=109450 Win=5942 Len=0"
"264","21.317603000","151.101.2.187","100.84.170.161","TLSv1.2","241","Application Data"
"265","21.349304400","151.101.2.187","100.84.170.161","TCP","241","[TCP Retransmission] 443  >  64433 [PSH, ACK] Seq=11259 Ack=109450 Win=5942 Len=187"
"266","21.349343500","100.84.170.161","151.101.2.187","TCP","66","64433  >  443 [ACK] Seq=109450 Ack=11446 Win=8207 Len=0 SLE=11259 SRE=11446"
"267","21.454473500","100.84.170.161","151.101.2.187","TLSv1.2","2443","Application Data"
"268","21.456784700","100.84.170.161","151.101.2.187","TLSv1.2","2429","Application Data"
"269","21.464194400","100.84.170.161","151.101.2.187","TLSv1.2","2444","Application Data"
"270","21.465485600","151.101.2.187","100.84.170.161","TCP","56","443  >  64433 [ACK] Seq=11446 Ack=111839 Win=5948 Len=0"
"271","21.466030800","151.101.2.187","100.84.170.161","TCP","56","443  >  64433 [ACK] Seq=11446 Ack=114214 Win=5954 Len=0"
"272","21.468027400","151.101.2.187","100.84.170.161","TLSv1.2","98","Application Data"
"273","21.469215600","151.101.2.187","100.84.170.161","TLSv1.2","104","Application Data"
"274","21.469270800","100.84.170.161","151.101.2.187","TCP","54","64433  >  443 [ACK] Seq=116604 Ack=11540 Win=8212 Len=0"
"275","21.473308700","151.101.2.187","100.84.170.161","TCP","56","443  >  64433 [ACK] Seq=11540 Ack=116604 Win=5959 Len=0"
"276","21.476350600","151.101.2.187","100.84.170.161","TLSv1.2","98","Application Data"
"277","21.509435200","151.101.2.187","100.84.170.161","TCP","98","[TCP Retransmission] 443  >  64433 [PSH, ACK] Seq=11540 Ack=116604 Win=5959 Len=44"
"278","21.509480800","100.84.170.161","151.101.2.187","TCP","66","64433  >  443 [ACK] Seq=116604 Ack=11584 Win=8212 Len=0 SLE=11540 SRE=11584"
"279","22.048652100","100.84.170.161","151.101.2.187","TLSv1.2","2446","Application Data"
"280","22.059547700","151.101.2.187","100.84.170.161","TCP","56","443  >  64433 [ACK] Seq=11584 Ack=118996 Win=5965 Len=0"
"281","22.062004200","151.101.2.187","100.84.170.161","TLSv1.2","131","Application Data"
"282","22.092273100","151.101.2.187","100.84.170.161","TCP","131","[TCP Retransmission] 443  >  64433 [PSH, ACK] Seq=11584 Ack=118996 Win=5965 Len=77"
"283","22.092378600","100.84.170.161","151.101.2.187","TCP","66","64433  >  443 [ACK] Seq=118996 Ack=11661 Win=8212 Len=0 SLE=11584 SRE=11661"
"284","23.414903700","100.84.170.161","151.101.2.187","TLSv1.2","2378","Application Data"
"285","23.424534500","151.101.2.187","100.84.170.161","TCP","56","443  >  64433 [ACK] Seq=11661 Ack=121320 Win=5971 Len=0"
"286","23.437031700","151.101.2.187","100.84.170.161","TLSv1.2","481","Application Data"
"287","23.439574800","100.84.170.161","151.101.2.187","TLSv1.2","89","Application Data"
"288","23.449810000","151.101.2.187","100.84.170.161","TCP","56","443  >  64433 [ACK] Seq=12088 Ack=121355 Win=5971 Len=0"
"289","28.530075600","100.84.170.161","151.101.2.187","TLSv1.2","2429","Application Data"
"290","28.533258900","100.84.170.161","151.101.2.187","TLSv1.2","2379","Application Data"
"291","28.539299600","151.101.2.187","100.84.170.161","TCP","56","443  >  64433 [ACK] Seq=12088 Ack=123730 Win=5976 Len=0"
"292","28.542018700","151.101.2.187","100.84.170.161","TLSv1.2","373","Application Data"
"293","28.543267500","151.101.2.187","100.84.170.161","TCP","56","443  >  64433 [ACK] Seq=12407 Ack=126055 Win=5982 Len=0"
"294","28.546754100","151.101.2.187","100.84.170.161","TLSv1.2","138","Application Data"
"295","28.546822600","100.84.170.161","151.101.2.187","TCP","54","64433  >  443 [ACK] Seq=126055 Ack=12491 Win=8208 Len=0"
"296","28.547069100","151.101.2.187","100.84.170.161","TLSv1.2","301","Application Data"
"297","28.549222300","100.84.170.161","151.101.2.187","TLSv1.2","89","Application Data"
"298","28.558752500","151.101.2.187","100.84.170.161","TCP","56","443  >  64433 [ACK] Seq=12738 Ack=126090 Win=5982 Len=0"
"299","43.165023600","100.84.170.161","151.101.2.187","TLSv1.2","2461","Application Data"
"300","43.165144000","100.84.170.161","151.101.2.187","TLSv1.2","93","Application Data"
"301","43.173546800","100.84.170.161","151.101.2.187","TLSv1.2","2452","Application Data"
"302","43.175051400","151.101.2.187","100.84.170.161","TCP","56","443  >  64433 [ACK] Seq=12738 Ack=128536 Win=5988 Len=0"
"303","43.175269200","151.101.2.187","100.84.170.161","TLSv1.2","93","Application Data"
"304","43.177300200","100.84.170.161","151.101.2.187","TLSv1.2","2396","Application Data"
"305","43.178185700","151.101.2.187","100.84.170.161","TLSv1.2","241","Application Data"
"306","43.178330100","100.84.170.161","151.101.2.187","TLSv1.2","2446","Application Data"
"307","43.182955800","151.101.2.187","100.84.170.161","TCP","56","443  >  64433 [ACK] Seq=12964 Ack=130934 Win=5993 Len=0"
"308","43.185341500","151.101.2.187","100.84.170.161","TLSv1.2","124","Application Data"
"309","43.185424600","100.84.170.161","151.101.2.187","TCP","54","64433  >  443 [ACK] Seq=135668 Ack=13034 Win=8212 Len=0"
"310","43.186415800","151.101.2.187","100.84.170.161","TCP","56","443  >  64433 [ACK] Seq=13034 Ack=133276 Win=5999 Len=0"
"311","43.187553900","151.101.2.187","100.84.170.161","TCP","56","443  >  64433 [ACK] Seq=13034 Ack=135668 Win=6005 Len=0"
"312","43.189821700","151.101.2.187","100.84.170.161","TLSv1.2","161","Application Data"
"313","43.189895800","100.84.170.161","151.101.2.187","TCP","54","64433  >  443 [ACK] Seq=135668 Ack=13141 Win=8212 Len=0"
"314","43.190206600","151.101.2.187","100.84.170.161","TLSv1.2","318","Application Data"
"315","43.190875500","151.101.2.187","100.84.170.161","TLSv1.2","131","Application Data"
"316","43.190928900","100.84.170.161","151.101.2.187","TCP","54","64433  >  443 [ACK] Seq=135668 Ack=13482 Win=8210 Len=0"
"317","43.192160000","100.84.170.161","151.101.2.187","TLSv1.2","89","Application Data"
"318","43.201297700","151.101.2.187","100.84.170.161","TCP","56","443  >  64433 [ACK] Seq=13482 Ack=135703 Win=6005 Len=0"
"319","43.269671500","100.84.170.161","151.101.2.187","TLSv1.2","2446","Application Data"
"320","43.280168600","151.101.2.187","100.84.170.161","TCP","56","443  >  64433 [ACK] Seq=13482 Ack=138095 Win=6011 Len=0"
"321","43.282270900","151.101.2.187","100.84.170.161","TLSv1.2","240","Application Data"
"322","43.309337300","151.101.2.187","100.84.170.161","TCP","240","[TCP Retransmission] 443  >  64433 [PSH, ACK] Seq=13482 Ack=138095 Win=6011 Len=186"
"323","43.309389300","100.84.170.161","151.101.2.187","TCP","66","64433  >  443 [ACK] Seq=138095 Ack=13668 Win=8210 Len=0 SLE=13482 SRE=13668"
"324","43.313604800","100.84.170.161","151.101.2.187","TLSv1.2","2460","Application Data"
"325","43.323488000","151.101.2.187","100.84.170.161","TCP","56","443  >  64433 [ACK] Seq=13668 Ack=140501 Win=6016 Len=0"
"326","43.326204000","151.101.2.187","100.84.170.161","TLSv1.2","125","Application Data"
"327","43.352184100","151.101.2.187","100.84.170.161","TCP","125","[TCP Retransmission] 443  >  64433 [PSH, ACK] Seq=13668 Ack=140501 Win=6016 Len=71"
"328","43.352221800","100.84.170.161","151.101.2.187","TCP","66","64433  >  443 [ACK] Seq=140501 Ack=13739 Win=8209 Len=0 SLE=13668 SRE=13739"
"329","43.397310100","100.84.170.161","151.101.2.187","TLSv1.2","2443","Application Data"
"330","43.407168400","151.101.2.187","100.84.170.161","TCP","56","443  >  64433 [ACK] Seq=13739 Ack=142890 Win=6022 Len=0"
"331","43.409852600","151.101.2.187","100.84.170.161","TLSv1.2","125","Application Data"
"332","43.414023700","100.84.170.161","151.101.2.187","TLSv1.2","2460","Application Data"
"333","43.423701900","151.101.2.187","100.84.170.161","TCP","56","443  >  64433 [ACK] Seq=13810 Ack=145296 Win=6028 Len=0"
"334","43.426225000","151.101.2.187","100.84.170.161","TLSv1.2","130","Application Data"
"335","43.453348900","151.101.2.187","100.84.170.161","TCP","130","[TCP Retransmission] 443  >  64433 [PSH, ACK] Seq=13810 Ack=145296 Win=6028 Len=76"
"336","43.453391700","100.84.170.161","151.101.2.187","TCP","66","64433  >  443 [ACK] Seq=145296 Ack=13886 Win=8209 Len=0 SLE=13810 SRE=13886"
"337","43.538943900","100.84.170.161","151.101.2.187","TLSv1.2","2455","Application Data"
"338","43.548220400","151.101.2.187","100.84.170.161","TCP","56","443  >  64433 [ACK] Seq=13886 Ack=147697 Win=6033 Len=0"
"339","43.550467700","151.101.2.187","100.84.170.161","TLSv1.2","181","Application Data"
"340","43.577453200","151.101.2.187","100.84.170.161","TCP","181","[TCP Retransmission] 443  >  64433 [PSH, ACK] Seq=13886 Ack=147697 Win=6033 Len=127"
"341","43.577540700","100.84.170.161","151.101.2.187","TCP","66","64433  >  443 [ACK] Seq=147697 Ack=14013 Win=8208 Len=0 SLE=13886 SRE=14013"
"342","43.627798300","100.84.170.161","151.101.2.187","TLSv1.2","2461","Application Data"
"343","43.628074200","100.84.170.161","151.101.2.187","TLSv1.2","2457","Application Data"
"344","43.628656200","100.84.170.161","151.101.2.187","TLSv1.2","2449","Application Data"
"345","43.628871200","100.84.170.161","151.101.2.187","TLSv1.2","2445","Application Data"
"346","43.629072600","100.84.170.161","151.101.2.187","TLSv1.2","2448","Application Data"
"347","43.637268600","151.101.2.187","100.84.170.161","TCP","56","443  >  64433 [ACK] Seq=14013 Ack=150104 Win=6039 Len=0"
"348","43.637585100","151.101.2.187","100.84.170.161","TCP","56","443  >  64433 [ACK] Seq=14013 Ack=152507 Win=6045 Len=0"
"349","43.637891700","151.101.2.187","100.84.170.161","TCP","56","443  >  64433 [ACK] Seq=14013 Ack=154902 Win=6051 Len=0"
"350","43.638326100","151.101.2.187","100.84.170.161","TCP","56","443  >  64433 [ACK] Seq=14013 Ack=159687 Win=6062 Len=0"
"351","43.640054200","151.101.2.187","100.84.170.161","TLSv1.2","291","Application Data"
"352","43.640589200","151.101.2.187","100.84.170.161","TLSv1.2","130","Application Data"
"353","43.640642700","100.84.170.161","151.101.2.187","TCP","54","64433  >  443 [ACK] Seq=159687 Ack=14326 Win=8207 Len=0"
"354","43.640887300","151.101.2.187","100.84.170.161","TLSv1.2","131","Application Data"
"355","43.641214200","151.101.2.187","100.84.170.161","TLSv1.2","130","Application Data"
"356","43.641256600","100.84.170.161","151.101.2.187","TCP","54","64433  >  443 [ACK] Seq=159687 Ack=14479 Win=8206 Len=0"
"357","43.641521900","151.101.2.187","100.84.170.161","TLSv1.2","124","Application Data"
"358","43.677265800","151.101.2.187","100.84.170.161","TCP","124","[TCP Retransmission] 443  >  64433 [PSH, ACK] Seq=14479 Ack=159687 Win=6062 Len=70"
"359","43.677303000","100.84.170.161","151.101.2.187","TCP","66","64433  >  443 [ACK] Seq=159687 Ack=14549 Win=8212 Len=0 SLE=14479 SRE=14549"
"360","43.796002400","100.84.170.161","151.101.2.187","TLSv1.2","2489","Application Data"
"361","43.796264100","100.84.170.161","151.101.2.187","TLSv1.2","2510","Application Data"
"362","43.797333300","100.84.170.161","151.101.2.187","TLSv1.2","2512","Application Data"
"363","43.805321200","151.101.2.187","100.84.170.161","TCP","56","443  >  64433 [ACK] Seq=14549 Ack=162122 Win=6068 Len=0"
"364","43.805622200","151.101.2.187","100.84.170.161","TCP","56","443  >  64433 [ACK] Seq=14549 Ack=164578 Win=6073 Len=0"
"365","43.806371800","151.101.2.187","100.84.170.161","TCP","56","443  >  64433 [ACK] Seq=14549 Ack=167036 Win=6079 Len=0"
"366","43.808412000","151.101.2.187","100.84.170.161","TLSv1.2","130","Application Data"
"367","43.809233400","151.101.2.187","100.84.170.161","TLSv1.2","131","Application Data"
"368","43.809289300","100.84.170.161","151.101.2.187","TCP","54","64433  >  443 [ACK] Seq=167036 Ack=14702 Win=8211 Len=0"
"369","43.809688700","151.101.2.187","100.84.170.161","TLSv1.2","130","Application Data"
"370","43.846246200","151.101.2.187","100.84.170.161","TCP","130","[TCP Retransmission] 443  >  64433 [PSH, ACK] Seq=14702 Ack=167036 Win=6079 Len=76"
"371","43.846283900","100.84.170.161","151.101.2.187","TCP","66","64433  >  443 [ACK] Seq=167036 Ack=14778 Win=8211 Len=0 SLE=14702 SRE=14778"
"372","46.823703500","100.84.170.161","151.101.2.187","TLSv1.2","2504","Application Data"
"373","46.833299200","151.101.2.187","100.84.170.161","TCP","56","443  >  64433 [ACK] Seq=14778 Ack=169486 Win=6085 Len=0"
"374","46.836177200","151.101.2.187","100.84.170.161","TLSv1.2","240","Application Data"
"375","46.849360200","100.84.170.161","151.101.2.187","TLSv1.2","2499","Application Data"
"376","46.850485500","100.84.170.161","151.101.2.187","TLSv1.2","2498","Application Data"
"377","46.858475100","151.101.2.187","100.84.170.161","TCP","56","443  >  64433 [ACK] Seq=14964 Ack=171931 Win=6090 Len=0"
"378","46.859917700","151.101.2.187","100.84.170.161","TCP","56","443  >  64433 [ACK] Seq=14964 Ack=174375 Win=6096 Len=0"
"379","46.861316500","151.101.2.187","100.84.170.161","TLSv1.2","130","Application Data"
"380","46.863602300","151.101.2.187","100.84.170.161","TLSv1.2","131","Application Data"
"381","46.863683100","100.84.170.161","151.101.2.187","TCP","54","64433  >  443 [ACK] Seq=174375 Ack=15117 Win=8210 Len=0"
"382","46.978946800","100.84.170.161","151.101.2.187","TLSv1.2","2512","Application Data"
"383","46.979465300","100.84.170.161","151.101.2.187","TLSv1.2","2513","Application Data"
"384","46.989644600","151.101.2.187","100.84.170.161","TCP","56","443  >  64433 [ACK] Seq=15117 Ack=179292 Win=6108 Len=0"
"385","46.992342500","151.101.2.187","100.84.170.161","TLSv1.2","169","Application Data"
"386","46.992638000","151.101.2.187","100.84.170.161","TLSv1.2","131","Application Data"
"387","46.992673200","100.84.170.161","151.101.2.187","TCP","54","64433  >  443 [ACK] Seq=179292 Ack=15309 Win=8209 Len=0"
"388","47.093497800","100.84.170.161","151.101.2.187","TLSv1.2","2513","Application Data"
"389","47.102700300","151.101.2.187","100.84.170.161","TCP","56","443  >  64433 [ACK] Seq=15309 Ack=181751 Win=6113 Len=0"
"390","47.105495000","151.101.2.187","100.84.170.161","TLSv1.2","125","Application Data"
"391","47.133158600","151.101.2.187","100.84.170.161","TCP","125","[TCP Retransmission] 443  >  64433 [PSH, ACK] Seq=15309 Ack=181751 Win=6113 Len=71"
"392","47.133204300","100.84.170.161","151.101.2.187","TCP","66","64433  >  443 [ACK] Seq=181751 Ack=15380 Win=8209 Len=0 SLE=15309 SRE=15380"
"393","47.180435400","100.84.170.161","151.101.2.187","TLSv1.2","2534","Application Data"
"394","47.189655300","151.101.2.187","100.84.170.161","TCP","56","443  >  64433 [ACK] Seq=15380 Ack=184231 Win=6119 Len=0"
"395","47.192429200","151.101.2.187","100.84.170.161","TLSv1.2","290","Application Data"
"396","47.220207300","151.101.2.187","100.84.170.161","TCP","290","[TCP Retransmission] 443  >  64433 [PSH, ACK] Seq=15380 Ack=184231 Win=6119 Len=236"
"397","47.220252000","100.84.170.161","151.101.2.187","TCP","66","64433  >  443 [ACK] Seq=184231 Ack=15616 Win=8208 Len=0 SLE=15380 SRE=15616"
"398","48.634058200","100.84.170.161","151.101.66.187","TCP","55","[TCP Keep-Alive] 50935  >  443 [ACK] Seq=160 Ack=395 Win=510 Len=1"
"399","48.644719300","151.101.66.187","100.84.170.161","TCP","66","[TCP Keep-Alive ACK] 443  >  50935 [ACK] Seq=395 Ack=161 Win=281 Len=0 SLE=160 SRE=161"
"400","50.278540700","100.84.170.161","151.101.2.187","TLSv1.2","2511","Application Data"
"401","50.291051400","151.101.2.187","100.84.170.161","TCP","56","443  >  64433 [ACK] Seq=15616 Ack=186688 Win=6125 Len=0"
"402","50.293125400","151.101.2.187","100.84.170.161","TLSv1.2","214","Application Data"
"403","50.321115500","151.101.2.187","100.84.170.161","TCP","214","[TCP Retransmission] 443  >  64433 [PSH, ACK] Seq=15616 Ack=186688 Win=6125 Len=160"
"404","50.321161900","100.84.170.161","151.101.2.187","TCP","66","64433  >  443 [ACK] Seq=186688 Ack=15776 Win=8207 Len=0 SLE=15616 SRE=15776"
"405","51.273487700","100.84.170.161","151.101.2.187","TLSv1.2","2504","Application Data"
"406","51.279602900","100.84.170.161","151.101.2.187","TLSv1.2","2499","Application Data"
"407","51.280326100","100.84.170.161","151.101.2.187","TLSv1.2","2498","Application Data"
"408","51.282510800","151.101.2.187","100.84.170.161","TCP","56","443  >  64433 [ACK] Seq=15776 Ack=189138 Win=6130 Len=0"
"409","51.285852000","151.101.2.187","100.84.170.161","TLSv1.2","214","Application Data"
"410","51.288872000","151.101.2.187","100.84.170.161","TCP","56","443  >  64433 [ACK] Seq=15936 Ack=191583 Win=6136 Len=0"
"411","51.289422200","151.101.2.187","100.84.170.161","TCP","56","443  >  64433 [ACK] Seq=15936 Ack=194027 Win=6142 Len=0"
"412","51.291680200","151.101.2.187","100.84.170.161","TLSv1.2","104","Application Data"
"413","51.291732400","100.84.170.161","151.101.2.187","TCP","54","64433  >  443 [ACK] Seq=194027 Ack=15986 Win=8206 Len=0"
"414","51.291910900","151.101.2.187","100.84.170.161","TLSv1.2","104","Application Data"
"415","51.328599700","100.84.170.161","151.101.2.187","TLSv1.2","2512","Application Data"
"416","51.328837500","100.84.170.161","151.101.2.187","TLSv1.2","2513","Application Data"
"417","51.329410900","151.101.2.187","100.84.170.161","TCP","104","[TCP Spurious Retransmission] 443  >  64433 [PSH, ACK] Seq=15986 Ack=194027 Win=6142 Len=50"
"418","51.329444100","100.84.170.161","151.101.2.187","TCP","66","[TCP Dup ACK 415#1] 64433  >  443 [ACK] Seq=198944 Ack=16036 Win=8212 Len=0 SLE=15986 SRE=16036"
"419","51.337823800","151.101.2.187","100.84.170.161","TCP","56","443  >  64433 [ACK] Seq=16036 Ack=196485 Win=6147 Len=0"
"420","51.338305600","151.101.2.187","100.84.170.161","TCP","56","443  >  64433 [ACK] Seq=16036 Ack=198944 Win=6153 Len=0"
"421","51.340911200","151.101.2.187","100.84.170.161","TLSv1.2","98","Application Data"
"422","51.341661300","151.101.2.187","100.84.170.161","TLSv1.2","98","Application Data"
"423","51.341716000","100.84.170.161","151.101.2.187","TCP","54","64433  >  443 [ACK] Seq=198944 Ack=16124 Win=8212 Len=0"
"424","51.451380200","100.84.170.161","151.101.2.187","TLSv1.2","2517","Application Data"
"425","51.451880000","100.84.170.161","151.101.2.187","TLSv1.2","2517","Application Data"
"426","51.452014400","100.84.170.161","151.101.2.187","TLSv1.2","2519","Application Data"
"427","51.462912300","151.101.2.187","100.84.170.161","TCP","56","443  >  64433 [ACK] Seq=16124 Ack=206335 Win=6170 Len=0"
"428","51.465647200","151.101.2.187","100.84.170.161","TLSv1.2","131","Application Data"
"429","51.465989800","151.101.2.187","100.84.170.161","TLSv1.2","184","Application Data"
"430","51.466032600","100.84.170.161","151.101.2.187","TCP","54","64433  >  443 [ACK] Seq=206335 Ack=16331 Win=8211 Len=0"
"431","54.016152500","100.84.170.161","151.101.2.187","TLSv1.2","2511","Application Data"
"432","54.016383700","100.84.170.161","151.101.2.187","TLSv1.2","2512","Application Data"
"433","54.025608800","151.101.2.187","100.84.170.161","TCP","56","443  >  64433 [ACK] Seq=16331 Ack=208792 Win=6176 Len=0"
"434","54.026046800","151.101.2.187","100.84.170.161","TCP","56","443  >  64433 [ACK] Seq=16331 Ack=211250 Win=6182 Len=0"
"435","54.029238100","151.101.2.187","100.84.170.161","TLSv1.2","214","Application Data"
"436","54.029592200","151.101.2.187","100.84.170.161","TLSv1.2","98","Application Data"
"437","54.029630400","100.84.170.161","151.101.2.187","TCP","54","64433  >  443 [ACK] Seq=211250 Ack=16535 Win=8210 Len=0"
"438","54.226943600","100.84.170.161","151.101.2.187","TLSv1.2","2515","Application Data"
"439","54.227137400","100.84.170.161","151.101.2.187","TLSv1.2","2517","Application Data"
"440","54.236605200","151.101.2.187","100.84.170.161","TCP","56","443  >  64433 [ACK] Seq=16535 Ack=216174 Win=6193 Len=0"
"441","54.239410700","151.101.2.187","100.84.170.161","TLSv1.2","104","Application Data"
"442","54.239827300","151.101.2.187","100.84.170.161","TLSv1.2","98","Application Data"
"443","54.239920100","100.84.170.161","151.101.2.187","TCP","54","64433  >  443 [ACK] Seq=216174 Ack=16629 Win=8210 Len=0"
"444","56.538701900","100.84.170.161","151.101.2.187","TLSv1.2","2459","Application Data"
"445","56.547886700","151.101.2.187","100.84.170.161","TCP","56","443  >  64433 [ACK] Seq=16629 Ack=218579 Win=6199 Len=0"
"446","56.550525700","151.101.2.187","100.84.170.161","TLSv1.2","955","Application Data"
"447","56.552629900","100.84.170.161","151.101.2.187","TLSv1.2","89","Application Data"
"448","56.561560700","151.101.2.187","100.84.170.161","TCP","56","443  >  64433 [ACK] Seq=17530 Ack=218614 Win=6199 Len=0"
"449","59.213983900","100.84.170.161","151.101.2.187","TLSv1.2","2512","Application Data"
"450","59.225507100","151.101.2.187","100.84.170.161","TCP","56","443  >  64433 [ACK] Seq=17530 Ack=221072 Win=6205 Len=0"
"451","59.227475000","151.101.2.187","100.84.170.161","TLSv1.2","400","Application Data"
"452","59.255259500","151.101.2.187","100.84.170.161","TCP","400","[TCP Retransmission] 443  >  64433 [PSH, ACK] Seq=17530 Ack=221072 Win=6205 Len=346"
"453","59.255301500","100.84.170.161","151.101.2.187","TCP","66","64433  >  443 [ACK] Seq=221072 Ack=17876 Win=8211 Len=0 SLE=17530 SRE=17876"
