No.,Time,Source,Destination,Protocol,Length,Info
1,0.0,172.20.40.110,151.101.2.187,TLSv1.2,175,Application Data
2,0.0008376,172.20.40.110,151.101.2.187,TLSv1.2,93,Application Data
3,0.0078626,151.101.2.187,172.20.40.110,TCP,60,443  >  54874 [ACK] Seq=1 Ack=122 Win=282 Len=0
4,0.0078626,151.101.2.187,172.20.40.110,TCP,60,443  >  54874 [ACK] Seq=1 Ack=161 Win=282 Len=0
5,0.0078626,151.101.2.187,172.20.40.110,TLSv1.2,93,Application Data
6,0.0101838,151.101.2.187,172.20.40.110,TLSv1.2,252,Application Data
7,0.010277,172.20.40.110,151.101.2.187,TCP,54,54874  >  443 [ACK] Seq=161 Ack=238 Win=257 Len=0
8,0.0174699,172.20.40.110,151.101.130.187,TLSv1.2,2622,Application Data
9,0.0178536,172.20.40.110,151.101.130.187,TLSv1.2,93,Application Data
10,0.0293244,151.101.130.187,172.20.40.110,TCP,60,443  >  62995 [ACK] Seq=1 Ack=2569 Win=3763 Len=0
11,0.0293244,151.101.130.187,172.20.40.110,TCP,60,443  >  62995 [ACK] Seq=1 Ack=2608 Win=3763 Len=0
12,0.0293244,151.101.130.187,172.20.40.110,TLSv1.2,93,Application Data
13,0.0798249,172.20.40.110,151.101.130.187,TCP,54,62995  >  443 [ACK] Seq=2608 Ack=40 Win=507 Len=0
14,0.0888184,151.101.130.187,172.20.40.110,TLSv1.2,501,Application Data
15,0.0888184,151.101.130.187,172.20.40.110,TCP,1434,443  >  62995 [ACK] Seq=487 Ack=2608 Win=3763 Len=1380 [TCP PDU reassembled in 17]
16,0.0888184,151.101.130.187,172.20.40.110,TCP,1434,"443  >  62995 [PSH, ACK] Seq=1867 Ack=2608 Win=3763 Len=1380 [TCP PDU reassembled in 17]"
17,0.0888184,151.101.130.187,172.20.40.110,TLSv1.2,62,Application Data
18,0.0888184,151.101.130.187,172.20.40.110,TLSv1.2,85,Application Data
19,0.0890058,172.20.40.110,151.101.130.187,TCP,54,62995  >  443 [ACK] Seq=2608 Ack=3286 Win=512 Len=0
20,0.0909361,172.20.40.110,151.101.130.187,TLSv1.2,89,Application Data
21,0.0986832,151.101.130.187,172.20.40.110,TCP,60,443  >  62995 [ACK] Seq=3286 Ack=2643 Win=3763 Len=0
22,0.5961164,172.20.40.110,151.101.130.187,TLSv1.2,2912,Application Data
23,0.5998576,172.20.40.110,151.101.130.187,TLSv1.2,2913,Application Data
24,0.6067168,172.20.40.110,151.101.130.187,TLSv1.2,2903,Application Data
25,0.6092767,151.101.130.187,172.20.40.110,TCP,60,443  >  62995 [ACK] Seq=3286 Ack=5501 Win=3774 Len=0
26,0.6118469,151.101.130.187,172.20.40.110,TLSv1.2,223,Application Data
27,0.6129401,151.101.130.187,172.20.40.110,TCP,60,443  >  62995 [ACK] Seq=3455 Ack=8360 Win=3785 Len=0
28,0.6154135,151.101.130.187,172.20.40.110,TLSv1.2,137,Application Data
29,0.615505,172.20.40.110,151.101.130.187,TCP,54,62995  >  443 [ACK] Seq=11209 Ack=3538 Win=511 Len=0
30,0.6177717,151.101.130.187,172.20.40.110,TCP,60,443  >  62995 [ACK] Seq=3538 Ack=11209 Win=3797 Len=0
31,0.6201745,151.101.130.187,172.20.40.110,TLSv1.2,129,Application Data
32,0.6755919,172.20.40.110,151.101.130.187,TCP,54,62995  >  443 [ACK] Seq=11209 Ack=3613 Win=510 Len=0
33,0.8410324,172.20.40.110,151.101.130.187,TLSv1.2,2880,Application Data
34,0.842257,172.20.40.110,151.101.130.187,TLSv1.2,2881,Application Data
35,0.9035755,151.101.130.187,172.20.40.110,TCP,60,443  >  62995 [ACK] Seq=3613 Ack=14035 Win=3808 Len=0
36,0.9035755,151.101.130.187,172.20.40.110,TCP,60,443  >  62995 [ACK] Seq=3613 Ack=16862 Win=3819 Len=0
37,0.9035755,151.101.130.187,172.20.40.110,TLSv1.2,439,Application Data
38,0.9035755,151.101.130.187,172.20.40.110,TLSv1.2,130,Application Data
39,0.9040712,172.20.40.110,151.101.130.187,TCP,54,62995  >  443 [ACK] Seq=16862 Ack=4074 Win=509 Len=0
40,1.0260328,172.20.40.110,151.101.130.187,TLSv1.2,2912,Application Data
41,1.0591176,151.101.130.187,172.20.40.110,TCP,60,443  >  62995 [ACK] Seq=4074 Ack=19720 Win=3830 Len=0
42,1.0591176,151.101.130.187,172.20.40.110,TLSv1.2,98,Application Data
43,1.0846479,172.20.40.110,151.101.130.187,TLSv1.2,2910,Application Data
44,1.1068214,151.101.130.187,172.20.40.110,TCP,60,443  >  62995 [ACK] Seq=4118 Ack=22576 Win=3841 Len=0
45,1.1075519,151.101.130.187,172.20.40.110,TLSv1.2,125,Application Data
46,1.1482193,172.20.40.110,151.101.130.187,TCP,54,62995  >  443 [ACK] Seq=22576 Ack=4189 Win=508 Len=0
47,1.1486902,172.20.40.110,151.101.130.187,TLSv1.2,2913,Application Data
48,1.1592697,151.101.130.187,172.20.40.110,TCP,60,443  >  62995 [ACK] Seq=4189 Ack=25435 Win=3852 Len=0
49,1.1627047,151.101.130.187,172.20.40.110,TLSv1.2,98,Application Data
50,1.2086018,172.20.40.110,151.101.130.187,TCP,54,62995  >  443 [ACK] Seq=25435 Ack=4233 Win=508 Len=0
51,1.281539,172.20.40.110,151.101.130.187,TLSv1.2,2912,Application Data
52,1.2818904,172.20.40.110,151.101.130.187,TLSv1.2,2911,Application Data
53,1.2910079,151.101.130.187,172.20.40.110,TCP,60,443  >  62995 [ACK] Seq=4233 Ack=28293 Win=3864 Len=0
54,1.2923487,151.101.130.187,172.20.40.110,TCP,60,443  >  62995 [ACK] Seq=4233 Ack=31150 Win=3875 Len=0
55,1.2944734,151.101.130.187,172.20.40.110,TLSv1.2,124,Application Data
56,1.2957018,151.101.130.187,172.20.40.110,TLSv1.2,130,Application Data
57,1.2957674,172.20.40.110,151.101.130.187,TCP,54,62995  >  443 [ACK] Seq=31150 Ack=4379 Win=507 Len=0
58,4.299646,172.20.40.110,151.101.130.187,TLSv1.2,2907,Application Data
59,4.3046583,172.20.40.110,151.101.130.187,TLSv1.2,2903,Application Data
60,4.3088659,151.101.130.187,172.20.40.110,TCP,60,443  >  62995 [ACK] Seq=4379 Ack=34003 Win=3886 Len=0
61,4.3100704,172.20.40.110,151.101.130.187,TLSv1.2,2903,Application Data
62,4.312687,151.101.130.187,172.20.40.110,TLSv1.2,241,Application Data
63,4.3149725,151.101.130.187,172.20.40.110,TCP,60,443  >  62995 [ACK] Seq=4566 Ack=36852 Win=3897 Len=0
64,4.3171194,151.101.130.187,172.20.40.110,TLSv1.2,130,Application Data
65,4.3172307,172.20.40.110,151.101.130.187,TCP,54,62995  >  443 [ACK] Seq=39701 Ack=4642 Win=506 Len=0
66,4.3214259,151.101.130.187,172.20.40.110,TCP,60,443  >  62995 [ACK] Seq=4642 Ack=39701 Win=3908 Len=0
67,4.3236417,151.101.130.187,172.20.40.110,TLSv1.2,103,Application Data
68,4.3349768,172.20.40.110,151.101.130.187,TLSv1.2,2896,Application Data
69,4.3352998,172.20.40.110,151.101.130.187,TLSv1.2,2897,Application Data
70,4.3440548,151.101.130.187,172.20.40.110,TCP,60,443  >  62995 [ACK] Seq=4691 Ack=42543 Win=3919 Len=0
71,4.3473663,151.101.130.187,172.20.40.110,TLSv1.2,104,Application Data
72,4.3494273,151.101.130.187,172.20.40.110,TCP,60,443  >  62995 [ACK] Seq=4741 Ack=45386 Win=3931 Len=0
73,4.3527448,151.101.130.187,172.20.40.110,TLSv1.2,104,Application Data
74,4.3528251,172.20.40.110,151.101.130.187,TCP,54,62995  >  443 [ACK] Seq=45386 Ack=4791 Win=511 Len=0
75,6.7897403,172.20.40.110,151.101.130.187,TLSv1.2,2901,Application Data
76,6.803123,151.101.130.187,172.20.40.110,TCP,60,443  >  62995 [ACK] Seq=4791 Ack=48233 Win=3942 Len=0
77,6.804519,151.101.130.187,172.20.40.110,TLSv1.2,245,Application Data
78,6.8557754,172.20.40.110,151.101.130.187,TCP,54,62995  >  443 [ACK] Seq=48233 Ack=4982 Win=510 Len=0
79,10.8080157,172.20.40.110,151.101.130.187,TLSv1.2,2912,Application Data
80,10.8185122,151.101.130.187,172.20.40.110,TCP,60,443  >  62995 [ACK] Seq=4982 Ack=51091 Win=3953 Len=0
81,10.8218488,151.101.130.187,172.20.40.110,TLSv1.2,246,Application Data
82,10.8746764,172.20.40.110,151.101.130.187,TCP,54,62995  >  443 [ACK] Seq=51091 Ack=5174 Win=510 Len=0
83,14.3390171,172.20.40.110,151.101.130.187,TLSv1.2,2914,Application Data
84,14.3511239,151.101.130.187,172.20.40.110,TCP,60,443  >  62995 [ACK] Seq=5174 Ack=53951 Win=3964 Len=0
85,14.6760016,151.101.130.187,172.20.40.110,TCP,1434,443  >  62995 [ACK] Seq=5174 Ack=53951 Win=3964 Len=1380 [TCP PDU reassembled in 86]
86,14.6760016,151.101.130.187,172.20.40.110,TLSv1.2,796,Application Data
87,14.6760016,151.101.130.187,172.20.40.110,TCP,4194,"443  >  62995 [PSH, ACK] Seq=7296 Ack=53951 Win=3964 Len=4140 [TCP PDU reassembled in 92]"
88,14.6761486,172.20.40.110,151.101.130.187,TCP,54,62995  >  443 [ACK] Seq=53951 Ack=11436 Win=512 Len=0
89,14.6795461,151.101.130.187,172.20.40.110,TCP,2814,"443  >  62995 [PSH, ACK] Seq=11436 Ack=53951 Win=3964 Len=2760 [TCP PDU reassembled in 92]"
90,14.6796776,172.20.40.110,151.101.130.187,TCP,54,62995  >  443 [ACK] Seq=53951 Ack=14196 Win=512 Len=0
91,14.6828359,151.101.130.187,172.20.40.110,TCP,1434,"443  >  62995 [PSH, ACK] Seq=14196 Ack=53951 Win=3964 Len=1380 [TCP PDU reassembled in 92]"
92,14.6828359,151.101.130.187,172.20.40.110,TLSv1.2,8334,Application Data
93,14.6830185,172.20.40.110,151.101.130.187,TCP,54,62995  >  443 [ACK] Seq=53951 Ack=23856 Win=512 Len=0
94,14.6844683,151.101.130.187,172.20.40.110,TCP,5574,"443  >  62995 [PSH, ACK] Seq=23856 Ack=53951 Win=3964 Len=5520 [TCP PDU reassembled in 102]"
95,14.6845755,172.20.40.110,151.101.130.187,TCP,54,62995  >  443 [ACK] Seq=53951 Ack=29376 Win=512 Len=0
96,14.6851405,172.20.40.110,151.101.130.187,TLSv1.2,89,Application Data
97,14.6974735,151.101.130.187,172.20.40.110,TCP,1434,443  >  62995 [ACK] Seq=29376 Ack=53951 Win=3964 Len=1380 [TCP PDU reassembled in 102]
98,14.6974735,151.101.130.187,172.20.40.110,TCP,1434,"443  >  62995 [PSH, ACK] Seq=30756 Ack=53951 Win=3964 Len=1380 [TCP PDU reassembled in 102]"
99,14.6974735,151.101.130.187,172.20.40.110,TCP,1434,443  >  62995 [ACK] Seq=32136 Ack=53951 Win=3964 Len=1380 [TCP PDU reassembled in 102]
100,14.6974735,151.101.130.187,172.20.40.110,TCP,1434,"443  >  62995 [PSH, ACK] Seq=33516 Ack=53951 Win=3964 Len=1380 [TCP PDU reassembled in 102]"
101,14.6976007,172.20.40.110,151.101.130.187,TCP,54,62995  >  443 [ACK] Seq=53986 Ack=34896 Win=512 Len=0
102,14.7018708,151.101.130.187,172.20.40.110,TLSv1.2,1434,Application Data
103,14.7018708,151.101.130.187,172.20.40.110,TCP,1434,"443  >  62995 [PSH, ACK] Seq=36276 Ack=53951 Win=3964 Len=1380 [TCP PDU reassembled in 107]"
104,14.7018708,151.101.130.187,172.20.40.110,TCP,1434,443  >  62995 [ACK] Seq=37656 Ack=53951 Win=3964 Len=1380 [TCP PDU reassembled in 107]
105,14.7019978,172.20.40.110,151.101.130.187,TCP,54,62995  >  443 [ACK] Seq=53986 Ack=39036 Win=512 Len=0
106,14.7043312,151.101.130.187,172.20.40.110,TCP,1434,"443  >  62995 [PSH, ACK] Seq=39036 Ack=53951 Win=3964 Len=1380 [TCP PDU reassembled in 107]"
107,14.7043312,151.101.130.187,172.20.40.110,TLSv1.2,5574,"Application Data, Application Data"
108,14.7044553,172.20.40.110,151.101.130.187,TCP,54,62995  >  443 [ACK] Seq=53986 Ack=45936 Win=512 Len=0
109,14.7073008,151.101.130.187,172.20.40.110,TLSv1.2,5574,"Application Data, Application Data, Application Data, Application Data, Application Data, Application Data"
110,14.7074196,172.20.40.110,151.101.130.187,TCP,54,62995  >  443 [ACK] Seq=53986 Ack=51456 Win=512 Len=0
111,14.7131167,151.101.130.187,172.20.40.110,TCP,1434,443  >  62995 [ACK] Seq=51456 Ack=53951 Win=3964 Len=1380 [TCP PDU reassembled in 112]
112,14.7131167,151.101.130.187,172.20.40.110,TLSv1.2,1434,Application Data
113,14.7131167,151.101.130.187,172.20.40.110,TLSv1.2,1042,Application Data
114,14.7131167,151.101.130.187,172.20.40.110,TCP,1042,"[TCP Retransmission] 443  >  62995 [PSH, ACK] Seq=54216 Ack=53951 Win=3964 Len=988 [TCP PDU reassembled in 113]"
115,14.7131167,151.101.130.187,172.20.40.110,TCP,60,443  >  62995 [ACK] Seq=55204 Ack=53986 Win=3964 Len=0
116,14.713291,172.20.40.110,151.101.130.187,TCP,66,62995  >  443 [ACK] Seq=53986 Ack=55204 Win=512 Len=0 SLE=54216 SRE=55204
117,14.7528049,151.101.130.187,172.20.40.110,TLSv1.2,906,Application Data
118,14.752917,172.20.40.110,151.101.130.187,TCP,54,62995  >  443 [ACK] Seq=53986 Ack=56056 Win=508 Len=0
119,14.7556287,151.101.130.187,172.20.40.110,TLSv1.2,1429,Application Data
120,14.7639254,151.101.130.187,172.20.40.110,TCP,1434,443  >  62995 [ACK] Seq=57431 Ack=53986 Win=3964 Len=1380 [TCP PDU reassembled in 121]
121,14.7639254,151.101.130.187,172.20.40.110,TLSv1.2,663,Application Data
122,14.7639254,151.101.130.187,172.20.40.110,TCP,1434,443  >  62995 [ACK] Seq=59420 Ack=53986 Win=3964 Len=1380 [TCP PDU reassembled in 123]
123,14.7639254,151.101.130.187,172.20.40.110,TLSv1.2,851,Application Data
124,14.7639254,151.101.130.187,172.20.40.110,TCP,1434,443  >  62995 [ACK] Seq=61597 Ack=53986 Win=3964 Len=1380 [TCP PDU reassembled in 126]
125,14.7640497,172.20.40.110,151.101.130.187,TCP,54,62995  >  443 [ACK] Seq=53986 Ack=62977 Win=512 Len=0
126,14.7665821,151.101.130.187,172.20.40.110,TLSv1.2,887,Application Data
127,14.7967098,151.101.130.187,172.20.40.110,TLSv1.2,248,Application Data
128,14.7967098,151.101.130.187,172.20.40.110,TCP,2814,"443  >  62995 [PSH, ACK] Seq=64004 Ack=53986 Win=3964 Len=2760 [TCP PDU reassembled in 130]"
129,14.7968509,172.20.40.110,151.101.130.187,TCP,54,62995  >  443 [ACK] Seq=53986 Ack=66764 Win=512 Len=0
130,14.7982528,151.101.130.187,172.20.40.110,TLSv1.2,1219,Application Data
131,14.8412374,151.101.130.187,172.20.40.110,TCP,2814,"443  >  62995 [PSH, ACK] Seq=67929 Ack=53986 Win=3964 Len=2760 [TCP PDU reassembled in 137]"
132,14.8413265,172.20.40.110,151.101.130.187,TCP,54,62995  >  443 [ACK] Seq=53986 Ack=70689 Win=512 Len=0
133,14.8424867,151.101.130.187,172.20.40.110,TCP,1434,443  >  62995 [ACK] Seq=70689 Ack=53986 Win=3964 Len=1380 [TCP PDU reassembled in 137]
134,14.8425708,172.20.40.110,151.101.130.187,TCP,54,62995  >  443 [ACK] Seq=53986 Ack=72069 Win=512 Len=0
135,14.8442481,151.101.130.187,172.20.40.110,TCP,1434,"443  >  62995 [PSH, ACK] Seq=72069 Ack=53986 Win=3964 Len=1380 [TCP PDU reassembled in 137]"
136,14.8442481,151.101.130.187,172.20.40.110,TCP,1434,443  >  62995 [ACK] Seq=73449 Ack=53986 Win=3964 Len=1380 [TCP PDU reassembled in 137]
137,14.8442481,151.101.130.187,172.20.40.110,TLSv1.2,702,Application Data
138,14.8443642,172.20.40.110,151.101.130.187,TCP,54,62995  >  443 [ACK] Seq=53986 Ack=75477 Win=512 Len=0
139,14.8807153,151.101.130.187,172.20.40.110,TCP,1434,443  >  62995 [ACK] Seq=75477 Ack=53986 Win=3964 Len=1380 [TCP PDU reassembled in 140]
140,14.8807153,151.101.130.187,172.20.40.110,TLSv1.2,659,Application Data
141,14.8808029,172.20.40.110,151.101.130.187,TCP,54,62995  >  443 [ACK] Seq=53986 Ack=77462 Win=512 Len=0
142,14.8882952,151.101.130.187,172.20.40.110,TLSv1.2,93,Application Data
143,14.8882952,151.101.130.187,172.20.40.110,TCP,1434,443  >  62995 [ACK] Seq=77501 Ack=53986 Win=3964 Len=1380 [TCP PDU reassembled in 144]
144,14.8882952,151.101.130.187,172.20.40.110,TLSv1.2,505,Application Data
145,14.8882952,151.101.130.187,172.20.40.110,TLSv1.2,487,Application Data
146,14.8883923,172.20.40.110,151.101.130.187,TCP,54,62995  >  443 [ACK] Seq=53986 Ack=79765 Win=512 Len=0
147,14.889536,151.101.130.187,172.20.40.110,TLSv1.2,95,Application Data
148,14.8896056,172.20.40.110,151.101.130.187,TCP,54,62995  >  443 [ACK] Seq=53986 Ack=79806 Win=511 Len=0
149,14.9406126,172.20.40.110,151.101.130.187,TLSv1.2,2846,Application Data
150,14.9408484,172.20.40.110,151.101.130.187,TLSv1.2,2848,Application Data
151,14.944004,172.20.40.110,151.101.130.187,TLSv1.2,2846,Application Data
152,14.9442892,172.20.40.110,151.101.130.187,TLSv1.2,2844,Application Data
153,14.9448024,172.20.40.110,151.101.130.187,TLSv1.2,2846,Application Data
154,14.9501778,172.20.40.110,151.101.130.187,TLSv1.2,2852,Application Data
155,14.9584817,151.101.130.187,172.20.40.110,TCP,60,443  >  62995 [ACK] Seq=79806 Ack=56778 Win=3975 Len=0
156,14.9584817,151.101.130.187,172.20.40.110,TCP,60,443  >  62995 [ACK] Seq=79806 Ack=59572 Win=3986 Len=0
157,14.9584817,151.101.130.187,172.20.40.110,TLSv1.2,311,Application Data
158,14.9584817,151.101.130.187,172.20.40.110,TLSv1.2,138,Application Data
159,14.9586563,172.20.40.110,151.101.130.187,TCP,54,62995  >  443 [ACK] Seq=70744 Ack=80147 Win=510 Len=0
160,14.9599292,151.101.130.187,172.20.40.110,TCP,60,443  >  62995 [ACK] Seq=80147 Ack=62364 Win=3997 Len=0
161,14.9599292,151.101.130.187,172.20.40.110,TCP,60,443  >  62995 [ACK] Seq=80147 Ack=65154 Win=4008 Len=0
162,14.9599292,151.101.130.187,172.20.40.110,TCP,60,443  >  62995 [ACK] Seq=80147 Ack=67946 Win=4019 Len=0
163,14.961124,151.101.130.187,172.20.40.110,TCP,60,443  >  62995 [ACK] Seq=80147 Ack=70744 Win=4030 Len=0
164,14.961124,151.101.130.187,172.20.40.110,TLSv1.2,206,"Application Data, Application Data"
165,14.961124,151.101.130.187,172.20.40.110,TLSv1.2,124,Application Data
166,14.9612299,172.20.40.110,151.101.130.187,TCP,54,62995  >  443 [ACK] Seq=70744 Ack=80369 Win=509 Len=0
167,14.9624928,151.101.130.187,172.20.40.110,TLSv1.2,131,Application Data
168,14.9626381,172.20.40.110,151.101.130.187,TCP,54,62995  >  443 [ACK] Seq=70744 Ack=80446 Win=509 Len=0
169,15.0601608,172.20.40.110,151.101.130.187,TLSv1.2,2848,Application Data
170,15.060397,172.20.40.110,151.101.130.187,TLSv1.2,2854,Application Data
171,15.0605746,172.20.40.110,151.101.130.187,TLSv1.2,2855,Application Data
172,15.0639833,172.20.40.110,151.101.130.187,TLSv1.2,2854,Application Data
173,15.0643156,172.20.40.110,151.101.130.187,TLSv1.2,2854,Application Data
174,15.0677494,172.20.40.110,151.101.130.187,TLSv1.2,2848,Application Data
175,15.0680894,172.20.40.110,151.101.130.187,TLSv1.2,2848,Application Data
176,15.0684156,172.20.40.110,151.101.130.187,TLSv1.2,2848,Application Data
177,15.0718653,151.101.130.187,172.20.40.110,TCP,60,443  >  62995 [ACK] Seq=80446 Ack=73538 Win=4040 Len=0
178,15.0728879,172.20.40.110,151.101.130.187,TLSv1.2,2851,Application Data
179,15.0846658,151.101.130.187,172.20.40.110,TLSv1.2,130,Application Data
180,15.0846658,151.101.130.187,172.20.40.110,TCP,60,443  >  62995 [ACK] Seq=80522 Ack=76338 Win=4051 Len=0
181,15.0846658,151.101.130.187,172.20.40.110,TLSv1.2,130,Application Data
182,15.0846658,151.101.130.187,172.20.40.110,TCP,60,443  >  62995 [ACK] Seq=80598 Ack=79139 Win=4062 Len=0
183,15.0846658,151.101.130.187,172.20.40.110,TCP,60,443  >  62995 [ACK] Seq=80598 Ack=81939 Win=4073 Len=0
184,15.0846658,151.101.130.187,172.20.40.110,TCP,60,443  >  62995 [ACK] Seq=80598 Ack=84739 Win=4084 Len=0
185,15.0850771,172.20.40.110,151.101.130.187,TCP,54,62995  >  443 [ACK] Seq=95918 Ack=80598 Win=508 Len=0
186,15.0879282,151.101.130.187,172.20.40.110,TLSv1.2,235,Application Data
187,15.0879282,151.101.130.187,172.20.40.110,TLSv1.2,131,Application Data
188,15.0880057,172.20.40.110,151.101.130.187,TCP,54,62995  >  443 [ACK] Seq=95918 Ack=80856 Win=507 Len=0
189,15.0961772,151.101.130.187,172.20.40.110,TCP,60,443  >  62995 [ACK] Seq=80856 Ack=87533 Win=4095 Len=0
190,15.0961772,151.101.130.187,172.20.40.110,TCP,60,443  >  62995 [ACK] Seq=80856 Ack=90327 Win=4106 Len=0
191,15.0961772,151.101.130.187,172.20.40.110,TCP,60,443  >  62995 [ACK] Seq=80856 Ack=93121 Win=4117 Len=0
192,15.0961772,151.101.130.187,172.20.40.110,TCP,60,443  >  62995 [ACK] Seq=80856 Ack=95918 Win=4128 Len=0
193,15.097479,151.101.130.187,172.20.40.110,TLSv1.2,209,Application Data
194,15.097479,151.101.130.187,172.20.40.110,TLSv1.2,130,Application Data
195,15.097479,151.101.130.187,172.20.40.110,TLSv1.2,311,Application Data
196,15.097479,151.101.130.187,172.20.40.110,TLSv1.2,136,Application Data
197,15.0975854,172.20.40.110,151.101.130.187,TCP,54,62995  >  443 [ACK] Seq=95918 Ack=81426 Win=512 Len=0
198,15.1216624,172.20.40.110,151.101.130.187,TLSv1.2,2847,Application Data
199,15.1319715,151.101.130.187,172.20.40.110,TCP,60,443  >  62995 [ACK] Seq=81426 Ack=98711 Win=4139 Len=0
200,15.1343595,172.20.40.110,151.101.130.187,TLSv1.2,2845,Application Data
201,15.1363048,151.101.130.187,172.20.40.110,TLSv1.2,131,Application Data
202,15.1459675,151.101.130.187,172.20.40.110,TCP,60,443  >  62995 [ACK] Seq=81503 Ack=101502 Win=4150 Len=0
203,15.1480274,151.101.130.187,172.20.40.110,TLSv1.2,130,Application Data
204,15.1481059,172.20.40.110,151.101.130.187,TCP,54,62995  >  443 [ACK] Seq=101502 Ack=81579 Win=511 Len=0
205,15.2547274,172.20.40.110,151.101.130.187,TLSv1.2,2862,Application Data
206,15.2553555,172.20.40.110,151.101.130.187,TLSv1.2,2846,Application Data
207,15.2559045,172.20.40.110,151.101.130.187,TLSv1.2,2847,Application Data
208,15.2686792,172.20.40.110,151.101.130.187,TLSv1.2,2863,Application Data
209,15.2730326,151.101.130.187,172.20.40.110,TCP,60,443  >  62995 [ACK] Seq=81579 Ack=104310 Win=4161 Len=0
210,15.2730326,151.101.130.187,172.20.40.110,TCP,60,443  >  62995 [ACK] Seq=81579 Ack=107102 Win=4172 Len=0
211,15.2730326,151.101.130.187,172.20.40.110,TCP,60,443  >  62995 [ACK] Seq=81579 Ack=109895 Win=4183 Len=0
212,15.2760122,151.101.130.187,172.20.40.110,TLSv1.2,131,Application Data
213,15.2770824,151.101.130.187,172.20.40.110,TLSv1.2,130,Application Data
214,15.2770824,151.101.130.187,172.20.40.110,TLSv1.2,131,Application Data
215,15.277163,172.20.40.110,151.101.130.187,TCP,54,62995  >  443 [ACK] Seq=112704 Ack=81809 Win=510 Len=0
216,15.2784646,151.101.130.187,172.20.40.110,TCP,60,443  >  62995 [ACK] Seq=81809 Ack=112704 Win=4194 Len=0
217,15.2797845,151.101.130.187,172.20.40.110,TLSv1.2,125,Application Data
218,15.2800064,172.20.40.110,151.101.130.187,TCP,54,62995  >  443 [ACK] Seq=112704 Ack=81880 Win=510 Len=0
219,16.8130848,172.20.40.110,151.101.130.187,TLSv1.2,3131,Application Data
220,16.8151124,172.20.40.110,151.101.130.187,TLSv1.2,3093,Application Data
221,16.8153522,172.20.40.110,151.101.130.187,TLSv1.2,3113,Application Data
222,16.8155877,172.20.40.110,151.101.130.187,TLSv1.2,3111,Application Data
223,16.8251925,151.101.130.187,172.20.40.110,TCP,60,443  >  62995 [ACK] Seq=81880 Ack=115781 Win=4206 Len=0
224,16.8376845,151.101.130.187,172.20.40.110,TCP,60,443  >  62995 [ACK] Seq=81880 Ack=118820 Win=4218 Len=0
225,16.8376845,151.101.130.187,172.20.40.110,TCP,60,443  >  62995 [ACK] Seq=81880 Ack=121879 Win=4230 Len=0
226,16.8376845,151.101.130.187,172.20.40.110,TCP,60,443  >  62995 [ACK] Seq=81880 Ack=124936 Win=4242 Len=0
227,16.9540628,151.101.130.187,172.20.40.110,TLSv1.2,558,Application Data
228,16.9540628,151.101.130.187,172.20.40.110,TCP,5574,443  >  62995 [ACK] Seq=82384 Ack=124936 Win=4242 Len=5520 [TCP PDU reassembled in 235]
229,16.9541484,172.20.40.110,151.101.130.187,TCP,54,62995  >  443 [ACK] Seq=124936 Ack=87904 Win=512 Len=0
230,16.9561576,151.101.130.187,172.20.40.110,TCP,2814,"443  >  62995 [PSH, ACK] Seq=87904 Ack=124936 Win=4242 Len=2760 [TCP PDU reassembled in 235]"
231,16.9562408,172.20.40.110,151.101.130.187,TCP,54,62995  >  443 [ACK] Seq=124936 Ack=90664 Win=512 Len=0
232,16.9588325,151.101.130.187,172.20.40.110,TCP,1434,443  >  62995 [ACK] Seq=90664 Ack=124936 Win=4242 Len=1380 [TCP PDU reassembled in 235]
233,16.9588325,151.101.130.187,172.20.40.110,TCP,5574,"443  >  62995 [PSH, ACK] Seq=92044 Ack=124936 Win=4242 Len=5520 [TCP PDU reassembled in 235]"
234,16.9589366,172.20.40.110,151.101.130.187,TCP,54,62995  >  443 [ACK] Seq=124936 Ack=97564 Win=512 Len=0
235,16.9649602,151.101.130.187,172.20.40.110,TLSv1.2,1434,Application Data
236,16.9649602,151.101.130.187,172.20.40.110,TCP,1434,443  >  62995 [ACK] Seq=98944 Ack=124936 Win=4242 Len=1380 [TCP PDU reassembled in 241]
237,16.9649602,151.101.130.187,172.20.40.110,TCP,1434,443  >  62995 [ACK] Seq=100324 Ack=124936 Win=4242 Len=1380 [TCP PDU reassembled in 241]
238,16.9649602,151.101.130.187,172.20.40.110,TCP,2814,"443  >  62995 [PSH, ACK] Seq=101704 Ack=124936 Win=4242 Len=2760 [TCP PDU reassembled in 241]"
239,16.9650459,172.20.40.110,151.101.130.187,TCP,54,62995  >  443 [ACK] Seq=124936 Ack=104464 Win=512 Len=0
240,16.9665286,151.101.130.187,172.20.40.110,TCP,1434,443  >  62995 [ACK] Seq=104464 Ack=124936 Win=4242 Len=1380 [TCP PDU reassembled in 241]
241,16.9665286,151.101.130.187,172.20.40.110,TLSv1.2,983,Application Data
242,16.9666181,172.20.40.110,151.101.130.187,TCP,54,62995  >  443 [ACK] Seq=124936 Ack=106773 Win=512 Len=0
243,16.9722274,151.101.130.187,172.20.40.110,TCP,1434,443  >  62995 [ACK] Seq=106773 Ack=124936 Win=4242 Len=1380 [TCP PDU reassembled in 248]
244,16.9722963,172.20.40.110,151.101.130.187,TCP,54,62995  >  443 [ACK] Seq=124936 Ack=108153 Win=512 Len=0
245,16.9753442,151.101.130.187,172.20.40.110,TCP,1434,443  >  62995 [ACK] Seq=108153 Ack=124936 Win=4242 Len=1380 [TCP PDU reassembled in 248]
246,16.9753442,151.101.130.187,172.20.40.110,TCP,1434,443  >  62995 [ACK] Seq=109533 Ack=124936 Win=4242 Len=1380 [TCP PDU reassembled in 248]
247,16.9753442,151.101.130.187,172.20.40.110,TCP,1434,443  >  62995 [ACK] Seq=110913 Ack=124936 Win=4242 Len=1380 [TCP PDU reassembled in 248]
248,16.9753442,151.101.130.187,172.20.40.110,TLSv1.2,1172,Application Data
249,16.9753442,151.101.130.187,172.20.40.110,TCP,1434,443  >  62995 [ACK] Seq=113411 Ack=124936 Win=4242 Len=1380 [TCP PDU reassembled in 255]
250,16.9754309,172.20.40.110,151.101.130.187,TCP,54,62995  >  443 [ACK] Seq=124936 Ack=114791 Win=512 Len=0
251,16.9775937,151.101.130.187,172.20.40.110,TCP,5574,443  >  62995 [ACK] Seq=114791 Ack=124936 Win=4242 Len=5520 [TCP PDU reassembled in 255]
252,16.9776789,172.20.40.110,151.101.130.187,TCP,54,62995  >  443 [ACK] Seq=124936 Ack=120311 Win=512 Len=0
253,16.980838,151.101.130.187,172.20.40.110,TCP,5574,"443  >  62995 [PSH, ACK] Seq=120311 Ack=124936 Win=4242 Len=5520 [TCP PDU reassembled in 255]"
254,16.9809908,172.20.40.110,151.101.130.187,TCP,54,62995  >  443 [ACK] Seq=124936 Ack=125831 Win=512 Len=0
255,16.9831011,151.101.130.187,172.20.40.110,TLSv1.2,5574,Application Data
256,16.9832153,172.20.40.110,151.101.130.187,TCP,54,62995  >  443 [ACK] Seq=124936 Ack=131351 Win=512 Len=0
257,16.9854995,151.101.130.187,172.20.40.110,TCP,1434,443  >  62995 [ACK] Seq=131351 Ack=124936 Win=4242 Len=1380 [TCP PDU reassembled in 258]
258,16.9854995,151.101.130.187,172.20.40.110,TLSv1.2,261,Application Data
259,16.9856132,172.20.40.110,151.101.130.187,TCP,54,62995  >  443 [ACK] Seq=124936 Ack=132938 Win=512 Len=0
260,17.2980972,151.101.130.187,172.20.40.110,TLSv1.2,134,Application Data
261,17.2980972,151.101.130.187,172.20.40.110,TCP,5574,443  >  62995 [ACK] Seq=133018 Ack=124936 Win=4242 Len=5520 [TCP PDU reassembled in 270]
262,17.2981833,172.20.40.110,151.101.130.187,TCP,54,62995  >  443 [ACK] Seq=124936 Ack=138538 Win=512 Len=0
263,17.300584,151.101.130.187,172.20.40.110,TCP,1434,443  >  62995 [ACK] Seq=138538 Ack=124936 Win=4242 Len=1380 [TCP PDU reassembled in 270]
264,17.3006562,172.20.40.110,151.101.130.187,TCP,54,62995  >  443 [ACK] Seq=124936 Ack=139918 Win=512 Len=0
265,17.307979,151.101.130.187,172.20.40.110,TCP,1434,"443  >  62995 [PSH, ACK] Seq=139918 Ack=124936 Win=4242 Len=1380 [TCP PDU reassembled in 270]"
266,17.307979,151.101.130.187,172.20.40.110,TCP,2814,443  >  62995 [ACK] Seq=141298 Ack=124936 Win=4242 Len=2760 [TCP PDU reassembled in 270]
267,17.307979,151.101.130.187,172.20.40.110,TCP,1434,443  >  62995 [ACK] Seq=144058 Ack=124936 Win=4242 Len=1380 [TCP PDU reassembled in 270]
268,17.307979,151.101.130.187,172.20.40.110,TCP,1434,443  >  62995 [ACK] Seq=145438 Ack=124936 Win=4242 Len=1380 [TCP PDU reassembled in 270]
269,17.307979,151.101.130.187,172.20.40.110,TCP,1434,443  >  62995 [ACK] Seq=146818 Ack=124936 Win=4242 Len=1380 [TCP PDU reassembled in 270]
270,17.307979,151.101.130.187,172.20.40.110,TLSv1.2,2814,Application Data
271,17.3080691,172.20.40.110,151.101.130.187,TCP,54,62995  >  443 [ACK] Seq=124936 Ack=150958 Win=512 Len=0
272,17.3106225,151.101.130.187,172.20.40.110,TCP,1434,443  >  62995 [ACK] Seq=150958 Ack=124936 Win=4242 Len=1380 [TCP PDU reassembled in 280]
273,17.3131464,151.101.130.187,172.20.40.110,TCP,1434,443  >  62995 [ACK] Seq=152338 Ack=124936 Win=4242 Len=1380 [TCP PDU reassembled in 280]
274,17.3131464,151.101.130.187,172.20.40.110,TCP,4194,"443  >  62995 [PSH, ACK] Seq=153718 Ack=124936 Win=4242 Len=4140 [TCP PDU reassembled in 280]"
275,17.3132383,172.20.40.110,151.101.130.187,TCP,54,62995  >  443 [ACK] Seq=124936 Ack=157858 Win=512 Len=0
276,17.3152583,151.101.130.187,172.20.40.110,TCP,1434,443  >  62995 [ACK] Seq=157858 Ack=124936 Win=4242 Len=1380 [TCP PDU reassembled in 280]
277,17.3152583,151.101.130.187,172.20.40.110,TCP,1434,443  >  62995 [ACK] Seq=159238 Ack=124936 Win=4242 Len=1380 [TCP PDU reassembled in 280]
278,17.3152583,151.101.130.187,172.20.40.110,TCP,2814,443  >  62995 [ACK] Seq=160618 Ack=124936 Win=4242 Len=2760 [TCP PDU reassembled in 280]
279,17.3153379,172.20.40.110,151.101.130.187,TCP,54,62995  >  443 [ACK] Seq=124936 Ack=163378 Win=512 Len=0
280,17.3181359,151.101.130.187,172.20.40.110,TLSv1.2,5574,Application Data
281,17.3182256,172.20.40.110,151.101.130.187,TCP,54,62995  >  443 [ACK] Seq=124936 Ack=168898 Win=512 Len=0
282,17.3228055,151.101.130.187,172.20.40.110,TCP,1434,443  >  62995 [ACK] Seq=168898 Ack=124936 Win=4242 Len=1380 [TCP PDU reassembled in 285]
283,17.3228055,151.101.130.187,172.20.40.110,TCP,1434,443  >  62995 [ACK] Seq=170278 Ack=124936 Win=4242 Len=1380 [TCP PDU reassembled in 285]
284,17.3228055,151.101.130.187,172.20.40.110,TCP,1434,443  >  62995 [ACK] Seq=171658 Ack=124936 Win=4242 Len=1380 [TCP PDU reassembled in 285]
285,17.3228055,151.101.130.187,172.20.40.110,TLSv1.2,2814,Application Data
286,17.3228835,172.20.40.110,151.101.130.187,TCP,54,62995  >  443 [ACK] Seq=124936 Ack=175798 Win=512 Len=0
287,17.330944,151.101.130.187,172.20.40.110,TCP,1434,443  >  62995 [ACK] Seq=175798 Ack=124936 Win=4242 Len=1380 [TCP PDU reassembled in 298]
288,17.330944,151.101.130.187,172.20.40.110,TCP,1434,443  >  62995 [ACK] Seq=177178 Ack=124936 Win=4242 Len=1380 [TCP PDU reassembled in 298]
289,17.330944,151.101.130.187,172.20.40.110,TCP,1434,443  >  62995 [ACK] Seq=178558 Ack=124936 Win=4242 Len=1380 [TCP PDU reassembled in 298]
290,17.330944,151.101.130.187,172.20.40.110,TCP,1434,443  >  62995 [ACK] Seq=179938 Ack=124936 Win=4242 Len=1380 [TCP PDU reassembled in 298]
291,17.330944,151.101.130.187,172.20.40.110,TCP,1434,"443  >  62995 [PSH, ACK] Seq=181318 Ack=124936 Win=4242 Len=1380 [TCP PDU reassembled in 298]"
292,17.3310684,172.20.40.110,151.101.130.187,TCP,54,62995  >  443 [ACK] Seq=124936 Ack=182698 Win=512 Len=0
293,17.3365386,151.101.130.187,172.20.40.110,TCP,1434,443  >  62995 [ACK] Seq=182698 Ack=124936 Win=4242 Len=1380 [TCP PDU reassembled in 298]
294,17.3365386,151.101.130.187,172.20.40.110,TCP,1434,443  >  62995 [ACK] Seq=184078 Ack=124936 Win=4242 Len=1380 [TCP PDU reassembled in 298]
295,17.3366255,172.20.40.110,151.101.130.187,TCP,54,62995  >  443 [ACK] Seq=124936 Ack=185458 Win=512 Len=0
296,17.3422611,151.101.130.187,172.20.40.110,TCP,1434,443  >  62995 [ACK] Seq=185458 Ack=124936 Win=4242 Len=1380 [TCP PDU reassembled in 298]
297,17.3422611,151.101.130.187,172.20.40.110,TCP,1434,443  >  62995 [ACK] Seq=186838 Ack=124936 Win=4242 Len=1380 [TCP PDU reassembled in 298]
298,17.3422611,151.101.130.187,172.20.40.110,TLSv1.2,1434,Application Data
299,17.3422611,151.101.130.187,172.20.40.110,TLSv1.2,1434,Application Data
300,17.3422611,151.101.130.187,172.20.40.110,TCP,2814,443  >  62995 [ACK] Seq=190978 Ack=124936 Win=4242 Len=2760 [TCP PDU reassembled in 303]
301,17.3423742,172.20.40.110,151.101.130.187,TCP,54,62995  >  443 [ACK] Seq=124936 Ack=193738 Win=512 Len=0
302,17.3432495,151.101.130.187,172.20.40.110,TCP,1434,443  >  62995 [ACK] Seq=193738 Ack=124936 Win=4242 Len=1380 [TCP PDU reassembled in 303]
303,17.3432495,151.101.130.187,172.20.40.110,TLSv1.2,185,"Application Data, Application Data"
304,17.3433141,172.20.40.110,151.101.130.187,TCP,54,62995  >  443 [ACK] Seq=124936 Ack=195249 Win=512 Len=0
305,17.3591008,151.101.130.187,172.20.40.110,TCP,4194,"443  >  62995 [PSH, ACK] Seq=195249 Ack=124936 Win=4242 Len=4140 [TCP PDU reassembled in 314]"
306,17.3591947,172.20.40.110,151.101.130.187,TCP,54,62995  >  443 [ACK] Seq=124936 Ack=199389 Win=512 Len=0
307,17.362776,151.101.130.187,172.20.40.110,TCP,4194,"443  >  62995 [PSH, ACK] Seq=199389 Ack=124936 Win=4242 Len=4140 [TCP PDU reassembled in 314]"
308,17.3628732,172.20.40.110,151.101.130.187,TCP,54,62995  >  443 [ACK] Seq=124936 Ack=203529 Win=512 Len=0
309,17.365118,151.101.130.187,172.20.40.110,TCP,1434,443  >  62995 [ACK] Seq=203529 Ack=124936 Win=4242 Len=1380 [TCP PDU reassembled in 314]
310,17.3651897,172.20.40.110,151.101.130.187,TCP,54,62995  >  443 [ACK] Seq=124936 Ack=204909 Win=512 Len=0
311,17.3683756,151.101.130.187,172.20.40.110,TCP,1434,443  >  62995 [ACK] Seq=204909 Ack=124936 Win=4242 Len=1380 [TCP PDU reassembled in 314]
312,17.3683756,151.101.130.187,172.20.40.110,TCP,1434,"443  >  62995 [PSH, ACK] Seq=206289 Ack=124936 Win=4242 Len=1380 [TCP PDU reassembled in 314]"
313,17.3683756,151.101.130.187,172.20.40.110,TCP,1434,443  >  62995 [ACK] Seq=207669 Ack=124936 Win=4242 Len=1380 [TCP PDU reassembled in 314]
314,17.3683756,151.101.130.187,172.20.40.110,TLSv1.2,2814,Application Data
315,17.3684581,172.20.40.110,151.101.130.187,TCP,54,62995  >  443 [ACK] Seq=124936 Ack=211809 Win=512 Len=0
316,17.3710422,151.101.130.187,172.20.40.110,TCP,4194,"443  >  62995 [PSH, ACK] Seq=211809 Ack=124936 Win=4242 Len=4140 [TCP PDU reassembled in 325]"
317,17.3711216,172.20.40.110,151.101.130.187,TCP,54,62995  >  443 [ACK] Seq=124936 Ack=215949 Win=512 Len=0
318,17.3745712,151.101.130.187,172.20.40.110,TCP,1434,443  >  62995 [ACK] Seq=215949 Ack=124936 Win=4242 Len=1380 [TCP PDU reassembled in 325]
319,17.3745712,151.101.130.187,172.20.40.110,TCP,4194,"443  >  62995 [PSH, ACK] Seq=217329 Ack=124936 Win=4242 Len=4140 [TCP PDU reassembled in 325]"
320,17.3746604,172.20.40.110,151.101.130.187,TCP,54,62995  >  443 [ACK] Seq=124936 Ack=221469 Win=512 Len=0
321,17.377772,151.101.130.187,172.20.40.110,TCP,2814,"443  >  62995 [PSH, ACK] Seq=221469 Ack=124936 Win=4242 Len=2760 [TCP PDU reassembled in 325]"
322,17.3778428,172.20.40.110,151.101.130.187,TCP,54,62995  >  443 [ACK] Seq=124936 Ack=224229 Win=512 Len=0
323,17.3811683,151.101.130.187,172.20.40.110,TCP,1434,443  >  62995 [ACK] Seq=224229 Ack=124936 Win=4242 Len=1380 [TCP PDU reassembled in 325]
324,17.3811683,151.101.130.187,172.20.40.110,TCP,1434,443  >  62995 [ACK] Seq=225609 Ack=124936 Win=4242 Len=1380 [TCP PDU reassembled in 325]
325,17.3811683,151.101.130.187,172.20.40.110,TLSv1.2,2814,Application Data
326,17.3812416,172.20.40.110,151.101.130.187,TCP,54,62995  >  443 [ACK] Seq=124936 Ack=229749 Win=512 Len=0
327,17.3841623,151.101.130.187,172.20.40.110,TCP,5574,"443  >  62995 [PSH, ACK] Seq=229749 Ack=124936 Win=4242 Len=5520 [TCP PDU reassembled in 335]"
328,17.3842387,172.20.40.110,151.101.130.187,TCP,54,62995  >  443 [ACK] Seq=124936 Ack=235269 Win=512 Len=0
329,17.3874495,151.101.130.187,172.20.40.110,TCP,1434,"443  >  62995 [PSH, ACK] Seq=235269 Ack=124936 Win=4242 Len=1380 [TCP PDU reassembled in 335]"
330,17.3897055,151.101.130.187,172.20.40.110,TCP,1434,443  >  62995 [ACK] Seq=236649 Ack=124936 Win=4242 Len=1380 [TCP PDU reassembled in 335]
331,17.3897055,151.101.130.187,172.20.40.110,TCP,1434,443  >  62995 [ACK] Seq=238029 Ack=124936 Win=4242 Len=1380 [TCP PDU reassembled in 335]
332,17.3897055,151.101.130.187,172.20.40.110,TCP,1434,"443  >  62995 [PSH, ACK] Seq=239409 Ack=124936 Win=4242 Len=1380 [TCP PDU reassembled in 335]"
333,17.3897055,151.101.130.187,172.20.40.110,TCP,1434,443  >  62995 [ACK] Seq=240789 Ack=124936 Win=4242 Len=1380 [TCP PDU reassembled in 335]
334,17.3897945,172.20.40.110,151.101.130.187,TCP,54,62995  >  443 [ACK] Seq=124936 Ack=242169 Win=512 Len=0
335,17.3919732,151.101.130.187,172.20.40.110,TLSv1.2,5574,Application Data
336,17.3920469,172.20.40.110,151.101.130.187,TCP,54,62995  >  443 [ACK] Seq=124936 Ack=247689 Win=512 Len=0
337,17.394337,151.101.130.187,172.20.40.110,TCP,4194,"443  >  62995 [PSH, ACK] Seq=247689 Ack=124936 Win=4242 Len=4140 [TCP PDU reassembled in 343]"
338,17.3944195,172.20.40.110,151.101.130.187,TCP,54,62995  >  443 [ACK] Seq=124936 Ack=251829 Win=512 Len=0
339,17.3987246,151.101.130.187,172.20.40.110,TCP,1434,443  >  62995 [ACK] Seq=251829 Ack=124936 Win=4242 Len=1380 [TCP PDU reassembled in 343]
340,17.3987246,151.101.130.187,172.20.40.110,TCP,1434,"443  >  62995 [PSH, ACK] Seq=253209 Ack=124936 Win=4242 Len=1380 [TCP PDU reassembled in 343]"
341,17.3987957,172.20.40.110,151.101.130.187,TCP,54,62995  >  443 [ACK] Seq=124936 Ack=254589 Win=512 Len=0
342,17.4006337,151.101.130.187,172.20.40.110,TCP,1434,443  >  62995 [ACK] Seq=254589 Ack=124936 Win=4242 Len=1380 [TCP PDU reassembled in 343]
343,17.4006337,151.101.130.187,172.20.40.110,TLSv1.2,79,Application Data
344,17.4007014,172.20.40.110,151.101.130.187,TCP,54,62995  >  443 [ACK] Seq=124936 Ack=255994 Win=512 Len=0
345,17.4774554,172.20.40.110,151.101.66.187,TCP,66,56717  >  443 [SYN] Seq=0 Win=64240 Len=0 MSS=1460 WS=256 SACK_PERM
346,17.4851636,151.101.66.187,172.20.40.110,TCP,66,"443  >  56717 [SYN, ACK] Seq=0 Ack=1 Win=65535 Len=0 MSS=1380 SACK_PERM WS=512"
347,17.4852848,172.20.40.110,151.101.66.187,TCP,54,56717  >  443 [ACK] Seq=1 Ack=1 Win=66048 Len=0
348,17.4866547,172.20.40.110,151.101.66.187,TLSv1.3,2011,Client Hello (SNI=observability.target.com)
349,17.4971062,151.101.66.187,172.20.40.110,TCP,60,443  >  56717 [ACK] Seq=1 Ack=1958 Win=144384 Len=0
350,17.4971062,151.101.66.187,172.20.40.110,TLSv1.3,1434,"Server Hello, Change Cipher Spec, Application Data, Application Data"
351,17.4971062,151.101.66.187,172.20.40.110,TLSv1.3,215,Application Data
352,17.4972233,172.20.40.110,151.101.66.187,TCP,54,56717  >  443 [ACK] Seq=1958 Ack=1542 Win=66048 Len=0
353,17.498278,172.20.40.110,151.101.66.187,TLSv1.3,118,"Change Cipher Spec, Application Data"
354,17.4985669,172.20.40.110,151.101.66.187,TLSv1.3,146,Application Data
355,17.4988166,172.20.40.110,151.101.66.187,TLSv1.3,533,Application Data
356,17.4989606,172.20.40.110,151.101.66.187,TCP,13854,56717  >  443 [ACK] Seq=2593 Ack=1542 Win=66048 Len=13800 [TCP PDU reassembled in 363]
357,17.5092254,151.101.66.187,172.20.40.110,TCP,60,443  >  56717 [ACK] Seq=1542 Ack=2022 Win=144384 Len=0
358,17.5092254,151.101.66.187,172.20.40.110,TCP,60,443  >  56717 [ACK] Seq=1542 Ack=2114 Win=144384 Len=0
359,17.5092254,151.101.66.187,172.20.40.110,TLSv1.3,119,Application Data
360,17.5093264,172.20.40.110,151.101.66.187,TCP,1434,56717  >  443 [ACK] Seq=16393 Ack=1607 Win=66048 Len=1380 [TCP PDU reassembled in 363]
361,17.5114569,151.101.66.187,172.20.40.110,TCP,60,443  >  56717 [ACK] Seq=1607 Ack=2593 Win=144384 Len=0
362,17.5138593,151.101.66.187,172.20.40.110,TCP,60,443  >  56717 [ACK] Seq=1607 Ack=10873 Win=136192 Len=0
363,17.5140602,172.20.40.110,151.101.66.187,TLSv1.3,2326,"Application Data, Application Data, Application Data"
364,17.5172297,151.101.66.187,172.20.40.110,TCP,60,443  >  56717 [ACK] Seq=1607 Ack=16393 Win=131072 Len=0
365,17.5224894,151.101.66.187,172.20.40.110,TCP,60,443  >  56717 [ACK] Seq=1607 Ack=20045 Win=127488 Len=0
366,17.5224894,151.101.66.187,172.20.40.110,TLSv1.3,89,Application Data
367,17.547692,151.101.66.187,172.20.40.110,TCP,89,"[TCP Retransmission] 443  >  56717 [PSH, ACK] Seq=1607 Ack=20045 Win=127488 Len=35"
368,17.5477608,172.20.40.110,151.101.66.187,TCP,66,56717  >  443 [ACK] Seq=20045 Ack=1642 Win=66048 Len=0 SLE=1607 SRE=1642
369,17.6075809,151.101.66.187,172.20.40.110,TLSv1.3,441,Application Data
370,17.6339696,151.101.66.187,172.20.40.110,TCP,441,"[TCP Retransmission] 443  >  56717 [PSH, ACK] Seq=1642 Ack=20045 Win=127488 Len=387"
371,17.6342214,172.20.40.110,151.101.66.187,TCP,66,56717  >  443 [ACK] Seq=20045 Ack=2029 Win=65536 Len=0 SLE=1642 SRE=2029
372,18.4768938,172.20.40.110,151.101.130.187,TLSv1.2,2850,Application Data
373,18.4772425,172.20.40.110,151.101.130.187,TLSv1.2,2846,Application Data
374,18.4898435,151.101.130.187,172.20.40.110,TCP,60,443  >  62995 [ACK] Seq=255994 Ack=127732 Win=4252 Len=0
375,18.4898435,151.101.130.187,172.20.40.110,TCP,60,443  >  62995 [ACK] Seq=255994 Ack=130524 Win=4263 Len=0
376,18.4942817,151.101.130.187,172.20.40.110,TLSv1.2,289,Application Data
377,18.4942817,151.101.130.187,172.20.40.110,TLSv1.2,131,Application Data
378,18.4943852,172.20.40.110,151.101.130.187,TCP,54,62995  >  443 [ACK] Seq=130524 Ack=256306 Win=510 Len=0
379,21.26229,172.20.40.110,151.101.130.187,TLSv1.2,2776,Application Data
