No.,Time,Source,Destination,Protocol,Length,Info
1,0.0,172.20.40.110,151.101.130.187,TCP,66,63075  >  443 [SYN] Seq=0 Win=64240 Len=0 MSS=1460 WS=256 SACK_PERM
2,0.007741,151.101.130.187,172.20.40.110,TCP,66,"443  >  63075 [SYN, ACK] Seq=0 Ack=1 Win=65535 Len=0 MSS=1380 SACK_PERM WS=512"
3,0.0078644,172.20.40.110,151.101.130.187,TCP,54,63075  >  443 [ACK] Seq=1 Ack=1 Win=66048 Len=0
4,0.0085997,172.20.40.110,151.101.130.187,TLSv1.3,1874,Client Hello (SNI=www.target.com)
5,0.0279765,172.20.40.110,151.101.130.187,TCP,1434,"[TCP Retransmission] 63075  >  443 [PSH, ACK] Seq=441 Ack=1 Win=66048 Len=1380"
6,0.0281853,151.101.130.187,172.20.40.110,TCP,60,443  >  63075 [ACK] Seq=1 Ack=1381 Win=144896 Len=0
7,0.0364016,151.101.130.187,172.20.40.110,TCP,60,443  >  63075 [ACK] Seq=1 Ack=1821 Win=144896 Len=0
8,0.0387271,151.101.130.187,172.20.40.110,TLSv1.3,1434,"Server Hello, Change Cipher Spec, Application Data"
9,0.0387271,151.101.130.187,172.20.40.110,TCP,1434,443  >  63075 [ACK] Seq=1381 Ack=1821 Win=144896 Len=1380 [TCP PDU reassembled in 15]
10,0.0387793,172.20.40.110,151.101.130.187,TCP,54,63075  >  443 [ACK] Seq=1821 Ack=2761 Win=66048 Len=0
11,0.0407141,151.101.130.187,172.20.40.110,TCP,1434,443  >  63075 [ACK] Seq=2761 Ack=1821 Win=144896 Len=1380 [TCP PDU reassembled in 15]
12,0.0937007,172.20.40.110,151.101.130.187,TCP,54,63075  >  443 [ACK] Seq=1821 Ack=4141 Win=66048 Len=0
13,0.1524785,151.101.130.187,172.20.40.110,TCP,1434,443  >  63075 [ACK] Seq=4141 Ack=1821 Win=144896 Len=1380 [TCP PDU reassembled in 15]
14,0.1524785,151.101.130.187,172.20.40.110,TCP,1434,"443  >  63075 [PSH, ACK] Seq=5521 Ack=1821 Win=144896 Len=1380 [TCP PDU reassembled in 15]"
15,0.1524785,151.101.130.187,172.20.40.110,TLSv1.3,1055,"Application Data, Application Data, Application Data, Application Data"
16,0.1524785,151.101.130.187,172.20.40.110,TCP,66,[TCP Dup ACK 7#1] 443  >  63075 [ACK] Seq=7902 Ack=1821 Win=144896 Len=0 SLE=441 SRE=1821
17,0.1524785,151.101.130.187,172.20.40.110,TCP,1055,"[TCP Retransmission] 443  >  63075 [PSH, ACK] Seq=6901 Ack=1821 Win=144896 Len=1001"
18,0.1526158,172.20.40.110,151.101.130.187,TCP,54,63075  >  443 [ACK] Seq=1821 Ack=7902 Win=66048 Len=0
19,0.1528129,172.20.40.110,151.101.130.187,TCP,66,[TCP Dup ACK 18#1] 63075  >  443 [ACK] Seq=1821 Ack=7902 Win=66048 Len=0 SLE=6901 SRE=7902
20,0.1600994,172.20.40.110,151.101.130.187,TLSv1.3,118,"Change Cipher Spec, Application Data"
21,0.1607616,172.20.40.110,151.101.130.187,TLSv1.3,146,Application Data
22,0.1614087,172.20.40.110,151.101.130.187,TLSv1.3,1097,Application Data
23,0.1688116,151.101.130.187,172.20.40.110,TCP,60,443  >  63075 [ACK] Seq=7902 Ack=1885 Win=144896 Len=0
24,0.1688116,151.101.130.187,172.20.40.110,TCP,60,443  >  63075 [ACK] Seq=7902 Ack=1977 Win=144896 Len=0
25,0.1688116,151.101.130.187,172.20.40.110,TLSv1.3,119,Application Data
26,0.1691972,172.20.40.110,151.101.130.187,TLSv1.3,85,Application Data
27,0.1724812,151.101.130.187,172.20.40.110,TCP,60,443  >  63075 [ACK] Seq=7967 Ack=3020 Win=143872 Len=0
28,0.2103172,151.101.130.187,172.20.40.110,TCP,60,443  >  63075 [ACK] Seq=7967 Ack=3051 Win=143872 Len=0
29,0.6968334,151.101.130.187,172.20.40.110,TCP,1434,443  >  63075 [ACK] Seq=7967 Ack=3051 Win=143872 Len=1380 [TCP PDU reassembled in 30]
30,0.6968334,151.101.130.187,172.20.40.110,TLSv1.3,620,"Application Data, Application Data"
31,0.6968334,151.101.130.187,172.20.40.110,TLSv1.3,4194,"Application Data, Application Data"
32,0.6974119,172.20.40.110,151.101.130.187,TCP,54,63075  >  443 [ACK] Seq=3051 Ack=14053 Win=66048 Len=0
33,0.7050431,151.101.130.187,172.20.40.110,TLSv1.3,1434,Application Data
34,0.7050431,151.101.130.187,172.20.40.110,TLSv1.3,1434,Application Data
35,0.7050431,151.101.130.187,172.20.40.110,TLSv1.3,1434,Application Data
36,0.7050431,151.101.130.187,172.20.40.110,TLSv1.3,6954,"Application Data, Application Data, Application Data, Application Data, Application Data"
37,0.7052335,172.20.40.110,151.101.130.187,TCP,54,63075  >  443 [ACK] Seq=3051 Ack=25093 Win=66048 Len=0
38,0.7072404,151.101.130.187,172.20.40.110,TLSv1.3,5574,"Application Data, Application Data, Application Data, Application Data"
39,0.7073454,172.20.40.110,151.101.130.187,TCP,54,63075  >  443 [ACK] Seq=3051 Ack=30613 Win=66048 Len=0
40,0.7096789,151.101.130.187,172.20.40.110,TLSv1.3,5574,"Application Data, Application Data, Application Data, Application Data"
41,0.7097856,172.20.40.110,151.101.130.187,TCP,54,63075  >  443 [ACK] Seq=3051 Ack=36133 Win=66048 Len=0
42,0.7127641,151.101.130.187,172.20.40.110,TLSv1.3,5574,"Application Data, Application Data, Application Data, Application Data"
43,0.7128807,172.20.40.110,151.101.130.187,TCP,54,63075  >  443 [ACK] Seq=3051 Ack=41653 Win=66048 Len=0
44,0.7150146,151.101.130.187,172.20.40.110,TLSv1.3,5574,"Application Data, Application Data, Application Data, Application Data"
45,0.7151171,172.20.40.110,151.101.130.187,TCP,54,63075  >  443 [ACK] Seq=3051 Ack=47173 Win=66048 Len=0
46,0.7174385,151.101.130.187,172.20.40.110,TLSv1.3,1434,Application Data
47,0.7175619,172.20.40.110,151.101.130.187,TCP,54,63075  >  443 [ACK] Seq=3051 Ack=48553 Win=66048 Len=0
48,0.7205684,151.101.130.187,172.20.40.110,TLSv1.3,1434,Application Data
49,0.7205684,151.101.130.187,172.20.40.110,TLSv1.3,6954,"Application Data, Application Data, Application Data, Application Data, Application Data"
50,0.7206977,172.20.40.110,151.101.130.187,TCP,54,63075  >  443 [ACK] Seq=3051 Ack=56833 Win=66048 Len=0
51,0.7250049,151.101.130.187,172.20.40.110,TLSv1.3,1434,Application Data
52,0.7294664,151.101.130.187,172.20.40.110,TLSv1.3,1434,Application Data
53,0.7295738,172.20.40.110,151.101.130.187,TCP,54,63075  >  443 [ACK] Seq=3051 Ack=59593 Win=66048 Len=0
54,0.7438544,151.101.130.187,172.20.40.110,TLSv1.3,1434,Application Data
55,0.7438544,151.101.130.187,172.20.40.110,TLSv1.3,1434,Application Data
56,0.7438544,151.101.130.187,172.20.40.110,TLSv1.3,1434,Application Data
57,0.7439507,172.20.40.110,151.101.130.187,TCP,54,63075  >  443 [ACK] Seq=3051 Ack=63733 Win=66048 Len=0
58,0.7459765,151.101.130.187,172.20.40.110,TLSv1.3,1434,Application Data
59,0.7459765,151.101.130.187,172.20.40.110,TLSv1.3,2814,"Application Data, Application Data"
60,0.7460771,172.20.40.110,151.101.130.187,TCP,54,63075  >  443 [ACK] Seq=3051 Ack=67873 Win=66048 Len=0
61,0.7482734,151.101.130.187,172.20.40.110,TLSv1.3,4194,"Application Data, Application Data, Application Data"
62,0.7483667,172.20.40.110,151.101.130.187,TCP,54,63075  >  443 [ACK] Seq=3051 Ack=72013 Win=66048 Len=0
63,0.7493927,151.101.130.187,172.20.40.110,TLSv1.3,1009,"Application Data, Application Data"
64,0.7494624,172.20.40.110,151.101.130.187,TCP,54,63075  >  443 [ACK] Seq=3051 Ack=72968 Win=65280 Len=0
65,1.2827744,172.20.40.110,151.101.130.187,TLSv1.3,1386,Application Data
66,1.2829073,172.20.40.110,151.101.130.187,TLSv1.3,289,Application Data
67,1.2830413,172.20.40.110,151.101.130.187,TLSv1.3,552,Application Data
68,1.2866112,172.20.40.110,151.101.130.187,TLSv1.3,435,Application Data
69,1.2867965,172.20.40.110,151.101.130.187,TLSv1.3,1387,Application Data
70,1.2869027,172.20.40.110,151.101.130.187,TLSv1.3,313,Application Data
71,1.2870119,172.20.40.110,151.101.130.187,TLSv1.3,552,Application Data
72,1.2871136,172.20.40.110,151.101.130.187,TLSv1.3,429,Application Data
73,1.3003371,151.101.130.187,172.20.40.110,TCP,60,443  >  63075 [ACK] Seq=72968 Ack=4383 Win=142848 Len=0
74,1.3003371,151.101.130.187,172.20.40.110,TLSv1.3,269,Application Data
75,1.3003371,151.101.130.187,172.20.40.110,TCP,60,443  >  63075 [ACK] Seq=73183 Ack=4618 Win=142848 Len=0
76,1.3003371,151.101.130.187,172.20.40.110,TCP,60,443  >  63075 [ACK] Seq=73183 Ack=5116 Win=142848 Len=0
77,1.3003371,151.101.130.187,172.20.40.110,TCP,60,443  >  63075 [ACK] Seq=73183 Ack=5497 Win=142848 Len=0
78,1.3003371,151.101.130.187,172.20.40.110,TCP,60,443  >  63075 [ACK] Seq=73183 Ack=6830 Win=141824 Len=0
79,1.3003371,151.101.130.187,172.20.40.110,TCP,60,443  >  63075 [ACK] Seq=73183 Ack=7962 Win=140800 Len=0
80,1.3082839,151.101.130.187,172.20.40.110,TLSv1.3,185,Application Data
81,1.3082839,151.101.130.187,172.20.40.110,TLSv1.3,130,Application Data
82,1.3083492,172.20.40.110,151.101.130.187,TCP,54,63075  >  443 [ACK] Seq=7962 Ack=73390 Win=64768 Len=0
83,1.3093415,151.101.130.187,172.20.40.110,TLSv1.3,152,Application Data
84,1.3093415,151.101.130.187,172.20.40.110,TLSv1.3,239,Application Data
85,1.3093415,151.101.130.187,172.20.40.110,TLSv1.3,226,Application Data
86,1.3094113,172.20.40.110,151.101.130.187,TCP,54,63075  >  443 [ACK] Seq=7962 Ack=73845 Win=66048 Len=0
87,1.7563989,172.20.40.110,151.101.130.187,TLSv1.3,1387,Application Data
88,1.7565345,172.20.40.110,151.101.130.187,TLSv1.3,146,Application Data
89,1.7566022,172.20.40.110,151.101.130.187,TLSv1.3,158,Application Data
90,1.7657105,151.101.130.187,172.20.40.110,TCP,60,443  >  63075 [ACK] Seq=73845 Ack=9295 Win=139776 Len=0
91,1.7670295,151.101.130.187,172.20.40.110,TCP,60,443  >  63075 [ACK] Seq=73845 Ack=9387 Win=139776 Len=0
92,1.7670295,151.101.130.187,172.20.40.110,TCP,60,443  >  63075 [ACK] Seq=73845 Ack=9491 Win=139776 Len=0
93,1.7727089,151.101.130.187,172.20.40.110,TLSv1.3,208,Application Data
94,1.7727089,151.101.130.187,172.20.40.110,TLSv1.3,142,"Application Data, Application Data"
95,1.7727868,172.20.40.110,151.101.130.187,TCP,54,63075  >  443 [ACK] Seq=9491 Ack=74087 Win=65792 Len=0
96,1.808095,172.20.40.110,151.101.130.187,TLSv1.3,195,Application Data
97,1.8158827,151.101.130.187,172.20.40.110,TCP,60,443  >  63075 [ACK] Seq=74087 Ack=9632 Win=139776 Len=0
98,1.818727,151.101.130.187,172.20.40.110,TLSv1.3,124,Application Data
99,1.8631304,172.20.40.110,151.101.130.187,TCP,54,63075  >  443 [ACK] Seq=9632 Ack=74157 Win=65792 Len=0
100,2.9103309,172.20.40.110,151.101.130.187,TLSv1.3,346,Application Data
101,2.9180302,151.101.130.187,172.20.40.110,TCP,60,443  >  63075 [ACK] Seq=74157 Ack=9924 Win=139776 Len=0
102,2.9203502,151.101.130.187,172.20.40.110,TLSv1.3,241,Application Data
103,2.9644005,172.20.40.110,151.101.130.187,TCP,54,63075  >  443 [ACK] Seq=9924 Ack=74344 Win=65536 Len=0
104,2.9692781,172.20.40.110,151.101.130.187,TLSv1.3,540,Application Data
105,2.9768994,151.101.130.187,172.20.40.110,TCP,60,443  >  63075 [ACK] Seq=74344 Ack=10410 Win=139776 Len=0
106,2.9803386,151.101.130.187,172.20.40.110,TLSv1.3,104,Application Data
107,2.9889928,172.20.40.110,151.101.130.187,TLSv1.3,452,Application Data
108,2.990431,172.20.40.110,151.101.130.187,TLSv1.3,1417,Application Data
109,2.9962402,151.101.130.187,172.20.40.110,TCP,60,443  >  63075 [ACK] Seq=74394 Ack=10808 Win=139776 Len=0
110,2.998535,151.101.130.187,172.20.40.110,TCP,60,443  >  63075 [ACK] Seq=74394 Ack=12171 Win=138752 Len=0
111,2.998535,151.101.130.187,172.20.40.110,TLSv1.3,98,Application Data
112,3.000604,151.101.130.187,172.20.40.110,TLSv1.3,98,Application Data
113,3.0006763,172.20.40.110,151.101.130.187,TCP,54,63075  >  443 [ACK] Seq=12171 Ack=74482 Win=65536 Len=0
114,3.2322894,172.20.40.110,151.101.130.187,TLSv1.3,393,Application Data
115,3.2338881,172.20.40.110,151.101.130.187,TLSv1.3,759,Application Data
116,3.2413132,151.101.130.187,172.20.40.110,TCP,60,443  >  63075 [ACK] Seq=74482 Ack=12510 Win=138752 Len=0
117,3.2423426,151.101.130.187,172.20.40.110,TCP,60,443  >  63075 [ACK] Seq=74482 Ack=13215 Win=138240 Len=0
118,3.2437516,151.101.130.187,172.20.40.110,TLSv1.3,130,Application Data
119,3.2448443,151.101.130.187,172.20.40.110,TLSv1.3,181,Application Data
120,3.2449297,172.20.40.110,151.101.130.187,TCP,54,63075  >  443 [ACK] Seq=13215 Ack=74685 Win=65280 Len=0
121,3.3370359,172.20.40.110,151.101.130.187,TLSv1.3,1465,Application Data
122,3.3487137,151.101.130.187,172.20.40.110,TCP,60,443  >  63075 [ACK] Seq=74685 Ack=14626 Win=137728 Len=0
123,3.3497255,151.101.130.187,172.20.40.110,TLSv1.3,131,Application Data
124,3.3980419,172.20.40.110,151.101.130.187,TCP,54,63075  >  443 [ACK] Seq=14626 Ack=74762 Win=65280 Len=0
125,9.5080059,172.20.40.110,151.101.130.187,TLSv1.3,678,Application Data
126,9.5088733,172.20.40.110,151.101.130.187,TLSv1.3,1740,Application Data
127,9.5150374,172.20.40.110,151.101.130.187,TLSv1.3,817,Application Data
128,9.5152801,172.20.40.110,151.101.130.187,TLSv1.3,1710,Application Data
129,9.5241841,172.20.40.110,151.101.130.187,TLSv1.3,817,Application Data
130,9.5254621,172.20.40.110,151.101.130.187,TLSv1.3,1706,Application Data
131,9.5256872,172.20.40.110,151.101.130.187,TLSv1.3,817,Application Data
132,9.5414645,151.101.130.187,172.20.40.110,TCP,60,443  >  63075 [ACK] Seq=74762 Ack=15250 Win=138240 Len=0
133,9.5441999,151.101.130.187,172.20.40.110,TCP,60,443  >  63075 [ACK] Seq=74762 Ack=16936 Win=137216 Len=0
134,9.5463598,151.101.130.187,172.20.40.110,TLSv1.3,214,Application Data
135,9.5463598,151.101.130.187,172.20.40.110,TLSv1.3,131,Application Data
136,9.5463598,151.101.130.187,172.20.40.110,TCP,60,443  >  63075 [ACK] Seq=74999 Ack=17699 Win=138240 Len=0
137,9.5463598,151.101.130.187,172.20.40.110,TCP,60,443  >  63075 [ACK] Seq=74999 Ack=19355 Win=137216 Len=0
138,9.5464593,172.20.40.110,151.101.130.187,TCP,54,63075  >  443 [ACK] Seq=22533 Ack=74999 Win=65024 Len=0
139,9.5489429,151.101.130.187,172.20.40.110,TLSv1.3,152,Application Data
140,9.5489429,151.101.130.187,172.20.40.110,TLSv1.3,192,Application Data
141,9.5492677,172.20.40.110,151.101.130.187,TCP,54,63075  >  443 [ACK] Seq=22533 Ack=75235 Win=66048 Len=0
142,9.5593504,151.101.130.187,172.20.40.110,TCP,60,443  >  63075 [ACK] Seq=75235 Ack=20118 Win=138240 Len=0
143,9.5593504,151.101.130.187,172.20.40.110,TCP,60,443  >  63075 [ACK] Seq=75235 Ack=22533 Win=137216 Len=0
144,9.5624115,151.101.130.187,172.20.40.110,TLSv1.3,98,Application Data
145,9.5624115,151.101.130.187,172.20.40.110,TLSv1.3,208,Application Data
146,9.5625553,172.20.40.110,151.101.130.187,TCP,54,63075  >  443 [ACK] Seq=22533 Ack=75433 Win=65792 Len=0
147,9.5644222,151.101.130.187,172.20.40.110,TLSv1.3,130,Application Data
148,9.6568488,151.101.130.187,172.20.40.110,TCP,130,"[TCP Retransmission] 443  >  63075 [PSH, ACK] Seq=75433 Ack=22533 Win=138752 Len=76"
149,9.6569731,172.20.40.110,151.101.130.187,TCP,66,63075  >  443 [ACK] Seq=22533 Ack=75509 Win=65792 Len=0 SLE=75433 SRE=75509
150,9.844717,172.20.40.110,151.101.130.187,TLSv1.3,1708,Application Data
151,9.846526,172.20.40.110,151.101.130.187,TLSv1.3,834,Application Data
152,9.8481575,172.20.40.110,151.101.130.187,TLSv1.3,1752,Application Data
153,9.8492861,172.20.40.110,151.101.130.187,TLSv1.3,800,Application Data
154,9.8536658,172.20.40.110,151.101.130.187,TLSv1.3,1767,Application Data
155,9.8540238,172.20.40.110,151.101.130.187,TLSv1.3,791,Application Data
156,9.8762789,151.101.130.187,172.20.40.110,TCP,60,443  >  63075 [ACK] Seq=75509 Ack=24187 Win=137216 Len=0
157,9.881459,151.101.130.187,172.20.40.110,TCP,60,443  >  63075 [ACK] Seq=75509 Ack=24967 Win=137216 Len=0
158,9.881459,151.101.130.187,172.20.40.110,TCP,60,443  >  63075 [ACK] Seq=75509 Ack=26665 Win=136192 Len=0
159,9.881459,151.101.130.187,172.20.40.110,TLSv1.3,104,Application Data
160,9.881459,151.101.130.187,172.20.40.110,TLSv1.3,125,Application Data
161,9.881459,151.101.130.187,172.20.40.110,TCP,60,443  >  63075 [ACK] Seq=75630 Ack=27411 Win=138240 Len=0
162,9.881459,151.101.130.187,172.20.40.110,TLSv1.3,104,Application Data
163,9.8815771,172.20.40.110,151.101.130.187,TCP,54,63075  >  443 [ACK] Seq=29861 Ack=75680 Win=65792 Len=0
164,9.8835927,151.101.130.187,172.20.40.110,TLSv1.3,124,Application Data
165,9.8835927,151.101.130.187,172.20.40.110,TCP,60,443  >  63075 [ACK] Seq=75750 Ack=29124 Win=137216 Len=0
166,9.8835927,151.101.130.187,172.20.40.110,TCP,60,443  >  63075 [ACK] Seq=75750 Ack=29861 Win=136704 Len=0
167,9.8837979,172.20.40.110,151.101.130.187,TCP,54,63075  >  443 [ACK] Seq=29861 Ack=75750 Win=65536 Len=0
168,9.890926,151.101.130.187,172.20.40.110,TLSv1.3,196,"Application Data, Application Data"
169,9.891088,172.20.40.110,151.101.130.187,TCP,54,63075  >  443 [ACK] Seq=29861 Ack=75892 Win=65536 Len=0
170,14.1841572,172.20.40.110,151.101.130.187,TLSv1.3,1918,Application Data
171,14.1952445,151.101.130.187,172.20.40.110,TCP,60,443  >  63075 [ACK] Seq=75892 Ack=31725 Win=137216 Len=0
172,14.2032564,151.101.130.187,172.20.40.110,TLSv1.3,241,Application Data
173,14.284491,151.101.130.187,172.20.40.110,TCP,241,"[TCP Retransmission] 443  >  63075 [PSH, ACK] Seq=75892 Ack=31725 Win=138752 Len=187"
174,14.2845438,172.20.40.110,151.101.130.187,TCP,66,63075  >  443 [ACK] Seq=31725 Ack=76079 Win=65280 Len=0 SLE=75892 SRE=76079
175,14.8637864,172.20.40.110,151.101.130.187,TLSv1.3,636,Application Data
176,14.8639549,172.20.40.110,151.101.130.187,TLSv1.3,1886,Application Data
177,14.8718793,151.101.130.187,172.20.40.110,TCP,60,443  >  63075 [ACK] Seq=76079 Ack=32307 Win=138240 Len=0
178,14.8742144,151.101.130.187,172.20.40.110,TCP,60,443  >  63075 [ACK] Seq=76079 Ack=34139 Win=136704 Len=0
179,14.8742144,151.101.130.187,172.20.40.110,TLSv1.3,284,Application Data
180,14.8762909,151.101.130.187,172.20.40.110,TLSv1.3,130,Application Data
181,14.876367,172.20.40.110,151.101.130.187,TCP,54,63075  >  443 [ACK] Seq=34139 Ack=76385 Win=65024 Len=0
182,17.8068431,172.20.40.110,151.101.130.187,TLSv1.3,728,Application Data
183,17.8150314,151.101.130.187,172.20.40.110,TCP,60,443  >  63075 [ACK] Seq=76385 Ack=34813 Win=138240 Len=0
184,17.8182497,151.101.130.187,172.20.40.110,TLSv1.3,214,Application Data
185,17.8649308,172.20.40.110,151.101.130.187,TLSv1.3,1812,Application Data
186,17.8675075,172.20.40.110,151.101.130.187,TLSv1.3,719,Application Data
187,17.8738468,151.101.130.187,172.20.40.110,TCP,60,443  >  63075 [ACK] Seq=76545 Ack=36571 Win=137216 Len=0
188,17.8761615,151.101.130.187,172.20.40.110,TCP,60,443  >  63075 [ACK] Seq=76545 Ack=37236 Win=137216 Len=0
189,17.8761615,151.101.130.187,172.20.40.110,TLSv1.3,98,Application Data
190,17.8774091,151.101.130.187,172.20.40.110,TLSv1.3,98,Application Data
191,17.8776675,172.20.40.110,151.101.130.187,TCP,54,63075  >  443 [ACK] Seq=37236 Ack=76633 Win=66048 Len=0
192,18.8852896,172.20.40.110,151.101.130.187,TLSv1.3,1812,Application Data
193,18.8866428,172.20.40.110,151.101.130.187,TLSv1.3,729,Application Data
194,18.8879686,172.20.40.110,151.101.130.187,TLSv1.3,1794,Application Data
195,18.8976581,172.20.40.110,151.101.130.187,TLSv1.3,742,Application Data
196,18.9104559,151.101.130.187,172.20.40.110,TCP,60,443  >  63075 [ACK] Seq=76633 Ack=38994 Win=137216 Len=0
197,18.9104559,151.101.130.187,172.20.40.110,TCP,60,443  >  63075 [ACK] Seq=76633 Ack=39669 Win=136704 Len=0
198,18.9104559,151.101.130.187,172.20.40.110,TCP,60,443  >  63075 [ACK] Seq=76633 Ack=41409 Win=135168 Len=0
199,18.9147049,151.101.130.187,172.20.40.110,TLSv1.3,262,Application Data
200,18.91898,151.101.130.187,172.20.40.110,TLSv1.3,217,Application Data
201,18.91898,151.101.130.187,172.20.40.110,TLSv1.3,155,Application Data
202,18.91898,151.101.130.187,172.20.40.110,TCP,60,443  >  63075 [ACK] Seq=77105 Ack=42097 Win=138240 Len=0
203,18.919081,172.20.40.110,151.101.130.187,TCP,54,63075  >  443 [ACK] Seq=42097 Ack=77105 Win=65536 Len=0
204,18.9215257,151.101.130.187,172.20.40.110,TLSv1.3,98,Application Data
205,18.9216842,172.20.40.110,151.101.130.187,TCP,54,63075  >  443 [ACK] Seq=42097 Ack=77149 Win=65536 Len=0
206,19.1269258,172.20.40.110,151.101.130.187,TLSv1.3,1816,Application Data
207,19.1410681,151.101.130.187,172.20.40.110,TCP,60,443  >  63075 [ACK] Seq=77149 Ack=43859 Win=137216 Len=0
208,19.1461222,151.101.130.187,172.20.40.110,TLSv1.3,130,Application Data
209,19.2090374,151.101.130.187,172.20.40.110,TCP,130,"[TCP Retransmission] 443  >  63075 [PSH, ACK] Seq=77149 Ack=43859 Win=138752 Len=76"
210,19.2091197,172.20.40.110,151.101.130.187,TCP,66,63075  >  443 [ACK] Seq=43859 Ack=77225 Win=65536 Len=0 SLE=77149 SRE=77225
211,19.2646761,172.20.40.110,151.101.130.187,TLSv1.3,678,Application Data
212,19.2689685,172.20.40.110,151.101.130.187,TLSv1.3,1807,Application Data
213,19.2692136,172.20.40.110,151.101.130.187,TLSv1.3,730,Application Data
214,19.2693664,172.20.40.110,151.101.130.187,TLSv1.3,1798,Application Data
215,19.2696974,172.20.40.110,151.101.130.187,TLSv1.3,727,Application Data
216,19.3096013,151.101.130.187,172.20.40.110,TCP,60,443  >  63075 [ACK] Seq=77225 Ack=44483 Win=138240 Len=0
217,19.3154752,151.101.130.187,172.20.40.110,TLSv1.3,173,Application Data
218,19.3154752,151.101.130.187,172.20.40.110,TLSv1.3,463,Application Data
219,19.3157851,172.20.40.110,151.101.130.187,TCP,54,63075  >  443 [ACK] Seq=49329 Ack=77753 Win=65024 Len=0
220,19.3173746,151.101.130.187,172.20.40.110,TCP,60,443  >  63075 [ACK] Seq=77753 Ack=46236 Win=137216 Len=0
221,19.3173746,151.101.130.187,172.20.40.110,TCP,60,443  >  63075 [ACK] Seq=77753 Ack=46912 Win=136704 Len=0
222,19.3173746,151.101.130.187,172.20.40.110,TCP,60,443  >  63075 [ACK] Seq=77753 Ack=48656 Win=136192 Len=0
223,19.3173746,151.101.130.187,172.20.40.110,TCP,60,443  >  63075 [ACK] Seq=77753 Ack=49329 Win=135680 Len=0
224,19.317829,172.20.40.110,151.101.130.187,TLSv1.3,89,Application Data
225,19.3198485,151.101.130.187,172.20.40.110,TLSv1.3,130,Application Data
226,19.3198485,151.101.130.187,172.20.40.110,TLSv1.3,124,Application Data
227,19.3199342,172.20.40.110,151.101.130.187,TCP,54,63075  >  443 [ACK] Seq=49364 Ack=77899 Win=64768 Len=0
228,19.3219799,151.101.130.187,172.20.40.110,TLSv1.3,130,Application Data
229,19.3219799,151.101.130.187,172.20.40.110,TLSv1.3,180,Application Data
230,19.3220602,172.20.40.110,151.101.130.187,TCP,54,63075  >  443 [ACK] Seq=49364 Ack=78101 Win=66048 Len=0
231,19.3554957,151.101.130.187,172.20.40.110,TCP,60,443  >  63075 [ACK] Seq=78101 Ack=49364 Win=138752 Len=0
232,24.6043462,172.20.40.110,151.101.130.187,TLSv1.3,1771,Application Data
233,24.6317728,151.101.130.187,172.20.40.110,TCP,60,443  >  63075 [ACK] Seq=78101 Ack=51081 Win=137216 Len=0
234,24.6989668,151.101.130.187,172.20.40.110,TLSv1.3,620,Application Data
235,24.7022157,172.20.40.110,151.101.130.187,TLSv1.3,89,Application Data
236,24.7282581,151.101.130.187,172.20.40.110,TCP,60,443  >  63075 [ACK] Seq=78667 Ack=51116 Win=138752 Len=0
237,32.8607273,172.20.40.110,151.101.130.187,TLSv1.3,1167,Application Data
238,32.8973818,151.101.130.187,172.20.40.110,TCP,60,443  >  63075 [ACK] Seq=78667 Ack=52229 Win=137728 Len=0
239,32.9056889,151.101.130.187,172.20.40.110,TLSv1.3,263,Application Data
240,32.9543715,172.20.40.110,151.101.130.187,TCP,54,63075  >  443 [ACK] Seq=52229 Ack=78876 Win=65280 Len=0
241,32.99332,151.101.130.187,172.20.40.110,TCP,263,"[TCP Spurious Retransmission] 443  >  63075 [PSH, ACK] Seq=78667 Ack=52229 Win=138752 Len=209"
242,32.9934028,172.20.40.110,151.101.130.187,TCP,66,[TCP Dup ACK 240#1] 63075  >  443 [ACK] Seq=52229 Ack=78876 Win=65280 Len=0 SLE=78667 SRE=78876
243,33.064466,172.20.40.110,151.101.130.187,TLSv1.3,1519,Application Data
244,33.1133283,151.101.130.187,172.20.40.110,TCP,60,443  >  63075 [ACK] Seq=78876 Ack=53694 Win=137728 Len=0
245,33.1158832,151.101.130.187,172.20.40.110,TLSv1.3,299,Application Data
246,33.1158832,151.101.130.187,172.20.40.110,TLSv1.3,367,Application Data
247,33.1161597,172.20.40.110,151.101.130.187,TCP,54,63075  >  443 [ACK] Seq=53694 Ack=79434 Win=64768 Len=0
248,33.1292058,172.20.40.110,151.101.130.187,TLSv1.3,89,Application Data
249,33.1734344,151.101.130.187,172.20.40.110,TCP,60,443  >  63075 [ACK] Seq=79434 Ack=53729 Win=138752 Len=0
250,33.3463006,172.20.40.110,151.101.130.187,TLSv1.3,1176,Application Data
251,33.3788675,151.101.130.187,172.20.40.110,TCP,60,443  >  63075 [ACK] Seq=79434 Ack=54851 Win=137728 Len=0
252,33.381699,151.101.130.187,172.20.40.110,TLSv1.3,131,Application Data
253,33.4264363,172.20.40.110,151.101.130.187,TCP,54,63075  >  443 [ACK] Seq=54851 Ack=79511 Win=66048 Len=0
254,33.4561362,172.20.40.110,151.101.130.187,TLSv1.3,1562,Application Data
255,33.4605781,172.20.40.110,151.101.130.187,TLSv1.3,1146,Application Data
256,33.4917068,151.101.130.187,172.20.40.110,TCP,60,443  >  63075 [ACK] Seq=79511 Ack=56359 Win=137728 Len=0
257,33.4944681,151.101.130.187,172.20.40.110,TLSv1.3,240,Application Data
258,33.4944681,151.101.130.187,172.20.40.110,TCP,60,443  >  63075 [ACK] Seq=79697 Ack=57451 Win=137728 Len=0
259,33.4944681,151.101.130.187,172.20.40.110,TLSv1.3,131,Application Data
260,33.494618,172.20.40.110,151.101.130.187,TCP,54,63075  >  443 [ACK] Seq=57451 Ack=79774 Win=65792 Len=0
261,33.6969621,172.20.40.110,151.101.130.187,TLSv1.3,1553,Application Data
262,33.7595698,151.101.130.187,172.20.40.110,TCP,60,443  >  63075 [ACK] Seq=79774 Ack=58950 Win=137728 Len=0
263,33.7595698,151.101.130.187,172.20.40.110,TLSv1.3,169,Application Data
264,33.8141856,172.20.40.110,151.101.130.187,TCP,54,63075  >  443 [ACK] Seq=58950 Ack=79889 Win=65792 Len=0
265,33.8494292,151.101.130.187,172.20.40.110,TCP,169,"[TCP Spurious Retransmission] 443  >  63075 [PSH, ACK] Seq=79774 Ack=58950 Win=138752 Len=115"
266,33.8495339,172.20.40.110,151.101.130.187,TCP,66,[TCP Dup ACK 264#1] 63075  >  443 [ACK] Seq=58950 Ack=79889 Win=65792 Len=0 SLE=79774 SRE=79889
267,33.8603999,172.20.40.110,151.101.130.187,TLSv1.3,1183,Application Data
268,33.885926,172.20.40.110,151.101.130.187,TLSv1.3,1548,Application Data
269,33.9308139,151.101.130.187,172.20.40.110,TCP,60,443  >  63075 [ACK] Seq=79889 Ack=60079 Win=137728 Len=0
270,33.9308139,151.101.130.187,172.20.40.110,TLSv1.3,131,Application Data
271,33.9539119,151.101.130.187,172.20.40.110,TCP,60,443  >  63075 [ACK] Seq=79966 Ack=61573 Win=137728 Len=0
272,33.9558699,151.101.130.187,172.20.40.110,TLSv1.3,98,Application Data
273,33.9559907,172.20.40.110,151.101.130.187,TCP,54,63075  >  443 [ACK] Seq=61573 Ack=80010 Win=65536 Len=0
274,34.2755666,172.20.40.110,151.101.130.187,TLSv1.3,1157,Application Data
275,34.2990838,151.101.130.187,172.20.40.110,TCP,60,443  >  63075 [ACK] Seq=80010 Ack=62676 Win=137728 Len=0
276,34.3041216,151.101.130.187,172.20.40.110,TLSv1.3,104,Application Data
277,34.3461867,172.20.40.110,151.101.130.187,TCP,54,63075  >  443 [ACK] Seq=62676 Ack=80060 Win=65536 Len=0
278,34.3911188,172.20.40.110,151.101.130.187,TLSv1.3,1547,Application Data
279,34.4114465,151.101.130.187,172.20.40.110,TCP,60,443  >  63075 [ACK] Seq=80060 Ack=64169 Win=137728 Len=0
280,34.4170617,151.101.130.187,172.20.40.110,TLSv1.3,130,Application Data
281,34.4591738,172.20.40.110,151.101.130.187,TCP,54,63075  >  443 [ACK] Seq=64169 Ack=80136 Win=65536 Len=0
282,34.6296048,172.20.40.110,151.101.130.187,TLSv1.3,1157,Application Data
283,34.6569264,151.101.130.187,172.20.40.110,TCP,60,443  >  63075 [ACK] Seq=80136 Ack=65272 Win=137728 Len=0
284,34.6590126,151.101.130.187,172.20.40.110,TLSv1.3,208,Application Data
285,34.6939255,172.20.40.110,151.101.130.187,TLSv1.3,1554,Application Data
286,34.7321827,151.101.130.187,172.20.40.110,TCP,60,443  >  63075 [ACK] Seq=80290 Ack=66772 Win=137728 Len=0
287,34.7345398,151.101.130.187,172.20.40.110,TLSv1.3,98,Application Data
288,34.7747044,172.20.40.110,151.101.130.187,TCP,54,63075  >  443 [ACK] Seq=66772 Ack=80334 Win=65280 Len=0
289,35.1308783,172.20.40.110,151.101.130.187,TLSv1.3,1173,Application Data
290,35.1595336,151.101.130.187,172.20.40.110,TCP,60,443  >  63075 [ACK] Seq=80334 Ack=67891 Win=137728 Len=0
291,35.1615103,151.101.130.187,172.20.40.110,TLSv1.3,130,Application Data
292,35.2170094,172.20.40.110,151.101.130.187,TCP,54,63075  >  443 [ACK] Seq=67891 Ack=80410 Win=65280 Len=0
293,35.5941535,172.20.40.110,151.101.130.187,TLSv1.3,1550,Application Data
294,35.6390968,151.101.130.187,172.20.40.110,TCP,60,443  >  63075 [ACK] Seq=80410 Ack=69387 Win=137728 Len=0
295,35.6440433,151.101.130.187,172.20.40.110,TLSv1.3,214,Application Data
296,35.6990989,172.20.40.110,151.101.130.187,TCP,54,63075  >  443 [ACK] Seq=69387 Ack=80570 Win=65024 Len=0
297,36.3964294,172.20.40.110,151.101.130.187,TLSv1.3,1184,Application Data
298,36.4368518,151.101.130.187,172.20.40.110,TCP,60,443  >  63075 [ACK] Seq=80570 Ack=70517 Win=137728 Len=0
299,36.4452882,151.101.130.187,172.20.40.110,TLSv1.3,152,Application Data
300,36.4981624,172.20.40.110,151.101.130.187,TCP,54,63075  >  443 [ACK] Seq=70517 Ack=80668 Win=65024 Len=0
301,37.9984783,172.20.40.110,151.101.130.187,TLSv1.3,1560,Application Data
302,37.9986988,172.20.40.110,151.101.130.187,TLSv1.3,1161,Application Data
303,38.0366128,151.101.130.187,172.20.40.110,TCP,60,443  >  63075 [ACK] Seq=80668 Ack=72023 Win=137728 Len=0
304,38.0366128,151.101.130.187,172.20.40.110,TCP,60,443  >  63075 [ACK] Seq=80668 Ack=73130 Win=136704 Len=0
305,38.0390373,151.101.130.187,172.20.40.110,TLSv1.3,379,Application Data
306,38.0409861,151.101.130.187,172.20.40.110,TLSv1.3,98,Application Data
307,38.0411205,172.20.40.110,151.101.130.187,TCP,54,63075  >  443 [ACK] Seq=73130 Ack=81037 Win=66048 Len=0
308,38.1419254,172.20.40.110,151.101.130.187,TLSv1.3,1570,Application Data
309,38.1469925,172.20.40.110,151.101.130.187,TLSv1.3,1161,Application Data
310,38.1971055,151.101.130.187,172.20.40.110,TCP,60,443  >  63075 [ACK] Seq=81037 Ack=74646 Win=137728 Len=0
311,38.1971055,151.101.130.187,172.20.40.110,TCP,60,443  >  63075 [ACK] Seq=81037 Ack=75753 Win=136704 Len=0
312,38.1995,151.101.130.187,172.20.40.110,TLSv1.3,104,Application Data
313,38.1995,151.101.130.187,172.20.40.110,TLSv1.3,98,Application Data
314,38.1996454,172.20.40.110,151.101.130.187,TCP,54,63075  >  443 [ACK] Seq=75753 Ack=81131 Win=66048 Len=0
315,38.2853838,172.20.40.110,151.101.130.187,TLSv1.3,1570,Application Data
316,38.3317483,151.101.130.187,172.20.40.110,TCP,60,443  >  63075 [ACK] Seq=81131 Ack=77269 Win=137728 Len=0
317,38.3317483,151.101.130.187,172.20.40.110,TLSv1.3,98,Application Data
318,38.3963194,172.20.40.110,151.101.130.187,TLSv1.3,1161,Application Data
319,38.4305554,151.101.130.187,172.20.40.110,TCP,60,443  >  63075 [ACK] Seq=81175 Ack=78376 Win=137728 Len=0
320,38.4328568,151.101.130.187,172.20.40.110,TLSv1.3,98,Application Data
321,38.5462351,151.101.130.187,172.20.40.110,TCP,98,"[TCP Retransmission] 443  >  63075 [PSH, ACK] Seq=81175 Ack=78376 Win=138752 Len=44"
322,38.5463059,172.20.40.110,151.101.130.187,TCP,66,63075  >  443 [ACK] Seq=78376 Ack=81219 Win=66048 Len=0 SLE=81175 SRE=81219
323,38.8104991,172.20.40.110,151.101.130.187,TLSv1.3,1570,Application Data
324,38.8441271,151.101.130.187,172.20.40.110,TCP,60,443  >  63075 [ACK] Seq=81219 Ack=79892 Win=137728 Len=0
325,38.846197,151.101.130.187,172.20.40.110,TLSv1.3,208,Application Data
326,38.8637864,172.20.40.110,151.101.130.187,TLSv1.3,1181,Application Data
327,38.920766,151.101.130.187,172.20.40.110,TCP,60,443  >  63075 [ACK] Seq=81373 Ack=81019 Win=137728 Len=0
328,38.9229582,151.101.130.187,172.20.40.110,TLSv1.3,131,Application Data
329,38.9353233,172.20.40.110,151.101.130.187,TLSv1.3,1571,Application Data
330,38.9848126,151.101.130.187,172.20.40.110,TCP,60,443  >  63075 [ACK] Seq=81450 Ack=82536 Win=137728 Len=0
331,38.9919907,151.101.130.187,172.20.40.110,TLSv1.3,98,Application Data
332,39.087311,172.20.40.110,151.101.130.187,TCP,54,63075  >  443 [ACK] Seq=82536 Ack=81494 Win=65536 Len=0
333,39.1366259,151.101.130.187,172.20.40.110,TCP,98,"[TCP Spurious Retransmission] 443  >  63075 [PSH, ACK] Seq=81450 Ack=82536 Win=138752 Len=44"
334,39.136724,172.20.40.110,151.101.130.187,TCP,66,[TCP Dup ACK 332#1] 63075  >  443 [ACK] Seq=82536 Ack=81494 Win=65536 Len=0 SLE=81450 SRE=81494
335,39.598682,172.20.40.110,151.101.130.187,TLSv1.3,1160,Application Data
336,39.6096825,151.101.130.187,172.20.40.110,TCP,60,443  >  63075 [ACK] Seq=81494 Ack=83642 Win=137728 Len=0
337,39.6135761,151.101.130.187,172.20.40.110,TLSv1.3,208,Application Data
338,39.6511199,172.20.40.110,151.101.130.187,TLSv1.3,1571,Application Data
339,39.6858294,151.101.130.187,172.20.40.110,TCP,60,443  >  63075 [ACK] Seq=81648 Ack=85159 Win=137728 Len=0
340,39.6858294,151.101.130.187,172.20.40.110,TLSv1.3,142,Application Data
341,39.837549,151.101.130.187,172.20.40.110,TCP,142,"[TCP Retransmission] 443  >  63075 [PSH, ACK] Seq=81648 Ack=85159 Win=138752 Len=88"
342,39.8376057,172.20.40.110,151.101.130.187,TCP,66,63075  >  443 [ACK] Seq=85159 Ack=81736 Win=65536 Len=0 SLE=81648 SRE=81736
343,43.5797568,172.20.40.110,151.101.130.187,TLSv1.3,1130,Application Data
344,43.5901872,151.101.130.187,172.20.40.110,TCP,60,443  >  63075 [ACK] Seq=81736 Ack=86235 Win=137728 Len=0
345,43.6010635,172.20.40.110,151.101.130.187,TLSv1.3,1571,Application Data
346,43.6075421,151.101.130.187,172.20.40.110,TLSv1.3,246,Application Data
347,43.6186601,151.101.130.187,172.20.40.110,TLSv1.3,131,Application Data
348,43.6187478,172.20.40.110,151.101.130.187,TCP,54,63075  >  443 [ACK] Seq=87752 Ack=82005 Win=65024 Len=0
349,43.6452481,172.20.40.110,151.101.130.187,TLSv1.3,1141,Application Data
350,43.6545527,151.101.130.187,172.20.40.110,TCP,60,443  >  63075 [ACK] Seq=82005 Ack=88839 Win=137728 Len=0
351,43.6566218,151.101.130.187,172.20.40.110,TLSv1.3,98,Application Data
352,43.7058845,172.20.40.110,151.101.130.187,TCP,54,63075  >  443 [ACK] Seq=88839 Ack=82049 Win=65024 Len=0
353,44.1072397,172.20.40.110,151.101.130.187,TLSv1.3,1572,Application Data
354,44.1167244,151.101.130.187,172.20.40.110,TCP,60,443  >  63075 [ACK] Seq=82049 Ack=90357 Win=137728 Len=0
355,44.1188534,151.101.130.187,172.20.40.110,TLSv1.3,104,Application Data
356,44.1603327,172.20.40.110,151.101.130.187,TCP,54,63075  >  443 [ACK] Seq=90357 Ack=82099 Win=65024 Len=0
357,44.417526,172.20.40.110,151.101.130.187,TLSv1.3,1152,Application Data
358,44.4190166,172.20.40.110,151.101.130.187,TLSv1.3,1531,Application Data
359,44.425633,151.101.130.187,172.20.40.110,TCP,60,443  >  63075 [ACK] Seq=82099 Ack=91455 Win=137728 Len=0
360,44.428026,151.101.130.187,172.20.40.110,TCP,60,443  >  63075 [ACK] Seq=82099 Ack=92932 Win=136704 Len=0
361,44.4302858,151.101.130.187,172.20.40.110,TLSv1.3,234,Application Data
362,44.4302858,151.101.130.187,172.20.40.110,TLSv1.3,130,Application Data
363,44.4303836,172.20.40.110,151.101.130.187,TCP,54,63075  >  443 [ACK] Seq=92932 Ack=82355 Win=64768 Len=0
364,48.1552112,172.20.40.110,151.101.130.187,TLSv1.3,1152,Application Data
365,48.1672336,151.101.130.187,172.20.40.110,TCP,60,443  >  63075 [ACK] Seq=82355 Ack=94030 Win=137728 Len=0
366,48.1704935,151.101.130.187,172.20.40.110,TLSv1.3,236,Application Data
367,48.187348,172.20.40.110,151.101.130.187,TLSv1.3,1543,Application Data
368,48.1976186,151.101.130.187,172.20.40.110,TCP,60,443  >  63075 [ACK] Seq=82537 Ack=95519 Win=137728 Len=0
369,48.1984778,172.20.40.110,151.101.130.187,TLSv1.3,1114,Application Data
370,48.2045726,151.101.130.187,172.20.40.110,TLSv1.3,129,Application Data
371,48.2059459,151.101.130.187,172.20.40.110,TCP,60,443  >  63075 [ACK] Seq=82612 Ack=96579 Win=137728 Len=0
372,48.2097538,151.101.130.187,172.20.40.110,TLSv1.3,264,Application Data
373,48.2098203,172.20.40.110,151.101.130.187,TCP,54,63075  >  443 [ACK] Seq=96579 Ack=82822 Win=65792 Len=0
374,48.2338134,172.20.40.110,151.101.130.187,TLSv1.3,1537,Application Data
375,48.2423723,151.101.130.187,172.20.40.110,TCP,60,443  >  63075 [ACK] Seq=82822 Ack=98062 Win=137728 Len=0
376,48.245832,151.101.130.187,172.20.40.110,TLSv1.3,130,Application Data
377,48.2981513,172.20.40.110,151.101.130.187,TCP,54,63075  >  443 [ACK] Seq=98062 Ack=82898 Win=65792 Len=0
378,48.4681979,172.20.40.110,151.101.130.187,TLSv1.3,1151,Application Data
379,48.4784367,172.20.40.110,151.101.130.187,TLSv1.3,1534,Application Data
380,48.4787875,151.101.130.187,172.20.40.110,TCP,60,443  >  63075 [ACK] Seq=82898 Ack=99159 Win=137728 Len=0
381,48.4812993,151.101.130.187,172.20.40.110,TLSv1.3,240,Application Data
382,48.4864946,151.101.130.187,172.20.40.110,TCP,60,443  >  63075 [ACK] Seq=83084 Ack=100639 Win=137728 Len=0
383,48.4885986,151.101.130.187,172.20.40.110,TLSv1.3,131,Application Data
384,48.4886746,172.20.40.110,151.101.130.187,TCP,54,63075  >  443 [ACK] Seq=100639 Ack=83161 Win=65536 Len=0
385,48.5899906,172.20.40.110,151.101.130.187,TLSv1.3,1151,Application Data
386,48.59802,151.101.130.187,172.20.40.110,TCP,60,443  >  63075 [ACK] Seq=83161 Ack=101736 Win=137728 Len=0
387,48.6048924,151.101.130.187,172.20.40.110,TLSv1.3,142,Application Data
388,48.6531769,172.20.40.110,151.101.130.187,TCP,54,63075  >  443 [ACK] Seq=101736 Ack=83249 Win=65280 Len=0
389,48.8780674,172.20.40.110,151.101.130.187,TLSv1.3,1501,Application Data
390,48.8880073,151.101.130.187,172.20.40.110,TCP,60,443  >  63075 [ACK] Seq=83249 Ack=103183 Win=137728 Len=0
391,48.8917049,151.101.130.187,172.20.40.110,TLSv1.3,796,Application Data
392,48.8999852,172.20.40.110,151.101.130.187,TLSv1.3,89,Application Data
393,48.9001505,172.20.40.110,151.101.130.187,TLSv1.3,1123,Application Data
394,48.9006264,172.20.40.110,151.101.130.187,TLSv1.3,1536,Application Data
395,48.9082709,151.101.130.187,172.20.40.110,TCP,60,443  >  63075 [ACK] Seq=83991 Ack=103218 Win=138752 Len=0
396,48.9128388,151.101.130.187,172.20.40.110,TCP,60,443  >  63075 [ACK] Seq=83991 Ack=104287 Win=137728 Len=0
397,48.9128388,151.101.130.187,172.20.40.110,TCP,60,443  >  63075 [ACK] Seq=83991 Ack=105769 Win=137216 Len=0
398,48.913949,151.101.130.187,172.20.40.110,TLSv1.3,124,Application Data
399,48.913949,151.101.130.187,172.20.40.110,TLSv1.3,131,Application Data
400,48.9140115,172.20.40.110,151.101.130.187,TCP,54,63075  >  443 [ACK] Seq=105769 Ack=84138 Win=66048 Len=0
401,49.0381663,172.20.40.110,151.101.130.187,TLSv1.3,1119,Application Data
402,49.0463321,151.101.130.187,172.20.40.110,TCP,60,443  >  63075 [ACK] Seq=84138 Ack=106834 Win=137728 Len=0
403,49.048427,151.101.130.187,172.20.40.110,TLSv1.3,124,Application Data
404,49.0950778,172.20.40.110,151.101.130.187,TCP,54,63075  >  443 [ACK] Seq=106834 Ack=84208 Win=65792 Len=0
405,49.2244976,172.20.40.110,151.101.130.187,TLSv1.3,1595,Application Data
406,49.2357815,151.101.130.187,172.20.40.110,TCP,60,443  >  63075 [ACK] Seq=84208 Ack=108375 Win=137216 Len=0
407,49.2404274,151.101.130.187,172.20.40.110,TLSv1.3,130,Application Data
408,49.2815805,172.20.40.110,151.101.130.187,TLSv1.3,1093,Application Data
409,49.2825016,172.20.40.110,151.101.130.187,TLSv1.3,1567,Application Data
410,49.2855797,172.20.40.110,151.101.130.187,TLSv1.3,1118,Application Data
411,49.2859623,172.20.40.110,151.101.130.187,TLSv1.3,1571,Application Data
412,49.2890196,151.101.130.187,172.20.40.110,TCP,60,443  >  63075 [ACK] Seq=84284 Ack=109414 Win=137728 Len=0
413,49.2911006,151.101.130.187,172.20.40.110,TCP,60,443  >  63075 [ACK] Seq=84284 Ack=110927 Win=136704 Len=0
414,49.2911006,151.101.130.187,172.20.40.110,TLSv1.3,130,Application Data
415,49.2932501,151.101.130.187,172.20.40.110,TLSv1.3,152,Application Data
416,49.293317,172.20.40.110,151.101.130.187,TCP,54,63075  >  443 [ACK] Seq=113508 Ack=84458 Win=65536 Len=0
417,49.294303,151.101.130.187,172.20.40.110,TCP,60,443  >  63075 [ACK] Seq=84458 Ack=111991 Win=137728 Len=0
418,49.2975717,151.101.130.187,172.20.40.110,TLSv1.3,135,Application Data
419,49.2975717,151.101.130.187,172.20.40.110,TCP,60,443  >  63075 [ACK] Seq=84539 Ack=113508 Win=137728 Len=0
420,49.2999793,151.101.130.187,172.20.40.110,TLSv1.3,257,Application Data
421,49.3000396,172.20.40.110,151.101.130.187,TCP,54,63075  >  443 [ACK] Seq=113508 Ack=84742 Win=65280 Len=0
422,51.2740621,172.20.40.110,151.101.130.187,TLSv1.3,1068,Application Data
423,51.2772103,172.20.40.110,151.101.130.187,TLSv1.3,1483,Application Data
424,51.2808318,172.20.40.110,151.101.130.187,TLSv1.3,1087,Application Data
425,51.2836879,151.101.130.187,172.20.40.110,TCP,60,443  >  63075 [ACK] Seq=84742 Ack=114522 Win=138240 Len=0
426,51.2857853,151.101.130.187,172.20.40.110,TCP,60,443  >  63075 [ACK] Seq=84742 Ack=115951 Win=137216 Len=0
427,51.2874958,151.101.130.187,172.20.40.110,TLSv1.3,272,Application Data
428,51.2874958,151.101.130.187,172.20.40.110,TLSv1.3,1046,Application Data
429,51.2875942,172.20.40.110,151.101.130.187,TCP,54,63075  >  443 [ACK] Seq=116984 Ack=85952 Win=66048 Len=0
430,51.2891804,151.101.130.187,172.20.40.110,TLSv1.3,155,Application Data
431,51.2891804,151.101.130.187,172.20.40.110,TLSv1.3,820,Application Data
432,51.2891804,151.101.130.187,172.20.40.110,TCP,60,443  >  63075 [ACK] Seq=86819 Ack=116984 Win=137728 Len=0
433,51.2896237,172.20.40.110,151.101.130.187,TCP,54,63075  >  443 [ACK] Seq=116984 Ack=86819 Win=65280 Len=0
434,51.2912356,151.101.130.187,172.20.40.110,TLSv1.3,183,Application Data
435,51.2912356,151.101.130.187,172.20.40.110,TLSv1.3,479,Application Data
436,51.2913489,172.20.40.110,151.101.130.187,TCP,54,63075  >  443 [ACK] Seq=116984 Ack=87373 Win=66048 Len=0
437,53.6623494,172.20.40.110,151.101.130.187,TLSv1.3,1546,Application Data
438,53.6707636,151.101.130.187,172.20.40.110,TCP,60,443  >  63075 [ACK] Seq=87373 Ack=118476 Win=137728 Len=0
439,53.6739582,151.101.130.187,172.20.40.110,TLSv1.3,247,Application Data
440,53.7185396,172.20.40.110,151.101.130.187,TCP,54,63075  >  443 [ACK] Seq=118476 Ack=87566 Win=65792 Len=0
441,56.8571527,172.20.40.110,151.101.130.187,TLSv1.3,1096,Application Data
442,56.8794577,151.101.130.187,172.20.40.110,TCP,60,443  >  63075 [ACK] Seq=87566 Ack=119518 Win=137728 Len=0
443,56.8794577,151.101.130.187,172.20.40.110,TLSv1.3,214,Application Data
444,56.9250916,172.20.40.110,151.101.130.187,TCP,54,63075  >  443 [ACK] Seq=119518 Ack=87726 Win=65792 Len=0
445,59.9242711,172.20.40.110,151.101.130.187,TLSv1.3,1487,Application Data
446,59.9250115,172.20.40.110,151.101.130.187,TLSv1.3,1143,Application Data
447,59.9523374,172.20.40.110,151.101.130.187,TCP,1434,"[TCP Retransmission] 63075  >  443 [PSH, ACK] Seq=120660 Ack=87726 Win=65792 Len=1380"
448,59.9659701,151.101.130.187,172.20.40.110,TCP,60,443  >  63075 [ACK] Seq=87726 Ack=120951 Win=137728 Len=0
449,59.9659701,151.101.130.187,172.20.40.110,TCP,60,443  >  63075 [ACK] Seq=87726 Ack=122040 Win=136704 Len=0
450,59.9659701,151.101.130.187,172.20.40.110,TLSv1.3,260,Application Data
451,59.9659701,151.101.130.187,172.20.40.110,TLSv1.3,471,Application Data
452,59.9659701,151.101.130.187,172.20.40.110,TLSv1.3,152,Application Data
453,59.9659701,151.101.130.187,172.20.40.110,TCP,66,[TCP Dup ACK 449#1] 443  >  63075 [ACK] Seq=88447 Ack=122040 Win=138752 Len=0 SLE=120660 SRE=122040
454,59.9662397,172.20.40.110,151.101.130.187,TCP,54,63075  >  443 [ACK] Seq=122040 Ack=88447 Win=65024 Len=0
455,59.9714121,172.20.40.110,151.101.130.187,TLSv1.3,89,Application Data
456,59.9793216,151.101.130.187,172.20.40.110,TCP,60,443  >  63075 [ACK] Seq=88447 Ack=122075 Win=138752 Len=0
