"No.","Time","Source","Destination","Protocol","Length","Info"
"1","0.000000000","100.84.170.161","151.101.2.187","TCP","66","62978  >  443 [SYN] Seq=0 Win=64240 Len=0 MSS=1460 WS=256 SACK_PERM"
"2","0.013565800","151.101.2.187","100.84.170.161","TCP","66","443  >  62978 [SYN, ACK] Seq=0 Ack=1 Win=65535 Len=0 MSS=1460 SACK_PERM WS=512"
"3","0.013687500","100.84.170.161","151.101.2.187","TCP","54","62978  >  443 [ACK] Seq=1 Ack=1 Win=131328 Len=0"
"4","0.015653300","100.84.170.161","151.101.2.187","TLSv1.3","2097","Client Hello (SNI=www.target.com)"
"5","0.024696000","151.101.2.187","100.84.170.161","TCP","56","443  >  62978 [ACK] Seq=1 Ack=2044 Win=144384 Len=0"
"6","0.025421700","151.101.2.187","100.84.170.161","TLSv1.3","1510","Server Hello, Change Cipher Spec, Application Data, Application Data"
"7","0.025756800","151.101.2.187","100.84.170.161","TLSv1.3","139","Application Data"
"8","0.025795600","100.84.170.161","151.101.2.187","TCP","54","62978  >  443 [ACK] Seq=2044 Ack=1542 Win=131328 Len=0"
"9","0.027040600","100.84.170.161","151.101.2.187","TLSv1.3","118","Change Cipher Spec, Application Data"
"10","0.028103300","100.84.170.161","151.101.2.187","TLSv1.3","146","Application Data"
"11","0.029072800","100.84.170.161","151.101.2.187","TLSv1.3","2546","Application Data"
"12","0.029359000","100.84.170.161","151.101.2.187","TLSv1.3","2551","Application Data"
"13","0.029572500","100.84.170.161","151.101.2.187","TLSv1.3","2552","Application Data"
"14","0.029837700","100.84.170.161","151.101.2.187","TLSv1.3","2537","Application Data"
"15","0.036232900","151.101.2.187","100.84.170.161","TCP","56","443  >  62978 [ACK] Seq=1542 Ack=2108 Win=145920 Len=0"
"16","0.037326000","151.101.2.187","100.84.170.161","TLSv1.3","119","Application Data"
"17","0.037823900","100.84.170.161","151.101.2.187","TLSv1.3","85","Application Data"
"18","0.038338500","151.101.2.187","100.84.170.161","TCP","56","443  >  62978 [ACK] Seq=1607 Ack=4692 Win=144384 Len=0"
"19","0.038962600","151.101.2.187","100.84.170.161","TCP","56","443  >  62978 [ACK] Seq=1607 Ack=7189 Win=144384 Len=0"
"20","0.039264900","151.101.2.187","100.84.170.161","TCP","56","443  >  62978 [ACK] Seq=1607 Ack=12170 Win=140288 Len=0"
"21","0.043104600","151.101.2.187","100.84.170.161","TLSv1.3","451","Application Data"
"22","0.043681100","151.101.2.187","100.84.170.161","TLSv1.3","129","Application Data"
"23","0.043744400","100.84.170.161","151.101.2.187","TCP","54","62978  >  443 [ACK] Seq=12201 Ack=2079 Win=130816 Len=0"
"24","0.045861200","151.101.2.187","100.84.170.161","TLSv1.3","185","Application Data"
"25","0.047253300","151.101.2.187","100.84.170.161","TCP","56","443  >  62978 [ACK] Seq=2210 Ack=12201 Win=145920 Len=0"
"26","0.081173200","151.101.2.187","100.84.170.161","TCP","185","[TCP Retransmission] 443  >  62978 [PSH, ACK] Seq=2079 Ack=12201 Win=145920 Len=131"
"27","0.081216400","100.84.170.161","151.101.2.187","TCP","66","62978  >  443 [ACK] Seq=12201 Ack=2210 Win=130560 Len=0 SLE=2079 SRE=2210"
"28","5.108184300","100.84.170.161","151.101.2.187","TLSv1.3","2551","Application Data"
"29","5.117485500","151.101.2.187","100.84.170.161","TCP","56","443  >  62978 [ACK] Seq=2210 Ack=14698 Win=144384 Len=0"
"30","5.120429300","151.101.2.187","100.84.170.161","TLSv1.3","214","Application Data"
"31","5.149259500","151.101.2.187","100.84.170.161","TCP","214","[TCP Retransmission] 443  >  62978 [PSH, ACK] Seq=2210 Ack=14698 Win=145920 Len=160"
"32","5.149296700","100.84.170.161","151.101.2.187","TCP","66","62978  >  443 [ACK] Seq=14698 Ack=2370 Win=130560 Len=0 SLE=2210 SRE=2370"
"33","5.196518100","100.84.170.161","151.101.2.187","TLSv1.3","2549","Application Data"
"34","5.205761200","151.101.2.187","100.84.170.161","TCP","56","443  >  62978 [ACK] Seq=2370 Ack=17193 Win=144384 Len=0"
"35","5.207776200","151.101.2.187","100.84.170.161","TLSv1.3","131","Application Data"
"36","5.235021300","151.101.2.187","100.84.170.161","TCP","131","[TCP Retransmission] 443  >  62978 [PSH, ACK] Seq=2370 Ack=17193 Win=145920 Len=77"
"37","5.235057900","100.84.170.161","151.101.2.187","TCP","66","62978  >  443 [ACK] Seq=17193 Ack=2447 Win=130304 Len=0 SLE=2370 SRE=2447"
"38","5.389782800","100.84.170.161","151.101.2.187","TLSv1.3","2552","Application Data"
"39","5.401318400","151.101.2.187","100.84.170.161","TCP","56","443  >  62978 [ACK] Seq=2447 Ack=19691 Win=144384 Len=0"
"40","5.402930700","151.101.2.187","100.84.170.161","TLSv1.3","103","Application Data"
"41","5.431185800","151.101.2.187","100.84.170.161","TCP","103","[TCP Retransmission] 443  >  62978 [PSH, ACK] Seq=2447 Ack=19691 Win=145920 Len=49"
"42","5.431222400","100.84.170.161","151.101.2.187","TCP","66","62978  >  443 [ACK] Seq=19691 Ack=2496 Win=130304 Len=0 SLE=2447 SRE=2496"
"43","5.722126800","100.84.170.161","151.101.2.187","TLSv1.3","2537","Application Data"
"44","5.732761500","151.101.2.187","100.84.170.161","TCP","56","443  >  62978 [ACK] Seq=2496 Ack=22174 Win=144384 Len=0"
"45","5.735743200","151.101.2.187","100.84.170.161","TLSv1.3","241","Application Data"
"46","5.763167400","151.101.2.187","100.84.170.161","TCP","241","[TCP Retransmission] 443  >  62978 [PSH, ACK] Seq=2496 Ack=22174 Win=145920 Len=187"
"47","5.763208000","100.84.170.161","151.101.2.187","TCP","66","62978  >  443 [ACK] Seq=22174 Ack=2683 Win=130048 Len=0 SLE=2496 SRE=2683"
"48","5.934718200","100.84.170.161","151.101.2.187","TLSv1.3","2540","Application Data"
"49","5.944318700","151.101.2.187","100.84.170.161","TCP","56","443  >  62978 [ACK] Seq=2683 Ack=24660 Win=144384 Len=0"
"50","5.953352000","151.101.2.187","100.84.170.161","TLSv1.3","130","Application Data"
"51","5.981898300","151.101.2.187","100.84.170.161","TCP","130","[TCP Retransmission] 443  >  62978 [PSH, ACK] Seq=2683 Ack=24660 Win=145920 Len=76"
"52","5.981939800","100.84.170.161","151.101.2.187","TCP","66","62978  >  443 [ACK] Seq=24660 Ack=2759 Win=130048 Len=0 SLE=2683 SRE=2759"
"53","5.985323700","100.84.170.161","151.101.2.187","TLSv1.3","2542","Application Data"
"54","5.995697500","151.101.2.187","100.84.170.161","TCP","56","443  >  62978 [ACK] Seq=2759 Ack=27148 Win=144384 Len=0"
"55","5.997890000","151.101.2.187","100.84.170.161","TLSv1.3","130","Application Data"
"56","6.026360300","151.101.2.187","100.84.170.161","TCP","130","[TCP Retransmission] 443  >  62978 [PSH, ACK] Seq=2759 Ack=27148 Win=145920 Len=76"
"57","6.026445700","100.84.170.161","151.101.2.187","TCP","66","62978  >  443 [ACK] Seq=27148 Ack=2835 Win=130048 Len=0 SLE=2759 SRE=2835"
"58","7.384222900","100.84.170.161","151.101.2.187","TLSv1.3","2551","Application Data"
"59","7.393367300","151.101.2.187","100.84.170.161","TCP","56","443  >  62978 [ACK] Seq=2835 Ack=29645 Win=144384 Len=0"
"60","7.396819400","151.101.2.187","100.84.170.161","TLSv1.3","214","Application Data"
"61","7.397047800","100.84.170.161","151.101.2.187","TLSv1.3","2552","Application Data"
"62","7.406231500","151.101.2.187","100.84.170.161","TCP","56","443  >  62978 [ACK] Seq=2995 Ack=32143 Win=144384 Len=0"
"63","7.409737700","151.101.2.187","100.84.170.161","TLSv1.3","340","Application Data"
"64","7.437278100","151.101.2.187","100.84.170.161","TCP","340","[TCP Retransmission] 443  >  62978 [PSH, ACK] Seq=2995 Ack=32143 Win=145920 Len=286"
"65","7.437320300","100.84.170.161","151.101.2.187","TCP","66","62978  >  443 [ACK] Seq=32143 Ack=3281 Win=131328 Len=0 SLE=2995 SRE=3281"
"66","7.581807700","100.84.170.161","151.101.2.187","TLSv1.3","2550","Application Data"
"67","7.593902300","151.101.2.187","100.84.170.161","TCP","56","443  >  62978 [ACK] Seq=3281 Ack=34639 Win=144384 Len=0"
"68","7.596753400","151.101.2.187","100.84.170.161","TLSv1.3","129","Application Data"
"69","7.624178300","151.101.2.187","100.84.170.161","TCP","129","[TCP Retransmission] 443  >  62978 [PSH, ACK] Seq=3281 Ack=34639 Win=145920 Len=75"
"70","7.624210800","100.84.170.161","151.101.2.187","TCP","66","62978  >  443 [ACK] Seq=34639 Ack=3356 Win=131072 Len=0 SLE=3281 SRE=3356"
"71","9.434964100","100.84.170.161","151.101.2.187","TLSv1.3","2551","Application Data"
"72","9.455069000","151.101.2.187","100.84.170.161","TCP","56","443  >  62978 [ACK] Seq=3356 Ack=37136 Win=144384 Len=0"
"73","9.458124800","151.101.2.187","100.84.170.161","TLSv1.3","214","Application Data"
"74","9.465016700","100.84.170.161","151.101.2.187","TLSv1.3","2549","Application Data"
"75","9.475632000","151.101.2.187","100.84.170.161","TCP","56","443  >  62978 [ACK] Seq=3516 Ack=39631 Win=144384 Len=0"
"76","9.478285300","151.101.2.187","100.84.170.161","TLSv1.3","104","Application Data"
"77","9.506464500","151.101.2.187","100.84.170.161","TCP","104","[TCP Retransmission] 443  >  62978 [PSH, ACK] Seq=3516 Ack=39631 Win=145920 Len=50"
"78","9.506502200","100.84.170.161","151.101.2.187","TCP","66","62978  >  443 [ACK] Seq=39631 Ack=3566 Win=131072 Len=0 SLE=3516 SRE=3566"
"79","9.750788900","100.84.170.161","151.101.2.187","TLSv1.3","2552","Application Data"
"80","9.777713400","100.84.170.161","151.101.2.187","TCP","1514","[TCP Retransmission] 62978  >  443 [PSH, ACK] Seq=40669 Ack=3566 Win=131072 Len=1460"
"81","9.939236400","151.101.2.187","100.84.170.161","TCP","56","443  >  62978 [ACK] Seq=3566 Ack=42129 Win=144384 Len=0"
"82","9.939236400","151.101.2.187","100.84.170.161","TCP","66","[TCP Dup ACK 81#1] 443  >  62978 [ACK] Seq=3566 Ack=42129 Win=144384 Len=0 SLE=40669 SRE=42129"
"83","9.939236400","151.101.2.187","100.84.170.161","TLSv1.3","214","Application Data"
"84","9.940364900","151.101.2.187","100.84.170.161","TCP","214","[TCP Retransmission] 443  >  62978 [PSH, ACK] Seq=3566 Ack=42129 Win=145920 Len=160"
"85","9.940407000","100.84.170.161","151.101.2.187","TCP","66","62978  >  443 [ACK] Seq=42129 Ack=3726 Win=130816 Len=0 SLE=3566 SRE=3726"
"86","10.054412800","100.84.170.161","151.101.2.187","TLSv1.3","2551","Application Data"
"87","10.083317300","100.84.170.161","151.101.2.187","TCP","1514","[TCP Retransmission] 62978  >  443 [PSH, ACK] Seq=43166 Ack=3726 Win=130816 Len=1460"
"88","10.160387800","151.101.2.187","100.84.170.161","TCP","56","443  >  62978 [ACK] Seq=3726 Ack=44626 Win=144384 Len=0"
"89","10.160597600","151.101.2.187","100.84.170.161","TCP","66","[TCP Dup ACK 88#1] 443  >  62978 [ACK] Seq=3726 Ack=44626 Win=144384 Len=0 SLE=43166 SRE=44626"
"90","10.160900500","151.101.2.187","100.84.170.161","TLSv1.3","130","Application Data"
"91","10.204571700","100.84.170.161","151.101.2.187","TCP","54","62978  >  443 [ACK] Seq=44626 Ack=3802 Win=130816 Len=0"
"92","10.314492400","100.84.170.161","151.101.2.187","TLSv1.3","2551","Application Data"
"93","10.314993400","100.84.170.161","151.101.2.187","TLSv1.3","2552","Application Data"
"94","10.336104200","151.101.2.187","100.84.170.161","TCP","130","[TCP Spurious Retransmission] 443  >  62978 [PSH, ACK] Seq=3726 Ack=44626 Win=145920 Len=76"
"95","10.336343900","100.84.170.161","151.101.2.187","TCP","66","[TCP Dup ACK 91#1] 62978  >  443 [ACK] Seq=49621 Ack=3802 Win=130816 Len=0 SLE=3726 SRE=3802"
"96","10.346628900","151.101.2.187","100.84.170.161","TCP","56","443  >  62978 [ACK] Seq=3802 Ack=49621 Win=144384 Len=0"
"97","10.348582000","151.101.2.187","100.84.170.161","TLSv1.3","130","Application Data"
"98","10.350519500","151.101.2.187","100.84.170.161","TLSv1.3","103","Application Data"
"99","10.350608900","100.84.170.161","151.101.2.187","TCP","54","62978  >  443 [ACK] Seq=49621 Ack=3927 Win=130560 Len=0"
"100","10.560368300","100.84.170.161","151.101.2.187","TLSv1.3","2551","Application Data"
"101","10.569809500","100.84.170.161","151.101.2.187","TLSv1.3","2552","Application Data"
"102","10.595668400","100.84.170.161","151.101.2.187","TCP","1514","[TCP Retransmission] 62978  >  443 [PSH, ACK] Seq=53156 Ack=3927 Win=130560 Len=1460"
"103","10.741507700","151.101.2.187","100.84.170.161","TCP","56","443  >  62978 [ACK] Seq=3927 Ack=52118 Win=144384 Len=0"
"104","10.741507700","151.101.2.187","100.84.170.161","TLSv1.3","98","Application Data"
"105","10.741507700","151.101.2.187","100.84.170.161","TCP","98","[TCP Retransmission] 443  >  62978 [PSH, ACK] Seq=3927 Ack=52118 Win=145920 Len=44"
"106","10.741610400","100.84.170.161","151.101.2.187","TCP","66","62978  >  443 [ACK] Seq=54616 Ack=3971 Win=130560 Len=0 SLE=3927 SRE=3971"
"107","10.751378400","151.101.2.187","100.84.170.161","TCP","56","443  >  62978 [ACK] Seq=3971 Ack=54616 Win=144384 Len=0"
"108","10.751569900","151.101.2.187","100.84.170.161","TCP","66","[TCP Dup ACK 107#1] 443  >  62978 [ACK] Seq=3971 Ack=54616 Win=144384 Len=0 SLE=53156 SRE=54616"
"109","10.753864600","151.101.2.187","100.84.170.161","TLSv1.3","208","Application Data"
"110","10.753912000","100.84.170.161","151.101.2.187","TCP","54","62978  >  443 [ACK] Seq=54616 Ack=4125 Win=130304 Len=0"
"111","15.276185500","100.84.170.161","151.101.2.187","TLSv1.3","2542","Application Data"
"112","15.291031300","100.84.170.161","151.101.2.187","TLSv1.3","2533","Application Data"
"113","15.291303100","100.84.170.161","151.101.2.187","TLSv1.3","2527","Application Data"
"114","15.293407600","100.84.170.161","151.101.2.187","TLSv1.3","2527","Application Data"
"115","15.347795300","151.101.2.187","100.84.170.161","TCP","56","443  >  62978 [ACK] Seq=4125 Ack=57104 Win=144384 Len=0"
"116","15.347795300","151.101.2.187","100.84.170.161","TLSv1.3","213","Application Data"
"117","15.347795300","151.101.2.187","100.84.170.161","TCP","213","[TCP Retransmission] 443  >  62978 [PSH, ACK] Seq=4125 Ack=57104 Win=145920 Len=159"
"118","15.347880100","100.84.170.161","151.101.2.187","TCP","66","62978  >  443 [ACK] Seq=64529 Ack=4284 Win=130304 Len=0 SLE=4125 SRE=4284"
"119","15.356097600","151.101.2.187","100.84.170.161","TCP","56","443  >  62978 [ACK] Seq=4284 Ack=64529 Win=140288 Len=0"
"120","15.359325200","151.101.2.187","100.84.170.161","TLSv1.3","129","Application Data"
"121","15.359378200","100.84.170.161","151.101.2.187","TCP","54","62978  >  443 [ACK] Seq=64529 Ack=4359 Win=130304 Len=0"
"122","15.360304900","151.101.2.187","100.84.170.161","TLSv1.3","131","Application Data"
"123","15.360573800","151.101.2.187","100.84.170.161","TLSv1.3","340","Application Data"
"124","15.360607400","100.84.170.161","151.101.2.187","TCP","54","62978  >  443 [ACK] Seq=64529 Ack=4722 Win=129792 Len=0"
"125","15.403613800","100.84.170.161","151.101.2.187","TLSv1.3","2527","Application Data"
"126","15.413649200","151.101.2.187","100.84.170.161","TCP","56","443  >  62978 [ACK] Seq=4722 Ack=67002 Win=144384 Len=0"
"127","15.416607000","151.101.2.187","100.84.170.161","TLSv1.3","130","Application Data"
"128","15.443151200","151.101.2.187","100.84.170.161","TCP","130","[TCP Retransmission] 443  >  62978 [PSH, ACK] Seq=4722 Ack=67002 Win=145920 Len=76"
"129","15.443194700","100.84.170.161","151.101.2.187","TCP","66","62978  >  443 [ACK] Seq=67002 Ack=4798 Win=131328 Len=0 SLE=4722 SRE=4798"
"130","15.565760700","100.84.170.161","151.101.2.187","TLSv1.3","2524","Application Data"
"131","15.575134300","151.101.2.187","100.84.170.161","TCP","56","443  >  62978 [ACK] Seq=4798 Ack=69472 Win=144384 Len=0"
"132","15.577642800","151.101.2.187","100.84.170.161","TLSv1.3","130","Application Data"
"133","15.586495000","100.84.170.161","151.101.2.187","TLSv1.3","2541","Application Data"
"134","15.596037700","151.101.2.187","100.84.170.161","TCP","56","443  >  62978 [ACK] Seq=4874 Ack=71959 Win=144384 Len=0"
"135","15.598283200","151.101.2.187","100.84.170.161","TLSv1.3","130","Application Data"
"136","15.619184600","100.84.170.161","151.101.2.187","TLSv1.3","2541","Application Data"
"137","15.627268200","151.101.2.187","100.84.170.161","TCP","130","[TCP Spurious Retransmission] 443  >  62978 [PSH, ACK] Seq=4874 Ack=71959 Win=145920 Len=76"
"138","15.627317700","100.84.170.161","151.101.2.187","TCP","66","[TCP Dup ACK 136#1] 62978  >  443 [ACK] Seq=74446 Ack=4950 Win=131072 Len=0 SLE=4874 SRE=4950"
"139","15.628807500","151.101.2.187","100.84.170.161","TCP","56","443  >  62978 [ACK] Seq=4950 Ack=74446 Win=144384 Len=0"
"140","15.631364700","151.101.2.187","100.84.170.161","TLSv1.3","103","Application Data"
"141","15.659360500","151.101.2.187","100.84.170.161","TCP","103","[TCP Retransmission] 443  >  62978 [PSH, ACK] Seq=4950 Ack=74446 Win=145920 Len=49"
"142","15.659399100","100.84.170.161","151.101.2.187","TCP","66","62978  >  443 [ACK] Seq=74446 Ack=4999 Win=131072 Len=0 SLE=4950 SRE=4999"
"143","15.792810900","100.84.170.161","151.101.2.187","TLSv1.3","2536","Application Data"
"144","15.803825400","151.101.2.187","100.84.170.161","TCP","56","443  >  62978 [ACK] Seq=4999 Ack=76928 Win=144384 Len=0"
"145","15.806085600","151.101.2.187","100.84.170.161","TLSv1.3","240","Application Data"
"146","15.833301900","151.101.2.187","100.84.170.161","TCP","240","[TCP Retransmission] 443  >  62978 [PSH, ACK] Seq=4999 Ack=76928 Win=145920 Len=186"
"147","15.833348300","100.84.170.161","151.101.2.187","TCP","66","62978  >  443 [ACK] Seq=76928 Ack=5185 Win=130816 Len=0 SLE=4999 SRE=5185"
"148","15.890358100","100.84.170.161","151.101.2.187","TLSv1.3","2542","Application Data"
"149","15.890460000","100.84.170.161","151.101.2.187","TLSv1.3","2546","Application Data"
"150","15.890567400","100.84.170.161","151.101.2.187","TLSv1.3","2526","Application Data"
"151","15.899717200","151.101.2.187","100.84.170.161","TCP","56","443  >  62978 [ACK] Seq=5185 Ack=79416 Win=144384 Len=0"
"152","15.900350600","151.101.2.187","100.84.170.161","TCP","56","443  >  62978 [ACK] Seq=5185 Ack=84380 Win=144384 Len=0"
"153","15.918195300","151.101.2.187","100.84.170.161","TLSv1.3","238","Application Data"
"154","15.948194500","151.101.2.187","100.84.170.161","TCP","238","[TCP Retransmission] 443  >  62978 [PSH, ACK] Seq=5185 Ack=84380 Win=145920 Len=184"
"155","15.948277100","100.84.170.161","151.101.2.187","TCP","66","62978  >  443 [ACK] Seq=84380 Ack=5369 Win=130816 Len=0 SLE=5185 SRE=5369"
"156","16.239573100","100.84.170.161","151.101.2.187","TLSv1.3","2553","Application Data"
"157","16.240881500","100.84.170.161","151.101.2.187","TLSv1.3","2556","Application Data"
"158","16.241078200","100.84.170.161","151.101.2.187","TLSv1.3","2552","Application Data"
"159","16.241199500","100.84.170.161","151.101.2.187","TLSv1.3","2544","Application Data"
"160","16.241544600","100.84.170.161","151.101.2.187","TLSv1.3","2543","Application Data"
"161","16.249009400","151.101.2.187","100.84.170.161","TCP","56","443  >  62978 [ACK] Seq=5369 Ack=86879 Win=144384 Len=0"
"162","16.250016900","151.101.2.187","100.84.170.161","TCP","56","443  >  62978 [ACK] Seq=5369 Ack=89381 Win=144384 Len=0"
"163","16.250555700","151.101.2.187","100.84.170.161","TCP","56","443  >  62978 [ACK] Seq=5369 Ack=94369 Win=144384 Len=0"
"164","16.250902200","151.101.2.187","100.84.170.161","TCP","56","443  >  62978 [ACK] Seq=5369 Ack=96858 Win=144384 Len=0"
"165","16.252538900","151.101.2.187","100.84.170.161","TLSv1.3","130","Application Data"
"166","16.253448000","151.101.2.187","100.84.170.161","TLSv1.3","131","Application Data"
"167","16.253504100","100.84.170.161","151.101.2.187","TCP","54","62978  >  443 [ACK] Seq=96858 Ack=5522 Win=130560 Len=0"
"168","16.253838400","151.101.2.187","100.84.170.161","TLSv1.3","130","Application Data"
"169","16.254184300","151.101.2.187","100.84.170.161","TLSv1.3","395","Application Data"
"170","16.254239800","100.84.170.161","151.101.2.187","TCP","54","62978  >  443 [ACK] Seq=96858 Ack=5939 Win=130048 Len=0"
"171","19.639001800","100.84.170.161","151.101.2.187","TLSv1.3","2463","Application Data"
"172","19.642268000","100.84.170.161","151.101.2.187","TLSv1.3","2462","Application Data"
"173","19.644254900","100.84.170.161","151.101.2.187","TLSv1.3","2466","Application Data"
"174","19.649821900","151.101.2.187","100.84.170.161","TCP","56","443  >  62978 [ACK] Seq=5939 Ack=99267 Win=144384 Len=0"
"175","19.652020400","151.101.2.187","100.84.170.161","TCP","56","443  >  62978 [ACK] Seq=5939 Ack=101675 Win=144384 Len=0"
"176","19.653514600","151.101.2.187","100.84.170.161","TCP","56","443  >  62978 [ACK] Seq=5939 Ack=104087 Win=142336 Len=0"
"177","19.654192400","151.101.2.187","100.84.170.161","TLSv1.3","1254","Application Data"
"178","19.656190900","100.84.170.161","151.101.2.187","TLSv1.3","89","Application Data"
"179","19.657222400","151.101.2.187","100.84.170.161","TLSv1.3","1371","Application Data"
"180","19.665693600","151.101.2.187","100.84.170.161","TCP","56","443  >  62978 [ACK] Seq=8456 Ack=104122 Win=145920 Len=0"
"181","19.692097300","151.101.2.187","100.84.170.161","TCP","1371","[TCP Retransmission] 443  >  62978 [PSH, ACK] Seq=7139 Ack=104122 Win=145920 Len=1317"
"182","19.692139800","100.84.170.161","151.101.2.187","TCP","66","62978  >  443 [ACK] Seq=104122 Ack=8456 Win=130048 Len=0 SLE=7139 SRE=8456"
"183","23.002968800","100.84.170.161","151.101.2.187","TLSv1.3","2530","Application Data"
"184","23.011965900","151.101.2.187","100.84.170.161","TCP","56","443  >  62978 [ACK] Seq=8456 Ack=106598 Win=144384 Len=0"
"185","23.014993100","151.101.2.187","100.84.170.161","TLSv1.3","240","Application Data"
"186","23.041223600","151.101.2.187","100.84.170.161","TCP","240","[TCP Retransmission] 443  >  62978 [PSH, ACK] Seq=8456 Ack=106598 Win=145920 Len=186"
"187","23.041296000","100.84.170.161","151.101.2.187","TCP","66","62978  >  443 [ACK] Seq=106598 Ack=8642 Win=131328 Len=0 SLE=8456 SRE=8642"
"188","23.160464800","100.84.170.161","151.101.2.187","TLSv1.3","2528","Application Data"
"189","23.171068700","151.101.2.187","100.84.170.161","TCP","56","443  >  62978 [ACK] Seq=8642 Ack=109072 Win=144384 Len=0"
"190","23.174092300","151.101.2.187","100.84.170.161","TLSv1.3","131","Application Data"
"191","23.200066700","151.101.2.187","100.84.170.161","TCP","131","[TCP Retransmission] 443  >  62978 [PSH, ACK] Seq=8642 Ack=109072 Win=145920 Len=77"
"192","23.200114100","100.84.170.161","151.101.2.187","TCP","66","62978  >  443 [ACK] Seq=109072 Ack=8719 Win=131072 Len=0 SLE=8642 SRE=8719"
"193","23.363289500","100.84.170.161","151.101.2.187","TLSv1.3","2531","Application Data"
"194","23.374704800","151.101.2.187","100.84.170.161","TCP","56","443  >  62978 [ACK] Seq=8719 Ack=111549 Win=144384 Len=0"
"195","23.377252500","151.101.2.187","100.84.170.161","TLSv1.3","130","Application Data"
"196","23.404990600","151.101.2.187","100.84.170.161","TCP","130","[TCP Retransmission] 443  >  62978 [PSH, ACK] Seq=8719 Ack=111549 Win=145920 Len=76"
"197","23.405035600","100.84.170.161","151.101.2.187","TCP","66","62978  >  443 [ACK] Seq=111549 Ack=8795 Win=131072 Len=0 SLE=8719 SRE=8795"
"198","23.993117700","100.84.170.161","151.101.2.187","TLSv1.3","2544","Application Data"
"199","24.002594300","151.101.2.187","100.84.170.161","TCP","56","443  >  62978 [ACK] Seq=8795 Ack=114039 Win=144384 Len=0"
"200","24.005691700","151.101.2.187","100.84.170.161","TLSv1.3","240","Application Data"
"201","24.032267800","151.101.2.187","100.84.170.161","TCP","240","[TCP Retransmission] 443  >  62978 [PSH, ACK] Seq=8795 Ack=114039 Win=145920 Len=186"
"202","24.032313000","100.84.170.161","151.101.2.187","TCP","66","62978  >  443 [ACK] Seq=114039 Ack=8981 Win=130816 Len=0 SLE=8795 SRE=8981"
"203","27.281583000","100.84.170.161","151.101.2.187","TLSv1.3","2532","Application Data"
"204","27.287851600","100.84.170.161","151.101.2.187","TLSv1.3","2523","Application Data"
"205","27.289982200","100.84.170.161","151.101.2.187","TLSv1.3","2517","Application Data"
"206","27.292149000","100.84.170.161","151.101.2.187","TLSv1.3","2517","Application Data"
"207","27.292218600","151.101.2.187","100.84.170.161","TCP","56","443  >  62978 [ACK] Seq=8981 Ack=116517 Win=144384 Len=0"
"208","27.294996300","151.101.2.187","100.84.170.161","TLSv1.3","423","Application Data"
"209","27.297738300","151.101.2.187","100.84.170.161","TCP","56","443  >  62978 [ACK] Seq=9350 Ack=118986 Win=144384 Len=0"
"210","27.299307100","151.101.2.187","100.84.170.161","TCP","56","443  >  62978 [ACK] Seq=9350 Ack=121449 Win=144384 Len=0"
"211","27.300024200","151.101.2.187","100.84.170.161","TLSv1.3","130","Application Data"
"212","27.300078100","100.84.170.161","151.101.2.187","TCP","54","62978  >  443 [ACK] Seq=123912 Ack=9426 Win=130560 Len=0"
"213","27.301389900","151.101.2.187","100.84.170.161","TLSv1.3","131","Application Data"
"214","27.301934100","151.101.2.187","100.84.170.161","TCP","56","443  >  62978 [ACK] Seq=9503 Ack=123912 Win=144384 Len=0"
"215","27.304811100","151.101.2.187","100.84.170.161","TLSv1.3","129","Application Data"
"216","27.304860900","100.84.170.161","151.101.2.187","TCP","54","62978  >  443 [ACK] Seq=123912 Ack=9578 Win=130304 Len=0"
"217","27.358611400","100.84.170.161","151.101.2.187","TLSv1.3","2517","Application Data"
"218","27.367691300","151.101.2.187","100.84.170.161","TCP","56","443  >  62978 [ACK] Seq=9578 Ack=126375 Win=144384 Len=0"
"219","27.370130000","151.101.2.187","100.84.170.161","TLSv1.3","130","Application Data"
"220","27.399125600","151.101.2.187","100.84.170.161","TCP","130","[TCP Retransmission] 443  >  62978 [PSH, ACK] Seq=9578 Ack=126375 Win=145920 Len=76"
"221","27.399164500","100.84.170.161","151.101.2.187","TCP","66","62978  >  443 [ACK] Seq=126375 Ack=9654 Win=130304 Len=0 SLE=9578 SRE=9654"
"222","27.460342500","100.84.170.161","151.101.2.187","TLSv1.3","2514","Application Data"
"223","27.465115500","100.84.170.161","151.101.2.187","TLSv1.3","2531","Application Data"
"224","27.470901600","151.101.2.187","100.84.170.161","TCP","56","443  >  62978 [ACK] Seq=9654 Ack=128835 Win=144384 Len=0"
"225","27.473105700","151.101.2.187","100.84.170.161","TLSv1.3","130","Application Data"
"226","27.475196300","151.101.2.187","100.84.170.161","TCP","56","443  >  62978 [ACK] Seq=9730 Ack=131312 Win=144384 Len=0"
"227","27.478045500","151.101.2.187","100.84.170.161","TLSv1.3","130","Application Data"
"228","27.478132200","100.84.170.161","151.101.2.187","TCP","54","62978  >  443 [ACK] Seq=131312 Ack=9806 Win=130048 Len=0"
"229","27.495787300","100.84.170.161","151.101.2.187","TLSv1.3","2531","Application Data"
"230","27.505742700","151.101.2.187","100.84.170.161","TCP","56","443  >  62978 [ACK] Seq=9806 Ack=133789 Win=144384 Len=0"
"231","27.508674400","151.101.2.187","100.84.170.161","TLSv1.3","130","Application Data"
"232","27.538175700","151.101.2.187","100.84.170.161","TCP","130","[TCP Retransmission] 443  >  62978 [PSH, ACK] Seq=9806 Ack=133789 Win=145920 Len=76"
"233","27.538221200","100.84.170.161","151.101.2.187","TCP","66","62978  >  443 [ACK] Seq=133789 Ack=9882 Win=130048 Len=0 SLE=9806 SRE=9882"
"234","27.615173800","100.84.170.161","151.101.2.187","TLSv1.3","2518","Application Data"
"235","27.619639200","100.84.170.161","151.101.2.187","TLSv1.3","2526","Application Data"
"236","27.624702700","151.101.2.187","100.84.170.161","TCP","56","443  >  62978 [ACK] Seq=9882 Ack=136253 Win=144384 Len=0"
"237","27.628563200","151.101.2.187","100.84.170.161","TLSv1.3","130","Application Data"
"238","27.629393300","151.101.2.187","100.84.170.161","TCP","56","443  >  62978 [ACK] Seq=9958 Ack=138725 Win=144384 Len=0"
"239","27.631092000","151.101.2.187","100.84.170.161","TLSv1.3","130","Application Data"
"240","27.631150900","100.84.170.161","151.101.2.187","TCP","54","62978  >  443 [ACK] Seq=138725 Ack=10034 Win=129792 Len=0"
"241","27.705071600","100.84.170.161","151.101.2.187","TLSv1.3","2530","Application Data"
"242","27.705330700","100.84.170.161","151.101.2.187","TLSv1.3","2532","Application Data"
"243","27.706160800","100.84.170.161","151.101.2.187","TLSv1.3","2528","Application Data"
"244","27.706358500","100.84.170.161","151.101.2.187","TLSv1.3","2520","Application Data"
"245","27.709334400","100.84.170.161","151.101.2.187","TLSv1.3","2519","Application Data"
"246","27.714605100","151.101.2.187","100.84.170.161","TCP","56","443  >  62978 [ACK] Seq=10034 Ack=143679 Win=142336 Len=0"
"247","27.715409700","151.101.2.187","100.84.170.161","TCP","56","443  >  62978 [ACK] Seq=10034 Ack=146153 Win=144384 Len=0"
"248","27.716046600","151.101.2.187","100.84.170.161","TCP","56","443  >  62978 [ACK] Seq=10034 Ack=148619 Win=144384 Len=0"
"249","27.717650500","151.101.2.187","100.84.170.161","TLSv1.3","240","Application Data"
"250","27.717695100","100.84.170.161","151.101.2.187","TCP","54","62978  >  443 [ACK] Seq=151084 Ack=10220 Win=131328 Len=0"
"251","27.717917500","151.101.2.187","100.84.170.161","TLSv1.3","341","Application Data"
"252","27.717940300","100.84.170.161","151.101.2.187","TCP","54","62978  >  443 [ACK] Seq=151084 Ack=10507 Win=131072 Len=0"
"253","27.718268700","151.101.2.187","100.84.170.161","TLSv1.3","130","Application Data"
"254","27.719201500","151.101.2.187","100.84.170.161","TLSv1.3","131","Application Data"
"255","27.719261400","100.84.170.161","151.101.2.187","TCP","54","62978  >  443 [ACK] Seq=151084 Ack=10660 Win=130816 Len=0"
"256","27.719575400","151.101.2.187","100.84.170.161","TCP","56","443  >  62978 [ACK] Seq=10660 Ack=151084 Win=151552 Len=0"
"257","27.721094900","151.101.2.187","100.84.170.161","TLSv1.3","130","Application Data"
"258","27.766850700","100.84.170.161","151.101.2.187","TCP","54","62978  >  443 [ACK] Seq=151084 Ack=10736 Win=130816 Len=0"
"259","27.768098500","151.101.2.187","100.84.170.161","TCP","130","[TCP Spurious Retransmission] 443  >  62978 [PSH, ACK] Seq=10660 Ack=151084 Win=151552 Len=76"
"260","27.768134100","100.84.170.161","151.101.2.187","TCP","66","[TCP Dup ACK 258#1] 62978  >  443 [ACK] Seq=151084 Ack=10736 Win=130816 Len=0 SLE=10660 SRE=10736"
"261","27.873581100","100.84.170.161","151.101.2.187","TLSv1.3","2540","Application Data"
"262","27.875636200","100.84.170.161","151.101.2.187","TLSv1.3","2536","Application Data"
"263","27.881233400","100.84.170.161","151.101.2.187","TLSv1.3","2520","Application Data"
"264","27.882972300","151.101.2.187","100.84.170.161","TCP","56","443  >  62978 [ACK] Seq=10736 Ack=153570 Win=157184 Len=0"
"265","27.885201700","151.101.2.187","100.84.170.161","TCP","56","443  >  62978 [ACK] Seq=10736 Ack=156052 Win=163328 Len=0"
"266","27.885570200","151.101.2.187","100.84.170.161","TLSv1.3","130","Application Data"
"267","27.888000700","151.101.2.187","100.84.170.161","TLSv1.3","130","Application Data"
"268","27.888063100","100.84.170.161","151.101.2.187","TCP","54","62978  >  443 [ACK] Seq=158518 Ack=10888 Win=130560 Len=0"
"269","27.890939500","151.101.2.187","100.84.170.161","TCP","56","443  >  62978 [ACK] Seq=10888 Ack=158518 Win=168960 Len=0"
"270","27.893649100","151.101.2.187","100.84.170.161","TLSv1.3","130","Application Data"
"271","27.926253400","151.101.2.187","100.84.170.161","TCP","130","[TCP Retransmission] 443  >  62978 [PSH, ACK] Seq=10888 Ack=158518 Win=168960 Len=76"
"272","27.926294100","100.84.170.161","151.101.2.187","TCP","66","62978  >  443 [ACK] Seq=158518 Ack=10964 Win=130560 Len=0 SLE=10888 SRE=10964"
"273","32.680605400","100.84.170.161","151.101.2.187","TLSv1.3","2532","Application Data"
"274","32.690370800","151.101.2.187","100.84.170.161","TCP","56","443  >  62978 [ACK] Seq=10964 Ack=160996 Win=175104 Len=0"
"275","32.692582800","151.101.2.187","100.84.170.161","TLSv1.3","213","Application Data"
"276","32.703814200","100.84.170.161","151.101.2.187","TLSv1.3","2530","Application Data"
"277","32.713649900","151.101.2.187","100.84.170.161","TCP","56","443  >  62978 [ACK] Seq=11123 Ack=163472 Win=180736 Len=0"
"278","32.716175700","151.101.2.187","100.84.170.161","TLSv1.3","131","Application Data"
"279","32.747239900","151.101.2.187","100.84.170.161","TCP","131","[TCP Retransmission] 443  >  62978 [PSH, ACK] Seq=11123 Ack=163472 Win=180736 Len=77"
"280","32.747278500","100.84.170.161","151.101.2.187","TCP","66","62978  >  443 [ACK] Seq=163472 Ack=11200 Win=130304 Len=0 SLE=11123 SRE=11200"
"281","33.220664900","100.84.170.161","151.101.2.187","TLSv1.3","2533","Application Data"
"282","33.232600600","151.101.2.187","100.84.170.161","TCP","56","443  >  62978 [ACK] Seq=11200 Ack=165951 Win=186368 Len=0"
"283","33.234961700","151.101.2.187","100.84.170.161","TLSv1.3","130","Application Data"
"284","33.265226900","151.101.2.187","100.84.170.161","TCP","130","[TCP Retransmission] 443  >  62978 [PSH, ACK] Seq=11200 Ack=165951 Win=186368 Len=76"
"285","33.265266900","100.84.170.161","151.101.2.187","TCP","66","62978  >  443 [ACK] Seq=165951 Ack=11276 Win=130304 Len=0 SLE=11200 SRE=11276"
"286","33.406271600","100.84.170.161","151.101.2.187","TLSv1.3","2532","Application Data"
"287","33.417055800","151.101.2.187","100.84.170.161","TCP","56","443  >  62978 [ACK] Seq=11276 Ack=168429 Win=192512 Len=0"
"288","33.418998500","151.101.2.187","100.84.170.161","TLSv1.3","130","Application Data"
"289","33.449379600","151.101.2.187","100.84.170.161","TCP","130","[TCP Retransmission] 443  >  62978 [PSH, ACK] Seq=11276 Ack=168429 Win=192512 Len=76"
"290","33.449425100","100.84.170.161","151.101.2.187","TCP","66","62978  >  443 [ACK] Seq=168429 Ack=11352 Win=130048 Len=0 SLE=11276 SRE=11352"
"291","33.534923900","100.84.170.161","151.101.2.187","TLSv1.3","2544","Application Data"
"292","33.544285900","151.101.2.187","100.84.170.161","TCP","56","443  >  62978 [ACK] Seq=11352 Ack=170919 Win=198144 Len=0"
"293","33.546307000","151.101.2.187","100.84.170.161","TLSv1.3","129","Application Data"
"294","33.576018900","151.101.2.187","100.84.170.161","TCP","129","[TCP Retransmission] 443  >  62978 [PSH, ACK] Seq=11352 Ack=170919 Win=198144 Len=75"
"295","33.576068800","100.84.170.161","151.101.2.187","TCP","66","62978  >  443 [ACK] Seq=170919 Ack=11427 Win=130048 Len=0 SLE=11352 SRE=11427"
"296","34.564662200","100.84.170.161","151.101.2.187","TLSv1.3","2518","Application Data"
"297","34.589571100","100.84.170.161","151.101.2.187","TCP","1514","[TCP Retransmission] 62978  >  443 [PSH, ACK] Seq=171923 Ack=11427 Win=130048 Len=1460"
"298","34.611220100","151.101.2.187","100.84.170.161","TCP","56","443  >  62978 [ACK] Seq=11427 Ack=173383 Win=204288 Len=0"
"299","34.611220100","151.101.2.187","100.84.170.161","TLSv1.3","450","Application Data"
"300","34.631072500","151.101.2.187","100.84.170.161","TCP","66","[TCP Dup ACK 298#1] 443  >  62978 [ACK] Seq=11823 Ack=173383 Win=204288 Len=0 SLE=171923 SRE=173383"
"301","34.641621900","151.101.2.187","100.84.170.161","TCP","450","[TCP Retransmission] 443  >  62978 [PSH, ACK] Seq=11427 Ack=173383 Win=204288 Len=396"
"302","34.641660200","100.84.170.161","151.101.2.187","TCP","66","62978  >  443 [ACK] Seq=173383 Ack=11823 Win=131328 Len=0 SLE=11427 SRE=11823"
"303","34.685287100","100.84.170.161","151.101.2.187","TLSv1.3","2521","Application Data"
"304","34.701375000","151.101.2.187","100.84.170.161","TCP","56","443  >  62978 [ACK] Seq=11823 Ack=175850 Win=209920 Len=0"
"305","34.703906500","151.101.2.187","100.84.170.161","TLSv1.3","240","Application Data"
"306","34.720065700","100.84.170.161","151.101.2.187","TLSv1.3","2523","Application Data"
"307","34.746045500","100.84.170.161","151.101.2.187","TCP","1514","[TCP Retransmission] 62978  >  443 [PSH, ACK] Seq=176859 Ack=12009 Win=131072 Len=1460"
"308","34.753915900","151.101.2.187","100.84.170.161","TCP","240","[TCP Spurious Retransmission] 443  >  62978 [PSH, ACK] Seq=11823 Ack=175850 Win=209920 Len=186"
"309","34.753915900","151.101.2.187","100.84.170.161","TCP","56","443  >  62978 [ACK] Seq=12009 Ack=178319 Win=215552 Len=0"
"310","34.754003700","100.84.170.161","151.101.2.187","TCP","66","[TCP Dup ACK 306#1] 62978  >  443 [ACK] Seq=178319 Ack=12009 Win=131072 Len=0 SLE=11823 SRE=12009"
"311","34.765321500","151.101.2.187","100.84.170.161","TLSv1.3","130","Application Data"
"312","34.807211800","100.84.170.161","151.101.2.187","TCP","54","62978  >  443 [ACK] Seq=178319 Ack=12085 Win=131072 Len=0"
"313","34.841897100","151.101.2.187","100.84.170.161","TCP","66","[TCP Dup ACK 309#1] 443  >  62978 [ACK] Seq=12085 Ack=178319 Win=215552 Len=0 SLE=176859 SRE=178319"
"314","35.909479100","100.84.170.161","151.101.2.187","TLSv1.3","2533","Application Data"
"315","35.909853200","100.84.170.161","151.101.2.187","TLSv1.3","2527","Application Data"
"316","35.921097600","151.101.2.187","100.84.170.161","TCP","56","443  >  62978 [ACK] Seq=12085 Ack=183271 Win=227328 Len=0"
"317","35.923312400","151.101.2.187","100.84.170.161","TLSv1.3","241","Application Data"
"318","35.923611100","151.101.2.187","100.84.170.161","TLSv1.3","103","Application Data"
"319","35.923663800","100.84.170.161","151.101.2.187","TCP","54","62978  >  443 [ACK] Seq=183271 Ack=12321 Win=130816 Len=0"
"320","36.030487100","100.84.170.161","151.101.2.187","TLSv1.3","2521","Application Data"
"321","36.031814400","100.84.170.161","151.101.2.187","TLSv1.3","2518","Application Data"
"322","36.039499500","151.101.2.187","100.84.170.161","TCP","56","443  >  62978 [ACK] Seq=12321 Ack=185738 Win=233472 Len=0"
"323","36.041729800","151.101.2.187","100.84.170.161","TCP","56","443  >  62978 [ACK] Seq=12321 Ack=188202 Win=239104 Len=0"
"324","36.043017900","151.101.2.187","100.84.170.161","TLSv1.3","130","Application Data"
"325","36.044440100","151.101.2.187","100.84.170.161","TLSv1.3","130","Application Data"
"326","36.044517800","100.84.170.161","151.101.2.187","TCP","54","62978  >  443 [ACK] Seq=188202 Ack=12473 Win=130560 Len=0"
"327","43.410138800","100.84.170.161","151.101.2.187","TLSv1.3","2454","Application Data"
"328","43.425240200","151.101.2.187","100.84.170.161","TCP","56","443  >  62978 [ACK] Seq=12473 Ack=190602 Win=244736 Len=0"
"329","43.430248700","151.101.2.187","100.84.170.161","TLSv1.3","240","Application Data"
"330","43.477659100","151.101.2.187","100.84.170.161","TCP","240","[TCP Retransmission] 443  >  62978 [PSH, ACK] Seq=12473 Ack=190602 Win=244736 Len=186"
"331","43.477715600","100.84.170.161","151.101.2.187","TCP","66","62978  >  443 [ACK] Seq=190602 Ack=12659 Win=130560 Len=0 SLE=12473 SRE=12659"
"332","43.498381700","100.84.170.161","151.101.2.187","TLSv1.3","2453","Application Data"
"333","43.508462700","151.101.2.187","100.84.170.161","TCP","56","443  >  62978 [ACK] Seq=12659 Ack=193001 Win=250880 Len=0"
"334","43.510853600","151.101.2.187","100.84.170.161","TLSv1.3","130","Application Data"
"335","43.553590400","100.84.170.161","151.101.2.187","TCP","54","62978  >  443 [ACK] Seq=193001 Ack=12735 Win=130304 Len=0"
"336","43.560368400","151.101.2.187","100.84.170.161","TCP","130","[TCP Spurious Retransmission] 443  >  62978 [PSH, ACK] Seq=12659 Ack=193001 Win=250880 Len=76"
"337","43.560406400","100.84.170.161","151.101.2.187","TCP","66","[TCP Dup ACK 335#1] 62978  >  443 [ACK] Seq=193001 Ack=12735 Win=130304 Len=0 SLE=12659 SRE=12735"
"338","44.926927500","100.84.170.161","151.101.2.187","TLSv1.3","2451","Application Data"
"339","44.939374100","151.101.2.187","100.84.170.161","TCP","56","443  >  62978 [ACK] Seq=12735 Ack=195398 Win=256512 Len=0"
"340","44.939374100","151.101.2.187","100.84.170.161","TLSv1.3","452","Application Data"
"341","44.984264700","100.84.170.161","151.101.2.187","TCP","54","62978  >  443 [ACK] Seq=195398 Ack=13133 Win=130048 Len=0"
"342","44.988131900","151.101.2.187","100.84.170.161","TCP","452","[TCP Spurious Retransmission] 443  >  62978 [PSH, ACK] Seq=12735 Ack=195398 Win=256512 Len=398"
"343","44.988173600","100.84.170.161","151.101.2.187","TCP","66","[TCP Dup ACK 341#1] 62978  >  443 [ACK] Seq=195398 Ack=13133 Win=130048 Len=0 SLE=12735 SRE=13133"
"344","45.279822800","100.84.170.161","151.101.2.187","TLSv1.3","2452","Application Data"
"345","45.291927300","151.101.2.187","100.84.170.161","TCP","56","443  >  62978 [ACK] Seq=13133 Ack=197796 Win=262656 Len=0"
"346","45.295716200","151.101.2.187","100.84.170.161","TLSv1.3","129","Application Data"
"347","45.345121600","151.101.2.187","100.84.170.161","TCP","129","[TCP Retransmission] 443  >  62978 [PSH, ACK] Seq=13133 Ack=197796 Win=262656 Len=75"
"348","45.345209300","100.84.170.161","151.101.2.187","TCP","66","62978  >  443 [ACK] Seq=197796 Ack=13208 Win=129792 Len=0 SLE=13133 SRE=13208"
"349","45.370306300","100.84.170.161","151.101.2.187","TLSv1.3","2451","Application Data"
"350","45.379995900","151.101.2.187","100.84.170.161","TCP","56","443  >  62978 [ACK] Seq=13208 Ack=200193 Win=268288 Len=0"
"351","45.382021700","151.101.2.187","100.84.170.161","TLSv1.3","98","Application Data"
"352","45.431884700","151.101.2.187","100.84.170.161","TCP","98","[TCP Retransmission] 443  >  62978 [PSH, ACK] Seq=13208 Ack=200193 Win=268288 Len=44"
"353","45.431936800","100.84.170.161","151.101.2.187","TCP","66","62978  >  443 [ACK] Seq=200193 Ack=13252 Win=129792 Len=0 SLE=13208 SRE=13252"
"354","45.999232000","100.84.170.161","151.101.2.187","TLSv1.3","2451","Application Data"
"355","46.009658700","151.101.2.187","100.84.170.161","TCP","56","443  >  62978 [ACK] Seq=13252 Ack=202590 Win=273920 Len=0"
"356","46.011292500","151.101.2.187","100.84.170.161","TLSv1.3","215","Application Data"
"357","46.051579600","100.84.170.161","151.101.2.187","TCP","54","62978  >  443 [ACK] Seq=202590 Ack=13413 Win=131328 Len=0"
"358","46.061506300","151.101.2.187","100.84.170.161","TCP","215","[TCP Spurious Retransmission] 443  >  62978 [PSH, ACK] Seq=13252 Ack=202590 Win=273920 Len=161"
"359","46.061546100","100.84.170.161","151.101.2.187","TCP","66","[TCP Dup ACK 357#1] 62978  >  443 [ACK] Seq=202590 Ack=13413 Win=131328 Len=0 SLE=13252 SRE=13413"
"360","46.325370200","100.84.170.161","151.101.2.187","TLSv1.3","2491","Application Data"
"361","46.338803800","151.101.2.187","100.84.170.161","TCP","56","443  >  62978 [ACK] Seq=13413 Ack=205027 Win=280064 Len=0"
"362","46.340797500","151.101.2.187","100.84.170.161","TLSv1.3","130","Application Data"
"363","46.383960100","100.84.170.161","151.101.2.187","TCP","54","62978  >  443 [ACK] Seq=205027 Ack=13489 Win=131072 Len=0"
"364","46.389234000","151.101.2.187","100.84.170.161","TCP","130","[TCP Spurious Retransmission] 443  >  62978 [PSH, ACK] Seq=13413 Ack=205027 Win=280064 Len=76"
"365","46.389294900","100.84.170.161","151.101.2.187","TCP","66","[TCP Dup ACK 363#1] 62978  >  443 [ACK] Seq=205027 Ack=13489 Win=131072 Len=0 SLE=13413 SRE=13489"
"366","46.834051400","100.84.170.161","151.101.2.187","TLSv1.3","2453","Application Data"
"367","46.834944800","100.84.170.161","151.101.2.187","TLSv1.3","2441","Application Data"
"368","46.836149700","100.84.170.161","151.101.2.187","TLSv1.3","2435","Application Data"
"369","46.844618600","100.84.170.161","151.101.2.187","TLSv1.3","2454","Application Data"
"370","46.844687000","151.101.2.187","100.84.170.161","TCP","56","443  >  62978 [ACK] Seq=13489 Ack=209813 Win=291840 Len=0"
"371","46.845459800","151.101.2.187","100.84.170.161","TCP","56","443  >  62978 [ACK] Seq=13489 Ack=212194 Win=297472 Len=0"
"372","46.847584600","151.101.2.187","100.84.170.161","TLSv1.3","241","Application Data"
"373","46.847937600","151.101.2.187","100.84.170.161","TLSv1.3","103","Application Data"
"374","46.847964300","100.84.170.161","151.101.2.187","TCP","54","62978  >  443 [ACK] Seq=214594 Ack=13725 Win=131072 Len=0"
"375","46.848206900","151.101.2.187","100.84.170.161","TLSv1.3","130","Application Data"
"376","46.854032800","151.101.2.187","100.84.170.161","TCP","56","443  >  62978 [ACK] Seq=13801 Ack=214594 Win=303616 Len=0"
"377","46.856631900","151.101.2.187","100.84.170.161","TLSv1.3","103","Application Data"
"378","46.856727300","100.84.170.161","151.101.2.187","TCP","54","62978  >  443 [ACK] Seq=214594 Ack=13850 Win=130816 Len=0"
"379","46.983251700","100.84.170.161","151.101.2.187","TLSv1.3","2457","Application Data"
"380","46.994026500","151.101.2.187","100.84.170.161","TCP","56","443  >  62978 [ACK] Seq=13850 Ack=216997 Win=309248 Len=0"
"381","46.996318100","151.101.2.187","100.84.170.161","TLSv1.3","129","Application Data"
"382","47.004646300","100.84.170.161","151.101.2.187","TLSv1.3","2448","Application Data"
"383","47.015133100","151.101.2.187","100.84.170.161","TCP","56","443  >  62978 [ACK] Seq=13925 Ack=219391 Win=314880 Len=0"
"384","47.017442900","151.101.2.187","100.84.170.161","TLSv1.3","129","Application Data"
"385","47.061892400","151.101.2.187","100.84.170.161","TCP","129","[TCP Retransmission] 443  >  62978 [PSH, ACK] Seq=13925 Ack=219391 Win=314880 Len=75"
"386","47.061933700","100.84.170.161","151.101.2.187","TCP","66","62978  >  443 [ACK] Seq=219391 Ack=14000 Win=130560 Len=0 SLE=13925 SRE=14000"
"387","47.084253400","100.84.170.161","151.101.2.187","TLSv1.3","2445","Application Data"
"388","47.084410900","100.84.170.161","151.101.2.187","TLSv1.3","2436","Application Data"
"389","47.095039500","151.101.2.187","100.84.170.161","TCP","56","443  >  62978 [ACK] Seq=14000 Ack=224164 Win=326656 Len=0"
"390","47.097161800","151.101.2.187","100.84.170.161","TLSv1.3","130","Application Data"
"391","47.097693400","151.101.2.187","100.84.170.161","TLSv1.3","179","Application Data"
"392","47.097737700","100.84.170.161","151.101.2.187","TCP","54","62978  >  443 [ACK] Seq=224164 Ack=14201 Win=130560 Len=0"
"393","47.177685600","100.84.170.161","151.101.2.187","TLSv1.3","2480","Application Data"
"394","47.177910800","100.84.170.161","151.101.2.187","TLSv1.3","2451","Application Data"
"395","47.178488600","100.84.170.161","151.101.2.187","TLSv1.3","2477","Application Data"
"396","47.186843400","151.101.2.187","100.84.170.161","TCP","56","443  >  62978 [ACK] Seq=14201 Ack=226590 Win=332800 Len=0"
"397","47.187346900","151.101.2.187","100.84.170.161","TCP","56","443  >  62978 [ACK] Seq=14201 Ack=231410 Win=344064 Len=0"
"398","47.189655700","151.101.2.187","100.84.170.161","TLSv1.3","291","Application Data"
"399","47.190011100","151.101.2.187","100.84.170.161","TLSv1.3","129","Application Data"
"400","47.190048500","100.84.170.161","151.101.2.187","TCP","54","62978  >  443 [ACK] Seq=231410 Ack=14513 Win=130048 Len=0"
"401","47.191073800","151.101.2.187","100.84.170.161","TLSv1.3","130","Application Data"
"402","47.236487300","100.84.170.161","151.101.2.187","TCP","54","62978  >  443 [ACK] Seq=231410 Ack=14589 Win=130048 Len=0"
"403","47.254816500","151.101.2.187","100.84.170.161","TCP","130","[TCP Spurious Retransmission] 443  >  62978 [PSH, ACK] Seq=14513 Ack=231410 Win=344064 Len=76"
"404","47.254881100","100.84.170.161","151.101.2.187","TCP","66","[TCP Dup ACK 402#1] 62978  >  443 [ACK] Seq=231410 Ack=14589 Win=130048 Len=0 SLE=14513 SRE=14589"
"405","47.532336400","100.84.170.161","151.101.2.187","TLSv1.3","2439","Application Data"
"406","47.543069000","151.101.2.187","100.84.170.161","TCP","56","443  >  62978 [ACK] Seq=14589 Ack=233795 Win=350208 Len=0"
"407","47.545670700","151.101.2.187","100.84.170.161","TLSv1.3","130","Application Data"
"408","47.561226500","100.84.170.161","151.101.2.187","TLSv1.3","2437","Application Data"
"409","47.570466700","151.101.2.187","100.84.170.161","TCP","56","443  >  62978 [ACK] Seq=14665 Ack=236178 Win=355840 Len=0"
"410","47.574489200","151.101.2.187","100.84.170.161","TLSv1.3","131","Application Data"
"411","47.616110700","151.101.2.187","100.84.170.161","TCP","131","[TCP Retransmission] 443  >  62978 [PSH, ACK] Seq=14665 Ack=236178 Win=355840 Len=77"
"412","47.616152600","100.84.170.161","151.101.2.187","TCP","66","62978  >  443 [ACK] Seq=236178 Ack=14742 Win=130048 Len=0 SLE=14665 SRE=14742"
"413","47.760032200","100.84.170.161","151.101.2.187","TLSv1.3","2440","Application Data"
"414","47.770970300","151.101.2.187","100.84.170.161","TCP","56","443  >  62978 [ACK] Seq=14742 Ack=238564 Win=361984 Len=0"
"415","47.773598300","151.101.2.187","100.84.170.161","TLSv1.3","241","Application Data"
"416","47.813941200","151.101.2.187","100.84.170.161","TCP","241","[TCP Retransmission] 443  >  62978 [PSH, ACK] Seq=14742 Ack=238564 Win=361984 Len=187"
"417","47.813986400","100.84.170.161","151.101.2.187","TCP","66","62978  >  443 [ACK] Seq=238564 Ack=14929 Win=131328 Len=0 SLE=14742 SRE=14929"
"418","48.874919400","100.84.170.161","151.101.2.187","TLSv1.3","2442","Application Data"
"419","48.884125000","151.101.2.187","100.84.170.161","TCP","56","443  >  62978 [ACK] Seq=14929 Ack=240952 Win=367616 Len=0"
"420","48.886902400","151.101.2.187","100.84.170.161","TLSv1.3","240","Application Data"
"421","48.928096400","151.101.2.187","100.84.170.161","TCP","240","[TCP Retransmission] 443  >  62978 [PSH, ACK] Seq=14929 Ack=240952 Win=367616 Len=186"
"422","48.928130600","100.84.170.161","151.101.2.187","TCP","66","62978  >  443 [ACK] Seq=240952 Ack=15115 Win=131072 Len=0 SLE=14929 SRE=15115"
"423","52.571725800","100.84.170.161","151.101.2.187","TLSv1.3","2448","Application Data"
"424","52.582335900","151.101.2.187","100.84.170.161","TCP","56","443  >  62978 [ACK] Seq=15115 Ack=243346 Win=373248 Len=0"
"425","52.584764700","151.101.2.187","100.84.170.161","TLSv1.3","213","Application Data"
"426","52.628145300","151.101.2.187","100.84.170.161","TCP","213","[TCP Retransmission] 443  >  62978 [PSH, ACK] Seq=15115 Ack=243346 Win=373248 Len=159"
"427","52.628218700","100.84.170.161","151.101.2.187","TCP","66","62978  >  443 [ACK] Seq=243346 Ack=15274 Win=130816 Len=0 SLE=15115 SRE=15274"
"428","53.375635900","100.84.170.161","151.101.2.187","TLSv1.3","2447","Application Data"
"429","53.377134800","100.84.170.161","151.101.2.187","TLSv1.3","2435","Application Data"
"430","53.381135000","100.84.170.161","151.101.2.187","TLSv1.3","2429","Application Data"
"431","53.386982300","151.101.2.187","100.84.170.161","TCP","56","443  >  62978 [ACK] Seq=15274 Ack=248120 Win=384000 Len=0"
"432","53.387863700","100.84.170.161","151.101.2.187","TLSv1.3","2448","Application Data"
"433","53.389467200","151.101.2.187","100.84.170.161","TLSv1.3","213","Application Data"
"434","53.389823600","151.101.2.187","100.84.170.161","TLSv1.3","179","Application Data"
"435","53.389856800","100.84.170.161","151.101.2.187","TCP","54","62978  >  443 [ACK] Seq=252889 Ack=15558 Win=130560 Len=0"
"436","53.391867600","151.101.2.187","100.84.170.161","TCP","56","443  >  62978 [ACK] Seq=15558 Ack=250495 Win=389632 Len=0"
"437","53.393329800","151.101.2.187","100.84.170.161","TLSv1.3","291","Application Data"
"438","53.396914900","151.101.2.187","100.84.170.161","TCP","56","443  >  62978 [ACK] Seq=15795 Ack=252889 Win=395776 Len=0"
"439","53.400329500","151.101.2.187","100.84.170.161","TLSv1.3","103","Application Data"
"440","53.400383300","100.84.170.161","151.101.2.187","TCP","54","62978  >  443 [ACK] Seq=252889 Ack=15844 Win=130304 Len=0"
"441","53.517126800","100.84.170.161","151.101.2.187","TLSv1.3","2451","Application Data"
"442","53.533454700","151.101.2.187","100.84.170.161","TCP","56","443  >  62978 [ACK] Seq=15844 Ack=255286 Win=401408 Len=0"
"443","53.533691400","151.101.2.187","100.84.170.161","TLSv1.3","129","Application Data"
"444","53.549085400","100.84.170.161","151.101.2.187","TLSv1.3","2442","Application Data"
"445","53.559862300","151.101.2.187","100.84.170.161","TCP","56","443  >  62978 [ACK] Seq=15919 Ack=257674 Win=407552 Len=0"
"446","53.563273900","151.101.2.187","100.84.170.161","TLSv1.3","130","Application Data"
"447","53.603065500","151.101.2.187","100.84.170.161","TCP","130","[TCP Retransmission] 443  >  62978 [PSH, ACK] Seq=15919 Ack=257674 Win=407552 Len=76"
"448","53.603115400","100.84.170.161","151.101.2.187","TCP","66","62978  >  443 [ACK] Seq=257674 Ack=15995 Win=130304 Len=0 SLE=15919 SRE=15995"
"449","53.635762600","100.84.170.161","151.101.2.187","TLSv1.3","2435","Application Data"
"450","53.636496900","100.84.170.161","151.101.2.187","TLSv1.3","2436","Application Data"
"451","53.636647100","100.84.170.161","151.101.2.187","TLSv1.3","2433","Application Data"
"452","53.649507400","151.101.2.187","100.84.170.161","TCP","56","443  >  62978 [ACK] Seq=15995 Ack=260055 Win=413184 Len=0"
"453","53.649853200","151.101.2.187","100.84.170.161","TCP","56","443  >  62978 [ACK] Seq=15995 Ack=262437 Win=419328 Len=0"
"454","53.651650900","151.101.2.187","100.84.170.161","TCP","56","443  >  62978 [ACK] Seq=15995 Ack=264816 Win=424960 Len=0"
"455","53.651650900","151.101.2.187","100.84.170.161","TLSv1.3","130","Application Data"
"456","53.651933700","151.101.2.187","100.84.170.161","TLSv1.3","184","Application Data"
"457","53.651998900","100.84.170.161","151.101.2.187","TCP","54","62978  >  443 [ACK] Seq=264816 Ack=16201 Win=130048 Len=0"
"458","53.704228800","100.84.170.161","151.101.2.187","TLSv1.3","2435","Application Data"
"459","53.704421300","100.84.170.161","151.101.2.187","TLSv1.3","2426","Application Data"
"460","53.716173400","151.101.2.187","100.84.170.161","TCP","56","443  >  62978 [ACK] Seq=16201 Ack=269569 Win=436736 Len=0"
"461","53.719252800","151.101.2.187","100.84.170.161","TLSv1.3","295","Application Data"
"462","53.758830700","151.101.2.187","100.84.170.161","TCP","295","[TCP Retransmission] 443  >  62978 [PSH, ACK] Seq=16201 Ack=269569 Win=436736 Len=241"
"463","53.758865600","100.84.170.161","151.101.2.187","TCP","66","62978  >  443 [ACK] Seq=269569 Ack=16442 Win=131328 Len=0 SLE=16201 SRE=16442"
"464","54.035323500","100.84.170.161","151.101.2.187","TLSv1.3","2462","Application Data"
"465","54.044804800","151.101.2.187","100.84.170.161","TCP","56","443  >  62978 [ACK] Seq=16442 Ack=271977 Win=442368 Len=0"
"466","54.048311400","151.101.2.187","100.84.170.161","TLSv1.3","131","Application Data"
"467","54.072367500","100.84.170.161","151.101.2.187","TLSv1.3","2450","Application Data"
"468","54.081916200","151.101.2.187","100.84.170.161","TCP","56","443  >  62978 [ACK] Seq=16519 Ack=274373 Win=448512 Len=0"
"469","54.084419700","151.101.2.187","100.84.170.161","TLSv1.3","131","Application Data"
"470","54.125186200","100.84.170.161","151.101.2.187","TLSv1.3","2464","Application Data"
"471","54.126701900","100.84.170.161","151.101.2.187","TLSv1.3","2463","Application Data"
"472","54.128789700","151.101.2.187","100.84.170.161","TCP","131","[TCP Spurious Retransmission] 443  >  62978 [PSH, ACK] Seq=16519 Ack=274373 Win=448512 Len=77"
"473","54.128830300","100.84.170.161","151.101.2.187","TCP","66","[TCP Dup ACK 470#1] 62978  >  443 [ACK] Seq=279192 Ack=16596 Win=131072 Len=0 SLE=16519 SRE=16596"
"474","54.134626900","151.101.2.187","100.84.170.161","TCP","56","443  >  62978 [ACK] Seq=16596 Ack=276783 Win=454144 Len=0"
"475","54.135863400","151.101.2.187","100.84.170.161","TCP","56","443  >  62978 [ACK] Seq=16596 Ack=279192 Win=459776 Len=0"
"476","54.138278000","151.101.2.187","100.84.170.161","TLSv1.3","179","Application Data"
"477","54.139860700","151.101.2.187","100.84.170.161","TLSv1.3","290","Application Data"
"478","54.139969500","100.84.170.161","151.101.2.187","TCP","54","62978  >  443 [ACK] Seq=279192 Ack=16957 Win=130816 Len=0"
"479","54.395136500","100.84.170.161","151.101.2.187","TLSv1.3","2464","Application Data"
"480","54.398599200","100.84.170.161","151.101.2.187","TLSv1.3","2462","Application Data"
"481","54.404841400","151.101.2.187","100.84.170.161","TCP","56","443  >  62978 [ACK] Seq=16957 Ack=281602 Win=465920 Len=0"
"482","54.407047800","151.101.2.187","100.84.170.161","TLSv1.3","130","Application Data"
"483","54.408158400","151.101.2.187","100.84.170.161","TCP","56","443  >  62978 [ACK] Seq=17033 Ack=284010 Win=471552 Len=0"
"484","54.410705900","151.101.2.187","100.84.170.161","TLSv1.3","98","Application Data"
"485","54.410757100","100.84.170.161","151.101.2.187","TCP","54","62978  >  443 [ACK] Seq=284010 Ack=17077 Win=130560 Len=0"
"486","54.656854200","100.84.170.161","151.101.2.187","TLSv1.3","2465","Application Data"
"487","54.667599700","151.101.2.187","100.84.170.161","TCP","56","443  >  62978 [ACK] Seq=17077 Ack=286421 Win=477696 Len=0"
"488","54.670350000","151.101.2.187","100.84.170.161","TLSv1.3","241","Application Data"
"489","54.711484200","151.101.2.187","100.84.170.161","TCP","241","[TCP Retransmission] 443  >  62978 [PSH, ACK] Seq=17077 Ack=286421 Win=477696 Len=187"
"490","54.711535200","100.84.170.161","151.101.2.187","TCP","66","62978  >  443 [ACK] Seq=286421 Ack=17264 Win=130560 Len=0 SLE=17077 SRE=17264"
"491","54.985521100","100.84.170.161","151.101.2.187","TLSv1.3","2467","Application Data"
"492","54.994730800","151.101.2.187","100.84.170.161","TCP","56","443  >  62978 [ACK] Seq=17264 Ack=288834 Win=483328 Len=0"
"493","54.997593200","151.101.2.187","100.84.170.161","TLSv1.3","103","Application Data"
"494","55.037121000","151.101.2.187","100.84.170.161","TCP","103","[TCP Retransmission] 443  >  62978 [PSH, ACK] Seq=17264 Ack=288834 Win=483328 Len=49"
"495","55.037166300","100.84.170.161","151.101.2.187","TCP","66","62978  >  443 [ACK] Seq=288834 Ack=17313 Win=130304 Len=0 SLE=17264 SRE=17313"
