No.,Time,Source,Destination,Protocol,Length,Info
1,0.0,100.84.170.161,151.101.2.187,TLSv1.2,2505,Application Data
2,0.0002505,100.84.170.161,151.101.2.187,TLSv1.2,93,Application Data
3,0.0096464,151.101.2.187,100.84.170.161,TCP,56,443  >  55283 [ACK] Seq=1 Ack=2491 Win=2134 Len=0
4,0.010439,151.101.2.187,100.84.170.161,TLSv1.2,93,Application Data
5,0.0357756,151.101.2.187,100.84.170.161,TCP,93,"[TCP Retransmission] 443  >  55283 [PSH, ACK] Seq=1 Ack=2491 Win=2134 Len=39"
6,0.0358648,100.84.170.161,151.101.2.187,TCP,66,55283  >  443 [ACK] Seq=2491 Ack=40 Win=511 Len=0 SLE=1 SRE=40
7,0.5480551,151.101.2.187,100.84.170.161,TCP,14614,443  >  55283 [ACK] Seq=40 Ack=2491 Win=2134 Len=14560 [TCP PDU reassembled in 8]
8,0.5480551,151.101.2.187,100.84.170.161,TLSv1.2,1330,Application Data
9,0.5480551,151.101.2.187,100.84.170.161,TLSv1.2,43734,"Application Data, Application Data"
10,0.5480551,151.101.2.187,100.84.170.161,TLSv1.2,874,Application Data
11,0.5480551,151.101.2.187,100.84.170.161,TCP,874,"[TCP Retransmission] 443  >  55283 [PSH, ACK] Seq=59556 Ack=2491 Win=2134 Len=820 [TCP PDU reassembled in 10]"
12,0.5482277,100.84.170.161,151.101.2.187,TCP,66,55283  >  443 [ACK] Seq=2491 Ack=60376 Win=513 Len=0 SLE=59556 SRE=60376
13,0.5515975,100.84.170.161,151.101.2.187,TLSv1.2,89,Application Data
14,0.560292,151.101.2.187,100.84.170.161,TCP,56,443  >  55283 [ACK] Seq=60376 Ack=2526 Win=2134 Len=0
15,0.914215,100.84.170.161,151.101.2.187,TLSv1.2,2520,Application Data
16,0.9144224,100.84.170.161,151.101.2.187,TLSv1.2,2514,Application Data
17,0.9254822,100.84.170.161,151.101.2.187,TLSv1.2,2520,Application Data
18,0.9453566,100.84.170.161,151.101.2.187,TCP,1514,"[TCP Retransmission] 55283  >  443 [PSH, ACK] Seq=8458 Ack=60376 Win=513 Len=1460"
19,0.9670546,100.84.170.161,151.101.2.187,TLSv1.2,2514,Application Data
20,0.9674907,100.84.170.161,151.101.2.187,TLSv1.2,2517,Application Data
21,0.9678258,100.84.170.161,151.101.2.187,TLSv1.2,2520,Application Data
22,0.9862766,151.101.2.187,100.84.170.161,TCP,56,443  >  55283 [ACK] Seq=60376 Ack=9918 Win=2167 Len=0
23,0.9862766,151.101.2.187,100.84.170.161,TLSv1.2,420,Application Data
24,0.9871625,100.84.170.161,151.101.2.187,TLSv1.2,2521,Application Data
25,1.004423,151.101.2.187,100.84.170.161,TLSv1.2,130,Application Data
26,1.004423,151.101.2.187,100.84.170.161,TCP,130,"[TCP Retransmission] 443  >  55283 [PSH, ACK] Seq=60742 Ack=9918 Win=2167 Len=76"
27,1.0046343,100.84.170.161,151.101.2.187,TCP,66,55283  >  443 [ACK] Seq=19774 Ack=60818 Win=511 Len=0 SLE=60742 SRE=60818
28,1.0084674,151.101.2.187,100.84.170.161,TCP,56,443  >  55283 [ACK] Seq=60818 Ack=17307 Win=2201 Len=0
29,1.0084674,151.101.2.187,100.84.170.161,TLSv1.2,136,Application Data
30,1.0084674,151.101.2.187,100.84.170.161,TLSv1.2,129,Application Data
31,1.008554,100.84.170.161,151.101.2.187,TCP,54,55283  >  443 [ACK] Seq=19774 Ack=60975 Win=510 Len=0
32,1.0100393,151.101.2.187,100.84.170.161,TLSv1.2,129,Application Data
33,1.0100948,100.84.170.161,151.101.2.187,TCP,54,55283  >  443 [ACK] Seq=19774 Ack=61050 Win=510 Len=0
34,1.0127519,151.101.2.187,100.84.170.161,TCP,56,443  >  55283 [ACK] Seq=61050 Ack=19774 Win=2212 Len=0
35,1.0153403,151.101.2.187,100.84.170.161,TLSv1.2,130,Application Data
36,1.0601545,100.84.170.161,151.101.2.187,TCP,54,55283  >  443 [ACK] Seq=19774 Ack=61126 Win=510 Len=0
37,1.0697576,151.101.2.187,100.84.170.161,TCP,130,"[TCP Spurious Retransmission] 443  >  55283 [PSH, ACK] Seq=61050 Ack=19774 Win=2212 Len=76"
38,1.0698422,100.84.170.161,151.101.2.187,TCP,66,[TCP Dup ACK 36#1] 55283  >  443 [ACK] Seq=19774 Ack=61126 Win=510 Len=0 SLE=61050 SRE=61126
39,1.3147398,100.84.170.161,151.101.2.187,TLSv1.2,2518,Application Data
40,1.3239037,151.101.2.187,100.84.170.161,TCP,56,443  >  55283 [ACK] Seq=61126 Ack=22238 Win=2224 Len=0
41,1.3265524,151.101.2.187,100.84.170.161,TLSv1.2,209,Application Data
42,1.3667405,151.101.2.187,100.84.170.161,TCP,209,"[TCP Retransmission] 443  >  55283 [PSH, ACK] Seq=61126 Ack=22238 Win=2224 Len=155"
43,1.3667902,100.84.170.161,151.101.2.187,TCP,66,55283  >  443 [ACK] Seq=22238 Ack=61281 Win=509 Len=0 SLE=61126 SRE=61281
44,1.7335998,100.84.170.161,151.101.2.187,TLSv1.2,2525,Application Data
45,1.7340107,100.84.170.161,151.101.2.187,TLSv1.2,2524,Application Data
46,1.744551,151.101.2.187,100.84.170.161,TCP,56,443  >  55283 [ACK] Seq=61281 Ack=24709 Win=2235 Len=0
47,1.74464,151.101.2.187,100.84.170.161,TCP,56,443  >  55283 [ACK] Seq=61281 Ack=27179 Win=2246 Len=0
48,1.7473622,151.101.2.187,100.84.170.161,TLSv1.2,213,Application Data
49,1.7477668,151.101.2.187,100.84.170.161,TLSv1.2,98,Application Data
50,1.7478063,100.84.170.161,151.101.2.187,TCP,54,55283  >  443 [ACK] Seq=27179 Ack=61484 Win=508 Len=0
51,3.2250371,100.84.170.161,151.101.2.187,TLSv1.2,2520,Application Data
52,3.2310502,100.84.170.161,151.101.2.187,TLSv1.2,2521,Application Data
53,3.2568536,100.84.170.161,151.101.2.187,TCP,1514,"[TCP Retransmission] 55283  >  443 [PSH, ACK] Seq=30652 Ack=61484 Win=508 Len=1460"
54,3.2880297,151.101.2.187,100.84.170.161,TCP,56,443  >  55283 [ACK] Seq=61484 Ack=29645 Win=2258 Len=0
55,3.2883182,151.101.2.187,100.84.170.161,TLSv1.2,213,Application Data
56,3.3107038,151.101.2.187,100.84.170.161,TCP,56,443  >  55283 [ACK] Seq=61643 Ack=32112 Win=2269 Len=0
57,3.311013,151.101.2.187,100.84.170.161,TLSv1.2,103,Application Data
58,3.3110446,100.84.170.161,151.101.2.187,TCP,54,55283  >  443 [ACK] Seq=32112 Ack=61692 Win=508 Len=0
59,3.3350603,151.101.2.187,100.84.170.161,TCP,66,[TCP Dup ACK 56#1] 443  >  55283 [ACK] Seq=61692 Ack=32112 Win=2269 Len=0 SLE=30652 SRE=32112
60,3.3357585,151.101.2.187,100.84.170.161,TCP,103,"[TCP Spurious Retransmission] 443  >  55283 [PSH, ACK] Seq=61643 Ack=32112 Win=2269 Len=49"
61,3.3358002,100.84.170.161,151.101.2.187,TCP,66,[TCP Dup ACK 58#1] 55283  >  443 [ACK] Seq=32112 Ack=61692 Win=508 Len=0 SLE=61643 SRE=61692
62,3.4731131,100.84.170.161,151.101.2.187,TLSv1.2,2516,Application Data
63,3.4742812,100.84.170.161,151.101.2.187,TLSv1.2,2514,Application Data
64,3.4823168,151.101.2.187,100.84.170.161,TCP,56,443  >  55283 [ACK] Seq=61692 Ack=34574 Win=2281 Len=0
65,3.4834273,151.101.2.187,100.84.170.161,TCP,56,443  >  55283 [ACK] Seq=61692 Ack=37034 Win=2292 Len=0
66,3.4848054,151.101.2.187,100.84.170.161,TLSv1.2,174,Application Data
67,3.4853959,151.101.2.187,100.84.170.161,TLSv1.2,136,Application Data
68,3.4854955,100.84.170.161,151.101.2.187,TCP,54,55283  >  443 [ACK] Seq=37034 Ack=61894 Win=513 Len=0
69,4.612122,100.84.170.161,151.101.2.187,TLSv1.2,2524,Application Data
70,4.6123595,100.84.170.161,151.101.2.187,TLSv1.2,2525,Application Data
71,4.6207658,151.101.2.187,100.84.170.161,TCP,56,443  >  55283 [ACK] Seq=61894 Ack=39504 Win=2303 Len=0
72,4.6213953,151.101.2.187,100.84.170.161,TCP,56,443  >  55283 [ACK] Seq=61894 Ack=41975 Win=2315 Len=0
73,4.62482,151.101.2.187,100.84.170.161,TLSv1.2,317,Application Data
74,4.6251407,151.101.2.187,100.84.170.161,TLSv1.2,103,Application Data
75,4.6251985,100.84.170.161,151.101.2.187,TCP,54,55283  >  443 [ACK] Seq=41975 Ack=62206 Win=512 Len=0
76,5.1209688,100.84.170.161,151.101.2.187,TLSv1.2,2520,Application Data
77,5.1235496,100.84.170.161,151.101.2.187,TLSv1.2,2521,Application Data
78,5.1294799,151.101.2.187,100.84.170.161,TCP,56,443  >  55283 [ACK] Seq=62206 Ack=44441 Win=2326 Len=0
79,5.1325428,151.101.2.187,100.84.170.161,TCP,56,443  >  55283 [ACK] Seq=62206 Ack=46908 Win=2338 Len=0
80,5.1327765,151.101.2.187,100.84.170.161,TLSv1.2,218,Application Data
81,5.1353052,151.101.2.187,100.84.170.161,TLSv1.2,98,Application Data
82,5.135415,100.84.170.161,151.101.2.187,TCP,54,55283  >  443 [ACK] Seq=46908 Ack=62414 Win=511 Len=0
83,5.9831396,100.84.170.161,151.101.2.187,TLSv1.2,2416,Application Data
84,5.9832949,100.84.170.161,151.101.2.187,TLSv1.2,2420,Application Data
85,5.9833887,100.84.170.161,151.101.2.187,TLSv1.2,2414,Application Data
86,5.9834681,100.84.170.161,151.101.2.187,TLSv1.2,2420,Application Data
87,5.9837514,100.84.170.161,151.101.2.187,TLSv1.2,2417,Application Data
88,5.9860622,100.84.170.161,151.101.2.187,TLSv1.2,2414,Application Data
89,5.993058,100.84.170.161,151.101.2.187,TLSv1.2,2418,Application Data
90,5.9939558,151.101.2.187,100.84.170.161,TCP,56,443  >  55283 [ACK] Seq=62414 Ack=51636 Win=2360 Len=0
91,5.9944307,151.101.2.187,100.84.170.161,TCP,56,443  >  55283 [ACK] Seq=62414 Ack=58725 Win=2395 Len=0
92,5.9947384,151.101.2.187,100.84.170.161,TCP,56,443  >  55283 [ACK] Seq=62414 Ack=61085 Win=2406 Len=0
93,5.9964822,151.101.2.187,100.84.170.161,TLSv1.2,214,Application Data
94,5.9968263,151.101.2.187,100.84.170.161,TLSv1.2,129,Application Data
95,5.996868,100.84.170.161,151.101.2.187,TCP,54,55283  >  443 [ACK] Seq=63449 Ack=62649 Win=510 Len=0
96,5.9971851,151.101.2.187,100.84.170.161,TLSv1.2,209,Application Data
97,5.9978364,151.101.2.187,100.84.170.161,TLSv1.2,206,"Application Data, Application Data"
98,5.9978984,100.84.170.161,151.101.2.187,TCP,54,55283  >  443 [ACK] Seq=63449 Ack=62956 Win=509 Len=0
99,5.9987235,151.101.2.187,100.84.170.161,TLSv1.2,129,Application Data
100,5.9987832,100.84.170.161,151.101.2.187,TCP,54,55283  >  443 [ACK] Seq=63449 Ack=63031 Win=508 Len=0
101,6.0026647,151.101.2.187,100.84.170.161,TCP,56,443  >  55283 [ACK] Seq=63031 Ack=63449 Win=2417 Len=0
102,6.0060509,151.101.2.187,100.84.170.161,TLSv1.2,174,Application Data
103,6.0317436,100.84.170.161,151.101.2.187,TLSv1.2,2414,Application Data
104,6.0318942,100.84.170.161,151.101.2.187,TLSv1.2,2420,Application Data
105,6.0319856,100.84.170.161,151.101.2.187,TLSv1.2,2421,Application Data
106,6.0378787,151.101.2.187,100.84.170.161,TCP,174,"[TCP Spurious Retransmission] 443  >  55283 [PSH, ACK] Seq=63031 Ack=63449 Win=2417 Len=120"
107,6.0379622,100.84.170.161,151.101.2.187,TCP,66,[TCP Dup ACK 103#1] 55283  >  443 [ACK] Seq=70542 Ack=63151 Win=508 Len=0 SLE=63031 SRE=63151
108,6.0410031,151.101.2.187,100.84.170.161,TCP,56,443  >  55283 [ACK] Seq=63151 Ack=65809 Win=2429 Len=0
109,6.0413079,151.101.2.187,100.84.170.161,TCP,56,443  >  55283 [ACK] Seq=63151 Ack=70542 Win=2452 Len=0
110,6.0437346,151.101.2.187,100.84.170.161,TLSv1.2,136,Application Data
111,6.0440726,151.101.2.187,100.84.170.161,TLSv1.2,130,Application Data
112,6.0441215,100.84.170.161,151.101.2.187,TCP,54,55283  >  443 [ACK] Seq=70542 Ack=63309 Win=507 Len=0
113,6.0458938,151.101.2.187,100.84.170.161,TLSv1.2,207,Application Data
114,6.0818338,151.101.2.187,100.84.170.161,TCP,207,"[TCP Retransmission] 443  >  55283 [PSH, ACK] Seq=63309 Ack=70542 Win=2452 Len=153"
115,6.0818706,100.84.170.161,151.101.2.187,TCP,66,55283  >  443 [ACK] Seq=70542 Ack=63462 Win=513 Len=0 SLE=63309 SRE=63462
116,6.7468005,100.84.170.161,151.101.2.187,TLSv1.2,2416,Application Data
117,6.7492622,100.84.170.161,151.101.2.187,TLSv1.2,2417,Application Data
118,6.7568546,151.101.2.187,100.84.170.161,TCP,56,443  >  55283 [ACK] Seq=63462 Ack=72904 Win=2463 Len=0
119,6.7582272,151.101.2.187,100.84.170.161,TCP,56,443  >  55283 [ACK] Seq=63462 Ack=75267 Win=2475 Len=0
120,6.7596111,151.101.2.187,100.84.170.161,TLSv1.2,208,Application Data
121,6.7601758,151.101.2.187,100.84.170.161,TLSv1.2,108,Application Data
122,6.7602261,100.84.170.161,151.101.2.187,TCP,54,55283  >  443 [ACK] Seq=75267 Ack=63670 Win=512 Len=0
123,7.8334096,100.84.170.161,151.101.2.187,TLSv1.2,2416,Application Data
124,7.844696,151.101.2.187,100.84.170.161,TCP,56,443  >  55283 [ACK] Seq=63670 Ack=77629 Win=2486 Len=0
125,7.8475733,151.101.2.187,100.84.170.161,TLSv1.2,240,Application Data
126,7.8746238,151.101.2.187,100.84.170.161,TCP,240,"[TCP Retransmission] 443  >  55283 [PSH, ACK] Seq=63670 Ack=77629 Win=2486 Len=186"
127,7.874724,100.84.170.161,151.101.2.187,TCP,66,55283  >  443 [ACK] Seq=77629 Ack=63856 Win=511 Len=0 SLE=63670 SRE=63856
128,8.0529238,100.84.170.161,151.101.2.187,TLSv1.2,2414,Application Data
129,8.0634836,151.101.2.187,100.84.170.161,TCP,56,443  >  55283 [ACK] Seq=63856 Ack=79989 Win=2497 Len=0
130,8.0666432,151.101.2.187,100.84.170.161,TLSv1.2,131,Application Data
131,8.0947299,151.101.2.187,100.84.170.161,TCP,131,"[TCP Retransmission] 443  >  55283 [PSH, ACK] Seq=63856 Ack=79989 Win=2497 Len=77"
132,8.0947856,100.84.170.161,151.101.2.187,TCP,66,55283  >  443 [ACK] Seq=79989 Ack=63933 Win=511 Len=0 SLE=63856 SRE=63933
133,8.475391,100.84.170.161,151.101.2.187,TLSv1.2,2415,Application Data
134,8.4856459,151.101.2.187,100.84.170.161,TCP,56,443  >  55283 [ACK] Seq=63933 Ack=82350 Win=2509 Len=0
135,8.4904638,151.101.2.187,100.84.170.161,TLSv1.2,207,Application Data
136,8.5177468,151.101.2.187,100.84.170.161,TCP,207,"[TCP Retransmission] 443  >  55283 [PSH, ACK] Seq=63933 Ack=82350 Win=2509 Len=153"
137,8.517819,100.84.170.161,151.101.2.187,TCP,66,55283  >  443 [ACK] Seq=82350 Ack=64086 Win=510 Len=0 SLE=63933 SRE=64086
138,9.9677805,100.84.170.161,151.101.2.187,TLSv1.2,2408,Application Data
139,9.967985,100.84.170.161,151.101.2.187,TLSv1.2,2402,Application Data
140,9.9681171,100.84.170.161,151.101.2.187,TLSv1.2,2409,Application Data
141,9.9682242,100.84.170.161,151.101.2.187,TLSv1.2,2408,Application Data
142,9.968843,100.84.170.161,151.101.2.187,TLSv1.2,2402,Application Data
143,9.9689922,100.84.170.161,151.101.2.187,TLSv1.2,2402,Application Data
144,9.9691192,100.84.170.161,151.101.2.187,TLSv1.2,2405,Application Data
145,9.9692604,100.84.170.161,151.101.2.187,TLSv1.2,2402,Application Data
146,9.9693874,100.84.170.161,151.101.2.187,TLSv1.2,2408,Application Data
147,9.9695072,100.84.170.161,151.101.2.187,TLSv1.2,2399,Application Data
148,9.9784,151.101.2.187,100.84.170.161,TCP,56,443  >  55283 [ACK] Seq=64086 Ack=87052 Win=2532 Len=0
149,9.9786519,151.101.2.187,100.84.170.161,TCP,56,443  >  55283 [ACK] Seq=64086 Ack=103510 Win=2611 Len=0
150,9.9789647,151.101.2.187,100.84.170.161,TCP,56,443  >  55283 [ACK] Seq=64086 Ack=105855 Win=2623 Len=0
151,9.9853319,151.101.2.187,100.84.170.161,TLSv1.2,295,Application Data
152,9.990256,151.101.2.187,100.84.170.161,TLSv1.2,234,Application Data
153,9.9903195,100.84.170.161,151.101.2.187,TCP,54,55283  >  443 [ACK] Seq=105855 Ack=64507 Win=509 Len=0
154,9.991106,151.101.2.187,100.84.170.161,TLSv1.2,130,Application Data
155,9.9926168,151.101.2.187,100.84.170.161,TLSv1.2,322,Application Data
156,9.9926168,151.101.2.187,100.84.170.161,TLSv1.2,130,Application Data
157,9.9926726,100.84.170.161,151.101.2.187,TCP,54,55283  >  443 [ACK] Seq=105855 Ack=64927 Win=513 Len=0
158,9.992914,151.101.2.187,100.84.170.161,TLSv1.2,130,Application Data
159,9.9929408,100.84.170.161,151.101.2.187,TCP,54,55283  >  443 [ACK] Seq=105855 Ack=65003 Win=512 Len=0
160,9.9994573,100.84.170.161,151.101.2.187,TLSv1.2,2419,Application Data
161,9.9996621,100.84.170.161,151.101.2.187,TLSv1.2,2414,Application Data
162,10.0089714,151.101.2.187,100.84.170.161,TCP,56,443  >  55283 [ACK] Seq=65003 Ack=110580 Win=2646 Len=0
163,10.0120481,151.101.2.187,100.84.170.161,TLSv1.2,131,Application Data
164,10.0125941,151.101.2.187,100.84.170.161,TLSv1.2,209,Application Data
165,10.0126348,100.84.170.161,151.101.2.187,TCP,54,55283  >  443 [ACK] Seq=110580 Ack=65235 Win=512 Len=0
166,11.2980294,100.84.170.161,151.101.2.187,TLSv1.2,2418,Application Data
167,11.308886,151.101.2.187,100.84.170.161,TCP,56,443  >  55283 [ACK] Seq=65235 Ack=112944 Win=2657 Len=0
168,11.3123637,151.101.2.187,100.84.170.161,TLSv1.2,241,Application Data
169,11.340896,151.101.2.187,100.84.170.161,TCP,241,"[TCP Retransmission] 443  >  55283 [PSH, ACK] Seq=65235 Ack=112944 Win=2657 Len=187"
170,11.34094,100.84.170.161,151.101.2.187,TCP,66,55283  >  443 [ACK] Seq=112944 Ack=65422 Win=511 Len=0 SLE=65235 SRE=65422
171,11.4550747,100.84.170.161,151.101.2.187,TLSv1.2,2419,Application Data
172,11.4651062,151.101.2.187,100.84.170.161,TCP,56,443  >  55283 [ACK] Seq=65422 Ack=115309 Win=2668 Len=0
173,11.4681758,151.101.2.187,100.84.170.161,TLSv1.2,129,Application Data
174,11.4965844,151.101.2.187,100.84.170.161,TCP,129,"[TCP Retransmission] 443  >  55283 [PSH, ACK] Seq=65422 Ack=115309 Win=2668 Len=75"
175,11.4966262,100.84.170.161,151.101.2.187,TCP,66,55283  >  443 [ACK] Seq=115309 Ack=65497 Win=511 Len=0 SLE=65422 SRE=65497
176,15.1796378,100.84.170.161,151.101.2.187,TLSv1.2,1852,Application Data
177,15.1886087,151.101.2.187,100.84.170.161,TCP,56,443  >  55283 [ACK] Seq=65497 Ack=117107 Win=2674 Len=0
178,15.2485134,151.101.2.187,100.84.170.161,TLSv1.2,339,Application Data
179,15.2487662,151.101.2.187,100.84.170.161,TLSv1.2,357,Application Data
180,15.2488545,100.84.170.161,151.101.2.187,TCP,54,55283  >  443 [ACK] Seq=117107 Ack=66085 Win=508 Len=0
181,15.2514278,100.84.170.161,151.101.2.187,TLSv1.2,89,Application Data
182,15.2599698,151.101.2.187,100.84.170.161,TCP,56,443  >  55283 [ACK] Seq=66085 Ack=117142 Win=2674 Len=0
183,19.2205838,100.84.170.161,151.101.2.187,TCP,55,56939  >  443 [ACK] Seq=1 Ack=1 Win=508 Len=1
184,19.2307262,151.101.2.187,100.84.170.161,TCP,66,443  >  56939 [ACK] Seq=1 Ack=2 Win=285 Len=0 SLE=1 SRE=2
185,19.5943375,100.84.170.161,151.101.2.187,TLSv1.2,813,Application Data
186,19.5955905,100.84.170.161,151.101.2.187,TLSv1.2,1833,Application Data
187,19.6038079,151.101.2.187,100.84.170.161,TCP,56,443  >  55283 [ACK] Seq=66085 Ack=117901 Win=2680 Len=0
188,19.6049514,151.101.2.187,100.84.170.161,TCP,56,443  >  55283 [ACK] Seq=66085 Ack=119680 Win=2686 Len=0
189,19.6070027,151.101.2.187,100.84.170.161,TLSv1.2,367,Application Data
190,19.608896,151.101.2.187,100.84.170.161,TLSv1.2,135,Application Data
191,19.6090135,100.84.170.161,151.101.2.187,TCP,54,55283  >  443 [ACK] Seq=119680 Ack=66479 Win=513 Len=0
192,20.5184499,100.84.170.161,151.101.2.187,TLSv1.2,832,Application Data
193,20.5296403,151.101.2.187,100.84.170.161,TCP,56,443  >  55283 [ACK] Seq=66479 Ack=120458 Win=2691 Len=0
194,20.5318001,151.101.2.187,100.84.170.161,TLSv1.2,213,Application Data
195,20.5610377,151.101.2.187,100.84.170.161,TCP,213,"[TCP Retransmission] 443  >  55283 [PSH, ACK] Seq=66479 Ack=120458 Win=2691 Len=159"
196,20.561126,100.84.170.161,151.101.2.187,TCP,66,55283  >  443 [ACK] Seq=120458 Ack=66638 Win=512 Len=0 SLE=66479 SRE=66638
197,21.0826587,100.84.170.161,151.101.2.187,TLSv1.2,1845,Application Data
198,21.0842929,100.84.170.161,151.101.2.187,TLSv1.2,811,Application Data
199,21.0867971,100.84.170.161,151.101.2.187,TLSv1.2,1837,Application Data
200,21.0915582,151.101.2.187,100.84.170.161,TCP,56,443  >  55283 [ACK] Seq=66638 Ack=122249 Win=2697 Len=0
201,21.0930243,151.101.2.187,100.84.170.161,TCP,56,443  >  55283 [ACK] Seq=66638 Ack=123006 Win=2703 Len=0
202,21.0943903,100.84.170.161,151.101.2.187,TLSv1.2,824,Application Data
203,21.0955276,151.101.2.187,100.84.170.161,TCP,56,443  >  55283 [ACK] Seq=66638 Ack=124789 Win=2708 Len=0
204,21.099713,151.101.2.187,100.84.170.161,TLSv1.2,291,Application Data
205,21.100242,151.101.2.187,100.84.170.161,TLSv1.2,130,Application Data
206,21.1002881,100.84.170.161,151.101.2.187,TCP,54,55283  >  443 [ACK] Seq=125559 Ack=66951 Win=511 Len=0
207,21.1005529,151.101.2.187,100.84.170.161,TLSv1.2,130,Application Data
208,21.1029237,151.101.2.187,100.84.170.161,TCP,56,443  >  55283 [ACK] Seq=67027 Ack=125559 Win=2714 Len=0
209,21.1056982,151.101.2.187,100.84.170.161,TLSv1.2,103,Application Data
210,21.1057574,100.84.170.161,151.101.2.187,TCP,54,55283  >  443 [ACK] Seq=125559 Ack=67076 Win=510 Len=0
211,21.2491634,100.84.170.161,151.101.2.187,TLSv1.2,1859,Application Data
212,21.2595951,151.101.2.187,100.84.170.161,TCP,56,443  >  55283 [ACK] Seq=67076 Ack=127364 Win=2720 Len=0
213,21.2642262,151.101.2.187,100.84.170.161,TLSv1.2,130,Application Data
214,21.2698483,100.84.170.161,151.101.2.187,TLSv1.2,818,Application Data
215,21.2784862,151.101.2.187,100.84.170.161,TCP,56,443  >  55283 [ACK] Seq=67152 Ack=128128 Win=2725 Len=0
216,21.2807603,151.101.2.187,100.84.170.161,TLSv1.2,130,Application Data
217,21.3096923,151.101.2.187,100.84.170.161,TCP,130,"[TCP Retransmission] 443  >  55283 [PSH, ACK] Seq=67152 Ack=128128 Win=2725 Len=76"
218,21.3097484,100.84.170.161,151.101.2.187,TCP,66,55283  >  443 [ACK] Seq=128128 Ack=67228 Win=510 Len=0 SLE=67152 SRE=67228
219,21.3446416,100.84.170.161,151.101.2.187,TLSv1.2,1843,Application Data
220,21.3534334,151.101.2.187,100.84.170.161,TCP,56,443  >  55283 [ACK] Seq=67228 Ack=129917 Win=2731 Len=0
221,21.3562268,151.101.2.187,100.84.170.161,TLSv1.2,130,Application Data
222,21.3836547,151.101.2.187,100.84.170.161,TCP,130,"[TCP Retransmission] 443  >  55283 [PSH, ACK] Seq=67228 Ack=129917 Win=2731 Len=76"
223,21.3836954,100.84.170.161,151.101.2.187,TCP,66,55283  >  443 [ACK] Seq=129917 Ack=67304 Win=510 Len=0 SLE=67228 SRE=67304
224,21.4386003,100.84.170.161,151.101.2.187,TLSv1.2,811,Application Data
225,21.4477766,151.101.2.187,100.84.170.161,TCP,56,443  >  55283 [ACK] Seq=67304 Ack=130674 Win=2737 Len=0
226,21.4512491,151.101.2.187,100.84.170.161,TLSv1.2,130,Application Data
227,21.4536569,100.84.170.161,151.101.2.187,TLSv1.2,1868,Application Data
228,21.4629756,151.101.2.187,100.84.170.161,TCP,56,443  >  55283 [ACK] Seq=67380 Ack=132488 Win=2743 Len=0
229,21.4655745,151.101.2.187,100.84.170.161,TLSv1.2,173,Application Data
230,21.4926557,151.101.2.187,100.84.170.161,TCP,173,"[TCP Retransmission] 443  >  55283 [PSH, ACK] Seq=67380 Ack=132488 Win=2743 Len=119"
231,21.4927045,100.84.170.161,151.101.2.187,TCP,66,55283  >  443 [ACK] Seq=132488 Ack=67499 Win=509 Len=0 SLE=67380 SRE=67499
232,21.6993325,100.84.170.161,151.101.2.187,TLSv1.2,800,Application Data
233,21.6994813,100.84.170.161,151.101.2.187,TLSv1.2,1847,Application Data
234,21.6995784,100.84.170.161,151.101.2.187,TLSv1.2,797,Application Data
235,21.6999678,100.84.170.161,151.101.2.187,TLSv1.2,1838,Application Data
236,21.7103421,151.101.2.187,100.84.170.161,TCP,56,443  >  55283 [ACK] Seq=67499 Ack=135027 Win=2754 Len=0
237,21.7106269,151.101.2.187,100.84.170.161,TCP,56,443  >  55283 [ACK] Seq=67499 Ack=135770 Win=2760 Len=0
238,21.7109063,151.101.2.187,100.84.170.161,TCP,56,443  >  55283 [ACK] Seq=67499 Ack=137554 Win=2765 Len=0
239,21.7116394,151.101.2.187,100.84.170.161,TLSv1.2,213,Application Data
240,21.7120088,151.101.2.187,100.84.170.161,TLSv1.2,135,Application Data
241,21.7120519,100.84.170.161,151.101.2.187,TCP,54,55283  >  443 [ACK] Seq=137554 Ack=67739 Win=508 Len=0
242,21.7124172,151.101.2.187,100.84.170.161,TLSv1.2,130,Application Data
243,21.712704,151.101.2.187,100.84.170.161,TLSv1.2,318,Application Data
244,21.7127335,100.84.170.161,151.101.2.187,TCP,54,55283  >  443 [ACK] Seq=137554 Ack=68079 Win=513 Len=0
245,22.0859215,100.84.170.161,151.101.2.187,TLSv1.2,828,Application Data
246,22.0959742,151.101.2.187,100.84.170.161,TCP,56,443  >  55283 [ACK] Seq=68079 Ack=138328 Win=2771 Len=0
247,22.0986684,151.101.2.187,100.84.170.161,TLSv1.2,240,Application Data
248,22.1166324,100.84.170.161,151.101.2.187,TLSv1.2,1833,Application Data
249,22.1257317,151.101.2.187,100.84.170.161,TCP,56,443  >  55283 [ACK] Seq=68265 Ack=140107 Win=2777 Len=0
250,22.1280128,151.101.2.187,100.84.170.161,TLSv1.2,131,Application Data
251,22.1587175,151.101.2.187,100.84.170.161,TCP,131,"[TCP Retransmission] 443  >  55283 [PSH, ACK] Seq=68265 Ack=140107 Win=2777 Len=77"
252,22.1587604,100.84.170.161,151.101.2.187,TCP,66,55283  >  443 [ACK] Seq=140107 Ack=68342 Win=512 Len=0 SLE=68265 SRE=68342
253,22.2197855,100.84.170.161,151.101.2.187,TLSv1.2,839,Application Data
254,22.2286713,151.101.2.187,100.84.170.161,TCP,56,443  >  55283 [ACK] Seq=68342 Ack=140892 Win=2782 Len=0
255,22.2312965,151.101.2.187,100.84.170.161,TLSv1.2,130,Application Data
256,22.2621806,100.84.170.161,151.101.2.187,TLSv1.2,1844,Application Data
257,22.2626274,151.101.2.187,100.84.170.161,TCP,130,"[TCP Spurious Retransmission] 443  >  55283 [PSH, ACK] Seq=68342 Ack=140892 Win=2782 Len=76"
258,22.2626665,100.84.170.161,151.101.2.187,TCP,66,[TCP Dup ACK 256#1] 55283  >  443 [ACK] Seq=142682 Ack=68418 Win=511 Len=0 SLE=68342 SRE=68418
259,22.2719767,151.101.2.187,100.84.170.161,TCP,56,443  >  55283 [ACK] Seq=68418 Ack=142682 Win=2788 Len=0
260,22.2757212,151.101.2.187,100.84.170.161,TLSv1.2,103,Application Data
261,22.3064972,151.101.2.187,100.84.170.161,TCP,103,"[TCP Retransmission] 443  >  55283 [PSH, ACK] Seq=68418 Ack=142682 Win=2788 Len=49"
262,22.3065404,100.84.170.161,151.101.2.187,TCP,66,55283  >  443 [ACK] Seq=142682 Ack=68467 Win=511 Len=0 SLE=68418 SRE=68467
263,31.8095914,100.84.170.161,151.101.2.187,TLSv1.2,825,Application Data
264,31.8193177,151.101.2.187,100.84.170.161,TCP,56,443  >  55283 [ACK] Seq=68467 Ack=143453 Win=2794 Len=0
265,31.8225457,100.84.170.161,151.101.2.187,TLSv1.2,1829,Application Data
266,31.8238997,151.101.2.187,100.84.170.161,TLSv1.2,240,Application Data
267,31.8263171,100.84.170.161,151.101.2.187,TLSv1.2,839,Application Data
268,31.8264616,100.84.170.161,151.101.2.187,TLSv1.2,1845,Application Data
269,31.8325876,151.101.2.187,100.84.170.161,TCP,56,443  >  55283 [ACK] Seq=68653 Ack=145228 Win=2800 Len=0
270,31.835668,151.101.2.187,100.84.170.161,TCP,56,443  >  55283 [ACK] Seq=68653 Ack=146013 Win=2805 Len=0
271,31.8362244,151.101.2.187,100.84.170.161,TCP,56,443  >  55283 [ACK] Seq=68653 Ack=147804 Win=2811 Len=0
272,31.8367182,151.101.2.187,100.84.170.161,TLSv1.2,174,Application Data
273,31.8381664,151.101.2.187,100.84.170.161,TLSv1.2,213,Application Data
274,31.8382254,100.84.170.161,151.101.2.187,TCP,54,55283  >  443 [ACK] Seq=147804 Ack=68932 Win=509 Len=0
275,31.8392739,151.101.2.187,100.84.170.161,TLSv1.2,134,Application Data
276,31.8433653,100.84.170.161,151.101.2.187,TLSv1.2,826,Application Data
277,31.8518157,151.101.2.187,100.84.170.161,TCP,56,443  >  55283 [ACK] Seq=69012 Ack=148576 Win=2817 Len=0
278,31.8548474,151.101.2.187,100.84.170.161,TLSv1.2,131,Application Data
279,31.854862,100.84.170.161,151.101.2.187,TLSv1.2,1829,Application Data
280,31.8597843,100.84.170.161,151.101.2.187,TCP,55,63540  >  443 [ACK] Seq=1 Ack=1 Win=507 Len=1 [TCP PDU reassembled in 595]
281,31.8634683,151.101.2.187,100.84.170.161,TCP,56,443  >  55283 [ACK] Seq=69089 Ack=150351 Win=2822 Len=0
282,31.866586,151.101.2.187,100.84.170.161,TLSv1.2,130,Application Data
283,31.8682207,151.101.2.187,100.84.170.161,TCP,66,443  >  63540 [ACK] Seq=1 Ack=2 Win=285 Len=0 SLE=1 SRE=2
284,31.8686827,100.84.170.161,151.101.2.187,TCP,54,55283  >  443 [ACK] Seq=150351 Ack=69165 Win=509 Len=0
285,31.9675457,100.84.170.161,151.101.2.187,TLSv1.2,835,Application Data
286,31.9736994,100.84.170.161,151.101.2.187,TLSv1.2,1829,Application Data
287,31.9754747,100.84.170.161,151.101.2.187,TLSv1.2,839,Application Data
288,31.9762778,151.101.2.187,100.84.170.161,TCP,56,443  >  55283 [ACK] Seq=69165 Ack=151132 Win=2828 Len=0
289,31.9771097,100.84.170.161,151.101.2.187,TLSv1.2,1852,Application Data
290,31.9788542,151.101.2.187,100.84.170.161,TLSv1.2,98,Application Data
291,31.9823848,151.101.2.187,100.84.170.161,TCP,56,443  >  55283 [ACK] Seq=69209 Ack=152907 Win=2834 Len=0
292,31.9824877,100.84.170.161,151.101.2.187,TLSv1.2,820,Application Data
293,31.9840744,151.101.2.187,100.84.170.161,TCP,56,443  >  55283 [ACK] Seq=69209 Ack=153692 Win=2840 Len=0
294,31.9848651,151.101.2.187,100.84.170.161,TLSv1.2,182,Application Data
295,31.9860585,151.101.2.187,100.84.170.161,TCP,56,443  >  55283 [ACK] Seq=69337 Ack=155490 Win=2845 Len=0
296,31.9865778,151.101.2.187,100.84.170.161,TLSv1.2,98,Application Data
297,31.986625,100.84.170.161,151.101.2.187,TCP,54,55283  >  443 [ACK] Seq=156256 Ack=69381 Win=508 Len=0
298,31.9876701,100.84.170.161,151.101.2.187,TLSv1.2,1829,Application Data
299,31.9884984,151.101.2.187,100.84.170.161,TLSv1.2,98,Application Data
300,31.9910588,151.101.2.187,100.84.170.161,TCP,56,443  >  55283 [ACK] Seq=69425 Ack=156256 Win=2851 Len=0
301,31.9938132,151.101.2.187,100.84.170.161,TLSv1.2,98,Application Data
302,31.9938728,100.84.170.161,151.101.2.187,TCP,54,55283  >  443 [ACK] Seq=158031 Ack=69469 Win=507 Len=0
303,31.9964095,151.101.2.187,100.84.170.161,TCP,56,443  >  55283 [ACK] Seq=69469 Ack=158031 Win=2857 Len=0
304,31.9989637,151.101.2.187,100.84.170.161,TLSv1.2,104,Application Data
305,32.0267679,100.84.170.161,151.101.2.187,TLSv1.2,837,Application Data
306,32.0345923,151.101.2.187,100.84.170.161,TCP,104,"[TCP Spurious Retransmission] 443  >  55283 [PSH, ACK] Seq=69469 Ack=158031 Win=2857 Len=50"
307,32.03463,100.84.170.161,151.101.2.187,TCP,66,[TCP Dup ACK 305#1] 55283  >  443 [ACK] Seq=158814 Ack=69519 Win=507 Len=0 SLE=69469 SRE=69519
308,32.035447,151.101.2.187,100.84.170.161,TCP,56,443  >  55283 [ACK] Seq=69519 Ack=158814 Win=2862 Len=0
309,32.0389194,151.101.2.187,100.84.170.161,TLSv1.2,131,Application Data
310,32.0706804,151.101.2.187,100.84.170.161,TCP,131,"[TCP Retransmission] 443  >  55283 [PSH, ACK] Seq=69519 Ack=158814 Win=2862 Len=77"
311,32.0707221,100.84.170.161,151.101.2.187,TCP,66,55283  >  443 [ACK] Seq=158814 Ack=69596 Win=513 Len=0 SLE=69519 SRE=69596
312,32.2201984,100.84.170.161,151.101.2.187,TLSv1.2,1829,Application Data
313,32.2302691,151.101.2.187,100.84.170.161,TCP,56,443  >  55283 [ACK] Seq=69596 Ack=160589 Win=2868 Len=0
314,32.2367195,151.101.2.187,100.84.170.161,TLSv1.2,130,Application Data
315,32.2686092,151.101.2.187,100.84.170.161,TCP,130,"[TCP Retransmission] 443  >  55283 [PSH, ACK] Seq=69596 Ack=160589 Win=2868 Len=76"
316,32.2686514,100.84.170.161,151.101.2.187,TCP,66,55283  >  443 [ACK] Seq=160589 Ack=69672 Win=512 Len=0 SLE=69596 SRE=69672
317,33.6591354,100.84.170.161,151.101.2.187,TLSv1.2,839,Application Data
318,33.6603014,100.84.170.161,151.101.2.187,TLSv1.2,1823,Application Data
319,33.6605635,100.84.170.161,151.101.2.187,TLSv1.2,821,Application Data
320,33.6639339,100.84.170.161,151.101.2.187,TLSv1.2,1836,Application Data
321,33.6678248,151.101.2.187,100.84.170.161,TCP,56,443  >  55283 [ACK] Seq=69672 Ack=161374 Win=2874 Len=0
322,33.6689164,151.101.2.187,100.84.170.161,TCP,56,443  >  55283 [ACK] Seq=69672 Ack=163143 Win=2879 Len=0
323,33.6691349,151.101.2.187,100.84.170.161,TCP,56,443  >  55283 [ACK] Seq=69672 Ack=163910 Win=2885 Len=0
324,33.6720576,151.101.2.187,100.84.170.161,TLSv1.2,240,Application Data
325,33.6725009,151.101.2.187,100.84.170.161,TLSv1.2,130,Application Data
326,33.6725623,100.84.170.161,151.101.2.187,TCP,54,55283  >  443 [ACK] Seq=165692 Ack=69934 Win=511 Len=0
327,33.673427,151.101.2.187,100.84.170.161,TLSv1.2,130,Application Data
328,33.6776339,151.101.2.187,100.84.170.161,TLSv1.2,130,Application Data
329,33.6777154,100.84.170.161,151.101.2.187,TCP,54,55283  >  443 [ACK] Seq=165692 Ack=70086 Win=511 Len=0
330,33.8247596,100.84.170.161,151.101.2.187,TLSv1.2,843,Application Data
331,33.8350554,151.101.2.187,100.84.170.161,TCP,56,443  >  55283 [ACK] Seq=70086 Ack=166481 Win=2897 Len=0
332,33.8375787,151.101.2.187,100.84.170.161,TLSv1.2,367,Application Data
333,33.867488,151.101.2.187,100.84.170.161,TCP,367,"[TCP Retransmission] 443  >  55283 [PSH, ACK] Seq=70086 Ack=166481 Win=2897 Len=313"
334,33.8675286,100.84.170.161,151.101.2.187,TCP,66,55283  >  443 [ACK] Seq=166481 Ack=70399 Win=510 Len=0 SLE=70086 SRE=70399
335,33.8922908,100.84.170.161,151.101.2.187,TLSv1.2,1834,Application Data
336,33.8924931,100.84.170.161,151.101.2.187,TLSv1.2,814,Application Data
337,33.8929844,100.84.170.161,151.101.2.187,TLSv1.2,1841,Application Data
338,33.8930835,100.84.170.161,151.101.2.187,TLSv1.2,805,Application Data
339,33.9012225,151.101.2.187,100.84.170.161,TCP,56,443  >  55283 [ACK] Seq=70399 Ack=168261 Win=2902 Len=0
340,33.9015344,151.101.2.187,100.84.170.161,TCP,56,443  >  55283 [ACK] Seq=70399 Ack=169021 Win=2908 Len=0
341,33.9023391,151.101.2.187,100.84.170.161,TCP,56,443  >  55283 [ACK] Seq=70399 Ack=170808 Win=2914 Len=0
342,33.9023391,151.101.2.187,100.84.170.161,TCP,56,443  >  55283 [ACK] Seq=70399 Ack=171559 Win=2919 Len=0
343,33.9081039,151.101.2.187,100.84.170.161,TLSv1.2,321,Application Data
344,33.9110523,151.101.2.187,100.84.170.161,TLSv1.2,130,Application Data
345,33.911101,100.84.170.161,151.101.2.187,TCP,54,55283  >  443 [ACK] Seq=171559 Ack=70742 Win=508 Len=0
346,34.0088141,100.84.170.161,151.101.2.187,TLSv1.2,2056,Application Data
347,34.0175396,151.101.2.187,100.84.170.161,TCP,56,443  >  55283 [ACK] Seq=70742 Ack=173561 Win=2925 Len=0
348,34.0210182,151.101.2.187,100.84.170.161,TLSv1.2,131,Application Data
349,34.0505257,151.101.2.187,100.84.170.161,TCP,131,"[TCP Retransmission] 443  >  55283 [PSH, ACK] Seq=70742 Ack=173561 Win=2925 Len=77"
350,34.0505649,100.84.170.161,151.101.2.187,TCP,66,55283  >  443 [ACK] Seq=173561 Ack=70819 Win=508 Len=0 SLE=70742 SRE=70819
351,34.3181172,100.84.170.161,151.101.2.187,TLSv1.2,624,Application Data
352,34.3268882,151.101.2.187,100.84.170.161,TCP,56,443  >  55283 [ACK] Seq=70819 Ack=174131 Win=2925 Len=0
353,34.3297557,151.101.2.187,100.84.170.161,TLSv1.2,129,Application Data
354,34.3595735,151.101.2.187,100.84.170.161,TCP,129,"[TCP Retransmission] 443  >  55283 [PSH, ACK] Seq=70819 Ack=174131 Win=2925 Len=75"
355,34.3596015,100.84.170.161,151.101.2.187,TCP,66,55283  >  443 [ACK] Seq=174131 Ack=70894 Win=508 Len=0 SLE=70819 SRE=70894
356,35.0123167,100.84.170.161,151.101.2.187,TLSv1.2,2089,Application Data
357,35.0211391,151.101.2.187,100.84.170.161,TCP,56,443  >  55283 [ACK] Seq=70894 Ack=176166 Win=2931 Len=0
358,35.0215609,100.84.170.161,151.101.2.187,TLSv1.2,563,Application Data
359,35.025266,151.101.2.187,100.84.170.161,TLSv1.2,240,Application Data
360,35.0253252,100.84.170.161,151.101.2.187,TCP,54,55283  >  443 [ACK] Seq=176675 Ack=71080 Win=513 Len=0
361,35.0300202,151.101.2.187,100.84.170.161,TCP,56,443  >  55283 [ACK] Seq=71080 Ack=176675 Win=2931 Len=0
362,35.0329399,151.101.2.187,100.84.170.161,TLSv1.2,104,Application Data
363,35.0330032,100.84.170.161,151.101.2.187,TCP,54,55283  >  443 [ACK] Seq=176675 Ack=71130 Win=513 Len=0
364,35.1812537,100.84.170.161,151.101.2.187,TLSv1.2,2106,Application Data
365,35.2006544,151.101.2.187,100.84.170.161,TCP,56,443  >  55283 [ACK] Seq=71130 Ack=178727 Win=2936 Len=0
366,35.2052819,151.101.2.187,100.84.170.161,TLSv1.2,103,Application Data
367,35.2327403,151.101.2.187,100.84.170.161,TCP,103,"[TCP Retransmission] 443  >  55283 [PSH, ACK] Seq=71130 Ack=178727 Win=2936 Len=49"
368,35.2327827,100.84.170.161,151.101.2.187,TCP,66,55283  >  443 [ACK] Seq=178727 Ack=71179 Win=512 Len=0 SLE=71130 SRE=71179
369,35.391036,100.84.170.161,151.101.2.187,TLSv1.2,574,Application Data
370,35.400978,151.101.2.187,100.84.170.161,TCP,56,443  >  55283 [ACK] Seq=71179 Ack=179247 Win=2936 Len=0
371,35.4058975,151.101.2.187,100.84.170.161,TLSv1.2,103,Application Data
372,35.4335253,151.101.2.187,100.84.170.161,TCP,103,"[TCP Retransmission] 443  >  55283 [PSH, ACK] Seq=71179 Ack=179247 Win=2936 Len=49"
373,35.4335569,100.84.170.161,151.101.2.187,TCP,66,55283  >  443 [ACK] Seq=179247 Ack=71228 Win=512 Len=0 SLE=71179 SRE=71228
374,35.4469495,100.84.170.161,151.101.2.187,TLSv1.2,2081,Application Data
375,35.4555784,151.101.2.187,100.84.170.161,TCP,56,443  >  55283 [ACK] Seq=71228 Ack=181274 Win=2942 Len=0
376,35.4589597,151.101.2.187,100.84.170.161,TLSv1.2,131,Application Data
377,35.4875762,151.101.2.187,100.84.170.161,TCP,131,"[TCP Retransmission] 443  >  55283 [PSH, ACK] Seq=71228 Ack=181274 Win=2942 Len=77"
378,35.487603,100.84.170.161,151.101.2.187,TCP,66,55283  >  443 [ACK] Seq=181274 Ack=71305 Win=512 Len=0 SLE=71228 SRE=71305
379,36.3395105,100.84.170.161,151.101.2.187,TLSv1.2,631,Application Data
380,36.3452062,100.84.170.161,151.101.2.187,TLSv1.2,2061,Application Data
381,36.3455662,100.84.170.161,151.101.2.187,TLSv1.2,635,Application Data
382,36.3475005,100.84.170.161,151.101.2.187,TLSv1.2,2067,Application Data
383,36.349781,151.101.2.187,100.84.170.161,TCP,56,443  >  55283 [ACK] Seq=71305 Ack=181851 Win=2942 Len=0
384,36.3513853,151.101.2.187,100.84.170.161,TLSv1.2,367,Application Data
385,36.3566924,100.84.170.161,151.101.2.187,TLSv1.2,642,Application Data
386,36.3567367,151.101.2.187,100.84.170.161,TCP,56,443  >  55283 [ACK] Seq=71618 Ack=186452 Win=2954 Len=0
387,36.3599856,151.101.2.187,100.84.170.161,TLSv1.2,134,Application Data
388,36.3602408,151.101.2.187,100.84.170.161,TLSv1.2,130,Application Data
389,36.3602805,100.84.170.161,151.101.2.187,TCP,54,55283  >  443 [ACK] Seq=187040 Ack=71774 Win=510 Len=0
390,36.3625961,151.101.2.187,100.84.170.161,TLSv1.2,208,Application Data
391,36.363671,100.84.170.161,151.101.2.187,TLSv1.2,2041,Application Data
392,36.3652318,151.101.2.187,100.84.170.161,TCP,56,443  >  55283 [ACK] Seq=71928 Ack=187040 Win=2954 Len=0
393,36.3682078,151.101.2.187,100.84.170.161,TLSv1.2,131,Application Data
394,36.3724218,151.101.2.187,100.84.170.161,TCP,56,443  >  55283 [ACK] Seq=72005 Ack=189027 Win=2959 Len=0
395,36.3755687,151.101.2.187,100.84.170.161,TLSv1.2,130,Application Data
396,36.3756179,100.84.170.161,151.101.2.187,TCP,54,55283  >  443 [ACK] Seq=189027 Ack=72081 Win=509 Len=0
397,36.4088197,100.84.170.161,151.101.2.187,TLSv1.2,653,Application Data
398,36.4175251,151.101.2.187,100.84.170.161,TCP,56,443  >  55283 [ACK] Seq=72081 Ack=189626 Win=2959 Len=0
399,36.424,151.101.2.187,100.84.170.161,TLSv1.2,130,Application Data
400,36.4572363,151.101.2.187,100.84.170.161,TCP,130,"[TCP Retransmission] 443  >  55283 [PSH, ACK] Seq=72081 Ack=189626 Win=2959 Len=76"
401,36.4572788,100.84.170.161,151.101.2.187,TCP,66,55283  >  443 [ACK] Seq=189626 Ack=72157 Win=509 Len=0 SLE=72081 SRE=72157
402,36.5800477,100.84.170.161,151.101.2.187,TLSv1.2,2041,Application Data
403,36.5915299,151.101.2.187,100.84.170.161,TCP,56,443  >  55283 [ACK] Seq=72157 Ack=191613 Win=2965 Len=0
404,36.5940038,151.101.2.187,100.84.170.161,TLSv1.2,130,Application Data
405,36.6229292,151.101.2.187,100.84.170.161,TCP,130,"[TCP Retransmission] 443  >  55283 [PSH, ACK] Seq=72157 Ack=191613 Win=2965 Len=76"
406,36.6230219,100.84.170.161,151.101.2.187,TCP,66,55283  >  443 [ACK] Seq=191613 Ack=72233 Win=508 Len=0 SLE=72157 SRE=72233
407,37.5626702,100.84.170.161,151.101.2.187,TLSv1.2,656,Application Data
408,37.5764802,151.101.2.187,100.84.170.161,TCP,56,443  >  55283 [ACK] Seq=72233 Ack=192215 Win=2965 Len=0
409,37.5792941,151.101.2.187,100.84.170.161,TLSv1.2,240,Application Data
410,37.6075017,151.101.2.187,100.84.170.161,TCP,240,"[TCP Retransmission] 443  >  55283 [PSH, ACK] Seq=72233 Ack=192215 Win=2965 Len=186"
411,37.6075386,100.84.170.161,151.101.2.187,TCP,66,55283  >  443 [ACK] Seq=192215 Ack=72419 Win=508 Len=0 SLE=72233 SRE=72419
412,38.1458046,100.84.170.161,151.101.2.187,TLSv1.2,2024,Application Data
413,38.1473137,100.84.170.161,151.101.2.187,TLSv1.2,643,Application Data
414,38.1478181,100.84.170.161,151.101.2.187,TLSv1.2,2029,Application Data
415,38.1538329,100.84.170.161,151.101.2.187,TLSv1.2,656,Application Data
416,38.1559214,151.101.2.187,100.84.170.161,TCP,56,443  >  55283 [ACK] Seq=72419 Ack=194774 Win=2971 Len=0
417,38.1566185,151.101.2.187,100.84.170.161,TCP,56,443  >  55283 [ACK] Seq=72419 Ack=196749 Win=2976 Len=0
418,38.1590371,151.101.2.187,100.84.170.161,TLSv1.2,240,Application Data
419,38.1590969,100.84.170.161,151.101.2.187,TCP,54,55283  >  443 [ACK] Seq=197351 Ack=72605 Win=513 Len=0
420,38.1594197,151.101.2.187,100.84.170.161,TLSv1.2,257,Application Data
421,38.1594474,100.84.170.161,151.101.2.187,TCP,54,55283  >  443 [ACK] Seq=197351 Ack=72808 Win=512 Len=0
422,38.1600281,100.84.170.161,151.101.2.187,TLSv1.2,2030,Application Data
423,38.1602445,151.101.2.187,100.84.170.161,TLSv1.2,130,Application Data
424,38.1624469,151.101.2.187,100.84.170.161,TCP,56,443  >  55283 [ACK] Seq=72884 Ack=197351 Win=2976 Len=0
425,38.1652289,151.101.2.187,100.84.170.161,TLSv1.2,108,Application Data
426,38.1652861,100.84.170.161,151.101.2.187,TCP,54,55283  >  443 [ACK] Seq=199327 Ack=72938 Win=511 Len=0
427,38.1693953,151.101.2.187,100.84.170.161,TCP,56,443  >  55283 [ACK] Seq=72938 Ack=199327 Win=2982 Len=0
428,38.1715971,151.101.2.187,100.84.170.161,TLSv1.2,130,Application Data
429,38.2016994,151.101.2.187,100.84.170.161,TCP,130,"[TCP Retransmission] 443  >  55283 [PSH, ACK] Seq=72938 Ack=199327 Win=2982 Len=76"
430,38.2017829,100.84.170.161,151.101.2.187,TCP,66,55283  >  443 [ACK] Seq=199327 Ack=73014 Win=511 Len=0 SLE=72938 SRE=73014
431,38.2070436,100.84.170.161,151.101.2.187,TLSv1.2,650,Application Data
432,38.2157248,151.101.2.187,100.84.170.161,TCP,56,443  >  55283 [ACK] Seq=73014 Ack=199923 Win=2982 Len=0
433,38.2186284,151.101.2.187,100.84.170.161,TLSv1.2,208,Application Data
434,38.2462653,151.101.2.187,100.84.170.161,TCP,208,"[TCP Retransmission] 443  >  55283 [PSH, ACK] Seq=73014 Ack=199923 Win=2982 Len=154"
435,38.2462995,100.84.170.161,151.101.2.187,TCP,66,55283  >  443 [ACK] Seq=199923 Ack=73168 Win=511 Len=0 SLE=73014 SRE=73168
436,38.3035605,100.84.170.161,151.101.2.187,TLSv1.2,2088,Application Data
437,38.3046099,100.84.170.161,151.101.2.187,TLSv1.2,560,Application Data
438,38.3047809,100.84.170.161,151.101.2.187,TLSv1.2,2095,Application Data
439,38.3048907,100.84.170.161,151.101.2.187,TLSv1.2,551,Application Data
440,38.3124999,151.101.2.187,100.84.170.161,TCP,56,443  >  55283 [ACK] Seq=73168 Ack=201957 Win=2988 Len=0
441,38.3131983,151.101.2.187,100.84.170.161,TCP,56,443  >  55283 [ACK] Seq=73168 Ack=202463 Win=2988 Len=0
442,38.3137089,151.101.2.187,100.84.170.161,TCP,56,443  >  55283 [ACK] Seq=73168 Ack=205001 Win=2993 Len=0
443,38.3149208,151.101.2.187,100.84.170.161,TLSv1.2,130,Application Data
444,38.3157183,151.101.2.187,100.84.170.161,TLSv1.2,130,Application Data
445,38.3157772,100.84.170.161,151.101.2.187,TCP,54,55283  >  443 [ACK] Seq=205001 Ack=73320 Win=510 Len=0
446,38.3164939,151.101.2.187,100.84.170.161,TLSv1.2,130,Application Data
447,38.3168618,151.101.2.187,100.84.170.161,TLSv1.2,130,Application Data
448,38.3168808,100.84.170.161,151.101.2.187,TCP,54,55283  >  443 [ACK] Seq=205001 Ack=73472 Win=509 Len=0
449,38.3956848,100.84.170.161,151.101.2.187,TLSv1.2,2213,Application Data
450,38.4162095,100.84.170.161,151.101.2.187,TLSv1.2,551,Application Data
451,38.4312483,100.84.170.161,151.101.2.187,TCP,1514,"[TCP Retransmission] 55283  >  443 [PSH, ACK] Seq=206197 Ack=73472 Win=509 Len=1460"
452,38.4615087,151.101.2.187,100.84.170.161,TCP,56,443  >  55283 [ACK] Seq=73472 Ack=207657 Win=2999 Len=0
453,38.4834007,151.101.2.187,100.84.170.161,TLSv1.2,131,Application Data
454,38.4837217,151.101.2.187,100.84.170.161,TLSv1.2,131,Application Data
455,38.4837554,100.84.170.161,151.101.2.187,TCP,54,55283  >  443 [ACK] Seq=207657 Ack=73626 Win=509 Len=0
456,38.4841154,151.101.2.187,100.84.170.161,TCP,66,[TCP Dup ACK 452#1] 443  >  55283 [ACK] Seq=73626 Ack=207657 Win=2999 Len=0 SLE=206197 SRE=207657
457,38.4851027,151.101.2.187,100.84.170.161,TCP,131,"[TCP Spurious Retransmission] 443  >  55283 [PSH, ACK] Seq=73549 Ack=207657 Win=2999 Len=77"
458,38.4851484,100.84.170.161,151.101.2.187,TCP,66,[TCP Dup ACK 455#1] 55283  >  443 [ACK] Seq=207657 Ack=73626 Win=509 Len=0 SLE=73549 SRE=73626
459,38.5540344,100.84.170.161,151.101.2.187,TLSv1.2,2215,Application Data
460,38.563378,151.101.2.187,100.84.170.161,TCP,56,443  >  55283 [ACK] Seq=73626 Ack=209818 Win=3005 Len=0
461,38.5665937,151.101.2.187,100.84.170.161,TLSv1.2,98,Application Data
462,38.580563,100.84.170.161,151.101.2.187,TLSv1.2,543,Application Data
463,38.5898347,151.101.2.187,100.84.170.161,TCP,56,443  >  55283 [ACK] Seq=73670 Ack=210307 Win=3005 Len=0
464,38.5924807,151.101.2.187,100.84.170.161,TLSv1.2,240,Application Data
465,38.6219929,151.101.2.187,100.84.170.161,TCP,240,"[TCP Retransmission] 443  >  55283 [PSH, ACK] Seq=73670 Ack=210307 Win=3005 Len=186"
466,38.6220372,100.84.170.161,151.101.2.187,TCP,66,55283  >  443 [ACK] Seq=210307 Ack=73856 Win=508 Len=0 SLE=73670 SRE=73856
467,43.610141,100.84.170.161,151.101.2.187,TLSv1.2,2192,Application Data
468,43.6189321,151.101.2.187,100.84.170.161,TCP,56,443  >  55283 [ACK] Seq=73856 Ack=212445 Win=3011 Len=0
469,43.6223643,151.101.2.187,100.84.170.161,TLSv1.2,340,Application Data
470,43.6579207,151.101.2.187,100.84.170.161,TCP,340,"[TCP Retransmission] 443  >  55283 [PSH, ACK] Seq=73856 Ack=212445 Win=3011 Len=286"
471,43.6579567,100.84.170.161,151.101.2.187,TCP,66,55283  >  443 [ACK] Seq=212445 Ack=74142 Win=513 Len=0 SLE=73856 SRE=74142
472,44.4547582,100.84.170.161,151.101.2.187,TLSv1.2,815,Application Data
473,44.4579846,100.84.170.161,151.101.2.187,TLSv1.2,1929,Application Data
474,44.4587969,100.84.170.161,151.101.2.187,TLSv1.2,800,Application Data
475,44.4634978,151.101.2.187,100.84.170.161,TCP,56,443  >  55283 [ACK] Seq=74142 Ack=213206 Win=3016 Len=0
476,44.4665756,151.101.2.187,100.84.170.161,TLSv1.2,208,Application Data
477,44.466828,151.101.2.187,100.84.170.161,TCP,56,443  >  55283 [ACK] Seq=74296 Ack=215081 Win=3022 Len=0
478,44.4677542,151.101.2.187,100.84.170.161,TCP,56,443  >  55283 [ACK] Seq=74296 Ack=215827 Win=3028 Len=0
479,44.4697365,151.101.2.187,100.84.170.161,TLSv1.2,135,Application Data
480,44.4697904,100.84.170.161,151.101.2.187,TCP,54,55283  >  443 [ACK] Seq=215827 Ack=74377 Win=512 Len=0
481,44.4711364,151.101.2.187,100.84.170.161,TLSv1.2,104,Application Data
482,44.4931728,100.84.170.161,151.101.2.187,TLSv1.2,1923,Application Data
483,44.5051747,151.101.2.187,100.84.170.161,TCP,56,443  >  55283 [ACK] Seq=74427 Ack=217696 Win=3033 Len=0
484,44.5067105,151.101.2.187,100.84.170.161,TLSv1.2,207,Application Data
485,44.5405602,151.101.2.187,100.84.170.161,TCP,207,"[TCP Retransmission] 443  >  55283 [PSH, ACK] Seq=74427 Ack=217696 Win=3033 Len=153"
486,44.5405899,100.84.170.161,151.101.2.187,TCP,66,55283  >  443 [ACK] Seq=217696 Ack=74580 Win=511 Len=0 SLE=74427 SRE=74580
487,44.6122795,100.84.170.161,151.101.2.187,TLSv1.2,800,Application Data
488,44.6207188,151.101.2.187,100.84.170.161,TCP,56,443  >  55283 [ACK] Seq=74580 Ack=218442 Win=3039 Len=0
489,44.6244982,151.101.2.187,100.84.170.161,TLSv1.2,130,Application Data
490,44.6552872,100.84.170.161,151.101.2.187,TLSv1.2,1932,Application Data
491,44.6593128,151.101.2.187,100.84.170.161,TCP,130,"[TCP Spurious Retransmission] 443  >  55283 [PSH, ACK] Seq=74580 Ack=218442 Win=3039 Len=76"
492,44.6593519,100.84.170.161,151.101.2.187,TCP,66,[TCP Dup ACK 490#1] 55283  >  443 [ACK] Seq=220320 Ack=74656 Win=511 Len=0 SLE=74580 SRE=74656
493,44.6645448,151.101.2.187,100.84.170.161,TCP,56,443  >  55283 [ACK] Seq=74656 Ack=220320 Win=3045 Len=0
494,44.6682019,151.101.2.187,100.84.170.161,TLSv1.2,131,Application Data
495,44.7026422,151.101.2.187,100.84.170.161,TCP,131,"[TCP Retransmission] 443  >  55283 [PSH, ACK] Seq=74656 Ack=220320 Win=3045 Len=77"
496,44.7026756,100.84.170.161,151.101.2.187,TCP,66,55283  >  443 [ACK] Seq=220320 Ack=74733 Win=510 Len=0 SLE=74656 SRE=74733
497,44.7869252,100.84.170.161,151.101.2.187,TLSv1.2,820,Application Data
498,44.7893786,100.84.170.161,151.101.2.187,TLSv1.2,1926,Application Data
499,44.7895366,100.84.170.161,151.101.2.187,TLSv1.2,805,Application Data
500,44.7913948,100.84.170.161,151.101.2.187,TLSv1.2,1922,Application Data
501,44.7966474,151.101.2.187,100.84.170.161,TCP,56,443  >  55283 [ACK] Seq=74733 Ack=221086 Win=3051 Len=0
502,44.7987268,151.101.2.187,100.84.170.161,TLSv1.2,240,Application Data
503,44.7993592,151.101.2.187,100.84.170.161,TCP,56,443  >  55283 [ACK] Seq=74919 Ack=222958 Win=3056 Len=0
504,44.7995758,151.101.2.187,100.84.170.161,TCP,56,443  >  55283 [ACK] Seq=74919 Ack=223709 Win=3062 Len=0
505,44.8018677,151.101.2.187,100.84.170.161,TCP,56,443  >  55283 [ACK] Seq=74919 Ack=225577 Win=3068 Len=0
506,44.8018677,151.101.2.187,100.84.170.161,TLSv1.2,131,Application Data
507,44.8019272,100.84.170.161,151.101.2.187,TCP,54,55283  >  443 [ACK] Seq=225577 Ack=74996 Win=509 Len=0
508,44.8032313,151.101.2.187,100.84.170.161,TLSv1.2,206,"Application Data, Application Data"
509,44.8032826,100.84.170.161,151.101.2.187,TCP,54,55283  >  443 [ACK] Seq=225577 Ack=75148 Win=509 Len=0
510,44.8209704,100.84.170.161,151.101.2.187,TLSv1.2,847,Application Data
511,44.8299522,151.101.2.187,100.84.170.161,TCP,56,443  >  55283 [ACK] Seq=75148 Ack=226370 Win=3073 Len=0
512,44.8329224,151.101.2.187,100.84.170.161,TLSv1.2,130,Application Data
513,44.8646116,151.101.2.187,100.84.170.161,TCP,130,"[TCP Retransmission] 443  >  55283 [PSH, ACK] Seq=75148 Ack=226370 Win=3073 Len=76"
514,44.8646498,100.84.170.161,151.101.2.187,TCP,66,55283  >  443 [ACK] Seq=226370 Ack=75224 Win=509 Len=0 SLE=75148 SRE=75224
515,44.9524349,100.84.170.161,151.101.2.187,TLSv1.2,1894,Application Data
516,44.9541632,100.84.170.161,151.101.2.187,TLSv1.2,858,Application Data
517,44.9612889,151.101.2.187,100.84.170.161,TCP,56,443  >  55283 [ACK] Seq=75224 Ack=228210 Win=3079 Len=0
518,44.9625649,151.101.2.187,100.84.170.161,TCP,56,443  >  55283 [ACK] Seq=75224 Ack=229014 Win=3085 Len=0
519,44.9643486,151.101.2.187,100.84.170.161,TLSv1.2,257,Application Data
520,44.9648506,151.101.2.187,100.84.170.161,TLSv1.2,130,Application Data
521,44.9648976,100.84.170.161,151.101.2.187,TCP,54,55283  >  443 [ACK] Seq=229014 Ack=75503 Win=507 Len=0
522,45.0802311,100.84.170.161,151.101.2.187,TLSv1.2,1843,Application Data
523,45.0892296,151.101.2.187,100.84.170.161,TCP,56,443  >  55283 [ACK] Seq=75503 Ack=230803 Win=3090 Len=0
524,45.1649962,151.101.2.187,100.84.170.161,TCP,1510,443  >  55283 [ACK] Seq=75503 Ack=230803 Win=3090 Len=1456 [TCP PDU reassembled in 526]
525,45.1656998,151.101.2.187,100.84.170.161,TCP,4422,443  >  55283 [ACK] Seq=76959 Ack=230803 Win=3090 Len=4368 [TCP PDU reassembled in 526]
526,45.1656998,151.101.2.187,100.84.170.161,TLSv1.2,783,Application Data
527,45.1657711,100.84.170.161,151.101.2.187,TCP,54,55283  >  443 [ACK] Seq=230803 Ack=82056 Win=513 Len=0
528,45.1666506,100.84.170.161,151.101.2.187,TLSv1.2,89,Application Data
529,45.1752268,151.101.2.187,100.84.170.161,TCP,56,443  >  55283 [ACK] Seq=82056 Ack=230838 Win=3090 Len=0
530,45.3522002,100.84.170.161,151.101.2.187,TLSv1.2,1100,Application Data
531,45.3625094,100.84.170.161,151.101.2.187,TLSv1.2,1636,Application Data
532,45.4617208,151.101.2.187,100.84.170.161,TCP,56,443  >  55283 [ACK] Seq=82056 Ack=233466 Win=3102 Len=0
533,45.4617208,151.101.2.187,100.84.170.161,TLSv1.2,291,Application Data
534,45.4617208,151.101.2.187,100.84.170.161,TLSv1.2,131,Application Data
535,45.4617899,100.84.170.161,151.101.2.187,TCP,54,55283  >  443 [ACK] Seq=233466 Ack=82370 Win=512 Len=0
536,45.5021088,100.84.170.161,151.101.2.187,TLSv1.2,1137,Application Data
537,45.5130252,151.101.2.187,100.84.170.161,TCP,131,"[TCP Spurious Retransmission] 443  >  55283 [PSH, ACK] Seq=82293 Ack=233466 Win=3102 Len=77"
538,45.5130707,100.84.170.161,151.101.2.187,TCP,66,[TCP Dup ACK 535#1] 55283  >  443 [ACK] Seq=234549 Ack=82370 Win=512 Len=0 SLE=82293 SRE=82370
539,45.5628629,151.101.2.187,100.84.170.161,TCP,56,443  >  55283 [ACK] Seq=82370 Ack=234549 Win=3108 Len=0
540,45.5628629,151.101.2.187,100.84.170.161,TLSv1.2,98,Application Data
541,45.5978084,151.101.2.187,100.84.170.161,TCP,98,"[TCP Retransmission] 443  >  55283 [PSH, ACK] Seq=82370 Ack=234549 Win=3108 Len=44"
542,45.5978563,100.84.170.161,151.101.2.187,TCP,66,55283  >  443 [ACK] Seq=234549 Ack=82414 Win=511 Len=0 SLE=82370 SRE=82414
543,45.6066304,100.84.170.161,151.101.2.187,TLSv1.2,1624,Application Data
544,45.6606905,100.84.170.161,151.101.2.187,TCP,1514,"[TCP Retransmission] 55283  >  443 [PSH, ACK] Seq=234659 Ack=82414 Win=511 Len=1460"
545,45.6667735,151.101.2.187,100.84.170.161,TCP,56,443  >  55283 [ACK] Seq=82414 Ack=236119 Win=3113 Len=0
546,45.6667735,151.101.2.187,100.84.170.161,TLSv1.2,130,Application Data
547,45.6697439,151.101.2.187,100.84.170.161,TCP,130,"[TCP Retransmission] 443  >  55283 [PSH, ACK] Seq=82414 Ack=236119 Win=3113 Len=76"
548,45.6697765,100.84.170.161,151.101.2.187,TCP,66,55283  >  443 [ACK] Seq=236119 Ack=82490 Win=511 Len=0 SLE=82414 SRE=82490
549,45.6749014,151.101.2.187,100.84.170.161,TCP,66,[TCP Dup ACK 545#1] 443  >  55283 [ACK] Seq=82490 Ack=236119 Win=3113 Len=0 SLE=234659 SRE=236119
550,45.7222922,100.84.170.161,151.101.2.187,TLSv1.2,1125,Application Data
551,45.7255312,100.84.170.161,151.101.2.187,TLSv1.2,1606,Application Data
552,45.7313365,151.101.2.187,100.84.170.161,TCP,56,443  >  55283 [ACK] Seq=82490 Ack=237190 Win=3119 Len=0
553,45.7348416,151.101.2.187,100.84.170.161,TCP,56,443  >  55283 [ACK] Seq=82490 Ack=238742 Win=3125 Len=0
554,45.7432622,151.101.2.187,100.84.170.161,TLSv1.2,367,Application Data
555,45.7443566,151.101.2.187,100.84.170.161,TLSv1.2,130,Application Data
556,45.7444024,100.84.170.161,151.101.2.187,TCP,54,55283  >  443 [ACK] Seq=238742 Ack=82879 Win=510 Len=0
557,45.7748593,100.84.170.161,151.101.2.187,TLSv1.2,1137,Application Data
558,45.783854,151.101.2.187,100.84.170.161,TCP,56,443  >  55283 [ACK] Seq=82879 Ack=239825 Win=3130 Len=0
559,45.7871692,151.101.2.187,100.84.170.161,TLSv1.2,131,Application Data
560,45.8165244,151.101.2.187,100.84.170.161,TCP,131,"[TCP Retransmission] 443  >  55283 [PSH, ACK] Seq=82879 Ack=239825 Win=3130 Len=77"
561,45.8166536,100.84.170.161,151.101.2.187,TCP,66,55283  >  443 [ACK] Seq=239825 Ack=82956 Win=509 Len=0 SLE=82879 SRE=82956
562,45.9276168,100.84.170.161,151.101.2.187,TLSv1.2,1646,Application Data
563,45.9280379,100.84.170.161,151.101.2.187,TLSv1.2,1137,Application Data
564,45.9358014,100.84.170.161,151.101.2.187,TLSv1.2,1640,Application Data
565,45.9388816,151.101.2.187,100.84.170.161,TCP,56,443  >  55283 [ACK] Seq=82956 Ack=242500 Win=3142 Len=0
566,45.9426028,151.101.2.187,100.84.170.161,TLSv1.2,130,Application Data
567,45.9430642,151.101.2.187,100.84.170.161,TLSv1.2,130,Application Data
568,45.9431094,100.84.170.161,151.101.2.187,TCP,54,55283  >  443 [ACK] Seq=244086 Ack=83108 Win=509 Len=0
569,45.9448399,151.101.2.187,100.84.170.161,TCP,56,443  >  55283 [ACK] Seq=83108 Ack=244086 Win=3147 Len=0
570,45.9501794,151.101.2.187,100.84.170.161,TLSv1.2,130,Application Data
571,45.9815755,151.101.2.187,100.84.170.161,TCP,130,"[TCP Retransmission] 443  >  55283 [PSH, ACK] Seq=83108 Ack=244086 Win=3147 Len=76"
572,45.981618,100.84.170.161,151.101.2.187,TCP,66,55283  >  443 [ACK] Seq=244086 Ack=83184 Win=508 Len=0 SLE=83108 SRE=83184
573,45.9943295,100.84.170.161,151.101.2.187,TLSv1.2,1122,Application Data
574,46.0036689,151.101.2.187,100.84.170.161,TCP,56,443  >  55283 [ACK] Seq=83184 Ack=245154 Win=3153 Len=0
575,46.0088487,151.101.2.187,100.84.170.161,TLSv1.2,98,Application Data
576,46.0365808,151.101.2.187,100.84.170.161,TCP,98,"[TCP Retransmission] 443  >  55283 [PSH, ACK] Seq=83184 Ack=245154 Win=3153 Len=44"
577,46.0366211,100.84.170.161,151.101.2.187,TCP,66,55283  >  443 [ACK] Seq=245154 Ack=83228 Win=508 Len=0 SLE=83184 SRE=83228
578,46.2380583,100.84.170.161,151.101.2.187,TLSv1.2,1638,Application Data
579,46.2438418,100.84.170.161,151.101.2.187,TLSv1.2,1114,Application Data
580,46.2467635,151.101.2.187,100.84.170.161,TCP,56,443  >  55283 [ACK] Seq=83228 Ack=246738 Win=3159 Len=0
581,46.2497251,151.101.2.187,100.84.170.161,TLSv1.2,130,Application Data
582,46.2524713,151.101.2.187,100.84.170.161,TCP,56,443  >  55283 [ACK] Seq=83304 Ack=247798 Win=3165 Len=0
583,46.2538116,100.84.170.161,151.101.2.187,TLSv1.2,1629,Application Data
584,46.2552638,151.101.2.187,100.84.170.161,TLSv1.2,130,Application Data
585,46.2629765,151.101.2.187,100.84.170.161,TCP,56,443  >  55283 [ACK] Seq=83380 Ack=249373 Win=3170 Len=0
586,46.2655165,151.101.2.187,100.84.170.161,TLSv1.2,212,Application Data
587,46.2655855,100.84.170.161,151.101.2.187,TCP,54,55283  >  443 [ACK] Seq=249373 Ack=83538 Win=513 Len=0
588,46.2873561,100.84.170.161,151.101.2.187,TLSv1.2,1120,Application Data
589,46.2875576,100.84.170.161,151.101.2.187,TLSv1.2,1603,Application Data
590,46.2960445,151.101.2.187,100.84.170.161,TCP,56,443  >  55283 [ACK] Seq=83538 Ack=250439 Win=3176 Len=0
591,46.2965659,151.101.2.187,100.84.170.161,TCP,56,443  >  55283 [ACK] Seq=83538 Ack=251988 Win=3182 Len=0
592,46.2995069,151.101.2.187,100.84.170.161,TLSv1.2,130,Application Data
593,46.2999438,151.101.2.187,100.84.170.161,TLSv1.2,131,Application Data
594,46.2999939,100.84.170.161,151.101.2.187,TCP,54,55283  >  443 [ACK] Seq=251988 Ack=83691 Win=512 Len=0
595,46.3289057,100.84.170.161,151.101.2.187,TLSv1.2,175,Ignored Unknown Record
596,46.329076,100.84.170.161,151.101.2.187,TLSv1.2,93,Application Data
597,46.3375203,151.101.2.187,100.84.170.161,TCP,56,443  >  63540 [ACK] Seq=1 Ack=123 Win=285 Len=0
598,46.3379627,151.101.2.187,100.84.170.161,TLSv1.2,93,Application Data
599,46.36439,151.101.2.187,100.84.170.161,TCP,93,"[TCP Retransmission] 443  >  63540 [PSH, ACK] Seq=1 Ack=162 Win=285 Len=39"
600,46.3644352,100.84.170.161,151.101.2.187,TCP,66,63540  >  443 [ACK] Seq=162 Ack=40 Win=513 Len=0 SLE=1 SRE=40
601,46.3921093,151.101.2.187,100.84.170.161,TLSv1.2,256,Application Data
602,46.3921639,100.84.170.161,151.101.2.187,TCP,54,63540  >  443 [ACK] Seq=162 Ack=242 Win=512 Len=0
603,46.39244,151.101.2.187,100.84.170.161,TLSv1.2,874,Application Data
604,46.3929461,100.84.170.161,151.101.2.187,TLSv1.2,89,Application Data
605,46.4013976,151.101.2.187,100.84.170.161,TCP,56,443  >  63540 [ACK] Seq=1062 Ack=197 Win=285 Len=0
606,46.5256441,100.84.170.161,151.101.2.187,TLSv1.2,1133,Application Data
607,46.5361278,151.101.2.187,100.84.170.161,TCP,56,443  >  55283 [ACK] Seq=83691 Ack=253067 Win=3187 Len=0
608,46.5386954,151.101.2.187,100.84.170.161,TLSv1.2,130,Application Data
609,46.5676228,151.101.2.187,100.84.170.161,TCP,130,"[TCP Retransmission] 443  >  55283 [PSH, ACK] Seq=83691 Ack=253067 Win=3187 Len=76"
610,46.5676664,100.84.170.161,151.101.2.187,TCP,66,55283  >  443 [ACK] Seq=253067 Ack=83767 Win=512 Len=0 SLE=83691 SRE=83767
611,49.7298291,100.84.170.161,151.101.2.187,TLSv1.2,1643,Application Data
612,49.7412827,151.101.2.187,100.84.170.161,TCP,56,443  >  55283 [ACK] Seq=83767 Ack=254656 Win=3193 Len=0
613,49.7443266,151.101.2.187,100.84.170.161,TLSv1.2,368,Application Data
614,49.7734541,151.101.2.187,100.84.170.161,TCP,368,"[TCP Retransmission] 443  >  55283 [PSH, ACK] Seq=83767 Ack=254656 Win=3193 Len=314"
615,49.7735004,100.84.170.161,151.101.2.187,TCP,66,55283  >  443 [ACK] Seq=254656 Ack=84081 Win=511 Len=0 SLE=83767 SRE=84081
616,49.8644768,100.84.170.161,151.101.2.187,TLSv1.2,1093,Application Data
617,49.8733711,100.84.170.161,151.101.2.187,TLSv1.2,1660,Application Data
618,49.8735526,151.101.2.187,100.84.170.161,TCP,56,443  >  55283 [ACK] Seq=84081 Ack=255695 Win=3199 Len=0
619,49.876701,151.101.2.187,100.84.170.161,TLSv1.2,130,Application Data
620,49.8819668,151.101.2.187,100.84.170.161,TCP,56,443  >  55283 [ACK] Seq=84157 Ack=257301 Win=3205 Len=0
621,49.8852183,151.101.2.187,100.84.170.161,TLSv1.2,130,Application Data
622,49.8853098,100.84.170.161,151.101.2.187,TCP,54,55283  >  443 [ACK] Seq=257301 Ack=84233 Win=510 Len=0
623,50.0016951,100.84.170.161,151.101.2.187,TLSv1.2,1126,Application Data
624,50.0636579,151.101.2.187,100.84.170.161,TCP,56,443  >  55283 [ACK] Seq=84233 Ack=258373 Win=3210 Len=0
625,50.0864122,151.101.2.187,100.84.170.161,TLSv1.2,98,Application Data
626,50.1111032,151.101.2.187,100.84.170.161,TCP,98,"[TCP Retransmission] 443  >  55283 [PSH, ACK] Seq=84233 Ack=258373 Win=3210 Len=44"
627,50.1111465,100.84.170.161,151.101.2.187,TCP,66,55283  >  443 [ACK] Seq=258373 Ack=84277 Win=510 Len=0 SLE=84233 SRE=84277
