No.,Time,Source,Destination,Protocol,Length,Info
1,0.0,172.20.40.110,151.101.130.187,TLSv1.2,2848,Application Data
2,0.0002522,172.20.40.110,151.101.130.187,TLSv1.2,93,Application Data
3,0.0120897,151.101.130.187,172.20.40.110,TCP,60,443  >  62995 [ACK] Seq=1 Ack=2795 Win=2156 Len=0
4,0.0120897,151.101.130.187,172.20.40.110,TCP,60,443  >  62995 [ACK] Seq=1 Ack=2834 Win=2156 Len=0
5,0.0120897,151.101.130.187,172.20.40.110,TLSv1.2,93,Application Data
6,0.044619,151.101.130.187,172.20.40.110,TCP,93,"[TCP Retransmission] 443  >  62995 [PSH, ACK] Seq=1 Ack=2834 Win=2156 Len=39"
7,0.0446679,172.20.40.110,151.101.130.187,TCP,66,62995  >  443 [ACK] Seq=2834 Ack=40 Win=511 Len=0 SLE=1 SRE=40
8,0.9315722,151.101.130.187,172.20.40.110,TLSv1.2,360,Application Data
9,0.9411538,151.101.130.187,172.20.40.110,TCP,1434,443  >  62995 [ACK] Seq=346 Ack=2834 Win=2156 Len=1380 [TCP PDU reassembled in 22]
10,0.9411538,151.101.130.187,172.20.40.110,TCP,1434,443  >  62995 [ACK] Seq=1726 Ack=2834 Win=2156 Len=1380 [TCP PDU reassembled in 22]
11,0.9412517,172.20.40.110,151.101.130.187,TCP,54,62995  >  443 [ACK] Seq=2834 Ack=3106 Win=512 Len=0
12,0.9444539,151.101.130.187,172.20.40.110,TCP,1434,443  >  62995 [ACK] Seq=3106 Ack=2834 Win=2156 Len=1380 [TCP PDU reassembled in 22]
13,0.9444539,151.101.130.187,172.20.40.110,TCP,1434,443  >  62995 [ACK] Seq=4486 Ack=2834 Win=2156 Len=1380 [TCP PDU reassembled in 22]
14,0.9444539,151.101.130.187,172.20.40.110,TCP,1434,443  >  62995 [ACK] Seq=5866 Ack=2834 Win=2156 Len=1380 [TCP PDU reassembled in 22]
15,0.944576,172.20.40.110,151.101.130.187,TCP,54,62995  >  443 [ACK] Seq=2834 Ack=7246 Win=512 Len=0
16,0.946737,151.101.130.187,172.20.40.110,TCP,1434,443  >  62995 [ACK] Seq=7246 Ack=2834 Win=2156 Len=1380 [TCP PDU reassembled in 22]
17,0.946737,151.101.130.187,172.20.40.110,TCP,1434,443  >  62995 [ACK] Seq=8626 Ack=2834 Win=2156 Len=1380 [TCP PDU reassembled in 22]
18,0.9468682,172.20.40.110,151.101.130.187,TCP,54,62995  >  443 [ACK] Seq=2834 Ack=10006 Win=512 Len=0
19,0.94904,151.101.130.187,172.20.40.110,TCP,1434,"443  >  62995 [PSH, ACK] Seq=10006 Ack=2834 Win=2156 Len=1380 [TCP PDU reassembled in 22]"
20,0.94904,151.101.130.187,172.20.40.110,TCP,1434,443  >  62995 [ACK] Seq=11386 Ack=2834 Win=2156 Len=1380 [TCP PDU reassembled in 22]
21,0.94904,151.101.130.187,172.20.40.110,TCP,1434,443  >  62995 [ACK] Seq=12766 Ack=2834 Win=2156 Len=1380 [TCP PDU reassembled in 22]
22,0.94904,151.101.130.187,172.20.40.110,TLSv1.2,2814,Application Data
23,0.9492088,172.20.40.110,151.101.130.187,TCP,54,62995  >  443 [ACK] Seq=2834 Ack=16906 Win=512 Len=0
24,0.951628,151.101.130.187,172.20.40.110,TCP,4194,443  >  62995 [ACK] Seq=16906 Ack=2834 Win=2156 Len=4140 [TCP PDU reassembled in 36]
25,0.9517354,172.20.40.110,151.101.130.187,TCP,54,62995  >  443 [ACK] Seq=2834 Ack=21046 Win=512 Len=0
26,0.95209,172.20.40.110,151.101.130.187,TLSv1.2,89,Application Data
27,0.9556961,151.101.130.187,172.20.40.110,TCP,1434,"443  >  62995 [PSH, ACK] Seq=21046 Ack=2834 Win=2156 Len=1380 [TCP PDU reassembled in 36]"
28,0.9557931,172.20.40.110,151.101.130.187,TCP,54,62995  >  443 [ACK] Seq=2869 Ack=22426 Win=512 Len=0
29,0.9580156,151.101.130.187,172.20.40.110,TCP,1434,443  >  62995 [ACK] Seq=22426 Ack=2834 Win=2156 Len=1380 [TCP PDU reassembled in 36]
30,0.9580156,151.101.130.187,172.20.40.110,TCP,1434,443  >  62995 [ACK] Seq=23806 Ack=2834 Win=2156 Len=1380 [TCP PDU reassembled in 36]
31,0.9580156,151.101.130.187,172.20.40.110,TCP,1434,443  >  62995 [ACK] Seq=25186 Ack=2834 Win=2156 Len=1380 [TCP PDU reassembled in 36]
32,0.9580156,151.101.130.187,172.20.40.110,TCP,2814,443  >  62995 [ACK] Seq=26566 Ack=2834 Win=2156 Len=2760 [TCP PDU reassembled in 36]
33,0.9581547,172.20.40.110,151.101.130.187,TCP,54,62995  >  443 [ACK] Seq=2869 Ack=29326 Win=512 Len=0
34,0.9606578,151.101.130.187,172.20.40.110,TCP,2814,443  >  62995 [ACK] Seq=29326 Ack=2834 Win=2156 Len=2760 [TCP PDU reassembled in 36]
35,0.9607835,172.20.40.110,151.101.130.187,TCP,54,62995  >  443 [ACK] Seq=2869 Ack=32086 Win=512 Len=0
36,0.9637754,151.101.130.187,172.20.40.110,TLSv1.2,691,Application Data
37,0.9637754,151.101.130.187,172.20.40.110,TCP,1434,443  >  62995 [ACK] Seq=32723 Ack=2834 Win=2156 Len=1380 [TCP PDU reassembled in 48]
38,0.9637754,151.101.130.187,172.20.40.110,TCP,1434,443  >  62995 [ACK] Seq=34103 Ack=2834 Win=2156 Len=1380 [TCP PDU reassembled in 48]
39,0.9637754,151.101.130.187,172.20.40.110,TCP,2814,443  >  62995 [ACK] Seq=35483 Ack=2834 Win=2156 Len=2760 [TCP PDU reassembled in 48]
40,0.9639001,172.20.40.110,151.101.130.187,TCP,54,62995  >  443 [ACK] Seq=2869 Ack=38243 Win=512 Len=0
41,0.9667703,151.101.130.187,172.20.40.110,TCP,1434,443  >  62995 [ACK] Seq=38243 Ack=2834 Win=2156 Len=1380 [TCP PDU reassembled in 48]
42,0.9668791,172.20.40.110,151.101.130.187,TCP,54,62995  >  443 [ACK] Seq=2869 Ack=39623 Win=512 Len=0
43,0.9690644,151.101.130.187,172.20.40.110,TCP,1434,443  >  62995 [ACK] Seq=39623 Ack=2834 Win=2156 Len=1380 [TCP PDU reassembled in 48]
44,0.9690644,151.101.130.187,172.20.40.110,TCP,1434,443  >  62995 [ACK] Seq=41003 Ack=2834 Win=2156 Len=1380 [TCP PDU reassembled in 48]
45,0.9690644,151.101.130.187,172.20.40.110,TCP,1434,"443  >  62995 [PSH, ACK] Seq=42383 Ack=2834 Win=2156 Len=1380 [TCP PDU reassembled in 48]"
46,0.9690644,151.101.130.187,172.20.40.110,TCP,1434,443  >  62995 [ACK] Seq=43763 Ack=2834 Win=2156 Len=1380 [TCP PDU reassembled in 48]
47,0.9692168,172.20.40.110,151.101.130.187,TCP,54,62995  >  443 [ACK] Seq=2869 Ack=45143 Win=512 Len=0
48,0.9713233,151.101.130.187,172.20.40.110,TLSv1.2,5574,Application Data
49,0.9714376,172.20.40.110,151.101.130.187,TCP,54,62995  >  443 [ACK] Seq=2869 Ack=50663 Win=512 Len=0
50,0.976982,151.101.130.187,172.20.40.110,TCP,1434,443  >  62995 [ACK] Seq=50663 Ack=2834 Win=2156 Len=1380 [TCP PDU reassembled in 60]
51,0.9770704,172.20.40.110,151.101.130.187,TCP,54,62995  >  443 [ACK] Seq=2869 Ack=52043 Win=512 Len=0
52,0.9796711,151.101.130.187,172.20.40.110,TCP,1434,443  >  62995 [ACK] Seq=52043 Ack=2834 Win=2156 Len=1380 [TCP PDU reassembled in 60]
53,0.9796711,151.101.130.187,172.20.40.110,TCP,1434,"443  >  62995 [PSH, ACK] Seq=53423 Ack=2834 Win=2156 Len=1380 [TCP PDU reassembled in 60]"
54,0.9796711,151.101.130.187,172.20.40.110,TCP,1434,443  >  62995 [ACK] Seq=54803 Ack=2834 Win=2156 Len=1380 [TCP PDU reassembled in 60]
55,0.9796711,151.101.130.187,172.20.40.110,TCP,1434,443  >  62995 [ACK] Seq=56183 Ack=2834 Win=2156 Len=1380 [TCP PDU reassembled in 60]
56,0.9797927,172.20.40.110,151.101.130.187,TCP,54,62995  >  443 [ACK] Seq=2869 Ack=57563 Win=512 Len=0
57,0.9829725,151.101.130.187,172.20.40.110,TCP,5574,443  >  62995 [ACK] Seq=57563 Ack=2834 Win=2156 Len=5520 [TCP PDU reassembled in 60]
58,0.9830715,172.20.40.110,151.101.130.187,TCP,54,62995  >  443 [ACK] Seq=2869 Ack=63083 Win=512 Len=0
59,0.9871935,151.101.130.187,172.20.40.110,TCP,1434,443  >  62995 [ACK] Seq=63083 Ack=2834 Win=2156 Len=1380 [TCP PDU reassembled in 60]
60,0.9871935,151.101.130.187,172.20.40.110,TLSv1.2,1434,Application Data
61,0.9871935,151.101.130.187,172.20.40.110,TLSv1.2,721,Application Data
62,0.9871935,151.101.130.187,172.20.40.110,TCP,721,"[TCP Retransmission] 443  >  62995 [PSH, ACK] Seq=65843 Ack=2834 Win=2156 Len=667 [TCP PDU reassembled in 61]"
63,0.9871935,151.101.130.187,172.20.40.110,TCP,60,443  >  62995 [ACK] Seq=66510 Ack=2869 Win=2156 Len=0
64,0.9873613,172.20.40.110,151.101.130.187,TCP,66,62995  >  443 [ACK] Seq=2869 Ack=66510 Win=512 Len=0 SLE=65843 SRE=66510
65,1.3348234,172.20.40.110,151.101.130.187,TLSv1.2,2840,Application Data
66,1.3364104,172.20.40.110,151.101.130.187,TLSv1.2,2855,Application Data
67,1.3373055,172.20.40.110,151.101.130.187,TLSv1.2,2840,Application Data
68,1.3493121,151.101.130.187,172.20.40.110,TCP,60,443  >  62995 [ACK] Seq=66510 Ack=4249 Win=2162 Len=0
69,1.3514521,151.101.130.187,172.20.40.110,TCP,60,443  >  62995 [ACK] Seq=66510 Ack=5655 Win=2167 Len=0
70,1.3514521,151.101.130.187,172.20.40.110,TCP,60,443  >  62995 [ACK] Seq=66510 Ack=8456 Win=2178 Len=0
71,1.3536711,151.101.130.187,172.20.40.110,TLSv1.2,241,Application Data
72,1.3559133,151.101.130.187,172.20.40.110,TLSv1.2,130,Application Data
73,1.3559133,151.101.130.187,172.20.40.110,TCP,60,443  >  62995 [ACK] Seq=66773 Ack=11242 Win=2189 Len=0
74,1.3560117,172.20.40.110,151.101.130.187,TCP,54,62995  >  443 [ACK] Seq=11242 Ack=66773 Win=511 Len=0
75,1.3569856,151.101.130.187,172.20.40.110,TLSv1.2,130,Application Data
76,1.3656693,172.20.40.110,151.101.130.187,TLSv1.2,2844,Application Data
77,1.3658896,172.20.40.110,151.101.130.187,TLSv1.2,2838,Application Data
78,1.3660419,172.20.40.110,151.101.130.187,TLSv1.2,2836,Application Data
79,1.366186,172.20.40.110,151.101.130.187,TLSv1.2,2841,Application Data
80,1.3663356,172.20.40.110,151.101.130.187,TLSv1.2,2846,Application Data
81,1.3664905,172.20.40.110,151.101.130.187,TLSv1.2,2840,Application Data
82,1.3666391,172.20.40.110,151.101.130.187,TLSv1.2,2838,Application Data
83,1.3667797,172.20.40.110,151.101.130.187,TLSv1.2,2854,Application Data
84,1.3669301,172.20.40.110,151.101.130.187,TLSv1.2,2843,Application Data
85,1.3670824,172.20.40.110,151.101.130.187,TLSv1.2,2840,Application Data
86,1.3819991,172.20.40.110,151.101.130.187,TLSv1.2,2854,Application Data
87,1.3824098,172.20.40.110,151.101.130.187,TLSv1.2,2797,Application Data
88,1.3849405,172.20.40.110,151.101.130.187,TLSv1.2,2846,Application Data
89,1.4027176,151.101.130.187,172.20.40.110,TCP,60,443  >  62995 [ACK] Seq=66849 Ack=14032 Win=2200 Len=0
90,1.4027176,151.101.130.187,172.20.40.110,TCP,60,443  >  62995 [ACK] Seq=66849 Ack=16816 Win=2211 Len=0
91,1.4027176,151.101.130.187,172.20.40.110,TCP,60,443  >  62995 [ACK] Seq=66849 Ack=19598 Win=2222 Len=0
92,1.4027176,151.101.130.187,172.20.40.110,TCP,60,443  >  62995 [ACK] Seq=66849 Ack=22385 Win=2233 Len=0
93,1.4027176,151.101.130.187,172.20.40.110,TCP,60,443  >  62995 [ACK] Seq=66849 Ack=25177 Win=2243 Len=0
94,1.4027176,151.101.130.187,172.20.40.110,TCP,60,443  >  62995 [ACK] Seq=66849 Ack=27963 Win=2254 Len=0
95,1.4139941,151.101.130.187,172.20.40.110,TLSv1.2,130,Application Data
96,1.419299,151.101.130.187,172.20.40.110,TLSv1.2,130,Application Data
97,1.419299,151.101.130.187,172.20.40.110,TLSv1.2,130,Application Data
98,1.419299,151.101.130.187,172.20.40.110,TLSv1.2,131,Application Data
99,1.419299,151.101.130.187,172.20.40.110,TLSv1.2,340,Application Data
100,1.419299,151.101.130.187,172.20.40.110,TLSv1.2,130,Application Data
101,1.419299,151.101.130.187,172.20.40.110,TCP,60,443  >  62995 [ACK] Seq=67516 Ack=30747 Win=2265 Len=0
102,1.419299,151.101.130.187,172.20.40.110,TLSv1.2,126,Application Data
103,1.419299,151.101.130.187,172.20.40.110,TCP,60,443  >  62995 [ACK] Seq=67588 Ack=33547 Win=2276 Len=0
104,1.419299,151.101.130.187,172.20.40.110,TCP,60,443  >  62995 [ACK] Seq=67588 Ack=36336 Win=2287 Len=0
105,1.419299,151.101.130.187,172.20.40.110,TLSv1.2,131,Application Data
106,1.419299,151.101.130.187,172.20.40.110,TLSv1.2,129,Application Data
107,1.419299,151.101.130.187,172.20.40.110,TCP,60,443  >  62995 [ACK] Seq=67740 Ack=39122 Win=2298 Len=0
108,1.4195088,172.20.40.110,151.101.130.187,TCP,54,62995  >  443 [ACK] Seq=47457 Ack=67740 Win=507 Len=0
109,1.4252295,151.101.130.187,172.20.40.110,TLSv1.2,240,Application Data
110,1.4253273,172.20.40.110,151.101.130.187,TCP,54,62995  >  443 [ACK] Seq=47457 Ack=67926 Win=512 Len=0
111,1.4276209,151.101.130.187,172.20.40.110,TCP,60,443  >  62995 [ACK] Seq=67926 Ack=41922 Win=2309 Len=0
112,1.4276209,151.101.130.187,172.20.40.110,TCP,60,443  >  62995 [ACK] Seq=67926 Ack=44665 Win=2320 Len=0
113,1.4276209,151.101.130.187,172.20.40.110,TLSv1.2,129,Application Data
114,1.4276209,151.101.130.187,172.20.40.110,TLSv1.2,173,Application Data
115,1.4277169,172.20.40.110,151.101.130.187,TCP,54,62995  >  443 [ACK] Seq=47457 Ack=68120 Win=511 Len=0
116,1.4312662,151.101.130.187,172.20.40.110,TLSv1.2,780,Application Data
117,1.4312662,151.101.130.187,172.20.40.110,TCP,60,443  >  62995 [ACK] Seq=68846 Ack=47457 Win=2331 Len=0
118,1.4312662,151.101.130.187,172.20.40.110,TLSv1.2,131,Application Data
119,1.4313694,172.20.40.110,151.101.130.187,TCP,54,62995  >  443 [ACK] Seq=47457 Ack=68923 Win=508 Len=0
120,1.5876467,172.20.40.110,151.101.130.187,TLSv1.2,2838,Application Data
121,1.6717787,172.20.40.110,151.101.130.187,TCP,1434,"[TCP Retransmission] 62995  >  443 [PSH, ACK] Seq=48861 Ack=68923 Win=508 Len=1380"
122,1.6777768,151.101.130.187,172.20.40.110,TCP,60,443  >  62995 [ACK] Seq=68923 Ack=50241 Win=2342 Len=0
123,1.6818993,151.101.130.187,172.20.40.110,TLSv1.2,124,Application Data
124,1.6980944,151.101.130.187,172.20.40.110,TCP,66,[TCP Dup ACK 122#1] 443  >  62995 [ACK] Seq=68993 Ack=50241 Win=2342 Len=0 SLE=48861 SRE=50241
125,1.726488,172.20.40.110,151.101.130.187,TCP,54,62995  >  443 [ACK] Seq=50241 Ack=68993 Win=507 Len=0
126,5.0990497,172.20.40.110,151.101.130.187,TLSv1.2,2842,Application Data
127,5.1009932,172.20.40.110,151.101.130.187,TLSv1.2,2838,Application Data
128,5.111937,151.101.130.187,172.20.40.110,TCP,60,443  >  62995 [ACK] Seq=68993 Ack=53029 Win=2353 Len=0
129,5.1165403,151.101.130.187,172.20.40.110,TLSv1.2,239,Application Data
130,5.1186193,151.101.130.187,172.20.40.110,TCP,60,443  >  62995 [ACK] Seq=69178 Ack=55813 Win=2364 Len=0
131,5.1315279,151.101.130.187,172.20.40.110,TLSv1.2,341,Application Data
132,5.1326631,172.20.40.110,151.101.130.187,TCP,54,62995  >  443 [ACK] Seq=55813 Ack=69465 Win=512 Len=0
133,5.473146,172.20.40.110,151.101.130.187,TLSv1.2,2850,Application Data
134,5.4734858,172.20.40.110,151.101.130.187,TLSv1.2,2845,Application Data
135,5.4739725,172.20.40.110,151.101.130.187,TLSv1.2,2844,Application Data
136,5.4899695,151.101.130.187,172.20.40.110,TCP,60,443  >  62995 [ACK] Seq=69465 Ack=57193 Win=2369 Len=0
137,5.4945419,151.101.130.187,172.20.40.110,TCP,60,443  >  62995 [ACK] Seq=69465 Ack=58609 Win=2375 Len=0
138,5.4945419,151.101.130.187,172.20.40.110,TCP,60,443  >  62995 [ACK] Seq=69465 Ack=61400 Win=2386 Len=0
139,5.4945419,151.101.130.187,172.20.40.110,TCP,60,443  >  62995 [ACK] Seq=69465 Ack=64190 Win=2397 Len=0
140,5.4988007,151.101.130.187,172.20.40.110,TLSv1.2,294,Application Data
141,5.5000873,151.101.130.187,172.20.40.110,TLSv1.2,130,Application Data
142,5.5001593,172.20.40.110,151.101.130.187,TCP,54,62995  >  443 [ACK] Seq=64190 Ack=69781 Win=510 Len=0
143,6.1406017,172.20.40.110,151.101.130.187,TLSv1.2,2841,Application Data
144,6.1530556,151.101.130.187,172.20.40.110,TCP,60,443  >  62995 [ACK] Seq=69781 Ack=66977 Win=2408 Len=0
145,6.1567801,151.101.130.187,172.20.40.110,TLSv1.2,130,Application Data
146,6.2103654,172.20.40.110,151.101.130.187,TCP,54,62995  >  443 [ACK] Seq=66977 Ack=69857 Win=510 Len=0
147,6.9285565,172.20.40.110,151.101.130.187,TLSv1.2,2854,Application Data
148,6.9413249,172.20.40.110,151.101.130.187,TLSv1.2,2837,Application Data
149,6.9562586,151.101.130.187,172.20.40.110,TCP,60,443  >  62995 [ACK] Seq=69857 Ack=69777 Win=2419 Len=0
150,6.9562586,151.101.130.187,172.20.40.110,TLSv1.2,240,Application Data
151,6.9613719,151.101.130.187,172.20.40.110,TCP,60,443  >  62995 [ACK] Seq=70043 Ack=72560 Win=2430 Len=0
152,6.9682896,151.101.130.187,172.20.40.110,TLSv1.2,131,Application Data
153,6.9683789,172.20.40.110,151.101.130.187,TCP,54,62995  >  443 [ACK] Seq=72560 Ack=70120 Win=509 Len=0
154,7.0333704,172.20.40.110,151.101.130.187,TLSv1.2,2843,Application Data
155,7.0345006,172.20.40.110,151.101.130.187,TLSv1.2,2842,Application Data
156,7.0377415,172.20.40.110,151.101.130.187,TLSv1.2,2839,Application Data
157,7.0749277,151.101.130.187,172.20.40.110,TCP,60,443  >  62995 [ACK] Seq=70120 Ack=75320 Win=2441 Len=0
158,7.0801877,151.101.130.187,172.20.40.110,TCP,60,443  >  62995 [ACK] Seq=70120 Ack=75349 Win=2441 Len=0
159,7.0801877,151.101.130.187,172.20.40.110,TLSv1.2,130,Application Data
160,7.0892233,151.101.130.187,172.20.40.110,TCP,60,443  >  62995 [ACK] Seq=70196 Ack=78109 Win=2452 Len=0
161,7.0902873,151.101.130.187,172.20.40.110,TCP,60,443  >  62995 [ACK] Seq=70196 Ack=78137 Win=2452 Len=0
162,7.0902873,151.101.130.187,172.20.40.110,TCP,60,443  >  62995 [ACK] Seq=70196 Ack=80922 Win=2463 Len=0
163,7.094631,151.101.130.187,172.20.40.110,TLSv1.2,124,Application Data
164,7.094631,151.101.130.187,172.20.40.110,TLSv1.2,130,Application Data
165,7.0947328,172.20.40.110,151.101.130.187,TCP,54,62995  >  443 [ACK] Seq=80922 Ack=70342 Win=508 Len=0
166,7.6315472,172.20.40.110,151.101.130.187,TLSv1.2,2840,Application Data
167,7.6323255,172.20.40.110,151.101.130.187,TLSv1.2,2843,Application Data
168,7.6515504,151.101.130.187,172.20.40.110,TCP,60,443  >  62995 [ACK] Seq=70342 Ack=83708 Win=2474 Len=0
169,7.6515504,151.101.130.187,172.20.40.110,TCP,60,443  >  62995 [ACK] Seq=70342 Ack=86497 Win=2485 Len=0
170,7.6515504,151.101.130.187,172.20.40.110,TLSv1.2,240,Application Data
171,7.6515504,151.101.130.187,172.20.40.110,TLSv1.2,340,Application Data
172,7.6516549,172.20.40.110,151.101.130.187,TCP,54,62995  >  443 [ACK] Seq=86497 Ack=70814 Win=506 Len=0
173,8.3744211,172.20.40.110,151.101.130.187,TLSv1.2,2858,Application Data
174,8.3746979,172.20.40.110,151.101.130.187,TLSv1.2,2859,Application Data
175,8.3894695,151.101.130.187,172.20.40.110,TCP,60,443  >  62995 [ACK] Seq=70814 Ack=89301 Win=2496 Len=0
176,8.3894695,151.101.130.187,172.20.40.110,TCP,60,443  >  62995 [ACK] Seq=70814 Ack=92106 Win=2507 Len=0
177,8.3919063,151.101.130.187,172.20.40.110,TLSv1.2,241,Application Data
178,8.3954736,151.101.130.187,172.20.40.110,TLSv1.2,131,Application Data
179,8.3955495,172.20.40.110,151.101.130.187,TCP,54,62995  >  443 [ACK] Seq=92106 Ack=71078 Win=512 Len=0
180,8.6129145,172.20.40.110,151.101.130.187,TLSv1.2,2846,Application Data
181,8.6136972,172.20.40.110,151.101.130.187,TLSv1.2,2848,Application Data
182,8.6201702,172.20.40.110,151.101.130.187,TLSv1.2,2842,Application Data
183,8.6205274,172.20.40.110,151.101.130.187,TLSv1.2,2844,Application Data
184,8.6253671,172.20.40.110,151.101.130.187,TLSv1.2,2842,Application Data
185,8.6255959,172.20.40.110,151.101.130.187,TLSv1.2,2840,Application Data
186,8.6336922,172.20.40.110,151.101.130.187,TLSv1.2,2842,Application Data
187,8.6461263,172.20.40.110,151.101.130.187,TLSv1.2,2842,Application Data
188,8.652324,151.101.130.187,172.20.40.110,TCP,60,443  >  62995 [ACK] Seq=71078 Ack=93486 Win=2513 Len=0
189,8.652324,151.101.130.187,172.20.40.110,TCP,60,443  >  62995 [ACK] Seq=71078 Ack=94898 Win=2518 Len=0
190,8.652324,151.101.130.187,172.20.40.110,TCP,60,443  >  62995 [ACK] Seq=71078 Ack=97692 Win=2529 Len=0
191,8.652324,151.101.130.187,172.20.40.110,TCP,60,443  >  62995 [ACK] Seq=71078 Ack=100480 Win=2540 Len=0
192,8.652324,151.101.130.187,172.20.40.110,TCP,60,443  >  62995 [ACK] Seq=71078 Ack=103270 Win=2551 Len=0
193,8.6634531,151.101.130.187,172.20.40.110,TCP,60,443  >  62995 [ACK] Seq=71078 Ack=104650 Win=2556 Len=0
194,8.6634531,151.101.130.187,172.20.40.110,TLSv1.2,130,Application Data
195,8.6634531,151.101.130.187,172.20.40.110,TLSv1.2,126,Application Data
196,8.6634531,151.101.130.187,172.20.40.110,TLSv1.2,129,Application Data
197,8.6634531,151.101.130.187,172.20.40.110,TLSv1.2,131,Application Data
198,8.6635429,172.20.40.110,151.101.130.187,TCP,54,62995  >  443 [ACK] Seq=114420 Ack=71378 Win=510 Len=0
199,8.6644333,151.101.130.187,172.20.40.110,TCP,60,443  >  62995 [ACK] Seq=71378 Ack=106058 Win=2562 Len=0
200,8.6674456,151.101.130.187,172.20.40.110,TLSv1.2,130,Application Data
201,8.672439,151.101.130.187,172.20.40.110,TCP,60,443  >  62995 [ACK] Seq=71454 Ack=108844 Win=2573 Len=0
202,8.672439,151.101.130.187,172.20.40.110,TCP,60,443  >  62995 [ACK] Seq=71454 Ack=111632 Win=2584 Len=0
203,8.672439,151.101.130.187,172.20.40.110,TCP,60,443  >  62995 [ACK] Seq=71454 Ack=114420 Win=2595 Len=0
204,8.688003,151.101.130.187,172.20.40.110,TLSv1.2,131,Application Data
205,8.688003,151.101.130.187,172.20.40.110,TLSv1.2,130,Application Data
206,8.688003,151.101.130.187,172.20.40.110,TLSv1.2,124,Application Data
207,8.6881535,172.20.40.110,151.101.130.187,TCP,54,62995  >  443 [ACK] Seq=114420 Ack=71677 Win=509 Len=0
208,9.7648084,172.20.40.110,151.101.130.187,TLSv1.2,2855,Application Data
209,9.7649806,172.20.40.110,151.101.130.187,TLSv1.2,2846,Application Data
210,9.7650658,172.20.40.110,151.101.130.187,TLSv1.2,2841,Application Data
211,9.7651443,172.20.40.110,151.101.130.187,TLSv1.2,2840,Application Data
212,9.7655315,172.20.40.110,151.101.130.187,TLSv1.2,2840,Application Data
213,9.7671461,172.20.40.110,151.101.130.187,TLSv1.2,2854,Application Data
214,9.7830424,151.101.130.187,172.20.40.110,TCP,60,443  >  62995 [ACK] Seq=71677 Ack=117221 Win=2606 Len=0
215,9.7872326,151.101.130.187,172.20.40.110,TLSv1.2,214,Application Data
216,9.7872326,151.101.130.187,172.20.40.110,TCP,60,443  >  62995 [ACK] Seq=71837 Ack=120013 Win=2617 Len=0
217,9.7872326,151.101.130.187,172.20.40.110,TCP,60,443  >  62995 [ACK] Seq=71837 Ack=122800 Win=2628 Len=0
218,9.7872326,151.101.130.187,172.20.40.110,TLSv1.2,340,Application Data
219,9.7872326,151.101.130.187,172.20.40.110,TLSv1.2,130,Application Data
220,9.787335,172.20.40.110,151.101.130.187,TCP,54,62995  >  443 [ACK] Seq=131172 Ack=72199 Win=507 Len=0
221,9.7888713,151.101.130.187,172.20.40.110,TCP,60,443  >  62995 [ACK] Seq=72199 Ack=125586 Win=2639 Len=0
222,9.7921874,151.101.130.187,172.20.40.110,TLSv1.2,130,Application Data
223,9.7921874,151.101.130.187,172.20.40.110,TCP,60,443  >  62995 [ACK] Seq=72275 Ack=128372 Win=2650 Len=0
224,9.7922693,172.20.40.110,151.101.130.187,TCP,54,62995  >  443 [ACK] Seq=131172 Ack=72275 Win=507 Len=0
225,9.7931452,151.101.130.187,172.20.40.110,TCP,60,443  >  62995 [ACK] Seq=72275 Ack=131172 Win=2661 Len=0
226,9.7953587,151.101.130.187,172.20.40.110,TLSv1.2,159,Application Data
227,9.8413085,172.20.40.110,151.101.130.187,TCP,54,62995  >  443 [ACK] Seq=131172 Ack=72380 Win=507 Len=0
228,9.9389836,172.20.40.110,151.101.130.187,TLSv1.2,2846,Application Data
229,9.9391786,172.20.40.110,151.101.130.187,TLSv1.2,2840,Application Data
230,9.9392681,172.20.40.110,151.101.130.187,TLSv1.2,2846,Application Data
231,9.9393445,172.20.40.110,151.101.130.187,TLSv1.2,2847,Application Data
232,9.9394519,172.20.40.110,151.101.130.187,TLSv1.2,2846,Application Data
233,9.9396004,172.20.40.110,151.101.130.187,TLSv1.2,2840,Application Data
234,9.9397897,172.20.40.110,151.101.130.187,TLSv1.2,2837,Application Data
235,9.939903,172.20.40.110,151.101.130.187,TLSv1.2,2839,Application Data
236,9.9551869,151.101.130.187,172.20.40.110,TCP,60,443  >  62995 [ACK] Seq=72380 Ack=133964 Win=2672 Len=0
237,9.9551869,151.101.130.187,172.20.40.110,TCP,60,443  >  62995 [ACK] Seq=72380 Ack=136750 Win=2682 Len=0
238,9.9551869,151.101.130.187,172.20.40.110,TCP,60,443  >  62995 [ACK] Seq=72380 Ack=139542 Win=2693 Len=0
239,9.9564428,151.101.130.187,172.20.40.110,TLSv1.2,131,Application Data
240,9.9564428,151.101.130.187,172.20.40.110,TLSv1.2,130,Application Data
241,9.9565389,172.20.40.110,151.101.130.187,TCP,54,62995  >  443 [ACK] Seq=153481 Ack=72533 Win=512 Len=0
242,9.9569296,151.101.130.187,172.20.40.110,TLSv1.2,131,Application Data
243,9.9577881,151.101.130.187,172.20.40.110,TCP,60,443  >  62995 [ACK] Seq=72610 Ack=142335 Win=2704 Len=0
244,9.9577881,151.101.130.187,172.20.40.110,TCP,60,443  >  62995 [ACK] Seq=72610 Ack=145127 Win=2715 Len=0
245,9.9577881,151.101.130.187,172.20.40.110,TCP,60,443  >  62995 [ACK] Seq=72610 Ack=147913 Win=2726 Len=0
246,9.9613801,151.101.130.187,172.20.40.110,TCP,60,443  >  62995 [ACK] Seq=72610 Ack=150696 Win=2737 Len=0
247,9.9613801,151.101.130.187,172.20.40.110,TCP,60,443  >  62995 [ACK] Seq=72610 Ack=153481 Win=2748 Len=0
248,9.9632977,151.101.130.187,172.20.40.110,TLSv1.2,130,Application Data
249,9.9633928,172.20.40.110,151.101.130.187,TCP,54,62995  >  443 [ACK] Seq=153481 Ack=72686 Win=511 Len=0
250,9.9664378,151.101.130.187,172.20.40.110,TLSv1.2,125,Application Data
251,9.9678042,151.101.130.187,172.20.40.110,TLSv1.2,131,Application Data
252,9.9678042,151.101.130.187,172.20.40.110,TLSv1.2,125,Application Data
253,9.9679768,172.20.40.110,151.101.130.187,TCP,54,62995  >  443 [ACK] Seq=153481 Ack=72905 Win=510 Len=0
254,9.968686,151.101.130.187,172.20.40.110,TLSv1.2,240,Application Data
255,9.9688275,172.20.40.110,151.101.130.187,TCP,54,62995  >  443 [ACK] Seq=153481 Ack=73091 Win=509 Len=0
256,10.3562213,172.20.40.110,151.101.130.187,TLSv1.2,2844,Application Data
257,10.3564389,172.20.40.110,151.101.130.187,TLSv1.2,2858,Application Data
258,10.357652,172.20.40.110,151.101.130.187,TLSv1.2,2847,Application Data
259,10.3577847,172.20.40.110,151.101.130.187,TLSv1.2,2844,Application Data
260,10.3578678,172.20.40.110,151.101.130.187,TLSv1.2,2847,Application Data
261,10.3582791,172.20.40.110,151.101.130.187,TLSv1.2,2844,Application Data
262,10.358418,172.20.40.110,151.101.130.187,TLSv1.2,2845,Application Data
263,10.3585449,172.20.40.110,151.101.130.187,TLSv1.2,2847,Application Data
264,10.3586729,172.20.40.110,151.101.130.187,TLSv1.2,2841,Application Data
265,10.3588837,172.20.40.110,151.101.130.187,TLSv1.2,2846,Application Data
266,10.3616917,172.20.40.110,151.101.130.187,TLSv1.2,2843,Application Data
267,10.3619184,172.20.40.110,151.101.130.187,TLSv1.2,2858,Application Data
268,10.4119624,172.20.40.110,151.101.130.187,TCP,1434,"[TCP Retransmission] 62995  >  443 [PSH, ACK] Seq=185617 Ack=73091 Win=509 Len=1380"
269,10.4587864,151.101.130.187,172.20.40.110,TCP,60,443  >  62995 [ACK] Seq=73091 Ack=154861 Win=2754 Len=0
270,10.5282749,151.101.130.187,172.20.40.110,TCP,66,[TCP Dup ACK 269#1] 443  >  62995 [ACK] Seq=73091 Ack=154861 Win=2754 Len=0 SLE=156241 SRE=156271
271,10.5316287,151.101.130.187,172.20.40.110,TCP,66,[TCP Dup ACK 269#2] 443  >  62995 [ACK] Seq=73091 Ack=154861 Win=2764 Len=0 SLE=156241 SRE=159075
272,10.5316287,151.101.130.187,172.20.40.110,TCP,66,[TCP Dup ACK 269#3] 443  >  62995 [ACK] Seq=73091 Ack=154861 Win=2775 Len=0 SLE=156241 SRE=161868
273,10.5316287,151.101.130.187,172.20.40.110,TCP,66,[TCP Dup ACK 269#4] 443  >  62995 [ACK] Seq=73091 Ack=154861 Win=2786 Len=0 SLE=156241 SRE=164658
274,10.5316287,151.101.130.187,172.20.40.110,TCP,66,[TCP Dup ACK 269#5] 443  >  62995 [ACK] Seq=73091 Ack=154861 Win=2797 Len=0 SLE=156241 SRE=167451
275,10.5316287,151.101.130.187,172.20.40.110,TCP,66,[TCP Dup ACK 269#6] 443  >  62995 [ACK] Seq=73091 Ack=154861 Win=2808 Len=0 SLE=156241 SRE=170241
276,10.5316287,151.101.130.187,172.20.40.110,TCP,66,[TCP Dup ACK 269#7] 443  >  62995 [ACK] Seq=73091 Ack=154861 Win=2819 Len=0 SLE=156241 SRE=173032
277,10.5316287,151.101.130.187,172.20.40.110,TCP,66,[TCP Dup ACK 269#8] 443  >  62995 [ACK] Seq=73091 Ack=154861 Win=2830 Len=0 SLE=156241 SRE=175825
278,10.5316287,151.101.130.187,172.20.40.110,TCP,66,[TCP Dup ACK 269#9] 443  >  62995 [ACK] Seq=73091 Ack=154861 Win=2841 Len=0 SLE=156241 SRE=178612
279,10.5316287,151.101.130.187,172.20.40.110,TCP,66,[TCP Dup ACK 269#10] 443  >  62995 [ACK] Seq=73091 Ack=154861 Win=2852 Len=0 SLE=156241 SRE=181404
280,10.5316287,151.101.130.187,172.20.40.110,TCP,66,[TCP Dup ACK 269#11] 443  >  62995 [ACK] Seq=73091 Ack=154861 Win=2863 Len=0 SLE=156241 SRE=184193
281,10.5316287,151.101.130.187,172.20.40.110,TCP,66,[TCP Dup ACK 269#12] 443  >  62995 [ACK] Seq=73091 Ack=154861 Win=2874 Len=0 SLE=156241 SRE=186997
282,10.5317363,172.20.40.110,151.101.130.187,TCP,1434,[TCP Fast Retransmission] 62995  >  443 [ACK] Seq=154861 Ack=73091 Win=509 Len=1380
283,10.5365048,151.101.130.187,172.20.40.110,TCP,74,[TCP Dup ACK 269#13] 443  >  62995 [ACK] Seq=73091 Ack=154861 Win=2874 Len=0 SLE=185617 SRE=186997 SLE=156241 SRE=186997
284,10.5453514,151.101.130.187,172.20.40.110,TCP,60,443  >  62995 [ACK] Seq=73091 Ack=186997 Win=2879 Len=0
285,10.5487553,151.101.130.187,172.20.40.110,TLSv1.2,449,Application Data
286,10.5498879,151.101.130.187,172.20.40.110,TLSv1.2,206,"Application Data, Application Data"
287,10.5498879,151.101.130.187,172.20.40.110,TLSv1.2,131,Application Data
288,10.5498879,151.101.130.187,172.20.40.110,TLSv1.2,130,Application Data
289,10.5499599,172.20.40.110,151.101.130.187,TCP,54,62995  >  443 [ACK] Seq=186997 Ack=73791 Win=507 Len=0
290,10.5504156,151.101.130.187,172.20.40.110,TLSv1.2,183,Application Data
291,10.5504518,172.20.40.110,151.101.130.187,TCP,54,62995  >  443 [ACK] Seq=186997 Ack=73920 Win=512 Len=0
292,10.5511977,151.101.130.187,172.20.40.110,TLSv1.2,282,"Application Data, Application Data, Application Data"
293,10.5512478,172.20.40.110,151.101.130.187,TCP,54,62995  >  443 [ACK] Seq=186997 Ack=74148 Win=511 Len=0
294,10.5599427,151.101.130.187,172.20.40.110,TLSv1.2,130,Application Data
295,10.5599427,151.101.130.187,172.20.40.110,TLSv1.2,130,Application Data
296,10.5600126,172.20.40.110,151.101.130.187,TCP,54,62995  >  443 [ACK] Seq=186997 Ack=74300 Win=510 Len=0
297,11.6173919,172.20.40.110,151.101.130.187,TLSv1.2,2839,Application Data
298,11.6219663,172.20.40.110,151.101.130.187,TLSv1.2,2837,Application Data
299,11.6221993,172.20.40.110,151.101.130.187,TLSv1.2,2842,Application Data
300,11.6334179,151.101.130.187,172.20.40.110,TCP,60,443  >  62995 [ACK] Seq=74300 Ack=189782 Win=2890 Len=0
301,11.6355712,151.101.130.187,172.20.40.110,TLSv1.2,451,Application Data
302,11.6399958,151.101.130.187,172.20.40.110,TCP,60,443  >  62995 [ACK] Seq=74697 Ack=192565 Win=2901 Len=0
303,11.6435079,151.101.130.187,172.20.40.110,TLSv1.2,129,Application Data
304,11.6435804,172.20.40.110,151.101.130.187,TCP,54,62995  >  443 [ACK] Seq=195353 Ack=74772 Win=508 Len=0
305,11.6445327,151.101.130.187,172.20.40.110,TCP,60,443  >  62995 [ACK] Seq=74772 Ack=195353 Win=2912 Len=0
306,11.6488315,151.101.130.187,172.20.40.110,TLSv1.2,131,Application Data
307,11.6963236,151.101.130.187,172.20.40.110,TCP,131,"[TCP Retransmission] 443  >  62995 [PSH, ACK] Seq=74772 Ack=195353 Win=2912 Len=77"
308,11.696384,172.20.40.110,151.101.130.187,TCP,66,62995  >  443 [ACK] Seq=195353 Ack=74849 Win=508 Len=0 SLE=74772 SRE=74849
309,13.1272586,172.20.40.110,151.101.130.187,TLSv1.2,2854,Application Data
310,13.1381506,151.101.130.187,172.20.40.110,TCP,60,443  >  62995 [ACK] Seq=74849 Ack=198153 Win=2923 Len=0
311,13.1449113,151.101.130.187,172.20.40.110,TLSv1.2,241,Application Data
312,13.1684666,172.20.40.110,151.101.130.187,TLSv1.2,2855,Application Data
313,13.1909487,151.101.130.187,172.20.40.110,TCP,241,"[TCP Spurious Retransmission] 443  >  62995 [PSH, ACK] Seq=74849 Ack=198153 Win=2923 Len=187"
314,13.1909487,151.101.130.187,172.20.40.110,TCP,60,443  >  62995 [ACK] Seq=75036 Ack=200954 Win=2934 Len=0
315,13.1910053,172.20.40.110,151.101.130.187,TCP,66,[TCP Dup ACK 312#1] 62995  >  443 [ACK] Seq=200954 Ack=75036 Win=507 Len=0 SLE=74849 SRE=75036
316,13.1919426,151.101.130.187,172.20.40.110,TLSv1.2,241,Application Data
317,13.2351113,151.101.130.187,172.20.40.110,TCP,241,"[TCP Retransmission] 443  >  62995 [PSH, ACK] Seq=75036 Ack=200954 Win=2934 Len=187"
318,13.2352716,172.20.40.110,151.101.130.187,TCP,66,62995  >  443 [ACK] Seq=200954 Ack=75223 Win=507 Len=0 SLE=75036 SRE=75223
319,13.9602345,172.20.40.110,151.101.130.187,TLSv1.2,2840,Application Data
320,13.9711341,151.101.130.187,172.20.40.110,TCP,60,443  >  62995 [ACK] Seq=75223 Ack=203740 Win=2945 Len=0
321,13.9762042,151.101.130.187,172.20.40.110,TLSv1.2,130,Application Data
322,14.0164548,151.101.130.187,172.20.40.110,TCP,130,"[TCP Retransmission] 443  >  62995 [PSH, ACK] Seq=75223 Ack=203740 Win=2945 Len=76"
323,14.0165132,172.20.40.110,151.101.130.187,TCP,66,62995  >  443 [ACK] Seq=203740 Ack=75299 Win=506 Len=0 SLE=75223 SRE=75299
324,14.0355173,172.20.40.110,151.101.130.187,TLSv1.2,2843,Application Data
325,14.0456838,172.20.40.110,151.101.130.187,TLSv1.2,2845,Application Data
326,14.0500227,151.101.130.187,172.20.40.110,TCP,60,443  >  62995 [ACK] Seq=75299 Ack=206529 Win=2956 Len=0
327,14.0510676,151.101.130.187,172.20.40.110,TLSv1.2,130,Application Data
328,14.051252,172.20.40.110,151.101.130.187,TCP,54,62995  >  443 [ACK] Seq=209320 Ack=75375 Win=512 Len=0
329,14.0574029,151.101.130.187,172.20.40.110,TCP,60,443  >  62995 [ACK] Seq=75375 Ack=209320 Win=2967 Len=0
330,14.0637386,151.101.130.187,172.20.40.110,TLSv1.2,130,Application Data
331,14.0638078,172.20.40.110,151.101.130.187,TCP,54,62995  >  443 [ACK] Seq=209320 Ack=75451 Win=511 Len=0
332,14.4939509,172.20.40.110,151.101.2.187,TCP,55,54874  >  443 [ACK] Seq=1 Ack=1 Win=256 Len=1 [TCP PDU reassembled in 509]
333,14.502227,151.101.2.187,172.20.40.110,TCP,66,443  >  54874 [ACK] Seq=1 Ack=2 Win=282 Len=0 SLE=1 SRE=2
334,14.8309037,172.20.40.110,151.101.130.187,TLSv1.2,2854,Application Data
335,14.8414754,151.101.130.187,172.20.40.110,TCP,60,443  >  62995 [ACK] Seq=75451 Ack=212120 Win=2978 Len=0
336,14.8440012,151.101.130.187,172.20.40.110,TLSv1.2,214,Application Data
337,14.8834039,151.101.130.187,172.20.40.110,TCP,214,"[TCP Retransmission] 443  >  62995 [PSH, ACK] Seq=75451 Ack=212120 Win=2978 Len=160"
338,14.8834615,172.20.40.110,151.101.130.187,TCP,66,62995  >  443 [ACK] Seq=212120 Ack=75611 Win=511 Len=0 SLE=75451 SRE=75611
339,14.907822,172.20.40.110,151.101.130.187,TLSv1.2,2855,Application Data
340,14.920972,151.101.130.187,172.20.40.110,TCP,60,443  >  62995 [ACK] Seq=75611 Ack=214921 Win=2989 Len=0
341,14.9256489,151.101.130.187,172.20.40.110,TLSv1.2,148,Application Data
342,14.966035,151.101.130.187,172.20.40.110,TCP,148,"[TCP Retransmission] 443  >  62995 [PSH, ACK] Seq=75611 Ack=214921 Win=2989 Len=94"
343,14.9660957,172.20.40.110,151.101.130.187,TCP,66,62995  >  443 [ACK] Seq=214921 Ack=75705 Win=510 Len=0 SLE=75611 SRE=75705
344,15.0819733,172.20.40.110,151.101.130.187,TLSv1.2,2854,Application Data
345,15.0970183,151.101.130.187,172.20.40.110,TCP,60,443  >  62995 [ACK] Seq=75705 Ack=217721 Win=3000 Len=0
346,15.0970183,151.101.130.187,172.20.40.110,TLSv1.2,296,Application Data
347,15.1427997,151.101.130.187,172.20.40.110,TCP,296,"[TCP Retransmission] 443  >  62995 [PSH, ACK] Seq=75705 Ack=217721 Win=3000 Len=242"
348,15.1428858,172.20.40.110,151.101.130.187,TCP,66,62995  >  443 [ACK] Seq=217721 Ack=75947 Win=509 Len=0 SLE=75705 SRE=75947
349,16.032674,172.20.40.110,151.101.130.187,TLSv1.2,2854,Application Data
350,16.0334721,172.20.40.110,151.101.130.187,TLSv1.2,2855,Application Data
351,16.0621796,151.101.130.187,172.20.40.110,TCP,60,443  >  62995 [ACK] Seq=75947 Ack=220521 Win=3011 Len=0
352,16.0621796,151.101.130.187,172.20.40.110,TCP,60,443  >  62995 [ACK] Seq=75947 Ack=223322 Win=3022 Len=0
353,16.0621796,151.101.130.187,172.20.40.110,TLSv1.2,214,Application Data
354,16.0621796,151.101.130.187,172.20.40.110,TLSv1.2,104,Application Data
355,16.062268,172.20.40.110,151.101.130.187,TCP,54,62995  >  443 [ACK] Seq=223322 Ack=76157 Win=509 Len=0
356,16.130089,172.20.40.110,151.101.130.187,TLSv1.2,2854,Application Data
357,16.1407102,172.20.40.110,151.101.130.187,TLSv1.2,2855,Application Data
358,16.1428069,151.101.130.187,172.20.40.110,TCP,60,443  >  62995 [ACK] Seq=76157 Ack=226122 Win=3033 Len=0
359,16.1452371,151.101.130.187,172.20.40.110,TLSv1.2,98,Application Data
360,16.1598471,151.101.130.187,172.20.40.110,TCP,60,443  >  62995 [ACK] Seq=76201 Ack=228923 Win=3044 Len=0
361,16.1611898,151.101.130.187,172.20.40.110,TLSv1.2,98,Application Data
362,16.1612685,172.20.40.110,151.101.130.187,TCP,54,62995  >  443 [ACK] Seq=228923 Ack=76245 Win=508 Len=0
363,16.5916583,172.20.40.110,151.101.130.187,TLSv1.2,2854,Application Data
364,16.6092174,151.101.130.187,172.20.40.110,TCP,60,443  >  62995 [ACK] Seq=76245 Ack=231723 Win=3055 Len=0
365,16.6228061,151.101.130.187,172.20.40.110,TLSv1.2,208,Application Data
366,16.6401759,172.20.40.110,151.101.130.187,TLSv1.2,2852,Application Data
367,16.6535365,151.101.130.187,172.20.40.110,TCP,208,"[TCP Spurious Retransmission] 443  >  62995 [PSH, ACK] Seq=76245 Ack=231723 Win=3055 Len=154"
368,16.6535914,172.20.40.110,151.101.130.187,TCP,66,[TCP Dup ACK 366#1] 62995  >  443 [ACK] Seq=234521 Ack=76399 Win=508 Len=0 SLE=76245 SRE=76399
369,16.6567161,151.101.130.187,172.20.40.110,TCP,60,443  >  62995 [ACK] Seq=76399 Ack=234521 Win=3066 Len=0
370,16.6599155,151.101.130.187,172.20.40.110,TLSv1.2,125,Application Data
371,16.6637731,172.20.40.110,151.101.130.187,TLSv1.2,2855,Application Data
372,16.6768206,151.101.130.187,172.20.40.110,TCP,60,443  >  62995 [ACK] Seq=76470 Ack=237322 Win=3076 Len=0
373,16.6802731,151.101.130.187,172.20.40.110,TLSv1.2,98,Application Data
374,16.7198387,151.101.130.187,172.20.40.110,TCP,98,"[TCP Retransmission] 443  >  62995 [PSH, ACK] Seq=76470 Ack=237322 Win=3076 Len=44"
375,16.7199048,172.20.40.110,151.101.130.187,TCP,66,62995  >  443 [ACK] Seq=237322 Ack=76514 Win=507 Len=0 SLE=76470 SRE=76514
376,16.9753221,172.20.40.110,151.101.130.187,TLSv1.2,2858,Application Data
377,16.9857444,151.101.130.187,172.20.40.110,TCP,60,443  >  62995 [ACK] Seq=76514 Ack=240126 Win=3087 Len=0
378,16.9895959,151.101.130.187,172.20.40.110,TLSv1.2,104,Application Data
379,17.0312304,151.101.130.187,172.20.40.110,TCP,104,"[TCP Retransmission] 443  >  62995 [PSH, ACK] Seq=76514 Ack=240126 Win=3087 Len=50"
380,17.0312802,172.20.40.110,151.101.130.187,TCP,66,62995  >  443 [ACK] Seq=240126 Ack=76564 Win=507 Len=0 SLE=76514 SRE=76564
381,19.3262866,172.20.40.110,151.101.130.187,TLSv1.2,2626,Application Data
382,19.3391228,151.101.130.187,172.20.40.110,TCP,60,443  >  62995 [ACK] Seq=76564 Ack=242698 Win=3097 Len=0
383,19.3968218,151.101.130.187,172.20.40.110,TLSv1.2,339,Application Data
384,19.3968218,151.101.130.187,172.20.40.110,TLSv1.2,357,Application Data
385,19.3969254,172.20.40.110,151.101.130.187,TCP,54,62995  >  443 [ACK] Seq=242698 Ack=77152 Win=512 Len=0
386,19.3986136,172.20.40.110,151.101.130.187,TLSv1.2,89,Application Data
387,19.4068417,151.101.130.187,172.20.40.110,TCP,60,443  >  62995 [ACK] Seq=77152 Ack=242733 Win=3097 Len=0
388,19.5252361,172.20.40.110,151.101.130.187,TLSv1.2,2854,Application Data
389,19.52848,172.20.40.110,151.101.130.187,TLSv1.2,2852,Application Data
390,19.5520681,172.20.40.110,151.101.130.187,TLSv1.2,2855,Application Data
391,19.5712055,172.20.40.110,151.101.130.187,TCP,1434,"[TCP Retransmission] 62995  >  443 [PSH, ACK] Seq=249752 Ack=77152 Win=512 Len=1380"
392,19.5816214,151.101.130.187,172.20.40.110,TCP,60,443  >  62995 [ACK] Seq=77152 Ack=244113 Win=3103 Len=0
393,19.5816214,151.101.130.187,172.20.40.110,TCP,60,443  >  62995 [ACK] Seq=77152 Ack=245533 Win=3109 Len=0
394,19.5816214,151.101.130.187,172.20.40.110,TCP,60,443  >  62995 [ACK] Seq=77152 Ack=248331 Win=3120 Len=0
395,19.5816214,151.101.130.187,172.20.40.110,TLSv1.2,104,Application Data
396,19.5816214,151.101.130.187,172.20.40.110,TLSv1.2,131,Application Data
397,19.5816214,151.101.130.187,172.20.40.110,TCP,60,443  >  62995 [ACK] Seq=77279 Ack=251132 Win=3131 Len=0
398,19.5816214,151.101.130.187,172.20.40.110,TLSv1.2,125,Application Data
399,19.5816214,151.101.130.187,172.20.40.110,TCP,66,[TCP Dup ACK 397#1] 443  >  62995 [ACK] Seq=77350 Ack=251132 Win=3131 Len=0 SLE=249752 SRE=251132
400,19.5817346,172.20.40.110,151.101.130.187,TCP,54,62995  >  443 [ACK] Seq=251132 Ack=77350 Win=511 Len=0
401,19.9117449,172.20.40.110,151.101.130.187,TLSv1.2,2854,Application Data
402,19.9225504,151.101.130.187,172.20.40.110,TCP,60,443  >  62995 [ACK] Seq=77350 Ack=253932 Win=3142 Len=0
403,19.9262262,151.101.130.187,172.20.40.110,TLSv1.2,104,Application Data
404,19.9465823,172.20.40.110,151.101.130.187,TLSv1.2,2853,Application Data
405,19.9575698,151.101.130.187,172.20.40.110,TCP,60,443  >  62995 [ACK] Seq=77400 Ack=256731 Win=3152 Len=0
406,19.9600697,151.101.130.187,172.20.40.110,TLSv1.2,124,Application Data
407,20.0015418,172.20.40.110,151.101.130.187,TCP,54,62995  >  443 [ACK] Seq=256731 Ack=77470 Win=510 Len=0
408,20.0058161,151.101.130.187,172.20.40.110,TCP,124,"[TCP Spurious Retransmission] 443  >  62995 [PSH, ACK] Seq=77400 Ack=256731 Win=3152 Len=70"
409,20.0059055,172.20.40.110,151.101.130.187,TCP,66,[TCP Dup ACK 407#1] 62995  >  443 [ACK] Seq=256731 Ack=77470 Win=510 Len=0 SLE=77400 SRE=77470
410,20.4330078,172.20.40.110,151.101.130.187,TLSv1.2,2584,Application Data
411,20.4446523,151.101.130.187,172.20.40.110,TCP,60,443  >  62995 [ACK] Seq=77470 Ack=259261 Win=3162 Len=0
412,20.5160362,151.101.130.187,172.20.40.110,TLSv1.2,512,Application Data
413,20.5160362,151.101.130.187,172.20.40.110,TLSv1.2,97,Application Data
414,20.5160362,151.101.130.187,172.20.40.110,TLSv1.2,762,"Application Data, Application Data"
415,20.5160362,151.101.130.187,172.20.40.110,TCP,1434,443  >  62995 [ACK] Seq=78679 Ack=259261 Win=3162 Len=1380 [TCP PDU reassembled in 416]
416,20.5160362,151.101.130.187,172.20.40.110,TLSv1.2,76,Application Data
417,20.5160362,151.101.130.187,172.20.40.110,TLSv1.2,293,"Application Data, Application Data, Application Data, Application Data, Application Data, Application Data, Application Data"
418,20.5160362,151.101.130.187,172.20.40.110,TLSv1.2,721,Application Data
419,20.5160362,151.101.130.187,172.20.40.110,TLSv1.2,85,Application Data
420,20.5161358,172.20.40.110,151.101.130.187,TCP,54,62995  >  443 [ACK] Seq=259261 Ack=81018 Win=512 Len=0
421,21.2764107,172.20.40.110,151.101.130.187,TLSv1.2,2854,Application Data
422,21.2795082,172.20.40.110,151.101.130.187,TLSv1.2,2855,Application Data
423,21.2871572,151.101.130.187,172.20.40.110,TCP,60,443  >  62995 [ACK] Seq=81018 Ack=262061 Win=3173 Len=0
424,21.291454,172.20.40.110,151.101.130.187,TLSv1.2,2844,Application Data
425,21.2972159,151.101.130.187,172.20.40.110,TLSv1.2,413,Application Data
426,21.2972159,151.101.130.187,172.20.40.110,TCP,60,443  >  62995 [ACK] Seq=81377 Ack=264862 Win=3184 Len=0
427,21.2972159,151.101.130.187,172.20.40.110,TLSv1.2,104,Application Data
428,21.2973077,172.20.40.110,151.101.130.187,TCP,54,62995  >  443 [ACK] Seq=267652 Ack=81427 Win=510 Len=0
429,21.3022995,151.101.130.187,172.20.40.110,TCP,60,443  >  62995 [ACK] Seq=81427 Ack=267652 Win=3195 Len=0
430,21.3115972,151.101.130.187,172.20.40.110,TLSv1.2,130,Application Data
431,21.3338121,172.20.40.110,151.101.130.187,TLSv1.2,2838,Application Data
432,21.3340178,172.20.40.110,151.101.130.187,TLSv1.2,2839,Application Data
433,21.3463819,151.101.130.187,172.20.40.110,TCP,60,443  >  62995 [ACK] Seq=81503 Ack=270436 Win=3206 Len=0
434,21.3484872,151.101.130.187,172.20.40.110,TLSv1.2,130,Application Data
435,21.3484872,151.101.130.187,172.20.40.110,TCP,60,443  >  62995 [ACK] Seq=81579 Ack=273221 Win=3217 Len=0
436,21.3506034,151.101.130.187,172.20.40.110,TLSv1.2,131,Application Data
437,21.3506865,172.20.40.110,151.101.130.187,TCP,54,62995  >  443 [ACK] Seq=273221 Ack=81656 Win=509 Len=0
438,30.2685403,172.20.40.110,151.101.130.187,TLSv1.2,2866,Application Data
439,30.2829759,151.101.130.187,172.20.40.110,TCP,60,443  >  62995 [ACK] Seq=81656 Ack=276033 Win=3228 Len=0
440,30.2882198,151.101.130.187,172.20.40.110,TLSv1.2,241,Application Data
441,30.3333629,151.101.130.187,172.20.40.110,TCP,241,"[TCP Retransmission] 443  >  62995 [PSH, ACK] Seq=81656 Ack=276033 Win=3228 Len=187"
442,30.3334176,172.20.40.110,151.101.130.187,TCP,66,62995  >  443 [ACK] Seq=276033 Ack=81843 Win=508 Len=0 SLE=81656 SRE=81843
443,30.438034,172.20.40.110,151.101.130.187,TLSv1.2,2879,Application Data
444,30.4513123,172.20.40.110,151.101.130.187,TLSv1.2,2864,Application Data
445,30.4515977,172.20.40.110,151.101.130.187,TLSv1.2,2870,Application Data
446,30.4550546,151.101.130.187,172.20.40.110,TCP,60,443  >  62995 [ACK] Seq=81843 Ack=278858 Win=3239 Len=0
447,30.4550546,151.101.130.187,172.20.40.110,TLSv1.2,136,Application Data
448,30.465455,151.101.130.187,172.20.40.110,TCP,60,443  >  62995 [ACK] Seq=81925 Ack=281668 Win=3250 Len=0
449,30.465455,151.101.130.187,172.20.40.110,TCP,60,443  >  62995 [ACK] Seq=81925 Ack=284484 Win=3261 Len=0
450,30.4699934,151.101.130.187,172.20.40.110,TLSv1.2,130,Application Data
451,30.4699934,151.101.130.187,172.20.40.110,TLSv1.2,130,Application Data
452,30.4700981,172.20.40.110,151.101.130.187,TCP,54,62995  >  443 [ACK] Seq=284484 Ack=82077 Win=507 Len=0
453,30.4977418,172.20.40.110,151.101.130.187,TLSv1.2,2864,Application Data
454,30.5063996,151.101.130.187,172.20.40.110,TCP,60,443  >  62995 [ACK] Seq=82077 Ack=287294 Win=3272 Len=0
455,30.5139134,151.101.130.187,172.20.40.110,TLSv1.2,130,Application Data
456,30.5549963,151.101.130.187,172.20.40.110,TCP,130,"[TCP Retransmission] 443  >  62995 [PSH, ACK] Seq=82077 Ack=287294 Win=3272 Len=76"
457,30.5550565,172.20.40.110,151.101.130.187,TCP,66,62995  >  443 [ACK] Seq=287294 Ack=82153 Win=507 Len=0 SLE=82077 SRE=82153
458,30.623998,172.20.40.110,151.101.130.187,TLSv1.2,2866,Application Data
459,30.6347116,151.101.130.187,172.20.40.110,TCP,60,443  >  62995 [ACK] Seq=82153 Ack=290106 Win=3283 Len=0
460,30.6359949,151.101.130.187,172.20.40.110,TLSv1.2,98,Application Data
461,30.6558632,172.20.40.110,151.101.130.187,TLSv1.2,2861,Application Data
462,30.6669401,172.20.40.110,151.101.130.187,TLSv1.2,2878,Application Data
463,30.6672369,151.101.130.187,172.20.40.110,TCP,60,443  >  62995 [ACK] Seq=82197 Ack=292913 Win=3294 Len=0
464,30.6708056,151.101.130.187,172.20.40.110,TLSv1.2,137,Application Data
465,30.6762956,151.101.130.187,172.20.40.110,TCP,60,443  >  62995 [ACK] Seq=82280 Ack=295737 Win=3305 Len=0
466,30.678634,151.101.130.187,172.20.40.110,TLSv1.2,130,Application Data
467,30.6787348,172.20.40.110,151.101.130.187,TCP,54,62995  >  443 [ACK] Seq=295737 Ack=82356 Win=506 Len=0
468,30.7104696,172.20.40.110,151.101.130.187,TLSv1.2,2878,Application Data
469,30.7235492,151.101.130.187,172.20.40.110,TCP,60,443  >  62995 [ACK] Seq=82356 Ack=298561 Win=3316 Len=0
470,30.7247337,151.101.130.187,172.20.40.110,TLSv1.2,330,Application Data
471,30.7702807,172.20.40.110,151.101.130.187,TCP,54,62995  >  443 [ACK] Seq=298561 Ack=82632 Win=512 Len=0
472,30.7717492,151.101.130.187,172.20.40.110,TCP,330,"[TCP Spurious Retransmission] 443  >  62995 [PSH, ACK] Seq=82356 Ack=298561 Win=3316 Len=276"
473,30.771814,172.20.40.110,151.101.130.187,TCP,66,[TCP Dup ACK 471#1] 62995  >  443 [ACK] Seq=298561 Ack=82632 Win=512 Len=0 SLE=82356 SRE=82632
474,30.9009507,172.20.40.110,151.101.130.187,TLSv1.2,2869,Application Data
475,30.9013524,172.20.40.110,151.101.130.187,TLSv1.2,2864,Application Data
476,30.9044959,172.20.40.110,151.101.130.187,TLSv1.2,2865,Application Data
477,30.9048552,172.20.40.110,151.101.130.187,TLSv1.2,2867,Application Data
478,30.9051535,172.20.40.110,151.101.130.187,TLSv1.2,2866,Application Data
479,30.905992,172.20.40.110,151.101.130.187,TLSv1.2,2863,Application Data
480,30.9144135,151.101.130.187,172.20.40.110,TCP,60,443  >  62995 [ACK] Seq=82632 Ack=301376 Win=3327 Len=0
481,30.9144135,151.101.130.187,172.20.40.110,TCP,60,443  >  62995 [ACK] Seq=82632 Ack=304186 Win=3338 Len=0
482,30.9168182,151.101.130.187,172.20.40.110,TLSv1.2,130,Application Data
483,30.9168182,151.101.130.187,172.20.40.110,TLSv1.2,130,Application Data
484,30.9169203,172.20.40.110,151.101.130.187,TCP,54,62995  >  443 [ACK] Seq=315431 Ack=82784 Win=511 Len=0
485,30.9229153,151.101.130.187,172.20.40.110,TCP,60,443  >  62995 [ACK] Seq=82784 Ack=306997 Win=3349 Len=0
486,30.9229153,151.101.130.187,172.20.40.110,TCP,60,443  >  62995 [ACK] Seq=82784 Ack=309810 Win=3360 Len=0
487,30.9229153,151.101.130.187,172.20.40.110,TCP,60,443  >  62995 [ACK] Seq=82784 Ack=312622 Win=3371 Len=0
488,30.9229153,151.101.130.187,172.20.40.110,TLSv1.2,178,Application Data
489,30.9229153,151.101.130.187,172.20.40.110,TLSv1.2,240,Application Data
490,30.9230326,172.20.40.110,151.101.130.187,TCP,54,62995  >  443 [ACK] Seq=315431 Ack=83094 Win=510 Len=0
491,30.9277412,151.101.130.187,172.20.40.110,TCP,60,443  >  62995 [ACK] Seq=83094 Ack=315431 Win=3382 Len=0
492,30.9333944,151.101.130.187,172.20.40.110,TLSv1.2,135,Application Data
493,30.9734561,151.101.130.187,172.20.40.110,TCP,135,"[TCP Retransmission] 443  >  62995 [PSH, ACK] Seq=83094 Ack=315431 Win=3382 Len=81"
494,30.9735446,172.20.40.110,151.101.130.187,TCP,66,62995  >  443 [ACK] Seq=315431 Ack=83175 Win=509 Len=0 SLE=83094 SRE=83175
495,31.0919698,172.20.40.110,151.101.130.187,TLSv1.2,2901,Application Data
496,31.1042891,151.101.130.187,172.20.40.110,TCP,60,443  >  62995 [ACK] Seq=83175 Ack=318278 Win=3394 Len=0
497,31.1089924,151.101.130.187,172.20.40.110,TLSv1.2,130,Application Data
498,31.1512507,172.20.40.110,151.101.130.187,TCP,54,62995  >  443 [ACK] Seq=318278 Ack=83251 Win=509 Len=0
499,31.1514518,151.101.130.187,172.20.40.110,TCP,130,"[TCP Spurious Retransmission] 443  >  62995 [PSH, ACK] Seq=83175 Ack=318278 Win=3394 Len=76"
500,31.1515214,172.20.40.110,151.101.130.187,TCP,66,[TCP Dup ACK 498#1] 62995  >  443 [ACK] Seq=318278 Ack=83251 Win=509 Len=0 SLE=83175 SRE=83251
501,37.9362195,172.20.40.110,151.101.130.187,TLSv1.2,2921,Application Data
502,37.9509237,151.101.130.187,172.20.40.110,TCP,60,443  >  62995 [ACK] Seq=83251 Ack=321145 Win=3405 Len=0
503,37.9526965,151.101.130.187,172.20.40.110,TLSv1.2,214,Application Data
504,37.9580608,172.20.40.110,151.101.130.187,TLSv1.2,2922,Application Data
505,37.9829136,151.101.130.187,172.20.40.110,TCP,60,443  >  62995 [ACK] Seq=83411 Ack=324013 Win=3416 Len=0
506,37.9849159,151.101.130.187,172.20.40.110,TLSv1.2,131,Application Data
507,38.0288553,151.101.130.187,172.20.40.110,TCP,131,"[TCP Retransmission] 443  >  62995 [PSH, ACK] Seq=83411 Ack=324013 Win=3416 Len=77"
508,38.0290296,172.20.40.110,151.101.130.187,TCP,66,62995  >  443 [ACK] Seq=324013 Ack=83488 Win=508 Len=0 SLE=83411 SRE=83488
509,39.4805927,172.20.40.110,151.101.2.187,TLSv1.2,248,Ignored Unknown Record
510,39.4806681,172.20.40.110,151.101.2.187,TLSv1.2,93,Application Data
511,39.4904763,151.101.2.187,172.20.40.110,TCP,60,443  >  54874 [ACK] Seq=1 Ack=196 Win=282 Len=0
512,39.4904763,151.101.2.187,172.20.40.110,TCP,60,443  >  54874 [ACK] Seq=1 Ack=235 Win=282 Len=0
513,39.4904763,151.101.2.187,172.20.40.110,TLSv1.2,93,Application Data
514,39.5140836,151.101.2.187,172.20.40.110,TCP,93,"[TCP Retransmission] 443  >  54874 [PSH, ACK] Seq=1 Ack=235 Win=282 Len=39"
515,39.514159,172.20.40.110,151.101.2.187,TCP,66,54874  >  443 [ACK] Seq=235 Ack=40 Win=256 Len=0 SLE=1 SRE=40
516,39.5402993,151.101.2.187,172.20.40.110,TLSv1.2,296,Application Data
517,39.5402993,151.101.2.187,172.20.40.110,TLSv1.2,914,Application Data
518,39.5402993,151.101.2.187,172.20.40.110,TLSv1.2,1083,Application Data
519,39.5404586,172.20.40.110,151.101.2.187,TCP,54,54874  >  443 [ACK] Seq=235 Ack=2171 Win=258 Len=0
520,39.5420876,172.20.40.110,151.101.2.187,TLSv1.2,89,Application Data
521,39.5520998,151.101.2.187,172.20.40.110,TCP,60,443  >  54874 [ACK] Seq=2171 Ack=270 Win=282 Len=0
522,47.045249,172.20.40.110,151.101.130.187,TLSv1.2,2907,Application Data
523,47.0549421,151.101.130.187,172.20.40.110,TCP,60,443  >  62995 [ACK] Seq=83488 Ack=326866 Win=3427 Len=0
524,47.0597261,151.101.130.187,172.20.40.110,TLSv1.2,246,Application Data
525,47.103881,151.101.130.187,172.20.40.110,TCP,246,"[TCP Retransmission] 443  >  62995 [PSH, ACK] Seq=83488 Ack=326866 Win=3427 Len=192"
526,47.1039396,172.20.40.110,151.101.130.187,TCP,66,62995  >  443 [ACK] Seq=326866 Ack=83680 Win=508 Len=0 SLE=83488 SRE=83680
527,47.1798817,172.20.40.110,151.101.130.187,TLSv1.2,2910,Application Data
528,47.2075821,172.20.40.110,151.101.130.187,TLSv1.2,2912,Application Data
529,47.2149595,172.20.40.110,151.101.130.187,TCP,1434,"[TCP Retransmission] 62995  >  443 [PSH, ACK] Seq=331200 Ack=83680 Win=508 Len=1380"
530,47.2450553,151.101.130.187,172.20.40.110,TCP,60,443  >  62995 [ACK] Seq=83680 Ack=329722 Win=3439 Len=0
531,47.2450553,151.101.130.187,172.20.40.110,TLSv1.2,439,Application Data
532,47.2456506,172.20.40.110,151.101.130.187,TCP,54,62995  >  443 [ACK] Seq=332580 Ack=84065 Win=512 Len=0
533,47.2692363,151.101.130.187,172.20.40.110,TCP,60,443  >  62995 [ACK] Seq=84065 Ack=331102 Win=3444 Len=0
534,47.2780857,151.101.130.187,172.20.40.110,TCP,60,443  >  62995 [ACK] Seq=84065 Ack=332580 Win=3450 Len=0
535,47.2780857,151.101.130.187,172.20.40.110,TCP,66,[TCP Dup ACK 534#1] 443  >  62995 [ACK] Seq=84065 Ack=332580 Win=3450 Len=0 SLE=331200 SRE=332580
536,47.2780857,151.101.130.187,172.20.40.110,TCP,439,"[TCP Spurious Retransmission] 443  >  62995 [PSH, ACK] Seq=83680 Ack=332580 Win=3450 Len=385"
537,47.2780857,151.101.130.187,172.20.40.110,TLSv1.2,130,Application Data
538,47.278281,172.20.40.110,151.101.130.187,TCP,66,[TCP Dup ACK 532#1] 62995  >  443 [ACK] Seq=332580 Ack=84065 Win=512 Len=0 SLE=83680 SRE=84065
539,47.2783972,172.20.40.110,151.101.130.187,TCP,54,62995  >  443 [ACK] Seq=332580 Ack=84141 Win=511 Len=0
540,49.8450858,172.20.40.110,151.101.130.187,TLSv1.2,2921,Application Data
541,49.8559453,151.101.130.187,172.20.40.110,TCP,60,443  >  62995 [ACK] Seq=84141 Ack=335447 Win=3461 Len=0
542,49.8594239,151.101.130.187,172.20.40.110,TLSv1.2,241,Application Data
543,49.8709736,172.20.40.110,151.101.130.187,TLSv1.2,2919,Application Data
544,49.87944,151.101.130.187,172.20.40.110,TCP,60,443  >  62995 [ACK] Seq=84328 Ack=338312 Win=3472 Len=0
545,49.8816468,151.101.130.187,172.20.40.110,TLSv1.2,131,Application Data
546,49.927723,172.20.40.110,151.101.130.187,TLSv1.2,2922,Application Data
547,49.9340154,151.101.130.187,172.20.40.110,TCP,131,"[TCP Spurious Retransmission] 443  >  62995 [PSH, ACK] Seq=84328 Ack=338312 Win=3472 Len=77"
548,49.9340801,172.20.40.110,151.101.130.187,TCP,66,[TCP Dup ACK 546#1] 62995  >  443 [ACK] Seq=341180 Ack=84405 Win=510 Len=0 SLE=84328 SRE=84405
549,49.9406976,151.101.130.187,172.20.40.110,TCP,60,443  >  62995 [ACK] Seq=84405 Ack=341180 Win=3484 Len=0
550,49.942766,151.101.130.187,172.20.40.110,TLSv1.2,104,Application Data
551,49.9826815,172.20.40.110,151.101.130.187,TCP,54,62995  >  443 [ACK] Seq=341180 Ack=84455 Win=510 Len=0
552,50.157128,172.20.40.110,151.101.130.187,TLSv1.2,2921,Application Data
553,50.2139593,151.101.130.187,172.20.40.110,TCP,60,443  >  62995 [ACK] Seq=84455 Ack=344047 Win=3495 Len=0
554,50.2139593,151.101.130.187,172.20.40.110,TLSv1.2,109,Application Data
555,50.2333216,151.101.130.187,172.20.40.110,TCP,109,"[TCP Retransmission] 443  >  62995 [PSH, ACK] Seq=84455 Ack=344047 Win=3495 Len=55"
556,50.2333817,172.20.40.110,151.101.130.187,TCP,66,62995  >  443 [ACK] Seq=344047 Ack=84510 Win=510 Len=0 SLE=84455 SRE=84510
557,50.2373554,172.20.40.110,151.101.130.187,TLSv1.2,2900,Application Data
558,50.2475794,151.101.130.187,172.20.40.110,TCP,60,443  >  62995 [ACK] Seq=84510 Ack=346893 Win=3506 Len=0
559,50.2487172,151.101.130.187,172.20.40.110,TLSv1.2,234,Application Data
560,50.2994506,172.20.40.110,151.101.130.187,TCP,54,62995  >  443 [ACK] Seq=346893 Ack=84690 Win=509 Len=0
561,50.3254031,151.101.130.187,172.20.40.110,TCP,234,"[TCP Spurious Retransmission] 443  >  62995 [PSH, ACK] Seq=84510 Ack=346893 Win=3506 Len=180"
562,50.3255064,172.20.40.110,151.101.130.187,TCP,66,[TCP Dup ACK 560#1] 62995  >  443 [ACK] Seq=346893 Ack=84690 Win=509 Len=0 SLE=84510 SRE=84690
563,50.4987381,172.20.40.110,151.101.130.187,TLSv1.2,2921,Application Data
564,50.5092535,151.101.130.187,172.20.40.110,TCP,60,443  >  62995 [ACK] Seq=84690 Ack=349760 Win=3517 Len=0
565,50.5114453,151.101.130.187,172.20.40.110,TLSv1.2,98,Application Data
566,50.5417639,172.20.40.110,151.101.130.187,TLSv1.2,2919,Application Data
567,50.5532865,151.101.130.187,172.20.40.110,TCP,60,443  >  62995 [ACK] Seq=84734 Ack=352625 Win=3529 Len=0
568,50.5555493,151.101.130.187,172.20.40.110,TLSv1.2,98,Application Data
569,50.5706627,172.20.40.110,151.101.130.187,TLSv1.2,2922,Application Data
570,50.5795496,151.101.130.187,172.20.40.110,TCP,60,443  >  62995 [ACK] Seq=84778 Ack=355493 Win=3540 Len=0
571,50.5851759,151.101.130.187,172.20.40.110,TLSv1.2,98,Application Data
572,50.6248855,172.20.40.110,151.101.130.187,TCP,54,62995  >  443 [ACK] Seq=355493 Ack=84822 Win=509 Len=0
573,50.9344453,172.20.40.110,151.101.130.187,TLSv1.2,2925,Application Data
574,50.9511629,151.101.130.187,172.20.40.110,TCP,60,443  >  62995 [ACK] Seq=84822 Ack=358364 Win=3551 Len=0
575,50.9545806,151.101.130.187,172.20.40.110,TLSv1.2,130,Application Data
576,50.9973388,172.20.40.110,151.101.130.187,TCP,54,62995  >  443 [ACK] Seq=358364 Ack=84898 Win=508 Len=0
577,51.9333446,172.20.40.110,151.101.130.187,TLSv1.2,2921,Application Data
578,51.9335908,172.20.40.110,151.101.130.187,TLSv1.2,2922,Application Data
579,51.9566802,151.101.130.187,172.20.40.110,TCP,60,443  >  62995 [ACK] Seq=84898 Ack=361231 Win=3562 Len=0
580,51.9566802,151.101.130.187,172.20.40.110,TCP,60,443  >  62995 [ACK] Seq=84898 Ack=364099 Win=3573 Len=0
581,51.9628566,151.101.130.187,172.20.40.110,TLSv1.2,275,Application Data
582,52.0106335,172.20.40.110,151.101.130.187,TCP,54,62995  >  443 [ACK] Seq=364099 Ack=85119 Win=507 Len=0
583,52.0270219,172.20.40.110,151.101.130.187,TLSv1.2,2921,Application Data
584,52.0315985,172.20.40.110,151.101.130.187,TLSv1.2,2922,Application Data
585,52.049444,151.101.130.187,172.20.40.110,TCP,60,443  >  62995 [ACK] Seq=85119 Ack=366966 Win=3585 Len=0
586,52.049444,151.101.130.187,172.20.40.110,TCP,60,443  >  62995 [ACK] Seq=85119 Ack=369834 Win=3596 Len=0
587,52.050696,151.101.130.187,172.20.40.110,TLSv1.2,142,"Application Data, Application Data"
588,52.0507794,172.20.40.110,151.101.130.187,TCP,54,62995  >  443 [ACK] Seq=369834 Ack=85207 Win=507 Len=0
589,54.901131,172.20.40.110,151.101.130.187,TLSv1.2,2913,Application Data
590,54.9065795,172.20.40.110,151.101.130.187,TLSv1.2,2904,Application Data
591,54.9088489,172.20.40.110,151.101.130.187,TLSv1.2,2898,Application Data
592,54.9146663,151.101.130.187,172.20.40.110,TCP,60,443  >  62995 [ACK] Seq=85207 Ack=372693 Win=3607 Len=0
593,54.9156873,151.101.130.187,172.20.40.110,TLSv1.2,214,Application Data
594,54.9170212,151.101.130.187,172.20.40.110,TCP,60,443  >  62995 [ACK] Seq=85367 Ack=375543 Win=3618 Len=0
595,54.9225469,151.101.130.187,172.20.40.110,TLSv1.2,329,Application Data
596,54.9225469,151.101.130.187,172.20.40.110,TCP,60,443  >  62995 [ACK] Seq=85642 Ack=378387 Win=3630 Len=0
597,54.922638,172.20.40.110,151.101.130.187,TCP,54,62995  >  443 [ACK] Seq=378387 Ack=85642 Win=512 Len=0
598,54.9235191,151.101.130.187,172.20.40.110,TLSv1.2,131,Application Data
599,54.9627656,172.20.40.110,151.101.130.187,TLSv1.2,2898,Application Data
600,54.9736019,151.101.130.187,172.20.40.110,TCP,60,443  >  62995 [ACK] Seq=85719 Ack=381231 Win=3641 Len=0
601,54.9770908,151.101.130.187,172.20.40.110,TLSv1.2,130,Application Data
602,55.0200983,172.20.40.110,151.101.130.187,TCP,54,62995  >  443 [ACK] Seq=381231 Ack=85795 Win=511 Len=0
603,55.0479416,172.20.40.110,151.101.130.187,TLSv1.2,2900,Application Data
604,55.0567235,151.101.130.187,172.20.40.110,TCP,60,443  >  62995 [ACK] Seq=85795 Ack=384077 Win=3652 Len=0
605,55.0591429,151.101.130.187,172.20.40.110,TLSv1.2,131,Application Data
606,55.0850291,172.20.40.110,151.101.130.187,TLSv1.2,2895,Application Data
607,55.09551,151.101.130.187,172.20.40.110,TCP,60,443  >  62995 [ACK] Seq=85872 Ack=386918 Win=3663 Len=0
608,55.0975902,172.20.40.110,151.101.130.187,TLSv1.2,2912,Application Data
609,55.1015258,151.101.130.187,172.20.40.110,TLSv1.2,131,Application Data
610,55.1092592,151.101.130.187,172.20.40.110,TCP,60,443  >  62995 [ACK] Seq=85949 Ack=389776 Win=3674 Len=0
611,55.1103789,151.101.130.187,172.20.40.110,TLSv1.2,135,Application Data
612,55.1104625,172.20.40.110,151.101.130.187,TCP,54,62995  >  443 [ACK] Seq=389776 Ack=86030 Win=510 Len=0
613,55.1334853,172.20.40.110,151.101.130.187,TLSv1.2,2912,Application Data
614,55.1433665,151.101.130.187,172.20.40.110,TCP,60,443  >  62995 [ACK] Seq=86030 Ack=392634 Win=3685 Len=0
615,55.1447227,151.101.130.187,172.20.40.110,TLSv1.2,131,Application Data
616,55.1869367,172.20.40.110,151.101.130.187,TCP,54,62995  >  443 [ACK] Seq=392634 Ack=86107 Win=510 Len=0
617,55.4354688,172.20.40.110,151.101.130.187,TLSv1.2,2911,Application Data
618,55.438994,172.20.40.110,151.101.130.187,TLSv1.2,2906,Application Data
619,55.4403079,172.20.40.110,151.101.130.187,TLSv1.2,2907,Application Data
620,55.4435876,172.20.40.110,151.101.130.187,TLSv1.2,2909,Application Data
621,55.4439373,172.20.40.110,151.101.130.187,TLSv1.2,2908,Application Data
622,55.4449132,172.20.40.110,151.101.130.187,TLSv1.2,2905,Application Data
623,55.4707625,172.20.40.110,151.101.130.187,TCP,1434,"[TCP Retransmission] 62995  >  443 [PSH, ACK] Seq=408376 Ack=86107 Win=510 Len=1380"
624,55.5018049,151.101.130.187,172.20.40.110,TCP,60,443  >  62995 [ACK] Seq=86107 Ack=395491 Win=3696 Len=0
625,55.5018049,151.101.130.187,172.20.40.110,TLSv1.2,240,Application Data
626,55.5060811,151.101.130.187,172.20.40.110,TCP,60,443  >  62995 [ACK] Seq=86293 Ack=398343 Win=3708 Len=0
627,55.5060811,151.101.130.187,172.20.40.110,TLSv1.2,130,Application Data
628,55.506292,172.20.40.110,151.101.130.187,TCP,54,62995  >  443 [ACK] Seq=409756 Ack=86369 Win=509 Len=0
629,55.5173501,151.101.130.187,172.20.40.110,TCP,60,443  >  62995 [ACK] Seq=86369 Ack=401196 Win=3719 Len=0
630,55.5173501,151.101.130.187,172.20.40.110,TCP,60,443  >  62995 [ACK] Seq=86369 Ack=404051 Win=3730 Len=0
631,55.5173501,151.101.130.187,172.20.40.110,TCP,60,443  >  62995 [ACK] Seq=86369 Ack=406905 Win=3741 Len=0
632,55.5173501,151.101.130.187,172.20.40.110,TLSv1.2,136,Application Data
633,55.5173501,151.101.130.187,172.20.40.110,TLSv1.2,206,"Application Data, Application Data"
634,55.5173501,151.101.130.187,172.20.40.110,TCP,60,443  >  62995 [ACK] Seq=86603 Ack=408285 Win=3747 Len=0
635,55.5173501,151.101.130.187,172.20.40.110,TCP,60,443  >  62995 [ACK] Seq=86603 Ack=409756 Win=3753 Len=0
636,55.5174832,172.20.40.110,151.101.130.187,TCP,54,62995  >  443 [ACK] Seq=409756 Ack=86603 Win=508 Len=0
637,55.5196474,151.101.130.187,172.20.40.110,TCP,66,[TCP Dup ACK 635#1] 443  >  62995 [ACK] Seq=86603 Ack=409756 Win=3753 Len=0 SLE=408376 SRE=409756
638,55.5196474,151.101.130.187,172.20.40.110,TLSv1.2,329,Application Data
639,55.5198403,172.20.40.110,151.101.130.187,TCP,54,62995  >  443 [ACK] Seq=409756 Ack=86878 Win=507 Len=0
