"No.","Time","Source","Destination","Protocol","Length","Info"
"1","0.000000000","100.84.170.161","151.101.66.187","TCP","66","59747  >  443 [SYN] Seq=0 Win=64240 Len=0 MSS=1460 WS=256 SACK_PERM"
"2","0.012635100","151.101.66.187","100.84.170.161","TCP","66","443  >  59747 [SYN, ACK] Seq=0 Ack=1 Win=65535 Len=0 MSS=1460 SACK_PERM WS=512"
"3","0.012732100","100.84.170.161","151.101.66.187","TCP","54","59747  >  443 [ACK] Seq=1 Ack=1 Win=131328 Len=0"
"4","0.014814800","100.84.170.161","151.101.66.187","TLSv1.3","2033","Client Hello (SNI=www.target.com)"
"5","0.023390700","151.101.66.187","100.84.170.161","TCP","56","443  >  59747 [ACK] Seq=1 Ack=1980 Win=144384 Len=0"
"6","0.023695200","151.101.66.187","100.84.170.161","TLSv1.3","1510","Server Hello, Change Cipher Spec, Application Data, Application Data"
"7","0.024105100","151.101.66.187","100.84.170.161","TLSv1.3","139","Application Data"
"8","0.024136100","100.84.170.161","151.101.66.187","TCP","54","59747  >  443 [ACK] Seq=1980 Ack=1542 Win=131328 Len=0"
"9","0.024724100","100.84.170.161","151.101.66.187","TLSv1.3","118","Change Cipher Spec, Application Data"
"10","0.025392400","100.84.170.161","151.101.66.187","TLSv1.3","146","Application Data"
"11","0.025983500","100.84.170.161","151.101.66.187","TLSv1.3","2512","Application Data"
"12","0.033411200","151.101.66.187","100.84.170.161","TCP","56","443  >  59747 [ACK] Seq=1542 Ack=2044 Win=144384 Len=0"
"13","0.033854600","151.101.66.187","100.84.170.161","TLSv1.3","119","Application Data"
"14","0.034280400","100.84.170.161","151.101.66.187","TLSv1.3","85","Application Data"
"15","0.035128000","151.101.66.187","100.84.170.161","TCP","56","443  >  59747 [ACK] Seq=1607 Ack=4594 Win=142336 Len=0"
"16","0.037154000","151.101.66.187","100.84.170.161","TLSv1.3","451","Application Data"
"17","0.043105000","151.101.66.187","100.84.170.161","TCP","56","443  >  59747 [ACK] Seq=2004 Ack=4625 Win=142336 Len=0"
"18","0.069432900","151.101.66.187","100.84.170.161","TCP","451","[TCP Retransmission] 443  >  59747 [PSH, ACK] Seq=1607 Ack=4625 Win=142336 Len=397"
"19","0.069476600","100.84.170.161","151.101.66.187","TCP","66","59747  >  443 [ACK] Seq=4625 Ack=2004 Win=130816 Len=0 SLE=1607 SRE=2004"
"20","0.420285400","100.84.170.161","151.101.66.187","TLSv1.3","2513","Application Data"
"21","0.430634500","151.101.66.187","100.84.170.161","TCP","56","443  >  59747 [ACK] Seq=2004 Ack=7084 Win=140288 Len=0"
"22","0.432989000","151.101.66.187","100.84.170.161","TLSv1.3","131","Application Data"
"23","0.460361800","151.101.66.187","100.84.170.161","TCP","131","[TCP Retransmission] 443  >  59747 [PSH, ACK] Seq=2004 Ack=7084 Win=140288 Len=77"
"24","0.460403000","100.84.170.161","151.101.66.187","TCP","66","59747  >  443 [ACK] Seq=7084 Ack=2081 Win=130816 Len=0 SLE=2004 SRE=2081"
"25","2.803436900","100.84.170.161","151.101.66.187","TLSv1.3","2512","Application Data"
"26","2.812181500","151.101.66.187","100.84.170.161","TCP","56","443  >  59747 [ACK] Seq=2081 Ack=9542 Win=138240 Len=0"
"27","2.815201700","151.101.66.187","100.84.170.161","TLSv1.3","214","Application Data"
"28","2.841471500","151.101.66.187","100.84.170.161","TCP","214","[TCP Retransmission] 443  >  59747 [PSH, ACK] Seq=2081 Ack=9542 Win=138240 Len=160"
"29","2.841518300","100.84.170.161","151.101.66.187","TCP","66","59747  >  443 [ACK] Seq=9542 Ack=2241 Win=130560 Len=0 SLE=2081 SRE=2241"
"30","2.869623700","100.84.170.161","151.101.66.187","TLSv1.3","2513","Application Data"
"31","2.878577300","151.101.66.187","100.84.170.161","TCP","56","443  >  59747 [ACK] Seq=2241 Ack=12001 Win=136192 Len=0"
"32","2.881373500","151.101.66.187","100.84.170.161","TLSv1.3","98","Application Data"
"33","2.908478900","151.101.66.187","100.84.170.161","TCP","98","[TCP Retransmission] 443  >  59747 [PSH, ACK] Seq=2241 Ack=12001 Win=136192 Len=44"
"34","2.908528400","100.84.170.161","151.101.66.187","TCP","66","59747  >  443 [ACK] Seq=12001 Ack=2285 Win=130560 Len=0 SLE=2241 SRE=2285"
"35","7.888257200","100.84.170.161","151.101.66.187","TLSv1.3","2514","Application Data"
"36","7.897393900","151.101.66.187","100.84.170.161","TCP","56","443  >  59747 [ACK] Seq=2285 Ack=14461 Win=134144 Len=0"
"37","7.900599800","151.101.66.187","100.84.170.161","TLSv1.3","214","Application Data"
"38","7.908747700","100.84.170.161","151.101.66.187","TLSv1.3","2505","Application Data"
"39","7.913634000","100.84.170.161","151.101.66.187","TLSv1.3","2500","Application Data"
"40","7.913887800","100.84.170.161","151.101.66.187","TLSv1.3","2499","Application Data"
"41","7.917972400","151.101.66.187","100.84.170.161","TCP","56","443  >  59747 [ACK] Seq=2445 Ack=16912 Win=132096 Len=0"
"42","7.920781000","151.101.66.187","100.84.170.161","TLSv1.3","124","Application Data"
"43","7.922877700","151.101.66.187","100.84.170.161","TCP","56","443  >  59747 [ACK] Seq=2515 Ack=21803 Win=128000 Len=0"
"44","7.925500600","151.101.66.187","100.84.170.161","TLSv1.3","185","Application Data"
"45","7.925571700","100.84.170.161","151.101.66.187","TCP","54","59747  >  443 [ACK] Seq=21803 Ack=2646 Win=130048 Len=0"
"46","8.044215100","100.84.170.161","151.101.66.187","TLSv1.3","2513","Application Data"
"47","8.076095600","100.84.170.161","151.101.66.187","TCP","1514","[TCP Retransmission] 59747  >  443 [PSH, ACK] Seq=22802 Ack=2646 Win=130048 Len=1460"
"48","8.104368100","151.101.66.187","100.84.170.161","TCP","56","443  >  59747 [ACK] Seq=2646 Ack=24262 Win=125952 Len=0"
"49","8.104696700","151.101.66.187","100.84.170.161","TLSv1.3","98","Application Data"
"50","8.111451300","151.101.66.187","100.84.170.161","TCP","66","[TCP Dup ACK 48#1] 443  >  59747 [ACK] Seq=2690 Ack=24262 Win=125952 Len=0 SLE=22802 SRE=24262"
"51","8.130430000","151.101.66.187","100.84.170.161","TCP","98","[TCP Retransmission] 443  >  59747 [PSH, ACK] Seq=2646 Ack=24262 Win=125952 Len=44"
"52","8.130483600","100.84.170.161","151.101.66.187","TCP","66","59747  >  443 [ACK] Seq=24262 Ack=2690 Win=130048 Len=0 SLE=2646 SRE=2690"
"53","8.146524400","100.84.170.161","151.101.66.187","TLSv1.3","2496","Application Data"
"54","8.155914000","151.101.66.187","100.84.170.161","TCP","56","443  >  59747 [ACK] Seq=2690 Ack=26704 Win=123904 Len=0"
"55","8.158814300","151.101.66.187","100.84.170.161","TLSv1.3","125","Application Data"
"56","8.163894400","100.84.170.161","151.101.66.187","TLSv1.3","2513","Application Data"
"57","8.172851300","151.101.66.187","100.84.170.161","TCP","56","443  >  59747 [ACK] Seq=2761 Ack=29163 Win=121856 Len=0"
"58","8.175531800","151.101.66.187","100.84.170.161","TLSv1.3","130","Application Data"
"59","8.205447100","151.101.66.187","100.84.170.161","TCP","130","[TCP Retransmission] 443  >  59747 [PSH, ACK] Seq=2761 Ack=29163 Win=121856 Len=76"
"60","8.205497200","100.84.170.161","151.101.66.187","TCP","66","59747  >  443 [ACK] Seq=29163 Ack=2837 Win=130048 Len=0 SLE=2761 SRE=2837"
"61","8.582161300","100.84.170.161","151.101.66.187","TLSv1.3","2500","Application Data"
"62","8.585690400","100.84.170.161","151.101.66.187","TLSv1.3","2508","Application Data"
"63","8.593515700","151.101.66.187","100.84.170.161","TCP","56","443  >  59747 [ACK] Seq=2837 Ack=31609 Win=119808 Len=0"
"64","8.594862100","151.101.66.187","100.84.170.161","TCP","56","443  >  59747 [ACK] Seq=2837 Ack=34063 Win=117760 Len=0"
"65","8.595818000","151.101.66.187","100.84.170.161","TLSv1.3","124","Application Data"
"66","8.597285300","151.101.66.187","100.84.170.161","TLSv1.3","131","Application Data"
"67","8.597331000","100.84.170.161","151.101.66.187","TCP","54","59747  >  443 [ACK] Seq=34063 Ack=2984 Win=129792 Len=0"
"68","8.694859100","100.84.170.161","151.101.66.187","TLSv1.3","2518","Application Data"
"69","8.695162500","100.84.170.161","151.101.66.187","TLSv1.3","2514","Application Data"
"70","8.703849800","151.101.66.187","100.84.170.161","TCP","56","443  >  59747 [ACK] Seq=2984 Ack=36527 Win=115712 Len=0"
"71","8.704098600","151.101.66.187","100.84.170.161","TCP","56","443  >  59747 [ACK] Seq=2984 Ack=38987 Win=113664 Len=0"
"72","8.706719400","151.101.66.187","100.84.170.161","TLSv1.3","130","Application Data"
"73","8.706910500","151.101.66.187","100.84.170.161","TLSv1.3","169","Application Data"
"74","8.706948200","100.84.170.161","151.101.66.187","TCP","54","59747  >  443 [ACK] Seq=38987 Ack=3175 Win=131328 Len=0"
"75","9.407573200","100.84.170.161","151.101.66.187","TLSv1.3","2522","Application Data"
"76","9.409761800","100.84.170.161","151.101.66.187","TLSv1.3","2503","Application Data"
"77","9.409966500","100.84.170.161","151.101.66.187","TLSv1.3","2499","Application Data"
"78","9.410109900","100.84.170.161","151.101.66.187","TLSv1.3","2491","Application Data"
"79","9.411533200","100.84.170.161","151.101.66.187","TLSv1.3","2487","Application Data"
"80","9.412744200","100.84.170.161","151.101.66.187","TLSv1.3","2490","Application Data"
"81","9.417815200","151.101.66.187","100.84.170.161","TCP","56","443  >  59747 [ACK] Seq=3175 Ack=41455 Win=111616 Len=0"
"82","9.418313200","151.101.66.187","100.84.170.161","TCP","56","443  >  59747 [ACK] Seq=3175 Ack=43904 Win=109568 Len=0"
"83","9.419857400","151.101.66.187","100.84.170.161","TCP","56","443  >  59747 [ACK] Seq=3175 Ack=48786 Win=105472 Len=0"
"84","9.420552100","151.101.66.187","100.84.170.161","TCP","56","443  >  59747 [ACK] Seq=3175 Ack=51219 Win=103424 Len=0"
"85","9.422118100","151.101.66.187","100.84.170.161","TCP","56","443  >  59747 [ACK] Seq=3175 Ack=53655 Win=101376 Len=0"
"86","9.424863100","151.101.66.187","100.84.170.161","TLSv1.3","401","Application Data"
"87","9.425947700","151.101.66.187","100.84.170.161","TLSv1.3","130","Application Data"
"88","9.426030300","100.84.170.161","151.101.66.187","TCP","54","59747  >  443 [ACK] Seq=53655 Ack=3598 Win=130816 Len=0"
"89","9.427311600","151.101.66.187","100.84.170.161","TLSv1.3","178","Application Data"
"90","9.427311600","151.101.66.187","100.84.170.161","TLSv1.3","131","Application Data"
"91","9.427387600","100.84.170.161","151.101.66.187","TCP","54","59747  >  443 [ACK] Seq=53655 Ack=3799 Win=130560 Len=0"
"92","9.428197500","151.101.66.187","100.84.170.161","TLSv1.3","124","Application Data"
"93","9.464591700","151.101.66.187","100.84.170.161","TCP","124","[TCP Retransmission] 443  >  59747 [PSH, ACK] Seq=3799 Ack=53655 Win=101376 Len=70"
"94","9.464664900","100.84.170.161","151.101.66.187","TCP","66","59747  >  443 [ACK] Seq=53655 Ack=3869 Win=130560 Len=0 SLE=3799 SRE=3869"
"95","10.089774400","100.84.170.161","151.101.66.187","TLSv1.3","2538","Application Data"
"96","10.099766800","151.101.66.187","100.84.170.161","TCP","56","443  >  59747 [ACK] Seq=3869 Ack=56139 Win=99328 Len=0"
"97","10.103325300","151.101.66.187","100.84.170.161","TLSv1.3","241","Application Data"
"98","10.129342500","100.84.170.161","151.101.66.187","TLSv1.3","2539","Application Data"
"99","10.130653500","151.101.66.187","100.84.170.161","TCP","241","[TCP Spurious Retransmission] 443  >  59747 [PSH, ACK] Seq=3869 Ack=56139 Win=101376 Len=187"
"100","10.130682900","100.84.170.161","151.101.66.187","TCP","66","[TCP Dup ACK 98#1] 59747  >  443 [ACK] Seq=58624 Ack=4056 Win=130304 Len=0 SLE=3869 SRE=4056"
"101","10.138532300","151.101.66.187","100.84.170.161","TCP","56","443  >  59747 [ACK] Seq=4056 Ack=58624 Win=99328 Len=0"
"102","10.141317800","151.101.66.187","100.84.170.161","TLSv1.3","131","Application Data"
"103","10.168435800","151.101.66.187","100.84.170.161","TCP","131","[TCP Retransmission] 443  >  59747 [PSH, ACK] Seq=4056 Ack=58624 Win=101376 Len=77"
"104","10.168499100","100.84.170.161","151.101.66.187","TCP","66","59747  >  443 [ACK] Seq=58624 Ack=4133 Win=130304 Len=0 SLE=4056 SRE=4133"
"105","17.112347900","100.84.170.161","151.101.66.187","TLSv1.3","2538","Application Data"
"106","17.122104400","151.101.66.187","100.84.170.161","TCP","56","443  >  59747 [ACK] Seq=4133 Ack=61108 Win=99328 Len=0"
"107","17.127275800","151.101.66.187","100.84.170.161","TLSv1.3","214","Application Data"
"108","17.154263100","151.101.66.187","100.84.170.161","TCP","214","[TCP Retransmission] 443  >  59747 [PSH, ACK] Seq=4133 Ack=61108 Win=101376 Len=160"
"109","17.154323100","100.84.170.161","151.101.66.187","TCP","66","59747  >  443 [ACK] Seq=61108 Ack=4293 Win=130048 Len=0 SLE=4133 SRE=4293"
"110","17.338784300","100.84.170.161","151.101.66.187","TLSv1.3","2539","Application Data"
"111","17.349777200","151.101.66.187","100.84.170.161","TCP","56","443  >  59747 [ACK] Seq=4293 Ack=63593 Win=99328 Len=0"
"112","17.354325400","151.101.66.187","100.84.170.161","TLSv1.3","104","Application Data"
"113","17.381629700","151.101.66.187","100.84.170.161","TCP","104","[TCP Retransmission] 443  >  59747 [PSH, ACK] Seq=4293 Ack=63593 Win=101376 Len=50"
"114","17.381663200","100.84.170.161","151.101.66.187","TCP","66","59747  >  443 [ACK] Seq=63593 Ack=4343 Win=130048 Len=0 SLE=4293 SRE=4343"
"115","18.348876800","100.84.170.161","151.101.66.187","TLSv1.3","2538","Application Data"
"116","18.357513600","151.101.66.187","100.84.170.161","TCP","56","443  >  59747 [ACK] Seq=4343 Ack=66077 Win=99328 Len=0"
"117","18.360649500","151.101.66.187","100.84.170.161","TLSv1.3","214","Application Data"
"118","18.388362100","151.101.66.187","100.84.170.161","TCP","214","[TCP Retransmission] 443  >  59747 [PSH, ACK] Seq=4343 Ack=66077 Win=101376 Len=160"
"119","18.388412200","100.84.170.161","151.101.66.187","TCP","66","59747  >  443 [ACK] Seq=66077 Ack=4503 Win=130048 Len=0 SLE=4343 SRE=4503"
"120","18.410661400","100.84.170.161","151.101.66.187","TLSv1.3","2539","Application Data"
"121","18.420522500","151.101.66.187","100.84.170.161","TCP","56","443  >  59747 [ACK] Seq=4503 Ack=68562 Win=99328 Len=0"
"122","18.423967000","151.101.66.187","100.84.170.161","TLSv1.3","142","Application Data"
"123","18.451280200","151.101.66.187","100.84.170.161","TCP","142","[TCP Retransmission] 443  >  59747 [PSH, ACK] Seq=4503 Ack=68562 Win=101376 Len=88"
"124","18.451325500","100.84.170.161","151.101.66.187","TCP","66","59747  >  443 [ACK] Seq=68562 Ack=4591 Win=129792 Len=0 SLE=4503 SRE=4591"
"125","28.311057600","100.84.170.161","151.101.66.187","TLSv1.3","2536","Application Data"
"126","28.321273700","151.101.66.187","100.84.170.161","TCP","56","443  >  59747 [ACK] Seq=4591 Ack=71044 Win=99328 Len=0"
"127","28.324497000","151.101.66.187","100.84.170.161","TLSv1.3","214","Application Data"
"128","28.328825600","100.84.170.161","151.101.66.187","TLSv1.3","2527","Application Data"
"129","28.329109500","100.84.170.161","151.101.66.187","TLSv1.3","2522","Application Data"
"130","28.330272800","100.84.170.161","151.101.66.187","TLSv1.3","2521","Application Data"
"131","28.337630100","151.101.66.187","100.84.170.161","TCP","56","443  >  59747 [ACK] Seq=4751 Ack=73517 Win=99328 Len=0"
"132","28.337984500","151.101.66.187","100.84.170.161","TCP","56","443  >  59747 [ACK] Seq=4751 Ack=75985 Win=97280 Len=0"
"133","28.339354900","100.84.170.161","151.101.66.187","TLSv1.3","2521","Application Data"
"134","28.340730600","151.101.66.187","100.84.170.161","TCP","56","443  >  59747 [ACK] Seq=4751 Ack=78452 Win=99328 Len=0"
"135","28.342219800","151.101.66.187","100.84.170.161","TLSv1.3","296","Application Data"
"136","28.343872600","151.101.66.187","100.84.170.161","TLSv1.3","131","Application Data"
"137","28.343945500","100.84.170.161","151.101.66.187","TCP","54","59747  >  443 [ACK] Seq=80919 Ack=5070 Win=131072 Len=0"
"138","28.345538200","151.101.66.187","100.84.170.161","TLSv1.3","124","Application Data"
"139","28.348632000","151.101.66.187","100.84.170.161","TCP","56","443  >  59747 [ACK] Seq=5140 Ack=80919 Win=99328 Len=0"
"140","28.352518300","151.101.66.187","100.84.170.161","TLSv1.3","130","Application Data"
"141","28.352588900","100.84.170.161","151.101.66.187","TCP","54","59747  >  443 [ACK] Seq=80919 Ack=5216 Win=130816 Len=0"
"142","28.411720100","100.84.170.161","151.101.66.187","TLSv1.3","2521","Application Data"
"143","28.421298100","151.101.66.187","100.84.170.161","TCP","56","443  >  59747 [ACK] Seq=5216 Ack=83386 Win=99328 Len=0"
"144","28.423954000","151.101.66.187","100.84.170.161","TLSv1.3","124","Application Data"
"145","28.451335600","151.101.66.187","100.84.170.161","TCP","124","[TCP Retransmission] 443  >  59747 [PSH, ACK] Seq=5216 Ack=83386 Win=101376 Len=70"
"146","28.451385000","100.84.170.161","151.101.66.187","TCP","66","59747  >  443 [ACK] Seq=83386 Ack=5286 Win=130816 Len=0 SLE=5216 SRE=5286"
"147","28.480549900","100.84.170.161","151.101.66.187","TLSv1.3","2535","Application Data"
"148","28.489803900","151.101.66.187","100.84.170.161","TCP","56","443  >  59747 [ACK] Seq=5286 Ack=85867 Win=99328 Len=0"
"149","28.492586000","151.101.66.187","100.84.170.161","TLSv1.3","98","Application Data"
"150","28.521114600","151.101.66.187","100.84.170.161","TCP","98","[TCP Retransmission] 443  >  59747 [PSH, ACK] Seq=5286 Ack=85867 Win=101376 Len=44"
"151","28.521179600","100.84.170.161","151.101.66.187","TCP","66","59747  >  443 [ACK] Seq=85867 Ack=5330 Win=130816 Len=0 SLE=5286 SRE=5330"
"152","28.538880400","100.84.170.161","151.101.66.187","TLSv1.3","2518","Application Data"
"153","28.547531000","151.101.66.187","100.84.170.161","TCP","56","443  >  59747 [ACK] Seq=5330 Ack=88331 Win=99328 Len=0"
"154","28.550206200","100.84.170.161","151.101.66.187","TLSv1.3","2535","Application Data"
"155","28.550615800","151.101.66.187","100.84.170.161","TLSv1.3","125","Application Data"
"156","28.558941000","151.101.66.187","100.84.170.161","TCP","56","443  >  59747 [ACK] Seq=5401 Ack=90812 Win=99328 Len=0"
"157","28.563112400","151.101.66.187","100.84.170.161","TLSv1.3","124","Application Data"
"158","28.563188200","100.84.170.161","151.101.66.187","TCP","54","59747  >  443 [ACK] Seq=90812 Ack=5471 Win=130560 Len=0"
"159","28.729698100","100.84.170.161","151.101.66.187","TLSv1.3","2530","Application Data"
"160","28.738535800","151.101.66.187","100.84.170.161","TCP","56","443  >  59747 [ACK] Seq=5471 Ack=93288 Win=99328 Len=0"
"161","28.741265900","151.101.66.187","100.84.170.161","TLSv1.3","131","Application Data"
"162","28.770386700","151.101.66.187","100.84.170.161","TCP","131","[TCP Retransmission] 443  >  59747 [PSH, ACK] Seq=5471 Ack=93288 Win=101376 Len=77"
"163","28.770426800","100.84.170.161","151.101.66.187","TCP","66","59747  >  443 [ACK] Seq=93288 Ack=5548 Win=130560 Len=0 SLE=5471 SRE=5548"
"164","28.811594700","100.84.170.161","151.101.66.187","TLSv1.3","2536","Application Data"
"165","28.811918200","100.84.170.161","151.101.66.187","TLSv1.3","2540","Application Data"
"166","28.812139900","100.84.170.161","151.101.66.187","TLSv1.3","2532","Application Data"
"167","28.813168900","100.84.170.161","151.101.66.187","TLSv1.3","2524","Application Data"
"168","28.813867200","100.84.170.161","151.101.66.187","TLSv1.3","2523","Application Data"
"169","28.814035200","100.84.170.161","151.101.66.187","TLSv1.3","2520","Application Data"
"170","28.820734300","151.101.66.187","100.84.170.161","TCP","56","443  >  59747 [ACK] Seq=5548 Ack=98256 Win=99328 Len=0"
"171","28.821507100","151.101.66.187","100.84.170.161","TCP","56","443  >  59747 [ACK] Seq=5548 Ack=100734 Win=99328 Len=0"
"172","28.822321000","151.101.66.187","100.84.170.161","TCP","56","443  >  59747 [ACK] Seq=5548 Ack=103204 Win=99328 Len=0"
"173","28.823089300","151.101.66.187","100.84.170.161","TCP","56","443  >  59747 [ACK] Seq=5548 Ack=105673 Win=99328 Len=0"
"174","28.823447800","151.101.66.187","100.84.170.161","TCP","56","443  >  59747 [ACK] Seq=5548 Ack=108139 Win=99328 Len=0"
"175","28.826668500","151.101.66.187","100.84.170.161","TLSv1.3","241","Application Data"
"176","28.827226700","151.101.66.187","100.84.170.161","TLSv1.3","124","Application Data"
"177","28.827284400","100.84.170.161","151.101.66.187","TCP","54","59747  >  443 [ACK] Seq=108139 Ack=5805 Win=130304 Len=0"
"178","28.827527200","151.101.66.187","100.84.170.161","TLSv1.3","130","Application Data"
"179","28.828191300","151.101.66.187","100.84.170.161","TLSv1.3","124","Application Data"
"180","28.828241500","100.84.170.161","151.101.66.187","TCP","54","59747  >  443 [ACK] Seq=108139 Ack=5951 Win=130048 Len=0"
"181","28.828993800","151.101.66.187","100.84.170.161","TLSv1.3","130","Application Data"
"182","28.829312000","151.101.66.187","100.84.170.161","TLSv1.3","175","Application Data"
"183","28.829358700","100.84.170.161","151.101.66.187","TCP","54","59747  >  443 [ACK] Seq=108139 Ack=6148 Win=129792 Len=0"
"184","29.070579700","100.84.170.161","151.101.66.187","TLSv1.3","2518","Application Data"
"185","29.071998400","100.84.170.161","151.101.66.187","TLSv1.3","2544","Application Data"
"186","29.080516400","151.101.66.187","100.84.170.161","TCP","56","443  >  59747 [ACK] Seq=6148 Ack=110603 Win=99328 Len=0"
"187","29.081595900","151.101.66.187","100.84.170.161","TCP","56","443  >  59747 [ACK] Seq=6148 Ack=113093 Win=99328 Len=0"
"188","29.083100400","151.101.66.187","100.84.170.161","TLSv1.3","125","Application Data"
"189","29.084839700","151.101.66.187","100.84.170.161","TLSv1.3","296","Application Data"
"190","29.084907300","100.84.170.161","151.101.66.187","TCP","54","59747  >  443 [ACK] Seq=113093 Ack=6461 Win=131328 Len=0"
"191","29.521496600","100.84.170.161","151.101.66.187","TLSv1.3","2532","Application Data"
"192","29.531860500","151.101.66.187","100.84.170.161","TCP","56","443  >  59747 [ACK] Seq=6461 Ack=115571 Win=99328 Len=0"
"193","29.538779200","151.101.66.187","100.84.170.161","TLSv1.3","131","Application Data"
"194","29.542532200","100.84.170.161","151.101.66.187","TLSv1.3","2533","Application Data"
"195","29.551198600","151.101.66.187","100.84.170.161","TCP","56","443  >  59747 [ACK] Seq=6538 Ack=118050 Win=99328 Len=0"
"196","29.554244700","151.101.66.187","100.84.170.161","TLSv1.3","125","Application Data"
"197","29.582228600","151.101.66.187","100.84.170.161","TCP","125","[TCP Retransmission] 443  >  59747 [PSH, ACK] Seq=6538 Ack=118050 Win=101376 Len=71"
"198","29.582274000","100.84.170.161","151.101.66.187","TCP","66","59747  >  443 [ACK] Seq=118050 Ack=6609 Win=131072 Len=0 SLE=6538 SRE=6609"
"199","32.571827000","100.84.170.161","151.101.66.187","TLSv1.3","2532","Application Data"
"200","32.581219000","151.101.66.187","100.84.170.161","TCP","56","443  >  59747 [ACK] Seq=6609 Ack=120528 Win=99328 Len=0"
"201","32.584127500","151.101.66.187","100.84.170.161","TLSv1.3","214","Application Data"
"202","32.612422100","151.101.66.187","100.84.170.161","TCP","214","[TCP Retransmission] 443  >  59747 [PSH, ACK] Seq=6609 Ack=120528 Win=101376 Len=160"
"203","32.612461100","100.84.170.161","151.101.66.187","TCP","66","59747  >  443 [ACK] Seq=120528 Ack=6769 Win=131072 Len=0 SLE=6609 SRE=6769"
"204","32.729310500","100.84.170.161","151.101.66.187","TLSv1.3","2533","Application Data"
"205","32.738798300","151.101.66.187","100.84.170.161","TCP","56","443  >  59747 [ACK] Seq=6769 Ack=123007 Win=99328 Len=0"
"206","32.741301100","151.101.66.187","100.84.170.161","TLSv1.3","98","Application Data"
"207","32.768469100","151.101.66.187","100.84.170.161","TCP","98","[TCP Retransmission] 443  >  59747 [PSH, ACK] Seq=6769 Ack=123007 Win=101376 Len=44"
"208","32.768652500","100.84.170.161","151.101.66.187","TCP","66","59747  >  443 [ACK] Seq=123007 Ack=6813 Win=130816 Len=0 SLE=6769 SRE=6813"
"209","33.915486500","100.84.170.161","151.101.66.187","TLSv1.3","2532","Application Data"
"210","33.924849800","151.101.66.187","100.84.170.161","TCP","56","443  >  59747 [ACK] Seq=6813 Ack=125485 Win=99328 Len=0"
"211","33.928392500","151.101.66.187","100.84.170.161","TLSv1.3","214","Application Data"
"212","33.956334100","151.101.66.187","100.84.170.161","TCP","214","[TCP Retransmission] 443  >  59747 [PSH, ACK] Seq=6813 Ack=125485 Win=101376 Len=160"
"213","33.956388500","100.84.170.161","151.101.66.187","TCP","66","59747  >  443 [ACK] Seq=125485 Ack=6973 Win=130816 Len=0 SLE=6813 SRE=6973"
"214","33.994294000","100.84.170.161","151.101.66.187","TLSv1.3","2533","Application Data"
"215","34.003269400","151.101.66.187","100.84.170.161","TCP","56","443  >  59747 [ACK] Seq=6973 Ack=127964 Win=99328 Len=0"
"216","34.006271300","151.101.66.187","100.84.170.161","TLSv1.3","98","Application Data"
"217","34.033708000","151.101.66.187","100.84.170.161","TCP","98","[TCP Retransmission] 443  >  59747 [PSH, ACK] Seq=6973 Ack=127964 Win=101376 Len=44"
"218","34.033748300","100.84.170.161","151.101.66.187","TCP","66","59747  >  443 [ACK] Seq=127964 Ack=7017 Win=130816 Len=0 SLE=6973 SRE=7017"
"219","42.092607600","100.84.170.161","151.101.66.187","TLSv1.3","2531","Application Data"
"220","42.101578400","151.101.66.187","100.84.170.161","TCP","56","443  >  59747 [ACK] Seq=7017 Ack=130441 Win=99328 Len=0"
"221","42.105622900","151.101.66.187","100.84.170.161","TLSv1.3","214","Application Data"
"222","42.133464700","151.101.66.187","100.84.170.161","TCP","214","[TCP Retransmission] 443  >  59747 [PSH, ACK] Seq=7017 Ack=130441 Win=101376 Len=160"
"223","42.133509900","100.84.170.161","151.101.66.187","TCP","66","59747  >  443 [ACK] Seq=130441 Ack=7177 Win=130560 Len=0 SLE=7017 SRE=7177"
"224","42.232687300","100.84.170.161","151.101.66.187","TLSv1.3","2531","Application Data"
"225","42.241893600","151.101.66.187","100.84.170.161","TCP","56","443  >  59747 [ACK] Seq=7177 Ack=132918 Win=99328 Len=0"
"226","42.242510400","100.84.170.161","151.101.66.187","TLSv1.3","2522","Application Data"
"227","42.242757200","100.84.170.161","151.101.66.187","TLSv1.3","2517","Application Data"
"228","42.244246400","151.101.66.187","100.84.170.161","TLSv1.3","104","Application Data"
"229","42.245545800","100.84.170.161","151.101.66.187","TLSv1.3","2516","Application Data"
"230","42.248549000","100.84.170.161","151.101.66.187","TLSv1.3","2516","Application Data"
"231","42.251122900","151.101.66.187","100.84.170.161","TCP","56","443  >  59747 [ACK] Seq=7227 Ack=135386 Win=99328 Len=0"
"232","42.251603500","151.101.66.187","100.84.170.161","TCP","56","443  >  59747 [ACK] Seq=7227 Ack=137849 Win=99328 Len=0"
"233","42.253902500","151.101.66.187","100.84.170.161","TLSv1.3","124","Application Data"
"234","42.254150000","151.101.66.187","100.84.170.161","TLSv1.3","130","Application Data"
"235","42.254188400","100.84.170.161","151.101.66.187","TCP","54","59747  >  443 [ACK] Seq=142773 Ack=7373 Win=130304 Len=0"
"236","42.254887900","151.101.66.187","100.84.170.161","TCP","56","443  >  59747 [ACK] Seq=7373 Ack=140311 Win=99328 Len=0"
"237","42.256931600","151.101.66.187","100.84.170.161","TLSv1.3","131","Application Data"
"238","42.258448100","151.101.66.187","100.84.170.161","TCP","56","443  >  59747 [ACK] Seq=7450 Ack=142773 Win=99328 Len=0"
"239","42.260006300","151.101.66.187","100.84.170.161","TLSv1.3","124","Application Data"
"240","42.260073100","100.84.170.161","151.101.66.187","TCP","54","59747  >  443 [ACK] Seq=142773 Ack=7520 Win=130304 Len=0"
"241","42.263873300","100.84.170.161","151.101.66.187","TLSv1.3","2516","Application Data"
"242","42.272857400","151.101.66.187","100.84.170.161","TCP","56","443  >  59747 [ACK] Seq=7520 Ack=145235 Win=99328 Len=0"
"243","42.275512200","151.101.66.187","100.84.170.161","TLSv1.3","124","Application Data"
"244","42.303230700","151.101.66.187","100.84.170.161","TCP","124","[TCP Retransmission] 443  >  59747 [PSH, ACK] Seq=7520 Ack=145235 Win=101376 Len=70"
"245","42.303272700","100.84.170.161","151.101.66.187","TCP","66","59747  >  443 [ACK] Seq=145235 Ack=7590 Win=130048 Len=0 SLE=7520 SRE=7590"
"246","42.333588500","100.84.170.161","151.101.66.187","TLSv1.3","2513","Application Data"
"247","42.342901900","151.101.66.187","100.84.170.161","TCP","56","443  >  59747 [ACK] Seq=7590 Ack=147694 Win=99328 Len=0"
"248","42.345608300","151.101.66.187","100.84.170.161","TLSv1.3","169","Application Data"
"249","42.345694100","100.84.170.161","151.101.66.187","TLSv1.3","2530","Application Data"
"250","42.354629400","151.101.66.187","100.84.170.161","TCP","56","443  >  59747 [ACK] Seq=7705 Ack=150170 Win=99328 Len=0"
"251","42.356840200","151.101.66.187","100.84.170.161","TLSv1.3","124","Application Data"
"252","42.380332700","100.84.170.161","151.101.66.187","TLSv1.3","2530","Application Data"
"253","42.382372700","151.101.66.187","100.84.170.161","TCP","124","[TCP Spurious Retransmission] 443  >  59747 [PSH, ACK] Seq=7705 Ack=150170 Win=101376 Len=70"
"254","42.382411100","100.84.170.161","151.101.66.187","TCP","66","[TCP Dup ACK 252#1] 59747  >  443 [ACK] Seq=152646 Ack=7775 Win=130048 Len=0 SLE=7705 SRE=7775"
"255","42.389292700","151.101.66.187","100.84.170.161","TCP","56","443  >  59747 [ACK] Seq=7775 Ack=152646 Win=105984 Len=0"
"256","42.392161100","151.101.66.187","100.84.170.161","TLSv1.3","98","Application Data"
"257","42.418415900","151.101.66.187","100.84.170.161","TCP","98","[TCP Retransmission] 443  >  59747 [PSH, ACK] Seq=7775 Ack=152646 Win=105984 Len=44"
"258","42.418458100","100.84.170.161","151.101.66.187","TCP","66","59747  >  443 [ACK] Seq=152646 Ack=7819 Win=129792 Len=0 SLE=7775 SRE=7819"
"259","42.597215900","100.84.170.161","151.101.66.187","TLSv1.3","2525","Application Data"
"260","42.607568900","151.101.66.187","100.84.170.161","TCP","56","443  >  59747 [ACK] Seq=7819 Ack=155117 Win=111104 Len=0"
"261","42.612628900","151.101.66.187","100.84.170.161","TLSv1.3","131","Application Data"
"262","42.638260200","151.101.66.187","100.84.170.161","TCP","131","[TCP Retransmission] 443  >  59747 [PSH, ACK] Seq=7819 Ack=155117 Win=111104 Len=77"
"263","42.638303300","100.84.170.161","151.101.66.187","TCP","66","59747  >  443 [ACK] Seq=155117 Ack=7896 Win=129792 Len=0 SLE=7819 SRE=7896"
"264","42.670435600","100.84.170.161","151.101.66.187","TLSv1.3","2531","Application Data"
"265","42.679213000","151.101.66.187","100.84.170.161","TCP","56","443  >  59747 [ACK] Seq=7896 Ack=157594 Win=116224 Len=0"
"266","42.684472200","151.101.66.187","100.84.170.161","TLSv1.3","291","Application Data"
"267","42.711470900","151.101.66.187","100.84.170.161","TCP","291","[TCP Retransmission] 443  >  59747 [PSH, ACK] Seq=7896 Ack=157594 Win=116224 Len=237"
"268","42.711518500","100.84.170.161","151.101.66.187","TCP","66","59747  >  443 [ACK] Seq=157594 Ack=8133 Win=131328 Len=0 SLE=7896 SRE=8133"
"269","42.917352400","100.84.170.161","151.101.66.187","TLSv1.3","2512","Application Data"
"270","42.917561100","100.84.170.161","151.101.66.187","TLSv1.3","2534","Application Data"
"271","42.917722800","100.84.170.161","151.101.66.187","TLSv1.3","2538","Application Data"
"272","42.917846900","100.84.170.161","151.101.66.187","TLSv1.3","2530","Application Data"
"273","42.917975900","100.84.170.161","151.101.66.187","TLSv1.3","2522","Application Data"
"274","42.918578100","100.84.170.161","151.101.66.187","TLSv1.3","2521","Application Data"
"275","42.926231500","151.101.66.187","100.84.170.161","TCP","56","443  >  59747 [ACK] Seq=8133 Ack=160052 Win=120832 Len=0"
"276","42.926513700","151.101.66.187","100.84.170.161","TCP","56","443  >  59747 [ACK] Seq=8133 Ack=165016 Win=131072 Len=0"
"277","42.927125800","151.101.66.187","100.84.170.161","TCP","56","443  >  59747 [ACK] Seq=8133 Ack=169960 Win=140800 Len=0"
"278","42.927367500","151.101.66.187","100.84.170.161","TCP","56","443  >  59747 [ACK] Seq=8133 Ack=172427 Win=145920 Len=0"
"279","42.929346100","151.101.66.187","100.84.170.161","TLSv1.3","295","Application Data"
"280","42.932650400","151.101.66.187","100.84.170.161","TLSv1.3","130","Application Data"
"281","42.932710800","100.84.170.161","151.101.66.187","TCP","54","59747  >  443 [ACK] Seq=172427 Ack=8450 Win=131072 Len=0"
"282","42.933495400","151.101.66.187","100.84.170.161","TLSv1.3","124","Application Data"
"283","42.934902900","151.101.66.187","100.84.170.161","TLSv1.3","130","Application Data"
"284","42.934969100","100.84.170.161","151.101.66.187","TCP","54","59747  >  443 [ACK] Seq=172427 Ack=8596 Win=130816 Len=0"
"285","42.937428100","151.101.66.187","100.84.170.161","TLSv1.3","131","Application Data"
"286","42.969067300","151.101.66.187","100.84.170.161","TCP","131","[TCP Retransmission] 443  >  59747 [PSH, ACK] Seq=8596 Ack=172427 Win=145920 Len=77"
"287","42.969111600","100.84.170.161","151.101.66.187","TCP","66","59747  >  443 [ACK] Seq=172427 Ack=8673 Win=130816 Len=0 SLE=8596 SRE=8673"
"288","43.115720600","100.84.170.161","151.101.66.187","TLSv1.3","2527","Application Data"
"289","43.124485000","151.101.66.187","100.84.170.161","TCP","56","443  >  59747 [ACK] Seq=8673 Ack=174900 Win=150528 Len=0"
"290","43.127816300","151.101.66.187","100.84.170.161","TLSv1.3","125","Application Data"
"291","43.137105400","100.84.170.161","151.101.66.187","TLSv1.3","2528","Application Data"
"292","43.146560300","151.101.66.187","100.84.170.161","TCP","56","443  >  59747 [ACK] Seq=8744 Ack=177374 Win=155648 Len=0"
"293","43.149224000","151.101.66.187","100.84.170.161","TLSv1.3","131","Application Data"
"294","43.177237100","151.101.66.187","100.84.170.161","TCP","131","[TCP Retransmission] 443  >  59747 [PSH, ACK] Seq=8744 Ack=177374 Win=155648 Len=77"
"295","43.177285000","100.84.170.161","151.101.66.187","TCP","66","59747  >  443 [ACK] Seq=177374 Ack=8821 Win=130560 Len=0 SLE=8744 SRE=8821"
"296","47.795674000","100.84.170.161","151.101.66.187","TLSv1.3","2535","Application Data"
"297","47.804879600","151.101.66.187","100.84.170.161","TCP","56","443  >  59747 [ACK] Seq=8821 Ack=179855 Win=160768 Len=0"
"298","47.807547600","151.101.66.187","100.84.170.161","TLSv1.3","240","Application Data"
"299","47.835117100","151.101.66.187","100.84.170.161","TCP","240","[TCP Retransmission] 443  >  59747 [PSH, ACK] Seq=8821 Ack=179855 Win=160768 Len=186"
"300","47.835184600","100.84.170.161","151.101.66.187","TCP","66","59747  >  443 [ACK] Seq=179855 Ack=9007 Win=130304 Len=0 SLE=8821 SRE=9007"
"301","51.737300500","100.84.170.161","151.101.66.187","TLSv1.3","2527","Application Data"
"302","51.746347400","151.101.66.187","100.84.170.161","TCP","56","443  >  59747 [ACK] Seq=9007 Ack=182328 Win=165376 Len=0"
"303","51.749438000","151.101.66.187","100.84.170.161","TLSv1.3","258","Application Data"
"304","51.776682400","151.101.66.187","100.84.170.161","TCP","258","[TCP Retransmission] 443  >  59747 [PSH, ACK] Seq=9007 Ack=182328 Win=165376 Len=204"
"305","51.776753800","100.84.170.161","151.101.66.187","TCP","66","59747  >  443 [ACK] Seq=182328 Ack=9211 Win=130304 Len=0 SLE=9007 SRE=9211"
"306","51.808832500","100.84.170.161","151.101.66.187","TLSv1.3","2525","Application Data"
"307","51.817869900","151.101.66.187","100.84.170.161","TCP","56","443  >  59747 [ACK] Seq=9211 Ack=184799 Win=170496 Len=0"
"308","51.821050900","151.101.66.187","100.84.170.161","TLSv1.3","235","Application Data"
"309","51.849212700","151.101.66.187","100.84.170.161","TCP","235","[TCP Retransmission] 443  >  59747 [PSH, ACK] Seq=9211 Ack=184799 Win=170496 Len=181"
"310","51.849274200","100.84.170.161","151.101.66.187","TCP","66","59747  >  443 [ACK] Seq=184799 Ack=9392 Win=130048 Len=0 SLE=9211 SRE=9392"
"311","52.060187000","100.84.170.161","151.101.66.187","TLSv1.3","2528","Application Data"
"312","52.069393300","151.101.66.187","100.84.170.161","TCP","56","443  >  59747 [ACK] Seq=9392 Ack=187273 Win=175616 Len=0"
"313","52.072202100","151.101.66.187","100.84.170.161","TLSv1.3","264","Application Data"
"314","52.100462200","151.101.66.187","100.84.170.161","TCP","264","[TCP Retransmission] 443  >  59747 [PSH, ACK] Seq=9392 Ack=187273 Win=175616 Len=210"
"315","52.100492600","100.84.170.161","151.101.66.187","TCP","66","59747  >  443 [ACK] Seq=187273 Ack=9602 Win=131328 Len=0 SLE=9392 SRE=9602"
"316","53.503509600","100.84.170.161","151.101.66.187","TLSv1.3","2527","Application Data"
"317","53.512618300","151.101.66.187","100.84.170.161","TCP","56","443  >  59747 [ACK] Seq=9602 Ack=189746 Win=180224 Len=0"
"318","53.515619700","151.101.66.187","100.84.170.161","TLSv1.3","214","Application Data"
"319","53.544096600","151.101.66.187","100.84.170.161","TCP","214","[TCP Retransmission] 443  >  59747 [PSH, ACK] Seq=9602 Ack=189746 Win=180224 Len=160"
"320","53.544137100","100.84.170.161","151.101.66.187","TCP","66","59747  >  443 [ACK] Seq=189746 Ack=9762 Win=131072 Len=0 SLE=9602 SRE=9762"
"321","53.550251900","100.84.170.161","151.101.66.187","TLSv1.3","2528","Application Data"
"322","53.559038100","151.101.66.187","100.84.170.161","TCP","56","443  >  59747 [ACK] Seq=9762 Ack=192220 Win=185344 Len=0"
"323","53.562665700","151.101.66.187","100.84.170.161","TLSv1.3","98","Application Data"
"324","53.591114700","151.101.66.187","100.84.170.161","TCP","98","[TCP Retransmission] 443  >  59747 [PSH, ACK] Seq=9762 Ack=192220 Win=185344 Len=44"
"325","53.591154600","100.84.170.161","151.101.66.187","TCP","66","59747  >  443 [ACK] Seq=192220 Ack=9806 Win=131072 Len=0 SLE=9762 SRE=9806"
"326","59.395393400","100.84.170.161","151.101.66.187","TLSv1.3","2537","Application Data"
"327","59.405669700","151.101.66.187","100.84.170.161","TCP","56","443  >  59747 [ACK] Seq=9806 Ack=194703 Win=190464 Len=0"
"328","59.405783800","100.84.170.161","151.101.66.187","TLSv1.3","2528","Application Data"
"329","59.407818000","100.84.170.161","151.101.66.187","TLSv1.3","2522","Application Data"
"330","59.408795900","151.101.66.187","100.84.170.161","TLSv1.3","214","Application Data"
"331","59.412561500","100.84.170.161","151.101.66.187","TLSv1.3","2522","Application Data"
"332","59.414623500","151.101.66.187","100.84.170.161","TCP","56","443  >  59747 [ACK] Seq=9966 Ack=197177 Win=195072 Len=0"
"333","59.416510600","151.101.66.187","100.84.170.161","TCP","56","443  >  59747 [ACK] Seq=9966 Ack=199645 Win=200192 Len=0"
"334","59.417085000","151.101.66.187","100.84.170.161","TLSv1.3","124","Application Data"
"335","59.418605300","151.101.66.187","100.84.170.161","TLSv1.3","131","Application Data"
"336","59.418661600","100.84.170.161","151.101.66.187","TCP","54","59747  >  443 [ACK] Seq=202113 Ack=10113 Win=130816 Len=0"
"337","59.421388600","151.101.66.187","100.84.170.161","TCP","56","443  >  59747 [ACK] Seq=10113 Ack=202113 Win=205312 Len=0"
"338","59.424200300","151.101.66.187","100.84.170.161","TLSv1.3","130","Application Data"
"339","59.455209500","151.101.66.187","100.84.170.161","TCP","130","[TCP Retransmission] 443  >  59747 [PSH, ACK] Seq=10113 Ack=202113 Win=205312 Len=76"
"340","59.455269100","100.84.170.161","151.101.66.187","TCP","66","59747  >  443 [ACK] Seq=202113 Ack=10189 Win=130560 Len=0 SLE=10113 SRE=10189"
"341","59.475674400","100.84.170.161","151.101.66.187","TLSv1.3","2522","Application Data"
"342","59.485570400","151.101.66.187","100.84.170.161","TCP","56","443  >  59747 [ACK] Seq=10189 Ack=204581 Win=209920 Len=0"
"343","59.487991000","151.101.66.187","100.84.170.161","TLSv1.3","124","Application Data"
"344","59.511261500","100.84.170.161","151.101.66.187","TLSv1.3","2536","Application Data"
"345","59.516201200","151.101.66.187","100.84.170.161","TCP","124","[TCP Spurious Retransmission] 443  >  59747 [PSH, ACK] Seq=10189 Ack=204581 Win=209920 Len=70"
"346","59.516248000","100.84.170.161","151.101.66.187","TCP","66","[TCP Dup ACK 344#1] 59747  >  443 [ACK] Seq=207063 Ack=10259 Win=130560 Len=0 SLE=10189 SRE=10259"
"347","59.520463000","151.101.66.187","100.84.170.161","TCP","56","443  >  59747 [ACK] Seq=10259 Ack=207063 Win=215040 Len=0"
"348","59.523479300","151.101.66.187","100.84.170.161","TLSv1.3","125","Application Data"
"349","59.551345000","151.101.66.187","100.84.170.161","TCP","125","[TCP Retransmission] 443  >  59747 [PSH, ACK] Seq=10259 Ack=207063 Win=215040 Len=71"
"350","59.551386700","100.84.170.161","151.101.66.187","TCP","66","59747  >  443 [ACK] Seq=207063 Ack=10330 Win=130560 Len=0 SLE=10259 SRE=10330"
"351","59.627518400","100.84.170.161","151.101.66.187","TLSv1.3","2519","Application Data"
"352","59.636735600","151.101.66.187","100.84.170.161","TCP","56","443  >  59747 [ACK] Seq=10330 Ack=209528 Win=220160 Len=0"
"353","59.639364000","151.101.66.187","100.84.170.161","TLSv1.3","125","Application Data"
"354","59.643428300","100.84.170.161","151.101.66.187","TLSv1.3","2536","Application Data"
"355","59.652256000","151.101.66.187","100.84.170.161","TCP","56","443  >  59747 [ACK] Seq=10401 Ack=212010 Win=224768 Len=0"
"356","59.655625300","151.101.66.187","100.84.170.161","TLSv1.3","124","Application Data"
"357","59.684180500","151.101.66.187","100.84.170.161","TCP","124","[TCP Retransmission] 443  >  59747 [PSH, ACK] Seq=10401 Ack=212010 Win=224768 Len=70"
"358","59.684265700","100.84.170.161","151.101.66.187","TCP","66","59747  >  443 [ACK] Seq=212010 Ack=10471 Win=130304 Len=0 SLE=10401 SRE=10471"
"359","59.972221500","100.84.170.161","151.101.66.187","TLSv1.3","2531","Application Data"
"360","59.994720400","100.84.170.161","151.101.66.187","TCP","1514","[TCP Retransmission] 59747  >  443 [PSH, ACK] Seq=213027 Ack=10471 Win=130304 Len=1460"
"361","60.070420000","151.101.66.187","100.84.170.161","TCP","56","443  >  59747 [ACK] Seq=10471 Ack=214487 Win=229888 Len=0"
"362","60.070630600","151.101.66.187","100.84.170.161","TCP","66","[TCP Dup ACK 361#1] 443  >  59747 [ACK] Seq=10471 Ack=214487 Win=229888 Len=0 SLE=213027 SRE=214487"
"363","60.071051500","151.101.66.187","100.84.170.161","TLSv1.3","241","Application Data"
"364","60.091955500","151.101.66.187","100.84.170.161","TCP","241","[TCP Retransmission] 443  >  59747 [PSH, ACK] Seq=10471 Ack=214487 Win=229888 Len=187"
"365","60.092002100","100.84.170.161","151.101.66.187","TCP","66","59747  >  443 [ACK] Seq=214487 Ack=10658 Win=130304 Len=0 SLE=10471 SRE=10658"
"366","60.107409300","100.84.170.161","151.101.66.187","TLSv1.3","2536","Application Data"
"367","60.112217000","100.84.170.161","151.101.66.187","TLSv1.3","2541","Application Data"
"368","60.112404200","100.84.170.161","151.101.66.187","TLSv1.3","2541","Application Data"
"369","60.112562800","100.84.170.161","151.101.66.187","TLSv1.3","2537","Application Data"
"370","60.112712500","100.84.170.161","151.101.66.187","TLSv1.3","2533","Application Data"
"371","60.112853000","100.84.170.161","151.101.66.187","TLSv1.3","2525","Application Data"
"372","60.113019500","100.84.170.161","151.101.66.187","TLSv1.3","2524","Application Data"
"373","60.117869700","151.101.66.187","100.84.170.161","TCP","56","443  >  59747 [ACK] Seq=10658 Ack=216969 Win=235008 Len=0"
"374","60.120272700","151.101.66.187","100.84.170.161","TLSv1.3","174","Application Data"
"375","60.122258100","151.101.66.187","100.84.170.161","TCP","56","443  >  59747 [ACK] Seq=10778 Ack=224426 Win=249856 Len=0"
"376","60.122535300","151.101.66.187","100.84.170.161","TCP","56","443  >  59747 [ACK] Seq=10778 Ack=231846 Win=264704 Len=0"
"377","60.125396100","151.101.66.187","100.84.170.161","TLSv1.3","130","Application Data"
"378","60.125498900","100.84.170.161","151.101.66.187","TCP","54","59747  >  443 [ACK] Seq=231846 Ack=10854 Win=130048 Len=0"
"379","60.125743200","151.101.66.187","100.84.170.161","TLSv1.3","296","Application Data"
"380","60.126427900","151.101.66.187","100.84.170.161","TLSv1.3","131","Application Data"
"381","60.126427900","151.101.66.187","100.84.170.161","TLSv1.3","130","Application Data"
"382","60.126533900","100.84.170.161","151.101.66.187","TCP","54","59747  >  443 [ACK] Seq=231846 Ack=11249 Win=131328 Len=0"
"383","60.126755800","151.101.66.187","100.84.170.161","TLSv1.3","125","Application Data"
"384","60.126755800","151.101.66.187","100.84.170.161","TLSv1.3","130","Application Data"
"385","60.126918200","100.84.170.161","151.101.66.187","TCP","54","59747  >  443 [ACK] Seq=231846 Ack=11396 Win=131072 Len=0"
"386","60.332162600","100.84.170.161","151.101.66.187","TLSv1.3","2519","Application Data"
"387","60.336368600","100.84.170.161","151.101.66.187","TLSv1.3","2527","Application Data"
"388","60.340893500","151.101.66.187","100.84.170.161","TCP","56","443  >  59747 [ACK] Seq=11396 Ack=234311 Win=269312 Len=0"
"389","60.343981400","151.101.66.187","100.84.170.161","TLSv1.3","125","Application Data"
"390","60.345249400","151.101.66.187","100.84.170.161","TCP","56","443  >  59747 [ACK] Seq=11467 Ack=236784 Win=274432 Len=0"
"391","60.347358900","151.101.66.187","100.84.170.161","TLSv1.3","124","Application Data"
"392","60.347414400","100.84.170.161","151.101.66.187","TCP","54","59747  >  443 [ACK] Seq=236784 Ack=11537 Win=131072 Len=0"
"393","60.622167400","100.84.170.161","151.101.66.187","TLSv1.3","2545","Application Data"
"394","60.631771100","151.101.66.187","100.84.170.161","TCP","56","443  >  59747 [ACK] Seq=11537 Ack=239275 Win=279552 Len=0"
"395","60.634863700","151.101.66.187","100.84.170.161","TLSv1.3","104","Application Data"
"396","60.650437000","100.84.170.161","151.101.66.187","TLSv1.3","2546","Application Data"
"397","60.659575800","151.101.66.187","100.84.170.161","TCP","56","443  >  59747 [ACK] Seq=11587 Ack=241767 Win=284160 Len=0"
"398","60.662243500","151.101.66.187","100.84.170.161","TLSv1.3","125","Application Data"
"399","60.693300900","151.101.66.187","100.84.170.161","TCP","125","[TCP Retransmission] 443  >  59747 [PSH, ACK] Seq=11587 Ack=241767 Win=284160 Len=71"
"400","60.693338200","100.84.170.161","151.101.66.187","TCP","66","59747  >  443 [ACK] Seq=241767 Ack=11658 Win=130816 Len=0 SLE=11587 SRE=11658"
