"No.","Time","Source","Destination","Protocol","Length","Info"
"1","0.000000000","100.84.170.161","151.101.2.187","TCP","66","64433  >  443 [SYN] Seq=0 Win=64240 Len=0 MSS=1460 WS=256 SACK_PERM"
"2","0.000837300","100.84.170.161","151.101.2.187","TCP","66","50097  >  443 [SYN] Seq=0 Win=64240 Len=0 MSS=1460 WS=256 SACK_PERM"
"3","0.013280300","151.101.2.187","100.84.170.161","TCP","66","443  >  64433 [SYN, ACK] Seq=0 Ack=1 Win=65535 Len=0 MSS=1460 SACK_PERM WS=512"
"4","0.013475300","100.84.170.161","151.101.2.187","TCP","54","64433  >  443 [ACK] Seq=1 Ack=1 Win=131328 Len=0"
"5","0.014909500","151.101.2.187","100.84.170.161","TCP","66","443  >  50097 [SYN, ACK] Seq=0 Ack=1 Win=65535 Len=0 MSS=1460 SACK_PERM WS=512"
"6","0.015285600","100.84.170.161","151.101.2.187","TCP","54","50097  >  443 [ACK] Seq=1 Ack=1 Win=131328 Len=0"
"7","0.016242700","100.84.170.161","151.101.2.187","TLSv1.3","1778","Client Hello (SNI=www.target.com)"
"8","0.017598000","100.84.170.161","151.101.2.187","TLSv1.3","1778","Client Hello (SNI=www.target.com)"
"9","0.026148800","151.101.2.187","100.84.170.161","TCP","56","443  >  64433 [ACK] Seq=1 Ack=1725 Win=144896 Len=0"
"10","0.026449900","151.101.2.187","100.84.170.161","TCP","56","443  >  50097 [ACK] Seq=1 Ack=1461 Win=144896 Len=0"
"11","0.026827800","151.101.2.187","100.84.170.161","TCP","56","443  >  50097 [ACK] Seq=1 Ack=1725 Win=144896 Len=0"
"12","0.028197300","151.101.2.187","100.84.170.161","TLSv1.3","1510","Server Hello, Change Cipher Spec, Application Data"
"13","0.028545200","151.101.2.187","100.84.170.161","TCP","1510","443  >  64433 [ACK] Seq=1457 Ack=1725 Win=145920 Len=1456 [TCP PDU reassembled in 16]"
"14","0.028600000","100.84.170.161","151.101.2.187","TCP","54","64433  >  443 [ACK] Seq=1725 Ack=2913 Win=131328 Len=0"
"15","0.028996900","151.101.2.187","100.84.170.161","TCP","4422","443  >  64433 [PSH, ACK] Seq=2913 Ack=1725 Win=145920 Len=4368 [TCP PDU reassembled in 16]"
"16","0.028996900","151.101.2.187","100.84.170.161","TLSv1.3","675","Application Data, Application Data, Application Data, Application Data"
"17","0.029081100","100.84.170.161","151.101.2.187","TCP","54","64433  >  443 [ACK] Seq=1725 Ack=7902 Win=131328 Len=0"
"18","0.029629000","151.101.2.187","100.84.170.161","TLSv1.3","7334","Server Hello, Change Cipher Spec, Application Data"
"19","0.029629000","151.101.2.187","100.84.170.161","TLSv1.3","675","Application Data, Application Data, Application Data, Application Data"
"20","0.029733200","100.84.170.161","151.101.2.187","TCP","54","50097  >  443 [ACK] Seq=1725 Ack=7902 Win=131328 Len=0"
"21","0.036311400","100.84.170.161","151.101.2.187","TLSv1.3","118","Change Cipher Spec, Application Data"
"22","0.036948100","100.84.170.161","151.101.2.187","TLSv1.3","118","Change Cipher Spec, Application Data"
"23","0.037732500","100.84.170.161","151.101.2.187","TCP","54","50097  >  443 [FIN, ACK] Seq=1789 Ack=7902 Win=131328 Len=0"
"24","0.038128400","100.84.170.161","151.101.2.187","TLSv1.3","146","Application Data"
"25","0.038950800","100.84.170.161","151.101.2.187","TLSv1.3","2331","Application Data"
"26","0.039348700","100.84.170.161","151.101.2.187","TLSv1.3","2330","Application Data"
"27","0.045433500","151.101.2.187","100.84.170.161","TCP","56","443  >  64433 [ACK] Seq=7902 Ack=1789 Win=145920 Len=0"
"28","0.045753800","151.101.2.187","100.84.170.161","TCP","56","443  >  50097 [ACK] Seq=7902 Ack=1789 Win=145920 Len=0"
"29","0.047509600","151.101.2.187","100.84.170.161","TLSv1.3","119","Application Data"
"30","0.048586800","151.101.2.187","100.84.170.161","TCP","56","443  >  64433 [ACK] Seq=7967 Ack=6434 Win=144384 Len=0"
"31","0.048682500","100.84.170.161","151.101.2.187","TLSv1.3","85","Application Data"
"32","0.050449900","151.101.2.187","100.84.170.161","TLSv1.3","78","Application Data"
"33","0.050532600","100.84.170.161","151.101.2.187","TCP","54","50097  >  443 [RST, ACK] Seq=1790 Ack=7926 Win=0 Len=0"
"34","0.052500200","151.101.2.187","100.84.170.161","TLSv1.3","451","Application Data"
"35","0.052500200","151.101.2.187","100.84.170.161","TLSv1.3","125","Application Data"
"36","0.052581000","100.84.170.161","151.101.2.187","TCP","54","64433  >  443 [ACK] Seq=6465 Ack=8435 Win=130816 Len=0"
"37","0.057872000","151.101.2.187","100.84.170.161","TCP","56","443  >  64433 [ACK] Seq=8435 Ack=6465 Win=145920 Len=0"
"38","0.480754300","100.84.170.161","151.101.2.187","TLSv1.3","2328","Application Data"
"39","0.489984600","151.101.2.187","100.84.170.161","TCP","56","443  >  64433 [ACK] Seq=8435 Ack=8739 Win=144384 Len=0"
"40","0.492399200","151.101.2.187","100.84.170.161","TLSv1.3","131","Application Data"
"41","0.520606600","151.101.2.187","100.84.170.161","TCP","131","[TCP Retransmission] 443  >  64433 [PSH, ACK] Seq=8435 Ack=8739 Win=145920 Len=77"
"42","0.520654300","100.84.170.161","151.101.2.187","TCP","66","64433  >  443 [ACK] Seq=8739 Ack=8512 Win=130560 Len=0 SLE=8435 SRE=8512"
"43","0.813294600","100.84.170.161","151.101.2.187","TLSv1.3","2329","Application Data"
"44","0.815956100","100.84.170.161","151.101.2.187","TLSv1.3","2330","Application Data"
"45","0.824402100","151.101.2.187","100.84.170.161","TCP","56","443  >  64433 [ACK] Seq=8512 Ack=11014 Win=144384 Len=0"
"46","0.826896300","151.101.2.187","100.84.170.161","TCP","56","443  >  64433 [ACK] Seq=8512 Ack=13290 Win=144384 Len=0"
"47","0.827254200","151.101.2.187","100.84.170.161","TLSv1.3","234","Application Data"
"48","0.827977900","151.101.2.187","100.84.170.161","TLSv1.3","130","Application Data"
"49","0.828048000","100.84.170.161","151.101.2.187","TCP","54","64433  >  443 [ACK] Seq=13290 Ack=8768 Win=130304 Len=0"
"50","1.460679800","100.84.170.161","151.101.2.187","TLSv1.3","2330","Application Data"
"51","1.463005200","100.84.170.161","151.101.2.187","TLSv1.3","328","Application Data"
"52","1.467366100","100.84.170.161","151.101.2.187","TLSv1.3","142","Application Data"
"53","1.471930800","151.101.2.187","100.84.170.161","TCP","56","443  >  64433 [ACK] Seq=8768 Ack=15566 Win=144384 Len=0"
"54","1.472552100","151.101.2.187","100.84.170.161","TCP","56","443  >  64433 [ACK] Seq=8768 Ack=15840 Win=144384 Len=0"
"55","1.473400900","151.101.2.187","100.84.170.161","TLSv1.3","104","Application Data"
"56","1.473513400","100.84.170.161","151.101.2.187","TLSv1.3","2151","Application Data"
"57","1.474360000","151.101.2.187","100.84.170.161","TLSv1.3","173","Application Data"
"58","1.474733100","151.101.2.187","100.84.170.161","TLSv1.3","447","Application Data"
"59","1.474783500","100.84.170.161","151.101.2.187","TCP","54","64433  >  443 [ACK] Seq=18025 Ack=9330 Win=129792 Len=0"
"60","1.478205100","151.101.2.187","100.84.170.161","TCP","56","443  >  64433 [ACK] Seq=9330 Ack=15928 Win=145920 Len=0"
"61","1.481455700","151.101.2.187","100.84.170.161","TLSv1.3","160","Application Data"
"62","1.481543100","100.84.170.161","151.101.2.187","TCP","54","64433  >  443 [ACK] Seq=18025 Ack=9436 Win=131328 Len=0"
"63","1.481725500","151.101.2.187","100.84.170.161","TLSv1.3","330","Application Data"
"64","1.481768200","100.84.170.161","151.101.2.187","TCP","54","64433  >  443 [ACK] Seq=18025 Ack=9712 Win=131072 Len=0"
"65","1.483975100","151.101.2.187","100.84.170.161","TCP","56","443  >  64433 [ACK] Seq=9712 Ack=18025 Win=144384 Len=0"
"66","1.487012100","151.101.2.187","100.84.170.161","TLSv1.3","98","Application Data"
"67","1.518710900","151.101.2.187","100.84.170.161","TCP","98","[TCP Retransmission] 443  >  64433 [PSH, ACK] Seq=9712 Ack=18025 Win=145920 Len=44"
"68","1.518750700","100.84.170.161","151.101.2.187","TCP","66","64433  >  443 [ACK] Seq=18025 Ack=9756 Win=131072 Len=0 SLE=9712 SRE=9756"
"69","1.616210300","100.84.170.161","151.101.2.187","TLSv1.3","344","Application Data"
"70","1.625757000","151.101.2.187","100.84.170.161","TCP","56","443  >  64433 [ACK] Seq=9756 Ack=18315 Win=145920 Len=0"
"71","1.629021300","151.101.2.187","100.84.170.161","TLSv1.3","472","Application Data"
"72","1.655795400","151.101.2.187","100.84.170.161","TCP","472","[TCP Retransmission] 443  >  64433 [PSH, ACK] Seq=9756 Ack=18315 Win=145920 Len=418"
"73","1.655840000","100.84.170.161","151.101.2.187","TCP","66","64433  >  443 [ACK] Seq=18315 Ack=10174 Win=130560 Len=0 SLE=9756 SRE=10174"
"74","1.674079900","100.84.170.161","151.101.2.187","TLSv1.3","159","Application Data"
"75","1.674230300","100.84.170.161","151.101.2.187","TLSv1.3","260","Application Data"
"76","1.674266800","100.84.170.161","151.101.2.187","TLSv1.3","149","Application Data"
"77","1.674473400","100.84.170.161","151.101.2.187","TLSv1.3","146","Application Data"
"78","1.683479000","151.101.2.187","100.84.170.161","TCP","56","443  >  64433 [ACK] Seq=10174 Ack=18420 Win=145920 Len=0"
"79","1.683935300","151.101.2.187","100.84.170.161","TCP","56","443  >  64433 [ACK] Seq=10174 Ack=18813 Win=145920 Len=0"
"80","1.686776600","151.101.2.187","100.84.170.161","TLSv1.3","1037","Application Data"
"81","1.687432600","151.101.2.187","100.84.170.161","TLSv1.3","762","Application Data"
"82","1.687432600","151.101.2.187","100.84.170.161","TLSv1.3","737","Application Data"
"83","1.687513300","100.84.170.161","151.101.2.187","TCP","54","64433  >  443 [ACK] Seq=18813 Ack=12548 Win=131328 Len=0"
"84","1.687748800","151.101.2.187","100.84.170.161","TLSv1.3","138","Application Data"
"85","1.687748800","151.101.2.187","100.84.170.161","TLSv1.3","556","Application Data"
"86","1.687795200","100.84.170.161","151.101.2.187","TCP","54","64433  >  443 [ACK] Seq=18813 Ack=13134 Win=130560 Len=0"
"87","1.746331400","100.84.170.161","151.101.2.187","TLSv1.3","221","Application Data"
"88","1.755726500","151.101.2.187","100.84.170.161","TCP","56","443  >  64433 [ACK] Seq=13134 Ack=18980 Win=145920 Len=0"
"89","1.758325600","151.101.2.187","100.84.170.161","TLSv1.3","104","Application Data"
"90","1.784963500","151.101.2.187","100.84.170.161","TCP","104","[TCP Retransmission] 443  >  64433 [PSH, ACK] Seq=13134 Ack=18980 Win=145920 Len=50"
"91","1.785007900","100.84.170.161","151.101.2.187","TCP","66","64433  >  443 [ACK] Seq=18980 Ack=13184 Win=130560 Len=0 SLE=13134 SRE=13184"
"92","1.814057200","100.84.170.161","151.101.2.187","TLSv1.3","2035","Application Data"
"93","1.815478200","100.84.170.161","151.101.2.187","TLSv1.3","488","Application Data"
"94","1.823238400","151.101.2.187","100.84.170.161","TCP","56","443  >  64433 [ACK] Seq=13184 Ack=20961 Win=144384 Len=0"
"95","1.824728300","151.101.2.187","100.84.170.161","TCP","56","443  >  64433 [ACK] Seq=13184 Ack=21395 Win=144384 Len=0"
"96","1.826994600","151.101.2.187","100.84.170.161","TLSv1.3","125","Application Data"
"97","1.827552500","151.101.2.187","100.84.170.161","TLSv1.3","125","Application Data"
"98","1.827601700","100.84.170.161","151.101.2.187","TCP","54","64433  >  443 [ACK] Seq=21395 Ack=13326 Win=130560 Len=0"
"99","2.252234900","100.84.170.161","151.101.2.187","TLSv1.3","1968","Application Data"
"100","2.262741800","151.101.2.187","100.84.170.161","TCP","56","443  >  64433 [ACK] Seq=13326 Ack=23309 Win=144384 Len=0"
"101","2.266527600","151.101.2.187","100.84.170.161","TLSv1.3","104","Application Data"
"102","2.278254800","100.84.170.161","151.101.2.187","TLSv1.3","354","Application Data"
"103","2.290023900","151.101.2.187","100.84.170.161","TCP","56","443  >  64433 [ACK] Seq=13376 Ack=23609 Win=145920 Len=0"
"104","2.293733500","151.101.2.187","100.84.170.161","TLSv1.3","125","Application Data"
"105","2.323154800","151.101.2.187","100.84.170.161","TCP","125","[TCP Retransmission] 443  >  64433 [PSH, ACK] Seq=13376 Ack=23609 Win=145920 Len=71"
"106","2.323206900","100.84.170.161","151.101.2.187","TCP","66","64433  >  443 [ACK] Seq=23609 Ack=13447 Win=130304 Len=0 SLE=13376 SRE=13447"
"107","2.422301200","100.84.170.161","151.101.2.187","TLSv1.3","2260","Application Data"
"108","2.434271000","151.101.2.187","100.84.170.161","TCP","56","443  >  64433 [ACK] Seq=13447 Ack=25815 Win=144384 Len=0"
"109","2.437136400","151.101.2.187","100.84.170.161","TLSv1.3","98","Application Data"
"110","2.470982400","151.101.2.187","100.84.170.161","TCP","98","[TCP Retransmission] 443  >  64433 [PSH, ACK] Seq=13447 Ack=25815 Win=145920 Len=44"
"111","2.471029700","100.84.170.161","151.101.2.187","TCP","66","64433  >  443 [ACK] Seq=25815 Ack=13491 Win=130304 Len=0 SLE=13447 SRE=13491"
"112","2.979532400","100.84.170.161","151.101.2.187","TLSv1.3","370","Application Data"
"113","2.979744500","100.84.170.161","151.101.2.187","TLSv1.3","2249","Application Data"
"114","2.988615300","151.101.2.187","100.84.170.161","TCP","56","443  >  64433 [ACK] Seq=13491 Ack=26131 Win=145920 Len=0"
"115","2.989431700","151.101.2.187","100.84.170.161","TCP","56","443  >  64433 [ACK] Seq=13491 Ack=28326 Win=144384 Len=0"
"116","2.991469100","151.101.2.187","100.84.170.161","TLSv1.3","208","Application Data"
"117","2.991773400","151.101.2.187","100.84.170.161","TLSv1.3","124","Application Data"
"118","2.991811400","100.84.170.161","151.101.2.187","TCP","54","64433  >  443 [ACK] Seq=28326 Ack=13715 Win=130048 Len=0"
"119","7.781331600","100.84.170.161","151.101.2.187","TLSv1.3","750","Application Data"
"120","7.791201700","151.101.2.187","100.84.170.161","TCP","56","443  >  64433 [ACK] Seq=13715 Ack=29022 Win=145408 Len=0"
"121","7.793866000","151.101.2.187","100.84.170.161","TLSv1.3","214","Application Data"
"122","7.822600600","151.101.2.187","100.84.170.161","TCP","214","[TCP Retransmission] 443  >  64433 [PSH, ACK] Seq=13715 Ack=29022 Win=145920 Len=160"
"123","7.822656800","100.84.170.161","151.101.2.187","TCP","66","64433  >  443 [ACK] Seq=29022 Ack=13875 Win=130048 Len=0 SLE=13715 SRE=13875"
"124","7.909923500","100.84.170.161","151.101.2.187","TLSv1.3","1904","Application Data"
"125","7.913630700","100.84.170.161","151.101.2.187","TLSv1.3","695","Application Data"
"126","7.917133500","100.84.170.161","151.101.2.187","TLSv1.3","1897","Application Data"
"127","7.920356700","151.101.2.187","100.84.170.161","TCP","56","443  >  64433 [ACK] Seq=13875 Ack=30872 Win=144384 Len=0"
"128","7.923689600","151.101.2.187","100.84.170.161","TLSv1.3","421","Application Data"
"129","7.923770000","100.84.170.161","151.101.2.187","TCP","54","64433  >  443 [ACK] Seq=33356 Ack=14242 Win=131328 Len=0"
"130","7.925526100","100.84.170.161","151.101.2.187","TLSv1.3","89","Application Data"
"131","7.925675200","151.101.2.187","100.84.170.161","TCP","56","443  >  64433 [ACK] Seq=14242 Ack=31513 Win=145408 Len=0"
"132","7.926456800","151.101.2.187","100.84.170.161","TLSv1.3","403","Application Data"
"133","7.927038600","151.101.2.187","100.84.170.161","TCP","56","443  >  64433 [ACK] Seq=14591 Ack=33356 Win=144384 Len=0"
"134","7.930016100","151.101.2.187","100.84.170.161","TLSv1.3","183","Application Data"
"135","7.930092000","100.84.170.161","151.101.2.187","TCP","54","64433  >  443 [ACK] Seq=33391 Ack=14720 Win=130816 Len=0"
"136","7.930214900","151.101.2.187","100.84.170.161","TLSv1.3","569","Application Data"
"137","7.934808700","151.101.2.187","100.84.170.161","TCP","56","443  >  64433 [ACK] Seq=15235 Ack=33391 Win=145920 Len=0"
"138","7.966805400","151.101.2.187","100.84.170.161","TCP","569","[TCP Retransmission] 443  >  64433 [PSH, ACK] Seq=14720 Ack=33391 Win=145920 Len=515"
"139","7.966849300","100.84.170.161","151.101.2.187","TCP","66","64433  >  443 [ACK] Seq=33391 Ack=15235 Win=130304 Len=0 SLE=14720 SRE=15235"
"140","8.068239400","100.84.170.161","151.101.2.187","TLSv1.3","702","Application Data"
"141","8.069021900","100.84.170.161","151.101.2.187","TLSv1.3","2402","Application Data"
"142","8.075241200","100.84.170.161","151.101.2.187","TLSv1.3","2512","Application Data"
"143","8.077605600","151.101.2.187","100.84.170.161","TCP","56","443  >  64433 [ACK] Seq=15235 Ack=34039 Win=145408 Len=0"
"144","8.078400900","151.101.2.187","100.84.170.161","TCP","56","443  >  64433 [ACK] Seq=15235 Ack=36387 Win=144384 Len=0"
"145","8.080295500","151.101.2.187","100.84.170.161","TLSv1.3","162","Application Data"
"146","8.080295500","151.101.2.187","100.84.170.161","TLSv1.3","364","Application Data"
"147","8.080411900","100.84.170.161","151.101.2.187","TCP","54","64433  >  443 [ACK] Seq=38845 Ack=15653 Win=129792 Len=0"
"148","8.080647800","151.101.2.187","100.84.170.161","TLSv1.3","270","Application Data"
"149","8.080751000","100.84.170.161","151.101.2.187","TCP","54","64433  >  443 [ACK] Seq=38845 Ack=15869 Win=131328 Len=0"
"150","8.084943700","151.101.2.187","100.84.170.161","TCP","56","443  >  64433 [ACK] Seq=15869 Ack=38845 Win=144384 Len=0"
"151","8.087211200","151.101.2.187","100.84.170.161","TLSv1.3","98","Application Data"
"152","8.087273500","100.84.170.161","151.101.2.187","TCP","54","64433  >  443 [ACK] Seq=38845 Ack=15913 Win=131328 Len=0"
"153","8.273163800","100.84.170.161","151.101.2.187","TLSv1.3","2442","Application Data"
"154","8.282915000","151.101.2.187","100.84.170.161","TCP","56","443  >  64433 [ACK] Seq=15913 Ack=41233 Win=144384 Len=0"
"155","8.285263800","151.101.2.187","100.84.170.161","TLSv1.3","133","Application Data"
"156","8.285527100","151.101.2.187","100.84.170.161","TLSv1.3","364","Application Data"
"157","8.285567900","100.84.170.161","151.101.2.187","TCP","54","64433  >  443 [ACK] Seq=41233 Ack=16302 Win=130816 Len=0"
"158","8.289094900","100.84.170.161","151.101.2.187","TLSv1.3","2448","Application Data"
"159","8.290938600","100.84.170.161","151.101.2.187","TLSv1.3","2448","Application Data"
"160","8.292586500","100.84.170.161","151.101.2.187","TLSv1.3","2445","Application Data"
"161","8.298563500","151.101.2.187","100.84.170.161","TCP","56","443  >  64433 [ACK] Seq=16302 Ack=43627 Win=144384 Len=0"
"162","8.301112000","151.101.2.187","100.84.170.161","TCP","56","443  >  64433 [ACK] Seq=16302 Ack=46021 Win=144384 Len=0"
"163","8.301454400","151.101.2.187","100.84.170.161","TLSv1.3","156","Application Data"
"164","8.301784100","151.101.2.187","100.84.170.161","TLSv1.3","323","Application Data"
"165","8.301837200","100.84.170.161","151.101.2.187","TCP","54","64433  >  443 [ACK] Seq=48412 Ack=16673 Win=130560 Len=0"
"166","8.302146500","151.101.2.187","100.84.170.161","TCP","56","443  >  64433 [ACK] Seq=16673 Ack=48412 Win=144384 Len=0"
"167","8.302847500","151.101.2.187","100.84.170.161","TLSv1.3","132","Application Data"
"168","8.302847500","151.101.2.187","100.84.170.161","TLSv1.3","694","Application Data"
"169","8.302924400","100.84.170.161","151.101.2.187","TCP","54","64433  >  443 [ACK] Seq=48412 Ack=17391 Win=131328 Len=0"
"170","8.304193300","151.101.2.187","100.84.170.161","TLSv1.3","155","Application Data"
"171","8.304508100","151.101.2.187","100.84.170.161","TLSv1.3","833","Application Data"
"172","8.304546300","100.84.170.161","151.101.2.187","TCP","54","64433  >  443 [ACK] Seq=48412 Ack=18271 Win=130304 Len=0"
"173","8.359395900","100.84.170.161","151.101.2.187","TLSv1.3","2511","Application Data"
"174","8.368703100","151.101.2.187","100.84.170.161","TCP","56","443  >  64433 [ACK] Seq=18271 Ack=50869 Win=144384 Len=0"
"175","8.371527300","151.101.2.187","100.84.170.161","TLSv1.3","130","Application Data"
"176","8.394811400","151.101.2.187","100.84.170.161","TCP","130","[TCP Retransmission] 443  >  64433 [PSH, ACK] Seq=18271 Ack=50869 Win=145920 Len=76"
"177","8.394871800","100.84.170.161","151.101.2.187","TCP","66","64433  >  443 [ACK] Seq=50869 Ack=18347 Win=130304 Len=0 SLE=18271 SRE=18347"
"178","8.585040200","100.84.170.161","151.101.2.187","TLSv1.3","2488","Application Data"
"179","8.587068800","100.84.170.161","151.101.2.187","TLSv1.3","2512","Application Data"
"180","8.594804200","151.101.2.187","100.84.170.161","TCP","56","443  >  64433 [ACK] Seq=18347 Ack=53303 Win=144384 Len=0"
"181","8.596779800","151.101.2.187","100.84.170.161","TCP","56","443  >  64433 [ACK] Seq=18347 Ack=55761 Win=144384 Len=0"
"182","8.598510200","151.101.2.187","100.84.170.161","TLSv1.3","125","Application Data"
"183","8.599980800","151.101.2.187","100.84.170.161","TLSv1.3","125","Application Data"
"184","8.600068000","100.84.170.161","151.101.2.187","TCP","54","64433  >  443 [ACK] Seq=55761 Ack=18489 Win=130048 Len=0"
"185","8.633962200","100.84.170.161","151.101.2.187","TLSv1.3","2525","Application Data"
"186","8.643895800","151.101.2.187","100.84.170.161","TCP","56","443  >  64433 [ACK] Seq=18489 Ack=58232 Win=144384 Len=0"
"187","8.645876600","151.101.2.187","100.84.170.161","TLSv1.3","98","Application Data"
"188","8.671591400","151.101.2.187","100.84.170.161","TCP","98","[TCP Retransmission] 443  >  64433 [PSH, ACK] Seq=18489 Ack=58232 Win=145920 Len=44"
"189","8.671630400","100.84.170.161","151.101.2.187","TCP","66","64433  >  443 [ACK] Seq=58232 Ack=18533 Win=130048 Len=0 SLE=18489 SRE=18533"
"190","8.696449400","100.84.170.161","151.101.2.187","TLSv1.3","2524","Application Data"
"191","8.706786300","151.101.2.187","100.84.170.161","TCP","56","443  >  64433 [ACK] Seq=18533 Ack=60702 Win=144384 Len=0"
"192","8.708665700","151.101.2.187","100.84.170.161","TLSv1.3","208","Application Data"
"193","8.733758900","151.101.2.187","100.84.170.161","TCP","208","[TCP Retransmission] 443  >  64433 [PSH, ACK] Seq=18533 Ack=60702 Win=145920 Len=154"
"194","8.733804400","100.84.170.161","151.101.2.187","TCP","66","64433  >  443 [ACK] Seq=60702 Ack=18687 Win=130048 Len=0 SLE=18533 SRE=18687"
"195","8.739572100","100.84.170.161","151.101.2.187","TLSv1.3","2062","Application Data"
"196","8.748860600","151.101.2.187","100.84.170.161","TCP","56","443  >  64433 [ACK] Seq=18687 Ack=62710 Win=144384 Len=0"
"197","8.845555800","151.101.2.187","100.84.170.161","TLSv1.3","479","Application Data"
"198","8.845935600","151.101.2.187","100.84.170.161","TLSv1.3","797","Application Data"
"199","8.846004400","100.84.170.161","151.101.2.187","TCP","54","64433  >  443 [ACK] Seq=62710 Ack=19855 Win=131328 Len=0"
"200","8.976130600","100.84.170.161","151.101.2.187","TLSv1.3","854","Application Data"
"201","8.985211600","151.101.2.187","100.84.170.161","TCP","56","443  >  64433 [ACK] Seq=19855 Ack=63510 Win=145408 Len=0"
"202","8.988369500","151.101.2.187","100.84.170.161","TLSv1.3","314","Application Data"
"203","9.012975500","151.101.2.187","100.84.170.161","TCP","314","[TCP Retransmission] 443  >  64433 [PSH, ACK] Seq=19855 Ack=63510 Win=145920 Len=260"
"204","9.013114100","100.84.170.161","151.101.2.187","TCP","66","64433  >  443 [ACK] Seq=63510 Ack=20115 Win=131072 Len=0 SLE=19855 SRE=20115"
"205","9.368217100","100.84.170.161","151.101.2.187","TLSv1.3","1810","Application Data"
"206","9.380162300","151.101.2.187","100.84.170.161","TCP","56","443  >  64433 [ACK] Seq=20115 Ack=65266 Win=144384 Len=0"
"207","9.382602000","151.101.2.187","100.84.170.161","TLSv1.3","104","Application Data"
"208","9.405798400","151.101.2.187","100.84.170.161","TCP","104","[TCP Retransmission] 443  >  64433 [PSH, ACK] Seq=20115 Ack=65266 Win=145920 Len=50"
"209","9.405842600","100.84.170.161","151.101.2.187","TCP","66","64433  >  443 [ACK] Seq=65266 Ack=20165 Win=131072 Len=0 SLE=20115 SRE=20165"
"210","9.540889400","100.84.170.161","151.101.2.187","TLSv1.3","825","Application Data"
"211","9.550646600","151.101.2.187","100.84.170.161","TCP","56","443  >  64433 [ACK] Seq=20165 Ack=66037 Win=145408 Len=0"
"212","9.552642200","151.101.2.187","100.84.170.161","TLSv1.3","173","Application Data"
"213","9.552944900","151.101.2.187","100.84.170.161","TLSv1.3","256","Application Data"
"214","9.552982400","100.84.170.161","151.101.2.187","TCP","54","64433  >  443 [ACK] Seq=66037 Ack=20486 Win=130560 Len=0"
"215","9.570519500","100.84.170.161","151.101.2.187","TLSv1.3","1842","Application Data"
"216","9.580446300","151.101.2.187","100.84.170.161","TCP","56","443  >  64433 [ACK] Seq=20486 Ack=67825 Win=144384 Len=0"
"217","9.583835000","151.101.2.187","100.84.170.161","TLSv1.3","130","Application Data"
"218","9.607707900","151.101.2.187","100.84.170.161","TCP","130","[TCP Retransmission] 443  >  64433 [PSH, ACK] Seq=20486 Ack=67825 Win=145920 Len=76"
"219","9.607751700","100.84.170.161","151.101.2.187","TCP","66","64433  >  443 [ACK] Seq=67825 Ack=20562 Win=130560 Len=0 SLE=20486 SRE=20562"
"220","9.707186700","100.84.170.161","151.101.2.187","TLSv1.3","818","Application Data"
"221","9.708840800","100.84.170.161","151.101.2.187","TLSv1.3","1772","Application Data"
"222","9.716883500","151.101.2.187","100.84.170.161","TCP","56","443  >  64433 [ACK] Seq=20562 Ack=68589 Win=145408 Len=0"
"223","9.718995000","151.101.2.187","100.84.170.161","TCP","56","443  >  64433 [ACK] Seq=20562 Ack=70307 Win=144384 Len=0"
"224","9.719858900","151.101.2.187","100.84.170.161","TLSv1.3","271","Application Data"
"225","9.720234400","151.101.2.187","100.84.170.161","TLSv1.3","379","Application Data"
"226","9.720276900","100.84.170.161","151.101.2.187","TCP","54","64433  >  443 [ACK] Seq=70307 Ack=21104 Win=130048 Len=0"
"227","9.721326900","151.101.2.187","100.84.170.161","TLSv1.3","442","Application Data"
"228","9.754798900","151.101.2.187","100.84.170.161","TCP","442","[TCP Retransmission] 443  >  64433 [PSH, ACK] Seq=21104 Ack=70307 Win=145920 Len=388"
"229","9.754858300","100.84.170.161","151.101.2.187","TCP","66","64433  >  443 [ACK] Seq=70307 Ack=21492 Win=131328 Len=0 SLE=21104 SRE=21492"
"230","9.906159500","100.84.170.161","151.101.2.187","TLSv1.3","839","Application Data"
"231","9.915661000","151.101.2.187","100.84.170.161","TCP","56","443  >  64433 [ACK] Seq=21492 Ack=71092 Win=145408 Len=0"
"232","9.918455000","151.101.2.187","100.84.170.161","TLSv1.3","162","Application Data"
"233","9.918724700","151.101.2.187","100.84.170.161","TLSv1.3","906","Application Data"
"234","9.918789600","100.84.170.161","151.101.2.187","TCP","54","64433  >  443 [ACK] Seq=71092 Ack=22452 Win=130304 Len=0"
"235","10.026151200","100.84.170.161","151.101.2.187","TLSv1.3","1783","Application Data"
"236","10.029463800","100.84.170.161","151.101.2.187","TLSv1.3","844","Application Data"
"237","10.029660900","100.84.170.161","151.101.2.187","TLSv1.3","1790","Application Data"
"238","10.035914800","151.101.2.187","100.84.170.161","TCP","56","443  >  64433 [ACK] Seq=22452 Ack=72821 Win=144384 Len=0"
"239","10.038542000","151.101.2.187","100.84.170.161","TCP","56","443  >  64433 [ACK] Seq=22452 Ack=73611 Win=144384 Len=0"
"240","10.039104900","151.101.2.187","100.84.170.161","TCP","56","443  >  64433 [ACK] Seq=22452 Ack=75347 Win=144384 Len=0"
"241","10.039627900","151.101.2.187","100.84.170.161","TLSv1.3","783","Application Data"
"242","10.041574400","151.101.2.187","100.84.170.161","TLSv1.3","738","Application Data"
"243","10.041665000","100.84.170.161","151.101.2.187","TCP","54","64433  >  443 [ACK] Seq=75347 Ack=23865 Win=131328 Len=0"
"244","10.041970400","151.101.2.187","100.84.170.161","TLSv1.3","139","Application Data"
"245","10.042644100","151.101.2.187","100.84.170.161","TLSv1.3","534","Application Data"
"246","10.042715900","100.84.170.161","151.101.2.187","TCP","54","64433  >  443 [ACK] Seq=75347 Ack=24430 Win=130816 Len=0"
"247","10.722850700","100.84.170.161","151.101.2.187","TLSv1.3","836","Application Data"
"248","10.731995700","151.101.2.187","100.84.170.161","TCP","56","443  >  64433 [ACK] Seq=24430 Ack=76129 Win=145408 Len=0"
"249","10.734903300","151.101.2.187","100.84.170.161","TLSv1.3","928","Application Data"
"250","10.759827700","151.101.2.187","100.84.170.161","TCP","928","[TCP Retransmission] 443  >  64433 [PSH, ACK] Seq=24430 Ack=76129 Win=145920 Len=874"
"251","10.759879600","100.84.170.161","151.101.2.187","TCP","66","64433  >  443 [ACK] Seq=76129 Ack=25304 Win=129792 Len=0 SLE=24430 SRE=25304"
"252","13.391278400","100.84.170.161","151.101.66.187","TCP","66","50935  >  443 [SYN] Seq=0 Win=64240 Len=0 MSS=1460 WS=256 SACK_PERM"
"253","13.406748400","151.101.66.187","100.84.170.161","TCP","66","443  >  50935 [SYN, ACK] Seq=0 Ack=1 Win=65535 Len=0 MSS=1460 SACK_PERM WS=512"
"254","13.406863800","100.84.170.161","151.101.66.187","TCP","54","50935  >  443 [ACK] Seq=1 Ack=1 Win=131328 Len=0"
"255","13.407766500","100.84.170.161","151.101.66.187","TLSv1.3","1843","Client Hello (SNI=r2d2.target.com)"
"256","13.417560000","151.101.66.187","100.84.170.161","TCP","56","443  >  50935 [ACK] Seq=1 Ack=1790 Win=144384 Len=0"
"257","13.419227200","151.101.66.187","100.84.170.161","TLSv1.3","1510","Server Hello, Change Cipher Spec, Application Data"
"258","13.419626300","151.101.66.187","100.84.170.161","TCP","1510","443  >  50935 [ACK] Seq=1457 Ack=1790 Win=144384 Len=1456 [TCP PDU reassembled in 261]"
"259","13.419679800","100.84.170.161","151.101.66.187","TCP","54","50935  >  443 [ACK] Seq=1790 Ack=2913 Win=131328 Len=0"
"260","13.420126200","151.101.66.187","100.84.170.161","TCP","4422","443  >  50935 [PSH, ACK] Seq=2913 Ack=1790 Win=144384 Len=4368 [TCP PDU reassembled in 261]"
"261","13.420126200","151.101.66.187","100.84.170.161","TLSv1.3","675","Application Data, Application Data, Application Data, Application Data"
"262","13.420244500","100.84.170.161","151.101.66.187","TCP","54","50935  >  443 [ACK] Seq=1790 Ack=7902 Win=131328 Len=0"
"263","13.424209700","100.84.170.161","151.101.66.187","TLSv1.3","118","Change Cipher Spec, Application Data"
"264","13.424786900","100.84.170.161","151.101.66.187","TLSv1.3","146","Application Data"
"265","13.425095500","100.84.170.161","151.101.66.187","TLSv1.3","597","Application Data"
"266","13.433851800","151.101.66.187","100.84.170.161","TCP","56","443  >  50935 [ACK] Seq=7902 Ack=1854 Win=144384 Len=0"
"267","13.434091500","151.101.66.187","100.84.170.161","TLSv1.3","119","Application Data"
"268","13.434416600","100.84.170.161","151.101.66.187","TLSv1.3","85","Application Data"
"269","13.434646200","151.101.66.187","100.84.170.161","TCP","56","443  >  50935 [ACK] Seq=7967 Ack=2489 Win=143872 Len=0"
"270","13.444367100","151.101.66.187","100.84.170.161","TCP","56","443  >  50935 [ACK] Seq=7967 Ack=2520 Win=143872 Len=0"
"271","13.485884300","151.101.66.187","100.84.170.161","TLSv1.3","512","Application Data"
"272","13.486624800","151.101.66.187","100.84.170.161","TLSv1.3","761","Application Data"
"273","13.486722300","100.84.170.161","151.101.66.187","TCP","54","50935  >  443 [ACK] Seq=2520 Ack=9132 Win=130048 Len=0"
"274","22.615861400","100.84.170.161","151.101.2.187","TLSv1.3","1901","Application Data"
"275","22.615993000","100.84.170.161","151.101.2.187","TLSv1.3","93","Application Data"
"276","22.625711300","151.101.2.187","100.84.170.161","TCP","56","443  >  64433 [ACK] Seq=25304 Ack=78015 Win=144384 Len=0"
"277","22.625996600","151.101.2.187","100.84.170.161","TLSv1.3","93","Application Data"
"278","22.649849500","151.101.2.187","100.84.170.161","TCP","93","[TCP Retransmission] 443  >  64433 [PSH, ACK] Seq=25304 Ack=78015 Win=145920 Len=39"
"279","22.649893700","100.84.170.161","151.101.2.187","TCP","66","64433  >  443 [ACK] Seq=78015 Ack=25343 Win=131328 Len=0 SLE=25304 SRE=25343"
"280","23.079228500","151.101.2.187","100.84.170.161","TLSv1.3","428","Application Data"
"281","23.079614100","151.101.2.187","100.84.170.161","TLSv1.3","1510","Application Data"
"282","23.079679900","100.84.170.161","151.101.2.187","TCP","54","64433  >  443 [ACK] Seq=78015 Ack=27173 Win=131328 Len=0"
"283","23.080075200","151.101.2.187","100.84.170.161","TLSv1.3","5878","Application Data, Application Data, Application Data, Application Data"
"284","23.080160600","100.84.170.161","151.101.2.187","TCP","54","64433  >  443 [ACK] Seq=78015 Ack=32997 Win=131328 Len=0"
"285","23.080639400","151.101.2.187","100.84.170.161","TLSv1.3","7334","Application Data, Application Data, Application Data, Application Data, Application Data"
"286","23.080714700","100.84.170.161","151.101.2.187","TCP","54","64433  >  443 [ACK] Seq=78015 Ack=40277 Win=131328 Len=0"
"287","23.081538900","151.101.2.187","100.84.170.161","TLSv1.3","7334","Application Data, Application Data, Application Data, Application Data, Application Data"
"288","23.081623700","100.84.170.161","151.101.2.187","TCP","54","64433  >  443 [ACK] Seq=78015 Ack=47557 Win=131328 Len=0"
"289","23.082391900","151.101.2.187","100.84.170.161","TLSv1.3","7334","Application Data, Application Data, Application Data, Application Data, Application Data"
"290","23.082470200","100.84.170.161","151.101.2.187","TCP","54","64433  >  443 [ACK] Seq=78015 Ack=54837 Win=131328 Len=0"
"291","23.083710200","151.101.2.187","100.84.170.161","TLSv1.3","7334","Application Data, Application Data, Application Data, Application Data, Application Data, Application Data"
"292","23.083790900","100.84.170.161","151.101.2.187","TCP","54","64433  >  443 [ACK] Seq=78015 Ack=62117 Win=131328 Len=0"
"293","23.083981200","100.84.170.161","151.101.2.187","TLSv1.3","89","Application Data"
"294","23.084192100","151.101.2.187","100.84.170.161","TLSv1.3","5878","Application Data, Application Data, Application Data, Application Data"
"295","23.084244300","100.84.170.161","151.101.2.187","TCP","54","64433  >  443 [ACK] Seq=78050 Ack=67941 Win=131328 Len=0"
"296","23.089746600","151.101.2.187","100.84.170.161","TLSv1.3","1510","Application Data"
"297","23.090099300","151.101.2.187","100.84.170.161","TLSv1.3","1510","Application Data"
"298","23.090160800","100.84.170.161","151.101.2.187","TCP","54","64433  >  443 [ACK] Seq=78050 Ack=70853 Win=131328 Len=0"
"299","23.090471000","151.101.2.187","100.84.170.161","TLSv1.3","1510","Application Data, Application Data"
"300","23.090471000","151.101.2.187","100.84.170.161","TLSv1.3","451","Application Data"
"301","23.090547000","100.84.170.161","151.101.2.187","TCP","54","64433  >  443 [ACK] Seq=78050 Ack=72706 Win=131328 Len=0"
"302","23.093826900","151.101.2.187","100.84.170.161","TCP","56","443  >  64433 [ACK] Seq=72706 Ack=78050 Win=145920 Len=0"
"303","23.540689600","100.84.170.161","151.101.2.187","TLSv1.3","997","Application Data"
"304","23.546089800","100.84.170.161","151.101.2.187","TLSv1.3","1753","Application Data"
"305","23.546525100","100.84.170.161","151.101.2.187","TLSv1.3","1023","Application Data"
"306","23.550814000","151.101.2.187","100.84.170.161","TCP","56","443  >  64433 [ACK] Seq=72706 Ack=78993 Win=145408 Len=0"
"307","23.552774400","151.101.2.187","100.84.170.161","TLSv1.3","130","Application Data"
"308","23.556011100","151.101.2.187","100.84.170.161","TCP","56","443  >  64433 [ACK] Seq=72782 Ack=81661 Win=144384 Len=0"
"309","23.558308000","151.101.2.187","100.84.170.161","TLSv1.3","130","Application Data"
"310","23.558462500","100.84.170.161","151.101.2.187","TCP","54","64433  >  443 [ACK] Seq=81661 Ack=72858 Win=131072 Len=0"
"311","23.558752500","151.101.2.187","100.84.170.161","TLSv1.3","129","Application Data"
"312","23.576478300","100.84.170.161","151.101.2.187","TLSv1.3","1704","Application Data"
"313","23.578592500","100.84.170.161","151.101.2.187","TLSv1.3","997","Application Data"
"314","23.578869800","100.84.170.161","151.101.2.187","TLSv1.3","1776","Application Data"
"315","23.585823700","151.101.2.187","100.84.170.161","TCP","56","443  >  64433 [ACK] Seq=72933 Ack=83311 Win=144384 Len=0"
"316","23.589369400","151.101.2.187","100.84.170.161","TLSv1.3","174","Application Data"
"317","23.589776800","151.101.2.187","100.84.170.161","TLSv1.3","255","Application Data"
"318","23.589929500","100.84.170.161","151.101.2.187","TCP","54","64433  >  443 [ACK] Seq=85976 Ack=73254 Win=130816 Len=0"
"319","23.590197200","151.101.2.187","100.84.170.161","TCP","56","443  >  64433 [ACK] Seq=73254 Ack=85976 Win=144384 Len=0"
"320","23.593030500","151.101.2.187","100.84.170.161","TLSv1.3","131","Application Data"
"321","23.593315600","151.101.2.187","100.84.170.161","TLSv1.3","130","Application Data"
"322","23.593353100","100.84.170.161","151.101.2.187","TCP","54","64433  >  443 [ACK] Seq=85976 Ack=73407 Win=130560 Len=0"
"323","23.729807000","100.84.170.161","151.101.2.187","TLSv1.3","1001","Application Data"
"324","23.740051800","151.101.2.187","100.84.170.161","TCP","56","443  >  64433 [ACK] Seq=73407 Ack=86923 Win=145408 Len=0"
"325","23.742223300","151.101.2.187","100.84.170.161","TLSv1.3","446","Application Data"
"326","23.769736400","151.101.2.187","100.84.170.161","TCP","446","[TCP Retransmission] 443  >  64433 [PSH, ACK] Seq=73407 Ack=86923 Win=145920 Len=392"
"327","23.769782600","100.84.170.161","151.101.2.187","TCP","66","64433  >  443 [ACK] Seq=86923 Ack=73799 Win=130304 Len=0 SLE=73407 SRE=73799"
"328","25.162799000","100.84.170.161","151.101.66.187","TLSv1.3","248","Application Data"
"329","25.162924700","100.84.170.161","151.101.66.187","TLSv1.3","93","Application Data"
"330","25.171902900","151.101.66.187","100.84.170.161","TCP","56","443  >  50935 [ACK] Seq=9132 Ack=2714 Win=143872 Len=0"
"331","25.172641900","151.101.66.187","100.84.170.161","TCP","56","443  >  50935 [ACK] Seq=9132 Ack=2753 Win=143872 Len=0"
"332","25.173028200","151.101.66.187","100.84.170.161","TLSv1.3","93","Application Data"
"333","25.175151200","100.84.170.161","151.101.2.187","TLSv1.3","1836","Application Data"
"334","25.184363500","151.101.2.187","100.84.170.161","TCP","56","443  >  64433 [ACK] Seq=73799 Ack=88705 Win=144384 Len=0"
"335","25.199711100","151.101.66.187","100.84.170.161","TCP","93","[TCP Retransmission] 443  >  50935 [PSH, ACK] Seq=9132 Ack=2753 Win=143872 Len=39"
"336","25.199758800","100.84.170.161","151.101.66.187","TCP","66","50935  >  443 [ACK] Seq=2753 Ack=9171 Win=130048 Len=0 SLE=9132 SRE=9171"
"337","25.227720800","151.101.66.187","100.84.170.161","TLSv1.3","271","Application Data"
"338","25.228039100","151.101.66.187","100.84.170.161","TLSv1.3","744","Application Data"
"339","25.228137000","100.84.170.161","151.101.66.187","TCP","54","50935  >  443 [ACK] Seq=2753 Ack=10078 Win=131328 Len=0"
"340","25.229080300","100.84.170.161","151.101.66.187","TLSv1.3","89","Application Data"
"341","25.232816200","151.101.2.187","100.84.170.161","TLSv1.3","450","Application Data"
"342","25.233229600","151.101.2.187","100.84.170.161","TLSv1.3","353","Application Data"
"343","25.233328500","100.84.170.161","151.101.2.187","TCP","54","64433  >  443 [ACK] Seq=88705 Ack=74494 Win=131328 Len=0"
"344","25.238494000","151.101.66.187","100.84.170.161","TCP","56","443  >  50935 [ACK] Seq=10078 Ack=2788 Win=143872 Len=0"
"345","25.605094300","100.84.170.161","151.101.2.187","TLSv1.3","983","Application Data"
"346","25.611197200","100.84.170.161","151.101.2.187","TLSv1.3","1753","Application Data"
"347","25.614537900","151.101.2.187","100.84.170.161","TCP","56","443  >  64433 [ACK] Seq=74494 Ack=89634 Win=145408 Len=0"
"348","25.618209400","151.101.2.187","100.84.170.161","TLSv1.3","217","Application Data"
"349","25.620275100","151.101.2.187","100.84.170.161","TCP","56","443  >  64433 [ACK] Seq=74657 Ack=91333 Win=144384 Len=0"
"350","25.623509200","151.101.2.187","100.84.170.161","TLSv1.3","124","Application Data"
"351","25.623601000","100.84.170.161","151.101.2.187","TCP","54","64433  >  443 [ACK] Seq=91333 Ack=74727 Win=131072 Len=0"
"352","27.640381400","100.84.170.161","151.101.2.187","TLSv1.3","679","Application Data"
"353","27.651142000","151.101.2.187","100.84.170.161","TCP","56","443  >  64433 [ACK] Seq=74727 Ack=91958 Win=145408 Len=0"
"354","27.701306900","151.101.2.187","100.84.170.161","TLSv1.3","501","Application Data"
"355","27.728885200","151.101.2.187","100.84.170.161","TCP","501","[TCP Retransmission] 443  >  64433 [PSH, ACK] Seq=74727 Ack=91958 Win=145920 Len=447"
"356","27.728932700","100.84.170.161","151.101.2.187","TCP","66","64433  >  443 [ACK] Seq=91958 Ack=75174 Win=130560 Len=0 SLE=74727 SRE=75174"
"357","27.882220800","100.84.170.161","151.101.2.187","TLSv1.3","1992","Application Data"
"358","27.882844500","100.84.170.161","151.101.2.187","TLSv1.3","721","Application Data"
"359","27.885061000","100.84.170.161","151.101.2.187","TLSv1.3","2016","Application Data"
"360","27.885770200","100.84.170.161","151.101.2.187","TLSv1.3","711","Application Data"
"361","27.885957000","100.84.170.161","151.101.2.187","TLSv1.3","2029","Application Data"
"362","27.888428400","100.84.170.161","151.101.2.187","TLSv1.3","705","Application Data"
"363","27.888944600","100.84.170.161","151.101.2.187","TLSv1.3","2019","Application Data"
"364","27.891878600","151.101.2.187","100.84.170.161","TCP","56","443  >  64433 [ACK] Seq=75174 Ack=93896 Win=144384 Len=0"
"365","27.892701300","151.101.2.187","100.84.170.161","TCP","56","443  >  64433 [ACK] Seq=75174 Ack=94563 Win=144384 Len=0"
"366","27.894342900","151.101.2.187","100.84.170.161","TLSv1.3","261","Application Data"
"367","27.894807800","151.101.2.187","100.84.170.161","TLSv1.3","265","Application Data"
"368","27.894859300","100.84.170.161","151.101.2.187","TCP","54","64433  >  443 [ACK] Seq=101773 Ack=75592 Win=130048 Len=0"
"369","27.895581300","151.101.2.187","100.84.170.161","TCP","56","443  >  64433 [ACK] Seq=75592 Ack=97182 Win=144384 Len=0"
"370","27.895930100","151.101.2.187","100.84.170.161","TCP","56","443  >  64433 [ACK] Seq=75592 Ack=99157 Win=142848 Len=0"
"371","27.898002700","151.101.2.187","100.84.170.161","TCP","56","443  >  64433 [ACK] Seq=75592 Ack=99808 Win=144384 Len=0"
"372","27.898287700","151.101.2.187","100.84.170.161","TLSv1.3","190","Application Data"
"373","27.898746600","151.101.2.187","100.84.170.161","TLSv1.3","130","Application Data"
"374","27.898795800","100.84.170.161","151.101.2.187","TCP","54","64433  >  443 [ACK] Seq=101773 Ack=75804 Win=130048 Len=0"
"375","27.900150500","151.101.2.187","100.84.170.161","TLSv1.3","130","Application Data"
"376","27.901217600","151.101.2.187","100.84.170.161","TLSv1.3","131","Application Data"
"377","27.901272100","100.84.170.161","151.101.2.187","TCP","54","64433  >  443 [ACK] Seq=101773 Ack=75957 Win=131328 Len=0"
"378","27.902523900","100.84.170.161","151.101.2.187","TLSv1.3","709","Application Data"
"379","27.911678700","151.101.2.187","100.84.170.161","TCP","56","443  >  64433 [ACK] Seq=75957 Ack=102428 Win=145408 Len=0"
"380","27.914190400","151.101.2.187","100.84.170.161","TLSv1.3","131","Application Data"
"381","27.932531500","100.84.170.161","151.101.2.187","TLSv1.3","2026","Application Data"
"382","27.940827300","151.101.2.187","100.84.170.161","TCP","131","[TCP Spurious Retransmission] 443  >  64433 [PSH, ACK] Seq=75957 Ack=102428 Win=145920 Len=77"
"383","27.940869500","100.84.170.161","151.101.2.187","TCP","66","[TCP Dup ACK 381#1] 64433  >  443 [ACK] Seq=104400 Ack=76034 Win=131072 Len=0 SLE=75957 SRE=76034"
"384","27.941824500","151.101.2.187","100.84.170.161","TCP","56","443  >  64433 [ACK] Seq=76034 Ack=104400 Win=144384 Len=0"
"385","27.944430500","151.101.2.187","100.84.170.161","TLSv1.3","98","Application Data"
"386","27.971786500","151.101.2.187","100.84.170.161","TCP","98","[TCP Retransmission] 443  >  64433 [PSH, ACK] Seq=76034 Ack=104400 Win=145920 Len=44"
"387","27.971829400","100.84.170.161","151.101.2.187","TCP","66","64433  >  443 [ACK] Seq=104400 Ack=76078 Win=131072 Len=0 SLE=76034 SRE=76078"
"388","29.625903300","100.84.170.161","151.101.66.187","TLSv1.3","254","Application Data"
"389","29.637511400","151.101.66.187","100.84.170.161","TCP","56","443  >  50935 [ACK] Seq=10078 Ack=2988 Win=143872 Len=0"
"390","29.687699800","151.101.66.187","100.84.170.161","TLSv1.3","927","Application Data"
"391","29.715369300","151.101.66.187","100.84.170.161","TCP","927","[TCP Retransmission] 443  >  50935 [PSH, ACK] Seq=10078 Ack=2988 Win=143872 Len=873"
"392","29.715435000","100.84.170.161","151.101.66.187","TCP","66","50935  >  443 [ACK] Seq=2988 Ack=10951 Win=130304 Len=0 SLE=10078 SRE=10951"
"393","31.825297800","100.84.170.161","151.101.66.187","TLSv1.3","250","Application Data"
"394","31.835100600","151.101.66.187","100.84.170.161","TCP","56","443  >  50935 [ACK] Seq=10951 Ack=3184 Win=143872 Len=0"
"395","31.881332400","151.101.66.187","100.84.170.161","TLSv1.3","244","Application Data"
"396","31.881667600","151.101.66.187","100.84.170.161","TLSv1.3","758","Application Data"
"397","31.881717100","100.84.170.161","151.101.66.187","TCP","54","50935  >  443 [ACK] Seq=3184 Ack=11845 Win=131328 Len=0"
"398","31.882991600","100.84.170.161","151.101.66.187","TLSv1.3","89","Application Data"
"399","31.892183200","151.101.66.187","100.84.170.161","TCP","56","443  >  50935 [ACK] Seq=11845 Ack=3219 Win=143872 Len=0"
"400","32.901503600","100.84.170.161","151.101.2.187","TLSv1.3","765","Application Data"
"401","32.912555200","151.101.2.187","100.84.170.161","TCP","56","443  >  64433 [ACK] Seq=76078 Ack=105111 Win=145408 Len=0"
"402","32.965848700","151.101.2.187","100.84.170.161","TLSv1.3","339","Application Data"
"403","32.966161900","151.101.2.187","100.84.170.161","TLSv1.3","357","Application Data"
"404","32.966213500","100.84.170.161","151.101.2.187","TCP","54","64433  >  443 [ACK] Seq=105111 Ack=76666 Win=130560 Len=0"
"405","32.967616700","100.84.170.161","151.101.2.187","TLSv1.3","89","Application Data"
"406","32.976993600","151.101.2.187","100.84.170.161","TCP","56","443  >  64433 [ACK] Seq=76666 Ack=105146 Win=145920 Len=0"
"407","34.916442200","100.84.170.161","151.101.66.187","TLSv1.3","247","Application Data"
"408","34.927675300","151.101.66.187","100.84.170.161","TCP","56","443  >  50935 [ACK] Seq=11845 Ack=3412 Win=143872 Len=0"
"409","34.978488200","151.101.66.187","100.84.170.161","TLSv1.3","480","Application Data"
"410","34.978723500","151.101.66.187","100.84.170.161","TLSv1.3","758","Application Data"
"411","34.978777800","100.84.170.161","151.101.66.187","TCP","54","50935  >  443 [ACK] Seq=3412 Ack=12975 Win=130048 Len=0"
"412","38.387132900","100.84.170.161","151.101.2.187","TLSv1.3","2082","Application Data"
"413","38.389233700","100.84.170.161","151.101.2.187","TLSv1.3","434","Application Data"
"414","38.398246300","151.101.2.187","100.84.170.161","TCP","56","443  >  64433 [ACK] Seq=76666 Ack=107554 Win=144384 Len=0"
"415","38.417961200","151.101.2.187","100.84.170.161","TLSv1.3","495","Application Data"
"416","38.443758600","151.101.2.187","100.84.170.161","TCP","495","[TCP Retransmission] 443  >  64433 [PSH, ACK] Seq=76666 Ack=107554 Win=145920 Len=441"
"417","38.443797100","100.84.170.161","151.101.2.187","TCP","66","64433  >  443 [ACK] Seq=107554 Ack=77107 Win=130048 Len=0 SLE=76666 SRE=77107"
"418","39.185630500","100.84.170.161","151.101.2.187","TLSv1.3","2092","Application Data"
"419","39.196661900","151.101.2.187","100.84.170.161","TCP","56","443  >  64433 [ACK] Seq=77107 Ack=109592 Win=144384 Len=0"
"420","39.200363100","151.101.2.187","100.84.170.161","TLSv1.3","240","Application Data"
"421","39.226649700","151.101.2.187","100.84.170.161","TCP","240","[TCP Retransmission] 443  >  64433 [PSH, ACK] Seq=77107 Ack=109592 Win=145920 Len=186"
"422","39.226691300","100.84.170.161","151.101.2.187","TCP","66","64433  >  443 [ACK] Seq=109592 Ack=77293 Win=130048 Len=0 SLE=77107 SRE=77293"
"423","39.294792400","100.84.170.161","151.101.2.187","TLSv1.3","464","Application Data"
"424","39.303940700","151.101.2.187","100.84.170.161","TCP","56","443  >  64433 [ACK] Seq=77293 Ack=110002 Win=145920 Len=0"
"425","39.306182200","151.101.2.187","100.84.170.161","TLSv1.3","136","Application Data"
"426","39.331493200","151.101.2.187","100.84.170.161","TCP","136","[TCP Retransmission] 443  >  64433 [PSH, ACK] Seq=77293 Ack=110002 Win=145920 Len=82"
"427","39.331557400","100.84.170.161","151.101.2.187","TCP","66","64433  >  443 [ACK] Seq=110002 Ack=77375 Win=129792 Len=0 SLE=77293 SRE=77375"
"428","39.737381800","100.84.170.161","151.101.2.187","TLSv1.3","2081","Application Data"
"429","39.748917600","151.101.2.187","100.84.170.161","TCP","56","443  >  64433 [ACK] Seq=77375 Ack=112029 Win=144384 Len=0"
"430","39.751533300","151.101.2.187","100.84.170.161","TLSv1.3","234","Application Data"
"431","39.776712900","151.101.2.187","100.84.170.161","TCP","234","[TCP Retransmission] 443  >  64433 [PSH, ACK] Seq=77375 Ack=112029 Win=145920 Len=180"
"432","39.776816000","100.84.170.161","151.101.2.187","TCP","66","64433  >  443 [ACK] Seq=112029 Ack=77555 Win=131328 Len=0 SLE=77375 SRE=77555"
"433","40.054979600","100.84.170.161","151.101.2.187","TLSv1.3","464","Application Data"
"434","40.064164800","151.101.2.187","100.84.170.161","TCP","56","443  >  64433 [ACK] Seq=77555 Ack=112439 Win=145920 Len=0"
"435","40.067506100","151.101.2.187","100.84.170.161","TLSv1.3","98","Application Data"
"436","40.092683500","151.101.2.187","100.84.170.161","TCP","98","[TCP Retransmission] 443  >  64433 [PSH, ACK] Seq=77555 Ack=112439 Win=145920 Len=44"
"437","40.092734400","100.84.170.161","151.101.2.187","TCP","66","64433  >  443 [ACK] Seq=112439 Ack=77599 Win=131328 Len=0 SLE=77555 SRE=77599"
"438","40.398771000","151.101.2.187","100.84.170.161","TCP","98","[TCP Spurious Retransmission] 443  >  64433 [PSH, ACK] Seq=77555 Ack=112439 Win=145920 Len=44"
"439","40.398826500","100.84.170.161","151.101.2.187","TCP","66","[TCP Dup ACK 437#1] 64433  >  443 [ACK] Seq=112439 Ack=77599 Win=131328 Len=0 SLE=77555 SRE=77599"
"440","40.508163000","100.84.170.161","151.101.2.187","TLSv1.3","2033","Application Data"
"441","40.519142400","151.101.2.187","100.84.170.161","TCP","56","443  >  64433 [ACK] Seq=77599 Ack=114418 Win=144384 Len=0"
"442","40.521528600","151.101.2.187","100.84.170.161","TLSv1.3","174","Application Data"
"443","40.521760700","151.101.2.187","100.84.170.161","TLSv1.3","439","Application Data"
"444","40.521803100","100.84.170.161","151.101.2.187","TCP","54","64433  >  443 [ACK] Seq=114418 Ack=78104 Win=130816 Len=0"
"445","40.523406600","100.84.170.161","151.101.2.187","TLSv1.3","89","Application Data"
"446","40.532984200","151.101.2.187","100.84.170.161","TCP","56","443  >  64433 [ACK] Seq=78104 Ack=114453 Win=145920 Len=0"
"447","44.393033400","100.84.170.161","151.101.2.187","TLSv1.3","543","Application Data"
"448","44.402702200","151.101.2.187","100.84.170.161","TCP","56","443  >  64433 [ACK] Seq=78104 Ack=114942 Win=145920 Len=0"
"449","44.405144700","151.101.2.187","100.84.170.161","TLSv1.3","214","Application Data"
"450","44.431571400","151.101.2.187","100.84.170.161","TCP","214","[TCP Retransmission] 443  >  64433 [PSH, ACK] Seq=78104 Ack=114942 Win=145920 Len=160"
"451","44.431637600","100.84.170.161","151.101.2.187","TCP","66","64433  >  443 [ACK] Seq=114942 Ack=78264 Win=130560 Len=0 SLE=78104 SRE=78264"
"452","44.978164900","100.84.170.161","151.101.2.187","TLSv1.3","2010","Application Data"
"453","44.980653600","100.84.170.161","151.101.2.187","TLSv1.3","540","Application Data"
"454","44.982953500","100.84.170.161","151.101.2.187","TLSv1.3","2015","Application Data"
"455","44.989023800","151.101.2.187","100.84.170.161","TCP","56","443  >  64433 [ACK] Seq=78264 Ack=116898 Win=144384 Len=0"
"456","44.989467000","100.84.170.161","151.101.2.187","TLSv1.3","553","Application Data"
"457","44.990344000","151.101.2.187","100.84.170.161","TCP","56","443  >  64433 [ACK] Seq=78264 Ack=117384 Win=144384 Len=0"
"458","44.992179600","151.101.2.187","100.84.170.161","TCP","56","443  >  64433 [ACK] Seq=78264 Ack=119345 Win=144384 Len=0"
"459","44.992800100","100.84.170.161","151.101.2.187","TLSv1.3","1965","Application Data"
"460","44.993903200","151.101.2.187","100.84.170.161","TLSv1.3","262","Application Data"
"461","44.994699700","151.101.2.187","100.84.170.161","TLSv1.3","130","Application Data"
"462","44.994764600","100.84.170.161","151.101.2.187","TCP","54","64433  >  443 [ACK] Seq=121755 Ack=78548 Win=130304 Len=0"
"463","44.998863800","151.101.2.187","100.84.170.161","TCP","56","443  >  64433 [ACK] Seq=78548 Ack=119844 Win=145920 Len=0"
"464","45.002225700","151.101.2.187","100.84.170.161","TLSv1.3","98","Application Data"
"465","45.004711200","151.101.2.187","100.84.170.161","TLSv1.3","199","Application Data"
"466","45.004768400","100.84.170.161","151.101.2.187","TCP","54","64433  >  443 [ACK] Seq=121755 Ack=78737 Win=130048 Len=0"
"467","45.005103800","151.101.2.187","100.84.170.161","TLSv1.3","309","Application Data"
"468","45.042026600","151.101.2.187","100.84.170.161","TCP","309","[TCP Retransmission] 443  >  64433 [PSH, ACK] Seq=78737 Ack=121755 Win=145920 Len=255"
"469","45.042063500","100.84.170.161","151.101.2.187","TCP","66","64433  >  443 [ACK] Seq=121755 Ack=78992 Win=129792 Len=0 SLE=78737 SRE=78992"
"470","45.139534400","100.84.170.161","151.101.2.187","TLSv1.3","556","Application Data"
"471","45.151056100","151.101.2.187","100.84.170.161","TCP","56","443  >  64433 [ACK] Seq=78992 Ack=122257 Win=145920 Len=0"
"472","45.152082800","151.101.2.187","100.84.170.161","TLSv1.3","291","Application Data"
"473","45.178226500","151.101.2.187","100.84.170.161","TCP","291","[TCP Retransmission] 443  >  64433 [PSH, ACK] Seq=78992 Ack=122257 Win=145920 Len=237"
"474","45.178280700","100.84.170.161","151.101.2.187","TCP","66","64433  >  443 [ACK] Seq=122257 Ack=79229 Win=131328 Len=0 SLE=78992 SRE=79229"
"475","45.277821100","100.84.170.161","151.101.2.187","TLSv1.3","2029","Application Data"
"476","45.279308300","100.84.170.161","151.101.2.187","TLSv1.3","501","Application Data"
"477","45.279553100","100.84.170.161","151.101.2.187","TLSv1.3","2036","Application Data"
"478","45.279681700","100.84.170.161","151.101.2.187","TLSv1.3","504","Application Data"
"479","45.288194000","151.101.2.187","100.84.170.161","TCP","56","443  >  64433 [ACK] Seq=79229 Ack=124232 Win=144384 Len=0"
"480","45.288842600","151.101.2.187","100.84.170.161","TCP","56","443  >  64433 [ACK] Seq=79229 Ack=124679 Win=144384 Len=0"
"481","45.289644900","151.101.2.187","100.84.170.161","TCP","56","443  >  64433 [ACK] Seq=79229 Ack=127111 Win=144384 Len=0"
"482","45.290813400","151.101.2.187","100.84.170.161","TLSv1.3","124","Application Data"
"483","45.291274500","151.101.2.187","100.84.170.161","TLSv1.3","130","Application Data"
"484","45.291315000","100.84.170.161","151.101.2.187","TCP","54","64433  >  443 [ACK] Seq=127111 Ack=79375 Win=131072 Len=0"
"485","45.292647500","151.101.2.187","100.84.170.161","TLSv1.3","135","Application Data"
"486","45.293744300","151.101.2.187","100.84.170.161","TLSv1.3","124","Application Data"
"487","45.293817300","100.84.170.161","151.101.2.187","TCP","54","64433  >  443 [ACK] Seq=127111 Ack=79526 Win=131072 Len=0"
"488","45.549580700","100.84.170.161","151.101.2.187","TLSv1.3","2112","Application Data"
"489","45.573239400","100.84.170.161","151.101.2.187","TCP","1514","[TCP Retransmission] 64433  >  443 [PSH, ACK] Seq=127709 Ack=79526 Win=131072 Len=1460"
"490","45.602095900","151.101.2.187","100.84.170.161","TCP","56","443  >  64433 [ACK] Seq=79526 Ack=129169 Win=144384 Len=0"
"491","45.602328600","151.101.2.187","100.84.170.161","TLSv1.3","131","Application Data"
"492","45.605745800","151.101.2.187","100.84.170.161","TCP","66","[TCP Dup ACK 490#1] 443  >  64433 [ACK] Seq=79603 Ack=129169 Win=145920 Len=0 SLE=127709 SRE=129169"
"493","45.613619900","151.101.2.187","100.84.170.161","TCP","131","[TCP Retransmission] 443  >  64433 [PSH, ACK] Seq=79526 Ack=129169 Win=145920 Len=77"
"494","45.613662500","100.84.170.161","151.101.2.187","TCP","66","64433  >  443 [ACK] Seq=129169 Ack=79603 Win=130816 Len=0 SLE=79526 SRE=79603"
"495","45.715109500","100.84.170.161","151.101.2.187","TLSv1.3","542","Application Data"
"496","45.724486900","151.101.2.187","100.84.170.161","TCP","56","443  >  64433 [ACK] Seq=79603 Ack=129657 Win=145920 Len=0"
"497","45.728578800","151.101.2.187","100.84.170.161","TLSv1.3","240","Application Data"
"498","45.755582800","151.101.2.187","100.84.170.161","TCP","240","[TCP Retransmission] 443  >  64433 [PSH, ACK] Seq=79603 Ack=129657 Win=145920 Len=186"
"499","45.755629500","100.84.170.161","151.101.2.187","TCP","66","64433  >  443 [ACK] Seq=129657 Ack=79789 Win=130816 Len=0 SLE=79603 SRE=79789"
"500","46.194908300","100.84.170.161","151.101.2.187","TLSv1.3","2090","Application Data"
"501","46.204213800","151.101.2.187","100.84.170.161","TCP","56","443  >  64433 [ACK] Seq=79789 Ack=131693 Win=144384 Len=0"
"502","46.207414000","151.101.2.187","100.84.170.161","TLSv1.3","131","Application Data"
"503","46.232916100","151.101.2.187","100.84.170.161","TCP","131","[TCP Retransmission] 443  >  64433 [PSH, ACK] Seq=79789 Ack=131693 Win=145920 Len=77"
"504","46.232962300","100.84.170.161","151.101.2.187","TCP","66","64433  >  443 [ACK] Seq=131693 Ack=79866 Win=130560 Len=0 SLE=79789 SRE=79866"
"505","49.632702100","100.84.170.161","151.101.2.187","TLSv1.3","821","Application Data"
"506","49.642130800","151.101.2.187","100.84.170.161","TCP","56","443  >  64433 [ACK] Seq=79866 Ack=132460 Win=145408 Len=0"
"507","49.645076800","151.101.2.187","100.84.170.161","TLSv1.3","241","Application Data"
"508","49.671798200","151.101.2.187","100.84.170.161","TCP","241","[TCP Retransmission] 443  >  64433 [PSH, ACK] Seq=79866 Ack=132460 Win=145920 Len=187"
"509","49.671842500","100.84.170.161","151.101.2.187","TCP","66","64433  >  443 [ACK] Seq=132460 Ack=80053 Win=130560 Len=0 SLE=79866 SRE=80053"
"510","49.727010600","100.84.170.161","151.101.2.187","TLSv1.3","1857","Application Data"
"511","49.736149400","151.101.2.187","100.84.170.161","TCP","56","443  >  64433 [ACK] Seq=80053 Ack=134263 Win=144384 Len=0"
"512","49.738801700","151.101.2.187","100.84.170.161","TLSv1.3","240","Application Data"
"513","49.764601600","151.101.2.187","100.84.170.161","TCP","240","[TCP Retransmission] 443  >  64433 [PSH, ACK] Seq=80053 Ack=134263 Win=145920 Len=186"
"514","49.764641200","100.84.170.161","151.101.2.187","TCP","66","64433  >  443 [ACK] Seq=134263 Ack=80239 Win=130304 Len=0 SLE=80053 SRE=80239"
"515","49.793133400","100.84.170.161","151.101.2.187","TLSv1.3","789","Application Data"
"516","49.800938200","100.84.170.161","151.101.2.187","TLSv1.3","1857","Application Data"
"517","49.802580400","151.101.2.187","100.84.170.161","TCP","56","443  >  64433 [ACK] Seq=80239 Ack=134998 Win=145408 Len=0"
"518","49.804893500","151.101.2.187","100.84.170.161","TLSv1.3","124","Application Data"
"519","49.810168800","151.101.2.187","100.84.170.161","TCP","56","443  >  64433 [ACK] Seq=80309 Ack=136801 Win=144384 Len=0"
"520","49.812628800","151.101.2.187","100.84.170.161","TLSv1.3","148","Application Data"
"521","49.812694400","100.84.170.161","151.101.2.187","TCP","54","64433  >  443 [ACK] Seq=136801 Ack=80403 Win=130048 Len=0"
"522","49.814828200","100.84.170.161","151.101.2.187","TLSv1.3","815","Application Data"
"523","49.824107100","151.101.2.187","100.84.170.161","TCP","56","443  >  64433 [ACK] Seq=80403 Ack=137562 Win=145408 Len=0"
"524","49.826607600","151.101.2.187","100.84.170.161","TLSv1.3","292","Application Data"
"525","49.854779600","151.101.2.187","100.84.170.161","TCP","292","[TCP Retransmission] 443  >  64433 [PSH, ACK] Seq=80403 Ack=137562 Win=145920 Len=238"
"526","49.854828400","100.84.170.161","151.101.2.187","TCP","66","64433  >  443 [ACK] Seq=137562 Ack=80641 Win=129792 Len=0 SLE=80403 SRE=80641"
"527","49.889538400","100.84.170.161","151.101.2.187","TLSv1.3","1848","Application Data"
"528","49.892303300","100.84.170.161","151.101.2.187","TLSv1.3","821","Application Data"
"529","49.898808300","151.101.2.187","100.84.170.161","TCP","56","443  >  64433 [ACK] Seq=80641 Ack=139356 Win=144384 Len=0"
"530","49.901082100","151.101.2.187","100.84.170.161","TLSv1.3","125","Application Data"
"531","49.901147500","100.84.170.161","151.101.2.187","TCP","54","64433  >  443 [ACK] Seq=140123 Ack=80712 Win=131328 Len=0"
"532","49.902035800","151.101.2.187","100.84.170.161","TCP","56","443  >  64433 [ACK] Seq=80712 Ack=140123 Win=145408 Len=0"
"533","49.904524100","151.101.2.187","100.84.170.161","TLSv1.3","98","Application Data"
"534","49.904607900","100.84.170.161","151.101.2.187","TCP","54","64433  >  443 [ACK] Seq=140123 Ack=80756 Win=131328 Len=0"
"535","50.034242800","100.84.170.161","151.101.2.187","TLSv1.3","1854","Application Data"
"536","50.044015200","151.101.2.187","100.84.170.161","TCP","56","443  >  64433 [ACK] Seq=80756 Ack=141923 Win=144384 Len=0"
"537","50.046476100","151.101.2.187","100.84.170.161","TLSv1.3","131","Application Data"
"538","50.046921600","100.84.170.161","151.101.2.187","TLSv1.3","819","Application Data"
"539","50.048662900","100.84.170.161","151.101.2.187","TLSv1.3","1819","Application Data"
"540","50.048793900","100.84.170.161","151.101.2.187","TLSv1.3","825","Application Data"
"541","50.080907000","151.101.2.187","100.84.170.161","TCP","56","443  >  64433 [ACK] Seq=80833 Ack=142688 Win=145408 Len=0"
"542","50.081094200","151.101.2.187","100.84.170.161","TLSv1.3","130","Application Data"
"543","50.081774500","151.101.2.187","100.84.170.161","TLSv1.3","194","Application Data, Application Data"
"544","50.081834900","100.84.170.161","151.101.2.187","TCP","54","64433  >  443 [ACK] Seq=145224 Ack=81049 Win=130816 Len=0"
"545","50.087482000","151.101.2.187","100.84.170.161","TCP","124","[TCP Spurious Retransmission] 443  >  64433 [PSH, ACK] Seq=80979 Ack=145224 Win=145920 Len=70"
"546","50.087593700","100.84.170.161","151.101.2.187","TCP","66","[TCP Dup ACK 544#1] 64433  >  443 [ACK] Seq=145224 Ack=81049 Win=130816 Len=0 SLE=80979 SRE=81049"
"547","50.117337100","100.84.170.161","151.101.2.187","TLSv1.3","1861","Application Data"
"548","50.126456500","151.101.2.187","100.84.170.161","TCP","56","443  >  64433 [ACK] Seq=81049 Ack=147031 Win=144384 Len=0"
"549","50.129142800","151.101.2.187","100.84.170.161","TLSv1.3","130","Application Data"
"550","50.155891700","151.101.2.187","100.84.170.161","TCP","130","[TCP Retransmission] 443  >  64433 [PSH, ACK] Seq=81049 Ack=147031 Win=145920 Len=76"
"551","50.155933800","100.84.170.161","151.101.2.187","TCP","66","64433  >  443 [ACK] Seq=147031 Ack=81125 Win=130816 Len=0 SLE=81049 SRE=81125"
"552","50.260107900","100.84.170.161","151.101.2.187","TLSv1.3","797","Application Data"
"553","50.262196200","100.84.170.161","151.101.2.187","TLSv1.3","1872","Application Data"
"554","50.269432600","151.101.2.187","100.84.170.161","TCP","56","443  >  64433 [ACK] Seq=81125 Ack=147774 Win=145408 Len=0"
"555","50.271478300","151.101.2.187","100.84.170.161","TCP","56","443  >  64433 [ACK] Seq=81125 Ack=149592 Win=151552 Len=0"
"556","50.272591100","151.101.2.187","100.84.170.161","TLSv1.3","98","Application Data"
"557","50.275488700","151.101.2.187","100.84.170.161","TLSv1.3","98","Application Data"
"558","50.275542900","100.84.170.161","151.101.2.187","TCP","54","64433  >  443 [ACK] Seq=149592 Ack=81213 Win=130816 Len=0"
"559","50.346334300","100.84.170.161","151.101.2.187","TLSv1.3","927","Application Data"
"560","50.355584200","151.101.2.187","100.84.170.161","TCP","56","443  >  64433 [ACK] Seq=81213 Ack=150465 Win=154624 Len=0"
"561","50.413578200","151.101.2.187","100.84.170.161","TLSv1.3","478","Application Data"
"562","50.414014400","151.101.2.187","100.84.170.161","TCP","1510","443  >  64433 [ACK] Seq=81637 Ack=150465 Win=154624 Len=1456 [TCP PDU reassembled in 565]"
"563","50.414170600","100.84.170.161","151.101.2.187","TCP","54","64433  >  443 [ACK] Seq=150465 Ack=83093 Win=131328 Len=0"
"564","50.414602300","151.101.2.187","100.84.170.161","TCP","1510","443  >  64433 [ACK] Seq=83093 Ack=150465 Win=154624 Len=1456 [TCP PDU reassembled in 565]"
"565","50.414602300","151.101.2.187","100.84.170.161","TLSv1.3","204","Application Data"
"566","50.414714700","100.84.170.161","151.101.2.187","TCP","54","64433  >  443 [ACK] Seq=150465 Ack=84699 Win=131328 Len=0"
"567","50.415803700","100.84.170.161","151.101.2.187","TLSv1.3","89","Application Data"
"568","50.425121900","151.101.2.187","100.84.170.161","TCP","56","443  >  64433 [ACK] Seq=84699 Ack=150500 Win=154624 Len=0"
"569","50.527077100","100.84.170.161","151.101.2.187","TLSv1.3","1928","Application Data"
"570","50.536356100","151.101.2.187","100.84.170.161","TCP","56","443  >  64433 [ACK] Seq=84699 Ack=152374 Win=160256 Len=0"
"571","50.539102800","151.101.2.187","100.84.170.161","TLSv1.3","252","Application Data"
"572","50.564737800","151.101.2.187","100.84.170.161","TCP","252","[TCP Retransmission] 443  >  64433 [PSH, ACK] Seq=84699 Ack=152374 Win=160256 Len=198"
"573","50.564788700","100.84.170.161","151.101.2.187","TCP","66","64433  >  443 [ACK] Seq=152374 Ack=84897 Win=131072 Len=0 SLE=84699 SRE=84897"
"574","50.662548800","100.84.170.161","151.101.2.187","TLSv1.3","705","Application Data"
"575","50.672011600","151.101.2.187","100.84.170.161","TCP","56","443  >  64433 [ACK] Seq=84897 Ack=153025 Win=163328 Len=0"
"576","50.674633400","151.101.2.187","100.84.170.161","TLSv1.3","396","Application Data"
"577","50.699593700","151.101.2.187","100.84.170.161","TCP","396","[TCP Retransmission] 443  >  64433 [PSH, ACK] Seq=84897 Ack=153025 Win=163328 Len=342"
"578","50.699658900","100.84.170.161","151.101.2.187","TCP","66","64433  >  443 [ACK] Seq=153025 Ack=85239 Win=130816 Len=0 SLE=84897 SRE=85239"
"579","50.771958000","100.84.170.161","151.101.2.187","TLSv1.3","1950","Application Data"
"580","50.781352400","151.101.2.187","100.84.170.161","TCP","56","443  >  64433 [ACK] Seq=85239 Ack=154921 Win=168960 Len=0"
"581","50.785014700","151.101.2.187","100.84.170.161","TLSv1.3","135","Application Data"
"582","50.810423400","151.101.2.187","100.84.170.161","TCP","135","[TCP Retransmission] 443  >  64433 [PSH, ACK] Seq=85239 Ack=154921 Win=168960 Len=81"
"583","50.810471700","100.84.170.161","151.101.2.187","TCP","66","64433  >  443 [ACK] Seq=154921 Ack=85320 Win=130560 Len=0 SLE=85239 SRE=85320"
"584","50.856902000","100.84.170.161","151.101.2.187","TLSv1.3","716","Application Data"
"585","50.857058400","100.84.170.161","151.101.2.187","TLSv1.3","1932","Application Data"
"586","50.866206900","151.101.2.187","100.84.170.161","TCP","56","443  >  64433 [ACK] Seq=85320 Ack=155583 Win=172032 Len=0"
"587","50.866884200","151.101.2.187","100.84.170.161","TCP","56","443  >  64433 [ACK] Seq=85320 Ack=157461 Win=177664 Len=0"
"588","50.868451400","151.101.2.187","100.84.170.161","TLSv1.3","130","Application Data"
"589","50.869127800","151.101.2.187","100.84.170.161","TLSv1.3","130","Application Data"
"590","50.869194200","100.84.170.161","151.101.2.187","TCP","54","64433  >  443 [ACK] Seq=157461 Ack=85472 Win=130560 Len=0"
"591","50.872263000","100.84.170.161","151.101.2.187","TLSv1.3","762","Application Data"
"592","50.881693100","151.101.2.187","100.84.170.161","TCP","56","443  >  64433 [ACK] Seq=85472 Ack=158169 Win=180736 Len=0"
"593","50.884315400","151.101.2.187","100.84.170.161","TLSv1.3","130","Application Data"
"594","50.909723800","151.101.2.187","100.84.170.161","TCP","130","[TCP Retransmission] 443  >  64433 [PSH, ACK] Seq=85472 Ack=158169 Win=180736 Len=76"
"595","50.909777200","100.84.170.161","151.101.2.187","TCP","66","64433  >  443 [ACK] Seq=158169 Ack=85548 Win=130304 Len=0 SLE=85472 SRE=85548"
"596","50.981921700","100.84.170.161","151.101.2.187","TLSv1.3","1895","Application Data"
"597","50.983039400","100.84.170.161","151.101.2.187","TLSv1.3","752","Application Data"
"598","50.983172400","100.84.170.161","151.101.2.187","TLSv1.3","1948","Application Data"
"599","50.991795800","151.101.2.187","100.84.170.161","TCP","56","443  >  64433 [ACK] Seq=85548 Ack=160010 Win=186368 Len=0"
"600","50.992157900","151.101.2.187","100.84.170.161","TCP","56","443  >  64433 [ACK] Seq=85548 Ack=160708 Win=189440 Len=0"
"601","50.993251700","151.101.2.187","100.84.170.161","TCP","56","443  >  64433 [ACK] Seq=85548 Ack=162602 Win=195072 Len=0"
"602","50.995291500","151.101.2.187","100.84.170.161","TLSv1.3","173","Application Data"
"603","50.995663600","151.101.2.187","100.84.170.161","TLSv1.3","683","Application Data"
"604","50.995708500","100.84.170.161","151.101.2.187","TCP","54","64433  >  443 [ACK] Seq=162602 Ack=86296 Win=131328 Len=0"
"605","50.995861300","151.101.2.187","100.84.170.161","TLSv1.3","130","Application Data"
"606","50.997148900","151.101.2.187","100.84.170.161","TLSv1.3","125","Application Data"
"607","50.997207800","100.84.170.161","151.101.2.187","TCP","54","64433  >  443 [ACK] Seq=162602 Ack=86443 Win=131072 Len=0"
"608","51.037668400","100.84.170.161","151.101.2.187","TLSv1.3","733","Application Data"
"609","51.048013000","151.101.2.187","100.84.170.161","TCP","56","443  >  64433 [ACK] Seq=86443 Ack=163281 Win=198144 Len=0"
"610","51.051787100","151.101.2.187","100.84.170.161","TLSv1.3","98","Application Data"
"611","51.075472600","151.101.2.187","100.84.170.161","TCP","98","[TCP Retransmission] 443  >  64433 [PSH, ACK] Seq=86443 Ack=163281 Win=198144 Len=44"
"612","51.075536800","100.84.170.161","151.101.2.187","TCP","66","64433  >  443 [ACK] Seq=163281 Ack=86487 Win=131072 Len=0 SLE=86443 SRE=86487"
"613","51.345654200","100.84.170.161","151.101.2.187","TLSv1.3","1955","Application Data"
"614","51.355294600","151.101.2.187","100.84.170.161","TCP","56","443  >  64433 [ACK] Seq=86487 Ack=165182 Win=204288 Len=0"
"615","51.357623200","151.101.2.187","100.84.170.161","TLSv1.3","131","Application Data"
"616","51.372003600","100.84.170.161","151.101.66.187","TLSv1.3","175","Application Data"
"617","51.372112700","100.84.170.161","151.101.66.187","TLSv1.3","93","Application Data"
"618","51.381123700","151.101.66.187","100.84.170.161","TCP","56","443  >  50935 [ACK] Seq=12975 Ack=3533 Win=143872 Len=0"
"619","51.381493000","151.101.66.187","100.84.170.161","TLSv1.3","93","Application Data"
"620","51.382616400","151.101.2.187","100.84.170.161","TCP","131","[TCP Retransmission] 443  >  64433 [PSH, ACK] Seq=86487 Ack=165182 Win=204288 Len=77"
"621","51.382660100","100.84.170.161","151.101.2.187","TCP","66","64433  >  443 [ACK] Seq=165182 Ack=86564 Win=131072 Len=0 SLE=86487 SRE=86564"
"622","51.382947300","151.101.66.187","100.84.170.161","TLSv1.3","267","Application Data"
"623","51.382990000","100.84.170.161","151.101.66.187","TCP","54","50935  >  443 [ACK] Seq=3572 Ack=13227 Win=129792 Len=0"
"624","51.543748800","100.84.170.161","151.101.2.187","TLSv1.3","737","Application Data"
"625","51.550422000","100.84.170.161","151.101.2.187","TLSv1.3","1922","Application Data"
"626","51.553004200","151.101.2.187","100.84.170.161","TCP","56","443  >  64433 [ACK] Seq=86564 Ack=165865 Win=206848 Len=0"
"627","51.555471800","151.101.2.187","100.84.170.161","TLSv1.3","131","Application Data"
"628","51.557373800","100.84.170.161","151.101.2.187","TLSv1.3","686","Application Data"
"629","51.560745500","151.101.2.187","100.84.170.161","TCP","56","443  >  64433 [ACK] Seq=86641 Ack=167733 Win=212992 Len=0"
"630","51.564068300","151.101.2.187","100.84.170.161","TLSv1.3","98","Application Data"
"631","51.566898100","151.101.2.187","100.84.170.161","TCP","56","443  >  64433 [ACK] Seq=86685 Ack=168365 Win=215552 Len=0"
"632","51.569893100","151.101.2.187","100.84.170.161","TLSv1.3","530","Application Data"
"633","51.569964400","100.84.170.161","151.101.2.187","TCP","54","64433  >  443 [ACK] Seq=168365 Ack=87161 Win=130304 Len=0"
"634","51.573872800","100.84.170.161","151.101.2.187","TLSv1.3","1884","Application Data"
"635","51.583656700","151.101.2.187","100.84.170.161","TCP","56","443  >  64433 [ACK] Seq=87161 Ack=170195 Win=221696 Len=0"
"636","51.586879100","151.101.2.187","100.84.170.161","TLSv1.3","408","Application Data"
"637","51.587274600","151.101.2.187","100.84.170.161","TLSv1.3","420","Application Data"
"638","51.587322300","100.84.170.161","151.101.2.187","TCP","54","64433  >  443 [ACK] Seq=170195 Ack=87881 Win=131328 Len=0"
"639","51.613932200","100.84.170.161","151.101.2.187","TLSv1.3","680","Application Data"
"640","51.619840300","100.84.170.161","151.101.2.187","TLSv1.3","1880","Application Data"
"641","51.623695100","151.101.2.187","100.84.170.161","TCP","56","443  >  64433 [ACK] Seq=87881 Ack=170821 Win=224768 Len=0"
"642","51.626531100","151.101.2.187","100.84.170.161","TLSv1.3","166","Application Data"
"643","51.626900700","151.101.2.187","100.84.170.161","TLSv1.3","1072","Application Data"
"644","51.626950200","100.84.170.161","151.101.2.187","TCP","54","64433  >  443 [ACK] Seq=172647 Ack=89011 Win=130048 Len=0"
"645","51.629218900","151.101.2.187","100.84.170.161","TCP","56","443  >  64433 [ACK] Seq=89011 Ack=172647 Win=230400 Len=0"
"646","51.633616400","151.101.2.187","100.84.170.161","TLSv1.3","139","Application Data"
"647","51.633863400","151.101.2.187","100.84.170.161","TLSv1.3","623","Application Data"
"648","51.633906000","100.84.170.161","151.101.2.187","TCP","54","64433  >  443 [ACK] Seq=172647 Ack=89665 Win=131328 Len=0"
"649","51.768429500","100.84.170.161","151.101.2.187","TLSv1.3","744","Application Data"
"650","51.779572000","151.101.2.187","100.84.170.161","TCP","56","443  >  64433 [ACK] Seq=89665 Ack=173337 Win=233472 Len=0"
"651","51.781993600","151.101.2.187","100.84.170.161","TLSv1.3","240","Application Data"
"652","51.806672700","151.101.2.187","100.84.170.161","TCP","240","[TCP Retransmission] 443  >  64433 [PSH, ACK] Seq=89665 Ack=173337 Win=233472 Len=186"
"653","51.806720600","100.84.170.161","151.101.2.187","TCP","66","64433  >  443 [ACK] Seq=173337 Ack=89851 Win=131072 Len=0 SLE=89665 SRE=89851"
"654","59.034674400","100.84.170.161","151.101.2.187","TLSv1.3","1949","Application Data"
"655","59.039166800","100.84.170.161","151.101.2.187","TLSv1.3","704","Application Data"
"656","59.044140500","151.101.2.187","100.84.170.161","TCP","56","443  >  64433 [ACK] Seq=89851 Ack=175232 Win=239104 Len=0"
"657","59.047224400","151.101.2.187","100.84.170.161","TLSv1.3","241","Application Data"
"658","59.048060300","151.101.2.187","100.84.170.161","TCP","56","443  >  64433 [ACK] Seq=90038 Ack=175882 Win=242176 Len=0"
"659","59.050937900","151.101.2.187","100.84.170.161","TLSv1.3","98","Application Data"
"660","59.051004000","100.84.170.161","151.101.2.187","TCP","54","64433  >  443 [ACK] Seq=175882 Ack=90082 Win=130816 Len=0"
"661","59.057668700","100.84.170.161","151.101.2.187","TLSv1.3","1965","Application Data"
"662","59.066913800","151.101.2.187","100.84.170.161","TCP","56","443  >  64433 [ACK] Seq=90082 Ack=177793 Win=247808 Len=0"
"663","59.070425700","151.101.2.187","100.84.170.161","TLSv1.3","125","Application Data"
"664","59.096639900","151.101.2.187","100.84.170.161","TCP","125","[TCP Retransmission] 443  >  64433 [PSH, ACK] Seq=90082 Ack=177793 Win=247808 Len=71"
"665","59.096694600","100.84.170.161","151.101.2.187","TCP","66","64433  >  443 [ACK] Seq=177793 Ack=90153 Win=130816 Len=0 SLE=90082 SRE=90153"
"666","59.243758600","100.84.170.161","151.101.2.187","TLSv1.3","663","Application Data"
"667","59.253036300","151.101.2.187","100.84.170.161","TCP","56","443  >  64433 [ACK] Seq=90153 Ack=178402 Win=250880 Len=0"
"668","59.256141500","151.101.2.187","100.84.170.161","TLSv1.3","545","Application Data"
"669","59.259109300","100.84.170.161","151.101.2.187","TLSv1.3","89","Application Data"
"670","59.268291300","151.101.2.187","100.84.170.161","TCP","56","443  >  64433 [ACK] Seq=90644 Ack=178437 Win=250880 Len=0"
