"No.","Time","Source","Destination","Protocol","Length","Info"
"1","0.000000000","172.20.40.110","151.101.66.187","TCP","55","51833  >  443 [ACK] Seq=1 Ack=1 Win=258 Len=1 [TCP PDU reassembled in 3]"
"2","0.008159600","151.101.66.187","172.20.40.110","TCP","66","443  >  51833 [ACK] Seq=1 Ack=2 Win=281 Len=0 SLE=1 SRE=2"
"3","3.400991900","172.20.40.110","151.101.66.187","TLSv1.2","175","Ignored Unknown Record"
"4","3.401078700","172.20.40.110","151.101.66.187","TLSv1.2","93","Application Data"
"5","3.411515000","151.101.66.187","172.20.40.110","TCP","60","443  >  51833 [ACK] Seq=1 Ack=123 Win=281 Len=0"
"6","3.412840400","151.101.66.187","172.20.40.110","TCP","60","443  >  51833 [ACK] Seq=1 Ack=162 Win=281 Len=0"
"7","3.412840400","151.101.66.187","172.20.40.110","TLSv1.2","93","Application Data"
"8","3.414754600","172.20.40.110","151.101.66.187","TLSv1.2","2620","Application Data"
"9","3.414890600","172.20.40.110","151.101.66.187","TLSv1.2","93","Application Data"
"10","3.426750500","151.101.66.187","172.20.40.110","TCP","60","443  >  57039 [ACK] Seq=1 Ack=2567 Win=2788 Len=0"
"11","3.426750500","151.101.66.187","172.20.40.110","TCP","60","443  >  57039 [ACK] Seq=1 Ack=2606 Win=2788 Len=0"
"12","3.426750500","151.101.66.187","172.20.40.110","TLSv1.2","93","Application Data"
"13","3.438152400","151.101.66.187","172.20.40.110","TCP","93","[TCP Retransmission] 443  >  51833 [PSH, ACK] Seq=1 Ack=162 Win=281 Len=39"
"14","3.438224800","172.20.40.110","151.101.66.187","TCP","66","51833  >  443 [ACK] Seq=162 Ack=40 Win=258 Len=0 SLE=1 SRE=40"
"15","3.459364800","151.101.66.187","172.20.40.110","TCP","93","[TCP Retransmission] 443  >  57039 [PSH, ACK] Seq=1 Ack=2606 Win=2788 Len=39"
"16","3.459442300","172.20.40.110","151.101.66.187","TCP","66","57039  >  443 [ACK] Seq=2606 Ack=40 Win=517 Len=0 SLE=1 SRE=40"
"17","3.465025200","151.101.66.187","172.20.40.110","TLSv1.2","396","Application Data"
"18","3.493115900","151.101.66.187","172.20.40.110","TCP","396","[TCP Retransmission] 443  >  51833 [PSH, ACK] Seq=40 Ack=162 Win=281 Len=342"
"19","3.493183600","172.20.40.110","151.101.66.187","TCP","66","51833  >  443 [ACK] Seq=162 Ack=382 Win=257 Len=0 SLE=40 SRE=382"
"20","3.507219800","151.101.66.187","172.20.40.110","TLSv1.2","512","Application Data"
"21","3.507219800","151.101.66.187","172.20.40.110","TCP","4194","443  >  57039 [ACK] Seq=498 Ack=2606 Win=2788 Len=4140 [TCP PDU reassembled in 22]"
"22","3.507219800","151.101.66.187","172.20.40.110","TLSv1.2","702","Application Data"
"23","3.507348900","172.20.40.110","151.101.66.187","TCP","54","57039  >  443 [ACK] Seq=2606 Ack=5286 Win=517 Len=0"
"24","3.508477300","151.101.66.187","172.20.40.110","TLSv1.2","86","Application Data"
"25","3.508477300","151.101.66.187","172.20.40.110","TLSv1.2","701","Application Data"
"26","3.508566900","172.20.40.110","151.101.66.187","TCP","54","57039  >  443 [ACK] Seq=2606 Ack=5965 Win=514 Len=0"
"27","3.509470000","151.101.66.187","172.20.40.110","TLSv1.2","85","Application Data"
"28","3.509535300","172.20.40.110","151.101.66.187","TCP","54","57039  >  443 [ACK] Seq=2606 Ack=5996 Win=514 Len=0"
"29","3.510895000","172.20.40.110","151.101.66.187","TLSv1.2","89","Application Data"
"30","3.520343400","151.101.66.187","172.20.40.110","TCP","60","443  >  57039 [ACK] Seq=5996 Ack=2641 Win=2788 Len=0"
"31","4.141521300","172.20.40.110","151.101.66.187","TLSv1.2","2889","Application Data"
"32","4.151671000","151.101.66.187","172.20.40.110","TCP","60","443  >  57039 [ACK] Seq=5996 Ack=5476 Win=2799 Len=0"
"33","4.173673000","151.101.66.187","172.20.40.110","TLSv1.2","439","Application Data"
"34","4.200891900","151.101.66.187","172.20.40.110","TCP","439","[TCP Retransmission] 443  >  57039 [PSH, ACK] Seq=5996 Ack=5476 Win=2799 Len=385"
"35","4.200961100","172.20.40.110","151.101.66.187","TCP","66","57039  >  443 [ACK] Seq=5476 Ack=6381 Win=513 Len=0 SLE=5996 SRE=6381"
"36","4.515113800","172.20.40.110","151.101.66.187","TLSv1.2","2889","Application Data"
"37","4.516203300","172.20.40.110","151.101.66.187","TLSv1.2","2890","Application Data"
"38","4.528335000","151.101.66.187","172.20.40.110","TCP","60","443  >  57039 [ACK] Seq=6381 Ack=8311 Win=2810 Len=0"
"39","4.528335000","151.101.66.187","172.20.40.110","TCP","60","443  >  57039 [ACK] Seq=6381 Ack=11147 Win=2821 Len=0"
"40","4.531978300","151.101.66.187","172.20.40.110","TLSv1.2","131","Application Data"
"41","4.531978300","151.101.66.187","172.20.40.110","TLSv1.2","125","Application Data"
"42","4.532064000","172.20.40.110","151.101.66.187","TCP","54","57039  >  443 [ACK] Seq=11147 Ack=6529 Win=512 Len=0"
"43","4.885934800","172.20.40.110","151.101.66.187","TLSv1.2","2885","Application Data"
"44","4.886743400","172.20.40.110","151.101.66.187","TLSv1.2","2886","Application Data"
"45","4.906458400","151.101.66.187","172.20.40.110","TCP","60","443  >  57039 [ACK] Seq=6529 Ack=13978 Win=2832 Len=0"
"46","4.906458400","151.101.66.187","172.20.40.110","TLSv1.2","240","Application Data"
"47","4.906458400","151.101.66.187","172.20.40.110","TCP","60","443  >  57039 [ACK] Seq=6715 Ack=16810 Win=2844 Len=0"
"48","4.906458400","151.101.66.187","172.20.40.110","TLSv1.2","131","Application Data"
"49","4.906760100","172.20.40.110","151.101.66.187","TCP","54","57039  >  443 [ACK] Seq=16810 Ack=6792 Win=517 Len=0"
"50","5.153975500","172.20.40.110","151.101.66.187","TLSv1.2","2889","Application Data"
"51","5.164096600","151.101.66.187","172.20.40.110","TCP","60","443  >  57039 [ACK] Seq=6792 Ack=19645 Win=2855 Len=0"
"52","5.166258700","151.101.66.187","172.20.40.110","TLSv1.2","98","Application Data"
"53","5.194617200","151.101.66.187","172.20.40.110","TCP","98","[TCP Retransmission] 443  >  57039 [PSH, ACK] Seq=6792 Ack=19645 Win=2855 Len=44"
"54","5.194683300","172.20.40.110","151.101.66.187","TCP","66","57039  >  443 [ACK] Seq=19645 Ack=6836 Win=517 Len=0 SLE=6792 SRE=6836"
"55","5.203647300","172.20.40.110","151.101.66.187","TLSv1.2","2887","Application Data"
"56","5.213176400","151.101.66.187","172.20.40.110","TCP","60","443  >  57039 [ACK] Seq=6836 Ack=22478 Win=2866 Len=0"
"57","5.215452000","151.101.66.187","172.20.40.110","TLSv1.2","125","Application Data"
"58","5.243740800","151.101.66.187","172.20.40.110","TCP","125","[TCP Retransmission] 443  >  57039 [PSH, ACK] Seq=6836 Ack=22478 Win=2866 Len=71"
"59","5.243834800","172.20.40.110","151.101.66.187","TCP","66","57039  >  443 [ACK] Seq=22478 Ack=6907 Win=517 Len=0 SLE=6836 SRE=6907"
"60","5.278533100","172.20.40.110","151.101.66.187","TLSv1.2","2890","Application Data"
"61","5.291733000","151.101.66.187","172.20.40.110","TCP","60","443  >  57039 [ACK] Seq=6907 Ack=25314 Win=2877 Len=0"
"62","5.291733000","151.101.66.187","172.20.40.110","TLSv1.2","104","Application Data"
"63","5.318744100","151.101.66.187","172.20.40.110","TCP","104","[TCP Retransmission] 443  >  57039 [PSH, ACK] Seq=6907 Ack=25314 Win=2877 Len=50"
"64","5.318819700","172.20.40.110","151.101.66.187","TCP","66","57039  >  443 [ACK] Seq=25314 Ack=6957 Win=516 Len=0 SLE=6907 SRE=6957"
"65","8.550535900","172.20.40.110","151.101.66.187","TLSv1.2","2884","Application Data"
"66","8.557884200","172.20.40.110","151.101.66.187","TLSv1.2","2880","Application Data"
"67","8.564399400","151.101.66.187","172.20.40.110","TCP","60","443  >  57039 [ACK] Seq=6957 Ack=28144 Win=2888 Len=0"
"68","8.565807900","151.101.66.187","172.20.40.110","TLSv1.2","246","Application Data"
"69","8.574700900","151.101.66.187","172.20.40.110","TCP","60","443  >  57039 [ACK] Seq=7149 Ack=30970 Win=2899 Len=0"
"70","8.576823200","151.101.66.187","172.20.40.110","TLSv1.2","130","Application Data"
"71","8.576908900","172.20.40.110","151.101.66.187","TCP","54","57039  >  443 [ACK] Seq=30970 Ack=7225 Win=515 Len=0"
"72","8.603682900","172.20.40.110","151.101.66.187","TLSv1.2","2873","Application Data"
"73","8.603973600","172.20.40.110","151.101.66.187","TLSv1.2","2874","Application Data"
"74","8.615611000","151.101.66.187","172.20.40.110","TCP","60","443  >  57039 [ACK] Seq=7225 Ack=33789 Win=2910 Len=0"
"75","8.615611000","151.101.66.187","172.20.40.110","TCP","60","443  >  57039 [ACK] Seq=7225 Ack=36609 Win=2921 Len=0"
"76","8.616678800","151.101.66.187","172.20.40.110","TLSv1.2","103","Application Data"
"77","8.618828500","151.101.66.187","172.20.40.110","TLSv1.2","110","Application Data"
"78","8.618913700","172.20.40.110","151.101.66.187","TCP","54","57039  >  443 [ACK] Seq=36609 Ack=7330 Win=515 Len=0"
"79","22.292792900","172.20.40.110","151.101.66.187","TLSv1.2","2912","Application Data"
"80","22.292923600","172.20.40.110","151.101.66.187","TLSv1.2","93","Application Data"
"81","22.305650100","151.101.66.187","172.20.40.110","TCP","60","443  >  57039 [ACK] Seq=7330 Ack=39467 Win=2932 Len=0"
"82","22.305650100","151.101.66.187","172.20.40.110","TCP","60","443  >  57039 [ACK] Seq=7330 Ack=39506 Win=2932 Len=0"
"83","22.306768900","151.101.66.187","172.20.40.110","TLSv1.2","93","Application Data"
"84","22.335964300","151.101.66.187","172.20.40.110","TCP","93","[TCP Retransmission] 443  >  57039 [PSH, ACK] Seq=7330 Ack=39506 Win=2932 Len=39"
"85","22.336023100","172.20.40.110","151.101.66.187","TCP","66","57039  >  443 [ACK] Seq=39506 Ack=7369 Win=515 Len=0 SLE=7330 SRE=7369"
"86","22.797351200","151.101.66.187","172.20.40.110","TCP","2814","443  >  57039 [ACK] Seq=7369 Ack=39506 Win=2932 Len=2760 [TCP PDU reassembled in 95]"
"87","22.797469700","172.20.40.110","151.101.66.187","TCP","54","57039  >  443 [ACK] Seq=39506 Ack=10129 Win=517 Len=0"
"88","22.799907000","151.101.66.187","172.20.40.110","TCP","1434","443  >  57039 [ACK] Seq=10129 Ack=39506 Win=2932 Len=1380 [TCP PDU reassembled in 95]"
"89","22.799907000","151.101.66.187","172.20.40.110","TCP","1434","443  >  57039 [ACK] Seq=11509 Ack=39506 Win=2932 Len=1380 [TCP PDU reassembled in 95]"
"90","22.799907000","151.101.66.187","172.20.40.110","TCP","2814","443  >  57039 [ACK] Seq=12889 Ack=39506 Win=2932 Len=2760 [TCP PDU reassembled in 95]"
"91","22.799988500","172.20.40.110","151.101.66.187","TCP","54","57039  >  443 [ACK] Seq=39506 Ack=15649 Win=517 Len=0"
"92","22.802212800","151.101.66.187","172.20.40.110","TCP","5574","443  >  57039 [ACK] Seq=15649 Ack=39506 Win=2932 Len=5520 [TCP PDU reassembled in 95]"
"93","22.802273600","172.20.40.110","151.101.66.187","TCP","54","57039  >  443 [ACK] Seq=39506 Ack=21169 Win=517 Len=0"
"94","22.804496900","151.101.66.187","172.20.40.110","TCP","1434","443  >  57039 [ACK] Seq=21169 Ack=39506 Win=2932 Len=1380 [TCP PDU reassembled in 95]"
"95","22.804496900","151.101.66.187","172.20.40.110","TLSv1.2","285","Application Data"
"96","22.804496900","151.101.66.187","172.20.40.110","TCP","4194","443  >  57039 [ACK] Seq=22780 Ack=39506 Win=2932 Len=4140 [TCP PDU reassembled in 102]"
"97","22.804606300","172.20.40.110","151.101.66.187","TCP","54","57039  >  443 [ACK] Seq=39506 Ack=26920 Win=517 Len=0"
"98","22.808050300","151.101.66.187","172.20.40.110","TCP","5574","443  >  57039 [ACK] Seq=26920 Ack=39506 Win=2932 Len=5520 [TCP PDU reassembled in 102]"
"99","22.808124000","172.20.40.110","151.101.66.187","TCP","54","57039  >  443 [ACK] Seq=39506 Ack=32440 Win=517 Len=0"
"100","22.810838800","151.101.66.187","172.20.40.110","TCP","5574","443  >  57039 [ACK] Seq=32440 Ack=39506 Win=2932 Len=5520 [TCP PDU reassembled in 102]"
"101","22.810917000","172.20.40.110","151.101.66.187","TCP","54","57039  >  443 [ACK] Seq=39506 Ack=37960 Win=517 Len=0"
"102","22.815537600","151.101.66.187","172.20.40.110","TLSv1.2","1434","Application Data"
"103","22.815537600","151.101.66.187","172.20.40.110","TCP","1434","443  >  57039 [ACK] Seq=39340 Ack=39506 Win=2932 Len=1380 [TCP PDU reassembled in 116]"
"104","22.815537600","151.101.66.187","172.20.40.110","TCP","1434","443  >  57039 [PSH, ACK] Seq=40720 Ack=39506 Win=2932 Len=1380 [TCP PDU reassembled in 116]"
"105","22.815537600","151.101.66.187","172.20.40.110","TCP","4194","443  >  57039 [ACK] Seq=42100 Ack=39506 Win=2932 Len=4140 [TCP PDU reassembled in 116]"
"106","22.815633800","172.20.40.110","151.101.66.187","TCP","54","57039  >  443 [ACK] Seq=39506 Ack=46240 Win=517 Len=0"
"107","22.816430700","172.20.40.110","151.101.66.187","TLSv1.2","89","Application Data"
"108","22.820284700","151.101.66.187","172.20.40.110","TCP","1434","443  >  57039 [ACK] Seq=46240 Ack=39506 Win=2932 Len=1380 [TCP PDU reassembled in 116]"
"109","22.820284700","151.101.66.187","172.20.40.110","TCP","1434","443  >  57039 [ACK] Seq=47620 Ack=39506 Win=2932 Len=1380 [TCP PDU reassembled in 116]"
"110","22.820284700","151.101.66.187","172.20.40.110","TCP","1434","443  >  57039 [ACK] Seq=49000 Ack=39506 Win=2932 Len=1380 [TCP PDU reassembled in 116]"
"111","22.820284700","151.101.66.187","172.20.40.110","TCP","1434","443  >  57039 [ACK] Seq=50380 Ack=39506 Win=2932 Len=1380 [TCP PDU reassembled in 116]"
"112","22.820373500","172.20.40.110","151.101.66.187","TCP","54","57039  >  443 [ACK] Seq=39541 Ack=51760 Win=517 Len=0"
"113","22.822724200","151.101.66.187","172.20.40.110","TCP","1434","443  >  57039 [ACK] Seq=51760 Ack=39506 Win=2932 Len=1380 [TCP PDU reassembled in 116]"
"114","22.822786500","172.20.40.110","151.101.66.187","TCP","54","57039  >  443 [ACK] Seq=39541 Ack=53140 Win=517 Len=0"
"115","22.825300600","151.101.66.187","172.20.40.110","TCP","1434","443  >  57039 [ACK] Seq=53140 Ack=39506 Win=2932 Len=1380 [TCP PDU reassembled in 116]"
"116","22.825300600","151.101.66.187","172.20.40.110","TLSv1.2","1434","Application Data"
"117","22.825300600","151.101.66.187","172.20.40.110","TCP","1434","443  >  57039 [ACK] Seq=55900 Ack=39506 Win=2932 Len=1380 [TCP PDU reassembled in 127]"
"118","22.825300600","151.101.66.187","172.20.40.110","TCP","1434","443  >  57039 [ACK] Seq=57280 Ack=39506 Win=2932 Len=1380 [TCP PDU reassembled in 127]"
"119","22.825382100","172.20.40.110","151.101.66.187","TCP","54","57039  >  443 [ACK] Seq=39541 Ack=58660 Win=517 Len=0"
"120","22.830455100","151.101.66.187","172.20.40.110","TCP","1434","443  >  57039 [ACK] Seq=58660 Ack=39506 Win=2932 Len=1380 [TCP PDU reassembled in 127]"
"121","22.830455100","151.101.66.187","172.20.40.110","TCP","1434","443  >  57039 [PSH, ACK] Seq=60040 Ack=39506 Win=2932 Len=1380 [TCP PDU reassembled in 127]"
"122","22.830455100","151.101.66.187","172.20.40.110","TCP","1434","443  >  57039 [ACK] Seq=61420 Ack=39506 Win=2932 Len=1380 [TCP PDU reassembled in 127]"
"123","22.830455100","151.101.66.187","172.20.40.110","TCP","2814","443  >  57039 [ACK] Seq=62800 Ack=39506 Win=2932 Len=2760 [TCP PDU reassembled in 127]"
"124","22.830537000","172.20.40.110","151.101.66.187","TCP","54","57039  >  443 [ACK] Seq=39541 Ack=65560 Win=517 Len=0"
"125","22.833100500","151.101.66.187","172.20.40.110","TCP","5574","443  >  57039 [ACK] Seq=65560 Ack=39506 Win=2932 Len=5520 [TCP PDU reassembled in 127]"
"126","22.833215800","172.20.40.110","151.101.66.187","TCP","54","57039  >  443 [ACK] Seq=39541 Ack=71080 Win=517 Len=0"
"127","22.835438800","151.101.66.187","172.20.40.110","TLSv1.2","4194","Application Data"
"128","22.835522800","172.20.40.110","151.101.66.187","TCP","54","57039  >  443 [ACK] Seq=39541 Ack=75220 Win=517 Len=0"
"129","22.837912100","151.101.66.187","172.20.40.110","TCP","1434","443  >  57039 [ACK] Seq=75220 Ack=39506 Win=2932 Len=1380 [TCP PDU reassembled in 130]"
"130","22.837912100","151.101.66.187","172.20.40.110","TLSv1.2","2814","Application Data"
"131","22.837912100","151.101.66.187","172.20.40.110","TLSv1.2","505","Application Data, Application Data"
"132","22.837912100","151.101.66.187","172.20.40.110","TCP","505","[TCP Retransmission] 443  >  57039 [PSH, ACK] Seq=79360 Ack=39506 Win=2932 Len=451"
"133","22.838007300","172.20.40.110","151.101.66.187","TCP","66","57039  >  443 [ACK] Seq=39541 Ack=79811 Win=517 Len=0 SLE=79360 SRE=79811"
"134","22.840311300","151.101.66.187","172.20.40.110","TCP","60","443  >  57039 [ACK] Seq=79811 Ack=39541 Win=2932 Len=0"
"135","23.381254500","172.20.40.110","151.101.66.187","TLSv1.2","2868","Application Data"
"136","23.382928100","172.20.40.110","151.101.66.187","TLSv1.2","2866","Application Data"
"137","23.384328900","172.20.40.110","151.101.66.187","TLSv1.2","2866","Application Data"
"138","23.385139600","172.20.40.110","151.101.66.187","TLSv1.2","2872","Application Data"
"139","23.390082800","151.101.66.187","172.20.40.110","TCP","60","443  >  57039 [ACK] Seq=79811 Ack=42355 Win=2943 Len=0"
"140","23.392754600","151.101.66.187","172.20.40.110","TCP","60","443  >  57039 [ACK] Seq=79811 Ack=45167 Win=2954 Len=0"
"141","23.393816900","151.101.66.187","172.20.40.110","TLSv1.2","361","Application Data"
"142","23.394862700","151.101.66.187","172.20.40.110","TLSv1.2","137","Application Data"
"143","23.394938600","172.20.40.110","151.101.66.187","TCP","54","57039  >  443 [ACK] Seq=50797 Ack=80201 Win=515 Len=0"
"144","23.395990600","151.101.66.187","172.20.40.110","TCP","60","443  >  57039 [ACK] Seq=80201 Ack=47979 Win=2965 Len=0"
"145","23.395990600","151.101.66.187","172.20.40.110","TCP","60","443  >  57039 [ACK] Seq=80201 Ack=50797 Win=2976 Len=0"
"146","23.399505600","151.101.66.187","172.20.40.110","TLSv1.2","130","Application Data"
"147","23.400651100","151.101.66.187","172.20.40.110","TLSv1.2","131","Application Data"
"148","23.400723600","172.20.40.110","151.101.66.187","TCP","54","57039  >  443 [ACK] Seq=50797 Ack=80354 Win=515 Len=0"
"149","23.437534900","172.20.40.110","151.101.66.187","TLSv1.2","2864","Application Data"
"150","23.441669000","172.20.40.110","151.101.66.187","TLSv1.2","2883","Application Data"
"151","23.445382300","172.20.40.110","151.101.66.187","TLSv1.2","2882","Application Data"
"152","23.446271200","172.20.40.110","151.101.66.187","TLSv1.2","2880","Application Data"
"153","23.446462900","172.20.40.110","151.101.66.187","TLSv1.2","2882","Application Data"
"154","23.454104700","151.101.66.187","172.20.40.110","TCP","60","443  >  57039 [ACK] Seq=80354 Ack=53607 Win=2987 Len=0"
"155","23.454104700","151.101.66.187","172.20.40.110","TLSv1.2","130","Application Data"
"156","23.460429700","151.101.66.187","172.20.40.110","TCP","60","443  >  57039 [ACK] Seq=80430 Ack=56436 Win=2999 Len=0"
"157","23.460429700","151.101.66.187","172.20.40.110","TCP","60","443  >  57039 [ACK] Seq=80430 Ack=59264 Win=3010 Len=0"
"158","23.460429700","151.101.66.187","172.20.40.110","TLSv1.2","131","Application Data"
"159","23.460429700","151.101.66.187","172.20.40.110","TLSv1.2","130","Application Data"
"160","23.460429700","151.101.66.187","172.20.40.110","TCP","60","443  >  57039 [ACK] Seq=80583 Ack=62090 Win=3021 Len=0"
"161","23.460429700","151.101.66.187","172.20.40.110","TCP","60","443  >  57039 [ACK] Seq=80583 Ack=64918 Win=3032 Len=0"
"162","23.460557800","172.20.40.110","151.101.66.187","TCP","54","57039  >  443 [ACK] Seq=64918 Ack=80583 Win=514 Len=0"
"163","23.462564900","151.101.66.187","172.20.40.110","TLSv1.2","131","Application Data"
"164","23.462629600","172.20.40.110","151.101.66.187","TCP","54","57039  >  443 [ACK] Seq=64918 Ack=80660 Win=514 Len=0"
"165","23.466149300","151.101.66.187","172.20.40.110","TLSv1.2","131","Application Data"
"166","23.518918500","172.20.40.110","151.101.66.187","TCP","54","57039  >  443 [ACK] Seq=64918 Ack=80737 Win=513 Len=0"
"167","23.602296400","172.20.40.110","151.101.66.187","TLSv1.2","2870","Application Data"
"168","23.602770000","172.20.40.110","151.101.66.187","TLSv1.2","2872","Application Data"
"169","23.615902400","151.101.66.187","172.20.40.110","TCP","60","443  >  57039 [ACK] Seq=80737 Ack=67734 Win=3043 Len=0"
"170","23.615902400","151.101.66.187","172.20.40.110","TCP","60","443  >  57039 [ACK] Seq=80737 Ack=70552 Win=3054 Len=0"
"171","23.615902400","151.101.66.187","172.20.40.110","TLSv1.2","98","Application Data"
"172","23.616851500","151.101.66.187","172.20.40.110","TLSv1.2","98","Application Data"
"173","23.616940900","172.20.40.110","151.101.66.187","TCP","54","57039  >  443 [ACK] Seq=70552 Ack=80825 Win=513 Len=0"
"174","23.617088500","172.20.40.110","151.101.66.187","TLSv1.2","2877","Application Data"
"175","23.628686100","151.101.66.187","172.20.40.110","TCP","60","443  >  57039 [ACK] Seq=80825 Ack=73375 Win=3065 Len=0"
"176","23.632197800","151.101.66.187","172.20.40.110","TLSv1.2","128","Application Data"
"177","23.666607200","172.20.40.110","151.101.66.187","TLSv1.2","2886","Application Data"
"178","23.667367100","172.20.40.110","151.101.66.187","TLSv1.2","2884","Application Data"
"179","23.669530200","172.20.40.110","151.101.66.187","TLSv1.2","2886","Application Data"
"180","23.675944100","172.20.40.110","151.101.66.187","TLSv1.2","2877","Application Data"
"181","23.683221600","151.101.66.187","172.20.40.110","TCP","60","443  >  57039 [ACK] Seq=80899 Ack=76207 Win=3076 Len=0"
"182","23.683221600","151.101.66.187","172.20.40.110","TCP","60","443  >  57039 [ACK] Seq=80899 Ack=79037 Win=3087 Len=0"
"183","23.683221600","151.101.66.187","172.20.40.110","TLSv1.2","98","Application Data"
"184","23.683221600","151.101.66.187","172.20.40.110","TLSv1.2","98","Application Data"
"185","23.683221600","151.101.66.187","172.20.40.110","TCP","60","443  >  57039 [ACK] Seq=80987 Ack=81869 Win=3098 Len=0"
"186","23.683342100","172.20.40.110","151.101.66.187","TCP","54","57039  >  443 [ACK] Seq=84692 Ack=80987 Win=512 Len=0"
"187","23.686966100","151.101.66.187","172.20.40.110","TLSv1.2","98","Application Data"
"188","23.686966100","151.101.66.187","172.20.40.110","TCP","60","443  >  57039 [ACK] Seq=81031 Ack=84692 Win=3109 Len=0"
"189","23.692518300","151.101.66.187","172.20.40.110","TLSv1.2","209","Application Data"
"190","23.692621200","172.20.40.110","151.101.66.187","TCP","54","57039  >  443 [ACK] Seq=84692 Ack=81186 Win=512 Len=0"
"191","23.696661200","172.20.40.110","151.101.66.187","TLSv1.2","2868","Application Data"
"192","23.696963300","172.20.40.110","151.101.66.187","TLSv1.2","2875","Application Data"
"193","23.697156900","172.20.40.110","151.101.66.187","TLSv1.2","2874","Application Data"
"194","23.697329200","172.20.40.110","151.101.66.187","TLSv1.2","2868","Application Data"
"195","23.697502900","172.20.40.110","151.101.66.187","TLSv1.2","2868","Application Data"
"196","23.697685100","172.20.40.110","151.101.66.187","TLSv1.2","2866","Application Data"
"197","23.707448900","172.20.40.110","151.101.66.187","TLSv1.2","2874","Application Data"
"198","23.710631400","151.101.66.187","172.20.40.110","TCP","60","443  >  57039 [ACK] Seq=81186 Ack=87506 Win=3120 Len=0"
"199","23.710631400","151.101.66.187","172.20.40.110","TLSv1.2","131","Application Data"
"200","23.710710600","172.20.40.110","151.101.66.187","TCP","54","57039  >  443 [ACK] Seq=104407 Ack=81263 Win=517 Len=0"
"201","23.716853200","151.101.66.187","172.20.40.110","TCP","60","443  >  57039 [ACK] Seq=81263 Ack=90327 Win=3131 Len=0"
"202","23.716853200","151.101.66.187","172.20.40.110","TCP","60","443  >  57039 [ACK] Seq=81263 Ack=93147 Win=3142 Len=0"
"203","23.716853200","151.101.66.187","172.20.40.110","TCP","60","443  >  57039 [ACK] Seq=81263 Ack=95961 Win=3153 Len=0"
"204","23.716853200","151.101.66.187","172.20.40.110","TLSv1.2","362","Application Data"
"205","23.716963000","172.20.40.110","151.101.66.187","TCP","54","57039  >  443 [ACK] Seq=104407 Ack=81571 Win=516 Len=0"
"206","23.717937200","151.101.66.187","172.20.40.110","TLSv1.2","135","Application Data"
"207","23.717937200","151.101.66.187","172.20.40.110","TCP","60","443  >  57039 [ACK] Seq=81652 Ack=98775 Win=3164 Len=0"
"208","23.717937200","151.101.66.187","172.20.40.110","TCP","60","443  >  57039 [ACK] Seq=81652 Ack=101587 Win=3175 Len=0"
"209","23.717937200","151.101.66.187","172.20.40.110","TLSv1.2","131","Application Data"
"210","23.717937200","151.101.66.187","172.20.40.110","TCP","60","443  >  57039 [ACK] Seq=81729 Ack=104407 Win=3186 Len=0"
"211","23.718044200","172.20.40.110","151.101.66.187","TCP","54","57039  >  443 [ACK] Seq=104407 Ack=81729 Win=515 Len=0"
"212","23.719794400","151.101.66.187","172.20.40.110","TLSv1.2","206","Application Data, Application Data"
"213","23.719794400","151.101.66.187","172.20.40.110","TLSv1.2","136","Application Data"
"214","23.719875200","172.20.40.110","151.101.66.187","TCP","54","57039  >  443 [ACK] Seq=104407 Ack=81963 Win=514 Len=0"
"215","23.782269800","172.20.40.110","151.101.66.187","TLSv1.2","2887","Application Data"
"216","23.788541800","172.20.40.110","151.101.66.187","TLSv1.2","2871","Application Data"
"217","23.789623700","172.20.40.110","151.101.66.187","TLSv1.2","2874","Application Data"
"218","23.789824700","172.20.40.110","151.101.66.187","TLSv1.2","2865","Application Data"
"219","23.789935800","172.20.40.110","151.101.66.187","TLSv1.2","2868","Application Data"
"220","23.792286200","172.20.40.110","151.101.66.187","TLSv1.2","2867","Application Data"
"221","23.796521900","151.101.66.187","172.20.40.110","TCP","60","443  >  57039 [ACK] Seq=81963 Ack=107240 Win=3197 Len=0"
"222","23.798959200","151.101.66.187","172.20.40.110","TLSv1.2","125","Application Data"
"223","23.798959200","151.101.66.187","172.20.40.110","TCP","60","443  >  57039 [ACK] Seq=82034 Ack=110057 Win=3208 Len=0"
"224","23.801654900","151.101.66.187","172.20.40.110","TLSv1.2","240","Application Data"
"225","23.801727900","172.20.40.110","151.101.66.187","TCP","54","57039  >  443 [ACK] Seq=121315 Ack=82220 Win=513 Len=0"
"226","23.805005300","151.101.66.187","172.20.40.110","TCP","60","443  >  57039 [ACK] Seq=82220 Ack=112877 Win=3219 Len=0"
"227","23.805005300","151.101.66.187","172.20.40.110","TCP","60","443  >  57039 [ACK] Seq=82220 Ack=115688 Win=3230 Len=0"
"228","23.805005300","151.101.66.187","172.20.40.110","TCP","60","443  >  57039 [ACK] Seq=82220 Ack=118502 Win=3241 Len=0"
"229","23.805005300","151.101.66.187","172.20.40.110","TCP","60","443  >  57039 [ACK] Seq=82220 Ack=121315 Win=3252 Len=0"
"230","23.808611500","151.101.66.187","172.20.40.110","TLSv1.2","125","Application Data"
"231","23.808611500","151.101.66.187","172.20.40.110","TLSv1.2","130","Application Data"
"232","23.808611500","151.101.66.187","172.20.40.110","TLSv1.2","208","Application Data"
"233","23.808611500","151.101.66.187","172.20.40.110","TLSv1.2","125","Application Data"
"234","23.808695500","172.20.40.110","151.101.66.187","TCP","54","57039  >  443 [ACK] Seq=121315 Ack=82592 Win=512 Len=0"
"235","25.196994800","172.20.40.110","151.101.66.187","TLSv1.2","3202","Application Data"
"236","25.197220000","172.20.40.110","151.101.66.187","TLSv1.2","3164","Application Data"
"237","25.197365700","172.20.40.110","151.101.66.187","TLSv1.2","3184","Application Data"
"238","25.199531800","172.20.40.110","151.101.66.187","TLSv1.2","3182","Application Data"
"239","25.199738400","172.20.40.110","151.101.66.187","TLSv1.2","3167","Application Data"
"240","25.217086500","151.101.66.187","172.20.40.110","TCP","60","443  >  57039 [ACK] Seq=82592 Ack=122695 Win=3258 Len=0"
"241","25.220531200","151.101.66.187","172.20.40.110","TCP","60","443  >  57039 [ACK] Seq=82592 Ack=124463 Win=3265 Len=0"
"242","25.220531200","151.101.66.187","172.20.40.110","TCP","60","443  >  57039 [ACK] Seq=82592 Ack=127573 Win=3277 Len=0"
"243","25.220531200","151.101.66.187","172.20.40.110","TCP","60","443  >  57039 [ACK] Seq=82592 Ack=130703 Win=3289 Len=0"
"244","25.220531200","151.101.66.187","172.20.40.110","TCP","60","443  >  57039 [ACK] Seq=82592 Ack=133831 Win=3302 Len=0"
"245","25.220531200","151.101.66.187","172.20.40.110","TCP","60","443  >  57039 [ACK] Seq=82592 Ack=136944 Win=3314 Len=0"
"246","25.231187200","172.20.40.110","151.101.66.187","TLSv1.2","2870","Application Data"
"247","25.236766100","172.20.40.110","151.101.66.187","TLSv1.2","2866","Application Data"
"248","25.240640700","151.101.66.187","172.20.40.110","TCP","60","443  >  57039 [ACK] Seq=82592 Ack=139760 Win=3325 Len=0"
"249","25.243945300","151.101.66.187","172.20.40.110","TLSv1.2","360","Application Data"
"250","25.244040800","172.20.40.110","151.101.66.187","TCP","54","57039  >  443 [ACK] Seq=142572 Ack=82898 Win=517 Len=0"
"251","25.246076300","151.101.66.187","172.20.40.110","TCP","60","443  >  57039 [ACK] Seq=82898 Ack=142572 Win=3336 Len=0"
"252","25.254126900","151.101.66.187","172.20.40.110","TLSv1.2","136","Application Data"
"253","25.254373400","172.20.40.110","151.101.66.187","TCP","54","57039  >  443 [ACK] Seq=142572 Ack=82980 Win=517 Len=0"
"254","25.260903700","172.20.40.110","151.101.66.187","TLSv1.2","2883","Application Data"
"255","25.271429200","151.101.66.187","172.20.40.110","TCP","60","443  >  57039 [ACK] Seq=82980 Ack=145401 Win=3347 Len=0"
"256","25.273084400","151.101.66.187","172.20.40.110","TLSv1.2","104","Application Data"
"257","25.314040300","151.101.66.187","172.20.40.110","TCP","104","[TCP Retransmission] 443  >  57039 [PSH, ACK] Seq=82980 Ack=145401 Win=3347 Len=50"
"258","25.314094300","172.20.40.110","151.101.66.187","TCP","66","57039  >  443 [ACK] Seq=145401 Ack=83030 Win=516 Len=0 SLE=82980 SRE=83030"
"259","25.352821500","172.20.40.110","151.101.66.187","TLSv1.2","2870","Application Data"
"260","25.356579500","172.20.40.110","151.101.66.187","TLSv1.2","2866","Application Data"
"261","25.365639300","151.101.66.187","172.20.40.110","TCP","60","443  >  57039 [ACK] Seq=83030 Ack=148217 Win=3358 Len=0"
"262","25.366137600","151.101.66.187","172.20.40.110","TCP","60","443  >  57039 [ACK] Seq=83030 Ack=151029 Win=3369 Len=0"
"263","25.368335200","151.101.66.187","172.20.40.110","TLSv1.2","98","Application Data"
"264","25.369477100","151.101.66.187","172.20.40.110","TLSv1.2","98","Application Data"
"265","25.369556500","172.20.40.110","151.101.66.187","TCP","54","57039  >  443 [ACK] Seq=151029 Ack=83118 Win=516 Len=0"
"266","25.373804900","172.20.40.110","151.101.66.187","TLSv1.2","2883","Application Data"
"267","25.384778600","151.101.66.187","172.20.40.110","TCP","60","443  >  57039 [ACK] Seq=83118 Ack=153858 Win=3380 Len=0"
"268","25.386199500","151.101.66.187","172.20.40.110","TLSv1.2","98","Application Data"
"269","25.415800600","151.101.66.187","172.20.40.110","TLSv1.2","434","Application Data"
"270","25.415800600","151.101.66.187","172.20.40.110","TLSv1.2","85","Application Data"
"271","25.415874000","172.20.40.110","151.101.66.187","TCP","54","57039  >  443 [ACK] Seq=153858 Ack=83573 Win=514 Len=0"
"272","25.439806000","172.20.40.110","151.101.66.187","TLSv1.2","2870","Application Data"
"273","25.444093800","172.20.40.110","151.101.66.187","TLSv1.2","2866","Application Data"
"274","25.449603400","151.101.66.187","172.20.40.110","TCP","9714","443  >  57039 [PSH, ACK] Seq=83573 Ack=153858 Win=3380 Len=9660 [TCP PDU reassembled in 277]"
"275","25.449690700","172.20.40.110","151.101.66.187","TCP","54","57039  >  443 [ACK] Seq=159486 Ack=93233 Win=517 Len=0"
"276","25.452148400","151.101.66.187","172.20.40.110","TCP","5574","443  >  57039 [ACK] Seq=93233 Ack=153858 Win=3380 Len=5520 [TCP PDU reassembled in 277]"
"277","25.452148400","151.101.66.187","172.20.40.110","TLSv1.2","481","Application Data"
"278","25.452148400","151.101.66.187","172.20.40.110","TCP","4194","443  >  57039 [ACK] Seq=99180 Ack=153858 Win=3380 Len=4140 [TCP PDU reassembled in 281]"
"279","25.452270500","172.20.40.110","151.101.66.187","TCP","54","57039  >  443 [ACK] Seq=159486 Ack=103320 Win=517 Len=0"
"280","25.453837200","151.101.66.187","172.20.40.110","TCP","4194","443  >  57039 [PSH, ACK] Seq=103320 Ack=153858 Win=3380 Len=4140 [TCP PDU reassembled in 281]"
"281","25.453837200","151.101.66.187","172.20.40.110","TLSv1.2","625","Application Data"
"282","25.453837200","151.101.66.187","172.20.40.110","TCP","60","443  >  57039 [ACK] Seq=108031 Ack=156674 Win=3391 Len=0"
"283","25.453837200","151.101.66.187","172.20.40.110","TLSv1.2","104","Application Data"
"284","25.453837200","151.101.66.187","172.20.40.110","TCP","60","443  >  57039 [ACK] Seq=108081 Ack=159486 Win=3402 Len=0"
"285","25.453966300","172.20.40.110","151.101.66.187","TCP","54","57039  >  443 [ACK] Seq=159486 Ack=108081 Win=517 Len=0"
"286","25.455079700","151.101.66.187","172.20.40.110","TLSv1.2","98","Application Data"
"287","25.460666000","151.101.66.187","172.20.40.110","TCP","5574","443  >  57039 [ACK] Seq=108125 Ack=159486 Win=3402 Len=5520 [TCP PDU reassembled in 288]"
"288","25.460666000","151.101.66.187","172.20.40.110","TLSv1.2","1165","Application Data"
"289","25.460666000","151.101.66.187","172.20.40.110","TCP","2814","443  >  57039 [ACK] Seq=114756 Ack=159486 Win=3402 Len=2760 [TCP PDU reassembled in 293]"
"290","25.460974800","172.20.40.110","151.101.66.187","TCP","54","57039  >  443 [ACK] Seq=159486 Ack=117516 Win=517 Len=0"
"291","25.463015300","151.101.66.187","172.20.40.110","TCP","9714","443  >  57039 [PSH, ACK] Seq=117516 Ack=159486 Win=3402 Len=9660 [TCP PDU reassembled in 293]"
"292","25.463095300","172.20.40.110","151.101.66.187","TCP","54","57039  >  443 [ACK] Seq=159486 Ack=127176 Win=517 Len=0"
"293","25.465450900","151.101.66.187","172.20.40.110","TLSv1.2","6954","Application Data"
"294","25.465450900","151.101.66.187","172.20.40.110","TLSv1.2","249","Application Data"
"295","25.465577700","172.20.40.110","151.101.66.187","TCP","54","57039  >  443 [ACK] Seq=159486 Ack=134271 Win=517 Len=0"
"296","25.484586200","172.20.40.110","151.101.66.187","TLSv1.2","2883","Application Data"
"297","25.495727500","151.101.66.187","172.20.40.110","TCP","60","443  >  57039 [ACK] Seq=134271 Ack=162315 Win=3413 Len=0"
"298","25.498115700","151.101.66.187","172.20.40.110","TLSv1.2","125","Application Data"
"299","25.534625700","151.101.66.187","172.20.40.110","TCP","125","[TCP Retransmission] 443  >  57039 [PSH, ACK] Seq=134271 Ack=162315 Win=3413 Len=71"
"300","25.534748400","172.20.40.110","151.101.66.187","TCP","66","57039  >  443 [ACK] Seq=162315 Ack=134342 Win=517 Len=0 SLE=134271 SRE=134342"
"301","25.540917200","172.20.40.110","151.101.66.187","TLSv1.2","2870","Application Data"
"302","25.541511900","172.20.40.110","151.101.66.187","TLSv1.2","2866","Application Data"
"303","25.552675500","151.101.66.187","172.20.40.110","TCP","60","443  >  57039 [ACK] Seq=134342 Ack=165131 Win=3424 Len=0"
"304","25.554005700","151.101.66.187","172.20.40.110","TCP","60","443  >  57039 [ACK] Seq=134342 Ack=167943 Win=3435 Len=0"
"305","25.556451500","151.101.66.187","172.20.40.110","TLSv1.2","98","Application Data"
"306","25.561282700","151.101.66.187","172.20.40.110","TLSv1.2","98","Application Data"
"307","25.561356900","172.20.40.110","151.101.66.187","TCP","54","57039  >  443 [ACK] Seq=167943 Ack=134430 Win=516 Len=0"
"308","25.697939500","151.101.66.187","172.20.40.110","TCP","6954","443  >  57039 [ACK] Seq=134430 Ack=167943 Win=3435 Len=6900 [TCP PDU reassembled in 309]"
"309","25.697939500","151.101.66.187","172.20.40.110","TLSv1.2","1084","Application Data"
"310","25.697939500","151.101.66.187","172.20.40.110","TCP","1434","443  >  57039 [ACK] Seq=142360 Ack=167943 Win=3435 Len=1380 [TCP PDU reassembled in 318]"
"311","25.698052700","172.20.40.110","151.101.66.187","TCP","54","57039  >  443 [ACK] Seq=167943 Ack=143740 Win=517 Len=0"
"312","25.702952100","151.101.66.187","172.20.40.110","TCP","1434","443  >  57039 [ACK] Seq=143740 Ack=167943 Win=3435 Len=1380 [TCP PDU reassembled in 318]"
"313","25.702952100","151.101.66.187","172.20.40.110","TCP","1434","443  >  57039 [ACK] Seq=145120 Ack=167943 Win=3435 Len=1380 [TCP PDU reassembled in 318]"
"314","25.702952100","151.101.66.187","172.20.40.110","TCP","1434","443  >  57039 [ACK] Seq=146500 Ack=167943 Win=3435 Len=1380 [TCP PDU reassembled in 318]"
"315","25.702952100","151.101.66.187","172.20.40.110","TCP","1434","443  >  57039 [ACK] Seq=147880 Ack=167943 Win=3435 Len=1380 [TCP PDU reassembled in 318]"
"316","25.702952100","151.101.66.187","172.20.40.110","TCP","4194","443  >  57039 [PSH, ACK] Seq=149260 Ack=167943 Win=3435 Len=4140 [TCP PDU reassembled in 318]"
"317","25.703063200","172.20.40.110","151.101.66.187","TCP","54","57039  >  443 [ACK] Seq=167943 Ack=153400 Win=517 Len=0"
"318","25.706094400","151.101.66.187","172.20.40.110","TLSv1.2","9714","Application Data, Application Data, Application Data"
"319","25.706178100","172.20.40.110","151.101.66.187","TCP","54","57039  >  443 [ACK] Seq=167943 Ack=163060 Win=517 Len=0"
"320","25.708880000","151.101.66.187","172.20.40.110","TLSv1.2","9714","Application Data, Application Data, Application Data, Application Data, Application Data"
"321","25.708968300","172.20.40.110","151.101.66.187","TCP","54","57039  >  443 [ACK] Seq=167943 Ack=172720 Win=517 Len=0"
"322","25.712079300","151.101.66.187","172.20.40.110","TLSv1.2","9714","Application Data, Application Data, Application Data, Application Data, Application Data, Application Data, Application Data"
"323","25.712210400","172.20.40.110","151.101.66.187","TCP","54","57039  >  443 [ACK] Seq=167943 Ack=182380 Win=517 Len=0"
"324","25.719300300","151.101.66.187","172.20.40.110","TCP","1434","443  >  57039 [ACK] Seq=182380 Ack=167943 Win=3435 Len=1380 [TCP PDU reassembled in 325]"
"325","25.719300300","151.101.66.187","172.20.40.110","TLSv1.2","1434","Application Data"
"326","25.719300300","151.101.66.187","172.20.40.110","TLSv1.2","1434","Application Data"
"327","25.719300300","151.101.66.187","172.20.40.110","TLSv1.2","1434","Application Data"
"328","25.719300300","151.101.66.187","172.20.40.110","TLSv1.2","1434","Application Data"
"329","25.719300300","151.101.66.187","172.20.40.110","TLSv1.2","1434","Application Data"
"330","25.719300300","151.101.66.187","172.20.40.110","TLSv1.2","1434","Application Data"
"331","25.719419300","172.20.40.110","151.101.66.187","TCP","54","57039  >  443 [ACK] Seq=167943 Ack=192040 Win=517 Len=0"
"332","25.721684200","151.101.66.187","172.20.40.110","TLSv1.2","4194","Application Data, Application Data"
"333","25.721684200","151.101.66.187","172.20.40.110","TLSv1.2","1149","Application Data"
"334","25.721792400","172.20.40.110","151.101.66.187","TCP","54","57039  >  443 [ACK] Seq=167943 Ack=197275 Win=517 Len=0"
"335","25.883678800","151.101.66.187","172.20.40.110","TCP","9714","443  >  57039 [PSH, ACK] Seq=197275 Ack=167943 Win=3435 Len=9660 [TCP PDU reassembled in 338]"
"336","25.883810900","172.20.40.110","151.101.66.187","TCP","54","57039  >  443 [ACK] Seq=167943 Ack=206935 Win=517 Len=0"
"337","25.886583300","151.101.66.187","172.20.40.110","TCP","5574","443  >  57039 [ACK] Seq=206935 Ack=167943 Win=3435 Len=5520 [TCP PDU reassembled in 338]"
"338","25.886583300","151.101.66.187","172.20.40.110","TLSv1.2","462","Application Data"
"339","25.886583300","151.101.66.187","172.20.40.110","TCP","4194","443  >  57039 [ACK] Seq=212863 Ack=167943 Win=3435 Len=4140 [TCP PDU reassembled in 345]"
"340","25.886680500","172.20.40.110","151.101.66.187","TCP","54","57039  >  443 [ACK] Seq=167943 Ack=217003 Win=517 Len=0"
"341","25.887900500","151.101.66.187","172.20.40.110","TCP","2814","443  >  57039 [ACK] Seq=217003 Ack=167943 Win=3435 Len=2760 [TCP PDU reassembled in 345]"
"342","25.887969200","172.20.40.110","151.101.66.187","TCP","54","57039  >  443 [ACK] Seq=167943 Ack=219763 Win=517 Len=0"
"343","25.894384500","151.101.66.187","172.20.40.110","TCP","1434","443  >  57039 [PSH, ACK] Seq=219763 Ack=167943 Win=3435 Len=1380 [TCP PDU reassembled in 345]"
"344","25.894384500","151.101.66.187","172.20.40.110","TCP","1434","443  >  57039 [ACK] Seq=221143 Ack=167943 Win=3435 Len=1380 [TCP PDU reassembled in 345]"
"345","25.894384500","151.101.66.187","172.20.40.110","TLSv1.2","13854","Application Data"
"346","25.894499400","172.20.40.110","151.101.66.187","TCP","54","57039  >  443 [ACK] Seq=167943 Ack=236323 Win=517 Len=0"
"347","25.898183500","151.101.66.187","172.20.40.110","TLSv1.2","9714","Application Data"
