"No.","Time","Source","Destination","Protocol","Length","Info"
"1","0.000000000","172.20.40.110","151.101.130.187","TLSv1.2","2794","Application Data"
"2","0.000187900","172.20.40.110","151.101.130.187","TLSv1.2","93","Application Data"
"3","0.014443200","151.101.130.187","172.20.40.110","TCP","60","443  >  62995 [ACK] Seq=1 Ack=2741 Win=5859 Len=0"
"4","0.014443200","151.101.130.187","172.20.40.110","TCP","60","443  >  62995 [ACK] Seq=1 Ack=2780 Win=5859 Len=0"
"5","0.014443200","151.101.130.187","172.20.40.110","TLSv1.2","93","Application Data"
"6","0.014471500","172.20.40.110","151.101.130.187","TLSv1.2","2794","Application Data"
"7","0.023228900","151.101.130.187","172.20.40.110","TLSv1.2","241","Application Data"
"8","0.024609200","151.101.130.187","172.20.40.110","TCP","60","443  >  62995 [ACK] Seq=227 Ack=5520 Win=5870 Len=0"
"9","0.028913500","172.20.40.110","151.101.130.187","TLSv1.2","2806","Application Data"
"10","0.029293700","151.101.130.187","172.20.40.110","TLSv1.2","131","Application Data"
"11","0.047982600","151.101.130.187","172.20.40.110","TCP","60","443  >  62995 [ACK] Seq=304 Ack=8272 Win=5876 Len=0"
"12","0.051174200","151.101.130.187","172.20.40.110","TLSv1.2","131","Application Data"
"13","0.051249200","172.20.40.110","151.101.130.187","TCP","54","62995  >  443 [ACK] Seq=8272 Ack=381 Win=508 Len=0"
"14","0.179630000","172.20.40.110","151.101.130.187","TLSv1.2","2811","Application Data"
"15","0.190042000","151.101.130.187","172.20.40.110","TCP","60","443  >  62995 [ACK] Seq=381 Ack=11029 Win=5886 Len=0"
"16","0.193332500","151.101.130.187","172.20.40.110","TLSv1.2","214","Application Data"
"17","0.234028900","151.101.130.187","172.20.40.110","TCP","214","[TCP Retransmission] 443  >  62995 [PSH, ACK] Seq=381 Ack=11029 Win=5886 Len=160"
"18","0.234135500","172.20.40.110","151.101.130.187","TCP","66","62995  >  443 [ACK] Seq=11029 Ack=541 Win=508 Len=0 SLE=381 SRE=541"
"19","1.988921100","172.20.40.110","151.101.130.187","TLSv1.2","2787","Application Data"
"20","1.992654800","172.20.40.110","151.101.130.187","TLSv1.2","2789","Application Data"
"21","2.000012800","151.101.130.187","172.20.40.110","TCP","60","443  >  62995 [ACK] Seq=541 Ack=13762 Win=5897 Len=0"
"22","2.001951500","172.20.40.110","151.101.130.187","TLSv1.2","2783","Application Data"
"23","2.002014600","151.101.130.187","172.20.40.110","TLSv1.2","372","Application Data"
"24","2.002221200","172.20.40.110","151.101.130.187","TLSv1.2","2785","Application Data"
"25","2.003614600","151.101.130.187","172.20.40.110","TCP","60","443  >  62995 [ACK] Seq=859 Ack=16497 Win=5908 Len=0"
"26","2.007481800","151.101.130.187","172.20.40.110","TLSv1.2","131","Application Data"
"27","2.013925900","151.101.130.187","172.20.40.110","TCP","60","443  >  62995 [ACK] Seq=936 Ack=19226 Win=5918 Len=0"
"28","2.013925900","151.101.130.187","172.20.40.110","TCP","60","443  >  62995 [ACK] Seq=936 Ack=21957 Win=5929 Len=0"
"29","2.015597900","172.20.40.110","151.101.130.187","TLSv1.2","2783","Application Data"
"30","2.017602100","151.101.130.187","172.20.40.110","TLSv1.2","132","Application Data"
"31","2.017602100","151.101.130.187","172.20.40.110","TLSv1.2","207","Application Data"
"32","2.017687600","172.20.40.110","151.101.130.187","TCP","54","62995  >  443 [ACK] Seq=24686 Ack=1167 Win=512 Len=0"
"33","2.026642600","172.20.40.110","151.101.130.187","TLSv1.2","2781","Application Data"
"34","2.028298500","151.101.130.187","172.20.40.110","TCP","60","443  >  62995 [ACK] Seq=1167 Ack=24686 Win=5940 Len=0"
"35","2.030764700","151.101.130.187","172.20.40.110","TLSv1.2","130","Application Data"
"36","2.037143700","151.101.130.187","172.20.40.110","TCP","60","443  >  62995 [ACK] Seq=1243 Ack=27413 Win=5950 Len=0"
"37","2.041492900","151.101.130.187","172.20.40.110","TLSv1.2","130","Application Data"
"38","2.041575900","172.20.40.110","151.101.130.187","TCP","54","62995  >  443 [ACK] Seq=27413 Ack=1319 Win=511 Len=0"
"39","2.069208300","172.20.40.110","151.101.130.187","TLSv1.2","2783","Application Data"
"40","2.079850200","151.101.130.187","172.20.40.110","TCP","60","443  >  62995 [ACK] Seq=1319 Ack=30142 Win=5961 Len=0"
"41","2.081445700","151.101.130.187","172.20.40.110","TLSv1.2","234","Application Data"
"42","2.119012600","151.101.130.187","172.20.40.110","TCP","234","[TCP Retransmission] 443  >  62995 [PSH, ACK] Seq=1319 Ack=30142 Win=5961 Len=180"
"43","2.119138100","172.20.40.110","151.101.130.187","TCP","66","62995  >  443 [ACK] Seq=30142 Ack=1499 Win=510 Len=0 SLE=1319 SRE=1499"
"44","2.615357700","172.20.40.110","151.101.130.187","TLSv1.2","2783","Application Data"
"45","2.627222000","151.101.130.187","172.20.40.110","TCP","60","443  >  62995 [ACK] Seq=1499 Ack=32871 Win=5967 Len=0"
"46","2.631544500","151.101.130.187","172.20.40.110","TLSv1.2","131","Application Data"
"47","2.665619800","151.101.130.187","172.20.40.110","TCP","131","[TCP Retransmission] 443  >  62995 [PSH, ACK] Seq=1499 Ack=32871 Win=5967 Len=77"
"48","2.665669000","172.20.40.110","151.101.130.187","TCP","66","62995  >  443 [ACK] Seq=32871 Ack=1576 Win=510 Len=0 SLE=1499 SRE=1576"
"49","4.925919100","172.20.40.110","151.101.130.187","TLSv1.2","2799","Application Data"
"50","4.926328400","172.20.40.110","151.101.130.187","TLSv1.2","2787","Application Data"
"51","4.929482300","172.20.40.110","151.101.130.187","TLSv1.2","2781","Application Data"
"52","4.932805800","172.20.40.110","151.101.130.187","TLSv1.2","2800","Application Data"
"53","4.937941400","151.101.130.187","172.20.40.110","TCP","60","443  >  62995 [ACK] Seq=1576 Ack=35616 Win=5977 Len=0"
"54","4.937941400","151.101.130.187","172.20.40.110","TCP","60","443  >  62995 [ACK] Seq=1576 Ack=38349 Win=5988 Len=0"
"55","4.940387100","151.101.130.187","172.20.40.110","TCP","60","443  >  62995 [ACK] Seq=1576 Ack=41076 Win=5999 Len=0"
"56","4.941551900","151.101.130.187","172.20.40.110","TLSv1.2","240","Application Data"
"57","4.942784700","151.101.130.187","172.20.40.110","TLSv1.2","130","Application Data"
"58","4.942784700","151.101.130.187","172.20.40.110","TLSv1.2","131","Application Data"
"59","4.942784700","151.101.130.187","172.20.40.110","TCP","60","443  >  62995 [ACK] Seq=1915 Ack=43822 Win=6009 Len=0"
"60","4.942926100","172.20.40.110","151.101.130.187","TCP","54","62995  >  443 [ACK] Seq=43822 Ack=1915 Win=509 Len=0"
"61","4.949178200","151.101.130.187","172.20.40.110","TLSv1.2","264","Application Data"
"62","4.949279000","172.20.40.110","151.101.130.187","TCP","54","62995  >  443 [ACK] Seq=43822 Ack=2125 Win=508 Len=0"
"63","5.119361300","172.20.40.110","151.101.130.187","TLSv1.2","2803","Application Data"
"64","5.130612200","151.101.130.187","172.20.40.110","TCP","60","443  >  62995 [ACK] Seq=2125 Ack=46571 Win=6020 Len=0"
"65","5.136079100","151.101.130.187","172.20.40.110","TLSv1.2","239","Application Data"
"66","5.169389100","151.101.130.187","172.20.40.110","TCP","239","[TCP Retransmission] 443  >  62995 [PSH, ACK] Seq=2125 Ack=46571 Win=6020 Len=185"
"67","5.169445400","172.20.40.110","151.101.130.187","TCP","66","62995  >  443 [ACK] Seq=46571 Ack=2310 Win=507 Len=0 SLE=2125 SRE=2310"
"68","5.215476700","172.20.40.110","151.101.130.187","TLSv1.2","2791","Application Data"
"69","5.227590700","151.101.130.187","172.20.40.110","TCP","60","443  >  62995 [ACK] Seq=2310 Ack=49308 Win=6031 Len=0"
"70","5.230266700","151.101.130.187","172.20.40.110","TLSv1.2","207","Application Data"
"71","5.266981400","151.101.130.187","172.20.40.110","TCP","207","[TCP Retransmission] 443  >  62995 [PSH, ACK] Seq=2310 Ack=49308 Win=6031 Len=153"
"72","5.267154400","172.20.40.110","151.101.130.187","TCP","66","62995  >  443 [ACK] Seq=49308 Ack=2463 Win=507 Len=0 SLE=2310 SRE=2463"
"73","5.270372700","172.20.40.110","151.101.130.187","TLSv1.2","2801","Application Data"
"74","5.271094100","172.20.40.110","151.101.130.187","TLSv1.2","2798","Application Data"
"75","5.271253900","172.20.40.110","151.101.130.187","TLSv1.2","2795","Application Data"
"76","5.279289700","151.101.130.187","172.20.40.110","TCP","60","443  >  62995 [ACK] Seq=2463 Ack=52055 Win=6042 Len=0"
"77","5.281772500","151.101.130.187","172.20.40.110","TLSv1.2","129","Application Data"
"78","5.283003400","151.101.130.187","172.20.40.110","TCP","60","443  >  62995 [ACK] Seq=2538 Ack=54799 Win=6052 Len=0"
"79","5.283003400","151.101.130.187","172.20.40.110","TCP","60","443  >  62995 [ACK] Seq=2538 Ack=57540 Win=6063 Len=0"
"80","5.285140300","151.101.130.187","172.20.40.110","TLSv1.2","184","Application Data"
"81","5.285223200","172.20.40.110","151.101.130.187","TCP","54","62995  >  443 [ACK] Seq=57540 Ack=2668 Win=512 Len=0"
"82","5.307159200","172.20.40.110","151.101.130.187","TLSv1.2","2785","Application Data"
"83","5.316284700","151.101.130.187","172.20.40.110","TCP","60","443  >  62995 [ACK] Seq=2668 Ack=60271 Win=6074 Len=0"
"84","5.316816500","172.20.40.110","151.101.130.187","TLSv1.2","2785","Application Data"
"85","5.323111700","151.101.130.187","172.20.40.110","TLSv1.2","131","Application Data"
"86","5.325222000","151.101.130.187","172.20.40.110","TCP","60","443  >  62995 [ACK] Seq=2745 Ack=63002 Win=6084 Len=0"
"87","5.328653900","151.101.130.187","172.20.40.110","TLSv1.2","131","Application Data"
"88","5.328728700","172.20.40.110","151.101.130.187","TCP","54","62995  >  443 [ACK] Seq=63002 Ack=2822 Win=511 Len=0"
"89","5.382193500","172.20.40.110","151.101.130.187","TLSv1.2","2797","Application Data"
"90","5.391527100","151.101.130.187","172.20.40.110","TCP","60","443  >  62995 [ACK] Seq=2822 Ack=65745 Win=6095 Len=0"
"91","5.395862100","151.101.130.187","172.20.40.110","TLSv1.2","125","Application Data"
"92","5.425824300","151.101.130.187","172.20.40.110","TCP","125","[TCP Retransmission] 443  >  62995 [PSH, ACK] Seq=2822 Ack=65745 Win=6095 Len=71"
"93","5.425881100","172.20.40.110","151.101.130.187","TCP","66","62995  >  443 [ACK] Seq=65745 Ack=2893 Win=511 Len=0 SLE=2822 SRE=2893"
"94","6.809083100","172.20.40.110","151.101.130.187","TLSv1.2","2763","Application Data"
"95","6.811322100","172.20.40.110","151.101.130.187","TLSv1.2","2761","Application Data"
"96","6.820872500","151.101.130.187","172.20.40.110","TCP","60","443  >  62995 [ACK] Seq=2893 Ack=68454 Win=6106 Len=0"
"97","6.824740700","151.101.130.187","172.20.40.110","TLSv1.2","214","Application Data"
"98","6.824740700","151.101.130.187","172.20.40.110","TCP","60","443  >  62995 [ACK] Seq=3053 Ack=71161 Win=6111 Len=0"
"99","6.824740700","151.101.130.187","172.20.40.110","TLSv1.2","104","Application Data"
"100","6.824826200","172.20.40.110","151.101.130.187","TCP","54","62995  >  443 [ACK] Seq=71161 Ack=3103 Win=510 Len=0"
"101","7.034840600","172.20.40.110","151.101.130.187","TLSv1.2","2764","Application Data"
"102","7.052508700","151.101.130.187","172.20.40.110","TCP","60","443  >  62995 [ACK] Seq=3103 Ack=73871 Win=6122 Len=0"
"103","7.052508700","151.101.130.187","172.20.40.110","TLSv1.2","104","Application Data"
"104","7.080472300","151.101.130.187","172.20.40.110","TCP","104","[TCP Retransmission] 443  >  62995 [PSH, ACK] Seq=3103 Ack=73871 Win=6122 Len=50"
"105","7.080530200","172.20.40.110","151.101.130.187","TCP","66","62995  >  443 [ACK] Seq=73871 Ack=3153 Win=510 Len=0 SLE=3103 SRE=3153"
"106","15.801065100","172.20.40.110","151.101.130.187","TLSv1.2","2758","Application Data"
"107","15.813580800","151.101.130.187","172.20.40.110","TCP","60","443  >  62995 [ACK] Seq=3153 Ack=76575 Win=6133 Len=0"
"108","15.815431400","151.101.130.187","172.20.40.110","TLSv1.2","374","Application Data"
"109","15.847305000","151.101.130.187","172.20.40.110","TCP","374","[TCP Retransmission] 443  >  62995 [PSH, ACK] Seq=3153 Ack=76575 Win=6133 Len=320"
"110","15.847393000","172.20.40.110","151.101.130.187","TCP","66","62995  >  443 [ACK] Seq=76575 Ack=3473 Win=508 Len=0 SLE=3153 SRE=3473"
"111","16.023638500","172.20.40.110","151.101.130.187","TLSv1.2","2749","Application Data"
"112","16.032801200","151.101.130.187","172.20.40.110","TCP","60","443  >  62995 [ACK] Seq=3473 Ack=79270 Win=6143 Len=0"
"113","16.037245200","151.101.130.187","172.20.40.110","TLSv1.2","104","Application Data"
"114","16.070102200","151.101.130.187","172.20.40.110","TCP","104","[TCP Retransmission] 443  >  62995 [PSH, ACK] Seq=3473 Ack=79270 Win=6143 Len=50"
"115","16.070263100","172.20.40.110","151.101.130.187","TCP","66","62995  >  443 [ACK] Seq=79270 Ack=3523 Win=508 Len=0 SLE=3473 SRE=3523"
"116","22.713492000","172.20.40.110","151.101.2.187","TCP","55","54874  >  443 [ACK] Seq=1 Ack=1 Win=256 Len=1"
"117","22.724362200","151.101.2.187","172.20.40.110","TCP","66","443  >  54874 [ACK] Seq=1 Ack=2 Win=282 Len=0 SLE=1 SRE=2"
"118","30.435921100","172.20.40.110","151.101.130.187","TLSv1.2","2755","Application Data"
"119","30.436029800","172.20.40.110","151.101.130.187","TLSv1.2","93","Application Data"
"120","30.446451300","151.101.130.187","172.20.40.110","TCP","60","443  >  62995 [ACK] Seq=3523 Ack=81971 Win=6154 Len=0"
"121","30.446451300","151.101.130.187","172.20.40.110","TCP","60","443  >  62995 [ACK] Seq=3523 Ack=82010 Win=6154 Len=0"
"122","30.446451300","151.101.130.187","172.20.40.110","TLSv1.2","93","Application Data"
"123","30.449507200","172.20.40.110","151.101.130.187","TLSv1.2","2751","Application Data"
"124","30.449689400","151.101.130.187","172.20.40.110","TLSv1.2","239","Application Data"
"125","30.453326000","172.20.40.110","151.101.130.187","TLSv1.2","2753","Application Data"
"126","30.459486500","172.20.40.110","151.101.130.187","TLSv1.2","2757","Application Data"
"127","30.461186700","151.101.130.187","172.20.40.110","TCP","60","443  >  62995 [ACK] Seq=3747 Ack=84707 Win=6159 Len=0"
"128","30.464576000","151.101.130.187","172.20.40.110","TLSv1.2","209","Application Data"
"129","30.464996600","151.101.130.187","172.20.40.110","TCP","60","443  >  62995 [ACK] Seq=3902 Ack=87406 Win=6170 Len=0"
"130","30.468607300","151.101.130.187","172.20.40.110","TLSv1.2","130","Application Data"
"131","30.468693600","172.20.40.110","151.101.130.187","TCP","54","62995  >  443 [ACK] Seq=90109 Ack=3978 Win=506 Len=0"
"132","30.470042500","151.101.130.187","172.20.40.110","TCP","60","443  >  62995 [ACK] Seq=3978 Ack=90109 Win=6180 Len=0"
"133","30.473028700","151.101.130.187","172.20.40.110","TLSv1.2","131","Application Data"
"134","30.483343500","172.20.40.110","151.101.130.187","TLSv1.2","2751","Application Data"
"135","30.485309000","172.20.40.110","151.101.130.187","TLSv1.2","2753","Application Data"
"136","30.487083500","172.20.40.110","151.101.130.187","TLSv1.2","2749","Application Data"
"137","30.492037800","151.101.130.187","172.20.40.110","TCP","60","443  >  62995 [ACK] Seq=4055 Ack=92806 Win=6191 Len=0"
"138","30.494261400","151.101.130.187","172.20.40.110","TCP","60","443  >  62995 [ACK] Seq=4055 Ack=95505 Win=6201 Len=0"
"139","30.496416500","151.101.130.187","172.20.40.110","TCP","60","443  >  62995 [ACK] Seq=4055 Ack=98200 Win=6212 Len=0"
"140","30.496416500","151.101.130.187","172.20.40.110","TLSv1.2","130","Application Data"
"141","30.498684000","151.101.130.187","172.20.40.110","TLSv1.2","98","Application Data"
"142","30.498684000","151.101.130.187","172.20.40.110","TLSv1.2","130","Application Data"
"143","30.498766200","172.20.40.110","151.101.130.187","TCP","54","62995  >  443 [ACK] Seq=98200 Ack=4251 Win=511 Len=0"
"144","30.516152300","172.20.40.110","151.101.130.187","TLSv1.2","2755","Application Data"
"145","30.524983900","151.101.130.187","172.20.40.110","TCP","60","443  >  62995 [ACK] Seq=4251 Ack=100901 Win=6223 Len=0"
"146","30.528380300","151.101.130.187","172.20.40.110","TLSv1.2","103","Application Data"
"147","30.539400500","172.20.40.110","151.101.130.187","TLSv1.2","2751","Application Data"
"148","30.541516600","172.20.40.110","151.101.130.187","TLSv1.2","2757","Application Data"
"149","30.549088200","172.20.40.110","151.101.130.187","TLSv1.2","2753","Application Data"
"150","30.552000500","151.101.130.187","172.20.40.110","TCP","60","443  >  62995 [ACK] Seq=4300 Ack=103598 Win=6233 Len=0"
"151","30.552000500","151.101.130.187","172.20.40.110","TCP","60","443  >  62995 [ACK] Seq=4300 Ack=106301 Win=6244 Len=0"
"152","30.552957700","151.101.130.187","172.20.40.110","TLSv1.2","142","Application Data, Application Data"
"153","30.553075800","172.20.40.110","151.101.130.187","TCP","54","62995  >  443 [ACK] Seq=109000 Ack=4388 Win=510 Len=0"
"154","30.559388200","151.101.130.187","172.20.40.110","TCP","60","443  >  62995 [ACK] Seq=4388 Ack=109000 Win=6254 Len=0"
"155","30.561898100","151.101.130.187","172.20.40.110","TLSv1.2","98","Application Data"
"156","30.574811400","172.20.40.110","151.101.130.187","TLSv1.2","2751","Application Data"
"157","30.577861900","172.20.40.110","151.101.130.187","TLSv1.2","2749","Application Data"
"158","30.583585800","151.101.130.187","172.20.40.110","TCP","60","443  >  62995 [ACK] Seq=4432 Ack=111697 Win=6265 Len=0"
"159","30.586861800","151.101.130.187","172.20.40.110","TLSv1.2","98","Application Data"
"160","30.586861800","151.101.130.187","172.20.40.110","TCP","60","443  >  62995 [ACK] Seq=4476 Ack=114392 Win=6275 Len=0"
"161","30.588865200","151.101.130.187","172.20.40.110","TLSv1.2","98","Application Data"
"162","30.588941700","172.20.40.110","151.101.130.187","TCP","54","62995  >  443 [ACK] Seq=114392 Ack=4520 Win=510 Len=0"
"163","30.824973600","172.20.40.110","151.101.130.187","TLSv1.2","2751","Application Data"
"164","30.834027200","151.101.130.187","172.20.40.110","TCP","60","443  >  62995 [ACK] Seq=4520 Ack=117089 Win=6286 Len=0"
"165","30.837437400","151.101.130.187","172.20.40.110","TLSv1.2","124","Application Data"
"166","30.870455100","151.101.130.187","172.20.40.110","TCP","124","[TCP Retransmission] 443  >  62995 [PSH, ACK] Seq=4520 Ack=117089 Win=6286 Len=70"
"167","30.870532500","172.20.40.110","151.101.130.187","TCP","66","62995  >  443 [ACK] Seq=117089 Ack=4590 Win=510 Len=0 SLE=4520 SRE=4590"
"168","31.082856400","172.20.40.110","151.101.130.187","TLSv1.2","2751","Application Data"
"169","31.093909800","151.101.130.187","172.20.40.110","TCP","60","443  >  62995 [ACK] Seq=4590 Ack=119786 Win=6296 Len=0"
"170","31.097746600","151.101.130.187","172.20.40.110","TLSv1.2","241","Application Data"
"171","31.129274600","151.101.130.187","172.20.40.110","TCP","241","[TCP Retransmission] 443  >  62995 [PSH, ACK] Seq=4590 Ack=119786 Win=6296 Len=187"
"172","31.129331900","172.20.40.110","151.101.130.187","TCP","66","62995  >  443 [ACK] Seq=119786 Ack=4777 Win=509 Len=0 SLE=4590 SRE=4777"
"173","31.249683500","172.20.40.110","151.101.66.187","TCP","55","56717  >  443 [ACK] Seq=1 Ack=1 Win=254 Len=1"
"174","31.266140600","151.101.66.187","172.20.40.110","TCP","66","443  >  56717 [ACK] Seq=1 Ack=2 Win=198 Len=0 SLE=1 SRE=2"
"175","31.840296800","172.20.40.110","151.101.130.187","TLSv1.2","2797","Application Data"
"176","31.850930000","151.101.130.187","172.20.40.110","TCP","60","443  >  62995 [ACK] Seq=4777 Ack=122529 Win=6307 Len=0"
"177","31.851851000","172.20.40.110","151.101.130.187","TLSv1.2","2782","Application Data"
"178","31.853114600","172.20.40.110","151.101.130.187","TLSv1.2","2788","Application Data"
"179","31.854321000","151.101.130.187","172.20.40.110","TLSv1.2","131","Application Data"
"180","31.861701300","151.101.130.187","172.20.40.110","TCP","60","443  >  62995 [ACK] Seq=4854 Ack=125257 Win=6318 Len=0"
"181","31.863048600","151.101.130.187","172.20.40.110","TCP","60","443  >  62995 [ACK] Seq=4854 Ack=127991 Win=6328 Len=0"
"182","31.864176200","151.101.130.187","172.20.40.110","TLSv1.2","263","Application Data"
"183","31.864247100","172.20.40.110","151.101.130.187","TCP","54","62995  >  443 [ACK] Seq=127991 Ack=5063 Win=508 Len=0"
"184","31.866312600","151.101.130.187","172.20.40.110","TLSv1.2","130","Application Data"
"185","31.905426100","151.101.130.187","172.20.40.110","TCP","130","[TCP Retransmission] 443  >  62995 [PSH, ACK] Seq=5063 Ack=127991 Win=6328 Len=76"
"186","31.905480300","172.20.40.110","151.101.130.187","TCP","66","62995  >  443 [ACK] Seq=127991 Ack=5139 Win=507 Len=0 SLE=5063 SRE=5139"
"187","31.914131400","172.20.40.110","151.101.130.187","TLSv1.2","2782","Application Data"
"188","31.924575700","151.101.130.187","172.20.40.110","TCP","60","443  >  62995 [ACK] Seq=5139 Ack=130719 Win=6339 Len=0"
"189","31.927009200","151.101.130.187","172.20.40.110","TLSv1.2","104","Application Data"
"190","31.960372900","151.101.130.187","172.20.40.110","TCP","104","[TCP Retransmission] 443  >  62995 [PSH, ACK] Seq=5139 Ack=130719 Win=6339 Len=50"
"191","31.960438600","172.20.40.110","151.101.130.187","TCP","66","62995  >  443 [ACK] Seq=130719 Ack=5189 Win=507 Len=0 SLE=5139 SRE=5189"
"192","32.062381000","172.20.40.110","151.101.130.187","TLSv1.2","2779","Application Data"
"193","32.072604700","151.101.130.187","172.20.40.110","TCP","60","443  >  62995 [ACK] Seq=5189 Ack=133444 Win=6350 Len=0"
"194","32.075831700","151.101.130.187","172.20.40.110","TLSv1.2","241","Application Data"
"195","32.077223900","172.20.40.110","151.101.130.187","TLSv1.2","2796","Application Data"
"196","32.093501500","151.101.130.187","172.20.40.110","TCP","60","443  >  62995 [ACK] Seq=5376 Ack=136186 Win=6360 Len=0"
"197","32.093501500","151.101.130.187","172.20.40.110","TLSv1.2","207","Application Data"
"198","32.115451100","172.20.40.110","151.101.130.187","TLSv1.2","2796","Application Data"
"199","32.122589300","151.101.130.187","172.20.40.110","TCP","207","[TCP Spurious Retransmission] 443  >  62995 [PSH, ACK] Seq=5376 Ack=136186 Win=6360 Len=153"
"200","32.122647600","172.20.40.110","151.101.130.187","TCP","66","[TCP Dup ACK 198#1] 62995  >  443 [ACK] Seq=138928 Ack=5529 Win=512 Len=0 SLE=5376 SRE=5529"
"201","32.126059100","151.101.130.187","172.20.40.110","TCP","60","443  >  62995 [ACK] Seq=5529 Ack=138928 Win=6371 Len=0"
"202","32.128425000","151.101.130.187","172.20.40.110","TLSv1.2","131","Application Data"
"203","32.162657700","151.101.130.187","172.20.40.110","TCP","131","[TCP Retransmission] 443  >  62995 [PSH, ACK] Seq=5529 Ack=138928 Win=6371 Len=77"
"204","32.162724300","172.20.40.110","151.101.130.187","TCP","66","62995  >  443 [ACK] Seq=138928 Ack=5606 Win=511 Len=0 SLE=5529 SRE=5606"
"205","32.305817300","172.20.40.110","151.101.130.187","TLSv1.2","2739","Application Data"
"206","32.306720800","172.20.40.110","151.101.130.187","TLSv1.2","2782","Application Data"
"207","32.317674800","151.101.130.187","172.20.40.110","TCP","60","443  >  62995 [ACK] Seq=5606 Ack=141613 Win=6382 Len=0"
"208","32.320964500","151.101.130.187","172.20.40.110","TLSv1.2","174","Application Data"
"209","32.320964500","151.101.130.187","172.20.40.110","TCP","2814","443  >  62995 [ACK] Seq=5726 Ack=141613 Win=6382 Len=2760 [TCP PDU reassembled in 210]"
"210","32.320964500","151.101.130.187","172.20.40.110","TLSv1.2","151","Application Data"
"211","32.320964500","151.101.130.187","172.20.40.110","TCP","60","443  >  62995 [ACK] Seq=8583 Ack=144341 Win=6392 Len=0"
"212","32.321078700","172.20.40.110","151.101.130.187","TCP","54","62995  >  443 [ACK] Seq=144341 Ack=8583 Win=512 Len=0"
"213","32.322313800","151.101.130.187","172.20.40.110","TLSv1.2","130","Application Data"
"214","32.323730900","172.20.40.110","151.101.130.187","TLSv1.2","89","Application Data"
"215","32.331741200","151.101.130.187","172.20.40.110","TCP","60","443  >  62995 [ACK] Seq=8659 Ack=144376 Win=6392 Len=0"
"216","32.456838900","172.20.40.110","151.101.130.187","TLSv1.2","2826","Application Data"
"217","32.461907100","172.20.40.110","151.101.130.187","TLSv1.2","2828","Application Data"
"218","32.463053200","172.20.40.110","151.101.130.187","TLSv1.2","2827","Application Data"
"219","32.463304400","172.20.40.110","151.101.130.187","TLSv1.2","2824","Application Data"
"220","32.480894500","151.101.130.187","172.20.40.110","TCP","60","443  >  62995 [ACK] Seq=8659 Ack=147148 Win=6392 Len=0"
"221","32.482837100","151.101.130.187","172.20.40.110","TLSv1.2","130","Application Data"
"222","32.482837100","151.101.130.187","172.20.40.110","TCP","60","443  >  62995 [ACK] Seq=8735 Ack=149922 Win=6392 Len=0"
"223","32.482837100","151.101.130.187","172.20.40.110","TCP","60","443  >  62995 [ACK] Seq=8735 Ack=152695 Win=6392 Len=0"
"224","32.482837100","151.101.130.187","172.20.40.110","TCP","60","443  >  62995 [ACK] Seq=8735 Ack=155465 Win=6392 Len=0"
"225","32.484518600","151.101.130.187","172.20.40.110","TLSv1.2","177","Application Data"
"226","32.484595900","172.20.40.110","151.101.130.187","TCP","54","62995  >  443 [ACK] Seq=155465 Ack=8858 Win=511 Len=0"
"227","32.485848200","151.101.130.187","172.20.40.110","TLSv1.2","130","Application Data"
"228","32.523920700","151.101.130.187","172.20.40.110","TCP","130","[TCP Retransmission] 443  >  62995 [PSH, ACK] Seq=8858 Ack=155465 Win=6392 Len=76"
"229","32.524026300","172.20.40.110","151.101.130.187","TCP","66","62995  >  443 [ACK] Seq=155465 Ack=8934 Win=510 Len=0 SLE=8858 SRE=8934"
"230","37.860688700","172.20.40.110","151.101.130.187","TLSv1.2","2796","Application Data"
"231","37.871362500","151.101.130.187","172.20.40.110","TCP","60","443  >  62995 [ACK] Seq=8934 Ack=158207 Win=6403 Len=0"
"232","37.872577000","151.101.130.187","172.20.40.110","TLSv1.2","347","Application Data"
"233","37.906270500","151.101.130.187","172.20.40.110","TCP","347","[TCP Retransmission] 443  >  62995 [PSH, ACK] Seq=8934 Ack=158207 Win=6403 Len=293"
"234","37.906492200","172.20.40.110","151.101.130.187","TCP","66","62995  >  443 [ACK] Seq=158207 Ack=9227 Win=509 Len=0 SLE=8934 SRE=9227"
"235","37.909938800","172.20.40.110","151.101.130.187","TLSv1.2","2797","Application Data"
"236","37.920076800","151.101.130.187","172.20.40.110","TCP","60","443  >  62995 [ACK] Seq=9227 Ack=160950 Win=6414 Len=0"
"237","37.921947100","151.101.130.187","172.20.40.110","TLSv1.2","131","Application Data"
"238","37.955286800","151.101.130.187","172.20.40.110","TCP","131","[TCP Retransmission] 443  >  62995 [PSH, ACK] Seq=9227 Ack=160950 Win=6414 Len=77"
"239","37.955358400","172.20.40.110","151.101.130.187","TCP","66","62995  >  443 [ACK] Seq=160950 Ack=9304 Win=509 Len=0 SLE=9227 SRE=9304"
"240","38.705908700","172.20.40.110","151.101.130.187","TLSv1.2","2782","Application Data"
"241","38.715076800","151.101.130.187","172.20.40.110","TCP","60","443  >  62995 [ACK] Seq=9304 Ack=163678 Win=6424 Len=0"
"242","38.724200700","151.101.130.187","172.20.40.110","TLSv1.2","240","Application Data"
"243","38.755297500","151.101.130.187","172.20.40.110","TCP","240","[TCP Retransmission] 443  >  62995 [PSH, ACK] Seq=9304 Ack=163678 Win=6424 Len=186"
"244","38.755349900","172.20.40.110","151.101.130.187","TCP","66","62995  >  443 [ACK] Seq=163678 Ack=9490 Win=508 Len=0 SLE=9304 SRE=9490"
"245","38.828785600","172.20.40.110","151.101.130.187","TLSv1.2","2785","Application Data"
"246","38.847010600","151.101.130.187","172.20.40.110","TCP","60","443  >  62995 [ACK] Seq=9490 Ack=166409 Win=6435 Len=0"
"247","38.847010600","151.101.130.187","172.20.40.110","TLSv1.2","207","Application Data"
"248","38.871650800","172.20.40.110","151.101.130.187","TLSv1.2","2787","Application Data"
"249","38.874162000","151.101.130.187","172.20.40.110","TCP","207","[TCP Spurious Retransmission] 443  >  62995 [PSH, ACK] Seq=9490 Ack=166409 Win=6435 Len=153"
"250","38.874213800","172.20.40.110","151.101.130.187","TCP","66","[TCP Dup ACK 248#1] 62995  >  443 [ACK] Seq=169142 Ack=9643 Win=507 Len=0 SLE=9490 SRE=9643"
"251","38.885074900","151.101.130.187","172.20.40.110","TCP","60","443  >  62995 [ACK] Seq=9643 Ack=169142 Win=6446 Len=0"
"252","38.885074900","151.101.130.187","172.20.40.110","TLSv1.2","130","Application Data"
"253","38.915984900","151.101.130.187","172.20.40.110","TCP","130","[TCP Retransmission] 443  >  62995 [PSH, ACK] Seq=9643 Ack=169142 Win=6446 Len=76"
"254","38.916073000","172.20.40.110","151.101.130.187","TCP","66","62995  >  443 [ACK] Seq=169142 Ack=9719 Win=507 Len=0 SLE=9643 SRE=9719"
"255","44.104642200","172.20.40.110","151.101.130.187","TLSv1.2","2845","Application Data"
"256","44.115949500","151.101.130.187","172.20.40.110","TCP","60","443  >  62995 [ACK] Seq=9719 Ack=171933 Win=6446 Len=0"
"257","44.885446400","151.101.130.187","172.20.40.110","TCP","4194","443  >  62995 [ACK] Seq=9719 Ack=171933 Win=6446 Len=4140 [TCP PDU reassembled in 261]"
"258","44.885560700","172.20.40.110","151.101.130.187","TCP","54","62995  >  443 [ACK] Seq=171933 Ack=13859 Win=512 Len=0"
"259","44.890607300","151.101.130.187","172.20.40.110","TCP","1434","443  >  62995 [ACK] Seq=13859 Ack=171933 Win=6446 Len=1380 [TCP PDU reassembled in 261]"
"260","44.890607300","151.101.130.187","172.20.40.110","TCP","1434","443  >  62995 [ACK] Seq=15239 Ack=171933 Win=6446 Len=1380 [TCP PDU reassembled in 261]"
"261","44.890607300","151.101.130.187","172.20.40.110","TLSv1.2","1320","Application Data"
"262","44.890607300","151.101.130.187","172.20.40.110","TCP","1434","443  >  62995 [ACK] Seq=17885 Ack=171933 Win=6446 Len=1380 [TCP PDU reassembled in 270]"
"263","44.890607300","151.101.130.187","172.20.40.110","TCP","1434","443  >  62995 [ACK] Seq=19265 Ack=171933 Win=6446 Len=1380 [TCP PDU reassembled in 270]"
"264","44.890744500","172.20.40.110","151.101.130.187","TCP","54","62995  >  443 [ACK] Seq=171933 Ack=20645 Win=512 Len=0"
"265","44.893482400","151.101.130.187","172.20.40.110","TCP","5574","443  >  62995 [ACK] Seq=20645 Ack=171933 Win=6446 Len=5520 [TCP PDU reassembled in 270]"
"266","44.893596700","172.20.40.110","151.101.130.187","TCP","54","62995  >  443 [ACK] Seq=171933 Ack=26165 Win=512 Len=0"
"267","44.895656100","151.101.130.187","172.20.40.110","TCP","5574","443  >  62995 [PSH, ACK] Seq=26165 Ack=171933 Win=6446 Len=5520 [TCP PDU reassembled in 270]"
"268","44.895761200","172.20.40.110","151.101.130.187","TCP","54","62995  >  443 [ACK] Seq=171933 Ack=31685 Win=512 Len=0"
"269","44.896654700","172.20.40.110","151.101.130.187","TLSv1.2","89","Application Data"
"270","44.898314600","151.101.130.187","172.20.40.110","TLSv1.2","2814","Application Data"
"271","44.898314600","151.101.130.187","172.20.40.110","TLSv1.2","1386","Application Data"
"272","44.898314600","151.101.130.187","172.20.40.110","TCP","2814","443  >  62995 [ACK] Seq=35777 Ack=171933 Win=6446 Len=2760 [TCP PDU reassembled in 277]"
"273","44.898439800","172.20.40.110","151.101.130.187","TCP","54","62995  >  443 [ACK] Seq=171968 Ack=38537 Win=512 Len=0"
"274","44.903335200","151.101.130.187","172.20.40.110","TCP","1434","443  >  62995 [ACK] Seq=38537 Ack=171933 Win=6446 Len=1380 [TCP PDU reassembled in 277]"
"275","44.903335200","151.101.130.187","172.20.40.110","TCP","1434","443  >  62995 [ACK] Seq=39917 Ack=171933 Win=6446 Len=1380 [TCP PDU reassembled in 277]"
"276","44.903335200","151.101.130.187","172.20.40.110","TCP","1434","443  >  62995 [ACK] Seq=41297 Ack=171933 Win=6446 Len=1380 [TCP PDU reassembled in 277]"
"277","44.903335200","151.101.130.187","172.20.40.110","TLSv1.2","1434","Application Data, Application Data"
"278","44.903468900","172.20.40.110","151.101.130.187","TCP","54","62995  >  443 [ACK] Seq=171968 Ack=44057 Win=512 Len=0"
"279","44.908169000","151.101.130.187","172.20.40.110","TLSv1.2","1434","Application Data"
"280","44.908169000","151.101.130.187","172.20.40.110","TLSv1.2","8334","Application Data"
"281","44.908298500","172.20.40.110","151.101.130.187","TCP","54","62995  >  443 [ACK] Seq=171968 Ack=53717 Win=512 Len=0"
"282","44.910344900","151.101.130.187","172.20.40.110","TCP","5574","443  >  62995 [PSH, ACK] Seq=53717 Ack=171933 Win=6446 Len=5520 [TCP PDU reassembled in 284]"
"283","44.910459700","172.20.40.110","151.101.130.187","TCP","54","62995  >  443 [ACK] Seq=171968 Ack=59237 Win=512 Len=0"
"284","44.913037100","151.101.130.187","172.20.40.110","TLSv1.2","4194","Application Data"
"285","44.913037100","151.101.130.187","172.20.40.110","TLSv1.2","569","Application Data, Application Data"
"286","44.913037100","151.101.130.187","172.20.40.110","TCP","569","[TCP Retransmission] 443  >  62995 [PSH, ACK] Seq=63377 Ack=171933 Win=6446 Len=515"
"287","44.913037100","151.101.130.187","172.20.40.110","TCP","60","443  >  62995 [ACK] Seq=63892 Ack=171968 Win=6446 Len=0"
"288","44.913203200","172.20.40.110","151.101.130.187","TCP","66","62995  >  443 [ACK] Seq=171968 Ack=63892 Win=512 Len=0 SLE=63377 SRE=63892"
"289","45.316491000","172.20.40.110","151.101.130.187","TLSv1.2","2834","Application Data"
"290","45.325698100","151.101.130.187","172.20.40.110","TCP","60","443  >  62995 [ACK] Seq=63892 Ack=174748 Win=6446 Len=0"
"291","45.331796500","172.20.40.110","151.101.130.187","TLSv1.2","2828","Application Data"
"292","45.333804700","172.20.40.110","151.101.130.187","TLSv1.2","2830","Application Data"
"293","45.334333900","172.20.40.110","151.101.130.187","TLSv1.2","2828","Application Data"
"294","45.336603400","151.101.130.187","172.20.40.110","TLSv1.2","241","Application Data"
"295","45.340498600","172.20.40.110","151.101.130.187","TLSv1.2","2826","Application Data"
"296","45.340991700","151.101.130.187","172.20.40.110","TCP","60","443  >  62995 [ACK] Seq=64079 Ack=177522 Win=6446 Len=0"
"297","45.342696000","172.20.40.110","151.101.130.187","TLSv1.2","2845","Application Data"
"298","45.342951700","172.20.40.110","151.101.130.187","TLSv1.2","2836","Application Data"
"299","45.343407200","151.101.130.187","172.20.40.110","TCP","60","443  >  62995 [ACK] Seq=64079 Ack=180298 Win=6446 Len=0"
"300","45.348331700","151.101.130.187","172.20.40.110","TLSv1.2","265","Application Data"
"301","45.349738400","151.101.130.187","172.20.40.110","TLSv1.2","104","Application Data"
"302","45.349738400","151.101.130.187","172.20.40.110","TCP","60","443  >  62995 [ACK] Seq=64340 Ack=183072 Win=6446 Len=0"
"303","45.349738400","151.101.130.187","172.20.40.110","TLSv1.2","130","Application Data"
"304","45.349738400","151.101.130.187","172.20.40.110","TCP","60","443  >  62995 [ACK] Seq=64416 Ack=185844 Win=6446 Len=0"
"305","45.349839400","172.20.40.110","151.101.130.187","TCP","54","62995  >  443 [ACK] Seq=191417 Ack=64416 Win=510 Len=0"
"306","45.352871000","151.101.130.187","172.20.40.110","TLSv1.2","130","Application Data"
"307","45.352945200","172.20.40.110","151.101.130.187","TCP","54","62995  >  443 [ACK] Seq=191417 Ack=64492 Win=509 Len=0"
"308","45.354105900","151.101.130.187","172.20.40.110","TCP","60","443  >  62995 [ACK] Seq=64492 Ack=188635 Win=6446 Len=0"
"309","45.354105900","151.101.130.187","172.20.40.110","TCP","60","443  >  62995 [ACK] Seq=64492 Ack=191417 Win=6446 Len=0"
"310","45.372647200","151.101.130.187","172.20.40.110","TLSv1.2","125","Application Data"
"311","45.372647200","151.101.130.187","172.20.40.110","TLSv1.2","130","Application Data"
"312","45.372817200","172.20.40.110","151.101.130.187","TCP","54","62995  >  443 [ACK] Seq=191417 Ack=64639 Win=509 Len=0"
"313","45.395763600","172.20.40.110","151.101.130.187","TLSv1.2","2830","Application Data"
"314","45.400017000","172.20.40.110","151.101.130.187","TLSv1.2","2830","Application Data"
"315","45.400272400","172.20.40.110","151.101.130.187","TLSv1.2","2844","Application Data"
"316","45.417224200","151.101.130.187","172.20.40.110","TCP","60","443  >  62995 [ACK] Seq=64639 Ack=194193 Win=6446 Len=0"
"317","45.422443300","151.101.130.187","172.20.40.110","TLSv1.2","208","Application Data"
"318","45.424498900","151.101.130.187","172.20.40.110","TCP","60","443  >  62995 [ACK] Seq=64793 Ack=196969 Win=6446 Len=0"
"319","45.424498900","151.101.130.187","172.20.40.110","TCP","60","443  >  62995 [ACK] Seq=64793 Ack=199759 Win=6446 Len=0"
"320","45.426973500","151.101.130.187","172.20.40.110","TLSv1.2","206","Application Data, Application Data"
"321","45.427128600","172.20.40.110","151.101.130.187","TCP","54","62995  >  443 [ACK] Seq=199759 Ack=64945 Win=507 Len=0"
"322","45.432280700","172.20.40.110","151.101.130.187","TLSv1.2","2838","Application Data"
"323","45.444094300","172.20.40.110","151.101.130.187","TLSv1.2","2836","Application Data"
"324","45.444374800","172.20.40.110","151.101.130.187","TLSv1.2","2833","Application Data"
"325","45.452720000","151.101.130.187","172.20.40.110","TCP","60","443  >  62995 [ACK] Seq=64945 Ack=202543 Win=6446 Len=0"
"326","45.455458800","151.101.130.187","172.20.40.110","TLSv1.2","124","Application Data"
"327","45.462545900","151.101.130.187","172.20.40.110","TCP","60","443  >  62995 [ACK] Seq=65015 Ack=205325 Win=6446 Len=0"
"328","45.462545900","151.101.130.187","172.20.40.110","TCP","60","443  >  62995 [ACK] Seq=65015 Ack=208104 Win=6446 Len=0"
"329","45.464640300","151.101.130.187","172.20.40.110","TLSv1.2","129","Application Data"
"330","45.464640300","151.101.130.187","172.20.40.110","TLSv1.2","131","Application Data"
"331","45.464735100","172.20.40.110","151.101.130.187","TCP","54","62995  >  443 [ACK] Seq=208104 Ack=65167 Win=507 Len=0"
"332","45.494631100","172.20.40.110","151.101.130.187","TLSv1.2","2828","Application Data"
"333","45.512855300","151.101.130.187","172.20.40.110","TCP","60","443  >  62995 [ACK] Seq=65167 Ack=210878 Win=6446 Len=0"
"334","45.515426900","151.101.130.187","172.20.40.110","TLSv1.2","124","Application Data"
"335","45.555771300","172.20.40.110","151.101.130.187","TCP","54","62995  >  443 [ACK] Seq=210878 Ack=65237 Win=506 Len=0"
"336","47.727439400","172.20.40.110","151.101.130.187","TLSv1.2","2840","Application Data"
"337","47.727742000","172.20.40.110","151.101.130.187","TLSv1.2","2834","Application Data"
"338","47.736582200","151.101.130.187","172.20.40.110","TCP","60","443  >  62995 [ACK] Seq=65237 Ack=213664 Win=6446 Len=0"
"339","47.739219100","151.101.130.187","172.20.40.110","TLSv1.2","214","Application Data"
"340","47.739462200","172.20.40.110","151.101.130.187","TCP","54","62995  >  443 [ACK] Seq=216444 Ack=65397 Win=512 Len=0"
"341","47.740097400","151.101.130.187","172.20.40.110","TCP","60","443  >  62995 [ACK] Seq=65397 Ack=216444 Win=6446 Len=0"
"342","47.742121300","151.101.130.187","172.20.40.110","TLSv1.2","104","Application Data"
"343","47.742198700","172.20.40.110","151.101.130.187","TCP","54","62995  >  443 [ACK] Seq=216444 Ack=65447 Win=511 Len=0"
"344","48.036570500","172.20.40.110","151.101.130.187","TLSv1.2","2832","Application Data"
"345","48.037769200","172.20.40.110","151.101.130.187","TLSv1.2","2828","Application Data"
"346","48.049287400","151.101.130.187","172.20.40.110","TCP","60","443  >  62995 [ACK] Seq=65447 Ack=219222 Win=6446 Len=0"
"347","48.049287400","151.101.130.187","172.20.40.110","TCP","60","443  >  62995 [ACK] Seq=65447 Ack=221996 Win=6446 Len=0"
"348","48.053294800","151.101.130.187","172.20.40.110","TLSv1.2","263","Application Data"
"349","48.053294800","151.101.130.187","172.20.40.110","TLSv1.2","131","Application Data"
"350","48.053389400","172.20.40.110","151.101.130.187","TCP","54","62995  >  443 [ACK] Seq=221996 Ack=65733 Win=510 Len=0"
"351","48.782763700","172.20.40.110","151.101.130.187","TLSv1.2","2831","Application Data"
"352","48.794031800","151.101.130.187","172.20.40.110","TCP","60","443  >  62995 [ACK] Seq=65733 Ack=224773 Win=6446 Len=0"
"353","48.797122100","151.101.130.187","172.20.40.110","TLSv1.2","240","Application Data"
"354","48.847051400","151.101.130.187","172.20.40.110","TCP","240","[TCP Retransmission] 443  >  62995 [PSH, ACK] Seq=65733 Ack=224773 Win=6446 Len=186"
"355","48.847106900","172.20.40.110","151.101.130.187","TCP","66","62995  >  443 [ACK] Seq=224773 Ack=65919 Win=510 Len=0 SLE=65733 SRE=65919"
"356","49.584212000","172.20.40.110","151.101.130.187","TLSv1.2","2826","Application Data"
"357","49.594189800","151.101.130.187","172.20.40.110","TCP","60","443  >  62995 [ACK] Seq=65919 Ack=227545 Win=6446 Len=0"
"358","49.599095100","151.101.130.187","172.20.40.110","TLSv1.2","241","Application Data"
"359","49.648105100","151.101.130.187","172.20.40.110","TCP","241","[TCP Retransmission] 443  >  62995 [PSH, ACK] Seq=65919 Ack=227545 Win=6446 Len=187"
"360","49.648160000","172.20.40.110","151.101.130.187","TCP","66","62995  >  443 [ACK] Seq=227545 Ack=66106 Win=509 Len=0 SLE=65919 SRE=66106"
"361","49.712980000","172.20.40.110","151.101.130.187","TLSv1.2","2843","Application Data"
"362","49.721619100","151.101.130.187","172.20.40.110","TCP","60","443  >  62995 [ACK] Seq=66106 Ack=230334 Win=6446 Len=0"
"363","49.725127500","151.101.130.187","172.20.40.110","TLSv1.2","208","Application Data"
"364","49.770960500","172.20.40.110","151.101.130.187","TCP","54","62995  >  443 [ACK] Seq=230334 Ack=66260 Win=508 Len=0"
"365","49.776260800","151.101.130.187","172.20.40.110","TCP","208","[TCP Spurious Retransmission] 443  >  62995 [PSH, ACK] Seq=66106 Ack=230334 Win=6446 Len=154"
"366","49.776319000","172.20.40.110","151.101.130.187","TCP","66","[TCP Dup ACK 364#1] 62995  >  443 [ACK] Seq=230334 Ack=66260 Win=508 Len=0 SLE=66106 SRE=66260"
"367","49.998354400","172.20.40.110","151.101.130.187","TLSv1.2","2832","Application Data"
"368","49.999629100","172.20.40.110","151.101.130.187","TLSv1.2","2831","Application Data"
"369","49.999786700","172.20.40.110","151.101.130.187","TLSv1.2","2828","Application Data"
"370","50.017383200","151.101.130.187","172.20.40.110","TCP","60","443  >  62995 [ACK] Seq=66260 Ack=233112 Win=6446 Len=0"
"371","50.017383200","151.101.130.187","172.20.40.110","TCP","60","443  >  62995 [ACK] Seq=66260 Ack=235889 Win=6446 Len=0"
"372","50.017383200","151.101.130.187","172.20.40.110","TCP","60","443  >  62995 [ACK] Seq=66260 Ack=238663 Win=6446 Len=0"
"373","50.022825700","151.101.130.187","172.20.40.110","TLSv1.2","206","Application Data, Application Data"
"374","50.022825700","151.101.130.187","172.20.40.110","TLSv1.2","130","Application Data"
"375","50.022928100","172.20.40.110","151.101.130.187","TCP","54","62995  >  443 [ACK] Seq=238663 Ack=66488 Win=507 Len=0"
"376","50.745768100","172.20.40.110","151.101.130.187","TLSv1.2","2848","Application Data"
"377","50.756707600","151.101.130.187","172.20.40.110","TCP","60","443  >  62995 [ACK] Seq=66488 Ack=241457 Win=6446 Len=0"
"378","50.759337400","151.101.130.187","172.20.40.110","TLSv1.2","235","Application Data"
"379","50.807450200","172.20.40.110","151.101.130.187","TCP","54","62995  >  443 [ACK] Seq=241457 Ack=66669 Win=507 Len=0"
"380","50.807872800","151.101.130.187","172.20.40.110","TCP","235","[TCP Spurious Retransmission] 443  >  62995 [PSH, ACK] Seq=66488 Ack=241457 Win=6446 Len=181"
"381","50.807928400","172.20.40.110","151.101.130.187","TCP","66","[TCP Dup ACK 379#1] 62995  >  443 [ACK] Seq=241457 Ack=66669 Win=507 Len=0 SLE=66488 SRE=66669"
"382","50.984083700","172.20.40.110","151.101.130.187","TLSv1.2","2835","Application Data"
"383","50.984235600","172.20.40.110","151.101.130.187","TLSv1.2","2837","Application Data"
"384","50.984960500","172.20.40.110","151.101.130.187","TLSv1.2","2831","Application Data"
"385","50.985214100","172.20.40.110","151.101.130.187","TLSv1.2","2833","Application Data"
"386","50.985547500","172.20.40.110","151.101.130.187","TLSv1.2","2831","Application Data"
"387","50.987902800","172.20.40.110","151.101.130.187","TLSv1.2","2829","Application Data"
"388","50.988087500","172.20.40.110","151.101.130.187","TLSv1.2","2831","Application Data"
"389","50.997367400","151.101.130.187","172.20.40.110","TCP","60","443  >  62995 [ACK] Seq=66669 Ack=244238 Win=6446 Len=0"
"390","50.998253900","151.101.130.187","172.20.40.110","TLSv1.2","103","Application Data"
"391","50.998253900","151.101.130.187","172.20.40.110","TCP","60","443  >  62995 [ACK] Seq=66718 Ack=247021 Win=6446 Len=0"
"392","50.998253900","151.101.130.187","172.20.40.110","TCP","60","443  >  62995 [ACK] Seq=66718 Ack=249798 Win=6446 Len=0"
"393","50.998253900","151.101.130.187","172.20.40.110","TCP","60","443  >  62995 [ACK] Seq=66718 Ack=252577 Win=6446 Len=0"
"394","51.001431400","172.20.40.110","151.101.130.187","TLSv1.2","2831","Application Data"
"395","51.004963400","151.101.130.187","172.20.40.110","TLSv1.2","131","Application Data"
"396","51.004963400","151.101.130.187","172.20.40.110","TLSv1.2","263","Application Data"
"397","51.004963400","151.101.130.187","172.20.40.110","TLSv1.2","132","Application Data"
"398","51.004963400","151.101.130.187","172.20.40.110","TCP","60","443  >  62995 [ACK] Seq=67082 Ack=255354 Win=6446 Len=0"
"399","51.004963400","151.101.130.187","172.20.40.110","TCP","60","443  >  62995 [ACK] Seq=67082 Ack=258129 Win=6446 Len=0"
"400","51.004963400","151.101.130.187","172.20.40.110","TCP","60","443  >  62995 [ACK] Seq=67082 Ack=260906 Win=6446 Len=0"
"401","51.005084400","172.20.40.110","151.101.130.187","TCP","54","62995  >  443 [ACK] Seq=263683 Ack=67082 Win=512 Len=0"
"402","51.007976200","151.101.130.187","172.20.40.110","TLSv1.2","130","Application Data"
"403","51.007976200","151.101.130.187","172.20.40.110","TLSv1.2","124","Application Data"
"404","51.008050300","172.20.40.110","151.101.130.187","TCP","54","62995  >  443 [ACK] Seq=263683 Ack=67228 Win=511 Len=0"
"405","51.009236400","151.101.130.187","172.20.40.110","TLSv1.2","130","Application Data"
"406","51.009344100","172.20.40.110","151.101.130.187","TCP","54","62995  >  443 [ACK] Seq=263683 Ack=67304 Win=511 Len=0"
"407","51.010589400","151.101.130.187","172.20.40.110","TCP","60","443  >  62995 [ACK] Seq=67304 Ack=263683 Win=6446 Len=0"
"408","51.021314900","151.101.130.187","172.20.40.110","TLSv1.2","131","Application Data"
"409","51.056652600","151.101.130.187","172.20.40.110","TCP","131","[TCP Retransmission] 443  >  62995 [PSH, ACK] Seq=67304 Ack=263683 Win=6446 Len=77"
"410","51.056733900","172.20.40.110","151.101.130.187","TCP","66","62995  >  443 [ACK] Seq=263683 Ack=67381 Win=510 Len=0 SLE=67304 SRE=67381"
"411","51.267924800","172.20.40.110","151.101.130.187","TLSv1.2","2835","Application Data"
"412","51.278348000","151.101.130.187","172.20.40.110","TCP","60","443  >  62995 [ACK] Seq=67381 Ack=266464 Win=6446 Len=0"
"413","51.280931500","172.20.40.110","151.101.130.187","TLSv1.2","2829","Application Data"
"414","51.281184900","172.20.40.110","151.101.130.187","TLSv1.2","2836","Application Data"
"415","51.282031000","172.20.40.110","151.101.130.187","TLSv1.2","2835","Application Data"
"416","51.286062400","172.20.40.110","151.101.130.187","TLSv1.2","2829","Application Data"
"417","51.287193000","151.101.130.187","172.20.40.110","TLSv1.2","317","Application Data"
"418","51.290522800","151.101.130.187","172.20.40.110","TCP","60","443  >  62995 [ACK] Seq=67644 Ack=269239 Win=6446 Len=0"
"419","51.293192600","151.101.130.187","172.20.40.110","TLSv1.2","131","Application Data"
"420","51.293192600","151.101.130.187","172.20.40.110","TCP","60","443  >  62995 [ACK] Seq=67721 Ack=272021 Win=6446 Len=0"
"421","51.293192600","151.101.130.187","172.20.40.110","TCP","60","443  >  62995 [ACK] Seq=67721 Ack=274802 Win=6446 Len=0"
"422","51.293290100","172.20.40.110","151.101.130.187","TCP","54","62995  >  443 [ACK] Seq=277577 Ack=67721 Win=509 Len=0"
"423","51.296383500","151.101.130.187","172.20.40.110","TCP","60","443  >  62995 [ACK] Seq=67721 Ack=277577 Win=6446 Len=0"
"424","51.296383500","151.101.130.187","172.20.40.110","TLSv1.2","131","Application Data"
"425","51.297447600","172.20.40.110","151.101.130.187","TLSv1.2","2835","Application Data"
"426","51.299209200","151.101.130.187","172.20.40.110","TLSv1.2","131","Application Data"
"427","51.301593200","151.101.130.187","172.20.40.110","TLSv1.2","130","Application Data"
"428","51.301677200","172.20.40.110","151.101.130.187","TCP","54","62995  >  443 [ACK] Seq=280358 Ack=67951 Win=508 Len=0"
"429","51.306674200","172.20.40.110","151.101.130.187","TLSv1.2","2828","Application Data"
"430","51.306932900","172.20.40.110","151.101.130.187","TLSv1.2","2829","Application Data"
"431","51.307993100","172.20.40.110","151.101.130.187","TLSv1.2","2826","Application Data"
"432","51.308239500","172.20.40.110","151.101.130.187","TLSv1.2","2832","Application Data"
"433","51.308333300","151.101.130.187","172.20.40.110","TCP","60","443  >  62995 [ACK] Seq=67951 Ack=280358 Win=6446 Len=0"
"434","51.314182800","151.101.130.187","172.20.40.110","TLSv1.2","125","Application Data"
"435","51.320576600","151.101.130.187","172.20.40.110","TCP","60","443  >  62995 [ACK] Seq=68022 Ack=283132 Win=6446 Len=0"
"436","51.320576600","151.101.130.187","172.20.40.110","TCP","60","443  >  62995 [ACK] Seq=68022 Ack=285907 Win=6446 Len=0"
"437","51.320576600","151.101.130.187","172.20.40.110","TCP","60","443  >  62995 [ACK] Seq=68022 Ack=288679 Win=6446 Len=0"
"438","51.322789400","151.101.130.187","172.20.40.110","TCP","60","443  >  62995 [ACK] Seq=68022 Ack=291457 Win=6446 Len=0"
"439","51.325106700","151.101.130.187","172.20.40.110","TLSv1.2","125","Application Data"
"440","51.325106700","151.101.130.187","172.20.40.110","TLSv1.2","263","Application Data"
"441","51.325298400","172.20.40.110","151.101.130.187","TCP","54","62995  >  443 [ACK] Seq=291457 Ack=68302 Win=507 Len=0"
"442","51.326294400","151.101.130.187","172.20.40.110","TLSv1.2","206","Application Data, Application Data"
"443","51.326391700","172.20.40.110","151.101.130.187","TCP","54","62995  >  443 [ACK] Seq=291457 Ack=68454 Win=506 Len=0"
"444","51.537520700","172.20.40.110","151.101.130.187","TLSv1.2","2833","Application Data"
"445","51.549067200","151.101.130.187","172.20.40.110","TCP","60","443  >  62995 [ACK] Seq=68454 Ack=294236 Win=6446 Len=0"
"446","51.550646400","151.101.130.187","172.20.40.110","TLSv1.2","130","Application Data"
"447","51.585394800","151.101.130.187","172.20.40.110","TCP","130","[TCP Retransmission] 443  >  62995 [PSH, ACK] Seq=68454 Ack=294236 Win=6446 Len=76"
"448","51.585464500","172.20.40.110","151.101.130.187","TCP","66","62995  >  443 [ACK] Seq=294236 Ack=68530 Win=512 Len=0 SLE=68454 SRE=68530"
"449","51.983946100","172.20.40.110","151.101.130.187","TLSv1.2","2844","Application Data"
"450","51.989280000","172.20.40.110","151.101.130.187","TLSv1.2","2835","Application Data"
"451","51.991876800","172.20.40.110","151.101.130.187","TLSv1.2","2829","Application Data"
"452","51.996598200","151.101.130.187","172.20.40.110","TCP","60","443  >  62995 [ACK] Seq=68530 Ack=297026 Win=6446 Len=0"
"453","52.004753000","151.101.130.187","172.20.40.110","TLSv1.2","131","Application Data"
"454","52.004753000","151.101.130.187","172.20.40.110","TCP","60","443  >  62995 [ACK] Seq=68607 Ack=299807 Win=6446 Len=0"
"455","52.004753000","151.101.130.187","172.20.40.110","TLSv1.2","130","Application Data"
"456","52.004753000","151.101.130.187","172.20.40.110","TCP","60","443  >  62995 [ACK] Seq=68683 Ack=302582 Win=6446 Len=0"
"457","52.004753000","151.101.130.187","172.20.40.110","TLSv1.2","318","Application Data"
"458","52.004843400","172.20.40.110","151.101.130.187","TCP","54","62995  >  443 [ACK] Seq=302582 Ack=68947 Win=510 Len=0"
"459","52.012244800","172.20.40.110","151.101.130.187","TLSv1.2","2829","Application Data"
"460","52.021751600","151.101.130.187","172.20.40.110","TCP","60","443  >  62995 [ACK] Seq=68947 Ack=305357 Win=6446 Len=0"
"461","52.024215700","151.101.130.187","172.20.40.110","TLSv1.2","130","Application Data"
"462","52.059921600","151.101.130.187","172.20.40.110","TCP","130","[TCP Retransmission] 443  >  62995 [PSH, ACK] Seq=68947 Ack=305357 Win=6446 Len=76"
"463","52.059996800","172.20.40.110","151.101.130.187","TCP","66","62995  >  443 [ACK] Seq=305357 Ack=69023 Win=510 Len=0 SLE=68947 SRE=69023"
"464","53.016492200","172.20.40.110","151.101.130.187","TLSv1.2","2829","Application Data"
"465","53.027027200","151.101.130.187","172.20.40.110","TCP","60","443  >  62995 [ACK] Seq=69023 Ack=308132 Win=6446 Len=0"
"466","53.033014000","151.101.130.187","172.20.40.110","TLSv1.2","214","Application Data"
"467","53.065526700","151.101.130.187","172.20.40.110","TCP","214","[TCP Retransmission] 443  >  62995 [PSH, ACK] Seq=69023 Ack=308132 Win=6446 Len=160"
"468","53.065582700","172.20.40.110","151.101.130.187","TCP","66","62995  >  443 [ACK] Seq=308132 Ack=69183 Win=509 Len=0 SLE=69023 SRE=69183"
"469","54.490482100","172.20.40.110","151.101.130.187","TLSv1.2","2834","Application Data"
"470","54.499034200","172.20.40.110","151.101.130.187","TLSv1.2","2836","Application Data"
"471","54.499338100","172.20.40.110","151.101.130.187","TLSv1.2","2830","Application Data"
"472","54.500792700","172.20.40.110","151.101.130.187","TLSv1.2","2835","Application Data"
"473","54.501024200","172.20.40.110","151.101.130.187","TLSv1.2","2832","Application Data"
"474","54.501222100","172.20.40.110","151.101.130.187","TLSv1.2","2847","Application Data"
"475","54.501395900","172.20.40.110","151.101.130.187","TLSv1.2","2847","Application Data"
"476","54.505141200","151.101.130.187","172.20.40.110","TCP","60","443  >  62995 [ACK] Seq=69183 Ack=310912 Win=6446 Len=0"
"477","54.515948300","151.101.130.187","172.20.40.110","TLSv1.2","240","Application Data"
"478","54.519394500","151.101.130.187","172.20.40.110","TCP","60","443  >  62995 [ACK] Seq=69369 Ack=313694 Win=6446 Len=0"
"479","54.519394500","151.101.130.187","172.20.40.110","TCP","60","443  >  62995 [ACK] Seq=69369 Ack=316470 Win=6446 Len=0"
"480","54.519394500","151.101.130.187","172.20.40.110","TCP","60","443  >  62995 [ACK] Seq=69369 Ack=319230 Win=6457 Len=0"
"481","54.519394500","151.101.130.187","172.20.40.110","TLSv1.2","263","Application Data"
"482","54.519394500","151.101.130.187","172.20.40.110","TLSv1.2","131","Application Data"
"483","54.519491300","172.20.40.110","151.101.130.187","TCP","54","62995  >  443 [ACK] Seq=327615 Ack=69655 Win=507 Len=0"
"484","54.522731200","151.101.130.187","172.20.40.110","TCP","60","443  >  62995 [ACK] Seq=69655 Ack=319251 Win=6457 Len=0"
"485","54.522731200","151.101.130.187","172.20.40.110","TCP","60","443  >  62995 [ACK] Seq=69655 Ack=322029 Win=6457 Len=0"
"486","54.522731200","151.101.130.187","172.20.40.110","TCP","60","443  >  62995 [ACK] Seq=69655 Ack=324822 Win=6457 Len=0"
"487","54.522731200","151.101.130.187","172.20.40.110","TCP","60","443  >  62995 [ACK] Seq=69655 Ack=327615 Win=6457 Len=0"
"488","54.527110000","151.101.130.187","172.20.40.110","TLSv1.2","124","Application Data"
"489","54.527181200","172.20.40.110","151.101.130.187","TCP","54","62995  >  443 [ACK] Seq=327615 Ack=69725 Win=507 Len=0"
"490","54.529381300","151.101.130.187","172.20.40.110","TLSv1.2","130","Application Data"
"491","54.529381300","151.101.130.187","172.20.40.110","TLSv1.2","131","Application Data"
"492","54.529381300","151.101.130.187","172.20.40.110","TLSv1.2","130","Application Data"
"493","54.529477400","172.20.40.110","151.101.130.187","TCP","54","62995  >  443 [ACK] Seq=327615 Ack=69954 Win=512 Len=0"
"494","60.067065000","172.20.40.110","151.101.130.187","TLSv1.2","2881","Application Data"
"495","60.076644500","151.101.130.187","172.20.40.110","TCP","60","443  >  62995 [ACK] Seq=69954 Ack=330442 Win=6457 Len=0"
"496","60.081383400","151.101.130.187","172.20.40.110","TLSv1.2","214","Application Data"
"497","60.110997300","151.101.130.187","172.20.40.110","TCP","214","[TCP Retransmission] 443  >  62995 [PSH, ACK] Seq=69954 Ack=330442 Win=6457 Len=160"
"498","60.111055900","172.20.40.110","151.101.130.187","TCP","66","62995  >  443 [ACK] Seq=330442 Ack=70114 Win=511 Len=0 SLE=69954 SRE=70114"
"499","60.114456100","172.20.40.110","151.101.130.187","TLSv1.2","2879","Application Data"
"500","60.119525600","172.20.40.110","151.101.130.187","TLSv1.2","2882","Application Data"
"501","60.124651800","151.101.130.187","172.20.40.110","TCP","60","443  >  62995 [ACK] Seq=70114 Ack=333267 Win=6457 Len=0"
"502","60.129175500","151.101.130.187","172.20.40.110","TLSv1.2","208","Application Data"
"503","60.129175500","151.101.130.187","172.20.40.110","TCP","60","443  >  62995 [ACK] Seq=70268 Ack=336095 Win=6457 Len=0"
"504","60.131302800","151.101.130.187","172.20.40.110","TLSv1.2","131","Application Data"
"505","60.131398500","172.20.40.110","151.101.130.187","TCP","54","62995  >  443 [ACK] Seq=336095 Ack=70345 Win=510 Len=0"
