"No.","Time","Source","Destination","Protocol","Length","Info"
"1","0.000000000","100.84.170.161","151.101.66.187","TCP","55","50935  >  443 [ACK] Seq=1 Ack=1 Win=507 Len=1 [TCP PDU reassembled in 189]"
"2","0.013985000","151.101.66.187","100.84.170.161","TCP","66","443  >  50935 [ACK] Seq=1 Ack=2 Win=281 Len=0 SLE=1 SRE=2"
"3","4.396764300","100.84.170.161","151.101.2.187","TLSv1.2","2000","Application Data"
"4","4.396878700","100.84.170.161","151.101.2.187","TLSv1.2","93","Application Data"
"5","4.403004300","100.84.170.161","151.101.2.187","TLSv1.2","720","Application Data"
"6","4.403538800","100.84.170.161","151.101.2.187","TLSv1.2","1962","Application Data"
"7","4.406435000","151.101.2.187","100.84.170.161","TCP","56","443  >  64433 [ACK] Seq=1 Ack=1986 Win=501 Len=0"
"8","4.406865000","151.101.2.187","100.84.170.161","TLSv1.2","93","Application Data"
"9","4.408668800","151.101.2.187","100.84.170.161","TLSv1.2","214","Application Data"
"10","4.408664000","100.84.170.161","151.101.2.187","TLSv1.2","663","Application Data"
"11","4.412012600","151.101.2.187","100.84.170.161","TCP","56","443  >  64433 [ACK] Seq=200 Ack=2652 Win=507 Len=0"
"12","4.412638700","151.101.2.187","100.84.170.161","TCP","56","443  >  64433 [ACK] Seq=200 Ack=4560 Win=518 Len=0"
"13","4.414855900","151.101.2.187","100.84.170.161","TLSv1.2","168","Application Data"
"14","4.414901800","100.84.170.161","151.101.2.187","TCP","54","64433  >  443 [ACK] Seq=5169 Ack=314 Win=508 Len=0"
"15","4.415983000","151.101.2.187","100.84.170.161","TLSv1.2","131","Application Data"
"16","4.418526800","151.101.2.187","100.84.170.161","TCP","56","443  >  64433 [ACK] Seq=391 Ack=5169 Win=524 Len=0"
"17","4.421267300","151.101.2.187","100.84.170.161","TLSv1.2","322","Application Data"
"18","4.421323200","100.84.170.161","151.101.2.187","TCP","54","64433  >  443 [ACK] Seq=5169 Ack=659 Win=513 Len=0"
"19","4.421628300","151.101.2.187","100.84.170.161","TLSv1.2","213","Application Data"
"20","4.422778200","100.84.170.161","151.101.2.187","TLSv1.2","89","Application Data"
"21","4.433157700","151.101.2.187","100.84.170.161","TCP","56","443  >  64433 [ACK] Seq=818 Ack=5204 Win=524 Len=0"
"22","4.472747400","100.84.170.161","151.101.2.187","TLSv1.2","1985","Application Data"
"23","4.483148000","151.101.2.187","100.84.170.161","TCP","56","443  >  64433 [ACK] Seq=818 Ack=7135 Win=535 Len=0"
"24","4.485629800","151.101.2.187","100.84.170.161","TLSv1.2","135","Application Data"
"25","4.514201700","151.101.2.187","100.84.170.161","TCP","135","[TCP Retransmission] 443  >  64433 [PSH, ACK] Seq=818 Ack=7135 Win=535 Len=81"
"26","4.514239300","100.84.170.161","151.101.2.187","TCP","66","64433  >  443 [ACK] Seq=7135 Ack=899 Win=512 Len=0 SLE=818 SRE=899"
"27","4.551236700","100.84.170.161","151.101.2.187","TLSv1.2","688","Application Data"
"28","4.561346600","100.84.170.161","151.101.2.187","TLSv1.2","1999","Application Data"
"29","4.561352400","151.101.2.187","100.84.170.161","TCP","56","443  >  64433 [ACK] Seq=899 Ack=7769 Win=541 Len=0"
"30","4.563870400","151.101.2.187","100.84.170.161","TLSv1.2","125","Application Data"
"31","4.571074700","151.101.2.187","100.84.170.161","TCP","56","443  >  64433 [ACK] Seq=970 Ack=9714 Win=553 Len=0"
"32","4.573350700","151.101.2.187","100.84.170.161","TLSv1.2","130","Application Data"
"33","4.573412800","100.84.170.161","151.101.2.187","TCP","54","64433  >  443 [ACK] Seq=9714 Ack=1046 Win=511 Len=0"
"34","4.593196600","100.84.170.161","151.101.2.187","TLSv1.2","705","Application Data"
"35","4.602549900","151.101.2.187","100.84.170.161","TCP","56","443  >  64433 [ACK] Seq=1046 Ack=10365 Win=558 Len=0"
"36","4.605640200","151.101.2.187","100.84.170.161","TLSv1.2","125","Application Data"
"37","4.635224900","151.101.2.187","100.84.170.161","TCP","125","[TCP Retransmission] 443  >  64433 [PSH, ACK] Seq=1046 Ack=10365 Win=558 Len=71"
"38","4.635265200","100.84.170.161","151.101.2.187","TCP","66","64433  >  443 [ACK] Seq=10365 Ack=1117 Win=511 Len=0 SLE=1046 SRE=1117"
"39","4.710443200","100.84.170.161","151.101.2.187","TLSv1.2","1994","Application Data"
"40","4.719516000","151.101.2.187","100.84.170.161","TCP","56","443  >  64433 [ACK] Seq=1117 Ack=12305 Win=570 Len=0"
"41","4.733033800","151.101.2.187","100.84.170.161","TLSv1.2","131","Application Data"
"42","4.763122300","151.101.2.187","100.84.170.161","TCP","131","[TCP Retransmission] 443  >  64433 [PSH, ACK] Seq=1117 Ack=12305 Win=570 Len=77"
"43","4.763177400","100.84.170.161","151.101.2.187","TCP","66","64433  >  443 [ACK] Seq=12305 Ack=1194 Win=511 Len=0 SLE=1117 SRE=1194"
"44","5.185563900","100.84.170.161","151.101.2.187","TLSv1.2","820","Application Data"
"45","5.185761700","100.84.170.161","151.101.2.187","TLSv1.2","1885","Application Data"
"46","5.185869500","100.84.170.161","151.101.2.187","TLSv1.2","832","Application Data"
"47","5.186003300","100.84.170.161","151.101.2.187","TLSv1.2","1881","Application Data"
"48","5.186436300","100.84.170.161","151.101.2.187","TLSv1.2","828","Application Data"
"49","5.186575100","100.84.170.161","151.101.2.187","TLSv1.2","1892","Application Data"
"50","5.186666600","100.84.170.161","151.101.2.187","TLSv1.2","796","Application Data"
"51","5.186757200","100.84.170.161","151.101.2.187","TLSv1.2","1888","Application Data"
"52","5.195029600","151.101.2.187","100.84.170.161","TCP","56","443  >  64433 [ACK] Seq=1194 Ack=13071 Win=575 Len=0"
"53","5.195360200","151.101.2.187","100.84.170.161","TCP","56","443  >  64433 [ACK] Seq=1194 Ack=15680 Win=593 Len=0"
"54","5.195667400","151.101.2.187","100.84.170.161","TCP","56","443  >  64433 [ACK] Seq=1194 Ack=17507 Win=604 Len=0"
"55","5.196043000","151.101.2.187","100.84.170.161","TCP","56","443  >  64433 [ACK] Seq=1194 Ack=20119 Win=621 Len=0"
"56","5.196345000","151.101.2.187","100.84.170.161","TCP","56","443  >  64433 [ACK] Seq=1194 Ack=22695 Win=638 Len=0"
"57","5.198930800","151.101.2.187","100.84.170.161","TLSv1.2","131","Application Data"
"58","5.199685100","151.101.2.187","100.84.170.161","TLSv1.2","238","Application Data"
"59","5.199751900","100.84.170.161","151.101.2.187","TCP","54","64433  >  443 [ACK] Seq=22695 Ack=1455 Win=510 Len=0"
"60","5.200712800","151.101.2.187","100.84.170.161","TLSv1.2","235","Application Data"
"61","5.200712800","151.101.2.187","100.84.170.161","TLSv1.2","168","Application Data"
"62","5.200777800","100.84.170.161","151.101.2.187","TCP","54","64433  >  443 [ACK] Seq=22695 Ack=1750 Win=509 Len=0"
"63","5.200995000","151.101.2.187","100.84.170.161","TLSv1.2","131","Application Data"
"64","5.201274500","151.101.2.187","100.84.170.161","TLSv1.2","130","Application Data"
"65","5.201306600","100.84.170.161","151.101.2.187","TCP","54","64433  >  443 [ACK] Seq=22695 Ack=1903 Win=508 Len=0"
"66","10.899489100","100.84.170.161","151.101.2.187","TLSv1.2","825","Application Data"
"67","10.908833200","151.101.2.187","100.84.170.161","TCP","56","443  >  64433 [ACK] Seq=1903 Ack=23466 Win=644 Len=0"
"68","10.911386700","151.101.2.187","100.84.170.161","TLSv1.2","375","Application Data"
"69","10.941489600","151.101.2.187","100.84.170.161","TCP","375","[TCP Retransmission] 443  >  64433 [PSH, ACK] Seq=1903 Ack=23466 Win=644 Len=321"
"70","10.941525300","100.84.170.161","151.101.2.187","TCP","66","64433  >  443 [ACK] Seq=23466 Ack=2224 Win=513 Len=0 SLE=1903 SRE=2224"
"71","11.080841400","100.84.170.161","151.101.2.187","TLSv1.2","1878","Application Data"
"72","11.090704400","151.101.2.187","100.84.170.161","TCP","56","443  >  64433 [ACK] Seq=2224 Ack=25290 Win=655 Len=0"
"73","11.093364800","151.101.2.187","100.84.170.161","TLSv1.2","130","Application Data"
"74","11.122368300","151.101.2.187","100.84.170.161","TCP","130","[TCP Retransmission] 443  >  64433 [PSH, ACK] Seq=2224 Ack=25290 Win=655 Len=76"
"75","11.122453200","100.84.170.161","151.101.2.187","TCP","66","64433  >  443 [ACK] Seq=25290 Ack=2300 Win=512 Len=0 SLE=2224 SRE=2300"
"76","11.210193800","100.84.170.161","151.101.2.187","TLSv1.2","825","Application Data"
"77","11.219840600","151.101.2.187","100.84.170.161","TCP","56","443  >  64433 [ACK] Seq=2300 Ack=26061 Win=661 Len=0"
"78","11.222030100","151.101.2.187","100.84.170.161","TLSv1.2","130","Application Data"
"79","11.251154200","151.101.2.187","100.84.170.161","TCP","130","[TCP Retransmission] 443  >  64433 [PSH, ACK] Seq=2300 Ack=26061 Win=661 Len=76"
"80","11.251211600","100.84.170.161","151.101.2.187","TCP","66","64433  >  443 [ACK] Seq=26061 Ack=2376 Win=512 Len=0 SLE=2300 SRE=2376"
"81","11.783949700","100.84.170.161","151.101.2.187","TLSv1.2","1896","Application Data"
"82","11.793715500","151.101.2.187","100.84.170.161","TCP","56","443  >  64433 [ACK] Seq=2376 Ack=27903 Win=672 Len=0"
"83","11.796462300","151.101.2.187","100.84.170.161","TLSv1.2","240","Application Data"
"84","11.824088000","151.101.2.187","100.84.170.161","TCP","240","[TCP Retransmission] 443  >  64433 [PSH, ACK] Seq=2376 Ack=27903 Win=672 Len=186"
"85","11.824153500","100.84.170.161","151.101.2.187","TCP","66","64433  >  443 [ACK] Seq=27903 Ack=2562 Win=511 Len=0 SLE=2376 SRE=2562"
"86","11.910463500","100.84.170.161","151.101.2.187","TLSv1.2","794","Application Data"
"87","11.920123200","151.101.2.187","100.84.170.161","TCP","56","443  >  64433 [ACK] Seq=2562 Ack=28643 Win=678 Len=0"
"88","11.922685600","151.101.2.187","100.84.170.161","TLSv1.2","130","Application Data"
"89","11.942428100","100.84.170.161","151.101.2.187","TLSv1.2","1888","Application Data"
"90","11.951005500","151.101.2.187","100.84.170.161","TCP","130","[TCP Spurious Retransmission] 443  >  64433 [PSH, ACK] Seq=2562 Ack=28643 Win=678 Len=76"
"91","11.951042300","100.84.170.161","151.101.2.187","TCP","66","[TCP Dup ACK 89#1] 64433  >  443 [ACK] Seq=30477 Ack=2638 Win=511 Len=0 SLE=2562 SRE=2638"
"92","11.952148200","151.101.2.187","100.84.170.161","TCP","56","443  >  64433 [ACK] Seq=2638 Ack=30477 Win=689 Len=0"
"93","11.954358600","151.101.2.187","100.84.170.161","TLSv1.2","130","Application Data"
"94","11.984500000","151.101.2.187","100.84.170.161","TCP","130","[TCP Retransmission] 443  >  64433 [PSH, ACK] Seq=2638 Ack=30477 Win=689 Len=76"
"95","11.984537800","100.84.170.161","151.101.2.187","TCP","66","64433  >  443 [ACK] Seq=30477 Ack=2714 Win=511 Len=0 SLE=2638 SRE=2714"
"96","15.297537800","100.84.170.161","151.101.2.187","TLSv1.2","824","Application Data"
"97","15.306951500","151.101.2.187","100.84.170.161","TCP","56","443  >  64433 [ACK] Seq=2714 Ack=31247 Win=695 Len=0"
"98","15.309236400","151.101.2.187","100.84.170.161","TLSv1.2","214","Application Data"
"99","15.320682500","100.84.170.161","151.101.2.187","TLSv1.2","1891","Application Data"
"100","15.321505700","100.84.170.161","151.101.2.187","TLSv1.2","786","Application Data"
"101","15.321741900","100.84.170.161","151.101.2.187","TLSv1.2","1885","Application Data"
"102","15.330612000","151.101.2.187","100.84.170.161","TCP","56","443  >  64433 [ACK] Seq=2874 Ack=33084 Win=707 Len=0"
"103","15.330935300","151.101.2.187","100.84.170.161","TCP","56","443  >  64433 [ACK] Seq=2874 Ack=33816 Win=712 Len=0"
"104","15.331486500","151.101.2.187","100.84.170.161","TCP","56","443  >  64433 [ACK] Seq=2874 Ack=35647 Win=724 Len=0"
"105","15.332660200","151.101.2.187","100.84.170.161","TLSv1.2","124","Application Data"
"106","15.332910700","151.101.2.187","100.84.170.161","TLSv1.2","131","Application Data"
"107","15.332943500","100.84.170.161","151.101.2.187","TCP","54","64433  >  443 [ACK] Seq=35647 Ack=3021 Win=510 Len=0"
"108","15.334236600","151.101.2.187","100.84.170.161","TLSv1.2","174","Application Data"
"109","15.371951800","151.101.2.187","100.84.170.161","TCP","174","[TCP Retransmission] 443  >  64433 [PSH, ACK] Seq=3021 Ack=35647 Win=724 Len=120"
"110","15.371990700","100.84.170.161","151.101.2.187","TCP","66","64433  >  443 [ACK] Seq=35647 Ack=3141 Win=509 Len=0 SLE=3021 SRE=3141"
"111","15.386361200","100.84.170.161","151.101.2.187","TLSv1.2","786","Application Data"
"112","15.395733200","151.101.2.187","100.84.170.161","TCP","56","443  >  64433 [ACK] Seq=3141 Ack=36379 Win=729 Len=0"
"113","15.398632900","151.101.2.187","100.84.170.161","TLSv1.2","104","Application Data"
"114","15.427000300","151.101.2.187","100.84.170.161","TCP","104","[TCP Retransmission] 443  >  64433 [PSH, ACK] Seq=3141 Ack=36379 Win=729 Len=50"
"115","15.427048800","100.84.170.161","151.101.2.187","TCP","66","64433  >  443 [ACK] Seq=36379 Ack=3191 Win=509 Len=0 SLE=3141 SRE=3191"
"116","15.467652000","100.84.170.161","151.101.2.187","TLSv1.2","1882","Application Data"
"117","15.477483600","151.101.2.187","100.84.170.161","TCP","56","443  >  64433 [ACK] Seq=3191 Ack=38207 Win=741 Len=0"
"118","15.479280100","100.84.170.161","151.101.2.187","TLSv1.2","823","Application Data"
"119","15.480660100","151.101.2.187","100.84.170.161","TLSv1.2","125","Application Data"
"120","15.489066200","151.101.2.187","100.84.170.161","TCP","56","443  >  64433 [ACK] Seq=3262 Ack=38976 Win=746 Len=0"
"121","15.491590300","151.101.2.187","100.84.170.161","TLSv1.2","130","Application Data"
"122","15.491644400","100.84.170.161","151.101.2.187","TCP","54","64433  >  443 [ACK] Seq=38976 Ack=3338 Win=508 Len=0"
"123","15.503898100","100.84.170.161","151.101.2.187","TLSv1.2","1876","Application Data"
"124","15.513080000","151.101.2.187","100.84.170.161","TCP","56","443  >  64433 [ACK] Seq=3338 Ack=40798 Win=758 Len=0"
"125","15.515977000","151.101.2.187","100.84.170.161","TLSv1.2","286","Application Data"
"126","15.547175900","151.101.2.187","100.84.170.161","TCP","286","[TCP Retransmission] 443  >  64433 [PSH, ACK] Seq=3338 Ack=40798 Win=758 Len=232"
"127","15.547215000","100.84.170.161","151.101.2.187","TCP","66","64433  >  443 [ACK] Seq=40798 Ack=3570 Win=508 Len=0 SLE=3338 SRE=3570"
"128","15.597298600","100.84.170.161","151.101.2.187","TLSv1.2","818","Application Data"
"129","15.606447900","151.101.2.187","100.84.170.161","TCP","56","443  >  64433 [ACK] Seq=3570 Ack=41562 Win=764 Len=0"
"130","15.608592400","151.101.2.187","100.84.170.161","TLSv1.2","136","Application Data"
"131","15.640151100","151.101.2.187","100.84.170.161","TCP","136","[TCP Retransmission] 443  >  64433 [PSH, ACK] Seq=3570 Ack=41562 Win=764 Len=82"
"132","15.640180900","100.84.170.161","151.101.2.187","TCP","66","64433  >  443 [ACK] Seq=41562 Ack=3652 Win=507 Len=0 SLE=3570 SRE=3652"
"133","15.679035300","100.84.170.161","151.101.2.187","TLSv1.2","1904","Application Data"
"134","15.681397600","100.84.170.161","151.101.2.187","TLSv1.2","808","Application Data"
"135","15.681583900","100.84.170.161","151.101.2.187","TLSv1.2","1900","Application Data"
"136","15.681682700","100.84.170.161","151.101.2.187","TLSv1.2","804","Application Data"
"137","15.682271100","100.84.170.161","151.101.2.187","TLSv1.2","1896","Application Data"
"138","15.682358100","100.84.170.161","151.101.2.187","TLSv1.2","815","Application Data"
"139","15.682419600","100.84.170.161","151.101.2.187","TLSv1.2","1864","Application Data"
"140","15.682461500","100.84.170.161","151.101.2.187","TLSv1.2","811","Application Data"
"141","15.689106000","151.101.2.187","100.84.170.161","TCP","56","443  >  64433 [ACK] Seq=3652 Ack=43412 Win=775 Len=0"
"142","15.690474900","151.101.2.187","100.84.170.161","TCP","56","443  >  64433 [ACK] Seq=3652 Ack=44166 Win=781 Len=0"
"143","15.691073100","151.101.2.187","100.84.170.161","TCP","56","443  >  64433 [ACK] Seq=3652 Ack=46762 Win=798 Len=0"
"144","15.691353100","151.101.2.187","100.84.170.161","TCP","56","443  >  64433 [ACK] Seq=3652 Ack=48604 Win=809 Len=0"
"145","15.692069100","151.101.2.187","100.84.170.161","TCP","56","443  >  64433 [ACK] Seq=3652 Ack=51932 Win=832 Len=0"
"146","15.700879800","151.101.2.187","100.84.170.161","TLSv1.2","179","Application Data"
"147","15.701206200","151.101.2.187","100.84.170.161","TLSv1.2","130","Application Data"
"148","15.701235600","100.84.170.161","151.101.2.187","TCP","54","64433  >  443 [ACK] Seq=51932 Ack=3853 Win=513 Len=0"
"149","15.701974400","151.101.2.187","100.84.170.161","TLSv1.2","124","Application Data"
"150","15.703047700","151.101.2.187","100.84.170.161","TLSv1.2","130","Application Data"
"151","15.703089700","100.84.170.161","151.101.2.187","TCP","54","64433  >  443 [ACK] Seq=51932 Ack=3999 Win=512 Len=0"
"152","15.703343100","151.101.2.187","100.84.170.161","TLSv1.2","125","Application Data"
"153","15.703343100","151.101.2.187","100.84.170.161","TLSv1.2","240","Application Data"
"154","15.703386000","100.84.170.161","151.101.2.187","TCP","54","64433  >  443 [ACK] Seq=51932 Ack=4256 Win=511 Len=0"
"155","15.704250900","151.101.2.187","100.84.170.161","TLSv1.2","131","Application Data"
"156","15.744100000","151.101.2.187","100.84.170.161","TCP","131","[TCP Retransmission] 443  >  64433 [PSH, ACK] Seq=4256 Ack=51932 Win=832 Len=77"
"157","15.744144700","100.84.170.161","151.101.2.187","TCP","66","64433  >  443 [ACK] Seq=51932 Ack=4333 Win=511 Len=0 SLE=4256 SRE=4333"
"158","23.089782900","100.84.170.161","151.101.2.187","TLSv1.2","2165","Application Data"
"159","23.099151800","151.101.2.187","100.84.170.161","TCP","56","443  >  64433 [ACK] Seq=4333 Ack=54043 Win=843 Len=0"
"160","23.101933200","151.101.2.187","100.84.170.161","TLSv1.2","214","Application Data"
"161","23.132498000","151.101.2.187","100.84.170.161","TCP","214","[TCP Retransmission] 443  >  64433 [PSH, ACK] Seq=4333 Ack=54043 Win=843 Len=160"
"162","23.132547200","100.84.170.161","151.101.2.187","TCP","66","64433  >  443 [ACK] Seq=54043 Ack=4493 Win=510 Len=0 SLE=4333 SRE=4493"
"163","23.243657900","100.84.170.161","151.101.2.187","TLSv1.2","552","Application Data"
"164","23.254623300","151.101.2.187","100.84.170.161","TCP","56","443  >  64433 [ACK] Seq=4493 Ack=54541 Win=849 Len=0"
"165","23.257383600","151.101.2.187","100.84.170.161","TLSv1.2","169","Application Data"
"166","23.273474600","100.84.170.161","151.101.2.187","TLSv1.2","2166","Application Data"
"167","23.282742700","151.101.2.187","100.84.170.161","TCP","56","443  >  64433 [ACK] Seq=4608 Ack=56653 Win=861 Len=0"
"168","23.286034300","151.101.2.187","100.84.170.161","TLSv1.2","235","Application Data"
"169","23.318295800","151.101.2.187","100.84.170.161","TCP","235","[TCP Retransmission] 443  >  64433 [PSH, ACK] Seq=4608 Ack=56653 Win=861 Len=181"
"170","23.318332300","100.84.170.161","151.101.2.187","TCP","66","64433  >  443 [ACK] Seq=56653 Ack=4789 Win=509 Len=0 SLE=4608 SRE=4789"
"171","23.447073100","100.84.170.161","151.101.2.187","TLSv1.2","571","Application Data"
"172","23.456680600","151.101.2.187","100.84.170.161","TCP","56","443  >  64433 [ACK] Seq=4789 Ack=57170 Win=866 Len=0"
"173","23.459683900","151.101.2.187","100.84.170.161","TLSv1.2","291","Application Data"
"174","23.492164800","151.101.2.187","100.84.170.161","TCP","291","[TCP Retransmission] 443  >  64433 [PSH, ACK] Seq=4789 Ack=57170 Win=866 Len=237"
"175","23.492205800","100.84.170.161","151.101.2.187","TCP","66","64433  >  443 [ACK] Seq=57170 Ack=5026 Win=508 Len=0 SLE=4789 SRE=5026"
"176","23.937394200","100.84.170.161","151.101.2.187","TLSv1.2","2211","Application Data"
"177","23.946837900","151.101.2.187","100.84.170.161","TCP","56","443  >  64433 [ACK] Seq=5026 Ack=59327 Win=878 Len=0"
"178","23.949386400","151.101.2.187","100.84.170.161","TLSv1.2","135","Application Data"
"179","23.980987200","151.101.2.187","100.84.170.161","TCP","135","[TCP Retransmission] 443  >  64433 [PSH, ACK] Seq=5026 Ack=59327 Win=878 Len=81"
"180","23.981064300","100.84.170.161","151.101.2.187","TCP","66","64433  >  443 [ACK] Seq=59327 Ack=5107 Win=508 Len=0 SLE=5026 SRE=5107"
"181","24.054355100","100.84.170.161","151.101.2.187","TLSv1.2","467","Application Data"
"182","24.063681200","151.101.2.187","100.84.170.161","TCP","56","443  >  64433 [ACK] Seq=5107 Ack=59740 Win=883 Len=0"
"183","24.072058300","151.101.2.187","100.84.170.161","TLSv1.2","130","Application Data"
"184","24.091040000","100.84.170.161","151.101.2.187","TLSv1.2","2209","Application Data"
"185","24.101777900","151.101.2.187","100.84.170.161","TCP","56","443  >  64433 [ACK] Seq=5183 Ack=61895 Win=895 Len=0"
"186","24.103816100","151.101.2.187","100.84.170.161","TLSv1.2","130","Application Data"
"187","24.139101500","151.101.2.187","100.84.170.161","TCP","130","[TCP Retransmission] 443  >  64433 [PSH, ACK] Seq=5183 Ack=61895 Win=895 Len=76"
"188","24.139141700","100.84.170.161","151.101.2.187","TCP","66","64433  >  443 [ACK] Seq=61895 Ack=5259 Win=507 Len=0 SLE=5183 SRE=5259"
"189","25.080339900","100.84.170.161","151.101.66.187","TLSv1.2","248","Ignored Unknown Record"
"190","25.080406900","100.84.170.161","151.101.66.187","TLSv1.2","93","Application Data"
"191","25.089476700","151.101.66.187","100.84.170.161","TCP","56","443  >  50935 [ACK] Seq=1 Ack=196 Win=281 Len=0"
"192","25.089761900","151.101.66.187","100.84.170.161","TCP","56","443  >  50935 [ACK] Seq=1 Ack=235 Win=281 Len=0"
"193","25.090181400","151.101.66.187","100.84.170.161","TLSv1.2","93","Application Data"
"194","25.115947600","151.101.66.187","100.84.170.161","TCP","93","[TCP Retransmission] 443  >  50935 [PSH, ACK] Seq=1 Ack=235 Win=281 Len=39"
"195","25.116019400","100.84.170.161","151.101.66.187","TCP","66","50935  >  443 [ACK] Seq=235 Ack=40 Win=507 Len=0 SLE=1 SRE=40"
"196","25.140019500","151.101.66.187","100.84.170.161","TLSv1.2","265","Application Data"
"197","25.140345700","151.101.66.187","100.84.170.161","TLSv1.2","187","Application Data"
"198","25.140385400","100.84.170.161","151.101.66.187","TCP","54","50935  >  443 [ACK] Seq=235 Ack=384 Win=513 Len=0"
"199","25.144493300","100.84.170.161","151.101.66.187","TLSv1.2","89","Application Data"
"200","25.153784400","151.101.66.187","100.84.170.161","TCP","56","443  >  50935 [ACK] Seq=384 Ack=270 Win=281 Len=0"
"201","27.768060000","100.84.170.161","151.101.2.187","TLSv1.2","473","Application Data"
"202","27.770203400","100.84.170.161","151.101.2.187","TLSv1.2","2219","Application Data"
"203","27.777384200","151.101.2.187","100.84.170.161","TCP","56","443  >  64433 [ACK] Seq=5259 Ack=62314 Win=900 Len=0"
"204","27.779997600","151.101.2.187","100.84.170.161","TLSv1.2","241","Application Data"
"205","27.782190300","151.101.2.187","100.84.170.161","TLSv1.2","104","Application Data"
"206","27.782242700","100.84.170.161","151.101.2.187","TCP","54","64433  >  443 [ACK] Seq=64479 Ack=5496 Win=513 Len=0"
"207","27.811379700","100.84.170.161","151.101.2.187","TLSv1.2","477","Application Data"
"208","27.812945900","100.84.170.161","151.101.2.187","TLSv1.2","2187","Application Data"
"209","27.820759200","151.101.2.187","100.84.170.161","TCP","56","443  >  64433 [ACK] Seq=5496 Ack=64902 Win=918 Len=0"
"210","27.822181000","151.101.2.187","100.84.170.161","TCP","56","443  >  64433 [ACK] Seq=5496 Ack=67035 Win=929 Len=0"
"211","27.823513200","151.101.2.187","100.84.170.161","TLSv1.2","130","Application Data"
"212","27.824039700","151.101.2.187","100.84.170.161","TLSv1.2","124","Application Data"
"213","27.824083400","100.84.170.161","151.101.2.187","TCP","54","64433  >  443 [ACK] Seq=67035 Ack=5642 Win=512 Len=0"
"214","31.145856700","100.84.170.161","151.101.2.187","TLSv1.2","531","Application Data"
"215","31.156880600","151.101.2.187","100.84.170.161","TCP","56","443  >  64433 [ACK] Seq=5642 Ack=67512 Win=935 Len=0"
"216","31.161839300","151.101.2.187","100.84.170.161","TLSv1.2","214","Application Data"
"217","31.195030000","100.84.170.161","151.101.2.187","TLSv1.2","2131","Application Data"
"218","31.195470200","151.101.2.187","100.84.170.161","TCP","214","[TCP Spurious Retransmission] 443  >  64433 [PSH, ACK] Seq=5642 Ack=67512 Win=935 Len=160"
"219","31.195515800","100.84.170.161","151.101.2.187","TCP","66","[TCP Dup ACK 217#1] 64433  >  443 [ACK] Seq=69589 Ack=5802 Win=512 Len=0 SLE=5642 SRE=5802"
"220","31.205305200","151.101.2.187","100.84.170.161","TCP","56","443  >  64433 [ACK] Seq=5802 Ack=69589 Win=946 Len=0"
"221","31.208190000","151.101.2.187","100.84.170.161","TLSv1.2","125","Application Data"
"222","31.241133500","151.101.2.187","100.84.170.161","TCP","125","[TCP Retransmission] 443  >  64433 [PSH, ACK] Seq=5802 Ack=69589 Win=946 Len=71"
"223","31.241267200","100.84.170.161","151.101.2.187","TCP","66","64433  >  443 [ACK] Seq=69589 Ack=5873 Win=511 Len=0 SLE=5802 SRE=5873"
"224","32.278702700","100.84.170.161","151.101.2.187","TLSv1.2","528","Application Data"
"225","32.288361700","151.101.2.187","100.84.170.161","TCP","56","443  >  64433 [ACK] Seq=5873 Ack=70063 Win=952 Len=0"
"226","32.290603600","151.101.2.187","100.84.170.161","TLSv1.2","214","Application Data"
"227","32.324344100","151.101.2.187","100.84.170.161","TCP","214","[TCP Retransmission] 443  >  64433 [PSH, ACK] Seq=5873 Ack=70063 Win=952 Len=160"
"228","32.324399400","100.84.170.161","151.101.2.187","TCP","66","64433  >  443 [ACK] Seq=70063 Ack=6033 Win=511 Len=0 SLE=5873 SRE=6033"
"229","32.597377700","100.84.170.161","151.101.2.187","TLSv1.2","2102","Application Data"
"230","32.606457500","151.101.2.187","100.84.170.161","TCP","56","443  >  64433 [ACK] Seq=6033 Ack=72111 Win=963 Len=0"
"231","32.623087300","151.101.2.187","100.84.170.161","TLSv1.2","169","Application Data"
"232","32.656967000","151.101.2.187","100.84.170.161","TCP","169","[TCP Retransmission] 443  >  64433 [PSH, ACK] Seq=6033 Ack=72111 Win=963 Len=115"
"233","32.657007900","100.84.170.161","151.101.2.187","TCP","66","64433  >  443 [ACK] Seq=72111 Ack=6148 Win=510 Len=0 SLE=6033 SRE=6148"
"234","33.073581200","100.84.170.161","151.101.2.187","TLSv1.2","528","Application Data"
"235","33.083342500","151.101.2.187","100.84.170.161","TCP","56","443  >  64433 [ACK] Seq=6148 Ack=72585 Win=969 Len=0"
"236","33.085438300","151.101.2.187","100.84.170.161","TLSv1.2","104","Application Data"
"237","33.120489900","151.101.2.187","100.84.170.161","TCP","104","[TCP Retransmission] 443  >  64433 [PSH, ACK] Seq=6148 Ack=72585 Win=969 Len=50"
"238","33.120565500","100.84.170.161","151.101.2.187","TCP","66","64433  >  443 [ACK] Seq=72585 Ack=6198 Win=510 Len=0 SLE=6148 SRE=6198"
"239","33.497924300","100.84.170.161","151.101.2.187","TLSv1.2","2102","Application Data"
"240","33.507721100","151.101.2.187","100.84.170.161","TCP","56","443  >  64433 [ACK] Seq=6198 Ack=74633 Win=980 Len=0"
"241","33.509821400","151.101.2.187","100.84.170.161","TLSv1.2","208","Application Data"
"242","33.543179900","151.101.2.187","100.84.170.161","TCP","208","[TCP Retransmission] 443  >  64433 [PSH, ACK] Seq=6198 Ack=74633 Win=980 Len=154"
"243","33.543305100","100.84.170.161","151.101.2.187","TCP","66","64433  >  443 [ACK] Seq=74633 Ack=6352 Win=509 Len=0 SLE=6198 SRE=6352"
"244","34.485138300","100.84.170.161","151.101.2.187","TLSv1.2","530","Application Data"
"245","34.495972300","151.101.2.187","100.84.170.161","TCP","56","443  >  64433 [ACK] Seq=6352 Ack=75109 Win=986 Len=0"
"246","34.497878900","151.101.2.187","100.84.170.161","TLSv1.2","375","Application Data"
"247","34.523926600","100.84.170.161","151.101.2.187","TLSv1.2","2132","Application Data"
"248","34.531086500","151.101.2.187","100.84.170.161","TCP","375","[TCP Spurious Retransmission] 443  >  64433 [PSH, ACK] Seq=6352 Ack=75109 Win=986 Len=321"
"249","34.531126300","100.84.170.161","151.101.2.187","TCP","66","[TCP Dup ACK 247#1] 64433  >  443 [ACK] Seq=77187 Ack=6673 Win=508 Len=0 SLE=6352 SRE=6673"
"250","34.533274800","151.101.2.187","100.84.170.161","TCP","56","443  >  64433 [ACK] Seq=6673 Ack=77187 Win=997 Len=0"
"251","34.536028400","151.101.2.187","100.84.170.161","TLSv1.2","130","Application Data"
"252","34.568788100","100.84.170.161","151.101.2.187","TLSv1.2","518","Application Data"
"253","34.569041900","151.101.2.187","100.84.170.161","TCP","130","[TCP Spurious Retransmission] 443  >  64433 [PSH, ACK] Seq=6673 Ack=77187 Win=997 Len=76"
"254","34.569056000","100.84.170.161","151.101.2.187","TLSv1.2","2136","Application Data"
"255","34.569071200","100.84.170.161","151.101.2.187","TCP","66","[TCP Dup ACK 252#1] 64433  >  443 [ACK] Seq=79733 Ack=6749 Win=508 Len=0 SLE=6673 SRE=6749"
"256","34.577946700","151.101.2.187","100.84.170.161","TCP","56","443  >  64433 [ACK] Seq=6749 Ack=77651 Win=1003 Len=0"
"257","34.579087400","151.101.2.187","100.84.170.161","TCP","56","443  >  64433 [ACK] Seq=6749 Ack=79733 Win=1015 Len=0"
"258","34.580411200","151.101.2.187","100.84.170.161","TLSv1.2","130","Application Data"
"259","34.581525700","151.101.2.187","100.84.170.161","TLSv1.2","130","Application Data"
"260","34.581582000","100.84.170.161","151.101.2.187","TCP","54","64433  >  443 [ACK] Seq=79733 Ack=6901 Win=507 Len=0"
"261","34.657265800","100.84.170.161","151.101.2.187","TLSv1.2","474","Application Data"
"262","34.666548500","151.101.2.187","100.84.170.161","TCP","56","443  >  64433 [ACK] Seq=6901 Ack=80153 Win=1020 Len=0"
"263","34.669220200","151.101.2.187","100.84.170.161","TLSv1.2","173","Application Data"
"264","34.669502500","151.101.2.187","100.84.170.161","TLSv1.2","306","Application Data"
"265","34.669529700","100.84.170.161","151.101.2.187","TCP","54","64433  >  443 [ACK] Seq=80153 Ack=7272 Win=513 Len=0"
"266","34.680344400","100.84.170.161","151.101.2.187","TLSv1.2","89","Application Data"
"267","34.684526100","100.84.170.161","151.101.2.187","TLSv1.2","2158","Application Data"
"268","34.690240200","151.101.2.187","100.84.170.161","TCP","56","443  >  64433 [ACK] Seq=7272 Ack=80188 Win=1020 Len=0"
"269","34.694144800","151.101.2.187","100.84.170.161","TCP","56","443  >  64433 [ACK] Seq=7272 Ack=82292 Win=1032 Len=0"
"270","34.696611900","151.101.2.187","100.84.170.161","TLSv1.2","130","Application Data"
"271","34.720471400","100.84.170.161","151.101.2.187","TLSv1.2","467","Application Data"
"272","34.727971100","151.101.2.187","100.84.170.161","TCP","130","[TCP Spurious Retransmission] 443  >  64433 [PSH, ACK] Seq=7272 Ack=82292 Win=1032 Len=76"
"273","34.728009700","100.84.170.161","151.101.2.187","TCP","66","[TCP Dup ACK 271#1] 64433  >  443 [ACK] Seq=82705 Ack=7348 Win=512 Len=0 SLE=7272 SRE=7348"
"274","34.729356600","151.101.2.187","100.84.170.161","TCP","56","443  >  64433 [ACK] Seq=7348 Ack=82705 Win=1037 Len=0"
"275","34.732396600","100.84.170.161","151.101.2.187","TLSv1.2","2149","Application Data"
"276","34.732516000","100.84.170.161","151.101.2.187","TLSv1.2","490","Application Data"
"277","34.734449000","151.101.2.187","100.84.170.161","TLSv1.2","161","Application Data"
"278","34.734449000","151.101.2.187","100.84.170.161","TLSv1.2","463","Application Data"
"279","34.734507500","100.84.170.161","151.101.2.187","TCP","54","64433  >  443 [ACK] Seq=85236 Ack=7864 Win=510 Len=0"
"280","34.743802000","151.101.2.187","100.84.170.161","TCP","56","443  >  64433 [ACK] Seq=7864 Ack=85236 Win=1054 Len=0"
"281","34.746401600","151.101.2.187","100.84.170.161","TLSv1.2","124","Application Data"
"282","34.746675700","151.101.2.187","100.84.170.161","TLSv1.2","130","Application Data"
"283","34.746714100","100.84.170.161","151.101.2.187","TCP","54","64433  >  443 [ACK] Seq=85236 Ack=8010 Win=510 Len=0"
"284","34.786584900","100.84.170.161","151.101.2.187","TLSv1.2","2217","Application Data"
"285","34.790066300","100.84.170.161","151.101.2.187","TLSv1.2","461","Application Data"
"286","34.796118200","151.101.2.187","100.84.170.161","TCP","56","443  >  64433 [ACK] Seq=8010 Ack=87399 Win=1066 Len=0"
"287","34.798923700","151.101.2.187","100.84.170.161","TLSv1.2","130","Application Data"
"288","34.799234300","151.101.2.187","100.84.170.161","TCP","56","443  >  64433 [ACK] Seq=8086 Ack=87806 Win=1072 Len=0"
"289","34.802076000","151.101.2.187","100.84.170.161","TLSv1.2","168","Application Data"
"290","34.802188700","100.84.170.161","151.101.2.187","TCP","54","64433  >  443 [ACK] Seq=87806 Ack=8200 Win=509 Len=0"
"291","35.134424200","100.84.170.161","151.101.2.187","TLSv1.2","2123","Application Data"
"292","35.139412900","100.84.170.161","151.101.2.187","TLSv1.2","476","Application Data"
"293","35.144812500","151.101.2.187","100.84.170.161","TCP","56","443  >  64433 [ACK] Seq=8200 Ack=89875 Win=1083 Len=0"
"294","35.147150400","151.101.2.187","100.84.170.161","TLSv1.2","131","Application Data"
"295","35.148644800","151.101.2.187","100.84.170.161","TCP","56","443  >  64433 [ACK] Seq=8277 Ack=90297 Win=1089 Len=0"
"296","35.150388800","151.101.2.187","100.84.170.161","TLSv1.2","396","Application Data"
"297","35.150459000","100.84.170.161","151.101.2.187","TCP","54","64433  >  443 [ACK] Seq=90297 Ack=8619 Win=508 Len=0"
"298","35.333045200","100.84.170.161","151.101.2.187","TLSv1.2","2134","Application Data"
"299","35.344300100","151.101.2.187","100.84.170.161","TCP","56","443  >  64433 [ACK] Seq=8619 Ack=92377 Win=1100 Len=0"
"300","35.346467200","151.101.2.187","100.84.170.161","TLSv1.2","240","Application Data"
"301","35.374997000","151.101.2.187","100.84.170.161","TCP","240","[TCP Retransmission] 443  >  64433 [PSH, ACK] Seq=8619 Ack=92377 Win=1100 Len=186"
"302","35.375031000","100.84.170.161","151.101.2.187","TCP","66","64433  >  443 [ACK] Seq=92377 Ack=8805 Win=513 Len=0 SLE=8619 SRE=8805"
"303","35.678393000","100.84.170.161","151.101.2.187","TLSv1.2","491","Application Data"
"304","35.688608800","151.101.2.187","100.84.170.161","TCP","56","443  >  64433 [ACK] Seq=8805 Ack=92814 Win=1106 Len=0"
"305","35.691618400","151.101.2.187","100.84.170.161","TLSv1.2","131","Application Data"
"306","35.721126500","151.101.2.187","100.84.170.161","TCP","131","[TCP Retransmission] 443  >  64433 [PSH, ACK] Seq=8805 Ack=92814 Win=1106 Len=77"
"307","35.721157700","100.84.170.161","151.101.2.187","TCP","66","64433  >  443 [ACK] Seq=92814 Ack=8882 Win=512 Len=0 SLE=8805 SRE=8882"
"308","38.894179700","100.84.170.161","151.101.2.187","TLSv1.2","2155","Application Data"
"309","38.915919000","100.84.170.161","151.101.2.187","TLSv1.2","434","Application Data"
"310","38.920184300","100.84.170.161","151.101.2.187","TCP","1514","[TCP Retransmission] 64433  >  443 [PSH, ACK] Seq=93835 Ack=8882 Win=512 Len=1460"
"311","38.924668100","151.101.2.187","100.84.170.161","TCP","56","443  >  64433 [ACK] Seq=8882 Ack=94915 Win=1117 Len=0"
"312","38.925024300","151.101.2.187","100.84.170.161","TLSv1.2","214","Application Data"
"313","38.933113800","151.101.2.187","100.84.170.161","TCP","56","443  >  64433 [ACK] Seq=9042 Ack=95295 Win=1123 Len=0"
"314","38.933113800","151.101.2.187","100.84.170.161","TCP","66","[TCP Dup ACK 313#1] 443  >  64433 [ACK] Seq=9042 Ack=95295 Win=1123 Len=0 SLE=93835 SRE=95295"
"315","38.935637000","151.101.2.187","100.84.170.161","TLSv1.2","98","Application Data"
"316","38.935712800","100.84.170.161","151.101.2.187","TCP","54","64433  >  443 [ACK] Seq=95295 Ack=9086 Win=512 Len=0"
"317","39.374650500","100.84.170.161","151.101.2.187","TLSv1.2","2162","Application Data"
"318","39.383958900","151.101.2.187","100.84.170.161","TCP","56","443  >  64433 [ACK] Seq=9086 Ack=97403 Win=1134 Len=0"
"319","39.386399700","151.101.2.187","100.84.170.161","TLSv1.2","208","Application Data"
"320","39.421068300","151.101.2.187","100.84.170.161","TCP","208","[TCP Retransmission] 443  >  64433 [PSH, ACK] Seq=9086 Ack=97403 Win=1134 Len=154"
"321","39.421104000","100.84.170.161","151.101.2.187","TCP","66","64433  >  443 [ACK] Seq=97403 Ack=9240 Win=511 Len=0 SLE=9086 SRE=9240"
"322","39.736645800","100.84.170.161","151.101.2.187","TLSv1.2","405","Application Data"
"323","39.745775200","151.101.2.187","100.84.170.161","TCP","56","443  >  64433 [ACK] Seq=9240 Ack=97754 Win=1140 Len=0"
"324","39.748378100","151.101.2.187","100.84.170.161","TLSv1.2","98","Application Data"
"325","39.783177800","151.101.2.187","100.84.170.161","TCP","98","[TCP Retransmission] 443  >  64433 [PSH, ACK] Seq=9240 Ack=97754 Win=1140 Len=44"
"326","39.783214800","100.84.170.161","151.101.2.187","TCP","66","64433  >  443 [ACK] Seq=97754 Ack=9284 Win=511 Len=0 SLE=9240 SRE=9284"
"327","40.592925000","100.84.170.161","151.101.2.187","TLSv1.2","2164","Application Data"
"328","40.593238800","100.84.170.161","151.101.2.187","TLSv1.2","445","Application Data"
"329","40.593942200","100.84.170.161","151.101.2.187","TLSv1.2","2146","Application Data"
"330","40.600856700","100.84.170.161","151.101.2.187","TLSv1.2","458","Application Data"
"331","40.602232700","151.101.2.187","100.84.170.161","TCP","56","443  >  64433 [ACK] Seq=9284 Ack=99864 Win=1151 Len=0"
"332","40.602581800","151.101.2.187","100.84.170.161","TCP","56","443  >  64433 [ACK] Seq=9284 Ack=100255 Win=1157 Len=0"
"333","40.603187100","151.101.2.187","100.84.170.161","TCP","56","443  >  64433 [ACK] Seq=9284 Ack=102347 Win=1169 Len=0"
"334","40.605733600","151.101.2.187","100.84.170.161","TLSv1.2","268","Application Data"
"335","40.606215100","151.101.2.187","100.84.170.161","TLSv1.2","130","Application Data"
"336","40.606266000","100.84.170.161","151.101.2.187","TCP","54","64433  >  443 [ACK] Seq=102751 Ack=9574 Win=510 Len=0"
"337","40.609920400","151.101.2.187","100.84.170.161","TCP","56","443  >  64433 [ACK] Seq=9574 Ack=102751 Win=1174 Len=0"
"338","40.612861600","151.101.2.187","100.84.170.161","TLSv1.2","98","Application Data"
"339","40.649913500","151.101.2.187","100.84.170.161","TCP","98","[TCP Retransmission] 443  >  64433 [PSH, ACK] Seq=9574 Ack=102751 Win=1174 Len=44"
"340","40.649950300","100.84.170.161","151.101.2.187","TCP","66","64433  >  443 [ACK] Seq=102751 Ack=9618 Win=510 Len=0 SLE=9574 SRE=9618"
"341","40.730152400","100.84.170.161","151.101.2.187","TLSv1.2","2168","Application Data"
"342","40.739651600","151.101.2.187","100.84.170.161","TCP","56","443  >  64433 [ACK] Seq=9618 Ack=104865 Win=1186 Len=0"
"343","40.742067200","151.101.2.187","100.84.170.161","TLSv1.2","130","Application Data"
"344","40.776150000","151.101.2.187","100.84.170.161","TCP","130","[TCP Retransmission] 443  >  64433 [PSH, ACK] Seq=9618 Ack=104865 Win=1186 Len=76"
"345","40.776187800","100.84.170.161","151.101.2.187","TCP","66","64433  >  443 [ACK] Seq=104865 Ack=9694 Win=509 Len=0 SLE=9618 SRE=9694"
"346","40.793379200","100.84.170.161","151.101.2.187","TLSv1.2","456","Application Data"
"347","40.793538400","100.84.170.161","151.101.2.187","TLSv1.2","2110","Application Data"
"348","40.802720800","151.101.2.187","100.84.170.161","TCP","56","443  >  64433 [ACK] Seq=9694 Ack=107323 Win=1203 Len=0"
"349","40.805260000","151.101.2.187","100.84.170.161","TLSv1.2","174","Application Data"
"350","40.805591400","151.101.2.187","100.84.170.161","TLSv1.2","124","Application Data"
"351","40.805628400","100.84.170.161","151.101.2.187","TCP","54","64433  >  443 [ACK] Seq=107323 Ack=9884 Win=509 Len=0"
"352","40.861871900","100.84.170.161","151.101.2.187","TLSv1.2","504","Application Data"
"353","40.862031000","100.84.170.161","151.101.2.187","TLSv1.2","2088","Application Data"
"354","40.870460700","100.84.170.161","151.101.2.187","TLSv1.2","482","Application Data"
"355","40.871626400","151.101.2.187","100.84.170.161","TCP","56","443  >  64433 [ACK] Seq=9884 Ack=107773 Win=1208 Len=0"
"356","40.872377300","151.101.2.187","100.84.170.161","TCP","56","443  >  64433 [ACK] Seq=9884 Ack=109807 Win=1220 Len=0"
"357","40.873456600","151.101.2.187","100.84.170.161","TLSv1.2","291","Application Data"
"358","40.874059800","151.101.2.187","100.84.170.161","TLSv1.2","124","Application Data"
"359","40.874098300","100.84.170.161","151.101.2.187","TCP","54","64433  >  443 [ACK] Seq=110235 Ack=10191 Win=507 Len=0"
"360","40.880814000","151.101.2.187","100.84.170.161","TCP","56","443  >  64433 [ACK] Seq=10191 Ack=110235 Win=1226 Len=0"
"361","40.883233300","151.101.2.187","100.84.170.161","TLSv1.2","135","Application Data"
"362","40.913978300","151.101.2.187","100.84.170.161","TCP","135","[TCP Retransmission] 443  >  64433 [PSH, ACK] Seq=10191 Ack=110235 Win=1226 Len=81"
"363","40.914023700","100.84.170.161","151.101.2.187","TCP","66","64433  >  443 [ACK] Seq=110235 Ack=10272 Win=513 Len=0 SLE=10191 SRE=10272"
"364","41.140246500","100.84.170.161","151.101.2.187","TLSv1.2","2188","Application Data"
"365","41.143216700","100.84.170.161","151.101.2.187","TLSv1.2","455","Application Data"
"366","41.150078400","151.101.2.187","100.84.170.161","TCP","56","443  >  64433 [ACK] Seq=10272 Ack=112369 Win=1237 Len=0"
"367","41.151924800","151.101.2.187","100.84.170.161","TLSv1.2","131","Application Data"
"368","41.152434800","151.101.2.187","100.84.170.161","TCP","56","443  >  64433 [ACK] Seq=10349 Ack=112770 Win=1243 Len=0"
"369","41.154731300","151.101.2.187","100.84.170.161","TLSv1.2","125","Application Data"
"370","41.154806200","100.84.170.161","151.101.2.187","TCP","54","64433  >  443 [ACK] Seq=112770 Ack=10420 Win=512 Len=0"
"371","41.410711200","100.84.170.161","151.101.2.187","TLSv1.2","2205","Application Data"
"372","41.420904100","151.101.2.187","100.84.170.161","TCP","56","443  >  64433 [ACK] Seq=10420 Ack=114921 Win=1254 Len=0"
"373","41.424608700","151.101.2.187","100.84.170.161","TLSv1.2","235","Application Data"
"374","41.454849500","151.101.2.187","100.84.170.161","TCP","235","[TCP Retransmission] 443  >  64433 [PSH, ACK] Seq=10420 Ack=114921 Win=1254 Len=181"
"375","41.454889000","100.84.170.161","151.101.2.187","TCP","66","64433  >  443 [ACK] Seq=114921 Ack=10601 Win=511 Len=0 SLE=10420 SRE=10601"
"376","41.801417500","100.84.170.161","151.101.2.187","TLSv1.2","466","Application Data"
"377","41.812575400","151.101.2.187","100.84.170.161","TCP","56","443  >  64433 [ACK] Seq=10601 Ack=115333 Win=1260 Len=0"
"378","41.816033200","151.101.2.187","100.84.170.161","TLSv1.2","124","Application Data"
"379","41.846951400","151.101.2.187","100.84.170.161","TCP","124","[TCP Retransmission] 443  >  64433 [PSH, ACK] Seq=10601 Ack=115333 Win=1260 Len=70"
"380","41.847017100","100.84.170.161","151.101.2.187","TCP","66","64433  >  443 [ACK] Seq=115333 Ack=10671 Win=511 Len=0 SLE=10601 SRE=10671"
"381","47.357510700","100.84.170.161","151.101.2.187","TLSv1.2","2273","Application Data"
"382","47.358362300","100.84.170.161","151.101.2.187","TLSv1.2","443","Application Data"
"383","47.363579600","100.84.170.161","151.101.2.187","TLSv1.2","2251","Application Data"
"384","47.367643700","151.101.2.187","100.84.170.161","TCP","56","443  >  64433 [ACK] Seq=10671 Ack=117941 Win=1277 Len=0"
"385","47.371264300","151.101.2.187","100.84.170.161","TLSv1.2","241","Application Data"
"386","47.371752400","151.101.2.187","100.84.170.161","TLSv1.2","104","Application Data"
"387","47.371793700","100.84.170.161","151.101.2.187","TCP","54","64433  >  443 [ACK] Seq=120138 Ack=10908 Win=510 Len=0"
"388","47.372902500","151.101.2.187","100.84.170.161","TCP","56","443  >  64433 [ACK] Seq=10908 Ack=120138 Win=1288 Len=0"
"389","47.375780500","151.101.2.187","100.84.170.161","TLSv1.2","124","Application Data"
"390","47.410294500","151.101.2.187","100.84.170.161","TCP","124","[TCP Retransmission] 443  >  64433 [PSH, ACK] Seq=10908 Ack=120138 Win=1288 Len=70"
"391","47.410499300","100.84.170.161","151.101.2.187","TCP","66","64433  >  443 [ACK] Seq=120138 Ack=10978 Win=510 Len=0 SLE=10908 SRE=10978"
"392","47.423786300","100.84.170.161","151.101.2.187","TLSv1.2","443","Application Data"
"393","47.433530200","151.101.2.187","100.84.170.161","TCP","56","443  >  64433 [ACK] Seq=10978 Ack=120527 Win=1294 Len=0"
"394","47.435694400","151.101.2.187","100.84.170.161","TLSv1.2","130","Application Data"
"395","47.465654500","151.101.2.187","100.84.170.161","TCP","130","[TCP Retransmission] 443  >  64433 [PSH, ACK] Seq=10978 Ack=120527 Win=1294 Len=76"
"396","47.465693300","100.84.170.161","151.101.2.187","TCP","66","64433  >  443 [ACK] Seq=120527 Ack=11054 Win=510 Len=0 SLE=10978 SRE=11054"
"397","47.550808100","100.84.170.161","151.101.2.187","TLSv1.2","2282","Application Data"
"398","47.560896800","151.101.2.187","100.84.170.161","TCP","56","443  >  64433 [ACK] Seq=11054 Ack=122755 Win=1305 Len=0"
"399","47.564105100","151.101.2.187","100.84.170.161","TLSv1.2","98","Application Data"
"400","47.582882600","100.84.170.161","151.101.2.187","TLSv1.2","440","Application Data"
"401","47.584021800","100.84.170.161","151.101.2.187","TLSv1.2","2282","Application Data"
"402","47.592793700","151.101.2.187","100.84.170.161","TCP","56","443  >  64433 [ACK] Seq=11098 Ack=123141 Win=1311 Len=0"
"403","47.593928700","151.101.2.187","100.84.170.161","TCP","56","443  >  64433 [ACK] Seq=11098 Ack=125369 Win=1323 Len=0"
"404","47.595276000","151.101.2.187","100.84.170.161","TLSv1.2","125","Application Data"
"405","47.596382000","151.101.2.187","100.84.170.161","TLSv1.2","130","Application Data"
"406","47.596441500","100.84.170.161","151.101.2.187","TCP","54","64433  >  443 [ACK] Seq=125369 Ack=11245 Win=509 Len=0"
"407","47.683428600","100.84.170.161","151.101.2.187","TLSv1.2","429","Application Data"
"408","47.756347800","151.101.2.187","100.84.170.161","TCP","56","443  >  64433 [ACK] Seq=11245 Ack=125744 Win=1328 Len=0"
"409","47.756636200","151.101.2.187","100.84.170.161","TLSv1.2","175","Application Data"
"410","47.758197600","151.101.2.187","100.84.170.161","TCP","175","[TCP Retransmission] 443  >  64433 [PSH, ACK] Seq=11245 Ack=125744 Win=1328 Len=121"
"411","47.758242600","100.84.170.161","151.101.2.187","TCP","66","64433  >  443 [ACK] Seq=125744 Ack=11366 Win=509 Len=0 SLE=11245 SRE=11366"
"412","47.913432100","100.84.170.161","151.101.2.187","TLSv1.2","2272","Application Data"
"413","47.913595200","100.84.170.161","151.101.2.187","TLSv1.2","442","Application Data"
"414","47.913737600","100.84.170.161","151.101.2.187","TLSv1.2","2268","Application Data"
"415","47.913811100","100.84.170.161","151.101.2.187","TLSv1.2","438","Application Data"
"416","47.913911200","100.84.170.161","151.101.2.187","TLSv1.2","2264","Application Data"
"417","47.913998900","100.84.170.161","151.101.2.187","TLSv1.2","449","Application Data"
"418","47.914105600","100.84.170.161","151.101.2.187","TLSv1.2","2252","Application Data"
"419","47.915680200","100.84.170.161","151.101.2.187","TLSv1.2","448","Application Data"
"420","47.925749000","151.101.2.187","100.84.170.161","TCP","56","443  >  64433 [ACK] Seq=11366 Ack=128350 Win=1345 Len=0"
"421","47.925973900","151.101.2.187","100.84.170.161","TCP","56","443  >  64433 [ACK] Seq=11366 Ack=136145 Win=1397 Len=0"
"422","47.931638600","151.101.2.187","100.84.170.161","TLSv1.2","124","Application Data"
"423","47.932778000","151.101.2.187","100.84.170.161","TLSv1.2","350","Application Data"
"424","47.932834700","100.84.170.161","151.101.2.187","TCP","54","64433  >  443 [ACK] Seq=136145 Ack=11732 Win=513 Len=0"
"425","47.933545900","151.101.2.187","100.84.170.161","TLSv1.2","130","Application Data"
"426","47.933842400","151.101.2.187","100.84.170.161","TLSv1.2","125","Application Data"
"427","47.933873800","100.84.170.161","151.101.2.187","TCP","54","64433  >  443 [ACK] Seq=136145 Ack=11879 Win=512 Len=0"
"428","47.934216700","151.101.2.187","100.84.170.161","TLSv1.2","125","Application Data"
"429","47.934859100","151.101.2.187","100.84.170.161","TLSv1.2","130","Application Data"
"430","47.934903000","100.84.170.161","151.101.2.187","TCP","54","64433  >  443 [ACK] Seq=136145 Ack=12026 Win=512 Len=0"
"431","47.935152400","151.101.2.187","100.84.170.161","TLSv1.2","131","Application Data"
"432","47.975906300","151.101.2.187","100.84.170.161","TCP","131","[TCP Retransmission] 443  >  64433 [PSH, ACK] Seq=12026 Ack=136145 Win=1397 Len=77"
"433","47.975930700","100.84.170.161","151.101.2.187","TCP","66","64433  >  443 [ACK] Seq=136145 Ack=12103 Win=511 Len=0 SLE=12026 SRE=12103"
"434","56.306533300","100.84.170.161","151.101.2.187","TLSv1.2","2239","Application Data"
"435","56.317715800","151.101.2.187","100.84.170.161","TCP","56","443  >  64433 [ACK] Seq=12103 Ack=138330 Win=1408 Len=0"
"436","56.321423700","151.101.2.187","100.84.170.161","TLSv1.2","241","Application Data"
"437","56.331741600","100.84.170.161","151.101.2.187","TLSv1.2","434","Application Data"
"438","56.340986600","151.101.2.187","100.84.170.161","TCP","56","443  >  64433 [ACK] Seq=12290 Ack=138710 Win=1414 Len=0"
"439","56.344626500","151.101.2.187","100.84.170.161","TLSv1.2","125","Application Data"
"440","56.354604000","100.84.170.161","151.101.2.187","TLSv1.2","2236","Application Data"
"441","56.364291300","151.101.2.187","100.84.170.161","TCP","56","443  >  64433 [ACK] Seq=12361 Ack=140892 Win=1425 Len=0"
"442","56.367178200","151.101.2.187","100.84.170.161","TLSv1.2","125","Application Data"
"443","56.400380500","151.101.2.187","100.84.170.161","TCP","125","[TCP Retransmission] 443  >  64433 [PSH, ACK] Seq=12361 Ack=140892 Win=1425 Len=71"
"444","56.400416400","100.84.170.161","151.101.2.187","TCP","66","64433  >  443 [ACK] Seq=140892 Ack=12432 Win=510 Len=0 SLE=12361 SRE=12432"
"445","56.793475100","100.84.170.161","151.101.2.187","TLSv1.2","445","Application Data"
"446","56.795264600","100.84.170.161","151.101.2.187","TLSv1.2","2220","Application Data"
"447","56.804392800","151.101.2.187","100.84.170.161","TCP","56","443  >  64433 [ACK] Seq=12432 Ack=141283 Win=1431 Len=0"
"448","56.804657400","151.101.2.187","100.84.170.161","TCP","56","443  >  64433 [ACK] Seq=12432 Ack=143449 Win=1442 Len=0"
"449","56.806975500","151.101.2.187","100.84.170.161","TLSv1.2","130","Application Data"
"450","56.807326700","151.101.2.187","100.84.170.161","TLSv1.2","130","Application Data"
"451","56.807383200","100.84.170.161","151.101.2.187","TCP","54","64433  >  443 [ACK] Seq=143449 Ack=12584 Win=509 Len=0"
"452","56.929680100","100.84.170.161","151.101.2.187","TLSv1.2","461","Application Data"
"453","56.940202600","151.101.2.187","100.84.170.161","TCP","56","443  >  64433 [ACK] Seq=12584 Ack=143856 Win=1448 Len=0"
"454","56.942288400","151.101.2.187","100.84.170.161","TLSv1.2","174","Application Data"
"455","56.972989000","151.101.2.187","100.84.170.161","TCP","174","[TCP Retransmission] 443  >  64433 [PSH, ACK] Seq=12584 Ack=143856 Win=1448 Len=120"
"456","56.973030200","100.84.170.161","151.101.2.187","TCP","66","64433  >  443 [ACK] Seq=143856 Ack=12704 Win=509 Len=0 SLE=12584 SRE=12704"
"457","58.114039000","100.84.170.161","151.101.2.187","TLSv1.2","2226","Application Data"
"458","58.115655400","100.84.170.161","151.101.2.187","TLSv1.2","452","Application Data"
"459","58.116995500","100.84.170.161","151.101.2.187","TLSv1.2","2198","Application Data"
"460","58.123655400","151.101.2.187","100.84.170.161","TCP","56","443  >  64433 [ACK] Seq=12704 Ack=146028 Win=1459 Len=0"
"461","58.125028600","151.101.2.187","100.84.170.161","TCP","56","443  >  64433 [ACK] Seq=12704 Ack=146426 Win=1465 Len=0"
"462","58.126187400","151.101.2.187","100.84.170.161","TLSv1.2","401","Application Data"
"463","58.127545700","151.101.2.187","100.84.170.161","TLSv1.2","135","Application Data"
"464","58.127601500","100.84.170.161","151.101.2.187","TCP","54","64433  >  443 [ACK] Seq=148570 Ack=13132 Win=507 Len=0"
"465","58.128948600","151.101.2.187","100.84.170.161","TLSv1.2","130","Application Data"
"466","58.167067700","151.101.2.187","100.84.170.161","TCP","130","[TCP Retransmission] 443  >  64433 [PSH, ACK] Seq=13132 Ack=148570 Win=1476 Len=76"
"467","58.167109000","100.84.170.161","151.101.2.187","TCP","66","64433  >  443 [ACK] Seq=148570 Ack=13208 Win=513 Len=0 SLE=13132 SRE=13208"
"468","58.376967400","100.84.170.161","151.101.2.187","TLSv1.2","456","Application Data"
"469","58.386452700","151.101.2.187","100.84.170.161","TCP","56","443  >  64433 [ACK] Seq=13208 Ack=148972 Win=1482 Len=0"
"470","58.388772800","151.101.2.187","100.84.170.161","TLSv1.2","240","Application Data"
"471","58.388804700","100.84.170.161","151.101.2.187","TLSv1.2","2192","Application Data"
"472","58.388955200","100.84.170.161","151.101.2.187","TLSv1.2","472","Application Data"
"473","58.397947100","151.101.2.187","100.84.170.161","TCP","56","443  >  64433 [ACK] Seq=13394 Ack=151110 Win=1494 Len=0"
"474","58.398246500","151.101.2.187","100.84.170.161","TCP","56","443  >  64433 [ACK] Seq=13394 Ack=151528 Win=1499 Len=0"
"475","58.400203900","151.101.2.187","100.84.170.161","TLSv1.2","124","Application Data"
"476","58.400579700","151.101.2.187","100.84.170.161","TLSv1.2","124","Application Data"
"477","58.400639100","100.84.170.161","151.101.2.187","TCP","54","64433  >  443 [ACK] Seq=151528 Ack=13534 Win=512 Len=0"
"478","61.722565000","100.84.170.161","151.101.2.187","TLSv1.2","2198","Application Data"
"479","61.733888700","151.101.2.187","100.84.170.161","TCP","56","443  >  64433 [ACK] Seq=13534 Ack=153672 Win=1511 Len=0"
"480","61.736207100","151.101.2.187","100.84.170.161","TLSv1.2","241","Application Data"
"481","61.764977200","151.101.2.187","100.84.170.161","TCP","241","[TCP Retransmission] 443  >  64433 [PSH, ACK] Seq=13534 Ack=153672 Win=1511 Len=187"
"482","61.765015400","100.84.170.161","151.101.2.187","TCP","66","64433  >  443 [ACK] Seq=153672 Ack=13721 Win=511 Len=0 SLE=13534 SRE=13721"
"483","62.590793700","100.84.170.161","151.101.2.187","TLSv1.2","434","Application Data"
"484","62.594106300","100.84.170.161","151.101.2.187","TLSv1.2","2191","Application Data"
"485","62.594440800","100.84.170.161","151.101.2.187","TLSv1.2","439","Application Data"
"486","62.598669100","100.84.170.161","151.101.2.187","TLSv1.2","2204","Application Data"
"487","62.600157800","151.101.2.187","100.84.170.161","TCP","56","443  >  64433 [ACK] Seq=13721 Ack=154052 Win=1516 Len=0"
"488","62.602534100","151.101.2.187","100.84.170.161","TLSv1.2","235","Application Data"
"489","62.603333100","151.101.2.187","100.84.170.161","TCP","56","443  >  64433 [ACK] Seq=13902 Ack=156189 Win=1528 Len=0"
"490","62.603609400","151.101.2.187","100.84.170.161","TCP","56","443  >  64433 [ACK] Seq=13902 Ack=156574 Win=1534 Len=0"
"491","62.606430700","151.101.2.187","100.84.170.161","TLSv1.2","130","Application Data"
"492","62.606492600","100.84.170.161","151.101.2.187","TCP","54","64433  >  443 [ACK] Seq=158724 Ack=13978 Win=510 Len=0"
"493","62.607310100","151.101.2.187","100.84.170.161","TLSv1.2","174","Application Data"
"494","62.607809800","151.101.2.187","100.84.170.161","TCP","56","443  >  64433 [ACK] Seq=14098 Ack=158724 Win=1545 Len=0"
"495","62.610655600","151.101.2.187","100.84.170.161","TLSv1.2","98","Application Data"
"496","62.610709500","100.84.170.161","151.101.2.187","TCP","54","64433  >  443 [ACK] Seq=158724 Ack=14142 Win=509 Len=0"
"497","62.721692900","100.84.170.161","151.101.2.187","TLSv1.2","461","Application Data"
"498","62.731723300","151.101.2.187","100.84.170.161","TCP","56","443  >  64433 [ACK] Seq=14142 Ack=159131 Win=1551 Len=0"
"499","62.733837600","151.101.2.187","100.84.170.161","TLSv1.2","130","Application Data"
"500","62.762959000","151.101.2.187","100.84.170.161","TCP","130","[TCP Retransmission] 443  >  64433 [PSH, ACK] Seq=14142 Ack=159131 Win=1551 Len=76"
"501","62.763003300","100.84.170.161","151.101.2.187","TCP","66","64433  >  443 [ACK] Seq=159131 Ack=14218 Win=509 Len=0 SLE=14142 SRE=14218"
"502","62.781566200","100.84.170.161","151.101.2.187","TLSv1.2","2192","Application Data"
"503","62.782567700","100.84.170.161","151.101.2.187","TLSv1.2","423","Application Data"
"504","62.792330100","151.101.2.187","100.84.170.161","TCP","56","443  >  64433 [ACK] Seq=14218 Ack=161638 Win=1568 Len=0"
"505","62.794981300","151.101.2.187","100.84.170.161","TLSv1.2","265","Application Data"
"506","62.795240100","151.101.2.187","100.84.170.161","TLSv1.2","98","Application Data"
"507","62.795269900","100.84.170.161","151.101.2.187","TCP","54","64433  >  443 [ACK] Seq=161638 Ack=14473 Win=508 Len=0"
"508","62.851816900","100.84.170.161","151.101.2.187","TLSv1.2","2196","Application Data"
"509","62.852733600","100.84.170.161","151.101.2.187","TLSv1.2","452","Application Data"
"510","62.852976100","100.84.170.161","151.101.2.187","TLSv1.2","2168","Application Data"
"511","62.862365900","151.101.2.187","100.84.170.161","TCP","56","443  >  64433 [ACK] Seq=14473 Ack=163780 Win=1579 Len=0"
"512","62.862365900","151.101.2.187","100.84.170.161","TCP","56","443  >  64433 [ACK] Seq=14473 Ack=164178 Win=1585 Len=0"
"513","62.862675200","151.101.2.187","100.84.170.161","TCP","56","443  >  64433 [ACK] Seq=14473 Ack=166292 Win=1596 Len=0"
"514","62.864670700","151.101.2.187","100.84.170.161","TLSv1.2","130","Application Data"
"515","62.864670700","151.101.2.187","100.84.170.161","TLSv1.2","109","Application Data"
"516","62.864806300","100.84.170.161","151.101.2.187","TCP","54","64433  >  443 [ACK] Seq=166292 Ack=14604 Win=507 Len=0"
"517","62.865069000","151.101.2.187","100.84.170.161","TLSv1.2","124","Application Data"
"518","62.901870500","151.101.2.187","100.84.170.161","TCP","124","[TCP Retransmission] 443  >  64433 [PSH, ACK] Seq=14604 Ack=166292 Win=1596 Len=70"
"519","62.901945100","100.84.170.161","151.101.2.187","TCP","66","64433  >  443 [ACK] Seq=166292 Ack=14674 Win=513 Len=0 SLE=14604 SRE=14674"
"520","62.993738900","100.84.170.161","151.101.2.187","TLSv1.2","765","Application Data"
"521","63.003277800","151.101.2.187","100.84.170.161","TCP","56","443  >  64433 [ACK] Seq=14674 Ack=167003 Win=1602 Len=0"
"522","63.005534300","151.101.2.187","100.84.170.161","TLSv1.2","131","Application Data"
"523","63.016577300","100.84.170.161","151.101.2.187","TLSv1.2","1886","Application Data"
"524","63.025700600","151.101.2.187","100.84.170.161","TCP","56","443  >  64433 [ACK] Seq=14751 Ack=168835 Win=1613 Len=0"
"525","63.028445100","151.101.2.187","100.84.170.161","TLSv1.2","131","Application Data"
"526","63.058491500","151.101.2.187","100.84.170.161","TCP","131","[TCP Retransmission] 443  >  64433 [PSH, ACK] Seq=14751 Ack=168835 Win=1613 Len=77"
"527","63.058532400","100.84.170.161","151.101.2.187","TCP","66","64433  >  443 [ACK] Seq=168835 Ack=14828 Win=512 Len=0 SLE=14751 SRE=14828"
"528","63.103639500","100.84.170.161","151.101.2.187","TLSv1.2","782","Application Data"
"529","63.112916700","151.101.2.187","100.84.170.161","TCP","56","443  >  64433 [ACK] Seq=14828 Ack=169563 Win=1619 Len=0"
"530","63.115119100","151.101.2.187","100.84.170.161","TLSv1.2","98","Application Data"
"531","63.123529200","100.84.170.161","151.101.2.187","TLSv1.2","1880","Application Data"
"532","63.126621800","100.84.170.161","151.101.2.187","TLSv1.2","786","Application Data"
"533","63.132828900","151.101.2.187","100.84.170.161","TCP","56","443  >  64433 [ACK] Seq=14872 Ack=171389 Win=1630 Len=0"
"534","63.135459500","151.101.2.187","100.84.170.161","TLSv1.2","130","Application Data"
"535","63.135773600","151.101.2.187","100.84.170.161","TCP","56","443  >  64433 [ACK] Seq=14948 Ack=172121 Win=1636 Len=0"
"536","63.137774700","151.101.2.187","100.84.170.161","TLSv1.2","131","Application Data"
"537","63.137824800","100.84.170.161","151.101.2.187","TCP","54","64433  >  443 [ACK] Seq=172121 Ack=15025 Win=511 Len=0"
"538","63.385421500","100.84.170.161","151.101.2.187","TLSv1.2","1910","Application Data"
"539","63.396400000","151.101.2.187","100.84.170.161","TCP","56","443  >  64433 [ACK] Seq=15025 Ack=173977 Win=1648 Len=0"
"540","63.398689400","151.101.2.187","100.84.170.161","TLSv1.2","208","Application Data"
"541","63.418445800","100.84.170.161","151.101.2.187","TLSv1.2","741","Application Data"
"542","63.427520000","151.101.2.187","100.84.170.161","TCP","56","443  >  64433 [ACK] Seq=15179 Ack=174664 Win=1653 Len=0"
"543","63.430690900","151.101.2.187","100.84.170.161","TLSv1.2","125","Application Data"
"544","63.464907600","151.101.2.187","100.84.170.161","TCP","125","[TCP Retransmission] 443  >  64433 [PSH, ACK] Seq=15179 Ack=174664 Win=1653 Len=71"
"545","63.464951600","100.84.170.161","151.101.2.187","TCP","66","64433  >  443 [ACK] Seq=174664 Ack=15250 Win=511 Len=0 SLE=15179 SRE=15250"
"546","63.689895100","100.84.170.161","151.101.2.187","TLSv1.2","1930","Application Data"
"547","63.698980200","151.101.2.187","100.84.170.161","TCP","56","443  >  64433 [ACK] Seq=15250 Ack=176540 Win=1665 Len=0"
"548","63.701277000","151.101.2.187","100.84.170.161","TLSv1.2","98","Application Data"
"549","63.735087300","151.101.2.187","100.84.170.161","TCP","98","[TCP Retransmission] 443  >  64433 [PSH, ACK] Seq=15250 Ack=176540 Win=1665 Len=44"
"550","63.735218900","100.84.170.161","151.101.2.187","TCP","66","64433  >  443 [ACK] Seq=176540 Ack=15294 Win=510 Len=0 SLE=15250 SRE=15294"
