"No.","Time","Source","Destination","Protocol","Length","Info"
"1","0.000000000","172.20.40.110","151.101.2.187","TLSv1.2","175","Application Data"
"2","0.000837600","172.20.40.110","151.101.2.187","TLSv1.2","93","Application Data"
"3","0.007862600","151.101.2.187","172.20.40.110","TCP","60","443  >  54874 [ACK] Seq=1 Ack=122 Win=282 Len=0"
"4","0.007862600","151.101.2.187","172.20.40.110","TCP","60","443  >  54874 [ACK] Seq=1 Ack=161 Win=282 Len=0"
"5","0.007862600","151.101.2.187","172.20.40.110","TLSv1.2","93","Application Data"
"6","0.010183800","151.101.2.187","172.20.40.110","TLSv1.2","252","Application Data"
"7","0.010277000","172.20.40.110","151.101.2.187","TCP","54","54874  >  443 [ACK] Seq=161 Ack=238 Win=257 Len=0"
"8","0.017469900","172.20.40.110","151.101.130.187","TLSv1.2","2622","Application Data"
"9","0.017853600","172.20.40.110","151.101.130.187","TLSv1.2","93","Application Data"
"10","0.029324400","151.101.130.187","172.20.40.110","TCP","60","443  >  62995 [ACK] Seq=1 Ack=2569 Win=3763 Len=0"
"11","0.029324400","151.101.130.187","172.20.40.110","TCP","60","443  >  62995 [ACK] Seq=1 Ack=2608 Win=3763 Len=0"
"12","0.029324400","151.101.130.187","172.20.40.110","TLSv1.2","93","Application Data"
"13","0.079824900","172.20.40.110","151.101.130.187","TCP","54","62995  >  443 [ACK] Seq=2608 Ack=40 Win=507 Len=0"
"14","0.088818400","151.101.130.187","172.20.40.110","TLSv1.2","501","Application Data"
"15","0.088818400","151.101.130.187","172.20.40.110","TCP","1434","443  >  62995 [ACK] Seq=487 Ack=2608 Win=3763 Len=1380 [TCP PDU reassembled in 17]"
"16","0.088818400","151.101.130.187","172.20.40.110","TCP","1434","443  >  62995 [PSH, ACK] Seq=1867 Ack=2608 Win=3763 Len=1380 [TCP PDU reassembled in 17]"
"17","0.088818400","151.101.130.187","172.20.40.110","TLSv1.2","62","Application Data"
"18","0.088818400","151.101.130.187","172.20.40.110","TLSv1.2","85","Application Data"
"19","0.089005800","172.20.40.110","151.101.130.187","TCP","54","62995  >  443 [ACK] Seq=2608 Ack=3286 Win=512 Len=0"
"20","0.090936100","172.20.40.110","151.101.130.187","TLSv1.2","89","Application Data"
"21","0.098683200","151.101.130.187","172.20.40.110","TCP","60","443  >  62995 [ACK] Seq=3286 Ack=2643 Win=3763 Len=0"
"22","0.596116400","172.20.40.110","151.101.130.187","TLSv1.2","2912","Application Data"
"23","0.599857600","172.20.40.110","151.101.130.187","TLSv1.2","2913","Application Data"
"24","0.606716800","172.20.40.110","151.101.130.187","TLSv1.2","2903","Application Data"
"25","0.609276700","151.101.130.187","172.20.40.110","TCP","60","443  >  62995 [ACK] Seq=3286 Ack=5501 Win=3774 Len=0"
"26","0.611846900","151.101.130.187","172.20.40.110","TLSv1.2","223","Application Data"
"27","0.612940100","151.101.130.187","172.20.40.110","TCP","60","443  >  62995 [ACK] Seq=3455 Ack=8360 Win=3785 Len=0"
"28","0.615413500","151.101.130.187","172.20.40.110","TLSv1.2","137","Application Data"
"29","0.615505000","172.20.40.110","151.101.130.187","TCP","54","62995  >  443 [ACK] Seq=11209 Ack=3538 Win=511 Len=0"
"30","0.617771700","151.101.130.187","172.20.40.110","TCP","60","443  >  62995 [ACK] Seq=3538 Ack=11209 Win=3797 Len=0"
"31","0.620174500","151.101.130.187","172.20.40.110","TLSv1.2","129","Application Data"
"32","0.675591900","172.20.40.110","151.101.130.187","TCP","54","62995  >  443 [ACK] Seq=11209 Ack=3613 Win=510 Len=0"
"33","0.841032400","172.20.40.110","151.101.130.187","TLSv1.2","2880","Application Data"
"34","0.842257000","172.20.40.110","151.101.130.187","TLSv1.2","2881","Application Data"
"35","0.903575500","151.101.130.187","172.20.40.110","TCP","60","443  >  62995 [ACK] Seq=3613 Ack=14035 Win=3808 Len=0"
"36","0.903575500","151.101.130.187","172.20.40.110","TCP","60","443  >  62995 [ACK] Seq=3613 Ack=16862 Win=3819 Len=0"
"37","0.903575500","151.101.130.187","172.20.40.110","TLSv1.2","439","Application Data"
"38","0.903575500","151.101.130.187","172.20.40.110","TLSv1.2","130","Application Data"
"39","0.904071200","172.20.40.110","151.101.130.187","TCP","54","62995  >  443 [ACK] Seq=16862 Ack=4074 Win=509 Len=0"
"40","1.026032800","172.20.40.110","151.101.130.187","TLSv1.2","2912","Application Data"
"41","1.059117600","151.101.130.187","172.20.40.110","TCP","60","443  >  62995 [ACK] Seq=4074 Ack=19720 Win=3830 Len=0"
"42","1.059117600","151.101.130.187","172.20.40.110","TLSv1.2","98","Application Data"
"43","1.084647900","172.20.40.110","151.101.130.187","TLSv1.2","2910","Application Data"
"44","1.106821400","151.101.130.187","172.20.40.110","TCP","60","443  >  62995 [ACK] Seq=4118 Ack=22576 Win=3841 Len=0"
"45","1.107551900","151.101.130.187","172.20.40.110","TLSv1.2","125","Application Data"
"46","1.148219300","172.20.40.110","151.101.130.187","TCP","54","62995  >  443 [ACK] Seq=22576 Ack=4189 Win=508 Len=0"
"47","1.148690200","172.20.40.110","151.101.130.187","TLSv1.2","2913","Application Data"
"48","1.159269700","151.101.130.187","172.20.40.110","TCP","60","443  >  62995 [ACK] Seq=4189 Ack=25435 Win=3852 Len=0"
"49","1.162704700","151.101.130.187","172.20.40.110","TLSv1.2","98","Application Data"
"50","1.208601800","172.20.40.110","151.101.130.187","TCP","54","62995  >  443 [ACK] Seq=25435 Ack=4233 Win=508 Len=0"
"51","1.281539000","172.20.40.110","151.101.130.187","TLSv1.2","2912","Application Data"
"52","1.281890400","172.20.40.110","151.101.130.187","TLSv1.2","2911","Application Data"
"53","1.291007900","151.101.130.187","172.20.40.110","TCP","60","443  >  62995 [ACK] Seq=4233 Ack=28293 Win=3864 Len=0"
"54","1.292348700","151.101.130.187","172.20.40.110","TCP","60","443  >  62995 [ACK] Seq=4233 Ack=31150 Win=3875 Len=0"
"55","1.294473400","151.101.130.187","172.20.40.110","TLSv1.2","124","Application Data"
"56","1.295701800","151.101.130.187","172.20.40.110","TLSv1.2","130","Application Data"
"57","1.295767400","172.20.40.110","151.101.130.187","TCP","54","62995  >  443 [ACK] Seq=31150 Ack=4379 Win=507 Len=0"
"58","4.299646000","172.20.40.110","151.101.130.187","TLSv1.2","2907","Application Data"
"59","4.304658300","172.20.40.110","151.101.130.187","TLSv1.2","2903","Application Data"
"60","4.308865900","151.101.130.187","172.20.40.110","TCP","60","443  >  62995 [ACK] Seq=4379 Ack=34003 Win=3886 Len=0"
"61","4.310070400","172.20.40.110","151.101.130.187","TLSv1.2","2903","Application Data"
"62","4.312687000","151.101.130.187","172.20.40.110","TLSv1.2","241","Application Data"
"63","4.314972500","151.101.130.187","172.20.40.110","TCP","60","443  >  62995 [ACK] Seq=4566 Ack=36852 Win=3897 Len=0"
"64","4.317119400","151.101.130.187","172.20.40.110","TLSv1.2","130","Application Data"
"65","4.317230700","172.20.40.110","151.101.130.187","TCP","54","62995  >  443 [ACK] Seq=39701 Ack=4642 Win=506 Len=0"
"66","4.321425900","151.101.130.187","172.20.40.110","TCP","60","443  >  62995 [ACK] Seq=4642 Ack=39701 Win=3908 Len=0"
"67","4.323641700","151.101.130.187","172.20.40.110","TLSv1.2","103","Application Data"
"68","4.334976800","172.20.40.110","151.101.130.187","TLSv1.2","2896","Application Data"
"69","4.335299800","172.20.40.110","151.101.130.187","TLSv1.2","2897","Application Data"
"70","4.344054800","151.101.130.187","172.20.40.110","TCP","60","443  >  62995 [ACK] Seq=4691 Ack=42543 Win=3919 Len=0"
"71","4.347366300","151.101.130.187","172.20.40.110","TLSv1.2","104","Application Data"
"72","4.349427300","151.101.130.187","172.20.40.110","TCP","60","443  >  62995 [ACK] Seq=4741 Ack=45386 Win=3931 Len=0"
"73","4.352744800","151.101.130.187","172.20.40.110","TLSv1.2","104","Application Data"
"74","4.352825100","172.20.40.110","151.101.130.187","TCP","54","62995  >  443 [ACK] Seq=45386 Ack=4791 Win=511 Len=0"
"75","6.789740300","172.20.40.110","151.101.130.187","TLSv1.2","2901","Application Data"
"76","6.803123000","151.101.130.187","172.20.40.110","TCP","60","443  >  62995 [ACK] Seq=4791 Ack=48233 Win=3942 Len=0"
"77","6.804519000","151.101.130.187","172.20.40.110","TLSv1.2","245","Application Data"
"78","6.855775400","172.20.40.110","151.101.130.187","TCP","54","62995  >  443 [ACK] Seq=48233 Ack=4982 Win=510 Len=0"
"79","10.808015700","172.20.40.110","151.101.130.187","TLSv1.2","2912","Application Data"
"80","10.818512200","151.101.130.187","172.20.40.110","TCP","60","443  >  62995 [ACK] Seq=4982 Ack=51091 Win=3953 Len=0"
"81","10.821848800","151.101.130.187","172.20.40.110","TLSv1.2","246","Application Data"
"82","10.874676400","172.20.40.110","151.101.130.187","TCP","54","62995  >  443 [ACK] Seq=51091 Ack=5174 Win=510 Len=0"
"83","14.339017100","172.20.40.110","151.101.130.187","TLSv1.2","2914","Application Data"
"84","14.351123900","151.101.130.187","172.20.40.110","TCP","60","443  >  62995 [ACK] Seq=5174 Ack=53951 Win=3964 Len=0"
"85","14.676001600","151.101.130.187","172.20.40.110","TCP","1434","443  >  62995 [ACK] Seq=5174 Ack=53951 Win=3964 Len=1380 [TCP PDU reassembled in 86]"
"86","14.676001600","151.101.130.187","172.20.40.110","TLSv1.2","796","Application Data"
"87","14.676001600","151.101.130.187","172.20.40.110","TCP","4194","443  >  62995 [PSH, ACK] Seq=7296 Ack=53951 Win=3964 Len=4140 [TCP PDU reassembled in 92]"
"88","14.676148600","172.20.40.110","151.101.130.187","TCP","54","62995  >  443 [ACK] Seq=53951 Ack=11436 Win=512 Len=0"
"89","14.679546100","151.101.130.187","172.20.40.110","TCP","2814","443  >  62995 [PSH, ACK] Seq=11436 Ack=53951 Win=3964 Len=2760 [TCP PDU reassembled in 92]"
"90","14.679677600","172.20.40.110","151.101.130.187","TCP","54","62995  >  443 [ACK] Seq=53951 Ack=14196 Win=512 Len=0"
"91","14.682835900","151.101.130.187","172.20.40.110","TCP","1434","443  >  62995 [PSH, ACK] Seq=14196 Ack=53951 Win=3964 Len=1380 [TCP PDU reassembled in 92]"
"92","14.682835900","151.101.130.187","172.20.40.110","TLSv1.2","8334","Application Data"
"93","14.683018500","172.20.40.110","151.101.130.187","TCP","54","62995  >  443 [ACK] Seq=53951 Ack=23856 Win=512 Len=0"
"94","14.684468300","151.101.130.187","172.20.40.110","TCP","5574","443  >  62995 [PSH, ACK] Seq=23856 Ack=53951 Win=3964 Len=5520 [TCP PDU reassembled in 102]"
"95","14.684575500","172.20.40.110","151.101.130.187","TCP","54","62995  >  443 [ACK] Seq=53951 Ack=29376 Win=512 Len=0"
"96","14.685140500","172.20.40.110","151.101.130.187","TLSv1.2","89","Application Data"
"97","14.697473500","151.101.130.187","172.20.40.110","TCP","1434","443  >  62995 [ACK] Seq=29376 Ack=53951 Win=3964 Len=1380 [TCP PDU reassembled in 102]"
"98","14.697473500","151.101.130.187","172.20.40.110","TCP","1434","443  >  62995 [PSH, ACK] Seq=30756 Ack=53951 Win=3964 Len=1380 [TCP PDU reassembled in 102]"
"99","14.697473500","151.101.130.187","172.20.40.110","TCP","1434","443  >  62995 [ACK] Seq=32136 Ack=53951 Win=3964 Len=1380 [TCP PDU reassembled in 102]"
"100","14.697473500","151.101.130.187","172.20.40.110","TCP","1434","443  >  62995 [PSH, ACK] Seq=33516 Ack=53951 Win=3964 Len=1380 [TCP PDU reassembled in 102]"
"101","14.697600700","172.20.40.110","151.101.130.187","TCP","54","62995  >  443 [ACK] Seq=53986 Ack=34896 Win=512 Len=0"
"102","14.701870800","151.101.130.187","172.20.40.110","TLSv1.2","1434","Application Data"
"103","14.701870800","151.101.130.187","172.20.40.110","TCP","1434","443  >  62995 [PSH, ACK] Seq=36276 Ack=53951 Win=3964 Len=1380 [TCP PDU reassembled in 107]"
"104","14.701870800","151.101.130.187","172.20.40.110","TCP","1434","443  >  62995 [ACK] Seq=37656 Ack=53951 Win=3964 Len=1380 [TCP PDU reassembled in 107]"
"105","14.701997800","172.20.40.110","151.101.130.187","TCP","54","62995  >  443 [ACK] Seq=53986 Ack=39036 Win=512 Len=0"
"106","14.704331200","151.101.130.187","172.20.40.110","TCP","1434","443  >  62995 [PSH, ACK] Seq=39036 Ack=53951 Win=3964 Len=1380 [TCP PDU reassembled in 107]"
"107","14.704331200","151.101.130.187","172.20.40.110","TLSv1.2","5574","Application Data, Application Data"
"108","14.704455300","172.20.40.110","151.101.130.187","TCP","54","62995  >  443 [ACK] Seq=53986 Ack=45936 Win=512 Len=0"
"109","14.707300800","151.101.130.187","172.20.40.110","TLSv1.2","5574","Application Data, Application Data, Application Data, Application Data, Application Data, Application Data"
"110","14.707419600","172.20.40.110","151.101.130.187","TCP","54","62995  >  443 [ACK] Seq=53986 Ack=51456 Win=512 Len=0"
"111","14.713116700","151.101.130.187","172.20.40.110","TCP","1434","443  >  62995 [ACK] Seq=51456 Ack=53951 Win=3964 Len=1380 [TCP PDU reassembled in 112]"
"112","14.713116700","151.101.130.187","172.20.40.110","TLSv1.2","1434","Application Data"
"113","14.713116700","151.101.130.187","172.20.40.110","TLSv1.2","1042","Application Data"
"114","14.713116700","151.101.130.187","172.20.40.110","TCP","1042","[TCP Retransmission] 443  >  62995 [PSH, ACK] Seq=54216 Ack=53951 Win=3964 Len=988 [TCP PDU reassembled in 113]"
"115","14.713116700","151.101.130.187","172.20.40.110","TCP","60","443  >  62995 [ACK] Seq=55204 Ack=53986 Win=3964 Len=0"
"116","14.713291000","172.20.40.110","151.101.130.187","TCP","66","62995  >  443 [ACK] Seq=53986 Ack=55204 Win=512 Len=0 SLE=54216 SRE=55204"
"117","14.752804900","151.101.130.187","172.20.40.110","TLSv1.2","906","Application Data"
"118","14.752917000","172.20.40.110","151.101.130.187","TCP","54","62995  >  443 [ACK] Seq=53986 Ack=56056 Win=508 Len=0"
"119","14.755628700","151.101.130.187","172.20.40.110","TLSv1.2","1429","Application Data"
"120","14.763925400","151.101.130.187","172.20.40.110","TCP","1434","443  >  62995 [ACK] Seq=57431 Ack=53986 Win=3964 Len=1380 [TCP PDU reassembled in 121]"
"121","14.763925400","151.101.130.187","172.20.40.110","TLSv1.2","663","Application Data"
"122","14.763925400","151.101.130.187","172.20.40.110","TCP","1434","443  >  62995 [ACK] Seq=59420 Ack=53986 Win=3964 Len=1380 [TCP PDU reassembled in 123]"
"123","14.763925400","151.101.130.187","172.20.40.110","TLSv1.2","851","Application Data"
"124","14.763925400","151.101.130.187","172.20.40.110","TCP","1434","443  >  62995 [ACK] Seq=61597 Ack=53986 Win=3964 Len=1380 [TCP PDU reassembled in 126]"
"125","14.764049700","172.20.40.110","151.101.130.187","TCP","54","62995  >  443 [ACK] Seq=53986 Ack=62977 Win=512 Len=0"
"126","14.766582100","151.101.130.187","172.20.40.110","TLSv1.2","887","Application Data"
"127","14.796709800","151.101.130.187","172.20.40.110","TLSv1.2","248","Application Data"
"128","14.796709800","151.101.130.187","172.20.40.110","TCP","2814","443  >  62995 [PSH, ACK] Seq=64004 Ack=53986 Win=3964 Len=2760 [TCP PDU reassembled in 130]"
"129","14.796850900","172.20.40.110","151.101.130.187","TCP","54","62995  >  443 [ACK] Seq=53986 Ack=66764 Win=512 Len=0"
"130","14.798252800","151.101.130.187","172.20.40.110","TLSv1.2","1219","Application Data"
"131","14.841237400","151.101.130.187","172.20.40.110","TCP","2814","443  >  62995 [PSH, ACK] Seq=67929 Ack=53986 Win=3964 Len=2760 [TCP PDU reassembled in 137]"
"132","14.841326500","172.20.40.110","151.101.130.187","TCP","54","62995  >  443 [ACK] Seq=53986 Ack=70689 Win=512 Len=0"
"133","14.842486700","151.101.130.187","172.20.40.110","TCP","1434","443  >  62995 [ACK] Seq=70689 Ack=53986 Win=3964 Len=1380 [TCP PDU reassembled in 137]"
"134","14.842570800","172.20.40.110","151.101.130.187","TCP","54","62995  >  443 [ACK] Seq=53986 Ack=72069 Win=512 Len=0"
"135","14.844248100","151.101.130.187","172.20.40.110","TCP","1434","443  >  62995 [PSH, ACK] Seq=72069 Ack=53986 Win=3964 Len=1380 [TCP PDU reassembled in 137]"
"136","14.844248100","151.101.130.187","172.20.40.110","TCP","1434","443  >  62995 [ACK] Seq=73449 Ack=53986 Win=3964 Len=1380 [TCP PDU reassembled in 137]"
"137","14.844248100","151.101.130.187","172.20.40.110","TLSv1.2","702","Application Data"
"138","14.844364200","172.20.40.110","151.101.130.187","TCP","54","62995  >  443 [ACK] Seq=53986 Ack=75477 Win=512 Len=0"
"139","14.880715300","151.101.130.187","172.20.40.110","TCP","1434","443  >  62995 [ACK] Seq=75477 Ack=53986 Win=3964 Len=1380 [TCP PDU reassembled in 140]"
"140","14.880715300","151.101.130.187","172.20.40.110","TLSv1.2","659","Application Data"
"141","14.880802900","172.20.40.110","151.101.130.187","TCP","54","62995  >  443 [ACK] Seq=53986 Ack=77462 Win=512 Len=0"
"142","14.888295200","151.101.130.187","172.20.40.110","TLSv1.2","93","Application Data"
"143","14.888295200","151.101.130.187","172.20.40.110","TCP","1434","443  >  62995 [ACK] Seq=77501 Ack=53986 Win=3964 Len=1380 [TCP PDU reassembled in 144]"
"144","14.888295200","151.101.130.187","172.20.40.110","TLSv1.2","505","Application Data"
"145","14.888295200","151.101.130.187","172.20.40.110","TLSv1.2","487","Application Data"
"146","14.888392300","172.20.40.110","151.101.130.187","TCP","54","62995  >  443 [ACK] Seq=53986 Ack=79765 Win=512 Len=0"
"147","14.889536000","151.101.130.187","172.20.40.110","TLSv1.2","95","Application Data"
"148","14.889605600","172.20.40.110","151.101.130.187","TCP","54","62995  >  443 [ACK] Seq=53986 Ack=79806 Win=511 Len=0"
"149","14.940612600","172.20.40.110","151.101.130.187","TLSv1.2","2846","Application Data"
"150","14.940848400","172.20.40.110","151.101.130.187","TLSv1.2","2848","Application Data"
"151","14.944004000","172.20.40.110","151.101.130.187","TLSv1.2","2846","Application Data"
"152","14.944289200","172.20.40.110","151.101.130.187","TLSv1.2","2844","Application Data"
"153","14.944802400","172.20.40.110","151.101.130.187","TLSv1.2","2846","Application Data"
"154","14.950177800","172.20.40.110","151.101.130.187","TLSv1.2","2852","Application Data"
"155","14.958481700","151.101.130.187","172.20.40.110","TCP","60","443  >  62995 [ACK] Seq=79806 Ack=56778 Win=3975 Len=0"
"156","14.958481700","151.101.130.187","172.20.40.110","TCP","60","443  >  62995 [ACK] Seq=79806 Ack=59572 Win=3986 Len=0"
"157","14.958481700","151.101.130.187","172.20.40.110","TLSv1.2","311","Application Data"
"158","14.958481700","151.101.130.187","172.20.40.110","TLSv1.2","138","Application Data"
"159","14.958656300","172.20.40.110","151.101.130.187","TCP","54","62995  >  443 [ACK] Seq=70744 Ack=80147 Win=510 Len=0"
"160","14.959929200","151.101.130.187","172.20.40.110","TCP","60","443  >  62995 [ACK] Seq=80147 Ack=62364 Win=3997 Len=0"
"161","14.959929200","151.101.130.187","172.20.40.110","TCP","60","443  >  62995 [ACK] Seq=80147 Ack=65154 Win=4008 Len=0"
"162","14.959929200","151.101.130.187","172.20.40.110","TCP","60","443  >  62995 [ACK] Seq=80147 Ack=67946 Win=4019 Len=0"
"163","14.961124000","151.101.130.187","172.20.40.110","TCP","60","443  >  62995 [ACK] Seq=80147 Ack=70744 Win=4030 Len=0"
"164","14.961124000","151.101.130.187","172.20.40.110","TLSv1.2","206","Application Data, Application Data"
"165","14.961124000","151.101.130.187","172.20.40.110","TLSv1.2","124","Application Data"
"166","14.961229900","172.20.40.110","151.101.130.187","TCP","54","62995  >  443 [ACK] Seq=70744 Ack=80369 Win=509 Len=0"
"167","14.962492800","151.101.130.187","172.20.40.110","TLSv1.2","131","Application Data"
"168","14.962638100","172.20.40.110","151.101.130.187","TCP","54","62995  >  443 [ACK] Seq=70744 Ack=80446 Win=509 Len=0"
"169","15.060160800","172.20.40.110","151.101.130.187","TLSv1.2","2848","Application Data"
"170","15.060397000","172.20.40.110","151.101.130.187","TLSv1.2","2854","Application Data"
"171","15.060574600","172.20.40.110","151.101.130.187","TLSv1.2","2855","Application Data"
"172","15.063983300","172.20.40.110","151.101.130.187","TLSv1.2","2854","Application Data"
"173","15.064315600","172.20.40.110","151.101.130.187","TLSv1.2","2854","Application Data"
"174","15.067749400","172.20.40.110","151.101.130.187","TLSv1.2","2848","Application Data"
"175","15.068089400","172.20.40.110","151.101.130.187","TLSv1.2","2848","Application Data"
"176","15.068415600","172.20.40.110","151.101.130.187","TLSv1.2","2848","Application Data"
"177","15.071865300","151.101.130.187","172.20.40.110","TCP","60","443  >  62995 [ACK] Seq=80446 Ack=73538 Win=4040 Len=0"
"178","15.072887900","172.20.40.110","151.101.130.187","TLSv1.2","2851","Application Data"
"179","15.084665800","151.101.130.187","172.20.40.110","TLSv1.2","130","Application Data"
"180","15.084665800","151.101.130.187","172.20.40.110","TCP","60","443  >  62995 [ACK] Seq=80522 Ack=76338 Win=4051 Len=0"
"181","15.084665800","151.101.130.187","172.20.40.110","TLSv1.2","130","Application Data"
"182","15.084665800","151.101.130.187","172.20.40.110","TCP","60","443  >  62995 [ACK] Seq=80598 Ack=79139 Win=4062 Len=0"
"183","15.084665800","151.101.130.187","172.20.40.110","TCP","60","443  >  62995 [ACK] Seq=80598 Ack=81939 Win=4073 Len=0"
"184","15.084665800","151.101.130.187","172.20.40.110","TCP","60","443  >  62995 [ACK] Seq=80598 Ack=84739 Win=4084 Len=0"
"185","15.085077100","172.20.40.110","151.101.130.187","TCP","54","62995  >  443 [ACK] Seq=95918 Ack=80598 Win=508 Len=0"
"186","15.087928200","151.101.130.187","172.20.40.110","TLSv1.2","235","Application Data"
"187","15.087928200","151.101.130.187","172.20.40.110","TLSv1.2","131","Application Data"
"188","15.088005700","172.20.40.110","151.101.130.187","TCP","54","62995  >  443 [ACK] Seq=95918 Ack=80856 Win=507 Len=0"
"189","15.096177200","151.101.130.187","172.20.40.110","TCP","60","443  >  62995 [ACK] Seq=80856 Ack=87533 Win=4095 Len=0"
"190","15.096177200","151.101.130.187","172.20.40.110","TCP","60","443  >  62995 [ACK] Seq=80856 Ack=90327 Win=4106 Len=0"
"191","15.096177200","151.101.130.187","172.20.40.110","TCP","60","443  >  62995 [ACK] Seq=80856 Ack=93121 Win=4117 Len=0"
"192","15.096177200","151.101.130.187","172.20.40.110","TCP","60","443  >  62995 [ACK] Seq=80856 Ack=95918 Win=4128 Len=0"
"193","15.097479000","151.101.130.187","172.20.40.110","TLSv1.2","209","Application Data"
"194","15.097479000","151.101.130.187","172.20.40.110","TLSv1.2","130","Application Data"
"195","15.097479000","151.101.130.187","172.20.40.110","TLSv1.2","311","Application Data"
"196","15.097479000","151.101.130.187","172.20.40.110","TLSv1.2","136","Application Data"
"197","15.097585400","172.20.40.110","151.101.130.187","TCP","54","62995  >  443 [ACK] Seq=95918 Ack=81426 Win=512 Len=0"
"198","15.121662400","172.20.40.110","151.101.130.187","TLSv1.2","2847","Application Data"
"199","15.131971500","151.101.130.187","172.20.40.110","TCP","60","443  >  62995 [ACK] Seq=81426 Ack=98711 Win=4139 Len=0"
"200","15.134359500","172.20.40.110","151.101.130.187","TLSv1.2","2845","Application Data"
"201","15.136304800","151.101.130.187","172.20.40.110","TLSv1.2","131","Application Data"
"202","15.145967500","151.101.130.187","172.20.40.110","TCP","60","443  >  62995 [ACK] Seq=81503 Ack=101502 Win=4150 Len=0"
"203","15.148027400","151.101.130.187","172.20.40.110","TLSv1.2","130","Application Data"
"204","15.148105900","172.20.40.110","151.101.130.187","TCP","54","62995  >  443 [ACK] Seq=101502 Ack=81579 Win=511 Len=0"
"205","15.254727400","172.20.40.110","151.101.130.187","TLSv1.2","2862","Application Data"
"206","15.255355500","172.20.40.110","151.101.130.187","TLSv1.2","2846","Application Data"
"207","15.255904500","172.20.40.110","151.101.130.187","TLSv1.2","2847","Application Data"
"208","15.268679200","172.20.40.110","151.101.130.187","TLSv1.2","2863","Application Data"
"209","15.273032600","151.101.130.187","172.20.40.110","TCP","60","443  >  62995 [ACK] Seq=81579 Ack=104310 Win=4161 Len=0"
"210","15.273032600","151.101.130.187","172.20.40.110","TCP","60","443  >  62995 [ACK] Seq=81579 Ack=107102 Win=4172 Len=0"
"211","15.273032600","151.101.130.187","172.20.40.110","TCP","60","443  >  62995 [ACK] Seq=81579 Ack=109895 Win=4183 Len=0"
"212","15.276012200","151.101.130.187","172.20.40.110","TLSv1.2","131","Application Data"
"213","15.277082400","151.101.130.187","172.20.40.110","TLSv1.2","130","Application Data"
"214","15.277082400","151.101.130.187","172.20.40.110","TLSv1.2","131","Application Data"
"215","15.277163000","172.20.40.110","151.101.130.187","TCP","54","62995  >  443 [ACK] Seq=112704 Ack=81809 Win=510 Len=0"
"216","15.278464600","151.101.130.187","172.20.40.110","TCP","60","443  >  62995 [ACK] Seq=81809 Ack=112704 Win=4194 Len=0"
"217","15.279784500","151.101.130.187","172.20.40.110","TLSv1.2","125","Application Data"
"218","15.280006400","172.20.40.110","151.101.130.187","TCP","54","62995  >  443 [ACK] Seq=112704 Ack=81880 Win=510 Len=0"
"219","16.813084800","172.20.40.110","151.101.130.187","TLSv1.2","3131","Application Data"
"220","16.815112400","172.20.40.110","151.101.130.187","TLSv1.2","3093","Application Data"
"221","16.815352200","172.20.40.110","151.101.130.187","TLSv1.2","3113","Application Data"
"222","16.815587700","172.20.40.110","151.101.130.187","TLSv1.2","3111","Application Data"
"223","16.825192500","151.101.130.187","172.20.40.110","TCP","60","443  >  62995 [ACK] Seq=81880 Ack=115781 Win=4206 Len=0"
"224","16.837684500","151.101.130.187","172.20.40.110","TCP","60","443  >  62995 [ACK] Seq=81880 Ack=118820 Win=4218 Len=0"
"225","16.837684500","151.101.130.187","172.20.40.110","TCP","60","443  >  62995 [ACK] Seq=81880 Ack=121879 Win=4230 Len=0"
"226","16.837684500","151.101.130.187","172.20.40.110","TCP","60","443  >  62995 [ACK] Seq=81880 Ack=124936 Win=4242 Len=0"
"227","16.954062800","151.101.130.187","172.20.40.110","TLSv1.2","558","Application Data"
"228","16.954062800","151.101.130.187","172.20.40.110","TCP","5574","443  >  62995 [ACK] Seq=82384 Ack=124936 Win=4242 Len=5520 [TCP PDU reassembled in 235]"
"229","16.954148400","172.20.40.110","151.101.130.187","TCP","54","62995  >  443 [ACK] Seq=124936 Ack=87904 Win=512 Len=0"
"230","16.956157600","151.101.130.187","172.20.40.110","TCP","2814","443  >  62995 [PSH, ACK] Seq=87904 Ack=124936 Win=4242 Len=2760 [TCP PDU reassembled in 235]"
"231","16.956240800","172.20.40.110","151.101.130.187","TCP","54","62995  >  443 [ACK] Seq=124936 Ack=90664 Win=512 Len=0"
"232","16.958832500","151.101.130.187","172.20.40.110","TCP","1434","443  >  62995 [ACK] Seq=90664 Ack=124936 Win=4242 Len=1380 [TCP PDU reassembled in 235]"
"233","16.958832500","151.101.130.187","172.20.40.110","TCP","5574","443  >  62995 [PSH, ACK] Seq=92044 Ack=124936 Win=4242 Len=5520 [TCP PDU reassembled in 235]"
"234","16.958936600","172.20.40.110","151.101.130.187","TCP","54","62995  >  443 [ACK] Seq=124936 Ack=97564 Win=512 Len=0"
"235","16.964960200","151.101.130.187","172.20.40.110","TLSv1.2","1434","Application Data"
"236","16.964960200","151.101.130.187","172.20.40.110","TCP","1434","443  >  62995 [ACK] Seq=98944 Ack=124936 Win=4242 Len=1380 [TCP PDU reassembled in 241]"
"237","16.964960200","151.101.130.187","172.20.40.110","TCP","1434","443  >  62995 [ACK] Seq=100324 Ack=124936 Win=4242 Len=1380 [TCP PDU reassembled in 241]"
"238","16.964960200","151.101.130.187","172.20.40.110","TCP","2814","443  >  62995 [PSH, ACK] Seq=101704 Ack=124936 Win=4242 Len=2760 [TCP PDU reassembled in 241]"
"239","16.965045900","172.20.40.110","151.101.130.187","TCP","54","62995  >  443 [ACK] Seq=124936 Ack=104464 Win=512 Len=0"
"240","16.966528600","151.101.130.187","172.20.40.110","TCP","1434","443  >  62995 [ACK] Seq=104464 Ack=124936 Win=4242 Len=1380 [TCP PDU reassembled in 241]"
"241","16.966528600","151.101.130.187","172.20.40.110","TLSv1.2","983","Application Data"
"242","16.966618100","172.20.40.110","151.101.130.187","TCP","54","62995  >  443 [ACK] Seq=124936 Ack=106773 Win=512 Len=0"
"243","16.972227400","151.101.130.187","172.20.40.110","TCP","1434","443  >  62995 [ACK] Seq=106773 Ack=124936 Win=4242 Len=1380 [TCP PDU reassembled in 248]"
"244","16.972296300","172.20.40.110","151.101.130.187","TCP","54","62995  >  443 [ACK] Seq=124936 Ack=108153 Win=512 Len=0"
"245","16.975344200","151.101.130.187","172.20.40.110","TCP","1434","443  >  62995 [ACK] Seq=108153 Ack=124936 Win=4242 Len=1380 [TCP PDU reassembled in 248]"
"246","16.975344200","151.101.130.187","172.20.40.110","TCP","1434","443  >  62995 [ACK] Seq=109533 Ack=124936 Win=4242 Len=1380 [TCP PDU reassembled in 248]"
"247","16.975344200","151.101.130.187","172.20.40.110","TCP","1434","443  >  62995 [ACK] Seq=110913 Ack=124936 Win=4242 Len=1380 [TCP PDU reassembled in 248]"
"248","16.975344200","151.101.130.187","172.20.40.110","TLSv1.2","1172","Application Data"
"249","16.975344200","151.101.130.187","172.20.40.110","TCP","1434","443  >  62995 [ACK] Seq=113411 Ack=124936 Win=4242 Len=1380 [TCP PDU reassembled in 255]"
"250","16.975430900","172.20.40.110","151.101.130.187","TCP","54","62995  >  443 [ACK] Seq=124936 Ack=114791 Win=512 Len=0"
"251","16.977593700","151.101.130.187","172.20.40.110","TCP","5574","443  >  62995 [ACK] Seq=114791 Ack=124936 Win=4242 Len=5520 [TCP PDU reassembled in 255]"
"252","16.977678900","172.20.40.110","151.101.130.187","TCP","54","62995  >  443 [ACK] Seq=124936 Ack=120311 Win=512 Len=0"
"253","16.980838000","151.101.130.187","172.20.40.110","TCP","5574","443  >  62995 [PSH, ACK] Seq=120311 Ack=124936 Win=4242 Len=5520 [TCP PDU reassembled in 255]"
"254","16.980990800","172.20.40.110","151.101.130.187","TCP","54","62995  >  443 [ACK] Seq=124936 Ack=125831 Win=512 Len=0"
"255","16.983101100","151.101.130.187","172.20.40.110","TLSv1.2","5574","Application Data"
"256","16.983215300","172.20.40.110","151.101.130.187","TCP","54","62995  >  443 [ACK] Seq=124936 Ack=131351 Win=512 Len=0"
"257","16.985499500","151.101.130.187","172.20.40.110","TCP","1434","443  >  62995 [ACK] Seq=131351 Ack=124936 Win=4242 Len=1380 [TCP PDU reassembled in 258]"
"258","16.985499500","151.101.130.187","172.20.40.110","TLSv1.2","261","Application Data"
"259","16.985613200","172.20.40.110","151.101.130.187","TCP","54","62995  >  443 [ACK] Seq=124936 Ack=132938 Win=512 Len=0"
"260","17.298097200","151.101.130.187","172.20.40.110","TLSv1.2","134","Application Data"
"261","17.298097200","151.101.130.187","172.20.40.110","TCP","5574","443  >  62995 [ACK] Seq=133018 Ack=124936 Win=4242 Len=5520 [TCP PDU reassembled in 270]"
"262","17.298183300","172.20.40.110","151.101.130.187","TCP","54","62995  >  443 [ACK] Seq=124936 Ack=138538 Win=512 Len=0"
"263","17.300584000","151.101.130.187","172.20.40.110","TCP","1434","443  >  62995 [ACK] Seq=138538 Ack=124936 Win=4242 Len=1380 [TCP PDU reassembled in 270]"
"264","17.300656200","172.20.40.110","151.101.130.187","TCP","54","62995  >  443 [ACK] Seq=124936 Ack=139918 Win=512 Len=0"
"265","17.307979000","151.101.130.187","172.20.40.110","TCP","1434","443  >  62995 [PSH, ACK] Seq=139918 Ack=124936 Win=4242 Len=1380 [TCP PDU reassembled in 270]"
"266","17.307979000","151.101.130.187","172.20.40.110","TCP","2814","443  >  62995 [ACK] Seq=141298 Ack=124936 Win=4242 Len=2760 [TCP PDU reassembled in 270]"
"267","17.307979000","151.101.130.187","172.20.40.110","TCP","1434","443  >  62995 [ACK] Seq=144058 Ack=124936 Win=4242 Len=1380 [TCP PDU reassembled in 270]"
"268","17.307979000","151.101.130.187","172.20.40.110","TCP","1434","443  >  62995 [ACK] Seq=145438 Ack=124936 Win=4242 Len=1380 [TCP PDU reassembled in 270]"
"269","17.307979000","151.101.130.187","172.20.40.110","TCP","1434","443  >  62995 [ACK] Seq=146818 Ack=124936 Win=4242 Len=1380 [TCP PDU reassembled in 270]"
"270","17.307979000","151.101.130.187","172.20.40.110","TLSv1.2","2814","Application Data"
"271","17.308069100","172.20.40.110","151.101.130.187","TCP","54","62995  >  443 [ACK] Seq=124936 Ack=150958 Win=512 Len=0"
"272","17.310622500","151.101.130.187","172.20.40.110","TCP","1434","443  >  62995 [ACK] Seq=150958 Ack=124936 Win=4242 Len=1380 [TCP PDU reassembled in 280]"
"273","17.313146400","151.101.130.187","172.20.40.110","TCP","1434","443  >  62995 [ACK] Seq=152338 Ack=124936 Win=4242 Len=1380 [TCP PDU reassembled in 280]"
"274","17.313146400","151.101.130.187","172.20.40.110","TCP","4194","443  >  62995 [PSH, ACK] Seq=153718 Ack=124936 Win=4242 Len=4140 [TCP PDU reassembled in 280]"
"275","17.313238300","172.20.40.110","151.101.130.187","TCP","54","62995  >  443 [ACK] Seq=124936 Ack=157858 Win=512 Len=0"
"276","17.315258300","151.101.130.187","172.20.40.110","TCP","1434","443  >  62995 [ACK] Seq=157858 Ack=124936 Win=4242 Len=1380 [TCP PDU reassembled in 280]"
"277","17.315258300","151.101.130.187","172.20.40.110","TCP","1434","443  >  62995 [ACK] Seq=159238 Ack=124936 Win=4242 Len=1380 [TCP PDU reassembled in 280]"
"278","17.315258300","151.101.130.187","172.20.40.110","TCP","2814","443  >  62995 [ACK] Seq=160618 Ack=124936 Win=4242 Len=2760 [TCP PDU reassembled in 280]"
"279","17.315337900","172.20.40.110","151.101.130.187","TCP","54","62995  >  443 [ACK] Seq=124936 Ack=163378 Win=512 Len=0"
"280","17.318135900","151.101.130.187","172.20.40.110","TLSv1.2","5574","Application Data"
"281","17.318225600","172.20.40.110","151.101.130.187","TCP","54","62995  >  443 [ACK] Seq=124936 Ack=168898 Win=512 Len=0"
"282","17.322805500","151.101.130.187","172.20.40.110","TCP","1434","443  >  62995 [ACK] Seq=168898 Ack=124936 Win=4242 Len=1380 [TCP PDU reassembled in 285]"
"283","17.322805500","151.101.130.187","172.20.40.110","TCP","1434","443  >  62995 [ACK] Seq=170278 Ack=124936 Win=4242 Len=1380 [TCP PDU reassembled in 285]"
"284","17.322805500","151.101.130.187","172.20.40.110","TCP","1434","443  >  62995 [ACK] Seq=171658 Ack=124936 Win=4242 Len=1380 [TCP PDU reassembled in 285]"
"285","17.322805500","151.101.130.187","172.20.40.110","TLSv1.2","2814","Application Data"
"286","17.322883500","172.20.40.110","151.101.130.187","TCP","54","62995  >  443 [ACK] Seq=124936 Ack=175798 Win=512 Len=0"
"287","17.330944000","151.101.130.187","172.20.40.110","TCP","1434","443  >  62995 [ACK] Seq=175798 Ack=124936 Win=4242 Len=1380 [TCP PDU reassembled in 298]"
"288","17.330944000","151.101.130.187","172.20.40.110","TCP","1434","443  >  62995 [ACK] Seq=177178 Ack=124936 Win=4242 Len=1380 [TCP PDU reassembled in 298]"
"289","17.330944000","151.101.130.187","172.20.40.110","TCP","1434","443  >  62995 [ACK] Seq=178558 Ack=124936 Win=4242 Len=1380 [TCP PDU reassembled in 298]"
"290","17.330944000","151.101.130.187","172.20.40.110","TCP","1434","443  >  62995 [ACK] Seq=179938 Ack=124936 Win=4242 Len=1380 [TCP PDU reassembled in 298]"
"291","17.330944000","151.101.130.187","172.20.40.110","TCP","1434","443  >  62995 [PSH, ACK] Seq=181318 Ack=124936 Win=4242 Len=1380 [TCP PDU reassembled in 298]"
"292","17.331068400","172.20.40.110","151.101.130.187","TCP","54","62995  >  443 [ACK] Seq=124936 Ack=182698 Win=512 Len=0"
"293","17.336538600","151.101.130.187","172.20.40.110","TCP","1434","443  >  62995 [ACK] Seq=182698 Ack=124936 Win=4242 Len=1380 [TCP PDU reassembled in 298]"
"294","17.336538600","151.101.130.187","172.20.40.110","TCP","1434","443  >  62995 [ACK] Seq=184078 Ack=124936 Win=4242 Len=1380 [TCP PDU reassembled in 298]"
"295","17.336625500","172.20.40.110","151.101.130.187","TCP","54","62995  >  443 [ACK] Seq=124936 Ack=185458 Win=512 Len=0"
"296","17.342261100","151.101.130.187","172.20.40.110","TCP","1434","443  >  62995 [ACK] Seq=185458 Ack=124936 Win=4242 Len=1380 [TCP PDU reassembled in 298]"
"297","17.342261100","151.101.130.187","172.20.40.110","TCP","1434","443  >  62995 [ACK] Seq=186838 Ack=124936 Win=4242 Len=1380 [TCP PDU reassembled in 298]"
"298","17.342261100","151.101.130.187","172.20.40.110","TLSv1.2","1434","Application Data"
"299","17.342261100","151.101.130.187","172.20.40.110","TLSv1.2","1434","Application Data"
"300","17.342261100","151.101.130.187","172.20.40.110","TCP","2814","443  >  62995 [ACK] Seq=190978 Ack=124936 Win=4242 Len=2760 [TCP PDU reassembled in 303]"
"301","17.342374200","172.20.40.110","151.101.130.187","TCP","54","62995  >  443 [ACK] Seq=124936 Ack=193738 Win=512 Len=0"
"302","17.343249500","151.101.130.187","172.20.40.110","TCP","1434","443  >  62995 [ACK] Seq=193738 Ack=124936 Win=4242 Len=1380 [TCP PDU reassembled in 303]"
"303","17.343249500","151.101.130.187","172.20.40.110","TLSv1.2","185","Application Data, Application Data"
"304","17.343314100","172.20.40.110","151.101.130.187","TCP","54","62995  >  443 [ACK] Seq=124936 Ack=195249 Win=512 Len=0"
"305","17.359100800","151.101.130.187","172.20.40.110","TCP","4194","443  >  62995 [PSH, ACK] Seq=195249 Ack=124936 Win=4242 Len=4140 [TCP PDU reassembled in 314]"
"306","17.359194700","172.20.40.110","151.101.130.187","TCP","54","62995  >  443 [ACK] Seq=124936 Ack=199389 Win=512 Len=0"
"307","17.362776000","151.101.130.187","172.20.40.110","TCP","4194","443  >  62995 [PSH, ACK] Seq=199389 Ack=124936 Win=4242 Len=4140 [TCP PDU reassembled in 314]"
"308","17.362873200","172.20.40.110","151.101.130.187","TCP","54","62995  >  443 [ACK] Seq=124936 Ack=203529 Win=512 Len=0"
"309","17.365118000","151.101.130.187","172.20.40.110","TCP","1434","443  >  62995 [ACK] Seq=203529 Ack=124936 Win=4242 Len=1380 [TCP PDU reassembled in 314]"
"310","17.365189700","172.20.40.110","151.101.130.187","TCP","54","62995  >  443 [ACK] Seq=124936 Ack=204909 Win=512 Len=0"
"311","17.368375600","151.101.130.187","172.20.40.110","TCP","1434","443  >  62995 [ACK] Seq=204909 Ack=124936 Win=4242 Len=1380 [TCP PDU reassembled in 314]"
"312","17.368375600","151.101.130.187","172.20.40.110","TCP","1434","443  >  62995 [PSH, ACK] Seq=206289 Ack=124936 Win=4242 Len=1380 [TCP PDU reassembled in 314]"
"313","17.368375600","151.101.130.187","172.20.40.110","TCP","1434","443  >  62995 [ACK] Seq=207669 Ack=124936 Win=4242 Len=1380 [TCP PDU reassembled in 314]"
"314","17.368375600","151.101.130.187","172.20.40.110","TLSv1.2","2814","Application Data"
"315","17.368458100","172.20.40.110","151.101.130.187","TCP","54","62995  >  443 [ACK] Seq=124936 Ack=211809 Win=512 Len=0"
"316","17.371042200","151.101.130.187","172.20.40.110","TCP","4194","443  >  62995 [PSH, ACK] Seq=211809 Ack=124936 Win=4242 Len=4140 [TCP PDU reassembled in 325]"
"317","17.371121600","172.20.40.110","151.101.130.187","TCP","54","62995  >  443 [ACK] Seq=124936 Ack=215949 Win=512 Len=0"
"318","17.374571200","151.101.130.187","172.20.40.110","TCP","1434","443  >  62995 [ACK] Seq=215949 Ack=124936 Win=4242 Len=1380 [TCP PDU reassembled in 325]"
"319","17.374571200","151.101.130.187","172.20.40.110","TCP","4194","443  >  62995 [PSH, ACK] Seq=217329 Ack=124936 Win=4242 Len=4140 [TCP PDU reassembled in 325]"
"320","17.374660400","172.20.40.110","151.101.130.187","TCP","54","62995  >  443 [ACK] Seq=124936 Ack=221469 Win=512 Len=0"
"321","17.377772000","151.101.130.187","172.20.40.110","TCP","2814","443  >  62995 [PSH, ACK] Seq=221469 Ack=124936 Win=4242 Len=2760 [TCP PDU reassembled in 325]"
"322","17.377842800","172.20.40.110","151.101.130.187","TCP","54","62995  >  443 [ACK] Seq=124936 Ack=224229 Win=512 Len=0"
"323","17.381168300","151.101.130.187","172.20.40.110","TCP","1434","443  >  62995 [ACK] Seq=224229 Ack=124936 Win=4242 Len=1380 [TCP PDU reassembled in 325]"
"324","17.381168300","151.101.130.187","172.20.40.110","TCP","1434","443  >  62995 [ACK] Seq=225609 Ack=124936 Win=4242 Len=1380 [TCP PDU reassembled in 325]"
"325","17.381168300","151.101.130.187","172.20.40.110","TLSv1.2","2814","Application Data"
"326","17.381241600","172.20.40.110","151.101.130.187","TCP","54","62995  >  443 [ACK] Seq=124936 Ack=229749 Win=512 Len=0"
"327","17.384162300","151.101.130.187","172.20.40.110","TCP","5574","443  >  62995 [PSH, ACK] Seq=229749 Ack=124936 Win=4242 Len=5520 [TCP PDU reassembled in 335]"
"328","17.384238700","172.20.40.110","151.101.130.187","TCP","54","62995  >  443 [ACK] Seq=124936 Ack=235269 Win=512 Len=0"
"329","17.387449500","151.101.130.187","172.20.40.110","TCP","1434","443  >  62995 [PSH, ACK] Seq=235269 Ack=124936 Win=4242 Len=1380 [TCP PDU reassembled in 335]"
"330","17.389705500","151.101.130.187","172.20.40.110","TCP","1434","443  >  62995 [ACK] Seq=236649 Ack=124936 Win=4242 Len=1380 [TCP PDU reassembled in 335]"
