No.,Time,Source,Destination,Protocol,Length,Info
1,0.0,100.84.170.161,151.101.66.187,TCP,55,50935  >  443 [ACK] Seq=1 Ack=1 Win=507 Len=1 [TCP PDU reassembled in 189]
2,0.013985,151.101.66.187,100.84.170.161,TCP,66,443  >  50935 [ACK] Seq=1 Ack=2 Win=281 Len=0 SLE=1 SRE=2
3,4.3967643,100.84.170.161,151.101.2.187,TLSv1.2,2000,Application Data
4,4.3968787,100.84.170.161,151.101.2.187,TLSv1.2,93,Application Data
5,4.4030043,100.84.170.161,151.101.2.187,TLSv1.2,720,Application Data
6,4.4035388,100.84.170.161,151.101.2.187,TLSv1.2,1962,Application Data
7,4.406435,151.101.2.187,100.84.170.161,TCP,56,443  >  64433 [ACK] Seq=1 Ack=1986 Win=501 Len=0
8,4.406865,151.101.2.187,100.84.170.161,TLSv1.2,93,Application Data
9,4.4086688,151.101.2.187,100.84.170.161,TLSv1.2,214,Application Data
10,4.408664,100.84.170.161,151.101.2.187,TLSv1.2,663,Application Data
11,4.4120126,151.101.2.187,100.84.170.161,TCP,56,443  >  64433 [ACK] Seq=200 Ack=2652 Win=507 Len=0
12,4.4126387,151.101.2.187,100.84.170.161,TCP,56,443  >  64433 [ACK] Seq=200 Ack=4560 Win=518 Len=0
13,4.4148559,151.101.2.187,100.84.170.161,TLSv1.2,168,Application Data
14,4.4149018,100.84.170.161,151.101.2.187,TCP,54,64433  >  443 [ACK] Seq=5169 Ack=314 Win=508 Len=0
15,4.415983,151.101.2.187,100.84.170.161,TLSv1.2,131,Application Data
16,4.4185268,151.101.2.187,100.84.170.161,TCP,56,443  >  64433 [ACK] Seq=391 Ack=5169 Win=524 Len=0
17,4.4212673,151.101.2.187,100.84.170.161,TLSv1.2,322,Application Data
18,4.4213232,100.84.170.161,151.101.2.187,TCP,54,64433  >  443 [ACK] Seq=5169 Ack=659 Win=513 Len=0
19,4.4216283,151.101.2.187,100.84.170.161,TLSv1.2,213,Application Data
20,4.4227782,100.84.170.161,151.101.2.187,TLSv1.2,89,Application Data
21,4.4331577,151.101.2.187,100.84.170.161,TCP,56,443  >  64433 [ACK] Seq=818 Ack=5204 Win=524 Len=0
22,4.4727474,100.84.170.161,151.101.2.187,TLSv1.2,1985,Application Data
23,4.483148,151.101.2.187,100.84.170.161,TCP,56,443  >  64433 [ACK] Seq=818 Ack=7135 Win=535 Len=0
24,4.4856298,151.101.2.187,100.84.170.161,TLSv1.2,135,Application Data
25,4.5142017,151.101.2.187,100.84.170.161,TCP,135,"[TCP Retransmission] 443  >  64433 [PSH, ACK] Seq=818 Ack=7135 Win=535 Len=81"
26,4.5142393,100.84.170.161,151.101.2.187,TCP,66,64433  >  443 [ACK] Seq=7135 Ack=899 Win=512 Len=0 SLE=818 SRE=899
27,4.5512367,100.84.170.161,151.101.2.187,TLSv1.2,688,Application Data
28,4.5613466,100.84.170.161,151.101.2.187,TLSv1.2,1999,Application Data
29,4.5613524,151.101.2.187,100.84.170.161,TCP,56,443  >  64433 [ACK] Seq=899 Ack=7769 Win=541 Len=0
30,4.5638704,151.101.2.187,100.84.170.161,TLSv1.2,125,Application Data
31,4.5710747,151.101.2.187,100.84.170.161,TCP,56,443  >  64433 [ACK] Seq=970 Ack=9714 Win=553 Len=0
32,4.5733507,151.101.2.187,100.84.170.161,TLSv1.2,130,Application Data
33,4.5734128,100.84.170.161,151.101.2.187,TCP,54,64433  >  443 [ACK] Seq=9714 Ack=1046 Win=511 Len=0
34,4.5931966,100.84.170.161,151.101.2.187,TLSv1.2,705,Application Data
35,4.6025499,151.101.2.187,100.84.170.161,TCP,56,443  >  64433 [ACK] Seq=1046 Ack=10365 Win=558 Len=0
36,4.6056402,151.101.2.187,100.84.170.161,TLSv1.2,125,Application Data
37,4.6352249,151.101.2.187,100.84.170.161,TCP,125,"[TCP Retransmission] 443  >  64433 [PSH, ACK] Seq=1046 Ack=10365 Win=558 Len=71"
38,4.6352652,100.84.170.161,151.101.2.187,TCP,66,64433  >  443 [ACK] Seq=10365 Ack=1117 Win=511 Len=0 SLE=1046 SRE=1117
39,4.7104432,100.84.170.161,151.101.2.187,TLSv1.2,1994,Application Data
40,4.719516,151.101.2.187,100.84.170.161,TCP,56,443  >  64433 [ACK] Seq=1117 Ack=12305 Win=570 Len=0
41,4.7330338,151.101.2.187,100.84.170.161,TLSv1.2,131,Application Data
42,4.7631223,151.101.2.187,100.84.170.161,TCP,131,"[TCP Retransmission] 443  >  64433 [PSH, ACK] Seq=1117 Ack=12305 Win=570 Len=77"
43,4.7631774,100.84.170.161,151.101.2.187,TCP,66,64433  >  443 [ACK] Seq=12305 Ack=1194 Win=511 Len=0 SLE=1117 SRE=1194
44,5.1855639,100.84.170.161,151.101.2.187,TLSv1.2,820,Application Data
45,5.1857617,100.84.170.161,151.101.2.187,TLSv1.2,1885,Application Data
46,5.1858695,100.84.170.161,151.101.2.187,TLSv1.2,832,Application Data
47,5.1860033,100.84.170.161,151.101.2.187,TLSv1.2,1881,Application Data
48,5.1864363,100.84.170.161,151.101.2.187,TLSv1.2,828,Application Data
49,5.1865751,100.84.170.161,151.101.2.187,TLSv1.2,1892,Application Data
50,5.1866666,100.84.170.161,151.101.2.187,TLSv1.2,796,Application Data
51,5.1867572,100.84.170.161,151.101.2.187,TLSv1.2,1888,Application Data
52,5.1950296,151.101.2.187,100.84.170.161,TCP,56,443  >  64433 [ACK] Seq=1194 Ack=13071 Win=575 Len=0
53,5.1953602,151.101.2.187,100.84.170.161,TCP,56,443  >  64433 [ACK] Seq=1194 Ack=15680 Win=593 Len=0
54,5.1956674,151.101.2.187,100.84.170.161,TCP,56,443  >  64433 [ACK] Seq=1194 Ack=17507 Win=604 Len=0
55,5.196043,151.101.2.187,100.84.170.161,TCP,56,443  >  64433 [ACK] Seq=1194 Ack=20119 Win=621 Len=0
56,5.196345,151.101.2.187,100.84.170.161,TCP,56,443  >  64433 [ACK] Seq=1194 Ack=22695 Win=638 Len=0
57,5.1989308,151.101.2.187,100.84.170.161,TLSv1.2,131,Application Data
58,5.1996851,151.101.2.187,100.84.170.161,TLSv1.2,238,Application Data
59,5.1997519,100.84.170.161,151.101.2.187,TCP,54,64433  >  443 [ACK] Seq=22695 Ack=1455 Win=510 Len=0
60,5.2007128,151.101.2.187,100.84.170.161,TLSv1.2,235,Application Data
61,5.2007128,151.101.2.187,100.84.170.161,TLSv1.2,168,Application Data
62,5.2007778,100.84.170.161,151.101.2.187,TCP,54,64433  >  443 [ACK] Seq=22695 Ack=1750 Win=509 Len=0
63,5.200995,151.101.2.187,100.84.170.161,TLSv1.2,131,Application Data
64,5.2012745,151.101.2.187,100.84.170.161,TLSv1.2,130,Application Data
65,5.2013066,100.84.170.161,151.101.2.187,TCP,54,64433  >  443 [ACK] Seq=22695 Ack=1903 Win=508 Len=0
66,10.8994891,100.84.170.161,151.101.2.187,TLSv1.2,825,Application Data
67,10.9088332,151.101.2.187,100.84.170.161,TCP,56,443  >  64433 [ACK] Seq=1903 Ack=23466 Win=644 Len=0
68,10.9113867,151.101.2.187,100.84.170.161,TLSv1.2,375,Application Data
69,10.9414896,151.101.2.187,100.84.170.161,TCP,375,"[TCP Retransmission] 443  >  64433 [PSH, ACK] Seq=1903 Ack=23466 Win=644 Len=321"
70,10.9415253,100.84.170.161,151.101.2.187,TCP,66,64433  >  443 [ACK] Seq=23466 Ack=2224 Win=513 Len=0 SLE=1903 SRE=2224
71,11.0808414,100.84.170.161,151.101.2.187,TLSv1.2,1878,Application Data
72,11.0907044,151.101.2.187,100.84.170.161,TCP,56,443  >  64433 [ACK] Seq=2224 Ack=25290 Win=655 Len=0
73,11.0933648,151.101.2.187,100.84.170.161,TLSv1.2,130,Application Data
74,11.1223683,151.101.2.187,100.84.170.161,TCP,130,"[TCP Retransmission] 443  >  64433 [PSH, ACK] Seq=2224 Ack=25290 Win=655 Len=76"
75,11.1224532,100.84.170.161,151.101.2.187,TCP,66,64433  >  443 [ACK] Seq=25290 Ack=2300 Win=512 Len=0 SLE=2224 SRE=2300
76,11.2101938,100.84.170.161,151.101.2.187,TLSv1.2,825,Application Data
77,11.2198406,151.101.2.187,100.84.170.161,TCP,56,443  >  64433 [ACK] Seq=2300 Ack=26061 Win=661 Len=0
78,11.2220301,151.101.2.187,100.84.170.161,TLSv1.2,130,Application Data
79,11.2511542,151.101.2.187,100.84.170.161,TCP,130,"[TCP Retransmission] 443  >  64433 [PSH, ACK] Seq=2300 Ack=26061 Win=661 Len=76"
80,11.2512116,100.84.170.161,151.101.2.187,TCP,66,64433  >  443 [ACK] Seq=26061 Ack=2376 Win=512 Len=0 SLE=2300 SRE=2376
81,11.7839497,100.84.170.161,151.101.2.187,TLSv1.2,1896,Application Data
82,11.7937155,151.101.2.187,100.84.170.161,TCP,56,443  >  64433 [ACK] Seq=2376 Ack=27903 Win=672 Len=0
83,11.7964623,151.101.2.187,100.84.170.161,TLSv1.2,240,Application Data
84,11.824088,151.101.2.187,100.84.170.161,TCP,240,"[TCP Retransmission] 443  >  64433 [PSH, ACK] Seq=2376 Ack=27903 Win=672 Len=186"
85,11.8241535,100.84.170.161,151.101.2.187,TCP,66,64433  >  443 [ACK] Seq=27903 Ack=2562 Win=511 Len=0 SLE=2376 SRE=2562
86,11.9104635,100.84.170.161,151.101.2.187,TLSv1.2,794,Application Data
87,11.9201232,151.101.2.187,100.84.170.161,TCP,56,443  >  64433 [ACK] Seq=2562 Ack=28643 Win=678 Len=0
88,11.9226856,151.101.2.187,100.84.170.161,TLSv1.2,130,Application Data
89,11.9424281,100.84.170.161,151.101.2.187,TLSv1.2,1888,Application Data
90,11.9510055,151.101.2.187,100.84.170.161,TCP,130,"[TCP Spurious Retransmission] 443  >  64433 [PSH, ACK] Seq=2562 Ack=28643 Win=678 Len=76"
91,11.9510423,100.84.170.161,151.101.2.187,TCP,66,[TCP Dup ACK 89#1] 64433  >  443 [ACK] Seq=30477 Ack=2638 Win=511 Len=0 SLE=2562 SRE=2638
92,11.9521482,151.101.2.187,100.84.170.161,TCP,56,443  >  64433 [ACK] Seq=2638 Ack=30477 Win=689 Len=0
93,11.9543586,151.101.2.187,100.84.170.161,TLSv1.2,130,Application Data
94,11.9845,151.101.2.187,100.84.170.161,TCP,130,"[TCP Retransmission] 443  >  64433 [PSH, ACK] Seq=2638 Ack=30477 Win=689 Len=76"
95,11.9845378,100.84.170.161,151.101.2.187,TCP,66,64433  >  443 [ACK] Seq=30477 Ack=2714 Win=511 Len=0 SLE=2638 SRE=2714
96,15.2975378,100.84.170.161,151.101.2.187,TLSv1.2,824,Application Data
97,15.3069515,151.101.2.187,100.84.170.161,TCP,56,443  >  64433 [ACK] Seq=2714 Ack=31247 Win=695 Len=0
98,15.3092364,151.101.2.187,100.84.170.161,TLSv1.2,214,Application Data
99,15.3206825,100.84.170.161,151.101.2.187,TLSv1.2,1891,Application Data
100,15.3215057,100.84.170.161,151.101.2.187,TLSv1.2,786,Application Data
101,15.3217419,100.84.170.161,151.101.2.187,TLSv1.2,1885,Application Data
102,15.330612,151.101.2.187,100.84.170.161,TCP,56,443  >  64433 [ACK] Seq=2874 Ack=33084 Win=707 Len=0
103,15.3309353,151.101.2.187,100.84.170.161,TCP,56,443  >  64433 [ACK] Seq=2874 Ack=33816 Win=712 Len=0
104,15.3314865,151.101.2.187,100.84.170.161,TCP,56,443  >  64433 [ACK] Seq=2874 Ack=35647 Win=724 Len=0
105,15.3326602,151.101.2.187,100.84.170.161,TLSv1.2,124,Application Data
106,15.3329107,151.101.2.187,100.84.170.161,TLSv1.2,131,Application Data
107,15.3329435,100.84.170.161,151.101.2.187,TCP,54,64433  >  443 [ACK] Seq=35647 Ack=3021 Win=510 Len=0
108,15.3342366,151.101.2.187,100.84.170.161,TLSv1.2,174,Application Data
109,15.3719518,151.101.2.187,100.84.170.161,TCP,174,"[TCP Retransmission] 443  >  64433 [PSH, ACK] Seq=3021 Ack=35647 Win=724 Len=120"
110,15.3719907,100.84.170.161,151.101.2.187,TCP,66,64433  >  443 [ACK] Seq=35647 Ack=3141 Win=509 Len=0 SLE=3021 SRE=3141
111,15.3863612,100.84.170.161,151.101.2.187,TLSv1.2,786,Application Data
112,15.3957332,151.101.2.187,100.84.170.161,TCP,56,443  >  64433 [ACK] Seq=3141 Ack=36379 Win=729 Len=0
113,15.3986329,151.101.2.187,100.84.170.161,TLSv1.2,104,Application Data
114,15.4270003,151.101.2.187,100.84.170.161,TCP,104,"[TCP Retransmission] 443  >  64433 [PSH, ACK] Seq=3141 Ack=36379 Win=729 Len=50"
115,15.4270488,100.84.170.161,151.101.2.187,TCP,66,64433  >  443 [ACK] Seq=36379 Ack=3191 Win=509 Len=0 SLE=3141 SRE=3191
116,15.467652,100.84.170.161,151.101.2.187,TLSv1.2,1882,Application Data
117,15.4774836,151.101.2.187,100.84.170.161,TCP,56,443  >  64433 [ACK] Seq=3191 Ack=38207 Win=741 Len=0
118,15.4792801,100.84.170.161,151.101.2.187,TLSv1.2,823,Application Data
119,15.4806601,151.101.2.187,100.84.170.161,TLSv1.2,125,Application Data
120,15.4890662,151.101.2.187,100.84.170.161,TCP,56,443  >  64433 [ACK] Seq=3262 Ack=38976 Win=746 Len=0
121,15.4915903,151.101.2.187,100.84.170.161,TLSv1.2,130,Application Data
122,15.4916444,100.84.170.161,151.101.2.187,TCP,54,64433  >  443 [ACK] Seq=38976 Ack=3338 Win=508 Len=0
123,15.5038981,100.84.170.161,151.101.2.187,TLSv1.2,1876,Application Data
124,15.51308,151.101.2.187,100.84.170.161,TCP,56,443  >  64433 [ACK] Seq=3338 Ack=40798 Win=758 Len=0
125,15.515977,151.101.2.187,100.84.170.161,TLSv1.2,286,Application Data
126,15.5471759,151.101.2.187,100.84.170.161,TCP,286,"[TCP Retransmission] 443  >  64433 [PSH, ACK] Seq=3338 Ack=40798 Win=758 Len=232"
127,15.547215,100.84.170.161,151.101.2.187,TCP,66,64433  >  443 [ACK] Seq=40798 Ack=3570 Win=508 Len=0 SLE=3338 SRE=3570
128,15.5972986,100.84.170.161,151.101.2.187,TLSv1.2,818,Application Data
129,15.6064479,151.101.2.187,100.84.170.161,TCP,56,443  >  64433 [ACK] Seq=3570 Ack=41562 Win=764 Len=0
130,15.6085924,151.101.2.187,100.84.170.161,TLSv1.2,136,Application Data
131,15.6401511,151.101.2.187,100.84.170.161,TCP,136,"[TCP Retransmission] 443  >  64433 [PSH, ACK] Seq=3570 Ack=41562 Win=764 Len=82"
132,15.6401809,100.84.170.161,151.101.2.187,TCP,66,64433  >  443 [ACK] Seq=41562 Ack=3652 Win=507 Len=0 SLE=3570 SRE=3652
133,15.6790353,100.84.170.161,151.101.2.187,TLSv1.2,1904,Application Data
134,15.6813976,100.84.170.161,151.101.2.187,TLSv1.2,808,Application Data
135,15.6815839,100.84.170.161,151.101.2.187,TLSv1.2,1900,Application Data
136,15.6816827,100.84.170.161,151.101.2.187,TLSv1.2,804,Application Data
137,15.6822711,100.84.170.161,151.101.2.187,TLSv1.2,1896,Application Data
138,15.6823581,100.84.170.161,151.101.2.187,TLSv1.2,815,Application Data
139,15.6824196,100.84.170.161,151.101.2.187,TLSv1.2,1864,Application Data
140,15.6824615,100.84.170.161,151.101.2.187,TLSv1.2,811,Application Data
141,15.689106,151.101.2.187,100.84.170.161,TCP,56,443  >  64433 [ACK] Seq=3652 Ack=43412 Win=775 Len=0
142,15.6904749,151.101.2.187,100.84.170.161,TCP,56,443  >  64433 [ACK] Seq=3652 Ack=44166 Win=781 Len=0
143,15.6910731,151.101.2.187,100.84.170.161,TCP,56,443  >  64433 [ACK] Seq=3652 Ack=46762 Win=798 Len=0
144,15.6913531,151.101.2.187,100.84.170.161,TCP,56,443  >  64433 [ACK] Seq=3652 Ack=48604 Win=809 Len=0
145,15.6920691,151.101.2.187,100.84.170.161,TCP,56,443  >  64433 [ACK] Seq=3652 Ack=51932 Win=832 Len=0
146,15.7008798,151.101.2.187,100.84.170.161,TLSv1.2,179,Application Data
147,15.7012062,151.101.2.187,100.84.170.161,TLSv1.2,130,Application Data
148,15.7012356,100.84.170.161,151.101.2.187,TCP,54,64433  >  443 [ACK] Seq=51932 Ack=3853 Win=513 Len=0
149,15.7019744,151.101.2.187,100.84.170.161,TLSv1.2,124,Application Data
150,15.7030477,151.101.2.187,100.84.170.161,TLSv1.2,130,Application Data
151,15.7030897,100.84.170.161,151.101.2.187,TCP,54,64433  >  443 [ACK] Seq=51932 Ack=3999 Win=512 Len=0
152,15.7033431,151.101.2.187,100.84.170.161,TLSv1.2,125,Application Data
153,15.7033431,151.101.2.187,100.84.170.161,TLSv1.2,240,Application Data
154,15.703386,100.84.170.161,151.101.2.187,TCP,54,64433  >  443 [ACK] Seq=51932 Ack=4256 Win=511 Len=0
155,15.7042509,151.101.2.187,100.84.170.161,TLSv1.2,131,Application Data
156,15.7441,151.101.2.187,100.84.170.161,TCP,131,"[TCP Retransmission] 443  >  64433 [PSH, ACK] Seq=4256 Ack=51932 Win=832 Len=77"
157,15.7441447,100.84.170.161,151.101.2.187,TCP,66,64433  >  443 [ACK] Seq=51932 Ack=4333 Win=511 Len=0 SLE=4256 SRE=4333
158,23.0897829,100.84.170.161,151.101.2.187,TLSv1.2,2165,Application Data
159,23.0991518,151.101.2.187,100.84.170.161,TCP,56,443  >  64433 [ACK] Seq=4333 Ack=54043 Win=843 Len=0
160,23.1019332,151.101.2.187,100.84.170.161,TLSv1.2,214,Application Data
161,23.132498,151.101.2.187,100.84.170.161,TCP,214,"[TCP Retransmission] 443  >  64433 [PSH, ACK] Seq=4333 Ack=54043 Win=843 Len=160"
162,23.1325472,100.84.170.161,151.101.2.187,TCP,66,64433  >  443 [ACK] Seq=54043 Ack=4493 Win=510 Len=0 SLE=4333 SRE=4493
163,23.2436579,100.84.170.161,151.101.2.187,TLSv1.2,552,Application Data
164,23.2546233,151.101.2.187,100.84.170.161,TCP,56,443  >  64433 [ACK] Seq=4493 Ack=54541 Win=849 Len=0
165,23.2573836,151.101.2.187,100.84.170.161,TLSv1.2,169,Application Data
166,23.2734746,100.84.170.161,151.101.2.187,TLSv1.2,2166,Application Data
167,23.2827427,151.101.2.187,100.84.170.161,TCP,56,443  >  64433 [ACK] Seq=4608 Ack=56653 Win=861 Len=0
168,23.2860343,151.101.2.187,100.84.170.161,TLSv1.2,235,Application Data
169,23.3182958,151.101.2.187,100.84.170.161,TCP,235,"[TCP Retransmission] 443  >  64433 [PSH, ACK] Seq=4608 Ack=56653 Win=861 Len=181"
170,23.3183323,100.84.170.161,151.101.2.187,TCP,66,64433  >  443 [ACK] Seq=56653 Ack=4789 Win=509 Len=0 SLE=4608 SRE=4789
171,23.4470731,100.84.170.161,151.101.2.187,TLSv1.2,571,Application Data
172,23.4566806,151.101.2.187,100.84.170.161,TCP,56,443  >  64433 [ACK] Seq=4789 Ack=57170 Win=866 Len=0
173,23.4596839,151.101.2.187,100.84.170.161,TLSv1.2,291,Application Data
174,23.4921648,151.101.2.187,100.84.170.161,TCP,291,"[TCP Retransmission] 443  >  64433 [PSH, ACK] Seq=4789 Ack=57170 Win=866 Len=237"
175,23.4922058,100.84.170.161,151.101.2.187,TCP,66,64433  >  443 [ACK] Seq=57170 Ack=5026 Win=508 Len=0 SLE=4789 SRE=5026
176,23.9373942,100.84.170.161,151.101.2.187,TLSv1.2,2211,Application Data
177,23.9468379,151.101.2.187,100.84.170.161,TCP,56,443  >  64433 [ACK] Seq=5026 Ack=59327 Win=878 Len=0
178,23.9493864,151.101.2.187,100.84.170.161,TLSv1.2,135,Application Data
179,23.9809872,151.101.2.187,100.84.170.161,TCP,135,"[TCP Retransmission] 443  >  64433 [PSH, ACK] Seq=5026 Ack=59327 Win=878 Len=81"
180,23.9810643,100.84.170.161,151.101.2.187,TCP,66,64433  >  443 [ACK] Seq=59327 Ack=5107 Win=508 Len=0 SLE=5026 SRE=5107
181,24.0543551,100.84.170.161,151.101.2.187,TLSv1.2,467,Application Data
182,24.0636812,151.101.2.187,100.84.170.161,TCP,56,443  >  64433 [ACK] Seq=5107 Ack=59740 Win=883 Len=0
183,24.0720583,151.101.2.187,100.84.170.161,TLSv1.2,130,Application Data
184,24.09104,100.84.170.161,151.101.2.187,TLSv1.2,2209,Application Data
185,24.1017779,151.101.2.187,100.84.170.161,TCP,56,443  >  64433 [ACK] Seq=5183 Ack=61895 Win=895 Len=0
186,24.1038161,151.101.2.187,100.84.170.161,TLSv1.2,130,Application Data
187,24.1391015,151.101.2.187,100.84.170.161,TCP,130,"[TCP Retransmission] 443  >  64433 [PSH, ACK] Seq=5183 Ack=61895 Win=895 Len=76"
188,24.1391417,100.84.170.161,151.101.2.187,TCP,66,64433  >  443 [ACK] Seq=61895 Ack=5259 Win=507 Len=0 SLE=5183 SRE=5259
189,25.0803399,100.84.170.161,151.101.66.187,TLSv1.2,248,Ignored Unknown Record
190,25.0804069,100.84.170.161,151.101.66.187,TLSv1.2,93,Application Data
191,25.0894767,151.101.66.187,100.84.170.161,TCP,56,443  >  50935 [ACK] Seq=1 Ack=196 Win=281 Len=0
192,25.0897619,151.101.66.187,100.84.170.161,TCP,56,443  >  50935 [ACK] Seq=1 Ack=235 Win=281 Len=0
193,25.0901814,151.101.66.187,100.84.170.161,TLSv1.2,93,Application Data
194,25.1159476,151.101.66.187,100.84.170.161,TCP,93,"[TCP Retransmission] 443  >  50935 [PSH, ACK] Seq=1 Ack=235 Win=281 Len=39"
195,25.1160194,100.84.170.161,151.101.66.187,TCP,66,50935  >  443 [ACK] Seq=235 Ack=40 Win=507 Len=0 SLE=1 SRE=40
196,25.1400195,151.101.66.187,100.84.170.161,TLSv1.2,265,Application Data
197,25.1403457,151.101.66.187,100.84.170.161,TLSv1.2,187,Application Data
198,25.1403854,100.84.170.161,151.101.66.187,TCP,54,50935  >  443 [ACK] Seq=235 Ack=384 Win=513 Len=0
199,25.1444933,100.84.170.161,151.101.66.187,TLSv1.2,89,Application Data
200,25.1537844,151.101.66.187,100.84.170.161,TCP,56,443  >  50935 [ACK] Seq=384 Ack=270 Win=281 Len=0
201,27.76806,100.84.170.161,151.101.2.187,TLSv1.2,473,Application Data
202,27.7702034,100.84.170.161,151.101.2.187,TLSv1.2,2219,Application Data
203,27.7773842,151.101.2.187,100.84.170.161,TCP,56,443  >  64433 [ACK] Seq=5259 Ack=62314 Win=900 Len=0
204,27.7799976,151.101.2.187,100.84.170.161,TLSv1.2,241,Application Data
205,27.7821903,151.101.2.187,100.84.170.161,TLSv1.2,104,Application Data
206,27.7822427,100.84.170.161,151.101.2.187,TCP,54,64433  >  443 [ACK] Seq=64479 Ack=5496 Win=513 Len=0
207,27.8113797,100.84.170.161,151.101.2.187,TLSv1.2,477,Application Data
208,27.8129459,100.84.170.161,151.101.2.187,TLSv1.2,2187,Application Data
209,27.8207592,151.101.2.187,100.84.170.161,TCP,56,443  >  64433 [ACK] Seq=5496 Ack=64902 Win=918 Len=0
210,27.822181,151.101.2.187,100.84.170.161,TCP,56,443  >  64433 [ACK] Seq=5496 Ack=67035 Win=929 Len=0
211,27.8235132,151.101.2.187,100.84.170.161,TLSv1.2,130,Application Data
212,27.8240397,151.101.2.187,100.84.170.161,TLSv1.2,124,Application Data
213,27.8240834,100.84.170.161,151.101.2.187,TCP,54,64433  >  443 [ACK] Seq=67035 Ack=5642 Win=512 Len=0
214,31.1458567,100.84.170.161,151.101.2.187,TLSv1.2,531,Application Data
215,31.1568806,151.101.2.187,100.84.170.161,TCP,56,443  >  64433 [ACK] Seq=5642 Ack=67512 Win=935 Len=0
216,31.1618393,151.101.2.187,100.84.170.161,TLSv1.2,214,Application Data
217,31.19503,100.84.170.161,151.101.2.187,TLSv1.2,2131,Application Data
218,31.1954702,151.101.2.187,100.84.170.161,TCP,214,"[TCP Spurious Retransmission] 443  >  64433 [PSH, ACK] Seq=5642 Ack=67512 Win=935 Len=160"
219,31.1955158,100.84.170.161,151.101.2.187,TCP,66,[TCP Dup ACK 217#1] 64433  >  443 [ACK] Seq=69589 Ack=5802 Win=512 Len=0 SLE=5642 SRE=5802
220,31.2053052,151.101.2.187,100.84.170.161,TCP,56,443  >  64433 [ACK] Seq=5802 Ack=69589 Win=946 Len=0
221,31.20819,151.101.2.187,100.84.170.161,TLSv1.2,125,Application Data
222,31.2411335,151.101.2.187,100.84.170.161,TCP,125,"[TCP Retransmission] 443  >  64433 [PSH, ACK] Seq=5802 Ack=69589 Win=946 Len=71"
223,31.2412672,100.84.170.161,151.101.2.187,TCP,66,64433  >  443 [ACK] Seq=69589 Ack=5873 Win=511 Len=0 SLE=5802 SRE=5873
224,32.2787027,100.84.170.161,151.101.2.187,TLSv1.2,528,Application Data
225,32.2883617,151.101.2.187,100.84.170.161,TCP,56,443  >  64433 [ACK] Seq=5873 Ack=70063 Win=952 Len=0
226,32.2906036,151.101.2.187,100.84.170.161,TLSv1.2,214,Application Data
227,32.3243441,151.101.2.187,100.84.170.161,TCP,214,"[TCP Retransmission] 443  >  64433 [PSH, ACK] Seq=5873 Ack=70063 Win=952 Len=160"
228,32.3243994,100.84.170.161,151.101.2.187,TCP,66,64433  >  443 [ACK] Seq=70063 Ack=6033 Win=511 Len=0 SLE=5873 SRE=6033
229,32.5973777,100.84.170.161,151.101.2.187,TLSv1.2,2102,Application Data
230,32.6064575,151.101.2.187,100.84.170.161,TCP,56,443  >  64433 [ACK] Seq=6033 Ack=72111 Win=963 Len=0
231,32.6230873,151.101.2.187,100.84.170.161,TLSv1.2,169,Application Data
232,32.656967,151.101.2.187,100.84.170.161,TCP,169,"[TCP Retransmission] 443  >  64433 [PSH, ACK] Seq=6033 Ack=72111 Win=963 Len=115"
233,32.6570079,100.84.170.161,151.101.2.187,TCP,66,64433  >  443 [ACK] Seq=72111 Ack=6148 Win=510 Len=0 SLE=6033 SRE=6148
234,33.0735812,100.84.170.161,151.101.2.187,TLSv1.2,528,Application Data
235,33.0833425,151.101.2.187,100.84.170.161,TCP,56,443  >  64433 [ACK] Seq=6148 Ack=72585 Win=969 Len=0
236,33.0854383,151.101.2.187,100.84.170.161,TLSv1.2,104,Application Data
237,33.1204899,151.101.2.187,100.84.170.161,TCP,104,"[TCP Retransmission] 443  >  64433 [PSH, ACK] Seq=6148 Ack=72585 Win=969 Len=50"
238,33.1205655,100.84.170.161,151.101.2.187,TCP,66,64433  >  443 [ACK] Seq=72585 Ack=6198 Win=510 Len=0 SLE=6148 SRE=6198
239,33.4979243,100.84.170.161,151.101.2.187,TLSv1.2,2102,Application Data
240,33.5077211,151.101.2.187,100.84.170.161,TCP,56,443  >  64433 [ACK] Seq=6198 Ack=74633 Win=980 Len=0
241,33.5098214,151.101.2.187,100.84.170.161,TLSv1.2,208,Application Data
242,33.5431799,151.101.2.187,100.84.170.161,TCP,208,"[TCP Retransmission] 443  >  64433 [PSH, ACK] Seq=6198 Ack=74633 Win=980 Len=154"
243,33.5433051,100.84.170.161,151.101.2.187,TCP,66,64433  >  443 [ACK] Seq=74633 Ack=6352 Win=509 Len=0 SLE=6198 SRE=6352
244,34.4851383,100.84.170.161,151.101.2.187,TLSv1.2,530,Application Data
245,34.4959723,151.101.2.187,100.84.170.161,TCP,56,443  >  64433 [ACK] Seq=6352 Ack=75109 Win=986 Len=0
246,34.4978789,151.101.2.187,100.84.170.161,TLSv1.2,375,Application Data
247,34.5239266,100.84.170.161,151.101.2.187,TLSv1.2,2132,Application Data
248,34.5310865,151.101.2.187,100.84.170.161,TCP,375,"[TCP Spurious Retransmission] 443  >  64433 [PSH, ACK] Seq=6352 Ack=75109 Win=986 Len=321"
249,34.5311263,100.84.170.161,151.101.2.187,TCP,66,[TCP Dup ACK 247#1] 64433  >  443 [ACK] Seq=77187 Ack=6673 Win=508 Len=0 SLE=6352 SRE=6673
250,34.5332748,151.101.2.187,100.84.170.161,TCP,56,443  >  64433 [ACK] Seq=6673 Ack=77187 Win=997 Len=0
251,34.5360284,151.101.2.187,100.84.170.161,TLSv1.2,130,Application Data
252,34.5687881,100.84.170.161,151.101.2.187,TLSv1.2,518,Application Data
253,34.5690419,151.101.2.187,100.84.170.161,TCP,130,"[TCP Spurious Retransmission] 443  >  64433 [PSH, ACK] Seq=6673 Ack=77187 Win=997 Len=76"
254,34.569056,100.84.170.161,151.101.2.187,TLSv1.2,2136,Application Data
255,34.5690712,100.84.170.161,151.101.2.187,TCP,66,[TCP Dup ACK 252#1] 64433  >  443 [ACK] Seq=79733 Ack=6749 Win=508 Len=0 SLE=6673 SRE=6749
256,34.5779467,151.101.2.187,100.84.170.161,TCP,56,443  >  64433 [ACK] Seq=6749 Ack=77651 Win=1003 Len=0
257,34.5790874,151.101.2.187,100.84.170.161,TCP,56,443  >  64433 [ACK] Seq=6749 Ack=79733 Win=1015 Len=0
258,34.5804112,151.101.2.187,100.84.170.161,TLSv1.2,130,Application Data
259,34.5815257,151.101.2.187,100.84.170.161,TLSv1.2,130,Application Data
260,34.581582,100.84.170.161,151.101.2.187,TCP,54,64433  >  443 [ACK] Seq=79733 Ack=6901 Win=507 Len=0
261,34.6572658,100.84.170.161,151.101.2.187,TLSv1.2,474,Application Data
262,34.6665485,151.101.2.187,100.84.170.161,TCP,56,443  >  64433 [ACK] Seq=6901 Ack=80153 Win=1020 Len=0
263,34.6692202,151.101.2.187,100.84.170.161,TLSv1.2,173,Application Data
264,34.6695025,151.101.2.187,100.84.170.161,TLSv1.2,306,Application Data
265,34.6695297,100.84.170.161,151.101.2.187,TCP,54,64433  >  443 [ACK] Seq=80153 Ack=7272 Win=513 Len=0
266,34.6803444,100.84.170.161,151.101.2.187,TLSv1.2,89,Application Data
267,34.6845261,100.84.170.161,151.101.2.187,TLSv1.2,2158,Application Data
268,34.6902402,151.101.2.187,100.84.170.161,TCP,56,443  >  64433 [ACK] Seq=7272 Ack=80188 Win=1020 Len=0
269,34.6941448,151.101.2.187,100.84.170.161,TCP,56,443  >  64433 [ACK] Seq=7272 Ack=82292 Win=1032 Len=0
270,34.6966119,151.101.2.187,100.84.170.161,TLSv1.2,130,Application Data
271,34.7204714,100.84.170.161,151.101.2.187,TLSv1.2,467,Application Data
272,34.7279711,151.101.2.187,100.84.170.161,TCP,130,"[TCP Spurious Retransmission] 443  >  64433 [PSH, ACK] Seq=7272 Ack=82292 Win=1032 Len=76"
273,34.7280097,100.84.170.161,151.101.2.187,TCP,66,[TCP Dup ACK 271#1] 64433  >  443 [ACK] Seq=82705 Ack=7348 Win=512 Len=0 SLE=7272 SRE=7348
274,34.7293566,151.101.2.187,100.84.170.161,TCP,56,443  >  64433 [ACK] Seq=7348 Ack=82705 Win=1037 Len=0
275,34.7323966,100.84.170.161,151.101.2.187,TLSv1.2,2149,Application Data
276,34.732516,100.84.170.161,151.101.2.187,TLSv1.2,490,Application Data
277,34.734449,151.101.2.187,100.84.170.161,TLSv1.2,161,Application Data
278,34.734449,151.101.2.187,100.84.170.161,TLSv1.2,463,Application Data
279,34.7345075,100.84.170.161,151.101.2.187,TCP,54,64433  >  443 [ACK] Seq=85236 Ack=7864 Win=510 Len=0
280,34.743802,151.101.2.187,100.84.170.161,TCP,56,443  >  64433 [ACK] Seq=7864 Ack=85236 Win=1054 Len=0
281,34.7464016,151.101.2.187,100.84.170.161,TLSv1.2,124,Application Data
282,34.7466757,151.101.2.187,100.84.170.161,TLSv1.2,130,Application Data
283,34.7467141,100.84.170.161,151.101.2.187,TCP,54,64433  >  443 [ACK] Seq=85236 Ack=8010 Win=510 Len=0
284,34.7865849,100.84.170.161,151.101.2.187,TLSv1.2,2217,Application Data
285,34.7900663,100.84.170.161,151.101.2.187,TLSv1.2,461,Application Data
286,34.7961182,151.101.2.187,100.84.170.161,TCP,56,443  >  64433 [ACK] Seq=8010 Ack=87399 Win=1066 Len=0
287,34.7989237,151.101.2.187,100.84.170.161,TLSv1.2,130,Application Data
288,34.7992343,151.101.2.187,100.84.170.161,TCP,56,443  >  64433 [ACK] Seq=8086 Ack=87806 Win=1072 Len=0
289,34.802076,151.101.2.187,100.84.170.161,TLSv1.2,168,Application Data
290,34.8021887,100.84.170.161,151.101.2.187,TCP,54,64433  >  443 [ACK] Seq=87806 Ack=8200 Win=509 Len=0
291,35.1344242,100.84.170.161,151.101.2.187,TLSv1.2,2123,Application Data
292,35.1394129,100.84.170.161,151.101.2.187,TLSv1.2,476,Application Data
293,35.1448125,151.101.2.187,100.84.170.161,TCP,56,443  >  64433 [ACK] Seq=8200 Ack=89875 Win=1083 Len=0
294,35.1471504,151.101.2.187,100.84.170.161,TLSv1.2,131,Application Data
295,35.1486448,151.101.2.187,100.84.170.161,TCP,56,443  >  64433 [ACK] Seq=8277 Ack=90297 Win=1089 Len=0
296,35.1503888,151.101.2.187,100.84.170.161,TLSv1.2,396,Application Data
297,35.150459,100.84.170.161,151.101.2.187,TCP,54,64433  >  443 [ACK] Seq=90297 Ack=8619 Win=508 Len=0
298,35.3330452,100.84.170.161,151.101.2.187,TLSv1.2,2134,Application Data
299,35.3443001,151.101.2.187,100.84.170.161,TCP,56,443  >  64433 [ACK] Seq=8619 Ack=92377 Win=1100 Len=0
300,35.3464672,151.101.2.187,100.84.170.161,TLSv1.2,240,Application Data
301,35.374997,151.101.2.187,100.84.170.161,TCP,240,"[TCP Retransmission] 443  >  64433 [PSH, ACK] Seq=8619 Ack=92377 Win=1100 Len=186"
302,35.375031,100.84.170.161,151.101.2.187,TCP,66,64433  >  443 [ACK] Seq=92377 Ack=8805 Win=513 Len=0 SLE=8619 SRE=8805
303,35.678393,100.84.170.161,151.101.2.187,TLSv1.2,491,Application Data
304,35.6886088,151.101.2.187,100.84.170.161,TCP,56,443  >  64433 [ACK] Seq=8805 Ack=92814 Win=1106 Len=0
305,35.6916184,151.101.2.187,100.84.170.161,TLSv1.2,131,Application Data
306,35.7211265,151.101.2.187,100.84.170.161,TCP,131,"[TCP Retransmission] 443  >  64433 [PSH, ACK] Seq=8805 Ack=92814 Win=1106 Len=77"
307,35.7211577,100.84.170.161,151.101.2.187,TCP,66,64433  >  443 [ACK] Seq=92814 Ack=8882 Win=512 Len=0 SLE=8805 SRE=8882
308,38.8941797,100.84.170.161,151.101.2.187,TLSv1.2,2155,Application Data
309,38.915919,100.84.170.161,151.101.2.187,TLSv1.2,434,Application Data
310,38.9201843,100.84.170.161,151.101.2.187,TCP,1514,"[TCP Retransmission] 64433  >  443 [PSH, ACK] Seq=93835 Ack=8882 Win=512 Len=1460"
311,38.9246681,151.101.2.187,100.84.170.161,TCP,56,443  >  64433 [ACK] Seq=8882 Ack=94915 Win=1117 Len=0
312,38.9250243,151.101.2.187,100.84.170.161,TLSv1.2,214,Application Data
313,38.9331138,151.101.2.187,100.84.170.161,TCP,56,443  >  64433 [ACK] Seq=9042 Ack=95295 Win=1123 Len=0
314,38.9331138,151.101.2.187,100.84.170.161,TCP,66,[TCP Dup ACK 313#1] 443  >  64433 [ACK] Seq=9042 Ack=95295 Win=1123 Len=0 SLE=93835 SRE=95295
315,38.935637,151.101.2.187,100.84.170.161,TLSv1.2,98,Application Data
316,38.9357128,100.84.170.161,151.101.2.187,TCP,54,64433  >  443 [ACK] Seq=95295 Ack=9086 Win=512 Len=0
317,39.3746505,100.84.170.161,151.101.2.187,TLSv1.2,2162,Application Data
318,39.3839589,151.101.2.187,100.84.170.161,TCP,56,443  >  64433 [ACK] Seq=9086 Ack=97403 Win=1134 Len=0
319,39.3863997,151.101.2.187,100.84.170.161,TLSv1.2,208,Application Data
320,39.4210683,151.101.2.187,100.84.170.161,TCP,208,"[TCP Retransmission] 443  >  64433 [PSH, ACK] Seq=9086 Ack=97403 Win=1134 Len=154"
321,39.421104,100.84.170.161,151.101.2.187,TCP,66,64433  >  443 [ACK] Seq=97403 Ack=9240 Win=511 Len=0 SLE=9086 SRE=9240
322,39.7366458,100.84.170.161,151.101.2.187,TLSv1.2,405,Application Data
323,39.7457752,151.101.2.187,100.84.170.161,TCP,56,443  >  64433 [ACK] Seq=9240 Ack=97754 Win=1140 Len=0
324,39.7483781,151.101.2.187,100.84.170.161,TLSv1.2,98,Application Data
325,39.7831778,151.101.2.187,100.84.170.161,TCP,98,"[TCP Retransmission] 443  >  64433 [PSH, ACK] Seq=9240 Ack=97754 Win=1140 Len=44"
326,39.7832148,100.84.170.161,151.101.2.187,TCP,66,64433  >  443 [ACK] Seq=97754 Ack=9284 Win=511 Len=0 SLE=9240 SRE=9284
327,40.592925,100.84.170.161,151.101.2.187,TLSv1.2,2164,Application Data
328,40.5932388,100.84.170.161,151.101.2.187,TLSv1.2,445,Application Data
329,40.5939422,100.84.170.161,151.101.2.187,TLSv1.2,2146,Application Data
330,40.6008567,100.84.170.161,151.101.2.187,TLSv1.2,458,Application Data
331,40.6022327,151.101.2.187,100.84.170.161,TCP,56,443  >  64433 [ACK] Seq=9284 Ack=99864 Win=1151 Len=0
332,40.6025818,151.101.2.187,100.84.170.161,TCP,56,443  >  64433 [ACK] Seq=9284 Ack=100255 Win=1157 Len=0
333,40.6031871,151.101.2.187,100.84.170.161,TCP,56,443  >  64433 [ACK] Seq=9284 Ack=102347 Win=1169 Len=0
334,40.6057336,151.101.2.187,100.84.170.161,TLSv1.2,268,Application Data
335,40.6062151,151.101.2.187,100.84.170.161,TLSv1.2,130,Application Data
336,40.606266,100.84.170.161,151.101.2.187,TCP,54,64433  >  443 [ACK] Seq=102751 Ack=9574 Win=510 Len=0
337,40.6099204,151.101.2.187,100.84.170.161,TCP,56,443  >  64433 [ACK] Seq=9574 Ack=102751 Win=1174 Len=0
338,40.6128616,151.101.2.187,100.84.170.161,TLSv1.2,98,Application Data
339,40.6499135,151.101.2.187,100.84.170.161,TCP,98,"[TCP Retransmission] 443  >  64433 [PSH, ACK] Seq=9574 Ack=102751 Win=1174 Len=44"
340,40.6499503,100.84.170.161,151.101.2.187,TCP,66,64433  >  443 [ACK] Seq=102751 Ack=9618 Win=510 Len=0 SLE=9574 SRE=9618
341,40.7301524,100.84.170.161,151.101.2.187,TLSv1.2,2168,Application Data
342,40.7396516,151.101.2.187,100.84.170.161,TCP,56,443  >  64433 [ACK] Seq=9618 Ack=104865 Win=1186 Len=0
343,40.7420672,151.101.2.187,100.84.170.161,TLSv1.2,130,Application Data
344,40.77615,151.101.2.187,100.84.170.161,TCP,130,"[TCP Retransmission] 443  >  64433 [PSH, ACK] Seq=9618 Ack=104865 Win=1186 Len=76"
345,40.7761878,100.84.170.161,151.101.2.187,TCP,66,64433  >  443 [ACK] Seq=104865 Ack=9694 Win=509 Len=0 SLE=9618 SRE=9694
346,40.7933792,100.84.170.161,151.101.2.187,TLSv1.2,456,Application Data
347,40.7935384,100.84.170.161,151.101.2.187,TLSv1.2,2110,Application Data
348,40.8027208,151.101.2.187,100.84.170.161,TCP,56,443  >  64433 [ACK] Seq=9694 Ack=107323 Win=1203 Len=0
349,40.80526,151.101.2.187,100.84.170.161,TLSv1.2,174,Application Data
350,40.8055914,151.101.2.187,100.84.170.161,TLSv1.2,124,Application Data
351,40.8056284,100.84.170.161,151.101.2.187,TCP,54,64433  >  443 [ACK] Seq=107323 Ack=9884 Win=509 Len=0
352,40.8618719,100.84.170.161,151.101.2.187,TLSv1.2,504,Application Data
353,40.862031,100.84.170.161,151.101.2.187,TLSv1.2,2088,Application Data
354,40.8704607,100.84.170.161,151.101.2.187,TLSv1.2,482,Application Data
355,40.8716264,151.101.2.187,100.84.170.161,TCP,56,443  >  64433 [ACK] Seq=9884 Ack=107773 Win=1208 Len=0
356,40.8723773,151.101.2.187,100.84.170.161,TCP,56,443  >  64433 [ACK] Seq=9884 Ack=109807 Win=1220 Len=0
357,40.8734566,151.101.2.187,100.84.170.161,TLSv1.2,291,Application Data
358,40.8740598,151.101.2.187,100.84.170.161,TLSv1.2,124,Application Data
359,40.8740983,100.84.170.161,151.101.2.187,TCP,54,64433  >  443 [ACK] Seq=110235 Ack=10191 Win=507 Len=0
360,40.880814,151.101.2.187,100.84.170.161,TCP,56,443  >  64433 [ACK] Seq=10191 Ack=110235 Win=1226 Len=0
361,40.8832333,151.101.2.187,100.84.170.161,TLSv1.2,135,Application Data
362,40.9139783,151.101.2.187,100.84.170.161,TCP,135,"[TCP Retransmission] 443  >  64433 [PSH, ACK] Seq=10191 Ack=110235 Win=1226 Len=81"
363,40.9140237,100.84.170.161,151.101.2.187,TCP,66,64433  >  443 [ACK] Seq=110235 Ack=10272 Win=513 Len=0 SLE=10191 SRE=10272
364,41.1402465,100.84.170.161,151.101.2.187,TLSv1.2,2188,Application Data
365,41.1432167,100.84.170.161,151.101.2.187,TLSv1.2,455,Application Data
366,41.1500784,151.101.2.187,100.84.170.161,TCP,56,443  >  64433 [ACK] Seq=10272 Ack=112369 Win=1237 Len=0
367,41.1519248,151.101.2.187,100.84.170.161,TLSv1.2,131,Application Data
368,41.1524348,151.101.2.187,100.84.170.161,TCP,56,443  >  64433 [ACK] Seq=10349 Ack=112770 Win=1243 Len=0
369,41.1547313,151.101.2.187,100.84.170.161,TLSv1.2,125,Application Data
370,41.1548062,100.84.170.161,151.101.2.187,TCP,54,64433  >  443 [ACK] Seq=112770 Ack=10420 Win=512 Len=0
371,41.4107112,100.84.170.161,151.101.2.187,TLSv1.2,2205,Application Data
372,41.4209041,151.101.2.187,100.84.170.161,TCP,56,443  >  64433 [ACK] Seq=10420 Ack=114921 Win=1254 Len=0
373,41.4246087,151.101.2.187,100.84.170.161,TLSv1.2,235,Application Data
374,41.4548495,151.101.2.187,100.84.170.161,TCP,235,"[TCP Retransmission] 443  >  64433 [PSH, ACK] Seq=10420 Ack=114921 Win=1254 Len=181"
375,41.454889,100.84.170.161,151.101.2.187,TCP,66,64433  >  443 [ACK] Seq=114921 Ack=10601 Win=511 Len=0 SLE=10420 SRE=10601
376,41.8014175,100.84.170.161,151.101.2.187,TLSv1.2,466,Application Data
377,41.8125754,151.101.2.187,100.84.170.161,TCP,56,443  >  64433 [ACK] Seq=10601 Ack=115333 Win=1260 Len=0
378,41.8160332,151.101.2.187,100.84.170.161,TLSv1.2,124,Application Data
379,41.8469514,151.101.2.187,100.84.170.161,TCP,124,"[TCP Retransmission] 443  >  64433 [PSH, ACK] Seq=10601 Ack=115333 Win=1260 Len=70"
380,41.8470171,100.84.170.161,151.101.2.187,TCP,66,64433  >  443 [ACK] Seq=115333 Ack=10671 Win=511 Len=0 SLE=10601 SRE=10671
381,47.3575107,100.84.170.161,151.101.2.187,TLSv1.2,2273,Application Data
382,47.3583623,100.84.170.161,151.101.2.187,TLSv1.2,443,Application Data
383,47.3635796,100.84.170.161,151.101.2.187,TLSv1.2,2251,Application Data
384,47.3676437,151.101.2.187,100.84.170.161,TCP,56,443  >  64433 [ACK] Seq=10671 Ack=117941 Win=1277 Len=0
385,47.3712643,151.101.2.187,100.84.170.161,TLSv1.2,241,Application Data
386,47.3717524,151.101.2.187,100.84.170.161,TLSv1.2,104,Application Data
387,47.3717937,100.84.170.161,151.101.2.187,TCP,54,64433  >  443 [ACK] Seq=120138 Ack=10908 Win=510 Len=0
388,47.3729025,151.101.2.187,100.84.170.161,TCP,56,443  >  64433 [ACK] Seq=10908 Ack=120138 Win=1288 Len=0
389,47.3757805,151.101.2.187,100.84.170.161,TLSv1.2,124,Application Data
390,47.4102945,151.101.2.187,100.84.170.161,TCP,124,"[TCP Retransmission] 443  >  64433 [PSH, ACK] Seq=10908 Ack=120138 Win=1288 Len=70"
391,47.4104993,100.84.170.161,151.101.2.187,TCP,66,64433  >  443 [ACK] Seq=120138 Ack=10978 Win=510 Len=0 SLE=10908 SRE=10978
392,47.4237863,100.84.170.161,151.101.2.187,TLSv1.2,443,Application Data
393,47.4335302,151.101.2.187,100.84.170.161,TCP,56,443  >  64433 [ACK] Seq=10978 Ack=120527 Win=1294 Len=0
394,47.4356944,151.101.2.187,100.84.170.161,TLSv1.2,130,Application Data
395,47.4656545,151.101.2.187,100.84.170.161,TCP,130,"[TCP Retransmission] 443  >  64433 [PSH, ACK] Seq=10978 Ack=120527 Win=1294 Len=76"
396,47.4656933,100.84.170.161,151.101.2.187,TCP,66,64433  >  443 [ACK] Seq=120527 Ack=11054 Win=510 Len=0 SLE=10978 SRE=11054
397,47.5508081,100.84.170.161,151.101.2.187,TLSv1.2,2282,Application Data
398,47.5608968,151.101.2.187,100.84.170.161,TCP,56,443  >  64433 [ACK] Seq=11054 Ack=122755 Win=1305 Len=0
399,47.5641051,151.101.2.187,100.84.170.161,TLSv1.2,98,Application Data
400,47.5828826,100.84.170.161,151.101.2.187,TLSv1.2,440,Application Data
401,47.5840218,100.84.170.161,151.101.2.187,TLSv1.2,2282,Application Data
402,47.5927937,151.101.2.187,100.84.170.161,TCP,56,443  >  64433 [ACK] Seq=11098 Ack=123141 Win=1311 Len=0
403,47.5939287,151.101.2.187,100.84.170.161,TCP,56,443  >  64433 [ACK] Seq=11098 Ack=125369 Win=1323 Len=0
404,47.595276,151.101.2.187,100.84.170.161,TLSv1.2,125,Application Data
405,47.596382,151.101.2.187,100.84.170.161,TLSv1.2,130,Application Data
406,47.5964415,100.84.170.161,151.101.2.187,TCP,54,64433  >  443 [ACK] Seq=125369 Ack=11245 Win=509 Len=0
407,47.6834286,100.84.170.161,151.101.2.187,TLSv1.2,429,Application Data
408,47.7563478,151.101.2.187,100.84.170.161,TCP,56,443  >  64433 [ACK] Seq=11245 Ack=125744 Win=1328 Len=0
409,47.7566362,151.101.2.187,100.84.170.161,TLSv1.2,175,Application Data
410,47.7581976,151.101.2.187,100.84.170.161,TCP,175,"[TCP Retransmission] 443  >  64433 [PSH, ACK] Seq=11245 Ack=125744 Win=1328 Len=121"
411,47.7582426,100.84.170.161,151.101.2.187,TCP,66,64433  >  443 [ACK] Seq=125744 Ack=11366 Win=509 Len=0 SLE=11245 SRE=11366
412,47.9134321,100.84.170.161,151.101.2.187,TLSv1.2,2272,Application Data
413,47.9135952,100.84.170.161,151.101.2.187,TLSv1.2,442,Application Data
414,47.9137376,100.84.170.161,151.101.2.187,TLSv1.2,2268,Application Data
415,47.9138111,100.84.170.161,151.101.2.187,TLSv1.2,438,Application Data
416,47.9139112,100.84.170.161,151.101.2.187,TLSv1.2,2264,Application Data
417,47.9139989,100.84.170.161,151.101.2.187,TLSv1.2,449,Application Data
418,47.9141056,100.84.170.161,151.101.2.187,TLSv1.2,2252,Application Data
419,47.9156802,100.84.170.161,151.101.2.187,TLSv1.2,448,Application Data
420,47.925749,151.101.2.187,100.84.170.161,TCP,56,443  >  64433 [ACK] Seq=11366 Ack=128350 Win=1345 Len=0
421,47.9259739,151.101.2.187,100.84.170.161,TCP,56,443  >  64433 [ACK] Seq=11366 Ack=136145 Win=1397 Len=0
422,47.9316386,151.101.2.187,100.84.170.161,TLSv1.2,124,Application Data
423,47.932778,151.101.2.187,100.84.170.161,TLSv1.2,350,Application Data
424,47.9328347,100.84.170.161,151.101.2.187,TCP,54,64433  >  443 [ACK] Seq=136145 Ack=11732 Win=513 Len=0
425,47.9335459,151.101.2.187,100.84.170.161,TLSv1.2,130,Application Data
426,47.9338424,151.101.2.187,100.84.170.161,TLSv1.2,125,Application Data
427,47.9338738,100.84.170.161,151.101.2.187,TCP,54,64433  >  443 [ACK] Seq=136145 Ack=11879 Win=512 Len=0
428,47.9342167,151.101.2.187,100.84.170.161,TLSv1.2,125,Application Data
429,47.9348591,151.101.2.187,100.84.170.161,TLSv1.2,130,Application Data
430,47.934903,100.84.170.161,151.101.2.187,TCP,54,64433  >  443 [ACK] Seq=136145 Ack=12026 Win=512 Len=0
431,47.9351524,151.101.2.187,100.84.170.161,TLSv1.2,131,Application Data
432,47.9759063,151.101.2.187,100.84.170.161,TCP,131,"[TCP Retransmission] 443  >  64433 [PSH, ACK] Seq=12026 Ack=136145 Win=1397 Len=77"
433,47.9759307,100.84.170.161,151.101.2.187,TCP,66,64433  >  443 [ACK] Seq=136145 Ack=12103 Win=511 Len=0 SLE=12026 SRE=12103
434,56.3065333,100.84.170.161,151.101.2.187,TLSv1.2,2239,Application Data
435,56.3177158,151.101.2.187,100.84.170.161,TCP,56,443  >  64433 [ACK] Seq=12103 Ack=138330 Win=1408 Len=0
436,56.3214237,151.101.2.187,100.84.170.161,TLSv1.2,241,Application Data
437,56.3317416,100.84.170.161,151.101.2.187,TLSv1.2,434,Application Data
438,56.3409866,151.101.2.187,100.84.170.161,TCP,56,443  >  64433 [ACK] Seq=12290 Ack=138710 Win=1414 Len=0
439,56.3446265,151.101.2.187,100.84.170.161,TLSv1.2,125,Application Data
440,56.354604,100.84.170.161,151.101.2.187,TLSv1.2,2236,Application Data
441,56.3642913,151.101.2.187,100.84.170.161,TCP,56,443  >  64433 [ACK] Seq=12361 Ack=140892 Win=1425 Len=0
442,56.3671782,151.101.2.187,100.84.170.161,TLSv1.2,125,Application Data
443,56.4003805,151.101.2.187,100.84.170.161,TCP,125,"[TCP Retransmission] 443  >  64433 [PSH, ACK] Seq=12361 Ack=140892 Win=1425 Len=71"
444,56.4004164,100.84.170.161,151.101.2.187,TCP,66,64433  >  443 [ACK] Seq=140892 Ack=12432 Win=510 Len=0 SLE=12361 SRE=12432
445,56.7934751,100.84.170.161,151.101.2.187,TLSv1.2,445,Application Data
446,56.7952646,100.84.170.161,151.101.2.187,TLSv1.2,2220,Application Data
447,56.8043928,151.101.2.187,100.84.170.161,TCP,56,443  >  64433 [ACK] Seq=12432 Ack=141283 Win=1431 Len=0
448,56.8046574,151.101.2.187,100.84.170.161,TCP,56,443  >  64433 [ACK] Seq=12432 Ack=143449 Win=1442 Len=0
449,56.8069755,151.101.2.187,100.84.170.161,TLSv1.2,130,Application Data
450,56.8073267,151.101.2.187,100.84.170.161,TLSv1.2,130,Application Data
451,56.8073832,100.84.170.161,151.101.2.187,TCP,54,64433  >  443 [ACK] Seq=143449 Ack=12584 Win=509 Len=0
452,56.9296801,100.84.170.161,151.101.2.187,TLSv1.2,461,Application Data
453,56.9402026,151.101.2.187,100.84.170.161,TCP,56,443  >  64433 [ACK] Seq=12584 Ack=143856 Win=1448 Len=0
454,56.9422884,151.101.2.187,100.84.170.161,TLSv1.2,174,Application Data
455,56.972989,151.101.2.187,100.84.170.161,TCP,174,"[TCP Retransmission] 443  >  64433 [PSH, ACK] Seq=12584 Ack=143856 Win=1448 Len=120"
456,56.9730302,100.84.170.161,151.101.2.187,TCP,66,64433  >  443 [ACK] Seq=143856 Ack=12704 Win=509 Len=0 SLE=12584 SRE=12704
457,58.114039,100.84.170.161,151.101.2.187,TLSv1.2,2226,Application Data
458,58.1156554,100.84.170.161,151.101.2.187,TLSv1.2,452,Application Data
459,58.1169955,100.84.170.161,151.101.2.187,TLSv1.2,2198,Application Data
460,58.1236554,151.101.2.187,100.84.170.161,TCP,56,443  >  64433 [ACK] Seq=12704 Ack=146028 Win=1459 Len=0
461,58.1250286,151.101.2.187,100.84.170.161,TCP,56,443  >  64433 [ACK] Seq=12704 Ack=146426 Win=1465 Len=0
462,58.1261874,151.101.2.187,100.84.170.161,TLSv1.2,401,Application Data
463,58.1275457,151.101.2.187,100.84.170.161,TLSv1.2,135,Application Data
464,58.1276015,100.84.170.161,151.101.2.187,TCP,54,64433  >  443 [ACK] Seq=148570 Ack=13132 Win=507 Len=0
465,58.1289486,151.101.2.187,100.84.170.161,TLSv1.2,130,Application Data
466,58.1670677,151.101.2.187,100.84.170.161,TCP,130,"[TCP Retransmission] 443  >  64433 [PSH, ACK] Seq=13132 Ack=148570 Win=1476 Len=76"
467,58.167109,100.84.170.161,151.101.2.187,TCP,66,64433  >  443 [ACK] Seq=148570 Ack=13208 Win=513 Len=0 SLE=13132 SRE=13208
468,58.3769674,100.84.170.161,151.101.2.187,TLSv1.2,456,Application Data
469,58.3864527,151.101.2.187,100.84.170.161,TCP,56,443  >  64433 [ACK] Seq=13208 Ack=148972 Win=1482 Len=0
470,58.3887728,151.101.2.187,100.84.170.161,TLSv1.2,240,Application Data
471,58.3888047,100.84.170.161,151.101.2.187,TLSv1.2,2192,Application Data
472,58.3889552,100.84.170.161,151.101.2.187,TLSv1.2,472,Application Data
473,58.3979471,151.101.2.187,100.84.170.161,TCP,56,443  >  64433 [ACK] Seq=13394 Ack=151110 Win=1494 Len=0
474,58.3982465,151.101.2.187,100.84.170.161,TCP,56,443  >  64433 [ACK] Seq=13394 Ack=151528 Win=1499 Len=0
475,58.4002039,151.101.2.187,100.84.170.161,TLSv1.2,124,Application Data
476,58.4005797,151.101.2.187,100.84.170.161,TLSv1.2,124,Application Data
477,58.4006391,100.84.170.161,151.101.2.187,TCP,54,64433  >  443 [ACK] Seq=151528 Ack=13534 Win=512 Len=0
