"No.","Time","Source","Destination","Protocol","Length","Info"
"1","0.000000000","100.84.170.161","151.101.2.187","TLSv1.2","2632","Application Data"
"2","0.000176700","100.84.170.161","151.101.2.187","TLSv1.2","93","Application Data"
"3","0.010162000","151.101.2.187","100.84.170.161","TCP","56","443  >  64433 [ACK] Seq=1 Ack=2618 Win=3992 Len=0"
"4","0.010369100","151.101.2.187","100.84.170.161","TLSv1.2","93","Application Data"
"5","0.039085200","151.101.2.187","100.84.170.161","TCP","93","[TCP Retransmission] 443  >  64433 [PSH, ACK] Seq=1 Ack=2618 Win=3992 Len=39"
"6","0.039139600","100.84.170.161","151.101.2.187","TCP","66","64433  >  443 [ACK] Seq=2618 Ack=40 Win=8207 Len=0 SLE=1 SRE=40"
"7","0.263183200","151.101.2.187","100.84.170.161","TCP","1510","443  >  64433 [ACK] Seq=40 Ack=2618 Win=3992 Len=1456 [TCP PDU reassembled in 8]"
"8","0.263183200","151.101.2.187","100.84.170.161","TLSv1.2","198","Application Data"
"9","0.263183200","151.101.2.187","100.84.170.161","TCP","198","[TCP Retransmission] 443  >  64433 [PSH, ACK] Seq=1496 Ack=2618 Win=3992 Len=144 [TCP PDU reassembled in 8]"
"10","0.263183200","151.101.2.187","100.84.170.161","TLSv1.2","116","Application Data"
"11","0.263183200","151.101.2.187","100.84.170.161","TLSv1.2","725","Application Data"
"12","0.263183200","151.101.2.187","100.84.170.161","TCP","1510","443  >  64433 [ACK] Seq=2373 Ack=2618 Win=3992 Len=1456 [TCP PDU reassembled in 13]"
"13","0.263183200","151.101.2.187","100.84.170.161","TLSv1.2","512","Application Data"
"14","0.263183200","151.101.2.187","100.84.170.161","TCP","1510","443  >  64433 [ACK] Seq=4287 Ack=2618 Win=3992 Len=1456 [TCP PDU reassembled in 15]"
"15","0.263183200","151.101.2.187","100.84.170.161","TLSv1.2","412","Application Data"
"16","0.263183200","151.101.2.187","100.84.170.161","TCP","1510","443  >  64433 [ACK] Seq=6101 Ack=2618 Win=3992 Len=1456 [TCP PDU reassembled in 17]"
"17","0.263183200","151.101.2.187","100.84.170.161","TLSv1.2","146","Application Data"
"18","0.263183200","151.101.2.187","100.84.170.161","TLSv1.2","355","Application Data"
"19","0.263183200","151.101.2.187","100.84.170.161","TLSv1.2","497","Application Data"
"20","0.263387100","100.84.170.161","151.101.2.187","TCP","66","64433  >  443 [ACK] Seq=2618 Ack=1640 Win=8212 Len=0 SLE=1496 SRE=1640"
"21","0.263543400","100.84.170.161","151.101.2.187","TCP","54","64433  >  443 [ACK] Seq=2618 Ack=8393 Win=8212 Len=0"
"22","0.263755200","151.101.2.187","100.84.170.161","TLSv1.2","85","Application Data"
"23","0.266481200","100.84.170.161","151.101.2.187","TLSv1.2","89","Application Data"
"24","0.275653000","151.101.2.187","100.84.170.161","TCP","56","443  >  64433 [ACK] Seq=8424 Ack=2653 Win=3992 Len=0"
"25","0.410204200","100.84.170.161","151.101.2.187","TLSv1.2","2454","Application Data"
"26","0.420159300","151.101.2.187","100.84.170.161","TCP","56","443  >  64433 [ACK] Seq=8424 Ack=5053 Win=4003 Len=0"
"27","0.425434500","151.101.2.187","100.84.170.161","TLSv1.2","181","Application Data"
"28","0.450396300","100.84.170.161","151.101.2.187","TLSv1.2","2453","Application Data"
"29","0.451134900","100.84.170.161","151.101.2.187","TLSv1.2","2451","Application Data"
"30","0.451667400","100.84.170.161","151.101.2.187","TLSv1.2","2448","Application Data"
"31","0.460973600","151.101.2.187","100.84.170.161","TCP","56","443  >  64433 [ACK] Seq=8551 Ack=7452 Win=4015 Len=0"
"32","0.461236800","151.101.2.187","100.84.170.161","TCP","56","443  >  64433 [ACK] Seq=8551 Ack=9849 Win=4026 Len=0"
"33","0.461414200","100.84.170.161","151.101.2.187","TLSv1.2","2448","Application Data"
"34","0.461538700","151.101.2.187","100.84.170.161","TCP","56","443  >  64433 [ACK] Seq=8551 Ack=12243 Win=4038 Len=0"
"35","0.462906500","151.101.2.187","100.84.170.161","TLSv1.2","130","Application Data"
"36","0.463298900","151.101.2.187","100.84.170.161","TLSv1.2","131","Application Data"
"37","0.463345100","100.84.170.161","151.101.2.187","TCP","54","64433  >  443 [ACK] Seq=14637 Ack=8704 Win=8211 Len=0"
"38","0.463663100","151.101.2.187","100.84.170.161","TLSv1.2","130","Application Data"
"39","0.471015000","151.101.2.187","100.84.170.161","TCP","56","443  >  64433 [ACK] Seq=8780 Ack=14637 Win=4049 Len=0"
"40","0.474119700","151.101.2.187","100.84.170.161","TLSv1.2","125","Application Data"
"41","0.474210400","100.84.170.161","151.101.2.187","TCP","54","64433  >  443 [ACK] Seq=14637 Ack=8851 Win=8210 Len=0"
"42","5.933739800","100.84.170.161","151.101.2.187","TLSv1.2","2429","Application Data"
"43","5.943146400","151.101.2.187","100.84.170.161","TCP","56","443  >  64433 [ACK] Seq=8851 Ack=17012 Win=4061 Len=0"
"44","5.945880700","151.101.2.187","100.84.170.161","TLSv1.2","241","Application Data"
"45","5.987719900","151.101.2.187","100.84.170.161","TCP","241","[TCP Retransmission] 443  >  64433 [PSH, ACK] Seq=8851 Ack=17012 Win=4061 Len=187"
"46","5.987765100","100.84.170.161","151.101.2.187","TCP","66","64433  >  443 [ACK] Seq=17012 Ack=9038 Win=8209 Len=0 SLE=8851 SRE=9038"
"47","10.941766500","100.84.170.161","151.101.2.187","TLSv1.2","2434","Application Data"
"48","10.951574200","151.101.2.187","100.84.170.161","TCP","56","443  >  64433 [ACK] Seq=9038 Ack=19392 Win=4072 Len=0"
"49","10.954044700","151.101.2.187","100.84.170.161","TLSv1.2","219","Application Data"
"50","10.995362200","100.84.170.161","151.101.2.187","TCP","54","64433  >  443 [ACK] Seq=19392 Ack=9203 Win=8209 Len=0"
"51","10.996282000","151.101.2.187","100.84.170.161","TCP","219","[TCP Spurious Retransmission] 443  >  64433 [PSH, ACK] Seq=9038 Ack=19392 Win=4072 Len=165"
"52","10.996345800","100.84.170.161","151.101.2.187","TCP","66","[TCP Dup ACK 50#1] 64433  >  443 [ACK] Seq=19392 Ack=9203 Win=8209 Len=0 SLE=9038 SRE=9203"
"53","17.061319800","100.84.170.161","151.101.2.187","TLSv1.2","2375","Application Data"
"54","17.061722000","100.84.170.161","151.101.2.187","TLSv1.2","2434","Application Data"
"55","17.070698500","151.101.2.187","100.84.170.161","TCP","56","443  >  64433 [ACK] Seq=9203 Ack=24093 Win=4095 Len=0"
"56","17.073531300","151.101.2.187","100.84.170.161","TLSv1.2","439","Application Data"
"57","17.073854500","151.101.2.187","100.84.170.161","TLSv1.2","258","Application Data"
"58","17.073895300","100.84.170.161","151.101.2.187","TCP","54","64433  >  443 [ACK] Seq=24093 Ack=9792 Win=8207 Len=0"
"59","17.074160500","151.101.2.187","100.84.170.161","TLSv1.2","104","Application Data"
"60","17.078675500","100.84.170.161","151.101.2.187","TLSv1.2","89","Application Data"
"61","17.087679300","151.101.2.187","100.84.170.161","TCP","56","443  >  64433 [ACK] Seq=9842 Ack=24128 Win=4095 Len=0"
"62","17.088260000","100.84.170.161","151.101.2.187","TLSv1.2","2428","Application Data"
"63","17.088413600","100.84.170.161","151.101.2.187","TLSv1.2","2425","Application Data"
"64","17.097503500","151.101.2.187","100.84.170.161","TCP","56","443  >  64433 [ACK] Seq=9842 Ack=26502 Win=4106 Len=0"
"65","17.097977300","151.101.2.187","100.84.170.161","TCP","56","443  >  64433 [ACK] Seq=9842 Ack=28873 Win=4118 Len=0"
"66","17.101731000","151.101.2.187","100.84.170.161","TLSv1.2","124","Application Data"
"67","17.102079600","151.101.2.187","100.84.170.161","TLSv1.2","130","Application Data"
"68","17.102122600","100.84.170.161","151.101.2.187","TCP","54","64433  >  443 [ACK] Seq=28873 Ack=9988 Win=8212 Len=0"
"69","17.165116300","100.84.170.161","151.101.2.187","TLSv1.2","2631","Application Data"
"70","17.166003600","100.84.170.161","151.101.2.187","TLSv1.2","2622","Application Data"
"71","17.166289200","100.84.170.161","151.101.2.187","TLSv1.2","2621","Application Data"
"72","17.166385600","100.84.170.161","151.101.2.187","TLSv1.2","2620","Application Data"
"73","17.167816000","100.84.170.161","151.101.2.187","TLSv1.2","2620","Application Data"
"74","17.174626100","151.101.2.187","100.84.170.161","TCP","56","443  >  64433 [ACK] Seq=9988 Ack=31450 Win=4129 Len=0"
"75","17.175225100","151.101.2.187","100.84.170.161","TCP","56","443  >  64433 [ACK] Seq=9988 Ack=34018 Win=4140 Len=0"
"76","17.175841500","151.101.2.187","100.84.170.161","TCP","56","443  >  64433 [ACK] Seq=9988 Ack=39151 Win=4163 Len=0"
"77","17.177191700","151.101.2.187","100.84.170.161","TCP","56","443  >  64433 [ACK] Seq=9988 Ack=41717 Win=4175 Len=0"
"78","17.777798700","151.101.2.187","100.84.170.161","TCP","14614","443  >  64433 [ACK] Seq=9988 Ack=41717 Win=4175 Len=14560 [TCP PDU reassembled in 79]"
"79","17.777798700","151.101.2.187","100.84.170.161","TLSv1.2","1350","Application Data"
"80","17.777798700","151.101.2.187","100.84.170.161","TLSv1.2","32086","Application Data"
"81","17.777798700","151.101.2.187","100.84.170.161","TLSv1.2","656","Application Data"
"82","17.777798700","151.101.2.187","100.84.170.161","TLSv1.2","29174","Application Data"
"83","17.777798700","151.101.2.187","100.84.170.161","TLSv1.2","91","Application Data"
"84","17.777798700","151.101.2.187","100.84.170.161","TLSv1.2","46646","Application Data, Application Data"
"85","17.777798700","151.101.2.187","100.84.170.161","TLSv1.2","923","Application Data"
"86","17.777798700","151.101.2.187","100.84.170.161","TCP","923","[TCP Retransmission] 443  >  64433 [PSH, ACK] Seq=134227 Ack=41717 Win=4175 Len=869 [TCP PDU reassembled in 85]"
"87","17.778057800","100.84.170.161","151.101.2.187","TCP","66","64433  >  443 [ACK] Seq=41717 Ack=135096 Win=8212 Len=0 SLE=134227 SRE=135096"
"88","17.824468600","151.101.2.187","100.84.170.161","TLSv1.2","114","Application Data"
"89","17.825033800","151.101.2.187","100.84.170.161","TCP","1510","443  >  64433 [ACK] Seq=135156 Ack=41717 Win=4175 Len=1456 [TCP PDU reassembled in 91]"
"90","17.825083100","100.84.170.161","151.101.2.187","TCP","54","64433  >  443 [ACK] Seq=41717 Ack=136612 Win=8212 Len=0"
"91","17.827952700","151.101.2.187","100.84.170.161","TLSv1.2","53926","Application Data, Application Data, Application Data"
"92","17.827952700","151.101.2.187","100.84.170.161","TLSv1.2","365","Application Data"
"93","17.827952700","151.101.2.187","100.84.170.161","TLSv1.2","8790","Application Data"
"94","17.827952700","151.101.2.187","100.84.170.161","TLSv1.2","970","Application Data, Application Data"
"95","17.828066500","100.84.170.161","151.101.2.187","TCP","54","64433  >  443 [ACK] Seq=41717 Ack=200447 Win=8212 Len=0"
"96","17.830284000","151.101.2.187","100.84.170.161","TLSv1.2","114","Application Data"
"97","17.830284000","151.101.2.187","100.84.170.161","TLSv1.2","61206","Application Data, Application Data, Application Data"
"98","17.830284000","151.101.2.187","100.84.170.161","TLSv1.2","1062","Application Data"
"99","17.830284000","151.101.2.187","100.84.170.161","TCP","1510","443  >  64433 [ACK] Seq=262667 Ack=41717 Win=4175 Len=1456 [TCP PDU reassembled in 100]"
"100","17.830284000","151.101.2.187","100.84.170.161","TLSv1.2","107","Application Data"
"101","17.830409300","100.84.170.161","151.101.2.187","TCP","54","64433  >  443 [ACK] Seq=41717 Ack=264176 Win=8212 Len=0"
"102","17.830635300","151.101.2.187","100.84.170.161","TLSv1.2","85","Application Data"
"103","17.830674700","100.84.170.161","151.101.2.187","TCP","54","64433  >  443 [ACK] Seq=41717 Ack=264207 Win=8212 Len=0"
"104","17.838533300","100.84.170.161","151.101.2.187","TLSv1.2","2625","Application Data"
"105","17.838823400","100.84.170.161","151.101.2.187","TLSv1.2","2637","Application Data"
"106","17.847947600","151.101.2.187","100.84.170.161","TCP","56","443  >  64433 [ACK] Seq=264207 Ack=44288 Win=4186 Len=0"
"107","17.848302600","151.101.2.187","100.84.170.161","TCP","56","443  >  64433 [ACK] Seq=264207 Ack=46871 Win=4197 Len=0"
"108","17.870136400","100.84.170.161","151.101.2.187","TLSv1.2","2626","Application Data"
"109","17.873638900","100.84.170.161","151.101.2.187","TLSv1.2","2630","Application Data"
"110","17.879997600","151.101.2.187","100.84.170.161","TCP","56","443  >  64433 [ACK] Seq=264207 Ack=49443 Win=4209 Len=0"
"111","17.884853400","151.101.2.187","100.84.170.161","TCP","56","443  >  64433 [ACK] Seq=264207 Ack=52019 Win=4220 Len=0"
"112","17.923054800","151.101.2.187","100.84.170.161","TLSv1.2","115","Application Data"
"113","17.923745500","151.101.2.187","100.84.170.161","TCP","1510","443  >  64433 [ACK] Seq=264268 Ack=52019 Win=4220 Len=1456 [TCP PDU reassembled in 115]"
"114","17.923792700","100.84.170.161","151.101.2.187","TCP","54","64433  >  443 [ACK] Seq=52019 Ack=265724 Win=8212 Len=0"
"115","17.927062700","151.101.2.187","100.84.170.161","TLSv1.2","33542","Application Data, Application Data"
"116","17.927062700","151.101.2.187","100.84.170.161","TLSv1.2","756","Application Data"
"117","17.927062700","151.101.2.187","100.84.170.161","TCP","2966","443  >  64433 [ACK] Seq=299914 Ack=52019 Win=4220 Len=2912 [TCP PDU reassembled in 118]"
"118","17.927062700","151.101.2.187","100.84.170.161","TLSv1.2","1252","Application Data"
"119","17.927062700","151.101.2.187","100.84.170.161","TCP","8790","443  >  64433 [ACK] Seq=304024 Ack=52019 Win=4220 Len=8736 [TCP PDU reassembled in 120]"
"120","17.927062700","151.101.2.187","100.84.170.161","TLSv1.2","869","Application Data"
"121","17.927062700","151.101.2.187","100.84.170.161","TCP","7334","443  >  64433 [ACK] Seq=313575 Ack=52019 Win=4220 Len=7280 [TCP PDU reassembled in 122]"
"122","17.927062700","151.101.2.187","100.84.170.161","TLSv1.2","892","Application Data"
"123","17.927062700","151.101.2.187","100.84.170.161","TCP","7334","443  >  64433 [ACK] Seq=321693 Ack=52019 Win=4220 Len=7280 [TCP PDU reassembled in 124]"
"124","17.927062700","151.101.2.187","100.84.170.161","TLSv1.2","120","Application Data"
"125","17.927249200","100.84.170.161","151.101.2.187","TCP","54","64433  >  443 [ACK] Seq=52019 Ack=329039 Win=8212 Len=0"
"126","17.936683800","100.84.170.161","151.101.2.187","TLSv1.2","2613","Application Data"
"127","17.949300600","151.101.2.187","100.84.170.161","TLSv1.2","158","Application Data"
"128","17.956381800","100.84.170.161","151.101.2.187","TLSv1.2","2626","Application Data"
"129","17.966354500","151.101.2.187","100.84.170.161","TCP","56","443  >  64433 [ACK] Seq=329143 Ack=57150 Win=4243 Len=0"
"130","18.497902600","151.101.2.187","100.84.170.161","TLSv1.2","218","Application Data"
"131","18.497902600","151.101.2.187","100.84.170.161","TLSv1.2","43734","Application Data, Application Data"
"132","18.497902600","151.101.2.187","100.84.170.161","TLSv1.2","466","Application Data"
"133","18.497902600","151.101.2.187","100.84.170.161","TLSv1.2","114","Application Data"
"134","18.497902600","151.101.2.187","100.84.170.161","TLSv1.2","34998","Application Data, Application Data"
"135","18.497902600","151.101.2.187","100.84.170.161","TLSv1.2","628","Application Data"
"136","18.497902600","151.101.2.187","100.84.170.161","TLSv1.2","115","Application Data"
"137","18.497902600","151.101.2.187","100.84.170.161","TLSv1.2","39366","Application Data, Application Data"
"138","18.497902600","151.101.2.187","100.84.170.161","TLSv1.2","721","Application Data"
"139","18.497902600","151.101.2.187","100.84.170.161","TCP","7334","443  >  64433 [ACK] Seq=449017 Ack=57150 Win=4243 Len=7280 [TCP PDU reassembled in 140]"
"140","18.497902600","151.101.2.187","100.84.170.161","TLSv1.2","1030","Application Data"
"141","18.497902600","151.101.2.187","100.84.170.161","TCP","16070","443  >  64433 [ACK] Seq=457273 Ack=57150 Win=4243 Len=16016 [TCP PDU reassembled in 142]"
"142","18.497902600","151.101.2.187","100.84.170.161","TLSv1.2","475","Application Data, Application Data"
"143","18.497902600","151.101.2.187","100.84.170.161","TCP","16070","443  >  64433 [ACK] Seq=473710 Ack=57150 Win=4243 Len=16016 [TCP PDU reassembled in 144]"
"144","18.497902600","151.101.2.187","100.84.170.161","TLSv1.2","475","Application Data, Application Data"
"145","18.497902600","151.101.2.187","100.84.170.161","TCP","16070","443  >  64433 [ACK] Seq=490147 Ack=57150 Win=4243 Len=16016 [TCP PDU reassembled in 147]"
"146","18.498379600","100.84.170.161","151.101.2.187","TCP","54","64433  >  443 [ACK] Seq=57150 Ack=506163 Win=8212 Len=0"
"147","18.499503500","151.101.2.187","100.84.170.161","TLSv1.2","329","Application Data"
"148","18.499503500","151.101.2.187","100.84.170.161","TCP","11702","443  >  64433 [ACK] Seq=506438 Ack=57150 Win=4243 Len=11648 [TCP PDU reassembled in 149]"
"149","18.499503500","151.101.2.187","100.84.170.161","TLSv1.2","439","Application Data"
"150","18.499503500","151.101.2.187","100.84.170.161","TLSv1.2","188","Application Data"
"151","18.499503500","151.101.2.187","100.84.170.161","TLSv1.2","21894","Application Data"
"152","18.499503500","151.101.2.187","100.84.170.161","TLSv1.2","895","Application Data"
"153","18.499503500","151.101.2.187","100.84.170.161","TCP","2966","443  >  64433 [ACK] Seq=541286 Ack=57150 Win=4243 Len=2912 [TCP PDU reassembled in 154]"
"154","18.499503500","151.101.2.187","100.84.170.161","TLSv1.2","68","Application Data"
"155","18.499503500","151.101.2.187","100.84.170.161","TCP","16070","443  >  64433 [ACK] Seq=544212 Ack=57150 Win=4243 Len=16016 [TCP PDU reassembled in 156]"
"156","18.499503500","151.101.2.187","100.84.170.161","TLSv1.2","334","Application Data"
"157","18.499503500","151.101.2.187","100.84.170.161","TCP","334","[TCP Retransmission] 443  >  64433 [PSH, ACK] Seq=560228 Ack=57150 Win=4243 Len=280 [TCP PDU reassembled in 156]"
"158","18.499751300","100.84.170.161","151.101.2.187","TCP","66","64433  >  443 [ACK] Seq=57150 Ack=560508 Win=8000 Len=0 SLE=560228 SRE=560508"
"159","18.501689700","100.84.170.161","151.101.2.187","TCP","54","[TCP Window Update] 64433  >  443 [ACK] Seq=57150 Ack=560508 Win=8212 Len=0"
"160","18.543601100","100.84.170.161","151.101.2.187","TLSv1.2","2622","Application Data"
"161","18.550700500","100.84.170.161","151.101.2.187","TLSv1.2","2635","Application Data"
"162","18.553262200","100.84.170.161","151.101.2.187","TLSv1.2","2624","Application Data"
"163","18.553487200","151.101.2.187","100.84.170.161","TCP","56","443  >  64433 [ACK] Seq=560508 Ack=59718 Win=4254 Len=0"
"164","18.560324300","151.101.2.187","100.84.170.161","TCP","56","443  >  64433 [ACK] Seq=560508 Ack=62299 Win=4266 Len=0"
"165","18.562761200","151.101.2.187","100.84.170.161","TCP","56","443  >  64433 [ACK] Seq=560508 Ack=64869 Win=4277 Len=0"
"166","18.751349100","100.84.170.161","151.101.2.187","TLSv1.2","2623","Application Data"
"167","18.762158600","151.101.2.187","100.84.170.161","TCP","56","443  >  64433 [ACK] Seq=560508 Ack=67438 Win=4289 Len=0"
"168","19.107271000","151.101.2.187","100.84.170.161","TLSv1.2","394","Application Data"
"169","19.107271000","151.101.2.187","100.84.170.161","TLSv1.2","23350","Application Data"
"170","19.107271000","151.101.2.187","100.84.170.161","TLSv1.2","1368","Application Data"
"171","19.107271000","151.101.2.187","100.84.170.161","TCP","16070","443  >  64433 [ACK] Seq=585458 Ack=67438 Win=4289 Len=16016 [TCP PDU reassembled in 172]"
"172","19.107271000","151.101.2.187","100.84.170.161","TLSv1.2","475","Application Data, Application Data"
"173","19.107271000","151.101.2.187","100.84.170.161","TLSv1.2","29174","Application Data"
"174","19.107271000","151.101.2.187","100.84.170.161","TLSv1.2","317","Application Data"
"175","19.107561100","100.84.170.161","151.101.2.187","TCP","54","64433  >  443 [ACK] Seq=67438 Ack=631278 Win=8212 Len=0"
"176","19.185805400","151.101.2.187","100.84.170.161","TCP","1510","443  >  64433 [ACK] Seq=631278 Ack=67438 Win=4289 Len=1456 [TCP PDU reassembled in 180]"
"177","19.185911000","151.101.2.187","100.84.170.161","TCP","1510","443  >  64433 [ACK] Seq=632734 Ack=67438 Win=4289 Len=1456 [TCP PDU reassembled in 180]"
"178","19.185938200","100.84.170.161","151.101.2.187","TCP","54","64433  >  443 [ACK] Seq=67438 Ack=634190 Win=8212 Len=0"
"179","19.188675200","151.101.2.187","100.84.170.161","TCP","11702","443  >  64433 [ACK] Seq=634190 Ack=67438 Win=4289 Len=11648 [TCP PDU reassembled in 180]"
"180","19.188675200","151.101.2.187","100.84.170.161","TLSv1.2","1046","Application Data"
"181","19.188675200","151.101.2.187","100.84.170.161","TLSv1.2","20438","Application Data"
"182","19.188675200","151.101.2.187","100.84.170.161","TLSv1.2","1116","Application Data"
"183","19.188675200","151.101.2.187","100.84.170.161","TCP","16070","443  >  64433 [ACK] Seq=668276 Ack=67438 Win=4289 Len=16016 [TCP PDU reassembled in 184]"
"184","19.188675200","151.101.2.187","100.84.170.161","TLSv1.2","475","Application Data, Application Data"
"185","19.188675200","151.101.2.187","100.84.170.161","TLSv1.2","21894","Application Data, Application Data"
"186","19.188675200","151.101.2.187","100.84.170.161","TLSv1.2","1112","Application Data"
"187","19.188675200","151.101.2.187","100.84.170.161","TLSv1.2","85","Application Data"
"188","19.188904100","100.84.170.161","151.101.2.187","TCP","54","64433  >  443 [ACK] Seq=67438 Ack=707642 Win=8212 Len=0"
"189","19.193435300","151.101.2.187","100.84.170.161","TLSv1.2","151","Application Data"
"190","19.193522700","100.84.170.161","151.101.2.187","TCP","54","64433  >  443 [ACK] Seq=67438 Ack=707739 Win=8212 Len=0"
"191","19.194436200","151.101.2.187","100.84.170.161","TCP","1510","443  >  64433 [ACK] Seq=707739 Ack=67438 Win=4289 Len=1456 [TCP PDU reassembled in 192]"
"192","19.195755000","151.101.2.187","100.84.170.161","TLSv1.2","24806","Application Data"
"193","19.195755000","151.101.2.187","100.84.170.161","TLSv1.2","569","Application Data"
"194","19.195863300","100.84.170.161","151.101.2.187","TCP","54","64433  >  443 [ACK] Seq=67438 Ack=734462 Win=8212 Len=0"
"195","19.196936500","151.101.2.187","100.84.170.161","TCP","16070","443  >  64433 [ACK] Seq=734462 Ack=67438 Win=4289 Len=16016 [TCP PDU reassembled in 196]"
"196","19.196936500","151.101.2.187","100.84.170.161","TLSv1.2","475","Application Data, Application Data"
"197","19.196936500","151.101.2.187","100.84.170.161","TCP","11702","443  >  64433 [ACK] Seq=750899 Ack=67438 Win=4289 Len=11648 [TCP PDU reassembled in 198]"
"198","19.196936500","151.101.2.187","100.84.170.161","TLSv1.2","1353","Application Data"
"199","19.197054300","100.84.170.161","151.101.2.187","TCP","54","64433  >  443 [ACK] Seq=67438 Ack=763846 Win=8212 Len=0"
"200","19.199951100","151.101.2.187","100.84.170.161","TCP","1510","443  >  64433 [ACK] Seq=763846 Ack=67438 Win=4289 Len=1456 [TCP PDU reassembled in 203]"
"201","19.200274800","151.101.2.187","100.84.170.161","TCP","1510","443  >  64433 [ACK] Seq=765302 Ack=67438 Win=4289 Len=1456 [TCP PDU reassembled in 203]"
"202","19.200334500","100.84.170.161","151.101.2.187","TCP","54","64433  >  443 [ACK] Seq=67438 Ack=766758 Win=8212 Len=0"
"203","19.200567000","151.101.2.187","100.84.170.161","TLSv1.2","650","Application Data"
"204","19.217048000","151.101.2.187","100.84.170.161","TLSv1.2","184","Application Data"
"205","19.217142700","100.84.170.161","151.101.2.187","TCP","54","64433  >  443 [ACK] Seq=67438 Ack=767484 Win=8209 Len=0"
"206","19.217368700","151.101.2.187","100.84.170.161","TCP","1510","443  >  64433 [ACK] Seq=767484 Ack=67438 Win=4289 Len=1456 [TCP PDU reassembled in 207]"
"207","19.219015700","151.101.2.187","100.84.170.161","TLSv1.2","29174","Application Data"
"208","19.219015700","151.101.2.187","100.84.170.161","TLSv1.2","841","Application Data"
"209","19.219015700","151.101.2.187","100.84.170.161","TCP","5878","443  >  64433 [ACK] Seq=798847 Ack=67438 Win=4289 Len=5824 [TCP PDU reassembled in 210]"
"210","19.219015700","151.101.2.187","100.84.170.161","TLSv1.2","372","Application Data"
"211","19.219015700","151.101.2.187","100.84.170.161","TCP","1510","443  >  64433 [ACK] Seq=804989 Ack=67438 Win=4289 Len=1456 [TCP PDU reassembled in 212]"
"212","19.219015700","151.101.2.187","100.84.170.161","TLSv1.2","1109","Application Data"
"213","19.219015700","151.101.2.187","100.84.170.161","TLSv1.2","85","Application Data"
"214","19.219173700","100.84.170.161","151.101.2.187","TCP","54","64433  >  443 [ACK] Seq=67438 Ack=807531 Win=8212 Len=0"
"215","19.323329000","100.84.170.161","151.101.2.187","TLSv1.2","2453","Application Data"
"216","19.335204000","151.101.2.187","100.84.170.161","TCP","56","443  >  64433 [ACK] Seq=807531 Ack=69837 Win=4300 Len=0"
"217","20.130612400","151.101.2.187","100.84.170.161","TLSv1.2","237","Application Data"
"218","20.130612400","151.101.2.187","100.84.170.161","TLSv1.2","39366","Application Data, Application Data"
"219","20.130612400","151.101.2.187","100.84.170.161","TLSv1.2","694","Application Data"
"220","20.130612400","151.101.2.187","100.84.170.161","TCP","694","[TCP Retransmission] 443  >  64433 [PSH, ACK] Seq=847026 Ack=69837 Win=4300 Len=640 [TCP PDU reassembled in 219]"
"221","20.130828500","100.84.170.161","151.101.2.187","TCP","66","64433  >  443 [ACK] Seq=69837 Ack=847666 Win=8212 Len=0 SLE=847026 SRE=847666"
"222","20.941991900","100.84.170.161","151.101.2.187","TLSv1.2","2447","Application Data"
"223","20.951425700","151.101.2.187","100.84.170.161","TCP","56","443  >  64433 [ACK] Seq=847666 Ack=72230 Win=4311 Len=0"
"224","20.953993700","151.101.2.187","100.84.170.161","TLSv1.2","290","Application Data"
"225","21.004998600","151.101.2.187","100.84.170.161","TCP","290","[TCP Retransmission] 443  >  64433 [PSH, ACK] Seq=847666 Ack=72230 Win=4311 Len=236"
"226","21.005088300","100.84.170.161","151.101.2.187","TCP","66","64433  >  443 [ACK] Seq=72230 Ack=847902 Win=8211 Len=0 SLE=847666 SRE=847902"
"227","21.031907200","100.84.170.161","151.101.2.187","TLSv1.2","2447","Application Data"
"228","21.034403800","100.84.170.161","151.101.2.187","TLSv1.2","2453","Application Data"
"229","21.034629200","100.84.170.161","151.101.2.187","TLSv1.2","2450","Application Data"
"230","21.036092000","100.84.170.161","151.101.2.187","TLSv1.2","2453","Application Data"
"231","21.036264100","100.84.170.161","151.101.2.187","TLSv1.2","2454","Application Data"
"232","21.041203100","151.101.2.187","100.84.170.161","TCP","56","443  >  64433 [ACK] Seq=847902 Ack=74623 Win=4323 Len=0"
"233","21.043933000","151.101.2.187","100.84.170.161","TCP","56","443  >  64433 [ACK] Seq=847902 Ack=77022 Win=4334 Len=0"
"234","21.044222800","151.101.2.187","100.84.170.161","TCP","56","443  >  64433 [ACK] Seq=847902 Ack=79418 Win=4346 Len=0"
"235","21.045222200","151.101.2.187","100.84.170.161","TLSv1.2","135","Application Data"
"236","21.045539600","151.101.2.187","100.84.170.161","TCP","56","443  >  64433 [ACK] Seq=847983 Ack=81817 Win=4357 Len=0"
"237","21.046342400","151.101.2.187","100.84.170.161","TCP","56","443  >  64433 [ACK] Seq=847983 Ack=84217 Win=4368 Len=0"
"238","21.048078200","151.101.2.187","100.84.170.161","TLSv1.2","131","Application Data"
"239","21.048139800","100.84.170.161","151.101.2.187","TCP","54","64433  >  443 [ACK] Seq=84217 Ack=848060 Win=8210 Len=0"
"240","21.048415900","151.101.2.187","100.84.170.161","TLSv1.2","203","Application Data"
"241","21.050261400","151.101.2.187","100.84.170.161","TLSv1.2","212","Application Data"
"242","21.050261400","151.101.2.187","100.84.170.161","TLSv1.2","131","Application Data"
"243","21.050331400","100.84.170.161","151.101.2.187","TCP","54","64433  >  443 [ACK] Seq=84217 Ack=848444 Win=8209 Len=0"
"244","21.253252800","100.84.170.161","151.101.2.187","TLSv1.2","2451","Application Data"
"245","21.263726500","151.101.2.187","100.84.170.161","TCP","56","443  >  64433 [ACK] Seq=848444 Ack=86614 Win=4380 Len=0"
"246","21.266005300","151.101.2.187","100.84.170.161","TLSv1.2","131","Application Data"
"247","21.311777300","151.101.2.187","100.84.170.161","TCP","131","[TCP Retransmission] 443  >  64433 [PSH, ACK] Seq=848444 Ack=86614 Win=4380 Len=77"
"248","21.311831500","100.84.170.161","151.101.2.187","TCP","66","64433  >  443 [ACK] Seq=86614 Ack=848521 Win=8209 Len=0 SLE=848444 SRE=848521"
"249","21.314373900","100.84.170.161","151.101.2.187","TLSv1.2","2453","Application Data"
"250","21.323834000","151.101.2.187","100.84.170.161","TCP","56","443  >  64433 [ACK] Seq=848521 Ack=89013 Win=4391 Len=0"
"251","21.327081600","151.101.2.187","100.84.170.161","TLSv1.2","125","Application Data"
"252","21.372261300","151.101.2.187","100.84.170.161","TCP","125","[TCP Retransmission] 443  >  64433 [PSH, ACK] Seq=848521 Ack=89013 Win=4391 Len=71"
"253","21.372383200","100.84.170.161","151.101.2.187","TCP","66","64433  >  443 [ACK] Seq=89013 Ack=848592 Win=8208 Len=0 SLE=848521 SRE=848592"
"254","23.426862000","100.84.170.161","151.101.2.187","TLSv1.2","2448","Application Data"
"255","23.436727900","151.101.2.187","100.84.170.161","TCP","56","443  >  64433 [ACK] Seq=848592 Ack=91407 Win=4403 Len=0"
"256","23.439640800","151.101.2.187","100.84.170.161","TLSv1.2","241","Application Data"
"257","23.482129100","100.84.170.161","151.101.2.187","TCP","54","64433  >  443 [ACK] Seq=91407 Ack=848779 Win=8208 Len=0"
"258","23.484995600","151.101.2.187","100.84.170.161","TCP","241","[TCP Spurious Retransmission] 443  >  64433 [PSH, ACK] Seq=848592 Ack=91407 Win=4403 Len=187"
"259","23.485063500","100.84.170.161","151.101.2.187","TCP","66","[TCP Dup ACK 257#1] 64433  >  443 [ACK] Seq=91407 Ack=848779 Win=8208 Len=0 SLE=848592 SRE=848779"
"260","23.757493300","100.84.170.161","151.101.2.187","TLSv1.2","2449","Application Data"
"261","23.758628300","100.84.170.161","151.101.2.187","TLSv1.2","2447","Application Data"
"262","23.769961200","151.101.2.187","100.84.170.161","TCP","56","443  >  64433 [ACK] Seq=848779 Ack=96195 Win=4426 Len=0"
"263","23.772614300","151.101.2.187","100.84.170.161","TLSv1.2","240","Application Data"
"264","23.772787600","151.101.2.187","100.84.170.161","TLSv1.2","168","Application Data"
"265","23.772821000","100.84.170.161","151.101.2.187","TCP","54","64433  >  443 [ACK] Seq=96195 Ack=849079 Win=8206 Len=0"
"266","23.982279300","100.84.170.161","151.101.2.187","TLSv1.2","2454","Application Data"
"267","23.991583200","151.101.2.187","100.84.170.161","TCP","56","443  >  64433 [ACK] Seq=849079 Ack=98595 Win=4437 Len=0"
"268","23.994982000","151.101.2.187","100.84.170.161","TLSv1.2","125","Application Data"
"269","24.043181900","151.101.2.187","100.84.170.161","TCP","125","[TCP Retransmission] 443  >  64433 [PSH, ACK] Seq=849079 Ack=98595 Win=4437 Len=71"
"270","24.043223300","100.84.170.161","151.101.2.187","TCP","66","64433  >  443 [ACK] Seq=98595 Ack=849150 Win=8212 Len=0 SLE=849079 SRE=849150"
"271","26.042000300","100.84.170.161","151.101.2.187","TLSv1.2","2411","Application Data"
"272","26.042655000","100.84.170.161","151.101.2.187","TLSv1.2","2415","Application Data"
"273","26.043027600","100.84.170.161","151.101.2.187","TLSv1.2","2409","Application Data"
"274","26.044545400","100.84.170.161","151.101.2.187","TLSv1.2","2415","Application Data"
"275","26.045780600","100.84.170.161","151.101.2.187","TLSv1.2","2412","Application Data"
"276","26.046075200","100.84.170.161","151.101.2.187","TLSv1.2","2409","Application Data"
"277","26.048736200","100.84.170.161","151.101.2.187","TLSv1.2","2413","Application Data"
"278","26.052950000","151.101.2.187","100.84.170.161","TCP","56","443  >  64433 [ACK] Seq=849150 Ack=105668 Win=4471 Len=0"
"279","26.053947900","151.101.2.187","100.84.170.161","TCP","56","443  >  64433 [ACK] Seq=849150 Ack=108029 Win=4483 Len=0"
"280","26.055328500","151.101.2.187","100.84.170.161","TLSv1.2","220","Application Data"
"281","26.055723500","151.101.2.187","100.84.170.161","TCP","56","443  >  64433 [ACK] Seq=849316 Ack=112742 Win=4505 Len=0"
"282","26.056115100","151.101.2.187","100.84.170.161","TLSv1.2","163","Application Data"
"283","26.056241400","100.84.170.161","151.101.2.187","TCP","54","64433  >  443 [ACK] Seq=115101 Ack=849425 Win=8211 Len=0"
"284","26.056835100","151.101.2.187","100.84.170.161","TLSv1.2","203","Application Data"
"285","26.057488300","151.101.2.187","100.84.170.161","TLSv1.2","213","Application Data"
"286","26.057543600","100.84.170.161","151.101.2.187","TCP","54","64433  >  443 [ACK] Seq=115101 Ack=849733 Win=8210 Len=0"
"287","26.058333300","151.101.2.187","100.84.170.161","TCP","56","443  >  64433 [ACK] Seq=849733 Ack=115101 Win=4517 Len=0"
"288","26.058604300","151.101.2.187","100.84.170.161","TLSv1.2","130","Application Data"
"289","26.061177200","151.101.2.187","100.84.170.161","TLSv1.2","131","Application Data"
"290","26.061243900","100.84.170.161","151.101.2.187","TCP","54","64433  >  443 [ACK] Seq=115101 Ack=849886 Win=8209 Len=0"
"291","26.071546800","100.84.170.161","151.101.2.187","TLSv1.2","2409","Application Data"
"292","26.071965600","100.84.170.161","151.101.2.187","TLSv1.2","2416","Application Data"
"293","26.072965600","100.84.170.161","151.101.2.187","TLSv1.2","2410","Application Data"
"294","26.080874900","151.101.2.187","100.84.170.161","TCP","56","443  >  64433 [ACK] Seq=849886 Ack=117456 Win=4528 Len=0"
"295","26.081277600","151.101.2.187","100.84.170.161","TCP","56","443  >  64433 [ACK] Seq=849886 Ack=119818 Win=4540 Len=0"
"296","26.082296800","151.101.2.187","100.84.170.161","TCP","56","443  >  64433 [ACK] Seq=849886 Ack=122174 Win=4551 Len=0"
"297","26.083504500","151.101.2.187","100.84.170.161","TLSv1.2","104","Application Data"
"298","26.083828800","151.101.2.187","100.84.170.161","TLSv1.2","98","Application Data"
"299","26.083868500","100.84.170.161","151.101.2.187","TCP","54","64433  >  443 [ACK] Seq=122174 Ack=849980 Win=8209 Len=0"
"300","26.084593800","151.101.2.187","100.84.170.161","TLSv1.2","125","Application Data"
"301","26.128509000","151.101.2.187","100.84.170.161","TCP","125","[TCP Retransmission] 443  >  64433 [PSH, ACK] Seq=849980 Ack=122174 Win=4551 Len=71"
"302","26.128537200","100.84.170.161","151.101.2.187","TCP","66","64433  >  443 [ACK] Seq=122174 Ack=850051 Win=8208 Len=0 SLE=849980 SRE=850051"
"303","28.078017800","100.84.170.161","151.101.2.187","TLSv1.2","2416","Application Data"
"304","28.080264700","100.84.170.161","151.101.2.187","TLSv1.2","2415","Application Data"
"305","28.087330900","151.101.2.187","100.84.170.161","TCP","56","443  >  64433 [ACK] Seq=850051 Ack=124536 Win=4562 Len=0"
"306","28.089735300","151.101.2.187","100.84.170.161","TCP","56","443  >  64433 [ACK] Seq=850051 Ack=126897 Win=4574 Len=0"
"307","28.090047300","151.101.2.187","100.84.170.161","TLSv1.2","241","Application Data"
"308","28.091829500","151.101.2.187","100.84.170.161","TLSv1.2","125","Application Data"
"309","28.091900700","100.84.170.161","151.101.2.187","TCP","54","64433  >  443 [ACK] Seq=126897 Ack=850309 Win=8207 Len=0"
"310","28.442067200","100.84.170.161","151.101.2.187","TLSv1.2","2411","Application Data"
"311","28.444034900","100.84.170.161","151.101.2.187","TLSv1.2","2399","Application Data"
"312","28.444893500","100.84.170.161","151.101.2.187","TLSv1.2","2393","Application Data"
"313","28.448905300","100.84.170.161","151.101.2.187","TLSv1.2","2412","Application Data"
"314","28.453033100","151.101.2.187","100.84.170.161","TCP","56","443  >  64433 [ACK] Seq=850309 Ack=129254 Win=4585 Len=0"
"315","28.453263400","151.101.2.187","100.84.170.161","TCP","56","443  >  64433 [ACK] Seq=850309 Ack=131599 Win=4597 Len=0"
"316","28.454175700","151.101.2.187","100.84.170.161","TCP","56","443  >  64433 [ACK] Seq=850309 Ack=133938 Win=4608 Len=0"
"317","28.456389300","151.101.2.187","100.84.170.161","TLSv1.2","98","Application Data"
"318","28.457080100","151.101.2.187","100.84.170.161","TLSv1.2","130","Application Data"
"319","28.457168100","100.84.170.161","151.101.2.187","TCP","54","64433  >  443 [ACK] Seq=136296 Ack=850429 Win=8207 Len=0"
"320","28.457336500","151.101.2.187","100.84.170.161","TLSv1.2","174","Application Data"
"321","28.458157900","151.101.2.187","100.84.170.161","TCP","56","443  >  64433 [ACK] Seq=850549 Ack=136296 Win=4619 Len=0"
"322","28.460878300","151.101.2.187","100.84.170.161","TLSv1.2","98","Application Data"
"323","28.460938900","100.84.170.161","151.101.2.187","TCP","54","64433  >  443 [ACK] Seq=136296 Ack=850593 Win=8206 Len=0"
"324","28.527078100","100.84.170.161","151.101.2.187","TLSv1.2","2400","Application Data"
"325","28.534072200","100.84.170.161","151.101.2.187","TLSv1.2","2397","Application Data"
"326","28.536399900","151.101.2.187","100.84.170.161","TCP","56","443  >  64433 [ACK] Seq=850593 Ack=138642 Win=4631 Len=0"
"327","28.538966100","151.101.2.187","100.84.170.161","TLSv1.2","136","Application Data"
"328","28.539038300","100.84.170.161","151.101.2.187","TCP","54","64433  >  443 [ACK] Seq=140985 Ack=850675 Win=8212 Len=0"
"329","28.543287500","151.101.2.187","100.84.170.161","TCP","56","443  >  64433 [ACK] Seq=850675 Ack=140985 Win=4642 Len=0"
"330","28.545768400","151.101.2.187","100.84.170.161","TLSv1.2","234","Application Data"
"331","28.545841400","100.84.170.161","151.101.2.187","TCP","54","64433  >  443 [ACK] Seq=140985 Ack=850855 Win=8211 Len=0"
"332","28.686364200","100.84.170.161","151.101.2.187","TLSv1.2","2415","Application Data"
"333","28.698666700","151.101.2.187","100.84.170.161","TCP","56","443  >  64433 [ACK] Seq=850855 Ack=143346 Win=4654 Len=0"
"334","28.701145500","151.101.2.187","100.84.170.161","TLSv1.2","135","Application Data"
"335","28.704360000","100.84.170.161","151.101.2.187","TLSv1.2","2406","Application Data"
"336","28.714231600","151.101.2.187","100.84.170.161","TCP","56","443  >  64433 [ACK] Seq=850936 Ack=145698 Win=4665 Len=0"
"337","28.718929200","151.101.2.187","100.84.170.161","TLSv1.2","203","Application Data"
"338","28.749495600","151.101.2.187","100.84.170.161","TCP","203","[TCP Retransmission] 443  >  64433 [PSH, ACK] Seq=850936 Ack=145698 Win=4665 Len=149"
"339","28.749533700","100.84.170.161","151.101.2.187","TCP","66","64433  >  443 [ACK] Seq=145698 Ack=851085 Win=8210 Len=0 SLE=850936 SRE=851085"
"340","28.794307300","100.84.170.161","151.101.2.187","TLSv1.2","2403","Application Data"
"341","28.794525900","100.84.170.161","151.101.2.187","TLSv1.2","2394","Application Data"
"342","28.804556300","151.101.2.187","100.84.170.161","TCP","56","443  >  64433 [ACK] Seq=851085 Ack=150387 Win=4688 Len=0"
"343","28.807749600","151.101.2.187","100.84.170.161","TLSv1.2","206","Application Data"
"344","28.807749600","151.101.2.187","100.84.170.161","TLSv1.2","130","Application Data"
"345","28.807832300","100.84.170.161","151.101.2.187","TCP","54","64433  >  443 [ACK] Seq=150387 Ack=851313 Win=8210 Len=0"
"346","29.273979800","100.84.170.161","151.101.2.187","TLSv1.2","2409","Application Data"
"347","29.284052000","151.101.2.187","100.84.170.161","TCP","56","443  >  64433 [ACK] Seq=851313 Ack=152742 Win=4699 Len=0"
"348","29.286908600","151.101.2.187","100.84.170.161","TLSv1.2","131","Application Data"
"349","29.315883300","151.101.2.187","100.84.170.161","TCP","131","[TCP Retransmission] 443  >  64433 [PSH, ACK] Seq=851313 Ack=152742 Win=4699 Len=77"
"350","29.315943400","100.84.170.161","151.101.2.187","TCP","66","64433  >  443 [ACK] Seq=152742 Ack=851390 Win=8209 Len=0 SLE=851313 SRE=851390"
"351","29.625927500","100.84.170.161","151.101.2.187","TLSv1.2","2410","Application Data"
"352","29.626181300","100.84.170.161","151.101.2.187","TLSv1.2","2411","Application Data"
"353","29.637100100","151.101.2.187","100.84.170.161","TCP","56","443  >  64433 [ACK] Seq=851390 Ack=157455 Win=4722 Len=0"
"354","29.640459000","151.101.2.187","100.84.170.161","TLSv1.2","240","Application Data"
"355","29.641636200","151.101.2.187","100.84.170.161","TLSv1.2","124","Application Data"
"356","29.641849400","100.84.170.161","151.101.2.187","TCP","54","64433  >  443 [ACK] Seq=157455 Ack=851646 Win=8208 Len=0"
"357","30.059180200","100.84.170.161","151.101.2.187","TLSv1.2","2301","Application Data"
"358","30.071301300","151.101.2.187","100.84.170.161","TCP","56","443  >  64433 [ACK] Seq=851646 Ack=159702 Win=4733 Len=0"
"359","30.074518500","151.101.2.187","100.84.170.161","TLSv1.2","104","Application Data"
"360","30.101821700","151.101.2.187","100.84.170.161","TCP","104","[TCP Retransmission] 443  >  64433 [PSH, ACK] Seq=851646 Ack=159702 Win=4733 Len=50"
"361","30.101872300","100.84.170.161","151.101.2.187","TCP","66","64433  >  443 [ACK] Seq=159702 Ack=851696 Win=8208 Len=0 SLE=851646 SRE=851696"
"362","30.539301500","100.84.170.161","151.101.2.187","TLSv1.2","2433","Application Data"
"363","30.550391800","151.101.2.187","100.84.170.161","TCP","56","443  >  64433 [ACK] Seq=851696 Ack=162081 Win=4745 Len=0"
"364","30.552765900","151.101.2.187","100.84.170.161","TLSv1.2","208","Application Data"
"365","30.580819400","151.101.2.187","100.84.170.161","TCP","208","[TCP Retransmission] 443  >  64433 [PSH, ACK] Seq=851696 Ack=162081 Win=4745 Len=154"
"366","30.580856100","100.84.170.161","151.101.2.187","TCP","66","64433  >  443 [ACK] Seq=162081 Ack=851850 Win=8207 Len=0 SLE=851696 SRE=851850"
"367","31.618568500","100.84.170.161","151.101.2.187","TLSv1.2","2416","Application Data"
"368","31.628526800","151.101.2.187","100.84.170.161","TCP","56","443  >  64433 [ACK] Seq=851850 Ack=164443 Win=4756 Len=0"
"369","31.632798200","151.101.2.187","100.84.170.161","TLSv1.2","241","Application Data"
"370","31.660709300","151.101.2.187","100.84.170.161","TCP","241","[TCP Retransmission] 443  >  64433 [PSH, ACK] Seq=851850 Ack=164443 Win=4756 Len=187"
"371","31.660757900","100.84.170.161","151.101.2.187","TCP","66","64433  >  443 [ACK] Seq=164443 Ack=852037 Win=8207 Len=0 SLE=851850 SRE=852037"
"372","34.780830600","100.84.170.161","151.101.2.187","TLSv1.2","303","Application Data"
"373","34.792961500","151.101.2.187","100.84.170.161","TCP","56","443  >  64433 [ACK] Seq=852037 Ack=164692 Win=4756 Len=0"
"374","34.844901500","151.101.2.187","100.84.170.161","TLSv1.2","339","Application Data"
"375","34.845166100","151.101.2.187","100.84.170.161","TLSv1.2","357","Application Data"
"376","34.845216500","100.84.170.161","151.101.2.187","TCP","54","64433  >  443 [ACK] Seq=164692 Ack=852625 Win=8212 Len=0"
"377","34.848693600","100.84.170.161","151.101.2.187","TLSv1.2","89","Application Data"
"378","34.858346500","151.101.2.187","100.84.170.161","TCP","56","443  >  64433 [ACK] Seq=852625 Ack=164727 Win=4756 Len=0"
"379","35.142094500","100.84.170.161","151.101.2.187","TLSv1.2","2320","Application Data"
"380","35.153354700","151.101.2.187","100.84.170.161","TCP","56","443  >  64433 [ACK] Seq=852625 Ack=166993 Win=4768 Len=0"
"381","35.155874600","151.101.2.187","100.84.170.161","TLSv1.2","314","Application Data"
"382","35.159434700","100.84.170.161","151.101.2.187","TLSv1.2","2416","Application Data"
"383","35.169462700","151.101.2.187","100.84.170.161","TCP","56","443  >  64433 [ACK] Seq=852885 Ack=169355 Win=4779 Len=0"
"384","35.172409500","151.101.2.187","100.84.170.161","TLSv1.2","104","Application Data"
"385","35.198471900","100.84.170.161","151.101.2.187","TLSv1.2","2429","Application Data"
"386","35.224185000","100.84.170.161","151.101.2.187","TCP","1514","[TCP Retransmission] 64433  >  443 [PSH, ACK] Seq=170270 Ack=852935 Win=8211 Len=1460"
"387","35.253816800","151.101.2.187","100.84.170.161","TCP","104","[TCP Spurious Retransmission] 443  >  64433 [PSH, ACK] Seq=852885 Ack=169355 Win=4779 Len=50"
"388","35.253853200","100.84.170.161","151.101.2.187","TCP","66","[TCP Dup ACK 385#1] 64433  >  443 [ACK] Seq=171730 Ack=852935 Win=8211 Len=0 SLE=852885 SRE=852935"
"389","35.296168500","151.101.2.187","100.84.170.161","TCP","56","443  >  64433 [ACK] Seq=852935 Ack=171730 Win=4791 Len=0"
"390","35.296422300","151.101.2.187","100.84.170.161","TCP","66","[TCP Dup ACK 389#1] 443  >  64433 [ACK] Seq=852935 Ack=171730 Win=4791 Len=0 SLE=170270 SRE=171730"
"391","35.296815900","151.101.2.187","100.84.170.161","TLSv1.2","104","Application Data"
"392","35.319493900","151.101.2.187","100.84.170.161","TCP","104","[TCP Retransmission] 443  >  64433 [PSH, ACK] Seq=852935 Ack=171730 Win=4791 Len=50"
"393","35.319535600","100.84.170.161","151.101.2.187","TCP","66","64433  >  443 [ACK] Seq=171730 Ack=852985 Win=8211 Len=0 SLE=852935 SRE=852985"
"394","35.792233700","100.84.170.161","151.101.2.187","TLSv1.2","2428","Application Data"
"395","35.802349900","151.101.2.187","100.84.170.161","TCP","56","443  >  64433 [ACK] Seq=852985 Ack=174104 Win=4802 Len=0"
"396","35.803930900","100.84.170.161","151.101.2.187","TLSv1.2","2416","Application Data"
"397","35.805870800","151.101.2.187","100.84.170.161","TLSv1.2","235","Application Data"
"398","35.813128400","151.101.2.187","100.84.170.161","TCP","56","443  >  64433 [ACK] Seq=853166 Ack=176466 Win=4813 Len=0"
"399","35.816007100","151.101.2.187","100.84.170.161","TLSv1.2","98","Application Data"
"400","35.816189500","100.84.170.161","151.101.2.187","TCP","54","64433  >  443 [ACK] Seq=176466 Ack=853210 Win=8210 Len=0"
"401","35.855367000","100.84.170.161","151.101.2.187","TLSv1.2","2433","Application Data"
"402","35.864698200","151.101.2.187","100.84.170.161","TCP","56","443  >  64433 [ACK] Seq=853210 Ack=178845 Win=4825 Len=0"
"403","35.867413400","151.101.2.187","100.84.170.161","TLSv1.2","98","Application Data"
"404","35.897766000","151.101.2.187","100.84.170.161","TCP","98","[TCP Retransmission] 443  >  64433 [PSH, ACK] Seq=853210 Ack=178845 Win=4825 Len=44"
"405","35.897812400","100.84.170.161","151.101.2.187","TCP","66","64433  >  443 [ACK] Seq=178845 Ack=853254 Win=8210 Len=0 SLE=853210 SRE=853254"
"406","36.109540800","100.84.170.161","151.101.2.187","TLSv1.2","2428","Application Data"
"407","36.118944300","151.101.2.187","100.84.170.161","TCP","56","443  >  64433 [ACK] Seq=853254 Ack=181219 Win=4836 Len=0"
"408","36.121622000","151.101.2.187","100.84.170.161","TLSv1.2","104","Application Data"
"409","36.133479600","100.84.170.161","151.101.2.187","TLSv1.2","2416","Application Data"
"410","36.143201800","151.101.2.187","100.84.170.161","TCP","56","443  >  64433 [ACK] Seq=853304 Ack=183581 Win=4848 Len=0"
"411","36.146367700","151.101.2.187","100.84.170.161","TLSv1.2","104","Application Data"
"412","36.177808200","151.101.2.187","100.84.170.161","TCP","104","[TCP Retransmission] 443  >  64433 [PSH, ACK] Seq=853304 Ack=183581 Win=4848 Len=50"
"413","36.177868300","100.84.170.161","151.101.2.187","TCP","66","64433  >  443 [ACK] Seq=183581 Ack=853354 Win=8209 Len=0 SLE=853304 SRE=853354"
"414","37.002263100","100.84.170.161","151.101.2.187","TLSv1.2","2428","Application Data"
"415","37.013895000","151.101.2.187","100.84.170.161","TCP","56","443  >  64433 [ACK] Seq=853354 Ack=185955 Win=4859 Len=0"
"416","37.015352900","100.84.170.161","151.101.2.187","TLSv1.2","2416","Application Data"
"417","37.016359800","151.101.2.187","100.84.170.161","TLSv1.2","208","Application Data"
"418","37.025592100","151.101.2.187","100.84.170.161","TCP","56","443  >  64433 [ACK] Seq=853508 Ack=188317 Win=4870 Len=0"
"419","37.028429200","151.101.2.187","100.84.170.161","TLSv1.2","104","Application Data"
"420","37.028504600","100.84.170.161","151.101.2.187","TCP","54","64433  >  443 [ACK] Seq=188317 Ack=853558 Win=8208 Len=0"
"421","37.054167300","100.84.170.161","151.101.2.187","TLSv1.2","2429","Application Data"
"422","37.063924600","151.101.2.187","100.84.170.161","TCP","56","443  >  64433 [ACK] Seq=853558 Ack=190692 Win=4882 Len=0"
"423","37.066405700","151.101.2.187","100.84.170.161","TLSv1.2","124","Application Data"
"424","37.099780500","151.101.2.187","100.84.170.161","TCP","124","[TCP Retransmission] 443  >  64433 [PSH, ACK] Seq=853558 Ack=190692 Win=4882 Len=70"
"425","37.099817100","100.84.170.161","151.101.2.187","TCP","66","64433  >  443 [ACK] Seq=190692 Ack=853628 Win=8208 Len=0 SLE=853558 SRE=853628"
"426","37.716157800","100.84.170.161","151.101.2.187","TLSv1.2","2428","Application Data"
"427","37.727009800","151.101.2.187","100.84.170.161","TCP","56","443  >  64433 [ACK] Seq=853628 Ack=193066 Win=4893 Len=0"
"428","37.729965700","151.101.2.187","100.84.170.161","TLSv1.2","214","Application Data"
"429","37.734080100","100.84.170.161","151.101.2.187","TLSv1.2","2416","Application Data"
"430","37.743988300","151.101.2.187","100.84.170.161","TCP","56","443  >  64433 [ACK] Seq=853788 Ack=195428 Win=4905 Len=0"
"431","37.748205600","151.101.2.187","100.84.170.161","TLSv1.2","125","Application Data"
"432","37.781926900","151.101.2.187","100.84.170.161","TCP","125","[TCP Retransmission] 443  >  64433 [PSH, ACK] Seq=853788 Ack=195428 Win=4905 Len=71"
"433","37.782016600","100.84.170.161","151.101.2.187","TCP","66","64433  >  443 [ACK] Seq=195428 Ack=853859 Win=8207 Len=0 SLE=853788 SRE=853859"
"434","38.130543000","100.84.170.161","151.101.2.187","TLSv1.2","2428","Application Data"
"435","38.131561900","100.84.170.161","151.101.2.187","TLSv1.2","2416","Application Data"
"436","38.140092500","151.101.2.187","100.84.170.161","TCP","56","443  >  64433 [ACK] Seq=853859 Ack=197802 Win=4916 Len=0"
"437","38.140758200","151.101.2.187","100.84.170.161","TCP","56","443  >  64433 [ACK] Seq=853859 Ack=200164 Win=4927 Len=0"
"438","38.142347100","151.101.2.187","100.84.170.161","TLSv1.2","104","Application Data"
"439","38.142879800","151.101.2.187","100.84.170.161","TLSv1.2","104","Application Data"
"440","38.142921200","100.84.170.161","151.101.2.187","TCP","54","64433  >  443 [ACK] Seq=200164 Ack=853959 Win=8207 Len=0"
"441","38.185724700","100.84.170.161","151.101.2.187","TLSv1.2","2433","Application Data"
"442","38.194941700","151.101.2.187","100.84.170.161","TCP","56","443  >  64433 [ACK] Seq=853959 Ack=202543 Win=4939 Len=0"
"443","38.198661900","151.101.2.187","100.84.170.161","TLSv1.2","98","Application Data"
"444","38.231515200","151.101.2.187","100.84.170.161","TCP","98","[TCP Retransmission] 443  >  64433 [PSH, ACK] Seq=853959 Ack=202543 Win=4939 Len=44"
"445","38.231555400","100.84.170.161","151.101.2.187","TCP","66","64433  >  443 [ACK] Seq=202543 Ack=854003 Win=8207 Len=0 SLE=853959 SRE=854003"
"446","40.865782300","100.84.170.161","151.101.2.187","TLSv1.2","2453","Application Data"
"447","40.866711200","100.84.170.161","151.101.2.187","TLSv1.2","2441","Application Data"
"448","40.868164600","100.84.170.161","151.101.2.187","TLSv1.2","2435","Application Data"
"449","40.874172100","100.84.170.161","151.101.2.187","TLSv1.2","2454","Application Data"
"450","40.877763100","151.101.2.187","100.84.170.161","TCP","56","443  >  64433 [ACK] Seq=854003 Ack=207329 Win=4962 Len=0"
"451","40.878268300","151.101.2.187","100.84.170.161","TCP","56","443  >  64433 [ACK] Seq=854003 Ack=209710 Win=4973 Len=0"
"452","40.880681500","151.101.2.187","100.84.170.161","TLSv1.2","295","Application Data"
"453","40.880767300","100.84.170.161","151.101.2.187","TCP","54","64433  >  443 [ACK] Seq=212110 Ack=854244 Win=8212 Len=0"
"454","40.880946100","151.101.2.187","100.84.170.161","TLSv1.2","130","Application Data"
"455","40.880977000","100.84.170.161","151.101.2.187","TCP","54","64433  >  443 [ACK] Seq=212110 Ack=854320 Win=8212 Len=0"
"456","40.883619400","151.101.2.187","100.84.170.161","TCP","56","443  >  64433 [ACK] Seq=854320 Ack=212110 Win=4984 Len=0"
"457","40.885478700","151.101.2.187","100.84.170.161","TLSv1.2","335","Application Data"
"458","40.920591000","151.101.2.187","100.84.170.161","TCP","335","[TCP Retransmission] 443  >  64433 [PSH, ACK] Seq=854320 Ack=212110 Win=4984 Len=281"
"459","40.920631600","100.84.170.161","151.101.2.187","TCP","66","64433  >  443 [ACK] Seq=212110 Ack=854601 Win=8211 Len=0 SLE=854320 SRE=854601"
"460","41.009007500","100.84.170.161","151.101.2.187","TLSv1.2","2457","Application Data"
"461","41.018539000","151.101.2.187","100.84.170.161","TCP","56","443  >  64433 [ACK] Seq=854601 Ack=214513 Win=4996 Len=0"
"462","41.023014300","151.101.2.187","100.84.170.161","TLSv1.2","130","Application Data"
"463","41.064249700","151.101.2.187","100.84.170.161","TCP","130","[TCP Retransmission] 443  >  64433 [PSH, ACK] Seq=854601 Ack=214513 Win=4996 Len=76"
"464","41.064291100","100.84.170.161","151.101.2.187","TCP","66","64433  >  443 [ACK] Seq=214513 Ack=854677 Win=8210 Len=0 SLE=854601 SRE=854677"
"465","41.358806000","100.84.170.161","151.101.2.187","TLSv1.2","2423","Application Data"
"466","41.358979500","100.84.170.161","151.101.2.187","TLSv1.2","2426","Application Data"
"467","41.359074400","100.84.170.161","151.101.2.187","TLSv1.2","2420","Application Data"
"468","41.359463600","100.84.170.161","151.101.2.187","TLSv1.2","2417","Application Data"
"469","41.368530500","151.101.2.187","100.84.170.161","TCP","56","443  >  64433 [ACK] Seq=854677 Ack=216882 Win=5007 Len=0"
"470","41.368822800","151.101.2.187","100.84.170.161","TCP","56","443  >  64433 [ACK] Seq=854677 Ack=221620 Win=5030 Len=0"
"471","41.369463100","151.101.2.187","100.84.170.161","TCP","56","443  >  64433 [ACK] Seq=854677 Ack=223983 Win=5041 Len=0"
"472","41.371335800","151.101.2.187","100.84.170.161","TLSv1.2","130","Application Data"
"473","41.371591900","151.101.2.187","100.84.170.161","TLSv1.2","124","Application Data"
"474","41.371635200","100.84.170.161","151.101.2.187","TCP","54","64433  >  443 [ACK] Seq=223983 Ack=854823 Win=8210 Len=0"
"475","41.371997100","151.101.2.187","100.84.170.161","TLSv1.2","130","Application Data"
"476","41.372329600","151.101.2.187","100.84.170.161","TLSv1.2","130","Application Data"
"477","41.372363500","100.84.170.161","151.101.2.187","TCP","54","64433  >  443 [ACK] Seq=223983 Ack=854975 Win=8209 Len=0"
"478","41.468027700","100.84.170.161","151.101.2.187","TLSv1.2","2453","Application Data"
"479","41.471075100","100.84.170.161","151.101.2.187","TLSv1.2","2462","Application Data"
"480","41.478010800","151.101.2.187","100.84.170.161","TCP","56","443  >  64433 [ACK] Seq=854975 Ack=226382 Win=5053 Len=0"
"481","41.480415000","151.101.2.187","100.84.170.161","TLSv1.2","125","Application Data"
"482","41.480827600","151.101.2.187","100.84.170.161","TCP","56","443  >  64433 [ACK] Seq=855046 Ack=228790 Win=5064 Len=0"
"483","41.483979800","151.101.2.187","100.84.170.161","TLSv1.2","104","Application Data"
"484","41.484040200","100.84.170.161","151.101.2.187","TCP","54","64433  >  443 [ACK] Seq=228790 Ack=855096 Win=8209 Len=0"
"485","41.626087200","100.84.170.161","151.101.2.187","TLSv1.2","2475","Application Data"
"486","41.636819100","151.101.2.187","100.84.170.161","TCP","56","443  >  64433 [ACK] Seq=855096 Ack=231211 Win=5076 Len=0"
"487","41.640500300","151.101.2.187","100.84.170.161","TLSv1.2","234","Application Data"
"488","41.668602100","151.101.2.187","100.84.170.161","TCP","234","[TCP Retransmission] 443  >  64433 [PSH, ACK] Seq=855096 Ack=231211 Win=5076 Len=180"
"489","41.668638900","100.84.170.161","151.101.2.187","TCP","66","64433  >  443 [ACK] Seq=231211 Ack=855276 Win=8208 Len=0 SLE=855096 SRE=855276"
"490","41.875491400","100.84.170.161","151.101.2.187","TLSv1.2","2477","Application Data"
"491","41.885287800","151.101.2.187","100.84.170.161","TCP","56","443  >  64433 [ACK] Seq=855276 Ack=233634 Win=5087 Len=0"
"492","41.887938300","151.101.2.187","100.84.170.161","TLSv1.2","98","Application Data"
"493","41.916611900","151.101.2.187","100.84.170.161","TCP","98","[TCP Retransmission] 443  >  64433 [PSH, ACK] Seq=855276 Ack=233634 Win=5087 Len=44"
"494","41.916657100","100.84.170.161","151.101.2.187","TCP","66","64433  >  443 [ACK] Seq=233634 Ack=855320 Win=8208 Len=0 SLE=855276 SRE=855320"
"495","41.926024400","100.84.170.161","151.101.2.187","TLSv1.2","2476","Application Data"
"496","41.928884400","100.84.170.161","151.101.2.187","TLSv1.2","2474","Application Data"
"497","41.935136500","151.101.2.187","100.84.170.161","TCP","56","443  >  64433 [ACK] Seq=855320 Ack=236056 Win=5098 Len=0"
"498","41.938014800","151.101.2.187","100.84.170.161","TLSv1.2","98","Application Data"
"499","41.939421200","151.101.2.187","100.84.170.161","TCP","56","443  >  64433 [ACK] Seq=855364 Ack=238476 Win=5110 Len=0"
"500","41.940649600","151.101.2.187","100.84.170.161","TLSv1.2","98","Application Data"
"501","41.940728400","100.84.170.161","151.101.2.187","TCP","54","64433  >  443 [ACK] Seq=238476 Ack=855408 Win=8207 Len=0"
"502","42.142635100","100.84.170.161","151.101.2.187","TLSv1.2","2464","Application Data"
"503","42.143451500","100.84.170.161","151.101.2.187","TLSv1.2","2458","Application Data"
"504","42.153596600","151.101.2.187","100.84.170.161","TCP","56","443  >  64433 [ACK] Seq=855408 Ack=243290 Win=5133 Len=0"
"505","42.156852500","151.101.2.187","100.84.170.161","TLSv1.2","104","Application Data"
"506","42.157025400","151.101.2.187","100.84.170.161","TLSv1.2","104","Application Data"
"507","42.157050800","100.84.170.161","151.101.2.187","TCP","54","64433  >  443 [ACK] Seq=243290 Ack=855508 Win=8207 Len=0"
"508","42.273572800","100.84.170.161","151.101.2.187","TLSv1.2","2480","Application Data"
"509","42.284670500","151.101.2.187","100.84.170.161","TCP","56","443  >  64433 [ACK] Seq=855508 Ack=245716 Win=5144 Len=0"
"510","42.287676500","151.101.2.187","100.84.170.161","TLSv1.2","104","Application Data"
"511","42.298681200","100.84.170.161","151.101.2.187","TLSv1.2","2471","Application Data"
"512","42.308374200","151.101.2.187","100.84.170.161","TCP","56","443  >  64433 [ACK] Seq=855558 Ack=248133 Win=5156 Len=0"
"513","42.311208500","151.101.2.187","100.84.170.161","TLSv1.2","130","Application Data"
"514","42.340515800","151.101.2.187","100.84.170.161","TCP","130","[TCP Retransmission] 443  >  64433 [PSH, ACK] Seq=855558 Ack=248133 Win=5156 Len=76"
"515","42.340553300","100.84.170.161","151.101.2.187","TCP","66","64433  >  443 [ACK] Seq=248133 Ack=855634 Win=8207 Len=0 SLE=855558 SRE=855634"
"516","42.540748100","100.84.170.161","151.101.2.187","TLSv1.2","2465","Application Data"
"517","42.540964100","100.84.170.161","151.101.2.187","TLSv1.2","2468","Application Data"
"518","42.541067500","100.84.170.161","151.101.2.187","TLSv1.2","2462","Application Data"
"519","42.541448400","100.84.170.161","151.101.2.187","TLSv1.2","2459","Application Data"
"520","42.553960000","151.101.2.187","100.84.170.161","TCP","56","443  >  64433 [ACK] Seq=855634 Ack=257771 Win=5199 Len=0"
"521","42.555910400","151.101.2.187","100.84.170.161","TLSv1.2","242","Application Data"
"522","42.556286200","151.101.2.187","100.84.170.161","TLSv1.2","104","Application Data"
"523","42.556325500","100.84.170.161","151.101.2.187","TCP","54","64433  >  443 [ACK] Seq=257771 Ack=855872 Win=8212 Len=0"
"524","42.556541100","151.101.2.187","100.84.170.161","TLSv1.2","142","Application Data"
"525","42.595647500","151.101.2.187","100.84.170.161","TCP","142","[TCP Retransmission] 443  >  64433 [PSH, ACK] Seq=855872 Ack=257771 Win=5199 Len=88"
"526","42.595688100","100.84.170.161","151.101.2.187","TCP","66","64433  >  443 [ACK] Seq=257771 Ack=855960 Win=8212 Len=0 SLE=855872 SRE=855960"
"527","42.642551800","100.84.170.161","151.101.2.187","TLSv1.2","2457","Application Data"
"528","42.652175400","151.101.2.187","100.84.170.161","TCP","56","443  >  64433 [ACK] Seq=855960 Ack=260174 Win=5211 Len=0"
"529","42.655313800","151.101.2.187","100.84.170.161","TLSv1.2","296","Application Data"
"530","42.684625000","151.101.2.187","100.84.170.161","TCP","296","[TCP Retransmission] 443  >  64433 [PSH, ACK] Seq=855960 Ack=260174 Win=5211 Len=242"
"531","42.684661500","100.84.170.161","151.101.2.187","TCP","66","64433  >  443 [ACK] Seq=260174 Ack=856202 Win=8211 Len=0 SLE=855960 SRE=856202"
"532","42.690181600","100.84.170.161","151.101.2.187","TLSv1.2","2479","Application Data"
"533","42.699470000","151.101.2.187","100.84.170.161","TCP","56","443  >  64433 [ACK] Seq=856202 Ack=262599 Win=5222 Len=0"
"534","42.702876700","151.101.2.187","100.84.170.161","TLSv1.2","98","Application Data"
"535","42.731697300","151.101.2.187","100.84.170.161","TCP","98","[TCP Retransmission] 443  >  64433 [PSH, ACK] Seq=856202 Ack=262599 Win=5222 Len=44"
"536","42.731800000","100.84.170.161","151.101.2.187","TCP","66","64433  >  443 [ACK] Seq=262599 Ack=856246 Win=8211 Len=0 SLE=856202 SRE=856246"
"537","42.832737300","100.84.170.161","151.101.2.187","TLSv1.2","2474","Application Data"
"538","42.842619600","151.101.2.187","100.84.170.161","TCP","56","443  >  64433 [ACK] Seq=856246 Ack=265019 Win=5233 Len=0"
"539","42.845238400","151.101.2.187","100.84.170.161","TLSv1.2","98","Application Data"
"540","42.848150400","100.84.170.161","151.101.2.187","TLSv1.2","2462","Application Data"
"541","42.857247300","151.101.2.187","100.84.170.161","TCP","56","443  >  64433 [ACK] Seq=856290 Ack=267427 Win=5245 Len=0"
"542","42.861092100","151.101.2.187","100.84.170.161","TLSv1.2","131","Application Data"
"543","42.889759000","151.101.2.187","100.84.170.161","TCP","131","[TCP Retransmission] 443  >  64433 [PSH, ACK] Seq=856290 Ack=267427 Win=5245 Len=77"
"544","42.889817300","100.84.170.161","151.101.2.187","TCP","66","64433  >  443 [ACK] Seq=267427 Ack=856367 Win=8210 Len=0 SLE=856290 SRE=856367"
"545","42.997941600","100.84.170.161","151.101.2.187","TLSv1.2","2475","Application Data"
"546","42.998254600","100.84.170.161","151.101.2.187","TLSv1.2","2476","Application Data"
"547","43.008864000","151.101.2.187","100.84.170.161","TCP","56","443  >  64433 [ACK] Seq=856367 Ack=272270 Win=5268 Len=0"
"548","43.011380600","151.101.2.187","100.84.170.161","TLSv1.2","98","Application Data"
"549","43.011718300","151.101.2.187","100.84.170.161","TLSv1.2","98","Application Data"
"550","43.011764900","100.84.170.161","151.101.2.187","TCP","54","64433  >  443 [ACK] Seq=272270 Ack=856455 Win=8210 Len=0"
"551","43.210725500","100.84.170.161","151.101.2.187","TLSv1.2","2462","Application Data"
"552","43.211314900","100.84.170.161","151.101.2.187","TLSv1.2","2468","Application Data"
"553","43.211438300","100.84.170.161","151.101.2.187","TLSv1.2","2469","Application Data"
"554","43.211531900","100.84.170.161","151.101.2.187","TLSv1.2","2462","Application Data"
"555","43.211669800","100.84.170.161","151.101.2.187","TLSv1.2","2462","Application Data"
"556","43.211798300","100.84.170.161","151.101.2.187","TLSv1.2","2468","Application Data"
"557","43.212331100","100.84.170.161","151.101.2.187","TLSv1.2","2474","Application Data"
"558","43.223707600","151.101.2.187","100.84.170.161","TCP","56","443  >  64433 [ACK] Seq=856455 Ack=284323 Win=5321 Len=0"
"559","43.224010000","151.101.2.187","100.84.170.161","TCP","56","443  >  64433 [ACK] Seq=856455 Ack=289157 Win=5343 Len=0"
"560","43.226794000","151.101.2.187","100.84.170.161","TLSv1.2","131","Application Data"
"561","43.228449300","151.101.2.187","100.84.170.161","TLSv1.2","282","Application Data"
"562","43.228520800","100.84.170.161","151.101.2.187","TCP","54","64433  >  443 [ACK] Seq=289157 Ack=856760 Win=8209 Len=0"
"563","43.228796800","151.101.2.187","100.84.170.161","TLSv1.2","131","Application Data"
"564","43.229405400","151.101.2.187","100.84.170.161","TLSv1.2","125","Application Data"
"565","43.229448600","100.84.170.161","151.101.2.187","TCP","54","64433  >  443 [ACK] Seq=289157 Ack=856908 Win=8208 Len=0"
"566","43.339821300","100.84.170.161","151.101.2.187","TLSv1.2","2472","Application Data"
"567","43.340018200","100.84.170.161","151.101.2.187","TLSv1.2","2466","Application Data"
"568","43.340191400","100.84.170.161","151.101.2.187","TLSv1.2","2469","Application Data"
"569","43.340526600","100.84.170.161","151.101.2.187","TLSv1.2","2463","Application Data"
"570","43.349649700","151.101.2.187","100.84.170.161","TCP","56","443  >  64433 [ACK] Seq=856908 Ack=291575 Win=5355 Len=0"
"571","43.349915200","151.101.2.187","100.84.170.161","TCP","56","443  >  64433 [ACK] Seq=856908 Ack=296402 Win=5378 Len=0"
"572","43.350233800","151.101.2.187","100.84.170.161","TCP","56","443  >  64433 [ACK] Seq=856908 Ack=298811 Win=5389 Len=0"
"573","43.352225200","151.101.2.187","100.84.170.161","TLSv1.2","178","Application Data"
"574","43.353147400","151.101.2.187","100.84.170.161","TLSv1.2","124","Application Data"
"575","43.353203000","100.84.170.161","151.101.2.187","TCP","54","64433  >  443 [ACK] Seq=298811 Ack=857102 Win=8207 Len=0"
"576","43.353514200","151.101.2.187","100.84.170.161","TLSv1.2","240","Application Data"
"577","43.391348700","151.101.2.187","100.84.170.161","TCP","240","[TCP Retransmission] 443  >  64433 [PSH, ACK] Seq=857102 Ack=298811 Win=5389 Len=186"
"578","43.391378300","100.84.170.161","151.101.2.187","TCP","66","64433  >  443 [ACK] Seq=298811 Ack=857288 Win=8206 Len=0 SLE=857102 SRE=857288"
"579","43.659579600","100.84.170.161","151.101.66.187","TCP","55","50935  >  443 [ACK] Seq=1 Ack=1 Win=512 Len=1"
"580","43.669590500","151.101.66.187","100.84.170.161","TCP","66","443  >  50935 [ACK] Seq=1 Ack=2 Win=281 Len=0 SLE=1 SRE=2"
"581","47.040948200","100.84.170.161","151.101.2.187","TLSv1.2","2474","Application Data"
"582","47.052207200","151.101.2.187","100.84.170.161","TCP","56","443  >  64433 [ACK] Seq=857288 Ack=301231 Win=5400 Len=0"
"583","47.053301500","100.84.170.161","151.101.2.187","TLSv1.2","2462","Application Data"
"584","47.055978700","151.101.2.187","100.84.170.161","TLSv1.2","241","Application Data"
"585","47.056080000","100.84.170.161","151.101.2.187","TCP","54","64433  >  443 [ACK] Seq=303639 Ack=857475 Win=8212 Len=0"
"586","47.062587600","151.101.2.187","100.84.170.161","TCP","56","443  >  64433 [ACK] Seq=857475 Ack=303639 Win=5412 Len=0"
"587","47.090316300","151.101.2.187","100.84.170.161","TLSv1.2","314","Application Data"
"588","47.090375500","100.84.170.161","151.101.2.187","TCP","54","64433  >  443 [ACK] Seq=303639 Ack=857735 Win=8211 Len=0"
"589","47.546832800","100.84.170.161","151.101.2.187","TLSv1.2","2474","Application Data"
"590","47.556196600","151.101.2.187","100.84.170.161","TCP","56","443  >  64433 [ACK] Seq=857735 Ack=306059 Win=5423 Len=0"
"591","47.557620800","100.84.170.161","151.101.2.187","TLSv1.2","2462","Application Data"
"592","47.561037500","151.101.2.187","100.84.170.161","TLSv1.2","214","Application Data"
"593","47.566847100","151.101.2.187","100.84.170.161","TCP","56","443  >  64433 [ACK] Seq=857895 Ack=308467 Win=5435 Len=0"
"594","47.571705800","151.101.2.187","100.84.170.161","TLSv1.2","125","Application Data"
"595","47.571785600","100.84.170.161","151.101.2.187","TCP","54","64433  >  443 [ACK] Seq=308467 Ack=857966 Win=8210 Len=0"
"596","48.503071500","100.84.170.161","151.101.2.187","TLSv1.2","2474","Application Data"
"597","48.515654700","151.101.2.187","100.84.170.161","TCP","56","443  >  64433 [ACK] Seq=857966 Ack=310887 Win=5446 Len=0"
"598","48.518893200","151.101.2.187","100.84.170.161","TLSv1.2","104","Application Data"
"599","48.533525900","100.84.170.161","151.101.2.187","TLSv1.2","2462","Application Data"
"600","48.542855400","151.101.2.187","100.84.170.161","TCP","56","443  >  64433 [ACK] Seq=858016 Ack=313295 Win=5452 Len=0"
"601","48.545767900","151.101.2.187","100.84.170.161","TLSv1.2","214","Application Data"
"602","48.578716100","151.101.2.187","100.84.170.161","TCP","214","[TCP Retransmission] 443  >  64433 [PSH, ACK] Seq=858016 Ack=313295 Win=5452 Len=160"
"603","48.578760000","100.84.170.161","151.101.2.187","TCP","66","64433  >  443 [ACK] Seq=313295 Ack=858176 Win=8209 Len=0 SLE=858016 SRE=858176"
"604","49.023657900","100.84.170.161","151.101.2.187","TLSv1.2","2474","Application Data"
"605","49.035021200","151.101.2.187","100.84.170.161","TCP","56","443  >  64433 [ACK] Seq=858176 Ack=315715 Win=5458 Len=0"
"606","49.040827500","100.84.170.161","151.101.2.187","TLSv1.2","2462","Application Data"
"607","49.050789600","151.101.2.187","100.84.170.161","TCP","56","443  >  64433 [ACK] Seq=858176 Ack=318123 Win=5463 Len=0"
"608","49.052892400","151.101.2.187","100.84.170.161","TLSv1.2","98","Application Data"
"609","49.055587100","151.101.2.187","100.84.170.161","TLSv1.2","104","Application Data"
"610","49.055676100","100.84.170.161","151.101.2.187","TCP","54","64433  >  443 [ACK] Seq=318123 Ack=858270 Win=8209 Len=0"
"611","53.813257600","100.84.170.161","151.101.2.187","TLSv1.2","2477","Application Data"
"612","53.816855500","100.84.170.161","151.101.2.187","TLSv1.2","2465","Application Data"
"613","53.817218200","100.84.170.161","151.101.2.187","TLSv1.2","2459","Application Data"
"614","53.819982800","100.84.170.161","151.101.2.187","TLSv1.2","2478","Application Data"
"615","53.825089300","151.101.2.187","100.84.170.161","TCP","56","443  >  64433 [ACK] Seq=858270 Ack=320546 Win=5469 Len=0"
"616","53.827364200","151.101.2.187","100.84.170.161","TCP","56","443  >  64433 [ACK] Seq=858270 Ack=325362 Win=5484 Len=0"
"617","53.827973300","151.101.2.187","100.84.170.161","TLSv1.2","241","Application Data"
"618","53.829307700","151.101.2.187","100.84.170.161","TCP","56","443  >  64433 [ACK] Seq=858457 Ack=327786 Win=5490 Len=0"
"619","53.829625800","151.101.2.187","100.84.170.161","TLSv1.2","130","Application Data"
"620","53.829666800","100.84.170.161","151.101.2.187","TCP","54","64433  >  443 [ACK] Seq=327786 Ack=858533 Win=8208 Len=0"
"621","53.830671000","151.101.2.187","100.84.170.161","TLSv1.2","130","Application Data"
"622","53.831259900","151.101.2.187","100.84.170.161","TLSv1.2","125","Application Data"
"623","53.831305100","100.84.170.161","151.101.2.187","TCP","54","64433  >  443 [ACK] Seq=327786 Ack=858680 Win=8207 Len=0"
"624","53.942352500","100.84.170.161","151.101.2.187","TLSv1.2","2481","Application Data"
"625","53.953184700","151.101.2.187","100.84.170.161","TCP","56","443  >  64433 [ACK] Seq=858680 Ack=330213 Win=5495 Len=0"
"626","53.955784800","151.101.2.187","100.84.170.161","TLSv1.2","130","Application Data"
"627","53.985052400","151.101.2.187","100.84.170.161","TCP","130","[TCP Retransmission] 443  >  64433 [PSH, ACK] Seq=858680 Ack=330213 Win=5495 Len=76"
"628","53.985092100","100.84.170.161","151.101.2.187","TCP","66","64433  >  443 [ACK] Seq=330213 Ack=858756 Win=8207 Len=0 SLE=858680 SRE=858756"
"629","54.217096500","100.84.170.161","151.101.2.187","TLSv1.2","2466","Application Data"
"630","54.217297000","100.84.170.161","151.101.2.187","TLSv1.2","2469","Application Data"
"631","54.217427200","100.84.170.161","151.101.2.187","TLSv1.2","2463","Application Data"
"632","54.217814600","100.84.170.161","151.101.2.187","TLSv1.2","2460","Application Data"
"633","54.227572700","151.101.2.187","100.84.170.161","TCP","56","443  >  64433 [ACK] Seq=858756 Ack=332625 Win=5501 Len=0"
"634","54.227572700","151.101.2.187","100.84.170.161","TCP","56","443  >  64433 [ACK] Seq=858756 Ack=337449 Win=5513 Len=0"
"635","54.228192300","151.101.2.187","100.84.170.161","TCP","56","443  >  64433 [ACK] Seq=858756 Ack=339855 Win=5518 Len=0"
"636","54.229440500","151.101.2.187","100.84.170.161","TLSv1.2","124","Application Data"
"637","54.229745900","151.101.2.187","100.84.170.161","TLSv1.2","130","Application Data"
"638","54.229780000","100.84.170.161","151.101.2.187","TCP","54","64433  >  443 [ACK] Seq=339855 Ack=858902 Win=8206 Len=0"
"639","54.229994200","151.101.2.187","100.84.170.161","TLSv1.2","124","Application Data"
"640","54.230694200","151.101.2.187","100.84.170.161","TLSv1.2","340","Application Data"
"641","54.230744200","100.84.170.161","151.101.2.187","TCP","54","64433  >  443 [ACK] Seq=339855 Ack=859258 Win=8212 Len=0"
"642","54.444025400","100.84.170.161","151.101.2.187","TLSv1.2","2475","Application Data"
"643","54.451856400","100.84.170.161","151.101.2.187","TLSv1.2","2463","Application Data"
"644","54.455657500","151.101.2.187","100.84.170.161","TCP","56","443  >  64433 [ACK] Seq=859258 Ack=342276 Win=5524 Len=0"
"645","54.458343800","151.101.2.187","100.84.170.161","TLSv1.2","131","Application Data"
"646","54.461527600","151.101.2.187","100.84.170.161","TCP","56","443  >  64433 [ACK] Seq=859335 Ack=344685 Win=5530 Len=0"
"647","54.463956200","151.101.2.187","100.84.170.161","TLSv1.2","131","Application Data"
"648","54.464039000","100.84.170.161","151.101.2.187","TCP","54","64433  >  443 [ACK] Seq=344685 Ack=859412 Win=8211 Len=0"
"649","54.860297800","100.84.170.161","151.101.2.187","TLSv1.2","2478","Application Data"
"650","54.869944800","151.101.2.187","100.84.170.161","TCP","56","443  >  64433 [ACK] Seq=859412 Ack=347109 Win=5535 Len=0"
"651","54.872637500","151.101.2.187","100.84.170.161","TLSv1.2","208","Application Data"
"652","54.879616600","100.84.170.161","151.101.2.187","TLSv1.2","2477","Application Data"
"653","54.881832800","100.84.170.161","151.101.2.187","TLSv1.2","2475","Application Data"
"654","54.888949400","151.101.2.187","100.84.170.161","TCP","56","443  >  64433 [ACK] Seq=859566 Ack=349532 Win=5541 Len=0"
"655","54.891205700","151.101.2.187","100.84.170.161","TCP","56","443  >  64433 [ACK] Seq=859566 Ack=351953 Win=5547 Len=0"
"656","54.892379700","151.101.2.187","100.84.170.161","TLSv1.2","98","Application Data"
"657","54.893484000","151.101.2.187","100.84.170.161","TLSv1.2","98","Application Data"
"658","54.893544600","100.84.170.161","151.101.2.187","TCP","54","64433  >  443 [ACK] Seq=351953 Ack=859654 Win=8210 Len=0"
"659","55.115193800","100.84.170.161","151.101.2.187","TLSv1.2","2465","Application Data"
"660","55.117519500","100.84.170.161","151.101.2.187","TLSv1.2","2459","Application Data"
"661","55.126153200","151.101.2.187","100.84.170.161","TCP","56","443  >  64433 [ACK] Seq=859654 Ack=354364 Win=5552 Len=0"
"662","55.126731600","151.101.2.187","100.84.170.161","TCP","56","443  >  64433 [ACK] Seq=859654 Ack=356769 Win=5558 Len=0"
"663","55.128354400","151.101.2.187","100.84.170.161","TLSv1.2","104","Application Data"
"664","55.128650200","151.101.2.187","100.84.170.161","TLSv1.2","104","Application Data"
"665","55.128686400","100.84.170.161","151.101.2.187","TCP","54","64433  >  443 [ACK] Seq=356769 Ack=859754 Win=8210 Len=0"
"666","55.281392200","100.84.170.161","151.101.2.187","TLSv1.2","2481","Application Data"
"667","55.292497200","151.101.2.187","100.84.170.161","TCP","56","443  >  64433 [ACK] Seq=859754 Ack=359196 Win=5564 Len=0"
"668","55.295029100","151.101.2.187","100.84.170.161","TLSv1.2","104","Application Data"
"669","55.313804300","100.84.170.161","151.101.2.187","TLSv1.2","2472","Application Data"
"670","55.323426600","151.101.2.187","100.84.170.161","TCP","56","443  >  64433 [ACK] Seq=859804 Ack=361614 Win=5570 Len=0"
"671","55.325736600","151.101.2.187","100.84.170.161","TLSv1.2","130","Application Data"
"672","55.360069500","151.101.2.187","100.84.170.161","TCP","130","[TCP Retransmission] 443  >  64433 [PSH, ACK] Seq=859804 Ack=361614 Win=5570 Len=76"
"673","55.360107200","100.84.170.161","151.101.2.187","TCP","66","64433  >  443 [ACK] Seq=361614 Ack=859880 Win=8210 Len=0 SLE=859804 SRE=859880"
"674","55.638077100","100.84.170.161","151.101.2.187","TLSv1.2","2479","Application Data"
"675","55.654961300","151.101.2.187","100.84.170.161","TCP","56","443  >  64433 [ACK] Seq=859880 Ack=364039 Win=5575 Len=0"
"676","55.655402200","151.101.2.187","100.84.170.161","TLSv1.2","240","Application Data"
"677","55.662297600","100.84.170.161","151.101.2.187","TLSv1.2","2480","Application Data"
"678","55.664998200","100.84.170.161","151.101.2.187","TLSv1.2","2470","Application Data"
"679","55.665714800","100.84.170.161","151.101.2.187","TLSv1.2","2473","Application Data"
"680","55.668135000","100.84.170.161","151.101.2.187","TLSv1.2","2467","Application Data"
"681","55.668317800","100.84.170.161","151.101.2.187","TLSv1.2","2464","Application Data"
"682","55.672026600","151.101.2.187","100.84.170.161","TCP","56","443  >  64433 [ACK] Seq=860066 Ack=366465 Win=5581 Len=0"
"683","55.674586400","151.101.2.187","100.84.170.161","TLSv1.2","130","Application Data"
"684","55.674912400","151.101.2.187","100.84.170.161","TCP","56","443  >  64433 [ACK] Seq=860142 Ack=368881 Win=5587 Len=0"
"685","55.675693500","151.101.2.187","100.84.170.161","TCP","56","443  >  64433 [ACK] Seq=860142 Ack=371300 Win=5592 Len=0"
"686","55.676817600","151.101.2.187","100.84.170.161","TLSv1.2","104","Application Data"
"687","55.676875500","100.84.170.161","151.101.2.187","TCP","54","64433  >  443 [ACK] Seq=376123 Ack=860192 Win=8208 Len=0"
"688","55.678084300","151.101.2.187","100.84.170.161","TLSv1.2","98","Application Data"
"689","55.680381300","151.101.2.187","100.84.170.161","TLSv1.2","98","Application Data"
"690","55.680442600","100.84.170.161","151.101.2.187","TCP","54","64433  >  443 [ACK] Seq=376123 Ack=860280 Win=8208 Len=0"
"691","55.680693400","151.101.2.187","100.84.170.161","TLSv1.2","104","Application Data"
"692","55.722927000","151.101.2.187","100.84.170.161","TCP","104","[TCP Retransmission] 443  >  64433 [PSH, ACK] Seq=860280 Ack=376123 Win=5604 Len=50"
"693","55.722966800","100.84.170.161","151.101.2.187","TCP","66","64433  >  443 [ACK] Seq=376123 Ack=860330 Win=8208 Len=0 SLE=860280 SRE=860330"
"694","55.832904000","100.84.170.161","151.101.2.187","TLSv1.2","2475","Application Data"
"695","55.842967400","100.84.170.161","151.101.2.187","TLSv1.2","2463","Application Data"
"696","55.843937000","151.101.2.187","100.84.170.161","TCP","56","443  >  64433 [ACK] Seq=860330 Ack=378544 Win=5609 Len=0"
"697","55.846534000","151.101.2.187","100.84.170.161","TLSv1.2","98","Application Data"
"698","55.852201000","151.101.2.187","100.84.170.161","TCP","56","443  >  64433 [ACK] Seq=860374 Ack=380953 Win=5615 Len=0"
"699","55.854893400","151.101.2.187","100.84.170.161","TLSv1.2","104","Application Data"
"700","55.854956900","100.84.170.161","151.101.2.187","TCP","54","64433  >  443 [ACK] Seq=380953 Ack=860424 Win=8207 Len=0"
"701","55.999451300","100.84.170.161","151.101.2.187","TLSv1.2","2476","Application Data"
"702","56.010917600","151.101.2.187","100.84.170.161","TCP","56","443  >  64433 [ACK] Seq=860424 Ack=383375 Win=5621 Len=0"
"703","56.028299700","151.101.2.187","100.84.170.161","TLSv1.2","98","Application Data"
"704","56.061761100","151.101.2.187","100.84.170.161","TCP","98","[TCP Retransmission] 443  >  64433 [PSH, ACK] Seq=860424 Ack=383375 Win=5621 Len=44"
"705","56.061831700","100.84.170.161","151.101.2.187","TCP","66","64433  >  443 [ACK] Seq=383375 Ack=860468 Win=8207 Len=0 SLE=860424 SRE=860468"
"706","59.816291500","100.84.170.161","151.101.2.187","TLSv1.2","2475","Application Data"
"707","59.827764300","151.101.2.187","100.84.170.161","TCP","56","443  >  64433 [ACK] Seq=860468 Ack=385796 Win=5627 Len=0"
"708","59.829845500","151.101.2.187","100.84.170.161","TLSv1.2","214","Application Data"
"709","59.836930800","100.84.170.161","151.101.2.187","TLSv1.2","2463","Application Data"
"710","59.846755700","151.101.2.187","100.84.170.161","TCP","56","443  >  64433 [ACK] Seq=860628 Ack=388205 Win=5632 Len=0"
"711","59.849246000","151.101.2.187","100.84.170.161","TLSv1.2","148","Application Data"
"712","59.873672500","100.84.170.161","151.101.2.187","TLSv1.2","2477","Application Data"
"713","59.882648900","151.101.2.187","100.84.170.161","TCP","148","[TCP Spurious Retransmission] 443  >  64433 [PSH, ACK] Seq=860628 Ack=388205 Win=5632 Len=94"
"714","59.882687300","100.84.170.161","151.101.2.187","TCP","66","[TCP Dup ACK 712#1] 64433  >  443 [ACK] Seq=390628 Ack=860722 Win=8212 Len=0 SLE=860628 SRE=860722"
"715","59.882932400","151.101.2.187","100.84.170.161","TCP","56","443  >  64433 [ACK] Seq=860722 Ack=390628 Win=5638 Len=0"
"716","59.885915100","151.101.2.187","100.84.170.161","TLSv1.2","270","Application Data"
"717","59.920586100","151.101.2.187","100.84.170.161","TCP","270","[TCP Retransmission] 443  >  64433 [PSH, ACK] Seq=860722 Ack=390628 Win=5638 Len=216"
"718","59.920623900","100.84.170.161","151.101.2.187","TCP","66","64433  >  443 [ACK] Seq=390628 Ack=860938 Win=8211 Len=0 SLE=860722 SRE=860938"
"719","60.702427500","100.84.170.161","151.101.2.187","TLSv1.2","2475","Application Data"
"720","60.712316500","100.84.170.161","151.101.2.187","TLSv1.2","2463","Application Data"
"721","60.712787700","151.101.2.187","100.84.170.161","TCP","56","443  >  64433 [ACK] Seq=860938 Ack=393049 Win=5644 Len=0"
"722","60.715963000","151.101.2.187","100.84.170.161","TLSv1.2","241","Application Data"
"723","60.721859600","151.101.2.187","100.84.170.161","TCP","56","443  >  64433 [ACK] Seq=861125 Ack=395458 Win=5649 Len=0"
"724","60.725074900","151.101.2.187","100.84.170.161","TLSv1.2","131","Application Data"
"725","60.725148400","100.84.170.161","151.101.2.187","TCP","54","64433  >  443 [ACK] Seq=395458 Ack=861202 Win=8210 Len=0"
"726","61.470173500","100.84.170.161","151.101.2.187","TLSv1.2","2475","Application Data"
"727","61.482106900","151.101.2.187","100.84.170.161","TCP","56","443  >  64433 [ACK] Seq=861202 Ack=397879 Win=5655 Len=0"
"728","61.484948900","151.101.2.187","100.84.170.161","TLSv1.2","104","Application Data"
"729","61.485835900","100.84.170.161","151.101.2.187","TLSv1.2","2463","Application Data"
"730","61.495077800","151.101.2.187","100.84.170.161","TCP","56","443  >  64433 [ACK] Seq=861252 Ack=400288 Win=5661 Len=0"
"731","61.498316400","151.101.2.187","100.84.170.161","TLSv1.2","104","Application Data"
"732","61.532653900","151.101.2.187","100.84.170.161","TCP","104","[TCP Retransmission] 443  >  64433 [PSH, ACK] Seq=861252 Ack=400288 Win=5661 Len=50"
"733","61.532804000","100.84.170.161","151.101.2.187","TCP","66","64433  >  443 [ACK] Seq=400288 Ack=861302 Win=8210 Len=0 SLE=861252 SRE=861302"
"734","61.538426600","100.84.170.161","151.101.2.187","TLSv1.2","2480","Application Data"
"735","61.547778100","151.101.2.187","100.84.170.161","TCP","56","443  >  64433 [ACK] Seq=861302 Ack=402714 Win=5667 Len=0"
"736","61.550234200","151.101.2.187","100.84.170.161","TLSv1.2","208","Application Data"
"737","61.583884600","151.101.2.187","100.84.170.161","TCP","208","[TCP Retransmission] 443  >  64433 [PSH, ACK] Seq=861302 Ack=402714 Win=5667 Len=154"
"738","61.583939700","100.84.170.161","151.101.2.187","TCP","66","64433  >  443 [ACK] Seq=402714 Ack=861456 Win=8209 Len=0 SLE=861302 SRE=861456"
"739","61.942205100","100.84.170.161","151.101.2.187","TLSv1.2","2475","Application Data"
"740","61.951357800","151.101.2.187","100.84.170.161","TCP","56","443  >  64433 [ACK] Seq=861456 Ack=405135 Win=5672 Len=0"
"741","61.953860200","151.101.2.187","100.84.170.161","TLSv1.2","98","Application Data"
"742","61.959768900","100.84.170.161","151.101.2.187","TLSv1.2","2463","Application Data"
"743","61.968960500","151.101.2.187","100.84.170.161","TCP","56","443  >  64433 [ACK] Seq=861500 Ack=407544 Win=5678 Len=0"
"744","61.971166800","151.101.2.187","100.84.170.161","TLSv1.2","98","Application Data"
"745","62.004711100","151.101.2.187","100.84.170.161","TCP","98","[TCP Retransmission] 443  >  64433 [PSH, ACK] Seq=861500 Ack=407544 Win=5678 Len=44"
"746","62.004741600","100.84.170.161","151.101.2.187","TCP","66","[TCP Previous segment not captured] 64433  >  443 [ACK] Seq=409971 Ack=861544 Win=8209 Len=0 SLE=861500 SRE=861544"
"747","62.004740600","100.84.170.161","151.101.2.187","TLSv1.2","2481","[TCP Out-Of-Order] , Application Data"
"748","62.013972900","151.101.2.187","100.84.170.161","TCP","56","443  >  64433 [ACK] Seq=861544 Ack=409971 Win=5684 Len=0"
"749","62.016844200","151.101.2.187","100.84.170.161","TLSv1.2","104","Application Data"
"750","62.050528600","151.101.2.187","100.84.170.161","TCP","104","[TCP Retransmission] 443  >  64433 [PSH, ACK] Seq=861544 Ack=409971 Win=5684 Len=50"
"751","62.050608500","100.84.170.161","151.101.2.187","TCP","66","64433  >  443 [ACK] Seq=409971 Ack=861594 Win=8209 Len=0 SLE=861544 SRE=861594"
