No.,Time,Source,Destination,Protocol,Length,Info
1,0.0,172.20.40.110,151.101.66.187,TLSv1.2,2786,Application Data
2,0.001011,172.20.40.110,151.101.66.187,TLSv1.2,93,Application Data
3,0.0140607,151.101.66.187,172.20.40.110,TCP,60,443  >  57039 [ACK] Seq=1 Ack=2733 Win=1327 Len=0
4,0.0140607,151.101.66.187,172.20.40.110,TCP,60,443  >  57039 [ACK] Seq=1 Ack=2772 Win=1327 Len=0
5,0.0140607,151.101.66.187,172.20.40.110,TLSv1.2,93,Application Data
6,0.0578868,172.20.40.110,151.101.66.187,TCP,54,57039  >  443 [ACK] Seq=2772 Ack=40 Win=513 Len=0
7,0.2766811,151.101.66.187,172.20.40.110,TLSv1.2,1100,Application Data
8,0.2766811,151.101.66.187,172.20.40.110,TCP,1434,443  >  57039 [ACK] Seq=1086 Ack=2772 Win=1327 Len=1380 [TCP PDU reassembled in 13]
9,0.2766811,151.101.66.187,172.20.40.110,TCP,1434,443  >  57039 [ACK] Seq=2466 Ack=2772 Win=1327 Len=1380 [TCP PDU reassembled in 13]
10,0.2766811,151.101.66.187,172.20.40.110,TCP,1434,443  >  57039 [ACK] Seq=3846 Ack=2772 Win=1327 Len=1380 [TCP PDU reassembled in 13]
11,0.2766811,151.101.66.187,172.20.40.110,TCP,1434,"443  >  57039 [PSH, ACK] Seq=5226 Ack=2772 Win=1327 Len=1380 [TCP PDU reassembled in 13]"
12,0.2768402,172.20.40.110,151.101.66.187,TCP,54,57039  >  443 [ACK] Seq=2772 Ack=6606 Win=517 Len=0
13,0.2797356,151.101.66.187,172.20.40.110,TLSv1.2,1180,Application Data
14,0.2797356,151.101.66.187,172.20.40.110,TCP,1434,443  >  57039 [ACK] Seq=7732 Ack=2772 Win=1327 Len=1380 [TCP PDU reassembled in 18]
15,0.2797356,151.101.66.187,172.20.40.110,TCP,4194,"443  >  57039 [PSH, ACK] Seq=9112 Ack=2772 Win=1327 Len=4140 [TCP PDU reassembled in 18]"
16,0.2798962,172.20.40.110,151.101.66.187,TCP,54,57039  >  443 [ACK] Seq=2772 Ack=13252 Win=517 Len=0
17,0.28301,151.101.66.187,172.20.40.110,TCP,1434,443  >  57039 [ACK] Seq=13252 Ack=2772 Win=1327 Len=1380 [TCP PDU reassembled in 18]
18,0.28301,151.101.66.187,172.20.40.110,TLSv1.2,1377,Application Data
19,0.28301,151.101.66.187,172.20.40.110,TCP,4194,443  >  57039 [ACK] Seq=15955 Ack=2772 Win=1327 Len=4140 [TCP PDU reassembled in 22]
20,0.2832236,172.20.40.110,151.101.66.187,TCP,54,57039  >  443 [ACK] Seq=2772 Ack=20095 Win=517 Len=0
21,0.2852436,151.101.66.187,172.20.40.110,TCP,2814,"443  >  57039 [PSH, ACK] Seq=20095 Ack=2772 Win=1327 Len=2760 [TCP PDU reassembled in 22]"
22,0.2852436,151.101.66.187,172.20.40.110,TLSv1.2,617,Application Data
23,0.2853661,172.20.40.110,151.101.66.187,TCP,54,57039  >  443 [ACK] Seq=2772 Ack=23418 Win=517 Len=0
24,0.2858416,172.20.40.110,151.101.66.187,TLSv1.2,89,Application Data
25,0.2929407,151.101.66.187,172.20.40.110,TCP,60,443  >  57039 [ACK] Seq=23418 Ack=2807 Win=1327 Len=0
26,0.4516093,172.20.40.110,151.101.66.187,TLSv1.2,2777,Application Data
27,0.4692726,151.101.66.187,172.20.40.110,TCP,60,443  >  57039 [ACK] Seq=23418 Ack=5530 Win=1338 Len=0
28,0.4709906,151.101.66.187,172.20.40.110,TLSv1.2,418,Application Data
29,0.5173688,172.20.40.110,151.101.66.187,TCP,54,57039  >  443 [ACK] Seq=5530 Ack=23782 Win=516 Len=0
30,1.3594743,172.20.40.110,151.101.66.187,TLSv1.2,2896,Application Data
31,1.3697848,151.101.66.187,172.20.40.110,TCP,60,443  >  57039 [ACK] Seq=23782 Ack=8372 Win=1349 Len=0
32,1.3930009,172.20.40.110,151.101.66.187,TLSv1.2,2777,Application Data
33,1.4052137,151.101.66.187,172.20.40.110,TCP,60,443  >  57039 [ACK] Seq=23782 Ack=11095 Win=1360 Len=0
34,1.4086194,151.101.66.187,172.20.40.110,TLSv1.2,214,Application Data
35,1.4562277,172.20.40.110,151.101.66.187,TCP,54,57039  >  443 [ACK] Seq=11095 Ack=23942 Win=515 Len=0
36,1.459033,172.20.40.110,151.101.66.187,TLSv1.2,89,Application Data
37,1.4677149,151.101.66.187,172.20.40.110,TCP,60,443  >  57039 [ACK] Seq=23942 Ack=11130 Win=1360 Len=0
38,1.5382917,172.20.40.110,151.101.66.187,TLSv1.2,2779,Application Data
39,1.550126,151.101.66.187,172.20.40.110,TCP,60,443  >  57039 [ACK] Seq=23942 Ack=13855 Win=1370 Len=0
40,1.550126,151.101.66.187,172.20.40.110,TLSv1.2,136,Application Data
41,1.5950001,172.20.40.110,151.101.66.187,TCP,54,57039  >  443 [ACK] Seq=13855 Ack=24024 Win=515 Len=0
42,1.6215803,172.20.40.110,151.101.66.187,TLSv1.2,2866,Application Data
43,1.6379344,151.101.66.187,172.20.40.110,TCP,60,443  >  57039 [ACK] Seq=24024 Ack=16667 Win=1381 Len=0
44,1.8458055,151.101.66.187,172.20.40.110,TLSv1.2,772,Application Data
45,1.8458055,151.101.66.187,172.20.40.110,TCP,5574,"443  >  57039 [PSH, ACK] Seq=24742 Ack=16667 Win=1381 Len=5520 [TCP PDU reassembled in 46]"
46,1.8458055,151.101.66.187,172.20.40.110,TLSv1.2,1197,Application Data
47,1.8458055,151.101.66.187,172.20.40.110,TCP,2814,443  >  57039 [ACK] Seq=31405 Ack=16667 Win=1381 Len=2760 [TCP PDU reassembled in 52]
48,1.8459358,172.20.40.110,151.101.66.187,TCP,54,57039  >  443 [ACK] Seq=16667 Ack=34165 Win=517 Len=0
49,1.8489851,151.101.66.187,172.20.40.110,TCP,9714,"443  >  57039 [PSH, ACK] Seq=34165 Ack=16667 Win=1381 Len=9660 [TCP PDU reassembled in 52]"
50,1.8491035,172.20.40.110,151.101.66.187,TCP,54,57039  >  443 [ACK] Seq=16667 Ack=43825 Win=517 Len=0
51,1.8522352,151.101.66.187,172.20.40.110,TCP,1434,443  >  57039 [ACK] Seq=43825 Ack=16667 Win=1381 Len=1380 [TCP PDU reassembled in 52]
52,1.8522352,151.101.66.187,172.20.40.110,TLSv1.2,908,Application Data
53,1.8523434,172.20.40.110,151.101.66.187,TCP,54,57039  >  443 [ACK] Seq=16667 Ack=46059 Win=517 Len=0
54,4.984253,172.20.40.110,151.101.66.187,TLSv1.2,2888,Application Data
55,4.9845471,172.20.40.110,151.101.66.187,TLSv1.2,2881,Application Data
56,5.0040689,151.101.66.187,172.20.40.110,TCP,60,443  >  57039 [ACK] Seq=46059 Ack=19501 Win=1393 Len=0
57,5.0040689,151.101.66.187,172.20.40.110,TCP,60,443  >  57039 [ACK] Seq=46059 Ack=22328 Win=1404 Len=0
58,5.0060527,151.101.66.187,172.20.40.110,TLSv1.2,240,Application Data
59,5.0060527,151.101.66.187,172.20.40.110,TLSv1.2,131,Application Data
60,5.0061623,172.20.40.110,151.101.66.187,TCP,54,57039  >  443 [ACK] Seq=22328 Ack=46322 Win=516 Len=0
61,5.3091281,172.20.40.110,151.101.66.187,TLSv1.2,2898,Application Data
62,5.3200258,151.101.66.187,172.20.40.110,TCP,60,443  >  57039 [ACK] Seq=46322 Ack=25172 Win=1415 Len=0
63,5.3287795,151.101.66.187,172.20.40.110,TLSv1.2,130,Application Data
64,5.3704923,172.20.40.110,151.101.66.187,TCP,54,57039  >  443 [ACK] Seq=25172 Ack=46398 Win=516 Len=0
65,6.0638627,172.20.40.110,151.101.66.187,TLSv1.2,2883,Application Data
66,6.0757787,151.101.66.187,172.20.40.110,TCP,60,443  >  57039 [ACK] Seq=46398 Ack=28001 Win=1426 Len=0
67,6.078201,151.101.66.187,172.20.40.110,TLSv1.2,241,Application Data
68,6.1209871,172.20.40.110,151.101.66.187,TCP,54,57039  >  443 [ACK] Seq=28001 Ack=46585 Win=515 Len=0
69,7.7783654,172.20.40.110,151.101.66.187,TLSv1.2,2590,Application Data
70,7.7934422,151.101.66.187,172.20.40.110,TCP,60,443  >  57039 [ACK] Seq=46585 Ack=30537 Win=1436 Len=0
71,7.862223,151.101.66.187,172.20.40.110,TLSv1.2,748,Application Data
72,7.8637184,172.20.40.110,151.101.66.187,TLSv1.2,89,Application Data
73,7.8707028,151.101.66.187,172.20.40.110,TCP,60,443  >  57039 [ACK] Seq=47279 Ack=30572 Win=1436 Len=0
74,13.8552066,172.20.40.110,151.101.66.187,TLSv1.2,2590,Application Data
75,13.8710068,151.101.66.187,172.20.40.110,TCP,60,443  >  57039 [ACK] Seq=47279 Ack=33108 Win=1446 Len=0
76,13.9612944,151.101.66.187,172.20.40.110,TLSv1.2,239,Application Data
77,13.9612944,151.101.66.187,172.20.40.110,TLSv1.2,357,Application Data
78,13.961394,172.20.40.110,151.101.66.187,TCP,54,57039  >  443 [ACK] Seq=33108 Ack=47767 Win=517 Len=0
79,13.9634986,172.20.40.110,151.101.66.187,TLSv1.2,89,Application Data
80,13.9721945,151.101.66.187,172.20.40.110,TCP,60,443  >  57039 [ACK] Seq=47767 Ack=33143 Win=1446 Len=0
81,14.4566094,172.20.40.110,151.101.66.187,TLSv1.2,2786,Application Data
82,14.4656837,151.101.66.187,172.20.40.110,TCP,60,443  >  57039 [ACK] Seq=47767 Ack=35875 Win=1456 Len=0
83,15.1576925,151.101.66.187,172.20.40.110,TLSv1.2,354,Application Data
84,15.1576925,151.101.66.187,172.20.40.110,TCP,9714,"443  >  57039 [PSH, ACK] Seq=48067 Ack=35875 Win=1456 Len=9660 [TCP PDU reassembled in 86]"
85,15.1577944,172.20.40.110,151.101.66.187,TCP,54,57039  >  443 [ACK] Seq=35875 Ack=57727 Win=517 Len=0
86,15.1608392,151.101.66.187,172.20.40.110,TLSv1.2,9714,Application Data
87,15.1609532,172.20.40.110,151.101.66.187,TCP,54,57039  >  443 [ACK] Seq=35875 Ack=67387 Win=517 Len=0
88,15.1649814,151.101.66.187,172.20.40.110,TCP,1434,443  >  57039 [ACK] Seq=67387 Ack=35875 Win=1456 Len=1380 [TCP PDU reassembled in 92]
89,15.1649814,151.101.66.187,172.20.40.110,TCP,1434,"443  >  57039 [PSH, ACK] Seq=68767 Ack=35875 Win=1456 Len=1380 [TCP PDU reassembled in 92]"
90,15.1649814,151.101.66.187,172.20.40.110,TCP,1434,443  >  57039 [ACK] Seq=70147 Ack=35875 Win=1456 Len=1380 [TCP PDU reassembled in 92]
91,15.1649814,151.101.66.187,172.20.40.110,TCP,1434,443  >  57039 [ACK] Seq=71527 Ack=35875 Win=1456 Len=1380 [TCP PDU reassembled in 92]
92,15.1649814,151.101.66.187,172.20.40.110,TLSv1.2,4194,Application Data
93,15.1651753,172.20.40.110,151.101.66.187,TCP,54,57039  >  443 [ACK] Seq=35875 Ack=77047 Win=517 Len=0
94,15.1674229,151.101.66.187,172.20.40.110,TLSv1.2,9714,Application Data
95,15.1675671,172.20.40.110,151.101.66.187,TCP,54,57039  >  443 [ACK] Seq=35875 Ack=86707 Win=517 Len=0
96,15.1699183,151.101.66.187,172.20.40.110,TCP,9714,"443  >  57039 [PSH, ACK] Seq=86707 Ack=35875 Win=1456 Len=9660 [TCP PDU reassembled in 98]"
97,15.1700406,172.20.40.110,151.101.66.187,TCP,54,57039  >  443 [ACK] Seq=35875 Ack=96367 Win=517 Len=0
98,15.1730911,151.101.66.187,172.20.40.110,TLSv1.2,9714,"Application Data, Application Data"
99,15.1731945,172.20.40.110,151.101.66.187,TCP,54,57039  >  443 [ACK] Seq=35875 Ack=106027 Win=517 Len=0
100,15.1753587,151.101.66.187,172.20.40.110,TCP,1434,443  >  57039 [ACK] Seq=106027 Ack=35875 Win=1456 Len=1380 [TCP PDU reassembled in 101]
101,15.1753587,151.101.66.187,172.20.40.110,TLSv1.2,998,"Application Data, Application Data"
102,15.1754622,172.20.40.110,151.101.66.187,TCP,54,57039  >  443 [ACK] Seq=35875 Ack=108351 Win=517 Len=0
103,15.3355283,172.20.40.110,151.101.66.187,TLSv1.2,2778,Application Data
104,15.3364669,172.20.40.110,151.101.66.187,TLSv1.2,2780,Application Data
105,15.3367313,172.20.40.110,151.101.66.187,TLSv1.2,2784,Application Data
106,15.3440693,151.101.66.187,172.20.40.110,TCP,60,443  >  57039 [ACK] Seq=108351 Ack=38599 Win=1467 Len=0
107,15.3472975,151.101.66.187,172.20.40.110,TLSv1.2,292,Application Data
108,15.3483126,151.101.66.187,172.20.40.110,TCP,60,443  >  57039 [ACK] Seq=108589 Ack=41325 Win=1477 Len=0
109,15.3483126,151.101.66.187,172.20.40.110,TCP,60,443  >  57039 [ACK] Seq=108589 Ack=44055 Win=1488 Len=0
110,15.3515795,151.101.66.187,172.20.40.110,TLSv1.2,157,Application Data
111,15.3515795,151.101.66.187,172.20.40.110,TLSv1.2,131,Application Data
112,15.3516525,172.20.40.110,151.101.66.187,TCP,54,57039  >  443 [ACK] Seq=44055 Ack=108769 Win=515 Len=0
113,15.3611817,172.20.40.110,151.101.66.187,TLSv1.2,2778,Application Data
114,15.3614201,172.20.40.110,151.101.66.187,TLSv1.2,2776,Application Data
115,15.3753474,151.101.66.187,172.20.40.110,TCP,60,443  >  57039 [ACK] Seq=108769 Ack=46779 Win=1499 Len=0
116,15.3753474,151.101.66.187,172.20.40.110,TCP,60,443  >  57039 [ACK] Seq=108769 Ack=49501 Win=1509 Len=0
117,15.3764138,151.101.66.187,172.20.40.110,TLSv1.2,206,"Application Data, Application Data"
118,15.376495,172.20.40.110,151.101.66.187,TCP,54,57039  >  443 [ACK] Seq=49501 Ack=108921 Win=515 Len=0
119,15.3938442,172.20.40.110,151.101.66.187,TLSv1.2,2795,Application Data
120,15.3944374,172.20.40.110,151.101.66.187,TLSv1.2,2794,Application Data
121,15.4062283,151.101.66.187,172.20.40.110,TCP,60,443  >  57039 [ACK] Seq=108921 Ack=52242 Win=1520 Len=0
122,15.4062283,151.101.66.187,172.20.40.110,TCP,60,443  >  57039 [ACK] Seq=108921 Ack=54982 Win=1531 Len=0
123,15.4097141,151.101.66.187,172.20.40.110,TLSv1.2,125,Application Data
124,15.4097141,151.101.66.187,172.20.40.110,TLSv1.2,253,Application Data
125,15.4097976,172.20.40.110,151.101.66.187,TCP,54,57039  >  443 [ACK] Seq=54982 Ack=109191 Win=514 Len=0
126,15.4816002,172.20.40.110,151.101.66.187,TLSv1.2,2778,Application Data
127,15.4901016,151.101.66.187,172.20.40.110,TCP,60,443  >  57039 [ACK] Seq=109191 Ack=57706 Win=1541 Len=0
128,15.4932693,151.101.66.187,172.20.40.110,TLSv1.2,124,Application Data
129,15.5414168,172.20.40.110,151.101.66.187,TCP,54,57039  >  443 [ACK] Seq=57706 Ack=109261 Win=513 Len=0
130,15.9392532,172.20.40.110,151.101.66.187,TLSv1.2,2798,Application Data
131,15.9397937,172.20.40.110,151.101.66.187,TLSv1.2,2799,Application Data
132,15.9591581,151.101.66.187,172.20.40.110,TCP,60,443  >  57039 [ACK] Seq=109261 Ack=60450 Win=1552 Len=0
133,15.9591581,151.101.66.187,172.20.40.110,TCP,60,443  >  57039 [ACK] Seq=109261 Ack=63195 Win=1563 Len=0
134,15.9605068,151.101.66.187,172.20.40.110,TLSv1.2,104,Application Data
135,15.9605068,151.101.66.187,172.20.40.110,TLSv1.2,98,Application Data
136,15.9606364,172.20.40.110,151.101.66.187,TCP,54,57039  >  443 [ACK] Seq=63195 Ack=109355 Win=513 Len=0
137,17.8768306,172.20.40.110,151.101.66.187,TLSv1.2,2782,Application Data
138,17.8789207,172.20.40.110,151.101.66.187,TLSv1.2,2778,Application Data
139,17.8875026,151.101.66.187,172.20.40.110,TCP,60,443  >  57039 [ACK] Seq=109355 Ack=65923 Win=1574 Len=0
140,17.8898483,151.101.66.187,172.20.40.110,TCP,60,443  >  57039 [ACK] Seq=109355 Ack=68647 Win=1584 Len=0
141,17.8898483,151.101.66.187,172.20.40.110,TLSv1.2,239,Application Data
142,17.8909555,151.101.66.187,172.20.40.110,TLSv1.2,136,Application Data
143,17.8910356,172.20.40.110,151.101.66.187,TCP,54,57039  >  443 [ACK] Seq=68647 Ack=109622 Win=512 Len=0
144,19.9597359,172.20.40.110,151.101.66.187,TLSv1.2,2786,Application Data
145,19.960274,172.20.40.110,151.101.66.187,TLSv1.2,2788,Application Data
146,19.967914,172.20.40.110,151.101.66.187,TLSv1.2,2782,Application Data
147,19.9685571,172.20.40.110,151.101.66.187,TLSv1.2,2784,Application Data
148,19.9716939,172.20.40.110,151.101.66.187,TLSv1.2,2782,Application Data
149,19.9724214,172.20.40.110,151.101.66.187,TLSv1.2,2780,Application Data
150,19.9789337,151.101.66.187,172.20.40.110,TCP,60,443  >  57039 [ACK] Seq=109622 Ack=71379 Win=1595 Len=0
151,19.9789337,151.101.66.187,172.20.40.110,TCP,60,443  >  57039 [ACK] Seq=109622 Ack=74113 Win=1606 Len=0
152,19.9789337,151.101.66.187,172.20.40.110,TLSv1.2,214,Application Data
153,19.9789337,151.101.66.187,172.20.40.110,TLSv1.2,147,Application Data
154,19.9791076,172.20.40.110,151.101.66.187,TCP,54,57039  >  443 [ACK] Seq=85025 Ack=109875 Win=517 Len=0
155,19.9795333,151.101.66.187,172.20.40.110,TCP,60,443  >  57039 [ACK] Seq=109875 Ack=76841 Win=1617 Len=0
156,19.9795333,151.101.66.187,172.20.40.110,TCP,60,443  >  57039 [ACK] Seq=109875 Ack=79571 Win=1628 Len=0
157,19.9913347,151.101.66.187,172.20.40.110,TCP,60,443  >  57039 [ACK] Seq=109875 Ack=82299 Win=1638 Len=0
158,19.9913347,151.101.66.187,172.20.40.110,TCP,60,443  >  57039 [ACK] Seq=109875 Ack=85025 Win=1649 Len=0
159,19.9913347,151.101.66.187,172.20.40.110,TLSv1.2,138,Application Data
160,19.9913347,151.101.66.187,172.20.40.110,TLSv1.2,104,Application Data
161,19.9914599,172.20.40.110,151.101.66.187,TCP,54,57039  >  443 [ACK] Seq=85025 Ack=110009 Win=516 Len=0
162,20.0027183,151.101.66.187,172.20.40.110,TLSv1.2,104,Application Data
163,20.0058422,151.101.66.187,172.20.40.110,TLSv1.2,131,Application Data
164,20.0059211,172.20.40.110,151.101.66.187,TCP,54,57039  >  443 [ACK] Seq=85025 Ack=110136 Win=516 Len=0
165,20.0900015,172.20.40.110,151.101.66.187,TLSv1.2,2782,Application Data
166,20.1014191,172.20.40.110,151.101.66.187,TLSv1.2,2782,Application Data
167,20.1015032,151.101.66.187,172.20.40.110,TCP,60,443  >  57039 [ACK] Seq=110136 Ack=87753 Win=1660 Len=0
168,20.1052795,151.101.66.187,172.20.40.110,TLSv1.2,98,Application Data
169,20.1125142,151.101.66.187,172.20.40.110,TCP,60,443  >  57039 [ACK] Seq=110180 Ack=90481 Win=1670 Len=0
170,20.1157355,151.101.66.187,172.20.40.110,TLSv1.2,104,Application Data
171,20.1158099,172.20.40.110,151.101.66.187,TCP,54,57039  >  443 [ACK] Seq=90481 Ack=110230 Win=516 Len=0
172,20.7156773,172.20.40.110,151.101.66.187,TLSv1.2,2795,Application Data
173,20.7279037,151.101.66.187,172.20.40.110,TCP,60,443  >  57039 [ACK] Seq=110230 Ack=93222 Win=1681 Len=0
174,20.7328096,151.101.66.187,172.20.40.110,TLSv1.2,214,Application Data
175,20.7863325,172.20.40.110,151.101.66.187,TCP,54,57039  >  443 [ACK] Seq=93222 Ack=110390 Win=515 Len=0
176,20.7872035,151.101.66.187,172.20.40.110,TCP,214,"[TCP Spurious Retransmission] 443  >  57039 [PSH, ACK] Seq=110230 Ack=93222 Win=1681 Len=160"
177,20.7872817,172.20.40.110,151.101.66.187,TCP,66,[TCP Dup ACK 175#1] 57039  >  443 [ACK] Seq=93222 Ack=110390 Win=515 Len=0 SLE=110230 SRE=110390
178,20.8159526,172.20.40.110,151.101.66.187,TLSv1.2,2794,Application Data
179,20.8270394,151.101.66.187,172.20.40.110,TCP,60,443  >  57039 [ACK] Seq=110390 Ack=95962 Win=1692 Len=0
180,20.8305551,151.101.66.187,172.20.40.110,TLSv1.2,98,Application Data
181,20.8754538,172.20.40.110,151.101.66.187,TCP,54,57039  >  443 [ACK] Seq=95962 Ack=110434 Win=515 Len=0
182,21.214181,172.20.40.110,151.101.66.187,TLSv1.2,2780,Application Data
183,21.2146558,172.20.40.110,151.101.66.187,TLSv1.2,2783,Application Data
184,21.2322878,151.101.66.187,172.20.40.110,TCP,60,443  >  57039 [ACK] Seq=110434 Ack=98688 Win=1702 Len=0
185,21.2322878,151.101.66.187,172.20.40.110,TCP,60,443  >  57039 [ACK] Seq=110434 Ack=101417 Win=1713 Len=0
186,21.2327947,172.20.40.110,151.101.66.187,TLSv1.2,2786,Application Data
187,21.2329954,172.20.40.110,151.101.66.187,TLSv1.2,2780,Application Data
188,21.2331128,172.20.40.110,151.101.66.187,TLSv1.2,2787,Application Data
189,21.2332244,172.20.40.110,151.101.66.187,TLSv1.2,2786,Application Data
190,21.2334279,172.20.40.110,151.101.66.187,TLSv1.2,2780,Application Data
191,21.2336322,172.20.40.110,151.101.66.187,TLSv1.2,2780,Application Data
192,21.2338389,172.20.40.110,151.101.66.187,TLSv1.2,2786,Application Data
193,21.235092,172.20.40.110,151.101.66.187,TLSv1.2,2779,Application Data
194,21.237598,172.20.40.110,151.101.66.187,TLSv1.2,2777,Application Data
195,21.2473968,151.101.66.187,172.20.40.110,TLSv1.2,130,Application Data
196,21.2473968,151.101.66.187,172.20.40.110,TLSv1.2,258,Application Data
197,21.2475268,172.20.40.110,151.101.66.187,TCP,54,57039  >  443 [ACK] Seq=125972 Ack=110714 Win=514 Len=0
198,21.2569631,151.101.66.187,172.20.40.110,TCP,60,443  >  57039 [ACK] Seq=110714 Ack=102797 Win=1719 Len=0
199,21.2598131,151.101.66.187,172.20.40.110,TCP,60,443  >  57039 [ACK] Seq=110714 Ack=104149 Win=1724 Len=0
200,21.2598131,151.101.66.187,172.20.40.110,TCP,60,443  >  57039 [ACK] Seq=110714 Ack=106875 Win=1735 Len=0
201,21.2598131,151.101.66.187,172.20.40.110,TCP,60,443  >  57039 [ACK] Seq=110714 Ack=109608 Win=1746 Len=0
202,21.2598131,151.101.66.187,172.20.40.110,TCP,60,443  >  57039 [ACK] Seq=110714 Ack=112340 Win=1756 Len=0
203,21.2598131,151.101.66.187,172.20.40.110,TCP,60,443  >  57039 [ACK] Seq=110714 Ack=115066 Win=1767 Len=0
204,21.2598131,151.101.66.187,172.20.40.110,TCP,60,443  >  57039 [ACK] Seq=110714 Ack=117792 Win=1778 Len=0
205,21.2598131,151.101.66.187,172.20.40.110,TCP,60,443  >  57039 [ACK] Seq=110714 Ack=120524 Win=1788 Len=0
206,21.2598131,151.101.66.187,172.20.40.110,TCP,60,443  >  57039 [ACK] Seq=110714 Ack=123249 Win=1799 Len=0
207,21.2603132,151.101.66.187,172.20.40.110,TCP,60,443  >  57039 [ACK] Seq=110714 Ack=124629 Win=1805 Len=0
208,21.2603132,151.101.66.187,172.20.40.110,TCP,60,443  >  57039 [ACK] Seq=110714 Ack=125972 Win=1810 Len=0
209,21.2634406,151.101.66.187,172.20.40.110,TLSv1.2,131,Application Data
210,21.2648013,151.101.66.187,172.20.40.110,TLSv1.2,124,Application Data
211,21.2648715,172.20.40.110,151.101.66.187,TCP,54,57039  >  443 [ACK] Seq=125972 Ack=110861 Win=513 Len=0
212,21.2669987,151.101.66.187,172.20.40.110,TLSv1.2,130,Application Data
213,21.2681602,151.101.66.187,172.20.40.110,TLSv1.2,447,Application Data
214,21.2682718,172.20.40.110,151.101.66.187,TCP,54,57039  >  443 [ACK] Seq=125972 Ack=111330 Win=517 Len=0
215,22.452802,172.20.40.110,151.101.66.187,TLSv1.2,2792,Application Data
216,22.4640857,151.101.66.187,172.20.40.110,TCP,60,443  >  57039 [ACK] Seq=111330 Ack=128710 Win=1821 Len=0
217,22.4666006,151.101.66.187,172.20.40.110,TLSv1.2,262,Application Data
218,22.5169108,151.101.66.187,172.20.40.110,TCP,262,"[TCP Retransmission] 443  >  57039 [PSH, ACK] Seq=111330 Ack=128710 Win=1821 Len=208"
219,22.5169883,172.20.40.110,151.101.66.187,TCP,66,57039  >  443 [ACK] Seq=128710 Ack=111538 Win=516 Len=0 SLE=111330 SRE=111538
220,22.855876,172.20.40.110,151.101.66.187,TLSv1.2,2792,Application Data
221,22.865141,151.101.66.187,172.20.40.110,TCP,60,443  >  57039 [ACK] Seq=111538 Ack=131448 Win=1832 Len=0
222,22.8676079,151.101.66.187,172.20.40.110,TLSv1.2,104,Application Data
223,22.918358,172.20.40.110,151.101.66.187,TCP,54,57039  >  443 [ACK] Seq=131448 Ack=111588 Win=516 Len=0
224,22.9185161,151.101.66.187,172.20.40.110,TCP,104,"[TCP Spurious Retransmission] 443  >  57039 [PSH, ACK] Seq=111538 Ack=131448 Win=1832 Len=50"
225,22.9185645,172.20.40.110,151.101.66.187,TCP,66,[TCP Dup ACK 223#1] 57039  >  443 [ACK] Seq=131448 Ack=111588 Win=516 Len=0 SLE=111538 SRE=111588
226,23.5251738,172.20.40.110,151.101.66.187,TLSv1.2,2794,Application Data
227,23.5337573,172.20.40.110,151.101.66.187,TLSv1.2,2795,Application Data
228,23.5380543,151.101.66.187,172.20.40.110,TCP,60,443  >  57039 [ACK] Seq=111588 Ack=134188 Win=1843 Len=0
229,23.5439098,151.101.66.187,172.20.40.110,TLSv1.2,241,Application Data
230,23.5439098,151.101.66.187,172.20.40.110,TCP,60,443  >  57039 [ACK] Seq=111775 Ack=136929 Win=1855 Len=0
231,23.5470384,151.101.66.187,172.20.40.110,TLSv1.2,125,Application Data
232,23.5471176,172.20.40.110,151.101.66.187,TCP,54,57039  >  443 [ACK] Seq=136929 Ack=111846 Win=515 Len=0
233,23.5513934,172.20.40.110,151.101.66.187,TLSv1.2,2778,Application Data
234,23.5641608,151.101.66.187,172.20.40.110,TCP,60,443  >  57039 [ACK] Seq=111846 Ack=139653 Win=1865 Len=0
235,23.5685889,151.101.66.187,172.20.40.110,TLSv1.2,259,Application Data
236,23.615071,151.101.66.187,172.20.40.110,TCP,259,"[TCP Retransmission] 443  >  57039 [PSH, ACK] Seq=111846 Ack=139653 Win=1865 Len=205"
237,23.6151299,172.20.40.110,151.101.66.187,TCP,66,57039  >  443 [ACK] Seq=139653 Ack=112051 Win=514 Len=0 SLE=111846 SRE=112051
238,24.2896338,172.20.40.110,151.101.66.187,TLSv1.2,2787,Application Data
239,24.289844,172.20.40.110,151.101.66.187,TLSv1.2,2790,Application Data
240,24.2899654,172.20.40.110,151.101.66.187,TLSv1.2,2784,Application Data
241,24.2900761,172.20.40.110,151.101.66.187,TLSv1.2,2781,Application Data
242,24.3037589,151.101.66.187,172.20.40.110,TCP,60,443  >  57039 [ACK] Seq=112051 Ack=142386 Win=1876 Len=0
243,24.3037589,151.101.66.187,172.20.40.110,TCP,60,443  >  57039 [ACK] Seq=112051 Ack=145122 Win=1887 Len=0
244,24.3037589,151.101.66.187,172.20.40.110,TCP,60,443  >  57039 [ACK] Seq=112051 Ack=147852 Win=1897 Len=0
245,24.3070778,151.101.66.187,172.20.40.110,TCP,60,443  >  57039 [ACK] Seq=112051 Ack=150579 Win=1908 Len=0
246,24.3114103,151.101.66.187,172.20.40.110,TLSv1.2,104,Application Data
247,24.3127031,151.101.66.187,172.20.40.110,TLSv1.2,124,Application Data
248,24.3127031,151.101.66.187,172.20.40.110,TLSv1.2,130,Application Data
249,24.3127917,172.20.40.110,151.101.66.187,TCP,54,57039  >  443 [ACK] Seq=150579 Ack=112247 Win=513 Len=0
250,24.3189741,151.101.66.187,172.20.40.110,TLSv1.2,130,Application Data
251,24.3190526,172.20.40.110,151.101.66.187,TCP,54,57039  >  443 [ACK] Seq=150579 Ack=112323 Win=513 Len=0
252,25.1338594,172.20.40.110,151.101.66.187,TLSv1.2,2831,Application Data
253,25.1402294,172.20.40.110,151.101.66.187,TLSv1.2,2829,Application Data
254,25.1464948,151.101.66.187,172.20.40.110,TCP,60,443  >  57039 [ACK] Seq=112323 Ack=153356 Win=1919 Len=0
255,25.1492205,151.101.66.187,172.20.40.110,TLSv1.2,219,Application Data
256,25.1492205,151.101.66.187,172.20.40.110,TCP,60,443  >  57039 [ACK] Seq=112488 Ack=156131 Win=1930 Len=0
257,25.1522882,151.101.66.187,172.20.40.110,TLSv1.2,104,Application Data
258,25.1523853,172.20.40.110,151.101.66.187,TCP,54,57039  >  443 [ACK] Seq=156131 Ack=112538 Win=512 Len=0
259,25.299385,172.20.40.110,151.101.66.187,TLSv1.2,2832,Application Data
260,25.3115586,151.101.66.187,172.20.40.110,TCP,60,443  >  57039 [ACK] Seq=112538 Ack=158909 Win=1940 Len=0
261,25.3128872,151.101.66.187,172.20.40.110,TLSv1.2,142,Application Data
262,25.3382684,172.20.40.110,151.101.66.187,TLSv1.2,2830,Application Data
263,25.3468073,151.101.66.187,172.20.40.110,TCP,60,443  >  57039 [ACK] Seq=112626 Ack=161685 Win=1951 Len=0
264,25.3500822,151.101.66.187,172.20.40.110,TLSv1.2,234,Application Data
265,25.3906839,172.20.40.110,151.101.66.187,TCP,54,57039  >  443 [ACK] Seq=161685 Ack=112806 Win=517 Len=0
266,25.3956281,151.101.66.187,172.20.40.110,TCP,234,"[TCP Spurious Retransmission] 443  >  57039 [PSH, ACK] Seq=112626 Ack=161685 Win=1951 Len=180"
267,25.3956929,172.20.40.110,151.101.66.187,TCP,66,[TCP Dup ACK 265#1] 57039  >  443 [ACK] Seq=161685 Ack=112806 Win=517 Len=0 SLE=112626 SRE=112806
268,26.8574787,172.20.40.110,151.101.66.187,TCP,55,51833  >  443 [ACK] Seq=1 Ack=1 Win=254 Len=1 [TCP PDU reassembled in 467]
269,26.8659814,151.101.66.187,172.20.40.110,TCP,66,443  >  51833 [ACK] Seq=1 Ack=2 Win=281 Len=0 SLE=1 SRE=2
270,27.6523562,172.20.40.110,151.101.66.187,TLSv1.2,2832,Application Data
271,27.6641164,151.101.66.187,172.20.40.110,TCP,60,443  >  57039 [ACK] Seq=112806 Ack=164463 Win=1962 Len=0
272,27.6694707,151.101.66.187,172.20.40.110,TLSv1.2,220,Application Data
273,27.7102783,172.20.40.110,151.101.66.187,TCP,54,57039  >  443 [ACK] Seq=164463 Ack=112972 Win=516 Len=0
274,27.7126781,151.101.66.187,172.20.40.110,TCP,220,"[TCP Spurious Retransmission] 443  >  57039 [PSH, ACK] Seq=112806 Ack=164463 Win=1962 Len=166"
275,27.7128654,172.20.40.110,151.101.66.187,TCP,66,[TCP Dup ACK 273#1] 57039  >  443 [ACK] Seq=164463 Ack=112972 Win=516 Len=0 SLE=112806 SRE=112972
276,28.6732598,172.20.40.110,151.101.66.187,TLSv1.2,2831,Application Data
277,28.676684,172.20.40.110,151.101.66.187,TLSv1.2,2819,Application Data
278,28.6803276,172.20.40.110,151.101.66.187,TLSv1.2,2813,Application Data
279,28.6859099,151.101.66.187,172.20.40.110,TCP,60,443  >  57039 [ACK] Seq=112972 Ack=167240 Win=1973 Len=0
280,28.688095,151.101.66.187,172.20.40.110,TLSv1.2,241,Application Data
281,28.6907825,151.101.66.187,172.20.40.110,TCP,60,443  >  57039 [ACK] Seq=113159 Ack=170000 Win=1984 Len=0
282,28.6907825,151.101.66.187,172.20.40.110,TCP,60,443  >  57039 [ACK] Seq=113159 Ack=170005 Win=1984 Len=0
283,28.6907825,151.101.66.187,172.20.40.110,TCP,60,443  >  57039 [ACK] Seq=113159 Ack=172764 Win=1995 Len=0
284,28.6921225,151.101.66.187,172.20.40.110,TLSv1.2,130,Application Data
285,28.6922088,172.20.40.110,151.101.66.187,TCP,54,57039  >  443 [ACK] Seq=172764 Ack=113235 Win=515 Len=0
286,28.6924161,172.20.40.110,151.101.66.187,TLSv1.2,2832,Application Data
287,28.695149,151.101.66.187,172.20.40.110,TLSv1.2,130,Application Data
288,28.7016389,151.101.66.187,172.20.40.110,TCP,60,443  >  57039 [ACK] Seq=113311 Ack=175542 Win=2005 Len=0
289,28.7043827,151.101.66.187,172.20.40.110,TLSv1.2,125,Application Data
290,28.7044552,172.20.40.110,151.101.66.187,TCP,54,57039  >  443 [ACK] Seq=175542 Ack=113382 Win=515 Len=0
291,28.8736705,172.20.40.110,151.101.66.187,TLSv1.2,2835,Application Data
292,28.8876126,151.101.66.187,172.20.40.110,TCP,60,443  >  57039 [ACK] Seq=113382 Ack=178323 Win=2017 Len=0
293,28.8897226,151.101.66.187,172.20.40.110,TLSv1.2,258,Application Data
294,28.9308226,151.101.66.187,172.20.40.110,TCP,258,"[TCP Retransmission] 443  >  57039 [PSH, ACK] Seq=113382 Ack=178323 Win=2017 Len=204"
295,28.9308973,172.20.40.110,151.101.66.187,TCP,66,57039  >  443 [ACK] Seq=178323 Ack=113586 Win=514 Len=0 SLE=113382 SRE=113586
296,28.9725149,172.20.40.110,151.101.66.187,TLSv1.2,2820,Application Data
297,28.9727586,172.20.40.110,151.101.66.187,TLSv1.2,2823,Application Data
298,28.9729124,172.20.40.110,151.101.66.187,TLSv1.2,2817,Application Data
299,28.9730475,172.20.40.110,151.101.66.187,TLSv1.2,2819,Application Data
300,28.9731938,172.20.40.110,151.101.66.187,TLSv1.2,2814,Application Data
301,28.9835044,151.101.66.187,172.20.40.110,TCP,60,443  >  57039 [ACK] Seq=113586 Ack=181089 Win=2027 Len=0
302,28.9917243,151.101.66.187,172.20.40.110,TLSv1.2,104,Application Data
303,28.9917243,151.101.66.187,172.20.40.110,TCP,60,443  >  57039 [ACK] Seq=113636 Ack=182469 Win=2033 Len=0
304,28.9955631,151.101.66.187,172.20.40.110,TCP,60,443  >  57039 [ACK] Seq=113636 Ack=183858 Win=2039 Len=0
305,28.9955631,151.101.66.187,172.20.40.110,TCP,60,443  >  57039 [ACK] Seq=113636 Ack=186618 Win=2049 Len=0
306,28.9955631,151.101.66.187,172.20.40.110,TCP,60,443  >  57039 [ACK] Seq=113636 Ack=186621 Win=2049 Len=0
307,28.9955631,151.101.66.187,172.20.40.110,TCP,60,443  >  57039 [ACK] Seq=113636 Ack=189381 Win=2060 Len=0
308,28.9955631,151.101.66.187,172.20.40.110,TCP,60,443  >  57039 [ACK] Seq=113636 Ack=189386 Win=2060 Len=0
309,28.999923,151.101.66.187,172.20.40.110,TCP,60,443  >  57039 [ACK] Seq=113636 Ack=190766 Win=2066 Len=0
310,28.999923,151.101.66.187,172.20.40.110,TLSv1.2,130,Application Data
311,28.999923,151.101.66.187,172.20.40.110,TLSv1.2,124,Application Data
312,28.999923,151.101.66.187,172.20.40.110,TLSv1.2,135,Application Data
313,29.0000191,172.20.40.110,151.101.66.187,TCP,54,57039  >  443 [ACK] Seq=192146 Ack=113863 Win=513 Len=0
314,29.0057729,151.101.66.187,172.20.40.110,TLSv1.2,130,Application Data
315,29.050148,151.101.66.187,172.20.40.110,TCP,130,"[TCP Retransmission] 443  >  57039 [PSH, ACK] Seq=113863 Ack=192146 Win=2071 Len=76"
316,29.0503306,172.20.40.110,151.101.66.187,TCP,66,57039  >  443 [ACK] Seq=192146 Ack=113939 Win=513 Len=0 SLE=113863 SRE=113939
317,29.4565022,172.20.40.110,151.101.66.187,TLSv1.2,2866,Application Data
318,29.4651827,172.20.40.110,151.101.66.187,TLSv1.2,2854,Application Data
319,29.4712519,151.101.66.187,172.20.40.110,TCP,60,443  >  57039 [ACK] Seq=113939 Ack=194958 Win=2082 Len=0
320,29.4712519,151.101.66.187,172.20.40.110,TLSv1.2,235,Application Data
321,29.4763224,151.101.66.187,172.20.40.110,TCP,60,443  >  57039 [ACK] Seq=114120 Ack=197758 Win=2093 Len=0
322,29.4797535,151.101.66.187,172.20.40.110,TLSv1.2,175,Application Data
323,29.4798515,172.20.40.110,151.101.66.187,TCP,54,57039  >  443 [ACK] Seq=197758 Ack=114241 Win=517 Len=0
324,29.7997169,172.20.40.110,151.101.66.187,TLSv1.2,2868,Application Data
325,29.805496,172.20.40.110,151.101.66.187,TLSv1.2,2866,Application Data
326,29.813693,151.101.66.187,172.20.40.110,TCP,60,443  >  57039 [ACK] Seq=114241 Ack=200572 Win=2104 Len=0
327,29.813693,151.101.66.187,172.20.40.110,TLSv1.2,137,Application Data
328,29.8190745,151.101.66.187,172.20.40.110,TCP,60,443  >  57039 [ACK] Seq=114324 Ack=203384 Win=2115 Len=0
329,29.8212967,151.101.66.187,172.20.40.110,TLSv1.2,104,Application Data
330,29.8213741,172.20.40.110,151.101.66.187,TCP,54,57039  >  443 [ACK] Seq=203384 Ack=114374 Win=516 Len=0
331,29.9970175,172.20.40.110,151.101.66.187,TLSv1.2,2869,Application Data
332,30.0096063,151.101.66.187,172.20.40.110,TCP,60,443  >  57039 [ACK] Seq=114374 Ack=206144 Win=2127 Len=0
333,30.0114488,151.101.66.187,172.20.40.110,TCP,60,443  >  57039 [ACK] Seq=114374 Ack=206199 Win=2127 Len=0
334,30.0162195,151.101.66.187,172.20.40.110,TLSv1.2,98,Application Data
335,30.0556768,151.101.66.187,172.20.40.110,TCP,98,"[TCP Retransmission] 443  >  57039 [PSH, ACK] Seq=114374 Ack=206199 Win=2127 Len=44"
336,30.0557648,172.20.40.110,151.101.66.187,TCP,66,57039  >  443 [ACK] Seq=206199 Ack=114418 Win=516 Len=0 SLE=114374 SRE=114418
337,30.3177817,172.20.40.110,151.101.66.187,TLSv1.2,2860,Application Data
338,30.3278386,172.20.40.110,151.101.66.187,TLSv1.2,2854,Application Data
339,30.3298778,151.101.66.187,172.20.40.110,TCP,60,443  >  57039 [ACK] Seq=114418 Ack=209005 Win=2138 Len=0
340,30.339034,151.101.66.187,172.20.40.110,TLSv1.2,131,Application Data
341,30.339034,151.101.66.187,172.20.40.110,TCP,60,443  >  57039 [ACK] Seq=114495 Ack=211805 Win=2149 Len=0
342,30.3423116,151.101.66.187,172.20.40.110,TLSv1.2,130,Application Data
343,30.3424982,172.20.40.110,151.101.66.187,TCP,54,57039  >  443 [ACK] Seq=211805 Ack=114571 Win=516 Len=0
344,32.4522457,172.20.40.110,151.101.66.187,TLSv1.2,2854,Application Data
345,32.4632728,172.20.40.110,151.101.66.187,TLSv1.2,2854,Application Data
346,32.4634381,151.101.66.187,172.20.40.110,TCP,60,443  >  57039 [ACK] Seq=114571 Ack=214605 Win=2160 Len=0
347,32.4659285,151.101.66.187,172.20.40.110,TLSv1.2,214,Application Data
348,32.472245,151.101.66.187,172.20.40.110,TCP,60,443  >  57039 [ACK] Seq=114731 Ack=217405 Win=2171 Len=0
349,32.474659,151.101.66.187,172.20.40.110,TLSv1.2,103,Application Data
350,32.4747683,172.20.40.110,151.101.66.187,TCP,54,57039  >  443 [ACK] Seq=217405 Ack=114780 Win=515 Len=0
351,32.5150857,172.20.40.110,151.101.66.187,TLSv1.2,2856,Application Data
352,32.5272279,151.101.66.187,172.20.40.110,TCP,60,443  >  57039 [ACK] Seq=114780 Ack=220207 Win=2182 Len=0
353,32.5294204,151.101.66.187,172.20.40.110,TLSv1.2,104,Application Data
354,32.5682126,151.101.66.187,172.20.40.110,TCP,104,"[TCP Retransmission] 443  >  57039 [PSH, ACK] Seq=114780 Ack=220207 Win=2182 Len=50"
355,32.5682835,172.20.40.110,151.101.66.187,TCP,66,57039  >  443 [ACK] Seq=220207 Ack=114830 Win=515 Len=0 SLE=114780 SRE=114830
356,32.9891297,172.20.40.110,151.101.66.187,TLSv1.2,2656,Application Data
357,33.0021351,151.101.66.187,172.20.40.110,TCP,60,443  >  57039 [ACK] Seq=114830 Ack=222809 Win=2192 Len=0
358,33.4732601,172.20.40.110,151.101.66.187,TLSv1.2,2854,Application Data
359,33.482445,172.20.40.110,151.101.66.187,TLSv1.2,2854,Application Data
360,33.4891474,151.101.66.187,172.20.40.110,TCP,60,443  >  57039 [ACK] Seq=114830 Ack=225609 Win=2203 Len=0
361,33.4891474,151.101.66.187,172.20.40.110,TLSv1.2,342,Application Data
362,33.496828,151.101.66.187,172.20.40.110,TCP,60,443  >  57039 [ACK] Seq=115118 Ack=228409 Win=2214 Len=0
363,33.5003183,151.101.66.187,172.20.40.110,TLSv1.2,104,Application Data
364,33.5003966,172.20.40.110,151.101.66.187,TCP,54,57039  >  443 [ACK] Seq=228409 Ack=115168 Win=513 Len=0
365,33.5251868,172.20.40.110,151.101.66.187,TLSv1.2,2860,Application Data
366,33.5384293,151.101.66.187,172.20.40.110,TCP,60,443  >  57039 [ACK] Seq=115168 Ack=231215 Win=2225 Len=0
367,33.5417917,151.101.66.187,172.20.40.110,TLSv1.2,130,Application Data
368,33.5818978,151.101.66.187,172.20.40.110,TCP,130,"[TCP Retransmission] 443  >  57039 [PSH, ACK] Seq=115168 Ack=231215 Win=2225 Len=76"
369,33.5819561,172.20.40.110,151.101.66.187,TCP,66,57039  >  443 [ACK] Seq=231215 Ack=115244 Win=513 Len=0 SLE=115168 SRE=115244
370,33.6763138,151.101.66.187,172.20.40.110,TLSv1.2,515,Application Data
371,33.679167,172.20.40.110,151.101.66.187,TLSv1.2,89,Application Data
372,33.6922982,151.101.66.187,172.20.40.110,TCP,60,443  >  57039 [ACK] Seq=115705 Ack=231250 Win=2225 Len=0
373,34.1626217,172.20.40.110,151.101.66.187,TLSv1.2,2854,Application Data
374,34.1758924,172.20.40.110,151.101.66.187,TLSv1.2,2854,Application Data
375,34.1791188,151.101.66.187,172.20.40.110,TCP,60,443  >  57039 [ACK] Seq=115705 Ack=234050 Win=2236 Len=0
376,34.1819284,151.101.66.187,172.20.40.110,TLSv1.2,175,Application Data
377,34.1861431,151.101.66.187,172.20.40.110,TCP,60,443  >  57039 [ACK] Seq=115826 Ack=236850 Win=2247 Len=0
378,34.188399,151.101.66.187,172.20.40.110,TLSv1.2,104,Application Data
379,34.1884745,172.20.40.110,151.101.66.187,TCP,54,57039  >  443 [ACK] Seq=236850 Ack=115876 Win=516 Len=0
380,38.8104285,172.20.40.110,151.101.66.187,TLSv1.2,2892,Application Data
381,38.8210901,151.101.66.187,172.20.40.110,TCP,60,443  >  57039 [ACK] Seq=115876 Ack=239688 Win=2258 Len=0
382,38.825308,151.101.66.187,172.20.40.110,TLSv1.2,274,Application Data
383,38.8339805,172.20.40.110,151.101.66.187,TLSv1.2,2883,Application Data
384,38.8355888,172.20.40.110,151.101.66.187,TLSv1.2,2877,Application Data
385,38.8419689,172.20.40.110,151.101.66.187,TLSv1.2,2877,Application Data
386,38.8444867,151.101.66.187,172.20.40.110,TCP,60,443  >  57039 [ACK] Seq=116096 Ack=242517 Win=2269 Len=0
387,38.8481831,151.101.66.187,172.20.40.110,TCP,60,443  >  57039 [ACK] Seq=116096 Ack=245340 Win=2280 Len=0
388,38.8481831,151.101.66.187,172.20.40.110,TLSv1.2,130,Application Data
389,38.8503072,151.101.66.187,172.20.40.110,TLSv1.2,131,Application Data
390,38.8503682,172.20.40.110,151.101.66.187,TCP,54,57039  >  443 [ACK] Seq=248163 Ack=116249 Win=515 Len=0
391,38.8516467,151.101.66.187,172.20.40.110,TCP,60,443  >  57039 [ACK] Seq=116249 Ack=248163 Win=2291 Len=0
392,38.8547897,151.101.66.187,172.20.40.110,TLSv1.2,130,Application Data
393,38.8968139,172.20.40.110,151.101.66.187,TCP,54,57039  >  443 [ACK] Seq=248163 Ack=116325 Win=515 Len=0
394,38.901265,151.101.66.187,172.20.40.110,TCP,130,"[TCP Spurious Retransmission] 443  >  57039 [PSH, ACK] Seq=116249 Ack=248163 Win=2291 Len=76"
395,38.9013326,172.20.40.110,151.101.66.187,TCP,66,[TCP Dup ACK 393#1] 57039  >  443 [ACK] Seq=248163 Ack=116325 Win=515 Len=0 SLE=116249 SRE=116325
396,38.9839263,172.20.40.110,151.101.66.187,TLSv1.2,2877,Application Data
397,39.0083783,151.101.66.187,172.20.40.110,TCP,60,443  >  57039 [ACK] Seq=116325 Ack=250986 Win=2302 Len=0
398,39.0118915,151.101.66.187,172.20.40.110,TLSv1.2,258,Application Data
399,39.0324138,151.101.66.187,172.20.40.110,TCP,258,"[TCP Retransmission] 443  >  57039 [PSH, ACK] Seq=116325 Ack=250986 Win=2302 Len=204"
400,39.0325004,172.20.40.110,151.101.66.187,TCP,66,57039  >  443 [ACK] Seq=250986 Ack=116529 Win=514 Len=0 SLE=116325 SRE=116529
401,39.0699539,172.20.40.110,151.101.66.187,TLSv1.2,2874,Application Data
402,39.0792984,151.101.66.187,172.20.40.110,TCP,60,443  >  57039 [ACK] Seq=116529 Ack=253806 Win=2313 Len=0
403,39.0824673,151.101.66.187,172.20.40.110,TLSv1.2,125,Application Data
404,39.1198132,151.101.66.187,172.20.40.110,TCP,125,"[TCP Retransmission] 443  >  57039 [PSH, ACK] Seq=116529 Ack=253806 Win=2313 Len=71"
405,39.1198765,172.20.40.110,151.101.66.187,TCP,66,57039  >  443 [ACK] Seq=253806 Ack=116600 Win=514 Len=0 SLE=116529 SRE=116600
406,39.159406,172.20.40.110,151.101.66.187,TLSv1.2,2874,Application Data
407,39.1715351,151.101.66.187,172.20.40.110,TCP,60,443  >  57039 [ACK] Seq=116600 Ack=256626 Win=2324 Len=0
408,39.1715351,151.101.66.187,172.20.40.110,TLSv1.2,98,Application Data
409,39.1759396,172.20.40.110,151.101.66.187,TLSv1.2,2880,Application Data
410,39.1781166,172.20.40.110,151.101.66.187,TLSv1.2,2876,Application Data
411,39.1782997,172.20.40.110,151.101.66.187,TLSv1.2,2879,Application Data
412,39.18546,151.101.66.187,172.20.40.110,TCP,60,443  >  57039 [ACK] Seq=116644 Ack=259452 Win=2335 Len=0
413,39.1890434,151.101.66.187,172.20.40.110,TLSv1.2,131,Application Data
414,39.1919451,151.101.66.187,172.20.40.110,TCP,60,443  >  57039 [ACK] Seq=116721 Ack=262274 Win=2346 Len=0
415,39.1919451,151.101.66.187,172.20.40.110,TCP,60,443  >  57039 [ACK] Seq=116721 Ack=265099 Win=2357 Len=0
416,39.1964029,151.101.66.187,172.20.40.110,TLSv1.2,124,Application Data
417,39.1964874,172.20.40.110,151.101.66.187,TCP,54,57039  >  443 [ACK] Seq=265099 Ack=116791 Win=513 Len=0
418,39.1974179,151.101.66.187,172.20.40.110,TLSv1.2,124,Application Data
419,39.2383424,151.101.66.187,172.20.40.110,TCP,124,"[TCP Retransmission] 443  >  57039 [PSH, ACK] Seq=116791 Ack=265099 Win=2357 Len=70"
420,39.2383967,172.20.40.110,151.101.66.187,TCP,66,57039  >  443 [ACK] Seq=265099 Ack=116861 Win=512 Len=0 SLE=116791 SRE=116861
421,39.2787823,172.20.40.110,151.101.66.187,TLSv1.2,2891,Application Data
422,39.2882449,151.101.66.187,172.20.40.110,TCP,60,443  >  57039 [ACK] Seq=116861 Ack=267936 Win=2368 Len=0
423,39.2914116,151.101.66.187,172.20.40.110,TLSv1.2,130,Application Data
424,39.3264024,151.101.66.187,172.20.40.110,TCP,130,"[TCP Retransmission] 443  >  57039 [PSH, ACK] Seq=116861 Ack=267936 Win=2368 Len=76"
425,39.3264678,172.20.40.110,151.101.66.187,TCP,66,57039  >  443 [ACK] Seq=267936 Ack=116937 Win=512 Len=0 SLE=116861 SRE=116937
426,39.5044671,172.20.40.110,151.101.66.187,TLSv1.2,2891,Application Data
427,39.505506,172.20.40.110,151.101.66.187,TLSv1.2,2892,Application Data
428,39.5141545,151.101.66.187,172.20.40.110,TCP,60,443  >  57039 [ACK] Seq=116937 Ack=270773 Win=2379 Len=0
429,39.5169924,151.101.66.187,172.20.40.110,TCP,60,443  >  57039 [ACK] Seq=116937 Ack=273611 Win=2390 Len=0
430,39.5169924,151.101.66.187,172.20.40.110,TLSv1.2,240,Application Data
431,39.5183111,151.101.66.187,172.20.40.110,TLSv1.2,142,Application Data
432,39.5183913,172.20.40.110,151.101.66.187,TCP,54,57039  >  443 [ACK] Seq=273611 Ack=117211 Win=517 Len=0
433,39.8534401,172.20.40.110,151.101.66.187,TLSv1.2,2877,Application Data
434,39.8678264,151.101.66.187,172.20.40.110,TCP,60,443  >  57039 [ACK] Seq=117211 Ack=276434 Win=2401 Len=0
435,39.8704789,151.101.66.187,172.20.40.110,TLSv1.2,104,Application Data
436,39.9035669,151.101.66.187,172.20.40.110,TCP,104,"[TCP Retransmission] 443  >  57039 [PSH, ACK] Seq=117211 Ack=276434 Win=2401 Len=50"
437,39.9036258,172.20.40.110,151.101.66.187,TCP,66,57039  >  443 [ACK] Seq=276434 Ack=117261 Win=517 Len=0 SLE=117211 SRE=117261
438,40.3049771,172.20.40.110,151.101.66.187,TLSv1.2,2874,Application Data
439,40.3052018,172.20.40.110,151.101.66.187,TLSv1.2,2871,Application Data
440,40.3053404,172.20.40.110,151.101.66.187,TLSv1.2,2877,Application Data
441,40.331385,151.101.66.187,172.20.40.110,TCP,60,443  >  57039 [ACK] Seq=117261 Ack=279254 Win=2412 Len=0
442,40.331385,151.101.66.187,172.20.40.110,TCP,60,443  >  57039 [ACK] Seq=117261 Ack=282071 Win=2423 Len=0
443,40.331385,151.101.66.187,172.20.40.110,TCP,60,443  >  57039 [ACK] Seq=117261 Ack=284894 Win=2434 Len=0
444,40.332755,172.20.40.110,151.101.66.187,TLSv1.2,2866,Application Data
445,40.3394882,151.101.66.187,172.20.40.110,TLSv1.2,130,Application Data
446,40.3394882,151.101.66.187,172.20.40.110,TLSv1.2,130,Application Data
447,40.3394882,151.101.66.187,172.20.40.110,TLSv1.2,162,Application Data
448,40.3395695,172.20.40.110,151.101.66.187,TCP,54,57039  >  443 [ACK] Seq=287706 Ack=117521 Win=516 Len=0
449,40.3471399,151.101.66.187,172.20.40.110,TCP,60,443  >  57039 [ACK] Seq=117521 Ack=287706 Win=2445 Len=0
450,40.358491,151.101.66.187,172.20.40.110,TLSv1.2,240,Application Data
451,40.3586275,172.20.40.110,151.101.66.187,TCP,54,57039  >  443 [ACK] Seq=287706 Ack=117707 Win=515 Len=0
452,40.3801181,172.20.40.110,151.101.66.187,TLSv1.2,2629,Application Data
453,40.3814272,172.20.40.110,151.101.66.187,TLSv1.2,2893,Application Data
454,40.4080264,151.101.66.187,172.20.40.110,TCP,60,443  >  57039 [ACK] Seq=117707 Ack=290281 Win=2455 Len=0
455,40.4080264,151.101.66.187,172.20.40.110,TCP,60,443  >  57039 [ACK] Seq=117707 Ack=293120 Win=2467 Len=0
456,40.4080264,151.101.66.187,172.20.40.110,TLSv1.2,130,Application Data
457,40.440025,151.101.66.187,172.20.40.110,TCP,130,"[TCP Retransmission] 443  >  57039 [PSH, ACK] Seq=117707 Ack=293120 Win=2467 Len=76"
458,40.4401101,172.20.40.110,151.101.66.187,TCP,66,57039  >  443 [ACK] Seq=293120 Ack=117783 Win=515 Len=0 SLE=117707 SRE=117783
459,40.4663267,151.101.66.187,172.20.40.110,TLSv1.2,478,Application Data
460,40.4663267,151.101.66.187,172.20.40.110,TCP,1434,443  >  57039 [ACK] Seq=118207 Ack=293120 Win=2467 Len=1380 [TCP PDU reassembled in 463]
461,40.4664194,172.20.40.110,151.101.66.187,TCP,54,57039  >  443 [ACK] Seq=293120 Ack=119587 Win=517 Len=0
462,40.4682633,151.101.66.187,172.20.40.110,TCP,1434,443  >  57039 [ACK] Seq=119587 Ack=293120 Win=2467 Len=1380 [TCP PDU reassembled in 463]
463,40.4682633,151.101.66.187,172.20.40.110,TLSv1.2,760,Application Data
464,40.468498,172.20.40.110,151.101.66.187,TCP,54,57039  >  443 [ACK] Seq=293120 Ack=121673 Win=517 Len=0
465,40.4785731,172.20.40.110,151.101.66.187,TLSv1.2,89,Application Data
466,40.4856781,151.101.66.187,172.20.40.110,TCP,60,443  >  57039 [ACK] Seq=121673 Ack=293155 Win=2467 Len=0
467,40.5302867,172.20.40.110,151.101.66.187,TLSv1.2,175,Ignored Unknown Record
468,40.5304076,172.20.40.110,151.101.66.187,TLSv1.2,93,Application Data
469,40.5386933,151.101.66.187,172.20.40.110,TCP,60,443  >  51833 [ACK] Seq=1 Ack=123 Win=281 Len=0
470,40.5386933,151.101.66.187,172.20.40.110,TCP,60,443  >  51833 [ACK] Seq=1 Ack=162 Win=281 Len=0
471,40.5397819,151.101.66.187,172.20.40.110,TLSv1.2,93,Application Data
472,40.5422901,151.101.66.187,172.20.40.110,TLSv1.2,292,Application Data
473,40.5423566,172.20.40.110,151.101.66.187,TCP,54,51833  >  443 [ACK] Seq=162 Ack=278 Win=258 Len=0
474,40.8293845,172.20.40.110,151.101.66.187,TLSv1.2,2906,Application Data
475,40.8325333,172.20.40.110,151.101.66.187,TLSv1.2,2907,Application Data
476,40.8380293,151.101.66.187,172.20.40.110,TCP,60,443  >  57039 [ACK] Seq=121673 Ack=296007 Win=2478 Len=0
477,40.8426278,151.101.66.187,172.20.40.110,TCP,60,443  >  57039 [ACK] Seq=121673 Ack=298860 Win=2489 Len=0
478,40.8438368,151.101.66.187,172.20.40.110,TLSv1.2,264,Application Data
479,40.8443731,172.20.40.110,151.101.66.187,TLSv1.2,2896,Application Data
480,40.8448905,151.101.66.187,172.20.40.110,TLSv1.2,169,Application Data
481,40.85719,151.101.66.187,172.20.40.110,TCP,60,443  >  57039 [ACK] Seq=121998 Ack=301702 Win=2500 Len=0
482,40.8591649,151.101.66.187,172.20.40.110,TLSv1.2,163,Application Data
483,40.859239,172.20.40.110,151.101.66.187,TCP,54,57039  >  443 [ACK] Seq=301702 Ack=122107 Win=515 Len=0
484,40.89214,172.20.40.110,151.101.66.187,TLSv1.2,2890,Application Data
485,40.8925411,172.20.40.110,151.101.66.187,TLSv1.2,2891,Application Data
486,40.9012985,151.101.66.187,172.20.40.110,TCP,60,443  >  57039 [ACK] Seq=122107 Ack=304538 Win=2511 Len=0
487,40.9027202,151.101.66.187,172.20.40.110,TCP,60,443  >  57039 [ACK] Seq=122107 Ack=307375 Win=2522 Len=0
488,40.9171324,151.101.66.187,172.20.40.110,TLSv1.2,240,Application Data
489,40.9200441,151.101.66.187,172.20.40.110,TLSv1.2,130,Application Data
490,40.9201368,172.20.40.110,151.101.66.187,TCP,54,57039  >  443 [ACK] Seq=307375 Ack=122369 Win=514 Len=0
491,46.8090084,172.20.40.110,151.101.66.187,TLSv1.2,2906,Application Data
492,46.8232036,151.101.66.187,172.20.40.110,TCP,60,443  >  57039 [ACK] Seq=122369 Ack=310227 Win=2533 Len=0
493,46.82848,151.101.66.187,172.20.40.110,TLSv1.2,214,Application Data
494,46.857396,151.101.66.187,172.20.40.110,TCP,214,"[TCP Retransmission] 443  >  57039 [PSH, ACK] Seq=122369 Ack=310227 Win=2533 Len=160"
495,46.8574774,172.20.40.110,151.101.66.187,TCP,66,57039  >  443 [ACK] Seq=310227 Ack=122529 Win=514 Len=0 SLE=122369 SRE=122529
496,46.89852,172.20.40.110,151.101.66.187,TLSv1.2,2907,Application Data
497,46.9096836,151.101.66.187,172.20.40.110,TCP,60,443  >  57039 [ACK] Seq=122529 Ack=313080 Win=2544 Len=0
498,46.9143529,151.101.66.187,172.20.40.110,TLSv1.2,98,Application Data
499,46.9452963,151.101.66.187,172.20.40.110,TCP,98,"[TCP Retransmission] 443  >  57039 [PSH, ACK] Seq=122529 Ack=313080 Win=2544 Len=44"
500,46.9454659,172.20.40.110,151.101.66.187,TCP,66,57039  >  443 [ACK] Seq=313080 Ack=122573 Win=513 Len=0 SLE=122529 SRE=122573
501,47.49776,172.20.40.110,151.101.66.187,TLSv1.2,2906,Application Data
502,47.5163142,151.101.66.187,172.20.40.110,TCP,60,443  >  57039 [ACK] Seq=122573 Ack=315932 Win=2555 Len=0
503,47.5163142,151.101.66.187,172.20.40.110,TLSv1.2,208,Application Data
504,47.5361938,172.20.40.110,151.101.66.187,TLSv1.2,2907,Application Data
505,47.5464695,151.101.66.187,172.20.40.110,TCP,60,443  >  57039 [ACK] Seq=122727 Ack=318785 Win=2567 Len=0
506,47.5488478,151.101.66.187,172.20.40.110,TLSv1.2,98,Application Data
507,47.583893,151.101.66.187,172.20.40.110,TCP,98,"[TCP Retransmission] 443  >  57039 [PSH, ACK] Seq=122727 Ack=318785 Win=2567 Len=44"
508,47.5839455,172.20.40.110,151.101.66.187,TCP,66,57039  >  443 [ACK] Seq=318785 Ack=122771 Win=513 Len=0 SLE=122727 SRE=122771
509,50.4062988,172.20.40.110,151.101.66.187,TLSv1.2,2906,Application Data
510,50.4192009,151.101.66.187,172.20.40.110,TCP,60,443  >  57039 [ACK] Seq=122771 Ack=321637 Win=2578 Len=0
511,50.4261649,151.101.66.187,172.20.40.110,TLSv1.2,214,Application Data
512,50.4588043,151.101.66.187,172.20.40.110,TCP,214,"[TCP Retransmission] 443  >  57039 [PSH, ACK] Seq=122771 Ack=321637 Win=2578 Len=160"
513,50.4591493,172.20.40.110,151.101.66.187,TCP,66,57039  >  443 [ACK] Seq=321637 Ack=122931 Win=512 Len=0 SLE=122771 SRE=122931
514,50.4873497,172.20.40.110,151.101.66.187,TLSv1.2,2907,Application Data
515,50.5018518,151.101.66.187,172.20.40.110,TCP,60,443  >  57039 [ACK] Seq=122931 Ack=324490 Win=2589 Len=0
516,50.5065436,151.101.66.187,172.20.40.110,TLSv1.2,98,Application Data
517,50.5430539,151.101.66.187,172.20.40.110,TCP,98,"[TCP Retransmission] 443  >  57039 [PSH, ACK] Seq=122931 Ack=324490 Win=2589 Len=44"
518,50.5431367,172.20.40.110,151.101.66.187,TCP,66,57039  >  443 [ACK] Seq=324490 Ack=122975 Win=512 Len=0 SLE=122931 SRE=122975
519,53.3403179,172.20.40.110,151.101.66.187,TLSv1.2,2886,Application Data
520,53.3534618,151.101.66.187,172.20.40.110,TCP,60,443  >  57039 [ACK] Seq=122975 Ack=327322 Win=2600 Len=0
521,53.3546102,151.101.66.187,172.20.40.110,TLSv1.2,241,Application Data
522,53.3892659,151.101.66.187,172.20.40.110,TCP,241,"[TCP Retransmission] 443  >  57039 [PSH, ACK] Seq=122975 Ack=327322 Win=2600 Len=187"
523,53.389325,172.20.40.110,151.101.66.187,TCP,66,57039  >  443 [ACK] Seq=327322 Ack=123162 Win=517 Len=0 SLE=122975 SRE=123162
524,53.3903257,172.20.40.110,151.101.66.187,TLSv1.2,2899,Application Data
525,53.4013425,151.101.66.187,172.20.40.110,TCP,60,443  >  57039 [ACK] Seq=123162 Ack=330167 Win=2611 Len=0
526,53.4024826,151.101.66.187,172.20.40.110,TLSv1.2,104,Application Data
527,53.4071532,172.20.40.110,151.101.66.187,TLSv1.2,2884,Application Data
528,53.4074255,172.20.40.110,151.101.66.187,TLSv1.2,2884,Application Data
529,53.409005,172.20.40.110,151.101.66.187,TLSv1.2,2890,Application Data
530,53.4238516,151.101.66.187,172.20.40.110,TCP,60,443  >  57039 [ACK] Seq=123212 Ack=332997 Win=2622 Len=0
531,53.4238516,151.101.66.187,172.20.40.110,TCP,60,443  >  57039 [ACK] Seq=123212 Ack=335827 Win=2634 Len=0
532,53.4238516,151.101.66.187,172.20.40.110,TCP,60,443  >  57039 [ACK] Seq=123212 Ack=338663 Win=2645 Len=0
533,53.4319789,151.101.66.187,172.20.40.110,TLSv1.2,130,Application Data
534,53.4319789,151.101.66.187,172.20.40.110,TLSv1.2,264,Application Data
535,53.4319789,151.101.66.187,172.20.40.110,TLSv1.2,168,Application Data
536,53.4321087,172.20.40.110,151.101.66.187,TCP,54,57039  >  443 [ACK] Seq=338663 Ack=123612 Win=515 Len=0
537,53.4675792,172.20.40.110,151.101.66.187,TLSv1.2,2884,Application Data
538,53.4819424,151.101.66.187,172.20.40.110,TCP,60,443  >  57039 [ACK] Seq=123612 Ack=341493 Win=2656 Len=0
539,53.4841897,151.101.66.187,172.20.40.110,TLSv1.2,163,Application Data
540,53.520473,151.101.66.187,172.20.40.110,TCP,163,"[TCP Retransmission] 443  >  57039 [PSH, ACK] Seq=123612 Ack=341493 Win=2656 Len=109"
541,53.5205253,172.20.40.110,151.101.66.187,TCP,66,57039  >  443 [ACK] Seq=341493 Ack=123721 Win=515 Len=0 SLE=123612 SRE=123721
542,53.6251717,172.20.40.110,151.101.66.187,TLSv1.2,2881,Application Data
543,53.6381397,151.101.66.187,172.20.40.110,TCP,60,443  >  57039 [ACK] Seq=123721 Ack=344320 Win=2667 Len=0
544,53.6413465,151.101.66.187,172.20.40.110,TLSv1.2,125,Application Data
545,53.6451646,172.20.40.110,151.101.66.187,TLSv1.2,2898,Application Data
546,53.6585508,151.101.66.187,172.20.40.110,TCP,60,443  >  57039 [ACK] Seq=123792 Ack=347164 Win=2678 Len=0
547,53.6596658,151.101.66.187,172.20.40.110,TLSv1.2,130,Application Data
548,53.6704948,172.20.40.110,151.101.66.187,TLSv1.2,2898,Application Data
549,53.6810374,151.101.66.187,172.20.40.110,TCP,60,443  >  57039 [ACK] Seq=123868 Ack=350008 Win=2689 Len=0
550,53.6842391,151.101.66.187,172.20.40.110,TLSv1.2,125,Application Data
551,53.7189608,151.101.66.187,172.20.40.110,TCP,125,"[TCP Retransmission] 443  >  57039 [PSH, ACK] Seq=123868 Ack=350008 Win=2689 Len=71"
552,53.7190169,172.20.40.110,151.101.66.187,TCP,66,57039  >  443 [ACK] Seq=350008 Ack=123939 Win=514 Len=0 SLE=123868 SRE=123939
553,53.8501623,172.20.40.110,151.101.66.187,TLSv1.2,2887,Application Data
554,53.8513521,172.20.40.110,151.101.66.187,TLSv1.2,2884,Application Data
555,53.8516162,172.20.40.110,151.101.66.187,TLSv1.2,2881,Application Data
556,53.8519288,172.20.40.110,151.101.66.187,TLSv1.2,2884,Application Data
557,53.8598579,151.101.66.187,172.20.40.110,TCP,60,443  >  57039 [ACK] Seq=123939 Ack=352841 Win=2700 Len=0
558,53.862969,151.101.66.187,172.20.40.110,TLSv1.2,129,Application Data
559,53.864649,151.101.66.187,172.20.40.110,TCP,60,443  >  57039 [ACK] Seq=124014 Ack=355671 Win=2711 Len=0
560,53.864649,151.101.66.187,172.20.40.110,TCP,60,443  >  57039 [ACK] Seq=124014 Ack=358498 Win=2722 Len=0
561,53.8657046,151.101.66.187,172.20.40.110,TCP,60,443  >  57039 [ACK] Seq=124014 Ack=361328 Win=2734 Len=0
562,53.8679,151.101.66.187,172.20.40.110,TLSv1.2,130,Application Data
563,53.8680007,172.20.40.110,151.101.66.187,TCP,54,57039  >  443 [ACK] Seq=361328 Ack=124090 Win=513 Len=0
564,53.8692426,151.101.66.187,172.20.40.110,TLSv1.2,130,Application Data
565,53.8692426,151.101.66.187,172.20.40.110,TLSv1.2,130,Application Data
566,53.8693576,172.20.40.110,151.101.66.187,TCP,54,57039  >  443 [ACK] Seq=361328 Ack=124242 Win=513 Len=0
567,54.0392278,172.20.40.110,151.101.66.187,TLSv1.2,2897,Application Data
568,54.0502753,172.20.40.110,151.101.66.187,TLSv1.2,2899,Application Data
569,54.0534859,151.101.66.187,172.20.40.110,TCP,60,443  >  57039 [ACK] Seq=124242 Ack=364171 Win=2745 Len=0
570,54.0546616,172.20.40.110,151.101.66.187,TLSv1.2,2895,Application Data
571,54.0560967,172.20.40.110,151.101.66.187,TLSv1.2,2898,Application Data
572,54.0687048,151.101.66.187,172.20.40.110,TLSv1.2,124,Application Data
573,54.0687048,151.101.66.187,172.20.40.110,TCP,60,443  >  57039 [ACK] Seq=124312 Ack=367016 Win=2756 Len=0
574,54.0687048,151.101.66.187,172.20.40.110,TLSv1.2,241,Application Data
575,54.0687048,151.101.66.187,172.20.40.110,TCP,60,443  >  57039 [ACK] Seq=124499 Ack=369857 Win=2767 Len=0
576,54.0687048,151.101.66.187,172.20.40.110,TCP,60,443  >  57039 [ACK] Seq=124499 Ack=372701 Win=2778 Len=0
577,54.0688344,172.20.40.110,151.101.66.187,TCP,54,57039  >  443 [ACK] Seq=372701 Ack=124499 Win=512 Len=0
578,54.0699238,151.101.66.187,172.20.40.110,TLSv1.2,130,Application Data
579,54.0699238,151.101.66.187,172.20.40.110,TLSv1.2,124,Application Data
580,54.0700172,172.20.40.110,151.101.66.187,TCP,54,57039  >  443 [ACK] Seq=372701 Ack=124645 Win=517 Len=0
