No.,Time,Source,Destination,Protocol,Length,Info
1,0.0,172.20.40.110,151.101.194.187,TLSv1.2,2893,Application Data
2,0.0001786,172.20.40.110,151.101.194.187,TLSv1.2,93,Application Data
3,0.0119069,151.101.194.187,172.20.40.110,TCP,60,443  >  50060 [ACK] Seq=1 Ack=2840 Win=1174 Len=0
4,0.0119069,151.101.194.187,172.20.40.110,TCP,60,443  >  50060 [ACK] Seq=1 Ack=2879 Win=1174 Len=0
5,0.0119069,151.101.194.187,172.20.40.110,TLSv1.2,93,Application Data
6,0.011997,172.20.40.110,151.101.194.187,TCP,54,50060  >  443 [ACK] Seq=2879 Ack=40 Win=258 Len=0
7,0.0176022,151.101.194.187,172.20.40.110,TLSv1.2,241,Application Data
8,0.0176848,172.20.40.110,151.101.194.187,TCP,54,50060  >  443 [ACK] Seq=2879 Ack=227 Win=258 Len=0
9,0.0389337,172.20.40.110,151.101.194.187,TLSv1.2,2893,Application Data
10,0.0503777,151.101.194.187,172.20.40.110,TCP,60,443  >  50060 [ACK] Seq=227 Ack=5718 Win=1185 Len=0
11,0.0537724,151.101.194.187,172.20.40.110,TLSv1.2,98,Application Data
12,0.0793364,151.101.194.187,172.20.40.110,TCP,98,"[TCP Retransmission] 443  >  50060 [PSH, ACK] Seq=227 Ack=5718 Win=1185 Len=44"
13,0.0794,172.20.40.110,151.101.194.187,TCP,66,50060  >  443 [ACK] Seq=5718 Ack=271 Win=257 Len=0 SLE=227 SRE=271
14,1.275699,172.20.40.110,151.101.194.187,TLSv1.2,2906,Application Data
15,1.2888874,151.101.194.187,172.20.40.110,TCP,60,443  >  50060 [ACK] Seq=271 Ack=8570 Win=1196 Len=0
16,1.2907767,172.20.40.110,151.101.194.187,TLSv1.2,2897,Application Data
17,1.2913258,172.20.40.110,151.101.194.187,TLSv1.2,2891,Application Data
18,1.3045706,151.101.194.187,172.20.40.110,TLSv1.2,241,Application Data
19,1.3045706,151.101.194.187,172.20.40.110,TCP,60,443  >  50060 [ACK] Seq=458 Ack=11413 Win=1207 Len=0
20,1.3045706,151.101.194.187,172.20.40.110,TCP,60,443  >  50060 [ACK] Seq=458 Ack=14250 Win=1219 Len=0
21,1.3045706,151.101.194.187,172.20.40.110,TLSv1.2,124,Application Data
22,1.3047047,172.20.40.110,151.101.194.187,TCP,54,50060  >  443 [ACK] Seq=14250 Ack=528 Win=256 Len=0
23,1.3055767,151.101.194.187,172.20.40.110,TLSv1.2,104,Application Data
24,1.3170999,172.20.40.110,151.101.194.187,TLSv1.2,2891,Application Data
25,1.3259972,151.101.194.187,172.20.40.110,TCP,60,443  >  50060 [ACK] Seq=578 Ack=17087 Win=1230 Len=0
26,1.3298042,151.101.194.187,172.20.40.110,TLSv1.2,130,Application Data
27,1.3611094,151.101.194.187,172.20.40.110,TCP,130,"[TCP Retransmission] 443  >  50060 [PSH, ACK] Seq=578 Ack=17087 Win=1230 Len=76"
28,1.3611758,172.20.40.110,151.101.194.187,TCP,66,50060  >  443 [ACK] Seq=17087 Ack=654 Win=256 Len=0 SLE=578 SRE=654
29,1.3895052,172.20.40.110,151.101.194.187,TLSv1.2,2891,Application Data
30,1.399551,151.101.194.187,172.20.40.110,TCP,60,443  >  50060 [ACK] Seq=654 Ack=19924 Win=1241 Len=0
31,1.4024411,151.101.194.187,172.20.40.110,TLSv1.2,130,Application Data
32,1.4331131,151.101.194.187,172.20.40.110,TCP,130,"[TCP Retransmission] 443  >  50060 [PSH, ACK] Seq=654 Ack=19924 Win=1241 Len=76"
33,1.4332302,172.20.40.110,151.101.194.187,TCP,66,50060  >  443 [ACK] Seq=19924 Ack=730 Win=256 Len=0 SLE=654 SRE=730
34,1.6308321,172.20.40.110,151.101.194.187,TLSv1.2,2888,Application Data
35,1.6490297,151.101.194.187,172.20.40.110,TCP,60,443  >  50060 [ACK] Seq=730 Ack=22758 Win=1252 Len=0
36,1.6490297,151.101.194.187,172.20.40.110,TLSv1.2,169,Application Data
37,1.6633089,172.20.40.110,151.101.194.187,TLSv1.2,2905,Application Data
38,1.6739295,151.101.194.187,172.20.40.110,TCP,60,443  >  50060 [ACK] Seq=845 Ack=25609 Win=1263 Len=0
39,1.6773266,151.101.194.187,172.20.40.110,TLSv1.2,135,Application Data
40,1.7117414,151.101.194.187,172.20.40.110,TCP,135,"[TCP Retransmission] 443  >  50060 [PSH, ACK] Seq=845 Ack=25609 Win=1263 Len=81"
41,1.711802,172.20.40.110,151.101.194.187,TCP,66,50060  >  443 [ACK] Seq=25609 Ack=926 Win=255 Len=0 SLE=845 SRE=926
42,1.7287955,172.20.40.110,151.101.194.187,TLSv1.2,2905,Application Data
43,1.7399193,151.101.194.187,172.20.40.110,TCP,60,443  >  50060 [ACK] Seq=926 Ack=28460 Win=1274 Len=0
44,1.7442677,151.101.194.187,172.20.40.110,TLSv1.2,286,Application Data
45,1.777723,151.101.194.187,172.20.40.110,TCP,286,"[TCP Retransmission] 443  >  50060 [PSH, ACK] Seq=926 Ack=28460 Win=1274 Len=232"
46,1.7778024,172.20.40.110,151.101.194.187,TCP,66,50060  >  443 [ACK] Seq=28460 Ack=1158 Win=254 Len=0 SLE=926 SRE=1158
47,2.0418219,172.20.40.110,151.101.194.187,TLSv1.2,2894,Application Data
48,2.0420849,172.20.40.110,151.101.194.187,TLSv1.2,2891,Application Data
49,2.0423167,172.20.40.110,151.101.194.187,TLSv1.2,2888,Application Data
50,2.0427767,172.20.40.110,151.101.194.187,TLSv1.2,2891,Application Data
51,2.0443439,172.20.40.110,151.101.194.187,TLSv1.2,2892,Application Data
52,2.0453575,172.20.40.110,151.101.194.187,TLSv1.2,2894,Application Data
53,2.0510649,172.20.40.110,151.101.194.187,TLSv1.2,2890,Application Data
54,2.0515664,172.20.40.110,151.101.194.187,TLSv1.2,2893,Application Data
55,2.0581395,151.101.194.187,172.20.40.110,TCP,60,443  >  50060 [ACK] Seq=1158 Ack=31300 Win=1285 Len=0
56,2.0581395,151.101.194.187,172.20.40.110,TCP,60,443  >  50060 [ACK] Seq=1158 Ack=34137 Win=1296 Len=0
57,2.0581395,151.101.194.187,172.20.40.110,TCP,60,443  >  50060 [ACK] Seq=1158 Ack=36971 Win=1307 Len=0
58,2.0598978,151.101.194.187,172.20.40.110,TLSv1.2,240,Application Data
59,2.0598978,151.101.194.187,172.20.40.110,TLSv1.2,130,Application Data
60,2.0599745,172.20.40.110,151.101.194.187,TCP,54,50060  >  443 [ACK] Seq=51161 Ack=1420 Win=258 Len=0
61,2.0622454,151.101.194.187,172.20.40.110,TLSv1.2,124,Application Data
62,2.0622454,151.101.194.187,172.20.40.110,TCP,60,443  >  50060 [ACK] Seq=1490 Ack=39808 Win=1318 Len=0
63,2.0622454,151.101.194.187,172.20.40.110,TCP,60,443  >  50060 [ACK] Seq=1490 Ack=42646 Win=1329 Len=0
64,2.0622454,151.101.194.187,172.20.40.110,TCP,60,443  >  50060 [ACK] Seq=1490 Ack=45486 Win=1341 Len=0
65,2.0647718,151.101.194.187,172.20.40.110,TLSv1.2,130,Application Data
66,2.0648558,172.20.40.110,151.101.194.187,TCP,54,50060  >  443 [ACK] Seq=51161 Ack=1566 Win=258 Len=0
67,2.0692175,151.101.194.187,172.20.40.110,TLSv1.2,125,Application Data
68,2.0692175,151.101.194.187,172.20.40.110,TLSv1.2,130,Application Data
69,2.0692839,172.20.40.110,151.101.194.187,TCP,54,50060  >  443 [ACK] Seq=51161 Ack=1713 Win=257 Len=0
70,2.0720433,151.101.194.187,172.20.40.110,TCP,60,443  >  50060 [ACK] Seq=1713 Ack=46866 Win=1346 Len=0
71,2.0757884,151.101.194.187,172.20.40.110,TCP,60,443  >  50060 [ACK] Seq=1713 Ack=48322 Win=1352 Len=0
72,2.0757884,151.101.194.187,172.20.40.110,TCP,60,443  >  50060 [ACK] Seq=1713 Ack=51161 Win=1363 Len=0
73,2.0783717,151.101.194.187,172.20.40.110,TLSv1.2,130,Application Data
74,2.0783717,151.101.194.187,172.20.40.110,TLSv1.2,124,Application Data
75,2.0784572,172.20.40.110,151.101.194.187,TCP,54,50060  >  443 [ACK] Seq=51161 Ack=1859 Win=257 Len=0
76,3.0685513,172.20.40.110,151.101.194.187,TLSv1.2,2915,Application Data
77,3.0786996,151.101.194.187,172.20.40.110,TCP,60,443  >  50060 [ACK] Seq=1859 Ack=54022 Win=1374 Len=0
78,3.0861541,151.101.194.187,172.20.40.110,TLSv1.2,240,Application Data
79,3.1176284,151.101.194.187,172.20.40.110,TCP,240,"[TCP Retransmission] 443  >  50060 [PSH, ACK] Seq=1859 Ack=54022 Win=1374 Len=186"
80,3.1177864,172.20.40.110,151.101.194.187,TCP,66,50060  >  443 [ACK] Seq=54022 Ack=2045 Win=256 Len=0 SLE=1859 SRE=2045
81,10.6520104,172.20.40.110,151.101.194.187,TLSv1.2,2854,Application Data
82,10.6613909,151.101.194.187,172.20.40.110,TCP,60,443  >  50060 [ACK] Seq=2045 Ack=56822 Win=1385 Len=0
83,10.8721432,151.101.194.187,172.20.40.110,TLSv1.2,5574,"Application Data, Application Data, Application Data"
84,10.872244,172.20.40.110,151.101.194.187,TCP,54,50060  >  443 [ACK] Seq=56822 Ack=7565 Win=258 Len=0
85,10.878207,172.20.40.110,151.101.194.187,TLSv1.2,89,Application Data
86,10.8838942,151.101.194.187,172.20.40.110,TLSv1.2,1434,Application Data
87,10.8838942,151.101.194.187,172.20.40.110,TLSv1.2,2814,"Application Data, Application Data"
88,10.8838942,151.101.194.187,172.20.40.110,TLSv1.2,1434,Application Data
89,10.8839938,172.20.40.110,151.101.194.187,TCP,54,50060  >  443 [ACK] Seq=56857 Ack=13085 Win=258 Len=0
90,10.8870235,151.101.194.187,172.20.40.110,TLSv1.2,1434,Application Data
91,10.8870235,151.101.194.187,172.20.40.110,TLSv1.2,1434,Application Data
92,10.8871211,172.20.40.110,151.101.194.187,TCP,54,50060  >  443 [ACK] Seq=56857 Ack=15845 Win=258 Len=0
93,10.8923928,151.101.194.187,172.20.40.110,TLSv1.2,1434,Application Data
94,10.8923928,151.101.194.187,172.20.40.110,TLSv1.2,995,"Application Data, Application Data"
95,10.8923928,151.101.194.187,172.20.40.110,TLSv1.2,2814,Application Data
96,10.8924938,172.20.40.110,151.101.194.187,TCP,54,50060  >  443 [ACK] Seq=56857 Ack=20926 Win=258 Len=0
97,10.8958612,151.101.194.187,172.20.40.110,TLSv1.2,5574,"Application Data, Application Data, Application Data, Application Data, Application Data"
98,10.8959553,172.20.40.110,151.101.194.187,TCP,54,50060  >  443 [ACK] Seq=56857 Ack=26446 Win=258 Len=0
99,10.8972784,151.101.194.187,172.20.40.110,TLSv1.2,1434,Application Data
100,10.8972784,151.101.194.187,172.20.40.110,TLSv1.2,1111,"Application Data, Application Data"
101,10.8972784,151.101.194.187,172.20.40.110,TCP,60,443  >  50060 [ACK] Seq=28883 Ack=56857 Win=1385 Len=0
102,10.8973804,172.20.40.110,151.101.194.187,TCP,54,50060  >  443 [ACK] Seq=56857 Ack=28883 Win=258 Len=0
103,11.2327273,172.20.40.110,151.101.194.187,TLSv1.2,2848,Application Data
104,11.233521,172.20.40.110,151.101.194.187,TLSv1.2,2846,Application Data
105,11.2360519,172.20.40.110,151.101.194.187,TLSv1.2,2852,Application Data
106,11.2413951,172.20.40.110,151.101.194.187,TLSv1.2,2846,Application Data
107,11.2416421,172.20.40.110,151.101.194.187,TLSv1.2,2844,Application Data
108,11.2418038,172.20.40.110,151.101.194.187,TLSv1.2,2846,Application Data
109,11.2801623,172.20.40.110,151.101.194.187,TCP,1434,"[TCP Retransmission] 50060  >  443 [PSH, ACK] Seq=72235 Ack=28883 Win=258 Len=1380"
110,11.3079964,151.101.194.187,172.20.40.110,TCP,60,443  >  50060 [ACK] Seq=28883 Ack=59651 Win=1396 Len=0
111,11.3079964,151.101.194.187,172.20.40.110,TCP,60,443  >  50060 [ACK] Seq=28883 Ack=62443 Win=1407 Len=0
112,11.3157148,151.101.194.187,172.20.40.110,TLSv1.2,450,Application Data
113,11.3179095,151.101.194.187,172.20.40.110,TLSv1.2,130,Application Data
114,11.3181069,172.20.40.110,151.101.194.187,TCP,54,50060  >  443 [ACK] Seq=73615 Ack=29355 Win=256 Len=0
115,11.320221,151.101.194.187,172.20.40.110,TCP,60,443  >  50060 [ACK] Seq=29355 Ack=65241 Win=1418 Len=0
116,11.328029,151.101.194.187,172.20.40.110,TLSv1.2,131,Application Data
117,11.3366338,151.101.194.187,172.20.40.110,TCP,60,443  >  50060 [ACK] Seq=29432 Ack=68033 Win=1429 Len=0
118,11.3366338,151.101.194.187,172.20.40.110,TCP,60,443  >  50060 [ACK] Seq=29432 Ack=70823 Win=1440 Len=0
119,11.3366338,151.101.194.187,172.20.40.110,TCP,60,443  >  50060 [ACK] Seq=29432 Ack=73615 Win=1451 Len=0
120,11.3366338,151.101.194.187,172.20.40.110,TLSv1.2,130,Application Data
121,11.3366338,151.101.194.187,172.20.40.110,TLSv1.2,126,Application Data
122,11.3370295,172.20.40.110,151.101.194.187,TCP,54,50060  >  443 [ACK] Seq=73615 Ack=29580 Win=256 Len=0
123,11.3386983,151.101.194.187,172.20.40.110,TLSv1.2,124,Application Data
124,11.3390379,172.20.40.110,151.101.194.187,TCP,54,50060  >  443 [ACK] Seq=73615 Ack=29650 Win=255 Len=0
125,11.3612707,151.101.194.187,172.20.40.110,TCP,66,[TCP Dup ACK 119#1] 443  >  50060 [ACK] Seq=29650 Ack=73615 Win=1451 Len=0 SLE=72235 SRE=73615
126,11.3987948,151.101.194.187,172.20.40.110,TCP,124,"[TCP Spurious Retransmission] 443  >  50060 [PSH, ACK] Seq=29580 Ack=73615 Win=1451 Len=70"
127,11.3988922,172.20.40.110,151.101.194.187,TCP,66,[TCP Dup ACK 124#1] 50060  >  443 [ACK] Seq=73615 Ack=29650 Win=255 Len=0 SLE=29580 SRE=29650
128,12.7672361,172.20.40.110,151.101.194.187,TLSv1.2,2850,Application Data
129,12.7732879,172.20.40.110,151.101.194.187,TLSv1.2,2846,Application Data
130,12.7796172,151.101.194.187,172.20.40.110,TCP,60,443  >  50060 [ACK] Seq=29650 Ack=76411 Win=1462 Len=0
131,12.7808038,151.101.194.187,172.20.40.110,TLSv1.2,240,Application Data
132,12.7831294,151.101.194.187,172.20.40.110,TCP,60,443  >  50060 [ACK] Seq=29836 Ack=79203 Win=1473 Len=0
133,12.7907596,151.101.194.187,172.20.40.110,TLSv1.2,131,Application Data
134,12.7908303,172.20.40.110,151.101.194.187,TCP,54,50060  >  443 [ACK] Seq=79203 Ack=29913 Win=254 Len=0
135,13.3105724,172.20.40.110,151.101.194.187,TLSv1.2,2854,Application Data
136,13.3140349,172.20.40.110,151.101.194.187,TLSv1.2,2856,Application Data
137,13.3160805,172.20.40.110,151.101.194.187,TLSv1.2,2850,Application Data
138,13.3216332,172.20.40.110,151.101.194.187,TLSv1.2,2852,Application Data
139,13.3273318,151.101.194.187,172.20.40.110,TCP,60,443  >  50060 [ACK] Seq=29913 Ack=82003 Win=1484 Len=0
140,13.3273318,151.101.194.187,172.20.40.110,TCP,60,443  >  50060 [ACK] Seq=29913 Ack=84805 Win=1495 Len=0
141,13.3273318,151.101.194.187,172.20.40.110,TLSv1.2,214,Application Data
142,13.3282199,151.101.194.187,172.20.40.110,TLSv1.2,104,Application Data
143,13.3282199,151.101.194.187,172.20.40.110,TCP,60,443  >  50060 [ACK] Seq=30123 Ack=87601 Win=1506 Len=0
144,13.3283071,172.20.40.110,151.101.194.187,TCP,54,50060  >  443 [ACK] Seq=90399 Ack=30123 Win=253 Len=0
145,13.3301311,172.20.40.110,151.101.194.187,TLSv1.2,2850,Application Data
146,13.3326928,151.101.194.187,172.20.40.110,TCP,60,443  >  50060 [ACK] Seq=30123 Ack=90399 Win=1516 Len=0
147,13.3326928,151.101.194.187,172.20.40.110,TLSv1.2,98,Application Data
148,13.3336233,151.101.194.187,172.20.40.110,TLSv1.2,104,Application Data
149,13.3336855,172.20.40.110,151.101.194.187,TLSv1.2,2848,Application Data
150,13.3387419,172.20.40.110,151.101.194.187,TLSv1.2,2850,Application Data
151,13.3423039,151.101.194.187,172.20.40.110,TCP,60,443  >  50060 [ACK] Seq=30217 Ack=93195 Win=1527 Len=0
152,13.3444095,151.101.194.187,172.20.40.110,TCP,60,443  >  50060 [ACK] Seq=30217 Ack=95989 Win=1538 Len=0
153,13.3444095,151.101.194.187,172.20.40.110,TLSv1.2,104,Application Data
154,13.3445246,172.20.40.110,151.101.194.187,TCP,54,50060  >  443 [ACK] Seq=98785 Ack=30267 Win=258 Len=0
155,13.3465288,151.101.194.187,172.20.40.110,TLSv1.2,104,Application Data
156,13.3465981,172.20.40.110,151.101.194.187,TCP,54,50060  >  443 [ACK] Seq=98785 Ack=30317 Win=258 Len=0
157,13.3475795,151.101.194.187,172.20.40.110,TCP,60,443  >  50060 [ACK] Seq=30317 Ack=98785 Win=1549 Len=0
158,13.3519466,151.101.194.187,172.20.40.110,TLSv1.2,142,Application Data
159,13.364353,172.20.40.110,151.101.194.187,TLSv1.2,2850,Application Data
160,13.3769325,151.101.194.187,172.20.40.110,TCP,60,443  >  50060 [ACK] Seq=30405 Ack=101581 Win=1560 Len=0
161,13.3812928,151.101.194.187,172.20.40.110,TLSv1.2,98,Application Data
162,13.4325189,172.20.40.110,151.101.194.187,TCP,54,50060  >  443 [ACK] Seq=101581 Ack=30449 Win=258 Len=0
163,13.4326896,151.101.194.187,172.20.40.110,TCP,98,"[TCP Spurious Retransmission] 443  >  50060 [PSH, ACK] Seq=30405 Ack=101581 Win=1560 Len=44"
164,13.4327389,172.20.40.110,151.101.194.187,TCP,66,[TCP Dup ACK 162#1] 50060  >  443 [ACK] Seq=101581 Ack=30449 Win=258 Len=0 SLE=30405 SRE=30449
165,18.041708,172.20.40.110,151.101.194.187,TLSv1.2,2677,Application Data
166,18.0542079,151.101.194.187,172.20.40.110,TCP,60,443  >  50060 [ACK] Seq=30449 Ack=104204 Win=1571 Len=0
167,18.1116951,151.101.194.187,172.20.40.110,TLSv1.2,780,Application Data
168,18.1150558,172.20.40.110,151.101.194.187,TLSv1.2,89,Application Data
169,18.1234173,151.101.194.187,172.20.40.110,TCP,60,443  >  50060 [ACK] Seq=31175 Ack=104239 Win=1571 Len=0
170,27.1751833,172.20.40.110,151.101.194.187,TLSv1.2,2853,Application Data
171,27.1759919,172.20.40.110,151.101.194.187,TLSv1.2,2847,Application Data
172,27.1806733,172.20.40.110,151.101.194.187,TLSv1.2,2854,Application Data
173,27.1818187,172.20.40.110,151.101.194.187,TLSv1.2,2853,Application Data
174,27.1820199,172.20.40.110,151.101.194.187,TLSv1.2,2847,Application Data
175,27.1821279,172.20.40.110,151.101.194.187,TLSv1.2,2847,Application Data
176,27.1827282,172.20.40.110,151.101.194.187,TLSv1.2,2850,Application Data
177,27.1887534,151.101.194.187,172.20.40.110,TCP,60,443  >  50060 [ACK] Seq=31175 Ack=107038 Win=1582 Len=0
178,27.1906285,151.101.194.187,172.20.40.110,TCP,60,443  >  50060 [ACK] Seq=31175 Ack=109831 Win=1593 Len=0
179,27.1906285,151.101.194.187,172.20.40.110,TLSv1.2,246,Application Data
180,27.1906285,151.101.194.187,172.20.40.110,TLSv1.2,131,Application Data
181,27.1906285,151.101.194.187,172.20.40.110,TCP,60,443  >  50060 [ACK] Seq=31444 Ack=112631 Win=1604 Len=0
182,27.1907376,172.20.40.110,151.101.194.187,TCP,54,50060  >  443 [ACK] Seq=123812 Ack=31444 Win=254 Len=0
183,27.1910801,172.20.40.110,151.101.194.187,TLSv1.2,2844,Application Data
184,27.1913164,172.20.40.110,151.101.194.187,TLSv1.2,2847,Application Data
185,27.1915128,172.20.40.110,151.101.194.187,TLSv1.2,2853,Application Data
186,27.1916687,172.20.40.110,151.101.194.187,TLSv1.2,2846,Application Data
187,27.1931046,151.101.194.187,172.20.40.110,TLSv1.2,125,Application Data
188,27.1983574,151.101.194.187,172.20.40.110,TCP,60,443  >  50060 [ACK] Seq=31515 Ack=115430 Win=1614 Len=0
189,27.1983574,151.101.194.187,172.20.40.110,TCP,60,443  >  50060 [ACK] Seq=31515 Ack=118223 Win=1625 Len=0
190,27.1983574,151.101.194.187,172.20.40.110,TCP,60,443  >  50060 [ACK] Seq=31515 Ack=121016 Win=1636 Len=0
191,27.2097584,151.101.194.187,172.20.40.110,TLSv1.2,130,Application Data
192,27.2098328,172.20.40.110,151.101.194.187,TCP,54,50060  >  443 [ACK] Seq=134986 Ack=31591 Win=253 Len=0
193,27.2149786,151.101.194.187,172.20.40.110,TLSv1.2,124,Application Data
194,27.2150592,172.20.40.110,151.101.194.187,TCP,54,50060  >  443 [ACK] Seq=134986 Ack=31661 Win=258 Len=0
195,27.2168757,151.101.194.187,172.20.40.110,TLSv1.2,125,Application Data
196,27.2168757,151.101.194.187,172.20.40.110,TCP,60,443  >  50060 [ACK] Seq=31732 Ack=123812 Win=1647 Len=0
197,27.2168757,151.101.194.187,172.20.40.110,TLSv1.2,130,Application Data
198,27.2168757,151.101.194.187,172.20.40.110,TCP,60,443  >  50060 [ACK] Seq=31808 Ack=126602 Win=1658 Len=0
199,27.2168757,151.101.194.187,172.20.40.110,TCP,60,443  >  50060 [ACK] Seq=31808 Ack=129395 Win=1669 Len=0
200,27.2168757,151.101.194.187,172.20.40.110,TCP,60,443  >  50060 [ACK] Seq=31808 Ack=132194 Win=1680 Len=0
201,27.2168757,151.101.194.187,172.20.40.110,TCP,60,443  >  50060 [ACK] Seq=31808 Ack=134986 Win=1691 Len=0
202,27.2168757,151.101.194.187,172.20.40.110,TLSv1.2,174,Application Data
203,27.2168757,151.101.194.187,172.20.40.110,TLSv1.2,124,Application Data
204,27.2168757,151.101.194.187,172.20.40.110,TLSv1.2,130,Application Data
205,27.2171282,172.20.40.110,151.101.194.187,TCP,54,50060  >  443 [ACK] Seq=134986 Ack=32074 Win=257 Len=0
206,41.6759333,172.20.40.110,151.101.194.187,TLSv1.2,2866,Application Data
207,41.6760908,172.20.40.110,151.101.194.187,TLSv1.2,93,Application Data
208,41.6917992,151.101.194.187,172.20.40.110,TCP,60,443  >  50060 [ACK] Seq=32074 Ack=137798 Win=1702 Len=0
209,41.6917992,151.101.194.187,172.20.40.110,TCP,60,443  >  50060 [ACK] Seq=32074 Ack=137837 Win=1702 Len=0
210,41.6917992,151.101.194.187,172.20.40.110,TLSv1.2,93,Application Data
211,41.7395516,172.20.40.110,151.101.194.187,TCP,54,50060  >  443 [ACK] Seq=137837 Ack=32113 Win=256 Len=0
212,41.7431987,151.101.194.187,172.20.40.110,TCP,93,"[TCP Spurious Retransmission] 443  >  50060 [PSH, ACK] Seq=32074 Ack=137837 Win=1702 Len=39"
213,41.7432575,172.20.40.110,151.101.194.187,TCP,66,[TCP Dup ACK 211#1] 50060  >  443 [ACK] Seq=137837 Ack=32113 Win=256 Len=0 SLE=32074 SRE=32113
214,42.717159,151.101.194.187,172.20.40.110,TLSv1.2,348,Application Data
215,42.717159,151.101.194.187,172.20.40.110,TCP,4194,"443  >  50060 [PSH, ACK] Seq=32407 Ack=137837 Win=1702 Len=4140 [TCP PDU reassembled in 222]"
216,42.7172689,172.20.40.110,151.101.194.187,TCP,54,50060  >  443 [ACK] Seq=137837 Ack=36547 Win=258 Len=0
217,42.7205646,151.101.194.187,172.20.40.110,TCP,1434,443  >  50060 [ACK] Seq=36547 Ack=137837 Win=1702 Len=1380 [TCP PDU reassembled in 222]
218,42.7205646,151.101.194.187,172.20.40.110,TCP,4194,"443  >  50060 [PSH, ACK] Seq=37927 Ack=137837 Win=1702 Len=4140 [TCP PDU reassembled in 222]"
219,42.7206722,172.20.40.110,151.101.194.187,TCP,54,50060  >  443 [ACK] Seq=137837 Ack=42067 Win=258 Len=0
220,42.7241345,151.101.194.187,172.20.40.110,TCP,5574,"443  >  50060 [PSH, ACK] Seq=42067 Ack=137837 Win=1702 Len=5520 [TCP PDU reassembled in 222]"
221,42.7242353,172.20.40.110,151.101.194.187,TCP,54,50060  >  443 [ACK] Seq=137837 Ack=47587 Win=258 Len=0
222,42.7266463,151.101.194.187,172.20.40.110,TLSv1.2,5574,Application Data
223,42.7267365,172.20.40.110,151.101.194.187,TCP,54,50060  >  443 [ACK] Seq=137837 Ack=53107 Win=258 Len=0
224,42.7314363,151.101.194.187,172.20.40.110,TCP,1434,443  >  50060 [ACK] Seq=53107 Ack=137837 Win=1702 Len=1380 [TCP PDU reassembled in 232]
225,42.7314363,151.101.194.187,172.20.40.110,TCP,1434,443  >  50060 [ACK] Seq=54487 Ack=137837 Win=1702 Len=1380 [TCP PDU reassembled in 232]
226,42.7314363,151.101.194.187,172.20.40.110,TCP,2814,"443  >  50060 [PSH, ACK] Seq=55867 Ack=137837 Win=1702 Len=2760 [TCP PDU reassembled in 232]"
227,42.7315255,172.20.40.110,151.101.194.187,TCP,54,50060  >  443 [ACK] Seq=137837 Ack=58627 Win=258 Len=0
228,42.7339008,151.101.194.187,172.20.40.110,TCP,1434,443  >  50060 [ACK] Seq=58627 Ack=137837 Win=1702 Len=1380 [TCP PDU reassembled in 232]
229,42.7339008,151.101.194.187,172.20.40.110,TCP,2814,"443  >  50060 [PSH, ACK] Seq=60007 Ack=137837 Win=1702 Len=2760 [TCP PDU reassembled in 232]"
230,42.7339824,172.20.40.110,151.101.194.187,TCP,54,50060  >  443 [ACK] Seq=137837 Ack=62767 Win=258 Len=0
231,42.7363533,151.101.194.187,172.20.40.110,TCP,1434,443  >  50060 [ACK] Seq=62767 Ack=137837 Win=1702 Len=1380 [TCP PDU reassembled in 232]
232,42.7363533,151.101.194.187,172.20.40.110,TLSv1.2,5574,Application Data
233,42.7364311,172.20.40.110,151.101.194.187,TCP,54,50060  >  443 [ACK] Seq=137837 Ack=69667 Win=258 Len=0
234,42.7388013,151.101.194.187,172.20.40.110,TCP,2814,443  >  50060 [ACK] Seq=69667 Ack=137837 Win=1702 Len=2760 [TCP PDU reassembled in 240]
235,42.7388799,172.20.40.110,151.101.194.187,TCP,54,50060  >  443 [ACK] Seq=137837 Ack=72427 Win=258 Len=0
236,42.7409038,151.101.194.187,172.20.40.110,TCP,1434,"443  >  50060 [PSH, ACK] Seq=72427 Ack=137837 Win=1702 Len=1380 [TCP PDU reassembled in 240]"
237,42.7409038,151.101.194.187,172.20.40.110,TCP,5574,"443  >  50060 [PSH, ACK] Seq=73807 Ack=137837 Win=1702 Len=5520 [TCP PDU reassembled in 240]"
238,42.7409963,172.20.40.110,151.101.194.187,TCP,54,50060  >  443 [ACK] Seq=137837 Ack=79327 Win=258 Len=0
239,42.745,151.101.194.187,172.20.40.110,TCP,1434,443  >  50060 [ACK] Seq=79327 Ack=137837 Win=1702 Len=1380 [TCP PDU reassembled in 240]
240,42.745,151.101.194.187,172.20.40.110,TLSv1.2,1434,Application Data
241,42.745,151.101.194.187,172.20.40.110,TLSv1.2,723,Application Data
242,42.745,151.101.194.187,172.20.40.110,TCP,723,"[TCP Retransmission] 443  >  50060 [PSH, ACK] Seq=82087 Ack=137837 Win=1702 Len=669 [TCP PDU reassembled in 241]"
243,42.7451058,172.20.40.110,151.101.194.187,TCP,66,50060  >  443 [ACK] Seq=137837 Ack=82756 Win=258 Len=0 SLE=82087 SRE=82756
244,42.7458973,172.20.40.110,151.101.194.187,TLSv1.2,89,Application Data
245,42.7533898,151.101.194.187,172.20.40.110,TCP,60,443  >  50060 [ACK] Seq=82756 Ack=137872 Win=1702 Len=0
246,42.9805959,172.20.40.110,151.101.194.187,TLSv1.2,2862,Application Data
247,42.9810768,172.20.40.110,151.101.194.187,TLSv1.2,2864,Application Data
248,42.983419,172.20.40.110,151.101.194.187,TLSv1.2,2862,Application Data
249,42.984199,172.20.40.110,151.101.194.187,TLSv1.2,2860,Application Data
250,42.9884036,172.20.40.110,151.101.194.187,TLSv1.2,2868,Application Data
251,42.9898815,151.101.194.187,172.20.40.110,TCP,60,443  >  50060 [ACK] Seq=82756 Ack=140680 Win=1713 Len=0
252,42.9917938,151.101.194.187,172.20.40.110,TCP,60,443  >  50060 [ACK] Seq=82756 Ack=143490 Win=1724 Len=0
253,42.9956767,151.101.194.187,172.20.40.110,TLSv1.2,446,Application Data
254,42.9967343,151.101.194.187,172.20.40.110,TCP,60,443  >  50060 [ACK] Seq=83148 Ack=146298 Win=1735 Len=0
255,42.9967343,151.101.194.187,172.20.40.110,TCP,60,443  >  50060 [ACK] Seq=83148 Ack=149104 Win=1746 Len=0
256,43.0002273,151.101.194.187,172.20.40.110,TLSv1.2,136,Application Data
257,43.0002273,151.101.194.187,172.20.40.110,TLSv1.2,206,"Application Data, Application Data"
258,43.0003177,172.20.40.110,151.101.194.187,TCP,54,50060  >  443 [ACK] Seq=151918 Ack=83382 Win=256 Len=0
259,43.0012108,151.101.194.187,172.20.40.110,TCP,60,443  >  50060 [ACK] Seq=83382 Ack=151918 Win=1757 Len=0
260,43.0045189,151.101.194.187,172.20.40.110,TLSv1.2,125,Application Data
261,43.0371925,172.20.40.110,151.101.194.187,TLSv1.2,2879,Application Data
262,43.0384714,172.20.40.110,151.101.194.187,TLSv1.2,2862,Application Data
263,43.0488706,151.101.194.187,172.20.40.110,TCP,60,443  >  50060 [ACK] Seq=83453 Ack=154743 Win=1768 Len=0
264,43.0488706,151.101.194.187,172.20.40.110,TCP,60,443  >  50060 [ACK] Seq=83453 Ack=157551 Win=1779 Len=0
265,43.0544079,151.101.194.187,172.20.40.110,TLSv1.2,124,Application Data
266,43.0567654,151.101.194.187,172.20.40.110,TLSv1.2,125,Application Data
267,43.0568471,172.20.40.110,151.101.194.187,TCP,54,50060  >  443 [ACK] Seq=157551 Ack=83594 Win=255 Len=0
268,44.9250136,172.20.40.110,151.101.194.187,TLSv1.2,2866,Application Data
269,44.9276251,172.20.40.110,151.101.194.187,TLSv1.2,2862,Application Data
270,44.9357633,151.101.194.187,172.20.40.110,TCP,60,443  >  50060 [ACK] Seq=83594 Ack=160363 Win=1790 Len=0
271,44.9389685,151.101.194.187,172.20.40.110,TLSv1.2,240,Application Data
272,44.9389685,151.101.194.187,172.20.40.110,TCP,60,443  >  50060 [ACK] Seq=83780 Ack=163171 Win=1801 Len=0
273,44.9420912,151.101.194.187,172.20.40.110,TLSv1.2,131,Application Data
274,44.9421707,172.20.40.110,151.101.194.187,TCP,54,50060  >  443 [ACK] Seq=163171 Ack=83857 Win=254 Len=0
275,47.4226643,172.20.40.110,151.101.194.187,TLSv1.2,2870,Application Data
276,47.4344298,151.101.194.187,172.20.40.110,TCP,60,443  >  50060 [ACK] Seq=83857 Ack=165987 Win=1812 Len=0
277,47.4385605,151.101.194.187,172.20.40.110,TLSv1.2,214,Application Data
278,47.4852985,172.20.40.110,151.101.194.187,TCP,54,50060  >  443 [ACK] Seq=165987 Ack=84017 Win=253 Len=0
279,47.6022933,172.20.40.110,151.101.194.187,TLSv1.2,2881,Application Data
280,47.603328,172.20.40.110,151.101.194.187,TLSv1.2,2872,Application Data
281,47.6039089,172.20.40.110,151.101.194.187,TLSv1.2,2866,Application Data
282,47.6065915,172.20.40.110,151.101.194.187,TLSv1.2,2868,Application Data
283,47.6083541,172.20.40.110,151.101.194.187,TLSv1.2,2866,Application Data
284,47.6108123,172.20.40.110,151.101.194.187,TLSv1.2,2864,Application Data
285,47.6134265,151.101.194.187,172.20.40.110,TCP,60,443  >  50060 [ACK] Seq=84017 Ack=168814 Win=1823 Len=0
286,47.6206395,151.101.194.187,172.20.40.110,TCP,60,443  >  50060 [ACK] Seq=84017 Ack=171632 Win=1834 Len=0
287,47.6219181,151.101.194.187,172.20.40.110,TCP,60,443  >  50060 [ACK] Seq=84017 Ack=174444 Win=1845 Len=0
288,47.6219181,151.101.194.187,172.20.40.110,TCP,60,443  >  50060 [ACK] Seq=84017 Ack=177258 Win=1856 Len=0
289,47.6233185,151.101.194.187,172.20.40.110,TLSv1.2,154,"Application Data, Application Data"
290,47.6233936,172.20.40.110,151.101.194.187,TCP,54,50060  >  443 [ACK] Seq=182880 Ack=84117 Win=253 Len=0
291,47.6246447,151.101.194.187,172.20.40.110,TLSv1.2,98,Application Data
292,47.6247193,172.20.40.110,151.101.194.187,TCP,54,50060  >  443 [ACK] Seq=182880 Ack=84161 Win=258 Len=0
293,47.6271234,151.101.194.187,172.20.40.110,TCP,60,443  >  50060 [ACK] Seq=84161 Ack=180070 Win=1867 Len=0
294,47.6271234,151.101.194.187,172.20.40.110,TCP,60,443  >  50060 [ACK] Seq=84161 Ack=182880 Win=1878 Len=0
295,47.6306074,151.101.194.187,172.20.40.110,TLSv1.2,104,Application Data
296,47.6306879,172.20.40.110,151.101.194.187,TCP,54,50060  >  443 [ACK] Seq=182880 Ack=84211 Win=258 Len=0
297,47.6329587,151.101.194.187,172.20.40.110,TLSv1.2,148,Application Data
298,47.6814446,172.20.40.110,151.101.194.187,TCP,54,50060  >  443 [ACK] Seq=182880 Ack=84305 Win=258 Len=0
299,47.7140666,172.20.40.110,151.101.194.187,TLSv1.2,2866,Application Data
300,47.7235022,151.101.194.187,172.20.40.110,TCP,60,443  >  50060 [ACK] Seq=84305 Ack=185692 Win=1889 Len=0
301,47.7267449,151.101.194.187,172.20.40.110,TLSv1.2,98,Application Data
302,47.7366546,172.20.40.110,151.101.194.187,TLSv1.2,2866,Application Data
303,47.7449367,151.101.194.187,172.20.40.110,TCP,60,443  >  50060 [ACK] Seq=84349 Ack=188504 Win=1900 Len=0
304,47.7495228,151.101.194.187,172.20.40.110,TLSv1.2,109,Application Data
305,47.7961059,172.20.40.110,151.101.194.187,TCP,54,50060  >  443 [ACK] Seq=188504 Ack=84404 Win=257 Len=0
306,47.7970667,151.101.194.187,172.20.40.110,TLSv1.2,301,Application Data
307,47.8477926,172.20.40.110,151.101.194.187,TCP,54,50060  >  443 [ACK] Seq=188504 Ack=84651 Win=256 Len=0
308,48.7093768,172.20.40.110,151.101.194.187,TLSv1.2,2845,Application Data
309,48.7107544,172.20.40.110,151.101.194.187,TLSv1.2,2847,Application Data
310,48.7218583,172.20.40.110,151.101.194.187,TLSv1.2,2845,Application Data
311,48.7221269,172.20.40.110,151.101.194.187,TLSv1.2,2843,Application Data
312,48.7224636,172.20.40.110,151.101.194.187,TLSv1.2,2851,Application Data
313,48.7244372,151.101.194.187,172.20.40.110,TCP,60,443  >  50060 [ACK] Seq=84651 Ack=191295 Win=1911 Len=0
314,48.7244372,151.101.194.187,172.20.40.110,TCP,60,443  >  50060 [ACK] Seq=84651 Ack=194088 Win=1922 Len=0
315,48.7286279,151.101.194.187,172.20.40.110,TLSv1.2,325,Application Data
316,48.7297159,151.101.194.187,172.20.40.110,TLSv1.2,130,Application Data
317,48.729796,172.20.40.110,151.101.194.187,TCP,54,50060  >  443 [ACK] Seq=202465 Ack=84998 Win=255 Len=0
318,48.7308368,151.101.194.187,172.20.40.110,TCP,60,443  >  50060 [ACK] Seq=84998 Ack=196879 Win=1933 Len=0
319,48.7353049,151.101.194.187,172.20.40.110,TLSv1.2,130,Application Data
320,48.7353049,151.101.194.187,172.20.40.110,TCP,60,443  >  50060 [ACK] Seq=85074 Ack=199668 Win=1944 Len=0
321,48.7353049,151.101.194.187,172.20.40.110,TCP,60,443  >  50060 [ACK] Seq=85074 Ack=202465 Win=1955 Len=0
322,48.7384273,151.101.194.187,172.20.40.110,TLSv1.2,130,Application Data
323,48.7384273,151.101.194.187,172.20.40.110,TLSv1.2,125,Application Data
324,48.7385086,172.20.40.110,151.101.194.187,TCP,54,50060  >  443 [ACK] Seq=202465 Ack=85221 Win=254 Len=0
325,48.8120909,172.20.40.110,151.101.194.187,TLSv1.2,2845,Application Data
326,48.8216139,151.101.194.187,172.20.40.110,TCP,60,443  >  50060 [ACK] Seq=85221 Ack=205256 Win=1966 Len=0
327,48.827463,151.101.194.187,172.20.40.110,TLSv1.2,124,Application Data
328,48.8805162,172.20.40.110,151.101.194.187,TCP,54,50060  >  443 [ACK] Seq=205256 Ack=85291 Win=254 Len=0
329,49.7314252,172.20.40.110,151.101.194.187,TLSv1.2,2849,Application Data
330,49.7389066,172.20.40.110,151.101.194.187,TLSv1.2,2845,Application Data
331,49.7443684,151.101.194.187,172.20.40.110,TCP,60,443  >  50060 [ACK] Seq=85291 Ack=208051 Win=1977 Len=0
332,49.7486481,151.101.194.187,172.20.40.110,TLSv1.2,240,Application Data
333,49.7512644,151.101.194.187,172.20.40.110,TCP,60,443  >  50060 [ACK] Seq=85477 Ack=210842 Win=1987 Len=0
334,49.7544693,151.101.194.187,172.20.40.110,TLSv1.2,131,Application Data
335,49.754584,172.20.40.110,151.101.194.187,TCP,54,50060  >  443 [ACK] Seq=210842 Ack=85554 Win=258 Len=0
336,50.3451203,172.20.40.110,151.101.194.187,TLSv1.2,2853,Application Data
337,50.3470385,172.20.40.110,151.101.194.187,TLSv1.2,2855,Application Data
338,50.3476942,172.20.40.110,151.101.194.187,TLSv1.2,2849,Application Data
339,50.3506204,172.20.40.110,151.101.194.187,TLSv1.2,2851,Application Data
340,50.3558844,172.20.40.110,151.101.194.187,TLSv1.2,2849,Application Data
341,50.3562601,172.20.40.110,151.101.194.187,TLSv1.2,2847,Application Data
342,50.358527,151.101.194.187,172.20.40.110,TCP,60,443  >  50060 [ACK] Seq=85554 Ack=213641 Win=1999 Len=0
343,50.358527,151.101.194.187,172.20.40.110,TCP,60,443  >  50060 [ACK] Seq=85554 Ack=216442 Win=2010 Len=0
344,50.3585455,172.20.40.110,151.101.194.187,TLSv1.2,2849,Application Data
345,50.3633629,151.101.194.187,172.20.40.110,TCP,60,443  >  50060 [ACK] Seq=85554 Ack=219237 Win=2021 Len=0
346,50.3633629,151.101.194.187,172.20.40.110,TCP,60,443  >  50060 [ACK] Seq=85554 Ack=222034 Win=2032 Len=0
347,50.3652315,151.101.194.187,172.20.40.110,TCP,60,443  >  50060 [ACK] Seq=85554 Ack=224829 Win=2042 Len=0
348,50.3674401,151.101.194.187,172.20.40.110,TCP,60,443  >  50060 [ACK] Seq=85554 Ack=227622 Win=2053 Len=0
349,50.3688204,151.101.194.187,172.20.40.110,TLSv1.2,341,Application Data
350,50.369681,151.101.194.187,172.20.40.110,TCP,60,443  >  50060 [ACK] Seq=85841 Ack=230417 Win=2064 Len=0
351,50.3728315,151.101.194.187,172.20.40.110,TLSv1.2,210,Application Data
352,50.3759789,151.101.194.187,172.20.40.110,TLSv1.2,98,Application Data
353,50.3793615,172.20.40.110,151.101.194.187,TCP,54,50060  >  443 [ACK] Seq=230417 Ack=86041 Win=256 Len=0
354,50.4080064,172.20.40.110,151.101.194.187,TLSv1.2,2849,Application Data
355,50.4173693,151.101.194.187,172.20.40.110,TCP,60,443  >  50060 [ACK] Seq=86041 Ack=233212 Win=2075 Len=0
356,50.4217058,151.101.194.187,172.20.40.110,TLSv1.2,98,Application Data
357,50.4666871,172.20.40.110,151.101.194.187,TCP,54,50060  >  443 [ACK] Seq=233212 Ack=86085 Win=256 Len=0
358,53.3799732,172.20.40.110,151.101.194.187,TLSv1.2,2853,Application Data
359,53.3893476,151.101.194.187,172.20.40.110,TCP,60,443  >  50060 [ACK] Seq=86085 Ack=236011 Win=2086 Len=0
360,53.3930859,151.101.194.187,172.20.40.110,TLSv1.2,323,Application Data
361,53.3933101,172.20.40.110,151.101.194.187,TLSv1.2,2854,Application Data
362,53.3945004,172.20.40.110,151.101.194.187,TLSv1.2,2853,Application Data
363,53.3965643,172.20.40.110,151.101.194.187,TLSv1.2,2847,Application Data
364,53.4024262,172.20.40.110,151.101.194.187,TLSv1.2,2847,Application Data
365,53.4028235,172.20.40.110,151.101.194.187,TLSv1.2,2847,Application Data
366,53.4044917,172.20.40.110,151.101.194.187,TLSv1.2,2850,Application Data
367,53.4052392,172.20.40.110,151.101.194.187,TLSv1.2,2847,Application Data
368,53.4087192,172.20.40.110,151.101.194.187,TLSv1.2,2853,Application Data
369,53.4097106,172.20.40.110,151.101.194.187,TLSv1.2,2844,Application Data
370,53.4159948,172.20.40.110,151.101.194.187,TLSv1.2,2846,Application Data
371,53.4175832,172.20.40.110,151.101.194.187,TCP,1434,"[TCP Retransmission] 50060  >  443 [PSH, ACK] Seq=262579 Ack=86354 Win=255 Len=1380"
372,53.4182201,151.101.194.187,172.20.40.110,TCP,60,443  >  50060 [ACK] Seq=86354 Ack=238811 Win=2097 Len=0
373,53.4182201,151.101.194.187,172.20.40.110,TCP,60,443  >  50060 [ACK] Seq=86354 Ack=241610 Win=2108 Len=0
374,53.4182201,151.101.194.187,172.20.40.110,TCP,60,443  >  50060 [ACK] Seq=86354 Ack=244403 Win=2119 Len=0
375,53.4182201,151.101.194.187,172.20.40.110,TLSv1.2,125,Application Data
376,53.4201825,151.101.194.187,172.20.40.110,TLSv1.2,208,"Application Data, Application Data"
377,53.4201825,151.101.194.187,172.20.40.110,TCP,60,443  >  50060 [ACK] Seq=86579 Ack=247196 Win=2130 Len=0
378,53.4201825,151.101.194.187,172.20.40.110,TCP,60,443  >  50060 [ACK] Seq=86579 Ack=249989 Win=2141 Len=0
379,53.4201825,151.101.194.187,172.20.40.110,TLSv1.2,130,Application Data
380,53.4201825,151.101.194.187,172.20.40.110,TLSv1.2,124,Application Data
381,53.4201825,151.101.194.187,172.20.40.110,TCP,60,443  >  50060 [ACK] Seq=86725 Ack=252785 Win=2152 Len=0
382,53.4201825,151.101.194.187,172.20.40.110,TCP,60,443  >  50060 [ACK] Seq=86725 Ack=255578 Win=2163 Len=0
383,53.4203661,172.20.40.110,151.101.194.187,TCP,54,50060  >  443 [ACK] Seq=263959 Ack=86725 Win=254 Len=0
384,53.4230907,151.101.194.187,172.20.40.110,TLSv1.2,129,Application Data
385,53.4231683,172.20.40.110,151.101.194.187,TCP,54,50060  >  443 [ACK] Seq=263959 Ack=86800 Win=253 Len=0
386,53.4275423,151.101.194.187,172.20.40.110,TLSv1.2,124,Application Data
387,53.4275423,151.101.194.187,172.20.40.110,TCP,60,443  >  50060 [ACK] Seq=86870 Ack=258377 Win=2173 Len=0
388,53.4275423,151.101.194.187,172.20.40.110,TLSv1.2,125,Application Data
389,53.4276377,172.20.40.110,151.101.194.187,TCP,54,50060  >  443 [ACK] Seq=263959 Ack=86941 Win=258 Len=0
390,53.4296443,151.101.194.187,172.20.40.110,TCP,60,443  >  50060 [ACK] Seq=86941 Ack=261167 Win=2184 Len=0
391,53.431851,151.101.194.187,172.20.40.110,TLSv1.2,130,Application Data
392,53.4330247,151.101.194.187,172.20.40.110,TCP,60,443  >  50060 [ACK] Seq=87017 Ack=263959 Win=2195 Len=0
393,53.4330247,151.101.194.187,172.20.40.110,TCP,66,[TCP Dup ACK 392#1] 443  >  50060 [ACK] Seq=87017 Ack=263959 Win=2195 Len=0 SLE=262579 SRE=263959
394,53.4363786,151.101.194.187,172.20.40.110,TLSv1.2,169,Application Data
395,53.4365992,172.20.40.110,151.101.194.187,TCP,54,50060  >  443 [ACK] Seq=263959 Ack=87132 Win=258 Len=0
396,55.5543185,172.20.40.110,151.101.194.187,TLSv1.2,2677,Application Data
397,55.5630877,151.101.194.187,172.20.40.110,TCP,60,443  >  50060 [ACK] Seq=87132 Ack=266582 Win=2206 Len=0
398,55.672164,151.101.194.187,172.20.40.110,TLSv1.2,422,Application Data
399,55.672164,151.101.194.187,172.20.40.110,TLSv1.2,357,Application Data
400,55.6722873,172.20.40.110,151.101.194.187,TCP,54,50060  >  443 [ACK] Seq=266582 Ack=87803 Win=255 Len=0
401,55.6746326,172.20.40.110,151.101.194.187,TLSv1.2,89,Application Data
402,55.681822,151.101.194.187,172.20.40.110,TCP,60,443  >  50060 [ACK] Seq=87803 Ack=266617 Win=2206 Len=0
403,56.0783292,172.20.40.110,151.101.194.187,TLSv1.2,2862,Application Data
404,56.0871063,151.101.194.187,172.20.40.110,TCP,60,443  >  50060 [ACK] Seq=87803 Ack=269425 Win=2216 Len=0
405,56.7407222,151.101.194.187,172.20.40.110,TLSv1.2,370,Application Data
406,56.7407222,151.101.194.187,172.20.40.110,TCP,4194,"443  >  50060 [PSH, ACK] Seq=88119 Ack=269425 Win=2216 Len=4140 [TCP PDU reassembled in 409]"
407,56.7408183,172.20.40.110,151.101.194.187,TCP,54,50060  >  443 [ACK] Seq=269425 Ack=92259 Win=258 Len=0
408,56.7514252,151.101.194.187,172.20.40.110,TCP,1434,443  >  50060 [ACK] Seq=92259 Ack=269425 Win=2216 Len=1380 [TCP PDU reassembled in 409]
409,56.7514252,151.101.194.187,172.20.40.110,TLSv1.2,1135,Application Data
410,56.7514252,151.101.194.187,172.20.40.110,TCP,4194,"443  >  50060 [PSH, ACK] Seq=94720 Ack=269425 Win=2216 Len=4140 [TCP PDU reassembled in 414]"
411,56.7515206,172.20.40.110,151.101.194.187,TCP,54,50060  >  443 [ACK] Seq=269425 Ack=98860 Win=258 Len=0
412,56.754364,151.101.194.187,172.20.40.110,TCP,6954,"443  >  50060 [PSH, ACK] Seq=98860 Ack=269425 Win=2216 Len=6900 [TCP PDU reassembled in 414]"
413,56.7544737,172.20.40.110,151.101.194.187,TCP,54,50060  >  443 [ACK] Seq=269425 Ack=105760 Win=258 Len=0
414,56.7565847,151.101.194.187,172.20.40.110,TLSv1.2,5574,Application Data
415,56.7566796,172.20.40.110,151.101.194.187,TCP,54,50060  >  443 [ACK] Seq=269425 Ack=111280 Win=258 Len=0
416,56.7593716,151.101.194.187,172.20.40.110,TCP,8334,"443  >  50060 [PSH, ACK] Seq=111280 Ack=269425 Win=2216 Len=8280 [TCP PDU reassembled in 418]"
417,56.7594511,172.20.40.110,151.101.194.187,TCP,54,50060  >  443 [ACK] Seq=269425 Ack=119560 Win=258 Len=0
418,56.7621165,151.101.194.187,172.20.40.110,TLSv1.2,8334,Application Data
419,56.7622132,172.20.40.110,151.101.194.187,TCP,54,50060  >  443 [ACK] Seq=269425 Ack=127840 Win=258 Len=0
420,56.7650178,151.101.194.187,172.20.40.110,TCP,6954,"443  >  50060 [PSH, ACK] Seq=127840 Ack=269425 Win=2216 Len=6900 [TCP PDU reassembled in 421]"
421,56.7650178,151.101.194.187,172.20.40.110,TLSv1.2,1167,Application Data
422,56.7650178,151.101.194.187,172.20.40.110,TLSv1.2,85,Application Data
423,56.7651064,172.20.40.110,151.101.194.187,TCP,54,50060  >  443 [ACK] Seq=269425 Ack=135884 Win=258 Len=0
424,56.9196737,172.20.40.110,151.101.194.187,TLSv1.2,2858,Application Data
425,56.9206421,172.20.40.110,151.101.194.187,TLSv1.2,2860,Application Data
426,56.9208542,172.20.40.110,151.101.194.187,TLSv1.2,2858,Application Data
427,56.9210928,172.20.40.110,151.101.194.187,TLSv1.2,2856,Application Data
428,56.9231766,172.20.40.110,151.101.194.187,TLSv1.2,2864,Application Data
429,56.9325845,151.101.194.187,172.20.40.110,TCP,60,443  >  50060 [ACK] Seq=135884 Ack=272229 Win=2227 Len=0
430,56.934737,151.101.194.187,172.20.40.110,TLSv1.2,193,Application Data
431,56.934737,151.101.194.187,172.20.40.110,TCP,60,443  >  50060 [ACK] Seq=136023 Ack=275035 Win=2238 Len=0
432,56.934737,151.101.194.187,172.20.40.110,TCP,60,443  >  50060 [ACK] Seq=136023 Ack=277839 Win=2249 Len=0
433,56.934737,151.101.194.187,172.20.40.110,TCP,60,443  >  50060 [ACK] Seq=136023 Ack=280641 Win=2260 Len=0
434,56.9374065,151.101.194.187,172.20.40.110,TCP,60,443  >  50060 [ACK] Seq=136023 Ack=283451 Win=2271 Len=0
435,56.9374065,151.101.194.187,172.20.40.110,TLSv1.2,130,Application Data
436,56.9374995,172.20.40.110,151.101.194.187,TCP,54,50060  >  443 [ACK] Seq=283451 Ack=136099 Win=257 Len=0
437,56.9387191,151.101.194.187,172.20.40.110,TLSv1.2,206,"Application Data, Application Data"
438,56.9387872,172.20.40.110,151.101.194.187,TCP,54,50060  >  443 [ACK] Seq=283451 Ack=136251 Win=257 Len=0
439,56.943162,151.101.194.187,172.20.40.110,TLSv1.2,125,Application Data
440,56.9697526,172.20.40.110,151.101.194.187,TLSv1.2,2875,Application Data
441,56.9700111,172.20.40.110,151.101.194.187,TLSv1.2,2858,Application Data
442,56.9789525,151.101.194.187,172.20.40.110,TCP,60,443  >  50060 [ACK] Seq=136322 Ack=286272 Win=2282 Len=0
443,56.9811108,151.101.194.187,172.20.40.110,TCP,60,443  >  50060 [ACK] Seq=136322 Ack=289076 Win=2293 Len=0
444,56.9833282,151.101.194.187,172.20.40.110,TLSv1.2,285,Application Data
445,56.98441,151.101.194.187,172.20.40.110,TLSv1.2,124,Application Data
446,56.9844881,172.20.40.110,151.101.194.187,TCP,54,50060  >  443 [ACK] Seq=289076 Ack=136623 Win=255 Len=0
447,58.6279398,172.20.40.110,151.101.194.187,TLSv1.2,2862,Application Data
448,58.6281863,172.20.40.110,151.101.194.187,TLSv1.2,2858,Application Data
449,58.6431875,151.101.194.187,172.20.40.110,TCP,60,443  >  50060 [ACK] Seq=136623 Ack=291884 Win=2304 Len=0
450,58.6431875,151.101.194.187,172.20.40.110,TCP,60,443  >  50060 [ACK] Seq=136623 Ack=294688 Win=2315 Len=0
451,58.6479223,151.101.194.187,172.20.40.110,TLSv1.2,324,Application Data
452,58.6479223,151.101.194.187,172.20.40.110,TLSv1.2,130,Application Data
453,58.6480099,172.20.40.110,151.101.194.187,TCP,54,50060  >  443 [ACK] Seq=294688 Ack=136969 Win=254 Len=0
