"No.","Time","Source","Destination","Protocol","Length","Info"
"1","0.000000000","172.20.40.110","151.101.130.187","TLSv1.2","2876","Application Data"
"2","0.000208100","172.20.40.110","151.101.130.187","TLSv1.2","93","Application Data"
"3","0.004845100","172.20.40.110","151.101.130.187","TLSv1.2","2869","Application Data"
"4","0.011873600","151.101.130.187","172.20.40.110","TCP","60","443  >  62995 [ACK] Seq=1 Ack=2823 Win=6457 Len=0"
"5","0.011873600","151.101.130.187","172.20.40.110","TCP","60","443  >  62995 [ACK] Seq=1 Ack=2862 Win=6457 Len=0"
"6","0.011873600","151.101.130.187","172.20.40.110","TLSv1.2","93","Application Data"
"7","0.015167600","151.101.130.187","172.20.40.110","TLSv1.2","374","Application Data"
"8","0.015167600","151.101.130.187","172.20.40.110","TCP","60","443  >  62995 [ACK] Seq=360 Ack=5677 Win=6457 Len=0"
"9","0.015291000","172.20.40.110","151.101.130.187","TCP","54","62995  >  443 [ACK] Seq=5677 Ack=360 Win=506 Len=0"
"10","0.018716000","151.101.130.187","172.20.40.110","TLSv1.2","131","Application Data"
"11","0.052549200","151.101.130.187","172.20.40.110","TCP","131","[TCP Retransmission] 443  >  62995 [PSH, ACK] Seq=360 Ack=5677 Win=6457 Len=77"
"12","0.052648500","172.20.40.110","151.101.130.187","TCP","66","62995  >  443 [ACK] Seq=5677 Ack=437 Win=512 Len=0 SLE=360 SRE=437"
"13","0.351805400","172.20.40.110","151.101.130.187","TLSv1.2","2874","Application Data"
"14","0.352125600","172.20.40.110","151.101.130.187","TLSv1.2","2871","Application Data"
"15","0.361686600","151.101.130.187","172.20.40.110","TCP","60","443  >  62995 [ACK] Seq=437 Ack=8497 Win=6457 Len=0"
"16","0.362901500","151.101.130.187","172.20.40.110","TCP","60","443  >  62995 [ACK] Seq=437 Ack=11314 Win=6457 Len=0"
"17","0.365966100","151.101.130.187","172.20.40.110","TLSv1.2","240","Application Data"
"18","0.365966100","151.101.130.187","172.20.40.110","TLSv1.2","130","Application Data"
"19","0.366076000","172.20.40.110","151.101.130.187","TCP","54","62995  >  443 [ACK] Seq=11314 Ack=699 Win=511 Len=0"
"20","7.107671200","172.20.40.110","151.101.130.187","TLSv1.2","2783","Application Data"
"21","7.120637300","151.101.130.187","172.20.40.110","TCP","60","443  >  62995 [ACK] Seq=699 Ack=14043 Win=6468 Len=0"
"22","7.124593400","151.101.130.187","172.20.40.110","TLSv1.2","214","Application Data"
"23","7.152801500","151.101.130.187","172.20.40.110","TCP","214","[TCP Retransmission] 443  >  62995 [PSH, ACK] Seq=699 Ack=14043 Win=6468 Len=160"
"24","7.152857000","172.20.40.110","151.101.130.187","TCP","66","62995  >  443 [ACK] Seq=14043 Ack=859 Win=510 Len=0 SLE=699 SRE=859"
"25","7.264685200","172.20.40.110","151.101.130.187","TLSv1.2","2782","Application Data"
"26","7.265894100","172.20.40.110","151.101.130.187","TLSv1.2","2783","Application Data"
"27","7.280503500","151.101.130.187","172.20.40.110","TCP","60","443  >  62995 [ACK] Seq=859 Ack=16771 Win=6478 Len=0"
"28","7.280503500","151.101.130.187","172.20.40.110","TCP","60","443  >  62995 [ACK] Seq=859 Ack=19500 Win=6489 Len=0"
"29","7.284317900","151.101.130.187","172.20.40.110","TLSv1.2","208","Application Data"
"30","7.286745200","172.20.40.110","151.101.130.187","TLSv1.2","2768","Application Data"
"31","7.291341100","151.101.130.187","172.20.40.110","TLSv1.2","125","Application Data"
"32","7.297992400","151.101.130.187","172.20.40.110","TCP","60","443  >  62995 [ACK] Seq=1084 Ack=22214 Win=6500 Len=0"
"33","7.301154500","151.101.130.187","172.20.40.110","TLSv1.2","130","Application Data"
"34","7.301232900","172.20.40.110","151.101.130.187","TCP","54","62995  >  443 [ACK] Seq=22214 Ack=1160 Win=509 Len=0"
"35","8.132595800","172.20.40.110","151.101.130.187","TLSv1.2","2780","Application Data"
"36","8.141519600","151.101.130.187","172.20.40.110","TCP","60","443  >  62995 [ACK] Seq=1160 Ack=24940 Win=6510 Len=0"
"37","8.145992600","151.101.130.187","172.20.40.110","TLSv1.2","235","Application Data"
"38","8.177395100","151.101.130.187","172.20.40.110","TCP","235","[TCP Retransmission] 443  >  62995 [PSH, ACK] Seq=1160 Ack=24940 Win=6510 Len=181"
"39","8.177499100","172.20.40.110","151.101.130.187","TCP","66","62995  >  443 [ACK] Seq=24940 Ack=1341 Win=508 Len=0 SLE=1160 SRE=1341"
"40","8.895135500","172.20.40.110","151.101.130.187","TLSv1.2","2780","Application Data"
"41","8.905634900","151.101.130.187","172.20.40.110","TCP","60","443  >  62995 [ACK] Seq=1341 Ack=27666 Win=6521 Len=0"
"42","8.907767600","151.101.130.187","172.20.40.110","TLSv1.2","214","Application Data"
"43","8.939940100","151.101.130.187","172.20.40.110","TCP","214","[TCP Retransmission] 443  >  62995 [PSH, ACK] Seq=1341 Ack=27666 Win=6521 Len=160"
"44","8.940002700","172.20.40.110","151.101.130.187","TCP","66","62995  >  443 [ACK] Seq=27666 Ack=1501 Win=507 Len=0 SLE=1341 SRE=1501"
"45","9.520349400","172.20.40.110","151.101.130.187","TLSv1.2","2781","Application Data"
"46","9.534904500","151.101.130.187","172.20.40.110","TCP","60","443  >  62995 [ACK] Seq=1501 Ack=30393 Win=6532 Len=0"
"47","9.544993700","151.101.130.187","172.20.40.110","TLSv1.2","373","Application Data"
"48","9.575300100","151.101.130.187","172.20.40.110","TCP","373","[TCP Retransmission] 443  >  62995 [PSH, ACK] Seq=1501 Ack=30393 Win=6532 Len=319"
"49","9.575458900","172.20.40.110","151.101.130.187","TCP","66","62995  >  443 [ACK] Seq=30393 Ack=1820 Win=512 Len=0 SLE=1501 SRE=1820"
"50","10.472144800","172.20.40.110","151.101.130.187","TLSv1.2","2782","Application Data"
"51","10.486199100","172.20.40.110","151.101.130.187","TLSv1.2","2783","Application Data"
"52","10.504331500","172.20.40.110","151.101.130.187","TCP","1434","[TCP Retransmission] 62995  >  443 [PSH, ACK] Seq=34470 Ack=1820 Win=512 Len=1380"
"53","10.511371200","172.20.40.110","151.101.130.187","TLSv1.2","2766","Application Data"
"54","10.525892200","151.101.130.187","172.20.40.110","TCP","60","443  >  62995 [ACK] Seq=1820 Ack=33121 Win=6542 Len=0"
"55","10.525892200","151.101.130.187","172.20.40.110","TLSv1.2","214","Application Data"
"56","10.525892200","151.101.130.187","172.20.40.110","TCP","214","[TCP Retransmission] 443  >  62995 [PSH, ACK] Seq=1820 Ack=33121 Win=6542 Len=160"
"57","10.525972800","172.20.40.110","151.101.130.187","TCP","66","62995  >  443 [ACK] Seq=38562 Ack=1980 Win=511 Len=0 SLE=1820 SRE=1980"
"58","10.528657700","151.101.130.187","172.20.40.110","TCP","60","443  >  62995 [ACK] Seq=1980 Ack=35850 Win=6553 Len=0"
"59","10.528657700","151.101.130.187","172.20.40.110","TCP","66","[TCP Dup ACK 58#1] 443  >  62995 [ACK] Seq=1980 Ack=35850 Win=6553 Len=0 SLE=34470 SRE=35850"
"60","10.528657700","151.101.130.187","172.20.40.110","TCP","60","443  >  62995 [ACK] Seq=1980 Ack=37230 Win=6559 Len=0"
"61","10.528657700","151.101.130.187","172.20.40.110","TCP","60","443  >  62995 [ACK] Seq=1980 Ack=38562 Win=6559 Len=0"
"62","10.531485300","151.101.130.187","172.20.40.110","TLSv1.2","131","Application Data"
"63","10.531566900","172.20.40.110","151.101.130.187","TCP","54","62995  >  443 [ACK] Seq=38562 Ack=2057 Win=511 Len=0"
"64","10.535917700","151.101.130.187","172.20.40.110","TLSv1.2","104","Application Data"
"65","10.569456800","151.101.130.187","172.20.40.110","TCP","104","[TCP Retransmission] 443  >  62995 [PSH, ACK] Seq=2057 Ack=38562 Win=6559 Len=50"
"66","10.569511100","172.20.40.110","151.101.130.187","TCP","66","62995  >  443 [ACK] Seq=38562 Ack=2107 Win=510 Len=0 SLE=2057 SRE=2107"
"67","10.600067000","172.20.40.110","151.101.130.187","TLSv1.2","2771","Application Data"
"68","10.600294000","172.20.40.110","151.101.130.187","TLSv1.2","2768","Application Data"
"69","10.610271800","151.101.130.187","172.20.40.110","TCP","60","443  >  62995 [ACK] Seq=2107 Ack=41279 Win=6569 Len=0"
"70","10.611450600","151.101.130.187","172.20.40.110","TCP","60","443  >  62995 [ACK] Seq=2107 Ack=43993 Win=6580 Len=0"
"71","10.615011600","151.101.130.187","172.20.40.110","TLSv1.2","130","Application Data"
"72","10.617732500","151.101.130.187","172.20.40.110","TLSv1.2","130","Application Data"
"73","10.617806500","172.20.40.110","151.101.130.187","TCP","54","62995  >  443 [ACK] Seq=43993 Ack=2259 Win=510 Len=0"
"74","10.712075000","172.20.40.110","151.101.130.187","TLSv1.2","2826","Application Data"
"75","10.712394500","172.20.40.110","151.101.130.187","TLSv1.2","2817","Application Data"
"76","10.723215100","151.101.130.187","172.20.40.110","TCP","60","443  >  62995 [ACK] Seq=2259 Ack=46765 Win=6580 Len=0"
"77","10.725312500","151.101.130.187","172.20.40.110","TCP","60","443  >  62995 [ACK] Seq=2259 Ack=49525 Win=6591 Len=0"
"78","10.725312500","151.101.130.187","172.20.40.110","TCP","60","443  >  62995 [ACK] Seq=2259 Ack=49528 Win=6591 Len=0"
"79","10.727633900","151.101.130.187","172.20.40.110","TLSv1.2","207","Application Data"
"80","10.728679600","151.101.130.187","172.20.40.110","TLSv1.2","130","Application Data"
"81","10.728751000","172.20.40.110","151.101.130.187","TCP","54","62995  >  443 [ACK] Seq=49528 Ack=2488 Win=509 Len=0"
"82","11.005858400","172.20.40.110","151.101.2.187","TCP","55","54874  >  443 [ACK] Seq=1 Ack=1 Win=256 Len=1"
"83","11.015598000","151.101.2.187","172.20.40.110","TCP","66","443  >  54874 [ACK] Seq=1 Ack=2 Win=282 Len=0 SLE=1 SRE=2"
"84","11.155568500","172.20.40.110","151.101.130.187","TLSv1.2","2770","Application Data"
"85","11.163906600","172.20.40.110","151.101.130.187","TLSv1.2","2768","Application Data"
"86","11.168005600","151.101.130.187","172.20.40.110","TCP","60","443  >  62995 [ACK] Seq=2488 Ack=52244 Win=6601 Len=0"
"87","11.203838800","172.20.40.110","151.101.130.187","TCP","1434","[TCP Retransmission] 62995  >  443 [PSH, ACK] Seq=53578 Ack=2488 Win=509 Len=1380"
"88","11.218053800","151.101.130.187","172.20.40.110","TLSv1.2","131","Application Data"
"89","11.218053800","151.101.130.187","172.20.40.110","TCP","60","443  >  62995 [ACK] Seq=2565 Ack=54958 Win=6612 Len=0"
"90","11.218053800","151.101.130.187","172.20.40.110","TLSv1.2","125","Application Data"
"91","11.218053800","151.101.130.187","172.20.40.110","TCP","125","[TCP Retransmission] 443  >  62995 [PSH, ACK] Seq=2565 Ack=54958 Win=6612 Len=71"
"92","11.218140100","172.20.40.110","151.101.130.187","TCP","66","62995  >  443 [ACK] Seq=54958 Ack=2636 Win=508 Len=0 SLE=2565 SRE=2636"
"93","11.224165700","151.101.130.187","172.20.40.110","TCP","66","[TCP Dup ACK 89#1] 443  >  62995 [ACK] Seq=2636 Ack=54958 Win=6612 Len=0 SLE=53578 SRE=54958"
"94","12.083325100","172.20.40.110","151.101.130.187","TLSv1.2","2771","Application Data"
"95","12.094980400","151.101.130.187","172.20.40.110","TCP","60","443  >  62995 [ACK] Seq=2636 Ack=57675 Win=6622 Len=0"
"96","12.096048700","151.101.130.187","172.20.40.110","TLSv1.2","241","Application Data"
"97","12.126925900","151.101.130.187","172.20.40.110","TCP","241","[TCP Retransmission] 443  >  62995 [PSH, ACK] Seq=2636 Ack=57675 Win=6622 Len=187"
"98","12.127011800","172.20.40.110","151.101.130.187","TCP","66","62995  >  443 [ACK] Seq=57675 Ack=2823 Win=508 Len=0 SLE=2636 SRE=2823"
"99","12.898059100","172.20.40.110","151.101.130.187","TLSv1.2","2773","Application Data"
"100","12.906540100","151.101.130.187","172.20.40.110","TCP","60","443  >  62995 [ACK] Seq=2823 Ack=60394 Win=6633 Len=0"
"101","12.910813200","151.101.130.187","172.20.40.110","TLSv1.2","234","Application Data"
"102","12.939429000","151.101.130.187","172.20.40.110","TCP","234","[TCP Retransmission] 443  >  62995 [PSH, ACK] Seq=2823 Ack=60394 Win=6633 Len=180"
"103","12.939482800","172.20.40.110","151.101.130.187","TCP","66","62995  >  443 [ACK] Seq=60394 Ack=3003 Win=507 Len=0 SLE=2823 SRE=3003"
"104","17.071097300","172.20.40.110","151.101.2.187","TCP","54","54874  >  443 [FIN, ACK] Seq=2 Ack=1 Win=256 Len=0"
"105","17.080851200","151.101.2.187","172.20.40.110","TCP","60","443  >  54874 [ACK] Seq=1 Ack=3 Win=282 Len=0"
"106","17.080851200","151.101.2.187","172.20.40.110","TLSv1.2","78","Application Data"
"107","17.080851200","151.101.2.187","172.20.40.110","TCP","60","443  >  54874 [FIN, ACK] Seq=25 Ack=3 Win=282 Len=0"
"108","17.080976200","172.20.40.110","151.101.2.187","TCP","54","54874  >  443 [RST, ACK] Seq=3 Ack=25 Win=0 Len=0"
"109","17.086527700","172.20.40.110","151.101.66.187","TCP","54","56717  >  443 [FIN, ACK] Seq=1 Ack=1 Win=254 Len=0"
"110","17.099797700","151.101.66.187","172.20.40.110","TCP","60","443  >  56717 [ACK] Seq=1 Ack=2 Win=198 Len=0"
"111","17.099797700","151.101.66.187","172.20.40.110","TLSv1.2","78","Application Data"
"112","17.099797700","151.101.66.187","172.20.40.110","TCP","60","443  >  56717 [FIN, ACK] Seq=25 Ack=2 Win=198 Len=0"
"113","17.099913100","172.20.40.110","151.101.66.187","TCP","54","56717  >  443 [RST, ACK] Seq=2 Ack=25 Win=0 Len=0"
"114","18.338901000","172.20.40.110","151.101.130.187","TCP","1434","62995  >  443 [ACK] Seq=60394 Ack=3003 Win=507 Len=1380 [TCP PDU reassembled in 116]"
"115","18.363333600","151.101.130.187","172.20.40.110","TCP","60","443  >  62995 [ACK] Seq=3003 Ack=61774 Win=6639 Len=0"
"116","18.363503500","172.20.40.110","151.101.130.187","TLSv1.2","1325","Application Data"
"117","18.373762400","151.101.130.187","172.20.40.110","TCP","60","443  >  62995 [ACK] Seq=3003 Ack=63045 Win=6639 Len=0"
"118","18.377326400","151.101.130.187","172.20.40.110","TLSv1.2","416","Application Data"
"119","18.377326400","151.101.130.187","172.20.40.110","TLSv1.2","225","Application Data"
"120","18.377419500","172.20.40.110","151.101.130.187","TCP","54","62995  >  443 [ACK] Seq=63045 Ack=3536 Win=512 Len=0"
"121","18.378026000","172.20.40.110","151.101.130.187","TCP","54","62995  >  443 [FIN, ACK] Seq=63045 Ack=3536 Win=512 Len=0"
"122","18.386702000","151.101.130.187","172.20.40.110","TCP","60","443  >  62995 [ACK] Seq=3536 Ack=63046 Win=6639 Len=0"
"123","18.386702000","151.101.130.187","172.20.40.110","TLSv1.2","78","Application Data"
"124","18.386702000","151.101.130.187","172.20.40.110","TCP","60","443  >  62995 [FIN, ACK] Seq=3560 Ack=63046 Win=6639 Len=0"
"125","18.386794800","172.20.40.110","151.101.130.187","TCP","54","62995  >  443 [RST, ACK] Seq=63046 Ack=3560 Win=0 Len=0"
"126","19.461503400","172.20.40.110","151.101.2.187","TCP","66","51526  >  443 [SYN] Seq=0 Win=64240 Len=0 MSS=1460 WS=256 SACK_PERM"
"127","19.469317700","151.101.2.187","172.20.40.110","TCP","66","443  >  51526 [SYN, ACK] Seq=0 Ack=1 Win=65535 Len=0 MSS=1380 SACK_PERM WS=512"
"128","19.469425400","172.20.40.110","151.101.2.187","TCP","54","51526  >  443 [ACK] Seq=1 Ack=1 Win=131072 Len=0"
"129","19.470258100","172.20.40.110","151.101.2.187","TLSv1.3","2065","Client Hello (SNI=www.target.com)"
"130","19.478978900","151.101.2.187","172.20.40.110","TCP","60","443  >  51526 [ACK] Seq=1 Ack=2012 Win=144384 Len=0"
"131","19.494484200","151.101.2.187","172.20.40.110","TLSv1.3","1434","Server Hello, Change Cipher Spec, Application Data, Application Data"
"132","19.494484200","151.101.2.187","172.20.40.110","TLSv1.3","215","Application Data"
"133","19.494558500","172.20.40.110","151.101.2.187","TCP","54","51526  >  443 [ACK] Seq=2012 Ack=1542 Win=131072 Len=0"
"134","19.501909200","172.20.40.110","151.101.2.187","TLSv1.3","118","Change Cipher Spec, Application Data"
"135","19.502202900","172.20.40.110","151.101.2.187","TLSv1.3","146","Application Data"
"136","19.502580400","172.20.40.110","151.101.2.187","TLSv1.3","2795","Application Data"
"137","19.510311600","151.101.2.187","172.20.40.110","TCP","60","443  >  51526 [ACK] Seq=1542 Ack=2076 Win=144384 Len=0"
"138","19.517776700","151.101.2.187","172.20.40.110","TCP","60","443  >  51526 [ACK] Seq=1542 Ack=2168 Win=144384 Len=0"
"139","19.517776700","151.101.2.187","172.20.40.110","TLSv1.3","119","Application Data"
"140","19.517776700","151.101.2.187","172.20.40.110","TCP","60","443  >  51526 [ACK] Seq=1607 Ack=4909 Win=141824 Len=0"
"141","19.518346000","172.20.40.110","151.101.2.187","TLSv1.3","85","Application Data"
"142","19.520411900","151.101.2.187","172.20.40.110","TLSv1.3","451","Application Data"
"143","19.526291300","151.101.2.187","172.20.40.110","TCP","60","443  >  51526 [ACK] Seq=2004 Ack=4940 Win=141824 Len=0"
"144","19.553199500","151.101.2.187","172.20.40.110","TCP","451","[TCP Retransmission] 443  >  51526 [PSH, ACK] Seq=1607 Ack=4940 Win=141824 Len=397"
"145","19.553257300","172.20.40.110","151.101.2.187","TCP","66","51526  >  443 [ACK] Seq=4940 Ack=2004 Win=130560 Len=0 SLE=1607 SRE=2004"
"146","19.626320800","172.20.40.110","151.101.2.187","TLSv1.3","2808","Application Data"
"147","19.636807100","151.101.2.187","172.20.40.110","TCP","60","443  >  51526 [ACK] Seq=2004 Ack=7694 Win=139264 Len=0"
"148","19.643091400","151.101.2.187","172.20.40.110","TLSv1.3","131","Application Data"
"149","19.665096400","172.20.40.110","151.101.2.187","TLSv1.3","2799","Application Data"
"150","19.667704600","151.101.2.187","172.20.40.110","TCP","131","[TCP Spurious Retransmission] 443  >  51526 [PSH, ACK] Seq=2004 Ack=7694 Win=139264 Len=77"
"151","19.667766600","172.20.40.110","151.101.2.187","TCP","66","[TCP Dup ACK 149#1] 51526  >  443 [ACK] Seq=10439 Ack=2081 Win=130560 Len=0 SLE=2004 SRE=2081"
"152","19.671039400","172.20.40.110","151.101.2.187","TLSv1.3","2793","Application Data"
"153","19.682558400","151.101.2.187","172.20.40.110","TCP","60","443  >  51526 [ACK] Seq=2081 Ack=10439 Win=136704 Len=0"
"154","19.684909700","151.101.2.187","172.20.40.110","TCP","60","443  >  51526 [ACK] Seq=2081 Ack=13178 Win=134144 Len=0"
"155","19.685007000","172.20.40.110","151.101.2.187","TLSv1.3","2793","Application Data"
"156","19.694036200","151.101.2.187","172.20.40.110","TLSv1.3","130","Application Data"
"157","19.694036200","151.101.2.187","172.20.40.110","TLSv1.3","131","Application Data"
"158","19.694107100","172.20.40.110","151.101.2.187","TCP","54","51526  >  443 [ACK] Seq=15917 Ack=2234 Win=130304 Len=0"
"159","19.701263600","151.101.2.187","172.20.40.110","TCP","60","443  >  51526 [ACK] Seq=2234 Ack=15917 Win=131584 Len=0"
"160","19.705835700","151.101.2.187","172.20.40.110","TLSv1.3","130","Application Data"
"161","19.729785100","151.101.2.187","172.20.40.110","TCP","130","[TCP Retransmission] 443  >  51526 [PSH, ACK] Seq=2234 Ack=15917 Win=131584 Len=76"
"162","19.729852300","172.20.40.110","151.101.2.187","TCP","66","51526  >  443 [ACK] Seq=15917 Ack=2310 Win=130304 Len=0 SLE=2234 SRE=2310"
"163","19.730108800","172.20.40.110","151.101.2.187","TLSv1.3","2793","Application Data"
"164","19.741995700","151.101.2.187","172.20.40.110","TCP","60","443  >  51526 [ACK] Seq=2310 Ack=18656 Win=129024 Len=0"
"165","19.745902500","172.20.40.110","151.101.2.187","TLSv1.3","2807","Application Data"
"166","19.758637400","151.101.2.187","172.20.40.110","TLSv1.3","130","Application Data"
"167","19.763378200","151.101.2.187","172.20.40.110","TCP","60","443  >  51526 [ACK] Seq=2386 Ack=21409 Win=126464 Len=0"
"168","19.770599400","151.101.2.187","172.20.40.110","TLSv1.3","125","Application Data"
"169","19.770687300","172.20.40.110","151.101.2.187","TCP","54","51526  >  443 [ACK] Seq=21409 Ack=2457 Win=130048 Len=0"
"170","19.857817900","172.20.40.110","151.101.2.187","TLSv1.3","2790","Application Data"
"171","19.868659600","151.101.2.187","172.20.40.110","TCP","60","443  >  51526 [ACK] Seq=2457 Ack=24145 Win=123904 Len=0"
"172","19.874233300","151.101.2.187","172.20.40.110","TLSv1.3","131","Application Data"
"173","19.886532900","172.20.40.110","151.101.2.187","TLSv1.3","2807","Application Data"
"174","19.897769600","151.101.2.187","172.20.40.110","TCP","60","443  >  51526 [ACK] Seq=2534 Ack=26898 Win=121344 Len=0"
"175","19.901263900","151.101.2.187","172.20.40.110","TLSv1.3","130","Application Data"
"176","19.934473200","151.101.2.187","172.20.40.110","TCP","130","[TCP Retransmission] 443  >  51526 [PSH, ACK] Seq=2534 Ack=26898 Win=121344 Len=76"
"177","19.934551200","172.20.40.110","151.101.2.187","TCP","66","51526  >  443 [ACK] Seq=26898 Ack=2610 Win=129792 Len=0 SLE=2534 SRE=2610"
"178","20.262634800","172.20.40.110","151.101.2.187","TLSv1.3","2790","Application Data"
"179","20.289630000","151.101.2.187","172.20.40.110","TCP","60","443  >  51526 [ACK] Seq=2610 Ack=29634 Win=118784 Len=0"
"180","20.289630000","151.101.2.187","172.20.40.110","TLSv1.3","130","Application Data"
"181","20.322632500","151.101.2.187","172.20.40.110","TCP","130","[TCP Retransmission] 443  >  51526 [PSH, ACK] Seq=2610 Ack=29634 Win=118784 Len=76"
"182","20.322688700","172.20.40.110","151.101.2.187","TCP","66","51526  >  443 [ACK] Seq=29634 Ack=2686 Win=129792 Len=0 SLE=2610 SRE=2686"
"183","20.340617700","172.20.40.110","151.101.2.187","TLSv1.3","2794","Application Data"
"184","20.341512500","172.20.40.110","151.101.2.187","TLSv1.3","2796","Application Data"
"185","20.342960400","172.20.40.110","151.101.2.187","TLSv1.3","2795","Application Data"
"186","20.353166100","151.101.2.187","172.20.40.110","TCP","60","443  >  51526 [ACK] Seq=2686 Ack=32374 Win=116224 Len=0"
"187","20.353166100","151.101.2.187","172.20.40.110","TCP","60","443  >  51526 [ACK] Seq=2686 Ack=35116 Win=113664 Len=0"
"188","20.357575700","151.101.2.187","172.20.40.110","TCP","60","443  >  51526 [ACK] Seq=2686 Ack=37857 Win=111104 Len=0"
"189","20.357575700","151.101.2.187","172.20.40.110","TLSv1.3","234","Application Data"
"190","20.357575700","151.101.2.187","172.20.40.110","TLSv1.3","131","Application Data"
"191","20.357575700","151.101.2.187","172.20.40.110","TLSv1.3","173","Application Data"
"192","20.357661900","172.20.40.110","151.101.2.187","TCP","54","51526  >  443 [ACK] Seq=37857 Ack=3062 Win=131072 Len=0"
"193","20.653738200","172.20.40.110","151.101.2.187","TLSv1.3","2819","Application Data"
"194","20.666488200","151.101.2.187","172.20.40.110","TCP","60","443  >  51526 [ACK] Seq=3062 Ack=40622 Win=108544 Len=0"
"195","20.674410300","151.101.2.187","172.20.40.110","TLSv1.3","291","Application Data"
"196","20.689728200","172.20.40.110","151.101.2.187","TLSv1.3","2816","Application Data"
"197","20.697008300","172.20.40.110","151.101.2.187","TLSv1.3","2864","Application Data"
"198","20.699094800","151.101.2.187","172.20.40.110","TCP","60","443  >  51526 [ACK] Seq=3299 Ack=43384 Win=105984 Len=0"
"199","20.704899200","151.101.2.187","172.20.40.110","TLSv1.3","130","Application Data"
"200","20.707908300","151.101.2.187","172.20.40.110","TCP","60","443  >  51526 [ACK] Seq=3375 Ack=46194 Win=103424 Len=0"
"201","20.714191400","151.101.2.187","172.20.40.110","TLSv1.3","129","Application Data"
"202","20.714316400","172.20.40.110","151.101.2.187","TCP","54","51526  >  443 [ACK] Seq=46194 Ack=3450 Win=130560 Len=0"
"203","24.249275700","172.20.40.110","151.101.2.187","TLSv1.3","2868","Application Data"
"204","24.263152700","172.20.40.110","151.101.2.187","TLSv1.3","2862","Application Data"
"205","24.277155700","172.20.40.110","151.101.2.187","TCP","1434","[TCP Retransmission] 51526  >  443 [PSH, ACK] Seq=50436 Ack=3450 Win=130560 Len=1380"
"206","24.583060300","172.20.40.110","151.101.2.187","TCP","1434","[TCP Retransmission] 51526  >  443 [ACK] Seq=46194 Ack=3450 Win=130560 Len=1380"
"207","25.187789000","172.20.40.110","151.101.2.187","TCP","1434","[TCP Retransmission] 51526  >  443 [ACK] Seq=46194 Ack=3450 Win=130560 Len=1380"
"208","26.388625100","172.20.40.110","151.101.2.187","TCP","590","[TCP Retransmission] 51526  >  443 [ACK] Seq=46194 Ack=3450 Win=130560 Len=536"
"209","27.592099800","172.20.40.110","151.101.2.187","TCP","590","[TCP Retransmission] 51526  >  443 [ACK] Seq=46194 Ack=3450 Win=130560 Len=536"
"210","31.216860600","172.20.40.110","151.101.2.187","TCP","1434","[TCP Retransmission] 51526  >  443 [ACK] Seq=46194 Ack=3450 Win=130560 Len=1380"
"211","31.247287600","151.101.2.187","172.20.40.110","TCP","60","443  >  51526 [ACK] Seq=3450 Ack=47574 Win=102912 Len=0"
"212","31.247403800","172.20.40.110","151.101.2.187","TLSv1.3","2814","[TCP Out-Of-Order] , Continuation Data"
"213","31.268239300","151.101.2.187","172.20.40.110","TCP","60","443  >  51526 [ACK] Seq=3450 Ack=50334 Win=100864 Len=0"
"214","31.268421800","172.20.40.110","151.101.2.187","TCP","1536","[TCP Retransmission] 51526  >  443 [PSH, ACK] Seq=50334 Ack=3450 Win=130560 Len=1482"
"215","31.279875400","151.101.2.187","172.20.40.110","TLSv1.3","240","Application Data"
"216","31.279875400","151.101.2.187","172.20.40.110","TCP","60","443  >  51526 [ACK] Seq=3636 Ack=51816 Win=101888 Len=0"
"217","31.289593500","151.101.2.187","172.20.40.110","TLSv1.3","130","Application Data"
"218","31.289731200","172.20.40.110","151.101.2.187","TCP","54","51526  >  443 [ACK] Seq=51816 Ack=3712 Win=130304 Len=0"
"219","31.995027900","172.20.40.110","151.101.2.187","TCP","54","51526  >  443 [FIN, ACK] Seq=51816 Ack=3712 Win=130304 Len=0"
"220","32.031749900","151.101.2.187","172.20.40.110","TCP","60","443  >  51526 [ACK] Seq=3712 Ack=51817 Win=102912 Len=0"
"221","32.031749900","151.101.2.187","172.20.40.110","TLSv1.3","78","Application Data"
"222","32.031749900","151.101.2.187","172.20.40.110","TCP","60","443  >  51526 [FIN, ACK] Seq=3736 Ack=51817 Win=102912 Len=0"
"223","32.032676000","172.20.40.110","151.101.2.187","TCP","54","51526  >  443 [RST, ACK] Seq=51817 Ack=3736 Win=0 Len=0"
"224","36.266633400","172.20.40.110","151.101.66.187","TCP","66","56337  >  443 [SYN] Seq=0 Win=64240 Len=0 MSS=1460 WS=256 SACK_PERM"
"225","36.275542300","151.101.66.187","172.20.40.110","TCP","66","443  >  56337 [SYN, ACK] Seq=0 Ack=1 Win=65535 Len=0 MSS=1380 SACK_PERM WS=512"
"226","36.276046300","172.20.40.110","151.101.66.187","TCP","54","56337  >  443 [ACK] Seq=1 Ack=1 Win=66048 Len=0"
"227","36.279222200","172.20.40.110","151.101.66.187","TLSv1.3","2097","Client Hello (SNI=www.target.com)"
"228","36.303822400","172.20.40.110","151.101.66.187","TCP","1434","[TCP Retransmission] 56337  >  443 [PSH, ACK] Seq=664 Ack=1 Win=66048 Len=1380"
"229","36.329926300","151.101.66.187","172.20.40.110","TCP","60","443  >  56337 [ACK] Seq=1 Ack=2044 Win=144384 Len=0"
"230","36.329926300","151.101.66.187","172.20.40.110","TLSv1.3","1434","Server Hello, Change Cipher Spec, Application Data, Application Data"
"231","36.329926300","151.101.66.187","172.20.40.110","TLSv1.3","215","Application Data"
"232","36.329926300","151.101.66.187","172.20.40.110","TCP","66","[TCP Dup ACK 229#1] 443  >  56337 [ACK] Seq=1542 Ack=2044 Win=144384 Len=0 SLE=664 SRE=2044"
"233","36.330467200","172.20.40.110","151.101.66.187","TCP","54","56337  >  443 [ACK] Seq=2044 Ack=1542 Win=66048 Len=0"
"234","36.331673700","172.20.40.110","151.101.66.187","TLSv1.3","118","Change Cipher Spec, Application Data"
"235","36.333362600","172.20.40.110","151.101.66.187","TLSv1.3","146","Application Data"
"236","36.334218900","172.20.40.110","151.101.66.187","TLSv1.3","2863","Application Data"
"237","36.334533400","172.20.40.110","151.101.66.187","TLSv1.3","2869","Application Data"
"238","36.344757000","151.101.66.187","172.20.40.110","TCP","60","443  >  56337 [ACK] Seq=1542 Ack=2108 Win=144384 Len=0"
"239","36.346343700","151.101.66.187","172.20.40.110","TCP","60","443  >  56337 [ACK] Seq=1542 Ack=2200 Win=144384 Len=0"
"240","36.346343700","151.101.66.187","172.20.40.110","TLSv1.3","119","Application Data"
"241","36.346343700","151.101.66.187","172.20.40.110","TCP","60","443  >  56337 [ACK] Seq=1607 Ack=5009 Win=141824 Len=0"
"242","36.350011200","172.20.40.110","151.101.66.187","TLSv1.3","85","Application Data"
"243","36.367804100","151.101.66.187","172.20.40.110","TLSv1.3","451","Application Data"
"244","36.367804100","151.101.66.187","172.20.40.110","TCP","60","443  >  56337 [ACK] Seq=2004 Ack=7824 Win=139264 Len=0"
"245","36.373268700","151.101.66.187","172.20.40.110","TLSv1.3","130","Application Data"
"246","36.373268700","151.101.66.187","172.20.40.110","TCP","60","443  >  56337 [ACK] Seq=2080 Ack=7855 Win=139264 Len=0"
"247","36.373476400","172.20.40.110","151.101.66.187","TCP","54","56337  >  443 [ACK] Seq=7855 Ack=2080 Win=65536 Len=0"
"248","39.104937500","172.20.40.110","151.101.66.187","TLSv1.3","2869","Application Data"
"249","39.124718800","172.20.40.110","151.101.66.187","TLSv1.3","2863","Application Data"
"250","39.128159200","172.20.40.110","151.101.66.187","TLSv1.3","2863","Application Data"
"251","39.138334900","172.20.40.110","151.101.66.187","TCP","1434","[TCP Retransmission] 56337  >  443 [PSH, ACK] Seq=14908 Ack=2080 Win=65536 Len=1380"
"252","39.174136200","151.101.66.187","172.20.40.110","TCP","60","443  >  56337 [ACK] Seq=2080 Ack=10670 Win=136704 Len=0"
"253","39.174136200","151.101.66.187","172.20.40.110","TCP","60","443  >  56337 [ACK] Seq=2080 Ack=13479 Win=134144 Len=0"
"254","39.174136200","151.101.66.187","172.20.40.110","TCP","60","443  >  56337 [ACK] Seq=2080 Ack=16288 Win=131584 Len=0"
"255","39.174136200","151.101.66.187","172.20.40.110","TLSv1.3","214","Application Data"
"256","39.174136200","151.101.66.187","172.20.40.110","TLSv1.3","104","Application Data"
"257","39.174136200","151.101.66.187","172.20.40.110","TLSv1.3","124","Application Data"
"258","39.174136200","151.101.66.187","172.20.40.110","TCP","66","[TCP Dup ACK 254#1] 443  >  56337 [ACK] Seq=2360 Ack=16288 Win=131584 Len=0 SLE=14908 SRE=16288"
"259","39.174286100","172.20.40.110","151.101.66.187","TCP","54","56337  >  443 [ACK] Seq=16288 Ack=2360 Win=65280 Len=0"
"260","39.235407000","172.20.40.110","151.101.66.187","TLSv1.3","2867","Application Data"
"261","39.257670400","151.101.66.187","172.20.40.110","TCP","60","443  >  56337 [ACK] Seq=2360 Ack=19101 Win=129024 Len=0"
"262","39.257670400","151.101.66.187","172.20.40.110","TLSv1.3","131","Application Data"
"263","39.302174300","172.20.40.110","151.101.66.187","TCP","54","56337  >  443 [ACK] Seq=19101 Ack=2437 Win=65280 Len=0"
"264","41.596878000","172.20.40.110","151.101.66.187","TLSv1.3","2870","Application Data"
"265","41.609691200","172.20.40.110","151.101.66.187","TLSv1.3","2864","Application Data"
"266","41.612355900","172.20.40.110","151.101.66.187","TLSv1.3","2864","Application Data"
"267","41.655873800","172.20.40.110","151.101.66.187","TCP","1434","[TCP Retransmission] 56337  >  443 [PSH, ACK] Seq=26157 Ack=2437 Win=65280 Len=1380"
"268","41.763907900","151.101.66.187","172.20.40.110","TCP","60","443  >  56337 [ACK] Seq=2437 Ack=21917 Win=126464 Len=0"
"269","41.763907900","151.101.66.187","172.20.40.110","TLSv1.3","214","Application Data"
"270","41.768934400","151.101.66.187","172.20.40.110","TCP","60","443  >  56337 [ACK] Seq=2597 Ack=24727 Win=123904 Len=0"
"271","41.773173200","151.101.66.187","172.20.40.110","TLSv1.3","103","Application Data"
"272","41.773265200","172.20.40.110","151.101.66.187","TCP","54","56337  >  443 [ACK] Seq=27537 Ack=2646 Win=65024 Len=0"
"273","41.774287300","151.101.66.187","172.20.40.110","TCP","60","443  >  56337 [ACK] Seq=2646 Ack=27537 Win=121856 Len=0"
"274","41.801441000","151.101.66.187","172.20.40.110","TLSv1.3","104","Application Data"
"275","41.801441000","151.101.66.187","172.20.40.110","TCP","66","[TCP Dup ACK 273#1] 443  >  56337 [ACK] Seq=2696 Ack=27537 Win=121856 Len=0 SLE=26157 SRE=27537"
"276","41.850415000","172.20.40.110","151.101.66.187","TCP","54","56337  >  443 [ACK] Seq=27537 Ack=2696 Win=65024 Len=0"
"277","41.855779500","151.101.66.187","172.20.40.110","TCP","104","[TCP Spurious Retransmission] 443  >  56337 [PSH, ACK] Seq=2646 Ack=27537 Win=121856 Len=50"
"278","41.855837600","172.20.40.110","151.101.66.187","TCP","66","[TCP Dup ACK 276#1] 56337  >  443 [ACK] Seq=27537 Ack=2696 Win=65024 Len=0 SLE=2646 SRE=2696"
"279","52.837867900","172.20.40.110","151.101.66.187","TLSv1.3","2879","Application Data"
"280","52.838049000","172.20.40.110","151.101.66.187","TLSv1.3","93","Application Data"
"281","52.872757200","151.101.66.187","172.20.40.110","TCP","60","443  >  56337 [ACK] Seq=2696 Ack=30362 Win=119296 Len=0"
"282","52.872757200","151.101.66.187","172.20.40.110","TCP","60","443  >  56337 [ACK] Seq=2696 Ack=30401 Win=119296 Len=0"
"283","52.872757200","151.101.66.187","172.20.40.110","TLSv1.3","93","Application Data"
"284","52.877321400","151.101.66.187","172.20.40.110","TLSv1.3","241","Application Data"
"285","52.877471600","172.20.40.110","151.101.66.187","TCP","54","56337  >  443 [ACK] Seq=30401 Ack=2922 Win=66048 Len=0"
"286","52.921559200","172.20.40.110","151.101.66.187","TLSv1.3","2886","Application Data"
"287","52.949815600","151.101.66.187","172.20.40.110","TCP","60","443  >  56337 [ACK] Seq=2922 Ack=33233 Win=116736 Len=0"
"288","52.949815600","151.101.66.187","172.20.40.110","TLSv1.3","130","Application Data"
"289","53.000777400","172.20.40.110","151.101.66.187","TCP","54","56337  >  443 [ACK] Seq=33233 Ack=2998 Win=66048 Len=0"
"290","53.017015900","151.101.66.187","172.20.40.110","TCP","130","[TCP Spurious Retransmission] 443  >  56337 [PSH, ACK] Seq=2922 Ack=33233 Win=116736 Len=76"
"291","53.017075700","172.20.40.110","151.101.66.187","TCP","66","[TCP Dup ACK 289#1] 56337  >  443 [ACK] Seq=33233 Ack=2998 Win=66048 Len=0 SLE=2922 SRE=2998"
