No.,Time,Source,Destination,Protocol,Length,Info
1,0.0,100.84.170.161,151.101.66.187,TLSv1.2,2527,Application Data
2,0.0001349,100.84.170.161,151.101.66.187,TLSv1.2,93,Application Data
3,0.0043419,100.84.170.161,151.101.66.187,TLSv1.2,2521,Application Data
4,0.008961,151.101.66.187,100.84.170.161,TCP,56,443  >  59747 [ACK] Seq=1 Ack=2513 Win=2894 Len=0
5,0.0092229,151.101.66.187,100.84.170.161,TLSv1.2,93,Application Data
6,0.0120188,151.101.66.187,100.84.170.161,TLSv1.2,220,Application Data
7,0.0120512,100.84.170.161,151.101.66.187,TCP,54,59747  >  443 [ACK] Seq=4980 Ack=206 Win=4102 Len=0
8,0.0136505,151.101.66.187,100.84.170.161,TCP,56,443  >  59747 [ACK] Seq=206 Ack=4980 Win=2904 Len=0
9,0.0165708,151.101.66.187,100.84.170.161,TLSv1.2,125,Application Data
10,0.0402753,100.84.170.161,151.101.66.187,TLSv1.2,2515,Application Data
11,0.0420803,100.84.170.161,151.101.66.187,TLSv1.2,2512,Application Data
12,0.0495244,151.101.66.187,100.84.170.161,TCP,56,443  >  59747 [ACK] Seq=277 Ack=7441 Win=2913 Len=0
13,0.050561,151.101.66.187,100.84.170.161,TCP,56,443  >  59747 [ACK] Seq=277 Ack=9899 Win=2923 Len=0
14,0.0521085,151.101.66.187,100.84.170.161,TLSv1.2,135,Application Data
15,0.0532916,151.101.66.187,100.84.170.161,TLSv1.2,124,Application Data
16,0.0533545,100.84.170.161,151.101.66.187,TCP,54,59747  >  443 [ACK] Seq=9899 Ack=428 Win=4101 Len=0
17,6.0378848,100.84.170.161,151.101.66.187,TLSv1.2,2412,Application Data
18,6.0492109,151.101.66.187,100.84.170.161,TCP,56,443  >  59747 [ACK] Seq=428 Ack=12257 Win=2932 Len=0
19,6.0515347,151.101.66.187,100.84.170.161,TLSv1.2,273,Application Data
20,6.0892069,151.101.66.187,100.84.170.161,TCP,273,"[TCP Retransmission] 443  >  59747 [PSH, ACK] Seq=428 Ack=12257 Win=2932 Len=219"
21,6.0892423,100.84.170.161,151.101.66.187,TCP,66,59747  >  443 [ACK] Seq=12257 Ack=647 Win=4101 Len=0 SLE=428 SRE=647
22,6.1203616,100.84.170.161,151.101.66.187,TLSv1.2,2451,Application Data
23,6.1294584,151.101.66.187,100.84.170.161,TCP,56,443  >  59747 [ACK] Seq=647 Ack=14654 Win=2942 Len=0
24,6.1314125,151.101.66.187,100.84.170.161,TLSv1.2,170,Application Data
25,6.1702963,151.101.66.187,100.84.170.161,TCP,170,"[TCP Retransmission] 443  >  59747 [PSH, ACK] Seq=647 Ack=14654 Win=2942 Len=116"
26,6.1703195,100.84.170.161,151.101.66.187,TCP,66,59747  >  443 [ACK] Seq=14654 Ack=763 Win=4100 Len=0 SLE=647 SRE=763
27,6.283864,100.84.170.161,151.101.66.187,TLSv1.2,2437,Application Data
28,6.292722,151.101.66.187,100.84.170.161,TCP,56,443  >  59747 [ACK] Seq=763 Ack=17037 Win=2951 Len=0
29,6.296025,151.101.66.187,100.84.170.161,TLSv1.2,202,Application Data
30,6.3331503,151.101.66.187,100.84.170.161,TCP,202,"[TCP Retransmission] 443  >  59747 [PSH, ACK] Seq=763 Ack=17037 Win=2951 Len=148"
31,6.3331919,100.84.170.161,151.101.66.187,TCP,66,59747  >  443 [ACK] Seq=17037 Ack=911 Win=4106 Len=0 SLE=763 SRE=911
32,6.7856929,100.84.170.161,151.101.66.187,TLSv1.2,2449,Application Data
33,6.7944414,151.101.66.187,100.84.170.161,TCP,56,443  >  59747 [ACK] Seq=911 Ack=19432 Win=2960 Len=0
34,6.7973141,151.101.66.187,100.84.170.161,TLSv1.2,131,Application Data
35,6.8351281,151.101.66.187,100.84.170.161,TCP,131,"[TCP Retransmission] 443  >  59747 [PSH, ACK] Seq=911 Ack=19432 Win=2960 Len=77"
36,6.8351776,100.84.170.161,151.101.66.187,TCP,66,59747  >  443 [ACK] Seq=19432 Ack=988 Win=4105 Len=0 SLE=911 SRE=988
37,7.2056084,100.84.170.161,151.101.66.187,TLSv1.2,2450,Application Data
38,7.2165023,151.101.66.187,100.84.170.161,TCP,56,443  >  59747 [ACK] Seq=988 Ack=21828 Win=2970 Len=0
39,7.218156,151.101.66.187,100.84.170.161,TLSv1.2,234,Application Data
40,7.2559129,100.84.170.161,151.101.66.187,TLSv1.2,2451,Application Data
41,7.2571769,151.101.66.187,100.84.170.161,TCP,234,"[TCP Spurious Retransmission] 443  >  59747 [PSH, ACK] Seq=988 Ack=21828 Win=2970 Len=180"
42,7.2572195,100.84.170.161,151.101.66.187,TCP,66,[TCP Dup ACK 40#1] 59747  >  443 [ACK] Seq=24225 Ack=1168 Win=4105 Len=0 SLE=988 SRE=1168
43,7.2646519,151.101.66.187,100.84.170.161,TCP,56,443  >  59747 [ACK] Seq=1168 Ack=24225 Win=2979 Len=0
44,7.2673532,151.101.66.187,100.84.170.161,TLSv1.2,124,Application Data
45,7.3059926,151.101.66.187,100.84.170.161,TCP,124,"[TCP Retransmission] 443  >  59747 [PSH, ACK] Seq=1168 Ack=24225 Win=2979 Len=70"
46,7.306036,100.84.170.161,151.101.66.187,TCP,66,59747  >  443 [ACK] Seq=24225 Ack=1238 Win=4104 Len=0 SLE=1168 SRE=1238
47,7.6488574,100.84.170.161,151.101.66.187,TLSv1.2,2451,Application Data
48,7.6569685,100.84.170.161,151.101.66.187,TLSv1.2,2452,Application Data
49,7.6588106,151.101.66.187,100.84.170.161,TCP,56,443  >  59747 [ACK] Seq=1238 Ack=26622 Win=2988 Len=0
50,7.6611279,151.101.66.187,100.84.170.161,TLSv1.2,104,Application Data
51,7.6657127,151.101.66.187,100.84.170.161,TCP,56,443  >  59747 [ACK] Seq=1288 Ack=29020 Win=2998 Len=0
52,7.6693724,151.101.66.187,100.84.170.161,TLSv1.2,98,Application Data
53,7.6695022,100.84.170.161,151.101.66.187,TCP,54,59747  >  443 [ACK] Seq=29020 Ack=1332 Win=4104 Len=0
54,7.680267,100.84.170.161,151.101.66.187,TLSv1.2,2446,Application Data
55,7.6893681,151.101.66.187,100.84.170.161,TCP,56,443  >  59747 [ACK] Seq=1332 Ack=31412 Win=3007 Len=0
56,7.6922571,151.101.66.187,100.84.170.161,TLSv1.2,130,Application Data
57,7.7239882,100.84.170.161,151.101.66.187,TLSv1.2,2443,Application Data
58,7.7247149,100.84.170.161,151.101.66.187,TLSv1.2,2434,Application Data
59,7.7304053,151.101.66.187,100.84.170.161,TCP,130,"[TCP Spurious Retransmission] 443  >  59747 [PSH, ACK] Seq=1332 Ack=31412 Win=3007 Len=76"
60,7.7304506,100.84.170.161,151.101.66.187,TCP,66,[TCP Dup ACK 57#1] 59747  >  443 [ACK] Seq=36181 Ack=1408 Win=4104 Len=0 SLE=1332 SRE=1408
61,7.7329597,151.101.66.187,100.84.170.161,TCP,56,443  >  59747 [ACK] Seq=1408 Ack=33801 Win=3016 Len=0
62,7.7337325,151.101.66.187,100.84.170.161,TCP,56,443  >  59747 [ACK] Seq=1408 Ack=36181 Win=3026 Len=0
63,7.7357564,151.101.66.187,100.84.170.161,TLSv1.2,124,Application Data
64,7.7391999,151.101.66.187,100.84.170.161,TLSv1.2,124,Application Data
65,7.7392554,100.84.170.161,151.101.66.187,TCP,54,59747  >  443 [ACK] Seq=36181 Ack=1548 Win=4103 Len=0
66,7.7738593,100.84.170.161,151.101.66.187,TLSv1.2,2479,Application Data
67,7.7741593,100.84.170.161,151.101.66.187,TLSv1.2,2476,Application Data
68,7.7829548,151.101.66.187,100.84.170.161,TCP,56,443  >  59747 [ACK] Seq=1548 Ack=41028 Win=3045 Len=0
69,7.7852963,151.101.66.187,100.84.170.161,TLSv1.2,104,Application Data
70,7.7855253,151.101.66.187,100.84.170.161,TLSv1.2,142,Application Data
71,7.7855643,100.84.170.161,151.101.66.187,TCP,54,59747  >  443 [ACK] Seq=41028 Ack=1686 Win=4103 Len=0
72,7.9329168,100.84.170.161,151.101.66.187,TLSv1.2,2434,Application Data
73,7.9416407,151.101.66.187,100.84.170.161,TCP,56,443  >  59747 [ACK] Seq=1686 Ack=43408 Win=3054 Len=0
74,7.9444421,151.101.66.187,100.84.170.161,TLSv1.2,98,Application Data
75,7.9736196,100.84.170.161,151.101.66.187,TLSv1.2,2432,Application Data
76,7.9801387,151.101.66.187,100.84.170.161,TCP,98,"[TCP Spurious Retransmission] 443  >  59747 [PSH, ACK] Seq=1686 Ack=43408 Win=3054 Len=44"
77,7.9801873,100.84.170.161,151.101.66.187,TCP,66,[TCP Dup ACK 75#1] 59747  >  443 [ACK] Seq=45786 Ack=1730 Win=4103 Len=0 SLE=1686 SRE=1730
78,7.9828349,151.101.66.187,100.84.170.161,TCP,56,443  >  59747 [ACK] Seq=1730 Ack=45786 Win=3063 Len=0
79,7.9853335,151.101.66.187,100.84.170.161,TLSv1.2,208,Application Data
80,8.0223654,151.101.66.187,100.84.170.161,TCP,208,"[TCP Retransmission] 443  >  59747 [PSH, ACK] Seq=1730 Ack=45786 Win=3063 Len=154"
81,8.0224145,100.84.170.161,151.101.66.187,TCP,66,59747  >  443 [ACK] Seq=45786 Ack=1884 Win=4102 Len=0 SLE=1730 SRE=1884
82,8.1330973,100.84.170.161,151.101.66.187,TLSv1.2,2435,Application Data
83,8.1449291,151.101.66.187,100.84.170.161,TCP,56,443  >  59747 [ACK] Seq=1884 Ack=48167 Win=3072 Len=0
84,8.1467636,151.101.66.187,100.84.170.161,TLSv1.2,104,Application Data
85,8.1811696,151.101.66.187,100.84.170.161,TCP,104,"[TCP Retransmission] 443  >  59747 [PSH, ACK] Seq=1884 Ack=48167 Win=3072 Len=50"
86,8.1812124,100.84.170.161,151.101.66.187,TCP,66,59747  >  443 [ACK] Seq=48167 Ack=1934 Win=4102 Len=0 SLE=1884 SRE=1934
87,8.4220717,100.84.170.161,151.101.66.187,TLSv1.2,2437,Application Data
88,8.4312245,151.101.66.187,100.84.170.161,TCP,56,443  >  59747 [ACK] Seq=1934 Ack=50550 Win=3082 Len=0
89,8.4338029,151.101.66.187,100.84.170.161,TLSv1.2,98,Application Data
90,8.4683381,151.101.66.187,100.84.170.161,TCP,98,"[TCP Retransmission] 443  >  59747 [PSH, ACK] Seq=1934 Ack=50550 Win=3082 Len=44"
91,8.4683799,100.84.170.161,151.101.66.187,TCP,66,59747  >  443 [ACK] Seq=50550 Ack=1978 Win=4102 Len=0 SLE=1934 SRE=1978
92,11.7733565,100.84.170.161,151.101.66.187,TLSv1.2,2443,Application Data
93,11.7760026,100.84.170.161,151.101.66.187,TLSv1.2,2444,Application Data
94,11.7830715,151.101.66.187,100.84.170.161,TCP,56,443  >  59747 [ACK] Seq=1978 Ack=52939 Win=3091 Len=0
95,11.7847966,151.101.66.187,100.84.170.161,TCP,56,443  >  59747 [ACK] Seq=1978 Ack=55329 Win=3100 Len=0
96,11.7858666,151.101.66.187,100.84.170.161,TLSv1.2,214,Application Data
97,11.7881235,151.101.66.187,100.84.170.161,TLSv1.2,98,Application Data
98,11.7881898,100.84.170.161,151.101.66.187,TCP,54,59747  >  443 [ACK] Seq=55329 Ack=2182 Win=4101 Len=0
99,12.1711662,100.84.170.161,151.101.66.187,TLSv1.2,2444,Application Data
100,12.180018,151.101.66.187,100.84.170.161,TCP,56,443  >  59747 [ACK] Seq=2182 Ack=57719 Win=3110 Len=0
101,12.1823886,151.101.66.187,100.84.170.161,TLSv1.2,208,Application Data
102,12.2164598,151.101.66.187,100.84.170.161,TCP,208,"[TCP Retransmission] 443  >  59747 [PSH, ACK] Seq=2182 Ack=57719 Win=3110 Len=154"
103,12.2165015,100.84.170.161,151.101.66.187,TCP,66,59747  >  443 [ACK] Seq=57719 Ack=2336 Win=4100 Len=0 SLE=2182 SRE=2336
104,12.9148019,100.84.170.161,151.101.66.187,TLSv1.2,2441,Application Data
105,12.9236332,151.101.66.187,100.84.170.161,TCP,56,443  >  59747 [ACK] Seq=2336 Ack=60106 Win=3119 Len=0
106,12.9282606,151.101.66.187,100.84.170.161,TLSv1.2,109,Application Data
107,12.9782407,100.84.170.161,151.101.66.187,TCP,54,59747  >  443 [ACK] Seq=60106 Ack=2391 Win=4106 Len=0
108,13.2241979,100.84.170.161,151.101.66.187,TLSv1.2,2442,Application Data
109,13.2328958,151.101.66.187,100.84.170.161,TCP,56,443  >  59747 [ACK] Seq=2391 Ack=62494 Win=3128 Len=0
110,13.2355788,151.101.66.187,100.84.170.161,TLSv1.2,208,Application Data
111,13.2814974,100.84.170.161,151.101.66.187,TCP,54,59747  >  443 [ACK] Seq=62494 Ack=2545 Win=4105 Len=0
112,13.3065475,100.84.170.161,151.101.66.187,TLSv1.2,2438,Application Data
113,13.3280919,100.84.170.161,151.101.66.187,TCP,1514,"[TCP Retransmission] 59747  >  443 [PSH, ACK] Seq=63418 Ack=2545 Win=4105 Len=1460"
114,13.3423187,151.101.66.187,100.84.170.161,TCP,56,443  >  59747 [ACK] Seq=2545 Ack=64878 Win=3138 Len=0
115,13.3423187,151.101.66.187,100.84.170.161,TLSv1.2,130,Application Data
116,13.3867315,100.84.170.161,151.101.66.187,TCP,54,59747  >  443 [ACK] Seq=64878 Ack=2621 Win=4105 Len=0
117,13.5820339,100.84.170.161,151.101.66.187,TLSv1.2,2443,Application Data
118,13.5827366,100.84.170.161,151.101.66.187,TLSv1.2,2431,Application Data
119,13.585599,100.84.170.161,151.101.66.187,TLSv1.2,2425,Application Data
120,13.5912909,100.84.170.161,151.101.66.187,TLSv1.2,2444,Application Data
121,13.5994387,151.101.66.187,100.84.170.161,TCP,66,[TCP Dup ACK 114#1] 443  >  59747 [ACK] Seq=2621 Ack=64878 Win=3138 Len=0 SLE=63418 SRE=64878
122,13.5994387,151.101.66.187,100.84.170.161,TCP,130,"[TCP Spurious Retransmission] 443  >  59747 [PSH, ACK] Seq=2545 Ack=64878 Win=3138 Len=76"
123,13.6001253,100.84.170.161,151.101.66.187,TCP,66,[TCP Dup ACK 116#1] 59747  >  443 [ACK] Seq=74405 Ack=2621 Win=4105 Len=0 SLE=2545 SRE=2621
124,13.6006166,151.101.66.187,100.84.170.161,TCP,56,443  >  59747 [ACK] Seq=2621 Ack=69644 Win=3156 Len=0
125,13.6006166,151.101.66.187,100.84.170.161,TCP,56,443  >  59747 [ACK] Seq=2621 Ack=72015 Win=3166 Len=0
126,13.6006166,151.101.66.187,100.84.170.161,TLSv1.2,104,Application Data
127,13.6006166,151.101.66.187,100.84.170.161,TLSv1.2,175,Application Data
128,13.6006166,151.101.66.187,100.84.170.161,TLSv1.2,208,Application Data
129,13.6008824,100.84.170.161,151.101.66.187,TCP,54,59747  >  443 [ACK] Seq=74405 Ack=2946 Win=4104 Len=0
130,13.6253724,100.84.170.161,151.101.66.187,TCP,1514,"[TCP Retransmission] 59747  >  443 [PSH, ACK] Seq=72945 Ack=2946 Win=4104 Len=1460"
131,13.6445021,151.101.66.187,100.84.170.161,TCP,56,443  >  59747 [ACK] Seq=2946 Ack=74405 Win=3175 Len=0
132,13.6445021,151.101.66.187,100.84.170.161,TLSv1.2,125,Application Data
133,13.6518594,151.101.66.187,100.84.170.161,TCP,66,[TCP Dup ACK 131#1] 443  >  59747 [ACK] Seq=3017 Ack=74405 Win=3175 Len=0 SLE=72945 SRE=74405
134,13.6853637,100.84.170.161,151.101.66.187,TCP,54,59747  >  443 [ACK] Seq=74405 Ack=3017 Win=4103 Len=0
135,13.7115517,151.101.66.187,100.84.170.161,TCP,125,"[TCP Spurious Retransmission] 443  >  59747 [PSH, ACK] Seq=2946 Ack=74405 Win=3175 Len=71"
136,13.7115906,100.84.170.161,151.101.66.187,TCP,66,[TCP Dup ACK 134#1] 59747  >  443 [ACK] Seq=74405 Ack=3017 Win=4103 Len=0 SLE=2946 SRE=3017
137,13.7191225,100.84.170.161,151.101.66.187,TLSv1.2,2447,Application Data
138,13.7278777,151.101.66.187,100.84.170.161,TCP,56,443  >  59747 [ACK] Seq=3017 Ack=76798 Win=3184 Len=0
139,13.7302531,151.101.66.187,100.84.170.161,TLSv1.2,124,Application Data
140,13.7382594,100.84.170.161,151.101.66.187,TLSv1.2,2438,Application Data
141,13.7603739,100.84.170.161,151.101.66.187,TCP,1514,"[TCP Retransmission] 59747  >  443 [PSH, ACK] Seq=77722 Ack=3087 Win=4103 Len=1460"
142,13.7842303,151.101.66.187,100.84.170.161,TCP,124,"[TCP Spurious Retransmission] 443  >  59747 [PSH, ACK] Seq=3017 Ack=76798 Win=3184 Len=70"
143,13.7842742,100.84.170.161,151.101.66.187,TCP,66,[TCP Dup ACK 140#1] 59747  >  443 [ACK] Seq=79182 Ack=3087 Win=4103 Len=0 SLE=3017 SRE=3087
144,13.7886792,151.101.66.187,100.84.170.161,TCP,56,443  >  59747 [ACK] Seq=3087 Ack=79182 Win=3194 Len=0
145,13.7889909,151.101.66.187,100.84.170.161,TCP,66,[TCP Dup ACK 144#1] 443  >  59747 [ACK] Seq=3087 Ack=79182 Win=3194 Len=0 SLE=77722 SRE=79182
146,13.7910865,151.101.66.187,100.84.170.161,TLSv1.2,104,Application Data
147,13.8077391,100.84.170.161,151.101.66.187,TLSv1.2,2432,Application Data
148,13.8079783,100.84.170.161,151.101.66.187,TLSv1.2,2429,Application Data
149,13.8359267,100.84.170.161,151.101.66.187,TCP,1514,"[TCP Retransmission] 59747  >  443 [PSH, ACK] Seq=82475 Ack=3137 Win=4103 Len=1460"
150,13.8497318,151.101.66.187,100.84.170.161,TCP,104,"[TCP Spurious Retransmission] 443  >  59747 [PSH, ACK] Seq=3087 Ack=79182 Win=3194 Len=50"
151,13.8497754,100.84.170.161,151.101.66.187,TCP,66,[TCP Dup ACK 147#1] 59747  >  443 [ACK] Seq=83935 Ack=3137 Win=4103 Len=0 SLE=3087 SRE=3137
152,13.8585932,151.101.66.187,100.84.170.161,TCP,56,443  >  59747 [ACK] Seq=3137 Ack=81560 Win=3203 Len=0
153,13.8585932,151.101.66.187,100.84.170.161,TCP,66,443  >  59747 [ACK] Seq=3137 Ack=83935 Win=3212 Len=0 SLE=82475 SRE=83935
154,13.8651015,151.101.66.187,100.84.170.161,TLSv1.2,130,Application Data
155,13.8654024,151.101.66.187,100.84.170.161,TLSv1.2,124,Application Data
156,13.8654402,100.84.170.161,151.101.66.187,TCP,54,59747  >  443 [ACK] Seq=83935 Ack=3283 Win=4102 Len=0
157,13.8860516,100.84.170.161,151.101.66.187,TLSv1.2,2430,Application Data
158,13.886852,100.84.170.161,151.101.66.187,TLSv1.2,2421,Application Data
159,13.9256609,151.101.66.187,100.84.170.161,TCP,56,443  >  59747 [ACK] Seq=3283 Ack=86311 Win=3221 Len=0
160,13.9262099,151.101.66.187,100.84.170.161,TCP,56,443  >  59747 [ACK] Seq=3283 Ack=88678 Win=3231 Len=0
161,13.9292351,151.101.66.187,100.84.170.161,TLSv1.2,98,Application Data
162,13.9297644,151.101.66.187,100.84.170.161,TLSv1.2,98,Application Data
163,13.9298088,100.84.170.161,151.101.66.187,TCP,54,59747  >  443 [ACK] Seq=88678 Ack=3371 Win=4102 Len=0
164,14.2142836,100.84.170.161,151.101.66.187,TLSv1.2,2484,Application Data
165,14.2174391,100.84.170.161,151.101.66.187,TLSv1.2,2482,Application Data
166,14.2655052,100.84.170.161,151.101.66.187,TCP,1514,"[TCP Retransmission] 59747  >  443 [PSH, ACK] Seq=92076 Ack=3371 Win=4102 Len=1460"
167,14.2659415,151.101.66.187,100.84.170.161,TCP,56,443  >  59747 [ACK] Seq=3371 Ack=93536 Win=3250 Len=0
168,14.2692861,151.101.66.187,100.84.170.161,TLSv1.2,235,Application Data
169,14.2706872,151.101.66.187,100.84.170.161,TLSv1.2,125,Application Data
170,14.2707501,100.84.170.161,151.101.66.187,TCP,54,59747  >  443 [ACK] Seq=93536 Ack=3623 Win=4101 Len=0
171,14.2743811,151.101.66.187,100.84.170.161,TCP,66,[TCP Dup ACK 167#1] 443  >  59747 [ACK] Seq=3623 Ack=93536 Win=3250 Len=0 SLE=92076 SRE=93536
172,14.4264806,100.84.170.161,151.101.66.187,TLSv1.2,2485,Application Data
173,14.464924,151.101.66.187,100.84.170.161,TCP,56,443  >  59747 [ACK] Seq=3623 Ack=95967 Win=3259 Len=0
174,14.4675696,151.101.66.187,100.84.170.161,TLSv1.2,148,Application Data
175,14.5143683,100.84.170.161,151.101.66.187,TCP,54,59747  >  443 [ACK] Seq=95967 Ack=3717 Win=4101 Len=0
176,14.5302157,151.101.66.187,100.84.170.161,TCP,148,"[TCP Spurious Retransmission] 443  >  59747 [PSH, ACK] Seq=3623 Ack=95967 Win=3259 Len=94"
177,14.5302553,100.84.170.161,151.101.66.187,TCP,66,[TCP Dup ACK 175#1] 59747  >  443 [ACK] Seq=95967 Ack=3717 Win=4101 Len=0 SLE=3623 SRE=3717
178,14.8477453,100.84.170.161,151.101.66.187,TLSv1.2,2487,Application Data
179,14.8841256,151.101.66.187,100.84.170.161,TCP,56,443  >  59747 [ACK] Seq=3717 Ack=98400 Win=3269 Len=0
180,14.8859388,151.101.66.187,100.84.170.161,TLSv1.2,130,Application Data
181,14.9289572,100.84.170.161,151.101.66.187,TCP,54,59747  >  443 [ACK] Seq=98400 Ack=3793 Win=4100 Len=0
182,14.9301556,151.101.66.187,100.84.170.161,TCP,130,"[TCP Spurious Retransmission] 443  >  59747 [PSH, ACK] Seq=3717 Ack=98400 Win=3269 Len=76"
183,14.9301956,100.84.170.161,151.101.66.187,TCP,66,[TCP Dup ACK 181#1] 59747  >  443 [ACK] Seq=98400 Ack=3793 Win=4100 Len=0 SLE=3717 SRE=3793
184,16.74254,100.84.170.161,151.101.66.187,TLSv1.2,2504,Application Data
185,16.7531909,151.101.66.187,100.84.170.161,TCP,56,443  >  59747 [ACK] Seq=3793 Ack=100850 Win=3278 Len=0
186,16.7558146,151.101.66.187,100.84.170.161,TLSv1.2,214,Application Data
187,16.7992515,151.101.66.187,100.84.170.161,TCP,214,"[TCP Retransmission] 443  >  59747 [PSH, ACK] Seq=3793 Ack=100850 Win=3278 Len=160"
188,16.7993039,100.84.170.161,151.101.66.187,TCP,66,59747  >  443 [ACK] Seq=100850 Ack=3953 Win=4106 Len=0 SLE=3793 SRE=3953
189,16.8000028,100.84.170.161,151.101.66.187,TLSv1.2,2503,Application Data
190,16.8085495,151.101.66.187,100.84.170.161,TCP,56,443  >  59747 [ACK] Seq=3953 Ack=103299 Win=3288 Len=0
191,16.8118736,151.101.66.187,100.84.170.161,TLSv1.2,98,Application Data
192,16.8287948,100.84.170.161,151.101.66.187,TLSv1.2,2501,Application Data
193,16.8378885,151.101.66.187,100.84.170.161,TCP,56,443  >  59747 [ACK] Seq=3997 Ack=105746 Win=3297 Len=0
194,16.8401975,151.101.66.187,100.84.170.161,TLSv1.2,98,Application Data
195,16.8843838,100.84.170.161,151.101.66.187,TCP,54,59747  >  443 [ACK] Seq=105746 Ack=4041 Win=4105 Len=0
196,16.887164,151.101.66.187,100.84.170.161,TCP,98,"[TCP Spurious Retransmission] 443  >  59747 [PSH, ACK] Seq=3997 Ack=105746 Win=3297 Len=44"
197,16.8872302,100.84.170.161,151.101.66.187,TCP,66,[TCP Dup ACK 195#1] 59747  >  443 [ACK] Seq=105746 Ack=4041 Win=4105 Len=0 SLE=3997 SRE=4041
198,17.2301495,100.84.170.161,151.101.66.187,TLSv1.2,2502,Application Data
199,17.2402796,151.101.66.187,100.84.170.161,TCP,56,443  >  59747 [ACK] Seq=4041 Ack=108194 Win=3307 Len=0
200,17.2434258,151.101.66.187,100.84.170.161,TLSv1.2,208,Application Data
201,17.2889433,100.84.170.161,151.101.66.187,TCP,54,59747  >  443 [ACK] Seq=108194 Ack=4195 Win=4105 Len=0
202,17.2901365,151.101.66.187,100.84.170.161,TCP,208,"[TCP Spurious Retransmission] 443  >  59747 [PSH, ACK] Seq=4041 Ack=108194 Win=3307 Len=154"
203,17.2901714,100.84.170.161,151.101.66.187,TCP,66,[TCP Dup ACK 201#1] 59747  >  443 [ACK] Seq=108194 Ack=4195 Win=4105 Len=0 SLE=4041 SRE=4195
204,17.8312416,100.84.170.161,151.101.66.187,TLSv1.2,2503,Application Data
205,17.8333041,100.84.170.161,151.101.66.187,TLSv1.2,2491,Application Data
206,17.8362155,100.84.170.161,151.101.66.187,TLSv1.2,2485,Application Data
207,17.8419144,100.84.170.161,151.101.66.187,TLSv1.2,2504,Application Data
208,17.8459233,100.84.170.161,151.101.66.187,TLSv1.2,2435,Application Data
209,17.8796524,100.84.170.161,151.101.66.187,TCP,1514,"[TCP Retransmission] 59747  >  443 [PSH, ACK] Seq=118882 Ack=4195 Win=4105 Len=1460"
210,17.8864841,151.101.66.187,100.84.170.161,TCP,56,443  >  59747 [ACK] Seq=4195 Ack=117961 Win=3345 Len=0
211,17.8866361,151.101.66.187,100.84.170.161,TLSv1.2,137,Application Data
212,17.8870786,151.101.66.187,100.84.170.161,TLSv1.2,158,Application Data
213,17.8871297,100.84.170.161,151.101.66.187,TCP,54,59747  >  443 [ACK] Seq=120342 Ack=4382 Win=4104 Len=0
214,17.8920338,151.101.66.187,100.84.170.161,TCP,56,443  >  59747 [ACK] Seq=4382 Ack=120342 Win=3354 Len=0
215,17.8939643,151.101.66.187,100.84.170.161,TCP,66,[TCP Dup ACK 214#1] 443  >  59747 [ACK] Seq=4382 Ack=120342 Win=3354 Len=0 SLE=118882 SRE=120342
216,17.8944971,151.101.66.187,100.84.170.161,TLSv1.2,445,Application Data
217,17.8983104,100.84.170.161,151.101.66.187,TLSv1.2,89,Application Data
218,17.9070758,151.101.66.187,100.84.170.161,TCP,56,443  >  59747 [ACK] Seq=4773 Ack=120377 Win=3354 Len=0
219,17.9666931,100.84.170.161,151.101.66.187,TLSv1.2,2507,Application Data
220,17.9758092,151.101.66.187,100.84.170.161,TCP,56,443  >  59747 [ACK] Seq=4773 Ack=122830 Win=3364 Len=0
221,17.9785949,151.101.66.187,100.84.170.161,TLSv1.2,208,Application Data
222,17.9888152,100.84.170.161,151.101.66.187,TLSv1.2,2498,Application Data
223,17.9982336,151.101.66.187,100.84.170.161,TCP,56,443  >  59747 [ACK] Seq=4927 Ack=125274 Win=3374 Len=0
224,18.0010288,151.101.66.187,100.84.170.161,TLSv1.2,208,Application Data
225,18.0450959,151.101.66.187,100.84.170.161,TCP,208,"[TCP Retransmission] 443  >  59747 [PSH, ACK] Seq=4927 Ack=125274 Win=3374 Len=154"
226,18.0451257,100.84.170.161,151.101.66.187,TCP,66,59747  >  443 [ACK] Seq=125274 Ack=5081 Win=4101 Len=0 SLE=4927 SRE=5081
227,18.0732259,100.84.170.161,151.101.66.187,TLSv1.2,2495,Application Data
228,18.0735689,100.84.170.161,151.101.66.187,TLSv1.2,2486,Application Data
229,18.0825489,151.101.66.187,100.84.170.161,TCP,56,443  >  59747 [ACK] Seq=5081 Ack=130147 Win=3393 Len=0
230,18.08607,151.101.66.187,100.84.170.161,TLSv1.2,172,Application Data
231,18.1292155,151.101.66.187,100.84.170.161,TCP,172,"[TCP Retransmission] 443  >  59747 [PSH, ACK] Seq=5081 Ack=130147 Win=3393 Len=118"
232,18.1292564,100.84.170.161,151.101.66.187,TCP,66,59747  >  443 [ACK] Seq=130147 Ack=5199 Win=4101 Len=0 SLE=5081 SRE=5199
233,18.1363388,100.84.170.161,151.101.66.187,TLSv1.2,2477,Application Data
234,18.1378993,100.84.170.161,151.101.66.187,TLSv1.2,2474,Application Data
235,18.1449819,151.101.66.187,100.84.170.161,TCP,56,443  >  59747 [ACK] Seq=5199 Ack=132570 Win=3402 Len=0
236,18.146541,151.101.66.187,100.84.170.161,TCP,56,443  >  59747 [ACK] Seq=5199 Ack=134990 Win=3411 Len=0
237,18.1474223,151.101.66.187,100.84.170.161,TLSv1.2,130,Application Data
238,18.1489003,151.101.66.187,100.84.170.161,TLSv1.2,124,Application Data
239,18.1489517,100.84.170.161,151.101.66.187,TCP,54,59747  >  443 [ACK] Seq=134990 Ack=5345 Win=4100 Len=0
240,18.2361553,100.84.170.161,151.101.66.187,TLSv1.2,2519,Application Data
241,18.2451349,151.101.66.187,100.84.170.161,TCP,56,443  >  59747 [ACK] Seq=5345 Ack=137455 Win=3421 Len=0
242,18.2455353,100.84.170.161,151.101.66.187,TLSv1.2,2507,Application Data
243,18.247493,151.101.66.187,100.84.170.161,TLSv1.2,98,Application Data
244,18.2543632,151.101.66.187,100.84.170.161,TCP,56,443  >  59747 [ACK] Seq=5389 Ack=139908 Win=3431 Len=0
245,18.257239,151.101.66.187,100.84.170.161,TLSv1.2,131,Application Data
246,18.2573084,100.84.170.161,151.101.66.187,TCP,54,59747  >  443 [ACK] Seq=139908 Ack=5466 Win=4106 Len=0
247,18.3076829,100.84.170.161,151.101.66.187,TLSv1.2,2521,Application Data
248,18.3168592,151.101.66.187,100.84.170.161,TCP,56,443  >  59747 [ACK] Seq=5466 Ack=142375 Win=3440 Len=0
249,18.3196351,151.101.66.187,100.84.170.161,TLSv1.2,124,Application Data
250,18.3614689,151.101.66.187,100.84.170.161,TCP,124,"[TCP Retransmission] 443  >  59747 [PSH, ACK] Seq=5466 Ack=142375 Win=3440 Len=70"
251,18.3614995,100.84.170.161,151.101.66.187,TCP,66,59747  >  443 [ACK] Seq=142375 Ack=5536 Win=4105 Len=0 SLE=5466 SRE=5536
252,22.5633139,100.84.170.161,151.101.66.187,TLSv1.2,2531,Application Data
253,22.5725239,151.101.66.187,100.84.170.161,TCP,56,443  >  59747 [ACK] Seq=5536 Ack=144852 Win=3450 Len=0
254,22.576098,151.101.66.187,100.84.170.161,TLSv1.2,291,Application Data
255,22.6182413,151.101.66.187,100.84.170.161,TCP,291,"[TCP Retransmission] 443  >  59747 [PSH, ACK] Seq=5536 Ack=144852 Win=3450 Len=237"
256,22.6182795,100.84.170.161,151.101.66.187,TCP,66,59747  >  443 [ACK] Seq=144852 Ack=5773 Win=4105 Len=0 SLE=5536 SRE=5773
257,22.6234184,100.84.170.161,151.101.66.187,TLSv1.2,2531,Application Data
258,22.6327973,151.101.66.187,100.84.170.161,TCP,56,443  >  59747 [ACK] Seq=5773 Ack=147329 Win=3460 Len=0
259,22.6350905,151.101.66.187,100.84.170.161,TLSv1.2,98,Application Data
260,22.6771942,151.101.66.187,100.84.170.161,TCP,98,"[TCP Retransmission] 443  >  59747 [PSH, ACK] Seq=5773 Ack=147329 Win=3460 Len=44"
261,22.6772508,100.84.170.161,151.101.66.187,TCP,66,59747  >  443 [ACK] Seq=147329 Ack=5817 Win=4104 Len=0 SLE=5773 SRE=5817
262,23.4395203,100.84.170.161,151.101.66.187,TLSv1.2,2530,Application Data
263,23.4496188,151.101.66.187,100.84.170.161,TCP,56,443  >  59747 [ACK] Seq=5817 Ack=149805 Win=3469 Len=0
264,23.4523191,100.84.170.161,151.101.66.187,TLSv1.2,2521,Application Data
265,23.4532922,151.101.66.187,100.84.170.161,TLSv1.2,214,Application Data
266,23.4565686,100.84.170.161,151.101.66.187,TLSv1.2,2515,Application Data
267,23.4591075,100.84.170.161,151.101.66.187,TLSv1.2,2515,Application Data
268,23.4611728,151.101.66.187,100.84.170.161,TCP,56,443  >  59747 [ACK] Seq=5977 Ack=152272 Win=3479 Len=0
269,23.4651195,151.101.66.187,100.84.170.161,TCP,56,443  >  59747 [ACK] Seq=5977 Ack=154733 Win=3489 Len=0
270,23.4663299,151.101.66.187,100.84.170.161,TLSv1.2,129,Application Data
271,23.4678679,151.101.66.187,100.84.170.161,TCP,56,443  >  59747 [ACK] Seq=6052 Ack=157194 Win=3498 Len=0
272,23.4695469,151.101.66.187,100.84.170.161,TLSv1.2,104,Application Data
273,23.4696189,100.84.170.161,151.101.66.187,TCP,54,59747  >  443 [ACK] Seq=157194 Ack=6102 Win=4103 Len=0
274,23.4706017,151.101.66.187,100.84.170.161,TLSv1.2,156,Application Data
275,23.5161559,100.84.170.161,151.101.66.187,TCP,54,59747  >  443 [ACK] Seq=157194 Ack=6204 Win=4103 Len=0
276,23.5165123,151.101.66.187,100.84.170.161,TCP,156,"[TCP Spurious Retransmission] 443  >  59747 [PSH, ACK] Seq=6102 Ack=157194 Win=3498 Len=102"
277,23.5165894,100.84.170.161,151.101.66.187,TCP,66,[TCP Dup ACK 275#1] 59747  >  443 [ACK] Seq=157194 Ack=6204 Win=4103 Len=0 SLE=6102 SRE=6204
278,23.6932548,100.84.170.161,151.101.66.187,TLSv1.2,2529,Application Data
279,23.703471,151.101.66.187,100.84.170.161,TCP,56,443  >  59747 [ACK] Seq=6204 Ack=159669 Win=3508 Len=0
280,23.7058623,151.101.66.187,100.84.170.161,TLSv1.2,124,Application Data
281,23.7248992,100.84.170.161,151.101.66.187,TLSv1.2,2529,Application Data
282,23.7349941,151.101.66.187,100.84.170.161,TCP,56,443  >  59747 [ACK] Seq=6274 Ack=162144 Win=3518 Len=0
283,23.7373314,151.101.66.187,100.84.170.161,TLSv1.2,125,Application Data
284,23.7783685,151.101.66.187,100.84.170.161,TCP,125,"[TCP Retransmission] 443  >  59747 [PSH, ACK] Seq=6274 Ack=162144 Win=3518 Len=71"
285,23.7784063,100.84.170.161,151.101.66.187,TCP,66,59747  >  443 [ACK] Seq=162144 Ack=6345 Win=4102 Len=0 SLE=6274 SRE=6345
286,23.8372606,100.84.170.161,151.101.66.187,TLSv1.2,2524,Application Data
287,23.8467252,151.101.66.187,100.84.170.161,TCP,56,443  >  59747 [ACK] Seq=6345 Ack=164614 Win=3527 Len=0
288,23.849664,151.101.66.187,100.84.170.161,TLSv1.2,176,Application Data
289,23.890735,100.84.170.161,151.101.66.187,TCP,54,59747  >  443 [ACK] Seq=164614 Ack=6467 Win=4102 Len=0
290,23.8915619,151.101.66.187,100.84.170.161,TCP,176,"[TCP Spurious Retransmission] 443  >  59747 [PSH, ACK] Seq=6345 Ack=164614 Win=3527 Len=122"
291,23.8916094,100.84.170.161,151.101.66.187,TCP,66,[TCP Dup ACK 289#1] 59747  >  443 [ACK] Seq=164614 Ack=6467 Win=4102 Len=0 SLE=6345 SRE=6467
292,23.9224654,100.84.170.161,151.101.66.187,TLSv1.2,2534,Application Data
293,23.9225957,100.84.170.161,151.101.66.187,TLSv1.2,2530,Application Data
294,23.932472,151.101.66.187,100.84.170.161,TCP,56,443  >  59747 [ACK] Seq=6467 Ack=169570 Win=3547 Len=0
295,23.9353324,151.101.66.187,100.84.170.161,TLSv1.2,125,Application Data
296,23.9361055,151.101.66.187,100.84.170.161,TLSv1.2,208,Application Data
297,23.9361698,100.84.170.161,151.101.66.187,TCP,54,59747  >  443 [ACK] Seq=169570 Ack=6692 Win=4101 Len=0
298,24.0607049,100.84.170.161,151.101.66.187,TLSv1.2,2536,Application Data
299,24.0612734,100.84.170.161,151.101.66.187,TLSv1.2,2532,Application Data
300,24.0641216,100.84.170.161,151.101.66.187,TLSv1.2,2528,Application Data
301,24.0699164,151.101.66.187,100.84.170.161,TCP,56,443  >  59747 [ACK] Seq=6692 Ack=172052 Win=3556 Len=0
302,24.0702038,151.101.66.187,100.84.170.161,TCP,56,443  >  59747 [ACK] Seq=6692 Ack=174530 Win=3566 Len=0
303,24.0727217,151.101.66.187,100.84.170.161,TLSv1.2,240,Application Data
304,24.0735901,151.101.66.187,100.84.170.161,TCP,56,443  >  59747 [ACK] Seq=6878 Ack=177004 Win=3576 Len=0
305,24.0739046,151.101.66.187,100.84.170.161,TLSv1.2,131,Application Data
306,24.0739577,100.84.170.161,151.101.66.187,TCP,54,59747  >  443 [ACK] Seq=177004 Ack=6955 Win=4106 Len=0
307,24.0765359,151.101.66.187,100.84.170.161,TLSv1.2,130,Application Data
308,24.1191707,151.101.66.187,100.84.170.161,TCP,130,"[TCP Retransmission] 443  >  59747 [PSH, ACK] Seq=6955 Ack=177004 Win=3576 Len=76"
309,24.1192171,100.84.170.161,151.101.66.187,TCP,66,59747  >  443 [ACK] Seq=177004 Ack=7031 Win=4105 Len=0 SLE=6955 SRE=7031
310,32.0742274,100.84.170.161,151.101.66.187,TLSv1.2,2531,Application Data
311,32.0799764,100.84.170.161,151.101.66.187,TLSv1.2,2536,Application Data
312,32.0838218,151.101.66.187,100.84.170.161,TCP,56,443  >  59747 [ACK] Seq=7031 Ack=179481 Win=3585 Len=0
313,32.0863068,100.84.170.161,151.101.66.187,TLSv1.2,2537,Application Data
314,32.0864964,151.101.66.187,100.84.170.161,TLSv1.2,291,Application Data
315,32.0892912,151.101.66.187,100.84.170.161,TCP,56,443  >  59747 [ACK] Seq=7268 Ack=181963 Win=3595 Len=0
316,32.0918497,151.101.66.187,100.84.170.161,TLSv1.2,98,Application Data
317,32.0919114,100.84.170.161,151.101.66.187,TCP,54,59747  >  443 [ACK] Seq=184446 Ack=7312 Win=4104 Len=0
318,32.0955022,100.84.170.161,151.101.66.187,TLSv1.2,2522,Application Data
319,32.0966371,151.101.66.187,100.84.170.161,TCP,56,443  >  59747 [ACK] Seq=7312 Ack=184446 Win=3605 Len=0
320,32.0986048,151.101.66.187,100.84.170.161,TLSv1.2,125,Application Data
321,32.1045918,151.101.66.187,100.84.170.161,TCP,56,443  >  59747 [ACK] Seq=7383 Ack=186914 Win=3614 Len=0
322,32.1072043,151.101.66.187,100.84.170.161,TLSv1.2,98,Application Data
323,32.1072567,100.84.170.161,151.101.66.187,TCP,54,59747  >  443 [ACK] Seq=186914 Ack=7427 Win=4104 Len=0
324,32.2165449,100.84.170.161,151.101.66.187,TCP,55,55359  >  443 [ACK] Seq=1 Ack=1 Win=512 Len=1 [TCP PDU reassembled in 343]
325,32.2255937,151.101.66.187,100.84.170.161,TCP,66,443  >  55359 [ACK] Seq=1 Ack=2 Win=281 Len=0 SLE=1 SRE=2
326,47.7948853,100.84.170.161,151.101.66.187,TLSv1.2,2536,Application Data
327,47.7951079,100.84.170.161,151.101.66.187,TLSv1.2,93,Application Data
328,47.8289029,100.84.170.161,151.101.66.187,TCP,1514,"[TCP Retransmission] 59747  >  443 [PSH, ACK] Seq=187975 Ack=7427 Win=4104 Len=1460"
329,47.8859453,151.101.66.187,100.84.170.161,TLSv1.2,93,Application Data
330,47.8859453,151.101.66.187,100.84.170.161,TLSv1.2,214,Application Data
331,47.8860336,100.84.170.161,151.101.66.187,TCP,54,59747  >  443 [ACK] Seq=189435 Ack=7626 Win=4103 Len=0
332,47.9104877,151.101.66.187,100.84.170.161,TCP,66,[TCP Dup ACK 329#1] 443  >  59747 [ACK] Seq=7626 Ack=189435 Win=3624 Len=0 SLE=187975 SRE=189435
333,47.9123738,151.101.66.187,100.84.170.161,TCP,214,"[TCP Spurious Retransmission] 443  >  59747 [PSH, ACK] Seq=7466 Ack=189435 Win=3624 Len=160"
334,47.9124137,100.84.170.161,151.101.66.187,TCP,66,[TCP Dup ACK 331#1] 59747  >  443 [ACK] Seq=189435 Ack=7626 Win=4103 Len=0 SLE=7466 SRE=7626
335,47.9329152,100.84.170.161,151.101.66.187,TLSv1.2,2534,Application Data
336,47.9541827,100.84.170.161,151.101.66.187,TCP,1514,"[TCP Retransmission] 59747  >  443 [PSH, ACK] Seq=190455 Ack=7626 Win=4103 Len=1460"
337,47.9979184,100.84.170.161,151.101.66.187,TLSv1.2,2537,Application Data
338,47.9988805,151.101.66.187,100.84.170.161,TLSv1.2,272,Application Data
339,48.0054509,151.101.66.187,100.84.170.161,TCP,66,[TCP Dup ACK 338#1] 443  >  59747 [ACK] Seq=7844 Ack=191915 Win=3634 Len=0 SLE=190455 SRE=191915
340,48.0074814,151.101.66.187,100.84.170.161,TCP,56,443  >  59747 [ACK] Seq=7844 Ack=194398 Win=3643 Len=0
341,48.0105721,151.101.66.187,100.84.170.161,TLSv1.2,98,Application Data
342,48.0106372,100.84.170.161,151.101.66.187,TCP,54,59747  >  443 [ACK] Seq=194398 Ack=7888 Win=4102 Len=0
343,48.819844,100.84.170.161,151.101.66.187,TLSv1.2,248,Ignored Unknown Record
344,48.8199375,100.84.170.161,151.101.66.187,TLSv1.2,93,Application Data
345,48.8313907,151.101.66.187,100.84.170.161,TCP,56,443  >  55359 [ACK] Seq=1 Ack=235 Win=281 Len=0
346,48.8318254,151.101.66.187,100.84.170.161,TLSv1.2,93,Application Data
347,48.8598746,151.101.66.187,100.84.170.161,TCP,93,"[TCP Retransmission] 443  >  55359 [PSH, ACK] Seq=1 Ack=235 Win=281 Len=39"
348,48.8599101,100.84.170.161,151.101.66.187,TCP,66,55359  >  443 [ACK] Seq=235 Ack=40 Win=512 Len=0 SLE=1 SRE=40
349,48.8810081,151.101.66.187,100.84.170.161,TLSv1.2,264,Application Data
350,48.881354,151.101.66.187,100.84.170.161,TLSv1.2,926,Application Data
351,48.8814269,100.84.170.161,151.101.66.187,TCP,54,55359  >  443 [ACK] Seq=235 Ack=1122 Win=507 Len=0
352,48.882472,151.101.66.187,100.84.170.161,TLSv1.2,101,Application Data
353,48.882472,151.101.66.187,100.84.170.161,TLSv1.2,348,Application Data
354,48.8826192,100.84.170.161,151.101.66.187,TCP,54,55359  >  443 [ACK] Seq=235 Ack=1463 Win=513 Len=0
355,48.8868096,100.84.170.161,151.101.66.187,TLSv1.2,89,Application Data
356,48.8957147,151.101.66.187,100.84.170.161,TCP,56,443  >  55359 [ACK] Seq=1463 Ack=270 Win=281 Len=0
357,55.7507732,100.84.170.161,151.101.66.187,TLSv1.2,2534,Application Data
358,55.7612395,100.84.170.161,151.101.66.187,TLSv1.2,2525,Application Data
359,55.76127,151.101.66.187,100.84.170.161,TCP,56,443  >  59747 [ACK] Seq=7888 Ack=196878 Win=3653 Len=0
360,55.7635214,100.84.170.161,151.101.66.187,TLSv1.2,2519,Application Data
361,55.7645139,151.101.66.187,100.84.170.161,TLSv1.2,214,Application Data
362,55.7694869,100.84.170.161,151.101.66.187,TLSv1.2,2519,Application Data
363,55.7731701,151.101.66.187,100.84.170.161,TCP,56,443  >  59747 [ACK] Seq=8048 Ack=199349 Win=3663 Len=0
364,55.7734987,151.101.66.187,100.84.170.161,TCP,56,443  >  59747 [ACK] Seq=8048 Ack=201814 Win=3672 Len=0
365,55.776474,151.101.66.187,100.84.170.161,TLSv1.2,169,Application Data
366,55.7774582,151.101.66.187,100.84.170.161,TLSv1.2,209,Application Data
367,55.7775239,100.84.170.161,151.101.66.187,TCP,54,59747  >  443 [ACK] Seq=204279 Ack=8318 Win=4100 Len=0
368,55.7844015,151.101.66.187,100.84.170.161,TCP,56,443  >  59747 [ACK] Seq=8318 Ack=204279 Win=3682 Len=0
369,55.7878939,151.101.66.187,100.84.170.161,TLSv1.2,124,Application Data
370,55.8259415,151.101.66.187,100.84.170.161,TCP,124,"[TCP Retransmission] 443  >  59747 [PSH, ACK] Seq=8318 Ack=204279 Win=3682 Len=70"
371,55.825994,100.84.170.161,151.101.66.187,TCP,66,59747  >  443 [ACK] Seq=204279 Ack=8388 Win=4100 Len=0 SLE=8318 SRE=8388
372,55.9623257,100.84.170.161,151.101.66.187,TLSv1.2,2533,Application Data
373,55.9753818,151.101.66.187,100.84.170.161,TCP,56,443  >  59747 [ACK] Seq=8388 Ack=206758 Win=3692 Len=0
374,55.9777751,151.101.66.187,100.84.170.161,TLSv1.2,234,Application Data
375,55.9887885,100.84.170.161,151.101.66.187,TLSv1.2,2533,Application Data
376,56.0006525,151.101.66.187,100.84.170.161,TCP,56,443  >  59747 [ACK] Seq=8568 Ack=209237 Win=3701 Len=0
377,56.0034825,151.101.66.187,100.84.170.161,TLSv1.2,125,Application Data
378,56.0433897,151.101.66.187,100.84.170.161,TCP,125,"[TCP Retransmission] 443  >  59747 [PSH, ACK] Seq=8568 Ack=209237 Win=3701 Len=71"
379,56.043437,100.84.170.161,151.101.66.187,TCP,66,59747  >  443 [ACK] Seq=209237 Ack=8639 Win=4105 Len=0 SLE=8568 SRE=8639
380,56.1243948,100.84.170.161,151.101.66.187,TLSv1.2,2528,Application Data
381,56.1414527,151.101.66.187,100.84.170.161,TCP,56,443  >  59747 [ACK] Seq=8639 Ack=211711 Win=3711 Len=0
382,56.1436594,151.101.66.187,100.84.170.161,TLSv1.2,131,Application Data
383,56.1819899,151.101.66.187,100.84.170.161,TCP,131,"[TCP Retransmission] 443  >  59747 [PSH, ACK] Seq=8639 Ack=211711 Win=3711 Len=77"
384,56.1820447,100.84.170.161,151.101.66.187,TCP,66,59747  >  443 [ACK] Seq=211711 Ack=8716 Win=4105 Len=0 SLE=8639 SRE=8716
385,56.1911237,100.84.170.161,151.101.66.187,TLSv1.2,2534,Application Data
386,56.1912632,100.84.170.161,151.101.66.187,TLSv1.2,2538,Application Data
387,56.1913915,100.84.170.161,151.101.66.187,TLSv1.2,2530,Application Data
388,56.2028254,151.101.66.187,100.84.170.161,TCP,56,443  >  59747 [ACK] Seq=8716 Ack=214191 Win=3721 Len=0
389,56.203816,151.101.66.187,100.84.170.161,TCP,56,443  >  59747 [ACK] Seq=8716 Ack=219151 Win=3740 Len=0
390,56.2049113,151.101.66.187,100.84.170.161,TLSv1.2,131,Application Data
391,56.2049113,151.101.66.187,100.84.170.161,TLSv1.2,180,Application Data
392,56.2049113,151.101.66.187,100.84.170.161,TLSv1.2,130,Application Data
393,56.2049776,100.84.170.161,151.101.66.187,TCP,54,59747  >  443 [ACK] Seq=219151 Ack=8995 Win=4104 Len=0
394,56.3169616,100.84.170.161,151.101.66.187,TLSv1.2,2542,Application Data
395,56.3171047,100.84.170.161,151.101.66.187,TLSv1.2,2538,Application Data
396,56.3256633,151.101.66.187,100.84.170.161,TCP,56,443  >  59747 [ACK] Seq=8995 Ack=221639 Win=3750 Len=0
397,56.3261906,151.101.66.187,100.84.170.161,TCP,56,443  >  59747 [ACK] Seq=8995 Ack=224123 Win=3759 Len=0
398,56.3293,151.101.66.187,100.84.170.161,TLSv1.2,130,Application Data
399,56.3298077,151.101.66.187,100.84.170.161,TLSv1.2,125,Application Data
400,56.329889,100.84.170.161,151.101.66.187,TCP,54,59747  >  443 [ACK] Seq=224123 Ack=9142 Win=4104 Len=0
