"No.","Time","Source","Destination","Protocol","Length","Info"
"1","0.000000000","172.20.40.110","151.101.194.187","TLSv1.2","2629","Application Data"
"2","0.000252900","172.20.40.110","151.101.194.187","TLSv1.2","93","Application Data"
"3","0.020790000","151.101.194.187","172.20.40.110","TCP","60","443  >  50060 [ACK] Seq=1 Ack=2576 Win=3924 Len=0"
"4","0.020790000","151.101.194.187","172.20.40.110","TCP","60","443  >  50060 [ACK] Seq=1 Ack=2615 Win=3924 Len=0"
"5","0.020790000","151.101.194.187","172.20.40.110","TLSv1.2","93","Application Data"
"6","0.055975400","151.101.194.187","172.20.40.110","TCP","93","[TCP Retransmission] 443  >  50060 [PSH, ACK] Seq=1 Ack=2615 Win=3924 Len=39"
"7","0.056069700","172.20.40.110","151.101.194.187","TCP","66","50060  >  443 [ACK] Seq=2615 Ack=40 Win=256 Len=0 SLE=1 SRE=40"
"8","0.080864300","151.101.194.187","172.20.40.110","TLSv1.2","512","Application Data"
"9","0.080864300","151.101.194.187","172.20.40.110","TLSv1.2","94","Application Data"
"10","0.080994700","172.20.40.110","151.101.194.187","TCP","54","50060  >  443 [ACK] Seq=2615 Ack=538 Win=254 Len=0"
"11","0.082779400","172.20.40.110","151.101.194.187","TLSv1.2","89","Application Data"
"12","0.083825700","151.101.194.187","172.20.40.110","TLSv1.2","86","Application Data"
"13","0.083825700","151.101.194.187","172.20.40.110","TLSv1.2","87","Application Data"
"14","0.083825700","151.101.194.187","172.20.40.110","TLSv1.2","118","Application Data, Application Data"
"15","0.083825700","151.101.194.187","172.20.40.110","TLSv1.2","120","Application Data, Application Data"
"16","0.083825700","151.101.194.187","172.20.40.110","TLSv1.2","86","Application Data"
"17","0.083825700","151.101.194.187","172.20.40.110","TLSv1.2","87","Application Data"
"18","0.083825700","151.101.194.187","172.20.40.110","TLSv1.2","648","Application Data"
"19","0.083825700","151.101.194.187","172.20.40.110","TCP","1434","443  >  50060 [ACK] Seq=1392 Ack=2615 Win=3924 Len=1380 [TCP PDU reassembled in 20]"
"20","0.083825700","151.101.194.187","172.20.40.110","TLSv1.2","76","Application Data"
"21","0.083825700","151.101.194.187","172.20.40.110","TLSv1.2","604","Application Data, Application Data"
"22","0.083825700","151.101.194.187","172.20.40.110","TLSv1.2","85","Application Data"
"23","0.084134100","172.20.40.110","151.101.194.187","TCP","54","50060  >  443 [ACK] Seq=2650 Ack=3375 Win=258 Len=0"
"24","0.092488200","151.101.194.187","172.20.40.110","TCP","60","443  >  50060 [ACK] Seq=3375 Ack=2650 Win=3924 Len=0"
"25","0.810688500","172.20.40.110","151.101.194.187","TLSv1.2","2941","Application Data"
"26","0.825661600","151.101.194.187","172.20.40.110","TCP","60","443  >  50060 [ACK] Seq=3375 Ack=5537 Win=3924 Len=0"
"27","0.828981000","151.101.194.187","172.20.40.110","TLSv1.2","439","Application Data"
"28","0.859583600","151.101.194.187","172.20.40.110","TCP","439","[TCP Retransmission] 443  >  50060 [PSH, ACK] Seq=3375 Ack=5537 Win=3924 Len=385"
"29","0.859671700","172.20.40.110","151.101.194.187","TCP","66","50060  >  443 [ACK] Seq=5537 Ack=3760 Win=257 Len=0 SLE=3375 SRE=3760"
"30","1.014564200","172.20.40.110","151.101.194.187","TLSv1.2","2942","Application Data"
"31","1.015706500","172.20.40.110","151.101.194.187","TLSv1.2","2941","Application Data"
"32","1.025435100","151.101.194.187","172.20.40.110","TCP","60","443  >  50060 [ACK] Seq=3760 Ack=8425 Win=3924 Len=0"
"33","1.025435100","151.101.194.187","172.20.40.110","TCP","60","443  >  50060 [ACK] Seq=3760 Ack=11312 Win=3924 Len=0"
"34","1.026660200","151.101.194.187","172.20.40.110","TLSv1.2","131","Application Data"
"35","1.028839100","151.101.194.187","172.20.40.110","TLSv1.2","125","Application Data"
"36","1.028947300","172.20.40.110","151.101.194.187","TCP","54","50060  >  443 [ACK] Seq=11312 Ack=3908 Win=256 Len=0"
"37","1.169460700","172.20.40.110","151.101.194.187","TLSv1.2","2941","Application Data"
"38","1.179759700","151.101.194.187","172.20.40.110","TCP","60","443  >  50060 [ACK] Seq=3908 Ack=14199 Win=3924 Len=0"
"39","1.182942600","151.101.194.187","172.20.40.110","TLSv1.2","98","Application Data"
"40","1.201791000","172.20.40.110","151.101.194.187","TLSv1.2","2939","Application Data"
"41","1.213323800","151.101.194.187","172.20.40.110","TCP","60","443  >  50060 [ACK] Seq=3952 Ack=17084 Win=3924 Len=0"
"42","1.213323800","151.101.194.187","172.20.40.110","TLSv1.2","131","Application Data"
"43","1.247672200","151.101.194.187","172.20.40.110","TCP","131","[TCP Retransmission] 443  >  50060 [PSH, ACK] Seq=3952 Ack=17084 Win=3924 Len=77"
"44","1.247755800","172.20.40.110","151.101.194.187","TCP","66","50060  >  443 [ACK] Seq=17084 Ack=4029 Win=256 Len=0 SLE=3952 SRE=4029"
"45","1.353313600","172.20.40.110","151.101.194.187","TLSv1.2","2942","Application Data"
"46","1.366423600","151.101.194.187","172.20.40.110","TCP","60","443  >  50060 [ACK] Seq=4029 Ack=19972 Win=3929 Len=0"
"47","1.377189700","151.101.194.187","172.20.40.110","TLSv1.2","98","Application Data"
"48","1.415707300","151.101.194.187","172.20.40.110","TCP","98","[TCP Retransmission] 443  >  50060 [PSH, ACK] Seq=4029 Ack=19972 Win=3929 Len=44"
"49","1.415775500","172.20.40.110","151.101.194.187","TCP","66","50060  >  443 [ACK] Seq=19972 Ack=4073 Win=256 Len=0 SLE=4029 SRE=4073"
"50","2.177696200","172.20.40.110","151.101.194.187","TLSv1.2","2926","Application Data"
"51","2.178232300","172.20.40.110","151.101.194.187","TLSv1.2","2941","Application Data"
"52","2.181629400","172.20.40.110","151.101.194.187","TLSv1.2","2929","Application Data"
"53","2.182067000","172.20.40.110","151.101.194.187","TLSv1.2","2925","Application Data"
"54","2.193814500","151.101.194.187","172.20.40.110","TCP","60","443  >  50060 [ACK] Seq=4073 Ack=22844 Win=3929 Len=0"
"55","2.193814500","151.101.194.187","172.20.40.110","TLSv1.2","241","Application Data"
"56","2.199764500","151.101.194.187","172.20.40.110","TCP","60","443  >  50060 [ACK] Seq=4260 Ack=25731 Win=3929 Len=0"
"57","2.199764500","151.101.194.187","172.20.40.110","TCP","60","443  >  50060 [ACK] Seq=4260 Ack=28606 Win=3929 Len=0"
"58","2.199764500","151.101.194.187","172.20.40.110","TCP","60","443  >  50060 [ACK] Seq=4260 Ack=31477 Win=3929 Len=0"
"59","2.206230000","151.101.194.187","172.20.40.110","TLSv1.2","129","Application Data"
"60","2.206230000","151.101.194.187","172.20.40.110","TLSv1.2","135","Application Data"
"61","2.206345100","172.20.40.110","151.101.194.187","TCP","54","50060  >  443 [ACK] Seq=31477 Ack=4416 Win=254 Len=0"
"62","2.207207000","151.101.194.187","172.20.40.110","TLSv1.2","130","Application Data"
"63","2.207305400","172.20.40.110","151.101.194.187","TCP","54","50060  >  443 [ACK] Seq=31477 Ack=4492 Win=254 Len=0"
"64","5.732163900","172.20.40.110","151.101.194.187","TLSv1.2","2941","Application Data"
"65","5.732624200","172.20.40.110","151.101.194.187","TLSv1.2","2942","Application Data"
"66","5.741022800","151.101.194.187","172.20.40.110","TCP","60","443  >  50060 [ACK] Seq=4492 Ack=34364 Win=3929 Len=0"
"67","5.743519700","151.101.194.187","172.20.40.110","TCP","60","443  >  50060 [ACK] Seq=4492 Ack=37252 Win=3929 Len=0"
"68","5.749586800","151.101.194.187","172.20.40.110","TLSv1.2","214","Application Data"
"69","5.752643800","151.101.194.187","172.20.40.110","TLSv1.2","98","Application Data"
"70","5.752749900","172.20.40.110","151.101.194.187","TCP","54","50060  >  443 [ACK] Seq=37252 Ack=4696 Win=253 Len=0"
"71","5.856727700","172.20.40.110","151.101.194.187","TLSv1.2","2941","Application Data"
"72","5.866889000","172.20.40.110","151.101.194.187","TLSv1.2","2942","Application Data"
"73","5.871728500","151.101.194.187","172.20.40.110","TCP","60","443  >  50060 [ACK] Seq=4696 Ack=40139 Win=3929 Len=0"
"74","5.872485100","151.101.194.187","172.20.40.110","TLSv1.2","98","Application Data"
"75","5.876532000","151.101.194.187","172.20.40.110","TCP","60","443  >  50060 [ACK] Seq=4740 Ack=42899 Win=3940 Len=0"
"76","5.880048500","151.101.194.187","172.20.40.110","TCP","60","443  >  50060 [ACK] Seq=4740 Ack=43027 Win=3940 Len=0"
"77","5.885679900","151.101.194.187","172.20.40.110","TLSv1.2","98","Application Data"
"78","5.885766200","172.20.40.110","151.101.194.187","TCP","54","50060  >  443 [ACK] Seq=43027 Ack=4784 Win=258 Len=0"
"79","6.241845900","172.20.40.110","151.101.194.187","TLSv1.2","2941","Application Data"
"80","6.251710900","151.101.194.187","172.20.40.110","TCP","60","443  >  50060 [ACK] Seq=4784 Ack=45914 Win=3940 Len=0"
"81","6.255148700","151.101.194.187","172.20.40.110","TLSv1.2","98","Application Data"
"82","6.258943600","172.20.40.110","151.101.194.187","TLSv1.2","2939","Application Data"
"83","6.269516700","151.101.194.187","172.20.40.110","TCP","60","443  >  50060 [ACK] Seq=4828 Ack=48799 Win=3940 Len=0"
"84","6.273996800","151.101.194.187","172.20.40.110","TLSv1.2","110","Application Data"
"85","6.308514300","151.101.194.187","172.20.40.110","TCP","110","[TCP Retransmission] 443  >  50060 [PSH, ACK] Seq=4828 Ack=48799 Win=3940 Len=56"
"86","6.308575200","172.20.40.110","151.101.194.187","TCP","66","50060  >  443 [ACK] Seq=48799 Ack=4884 Win=258 Len=0 SLE=4828 SRE=4884"
"87","6.317870000","172.20.40.110","151.101.194.187","TLSv1.2","2942","Application Data"
"88","6.331187300","151.101.194.187","172.20.40.110","TCP","60","443  >  50060 [ACK] Seq=4884 Ack=51687 Win=3940 Len=0"
"89","6.336176100","151.101.194.187","172.20.40.110","TLSv1.2","98","Application Data"
"90","6.368558700","151.101.194.187","172.20.40.110","TCP","98","[TCP Retransmission] 443  >  50060 [PSH, ACK] Seq=4884 Ack=51687 Win=3940 Len=44"
"91","6.368625100","172.20.40.110","151.101.194.187","TCP","66","50060  >  443 [ACK] Seq=51687 Ack=4928 Win=258 Len=0 SLE=4884 SRE=4928"
"92","7.213266300","172.20.40.110","151.101.194.187","TLSv1.2","2941","Application Data"
"93","7.225813400","172.20.40.110","151.101.194.187","TLSv1.2","2939","Application Data"
"94","7.227809900","151.101.194.187","172.20.40.110","TCP","60","443  >  50060 [ACK] Seq=4928 Ack=54574 Win=3940 Len=0"
"95","7.230419900","151.101.194.187","172.20.40.110","TLSv1.2","208","Application Data"
"96","7.236266400","151.101.194.187","172.20.40.110","TCP","60","443  >  50060 [ACK] Seq=5082 Ack=57459 Win=3940 Len=0"
"97","7.240618000","151.101.194.187","172.20.40.110","TLSv1.2","148","Application Data"
"98","7.240701400","172.20.40.110","151.101.194.187","TCP","54","50060  >  443 [ACK] Seq=57459 Ack=5176 Win=257 Len=0"
"99","7.256387900","172.20.40.110","151.101.194.187","TLSv1.2","2942","Application Data"
"100","7.267921100","151.101.194.187","172.20.40.110","TCP","60","443  >  50060 [ACK] Seq=5176 Ack=60347 Win=3940 Len=0"
"101","7.270141100","151.101.194.187","172.20.40.110","TLSv1.2","98","Application Data"
"102","7.307038000","151.101.194.187","172.20.40.110","TCP","98","[TCP Retransmission] 443  >  50060 [PSH, ACK] Seq=5176 Ack=60347 Win=3940 Len=44"
"103","7.307102600","172.20.40.110","151.101.194.187","TCP","66","50060  >  443 [ACK] Seq=60347 Ack=5220 Win=257 Len=0 SLE=5176 SRE=5220"
"104","13.579083900","172.20.40.110","151.101.194.187","TLSv1.2","2895","Application Data"
"105","13.592443700","151.101.194.187","172.20.40.110","TCP","60","443  >  50060 [ACK] Seq=5220 Ack=63188 Win=3940 Len=0"
"106","13.594899000","151.101.194.187","172.20.40.110","TLSv1.2","395","Application Data"
"107","13.601507300","172.20.40.110","151.101.194.187","TLSv1.2","2897","Application Data"
"108","13.612724900","151.101.194.187","172.20.40.110","TCP","60","443  >  50060 [ACK] Seq=5561 Ack=66031 Win=3940 Len=0"
"109","13.616202100","151.101.194.187","172.20.40.110","TLSv1.2","241","Application Data"
"110","13.633905800","172.20.40.110","151.101.194.187","TLSv1.2","2891","Application Data"
"111","13.640808800","172.20.40.110","151.101.194.187","TLSv1.2","2893","Application Data"
"112","13.644171000","151.101.194.187","172.20.40.110","TCP","60","443  >  50060 [ACK] Seq=5748 Ack=68868 Win=3940 Len=0"
"113","13.648590300","151.101.194.187","172.20.40.110","TLSv1.2","126","Application Data"
"114","13.649389400","172.20.40.110","151.101.194.187","TLSv1.2","2891","Application Data"
"115","13.649615300","151.101.194.187","172.20.40.110","TCP","60","443  >  50060 [ACK] Seq=5820 Ack=71707 Win=3940 Len=0"
"116","13.655791900","151.101.194.187","172.20.40.110","TLSv1.2","130","Application Data"
"117","13.658607800","151.101.194.187","172.20.40.110","TCP","60","443  >  50060 [ACK] Seq=5896 Ack=74467 Win=3952 Len=0"
"118","13.662842000","151.101.194.187","172.20.40.110","TCP","60","443  >  50060 [ACK] Seq=5896 Ack=74544 Win=3952 Len=0"
"119","13.666494700","172.20.40.110","151.101.194.187","TLSv1.2","2889","Application Data"
"120","13.669129400","151.101.194.187","172.20.40.110","TLSv1.2","130","Application Data"
"121","13.675056400","151.101.194.187","172.20.40.110","TCP","60","443  >  50060 [ACK] Seq=5972 Ack=77379 Win=3952 Len=0"
"122","13.678283600","151.101.194.187","172.20.40.110","TLSv1.2","130","Application Data"
"123","13.678366600","172.20.40.110","151.101.194.187","TCP","54","50060  >  443 [ACK] Seq=77379 Ack=6048 Win=253 Len=0"
"124","13.741165200","172.20.40.110","151.101.194.187","TLSv1.2","2891","Application Data"
"125","13.750026300","151.101.194.187","172.20.40.110","TCP","60","443  >  50060 [ACK] Seq=6048 Ack=80216 Win=3952 Len=0"
"126","13.757933800","151.101.194.187","172.20.40.110","TLSv1.2","129","Application Data"
"127","13.794230400","151.101.194.187","172.20.40.110","TCP","129","[TCP Retransmission] 443  >  50060 [PSH, ACK] Seq=6048 Ack=80216 Win=3952 Len=75"
"128","13.794289500","172.20.40.110","151.101.194.187","TCP","66","50060  >  443 [ACK] Seq=80216 Ack=6123 Win=253 Len=0 SLE=6048 SRE=6123"
"129","14.009961500","172.20.40.110","151.101.194.187","TLSv1.2","2891","Application Data"
"130","14.022174300","151.101.194.187","172.20.40.110","TCP","60","443  >  50060 [ACK] Seq=6123 Ack=83053 Win=3952 Len=0"
"131","14.023303800","151.101.194.187","172.20.40.110","TLSv1.2","131","Application Data"
"132","14.061170700","151.101.194.187","172.20.40.110","TCP","131","[TCP Retransmission] 443  >  50060 [PSH, ACK] Seq=6123 Ack=83053 Win=3952 Len=77"
"133","14.061224600","172.20.40.110","151.101.194.187","TCP","66","50060  >  443 [ACK] Seq=83053 Ack=6200 Win=258 Len=0 SLE=6123 SRE=6200"
"134","16.157132200","172.20.40.110","151.101.194.187","TLSv1.2","2907","Application Data"
"135","16.163425400","172.20.40.110","151.101.194.187","TLSv1.2","2895","Application Data"
"136","16.171669200","172.20.40.110","151.101.194.187","TLSv1.2","2908","Application Data"
"137","16.173346200","172.20.40.110","151.101.194.187","TLSv1.2","2889","Application Data"
"138","16.183023800","151.101.194.187","172.20.40.110","TCP","60","443  >  50060 [ACK] Seq=6200 Ack=85906 Win=3952 Len=0"
"139","16.183023800","151.101.194.187","172.20.40.110","TCP","60","443  >  50060 [ACK] Seq=6200 Ack=88747 Win=3952 Len=0"
"140","16.183023800","151.101.194.187","172.20.40.110","TLSv1.2","241","Application Data"
"141","16.184569800","151.101.194.187","172.20.40.110","TLSv1.2","136","Application Data"
"142","16.184976800","172.20.40.110","151.101.194.187","TCP","54","50060  >  443 [ACK] Seq=94436 Ack=6469 Win=257 Len=0"
"143","16.185492200","151.101.194.187","172.20.40.110","TCP","60","443  >  50060 [ACK] Seq=6469 Ack=91601 Win=3952 Len=0"
"144","16.185492200","151.101.194.187","172.20.40.110","TCP","60","443  >  50060 [ACK] Seq=6469 Ack=94436 Win=3952 Len=0"
"145","16.190771700","151.101.194.187","172.20.40.110","TLSv1.2","174","Application Data"
"146","16.190771700","151.101.194.187","172.20.40.110","TLSv1.2","125","Application Data"
"147","16.190867000","172.20.40.110","151.101.194.187","TCP","54","50060  >  443 [ACK] Seq=94436 Ack=6660 Win=256 Len=0"
"148","16.371577900","172.20.40.110","151.101.194.187","TLSv1.2","2911","Application Data"
"149","16.382354500","151.101.194.187","172.20.40.110","TCP","60","443  >  50060 [ACK] Seq=6660 Ack=97293 Win=3952 Len=0"
"150","16.385678200","151.101.194.187","172.20.40.110","TLSv1.2","285","Application Data"
"151","16.422430600","151.101.194.187","172.20.40.110","TCP","285","[TCP Retransmission] 443  >  50060 [PSH, ACK] Seq=6660 Ack=97293 Win=3952 Len=231"
"152","16.422572200","172.20.40.110","151.101.194.187","TCP","66","50060  >  443 [ACK] Seq=97293 Ack=6891 Win=256 Len=0 SLE=6660 SRE=6891"
"153","16.476928600","172.20.40.110","151.101.194.187","TLSv1.2","2893","Application Data"
"154","16.477175200","172.20.40.110","151.101.194.187","TLSv1.2","2890","Application Data"
"155","16.477324500","172.20.40.110","151.101.194.187","TLSv1.2","2896","Application Data"
"156","16.486765100","151.101.194.187","172.20.40.110","TCP","60","443  >  50060 [ACK] Seq=6891 Ack=100132 Win=3952 Len=0"
"157","16.489819000","151.101.194.187","172.20.40.110","TLSv1.2","124","Application Data"
"158","16.493893500","151.101.194.187","172.20.40.110","TCP","60","443  >  50060 [ACK] Seq=6961 Ack=102968 Win=3952 Len=0"
"159","16.493893500","151.101.194.187","172.20.40.110","TCP","60","443  >  50060 [ACK] Seq=6961 Ack=105810 Win=3952 Len=0"
"160","16.493893500","151.101.194.187","172.20.40.110","TLSv1.2","206","Application Data, Application Data"
"161","16.493983800","172.20.40.110","151.101.194.187","TCP","54","50060  >  443 [ACK] Seq=105810 Ack=7113 Win=255 Len=0"
"162","16.555398800","172.20.40.110","151.101.194.187","TLSv1.2","2937","Application Data"
"163","16.566267800","151.101.194.187","172.20.40.110","TCP","60","443  >  50060 [ACK] Seq=7113 Ack=108693 Win=3952 Len=0"
"164","16.570693800","151.101.194.187","172.20.40.110","TLSv1.2","130","Application Data"
"165","16.607340300","151.101.194.187","172.20.40.110","TCP","130","[TCP Retransmission] 443  >  50060 [PSH, ACK] Seq=7113 Ack=108693 Win=3952 Len=76"
"166","16.607400600","172.20.40.110","151.101.194.187","TCP","66","50060  >  443 [ACK] Seq=108693 Ack=7189 Win=254 Len=0 SLE=7113 SRE=7189"
"167","16.638442500","172.20.40.110","151.101.194.187","TLSv1.2","2893","Application Data"
"168","16.647287900","151.101.194.187","172.20.40.110","TCP","60","443  >  50060 [ACK] Seq=7189 Ack=111532 Win=3952 Len=0"
"169","16.651993900","151.101.194.187","172.20.40.110","TLSv1.2","235","Application Data"
"170","16.659207000","172.20.40.110","151.101.194.187","TLSv1.2","2905","Application Data"
"171","16.668504900","151.101.194.187","172.20.40.110","TCP","60","443  >  50060 [ACK] Seq=7370 Ack=114383 Win=3952 Len=0"
"172","16.675320600","151.101.194.187","172.20.40.110","TLSv1.2","125","Application Data"
"173","16.707609800","151.101.194.187","172.20.40.110","TCP","125","[TCP Retransmission] 443  >  50060 [PSH, ACK] Seq=7370 Ack=114383 Win=3952 Len=71"
"174","16.707673500","172.20.40.110","151.101.194.187","TCP","66","50060  >  443 [ACK] Seq=114383 Ack=7441 Win=253 Len=0 SLE=7370 SRE=7441"
"175","17.330815600","172.20.40.110","151.101.194.187","TLSv1.2","2889","Application Data"
"176","17.337088400","172.20.40.110","151.101.194.187","TLSv1.2","2838","Application Data"
"177","17.346929700","151.101.194.187","172.20.40.110","TCP","60","443  >  50060 [ACK] Seq=7441 Ack=117218 Win=3952 Len=0"
"178","17.359140400","151.101.194.187","172.20.40.110","TLSv1.2","135","Application Data"
"179","17.359140400","151.101.194.187","172.20.40.110","TCP","60","443  >  50060 [ACK] Seq=7522 Ack=120002 Win=3957 Len=0"
"180","17.362165500","151.101.194.187","172.20.40.110","TLSv1.2","130","Application Data"
"181","17.362239800","172.20.40.110","151.101.194.187","TCP","54","50060  >  443 [ACK] Seq=120002 Ack=7598 Win=258 Len=0"
"182","17.503794200","172.20.40.110","151.101.194.187","TLSv1.2","2852","Application Data"
"183","17.504895900","172.20.40.110","151.101.194.187","TLSv1.2","2850","Application Data"
"184","17.533152300","151.101.194.187","172.20.40.110","TCP","60","443  >  50060 [ACK] Seq=7598 Ack=122800 Win=3957 Len=0"
"185","17.533152300","151.101.194.187","172.20.40.110","TCP","60","443  >  50060 [ACK] Seq=7598 Ack=125596 Win=3957 Len=0"
"186","17.533152300","151.101.194.187","172.20.40.110","TLSv1.2","125","Application Data"
"187","17.533152300","151.101.194.187","172.20.40.110","TLSv1.2","98","Application Data"
"188","17.533327200","172.20.40.110","151.101.194.187","TCP","54","50060  >  443 [ACK] Seq=125596 Ack=7713 Win=258 Len=0"
"189","17.792290600","172.20.40.110","151.101.194.187","TLSv1.2","2853","Application Data"
"190","17.802393300","151.101.194.187","172.20.40.110","TCP","60","443  >  50060 [ACK] Seq=7713 Ack=128395 Win=3957 Len=0"
"191","17.806044200","151.101.194.187","172.20.40.110","TLSv1.2","208","Application Data"
"192","17.843003700","151.101.194.187","172.20.40.110","TCP","208","[TCP Retransmission] 443  >  50060 [PSH, ACK] Seq=7713 Ack=128395 Win=3957 Len=154"
"193","17.843093200","172.20.40.110","151.101.194.187","TCP","66","50060  >  443 [ACK] Seq=128395 Ack=7867 Win=257 Len=0 SLE=7713 SRE=7867"
"194","27.675404200","172.20.40.110","151.101.194.187","TLSv1.2","2870","Application Data"
"195","27.681804300","172.20.40.110","151.101.194.187","TLSv1.2","2866","Application Data"
"196","27.692144800","172.20.40.110","151.101.194.187","TLSv1.2","2846","Application Data"
"197","27.694101200","151.101.194.187","172.20.40.110","TCP","60","443  >  50060 [ACK] Seq=7867 Ack=131211 Win=3957 Len=0"
"198","27.694101200","151.101.194.187","172.20.40.110","TCP","60","443  >  50060 [ACK] Seq=7867 Ack=134023 Win=3957 Len=0"
"199","27.694404200","172.20.40.110","151.101.194.187","TLSv1.2","2868","Application Data"
"200","27.700223400","151.101.194.187","172.20.40.110","TLSv1.2","246","Application Data"
"201","27.700223400","151.101.194.187","172.20.40.110","TLSv1.2","176","Application Data"
"202","27.700318400","172.20.40.110","151.101.194.187","TCP","54","50060  >  443 [ACK] Seq=139629 Ack=8181 Win=256 Len=0"
"203","27.701463600","151.101.194.187","172.20.40.110","TCP","60","443  >  50060 [ACK] Seq=8181 Ack=136815 Win=3957 Len=0"
"204","27.711829800","151.101.194.187","172.20.40.110","TLSv1.2","280","Application Data"
"205","27.711829800","151.101.194.187","172.20.40.110","TCP","60","443  >  50060 [ACK] Seq=8407 Ack=139629 Win=3957 Len=0"
"206","27.711829800","151.101.194.187","172.20.40.110","TLSv1.2","130","Application Data"
"207","27.712041700","172.20.40.110","151.101.194.187","TCP","54","50060  >  443 [ACK] Seq=139629 Ack=8483 Win=255 Len=0"
"208","27.727487600","172.20.40.110","151.101.194.187","TLSv1.2","2866","Application Data"
"209","27.729942900","172.20.40.110","151.101.194.187","TLSv1.2","2864","Application Data"
"210","27.741964800","151.101.194.187","172.20.40.110","TCP","60","443  >  50060 [ACK] Seq=8483 Ack=142441 Win=3957 Len=0"
"211","27.741964800","151.101.194.187","172.20.40.110","TCP","60","443  >  50060 [ACK] Seq=8483 Ack=145251 Win=3957 Len=0"
"212","27.744319500","151.101.194.187","172.20.40.110","TLSv1.2","206","Application Data, Application Data"
"213","27.744398000","172.20.40.110","151.101.194.187","TCP","54","50060  >  443 [ACK] Seq=145251 Ack=8635 Win=254 Len=0"
"214","27.785104800","172.20.40.110","151.101.194.187","TLSv1.2","2870","Application Data"
"215","27.793896600","151.101.194.187","172.20.40.110","TCP","60","443  >  50060 [ACK] Seq=8635 Ack=148067 Win=3957 Len=0"
"216","27.800482000","151.101.194.187","172.20.40.110","TLSv1.2","98","Application Data"
"217","27.808913900","172.20.40.110","151.101.194.187","TLSv1.2","2866","Application Data"
"218","27.816381700","172.20.40.110","151.101.194.187","TLSv1.2","2868","Application Data"
"219","27.816658700","172.20.40.110","151.101.194.187","TLSv1.2","2872","Application Data"
"220","27.819068800","151.101.194.187","172.20.40.110","TCP","60","443  >  50060 [ACK] Seq=8679 Ack=150879 Win=3957 Len=0"
"221","27.825540800","151.101.194.187","172.20.40.110","TCP","60","443  >  50060 [ACK] Seq=8679 Ack=153693 Win=3957 Len=0"
"222","27.827609100","151.101.194.187","172.20.40.110","TCP","60","443  >  50060 [ACK] Seq=8679 Ack=156511 Win=3957 Len=0"
"223","27.832132200","151.101.194.187","172.20.40.110","TLSv1.2","186","Application Data, Application Data, Application Data"
"224","27.832218800","172.20.40.110","151.101.194.187","TCP","54","50060  >  443 [ACK] Seq=156511 Ack=8811 Win=254 Len=0"
"225","28.042302700","172.20.40.110","151.101.194.187","TLSv1.2","2866","Application Data"
"226","28.042630800","172.20.40.110","151.101.194.187","TLSv1.2","2868","Application Data"
"227","28.054618600","151.101.194.187","172.20.40.110","TCP","60","443  >  50060 [ACK] Seq=8811 Ack=159323 Win=3957 Len=0"
"228","28.054618600","151.101.194.187","172.20.40.110","TCP","60","443  >  50060 [ACK] Seq=8811 Ack=162137 Win=3957 Len=0"
"229","28.058092300","172.20.40.110","151.101.194.187","TLSv1.2","2864","Application Data"
"230","28.058460000","151.101.194.187","172.20.40.110","TLSv1.2","98","Application Data"
"231","28.060317300","151.101.194.187","172.20.40.110","TLSv1.2","98","Application Data"
"232","28.060411700","172.20.40.110","151.101.194.187","TCP","54","50060  >  443 [ACK] Seq=164947 Ack=8899 Win=253 Len=0"
"233","28.069188500","151.101.194.187","172.20.40.110","TCP","60","443  >  50060 [ACK] Seq=8899 Ack=164947 Win=3957 Len=0"
"234","28.073495400","151.101.194.187","172.20.40.110","TLSv1.2","104","Application Data"
"235","28.104875800","151.101.194.187","172.20.40.110","TCP","104","[TCP Retransmission] 443  >  50060 [PSH, ACK] Seq=8899 Ack=164947 Win=3957 Len=50"
"236","28.104961100","172.20.40.110","151.101.194.187","TCP","66","50060  >  443 [ACK] Seq=164947 Ack=8949 Win=253 Len=0 SLE=8899 SRE=8949"
"237","28.145864900","172.20.40.110","151.101.194.187","TLSv1.2","2866","Application Data"
"238","28.161690700","151.101.194.187","172.20.40.110","TCP","60","443  >  50060 [ACK] Seq=8949 Ack=167759 Win=3957 Len=0"
"239","28.161690700","151.101.194.187","172.20.40.110","TLSv1.2","124","Application Data"
"240","28.191634500","151.101.194.187","172.20.40.110","TCP","124","[TCP Retransmission] 443  >  50060 [PSH, ACK] Seq=8949 Ack=167759 Win=3957 Len=70"
"241","28.191662000","172.20.40.110","151.101.194.187","TCP","66","50060  >  443 [ACK] Seq=167759 Ack=9019 Win=258 Len=0 SLE=8949 SRE=9019"
"242","28.317906300","172.20.40.110","151.101.194.187","TLSv1.2","2866","Application Data"
"243","28.328938100","151.101.194.187","172.20.40.110","TCP","60","443  >  50060 [ACK] Seq=9019 Ack=170571 Win=3957 Len=0"
"244","28.332206200","151.101.194.187","172.20.40.110","TLSv1.2","131","Application Data"
"245","28.364898800","151.101.194.187","172.20.40.110","TCP","131","[TCP Retransmission] 443  >  50060 [PSH, ACK] Seq=9019 Ack=170571 Win=3957 Len=77"
"246","28.364971500","172.20.40.110","151.101.194.187","TCP","66","50060  >  443 [ACK] Seq=170571 Ack=9096 Win=258 Len=0 SLE=9019 SRE=9096"
"247","29.034318800","172.20.40.110","151.101.194.187","TLSv1.2","2883","Application Data"
"248","29.039504600","172.20.40.110","151.101.194.187","TLSv1.2","2868","Application Data"
"249","29.041209600","172.20.40.110","151.101.194.187","TLSv1.2","2874","Application Data"
"250","29.046375400","151.101.194.187","172.20.40.110","TCP","60","443  >  50060 [ACK] Seq=9096 Ack=173400 Win=3957 Len=0"
"251","29.050264100","151.101.194.187","172.20.40.110","TLSv1.2","241","Application Data"
"252","29.053508100","151.101.194.187","172.20.40.110","TCP","60","443  >  50060 [ACK] Seq=9283 Ack=176214 Win=3963 Len=0"
"253","29.053508100","151.101.194.187","172.20.40.110","TCP","60","443  >  50060 [ACK] Seq=9283 Ack=179034 Win=3963 Len=0"
"254","29.056785400","151.101.194.187","172.20.40.110","TLSv1.2","136","Application Data"
"255","29.056889500","172.20.40.110","151.101.194.187","TCP","54","50060  >  443 [ACK] Seq=179034 Ack=9365 Win=257 Len=0"
"256","29.057853700","151.101.194.187","172.20.40.110","TLSv1.2","124","Application Data"
"257","29.089798400","172.20.40.110","151.101.194.187","TLSv1.2","2868","Application Data"
"258","29.096708600","151.101.194.187","172.20.40.110","TCP","124","[TCP Spurious Retransmission] 443  >  50060 [PSH, ACK] Seq=9365 Ack=179034 Win=3963 Len=70"
"259","29.096766600","172.20.40.110","151.101.194.187","TCP","66","[TCP Dup ACK 257#1] 50060  >  443 [ACK] Seq=181848 Ack=9435 Win=257 Len=0 SLE=9365 SRE=9435"
"260","29.100171400","151.101.194.187","172.20.40.110","TCP","60","443  >  50060 [ACK] Seq=9435 Ack=181848 Win=3963 Len=0"
"261","29.104762800","151.101.194.187","172.20.40.110","TLSv1.2","104","Application Data"
"262","29.134301400","151.101.194.187","172.20.40.110","TCP","104","[TCP Retransmission] 443  >  50060 [PSH, ACK] Seq=9435 Ack=181848 Win=3963 Len=50"
"263","29.134352900","172.20.40.110","151.101.194.187","TCP","66","50060  >  443 [ACK] Seq=181848 Ack=9485 Win=256 Len=0 SLE=9435 SRE=9485"
"264","29.153229100","172.20.40.110","151.101.194.187","TLSv1.2","2882","Application Data"
"265","29.163684500","151.101.194.187","172.20.40.110","TCP","60","443  >  50060 [ACK] Seq=9485 Ack=184676 Win=3963 Len=0"
"266","29.165059400","151.101.194.187","172.20.40.110","TLSv1.2","125","Application Data"
"267","29.196561700","151.101.194.187","172.20.40.110","TCP","125","[TCP Retransmission] 443  >  50060 [PSH, ACK] Seq=9485 Ack=184676 Win=3963 Len=71"
"268","29.196622300","172.20.40.110","151.101.194.187","TCP","66","50060  >  443 [ACK] Seq=184676 Ack=9556 Win=256 Len=0 SLE=9485 SRE=9556"
"269","29.260953100","172.20.40.110","151.101.194.187","TLSv1.2","2865","Application Data"
"270","29.270290800","151.101.194.187","172.20.40.110","TCP","60","443  >  50060 [ACK] Seq=9556 Ack=187487 Win=3963 Len=0"
"271","29.273768300","172.20.40.110","151.101.194.187","TLSv1.2","2882","Application Data"
"272","29.276364000","151.101.194.187","172.20.40.110","TLSv1.2","125","Application Data"
"273","29.282760600","151.101.194.187","172.20.40.110","TCP","60","443  >  50060 [ACK] Seq=9627 Ack=190315 Win=3963 Len=0"
"274","29.285190600","151.101.194.187","172.20.40.110","TLSv1.2","136","Application Data"
"275","29.285314100","172.20.40.110","151.101.194.187","TCP","54","50060  >  443 [ACK] Seq=190315 Ack=9709 Win=256 Len=0"
"276","29.388771200","172.20.40.110","151.101.194.187","TLSv1.2","2869","Application Data"
"277","29.398068900","151.101.194.187","172.20.40.110","TCP","60","443  >  50060 [ACK] Seq=9709 Ack=193130 Win=3963 Len=0"
"278","29.401204500","151.101.194.187","172.20.40.110","TLSv1.2","174","Application Data"
"279","29.434208500","151.101.194.187","172.20.40.110","TCP","174","[TCP Retransmission] 443  >  50060 [PSH, ACK] Seq=9709 Ack=193130 Win=3963 Len=120"
"280","29.434267900","172.20.40.110","151.101.194.187","TCP","66","50060  >  443 [ACK] Seq=193130 Ack=9829 Win=255 Len=0 SLE=9709 SRE=9829"
"281","29.479826400","172.20.40.110","151.101.194.187","TLSv1.2","2868","Application Data"
"282","29.480052300","172.20.40.110","151.101.194.187","TLSv1.2","2869","Application Data"
"283","29.490402900","151.101.194.187","172.20.40.110","TCP","60","443  >  50060 [ACK] Seq=9829 Ack=195944 Win=3963 Len=0"
"284","29.491903900","151.101.194.187","172.20.40.110","TCP","60","443  >  50060 [ACK] Seq=9829 Ack=198759 Win=3963 Len=0"
"285","29.491903900","151.101.194.187","172.20.40.110","TLSv1.2","285","Application Data"
"286","29.493925000","151.101.194.187","172.20.40.110","TLSv1.2","124","Application Data"
"287","29.493993800","172.20.40.110","151.101.194.187","TCP","54","50060  >  443 [ACK] Seq=198759 Ack=10130 Win=254 Len=0"
"288","29.775605600","172.20.40.110","151.101.194.187","TLSv1.2","2950","Application Data"
"289","29.775876200","172.20.40.110","151.101.194.187","TLSv1.2","2905","Application Data"
"290","29.776170600","172.20.40.110","151.101.194.187","TLSv1.2","2899","Application Data"
"291","29.786064600","151.101.194.187","172.20.40.110","TCP","60","443  >  50060 [ACK] Seq=10130 Ack=201655 Win=3963 Len=0"
"292","29.787660300","151.101.194.187","172.20.40.110","TLSv1.2","240","Application Data"
"293","29.788522600","151.101.194.187","172.20.40.110","TCP","60","443  >  50060 [ACK] Seq=10316 Ack=204506 Win=3963 Len=0"
"294","29.788522600","151.101.194.187","172.20.40.110","TCP","60","443  >  50060 [ACK] Seq=10316 Ack=207351 Win=3963 Len=0"
"295","29.791935800","151.101.194.187","172.20.40.110","TLSv1.2","130","Application Data"
"296","29.792035100","172.20.40.110","151.101.194.187","TCP","54","50060  >  443 [ACK] Seq=207351 Ack=10392 Win=253 Len=0"
"297","29.794357100","151.101.194.187","172.20.40.110","TLSv1.2","130","Application Data"
"298","29.811684600","172.20.40.110","151.101.194.187","TLSv1.2","2942","Application Data"
"299","29.819715800","172.20.40.110","151.101.194.187","TLSv1.2","2938","Application Data"
"300","29.820059300","172.20.40.110","151.101.194.187","TLSv1.2","2939","Application Data"
"301","29.822336900","151.101.194.187","172.20.40.110","TCP","60","443  >  50060 [ACK] Seq=10468 Ack=210239 Win=3963 Len=0"
"302","29.824838100","151.101.194.187","172.20.40.110","TLSv1.2","131","Application Data"
"303","29.828887600","151.101.194.187","172.20.40.110","TCP","60","443  >  50060 [ACK] Seq=10545 Ack=213123 Win=3963 Len=0"
"304","29.832928300","151.101.194.187","172.20.40.110","TCP","60","443  >  50060 [ACK] Seq=10545 Ack=216008 Win=3963 Len=0"
"305","29.834232000","151.101.194.187","172.20.40.110","TLSv1.2","130","Application Data"
"306","29.834320400","172.20.40.110","151.101.194.187","TCP","54","50060  >  443 [ACK] Seq=216008 Ack=10621 Win=258 Len=0"
"307","29.835295700","151.101.194.187","172.20.40.110","TLSv1.2","125","Application Data"
"308","29.845617700","172.20.40.110","151.101.194.187","TLSv1.2","2935","Application Data"
"309","29.854853800","151.101.194.187","172.20.40.110","TCP","60","443  >  50060 [ACK] Seq=10692 Ack=218889 Win=3963 Len=0"
"310","29.858271200","151.101.194.187","172.20.40.110","TLSv1.2","129","Application Data"
"311","29.893674900","151.101.194.187","172.20.40.110","TCP","129","[TCP Retransmission] 443  >  50060 [PSH, ACK] Seq=10692 Ack=218889 Win=3963 Len=75"
"312","29.893731200","172.20.40.110","151.101.194.187","TCP","66","50060  >  443 [ACK] Seq=218889 Ack=10767 Win=257 Len=0 SLE=10692 SRE=10767"
"313","34.579467300","172.20.40.110","151.101.194.187","TLSv1.2","2942","Application Data"
"314","34.582237000","172.20.40.110","151.101.194.187","TLSv1.2","2940","Application Data"
"315","34.592956400","151.101.194.187","172.20.40.110","TCP","60","443  >  50060 [ACK] Seq=10767 Ack=221777 Win=3963 Len=0"
"316","34.595539600","151.101.194.187","172.20.40.110","TLSv1.2","214","Application Data"
"317","34.598826000","151.101.194.187","172.20.40.110","TCP","60","443  >  50060 [ACK] Seq=10927 Ack=224663 Win=3963 Len=0"
"318","34.602234300","151.101.194.187","172.20.40.110","TLSv1.2","125","Application Data"
"319","34.602322600","172.20.40.110","151.101.194.187","TCP","54","50060  >  443 [ACK] Seq=224663 Ack=10998 Win=256 Len=0"
"320","34.616479300","172.20.40.110","151.101.194.187","TLSv1.2","2943","Application Data"
"321","34.632572300","151.101.194.187","172.20.40.110","TCP","60","443  >  50060 [ACK] Seq=10998 Ack=227552 Win=3963 Len=0"
"322","34.634538400","151.101.194.187","172.20.40.110","TLSv1.2","241","Application Data"
"323","34.667190200","172.20.40.110","151.101.194.187","TLSv1.2","2941","Application Data"
"324","34.670465900","151.101.194.187","172.20.40.110","TCP","241","[TCP Spurious Retransmission] 443  >  50060 [PSH, ACK] Seq=10998 Ack=227552 Win=3963 Len=187"
"325","34.670532700","172.20.40.110","151.101.194.187","TCP","66","[TCP Dup ACK 323#1] 50060  >  443 [ACK] Seq=230439 Ack=11185 Win=255 Len=0 SLE=10998 SRE=11185"
"326","34.675994300","151.101.194.187","172.20.40.110","TCP","60","443  >  50060 [ACK] Seq=11185 Ack=230439 Win=3963 Len=0"
"327","34.680106900","151.101.194.187","172.20.40.110","TLSv1.2","168","Application Data"
"328","34.714624600","151.101.194.187","172.20.40.110","TCP","168","[TCP Retransmission] 443  >  50060 [PSH, ACK] Seq=11185 Ack=230439 Win=3963 Len=114"
"329","34.714838600","172.20.40.110","151.101.194.187","TCP","66","50060  >  443 [ACK] Seq=230439 Ack=11299 Win=255 Len=0 SLE=11185 SRE=11299"
"330","40.946700400","172.20.40.110","151.101.194.187","TLSv1.2","2947","Application Data"
"331","40.955347700","172.20.40.110","151.101.194.187","TLSv1.2","2938","Application Data"
"332","40.956378000","172.20.40.110","151.101.194.187","TLSv1.2","2932","Application Data"
"333","40.961875400","151.101.194.187","172.20.40.110","TCP","60","443  >  50060 [ACK] Seq=11299 Ack=233332 Win=3963 Len=0"
"334","40.963323500","151.101.194.187","172.20.40.110","TLSv1.2","369","Application Data"
"335","40.964542500","151.101.194.187","172.20.40.110","TCP","60","443  >  50060 [ACK] Seq=11614 Ack=236216 Win=3963 Len=0"
"336","40.966925400","151.101.194.187","172.20.40.110","TCP","60","443  >  50060 [ACK] Seq=11614 Ack=239094 Win=3963 Len=0"
"337","40.968300000","151.101.194.187","172.20.40.110","TLSv1.2","124","Application Data"
"338","40.968374000","172.20.40.110","151.101.194.187","TCP","54","50060  >  443 [ACK] Seq=239094 Ack=11684 Win=254 Len=0"
"339","40.972633700","151.101.194.187","172.20.40.110","TLSv1.2","131","Application Data"
"340","41.009438000","151.101.194.187","172.20.40.110","TCP","131","[TCP Retransmission] 443  >  50060 [PSH, ACK] Seq=11684 Ack=239094 Win=3963 Len=77"
"341","41.009492700","172.20.40.110","151.101.194.187","TCP","66","50060  >  443 [ACK] Seq=239094 Ack=11761 Win=253 Len=0 SLE=11684 SRE=11761"
"342","41.141268400","172.20.40.110","151.101.194.187","TLSv1.2","2946","Application Data"
"343","41.152011300","151.101.194.187","172.20.40.110","TCP","60","443  >  50060 [ACK] Seq=11761 Ack=241986 Win=3963 Len=0"
"344","41.156775800","151.101.194.187","172.20.40.110","TLSv1.2","130","Application Data"
"345","41.177205600","172.20.40.110","151.101.194.187","TLSv1.2","2946","Application Data"
"346","41.186050100","151.101.194.187","172.20.40.110","TCP","60","443  >  50060 [ACK] Seq=11837 Ack=244878 Win=3963 Len=0"
"347","41.190313600","151.101.194.187","172.20.40.110","TLSv1.2","125","Application Data"
"348","41.228107000","151.101.194.187","172.20.40.110","TCP","125","[TCP Retransmission] 443  >  50060 [PSH, ACK] Seq=11837 Ack=244878 Win=3963 Len=71"
"349","41.228218200","172.20.40.110","151.101.194.187","TCP","66","50060  >  443 [ACK] Seq=244878 Ack=11908 Win=258 Len=0 SLE=11837 SRE=11908"
"350","41.292014500","172.20.40.110","151.101.194.187","TLSv1.2","2933","Application Data"
"351","41.295679400","172.20.40.110","151.101.194.187","TLSv1.2","2929","Application Data"
"352","41.303312500","151.101.194.187","172.20.40.110","TCP","60","443  >  50060 [ACK] Seq=11908 Ack=247757 Win=3963 Len=0"
"353","41.306568100","151.101.194.187","172.20.40.110","TLSv1.2","130","Application Data"
"354","41.306568100","151.101.194.187","172.20.40.110","TCP","60","443  >  50060 [ACK] Seq=11984 Ack=250632 Win=3963 Len=0"
"355","41.308269400","151.101.194.187","172.20.40.110","TLSv1.2","125","Application Data"
"356","41.308342200","172.20.40.110","151.101.194.187","TCP","54","50060  >  443 [ACK] Seq=250632 Ack=12055 Win=258 Len=0"
"357","41.340277500","172.20.40.110","151.101.194.187","TLSv1.2","2938","Application Data"
"358","41.340531100","172.20.40.110","151.101.194.187","TLSv1.2","2929","Application Data"
"359","41.352624900","151.101.194.187","172.20.40.110","TCP","60","443  >  50060 [ACK] Seq=12055 Ack=253516 Win=3963 Len=0"
"360","41.352624900","151.101.194.187","172.20.40.110","TCP","60","443  >  50060 [ACK] Seq=12055 Ack=256391 Win=3963 Len=0"
"361","41.356952400","151.101.194.187","172.20.40.110","TLSv1.2","130","Application Data"
"362","41.358299700","151.101.194.187","172.20.40.110","TLSv1.2","131","Application Data"
"363","41.358378100","172.20.40.110","151.101.194.187","TCP","54","50060  >  443 [ACK] Seq=256391 Ack=12208 Win=257 Len=0"
"364","41.479920800","172.20.40.110","151.101.194.187","TLSv1.2","2938","Application Data"
"365","41.482780800","172.20.40.110","151.101.194.187","TLSv1.2","2946","Application Data"
"366","41.487338200","172.20.40.110","151.101.194.187","TLSv1.2","2934","Application Data"
"367","41.487950700","172.20.40.110","151.101.194.187","TLSv1.2","2935","Application Data"
"368","41.489899800","151.101.194.187","172.20.40.110","TCP","60","443  >  50060 [ACK] Seq=12208 Ack=259275 Win=3963 Len=0"
"369","41.492871000","151.101.194.187","172.20.40.110","TCP","60","443  >  50060 [ACK] Seq=12208 Ack=262167 Win=3963 Len=0"
"370","41.497746800","151.101.194.187","172.20.40.110","TLSv1.2","130","Application Data"
"371","41.503358300","151.101.194.187","172.20.40.110","TLSv1.2","124","Application Data"
"372","41.503358300","151.101.194.187","172.20.40.110","TCP","60","443  >  50060 [ACK] Seq=12354 Ack=265047 Win=3963 Len=0"
"373","41.503358300","151.101.194.187","172.20.40.110","TCP","60","443  >  50060 [ACK] Seq=12354 Ack=267928 Win=3963 Len=0"
"374","41.503358300","151.101.194.187","172.20.40.110","TLSv1.2","130","Application Data"
"375","41.503358300","151.101.194.187","172.20.40.110","TLSv1.2","124","Application Data"
"376","41.503591200","172.20.40.110","151.101.194.187","TCP","54","50060  >  443 [ACK] Seq=267928 Ack=12500 Win=256 Len=0"
"377","47.075271200","172.20.40.110","151.101.194.187","TLSv1.2","2946","Application Data"
"378","47.086209600","172.20.40.110","151.101.194.187","TLSv1.2","2944","Application Data"
"379","47.089215600","151.101.194.187","172.20.40.110","TCP","60","443  >  50060 [ACK] Seq=12500 Ack=270820 Win=3963 Len=0"
"380","47.090358800","151.101.194.187","172.20.40.110","TLSv1.2","220","Application Data"
"381","47.096125700","151.101.194.187","172.20.40.110","TCP","60","443  >  50060 [ACK] Seq=12666 Ack=273710 Win=3963 Len=0"
"382","47.099385600","151.101.194.187","172.20.40.110","TLSv1.2","169","Application Data"
"383","47.099478600","172.20.40.110","151.101.194.187","TCP","54","50060  >  443 [ACK] Seq=273710 Ack=12781 Win=255 Len=0"
"384","47.114541300","172.20.40.110","151.101.194.187","TLSv1.2","2947","Application Data"
"385","47.123855800","151.101.194.187","172.20.40.110","TCP","60","443  >  50060 [ACK] Seq=12781 Ack=276603 Win=3963 Len=0"
"386","47.127368900","151.101.194.187","172.20.40.110","TLSv1.2","125","Application Data"
"387","47.164065200","151.101.194.187","172.20.40.110","TCP","125","[TCP Retransmission] 443  >  50060 [PSH, ACK] Seq=12781 Ack=276603 Win=3963 Len=71"
"388","47.164125900","172.20.40.110","151.101.194.187","TCP","66","50060  >  443 [ACK] Seq=276603 Ack=12852 Win=255 Len=0 SLE=12781 SRE=12852"
"389","47.181017000","172.20.40.110","151.101.194.187","TLSv1.2","2945","Application Data"
"390","47.189568200","151.101.194.187","172.20.40.110","TCP","60","443  >  50060 [ACK] Seq=12852 Ack=279494 Win=3963 Len=0"
"391","47.196604500","151.101.194.187","172.20.40.110","TLSv1.2","279","Application Data"
"392","47.232235300","151.101.194.187","172.20.40.110","TCP","279","[TCP Retransmission] 443  >  50060 [PSH, ACK] Seq=12852 Ack=279494 Win=3963 Len=225"
"393","47.232298700","172.20.40.110","151.101.194.187","TCP","66","50060  >  443 [ACK] Seq=279494 Ack=13077 Win=254 Len=0 SLE=12852 SRE=13077"
"394","52.994559800","172.20.40.110","151.101.194.187","TLSv1.2","2954","Application Data"
"395","53.002231300","172.20.40.110","151.101.194.187","TLSv1.2","2945","Application Data"
"396","53.005614900","172.20.40.110","151.101.194.187","TLSv1.2","2939","Application Data"
"397","53.008266100","151.101.194.187","172.20.40.110","TCP","60","443  >  50060 [ACK] Seq=13077 Ack=282394 Win=3963 Len=0"
"398","53.010104100","151.101.194.187","172.20.40.110","TLSv1.2","214","Application Data"
"399","53.011114500","151.101.194.187","172.20.40.110","TCP","60","443  >  50060 [ACK] Seq=13237 Ack=285285 Win=3963 Len=0"
"400","53.013516400","151.101.194.187","172.20.40.110","TLSv1.2","124","Application Data"
"401","53.013598100","172.20.40.110","151.101.194.187","TCP","54","50060  >  443 [ACK] Seq=288170 Ack=13307 Win=258 Len=0"
"402","53.014585500","151.101.194.187","172.20.40.110","TCP","60","443  >  50060 [ACK] Seq=13307 Ack=288170 Win=3963 Len=0"
"403","53.017028500","151.101.194.187","172.20.40.110","TLSv1.2","131","Application Data"
"404","53.055912500","151.101.194.187","172.20.40.110","TCP","131","[TCP Retransmission] 443  >  50060 [PSH, ACK] Seq=13307 Ack=288170 Win=3963 Len=77"
"405","53.055998300","172.20.40.110","151.101.194.187","TCP","66","50060  >  443 [ACK] Seq=288170 Ack=13384 Win=258 Len=0 SLE=13307 SRE=13384"
"406","53.066240400","172.20.40.110","151.101.194.187","TLSv1.2","2939","Application Data"
"407","53.074811600","151.101.194.187","172.20.40.110","TCP","60","443  >  50060 [ACK] Seq=13384 Ack=291055 Win=3963 Len=0"
"408","53.079596500","151.101.194.187","172.20.40.110","TLSv1.2","130","Application Data"
"409","53.101314700","172.20.40.110","151.101.194.187","TLSv1.2","2951","Application Data"
"410","53.110783400","151.101.194.187","172.20.40.110","TCP","60","443  >  50060 [ACK] Seq=13460 Ack=293952 Win=3963 Len=0"
"411","53.113433300","151.101.194.187","172.20.40.110","TLSv1.2","104","Application Data"
"412","53.152659100","151.101.194.187","172.20.40.110","TCP","104","[TCP Retransmission] 443  >  50060 [PSH, ACK] Seq=13460 Ack=293952 Win=3963 Len=50"
"413","53.152740600","172.20.40.110","151.101.194.187","TCP","66","50060  >  443 [ACK] Seq=293952 Ack=13510 Win=257 Len=0 SLE=13460 SRE=13510"
"414","53.199548500","172.20.40.110","151.101.194.187","TLSv1.2","2936","Application Data"
"415","53.209242800","151.101.194.187","172.20.40.110","TCP","60","443  >  50060 [ACK] Seq=13510 Ack=296834 Win=3963 Len=0"
"416","53.211904500","151.101.194.187","172.20.40.110","TLSv1.2","125","Application Data"
"417","53.216095600","172.20.40.110","151.101.194.187","TLSv1.2","2953","Application Data"
"418","53.225472700","151.101.194.187","172.20.40.110","TCP","60","443  >  50060 [ACK] Seq=13581 Ack=299733 Win=3963 Len=0"
"419","53.227846500","151.101.194.187","172.20.40.110","TLSv1.2","130","Application Data"
"420","53.245477100","172.20.40.110","151.101.194.187","TLSv1.2","2953","Application Data"
"421","53.255987500","151.101.194.187","172.20.40.110","TCP","60","443  >  50060 [ACK] Seq=13657 Ack=302632 Win=3963 Len=0"
"422","53.257337100","151.101.194.187","172.20.40.110","TLSv1.2","125","Application Data"
"423","53.297082100","151.101.194.187","172.20.40.110","TCP","125","[TCP Retransmission] 443  >  50060 [PSH, ACK] Seq=13657 Ack=302632 Win=3963 Len=71"
"424","53.297146600","172.20.40.110","151.101.194.187","TCP","66","50060  >  443 [ACK] Seq=302632 Ack=13728 Win=257 Len=0 SLE=13657 SRE=13728"
"425","53.384916900","172.20.40.110","151.101.194.187","TLSv1.2","2940","Application Data"
"426","53.395858700","151.101.194.187","172.20.40.110","TCP","60","443  >  50060 [ACK] Seq=13728 Ack=305518 Win=3963 Len=0"
"427","53.399052800","151.101.194.187","172.20.40.110","TLSv1.2","124","Application Data"
"428","53.437277300","151.101.194.187","172.20.40.110","TCP","124","[TCP Retransmission] 443  >  50060 [PSH, ACK] Seq=13728 Ack=305518 Win=3963 Len=70"
"429","53.437338100","172.20.40.110","151.101.194.187","TCP","66","50060  >  443 [ACK] Seq=305518 Ack=13798 Win=256 Len=0 SLE=13728 SRE=13798"
"430","53.507459700","172.20.40.110","151.101.194.187","TLSv1.2","2943","Application Data"
"431","53.508969500","172.20.40.110","151.101.194.187","TLSv1.2","2942","Application Data"
"432","53.509203600","172.20.40.110","151.101.194.187","TLSv1.2","2939","Application Data"
"433","53.509315800","172.20.40.110","151.101.194.187","TLSv1.2","2940","Application Data"
"434","53.509402900","172.20.40.110","151.101.194.187","TLSv1.2","2942","Application Data"
"435","53.510050700","172.20.40.110","151.101.194.187","TLSv1.2","2941","Application Data"
"436","53.510573600","172.20.40.110","151.101.194.187","TLSv1.2","2938","Application Data"
"437","53.523522300","151.101.194.187","172.20.40.110","TCP","60","443  >  50060 [ACK] Seq=13798 Ack=308407 Win=3963 Len=0"
"438","53.523522300","151.101.194.187","172.20.40.110","TCP","60","443  >  50060 [ACK] Seq=13798 Ack=311295 Win=3963 Len=0"
"439","53.547261800","151.101.194.187","172.20.40.110","TLSv1.2","135","Application Data"
"440","53.547261800","151.101.194.187","172.20.40.110","TLSv1.2","125","Application Data"
"441","53.547261800","151.101.194.187","172.20.40.110","TCP","60","443  >  50060 [ACK] Seq=13950 Ack=314180 Win=3963 Len=0"
"442","53.547359300","172.20.40.110","151.101.194.187","TCP","54","50060  >  443 [ACK] Seq=325725 Ack=13950 Win=256 Len=0"
"443","53.551123200","151.101.194.187","172.20.40.110","TLSv1.2","130","Application Data"
"444","53.552830500","151.101.194.187","172.20.40.110","TCP","60","443  >  50060 [ACK] Seq=14026 Ack=317066 Win=3969 Len=0"
"445","53.552830500","151.101.194.187","172.20.40.110","TCP","60","443  >  50060 [ACK] Seq=14026 Ack=319954 Win=3969 Len=0"
"446","53.552830500","151.101.194.187","172.20.40.110","TCP","60","443  >  50060 [ACK] Seq=14026 Ack=322841 Win=3969 Len=0"
"447","53.552830500","151.101.194.187","172.20.40.110","TCP","60","443  >  50060 [ACK] Seq=14026 Ack=325725 Win=3969 Len=0"
"448","53.558292600","151.101.194.187","172.20.40.110","TLSv1.2","179","Application Data"
"449","53.558387400","172.20.40.110","151.101.194.187","TCP","54","50060  >  443 [ACK] Seq=325725 Ack=14151 Win=255 Len=0"
"450","53.559308400","151.101.194.187","172.20.40.110","TLSv1.2","124","Application Data"
"451","53.560457900","151.101.194.187","172.20.40.110","TLSv1.2","168","Application Data"
"452","53.560529100","172.20.40.110","151.101.194.187","TCP","54","50060  >  443 [ACK] Seq=325725 Ack=14335 Win=254 Len=0"
"453","53.733211800","172.20.40.110","151.101.194.187","TLSv1.2","2904","Application Data"
"454","53.739094300","172.20.40.110","151.101.194.187","TLSv1.2","2933","Application Data"
"455","53.742553500","151.101.194.187","172.20.40.110","TCP","60","443  >  50060 [ACK] Seq=14335 Ack=328575 Win=3969 Len=0"
"456","53.747037300","151.101.194.187","172.20.40.110","TLSv1.2","389","Application Data"
"457","53.749100000","151.101.194.187","172.20.40.110","TCP","60","443  >  50060 [ACK] Seq=14670 Ack=331454 Win=3969 Len=0"
"458","53.753621800","151.101.194.187","172.20.40.110","TLSv1.2","130","Application Data"
"459","53.753721000","172.20.40.110","151.101.194.187","TCP","54","50060  >  443 [ACK] Seq=331454 Ack=14746 Win=258 Len=0"
