"No.","Time","Source","Destination","Protocol","Length","Info"
"1","0.000000000","100.84.170.161","151.101.66.187","TLSv1.2","2527","Application Data"
"2","0.000134900","100.84.170.161","151.101.66.187","TLSv1.2","93","Application Data"
"3","0.004341900","100.84.170.161","151.101.66.187","TLSv1.2","2521","Application Data"
"4","0.008961000","151.101.66.187","100.84.170.161","TCP","56","443  >  59747 [ACK] Seq=1 Ack=2513 Win=2894 Len=0"
"5","0.009222900","151.101.66.187","100.84.170.161","TLSv1.2","93","Application Data"
"6","0.012018800","151.101.66.187","100.84.170.161","TLSv1.2","220","Application Data"
"7","0.012051200","100.84.170.161","151.101.66.187","TCP","54","59747  >  443 [ACK] Seq=4980 Ack=206 Win=4102 Len=0"
"8","0.013650500","151.101.66.187","100.84.170.161","TCP","56","443  >  59747 [ACK] Seq=206 Ack=4980 Win=2904 Len=0"
"9","0.016570800","151.101.66.187","100.84.170.161","TLSv1.2","125","Application Data"
"10","0.040275300","100.84.170.161","151.101.66.187","TLSv1.2","2515","Application Data"
"11","0.042080300","100.84.170.161","151.101.66.187","TLSv1.2","2512","Application Data"
"12","0.049524400","151.101.66.187","100.84.170.161","TCP","56","443  >  59747 [ACK] Seq=277 Ack=7441 Win=2913 Len=0"
"13","0.050561000","151.101.66.187","100.84.170.161","TCP","56","443  >  59747 [ACK] Seq=277 Ack=9899 Win=2923 Len=0"
"14","0.052108500","151.101.66.187","100.84.170.161","TLSv1.2","135","Application Data"
"15","0.053291600","151.101.66.187","100.84.170.161","TLSv1.2","124","Application Data"
"16","0.053354500","100.84.170.161","151.101.66.187","TCP","54","59747  >  443 [ACK] Seq=9899 Ack=428 Win=4101 Len=0"
"17","6.037884800","100.84.170.161","151.101.66.187","TLSv1.2","2412","Application Data"
"18","6.049210900","151.101.66.187","100.84.170.161","TCP","56","443  >  59747 [ACK] Seq=428 Ack=12257 Win=2932 Len=0"
"19","6.051534700","151.101.66.187","100.84.170.161","TLSv1.2","273","Application Data"
"20","6.089206900","151.101.66.187","100.84.170.161","TCP","273","[TCP Retransmission] 443  >  59747 [PSH, ACK] Seq=428 Ack=12257 Win=2932 Len=219"
"21","6.089242300","100.84.170.161","151.101.66.187","TCP","66","59747  >  443 [ACK] Seq=12257 Ack=647 Win=4101 Len=0 SLE=428 SRE=647"
"22","6.120361600","100.84.170.161","151.101.66.187","TLSv1.2","2451","Application Data"
"23","6.129458400","151.101.66.187","100.84.170.161","TCP","56","443  >  59747 [ACK] Seq=647 Ack=14654 Win=2942 Len=0"
"24","6.131412500","151.101.66.187","100.84.170.161","TLSv1.2","170","Application Data"
"25","6.170296300","151.101.66.187","100.84.170.161","TCP","170","[TCP Retransmission] 443  >  59747 [PSH, ACK] Seq=647 Ack=14654 Win=2942 Len=116"
"26","6.170319500","100.84.170.161","151.101.66.187","TCP","66","59747  >  443 [ACK] Seq=14654 Ack=763 Win=4100 Len=0 SLE=647 SRE=763"
"27","6.283864000","100.84.170.161","151.101.66.187","TLSv1.2","2437","Application Data"
"28","6.292722000","151.101.66.187","100.84.170.161","TCP","56","443  >  59747 [ACK] Seq=763 Ack=17037 Win=2951 Len=0"
"29","6.296025000","151.101.66.187","100.84.170.161","TLSv1.2","202","Application Data"
"30","6.333150300","151.101.66.187","100.84.170.161","TCP","202","[TCP Retransmission] 443  >  59747 [PSH, ACK] Seq=763 Ack=17037 Win=2951 Len=148"
"31","6.333191900","100.84.170.161","151.101.66.187","TCP","66","59747  >  443 [ACK] Seq=17037 Ack=911 Win=4106 Len=0 SLE=763 SRE=911"
"32","6.785692900","100.84.170.161","151.101.66.187","TLSv1.2","2449","Application Data"
"33","6.794441400","151.101.66.187","100.84.170.161","TCP","56","443  >  59747 [ACK] Seq=911 Ack=19432 Win=2960 Len=0"
"34","6.797314100","151.101.66.187","100.84.170.161","TLSv1.2","131","Application Data"
"35","6.835128100","151.101.66.187","100.84.170.161","TCP","131","[TCP Retransmission] 443  >  59747 [PSH, ACK] Seq=911 Ack=19432 Win=2960 Len=77"
"36","6.835177600","100.84.170.161","151.101.66.187","TCP","66","59747  >  443 [ACK] Seq=19432 Ack=988 Win=4105 Len=0 SLE=911 SRE=988"
"37","7.205608400","100.84.170.161","151.101.66.187","TLSv1.2","2450","Application Data"
"38","7.216502300","151.101.66.187","100.84.170.161","TCP","56","443  >  59747 [ACK] Seq=988 Ack=21828 Win=2970 Len=0"
"39","7.218156000","151.101.66.187","100.84.170.161","TLSv1.2","234","Application Data"
"40","7.255912900","100.84.170.161","151.101.66.187","TLSv1.2","2451","Application Data"
"41","7.257176900","151.101.66.187","100.84.170.161","TCP","234","[TCP Spurious Retransmission] 443  >  59747 [PSH, ACK] Seq=988 Ack=21828 Win=2970 Len=180"
"42","7.257219500","100.84.170.161","151.101.66.187","TCP","66","[TCP Dup ACK 40#1] 59747  >  443 [ACK] Seq=24225 Ack=1168 Win=4105 Len=0 SLE=988 SRE=1168"
"43","7.264651900","151.101.66.187","100.84.170.161","TCP","56","443  >  59747 [ACK] Seq=1168 Ack=24225 Win=2979 Len=0"
"44","7.267353200","151.101.66.187","100.84.170.161","TLSv1.2","124","Application Data"
"45","7.305992600","151.101.66.187","100.84.170.161","TCP","124","[TCP Retransmission] 443  >  59747 [PSH, ACK] Seq=1168 Ack=24225 Win=2979 Len=70"
"46","7.306036000","100.84.170.161","151.101.66.187","TCP","66","59747  >  443 [ACK] Seq=24225 Ack=1238 Win=4104 Len=0 SLE=1168 SRE=1238"
"47","7.648857400","100.84.170.161","151.101.66.187","TLSv1.2","2451","Application Data"
"48","7.656968500","100.84.170.161","151.101.66.187","TLSv1.2","2452","Application Data"
"49","7.658810600","151.101.66.187","100.84.170.161","TCP","56","443  >  59747 [ACK] Seq=1238 Ack=26622 Win=2988 Len=0"
"50","7.661127900","151.101.66.187","100.84.170.161","TLSv1.2","104","Application Data"
"51","7.665712700","151.101.66.187","100.84.170.161","TCP","56","443  >  59747 [ACK] Seq=1288 Ack=29020 Win=2998 Len=0"
"52","7.669372400","151.101.66.187","100.84.170.161","TLSv1.2","98","Application Data"
"53","7.669502200","100.84.170.161","151.101.66.187","TCP","54","59747  >  443 [ACK] Seq=29020 Ack=1332 Win=4104 Len=0"
"54","7.680267000","100.84.170.161","151.101.66.187","TLSv1.2","2446","Application Data"
"55","7.689368100","151.101.66.187","100.84.170.161","TCP","56","443  >  59747 [ACK] Seq=1332 Ack=31412 Win=3007 Len=0"
"56","7.692257100","151.101.66.187","100.84.170.161","TLSv1.2","130","Application Data"
"57","7.723988200","100.84.170.161","151.101.66.187","TLSv1.2","2443","Application Data"
"58","7.724714900","100.84.170.161","151.101.66.187","TLSv1.2","2434","Application Data"
"59","7.730405300","151.101.66.187","100.84.170.161","TCP","130","[TCP Spurious Retransmission] 443  >  59747 [PSH, ACK] Seq=1332 Ack=31412 Win=3007 Len=76"
"60","7.730450600","100.84.170.161","151.101.66.187","TCP","66","[TCP Dup ACK 57#1] 59747  >  443 [ACK] Seq=36181 Ack=1408 Win=4104 Len=0 SLE=1332 SRE=1408"
"61","7.732959700","151.101.66.187","100.84.170.161","TCP","56","443  >  59747 [ACK] Seq=1408 Ack=33801 Win=3016 Len=0"
"62","7.733732500","151.101.66.187","100.84.170.161","TCP","56","443  >  59747 [ACK] Seq=1408 Ack=36181 Win=3026 Len=0"
"63","7.735756400","151.101.66.187","100.84.170.161","TLSv1.2","124","Application Data"
"64","7.739199900","151.101.66.187","100.84.170.161","TLSv1.2","124","Application Data"
"65","7.739255400","100.84.170.161","151.101.66.187","TCP","54","59747  >  443 [ACK] Seq=36181 Ack=1548 Win=4103 Len=0"
"66","7.773859300","100.84.170.161","151.101.66.187","TLSv1.2","2479","Application Data"
"67","7.774159300","100.84.170.161","151.101.66.187","TLSv1.2","2476","Application Data"
"68","7.782954800","151.101.66.187","100.84.170.161","TCP","56","443  >  59747 [ACK] Seq=1548 Ack=41028 Win=3045 Len=0"
"69","7.785296300","151.101.66.187","100.84.170.161","TLSv1.2","104","Application Data"
"70","7.785525300","151.101.66.187","100.84.170.161","TLSv1.2","142","Application Data"
"71","7.785564300","100.84.170.161","151.101.66.187","TCP","54","59747  >  443 [ACK] Seq=41028 Ack=1686 Win=4103 Len=0"
"72","7.932916800","100.84.170.161","151.101.66.187","TLSv1.2","2434","Application Data"
"73","7.941640700","151.101.66.187","100.84.170.161","TCP","56","443  >  59747 [ACK] Seq=1686 Ack=43408 Win=3054 Len=0"
"74","7.944442100","151.101.66.187","100.84.170.161","TLSv1.2","98","Application Data"
"75","7.973619600","100.84.170.161","151.101.66.187","TLSv1.2","2432","Application Data"
"76","7.980138700","151.101.66.187","100.84.170.161","TCP","98","[TCP Spurious Retransmission] 443  >  59747 [PSH, ACK] Seq=1686 Ack=43408 Win=3054 Len=44"
"77","7.980187300","100.84.170.161","151.101.66.187","TCP","66","[TCP Dup ACK 75#1] 59747  >  443 [ACK] Seq=45786 Ack=1730 Win=4103 Len=0 SLE=1686 SRE=1730"
"78","7.982834900","151.101.66.187","100.84.170.161","TCP","56","443  >  59747 [ACK] Seq=1730 Ack=45786 Win=3063 Len=0"
"79","7.985333500","151.101.66.187","100.84.170.161","TLSv1.2","208","Application Data"
"80","8.022365400","151.101.66.187","100.84.170.161","TCP","208","[TCP Retransmission] 443  >  59747 [PSH, ACK] Seq=1730 Ack=45786 Win=3063 Len=154"
"81","8.022414500","100.84.170.161","151.101.66.187","TCP","66","59747  >  443 [ACK] Seq=45786 Ack=1884 Win=4102 Len=0 SLE=1730 SRE=1884"
"82","8.133097300","100.84.170.161","151.101.66.187","TLSv1.2","2435","Application Data"
"83","8.144929100","151.101.66.187","100.84.170.161","TCP","56","443  >  59747 [ACK] Seq=1884 Ack=48167 Win=3072 Len=0"
"84","8.146763600","151.101.66.187","100.84.170.161","TLSv1.2","104","Application Data"
"85","8.181169600","151.101.66.187","100.84.170.161","TCP","104","[TCP Retransmission] 443  >  59747 [PSH, ACK] Seq=1884 Ack=48167 Win=3072 Len=50"
"86","8.181212400","100.84.170.161","151.101.66.187","TCP","66","59747  >  443 [ACK] Seq=48167 Ack=1934 Win=4102 Len=0 SLE=1884 SRE=1934"
"87","8.422071700","100.84.170.161","151.101.66.187","TLSv1.2","2437","Application Data"
"88","8.431224500","151.101.66.187","100.84.170.161","TCP","56","443  >  59747 [ACK] Seq=1934 Ack=50550 Win=3082 Len=0"
"89","8.433802900","151.101.66.187","100.84.170.161","TLSv1.2","98","Application Data"
"90","8.468338100","151.101.66.187","100.84.170.161","TCP","98","[TCP Retransmission] 443  >  59747 [PSH, ACK] Seq=1934 Ack=50550 Win=3082 Len=44"
"91","8.468379900","100.84.170.161","151.101.66.187","TCP","66","59747  >  443 [ACK] Seq=50550 Ack=1978 Win=4102 Len=0 SLE=1934 SRE=1978"
"92","11.773356500","100.84.170.161","151.101.66.187","TLSv1.2","2443","Application Data"
"93","11.776002600","100.84.170.161","151.101.66.187","TLSv1.2","2444","Application Data"
"94","11.783071500","151.101.66.187","100.84.170.161","TCP","56","443  >  59747 [ACK] Seq=1978 Ack=52939 Win=3091 Len=0"
"95","11.784796600","151.101.66.187","100.84.170.161","TCP","56","443  >  59747 [ACK] Seq=1978 Ack=55329 Win=3100 Len=0"
"96","11.785866600","151.101.66.187","100.84.170.161","TLSv1.2","214","Application Data"
"97","11.788123500","151.101.66.187","100.84.170.161","TLSv1.2","98","Application Data"
"98","11.788189800","100.84.170.161","151.101.66.187","TCP","54","59747  >  443 [ACK] Seq=55329 Ack=2182 Win=4101 Len=0"
"99","12.171166200","100.84.170.161","151.101.66.187","TLSv1.2","2444","Application Data"
"100","12.180018000","151.101.66.187","100.84.170.161","TCP","56","443  >  59747 [ACK] Seq=2182 Ack=57719 Win=3110 Len=0"
"101","12.182388600","151.101.66.187","100.84.170.161","TLSv1.2","208","Application Data"
"102","12.216459800","151.101.66.187","100.84.170.161","TCP","208","[TCP Retransmission] 443  >  59747 [PSH, ACK] Seq=2182 Ack=57719 Win=3110 Len=154"
"103","12.216501500","100.84.170.161","151.101.66.187","TCP","66","59747  >  443 [ACK] Seq=57719 Ack=2336 Win=4100 Len=0 SLE=2182 SRE=2336"
"104","12.914801900","100.84.170.161","151.101.66.187","TLSv1.2","2441","Application Data"
"105","12.923633200","151.101.66.187","100.84.170.161","TCP","56","443  >  59747 [ACK] Seq=2336 Ack=60106 Win=3119 Len=0"
"106","12.928260600","151.101.66.187","100.84.170.161","TLSv1.2","109","Application Data"
"107","12.978240700","100.84.170.161","151.101.66.187","TCP","54","59747  >  443 [ACK] Seq=60106 Ack=2391 Win=4106 Len=0"
"108","13.224197900","100.84.170.161","151.101.66.187","TLSv1.2","2442","Application Data"
"109","13.232895800","151.101.66.187","100.84.170.161","TCP","56","443  >  59747 [ACK] Seq=2391 Ack=62494 Win=3128 Len=0"
"110","13.235578800","151.101.66.187","100.84.170.161","TLSv1.2","208","Application Data"
"111","13.281497400","100.84.170.161","151.101.66.187","TCP","54","59747  >  443 [ACK] Seq=62494 Ack=2545 Win=4105 Len=0"
"112","13.306547500","100.84.170.161","151.101.66.187","TLSv1.2","2438","Application Data"
"113","13.328091900","100.84.170.161","151.101.66.187","TCP","1514","[TCP Retransmission] 59747  >  443 [PSH, ACK] Seq=63418 Ack=2545 Win=4105 Len=1460"
"114","13.342318700","151.101.66.187","100.84.170.161","TCP","56","443  >  59747 [ACK] Seq=2545 Ack=64878 Win=3138 Len=0"
"115","13.342318700","151.101.66.187","100.84.170.161","TLSv1.2","130","Application Data"
"116","13.386731500","100.84.170.161","151.101.66.187","TCP","54","59747  >  443 [ACK] Seq=64878 Ack=2621 Win=4105 Len=0"
"117","13.582033900","100.84.170.161","151.101.66.187","TLSv1.2","2443","Application Data"
"118","13.582736600","100.84.170.161","151.101.66.187","TLSv1.2","2431","Application Data"
"119","13.585599000","100.84.170.161","151.101.66.187","TLSv1.2","2425","Application Data"
"120","13.591290900","100.84.170.161","151.101.66.187","TLSv1.2","2444","Application Data"
"121","13.599438700","151.101.66.187","100.84.170.161","TCP","66","[TCP Dup ACK 114#1] 443  >  59747 [ACK] Seq=2621 Ack=64878 Win=3138 Len=0 SLE=63418 SRE=64878"
"122","13.599438700","151.101.66.187","100.84.170.161","TCP","130","[TCP Spurious Retransmission] 443  >  59747 [PSH, ACK] Seq=2545 Ack=64878 Win=3138 Len=76"
"123","13.600125300","100.84.170.161","151.101.66.187","TCP","66","[TCP Dup ACK 116#1] 59747  >  443 [ACK] Seq=74405 Ack=2621 Win=4105 Len=0 SLE=2545 SRE=2621"
"124","13.600616600","151.101.66.187","100.84.170.161","TCP","56","443  >  59747 [ACK] Seq=2621 Ack=69644 Win=3156 Len=0"
"125","13.600616600","151.101.66.187","100.84.170.161","TCP","56","443  >  59747 [ACK] Seq=2621 Ack=72015 Win=3166 Len=0"
"126","13.600616600","151.101.66.187","100.84.170.161","TLSv1.2","104","Application Data"
"127","13.600616600","151.101.66.187","100.84.170.161","TLSv1.2","175","Application Data"
"128","13.600616600","151.101.66.187","100.84.170.161","TLSv1.2","208","Application Data"
"129","13.600882400","100.84.170.161","151.101.66.187","TCP","54","59747  >  443 [ACK] Seq=74405 Ack=2946 Win=4104 Len=0"
"130","13.625372400","100.84.170.161","151.101.66.187","TCP","1514","[TCP Retransmission] 59747  >  443 [PSH, ACK] Seq=72945 Ack=2946 Win=4104 Len=1460"
"131","13.644502100","151.101.66.187","100.84.170.161","TCP","56","443  >  59747 [ACK] Seq=2946 Ack=74405 Win=3175 Len=0"
"132","13.644502100","151.101.66.187","100.84.170.161","TLSv1.2","125","Application Data"
"133","13.651859400","151.101.66.187","100.84.170.161","TCP","66","[TCP Dup ACK 131#1] 443  >  59747 [ACK] Seq=3017 Ack=74405 Win=3175 Len=0 SLE=72945 SRE=74405"
"134","13.685363700","100.84.170.161","151.101.66.187","TCP","54","59747  >  443 [ACK] Seq=74405 Ack=3017 Win=4103 Len=0"
"135","13.711551700","151.101.66.187","100.84.170.161","TCP","125","[TCP Spurious Retransmission] 443  >  59747 [PSH, ACK] Seq=2946 Ack=74405 Win=3175 Len=71"
"136","13.711590600","100.84.170.161","151.101.66.187","TCP","66","[TCP Dup ACK 134#1] 59747  >  443 [ACK] Seq=74405 Ack=3017 Win=4103 Len=0 SLE=2946 SRE=3017"
"137","13.719122500","100.84.170.161","151.101.66.187","TLSv1.2","2447","Application Data"
"138","13.727877700","151.101.66.187","100.84.170.161","TCP","56","443  >  59747 [ACK] Seq=3017 Ack=76798 Win=3184 Len=0"
"139","13.730253100","151.101.66.187","100.84.170.161","TLSv1.2","124","Application Data"
"140","13.738259400","100.84.170.161","151.101.66.187","TLSv1.2","2438","Application Data"
"141","13.760373900","100.84.170.161","151.101.66.187","TCP","1514","[TCP Retransmission] 59747  >  443 [PSH, ACK] Seq=77722 Ack=3087 Win=4103 Len=1460"
"142","13.784230300","151.101.66.187","100.84.170.161","TCP","124","[TCP Spurious Retransmission] 443  >  59747 [PSH, ACK] Seq=3017 Ack=76798 Win=3184 Len=70"
"143","13.784274200","100.84.170.161","151.101.66.187","TCP","66","[TCP Dup ACK 140#1] 59747  >  443 [ACK] Seq=79182 Ack=3087 Win=4103 Len=0 SLE=3017 SRE=3087"
"144","13.788679200","151.101.66.187","100.84.170.161","TCP","56","443  >  59747 [ACK] Seq=3087 Ack=79182 Win=3194 Len=0"
"145","13.788990900","151.101.66.187","100.84.170.161","TCP","66","[TCP Dup ACK 144#1] 443  >  59747 [ACK] Seq=3087 Ack=79182 Win=3194 Len=0 SLE=77722 SRE=79182"
"146","13.791086500","151.101.66.187","100.84.170.161","TLSv1.2","104","Application Data"
"147","13.807739100","100.84.170.161","151.101.66.187","TLSv1.2","2432","Application Data"
"148","13.807978300","100.84.170.161","151.101.66.187","TLSv1.2","2429","Application Data"
"149","13.835926700","100.84.170.161","151.101.66.187","TCP","1514","[TCP Retransmission] 59747  >  443 [PSH, ACK] Seq=82475 Ack=3137 Win=4103 Len=1460"
"150","13.849731800","151.101.66.187","100.84.170.161","TCP","104","[TCP Spurious Retransmission] 443  >  59747 [PSH, ACK] Seq=3087 Ack=79182 Win=3194 Len=50"
"151","13.849775400","100.84.170.161","151.101.66.187","TCP","66","[TCP Dup ACK 147#1] 59747  >  443 [ACK] Seq=83935 Ack=3137 Win=4103 Len=0 SLE=3087 SRE=3137"
"152","13.858593200","151.101.66.187","100.84.170.161","TCP","56","443  >  59747 [ACK] Seq=3137 Ack=81560 Win=3203 Len=0"
"153","13.858593200","151.101.66.187","100.84.170.161","TCP","66","443  >  59747 [ACK] Seq=3137 Ack=83935 Win=3212 Len=0 SLE=82475 SRE=83935"
"154","13.865101500","151.101.66.187","100.84.170.161","TLSv1.2","130","Application Data"
"155","13.865402400","151.101.66.187","100.84.170.161","TLSv1.2","124","Application Data"
"156","13.865440200","100.84.170.161","151.101.66.187","TCP","54","59747  >  443 [ACK] Seq=83935 Ack=3283 Win=4102 Len=0"
"157","13.886051600","100.84.170.161","151.101.66.187","TLSv1.2","2430","Application Data"
"158","13.886852000","100.84.170.161","151.101.66.187","TLSv1.2","2421","Application Data"
"159","13.925660900","151.101.66.187","100.84.170.161","TCP","56","443  >  59747 [ACK] Seq=3283 Ack=86311 Win=3221 Len=0"
"160","13.926209900","151.101.66.187","100.84.170.161","TCP","56","443  >  59747 [ACK] Seq=3283 Ack=88678 Win=3231 Len=0"
"161","13.929235100","151.101.66.187","100.84.170.161","TLSv1.2","98","Application Data"
"162","13.929764400","151.101.66.187","100.84.170.161","TLSv1.2","98","Application Data"
"163","13.929808800","100.84.170.161","151.101.66.187","TCP","54","59747  >  443 [ACK] Seq=88678 Ack=3371 Win=4102 Len=0"
"164","14.214283600","100.84.170.161","151.101.66.187","TLSv1.2","2484","Application Data"
"165","14.217439100","100.84.170.161","151.101.66.187","TLSv1.2","2482","Application Data"
"166","14.265505200","100.84.170.161","151.101.66.187","TCP","1514","[TCP Retransmission] 59747  >  443 [PSH, ACK] Seq=92076 Ack=3371 Win=4102 Len=1460"
"167","14.265941500","151.101.66.187","100.84.170.161","TCP","56","443  >  59747 [ACK] Seq=3371 Ack=93536 Win=3250 Len=0"
"168","14.269286100","151.101.66.187","100.84.170.161","TLSv1.2","235","Application Data"
"169","14.270687200","151.101.66.187","100.84.170.161","TLSv1.2","125","Application Data"
"170","14.270750100","100.84.170.161","151.101.66.187","TCP","54","59747  >  443 [ACK] Seq=93536 Ack=3623 Win=4101 Len=0"
"171","14.274381100","151.101.66.187","100.84.170.161","TCP","66","[TCP Dup ACK 167#1] 443  >  59747 [ACK] Seq=3623 Ack=93536 Win=3250 Len=0 SLE=92076 SRE=93536"
"172","14.426480600","100.84.170.161","151.101.66.187","TLSv1.2","2485","Application Data"
"173","14.464924000","151.101.66.187","100.84.170.161","TCP","56","443  >  59747 [ACK] Seq=3623 Ack=95967 Win=3259 Len=0"
"174","14.467569600","151.101.66.187","100.84.170.161","TLSv1.2","148","Application Data"
"175","14.514368300","100.84.170.161","151.101.66.187","TCP","54","59747  >  443 [ACK] Seq=95967 Ack=3717 Win=4101 Len=0"
"176","14.530215700","151.101.66.187","100.84.170.161","TCP","148","[TCP Spurious Retransmission] 443  >  59747 [PSH, ACK] Seq=3623 Ack=95967 Win=3259 Len=94"
"177","14.530255300","100.84.170.161","151.101.66.187","TCP","66","[TCP Dup ACK 175#1] 59747  >  443 [ACK] Seq=95967 Ack=3717 Win=4101 Len=0 SLE=3623 SRE=3717"
"178","14.847745300","100.84.170.161","151.101.66.187","TLSv1.2","2487","Application Data"
"179","14.884125600","151.101.66.187","100.84.170.161","TCP","56","443  >  59747 [ACK] Seq=3717 Ack=98400 Win=3269 Len=0"
"180","14.885938800","151.101.66.187","100.84.170.161","TLSv1.2","130","Application Data"
"181","14.928957200","100.84.170.161","151.101.66.187","TCP","54","59747  >  443 [ACK] Seq=98400 Ack=3793 Win=4100 Len=0"
"182","14.930155600","151.101.66.187","100.84.170.161","TCP","130","[TCP Spurious Retransmission] 443  >  59747 [PSH, ACK] Seq=3717 Ack=98400 Win=3269 Len=76"
"183","14.930195600","100.84.170.161","151.101.66.187","TCP","66","[TCP Dup ACK 181#1] 59747  >  443 [ACK] Seq=98400 Ack=3793 Win=4100 Len=0 SLE=3717 SRE=3793"
"184","16.742540000","100.84.170.161","151.101.66.187","TLSv1.2","2504","Application Data"
"185","16.753190900","151.101.66.187","100.84.170.161","TCP","56","443  >  59747 [ACK] Seq=3793 Ack=100850 Win=3278 Len=0"
"186","16.755814600","151.101.66.187","100.84.170.161","TLSv1.2","214","Application Data"
"187","16.799251500","151.101.66.187","100.84.170.161","TCP","214","[TCP Retransmission] 443  >  59747 [PSH, ACK] Seq=3793 Ack=100850 Win=3278 Len=160"
"188","16.799303900","100.84.170.161","151.101.66.187","TCP","66","59747  >  443 [ACK] Seq=100850 Ack=3953 Win=4106 Len=0 SLE=3793 SRE=3953"
"189","16.800002800","100.84.170.161","151.101.66.187","TLSv1.2","2503","Application Data"
"190","16.808549500","151.101.66.187","100.84.170.161","TCP","56","443  >  59747 [ACK] Seq=3953 Ack=103299 Win=3288 Len=0"
"191","16.811873600","151.101.66.187","100.84.170.161","TLSv1.2","98","Application Data"
"192","16.828794800","100.84.170.161","151.101.66.187","TLSv1.2","2501","Application Data"
"193","16.837888500","151.101.66.187","100.84.170.161","TCP","56","443  >  59747 [ACK] Seq=3997 Ack=105746 Win=3297 Len=0"
"194","16.840197500","151.101.66.187","100.84.170.161","TLSv1.2","98","Application Data"
"195","16.884383800","100.84.170.161","151.101.66.187","TCP","54","59747  >  443 [ACK] Seq=105746 Ack=4041 Win=4105 Len=0"
"196","16.887164000","151.101.66.187","100.84.170.161","TCP","98","[TCP Spurious Retransmission] 443  >  59747 [PSH, ACK] Seq=3997 Ack=105746 Win=3297 Len=44"
"197","16.887230200","100.84.170.161","151.101.66.187","TCP","66","[TCP Dup ACK 195#1] 59747  >  443 [ACK] Seq=105746 Ack=4041 Win=4105 Len=0 SLE=3997 SRE=4041"
"198","17.230149500","100.84.170.161","151.101.66.187","TLSv1.2","2502","Application Data"
"199","17.240279600","151.101.66.187","100.84.170.161","TCP","56","443  >  59747 [ACK] Seq=4041 Ack=108194 Win=3307 Len=0"
"200","17.243425800","151.101.66.187","100.84.170.161","TLSv1.2","208","Application Data"
"201","17.288943300","100.84.170.161","151.101.66.187","TCP","54","59747  >  443 [ACK] Seq=108194 Ack=4195 Win=4105 Len=0"
"202","17.290136500","151.101.66.187","100.84.170.161","TCP","208","[TCP Spurious Retransmission] 443  >  59747 [PSH, ACK] Seq=4041 Ack=108194 Win=3307 Len=154"
"203","17.290171400","100.84.170.161","151.101.66.187","TCP","66","[TCP Dup ACK 201#1] 59747  >  443 [ACK] Seq=108194 Ack=4195 Win=4105 Len=0 SLE=4041 SRE=4195"
"204","17.831241600","100.84.170.161","151.101.66.187","TLSv1.2","2503","Application Data"
"205","17.833304100","100.84.170.161","151.101.66.187","TLSv1.2","2491","Application Data"
"206","17.836215500","100.84.170.161","151.101.66.187","TLSv1.2","2485","Application Data"
"207","17.841914400","100.84.170.161","151.101.66.187","TLSv1.2","2504","Application Data"
"208","17.845923300","100.84.170.161","151.101.66.187","TLSv1.2","2435","Application Data"
"209","17.879652400","100.84.170.161","151.101.66.187","TCP","1514","[TCP Retransmission] 59747  >  443 [PSH, ACK] Seq=118882 Ack=4195 Win=4105 Len=1460"
"210","17.886484100","151.101.66.187","100.84.170.161","TCP","56","443  >  59747 [ACK] Seq=4195 Ack=117961 Win=3345 Len=0"
"211","17.886636100","151.101.66.187","100.84.170.161","TLSv1.2","137","Application Data"
"212","17.887078600","151.101.66.187","100.84.170.161","TLSv1.2","158","Application Data"
"213","17.887129700","100.84.170.161","151.101.66.187","TCP","54","59747  >  443 [ACK] Seq=120342 Ack=4382 Win=4104 Len=0"
"214","17.892033800","151.101.66.187","100.84.170.161","TCP","56","443  >  59747 [ACK] Seq=4382 Ack=120342 Win=3354 Len=0"
"215","17.893964300","151.101.66.187","100.84.170.161","TCP","66","[TCP Dup ACK 214#1] 443  >  59747 [ACK] Seq=4382 Ack=120342 Win=3354 Len=0 SLE=118882 SRE=120342"
"216","17.894497100","151.101.66.187","100.84.170.161","TLSv1.2","445","Application Data"
"217","17.898310400","100.84.170.161","151.101.66.187","TLSv1.2","89","Application Data"
"218","17.907075800","151.101.66.187","100.84.170.161","TCP","56","443  >  59747 [ACK] Seq=4773 Ack=120377 Win=3354 Len=0"
"219","17.966693100","100.84.170.161","151.101.66.187","TLSv1.2","2507","Application Data"
"220","17.975809200","151.101.66.187","100.84.170.161","TCP","56","443  >  59747 [ACK] Seq=4773 Ack=122830 Win=3364 Len=0"
"221","17.978594900","151.101.66.187","100.84.170.161","TLSv1.2","208","Application Data"
"222","17.988815200","100.84.170.161","151.101.66.187","TLSv1.2","2498","Application Data"
"223","17.998233600","151.101.66.187","100.84.170.161","TCP","56","443  >  59747 [ACK] Seq=4927 Ack=125274 Win=3374 Len=0"
"224","18.001028800","151.101.66.187","100.84.170.161","TLSv1.2","208","Application Data"
"225","18.045095900","151.101.66.187","100.84.170.161","TCP","208","[TCP Retransmission] 443  >  59747 [PSH, ACK] Seq=4927 Ack=125274 Win=3374 Len=154"
"226","18.045125700","100.84.170.161","151.101.66.187","TCP","66","59747  >  443 [ACK] Seq=125274 Ack=5081 Win=4101 Len=0 SLE=4927 SRE=5081"
"227","18.073225900","100.84.170.161","151.101.66.187","TLSv1.2","2495","Application Data"
"228","18.073568900","100.84.170.161","151.101.66.187","TLSv1.2","2486","Application Data"
"229","18.082548900","151.101.66.187","100.84.170.161","TCP","56","443  >  59747 [ACK] Seq=5081 Ack=130147 Win=3393 Len=0"
"230","18.086070000","151.101.66.187","100.84.170.161","TLSv1.2","172","Application Data"
"231","18.129215500","151.101.66.187","100.84.170.161","TCP","172","[TCP Retransmission] 443  >  59747 [PSH, ACK] Seq=5081 Ack=130147 Win=3393 Len=118"
"232","18.129256400","100.84.170.161","151.101.66.187","TCP","66","59747  >  443 [ACK] Seq=130147 Ack=5199 Win=4101 Len=0 SLE=5081 SRE=5199"
"233","18.136338800","100.84.170.161","151.101.66.187","TLSv1.2","2477","Application Data"
"234","18.137899300","100.84.170.161","151.101.66.187","TLSv1.2","2474","Application Data"
"235","18.144981900","151.101.66.187","100.84.170.161","TCP","56","443  >  59747 [ACK] Seq=5199 Ack=132570 Win=3402 Len=0"
"236","18.146541000","151.101.66.187","100.84.170.161","TCP","56","443  >  59747 [ACK] Seq=5199 Ack=134990 Win=3411 Len=0"
"237","18.147422300","151.101.66.187","100.84.170.161","TLSv1.2","130","Application Data"
"238","18.148900300","151.101.66.187","100.84.170.161","TLSv1.2","124","Application Data"
"239","18.148951700","100.84.170.161","151.101.66.187","TCP","54","59747  >  443 [ACK] Seq=134990 Ack=5345 Win=4100 Len=0"
"240","18.236155300","100.84.170.161","151.101.66.187","TLSv1.2","2519","Application Data"
"241","18.245134900","151.101.66.187","100.84.170.161","TCP","56","443  >  59747 [ACK] Seq=5345 Ack=137455 Win=3421 Len=0"
"242","18.245535300","100.84.170.161","151.101.66.187","TLSv1.2","2507","Application Data"
"243","18.247493000","151.101.66.187","100.84.170.161","TLSv1.2","98","Application Data"
"244","18.254363200","151.101.66.187","100.84.170.161","TCP","56","443  >  59747 [ACK] Seq=5389 Ack=139908 Win=3431 Len=0"
"245","18.257239000","151.101.66.187","100.84.170.161","TLSv1.2","131","Application Data"
"246","18.257308400","100.84.170.161","151.101.66.187","TCP","54","59747  >  443 [ACK] Seq=139908 Ack=5466 Win=4106 Len=0"
"247","18.307682900","100.84.170.161","151.101.66.187","TLSv1.2","2521","Application Data"
"248","18.316859200","151.101.66.187","100.84.170.161","TCP","56","443  >  59747 [ACK] Seq=5466 Ack=142375 Win=3440 Len=0"
"249","18.319635100","151.101.66.187","100.84.170.161","TLSv1.2","124","Application Data"
"250","18.361468900","151.101.66.187","100.84.170.161","TCP","124","[TCP Retransmission] 443  >  59747 [PSH, ACK] Seq=5466 Ack=142375 Win=3440 Len=70"
"251","18.361499500","100.84.170.161","151.101.66.187","TCP","66","59747  >  443 [ACK] Seq=142375 Ack=5536 Win=4105 Len=0 SLE=5466 SRE=5536"
"252","22.563313900","100.84.170.161","151.101.66.187","TLSv1.2","2531","Application Data"
"253","22.572523900","151.101.66.187","100.84.170.161","TCP","56","443  >  59747 [ACK] Seq=5536 Ack=144852 Win=3450 Len=0"
"254","22.576098000","151.101.66.187","100.84.170.161","TLSv1.2","291","Application Data"
"255","22.618241300","151.101.66.187","100.84.170.161","TCP","291","[TCP Retransmission] 443  >  59747 [PSH, ACK] Seq=5536 Ack=144852 Win=3450 Len=237"
"256","22.618279500","100.84.170.161","151.101.66.187","TCP","66","59747  >  443 [ACK] Seq=144852 Ack=5773 Win=4105 Len=0 SLE=5536 SRE=5773"
"257","22.623418400","100.84.170.161","151.101.66.187","TLSv1.2","2531","Application Data"
"258","22.632797300","151.101.66.187","100.84.170.161","TCP","56","443  >  59747 [ACK] Seq=5773 Ack=147329 Win=3460 Len=0"
"259","22.635090500","151.101.66.187","100.84.170.161","TLSv1.2","98","Application Data"
"260","22.677194200","151.101.66.187","100.84.170.161","TCP","98","[TCP Retransmission] 443  >  59747 [PSH, ACK] Seq=5773 Ack=147329 Win=3460 Len=44"
"261","22.677250800","100.84.170.161","151.101.66.187","TCP","66","59747  >  443 [ACK] Seq=147329 Ack=5817 Win=4104 Len=0 SLE=5773 SRE=5817"
"262","23.439520300","100.84.170.161","151.101.66.187","TLSv1.2","2530","Application Data"
"263","23.449618800","151.101.66.187","100.84.170.161","TCP","56","443  >  59747 [ACK] Seq=5817 Ack=149805 Win=3469 Len=0"
"264","23.452319100","100.84.170.161","151.101.66.187","TLSv1.2","2521","Application Data"
"265","23.453292200","151.101.66.187","100.84.170.161","TLSv1.2","214","Application Data"
"266","23.456568600","100.84.170.161","151.101.66.187","TLSv1.2","2515","Application Data"
"267","23.459107500","100.84.170.161","151.101.66.187","TLSv1.2","2515","Application Data"
"268","23.461172800","151.101.66.187","100.84.170.161","TCP","56","443  >  59747 [ACK] Seq=5977 Ack=152272 Win=3479 Len=0"
"269","23.465119500","151.101.66.187","100.84.170.161","TCP","56","443  >  59747 [ACK] Seq=5977 Ack=154733 Win=3489 Len=0"
"270","23.466329900","151.101.66.187","100.84.170.161","TLSv1.2","129","Application Data"
"271","23.467867900","151.101.66.187","100.84.170.161","TCP","56","443  >  59747 [ACK] Seq=6052 Ack=157194 Win=3498 Len=0"
"272","23.469546900","151.101.66.187","100.84.170.161","TLSv1.2","104","Application Data"
"273","23.469618900","100.84.170.161","151.101.66.187","TCP","54","59747  >  443 [ACK] Seq=157194 Ack=6102 Win=4103 Len=0"
"274","23.470601700","151.101.66.187","100.84.170.161","TLSv1.2","156","Application Data"
"275","23.516155900","100.84.170.161","151.101.66.187","TCP","54","59747  >  443 [ACK] Seq=157194 Ack=6204 Win=4103 Len=0"
"276","23.516512300","151.101.66.187","100.84.170.161","TCP","156","[TCP Spurious Retransmission] 443  >  59747 [PSH, ACK] Seq=6102 Ack=157194 Win=3498 Len=102"
"277","23.516589400","100.84.170.161","151.101.66.187","TCP","66","[TCP Dup ACK 275#1] 59747  >  443 [ACK] Seq=157194 Ack=6204 Win=4103 Len=0 SLE=6102 SRE=6204"
"278","23.693254800","100.84.170.161","151.101.66.187","TLSv1.2","2529","Application Data"
"279","23.703471000","151.101.66.187","100.84.170.161","TCP","56","443  >  59747 [ACK] Seq=6204 Ack=159669 Win=3508 Len=0"
"280","23.705862300","151.101.66.187","100.84.170.161","TLSv1.2","124","Application Data"
"281","23.724899200","100.84.170.161","151.101.66.187","TLSv1.2","2529","Application Data"
"282","23.734994100","151.101.66.187","100.84.170.161","TCP","56","443  >  59747 [ACK] Seq=6274 Ack=162144 Win=3518 Len=0"
"283","23.737331400","151.101.66.187","100.84.170.161","TLSv1.2","125","Application Data"
"284","23.778368500","151.101.66.187","100.84.170.161","TCP","125","[TCP Retransmission] 443  >  59747 [PSH, ACK] Seq=6274 Ack=162144 Win=3518 Len=71"
"285","23.778406300","100.84.170.161","151.101.66.187","TCP","66","59747  >  443 [ACK] Seq=162144 Ack=6345 Win=4102 Len=0 SLE=6274 SRE=6345"
"286","23.837260600","100.84.170.161","151.101.66.187","TLSv1.2","2524","Application Data"
"287","23.846725200","151.101.66.187","100.84.170.161","TCP","56","443  >  59747 [ACK] Seq=6345 Ack=164614 Win=3527 Len=0"
"288","23.849664000","151.101.66.187","100.84.170.161","TLSv1.2","176","Application Data"
"289","23.890735000","100.84.170.161","151.101.66.187","TCP","54","59747  >  443 [ACK] Seq=164614 Ack=6467 Win=4102 Len=0"
"290","23.891561900","151.101.66.187","100.84.170.161","TCP","176","[TCP Spurious Retransmission] 443  >  59747 [PSH, ACK] Seq=6345 Ack=164614 Win=3527 Len=122"
"291","23.891609400","100.84.170.161","151.101.66.187","TCP","66","[TCP Dup ACK 289#1] 59747  >  443 [ACK] Seq=164614 Ack=6467 Win=4102 Len=0 SLE=6345 SRE=6467"
"292","23.922465400","100.84.170.161","151.101.66.187","TLSv1.2","2534","Application Data"
"293","23.922595700","100.84.170.161","151.101.66.187","TLSv1.2","2530","Application Data"
"294","23.932472000","151.101.66.187","100.84.170.161","TCP","56","443  >  59747 [ACK] Seq=6467 Ack=169570 Win=3547 Len=0"
"295","23.935332400","151.101.66.187","100.84.170.161","TLSv1.2","125","Application Data"
"296","23.936105500","151.101.66.187","100.84.170.161","TLSv1.2","208","Application Data"
"297","23.936169800","100.84.170.161","151.101.66.187","TCP","54","59747  >  443 [ACK] Seq=169570 Ack=6692 Win=4101 Len=0"
"298","24.060704900","100.84.170.161","151.101.66.187","TLSv1.2","2536","Application Data"
"299","24.061273400","100.84.170.161","151.101.66.187","TLSv1.2","2532","Application Data"
"300","24.064121600","100.84.170.161","151.101.66.187","TLSv1.2","2528","Application Data"
"301","24.069916400","151.101.66.187","100.84.170.161","TCP","56","443  >  59747 [ACK] Seq=6692 Ack=172052 Win=3556 Len=0"
"302","24.070203800","151.101.66.187","100.84.170.161","TCP","56","443  >  59747 [ACK] Seq=6692 Ack=174530 Win=3566 Len=0"
"303","24.072721700","151.101.66.187","100.84.170.161","TLSv1.2","240","Application Data"
"304","24.073590100","151.101.66.187","100.84.170.161","TCP","56","443  >  59747 [ACK] Seq=6878 Ack=177004 Win=3576 Len=0"
"305","24.073904600","151.101.66.187","100.84.170.161","TLSv1.2","131","Application Data"
"306","24.073957700","100.84.170.161","151.101.66.187","TCP","54","59747  >  443 [ACK] Seq=177004 Ack=6955 Win=4106 Len=0"
"307","24.076535900","151.101.66.187","100.84.170.161","TLSv1.2","130","Application Data"
"308","24.119170700","151.101.66.187","100.84.170.161","TCP","130","[TCP Retransmission] 443  >  59747 [PSH, ACK] Seq=6955 Ack=177004 Win=3576 Len=76"
"309","24.119217100","100.84.170.161","151.101.66.187","TCP","66","59747  >  443 [ACK] Seq=177004 Ack=7031 Win=4105 Len=0 SLE=6955 SRE=7031"
"310","32.074227400","100.84.170.161","151.101.66.187","TLSv1.2","2531","Application Data"
"311","32.079976400","100.84.170.161","151.101.66.187","TLSv1.2","2536","Application Data"
"312","32.083821800","151.101.66.187","100.84.170.161","TCP","56","443  >  59747 [ACK] Seq=7031 Ack=179481 Win=3585 Len=0"
"313","32.086306800","100.84.170.161","151.101.66.187","TLSv1.2","2537","Application Data"
"314","32.086496400","151.101.66.187","100.84.170.161","TLSv1.2","291","Application Data"
"315","32.089291200","151.101.66.187","100.84.170.161","TCP","56","443  >  59747 [ACK] Seq=7268 Ack=181963 Win=3595 Len=0"
"316","32.091849700","151.101.66.187","100.84.170.161","TLSv1.2","98","Application Data"
"317","32.091911400","100.84.170.161","151.101.66.187","TCP","54","59747  >  443 [ACK] Seq=184446 Ack=7312 Win=4104 Len=0"
"318","32.095502200","100.84.170.161","151.101.66.187","TLSv1.2","2522","Application Data"
"319","32.096637100","151.101.66.187","100.84.170.161","TCP","56","443  >  59747 [ACK] Seq=7312 Ack=184446 Win=3605 Len=0"
"320","32.098604800","151.101.66.187","100.84.170.161","TLSv1.2","125","Application Data"
"321","32.104591800","151.101.66.187","100.84.170.161","TCP","56","443  >  59747 [ACK] Seq=7383 Ack=186914 Win=3614 Len=0"
"322","32.107204300","151.101.66.187","100.84.170.161","TLSv1.2","98","Application Data"
"323","32.107256700","100.84.170.161","151.101.66.187","TCP","54","59747  >  443 [ACK] Seq=186914 Ack=7427 Win=4104 Len=0"
"324","32.216544900","100.84.170.161","151.101.66.187","TCP","55","55359  >  443 [ACK] Seq=1 Ack=1 Win=512 Len=1 [TCP PDU reassembled in 343]"
"325","32.225593700","151.101.66.187","100.84.170.161","TCP","66","443  >  55359 [ACK] Seq=1 Ack=2 Win=281 Len=0 SLE=1 SRE=2"
"326","47.794885300","100.84.170.161","151.101.66.187","TLSv1.2","2536","Application Data"
"327","47.795107900","100.84.170.161","151.101.66.187","TLSv1.2","93","Application Data"
"328","47.828902900","100.84.170.161","151.101.66.187","TCP","1514","[TCP Retransmission] 59747  >  443 [PSH, ACK] Seq=187975 Ack=7427 Win=4104 Len=1460"
"329","47.885945300","151.101.66.187","100.84.170.161","TLSv1.2","93","Application Data"
"330","47.885945300","151.101.66.187","100.84.170.161","TLSv1.2","214","Application Data"
"331","47.886033600","100.84.170.161","151.101.66.187","TCP","54","59747  >  443 [ACK] Seq=189435 Ack=7626 Win=4103 Len=0"
"332","47.910487700","151.101.66.187","100.84.170.161","TCP","66","[TCP Dup ACK 329#1] 443  >  59747 [ACK] Seq=7626 Ack=189435 Win=3624 Len=0 SLE=187975 SRE=189435"
"333","47.912373800","151.101.66.187","100.84.170.161","TCP","214","[TCP Spurious Retransmission] 443  >  59747 [PSH, ACK] Seq=7466 Ack=189435 Win=3624 Len=160"
"334","47.912413700","100.84.170.161","151.101.66.187","TCP","66","[TCP Dup ACK 331#1] 59747  >  443 [ACK] Seq=189435 Ack=7626 Win=4103 Len=0 SLE=7466 SRE=7626"
"335","47.932915200","100.84.170.161","151.101.66.187","TLSv1.2","2534","Application Data"
"336","47.954182700","100.84.170.161","151.101.66.187","TCP","1514","[TCP Retransmission] 59747  >  443 [PSH, ACK] Seq=190455 Ack=7626 Win=4103 Len=1460"
"337","47.997918400","100.84.170.161","151.101.66.187","TLSv1.2","2537","Application Data"
"338","47.998880500","151.101.66.187","100.84.170.161","TLSv1.2","272","Application Data"
"339","48.005450900","151.101.66.187","100.84.170.161","TCP","66","[TCP Dup ACK 338#1] 443  >  59747 [ACK] Seq=7844 Ack=191915 Win=3634 Len=0 SLE=190455 SRE=191915"
"340","48.007481400","151.101.66.187","100.84.170.161","TCP","56","443  >  59747 [ACK] Seq=7844 Ack=194398 Win=3643 Len=0"
"341","48.010572100","151.101.66.187","100.84.170.161","TLSv1.2","98","Application Data"
"342","48.010637200","100.84.170.161","151.101.66.187","TCP","54","59747  >  443 [ACK] Seq=194398 Ack=7888 Win=4102 Len=0"
"343","48.819844000","100.84.170.161","151.101.66.187","TLSv1.2","248","Ignored Unknown Record"
"344","48.819937500","100.84.170.161","151.101.66.187","TLSv1.2","93","Application Data"
"345","48.831390700","151.101.66.187","100.84.170.161","TCP","56","443  >  55359 [ACK] Seq=1 Ack=235 Win=281 Len=0"
"346","48.831825400","151.101.66.187","100.84.170.161","TLSv1.2","93","Application Data"
"347","48.859874600","151.101.66.187","100.84.170.161","TCP","93","[TCP Retransmission] 443  >  55359 [PSH, ACK] Seq=1 Ack=235 Win=281 Len=39"
"348","48.859910100","100.84.170.161","151.101.66.187","TCP","66","55359  >  443 [ACK] Seq=235 Ack=40 Win=512 Len=0 SLE=1 SRE=40"
"349","48.881008100","151.101.66.187","100.84.170.161","TLSv1.2","264","Application Data"
"350","48.881354000","151.101.66.187","100.84.170.161","TLSv1.2","926","Application Data"
"351","48.881426900","100.84.170.161","151.101.66.187","TCP","54","55359  >  443 [ACK] Seq=235 Ack=1122 Win=507 Len=0"
"352","48.882472000","151.101.66.187","100.84.170.161","TLSv1.2","101","Application Data"
"353","48.882472000","151.101.66.187","100.84.170.161","TLSv1.2","348","Application Data"
"354","48.882619200","100.84.170.161","151.101.66.187","TCP","54","55359  >  443 [ACK] Seq=235 Ack=1463 Win=513 Len=0"
"355","48.886809600","100.84.170.161","151.101.66.187","TLSv1.2","89","Application Data"
"356","48.895714700","151.101.66.187","100.84.170.161","TCP","56","443  >  55359 [ACK] Seq=1463 Ack=270 Win=281 Len=0"
"357","55.750773200","100.84.170.161","151.101.66.187","TLSv1.2","2534","Application Data"
"358","55.761239500","100.84.170.161","151.101.66.187","TLSv1.2","2525","Application Data"
"359","55.761270000","151.101.66.187","100.84.170.161","TCP","56","443  >  59747 [ACK] Seq=7888 Ack=196878 Win=3653 Len=0"
"360","55.763521400","100.84.170.161","151.101.66.187","TLSv1.2","2519","Application Data"
"361","55.764513900","151.101.66.187","100.84.170.161","TLSv1.2","214","Application Data"
"362","55.769486900","100.84.170.161","151.101.66.187","TLSv1.2","2519","Application Data"
"363","55.773170100","151.101.66.187","100.84.170.161","TCP","56","443  >  59747 [ACK] Seq=8048 Ack=199349 Win=3663 Len=0"
"364","55.773498700","151.101.66.187","100.84.170.161","TCP","56","443  >  59747 [ACK] Seq=8048 Ack=201814 Win=3672 Len=0"
"365","55.776474000","151.101.66.187","100.84.170.161","TLSv1.2","169","Application Data"
"366","55.777458200","151.101.66.187","100.84.170.161","TLSv1.2","209","Application Data"
"367","55.777523900","100.84.170.161","151.101.66.187","TCP","54","59747  >  443 [ACK] Seq=204279 Ack=8318 Win=4100 Len=0"
"368","55.784401500","151.101.66.187","100.84.170.161","TCP","56","443  >  59747 [ACK] Seq=8318 Ack=204279 Win=3682 Len=0"
"369","55.787893900","151.101.66.187","100.84.170.161","TLSv1.2","124","Application Data"
"370","55.825941500","151.101.66.187","100.84.170.161","TCP","124","[TCP Retransmission] 443  >  59747 [PSH, ACK] Seq=8318 Ack=204279 Win=3682 Len=70"
"371","55.825994000","100.84.170.161","151.101.66.187","TCP","66","59747  >  443 [ACK] Seq=204279 Ack=8388 Win=4100 Len=0 SLE=8318 SRE=8388"
"372","55.962325700","100.84.170.161","151.101.66.187","TLSv1.2","2533","Application Data"
"373","55.975381800","151.101.66.187","100.84.170.161","TCP","56","443  >  59747 [ACK] Seq=8388 Ack=206758 Win=3692 Len=0"
"374","55.977775100","151.101.66.187","100.84.170.161","TLSv1.2","234","Application Data"
"375","55.988788500","100.84.170.161","151.101.66.187","TLSv1.2","2533","Application Data"
"376","56.000652500","151.101.66.187","100.84.170.161","TCP","56","443  >  59747 [ACK] Seq=8568 Ack=209237 Win=3701 Len=0"
"377","56.003482500","151.101.66.187","100.84.170.161","TLSv1.2","125","Application Data"
"378","56.043389700","151.101.66.187","100.84.170.161","TCP","125","[TCP Retransmission] 443  >  59747 [PSH, ACK] Seq=8568 Ack=209237 Win=3701 Len=71"
"379","56.043437000","100.84.170.161","151.101.66.187","TCP","66","59747  >  443 [ACK] Seq=209237 Ack=8639 Win=4105 Len=0 SLE=8568 SRE=8639"
"380","56.124394800","100.84.170.161","151.101.66.187","TLSv1.2","2528","Application Data"
"381","56.141452700","151.101.66.187","100.84.170.161","TCP","56","443  >  59747 [ACK] Seq=8639 Ack=211711 Win=3711 Len=0"
"382","56.143659400","151.101.66.187","100.84.170.161","TLSv1.2","131","Application Data"
"383","56.181989900","151.101.66.187","100.84.170.161","TCP","131","[TCP Retransmission] 443  >  59747 [PSH, ACK] Seq=8639 Ack=211711 Win=3711 Len=77"
"384","56.182044700","100.84.170.161","151.101.66.187","TCP","66","59747  >  443 [ACK] Seq=211711 Ack=8716 Win=4105 Len=0 SLE=8639 SRE=8716"
"385","56.191123700","100.84.170.161","151.101.66.187","TLSv1.2","2534","Application Data"
"386","56.191263200","100.84.170.161","151.101.66.187","TLSv1.2","2538","Application Data"
"387","56.191391500","100.84.170.161","151.101.66.187","TLSv1.2","2530","Application Data"
"388","56.202825400","151.101.66.187","100.84.170.161","TCP","56","443  >  59747 [ACK] Seq=8716 Ack=214191 Win=3721 Len=0"
"389","56.203816000","151.101.66.187","100.84.170.161","TCP","56","443  >  59747 [ACK] Seq=8716 Ack=219151 Win=3740 Len=0"
"390","56.204911300","151.101.66.187","100.84.170.161","TLSv1.2","131","Application Data"
"391","56.204911300","151.101.66.187","100.84.170.161","TLSv1.2","180","Application Data"
"392","56.204911300","151.101.66.187","100.84.170.161","TLSv1.2","130","Application Data"
"393","56.204977600","100.84.170.161","151.101.66.187","TCP","54","59747  >  443 [ACK] Seq=219151 Ack=8995 Win=4104 Len=0"
"394","56.316961600","100.84.170.161","151.101.66.187","TLSv1.2","2542","Application Data"
"395","56.317104700","100.84.170.161","151.101.66.187","TLSv1.2","2538","Application Data"
"396","56.325663300","151.101.66.187","100.84.170.161","TCP","56","443  >  59747 [ACK] Seq=8995 Ack=221639 Win=3750 Len=0"
"397","56.326190600","151.101.66.187","100.84.170.161","TCP","56","443  >  59747 [ACK] Seq=8995 Ack=224123 Win=3759 Len=0"
"398","56.329300000","151.101.66.187","100.84.170.161","TLSv1.2","130","Application Data"
"399","56.329807700","151.101.66.187","100.84.170.161","TLSv1.2","125","Application Data"
"400","56.329889000","100.84.170.161","151.101.66.187","TCP","54","59747  >  443 [ACK] Seq=224123 Ack=9142 Win=4104 Len=0"
