"No.","Time","Source","Destination","Protocol","Length","Info"
"1","0.000000000","172.20.40.110","151.101.66.187","TLSv1.2","2786","Application Data"
"2","0.001011000","172.20.40.110","151.101.66.187","TLSv1.2","93","Application Data"
"3","0.014060700","151.101.66.187","172.20.40.110","TCP","60","443  >  57039 [ACK] Seq=1 Ack=2733 Win=1327 Len=0"
"4","0.014060700","151.101.66.187","172.20.40.110","TCP","60","443  >  57039 [ACK] Seq=1 Ack=2772 Win=1327 Len=0"
"5","0.014060700","151.101.66.187","172.20.40.110","TLSv1.2","93","Application Data"
"6","0.057886800","172.20.40.110","151.101.66.187","TCP","54","57039  >  443 [ACK] Seq=2772 Ack=40 Win=513 Len=0"
"7","0.276681100","151.101.66.187","172.20.40.110","TLSv1.2","1100","Application Data"
"8","0.276681100","151.101.66.187","172.20.40.110","TCP","1434","443  >  57039 [ACK] Seq=1086 Ack=2772 Win=1327 Len=1380 [TCP PDU reassembled in 13]"
"9","0.276681100","151.101.66.187","172.20.40.110","TCP","1434","443  >  57039 [ACK] Seq=2466 Ack=2772 Win=1327 Len=1380 [TCP PDU reassembled in 13]"
"10","0.276681100","151.101.66.187","172.20.40.110","TCP","1434","443  >  57039 [ACK] Seq=3846 Ack=2772 Win=1327 Len=1380 [TCP PDU reassembled in 13]"
"11","0.276681100","151.101.66.187","172.20.40.110","TCP","1434","443  >  57039 [PSH, ACK] Seq=5226 Ack=2772 Win=1327 Len=1380 [TCP PDU reassembled in 13]"
"12","0.276840200","172.20.40.110","151.101.66.187","TCP","54","57039  >  443 [ACK] Seq=2772 Ack=6606 Win=517 Len=0"
"13","0.279735600","151.101.66.187","172.20.40.110","TLSv1.2","1180","Application Data"
"14","0.279735600","151.101.66.187","172.20.40.110","TCP","1434","443  >  57039 [ACK] Seq=7732 Ack=2772 Win=1327 Len=1380 [TCP PDU reassembled in 18]"
"15","0.279735600","151.101.66.187","172.20.40.110","TCP","4194","443  >  57039 [PSH, ACK] Seq=9112 Ack=2772 Win=1327 Len=4140 [TCP PDU reassembled in 18]"
"16","0.279896200","172.20.40.110","151.101.66.187","TCP","54","57039  >  443 [ACK] Seq=2772 Ack=13252 Win=517 Len=0"
"17","0.283010000","151.101.66.187","172.20.40.110","TCP","1434","443  >  57039 [ACK] Seq=13252 Ack=2772 Win=1327 Len=1380 [TCP PDU reassembled in 18]"
"18","0.283010000","151.101.66.187","172.20.40.110","TLSv1.2","1377","Application Data"
"19","0.283010000","151.101.66.187","172.20.40.110","TCP","4194","443  >  57039 [ACK] Seq=15955 Ack=2772 Win=1327 Len=4140 [TCP PDU reassembled in 22]"
"20","0.283223600","172.20.40.110","151.101.66.187","TCP","54","57039  >  443 [ACK] Seq=2772 Ack=20095 Win=517 Len=0"
"21","0.285243600","151.101.66.187","172.20.40.110","TCP","2814","443  >  57039 [PSH, ACK] Seq=20095 Ack=2772 Win=1327 Len=2760 [TCP PDU reassembled in 22]"
"22","0.285243600","151.101.66.187","172.20.40.110","TLSv1.2","617","Application Data"
"23","0.285366100","172.20.40.110","151.101.66.187","TCP","54","57039  >  443 [ACK] Seq=2772 Ack=23418 Win=517 Len=0"
"24","0.285841600","172.20.40.110","151.101.66.187","TLSv1.2","89","Application Data"
"25","0.292940700","151.101.66.187","172.20.40.110","TCP","60","443  >  57039 [ACK] Seq=23418 Ack=2807 Win=1327 Len=0"
"26","0.451609300","172.20.40.110","151.101.66.187","TLSv1.2","2777","Application Data"
"27","0.469272600","151.101.66.187","172.20.40.110","TCP","60","443  >  57039 [ACK] Seq=23418 Ack=5530 Win=1338 Len=0"
"28","0.470990600","151.101.66.187","172.20.40.110","TLSv1.2","418","Application Data"
"29","0.517368800","172.20.40.110","151.101.66.187","TCP","54","57039  >  443 [ACK] Seq=5530 Ack=23782 Win=516 Len=0"
"30","1.359474300","172.20.40.110","151.101.66.187","TLSv1.2","2896","Application Data"
"31","1.369784800","151.101.66.187","172.20.40.110","TCP","60","443  >  57039 [ACK] Seq=23782 Ack=8372 Win=1349 Len=0"
"32","1.393000900","172.20.40.110","151.101.66.187","TLSv1.2","2777","Application Data"
"33","1.405213700","151.101.66.187","172.20.40.110","TCP","60","443  >  57039 [ACK] Seq=23782 Ack=11095 Win=1360 Len=0"
"34","1.408619400","151.101.66.187","172.20.40.110","TLSv1.2","214","Application Data"
"35","1.456227700","172.20.40.110","151.101.66.187","TCP","54","57039  >  443 [ACK] Seq=11095 Ack=23942 Win=515 Len=0"
"36","1.459033000","172.20.40.110","151.101.66.187","TLSv1.2","89","Application Data"
"37","1.467714900","151.101.66.187","172.20.40.110","TCP","60","443  >  57039 [ACK] Seq=23942 Ack=11130 Win=1360 Len=0"
"38","1.538291700","172.20.40.110","151.101.66.187","TLSv1.2","2779","Application Data"
"39","1.550126000","151.101.66.187","172.20.40.110","TCP","60","443  >  57039 [ACK] Seq=23942 Ack=13855 Win=1370 Len=0"
"40","1.550126000","151.101.66.187","172.20.40.110","TLSv1.2","136","Application Data"
"41","1.595000100","172.20.40.110","151.101.66.187","TCP","54","57039  >  443 [ACK] Seq=13855 Ack=24024 Win=515 Len=0"
"42","1.621580300","172.20.40.110","151.101.66.187","TLSv1.2","2866","Application Data"
"43","1.637934400","151.101.66.187","172.20.40.110","TCP","60","443  >  57039 [ACK] Seq=24024 Ack=16667 Win=1381 Len=0"
"44","1.845805500","151.101.66.187","172.20.40.110","TLSv1.2","772","Application Data"
"45","1.845805500","151.101.66.187","172.20.40.110","TCP","5574","443  >  57039 [PSH, ACK] Seq=24742 Ack=16667 Win=1381 Len=5520 [TCP PDU reassembled in 46]"
"46","1.845805500","151.101.66.187","172.20.40.110","TLSv1.2","1197","Application Data"
"47","1.845805500","151.101.66.187","172.20.40.110","TCP","2814","443  >  57039 [ACK] Seq=31405 Ack=16667 Win=1381 Len=2760 [TCP PDU reassembled in 52]"
"48","1.845935800","172.20.40.110","151.101.66.187","TCP","54","57039  >  443 [ACK] Seq=16667 Ack=34165 Win=517 Len=0"
"49","1.848985100","151.101.66.187","172.20.40.110","TCP","9714","443  >  57039 [PSH, ACK] Seq=34165 Ack=16667 Win=1381 Len=9660 [TCP PDU reassembled in 52]"
"50","1.849103500","172.20.40.110","151.101.66.187","TCP","54","57039  >  443 [ACK] Seq=16667 Ack=43825 Win=517 Len=0"
"51","1.852235200","151.101.66.187","172.20.40.110","TCP","1434","443  >  57039 [ACK] Seq=43825 Ack=16667 Win=1381 Len=1380 [TCP PDU reassembled in 52]"
"52","1.852235200","151.101.66.187","172.20.40.110","TLSv1.2","908","Application Data"
"53","1.852343400","172.20.40.110","151.101.66.187","TCP","54","57039  >  443 [ACK] Seq=16667 Ack=46059 Win=517 Len=0"
"54","4.984253000","172.20.40.110","151.101.66.187","TLSv1.2","2888","Application Data"
"55","4.984547100","172.20.40.110","151.101.66.187","TLSv1.2","2881","Application Data"
"56","5.004068900","151.101.66.187","172.20.40.110","TCP","60","443  >  57039 [ACK] Seq=46059 Ack=19501 Win=1393 Len=0"
"57","5.004068900","151.101.66.187","172.20.40.110","TCP","60","443  >  57039 [ACK] Seq=46059 Ack=22328 Win=1404 Len=0"
"58","5.006052700","151.101.66.187","172.20.40.110","TLSv1.2","240","Application Data"
"59","5.006052700","151.101.66.187","172.20.40.110","TLSv1.2","131","Application Data"
"60","5.006162300","172.20.40.110","151.101.66.187","TCP","54","57039  >  443 [ACK] Seq=22328 Ack=46322 Win=516 Len=0"
"61","5.309128100","172.20.40.110","151.101.66.187","TLSv1.2","2898","Application Data"
"62","5.320025800","151.101.66.187","172.20.40.110","TCP","60","443  >  57039 [ACK] Seq=46322 Ack=25172 Win=1415 Len=0"
"63","5.328779500","151.101.66.187","172.20.40.110","TLSv1.2","130","Application Data"
"64","5.370492300","172.20.40.110","151.101.66.187","TCP","54","57039  >  443 [ACK] Seq=25172 Ack=46398 Win=516 Len=0"
"65","6.063862700","172.20.40.110","151.101.66.187","TLSv1.2","2883","Application Data"
"66","6.075778700","151.101.66.187","172.20.40.110","TCP","60","443  >  57039 [ACK] Seq=46398 Ack=28001 Win=1426 Len=0"
"67","6.078201000","151.101.66.187","172.20.40.110","TLSv1.2","241","Application Data"
"68","6.120987100","172.20.40.110","151.101.66.187","TCP","54","57039  >  443 [ACK] Seq=28001 Ack=46585 Win=515 Len=0"
"69","7.778365400","172.20.40.110","151.101.66.187","TLSv1.2","2590","Application Data"
"70","7.793442200","151.101.66.187","172.20.40.110","TCP","60","443  >  57039 [ACK] Seq=46585 Ack=30537 Win=1436 Len=0"
"71","7.862223000","151.101.66.187","172.20.40.110","TLSv1.2","748","Application Data"
"72","7.863718400","172.20.40.110","151.101.66.187","TLSv1.2","89","Application Data"
"73","7.870702800","151.101.66.187","172.20.40.110","TCP","60","443  >  57039 [ACK] Seq=47279 Ack=30572 Win=1436 Len=0"
"74","13.855206600","172.20.40.110","151.101.66.187","TLSv1.2","2590","Application Data"
"75","13.871006800","151.101.66.187","172.20.40.110","TCP","60","443  >  57039 [ACK] Seq=47279 Ack=33108 Win=1446 Len=0"
"76","13.961294400","151.101.66.187","172.20.40.110","TLSv1.2","239","Application Data"
"77","13.961294400","151.101.66.187","172.20.40.110","TLSv1.2","357","Application Data"
"78","13.961394000","172.20.40.110","151.101.66.187","TCP","54","57039  >  443 [ACK] Seq=33108 Ack=47767 Win=517 Len=0"
"79","13.963498600","172.20.40.110","151.101.66.187","TLSv1.2","89","Application Data"
"80","13.972194500","151.101.66.187","172.20.40.110","TCP","60","443  >  57039 [ACK] Seq=47767 Ack=33143 Win=1446 Len=0"
"81","14.456609400","172.20.40.110","151.101.66.187","TLSv1.2","2786","Application Data"
"82","14.465683700","151.101.66.187","172.20.40.110","TCP","60","443  >  57039 [ACK] Seq=47767 Ack=35875 Win=1456 Len=0"
"83","15.157692500","151.101.66.187","172.20.40.110","TLSv1.2","354","Application Data"
"84","15.157692500","151.101.66.187","172.20.40.110","TCP","9714","443  >  57039 [PSH, ACK] Seq=48067 Ack=35875 Win=1456 Len=9660 [TCP PDU reassembled in 86]"
"85","15.157794400","172.20.40.110","151.101.66.187","TCP","54","57039  >  443 [ACK] Seq=35875 Ack=57727 Win=517 Len=0"
"86","15.160839200","151.101.66.187","172.20.40.110","TLSv1.2","9714","Application Data"
"87","15.160953200","172.20.40.110","151.101.66.187","TCP","54","57039  >  443 [ACK] Seq=35875 Ack=67387 Win=517 Len=0"
"88","15.164981400","151.101.66.187","172.20.40.110","TCP","1434","443  >  57039 [ACK] Seq=67387 Ack=35875 Win=1456 Len=1380 [TCP PDU reassembled in 92]"
"89","15.164981400","151.101.66.187","172.20.40.110","TCP","1434","443  >  57039 [PSH, ACK] Seq=68767 Ack=35875 Win=1456 Len=1380 [TCP PDU reassembled in 92]"
"90","15.164981400","151.101.66.187","172.20.40.110","TCP","1434","443  >  57039 [ACK] Seq=70147 Ack=35875 Win=1456 Len=1380 [TCP PDU reassembled in 92]"
"91","15.164981400","151.101.66.187","172.20.40.110","TCP","1434","443  >  57039 [ACK] Seq=71527 Ack=35875 Win=1456 Len=1380 [TCP PDU reassembled in 92]"
"92","15.164981400","151.101.66.187","172.20.40.110","TLSv1.2","4194","Application Data"
"93","15.165175300","172.20.40.110","151.101.66.187","TCP","54","57039  >  443 [ACK] Seq=35875 Ack=77047 Win=517 Len=0"
"94","15.167422900","151.101.66.187","172.20.40.110","TLSv1.2","9714","Application Data"
"95","15.167567100","172.20.40.110","151.101.66.187","TCP","54","57039  >  443 [ACK] Seq=35875 Ack=86707 Win=517 Len=0"
"96","15.169918300","151.101.66.187","172.20.40.110","TCP","9714","443  >  57039 [PSH, ACK] Seq=86707 Ack=35875 Win=1456 Len=9660 [TCP PDU reassembled in 98]"
"97","15.170040600","172.20.40.110","151.101.66.187","TCP","54","57039  >  443 [ACK] Seq=35875 Ack=96367 Win=517 Len=0"
"98","15.173091100","151.101.66.187","172.20.40.110","TLSv1.2","9714","Application Data, Application Data"
"99","15.173194500","172.20.40.110","151.101.66.187","TCP","54","57039  >  443 [ACK] Seq=35875 Ack=106027 Win=517 Len=0"
"100","15.175358700","151.101.66.187","172.20.40.110","TCP","1434","443  >  57039 [ACK] Seq=106027 Ack=35875 Win=1456 Len=1380 [TCP PDU reassembled in 101]"
"101","15.175358700","151.101.66.187","172.20.40.110","TLSv1.2","998","Application Data, Application Data"
"102","15.175462200","172.20.40.110","151.101.66.187","TCP","54","57039  >  443 [ACK] Seq=35875 Ack=108351 Win=517 Len=0"
"103","15.335528300","172.20.40.110","151.101.66.187","TLSv1.2","2778","Application Data"
"104","15.336466900","172.20.40.110","151.101.66.187","TLSv1.2","2780","Application Data"
"105","15.336731300","172.20.40.110","151.101.66.187","TLSv1.2","2784","Application Data"
"106","15.344069300","151.101.66.187","172.20.40.110","TCP","60","443  >  57039 [ACK] Seq=108351 Ack=38599 Win=1467 Len=0"
"107","15.347297500","151.101.66.187","172.20.40.110","TLSv1.2","292","Application Data"
"108","15.348312600","151.101.66.187","172.20.40.110","TCP","60","443  >  57039 [ACK] Seq=108589 Ack=41325 Win=1477 Len=0"
"109","15.348312600","151.101.66.187","172.20.40.110","TCP","60","443  >  57039 [ACK] Seq=108589 Ack=44055 Win=1488 Len=0"
"110","15.351579500","151.101.66.187","172.20.40.110","TLSv1.2","157","Application Data"
"111","15.351579500","151.101.66.187","172.20.40.110","TLSv1.2","131","Application Data"
"112","15.351652500","172.20.40.110","151.101.66.187","TCP","54","57039  >  443 [ACK] Seq=44055 Ack=108769 Win=515 Len=0"
"113","15.361181700","172.20.40.110","151.101.66.187","TLSv1.2","2778","Application Data"
"114","15.361420100","172.20.40.110","151.101.66.187","TLSv1.2","2776","Application Data"
"115","15.375347400","151.101.66.187","172.20.40.110","TCP","60","443  >  57039 [ACK] Seq=108769 Ack=46779 Win=1499 Len=0"
"116","15.375347400","151.101.66.187","172.20.40.110","TCP","60","443  >  57039 [ACK] Seq=108769 Ack=49501 Win=1509 Len=0"
"117","15.376413800","151.101.66.187","172.20.40.110","TLSv1.2","206","Application Data, Application Data"
"118","15.376495000","172.20.40.110","151.101.66.187","TCP","54","57039  >  443 [ACK] Seq=49501 Ack=108921 Win=515 Len=0"
"119","15.393844200","172.20.40.110","151.101.66.187","TLSv1.2","2795","Application Data"
"120","15.394437400","172.20.40.110","151.101.66.187","TLSv1.2","2794","Application Data"
"121","15.406228300","151.101.66.187","172.20.40.110","TCP","60","443  >  57039 [ACK] Seq=108921 Ack=52242 Win=1520 Len=0"
"122","15.406228300","151.101.66.187","172.20.40.110","TCP","60","443  >  57039 [ACK] Seq=108921 Ack=54982 Win=1531 Len=0"
"123","15.409714100","151.101.66.187","172.20.40.110","TLSv1.2","125","Application Data"
"124","15.409714100","151.101.66.187","172.20.40.110","TLSv1.2","253","Application Data"
"125","15.409797600","172.20.40.110","151.101.66.187","TCP","54","57039  >  443 [ACK] Seq=54982 Ack=109191 Win=514 Len=0"
"126","15.481600200","172.20.40.110","151.101.66.187","TLSv1.2","2778","Application Data"
"127","15.490101600","151.101.66.187","172.20.40.110","TCP","60","443  >  57039 [ACK] Seq=109191 Ack=57706 Win=1541 Len=0"
"128","15.493269300","151.101.66.187","172.20.40.110","TLSv1.2","124","Application Data"
"129","15.541416800","172.20.40.110","151.101.66.187","TCP","54","57039  >  443 [ACK] Seq=57706 Ack=109261 Win=513 Len=0"
"130","15.939253200","172.20.40.110","151.101.66.187","TLSv1.2","2798","Application Data"
"131","15.939793700","172.20.40.110","151.101.66.187","TLSv1.2","2799","Application Data"
"132","15.959158100","151.101.66.187","172.20.40.110","TCP","60","443  >  57039 [ACK] Seq=109261 Ack=60450 Win=1552 Len=0"
"133","15.959158100","151.101.66.187","172.20.40.110","TCP","60","443  >  57039 [ACK] Seq=109261 Ack=63195 Win=1563 Len=0"
"134","15.960506800","151.101.66.187","172.20.40.110","TLSv1.2","104","Application Data"
"135","15.960506800","151.101.66.187","172.20.40.110","TLSv1.2","98","Application Data"
"136","15.960636400","172.20.40.110","151.101.66.187","TCP","54","57039  >  443 [ACK] Seq=63195 Ack=109355 Win=513 Len=0"
"137","17.876830600","172.20.40.110","151.101.66.187","TLSv1.2","2782","Application Data"
"138","17.878920700","172.20.40.110","151.101.66.187","TLSv1.2","2778","Application Data"
"139","17.887502600","151.101.66.187","172.20.40.110","TCP","60","443  >  57039 [ACK] Seq=109355 Ack=65923 Win=1574 Len=0"
"140","17.889848300","151.101.66.187","172.20.40.110","TCP","60","443  >  57039 [ACK] Seq=109355 Ack=68647 Win=1584 Len=0"
"141","17.889848300","151.101.66.187","172.20.40.110","TLSv1.2","239","Application Data"
"142","17.890955500","151.101.66.187","172.20.40.110","TLSv1.2","136","Application Data"
"143","17.891035600","172.20.40.110","151.101.66.187","TCP","54","57039  >  443 [ACK] Seq=68647 Ack=109622 Win=512 Len=0"
"144","19.959735900","172.20.40.110","151.101.66.187","TLSv1.2","2786","Application Data"
"145","19.960274000","172.20.40.110","151.101.66.187","TLSv1.2","2788","Application Data"
"146","19.967914000","172.20.40.110","151.101.66.187","TLSv1.2","2782","Application Data"
"147","19.968557100","172.20.40.110","151.101.66.187","TLSv1.2","2784","Application Data"
"148","19.971693900","172.20.40.110","151.101.66.187","TLSv1.2","2782","Application Data"
"149","19.972421400","172.20.40.110","151.101.66.187","TLSv1.2","2780","Application Data"
"150","19.978933700","151.101.66.187","172.20.40.110","TCP","60","443  >  57039 [ACK] Seq=109622 Ack=71379 Win=1595 Len=0"
"151","19.978933700","151.101.66.187","172.20.40.110","TCP","60","443  >  57039 [ACK] Seq=109622 Ack=74113 Win=1606 Len=0"
"152","19.978933700","151.101.66.187","172.20.40.110","TLSv1.2","214","Application Data"
"153","19.978933700","151.101.66.187","172.20.40.110","TLSv1.2","147","Application Data"
"154","19.979107600","172.20.40.110","151.101.66.187","TCP","54","57039  >  443 [ACK] Seq=85025 Ack=109875 Win=517 Len=0"
"155","19.979533300","151.101.66.187","172.20.40.110","TCP","60","443  >  57039 [ACK] Seq=109875 Ack=76841 Win=1617 Len=0"
"156","19.979533300","151.101.66.187","172.20.40.110","TCP","60","443  >  57039 [ACK] Seq=109875 Ack=79571 Win=1628 Len=0"
"157","19.991334700","151.101.66.187","172.20.40.110","TCP","60","443  >  57039 [ACK] Seq=109875 Ack=82299 Win=1638 Len=0"
"158","19.991334700","151.101.66.187","172.20.40.110","TCP","60","443  >  57039 [ACK] Seq=109875 Ack=85025 Win=1649 Len=0"
"159","19.991334700","151.101.66.187","172.20.40.110","TLSv1.2","138","Application Data"
"160","19.991334700","151.101.66.187","172.20.40.110","TLSv1.2","104","Application Data"
"161","19.991459900","172.20.40.110","151.101.66.187","TCP","54","57039  >  443 [ACK] Seq=85025 Ack=110009 Win=516 Len=0"
"162","20.002718300","151.101.66.187","172.20.40.110","TLSv1.2","104","Application Data"
"163","20.005842200","151.101.66.187","172.20.40.110","TLSv1.2","131","Application Data"
"164","20.005921100","172.20.40.110","151.101.66.187","TCP","54","57039  >  443 [ACK] Seq=85025 Ack=110136 Win=516 Len=0"
"165","20.090001500","172.20.40.110","151.101.66.187","TLSv1.2","2782","Application Data"
"166","20.101419100","172.20.40.110","151.101.66.187","TLSv1.2","2782","Application Data"
"167","20.101503200","151.101.66.187","172.20.40.110","TCP","60","443  >  57039 [ACK] Seq=110136 Ack=87753 Win=1660 Len=0"
"168","20.105279500","151.101.66.187","172.20.40.110","TLSv1.2","98","Application Data"
"169","20.112514200","151.101.66.187","172.20.40.110","TCP","60","443  >  57039 [ACK] Seq=110180 Ack=90481 Win=1670 Len=0"
"170","20.115735500","151.101.66.187","172.20.40.110","TLSv1.2","104","Application Data"
"171","20.115809900","172.20.40.110","151.101.66.187","TCP","54","57039  >  443 [ACK] Seq=90481 Ack=110230 Win=516 Len=0"
"172","20.715677300","172.20.40.110","151.101.66.187","TLSv1.2","2795","Application Data"
"173","20.727903700","151.101.66.187","172.20.40.110","TCP","60","443  >  57039 [ACK] Seq=110230 Ack=93222 Win=1681 Len=0"
"174","20.732809600","151.101.66.187","172.20.40.110","TLSv1.2","214","Application Data"
"175","20.786332500","172.20.40.110","151.101.66.187","TCP","54","57039  >  443 [ACK] Seq=93222 Ack=110390 Win=515 Len=0"
"176","20.787203500","151.101.66.187","172.20.40.110","TCP","214","[TCP Spurious Retransmission] 443  >  57039 [PSH, ACK] Seq=110230 Ack=93222 Win=1681 Len=160"
"177","20.787281700","172.20.40.110","151.101.66.187","TCP","66","[TCP Dup ACK 175#1] 57039  >  443 [ACK] Seq=93222 Ack=110390 Win=515 Len=0 SLE=110230 SRE=110390"
"178","20.815952600","172.20.40.110","151.101.66.187","TLSv1.2","2794","Application Data"
"179","20.827039400","151.101.66.187","172.20.40.110","TCP","60","443  >  57039 [ACK] Seq=110390 Ack=95962 Win=1692 Len=0"
"180","20.830555100","151.101.66.187","172.20.40.110","TLSv1.2","98","Application Data"
"181","20.875453800","172.20.40.110","151.101.66.187","TCP","54","57039  >  443 [ACK] Seq=95962 Ack=110434 Win=515 Len=0"
"182","21.214181000","172.20.40.110","151.101.66.187","TLSv1.2","2780","Application Data"
"183","21.214655800","172.20.40.110","151.101.66.187","TLSv1.2","2783","Application Data"
"184","21.232287800","151.101.66.187","172.20.40.110","TCP","60","443  >  57039 [ACK] Seq=110434 Ack=98688 Win=1702 Len=0"
"185","21.232287800","151.101.66.187","172.20.40.110","TCP","60","443  >  57039 [ACK] Seq=110434 Ack=101417 Win=1713 Len=0"
"186","21.232794700","172.20.40.110","151.101.66.187","TLSv1.2","2786","Application Data"
"187","21.232995400","172.20.40.110","151.101.66.187","TLSv1.2","2780","Application Data"
"188","21.233112800","172.20.40.110","151.101.66.187","TLSv1.2","2787","Application Data"
"189","21.233224400","172.20.40.110","151.101.66.187","TLSv1.2","2786","Application Data"
"190","21.233427900","172.20.40.110","151.101.66.187","TLSv1.2","2780","Application Data"
"191","21.233632200","172.20.40.110","151.101.66.187","TLSv1.2","2780","Application Data"
"192","21.233838900","172.20.40.110","151.101.66.187","TLSv1.2","2786","Application Data"
"193","21.235092000","172.20.40.110","151.101.66.187","TLSv1.2","2779","Application Data"
"194","21.237598000","172.20.40.110","151.101.66.187","TLSv1.2","2777","Application Data"
"195","21.247396800","151.101.66.187","172.20.40.110","TLSv1.2","130","Application Data"
"196","21.247396800","151.101.66.187","172.20.40.110","TLSv1.2","258","Application Data"
"197","21.247526800","172.20.40.110","151.101.66.187","TCP","54","57039  >  443 [ACK] Seq=125972 Ack=110714 Win=514 Len=0"
"198","21.256963100","151.101.66.187","172.20.40.110","TCP","60","443  >  57039 [ACK] Seq=110714 Ack=102797 Win=1719 Len=0"
"199","21.259813100","151.101.66.187","172.20.40.110","TCP","60","443  >  57039 [ACK] Seq=110714 Ack=104149 Win=1724 Len=0"
"200","21.259813100","151.101.66.187","172.20.40.110","TCP","60","443  >  57039 [ACK] Seq=110714 Ack=106875 Win=1735 Len=0"
"201","21.259813100","151.101.66.187","172.20.40.110","TCP","60","443  >  57039 [ACK] Seq=110714 Ack=109608 Win=1746 Len=0"
"202","21.259813100","151.101.66.187","172.20.40.110","TCP","60","443  >  57039 [ACK] Seq=110714 Ack=112340 Win=1756 Len=0"
"203","21.259813100","151.101.66.187","172.20.40.110","TCP","60","443  >  57039 [ACK] Seq=110714 Ack=115066 Win=1767 Len=0"
"204","21.259813100","151.101.66.187","172.20.40.110","TCP","60","443  >  57039 [ACK] Seq=110714 Ack=117792 Win=1778 Len=0"
"205","21.259813100","151.101.66.187","172.20.40.110","TCP","60","443  >  57039 [ACK] Seq=110714 Ack=120524 Win=1788 Len=0"
"206","21.259813100","151.101.66.187","172.20.40.110","TCP","60","443  >  57039 [ACK] Seq=110714 Ack=123249 Win=1799 Len=0"
"207","21.260313200","151.101.66.187","172.20.40.110","TCP","60","443  >  57039 [ACK] Seq=110714 Ack=124629 Win=1805 Len=0"
"208","21.260313200","151.101.66.187","172.20.40.110","TCP","60","443  >  57039 [ACK] Seq=110714 Ack=125972 Win=1810 Len=0"
"209","21.263440600","151.101.66.187","172.20.40.110","TLSv1.2","131","Application Data"
"210","21.264801300","151.101.66.187","172.20.40.110","TLSv1.2","124","Application Data"
"211","21.264871500","172.20.40.110","151.101.66.187","TCP","54","57039  >  443 [ACK] Seq=125972 Ack=110861 Win=513 Len=0"
"212","21.266998700","151.101.66.187","172.20.40.110","TLSv1.2","130","Application Data"
"213","21.268160200","151.101.66.187","172.20.40.110","TLSv1.2","447","Application Data"
"214","21.268271800","172.20.40.110","151.101.66.187","TCP","54","57039  >  443 [ACK] Seq=125972 Ack=111330 Win=517 Len=0"
"215","22.452802000","172.20.40.110","151.101.66.187","TLSv1.2","2792","Application Data"
"216","22.464085700","151.101.66.187","172.20.40.110","TCP","60","443  >  57039 [ACK] Seq=111330 Ack=128710 Win=1821 Len=0"
"217","22.466600600","151.101.66.187","172.20.40.110","TLSv1.2","262","Application Data"
"218","22.516910800","151.101.66.187","172.20.40.110","TCP","262","[TCP Retransmission] 443  >  57039 [PSH, ACK] Seq=111330 Ack=128710 Win=1821 Len=208"
"219","22.516988300","172.20.40.110","151.101.66.187","TCP","66","57039  >  443 [ACK] Seq=128710 Ack=111538 Win=516 Len=0 SLE=111330 SRE=111538"
"220","22.855876000","172.20.40.110","151.101.66.187","TLSv1.2","2792","Application Data"
"221","22.865141000","151.101.66.187","172.20.40.110","TCP","60","443  >  57039 [ACK] Seq=111538 Ack=131448 Win=1832 Len=0"
"222","22.867607900","151.101.66.187","172.20.40.110","TLSv1.2","104","Application Data"
"223","22.918358000","172.20.40.110","151.101.66.187","TCP","54","57039  >  443 [ACK] Seq=131448 Ack=111588 Win=516 Len=0"
"224","22.918516100","151.101.66.187","172.20.40.110","TCP","104","[TCP Spurious Retransmission] 443  >  57039 [PSH, ACK] Seq=111538 Ack=131448 Win=1832 Len=50"
"225","22.918564500","172.20.40.110","151.101.66.187","TCP","66","[TCP Dup ACK 223#1] 57039  >  443 [ACK] Seq=131448 Ack=111588 Win=516 Len=0 SLE=111538 SRE=111588"
"226","23.525173800","172.20.40.110","151.101.66.187","TLSv1.2","2794","Application Data"
"227","23.533757300","172.20.40.110","151.101.66.187","TLSv1.2","2795","Application Data"
"228","23.538054300","151.101.66.187","172.20.40.110","TCP","60","443  >  57039 [ACK] Seq=111588 Ack=134188 Win=1843 Len=0"
"229","23.543909800","151.101.66.187","172.20.40.110","TLSv1.2","241","Application Data"
"230","23.543909800","151.101.66.187","172.20.40.110","TCP","60","443  >  57039 [ACK] Seq=111775 Ack=136929 Win=1855 Len=0"
"231","23.547038400","151.101.66.187","172.20.40.110","TLSv1.2","125","Application Data"
"232","23.547117600","172.20.40.110","151.101.66.187","TCP","54","57039  >  443 [ACK] Seq=136929 Ack=111846 Win=515 Len=0"
"233","23.551393400","172.20.40.110","151.101.66.187","TLSv1.2","2778","Application Data"
"234","23.564160800","151.101.66.187","172.20.40.110","TCP","60","443  >  57039 [ACK] Seq=111846 Ack=139653 Win=1865 Len=0"
"235","23.568588900","151.101.66.187","172.20.40.110","TLSv1.2","259","Application Data"
"236","23.615071000","151.101.66.187","172.20.40.110","TCP","259","[TCP Retransmission] 443  >  57039 [PSH, ACK] Seq=111846 Ack=139653 Win=1865 Len=205"
"237","23.615129900","172.20.40.110","151.101.66.187","TCP","66","57039  >  443 [ACK] Seq=139653 Ack=112051 Win=514 Len=0 SLE=111846 SRE=112051"
"238","24.289633800","172.20.40.110","151.101.66.187","TLSv1.2","2787","Application Data"
"239","24.289844000","172.20.40.110","151.101.66.187","TLSv1.2","2790","Application Data"
"240","24.289965400","172.20.40.110","151.101.66.187","TLSv1.2","2784","Application Data"
"241","24.290076100","172.20.40.110","151.101.66.187","TLSv1.2","2781","Application Data"
"242","24.303758900","151.101.66.187","172.20.40.110","TCP","60","443  >  57039 [ACK] Seq=112051 Ack=142386 Win=1876 Len=0"
"243","24.303758900","151.101.66.187","172.20.40.110","TCP","60","443  >  57039 [ACK] Seq=112051 Ack=145122 Win=1887 Len=0"
"244","24.303758900","151.101.66.187","172.20.40.110","TCP","60","443  >  57039 [ACK] Seq=112051 Ack=147852 Win=1897 Len=0"
"245","24.307077800","151.101.66.187","172.20.40.110","TCP","60","443  >  57039 [ACK] Seq=112051 Ack=150579 Win=1908 Len=0"
"246","24.311410300","151.101.66.187","172.20.40.110","TLSv1.2","104","Application Data"
"247","24.312703100","151.101.66.187","172.20.40.110","TLSv1.2","124","Application Data"
"248","24.312703100","151.101.66.187","172.20.40.110","TLSv1.2","130","Application Data"
"249","24.312791700","172.20.40.110","151.101.66.187","TCP","54","57039  >  443 [ACK] Seq=150579 Ack=112247 Win=513 Len=0"
"250","24.318974100","151.101.66.187","172.20.40.110","TLSv1.2","130","Application Data"
"251","24.319052600","172.20.40.110","151.101.66.187","TCP","54","57039  >  443 [ACK] Seq=150579 Ack=112323 Win=513 Len=0"
"252","25.133859400","172.20.40.110","151.101.66.187","TLSv1.2","2831","Application Data"
"253","25.140229400","172.20.40.110","151.101.66.187","TLSv1.2","2829","Application Data"
"254","25.146494800","151.101.66.187","172.20.40.110","TCP","60","443  >  57039 [ACK] Seq=112323 Ack=153356 Win=1919 Len=0"
"255","25.149220500","151.101.66.187","172.20.40.110","TLSv1.2","219","Application Data"
"256","25.149220500","151.101.66.187","172.20.40.110","TCP","60","443  >  57039 [ACK] Seq=112488 Ack=156131 Win=1930 Len=0"
"257","25.152288200","151.101.66.187","172.20.40.110","TLSv1.2","104","Application Data"
"258","25.152385300","172.20.40.110","151.101.66.187","TCP","54","57039  >  443 [ACK] Seq=156131 Ack=112538 Win=512 Len=0"
"259","25.299385000","172.20.40.110","151.101.66.187","TLSv1.2","2832","Application Data"
"260","25.311558600","151.101.66.187","172.20.40.110","TCP","60","443  >  57039 [ACK] Seq=112538 Ack=158909 Win=1940 Len=0"
"261","25.312887200","151.101.66.187","172.20.40.110","TLSv1.2","142","Application Data"
"262","25.338268400","172.20.40.110","151.101.66.187","TLSv1.2","2830","Application Data"
"263","25.346807300","151.101.66.187","172.20.40.110","TCP","60","443  >  57039 [ACK] Seq=112626 Ack=161685 Win=1951 Len=0"
"264","25.350082200","151.101.66.187","172.20.40.110","TLSv1.2","234","Application Data"
"265","25.390683900","172.20.40.110","151.101.66.187","TCP","54","57039  >  443 [ACK] Seq=161685 Ack=112806 Win=517 Len=0"
"266","25.395628100","151.101.66.187","172.20.40.110","TCP","234","[TCP Spurious Retransmission] 443  >  57039 [PSH, ACK] Seq=112626 Ack=161685 Win=1951 Len=180"
"267","25.395692900","172.20.40.110","151.101.66.187","TCP","66","[TCP Dup ACK 265#1] 57039  >  443 [ACK] Seq=161685 Ack=112806 Win=517 Len=0 SLE=112626 SRE=112806"
"268","26.857478700","172.20.40.110","151.101.66.187","TCP","55","51833  >  443 [ACK] Seq=1 Ack=1 Win=254 Len=1 [TCP PDU reassembled in 467]"
"269","26.865981400","151.101.66.187","172.20.40.110","TCP","66","443  >  51833 [ACK] Seq=1 Ack=2 Win=281 Len=0 SLE=1 SRE=2"
"270","27.652356200","172.20.40.110","151.101.66.187","TLSv1.2","2832","Application Data"
"271","27.664116400","151.101.66.187","172.20.40.110","TCP","60","443  >  57039 [ACK] Seq=112806 Ack=164463 Win=1962 Len=0"
"272","27.669470700","151.101.66.187","172.20.40.110","TLSv1.2","220","Application Data"
"273","27.710278300","172.20.40.110","151.101.66.187","TCP","54","57039  >  443 [ACK] Seq=164463 Ack=112972 Win=516 Len=0"
"274","27.712678100","151.101.66.187","172.20.40.110","TCP","220","[TCP Spurious Retransmission] 443  >  57039 [PSH, ACK] Seq=112806 Ack=164463 Win=1962 Len=166"
"275","27.712865400","172.20.40.110","151.101.66.187","TCP","66","[TCP Dup ACK 273#1] 57039  >  443 [ACK] Seq=164463 Ack=112972 Win=516 Len=0 SLE=112806 SRE=112972"
"276","28.673259800","172.20.40.110","151.101.66.187","TLSv1.2","2831","Application Data"
"277","28.676684000","172.20.40.110","151.101.66.187","TLSv1.2","2819","Application Data"
"278","28.680327600","172.20.40.110","151.101.66.187","TLSv1.2","2813","Application Data"
"279","28.685909900","151.101.66.187","172.20.40.110","TCP","60","443  >  57039 [ACK] Seq=112972 Ack=167240 Win=1973 Len=0"
"280","28.688095000","151.101.66.187","172.20.40.110","TLSv1.2","241","Application Data"
"281","28.690782500","151.101.66.187","172.20.40.110","TCP","60","443  >  57039 [ACK] Seq=113159 Ack=170000 Win=1984 Len=0"
"282","28.690782500","151.101.66.187","172.20.40.110","TCP","60","443  >  57039 [ACK] Seq=113159 Ack=170005 Win=1984 Len=0"
"283","28.690782500","151.101.66.187","172.20.40.110","TCP","60","443  >  57039 [ACK] Seq=113159 Ack=172764 Win=1995 Len=0"
"284","28.692122500","151.101.66.187","172.20.40.110","TLSv1.2","130","Application Data"
"285","28.692208800","172.20.40.110","151.101.66.187","TCP","54","57039  >  443 [ACK] Seq=172764 Ack=113235 Win=515 Len=0"
"286","28.692416100","172.20.40.110","151.101.66.187","TLSv1.2","2832","Application Data"
"287","28.695149000","151.101.66.187","172.20.40.110","TLSv1.2","130","Application Data"
"288","28.701638900","151.101.66.187","172.20.40.110","TCP","60","443  >  57039 [ACK] Seq=113311 Ack=175542 Win=2005 Len=0"
"289","28.704382700","151.101.66.187","172.20.40.110","TLSv1.2","125","Application Data"
"290","28.704455200","172.20.40.110","151.101.66.187","TCP","54","57039  >  443 [ACK] Seq=175542 Ack=113382 Win=515 Len=0"
"291","28.873670500","172.20.40.110","151.101.66.187","TLSv1.2","2835","Application Data"
"292","28.887612600","151.101.66.187","172.20.40.110","TCP","60","443  >  57039 [ACK] Seq=113382 Ack=178323 Win=2017 Len=0"
"293","28.889722600","151.101.66.187","172.20.40.110","TLSv1.2","258","Application Data"
"294","28.930822600","151.101.66.187","172.20.40.110","TCP","258","[TCP Retransmission] 443  >  57039 [PSH, ACK] Seq=113382 Ack=178323 Win=2017 Len=204"
"295","28.930897300","172.20.40.110","151.101.66.187","TCP","66","57039  >  443 [ACK] Seq=178323 Ack=113586 Win=514 Len=0 SLE=113382 SRE=113586"
"296","28.972514900","172.20.40.110","151.101.66.187","TLSv1.2","2820","Application Data"
"297","28.972758600","172.20.40.110","151.101.66.187","TLSv1.2","2823","Application Data"
"298","28.972912400","172.20.40.110","151.101.66.187","TLSv1.2","2817","Application Data"
"299","28.973047500","172.20.40.110","151.101.66.187","TLSv1.2","2819","Application Data"
"300","28.973193800","172.20.40.110","151.101.66.187","TLSv1.2","2814","Application Data"
"301","28.983504400","151.101.66.187","172.20.40.110","TCP","60","443  >  57039 [ACK] Seq=113586 Ack=181089 Win=2027 Len=0"
"302","28.991724300","151.101.66.187","172.20.40.110","TLSv1.2","104","Application Data"
"303","28.991724300","151.101.66.187","172.20.40.110","TCP","60","443  >  57039 [ACK] Seq=113636 Ack=182469 Win=2033 Len=0"
"304","28.995563100","151.101.66.187","172.20.40.110","TCP","60","443  >  57039 [ACK] Seq=113636 Ack=183858 Win=2039 Len=0"
"305","28.995563100","151.101.66.187","172.20.40.110","TCP","60","443  >  57039 [ACK] Seq=113636 Ack=186618 Win=2049 Len=0"
"306","28.995563100","151.101.66.187","172.20.40.110","TCP","60","443  >  57039 [ACK] Seq=113636 Ack=186621 Win=2049 Len=0"
"307","28.995563100","151.101.66.187","172.20.40.110","TCP","60","443  >  57039 [ACK] Seq=113636 Ack=189381 Win=2060 Len=0"
"308","28.995563100","151.101.66.187","172.20.40.110","TCP","60","443  >  57039 [ACK] Seq=113636 Ack=189386 Win=2060 Len=0"
"309","28.999923000","151.101.66.187","172.20.40.110","TCP","60","443  >  57039 [ACK] Seq=113636 Ack=190766 Win=2066 Len=0"
"310","28.999923000","151.101.66.187","172.20.40.110","TLSv1.2","130","Application Data"
"311","28.999923000","151.101.66.187","172.20.40.110","TLSv1.2","124","Application Data"
"312","28.999923000","151.101.66.187","172.20.40.110","TLSv1.2","135","Application Data"
"313","29.000019100","172.20.40.110","151.101.66.187","TCP","54","57039  >  443 [ACK] Seq=192146 Ack=113863 Win=513 Len=0"
"314","29.005772900","151.101.66.187","172.20.40.110","TLSv1.2","130","Application Data"
"315","29.050148000","151.101.66.187","172.20.40.110","TCP","130","[TCP Retransmission] 443  >  57039 [PSH, ACK] Seq=113863 Ack=192146 Win=2071 Len=76"
"316","29.050330600","172.20.40.110","151.101.66.187","TCP","66","57039  >  443 [ACK] Seq=192146 Ack=113939 Win=513 Len=0 SLE=113863 SRE=113939"
"317","29.456502200","172.20.40.110","151.101.66.187","TLSv1.2","2866","Application Data"
"318","29.465182700","172.20.40.110","151.101.66.187","TLSv1.2","2854","Application Data"
"319","29.471251900","151.101.66.187","172.20.40.110","TCP","60","443  >  57039 [ACK] Seq=113939 Ack=194958 Win=2082 Len=0"
"320","29.471251900","151.101.66.187","172.20.40.110","TLSv1.2","235","Application Data"
"321","29.476322400","151.101.66.187","172.20.40.110","TCP","60","443  >  57039 [ACK] Seq=114120 Ack=197758 Win=2093 Len=0"
"322","29.479753500","151.101.66.187","172.20.40.110","TLSv1.2","175","Application Data"
"323","29.479851500","172.20.40.110","151.101.66.187","TCP","54","57039  >  443 [ACK] Seq=197758 Ack=114241 Win=517 Len=0"
"324","29.799716900","172.20.40.110","151.101.66.187","TLSv1.2","2868","Application Data"
"325","29.805496000","172.20.40.110","151.101.66.187","TLSv1.2","2866","Application Data"
"326","29.813693000","151.101.66.187","172.20.40.110","TCP","60","443  >  57039 [ACK] Seq=114241 Ack=200572 Win=2104 Len=0"
"327","29.813693000","151.101.66.187","172.20.40.110","TLSv1.2","137","Application Data"
"328","29.819074500","151.101.66.187","172.20.40.110","TCP","60","443  >  57039 [ACK] Seq=114324 Ack=203384 Win=2115 Len=0"
"329","29.821296700","151.101.66.187","172.20.40.110","TLSv1.2","104","Application Data"
"330","29.821374100","172.20.40.110","151.101.66.187","TCP","54","57039  >  443 [ACK] Seq=203384 Ack=114374 Win=516 Len=0"
"331","29.997017500","172.20.40.110","151.101.66.187","TLSv1.2","2869","Application Data"
"332","30.009606300","151.101.66.187","172.20.40.110","TCP","60","443  >  57039 [ACK] Seq=114374 Ack=206144 Win=2127 Len=0"
"333","30.011448800","151.101.66.187","172.20.40.110","TCP","60","443  >  57039 [ACK] Seq=114374 Ack=206199 Win=2127 Len=0"
"334","30.016219500","151.101.66.187","172.20.40.110","TLSv1.2","98","Application Data"
"335","30.055676800","151.101.66.187","172.20.40.110","TCP","98","[TCP Retransmission] 443  >  57039 [PSH, ACK] Seq=114374 Ack=206199 Win=2127 Len=44"
"336","30.055764800","172.20.40.110","151.101.66.187","TCP","66","57039  >  443 [ACK] Seq=206199 Ack=114418 Win=516 Len=0 SLE=114374 SRE=114418"
"337","30.317781700","172.20.40.110","151.101.66.187","TLSv1.2","2860","Application Data"
"338","30.327838600","172.20.40.110","151.101.66.187","TLSv1.2","2854","Application Data"
"339","30.329877800","151.101.66.187","172.20.40.110","TCP","60","443  >  57039 [ACK] Seq=114418 Ack=209005 Win=2138 Len=0"
"340","30.339034000","151.101.66.187","172.20.40.110","TLSv1.2","131","Application Data"
"341","30.339034000","151.101.66.187","172.20.40.110","TCP","60","443  >  57039 [ACK] Seq=114495 Ack=211805 Win=2149 Len=0"
"342","30.342311600","151.101.66.187","172.20.40.110","TLSv1.2","130","Application Data"
"343","30.342498200","172.20.40.110","151.101.66.187","TCP","54","57039  >  443 [ACK] Seq=211805 Ack=114571 Win=516 Len=0"
"344","32.452245700","172.20.40.110","151.101.66.187","TLSv1.2","2854","Application Data"
"345","32.463272800","172.20.40.110","151.101.66.187","TLSv1.2","2854","Application Data"
"346","32.463438100","151.101.66.187","172.20.40.110","TCP","60","443  >  57039 [ACK] Seq=114571 Ack=214605 Win=2160 Len=0"
"347","32.465928500","151.101.66.187","172.20.40.110","TLSv1.2","214","Application Data"
"348","32.472245000","151.101.66.187","172.20.40.110","TCP","60","443  >  57039 [ACK] Seq=114731 Ack=217405 Win=2171 Len=0"
"349","32.474659000","151.101.66.187","172.20.40.110","TLSv1.2","103","Application Data"
"350","32.474768300","172.20.40.110","151.101.66.187","TCP","54","57039  >  443 [ACK] Seq=217405 Ack=114780 Win=515 Len=0"
"351","32.515085700","172.20.40.110","151.101.66.187","TLSv1.2","2856","Application Data"
"352","32.527227900","151.101.66.187","172.20.40.110","TCP","60","443  >  57039 [ACK] Seq=114780 Ack=220207 Win=2182 Len=0"
"353","32.529420400","151.101.66.187","172.20.40.110","TLSv1.2","104","Application Data"
"354","32.568212600","151.101.66.187","172.20.40.110","TCP","104","[TCP Retransmission] 443  >  57039 [PSH, ACK] Seq=114780 Ack=220207 Win=2182 Len=50"
"355","32.568283500","172.20.40.110","151.101.66.187","TCP","66","57039  >  443 [ACK] Seq=220207 Ack=114830 Win=515 Len=0 SLE=114780 SRE=114830"
"356","32.989129700","172.20.40.110","151.101.66.187","TLSv1.2","2656","Application Data"
"357","33.002135100","151.101.66.187","172.20.40.110","TCP","60","443  >  57039 [ACK] Seq=114830 Ack=222809 Win=2192 Len=0"
"358","33.473260100","172.20.40.110","151.101.66.187","TLSv1.2","2854","Application Data"
"359","33.482445000","172.20.40.110","151.101.66.187","TLSv1.2","2854","Application Data"
"360","33.489147400","151.101.66.187","172.20.40.110","TCP","60","443  >  57039 [ACK] Seq=114830 Ack=225609 Win=2203 Len=0"
"361","33.489147400","151.101.66.187","172.20.40.110","TLSv1.2","342","Application Data"
"362","33.496828000","151.101.66.187","172.20.40.110","TCP","60","443  >  57039 [ACK] Seq=115118 Ack=228409 Win=2214 Len=0"
"363","33.500318300","151.101.66.187","172.20.40.110","TLSv1.2","104","Application Data"
"364","33.500396600","172.20.40.110","151.101.66.187","TCP","54","57039  >  443 [ACK] Seq=228409 Ack=115168 Win=513 Len=0"
"365","33.525186800","172.20.40.110","151.101.66.187","TLSv1.2","2860","Application Data"
"366","33.538429300","151.101.66.187","172.20.40.110","TCP","60","443  >  57039 [ACK] Seq=115168 Ack=231215 Win=2225 Len=0"
"367","33.541791700","151.101.66.187","172.20.40.110","TLSv1.2","130","Application Data"
"368","33.581897800","151.101.66.187","172.20.40.110","TCP","130","[TCP Retransmission] 443  >  57039 [PSH, ACK] Seq=115168 Ack=231215 Win=2225 Len=76"
"369","33.581956100","172.20.40.110","151.101.66.187","TCP","66","57039  >  443 [ACK] Seq=231215 Ack=115244 Win=513 Len=0 SLE=115168 SRE=115244"
"370","33.676313800","151.101.66.187","172.20.40.110","TLSv1.2","515","Application Data"
"371","33.679167000","172.20.40.110","151.101.66.187","TLSv1.2","89","Application Data"
"372","33.692298200","151.101.66.187","172.20.40.110","TCP","60","443  >  57039 [ACK] Seq=115705 Ack=231250 Win=2225 Len=0"
"373","34.162621700","172.20.40.110","151.101.66.187","TLSv1.2","2854","Application Data"
"374","34.175892400","172.20.40.110","151.101.66.187","TLSv1.2","2854","Application Data"
"375","34.179118800","151.101.66.187","172.20.40.110","TCP","60","443  >  57039 [ACK] Seq=115705 Ack=234050 Win=2236 Len=0"
"376","34.181928400","151.101.66.187","172.20.40.110","TLSv1.2","175","Application Data"
"377","34.186143100","151.101.66.187","172.20.40.110","TCP","60","443  >  57039 [ACK] Seq=115826 Ack=236850 Win=2247 Len=0"
"378","34.188399000","151.101.66.187","172.20.40.110","TLSv1.2","104","Application Data"
"379","34.188474500","172.20.40.110","151.101.66.187","TCP","54","57039  >  443 [ACK] Seq=236850 Ack=115876 Win=516 Len=0"
"380","38.810428500","172.20.40.110","151.101.66.187","TLSv1.2","2892","Application Data"
"381","38.821090100","151.101.66.187","172.20.40.110","TCP","60","443  >  57039 [ACK] Seq=115876 Ack=239688 Win=2258 Len=0"
"382","38.825308000","151.101.66.187","172.20.40.110","TLSv1.2","274","Application Data"
"383","38.833980500","172.20.40.110","151.101.66.187","TLSv1.2","2883","Application Data"
"384","38.835588800","172.20.40.110","151.101.66.187","TLSv1.2","2877","Application Data"
"385","38.841968900","172.20.40.110","151.101.66.187","TLSv1.2","2877","Application Data"
"386","38.844486700","151.101.66.187","172.20.40.110","TCP","60","443  >  57039 [ACK] Seq=116096 Ack=242517 Win=2269 Len=0"
"387","38.848183100","151.101.66.187","172.20.40.110","TCP","60","443  >  57039 [ACK] Seq=116096 Ack=245340 Win=2280 Len=0"
"388","38.848183100","151.101.66.187","172.20.40.110","TLSv1.2","130","Application Data"
"389","38.850307200","151.101.66.187","172.20.40.110","TLSv1.2","131","Application Data"
"390","38.850368200","172.20.40.110","151.101.66.187","TCP","54","57039  >  443 [ACK] Seq=248163 Ack=116249 Win=515 Len=0"
"391","38.851646700","151.101.66.187","172.20.40.110","TCP","60","443  >  57039 [ACK] Seq=116249 Ack=248163 Win=2291 Len=0"
"392","38.854789700","151.101.66.187","172.20.40.110","TLSv1.2","130","Application Data"
"393","38.896813900","172.20.40.110","151.101.66.187","TCP","54","57039  >  443 [ACK] Seq=248163 Ack=116325 Win=515 Len=0"
"394","38.901265000","151.101.66.187","172.20.40.110","TCP","130","[TCP Spurious Retransmission] 443  >  57039 [PSH, ACK] Seq=116249 Ack=248163 Win=2291 Len=76"
"395","38.901332600","172.20.40.110","151.101.66.187","TCP","66","[TCP Dup ACK 393#1] 57039  >  443 [ACK] Seq=248163 Ack=116325 Win=515 Len=0 SLE=116249 SRE=116325"
"396","38.983926300","172.20.40.110","151.101.66.187","TLSv1.2","2877","Application Data"
"397","39.008378300","151.101.66.187","172.20.40.110","TCP","60","443  >  57039 [ACK] Seq=116325 Ack=250986 Win=2302 Len=0"
"398","39.011891500","151.101.66.187","172.20.40.110","TLSv1.2","258","Application Data"
"399","39.032413800","151.101.66.187","172.20.40.110","TCP","258","[TCP Retransmission] 443  >  57039 [PSH, ACK] Seq=116325 Ack=250986 Win=2302 Len=204"
"400","39.032500400","172.20.40.110","151.101.66.187","TCP","66","57039  >  443 [ACK] Seq=250986 Ack=116529 Win=514 Len=0 SLE=116325 SRE=116529"
"401","39.069953900","172.20.40.110","151.101.66.187","TLSv1.2","2874","Application Data"
"402","39.079298400","151.101.66.187","172.20.40.110","TCP","60","443  >  57039 [ACK] Seq=116529 Ack=253806 Win=2313 Len=0"
"403","39.082467300","151.101.66.187","172.20.40.110","TLSv1.2","125","Application Data"
"404","39.119813200","151.101.66.187","172.20.40.110","TCP","125","[TCP Retransmission] 443  >  57039 [PSH, ACK] Seq=116529 Ack=253806 Win=2313 Len=71"
"405","39.119876500","172.20.40.110","151.101.66.187","TCP","66","57039  >  443 [ACK] Seq=253806 Ack=116600 Win=514 Len=0 SLE=116529 SRE=116600"
"406","39.159406000","172.20.40.110","151.101.66.187","TLSv1.2","2874","Application Data"
"407","39.171535100","151.101.66.187","172.20.40.110","TCP","60","443  >  57039 [ACK] Seq=116600 Ack=256626 Win=2324 Len=0"
"408","39.171535100","151.101.66.187","172.20.40.110","TLSv1.2","98","Application Data"
"409","39.175939600","172.20.40.110","151.101.66.187","TLSv1.2","2880","Application Data"
"410","39.178116600","172.20.40.110","151.101.66.187","TLSv1.2","2876","Application Data"
"411","39.178299700","172.20.40.110","151.101.66.187","TLSv1.2","2879","Application Data"
"412","39.185460000","151.101.66.187","172.20.40.110","TCP","60","443  >  57039 [ACK] Seq=116644 Ack=259452 Win=2335 Len=0"
"413","39.189043400","151.101.66.187","172.20.40.110","TLSv1.2","131","Application Data"
"414","39.191945100","151.101.66.187","172.20.40.110","TCP","60","443  >  57039 [ACK] Seq=116721 Ack=262274 Win=2346 Len=0"
"415","39.191945100","151.101.66.187","172.20.40.110","TCP","60","443  >  57039 [ACK] Seq=116721 Ack=265099 Win=2357 Len=0"
"416","39.196402900","151.101.66.187","172.20.40.110","TLSv1.2","124","Application Data"
"417","39.196487400","172.20.40.110","151.101.66.187","TCP","54","57039  >  443 [ACK] Seq=265099 Ack=116791 Win=513 Len=0"
"418","39.197417900","151.101.66.187","172.20.40.110","TLSv1.2","124","Application Data"
"419","39.238342400","151.101.66.187","172.20.40.110","TCP","124","[TCP Retransmission] 443  >  57039 [PSH, ACK] Seq=116791 Ack=265099 Win=2357 Len=70"
"420","39.238396700","172.20.40.110","151.101.66.187","TCP","66","57039  >  443 [ACK] Seq=265099 Ack=116861 Win=512 Len=0 SLE=116791 SRE=116861"
"421","39.278782300","172.20.40.110","151.101.66.187","TLSv1.2","2891","Application Data"
"422","39.288244900","151.101.66.187","172.20.40.110","TCP","60","443  >  57039 [ACK] Seq=116861 Ack=267936 Win=2368 Len=0"
"423","39.291411600","151.101.66.187","172.20.40.110","TLSv1.2","130","Application Data"
"424","39.326402400","151.101.66.187","172.20.40.110","TCP","130","[TCP Retransmission] 443  >  57039 [PSH, ACK] Seq=116861 Ack=267936 Win=2368 Len=76"
"425","39.326467800","172.20.40.110","151.101.66.187","TCP","66","57039  >  443 [ACK] Seq=267936 Ack=116937 Win=512 Len=0 SLE=116861 SRE=116937"
"426","39.504467100","172.20.40.110","151.101.66.187","TLSv1.2","2891","Application Data"
"427","39.505506000","172.20.40.110","151.101.66.187","TLSv1.2","2892","Application Data"
"428","39.514154500","151.101.66.187","172.20.40.110","TCP","60","443  >  57039 [ACK] Seq=116937 Ack=270773 Win=2379 Len=0"
"429","39.516992400","151.101.66.187","172.20.40.110","TCP","60","443  >  57039 [ACK] Seq=116937 Ack=273611 Win=2390 Len=0"
"430","39.516992400","151.101.66.187","172.20.40.110","TLSv1.2","240","Application Data"
"431","39.518311100","151.101.66.187","172.20.40.110","TLSv1.2","142","Application Data"
"432","39.518391300","172.20.40.110","151.101.66.187","TCP","54","57039  >  443 [ACK] Seq=273611 Ack=117211 Win=517 Len=0"
"433","39.853440100","172.20.40.110","151.101.66.187","TLSv1.2","2877","Application Data"
"434","39.867826400","151.101.66.187","172.20.40.110","TCP","60","443  >  57039 [ACK] Seq=117211 Ack=276434 Win=2401 Len=0"
"435","39.870478900","151.101.66.187","172.20.40.110","TLSv1.2","104","Application Data"
"436","39.903566900","151.101.66.187","172.20.40.110","TCP","104","[TCP Retransmission] 443  >  57039 [PSH, ACK] Seq=117211 Ack=276434 Win=2401 Len=50"
"437","39.903625800","172.20.40.110","151.101.66.187","TCP","66","57039  >  443 [ACK] Seq=276434 Ack=117261 Win=517 Len=0 SLE=117211 SRE=117261"
"438","40.304977100","172.20.40.110","151.101.66.187","TLSv1.2","2874","Application Data"
"439","40.305201800","172.20.40.110","151.101.66.187","TLSv1.2","2871","Application Data"
"440","40.305340400","172.20.40.110","151.101.66.187","TLSv1.2","2877","Application Data"
"441","40.331385000","151.101.66.187","172.20.40.110","TCP","60","443  >  57039 [ACK] Seq=117261 Ack=279254 Win=2412 Len=0"
"442","40.331385000","151.101.66.187","172.20.40.110","TCP","60","443  >  57039 [ACK] Seq=117261 Ack=282071 Win=2423 Len=0"
"443","40.331385000","151.101.66.187","172.20.40.110","TCP","60","443  >  57039 [ACK] Seq=117261 Ack=284894 Win=2434 Len=0"
"444","40.332755000","172.20.40.110","151.101.66.187","TLSv1.2","2866","Application Data"
"445","40.339488200","151.101.66.187","172.20.40.110","TLSv1.2","130","Application Data"
"446","40.339488200","151.101.66.187","172.20.40.110","TLSv1.2","130","Application Data"
"447","40.339488200","151.101.66.187","172.20.40.110","TLSv1.2","162","Application Data"
"448","40.339569500","172.20.40.110","151.101.66.187","TCP","54","57039  >  443 [ACK] Seq=287706 Ack=117521 Win=516 Len=0"
"449","40.347139900","151.101.66.187","172.20.40.110","TCP","60","443  >  57039 [ACK] Seq=117521 Ack=287706 Win=2445 Len=0"
"450","40.358491000","151.101.66.187","172.20.40.110","TLSv1.2","240","Application Data"
"451","40.358627500","172.20.40.110","151.101.66.187","TCP","54","57039  >  443 [ACK] Seq=287706 Ack=117707 Win=515 Len=0"
"452","40.380118100","172.20.40.110","151.101.66.187","TLSv1.2","2629","Application Data"
"453","40.381427200","172.20.40.110","151.101.66.187","TLSv1.2","2893","Application Data"
"454","40.408026400","151.101.66.187","172.20.40.110","TCP","60","443  >  57039 [ACK] Seq=117707 Ack=290281 Win=2455 Len=0"
"455","40.408026400","151.101.66.187","172.20.40.110","TCP","60","443  >  57039 [ACK] Seq=117707 Ack=293120 Win=2467 Len=0"
"456","40.408026400","151.101.66.187","172.20.40.110","TLSv1.2","130","Application Data"
"457","40.440025000","151.101.66.187","172.20.40.110","TCP","130","[TCP Retransmission] 443  >  57039 [PSH, ACK] Seq=117707 Ack=293120 Win=2467 Len=76"
"458","40.440110100","172.20.40.110","151.101.66.187","TCP","66","57039  >  443 [ACK] Seq=293120 Ack=117783 Win=515 Len=0 SLE=117707 SRE=117783"
"459","40.466326700","151.101.66.187","172.20.40.110","TLSv1.2","478","Application Data"
"460","40.466326700","151.101.66.187","172.20.40.110","TCP","1434","443  >  57039 [ACK] Seq=118207 Ack=293120 Win=2467 Len=1380 [TCP PDU reassembled in 463]"
"461","40.466419400","172.20.40.110","151.101.66.187","TCP","54","57039  >  443 [ACK] Seq=293120 Ack=119587 Win=517 Len=0"
"462","40.468263300","151.101.66.187","172.20.40.110","TCP","1434","443  >  57039 [ACK] Seq=119587 Ack=293120 Win=2467 Len=1380 [TCP PDU reassembled in 463]"
"463","40.468263300","151.101.66.187","172.20.40.110","TLSv1.2","760","Application Data"
"464","40.468498000","172.20.40.110","151.101.66.187","TCP","54","57039  >  443 [ACK] Seq=293120 Ack=121673 Win=517 Len=0"
"465","40.478573100","172.20.40.110","151.101.66.187","TLSv1.2","89","Application Data"
"466","40.485678100","151.101.66.187","172.20.40.110","TCP","60","443  >  57039 [ACK] Seq=121673 Ack=293155 Win=2467 Len=0"
"467","40.530286700","172.20.40.110","151.101.66.187","TLSv1.2","175","Ignored Unknown Record"
"468","40.530407600","172.20.40.110","151.101.66.187","TLSv1.2","93","Application Data"
"469","40.538693300","151.101.66.187","172.20.40.110","TCP","60","443  >  51833 [ACK] Seq=1 Ack=123 Win=281 Len=0"
"470","40.538693300","151.101.66.187","172.20.40.110","TCP","60","443  >  51833 [ACK] Seq=1 Ack=162 Win=281 Len=0"
"471","40.539781900","151.101.66.187","172.20.40.110","TLSv1.2","93","Application Data"
"472","40.542290100","151.101.66.187","172.20.40.110","TLSv1.2","292","Application Data"
"473","40.542356600","172.20.40.110","151.101.66.187","TCP","54","51833  >  443 [ACK] Seq=162 Ack=278 Win=258 Len=0"
"474","40.829384500","172.20.40.110","151.101.66.187","TLSv1.2","2906","Application Data"
"475","40.832533300","172.20.40.110","151.101.66.187","TLSv1.2","2907","Application Data"
"476","40.838029300","151.101.66.187","172.20.40.110","TCP","60","443  >  57039 [ACK] Seq=121673 Ack=296007 Win=2478 Len=0"
"477","40.842627800","151.101.66.187","172.20.40.110","TCP","60","443  >  57039 [ACK] Seq=121673 Ack=298860 Win=2489 Len=0"
"478","40.843836800","151.101.66.187","172.20.40.110","TLSv1.2","264","Application Data"
"479","40.844373100","172.20.40.110","151.101.66.187","TLSv1.2","2896","Application Data"
"480","40.844890500","151.101.66.187","172.20.40.110","TLSv1.2","169","Application Data"
"481","40.857190000","151.101.66.187","172.20.40.110","TCP","60","443  >  57039 [ACK] Seq=121998 Ack=301702 Win=2500 Len=0"
"482","40.859164900","151.101.66.187","172.20.40.110","TLSv1.2","163","Application Data"
"483","40.859239000","172.20.40.110","151.101.66.187","TCP","54","57039  >  443 [ACK] Seq=301702 Ack=122107 Win=515 Len=0"
"484","40.892140000","172.20.40.110","151.101.66.187","TLSv1.2","2890","Application Data"
"485","40.892541100","172.20.40.110","151.101.66.187","TLSv1.2","2891","Application Data"
"486","40.901298500","151.101.66.187","172.20.40.110","TCP","60","443  >  57039 [ACK] Seq=122107 Ack=304538 Win=2511 Len=0"
"487","40.902720200","151.101.66.187","172.20.40.110","TCP","60","443  >  57039 [ACK] Seq=122107 Ack=307375 Win=2522 Len=0"
"488","40.917132400","151.101.66.187","172.20.40.110","TLSv1.2","240","Application Data"
"489","40.920044100","151.101.66.187","172.20.40.110","TLSv1.2","130","Application Data"
"490","40.920136800","172.20.40.110","151.101.66.187","TCP","54","57039  >  443 [ACK] Seq=307375 Ack=122369 Win=514 Len=0"
"491","46.809008400","172.20.40.110","151.101.66.187","TLSv1.2","2906","Application Data"
"492","46.823203600","151.101.66.187","172.20.40.110","TCP","60","443  >  57039 [ACK] Seq=122369 Ack=310227 Win=2533 Len=0"
"493","46.828480000","151.101.66.187","172.20.40.110","TLSv1.2","214","Application Data"
"494","46.857396000","151.101.66.187","172.20.40.110","TCP","214","[TCP Retransmission] 443  >  57039 [PSH, ACK] Seq=122369 Ack=310227 Win=2533 Len=160"
"495","46.857477400","172.20.40.110","151.101.66.187","TCP","66","57039  >  443 [ACK] Seq=310227 Ack=122529 Win=514 Len=0 SLE=122369 SRE=122529"
"496","46.898520000","172.20.40.110","151.101.66.187","TLSv1.2","2907","Application Data"
"497","46.909683600","151.101.66.187","172.20.40.110","TCP","60","443  >  57039 [ACK] Seq=122529 Ack=313080 Win=2544 Len=0"
"498","46.914352900","151.101.66.187","172.20.40.110","TLSv1.2","98","Application Data"
"499","46.945296300","151.101.66.187","172.20.40.110","TCP","98","[TCP Retransmission] 443  >  57039 [PSH, ACK] Seq=122529 Ack=313080 Win=2544 Len=44"
"500","46.945465900","172.20.40.110","151.101.66.187","TCP","66","57039  >  443 [ACK] Seq=313080 Ack=122573 Win=513 Len=0 SLE=122529 SRE=122573"
"501","47.497760000","172.20.40.110","151.101.66.187","TLSv1.2","2906","Application Data"
"502","47.516314200","151.101.66.187","172.20.40.110","TCP","60","443  >  57039 [ACK] Seq=122573 Ack=315932 Win=2555 Len=0"
"503","47.516314200","151.101.66.187","172.20.40.110","TLSv1.2","208","Application Data"
"504","47.536193800","172.20.40.110","151.101.66.187","TLSv1.2","2907","Application Data"
"505","47.546469500","151.101.66.187","172.20.40.110","TCP","60","443  >  57039 [ACK] Seq=122727 Ack=318785 Win=2567 Len=0"
"506","47.548847800","151.101.66.187","172.20.40.110","TLSv1.2","98","Application Data"
"507","47.583893000","151.101.66.187","172.20.40.110","TCP","98","[TCP Retransmission] 443  >  57039 [PSH, ACK] Seq=122727 Ack=318785 Win=2567 Len=44"
"508","47.583945500","172.20.40.110","151.101.66.187","TCP","66","57039  >  443 [ACK] Seq=318785 Ack=122771 Win=513 Len=0 SLE=122727 SRE=122771"
"509","50.406298800","172.20.40.110","151.101.66.187","TLSv1.2","2906","Application Data"
"510","50.419200900","151.101.66.187","172.20.40.110","TCP","60","443  >  57039 [ACK] Seq=122771 Ack=321637 Win=2578 Len=0"
"511","50.426164900","151.101.66.187","172.20.40.110","TLSv1.2","214","Application Data"
"512","50.458804300","151.101.66.187","172.20.40.110","TCP","214","[TCP Retransmission] 443  >  57039 [PSH, ACK] Seq=122771 Ack=321637 Win=2578 Len=160"
"513","50.459149300","172.20.40.110","151.101.66.187","TCP","66","57039  >  443 [ACK] Seq=321637 Ack=122931 Win=512 Len=0 SLE=122771 SRE=122931"
"514","50.487349700","172.20.40.110","151.101.66.187","TLSv1.2","2907","Application Data"
"515","50.501851800","151.101.66.187","172.20.40.110","TCP","60","443  >  57039 [ACK] Seq=122931 Ack=324490 Win=2589 Len=0"
"516","50.506543600","151.101.66.187","172.20.40.110","TLSv1.2","98","Application Data"
"517","50.543053900","151.101.66.187","172.20.40.110","TCP","98","[TCP Retransmission] 443  >  57039 [PSH, ACK] Seq=122931 Ack=324490 Win=2589 Len=44"
"518","50.543136700","172.20.40.110","151.101.66.187","TCP","66","57039  >  443 [ACK] Seq=324490 Ack=122975 Win=512 Len=0 SLE=122931 SRE=122975"
"519","53.340317900","172.20.40.110","151.101.66.187","TLSv1.2","2886","Application Data"
"520","53.353461800","151.101.66.187","172.20.40.110","TCP","60","443  >  57039 [ACK] Seq=122975 Ack=327322 Win=2600 Len=0"
"521","53.354610200","151.101.66.187","172.20.40.110","TLSv1.2","241","Application Data"
"522","53.389265900","151.101.66.187","172.20.40.110","TCP","241","[TCP Retransmission] 443  >  57039 [PSH, ACK] Seq=122975 Ack=327322 Win=2600 Len=187"
"523","53.389325000","172.20.40.110","151.101.66.187","TCP","66","57039  >  443 [ACK] Seq=327322 Ack=123162 Win=517 Len=0 SLE=122975 SRE=123162"
"524","53.390325700","172.20.40.110","151.101.66.187","TLSv1.2","2899","Application Data"
"525","53.401342500","151.101.66.187","172.20.40.110","TCP","60","443  >  57039 [ACK] Seq=123162 Ack=330167 Win=2611 Len=0"
"526","53.402482600","151.101.66.187","172.20.40.110","TLSv1.2","104","Application Data"
"527","53.407153200","172.20.40.110","151.101.66.187","TLSv1.2","2884","Application Data"
"528","53.407425500","172.20.40.110","151.101.66.187","TLSv1.2","2884","Application Data"
"529","53.409005000","172.20.40.110","151.101.66.187","TLSv1.2","2890","Application Data"
"530","53.423851600","151.101.66.187","172.20.40.110","TCP","60","443  >  57039 [ACK] Seq=123212 Ack=332997 Win=2622 Len=0"
"531","53.423851600","151.101.66.187","172.20.40.110","TCP","60","443  >  57039 [ACK] Seq=123212 Ack=335827 Win=2634 Len=0"
"532","53.423851600","151.101.66.187","172.20.40.110","TCP","60","443  >  57039 [ACK] Seq=123212 Ack=338663 Win=2645 Len=0"
"533","53.431978900","151.101.66.187","172.20.40.110","TLSv1.2","130","Application Data"
"534","53.431978900","151.101.66.187","172.20.40.110","TLSv1.2","264","Application Data"
"535","53.431978900","151.101.66.187","172.20.40.110","TLSv1.2","168","Application Data"
"536","53.432108700","172.20.40.110","151.101.66.187","TCP","54","57039  >  443 [ACK] Seq=338663 Ack=123612 Win=515 Len=0"
"537","53.467579200","172.20.40.110","151.101.66.187","TLSv1.2","2884","Application Data"
"538","53.481942400","151.101.66.187","172.20.40.110","TCP","60","443  >  57039 [ACK] Seq=123612 Ack=341493 Win=2656 Len=0"
"539","53.484189700","151.101.66.187","172.20.40.110","TLSv1.2","163","Application Data"
"540","53.520473000","151.101.66.187","172.20.40.110","TCP","163","[TCP Retransmission] 443  >  57039 [PSH, ACK] Seq=123612 Ack=341493 Win=2656 Len=109"
"541","53.520525300","172.20.40.110","151.101.66.187","TCP","66","57039  >  443 [ACK] Seq=341493 Ack=123721 Win=515 Len=0 SLE=123612 SRE=123721"
"542","53.625171700","172.20.40.110","151.101.66.187","TLSv1.2","2881","Application Data"
"543","53.638139700","151.101.66.187","172.20.40.110","TCP","60","443  >  57039 [ACK] Seq=123721 Ack=344320 Win=2667 Len=0"
"544","53.641346500","151.101.66.187","172.20.40.110","TLSv1.2","125","Application Data"
"545","53.645164600","172.20.40.110","151.101.66.187","TLSv1.2","2898","Application Data"
"546","53.658550800","151.101.66.187","172.20.40.110","TCP","60","443  >  57039 [ACK] Seq=123792 Ack=347164 Win=2678 Len=0"
"547","53.659665800","151.101.66.187","172.20.40.110","TLSv1.2","130","Application Data"
"548","53.670494800","172.20.40.110","151.101.66.187","TLSv1.2","2898","Application Data"
"549","53.681037400","151.101.66.187","172.20.40.110","TCP","60","443  >  57039 [ACK] Seq=123868 Ack=350008 Win=2689 Len=0"
"550","53.684239100","151.101.66.187","172.20.40.110","TLSv1.2","125","Application Data"
"551","53.718960800","151.101.66.187","172.20.40.110","TCP","125","[TCP Retransmission] 443  >  57039 [PSH, ACK] Seq=123868 Ack=350008 Win=2689 Len=71"
"552","53.719016900","172.20.40.110","151.101.66.187","TCP","66","57039  >  443 [ACK] Seq=350008 Ack=123939 Win=514 Len=0 SLE=123868 SRE=123939"
"553","53.850162300","172.20.40.110","151.101.66.187","TLSv1.2","2887","Application Data"
"554","53.851352100","172.20.40.110","151.101.66.187","TLSv1.2","2884","Application Data"
"555","53.851616200","172.20.40.110","151.101.66.187","TLSv1.2","2881","Application Data"
"556","53.851928800","172.20.40.110","151.101.66.187","TLSv1.2","2884","Application Data"
"557","53.859857900","151.101.66.187","172.20.40.110","TCP","60","443  >  57039 [ACK] Seq=123939 Ack=352841 Win=2700 Len=0"
"558","53.862969000","151.101.66.187","172.20.40.110","TLSv1.2","129","Application Data"
"559","53.864649000","151.101.66.187","172.20.40.110","TCP","60","443  >  57039 [ACK] Seq=124014 Ack=355671 Win=2711 Len=0"
"560","53.864649000","151.101.66.187","172.20.40.110","TCP","60","443  >  57039 [ACK] Seq=124014 Ack=358498 Win=2722 Len=0"
"561","53.865704600","151.101.66.187","172.20.40.110","TCP","60","443  >  57039 [ACK] Seq=124014 Ack=361328 Win=2734 Len=0"
"562","53.867900000","151.101.66.187","172.20.40.110","TLSv1.2","130","Application Data"
"563","53.868000700","172.20.40.110","151.101.66.187","TCP","54","57039  >  443 [ACK] Seq=361328 Ack=124090 Win=513 Len=0"
"564","53.869242600","151.101.66.187","172.20.40.110","TLSv1.2","130","Application Data"
"565","53.869242600","151.101.66.187","172.20.40.110","TLSv1.2","130","Application Data"
"566","53.869357600","172.20.40.110","151.101.66.187","TCP","54","57039  >  443 [ACK] Seq=361328 Ack=124242 Win=513 Len=0"
"567","54.039227800","172.20.40.110","151.101.66.187","TLSv1.2","2897","Application Data"
"568","54.050275300","172.20.40.110","151.101.66.187","TLSv1.2","2899","Application Data"
"569","54.053485900","151.101.66.187","172.20.40.110","TCP","60","443  >  57039 [ACK] Seq=124242 Ack=364171 Win=2745 Len=0"
"570","54.054661600","172.20.40.110","151.101.66.187","TLSv1.2","2895","Application Data"
"571","54.056096700","172.20.40.110","151.101.66.187","TLSv1.2","2898","Application Data"
"572","54.068704800","151.101.66.187","172.20.40.110","TLSv1.2","124","Application Data"
"573","54.068704800","151.101.66.187","172.20.40.110","TCP","60","443  >  57039 [ACK] Seq=124312 Ack=367016 Win=2756 Len=0"
"574","54.068704800","151.101.66.187","172.20.40.110","TLSv1.2","241","Application Data"
"575","54.068704800","151.101.66.187","172.20.40.110","TCP","60","443  >  57039 [ACK] Seq=124499 Ack=369857 Win=2767 Len=0"
"576","54.068704800","151.101.66.187","172.20.40.110","TCP","60","443  >  57039 [ACK] Seq=124499 Ack=372701 Win=2778 Len=0"
"577","54.068834400","172.20.40.110","151.101.66.187","TCP","54","57039  >  443 [ACK] Seq=372701 Ack=124499 Win=512 Len=0"
"578","54.069923800","151.101.66.187","172.20.40.110","TLSv1.2","130","Application Data"
"579","54.069923800","151.101.66.187","172.20.40.110","TLSv1.2","124","Application Data"
"580","54.070017200","172.20.40.110","151.101.66.187","TCP","54","57039  >  443 [ACK] Seq=372701 Ack=124645 Win=517 Len=0"
