No.,Time,Source,Destination,Protocol,Length,Info
1,0.0,100.84.170.161,151.101.2.187,TLSv1.2,2422,Application Data
2,0.0003071,100.84.170.161,151.101.2.187,TLSv1.2,93,Application Data
3,0.0006343,100.84.170.161,151.101.2.187,TLSv1.2,2509,Application Data
4,0.0111441,151.101.2.187,100.84.170.161,TCP,56,443  >  55283 [ACK] Seq=1 Ack=4863 Win=950 Len=0
5,0.0118454,151.101.2.187,100.84.170.161,TLSv1.2,93,Application Data
6,0.0146894,151.101.2.187,100.84.170.161,TLSv1.2,240,Application Data
7,0.0147721,100.84.170.161,151.101.2.187,TCP,54,55283  >  443 [ACK] Seq=4863 Ack=226 Win=512 Len=0
8,0.0149557,151.101.2.187,100.84.170.161,TLSv1.2,130,Application Data
9,0.0554322,151.101.2.187,100.84.170.161,TCP,130,"[TCP Retransmission] 443  >  55283 [PSH, ACK] Seq=226 Ack=4863 Win=950 Len=76"
10,0.0554792,100.84.170.161,151.101.2.187,TCP,66,55283  >  443 [ACK] Seq=4863 Ack=302 Win=512 Len=0 SLE=226 SRE=302
11,0.159609,100.84.170.161,151.101.2.187,TLSv1.2,2508,Application Data
12,0.1677861,100.84.170.161,151.101.2.187,TLSv1.2,2509,Application Data
13,0.1687292,151.101.2.187,100.84.170.161,TCP,56,443  >  55283 [ACK] Seq=302 Ack=7317 Win=961 Len=0
14,0.1721289,151.101.2.187,100.84.170.161,TLSv1.2,98,Application Data
15,0.176782,151.101.2.187,100.84.170.161,TCP,56,443  >  55283 [ACK] Seq=346 Ack=9772 Win=973 Len=0
16,0.1796299,151.101.2.187,100.84.170.161,TLSv1.2,98,Application Data
17,0.1797246,100.84.170.161,151.101.2.187,TCP,54,55283  >  443 [ACK] Seq=9772 Ack=390 Win=511 Len=0
18,0.7595492,100.84.170.161,151.101.2.187,TLSv1.2,2508,Application Data
19,0.7685721,151.101.2.187,100.84.170.161,TCP,56,443  >  55283 [ACK] Seq=390 Ack=12226 Win=984 Len=0
20,0.7708523,151.101.2.187,100.84.170.161,TLSv1.2,213,Application Data
21,0.8036403,151.101.2.187,100.84.170.161,TCP,213,"[TCP Retransmission] 443  >  55283 [PSH, ACK] Seq=390 Ack=12226 Win=984 Len=159"
22,0.8036809,100.84.170.161,151.101.2.187,TCP,66,55283  >  443 [ACK] Seq=12226 Ack=549 Win=511 Len=0 SLE=390 SRE=549
23,0.9066671,100.84.170.161,151.101.2.187,TLSv1.2,2509,Application Data
24,0.9172637,151.101.2.187,100.84.170.161,TCP,56,443  >  55283 [ACK] Seq=549 Ack=14681 Win=995 Len=0
25,0.9217613,151.101.2.187,100.84.170.161,TLSv1.2,103,Application Data
26,0.9534924,151.101.2.187,100.84.170.161,TCP,103,"[TCP Retransmission] 443  >  55283 [PSH, ACK] Seq=549 Ack=14681 Win=995 Len=49"
27,0.9535472,100.84.170.161,151.101.2.187,TCP,66,55283  >  443 [ACK] Seq=14681 Ack=598 Win=510 Len=0 SLE=549 SRE=598
28,3.5025459,100.84.170.161,151.101.2.187,TLSv1.2,2508,Application Data
29,3.5112809,151.101.2.187,100.84.170.161,TCP,56,443  >  55283 [ACK] Seq=598 Ack=17135 Win=1007 Len=0
30,3.5140009,151.101.2.187,100.84.170.161,TLSv1.2,213,Application Data
31,3.519662,100.84.170.161,151.101.2.187,TLSv1.2,2507,Application Data
32,3.5283769,151.101.2.187,100.84.170.161,TCP,56,443  >  55283 [ACK] Seq=757 Ack=19588 Win=1018 Len=0
33,3.5314568,151.101.2.187,100.84.170.161,TLSv1.2,178,Application Data
34,3.554426,100.84.170.161,151.101.2.187,TLSv1.2,2509,Application Data
35,3.5624538,151.101.2.187,100.84.170.161,TCP,178,"[TCP Spurious Retransmission] 443  >  55283 [PSH, ACK] Seq=757 Ack=19588 Win=1018 Len=124"
36,3.5624957,100.84.170.161,151.101.2.187,TCP,66,[TCP Dup ACK 34#1] 55283  >  443 [ACK] Seq=22043 Ack=881 Win=509 Len=0 SLE=757 SRE=881
37,3.5632684,151.101.2.187,100.84.170.161,TCP,56,443  >  55283 [ACK] Seq=881 Ack=22043 Win=1030 Len=0
38,3.5654633,151.101.2.187,100.84.170.161,TLSv1.2,264,Application Data
39,3.5973184,151.101.2.187,100.84.170.161,TCP,264,"[TCP Retransmission] 443  >  55283 [PSH, ACK] Seq=881 Ack=22043 Win=1030 Len=210"
40,3.5973661,100.84.170.161,151.101.2.187,TCP,66,55283  >  443 [ACK] Seq=22043 Ack=1091 Win=509 Len=0 SLE=881 SRE=1091
41,8.1692671,100.84.170.161,151.101.2.187,TLSv1.2,2519,Application Data
42,8.1796849,151.101.2.187,100.84.170.161,TCP,56,443  >  55283 [ACK] Seq=1091 Ack=24508 Win=1041 Len=0
43,8.1797142,100.84.170.161,151.101.2.187,TLSv1.2,2510,Application Data
44,8.1834313,100.84.170.161,151.101.2.187,TLSv1.2,2504,Application Data
45,8.1834788,151.101.2.187,100.84.170.161,TLSv1.2,213,Application Data
46,8.189055,151.101.2.187,100.84.170.161,TCP,56,443  >  55283 [ACK] Seq=1250 Ack=26964 Win=1052 Len=0
47,8.191321,151.101.2.187,100.84.170.161,TLSv1.2,130,Application Data
48,8.1913896,100.84.170.161,151.101.2.187,TCP,54,55283  >  443 [ACK] Seq=29414 Ack=1326 Win=508 Len=0
49,8.1921241,151.101.2.187,100.84.170.161,TCP,56,443  >  55283 [ACK] Seq=1326 Ack=29414 Win=1064 Len=0
50,8.1954034,151.101.2.187,100.84.170.161,TLSv1.2,131,Application Data
51,8.2326084,151.101.2.187,100.84.170.161,TCP,131,"[TCP Retransmission] 443  >  55283 [PSH, ACK] Seq=1326 Ack=29414 Win=1064 Len=77"
52,8.2326582,100.84.170.161,151.101.2.187,TCP,66,55283  >  443 [ACK] Seq=29414 Ack=1403 Win=507 Len=0 SLE=1326 SRE=1403
53,8.2884842,100.84.170.161,151.101.2.187,TLSv1.2,2504,Application Data
54,8.2981532,151.101.2.187,100.84.170.161,TCP,56,443  >  55283 [ACK] Seq=1403 Ack=31864 Win=1075 Len=0
55,8.3023733,151.101.2.187,100.84.170.161,TLSv1.2,130,Application Data
56,8.3291049,100.84.170.161,151.101.2.187,TLSv1.2,2518,Application Data
57,8.3344194,151.101.2.187,100.84.170.161,TCP,130,"[TCP Spurious Retransmission] 443  >  55283 [PSH, ACK] Seq=1403 Ack=31864 Win=1075 Len=76"
58,8.334459,100.84.170.161,151.101.2.187,TCP,66,[TCP Dup ACK 56#1] 55283  >  443 [ACK] Seq=34328 Ack=1479 Win=513 Len=0 SLE=1403 SRE=1479
59,8.3379025,151.101.2.187,100.84.170.161,TCP,56,443  >  55283 [ACK] Seq=1479 Ack=34328 Win=1087 Len=0
60,8.340718,151.101.2.187,100.84.170.161,TLSv1.2,130,Application Data
61,8.3735509,151.101.2.187,100.84.170.161,TCP,130,"[TCP Retransmission] 443  >  55283 [PSH, ACK] Seq=1479 Ack=34328 Win=1087 Len=76"
62,8.3736372,100.84.170.161,151.101.2.187,TCP,66,55283  >  443 [ACK] Seq=34328 Ack=1555 Win=512 Len=0 SLE=1479 SRE=1555
63,8.409329,100.84.170.161,151.101.2.187,TLSv1.2,2501,Application Data
64,8.4180792,151.101.2.187,100.84.170.161,TCP,56,443  >  55283 [ACK] Seq=1555 Ack=36775 Win=1098 Len=0
65,8.4213356,151.101.2.187,100.84.170.161,TLSv1.2,130,Application Data
66,8.4542839,151.101.2.187,100.84.170.161,TCP,130,"[TCP Retransmission] 443  >  55283 [PSH, ACK] Seq=1555 Ack=36775 Win=1098 Len=76"
67,8.4543199,100.84.170.161,151.101.2.187,TCP,66,55283  >  443 [ACK] Seq=36775 Ack=1631 Win=512 Len=0 SLE=1555 SRE=1631
68,8.5461925,100.84.170.161,151.101.2.187,TLSv1.2,2518,Application Data
69,8.5551446,151.101.2.187,100.84.170.161,TCP,56,443  >  55283 [ACK] Seq=1631 Ack=39239 Win=1109 Len=0
70,8.5576009,151.101.2.187,100.84.170.161,TLSv1.2,240,Application Data
71,8.5902203,151.101.2.187,100.84.170.161,TCP,240,"[TCP Retransmission] 443  >  55283 [PSH, ACK] Seq=1631 Ack=39239 Win=1109 Len=186"
72,8.590254,100.84.170.161,151.101.2.187,TCP,66,55283  >  443 [ACK] Seq=39239 Ack=1817 Win=511 Len=0 SLE=1631 SRE=1817
73,8.6872606,100.84.170.161,151.101.2.187,TLSv1.2,2505,Application Data
74,8.6961627,151.101.2.187,100.84.170.161,TCP,56,443  >  55283 [ACK] Seq=1817 Ack=41690 Win=1121 Len=0
75,8.6991286,151.101.2.187,100.84.170.161,TLSv1.2,130,Application Data
76,8.7108673,100.84.170.161,151.101.2.187,TLSv1.2,2513,Application Data
77,8.7200594,151.101.2.187,100.84.170.161,TCP,56,443  >  55283 [ACK] Seq=1893 Ack=44149 Win=1132 Len=0
78,8.7241503,151.101.2.187,100.84.170.161,TLSv1.2,131,Application Data
79,8.7583913,151.101.2.187,100.84.170.161,TCP,131,"[TCP Retransmission] 443  >  55283 [PSH, ACK] Seq=1893 Ack=44149 Win=1132 Len=77"
80,8.7584241,100.84.170.161,151.101.2.187,TCP,66,55283  >  443 [ACK] Seq=44149 Ack=1970 Win=511 Len=0 SLE=1893 SRE=1970
81,8.8343574,100.84.170.161,151.101.2.187,TLSv1.2,2523,Application Data
82,8.8346997,100.84.170.161,151.101.2.187,TLSv1.2,2523,Application Data
83,8.8349921,100.84.170.161,151.101.2.187,TLSv1.2,2519,Application Data
84,8.8360483,100.84.170.161,151.101.2.187,TLSv1.2,2519,Application Data
85,8.836312,100.84.170.161,151.101.2.187,TLSv1.2,2507,Application Data
86,8.8367359,100.84.170.161,151.101.2.187,TLSv1.2,2506,Application Data
87,8.8369484,100.84.170.161,151.101.2.187,TLSv1.2,2503,Application Data
88,8.8433701,151.101.2.187,100.84.170.161,TCP,56,443  >  55283 [ACK] Seq=1970 Ack=46618 Win=1144 Len=0
89,8.8437506,151.101.2.187,100.84.170.161,TCP,56,443  >  55283 [ACK] Seq=1970 Ack=49087 Win=1155 Len=0
90,8.844379,151.101.2.187,100.84.170.161,TCP,56,443  >  55283 [ACK] Seq=1970 Ack=51552 Win=1166 Len=0
91,8.8456175,151.101.2.187,100.84.170.161,TCP,56,443  >  55283 [ACK] Seq=1970 Ack=58922 Win=1201 Len=0
92,8.8463829,151.101.2.187,100.84.170.161,TCP,56,443  >  55283 [ACK] Seq=1970 Ack=61371 Win=1212 Len=0
93,8.8473024,151.101.2.187,100.84.170.161,TLSv1.2,130,Application Data
94,8.8480075,151.101.2.187,100.84.170.161,TLSv1.2,340,Application Data
95,8.848057,100.84.170.161,151.101.2.187,TCP,54,55283  >  443 [ACK] Seq=61371 Ack=2332 Win=509 Len=0
96,8.8492887,151.101.2.187,100.84.170.161,TLSv1.2,130,Application Data
97,8.8496778,151.101.2.187,100.84.170.161,TLSv1.2,130,Application Data
98,8.8497355,100.84.170.161,151.101.2.187,TCP,54,55283  >  443 [ACK] Seq=61371 Ack=2484 Win=509 Len=0
99,8.8499816,151.101.2.187,100.84.170.161,TLSv1.2,240,Application Data
100,8.8895101,100.84.170.161,151.101.2.187,TCP,54,55283  >  443 [ACK] Seq=61371 Ack=2670 Win=508 Len=0
101,8.8914724,151.101.2.187,100.84.170.161,TCP,240,"[TCP Spurious Retransmission] 443  >  55283 [PSH, ACK] Seq=2484 Ack=61371 Win=1212 Len=186"
102,8.8915221,100.84.170.161,151.101.2.187,TCP,66,[TCP Dup ACK 100#1] 55283  >  443 [ACK] Seq=61371 Ack=2670 Win=508 Len=0 SLE=2484 SRE=2670
103,9.1378624,100.84.170.161,151.101.2.187,TLSv1.2,2530,Application Data
104,9.1469604,151.101.2.187,100.84.170.161,TCP,56,443  >  55283 [ACK] Seq=2670 Ack=63847 Win=1224 Len=0
105,9.1500598,151.101.2.187,100.84.170.161,TLSv1.2,130,Application Data
106,9.1831953,151.101.2.187,100.84.170.161,TCP,130,"[TCP Retransmission] 443  >  55283 [PSH, ACK] Seq=2670 Ack=63847 Win=1224 Len=76"
107,9.1832799,100.84.170.161,151.101.2.187,TCP,66,55283  >  443 [ACK] Seq=63847 Ack=2746 Win=508 Len=0 SLE=2670 SRE=2746
108,17.2591016,100.84.170.161,151.101.2.187,TLSv1.2,2534,Application Data
109,17.2693403,151.101.2.187,100.84.170.161,TCP,56,443  >  55283 [ACK] Seq=2746 Ack=66327 Win=1235 Len=0
110,17.2731968,151.101.2.187,100.84.170.161,TLSv1.2,241,Application Data
111,17.3054732,151.101.2.187,100.84.170.161,TCP,241,"[TCP Retransmission] 443  >  55283 [PSH, ACK] Seq=2746 Ack=66327 Win=1235 Len=187"
112,17.3055203,100.84.170.161,151.101.2.187,TCP,66,55283  >  443 [ACK] Seq=66327 Ack=2933 Win=507 Len=0 SLE=2746 SRE=2933
113,20.7193961,100.84.170.161,151.101.2.187,TLSv1.2,2539,Application Data
114,20.7247942,100.84.170.161,151.101.2.187,TLSv1.2,2537,Application Data
115,20.7285438,151.101.2.187,100.84.170.161,TCP,56,443  >  55283 [ACK] Seq=2933 Ack=68812 Win=1246 Len=0
116,20.7325247,151.101.2.187,100.84.170.161,TLSv1.2,240,Application Data
117,20.7325783,100.84.170.161,151.101.2.187,TCP,54,55283  >  443 [ACK] Seq=71295 Ack=3119 Win=513 Len=0
118,20.733966,151.101.2.187,100.84.170.161,TCP,56,443  >  55283 [ACK] Seq=3119 Ack=71295 Win=1258 Len=0
119,20.7383429,151.101.2.187,100.84.170.161,TLSv1.2,131,Application Data
120,20.7384086,100.84.170.161,151.101.2.187,TCP,54,55283  >  443 [ACK] Seq=71295 Ack=3196 Win=512 Len=0
121,21.2377622,100.84.170.161,151.101.2.187,TLSv1.2,2540,Application Data
122,21.2500678,151.101.2.187,100.84.170.161,TCP,56,443  >  55283 [ACK] Seq=3196 Ack=73781 Win=1269 Len=0
123,21.2527185,151.101.2.187,100.84.170.161,TLSv1.2,130,Application Data
124,21.2818753,151.101.2.187,100.84.170.161,TCP,130,"[TCP Retransmission] 443  >  55283 [PSH, ACK] Seq=3196 Ack=73781 Win=1269 Len=76"
125,21.2819305,100.84.170.161,151.101.2.187,TCP,66,55283  >  443 [ACK] Seq=73781 Ack=3272 Win=512 Len=0 SLE=3196 SRE=3272
126,23.48845,100.84.170.161,151.101.2.187,TCP,66,63540  >  443 [SYN] Seq=0 Win=64240 Len=0 MSS=1460 WS=256 SACK_PERM
127,23.5011972,151.101.2.187,100.84.170.161,TCP,66,"443  >  63540 [SYN, ACK] Seq=0 Ack=1 Win=65535 Len=0 MSS=1460 SACK_PERM WS=512"
128,23.5012967,100.84.170.161,151.101.2.187,TCP,54,63540  >  443 [ACK] Seq=1 Ack=1 Win=131328 Len=0
129,23.5021983,100.84.170.161,151.101.2.187,TLSv1.3,2034,Client Hello (SNI=r2d2.target.com)
130,23.5125358,151.101.2.187,100.84.170.161,TCP,56,443  >  63540 [ACK] Seq=1 Ack=1981 Win=144384 Len=0
131,23.5128565,151.101.2.187,100.84.170.161,TLSv1.3,1510,"Server Hello, Change Cipher Spec, Application Data, Application Data"
132,23.5131938,151.101.2.187,100.84.170.161,TLSv1.3,139,Application Data
133,23.5132277,100.84.170.161,151.101.2.187,TCP,54,63540  >  443 [ACK] Seq=1981 Ack=1542 Win=131328 Len=0
134,23.5162296,100.84.170.161,151.101.2.187,TLSv1.3,118,"Change Cipher Spec, Application Data"
135,23.5176633,100.84.170.161,151.101.2.187,TLSv1.3,146,Application Data
136,23.5199048,100.84.170.161,151.101.2.187,TLSv1.3,599,Application Data
137,23.525231,151.101.2.187,100.84.170.161,TCP,56,443  >  63540 [ACK] Seq=1542 Ack=2045 Win=145920 Len=0
138,23.5275175,151.101.2.187,100.84.170.161,TLSv1.3,119,Application Data
139,23.5277243,100.84.170.161,151.101.2.187,TLSv1.3,85,Application Data
140,23.5288539,151.101.2.187,100.84.170.161,TCP,56,443  >  63540 [ACK] Seq=1607 Ack=2682 Win=145408 Len=0
141,23.5362608,151.101.2.187,100.84.170.161,TCP,56,443  >  63540 [ACK] Seq=1607 Ack=2713 Win=145408 Len=0
142,23.5833189,151.101.2.187,100.84.170.161,TLSv1.3,513,Application Data
143,23.5837511,151.101.2.187,100.84.170.161,TLSv1.3,920,Application Data
144,23.5838474,100.84.170.161,151.101.2.187,TCP,54,63540  >  443 [ACK] Seq=2713 Ack=2932 Win=129792 Len=0
145,23.5840653,151.101.2.187,100.84.170.161,TLSv1.3,85,Application Data
146,23.619453,151.101.2.187,100.84.170.161,TCP,85,"[TCP Retransmission] 443  >  63540 [PSH, ACK] Seq=2932 Ack=2713 Win=145920 Len=31"
147,23.619491,100.84.170.161,151.101.2.187,TCP,66,63540  >  443 [ACK] Seq=2713 Ack=2963 Win=129792 Len=0 SLE=2932 SRE=2963
148,31.1824136,100.84.170.161,151.101.2.187,TLSv1.2,2536,Application Data
149,31.1914679,151.101.2.187,100.84.170.161,TCP,56,443  >  55283 [ACK] Seq=3272 Ack=76263 Win=1281 Len=0
150,31.1944933,151.101.2.187,100.84.170.161,TLSv1.2,423,Application Data
151,31.2044574,100.84.170.161,151.101.2.187,TLSv1.2,2527,Application Data
152,31.2079622,100.84.170.161,151.101.2.187,TLSv1.2,2521,Application Data
153,31.213226,151.101.2.187,100.84.170.161,TCP,56,443  >  55283 [ACK] Seq=3641 Ack=78736 Win=1292 Len=0
154,31.215763,151.101.2.187,100.84.170.161,TLSv1.2,130,Application Data
155,31.2169131,151.101.2.187,100.84.170.161,TCP,56,443  >  55283 [ACK] Seq=3717 Ack=81203 Win=1303 Len=0
156,31.2214935,151.101.2.187,100.84.170.161,TLSv1.2,131,Application Data
157,31.2216121,100.84.170.161,151.101.2.187,TCP,54,55283  >  443 [ACK] Seq=81203 Ack=3794 Win=510 Len=0
158,31.2398419,100.84.170.161,151.101.2.187,TLSv1.2,2521,Application Data
159,31.2488368,151.101.2.187,100.84.170.161,TCP,56,443  >  55283 [ACK] Seq=3794 Ack=83670 Win=1315 Len=0
160,31.2530177,151.101.2.187,100.84.170.161,TLSv1.2,130,Application Data
161,31.2848578,151.101.2.187,100.84.170.161,TCP,130,"[TCP Retransmission] 443  >  55283 [PSH, ACK] Seq=3794 Ack=83670 Win=1315 Len=76"
162,31.2849078,100.84.170.161,151.101.2.187,TCP,66,55283  >  443 [ACK] Seq=83670 Ack=3870 Win=510 Len=0 SLE=3794 SRE=3870
163,31.3708238,100.84.170.161,151.101.2.187,TLSv1.2,2518,Application Data
164,31.379653,151.101.2.187,100.84.170.161,TCP,56,443  >  55283 [ACK] Seq=3870 Ack=86134 Win=1326 Len=0
165,31.3826329,151.101.2.187,100.84.170.161,TLSv1.2,130,Application Data
166,31.3950833,100.84.170.161,151.101.2.187,TLSv1.2,2535,Application Data
167,31.4042439,151.101.2.187,100.84.170.161,TCP,56,443  >  55283 [ACK] Seq=3946 Ack=88615 Win=1338 Len=0
168,31.4064432,151.101.2.187,100.84.170.161,TLSv1.2,130,Application Data
169,31.4395975,151.101.2.187,100.84.170.161,TCP,130,"[TCP Retransmission] 443  >  55283 [PSH, ACK] Seq=3946 Ack=88615 Win=1338 Len=76"
170,31.4396461,100.84.170.161,151.101.2.187,TCP,66,55283  >  443 [ACK] Seq=88615 Ack=4022 Win=509 Len=0 SLE=3946 SRE=4022
171,31.4562134,100.84.170.161,151.101.2.187,TLSv1.2,2535,Application Data
172,31.4649087,151.101.2.187,100.84.170.161,TCP,56,443  >  55283 [ACK] Seq=4022 Ack=91096 Win=1349 Len=0
173,31.4696522,151.101.2.187,100.84.170.161,TLSv1.2,103,Application Data
174,31.5025703,151.101.2.187,100.84.170.161,TCP,103,"[TCP Retransmission] 443  >  55283 [PSH, ACK] Seq=4022 Ack=91096 Win=1349 Len=49"
175,31.502626,100.84.170.161,151.101.2.187,TCP,66,55283  >  443 [ACK] Seq=91096 Ack=4071 Win=509 Len=0 SLE=4022 SRE=4071
176,31.7482901,100.84.170.161,151.101.2.187,TLSv1.2,2530,Application Data
177,31.7583816,151.101.2.187,100.84.170.161,TCP,56,443  >  55283 [ACK] Seq=4071 Ack=93572 Win=1360 Len=0
178,31.7619398,151.101.2.187,100.84.170.161,TLSv1.2,241,Application Data
179,31.7945231,151.101.2.187,100.84.170.161,TCP,241,"[TCP Retransmission] 443  >  55283 [PSH, ACK] Seq=4071 Ack=93572 Win=1360 Len=187"
180,31.7945815,100.84.170.161,151.101.2.187,TCP,66,55283  >  443 [ACK] Seq=93572 Ack=4258 Win=508 Len=0 SLE=4071 SRE=4258
181,31.8728524,100.84.170.161,151.101.2.187,TLSv1.2,2475,Application Data
182,31.8799187,100.84.170.161,151.101.2.187,TLSv1.2,2532,Application Data
183,31.8801396,100.84.170.161,151.101.2.187,TLSv1.2,2535,Application Data
184,31.8818237,151.101.2.187,100.84.170.161,TCP,56,443  >  55283 [ACK] Seq=4258 Ack=95993 Win=1372 Len=0
185,31.8842823,151.101.2.187,100.84.170.161,TLSv1.2,173,Application Data
186,31.8846451,151.101.2.187,100.84.170.161,TLSv1.2,452,Application Data
187,31.8846851,100.84.170.161,151.101.2.187,TCP,54,55283  >  443 [ACK] Seq=100952 Ack=4775 Win=513 Len=0
188,31.88677,100.84.170.161,151.101.2.187,TLSv1.2,89,Application Data
189,31.8888814,151.101.2.187,100.84.170.161,TCP,56,443  >  55283 [ACK] Seq=4775 Ack=98471 Win=1383 Len=0
190,31.8892668,151.101.2.187,100.84.170.161,TCP,56,443  >  55283 [ACK] Seq=4775 Ack=100952 Win=1395 Len=0
191,31.8915656,151.101.2.187,100.84.170.161,TLSv1.2,130,Application Data
192,31.8938423,151.101.2.187,100.84.170.161,TLSv1.2,130,Application Data
193,31.8939055,100.84.170.161,151.101.2.187,TCP,54,55283  >  443 [ACK] Seq=100987 Ack=4927 Win=512 Len=0
194,31.8958295,151.101.2.187,100.84.170.161,TCP,56,443  >  55283 [ACK] Seq=4927 Ack=100987 Win=1395 Len=0
195,32.0056128,100.84.170.161,151.101.2.187,TLSv1.2,2544,Application Data
196,32.006319,100.84.170.161,151.101.2.187,TLSv1.2,2532,Application Data
197,32.0064923,100.84.170.161,151.101.2.187,TLSv1.2,2531,Application Data
198,32.0175778,151.101.2.187,100.84.170.161,TCP,56,443  >  55283 [ACK] Seq=4927 Ack=108432 Win=1429 Len=0
199,32.019287,151.101.2.187,100.84.170.161,TLSv1.2,341,Application Data
200,32.0195992,151.101.2.187,100.84.170.161,TLSv1.2,131,Application Data
201,32.0195992,151.101.2.187,100.84.170.161,TLSv1.2,130,Application Data
202,32.0196235,100.84.170.161,151.101.2.187,TCP,54,55283  >  443 [ACK] Seq=108432 Ack=5367 Win=510 Len=0
203,36.3570889,100.84.170.161,151.101.2.187,TLSv1.2,2530,Application Data
204,36.366558,151.101.2.187,100.84.170.161,TCP,56,443  >  55283 [ACK] Seq=5367 Ack=110908 Win=1440 Len=0
205,36.3696447,151.101.2.187,100.84.170.161,TLSv1.2,240,Application Data
206,36.3992441,151.101.2.187,100.84.170.161,TCP,240,"[TCP Retransmission] 443  >  55283 [PSH, ACK] Seq=5367 Ack=110908 Win=1440 Len=186"
207,36.3992789,100.84.170.161,151.101.2.187,TCP,66,55283  >  443 [ACK] Seq=110908 Ack=5553 Win=510 Len=0 SLE=5367 SRE=5553
208,36.4585589,100.84.170.161,151.101.2.187,TLSv1.2,2528,Application Data
209,36.4674722,151.101.2.187,100.84.170.161,TCP,56,443  >  55283 [ACK] Seq=5553 Ack=113382 Win=1452 Len=0
210,36.4705,151.101.2.187,100.84.170.161,TLSv1.2,131,Application Data
211,36.5003421,151.101.2.187,100.84.170.161,TCP,131,"[TCP Retransmission] 443  >  55283 [PSH, ACK] Seq=5553 Ack=113382 Win=1452 Len=77"
212,36.5003769,100.84.170.161,151.101.2.187,TCP,66,55283  >  443 [ACK] Seq=113382 Ack=5630 Win=509 Len=0 SLE=5553 SRE=5630
213,36.5972323,100.84.170.161,151.101.2.187,TLSv1.2,2531,Application Data
214,36.6071082,151.101.2.187,100.84.170.161,TCP,56,443  >  55283 [ACK] Seq=5630 Ack=115859 Win=1463 Len=0
215,36.6119763,151.101.2.187,100.84.170.161,TLSv1.2,240,Application Data
216,36.6411311,151.101.2.187,100.84.170.161,TCP,240,"[TCP Retransmission] 443  >  55283 [PSH, ACK] Seq=5630 Ack=115859 Win=1463 Len=186"
217,36.6411689,100.84.170.161,151.101.2.187,TCP,66,55283  >  443 [ACK] Seq=115859 Ack=5816 Win=509 Len=0 SLE=5630 SRE=5816
218,37.6021184,100.84.170.161,151.101.2.187,TLSv1.2,2525,Application Data
219,37.6041422,100.84.170.161,151.101.2.187,TLSv1.2,2531,Application Data
220,37.6112082,151.101.2.187,100.84.170.161,TCP,56,443  >  55283 [ACK] Seq=5816 Ack=118330 Win=1474 Len=0
221,37.6130377,151.101.2.187,100.84.170.161,TCP,56,443  >  55283 [ACK] Seq=5816 Ack=120807 Win=1486 Len=0
222,37.6142704,151.101.2.187,100.84.170.161,TLSv1.2,241,Application Data
223,37.6150878,151.101.2.187,100.84.170.161,TLSv1.2,103,Application Data
224,37.6151503,100.84.170.161,151.101.2.187,TCP,54,55283  >  443 [ACK] Seq=120807 Ack=6052 Win=508 Len=0
225,37.658075,100.84.170.161,151.101.2.187,TLSv1.2,2519,Application Data
226,37.6586349,100.84.170.161,151.101.2.187,TLSv1.2,2516,Application Data
227,37.6671351,151.101.2.187,100.84.170.161,TCP,56,443  >  55283 [ACK] Seq=6052 Ack=123272 Win=1497 Len=0
228,37.6684668,151.101.2.187,100.84.170.161,TCP,56,443  >  55283 [ACK] Seq=6052 Ack=125734 Win=1509 Len=0
229,37.6697511,151.101.2.187,100.84.170.161,TLSv1.2,129,Application Data
230,37.6714011,151.101.2.187,100.84.170.161,TLSv1.2,130,Application Data
231,37.6714506,100.84.170.161,151.101.2.187,TCP,54,55283  >  443 [ACK] Seq=125734 Ack=6203 Win=507 Len=0
232,42.9707073,100.84.170.161,151.101.2.187,TLSv1.2,2532,Application Data
233,42.9798452,151.101.2.187,100.84.170.161,TCP,56,443  >  55283 [ACK] Seq=6203 Ack=128212 Win=1520 Len=0
234,43.2856994,151.101.2.187,100.84.170.161,TCP,14614,443  >  55283 [ACK] Seq=6203 Ack=128212 Win=1520 Len=14560 [TCP PDU reassembled in 235]
235,43.2856994,151.101.2.187,100.84.170.161,TLSv1.2,900,Application Data
236,43.2856994,151.101.2.187,100.84.170.161,TLSv1.2,27718,Application Data
237,43.2856994,151.101.2.187,100.84.170.161,TLSv1.2,1063,Application Data
238,43.2856994,151.101.2.187,100.84.170.161,TLSv1.2,8790,Application Data
239,43.2856994,151.101.2.187,100.84.170.161,TLSv1.2,1088,Application Data
240,43.2856994,151.101.2.187,100.84.170.161,TCP,1088,"[TCP Retransmission] 443  >  55283 [PSH, ACK] Seq=59018 Ack=128212 Win=1520 Len=1034 [TCP PDU reassembled in 239]"
241,43.2858786,100.84.170.161,151.101.2.187,TCP,66,55283  >  443 [ACK] Seq=128212 Ack=60052 Win=513 Len=0 SLE=59018 SRE=60052
242,43.2938423,100.84.170.161,151.101.2.187,TLSv1.2,89,Application Data
243,43.3037821,151.101.2.187,100.84.170.161,TCP,56,443  >  55283 [ACK] Seq=60052 Ack=128247 Win=1520 Len=0
244,43.3801369,151.101.2.187,100.84.170.161,TCP,1510,443  >  55283 [ACK] Seq=60052 Ack=128247 Win=1520 Len=1456 [TCP PDU reassembled in 245]
245,43.3804966,151.101.2.187,100.84.170.161,TLSv1.2,210,Application Data
246,43.3805769,100.84.170.161,151.101.2.187,TCP,54,55283  >  443 [ACK] Seq=128247 Ack=61664 Win=513 Len=0
247,43.3878988,151.101.2.187,100.84.170.161,TCP,1510,443  >  55283 [ACK] Seq=61664 Ack=128247 Win=1520 Len=1456 [TCP PDU reassembled in 250]
248,43.3882169,151.101.2.187,100.84.170.161,TCP,1510,443  >  55283 [ACK] Seq=63120 Ack=128247 Win=1520 Len=1456 [TCP PDU reassembled in 250]
249,43.3882677,100.84.170.161,151.101.2.187,TCP,54,55283  >  443 [ACK] Seq=128247 Ack=64576 Win=513 Len=0
250,43.388797,151.101.2.187,100.84.170.161,TLSv1.2,399,Application Data
251,43.388797,151.101.2.187,100.84.170.161,TCP,2966,443  >  55283 [ACK] Seq=64921 Ack=128247 Win=1520 Len=2912 [TCP PDU reassembled in 253]
252,43.3888661,100.84.170.161,151.101.2.187,TCP,54,55283  >  443 [ACK] Seq=128247 Ack=67833 Win=513 Len=0
253,43.3893432,151.101.2.187,100.84.170.161,TLSv1.2,73,Application Data
254,43.3893922,100.84.170.161,151.101.2.187,TCP,54,55283  >  443 [ACK] Seq=128247 Ack=67852 Win=513 Len=0
255,43.4125129,151.101.2.187,100.84.170.161,TLSv1.2,265,Application Data
256,43.4129092,151.101.2.187,100.84.170.161,TCP,1510,443  >  55283 [ACK] Seq=68063 Ack=128247 Win=1520 Len=1456 [TCP PDU reassembled in 258]
257,43.4129712,100.84.170.161,151.101.2.187,TCP,54,55283  >  443 [ACK] Seq=128247 Ack=69519 Win=513 Len=0
258,43.4133363,151.101.2.187,100.84.170.161,TLSv1.2,1462,Application Data
259,43.4153378,151.101.2.187,100.84.170.161,TLSv1.2,1099,Application Data
260,43.4154206,100.84.170.161,151.101.2.187,TCP,54,55283  >  443 [ACK] Seq=128247 Ack=71972 Win=513 Len=0
261,43.506706,151.101.2.187,100.84.170.161,TLSv1.2,86,Application Data
262,43.5073738,151.101.2.187,100.84.170.161,TLSv1.2,93,Application Data
263,43.5074747,100.84.170.161,151.101.2.187,TCP,54,55283  >  443 [ACK] Seq=128247 Ack=72043 Win=513 Len=0
264,43.5078068,151.101.2.187,100.84.170.161,TCP,2966,443  >  55283 [ACK] Seq=72043 Ack=128247 Win=1520 Len=2912 [TCP PDU reassembled in 265]
265,43.5078068,151.101.2.187,100.84.170.161,TLSv1.2,501,Application Data
266,43.5078625,100.84.170.161,151.101.2.187,TCP,54,55283  >  443 [ACK] Seq=128247 Ack=75402 Win=513 Len=0
267,43.5094944,151.101.2.187,100.84.170.161,TCP,10246,443  >  55283 [ACK] Seq=75402 Ack=128247 Win=1520 Len=10192 [TCP PDU reassembled in 268]
268,43.5094944,151.101.2.187,100.84.170.161,TLSv1.2,176,Application Data
269,43.5095643,100.84.170.161,151.101.2.187,TCP,54,55283  >  443 [ACK] Seq=128247 Ack=85716 Win=513 Len=0
270,43.5726853,151.101.2.187,100.84.170.161,TCP,1510,443  >  55283 [ACK] Seq=85716 Ack=128247 Win=1520 Len=1456 [TCP PDU reassembled in 271]
271,43.5729815,151.101.2.187,100.84.170.161,TLSv1.2,241,Application Data
272,43.5730118,100.84.170.161,151.101.2.187,TCP,54,55283  >  443 [ACK] Seq=128247 Ack=87359 Win=513 Len=0
273,43.5741233,151.101.2.187,100.84.170.161,TLSv1.2,89,Application Data
274,43.5741233,151.101.2.187,100.84.170.161,TLSv1.2,1290,Application Data
275,43.5741233,151.101.2.187,100.84.170.161,TLSv1.2,1380,Application Data
276,43.5741233,151.101.2.187,100.84.170.161,TLSv1.2,540,"Application Data, Application Data"
277,43.5741233,151.101.2.187,100.84.170.161,TCP,1510,443  >  55283 [ACK] Seq=90442 Ack=128247 Win=1520 Len=1456 [TCP PDU reassembled in 278]
278,43.5741233,151.101.2.187,100.84.170.161,TLSv1.2,271,Application Data
279,43.5742983,100.84.170.161,151.101.2.187,TCP,54,55283  >  443 [ACK] Seq=128247 Ack=92115 Win=513 Len=0
280,43.5778763,151.101.2.187,100.84.170.161,TLSv1.2,100,Application Data
281,43.5778763,151.101.2.187,100.84.170.161,TLSv1.2,1282,Application Data
282,43.5779323,100.84.170.161,151.101.2.187,TCP,54,55283  >  443 [ACK] Seq=128247 Ack=93389 Win=508 Len=0
283,43.5782187,151.101.2.187,100.84.170.161,TLSv1.2,476,Application Data
284,43.5825942,151.101.2.187,100.84.170.161,TLSv1.2,86,Application Data
285,43.582657,100.84.170.161,151.101.2.187,TCP,54,55283  >  443 [ACK] Seq=128247 Ack=93843 Win=513 Len=0
286,43.583086,151.101.2.187,100.84.170.161,TLSv1.2,500,Application Data
287,43.5918123,151.101.2.187,100.84.170.161,TLSv1.2,95,Application Data
288,43.5918693,100.84.170.161,151.101.2.187,TCP,54,55283  >  443 [ACK] Seq=128247 Ack=94330 Win=511 Len=0
289,43.5923715,151.101.2.187,100.84.170.161,TLSv1.2,85,Application Data
290,43.6272897,151.101.2.187,100.84.170.161,TCP,85,"[TCP Retransmission] 443  >  55283 [PSH, ACK] Seq=94330 Ack=128247 Win=1520 Len=31"
291,43.6273269,100.84.170.161,151.101.2.187,TCP,66,55283  >  443 [ACK] Seq=128247 Ack=94361 Win=511 Len=0 SLE=94330 SRE=94361
292,43.7454559,100.84.170.161,151.101.2.187,TLSv1.2,2490,Application Data
293,43.745778,100.84.170.161,151.101.2.187,TLSv1.2,2488,Application Data
294,43.7460097,100.84.170.161,151.101.2.187,TLSv1.2,2488,Application Data
295,43.7528472,100.84.170.161,151.101.2.187,TLSv1.2,2486,Application Data
296,43.7574062,151.101.2.187,100.84.170.161,TCP,56,443  >  55283 [ACK] Seq=94361 Ack=135551 Win=1552 Len=0
297,43.7579978,151.101.2.187,100.84.170.161,TLSv1.2,290,Application Data
298,43.7582856,151.101.2.187,100.84.170.161,TLSv1.2,130,Application Data
299,43.7583205,100.84.170.161,151.101.2.187,TCP,54,55283  >  443 [ACK] Seq=137983 Ack=94673 Win=510 Len=0
300,43.7586809,151.101.2.187,100.84.170.161,TLSv1.2,131,Application Data
301,43.7626093,151.101.2.187,100.84.170.161,TCP,56,443  >  55283 [ACK] Seq=94750 Ack=137983 Win=1564 Len=0
302,43.7648187,151.101.2.187,100.84.170.161,TLSv1.2,130,Application Data
303,43.7649119,100.84.170.161,151.101.2.187,TCP,54,55283  >  443 [ACK] Seq=137983 Ack=94826 Win=509 Len=0
304,43.8048367,100.84.170.161,151.101.2.187,TLSv1.2,2494,Application Data
305,43.8054841,100.84.170.161,151.101.2.187,TLSv1.2,2490,Application Data
306,43.8057922,100.84.170.161,151.101.2.187,TLSv1.2,2493,Application Data
307,43.8060512,100.84.170.161,151.101.2.187,TLSv1.2,2488,Application Data
308,43.8139131,151.101.2.187,100.84.170.161,TCP,56,443  >  55283 [ACK] Seq=94826 Ack=140423 Win=1575 Len=0
309,43.814228,151.101.2.187,100.84.170.161,TCP,56,443  >  55283 [ACK] Seq=94826 Ack=142859 Win=1587 Len=0
310,43.8146193,151.101.2.187,100.84.170.161,TCP,56,443  >  55283 [ACK] Seq=94826 Ack=145298 Win=1598 Len=0
311,43.8149962,151.101.2.187,100.84.170.161,TCP,56,443  >  55283 [ACK] Seq=94826 Ack=147732 Win=1609 Len=0
312,43.8170013,151.101.2.187,100.84.170.161,TLSv1.2,130,Application Data
313,43.8174003,151.101.2.187,100.84.170.161,TLSv1.2,130,Application Data
314,43.8175228,100.84.170.161,151.101.2.187,TCP,54,55283  >  443 [ACK] Seq=147732 Ack=94978 Win=508 Len=0
315,43.8183808,151.101.2.187,100.84.170.161,TLSv1.2,130,Application Data
316,43.8186545,151.101.2.187,100.84.170.161,TLSv1.2,153,Application Data
317,43.818684,100.84.170.161,151.101.2.187,TCP,54,55283  >  443 [ACK] Seq=147732 Ack=95153 Win=508 Len=0
318,43.9297153,100.84.170.161,151.101.2.187,TLSv1.2,2496,Application Data
319,43.9407258,100.84.170.161,151.101.2.187,TLSv1.2,2490,Application Data
320,43.9409284,100.84.170.161,151.101.2.187,TLSv1.2,2497,Application Data
321,43.9411022,100.84.170.161,151.101.2.187,TLSv1.2,2490,Application Data
322,43.9412428,100.84.170.161,151.101.2.187,TLSv1.2,2496,Application Data
323,43.9413707,100.84.170.161,151.101.2.187,TLSv1.2,2490,Application Data
324,43.9415094,100.84.170.161,151.101.2.187,TLSv1.2,2496,Application Data
325,43.9424558,100.84.170.161,151.101.2.187,TLSv1.2,2487,Application Data
326,43.9426273,100.84.170.161,151.101.2.187,TLSv1.2,2504,Application Data
327,43.9427477,100.84.170.161,151.101.2.187,TLSv1.2,2505,Application Data
328,43.942863,100.84.170.161,151.101.2.187,TLSv1.2,2489,Application Data
329,43.9429937,100.84.170.161,151.101.2.187,TLSv1.2,2488,Application Data
330,43.9431053,100.84.170.161,151.101.2.187,TLSv1.2,2489,Application Data
331,43.9444239,151.101.2.187,100.84.170.161,TCP,56,443  >  55283 [ACK] Seq=95153 Ack=150174 Win=1621 Len=0
332,43.9478877,151.101.2.187,100.84.170.161,TLSv1.2,185,Application Data
333,43.9493622,151.101.2.187,100.84.170.161,TCP,56,443  >  55283 [ACK] Seq=95284 Ack=152610 Win=1632 Len=0
334,43.9497804,151.101.2.187,100.84.170.161,TCP,56,443  >  55283 [ACK] Seq=95284 Ack=155053 Win=1644 Len=0
335,43.950225,151.101.2.187,100.84.170.161,TCP,56,443  >  55283 [ACK] Seq=95284 Ack=157489 Win=1655 Len=0
336,43.9506732,151.101.2.187,100.84.170.161,TCP,56,443  >  55283 [ACK] Seq=95284 Ack=164809 Win=1689 Len=0
337,43.9513929,151.101.2.187,100.84.170.161,TCP,56,443  >  55283 [ACK] Seq=95284 Ack=167242 Win=1701 Len=0
338,43.9529643,151.101.2.187,100.84.170.161,TCP,56,443  >  55283 [ACK] Seq=95284 Ack=174578 Win=1735 Len=0
339,43.9530995,151.101.2.187,100.84.170.161,TCP,56,443  >  55283 [ACK] Seq=95284 Ack=179447 Win=1758 Len=0
340,43.9546306,151.101.2.187,100.84.170.161,TLSv1.2,135,Application Data
341,43.9546902,100.84.170.161,151.101.2.187,TCP,54,55283  >  443 [ACK] Seq=179447 Ack=95365 Win=513 Len=0
342,43.9565116,151.101.2.187,100.84.170.161,TLSv1.2,209,Application Data
343,43.9570125,151.101.2.187,100.84.170.161,TLSv1.2,130,Application Data
344,43.9570555,100.84.170.161,151.101.2.187,TCP,54,55283  >  443 [ACK] Seq=179447 Ack=95596 Win=512 Len=0
345,43.9573434,151.101.2.187,100.84.170.161,TLSv1.2,290,Application Data
346,43.9579246,151.101.2.187,100.84.170.161,TLSv1.2,130,Application Data
347,43.9579727,100.84.170.161,151.101.2.187,TCP,54,55283  >  443 [ACK] Seq=179447 Ack=95908 Win=511 Len=0
348,43.9586703,151.101.2.187,100.84.170.161,TLSv1.2,186,Application Data
349,43.9590308,151.101.2.187,100.84.170.161,TLSv1.2,239,Application Data
350,43.9590685,100.84.170.161,151.101.2.187,TCP,54,55283  >  443 [ACK] Seq=179447 Ack=96225 Win=509 Len=0
351,43.9605124,151.101.2.187,100.84.170.161,TLSv1.2,152,Application Data
352,43.9605124,151.101.2.187,100.84.170.161,TLSv1.2,185,Application Data
353,43.9605912,100.84.170.161,151.101.2.187,TCP,54,55283  >  443 [ACK] Seq=179447 Ack=96454 Win=509 Len=0
354,45.7173542,100.84.170.161,151.101.2.187,TLSv1.2,2773,Application Data
355,45.718105,100.84.170.161,151.101.2.187,TLSv1.2,2735,Application Data
356,45.7211918,100.84.170.161,151.101.2.187,TLSv1.2,2755,Application Data
357,45.7219198,100.84.170.161,151.101.2.187,TLSv1.2,2753,Application Data
358,45.7259308,151.101.2.187,100.84.170.161,TCP,56,443  >  55283 [ACK] Seq=96454 Ack=182166 Win=1769 Len=0
359,45.7267914,151.101.2.187,100.84.170.161,TCP,56,443  >  55283 [ACK] Seq=96454 Ack=184847 Win=1781 Len=0
360,45.7302583,151.101.2.187,100.84.170.161,TCP,56,443  >  55283 [ACK] Seq=96454 Ack=187548 Win=1792 Len=0
361,45.7309275,151.101.2.187,100.84.170.161,TCP,56,443  >  55283 [ACK] Seq=96454 Ack=190247 Win=1803 Len=0
362,45.8734213,151.101.2.187,100.84.170.161,TLSv1.2,507,Application Data
363,45.8738601,151.101.2.187,100.84.170.161,TCP,1510,443  >  55283 [ACK] Seq=96907 Ack=190247 Win=1803 Len=1456 [TCP PDU reassembled in 365]
364,45.8739112,100.84.170.161,151.101.2.187,TCP,54,55283  >  443 [ACK] Seq=190247 Ack=98363 Win=513 Len=0
365,45.8747336,151.101.2.187,100.84.170.161,TLSv1.2,16070,Application Data
366,45.8748021,100.84.170.161,151.101.2.187,TCP,54,55283  >  443 [ACK] Seq=190247 Ack=114379 Win=513 Len=0
367,45.8755288,151.101.2.187,100.84.170.161,TCP,5878,443  >  55283 [ACK] Seq=114379 Ack=190247 Win=1803 Len=5824 [TCP PDU reassembled in 368]
368,45.8755288,151.101.2.187,100.84.170.161,TLSv1.2,1131,Application Data
369,45.8755941,100.84.170.161,151.101.2.187,TCP,54,55283  >  443 [ACK] Seq=190247 Ack=121280 Win=513 Len=0
370,45.8951381,151.101.2.187,100.84.170.161,TCP,1510,443  >  55283 [ACK] Seq=121280 Ack=190247 Win=1803 Len=1456 [TCP PDU reassembled in 374]
371,45.8955335,151.101.2.187,100.84.170.161,TCP,1510,443  >  55283 [ACK] Seq=122736 Ack=190247 Win=1803 Len=1456 [TCP PDU reassembled in 374]
372,45.8955722,100.84.170.161,151.101.2.187,TCP,54,55283  >  443 [ACK] Seq=190247 Ack=124192 Win=513 Len=0
373,45.8964009,151.101.2.187,100.84.170.161,TCP,11702,443  >  55283 [ACK] Seq=124192 Ack=190247 Win=1803 Len=11648 [TCP PDU reassembled in 374]
374,45.8964009,151.101.2.187,100.84.170.161,TLSv1.2,1084,Application Data
375,45.8964009,151.101.2.187,100.84.170.161,TCP,4422,443  >  55283 [ACK] Seq=136870 Ack=190247 Win=1803 Len=4368 [TCP PDU reassembled in 378]
376,45.8965071,100.84.170.161,151.101.2.187,TCP,54,55283  >  443 [ACK] Seq=190247 Ack=141238 Win=513 Len=0
377,45.8975322,151.101.2.187,100.84.170.161,TCP,5878,443  >  55283 [ACK] Seq=141238 Ack=190247 Win=1803 Len=5824 [TCP PDU reassembled in 378]
378,45.8975322,151.101.2.187,100.84.170.161,TLSv1.2,378,Application Data
379,45.8975976,100.84.170.161,151.101.2.187,TCP,54,55283  >  443 [ACK] Seq=190247 Ack=147386 Win=513 Len=0
380,46.1525334,151.101.2.187,100.84.170.161,TLSv1.2,196,Application Data
381,46.1525334,151.101.2.187,100.84.170.161,TLSv1.2,20438,Application Data
382,46.1525334,151.101.2.187,100.84.170.161,TLSv1.2,826,Application Data
383,46.1525334,151.101.2.187,100.84.170.161,TCP,7334,443  >  55283 [ACK] Seq=168684 Ack=190247 Win=1803 Len=7280 [TCP PDU reassembled in 384]
384,46.1525334,151.101.2.187,100.84.170.161,TLSv1.2,997,Application Data
385,46.1525334,151.101.2.187,100.84.170.161,TLSv1.2,30630,"Application Data, Application Data"
386,46.1525334,151.101.2.187,100.84.170.161,TLSv1.2,155,Application Data
387,46.1525334,151.101.2.187,100.84.170.161,TCP,155,"[TCP Retransmission] 443  >  55283 [PSH, ACK] Seq=207483 Ack=190247 Win=1803 Len=101 [TCP PDU reassembled in 386]"
388,46.1526806,100.84.170.161,151.101.2.187,TCP,66,55283  >  443 [ACK] Seq=190247 Ack=207584 Win=513 Len=0 SLE=207483 SRE=207584
389,46.2469294,151.101.2.187,100.84.170.161,TCP,1510,443  >  55283 [ACK] Seq=207584 Ack=190247 Win=1803 Len=1456 [TCP PDU reassembled in 393]
390,46.2472995,151.101.2.187,100.84.170.161,TCP,1510,443  >  55283 [ACK] Seq=209040 Ack=190247 Win=1803 Len=1456 [TCP PDU reassembled in 393]
391,46.2473574,100.84.170.161,151.101.2.187,TCP,54,55283  >  443 [ACK] Seq=190247 Ack=210496 Win=513 Len=0
392,46.2490185,151.101.2.187,100.84.170.161,TCP,11702,443  >  55283 [ACK] Seq=210496 Ack=190247 Win=1803 Len=11648 [TCP PDU reassembled in 393]
393,46.2490185,151.101.2.187,100.84.170.161,TLSv1.2,974,Application Data
394,46.2490185,151.101.2.187,100.84.170.161,TLSv1.2,30630,Application Data
395,46.2491584,100.84.170.161,151.101.2.187,TCP,54,55283  >  443 [ACK] Seq=190247 Ack=253640 Win=513 Len=0
396,46.2500015,151.101.2.187,100.84.170.161,TLSv1.2,13158,Application Data
397,46.2500015,151.101.2.187,100.84.170.161,TLSv1.2,221,Application Data
398,46.2500622,100.84.170.161,151.101.2.187,TCP,54,55283  >  443 [ACK] Seq=190247 Ack=266911 Win=513 Len=0
399,46.5968912,100.84.170.161,151.101.2.187,TCP,66,56939  >  443 [SYN] Seq=0 Win=64240 Len=0 MSS=1460 WS=256 SACK_PERM
400,46.6095001,151.101.2.187,100.84.170.161,TCP,66,"443  >  56939 [SYN, ACK] Seq=0 Ack=1 Win=65535 Len=0 MSS=1460 SACK_PERM WS=512"
401,46.6095765,100.84.170.161,151.101.2.187,TCP,54,56939  >  443 [ACK] Seq=1 Ack=1 Win=131328 Len=0
402,46.6102055,100.84.170.161,151.101.2.187,TLSv1.3,1788,Client Hello (SNI=observability.target.com)
403,46.6201952,151.101.2.187,100.84.170.161,TCP,56,443  >  56939 [ACK] Seq=1 Ack=1735 Win=144896 Len=0
404,46.6229133,151.101.2.187,100.84.170.161,TLSv1.3,1510,"Server Hello, Change Cipher Spec, Application Data"
405,46.6236533,151.101.2.187,100.84.170.161,TLSv1.3,4422,Application Data
406,46.6236533,151.101.2.187,100.84.170.161,TLSv1.3,473,"Application Data, Application Data, Application Data"
407,46.6237139,100.84.170.161,151.101.2.187,TCP,54,56939  >  443 [ACK] Seq=1735 Ack=6244 Win=131328 Len=0
408,46.6265972,100.84.170.161,151.101.2.187,TLSv1.3,118,"Change Cipher Spec, Application Data"
409,46.6274188,100.84.170.161,151.101.2.187,TLSv1.3,146,Application Data
410,46.627755,100.84.170.161,151.101.2.187,TLSv1.3,441,Application Data
411,46.6354155,151.101.2.187,100.84.170.161,TCP,56,443  >  56939 [ACK] Seq=6244 Ack=1799 Win=145920 Len=0
412,46.6359517,151.101.2.187,100.84.170.161,TCP,56,443  >  56939 [ACK] Seq=6244 Ack=1891 Win=145920 Len=0
413,46.6362355,151.101.2.187,100.84.170.161,TLSv1.3,119,Application Data
414,46.6366277,100.84.170.161,151.101.2.187,TLSv1.3,85,Application Data
415,46.645681,151.101.2.187,100.84.170.161,TCP,56,443  >  56939 [ACK] Seq=6309 Ack=2309 Win=145920 Len=0
416,46.705456,151.101.2.187,100.84.170.161,TLSv1.3,541,Application Data
417,46.7069087,100.84.170.161,151.101.2.187,TLSv1.3,303,Application Data
418,46.7070792,100.84.170.161,151.101.2.187,TLSv1.3,16460,Application Data
419,46.7156492,151.101.2.187,100.84.170.161,TCP,56,443  >  56939 [ACK] Seq=6796 Ack=2558 Win=145920 Len=0
420,46.7166845,151.101.2.187,100.84.170.161,TCP,56,443  >  56939 [ACK] Seq=6796 Ack=18964 Win=130560 Len=0
421,46.7167292,100.84.170.161,151.101.2.187,TLSv1.3,1065,Application Data
422,46.7170037,151.101.2.187,100.84.170.161,TLSv1.3,89,Application Data
423,46.7253554,151.101.2.187,100.84.170.161,TCP,56,443  >  56939 [ACK] Seq=6831 Ack=19975 Win=145408 Len=0
424,46.743703,151.101.2.187,100.84.170.161,TCP,89,"[TCP Retransmission] 443  >  56939 [PSH, ACK] Seq=6796 Ack=19975 Win=145920 Len=35"
425,46.7437485,100.84.170.161,151.101.2.187,TCP,66,56939  >  443 [ACK] Seq=19975 Ack=6831 Win=130560 Len=0 SLE=6796 SRE=6831
426,46.8068461,151.101.2.187,100.84.170.161,TLSv1.3,238,Application Data
427,46.8071583,151.101.2.187,100.84.170.161,TLSv1.3,106,Application Data
428,46.8071996,100.84.170.161,151.101.2.187,TCP,54,56939  >  443 [ACK] Seq=19975 Ack=7067 Win=130560 Len=0
429,49.450745,100.84.170.161,151.101.2.187,TLSv1.2,2534,Application Data
430,49.4519219,100.84.170.161,151.101.2.187,TLSv1.2,2530,Application Data
431,49.4596433,151.101.2.187,100.84.170.161,TCP,56,443  >  55283 [ACK] Seq=266911 Ack=192727 Win=1815 Len=0
432,49.4606419,151.101.2.187,100.84.170.161,TCP,56,443  >  55283 [ACK] Seq=266911 Ack=195203 Win=1826 Len=0
433,49.4623754,151.101.2.187,100.84.170.161,TLSv1.2,290,Application Data
434,49.4628698,151.101.2.187,100.84.170.161,TLSv1.2,130,Application Data
435,49.462929,100.84.170.161,151.101.2.187,TCP,54,55283  >  443 [ACK] Seq=195203 Ack=267223 Win=512 Len=0
436,49.8596017,100.84.170.161,151.101.2.187,TLSv1.2,2497,Application Data
437,49.8677224,100.84.170.161,151.101.2.187,TLSv1.2,2493,Application Data
438,49.8681423,151.101.2.187,100.84.170.161,TCP,56,443  >  55283 [ACK] Seq=267223 Ack=197646 Win=1838 Len=0
439,49.869906,100.84.170.161,151.101.2.187,TLSv1.2,2495,Application Data
440,49.870727,151.101.2.187,100.84.170.161,TLSv1.2,236,Application Data
441,49.876836,151.101.2.187,100.84.170.161,TCP,56,443  >  55283 [ACK] Seq=267405 Ack=200085 Win=1849 Len=0
442,49.8786005,151.101.2.187,100.84.170.161,TCP,56,443  >  55283 [ACK] Seq=267405 Ack=202526 Win=1860 Len=0
443,49.8796593,151.101.2.187,100.84.170.161,TLSv1.2,187,Application Data
444,49.8797163,100.84.170.161,151.101.2.187,TCP,54,55283  >  443 [ACK] Seq=202526 Ack=267538 Win=510 Len=0
445,49.8816245,151.101.2.187,100.84.170.161,TLSv1.2,135,Application Data
446,49.8832899,100.84.170.161,151.101.2.187,TLSv1.2,2493,Application Data
447,49.8880618,100.84.170.161,151.101.2.187,TLSv1.2,2491,Application Data
448,49.8918751,151.101.2.187,100.84.170.161,TCP,56,443  >  55283 [ACK] Seq=267619 Ack=204965 Win=1872 Len=0
449,49.8963204,151.101.2.187,100.84.170.161,TLSv1.2,130,Application Data
450,49.8969871,151.101.2.187,100.84.170.161,TCP,56,443  >  55283 [ACK] Seq=267695 Ack=207402 Win=1883 Len=0
451,49.8991259,151.101.2.187,100.84.170.161,TLSv1.2,208,Application Data
452,49.8991839,100.84.170.161,151.101.2.187,TCP,54,55283  >  443 [ACK] Seq=207402 Ack=267849 Win=509 Len=0
453,49.92285,100.84.170.161,151.101.2.187,TLSv1.2,2509,Application Data
454,49.931701,151.101.2.187,100.84.170.161,TCP,56,443  >  55283 [ACK] Seq=267849 Ack=209857 Win=1895 Len=0
455,49.9336502,151.101.2.187,100.84.170.161,TLSv1.2,130,Application Data
456,49.9612754,151.101.2.187,100.84.170.161,TCP,130,"[TCP Retransmission] 443  >  55283 [PSH, ACK] Seq=267849 Ack=209857 Win=1895 Len=76"
457,49.9613266,100.84.170.161,151.101.2.187,TCP,66,55283  >  443 [ACK] Seq=209857 Ack=267925 Win=509 Len=0 SLE=267849 SRE=267925
458,50.0974414,100.84.170.161,151.101.2.187,TLSv1.2,2510,Application Data
459,50.1022682,100.84.170.161,151.101.2.187,TLSv1.2,2493,Application Data
460,50.1085765,151.101.2.187,100.84.170.161,TCP,56,443  >  55283 [ACK] Seq=267925 Ack=212313 Win=1906 Len=0
461,50.113748,151.101.2.187,100.84.170.161,TCP,56,443  >  55283 [ACK] Seq=267925 Ack=214752 Win=1917 Len=0
462,50.1142397,151.101.2.187,100.84.170.161,TLSv1.2,130,Application Data
463,50.1172453,151.101.2.187,100.84.170.161,TLSv1.2,130,Application Data
464,50.117326,100.84.170.161,151.101.2.187,TCP,54,55283  >  443 [ACK] Seq=214752 Ack=268077 Win=508 Len=0
465,50.2009033,100.84.170.161,151.101.2.187,TLSv1.2,2493,Application Data
466,50.2107697,151.101.2.187,100.84.170.161,TCP,56,443  >  55283 [ACK] Seq=268077 Ack=217191 Win=1929 Len=0
467,50.2135346,151.101.2.187,100.84.170.161,TLSv1.2,103,Application Data
468,50.2402752,151.101.2.187,100.84.170.161,TCP,103,"[TCP Retransmission] 443  >  55283 [PSH, ACK] Seq=268077 Ack=217191 Win=1929 Len=49"
469,50.2403176,100.84.170.161,151.101.2.187,TCP,66,55283  >  443 [ACK] Seq=217191 Ack=268126 Win=508 Len=0 SLE=268077 SRE=268126
470,50.4386364,100.84.170.161,151.101.2.187,TLSv1.2,2503,Application Data
471,50.4388724,100.84.170.161,151.101.2.187,TLSv1.2,2497,Application Data
472,50.440285,100.84.170.161,151.101.2.187,TLSv1.2,2498,Application Data
473,50.4450426,100.84.170.161,151.101.2.187,TLSv1.2,2505,Application Data
474,50.4491548,151.101.2.187,100.84.170.161,TCP,56,443  >  55283 [ACK] Seq=268126 Ack=219640 Win=1940 Len=0
475,50.4508043,151.101.2.187,100.84.170.161,TCP,56,443  >  55283 [ACK] Seq=268126 Ack=224527 Win=1963 Len=0
476,50.4535877,151.101.2.187,100.84.170.161,TLSv1.2,131,Application Data
477,50.4540618,151.101.2.187,100.84.170.161,TCP,56,443  >  55283 [ACK] Seq=268203 Ack=226978 Win=1974 Len=0
478,50.4546035,151.101.2.187,100.84.170.161,TLSv1.2,181,Application Data
479,50.4546508,100.84.170.161,151.101.2.187,TCP,54,55283  >  443 [ACK] Seq=226978 Ack=268330 Win=507 Len=0
480,50.4558676,151.101.2.187,100.84.170.161,TLSv1.2,130,Application Data
481,50.4583411,151.101.2.187,100.84.170.161,TLSv1.2,262,Application Data
482,50.4583994,100.84.170.161,151.101.2.187,TCP,54,55283  >  443 [ACK] Seq=226978 Ack=268614 Win=513 Len=0
483,50.4671039,100.84.170.161,151.101.2.187,TLSv1.2,2499,Application Data
484,50.4720067,100.84.170.161,151.101.2.187,TLSv1.2,2506,Application Data
485,50.4722345,100.84.170.161,151.101.2.187,TLSv1.2,2505,Application Data
486,50.4723772,100.84.170.161,151.101.2.187,TLSv1.2,2499,Application Data
487,50.4725043,100.84.170.161,151.101.2.187,TLSv1.2,2499,Application Data
488,50.4737723,100.84.170.161,151.101.2.187,TLSv1.2,2502,Application Data
489,50.473976,100.84.170.161,151.101.2.187,TLSv1.2,2499,Application Data
490,50.4741261,100.84.170.161,151.101.2.187,TLSv1.2,2505,Application Data
491,50.4742558,100.84.170.161,151.101.2.187,TLSv1.2,2496,Application Data
492,50.4746133,100.84.170.161,151.101.2.187,TLSv1.2,2498,Application Data
493,50.4759383,151.101.2.187,100.84.170.161,TCP,56,443  >  55283 [ACK] Seq=268614 Ack=229423 Win=1986 Len=0
494,50.4790769,151.101.2.187,100.84.170.161,TLSv1.2,186,Application Data
495,50.4810235,151.101.2.187,100.84.170.161,TCP,56,443  >  55283 [ACK] Seq=268746 Ack=231875 Win=1997 Len=0
496,50.4825164,151.101.2.187,100.84.170.161,TCP,56,443  >  55283 [ACK] Seq=268746 Ack=239216 Win=2031 Len=0
497,50.4829044,151.101.2.187,100.84.170.161,TCP,56,443  >  55283 [ACK] Seq=268746 Ack=241664 Win=2043 Len=0
498,50.4831879,151.101.2.187,100.84.170.161,TCP,56,443  >  55283 [ACK] Seq=268746 Ack=246560 Win=2066 Len=0
499,50.4834287,151.101.2.187,100.84.170.161,TCP,56,443  >  55283 [ACK] Seq=268746 Ack=251446 Win=2088 Len=0
500,50.4838371,151.101.2.187,100.84.170.161,TLSv1.2,135,Application Data
501,50.4839333,100.84.170.161,151.101.2.187,TCP,54,55283  >  443 [ACK] Seq=251446 Ack=268827 Win=512 Len=0
502,50.4843414,151.101.2.187,100.84.170.161,TLSv1.2,131,Application Data
503,50.484508,151.101.2.187,100.84.170.161,TLSv1.2,208,Application Data
504,50.4845304,100.84.170.161,151.101.2.187,TCP,54,55283  >  443 [ACK] Seq=251446 Ack=269058 Win=511 Len=0
505,50.4856211,151.101.2.187,100.84.170.161,TLSv1.2,130,Application Data
506,50.4860184,151.101.2.187,100.84.170.161,TLSv1.2,130,Application Data
507,50.4860597,100.84.170.161,151.101.2.187,TCP,54,55283  >  443 [ACK] Seq=251446 Ack=269210 Win=510 Len=0
508,50.4864425,151.101.2.187,100.84.170.161,TLSv1.2,130,Application Data
509,50.4870517,151.101.2.187,100.84.170.161,TLSv1.2,131,Application Data
510,50.4870978,100.84.170.161,151.101.2.187,TCP,54,55283  >  443 [ACK] Seq=251446 Ack=269363 Win=510 Len=0
511,50.4874487,151.101.2.187,100.84.170.161,TLSv1.2,130,Application Data
512,50.4880996,151.101.2.187,100.84.170.161,TLSv1.2,181,Application Data
513,50.4881397,100.84.170.161,151.101.2.187,TCP,54,55283  >  443 [ACK] Seq=251446 Ack=269566 Win=509 Len=0
514,50.6928654,100.84.170.161,151.101.2.187,TLSv1.3,136,Application Data
515,50.6930742,100.84.170.161,151.101.2.187,TLSv1.3,16460,Application Data
516,50.6932099,100.84.170.161,151.101.2.187,TLSv1.3,5496,Application Data
517,50.7018272,151.101.2.187,100.84.170.161,TCP,56,443  >  56939 [ACK] Seq=7067 Ack=20057 Win=145920 Len=0
518,50.7026479,151.101.2.187,100.84.170.161,TCP,56,443  >  56939 [ACK] Seq=7067 Ack=41905 Win=140288 Len=0
519,50.7029965,151.101.2.187,100.84.170.161,TLSv1.3,89,Application Data
520,50.7286196,151.101.2.187,100.84.170.161,TCP,89,"[TCP Retransmission] 443  >  56939 [PSH, ACK] Seq=7067 Ack=41905 Win=145920 Len=35"
521,50.7287179,100.84.170.161,151.101.2.187,TCP,66,56939  >  443 [ACK] Seq=41905 Ack=7102 Win=130304 Len=0 SLE=7067 SRE=7102
522,50.79437,151.101.2.187,100.84.170.161,TLSv1.3,179,Application Data
523,50.7946421,151.101.2.187,100.84.170.161,TLSv1.3,106,Application Data
524,50.7946786,100.84.170.161,151.101.2.187,TCP,54,56939  >  443 [ACK] Seq=41905 Ack=7279 Win=130304 Len=0
525,53.1267551,100.84.170.161,151.101.2.187,TLSv1.2,2268,Application Data
526,53.1370722,151.101.2.187,100.84.170.161,TCP,56,443  >  55283 [ACK] Seq=269566 Ack=253660 Win=2100 Len=0
527,53.1927643,151.101.2.187,100.84.170.161,TLSv1.2,697,Application Data
528,53.1946598,100.84.170.161,151.101.2.187,TLSv1.2,89,Application Data
529,53.2032841,151.101.2.187,100.84.170.161,TCP,56,443  >  55283 [ACK] Seq=270209 Ack=253695 Win=2100 Len=0
530,53.8395096,100.84.170.161,151.101.2.187,TLSv1.2,2642,Application Data
531,53.8498434,151.101.2.187,100.84.170.161,TCP,56,443  >  55283 [ACK] Seq=270209 Ack=256283 Win=2111 Len=0
532,54.1393862,151.101.2.187,100.84.170.161,TLSv1.2,378,Application Data
533,54.1393862,151.101.2.187,100.84.170.161,TCP,2966,443  >  55283 [ACK] Seq=270533 Ack=256283 Win=2111 Len=2912 [TCP PDU reassembled in 534]
534,54.1393862,151.101.2.187,100.84.170.161,TLSv1.2,606,Application Data
535,54.1393862,151.101.2.187,100.84.170.161,TCP,7334,443  >  55283 [ACK] Seq=273997 Ack=256283 Win=2111 Len=7280 [TCP PDU reassembled in 536]
536,54.1393862,151.101.2.187,100.84.170.161,TLSv1.2,981,Application Data
537,54.1393862,151.101.2.187,100.84.170.161,TLSv1.2,1307,Application Data
538,54.1393862,151.101.2.187,100.84.170.161,TCP,2966,443  >  55283 [ACK] Seq=283457 Ack=256283 Win=2111 Len=2912 [TCP PDU reassembled in 539]
539,54.1393862,151.101.2.187,100.84.170.161,TLSv1.2,955,Application Data
540,54.1393862,151.101.2.187,100.84.170.161,TCP,955,"[TCP Retransmission] 443  >  55283 [PSH, ACK] Seq=286369 Ack=256283 Win=2111 Len=901 [TCP PDU reassembled in 539]"
541,54.1395834,100.84.170.161,151.101.2.187,TCP,66,55283  >  443 [ACK] Seq=256283 Ack=287270 Win=513 Len=0 SLE=286369 SRE=287270
542,54.2093584,151.101.2.187,100.84.170.161,TCP,1510,443  >  55283 [ACK] Seq=287270 Ack=256283 Win=2111 Len=1456 [TCP PDU reassembled in 546]
543,54.2097468,151.101.2.187,100.84.170.161,TCP,1510,443  >  55283 [ACK] Seq=288726 Ack=256283 Win=2111 Len=1456 [TCP PDU reassembled in 546]
544,54.2097902,100.84.170.161,151.101.2.187,TCP,54,55283  >  443 [ACK] Seq=256283 Ack=290182 Win=513 Len=0
545,54.2110638,151.101.2.187,100.84.170.161,TCP,13158,443  >  55283 [ACK] Seq=290182 Ack=256283 Win=2111 Len=13104 [TCP PDU reassembled in 546]
546,54.2110638,151.101.2.187,100.84.170.161,TLSv1.2,1479,"Application Data, Application Data"
547,54.2111676,100.84.170.161,151.101.2.187,TCP,54,55283  >  443 [ACK] Seq=256283 Ack=304711 Win=513 Len=0
548,54.2828929,151.101.2.187,100.84.170.161,TCP,1510,443  >  55283 [ACK] Seq=304711 Ack=256283 Win=2111 Len=1456 [TCP PDU reassembled in 552]
549,54.2832892,151.101.2.187,100.84.170.161,TCP,1510,443  >  55283 [ACK] Seq=306167 Ack=256283 Win=2111 Len=1456 [TCP PDU reassembled in 552]
550,54.2833429,100.84.170.161,151.101.2.187,TCP,54,55283  >  443 [ACK] Seq=256283 Ack=307623 Win=513 Len=0
551,54.2836033,151.101.2.187,100.84.170.161,TCP,1510,443  >  55283 [ACK] Seq=307623 Ack=256283 Win=2111 Len=1456 [TCP PDU reassembled in 552]
552,54.2836033,151.101.2.187,100.84.170.161,TLSv1.2,1195,Application Data
553,54.2836484,100.84.170.161,151.101.2.187,TCP,54,55283  >  443 [ACK] Seq=256283 Ack=310220 Win=513 Len=0
554,54.2853624,151.101.2.187,100.84.170.161,TLSv1.2,18982,Application Data
555,54.2853624,151.101.2.187,100.84.170.161,TLSv1.2,256,Application Data
556,54.2853624,151.101.2.187,100.84.170.161,TCP,16070,443  >  55283 [ACK] Seq=329350 Ack=256283 Win=2111 Len=16016 [TCP PDU reassembled in 557]
557,54.2853624,151.101.2.187,100.84.170.161,TLSv1.2,514,"Application Data, Application Data"
558,54.2854811,100.84.170.161,151.101.2.187,TCP,54,55283  >  443 [ACK] Seq=256283 Ack=345826 Win=513 Len=0
559,54.2868272,151.101.2.187,100.84.170.161,TCP,7334,443  >  55283 [ACK] Seq=345826 Ack=256283 Win=2111 Len=7280 [TCP PDU reassembled in 560]
560,54.2868272,151.101.2.187,100.84.170.161,TLSv1.2,997,Application Data
561,54.2868272,151.101.2.187,100.84.170.161,TLSv1.2,16070,Application Data
562,54.2868272,151.101.2.187,100.84.170.161,TLSv1.2,484,Application Data
563,54.2868272,151.101.2.187,100.84.170.161,TLSv1.2,8790,Application Data
564,54.2868272,151.101.2.187,100.84.170.161,TLSv1.2,1338,Application Data
565,54.2869781,100.84.170.161,151.101.2.187,TCP,54,55283  >  443 [ACK] Seq=256283 Ack=380515 Win=513 Len=0
566,54.3335004,151.101.2.187,100.84.170.161,TCP,1510,443  >  55283 [ACK] Seq=380515 Ack=256283 Win=2111 Len=1456 [TCP PDU reassembled in 567]
567,54.3338166,151.101.2.187,100.84.170.161,TLSv1.2,1057,Application Data
568,54.3338647,100.84.170.161,151.101.2.187,TCP,54,55283  >  443 [ACK] Seq=256283 Ack=382974 Win=513 Len=0
569,54.3341638,151.101.2.187,100.84.170.161,TCP,1510,443  >  55283 [ACK] Seq=382974 Ack=256283 Win=2111 Len=1456 [TCP PDU reassembled in 570]
570,54.3341638,151.101.2.187,100.84.170.161,TLSv1.2,387,Application Data
571,54.3342155,100.84.170.161,151.101.2.187,TCP,54,55283  >  443 [ACK] Seq=256283 Ack=384763 Win=513 Len=0
572,54.3347456,151.101.2.187,100.84.170.161,TLSv1.2,85,Application Data
573,54.3681325,151.101.2.187,100.84.170.161,TCP,85,"[TCP Retransmission] 443  >  55283 [PSH, ACK] Seq=384763 Ack=256283 Win=2111 Len=31"
574,54.3681726,100.84.170.161,151.101.2.187,TCP,66,55283  >  443 [ACK] Seq=256283 Ack=384794 Win=513 Len=0 SLE=384763 SRE=384794
575,54.371709,100.84.170.161,151.101.2.187,TLSv1.2,2401,Application Data
576,54.3803756,151.101.2.187,100.84.170.161,TCP,56,443  >  55283 [ACK] Seq=384794 Ack=258630 Win=2123 Len=0
577,54.3942002,151.101.2.187,100.84.170.161,TLSv1.2,250,Application Data
578,54.3944164,151.101.2.187,100.84.170.161,TLSv1.2,355,Application Data
579,54.3944523,100.84.170.161,151.101.2.187,TCP,54,55283  >  443 [ACK] Seq=258630 Ack=385291 Win=511 Len=0
580,55.854487,100.84.170.161,151.101.2.187,TLSv1.3,136,Application Data
581,55.8546962,100.84.170.161,151.101.2.187,TLSv1.3,16460,Application Data
582,55.8548568,100.84.170.161,151.101.2.187,TLSv1.3,7169,Application Data
583,55.8658347,151.101.2.187,100.84.170.161,TCP,56,443  >  56939 [ACK] Seq=7279 Ack=58393 Win=129536 Len=0
584,55.8661353,151.101.2.187,100.84.170.161,TCP,56,443  >  56939 [ACK] Seq=7279 Ack=61313 Win=145920 Len=0
585,55.8666066,151.101.2.187,100.84.170.161,TLSv1.3,89,Application Data
586,55.8907729,151.101.2.187,100.84.170.161,TCP,89,"[TCP Retransmission] 443  >  56939 [PSH, ACK] Seq=7279 Ack=65508 Win=145920 Len=35"
587,55.8908411,100.84.170.161,151.101.2.187,TCP,66,56939  >  443 [ACK] Seq=65508 Ack=7314 Win=130304 Len=0 SLE=7279 SRE=7314
588,55.9603568,151.101.2.187,100.84.170.161,TLSv1.3,176,Application Data
589,55.9603568,151.101.2.187,100.84.170.161,TLSv1.3,106,Application Data
590,55.9604307,100.84.170.161,151.101.2.187,TCP,54,56939  >  443 [ACK] Seq=65508 Ack=7488 Win=130048 Len=0
591,55.961531,100.84.170.161,151.101.2.187,TLSv1.3,89,Application Data
592,55.9708473,151.101.2.187,100.84.170.161,TCP,56,443  >  56939 [ACK] Seq=7488 Ack=65543 Win=145920 Len=0
