No.,Time,Source,Destination,Protocol,Length,Info
1,0.0,172.20.40.110,151.101.66.187,TLSv1.2,2878,Application Data
2,0.0001929,172.20.40.110,151.101.66.187,TLSv1.2,93,Application Data
3,0.0271688,151.101.66.187,172.20.40.110,TCP,60,443  >  56337 [ACK] Seq=1 Ack=2825 Win=223 Len=0
4,0.0271688,151.101.66.187,172.20.40.110,TCP,60,443  >  56337 [ACK] Seq=1 Ack=2864 Win=223 Len=0
5,0.0271688,151.101.66.187,172.20.40.110,TLSv1.2,93,Application Data
6,0.0271688,151.101.66.187,172.20.40.110,TLSv1.2,241,Application Data
7,0.0274949,172.20.40.110,151.101.66.187,TCP,54,56337  >  443 [ACK] Seq=2864 Ack=227 Win=257 Len=0
8,0.4981087,172.20.40.110,151.101.66.187,TLSv1.2,2876,Application Data
9,0.5213324,151.101.66.187,172.20.40.110,TCP,60,443  >  56337 [ACK] Seq=227 Ack=5686 Win=218 Len=0
10,0.5213324,151.101.66.187,172.20.40.110,TLSv1.2,341,Application Data
11,0.5226584,172.20.40.110,151.101.66.187,TLSv1.2,2879,Application Data
12,0.5347759,151.101.66.187,172.20.40.110,TCP,60,443  >  56337 [ACK] Seq=514 Ack=8511 Win=213 Len=0
13,0.5382451,151.101.66.187,172.20.40.110,TLSv1.2,98,Application Data
14,0.5813649,172.20.40.110,151.101.66.187,TCP,54,56337  >  443 [ACK] Seq=8511 Ack=558 Win=256 Len=0
15,1.4193629,172.20.40.110,151.101.66.187,TLSv1.2,2864,Application Data
16,1.4292101,151.101.66.187,172.20.40.110,TCP,60,443  >  56337 [ACK] Seq=558 Ack=11321 Win=208 Len=0
17,1.4316671,151.101.66.187,172.20.40.110,TLSv1.2,234,Application Data
18,1.4748231,172.20.40.110,151.101.66.187,TCP,54,56337  >  443 [ACK] Seq=11321 Ack=738 Win=255 Len=0
19,1.5366092,172.20.40.110,151.101.66.187,TLSv1.2,2867,Application Data
20,1.5518884,151.101.66.187,172.20.40.110,TCP,60,443  >  56337 [ACK] Seq=738 Ack=12701 Win=206 Len=0
21,1.5538103,151.101.66.187,172.20.40.110,TCP,60,443  >  56337 [ACK] Seq=738 Ack=14134 Win=204 Len=0
22,1.557589,151.101.66.187,172.20.40.110,TLSv1.2,130,Application Data
23,1.5640922,172.20.40.110,151.101.66.187,TLSv1.2,2869,Application Data
24,1.5759736,151.101.66.187,172.20.40.110,TCP,60,443  >  56337 [ACK] Seq=814 Ack=16949 Win=199 Len=0
25,1.5817202,151.101.66.187,172.20.40.110,TLSv1.2,124,Application Data
26,1.6268395,172.20.40.110,151.101.66.187,TCP,54,56337  >  443 [ACK] Seq=16949 Ack=884 Win=255 Len=0
27,2.2624909,172.20.40.110,151.101.66.187,TCP,54,"56337  >  443 [FIN, ACK] Seq=16949 Ack=884 Win=255 Len=0"
28,2.2743579,151.101.66.187,172.20.40.110,TCP,60,443  >  56337 [ACK] Seq=884 Ack=16950 Win=204 Len=0
29,2.2743579,151.101.66.187,172.20.40.110,TLSv1.2,78,Application Data
30,2.2743579,151.101.66.187,172.20.40.110,TCP,60,"443  >  56337 [FIN, ACK] Seq=908 Ack=16950 Win=204 Len=0"
31,2.2745774,172.20.40.110,151.101.66.187,TCP,54,"56337  >  443 [RST, ACK] Seq=16950 Ack=908 Win=0 Len=0"
32,3.3271799,151.101.2.187,172.20.40.110,TLSv1.2,105,Application Data
33,3.3271799,151.101.2.187,172.20.40.110,TLSv1.2,78,Application Data
34,3.3271799,151.101.2.187,172.20.40.110,TCP,60,"443  >  65401 [FIN, ACK] Seq=76 Ack=1 Win=198 Len=0"
35,3.3654468,151.101.2.187,172.20.40.110,TCP,60,"[TCP Retransmission] 443  >  65401 [FIN, ACK] Seq=76 Ack=1 Win=198 Len=0"
36,3.5922506,151.101.2.187,172.20.40.110,TCP,129,"[TCP Retransmission] 443  >  65401 [FIN, PSH, ACK] Seq=1 Ack=1 Win=198 Len=75"
37,4.0294568,151.101.2.187,172.20.40.110,TCP,129,"[TCP Retransmission] 443  >  65401 [FIN, PSH, ACK] Seq=1 Ack=1 Win=198 Len=75"
38,4.9279253,151.101.2.187,172.20.40.110,TCP,129,"[TCP Retransmission] 443  >  65401 [FIN, PSH, ACK] Seq=1 Ack=1 Win=198 Len=75"
39,5.1971985,172.20.40.110,151.101.130.187,TCP,66,52383  >  443 [SYN] Seq=0 Win=64240 Len=0 MSS=1460 WS=256 SACK_PERM
40,5.2076334,151.101.130.187,172.20.40.110,TCP,66,"443  >  52383 [SYN, ACK] Seq=0 Ack=1 Win=65535 Len=0 MSS=1380 SACK_PERM WS=512"
41,5.2079537,172.20.40.110,151.101.130.187,TCP,54,52383  >  443 [ACK] Seq=1 Ack=1 Win=131072 Len=0
42,5.2092794,172.20.40.110,151.101.130.187,TLSv1.3,2097,Client Hello (SNI=www.target.com)
43,5.2304231,151.101.130.187,172.20.40.110,TCP,60,443  >  52383 [ACK] Seq=1 Ack=2044 Win=144384 Len=0
44,5.2304231,151.101.130.187,172.20.40.110,TLSv1.3,1434,"Server Hello, Change Cipher Spec, Application Data, Application Data"
45,5.2304231,151.101.130.187,172.20.40.110,TLSv1.3,215,Application Data
46,5.2305113,172.20.40.110,151.101.130.187,TCP,54,52383  >  443 [ACK] Seq=2044 Ack=1542 Win=131072 Len=0
47,5.231705,172.20.40.110,151.101.130.187,TLSv1.3,118,"Change Cipher Spec, Application Data"
48,5.2323275,172.20.40.110,151.101.130.187,TLSv1.3,146,Application Data
49,5.2337376,172.20.40.110,151.101.130.187,TLSv1.3,2865,Application Data
50,5.2342099,172.20.40.110,151.101.130.187,TLSv1.3,2856,Application Data
51,5.2345444,172.20.40.110,151.101.130.187,TLSv1.3,2850,Application Data
52,5.2348918,172.20.40.110,151.101.130.187,TLSv1.3,2850,Application Data
53,5.2408226,172.20.40.110,151.101.130.187,TLSv1.3,2850,Application Data
54,5.2490843,151.101.130.187,172.20.40.110,TCP,60,443  >  52383 [ACK] Seq=1542 Ack=2108 Win=144384 Len=0
55,5.2490843,151.101.130.187,172.20.40.110,TCP,60,443  >  52383 [ACK] Seq=1542 Ack=2200 Win=144384 Len=0
56,5.2490843,151.101.130.187,172.20.40.110,TLSv1.3,119,Application Data
57,5.2490843,151.101.130.187,172.20.40.110,TCP,60,443  >  52383 [ACK] Seq=1607 Ack=5011 Win=141824 Len=0
58,5.2503453,172.20.40.110,151.101.130.187,TLSv1.3,85,Application Data
59,5.2519438,172.20.40.110,151.101.130.187,TLSv1.3,2864,Application Data
60,5.2568627,151.101.130.187,172.20.40.110,TLSv1.3,451,Application Data
61,5.2568627,151.101.130.187,172.20.40.110,TCP,60,443  >  52383 [ACK] Seq=2004 Ack=7813 Win=139264 Len=0
62,5.2568627,151.101.130.187,172.20.40.110,TCP,60,443  >  52383 [ACK] Seq=2004 Ack=10609 Win=136704 Len=0
63,5.2568627,151.101.130.187,172.20.40.110,TCP,60,443  >  52383 [ACK] Seq=2004 Ack=13405 Win=134144 Len=0
64,5.2568627,151.101.130.187,172.20.40.110,TCP,60,443  >  52383 [ACK] Seq=2004 Ack=16201 Win=131584 Len=0
65,5.2576783,151.101.130.187,172.20.40.110,TCP,60,443  >  52383 [ACK] Seq=2004 Ack=16232 Win=131584 Len=0
66,5.2601618,151.101.130.187,172.20.40.110,TLSv1.3,130,Application Data
67,5.2601618,151.101.130.187,172.20.40.110,TLSv1.3,131,Application Data
68,5.2601618,151.101.130.187,172.20.40.110,TLSv1.3,124,Application Data
69,5.2602457,172.20.40.110,151.101.130.187,TCP,54,52383  >  443 [ACK] Seq=19042 Ack=2227 Win=130304 Len=0
70,5.2658963,151.101.130.187,172.20.40.110,TCP,60,443  >  52383 [ACK] Seq=2227 Ack=19042 Win=129024 Len=0
71,5.2658963,151.101.130.187,172.20.40.110,TLSv1.3,130,Application Data
72,5.2658963,151.101.130.187,172.20.40.110,TLSv1.3,125,Application Data
73,5.2659869,172.20.40.110,151.101.130.187,TCP,54,52383  >  443 [ACK] Seq=19042 Ack=2374 Win=130048 Len=0
74,5.3606753,172.20.40.110,151.101.130.187,TLSv1.3,2847,Application Data
75,5.3777155,172.20.40.110,151.101.130.187,TLSv1.3,2864,Application Data
76,5.3833076,151.101.130.187,172.20.40.110,TCP,60,443  >  52383 [ACK] Seq=2374 Ack=21835 Win=126464 Len=0
77,5.3883294,151.101.130.187,172.20.40.110,TLSv1.3,131,Application Data
78,5.3883294,151.101.130.187,172.20.40.110,TCP,60,443  >  52383 [ACK] Seq=2451 Ack=24645 Win=123904 Len=0
79,5.3926483,151.101.130.187,172.20.40.110,TLSv1.3,130,Application Data
80,5.3927463,172.20.40.110,151.101.130.187,TCP,54,52383  >  443 [ACK] Seq=24645 Ack=2527 Win=130048 Len=0
81,5.7603941,172.20.40.110,151.101.130.187,TLSv1.3,2858,Application Data
82,5.7609801,172.20.40.110,151.101.130.187,TLSv1.3,2850,Application Data
83,5.7756346,151.101.130.187,172.20.40.110,TCP,60,443  >  52383 [ACK] Seq=2527 Ack=27449 Win=121344 Len=0
84,5.7756346,151.101.130.187,172.20.40.110,TCP,60,443  >  52383 [ACK] Seq=2527 Ack=30245 Win=118784 Len=0
85,5.7802617,151.101.130.187,172.20.40.110,TLSv1.3,240,Application Data
86,5.7802617,151.101.130.187,172.20.40.110,TLSv1.3,130,Application Data
87,5.7803412,172.20.40.110,151.101.130.187,TCP,54,52383  >  443 [ACK] Seq=30245 Ack=2789 Win=129792 Len=0
88,5.9544107,172.20.40.110,151.101.130.187,TLSv1.3,2866,Application Data
89,5.9547936,172.20.40.110,151.101.130.187,TLSv1.3,2868,Application Data
90,5.9603944,172.20.40.110,151.101.130.187,TLSv1.3,2867,Application Data
91,5.9671861,151.101.130.187,172.20.40.110,TCP,60,443  >  52383 [ACK] Seq=2789 Ack=33057 Win=116224 Len=0
92,5.9703717,151.101.130.187,172.20.40.110,TCP,60,443  >  52383 [ACK] Seq=2789 Ack=35871 Win=113664 Len=0
93,5.9703717,151.101.130.187,172.20.40.110,TLSv1.3,124,Application Data
94,5.9703717,151.101.130.187,172.20.40.110,TLSv1.3,131,Application Data
95,5.9704709,172.20.40.110,151.101.130.187,TCP,54,52383  >  443 [ACK] Seq=38684 Ack=2936 Win=131072 Len=0
96,5.9723882,151.101.130.187,172.20.40.110,TCP,60,443  >  52383 [ACK] Seq=2936 Ack=38684 Win=111104 Len=0
97,5.9773796,151.101.130.187,172.20.40.110,TLSv1.3,168,Application Data
98,6.0141642,151.101.130.187,172.20.40.110,TCP,168,"[TCP Retransmission] 443  >  52383 [PSH, ACK] Seq=2936 Ack=38684 Win=111104 Len=114"
99,6.0142253,172.20.40.110,151.101.130.187,TCP,66,52383  >  443 [ACK] Seq=38684 Ack=3050 Win=130816 Len=0 SLE=2936 SRE=3050
100,9.5537724,172.20.40.110,151.101.130.187,TLSv1.3,2860,Application Data
101,9.5543419,172.20.40.110,151.101.130.187,TLSv1.3,2858,Application Data
102,9.5565049,172.20.40.110,151.101.130.187,TLSv1.3,2863,Application Data
103,9.5661876,151.101.130.187,172.20.40.110,TCP,60,443  >  52383 [ACK] Seq=3050 Ack=41490 Win=108544 Len=0
104,9.5661876,151.101.130.187,172.20.40.110,TCP,60,443  >  52383 [ACK] Seq=3050 Ack=44294 Win=105984 Len=0
105,9.5683058,151.101.130.187,172.20.40.110,TCP,60,443  >  52383 [ACK] Seq=3050 Ack=47103 Win=103424 Len=0
106,9.5694939,151.101.130.187,172.20.40.110,TLSv1.3,406,Application Data
107,9.570561,151.101.130.187,172.20.40.110,TLSv1.3,130,Application Data
108,9.570561,151.101.130.187,172.20.40.110,TLSv1.3,131,Application Data
109,9.5706294,172.20.40.110,151.101.130.187,TCP,54,52383  >  443 [ACK] Seq=47103 Ack=3555 Win=130304 Len=0
110,10.237298,151.101.2.187,172.20.40.110,TCP,129,"[TCP Retransmission] 443  >  65401 [FIN, PSH, ACK] Seq=1 Ack=1 Win=198 Len=75"
111,15.7876917,172.20.40.110,151.101.130.187,TLSv1.3,2870,Application Data
112,15.7925505,172.20.40.110,151.101.130.187,TLSv1.3,2875,Application Data
113,15.8009044,172.20.40.110,151.101.130.187,TLSv1.3,2861,Application Data
114,15.8009598,151.101.130.187,172.20.40.110,TCP,60,443  >  52383 [ACK] Seq=3555 Ack=49919 Win=101888 Len=0
115,15.8009598,151.101.130.187,172.20.40.110,TLSv1.3,241,Application Data
116,15.8083292,151.101.130.187,172.20.40.110,TCP,60,443  >  52383 [ACK] Seq=3742 Ack=52740 Win=101888 Len=0
117,15.8218672,172.20.40.110,151.101.130.187,TLSv1.3,2876,Application Data
118,15.8251152,151.101.130.187,172.20.40.110,TLSv1.3,125,Application Data
119,15.8251152,151.101.130.187,172.20.40.110,TCP,60,443  >  52383 [ACK] Seq=3813 Ack=55547 Win=101888 Len=0
120,15.8251152,151.101.130.187,172.20.40.110,TLSv1.3,130,Application Data
121,15.825257,172.20.40.110,151.101.130.187,TCP,54,52383  >  443 [ACK] Seq=58369 Ack=3889 Win=130048 Len=0
122,15.8479143,151.101.130.187,172.20.40.110,TCP,60,443  >  52383 [ACK] Seq=3889 Ack=58369 Win=101888 Len=0
123,15.8479143,151.101.130.187,172.20.40.110,TLSv1.3,125,Application Data
124,15.8772172,151.101.130.187,172.20.40.110,TCP,125,"[TCP Retransmission] 443  >  52383 [PSH, ACK] Seq=3889 Ack=58369 Win=104448 Len=71"
125,15.8772749,172.20.40.110,151.101.130.187,TCP,66,52383  >  443 [ACK] Seq=58369 Ack=3960 Win=130048 Len=0 SLE=3889 SRE=3960
126,17.6623612,151.101.2.187,172.20.40.110,TCP,129,"[TCP Retransmission] 443  >  65401 [FIN, PSH, ACK] Seq=1 Ack=1 Win=198 Len=75"
127,23.7997735,172.20.40.110,151.101.130.187,TLSv1.3,2875,Application Data
128,23.8046626,172.20.40.110,151.101.130.187,TLSv1.3,2873,Application Data
129,23.8165046,151.101.130.187,172.20.40.110,TCP,60,443  >  52383 [ACK] Seq=3960 Ack=61190 Win=101888 Len=0
130,23.8197868,151.101.130.187,172.20.40.110,TLSv1.3,214,Application Data
131,23.8332473,151.101.130.187,172.20.40.110,TCP,60,443  >  52383 [ACK] Seq=4120 Ack=64009 Win=101888 Len=0
132,23.8332473,151.101.130.187,172.20.40.110,TLSv1.3,125,Application Data
133,23.8335946,172.20.40.110,151.101.130.187,TCP,54,52383  >  443 [ACK] Seq=64009 Ack=4191 Win=129792 Len=0
134,23.8378217,172.20.40.110,151.101.130.187,TLSv1.3,2876,Application Data
135,23.8503674,151.101.130.187,172.20.40.110,TCP,60,443  >  52383 [ACK] Seq=4191 Ack=66831 Win=101888 Len=0
136,23.8557613,151.101.130.187,172.20.40.110,TLSv1.3,98,Application Data
137,23.8955537,151.101.130.187,172.20.40.110,TCP,98,"[TCP Retransmission] 443  >  52383 [PSH, ACK] Seq=4191 Ack=66831 Win=104448 Len=44"
138,23.8956204,172.20.40.110,151.101.130.187,TCP,66,52383  >  443 [ACK] Seq=66831 Ack=4235 Win=129792 Len=0 SLE=4191 SRE=4235
139,25.0116554,172.20.40.110,151.101.130.187,TLSv1.3,2861,Application Data
140,25.022165,151.101.130.187,172.20.40.110,TCP,60,443  >  52383 [ACK] Seq=4235 Ack=69638 Win=101888 Len=0
141,25.0344834,151.101.130.187,172.20.40.110,TLSv1.3,240,Application Data
142,25.0653427,151.101.130.187,172.20.40.110,TCP,240,"[TCP Retransmission] 443  >  52383 [PSH, ACK] Seq=4235 Ack=69638 Win=104448 Len=186"
143,25.0654041,172.20.40.110,151.101.130.187,TCP,66,52383  >  443 [ACK] Seq=69638 Ack=4421 Win=131072 Len=0 SLE=4235 SRE=4421
144,25.1507096,172.20.40.110,151.101.130.187,TLSv1.3,2864,Application Data
145,25.1598707,151.101.130.187,172.20.40.110,TCP,60,443  >  52383 [ACK] Seq=4421 Ack=72448 Win=101888 Len=0
146,25.1640273,151.101.130.187,172.20.40.110,TLSv1.3,174,Application Data
147,25.1642513,172.20.40.110,151.101.130.187,TLSv1.3,2866,Application Data
148,25.1784536,151.101.130.187,172.20.40.110,TCP,60,443  >  52383 [ACK] Seq=4541 Ack=75260 Win=101888 Len=0
149,25.1831338,151.101.130.187,172.20.40.110,TLSv1.3,296,Application Data
150,25.2171533,151.101.130.187,172.20.40.110,TCP,296,"[TCP Retransmission] 443  >  52383 [PSH, ACK] Seq=4541 Ack=75260 Win=104448 Len=242"
151,25.2172247,172.20.40.110,151.101.130.187,TCP,66,52383  >  443 [ACK] Seq=75260 Ack=4783 Win=130560 Len=0 SLE=4541 SRE=4783
152,25.646896,172.20.40.110,151.101.130.187,TLSv1.3,2875,Application Data
153,25.6499152,172.20.40.110,151.101.130.187,TLSv1.3,2873,Application Data
154,25.6571114,151.101.130.187,172.20.40.110,TCP,60,443  >  52383 [ACK] Seq=4783 Ack=78081 Win=101888 Len=0
155,25.6631482,151.101.130.187,172.20.40.110,TCP,60,443  >  52383 [ACK] Seq=4783 Ack=80900 Win=101888 Len=0
156,25.6631482,151.101.130.187,172.20.40.110,TLSv1.3,214,Application Data
157,25.6641473,151.101.130.187,172.20.40.110,TLSv1.3,98,Application Data
158,25.664225,172.20.40.110,151.101.130.187,TCP,54,52383  >  443 [ACK] Seq=80900 Ack=4987 Win=130304 Len=0
159,25.679437,172.20.40.110,151.101.130.187,TLSv1.3,2876,Application Data
160,25.6879235,151.101.130.187,172.20.40.110,TCP,60,443  >  52383 [ACK] Seq=4987 Ack=83722 Win=101888 Len=0
161,25.6945859,151.101.130.187,172.20.40.110,TLSv1.3,98,Application Data
162,25.7286162,151.101.130.187,172.20.40.110,TCP,98,"[TCP Retransmission] 443  >  52383 [PSH, ACK] Seq=4987 Ack=83722 Win=104448 Len=44"
163,25.7286693,172.20.40.110,151.101.130.187,TCP,66,52383  >  443 [ACK] Seq=83722 Ack=5031 Win=130304 Len=0 SLE=4987 SRE=5031
164,30.2786941,172.20.40.110,151.101.130.187,TLSv1.3,2922,Application Data
165,30.2910958,151.101.130.187,172.20.40.110,TCP,60,443  >  52383 [ACK] Seq=5031 Ack=86590 Win=101888 Len=0
166,31.0504658,151.101.130.187,172.20.40.110,TLSv1.3,5574,"Application Data, Application Data, Application Data"
167,31.0505672,172.20.40.110,151.101.130.187,TCP,54,52383  >  443 [ACK] Seq=86590 Ack=10551 Win=131072 Len=0
168,31.0535781,172.20.40.110,151.101.130.187,TLSv1.3,89,Application Data
169,31.0639328,151.101.130.187,172.20.40.110,TLSv1.3,1434,Application Data
170,31.0639328,151.101.130.187,172.20.40.110,TLSv1.3,1434,Application Data
171,31.0639328,151.101.130.187,172.20.40.110,TLSv1.3,1434,Application Data
172,31.0640304,172.20.40.110,151.101.130.187,TCP,54,52383  >  443 [ACK] Seq=86625 Ack=14691 Win=131072 Len=0
173,31.0717798,151.101.130.187,172.20.40.110,TLSv1.3,1434,Application Data
174,31.0717798,151.101.130.187,172.20.40.110,TLSv1.3,1434,Application Data
175,31.0717798,151.101.130.187,172.20.40.110,TLSv1.3,1434,Application Data
176,31.0717798,151.101.130.187,172.20.40.110,TLSv1.3,1434,Application Data
177,31.0719768,172.20.40.110,151.101.130.187,TCP,54,52383  >  443 [ACK] Seq=86625 Ack=20211 Win=131072 Len=0
178,31.0738146,151.101.130.187,172.20.40.110,TLSv1.3,5574,"Application Data, Application Data, Application Data, Application Data, Application Data"
179,31.0739299,172.20.40.110,151.101.130.187,TCP,54,52383  >  443 [ACK] Seq=86625 Ack=25731 Win=131072 Len=0
180,31.0761442,151.101.130.187,172.20.40.110,TLSv1.3,5574,"Application Data, Application Data, Application Data, Application Data"
181,31.0762613,172.20.40.110,151.101.130.187,TCP,54,52383  >  443 [ACK] Seq=86625 Ack=31251 Win=131072 Len=0
182,31.0793224,151.101.130.187,172.20.40.110,TLSv1.3,5574,"Application Data, Application Data, Application Data, Application Data"
183,31.07945,172.20.40.110,151.101.130.187,TCP,54,52383  >  443 [ACK] Seq=86625 Ack=36771 Win=131072 Len=0
184,31.0819618,151.101.130.187,172.20.40.110,TLSv1.3,2814,"Application Data, Application Data"
185,31.0820657,172.20.40.110,151.101.130.187,TCP,54,52383  >  443 [ACK] Seq=86625 Ack=39531 Win=131072 Len=0
186,31.0868822,151.101.130.187,172.20.40.110,TLSv1.3,1434,Application Data
187,31.0868822,151.101.130.187,172.20.40.110,TLSv1.3,1434,Application Data
188,31.0868822,151.101.130.187,172.20.40.110,TLSv1.3,2814,"Application Data, Application Data"
189,31.0869958,172.20.40.110,151.101.130.187,TCP,54,52383  >  443 [ACK] Seq=86625 Ack=45051 Win=131072 Len=0
190,31.1036029,151.101.130.187,172.20.40.110,TLSv1.3,1434,Application Data
191,31.1036029,151.101.130.187,172.20.40.110,TLSv1.3,1434,Application Data
192,31.1036029,151.101.130.187,172.20.40.110,TLSv1.3,1434,Application Data
193,31.1037135,172.20.40.110,151.101.130.187,TCP,54,52383  >  443 [ACK] Seq=86625 Ack=49191 Win=131072 Len=0
194,31.1056525,151.101.130.187,172.20.40.110,TLSv1.3,1434,Application Data
195,31.1056525,151.101.130.187,172.20.40.110,TLSv1.3,1434,Application Data
196,31.1056525,151.101.130.187,172.20.40.110,TLSv1.3,1434,Application Data
197,31.1057831,172.20.40.110,151.101.130.187,TCP,54,52383  >  443 [ACK] Seq=86625 Ack=53331 Win=131072 Len=0
198,31.1080626,151.101.130.187,172.20.40.110,TLSv1.3,4194,"Application Data, Application Data"
199,31.1080626,151.101.130.187,172.20.40.110,TCP,60,443  >  52383 [ACK] Seq=57471 Ack=86625 Win=104448 Len=0
200,31.1080626,151.101.130.187,172.20.40.110,TLSv1.3,1434,Application Data
201,31.1081953,172.20.40.110,151.101.130.187,TCP,54,52383  >  443 [ACK] Seq=86625 Ack=58851 Win=131072 Len=0
202,31.1105454,151.101.130.187,172.20.40.110,TLSv1.3,5574,"Application Data, Application Data, Application Data, Application Data"
203,31.1106574,172.20.40.110,151.101.130.187,TCP,54,52383  >  443 [ACK] Seq=86625 Ack=64371 Win=131072 Len=0
204,31.1135426,151.101.130.187,172.20.40.110,TLSv1.3,1434,Application Data
205,31.1135426,151.101.130.187,172.20.40.110,TLSv1.3,307,"Application Data, Application Data"
206,31.1136522,172.20.40.110,151.101.130.187,TCP,54,52383  >  443 [ACK] Seq=86625 Ack=66004 Win=131072 Len=0
207,31.4212706,172.20.40.110,151.101.130.187,TLSv1.3,2873,Application Data
208,31.4248579,172.20.40.110,151.101.130.187,TLSv1.3,2869,Application Data
209,31.4295047,172.20.40.110,151.101.130.187,TLSv1.3,2867,Application Data
210,31.4314464,172.20.40.110,151.101.130.187,TLSv1.3,2884,Application Data
211,31.4334118,172.20.40.110,151.101.130.187,TLSv1.3,2867,Application Data
212,31.4339668,172.20.40.110,151.101.130.187,TLSv1.3,2865,Application Data
213,31.4389783,151.101.130.187,172.20.40.110,TCP,60,443  >  52383 [ACK] Seq=66004 Ack=89444 Win=101888 Len=0
214,31.4389783,151.101.130.187,172.20.40.110,TLSv1.3,131,Application Data
215,31.4389783,151.101.130.187,172.20.40.110,TCP,60,443  >  52383 [ACK] Seq=66081 Ack=92259 Win=102400 Len=0
216,31.4456934,151.101.130.187,172.20.40.110,TCP,60,443  >  52383 [ACK] Seq=66081 Ack=95072 Win=101888 Len=0
217,31.4456934,151.101.130.187,172.20.40.110,TLSv1.3,104,Application Data
218,31.4456934,151.101.130.187,172.20.40.110,TLSv1.3,132,Application Data
219,31.4456934,151.101.130.187,172.20.40.110,TCP,60,443  >  52383 [ACK] Seq=66209 Ack=97902 Win=101888 Len=0
220,31.4456934,151.101.130.187,172.20.40.110,TLSv1.3,125,Application Data
221,31.4458739,172.20.40.110,151.101.130.187,TCP,54,52383  >  443 [ACK] Seq=103526 Ack=66280 Win=130816 Len=0
222,31.4564177,151.101.130.187,172.20.40.110,TCP,60,443  >  52383 [ACK] Seq=66280 Ack=100715 Win=102400 Len=0
223,31.4564177,151.101.130.187,172.20.40.110,TCP,60,443  >  52383 [ACK] Seq=66280 Ack=103526 Win=99840 Len=0
224,31.4633836,151.101.130.187,172.20.40.110,TLSv1.3,130,Application Data
225,31.4633836,151.101.130.187,172.20.40.110,TLSv1.3,130,Application Data
226,31.463753,172.20.40.110,151.101.130.187,TCP,54,52383  >  443 [ACK] Seq=103526 Ack=66432 Win=130560 Len=0
227,31.4766211,172.20.40.110,151.101.130.187,TLSv1.3,2875,Application Data
228,31.4771253,172.20.40.110,151.101.130.187,TLSv1.3,2869,Application Data
229,31.4773508,172.20.40.110,151.101.130.187,TLSv1.3,2869,Application Data
230,31.5170031,151.101.130.187,172.20.40.110,TCP,60,443  >  52383 [ACK] Seq=66432 Ack=106347 Win=101888 Len=0
231,31.5170031,151.101.130.187,172.20.40.110,TCP,60,443  >  52383 [ACK] Seq=66432 Ack=109162 Win=101888 Len=0
232,31.5170031,151.101.130.187,172.20.40.110,TCP,60,443  >  52383 [ACK] Seq=66432 Ack=111977 Win=101888 Len=0
233,31.5170031,151.101.130.187,172.20.40.110,TLSv1.3,174,Application Data
234,31.5170031,151.101.130.187,172.20.40.110,TLSv1.3,296,Application Data
235,31.5170031,151.101.130.187,172.20.40.110,TLSv1.3,130,Application Data
236,31.517289,172.20.40.110,151.101.130.187,TCP,54,52383  >  443 [ACK] Seq=111977 Ack=66870 Win=130048 Len=0
237,31.5359788,172.20.40.110,151.101.130.187,TLSv1.3,2883,Application Data
238,31.5363932,172.20.40.110,151.101.130.187,TLSv1.3,2869,Application Data
239,31.5448254,151.101.130.187,172.20.40.110,TCP,60,443  >  52383 [ACK] Seq=66870 Ack=114806 Win=101888 Len=0
240,31.5458279,172.20.40.110,151.101.130.187,TLSv1.3,2877,Application Data
241,31.549537,151.101.130.187,172.20.40.110,TCP,60,443  >  52383 [ACK] Seq=66870 Ack=117621 Win=101888 Len=0
242,31.5506052,151.101.130.187,172.20.40.110,TLSv1.3,125,Application Data
243,31.5551658,151.101.130.187,172.20.40.110,TLSv1.3,130,Application Data
244,31.5551658,151.101.130.187,172.20.40.110,TCP,60,443  >  52383 [ACK] Seq=67017 Ack=120444 Win=101888 Len=0
245,31.5552834,172.20.40.110,151.101.130.187,TCP,54,52383  >  443 [ACK] Seq=120444 Ack=67017 Win=130048 Len=0
246,31.5590655,172.20.40.110,151.101.130.187,TLSv1.3,2875,Application Data
247,31.5617519,172.20.40.110,151.101.130.187,TLSv1.3,2872,Application Data
248,31.5647584,151.101.130.187,172.20.40.110,TLSv1.3,124,Application Data
249,31.5675352,151.101.130.187,172.20.40.110,TCP,60,443  >  52383 [ACK] Seq=67087 Ack=123265 Win=101888 Len=0
250,31.5720295,151.101.130.187,172.20.40.110,TCP,60,443  >  52383 [ACK] Seq=67087 Ack=126083 Win=101888 Len=0
251,31.5720295,151.101.130.187,172.20.40.110,TLSv1.3,154,Application Data
252,31.5721448,172.20.40.110,151.101.130.187,TCP,54,52383  >  443 [ACK] Seq=126083 Ack=67187 Win=129792 Len=0
253,31.5744024,151.101.130.187,172.20.40.110,TLSv1.3,217,Application Data
254,31.6183061,172.20.40.110,151.101.130.187,TLSv1.3,2873,Application Data
255,31.6195376,172.20.40.110,151.101.130.187,TLSv1.3,2888,Application Data
256,31.6214781,172.20.40.110,151.101.130.187,TLSv1.3,2883,Application Data
257,31.6318071,151.101.130.187,172.20.40.110,TCP,60,443  >  52383 [ACK] Seq=67350 Ack=128902 Win=101888 Len=0
258,31.6318071,151.101.130.187,172.20.40.110,TCP,60,443  >  52383 [ACK] Seq=67350 Ack=131736 Win=101888 Len=0
259,31.6318071,151.101.130.187,172.20.40.110,TLSv1.3,240,Application Data
260,31.6320135,172.20.40.110,151.101.130.187,TCP,54,52383  >  443 [ACK] Seq=134565 Ack=67536 Win=131072 Len=0
261,31.6331819,151.101.130.187,172.20.40.110,TCP,60,443  >  52383 [ACK] Seq=67536 Ack=134565 Win=101888 Len=0
262,31.6353837,151.101.130.187,172.20.40.110,TLSv1.3,125,Application Data
263,31.6354509,172.20.40.110,151.101.130.187,TCP,54,52383  >  443 [ACK] Seq=134565 Ack=67607 Win=130816 Len=0
264,31.6396216,151.101.130.187,172.20.40.110,TLSv1.3,130,Application Data
265,31.6926026,172.20.40.110,151.101.130.187,TCP,54,52383  >  443 [ACK] Seq=134565 Ack=67683 Win=130816 Len=0
266,31.6985556,151.101.130.187,172.20.40.110,TCP,130,"[TCP Spurious Retransmission] 443  >  52383 [PSH, ACK] Seq=67607 Ack=134565 Win=104448 Len=76"
267,31.6986105,172.20.40.110,151.101.130.187,TCP,66,[TCP Dup ACK 265#1] 52383  >  443 [ACK] Seq=134565 Ack=67683 Win=130816 Len=0 SLE=67607 SRE=67683
268,31.7030707,172.20.40.110,151.101.130.187,TLSv1.3,2867,Application Data
269,31.7120428,151.101.130.187,172.20.40.110,TCP,60,443  >  52383 [ACK] Seq=67683 Ack=137378 Win=101888 Len=0
270,31.716378,151.101.130.187,172.20.40.110,TLSv1.3,124,Application Data
271,31.7577162,172.20.40.110,151.101.130.187,TCP,54,52383  >  443 [ACK] Seq=137378 Ack=67753 Win=130816 Len=0
272,32.2229541,151.101.2.187,172.20.40.110,TCP,129,"[TCP Retransmission] 443  >  65401 [FIN, PSH, ACK] Seq=1 Ack=1 Win=198 Len=75"
273,33.5722744,172.20.40.110,151.101.130.187,TLSv1.3,2879,Application Data
274,33.5725299,172.20.40.110,151.101.130.187,TLSv1.3,2873,Application Data
275,33.5941062,151.101.130.187,172.20.40.110,TCP,60,443  >  52383 [ACK] Seq=67753 Ack=140203 Win=101888 Len=0
276,33.5941062,151.101.130.187,172.20.40.110,TCP,60,443  >  52383 [ACK] Seq=67753 Ack=143022 Win=102400 Len=0
277,33.5944009,151.101.130.187,172.20.40.110,TLSv1.3,214,Application Data
278,33.5987054,151.101.130.187,172.20.40.110,TLSv1.3,258,Application Data
279,33.5988056,172.20.40.110,151.101.130.187,TCP,54,52383  >  443 [ACK] Seq=143022 Ack=68117 Win=130304 Len=0
280,33.8652337,172.20.40.110,151.101.130.187,TLSv1.3,2871,Application Data
281,33.8665511,172.20.40.110,151.101.130.187,TLSv1.3,2867,Application Data
282,33.8758829,151.101.130.187,172.20.40.110,TCP,60,443  >  52383 [ACK] Seq=68117 Ack=145839 Win=101888 Len=0
283,33.8787289,151.101.130.187,172.20.40.110,TLSv1.3,296,Application Data
284,33.8849526,151.101.130.187,172.20.40.110,TCP,60,443  >  52383 [ACK] Seq=68359 Ack=148652 Win=101888 Len=0
285,33.8893475,151.101.130.187,172.20.40.110,TLSv1.3,131,Application Data
286,33.8894232,172.20.40.110,151.101.130.187,TCP,54,52383  >  443 [ACK] Seq=148652 Ack=68436 Win=130048 Len=0
287,34.6590807,172.20.40.110,151.101.130.187,TLSv1.3,2870,Application Data
288,34.6721853,151.101.130.187,172.20.40.110,TCP,60,443  >  52383 [ACK] Seq=68436 Ack=151468 Win=110080 Len=0
289,34.6764645,151.101.130.187,172.20.40.110,TLSv1.3,240,Application Data
290,34.7250539,172.20.40.110,151.101.130.187,TCP,54,52383  >  443 [ACK] Seq=151468 Ack=68622 Win=129792 Len=0
291,34.7355413,151.101.130.187,172.20.40.110,TCP,240,"[TCP Spurious Retransmission] 443  >  52383 [PSH, ACK] Seq=68436 Ack=151468 Win=110080 Len=186"
292,34.7356212,172.20.40.110,151.101.130.187,TCP,66,[TCP Dup ACK 290#1] 52383  >  443 [ACK] Seq=151468 Ack=68622 Win=129792 Len=0 SLE=68436 SRE=68622
293,35.1039654,172.20.40.110,151.101.130.187,TLSv1.3,2866,Application Data
294,35.1143987,151.101.130.187,172.20.40.110,TCP,60,443  >  52383 [ACK] Seq=68622 Ack=154280 Win=115712 Len=0
295,35.1149703,172.20.40.110,151.101.130.187,TLSv1.3,2866,Application Data
296,35.1227274,151.101.130.187,172.20.40.110,TLSv1.3,125,Application Data
297,35.1293334,151.101.130.187,172.20.40.110,TCP,60,443  >  52383 [ACK] Seq=68693 Ack=157092 Win=121344 Len=0
298,35.1324929,151.101.130.187,172.20.40.110,TLSv1.3,130,Application Data
299,35.1326052,172.20.40.110,151.101.130.187,TCP,54,52383  >  443 [ACK] Seq=157092 Ack=68769 Win=129792 Len=0
300,35.1775331,172.20.40.110,151.101.130.187,TLSv1.3,2884,Application Data
301,35.1932612,151.101.130.187,172.20.40.110,TCP,60,443  >  52383 [ACK] Seq=68769 Ack=159922 Win=126976 Len=0
302,35.1949978,151.101.130.187,172.20.40.110,TLSv1.3,98,Application Data
303,35.2352755,172.20.40.110,151.101.130.187,TCP,54,52383  >  443 [ACK] Seq=159922 Ack=68813 Win=129792 Len=0
304,35.4045551,172.20.40.110,151.101.130.187,TLSv1.3,2877,Application Data
305,35.4155982,151.101.130.187,172.20.40.110,TCP,60,443  >  52383 [ACK] Seq=68813 Ack=162745 Win=132608 Len=0
306,35.4217317,151.101.130.187,172.20.40.110,TLSv1.3,130,Application Data
307,35.4656033,172.20.40.110,151.101.130.187,TCP,54,52383  >  443 [ACK] Seq=162745 Ack=68889 Win=129536 Len=0
308,35.6187583,172.20.40.110,151.101.130.187,TLSv1.3,2872,Application Data
309,35.6194516,172.20.40.110,151.101.130.187,TLSv1.3,2871,Application Data
310,35.6198556,172.20.40.110,151.101.130.187,TLSv1.3,2868,Application Data
311,35.6427977,151.101.130.187,172.20.40.110,TCP,60,443  >  52383 [ACK] Seq=68889 Ack=165563 Win=138240 Len=0
312,35.6427977,151.101.130.187,172.20.40.110,TCP,60,443  >  52383 [ACK] Seq=68889 Ack=168380 Win=143872 Len=0
313,35.6427977,151.101.130.187,172.20.40.110,TCP,60,443  >  52383 [ACK] Seq=68889 Ack=171194 Win=149504 Len=0
314,35.6475963,151.101.130.187,172.20.40.110,TLSv1.3,240,Application Data
315,35.6475963,151.101.130.187,172.20.40.110,TLSv1.3,179,Application Data
316,35.6477766,172.20.40.110,151.101.130.187,TCP,54,52383  >  443 [ACK] Seq=171194 Ack=69200 Win=131072 Len=0
317,35.7153007,172.20.40.110,151.101.130.187,TLSv1.3,2869,Application Data
318,35.7271419,151.101.130.187,172.20.40.110,TCP,60,443  >  52383 [ACK] Seq=69200 Ack=174009 Win=155136 Len=0
319,35.7271419,151.101.130.187,172.20.40.110,TLSv1.3,130,Application Data
320,35.7823018,172.20.40.110,151.101.130.187,TLSv1.3,2875,Application Data
321,35.7848309,172.20.40.110,151.101.130.187,TLSv1.3,2869,Application Data
322,35.7946538,151.101.130.187,172.20.40.110,TCP,130,"[TCP Spurious Retransmission] 443  >  52383 [PSH, ACK] Seq=69200 Ack=174009 Win=155136 Len=76"
323,35.7947091,172.20.40.110,151.101.130.187,TCP,66,[TCP Dup ACK 320#1] 52383  >  443 [ACK] Seq=179645 Ack=69276 Win=130816 Len=0 SLE=69200 SRE=69276
324,35.7982228,151.101.130.187,172.20.40.110,TCP,60,443  >  52383 [ACK] Seq=69276 Ack=176830 Win=160768 Len=0
325,35.7982228,151.101.130.187,172.20.40.110,TCP,60,443  >  52383 [ACK] Seq=69276 Ack=179645 Win=166400 Len=0
326,35.8029741,151.101.130.187,172.20.40.110,TLSv1.3,175,Application Data
327,35.805662,151.101.130.187,172.20.40.110,TLSv1.3,124,Application Data
328,35.8057409,172.20.40.110,151.101.130.187,TCP,54,52383  >  443 [ACK] Seq=179645 Ack=69467 Win=130816 Len=0
329,36.8375691,172.20.40.110,151.101.130.187,TLSv1.3,2887,Application Data
330,36.8580151,151.101.130.187,172.20.40.110,TCP,60,443  >  52383 [ACK] Seq=69467 Ack=182478 Win=172032 Len=0
331,36.8670371,151.101.130.187,172.20.40.110,TLSv1.3,407,Application Data
332,36.9171137,172.20.40.110,151.101.130.187,TCP,54,52383  >  443 [ACK] Seq=182478 Ack=69820 Win=130304 Len=0
333,36.9236861,151.101.130.187,172.20.40.110,TCP,407,"[TCP Spurious Retransmission] 443  >  52383 [PSH, ACK] Seq=69467 Ack=182478 Win=172032 Len=353"
334,36.9237619,172.20.40.110,151.101.130.187,TCP,66,[TCP Dup ACK 332#1] 52383  >  443 [ACK] Seq=182478 Ack=69820 Win=130304 Len=0 SLE=69467 SRE=69820
335,37.4189834,172.20.40.110,151.101.130.187,TLSv1.3,2875,Application Data
336,37.4317786,172.20.40.110,151.101.130.187,TLSv1.3,2877,Application Data
337,37.4585706,172.20.40.110,151.101.130.187,TLSv1.3,2871,Application Data
338,37.4602913,172.20.40.110,151.101.130.187,TLSv1.3,2871,Application Data
339,37.461759,172.20.40.110,151.101.130.187,TCP,1434,"[TCP Retransmission] 52383  >  443 [PSH, ACK] Seq=192376 Ack=69820 Win=130304 Len=1380"
340,37.4668819,172.20.40.110,151.101.130.187,TLSv1.3,2869,Application Data
341,37.4683071,172.20.40.110,151.101.130.187,TLSv1.3,2888,Application Data
342,37.4691983,172.20.40.110,151.101.130.187,TLSv1.3,2873,Application Data
343,37.4721359,172.20.40.110,151.101.130.187,TLSv1.3,2881,Application Data
344,37.4731749,172.20.40.110,151.101.130.187,TLSv1.3,2879,Application Data
345,37.4742545,172.20.40.110,151.101.130.187,TLSv1.3,2870,Application Data
346,37.4756889,172.20.40.110,151.101.130.187,TLSv1.3,2881,Application Data
347,37.4779038,172.20.40.110,151.101.130.187,TLSv1.3,2873,Application Data
348,37.4792019,172.20.40.110,151.101.130.187,TLSv1.3,2874,Application Data
349,37.4800302,172.20.40.110,151.101.130.187,TLSv1.3,2876,Application Data
350,37.485938,151.101.130.187,172.20.40.110,TCP,60,443  >  52383 [ACK] Seq=69820 Ack=185299 Win=177664 Len=0
351,37.485938,151.101.130.187,172.20.40.110,TLSv1.3,129,Application Data
352,37.4865403,172.20.40.110,151.101.130.187,TLSv1.3,2870,Application Data
353,37.4889685,172.20.40.110,151.101.130.187,TLSv1.3,2875,Application Data
354,37.4892193,172.20.40.110,151.101.130.187,TLSv1.3,2872,Application Data
355,37.4894047,172.20.40.110,151.101.130.187,TLSv1.3,2887,Application Data
356,37.4895623,172.20.40.110,151.101.130.187,TLSv1.3,2871,Application Data
357,37.5292892,151.101.130.187,172.20.40.110,TCP,60,443  >  52383 [ACK] Seq=69895 Ack=186679 Win=180736 Len=0
358,37.5339565,172.20.40.110,151.101.130.187,TLSv1.3,2871,Application Data
359,37.540807,151.101.130.187,172.20.40.110,TCP,129,"[TCP Spurious Retransmission] 443  >  52383 [PSH, ACK] Seq=69820 Ack=186679 Win=180736 Len=75"
360,37.5409941,172.20.40.110,151.101.130.187,TCP,66,[TCP Dup ACK 352#1] 52383  >  443 [ACK] Seq=238902 Ack=69895 Win=130304 Len=0 SLE=69820 SRE=69895
361,37.5877684,151.101.130.187,172.20.40.110,TCP,66,[TCP Dup ACK 357#1] 443  >  52383 [ACK] Seq=69895 Ack=186679 Win=180736 Len=0 SLE=188059 SRE=188122
362,37.5877684,151.101.130.187,172.20.40.110,TCP,66,[TCP Dup ACK 357#2] 443  >  52383 [ACK] Seq=69895 Ack=186679 Win=186368 Len=0 SLE=188059 SRE=190939
363,37.5877684,151.101.130.187,172.20.40.110,TCP,66,[TCP Dup ACK 357#3] 443  >  52383 [ACK] Seq=69895 Ack=186679 Win=192000 Len=0 SLE=188059 SRE=193756
364,37.5878382,172.20.40.110,151.101.130.187,TCP,1434,[TCP Fast Retransmission] 52383  >  443 [ACK] Seq=186679 Ack=69895 Win=130304 Len=1380
365,37.6209105,172.20.40.110,151.101.130.187,TCP,1434,52383  >  443 [ACK] Seq=238902 Ack=69895 Win=130304 Len=1380 [TCP PDU reassembled in 367]
366,37.6209105,172.20.40.110,151.101.130.187,TCP,1434,52383  >  443 [ACK] Seq=240282 Ack=69895 Win=130304 Len=1380 [TCP PDU reassembled in 367]
367,37.6209105,172.20.40.110,151.101.130.187,TLSv1.3,108,Application Data
368,37.6237717,172.20.40.110,151.101.130.187,TCP,1434,52383  >  443 [ACK] Seq=241716 Ack=69895 Win=130304 Len=1380 [TCP PDU reassembled in 370]
369,37.6237717,172.20.40.110,151.101.130.187,TCP,1434,52383  >  443 [ACK] Seq=243096 Ack=69895 Win=130304 Len=1380 [TCP PDU reassembled in 370]
370,37.6237717,172.20.40.110,151.101.130.187,TLSv1.3,106,Application Data
371,37.6240816,172.20.40.110,151.101.130.187,TCP,1434,52383  >  443 [ACK] Seq=244528 Ack=69895 Win=130304 Len=1380 [TCP PDU reassembled in 373]
372,37.6240816,172.20.40.110,151.101.130.187,TCP,1434,52383  >  443 [ACK] Seq=245908 Ack=69895 Win=130304 Len=1380 [TCP PDU reassembled in 373]
373,37.6240816,172.20.40.110,151.101.130.187,TLSv1.3,111,Application Data
374,37.7314619,151.101.130.187,172.20.40.110,TCP,66,[TCP Dup ACK 357#4] 443  >  52383 [ACK] Seq=69895 Ack=186679 Win=197632 Len=0 SLE=188059 SRE=196571
375,37.7314619,151.101.130.187,172.20.40.110,TCP,66,[TCP Dup ACK 357#5] 443  >  52383 [ACK] Seq=69895 Ack=186679 Win=203264 Len=0 SLE=188059 SRE=199405
376,37.7314619,151.101.130.187,172.20.40.110,TCP,66,[TCP Dup ACK 357#6] 443  >  52383 [ACK] Seq=69895 Ack=186679 Win=208896 Len=0 SLE=188059 SRE=202224
377,37.7314619,151.101.130.187,172.20.40.110,TCP,66,[TCP Dup ACK 357#7] 443  >  52383 [ACK] Seq=69895 Ack=186679 Win=214528 Len=0 SLE=188059 SRE=205051
378,37.7314619,151.101.130.187,172.20.40.110,TCP,66,[TCP Dup ACK 357#8] 443  >  52383 [ACK] Seq=69895 Ack=186679 Win=220160 Len=0 SLE=188059 SRE=207876
379,37.7314619,151.101.130.187,172.20.40.110,TCP,66,[TCP Dup ACK 357#9] 443  >  52383 [ACK] Seq=69895 Ack=186679 Win=223232 Len=0 SLE=188059 SRE=209256
380,37.7314619,151.101.130.187,172.20.40.110,TCP,66,[TCP Dup ACK 357#10] 443  >  52383 [ACK] Seq=69895 Ack=186679 Win=226304 Len=0 SLE=188059 SRE=210692
381,37.7314619,151.101.130.187,172.20.40.110,TCP,66,[TCP Dup ACK 357#11] 443  >  52383 [ACK] Seq=69895 Ack=186679 Win=231936 Len=0 SLE=188059 SRE=213519
382,37.7314619,151.101.130.187,172.20.40.110,TCP,66,[TCP Dup ACK 357#12] 443  >  52383 [ACK] Seq=69895 Ack=186679 Win=237568 Len=0 SLE=188059 SRE=216338
383,37.7314619,151.101.130.187,172.20.40.110,TCP,66,[TCP Dup ACK 357#13] 443  >  52383 [ACK] Seq=69895 Ack=186679 Win=243200 Len=0 SLE=188059 SRE=219158
384,37.7314619,151.101.130.187,172.20.40.110,TCP,66,[TCP Dup ACK 357#14] 443  >  52383 [ACK] Seq=69895 Ack=186679 Win=248832 Len=0 SLE=188059 SRE=221980
385,37.7314619,151.101.130.187,172.20.40.110,TCP,66,[TCP Dup ACK 357#15] 443  >  52383 [ACK] Seq=69895 Ack=186679 Win=254464 Len=0 SLE=188059 SRE=224796
386,37.7314619,151.101.130.187,172.20.40.110,TCP,66,[TCP Dup ACK 357#16] 443  >  52383 [ACK] Seq=69895 Ack=186679 Win=260096 Len=0 SLE=188059 SRE=227617
387,37.7314619,151.101.130.187,172.20.40.110,TCP,66,[TCP Dup ACK 357#17] 443  >  52383 [ACK] Seq=69895 Ack=186679 Win=265728 Len=0 SLE=188059 SRE=230435
388,37.7314619,151.101.130.187,172.20.40.110,TCP,66,[TCP Dup ACK 357#18] 443  >  52383 [ACK] Seq=69895 Ack=186679 Win=268288 Len=0 SLE=188059 SRE=231815
389,37.7314619,151.101.130.187,172.20.40.110,TCP,66,[TCP Dup ACK 357#19] 443  >  52383 [ACK] Seq=69895 Ack=186679 Win=271360 Len=0 SLE=188059 SRE=233268
390,37.7826402,172.20.40.110,151.101.130.187,TCP,1434,52383  >  443 [ACK] Seq=247345 Ack=69895 Win=130304 Len=1380 [TCP PDU reassembled in 392]
391,37.7826402,172.20.40.110,151.101.130.187,TCP,1434,52383  >  443 [ACK] Seq=248725 Ack=69895 Win=130304 Len=1380 [TCP PDU reassembled in 392]
392,37.7826402,172.20.40.110,151.101.130.187,TLSv1.3,113,Application Data
393,37.871185,151.101.130.187,172.20.40.110,TCP,66,[TCP Dup ACK 357#20] 443  >  52383 [ACK] Seq=69895 Ack=186679 Win=276992 Len=0 SLE=188059 SRE=236085
394,37.871185,151.101.130.187,172.20.40.110,TCP,66,[TCP Dup ACK 357#21] 443  >  52383 [ACK] Seq=69895 Ack=186679 Win=282624 Len=0 SLE=188059 SRE=238902
395,37.871185,151.101.130.187,172.20.40.110,TCP,60,443  >  52383 [ACK] Seq=69895 Ack=238902 Win=285696 Len=0
396,37.871185,151.101.130.187,172.20.40.110,TCP,60,443  >  52383 [ACK] Seq=69895 Ack=240282 Win=288768 Len=0
397,37.8804546,151.101.130.187,172.20.40.110,TLSv1.3,240,Application Data
398,37.8804546,151.101.130.187,172.20.40.110,TLSv1.3,125,Application Data
399,37.8804546,151.101.130.187,172.20.40.110,TLSv1.3,130,Application Data
400,37.8806545,172.20.40.110,151.101.130.187,TCP,54,52383  >  443 [ACK] Seq=250164 Ack=70228 Win=130048 Len=0
401,37.8832563,151.101.130.187,172.20.40.110,TLSv1.3,131,Application Data
402,37.8832563,151.101.130.187,172.20.40.110,TLSv1.3,206,"Application Data, Application Data"
403,37.8832563,151.101.130.187,172.20.40.110,TLSv1.3,126,Application Data
404,37.8832563,151.101.130.187,172.20.40.110,TLSv1.3,131,Application Data
405,37.8832563,151.101.130.187,172.20.40.110,TLSv1.3,169,Application Data
406,37.8832563,151.101.130.187,172.20.40.110,TLSv1.3,131,Application Data
407,37.8832563,151.101.130.187,172.20.40.110,TLSv1.3,135,Application Data
408,37.8832563,151.101.130.187,172.20.40.110,TLSv1.3,292,Application Data
409,37.8832563,151.101.130.187,172.20.40.110,TLSv1.3,178,Application Data
410,37.8832563,151.101.130.187,172.20.40.110,TLSv1.3,240,Application Data
411,37.8832563,151.101.130.187,172.20.40.110,TLSv1.3,124,Application Data
412,37.8832563,151.101.130.187,172.20.40.110,TLSv1.3,130,Application Data
413,37.8832563,151.101.130.187,172.20.40.110,TLSv1.3,124,Application Data
414,37.8832563,151.101.130.187,172.20.40.110,TLSv1.3,130,Application Data
415,37.8832563,151.101.130.187,172.20.40.110,TCP,66,[TCP Dup ACK 396#1] 443  >  52383 [ACK] Seq=71719 Ack=240282 Win=288768 Len=0 SLE=241662 SRE=241716
416,37.8832563,151.101.130.187,172.20.40.110,TCP,66,[TCP Dup ACK 396#2] 443  >  52383 [ACK] Seq=71719 Ack=240282 Win=294400 Len=0 SLE=241662 SRE=244528
417,37.8832563,151.101.130.187,172.20.40.110,TCP,66,[TCP Dup ACK 396#3] 443  >  52383 [ACK] Seq=71719 Ack=240282 Win=296960 Len=0 SLE=241662 SRE=245908
418,37.8832563,151.101.130.187,172.20.40.110,TCP,142,"[TCP Retransmission] 443  >  52383 [PSH, ACK] Seq=71643 Ack=240282 Win=296960 Len=76 SLE=241662 SRE=245908"
419,37.8834719,172.20.40.110,151.101.130.187,TCP,54,52383  >  443 [ACK] Seq=250164 Ack=71719 Win=131072 Len=0
420,37.8837183,172.20.40.110,151.101.130.187,TCP,1434,[TCP Fast Retransmission] 52383  >  443 [ACK] Seq=240282 Ack=71719 Win=131072 Len=1380 [TCP PDU reassembled in 367]
421,37.8838438,172.20.40.110,151.101.130.187,TCP,66,[TCP Dup ACK 419#1] 52383  >  443 [ACK] Seq=250164 Ack=71719 Win=131072 Len=0 SLE=71643 SRE=71719
422,37.8839962,151.101.130.187,172.20.40.110,TCP,66,[TCP Dup ACK 396#4] 443  >  52383 [ACK] Seq=71719 Ack=240282 Win=303104 Len=0 SLE=241662 SRE=248725
423,37.8913454,151.101.130.187,172.20.40.110,TCP,66,[TCP Dup ACK 396#5] 443  >  52383 [ACK] Seq=71719 Ack=240282 Win=305664 Len=0 SLE=241662 SRE=250164
424,37.8929628,151.101.130.187,172.20.40.110,TCP,60,443  >  52383 [ACK] Seq=71719 Ack=250164 Win=308736 Len=0
425,37.9176215,151.101.130.187,172.20.40.110,TLSv1.3,206,"Application Data, Application Data"
426,37.9176215,151.101.130.187,172.20.40.110,TLSv1.3,131,Application Data
427,37.9176215,151.101.130.187,172.20.40.110,TLSv1.3,175,Application Data
428,37.9177383,172.20.40.110,151.101.130.187,TCP,54,52383  >  443 [ACK] Seq=250164 Ack=72069 Win=130560 Len=0
429,41.5778707,172.20.40.110,151.101.130.187,TLSv1.3,2882,Application Data
430,41.5875062,172.20.40.110,151.101.130.187,TLSv1.3,2880,Application Data
431,41.6082366,151.101.130.187,172.20.40.110,TCP,60,443  >  52383 [ACK] Seq=72069 Ack=252992 Win=314368 Len=0
432,41.6082366,151.101.130.187,172.20.40.110,TLSv1.3,246,Application Data
433,41.6082366,151.101.130.187,172.20.40.110,TCP,60,443  >  52383 [ACK] Seq=72261 Ack=255818 Win=320000 Len=0
434,41.6093418,151.101.130.187,172.20.40.110,TLSv1.3,402,Application Data
435,41.609398,172.20.40.110,151.101.130.187,TCP,54,52383  >  443 [ACK] Seq=255818 Ack=72609 Win=130048 Len=0
436,41.6210205,172.20.40.110,151.101.130.187,TLSv1.3,2883,Application Data
437,41.635049,151.101.130.187,172.20.40.110,TCP,60,443  >  52383 [ACK] Seq=72609 Ack=258647 Win=325632 Len=0
438,41.6378266,151.101.130.187,172.20.40.110,TLSv1.3,125,Application Data
439,41.6914899,172.20.40.110,151.101.130.187,TCP,54,52383  >  443 [ACK] Seq=258647 Ack=72680 Win=130048 Len=0
440,42.0421674,172.20.40.110,151.101.130.187,TLSv1.3,2868,Application Data
441,42.0570286,151.101.130.187,172.20.40.110,TCP,60,443  >  52383 [ACK] Seq=72680 Ack=261461 Win=331264 Len=0
442,42.0673238,151.101.130.187,172.20.40.110,TLSv1.3,104,Application Data
443,42.1152531,172.20.40.110,151.101.130.187,TCP,54,52383  >  443 [ACK] Seq=261461 Ack=72730 Win=130048 Len=0
444,42.207974,172.20.40.110,151.101.130.187,TLSv1.3,2871,Application Data
445,42.2216192,151.101.130.187,172.20.40.110,TCP,60,443  >  52383 [ACK] Seq=72730 Ack=264278 Win=336896 Len=0
446,42.2217389,172.20.40.110,151.101.130.187,TLSv1.3,2873,Application Data
447,42.2282518,151.101.130.187,172.20.40.110,TLSv1.3,130,Application Data
448,42.2346827,151.101.130.187,172.20.40.110,TCP,60,443  >  52383 [ACK] Seq=72806 Ack=267097 Win=342528 Len=0
449,42.2391779,151.101.130.187,172.20.40.110,TLSv1.3,130,Application Data
450,42.2392992,172.20.40.110,151.101.130.187,TCP,54,52383  >  443 [ACK] Seq=267097 Ack=72882 Win=129792 Len=0
451,42.8130206,172.20.40.110,151.101.130.187,TCP,54,"52383  >  443 [FIN, ACK] Seq=267097 Ack=72882 Win=129792 Len=0"
452,43.4893319,172.20.40.110,151.101.130.187,TCP,54,"[TCP Retransmission] 52383  >  443 [FIN, ACK] Seq=267097 Ack=72882 Win=129792 Len=0"
453,44.7306933,172.20.40.110,151.101.130.187,TCP,54,"[TCP Retransmission] 52383  >  443 [FIN, ACK] Seq=267097 Ack=72882 Win=129792 Len=0"
454,47.2011879,172.20.40.110,151.101.130.187,TCP,54,"[TCP Retransmission] 52383  >  443 [FIN, ACK] Seq=267097 Ack=72882 Win=129792 Len=0"
455,47.7581236,151.101.130.187,172.20.40.110,TCP,60,"[TCP Previous segment not captured] 443  >  52383 [FIN, ACK] Seq=72906 Ack=267098 Win=342528 Len=0"
456,47.7591958,172.20.40.110,151.101.130.187,TCP,54,[TCP Dup ACK 450#1] 52383  >  443 [ACK] Seq=267098 Ack=72882 Win=129792 Len=0
457,47.7597769,151.101.130.187,172.20.40.110,TCP,66,[TCP Dup ACK 455#1] 443  >  52383 [ACK] Seq=72907 Ack=267098 Win=342528 Len=0 SLE=267097 SRE=267098
458,48.0010097,151.101.130.187,172.20.40.110,TCP,78,"[TCP Retransmission] 443  >  52383 [FIN, PSH, ACK] Seq=72882 Ack=267098 Win=342528 Len=24"
459,48.001147,172.20.40.110,151.101.130.187,TCP,54,"52383  >  443 [RST, ACK] Seq=267098 Ack=72906 Win=0 Len=0"
460,52.8501321,172.20.40.110,151.101.130.187,TCP,66,59702  >  443 [SYN] Seq=0 Win=64240 Len=0 MSS=1460 WS=256 SACK_PERM
461,52.8577322,151.101.130.187,172.20.40.110,TCP,66,"443  >  59702 [SYN, ACK] Seq=0 Ack=1 Win=65535 Len=0 MSS=1380 SACK_PERM WS=512"
462,52.8578866,172.20.40.110,151.101.130.187,TCP,54,59702  >  443 [ACK] Seq=1 Ack=1 Win=66048 Len=0
463,52.8594703,172.20.40.110,151.101.130.187,TLSv1.3,2065,Client Hello (SNI=www.target.com)
464,52.8743216,151.101.130.187,172.20.40.110,TCP,60,443  >  59702 [ACK] Seq=1 Ack=2012 Win=144384 Len=0
465,52.8743216,151.101.130.187,172.20.40.110,TLSv1.3,1434,"Server Hello, Change Cipher Spec, Application Data, Application Data"
466,52.8743216,151.101.130.187,172.20.40.110,TLSv1.3,215,Application Data
467,52.8744444,172.20.40.110,151.101.130.187,TCP,54,59702  >  443 [ACK] Seq=2012 Ack=1542 Win=66048 Len=0
468,52.8753116,172.20.40.110,151.101.130.187,TLSv1.3,118,"Change Cipher Spec, Application Data"
469,52.8756551,172.20.40.110,151.101.130.187,TLSv1.3,146,Application Data
470,52.8759682,172.20.40.110,151.101.130.187,TLSv1.3,2640,Application Data
471,52.9037854,151.101.130.187,172.20.40.110,TCP,60,443  >  59702 [ACK] Seq=1542 Ack=2076 Win=144384 Len=0
472,52.9069886,151.101.130.187,172.20.40.110,TCP,60,443  >  59702 [ACK] Seq=1542 Ack=2168 Win=144384 Len=0
473,52.9069886,151.101.130.187,172.20.40.110,TLSv1.3,119,Application Data
474,52.90743,172.20.40.110,151.101.130.187,TLSv1.3,85,Application Data
475,52.9130449,151.101.130.187,172.20.40.110,TCP,60,443  >  59702 [ACK] Seq=1607 Ack=4754 Win=141824 Len=0
476,52.9167079,151.101.130.187,172.20.40.110,TCP,60,443  >  59702 [ACK] Seq=1607 Ack=4785 Win=141824 Len=0
477,53.3135566,151.101.130.187,172.20.40.110,TLSv1.3,499,Application Data
478,53.3135566,151.101.130.187,172.20.40.110,TLSv1.3,357,Application Data
479,53.3136741,172.20.40.110,151.101.130.187,TCP,54,59702  >  443 [ACK] Seq=4785 Ack=2355 Win=65280 Len=0
