No.,Time,Source,Destination,Protocol,Length,Info
1,0.0,172.20.40.110,151.101.66.187,TLSv1.2,2861,Application Data
2,0.0004101,172.20.40.110,151.101.66.187,TLSv1.2,93,Application Data
3,0.0180796,151.101.66.187,172.20.40.110,TCP,60,443  >  57039 [ACK] Seq=1 Ack=2808 Win=4355 Len=0
4,0.0180796,151.101.66.187,172.20.40.110,TCP,60,443  >  57039 [ACK] Seq=1 Ack=2847 Win=4355 Len=0
5,0.0201773,151.101.66.187,172.20.40.110,TLSv1.2,93,Application Data
6,0.0222298,151.101.66.187,172.20.40.110,TLSv1.2,241,Application Data
7,0.0223117,172.20.40.110,151.101.66.187,TCP,54,57039  >  443 [ACK] Seq=2847 Ack=227 Win=515 Len=0
8,2.2738561,172.20.40.110,151.101.66.187,TLSv1.2,2861,Application Data
9,2.2839028,151.101.66.187,172.20.40.110,TCP,60,443  >  57039 [ACK] Seq=227 Ack=5654 Win=4355 Len=0
10,2.2867703,151.101.66.187,172.20.40.110,TLSv1.2,214,Application Data
11,2.318559,151.101.66.187,172.20.40.110,TCP,214,"[TCP Retransmission] 443  >  57039 [PSH, ACK] Seq=227 Ack=5654 Win=4355 Len=160"
12,2.3186173,172.20.40.110,151.101.66.187,TCP,66,57039  >  443 [ACK] Seq=5654 Ack=387 Win=514 Len=0 SLE=227 SRE=387
13,5.1336672,172.20.40.110,151.101.66.187,TLSv1.2,2861,Application Data
14,5.1481082,151.101.66.187,172.20.40.110,TCP,60,443  >  57039 [ACK] Seq=387 Ack=8461 Win=4355 Len=0
15,5.1505404,151.101.66.187,172.20.40.110,TLSv1.2,214,Application Data
16,5.1840965,151.101.66.187,172.20.40.110,TCP,214,"[TCP Retransmission] 443  >  57039 [PSH, ACK] Seq=387 Ack=8461 Win=4355 Len=160"
17,5.1842487,172.20.40.110,151.101.66.187,TCP,66,57039  >  443 [ACK] Seq=8461 Ack=547 Win=514 Len=0 SLE=387 SRE=547
18,8.0954331,172.20.40.110,151.101.66.187,TLSv1.2,2825,Application Data
19,8.1053909,151.101.66.187,172.20.40.110,TCP,60,443  >  57039 [ACK] Seq=547 Ack=11232 Win=4355 Len=0
20,8.107442,172.20.40.110,151.101.66.187,TLSv1.2,2821,Application Data
21,8.1088633,172.20.40.110,151.101.66.187,TLSv1.2,2823,Application Data
22,8.1099527,151.101.66.187,172.20.40.110,TLSv1.2,245,Application Data
23,8.1099893,172.20.40.110,151.101.66.187,TLSv1.2,2827,Application Data
24,8.1165288,151.101.66.187,172.20.40.110,TCP,60,443  >  57039 [ACK] Seq=738 Ack=13999 Win=4355 Len=0
25,8.1198463,151.101.66.187,172.20.40.110,TLSv1.2,176,Application Data
26,8.1219518,151.101.66.187,172.20.40.110,TCP,60,443  >  57039 [ACK] Seq=860 Ack=16768 Win=4355 Len=0
27,8.1219518,151.101.66.187,172.20.40.110,TCP,60,443  >  57039 [ACK] Seq=860 Ack=19541 Win=4355 Len=0
28,8.1227842,172.20.40.110,151.101.66.187,TCP,54,57039  >  443 [ACK] Seq=19541 Ack=860 Win=512 Len=0
29,8.1252255,151.101.66.187,172.20.40.110,TLSv1.2,263,Application Data
30,8.1252255,151.101.66.187,172.20.40.110,TLSv1.2,130,Application Data
31,8.1253215,172.20.40.110,151.101.66.187,TCP,54,57039  >  443 [ACK] Seq=19541 Ack=1145 Win=517 Len=0
32,8.2400819,172.20.40.110,151.101.66.187,TLSv1.2,2823,Application Data
33,8.2540783,151.101.66.187,172.20.40.110,TCP,60,443  >  57039 [ACK] Seq=1145 Ack=22310 Win=4360 Len=0
34,8.2567588,151.101.66.187,172.20.40.110,TLSv1.2,98,Application Data
35,8.2681722,172.20.40.110,151.101.66.187,TLSv1.2,2831,Application Data
36,8.2791108,151.101.66.187,172.20.40.110,TCP,60,443  >  57039 [ACK] Seq=1189 Ack=25087 Win=4360 Len=0
37,8.2815435,151.101.66.187,172.20.40.110,TLSv1.2,98,Application Data
38,8.3012468,172.20.40.110,151.101.66.187,TLSv1.2,2821,Application Data
39,8.3098749,151.101.66.187,172.20.40.110,TCP,60,443  >  57039 [ACK] Seq=1233 Ack=27854 Win=4360 Len=0
40,8.3150924,151.101.66.187,172.20.40.110,TLSv1.2,158,Application Data
41,8.318265,172.20.40.110,151.101.66.187,TLSv1.2,2823,Application Data
42,8.3280016,151.101.66.187,172.20.40.110,TCP,60,443  >  57039 [ACK] Seq=1337 Ack=30623 Win=4360 Len=0
43,8.3313623,151.101.66.187,172.20.40.110,TLSv1.2,98,Application Data
44,8.3333137,172.20.40.110,151.101.66.187,TLSv1.2,2819,Application Data
45,8.3469817,151.101.66.187,172.20.40.110,TCP,60,443  >  57039 [ACK] Seq=1381 Ack=33383 Win=4371 Len=0
46,8.3483154,151.101.66.187,172.20.40.110,TCP,60,443  >  57039 [ACK] Seq=1381 Ack=33388 Win=4371 Len=0
47,8.3483154,151.101.66.187,172.20.40.110,TLSv1.2,130,Application Data
48,8.3827248,151.101.66.187,172.20.40.110,TCP,130,"[TCP Retransmission] 443  >  57039 [PSH, ACK] Seq=1381 Ack=33388 Win=4371 Len=76"
49,8.3827989,172.20.40.110,151.101.66.187,TCP,66,57039  >  443 [ACK] Seq=33388 Ack=1457 Win=516 Len=0 SLE=1381 SRE=1457
50,8.4497461,172.20.40.110,151.101.66.187,TLSv1.2,2821,Application Data
51,8.4593165,151.101.66.187,172.20.40.110,TCP,60,443  >  57039 [ACK] Seq=1457 Ack=36155 Win=4371 Len=0
52,8.4620504,151.101.66.187,172.20.40.110,TLSv1.2,124,Application Data
53,8.4975676,151.101.66.187,172.20.40.110,TCP,124,"[TCP Retransmission] 443  >  57039 [PSH, ACK] Seq=1457 Ack=36155 Win=4371 Len=70"
54,8.4976659,172.20.40.110,151.101.66.187,TCP,66,57039  >  443 [ACK] Seq=36155 Ack=1527 Win=516 Len=0 SLE=1457 SRE=1527
55,8.6268564,172.20.40.110,151.101.66.187,TLSv1.2,2821,Application Data
56,8.6388654,151.101.66.187,172.20.40.110,TCP,60,443  >  57039 [ACK] Seq=1527 Ack=38922 Win=4371 Len=0
57,8.6412713,151.101.66.187,172.20.40.110,TLSv1.2,241,Application Data
58,8.6779872,151.101.66.187,172.20.40.110,TCP,241,"[TCP Retransmission] 443  >  57039 [PSH, ACK] Seq=1527 Ack=38922 Win=4371 Len=187"
59,8.6780426,172.20.40.110,151.101.66.187,TCP,66,57039  >  443 [ACK] Seq=38922 Ack=1714 Win=515 Len=0 SLE=1527 SRE=1714
60,10.4130455,172.20.40.110,151.101.66.187,TLSv1.2,2837,Application Data
61,10.4222142,172.20.40.110,151.101.66.187,TLSv1.2,2825,Application Data
62,10.4224624,172.20.40.110,151.101.66.187,TLSv1.2,2819,Application Data
63,10.4246204,151.101.66.187,172.20.40.110,TCP,60,443  >  57039 [ACK] Seq=1714 Ack=41705 Win=4371 Len=0
64,10.4284677,151.101.66.187,172.20.40.110,TLSv1.2,241,Application Data
65,10.4340524,151.101.66.187,172.20.40.110,TCP,60,443  >  57039 [ACK] Seq=1901 Ack=44476 Win=4377 Len=0
66,10.4340524,151.101.66.187,172.20.40.110,TCP,60,443  >  57039 [ACK] Seq=1901 Ack=47236 Win=4388 Len=0
67,10.4340524,151.101.66.187,172.20.40.110,TCP,60,443  >  57039 [ACK] Seq=1901 Ack=47241 Win=4388 Len=0
68,10.4366186,151.101.66.187,172.20.40.110,TLSv1.2,130,Application Data
69,10.4367282,172.20.40.110,151.101.66.187,TCP,54,57039  >  443 [ACK] Seq=47241 Ack=1977 Win=514 Len=0
70,10.437465,151.101.66.187,172.20.40.110,TLSv1.2,130,Application Data
71,10.4434391,172.20.40.110,151.101.66.187,TLSv1.2,2838,Application Data
72,10.4545916,151.101.66.187,172.20.40.110,TCP,60,443  >  57039 [ACK] Seq=2053 Ack=50025 Win=4393 Len=0
73,10.4567486,151.101.66.187,172.20.40.110,TLSv1.2,131,Application Data
74,10.4921019,151.101.66.187,172.20.40.110,TCP,131,"[TCP Retransmission] 443  >  57039 [PSH, ACK] Seq=2053 Ack=50025 Win=4393 Len=77"
75,10.4921621,172.20.40.110,151.101.66.187,TCP,66,57039  >  443 [ACK] Seq=50025 Ack=2130 Win=513 Len=0 SLE=2053 SRE=2130
76,10.6879432,172.20.40.110,151.101.66.187,TLSv1.2,2823,Application Data
77,10.6908045,172.20.40.110,151.101.66.187,TLSv1.2,2826,Application Data
78,10.6912884,172.20.40.110,151.101.66.187,TLSv1.2,2820,Application Data
79,10.6993884,151.101.66.187,172.20.40.110,TCP,60,443  >  57039 [ACK] Seq=2130 Ack=52794 Win=4393 Len=0
80,10.6993884,151.101.66.187,172.20.40.110,TCP,60,443  >  57039 [ACK] Seq=2130 Ack=55566 Win=4393 Len=0
81,10.7031968,151.101.66.187,172.20.40.110,TLSv1.2,240,Application Data
82,10.7045143,151.101.66.187,172.20.40.110,TLSv1.2,305,Application Data
83,10.7046298,172.20.40.110,151.101.66.187,TCP,54,57039  >  443 [ACK] Seq=58332 Ack=2567 Win=517 Len=0
84,10.7124869,151.101.66.187,172.20.40.110,TCP,60,443  >  57039 [ACK] Seq=2567 Ack=58332 Win=4393 Len=0
85,10.7129585,151.101.66.187,172.20.40.110,TLSv1.2,130,Application Data
86,10.7470199,151.101.66.187,172.20.40.110,TCP,130,"[TCP Retransmission] 443  >  57039 [PSH, ACK] Seq=2567 Ack=58332 Win=4393 Len=76"
87,10.7470859,172.20.40.110,151.101.66.187,TCP,66,57039  >  443 [ACK] Seq=58332 Ack=2643 Win=517 Len=0 SLE=2567 SRE=2643
88,10.7500547,172.20.40.110,151.101.66.187,TLSv1.2,2837,Application Data
89,10.7542134,172.20.40.110,151.101.66.187,TLSv1.2,2841,Application Data
90,10.7611008,151.101.66.187,172.20.40.110,TCP,60,443  >  57039 [ACK] Seq=2643 Ack=61115 Win=4399 Len=0
91,10.7645025,151.101.66.187,172.20.40.110,TCP,60,443  >  57039 [ACK] Seq=2643 Ack=63902 Win=4399 Len=0
92,10.7656154,151.101.66.187,172.20.40.110,TLSv1.2,158,Application Data
93,10.7701765,151.101.66.187,172.20.40.110,TLSv1.2,124,Application Data
94,10.770485,172.20.40.110,151.101.66.187,TCP,54,57039  >  443 [ACK] Seq=63902 Ack=2817 Win=516 Len=0
95,10.8169787,172.20.40.110,151.101.66.187,TLSv1.2,2823,Application Data
96,10.8255878,151.101.66.187,172.20.40.110,TCP,60,443  >  57039 [ACK] Seq=2817 Ack=66671 Win=4399 Len=0
97,10.8295124,151.101.66.187,172.20.40.110,TLSv1.2,131,Application Data
98,10.8372406,172.20.40.110,151.101.66.187,TLSv1.2,2823,Application Data
99,10.8462333,151.101.66.187,172.20.40.110,TCP,60,443  >  57039 [ACK] Seq=2894 Ack=69440 Win=4399 Len=0
100,10.850723,151.101.66.187,172.20.40.110,TLSv1.2,131,Application Data
101,10.8828847,151.101.66.187,172.20.40.110,TCP,131,"[TCP Retransmission] 443  >  57039 [PSH, ACK] Seq=2894 Ack=69440 Win=4399 Len=77"
102,10.8829428,172.20.40.110,151.101.66.187,TCP,66,57039  >  443 [ACK] Seq=69440 Ack=2971 Win=515 Len=0 SLE=2894 SRE=2971
103,11.8752023,172.20.40.110,151.101.66.187,TLSv1.2,2793,Application Data
104,11.8910751,151.101.66.187,172.20.40.110,TCP,60,443  >  57039 [ACK] Seq=2971 Ack=72179 Win=4410 Len=0
105,11.8963707,151.101.66.187,172.20.40.110,TLSv1.2,214,Application Data
106,11.9276832,151.101.66.187,172.20.40.110,TCP,214,"[TCP Retransmission] 443  >  57039 [PSH, ACK] Seq=2971 Ack=72179 Win=4410 Len=160"
107,11.9277536,172.20.40.110,151.101.66.187,TCP,66,57039  >  443 [ACK] Seq=72179 Ack=3131 Win=515 Len=0 SLE=2971 SRE=3131
108,12.0278633,172.20.40.110,151.101.66.187,TLSv1.2,2794,Application Data
109,12.048026,151.101.66.187,172.20.40.110,TCP,60,443  >  57039 [ACK] Seq=3131 Ack=73559 Win=4415 Len=0
110,12.0636959,151.101.66.187,172.20.40.110,TCP,60,443  >  57039 [ACK] Seq=3131 Ack=74919 Win=4421 Len=0
111,12.0682394,151.101.66.187,172.20.40.110,TLSv1.2,98,Application Data
112,12.0993505,151.101.66.187,172.20.40.110,TCP,98,"[TCP Retransmission] 443  >  57039 [PSH, ACK] Seq=3131 Ack=74919 Win=4421 Len=44"
113,12.0994192,172.20.40.110,151.101.66.187,TCP,66,57039  >  443 [ACK] Seq=74919 Ack=3175 Win=515 Len=0 SLE=3131 SRE=3175
114,12.1901695,172.20.40.110,151.101.66.187,TLSv1.2,2781,Application Data
115,12.199145,151.101.66.187,172.20.40.110,TCP,60,443  >  57039 [ACK] Seq=3175 Ack=76299 Win=4427 Len=0
116,12.201031,151.101.66.187,172.20.40.110,TCP,60,443  >  57039 [ACK] Seq=3175 Ack=77646 Win=4433 Len=0
117,12.2088824,151.101.66.187,172.20.40.110,TLSv1.2,104,Application Data
118,12.2383956,151.101.66.187,172.20.40.110,TCP,104,"[TCP Retransmission] 443  >  57039 [PSH, ACK] Seq=3175 Ack=77646 Win=4433 Len=50"
119,12.2384495,172.20.40.110,151.101.66.187,TCP,66,57039  >  443 [ACK] Seq=77646 Ack=3225 Win=514 Len=0 SLE=3175 SRE=3225
120,12.6497401,172.20.40.110,151.101.66.187,TCP,54,"51833  >  443 [FIN, ACK] Seq=1 Ack=1 Win=256 Len=0"
121,12.6517354,172.20.40.110,151.101.66.187,TCP,54,"57039  >  443 [FIN, ACK] Seq=77646 Ack=3225 Win=514 Len=0"
122,12.6593866,151.101.66.187,172.20.40.110,TCP,60,443  >  51833 [ACK] Seq=1 Ack=2 Win=281 Len=0
123,12.6593866,151.101.66.187,172.20.40.110,TLSv1.2,78,Application Data
124,12.6599412,172.20.40.110,151.101.66.187,TCP,54,"51833  >  443 [RST, ACK] Seq=2 Ack=25 Win=0 Len=0"
125,12.6651877,151.101.66.187,172.20.40.110,TCP,60,"443  >  51833 [FIN, ACK] Seq=25 Ack=2 Win=281 Len=0"
126,12.6651877,151.101.66.187,172.20.40.110,TCP,60,443  >  57039 [ACK] Seq=3225 Ack=77647 Win=4433 Len=0
127,12.6651877,151.101.66.187,172.20.40.110,TLSv1.2,78,Application Data
128,12.6651877,151.101.66.187,172.20.40.110,TCP,60,"443  >  57039 [FIN, ACK] Seq=3249 Ack=77647 Win=4433 Len=0"
129,12.6665501,172.20.40.110,151.101.66.187,TCP,54,"57039  >  443 [RST, ACK] Seq=77647 Ack=3249 Win=0 Len=0"
130,17.746454,172.20.40.110,151.101.194.187,TCP,66,50060  >  443 [SYN] Seq=0 Win=64240 Len=0 MSS=1460 WS=256 SACK_PERM
131,17.7543413,151.101.194.187,172.20.40.110,TCP,66,"443  >  50060 [SYN, ACK] Seq=0 Ack=1 Win=65535 Len=0 MSS=1380 SACK_PERM WS=512"
132,17.7544836,172.20.40.110,151.101.194.187,TCP,54,50060  >  443 [ACK] Seq=1 Ack=1 Win=66048 Len=0
133,17.7554267,172.20.40.110,151.101.194.187,TLSv1.3,2065,Client Hello (SNI=www.target.com)
134,17.7643124,151.101.194.187,172.20.40.110,TCP,60,443  >  50060 [ACK] Seq=1 Ack=2012 Win=144384 Len=0
135,17.7795942,151.101.194.187,172.20.40.110,TLSv1.3,1434,"Server Hello, Change Cipher Spec, Application Data, Application Data"
136,17.7795942,151.101.194.187,172.20.40.110,TLSv1.3,215,Application Data
137,17.7796714,172.20.40.110,151.101.194.187,TCP,54,50060  >  443 [ACK] Seq=2012 Ack=1542 Win=66048 Len=0
138,17.7827785,172.20.40.110,151.101.194.187,TLSv1.3,118,"Change Cipher Spec, Application Data"
139,17.7832345,172.20.40.110,151.101.194.187,TLSv1.3,146,Application Data
140,17.7841486,172.20.40.110,151.101.194.187,TLSv1.3,2809,Application Data
141,17.7845897,172.20.40.110,151.101.194.187,TLSv1.3,2805,Application Data
142,17.7849745,172.20.40.110,151.101.194.187,TLSv1.3,2805,Application Data
143,17.7851905,172.20.40.110,151.101.194.187,TLSv1.3,2811,Application Data
144,17.7853476,172.20.40.110,151.101.194.187,TLSv1.3,2807,Application Data
145,17.7879753,172.20.40.110,151.101.194.187,TCP,1434,50060  >  443 [ACK] Seq=15935 Ack=1542 Win=66048 Len=1380 [TCP PDU reassembled in 151]
146,17.7975275,151.101.194.187,172.20.40.110,TCP,60,443  >  50060 [ACK] Seq=1542 Ack=2076 Win=144384 Len=0
147,17.7975275,151.101.194.187,172.20.40.110,TCP,60,443  >  50060 [ACK] Seq=1542 Ack=2168 Win=144384 Len=0
148,17.7975275,151.101.194.187,172.20.40.110,TLSv1.3,119,Application Data
149,17.7975275,151.101.194.187,172.20.40.110,TCP,60,443  >  50060 [ACK] Seq=1607 Ack=4923 Win=141824 Len=0
150,17.7975275,151.101.194.187,172.20.40.110,TLSv1.3,450,Application Data
151,17.7976566,172.20.40.110,151.101.194.187,TLSv1.3,1423,Application Data
152,17.7981999,172.20.40.110,151.101.194.187,TLSv1.3,85,Application Data
153,17.7985053,151.101.194.187,172.20.40.110,TCP,60,443  >  50060 [ACK] Seq=2003 Ack=7674 Win=139264 Len=0
154,17.7985053,151.101.194.187,172.20.40.110,TCP,60,443  >  50060 [ACK] Seq=2003 Ack=10425 Win=136704 Len=0
155,17.7985053,151.101.194.187,172.20.40.110,TCP,60,443  >  50060 [ACK] Seq=2003 Ack=13182 Win=134144 Len=0
156,17.8040089,151.101.194.187,172.20.40.110,TLSv1.3,132,Application Data
157,17.8040089,151.101.194.187,172.20.40.110,TCP,60,443  >  50060 [ACK] Seq=2081 Ack=15935 Win=131584 Len=0
158,17.8040089,151.101.194.187,172.20.40.110,TLSv1.3,125,Application Data
159,17.8041223,172.20.40.110,151.101.194.187,TCP,54,50060  >  443 [ACK] Seq=18715 Ack=2152 Win=65536 Len=0
160,17.8050701,151.101.194.187,172.20.40.110,TLSv1.3,130,Application Data
161,17.8072617,151.101.194.187,172.20.40.110,TCP,60,443  >  50060 [ACK] Seq=2228 Ack=18684 Win=129536 Len=0
162,17.8072617,151.101.194.187,172.20.40.110,TCP,60,443  >  50060 [ACK] Seq=2228 Ack=18715 Win=129536 Len=0
163,17.8083901,151.101.194.187,172.20.40.110,TLSv1.3,130,Application Data
164,17.808463,172.20.40.110,151.101.194.187,TCP,54,50060  >  443 [ACK] Seq=18715 Ack=2304 Win=65280 Len=0
165,17.8116356,151.101.194.187,172.20.40.110,TLSv1.3,130,Application Data
166,17.8405406,151.101.194.187,172.20.40.110,TCP,130,"[TCP Retransmission] 443  >  50060 [PSH, ACK] Seq=2304 Ack=18715 Win=129536 Len=76"
167,17.8406001,172.20.40.110,151.101.194.187,TCP,66,50060  >  443 [ACK] Seq=18715 Ack=2380 Win=65280 Len=0 SLE=2304 SRE=2380
168,17.9252782,172.20.40.110,151.101.194.187,TLSv1.3,2809,Application Data
169,17.9306317,172.20.40.110,151.101.194.187,TLSv1.3,2805,Application Data
170,17.933731,172.20.40.110,151.101.194.187,TLSv1.3,2815,Application Data
171,17.9361214,172.20.40.110,151.101.194.187,TLSv1.3,2807,Application Data
172,17.9391366,151.101.194.187,172.20.40.110,TCP,60,443  >  50060 [ACK] Seq=2380 Ack=21470 Win=126976 Len=0
173,17.9391366,151.101.194.187,172.20.40.110,TLSv1.3,98,Application Data
174,17.9404216,151.101.194.187,172.20.40.110,TCP,60,443  >  50060 [ACK] Seq=2424 Ack=24221 Win=124416 Len=0
175,17.9425624,151.101.194.187,172.20.40.110,TCP,60,443  >  50060 [ACK] Seq=2424 Ack=26982 Win=121856 Len=0
176,17.9449721,151.101.194.187,172.20.40.110,TCP,60,443  >  50060 [ACK] Seq=2424 Ack=29735 Win=119296 Len=0
177,17.9495921,151.101.194.187,172.20.40.110,TLSv1.3,98,Application Data
178,17.9496731,172.20.40.110,151.101.194.187,TCP,54,50060  >  443 [ACK] Seq=29735 Ack=2468 Win=65280 Len=0
179,17.9530413,151.101.194.187,172.20.40.110,TLSv1.3,98,Application Data
180,17.9552292,151.101.194.187,172.20.40.110,TLSv1.3,98,Application Data
181,17.9553083,172.20.40.110,151.101.194.187,TCP,54,50060  >  443 [ACK] Seq=29735 Ack=2556 Win=65024 Len=0
182,17.9580328,172.20.40.110,151.101.194.187,TLSv1.3,2805,Application Data
183,17.9620901,172.20.40.110,151.101.194.187,TLSv1.3,2803,Application Data
184,17.9681401,151.101.194.187,172.20.40.110,TCP,60,443  >  50060 [ACK] Seq=2556 Ack=32486 Win=116736 Len=0
185,17.9727051,151.101.194.187,172.20.40.110,TLSv1.3,98,Application Data
186,17.9727051,151.101.194.187,172.20.40.110,TCP,60,443  >  50060 [ACK] Seq=2600 Ack=35235 Win=114176 Len=0
187,17.973814,151.101.194.187,172.20.40.110,TLSv1.3,98,Application Data
188,17.9739081,172.20.40.110,151.101.194.187,TCP,54,50060  >  443 [ACK] Seq=35235 Ack=2644 Win=65024 Len=0
189,18.0384996,172.20.40.110,151.101.194.187,TLSv1.3,2805,Application Data
190,18.0479877,151.101.194.187,172.20.40.110,TCP,60,443  >  50060 [ACK] Seq=2644 Ack=37986 Win=111616 Len=0
191,18.0516944,151.101.194.187,172.20.40.110,TLSv1.3,124,Application Data
192,18.0782774,151.101.194.187,172.20.40.110,TCP,124,"[TCP Retransmission] 443  >  50060 [PSH, ACK] Seq=2644 Ack=37986 Win=111616 Len=70"
193,18.0783419,172.20.40.110,151.101.194.187,TCP,66,50060  >  443 [ACK] Seq=37986 Ack=2714 Win=65024 Len=0 SLE=2644 SRE=2714
194,18.2022211,172.20.40.110,151.101.194.187,TLSv1.3,2805,Application Data
195,18.2145201,151.101.194.187,172.20.40.110,TCP,60,443  >  50060 [ACK] Seq=2714 Ack=40737 Win=109056 Len=0
196,18.2184725,151.101.194.187,172.20.40.110,TLSv1.3,131,Application Data
197,18.2452572,151.101.194.187,172.20.40.110,TCP,131,"[TCP Retransmission] 443  >  50060 [PSH, ACK] Seq=2714 Ack=40737 Win=109056 Len=77"
198,18.245335,172.20.40.110,151.101.194.187,TCP,66,50060  >  443 [ACK] Seq=40737 Ack=2791 Win=64768 Len=0 SLE=2714 SRE=2791
199,18.4385235,172.20.40.110,151.101.194.187,TLSv1.3,2809,Application Data
200,18.4525798,151.101.194.187,172.20.40.110,TCP,60,443  >  50060 [ACK] Seq=2791 Ack=43492 Win=106496 Len=0
201,18.4564893,151.101.194.187,172.20.40.110,TLSv1.3,131,Application Data
202,18.4834968,151.101.194.187,172.20.40.110,TCP,131,"[TCP Retransmission] 443  >  50060 [PSH, ACK] Seq=2791 Ack=43492 Win=106496 Len=77"
203,18.483592,172.20.40.110,151.101.194.187,TCP,66,50060  >  443 [ACK] Seq=43492 Ack=2868 Win=64768 Len=0 SLE=2791 SRE=2868
204,19.0326504,172.20.40.110,151.101.194.187,TLSv1.3,2822,Application Data
205,19.0433924,172.20.40.110,151.101.194.187,TLSv1.3,2813,Application Data
206,19.044322,151.101.194.187,172.20.40.110,TCP,60,443  >  50060 [ACK] Seq=2868 Ack=46260 Win=103936 Len=0
207,19.0454284,172.20.40.110,151.101.194.187,TLSv1.3,2807,Application Data
208,19.0488342,151.101.194.187,172.20.40.110,TLSv1.3,241,Application Data
209,19.0489454,172.20.40.110,151.101.194.187,TCP,54,50060  >  443 [ACK] Seq=51772 Ack=3055 Win=66048 Len=0
210,19.0529521,172.20.40.110,151.101.194.187,TLSv1.3,2807,Application Data
211,19.0554382,151.101.194.187,172.20.40.110,TCP,60,443  >  50060 [ACK] Seq=3055 Ack=49019 Win=101376 Len=0
212,19.0571748,151.101.194.187,172.20.40.110,TCP,60,443  >  50060 [ACK] Seq=3055 Ack=51772 Win=100864 Len=0
213,19.0571748,151.101.194.187,172.20.40.110,TLSv1.3,124,Application Data
214,19.0582396,151.101.194.187,172.20.40.110,TLSv1.3,131,Application Data
215,19.0583027,172.20.40.110,151.101.194.187,TCP,54,50060  >  443 [ACK] Seq=54525 Ack=3202 Win=66048 Len=0
216,19.0613654,151.101.194.187,172.20.40.110,TCP,60,443  >  50060 [ACK] Seq=3202 Ack=54525 Win=100864 Len=0
217,19.0647904,151.101.194.187,172.20.40.110,TLSv1.3,179,Application Data
218,19.0915095,151.101.194.187,172.20.40.110,TCP,179,"[TCP Retransmission] 443  >  50060 [PSH, ACK] Seq=3202 Ack=54525 Win=102912 Len=125"
219,19.0915617,172.20.40.110,151.101.194.187,TCP,66,50060  >  443 [ACK] Seq=54525 Ack=3327 Win=65792 Len=0 SLE=3202 SRE=3327
220,19.1008396,172.20.40.110,151.101.194.187,TLSv1.3,2807,Application Data
221,19.1097752,151.101.194.187,172.20.40.110,TCP,60,443  >  50060 [ACK] Seq=3327 Ack=57278 Win=100864 Len=0
222,19.1129661,151.101.194.187,172.20.40.110,TLSv1.3,265,Application Data
223,19.1380426,151.101.194.187,172.20.40.110,TCP,265,"[TCP Retransmission] 443  >  50060 [PSH, ACK] Seq=3327 Ack=57278 Win=102912 Len=211"
224,19.1381195,172.20.40.110,151.101.194.187,TCP,66,50060  >  443 [ACK] Seq=57278 Ack=3538 Win=65536 Len=0 SLE=3327 SRE=3538
225,19.2835955,172.20.40.110,151.101.194.187,TLSv1.3,2804,Application Data
226,19.2921103,151.101.194.187,172.20.40.110,TCP,60,443  >  50060 [ACK] Seq=3538 Ack=60028 Win=100864 Len=0
227,19.2953815,151.101.194.187,172.20.40.110,TLSv1.3,125,Application Data
228,19.3210552,151.101.194.187,172.20.40.110,TCP,125,"[TCP Retransmission] 443  >  50060 [PSH, ACK] Seq=3538 Ack=60028 Win=102912 Len=71"
229,19.3211148,172.20.40.110,151.101.194.187,TCP,66,50060  >  443 [ACK] Seq=60028 Ack=3609 Win=65536 Len=0 SLE=3538 SRE=3609
230,19.3373818,172.20.40.110,151.101.194.187,TLSv1.3,2821,Application Data
231,19.3487568,151.101.194.187,172.20.40.110,TCP,60,443  >  50060 [ACK] Seq=3609 Ack=62795 Win=100352 Len=0
232,19.3499242,151.101.194.187,172.20.40.110,TLSv1.3,130,Application Data
233,19.3646851,172.20.40.110,151.101.194.187,TLSv1.3,2821,Application Data
234,19.3752488,151.101.194.187,172.20.40.110,TCP,130,"[TCP Spurious Retransmission] 443  >  50060 [PSH, ACK] Seq=3609 Ack=62795 Win=102912 Len=76"
235,19.3752488,151.101.194.187,172.20.40.110,TCP,60,443  >  50060 [ACK] Seq=3685 Ack=65562 Win=100352 Len=0
236,19.3753072,172.20.40.110,151.101.194.187,TCP,66,[TCP Dup ACK 233#1] 50060  >  443 [ACK] Seq=65562 Ack=3685 Win=65536 Len=0 SLE=3609 SRE=3685
237,19.3781201,151.101.194.187,172.20.40.110,TLSv1.3,125,Application Data
238,19.4056048,151.101.194.187,172.20.40.110,TCP,125,"[TCP Retransmission] 443  >  50060 [PSH, ACK] Seq=3685 Ack=65562 Win=102912 Len=71"
239,19.4056626,172.20.40.110,151.101.194.187,TCP,66,50060  >  443 [ACK] Seq=65562 Ack=3756 Win=65536 Len=0 SLE=3685 SRE=3756
240,19.5754018,172.20.40.110,151.101.194.187,TLSv1.3,2807,Application Data
241,19.5911139,151.101.194.187,172.20.40.110,TCP,60,443  >  50060 [ACK] Seq=3756 Ack=68315 Win=100864 Len=0
242,19.5911139,151.101.194.187,172.20.40.110,TLSv1.3,240,Application Data
243,19.6275062,151.101.194.187,172.20.40.110,TCP,240,"[TCP Retransmission] 443  >  50060 [PSH, ACK] Seq=3756 Ack=68315 Win=102912 Len=186"
244,19.6275803,172.20.40.110,151.101.194.187,TCP,66,50060  >  443 [ACK] Seq=68315 Ack=3942 Win=65280 Len=0 SLE=3756 SRE=3942
245,19.838132,172.20.40.110,151.101.194.187,TLSv1.3,2786,Application Data
246,19.8389037,172.20.40.110,151.101.194.187,TLSv1.3,2783,Application Data
247,19.8480912,151.101.194.187,172.20.40.110,TCP,60,443  >  50060 [ACK] Seq=3942 Ack=71047 Win=100864 Len=0
248,19.8509284,151.101.194.187,172.20.40.110,TCP,60,443  >  50060 [ACK] Seq=3942 Ack=73776 Win=100864 Len=0
249,19.8509284,151.101.194.187,172.20.40.110,TLSv1.3,129,Application Data
250,19.8519672,151.101.194.187,172.20.40.110,TLSv1.3,130,Application Data
251,19.852073,172.20.40.110,151.101.194.187,TCP,54,50060  >  443 [ACK] Seq=73776 Ack=4093 Win=65024 Len=0
252,19.8642557,172.20.40.110,151.101.194.187,TLSv1.3,2815,Application Data
253,19.8649287,172.20.40.110,151.101.194.187,TLSv1.3,2811,Application Data
254,19.8706428,172.20.40.110,151.101.194.187,TLSv1.3,2780,Application Data
255,19.8708937,172.20.40.110,151.101.194.187,TLSv1.3,2813,Application Data
256,19.8726342,172.20.40.110,151.101.194.187,TLSv1.3,2814,Application Data
257,19.8784534,151.101.194.187,172.20.40.110,TCP,60,443  >  50060 [ACK] Seq=4093 Ack=76537 Win=100352 Len=0
258,19.8784534,151.101.194.187,172.20.40.110,TCP,60,443  >  50060 [ACK] Seq=4093 Ack=79294 Win=100864 Len=0
259,19.8784534,151.101.194.187,172.20.40.110,TLSv1.3,125,Application Data
260,19.8802137,151.101.194.187,172.20.40.110,TLSv1.3,124,Application Data
261,19.8802137,151.101.194.187,172.20.40.110,TCP,60,443  >  50060 [ACK] Seq=4234 Ack=82020 Win=100864 Len=0
262,19.8802958,172.20.40.110,151.101.194.187,TCP,54,50060  >  443 [ACK] Seq=87539 Ack=4234 Win=65024 Len=0
263,19.8812091,151.101.194.187,172.20.40.110,TCP,60,443  >  50060 [ACK] Seq=4234 Ack=84779 Win=100864 Len=0
264,19.8834011,151.101.194.187,172.20.40.110,TLSv1.3,130,Application Data
265,19.8834011,151.101.194.187,172.20.40.110,TCP,60,443  >  50060 [ACK] Seq=4310 Ack=87539 Win=102912 Len=0
266,19.8844741,151.101.194.187,172.20.40.110,TLSv1.3,130,Application Data
267,19.8845371,172.20.40.110,151.101.194.187,TCP,54,50060  >  443 [ACK] Seq=87539 Ack=4386 Win=64768 Len=0
268,19.8876739,151.101.194.187,172.20.40.110,TLSv1.3,124,Application Data
269,19.913289,172.20.40.110,151.101.194.187,TLSv1.3,2785,Application Data
270,19.9177386,151.101.194.187,172.20.40.110,TCP,124,"[TCP Spurious Retransmission] 443  >  50060 [PSH, ACK] Seq=4386 Ack=87539 Win=102912 Len=70"
271,19.917802,172.20.40.110,151.101.194.187,TCP,66,[TCP Dup ACK 269#1] 50060  >  443 [ACK] Seq=90270 Ack=4456 Win=66048 Len=0 SLE=4386 SRE=4456
272,19.9262283,151.101.194.187,172.20.40.110,TCP,60,443  >  50060 [ACK] Seq=4456 Ack=90270 Win=101888 Len=0
273,19.9296726,151.101.194.187,172.20.40.110,TLSv1.3,130,Application Data
274,19.9549602,151.101.194.187,172.20.40.110,TCP,130,"[TCP Retransmission] 443  >  50060 [PSH, ACK] Seq=4456 Ack=90270 Win=102912 Len=76"
275,19.9550253,172.20.40.110,151.101.194.187,TCP,66,50060  >  443 [ACK] Seq=90270 Ack=4532 Win=66048 Len=0 SLE=4456 SRE=4532
276,20.1325284,172.20.40.110,151.101.194.187,TLSv1.3,2862,Application Data
277,20.1424567,151.101.194.187,172.20.40.110,TCP,60,443  >  50060 [ACK] Seq=4532 Ack=93078 Win=100352 Len=0
278,20.1454447,151.101.194.187,172.20.40.110,TLSv1.3,104,Application Data
279,20.1702773,151.101.194.187,172.20.40.110,TCP,104,"[TCP Retransmission] 443  >  50060 [PSH, ACK] Seq=4532 Ack=93078 Win=102912 Len=50"
280,20.170333,172.20.40.110,151.101.194.187,TCP,66,50060  >  443 [ACK] Seq=93078 Ack=4582 Win=66048 Len=0 SLE=4532 SRE=4582
281,24.6439857,172.20.40.110,151.101.194.187,TLSv1.3,2874,Application Data
282,24.6551594,151.101.194.187,172.20.40.110,TCP,60,443  >  50060 [ACK] Seq=4582 Ack=95898 Win=100352 Len=0
283,24.6577243,151.101.194.187,172.20.40.110,TLSv1.3,258,Application Data
284,24.6754591,172.20.40.110,151.101.194.187,TLSv1.3,2875,Application Data
285,24.6820025,151.101.194.187,172.20.40.110,TCP,258,"[TCP Spurious Retransmission] 443  >  50060 [PSH, ACK] Seq=4582 Ack=95898 Win=102912 Len=204"
286,24.6820722,172.20.40.110,151.101.194.187,TCP,66,[TCP Dup ACK 284#1] 50060  >  443 [ACK] Seq=98719 Ack=4786 Win=65792 Len=0 SLE=4582 SRE=4786
287,24.6862913,151.101.194.187,172.20.40.110,TCP,60,443  >  50060 [ACK] Seq=4786 Ack=98719 Win=100352 Len=0
288,24.6896372,151.101.194.187,172.20.40.110,TLSv1.3,291,Application Data
289,24.7136319,151.101.194.187,172.20.40.110,TCP,291,"[TCP Retransmission] 443  >  50060 [PSH, ACK] Seq=4786 Ack=98719 Win=102912 Len=237"
290,24.713682,172.20.40.110,151.101.194.187,TCP,66,50060  >  443 [ACK] Seq=98719 Ack=5023 Win=65536 Len=0 SLE=4786 SRE=5023
291,24.8979665,172.20.40.110,151.101.194.187,TLSv1.3,2866,Application Data
292,24.9076559,151.101.194.187,172.20.40.110,TCP,60,443  >  50060 [ACK] Seq=5023 Ack=101531 Win=100352 Len=0
293,24.9112255,151.101.194.187,172.20.40.110,TLSv1.3,104,Application Data
294,24.9385997,151.101.194.187,172.20.40.110,TCP,104,"[TCP Retransmission] 443  >  50060 [PSH, ACK] Seq=5023 Ack=101531 Win=102912 Len=50"
295,24.9386829,172.20.40.110,151.101.194.187,TCP,66,50060  >  443 [ACK] Seq=101531 Ack=5073 Win=65536 Len=0 SLE=5023 SRE=5073
296,25.4033537,172.20.40.110,151.101.194.187,TLSv1.3,2874,Application Data
297,25.409007,172.20.40.110,151.101.194.187,TLSv1.3,2875,Application Data
298,25.4141481,151.101.194.187,172.20.40.110,TCP,60,443  >  50060 [ACK] Seq=5073 Ack=104351 Win=100352 Len=0
299,25.417729,151.101.194.187,172.20.40.110,TLSv1.3,98,Application Data
300,25.4186638,151.101.194.187,172.20.40.110,TCP,60,443  >  50060 [ACK] Seq=5117 Ack=107172 Win=100352 Len=0
301,25.424018,151.101.194.187,172.20.40.110,TLSv1.3,98,Application Data
302,25.424093,172.20.40.110,151.101.194.187,TCP,54,50060  >  443 [ACK] Seq=107172 Ack=5161 Win=65280 Len=0
303,25.5626625,172.20.40.110,151.101.194.187,TLSv1.3,2874,Application Data
304,25.5696166,172.20.40.110,151.101.194.187,TLSv1.3,2875,Application Data
305,25.5721709,151.101.194.187,172.20.40.110,TCP,60,443  >  50060 [ACK] Seq=5161 Ack=109992 Win=100352 Len=0
306,25.5756188,151.101.194.187,172.20.40.110,TLSv1.3,214,Application Data
307,25.5791471,151.101.194.187,172.20.40.110,TCP,60,443  >  50060 [ACK] Seq=5321 Ack=112813 Win=100352 Len=0
308,25.5815996,151.101.194.187,172.20.40.110,TLSv1.3,98,Application Data
309,25.5816792,172.20.40.110,151.101.194.187,TCP,54,50060  >  443 [ACK] Seq=112813 Ack=5365 Win=65280 Len=0
310,25.6458055,172.20.40.110,151.101.194.187,TLSv1.3,2874,Application Data
311,25.6578066,151.101.194.187,172.20.40.110,TCP,60,443  >  50060 [ACK] Seq=5365 Ack=115633 Win=100352 Len=0
312,25.6583578,151.101.194.187,172.20.40.110,TLSv1.3,125,Application Data
313,25.6724074,172.20.40.110,151.101.194.187,TLSv1.3,2872,Application Data
314,25.6816239,151.101.194.187,172.20.40.110,TCP,60,443  >  50060 [ACK] Seq=5436 Ack=118451 Win=100352 Len=0
315,25.686006,151.101.194.187,172.20.40.110,TLSv1.3,125,Application Data
316,25.7137581,151.101.194.187,172.20.40.110,TCP,125,"[TCP Retransmission] 443  >  50060 [PSH, ACK] Seq=5436 Ack=118451 Win=102912 Len=71"
317,25.713817,172.20.40.110,151.101.194.187,TCP,66,50060  >  443 [ACK] Seq=118451 Ack=5507 Win=65024 Len=0 SLE=5436 SRE=5507
318,25.7198089,172.20.40.110,151.101.194.187,TLSv1.3,2875,Application Data
319,25.7289766,151.101.194.187,172.20.40.110,TCP,60,443  >  50060 [ACK] Seq=5507 Ack=121272 Win=100352 Len=0
320,25.7428571,151.101.194.187,172.20.40.110,TLSv1.3,98,Application Data
321,25.7713075,151.101.194.187,172.20.40.110,TCP,98,"[TCP Retransmission] 443  >  50060 [PSH, ACK] Seq=5507 Ack=121272 Win=102912 Len=44"
322,25.7713707,172.20.40.110,151.101.194.187,TCP,66,50060  >  443 [ACK] Seq=121272 Ack=5551 Win=65024 Len=0 SLE=5507 SRE=5551
323,26.0405333,172.20.40.110,151.101.194.187,TLSv1.3,2862,Application Data
324,26.0423,172.20.40.110,151.101.194.187,TLSv1.3,2874,Application Data
325,26.0514106,151.101.194.187,172.20.40.110,TCP,60,443  >  50060 [ACK] Seq=5551 Ack=124080 Win=100352 Len=0
326,26.0616222,151.101.194.187,172.20.40.110,TCP,60,443  >  50060 [ACK] Seq=5551 Ack=126900 Win=99840 Len=0
327,26.0616222,151.101.194.187,172.20.40.110,TLSv1.3,104,Application Data
328,26.0616222,151.101.194.187,172.20.40.110,TLSv1.3,130,Application Data
329,26.061748,172.20.40.110,151.101.194.187,TCP,54,50060  >  443 [ACK] Seq=126900 Ack=5677 Win=64768 Len=0
330,26.2698881,172.20.40.110,151.101.194.187,TLSv1.3,2857,Application Data
331,26.280895,151.101.194.187,172.20.40.110,TCP,60,443  >  50060 [ACK] Seq=5677 Ack=129703 Win=100352 Len=0
332,26.2898295,151.101.194.187,172.20.40.110,TLSv1.3,130,Application Data
333,26.3124222,151.101.194.187,172.20.40.110,TCP,130,"[TCP Retransmission] 443  >  50060 [PSH, ACK] Seq=5677 Ack=129703 Win=102912 Len=76"
334,26.3124969,172.20.40.110,151.101.194.187,TCP,66,50060  >  443 [ACK] Seq=129703 Ack=5753 Win=64768 Len=0 SLE=5677 SRE=5753
335,30.7075694,172.20.40.110,151.101.194.187,TLSv1.3,2896,Application Data
336,30.7152792,172.20.40.110,151.101.194.187,TLSv1.3,2887,Application Data
337,30.7171718,172.20.40.110,151.101.194.187,TLSv1.3,2881,Application Data
338,30.7209102,172.20.40.110,151.101.194.187,TLSv1.3,2881,Application Data
339,30.7209317,151.101.194.187,172.20.40.110,TCP,60,443  >  50060 [ACK] Seq=5753 Ack=132545 Win=100352 Len=0
340,30.7247078,151.101.194.187,172.20.40.110,TCP,60,443  >  50060 [ACK] Seq=5753 Ack=135378 Win=99840 Len=0
341,30.7258675,151.101.194.187,172.20.40.110,TLSv1.3,214,Application Data
342,30.7269017,151.101.194.187,172.20.40.110,TCP,60,443  >  50060 [ACK] Seq=5913 Ack=138205 Win=100352 Len=0
343,30.7290617,151.101.194.187,172.20.40.110,TLSv1.3,124,Application Data
344,30.7300971,151.101.194.187,172.20.40.110,TCP,60,443  >  50060 [ACK] Seq=5983 Ack=141032 Win=100352 Len=0
345,30.7333608,151.101.194.187,172.20.40.110,TLSv1.3,131,Application Data
346,30.7333608,151.101.194.187,172.20.40.110,TLSv1.3,130,Application Data
347,30.7335219,172.20.40.110,151.101.194.187,TCP,54,50060  >  443 [ACK] Seq=141032 Ack=6136 Win=66048 Len=0
348,30.7697491,172.20.40.110,151.101.194.187,TLSv1.3,2881,Application Data
349,30.7795609,151.101.194.187,172.20.40.110,TCP,60,443  >  50060 [ACK] Seq=6136 Ack=143859 Win=100352 Len=0
350,30.7851962,151.101.194.187,172.20.40.110,TLSv1.3,130,Application Data
351,30.8128927,151.101.194.187,172.20.40.110,TCP,130,"[TCP Retransmission] 443  >  50060 [PSH, ACK] Seq=6136 Ack=143859 Win=102912 Len=76"
352,30.8129713,172.20.40.110,151.101.194.187,TCP,66,50060  >  443 [ACK] Seq=143859 Ack=6212 Win=66048 Len=0 SLE=6136 SRE=6212
353,30.8171233,172.20.40.110,151.101.194.187,TLSv1.3,2895,Application Data
354,30.8299236,151.101.194.187,172.20.40.110,TCP,60,443  >  50060 [ACK] Seq=6212 Ack=146700 Win=100352 Len=0
355,30.8341701,151.101.194.187,172.20.40.110,TLSv1.3,142,Application Data
356,30.8642071,151.101.194.187,172.20.40.110,TCP,142,"[TCP Retransmission] 443  >  50060 [PSH, ACK] Seq=6212 Ack=146700 Win=102912 Len=88"
357,30.8642594,172.20.40.110,151.101.194.187,TCP,66,50060  >  443 [ACK] Seq=146700 Ack=6300 Win=66048 Len=0 SLE=6212 SRE=6300
358,30.9193013,172.20.40.110,151.101.194.187,TLSv1.3,2878,Application Data
359,30.9303094,172.20.40.110,151.101.194.187,TLSv1.3,2895,Application Data
360,30.9305014,151.101.194.187,172.20.40.110,TCP,60,443  >  50060 [ACK] Seq=6300 Ack=149524 Win=100352 Len=0
361,30.9354224,151.101.194.187,172.20.40.110,TLSv1.3,125,Application Data
362,30.9419415,151.101.194.187,172.20.40.110,TCP,60,443  >  50060 [ACK] Seq=6371 Ack=152365 Win=108544 Len=0
363,30.9466683,151.101.194.187,172.20.40.110,TLSv1.3,130,Application Data
364,30.9467464,172.20.40.110,151.101.194.187,TCP,54,50060  >  443 [ACK] Seq=152365 Ack=6447 Win=65792 Len=0
365,31.1096183,172.20.40.110,151.101.194.187,TLSv1.3,2894,Application Data
366,31.1098676,172.20.40.110,151.101.194.187,TLSv1.3,2884,Application Data
367,31.1100445,172.20.40.110,151.101.194.187,TLSv1.3,2881,Application Data
368,31.1101744,172.20.40.110,151.101.194.187,TLSv1.3,2878,Application Data
369,31.1103939,172.20.40.110,151.101.194.187,TLSv1.3,2882,Application Data
370,31.1115799,172.20.40.110,151.101.194.187,TLSv1.3,2884,Application Data
371,31.1118562,172.20.40.110,151.101.194.187,TLSv1.3,2880,Application Data
372,31.1140112,172.20.40.110,151.101.194.187,TLSv1.3,2883,Application Data
373,31.1273211,151.101.194.187,172.20.40.110,TCP,60,443  >  50060 [ACK] Seq=6447 Ack=155205 Win=114176 Len=0
374,31.1273211,151.101.194.187,172.20.40.110,TCP,60,443  >  50060 [ACK] Seq=6447 Ack=158035 Win=119808 Len=0
375,31.1273211,151.101.194.187,172.20.40.110,TCP,60,443  >  50060 [ACK] Seq=6447 Ack=160862 Win=125440 Len=0
376,31.1301674,151.101.194.187,172.20.40.110,TCP,60,443  >  50060 [ACK] Seq=6447 Ack=163686 Win=131072 Len=0
377,31.1301674,151.101.194.187,172.20.40.110,TCP,60,443  >  50060 [ACK] Seq=6447 Ack=166514 Win=136704 Len=0
378,31.1301674,151.101.194.187,172.20.40.110,TCP,60,443  >  50060 [ACK] Seq=6447 Ack=169344 Win=142336 Len=0
379,31.1315137,151.101.194.187,172.20.40.110,TLSv1.3,290,Application Data
380,31.1315137,151.101.194.187,172.20.40.110,TLSv1.3,157,Application Data
381,31.1315949,172.20.40.110,151.101.194.187,TCP,54,50060  >  443 [ACK] Seq=174999 Ack=6786 Win=65536 Len=0
382,31.1334673,151.101.194.187,172.20.40.110,TCP,60,443  >  50060 [ACK] Seq=6786 Ack=172170 Win=147968 Len=0
383,31.1334673,151.101.194.187,172.20.40.110,TCP,60,443  >  50060 [ACK] Seq=6786 Ack=174999 Win=154112 Len=0
384,31.1356379,151.101.194.187,172.20.40.110,TLSv1.3,125,Application Data
385,31.1378366,151.101.194.187,172.20.40.110,TLSv1.3,130,Application Data
386,31.1378366,151.101.194.187,172.20.40.110,TLSv1.3,124,Application Data
387,31.1379757,172.20.40.110,151.101.194.187,TCP,54,50060  >  443 [ACK] Seq=174999 Ack=7003 Win=65280 Len=0
388,31.1389066,151.101.194.187,172.20.40.110,TLSv1.3,124,Application Data
389,31.138972,172.20.40.110,151.101.194.187,TCP,54,50060  >  443 [ACK] Seq=174999 Ack=7073 Win=65280 Len=0
390,31.1400144,151.101.194.187,172.20.40.110,TLSv1.3,124,Application Data
391,31.1815268,172.20.40.110,151.101.194.187,TCP,54,50060  >  443 [ACK] Seq=174999 Ack=7143 Win=65024 Len=0
392,31.184511,151.101.194.187,172.20.40.110,TCP,124,"[TCP Spurious Retransmission] 443  >  50060 [PSH, ACK] Seq=7073 Ack=174999 Win=154112 Len=70"
393,31.1846049,172.20.40.110,151.101.194.187,TCP,66,[TCP Dup ACK 391#1] 50060  >  443 [ACK] Seq=174999 Ack=7143 Win=65024 Len=0 SLE=7073 SRE=7143
394,31.3811346,172.20.40.110,151.101.194.187,TLSv1.3,2885,Application Data
395,31.3820778,172.20.40.110,151.101.194.187,TLSv1.3,2887,Application Data
396,31.3959434,151.101.194.187,172.20.40.110,TCP,60,443  >  50060 [ACK] Seq=7143 Ack=177830 Win=159744 Len=0
397,31.3959434,151.101.194.187,172.20.40.110,TCP,60,443  >  50060 [ACK] Seq=7143 Ack=180663 Win=165376 Len=0
398,31.4049743,151.101.194.187,172.20.40.110,TLSv1.3,130,Application Data
399,31.4049743,151.101.194.187,172.20.40.110,TLSv1.3,240,Application Data
400,31.4050595,172.20.40.110,151.101.194.187,TCP,54,50060  >  443 [ACK] Seq=180663 Ack=7405 Win=64768 Len=0
401,33.0653614,172.20.40.110,151.101.194.187,TLSv1.3,2917,Application Data
402,33.0661688,172.20.40.110,151.101.194.187,TLSv1.3,2918,Application Data
403,33.0884973,151.101.194.187,172.20.40.110,TCP,60,443  >  50060 [ACK] Seq=7405 Ack=183526 Win=171008 Len=0
404,33.0884973,151.101.194.187,172.20.40.110,TCP,60,443  >  50060 [ACK] Seq=7405 Ack=186390 Win=176640 Len=0
405,33.0884973,151.101.194.187,172.20.40.110,TLSv1.3,241,Application Data
406,33.0885784,172.20.40.110,151.101.194.187,TCP,54,50060  >  443 [ACK] Seq=186390 Ack=7592 Win=66048 Len=0
407,33.0898359,151.101.194.187,172.20.40.110,TLSv1.3,125,Application Data
408,33.0898917,172.20.40.110,151.101.194.187,TCP,54,50060  >  443 [ACK] Seq=186390 Ack=7663 Win=66048 Len=0
409,38.1502953,172.20.40.110,151.101.194.187,TLSv1.3,2917,Application Data
410,38.1584345,151.101.194.187,172.20.40.110,TCP,60,443  >  50060 [ACK] Seq=7663 Ack=189253 Win=182272 Len=0
411,38.1647321,151.101.194.187,172.20.40.110,TLSv1.3,214,Application Data
412,38.1881274,151.101.194.187,172.20.40.110,TCP,214,"[TCP Retransmission] 443  >  50060 [PSH, ACK] Seq=7663 Ack=189253 Win=182272 Len=160"
413,38.1883827,172.20.40.110,151.101.194.187,TCP,66,50060  >  443 [ACK] Seq=189253 Ack=7823 Win=65792 Len=0 SLE=7663 SRE=7823
414,38.1963171,172.20.40.110,151.101.194.187,TLSv1.3,2915,Application Data
415,38.2046715,151.101.194.187,172.20.40.110,TCP,60,443  >  50060 [ACK] Seq=7823 Ack=192114 Win=187904 Len=0
416,38.2086606,151.101.194.187,172.20.40.110,TLSv1.3,341,Application Data
417,38.2331777,172.20.40.110,151.101.194.187,TLSv1.3,2918,Application Data
418,38.2353517,151.101.194.187,172.20.40.110,TCP,341,"[TCP Spurious Retransmission] 443  >  50060 [PSH, ACK] Seq=7823 Ack=192114 Win=187904 Len=287"
419,38.2354767,172.20.40.110,151.101.194.187,TCP,66,[TCP Dup ACK 417#1] 50060  >  443 [ACK] Seq=194978 Ack=8110 Win=65536 Len=0 SLE=7823 SRE=8110
420,38.2417888,151.101.194.187,172.20.40.110,TCP,60,443  >  50060 [ACK] Seq=8110 Ack=194978 Win=194048 Len=0
421,38.2505221,151.101.194.187,172.20.40.110,TLSv1.3,98,Application Data
422,38.2746665,151.101.194.187,172.20.40.110,TCP,98,"[TCP Retransmission] 443  >  50060 [PSH, ACK] Seq=8110 Ack=194978 Win=194048 Len=44"
423,38.2747251,172.20.40.110,151.101.194.187,TCP,66,50060  >  443 [ACK] Seq=194978 Ack=8154 Win=65536 Len=0 SLE=8110 SRE=8154
424,38.3277198,172.20.40.110,151.101.194.187,TLSv1.3,2905,Application Data
425,38.3279685,172.20.40.110,151.101.194.187,TLSv1.3,2917,Application Data
426,38.341388,151.101.194.187,172.20.40.110,TCP,60,443  >  50060 [ACK] Seq=8154 Ack=197829 Win=199680 Len=0
427,38.341388,151.101.194.187,172.20.40.110,TCP,60,443  >  50060 [ACK] Seq=8154 Ack=200692 Win=205312 Len=0
428,38.3462672,151.101.194.187,172.20.40.110,TLSv1.3,130,Application Data
429,38.3462672,151.101.194.187,172.20.40.110,TLSv1.3,104,Application Data
430,38.3463617,172.20.40.110,151.101.194.187,TCP,54,50060  >  443 [ACK] Seq=200692 Ack=8280 Win=65536 Len=0
431,39.903624,172.20.40.110,151.101.194.187,TLSv1.3,2917,Application Data
432,39.9146015,151.101.194.187,172.20.40.110,TCP,60,443  >  50060 [ACK] Seq=8280 Ack=203555 Win=210944 Len=0
433,39.9151458,151.101.194.187,172.20.40.110,TLSv1.3,214,Application Data
434,39.9310498,172.20.40.110,151.101.194.187,TLSv1.3,2915,Application Data
435,39.9408359,151.101.194.187,172.20.40.110,TCP,60,443  >  50060 [ACK] Seq=8440 Ack=206416 Win=217088 Len=0
436,39.944607,151.101.194.187,172.20.40.110,TLSv1.3,98,Application Data
437,39.9615362,172.20.40.110,151.101.194.187,TLSv1.3,2918,Application Data
438,39.9720326,151.101.194.187,172.20.40.110,TCP,60,443  >  50060 [ACK] Seq=8484 Ack=209280 Win=222720 Len=0
439,39.973095,151.101.194.187,172.20.40.110,TLSv1.3,98,Application Data
440,40.0059873,151.101.194.187,172.20.40.110,TCP,98,"[TCP Retransmission] 443  >  50060 [PSH, ACK] Seq=8484 Ack=209280 Win=222720 Len=44"
441,40.0060567,172.20.40.110,151.101.194.187,TCP,66,50060  >  443 [ACK] Seq=209280 Ack=8528 Win=65280 Len=0 SLE=8484 SRE=8528
442,40.3699726,172.20.40.110,151.101.194.187,TLSv1.3,2920,Application Data
443,40.3704567,172.20.40.110,151.101.194.187,TLSv1.3,2909,Application Data
444,40.3857001,151.101.194.187,172.20.40.110,TCP,60,443  >  50060 [ACK] Seq=8528 Ack=212146 Win=228352 Len=0
445,40.3857001,151.101.194.187,172.20.40.110,TCP,60,443  >  50060 [ACK] Seq=8528 Ack=215001 Win=233984 Len=0
446,40.3864139,151.101.194.187,172.20.40.110,TLSv1.3,104,Application Data
447,40.3884566,151.101.194.187,172.20.40.110,TLSv1.3,130,Application Data
448,40.388542,172.20.40.110,151.101.194.187,TCP,54,50060  >  443 [ACK] Seq=215001 Ack=8654 Win=65024 Len=0
449,43.1179319,172.20.40.110,151.101.194.187,TLSv1.3,2898,Application Data
450,43.1269793,172.20.40.110,151.101.194.187,TLSv1.3,2889,Application Data
451,43.1276596,172.20.40.110,151.101.194.187,TLSv1.3,2883,Application Data
452,43.1302426,172.20.40.110,151.101.194.187,TLSv1.3,2883,Application Data
453,43.1345267,151.101.194.187,172.20.40.110,TCP,60,443  >  50060 [ACK] Seq=8654 Ack=217845 Win=239616 Len=0
454,43.1470787,151.101.194.187,172.20.40.110,TLSv1.3,214,Application Data
455,43.1470787,151.101.194.187,172.20.40.110,TCP,60,443  >  50060 [ACK] Seq=8814 Ack=220680 Win=245248 Len=0
456,43.1470787,151.101.194.187,172.20.40.110,TCP,60,443  >  50060 [ACK] Seq=8814 Ack=223509 Win=250880 Len=0
457,43.1470787,151.101.194.187,172.20.40.110,TCP,60,443  >  50060 [ACK] Seq=8814 Ack=226338 Win=256512 Len=0
458,43.1470787,151.101.194.187,172.20.40.110,TLSv1.3,124,Application Data
459,43.1470787,151.101.194.187,172.20.40.110,TLSv1.3,130,Application Data
460,43.1472066,172.20.40.110,151.101.194.187,TCP,54,50060  >  443 [ACK] Seq=226338 Ack=8960 Win=64768 Len=0
461,43.1481231,151.101.194.187,172.20.40.110,TLSv1.3,131,Application Data
462,43.1482014,172.20.40.110,151.101.194.187,TCP,54,50060  >  443 [ACK] Seq=226338 Ack=9037 Win=66048 Len=0
463,43.1772639,172.20.40.110,151.101.194.187,TLSv1.3,2883,Application Data
464,43.1911424,151.101.194.187,172.20.40.110,TCP,60,443  >  50060 [ACK] Seq=9037 Ack=229167 Win=262144 Len=0
465,43.1989775,151.101.194.187,172.20.40.110,TLSv1.3,130,Application Data
466,43.2235712,151.101.194.187,172.20.40.110,TCP,130,"[TCP Retransmission] 443  >  50060 [PSH, ACK] Seq=9037 Ack=229167 Win=262144 Len=76"
467,43.2236313,172.20.40.110,151.101.194.187,TCP,66,50060  >  443 [ACK] Seq=229167 Ack=9113 Win=66048 Len=0 SLE=9037 SRE=9113
468,43.3298299,172.20.40.110,151.101.194.187,TLSv1.3,2880,Application Data
469,43.342714,151.101.194.187,172.20.40.110,TCP,60,443  >  50060 [ACK] Seq=9113 Ack=231993 Win=267776 Len=0
470,43.3433102,172.20.40.110,151.101.194.187,TLSv1.3,2897,Application Data
471,43.3475298,151.101.194.187,172.20.40.110,TLSv1.3,125,Application Data
472,43.3539881,151.101.194.187,172.20.40.110,TCP,60,443  >  50060 [ACK] Seq=9184 Ack=234836 Win=273920 Len=0
473,43.3591412,151.101.194.187,172.20.40.110,TLSv1.3,130,Application Data
474,43.3592177,172.20.40.110,151.101.194.187,TCP,54,50060  >  443 [ACK] Seq=234836 Ack=9260 Win=65792 Len=0
475,43.3659099,172.20.40.110,151.101.194.187,TLSv1.3,2897,Application Data
476,43.376606,151.101.194.187,172.20.40.110,TCP,60,443  >  50060 [ACK] Seq=9260 Ack=237679 Win=279552 Len=0
477,43.378703,151.101.194.187,172.20.40.110,TLSv1.3,125,Application Data
478,43.4141474,151.101.194.187,172.20.40.110,TCP,125,"[TCP Retransmission] 443  >  50060 [PSH, ACK] Seq=9260 Ack=237679 Win=279552 Len=71"
479,43.414195,172.20.40.110,151.101.194.187,TCP,66,50060  >  443 [ACK] Seq=237679 Ack=9331 Win=65792 Len=0 SLE=9260 SRE=9331
480,43.5039185,172.20.40.110,151.101.194.187,TLSv1.3,2883,Application Data
481,43.5041846,172.20.40.110,151.101.194.187,TLSv1.3,2885,Application Data
482,43.5146674,151.101.194.187,172.20.40.110,TCP,60,443  >  50060 [ACK] Seq=9331 Ack=240508 Win=285184 Len=0
483,43.5146674,151.101.194.187,172.20.40.110,TCP,60,443  >  50060 [ACK] Seq=9331 Ack=243339 Win=290816 Len=0
484,43.5187221,151.101.194.187,172.20.40.110,TLSv1.3,450,Application Data
485,43.5200278,151.101.194.187,172.20.40.110,TLSv1.3,130,Application Data
486,43.5201087,172.20.40.110,151.101.194.187,TCP,54,50060  >  443 [ACK] Seq=243339 Ack=9803 Win=65280 Len=0
487,43.7497208,172.20.40.110,151.101.194.187,TLSv1.3,2889,Application Data
488,43.7500438,172.20.40.110,151.101.194.187,TLSv1.3,2886,Application Data
489,43.7507371,172.20.40.110,151.101.194.187,TLSv1.3,2883,Application Data
490,43.7575319,172.20.40.110,151.101.194.187,TLSv1.3,2887,Application Data
491,43.7635935,172.20.40.110,151.101.194.187,TLSv1.3,2889,Application Data
492,43.7664472,172.20.40.110,151.101.194.187,TLSv1.3,2885,Application Data
493,43.7686378,172.20.40.110,151.101.194.187,TLSv1.3,2888,Application Data
494,43.7741768,151.101.194.187,172.20.40.110,TCP,60,443  >  50060 [ACK] Seq=9803 Ack=244719 Win=293376 Len=0
495,43.779394,151.101.194.187,172.20.40.110,TCP,60,443  >  50060 [ACK] Seq=9803 Ack=246174 Win=296448 Len=0
496,43.779394,151.101.194.187,172.20.40.110,TCP,60,443  >  50060 [ACK] Seq=9803 Ack=249006 Win=302080 Len=0
497,43.7806748,151.101.194.187,172.20.40.110,TLSv1.3,130,Application Data
498,43.7806748,151.101.194.187,172.20.40.110,TCP,60,443  >  50060 [ACK] Seq=9879 Ack=251835 Win=307712 Len=0
499,43.7830781,151.101.194.187,172.20.40.110,TLSv1.3,129,Application Data
500,43.7830781,151.101.194.187,172.20.40.110,TLSv1.3,130,Application Data
501,43.783152,172.20.40.110,151.101.194.187,TCP,54,50060  >  443 [ACK] Seq=263168 Ack=10030 Win=65024 Len=0
502,43.7865276,151.101.194.187,172.20.40.110,TCP,60,443  >  50060 [ACK] Seq=10030 Ack=254668 Win=313344 Len=0
503,43.7865276,151.101.194.187,172.20.40.110,TCP,60,443  >  50060 [ACK] Seq=10030 Ack=257503 Win=318976 Len=0
504,43.7865276,151.101.194.187,172.20.40.110,TCP,60,443  >  50060 [ACK] Seq=10030 Ack=260334 Win=324608 Len=0
505,43.7865276,151.101.194.187,172.20.40.110,TCP,60,443  >  50060 [ACK] Seq=10030 Ack=263168 Win=330752 Len=0
506,43.7886461,151.101.194.187,172.20.40.110,TLSv1.3,194,"Application Data, Application Data"
507,43.7887213,172.20.40.110,151.101.194.187,TCP,54,50060  >  443 [ACK] Seq=263168 Ack=10170 Win=65024 Len=0
508,43.7908364,151.101.194.187,172.20.40.110,TLSv1.3,124,Application Data
509,43.7908364,151.101.194.187,172.20.40.110,TLSv1.3,125,Application Data
510,43.7909227,172.20.40.110,151.101.194.187,TCP,54,50060  >  443 [ACK] Seq=263168 Ack=10311 Win=64768 Len=0
511,50.6243892,172.20.40.110,151.101.194.187,TLSv1.3,2866,Application Data
512,50.6415562,151.101.194.187,172.20.40.110,TCP,60,443  >  50060 [ACK] Seq=10311 Ack=265980 Win=336384 Len=0
513,50.6457949,172.20.40.110,151.101.194.187,TLSv1.3,2865,Application Data
514,50.6493813,151.101.194.187,172.20.40.110,TLSv1.3,241,Application Data
515,50.6494889,172.20.40.110,151.101.194.187,TCP,54,50060  >  443 [ACK] Seq=268791 Ack=10498 Win=66048 Len=0
516,50.6582944,151.101.194.187,172.20.40.110,TCP,60,443  >  50060 [ACK] Seq=10498 Ack=268791 Win=342016 Len=0
517,50.662365,151.101.194.187,172.20.40.110,TLSv1.3,98,Application Data
518,50.66244,172.20.40.110,151.101.194.187,TCP,54,50060  >  443 [ACK] Seq=268791 Ack=10542 Win=66048 Len=0
519,51.8211966,172.20.40.110,151.101.194.187,TLSv1.3,2865,Application Data
520,51.8220063,172.20.40.110,151.101.194.187,TLSv1.3,2853,Application Data
521,51.8263576,172.20.40.110,151.101.194.187,TLSv1.3,2847,Application Data
522,51.8309493,172.20.40.110,151.101.194.187,TLSv1.3,2866,Application Data
523,51.8363255,151.101.194.187,172.20.40.110,TCP,60,443  >  50060 [ACK] Seq=10542 Ack=271602 Win=347136 Len=0
524,51.8363255,151.101.194.187,172.20.40.110,TCP,60,443  >  50060 [ACK] Seq=10542 Ack=274401 Win=352768 Len=0
525,51.8397138,151.101.194.187,172.20.40.110,TCP,60,443  >  50060 [ACK] Seq=10542 Ack=277194 Win=358400 Len=0
526,51.8397138,151.101.194.187,172.20.40.110,TLSv1.3,214,Application Data
527,51.8408483,151.101.194.187,172.20.40.110,TLSv1.3,130,Application Data
528,51.8408483,151.101.194.187,172.20.40.110,TCP,60,443  >  50060 [ACK] Seq=10778 Ack=280006 Win=364544 Len=0
529,51.8409719,172.20.40.110,151.101.194.187,TCP,54,50060  >  443 [ACK] Seq=280006 Ack=10778 Win=65792 Len=0
530,51.842462,151.101.194.187,172.20.40.110,TLSv1.3,179,Application Data
531,51.8432472,151.101.194.187,172.20.40.110,TLSv1.3,98,Application Data
532,51.8433207,172.20.40.110,151.101.194.187,TCP,54,50060  >  443 [ACK] Seq=280006 Ack=10947 Win=65536 Len=0
533,51.9624206,172.20.40.110,151.101.194.187,TLSv1.3,2869,Application Data
534,51.9739581,172.20.40.110,151.101.194.187,TLSv1.3,2849,Application Data
535,51.9740978,151.101.194.187,172.20.40.110,TCP,60,443  >  50060 [ACK] Seq=10947 Ack=282766 Win=370176 Len=0
536,51.9765574,151.101.194.187,172.20.40.110,TCP,60,443  >  50060 [ACK] Seq=10947 Ack=282821 Win=370176 Len=0
537,51.9802469,151.101.194.187,172.20.40.110,TLSv1.3,291,Application Data
538,51.9826429,151.101.194.187,172.20.40.110,TCP,60,443  >  50060 [ACK] Seq=11184 Ack=285616 Win=375808 Len=0
539,51.9859066,151.101.194.187,172.20.40.110,TLSv1.3,125,Application Data
540,51.9859864,172.20.40.110,151.101.194.187,TCP,54,50060  >  443 [ACK] Seq=285616 Ack=11255 Win=65280 Len=0
541,52.0444456,172.20.40.110,151.101.194.187,TLSv1.3,2854,Application Data
542,52.0446056,172.20.40.110,151.101.194.187,TLSv1.3,2851,Application Data
543,52.0446915,172.20.40.110,151.101.194.187,TLSv1.3,2857,Application Data
544,52.0464342,172.20.40.110,151.101.194.187,TLSv1.3,2848,Application Data
545,52.0536328,151.101.194.187,172.20.40.110,TCP,60,443  >  50060 [ACK] Seq=11255 Ack=288416 Win=381440 Len=0
546,52.0594003,151.101.194.187,172.20.40.110,TLSv1.3,103,Application Data
547,52.0603363,151.101.194.187,172.20.40.110,TCP,60,443  >  50060 [ACK] Seq=11304 Ack=291213 Win=387072 Len=0
548,52.0603363,151.101.194.187,172.20.40.110,TCP,60,443  >  50060 [ACK] Seq=11304 Ack=294016 Win=392704 Len=0
549,52.0603363,151.101.194.187,172.20.40.110,TCP,60,443  >  50060 [ACK] Seq=11304 Ack=296810 Win=398336 Len=0
550,52.0650882,151.101.194.187,172.20.40.110,TLSv1.3,206,Application Data
551,52.0651606,172.20.40.110,151.101.194.187,TCP,54,50060  >  443 [ACK] Seq=296810 Ack=11456 Win=65280 Len=0
552,52.1507923,172.20.40.110,151.101.194.187,TLSv1.3,2868,Application Data
553,52.1602732,151.101.194.187,172.20.40.110,TCP,60,443  >  50060 [ACK] Seq=11456 Ack=299624 Win=403968 Len=0
554,52.1659346,151.101.194.187,172.20.40.110,TLSv1.3,130,Application Data
555,52.193614,151.101.194.187,172.20.40.110,TCP,130,"[TCP Retransmission] 443  >  50060 [PSH, ACK] Seq=11456 Ack=299624 Win=403968 Len=76"
556,52.1936792,172.20.40.110,151.101.194.187,TCP,66,50060  >  443 [ACK] Seq=299624 Ack=11532 Win=65024 Len=0 SLE=11456 SRE=11532
557,52.5553644,172.20.40.110,151.101.194.187,TLSv1.3,2841,Application Data
558,52.5616323,172.20.40.110,151.101.194.187,TLSv1.3,2841,Application Data
559,52.5663954,151.101.194.187,172.20.40.110,TCP,60,443  >  50060 [ACK] Seq=11532 Ack=302411 Win=409600 Len=0
560,52.5691707,151.101.194.187,172.20.40.110,TLSv1.3,235,Application Data
561,52.5714151,151.101.194.187,172.20.40.110,TCP,60,443  >  50060 [ACK] Seq=11713 Ack=305198 Win=414720 Len=0
562,52.5761193,151.101.194.187,172.20.40.110,TLSv1.3,131,Application Data
563,52.5762144,172.20.40.110,151.101.194.187,TCP,54,50060  >  443 [ACK] Seq=305198 Ack=11790 Win=64768 Len=0
564,52.6365928,172.20.40.110,151.101.194.187,TLSv1.3,2843,Application Data
565,52.6370013,172.20.40.110,151.101.194.187,TLSv1.3,2854,Application Data
566,52.645733,151.101.194.187,172.20.40.110,TCP,60,443  >  50060 [ACK] Seq=11790 Ack=307987 Win=420352 Len=0
567,52.6492892,151.101.194.187,172.20.40.110,TCP,60,443  >  50060 [ACK] Seq=11790 Ack=310787 Win=425984 Len=0
568,52.6505709,151.101.194.187,172.20.40.110,TLSv1.3,98,Application Data
569,52.6533176,151.101.194.187,172.20.40.110,TLSv1.3,124,Application Data
570,52.6534139,172.20.40.110,151.101.194.187,TCP,54,50060  >  443 [ACK] Seq=310787 Ack=11904 Win=66048 Len=0
571,52.8692643,172.20.40.110,151.101.194.187,TLSv1.3,2855,Application Data
572,52.8731926,172.20.40.110,151.101.194.187,TLSv1.3,2853,Application Data
573,52.8804796,151.101.194.187,172.20.40.110,TCP,60,443  >  50060 [ACK] Seq=11904 Ack=313588 Win=431616 Len=0
574,52.8834096,151.101.194.187,172.20.40.110,TCP,60,443  >  50060 [ACK] Seq=11904 Ack=316387 Win=437248 Len=0
575,52.8846076,151.101.194.187,172.20.40.110,TLSv1.3,125,Application Data
576,52.8869833,151.101.194.187,172.20.40.110,TLSv1.3,125,Application Data
577,52.887056,172.20.40.110,151.101.194.187,TCP,54,50060  >  443 [ACK] Seq=316387 Ack=12046 Win=66048 Len=0
578,53.0428449,172.20.40.110,151.101.194.187,TLSv1.3,2856,Application Data
579,53.0536882,151.101.194.187,172.20.40.110,TCP,60,443  >  50060 [ACK] Seq=12046 Ack=319189 Win=442880 Len=0
580,53.0582299,151.101.194.187,172.20.40.110,TLSv1.3,125,Application Data
581,53.0841629,151.101.194.187,172.20.40.110,TCP,125,"[TCP Retransmission] 443  >  50060 [PSH, ACK] Seq=12046 Ack=319189 Win=442880 Len=71"
582,53.0842153,172.20.40.110,151.101.194.187,TCP,66,50060  >  443 [ACK] Seq=319189 Ack=12117 Win=65792 Len=0 SLE=12046 SRE=12117
583,53.3196616,172.20.40.110,151.101.194.187,TLSv1.3,2890,Application Data
584,53.3319213,151.101.194.187,172.20.40.110,TCP,60,443  >  50060 [ACK] Seq=12117 Ack=322025 Win=448512 Len=0
585,53.3332802,151.101.194.187,172.20.40.110,TLSv1.3,129,Application Data
586,53.3615401,151.101.194.187,172.20.40.110,TCP,129,"[TCP Retransmission] 443  >  50060 [PSH, ACK] Seq=12117 Ack=322025 Win=448512 Len=75"
587,53.3616054,172.20.40.110,151.101.194.187,TCP,66,50060  >  443 [ACK] Seq=322025 Ack=12192 Win=65792 Len=0 SLE=12117 SRE=12192
588,53.3656077,172.20.40.110,151.101.194.187,TLSv1.3,2847,Application Data
589,53.3680596,172.20.40.110,151.101.194.187,TLSv1.3,2858,Application Data
590,53.3759281,151.101.194.187,172.20.40.110,TCP,60,443  >  50060 [ACK] Seq=12192 Ack=324818 Win=454144 Len=0
591,53.3815969,151.101.194.187,172.20.40.110,TLSv1.3,104,Application Data
592,53.3847787,151.101.194.187,172.20.40.110,TCP,60,443  >  50060 [ACK] Seq=12242 Ack=327622 Win=459776 Len=0
593,53.3858773,151.101.194.187,172.20.40.110,TLSv1.3,104,Application Data
594,53.385983,172.20.40.110,151.101.194.187,TCP,54,50060  >  443 [ACK] Seq=327622 Ack=12292 Win=65792 Len=0
595,56.1046874,172.20.40.110,151.101.194.187,TLSv1.3,2880,Application Data
596,56.116662,151.101.194.187,172.20.40.110,TCP,60,443  >  50060 [ACK] Seq=12292 Ack=330448 Win=465408 Len=0
597,56.1201151,151.101.194.187,172.20.40.110,TLSv1.3,258,Application Data
598,56.1472154,151.101.194.187,172.20.40.110,TCP,258,"[TCP Retransmission] 443  >  50060 [PSH, ACK] Seq=12292 Ack=330448 Win=465408 Len=204"
599,56.1472789,172.20.40.110,151.101.194.187,TCP,66,50060  >  443 [ACK] Seq=330448 Ack=12496 Win=65536 Len=0 SLE=12292 SRE=12496
600,56.1536523,172.20.40.110,151.101.194.187,TLSv1.3,2879,Application Data
601,56.1626726,151.101.194.187,172.20.40.110,TCP,60,443  >  50060 [ACK] Seq=12496 Ack=333273 Win=471040 Len=0
602,56.1667313,151.101.194.187,172.20.40.110,TLSv1.3,103,Application Data
603,56.192405,151.101.194.187,172.20.40.110,TCP,103,"[TCP Retransmission] 443  >  50060 [PSH, ACK] Seq=12496 Ack=333273 Win=471040 Len=49"
604,56.1924691,172.20.40.110,151.101.194.187,TCP,66,50060  >  443 [ACK] Seq=333273 Ack=12545 Win=65536 Len=0 SLE=12496 SRE=12545
605,56.2214519,172.20.40.110,151.101.194.187,TLSv1.3,2877,Application Data
606,56.2308995,151.101.194.187,172.20.40.110,TCP,60,443  >  50060 [ACK] Seq=12545 Ack=336096 Win=476672 Len=0
607,56.233193,151.101.194.187,172.20.40.110,TLSv1.3,265,Application Data
608,56.2625671,151.101.194.187,172.20.40.110,TCP,265,"[TCP Retransmission] 443  >  50060 [PSH, ACK] Seq=12545 Ack=336096 Win=476672 Len=211"
609,56.2626789,172.20.40.110,151.101.194.187,TCP,66,50060  >  443 [ACK] Seq=336096 Ack=12756 Win=65280 Len=0 SLE=12545 SRE=12756
610,56.6720391,172.20.40.110,151.101.194.187,TLSv1.3,2867,Application Data
611,56.6722896,172.20.40.110,151.101.194.187,TLSv1.3,2878,Application Data
612,56.6725791,172.20.40.110,151.101.194.187,TLSv1.3,2879,Application Data
613,56.6879317,151.101.194.187,172.20.40.110,TCP,60,443  >  50060 [ACK] Seq=12756 Ack=338909 Win=482304 Len=0
614,56.6891091,151.101.194.187,172.20.40.110,TCP,60,443  >  50060 [ACK] Seq=12756 Ack=341733 Win=487936 Len=0
615,56.6891091,151.101.194.187,172.20.40.110,TCP,60,443  >  50060 [ACK] Seq=12756 Ack=344558 Win=494080 Len=0
616,56.6891091,151.101.194.187,172.20.40.110,TLSv1.3,214,Application Data
617,56.6911937,151.101.194.187,172.20.40.110,TLSv1.3,98,Application Data
618,56.6912731,172.20.40.110,151.101.194.187,TCP,54,50060  >  443 [ACK] Seq=344558 Ack=12960 Win=65024 Len=0
619,56.6926016,151.101.194.187,172.20.40.110,TLSv1.3,104,Application Data
620,56.7251717,151.101.194.187,172.20.40.110,TCP,104,"[TCP Retransmission] 443  >  50060 [PSH, ACK] Seq=12960 Ack=344558 Win=494080 Len=50"
621,56.7252595,172.20.40.110,151.101.194.187,TCP,66,50060  >  443 [ACK] Seq=344558 Ack=13010 Win=65024 Len=0 SLE=12960 SRE=13010
622,57.8816898,172.20.40.110,151.101.194.187,TLSv1.3,2879,Application Data
623,57.8820164,172.20.40.110,151.101.194.187,TLSv1.3,2867,Application Data
624,57.8823522,172.20.40.110,151.101.194.187,TLSv1.3,2861,Application Data
625,57.8995392,172.20.40.110,151.101.194.187,TLSv1.3,2880,Application Data
626,57.9006859,172.20.40.110,151.101.194.187,TLSv1.3,2862,Application Data
627,57.9083824,151.101.194.187,172.20.40.110,TCP,60,443  >  50060 [ACK] Seq=13010 Ack=347383 Win=499712 Len=0
628,57.9083824,151.101.194.187,172.20.40.110,TCP,60,443  >  50060 [ACK] Seq=13010 Ack=350196 Win=505344 Len=0
629,57.9083824,151.101.194.187,172.20.40.110,TCP,60,443  >  50060 [ACK] Seq=13010 Ack=353003 Win=510464 Len=0
630,57.9111732,151.101.194.187,172.20.40.110,TLSv1.3,214,Application Data
631,57.9126176,151.101.194.187,172.20.40.110,TLSv1.3,130,Application Data
632,57.9126176,151.101.194.187,172.20.40.110,TCP,60,443  >  50060 [ACK] Seq=13246 Ack=355763 Win=516096 Len=0
633,57.9128469,172.20.40.110,151.101.194.187,TCP,54,50060  >  443 [ACK] Seq=358637 Ack=13246 Win=64768 Len=0
634,57.9139012,151.101.194.187,172.20.40.110,TLSv1.3,130,Application Data
635,57.9139834,172.20.40.110,151.101.194.187,TCP,54,50060  >  443 [ACK] Seq=358637 Ack=13322 Win=66048 Len=0
636,57.9152183,151.101.194.187,172.20.40.110,TCP,60,443  >  50060 [ACK] Seq=13322 Ack=355829 Win=516096 Len=0
637,57.9163641,151.101.194.187,172.20.40.110,TCP,60,443  >  50060 [ACK] Seq=13322 Ack=358637 Win=521728 Len=0
638,57.9195542,151.101.194.187,172.20.40.110,TLSv1.3,124,Application Data
639,57.9196298,172.20.40.110,151.101.194.187,TCP,54,50060  >  443 [ACK] Seq=358637 Ack=13392 Win=66048 Len=0
640,57.9209073,151.101.194.187,172.20.40.110,TLSv1.3,98,Application Data
641,57.9512835,151.101.194.187,172.20.40.110,TCP,98,"[TCP Retransmission] 443  >  50060 [PSH, ACK] Seq=13392 Ack=358637 Win=521728 Len=44"
642,57.9513423,172.20.40.110,151.101.194.187,TCP,66,50060  >  443 [ACK] Seq=358637 Ack=13436 Win=66048 Len=0 SLE=13392 SRE=13436
643,58.0297235,172.20.40.110,151.101.194.187,TLSv1.3,2883,Application Data
644,58.0404409,151.101.194.187,172.20.40.110,TCP,60,443  >  50060 [ACK] Seq=13436 Ack=361466 Win=527360 Len=0
645,58.0435008,172.20.40.110,151.101.194.187,TLSv1.3,2863,Application Data
646,58.047163,151.101.194.187,172.20.40.110,TLSv1.3,130,Application Data
647,58.0526576,151.101.194.187,172.20.40.110,TCP,60,443  >  50060 [ACK] Seq=13512 Ack=364275 Win=532992 Len=0
648,58.0564119,151.101.194.187,172.20.40.110,TLSv1.3,125,Application Data
649,58.0565227,172.20.40.110,151.101.194.187,TCP,54,50060  >  443 [ACK] Seq=364275 Ack=13583 Win=65792 Len=0
650,58.1955162,172.20.40.110,151.101.194.187,TLSv1.3,2871,Application Data
651,58.1999305,172.20.40.110,151.101.194.187,TLSv1.3,2849,Application Data
652,58.2006319,172.20.40.110,151.101.194.187,TLSv1.3,2852,Application Data
653,58.2010157,172.20.40.110,151.101.194.187,TLSv1.3,2846,Application Data
654,58.2032096,172.20.40.110,151.101.194.187,TLSv1.3,2843,Application Data
655,58.2063527,151.101.194.187,172.20.40.110,TCP,60,443  >  50060 [ACK] Seq=13583 Ack=367092 Win=538624 Len=0
656,58.2101149,151.101.194.187,172.20.40.110,TLSv1.3,130,Application Data
657,58.2111366,151.101.194.187,172.20.40.110,TCP,60,443  >  50060 [ACK] Seq=13659 Ack=369887 Win=544256 Len=0
658,58.2124044,151.101.194.187,172.20.40.110,TCP,60,443  >  50060 [ACK] Seq=13659 Ack=372685 Win=549888 Len=0
659,58.2124044,151.101.194.187,172.20.40.110,TCP,60,443  >  50060 [ACK] Seq=13659 Ack=375477 Win=555520 Len=0
660,58.2148009,151.101.194.187,172.20.40.110,TLSv1.3,129,Application Data
661,58.2148982,172.20.40.110,151.101.194.187,TCP,54,50060  >  443 [ACK] Seq=378266 Ack=13734 Win=65792 Len=0
662,58.2158412,151.101.194.187,172.20.40.110,TCP,60,443  >  50060 [ACK] Seq=13734 Ack=378266 Win=561152 Len=0
663,58.2190937,151.101.194.187,172.20.40.110,TLSv1.3,130,Application Data
664,58.2212576,151.101.194.187,172.20.40.110,TLSv1.3,227,Application Data
665,58.2213479,172.20.40.110,151.101.194.187,TCP,54,50060  >  443 [ACK] Seq=378266 Ack=13983 Win=65536 Len=0
666,58.5043739,172.20.40.110,151.101.194.187,TLSv1.3,2909,Application Data
667,58.5118089,172.20.40.110,151.101.194.187,TLSv1.3,2909,Application Data
668,58.5149734,151.101.194.187,172.20.40.110,TCP,60,443  >  50060 [ACK] Seq=13983 Ack=381121 Win=566784 Len=0
669,58.5196558,151.101.194.187,172.20.40.110,TLSv1.3,396,Application Data
670,58.5228937,151.101.194.187,172.20.40.110,TCP,60,443  >  50060 [ACK] Seq=14325 Ack=383976 Win=572416 Len=0
671,58.5251618,151.101.194.187,172.20.40.110,TLSv1.3,131,Application Data
672,58.5252342,172.20.40.110,151.101.194.187,TCP,54,50060  >  443 [ACK] Seq=383976 Ack=14402 Win=65024 Len=0
673,58.5720471,172.20.40.110,151.101.194.187,TLSv1.3,2921,Application Data
674,58.5808556,151.101.194.187,172.20.40.110,TCP,60,443  >  50060 [ACK] Seq=14402 Ack=386843 Win=578048 Len=0
675,58.5843345,151.101.194.187,172.20.40.110,TLSv1.3,125,Application Data
676,58.5908079,172.20.40.110,151.101.194.187,TLSv1.3,2911,Application Data
677,58.5995314,151.101.194.187,172.20.40.110,TCP,60,443  >  50060 [ACK] Seq=14473 Ack=389700 Win=584192 Len=0
678,58.6029667,151.101.194.187,172.20.40.110,TLSv1.3,98,Application Data
679,58.6322004,151.101.194.187,172.20.40.110,TCP,98,"[TCP Retransmission] 443  >  50060 [PSH, ACK] Seq=14473 Ack=389700 Win=584192 Len=44"
680,58.6322849,172.20.40.110,151.101.194.187,TCP,66,50060  >  443 [ACK] Seq=389700 Ack=14517 Win=65024 Len=0 SLE=14473 SRE=14517
681,58.85906,172.20.40.110,151.101.194.187,TLSv1.3,2926,Application Data
682,58.8600733,172.20.40.110,151.101.194.187,TLSv1.3,2927,Application Data
683,58.8712634,151.101.194.187,172.20.40.110,TCP,60,443  >  50060 [ACK] Seq=14517 Ack=392572 Win=589824 Len=0
684,58.8712634,151.101.194.187,172.20.40.110,TCP,60,443  >  50060 [ACK] Seq=14517 Ack=395445 Win=595456 Len=0
685,58.8778359,151.101.194.187,172.20.40.110,TLSv1.3,124,Application Data
686,58.8778359,151.101.194.187,172.20.40.110,TLSv1.3,130,Application Data
687,58.8779216,172.20.40.110,151.101.194.187,TCP,54,50060  >  443 [ACK] Seq=395445 Ack=14663 Win=64768 Len=0
