"No.","Time","Source","Destination","Protocol","Length","Info"
"1","0.000000000","172.20.40.110","151.101.66.187","TLSv1.2","2878","Application Data"
"2","0.000192900","172.20.40.110","151.101.66.187","TLSv1.2","93","Application Data"
"3","0.027168800","151.101.66.187","172.20.40.110","TCP","60","443  >  56337 [ACK] Seq=1 Ack=2825 Win=223 Len=0"
"4","0.027168800","151.101.66.187","172.20.40.110","TCP","60","443  >  56337 [ACK] Seq=1 Ack=2864 Win=223 Len=0"
"5","0.027168800","151.101.66.187","172.20.40.110","TLSv1.2","93","Application Data"
"6","0.027168800","151.101.66.187","172.20.40.110","TLSv1.2","241","Application Data"
"7","0.027494900","172.20.40.110","151.101.66.187","TCP","54","56337  >  443 [ACK] Seq=2864 Ack=227 Win=257 Len=0"
"8","0.498108700","172.20.40.110","151.101.66.187","TLSv1.2","2876","Application Data"
"9","0.521332400","151.101.66.187","172.20.40.110","TCP","60","443  >  56337 [ACK] Seq=227 Ack=5686 Win=218 Len=0"
"10","0.521332400","151.101.66.187","172.20.40.110","TLSv1.2","341","Application Data"
"11","0.522658400","172.20.40.110","151.101.66.187","TLSv1.2","2879","Application Data"
"12","0.534775900","151.101.66.187","172.20.40.110","TCP","60","443  >  56337 [ACK] Seq=514 Ack=8511 Win=213 Len=0"
"13","0.538245100","151.101.66.187","172.20.40.110","TLSv1.2","98","Application Data"
"14","0.581364900","172.20.40.110","151.101.66.187","TCP","54","56337  >  443 [ACK] Seq=8511 Ack=558 Win=256 Len=0"
"15","1.419362900","172.20.40.110","151.101.66.187","TLSv1.2","2864","Application Data"
"16","1.429210100","151.101.66.187","172.20.40.110","TCP","60","443  >  56337 [ACK] Seq=558 Ack=11321 Win=208 Len=0"
"17","1.431667100","151.101.66.187","172.20.40.110","TLSv1.2","234","Application Data"
"18","1.474823100","172.20.40.110","151.101.66.187","TCP","54","56337  >  443 [ACK] Seq=11321 Ack=738 Win=255 Len=0"
"19","1.536609200","172.20.40.110","151.101.66.187","TLSv1.2","2867","Application Data"
"20","1.551888400","151.101.66.187","172.20.40.110","TCP","60","443  >  56337 [ACK] Seq=738 Ack=12701 Win=206 Len=0"
"21","1.553810300","151.101.66.187","172.20.40.110","TCP","60","443  >  56337 [ACK] Seq=738 Ack=14134 Win=204 Len=0"
"22","1.557589000","151.101.66.187","172.20.40.110","TLSv1.2","130","Application Data"
"23","1.564092200","172.20.40.110","151.101.66.187","TLSv1.2","2869","Application Data"
"24","1.575973600","151.101.66.187","172.20.40.110","TCP","60","443  >  56337 [ACK] Seq=814 Ack=16949 Win=199 Len=0"
"25","1.581720200","151.101.66.187","172.20.40.110","TLSv1.2","124","Application Data"
"26","1.626839500","172.20.40.110","151.101.66.187","TCP","54","56337  >  443 [ACK] Seq=16949 Ack=884 Win=255 Len=0"
"27","2.262490900","172.20.40.110","151.101.66.187","TCP","54","56337  >  443 [FIN, ACK] Seq=16949 Ack=884 Win=255 Len=0"
"28","2.274357900","151.101.66.187","172.20.40.110","TCP","60","443  >  56337 [ACK] Seq=884 Ack=16950 Win=204 Len=0"
"29","2.274357900","151.101.66.187","172.20.40.110","TLSv1.2","78","Application Data"
"30","2.274357900","151.101.66.187","172.20.40.110","TCP","60","443  >  56337 [FIN, ACK] Seq=908 Ack=16950 Win=204 Len=0"
"31","2.274577400","172.20.40.110","151.101.66.187","TCP","54","56337  >  443 [RST, ACK] Seq=16950 Ack=908 Win=0 Len=0"
"32","3.327179900","151.101.2.187","172.20.40.110","TLSv1.2","105","Application Data"
"33","3.327179900","151.101.2.187","172.20.40.110","TLSv1.2","78","Application Data"
"34","3.327179900","151.101.2.187","172.20.40.110","TCP","60","443  >  65401 [FIN, ACK] Seq=76 Ack=1 Win=198 Len=0"
"35","3.365446800","151.101.2.187","172.20.40.110","TCP","60","[TCP Retransmission] 443  >  65401 [FIN, ACK] Seq=76 Ack=1 Win=198 Len=0"
"36","3.592250600","151.101.2.187","172.20.40.110","TCP","129","[TCP Retransmission] 443  >  65401 [FIN, PSH, ACK] Seq=1 Ack=1 Win=198 Len=75"
"37","4.029456800","151.101.2.187","172.20.40.110","TCP","129","[TCP Retransmission] 443  >  65401 [FIN, PSH, ACK] Seq=1 Ack=1 Win=198 Len=75"
"38","4.927925300","151.101.2.187","172.20.40.110","TCP","129","[TCP Retransmission] 443  >  65401 [FIN, PSH, ACK] Seq=1 Ack=1 Win=198 Len=75"
"39","5.197198500","172.20.40.110","151.101.130.187","TCP","66","52383  >  443 [SYN] Seq=0 Win=64240 Len=0 MSS=1460 WS=256 SACK_PERM"
"40","5.207633400","151.101.130.187","172.20.40.110","TCP","66","443  >  52383 [SYN, ACK] Seq=0 Ack=1 Win=65535 Len=0 MSS=1380 SACK_PERM WS=512"
"41","5.207953700","172.20.40.110","151.101.130.187","TCP","54","52383  >  443 [ACK] Seq=1 Ack=1 Win=131072 Len=0"
"42","5.209279400","172.20.40.110","151.101.130.187","TLSv1.3","2097","Client Hello (SNI=www.target.com)"
"43","5.230423100","151.101.130.187","172.20.40.110","TCP","60","443  >  52383 [ACK] Seq=1 Ack=2044 Win=144384 Len=0"
"44","5.230423100","151.101.130.187","172.20.40.110","TLSv1.3","1434","Server Hello, Change Cipher Spec, Application Data, Application Data"
"45","5.230423100","151.101.130.187","172.20.40.110","TLSv1.3","215","Application Data"
"46","5.230511300","172.20.40.110","151.101.130.187","TCP","54","52383  >  443 [ACK] Seq=2044 Ack=1542 Win=131072 Len=0"
"47","5.231705000","172.20.40.110","151.101.130.187","TLSv1.3","118","Change Cipher Spec, Application Data"
"48","5.232327500","172.20.40.110","151.101.130.187","TLSv1.3","146","Application Data"
"49","5.233737600","172.20.40.110","151.101.130.187","TLSv1.3","2865","Application Data"
"50","5.234209900","172.20.40.110","151.101.130.187","TLSv1.3","2856","Application Data"
"51","5.234544400","172.20.40.110","151.101.130.187","TLSv1.3","2850","Application Data"
"52","5.234891800","172.20.40.110","151.101.130.187","TLSv1.3","2850","Application Data"
"53","5.240822600","172.20.40.110","151.101.130.187","TLSv1.3","2850","Application Data"
"54","5.249084300","151.101.130.187","172.20.40.110","TCP","60","443  >  52383 [ACK] Seq=1542 Ack=2108 Win=144384 Len=0"
"55","5.249084300","151.101.130.187","172.20.40.110","TCP","60","443  >  52383 [ACK] Seq=1542 Ack=2200 Win=144384 Len=0"
"56","5.249084300","151.101.130.187","172.20.40.110","TLSv1.3","119","Application Data"
"57","5.249084300","151.101.130.187","172.20.40.110","TCP","60","443  >  52383 [ACK] Seq=1607 Ack=5011 Win=141824 Len=0"
"58","5.250345300","172.20.40.110","151.101.130.187","TLSv1.3","85","Application Data"
"59","5.251943800","172.20.40.110","151.101.130.187","TLSv1.3","2864","Application Data"
"60","5.256862700","151.101.130.187","172.20.40.110","TLSv1.3","451","Application Data"
"61","5.256862700","151.101.130.187","172.20.40.110","TCP","60","443  >  52383 [ACK] Seq=2004 Ack=7813 Win=139264 Len=0"
"62","5.256862700","151.101.130.187","172.20.40.110","TCP","60","443  >  52383 [ACK] Seq=2004 Ack=10609 Win=136704 Len=0"
"63","5.256862700","151.101.130.187","172.20.40.110","TCP","60","443  >  52383 [ACK] Seq=2004 Ack=13405 Win=134144 Len=0"
"64","5.256862700","151.101.130.187","172.20.40.110","TCP","60","443  >  52383 [ACK] Seq=2004 Ack=16201 Win=131584 Len=0"
"65","5.257678300","151.101.130.187","172.20.40.110","TCP","60","443  >  52383 [ACK] Seq=2004 Ack=16232 Win=131584 Len=0"
"66","5.260161800","151.101.130.187","172.20.40.110","TLSv1.3","130","Application Data"
"67","5.260161800","151.101.130.187","172.20.40.110","TLSv1.3","131","Application Data"
"68","5.260161800","151.101.130.187","172.20.40.110","TLSv1.3","124","Application Data"
"69","5.260245700","172.20.40.110","151.101.130.187","TCP","54","52383  >  443 [ACK] Seq=19042 Ack=2227 Win=130304 Len=0"
"70","5.265896300","151.101.130.187","172.20.40.110","TCP","60","443  >  52383 [ACK] Seq=2227 Ack=19042 Win=129024 Len=0"
"71","5.265896300","151.101.130.187","172.20.40.110","TLSv1.3","130","Application Data"
"72","5.265896300","151.101.130.187","172.20.40.110","TLSv1.3","125","Application Data"
"73","5.265986900","172.20.40.110","151.101.130.187","TCP","54","52383  >  443 [ACK] Seq=19042 Ack=2374 Win=130048 Len=0"
"74","5.360675300","172.20.40.110","151.101.130.187","TLSv1.3","2847","Application Data"
"75","5.377715500","172.20.40.110","151.101.130.187","TLSv1.3","2864","Application Data"
"76","5.383307600","151.101.130.187","172.20.40.110","TCP","60","443  >  52383 [ACK] Seq=2374 Ack=21835 Win=126464 Len=0"
"77","5.388329400","151.101.130.187","172.20.40.110","TLSv1.3","131","Application Data"
"78","5.388329400","151.101.130.187","172.20.40.110","TCP","60","443  >  52383 [ACK] Seq=2451 Ack=24645 Win=123904 Len=0"
"79","5.392648300","151.101.130.187","172.20.40.110","TLSv1.3","130","Application Data"
"80","5.392746300","172.20.40.110","151.101.130.187","TCP","54","52383  >  443 [ACK] Seq=24645 Ack=2527 Win=130048 Len=0"
"81","5.760394100","172.20.40.110","151.101.130.187","TLSv1.3","2858","Application Data"
"82","5.760980100","172.20.40.110","151.101.130.187","TLSv1.3","2850","Application Data"
"83","5.775634600","151.101.130.187","172.20.40.110","TCP","60","443  >  52383 [ACK] Seq=2527 Ack=27449 Win=121344 Len=0"
"84","5.775634600","151.101.130.187","172.20.40.110","TCP","60","443  >  52383 [ACK] Seq=2527 Ack=30245 Win=118784 Len=0"
"85","5.780261700","151.101.130.187","172.20.40.110","TLSv1.3","240","Application Data"
"86","5.780261700","151.101.130.187","172.20.40.110","TLSv1.3","130","Application Data"
"87","5.780341200","172.20.40.110","151.101.130.187","TCP","54","52383  >  443 [ACK] Seq=30245 Ack=2789 Win=129792 Len=0"
"88","5.954410700","172.20.40.110","151.101.130.187","TLSv1.3","2866","Application Data"
"89","5.954793600","172.20.40.110","151.101.130.187","TLSv1.3","2868","Application Data"
"90","5.960394400","172.20.40.110","151.101.130.187","TLSv1.3","2867","Application Data"
"91","5.967186100","151.101.130.187","172.20.40.110","TCP","60","443  >  52383 [ACK] Seq=2789 Ack=33057 Win=116224 Len=0"
"92","5.970371700","151.101.130.187","172.20.40.110","TCP","60","443  >  52383 [ACK] Seq=2789 Ack=35871 Win=113664 Len=0"
"93","5.970371700","151.101.130.187","172.20.40.110","TLSv1.3","124","Application Data"
"94","5.970371700","151.101.130.187","172.20.40.110","TLSv1.3","131","Application Data"
"95","5.970470900","172.20.40.110","151.101.130.187","TCP","54","52383  >  443 [ACK] Seq=38684 Ack=2936 Win=131072 Len=0"
"96","5.972388200","151.101.130.187","172.20.40.110","TCP","60","443  >  52383 [ACK] Seq=2936 Ack=38684 Win=111104 Len=0"
"97","5.977379600","151.101.130.187","172.20.40.110","TLSv1.3","168","Application Data"
"98","6.014164200","151.101.130.187","172.20.40.110","TCP","168","[TCP Retransmission] 443  >  52383 [PSH, ACK] Seq=2936 Ack=38684 Win=111104 Len=114"
"99","6.014225300","172.20.40.110","151.101.130.187","TCP","66","52383  >  443 [ACK] Seq=38684 Ack=3050 Win=130816 Len=0 SLE=2936 SRE=3050"
"100","9.553772400","172.20.40.110","151.101.130.187","TLSv1.3","2860","Application Data"
"101","9.554341900","172.20.40.110","151.101.130.187","TLSv1.3","2858","Application Data"
"102","9.556504900","172.20.40.110","151.101.130.187","TLSv1.3","2863","Application Data"
"103","9.566187600","151.101.130.187","172.20.40.110","TCP","60","443  >  52383 [ACK] Seq=3050 Ack=41490 Win=108544 Len=0"
"104","9.566187600","151.101.130.187","172.20.40.110","TCP","60","443  >  52383 [ACK] Seq=3050 Ack=44294 Win=105984 Len=0"
"105","9.568305800","151.101.130.187","172.20.40.110","TCP","60","443  >  52383 [ACK] Seq=3050 Ack=47103 Win=103424 Len=0"
"106","9.569493900","151.101.130.187","172.20.40.110","TLSv1.3","406","Application Data"
"107","9.570561000","151.101.130.187","172.20.40.110","TLSv1.3","130","Application Data"
"108","9.570561000","151.101.130.187","172.20.40.110","TLSv1.3","131","Application Data"
"109","9.570629400","172.20.40.110","151.101.130.187","TCP","54","52383  >  443 [ACK] Seq=47103 Ack=3555 Win=130304 Len=0"
"110","10.237298000","151.101.2.187","172.20.40.110","TCP","129","[TCP Retransmission] 443  >  65401 [FIN, PSH, ACK] Seq=1 Ack=1 Win=198 Len=75"
"111","15.787691700","172.20.40.110","151.101.130.187","TLSv1.3","2870","Application Data"
"112","15.792550500","172.20.40.110","151.101.130.187","TLSv1.3","2875","Application Data"
"113","15.800904400","172.20.40.110","151.101.130.187","TLSv1.3","2861","Application Data"
"114","15.800959800","151.101.130.187","172.20.40.110","TCP","60","443  >  52383 [ACK] Seq=3555 Ack=49919 Win=101888 Len=0"
"115","15.800959800","151.101.130.187","172.20.40.110","TLSv1.3","241","Application Data"
"116","15.808329200","151.101.130.187","172.20.40.110","TCP","60","443  >  52383 [ACK] Seq=3742 Ack=52740 Win=101888 Len=0"
"117","15.821867200","172.20.40.110","151.101.130.187","TLSv1.3","2876","Application Data"
"118","15.825115200","151.101.130.187","172.20.40.110","TLSv1.3","125","Application Data"
"119","15.825115200","151.101.130.187","172.20.40.110","TCP","60","443  >  52383 [ACK] Seq=3813 Ack=55547 Win=101888 Len=0"
"120","15.825115200","151.101.130.187","172.20.40.110","TLSv1.3","130","Application Data"
"121","15.825257000","172.20.40.110","151.101.130.187","TCP","54","52383  >  443 [ACK] Seq=58369 Ack=3889 Win=130048 Len=0"
"122","15.847914300","151.101.130.187","172.20.40.110","TCP","60","443  >  52383 [ACK] Seq=3889 Ack=58369 Win=101888 Len=0"
"123","15.847914300","151.101.130.187","172.20.40.110","TLSv1.3","125","Application Data"
"124","15.877217200","151.101.130.187","172.20.40.110","TCP","125","[TCP Retransmission] 443  >  52383 [PSH, ACK] Seq=3889 Ack=58369 Win=104448 Len=71"
"125","15.877274900","172.20.40.110","151.101.130.187","TCP","66","52383  >  443 [ACK] Seq=58369 Ack=3960 Win=130048 Len=0 SLE=3889 SRE=3960"
"126","17.662361200","151.101.2.187","172.20.40.110","TCP","129","[TCP Retransmission] 443  >  65401 [FIN, PSH, ACK] Seq=1 Ack=1 Win=198 Len=75"
"127","23.799773500","172.20.40.110","151.101.130.187","TLSv1.3","2875","Application Data"
"128","23.804662600","172.20.40.110","151.101.130.187","TLSv1.3","2873","Application Data"
"129","23.816504600","151.101.130.187","172.20.40.110","TCP","60","443  >  52383 [ACK] Seq=3960 Ack=61190 Win=101888 Len=0"
"130","23.819786800","151.101.130.187","172.20.40.110","TLSv1.3","214","Application Data"
"131","23.833247300","151.101.130.187","172.20.40.110","TCP","60","443  >  52383 [ACK] Seq=4120 Ack=64009 Win=101888 Len=0"
"132","23.833247300","151.101.130.187","172.20.40.110","TLSv1.3","125","Application Data"
"133","23.833594600","172.20.40.110","151.101.130.187","TCP","54","52383  >  443 [ACK] Seq=64009 Ack=4191 Win=129792 Len=0"
"134","23.837821700","172.20.40.110","151.101.130.187","TLSv1.3","2876","Application Data"
"135","23.850367400","151.101.130.187","172.20.40.110","TCP","60","443  >  52383 [ACK] Seq=4191 Ack=66831 Win=101888 Len=0"
"136","23.855761300","151.101.130.187","172.20.40.110","TLSv1.3","98","Application Data"
"137","23.895553700","151.101.130.187","172.20.40.110","TCP","98","[TCP Retransmission] 443  >  52383 [PSH, ACK] Seq=4191 Ack=66831 Win=104448 Len=44"
"138","23.895620400","172.20.40.110","151.101.130.187","TCP","66","52383  >  443 [ACK] Seq=66831 Ack=4235 Win=129792 Len=0 SLE=4191 SRE=4235"
"139","25.011655400","172.20.40.110","151.101.130.187","TLSv1.3","2861","Application Data"
"140","25.022165000","151.101.130.187","172.20.40.110","TCP","60","443  >  52383 [ACK] Seq=4235 Ack=69638 Win=101888 Len=0"
"141","25.034483400","151.101.130.187","172.20.40.110","TLSv1.3","240","Application Data"
"142","25.065342700","151.101.130.187","172.20.40.110","TCP","240","[TCP Retransmission] 443  >  52383 [PSH, ACK] Seq=4235 Ack=69638 Win=104448 Len=186"
"143","25.065404100","172.20.40.110","151.101.130.187","TCP","66","52383  >  443 [ACK] Seq=69638 Ack=4421 Win=131072 Len=0 SLE=4235 SRE=4421"
"144","25.150709600","172.20.40.110","151.101.130.187","TLSv1.3","2864","Application Data"
"145","25.159870700","151.101.130.187","172.20.40.110","TCP","60","443  >  52383 [ACK] Seq=4421 Ack=72448 Win=101888 Len=0"
"146","25.164027300","151.101.130.187","172.20.40.110","TLSv1.3","174","Application Data"
"147","25.164251300","172.20.40.110","151.101.130.187","TLSv1.3","2866","Application Data"
"148","25.178453600","151.101.130.187","172.20.40.110","TCP","60","443  >  52383 [ACK] Seq=4541 Ack=75260 Win=101888 Len=0"
"149","25.183133800","151.101.130.187","172.20.40.110","TLSv1.3","296","Application Data"
"150","25.217153300","151.101.130.187","172.20.40.110","TCP","296","[TCP Retransmission] 443  >  52383 [PSH, ACK] Seq=4541 Ack=75260 Win=104448 Len=242"
"151","25.217224700","172.20.40.110","151.101.130.187","TCP","66","52383  >  443 [ACK] Seq=75260 Ack=4783 Win=130560 Len=0 SLE=4541 SRE=4783"
"152","25.646896000","172.20.40.110","151.101.130.187","TLSv1.3","2875","Application Data"
"153","25.649915200","172.20.40.110","151.101.130.187","TLSv1.3","2873","Application Data"
"154","25.657111400","151.101.130.187","172.20.40.110","TCP","60","443  >  52383 [ACK] Seq=4783 Ack=78081 Win=101888 Len=0"
"155","25.663148200","151.101.130.187","172.20.40.110","TCP","60","443  >  52383 [ACK] Seq=4783 Ack=80900 Win=101888 Len=0"
"156","25.663148200","151.101.130.187","172.20.40.110","TLSv1.3","214","Application Data"
"157","25.664147300","151.101.130.187","172.20.40.110","TLSv1.3","98","Application Data"
"158","25.664225000","172.20.40.110","151.101.130.187","TCP","54","52383  >  443 [ACK] Seq=80900 Ack=4987 Win=130304 Len=0"
"159","25.679437000","172.20.40.110","151.101.130.187","TLSv1.3","2876","Application Data"
"160","25.687923500","151.101.130.187","172.20.40.110","TCP","60","443  >  52383 [ACK] Seq=4987 Ack=83722 Win=101888 Len=0"
"161","25.694585900","151.101.130.187","172.20.40.110","TLSv1.3","98","Application Data"
"162","25.728616200","151.101.130.187","172.20.40.110","TCP","98","[TCP Retransmission] 443  >  52383 [PSH, ACK] Seq=4987 Ack=83722 Win=104448 Len=44"
"163","25.728669300","172.20.40.110","151.101.130.187","TCP","66","52383  >  443 [ACK] Seq=83722 Ack=5031 Win=130304 Len=0 SLE=4987 SRE=5031"
"164","30.278694100","172.20.40.110","151.101.130.187","TLSv1.3","2922","Application Data"
"165","30.291095800","151.101.130.187","172.20.40.110","TCP","60","443  >  52383 [ACK] Seq=5031 Ack=86590 Win=101888 Len=0"
"166","31.050465800","151.101.130.187","172.20.40.110","TLSv1.3","5574","Application Data, Application Data, Application Data"
"167","31.050567200","172.20.40.110","151.101.130.187","TCP","54","52383  >  443 [ACK] Seq=86590 Ack=10551 Win=131072 Len=0"
"168","31.053578100","172.20.40.110","151.101.130.187","TLSv1.3","89","Application Data"
"169","31.063932800","151.101.130.187","172.20.40.110","TLSv1.3","1434","Application Data"
"170","31.063932800","151.101.130.187","172.20.40.110","TLSv1.3","1434","Application Data"
"171","31.063932800","151.101.130.187","172.20.40.110","TLSv1.3","1434","Application Data"
"172","31.064030400","172.20.40.110","151.101.130.187","TCP","54","52383  >  443 [ACK] Seq=86625 Ack=14691 Win=131072 Len=0"
"173","31.071779800","151.101.130.187","172.20.40.110","TLSv1.3","1434","Application Data"
"174","31.071779800","151.101.130.187","172.20.40.110","TLSv1.3","1434","Application Data"
"175","31.071779800","151.101.130.187","172.20.40.110","TLSv1.3","1434","Application Data"
"176","31.071779800","151.101.130.187","172.20.40.110","TLSv1.3","1434","Application Data"
"177","31.071976800","172.20.40.110","151.101.130.187","TCP","54","52383  >  443 [ACK] Seq=86625 Ack=20211 Win=131072 Len=0"
"178","31.073814600","151.101.130.187","172.20.40.110","TLSv1.3","5574","Application Data, Application Data, Application Data, Application Data, Application Data"
"179","31.073929900","172.20.40.110","151.101.130.187","TCP","54","52383  >  443 [ACK] Seq=86625 Ack=25731 Win=131072 Len=0"
"180","31.076144200","151.101.130.187","172.20.40.110","TLSv1.3","5574","Application Data, Application Data, Application Data, Application Data"
"181","31.076261300","172.20.40.110","151.101.130.187","TCP","54","52383  >  443 [ACK] Seq=86625 Ack=31251 Win=131072 Len=0"
"182","31.079322400","151.101.130.187","172.20.40.110","TLSv1.3","5574","Application Data, Application Data, Application Data, Application Data"
"183","31.079450000","172.20.40.110","151.101.130.187","TCP","54","52383  >  443 [ACK] Seq=86625 Ack=36771 Win=131072 Len=0"
"184","31.081961800","151.101.130.187","172.20.40.110","TLSv1.3","2814","Application Data, Application Data"
"185","31.082065700","172.20.40.110","151.101.130.187","TCP","54","52383  >  443 [ACK] Seq=86625 Ack=39531 Win=131072 Len=0"
"186","31.086882200","151.101.130.187","172.20.40.110","TLSv1.3","1434","Application Data"
"187","31.086882200","151.101.130.187","172.20.40.110","TLSv1.3","1434","Application Data"
"188","31.086882200","151.101.130.187","172.20.40.110","TLSv1.3","2814","Application Data, Application Data"
"189","31.086995800","172.20.40.110","151.101.130.187","TCP","54","52383  >  443 [ACK] Seq=86625 Ack=45051 Win=131072 Len=0"
"190","31.103602900","151.101.130.187","172.20.40.110","TLSv1.3","1434","Application Data"
"191","31.103602900","151.101.130.187","172.20.40.110","TLSv1.3","1434","Application Data"
"192","31.103602900","151.101.130.187","172.20.40.110","TLSv1.3","1434","Application Data"
"193","31.103713500","172.20.40.110","151.101.130.187","TCP","54","52383  >  443 [ACK] Seq=86625 Ack=49191 Win=131072 Len=0"
"194","31.105652500","151.101.130.187","172.20.40.110","TLSv1.3","1434","Application Data"
"195","31.105652500","151.101.130.187","172.20.40.110","TLSv1.3","1434","Application Data"
"196","31.105652500","151.101.130.187","172.20.40.110","TLSv1.3","1434","Application Data"
"197","31.105783100","172.20.40.110","151.101.130.187","TCP","54","52383  >  443 [ACK] Seq=86625 Ack=53331 Win=131072 Len=0"
"198","31.108062600","151.101.130.187","172.20.40.110","TLSv1.3","4194","Application Data, Application Data"
"199","31.108062600","151.101.130.187","172.20.40.110","TCP","60","443  >  52383 [ACK] Seq=57471 Ack=86625 Win=104448 Len=0"
"200","31.108062600","151.101.130.187","172.20.40.110","TLSv1.3","1434","Application Data"
"201","31.108195300","172.20.40.110","151.101.130.187","TCP","54","52383  >  443 [ACK] Seq=86625 Ack=58851 Win=131072 Len=0"
"202","31.110545400","151.101.130.187","172.20.40.110","TLSv1.3","5574","Application Data, Application Data, Application Data, Application Data"
"203","31.110657400","172.20.40.110","151.101.130.187","TCP","54","52383  >  443 [ACK] Seq=86625 Ack=64371 Win=131072 Len=0"
"204","31.113542600","151.101.130.187","172.20.40.110","TLSv1.3","1434","Application Data"
"205","31.113542600","151.101.130.187","172.20.40.110","TLSv1.3","307","Application Data, Application Data"
"206","31.113652200","172.20.40.110","151.101.130.187","TCP","54","52383  >  443 [ACK] Seq=86625 Ack=66004 Win=131072 Len=0"
"207","31.421270600","172.20.40.110","151.101.130.187","TLSv1.3","2873","Application Data"
"208","31.424857900","172.20.40.110","151.101.130.187","TLSv1.3","2869","Application Data"
"209","31.429504700","172.20.40.110","151.101.130.187","TLSv1.3","2867","Application Data"
"210","31.431446400","172.20.40.110","151.101.130.187","TLSv1.3","2884","Application Data"
"211","31.433411800","172.20.40.110","151.101.130.187","TLSv1.3","2867","Application Data"
"212","31.433966800","172.20.40.110","151.101.130.187","TLSv1.3","2865","Application Data"
"213","31.438978300","151.101.130.187","172.20.40.110","TCP","60","443  >  52383 [ACK] Seq=66004 Ack=89444 Win=101888 Len=0"
"214","31.438978300","151.101.130.187","172.20.40.110","TLSv1.3","131","Application Data"
"215","31.438978300","151.101.130.187","172.20.40.110","TCP","60","443  >  52383 [ACK] Seq=66081 Ack=92259 Win=102400 Len=0"
"216","31.445693400","151.101.130.187","172.20.40.110","TCP","60","443  >  52383 [ACK] Seq=66081 Ack=95072 Win=101888 Len=0"
"217","31.445693400","151.101.130.187","172.20.40.110","TLSv1.3","104","Application Data"
"218","31.445693400","151.101.130.187","172.20.40.110","TLSv1.3","132","Application Data"
"219","31.445693400","151.101.130.187","172.20.40.110","TCP","60","443  >  52383 [ACK] Seq=66209 Ack=97902 Win=101888 Len=0"
"220","31.445693400","151.101.130.187","172.20.40.110","TLSv1.3","125","Application Data"
"221","31.445873900","172.20.40.110","151.101.130.187","TCP","54","52383  >  443 [ACK] Seq=103526 Ack=66280 Win=130816 Len=0"
"222","31.456417700","151.101.130.187","172.20.40.110","TCP","60","443  >  52383 [ACK] Seq=66280 Ack=100715 Win=102400 Len=0"
"223","31.456417700","151.101.130.187","172.20.40.110","TCP","60","443  >  52383 [ACK] Seq=66280 Ack=103526 Win=99840 Len=0"
"224","31.463383600","151.101.130.187","172.20.40.110","TLSv1.3","130","Application Data"
"225","31.463383600","151.101.130.187","172.20.40.110","TLSv1.3","130","Application Data"
"226","31.463753000","172.20.40.110","151.101.130.187","TCP","54","52383  >  443 [ACK] Seq=103526 Ack=66432 Win=130560 Len=0"
"227","31.476621100","172.20.40.110","151.101.130.187","TLSv1.3","2875","Application Data"
"228","31.477125300","172.20.40.110","151.101.130.187","TLSv1.3","2869","Application Data"
"229","31.477350800","172.20.40.110","151.101.130.187","TLSv1.3","2869","Application Data"
"230","31.517003100","151.101.130.187","172.20.40.110","TCP","60","443  >  52383 [ACK] Seq=66432 Ack=106347 Win=101888 Len=0"
"231","31.517003100","151.101.130.187","172.20.40.110","TCP","60","443  >  52383 [ACK] Seq=66432 Ack=109162 Win=101888 Len=0"
"232","31.517003100","151.101.130.187","172.20.40.110","TCP","60","443  >  52383 [ACK] Seq=66432 Ack=111977 Win=101888 Len=0"
"233","31.517003100","151.101.130.187","172.20.40.110","TLSv1.3","174","Application Data"
"234","31.517003100","151.101.130.187","172.20.40.110","TLSv1.3","296","Application Data"
"235","31.517003100","151.101.130.187","172.20.40.110","TLSv1.3","130","Application Data"
"236","31.517289000","172.20.40.110","151.101.130.187","TCP","54","52383  >  443 [ACK] Seq=111977 Ack=66870 Win=130048 Len=0"
"237","31.535978800","172.20.40.110","151.101.130.187","TLSv1.3","2883","Application Data"
"238","31.536393200","172.20.40.110","151.101.130.187","TLSv1.3","2869","Application Data"
"239","31.544825400","151.101.130.187","172.20.40.110","TCP","60","443  >  52383 [ACK] Seq=66870 Ack=114806 Win=101888 Len=0"
"240","31.545827900","172.20.40.110","151.101.130.187","TLSv1.3","2877","Application Data"
"241","31.549537000","151.101.130.187","172.20.40.110","TCP","60","443  >  52383 [ACK] Seq=66870 Ack=117621 Win=101888 Len=0"
"242","31.550605200","151.101.130.187","172.20.40.110","TLSv1.3","125","Application Data"
"243","31.555165800","151.101.130.187","172.20.40.110","TLSv1.3","130","Application Data"
"244","31.555165800","151.101.130.187","172.20.40.110","TCP","60","443  >  52383 [ACK] Seq=67017 Ack=120444 Win=101888 Len=0"
"245","31.555283400","172.20.40.110","151.101.130.187","TCP","54","52383  >  443 [ACK] Seq=120444 Ack=67017 Win=130048 Len=0"
"246","31.559065500","172.20.40.110","151.101.130.187","TLSv1.3","2875","Application Data"
"247","31.561751900","172.20.40.110","151.101.130.187","TLSv1.3","2872","Application Data"
"248","31.564758400","151.101.130.187","172.20.40.110","TLSv1.3","124","Application Data"
"249","31.567535200","151.101.130.187","172.20.40.110","TCP","60","443  >  52383 [ACK] Seq=67087 Ack=123265 Win=101888 Len=0"
"250","31.572029500","151.101.130.187","172.20.40.110","TCP","60","443  >  52383 [ACK] Seq=67087 Ack=126083 Win=101888 Len=0"
"251","31.572029500","151.101.130.187","172.20.40.110","TLSv1.3","154","Application Data"
"252","31.572144800","172.20.40.110","151.101.130.187","TCP","54","52383  >  443 [ACK] Seq=126083 Ack=67187 Win=129792 Len=0"
"253","31.574402400","151.101.130.187","172.20.40.110","TLSv1.3","217","Application Data"
"254","31.618306100","172.20.40.110","151.101.130.187","TLSv1.3","2873","Application Data"
"255","31.619537600","172.20.40.110","151.101.130.187","TLSv1.3","2888","Application Data"
"256","31.621478100","172.20.40.110","151.101.130.187","TLSv1.3","2883","Application Data"
"257","31.631807100","151.101.130.187","172.20.40.110","TCP","60","443  >  52383 [ACK] Seq=67350 Ack=128902 Win=101888 Len=0"
"258","31.631807100","151.101.130.187","172.20.40.110","TCP","60","443  >  52383 [ACK] Seq=67350 Ack=131736 Win=101888 Len=0"
"259","31.631807100","151.101.130.187","172.20.40.110","TLSv1.3","240","Application Data"
"260","31.632013500","172.20.40.110","151.101.130.187","TCP","54","52383  >  443 [ACK] Seq=134565 Ack=67536 Win=131072 Len=0"
"261","31.633181900","151.101.130.187","172.20.40.110","TCP","60","443  >  52383 [ACK] Seq=67536 Ack=134565 Win=101888 Len=0"
"262","31.635383700","151.101.130.187","172.20.40.110","TLSv1.3","125","Application Data"
"263","31.635450900","172.20.40.110","151.101.130.187","TCP","54","52383  >  443 [ACK] Seq=134565 Ack=67607 Win=130816 Len=0"
"264","31.639621600","151.101.130.187","172.20.40.110","TLSv1.3","130","Application Data"
"265","31.692602600","172.20.40.110","151.101.130.187","TCP","54","52383  >  443 [ACK] Seq=134565 Ack=67683 Win=130816 Len=0"
"266","31.698555600","151.101.130.187","172.20.40.110","TCP","130","[TCP Spurious Retransmission] 443  >  52383 [PSH, ACK] Seq=67607 Ack=134565 Win=104448 Len=76"
"267","31.698610500","172.20.40.110","151.101.130.187","TCP","66","[TCP Dup ACK 265#1] 52383  >  443 [ACK] Seq=134565 Ack=67683 Win=130816 Len=0 SLE=67607 SRE=67683"
"268","31.703070700","172.20.40.110","151.101.130.187","TLSv1.3","2867","Application Data"
"269","31.712042800","151.101.130.187","172.20.40.110","TCP","60","443  >  52383 [ACK] Seq=67683 Ack=137378 Win=101888 Len=0"
"270","31.716378000","151.101.130.187","172.20.40.110","TLSv1.3","124","Application Data"
"271","31.757716200","172.20.40.110","151.101.130.187","TCP","54","52383  >  443 [ACK] Seq=137378 Ack=67753 Win=130816 Len=0"
"272","32.222954100","151.101.2.187","172.20.40.110","TCP","129","[TCP Retransmission] 443  >  65401 [FIN, PSH, ACK] Seq=1 Ack=1 Win=198 Len=75"
"273","33.572274400","172.20.40.110","151.101.130.187","TLSv1.3","2879","Application Data"
"274","33.572529900","172.20.40.110","151.101.130.187","TLSv1.3","2873","Application Data"
"275","33.594106200","151.101.130.187","172.20.40.110","TCP","60","443  >  52383 [ACK] Seq=67753 Ack=140203 Win=101888 Len=0"
"276","33.594106200","151.101.130.187","172.20.40.110","TCP","60","443  >  52383 [ACK] Seq=67753 Ack=143022 Win=102400 Len=0"
"277","33.594400900","151.101.130.187","172.20.40.110","TLSv1.3","214","Application Data"
"278","33.598705400","151.101.130.187","172.20.40.110","TLSv1.3","258","Application Data"
"279","33.598805600","172.20.40.110","151.101.130.187","TCP","54","52383  >  443 [ACK] Seq=143022 Ack=68117 Win=130304 Len=0"
"280","33.865233700","172.20.40.110","151.101.130.187","TLSv1.3","2871","Application Data"
"281","33.866551100","172.20.40.110","151.101.130.187","TLSv1.3","2867","Application Data"
"282","33.875882900","151.101.130.187","172.20.40.110","TCP","60","443  >  52383 [ACK] Seq=68117 Ack=145839 Win=101888 Len=0"
"283","33.878728900","151.101.130.187","172.20.40.110","TLSv1.3","296","Application Data"
"284","33.884952600","151.101.130.187","172.20.40.110","TCP","60","443  >  52383 [ACK] Seq=68359 Ack=148652 Win=101888 Len=0"
"285","33.889347500","151.101.130.187","172.20.40.110","TLSv1.3","131","Application Data"
"286","33.889423200","172.20.40.110","151.101.130.187","TCP","54","52383  >  443 [ACK] Seq=148652 Ack=68436 Win=130048 Len=0"
"287","34.659080700","172.20.40.110","151.101.130.187","TLSv1.3","2870","Application Data"
"288","34.672185300","151.101.130.187","172.20.40.110","TCP","60","443  >  52383 [ACK] Seq=68436 Ack=151468 Win=110080 Len=0"
"289","34.676464500","151.101.130.187","172.20.40.110","TLSv1.3","240","Application Data"
"290","34.725053900","172.20.40.110","151.101.130.187","TCP","54","52383  >  443 [ACK] Seq=151468 Ack=68622 Win=129792 Len=0"
"291","34.735541300","151.101.130.187","172.20.40.110","TCP","240","[TCP Spurious Retransmission] 443  >  52383 [PSH, ACK] Seq=68436 Ack=151468 Win=110080 Len=186"
"292","34.735621200","172.20.40.110","151.101.130.187","TCP","66","[TCP Dup ACK 290#1] 52383  >  443 [ACK] Seq=151468 Ack=68622 Win=129792 Len=0 SLE=68436 SRE=68622"
"293","35.103965400","172.20.40.110","151.101.130.187","TLSv1.3","2866","Application Data"
"294","35.114398700","151.101.130.187","172.20.40.110","TCP","60","443  >  52383 [ACK] Seq=68622 Ack=154280 Win=115712 Len=0"
"295","35.114970300","172.20.40.110","151.101.130.187","TLSv1.3","2866","Application Data"
"296","35.122727400","151.101.130.187","172.20.40.110","TLSv1.3","125","Application Data"
"297","35.129333400","151.101.130.187","172.20.40.110","TCP","60","443  >  52383 [ACK] Seq=68693 Ack=157092 Win=121344 Len=0"
"298","35.132492900","151.101.130.187","172.20.40.110","TLSv1.3","130","Application Data"
"299","35.132605200","172.20.40.110","151.101.130.187","TCP","54","52383  >  443 [ACK] Seq=157092 Ack=68769 Win=129792 Len=0"
"300","35.177533100","172.20.40.110","151.101.130.187","TLSv1.3","2884","Application Data"
"301","35.193261200","151.101.130.187","172.20.40.110","TCP","60","443  >  52383 [ACK] Seq=68769 Ack=159922 Win=126976 Len=0"
"302","35.194997800","151.101.130.187","172.20.40.110","TLSv1.3","98","Application Data"
"303","35.235275500","172.20.40.110","151.101.130.187","TCP","54","52383  >  443 [ACK] Seq=159922 Ack=68813 Win=129792 Len=0"
"304","35.404555100","172.20.40.110","151.101.130.187","TLSv1.3","2877","Application Data"
"305","35.415598200","151.101.130.187","172.20.40.110","TCP","60","443  >  52383 [ACK] Seq=68813 Ack=162745 Win=132608 Len=0"
"306","35.421731700","151.101.130.187","172.20.40.110","TLSv1.3","130","Application Data"
"307","35.465603300","172.20.40.110","151.101.130.187","TCP","54","52383  >  443 [ACK] Seq=162745 Ack=68889 Win=129536 Len=0"
"308","35.618758300","172.20.40.110","151.101.130.187","TLSv1.3","2872","Application Data"
"309","35.619451600","172.20.40.110","151.101.130.187","TLSv1.3","2871","Application Data"
"310","35.619855600","172.20.40.110","151.101.130.187","TLSv1.3","2868","Application Data"
"311","35.642797700","151.101.130.187","172.20.40.110","TCP","60","443  >  52383 [ACK] Seq=68889 Ack=165563 Win=138240 Len=0"
"312","35.642797700","151.101.130.187","172.20.40.110","TCP","60","443  >  52383 [ACK] Seq=68889 Ack=168380 Win=143872 Len=0"
"313","35.642797700","151.101.130.187","172.20.40.110","TCP","60","443  >  52383 [ACK] Seq=68889 Ack=171194 Win=149504 Len=0"
"314","35.647596300","151.101.130.187","172.20.40.110","TLSv1.3","240","Application Data"
"315","35.647596300","151.101.130.187","172.20.40.110","TLSv1.3","179","Application Data"
"316","35.647776600","172.20.40.110","151.101.130.187","TCP","54","52383  >  443 [ACK] Seq=171194 Ack=69200 Win=131072 Len=0"
"317","35.715300700","172.20.40.110","151.101.130.187","TLSv1.3","2869","Application Data"
"318","35.727141900","151.101.130.187","172.20.40.110","TCP","60","443  >  52383 [ACK] Seq=69200 Ack=174009 Win=155136 Len=0"
"319","35.727141900","151.101.130.187","172.20.40.110","TLSv1.3","130","Application Data"
"320","35.782301800","172.20.40.110","151.101.130.187","TLSv1.3","2875","Application Data"
"321","35.784830900","172.20.40.110","151.101.130.187","TLSv1.3","2869","Application Data"
"322","35.794653800","151.101.130.187","172.20.40.110","TCP","130","[TCP Spurious Retransmission] 443  >  52383 [PSH, ACK] Seq=69200 Ack=174009 Win=155136 Len=76"
"323","35.794709100","172.20.40.110","151.101.130.187","TCP","66","[TCP Dup ACK 320#1] 52383  >  443 [ACK] Seq=179645 Ack=69276 Win=130816 Len=0 SLE=69200 SRE=69276"
"324","35.798222800","151.101.130.187","172.20.40.110","TCP","60","443  >  52383 [ACK] Seq=69276 Ack=176830 Win=160768 Len=0"
"325","35.798222800","151.101.130.187","172.20.40.110","TCP","60","443  >  52383 [ACK] Seq=69276 Ack=179645 Win=166400 Len=0"
"326","35.802974100","151.101.130.187","172.20.40.110","TLSv1.3","175","Application Data"
"327","35.805662000","151.101.130.187","172.20.40.110","TLSv1.3","124","Application Data"
"328","35.805740900","172.20.40.110","151.101.130.187","TCP","54","52383  >  443 [ACK] Seq=179645 Ack=69467 Win=130816 Len=0"
"329","36.837569100","172.20.40.110","151.101.130.187","TLSv1.3","2887","Application Data"
"330","36.858015100","151.101.130.187","172.20.40.110","TCP","60","443  >  52383 [ACK] Seq=69467 Ack=182478 Win=172032 Len=0"
"331","36.867037100","151.101.130.187","172.20.40.110","TLSv1.3","407","Application Data"
"332","36.917113700","172.20.40.110","151.101.130.187","TCP","54","52383  >  443 [ACK] Seq=182478 Ack=69820 Win=130304 Len=0"
"333","36.923686100","151.101.130.187","172.20.40.110","TCP","407","[TCP Spurious Retransmission] 443  >  52383 [PSH, ACK] Seq=69467 Ack=182478 Win=172032 Len=353"
"334","36.923761900","172.20.40.110","151.101.130.187","TCP","66","[TCP Dup ACK 332#1] 52383  >  443 [ACK] Seq=182478 Ack=69820 Win=130304 Len=0 SLE=69467 SRE=69820"
"335","37.418983400","172.20.40.110","151.101.130.187","TLSv1.3","2875","Application Data"
"336","37.431778600","172.20.40.110","151.101.130.187","TLSv1.3","2877","Application Data"
"337","37.458570600","172.20.40.110","151.101.130.187","TLSv1.3","2871","Application Data"
"338","37.460291300","172.20.40.110","151.101.130.187","TLSv1.3","2871","Application Data"
"339","37.461759000","172.20.40.110","151.101.130.187","TCP","1434","[TCP Retransmission] 52383  >  443 [PSH, ACK] Seq=192376 Ack=69820 Win=130304 Len=1380"
"340","37.466881900","172.20.40.110","151.101.130.187","TLSv1.3","2869","Application Data"
"341","37.468307100","172.20.40.110","151.101.130.187","TLSv1.3","2888","Application Data"
"342","37.469198300","172.20.40.110","151.101.130.187","TLSv1.3","2873","Application Data"
"343","37.472135900","172.20.40.110","151.101.130.187","TLSv1.3","2881","Application Data"
"344","37.473174900","172.20.40.110","151.101.130.187","TLSv1.3","2879","Application Data"
"345","37.474254500","172.20.40.110","151.101.130.187","TLSv1.3","2870","Application Data"
"346","37.475688900","172.20.40.110","151.101.130.187","TLSv1.3","2881","Application Data"
"347","37.477903800","172.20.40.110","151.101.130.187","TLSv1.3","2873","Application Data"
"348","37.479201900","172.20.40.110","151.101.130.187","TLSv1.3","2874","Application Data"
"349","37.480030200","172.20.40.110","151.101.130.187","TLSv1.3","2876","Application Data"
"350","37.485938000","151.101.130.187","172.20.40.110","TCP","60","443  >  52383 [ACK] Seq=69820 Ack=185299 Win=177664 Len=0"
"351","37.485938000","151.101.130.187","172.20.40.110","TLSv1.3","129","Application Data"
"352","37.486540300","172.20.40.110","151.101.130.187","TLSv1.3","2870","Application Data"
"353","37.488968500","172.20.40.110","151.101.130.187","TLSv1.3","2875","Application Data"
"354","37.489219300","172.20.40.110","151.101.130.187","TLSv1.3","2872","Application Data"
"355","37.489404700","172.20.40.110","151.101.130.187","TLSv1.3","2887","Application Data"
"356","37.489562300","172.20.40.110","151.101.130.187","TLSv1.3","2871","Application Data"
"357","37.529289200","151.101.130.187","172.20.40.110","TCP","60","443  >  52383 [ACK] Seq=69895 Ack=186679 Win=180736 Len=0"
"358","37.533956500","172.20.40.110","151.101.130.187","TLSv1.3","2871","Application Data"
"359","37.540807000","151.101.130.187","172.20.40.110","TCP","129","[TCP Spurious Retransmission] 443  >  52383 [PSH, ACK] Seq=69820 Ack=186679 Win=180736 Len=75"
"360","37.540994100","172.20.40.110","151.101.130.187","TCP","66","[TCP Dup ACK 352#1] 52383  >  443 [ACK] Seq=238902 Ack=69895 Win=130304 Len=0 SLE=69820 SRE=69895"
"361","37.587768400","151.101.130.187","172.20.40.110","TCP","66","[TCP Dup ACK 357#1] 443  >  52383 [ACK] Seq=69895 Ack=186679 Win=180736 Len=0 SLE=188059 SRE=188122"
"362","37.587768400","151.101.130.187","172.20.40.110","TCP","66","[TCP Dup ACK 357#2] 443  >  52383 [ACK] Seq=69895 Ack=186679 Win=186368 Len=0 SLE=188059 SRE=190939"
"363","37.587768400","151.101.130.187","172.20.40.110","TCP","66","[TCP Dup ACK 357#3] 443  >  52383 [ACK] Seq=69895 Ack=186679 Win=192000 Len=0 SLE=188059 SRE=193756"
"364","37.587838200","172.20.40.110","151.101.130.187","TCP","1434","[TCP Fast Retransmission] 52383  >  443 [ACK] Seq=186679 Ack=69895 Win=130304 Len=1380"
"365","37.620910500","172.20.40.110","151.101.130.187","TCP","1434","52383  >  443 [ACK] Seq=238902 Ack=69895 Win=130304 Len=1380 [TCP PDU reassembled in 367]"
"366","37.620910500","172.20.40.110","151.101.130.187","TCP","1434","52383  >  443 [ACK] Seq=240282 Ack=69895 Win=130304 Len=1380 [TCP PDU reassembled in 367]"
"367","37.620910500","172.20.40.110","151.101.130.187","TLSv1.3","108","Application Data"
"368","37.623771700","172.20.40.110","151.101.130.187","TCP","1434","52383  >  443 [ACK] Seq=241716 Ack=69895 Win=130304 Len=1380 [TCP PDU reassembled in 370]"
"369","37.623771700","172.20.40.110","151.101.130.187","TCP","1434","52383  >  443 [ACK] Seq=243096 Ack=69895 Win=130304 Len=1380 [TCP PDU reassembled in 370]"
"370","37.623771700","172.20.40.110","151.101.130.187","TLSv1.3","106","Application Data"
"371","37.624081600","172.20.40.110","151.101.130.187","TCP","1434","52383  >  443 [ACK] Seq=244528 Ack=69895 Win=130304 Len=1380 [TCP PDU reassembled in 373]"
"372","37.624081600","172.20.40.110","151.101.130.187","TCP","1434","52383  >  443 [ACK] Seq=245908 Ack=69895 Win=130304 Len=1380 [TCP PDU reassembled in 373]"
"373","37.624081600","172.20.40.110","151.101.130.187","TLSv1.3","111","Application Data"
"374","37.731461900","151.101.130.187","172.20.40.110","TCP","66","[TCP Dup ACK 357#4] 443  >  52383 [ACK] Seq=69895 Ack=186679 Win=197632 Len=0 SLE=188059 SRE=196571"
"375","37.731461900","151.101.130.187","172.20.40.110","TCP","66","[TCP Dup ACK 357#5] 443  >  52383 [ACK] Seq=69895 Ack=186679 Win=203264 Len=0 SLE=188059 SRE=199405"
"376","37.731461900","151.101.130.187","172.20.40.110","TCP","66","[TCP Dup ACK 357#6] 443  >  52383 [ACK] Seq=69895 Ack=186679 Win=208896 Len=0 SLE=188059 SRE=202224"
"377","37.731461900","151.101.130.187","172.20.40.110","TCP","66","[TCP Dup ACK 357#7] 443  >  52383 [ACK] Seq=69895 Ack=186679 Win=214528 Len=0 SLE=188059 SRE=205051"
"378","37.731461900","151.101.130.187","172.20.40.110","TCP","66","[TCP Dup ACK 357#8] 443  >  52383 [ACK] Seq=69895 Ack=186679 Win=220160 Len=0 SLE=188059 SRE=207876"
"379","37.731461900","151.101.130.187","172.20.40.110","TCP","66","[TCP Dup ACK 357#9] 443  >  52383 [ACK] Seq=69895 Ack=186679 Win=223232 Len=0 SLE=188059 SRE=209256"
"380","37.731461900","151.101.130.187","172.20.40.110","TCP","66","[TCP Dup ACK 357#10] 443  >  52383 [ACK] Seq=69895 Ack=186679 Win=226304 Len=0 SLE=188059 SRE=210692"
"381","37.731461900","151.101.130.187","172.20.40.110","TCP","66","[TCP Dup ACK 357#11] 443  >  52383 [ACK] Seq=69895 Ack=186679 Win=231936 Len=0 SLE=188059 SRE=213519"
"382","37.731461900","151.101.130.187","172.20.40.110","TCP","66","[TCP Dup ACK 357#12] 443  >  52383 [ACK] Seq=69895 Ack=186679 Win=237568 Len=0 SLE=188059 SRE=216338"
"383","37.731461900","151.101.130.187","172.20.40.110","TCP","66","[TCP Dup ACK 357#13] 443  >  52383 [ACK] Seq=69895 Ack=186679 Win=243200 Len=0 SLE=188059 SRE=219158"
"384","37.731461900","151.101.130.187","172.20.40.110","TCP","66","[TCP Dup ACK 357#14] 443  >  52383 [ACK] Seq=69895 Ack=186679 Win=248832 Len=0 SLE=188059 SRE=221980"
"385","37.731461900","151.101.130.187","172.20.40.110","TCP","66","[TCP Dup ACK 357#15] 443  >  52383 [ACK] Seq=69895 Ack=186679 Win=254464 Len=0 SLE=188059 SRE=224796"
"386","37.731461900","151.101.130.187","172.20.40.110","TCP","66","[TCP Dup ACK 357#16] 443  >  52383 [ACK] Seq=69895 Ack=186679 Win=260096 Len=0 SLE=188059 SRE=227617"
"387","37.731461900","151.101.130.187","172.20.40.110","TCP","66","[TCP Dup ACK 357#17] 443  >  52383 [ACK] Seq=69895 Ack=186679 Win=265728 Len=0 SLE=188059 SRE=230435"
"388","37.731461900","151.101.130.187","172.20.40.110","TCP","66","[TCP Dup ACK 357#18] 443  >  52383 [ACK] Seq=69895 Ack=186679 Win=268288 Len=0 SLE=188059 SRE=231815"
"389","37.731461900","151.101.130.187","172.20.40.110","TCP","66","[TCP Dup ACK 357#19] 443  >  52383 [ACK] Seq=69895 Ack=186679 Win=271360 Len=0 SLE=188059 SRE=233268"
"390","37.782640200","172.20.40.110","151.101.130.187","TCP","1434","52383  >  443 [ACK] Seq=247345 Ack=69895 Win=130304 Len=1380 [TCP PDU reassembled in 392]"
"391","37.782640200","172.20.40.110","151.101.130.187","TCP","1434","52383  >  443 [ACK] Seq=248725 Ack=69895 Win=130304 Len=1380 [TCP PDU reassembled in 392]"
"392","37.782640200","172.20.40.110","151.101.130.187","TLSv1.3","113","Application Data"
"393","37.871185000","151.101.130.187","172.20.40.110","TCP","66","[TCP Dup ACK 357#20] 443  >  52383 [ACK] Seq=69895 Ack=186679 Win=276992 Len=0 SLE=188059 SRE=236085"
"394","37.871185000","151.101.130.187","172.20.40.110","TCP","66","[TCP Dup ACK 357#21] 443  >  52383 [ACK] Seq=69895 Ack=186679 Win=282624 Len=0 SLE=188059 SRE=238902"
"395","37.871185000","151.101.130.187","172.20.40.110","TCP","60","443  >  52383 [ACK] Seq=69895 Ack=238902 Win=285696 Len=0"
"396","37.871185000","151.101.130.187","172.20.40.110","TCP","60","443  >  52383 [ACK] Seq=69895 Ack=240282 Win=288768 Len=0"
"397","37.880454600","151.101.130.187","172.20.40.110","TLSv1.3","240","Application Data"
"398","37.880454600","151.101.130.187","172.20.40.110","TLSv1.3","125","Application Data"
"399","37.880454600","151.101.130.187","172.20.40.110","TLSv1.3","130","Application Data"
"400","37.880654500","172.20.40.110","151.101.130.187","TCP","54","52383  >  443 [ACK] Seq=250164 Ack=70228 Win=130048 Len=0"
"401","37.883256300","151.101.130.187","172.20.40.110","TLSv1.3","131","Application Data"
"402","37.883256300","151.101.130.187","172.20.40.110","TLSv1.3","206","Application Data, Application Data"
"403","37.883256300","151.101.130.187","172.20.40.110","TLSv1.3","126","Application Data"
"404","37.883256300","151.101.130.187","172.20.40.110","TLSv1.3","131","Application Data"
"405","37.883256300","151.101.130.187","172.20.40.110","TLSv1.3","169","Application Data"
"406","37.883256300","151.101.130.187","172.20.40.110","TLSv1.3","131","Application Data"
"407","37.883256300","151.101.130.187","172.20.40.110","TLSv1.3","135","Application Data"
"408","37.883256300","151.101.130.187","172.20.40.110","TLSv1.3","292","Application Data"
"409","37.883256300","151.101.130.187","172.20.40.110","TLSv1.3","178","Application Data"
"410","37.883256300","151.101.130.187","172.20.40.110","TLSv1.3","240","Application Data"
"411","37.883256300","151.101.130.187","172.20.40.110","TLSv1.3","124","Application Data"
"412","37.883256300","151.101.130.187","172.20.40.110","TLSv1.3","130","Application Data"
"413","37.883256300","151.101.130.187","172.20.40.110","TLSv1.3","124","Application Data"
"414","37.883256300","151.101.130.187","172.20.40.110","TLSv1.3","130","Application Data"
"415","37.883256300","151.101.130.187","172.20.40.110","TCP","66","[TCP Dup ACK 396#1] 443  >  52383 [ACK] Seq=71719 Ack=240282 Win=288768 Len=0 SLE=241662 SRE=241716"
"416","37.883256300","151.101.130.187","172.20.40.110","TCP","66","[TCP Dup ACK 396#2] 443  >  52383 [ACK] Seq=71719 Ack=240282 Win=294400 Len=0 SLE=241662 SRE=244528"
"417","37.883256300","151.101.130.187","172.20.40.110","TCP","66","[TCP Dup ACK 396#3] 443  >  52383 [ACK] Seq=71719 Ack=240282 Win=296960 Len=0 SLE=241662 SRE=245908"
"418","37.883256300","151.101.130.187","172.20.40.110","TCP","142","[TCP Retransmission] 443  >  52383 [PSH, ACK] Seq=71643 Ack=240282 Win=296960 Len=76 SLE=241662 SRE=245908"
"419","37.883471900","172.20.40.110","151.101.130.187","TCP","54","52383  >  443 [ACK] Seq=250164 Ack=71719 Win=131072 Len=0"
"420","37.883718300","172.20.40.110","151.101.130.187","TCP","1434","[TCP Fast Retransmission] 52383  >  443 [ACK] Seq=240282 Ack=71719 Win=131072 Len=1380 [TCP PDU reassembled in 367]"
"421","37.883843800","172.20.40.110","151.101.130.187","TCP","66","[TCP Dup ACK 419#1] 52383  >  443 [ACK] Seq=250164 Ack=71719 Win=131072 Len=0 SLE=71643 SRE=71719"
"422","37.883996200","151.101.130.187","172.20.40.110","TCP","66","[TCP Dup ACK 396#4] 443  >  52383 [ACK] Seq=71719 Ack=240282 Win=303104 Len=0 SLE=241662 SRE=248725"
"423","37.891345400","151.101.130.187","172.20.40.110","TCP","66","[TCP Dup ACK 396#5] 443  >  52383 [ACK] Seq=71719 Ack=240282 Win=305664 Len=0 SLE=241662 SRE=250164"
"424","37.892962800","151.101.130.187","172.20.40.110","TCP","60","443  >  52383 [ACK] Seq=71719 Ack=250164 Win=308736 Len=0"
"425","37.917621500","151.101.130.187","172.20.40.110","TLSv1.3","206","Application Data, Application Data"
"426","37.917621500","151.101.130.187","172.20.40.110","TLSv1.3","131","Application Data"
"427","37.917621500","151.101.130.187","172.20.40.110","TLSv1.3","175","Application Data"
"428","37.917738300","172.20.40.110","151.101.130.187","TCP","54","52383  >  443 [ACK] Seq=250164 Ack=72069 Win=130560 Len=0"
"429","41.577870700","172.20.40.110","151.101.130.187","TLSv1.3","2882","Application Data"
"430","41.587506200","172.20.40.110","151.101.130.187","TLSv1.3","2880","Application Data"
"431","41.608236600","151.101.130.187","172.20.40.110","TCP","60","443  >  52383 [ACK] Seq=72069 Ack=252992 Win=314368 Len=0"
"432","41.608236600","151.101.130.187","172.20.40.110","TLSv1.3","246","Application Data"
"433","41.608236600","151.101.130.187","172.20.40.110","TCP","60","443  >  52383 [ACK] Seq=72261 Ack=255818 Win=320000 Len=0"
"434","41.609341800","151.101.130.187","172.20.40.110","TLSv1.3","402","Application Data"
"435","41.609398000","172.20.40.110","151.101.130.187","TCP","54","52383  >  443 [ACK] Seq=255818 Ack=72609 Win=130048 Len=0"
"436","41.621020500","172.20.40.110","151.101.130.187","TLSv1.3","2883","Application Data"
"437","41.635049000","151.101.130.187","172.20.40.110","TCP","60","443  >  52383 [ACK] Seq=72609 Ack=258647 Win=325632 Len=0"
"438","41.637826600","151.101.130.187","172.20.40.110","TLSv1.3","125","Application Data"
"439","41.691489900","172.20.40.110","151.101.130.187","TCP","54","52383  >  443 [ACK] Seq=258647 Ack=72680 Win=130048 Len=0"
"440","42.042167400","172.20.40.110","151.101.130.187","TLSv1.3","2868","Application Data"
"441","42.057028600","151.101.130.187","172.20.40.110","TCP","60","443  >  52383 [ACK] Seq=72680 Ack=261461 Win=331264 Len=0"
"442","42.067323800","151.101.130.187","172.20.40.110","TLSv1.3","104","Application Data"
"443","42.115253100","172.20.40.110","151.101.130.187","TCP","54","52383  >  443 [ACK] Seq=261461 Ack=72730 Win=130048 Len=0"
"444","42.207974000","172.20.40.110","151.101.130.187","TLSv1.3","2871","Application Data"
"445","42.221619200","151.101.130.187","172.20.40.110","TCP","60","443  >  52383 [ACK] Seq=72730 Ack=264278 Win=336896 Len=0"
"446","42.221738900","172.20.40.110","151.101.130.187","TLSv1.3","2873","Application Data"
"447","42.228251800","151.101.130.187","172.20.40.110","TLSv1.3","130","Application Data"
"448","42.234682700","151.101.130.187","172.20.40.110","TCP","60","443  >  52383 [ACK] Seq=72806 Ack=267097 Win=342528 Len=0"
"449","42.239177900","151.101.130.187","172.20.40.110","TLSv1.3","130","Application Data"
"450","42.239299200","172.20.40.110","151.101.130.187","TCP","54","52383  >  443 [ACK] Seq=267097 Ack=72882 Win=129792 Len=0"
"451","42.813020600","172.20.40.110","151.101.130.187","TCP","54","52383  >  443 [FIN, ACK] Seq=267097 Ack=72882 Win=129792 Len=0"
"452","43.489331900","172.20.40.110","151.101.130.187","TCP","54","[TCP Retransmission] 52383  >  443 [FIN, ACK] Seq=267097 Ack=72882 Win=129792 Len=0"
"453","44.730693300","172.20.40.110","151.101.130.187","TCP","54","[TCP Retransmission] 52383  >  443 [FIN, ACK] Seq=267097 Ack=72882 Win=129792 Len=0"
"454","47.201187900","172.20.40.110","151.101.130.187","TCP","54","[TCP Retransmission] 52383  >  443 [FIN, ACK] Seq=267097 Ack=72882 Win=129792 Len=0"
"455","47.758123600","151.101.130.187","172.20.40.110","TCP","60","[TCP Previous segment not captured] 443  >  52383 [FIN, ACK] Seq=72906 Ack=267098 Win=342528 Len=0"
"456","47.759195800","172.20.40.110","151.101.130.187","TCP","54","[TCP Dup ACK 450#1] 52383  >  443 [ACK] Seq=267098 Ack=72882 Win=129792 Len=0"
"457","47.759776900","151.101.130.187","172.20.40.110","TCP","66","[TCP Dup ACK 455#1] 443  >  52383 [ACK] Seq=72907 Ack=267098 Win=342528 Len=0 SLE=267097 SRE=267098"
"458","48.001009700","151.101.130.187","172.20.40.110","TCP","78","[TCP Retransmission] 443  >  52383 [FIN, PSH, ACK] Seq=72882 Ack=267098 Win=342528 Len=24"
"459","48.001147000","172.20.40.110","151.101.130.187","TCP","54","52383  >  443 [RST, ACK] Seq=267098 Ack=72906 Win=0 Len=0"
"460","52.850132100","172.20.40.110","151.101.130.187","TCP","66","59702  >  443 [SYN] Seq=0 Win=64240 Len=0 MSS=1460 WS=256 SACK_PERM"
"461","52.857732200","151.101.130.187","172.20.40.110","TCP","66","443  >  59702 [SYN, ACK] Seq=0 Ack=1 Win=65535 Len=0 MSS=1380 SACK_PERM WS=512"
"462","52.857886600","172.20.40.110","151.101.130.187","TCP","54","59702  >  443 [ACK] Seq=1 Ack=1 Win=66048 Len=0"
"463","52.859470300","172.20.40.110","151.101.130.187","TLSv1.3","2065","Client Hello (SNI=www.target.com)"
"464","52.874321600","151.101.130.187","172.20.40.110","TCP","60","443  >  59702 [ACK] Seq=1 Ack=2012 Win=144384 Len=0"
"465","52.874321600","151.101.130.187","172.20.40.110","TLSv1.3","1434","Server Hello, Change Cipher Spec, Application Data, Application Data"
"466","52.874321600","151.101.130.187","172.20.40.110","TLSv1.3","215","Application Data"
"467","52.874444400","172.20.40.110","151.101.130.187","TCP","54","59702  >  443 [ACK] Seq=2012 Ack=1542 Win=66048 Len=0"
"468","52.875311600","172.20.40.110","151.101.130.187","TLSv1.3","118","Change Cipher Spec, Application Data"
"469","52.875655100","172.20.40.110","151.101.130.187","TLSv1.3","146","Application Data"
"470","52.875968200","172.20.40.110","151.101.130.187","TLSv1.3","2640","Application Data"
"471","52.903785400","151.101.130.187","172.20.40.110","TCP","60","443  >  59702 [ACK] Seq=1542 Ack=2076 Win=144384 Len=0"
"472","52.906988600","151.101.130.187","172.20.40.110","TCP","60","443  >  59702 [ACK] Seq=1542 Ack=2168 Win=144384 Len=0"
"473","52.906988600","151.101.130.187","172.20.40.110","TLSv1.3","119","Application Data"
"474","52.907430000","172.20.40.110","151.101.130.187","TLSv1.3","85","Application Data"
"475","52.913044900","151.101.130.187","172.20.40.110","TCP","60","443  >  59702 [ACK] Seq=1607 Ack=4754 Win=141824 Len=0"
"476","52.916707900","151.101.130.187","172.20.40.110","TCP","60","443  >  59702 [ACK] Seq=1607 Ack=4785 Win=141824 Len=0"
"477","53.313556600","151.101.130.187","172.20.40.110","TLSv1.3","499","Application Data"
"478","53.313556600","151.101.130.187","172.20.40.110","TLSv1.3","357","Application Data"
"479","53.313674100","172.20.40.110","151.101.130.187","TCP","54","59702  >  443 [ACK] Seq=4785 Ack=2355 Win=65280 Len=0"
