"No.","Time","Source","Destination","Protocol","Length","Info"
"1","0.000000000","100.84.170.161","151.101.2.187","TLSv1.2","2422","Application Data"
"2","0.000307100","100.84.170.161","151.101.2.187","TLSv1.2","93","Application Data"
"3","0.000634300","100.84.170.161","151.101.2.187","TLSv1.2","2509","Application Data"
"4","0.011144100","151.101.2.187","100.84.170.161","TCP","56","443  >  55283 [ACK] Seq=1 Ack=4863 Win=950 Len=0"
"5","0.011845400","151.101.2.187","100.84.170.161","TLSv1.2","93","Application Data"
"6","0.014689400","151.101.2.187","100.84.170.161","TLSv1.2","240","Application Data"
"7","0.014772100","100.84.170.161","151.101.2.187","TCP","54","55283  >  443 [ACK] Seq=4863 Ack=226 Win=512 Len=0"
"8","0.014955700","151.101.2.187","100.84.170.161","TLSv1.2","130","Application Data"
"9","0.055432200","151.101.2.187","100.84.170.161","TCP","130","[TCP Retransmission] 443  >  55283 [PSH, ACK] Seq=226 Ack=4863 Win=950 Len=76"
"10","0.055479200","100.84.170.161","151.101.2.187","TCP","66","55283  >  443 [ACK] Seq=4863 Ack=302 Win=512 Len=0 SLE=226 SRE=302"
"11","0.159609000","100.84.170.161","151.101.2.187","TLSv1.2","2508","Application Data"
"12","0.167786100","100.84.170.161","151.101.2.187","TLSv1.2","2509","Application Data"
"13","0.168729200","151.101.2.187","100.84.170.161","TCP","56","443  >  55283 [ACK] Seq=302 Ack=7317 Win=961 Len=0"
"14","0.172128900","151.101.2.187","100.84.170.161","TLSv1.2","98","Application Data"
"15","0.176782000","151.101.2.187","100.84.170.161","TCP","56","443  >  55283 [ACK] Seq=346 Ack=9772 Win=973 Len=0"
"16","0.179629900","151.101.2.187","100.84.170.161","TLSv1.2","98","Application Data"
"17","0.179724600","100.84.170.161","151.101.2.187","TCP","54","55283  >  443 [ACK] Seq=9772 Ack=390 Win=511 Len=0"
"18","0.759549200","100.84.170.161","151.101.2.187","TLSv1.2","2508","Application Data"
"19","0.768572100","151.101.2.187","100.84.170.161","TCP","56","443  >  55283 [ACK] Seq=390 Ack=12226 Win=984 Len=0"
"20","0.770852300","151.101.2.187","100.84.170.161","TLSv1.2","213","Application Data"
"21","0.803640300","151.101.2.187","100.84.170.161","TCP","213","[TCP Retransmission] 443  >  55283 [PSH, ACK] Seq=390 Ack=12226 Win=984 Len=159"
"22","0.803680900","100.84.170.161","151.101.2.187","TCP","66","55283  >  443 [ACK] Seq=12226 Ack=549 Win=511 Len=0 SLE=390 SRE=549"
"23","0.906667100","100.84.170.161","151.101.2.187","TLSv1.2","2509","Application Data"
"24","0.917263700","151.101.2.187","100.84.170.161","TCP","56","443  >  55283 [ACK] Seq=549 Ack=14681 Win=995 Len=0"
"25","0.921761300","151.101.2.187","100.84.170.161","TLSv1.2","103","Application Data"
"26","0.953492400","151.101.2.187","100.84.170.161","TCP","103","[TCP Retransmission] 443  >  55283 [PSH, ACK] Seq=549 Ack=14681 Win=995 Len=49"
"27","0.953547200","100.84.170.161","151.101.2.187","TCP","66","55283  >  443 [ACK] Seq=14681 Ack=598 Win=510 Len=0 SLE=549 SRE=598"
"28","3.502545900","100.84.170.161","151.101.2.187","TLSv1.2","2508","Application Data"
"29","3.511280900","151.101.2.187","100.84.170.161","TCP","56","443  >  55283 [ACK] Seq=598 Ack=17135 Win=1007 Len=0"
"30","3.514000900","151.101.2.187","100.84.170.161","TLSv1.2","213","Application Data"
"31","3.519662000","100.84.170.161","151.101.2.187","TLSv1.2","2507","Application Data"
"32","3.528376900","151.101.2.187","100.84.170.161","TCP","56","443  >  55283 [ACK] Seq=757 Ack=19588 Win=1018 Len=0"
"33","3.531456800","151.101.2.187","100.84.170.161","TLSv1.2","178","Application Data"
"34","3.554426000","100.84.170.161","151.101.2.187","TLSv1.2","2509","Application Data"
"35","3.562453800","151.101.2.187","100.84.170.161","TCP","178","[TCP Spurious Retransmission] 443  >  55283 [PSH, ACK] Seq=757 Ack=19588 Win=1018 Len=124"
"36","3.562495700","100.84.170.161","151.101.2.187","TCP","66","[TCP Dup ACK 34#1] 55283  >  443 [ACK] Seq=22043 Ack=881 Win=509 Len=0 SLE=757 SRE=881"
"37","3.563268400","151.101.2.187","100.84.170.161","TCP","56","443  >  55283 [ACK] Seq=881 Ack=22043 Win=1030 Len=0"
"38","3.565463300","151.101.2.187","100.84.170.161","TLSv1.2","264","Application Data"
"39","3.597318400","151.101.2.187","100.84.170.161","TCP","264","[TCP Retransmission] 443  >  55283 [PSH, ACK] Seq=881 Ack=22043 Win=1030 Len=210"
"40","3.597366100","100.84.170.161","151.101.2.187","TCP","66","55283  >  443 [ACK] Seq=22043 Ack=1091 Win=509 Len=0 SLE=881 SRE=1091"
"41","8.169267100","100.84.170.161","151.101.2.187","TLSv1.2","2519","Application Data"
"42","8.179684900","151.101.2.187","100.84.170.161","TCP","56","443  >  55283 [ACK] Seq=1091 Ack=24508 Win=1041 Len=0"
"43","8.179714200","100.84.170.161","151.101.2.187","TLSv1.2","2510","Application Data"
"44","8.183431300","100.84.170.161","151.101.2.187","TLSv1.2","2504","Application Data"
"45","8.183478800","151.101.2.187","100.84.170.161","TLSv1.2","213","Application Data"
"46","8.189055000","151.101.2.187","100.84.170.161","TCP","56","443  >  55283 [ACK] Seq=1250 Ack=26964 Win=1052 Len=0"
"47","8.191321000","151.101.2.187","100.84.170.161","TLSv1.2","130","Application Data"
"48","8.191389600","100.84.170.161","151.101.2.187","TCP","54","55283  >  443 [ACK] Seq=29414 Ack=1326 Win=508 Len=0"
"49","8.192124100","151.101.2.187","100.84.170.161","TCP","56","443  >  55283 [ACK] Seq=1326 Ack=29414 Win=1064 Len=0"
"50","8.195403400","151.101.2.187","100.84.170.161","TLSv1.2","131","Application Data"
"51","8.232608400","151.101.2.187","100.84.170.161","TCP","131","[TCP Retransmission] 443  >  55283 [PSH, ACK] Seq=1326 Ack=29414 Win=1064 Len=77"
"52","8.232658200","100.84.170.161","151.101.2.187","TCP","66","55283  >  443 [ACK] Seq=29414 Ack=1403 Win=507 Len=0 SLE=1326 SRE=1403"
"53","8.288484200","100.84.170.161","151.101.2.187","TLSv1.2","2504","Application Data"
"54","8.298153200","151.101.2.187","100.84.170.161","TCP","56","443  >  55283 [ACK] Seq=1403 Ack=31864 Win=1075 Len=0"
"55","8.302373300","151.101.2.187","100.84.170.161","TLSv1.2","130","Application Data"
"56","8.329104900","100.84.170.161","151.101.2.187","TLSv1.2","2518","Application Data"
"57","8.334419400","151.101.2.187","100.84.170.161","TCP","130","[TCP Spurious Retransmission] 443  >  55283 [PSH, ACK] Seq=1403 Ack=31864 Win=1075 Len=76"
"58","8.334459000","100.84.170.161","151.101.2.187","TCP","66","[TCP Dup ACK 56#1] 55283  >  443 [ACK] Seq=34328 Ack=1479 Win=513 Len=0 SLE=1403 SRE=1479"
"59","8.337902500","151.101.2.187","100.84.170.161","TCP","56","443  >  55283 [ACK] Seq=1479 Ack=34328 Win=1087 Len=0"
"60","8.340718000","151.101.2.187","100.84.170.161","TLSv1.2","130","Application Data"
"61","8.373550900","151.101.2.187","100.84.170.161","TCP","130","[TCP Retransmission] 443  >  55283 [PSH, ACK] Seq=1479 Ack=34328 Win=1087 Len=76"
"62","8.373637200","100.84.170.161","151.101.2.187","TCP","66","55283  >  443 [ACK] Seq=34328 Ack=1555 Win=512 Len=0 SLE=1479 SRE=1555"
"63","8.409329000","100.84.170.161","151.101.2.187","TLSv1.2","2501","Application Data"
"64","8.418079200","151.101.2.187","100.84.170.161","TCP","56","443  >  55283 [ACK] Seq=1555 Ack=36775 Win=1098 Len=0"
"65","8.421335600","151.101.2.187","100.84.170.161","TLSv1.2","130","Application Data"
"66","8.454283900","151.101.2.187","100.84.170.161","TCP","130","[TCP Retransmission] 443  >  55283 [PSH, ACK] Seq=1555 Ack=36775 Win=1098 Len=76"
"67","8.454319900","100.84.170.161","151.101.2.187","TCP","66","55283  >  443 [ACK] Seq=36775 Ack=1631 Win=512 Len=0 SLE=1555 SRE=1631"
"68","8.546192500","100.84.170.161","151.101.2.187","TLSv1.2","2518","Application Data"
"69","8.555144600","151.101.2.187","100.84.170.161","TCP","56","443  >  55283 [ACK] Seq=1631 Ack=39239 Win=1109 Len=0"
"70","8.557600900","151.101.2.187","100.84.170.161","TLSv1.2","240","Application Data"
"71","8.590220300","151.101.2.187","100.84.170.161","TCP","240","[TCP Retransmission] 443  >  55283 [PSH, ACK] Seq=1631 Ack=39239 Win=1109 Len=186"
"72","8.590254000","100.84.170.161","151.101.2.187","TCP","66","55283  >  443 [ACK] Seq=39239 Ack=1817 Win=511 Len=0 SLE=1631 SRE=1817"
"73","8.687260600","100.84.170.161","151.101.2.187","TLSv1.2","2505","Application Data"
"74","8.696162700","151.101.2.187","100.84.170.161","TCP","56","443  >  55283 [ACK] Seq=1817 Ack=41690 Win=1121 Len=0"
"75","8.699128600","151.101.2.187","100.84.170.161","TLSv1.2","130","Application Data"
"76","8.710867300","100.84.170.161","151.101.2.187","TLSv1.2","2513","Application Data"
"77","8.720059400","151.101.2.187","100.84.170.161","TCP","56","443  >  55283 [ACK] Seq=1893 Ack=44149 Win=1132 Len=0"
"78","8.724150300","151.101.2.187","100.84.170.161","TLSv1.2","131","Application Data"
"79","8.758391300","151.101.2.187","100.84.170.161","TCP","131","[TCP Retransmission] 443  >  55283 [PSH, ACK] Seq=1893 Ack=44149 Win=1132 Len=77"
"80","8.758424100","100.84.170.161","151.101.2.187","TCP","66","55283  >  443 [ACK] Seq=44149 Ack=1970 Win=511 Len=0 SLE=1893 SRE=1970"
"81","8.834357400","100.84.170.161","151.101.2.187","TLSv1.2","2523","Application Data"
"82","8.834699700","100.84.170.161","151.101.2.187","TLSv1.2","2523","Application Data"
"83","8.834992100","100.84.170.161","151.101.2.187","TLSv1.2","2519","Application Data"
"84","8.836048300","100.84.170.161","151.101.2.187","TLSv1.2","2519","Application Data"
"85","8.836312000","100.84.170.161","151.101.2.187","TLSv1.2","2507","Application Data"
"86","8.836735900","100.84.170.161","151.101.2.187","TLSv1.2","2506","Application Data"
"87","8.836948400","100.84.170.161","151.101.2.187","TLSv1.2","2503","Application Data"
"88","8.843370100","151.101.2.187","100.84.170.161","TCP","56","443  >  55283 [ACK] Seq=1970 Ack=46618 Win=1144 Len=0"
"89","8.843750600","151.101.2.187","100.84.170.161","TCP","56","443  >  55283 [ACK] Seq=1970 Ack=49087 Win=1155 Len=0"
"90","8.844379000","151.101.2.187","100.84.170.161","TCP","56","443  >  55283 [ACK] Seq=1970 Ack=51552 Win=1166 Len=0"
"91","8.845617500","151.101.2.187","100.84.170.161","TCP","56","443  >  55283 [ACK] Seq=1970 Ack=58922 Win=1201 Len=0"
"92","8.846382900","151.101.2.187","100.84.170.161","TCP","56","443  >  55283 [ACK] Seq=1970 Ack=61371 Win=1212 Len=0"
"93","8.847302400","151.101.2.187","100.84.170.161","TLSv1.2","130","Application Data"
"94","8.848007500","151.101.2.187","100.84.170.161","TLSv1.2","340","Application Data"
"95","8.848057000","100.84.170.161","151.101.2.187","TCP","54","55283  >  443 [ACK] Seq=61371 Ack=2332 Win=509 Len=0"
"96","8.849288700","151.101.2.187","100.84.170.161","TLSv1.2","130","Application Data"
"97","8.849677800","151.101.2.187","100.84.170.161","TLSv1.2","130","Application Data"
"98","8.849735500","100.84.170.161","151.101.2.187","TCP","54","55283  >  443 [ACK] Seq=61371 Ack=2484 Win=509 Len=0"
"99","8.849981600","151.101.2.187","100.84.170.161","TLSv1.2","240","Application Data"
"100","8.889510100","100.84.170.161","151.101.2.187","TCP","54","55283  >  443 [ACK] Seq=61371 Ack=2670 Win=508 Len=0"
"101","8.891472400","151.101.2.187","100.84.170.161","TCP","240","[TCP Spurious Retransmission] 443  >  55283 [PSH, ACK] Seq=2484 Ack=61371 Win=1212 Len=186"
"102","8.891522100","100.84.170.161","151.101.2.187","TCP","66","[TCP Dup ACK 100#1] 55283  >  443 [ACK] Seq=61371 Ack=2670 Win=508 Len=0 SLE=2484 SRE=2670"
"103","9.137862400","100.84.170.161","151.101.2.187","TLSv1.2","2530","Application Data"
"104","9.146960400","151.101.2.187","100.84.170.161","TCP","56","443  >  55283 [ACK] Seq=2670 Ack=63847 Win=1224 Len=0"
"105","9.150059800","151.101.2.187","100.84.170.161","TLSv1.2","130","Application Data"
"106","9.183195300","151.101.2.187","100.84.170.161","TCP","130","[TCP Retransmission] 443  >  55283 [PSH, ACK] Seq=2670 Ack=63847 Win=1224 Len=76"
"107","9.183279900","100.84.170.161","151.101.2.187","TCP","66","55283  >  443 [ACK] Seq=63847 Ack=2746 Win=508 Len=0 SLE=2670 SRE=2746"
"108","17.259101600","100.84.170.161","151.101.2.187","TLSv1.2","2534","Application Data"
"109","17.269340300","151.101.2.187","100.84.170.161","TCP","56","443  >  55283 [ACK] Seq=2746 Ack=66327 Win=1235 Len=0"
"110","17.273196800","151.101.2.187","100.84.170.161","TLSv1.2","241","Application Data"
"111","17.305473200","151.101.2.187","100.84.170.161","TCP","241","[TCP Retransmission] 443  >  55283 [PSH, ACK] Seq=2746 Ack=66327 Win=1235 Len=187"
"112","17.305520300","100.84.170.161","151.101.2.187","TCP","66","55283  >  443 [ACK] Seq=66327 Ack=2933 Win=507 Len=0 SLE=2746 SRE=2933"
"113","20.719396100","100.84.170.161","151.101.2.187","TLSv1.2","2539","Application Data"
"114","20.724794200","100.84.170.161","151.101.2.187","TLSv1.2","2537","Application Data"
"115","20.728543800","151.101.2.187","100.84.170.161","TCP","56","443  >  55283 [ACK] Seq=2933 Ack=68812 Win=1246 Len=0"
"116","20.732524700","151.101.2.187","100.84.170.161","TLSv1.2","240","Application Data"
"117","20.732578300","100.84.170.161","151.101.2.187","TCP","54","55283  >  443 [ACK] Seq=71295 Ack=3119 Win=513 Len=0"
"118","20.733966000","151.101.2.187","100.84.170.161","TCP","56","443  >  55283 [ACK] Seq=3119 Ack=71295 Win=1258 Len=0"
"119","20.738342900","151.101.2.187","100.84.170.161","TLSv1.2","131","Application Data"
"120","20.738408600","100.84.170.161","151.101.2.187","TCP","54","55283  >  443 [ACK] Seq=71295 Ack=3196 Win=512 Len=0"
"121","21.237762200","100.84.170.161","151.101.2.187","TLSv1.2","2540","Application Data"
"122","21.250067800","151.101.2.187","100.84.170.161","TCP","56","443  >  55283 [ACK] Seq=3196 Ack=73781 Win=1269 Len=0"
"123","21.252718500","151.101.2.187","100.84.170.161","TLSv1.2","130","Application Data"
"124","21.281875300","151.101.2.187","100.84.170.161","TCP","130","[TCP Retransmission] 443  >  55283 [PSH, ACK] Seq=3196 Ack=73781 Win=1269 Len=76"
"125","21.281930500","100.84.170.161","151.101.2.187","TCP","66","55283  >  443 [ACK] Seq=73781 Ack=3272 Win=512 Len=0 SLE=3196 SRE=3272"
"126","23.488450000","100.84.170.161","151.101.2.187","TCP","66","63540  >  443 [SYN] Seq=0 Win=64240 Len=0 MSS=1460 WS=256 SACK_PERM"
"127","23.501197200","151.101.2.187","100.84.170.161","TCP","66","443  >  63540 [SYN, ACK] Seq=0 Ack=1 Win=65535 Len=0 MSS=1460 SACK_PERM WS=512"
"128","23.501296700","100.84.170.161","151.101.2.187","TCP","54","63540  >  443 [ACK] Seq=1 Ack=1 Win=131328 Len=0"
"129","23.502198300","100.84.170.161","151.101.2.187","TLSv1.3","2034","Client Hello (SNI=r2d2.target.com)"
"130","23.512535800","151.101.2.187","100.84.170.161","TCP","56","443  >  63540 [ACK] Seq=1 Ack=1981 Win=144384 Len=0"
"131","23.512856500","151.101.2.187","100.84.170.161","TLSv1.3","1510","Server Hello, Change Cipher Spec, Application Data, Application Data"
"132","23.513193800","151.101.2.187","100.84.170.161","TLSv1.3","139","Application Data"
"133","23.513227700","100.84.170.161","151.101.2.187","TCP","54","63540  >  443 [ACK] Seq=1981 Ack=1542 Win=131328 Len=0"
"134","23.516229600","100.84.170.161","151.101.2.187","TLSv1.3","118","Change Cipher Spec, Application Data"
"135","23.517663300","100.84.170.161","151.101.2.187","TLSv1.3","146","Application Data"
"136","23.519904800","100.84.170.161","151.101.2.187","TLSv1.3","599","Application Data"
"137","23.525231000","151.101.2.187","100.84.170.161","TCP","56","443  >  63540 [ACK] Seq=1542 Ack=2045 Win=145920 Len=0"
"138","23.527517500","151.101.2.187","100.84.170.161","TLSv1.3","119","Application Data"
"139","23.527724300","100.84.170.161","151.101.2.187","TLSv1.3","85","Application Data"
"140","23.528853900","151.101.2.187","100.84.170.161","TCP","56","443  >  63540 [ACK] Seq=1607 Ack=2682 Win=145408 Len=0"
"141","23.536260800","151.101.2.187","100.84.170.161","TCP","56","443  >  63540 [ACK] Seq=1607 Ack=2713 Win=145408 Len=0"
"142","23.583318900","151.101.2.187","100.84.170.161","TLSv1.3","513","Application Data"
"143","23.583751100","151.101.2.187","100.84.170.161","TLSv1.3","920","Application Data"
"144","23.583847400","100.84.170.161","151.101.2.187","TCP","54","63540  >  443 [ACK] Seq=2713 Ack=2932 Win=129792 Len=0"
"145","23.584065300","151.101.2.187","100.84.170.161","TLSv1.3","85","Application Data"
"146","23.619453000","151.101.2.187","100.84.170.161","TCP","85","[TCP Retransmission] 443  >  63540 [PSH, ACK] Seq=2932 Ack=2713 Win=145920 Len=31"
"147","23.619491000","100.84.170.161","151.101.2.187","TCP","66","63540  >  443 [ACK] Seq=2713 Ack=2963 Win=129792 Len=0 SLE=2932 SRE=2963"
"148","31.182413600","100.84.170.161","151.101.2.187","TLSv1.2","2536","Application Data"
"149","31.191467900","151.101.2.187","100.84.170.161","TCP","56","443  >  55283 [ACK] Seq=3272 Ack=76263 Win=1281 Len=0"
"150","31.194493300","151.101.2.187","100.84.170.161","TLSv1.2","423","Application Data"
"151","31.204457400","100.84.170.161","151.101.2.187","TLSv1.2","2527","Application Data"
"152","31.207962200","100.84.170.161","151.101.2.187","TLSv1.2","2521","Application Data"
"153","31.213226000","151.101.2.187","100.84.170.161","TCP","56","443  >  55283 [ACK] Seq=3641 Ack=78736 Win=1292 Len=0"
"154","31.215763000","151.101.2.187","100.84.170.161","TLSv1.2","130","Application Data"
"155","31.216913100","151.101.2.187","100.84.170.161","TCP","56","443  >  55283 [ACK] Seq=3717 Ack=81203 Win=1303 Len=0"
"156","31.221493500","151.101.2.187","100.84.170.161","TLSv1.2","131","Application Data"
"157","31.221612100","100.84.170.161","151.101.2.187","TCP","54","55283  >  443 [ACK] Seq=81203 Ack=3794 Win=510 Len=0"
"158","31.239841900","100.84.170.161","151.101.2.187","TLSv1.2","2521","Application Data"
"159","31.248836800","151.101.2.187","100.84.170.161","TCP","56","443  >  55283 [ACK] Seq=3794 Ack=83670 Win=1315 Len=0"
"160","31.253017700","151.101.2.187","100.84.170.161","TLSv1.2","130","Application Data"
"161","31.284857800","151.101.2.187","100.84.170.161","TCP","130","[TCP Retransmission] 443  >  55283 [PSH, ACK] Seq=3794 Ack=83670 Win=1315 Len=76"
"162","31.284907800","100.84.170.161","151.101.2.187","TCP","66","55283  >  443 [ACK] Seq=83670 Ack=3870 Win=510 Len=0 SLE=3794 SRE=3870"
"163","31.370823800","100.84.170.161","151.101.2.187","TLSv1.2","2518","Application Data"
"164","31.379653000","151.101.2.187","100.84.170.161","TCP","56","443  >  55283 [ACK] Seq=3870 Ack=86134 Win=1326 Len=0"
"165","31.382632900","151.101.2.187","100.84.170.161","TLSv1.2","130","Application Data"
"166","31.395083300","100.84.170.161","151.101.2.187","TLSv1.2","2535","Application Data"
"167","31.404243900","151.101.2.187","100.84.170.161","TCP","56","443  >  55283 [ACK] Seq=3946 Ack=88615 Win=1338 Len=0"
"168","31.406443200","151.101.2.187","100.84.170.161","TLSv1.2","130","Application Data"
"169","31.439597500","151.101.2.187","100.84.170.161","TCP","130","[TCP Retransmission] 443  >  55283 [PSH, ACK] Seq=3946 Ack=88615 Win=1338 Len=76"
"170","31.439646100","100.84.170.161","151.101.2.187","TCP","66","55283  >  443 [ACK] Seq=88615 Ack=4022 Win=509 Len=0 SLE=3946 SRE=4022"
"171","31.456213400","100.84.170.161","151.101.2.187","TLSv1.2","2535","Application Data"
"172","31.464908700","151.101.2.187","100.84.170.161","TCP","56","443  >  55283 [ACK] Seq=4022 Ack=91096 Win=1349 Len=0"
"173","31.469652200","151.101.2.187","100.84.170.161","TLSv1.2","103","Application Data"
"174","31.502570300","151.101.2.187","100.84.170.161","TCP","103","[TCP Retransmission] 443  >  55283 [PSH, ACK] Seq=4022 Ack=91096 Win=1349 Len=49"
"175","31.502626000","100.84.170.161","151.101.2.187","TCP","66","55283  >  443 [ACK] Seq=91096 Ack=4071 Win=509 Len=0 SLE=4022 SRE=4071"
"176","31.748290100","100.84.170.161","151.101.2.187","TLSv1.2","2530","Application Data"
"177","31.758381600","151.101.2.187","100.84.170.161","TCP","56","443  >  55283 [ACK] Seq=4071 Ack=93572 Win=1360 Len=0"
"178","31.761939800","151.101.2.187","100.84.170.161","TLSv1.2","241","Application Data"
"179","31.794523100","151.101.2.187","100.84.170.161","TCP","241","[TCP Retransmission] 443  >  55283 [PSH, ACK] Seq=4071 Ack=93572 Win=1360 Len=187"
"180","31.794581500","100.84.170.161","151.101.2.187","TCP","66","55283  >  443 [ACK] Seq=93572 Ack=4258 Win=508 Len=0 SLE=4071 SRE=4258"
"181","31.872852400","100.84.170.161","151.101.2.187","TLSv1.2","2475","Application Data"
"182","31.879918700","100.84.170.161","151.101.2.187","TLSv1.2","2532","Application Data"
"183","31.880139600","100.84.170.161","151.101.2.187","TLSv1.2","2535","Application Data"
"184","31.881823700","151.101.2.187","100.84.170.161","TCP","56","443  >  55283 [ACK] Seq=4258 Ack=95993 Win=1372 Len=0"
"185","31.884282300","151.101.2.187","100.84.170.161","TLSv1.2","173","Application Data"
"186","31.884645100","151.101.2.187","100.84.170.161","TLSv1.2","452","Application Data"
"187","31.884685100","100.84.170.161","151.101.2.187","TCP","54","55283  >  443 [ACK] Seq=100952 Ack=4775 Win=513 Len=0"
"188","31.886770000","100.84.170.161","151.101.2.187","TLSv1.2","89","Application Data"
"189","31.888881400","151.101.2.187","100.84.170.161","TCP","56","443  >  55283 [ACK] Seq=4775 Ack=98471 Win=1383 Len=0"
"190","31.889266800","151.101.2.187","100.84.170.161","TCP","56","443  >  55283 [ACK] Seq=4775 Ack=100952 Win=1395 Len=0"
"191","31.891565600","151.101.2.187","100.84.170.161","TLSv1.2","130","Application Data"
"192","31.893842300","151.101.2.187","100.84.170.161","TLSv1.2","130","Application Data"
"193","31.893905500","100.84.170.161","151.101.2.187","TCP","54","55283  >  443 [ACK] Seq=100987 Ack=4927 Win=512 Len=0"
"194","31.895829500","151.101.2.187","100.84.170.161","TCP","56","443  >  55283 [ACK] Seq=4927 Ack=100987 Win=1395 Len=0"
"195","32.005612800","100.84.170.161","151.101.2.187","TLSv1.2","2544","Application Data"
"196","32.006319000","100.84.170.161","151.101.2.187","TLSv1.2","2532","Application Data"
"197","32.006492300","100.84.170.161","151.101.2.187","TLSv1.2","2531","Application Data"
"198","32.017577800","151.101.2.187","100.84.170.161","TCP","56","443  >  55283 [ACK] Seq=4927 Ack=108432 Win=1429 Len=0"
"199","32.019287000","151.101.2.187","100.84.170.161","TLSv1.2","341","Application Data"
"200","32.019599200","151.101.2.187","100.84.170.161","TLSv1.2","131","Application Data"
"201","32.019599200","151.101.2.187","100.84.170.161","TLSv1.2","130","Application Data"
"202","32.019623500","100.84.170.161","151.101.2.187","TCP","54","55283  >  443 [ACK] Seq=108432 Ack=5367 Win=510 Len=0"
"203","36.357088900","100.84.170.161","151.101.2.187","TLSv1.2","2530","Application Data"
"204","36.366558000","151.101.2.187","100.84.170.161","TCP","56","443  >  55283 [ACK] Seq=5367 Ack=110908 Win=1440 Len=0"
"205","36.369644700","151.101.2.187","100.84.170.161","TLSv1.2","240","Application Data"
"206","36.399244100","151.101.2.187","100.84.170.161","TCP","240","[TCP Retransmission] 443  >  55283 [PSH, ACK] Seq=5367 Ack=110908 Win=1440 Len=186"
"207","36.399278900","100.84.170.161","151.101.2.187","TCP","66","55283  >  443 [ACK] Seq=110908 Ack=5553 Win=510 Len=0 SLE=5367 SRE=5553"
"208","36.458558900","100.84.170.161","151.101.2.187","TLSv1.2","2528","Application Data"
"209","36.467472200","151.101.2.187","100.84.170.161","TCP","56","443  >  55283 [ACK] Seq=5553 Ack=113382 Win=1452 Len=0"
"210","36.470500000","151.101.2.187","100.84.170.161","TLSv1.2","131","Application Data"
"211","36.500342100","151.101.2.187","100.84.170.161","TCP","131","[TCP Retransmission] 443  >  55283 [PSH, ACK] Seq=5553 Ack=113382 Win=1452 Len=77"
"212","36.500376900","100.84.170.161","151.101.2.187","TCP","66","55283  >  443 [ACK] Seq=113382 Ack=5630 Win=509 Len=0 SLE=5553 SRE=5630"
"213","36.597232300","100.84.170.161","151.101.2.187","TLSv1.2","2531","Application Data"
"214","36.607108200","151.101.2.187","100.84.170.161","TCP","56","443  >  55283 [ACK] Seq=5630 Ack=115859 Win=1463 Len=0"
"215","36.611976300","151.101.2.187","100.84.170.161","TLSv1.2","240","Application Data"
"216","36.641131100","151.101.2.187","100.84.170.161","TCP","240","[TCP Retransmission] 443  >  55283 [PSH, ACK] Seq=5630 Ack=115859 Win=1463 Len=186"
"217","36.641168900","100.84.170.161","151.101.2.187","TCP","66","55283  >  443 [ACK] Seq=115859 Ack=5816 Win=509 Len=0 SLE=5630 SRE=5816"
"218","37.602118400","100.84.170.161","151.101.2.187","TLSv1.2","2525","Application Data"
"219","37.604142200","100.84.170.161","151.101.2.187","TLSv1.2","2531","Application Data"
"220","37.611208200","151.101.2.187","100.84.170.161","TCP","56","443  >  55283 [ACK] Seq=5816 Ack=118330 Win=1474 Len=0"
"221","37.613037700","151.101.2.187","100.84.170.161","TCP","56","443  >  55283 [ACK] Seq=5816 Ack=120807 Win=1486 Len=0"
"222","37.614270400","151.101.2.187","100.84.170.161","TLSv1.2","241","Application Data"
"223","37.615087800","151.101.2.187","100.84.170.161","TLSv1.2","103","Application Data"
"224","37.615150300","100.84.170.161","151.101.2.187","TCP","54","55283  >  443 [ACK] Seq=120807 Ack=6052 Win=508 Len=0"
"225","37.658075000","100.84.170.161","151.101.2.187","TLSv1.2","2519","Application Data"
"226","37.658634900","100.84.170.161","151.101.2.187","TLSv1.2","2516","Application Data"
"227","37.667135100","151.101.2.187","100.84.170.161","TCP","56","443  >  55283 [ACK] Seq=6052 Ack=123272 Win=1497 Len=0"
"228","37.668466800","151.101.2.187","100.84.170.161","TCP","56","443  >  55283 [ACK] Seq=6052 Ack=125734 Win=1509 Len=0"
"229","37.669751100","151.101.2.187","100.84.170.161","TLSv1.2","129","Application Data"
"230","37.671401100","151.101.2.187","100.84.170.161","TLSv1.2","130","Application Data"
"231","37.671450600","100.84.170.161","151.101.2.187","TCP","54","55283  >  443 [ACK] Seq=125734 Ack=6203 Win=507 Len=0"
"232","42.970707300","100.84.170.161","151.101.2.187","TLSv1.2","2532","Application Data"
"233","42.979845200","151.101.2.187","100.84.170.161","TCP","56","443  >  55283 [ACK] Seq=6203 Ack=128212 Win=1520 Len=0"
"234","43.285699400","151.101.2.187","100.84.170.161","TCP","14614","443  >  55283 [ACK] Seq=6203 Ack=128212 Win=1520 Len=14560 [TCP PDU reassembled in 235]"
"235","43.285699400","151.101.2.187","100.84.170.161","TLSv1.2","900","Application Data"
"236","43.285699400","151.101.2.187","100.84.170.161","TLSv1.2","27718","Application Data"
"237","43.285699400","151.101.2.187","100.84.170.161","TLSv1.2","1063","Application Data"
"238","43.285699400","151.101.2.187","100.84.170.161","TLSv1.2","8790","Application Data"
"239","43.285699400","151.101.2.187","100.84.170.161","TLSv1.2","1088","Application Data"
"240","43.285699400","151.101.2.187","100.84.170.161","TCP","1088","[TCP Retransmission] 443  >  55283 [PSH, ACK] Seq=59018 Ack=128212 Win=1520 Len=1034 [TCP PDU reassembled in 239]"
"241","43.285878600","100.84.170.161","151.101.2.187","TCP","66","55283  >  443 [ACK] Seq=128212 Ack=60052 Win=513 Len=0 SLE=59018 SRE=60052"
"242","43.293842300","100.84.170.161","151.101.2.187","TLSv1.2","89","Application Data"
"243","43.303782100","151.101.2.187","100.84.170.161","TCP","56","443  >  55283 [ACK] Seq=60052 Ack=128247 Win=1520 Len=0"
"244","43.380136900","151.101.2.187","100.84.170.161","TCP","1510","443  >  55283 [ACK] Seq=60052 Ack=128247 Win=1520 Len=1456 [TCP PDU reassembled in 245]"
"245","43.380496600","151.101.2.187","100.84.170.161","TLSv1.2","210","Application Data"
"246","43.380576900","100.84.170.161","151.101.2.187","TCP","54","55283  >  443 [ACK] Seq=128247 Ack=61664 Win=513 Len=0"
"247","43.387898800","151.101.2.187","100.84.170.161","TCP","1510","443  >  55283 [ACK] Seq=61664 Ack=128247 Win=1520 Len=1456 [TCP PDU reassembled in 250]"
"248","43.388216900","151.101.2.187","100.84.170.161","TCP","1510","443  >  55283 [ACK] Seq=63120 Ack=128247 Win=1520 Len=1456 [TCP PDU reassembled in 250]"
"249","43.388267700","100.84.170.161","151.101.2.187","TCP","54","55283  >  443 [ACK] Seq=128247 Ack=64576 Win=513 Len=0"
"250","43.388797000","151.101.2.187","100.84.170.161","TLSv1.2","399","Application Data"
"251","43.388797000","151.101.2.187","100.84.170.161","TCP","2966","443  >  55283 [ACK] Seq=64921 Ack=128247 Win=1520 Len=2912 [TCP PDU reassembled in 253]"
"252","43.388866100","100.84.170.161","151.101.2.187","TCP","54","55283  >  443 [ACK] Seq=128247 Ack=67833 Win=513 Len=0"
"253","43.389343200","151.101.2.187","100.84.170.161","TLSv1.2","73","Application Data"
"254","43.389392200","100.84.170.161","151.101.2.187","TCP","54","55283  >  443 [ACK] Seq=128247 Ack=67852 Win=513 Len=0"
"255","43.412512900","151.101.2.187","100.84.170.161","TLSv1.2","265","Application Data"
"256","43.412909200","151.101.2.187","100.84.170.161","TCP","1510","443  >  55283 [ACK] Seq=68063 Ack=128247 Win=1520 Len=1456 [TCP PDU reassembled in 258]"
"257","43.412971200","100.84.170.161","151.101.2.187","TCP","54","55283  >  443 [ACK] Seq=128247 Ack=69519 Win=513 Len=0"
"258","43.413336300","151.101.2.187","100.84.170.161","TLSv1.2","1462","Application Data"
"259","43.415337800","151.101.2.187","100.84.170.161","TLSv1.2","1099","Application Data"
"260","43.415420600","100.84.170.161","151.101.2.187","TCP","54","55283  >  443 [ACK] Seq=128247 Ack=71972 Win=513 Len=0"
"261","43.506706000","151.101.2.187","100.84.170.161","TLSv1.2","86","Application Data"
"262","43.507373800","151.101.2.187","100.84.170.161","TLSv1.2","93","Application Data"
"263","43.507474700","100.84.170.161","151.101.2.187","TCP","54","55283  >  443 [ACK] Seq=128247 Ack=72043 Win=513 Len=0"
"264","43.507806800","151.101.2.187","100.84.170.161","TCP","2966","443  >  55283 [ACK] Seq=72043 Ack=128247 Win=1520 Len=2912 [TCP PDU reassembled in 265]"
"265","43.507806800","151.101.2.187","100.84.170.161","TLSv1.2","501","Application Data"
"266","43.507862500","100.84.170.161","151.101.2.187","TCP","54","55283  >  443 [ACK] Seq=128247 Ack=75402 Win=513 Len=0"
"267","43.509494400","151.101.2.187","100.84.170.161","TCP","10246","443  >  55283 [ACK] Seq=75402 Ack=128247 Win=1520 Len=10192 [TCP PDU reassembled in 268]"
"268","43.509494400","151.101.2.187","100.84.170.161","TLSv1.2","176","Application Data"
"269","43.509564300","100.84.170.161","151.101.2.187","TCP","54","55283  >  443 [ACK] Seq=128247 Ack=85716 Win=513 Len=0"
"270","43.572685300","151.101.2.187","100.84.170.161","TCP","1510","443  >  55283 [ACK] Seq=85716 Ack=128247 Win=1520 Len=1456 [TCP PDU reassembled in 271]"
"271","43.572981500","151.101.2.187","100.84.170.161","TLSv1.2","241","Application Data"
"272","43.573011800","100.84.170.161","151.101.2.187","TCP","54","55283  >  443 [ACK] Seq=128247 Ack=87359 Win=513 Len=0"
"273","43.574123300","151.101.2.187","100.84.170.161","TLSv1.2","89","Application Data"
"274","43.574123300","151.101.2.187","100.84.170.161","TLSv1.2","1290","Application Data"
"275","43.574123300","151.101.2.187","100.84.170.161","TLSv1.2","1380","Application Data"
"276","43.574123300","151.101.2.187","100.84.170.161","TLSv1.2","540","Application Data, Application Data"
"277","43.574123300","151.101.2.187","100.84.170.161","TCP","1510","443  >  55283 [ACK] Seq=90442 Ack=128247 Win=1520 Len=1456 [TCP PDU reassembled in 278]"
"278","43.574123300","151.101.2.187","100.84.170.161","TLSv1.2","271","Application Data"
"279","43.574298300","100.84.170.161","151.101.2.187","TCP","54","55283  >  443 [ACK] Seq=128247 Ack=92115 Win=513 Len=0"
"280","43.577876300","151.101.2.187","100.84.170.161","TLSv1.2","100","Application Data"
"281","43.577876300","151.101.2.187","100.84.170.161","TLSv1.2","1282","Application Data"
"282","43.577932300","100.84.170.161","151.101.2.187","TCP","54","55283  >  443 [ACK] Seq=128247 Ack=93389 Win=508 Len=0"
"283","43.578218700","151.101.2.187","100.84.170.161","TLSv1.2","476","Application Data"
"284","43.582594200","151.101.2.187","100.84.170.161","TLSv1.2","86","Application Data"
"285","43.582657000","100.84.170.161","151.101.2.187","TCP","54","55283  >  443 [ACK] Seq=128247 Ack=93843 Win=513 Len=0"
"286","43.583086000","151.101.2.187","100.84.170.161","TLSv1.2","500","Application Data"
"287","43.591812300","151.101.2.187","100.84.170.161","TLSv1.2","95","Application Data"
"288","43.591869300","100.84.170.161","151.101.2.187","TCP","54","55283  >  443 [ACK] Seq=128247 Ack=94330 Win=511 Len=0"
"289","43.592371500","151.101.2.187","100.84.170.161","TLSv1.2","85","Application Data"
"290","43.627289700","151.101.2.187","100.84.170.161","TCP","85","[TCP Retransmission] 443  >  55283 [PSH, ACK] Seq=94330 Ack=128247 Win=1520 Len=31"
"291","43.627326900","100.84.170.161","151.101.2.187","TCP","66","55283  >  443 [ACK] Seq=128247 Ack=94361 Win=511 Len=0 SLE=94330 SRE=94361"
"292","43.745455900","100.84.170.161","151.101.2.187","TLSv1.2","2490","Application Data"
"293","43.745778000","100.84.170.161","151.101.2.187","TLSv1.2","2488","Application Data"
"294","43.746009700","100.84.170.161","151.101.2.187","TLSv1.2","2488","Application Data"
"295","43.752847200","100.84.170.161","151.101.2.187","TLSv1.2","2486","Application Data"
"296","43.757406200","151.101.2.187","100.84.170.161","TCP","56","443  >  55283 [ACK] Seq=94361 Ack=135551 Win=1552 Len=0"
"297","43.757997800","151.101.2.187","100.84.170.161","TLSv1.2","290","Application Data"
"298","43.758285600","151.101.2.187","100.84.170.161","TLSv1.2","130","Application Data"
"299","43.758320500","100.84.170.161","151.101.2.187","TCP","54","55283  >  443 [ACK] Seq=137983 Ack=94673 Win=510 Len=0"
"300","43.758680900","151.101.2.187","100.84.170.161","TLSv1.2","131","Application Data"
"301","43.762609300","151.101.2.187","100.84.170.161","TCP","56","443  >  55283 [ACK] Seq=94750 Ack=137983 Win=1564 Len=0"
"302","43.764818700","151.101.2.187","100.84.170.161","TLSv1.2","130","Application Data"
"303","43.764911900","100.84.170.161","151.101.2.187","TCP","54","55283  >  443 [ACK] Seq=137983 Ack=94826 Win=509 Len=0"
"304","43.804836700","100.84.170.161","151.101.2.187","TLSv1.2","2494","Application Data"
"305","43.805484100","100.84.170.161","151.101.2.187","TLSv1.2","2490","Application Data"
"306","43.805792200","100.84.170.161","151.101.2.187","TLSv1.2","2493","Application Data"
"307","43.806051200","100.84.170.161","151.101.2.187","TLSv1.2","2488","Application Data"
"308","43.813913100","151.101.2.187","100.84.170.161","TCP","56","443  >  55283 [ACK] Seq=94826 Ack=140423 Win=1575 Len=0"
"309","43.814228000","151.101.2.187","100.84.170.161","TCP","56","443  >  55283 [ACK] Seq=94826 Ack=142859 Win=1587 Len=0"
"310","43.814619300","151.101.2.187","100.84.170.161","TCP","56","443  >  55283 [ACK] Seq=94826 Ack=145298 Win=1598 Len=0"
"311","43.814996200","151.101.2.187","100.84.170.161","TCP","56","443  >  55283 [ACK] Seq=94826 Ack=147732 Win=1609 Len=0"
"312","43.817001300","151.101.2.187","100.84.170.161","TLSv1.2","130","Application Data"
"313","43.817400300","151.101.2.187","100.84.170.161","TLSv1.2","130","Application Data"
"314","43.817522800","100.84.170.161","151.101.2.187","TCP","54","55283  >  443 [ACK] Seq=147732 Ack=94978 Win=508 Len=0"
"315","43.818380800","151.101.2.187","100.84.170.161","TLSv1.2","130","Application Data"
"316","43.818654500","151.101.2.187","100.84.170.161","TLSv1.2","153","Application Data"
"317","43.818684000","100.84.170.161","151.101.2.187","TCP","54","55283  >  443 [ACK] Seq=147732 Ack=95153 Win=508 Len=0"
"318","43.929715300","100.84.170.161","151.101.2.187","TLSv1.2","2496","Application Data"
"319","43.940725800","100.84.170.161","151.101.2.187","TLSv1.2","2490","Application Data"
"320","43.940928400","100.84.170.161","151.101.2.187","TLSv1.2","2497","Application Data"
"321","43.941102200","100.84.170.161","151.101.2.187","TLSv1.2","2490","Application Data"
"322","43.941242800","100.84.170.161","151.101.2.187","TLSv1.2","2496","Application Data"
"323","43.941370700","100.84.170.161","151.101.2.187","TLSv1.2","2490","Application Data"
"324","43.941509400","100.84.170.161","151.101.2.187","TLSv1.2","2496","Application Data"
"325","43.942455800","100.84.170.161","151.101.2.187","TLSv1.2","2487","Application Data"
"326","43.942627300","100.84.170.161","151.101.2.187","TLSv1.2","2504","Application Data"
"327","43.942747700","100.84.170.161","151.101.2.187","TLSv1.2","2505","Application Data"
"328","43.942863000","100.84.170.161","151.101.2.187","TLSv1.2","2489","Application Data"
"329","43.942993700","100.84.170.161","151.101.2.187","TLSv1.2","2488","Application Data"
"330","43.943105300","100.84.170.161","151.101.2.187","TLSv1.2","2489","Application Data"
"331","43.944423900","151.101.2.187","100.84.170.161","TCP","56","443  >  55283 [ACK] Seq=95153 Ack=150174 Win=1621 Len=0"
"332","43.947887700","151.101.2.187","100.84.170.161","TLSv1.2","185","Application Data"
"333","43.949362200","151.101.2.187","100.84.170.161","TCP","56","443  >  55283 [ACK] Seq=95284 Ack=152610 Win=1632 Len=0"
"334","43.949780400","151.101.2.187","100.84.170.161","TCP","56","443  >  55283 [ACK] Seq=95284 Ack=155053 Win=1644 Len=0"
"335","43.950225000","151.101.2.187","100.84.170.161","TCP","56","443  >  55283 [ACK] Seq=95284 Ack=157489 Win=1655 Len=0"
"336","43.950673200","151.101.2.187","100.84.170.161","TCP","56","443  >  55283 [ACK] Seq=95284 Ack=164809 Win=1689 Len=0"
"337","43.951392900","151.101.2.187","100.84.170.161","TCP","56","443  >  55283 [ACK] Seq=95284 Ack=167242 Win=1701 Len=0"
"338","43.952964300","151.101.2.187","100.84.170.161","TCP","56","443  >  55283 [ACK] Seq=95284 Ack=174578 Win=1735 Len=0"
"339","43.953099500","151.101.2.187","100.84.170.161","TCP","56","443  >  55283 [ACK] Seq=95284 Ack=179447 Win=1758 Len=0"
"340","43.954630600","151.101.2.187","100.84.170.161","TLSv1.2","135","Application Data"
"341","43.954690200","100.84.170.161","151.101.2.187","TCP","54","55283  >  443 [ACK] Seq=179447 Ack=95365 Win=513 Len=0"
"342","43.956511600","151.101.2.187","100.84.170.161","TLSv1.2","209","Application Data"
"343","43.957012500","151.101.2.187","100.84.170.161","TLSv1.2","130","Application Data"
"344","43.957055500","100.84.170.161","151.101.2.187","TCP","54","55283  >  443 [ACK] Seq=179447 Ack=95596 Win=512 Len=0"
"345","43.957343400","151.101.2.187","100.84.170.161","TLSv1.2","290","Application Data"
"346","43.957924600","151.101.2.187","100.84.170.161","TLSv1.2","130","Application Data"
"347","43.957972700","100.84.170.161","151.101.2.187","TCP","54","55283  >  443 [ACK] Seq=179447 Ack=95908 Win=511 Len=0"
"348","43.958670300","151.101.2.187","100.84.170.161","TLSv1.2","186","Application Data"
"349","43.959030800","151.101.2.187","100.84.170.161","TLSv1.2","239","Application Data"
"350","43.959068500","100.84.170.161","151.101.2.187","TCP","54","55283  >  443 [ACK] Seq=179447 Ack=96225 Win=509 Len=0"
"351","43.960512400","151.101.2.187","100.84.170.161","TLSv1.2","152","Application Data"
"352","43.960512400","151.101.2.187","100.84.170.161","TLSv1.2","185","Application Data"
"353","43.960591200","100.84.170.161","151.101.2.187","TCP","54","55283  >  443 [ACK] Seq=179447 Ack=96454 Win=509 Len=0"
"354","45.717354200","100.84.170.161","151.101.2.187","TLSv1.2","2773","Application Data"
"355","45.718105000","100.84.170.161","151.101.2.187","TLSv1.2","2735","Application Data"
"356","45.721191800","100.84.170.161","151.101.2.187","TLSv1.2","2755","Application Data"
"357","45.721919800","100.84.170.161","151.101.2.187","TLSv1.2","2753","Application Data"
"358","45.725930800","151.101.2.187","100.84.170.161","TCP","56","443  >  55283 [ACK] Seq=96454 Ack=182166 Win=1769 Len=0"
"359","45.726791400","151.101.2.187","100.84.170.161","TCP","56","443  >  55283 [ACK] Seq=96454 Ack=184847 Win=1781 Len=0"
"360","45.730258300","151.101.2.187","100.84.170.161","TCP","56","443  >  55283 [ACK] Seq=96454 Ack=187548 Win=1792 Len=0"
"361","45.730927500","151.101.2.187","100.84.170.161","TCP","56","443  >  55283 [ACK] Seq=96454 Ack=190247 Win=1803 Len=0"
"362","45.873421300","151.101.2.187","100.84.170.161","TLSv1.2","507","Application Data"
"363","45.873860100","151.101.2.187","100.84.170.161","TCP","1510","443  >  55283 [ACK] Seq=96907 Ack=190247 Win=1803 Len=1456 [TCP PDU reassembled in 365]"
"364","45.873911200","100.84.170.161","151.101.2.187","TCP","54","55283  >  443 [ACK] Seq=190247 Ack=98363 Win=513 Len=0"
"365","45.874733600","151.101.2.187","100.84.170.161","TLSv1.2","16070","Application Data"
"366","45.874802100","100.84.170.161","151.101.2.187","TCP","54","55283  >  443 [ACK] Seq=190247 Ack=114379 Win=513 Len=0"
"367","45.875528800","151.101.2.187","100.84.170.161","TCP","5878","443  >  55283 [ACK] Seq=114379 Ack=190247 Win=1803 Len=5824 [TCP PDU reassembled in 368]"
"368","45.875528800","151.101.2.187","100.84.170.161","TLSv1.2","1131","Application Data"
"369","45.875594100","100.84.170.161","151.101.2.187","TCP","54","55283  >  443 [ACK] Seq=190247 Ack=121280 Win=513 Len=0"
"370","45.895138100","151.101.2.187","100.84.170.161","TCP","1510","443  >  55283 [ACK] Seq=121280 Ack=190247 Win=1803 Len=1456 [TCP PDU reassembled in 374]"
"371","45.895533500","151.101.2.187","100.84.170.161","TCP","1510","443  >  55283 [ACK] Seq=122736 Ack=190247 Win=1803 Len=1456 [TCP PDU reassembled in 374]"
"372","45.895572200","100.84.170.161","151.101.2.187","TCP","54","55283  >  443 [ACK] Seq=190247 Ack=124192 Win=513 Len=0"
"373","45.896400900","151.101.2.187","100.84.170.161","TCP","11702","443  >  55283 [ACK] Seq=124192 Ack=190247 Win=1803 Len=11648 [TCP PDU reassembled in 374]"
"374","45.896400900","151.101.2.187","100.84.170.161","TLSv1.2","1084","Application Data"
"375","45.896400900","151.101.2.187","100.84.170.161","TCP","4422","443  >  55283 [ACK] Seq=136870 Ack=190247 Win=1803 Len=4368 [TCP PDU reassembled in 378]"
"376","45.896507100","100.84.170.161","151.101.2.187","TCP","54","55283  >  443 [ACK] Seq=190247 Ack=141238 Win=513 Len=0"
"377","45.897532200","151.101.2.187","100.84.170.161","TCP","5878","443  >  55283 [ACK] Seq=141238 Ack=190247 Win=1803 Len=5824 [TCP PDU reassembled in 378]"
"378","45.897532200","151.101.2.187","100.84.170.161","TLSv1.2","378","Application Data"
"379","45.897597600","100.84.170.161","151.101.2.187","TCP","54","55283  >  443 [ACK] Seq=190247 Ack=147386 Win=513 Len=0"
"380","46.152533400","151.101.2.187","100.84.170.161","TLSv1.2","196","Application Data"
"381","46.152533400","151.101.2.187","100.84.170.161","TLSv1.2","20438","Application Data"
"382","46.152533400","151.101.2.187","100.84.170.161","TLSv1.2","826","Application Data"
"383","46.152533400","151.101.2.187","100.84.170.161","TCP","7334","443  >  55283 [ACK] Seq=168684 Ack=190247 Win=1803 Len=7280 [TCP PDU reassembled in 384]"
"384","46.152533400","151.101.2.187","100.84.170.161","TLSv1.2","997","Application Data"
"385","46.152533400","151.101.2.187","100.84.170.161","TLSv1.2","30630","Application Data, Application Data"
"386","46.152533400","151.101.2.187","100.84.170.161","TLSv1.2","155","Application Data"
"387","46.152533400","151.101.2.187","100.84.170.161","TCP","155","[TCP Retransmission] 443  >  55283 [PSH, ACK] Seq=207483 Ack=190247 Win=1803 Len=101 [TCP PDU reassembled in 386]"
"388","46.152680600","100.84.170.161","151.101.2.187","TCP","66","55283  >  443 [ACK] Seq=190247 Ack=207584 Win=513 Len=0 SLE=207483 SRE=207584"
"389","46.246929400","151.101.2.187","100.84.170.161","TCP","1510","443  >  55283 [ACK] Seq=207584 Ack=190247 Win=1803 Len=1456 [TCP PDU reassembled in 393]"
"390","46.247299500","151.101.2.187","100.84.170.161","TCP","1510","443  >  55283 [ACK] Seq=209040 Ack=190247 Win=1803 Len=1456 [TCP PDU reassembled in 393]"
"391","46.247357400","100.84.170.161","151.101.2.187","TCP","54","55283  >  443 [ACK] Seq=190247 Ack=210496 Win=513 Len=0"
"392","46.249018500","151.101.2.187","100.84.170.161","TCP","11702","443  >  55283 [ACK] Seq=210496 Ack=190247 Win=1803 Len=11648 [TCP PDU reassembled in 393]"
"393","46.249018500","151.101.2.187","100.84.170.161","TLSv1.2","974","Application Data"
"394","46.249018500","151.101.2.187","100.84.170.161","TLSv1.2","30630","Application Data"
"395","46.249158400","100.84.170.161","151.101.2.187","TCP","54","55283  >  443 [ACK] Seq=190247 Ack=253640 Win=513 Len=0"
"396","46.250001500","151.101.2.187","100.84.170.161","TLSv1.2","13158","Application Data"
"397","46.250001500","151.101.2.187","100.84.170.161","TLSv1.2","221","Application Data"
"398","46.250062200","100.84.170.161","151.101.2.187","TCP","54","55283  >  443 [ACK] Seq=190247 Ack=266911 Win=513 Len=0"
"399","46.596891200","100.84.170.161","151.101.2.187","TCP","66","56939  >  443 [SYN] Seq=0 Win=64240 Len=0 MSS=1460 WS=256 SACK_PERM"
"400","46.609500100","151.101.2.187","100.84.170.161","TCP","66","443  >  56939 [SYN, ACK] Seq=0 Ack=1 Win=65535 Len=0 MSS=1460 SACK_PERM WS=512"
"401","46.609576500","100.84.170.161","151.101.2.187","TCP","54","56939  >  443 [ACK] Seq=1 Ack=1 Win=131328 Len=0"
"402","46.610205500","100.84.170.161","151.101.2.187","TLSv1.3","1788","Client Hello (SNI=observability.target.com)"
"403","46.620195200","151.101.2.187","100.84.170.161","TCP","56","443  >  56939 [ACK] Seq=1 Ack=1735 Win=144896 Len=0"
"404","46.622913300","151.101.2.187","100.84.170.161","TLSv1.3","1510","Server Hello, Change Cipher Spec, Application Data"
"405","46.623653300","151.101.2.187","100.84.170.161","TLSv1.3","4422","Application Data"
"406","46.623653300","151.101.2.187","100.84.170.161","TLSv1.3","473","Application Data, Application Data, Application Data"
"407","46.623713900","100.84.170.161","151.101.2.187","TCP","54","56939  >  443 [ACK] Seq=1735 Ack=6244 Win=131328 Len=0"
"408","46.626597200","100.84.170.161","151.101.2.187","TLSv1.3","118","Change Cipher Spec, Application Data"
"409","46.627418800","100.84.170.161","151.101.2.187","TLSv1.3","146","Application Data"
"410","46.627755000","100.84.170.161","151.101.2.187","TLSv1.3","441","Application Data"
"411","46.635415500","151.101.2.187","100.84.170.161","TCP","56","443  >  56939 [ACK] Seq=6244 Ack=1799 Win=145920 Len=0"
"412","46.635951700","151.101.2.187","100.84.170.161","TCP","56","443  >  56939 [ACK] Seq=6244 Ack=1891 Win=145920 Len=0"
"413","46.636235500","151.101.2.187","100.84.170.161","TLSv1.3","119","Application Data"
"414","46.636627700","100.84.170.161","151.101.2.187","TLSv1.3","85","Application Data"
"415","46.645681000","151.101.2.187","100.84.170.161","TCP","56","443  >  56939 [ACK] Seq=6309 Ack=2309 Win=145920 Len=0"
"416","46.705456000","151.101.2.187","100.84.170.161","TLSv1.3","541","Application Data"
"417","46.706908700","100.84.170.161","151.101.2.187","TLSv1.3","303","Application Data"
"418","46.707079200","100.84.170.161","151.101.2.187","TLSv1.3","16460","Application Data"
"419","46.715649200","151.101.2.187","100.84.170.161","TCP","56","443  >  56939 [ACK] Seq=6796 Ack=2558 Win=145920 Len=0"
"420","46.716684500","151.101.2.187","100.84.170.161","TCP","56","443  >  56939 [ACK] Seq=6796 Ack=18964 Win=130560 Len=0"
"421","46.716729200","100.84.170.161","151.101.2.187","TLSv1.3","1065","Application Data"
"422","46.717003700","151.101.2.187","100.84.170.161","TLSv1.3","89","Application Data"
"423","46.725355400","151.101.2.187","100.84.170.161","TCP","56","443  >  56939 [ACK] Seq=6831 Ack=19975 Win=145408 Len=0"
"424","46.743703000","151.101.2.187","100.84.170.161","TCP","89","[TCP Retransmission] 443  >  56939 [PSH, ACK] Seq=6796 Ack=19975 Win=145920 Len=35"
"425","46.743748500","100.84.170.161","151.101.2.187","TCP","66","56939  >  443 [ACK] Seq=19975 Ack=6831 Win=130560 Len=0 SLE=6796 SRE=6831"
"426","46.806846100","151.101.2.187","100.84.170.161","TLSv1.3","238","Application Data"
"427","46.807158300","151.101.2.187","100.84.170.161","TLSv1.3","106","Application Data"
"428","46.807199600","100.84.170.161","151.101.2.187","TCP","54","56939  >  443 [ACK] Seq=19975 Ack=7067 Win=130560 Len=0"
"429","49.450745000","100.84.170.161","151.101.2.187","TLSv1.2","2534","Application Data"
"430","49.451921900","100.84.170.161","151.101.2.187","TLSv1.2","2530","Application Data"
"431","49.459643300","151.101.2.187","100.84.170.161","TCP","56","443  >  55283 [ACK] Seq=266911 Ack=192727 Win=1815 Len=0"
"432","49.460641900","151.101.2.187","100.84.170.161","TCP","56","443  >  55283 [ACK] Seq=266911 Ack=195203 Win=1826 Len=0"
"433","49.462375400","151.101.2.187","100.84.170.161","TLSv1.2","290","Application Data"
"434","49.462869800","151.101.2.187","100.84.170.161","TLSv1.2","130","Application Data"
"435","49.462929000","100.84.170.161","151.101.2.187","TCP","54","55283  >  443 [ACK] Seq=195203 Ack=267223 Win=512 Len=0"
"436","49.859601700","100.84.170.161","151.101.2.187","TLSv1.2","2497","Application Data"
"437","49.867722400","100.84.170.161","151.101.2.187","TLSv1.2","2493","Application Data"
"438","49.868142300","151.101.2.187","100.84.170.161","TCP","56","443  >  55283 [ACK] Seq=267223 Ack=197646 Win=1838 Len=0"
"439","49.869906000","100.84.170.161","151.101.2.187","TLSv1.2","2495","Application Data"
"440","49.870727000","151.101.2.187","100.84.170.161","TLSv1.2","236","Application Data"
"441","49.876836000","151.101.2.187","100.84.170.161","TCP","56","443  >  55283 [ACK] Seq=267405 Ack=200085 Win=1849 Len=0"
"442","49.878600500","151.101.2.187","100.84.170.161","TCP","56","443  >  55283 [ACK] Seq=267405 Ack=202526 Win=1860 Len=0"
"443","49.879659300","151.101.2.187","100.84.170.161","TLSv1.2","187","Application Data"
"444","49.879716300","100.84.170.161","151.101.2.187","TCP","54","55283  >  443 [ACK] Seq=202526 Ack=267538 Win=510 Len=0"
"445","49.881624500","151.101.2.187","100.84.170.161","TLSv1.2","135","Application Data"
"446","49.883289900","100.84.170.161","151.101.2.187","TLSv1.2","2493","Application Data"
"447","49.888061800","100.84.170.161","151.101.2.187","TLSv1.2","2491","Application Data"
"448","49.891875100","151.101.2.187","100.84.170.161","TCP","56","443  >  55283 [ACK] Seq=267619 Ack=204965 Win=1872 Len=0"
"449","49.896320400","151.101.2.187","100.84.170.161","TLSv1.2","130","Application Data"
"450","49.896987100","151.101.2.187","100.84.170.161","TCP","56","443  >  55283 [ACK] Seq=267695 Ack=207402 Win=1883 Len=0"
"451","49.899125900","151.101.2.187","100.84.170.161","TLSv1.2","208","Application Data"
"452","49.899183900","100.84.170.161","151.101.2.187","TCP","54","55283  >  443 [ACK] Seq=207402 Ack=267849 Win=509 Len=0"
"453","49.922850000","100.84.170.161","151.101.2.187","TLSv1.2","2509","Application Data"
"454","49.931701000","151.101.2.187","100.84.170.161","TCP","56","443  >  55283 [ACK] Seq=267849 Ack=209857 Win=1895 Len=0"
"455","49.933650200","151.101.2.187","100.84.170.161","TLSv1.2","130","Application Data"
"456","49.961275400","151.101.2.187","100.84.170.161","TCP","130","[TCP Retransmission] 443  >  55283 [PSH, ACK] Seq=267849 Ack=209857 Win=1895 Len=76"
"457","49.961326600","100.84.170.161","151.101.2.187","TCP","66","55283  >  443 [ACK] Seq=209857 Ack=267925 Win=509 Len=0 SLE=267849 SRE=267925"
"458","50.097441400","100.84.170.161","151.101.2.187","TLSv1.2","2510","Application Data"
"459","50.102268200","100.84.170.161","151.101.2.187","TLSv1.2","2493","Application Data"
"460","50.108576500","151.101.2.187","100.84.170.161","TCP","56","443  >  55283 [ACK] Seq=267925 Ack=212313 Win=1906 Len=0"
"461","50.113748000","151.101.2.187","100.84.170.161","TCP","56","443  >  55283 [ACK] Seq=267925 Ack=214752 Win=1917 Len=0"
"462","50.114239700","151.101.2.187","100.84.170.161","TLSv1.2","130","Application Data"
"463","50.117245300","151.101.2.187","100.84.170.161","TLSv1.2","130","Application Data"
"464","50.117326000","100.84.170.161","151.101.2.187","TCP","54","55283  >  443 [ACK] Seq=214752 Ack=268077 Win=508 Len=0"
"465","50.200903300","100.84.170.161","151.101.2.187","TLSv1.2","2493","Application Data"
"466","50.210769700","151.101.2.187","100.84.170.161","TCP","56","443  >  55283 [ACK] Seq=268077 Ack=217191 Win=1929 Len=0"
"467","50.213534600","151.101.2.187","100.84.170.161","TLSv1.2","103","Application Data"
"468","50.240275200","151.101.2.187","100.84.170.161","TCP","103","[TCP Retransmission] 443  >  55283 [PSH, ACK] Seq=268077 Ack=217191 Win=1929 Len=49"
"469","50.240317600","100.84.170.161","151.101.2.187","TCP","66","55283  >  443 [ACK] Seq=217191 Ack=268126 Win=508 Len=0 SLE=268077 SRE=268126"
"470","50.438636400","100.84.170.161","151.101.2.187","TLSv1.2","2503","Application Data"
"471","50.438872400","100.84.170.161","151.101.2.187","TLSv1.2","2497","Application Data"
"472","50.440285000","100.84.170.161","151.101.2.187","TLSv1.2","2498","Application Data"
"473","50.445042600","100.84.170.161","151.101.2.187","TLSv1.2","2505","Application Data"
"474","50.449154800","151.101.2.187","100.84.170.161","TCP","56","443  >  55283 [ACK] Seq=268126 Ack=219640 Win=1940 Len=0"
"475","50.450804300","151.101.2.187","100.84.170.161","TCP","56","443  >  55283 [ACK] Seq=268126 Ack=224527 Win=1963 Len=0"
"476","50.453587700","151.101.2.187","100.84.170.161","TLSv1.2","131","Application Data"
"477","50.454061800","151.101.2.187","100.84.170.161","TCP","56","443  >  55283 [ACK] Seq=268203 Ack=226978 Win=1974 Len=0"
"478","50.454603500","151.101.2.187","100.84.170.161","TLSv1.2","181","Application Data"
"479","50.454650800","100.84.170.161","151.101.2.187","TCP","54","55283  >  443 [ACK] Seq=226978 Ack=268330 Win=507 Len=0"
"480","50.455867600","151.101.2.187","100.84.170.161","TLSv1.2","130","Application Data"
"481","50.458341100","151.101.2.187","100.84.170.161","TLSv1.2","262","Application Data"
"482","50.458399400","100.84.170.161","151.101.2.187","TCP","54","55283  >  443 [ACK] Seq=226978 Ack=268614 Win=513 Len=0"
"483","50.467103900","100.84.170.161","151.101.2.187","TLSv1.2","2499","Application Data"
"484","50.472006700","100.84.170.161","151.101.2.187","TLSv1.2","2506","Application Data"
"485","50.472234500","100.84.170.161","151.101.2.187","TLSv1.2","2505","Application Data"
"486","50.472377200","100.84.170.161","151.101.2.187","TLSv1.2","2499","Application Data"
"487","50.472504300","100.84.170.161","151.101.2.187","TLSv1.2","2499","Application Data"
"488","50.473772300","100.84.170.161","151.101.2.187","TLSv1.2","2502","Application Data"
"489","50.473976000","100.84.170.161","151.101.2.187","TLSv1.2","2499","Application Data"
"490","50.474126100","100.84.170.161","151.101.2.187","TLSv1.2","2505","Application Data"
"491","50.474255800","100.84.170.161","151.101.2.187","TLSv1.2","2496","Application Data"
"492","50.474613300","100.84.170.161","151.101.2.187","TLSv1.2","2498","Application Data"
"493","50.475938300","151.101.2.187","100.84.170.161","TCP","56","443  >  55283 [ACK] Seq=268614 Ack=229423 Win=1986 Len=0"
"494","50.479076900","151.101.2.187","100.84.170.161","TLSv1.2","186","Application Data"
"495","50.481023500","151.101.2.187","100.84.170.161","TCP","56","443  >  55283 [ACK] Seq=268746 Ack=231875 Win=1997 Len=0"
"496","50.482516400","151.101.2.187","100.84.170.161","TCP","56","443  >  55283 [ACK] Seq=268746 Ack=239216 Win=2031 Len=0"
"497","50.482904400","151.101.2.187","100.84.170.161","TCP","56","443  >  55283 [ACK] Seq=268746 Ack=241664 Win=2043 Len=0"
"498","50.483187900","151.101.2.187","100.84.170.161","TCP","56","443  >  55283 [ACK] Seq=268746 Ack=246560 Win=2066 Len=0"
"499","50.483428700","151.101.2.187","100.84.170.161","TCP","56","443  >  55283 [ACK] Seq=268746 Ack=251446 Win=2088 Len=0"
"500","50.483837100","151.101.2.187","100.84.170.161","TLSv1.2","135","Application Data"
"501","50.483933300","100.84.170.161","151.101.2.187","TCP","54","55283  >  443 [ACK] Seq=251446 Ack=268827 Win=512 Len=0"
"502","50.484341400","151.101.2.187","100.84.170.161","TLSv1.2","131","Application Data"
"503","50.484508000","151.101.2.187","100.84.170.161","TLSv1.2","208","Application Data"
"504","50.484530400","100.84.170.161","151.101.2.187","TCP","54","55283  >  443 [ACK] Seq=251446 Ack=269058 Win=511 Len=0"
"505","50.485621100","151.101.2.187","100.84.170.161","TLSv1.2","130","Application Data"
"506","50.486018400","151.101.2.187","100.84.170.161","TLSv1.2","130","Application Data"
"507","50.486059700","100.84.170.161","151.101.2.187","TCP","54","55283  >  443 [ACK] Seq=251446 Ack=269210 Win=510 Len=0"
"508","50.486442500","151.101.2.187","100.84.170.161","TLSv1.2","130","Application Data"
"509","50.487051700","151.101.2.187","100.84.170.161","TLSv1.2","131","Application Data"
"510","50.487097800","100.84.170.161","151.101.2.187","TCP","54","55283  >  443 [ACK] Seq=251446 Ack=269363 Win=510 Len=0"
"511","50.487448700","151.101.2.187","100.84.170.161","TLSv1.2","130","Application Data"
"512","50.488099600","151.101.2.187","100.84.170.161","TLSv1.2","181","Application Data"
"513","50.488139700","100.84.170.161","151.101.2.187","TCP","54","55283  >  443 [ACK] Seq=251446 Ack=269566 Win=509 Len=0"
"514","50.692865400","100.84.170.161","151.101.2.187","TLSv1.3","136","Application Data"
"515","50.693074200","100.84.170.161","151.101.2.187","TLSv1.3","16460","Application Data"
"516","50.693209900","100.84.170.161","151.101.2.187","TLSv1.3","5496","Application Data"
"517","50.701827200","151.101.2.187","100.84.170.161","TCP","56","443  >  56939 [ACK] Seq=7067 Ack=20057 Win=145920 Len=0"
"518","50.702647900","151.101.2.187","100.84.170.161","TCP","56","443  >  56939 [ACK] Seq=7067 Ack=41905 Win=140288 Len=0"
"519","50.702996500","151.101.2.187","100.84.170.161","TLSv1.3","89","Application Data"
"520","50.728619600","151.101.2.187","100.84.170.161","TCP","89","[TCP Retransmission] 443  >  56939 [PSH, ACK] Seq=7067 Ack=41905 Win=145920 Len=35"
"521","50.728717900","100.84.170.161","151.101.2.187","TCP","66","56939  >  443 [ACK] Seq=41905 Ack=7102 Win=130304 Len=0 SLE=7067 SRE=7102"
"522","50.794370000","151.101.2.187","100.84.170.161","TLSv1.3","179","Application Data"
"523","50.794642100","151.101.2.187","100.84.170.161","TLSv1.3","106","Application Data"
"524","50.794678600","100.84.170.161","151.101.2.187","TCP","54","56939  >  443 [ACK] Seq=41905 Ack=7279 Win=130304 Len=0"
"525","53.126755100","100.84.170.161","151.101.2.187","TLSv1.2","2268","Application Data"
"526","53.137072200","151.101.2.187","100.84.170.161","TCP","56","443  >  55283 [ACK] Seq=269566 Ack=253660 Win=2100 Len=0"
"527","53.192764300","151.101.2.187","100.84.170.161","TLSv1.2","697","Application Data"
"528","53.194659800","100.84.170.161","151.101.2.187","TLSv1.2","89","Application Data"
"529","53.203284100","151.101.2.187","100.84.170.161","TCP","56","443  >  55283 [ACK] Seq=270209 Ack=253695 Win=2100 Len=0"
"530","53.839509600","100.84.170.161","151.101.2.187","TLSv1.2","2642","Application Data"
"531","53.849843400","151.101.2.187","100.84.170.161","TCP","56","443  >  55283 [ACK] Seq=270209 Ack=256283 Win=2111 Len=0"
"532","54.139386200","151.101.2.187","100.84.170.161","TLSv1.2","378","Application Data"
"533","54.139386200","151.101.2.187","100.84.170.161","TCP","2966","443  >  55283 [ACK] Seq=270533 Ack=256283 Win=2111 Len=2912 [TCP PDU reassembled in 534]"
"534","54.139386200","151.101.2.187","100.84.170.161","TLSv1.2","606","Application Data"
"535","54.139386200","151.101.2.187","100.84.170.161","TCP","7334","443  >  55283 [ACK] Seq=273997 Ack=256283 Win=2111 Len=7280 [TCP PDU reassembled in 536]"
"536","54.139386200","151.101.2.187","100.84.170.161","TLSv1.2","981","Application Data"
"537","54.139386200","151.101.2.187","100.84.170.161","TLSv1.2","1307","Application Data"
"538","54.139386200","151.101.2.187","100.84.170.161","TCP","2966","443  >  55283 [ACK] Seq=283457 Ack=256283 Win=2111 Len=2912 [TCP PDU reassembled in 539]"
"539","54.139386200","151.101.2.187","100.84.170.161","TLSv1.2","955","Application Data"
"540","54.139386200","151.101.2.187","100.84.170.161","TCP","955","[TCP Retransmission] 443  >  55283 [PSH, ACK] Seq=286369 Ack=256283 Win=2111 Len=901 [TCP PDU reassembled in 539]"
"541","54.139583400","100.84.170.161","151.101.2.187","TCP","66","55283  >  443 [ACK] Seq=256283 Ack=287270 Win=513 Len=0 SLE=286369 SRE=287270"
"542","54.209358400","151.101.2.187","100.84.170.161","TCP","1510","443  >  55283 [ACK] Seq=287270 Ack=256283 Win=2111 Len=1456 [TCP PDU reassembled in 546]"
"543","54.209746800","151.101.2.187","100.84.170.161","TCP","1510","443  >  55283 [ACK] Seq=288726 Ack=256283 Win=2111 Len=1456 [TCP PDU reassembled in 546]"
"544","54.209790200","100.84.170.161","151.101.2.187","TCP","54","55283  >  443 [ACK] Seq=256283 Ack=290182 Win=513 Len=0"
"545","54.211063800","151.101.2.187","100.84.170.161","TCP","13158","443  >  55283 [ACK] Seq=290182 Ack=256283 Win=2111 Len=13104 [TCP PDU reassembled in 546]"
"546","54.211063800","151.101.2.187","100.84.170.161","TLSv1.2","1479","Application Data, Application Data"
"547","54.211167600","100.84.170.161","151.101.2.187","TCP","54","55283  >  443 [ACK] Seq=256283 Ack=304711 Win=513 Len=0"
"548","54.282892900","151.101.2.187","100.84.170.161","TCP","1510","443  >  55283 [ACK] Seq=304711 Ack=256283 Win=2111 Len=1456 [TCP PDU reassembled in 552]"
"549","54.283289200","151.101.2.187","100.84.170.161","TCP","1510","443  >  55283 [ACK] Seq=306167 Ack=256283 Win=2111 Len=1456 [TCP PDU reassembled in 552]"
"550","54.283342900","100.84.170.161","151.101.2.187","TCP","54","55283  >  443 [ACK] Seq=256283 Ack=307623 Win=513 Len=0"
"551","54.283603300","151.101.2.187","100.84.170.161","TCP","1510","443  >  55283 [ACK] Seq=307623 Ack=256283 Win=2111 Len=1456 [TCP PDU reassembled in 552]"
"552","54.283603300","151.101.2.187","100.84.170.161","TLSv1.2","1195","Application Data"
"553","54.283648400","100.84.170.161","151.101.2.187","TCP","54","55283  >  443 [ACK] Seq=256283 Ack=310220 Win=513 Len=0"
"554","54.285362400","151.101.2.187","100.84.170.161","TLSv1.2","18982","Application Data"
"555","54.285362400","151.101.2.187","100.84.170.161","TLSv1.2","256","Application Data"
"556","54.285362400","151.101.2.187","100.84.170.161","TCP","16070","443  >  55283 [ACK] Seq=329350 Ack=256283 Win=2111 Len=16016 [TCP PDU reassembled in 557]"
"557","54.285362400","151.101.2.187","100.84.170.161","TLSv1.2","514","Application Data, Application Data"
"558","54.285481100","100.84.170.161","151.101.2.187","TCP","54","55283  >  443 [ACK] Seq=256283 Ack=345826 Win=513 Len=0"
"559","54.286827200","151.101.2.187","100.84.170.161","TCP","7334","443  >  55283 [ACK] Seq=345826 Ack=256283 Win=2111 Len=7280 [TCP PDU reassembled in 560]"
"560","54.286827200","151.101.2.187","100.84.170.161","TLSv1.2","997","Application Data"
"561","54.286827200","151.101.2.187","100.84.170.161","TLSv1.2","16070","Application Data"
"562","54.286827200","151.101.2.187","100.84.170.161","TLSv1.2","484","Application Data"
"563","54.286827200","151.101.2.187","100.84.170.161","TLSv1.2","8790","Application Data"
"564","54.286827200","151.101.2.187","100.84.170.161","TLSv1.2","1338","Application Data"
"565","54.286978100","100.84.170.161","151.101.2.187","TCP","54","55283  >  443 [ACK] Seq=256283 Ack=380515 Win=513 Len=0"
"566","54.333500400","151.101.2.187","100.84.170.161","TCP","1510","443  >  55283 [ACK] Seq=380515 Ack=256283 Win=2111 Len=1456 [TCP PDU reassembled in 567]"
"567","54.333816600","151.101.2.187","100.84.170.161","TLSv1.2","1057","Application Data"
"568","54.333864700","100.84.170.161","151.101.2.187","TCP","54","55283  >  443 [ACK] Seq=256283 Ack=382974 Win=513 Len=0"
"569","54.334163800","151.101.2.187","100.84.170.161","TCP","1510","443  >  55283 [ACK] Seq=382974 Ack=256283 Win=2111 Len=1456 [TCP PDU reassembled in 570]"
"570","54.334163800","151.101.2.187","100.84.170.161","TLSv1.2","387","Application Data"
"571","54.334215500","100.84.170.161","151.101.2.187","TCP","54","55283  >  443 [ACK] Seq=256283 Ack=384763 Win=513 Len=0"
"572","54.334745600","151.101.2.187","100.84.170.161","TLSv1.2","85","Application Data"
"573","54.368132500","151.101.2.187","100.84.170.161","TCP","85","[TCP Retransmission] 443  >  55283 [PSH, ACK] Seq=384763 Ack=256283 Win=2111 Len=31"
"574","54.368172600","100.84.170.161","151.101.2.187","TCP","66","55283  >  443 [ACK] Seq=256283 Ack=384794 Win=513 Len=0 SLE=384763 SRE=384794"
"575","54.371709000","100.84.170.161","151.101.2.187","TLSv1.2","2401","Application Data"
"576","54.380375600","151.101.2.187","100.84.170.161","TCP","56","443  >  55283 [ACK] Seq=384794 Ack=258630 Win=2123 Len=0"
"577","54.394200200","151.101.2.187","100.84.170.161","TLSv1.2","250","Application Data"
"578","54.394416400","151.101.2.187","100.84.170.161","TLSv1.2","355","Application Data"
"579","54.394452300","100.84.170.161","151.101.2.187","TCP","54","55283  >  443 [ACK] Seq=258630 Ack=385291 Win=511 Len=0"
"580","55.854487000","100.84.170.161","151.101.2.187","TLSv1.3","136","Application Data"
"581","55.854696200","100.84.170.161","151.101.2.187","TLSv1.3","16460","Application Data"
"582","55.854856800","100.84.170.161","151.101.2.187","TLSv1.3","7169","Application Data"
"583","55.865834700","151.101.2.187","100.84.170.161","TCP","56","443  >  56939 [ACK] Seq=7279 Ack=58393 Win=129536 Len=0"
"584","55.866135300","151.101.2.187","100.84.170.161","TCP","56","443  >  56939 [ACK] Seq=7279 Ack=61313 Win=145920 Len=0"
"585","55.866606600","151.101.2.187","100.84.170.161","TLSv1.3","89","Application Data"
"586","55.890772900","151.101.2.187","100.84.170.161","TCP","89","[TCP Retransmission] 443  >  56939 [PSH, ACK] Seq=7279 Ack=65508 Win=145920 Len=35"
"587","55.890841100","100.84.170.161","151.101.2.187","TCP","66","56939  >  443 [ACK] Seq=65508 Ack=7314 Win=130304 Len=0 SLE=7279 SRE=7314"
"588","55.960356800","151.101.2.187","100.84.170.161","TLSv1.3","176","Application Data"
"589","55.960356800","151.101.2.187","100.84.170.161","TLSv1.3","106","Application Data"
"590","55.960430700","100.84.170.161","151.101.2.187","TCP","54","56939  >  443 [ACK] Seq=65508 Ack=7488 Win=130048 Len=0"
"591","55.961531000","100.84.170.161","151.101.2.187","TLSv1.3","89","Application Data"
"592","55.970847300","151.101.2.187","100.84.170.161","TCP","56","443  >  56939 [ACK] Seq=7488 Ack=65543 Win=145920 Len=0"
