"No.","Time","Source","Destination","Protocol","Length","Info"
"1","0.000000000","172.20.40.110","151.101.130.187","TCP","55","57648  >  443 [ACK] Seq=1 Ack=1 Win=254 Len=1 [TCP PDU reassembled in 441]"
"2","0.010342700","151.101.130.187","172.20.40.110","TCP","66","443  >  57648 [ACK] Seq=1 Ack=2 Win=281 Len=0 SLE=1 SRE=2"
"3","3.231812800","172.20.40.110","151.101.194.187","TLSv1.2","2890","Application Data"
"4","3.231986100","172.20.40.110","151.101.194.187","TLSv1.2","93","Application Data"
"5","3.242207300","151.101.194.187","172.20.40.110","TCP","60","443  >  64055 [ACK] Seq=1 Ack=2837 Win=414 Len=0"
"6","3.242207300","151.101.194.187","172.20.40.110","TCP","60","443  >  64055 [ACK] Seq=1 Ack=2876 Win=414 Len=0"
"7","3.242207300","151.101.194.187","172.20.40.110","TLSv1.2","93","Application Data"
"8","3.245554900","151.101.194.187","172.20.40.110","TLSv1.2","379","Application Data"
"9","3.245665200","172.20.40.110","151.101.194.187","TCP","54","64055  >  443 [ACK] Seq=2876 Ack=365 Win=506 Len=0"
"10","3.341805700","172.20.40.110","151.101.194.187","TLSv1.2","2889","Application Data"
"11","3.352048800","151.101.194.187","172.20.40.110","TCP","60","443  >  64055 [ACK] Seq=365 Ack=5711 Win=425 Len=0"
"12","3.354020400","151.101.194.187","172.20.40.110","TLSv1.2","104","Application Data"
"13","3.389569100","151.101.194.187","172.20.40.110","TCP","104","[TCP Retransmission] 443  >  64055 [PSH, ACK] Seq=365 Ack=5711 Win=425 Len=50"
"14","3.389640800","172.20.40.110","151.101.194.187","TCP","66","64055  >  443 [ACK] Seq=5711 Ack=415 Win=512 Len=0 SLE=365 SRE=415"
"15","5.105521600","172.20.40.110","151.101.194.187","TLSv1.2","2889","Application Data"
"16","5.113701400","172.20.40.110","151.101.194.187","TLSv1.2","2875","Application Data"
"17","5.116485000","151.101.194.187","172.20.40.110","TCP","60","443  >  64055 [ACK] Seq=415 Ack=8546 Win=436 Len=0"
"18","5.117507700","151.101.194.187","172.20.40.110","TLSv1.2","214","Application Data"
"19","5.123260600","151.101.194.187","172.20.40.110","TCP","60","443  >  64055 [ACK] Seq=575 Ack=11367 Win=447 Len=0"
"20","5.125681200","151.101.194.187","172.20.40.110","TLSv1.2","130","Application Data"
"21","5.125789200","172.20.40.110","151.101.194.187","TCP","54","64055  >  443 [ACK] Seq=11367 Ack=651 Win=511 Len=0"
"22","5.133220600","172.20.40.110","151.101.194.187","TLSv1.2","2890","Application Data"
"23","5.142056700","151.101.194.187","172.20.40.110","TCP","60","443  >  64055 [ACK] Seq=651 Ack=14203 Win=458 Len=0"
"24","5.146449900","151.101.194.187","172.20.40.110","TLSv1.2","213","Application Data"
"25","5.181208100","151.101.194.187","172.20.40.110","TCP","213","[TCP Retransmission] 443  >  64055 [PSH, ACK] Seq=651 Ack=14203 Win=458 Len=159"
"26","5.181275100","172.20.40.110","151.101.194.187","TCP","66","64055  >  443 [ACK] Seq=14203 Ack=810 Win=510 Len=0 SLE=651 SRE=810"
"27","5.598956100","172.20.40.110","151.101.194.187","TLSv1.2","2887","Application Data"
"28","5.608873600","151.101.194.187","172.20.40.110","TCP","60","443  >  64055 [ACK] Seq=810 Ack=17036 Win=469 Len=0"
"29","5.611804300","151.101.194.187","172.20.40.110","TLSv1.2","130","Application Data"
"30","5.646047800","151.101.194.187","172.20.40.110","TCP","130","[TCP Retransmission] 443  >  64055 [PSH, ACK] Seq=810 Ack=17036 Win=469 Len=76"
"31","5.646099800","172.20.40.110","151.101.194.187","TCP","66","64055  >  443 [ACK] Seq=17036 Ack=886 Win=510 Len=0 SLE=810 SRE=886"
"32","6.896854200","172.20.40.110","151.101.194.187","TLSv1.2","2889","Application Data"
"33","6.897501300","172.20.40.110","151.101.194.187","TLSv1.2","2890","Application Data"
"34","6.899555300","172.20.40.110","151.101.194.187","TLSv1.2","2877","Application Data"
"35","6.899761900","172.20.40.110","151.101.194.187","TLSv1.2","2871","Application Data"
"36","6.919860100","151.101.194.187","172.20.40.110","TCP","60","443  >  64055 [ACK] Seq=886 Ack=18416 Win=475 Len=0"
"37","6.919860100","151.101.194.187","172.20.40.110","TCP","60","443  >  64055 [ACK] Seq=886 Ack=19871 Win=480 Len=0"
"38","6.919860100","151.101.194.187","172.20.40.110","TCP","60","443  >  64055 [ACK] Seq=886 Ack=22707 Win=491 Len=0"
"39","6.919860100","151.101.194.187","172.20.40.110","TCP","60","443  >  64055 [ACK] Seq=886 Ack=25530 Win=502 Len=0"
"40","6.919860100","151.101.194.187","172.20.40.110","TCP","60","443  >  64055 [ACK] Seq=886 Ack=28347 Win=513 Len=0"
"41","6.924522600","151.101.194.187","172.20.40.110","TLSv1.2","376","Application Data"
"42","6.960109800","151.101.194.187","172.20.40.110","TCP","376","[TCP Retransmission] 443  >  64055 [PSH, ACK] Seq=886 Ack=28347 Win=513 Len=322"
"43","6.960169000","172.20.40.110","151.101.194.187","TCP","66","64055  >  443 [ACK] Seq=28347 Ack=1208 Win=509 Len=0 SLE=886 SRE=1208"
"44","7.014084700","172.20.40.110","151.101.194.187","TLSv1.2","2893","Application Data"
"45","7.024006100","151.101.194.187","172.20.40.110","TCP","60","443  >  64055 [ACK] Seq=1208 Ack=31186 Win=524 Len=0"
"46","7.027129500","151.101.194.187","172.20.40.110","TLSv1.2","130","Application Data"
"47","7.036698100","172.20.40.110","151.101.194.187","TLSv1.2","2873","Application Data"
"48","7.046316400","151.101.194.187","172.20.40.110","TCP","60","443  >  64055 [ACK] Seq=1284 Ack=34005 Win=535 Len=0"
"49","7.048769900","151.101.194.187","172.20.40.110","TLSv1.2","341","Application Data"
"50","7.084156700","151.101.194.187","172.20.40.110","TCP","341","[TCP Retransmission] 443  >  64055 [PSH, ACK] Seq=1284 Ack=34005 Win=535 Len=287"
"51","7.084216000","172.20.40.110","151.101.194.187","TCP","66","64055  >  443 [ACK] Seq=34005 Ack=1571 Win=507 Len=0 SLE=1284 SRE=1571"
"52","7.262965500","172.20.40.110","151.101.194.187","TLSv1.2","2830","Application Data"
"53","7.265020000","172.20.40.110","151.101.194.187","TLSv1.2","2896","Application Data"
"54","7.265617600","172.20.40.110","151.101.194.187","TLSv1.2","2877","Application Data"
"55","7.265778600","172.20.40.110","151.101.194.187","TLSv1.2","2875","Application Data"
"56","7.273023300","172.20.40.110","151.101.194.187","TLSv1.2","2953","Application Data"
"57","7.275465000","172.20.40.110","151.101.194.187","TLSv1.2","2924","Application Data"
"58","7.278159800","151.101.194.187","172.20.40.110","TCP","60","443  >  64055 [ACK] Seq=1571 Ack=36781 Win=546 Len=0"
"59","7.284007600","151.101.194.187","172.20.40.110","TCP","60","443  >  64055 [ACK] Seq=1571 Ack=39623 Win=557 Len=0"
"60","7.284007600","151.101.194.187","172.20.40.110","TCP","60","443  >  64055 [ACK] Seq=1571 Ack=42446 Win=568 Len=0"
"61","7.290225200","151.101.194.187","172.20.40.110","TLSv1.2","283","Application Data"
"62","7.290225200","151.101.194.187","172.20.40.110","TLSv1.2","517","Application Data"
"63","7.290225200","151.101.194.187","172.20.40.110","TLSv1.2","130","Application Data"
"64","7.290337800","172.20.40.110","151.101.194.187","TCP","54","64055  >  443 [ACK] Seq=51036 Ack=2339 Win=512 Len=0"
"65","7.297214600","172.20.40.110","151.101.194.187","TLSv1.2","89","Application Data"
"66","7.302507900","151.101.194.187","172.20.40.110","TCP","60","443  >  64055 [ACK] Seq=2339 Ack=45267 Win=580 Len=0"
"67","7.302507900","151.101.194.187","172.20.40.110","TCP","60","443  >  64055 [ACK] Seq=2339 Ack=48166 Win=591 Len=0"
"68","7.302507900","151.101.194.187","172.20.40.110","TCP","60","443  >  64055 [ACK] Seq=2339 Ack=51036 Win=602 Len=0"
"69","7.307538900","151.101.194.187","172.20.40.110","TCP","60","443  >  64055 [ACK] Seq=2339 Ack=51071 Win=602 Len=0"
"70","7.307538900","151.101.194.187","172.20.40.110","TLSv1.2","238","Application Data"
"71","7.343397000","151.101.194.187","172.20.40.110","TCP","238","[TCP Retransmission] 443  >  64055 [PSH, ACK] Seq=2339 Ack=51071 Win=602 Len=184"
"72","7.343589500","172.20.40.110","151.101.194.187","TCP","66","64055  >  443 [ACK] Seq=51071 Ack=2523 Win=511 Len=0 SLE=2339 SRE=2523"
"73","7.814000700","172.20.40.110","151.101.194.187","TLSv1.2","2804","Application Data"
"74","7.819170500","172.20.40.110","151.101.194.187","TLSv1.2","2802","Application Data"
"75","7.826547500","151.101.194.187","172.20.40.110","TCP","60","443  >  64055 [ACK] Seq=2523 Ack=53821 Win=614 Len=0"
"76","7.829445300","151.101.194.187","172.20.40.110","TCP","60","443  >  64055 [ACK] Seq=2523 Ack=56569 Win=624 Len=0"
"77","7.830826800","151.101.194.187","172.20.40.110","TLSv1.2","104","Application Data"
"78","7.831934600","151.101.194.187","172.20.40.110","TLSv1.2","130","Application Data"
"79","7.832013900","172.20.40.110","151.101.194.187","TCP","54","64055  >  443 [ACK] Seq=56569 Ack=2649 Win=510 Len=0"
"80","7.988538100","151.101.194.187","172.20.40.110","TLSv1.2","250","Application Data"
"81","7.988538100","151.101.194.187","172.20.40.110","TCP","9714","443  >  64055 [PSH, ACK] Seq=2845 Ack=56569 Win=624 Len=9660 [TCP PDU reassembled in 87]"
"82","7.988664000","172.20.40.110","151.101.194.187","TCP","54","64055  >  443 [ACK] Seq=56569 Ack=12505 Win=512 Len=0"
"83","7.993846100","151.101.194.187","172.20.40.110","TCP","1434","443  >  64055 [ACK] Seq=12505 Ack=56569 Win=624 Len=1380 [TCP PDU reassembled in 87]"
"84","7.993846100","151.101.194.187","172.20.40.110","TCP","1434","443  >  64055 [PSH, ACK] Seq=13885 Ack=56569 Win=624 Len=1380 [TCP PDU reassembled in 87]"
"85","7.993846100","151.101.194.187","172.20.40.110","TCP","1434","443  >  64055 [ACK] Seq=15265 Ack=56569 Win=624 Len=1380 [TCP PDU reassembled in 87]"
"86","7.993846100","151.101.194.187","172.20.40.110","TCP","1434","443  >  64055 [ACK] Seq=16645 Ack=56569 Win=624 Len=1380 [TCP PDU reassembled in 87]"
"87","7.993846100","151.101.194.187","172.20.40.110","TLSv1.2","4194","Application Data"
"88","7.994017900","172.20.40.110","151.101.194.187","TCP","54","64055  >  443 [ACK] Seq=56569 Ack=22165 Win=512 Len=0"
"89","7.996184700","151.101.194.187","172.20.40.110","TCP","9714","443  >  64055 [PSH, ACK] Seq=22165 Ack=56569 Win=624 Len=9660 [TCP PDU reassembled in 91]"
"90","7.996298200","172.20.40.110","151.101.194.187","TCP","54","64055  >  443 [ACK] Seq=56569 Ack=31825 Win=512 Len=0"
"91","7.998773800","151.101.194.187","172.20.40.110","TLSv1.2","9714","Application Data"
"92","7.998880200","172.20.40.110","151.101.194.187","TCP","54","64055  >  443 [ACK] Seq=56569 Ack=41485 Win=512 Len=0"
"93","8.001808600","151.101.194.187","172.20.40.110","TCP","9714","443  >  64055 [PSH, ACK] Seq=41485 Ack=56569 Win=624 Len=9660 [TCP PDU reassembled in 95]"
"94","8.001911800","172.20.40.110","151.101.194.187","TCP","54","64055  >  443 [ACK] Seq=56569 Ack=51145 Win=512 Len=0"
"95","8.006582200","151.101.194.187","172.20.40.110","TLSv1.2","1434","Application Data"
"96","8.006582200","151.101.194.187","172.20.40.110","TCP","1434","443  >  64055 [PSH, ACK] Seq=52525 Ack=56569 Win=624 Len=1380 [TCP PDU reassembled in 101]"
"97","8.006582200","151.101.194.187","172.20.40.110","TCP","1434","443  >  64055 [ACK] Seq=53905 Ack=56569 Win=624 Len=1380 [TCP PDU reassembled in 101]"
"98","8.006582200","151.101.194.187","172.20.40.110","TCP","1434","443  >  64055 [ACK] Seq=55285 Ack=56569 Win=624 Len=1380 [TCP PDU reassembled in 101]"
"99","8.006582200","151.101.194.187","172.20.40.110","TCP","4194","443  >  64055 [PSH, ACK] Seq=56665 Ack=56569 Win=624 Len=4140 [TCP PDU reassembled in 101]"
"100","8.006728700","172.20.40.110","151.101.194.187","TCP","54","64055  >  443 [ACK] Seq=56569 Ack=60805 Win=512 Len=0"
"101","8.009038400","151.101.194.187","172.20.40.110","TLSv1.2","9714","Application Data"
"102","8.009038400","151.101.194.187","172.20.40.110","TLSv1.2","242","Application Data"
"103","8.009165600","172.20.40.110","151.101.194.187","TCP","54","64055  >  443 [ACK] Seq=56569 Ack=70653 Win=512 Len=0"
"104","8.053741300","172.20.40.110","151.101.194.187","TLSv1.2","2805","Application Data"
"105","8.062806000","151.101.194.187","172.20.40.110","TCP","60","443  >  64055 [ACK] Seq=70653 Ack=59320 Win=635 Len=0"
"106","8.066343300","151.101.194.187","172.20.40.110","TLSv1.2","340","Application Data"
"107","8.109679900","151.101.194.187","172.20.40.110","TCP","340","[TCP Retransmission] 443  >  64055 [PSH, ACK] Seq=70653 Ack=59320 Win=635 Len=286"
"108","8.109740800","172.20.40.110","151.101.194.187","TCP","66","64055  >  443 [ACK] Seq=59320 Ack=70939 Win=510 Len=0 SLE=70653 SRE=70939"
"109","8.764883300","172.20.40.110","151.101.194.187","TLSv1.2","2790","Application Data"
"110","8.766073300","172.20.40.110","151.101.194.187","TLSv1.2","2794","Application Data"
"111","8.766301200","172.20.40.110","151.101.194.187","TLSv1.2","2788","Application Data"
"112","8.779811700","151.101.194.187","172.20.40.110","TCP","60","443  >  64055 [ACK] Seq=70939 Ack=62056 Win=646 Len=0"
"113","8.787843200","151.101.194.187","172.20.40.110","TCP","60","443  >  64055 [ACK] Seq=70939 Ack=64796 Win=657 Len=0"
"114","8.787843200","151.101.194.187","172.20.40.110","TCP","60","443  >  64055 [ACK] Seq=70939 Ack=67530 Win=667 Len=0"
"115","8.787843200","151.101.194.187","172.20.40.110","TLSv1.2","241","Application Data"
"116","8.787843200","151.101.194.187","172.20.40.110","TLSv1.2","132","Application Data"
"117","8.787843200","151.101.194.187","172.20.40.110","TLSv1.2","130","Application Data"
"118","8.787965000","172.20.40.110","151.101.194.187","TCP","54","64055  >  443 [ACK] Seq=67530 Ack=71280 Win=509 Len=0"
"119","8.788005200","172.20.40.110","151.101.194.187","TLSv1.2","2788","Application Data"
"120","8.794342600","172.20.40.110","151.101.194.187","TLSv1.2","2786","Application Data"
"121","8.797359700","151.101.194.187","172.20.40.110","TCP","60","443  >  64055 [ACK] Seq=71280 Ack=70264 Win=678 Len=0"
"122","8.801098000","151.101.194.187","172.20.40.110","TLSv1.2","130","Application Data"
"123","8.804865900","151.101.194.187","172.20.40.110","TCP","60","443  >  64055 [ACK] Seq=71356 Ack=72996 Win=689 Len=0"
"124","8.807775900","151.101.194.187","172.20.40.110","TLSv1.2","130","Application Data"
"125","8.807845400","172.20.40.110","151.101.194.187","TCP","54","64055  >  443 [ACK] Seq=72996 Ack=71432 Win=509 Len=0"
"126","8.846218900","172.20.40.110","151.101.194.187","TLSv1.2","2805","Application Data"
"127","8.850531600","172.20.40.110","151.101.194.187","TLSv1.2","2804","Application Data"
"128","8.856373900","151.101.194.187","172.20.40.110","TCP","60","443  >  64055 [ACK] Seq=71432 Ack=75747 Win=700 Len=0"
"129","8.861622300","151.101.194.187","172.20.40.110","TLSv1.2","98","Application Data"
"130","8.868412900","151.101.194.187","172.20.40.110","TCP","60","443  >  64055 [ACK] Seq=71476 Ack=78497 Win=711 Len=0"
"131","8.872891100","151.101.194.187","172.20.40.110","TLSv1.2","131","Application Data"
"132","8.873046800","172.20.40.110","151.101.194.187","TCP","54","64055  >  443 [ACK] Seq=78497 Ack=71553 Win=508 Len=0"
"133","8.881515200","172.20.40.110","151.101.194.187","TLSv1.2","2788","Application Data"
"134","8.891082700","151.101.194.187","172.20.40.110","TCP","60","443  >  64055 [ACK] Seq=71553 Ack=81231 Win=721 Len=0"
"135","8.895341000","151.101.194.187","172.20.40.110","TLSv1.2","124","Application Data"
"136","8.933155600","151.101.194.187","172.20.40.110","TCP","124","[TCP Retransmission] 443  >  64055 [PSH, ACK] Seq=71553 Ack=81231 Win=721 Len=70"
"137","8.933202000","172.20.40.110","151.101.194.187","TCP","66","64055  >  443 [ACK] Seq=81231 Ack=71623 Win=508 Len=0 SLE=71553 SRE=71623"
"138","12.681152800","172.20.40.110","151.101.194.187","TLSv1.2","2792","Application Data"
"139","12.681520500","172.20.40.110","151.101.194.187","TLSv1.2","2788","Application Data"
"140","12.699557200","151.101.194.187","172.20.40.110","TCP","60","443  >  64055 [ACK] Seq=71623 Ack=83969 Win=732 Len=0"
"141","12.699557200","151.101.194.187","172.20.40.110","TCP","60","443  >  64055 [ACK] Seq=71623 Ack=86703 Win=743 Len=0"
"142","12.699557200","151.101.194.187","172.20.40.110","TLSv1.2","240","Application Data"
"143","12.699557200","151.101.194.187","172.20.40.110","TLSv1.2","130","Application Data"
"144","12.699726900","172.20.40.110","151.101.194.187","TCP","54","64055  >  443 [ACK] Seq=86703 Ack=71885 Win=507 Len=0"
"145","14.276396500","172.20.40.110","151.101.194.187","TLSv1.2","2811","Application Data"
"146","14.289964600","151.101.194.187","172.20.40.110","TCP","60","443  >  64055 [ACK] Seq=71885 Ack=89460 Win=754 Len=0"
"147","14.294402100","151.101.194.187","172.20.40.110","TLSv1.2","213","Application Data"
"148","14.324208800","172.20.40.110","151.101.194.187","TLSv1.2","2810","Application Data"
"149","14.330724300","151.101.194.187","172.20.40.110","TCP","213","[TCP Spurious Retransmission] 443  >  64055 [PSH, ACK] Seq=71885 Ack=89460 Win=754 Len=159"
"150","14.330785800","172.20.40.110","151.101.194.187","TCP","66","[TCP Dup ACK 148#1] 64055  >  443 [ACK] Seq=92216 Ack=72044 Win=512 Len=0 SLE=71885 SRE=72044"
"151","14.336225900","151.101.194.187","172.20.40.110","TCP","60","443  >  64055 [ACK] Seq=72044 Ack=92216 Win=764 Len=0"
"152","14.342315700","151.101.194.187","172.20.40.110","TLSv1.2","314","Application Data"
"153","14.379613200","151.101.194.187","172.20.40.110","TCP","314","[TCP Retransmission] 443  >  64055 [PSH, ACK] Seq=72044 Ack=92216 Win=764 Len=260"
"154","14.379723100","172.20.40.110","151.101.194.187","TCP","66","64055  >  443 [ACK] Seq=92216 Ack=72304 Win=511 Len=0 SLE=72044 SRE=72304"
"155","14.746378600","172.20.40.110","151.101.194.187","TLSv1.2","2796","Application Data"
"156","14.760844600","151.101.194.187","172.20.40.110","TCP","60","443  >  64055 [ACK] Seq=72304 Ack=94958 Win=775 Len=0"
"157","14.763159400","151.101.194.187","172.20.40.110","TLSv1.2","130","Application Data"
"158","14.803082600","151.101.194.187","172.20.40.110","TCP","130","[TCP Retransmission] 443  >  64055 [PSH, ACK] Seq=72304 Ack=94958 Win=775 Len=76"
"159","14.803159300","172.20.40.110","151.101.194.187","TCP","66","64055  >  443 [ACK] Seq=94958 Ack=72380 Win=510 Len=0 SLE=72304 SRE=72380"
"160","15.024412300","172.20.40.110","151.101.194.187","TLSv1.2","2798","Application Data"
"161","15.031016800","172.20.40.110","151.101.194.187","TLSv1.2","2794","Application Data"
"162","15.033322200","172.20.40.110","151.101.194.187","TLSv1.2","2796","Application Data"
"163","15.040101100","151.101.194.187","172.20.40.110","TCP","60","443  >  64055 [ACK] Seq=72380 Ack=97702 Win=786 Len=0"
"164","15.042117300","172.20.40.110","151.101.194.187","TLSv1.2","2794","Application Data"
"165","15.043221800","151.101.194.187","172.20.40.110","TLSv1.2","104","Application Data"
"166","15.046230500","172.20.40.110","151.101.194.187","TLSv1.2","2792","Application Data"
"167","15.055354000","151.101.194.187","172.20.40.110","TCP","60","443  >  64055 [ACK] Seq=72430 Ack=100442 Win=796 Len=0"
"168","15.055354000","151.101.194.187","172.20.40.110","TCP","60","443  >  64055 [ACK] Seq=72430 Ack=103184 Win=807 Len=0"
"169","15.055354000","151.101.194.187","172.20.40.110","TCP","60","443  >  64055 [ACK] Seq=72430 Ack=105924 Win=818 Len=0"
"170","15.058512300","151.101.194.187","172.20.40.110","TLSv1.2","104","Application Data"
"171","15.059600200","151.101.194.187","172.20.40.110","TLSv1.2","104","Application Data"
"172","15.059686900","172.20.40.110","151.101.194.187","TCP","54","64055  >  443 [ACK] Seq=108662 Ack=72530 Win=510 Len=0"
"173","15.060039500","151.101.194.187","172.20.40.110","TLSv1.2","104","Application Data"
"174","15.064202600","151.101.194.187","172.20.40.110","TCP","60","443  >  64055 [ACK] Seq=72580 Ack=108662 Win=829 Len=0"
"175","15.065277500","151.101.194.187","172.20.40.110","TLSv1.2","104","Application Data"
"176","15.065339000","172.20.40.110","151.101.194.187","TCP","54","64055  >  443 [ACK] Seq=108662 Ack=72630 Win=509 Len=0"
"177","15.257833200","172.20.40.110","151.101.194.187","TLSv1.2","2794","Application Data"
"178","15.268270800","151.101.194.187","172.20.40.110","TCP","60","443  >  64055 [ACK] Seq=72630 Ack=111402 Win=839 Len=0"
"179","15.273809000","151.101.194.187","172.20.40.110","TLSv1.2","208","Application Data"
"180","15.309553000","151.101.194.187","172.20.40.110","TCP","208","[TCP Retransmission] 443  >  64055 [PSH, ACK] Seq=72630 Ack=111402 Win=839 Len=154"
"181","15.309633100","172.20.40.110","151.101.194.187","TCP","66","64055  >  443 [ACK] Seq=111402 Ack=72784 Win=509 Len=0 SLE=72630 SRE=72784"
"182","15.348270600","172.20.40.110","151.101.194.187","TLSv1.2","2794","Application Data"
"183","15.357307200","151.101.194.187","172.20.40.110","TCP","60","443  >  64055 [ACK] Seq=72784 Ack=114142 Win=850 Len=0"
"184","15.364103700","151.101.194.187","172.20.40.110","TLSv1.2","103","Application Data"
"185","15.398000500","151.101.194.187","172.20.40.110","TCP","103","[TCP Retransmission] 443  >  64055 [PSH, ACK] Seq=72784 Ack=114142 Win=850 Len=49"
"186","15.398054700","172.20.40.110","151.101.194.187","TCP","66","64055  >  443 [ACK] Seq=114142 Ack=72833 Win=509 Len=0 SLE=72784 SRE=72833"
"187","16.004314300","172.20.40.110","151.101.194.187","TLSv1.2","2799","Application Data"
"188","16.013259200","151.101.194.187","172.20.40.110","TCP","60","443  >  64055 [ACK] Seq=72833 Ack=116887 Win=861 Len=0"
"189","16.015475600","151.101.194.187","172.20.40.110","TLSv1.2","131","Application Data"
"190","16.050674200","151.101.194.187","172.20.40.110","TCP","131","[TCP Retransmission] 443  >  64055 [PSH, ACK] Seq=72833 Ack=116887 Win=861 Len=77"
"191","16.050739600","172.20.40.110","151.101.194.187","TCP","66","64055  >  443 [ACK] Seq=116887 Ack=72910 Win=508 Len=0 SLE=72833 SRE=72910"
"192","17.551574000","172.20.40.110","151.101.194.187","TLSv1.2","2811","Application Data"
"193","17.562954200","151.101.194.187","172.20.40.110","TCP","60","443  >  64055 [ACK] Seq=72910 Ack=119644 Win=871 Len=0"
"194","17.566319700","151.101.194.187","172.20.40.110","TLSv1.2","240","Application Data"
"195","17.591068800","172.20.40.110","151.101.194.187","TLSv1.2","2810","Application Data"
"196","17.600512900","151.101.194.187","172.20.40.110","TCP","60","443  >  64055 [ACK] Seq=73096 Ack=122400 Win=882 Len=0"
"197","17.607051700","151.101.194.187","172.20.40.110","TLSv1.2","131","Application Data"
"198","17.651132200","151.101.194.187","172.20.40.110","TCP","131","[TCP Retransmission] 443  >  64055 [PSH, ACK] Seq=73096 Ack=122400 Win=882 Len=77"
"199","17.651340600","172.20.40.110","151.101.194.187","TCP","66","64055  >  443 [ACK] Seq=122400 Ack=73173 Win=507 Len=0 SLE=73096 SRE=73173"
"200","17.751089500","172.20.40.110","151.101.194.187","TLSv1.2","2796","Application Data"
"201","17.759936700","151.101.194.187","172.20.40.110","TCP","60","443  >  64055 [ACK] Seq=73173 Ack=125142 Win=893 Len=0"
"202","17.763443600","151.101.194.187","172.20.40.110","TLSv1.2","104","Application Data"
"203","17.803391400","151.101.194.187","172.20.40.110","TCP","104","[TCP Retransmission] 443  >  64055 [PSH, ACK] Seq=73173 Ack=125142 Win=893 Len=50"
"204","17.803446900","172.20.40.110","151.101.194.187","TCP","66","64055  >  443 [ACK] Seq=125142 Ack=73223 Win=507 Len=0 SLE=73173 SRE=73223"
"205","19.256070700","172.20.40.110","151.101.194.187","TLSv1.2","2808","Application Data"
"206","19.266801700","151.101.194.187","172.20.40.110","TCP","60","443  >  64055 [ACK] Seq=73223 Ack=127896 Win=904 Len=0"
"207","19.269525700","151.101.194.187","172.20.40.110","TLSv1.2","240","Application Data"
"208","19.308895700","151.101.194.187","172.20.40.110","TCP","240","[TCP Retransmission] 443  >  64055 [PSH, ACK] Seq=73223 Ack=127896 Win=904 Len=186"
"209","19.308970000","172.20.40.110","151.101.194.187","TCP","66","64055  >  443 [ACK] Seq=127896 Ack=73409 Win=506 Len=0 SLE=73223 SRE=73409"
"210","20.775029200","172.20.40.110","151.101.194.187","TLSv1.2","2802","Application Data"
"211","20.787442700","172.20.40.110","151.101.194.187","TLSv1.2","2796","Application Data"
"212","20.787880300","172.20.40.110","151.101.194.187","TLSv1.2","2796","Application Data"
"213","20.787986700","151.101.194.187","172.20.40.110","TCP","60","443  >  64055 [ACK] Seq=73409 Ack=130644 Win=914 Len=0"
"214","20.791031500","151.101.194.187","172.20.40.110","TLSv1.2","240","Application Data"
"215","20.791127200","172.20.40.110","151.101.194.187","TCP","54","64055  >  443 [ACK] Seq=136128 Ack=73595 Win=512 Len=0"
"216","20.805387900","151.101.194.187","172.20.40.110","TCP","60","443  >  64055 [ACK] Seq=73595 Ack=133386 Win=925 Len=0"
"217","20.805387900","151.101.194.187","172.20.40.110","TCP","60","443  >  64055 [ACK] Seq=73595 Ack=136128 Win=936 Len=0"
"218","20.805387900","151.101.194.187","172.20.40.110","TLSv1.2","340","Application Data"
"219","20.805387900","151.101.194.187","172.20.40.110","TLSv1.2","130","Application Data"
"220","20.805513200","172.20.40.110","151.101.194.187","TCP","54","64055  >  443 [ACK] Seq=136128 Ack=73957 Win=510 Len=0"
"221","20.824624100","172.20.40.110","151.101.194.187","TLSv1.2","2796","Application Data"
"222","20.826555400","172.20.40.110","151.101.194.187","TLSv1.2","2803","Application Data"
"223","20.826721000","172.20.40.110","151.101.194.187","TLSv1.2","2802","Application Data"
"224","20.826812500","172.20.40.110","151.101.194.187","TLSv1.2","2799","Application Data"
"225","20.827090500","172.20.40.110","151.101.194.187","TLSv1.2","2796","Application Data"
"226","20.827264800","172.20.40.110","151.101.194.187","TLSv1.2","2793","Application Data"
"227","20.827840200","172.20.40.110","151.101.194.187","TLSv1.2","2802","Application Data"
"228","20.828308900","172.20.40.110","151.101.194.187","TLSv1.2","2795","Application Data"
"229","20.847066900","151.101.194.187","172.20.40.110","TCP","60","443  >  64055 [ACK] Seq=73957 Ack=138870 Win=947 Len=0"
"230","20.847066900","151.101.194.187","172.20.40.110","TLSv1.2","131","Application Data"
"231","20.852404400","151.101.194.187","172.20.40.110","TCP","60","443  >  64055 [ACK] Seq=74034 Ack=141619 Win=957 Len=0"
"232","20.852404400","151.101.194.187","172.20.40.110","TCP","60","443  >  64055 [ACK] Seq=74034 Ack=144367 Win=968 Len=0"
"233","20.853313800","151.101.194.187","172.20.40.110","TCP","60","443  >  64055 [ACK] Seq=74034 Ack=147112 Win=979 Len=0"
"234","20.853313800","151.101.194.187","172.20.40.110","TCP","60","443  >  64055 [ACK] Seq=74034 Ack=149854 Win=989 Len=0"
"235","20.853313800","151.101.194.187","172.20.40.110","TCP","60","443  >  64055 [ACK] Seq=74034 Ack=152593 Win=1000 Len=0"
"236","20.853313800","151.101.194.187","172.20.40.110","TCP","60","443  >  64055 [ACK] Seq=74034 Ack=155341 Win=1011 Len=0"
"237","20.853313800","151.101.194.187","172.20.40.110","TCP","60","443  >  64055 [ACK] Seq=74034 Ack=158082 Win=1022 Len=0"
"238","20.855398700","151.101.194.187","172.20.40.110","TLSv1.2","131","Application Data"
"239","20.855478400","172.20.40.110","151.101.194.187","TCP","54","64055  >  443 [ACK] Seq=158082 Ack=74111 Win=510 Len=0"
"240","20.857670000","151.101.194.187","172.20.40.110","TLSv1.2","131","Application Data"
"241","20.857670000","151.101.194.187","172.20.40.110","TLSv1.2","131","Application Data"
"242","20.857670000","151.101.194.187","172.20.40.110","TLSv1.2","130","Application Data"
"243","20.857670000","151.101.194.187","172.20.40.110","TLSv1.2","129","Application Data"
"244","20.857752300","172.20.40.110","151.101.194.187","TCP","54","64055  >  443 [ACK] Seq=158082 Ack=74416 Win=508 Len=0"
"245","20.858705500","151.101.194.187","172.20.40.110","TLSv1.2","131","Application Data"
"246","20.858705500","151.101.194.187","172.20.40.110","TLSv1.2","130","Application Data"
"247","20.858774100","172.20.40.110","151.101.194.187","TCP","54","64055  >  443 [ACK] Seq=158082 Ack=74569 Win=508 Len=0"
"248","21.445477800","172.20.40.110","151.101.194.187","TLSv1.2","2811","Application Data"
"249","21.456496100","151.101.194.187","172.20.40.110","TCP","60","443  >  64055 [ACK] Seq=74569 Ack=160839 Win=1032 Len=0"
"250","21.459465500","151.101.194.187","172.20.40.110","TLSv1.2","240","Application Data"
"251","21.459583500","172.20.40.110","151.101.194.187","TLSv1.2","2810","Application Data"
"252","21.473766200","151.101.194.187","172.20.40.110","TCP","60","443  >  64055 [ACK] Seq=74755 Ack=163595 Win=1044 Len=0"
"253","21.475790000","151.101.194.187","172.20.40.110","TLSv1.2","131","Application Data"
"254","21.507992300","151.101.194.187","172.20.40.110","TCP","131","[TCP Retransmission] 443  >  64055 [PSH, ACK] Seq=74755 Ack=163595 Win=1044 Len=77"
"255","21.508064300","172.20.40.110","151.101.194.187","TCP","66","64055  >  443 [ACK] Seq=163595 Ack=74832 Win=507 Len=0 SLE=74755 SRE=74832"
"256","22.681056800","172.20.40.110","151.101.194.187","TLSv1.2","2810","Application Data"
"257","22.686717200","172.20.40.110","151.101.194.187","TLSv1.2","2811","Application Data"
"258","22.688232300","172.20.40.110","151.101.194.187","TLSv1.2","2798","Application Data"
"259","22.688454400","172.20.40.110","151.101.194.187","TLSv1.2","2792","Application Data"
"260","22.693855200","151.101.194.187","172.20.40.110","TCP","60","443  >  64055 [ACK] Seq=74832 Ack=166351 Win=1055 Len=0"
"261","22.697871200","151.101.194.187","172.20.40.110","TLSv1.2","424","Application Data"
"262","22.697871200","151.101.194.187","172.20.40.110","TCP","60","443  >  64055 [ACK] Seq=75202 Ack=169108 Win=1065 Len=0"
"263","22.697979800","172.20.40.110","151.101.194.187","TCP","54","64055  >  443 [ACK] Seq=174590 Ack=75202 Win=512 Len=0"
"264","22.699120300","151.101.194.187","172.20.40.110","TLSv1.2","103","Application Data"
"265","22.699194100","172.20.40.110","151.101.194.187","TCP","54","64055  >  443 [ACK] Seq=174590 Ack=75251 Win=511 Len=0"
"266","22.701670900","151.101.194.187","172.20.40.110","TCP","60","443  >  64055 [ACK] Seq=75251 Ack=171852 Win=1076 Len=0"
"267","22.701670900","151.101.194.187","172.20.40.110","TCP","60","443  >  64055 [ACK] Seq=75251 Ack=174590 Win=1087 Len=0"
"268","22.704489600","151.101.194.187","172.20.40.110","TLSv1.2","130","Application Data"
"269","22.704489600","151.101.194.187","172.20.40.110","TLSv1.2","130","Application Data"
"270","22.704618000","172.20.40.110","151.101.194.187","TCP","54","64055  >  443 [ACK] Seq=174590 Ack=75403 Win=511 Len=0"
"271","22.867808900","172.20.40.110","151.101.194.187","TLSv1.2","2814","Application Data"
"272","22.880308000","151.101.194.187","172.20.40.110","TCP","60","443  >  64055 [ACK] Seq=75403 Ack=177350 Win=1097 Len=0"
"273","22.884497600","151.101.194.187","172.20.40.110","TLSv1.2","130","Application Data"
"274","22.911978100","151.101.194.187","172.20.40.110","TCP","130","[TCP Retransmission] 443  >  64055 [PSH, ACK] Seq=75403 Ack=177350 Win=1097 Len=76"
"275","22.912040400","172.20.40.110","151.101.194.187","TCP","66","64055  >  443 [ACK] Seq=177350 Ack=75479 Win=511 Len=0 SLE=75403 SRE=75479"
"276","23.108929900","172.20.40.110","151.101.194.187","TLSv1.2","2803","Application Data"
"277","23.110981600","172.20.40.110","151.101.194.187","TLSv1.2","2806","Application Data"
"278","23.111577200","172.20.40.110","151.101.194.187","TLSv1.2","2800","Application Data"
"279","23.114508400","172.20.40.110","151.101.194.187","TLSv1.2","2797","Application Data"
"280","23.118596800","151.101.194.187","172.20.40.110","TCP","60","443  >  64055 [ACK] Seq=75479 Ack=180099 Win=1108 Len=0"
"281","23.120243200","151.101.194.187","172.20.40.110","TCP","60","443  >  64055 [ACK] Seq=75479 Ack=182851 Win=1119 Len=0"
"282","23.120243200","151.101.194.187","172.20.40.110","TLSv1.2","104","Application Data"
"283","23.121537800","151.101.194.187","172.20.40.110","TLSv1.2","130","Application Data"
"284","23.121613000","172.20.40.110","151.101.194.187","TCP","54","64055  >  443 [ACK] Seq=188340 Ack=75605 Win=510 Len=0"
"285","23.123026600","151.101.194.187","172.20.40.110","TCP","60","443  >  64055 [ACK] Seq=75605 Ack=185597 Win=1130 Len=0"
"286","23.124240500","151.101.194.187","172.20.40.110","TCP","60","443  >  64055 [ACK] Seq=75605 Ack=188340 Win=1140 Len=0"
"287","23.126990200","151.101.194.187","172.20.40.110","TLSv1.2","130","Application Data"
"288","23.128131700","151.101.194.187","172.20.40.110","TLSv1.2","130","Application Data"
"289","23.128231500","172.20.40.110","151.101.194.187","TCP","54","64055  >  443 [ACK] Seq=188340 Ack=75757 Win=509 Len=0"
"290","23.156676600","172.20.40.110","151.101.194.187","TLSv1.2","2810","Application Data"
"291","23.159497700","172.20.40.110","151.101.194.187","TLSv1.2","2811","Application Data"
"292","23.167783700","151.101.194.187","172.20.40.110","TCP","60","443  >  64055 [ACK] Seq=75757 Ack=191096 Win=1151 Len=0"
"293","23.171102200","151.101.194.187","172.20.40.110","TCP","60","443  >  64055 [ACK] Seq=75757 Ack=193853 Win=1162 Len=0"
"294","23.174517200","151.101.194.187","172.20.40.110","TLSv1.2","208","Application Data"
"295","23.174517200","151.101.194.187","172.20.40.110","TLSv1.2","130","Application Data"
"296","23.174620200","172.20.40.110","151.101.194.187","TCP","54","64055  >  443 [ACK] Seq=193853 Ack=75987 Win=509 Len=0"
"297","24.012181900","172.20.40.110","151.101.194.187","TLSv1.2","2809","Application Data"
"298","24.023672600","151.101.194.187","172.20.40.110","TCP","60","443  >  64055 [ACK] Seq=75987 Ack=196608 Win=1173 Len=0"
"299","24.027550100","151.101.194.187","172.20.40.110","TLSv1.2","104","Application Data"
"300","24.041774600","172.20.40.110","151.101.194.187","TLSv1.2","2807","Application Data"
"301","24.055140700","151.101.194.187","172.20.40.110","TCP","104","[TCP Spurious Retransmission] 443  >  64055 [PSH, ACK] Seq=75987 Ack=196608 Win=1173 Len=50"
"302","24.055140700","151.101.194.187","172.20.40.110","TCP","60","443  >  64055 [ACK] Seq=76037 Ack=199361 Win=1183 Len=0"
"303","24.055448400","172.20.40.110","151.101.194.187","TCP","66","[TCP Dup ACK 300#1] 64055  >  443 [ACK] Seq=199361 Ack=76037 Win=508 Len=0 SLE=75987 SRE=76037"
"304","24.059335700","151.101.194.187","172.20.40.110","TLSv1.2","130","Application Data"
"305","24.083765300","151.101.194.187","172.20.40.110","TCP","130","[TCP Retransmission] 443  >  64055 [PSH, ACK] Seq=76037 Ack=199361 Win=1183 Len=76"
"306","24.083839700","172.20.40.110","151.101.194.187","TCP","66","64055  >  443 [ACK] Seq=199361 Ack=76113 Win=508 Len=0 SLE=76037 SRE=76113"
"307","24.185283100","172.20.40.110","151.101.194.187","TLSv1.2","2810","Application Data"
"308","24.197126000","151.101.194.187","172.20.40.110","TCP","60","443  >  64055 [ACK] Seq=76113 Ack=202117 Win=1194 Len=0"
"309","24.216219300","151.101.194.187","172.20.40.110","TLSv1.2","213","Application Data"
"310","24.242256400","151.101.194.187","172.20.40.110","TCP","213","[TCP Retransmission] 443  >  64055 [PSH, ACK] Seq=76113 Ack=202117 Win=1194 Len=159"
"311","24.242326600","172.20.40.110","151.101.194.187","TCP","66","64055  >  443 [ACK] Seq=202117 Ack=76272 Win=507 Len=0 SLE=76113 SRE=76272"
"312","25.741787900","172.20.40.110","151.101.194.187","TLSv1.2","2795","Application Data"
"313","25.756264800","151.101.194.187","172.20.40.110","TCP","60","443  >  64055 [ACK] Seq=76272 Ack=204858 Win=1205 Len=0"
"314","25.758982900","151.101.194.187","172.20.40.110","TLSv1.2","451","Application Data"
"315","25.783748200","151.101.194.187","172.20.40.110","TCP","451","[TCP Retransmission] 443  >  64055 [PSH, ACK] Seq=76272 Ack=204858 Win=1205 Len=397"
"316","25.783828500","172.20.40.110","151.101.194.187","TCP","66","64055  >  443 [ACK] Seq=204858 Ack=76669 Win=512 Len=0 SLE=76272 SRE=76669"
"317","25.928136100","172.20.40.110","151.101.194.187","TLSv1.2","2795","Application Data"
"318","25.943369700","151.101.194.187","172.20.40.110","TCP","60","443  >  64055 [ACK] Seq=76669 Ack=207599 Win=1216 Len=0"
"319","25.946423700","151.101.194.187","172.20.40.110","TLSv1.2","131","Application Data"
"320","25.972349600","151.101.194.187","172.20.40.110","TCP","131","[TCP Retransmission] 443  >  64055 [PSH, ACK] Seq=76669 Ack=207599 Win=1216 Len=77"
"321","25.972397400","172.20.40.110","151.101.194.187","TCP","66","64055  >  443 [ACK] Seq=207599 Ack=76746 Win=511 Len=0 SLE=76669 SRE=76746"
"322","26.484047100","172.20.40.110","151.101.194.187","TLSv1.2","2807","Application Data"
"323","26.492280800","172.20.40.110","151.101.194.187","TLSv1.2","2795","Application Data"
"324","26.495560400","151.101.194.187","172.20.40.110","TCP","60","443  >  64055 [ACK] Seq=76746 Ack=210352 Win=1226 Len=0"
"325","26.501535000","151.101.194.187","172.20.40.110","TLSv1.2","213","Application Data"
"326","26.501535000","151.101.194.187","172.20.40.110","TCP","60","443  >  64055 [ACK] Seq=76905 Ack=213093 Win=1237 Len=0"
"327","26.502955300","172.20.40.110","151.101.194.187","TLSv1.2","2795","Application Data"
"328","26.505700200","151.101.194.187","172.20.40.110","TLSv1.2","104","Application Data"
"329","26.512686100","151.101.194.187","172.20.40.110","TCP","60","443  >  64055 [ACK] Seq=76955 Ack=215834 Win=1248 Len=0"
"330","26.517161200","151.101.194.187","172.20.40.110","TLSv1.2","98","Application Data"
"331","26.517237700","172.20.40.110","151.101.194.187","TCP","54","64055  >  443 [ACK] Seq=215834 Ack=76999 Win=510 Len=0"
"332","29.052296000","172.20.40.110","151.101.194.187","TLSv1.2","2610","Application Data"
"333","29.063326100","151.101.194.187","172.20.40.110","TCP","60","443  >  64055 [ACK] Seq=76999 Ack=218390 Win=1258 Len=0"
"334","29.135798000","151.101.194.187","172.20.40.110","TLSv1.2","339","Application Data"
"335","29.135798000","151.101.194.187","172.20.40.110","TLSv1.2","357","Application Data"
"336","29.135883400","172.20.40.110","151.101.194.187","TCP","54","64055  >  443 [ACK] Seq=218390 Ack=77587 Win=508 Len=0"
"337","29.137661800","172.20.40.110","151.101.194.187","TLSv1.2","89","Application Data"
"338","29.145433100","151.101.194.187","172.20.40.110","TCP","60","443  >  64055 [ACK] Seq=77587 Ack=218425 Win=1258 Len=0"
"339","30.454226700","172.20.40.110","151.101.194.187","TLSv1.2","2893","Application Data"
"340","30.464791400","151.101.194.187","172.20.40.110","TCP","60","443  >  64055 [ACK] Seq=77587 Ack=221264 Win=1269 Len=0"
"341","30.467990800","151.101.194.187","172.20.40.110","TLSv1.2","240","Application Data"
"342","30.479092900","172.20.40.110","151.101.194.187","TLSv1.2","2884","Application Data"
"343","30.483648900","172.20.40.110","151.101.194.187","TLSv1.2","2879","Application Data"
"344","30.484196900","172.20.40.110","151.101.194.187","TLSv1.2","2878","Application Data"
"345","30.489941700","151.101.194.187","172.20.40.110","TCP","60","443  >  64055 [ACK] Seq=77773 Ack=224094 Win=1280 Len=0"
"346","30.493814400","151.101.194.187","172.20.40.110","TLSv1.2","130","Application Data"
"347","30.501452500","151.101.194.187","172.20.40.110","TCP","60","443  >  64055 [ACK] Seq=77849 Ack=226919 Win=1291 Len=0"
"348","30.501452500","151.101.194.187","172.20.40.110","TCP","60","443  >  64055 [ACK] Seq=77849 Ack=229743 Win=1302 Len=0"
"349","30.501452500","151.101.194.187","172.20.40.110","TLSv1.2","130","Application Data"
"350","30.501452500","151.101.194.187","172.20.40.110","TLSv1.2","153","Application Data"
"351","30.501555100","172.20.40.110","151.101.194.187","TCP","54","64055  >  443 [ACK] Seq=229743 Ack=78024 Win=506 Len=0"
"352","30.517590800","172.20.40.110","151.101.194.187","TLSv1.2","2879","Application Data"
"353","30.527846700","151.101.194.187","172.20.40.110","TCP","60","443  >  64055 [ACK] Seq=78024 Ack=232568 Win=1313 Len=0"
"354","30.531688500","151.101.194.187","172.20.40.110","TLSv1.2","291","Application Data"
"355","30.573108700","151.101.194.187","172.20.40.110","TCP","291","[TCP Retransmission] 443  >  64055 [PSH, ACK] Seq=78024 Ack=232568 Win=1313 Len=237"
"356","30.573194000","172.20.40.110","151.101.194.187","TCP","66","64055  >  443 [ACK] Seq=232568 Ack=78261 Win=512 Len=0 SLE=78024 SRE=78261"
"357","30.600054700","172.20.40.110","151.101.194.187","TLSv1.2","2892","Application Data"
"358","30.612690500","151.101.194.187","172.20.40.110","TCP","60","443  >  64055 [ACK] Seq=78261 Ack=235406 Win=1324 Len=0"
"359","30.612690500","151.101.194.187","172.20.40.110","TLSv1.2","130","Application Data"
"360","30.643867800","151.101.194.187","172.20.40.110","TCP","130","[TCP Retransmission] 443  >  64055 [PSH, ACK] Seq=78261 Ack=235406 Win=1324 Len=76"
"361","30.643924000","172.20.40.110","151.101.194.187","TCP","66","64055  >  443 [ACK] Seq=235406 Ack=78337 Win=511 Len=0 SLE=78261 SRE=78337"
"362","30.710218500","172.20.40.110","151.101.194.187","TLSv1.2","2878","Application Data"
"363","30.722384100","151.101.194.187","172.20.40.110","TCP","60","443  >  64055 [ACK] Seq=78337 Ack=238230 Win=1335 Len=0"
"364","30.724277700","151.101.194.187","172.20.40.110","TLSv1.2","130","Application Data"
"365","30.749587900","172.20.40.110","151.101.194.187","TLSv1.2","2875","Application Data"
"366","30.756184400","151.101.194.187","172.20.40.110","TCP","130","[TCP Spurious Retransmission] 443  >  64055 [PSH, ACK] Seq=78337 Ack=238230 Win=1335 Len=76"
"367","30.756298600","172.20.40.110","151.101.194.187","TCP","66","[TCP Dup ACK 365#1] 64055  >  443 [ACK] Seq=241051 Ack=78413 Win=511 Len=0 SLE=78337 SRE=78413"
"368","30.761603000","151.101.194.187","172.20.40.110","TCP","60","443  >  64055 [ACK] Seq=78413 Ack=241051 Win=1346 Len=0"
"369","30.763781100","151.101.194.187","172.20.40.110","TLSv1.2","131","Application Data"
"370","30.768823200","172.20.40.110","151.101.194.187","TLSv1.2","2892","Application Data"
"371","30.776615600","172.20.40.110","151.101.194.187","TLSv1.2","2893","Application Data"
"372","30.779347900","151.101.194.187","172.20.40.110","TCP","60","443  >  64055 [ACK] Seq=78490 Ack=243889 Win=1357 Len=0"
"373","30.784781100","151.101.194.187","172.20.40.110","TLSv1.2","131","Application Data"
"374","30.786069700","151.101.194.187","172.20.40.110","TCP","60","443  >  64055 [ACK] Seq=78567 Ack=246728 Win=1368 Len=0"
"375","30.789312600","151.101.194.187","172.20.40.110","TLSv1.2","98","Application Data"
"376","30.789395800","172.20.40.110","151.101.194.187","TCP","54","64055  >  443 [ACK] Seq=246728 Ack=78611 Win=510 Len=0"
"377","30.977329700","172.20.40.110","151.101.194.187","TLSv1.2","2875","Application Data"
"378","30.979066700","172.20.40.110","151.101.194.187","TLSv1.2","2881","Application Data"
"379","30.979878900","172.20.40.110","151.101.194.187","TLSv1.2","2877","Application Data"
"380","30.980077200","172.20.40.110","151.101.194.187","TLSv1.2","2880","Application Data"
"381","30.989149200","151.101.194.187","172.20.40.110","TCP","60","443  >  64055 [ACK] Seq=78611 Ack=249549 Win=1379 Len=0"
"382","30.992531500","151.101.194.187","172.20.40.110","TLSv1.2","98","Application Data"
"383","30.993826400","151.101.194.187","172.20.40.110","TCP","60","443  >  64055 [ACK] Seq=78655 Ack=252376 Win=1390 Len=0"
"384","30.993826400","151.101.194.187","172.20.40.110","TCP","60","443  >  64055 [ACK] Seq=78655 Ack=255199 Win=1401 Len=0"
"385","30.996273700","151.101.194.187","172.20.40.110","TCP","60","443  >  64055 [ACK] Seq=78655 Ack=258025 Win=1413 Len=0"
"386","30.997397200","151.101.194.187","172.20.40.110","TLSv1.2","130","Application Data"
"387","30.997397200","151.101.194.187","172.20.40.110","TLSv1.2","130","Application Data"
"388","30.997482500","172.20.40.110","151.101.194.187","TCP","54","64055  >  443 [ACK] Seq=258025 Ack=78807 Win=509 Len=0"
"389","30.999553500","151.101.194.187","172.20.40.110","TLSv1.2","129","Application Data"
"390","30.999661300","172.20.40.110","151.101.194.187","TCP","54","64055  >  443 [ACK] Seq=258025 Ack=78882 Win=509 Len=0"
"391","31.103406000","172.20.40.110","151.101.194.187","TLSv1.2","2892","Application Data"
"392","31.114684100","151.101.194.187","172.20.40.110","TCP","60","443  >  64055 [ACK] Seq=78882 Ack=260863 Win=1424 Len=0"
"393","31.118168400","151.101.194.187","172.20.40.110","TLSv1.2","240","Application Data"
"394","31.147267800","151.101.194.187","172.20.40.110","TCP","240","[TCP Retransmission] 443  >  64055 [PSH, ACK] Seq=78882 Ack=260863 Win=1424 Len=186"
"395","31.147324600","172.20.40.110","151.101.194.187","TCP","66","64055  >  443 [ACK] Seq=260863 Ack=79068 Win=508 Len=0 SLE=78882 SRE=79068"
"396","31.196806600","172.20.40.110","151.101.194.187","TLSv1.2","2892","Application Data"
"397","31.198609500","172.20.40.110","151.101.194.187","TLSv1.2","2893","Application Data"
"398","31.207229600","151.101.194.187","172.20.40.110","TCP","60","443  >  64055 [ACK] Seq=79068 Ack=263701 Win=1435 Len=0"
"399","31.209845600","151.101.194.187","172.20.40.110","TCP","60","443  >  64055 [ACK] Seq=79068 Ack=266540 Win=1446 Len=0"
"400","31.211279200","151.101.194.187","172.20.40.110","TLSv1.2","208","Application Data"
"401","31.211279200","151.101.194.187","172.20.40.110","TLSv1.2","130","Application Data"
"402","31.211369600","172.20.40.110","151.101.194.187","TCP","54","64055  >  443 [ACK] Seq=266540 Ack=79298 Win=508 Len=0"
"403","31.383104600","172.20.40.110","151.101.194.187","TLSv1.2","2884","Application Data"
"404","31.398951300","151.101.194.187","172.20.40.110","TCP","60","443  >  64055 [ACK] Seq=79298 Ack=269370 Win=1457 Len=0"
"405","31.400328600","151.101.194.187","172.20.40.110","TLSv1.2","180","Application Data"
"406","31.416572700","172.20.40.110","151.101.194.187","TLSv1.2","2886","Application Data"
"407","31.417128600","172.20.40.110","151.101.194.187","TLSv1.2","2875","Application Data"
"408","31.426008300","151.101.194.187","172.20.40.110","TCP","60","443  >  64055 [ACK] Seq=79424 Ack=272202 Win=1469 Len=0"
"409","31.428406400","151.101.194.187","172.20.40.110","TCP","60","443  >  64055 [ACK] Seq=79424 Ack=275023 Win=1480 Len=0"
"410","31.431264000","151.101.194.187","172.20.40.110","TLSv1.2","291","Application Data"
"411","31.431264000","151.101.194.187","172.20.40.110","TLSv1.2","130","Application Data"
"412","31.431345900","172.20.40.110","151.101.194.187","TCP","54","64055  >  443 [ACK] Seq=275023 Ack=79737 Win=512 Len=0"
"413","31.495684400","172.20.40.110","151.101.194.187","TLSv1.2","2878","Application Data"
"414","31.507073800","151.101.194.187","172.20.40.110","TCP","60","443  >  64055 [ACK] Seq=79737 Ack=277847 Win=1491 Len=0"
"415","31.511187200","151.101.194.187","172.20.40.110","TLSv1.2","130","Application Data"
"416","31.541030100","151.101.194.187","172.20.40.110","TCP","130","[TCP Retransmission] 443  >  64055 [PSH, ACK] Seq=79737 Ack=277847 Win=1491 Len=76"
"417","31.541094200","172.20.40.110","151.101.194.187","TCP","66","64055  >  443 [ACK] Seq=277847 Ack=79813 Win=511 Len=0 SLE=79737 SRE=79813"
"418","32.058494000","172.20.40.110","151.101.194.187","TLSv1.2","2847","Application Data"
"419","32.064250700","172.20.40.110","151.101.194.187","TLSv1.2","2879","Application Data"
"420","32.069134600","151.101.194.187","172.20.40.110","TCP","60","443  >  64055 [ACK] Seq=79813 Ack=280640 Win=1501 Len=0"
"421","32.072434500","151.101.194.187","172.20.40.110","TLSv1.2","130","Application Data"
"422","32.074655800","151.101.194.187","172.20.40.110","TCP","60","443  >  64055 [ACK] Seq=79889 Ack=283465 Win=1512 Len=0"
"423","32.079178500","151.101.194.187","172.20.40.110","TLSv1.2","130","Application Data"
"424","32.079242900","172.20.40.110","151.101.194.187","TCP","54","64055  >  443 [ACK] Seq=283465 Ack=79965 Win=511 Len=0"
"425","32.104083600","172.20.40.110","151.101.194.187","TLSv1.2","2616","Application Data"
"426","32.113097900","151.101.194.187","172.20.40.110","TCP","60","443  >  64055 [ACK] Seq=79965 Ack=286027 Win=1523 Len=0"
"427","32.190205000","151.101.194.187","172.20.40.110","TLSv1.2","522","Application Data"
"428","32.191832500","151.101.194.187","172.20.40.110","TLSv1.2","86","Application Data"
"429","32.191832500","151.101.194.187","172.20.40.110","TLSv1.2","878","Application Data"
"430","32.191832500","151.101.194.187","172.20.40.110","TLSv1.2","86","Application Data"
"431","32.191832500","151.101.194.187","172.20.40.110","TLSv1.2","86","Application Data"
"432","32.191832500","151.101.194.187","172.20.40.110","TLSv1.2","124","Application Data, Application Data"
"433","32.191832500","151.101.194.187","172.20.40.110","TLSv1.2","87","Application Data"
"434","32.191832500","151.101.194.187","172.20.40.110","TLSv1.2","86","Application Data"
"435","32.191832500","151.101.194.187","172.20.40.110","TLSv1.2","86","Application Data"
"436","32.192053800","172.20.40.110","151.101.194.187","TCP","54","64055  >  443 [ACK] Seq=286027 Ack=81520 Win=512 Len=0"
"437","32.193814400","151.101.194.187","172.20.40.110","TLSv1.2","87","Application Data"
"438","32.193814400","151.101.194.187","172.20.40.110","TLSv1.2","382","Application Data"
"439","32.193814400","151.101.194.187","172.20.40.110","TLSv1.2","85","Application Data"
"440","32.193906300","172.20.40.110","151.101.194.187","TCP","54","64055  >  443 [ACK] Seq=286027 Ack=81912 Win=510 Len=0"
"441","32.418689300","172.20.40.110","151.101.130.187","TLSv1.2","175","Ignored Unknown Record"
"442","32.418821100","172.20.40.110","151.101.130.187","TLSv1.2","93","Application Data"
"443","32.427756100","151.101.130.187","172.20.40.110","TCP","66","[TCP Dup ACK 2#1] 443  >  57648 [ACK] Seq=1 Ack=2 Win=281 Len=0 SLE=123 SRE=162"
"444","32.427756100","151.101.130.187","172.20.40.110","TCP","60","443  >  57648 [ACK] Seq=1 Ack=162 Win=281 Len=0"
"445","32.427756100","151.101.130.187","172.20.40.110","TLSv1.2","93","Application Data"
"446","32.428818800","151.101.130.187","172.20.40.110","TLSv1.2","266","Application Data"
"447","32.428899500","172.20.40.110","151.101.130.187","TCP","54","57648  >  443 [ACK] Seq=162 Ack=252 Win=253 Len=0"
"448","32.764752100","172.20.40.110","151.101.194.187","TLSv1.2","2892","Application Data"
"449","32.776734600","151.101.194.187","172.20.40.110","TCP","60","443  >  64055 [ACK] Seq=81912 Ack=288865 Win=1534 Len=0"
"450","32.777979700","151.101.194.187","172.20.40.110","TLSv1.2","428","Application Data"
"451","32.794935500","172.20.40.110","151.101.194.187","TLSv1.2","2893","Application Data"
"452","32.805832900","151.101.194.187","172.20.40.110","TCP","60","443  >  64055 [ACK] Seq=82286 Ack=291704 Win=1545 Len=0"
"453","32.808053000","151.101.194.187","172.20.40.110","TLSv1.2","130","Application Data"
"454","32.840518100","151.101.194.187","172.20.40.110","TCP","130","[TCP Retransmission] 443  >  64055 [PSH, ACK] Seq=82286 Ack=291704 Win=1545 Len=76"
"455","32.840572700","172.20.40.110","151.101.194.187","TCP","66","64055  >  443 [ACK] Seq=291704 Ack=82362 Win=508 Len=0 SLE=82286 SRE=82362"
"456","32.931936900","172.20.40.110","151.101.194.187","TLSv1.2","2882","Application Data"
"457","32.937880900","172.20.40.110","151.101.194.187","TLSv1.2","2876","Application Data"
"458","32.938139500","172.20.40.110","151.101.194.187","TLSv1.2","2877","Application Data"
"459","32.944599700","151.101.194.187","172.20.40.110","TCP","60","443  >  64055 [ACK] Seq=82362 Ack=294532 Win=1556 Len=0"
"460","32.945710500","151.101.194.187","172.20.40.110","TLSv1.2","130","Application Data"
"461","32.951218300","151.101.194.187","172.20.40.110","TCP","60","443  >  64055 [ACK] Seq=82438 Ack=297354 Win=1567 Len=0"
"462","32.951218300","151.101.194.187","172.20.40.110","TCP","60","443  >  64055 [ACK] Seq=82438 Ack=300177 Win=1578 Len=0"
"463","32.953685600","151.101.194.187","172.20.40.110","TLSv1.2","130","Application Data"
"464","32.953685600","151.101.194.187","172.20.40.110","TLSv1.2","131","Application Data"
"465","32.953811700","172.20.40.110","151.101.194.187","TCP","54","64055  >  443 [ACK] Seq=300177 Ack=82591 Win=507 Len=0"
"466","37.044424400","172.20.40.110","151.101.194.187","TLSv1.2","2892","Application Data"
"467","37.056946900","151.101.194.187","172.20.40.110","TCP","60","443  >  64055 [ACK] Seq=82591 Ack=303015 Win=1589 Len=0"
"468","37.066197900","151.101.194.187","172.20.40.110","TLSv1.2","214","Application Data"
"469","37.091381000","151.101.194.187","172.20.40.110","TCP","214","[TCP Retransmission] 443  >  64055 [PSH, ACK] Seq=82591 Ack=303015 Win=1589 Len=160"
"470","37.091481900","172.20.40.110","151.101.194.187","TCP","66","64055  >  443 [ACK] Seq=303015 Ack=82751 Win=507 Len=0 SLE=82591 SRE=82751"
"471","37.097569800","172.20.40.110","151.101.194.187","TLSv1.2","2893","Application Data"
"472","37.107517500","151.101.194.187","172.20.40.110","TCP","60","443  >  64055 [ACK] Seq=82751 Ack=305854 Win=1600 Len=0"
"473","37.110818800","151.101.194.187","172.20.40.110","TLSv1.2","103","Application Data"
"474","37.142188400","151.101.194.187","172.20.40.110","TCP","103","[TCP Retransmission] 443  >  64055 [PSH, ACK] Seq=82751 Ack=305854 Win=1600 Len=49"
"475","37.142302300","172.20.40.110","151.101.194.187","TCP","66","64055  >  443 [ACK] Seq=305854 Ack=82800 Win=507 Len=0 SLE=82751 SRE=82800"
"476","39.308402600","172.20.40.110","151.101.194.187","TLSv1.2","2892","Application Data"
"477","39.320647600","151.101.194.187","172.20.40.110","TCP","60","443  >  64055 [ACK] Seq=82800 Ack=308692 Win=1611 Len=0"
"478","39.322060200","151.101.194.187","172.20.40.110","TLSv1.2","214","Application Data"
"479","39.354535100","151.101.194.187","172.20.40.110","TCP","214","[TCP Retransmission] 443  >  64055 [PSH, ACK] Seq=82800 Ack=308692 Win=1611 Len=160"
"480","39.354604000","172.20.40.110","151.101.194.187","TCP","66","64055  >  443 [ACK] Seq=308692 Ack=82960 Win=512 Len=0 SLE=82800 SRE=82960"
"481","39.374511200","172.20.40.110","151.101.194.187","TLSv1.2","2890","Application Data"
"482","39.383505700","151.101.194.187","172.20.40.110","TCP","60","443  >  64055 [ACK] Seq=82960 Ack=311528 Win=1622 Len=0"
"483","39.387780200","151.101.194.187","172.20.40.110","TLSv1.2","130","Application Data"
"484","39.419209300","151.101.194.187","172.20.40.110","TCP","130","[TCP Retransmission] 443  >  64055 [PSH, ACK] Seq=82960 Ack=311528 Win=1622 Len=76"
"485","39.419260400","172.20.40.110","151.101.194.187","TCP","66","64055  >  443 [ACK] Seq=311528 Ack=83036 Win=511 Len=0 SLE=82960 SRE=83036"
"486","40.356945600","172.20.40.110","151.101.194.187","TLSv1.2","2893","Application Data"
"487","40.372338100","151.101.194.187","172.20.40.110","TCP","60","443  >  64055 [ACK] Seq=83036 Ack=314367 Win=1633 Len=0"
"488","40.372338100","151.101.194.187","172.20.40.110","TLSv1.2","213","Application Data"
"489","40.403509200","151.101.194.187","172.20.40.110","TCP","213","[TCP Retransmission] 443  >  64055 [PSH, ACK] Seq=83036 Ack=314367 Win=1633 Len=159"
"490","40.403560800","172.20.40.110","151.101.194.187","TCP","66","64055  >  443 [ACK] Seq=314367 Ack=83195 Win=511 Len=0 SLE=83036 SRE=83195"
"491","40.449370700","172.20.40.110","151.101.194.187","TLSv1.2","2892","Application Data"
"492","40.464983100","151.101.194.187","172.20.40.110","TCP","60","443  >  64055 [ACK] Seq=83195 Ack=317205 Win=1644 Len=0"
"493","40.466366700","151.101.194.187","172.20.40.110","TLSv1.2","130","Application Data"
"494","40.501436600","151.101.194.187","172.20.40.110","TCP","130","[TCP Retransmission] 443  >  64055 [PSH, ACK] Seq=83195 Ack=317205 Win=1644 Len=76"
"495","40.501506500","172.20.40.110","151.101.194.187","TCP","66","64055  >  443 [ACK] Seq=317205 Ack=83271 Win=510 Len=0 SLE=83195 SRE=83271"
"496","47.073496100","172.20.40.110","151.101.194.187","TLSv1.2","2886","Application Data"
"497","47.085458000","151.101.194.187","172.20.40.110","TCP","60","443  >  64055 [ACK] Seq=83271 Ack=320037 Win=1655 Len=0"
"498","47.088733300","151.101.194.187","172.20.40.110","TLSv1.2","451","Application Data"
"499","47.118746800","151.101.194.187","172.20.40.110","TCP","451","[TCP Retransmission] 443  >  64055 [PSH, ACK] Seq=83271 Ack=320037 Win=1655 Len=397"
"500","47.118811600","172.20.40.110","151.101.194.187","TCP","66","64055  >  443 [ACK] Seq=320037 Ack=83668 Win=509 Len=0 SLE=83271 SRE=83668"
"501","47.336372900","172.20.40.110","151.101.194.187","TLSv1.2","2905","Application Data"
"502","47.349440100","151.101.194.187","172.20.40.110","TCP","60","443  >  64055 [ACK] Seq=83668 Ack=322888 Win=1666 Len=0"
"503","47.351991400","151.101.194.187","172.20.40.110","TLSv1.2","240","Application Data"
"504","47.372065000","172.20.40.110","151.101.194.187","TLSv1.2","2890","Application Data"
"505","47.372335700","172.20.40.110","151.101.194.187","TLSv1.2","2896","Application Data"
"506","47.375702300","172.20.40.110","151.101.194.187","TLSv1.2","2890","Application Data"
"507","47.381322100","151.101.194.187","172.20.40.110","TCP","60","443  >  64055 [ACK] Seq=83854 Ack=325724 Win=1678 Len=0"
"508","47.383761700","151.101.194.187","172.20.40.110","TCP","60","443  >  64055 [ACK] Seq=83854 Ack=328566 Win=1689 Len=0"
"509","47.386050500","151.101.194.187","172.20.40.110","TLSv1.2","131","Application Data"
"510","47.386050500","151.101.194.187","172.20.40.110","TCP","60","443  >  64055 [ACK] Seq=83931 Ack=331402 Win=1700 Len=0"
"511","47.387061000","151.101.194.187","172.20.40.110","TLSv1.2","130","Application Data"
"512","47.387160200","172.20.40.110","151.101.194.187","TCP","54","64055  >  443 [ACK] Seq=331402 Ack=84007 Win=508 Len=0"
"513","47.389227500","151.101.194.187","172.20.40.110","TLSv1.2","130","Application Data"
"514","47.424221200","172.20.40.110","151.101.194.187","TLSv1.2","2890","Application Data"
"515","47.430121500","151.101.194.187","172.20.40.110","TCP","130","[TCP Spurious Retransmission] 443  >  64055 [PSH, ACK] Seq=84007 Ack=331402 Win=1700 Len=76"
"516","47.430230800","172.20.40.110","151.101.194.187","TCP","66","[TCP Dup ACK 514#1] 64055  >  443 [ACK] Seq=334238 Ack=84083 Win=507 Len=0 SLE=84007 SRE=84083"
"517","47.434915200","151.101.194.187","172.20.40.110","TCP","60","443  >  64055 [ACK] Seq=84083 Ack=334238 Win=1711 Len=0"
"518","47.435987200","151.101.194.187","172.20.40.110","TLSv1.2","130","Application Data"
"519","47.472160000","151.101.194.187","172.20.40.110","TCP","130","[TCP Retransmission] 443  >  64055 [PSH, ACK] Seq=84083 Ack=334238 Win=1711 Len=76"
"520","47.472213700","172.20.40.110","151.101.194.187","TCP","66","64055  >  443 [ACK] Seq=334238 Ack=84159 Win=507 Len=0 SLE=84083 SRE=84159"
"521","47.475060600","172.20.40.110","151.101.194.187","TLSv1.2","2902","Application Data"
"522","47.483804500","151.101.194.187","172.20.40.110","TCP","60","443  >  64055 [ACK] Seq=84159 Ack=337086 Win=1722 Len=0"
"523","47.487052100","151.101.194.187","172.20.40.110","TLSv1.2","103","Application Data"
"524","47.498190400","172.20.40.110","151.101.194.187","TLSv1.2","2904","Application Data"
"525","47.507306500","151.101.194.187","172.20.40.110","TCP","60","443  >  64055 [ACK] Seq=84208 Ack=339936 Win=1733 Len=0"
"526","47.510485800","151.101.194.187","172.20.40.110","TLSv1.2","131","Application Data"
"527","47.545693200","151.101.194.187","172.20.40.110","TCP","131","[TCP Retransmission] 443  >  64055 [PSH, ACK] Seq=84208 Ack=339936 Win=1733 Len=77"
"528","47.545759300","172.20.40.110","151.101.194.187","TCP","66","64055  >  443 [ACK] Seq=339936 Ack=84285 Win=506 Len=0 SLE=84208 SRE=84285"
"529","47.591297900","172.20.40.110","151.101.194.187","TLSv1.2","2887","Application Data"
"530","47.597735600","172.20.40.110","151.101.194.187","TLSv1.2","2904","Application Data"
"531","47.603187400","151.101.194.187","172.20.40.110","TCP","60","443  >  64055 [ACK] Seq=84285 Ack=342769 Win=1744 Len=0"
"532","47.603187400","151.101.194.187","172.20.40.110","TLSv1.2","131","Application Data"
"533","47.603308500","172.20.40.110","151.101.194.187","TCP","54","64055  >  443 [ACK] Seq=345619 Ack=84362 Win=512 Len=0"
"534","47.607811900","151.101.194.187","172.20.40.110","TCP","60","443  >  64055 [ACK] Seq=84362 Ack=345619 Win=1755 Len=0"
"535","47.610049100","151.101.194.187","172.20.40.110","TLSv1.2","130","Application Data"
"536","47.610139900","172.20.40.110","151.101.194.187","TCP","54","64055  >  443 [ACK] Seq=345619 Ack=84438 Win=511 Len=0"
"537","47.928131200","172.20.40.110","151.101.194.187","TLSv1.2","2890","Application Data"
"538","47.940396400","151.101.194.187","172.20.40.110","TCP","60","443  >  64055 [ACK] Seq=84438 Ack=348455 Win=1766 Len=0"
"539","47.956142600","151.101.194.187","172.20.40.110","TLSv1.2","130","Application Data"
"540","47.988450400","151.101.194.187","172.20.40.110","TCP","130","[TCP Retransmission] 443  >  64055 [PSH, ACK] Seq=84438 Ack=348455 Win=1766 Len=76"
"541","47.988603600","172.20.40.110","151.101.194.187","TCP","66","64055  >  443 [ACK] Seq=348455 Ack=84514 Win=511 Len=0 SLE=84438 SRE=84514"
"542","48.164631200","172.20.40.110","151.101.194.187","TLSv1.2","2896","Application Data"
"543","48.172965300","172.20.40.110","151.101.194.187","TLSv1.2","2894","Application Data"
"544","48.173234600","172.20.40.110","151.101.194.187","TLSv1.2","2885","Application Data"
"545","48.173386300","172.20.40.110","151.101.194.187","TLSv1.2","2889","Application Data"
"546","48.173554900","172.20.40.110","151.101.194.187","TLSv1.2","2891","Application Data"
"547","48.173701400","172.20.40.110","151.101.194.187","TLSv1.2","2887","Application Data"
"548","48.174580800","172.20.40.110","151.101.194.187","TLSv1.2","2890","Application Data"
"549","48.186373900","151.101.194.187","172.20.40.110","TCP","60","443  >  64055 [ACK] Seq=84514 Ack=351297 Win=1777 Len=0"
"550","48.187105800","151.101.194.187","172.20.40.110","TLSv1.2","450","Application Data"
"551","48.187105800","151.101.194.187","172.20.40.110","TCP","60","443  >  64055 [ACK] Seq=84910 Ack=354137 Win=1789 Len=0"
"552","48.188389500","151.101.194.187","172.20.40.110","TCP","60","443  >  64055 [ACK] Seq=84910 Ack=356968 Win=1800 Len=0"
"553","48.188389500","151.101.194.187","172.20.40.110","TCP","60","443  >  64055 [ACK] Seq=84910 Ack=359803 Win=1811 Len=0"
"554","48.189737900","151.101.194.187","172.20.40.110","TLSv1.2","131","Application Data"
"555","48.189870900","172.20.40.110","151.101.194.187","TCP","54","64055  >  443 [ACK] Seq=368309 Ack=84987 Win=509 Len=0"
"556","48.193641000","151.101.194.187","172.20.40.110","TCP","60","443  >  64055 [ACK] Seq=84987 Ack=362640 Win=1822 Len=0"
"557","48.193641000","151.101.194.187","172.20.40.110","TCP","60","443  >  64055 [ACK] Seq=84987 Ack=365473 Win=1833 Len=0"
"558","48.193641000","151.101.194.187","172.20.40.110","TCP","60","443  >  64055 [ACK] Seq=84987 Ack=368309 Win=1844 Len=0"
"559","48.196048500","151.101.194.187","172.20.40.110","TLSv1.2","130","Application Data"
"560","48.197148600","151.101.194.187","172.20.40.110","TLSv1.2","130","Application Data"
"561","48.197232000","172.20.40.110","151.101.194.187","TCP","54","64055  >  443 [ACK] Seq=368309 Ack=85139 Win=509 Len=0"
"562","48.199635600","151.101.194.187","172.20.40.110","TLSv1.2","129","Application Data"
"563","48.199635600","151.101.194.187","172.20.40.110","TLSv1.2","130","Application Data"
"564","48.199718900","172.20.40.110","151.101.194.187","TCP","54","64055  >  443 [ACK] Seq=368309 Ack=85290 Win=508 Len=0"
"565","48.202760900","151.101.194.187","172.20.40.110","TLSv1.2","124","Application Data"
"566","48.238914700","151.101.194.187","172.20.40.110","TCP","124","[TCP Retransmission] 443  >  64055 [PSH, ACK] Seq=85290 Ack=368309 Win=1844 Len=70"
"567","48.239010200","172.20.40.110","151.101.194.187","TCP","66","64055  >  443 [ACK] Seq=368309 Ack=85360 Win=508 Len=0 SLE=85290 SRE=85360"
"568","48.469964000","172.20.40.110","151.101.194.187","TLSv1.2","2904","Application Data"
"569","48.480400300","151.101.194.187","172.20.40.110","TCP","60","443  >  64055 [ACK] Seq=85360 Ack=371159 Win=1855 Len=0"
"570","48.487262600","172.20.40.110","151.101.194.187","TLSv1.2","2905","Application Data"
"571","48.490658000","151.101.194.187","172.20.40.110","TLSv1.2","104","Application Data"
"572","48.496400100","151.101.194.187","172.20.40.110","TCP","60","443  >  64055 [ACK] Seq=85410 Ack=374010 Win=1867 Len=0"
"573","48.504051400","151.101.194.187","172.20.40.110","TLSv1.2","130","Application Data"
"574","48.504266700","172.20.40.110","151.101.194.187","TCP","54","64055  >  443 [ACK] Seq=374010 Ack=85486 Win=507 Len=0"
"575","56.824497700","172.20.40.110","151.101.194.187","TLSv1.2","2904","Application Data"
"576","56.831177200","172.20.40.110","151.101.194.187","TLSv1.2","2902","Application Data"
"577","56.839889600","151.101.194.187","172.20.40.110","TCP","60","443  >  64055 [ACK] Seq=85486 Ack=376860 Win=1878 Len=0"
"578","56.844569800","151.101.194.187","172.20.40.110","TLSv1.2","241","Application Data"
"579","56.844569800","151.101.194.187","172.20.40.110","TCP","60","443  >  64055 [ACK] Seq=85673 Ack=379708 Win=1889 Len=0"
"580","56.848774200","151.101.194.187","172.20.40.110","TLSv1.2","130","Application Data"
"581","56.848866100","172.20.40.110","151.101.194.187","TCP","54","64055  >  443 [ACK] Seq=379708 Ack=85749 Win=512 Len=0"
"582","56.902722500","172.20.40.110","151.101.194.187","TLSv1.2","2905","Application Data"
"583","56.911994700","151.101.194.187","172.20.40.110","TCP","60","443  >  64055 [ACK] Seq=85749 Ack=382559 Win=1900 Len=0"
"584","56.915476000","151.101.194.187","172.20.40.110","TLSv1.2","103","Application Data"
"585","56.948905100","151.101.194.187","172.20.40.110","TCP","103","[TCP Retransmission] 443  >  64055 [PSH, ACK] Seq=85749 Ack=382559 Win=1900 Len=49"
"586","56.948963100","172.20.40.110","151.101.194.187","TCP","66","64055  >  443 [ACK] Seq=382559 Ack=85798 Win=511 Len=0 SLE=85749 SRE=85798"
"587","57.026017300","172.20.40.110","151.101.194.187","TLSv1.2","2902","Application Data"
"588","57.035006800","151.101.194.187","172.20.40.110","TCP","60","443  >  64055 [ACK] Seq=85798 Ack=385407 Win=1911 Len=0"
"589","57.042386800","151.101.194.187","172.20.40.110","TLSv1.2","179","Application Data"
"590","57.076179800","151.101.194.187","172.20.40.110","TCP","179","[TCP Retransmission] 443  >  64055 [PSH, ACK] Seq=85798 Ack=385407 Win=1911 Len=125"
"591","57.076274500","172.20.40.110","151.101.194.187","TCP","66","64055  >  443 [ACK] Seq=385407 Ack=85923 Win=511 Len=0 SLE=85798 SRE=85923"
"592","57.113144600","172.20.40.110","151.101.194.187","TLSv1.2","2904","Application Data"
"593","57.116534900","172.20.40.110","151.101.194.187","TLSv1.2","2902","Application Data"
"594","57.125819600","151.101.194.187","172.20.40.110","TCP","60","443  >  64055 [ACK] Seq=85923 Ack=388257 Win=1922 Len=0"
"595","57.128186100","151.101.194.187","172.20.40.110","TLSv1.2","98","Application Data"
"596","57.133477300","151.101.194.187","172.20.40.110","TCP","60","443  >  64055 [ACK] Seq=85967 Ack=391105 Win=1934 Len=0"
"597","57.136715600","151.101.194.187","172.20.40.110","TLSv1.2","98","Application Data"
"598","57.136798500","172.20.40.110","151.101.194.187","TCP","54","64055  >  443 [ACK] Seq=391105 Ack=86011 Win=511 Len=0"
"599","57.163207200","172.20.40.110","151.101.194.187","TLSv1.2","2905","Application Data"
"600","57.180007900","151.101.194.187","172.20.40.110","TCP","60","443  >  64055 [ACK] Seq=86011 Ack=393956 Win=1945 Len=0"
"601","57.183357100","151.101.194.187","172.20.40.110","TLSv1.2","369","Application Data"
"602","57.217657400","151.101.194.187","172.20.40.110","TCP","369","[TCP Retransmission] 443  >  64055 [PSH, ACK] Seq=86011 Ack=393956 Win=1945 Len=315"
"603","57.217740900","172.20.40.110","151.101.194.187","TCP","66","64055  >  443 [ACK] Seq=393956 Ack=86326 Win=509 Len=0 SLE=86011 SRE=86326"
