No.,Time,Source,Destination,Protocol,Length,Info
1,0.0,100.84.170.161,151.101.66.187,TLSv1.2,1695,Application Data
2,0.0001664,100.84.170.161,151.101.66.187,TLSv1.2,93,Application Data
3,0.010243,151.101.66.187,100.84.170.161,TCP,56,443  >  59747 [ACK] Seq=1 Ack=1681 Win=4940 Len=0
4,0.0107784,151.101.66.187,100.84.170.161,TLSv1.2,93,Application Data
5,0.0138118,151.101.66.187,100.84.170.161,TLSv1.2,246,Application Data
6,0.0139172,100.84.170.161,151.101.66.187,TCP,54,59747  >  443 [ACK] Seq=1681 Ack=232 Win=4101 Len=0
7,9.5003528,100.84.170.161,151.101.66.187,TLSv1.2,1000,Application Data
8,9.502248,100.84.170.161,151.101.66.187,TLSv1.2,1688,Application Data
9,9.5149795,151.101.66.187,100.84.170.161,TCP,56,443  >  59747 [ACK] Seq=232 Ack=2627 Win=4940 Len=0
10,9.5149795,151.101.66.187,100.84.170.161,TLSv1.2,337,Application Data
11,9.5186325,151.101.66.187,100.84.170.161,TCP,56,443  >  59747 [ACK] Seq=515 Ack=4261 Win=4940 Len=0
12,9.5230375,151.101.66.187,100.84.170.161,TLSv1.2,125,Application Data
13,9.5231608,100.84.170.161,151.101.66.187,TCP,54,59747  >  443 [ACK] Seq=4261 Ack=586 Win=4106 Len=0
14,9.5791038,100.84.170.161,151.101.66.187,TLSv1.2,1058,Application Data
15,9.5794737,100.84.170.161,151.101.66.187,TLSv1.2,1646,Application Data
16,9.5877354,151.101.66.187,100.84.170.161,TCP,56,443  >  59747 [ACK] Seq=586 Ack=5265 Win=4945 Len=0
17,9.5882776,151.101.66.187,100.84.170.161,TCP,56,443  >  59747 [ACK] Seq=586 Ack=6857 Win=4945 Len=0
18,9.5911984,151.101.66.187,100.84.170.161,TLSv1.2,130,Application Data
19,9.5920707,151.101.66.187,100.84.170.161,TLSv1.2,124,Application Data
20,9.5921286,100.84.170.161,151.101.66.187,TCP,54,59747  >  443 [ACK] Seq=6857 Ack=732 Win=4105 Len=0
21,12.9429952,100.84.170.161,151.101.66.187,TLSv1.2,1076,Application Data
22,12.9537997,151.101.66.187,100.84.170.161,TCP,56,443  >  59747 [ACK] Seq=732 Ack=7879 Win=4951 Len=0
23,13.628023,151.101.66.187,100.84.170.161,TCP,5878,443  >  59747 [ACK] Seq=732 Ack=7879 Win=4951 Len=5824 [TCP PDU reassembled in 24]
24,13.628023,151.101.66.187,100.84.170.161,TLSv1.2,1074,Application Data
25,13.628023,151.101.66.187,100.84.170.161,TLSv1.2,52470,"Application Data, Application Data, Application Data"
26,13.628023,151.101.66.187,100.84.170.161,TLSv1.2,674,Application Data
27,13.628023,151.101.66.187,100.84.170.161,TCP,674,"[TCP Retransmission] 443  >  59747 [PSH, ACK] Seq=59992 Ack=7879 Win=4951 Len=620 [TCP PDU reassembled in 26]"
28,13.628214,100.84.170.161,151.101.66.187,TCP,66,59747  >  443 [ACK] Seq=7879 Ack=60612 Win=4106 Len=0 SLE=59992 SRE=60612
29,13.6305275,100.84.170.161,151.101.66.187,TLSv1.2,89,Application Data
30,13.6402011,151.101.66.187,100.84.170.161,TCP,56,443  >  59747 [ACK] Seq=60612 Ack=7914 Win=4951 Len=0
31,14.273315,100.84.170.161,151.101.66.187,TLSv1.2,1824,Application Data
32,14.2735865,100.84.170.161,151.101.66.187,TLSv1.2,937,Application Data
33,14.2737799,100.84.170.161,151.101.66.187,TLSv1.2,1821,Application Data
34,14.2833129,151.101.66.187,100.84.170.161,TCP,56,443  >  59747 [ACK] Seq=60612 Ack=12334 Win=4951 Len=0
35,14.2871176,151.101.66.187,100.84.170.161,TLSv1.2,241,Application Data
36,14.2874802,151.101.66.187,100.84.170.161,TLSv1.2,212,Application Data
37,14.2875218,100.84.170.161,151.101.66.187,TCP,54,59747  >  443 [ACK] Seq=12334 Ack=60957 Win=4104 Len=0
38,14.2877996,151.101.66.187,100.84.170.161,TLSv1.2,135,Application Data
39,14.3236371,151.101.66.187,100.84.170.161,TCP,135,"[TCP Retransmission] 443  >  59747 [PSH, ACK] Seq=60957 Ack=12334 Win=4951 Len=81"
40,14.3236889,100.84.170.161,151.101.66.187,TCP,66,59747  >  443 [ACK] Seq=12334 Ack=61038 Win=4104 Len=0 SLE=60957 SRE=61038
41,14.3624171,100.84.170.161,151.101.66.187,TLSv1.2,934,Application Data
42,14.3715349,151.101.66.187,100.84.170.161,TCP,56,443  >  59747 [ACK] Seq=61038 Ack=13214 Win=4951 Len=0
43,14.3738303,151.101.66.187,100.84.170.161,TLSv1.2,130,Application Data
44,14.4002487,151.101.66.187,100.84.170.161,TCP,130,"[TCP Retransmission] 443  >  59747 [PSH, ACK] Seq=61038 Ack=13214 Win=4951 Len=76"
45,14.4003002,100.84.170.161,151.101.66.187,TCP,66,59747  >  443 [ACK] Seq=13214 Ack=61114 Win=4104 Len=0 SLE=61038 SRE=61114
46,14.4529341,100.84.170.161,151.101.66.187,TLSv1.2,1850,Application Data
47,14.4616953,151.101.66.187,100.84.170.161,TCP,56,443  >  59747 [ACK] Seq=61114 Ack=15010 Win=4951 Len=0
48,14.465927,151.101.66.187,100.84.170.161,TLSv1.2,124,Application Data
49,14.4917124,151.101.66.187,100.84.170.161,TCP,124,"[TCP Retransmission] 443  >  59747 [PSH, ACK] Seq=61114 Ack=15010 Win=4951 Len=70"
50,14.4917436,100.84.170.161,151.101.66.187,TCP,66,59747  >  443 [ACK] Seq=15010 Ack=61184 Win=4104 Len=0 SLE=61114 SRE=61184
51,14.5140913,100.84.170.161,151.101.66.187,TLSv1.2,951,Application Data
52,14.5226391,151.101.66.187,100.84.170.161,TCP,56,443  >  59747 [ACK] Seq=61184 Ack=15907 Win=4951 Len=0
53,14.5254102,151.101.66.187,100.84.170.161,TLSv1.2,248,Application Data
54,14.5511526,151.101.66.187,100.84.170.161,TCP,248,"[TCP Retransmission] 443  >  59747 [PSH, ACK] Seq=61184 Ack=15907 Win=4951 Len=194"
55,14.5511857,100.84.170.161,151.101.66.187,TCP,66,59747  >  443 [ACK] Seq=15907 Ack=61378 Win=4103 Len=0 SLE=61184 SRE=61378
56,14.6158654,100.84.170.161,151.101.66.187,TLSv1.2,1807,Application Data
57,14.6246935,151.101.66.187,100.84.170.161,TCP,56,443  >  59747 [ACK] Seq=61378 Ack=17660 Win=4951 Len=0
58,14.6291028,151.101.66.187,100.84.170.161,TLSv1.2,125,Application Data
59,14.6561279,151.101.66.187,100.84.170.161,TCP,125,"[TCP Retransmission] 443  >  59747 [PSH, ACK] Seq=61378 Ack=17660 Win=4951 Len=71"
60,14.6561773,100.84.170.161,151.101.66.187,TCP,66,59747  >  443 [ACK] Seq=17660 Ack=61449 Win=4102 Len=0 SLE=61378 SRE=61449
61,14.7552532,100.84.170.161,151.101.66.187,TLSv1.2,958,Application Data
62,14.7556354,100.84.170.161,151.101.66.187,TLSv1.2,1828,Application Data
63,14.764184,151.101.66.187,100.84.170.161,TCP,56,443  >  59747 [ACK] Seq=61449 Ack=18564 Win=4951 Len=0
64,14.764703,151.101.66.187,100.84.170.161,TCP,56,443  >  59747 [ACK] Seq=61449 Ack=20338 Win=4951 Len=0
65,14.7694995,151.101.66.187,100.84.170.161,TLSv1.2,131,Application Data
66,14.7717966,151.101.66.187,100.84.170.161,TLSv1.2,130,Application Data
67,14.7719218,100.84.170.161,151.101.66.187,TCP,54,59747  >  443 [ACK] Seq=20338 Ack=61602 Win=4102 Len=0
68,16.6225673,100.84.170.161,151.101.66.187,TLSv1.2,890,Application Data
69,16.6330943,151.101.66.187,100.84.170.161,TCP,56,443  >  59747 [ACK] Seq=61602 Ack=21174 Win=4951 Len=0
70,16.635533,151.101.66.187,100.84.170.161,TCP,1510,443  >  59747 [ACK] Seq=61602 Ack=21174 Win=4951 Len=1456 [TCP PDU reassembled in 71]
71,16.6359368,151.101.66.187,100.84.170.161,TLSv1.2,215,Application Data
72,16.6359757,100.84.170.161,151.101.66.187,TCP,54,59747  >  443 [ACK] Seq=21174 Ack=63219 Win=4106 Len=0
73,16.6692704,100.84.170.161,151.101.66.187,TLSv1.2,1846,Application Data
74,16.6694639,100.84.170.161,151.101.66.187,TLSv1.2,934,Application Data
75,16.6781143,151.101.66.187,100.84.170.161,TCP,56,443  >  59747 [ACK] Seq=63219 Ack=22966 Win=4951 Len=0
76,16.6784463,151.101.66.187,100.84.170.161,TCP,56,443  >  59747 [ACK] Seq=63219 Ack=23846 Win=4951 Len=0
77,16.6805851,151.101.66.187,100.84.170.161,TLSv1.2,130,Application Data
78,16.6805851,151.101.66.187,100.84.170.161,TLSv1.2,124,Application Data
79,16.6806449,100.84.170.161,151.101.66.187,TCP,54,59747  >  443 [ACK] Seq=23846 Ack=63365 Win=4105 Len=0
80,18.1244706,100.84.170.161,151.101.66.187,TLSv1.2,2001,Application Data
81,18.1260956,100.84.170.161,151.101.66.187,TLSv1.2,664,Application Data
82,18.1269538,100.84.170.161,151.101.66.187,TLSv1.2,1989,Application Data
83,18.1271287,100.84.170.161,151.101.66.187,TLSv1.2,654,Application Data
84,18.1272477,100.84.170.161,151.101.66.187,TLSv1.2,2002,Application Data
85,18.1282132,100.84.170.161,151.101.66.187,TLSv1.2,648,Application Data
86,18.1338873,151.101.66.187,100.84.170.161,TCP,56,443  >  59747 [ACK] Seq=63365 Ack=25793 Win=4959 Len=0
87,18.1357232,151.101.66.187,100.84.170.161,TCP,56,443  >  59747 [ACK] Seq=63365 Ack=26403 Win=4959 Len=0
88,18.1361225,151.101.66.187,100.84.170.161,TCP,56,443  >  59747 [ACK] Seq=63365 Ack=30886 Win=4966 Len=0
89,18.1367212,151.101.66.187,100.84.170.161,TCP,56,443  >  59747 [ACK] Seq=63365 Ack=31480 Win=4966 Len=0
90,18.1375161,151.101.66.187,100.84.170.161,TLSv1.2,214,Application Data
91,18.1392297,151.101.66.187,100.84.170.161,TLSv1.2,148,Application Data
92,18.1392916,100.84.170.161,151.101.66.187,TCP,54,59747  >  443 [ACK] Seq=31480 Ack=63619 Win=4104 Len=0
93,18.1400782,151.101.66.187,100.84.170.161,TLSv1.2,169,Application Data
94,18.1414675,151.101.66.187,100.84.170.161,TLSv1.2,157,Application Data
95,18.1415314,100.84.170.161,151.101.66.187,TCP,54,59747  >  443 [ACK] Seq=31480 Ack=63837 Win=4103 Len=0
96,18.1437556,151.101.66.187,100.84.170.161,TLSv1.2,124,Application Data
97,18.148712,100.84.170.161,151.101.66.187,TLSv1.2,2003,Application Data
98,18.1574322,151.101.66.187,100.84.170.161,TCP,56,443  >  59747 [ACK] Seq=63907 Ack=33429 Win=4974 Len=0
99,18.1607629,151.101.66.187,100.84.170.161,TLSv1.2,104,Application Data
100,18.1793819,100.84.170.161,151.101.66.187,TLSv1.2,648,Application Data
101,18.1861019,151.101.66.187,100.84.170.161,TCP,104,"[TCP Spurious Retransmission] 443  >  59747 [PSH, ACK] Seq=63907 Ack=33429 Win=4974 Len=50"
102,18.1861475,100.84.170.161,151.101.66.187,TCP,66,[TCP Dup ACK 100#1] 59747  >  443 [ACK] Seq=34023 Ack=63957 Win=4103 Len=0 SLE=63907 SRE=63957
103,18.1883464,151.101.66.187,100.84.170.161,TCP,56,443  >  59747 [ACK] Seq=63957 Ack=34023 Win=4974 Len=0
104,18.1911771,151.101.66.187,100.84.170.161,TLSv1.2,98,Application Data
105,18.2170112,151.101.66.187,100.84.170.161,TCP,98,"[TCP Retransmission] 443  >  59747 [PSH, ACK] Seq=63957 Ack=34023 Win=4974 Len=44"
106,18.2170873,100.84.170.161,151.101.66.187,TCP,66,59747  >  443 [ACK] Seq=34023 Ack=64001 Win=4103 Len=0 SLE=63957 SRE=64001
107,18.6408885,100.84.170.161,151.101.66.187,TLSv1.2,2103,Application Data
108,18.6506613,151.101.66.187,100.84.170.161,TCP,56,443  >  59747 [ACK] Seq=64001 Ack=36072 Win=4982 Len=0
109,18.6533237,151.101.66.187,100.84.170.161,TLSv1.2,358,Application Data
110,18.6781791,151.101.66.187,100.84.170.161,TCP,358,"[TCP Retransmission] 443  >  59747 [PSH, ACK] Seq=64001 Ack=36072 Win=4982 Len=304"
111,18.6782178,100.84.170.161,151.101.66.187,TCP,66,59747  >  443 [ACK] Seq=36072 Ack=64305 Win=4102 Len=0 SLE=64001 SRE=64305
112,19.1772902,100.84.170.161,151.101.66.187,TLSv1.2,540,Application Data
113,19.1774848,100.84.170.161,151.101.66.187,TLSv1.2,2110,Application Data
114,19.1874759,151.101.66.187,100.84.170.161,TCP,56,443  >  59747 [ACK] Seq=64305 Ack=38614 Win=4990 Len=0
115,19.1908414,151.101.66.187,100.84.170.161,TLSv1.2,131,Application Data
116,19.1912869,151.101.66.187,100.84.170.161,TLSv1.2,130,Application Data
117,19.1913312,100.84.170.161,151.101.66.187,TCP,54,59747  >  443 [ACK] Seq=38614 Ack=64458 Win=4101 Len=0
118,19.3459016,100.84.170.161,151.101.66.187,TLSv1.2,555,Application Data
119,19.3476122,100.84.170.161,151.101.66.187,TLSv1.2,2107,Application Data
120,19.3501168,100.84.170.161,151.101.66.187,TLSv1.2,550,Application Data
121,19.3545317,151.101.66.187,100.84.170.161,TCP,56,443  >  59747 [ACK] Seq=64458 Ack=39115 Win=4990 Len=0
122,19.3555389,100.84.170.161,151.101.66.187,TLSv1.2,2097,Application Data
123,19.3565962,151.101.66.187,100.84.170.161,TCP,56,443  >  59747 [ACK] Seq=64458 Ack=41168 Win=4998 Len=0
124,19.3570779,151.101.66.187,100.84.170.161,TLSv1.2,235,Application Data
125,19.3593172,151.101.66.187,100.84.170.161,TLSv1.2,129,Application Data
126,19.3593172,151.101.66.187,100.84.170.161,TCP,56,443  >  59747 [ACK] Seq=64714 Ack=41664 Win=4998 Len=0
127,19.3594792,100.84.170.161,151.101.66.187,TCP,54,59747  >  443 [ACK] Seq=43707 Ack=64714 Win=4106 Len=0
128,19.3611953,151.101.66.187,100.84.170.161,TLSv1.2,125,Application Data
129,19.3643809,151.101.66.187,100.84.170.161,TCP,56,443  >  59747 [ACK] Seq=64785 Ack=43707 Win=5006 Len=0
130,19.3674845,151.101.66.187,100.84.170.161,TLSv1.2,130,Application Data
131,19.3675352,100.84.170.161,151.101.66.187,TCP,54,59747  >  443 [ACK] Seq=43707 Ack=64861 Win=4105 Len=0
132,19.512678,100.84.170.161,151.101.66.187,TLSv1.2,494,Application Data
133,19.5217821,151.101.66.187,100.84.170.161,TCP,56,443  >  59747 [ACK] Seq=64861 Ack=44147 Win=5006 Len=0
134,19.5246223,151.101.66.187,100.84.170.161,TLSv1.2,217,Application Data
135,19.5246223,151.101.66.187,100.84.170.161,TLSv1.2,375,Application Data
136,19.5246786,100.84.170.161,151.101.66.187,TCP,54,59747  >  443 [ACK] Seq=44147 Ack=65345 Win=4103 Len=0
137,19.5277656,100.84.170.161,151.101.66.187,TLSv1.2,89,Application Data
138,19.5368549,151.101.66.187,100.84.170.161,TCP,56,443  >  59747 [ACK] Seq=65345 Ack=44182 Win=5006 Len=0
139,24.047507,100.84.170.161,151.101.66.187,TLSv1.2,2023,Application Data
140,24.0751882,100.84.170.161,151.101.66.187,TCP,1514,"[TCP Retransmission] 59747  >  443 [PSH, ACK] Seq=44691 Ack=65345 Win=4103 Len=1460"
141,24.1137067,151.101.66.187,100.84.170.161,TCP,56,443  >  59747 [ACK] Seq=65345 Ack=46151 Win=5014 Len=0
142,24.1364037,151.101.66.187,100.84.170.161,TCP,66,[TCP Dup ACK 141#1] 443  >  59747 [ACK] Seq=65345 Ack=46151 Win=5014 Len=0 SLE=44691 SRE=46151
143,24.152607,151.101.66.187,100.84.170.161,TLSv1.2,652,Application Data
144,24.177815,151.101.66.187,100.84.170.161,TCP,652,"[TCP Retransmission] 443  >  59747 [PSH, ACK] Seq=65345 Ack=46151 Win=5014 Len=598"
145,24.1778851,100.84.170.161,151.101.66.187,TCP,66,59747  >  443 [ACK] Seq=46151 Ack=65943 Win=4101 Len=0 SLE=65345 SRE=65943
146,24.229536,100.84.170.161,151.101.66.187,TLSv1.2,619,Application Data
147,24.2305381,100.84.170.161,151.101.66.187,TLSv1.2,1998,Application Data
148,24.2384249,151.101.66.187,100.84.170.161,TCP,56,443  >  59747 [ACK] Seq=65943 Ack=46716 Win=5014 Len=0
149,24.2391435,151.101.66.187,100.84.170.161,TCP,56,443  >  59747 [ACK] Seq=65943 Ack=48660 Win=5014 Len=0
150,24.2408127,151.101.66.187,100.84.170.161,TLSv1.2,238,Application Data
151,24.2412833,151.101.66.187,100.84.170.161,TLSv1.2,98,Application Data
152,24.2413128,100.84.170.161,151.101.66.187,TCP,54,59747  >  443 [ACK] Seq=48660 Ack=66171 Win=4100 Len=0
153,24.4609359,100.84.170.161,151.101.66.187,TLSv1.2,633,Application Data
154,24.4700421,151.101.66.187,100.84.170.161,TCP,56,443  >  59747 [ACK] Seq=66171 Ack=49239 Win=5014 Len=0
155,24.4725798,151.101.66.187,100.84.170.161,TLSv1.2,235,Application Data
156,24.4982283,151.101.66.187,100.84.170.161,TCP,235,"[TCP Retransmission] 443  >  59747 [PSH, ACK] Seq=66171 Ack=49239 Win=5014 Len=181"
157,24.49829,100.84.170.161,151.101.66.187,TCP,66,59747  >  443 [ACK] Seq=49239 Ack=66352 Win=4106 Len=0 SLE=66171 SRE=66352
158,24.7708488,100.84.170.161,151.101.66.187,TLSv1.2,2020,Application Data
159,24.7818279,151.101.66.187,100.84.170.161,TCP,56,443  >  59747 [ACK] Seq=66352 Ack=51205 Win=5021 Len=0
160,24.7863963,151.101.66.187,100.84.170.161,TLSv1.2,130,Application Data
161,24.8109035,151.101.66.187,100.84.170.161,TCP,130,"[TCP Retransmission] 443  >  59747 [PSH, ACK] Seq=66352 Ack=51205 Win=5021 Len=76"
162,24.8109835,100.84.170.161,151.101.66.187,TCP,66,59747  >  443 [ACK] Seq=51205 Ack=66428 Win=4105 Len=0 SLE=66352 SRE=66428
163,24.8552618,100.84.170.161,151.101.66.187,TLSv1.2,618,Application Data
164,24.8638253,151.101.66.187,100.84.170.161,TCP,56,443  >  59747 [ACK] Seq=66428 Ack=51769 Win=5021 Len=0
165,24.8663689,151.101.66.187,100.84.170.161,TLSv1.2,124,Application Data
166,24.8909699,151.101.66.187,100.84.170.161,TCP,124,"[TCP Retransmission] 443  >  59747 [PSH, ACK] Seq=66428 Ack=51769 Win=5021 Len=70"
167,24.8910095,100.84.170.161,151.101.66.187,TCP,66,59747  >  443 [ACK] Seq=51769 Ack=66498 Win=4105 Len=0 SLE=66428 SRE=66498
168,26.9179445,100.84.170.161,151.101.66.187,TCP,55,55359  >  443 [ACK] Seq=1 Ack=1 Win=512 Len=1 [TCP PDU reassembled in 295]
169,26.9280021,151.101.66.187,100.84.170.161,TCP,66,443  >  55359 [ACK] Seq=1 Ack=2 Win=281 Len=0 SLE=1 SRE=2
170,29.3488991,100.84.170.161,151.101.66.187,TLSv1.2,2082,Application Data
171,29.3576566,151.101.66.187,100.84.170.161,TCP,56,443  >  59747 [ACK] Seq=66498 Ack=53797 Win=5029 Len=0
172,29.363095,151.101.66.187,100.84.170.161,TLSv1.2,241,Application Data
173,29.3889925,151.101.66.187,100.84.170.161,TCP,241,"[TCP Retransmission] 443  >  59747 [PSH, ACK] Seq=66498 Ack=53797 Win=5029 Len=187"
174,29.3890298,100.84.170.161,151.101.66.187,TCP,66,59747  >  443 [ACK] Seq=53797 Ack=66685 Win=4104 Len=0 SLE=66498 SRE=66685
175,30.0115623,100.84.170.161,151.101.66.187,TLSv1.2,781,Application Data
176,30.0201907,151.101.66.187,100.84.170.161,TCP,56,443  >  59747 [ACK] Seq=66685 Ack=54524 Win=5029 Len=0
177,30.023747,151.101.66.187,100.84.170.161,TLSv1.2,104,Application Data
178,30.0295786,100.84.170.161,151.101.66.187,TLSv1.2,1886,Application Data
179,30.0301602,100.84.170.161,151.101.66.187,TLSv1.2,793,Application Data
180,30.0358474,100.84.170.161,151.101.66.187,TLSv1.2,1880,Application Data
181,30.0383456,151.101.66.187,100.84.170.161,TCP,56,443  >  59747 [ACK] Seq=66735 Ack=56356 Win=5029 Len=0
182,30.0385799,151.101.66.187,100.84.170.161,TCP,56,443  >  59747 [ACK] Seq=66735 Ack=57095 Win=5029 Len=0
183,30.0413819,151.101.66.187,100.84.170.161,TLSv1.2,131,Application Data
184,30.041595,151.101.66.187,100.84.170.161,TLSv1.2,124,Application Data
185,30.0416282,100.84.170.161,151.101.66.187,TCP,54,59747  >  443 [ACK] Seq=58921 Ack=66882 Win=4104 Len=0
186,30.0444825,151.101.66.187,100.84.170.161,TCP,56,443  >  59747 [ACK] Seq=66882 Ack=58921 Win=5029 Len=0
187,30.0471221,151.101.66.187,100.84.170.161,TLSv1.2,124,Application Data
188,30.0770463,151.101.66.187,100.84.170.161,TCP,124,"[TCP Retransmission] 443  >  59747 [PSH, ACK] Seq=66882 Ack=58921 Win=5029 Len=70"
189,30.0771046,100.84.170.161,151.101.66.187,TCP,66,59747  >  443 [ACK] Seq=58921 Ack=66952 Win=4103 Len=0 SLE=66882 SRE=66952
190,30.1965321,100.84.170.161,151.101.66.187,TLSv1.2,793,Application Data
191,30.2061232,151.101.66.187,100.84.170.161,TCP,56,443  >  59747 [ACK] Seq=66952 Ack=59660 Win=5029 Len=0
192,30.2111629,151.101.66.187,100.84.170.161,TLSv1.2,168,Application Data
193,30.2137146,100.84.170.161,151.101.66.187,TLSv1.2,1884,Application Data
194,30.2230568,151.101.66.187,100.84.170.161,TCP,56,443  >  59747 [ACK] Seq=67066 Ack=61490 Win=5029 Len=0
195,30.2259175,151.101.66.187,100.84.170.161,TLSv1.2,125,Application Data
196,30.2366516,100.84.170.161,151.101.66.187,TLSv1.2,835,Application Data
197,30.246319,151.101.66.187,100.84.170.161,TCP,56,443  >  59747 [ACK] Seq=67137 Ack=62271 Win=5029 Len=0
198,30.2486218,151.101.66.187,100.84.170.161,TLSv1.2,131,Application Data
199,30.2762178,151.101.66.187,100.84.170.161,TCP,131,"[TCP Retransmission] 443  >  59747 [PSH, ACK] Seq=67137 Ack=62271 Win=5029 Len=77"
200,30.2762891,100.84.170.161,151.101.66.187,TCP,66,59747  >  443 [ACK] Seq=62271 Ack=67214 Win=4102 Len=0 SLE=67137 SRE=67214
201,30.3311365,100.84.170.161,151.101.66.187,TLSv1.2,1807,Application Data
202,30.3579463,100.84.170.161,151.101.66.187,TCP,1514,"[TCP Retransmission] 59747  >  443 [PSH, ACK] Seq=62564 Ack=67214 Win=4102 Len=1460"
203,30.3697501,100.84.170.161,151.101.66.187,TLSv1.2,833,Application Data
204,30.383767,100.84.170.161,151.101.66.187,TLSv1.2,1873,Application Data
205,30.383944,100.84.170.161,151.101.66.187,TLSv1.2,798,Application Data
206,30.3849439,100.84.170.161,151.101.66.187,TLSv1.2,1879,Application Data
207,30.4043661,100.84.170.161,151.101.66.187,TLSv1.2,840,Application Data
208,30.4132967,151.101.66.187,100.84.170.161,TCP,56,443  >  59747 [ACK] Seq=67214 Ack=64024 Win=5029 Len=0
209,30.4138688,151.101.66.187,100.84.170.161,TLSv1.2,316,Application Data
210,30.4138688,151.101.66.187,100.84.170.161,TLSv1.2,268,Application Data
211,30.4139461,100.84.170.161,151.101.66.187,TCP,54,59747  >  443 [ACK] Seq=69977 Ack=67690 Win=4101 Len=0
212,30.4154207,100.84.170.161,151.101.66.187,TLSv1.2,89,Application Data
213,30.4368068,151.101.66.187,100.84.170.161,TCP,66,[TCP Dup ACK 208#1] 443  >  59747 [ACK] Seq=67690 Ack=64024 Win=5029 Len=0 SLE=62564 SRE=64024
214,30.4370819,151.101.66.187,100.84.170.161,TCP,268,"[TCP Spurious Retransmission] 443  >  59747 [PSH, ACK] Seq=67476 Ack=64024 Win=5029 Len=214"
215,30.4371148,100.84.170.161,151.101.66.187,TCP,66,[TCP Dup ACK 211#1] 59747  >  443 [ACK] Seq=70012 Ack=67690 Win=4101 Len=0 SLE=67476 SRE=67690
216,30.4465158,151.101.66.187,100.84.170.161,TCP,56,443  >  59747 [ACK] Seq=67690 Ack=69191 Win=5029 Len=0
217,30.4468341,151.101.66.187,100.84.170.161,TLSv1.2,258,Application Data
218,30.4468789,100.84.170.161,151.101.66.187,TCP,54,59747  >  443 [ACK] Seq=70012 Ack=67894 Win=4106 Len=0
219,30.4474758,151.101.66.187,100.84.170.161,TLSv1.2,124,Application Data
220,30.4474758,151.101.66.187,100.84.170.161,TLSv1.2,125,Application Data
221,30.4475298,100.84.170.161,151.101.66.187,TCP,54,59747  >  443 [ACK] Seq=70012 Ack=68035 Win=4105 Len=0
222,30.4478484,151.101.66.187,100.84.170.161,TLSv1.2,125,Application Data
223,30.4478915,100.84.170.161,151.101.66.187,TCP,54,59747  >  443 [ACK] Seq=70012 Ack=68106 Win=4105 Len=0
224,30.4481601,151.101.66.187,100.84.170.161,TCP,56,443  >  59747 [ACK] Seq=68106 Ack=69977 Win=5029 Len=0
225,30.4481601,151.101.66.187,100.84.170.161,TLSv1.2,124,Application Data
226,30.453907,151.101.66.187,100.84.170.161,TCP,56,443  >  59747 [ACK] Seq=68176 Ack=70012 Win=5029 Len=0
227,30.4887206,100.84.170.161,151.101.66.187,TCP,54,59747  >  443 [ACK] Seq=70012 Ack=68176 Win=4105 Len=0
228,30.5342715,151.101.66.187,100.84.170.161,TCP,124,"[TCP Spurious Retransmission] 443  >  59747 [PSH, ACK] Seq=68106 Ack=70012 Win=5029 Len=70"
229,30.534308,100.84.170.161,151.101.66.187,TCP,66,[TCP Dup ACK 227#1] 59747  >  443 [ACK] Seq=70012 Ack=68176 Win=4105 Len=0 SLE=68106 SRE=68176
230,30.6790582,100.84.170.161,151.101.66.187,TLSv1.2,1851,Application Data
231,30.6792569,100.84.170.161,151.101.66.187,TLSv1.2,851,Application Data
232,30.6894178,151.101.66.187,100.84.170.161,TCP,56,443  >  59747 [ACK] Seq=68176 Ack=71809 Win=5029 Len=0
233,30.6896721,151.101.66.187,100.84.170.161,TCP,56,443  >  59747 [ACK] Seq=68176 Ack=72606 Win=5029 Len=0
234,30.6924031,151.101.66.187,100.84.170.161,TLSv1.2,104,Application Data
235,30.6926637,151.101.66.187,100.84.170.161,TLSv1.2,125,Application Data
236,30.6926907,100.84.170.161,151.101.66.187,TCP,54,59747  >  443 [ACK] Seq=72606 Ack=68297 Win=4104 Len=0
237,30.960069,100.84.170.161,151.101.66.187,TLSv1.2,1990,Application Data
238,30.9687205,151.101.66.187,100.84.170.161,TCP,56,443  >  59747 [ACK] Seq=68297 Ack=74542 Win=5029 Len=0
239,30.973098,100.84.170.161,151.101.66.187,TLSv1.2,903,Application Data
240,30.9815984,151.101.66.187,100.84.170.161,TCP,56,443  >  59747 [ACK] Seq=68297 Ack=75391 Win=5029 Len=0
241,30.9844241,151.101.66.187,100.84.170.161,TLSv1.2,98,Application Data
242,30.9996835,100.84.170.161,151.101.66.187,TLSv1.2,1783,Application Data
243,31.0087302,151.101.66.187,100.84.170.161,TCP,56,443  >  59747 [ACK] Seq=68341 Ack=77120 Win=5029 Len=0
244,31.0112138,151.101.66.187,100.84.170.161,TLSv1.2,125,Application Data
245,31.0224694,151.101.66.187,100.84.170.161,TLSv1.2,479,Application Data
246,31.0225381,100.84.170.161,151.101.66.187,TCP,54,59747  >  443 [ACK] Seq=77120 Ack=68837 Win=4102 Len=0
247,31.0227659,151.101.66.187,100.84.170.161,TCP,1510,443  >  59747 [ACK] Seq=68837 Ack=77120 Win=5029 Len=1456 [TCP PDU reassembled in 249]
248,31.0235127,151.101.66.187,100.84.170.161,TCP,1510,443  >  59747 [ACK] Seq=70293 Ack=77120 Win=5029 Len=1456 [TCP PDU reassembled in 249]
249,31.0235127,151.101.66.187,100.84.170.161,TLSv1.2,813,Application Data
250,31.0235127,151.101.66.187,100.84.170.161,TLSv1.2,86,Application Data
251,31.0235127,151.101.66.187,100.84.170.161,TLSv1.2,936,Application Data
252,31.0235127,151.101.66.187,100.84.170.161,TLSv1.2,85,Application Data
253,31.0235942,100.84.170.161,151.101.66.187,TCP,54,59747  >  443 [ACK] Seq=77120 Ack=73453 Win=4106 Len=0
254,31.1509973,100.84.170.161,151.101.66.187,TLSv1.2,940,Application Data
255,31.1612445,151.101.66.187,100.84.170.161,TCP,56,443  >  59747 [ACK] Seq=73453 Ack=78006 Win=5029 Len=0
256,31.1640863,151.101.66.187,100.84.170.161,TLSv1.2,311,Application Data
257,31.1993329,151.101.66.187,100.84.170.161,TCP,311,"[TCP Retransmission] 443  >  59747 [PSH, ACK] Seq=73453 Ack=78006 Win=5029 Len=257"
258,31.1993759,100.84.170.161,151.101.66.187,TCP,66,59747  >  443 [ACK] Seq=78006 Ack=73710 Win=4105 Len=0 SLE=73453 SRE=73710
259,31.2536415,100.84.170.161,151.101.66.187,TLSv1.2,1771,Application Data
260,31.2625998,151.101.66.187,100.84.170.161,TCP,56,443  >  59747 [ACK] Seq=73710 Ack=79723 Win=5029 Len=0
261,31.265451,151.101.66.187,100.84.170.161,TLSv1.2,264,Application Data
262,31.2819752,100.84.170.161,151.101.66.187,TLSv1.2,938,Application Data
263,31.284568,100.84.170.161,151.101.66.187,TLSv1.2,1766,Application Data
264,31.2907228,151.101.66.187,100.84.170.161,TCP,56,443  >  59747 [ACK] Seq=73920 Ack=80607 Win=5029 Len=0
265,31.2937503,151.101.66.187,100.84.170.161,TLSv1.2,234,Application Data
266,31.2959936,151.101.66.187,100.84.170.161,TLSv1.2,131,Application Data
267,31.2960529,100.84.170.161,151.101.66.187,TCP,54,59747  >  443 [ACK] Seq=82319 Ack=74177 Win=4103 Len=0
268,31.441498,100.84.170.161,151.101.66.187,TLSv1.2,928,Application Data
269,31.4417547,100.84.170.161,151.101.66.187,TLSv1.2,1753,Application Data
270,31.4506285,151.101.66.187,100.84.170.161,TCP,56,443  >  59747 [ACK] Seq=74177 Ack=83193 Win=5029 Len=0
271,31.4516442,151.101.66.187,100.84.170.161,TCP,56,443  >  59747 [ACK] Seq=74177 Ack=84892 Win=5029 Len=0
272,31.4537319,151.101.66.187,100.84.170.161,TLSv1.2,130,Application Data
273,31.4544023,151.101.66.187,100.84.170.161,TLSv1.2,124,Application Data
274,31.4544535,100.84.170.161,151.101.66.187,TCP,54,59747  >  443 [ACK] Seq=84892 Ack=74323 Win=4102 Len=0
275,31.9535265,100.84.170.161,151.101.66.187,TLSv1.2,938,Application Data
276,31.9537732,100.84.170.161,151.101.66.187,TLSv1.2,1789,Application Data
277,31.9541346,100.84.170.161,151.101.66.187,TLSv1.2,944,Application Data
278,31.9659422,151.101.66.187,100.84.170.161,TCP,56,443  >  59747 [ACK] Seq=74323 Ack=88401 Win=5029 Len=0
279,31.9681397,151.101.66.187,100.84.170.161,TLSv1.2,125,Application Data
280,31.9684746,151.101.66.187,100.84.170.161,TLSv1.2,130,Application Data
281,31.9685032,100.84.170.161,151.101.66.187,TCP,54,59747  >  443 [ACK] Seq=88401 Ack=74470 Win=4102 Len=0
282,31.9692877,151.101.66.187,100.84.170.161,TLSv1.2,130,Application Data
283,32.0057756,100.84.170.161,151.101.66.187,TLSv1.2,1781,Application Data
284,32.0103419,151.101.66.187,100.84.170.161,TCP,130,"[TCP Spurious Retransmission] 443  >  59747 [PSH, ACK] Seq=74470 Ack=88401 Win=5029 Len=76"
285,32.0104799,100.84.170.161,151.101.66.187,TCP,66,[TCP Dup ACK 283#1] 59747  >  443 [ACK] Seq=90128 Ack=74546 Win=4101 Len=0 SLE=74470 SRE=74546
286,32.0146726,151.101.66.187,100.84.170.161,TCP,56,443  >  59747 [ACK] Seq=74546 Ack=90128 Win=5029 Len=0
287,32.017194,151.101.66.187,100.84.170.161,TLSv1.2,98,Application Data
288,32.049878,151.101.66.187,100.84.170.161,TCP,98,"[TCP Retransmission] 443  >  59747 [PSH, ACK] Seq=74546 Ack=90128 Win=5029 Len=44"
289,32.049918,100.84.170.161,151.101.66.187,TCP,66,59747  >  443 [ACK] Seq=90128 Ack=74590 Win=4101 Len=0 SLE=74546 SRE=74590
290,32.3804236,100.84.170.161,151.101.66.187,TLSv1.2,923,Application Data
291,32.389272,151.101.66.187,100.84.170.161,TCP,56,443  >  59747 [ACK] Seq=74590 Ack=90997 Win=5029 Len=0
292,32.3927493,151.101.66.187,100.84.170.161,TLSv1.2,241,Application Data
293,32.4252205,151.101.66.187,100.84.170.161,TCP,241,"[TCP Retransmission] 443  >  59747 [PSH, ACK] Seq=74590 Ack=90997 Win=5029 Len=187"
294,32.4252985,100.84.170.161,151.101.66.187,TCP,66,59747  >  443 [ACK] Seq=90997 Ack=74777 Win=4101 Len=0 SLE=74590 SRE=74777
295,32.5020238,100.84.170.161,151.101.66.187,TLSv1.2,175,Ignored Unknown Record
296,32.5021492,100.84.170.161,151.101.66.187,TLSv1.2,93,Application Data
297,32.5106178,151.101.66.187,100.84.170.161,TCP,56,443  >  55359 [ACK] Seq=1 Ack=123 Win=281 Len=0
298,32.5111601,151.101.66.187,100.84.170.161,TCP,56,443  >  55359 [ACK] Seq=1 Ack=162 Win=281 Len=0
299,32.5117423,151.101.66.187,100.84.170.161,TLSv1.2,93,Application Data
300,32.5387347,151.101.66.187,100.84.170.161,TCP,93,"[TCP Retransmission] 443  >  55359 [PSH, ACK] Seq=1 Ack=162 Win=281 Len=39"
301,32.5387854,100.84.170.161,151.101.66.187,TCP,66,55359  >  443 [ACK] Seq=162 Ack=40 Win=512 Len=0 SLE=1 SRE=40
302,32.5614777,151.101.66.187,100.84.170.161,TLSv1.2,381,Application Data
303,32.5617534,151.101.66.187,100.84.170.161,TLSv1.2,823,Application Data
304,32.5617886,100.84.170.161,151.101.66.187,TCP,54,55359  >  443 [ACK] Seq=162 Ack=1136 Win=507 Len=0
305,32.5626534,100.84.170.161,151.101.66.187,TLSv1.2,89,Application Data
306,32.5713231,151.101.66.187,100.84.170.161,TCP,56,443  >  55359 [ACK] Seq=1136 Ack=197 Win=281 Len=0
307,32.7617185,100.84.170.161,151.101.66.187,TLSv1.2,1798,Application Data
308,32.7659761,100.84.170.161,151.101.66.187,TLSv1.2,888,Application Data
309,32.7707149,100.84.170.161,151.101.66.187,TLSv1.2,1805,Application Data
310,32.7717569,151.101.66.187,100.84.170.161,TCP,56,443  >  59747 [ACK] Seq=74777 Ack=92741 Win=5029 Len=0
311,32.7743474,151.101.66.187,100.84.170.161,TLSv1.2,131,Application Data
312,32.7747146,151.101.66.187,100.84.170.161,TCP,56,443  >  59747 [ACK] Seq=74854 Ack=93575 Win=5029 Len=0
313,32.7768412,151.101.66.187,100.84.170.161,TLSv1.2,98,Application Data
314,32.7769085,100.84.170.161,151.101.66.187,TCP,54,59747  >  443 [ACK] Seq=95326 Ack=74898 Win=4100 Len=0
315,32.7795729,151.101.66.187,100.84.170.161,TCP,56,443  >  59747 [ACK] Seq=74898 Ack=95326 Win=5029 Len=0
316,32.782166,151.101.66.187,100.84.170.161,TLSv1.2,129,Application Data
317,32.8186496,151.101.66.187,100.84.170.161,TCP,129,"[TCP Retransmission] 443  >  59747 [PSH, ACK] Seq=74898 Ack=95326 Win=5029 Len=75"
318,32.8186887,100.84.170.161,151.101.66.187,TCP,66,59747  >  443 [ACK] Seq=95326 Ack=74973 Win=4106 Len=0 SLE=74898 SRE=74973
319,32.8221388,100.84.170.161,151.101.66.187,TLSv1.2,904,Application Data
320,32.8223608,100.84.170.161,151.101.66.187,TLSv1.2,1759,Application Data
321,32.8310085,151.101.66.187,100.84.170.161,TCP,56,443  >  59747 [ACK] Seq=74973 Ack=97881 Win=5029 Len=0
322,32.8363162,151.101.66.187,100.84.170.161,TLSv1.2,206,Application Data
323,32.8366919,151.101.66.187,100.84.170.161,TLSv1.2,265,Application Data
324,32.8367255,100.84.170.161,151.101.66.187,TCP,54,59747  >  443 [ACK] Seq=97881 Ack=75336 Win=4104 Len=0
325,32.8814996,100.84.170.161,151.101.66.187,TLSv1.2,927,Application Data
326,32.8904719,151.101.66.187,100.84.170.161,TCP,56,443  >  59747 [ACK] Seq=75336 Ack=98754 Win=5029 Len=0
327,32.8927444,151.101.66.187,100.84.170.161,TLSv1.2,130,Application Data
328,32.9232076,151.101.66.187,100.84.170.161,TCP,130,"[TCP Retransmission] 443  >  59747 [PSH, ACK] Seq=75336 Ack=98754 Win=5029 Len=76"
329,32.923242,100.84.170.161,151.101.66.187,TCP,66,59747  >  443 [ACK] Seq=98754 Ack=75412 Win=4104 Len=0 SLE=75336 SRE=75412
330,41.6970314,100.84.170.161,151.101.66.187,TLSv1.2,1884,Application Data
331,41.705748,151.101.66.187,100.84.170.161,TCP,56,443  >  59747 [ACK] Seq=75412 Ack=100584 Win=5029 Len=0
332,42.2997328,151.101.66.187,100.84.170.161,TLSv1.2,423,Application Data
333,42.2997328,151.101.66.187,100.84.170.161,TLSv1.2,56838,"Application Data, Application Data, Application Data"
334,42.2997328,151.101.66.187,100.84.170.161,TLSv1.2,861,Application Data
335,42.2997328,151.101.66.187,100.84.170.161,TCP,861,"[TCP Retransmission] 443  >  59747 [PSH, ACK] Seq=132565 Ack=100584 Win=5029 Len=807 [TCP PDU reassembled in 334]"
336,42.2999075,100.84.170.161,151.101.66.187,TCP,66,59747  >  443 [ACK] Seq=100584 Ack=133372 Win=4106 Len=0 SLE=132565 SRE=133372
337,42.3032782,100.84.170.161,151.101.66.187,TLSv1.2,89,Application Data
338,42.3120631,151.101.66.187,100.84.170.161,TCP,56,443  >  59747 [ACK] Seq=133372 Ack=100619 Win=5029 Len=0
339,42.6814084,100.84.170.161,151.101.66.187,TLSv1.2,953,Application Data
340,42.6816031,100.84.170.161,151.101.66.187,TLSv1.2,1780,Application Data
341,42.6868111,100.84.170.161,151.101.66.187,TLSv1.2,953,Application Data
342,42.6901777,151.101.66.187,100.84.170.161,TCP,56,443  >  59747 [ACK] Seq=133372 Ack=101518 Win=5029 Len=0
343,42.690602,151.101.66.187,100.84.170.161,TCP,56,443  >  59747 [ACK] Seq=133372 Ack=103244 Win=5029 Len=0
344,42.6924818,151.101.66.187,100.84.170.161,TLSv1.2,240,Application Data
345,42.6927995,151.101.66.187,100.84.170.161,TLSv1.2,130,Application Data
346,42.6928289,100.84.170.161,151.101.66.187,TCP,54,59747  >  443 [ACK] Seq=104143 Ack=133634 Win=4105 Len=0
347,42.6933623,100.84.170.161,151.101.66.187,TLSv1.2,1787,Application Data
348,42.6935106,100.84.170.161,151.101.66.187,TLSv1.2,973,Application Data
349,42.6953103,151.101.66.187,100.84.170.161,TCP,56,443  >  59747 [ACK] Seq=133634 Ack=104143 Win=5029 Len=0
350,42.6957471,100.84.170.161,151.101.66.187,TLSv1.2,1778,Application Data
351,42.6978369,151.101.66.187,100.84.170.161,TLSv1.2,131,Application Data
352,42.7023352,151.101.66.187,100.84.170.161,TCP,56,443  >  59747 [ACK] Seq=133711 Ack=105876 Win=5029 Len=0
353,42.7023352,151.101.66.187,100.84.170.161,TCP,56,443  >  59747 [ACK] Seq=133711 Ack=106795 Win=5029 Len=0
354,42.7044182,151.101.66.187,100.84.170.161,TCP,56,443  >  59747 [ACK] Seq=133711 Ack=108519 Win=5029 Len=0
355,42.7051862,151.101.66.187,100.84.170.161,TLSv1.2,223,Application Data
356,42.7054462,100.84.170.161,151.101.66.187,TCP,54,59747  >  443 [ACK] Seq=108519 Ack=133880 Win=4104 Len=0
357,42.7070106,151.101.66.187,100.84.170.161,TLSv1.2,156,Application Data
358,42.7151163,100.84.170.161,151.101.66.187,TLSv1.2,942,Application Data
359,42.723539,151.101.66.187,100.84.170.161,TCP,56,443  >  59747 [ACK] Seq=133982 Ack=109407 Win=5029 Len=0
360,42.7263164,151.101.66.187,100.84.170.161,TLSv1.2,265,Application Data
361,42.7355365,100.84.170.161,151.101.66.187,TLSv1.2,1772,Application Data
362,42.7443468,151.101.66.187,100.84.170.161,TCP,56,443  >  59747 [ACK] Seq=134193 Ack=111125 Win=5029 Len=0
363,42.7468016,151.101.66.187,100.84.170.161,TLSv1.2,130,Application Data
364,42.7724775,100.84.170.161,151.101.66.187,TLSv1.2,979,Application Data
365,42.7766831,100.84.170.161,151.101.66.187,TLSv1.2,1782,Application Data
366,42.7774461,100.84.170.161,151.101.66.187,TLSv1.2,974,Application Data
367,42.7791804,151.101.66.187,100.84.170.161,TCP,130,"[TCP Spurious Retransmission] 443  >  59747 [PSH, ACK] Seq=134193 Ack=111125 Win=5029 Len=76"
368,42.7792296,100.84.170.161,151.101.66.187,TCP,66,[TCP Dup ACK 364#1] 59747  >  443 [ACK] Seq=114698 Ack=134269 Win=4102 Len=0 SLE=134193 SRE=134269
369,42.7812828,151.101.66.187,100.84.170.161,TCP,56,443  >  59747 [ACK] Seq=134269 Ack=112050 Win=5029 Len=0
370,42.783547,100.84.170.161,151.101.66.187,TLSv1.2,1781,Application Data
371,42.7844709,100.84.170.161,151.101.66.187,TLSv1.2,970,Application Data
372,42.7848467,151.101.66.187,100.84.170.161,TLSv1.2,124,Application Data
373,42.7854257,151.101.66.187,100.84.170.161,TCP,56,443  >  59747 [ACK] Seq=134339 Ack=113778 Win=5029 Len=0
374,42.7858342,151.101.66.187,100.84.170.161,TCP,56,443  >  59747 [ACK] Seq=134339 Ack=114698 Win=5029 Len=0
375,42.7878564,151.101.66.187,100.84.170.161,TLSv1.2,124,Application Data
376,42.7879211,100.84.170.161,151.101.66.187,TCP,54,59747  >  443 [ACK] Seq=117341 Ack=134409 Win=4102 Len=0
377,42.7886148,151.101.66.187,100.84.170.161,TLSv1.2,130,Application Data
378,42.7928203,151.101.66.187,100.84.170.161,TCP,56,443  >  59747 [ACK] Seq=134485 Ack=116425 Win=5029 Len=0
379,42.7941575,151.101.66.187,100.84.170.161,TCP,56,443  >  59747 [ACK] Seq=134485 Ack=117341 Win=5029 Len=0
380,42.7958868,151.101.66.187,100.84.170.161,TLSv1.2,131,Application Data
381,42.7959457,100.84.170.161,151.101.66.187,TCP,54,59747  >  443 [ACK] Seq=117341 Ack=134562 Win=4101 Len=0
382,42.797824,151.101.66.187,100.84.170.161,TLSv1.2,131,Application Data
383,42.8379552,151.101.66.187,100.84.170.161,TCP,131,"[TCP Retransmission] 443  >  59747 [PSH, ACK] Seq=134562 Ack=117341 Win=5029 Len=77"
384,42.8380703,100.84.170.161,151.101.66.187,TCP,66,59747  >  443 [ACK] Seq=117341 Ack=134639 Win=4101 Len=0 SLE=134562 SRE=134639
385,42.884616,100.84.170.161,151.101.66.187,TLSv1.2,1773,Application Data
386,42.8854793,100.84.170.161,151.101.66.187,TLSv1.2,984,Application Data
387,42.8935245,151.101.66.187,100.84.170.161,TCP,56,443  >  59747 [ACK] Seq=134639 Ack=119060 Win=5029 Len=0
388,42.894328,151.101.66.187,100.84.170.161,TCP,56,443  >  59747 [ACK] Seq=134639 Ack=119990 Win=5029 Len=0
389,42.8961173,151.101.66.187,100.84.170.161,TLSv1.2,131,Application Data
390,42.8964435,151.101.66.187,100.84.170.161,TLSv1.2,240,Application Data
391,42.8964776,100.84.170.161,151.101.66.187,TCP,54,59747  >  443 [ACK] Seq=119990 Ack=134902 Win=4106 Len=0
392,43.0264755,100.84.170.161,151.101.66.187,TLSv1.2,1803,Application Data
393,43.0320309,100.84.170.161,151.101.66.187,TLSv1.2,928,Application Data
394,43.0355664,151.101.66.187,100.84.170.161,TCP,56,443  >  59747 [ACK] Seq=134902 Ack=121739 Win=5029 Len=0
395,43.0381126,151.101.66.187,100.84.170.161,TLSv1.2,130,Application Data
396,43.0406138,151.101.66.187,100.84.170.161,TCP,56,443  >  59747 [ACK] Seq=134978 Ack=122613 Win=5029 Len=0
397,43.0434204,151.101.66.187,100.84.170.161,TLSv1.2,131,Application Data
398,43.043503,100.84.170.161,151.101.66.187,TCP,54,59747  >  443 [ACK] Seq=122613 Ack=135055 Win=4105 Len=0
399,44.9179678,100.84.170.161,151.101.66.187,TLSv1.2,1805,Application Data
400,44.9183166,100.84.170.161,151.101.66.187,TLSv1.2,913,Application Data
401,44.9268174,151.101.66.187,100.84.170.161,TCP,56,443  >  59747 [ACK] Seq=135055 Ack=124364 Win=5029 Len=0
402,44.9270692,151.101.66.187,100.84.170.161,TCP,56,443  >  59747 [ACK] Seq=135055 Ack=125223 Win=5029 Len=0
403,44.9296504,151.101.66.187,100.84.170.161,TLSv1.2,214,Application Data
404,44.9299105,151.101.66.187,100.84.170.161,TLSv1.2,180,Application Data
405,44.929934,100.84.170.161,151.101.66.187,TCP,54,59747  >  443 [ACK] Seq=125223 Ack=135341 Win=4104 Len=0
406,45.2829084,100.84.170.161,151.101.66.187,TLSv1.2,1811,Application Data
407,45.2871752,100.84.170.161,151.101.66.187,TLSv1.2,944,Application Data
408,45.2919633,151.101.66.187,100.84.170.161,TCP,56,443  >  59747 [ACK] Seq=135341 Ack=126980 Win=5029 Len=0
409,45.2945088,151.101.66.187,100.84.170.161,TLSv1.2,374,Application Data
410,45.2964266,151.101.66.187,100.84.170.161,TCP,56,443  >  59747 [ACK] Seq=135661 Ack=127870 Win=5029 Len=0
411,45.2993676,151.101.66.187,100.84.170.161,TLSv1.2,124,Application Data
412,45.299431,100.84.170.161,151.101.66.187,TCP,54,59747  >  443 [ACK] Seq=127870 Ack=135731 Win=4103 Len=0
413,46.238921,100.84.170.161,151.101.66.187,TLSv1.2,1815,Application Data
414,46.2490112,151.101.66.187,100.84.170.161,TCP,56,443  >  59747 [ACK] Seq=135731 Ack=129631 Win=5029 Len=0
415,46.2515603,151.101.66.187,100.84.170.161,TLSv1.2,131,Application Data
416,46.2809325,151.101.66.187,100.84.170.161,TCP,131,"[TCP Retransmission] 443  >  59747 [PSH, ACK] Seq=135731 Ack=129631 Win=5029 Len=77"
417,46.2809778,100.84.170.161,151.101.66.187,TCP,66,59747  >  443 [ACK] Seq=129631 Ack=135808 Win=4102 Len=0 SLE=135731 SRE=135808
418,46.3019503,100.84.170.161,151.101.66.187,TLSv1.2,959,Application Data
419,46.3024275,100.84.170.161,151.101.66.187,TLSv1.2,1799,Application Data
420,46.310827,151.101.66.187,100.84.170.161,TCP,56,443  >  59747 [ACK] Seq=135808 Ack=130536 Win=5029 Len=0
421,46.3113012,151.101.66.187,100.84.170.161,TCP,56,443  >  59747 [ACK] Seq=135808 Ack=132281 Win=5029 Len=0
422,46.3135228,151.101.66.187,100.84.170.161,TLSv1.2,235,Application Data
423,46.3138345,151.101.66.187,100.84.170.161,TLSv1.2,130,Application Data
424,46.3138821,100.84.170.161,151.101.66.187,TCP,54,59747  >  443 [ACK] Seq=132281 Ack=136065 Win=4101 Len=0
425,46.590747,100.84.170.161,151.101.66.187,TLSv1.2,970,Application Data
426,46.6013042,151.101.66.187,100.84.170.161,TCP,56,443  >  59747 [ACK] Seq=136065 Ack=133197 Win=5029 Len=0
427,46.6035955,151.101.66.187,100.84.170.161,TLSv1.2,131,Application Data
428,46.6328905,151.101.66.187,100.84.170.161,TCP,131,"[TCP Retransmission] 443  >  59747 [PSH, ACK] Seq=136065 Ack=133197 Win=5029 Len=77"
429,46.6329224,100.84.170.161,151.101.66.187,TCP,66,59747  >  443 [ACK] Seq=133197 Ack=136142 Win=4101 Len=0 SLE=136065 SRE=136142
430,46.8677245,100.84.170.161,151.101.66.187,TLSv1.2,1810,Application Data
431,46.8780523,151.101.66.187,100.84.170.161,TCP,56,443  >  59747 [ACK] Seq=136142 Ack=134953 Win=5029 Len=0
432,46.880363,100.84.170.161,151.101.66.187,TLSv1.2,930,Application Data
433,46.8821347,151.101.66.187,100.84.170.161,TLSv1.2,131,Application Data
434,46.8895482,151.101.66.187,100.84.170.161,TCP,56,443  >  59747 [ACK] Seq=136219 Ack=135829 Win=5029 Len=0
435,46.8920971,151.101.66.187,100.84.170.161,TLSv1.2,98,Application Data
436,46.8921463,100.84.170.161,151.101.66.187,TCP,54,59747  >  443 [ACK] Seq=135829 Ack=136263 Win=4100 Len=0
437,47.2806391,100.84.170.161,151.101.66.187,TLSv1.2,1808,Application Data
438,47.2808257,100.84.170.161,151.101.66.187,TLSv1.2,918,Application Data
439,47.2822558,100.84.170.161,151.101.66.187,TLSv1.2,1802,Application Data
440,47.2831068,100.84.170.161,151.101.66.187,TLSv1.2,882,Application Data
441,47.2840225,100.84.170.161,151.101.66.187,TLSv1.2,1812,Application Data
442,47.2894646,151.101.66.187,100.84.170.161,TCP,56,443  >  59747 [ACK] Seq=136263 Ack=137583 Win=5029 Len=0
443,47.2896952,151.101.66.187,100.84.170.161,TCP,56,443  >  59747 [ACK] Seq=136263 Ack=138447 Win=5029 Len=0
444,47.2910932,151.101.66.187,100.84.170.161,TCP,56,443  >  59747 [ACK] Seq=136263 Ack=140195 Win=5029 Len=0
445,47.2920262,151.101.66.187,100.84.170.161,TCP,56,443  >  59747 [ACK] Seq=136263 Ack=141023 Win=5029 Len=0
446,47.292752,151.101.66.187,100.84.170.161,TLSv1.2,262,Application Data
447,47.2927901,100.84.170.161,151.101.66.187,TCP,54,59747  >  443 [ACK] Seq=142781 Ack=136471 Win=4106 Len=0
448,47.2934779,151.101.66.187,100.84.170.161,TCP,56,443  >  59747 [ACK] Seq=136471 Ack=142781 Win=5029 Len=0
449,47.2947161,151.101.66.187,100.84.170.161,TLSv1.2,124,Application Data
450,47.294797,100.84.170.161,151.101.66.187,TCP,54,59747  >  443 [ACK] Seq=142781 Ack=136541 Win=4105 Len=0
451,47.295262,151.101.66.187,100.84.170.161,TLSv1.2,131,Application Data
452,47.295262,151.101.66.187,100.84.170.161,TLSv1.2,130,Application Data
453,47.295311,100.84.170.161,151.101.66.187,TCP,54,59747  >  443 [ACK] Seq=142781 Ack=136694 Win=4105 Len=0
454,47.3039634,100.84.170.161,151.101.66.187,TLSv1.2,906,Application Data
455,47.3044234,100.84.170.161,151.101.66.187,TLSv1.2,1812,Application Data
456,47.3178399,151.101.66.187,100.84.170.161,TCP,56,443  >  59747 [ACK] Seq=136694 Ack=143633 Win=5029 Len=0
457,47.3183067,151.101.66.187,100.84.170.161,TCP,56,443  >  59747 [ACK] Seq=136694 Ack=145391 Win=5029 Len=0
458,47.3186736,151.101.66.187,100.84.170.161,TLSv1.2,207,Application Data
459,47.3186736,151.101.66.187,100.84.170.161,TLSv1.2,103,Application Data
460,47.3187334,100.84.170.161,151.101.66.187,TCP,54,59747  >  443 [ACK] Seq=145391 Ack=136896 Win=4104 Len=0
461,47.7753703,100.84.170.161,151.101.66.187,TLSv1.2,912,Application Data
462,47.7815572,100.84.170.161,151.101.66.187,TLSv1.2,1797,Application Data
463,47.7841415,100.84.170.161,151.101.66.187,TLSv1.2,880,Application Data
464,47.7855435,151.101.66.187,100.84.170.161,TCP,56,443  >  59747 [ACK] Seq=136896 Ack=146249 Win=5029 Len=0
465,47.7879938,151.101.66.187,100.84.170.161,TLSv1.2,233,Application Data
466,47.7905381,151.101.66.187,100.84.170.161,TCP,56,443  >  59747 [ACK] Seq=137075 Ack=147992 Win=5029 Len=0
467,47.7928289,151.101.66.187,100.84.170.161,TCP,56,443  >  59747 [ACK] Seq=137075 Ack=148818 Win=5029 Len=0
468,47.7931431,151.101.66.187,100.84.170.161,TLSv1.2,124,Application Data
469,47.7931927,100.84.170.161,151.101.66.187,TCP,54,59747  >  443 [ACK] Seq=148818 Ack=137145 Win=4103 Len=0
470,47.7953395,151.101.66.187,100.84.170.161,TLSv1.2,131,Application Data
471,47.8310125,151.101.66.187,100.84.170.161,TCP,131,"[TCP Retransmission] 443  >  59747 [PSH, ACK] Seq=137145 Ack=148818 Win=5029 Len=77"
472,47.8310539,100.84.170.161,151.101.66.187,TCP,66,59747  >  443 [ACK] Seq=148818 Ack=137222 Win=4103 Len=0 SLE=137145 SRE=137222
473,47.8645656,100.84.170.161,151.101.66.187,TLSv1.2,1802,Application Data
474,47.8735113,151.101.66.187,100.84.170.161,TCP,56,443  >  59747 [ACK] Seq=137222 Ack=150566 Win=5029 Len=0
475,47.8773567,151.101.66.187,100.84.170.161,TLSv1.2,130,Application Data
476,47.8919424,100.84.170.161,151.101.66.187,TLSv1.2,909,Application Data
477,47.8921697,100.84.170.161,151.101.66.187,TLSv1.2,1788,Application Data
478,47.8936256,100.84.170.161,151.101.66.187,TLSv1.2,915,Application Data
479,47.8951705,100.84.170.161,151.101.66.187,TLSv1.2,1773,Application Data
480,47.901037,151.101.66.187,100.84.170.161,TCP,56,443  >  59747 [ACK] Seq=137298 Ack=151421 Win=5029 Len=0
481,47.9018092,151.101.66.187,100.84.170.161,TCP,56,443  >  59747 [ACK] Seq=137298 Ack=153155 Win=5029 Len=0
482,47.9023821,151.101.66.187,100.84.170.161,TCP,56,443  >  59747 [ACK] Seq=137298 Ack=154016 Win=5029 Len=0
483,47.9044609,151.101.66.187,100.84.170.161,TCP,56,443  >  59747 [ACK] Seq=137298 Ack=155735 Win=5029 Len=0
484,47.9049156,151.101.66.187,100.84.170.161,TLSv1.2,125,Application Data
485,47.9063029,151.101.66.187,100.84.170.161,TLSv1.2,124,Application Data
486,47.906364,100.84.170.161,151.101.66.187,TCP,54,59747  >  443 [ACK] Seq=155735 Ack=137439 Win=4102 Len=0
487,47.9065637,151.101.66.187,100.84.170.161,TLSv1.2,125,Application Data
488,47.907282,151.101.66.187,100.84.170.161,TLSv1.2,124,Application Data
489,47.9073456,100.84.170.161,151.101.66.187,TCP,54,59747  >  443 [ACK] Seq=155735 Ack=137580 Win=4101 Len=0
490,48.103546,100.84.170.161,151.101.66.187,TLSv1.2,932,Application Data
491,48.1124697,151.101.66.187,100.84.170.161,TCP,56,443  >  59747 [ACK] Seq=137580 Ack=156613 Win=5029 Len=0
492,48.1149422,151.101.66.187,100.84.170.161,TLSv1.2,131,Application Data
493,48.1463635,151.101.66.187,100.84.170.161,TCP,131,"[TCP Retransmission] 443  >  59747 [PSH, ACK] Seq=137580 Ack=156613 Win=5029 Len=77"
494,48.1464058,100.84.170.161,151.101.66.187,TCP,66,59747  >  443 [ACK] Seq=156613 Ack=137657 Win=4101 Len=0 SLE=137580 SRE=137657
495,48.1818433,100.84.170.161,151.101.66.187,TLSv1.2,1800,Application Data
496,48.1905577,151.101.66.187,100.84.170.161,TCP,56,443  >  59747 [ACK] Seq=137657 Ack=158359 Win=5029 Len=0
497,48.192927,151.101.66.187,100.84.170.161,TLSv1.2,130,Application Data
498,48.200491,100.84.170.161,151.101.66.187,TLSv1.2,912,Application Data
499,48.2006292,100.84.170.161,151.101.66.187,TLSv1.2,1791,Application Data
500,48.2007061,100.84.170.161,151.101.66.187,TLSv1.2,890,Application Data
501,48.2007777,100.84.170.161,151.101.66.187,TLSv1.2,1797,Application Data
502,48.2009056,100.84.170.161,151.101.66.187,TLSv1.2,906,Application Data
503,48.2010803,100.84.170.161,151.101.66.187,TLSv1.2,1791,Application Data
504,48.2011614,100.84.170.161,151.101.66.187,TLSv1.2,912,Application Data
505,48.2012604,100.84.170.161,151.101.66.187,TLSv1.2,1794,Application Data
506,48.2013526,100.84.170.161,151.101.66.187,TLSv1.2,883,Application Data
507,48.2021867,100.84.170.161,151.101.66.187,TLSv1.2,1803,Application Data
508,48.2023351,100.84.170.161,151.101.66.187,TLSv1.2,903,Application Data
509,48.2099054,151.101.66.187,100.84.170.161,TCP,56,443  >  59747 [ACK] Seq=137733 Ack=159217 Win=5029 Len=0
510,48.2106042,151.101.66.187,100.84.170.161,TCP,56,443  >  59747 [ACK] Seq=137733 Ack=164385 Win=5029 Len=0
511,48.2106042,151.101.66.187,100.84.170.161,TCP,56,443  >  59747 [ACK] Seq=137733 Ack=169549 Win=5029 Len=0
512,48.2109343,151.101.66.187,100.84.170.161,TCP,56,443  >  59747 [ACK] Seq=137733 Ack=171298 Win=5029 Len=0
513,48.2112673,151.101.66.187,100.84.170.161,TCP,56,443  >  59747 [ACK] Seq=137733 Ack=172147 Win=5029 Len=0
514,48.2122942,151.101.66.187,100.84.170.161,TLSv1.2,234,Application Data
515,48.2143492,151.101.66.187,100.84.170.161,TLSv1.2,131,Application Data
516,48.2144049,100.84.170.161,151.101.66.187,TCP,54,59747  >  443 [ACK] Seq=172147 Ack=137990 Win=4106 Len=0
517,48.2159249,151.101.66.187,100.84.170.161,TLSv1.2,125,Application Data
518,48.2159249,151.101.66.187,100.84.170.161,TLSv1.2,124,Application Data
519,48.215974,100.84.170.161,151.101.66.187,TCP,54,59747  >  443 [ACK] Seq=172147 Ack=138131 Win=4105 Len=0
520,48.2162372,151.101.66.187,100.84.170.161,TLSv1.2,124,Application Data
521,48.2162372,151.101.66.187,100.84.170.161,TLSv1.2,255,Application Data
522,48.2162372,151.101.66.187,100.84.170.161,TLSv1.2,264,Application Data
523,48.2162575,100.84.170.161,151.101.66.187,TCP,54,59747  >  443 [ACK] Seq=172147 Ack=138612 Win=4103 Len=0
524,48.2165634,151.101.66.187,100.84.170.161,TLSv1.2,208,"Application Data, Application Data"
525,48.2165893,100.84.170.161,151.101.66.187,TCP,54,59747  >  443 [ACK] Seq=172147 Ack=138766 Win=4103 Len=0
526,48.2172636,151.101.66.187,100.84.170.161,TLSv1.2,124,Application Data
527,48.2172875,100.84.170.161,151.101.66.187,TCP,54,59747  >  443 [ACK] Seq=172147 Ack=138836 Win=4102 Len=0
528,48.6116541,100.84.170.161,151.101.66.187,TLSv1.2,1798,Application Data
529,48.6137841,100.84.170.161,151.101.66.187,TLSv1.2,871,Application Data
530,48.6140156,100.84.170.161,151.101.66.187,TLSv1.2,1817,Application Data
531,48.6161224,100.84.170.161,151.101.66.187,TLSv1.2,912,Application Data
532,48.6169404,100.84.170.161,151.101.66.187,TLSv1.2,1803,Application Data
533,48.6171132,100.84.170.161,151.101.66.187,TLSv1.2,919,Application Data
534,48.6211405,100.84.170.161,151.101.66.187,TLSv1.2,1808,Application Data
535,48.6220273,151.101.66.187,100.84.170.161,TCP,56,443  >  59747 [ACK] Seq=138836 Ack=173891 Win=5029 Len=0
536,48.6224981,151.101.66.187,100.84.170.161,TCP,56,443  >  59747 [ACK] Seq=138836 Ack=174708 Win=5029 Len=0
537,48.6227714,151.101.66.187,100.84.170.161,TCP,56,443  >  59747 [ACK] Seq=138836 Ack=176471 Win=5029 Len=0
538,48.622936,100.84.170.161,151.101.66.187,TLSv1.2,885,Application Data
539,48.6242008,151.101.66.187,100.84.170.161,TLSv1.2,234,Application Data
540,48.624522,151.101.66.187,100.84.170.161,TLSv1.2,124,Application Data
541,48.6245579,100.84.170.161,151.101.66.187,TCP,54,59747  >  443 [ACK] Seq=182528 Ack=139086 Win=4101 Len=0
542,48.6248019,151.101.66.187,100.84.170.161,TLSv1.2,130,Application Data
543,48.6255114,151.101.66.187,100.84.170.161,TCP,56,443  >  59747 [ACK] Seq=139162 Ack=179078 Win=5029 Len=0
544,48.6260885,151.101.66.187,100.84.170.161,TCP,56,443  >  59747 [ACK] Seq=139162 Ack=179943 Win=5029 Len=0
545,48.6266802,151.101.66.187,100.84.170.161,TLSv1.2,125,Application Data
546,48.6267314,100.84.170.161,151.101.66.187,TCP,54,59747  >  443 [ACK] Seq=182528 Ack=139233 Win=4101 Len=0
547,48.6275086,151.101.66.187,100.84.170.161,TLSv1.2,131,Application Data
548,48.6277902,151.101.66.187,100.84.170.161,TLSv1.2,131,Application Data
549,48.6278167,100.84.170.161,151.101.66.187,TCP,54,59747  >  443 [ACK] Seq=182528 Ack=139387 Win=4100 Len=0
550,48.6297485,151.101.66.187,100.84.170.161,TCP,56,443  >  59747 [ACK] Seq=139387 Ack=181697 Win=5029 Len=0
551,48.6314407,151.101.66.187,100.84.170.161,TCP,56,443  >  59747 [ACK] Seq=139387 Ack=182528 Win=5029 Len=0
552,48.632011,151.101.66.187,100.84.170.161,TLSv1.2,130,Application Data
553,48.6336287,151.101.66.187,100.84.170.161,TLSv1.2,125,Application Data
554,48.6336789,100.84.170.161,151.101.66.187,TCP,54,59747  >  443 [ACK] Seq=182528 Ack=139534 Win=4106 Len=0
555,49.4808545,100.84.170.161,151.101.66.187,TLSv1.2,2035,Application Data
556,49.4902313,151.101.66.187,100.84.170.161,TCP,56,443  >  59747 [ACK] Seq=139534 Ack=184509 Win=5037 Len=0
557,49.4925444,151.101.66.187,100.84.170.161,TLSv1.2,208,Application Data
558,49.5199213,151.101.66.187,100.84.170.161,TCP,208,"[TCP Retransmission] 443  >  59747 [PSH, ACK] Seq=139534 Ack=184509 Win=5037 Len=154"
559,49.5199624,100.84.170.161,151.101.66.187,TCP,66,59747  >  443 [ACK] Seq=184509 Ack=139688 Win=4105 Len=0 SLE=139534 SRE=139688
560,51.5798698,100.84.170.161,151.101.66.187,TLSv1.2,671,Application Data
561,51.5850894,100.84.170.161,151.101.66.187,TLSv1.2,2047,Application Data
562,51.5907362,151.101.66.187,100.84.170.161,TCP,56,443  >  59747 [ACK] Seq=139688 Ack=185126 Win=5037 Len=0
563,51.5934664,151.101.66.187,100.84.170.161,TLSv1.2,214,Application Data
564,51.5942477,151.101.66.187,100.84.170.161,TCP,56,443  >  59747 [ACK] Seq=139848 Ack=187119 Win=5045 Len=0
565,51.5978598,151.101.66.187,100.84.170.161,TLSv1.2,201,Application Data
566,51.5979189,100.84.170.161,151.101.66.187,TCP,54,59747  >  443 [ACK] Seq=187119 Ack=139995 Win=4104 Len=0
567,51.700819,100.84.170.161,151.101.66.187,TLSv1.2,672,Application Data
568,51.7107933,151.101.66.187,100.84.170.161,TCP,56,443  >  59747 [ACK] Seq=139995 Ack=187737 Win=5045 Len=0
569,51.7136259,151.101.66.187,100.84.170.161,TLSv1.2,265,Application Data
570,51.7411704,151.101.66.187,100.84.170.161,TCP,265,"[TCP Retransmission] 443  >  59747 [PSH, ACK] Seq=139995 Ack=187737 Win=5045 Len=211"
571,51.7412025,100.84.170.161,151.101.66.187,TCP,66,59747  >  443 [ACK] Seq=187737 Ack=140206 Win=4103 Len=0 SLE=139995 SRE=140206
572,55.4316443,100.84.170.161,151.101.66.187,TLSv1.2,2090,Application Data
573,55.4355026,100.84.170.161,151.101.66.187,TLSv1.2,585,Application Data
574,55.4381429,100.84.170.161,151.101.66.187,TLSv1.2,2102,Application Data
575,55.4419842,151.101.66.187,100.84.170.161,TCP,56,443  >  59747 [ACK] Seq=140206 Ack=189773 Win=5053 Len=0
576,55.443318,100.84.170.161,151.101.66.187,TLSv1.2,579,Application Data
577,55.4443727,151.101.66.187,100.84.170.161,TCP,56,443  >  59747 [ACK] Seq=140206 Ack=190304 Win=5053 Len=0
578,55.4446549,151.101.66.187,100.84.170.161,TLSv1.2,214,Application Data
579,55.4463351,151.101.66.187,100.84.170.161,TLSv1.2,124,Application Data
580,55.4464101,100.84.170.161,151.101.66.187,TCP,54,59747  >  443 [ACK] Seq=192877 Ack=140436 Win=4102 Len=0
581,55.4479154,151.101.66.187,100.84.170.161,TCP,56,443  >  59747 [ACK] Seq=140436 Ack=192352 Win=5061 Len=0
582,55.4500832,151.101.66.187,100.84.170.161,TLSv1.2,131,Application Data
583,55.4531456,151.101.66.187,100.84.170.161,TCP,56,443  >  59747 [ACK] Seq=140513 Ack=192877 Win=5061 Len=0
584,55.4559991,151.101.66.187,100.84.170.161,TLSv1.2,124,Application Data
585,55.4560645,100.84.170.161,151.101.66.187,TCP,54,59747  >  443 [ACK] Seq=192877 Ack=140583 Win=4102 Len=0
586,55.5166324,100.84.170.161,151.101.66.187,TLSv1.2,2102,Application Data
587,55.526434,151.101.66.187,100.84.170.161,TCP,56,443  >  59747 [ACK] Seq=140583 Ack=194925 Win=5069 Len=0
588,55.5293683,151.101.66.187,100.84.170.161,TLSv1.2,124,Application Data
589,55.557206,151.101.66.187,100.84.170.161,TCP,124,"[TCP Retransmission] 443  >  59747 [PSH, ACK] Seq=140583 Ack=194925 Win=5069 Len=70"
590,55.5572384,100.84.170.161,151.101.66.187,TCP,66,59747  >  443 [ACK] Seq=194925 Ack=140653 Win=4101 Len=0 SLE=140583 SRE=140653
591,55.5858982,100.84.170.161,151.101.66.187,TLSv1.2,578,Application Data
592,55.5955607,151.101.66.187,100.84.170.161,TCP,56,443  >  59747 [ACK] Seq=140653 Ack=195449 Win=5069 Len=0
593,55.59858,151.101.66.187,100.84.170.161,TLSv1.2,104,Application Data
594,55.6162666,100.84.170.161,151.101.66.187,TLSv1.2,2122,Application Data
595,55.6254112,151.101.66.187,100.84.170.161,TCP,56,443  >  59747 [ACK] Seq=140703 Ack=197517 Win=5077 Len=0
596,55.6285109,151.101.66.187,100.84.170.161,TLSv1.2,125,Application Data
597,55.6486196,100.84.170.161,151.101.66.187,TLSv1.2,593,Application Data
598,55.6578189,151.101.66.187,100.84.170.161,TCP,56,443  >  59747 [ACK] Seq=140774 Ack=198056 Win=5077 Len=0
599,55.662368,151.101.66.187,100.84.170.161,TLSv1.2,104,Application Data
600,55.6815777,100.84.170.161,151.101.66.187,TLSv1.2,2116,Application Data
601,55.6901906,151.101.66.187,100.84.170.161,TCP,56,443  >  59747 [ACK] Seq=140824 Ack=200118 Win=5085 Len=0
602,55.692752,151.101.66.187,100.84.170.161,TLSv1.2,98,Application Data
603,55.7312648,151.101.66.187,100.84.170.161,TCP,98,"[TCP Retransmission] 443  >  59747 [PSH, ACK] Seq=140824 Ack=200118 Win=5085 Len=44"
604,55.731305,100.84.170.161,151.101.66.187,TCP,66,59747  >  443 [ACK] Seq=200118 Ack=140868 Win=4101 Len=0 SLE=140824 SRE=140868
605,55.7857058,100.84.170.161,151.101.66.187,TLSv1.2,588,Application Data
606,55.7945217,151.101.66.187,100.84.170.161,TCP,56,443  >  59747 [ACK] Seq=140868 Ack=200652 Win=5085 Len=0
607,55.7981463,151.101.66.187,100.84.170.161,TLSv1.2,130,Application Data
608,55.8368348,151.101.66.187,100.84.170.161,TCP,130,"[TCP Retransmission] 443  >  59747 [PSH, ACK] Seq=140868 Ack=200652 Win=5085 Len=76"
609,55.8368809,100.84.170.161,151.101.66.187,TCP,66,59747  >  443 [ACK] Seq=200652 Ack=140944 Win=4100 Len=0 SLE=140868 SRE=140944
610,55.8729702,100.84.170.161,151.101.66.187,TLSv1.2,2138,Application Data
611,55.8731415,100.84.170.161,151.101.66.187,TLSv1.2,597,Application Data
612,55.8732393,100.84.170.161,151.101.66.187,TLSv1.2,2117,Application Data
613,55.8819983,151.101.66.187,100.84.170.161,TCP,56,443  >  59747 [ACK] Seq=140944 Ack=202736 Win=5093 Len=0
614,55.8823058,151.101.66.187,100.84.170.161,TCP,56,443  >  59747 [ACK] Seq=140944 Ack=205342 Win=5101 Len=0
615,55.8865649,151.101.66.187,100.84.170.161,TLSv1.2,125,Application Data
616,55.8914637,151.101.66.187,100.84.170.161,TLSv1.2,131,Application Data
617,55.891588,100.84.170.161,151.101.66.187,TCP,54,59747  >  443 [ACK] Seq=205342 Ack=141092 Win=4106 Len=0
618,55.8917082,151.101.66.187,100.84.170.161,TLSv1.2,130,Application Data
619,55.9376297,100.84.170.161,151.101.66.187,TCP,54,59747  >  443 [ACK] Seq=205342 Ack=141168 Win=4105 Len=0
620,55.9389361,151.101.66.187,100.84.170.161,TCP,130,"[TCP Spurious Retransmission] 443  >  59747 [PSH, ACK] Seq=141092 Ack=205342 Win=5101 Len=76"
621,55.9389903,100.84.170.161,151.101.66.187,TCP,66,[TCP Dup ACK 619#1] 59747  >  443 [ACK] Seq=205342 Ack=141168 Win=4105 Len=0 SLE=141092 SRE=141168
622,56.0482404,100.84.170.161,151.101.66.187,TLSv1.2,921,Application Data
623,56.0512948,100.84.170.161,151.101.66.187,TLSv1.2,1823,Application Data
624,56.053723,100.84.170.161,151.101.66.187,TLSv1.2,911,Application Data
625,56.0562581,100.84.170.161,151.101.66.187,TLSv1.2,1791,Application Data
626,56.0564331,100.84.170.161,151.101.66.187,TLSv1.2,907,Application Data
627,56.0573814,151.101.66.187,100.84.170.161,TCP,56,443  >  59747 [ACK] Seq=141168 Ack=206209 Win=5101 Len=0
628,56.0602948,151.101.66.187,100.84.170.161,TLSv1.2,130,Application Data
629,56.0626394,151.101.66.187,100.84.170.161,TCP,56,443  >  59747 [ACK] Seq=141244 Ack=208835 Win=5108 Len=0
630,56.0633219,151.101.66.187,100.84.170.161,TLSv1.2,130,Application Data
631,56.0633708,100.84.170.161,151.101.66.187,TCP,54,59747  >  443 [ACK] Seq=211425 Ack=141320 Win=4105 Len=0
632,56.0651009,151.101.66.187,100.84.170.161,TCP,56,443  >  59747 [ACK] Seq=141320 Ack=210572 Win=5108 Len=0
633,56.0652542,151.101.66.187,100.84.170.161,TLSv1.2,201,Application Data
634,56.0683293,151.101.66.187,100.84.170.161,TLSv1.2,124,Application Data
635,56.0683966,100.84.170.161,151.101.66.187,TCP,54,59747  >  443 [ACK] Seq=211425 Ack=141537 Win=4104 Len=0
636,56.0686029,151.101.66.187,100.84.170.161,TLSv1.2,258,Application Data
637,56.1128045,151.101.66.187,100.84.170.161,TCP,258,"[TCP Retransmission] 443  >  59747 [PSH, ACK] Seq=141537 Ack=211425 Win=5108 Len=204"
638,56.1128355,100.84.170.161,151.101.66.187,TCP,66,59747  >  443 [ACK] Seq=211425 Ack=141741 Win=4103 Len=0 SLE=141537 SRE=141741
639,59.0972699,100.84.170.161,151.101.66.187,TLSv1.2,1812,Application Data
640,59.1078661,151.101.66.187,100.84.170.161,TCP,56,443  >  59747 [ACK] Seq=141741 Ack=213183 Win=5108 Len=0
641,59.1672564,151.101.66.187,100.84.170.161,TLSv1.2,339,Application Data
642,59.1677071,151.101.66.187,100.84.170.161,TLSv1.2,357,Application Data
643,59.1677589,100.84.170.161,151.101.66.187,TCP,54,59747  >  443 [ACK] Seq=213183 Ack=142329 Win=4101 Len=0
644,59.1696302,100.84.170.161,151.101.66.187,TLSv1.2,89,Application Data
645,59.1789385,151.101.66.187,100.84.170.161,TCP,56,443  >  59747 [ACK] Seq=142329 Ack=213218 Win=5108 Len=0
