No.,Time,Source,Destination,Protocol,Length,Info
1,0.0,100.84.170.161,151.101.66.187,TLSv1.2,2555,Application Data
2,0.0001416,100.84.170.161,151.101.66.187,TLSv1.2,93,Application Data
3,0.0088098,151.101.66.187,100.84.170.161,TCP,56,443  >  59747 [ACK] Seq=1 Ack=2502 Win=1590 Len=0
4,0.0092933,151.101.66.187,100.84.170.161,TLSv1.2,93,Application Data
5,0.0118369,151.101.66.187,100.84.170.161,TLSv1.2,406,Application Data
6,0.0119052,100.84.170.161,151.101.66.187,TCP,54,59747  >  443 [ACK] Seq=2541 Ack=392 Win=511 Len=0
7,4.5929132,100.84.170.161,151.101.66.187,TCP,55,55359  >  443 [ACK] Seq=1 Ack=1 Win=513 Len=1 [TCP PDU reassembled in 9]
8,4.6037301,151.101.66.187,100.84.170.161,TCP,66,443  >  55359 [ACK] Seq=1 Ack=2 Win=281 Len=0 SLE=1 SRE=2
9,6.1651063,100.84.170.161,151.101.66.187,TLSv1.2,175,Ignored Unknown Record
10,6.1652321,100.84.170.161,151.101.66.187,TLSv1.2,93,Application Data
11,6.1739047,151.101.66.187,100.84.170.161,TCP,56,443  >  55359 [ACK] Seq=1 Ack=123 Win=281 Len=0
12,6.1742377,151.101.66.187,100.84.170.161,TCP,56,443  >  55359 [ACK] Seq=1 Ack=162 Win=281 Len=0
13,6.1744076,151.101.66.187,100.84.170.161,TLSv1.2,93,Application Data
14,6.1760797,151.101.66.187,100.84.170.161,TLSv1.2,266,Application Data
15,6.176136,100.84.170.161,151.101.66.187,TCP,54,55359  >  443 [ACK] Seq=162 Ack=252 Win=512 Len=0
16,6.1991908,100.84.170.161,151.101.66.187,TLSv1.2,1936,Application Data
17,6.2091957,151.101.66.187,100.84.170.161,TCP,56,443  >  59747 [ACK] Seq=392 Ack=4423 Win=1597 Len=0
18,6.2595341,151.101.66.187,100.84.170.161,TLSv1.2,1510,Application Data
19,6.2595341,151.101.66.187,100.84.170.161,TLSv1.2,1151,Application Data
20,6.2595341,151.101.66.187,100.84.170.161,TLSv1.2,1007,Application Data
21,6.259732,100.84.170.161,151.101.66.187,TCP,54,59747  >  443 [ACK] Seq=4423 Ack=3898 Win=513 Len=0
22,6.2606781,100.84.170.161,151.101.66.187,TLSv1.2,89,Application Data
23,6.2696661,151.101.66.187,100.84.170.161,TCP,56,443  >  59747 [ACK] Seq=3898 Ack=4458 Win=1597 Len=0
24,6.3470147,100.84.170.161,151.101.66.187,TLSv1.2,1021,Application Data
25,6.3557854,151.101.66.187,100.84.170.161,TCP,56,443  >  59747 [ACK] Seq=3898 Ack=5425 Win=1603 Len=0
26,6.3584804,151.101.66.187,100.84.170.161,TLSv1.2,261,Application Data
27,6.3645139,100.84.170.161,151.101.66.187,TLSv1.2,1683,Application Data
28,6.3688378,100.84.170.161,151.101.66.187,TLSv1.2,1058,Application Data
29,6.3740041,151.101.66.187,100.84.170.161,TCP,56,443  >  59747 [ACK] Seq=4105 Ack=7054 Win=1609 Len=0
30,6.3860079,100.84.170.161,151.101.66.187,TLSv1.2,1696,Application Data
31,6.4061537,100.84.170.161,151.101.66.187,TLSv1.2,1042,Application Data
32,6.4073285,100.84.170.161,151.101.66.187,TLSv1.2,1670,Application Data
33,6.4264666,151.101.66.187,100.84.170.161,TLSv1.2,196,"Application Data, Application Data"
34,6.4265256,100.84.170.161,151.101.66.187,TCP,54,59747  >  443 [ACK] Seq=12304 Ack=4247 Win=511 Len=0
35,6.4492462,151.101.66.187,100.84.170.161,TCP,125,"[TCP Spurious Retransmission] 443  >  59747 [PSH, ACK] Seq=4176 Ack=8058 Win=1615 Len=71"
36,6.4492838,100.84.170.161,151.101.66.187,TCP,66,[TCP Dup ACK 34#1] 59747  >  443 [ACK] Seq=12304 Ack=4247 Win=511 Len=0 SLE=4176 SRE=4247
37,6.4705568,100.84.170.161,151.101.66.187,TCP,1514,"[TCP Retransmission] 59747  >  443 [PSH, ACK] Seq=10844 Ack=4247 Win=511 Len=1460"
38,6.4733893,151.101.66.187,100.84.170.161,TCP,56,443  >  59747 [ACK] Seq=4247 Ack=9700 Win=1621 Len=0
39,6.4738437,151.101.66.187,100.84.170.161,TLSv1.2,135,Application Data
40,6.4971683,151.101.66.187,100.84.170.161,TCP,56,443  >  59747 [ACK] Seq=4328 Ack=12304 Win=1633 Len=0
41,6.4974372,151.101.66.187,100.84.170.161,TLSv1.2,346,Application Data
42,6.4974903,100.84.170.161,151.101.66.187,TCP,54,59747  >  443 [ACK] Seq=12304 Ack=4620 Win=510 Len=0
43,6.5131599,151.101.66.187,100.84.170.161,TCP,66,[TCP Dup ACK 40#1] 443  >  59747 [ACK] Seq=4620 Ack=12304 Win=1633 Len=0 SLE=10844 SRE=12304
44,6.513417,151.101.66.187,100.84.170.161,TCP,346,"[TCP Spurious Retransmission] 443  >  59747 [PSH, ACK] Seq=4328 Ack=12304 Win=1633 Len=292"
45,6.5134486,100.84.170.161,151.101.66.187,TCP,66,[TCP Dup ACK 42#1] 59747  >  443 [ACK] Seq=12304 Ack=4620 Win=510 Len=0 SLE=4328 SRE=4620
46,6.8193764,100.84.170.161,151.101.66.187,TLSv1.2,1057,Application Data
47,6.8248674,100.84.170.161,151.101.66.187,TLSv1.2,1704,Application Data
48,6.82806,151.101.66.187,100.84.170.161,TCP,56,443  >  59747 [ACK] Seq=4620 Ack=13307 Win=1639 Len=0
49,6.830888,151.101.66.187,100.84.170.161,TLSv1.2,104,Application Data
50,6.8336245,151.101.66.187,100.84.170.161,TCP,56,443  >  59747 [ACK] Seq=4670 Ack=14957 Win=1646 Len=0
51,6.8358737,151.101.66.187,100.84.170.161,TLSv1.2,125,Application Data
52,6.8359337,100.84.170.161,151.101.66.187,TCP,54,59747  >  443 [ACK] Seq=14957 Ack=4741 Win=509 Len=0
53,6.9898477,100.84.170.161,151.101.66.187,TLSv1.2,1058,Application Data
54,7.0000793,151.101.66.187,100.84.170.161,TCP,56,443  >  59747 [ACK] Seq=4741 Ack=15961 Win=1651 Len=0
55,7.0031534,151.101.66.187,100.84.170.161,TLSv1.2,98,Application Data
56,7.0327764,151.101.66.187,100.84.170.161,TCP,98,"[TCP Retransmission] 443  >  59747 [PSH, ACK] Seq=4741 Ack=15961 Win=1651 Len=44"
57,7.0328214,100.84.170.161,151.101.66.187,TCP,66,59747  >  443 [ACK] Seq=15961 Ack=4785 Win=509 Len=0 SLE=4741 SRE=4785
58,16.7000174,100.84.170.161,151.101.66.187,TLSv1.2,2407,Application Data
59,16.7095309,151.101.66.187,100.84.170.161,TCP,56,443  >  59747 [ACK] Seq=4785 Ack=18314 Win=1660 Len=0
60,16.7120452,151.101.66.187,100.84.170.161,TLSv1.2,468,Application Data
61,16.7409023,151.101.66.187,100.84.170.161,TCP,468,"[TCP Retransmission] 443  >  59747 [PSH, ACK] Seq=4785 Ack=18314 Win=1660 Len=414"
62,16.7409511,100.84.170.161,151.101.66.187,TCP,66,59747  >  443 [ACK] Seq=18314 Ack=5199 Win=508 Len=0 SLE=4785 SRE=5199
63,16.7457049,100.84.170.161,151.101.66.187,TLSv1.2,385,Application Data
64,16.7554788,151.101.66.187,100.84.170.161,TCP,56,443  >  59747 [ACK] Seq=5199 Ack=18645 Win=1666 Len=0
65,16.9595506,151.101.66.187,100.84.170.161,TLSv1.2,264,Application Data
66,16.9595506,151.101.66.187,100.84.170.161,TLSv1.2,16070,"Application Data, Application Data, Application Data, Application Data, Application Data, Application Data, Application Data, Application Data, Application Data, Application Data, Application Data"
67,16.9595506,151.101.66.187,100.84.170.161,TLSv1.2,695,Application Data
68,16.9595506,151.101.66.187,100.84.170.161,TLSv1.2,18982,"Application Data, Application Data, Application Data, Application Data, Application Data, Application Data, Application Data, Application Data, Application Data, Application Data, Application Data, Application Data, Application Data"
69,16.9595506,151.101.66.187,100.84.170.161,TLSv1.2,1320,"Application Data, Application Data"
70,16.9595506,151.101.66.187,100.84.170.161,TCP,1320,"[TCP Retransmission] 443  >  59747 [PSH, ACK] Seq=40994 Ack=18645 Win=1666 Len=1266"
71,16.9597356,100.84.170.161,151.101.66.187,TCP,66,59747  >  443 [ACK] Seq=18645 Ack=42260 Win=513 Len=0 SLE=40994 SRE=42260
72,16.9922157,100.84.170.161,151.101.66.187,TLSv1.2,89,Application Data
73,17.0010361,151.101.66.187,100.84.170.161,TCP,56,443  >  59747 [ACK] Seq=42260 Ack=18680 Win=1666 Len=0
74,17.2413659,100.84.170.161,151.101.66.187,TLSv1.2,1744,Application Data
75,17.2441364,100.84.170.161,151.101.66.187,TLSv1.2,597,Application Data
76,17.2442674,100.84.170.161,151.101.66.187,TLSv1.2,181,Application Data
77,17.2450429,100.84.170.161,151.101.66.187,TLSv1.2,164,Application Data
78,17.2453886,100.84.170.161,151.101.66.187,TLSv1.2,457,Application Data
79,17.2455349,100.84.170.161,151.101.66.187,TLSv1.2,2147,Application Data
80,17.251842,151.101.66.187,100.84.170.161,TCP,56,443  >  59747 [ACK] Seq=42260 Ack=20370 Win=1673 Len=0
81,17.2528074,151.101.66.187,100.84.170.161,TLSv1.2,192,Application Data
82,17.2532201,151.101.66.187,100.84.170.161,TCP,1510,443  >  59747 [ACK] Seq=42398 Ack=20913 Win=1678 Len=1456 [TCP PDU reassembled in 86]
83,17.2532724,100.84.170.161,151.101.66.187,TCP,54,59747  >  443 [ACK] Seq=23646 Ack=43854 Win=513 Len=0
84,17.2539474,151.101.66.187,100.84.170.161,TCP,10246,"443  >  59747 [PSH, ACK] Seq=43854 Ack=20913 Win=1678 Len=10192 [TCP PDU reassembled in 86]"
85,17.2540043,100.84.170.161,151.101.66.187,TCP,54,59747  >  443 [ACK] Seq=23646 Ack=54046 Win=513 Len=0
86,17.2551563,151.101.66.187,100.84.170.161,TLSv1.2,11702,Application Data
87,17.2552269,100.84.170.161,151.101.66.187,TCP,54,59747  >  443 [ACK] Seq=23646 Ack=65694 Win=513 Len=0
88,17.2566609,151.101.66.187,100.84.170.161,TCP,1510,443  >  59747 [ACK] Seq=65694 Ack=20913 Win=1678 Len=1456 [TCP PDU reassembled in 89]
89,17.2566609,151.101.66.187,100.84.170.161,TLSv1.2,202,Application Data
90,17.2566609,151.101.66.187,100.84.170.161,TLSv1.2,2966,Application Data
91,17.2566609,151.101.66.187,100.84.170.161,TLSv1.2,561,Application Data
92,17.2566609,151.101.66.187,100.84.170.161,TLSv1.2,1215,Application Data
93,17.2566609,151.101.66.187,100.84.170.161,TLSv1.2,11702,Application Data
94,17.2567703,100.84.170.161,151.101.66.187,TCP,54,59747  >  443 [ACK] Seq=23646 Ack=83526 Win=513 Len=0
95,17.2572529,151.101.66.187,100.84.170.161,TLSv1.2,11702,Application Data
96,17.2572889,100.84.170.161,151.101.66.187,TCP,54,59747  >  443 [ACK] Seq=23646 Ack=95174 Win=513 Len=0
97,17.2579326,151.101.66.187,100.84.170.161,TLSv1.2,11702,Application Data
98,17.2579804,100.84.170.161,151.101.66.187,TCP,54,59747  >  443 [ACK] Seq=23646 Ack=106822 Win=513 Len=0
99,17.258879,151.101.66.187,100.84.170.161,TLSv1.2,11702,"Application Data, Application Data"
100,17.25897,100.84.170.161,151.101.66.187,TCP,54,59747  >  443 [ACK] Seq=23646 Ack=118470 Win=513 Len=0
101,17.2596749,151.101.66.187,100.84.170.161,TCP,4422,"443  >  59747 [PSH, ACK] Seq=118470 Ack=23646 Win=1692 Len=4368 [TCP PDU reassembled in 106]"
102,17.2597399,100.84.170.161,151.101.66.187,TCP,54,59747  >  443 [ACK] Seq=23646 Ack=122838 Win=1026 Len=0
103,17.2625456,151.101.66.187,100.84.170.161,TCP,1510,443  >  59747 [ACK] Seq=122838 Ack=23646 Win=1692 Len=1456 [TCP PDU reassembled in 106]
104,17.2629391,151.101.66.187,100.84.170.161,TCP,1510,443  >  59747 [ACK] Seq=124294 Ack=23646 Win=1692 Len=1456 [TCP PDU reassembled in 106]
105,17.2629804,100.84.170.161,151.101.66.187,TCP,54,59747  >  443 [ACK] Seq=23646 Ack=125750 Win=1026 Len=0
106,17.2639349,151.101.66.187,100.84.170.161,TLSv1.2,17526,Application Data
107,17.2640002,100.84.170.161,151.101.66.187,TCP,54,59747  >  443 [ACK] Seq=23646 Ack=143222 Win=1026 Len=0
108,17.2658776,151.101.66.187,100.84.170.161,TLSv1.2,17526,Application Data
109,17.2659522,100.84.170.161,151.101.66.187,TCP,54,59747  >  443 [ACK] Seq=23646 Ack=160694 Win=1026 Len=0
110,17.2675123,151.101.66.187,100.84.170.161,TCP,1510,443  >  59747 [ACK] Seq=160694 Ack=23646 Win=1692 Len=1456 [TCP PDU reassembled in 113]
111,17.2679183,151.101.66.187,100.84.170.161,TCP,1510,443  >  59747 [ACK] Seq=162150 Ack=23646 Win=1692 Len=1456 [TCP PDU reassembled in 113]
112,17.2679601,100.84.170.161,151.101.66.187,TCP,54,59747  >  443 [ACK] Seq=23646 Ack=163606 Win=1026 Len=0
113,17.2692621,151.101.66.187,100.84.170.161,TLSv1.2,30630,"Application Data, Application Data, Application Data"
114,17.2692621,151.101.66.187,100.84.170.161,TLSv1.2,298,Application Data
115,17.269339,100.84.170.161,151.101.66.187,TCP,54,59747  >  443 [ACK] Seq=23646 Ack=194426 Win=1026 Len=0
116,17.3086669,100.84.170.161,151.101.66.187,TLSv1.2,466,Application Data
117,17.308937,100.84.170.161,151.101.66.187,TLSv1.2,2144,Application Data
118,17.3173443,151.101.66.187,100.84.170.161,TCP,56,443  >  59747 [ACK] Seq=194426 Ack=24058 Win=1698 Len=0
119,17.3183294,151.101.66.187,100.84.170.161,TLSv1.2,169,Application Data
120,17.3190547,151.101.66.187,100.84.170.161,TCP,1510,443  >  59747 [ACK] Seq=194541 Ack=26148 Win=1706 Len=1456 [TCP PDU reassembled in 122]
121,17.3191214,100.84.170.161,151.101.66.187,TCP,54,59747  >  443 [ACK] Seq=26148 Ack=195997 Win=1026 Len=0
122,17.3210461,151.101.66.187,100.84.170.161,TLSv1.2,39366,"Application Data, Application Data"
123,17.3211812,100.84.170.161,151.101.66.187,TCP,54,59747  >  443 [ACK] Seq=26148 Ack=235309 Win=1026 Len=0
124,17.3240365,151.101.66.187,100.84.170.161,TLSv1.2,24806,Application Data
125,17.3240365,151.101.66.187,100.84.170.161,TLSv1.2,216,"Application Data, Application Data"
126,17.3240365,151.101.66.187,100.84.170.161,TLSv1.2,26262,Application Data
127,17.3240365,151.101.66.187,100.84.170.161,TLSv1.2,1356,Application Data
128,17.3240365,151.101.66.187,100.84.170.161,TLSv1.2,10246,Application Data
129,17.3240365,151.101.66.187,100.84.170.161,TLSv1.2,763,Application Data
130,17.3241843,100.84.170.161,151.101.66.187,TCP,54,59747  >  443 [ACK] Seq=26148 Ack=298634 Win=1026 Len=0
131,17.3381341,100.84.170.161,151.101.66.187,TLSv1.2,464,Application Data
132,17.3400068,100.84.170.161,151.101.66.187,TLSv1.2,2161,Application Data
133,17.3472947,151.101.66.187,100.84.170.161,TCP,56,443  >  59747 [ACK] Seq=298634 Ack=26558 Win=1712 Len=0
134,17.3483508,151.101.66.187,100.84.170.161,TLSv1.2,404,Application Data
135,17.3503506,151.101.66.187,100.84.170.161,TLSv1.2,39366,"Application Data, Application Data"
136,17.3504412,100.84.170.161,151.101.66.187,TCP,54,59747  >  443 [ACK] Seq=28665 Ack=338296 Win=1026 Len=0
137,17.3526278,151.101.66.187,100.84.170.161,TLSv1.2,43734,"Application Data, Application Data, Application Data, Application Data"
138,17.3526278,151.101.66.187,100.84.170.161,TLSv1.2,71,Application Data
139,17.3526278,151.101.66.187,100.84.170.161,TLSv1.2,176,Application Data
140,17.3526278,151.101.66.187,100.84.170.161,TLSv1.2,910,Application Data
141,17.3528528,100.84.170.161,151.101.66.187,TCP,54,59747  >  443 [ACK] Seq=28665 Ack=382971 Win=1026 Len=0
142,17.3655343,100.84.170.161,151.101.66.187,TLSv1.2,386,Application Data
143,17.3685172,100.84.170.161,151.101.66.187,TLSv1.2,179,Application Data
144,17.3752531,151.101.66.187,100.84.170.161,TCP,56,443  >  59747 [ACK] Seq=382971 Ack=28997 Win=1726 Len=0
145,17.3767057,151.101.66.187,100.84.170.161,TLSv1.2,408,Application Data
146,17.3771118,151.101.66.187,100.84.170.161,TCP,1510,443  >  59747 [ACK] Seq=383325 Ack=28997 Win=1726 Len=1456 [TCP PDU reassembled in 148]
147,17.3771761,100.84.170.161,151.101.66.187,TCP,54,59747  >  443 [ACK] Seq=29122 Ack=384781 Win=1026 Len=0
148,17.3787514,151.101.66.187,100.84.170.161,TLSv1.2,36454,"Application Data, Application Data"
149,17.37885,100.84.170.161,151.101.66.187,TCP,54,59747  >  443 [ACK] Seq=29122 Ack=421181 Win=1026 Len=0
150,17.3823988,151.101.66.187,100.84.170.161,TLSv1.2,34998,"Application Data, Application Data, Application Data"
151,17.3823988,151.101.66.187,100.84.170.161,TLSv1.2,1415,Application Data
152,17.3824847,100.84.170.161,151.101.66.187,TCP,54,59747  >  443 [ACK] Seq=29122 Ack=457486 Win=1026 Len=0
153,17.3874756,151.101.66.187,100.84.170.161,TCP,56,443  >  59747 [ACK] Seq=457486 Ack=29122 Win=1726 Len=0
154,17.3874756,151.101.66.187,100.84.170.161,TLSv1.2,126,Application Data
155,17.3874756,151.101.66.187,100.84.170.161,TLSv1.2,64118,"Application Data, Application Data, Application Data"
156,17.3874756,151.101.66.187,100.84.170.161,TCP,1510,443  >  59747 [ACK] Seq=521622 Ack=29122 Win=1726 Len=1456 [TCP PDU reassembled in 157]
157,17.3874756,151.101.66.187,100.84.170.161,TLSv1.2,216,"Application Data, Application Data"
158,17.3874756,151.101.66.187,100.84.170.161,TLSv1.2,40822,"Application Data, Application Data"
159,17.3874756,151.101.66.187,100.84.170.161,TLSv1.2,24806,Application Data
160,17.3876763,100.84.170.161,151.101.66.187,TCP,54,59747  >  443 [ACK] Seq=29122 Ack=588760 Win=1956 Len=0
161,17.387956,100.84.170.161,151.101.66.187,TCP,54,[TCP Window Update] 59747  >  443 [ACK] Seq=29122 Ack=588760 Win=2053 Len=0
162,17.3888052,151.101.66.187,100.84.170.161,TLSv1.2,216,"Application Data, Application Data"
163,17.3888052,151.101.66.187,100.84.170.161,TLSv1.2,36454,"Application Data, Application Data"
164,17.3889125,100.84.170.161,151.101.66.187,TCP,54,59747  >  443 [ACK] Seq=29122 Ack=625322 Win=2053 Len=0
165,17.3911109,151.101.66.187,100.84.170.161,TLSv1.2,45190,"Application Data, Application Data, Application Data"
166,17.3911926,100.84.170.161,151.101.66.187,TCP,54,59747  >  443 [ACK] Seq=29122 Ack=670458 Win=2053 Len=0
167,17.3919737,151.101.66.187,100.84.170.161,TLSv1.2,17526,"Application Data, Application Data"
168,17.3919737,151.101.66.187,100.84.170.161,TLSv1.2,1131,Application Data
169,17.3920345,100.84.170.161,151.101.66.187,TCP,54,59747  >  443 [ACK] Seq=29122 Ack=689007 Win=2053 Len=0
170,17.4372453,100.84.170.161,151.101.66.187,TLSv1.2,295,Application Data
171,17.4375815,100.84.170.161,151.101.66.187,TLSv1.2,2176,Application Data
172,17.4384487,100.84.170.161,151.101.66.187,TLSv1.2,271,Application Data
173,17.4413487,100.84.170.161,151.101.66.187,TLSv1.2,354,Application Data
174,17.4432075,100.84.170.161,151.101.66.187,TLSv1.2,2143,Application Data
175,17.443502,100.84.170.161,151.101.66.187,TLSv1.2,466,Application Data
176,17.4463584,151.101.66.187,100.84.170.161,TCP,56,443  >  59747 [ACK] Seq=689007 Ack=31485 Win=1734 Len=0
177,17.4470116,151.101.66.187,100.84.170.161,TLSv1.2,121,Application Data
178,17.4473439,151.101.66.187,100.84.170.161,TLSv1.2,1084,Application Data
179,17.4473819,100.84.170.161,151.101.66.187,TCP,54,59747  >  443 [ACK] Seq=34503 Ack=690104 Win=2048 Len=0
180,17.4477639,151.101.66.187,100.84.170.161,TLSv1.2,122,Application Data
181,17.4489195,151.101.66.187,100.84.170.161,TCP,1510,443  >  59747 [ACK] Seq=690172 Ack=31702 Win=1734 Len=1456 [TCP PDU reassembled in 183]
182,17.4489726,100.84.170.161,151.101.66.187,TCP,54,59747  >  443 [ACK] Seq=34503 Ack=691628 Win=2053 Len=0
183,17.4521408,151.101.66.187,100.84.170.161,TLSv1.2,64118,"Application Data, Application Data, Application Data"
184,17.4521408,151.101.66.187,100.84.170.161,TLSv1.2,216,"Application Data, Application Data"
185,17.4521408,151.101.66.187,100.84.170.161,TLSv1.2,24806,Application Data
186,17.4521408,151.101.66.187,100.84.170.161,TLSv1.2,1473,Application Data
187,17.4522976,100.84.170.161,151.101.66.187,TCP,54,59747  >  443 [ACK] Seq=34503 Ack=782025 Win=2053 Len=0
188,17.4555891,151.101.66.187,100.84.170.161,TCP,56,443  >  59747 [ACK] Seq=782025 Ack=32002 Win=1740 Len=0
189,17.4555891,151.101.66.187,100.84.170.161,TCP,16070,443  >  59747 [ACK] Seq=782025 Ack=32002 Win=1740 Len=16016 [TCP PDU reassembled in 190]
190,17.4555891,151.101.66.187,100.84.170.161,TLSv1.2,102,Application Data
191,17.4555891,151.101.66.187,100.84.170.161,TLSv1.2,64118,"Application Data, Application Data, Application Data"
192,17.4555891,151.101.66.187,100.84.170.161,TLSv1.2,8790,"Application Data, Application Data"
193,17.4555891,151.101.66.187,100.84.170.161,TLSv1.2,1336,Application Data
194,17.4555891,151.101.66.187,100.84.170.161,TCP,56,443  >  59747 [ACK] Seq=872171 Ack=34503 Win=1754 Len=0
195,17.4557573,100.84.170.161,151.101.66.187,TCP,54,59747  >  443 [ACK] Seq=34503 Ack=872171 Win=2053 Len=0
196,17.4580903,151.101.66.187,100.84.170.161,TLSv1.2,199,Application Data
197,17.4580903,151.101.66.187,100.84.170.161,TLSv1.2,52470,"Application Data, Application Data, Application Data"
198,17.4580903,151.101.66.187,100.84.170.161,TLSv1.2,1346,Application Data
199,17.4580903,151.101.66.187,100.84.170.161,TCP,8790,443  >  59747 [ACK] Seq=926024 Ack=34503 Win=1754 Len=8736 [TCP PDU reassembled in 200]
200,17.4580903,151.101.66.187,100.84.170.161,TLSv1.2,1118,Application Data
201,17.4582121,100.84.170.161,151.101.66.187,TCP,54,59747  >  443 [ACK] Seq=34503 Ack=935824 Win=2053 Len=0
202,17.4608651,100.84.170.161,151.101.66.187,TLSv1.2,2167,Application Data
203,17.467605,100.84.170.161,151.101.66.187,TLSv1.2,463,Application Data
204,17.4695202,151.101.66.187,100.84.170.161,TCP,56,443  >  59747 [ACK] Seq=935824 Ack=36616 Win=1762 Len=0
205,17.4704541,151.101.66.187,100.84.170.161,TLSv1.2,453,Application Data
206,17.4707783,151.101.66.187,100.84.170.161,TCP,1510,443  >  59747 [ACK] Seq=936223 Ack=36616 Win=1762 Len=1456 [TCP PDU reassembled in 209]
207,17.4708211,100.84.170.161,151.101.66.187,TCP,54,59747  >  443 [ACK] Seq=37025 Ack=937679 Win=2053 Len=0
208,17.4714018,151.101.66.187,100.84.170.161,TCP,7334,443  >  59747 [ACK] Seq=937679 Ack=36616 Win=1762 Len=7280 [TCP PDU reassembled in 209]
209,17.4714018,151.101.66.187,100.84.170.161,TLSv1.2,996,Application Data
210,17.4714719,100.84.170.161,151.101.66.187,TCP,54,59747  >  443 [ACK] Seq=37025 Ack=945901 Win=2053 Len=0
211,17.4760317,151.101.66.187,100.84.170.161,TCP,56,443  >  59747 [ACK] Seq=945901 Ack=37025 Win=1768 Len=0
212,17.4782926,151.101.66.187,100.84.170.161,TLSv1.2,227,Application Data
213,17.4791443,151.101.66.187,100.84.170.161,TCP,1510,443  >  59747 [ACK] Seq=946074 Ack=37025 Win=1768 Len=1456 [TCP PDU reassembled in 216]
214,17.4792159,100.84.170.161,151.101.66.187,TCP,54,59747  >  443 [ACK] Seq=37025 Ack=947530 Win=2053 Len=0
215,17.4793866,100.84.170.161,151.101.66.187,TLSv1.2,2159,Application Data
216,17.4822768,151.101.66.187,100.84.170.161,TLSv1.2,64118,"Application Data, Application Data, Application Data"
217,17.4822768,151.101.66.187,100.84.170.161,TLSv1.2,17526,"Application Data, Application Data, Application Data"
218,17.4822768,151.101.66.187,100.84.170.161,TLSv1.2,1118,Application Data
219,17.4824012,100.84.170.161,151.101.66.187,TCP,54,59747  >  443 [ACK] Seq=39130 Ack=1030130 Win=2053 Len=0
220,17.4871732,100.84.170.161,151.101.66.187,TLSv1.2,475,Application Data
221,17.4907757,151.101.66.187,100.84.170.161,TCP,56,443  >  59747 [ACK] Seq=1030130 Ack=39130 Win=1776 Len=0
222,17.4957818,151.101.66.187,100.84.170.161,TCP,56,443  >  59747 [ACK] Seq=1030130 Ack=39551 Win=1782 Len=0
223,17.5306332,100.84.170.161,151.101.66.187,TLSv1.2,2174,Application Data
224,17.5401502,151.101.66.187,100.84.170.161,TCP,56,443  >  59747 [ACK] Seq=1030130 Ack=41671 Win=1790 Len=0
225,17.5422156,151.101.66.187,100.84.170.161,TLSv1.2,235,Application Data
226,17.5425829,151.101.66.187,100.84.170.161,TCP,1510,443  >  59747 [ACK] Seq=1030311 Ack=41671 Win=1790 Len=1456 [TCP PDU reassembled in 229]
227,17.5426374,100.84.170.161,151.101.66.187,TCP,54,59747  >  443 [ACK] Seq=41671 Ack=1031767 Win=2053 Len=0
228,17.5519217,151.101.66.187,100.84.170.161,TCP,14614,443  >  59747 [ACK] Seq=1031767 Ack=41671 Win=1790 Len=14560 [TCP PDU reassembled in 229]
229,17.5519217,151.101.66.187,100.84.170.161,TLSv1.2,475,"Application Data, Application Data"
230,17.5519217,151.101.66.187,100.84.170.161,TLSv1.2,32086,Application Data
231,17.5519217,151.101.66.187,100.84.170.161,TLSv1.2,874,"Application Data, Application Data"
232,17.5519217,151.101.66.187,100.84.170.161,TCP,14614,443  >  59747 [ACK] Seq=1079600 Ack=41671 Win=1790 Len=14560 [TCP PDU reassembled in 233]
233,17.5519217,151.101.66.187,100.84.170.161,TLSv1.2,933,Application Data
234,17.5519217,151.101.66.187,100.84.170.161,TCP,16070,443  >  59747 [ACK] Seq=1095039 Ack=41671 Win=1790 Len=16016 [TCP PDU reassembled in 235]
235,17.5519217,151.101.66.187,100.84.170.161,TLSv1.2,475,"Application Data, Application Data"
236,17.5519217,151.101.66.187,100.84.170.161,TLSv1.2,32086,"Application Data, Application Data"
237,17.5519217,151.101.66.187,100.84.170.161,TLSv1.2,896,"Application Data, Application Data"
238,17.5519217,151.101.66.187,100.84.170.161,TCP,16070,443  >  59747 [ACK] Seq=1144350 Ack=41671 Win=1790 Len=16016 [TCP PDU reassembled in 239]
239,17.5519217,151.101.66.187,100.84.170.161,TLSv1.2,475,"Application Data, Application Data"
240,17.5519217,151.101.66.187,100.84.170.161,TCP,16070,443  >  59747 [ACK] Seq=1160787 Ack=41671 Win=1790 Len=16016 [TCP PDU reassembled in 241]
241,17.5519217,151.101.66.187,100.84.170.161,TLSv1.2,475,"Application Data, Application Data"
242,17.5519217,151.101.66.187,100.84.170.161,TLSv1.2,33542,"Application Data, Application Data, Application Data, Application Data"
243,17.5522647,100.84.170.161,151.101.66.187,TCP,54,59747  >  443 [ACK] Seq=41671 Ack=1210712 Win=2053 Len=0
244,17.5544606,100.84.170.161,151.101.66.187,TLSv1.2,531,Application Data
245,17.5569906,151.101.66.187,100.84.170.161,TCP,14614,443  >  59747 [ACK] Seq=1210712 Ack=41671 Win=1790 Len=14560 [TCP PDU reassembled in 246]
246,17.5569906,151.101.66.187,100.84.170.161,TLSv1.2,1317,"Application Data, Application Data"
247,17.5569906,151.101.66.187,100.84.170.161,TLSv1.2,64118,"Application Data, Application Data, Application Data, Application Data, Application Data, Application Data"
248,17.5569906,151.101.66.187,100.84.170.161,TLSv1.2,64118,"Application Data, Application Data, Application Data, Application Data, Application Data, Application Data, Application Data"
249,17.5569906,151.101.66.187,100.84.170.161,TLSv1.2,36454,"Application Data, Application Data, Application Data, Application Data, Application Data"
250,17.5571678,100.84.170.161,151.101.66.187,TCP,54,59747  >  443 [ACK] Seq=42148 Ack=1391063 Win=2053 Len=0
251,17.5573861,151.101.66.187,100.84.170.161,TCP,4422,443  >  59747 [ACK] Seq=1391063 Ack=41671 Win=1790 Len=4368 [TCP PDU reassembled in 254]
252,17.5574293,100.84.170.161,151.101.66.187,TCP,54,59747  >  443 [ACK] Seq=42148 Ack=1395431 Win=2036 Len=0
253,17.5584692,100.84.170.161,151.101.66.187,TCP,54,[TCP Window Update] 59747  >  443 [ACK] Seq=42148 Ack=1395431 Win=2053 Len=0
254,17.5635889,151.101.66.187,100.84.170.161,TLSv1.2,64118,"Application Data, Application Data, Application Data, Application Data, Application Data, Application Data, Application Data"
255,17.5635889,151.101.66.187,100.84.170.161,TLSv1.2,64118,"Application Data, Application Data, Application Data, Application Data, Application Data, Application Data"
256,17.5635889,151.101.66.187,100.84.170.161,TLSv1.2,32086,"Application Data, Application Data, Application Data"
257,17.5635889,151.101.66.187,100.84.170.161,TCP,161,"443  >  59747 [PSH, ACK] Seq=1555591 Ack=41671 Win=1790 Len=107 [TCP PDU reassembled in 267]"
258,17.5637595,100.84.170.161,151.101.66.187,TCP,54,59747  >  443 [ACK] Seq=42148 Ack=1555698 Win=4106 Len=0
259,17.5640508,151.101.66.187,100.84.170.161,TCP,1510,443  >  59747 [ACK] Seq=1555698 Ack=41671 Win=1790 Len=1456 [TCP PDU reassembled in 267]
260,17.5640508,151.101.66.187,100.84.170.161,TCP,235,"443  >  59747 [PSH, ACK] Seq=1557154 Ack=41671 Win=1790 Len=181 [TCP PDU reassembled in 267]"
261,17.564105,100.84.170.161,151.101.66.187,TCP,54,59747  >  443 [ACK] Seq=42148 Ack=1557335 Win=4099 Len=0
262,17.5648831,100.84.170.161,151.101.66.187,TCP,54,[TCP Window Update] 59747  >  443 [ACK] Seq=42148 Ack=1557335 Win=4106 Len=0
263,17.5662339,151.101.66.187,100.84.170.161,TCP,1510,443  >  59747 [ACK] Seq=1557335 Ack=42148 Win=1796 Len=1456 [TCP PDU reassembled in 267]
264,17.5666448,151.101.66.187,100.84.170.161,TCP,1510,443  >  59747 [ACK] Seq=1558791 Ack=42148 Win=1796 Len=1456 [TCP PDU reassembled in 267]
265,17.5667303,100.84.170.161,151.101.66.187,TCP,54,59747  >  443 [ACK] Seq=42148 Ack=1560247 Win=4106 Len=0
266,17.5714909,100.84.170.161,151.101.66.187,TLSv1.2,2276,Application Data
267,17.5753432,151.101.66.187,100.84.170.161,TLSv1.2,49558,"Application Data, Application Data, Application Data, Application Data"
268,17.5753432,151.101.66.187,100.84.170.161,TCP,1222,"443  >  59747 [PSH, ACK] Seq=1609751 Ack=42148 Win=1796 Len=1168 [TCP PDU reassembled in 269]"
269,17.5753432,151.101.66.187,100.84.170.161,TLSv1.2,64118,"Application Data, Application Data, Application Data, Application Data, Application Data"
270,17.5753432,151.101.66.187,100.84.170.161,TLSv1.2,64118,"Application Data, Application Data, Application Data, Application Data, Application Data"
271,17.5753432,151.101.66.187,100.84.170.161,TCP,1510,443  >  59747 [ACK] Seq=1739047 Ack=42148 Win=1796 Len=1456 [TCP PDU reassembled in 274]
272,17.5755171,100.84.170.161,151.101.66.187,TCP,54,59747  >  443 [ACK] Seq=44370 Ack=1740503 Win=4106 Len=0
273,17.5816011,100.84.170.161,151.101.66.187,TLSv1.2,400,Application Data
274,17.582466,151.101.66.187,100.84.170.161,TLSv1.2,64118,"Application Data, Application Data, Application Data, Application Data, Application Data"
275,17.582466,151.101.66.187,100.84.170.161,TLSv1.2,64118,"Application Data, Application Data, Application Data, Application Data, Application Data, Application Data"
276,17.582466,151.101.66.187,100.84.170.161,TLSv1.2,51014,"Application Data, Application Data, Application Data, Application Data, Application Data, Application Data"
277,17.5826415,100.84.170.161,151.101.66.187,TCP,54,59747  >  443 [ACK] Seq=44716 Ack=1919591 Win=4106 Len=0
278,17.5883508,151.101.66.187,100.84.170.161,TCP,1462,"443  >  59747 [PSH, ACK] Seq=1919591 Ack=42148 Win=1796 Len=1408 [TCP PDU reassembled in 279]"
279,17.5883508,151.101.66.187,100.84.170.161,TLSv1.2,64118,"Application Data, Application Data, Application Data, Application Data, Application Data, Application Data"
280,17.5883508,151.101.66.187,100.84.170.161,TLSv1.2,64118,"Application Data, Application Data, Application Data, Application Data, Application Data"
281,17.5883508,151.101.66.187,100.84.170.161,TLSv1.2,49558,"Application Data, Application Data, Application Data, Application Data"
282,17.588596,100.84.170.161,151.101.66.187,TCP,54,59747  >  443 [ACK] Seq=44716 Ack=2098631 Win=4106 Len=0
283,17.5941733,151.101.66.187,100.84.170.161,TLSv1.2,64118,"Application Data, Application Data, Application Data, Application Data"
284,17.5941733,151.101.66.187,100.84.170.161,TLSv1.2,64118,"Application Data, Application Data, Application Data, Application Data, Application Data"
285,17.5941733,151.101.66.187,100.84.170.161,TLSv1.2,51014,"Application Data, Application Data, Application Data, Application Data"
286,17.5943311,100.84.170.161,151.101.66.187,TCP,54,59747  >  443 [ACK] Seq=44716 Ack=2277719 Win=4106 Len=0
287,17.5950793,151.101.66.187,100.84.170.161,TLSv1.2,21894,"Application Data, Application Data"
288,17.5951406,100.84.170.161,151.101.66.187,TCP,54,59747  >  443 [ACK] Seq=44716 Ack=2299559 Win=4106 Len=0
289,17.5961396,100.84.170.161,151.101.66.187,TCP,1514,"[TCP Retransmission] 59747  >  443 [PSH, ACK] Seq=43256 Ack=2299559 Win=4106 Len=1460"
290,17.5995159,151.101.66.187,100.84.170.161,TLSv1.2,64118,"Application Data, Application Data, Application Data, Application Data, Application Data"
291,17.5995159,151.101.66.187,100.84.170.161,TLSv1.2,45190,"Application Data, Application Data, Application Data"
292,17.5995159,151.101.66.187,100.84.170.161,TLSv1.2,597,"Application Data, Application Data"
293,17.5996592,100.84.170.161,151.101.66.187,TCP,54,59747  >  443 [ACK] Seq=44716 Ack=2409302 Win=4106 Len=0
294,17.6023709,151.101.66.187,100.84.170.161,TCP,56,443  >  59747 [ACK] Seq=2409302 Ack=44370 Win=1807 Len=0
295,17.6027229,151.101.66.187,100.84.170.161,TCP,56,443  >  59747 [ACK] Seq=2409302 Ack=44716 Win=1813 Len=0
296,17.6068424,151.101.66.187,100.84.170.161,TLSv1.2,459,Application Data
297,17.6071683,151.101.66.187,100.84.170.161,TCP,1510,443  >  59747 [ACK] Seq=2409707 Ack=44716 Win=1813 Len=1456 [TCP PDU reassembled in 300]
298,17.6072405,100.84.170.161,151.101.66.187,TCP,54,59747  >  443 [ACK] Seq=44716 Ack=2411163 Win=4106 Len=0
299,17.6128169,151.101.66.187,100.84.170.161,TCP,14614,443  >  59747 [ACK] Seq=2411163 Ack=44716 Win=1813 Len=14560 [TCP PDU reassembled in 300]
300,17.6128169,151.101.66.187,100.84.170.161,TLSv1.2,475,"Application Data, Application Data"
301,17.6128169,151.101.66.187,100.84.170.161,TLSv1.2,32086,Application Data
302,17.6128169,151.101.66.187,100.84.170.161,TLSv1.2,874,"Application Data, Application Data"
303,17.6128169,151.101.66.187,100.84.170.161,TCP,14614,443  >  59747 [ACK] Seq=2458996 Ack=44716 Win=1813 Len=14560 [TCP PDU reassembled in 304]
304,17.6128169,151.101.66.187,100.84.170.161,TLSv1.2,949,Application Data
305,17.6128169,151.101.66.187,100.84.170.161,TLSv1.2,64118,"Application Data, Application Data, Application Data"
306,17.6128169,151.101.66.187,100.84.170.161,TCP,1510,443  >  59747 [ACK] Seq=2538515 Ack=44716 Win=1813 Len=1456 [TCP PDU reassembled in 307]
307,17.6128169,151.101.66.187,100.84.170.161,TLSv1.2,216,"Application Data, Application Data"
308,17.6128169,151.101.66.187,100.84.170.161,TLSv1.2,32086,Application Data
309,17.6128169,151.101.66.187,100.84.170.161,TLSv1.2,1288,"Application Data, Application Data"
310,17.6128169,151.101.66.187,100.84.170.161,TCP,66,[TCP Dup ACK 295#1] 443  >  59747 [ACK] Seq=2573399 Ack=44716 Win=1813 Len=0 SLE=43256 SRE=44716
311,17.6130931,100.84.170.161,151.101.66.187,TCP,54,59747  >  443 [ACK] Seq=44716 Ack=2573399 Win=4106 Len=0
312,17.6280082,100.84.170.161,151.101.66.187,TLSv1.2,2291,Application Data
313,17.6375322,151.101.66.187,100.84.170.161,TCP,56,443  >  59747 [ACK] Seq=2573399 Ack=46953 Win=1821 Len=0
314,17.6435216,100.84.170.161,151.101.66.187,TLSv1.2,436,Application Data
315,17.6529044,151.101.66.187,100.84.170.161,TCP,56,443  >  59747 [ACK] Seq=2573399 Ack=47335 Win=1827 Len=0
316,17.6542882,151.101.66.187,100.84.170.161,TCP,1510,443  >  59747 [ACK] Seq=2573399 Ack=47335 Win=1827 Len=1456 [TCP PDU reassembled in 317]
317,17.6545958,151.101.66.187,100.84.170.161,TLSv1.2,639,Application Data
318,17.6546412,100.84.170.161,151.101.66.187,TCP,54,59747  >  443 [ACK] Seq=47335 Ack=2575440 Win=4106 Len=0
319,17.6596133,100.84.170.161,151.101.66.187,TLSv1.2,2125,Application Data
320,17.6689091,151.101.66.187,100.84.170.161,TCP,56,443  >  59747 [ACK] Seq=2575440 Ack=49406 Win=1835 Len=0
321,17.6698976,151.101.66.187,100.84.170.161,TCP,1510,443  >  59747 [ACK] Seq=2575440 Ack=49406 Win=1835 Len=1456 [TCP PDU reassembled in 322]
322,17.6701667,151.101.66.187,100.84.170.161,TLSv1.2,566,Application Data
323,17.6702146,100.84.170.161,151.101.66.187,TCP,54,59747  >  443 [ACK] Seq=49406 Ack=2577408 Win=4106 Len=0
324,17.6741703,100.84.170.161,151.101.66.187,TLSv1.2,437,Application Data
325,17.6832766,151.101.66.187,100.84.170.161,TCP,56,443  >  59747 [ACK] Seq=2577408 Ack=49789 Win=1841 Len=0
326,17.6848834,151.101.66.187,100.84.170.161,TLSv1.2,772,Application Data
327,17.6862143,151.101.66.187,100.84.170.161,TLSv1.2,130,Application Data
328,17.6862777,100.84.170.161,151.101.66.187,TCP,54,59747  >  443 [ACK] Seq=49789 Ack=2578202 Win=4103 Len=0
329,17.6882738,100.84.170.161,151.101.66.187,TLSv1.2,2123,Application Data
330,17.6967878,151.101.66.187,100.84.170.161,TCP,56,443  >  59747 [ACK] Seq=2578202 Ack=51858 Win=1849 Len=0
331,17.6979125,151.101.66.187,100.84.170.161,TLSv1.2,174,Application Data
332,17.698346,151.101.66.187,100.84.170.161,TCP,1510,443  >  59747 [ACK] Seq=2578322 Ack=51858 Win=1849 Len=1456 [TCP PDU reassembled in 335]
333,17.6983934,100.84.170.161,151.101.66.187,TCP,54,59747  >  443 [ACK] Seq=51858 Ack=2579778 Win=4106 Len=0
334,17.6987369,151.101.66.187,100.84.170.161,TCP,1510,443  >  59747 [ACK] Seq=2579778 Ack=51858 Win=1849 Len=1456 [TCP PDU reassembled in 335]
335,17.6998678,151.101.66.187,100.84.170.161,TLSv1.2,23350,Application Data
336,17.6998678,151.101.66.187,100.84.170.161,TLSv1.2,365,Application Data
337,17.6999677,100.84.170.161,151.101.66.187,TCP,54,59747  >  443 [ACK] Seq=51858 Ack=2604841 Win=4106 Len=0
338,17.7237841,151.101.66.187,100.84.170.161,TLSv1.2,130,Application Data
339,17.7445389,100.84.170.161,151.101.66.187,TLSv1.2,494,Application Data
340,17.7531896,151.101.66.187,100.84.170.161,TCP,56,443  >  59747 [ACK] Seq=2604917 Ack=52298 Win=1855 Len=0
341,17.7565102,151.101.66.187,100.84.170.161,TLSv1.2,236,Application Data
342,17.7568953,151.101.66.187,100.84.170.161,TCP,1510,443  >  59747 [ACK] Seq=2605099 Ack=52298 Win=1855 Len=1456 [TCP PDU reassembled in 345]
343,17.7569455,100.84.170.161,151.101.66.187,TCP,54,59747  >  443 [ACK] Seq=52298 Ack=2606555 Win=4106 Len=0
344,17.771519,151.101.66.187,100.84.170.161,TCP,14614,443  >  59747 [ACK] Seq=2606555 Ack=52298 Win=1855 Len=14560 [TCP PDU reassembled in 345]
345,17.771519,151.101.66.187,100.84.170.161,TLSv1.2,475,"Application Data, Application Data"
346,17.771519,151.101.66.187,100.84.170.161,TLSv1.2,32086,Application Data
347,17.771519,151.101.66.187,100.84.170.161,TLSv1.2,874,"Application Data, Application Data"
348,17.771519,151.101.66.187,100.84.170.161,TCP,13158,443  >  59747 [ACK] Seq=2654388 Ack=52298 Win=1855 Len=13104 [TCP PDU reassembled in 349]
349,17.771519,151.101.66.187,100.84.170.161,TLSv1.2,1292,Application Data
350,17.771519,151.101.66.187,100.84.170.161,TCP,16070,443  >  59747 [ACK] Seq=2668730 Ack=52298 Win=1855 Len=16016 [TCP PDU reassembled in 351]
351,17.771519,151.101.66.187,100.84.170.161,TLSv1.2,475,"Application Data, Application Data"
352,17.771519,151.101.66.187,100.84.170.161,TLSv1.2,32086,"Application Data, Application Data"
353,17.771519,151.101.66.187,100.84.170.161,TLSv1.2,896,"Application Data, Application Data"
354,17.771519,151.101.66.187,100.84.170.161,TCP,16070,443  >  59747 [ACK] Seq=2718041 Ack=52298 Win=1855 Len=16016 [TCP PDU reassembled in 355]
355,17.771519,151.101.66.187,100.84.170.161,TLSv1.2,475,"Application Data, Application Data"
356,17.771519,151.101.66.187,100.84.170.161,TCP,16070,443  >  59747 [ACK] Seq=2734478 Ack=52298 Win=1855 Len=16016 [TCP PDU reassembled in 357]
357,17.771519,151.101.66.187,100.84.170.161,TLSv1.2,475,"Application Data, Application Data"
358,17.771519,151.101.66.187,100.84.170.161,TLSv1.2,32086,"Application Data, Application Data"
359,17.771519,151.101.66.187,100.84.170.161,TLSv1.2,896,"Application Data, Application Data"
360,17.771519,151.101.66.187,100.84.170.161,TCP,1510,443  >  59747 [ACK] Seq=2783789 Ack=52298 Win=1855 Len=1456 [TCP PDU reassembled in 363]
361,17.7719864,100.84.170.161,151.101.66.187,TCP,54,59747  >  443 [ACK] Seq=52298 Ack=2785245 Win=4106 Len=0
362,17.7767701,151.101.66.187,100.84.170.161,TCP,14614,443  >  59747 [ACK] Seq=2785245 Ack=52298 Win=1855 Len=14560 [TCP PDU reassembled in 363]
363,17.7767701,151.101.66.187,100.84.170.161,TLSv1.2,475,"Application Data, Application Data"
364,17.7767701,151.101.66.187,100.84.170.161,TCP,16070,443  >  59747 [ACK] Seq=2800226 Ack=52298 Win=1855 Len=16016 [TCP PDU reassembled in 365]
365,17.7767701,151.101.66.187,100.84.170.161,TLSv1.2,475,"Application Data, Application Data"
366,17.7767701,151.101.66.187,100.84.170.161,TLSv1.2,32086,Application Data
367,17.7767701,151.101.66.187,100.84.170.161,TLSv1.2,874,"Application Data, Application Data"
368,17.7767701,151.101.66.187,100.84.170.161,TCP,16070,443  >  59747 [ACK] Seq=2849515 Ack=52298 Win=1855 Len=16016 [TCP PDU reassembled in 369]
369,17.7767701,151.101.66.187,100.84.170.161,TLSv1.2,475,"Application Data, Application Data"
370,17.7767701,151.101.66.187,100.84.170.161,TCP,16070,443  >  59747 [ACK] Seq=2865952 Ack=52298 Win=1855 Len=16016 [TCP PDU reassembled in 371]
371,17.7767701,151.101.66.187,100.84.170.161,TLSv1.2,475,"Application Data, Application Data"
372,17.7767701,151.101.66.187,100.84.170.161,TLSv1.2,32086,Application Data
373,17.7767701,151.101.66.187,100.84.170.161,TLSv1.2,874,"Application Data, Application Data"
374,17.7767701,151.101.66.187,100.84.170.161,TCP,16070,443  >  59747 [ACK] Seq=2915241 Ack=52298 Win=1855 Len=16016 [TCP PDU reassembled in 375]
375,17.7767701,151.101.66.187,100.84.170.161,TLSv1.2,475,"Application Data, Application Data"
376,17.7767701,151.101.66.187,100.84.170.161,TCP,16070,443  >  59747 [ACK] Seq=2931678 Ack=52298 Win=1855 Len=16016 [TCP PDU reassembled in 377]
377,17.7767701,151.101.66.187,100.84.170.161,TLSv1.2,475,"Application Data, Application Data"
378,17.7767701,151.101.66.187,100.84.170.161,TCP,14614,443  >  59747 [ACK] Seq=2948115 Ack=52298 Win=1855 Len=14560 [TCP PDU reassembled in 380]
