"No.","Time","Source","Destination","Protocol","Length","Info"
"1","0.000000000","100.84.170.161","151.101.66.187","TLSv1.2","2530","Application Data"
"2","0.000172100","100.84.170.161","151.101.66.187","TLSv1.2","93","Application Data"
"3","0.009517000","151.101.66.187","100.84.170.161","TCP","56","443  >  59747 [ACK] Seq=1 Ack=2516 Win=3769 Len=0"
"4","0.010095100","151.101.66.187","100.84.170.161","TLSv1.2","93","Application Data"
"5","0.014189200","151.101.66.187","100.84.170.161","TLSv1.2","251","Application Data"
"6","0.014257200","100.84.170.161","151.101.66.187","TCP","54","59747  >  443 [ACK] Seq=2516 Ack=237 Win=4103 Len=0"
"7","0.222463200","100.84.170.161","151.101.66.187","TLSv1.2","2528","Application Data"
"8","0.233851700","151.101.66.187","100.84.170.161","TCP","56","443  >  59747 [ACK] Seq=237 Ack=4990 Win=3779 Len=0"
"9","0.236404200","151.101.66.187","100.84.170.161","TLSv1.2","125","Application Data"
"10","0.270994000","151.101.66.187","100.84.170.161","TCP","125","[TCP Retransmission] 443  >  59747 [PSH, ACK] Seq=237 Ack=4990 Win=3779 Len=71"
"11","0.271049500","100.84.170.161","151.101.66.187","TCP","66","59747  >  443 [ACK] Seq=4990 Ack=308 Win=4102 Len=0 SLE=237 SRE=308"
"12","0.351911300","100.84.170.161","151.101.66.187","TLSv1.2","2531","Application Data"
"13","0.363401300","151.101.66.187","100.84.170.161","TCP","56","443  >  59747 [ACK] Seq=308 Ack=7467 Win=3789 Len=0"
"14","0.365985300","151.101.66.187","100.84.170.161","TLSv1.2","131","Application Data"
"15","0.400911800","151.101.66.187","100.84.170.161","TCP","131","[TCP Retransmission] 443  >  59747 [PSH, ACK] Seq=308 Ack=7467 Win=3789 Len=77"
"16","0.400956700","100.84.170.161","151.101.66.187","TCP","66","59747  >  443 [ACK] Seq=7467 Ack=385 Win=4102 Len=0 SLE=308 SRE=385"
"17","4.046875500","100.84.170.161","151.101.66.187","TLSv1.2","2516","Application Data"
"18","4.055538300","151.101.66.187","100.84.170.161","TCP","56","443  >  59747 [ACK] Seq=385 Ack=9929 Win=3798 Len=0"
"19","4.058411700","151.101.66.187","100.84.170.161","TLSv1.2","285","Application Data"
"20","4.092901900","151.101.66.187","100.84.170.161","TCP","285","[TCP Retransmission] 443  >  59747 [PSH, ACK] Seq=385 Ack=9929 Win=3798 Len=231"
"21","4.092941100","100.84.170.161","151.101.66.187","TCP","66","59747  >  443 [ACK] Seq=9929 Ack=616 Win=4101 Len=0 SLE=385 SRE=616"
"22","4.234442100","100.84.170.161","151.101.66.187","TLSv1.2","2519","Application Data"
"23","4.235945700","100.84.170.161","151.101.66.187","TLSv1.2","2521","Application Data"
"24","4.243804100","151.101.66.187","100.84.170.161","TCP","56","443  >  59747 [ACK] Seq=616 Ack=12394 Win=3808 Len=0"
"25","4.245105000","151.101.66.187","100.84.170.161","TCP","56","443  >  59747 [ACK] Seq=616 Ack=14861 Win=3817 Len=0"
"26","4.247478300","151.101.66.187","100.84.170.161","TLSv1.2","202","Application Data"
"27","4.247786200","151.101.66.187","100.84.170.161","TLSv1.2","124","Application Data"
"28","4.247830900","100.84.170.161","151.101.66.187","TCP","54","59747  >  443 [ACK] Seq=14861 Ack=834 Win=4100 Len=0"
"29","6.982010900","100.84.170.161","151.101.66.187","TLSv1.2","2534","Application Data"
"30","6.991027300","151.101.66.187","100.84.170.161","TCP","56","443  >  59747 [ACK] Seq=834 Ack=17341 Win=3827 Len=0"
"31","6.993856400","100.84.170.161","151.101.66.187","TLSv1.2","2525","Application Data"
"32","6.994123500","151.101.66.187","100.84.170.161","TLSv1.2","214","Application Data"
"33","6.994216700","100.84.170.161","151.101.66.187","TCP","54","59747  >  443 [ACK] Seq=19812 Ack=994 Win=4106 Len=0"
"34","6.997654000","100.84.170.161","151.101.66.187","TLSv1.2","2519","Application Data"
"35","7.001891400","100.84.170.161","151.101.66.187","TLSv1.2","2519","Application Data"
"36","7.003057000","151.101.66.187","100.84.170.161","TCP","56","443  >  59747 [ACK] Seq=994 Ack=19812 Win=3837 Len=0"
"37","7.005771400","151.101.66.187","100.84.170.161","TLSv1.2","124","Application Data"
"38","7.006520300","151.101.66.187","100.84.170.161","TCP","56","443  >  59747 [ACK] Seq=1064 Ack=22277 Win=3846 Len=0"
"39","7.009234400","151.101.66.187","100.84.170.161","TLSv1.2","131","Application Data"
"40","7.009314200","100.84.170.161","151.101.66.187","TCP","54","59747  >  443 [ACK] Seq=24742 Ack=1141 Win=4105 Len=0"
"41","7.010661100","151.101.66.187","100.84.170.161","TCP","56","443  >  59747 [ACK] Seq=1141 Ack=24742 Win=3856 Len=0"
"42","7.013861800","151.101.66.187","100.84.170.161","TLSv1.2","168","Application Data"
"43","7.049851800","151.101.66.187","100.84.170.161","TCP","168","[TCP Retransmission] 443  >  59747 [PSH, ACK] Seq=1141 Ack=24742 Win=3856 Len=114"
"44","7.049930000","100.84.170.161","151.101.66.187","TCP","66","59747  >  443 [ACK] Seq=24742 Ack=1255 Win=4105 Len=0 SLE=1141 SRE=1255"
"45","7.242619200","100.84.170.161","151.101.66.187","TLSv1.2","2533","Application Data"
"46","7.252821400","151.101.66.187","100.84.170.161","TCP","56","443  >  59747 [ACK] Seq=1255 Ack=27221 Win=3866 Len=0"
"47","7.255365600","151.101.66.187","100.84.170.161","TLSv1.2","136","Application Data"
"48","7.285995400","151.101.66.187","100.84.170.161","TCP","136","[TCP Retransmission] 443  >  59747 [PSH, ACK] Seq=1255 Ack=27221 Win=3866 Len=82"
"49","7.286042400","100.84.170.161","151.101.66.187","TCP","66","59747  >  443 [ACK] Seq=27221 Ack=1337 Win=4104 Len=0 SLE=1255 SRE=1337"
"50","7.297414400","100.84.170.161","151.101.66.187","TLSv1.2","2533","Application Data"
"51","7.306067800","151.101.66.187","100.84.170.161","TCP","56","443  >  59747 [ACK] Seq=1337 Ack=29700 Win=3875 Len=0"
"52","7.309638400","151.101.66.187","100.84.170.161","TLSv1.2","125","Application Data"
"53","7.339871600","151.101.66.187","100.84.170.161","TCP","125","[TCP Retransmission] 443  >  59747 [PSH, ACK] Seq=1337 Ack=29700 Win=3875 Len=71"
"54","7.339909700","100.84.170.161","151.101.66.187","TCP","66","59747  >  443 [ACK] Seq=29700 Ack=1408 Win=4104 Len=0 SLE=1337 SRE=1408"
"55","7.450807800","100.84.170.161","151.101.66.187","TLSv1.2","2528","Application Data"
"56","7.471733600","151.101.66.187","100.84.170.161","TCP","56","443  >  59747 [ACK] Seq=1408 Ack=32174 Win=3885 Len=0"
"57","7.475655900","151.101.66.187","100.84.170.161","TLSv1.2","131","Application Data"
"58","7.507257600","151.101.66.187","100.84.170.161","TCP","131","[TCP Retransmission] 443  >  59747 [PSH, ACK] Seq=1408 Ack=32174 Win=3885 Len=77"
"59","7.507289800","100.84.170.161","151.101.66.187","TCP","66","59747  >  443 [ACK] Seq=32174 Ack=1485 Win=4104 Len=0 SLE=1408 SRE=1485"
"60","7.515064300","100.84.170.161","151.101.66.187","TLSv1.2","2538","Application Data"
"61","7.515880400","100.84.170.161","151.101.66.187","TLSv1.2","2534","Application Data"
"62","7.525176600","151.101.66.187","100.84.170.161","TCP","56","443  >  59747 [ACK] Seq=1485 Ack=37138 Win=3904 Len=0"
"63","7.527960300","151.101.66.187","100.84.170.161","TLSv1.2","135","Application Data"
"64","7.528977100","151.101.66.187","100.84.170.161","TLSv1.2","157","Application Data"
"65","7.529016900","100.84.170.161","151.101.66.187","TCP","54","59747  >  443 [ACK] Seq=37138 Ack=1669 Win=4103 Len=0"
"66","7.638382200","100.84.170.161","151.101.66.187","TLSv1.2","2539","Application Data"
"67","7.638845200","100.84.170.161","151.101.66.187","TLSv1.2","2535","Application Data"
"68","7.649398700","151.101.66.187","100.84.170.161","TCP","56","443  >  59747 [ACK] Seq=1669 Ack=42104 Win=3924 Len=0"
"69","7.650912400","100.84.170.161","151.101.66.187","TLSv1.2","2531","Application Data"
"70","7.652189700","151.101.66.187","100.84.170.161","TLSv1.2","130","Application Data"
"71","7.652557700","151.101.66.187","100.84.170.161","TLSv1.2","131","Application Data"
"72","7.652592100","100.84.170.161","151.101.66.187","TCP","54","59747  >  443 [ACK] Seq=44581 Ack=1822 Win=4103 Len=0"
"73","7.659410400","151.101.66.187","100.84.170.161","TCP","56","443  >  59747 [ACK] Seq=1822 Ack=44581 Win=3933 Len=0"
"74","7.662133800","151.101.66.187","100.84.170.161","TLSv1.2","130","Application Data"
"75","7.690656500","151.101.66.187","100.84.170.161","TCP","130","[TCP Retransmission] 443  >  59747 [PSH, ACK] Seq=1822 Ack=44581 Win=3933 Len=76"
"76","7.690693200","100.84.170.161","151.101.66.187","TCP","66","59747  >  443 [ACK] Seq=44581 Ack=1898 Win=4102 Len=0 SLE=1822 SRE=1898"
"77","12.233280800","100.84.170.161","151.101.66.187","TLSv1.2","2531","Application Data"
"78","12.234026400","100.84.170.161","151.101.66.187","TLSv1.2","2536","Application Data"
"79","12.241400800","100.84.170.161","151.101.66.187","TLSv1.2","2537","Application Data"
"80","12.242745800","151.101.66.187","100.84.170.161","TCP","56","443  >  59747 [ACK] Seq=1898 Ack=47058 Win=3943 Len=0"
"81","12.243506800","151.101.66.187","100.84.170.161","TCP","56","443  >  59747 [ACK] Seq=1898 Ack=49540 Win=3953 Len=0"
"82","12.245643800","151.101.66.187","100.84.170.161","TLSv1.2","286","Application Data"
"83","12.246916000","151.101.66.187","100.84.170.161","TLSv1.2","182","Application Data"
"84","12.246977700","100.84.170.161","151.101.66.187","TCP","54","59747  >  443 [ACK] Seq=52023 Ack=2258 Win=4101 Len=0"
"85","12.248618300","100.84.170.161","151.101.66.187","TLSv1.2","2522","Application Data"
"86","12.251021000","151.101.66.187","100.84.170.161","TCP","56","443  >  59747 [ACK] Seq=2258 Ack=52023 Win=3963 Len=0"
"87","12.254033400","151.101.66.187","100.84.170.161","TLSv1.2","125","Application Data"
"88","12.257450400","151.101.66.187","100.84.170.161","TCP","56","443  >  59747 [ACK] Seq=2329 Ack=54491 Win=3972 Len=0"
"89","12.259748100","151.101.66.187","100.84.170.161","TLSv1.2","98","Application Data"
"90","12.259807200","100.84.170.161","151.101.66.187","TCP","54","59747  >  443 [ACK] Seq=54491 Ack=2373 Win=4100 Len=0"
"91","20.116446100","100.84.170.161","151.101.66.187","TLSv1.2","2522","Application Data"
"92","20.126797900","151.101.66.187","100.84.170.161","TCP","56","443  >  59747 [ACK] Seq=2373 Ack=56959 Win=3982 Len=0"
"93","20.129101900","151.101.66.187","100.84.170.161","TLSv1.2","214","Application Data"
"94","20.157844100","151.101.66.187","100.84.170.161","TCP","214","[TCP Retransmission] 443  >  59747 [PSH, ACK] Seq=2373 Ack=56959 Win=3982 Len=160"
"95","20.157902400","100.84.170.161","151.101.66.187","TCP","66","59747  >  443 [ACK] Seq=56959 Ack=2533 Win=4106 Len=0 SLE=2373 SRE=2533"
"96","22.268638900","100.84.170.161","151.101.66.187","TLSv1.2","2523","Application Data"
"97","22.277562600","151.101.66.187","100.84.170.161","TCP","56","443  >  59747 [ACK] Seq=2533 Ack=59428 Win=3991 Len=0"
"98","22.280332200","151.101.66.187","100.84.170.161","TLSv1.2","240","Application Data"
"99","22.309869800","151.101.66.187","100.84.170.161","TCP","240","[TCP Retransmission] 443  >  59747 [PSH, ACK] Seq=2533 Ack=59428 Win=3991 Len=186"
"100","22.309910000","100.84.170.161","151.101.66.187","TCP","66","59747  >  443 [ACK] Seq=59428 Ack=2719 Win=4105 Len=0 SLE=2533 SRE=2719"
"101","30.570236200","100.84.170.161","151.101.66.187","TLSv1.2","2536","Application Data"
"102","30.579265800","151.101.66.187","100.84.170.161","TCP","56","443  >  59747 [ACK] Seq=2719 Ack=61910 Win=4001 Len=0"
"103","30.582738000","151.101.66.187","100.84.170.161","TLSv1.2","264","Application Data"
"104","30.610812700","151.101.66.187","100.84.170.161","TCP","264","[TCP Retransmission] 443  >  59747 [PSH, ACK] Seq=2719 Ack=61910 Win=4001 Len=210"
"105","30.610852500","100.84.170.161","151.101.66.187","TCP","66","59747  >  443 [ACK] Seq=61910 Ack=2929 Win=4104 Len=0 SLE=2719 SRE=2929"
"106","30.761110400","100.84.170.161","151.101.66.187","TLSv1.2","2534","Application Data"
"107","30.771830500","151.101.66.187","100.84.170.161","TCP","56","443  >  59747 [ACK] Seq=2929 Ack=64390 Win=4011 Len=0"
"108","30.774144800","151.101.66.187","100.84.170.161","TLSv1.2","235","Application Data"
"109","30.803842200","151.101.66.187","100.84.170.161","TCP","235","[TCP Retransmission] 443  >  59747 [PSH, ACK] Seq=2929 Ack=64390 Win=4011 Len=181"
"110","30.803883900","100.84.170.161","151.101.66.187","TCP","66","59747  >  443 [ACK] Seq=64390 Ack=3110 Win=4103 Len=0 SLE=2929 SRE=3110"
"111","30.810153700","100.84.170.161","151.101.66.187","TLSv1.2","2537","Application Data"
"112","30.819190500","151.101.66.187","100.84.170.161","TCP","56","443  >  59747 [ACK] Seq=3110 Ack=66873 Win=4021 Len=0"
"113","30.821634300","151.101.66.187","100.84.170.161","TLSv1.2","135","Application Data"
"114","30.851816700","151.101.66.187","100.84.170.161","TCP","135","[TCP Retransmission] 443  >  59747 [PSH, ACK] Seq=3110 Ack=66873 Win=4021 Len=81"
"115","30.851890200","100.84.170.161","151.101.66.187","TCP","66","59747  >  443 [ACK] Seq=66873 Ack=3191 Win=4103 Len=0 SLE=3110 SRE=3191"
"116","32.683311700","100.84.170.161","151.101.66.187","TCP","55","55359  >  443 [ACK] Seq=1 Ack=1 Win=513 Len=1"
"117","32.691937800","151.101.66.187","100.84.170.161","TCP","66","443  >  55359 [ACK] Seq=1 Ack=2 Win=281 Len=0 SLE=1 SRE=2"
"118","32.844873200","100.84.170.161","151.101.66.187","TLSv1.2","2522","Application Data"
"119","32.853977100","151.101.66.187","100.84.170.161","TCP","56","443  >  59747 [ACK] Seq=3191 Ack=69341 Win=4030 Len=0"
"120","32.856209400","151.101.66.187","100.84.170.161","TLSv1.2","240","Application Data"
"121","32.885903100","151.101.66.187","100.84.170.161","TCP","240","[TCP Retransmission] 443  >  59747 [PSH, ACK] Seq=3191 Ack=69341 Win=4030 Len=186"
"122","32.886012200","100.84.170.161","151.101.66.187","TCP","66","59747  >  443 [ACK] Seq=69341 Ack=3377 Win=4102 Len=0 SLE=3191 SRE=3377"
"123","32.953232500","100.84.170.161","151.101.66.187","TLSv1.2","2525","Application Data"
"124","32.962114600","151.101.66.187","100.84.170.161","TCP","56","443  >  59747 [ACK] Seq=3377 Ack=71812 Win=4040 Len=0"
"125","32.963924300","151.101.66.187","100.84.170.161","TLSv1.2","130","Application Data"
"126","32.993660300","151.101.66.187","100.84.170.161","TCP","130","[TCP Retransmission] 443  >  59747 [PSH, ACK] Seq=3377 Ack=71812 Win=4040 Len=76"
"127","32.993699200","100.84.170.161","151.101.66.187","TCP","66","59747  >  443 [ACK] Seq=71812 Ack=3453 Win=4102 Len=0 SLE=3377 SRE=3453"
"128","33.001061900","100.84.170.161","151.101.66.187","TLSv1.2","2527","Application Data"
"129","33.009758800","151.101.66.187","100.84.170.161","TCP","56","443  >  59747 [ACK] Seq=3453 Ack=74285 Win=4050 Len=0"
"130","33.015900500","151.101.66.187","100.84.170.161","TLSv1.2","124","Application Data"
"131","33.045056600","151.101.66.187","100.84.170.161","TCP","124","[TCP Retransmission] 443  >  59747 [PSH, ACK] Seq=3453 Ack=74285 Win=4050 Len=70"
"132","33.045177800","100.84.170.161","151.101.66.187","TCP","66","59747  >  443 [ACK] Seq=74285 Ack=3523 Win=4102 Len=0 SLE=3453 SRE=3523"
"133","37.964619900","100.84.170.161","151.101.66.187","TLSv1.2","2541","Application Data"
"134","37.974755900","151.101.66.187","100.84.170.161","TCP","56","443  >  59747 [ACK] Seq=3523 Ack=76772 Win=4059 Len=0"
"135","37.977129900","151.101.66.187","100.84.170.161","TLSv1.2","259","Application Data"
"136","37.983648200","100.84.170.161","151.101.66.187","TLSv1.2","2532","Application Data"
"137","37.985354600","100.84.170.161","151.101.66.187","TLSv1.2","2526","Application Data"
"138","37.988031600","100.84.170.161","151.101.66.187","TLSv1.2","2526","Application Data"
"139","37.993358100","151.101.66.187","100.84.170.161","TCP","56","443  >  59747 [ACK] Seq=3728 Ack=79250 Win=4069 Len=0"
"140","37.994469300","151.101.66.187","100.84.170.161","TCP","56","443  >  59747 [ACK] Seq=3728 Ack=81722 Win=4079 Len=0"
"141","37.996275000","151.101.66.187","100.84.170.161","TLSv1.2","202","Application Data"
"142","37.997163000","151.101.66.187","100.84.170.161","TLSv1.2","131","Application Data"
"143","37.997212500","100.84.170.161","151.101.66.187","TCP","54","59747  >  443 [ACK] Seq=84194 Ack=3953 Win=4100 Len=0"
"144","37.997615300","151.101.66.187","100.84.170.161","TCP","56","443  >  59747 [ACK] Seq=3953 Ack=84194 Win=4088 Len=0"
"145","37.999908700","151.101.66.187","100.84.170.161","TLSv1.2","124","Application Data"
"146","38.035714300","151.101.66.187","100.84.170.161","TCP","124","[TCP Retransmission] 443  >  59747 [PSH, ACK] Seq=3953 Ack=84194 Win=4088 Len=70"
"147","38.035764500","100.84.170.161","151.101.66.187","TCP","66","59747  >  443 [ACK] Seq=84194 Ack=4023 Win=4106 Len=0 SLE=3953 SRE=4023"
"148","38.194844200","100.84.170.161","151.101.66.187","TLSv1.2","2540","Application Data"
"149","38.205667000","151.101.66.187","100.84.170.161","TCP","56","443  >  59747 [ACK] Seq=4023 Ack=86680 Win=4098 Len=0"
"150","38.209290300","151.101.66.187","100.84.170.161","TLSv1.2","130","Application Data"
"151","38.237431300","100.84.170.161","151.101.66.187","TLSv1.2","2540","Application Data"
"152","38.237771900","151.101.66.187","100.84.170.161","TCP","130","[TCP Spurious Retransmission] 443  >  59747 [PSH, ACK] Seq=4023 Ack=86680 Win=4098 Len=76"
"153","38.237818500","100.84.170.161","151.101.66.187","TCP","66","[TCP Dup ACK 151#1] 59747  >  443 [ACK] Seq=89166 Ack=4099 Win=4105 Len=0 SLE=4023 SRE=4099"
"154","38.246514600","151.101.66.187","100.84.170.161","TCP","56","443  >  59747 [ACK] Seq=4099 Ack=89166 Win=4108 Len=0"
"155","38.249844600","151.101.66.187","100.84.170.161","TLSv1.2","125","Application Data"
"156","38.279042700","151.101.66.187","100.84.170.161","TCP","125","[TCP Retransmission] 443  >  59747 [PSH, ACK] Seq=4099 Ack=89166 Win=4108 Len=71"
"157","38.279097800","100.84.170.161","151.101.66.187","TCP","66","59747  >  443 [ACK] Seq=89166 Ack=4170 Win=4105 Len=0 SLE=4099 SRE=4170"
"158","38.479552900","100.84.170.161","151.101.66.187","TLSv1.2","2535","Application Data"
"159","38.488440100","151.101.66.187","100.84.170.161","TCP","56","443  >  59747 [ACK] Seq=4170 Ack=91647 Win=4117 Len=0"
"160","38.490373600","151.101.66.187","100.84.170.161","TLSv1.2","131","Application Data"
"161","38.518744500","151.101.66.187","100.84.170.161","TCP","131","[TCP Retransmission] 443  >  59747 [PSH, ACK] Seq=4170 Ack=91647 Win=4117 Len=77"
"162","38.518778600","100.84.170.161","151.101.66.187","TCP","66","59747  >  443 [ACK] Seq=91647 Ack=4247 Win=4105 Len=0 SLE=4170 SRE=4247"
"163","38.538396200","100.84.170.161","151.101.66.187","TLSv1.2","2545","Application Data"
"164","38.538565200","100.84.170.161","151.101.66.187","TLSv1.2","2541","Application Data"
"165","38.538692900","100.84.170.161","151.101.66.187","TLSv1.2","2537","Application Data"
"166","38.547426200","151.101.66.187","100.84.170.161","TCP","56","443  >  59747 [ACK] Seq=4247 Ack=94138 Win=4127 Len=0"
"167","38.548705300","151.101.66.187","100.84.170.161","TCP","56","443  >  59747 [ACK] Seq=4247 Ack=99108 Win=4146 Len=0"
"168","38.549748400","151.101.66.187","100.84.170.161","TLSv1.2","180","Application Data"
"169","38.549959200","151.101.66.187","100.84.170.161","TLSv1.2","131","Application Data"
"170","38.549987800","100.84.170.161","151.101.66.187","TCP","54","59747  >  443 [ACK] Seq=99108 Ack=4450 Win=4104 Len=0"
"171","38.550351700","151.101.66.187","100.84.170.161","TLSv1.2","167","Application Data"
"172","38.588716500","151.101.66.187","100.84.170.161","TCP","167","[TCP Retransmission] 443  >  59747 [PSH, ACK] Seq=4450 Ack=99108 Win=4146 Len=113"
"173","38.588758300","100.84.170.161","151.101.66.187","TCP","66","59747  >  443 [ACK] Seq=99108 Ack=4563 Win=4104 Len=0 SLE=4450 SRE=4563"
"174","38.703608100","100.84.170.161","151.101.66.187","TLSv1.2","2551","Application Data"
"175","38.704741400","100.84.170.161","151.101.66.187","TLSv1.2","2547","Application Data"
"176","38.714267100","151.101.66.187","100.84.170.161","TCP","56","443  >  59747 [ACK] Seq=4563 Ack=104098 Win=4168 Len=0"
"177","38.720484400","151.101.66.187","100.84.170.161","TLSv1.2","130","Application Data"
"178","38.721227600","151.101.66.187","100.84.170.161","TLSv1.2","125","Application Data"
"179","38.721273300","100.84.170.161","151.101.66.187","TCP","54","59747  >  443 [ACK] Seq=104098 Ack=4710 Win=4103 Len=0"
"180","47.680097500","100.84.170.161","151.101.66.187","TLSv1.2","2545","Application Data"
"181","47.689291700","151.101.66.187","100.84.170.161","TCP","56","443  >  59747 [ACK] Seq=4710 Ack=106589 Win=4177 Len=0"
"182","47.691790500","151.101.66.187","100.84.170.161","TLSv1.2","214","Application Data"
"183","47.719724900","151.101.66.187","100.84.170.161","TCP","214","[TCP Retransmission] 443  >  59747 [PSH, ACK] Seq=4710 Ack=106589 Win=4177 Len=160"
"184","47.719759500","100.84.170.161","151.101.66.187","TCP","66","59747  >  443 [ACK] Seq=106589 Ack=4870 Win=4102 Len=0 SLE=4710 SRE=4870"
"185","47.940719900","100.84.170.161","151.101.66.187","TLSv1.2","2543","Application Data"
"186","47.961006700","100.84.170.161","151.101.66.187","TCP","1514","[TCP Retransmission] 59747  >  443 [PSH, ACK] Seq=107618 Ack=4870 Win=4102 Len=1460"
"187","47.977608200","151.101.66.187","100.84.170.161","TCP","56","443  >  59747 [ACK] Seq=4870 Ack=109078 Win=4187 Len=0"
"188","47.979112500","151.101.66.187","100.84.170.161","TCP","66","[TCP Dup ACK 187#1] 443  >  59747 [ACK] Seq=4870 Ack=109078 Win=4187 Len=0 SLE=107618 SRE=109078"
"189","47.980261100","151.101.66.187","100.84.170.161","TLSv1.2","235","Application Data"
"190","47.993421400","100.84.170.161","151.101.66.187","TLSv1.2","2546","Application Data"
"191","48.004600500","151.101.66.187","100.84.170.161","TCP","56","443  >  59747 [ACK] Seq=5051 Ack=111570 Win=4197 Len=0"
"192","48.007639500","151.101.66.187","100.84.170.161","TLSv1.2","170","Application Data"
"193","48.038986400","151.101.66.187","100.84.170.161","TCP","170","[TCP Retransmission] 443  >  59747 [PSH, ACK] Seq=5051 Ack=111570 Win=4197 Len=116"
"194","48.039022900","100.84.170.161","151.101.66.187","TCP","66","59747  >  443 [ACK] Seq=111570 Ack=5167 Win=4101 Len=0 SLE=5051 SRE=5167"
"195","48.803653200","100.84.170.161","151.101.66.187","TLSv1.2","2531","Application Data"
"196","48.812392600","151.101.66.187","100.84.170.161","TCP","56","443  >  59747 [ACK] Seq=5167 Ack=114047 Win=4206 Len=0"
"197","48.815679500","151.101.66.187","100.84.170.161","TLSv1.2","312","Application Data"
"198","48.847943900","151.101.66.187","100.84.170.161","TCP","312","[TCP Retransmission] 443  >  59747 [PSH, ACK] Seq=5167 Ack=114047 Win=4206 Len=258"
"199","48.847990700","100.84.170.161","151.101.66.187","TCP","66","59747  >  443 [ACK] Seq=114047 Ack=5425 Win=4100 Len=0 SLE=5167 SRE=5425"
"200","48.913560100","100.84.170.161","151.101.66.187","TLSv1.2","2534","Application Data"
"201","48.923176100","151.101.66.187","100.84.170.161","TCP","56","443  >  59747 [ACK] Seq=5425 Ack=116527 Win=4216 Len=0"
"202","48.925818500","151.101.66.187","100.84.170.161","TLSv1.2","130","Application Data"
"203","48.956722500","151.101.66.187","100.84.170.161","TCP","130","[TCP Retransmission] 443  >  59747 [PSH, ACK] Seq=5425 Ack=116527 Win=4216 Len=76"
"204","48.956760500","100.84.170.161","151.101.66.187","TCP","66","59747  >  443 [ACK] Seq=116527 Ack=5501 Win=4106 Len=0 SLE=5425 SRE=5501"
"205","48.961964600","100.84.170.161","151.101.66.187","TLSv1.2","2536","Application Data"
"206","48.971238800","151.101.66.187","100.84.170.161","TCP","56","443  >  59747 [ACK] Seq=5501 Ack=119009 Win=4226 Len=0"
"207","48.974735200","151.101.66.187","100.84.170.161","TLSv1.2","124","Application Data"
"208","49.007168100","151.101.66.187","100.84.170.161","TCP","124","[TCP Retransmission] 443  >  59747 [PSH, ACK] Seq=5501 Ack=119009 Win=4226 Len=70"
"209","49.007210500","100.84.170.161","151.101.66.187","TCP","66","59747  >  443 [ACK] Seq=119009 Ack=5571 Win=4105 Len=0 SLE=5501 SRE=5571"
"210","52.153509900","100.84.170.161","151.101.66.187","TLSv1.2","2540","Application Data"
"211","52.160196900","100.84.170.161","151.101.66.187","TLSv1.2","2531","Application Data"
"212","52.162947100","100.84.170.161","151.101.66.187","TLSv1.2","2525","Application Data"
"213","52.163817000","151.101.66.187","100.84.170.161","TCP","56","443  >  59747 [ACK] Seq=5571 Ack=121495 Win=4236 Len=0"
"214","52.166403800","100.84.170.161","151.101.66.187","TLSv1.2","2525","Application Data"
"215","52.167268400","151.101.66.187","100.84.170.161","TLSv1.2","214","Application Data"
"216","52.169694100","151.101.66.187","100.84.170.161","TCP","56","443  >  59747 [ACK] Seq=5731 Ack=123972 Win=4245 Len=0"
"217","52.172605400","151.101.66.187","100.84.170.161","TCP","56","443  >  59747 [ACK] Seq=5731 Ack=126443 Win=4255 Len=0"
"218","52.173601600","151.101.66.187","100.84.170.161","TLSv1.2","168","Application Data"
"219","52.173661200","100.84.170.161","151.101.66.187","TCP","54","59747  >  443 [ACK] Seq=128914 Ack=5845 Win=4104 Len=0"
"220","52.175424900","151.101.66.187","100.84.170.161","TLSv1.2","137","Application Data"
"221","52.176400200","151.101.66.187","100.84.170.161","TCP","56","443  >  59747 [ACK] Seq=5928 Ack=128914 Win=4265 Len=0"
"222","52.178557200","151.101.66.187","100.84.170.161","TLSv1.2","130","Application Data"
"223","52.178627500","100.84.170.161","151.101.66.187","TCP","54","59747  >  443 [ACK] Seq=128914 Ack=6004 Win=4104 Len=0"
"224","52.349936800","100.84.170.161","151.101.66.187","TLSv1.2","2539","Application Data"
"225","52.360476400","151.101.66.187","100.84.170.161","TCP","56","443  >  59747 [ACK] Seq=6004 Ack=131399 Win=4274 Len=0"
"226","52.363677600","151.101.66.187","100.84.170.161","TLSv1.2","161","Application Data"
"227","52.378391500","100.84.170.161","151.101.66.187","TLSv1.2","2539","Application Data"
"228","52.387187800","151.101.66.187","100.84.170.161","TCP","56","443  >  59747 [ACK] Seq=6111 Ack=133884 Win=4284 Len=0"
"229","52.390109000","151.101.66.187","100.84.170.161","TLSv1.2","125","Application Data"
"230","52.424665500","151.101.66.187","100.84.170.161","TCP","125","[TCP Retransmission] 443  >  59747 [PSH, ACK] Seq=6111 Ack=133884 Win=4284 Len=71"
"231","52.424710100","100.84.170.161","151.101.66.187","TCP","66","59747  >  443 [ACK] Seq=133884 Ack=6182 Win=4103 Len=0 SLE=6111 SRE=6182"
"232","52.519258100","100.84.170.161","151.101.66.187","TLSv1.2","2534","Application Data"
"233","52.529915600","151.101.66.187","100.84.170.161","TCP","56","443  >  59747 [ACK] Seq=6182 Ack=136364 Win=4294 Len=0"
"234","52.532295500","151.101.66.187","100.84.170.161","TLSv1.2","131","Application Data"
"235","52.566031700","151.101.66.187","100.84.170.161","TCP","131","[TCP Retransmission] 443  >  59747 [PSH, ACK] Seq=6182 Ack=136364 Win=4294 Len=77"
"236","52.566062500","100.84.170.161","151.101.66.187","TCP","66","59747  >  443 [ACK] Seq=136364 Ack=6259 Win=4103 Len=0 SLE=6182 SRE=6259"
"237","52.575486400","100.84.170.161","151.101.66.187","TLSv1.2","2544","Application Data"
"238","52.576244100","100.84.170.161","151.101.66.187","TLSv1.2","2540","Application Data"
"239","52.584430600","151.101.66.187","100.84.170.161","TCP","56","443  >  59747 [ACK] Seq=6259 Ack=138854 Win=4303 Len=0"
"240","52.585288200","151.101.66.187","100.84.170.161","TCP","56","443  >  59747 [ACK] Seq=6259 Ack=141340 Win=4313 Len=0"
"241","52.587460600","151.101.66.187","100.84.170.161","TLSv1.2","130","Application Data"
"242","52.587651000","151.101.66.187","100.84.170.161","TLSv1.2","125","Application Data"
"243","52.587684400","100.84.170.161","151.101.66.187","TCP","54","59747  >  443 [ACK] Seq=141340 Ack=6406 Win=4102 Len=0"
"244","52.714361200","100.84.170.161","151.101.66.187","TLSv1.2","2546","Application Data"
"245","52.718855300","100.84.170.161","151.101.66.187","TLSv1.2","2542","Application Data"
"246","52.719545400","100.84.170.161","151.101.66.187","TLSv1.2","2538","Application Data"
"247","52.723189100","151.101.66.187","100.84.170.161","TCP","56","443  >  59747 [ACK] Seq=6406 Ack=143832 Win=4323 Len=0"
"248","52.726071900","151.101.66.187","100.84.170.161","TLSv1.2","130","Application Data"
"249","52.727729300","151.101.66.187","100.84.170.161","TCP","56","443  >  59747 [ACK] Seq=6482 Ack=146320 Win=4333 Len=0"
"250","52.728199400","151.101.66.187","100.84.170.161","TCP","56","443  >  59747 [ACK] Seq=6482 Ack=148804 Win=4342 Len=0"
"251","52.730277600","151.101.66.187","100.84.170.161","TLSv1.2","286","Application Data"
"252","52.730334700","100.84.170.161","151.101.66.187","TCP","54","59747  >  443 [ACK] Seq=148804 Ack=6714 Win=4101 Len=0"
"253","52.730620700","151.101.66.187","100.84.170.161","TLSv1.2","208","Application Data"
"254","52.770577500","151.101.66.187","100.84.170.161","TCP","208","[TCP Retransmission] 443  >  59747 [PSH, ACK] Seq=6714 Ack=148804 Win=4342 Len=154"
"255","52.770616000","100.84.170.161","151.101.66.187","TCP","66","59747  >  443 [ACK] Seq=148804 Ack=6868 Win=4100 Len=0 SLE=6714 SRE=6868"
"256","58.009001100","100.84.170.161","151.101.66.187","TLSv1.2","2531","Application Data"
"257","58.017747800","151.101.66.187","100.84.170.161","TCP","56","443  >  59747 [ACK] Seq=6868 Ack=151281 Win=4352 Len=0"
"258","58.020547900","151.101.66.187","100.84.170.161","TLSv1.2","214","Application Data"
"259","58.052788000","151.101.66.187","100.84.170.161","TCP","214","[TCP Retransmission] 443  >  59747 [PSH, ACK] Seq=6868 Ack=151281 Win=4352 Len=160"
"260","58.052854600","100.84.170.161","151.101.66.187","TCP","66","59747  >  443 [ACK] Seq=151281 Ack=7028 Win=4106 Len=0 SLE=6868 SRE=7028"
"261","58.198303800","100.84.170.161","151.101.66.187","TLSv1.2","2529","Application Data"
"262","58.208446200","151.101.66.187","100.84.170.161","TCP","56","443  >  59747 [ACK] Seq=7028 Ack=153756 Win=4362 Len=0"
"263","58.210995200","151.101.66.187","100.84.170.161","TLSv1.2","125","Application Data"
"264","58.242675200","100.84.170.161","151.101.66.187","TLSv1.2","2532","Application Data"
"265","58.243591200","151.101.66.187","100.84.170.161","TCP","125","[TCP Spurious Retransmission] 443  >  59747 [PSH, ACK] Seq=7028 Ack=153756 Win=4362 Len=71"
"266","58.243618400","100.84.170.161","151.101.66.187","TCP","66","[TCP Dup ACK 264#1] 59747  >  443 [ACK] Seq=156234 Ack=7099 Win=4105 Len=0 SLE=7028 SRE=7099"
"267","58.251437700","151.101.66.187","100.84.170.161","TCP","56","443  >  59747 [ACK] Seq=7099 Ack=156234 Win=4371 Len=0"
"268","58.253824600","151.101.66.187","100.84.170.161","TLSv1.2","131","Application Data"
"269","58.285691900","151.101.66.187","100.84.170.161","TCP","131","[TCP Retransmission] 443  >  59747 [PSH, ACK] Seq=7099 Ack=156234 Win=4371 Len=77"
"270","58.285738400","100.84.170.161","151.101.66.187","TCP","66","59747  >  443 [ACK] Seq=156234 Ack=7176 Win=4105 Len=0 SLE=7099 SRE=7176"
