"No.","Time","Source","Destination","Protocol","Length","Info"
"1","0.000000000","100.84.170.161","151.101.66.187","TLSv1.2","1695","Application Data"
"2","0.000166400","100.84.170.161","151.101.66.187","TLSv1.2","93","Application Data"
"3","0.010243000","151.101.66.187","100.84.170.161","TCP","56","443  >  59747 [ACK] Seq=1 Ack=1681 Win=4940 Len=0"
"4","0.010778400","151.101.66.187","100.84.170.161","TLSv1.2","93","Application Data"
"5","0.013811800","151.101.66.187","100.84.170.161","TLSv1.2","246","Application Data"
"6","0.013917200","100.84.170.161","151.101.66.187","TCP","54","59747  >  443 [ACK] Seq=1681 Ack=232 Win=4101 Len=0"
"7","9.500352800","100.84.170.161","151.101.66.187","TLSv1.2","1000","Application Data"
"8","9.502248000","100.84.170.161","151.101.66.187","TLSv1.2","1688","Application Data"
"9","9.514979500","151.101.66.187","100.84.170.161","TCP","56","443  >  59747 [ACK] Seq=232 Ack=2627 Win=4940 Len=0"
"10","9.514979500","151.101.66.187","100.84.170.161","TLSv1.2","337","Application Data"
"11","9.518632500","151.101.66.187","100.84.170.161","TCP","56","443  >  59747 [ACK] Seq=515 Ack=4261 Win=4940 Len=0"
"12","9.523037500","151.101.66.187","100.84.170.161","TLSv1.2","125","Application Data"
"13","9.523160800","100.84.170.161","151.101.66.187","TCP","54","59747  >  443 [ACK] Seq=4261 Ack=586 Win=4106 Len=0"
"14","9.579103800","100.84.170.161","151.101.66.187","TLSv1.2","1058","Application Data"
"15","9.579473700","100.84.170.161","151.101.66.187","TLSv1.2","1646","Application Data"
"16","9.587735400","151.101.66.187","100.84.170.161","TCP","56","443  >  59747 [ACK] Seq=586 Ack=5265 Win=4945 Len=0"
"17","9.588277600","151.101.66.187","100.84.170.161","TCP","56","443  >  59747 [ACK] Seq=586 Ack=6857 Win=4945 Len=0"
"18","9.591198400","151.101.66.187","100.84.170.161","TLSv1.2","130","Application Data"
"19","9.592070700","151.101.66.187","100.84.170.161","TLSv1.2","124","Application Data"
"20","9.592128600","100.84.170.161","151.101.66.187","TCP","54","59747  >  443 [ACK] Seq=6857 Ack=732 Win=4105 Len=0"
"21","12.942995200","100.84.170.161","151.101.66.187","TLSv1.2","1076","Application Data"
"22","12.953799700","151.101.66.187","100.84.170.161","TCP","56","443  >  59747 [ACK] Seq=732 Ack=7879 Win=4951 Len=0"
"23","13.628023000","151.101.66.187","100.84.170.161","TCP","5878","443  >  59747 [ACK] Seq=732 Ack=7879 Win=4951 Len=5824 [TCP PDU reassembled in 24]"
"24","13.628023000","151.101.66.187","100.84.170.161","TLSv1.2","1074","Application Data"
"25","13.628023000","151.101.66.187","100.84.170.161","TLSv1.2","52470","Application Data, Application Data, Application Data"
"26","13.628023000","151.101.66.187","100.84.170.161","TLSv1.2","674","Application Data"
"27","13.628023000","151.101.66.187","100.84.170.161","TCP","674","[TCP Retransmission] 443  >  59747 [PSH, ACK] Seq=59992 Ack=7879 Win=4951 Len=620 [TCP PDU reassembled in 26]"
"28","13.628214000","100.84.170.161","151.101.66.187","TCP","66","59747  >  443 [ACK] Seq=7879 Ack=60612 Win=4106 Len=0 SLE=59992 SRE=60612"
"29","13.630527500","100.84.170.161","151.101.66.187","TLSv1.2","89","Application Data"
"30","13.640201100","151.101.66.187","100.84.170.161","TCP","56","443  >  59747 [ACK] Seq=60612 Ack=7914 Win=4951 Len=0"
"31","14.273315000","100.84.170.161","151.101.66.187","TLSv1.2","1824","Application Data"
"32","14.273586500","100.84.170.161","151.101.66.187","TLSv1.2","937","Application Data"
"33","14.273779900","100.84.170.161","151.101.66.187","TLSv1.2","1821","Application Data"
"34","14.283312900","151.101.66.187","100.84.170.161","TCP","56","443  >  59747 [ACK] Seq=60612 Ack=12334 Win=4951 Len=0"
"35","14.287117600","151.101.66.187","100.84.170.161","TLSv1.2","241","Application Data"
"36","14.287480200","151.101.66.187","100.84.170.161","TLSv1.2","212","Application Data"
"37","14.287521800","100.84.170.161","151.101.66.187","TCP","54","59747  >  443 [ACK] Seq=12334 Ack=60957 Win=4104 Len=0"
"38","14.287799600","151.101.66.187","100.84.170.161","TLSv1.2","135","Application Data"
"39","14.323637100","151.101.66.187","100.84.170.161","TCP","135","[TCP Retransmission] 443  >  59747 [PSH, ACK] Seq=60957 Ack=12334 Win=4951 Len=81"
"40","14.323688900","100.84.170.161","151.101.66.187","TCP","66","59747  >  443 [ACK] Seq=12334 Ack=61038 Win=4104 Len=0 SLE=60957 SRE=61038"
"41","14.362417100","100.84.170.161","151.101.66.187","TLSv1.2","934","Application Data"
"42","14.371534900","151.101.66.187","100.84.170.161","TCP","56","443  >  59747 [ACK] Seq=61038 Ack=13214 Win=4951 Len=0"
"43","14.373830300","151.101.66.187","100.84.170.161","TLSv1.2","130","Application Data"
"44","14.400248700","151.101.66.187","100.84.170.161","TCP","130","[TCP Retransmission] 443  >  59747 [PSH, ACK] Seq=61038 Ack=13214 Win=4951 Len=76"
"45","14.400300200","100.84.170.161","151.101.66.187","TCP","66","59747  >  443 [ACK] Seq=13214 Ack=61114 Win=4104 Len=0 SLE=61038 SRE=61114"
"46","14.452934100","100.84.170.161","151.101.66.187","TLSv1.2","1850","Application Data"
"47","14.461695300","151.101.66.187","100.84.170.161","TCP","56","443  >  59747 [ACK] Seq=61114 Ack=15010 Win=4951 Len=0"
"48","14.465927000","151.101.66.187","100.84.170.161","TLSv1.2","124","Application Data"
"49","14.491712400","151.101.66.187","100.84.170.161","TCP","124","[TCP Retransmission] 443  >  59747 [PSH, ACK] Seq=61114 Ack=15010 Win=4951 Len=70"
"50","14.491743600","100.84.170.161","151.101.66.187","TCP","66","59747  >  443 [ACK] Seq=15010 Ack=61184 Win=4104 Len=0 SLE=61114 SRE=61184"
"51","14.514091300","100.84.170.161","151.101.66.187","TLSv1.2","951","Application Data"
"52","14.522639100","151.101.66.187","100.84.170.161","TCP","56","443  >  59747 [ACK] Seq=61184 Ack=15907 Win=4951 Len=0"
"53","14.525410200","151.101.66.187","100.84.170.161","TLSv1.2","248","Application Data"
"54","14.551152600","151.101.66.187","100.84.170.161","TCP","248","[TCP Retransmission] 443  >  59747 [PSH, ACK] Seq=61184 Ack=15907 Win=4951 Len=194"
"55","14.551185700","100.84.170.161","151.101.66.187","TCP","66","59747  >  443 [ACK] Seq=15907 Ack=61378 Win=4103 Len=0 SLE=61184 SRE=61378"
"56","14.615865400","100.84.170.161","151.101.66.187","TLSv1.2","1807","Application Data"
"57","14.624693500","151.101.66.187","100.84.170.161","TCP","56","443  >  59747 [ACK] Seq=61378 Ack=17660 Win=4951 Len=0"
"58","14.629102800","151.101.66.187","100.84.170.161","TLSv1.2","125","Application Data"
"59","14.656127900","151.101.66.187","100.84.170.161","TCP","125","[TCP Retransmission] 443  >  59747 [PSH, ACK] Seq=61378 Ack=17660 Win=4951 Len=71"
"60","14.656177300","100.84.170.161","151.101.66.187","TCP","66","59747  >  443 [ACK] Seq=17660 Ack=61449 Win=4102 Len=0 SLE=61378 SRE=61449"
"61","14.755253200","100.84.170.161","151.101.66.187","TLSv1.2","958","Application Data"
"62","14.755635400","100.84.170.161","151.101.66.187","TLSv1.2","1828","Application Data"
"63","14.764184000","151.101.66.187","100.84.170.161","TCP","56","443  >  59747 [ACK] Seq=61449 Ack=18564 Win=4951 Len=0"
"64","14.764703000","151.101.66.187","100.84.170.161","TCP","56","443  >  59747 [ACK] Seq=61449 Ack=20338 Win=4951 Len=0"
"65","14.769499500","151.101.66.187","100.84.170.161","TLSv1.2","131","Application Data"
"66","14.771796600","151.101.66.187","100.84.170.161","TLSv1.2","130","Application Data"
"67","14.771921800","100.84.170.161","151.101.66.187","TCP","54","59747  >  443 [ACK] Seq=20338 Ack=61602 Win=4102 Len=0"
"68","16.622567300","100.84.170.161","151.101.66.187","TLSv1.2","890","Application Data"
"69","16.633094300","151.101.66.187","100.84.170.161","TCP","56","443  >  59747 [ACK] Seq=61602 Ack=21174 Win=4951 Len=0"
"70","16.635533000","151.101.66.187","100.84.170.161","TCP","1510","443  >  59747 [ACK] Seq=61602 Ack=21174 Win=4951 Len=1456 [TCP PDU reassembled in 71]"
"71","16.635936800","151.101.66.187","100.84.170.161","TLSv1.2","215","Application Data"
"72","16.635975700","100.84.170.161","151.101.66.187","TCP","54","59747  >  443 [ACK] Seq=21174 Ack=63219 Win=4106 Len=0"
"73","16.669270400","100.84.170.161","151.101.66.187","TLSv1.2","1846","Application Data"
"74","16.669463900","100.84.170.161","151.101.66.187","TLSv1.2","934","Application Data"
"75","16.678114300","151.101.66.187","100.84.170.161","TCP","56","443  >  59747 [ACK] Seq=63219 Ack=22966 Win=4951 Len=0"
"76","16.678446300","151.101.66.187","100.84.170.161","TCP","56","443  >  59747 [ACK] Seq=63219 Ack=23846 Win=4951 Len=0"
"77","16.680585100","151.101.66.187","100.84.170.161","TLSv1.2","130","Application Data"
"78","16.680585100","151.101.66.187","100.84.170.161","TLSv1.2","124","Application Data"
"79","16.680644900","100.84.170.161","151.101.66.187","TCP","54","59747  >  443 [ACK] Seq=23846 Ack=63365 Win=4105 Len=0"
"80","18.124470600","100.84.170.161","151.101.66.187","TLSv1.2","2001","Application Data"
"81","18.126095600","100.84.170.161","151.101.66.187","TLSv1.2","664","Application Data"
"82","18.126953800","100.84.170.161","151.101.66.187","TLSv1.2","1989","Application Data"
"83","18.127128700","100.84.170.161","151.101.66.187","TLSv1.2","654","Application Data"
"84","18.127247700","100.84.170.161","151.101.66.187","TLSv1.2","2002","Application Data"
"85","18.128213200","100.84.170.161","151.101.66.187","TLSv1.2","648","Application Data"
"86","18.133887300","151.101.66.187","100.84.170.161","TCP","56","443  >  59747 [ACK] Seq=63365 Ack=25793 Win=4959 Len=0"
"87","18.135723200","151.101.66.187","100.84.170.161","TCP","56","443  >  59747 [ACK] Seq=63365 Ack=26403 Win=4959 Len=0"
"88","18.136122500","151.101.66.187","100.84.170.161","TCP","56","443  >  59747 [ACK] Seq=63365 Ack=30886 Win=4966 Len=0"
"89","18.136721200","151.101.66.187","100.84.170.161","TCP","56","443  >  59747 [ACK] Seq=63365 Ack=31480 Win=4966 Len=0"
"90","18.137516100","151.101.66.187","100.84.170.161","TLSv1.2","214","Application Data"
"91","18.139229700","151.101.66.187","100.84.170.161","TLSv1.2","148","Application Data"
"92","18.139291600","100.84.170.161","151.101.66.187","TCP","54","59747  >  443 [ACK] Seq=31480 Ack=63619 Win=4104 Len=0"
"93","18.140078200","151.101.66.187","100.84.170.161","TLSv1.2","169","Application Data"
"94","18.141467500","151.101.66.187","100.84.170.161","TLSv1.2","157","Application Data"
"95","18.141531400","100.84.170.161","151.101.66.187","TCP","54","59747  >  443 [ACK] Seq=31480 Ack=63837 Win=4103 Len=0"
"96","18.143755600","151.101.66.187","100.84.170.161","TLSv1.2","124","Application Data"
"97","18.148712000","100.84.170.161","151.101.66.187","TLSv1.2","2003","Application Data"
"98","18.157432200","151.101.66.187","100.84.170.161","TCP","56","443  >  59747 [ACK] Seq=63907 Ack=33429 Win=4974 Len=0"
"99","18.160762900","151.101.66.187","100.84.170.161","TLSv1.2","104","Application Data"
"100","18.179381900","100.84.170.161","151.101.66.187","TLSv1.2","648","Application Data"
"101","18.186101900","151.101.66.187","100.84.170.161","TCP","104","[TCP Spurious Retransmission] 443  >  59747 [PSH, ACK] Seq=63907 Ack=33429 Win=4974 Len=50"
"102","18.186147500","100.84.170.161","151.101.66.187","TCP","66","[TCP Dup ACK 100#1] 59747  >  443 [ACK] Seq=34023 Ack=63957 Win=4103 Len=0 SLE=63907 SRE=63957"
"103","18.188346400","151.101.66.187","100.84.170.161","TCP","56","443  >  59747 [ACK] Seq=63957 Ack=34023 Win=4974 Len=0"
"104","18.191177100","151.101.66.187","100.84.170.161","TLSv1.2","98","Application Data"
"105","18.217011200","151.101.66.187","100.84.170.161","TCP","98","[TCP Retransmission] 443  >  59747 [PSH, ACK] Seq=63957 Ack=34023 Win=4974 Len=44"
"106","18.217087300","100.84.170.161","151.101.66.187","TCP","66","59747  >  443 [ACK] Seq=34023 Ack=64001 Win=4103 Len=0 SLE=63957 SRE=64001"
"107","18.640888500","100.84.170.161","151.101.66.187","TLSv1.2","2103","Application Data"
"108","18.650661300","151.101.66.187","100.84.170.161","TCP","56","443  >  59747 [ACK] Seq=64001 Ack=36072 Win=4982 Len=0"
"109","18.653323700","151.101.66.187","100.84.170.161","TLSv1.2","358","Application Data"
"110","18.678179100","151.101.66.187","100.84.170.161","TCP","358","[TCP Retransmission] 443  >  59747 [PSH, ACK] Seq=64001 Ack=36072 Win=4982 Len=304"
"111","18.678217800","100.84.170.161","151.101.66.187","TCP","66","59747  >  443 [ACK] Seq=36072 Ack=64305 Win=4102 Len=0 SLE=64001 SRE=64305"
"112","19.177290200","100.84.170.161","151.101.66.187","TLSv1.2","540","Application Data"
"113","19.177484800","100.84.170.161","151.101.66.187","TLSv1.2","2110","Application Data"
"114","19.187475900","151.101.66.187","100.84.170.161","TCP","56","443  >  59747 [ACK] Seq=64305 Ack=38614 Win=4990 Len=0"
"115","19.190841400","151.101.66.187","100.84.170.161","TLSv1.2","131","Application Data"
"116","19.191286900","151.101.66.187","100.84.170.161","TLSv1.2","130","Application Data"
"117","19.191331200","100.84.170.161","151.101.66.187","TCP","54","59747  >  443 [ACK] Seq=38614 Ack=64458 Win=4101 Len=0"
"118","19.345901600","100.84.170.161","151.101.66.187","TLSv1.2","555","Application Data"
"119","19.347612200","100.84.170.161","151.101.66.187","TLSv1.2","2107","Application Data"
"120","19.350116800","100.84.170.161","151.101.66.187","TLSv1.2","550","Application Data"
"121","19.354531700","151.101.66.187","100.84.170.161","TCP","56","443  >  59747 [ACK] Seq=64458 Ack=39115 Win=4990 Len=0"
"122","19.355538900","100.84.170.161","151.101.66.187","TLSv1.2","2097","Application Data"
"123","19.356596200","151.101.66.187","100.84.170.161","TCP","56","443  >  59747 [ACK] Seq=64458 Ack=41168 Win=4998 Len=0"
"124","19.357077900","151.101.66.187","100.84.170.161","TLSv1.2","235","Application Data"
"125","19.359317200","151.101.66.187","100.84.170.161","TLSv1.2","129","Application Data"
"126","19.359317200","151.101.66.187","100.84.170.161","TCP","56","443  >  59747 [ACK] Seq=64714 Ack=41664 Win=4998 Len=0"
"127","19.359479200","100.84.170.161","151.101.66.187","TCP","54","59747  >  443 [ACK] Seq=43707 Ack=64714 Win=4106 Len=0"
"128","19.361195300","151.101.66.187","100.84.170.161","TLSv1.2","125","Application Data"
"129","19.364380900","151.101.66.187","100.84.170.161","TCP","56","443  >  59747 [ACK] Seq=64785 Ack=43707 Win=5006 Len=0"
"130","19.367484500","151.101.66.187","100.84.170.161","TLSv1.2","130","Application Data"
"131","19.367535200","100.84.170.161","151.101.66.187","TCP","54","59747  >  443 [ACK] Seq=43707 Ack=64861 Win=4105 Len=0"
"132","19.512678000","100.84.170.161","151.101.66.187","TLSv1.2","494","Application Data"
"133","19.521782100","151.101.66.187","100.84.170.161","TCP","56","443  >  59747 [ACK] Seq=64861 Ack=44147 Win=5006 Len=0"
"134","19.524622300","151.101.66.187","100.84.170.161","TLSv1.2","217","Application Data"
"135","19.524622300","151.101.66.187","100.84.170.161","TLSv1.2","375","Application Data"
"136","19.524678600","100.84.170.161","151.101.66.187","TCP","54","59747  >  443 [ACK] Seq=44147 Ack=65345 Win=4103 Len=0"
"137","19.527765600","100.84.170.161","151.101.66.187","TLSv1.2","89","Application Data"
"138","19.536854900","151.101.66.187","100.84.170.161","TCP","56","443  >  59747 [ACK] Seq=65345 Ack=44182 Win=5006 Len=0"
"139","24.047507000","100.84.170.161","151.101.66.187","TLSv1.2","2023","Application Data"
"140","24.075188200","100.84.170.161","151.101.66.187","TCP","1514","[TCP Retransmission] 59747  >  443 [PSH, ACK] Seq=44691 Ack=65345 Win=4103 Len=1460"
"141","24.113706700","151.101.66.187","100.84.170.161","TCP","56","443  >  59747 [ACK] Seq=65345 Ack=46151 Win=5014 Len=0"
"142","24.136403700","151.101.66.187","100.84.170.161","TCP","66","[TCP Dup ACK 141#1] 443  >  59747 [ACK] Seq=65345 Ack=46151 Win=5014 Len=0 SLE=44691 SRE=46151"
"143","24.152607000","151.101.66.187","100.84.170.161","TLSv1.2","652","Application Data"
"144","24.177815000","151.101.66.187","100.84.170.161","TCP","652","[TCP Retransmission] 443  >  59747 [PSH, ACK] Seq=65345 Ack=46151 Win=5014 Len=598"
"145","24.177885100","100.84.170.161","151.101.66.187","TCP","66","59747  >  443 [ACK] Seq=46151 Ack=65943 Win=4101 Len=0 SLE=65345 SRE=65943"
"146","24.229536000","100.84.170.161","151.101.66.187","TLSv1.2","619","Application Data"
"147","24.230538100","100.84.170.161","151.101.66.187","TLSv1.2","1998","Application Data"
"148","24.238424900","151.101.66.187","100.84.170.161","TCP","56","443  >  59747 [ACK] Seq=65943 Ack=46716 Win=5014 Len=0"
"149","24.239143500","151.101.66.187","100.84.170.161","TCP","56","443  >  59747 [ACK] Seq=65943 Ack=48660 Win=5014 Len=0"
"150","24.240812700","151.101.66.187","100.84.170.161","TLSv1.2","238","Application Data"
"151","24.241283300","151.101.66.187","100.84.170.161","TLSv1.2","98","Application Data"
"152","24.241312800","100.84.170.161","151.101.66.187","TCP","54","59747  >  443 [ACK] Seq=48660 Ack=66171 Win=4100 Len=0"
"153","24.460935900","100.84.170.161","151.101.66.187","TLSv1.2","633","Application Data"
"154","24.470042100","151.101.66.187","100.84.170.161","TCP","56","443  >  59747 [ACK] Seq=66171 Ack=49239 Win=5014 Len=0"
"155","24.472579800","151.101.66.187","100.84.170.161","TLSv1.2","235","Application Data"
"156","24.498228300","151.101.66.187","100.84.170.161","TCP","235","[TCP Retransmission] 443  >  59747 [PSH, ACK] Seq=66171 Ack=49239 Win=5014 Len=181"
"157","24.498290000","100.84.170.161","151.101.66.187","TCP","66","59747  >  443 [ACK] Seq=49239 Ack=66352 Win=4106 Len=0 SLE=66171 SRE=66352"
"158","24.770848800","100.84.170.161","151.101.66.187","TLSv1.2","2020","Application Data"
"159","24.781827900","151.101.66.187","100.84.170.161","TCP","56","443  >  59747 [ACK] Seq=66352 Ack=51205 Win=5021 Len=0"
"160","24.786396300","151.101.66.187","100.84.170.161","TLSv1.2","130","Application Data"
"161","24.810903500","151.101.66.187","100.84.170.161","TCP","130","[TCP Retransmission] 443  >  59747 [PSH, ACK] Seq=66352 Ack=51205 Win=5021 Len=76"
"162","24.810983500","100.84.170.161","151.101.66.187","TCP","66","59747  >  443 [ACK] Seq=51205 Ack=66428 Win=4105 Len=0 SLE=66352 SRE=66428"
"163","24.855261800","100.84.170.161","151.101.66.187","TLSv1.2","618","Application Data"
"164","24.863825300","151.101.66.187","100.84.170.161","TCP","56","443  >  59747 [ACK] Seq=66428 Ack=51769 Win=5021 Len=0"
"165","24.866368900","151.101.66.187","100.84.170.161","TLSv1.2","124","Application Data"
"166","24.890969900","151.101.66.187","100.84.170.161","TCP","124","[TCP Retransmission] 443  >  59747 [PSH, ACK] Seq=66428 Ack=51769 Win=5021 Len=70"
"167","24.891009500","100.84.170.161","151.101.66.187","TCP","66","59747  >  443 [ACK] Seq=51769 Ack=66498 Win=4105 Len=0 SLE=66428 SRE=66498"
"168","26.917944500","100.84.170.161","151.101.66.187","TCP","55","55359  >  443 [ACK] Seq=1 Ack=1 Win=512 Len=1 [TCP PDU reassembled in 295]"
"169","26.928002100","151.101.66.187","100.84.170.161","TCP","66","443  >  55359 [ACK] Seq=1 Ack=2 Win=281 Len=0 SLE=1 SRE=2"
"170","29.348899100","100.84.170.161","151.101.66.187","TLSv1.2","2082","Application Data"
"171","29.357656600","151.101.66.187","100.84.170.161","TCP","56","443  >  59747 [ACK] Seq=66498 Ack=53797 Win=5029 Len=0"
"172","29.363095000","151.101.66.187","100.84.170.161","TLSv1.2","241","Application Data"
"173","29.388992500","151.101.66.187","100.84.170.161","TCP","241","[TCP Retransmission] 443  >  59747 [PSH, ACK] Seq=66498 Ack=53797 Win=5029 Len=187"
"174","29.389029800","100.84.170.161","151.101.66.187","TCP","66","59747  >  443 [ACK] Seq=53797 Ack=66685 Win=4104 Len=0 SLE=66498 SRE=66685"
"175","30.011562300","100.84.170.161","151.101.66.187","TLSv1.2","781","Application Data"
"176","30.020190700","151.101.66.187","100.84.170.161","TCP","56","443  >  59747 [ACK] Seq=66685 Ack=54524 Win=5029 Len=0"
"177","30.023747000","151.101.66.187","100.84.170.161","TLSv1.2","104","Application Data"
"178","30.029578600","100.84.170.161","151.101.66.187","TLSv1.2","1886","Application Data"
"179","30.030160200","100.84.170.161","151.101.66.187","TLSv1.2","793","Application Data"
"180","30.035847400","100.84.170.161","151.101.66.187","TLSv1.2","1880","Application Data"
"181","30.038345600","151.101.66.187","100.84.170.161","TCP","56","443  >  59747 [ACK] Seq=66735 Ack=56356 Win=5029 Len=0"
"182","30.038579900","151.101.66.187","100.84.170.161","TCP","56","443  >  59747 [ACK] Seq=66735 Ack=57095 Win=5029 Len=0"
"183","30.041381900","151.101.66.187","100.84.170.161","TLSv1.2","131","Application Data"
"184","30.041595000","151.101.66.187","100.84.170.161","TLSv1.2","124","Application Data"
"185","30.041628200","100.84.170.161","151.101.66.187","TCP","54","59747  >  443 [ACK] Seq=58921 Ack=66882 Win=4104 Len=0"
"186","30.044482500","151.101.66.187","100.84.170.161","TCP","56","443  >  59747 [ACK] Seq=66882 Ack=58921 Win=5029 Len=0"
"187","30.047122100","151.101.66.187","100.84.170.161","TLSv1.2","124","Application Data"
"188","30.077046300","151.101.66.187","100.84.170.161","TCP","124","[TCP Retransmission] 443  >  59747 [PSH, ACK] Seq=66882 Ack=58921 Win=5029 Len=70"
"189","30.077104600","100.84.170.161","151.101.66.187","TCP","66","59747  >  443 [ACK] Seq=58921 Ack=66952 Win=4103 Len=0 SLE=66882 SRE=66952"
"190","30.196532100","100.84.170.161","151.101.66.187","TLSv1.2","793","Application Data"
"191","30.206123200","151.101.66.187","100.84.170.161","TCP","56","443  >  59747 [ACK] Seq=66952 Ack=59660 Win=5029 Len=0"
"192","30.211162900","151.101.66.187","100.84.170.161","TLSv1.2","168","Application Data"
"193","30.213714600","100.84.170.161","151.101.66.187","TLSv1.2","1884","Application Data"
"194","30.223056800","151.101.66.187","100.84.170.161","TCP","56","443  >  59747 [ACK] Seq=67066 Ack=61490 Win=5029 Len=0"
"195","30.225917500","151.101.66.187","100.84.170.161","TLSv1.2","125","Application Data"
"196","30.236651600","100.84.170.161","151.101.66.187","TLSv1.2","835","Application Data"
"197","30.246319000","151.101.66.187","100.84.170.161","TCP","56","443  >  59747 [ACK] Seq=67137 Ack=62271 Win=5029 Len=0"
"198","30.248621800","151.101.66.187","100.84.170.161","TLSv1.2","131","Application Data"
"199","30.276217800","151.101.66.187","100.84.170.161","TCP","131","[TCP Retransmission] 443  >  59747 [PSH, ACK] Seq=67137 Ack=62271 Win=5029 Len=77"
"200","30.276289100","100.84.170.161","151.101.66.187","TCP","66","59747  >  443 [ACK] Seq=62271 Ack=67214 Win=4102 Len=0 SLE=67137 SRE=67214"
"201","30.331136500","100.84.170.161","151.101.66.187","TLSv1.2","1807","Application Data"
"202","30.357946300","100.84.170.161","151.101.66.187","TCP","1514","[TCP Retransmission] 59747  >  443 [PSH, ACK] Seq=62564 Ack=67214 Win=4102 Len=1460"
"203","30.369750100","100.84.170.161","151.101.66.187","TLSv1.2","833","Application Data"
"204","30.383767000","100.84.170.161","151.101.66.187","TLSv1.2","1873","Application Data"
"205","30.383944000","100.84.170.161","151.101.66.187","TLSv1.2","798","Application Data"
"206","30.384943900","100.84.170.161","151.101.66.187","TLSv1.2","1879","Application Data"
"207","30.404366100","100.84.170.161","151.101.66.187","TLSv1.2","840","Application Data"
"208","30.413296700","151.101.66.187","100.84.170.161","TCP","56","443  >  59747 [ACK] Seq=67214 Ack=64024 Win=5029 Len=0"
"209","30.413868800","151.101.66.187","100.84.170.161","TLSv1.2","316","Application Data"
"210","30.413868800","151.101.66.187","100.84.170.161","TLSv1.2","268","Application Data"
"211","30.413946100","100.84.170.161","151.101.66.187","TCP","54","59747  >  443 [ACK] Seq=69977 Ack=67690 Win=4101 Len=0"
"212","30.415420700","100.84.170.161","151.101.66.187","TLSv1.2","89","Application Data"
"213","30.436806800","151.101.66.187","100.84.170.161","TCP","66","[TCP Dup ACK 208#1] 443  >  59747 [ACK] Seq=67690 Ack=64024 Win=5029 Len=0 SLE=62564 SRE=64024"
"214","30.437081900","151.101.66.187","100.84.170.161","TCP","268","[TCP Spurious Retransmission] 443  >  59747 [PSH, ACK] Seq=67476 Ack=64024 Win=5029 Len=214"
"215","30.437114800","100.84.170.161","151.101.66.187","TCP","66","[TCP Dup ACK 211#1] 59747  >  443 [ACK] Seq=70012 Ack=67690 Win=4101 Len=0 SLE=67476 SRE=67690"
"216","30.446515800","151.101.66.187","100.84.170.161","TCP","56","443  >  59747 [ACK] Seq=67690 Ack=69191 Win=5029 Len=0"
"217","30.446834100","151.101.66.187","100.84.170.161","TLSv1.2","258","Application Data"
"218","30.446878900","100.84.170.161","151.101.66.187","TCP","54","59747  >  443 [ACK] Seq=70012 Ack=67894 Win=4106 Len=0"
"219","30.447475800","151.101.66.187","100.84.170.161","TLSv1.2","124","Application Data"
"220","30.447475800","151.101.66.187","100.84.170.161","TLSv1.2","125","Application Data"
"221","30.447529800","100.84.170.161","151.101.66.187","TCP","54","59747  >  443 [ACK] Seq=70012 Ack=68035 Win=4105 Len=0"
"222","30.447848400","151.101.66.187","100.84.170.161","TLSv1.2","125","Application Data"
"223","30.447891500","100.84.170.161","151.101.66.187","TCP","54","59747  >  443 [ACK] Seq=70012 Ack=68106 Win=4105 Len=0"
"224","30.448160100","151.101.66.187","100.84.170.161","TCP","56","443  >  59747 [ACK] Seq=68106 Ack=69977 Win=5029 Len=0"
"225","30.448160100","151.101.66.187","100.84.170.161","TLSv1.2","124","Application Data"
"226","30.453907000","151.101.66.187","100.84.170.161","TCP","56","443  >  59747 [ACK] Seq=68176 Ack=70012 Win=5029 Len=0"
"227","30.488720600","100.84.170.161","151.101.66.187","TCP","54","59747  >  443 [ACK] Seq=70012 Ack=68176 Win=4105 Len=0"
"228","30.534271500","151.101.66.187","100.84.170.161","TCP","124","[TCP Spurious Retransmission] 443  >  59747 [PSH, ACK] Seq=68106 Ack=70012 Win=5029 Len=70"
"229","30.534308000","100.84.170.161","151.101.66.187","TCP","66","[TCP Dup ACK 227#1] 59747  >  443 [ACK] Seq=70012 Ack=68176 Win=4105 Len=0 SLE=68106 SRE=68176"
"230","30.679058200","100.84.170.161","151.101.66.187","TLSv1.2","1851","Application Data"
"231","30.679256900","100.84.170.161","151.101.66.187","TLSv1.2","851","Application Data"
"232","30.689417800","151.101.66.187","100.84.170.161","TCP","56","443  >  59747 [ACK] Seq=68176 Ack=71809 Win=5029 Len=0"
"233","30.689672100","151.101.66.187","100.84.170.161","TCP","56","443  >  59747 [ACK] Seq=68176 Ack=72606 Win=5029 Len=0"
"234","30.692403100","151.101.66.187","100.84.170.161","TLSv1.2","104","Application Data"
"235","30.692663700","151.101.66.187","100.84.170.161","TLSv1.2","125","Application Data"
"236","30.692690700","100.84.170.161","151.101.66.187","TCP","54","59747  >  443 [ACK] Seq=72606 Ack=68297 Win=4104 Len=0"
"237","30.960069000","100.84.170.161","151.101.66.187","TLSv1.2","1990","Application Data"
"238","30.968720500","151.101.66.187","100.84.170.161","TCP","56","443  >  59747 [ACK] Seq=68297 Ack=74542 Win=5029 Len=0"
"239","30.973098000","100.84.170.161","151.101.66.187","TLSv1.2","903","Application Data"
"240","30.981598400","151.101.66.187","100.84.170.161","TCP","56","443  >  59747 [ACK] Seq=68297 Ack=75391 Win=5029 Len=0"
"241","30.984424100","151.101.66.187","100.84.170.161","TLSv1.2","98","Application Data"
"242","30.999683500","100.84.170.161","151.101.66.187","TLSv1.2","1783","Application Data"
"243","31.008730200","151.101.66.187","100.84.170.161","TCP","56","443  >  59747 [ACK] Seq=68341 Ack=77120 Win=5029 Len=0"
"244","31.011213800","151.101.66.187","100.84.170.161","TLSv1.2","125","Application Data"
"245","31.022469400","151.101.66.187","100.84.170.161","TLSv1.2","479","Application Data"
"246","31.022538100","100.84.170.161","151.101.66.187","TCP","54","59747  >  443 [ACK] Seq=77120 Ack=68837 Win=4102 Len=0"
"247","31.022765900","151.101.66.187","100.84.170.161","TCP","1510","443  >  59747 [ACK] Seq=68837 Ack=77120 Win=5029 Len=1456 [TCP PDU reassembled in 249]"
"248","31.023512700","151.101.66.187","100.84.170.161","TCP","1510","443  >  59747 [ACK] Seq=70293 Ack=77120 Win=5029 Len=1456 [TCP PDU reassembled in 249]"
"249","31.023512700","151.101.66.187","100.84.170.161","TLSv1.2","813","Application Data"
"250","31.023512700","151.101.66.187","100.84.170.161","TLSv1.2","86","Application Data"
"251","31.023512700","151.101.66.187","100.84.170.161","TLSv1.2","936","Application Data"
"252","31.023512700","151.101.66.187","100.84.170.161","TLSv1.2","85","Application Data"
"253","31.023594200","100.84.170.161","151.101.66.187","TCP","54","59747  >  443 [ACK] Seq=77120 Ack=73453 Win=4106 Len=0"
"254","31.150997300","100.84.170.161","151.101.66.187","TLSv1.2","940","Application Data"
"255","31.161244500","151.101.66.187","100.84.170.161","TCP","56","443  >  59747 [ACK] Seq=73453 Ack=78006 Win=5029 Len=0"
"256","31.164086300","151.101.66.187","100.84.170.161","TLSv1.2","311","Application Data"
"257","31.199332900","151.101.66.187","100.84.170.161","TCP","311","[TCP Retransmission] 443  >  59747 [PSH, ACK] Seq=73453 Ack=78006 Win=5029 Len=257"
"258","31.199375900","100.84.170.161","151.101.66.187","TCP","66","59747  >  443 [ACK] Seq=78006 Ack=73710 Win=4105 Len=0 SLE=73453 SRE=73710"
"259","31.253641500","100.84.170.161","151.101.66.187","TLSv1.2","1771","Application Data"
"260","31.262599800","151.101.66.187","100.84.170.161","TCP","56","443  >  59747 [ACK] Seq=73710 Ack=79723 Win=5029 Len=0"
"261","31.265451000","151.101.66.187","100.84.170.161","TLSv1.2","264","Application Data"
"262","31.281975200","100.84.170.161","151.101.66.187","TLSv1.2","938","Application Data"
"263","31.284568000","100.84.170.161","151.101.66.187","TLSv1.2","1766","Application Data"
"264","31.290722800","151.101.66.187","100.84.170.161","TCP","56","443  >  59747 [ACK] Seq=73920 Ack=80607 Win=5029 Len=0"
"265","31.293750300","151.101.66.187","100.84.170.161","TLSv1.2","234","Application Data"
"266","31.295993600","151.101.66.187","100.84.170.161","TLSv1.2","131","Application Data"
"267","31.296052900","100.84.170.161","151.101.66.187","TCP","54","59747  >  443 [ACK] Seq=82319 Ack=74177 Win=4103 Len=0"
"268","31.441498000","100.84.170.161","151.101.66.187","TLSv1.2","928","Application Data"
"269","31.441754700","100.84.170.161","151.101.66.187","TLSv1.2","1753","Application Data"
"270","31.450628500","151.101.66.187","100.84.170.161","TCP","56","443  >  59747 [ACK] Seq=74177 Ack=83193 Win=5029 Len=0"
"271","31.451644200","151.101.66.187","100.84.170.161","TCP","56","443  >  59747 [ACK] Seq=74177 Ack=84892 Win=5029 Len=0"
"272","31.453731900","151.101.66.187","100.84.170.161","TLSv1.2","130","Application Data"
"273","31.454402300","151.101.66.187","100.84.170.161","TLSv1.2","124","Application Data"
"274","31.454453500","100.84.170.161","151.101.66.187","TCP","54","59747  >  443 [ACK] Seq=84892 Ack=74323 Win=4102 Len=0"
"275","31.953526500","100.84.170.161","151.101.66.187","TLSv1.2","938","Application Data"
"276","31.953773200","100.84.170.161","151.101.66.187","TLSv1.2","1789","Application Data"
"277","31.954134600","100.84.170.161","151.101.66.187","TLSv1.2","944","Application Data"
"278","31.965942200","151.101.66.187","100.84.170.161","TCP","56","443  >  59747 [ACK] Seq=74323 Ack=88401 Win=5029 Len=0"
"279","31.968139700","151.101.66.187","100.84.170.161","TLSv1.2","125","Application Data"
"280","31.968474600","151.101.66.187","100.84.170.161","TLSv1.2","130","Application Data"
"281","31.968503200","100.84.170.161","151.101.66.187","TCP","54","59747  >  443 [ACK] Seq=88401 Ack=74470 Win=4102 Len=0"
"282","31.969287700","151.101.66.187","100.84.170.161","TLSv1.2","130","Application Data"
"283","32.005775600","100.84.170.161","151.101.66.187","TLSv1.2","1781","Application Data"
"284","32.010341900","151.101.66.187","100.84.170.161","TCP","130","[TCP Spurious Retransmission] 443  >  59747 [PSH, ACK] Seq=74470 Ack=88401 Win=5029 Len=76"
"285","32.010479900","100.84.170.161","151.101.66.187","TCP","66","[TCP Dup ACK 283#1] 59747  >  443 [ACK] Seq=90128 Ack=74546 Win=4101 Len=0 SLE=74470 SRE=74546"
"286","32.014672600","151.101.66.187","100.84.170.161","TCP","56","443  >  59747 [ACK] Seq=74546 Ack=90128 Win=5029 Len=0"
"287","32.017194000","151.101.66.187","100.84.170.161","TLSv1.2","98","Application Data"
"288","32.049878000","151.101.66.187","100.84.170.161","TCP","98","[TCP Retransmission] 443  >  59747 [PSH, ACK] Seq=74546 Ack=90128 Win=5029 Len=44"
"289","32.049918000","100.84.170.161","151.101.66.187","TCP","66","59747  >  443 [ACK] Seq=90128 Ack=74590 Win=4101 Len=0 SLE=74546 SRE=74590"
"290","32.380423600","100.84.170.161","151.101.66.187","TLSv1.2","923","Application Data"
"291","32.389272000","151.101.66.187","100.84.170.161","TCP","56","443  >  59747 [ACK] Seq=74590 Ack=90997 Win=5029 Len=0"
"292","32.392749300","151.101.66.187","100.84.170.161","TLSv1.2","241","Application Data"
"293","32.425220500","151.101.66.187","100.84.170.161","TCP","241","[TCP Retransmission] 443  >  59747 [PSH, ACK] Seq=74590 Ack=90997 Win=5029 Len=187"
"294","32.425298500","100.84.170.161","151.101.66.187","TCP","66","59747  >  443 [ACK] Seq=90997 Ack=74777 Win=4101 Len=0 SLE=74590 SRE=74777"
"295","32.502023800","100.84.170.161","151.101.66.187","TLSv1.2","175","Ignored Unknown Record"
"296","32.502149200","100.84.170.161","151.101.66.187","TLSv1.2","93","Application Data"
"297","32.510617800","151.101.66.187","100.84.170.161","TCP","56","443  >  55359 [ACK] Seq=1 Ack=123 Win=281 Len=0"
"298","32.511160100","151.101.66.187","100.84.170.161","TCP","56","443  >  55359 [ACK] Seq=1 Ack=162 Win=281 Len=0"
"299","32.511742300","151.101.66.187","100.84.170.161","TLSv1.2","93","Application Data"
"300","32.538734700","151.101.66.187","100.84.170.161","TCP","93","[TCP Retransmission] 443  >  55359 [PSH, ACK] Seq=1 Ack=162 Win=281 Len=39"
"301","32.538785400","100.84.170.161","151.101.66.187","TCP","66","55359  >  443 [ACK] Seq=162 Ack=40 Win=512 Len=0 SLE=1 SRE=40"
"302","32.561477700","151.101.66.187","100.84.170.161","TLSv1.2","381","Application Data"
"303","32.561753400","151.101.66.187","100.84.170.161","TLSv1.2","823","Application Data"
"304","32.561788600","100.84.170.161","151.101.66.187","TCP","54","55359  >  443 [ACK] Seq=162 Ack=1136 Win=507 Len=0"
"305","32.562653400","100.84.170.161","151.101.66.187","TLSv1.2","89","Application Data"
"306","32.571323100","151.101.66.187","100.84.170.161","TCP","56","443  >  55359 [ACK] Seq=1136 Ack=197 Win=281 Len=0"
"307","32.761718500","100.84.170.161","151.101.66.187","TLSv1.2","1798","Application Data"
"308","32.765976100","100.84.170.161","151.101.66.187","TLSv1.2","888","Application Data"
"309","32.770714900","100.84.170.161","151.101.66.187","TLSv1.2","1805","Application Data"
"310","32.771756900","151.101.66.187","100.84.170.161","TCP","56","443  >  59747 [ACK] Seq=74777 Ack=92741 Win=5029 Len=0"
"311","32.774347400","151.101.66.187","100.84.170.161","TLSv1.2","131","Application Data"
"312","32.774714600","151.101.66.187","100.84.170.161","TCP","56","443  >  59747 [ACK] Seq=74854 Ack=93575 Win=5029 Len=0"
"313","32.776841200","151.101.66.187","100.84.170.161","TLSv1.2","98","Application Data"
"314","32.776908500","100.84.170.161","151.101.66.187","TCP","54","59747  >  443 [ACK] Seq=95326 Ack=74898 Win=4100 Len=0"
"315","32.779572900","151.101.66.187","100.84.170.161","TCP","56","443  >  59747 [ACK] Seq=74898 Ack=95326 Win=5029 Len=0"
"316","32.782166000","151.101.66.187","100.84.170.161","TLSv1.2","129","Application Data"
"317","32.818649600","151.101.66.187","100.84.170.161","TCP","129","[TCP Retransmission] 443  >  59747 [PSH, ACK] Seq=74898 Ack=95326 Win=5029 Len=75"
"318","32.818688700","100.84.170.161","151.101.66.187","TCP","66","59747  >  443 [ACK] Seq=95326 Ack=74973 Win=4106 Len=0 SLE=74898 SRE=74973"
"319","32.822138800","100.84.170.161","151.101.66.187","TLSv1.2","904","Application Data"
"320","32.822360800","100.84.170.161","151.101.66.187","TLSv1.2","1759","Application Data"
"321","32.831008500","151.101.66.187","100.84.170.161","TCP","56","443  >  59747 [ACK] Seq=74973 Ack=97881 Win=5029 Len=0"
"322","32.836316200","151.101.66.187","100.84.170.161","TLSv1.2","206","Application Data"
"323","32.836691900","151.101.66.187","100.84.170.161","TLSv1.2","265","Application Data"
"324","32.836725500","100.84.170.161","151.101.66.187","TCP","54","59747  >  443 [ACK] Seq=97881 Ack=75336 Win=4104 Len=0"
"325","32.881499600","100.84.170.161","151.101.66.187","TLSv1.2","927","Application Data"
"326","32.890471900","151.101.66.187","100.84.170.161","TCP","56","443  >  59747 [ACK] Seq=75336 Ack=98754 Win=5029 Len=0"
"327","32.892744400","151.101.66.187","100.84.170.161","TLSv1.2","130","Application Data"
"328","32.923207600","151.101.66.187","100.84.170.161","TCP","130","[TCP Retransmission] 443  >  59747 [PSH, ACK] Seq=75336 Ack=98754 Win=5029 Len=76"
"329","32.923242000","100.84.170.161","151.101.66.187","TCP","66","59747  >  443 [ACK] Seq=98754 Ack=75412 Win=4104 Len=0 SLE=75336 SRE=75412"
"330","41.697031400","100.84.170.161","151.101.66.187","TLSv1.2","1884","Application Data"
"331","41.705748000","151.101.66.187","100.84.170.161","TCP","56","443  >  59747 [ACK] Seq=75412 Ack=100584 Win=5029 Len=0"
"332","42.299732800","151.101.66.187","100.84.170.161","TLSv1.2","423","Application Data"
"333","42.299732800","151.101.66.187","100.84.170.161","TLSv1.2","56838","Application Data, Application Data, Application Data"
"334","42.299732800","151.101.66.187","100.84.170.161","TLSv1.2","861","Application Data"
"335","42.299732800","151.101.66.187","100.84.170.161","TCP","861","[TCP Retransmission] 443  >  59747 [PSH, ACK] Seq=132565 Ack=100584 Win=5029 Len=807 [TCP PDU reassembled in 334]"
"336","42.299907500","100.84.170.161","151.101.66.187","TCP","66","59747  >  443 [ACK] Seq=100584 Ack=133372 Win=4106 Len=0 SLE=132565 SRE=133372"
"337","42.303278200","100.84.170.161","151.101.66.187","TLSv1.2","89","Application Data"
"338","42.312063100","151.101.66.187","100.84.170.161","TCP","56","443  >  59747 [ACK] Seq=133372 Ack=100619 Win=5029 Len=0"
"339","42.681408400","100.84.170.161","151.101.66.187","TLSv1.2","953","Application Data"
"340","42.681603100","100.84.170.161","151.101.66.187","TLSv1.2","1780","Application Data"
"341","42.686811100","100.84.170.161","151.101.66.187","TLSv1.2","953","Application Data"
"342","42.690177700","151.101.66.187","100.84.170.161","TCP","56","443  >  59747 [ACK] Seq=133372 Ack=101518 Win=5029 Len=0"
"343","42.690602000","151.101.66.187","100.84.170.161","TCP","56","443  >  59747 [ACK] Seq=133372 Ack=103244 Win=5029 Len=0"
"344","42.692481800","151.101.66.187","100.84.170.161","TLSv1.2","240","Application Data"
"345","42.692799500","151.101.66.187","100.84.170.161","TLSv1.2","130","Application Data"
"346","42.692828900","100.84.170.161","151.101.66.187","TCP","54","59747  >  443 [ACK] Seq=104143 Ack=133634 Win=4105 Len=0"
"347","42.693362300","100.84.170.161","151.101.66.187","TLSv1.2","1787","Application Data"
"348","42.693510600","100.84.170.161","151.101.66.187","TLSv1.2","973","Application Data"
"349","42.695310300","151.101.66.187","100.84.170.161","TCP","56","443  >  59747 [ACK] Seq=133634 Ack=104143 Win=5029 Len=0"
"350","42.695747100","100.84.170.161","151.101.66.187","TLSv1.2","1778","Application Data"
"351","42.697836900","151.101.66.187","100.84.170.161","TLSv1.2","131","Application Data"
"352","42.702335200","151.101.66.187","100.84.170.161","TCP","56","443  >  59747 [ACK] Seq=133711 Ack=105876 Win=5029 Len=0"
"353","42.702335200","151.101.66.187","100.84.170.161","TCP","56","443  >  59747 [ACK] Seq=133711 Ack=106795 Win=5029 Len=0"
"354","42.704418200","151.101.66.187","100.84.170.161","TCP","56","443  >  59747 [ACK] Seq=133711 Ack=108519 Win=5029 Len=0"
"355","42.705186200","151.101.66.187","100.84.170.161","TLSv1.2","223","Application Data"
"356","42.705446200","100.84.170.161","151.101.66.187","TCP","54","59747  >  443 [ACK] Seq=108519 Ack=133880 Win=4104 Len=0"
"357","42.707010600","151.101.66.187","100.84.170.161","TLSv1.2","156","Application Data"
"358","42.715116300","100.84.170.161","151.101.66.187","TLSv1.2","942","Application Data"
"359","42.723539000","151.101.66.187","100.84.170.161","TCP","56","443  >  59747 [ACK] Seq=133982 Ack=109407 Win=5029 Len=0"
"360","42.726316400","151.101.66.187","100.84.170.161","TLSv1.2","265","Application Data"
"361","42.735536500","100.84.170.161","151.101.66.187","TLSv1.2","1772","Application Data"
"362","42.744346800","151.101.66.187","100.84.170.161","TCP","56","443  >  59747 [ACK] Seq=134193 Ack=111125 Win=5029 Len=0"
"363","42.746801600","151.101.66.187","100.84.170.161","TLSv1.2","130","Application Data"
"364","42.772477500","100.84.170.161","151.101.66.187","TLSv1.2","979","Application Data"
"365","42.776683100","100.84.170.161","151.101.66.187","TLSv1.2","1782","Application Data"
"366","42.777446100","100.84.170.161","151.101.66.187","TLSv1.2","974","Application Data"
"367","42.779180400","151.101.66.187","100.84.170.161","TCP","130","[TCP Spurious Retransmission] 443  >  59747 [PSH, ACK] Seq=134193 Ack=111125 Win=5029 Len=76"
"368","42.779229600","100.84.170.161","151.101.66.187","TCP","66","[TCP Dup ACK 364#1] 59747  >  443 [ACK] Seq=114698 Ack=134269 Win=4102 Len=0 SLE=134193 SRE=134269"
"369","42.781282800","151.101.66.187","100.84.170.161","TCP","56","443  >  59747 [ACK] Seq=134269 Ack=112050 Win=5029 Len=0"
"370","42.783547000","100.84.170.161","151.101.66.187","TLSv1.2","1781","Application Data"
"371","42.784470900","100.84.170.161","151.101.66.187","TLSv1.2","970","Application Data"
"372","42.784846700","151.101.66.187","100.84.170.161","TLSv1.2","124","Application Data"
"373","42.785425700","151.101.66.187","100.84.170.161","TCP","56","443  >  59747 [ACK] Seq=134339 Ack=113778 Win=5029 Len=0"
"374","42.785834200","151.101.66.187","100.84.170.161","TCP","56","443  >  59747 [ACK] Seq=134339 Ack=114698 Win=5029 Len=0"
"375","42.787856400","151.101.66.187","100.84.170.161","TLSv1.2","124","Application Data"
"376","42.787921100","100.84.170.161","151.101.66.187","TCP","54","59747  >  443 [ACK] Seq=117341 Ack=134409 Win=4102 Len=0"
"377","42.788614800","151.101.66.187","100.84.170.161","TLSv1.2","130","Application Data"
"378","42.792820300","151.101.66.187","100.84.170.161","TCP","56","443  >  59747 [ACK] Seq=134485 Ack=116425 Win=5029 Len=0"
"379","42.794157500","151.101.66.187","100.84.170.161","TCP","56","443  >  59747 [ACK] Seq=134485 Ack=117341 Win=5029 Len=0"
"380","42.795886800","151.101.66.187","100.84.170.161","TLSv1.2","131","Application Data"
"381","42.795945700","100.84.170.161","151.101.66.187","TCP","54","59747  >  443 [ACK] Seq=117341 Ack=134562 Win=4101 Len=0"
"382","42.797824000","151.101.66.187","100.84.170.161","TLSv1.2","131","Application Data"
"383","42.837955200","151.101.66.187","100.84.170.161","TCP","131","[TCP Retransmission] 443  >  59747 [PSH, ACK] Seq=134562 Ack=117341 Win=5029 Len=77"
"384","42.838070300","100.84.170.161","151.101.66.187","TCP","66","59747  >  443 [ACK] Seq=117341 Ack=134639 Win=4101 Len=0 SLE=134562 SRE=134639"
"385","42.884616000","100.84.170.161","151.101.66.187","TLSv1.2","1773","Application Data"
"386","42.885479300","100.84.170.161","151.101.66.187","TLSv1.2","984","Application Data"
"387","42.893524500","151.101.66.187","100.84.170.161","TCP","56","443  >  59747 [ACK] Seq=134639 Ack=119060 Win=5029 Len=0"
"388","42.894328000","151.101.66.187","100.84.170.161","TCP","56","443  >  59747 [ACK] Seq=134639 Ack=119990 Win=5029 Len=0"
"389","42.896117300","151.101.66.187","100.84.170.161","TLSv1.2","131","Application Data"
"390","42.896443500","151.101.66.187","100.84.170.161","TLSv1.2","240","Application Data"
"391","42.896477600","100.84.170.161","151.101.66.187","TCP","54","59747  >  443 [ACK] Seq=119990 Ack=134902 Win=4106 Len=0"
"392","43.026475500","100.84.170.161","151.101.66.187","TLSv1.2","1803","Application Data"
"393","43.032030900","100.84.170.161","151.101.66.187","TLSv1.2","928","Application Data"
"394","43.035566400","151.101.66.187","100.84.170.161","TCP","56","443  >  59747 [ACK] Seq=134902 Ack=121739 Win=5029 Len=0"
"395","43.038112600","151.101.66.187","100.84.170.161","TLSv1.2","130","Application Data"
"396","43.040613800","151.101.66.187","100.84.170.161","TCP","56","443  >  59747 [ACK] Seq=134978 Ack=122613 Win=5029 Len=0"
"397","43.043420400","151.101.66.187","100.84.170.161","TLSv1.2","131","Application Data"
"398","43.043503000","100.84.170.161","151.101.66.187","TCP","54","59747  >  443 [ACK] Seq=122613 Ack=135055 Win=4105 Len=0"
"399","44.917967800","100.84.170.161","151.101.66.187","TLSv1.2","1805","Application Data"
"400","44.918316600","100.84.170.161","151.101.66.187","TLSv1.2","913","Application Data"
"401","44.926817400","151.101.66.187","100.84.170.161","TCP","56","443  >  59747 [ACK] Seq=135055 Ack=124364 Win=5029 Len=0"
"402","44.927069200","151.101.66.187","100.84.170.161","TCP","56","443  >  59747 [ACK] Seq=135055 Ack=125223 Win=5029 Len=0"
"403","44.929650400","151.101.66.187","100.84.170.161","TLSv1.2","214","Application Data"
"404","44.929910500","151.101.66.187","100.84.170.161","TLSv1.2","180","Application Data"
"405","44.929934000","100.84.170.161","151.101.66.187","TCP","54","59747  >  443 [ACK] Seq=125223 Ack=135341 Win=4104 Len=0"
"406","45.282908400","100.84.170.161","151.101.66.187","TLSv1.2","1811","Application Data"
"407","45.287175200","100.84.170.161","151.101.66.187","TLSv1.2","944","Application Data"
"408","45.291963300","151.101.66.187","100.84.170.161","TCP","56","443  >  59747 [ACK] Seq=135341 Ack=126980 Win=5029 Len=0"
"409","45.294508800","151.101.66.187","100.84.170.161","TLSv1.2","374","Application Data"
"410","45.296426600","151.101.66.187","100.84.170.161","TCP","56","443  >  59747 [ACK] Seq=135661 Ack=127870 Win=5029 Len=0"
"411","45.299367600","151.101.66.187","100.84.170.161","TLSv1.2","124","Application Data"
"412","45.299431000","100.84.170.161","151.101.66.187","TCP","54","59747  >  443 [ACK] Seq=127870 Ack=135731 Win=4103 Len=0"
"413","46.238921000","100.84.170.161","151.101.66.187","TLSv1.2","1815","Application Data"
"414","46.249011200","151.101.66.187","100.84.170.161","TCP","56","443  >  59747 [ACK] Seq=135731 Ack=129631 Win=5029 Len=0"
"415","46.251560300","151.101.66.187","100.84.170.161","TLSv1.2","131","Application Data"
"416","46.280932500","151.101.66.187","100.84.170.161","TCP","131","[TCP Retransmission] 443  >  59747 [PSH, ACK] Seq=135731 Ack=129631 Win=5029 Len=77"
"417","46.280977800","100.84.170.161","151.101.66.187","TCP","66","59747  >  443 [ACK] Seq=129631 Ack=135808 Win=4102 Len=0 SLE=135731 SRE=135808"
"418","46.301950300","100.84.170.161","151.101.66.187","TLSv1.2","959","Application Data"
"419","46.302427500","100.84.170.161","151.101.66.187","TLSv1.2","1799","Application Data"
"420","46.310827000","151.101.66.187","100.84.170.161","TCP","56","443  >  59747 [ACK] Seq=135808 Ack=130536 Win=5029 Len=0"
"421","46.311301200","151.101.66.187","100.84.170.161","TCP","56","443  >  59747 [ACK] Seq=135808 Ack=132281 Win=5029 Len=0"
"422","46.313522800","151.101.66.187","100.84.170.161","TLSv1.2","235","Application Data"
"423","46.313834500","151.101.66.187","100.84.170.161","TLSv1.2","130","Application Data"
"424","46.313882100","100.84.170.161","151.101.66.187","TCP","54","59747  >  443 [ACK] Seq=132281 Ack=136065 Win=4101 Len=0"
"425","46.590747000","100.84.170.161","151.101.66.187","TLSv1.2","970","Application Data"
"426","46.601304200","151.101.66.187","100.84.170.161","TCP","56","443  >  59747 [ACK] Seq=136065 Ack=133197 Win=5029 Len=0"
"427","46.603595500","151.101.66.187","100.84.170.161","TLSv1.2","131","Application Data"
"428","46.632890500","151.101.66.187","100.84.170.161","TCP","131","[TCP Retransmission] 443  >  59747 [PSH, ACK] Seq=136065 Ack=133197 Win=5029 Len=77"
"429","46.632922400","100.84.170.161","151.101.66.187","TCP","66","59747  >  443 [ACK] Seq=133197 Ack=136142 Win=4101 Len=0 SLE=136065 SRE=136142"
"430","46.867724500","100.84.170.161","151.101.66.187","TLSv1.2","1810","Application Data"
"431","46.878052300","151.101.66.187","100.84.170.161","TCP","56","443  >  59747 [ACK] Seq=136142 Ack=134953 Win=5029 Len=0"
"432","46.880363000","100.84.170.161","151.101.66.187","TLSv1.2","930","Application Data"
"433","46.882134700","151.101.66.187","100.84.170.161","TLSv1.2","131","Application Data"
"434","46.889548200","151.101.66.187","100.84.170.161","TCP","56","443  >  59747 [ACK] Seq=136219 Ack=135829 Win=5029 Len=0"
"435","46.892097100","151.101.66.187","100.84.170.161","TLSv1.2","98","Application Data"
"436","46.892146300","100.84.170.161","151.101.66.187","TCP","54","59747  >  443 [ACK] Seq=135829 Ack=136263 Win=4100 Len=0"
"437","47.280639100","100.84.170.161","151.101.66.187","TLSv1.2","1808","Application Data"
"438","47.280825700","100.84.170.161","151.101.66.187","TLSv1.2","918","Application Data"
"439","47.282255800","100.84.170.161","151.101.66.187","TLSv1.2","1802","Application Data"
"440","47.283106800","100.84.170.161","151.101.66.187","TLSv1.2","882","Application Data"
"441","47.284022500","100.84.170.161","151.101.66.187","TLSv1.2","1812","Application Data"
"442","47.289464600","151.101.66.187","100.84.170.161","TCP","56","443  >  59747 [ACK] Seq=136263 Ack=137583 Win=5029 Len=0"
"443","47.289695200","151.101.66.187","100.84.170.161","TCP","56","443  >  59747 [ACK] Seq=136263 Ack=138447 Win=5029 Len=0"
"444","47.291093200","151.101.66.187","100.84.170.161","TCP","56","443  >  59747 [ACK] Seq=136263 Ack=140195 Win=5029 Len=0"
"445","47.292026200","151.101.66.187","100.84.170.161","TCP","56","443  >  59747 [ACK] Seq=136263 Ack=141023 Win=5029 Len=0"
"446","47.292752000","151.101.66.187","100.84.170.161","TLSv1.2","262","Application Data"
"447","47.292790100","100.84.170.161","151.101.66.187","TCP","54","59747  >  443 [ACK] Seq=142781 Ack=136471 Win=4106 Len=0"
"448","47.293477900","151.101.66.187","100.84.170.161","TCP","56","443  >  59747 [ACK] Seq=136471 Ack=142781 Win=5029 Len=0"
"449","47.294716100","151.101.66.187","100.84.170.161","TLSv1.2","124","Application Data"
"450","47.294797000","100.84.170.161","151.101.66.187","TCP","54","59747  >  443 [ACK] Seq=142781 Ack=136541 Win=4105 Len=0"
"451","47.295262000","151.101.66.187","100.84.170.161","TLSv1.2","131","Application Data"
"452","47.295262000","151.101.66.187","100.84.170.161","TLSv1.2","130","Application Data"
"453","47.295311000","100.84.170.161","151.101.66.187","TCP","54","59747  >  443 [ACK] Seq=142781 Ack=136694 Win=4105 Len=0"
"454","47.303963400","100.84.170.161","151.101.66.187","TLSv1.2","906","Application Data"
"455","47.304423400","100.84.170.161","151.101.66.187","TLSv1.2","1812","Application Data"
"456","47.317839900","151.101.66.187","100.84.170.161","TCP","56","443  >  59747 [ACK] Seq=136694 Ack=143633 Win=5029 Len=0"
"457","47.318306700","151.101.66.187","100.84.170.161","TCP","56","443  >  59747 [ACK] Seq=136694 Ack=145391 Win=5029 Len=0"
"458","47.318673600","151.101.66.187","100.84.170.161","TLSv1.2","207","Application Data"
"459","47.318673600","151.101.66.187","100.84.170.161","TLSv1.2","103","Application Data"
"460","47.318733400","100.84.170.161","151.101.66.187","TCP","54","59747  >  443 [ACK] Seq=145391 Ack=136896 Win=4104 Len=0"
"461","47.775370300","100.84.170.161","151.101.66.187","TLSv1.2","912","Application Data"
"462","47.781557200","100.84.170.161","151.101.66.187","TLSv1.2","1797","Application Data"
"463","47.784141500","100.84.170.161","151.101.66.187","TLSv1.2","880","Application Data"
"464","47.785543500","151.101.66.187","100.84.170.161","TCP","56","443  >  59747 [ACK] Seq=136896 Ack=146249 Win=5029 Len=0"
"465","47.787993800","151.101.66.187","100.84.170.161","TLSv1.2","233","Application Data"
"466","47.790538100","151.101.66.187","100.84.170.161","TCP","56","443  >  59747 [ACK] Seq=137075 Ack=147992 Win=5029 Len=0"
"467","47.792828900","151.101.66.187","100.84.170.161","TCP","56","443  >  59747 [ACK] Seq=137075 Ack=148818 Win=5029 Len=0"
"468","47.793143100","151.101.66.187","100.84.170.161","TLSv1.2","124","Application Data"
"469","47.793192700","100.84.170.161","151.101.66.187","TCP","54","59747  >  443 [ACK] Seq=148818 Ack=137145 Win=4103 Len=0"
"470","47.795339500","151.101.66.187","100.84.170.161","TLSv1.2","131","Application Data"
"471","47.831012500","151.101.66.187","100.84.170.161","TCP","131","[TCP Retransmission] 443  >  59747 [PSH, ACK] Seq=137145 Ack=148818 Win=5029 Len=77"
"472","47.831053900","100.84.170.161","151.101.66.187","TCP","66","59747  >  443 [ACK] Seq=148818 Ack=137222 Win=4103 Len=0 SLE=137145 SRE=137222"
"473","47.864565600","100.84.170.161","151.101.66.187","TLSv1.2","1802","Application Data"
"474","47.873511300","151.101.66.187","100.84.170.161","TCP","56","443  >  59747 [ACK] Seq=137222 Ack=150566 Win=5029 Len=0"
"475","47.877356700","151.101.66.187","100.84.170.161","TLSv1.2","130","Application Data"
"476","47.891942400","100.84.170.161","151.101.66.187","TLSv1.2","909","Application Data"
"477","47.892169700","100.84.170.161","151.101.66.187","TLSv1.2","1788","Application Data"
"478","47.893625600","100.84.170.161","151.101.66.187","TLSv1.2","915","Application Data"
"479","47.895170500","100.84.170.161","151.101.66.187","TLSv1.2","1773","Application Data"
"480","47.901037000","151.101.66.187","100.84.170.161","TCP","56","443  >  59747 [ACK] Seq=137298 Ack=151421 Win=5029 Len=0"
"481","47.901809200","151.101.66.187","100.84.170.161","TCP","56","443  >  59747 [ACK] Seq=137298 Ack=153155 Win=5029 Len=0"
"482","47.902382100","151.101.66.187","100.84.170.161","TCP","56","443  >  59747 [ACK] Seq=137298 Ack=154016 Win=5029 Len=0"
"483","47.904460900","151.101.66.187","100.84.170.161","TCP","56","443  >  59747 [ACK] Seq=137298 Ack=155735 Win=5029 Len=0"
"484","47.904915600","151.101.66.187","100.84.170.161","TLSv1.2","125","Application Data"
"485","47.906302900","151.101.66.187","100.84.170.161","TLSv1.2","124","Application Data"
"486","47.906364000","100.84.170.161","151.101.66.187","TCP","54","59747  >  443 [ACK] Seq=155735 Ack=137439 Win=4102 Len=0"
"487","47.906563700","151.101.66.187","100.84.170.161","TLSv1.2","125","Application Data"
"488","47.907282000","151.101.66.187","100.84.170.161","TLSv1.2","124","Application Data"
"489","47.907345600","100.84.170.161","151.101.66.187","TCP","54","59747  >  443 [ACK] Seq=155735 Ack=137580 Win=4101 Len=0"
"490","48.103546000","100.84.170.161","151.101.66.187","TLSv1.2","932","Application Data"
"491","48.112469700","151.101.66.187","100.84.170.161","TCP","56","443  >  59747 [ACK] Seq=137580 Ack=156613 Win=5029 Len=0"
"492","48.114942200","151.101.66.187","100.84.170.161","TLSv1.2","131","Application Data"
"493","48.146363500","151.101.66.187","100.84.170.161","TCP","131","[TCP Retransmission] 443  >  59747 [PSH, ACK] Seq=137580 Ack=156613 Win=5029 Len=77"
"494","48.146405800","100.84.170.161","151.101.66.187","TCP","66","59747  >  443 [ACK] Seq=156613 Ack=137657 Win=4101 Len=0 SLE=137580 SRE=137657"
"495","48.181843300","100.84.170.161","151.101.66.187","TLSv1.2","1800","Application Data"
"496","48.190557700","151.101.66.187","100.84.170.161","TCP","56","443  >  59747 [ACK] Seq=137657 Ack=158359 Win=5029 Len=0"
"497","48.192927000","151.101.66.187","100.84.170.161","TLSv1.2","130","Application Data"
"498","48.200491000","100.84.170.161","151.101.66.187","TLSv1.2","912","Application Data"
"499","48.200629200","100.84.170.161","151.101.66.187","TLSv1.2","1791","Application Data"
"500","48.200706100","100.84.170.161","151.101.66.187","TLSv1.2","890","Application Data"
"501","48.200777700","100.84.170.161","151.101.66.187","TLSv1.2","1797","Application Data"
"502","48.200905600","100.84.170.161","151.101.66.187","TLSv1.2","906","Application Data"
"503","48.201080300","100.84.170.161","151.101.66.187","TLSv1.2","1791","Application Data"
"504","48.201161400","100.84.170.161","151.101.66.187","TLSv1.2","912","Application Data"
"505","48.201260400","100.84.170.161","151.101.66.187","TLSv1.2","1794","Application Data"
"506","48.201352600","100.84.170.161","151.101.66.187","TLSv1.2","883","Application Data"
"507","48.202186700","100.84.170.161","151.101.66.187","TLSv1.2","1803","Application Data"
"508","48.202335100","100.84.170.161","151.101.66.187","TLSv1.2","903","Application Data"
"509","48.209905400","151.101.66.187","100.84.170.161","TCP","56","443  >  59747 [ACK] Seq=137733 Ack=159217 Win=5029 Len=0"
"510","48.210604200","151.101.66.187","100.84.170.161","TCP","56","443  >  59747 [ACK] Seq=137733 Ack=164385 Win=5029 Len=0"
"511","48.210604200","151.101.66.187","100.84.170.161","TCP","56","443  >  59747 [ACK] Seq=137733 Ack=169549 Win=5029 Len=0"
"512","48.210934300","151.101.66.187","100.84.170.161","TCP","56","443  >  59747 [ACK] Seq=137733 Ack=171298 Win=5029 Len=0"
"513","48.211267300","151.101.66.187","100.84.170.161","TCP","56","443  >  59747 [ACK] Seq=137733 Ack=172147 Win=5029 Len=0"
"514","48.212294200","151.101.66.187","100.84.170.161","TLSv1.2","234","Application Data"
"515","48.214349200","151.101.66.187","100.84.170.161","TLSv1.2","131","Application Data"
"516","48.214404900","100.84.170.161","151.101.66.187","TCP","54","59747  >  443 [ACK] Seq=172147 Ack=137990 Win=4106 Len=0"
"517","48.215924900","151.101.66.187","100.84.170.161","TLSv1.2","125","Application Data"
"518","48.215924900","151.101.66.187","100.84.170.161","TLSv1.2","124","Application Data"
"519","48.215974000","100.84.170.161","151.101.66.187","TCP","54","59747  >  443 [ACK] Seq=172147 Ack=138131 Win=4105 Len=0"
"520","48.216237200","151.101.66.187","100.84.170.161","TLSv1.2","124","Application Data"
"521","48.216237200","151.101.66.187","100.84.170.161","TLSv1.2","255","Application Data"
"522","48.216237200","151.101.66.187","100.84.170.161","TLSv1.2","264","Application Data"
"523","48.216257500","100.84.170.161","151.101.66.187","TCP","54","59747  >  443 [ACK] Seq=172147 Ack=138612 Win=4103 Len=0"
"524","48.216563400","151.101.66.187","100.84.170.161","TLSv1.2","208","Application Data, Application Data"
"525","48.216589300","100.84.170.161","151.101.66.187","TCP","54","59747  >  443 [ACK] Seq=172147 Ack=138766 Win=4103 Len=0"
"526","48.217263600","151.101.66.187","100.84.170.161","TLSv1.2","124","Application Data"
"527","48.217287500","100.84.170.161","151.101.66.187","TCP","54","59747  >  443 [ACK] Seq=172147 Ack=138836 Win=4102 Len=0"
"528","48.611654100","100.84.170.161","151.101.66.187","TLSv1.2","1798","Application Data"
"529","48.613784100","100.84.170.161","151.101.66.187","TLSv1.2","871","Application Data"
"530","48.614015600","100.84.170.161","151.101.66.187","TLSv1.2","1817","Application Data"
"531","48.616122400","100.84.170.161","151.101.66.187","TLSv1.2","912","Application Data"
"532","48.616940400","100.84.170.161","151.101.66.187","TLSv1.2","1803","Application Data"
"533","48.617113200","100.84.170.161","151.101.66.187","TLSv1.2","919","Application Data"
"534","48.621140500","100.84.170.161","151.101.66.187","TLSv1.2","1808","Application Data"
"535","48.622027300","151.101.66.187","100.84.170.161","TCP","56","443  >  59747 [ACK] Seq=138836 Ack=173891 Win=5029 Len=0"
"536","48.622498100","151.101.66.187","100.84.170.161","TCP","56","443  >  59747 [ACK] Seq=138836 Ack=174708 Win=5029 Len=0"
"537","48.622771400","151.101.66.187","100.84.170.161","TCP","56","443  >  59747 [ACK] Seq=138836 Ack=176471 Win=5029 Len=0"
"538","48.622936000","100.84.170.161","151.101.66.187","TLSv1.2","885","Application Data"
"539","48.624200800","151.101.66.187","100.84.170.161","TLSv1.2","234","Application Data"
"540","48.624522000","151.101.66.187","100.84.170.161","TLSv1.2","124","Application Data"
"541","48.624557900","100.84.170.161","151.101.66.187","TCP","54","59747  >  443 [ACK] Seq=182528 Ack=139086 Win=4101 Len=0"
"542","48.624801900","151.101.66.187","100.84.170.161","TLSv1.2","130","Application Data"
"543","48.625511400","151.101.66.187","100.84.170.161","TCP","56","443  >  59747 [ACK] Seq=139162 Ack=179078 Win=5029 Len=0"
"544","48.626088500","151.101.66.187","100.84.170.161","TCP","56","443  >  59747 [ACK] Seq=139162 Ack=179943 Win=5029 Len=0"
"545","48.626680200","151.101.66.187","100.84.170.161","TLSv1.2","125","Application Data"
"546","48.626731400","100.84.170.161","151.101.66.187","TCP","54","59747  >  443 [ACK] Seq=182528 Ack=139233 Win=4101 Len=0"
"547","48.627508600","151.101.66.187","100.84.170.161","TLSv1.2","131","Application Data"
"548","48.627790200","151.101.66.187","100.84.170.161","TLSv1.2","131","Application Data"
"549","48.627816700","100.84.170.161","151.101.66.187","TCP","54","59747  >  443 [ACK] Seq=182528 Ack=139387 Win=4100 Len=0"
"550","48.629748500","151.101.66.187","100.84.170.161","TCP","56","443  >  59747 [ACK] Seq=139387 Ack=181697 Win=5029 Len=0"
"551","48.631440700","151.101.66.187","100.84.170.161","TCP","56","443  >  59747 [ACK] Seq=139387 Ack=182528 Win=5029 Len=0"
"552","48.632011000","151.101.66.187","100.84.170.161","TLSv1.2","130","Application Data"
"553","48.633628700","151.101.66.187","100.84.170.161","TLSv1.2","125","Application Data"
"554","48.633678900","100.84.170.161","151.101.66.187","TCP","54","59747  >  443 [ACK] Seq=182528 Ack=139534 Win=4106 Len=0"
"555","49.480854500","100.84.170.161","151.101.66.187","TLSv1.2","2035","Application Data"
"556","49.490231300","151.101.66.187","100.84.170.161","TCP","56","443  >  59747 [ACK] Seq=139534 Ack=184509 Win=5037 Len=0"
"557","49.492544400","151.101.66.187","100.84.170.161","TLSv1.2","208","Application Data"
"558","49.519921300","151.101.66.187","100.84.170.161","TCP","208","[TCP Retransmission] 443  >  59747 [PSH, ACK] Seq=139534 Ack=184509 Win=5037 Len=154"
"559","49.519962400","100.84.170.161","151.101.66.187","TCP","66","59747  >  443 [ACK] Seq=184509 Ack=139688 Win=4105 Len=0 SLE=139534 SRE=139688"
"560","51.579869800","100.84.170.161","151.101.66.187","TLSv1.2","671","Application Data"
"561","51.585089400","100.84.170.161","151.101.66.187","TLSv1.2","2047","Application Data"
"562","51.590736200","151.101.66.187","100.84.170.161","TCP","56","443  >  59747 [ACK] Seq=139688 Ack=185126 Win=5037 Len=0"
"563","51.593466400","151.101.66.187","100.84.170.161","TLSv1.2","214","Application Data"
"564","51.594247700","151.101.66.187","100.84.170.161","TCP","56","443  >  59747 [ACK] Seq=139848 Ack=187119 Win=5045 Len=0"
"565","51.597859800","151.101.66.187","100.84.170.161","TLSv1.2","201","Application Data"
"566","51.597918900","100.84.170.161","151.101.66.187","TCP","54","59747  >  443 [ACK] Seq=187119 Ack=139995 Win=4104 Len=0"
"567","51.700819000","100.84.170.161","151.101.66.187","TLSv1.2","672","Application Data"
"568","51.710793300","151.101.66.187","100.84.170.161","TCP","56","443  >  59747 [ACK] Seq=139995 Ack=187737 Win=5045 Len=0"
"569","51.713625900","151.101.66.187","100.84.170.161","TLSv1.2","265","Application Data"
"570","51.741170400","151.101.66.187","100.84.170.161","TCP","265","[TCP Retransmission] 443  >  59747 [PSH, ACK] Seq=139995 Ack=187737 Win=5045 Len=211"
"571","51.741202500","100.84.170.161","151.101.66.187","TCP","66","59747  >  443 [ACK] Seq=187737 Ack=140206 Win=4103 Len=0 SLE=139995 SRE=140206"
"572","55.431644300","100.84.170.161","151.101.66.187","TLSv1.2","2090","Application Data"
"573","55.435502600","100.84.170.161","151.101.66.187","TLSv1.2","585","Application Data"
"574","55.438142900","100.84.170.161","151.101.66.187","TLSv1.2","2102","Application Data"
"575","55.441984200","151.101.66.187","100.84.170.161","TCP","56","443  >  59747 [ACK] Seq=140206 Ack=189773 Win=5053 Len=0"
"576","55.443318000","100.84.170.161","151.101.66.187","TLSv1.2","579","Application Data"
"577","55.444372700","151.101.66.187","100.84.170.161","TCP","56","443  >  59747 [ACK] Seq=140206 Ack=190304 Win=5053 Len=0"
"578","55.444654900","151.101.66.187","100.84.170.161","TLSv1.2","214","Application Data"
"579","55.446335100","151.101.66.187","100.84.170.161","TLSv1.2","124","Application Data"
"580","55.446410100","100.84.170.161","151.101.66.187","TCP","54","59747  >  443 [ACK] Seq=192877 Ack=140436 Win=4102 Len=0"
"581","55.447915400","151.101.66.187","100.84.170.161","TCP","56","443  >  59747 [ACK] Seq=140436 Ack=192352 Win=5061 Len=0"
"582","55.450083200","151.101.66.187","100.84.170.161","TLSv1.2","131","Application Data"
"583","55.453145600","151.101.66.187","100.84.170.161","TCP","56","443  >  59747 [ACK] Seq=140513 Ack=192877 Win=5061 Len=0"
"584","55.455999100","151.101.66.187","100.84.170.161","TLSv1.2","124","Application Data"
"585","55.456064500","100.84.170.161","151.101.66.187","TCP","54","59747  >  443 [ACK] Seq=192877 Ack=140583 Win=4102 Len=0"
"586","55.516632400","100.84.170.161","151.101.66.187","TLSv1.2","2102","Application Data"
"587","55.526434000","151.101.66.187","100.84.170.161","TCP","56","443  >  59747 [ACK] Seq=140583 Ack=194925 Win=5069 Len=0"
"588","55.529368300","151.101.66.187","100.84.170.161","TLSv1.2","124","Application Data"
"589","55.557206000","151.101.66.187","100.84.170.161","TCP","124","[TCP Retransmission] 443  >  59747 [PSH, ACK] Seq=140583 Ack=194925 Win=5069 Len=70"
"590","55.557238400","100.84.170.161","151.101.66.187","TCP","66","59747  >  443 [ACK] Seq=194925 Ack=140653 Win=4101 Len=0 SLE=140583 SRE=140653"
"591","55.585898200","100.84.170.161","151.101.66.187","TLSv1.2","578","Application Data"
"592","55.595560700","151.101.66.187","100.84.170.161","TCP","56","443  >  59747 [ACK] Seq=140653 Ack=195449 Win=5069 Len=0"
"593","55.598580000","151.101.66.187","100.84.170.161","TLSv1.2","104","Application Data"
"594","55.616266600","100.84.170.161","151.101.66.187","TLSv1.2","2122","Application Data"
"595","55.625411200","151.101.66.187","100.84.170.161","TCP","56","443  >  59747 [ACK] Seq=140703 Ack=197517 Win=5077 Len=0"
"596","55.628510900","151.101.66.187","100.84.170.161","TLSv1.2","125","Application Data"
"597","55.648619600","100.84.170.161","151.101.66.187","TLSv1.2","593","Application Data"
"598","55.657818900","151.101.66.187","100.84.170.161","TCP","56","443  >  59747 [ACK] Seq=140774 Ack=198056 Win=5077 Len=0"
"599","55.662368000","151.101.66.187","100.84.170.161","TLSv1.2","104","Application Data"
"600","55.681577700","100.84.170.161","151.101.66.187","TLSv1.2","2116","Application Data"
"601","55.690190600","151.101.66.187","100.84.170.161","TCP","56","443  >  59747 [ACK] Seq=140824 Ack=200118 Win=5085 Len=0"
"602","55.692752000","151.101.66.187","100.84.170.161","TLSv1.2","98","Application Data"
"603","55.731264800","151.101.66.187","100.84.170.161","TCP","98","[TCP Retransmission] 443  >  59747 [PSH, ACK] Seq=140824 Ack=200118 Win=5085 Len=44"
"604","55.731305000","100.84.170.161","151.101.66.187","TCP","66","59747  >  443 [ACK] Seq=200118 Ack=140868 Win=4101 Len=0 SLE=140824 SRE=140868"
"605","55.785705800","100.84.170.161","151.101.66.187","TLSv1.2","588","Application Data"
"606","55.794521700","151.101.66.187","100.84.170.161","TCP","56","443  >  59747 [ACK] Seq=140868 Ack=200652 Win=5085 Len=0"
"607","55.798146300","151.101.66.187","100.84.170.161","TLSv1.2","130","Application Data"
"608","55.836834800","151.101.66.187","100.84.170.161","TCP","130","[TCP Retransmission] 443  >  59747 [PSH, ACK] Seq=140868 Ack=200652 Win=5085 Len=76"
"609","55.836880900","100.84.170.161","151.101.66.187","TCP","66","59747  >  443 [ACK] Seq=200652 Ack=140944 Win=4100 Len=0 SLE=140868 SRE=140944"
"610","55.872970200","100.84.170.161","151.101.66.187","TLSv1.2","2138","Application Data"
"611","55.873141500","100.84.170.161","151.101.66.187","TLSv1.2","597","Application Data"
"612","55.873239300","100.84.170.161","151.101.66.187","TLSv1.2","2117","Application Data"
"613","55.881998300","151.101.66.187","100.84.170.161","TCP","56","443  >  59747 [ACK] Seq=140944 Ack=202736 Win=5093 Len=0"
"614","55.882305800","151.101.66.187","100.84.170.161","TCP","56","443  >  59747 [ACK] Seq=140944 Ack=205342 Win=5101 Len=0"
"615","55.886564900","151.101.66.187","100.84.170.161","TLSv1.2","125","Application Data"
"616","55.891463700","151.101.66.187","100.84.170.161","TLSv1.2","131","Application Data"
"617","55.891588000","100.84.170.161","151.101.66.187","TCP","54","59747  >  443 [ACK] Seq=205342 Ack=141092 Win=4106 Len=0"
"618","55.891708200","151.101.66.187","100.84.170.161","TLSv1.2","130","Application Data"
"619","55.937629700","100.84.170.161","151.101.66.187","TCP","54","59747  >  443 [ACK] Seq=205342 Ack=141168 Win=4105 Len=0"
"620","55.938936100","151.101.66.187","100.84.170.161","TCP","130","[TCP Spurious Retransmission] 443  >  59747 [PSH, ACK] Seq=141092 Ack=205342 Win=5101 Len=76"
"621","55.938990300","100.84.170.161","151.101.66.187","TCP","66","[TCP Dup ACK 619#1] 59747  >  443 [ACK] Seq=205342 Ack=141168 Win=4105 Len=0 SLE=141092 SRE=141168"
"622","56.048240400","100.84.170.161","151.101.66.187","TLSv1.2","921","Application Data"
"623","56.051294800","100.84.170.161","151.101.66.187","TLSv1.2","1823","Application Data"
"624","56.053723000","100.84.170.161","151.101.66.187","TLSv1.2","911","Application Data"
"625","56.056258100","100.84.170.161","151.101.66.187","TLSv1.2","1791","Application Data"
"626","56.056433100","100.84.170.161","151.101.66.187","TLSv1.2","907","Application Data"
"627","56.057381400","151.101.66.187","100.84.170.161","TCP","56","443  >  59747 [ACK] Seq=141168 Ack=206209 Win=5101 Len=0"
"628","56.060294800","151.101.66.187","100.84.170.161","TLSv1.2","130","Application Data"
"629","56.062639400","151.101.66.187","100.84.170.161","TCP","56","443  >  59747 [ACK] Seq=141244 Ack=208835 Win=5108 Len=0"
"630","56.063321900","151.101.66.187","100.84.170.161","TLSv1.2","130","Application Data"
"631","56.063370800","100.84.170.161","151.101.66.187","TCP","54","59747  >  443 [ACK] Seq=211425 Ack=141320 Win=4105 Len=0"
"632","56.065100900","151.101.66.187","100.84.170.161","TCP","56","443  >  59747 [ACK] Seq=141320 Ack=210572 Win=5108 Len=0"
"633","56.065254200","151.101.66.187","100.84.170.161","TLSv1.2","201","Application Data"
"634","56.068329300","151.101.66.187","100.84.170.161","TLSv1.2","124","Application Data"
"635","56.068396600","100.84.170.161","151.101.66.187","TCP","54","59747  >  443 [ACK] Seq=211425 Ack=141537 Win=4104 Len=0"
"636","56.068602900","151.101.66.187","100.84.170.161","TLSv1.2","258","Application Data"
"637","56.112804500","151.101.66.187","100.84.170.161","TCP","258","[TCP Retransmission] 443  >  59747 [PSH, ACK] Seq=141537 Ack=211425 Win=5108 Len=204"
"638","56.112835500","100.84.170.161","151.101.66.187","TCP","66","59747  >  443 [ACK] Seq=211425 Ack=141741 Win=4103 Len=0 SLE=141537 SRE=141741"
"639","59.097269900","100.84.170.161","151.101.66.187","TLSv1.2","1812","Application Data"
"640","59.107866100","151.101.66.187","100.84.170.161","TCP","56","443  >  59747 [ACK] Seq=141741 Ack=213183 Win=5108 Len=0"
"641","59.167256400","151.101.66.187","100.84.170.161","TLSv1.2","339","Application Data"
"642","59.167707100","151.101.66.187","100.84.170.161","TLSv1.2","357","Application Data"
"643","59.167758900","100.84.170.161","151.101.66.187","TCP","54","59747  >  443 [ACK] Seq=213183 Ack=142329 Win=4101 Len=0"
"644","59.169630200","100.84.170.161","151.101.66.187","TLSv1.2","89","Application Data"
"645","59.178938500","151.101.66.187","100.84.170.161","TCP","56","443  >  59747 [ACK] Seq=142329 Ack=213218 Win=5108 Len=0"
