"No.","Time","Source","Destination","Protocol","Length","Info"
"1","0.000000000","100.84.170.161","151.101.66.187","TLSv1.2","2442","Application Data"
"2","0.000100900","100.84.170.161","151.101.66.187","TLSv1.2","93","Application Data"
"3","0.009411100","151.101.66.187","100.84.170.161","TCP","56","443  >  59747 [ACK] Seq=1 Ack=2428 Win=2086 Len=0"
"4","0.010638100","151.101.66.187","100.84.170.161","TLSv1.2","93","Application Data"
"5","0.060471700","100.84.170.161","151.101.66.187","TCP","54","59747  >  443 [ACK] Seq=2428 Ack=40 Win=4106 Len=0"
"6","0.060691000","151.101.66.187","100.84.170.161","TCP","93","[TCP Spurious Retransmission] 443  >  59747 [PSH, ACK] Seq=1 Ack=2428 Win=2086 Len=39"
"7","0.060740800","100.84.170.161","151.101.66.187","TCP","66","[TCP Dup ACK 5#1] 59747  >  443 [ACK] Seq=2428 Ack=40 Win=4106 Len=0 SLE=1 SRE=40"
"8","0.761335000","151.101.66.187","100.84.170.161","TLSv1.2","579","Application Data"
"9","0.761335000","151.101.66.187","100.84.170.161","TLSv1.2","32086","Application Data"
"10","0.761335000","151.101.66.187","100.84.170.161","TLSv1.2","888","Application Data, Application Data"
"11","0.761335000","151.101.66.187","100.84.170.161","TLSv1.2","94","Application Data"
"12","0.761335000","151.101.66.187","100.84.170.161","TCP","16070","443  >  59747 [ACK] Seq=33471 Ack=2428 Win=2086 Len=16016 [TCP PDU reassembled in 13]"
"13","0.761335000","151.101.66.187","100.84.170.161","TLSv1.2","475","Application Data, Application Data"
"14","0.761335000","151.101.66.187","100.84.170.161","TLSv1.2","11702","Application Data"
"15","0.761335000","151.101.66.187","100.84.170.161","TLSv1.2","132","Application Data, Application Data"
"16","0.761571200","100.84.170.161","151.101.66.187","TCP","54","59747  >  443 [ACK] Seq=2428 Ack=61634 Win=4106 Len=0"
"17","0.761802600","151.101.66.187","100.84.170.161","TCP","132","[TCP Spurious Retransmission] 443  >  59747 [PSH, ACK] Seq=61556 Ack=2428 Win=2086 Len=78"
"18","0.761837900","100.84.170.161","151.101.66.187","TCP","66","[TCP Dup ACK 16#1] 59747  >  443 [ACK] Seq=2428 Ack=61634 Win=4106 Len=0 SLE=61556 SRE=61634"
"19","0.765201900","100.84.170.161","151.101.66.187","TLSv1.2","89","Application Data"
"20","0.791625400","151.101.66.187","100.84.170.161","TCP","56","443  >  59747 [ACK] Seq=61634 Ack=2463 Win=2086 Len=0"
"21","14.827658600","100.84.170.161","151.101.66.187","TLSv1.2","2463","Application Data"
"22","14.827827200","100.84.170.161","151.101.66.187","TLSv1.2","93","Application Data"
"23","14.829829900","100.84.170.161","151.101.66.187","TLSv1.2","2451","Application Data"
"24","14.833860900","100.84.170.161","151.101.66.187","TLSv1.2","2445","Application Data"
"25","14.838021000","151.101.66.187","100.84.170.161","TCP","56","443  >  59747 [ACK] Seq=61634 Ack=4911 Win=2096 Len=0"
"26","14.838425400","151.101.66.187","100.84.170.161","TLSv1.2","93","Application Data"
"27","14.840780200","100.84.170.161","151.101.66.187","TLSv1.2","2464","Application Data"
"28","14.840993600","151.101.66.187","100.84.170.161","TLSv1.2","345","Application Data"
"29","14.843157600","151.101.66.187","100.84.170.161","TCP","56","443  >  59747 [ACK] Seq=61964 Ack=9699 Win=2115 Len=0"
"30","14.846256700","151.101.66.187","100.84.170.161","TLSv1.2","130","Application Data"
"31","14.846326700","100.84.170.161","151.101.66.187","TCP","54","59747  >  443 [ACK] Seq=12109 Ack=62040 Win=4104 Len=0"
"32","14.850289000","151.101.66.187","100.84.170.161","TCP","56","443  >  59747 [ACK] Seq=62040 Ack=12109 Win=2124 Len=0"
"33","14.853495700","151.101.66.187","100.84.170.161","TLSv1.2","125","Application Data"
"34","14.896136000","100.84.170.161","151.101.66.187","TCP","54","59747  >  443 [ACK] Seq=12109 Ack=62111 Win=4104 Len=0"
"35","14.900179800","151.101.66.187","100.84.170.161","TCP","125","[TCP Spurious Retransmission] 443  >  59747 [PSH, ACK] Seq=62040 Ack=12109 Win=2124 Len=71"
"36","14.900225700","100.84.170.161","151.101.66.187","TCP","66","[TCP Dup ACK 34#1] 59747  >  443 [ACK] Seq=12109 Ack=62111 Win=4104 Len=0 SLE=62040 SRE=62111"
"37","15.027105100","100.84.170.161","151.101.66.187","TLSv1.2","2467","Application Data"
"38","15.038627300","151.101.66.187","100.84.170.161","TCP","56","443  >  59747 [ACK] Seq=62111 Ack=14522 Win=2133 Len=0"
"39","15.041972000","151.101.66.187","100.84.170.161","TLSv1.2","234","Application Data"
"40","15.044249800","100.84.170.161","151.101.66.187","TLSv1.2","2458","Application Data"
"41","15.053327200","151.101.66.187","100.84.170.161","TCP","56","443  >  59747 [ACK] Seq=62291 Ack=16926 Win=2143 Len=0"
"42","15.056134700","151.101.66.187","100.84.170.161","TLSv1.2","135","Application Data"
"43","15.101276800","151.101.66.187","100.84.170.161","TCP","135","[TCP Retransmission] 443  >  59747 [PSH, ACK] Seq=62291 Ack=16926 Win=2143 Len=81"
"44","15.101382000","100.84.170.161","151.101.66.187","TCP","66","59747  >  443 [ACK] Seq=16926 Ack=62372 Win=4103 Len=0 SLE=62291 SRE=62372"
"45","15.130219100","100.84.170.161","151.101.66.187","TLSv1.2","2452","Application Data"
"46","15.130486500","100.84.170.161","151.101.66.187","TLSv1.2","2455","Application Data"
"47","15.131893000","100.84.170.161","151.101.66.187","TLSv1.2","2449","Application Data"
"48","15.132244000","100.84.170.161","151.101.66.187","TLSv1.2","2446","Application Data"
"49","15.138844200","151.101.66.187","100.84.170.161","TCP","56","443  >  59747 [ACK] Seq=62372 Ack=19324 Win=2152 Len=0"
"50","15.139607500","151.101.66.187","100.84.170.161","TCP","56","443  >  59747 [ACK] Seq=62372 Ack=21725 Win=2161 Len=0"
"51","15.140707700","151.101.66.187","100.84.170.161","TCP","56","443  >  59747 [ACK] Seq=62372 Ack=24120 Win=2171 Len=0"
"52","15.140908400","151.101.66.187","100.84.170.161","TCP","56","443  >  59747 [ACK] Seq=62372 Ack=26512 Win=2180 Len=0"
"53","15.142405800","151.101.66.187","100.84.170.161","TLSv1.2","130","Application Data"
"54","15.143154700","151.101.66.187","100.84.170.161","TLSv1.2","156","Application Data"
"55","15.143206000","100.84.170.161","151.101.66.187","TCP","54","59747  >  443 [ACK] Seq=26512 Ack=62550 Win=4102 Len=0"
"56","15.144338600","151.101.66.187","100.84.170.161","TLSv1.2","147","Application Data"
"57","15.144338600","151.101.66.187","100.84.170.161","TLSv1.2","124","Application Data"
"58","15.144399600","100.84.170.161","151.101.66.187","TCP","54","59747  >  443 [ACK] Seq=26512 Ack=62713 Win=4102 Len=0"
"59","15.466573200","100.84.170.161","151.101.66.187","TLSv1.2","2468","Application Data"
"60","15.475341200","151.101.66.187","100.84.170.161","TCP","56","443  >  59747 [ACK] Seq=62713 Ack=28926 Win=2190 Len=0"
"61","15.478768800","151.101.66.187","100.84.170.161","TLSv1.2","147","Application Data"
"62","15.516338400","151.101.66.187","100.84.170.161","TCP","147","[TCP Retransmission] 443  >  59747 [PSH, ACK] Seq=62713 Ack=28926 Win=2190 Len=93"
"63","15.516370400","100.84.170.161","151.101.66.187","TCP","66","59747  >  443 [ACK] Seq=28926 Ack=62806 Win=4101 Len=0 SLE=62713 SRE=62806"
"64","16.071809700","100.84.170.161","151.101.66.187","TLSv1.2","2492","Application Data"
"65","16.076133800","100.84.170.161","151.101.66.187","TLSv1.2","2490","Application Data"
"66","16.082255100","151.101.66.187","100.84.170.161","TCP","56","443  >  59747 [ACK] Seq=62806 Ack=31364 Win=2199 Len=0"
"67","16.084907000","151.101.66.187","100.84.170.161","TLSv1.2","292","Application Data"
"68","16.085168900","151.101.66.187","100.84.170.161","TCP","56","443  >  59747 [ACK] Seq=63044 Ack=33800 Win=2209 Len=0"
"69","16.087889400","151.101.66.187","100.84.170.161","TLSv1.2","98","Application Data"
"70","16.087947900","100.84.170.161","151.101.66.187","TCP","54","59747  >  443 [ACK] Seq=33800 Ack=63088 Win=4100 Len=0"
"71","16.309487800","100.84.170.161","151.101.66.187","TLSv1.2","2493","Application Data"
"72","16.319691900","151.101.66.187","100.84.170.161","TCP","56","443  >  59747 [ACK] Seq=63088 Ack=36239 Win=2218 Len=0"
"73","16.325125100","151.101.66.187","100.84.170.161","TLSv1.2","104","Application Data"
"74","16.359206000","151.101.66.187","100.84.170.161","TCP","104","[TCP Retransmission] 443  >  59747 [PSH, ACK] Seq=63088 Ack=36239 Win=2218 Len=50"
"75","16.359249700","100.84.170.161","151.101.66.187","TCP","66","59747  >  443 [ACK] Seq=36239 Ack=63138 Win=4106 Len=0 SLE=63088 SRE=63138"
"76","16.723435800","100.84.170.161","151.101.66.187","TLSv1.2","2478","Application Data"
"77","16.732851400","151.101.66.187","100.84.170.161","TCP","56","443  >  59747 [ACK] Seq=63138 Ack=38663 Win=2228 Len=0"
"78","16.734531800","151.101.66.187","100.84.170.161","TLSv1.2","131","Application Data"
"79","16.771255600","151.101.66.187","100.84.170.161","TCP","131","[TCP Retransmission] 443  >  59747 [PSH, ACK] Seq=63138 Ack=38663 Win=2228 Len=77"
"80","16.771294300","100.84.170.161","151.101.66.187","TCP","66","59747  >  443 [ACK] Seq=38663 Ack=63215 Win=4105 Len=0 SLE=63138 SRE=63215"
"81","18.911945700","100.84.170.161","151.101.66.187","TLSv1.2","2285","Application Data"
"82","18.922104700","151.101.66.187","100.84.170.161","TCP","56","443  >  59747 [ACK] Seq=63215 Ack=40894 Win=2236 Len=0"
"83","18.997165000","151.101.66.187","100.84.170.161","TLSv1.2","339","Application Data"
"84","18.997420500","151.101.66.187","100.84.170.161","TLSv1.2","357","Application Data"
"85","18.997470200","100.84.170.161","151.101.66.187","TCP","54","59747  >  443 [ACK] Seq=40894 Ack=63803 Win=4103 Len=0"
"86","18.999832800","100.84.170.161","151.101.66.187","TLSv1.2","89","Application Data"
"87","19.008601800","151.101.66.187","100.84.170.161","TCP","56","443  >  59747 [ACK] Seq=63803 Ack=40929 Win=2236 Len=0"
"88","19.037473900","100.84.170.161","151.101.66.187","TLSv1.2","2404","Application Data"
"89","19.056193000","100.84.170.161","151.101.66.187","TLSv1.2","2478","Application Data"
"90","19.060088900","100.84.170.161","151.101.66.187","TCP","1514","[TCP Retransmission] 59747  >  443 [PSH, ACK] Seq=44243 Ack=63803 Win=4103 Len=1460"
"91","19.128334200","151.101.66.187","100.84.170.161","TCP","66","[TCP Dup ACK 87#1] 443  >  59747 [ACK] Seq=63803 Ack=40929 Win=2242 Len=0 SLE=42389 SRE=43279"
"92","19.128731000","151.101.66.187","100.84.170.161","TCP","66","[TCP Dup ACK 87#2] 443  >  59747 [ACK] Seq=63803 Ack=40929 Win=2252 Len=0 SLE=42389 SRE=45703"
"93","19.128866000","100.84.170.161","151.101.66.187","TCP","1514","[TCP Fast Retransmission] 59747  >  443 [ACK] Seq=40929 Ack=63803 Win=4103 Len=1460"
"94","19.149370300","151.101.66.187","100.84.170.161","TCP","74","[TCP Dup ACK 87#3] 443  >  59747 [ACK] Seq=63803 Ack=40929 Win=2252 Len=0 SLE=44243 SRE=45703 SLE=42389 SRE=45703"
"95","19.158053800","151.101.66.187","100.84.170.161","TCP","56","443  >  59747 [ACK] Seq=63803 Ack=45703 Win=2257 Len=0"
"96","19.160438700","151.101.66.187","100.84.170.161","TLSv1.2","154","Application Data"
"97","19.160825700","151.101.66.187","100.84.170.161","TLSv1.2","104","Application Data"
"98","19.160888600","100.84.170.161","151.101.66.187","TCP","54","59747  >  443 [ACK] Seq=45703 Ack=63953 Win=4103 Len=0"
"99","19.548621700","100.84.170.161","151.101.66.187","TLSv1.2","2490","Application Data"
"100","19.557728000","151.101.66.187","100.84.170.161","TCP","56","443  >  59747 [ACK] Seq=63953 Ack=48139 Win=2267 Len=0"
"101","19.559548000","151.101.66.187","100.84.170.161","TLSv1.2","98","Application Data"
"102","19.568005500","100.84.170.161","151.101.66.187","TLSv1.2","2478","Application Data"
"103","19.577266500","151.101.66.187","100.84.170.161","TCP","56","443  >  59747 [ACK] Seq=63997 Ack=50563 Win=2276 Len=0"
"104","19.580438700","151.101.66.187","100.84.170.161","TLSv1.2","104","Application Data"
"105","19.614081400","151.101.66.187","100.84.170.161","TCP","104","[TCP Retransmission] 443  >  59747 [PSH, ACK] Seq=63997 Ack=50563 Win=2276 Len=50"
"106","19.614134300","100.84.170.161","151.101.66.187","TCP","66","59747  >  443 [ACK] Seq=50563 Ack=64047 Win=4102 Len=0 SLE=63997 SRE=64047"
"107","20.787729200","100.84.170.161","151.101.66.187","TLSv1.2","2490","Application Data"
"108","20.798165500","151.101.66.187","100.84.170.161","TCP","56","443  >  59747 [ACK] Seq=64047 Ack=52999 Win=2286 Len=0"
"109","20.801138300","151.101.66.187","100.84.170.161","TLSv1.2","214","Application Data"
"110","20.806350500","100.84.170.161","151.101.66.187","TLSv1.2","2478","Application Data"
"111","20.814995800","151.101.66.187","100.84.170.161","TCP","56","443  >  59747 [ACK] Seq=64207 Ack=55423 Win=2295 Len=0"
"112","20.818514700","151.101.66.187","100.84.170.161","TLSv1.2","109","Application Data"
"113","20.852214900","151.101.66.187","100.84.170.161","TCP","109","[TCP Retransmission] 443  >  59747 [PSH, ACK] Seq=64207 Ack=55423 Win=2295 Len=55"
"114","20.852270200","100.84.170.161","151.101.66.187","TCP","66","59747  >  443 [ACK] Seq=55423 Ack=64262 Win=4101 Len=0 SLE=64207 SRE=64262"
"115","22.076358800","100.84.170.161","151.101.66.187","TLSv1.2","2478","Application Data"
"116","22.085791400","151.101.66.187","100.84.170.161","TCP","56","443  >  59747 [ACK] Seq=64262 Ack=57847 Win=2305 Len=0"
"117","22.090359200","151.101.66.187","100.84.170.161","TLSv1.2","246","Application Data"
"118","22.116744900","100.84.170.161","151.101.66.187","TLSv1.2","2492","Application Data"
"119","22.123093900","151.101.66.187","100.84.170.161","TCP","246","[TCP Spurious Retransmission] 443  >  59747 [PSH, ACK] Seq=64262 Ack=57847 Win=2305 Len=192"
"120","22.123142000","100.84.170.161","151.101.66.187","TCP","66","[TCP Dup ACK 118#1] 59747  >  443 [ACK] Seq=60285 Ack=64454 Win=4101 Len=0 SLE=64262 SRE=64454"
"121","22.125578700","151.101.66.187","100.84.170.161","TCP","56","443  >  59747 [ACK] Seq=64454 Ack=60285 Win=2314 Len=0"
"122","22.128596600","151.101.66.187","100.84.170.161","TLSv1.2","175","Application Data"
"123","22.163278000","151.101.66.187","100.84.170.161","TCP","175","[TCP Retransmission] 443  >  59747 [PSH, ACK] Seq=64454 Ack=60285 Win=2314 Len=121"
"124","22.163333100","100.84.170.161","151.101.66.187","TCP","66","59747  >  443 [ACK] Seq=60285 Ack=64575 Win=4100 Len=0 SLE=64454 SRE=64575"
"125","23.593846300","100.84.170.161","151.101.66.187","TLSv1.2","2478","Application Data"
"126","23.601718000","100.84.170.161","151.101.66.187","TLSv1.2","2490","Application Data"
"127","23.602665700","151.101.66.187","100.84.170.161","TCP","56","443  >  59747 [ACK] Seq=64575 Ack=62709 Win=2324 Len=0"
"128","23.605719000","151.101.66.187","100.84.170.161","TLSv1.2","292","Application Data"
"129","23.605774200","100.84.170.161","151.101.66.187","TCP","54","59747  >  443 [ACK] Seq=65145 Ack=64813 Win=4106 Len=0"
"130","23.610471200","151.101.66.187","100.84.170.161","TCP","56","443  >  59747 [ACK] Seq=64813 Ack=65145 Win=2333 Len=0"
"131","23.613563700","151.101.66.187","100.84.170.161","TLSv1.2","131","Application Data"
"132","23.613613300","100.84.170.161","151.101.66.187","TCP","54","59747  >  443 [ACK] Seq=65145 Ack=64890 Win=4105 Len=0"
"133","23.664169600","100.84.170.161","151.101.66.187","TLSv1.2","2496","Application Data"
"134","23.673015600","151.101.66.187","100.84.170.161","TCP","56","443  >  59747 [ACK] Seq=64890 Ack=67587 Win=2343 Len=0"
"135","23.675697000","151.101.66.187","100.84.170.161","TLSv1.2","98","Application Data"
"136","23.707170500","151.101.66.187","100.84.170.161","TCP","98","[TCP Retransmission] 443  >  59747 [PSH, ACK] Seq=64890 Ack=67587 Win=2343 Len=44"
"137","23.707212000","100.84.170.161","151.101.66.187","TCP","66","59747  >  443 [ACK] Seq=67587 Ack=64934 Win=4105 Len=0 SLE=64890 SRE=64934"
"138","30.309175900","100.84.170.161","151.101.66.187","TLSv1.2","2487","Application Data"
"139","30.319451800","151.101.66.187","100.84.170.161","TCP","56","443  >  59747 [ACK] Seq=64934 Ack=70020 Win=2352 Len=0"
"140","30.322595100","151.101.66.187","100.84.170.161","TLSv1.2","241","Application Data"
"141","30.354146000","151.101.66.187","100.84.170.161","TCP","241","[TCP Retransmission] 443  >  59747 [PSH, ACK] Seq=64934 Ack=70020 Win=2352 Len=187"
"142","30.354185000","100.84.170.161","151.101.66.187","TCP","66","59747  >  443 [ACK] Seq=70020 Ack=65121 Win=4105 Len=0 SLE=64934 SRE=65121"
"143","30.502746200","100.84.170.161","151.101.66.187","TLSv1.2","2486","Application Data"
"144","30.511842000","151.101.66.187","100.84.170.161","TCP","56","443  >  59747 [ACK] Seq=65121 Ack=72452 Win=2362 Len=0"
"145","30.514036000","151.101.66.187","100.84.170.161","TLSv1.2","125","Application Data"
"146","30.545181600","151.101.66.187","100.84.170.161","TCP","125","[TCP Retransmission] 443  >  59747 [PSH, ACK] Seq=65121 Ack=72452 Win=2362 Len=71"
"147","30.545240700","100.84.170.161","151.101.66.187","TCP","66","59747  >  443 [ACK] Seq=72452 Ack=65192 Win=4104 Len=0 SLE=65121 SRE=65192"
"148","30.810702700","100.84.170.161","151.101.66.187","TLSv1.2","2484","Application Data"
"149","30.820064300","151.101.66.187","100.84.170.161","TCP","56","443  >  59747 [ACK] Seq=65192 Ack=74882 Win=2371 Len=0"
"150","30.822491500","151.101.66.187","100.84.170.161","TLSv1.2","98","Application Data"
"151","30.864971500","151.101.66.187","100.84.170.161","TCP","98","[TCP Retransmission] 443  >  59747 [PSH, ACK] Seq=65192 Ack=74882 Win=2371 Len=44"
"152","30.865021900","100.84.170.161","151.101.66.187","TCP","66","59747  >  443 [ACK] Seq=74882 Ack=65236 Win=4104 Len=0 SLE=65192 SRE=65236"
"153","31.070563900","100.84.170.161","151.101.66.187","TLSv1.2","2489","Application Data"
"154","31.070930800","100.84.170.161","151.101.66.187","TLSv1.2","2485","Application Data"
"155","31.079740400","151.101.66.187","100.84.170.161","TCP","56","443  >  59747 [ACK] Seq=65236 Ack=77317 Win=2381 Len=0"
"156","31.079950600","151.101.66.187","100.84.170.161","TCP","56","443  >  59747 [ACK] Seq=65236 Ack=79748 Win=2390 Len=0"
"157","31.083009100","151.101.66.187","100.84.170.161","TLSv1.2","234","Application Data"
"158","31.083302600","151.101.66.187","100.84.170.161","TLSv1.2","181","Application Data"
"159","31.083342100","100.84.170.161","151.101.66.187","TCP","54","59747  >  443 [ACK] Seq=79748 Ack=65543 Win=4103 Len=0"
"160","31.158238100","100.84.170.161","151.101.66.187","TLSv1.2","2484","Application Data"
"161","31.167194900","151.101.66.187","100.84.170.161","TCP","56","443  >  59747 [ACK] Seq=65543 Ack=82178 Win=2400 Len=0"
"162","31.170110300","151.101.66.187","100.84.170.161","TLSv1.2","98","Application Data"
"163","31.200963100","151.101.66.187","100.84.170.161","TCP","98","[TCP Retransmission] 443  >  59747 [PSH, ACK] Seq=65543 Ack=82178 Win=2400 Len=44"
"164","31.201003000","100.84.170.161","151.101.66.187","TCP","66","59747  >  443 [ACK] Seq=82178 Ack=65587 Win=4103 Len=0 SLE=65543 SRE=65587"
"165","31.602658000","100.84.170.161","151.101.66.187","TLSv1.2","2489","Application Data"
"166","31.612498700","151.101.66.187","100.84.170.161","TCP","56","443  >  59747 [ACK] Seq=65587 Ack=84613 Win=2409 Len=0"
"167","31.615591900","151.101.66.187","100.84.170.161","TLSv1.2","98","Application Data"
"168","31.646148100","151.101.66.187","100.84.170.161","TCP","98","[TCP Retransmission] 443  >  59747 [PSH, ACK] Seq=65587 Ack=84613 Win=2409 Len=44"
"169","31.646184200","100.84.170.161","151.101.66.187","TCP","66","59747  >  443 [ACK] Seq=84613 Ack=65631 Win=4103 Len=0 SLE=65587 SRE=65631"
"170","31.920171700","100.84.170.161","151.101.66.187","TLSv1.2","2486","Application Data"
"171","31.922126000","100.84.170.161","151.101.66.187","TLSv1.2","2474","Application Data"
"172","31.923660300","100.84.170.161","151.101.66.187","TLSv1.2","2468","Application Data"
"173","31.929133600","100.84.170.161","151.101.66.187","TLSv1.2","2487","Application Data"
"174","31.929237200","151.101.66.187","100.84.170.161","TCP","56","443  >  59747 [ACK] Seq=65631 Ack=87045 Win=2419 Len=0"
"175","31.930995700","151.101.66.187","100.84.170.161","TCP","56","443  >  59747 [ACK] Seq=65631 Ack=89465 Win=2428 Len=0"
"176","31.931885600","151.101.66.187","100.84.170.161","TLSv1.2","104","Application Data"
"177","31.932420300","151.101.66.187","100.84.170.161","TCP","56","443  >  59747 [ACK] Seq=65681 Ack=91879 Win=2438 Len=0"
"178","31.933863200","151.101.66.187","100.84.170.161","TLSv1.2","130","Application Data"
"179","31.933930400","100.84.170.161","151.101.66.187","TCP","54","59747  >  443 [ACK] Seq=94312 Ack=65757 Win=4102 Len=0"
"180","31.935075500","151.101.66.187","100.84.170.161","TLSv1.2","135","Application Data"
"181","31.937862200","151.101.66.187","100.84.170.161","TCP","56","443  >  59747 [ACK] Seq=65838 Ack=94312 Win=2447 Len=0"
"182","31.944141900","151.101.66.187","100.84.170.161","TLSv1.2","98","Application Data"
"183","31.944201200","100.84.170.161","151.101.66.187","TCP","54","59747  >  443 [ACK] Seq=94312 Ack=65882 Win=4102 Len=0"
"184","32.048380400","100.84.170.161","151.101.66.187","TLSv1.2","2490","Application Data"
"185","32.058561100","151.101.66.187","100.84.170.161","TCP","56","443  >  59747 [ACK] Seq=65882 Ack=96748 Win=2457 Len=0"
"186","32.060852300","151.101.66.187","100.84.170.161","TLSv1.2","266","Application Data"
"187","32.090217500","151.101.66.187","100.84.170.161","TCP","266","[TCP Retransmission] 443  >  59747 [PSH, ACK] Seq=65882 Ack=96748 Win=2457 Len=212"
"188","32.090257800","100.84.170.161","151.101.66.187","TCP","66","59747  >  443 [ACK] Seq=96748 Ack=66094 Win=4101 Len=0 SLE=65882 SRE=66094"
"189","32.109077000","100.84.170.161","151.101.66.187","TLSv1.2","2474","Application Data"
"190","32.117696700","151.101.66.187","100.84.170.161","TCP","56","443  >  59747 [ACK] Seq=66094 Ack=99168 Win=2466 Len=0"
"191","32.120498900","151.101.66.187","100.84.170.161","TLSv1.2","175","Application Data"
"192","32.150128200","151.101.66.187","100.84.170.161","TCP","175","[TCP Retransmission] 443  >  59747 [PSH, ACK] Seq=66094 Ack=99168 Win=2466 Len=121"
"193","32.150177900","100.84.170.161","151.101.66.187","TCP","66","59747  >  443 [ACK] Seq=99168 Ack=66215 Win=4100 Len=0 SLE=66094 SRE=66215"
"194","32.153062300","100.84.170.161","151.101.66.187","TLSv1.2","2485","Application Data"
"195","32.153311500","100.84.170.161","151.101.66.187","TLSv1.2","2488","Application Data"
"196","32.153868900","100.84.170.161","151.101.66.187","TLSv1.2","2482","Application Data"
"197","32.156453800","100.84.170.161","151.101.66.187","TLSv1.2","2479","Application Data"
"198","32.161751600","151.101.66.187","100.84.170.161","TCP","56","443  >  59747 [ACK] Seq=66215 Ack=101599 Win=2476 Len=0"
"199","32.162321800","151.101.66.187","100.84.170.161","TCP","56","443  >  59747 [ACK] Seq=66215 Ack=104033 Win=2485 Len=0"
"200","32.162695900","151.101.66.187","100.84.170.161","TCP","56","443  >  59747 [ACK] Seq=66215 Ack=106461 Win=2495 Len=0"
"201","32.165193400","151.101.66.187","100.84.170.161","TCP","56","443  >  59747 [ACK] Seq=66215 Ack=108886 Win=2504 Len=0"
"202","32.168062700","151.101.66.187","100.84.170.161","TLSv1.2","208","Application Data"
"203","32.168318200","151.101.66.187","100.84.170.161","TLSv1.2","124","Application Data"
"204","32.168358200","100.84.170.161","151.101.66.187","TCP","54","59747  >  443 [ACK] Seq=108886 Ack=66439 Win=4106 Len=0"
"205","32.169217900","151.101.66.187","100.84.170.161","TLSv1.2","124","Application Data"
"206","32.170042300","151.101.66.187","100.84.170.161","TLSv1.2","124","Application Data"
"207","32.170093000","100.84.170.161","151.101.66.187","TCP","54","59747  >  443 [ACK] Seq=108886 Ack=66579 Win=4105 Len=0"
"208","32.428716900","100.84.170.161","151.101.66.187","TLSv1.2","2413","Application Data"
"209","32.432727800","100.84.170.161","151.101.66.187","TLSv1.2","2433","Application Data"
"210","32.437332700","151.101.66.187","100.84.170.161","TCP","56","443  >  59747 [ACK] Seq=66579 Ack=111245 Win=2513 Len=0"
"211","32.440094800","151.101.66.187","100.84.170.161","TLSv1.2","104","Application Data"
"212","32.441487700","151.101.66.187","100.84.170.161","TCP","56","443  >  59747 [ACK] Seq=66629 Ack=113624 Win=2523 Len=0"
"213","32.450914700","151.101.66.187","100.84.170.161","TLSv1.2","125","Application Data"
"214","32.450973900","100.84.170.161","151.101.66.187","TCP","54","59747  >  443 [ACK] Seq=113624 Ack=66700 Win=4105 Len=0"
"215","32.681360700","100.84.170.161","151.101.66.187","TLSv1.2","2436","Application Data"
"216","32.691840100","151.101.66.187","100.84.170.161","TCP","56","443  >  59747 [ACK] Seq=66700 Ack=116006 Win=2532 Len=0"
"217","32.693850500","151.101.66.187","100.84.170.161","TLSv1.2","125","Application Data"
"218","32.724592000","151.101.66.187","100.84.170.161","TCP","125","[TCP Retransmission] 443  >  59747 [PSH, ACK] Seq=66700 Ack=116006 Win=2532 Len=71"
"219","32.724657600","100.84.170.161","151.101.66.187","TCP","66","59747  >  443 [ACK] Seq=116006 Ack=66771 Win=4104 Len=0 SLE=66700 SRE=66771"
"220","33.081248900","100.84.170.161","151.101.66.187","TLSv1.2","2442","Application Data"
"221","33.101654800","100.84.170.161","151.101.66.187","TCP","1514","[TCP Retransmission] 59747  >  443 [PSH, ACK] Seq=116934 Ack=66771 Win=4104 Len=1460"
"222","33.113329000","100.84.170.161","151.101.66.187","TCP","55","55359  >  443 [ACK] Seq=1 Ack=1 Win=512 Len=1"
"223","33.134749300","151.101.66.187","100.84.170.161","TLSv1.2","214","Application Data"
"224","33.146745200","151.101.66.187","100.84.170.161","TCP","214","[TCP Retransmission] 443  >  59747 [PSH, ACK] Seq=66771 Ack=118394 Win=2541 Len=160"
"225","33.146786500","100.84.170.161","151.101.66.187","TCP","66","59747  >  443 [ACK] Seq=118394 Ack=66931 Win=4104 Len=0 SLE=66771 SRE=66931"
"226","33.147526100","151.101.66.187","100.84.170.161","TCP","66","[TCP Dup ACK 223#1] 443  >  59747 [ACK] Seq=66931 Ack=118394 Win=2541 Len=0 SLE=116934 SRE=118394"
"227","33.154126800","151.101.66.187","100.84.170.161","TCP","66","443  >  55359 [ACK] Seq=1 Ack=2 Win=281 Len=0 SLE=1 SRE=2"
"228","47.127597700","100.84.170.161","151.101.66.187","TLSv1.2","2463","Application Data"
"229","47.127725300","100.84.170.161","151.101.66.187","TLSv1.2","93","Application Data"
"230","47.156990900","100.84.170.161","151.101.66.187","TCP","1514","[TCP Retransmission] 59747  >  443 [PSH, ACK] Seq=119382 Ack=66931 Win=4104 Len=1460"
"231","47.170495300","151.101.66.187","100.84.170.161","TLSv1.2","93","Application Data"
"232","47.170495300","151.101.66.187","100.84.170.161","TLSv1.2","214","Application Data"
"233","47.170575300","100.84.170.161","151.101.66.187","TCP","54","59747  >  443 [ACK] Seq=120842 Ack=67130 Win=4103 Len=0"
"234","47.176675300","151.101.66.187","100.84.170.161","TCP","66","[TCP Dup ACK 231#1] 443  >  59747 [ACK] Seq=67130 Ack=120842 Win=2551 Len=0 SLE=119382 SRE=120842"
"235","47.284102400","100.84.170.161","151.101.66.187","TLSv1.2","2464","Application Data"
"236","47.291565500","100.84.170.161","151.101.66.187","TLSv1.2","2477","Application Data"
"237","47.293414900","100.84.170.161","151.101.66.187","TLSv1.2","2471","Application Data"
"238","47.294316900","151.101.66.187","100.84.170.161","TCP","56","443  >  59747 [ACK] Seq=67130 Ack=123252 Win=2560 Len=0"
"239","47.296111000","151.101.66.187","100.84.170.161","TLSv1.2","154","Application Data"
"240","47.297824500","100.84.170.161","151.101.66.187","TLSv1.2","2471","Application Data"
"241","47.301136600","151.101.66.187","100.84.170.161","TCP","56","443  >  59747 [ACK] Seq=67230 Ack=125675 Win=2569 Len=0"
"242","47.302905300","151.101.66.187","100.84.170.161","TCP","56","443  >  59747 [ACK] Seq=67230 Ack=128092 Win=2579 Len=0"
"243","47.303267500","151.101.66.187","100.84.170.161","TLSv1.2","124","Application Data"
"244","47.304935500","151.101.66.187","100.84.170.161","TLSv1.2","131","Application Data"
"245","47.304999500","100.84.170.161","151.101.66.187","TCP","54","59747  >  443 [ACK] Seq=130509 Ack=67377 Win=4102 Len=0"
"246","47.307000900","151.101.66.187","100.84.170.161","TCP","56","443  >  59747 [ACK] Seq=67377 Ack=130509 Win=2588 Len=0"
"247","47.309286400","151.101.66.187","100.84.170.161","TLSv1.2","124","Application Data"
"248","47.343921100","151.101.66.187","100.84.170.161","TCP","124","[TCP Retransmission] 443  >  59747 [PSH, ACK] Seq=67377 Ack=130509 Win=2588 Len=70"
"249","47.343970300","100.84.170.161","151.101.66.187","TCP","66","59747  >  443 [ACK] Seq=130509 Ack=67447 Win=4102 Len=0 SLE=67377 SRE=67447"
"250","47.363474200","100.84.170.161","151.101.66.187","TLSv1.2","2471","Application Data"
"251","47.372433800","151.101.66.187","100.84.170.161","TCP","56","443  >  59747 [ACK] Seq=67447 Ack=132926 Win=2598 Len=0"
"252","47.375591400","151.101.66.187","100.84.170.161","TLSv1.2","129","Application Data"
"253","47.405088000","151.101.66.187","100.84.170.161","TCP","129","[TCP Retransmission] 443  >  59747 [PSH, ACK] Seq=67447 Ack=132926 Win=2598 Len=75"
"254","47.405133500","100.84.170.161","151.101.66.187","TCP","66","59747  >  443 [ACK] Seq=132926 Ack=67522 Win=4102 Len=0 SLE=67447 SRE=67522"
"255","47.475388100","100.84.170.161","151.101.66.187","TLSv1.2","2468","Application Data"
"256","47.488383200","151.101.66.187","100.84.170.161","TCP","56","443  >  59747 [ACK] Seq=67522 Ack=135340 Win=2607 Len=0"
"257","47.490823300","151.101.66.187","100.84.170.161","TLSv1.2","125","Application Data"
"258","47.493962600","100.84.170.161","151.101.66.187","TLSv1.2","2485","Application Data"
"259","47.502827300","151.101.66.187","100.84.170.161","TCP","56","443  >  59747 [ACK] Seq=67593 Ack=137771 Win=2617 Len=0"
"260","47.505550800","151.101.66.187","100.84.170.161","TLSv1.2","156","Application Data"
"261","47.517233200","100.84.170.161","151.101.66.187","TLSv1.2","2485","Application Data"
"262","47.532892900","151.101.66.187","100.84.170.161","TCP","56","443  >  59747 [ACK] Seq=67695 Ack=140202 Win=2626 Len=0"
"263","47.535277300","151.101.66.187","100.84.170.161","TLSv1.2","125","Application Data"
"264","47.568299500","151.101.66.187","100.84.170.161","TCP","125","[TCP Retransmission] 443  >  59747 [PSH, ACK] Seq=67695 Ack=140202 Win=2626 Len=71"
"265","47.568342500","100.84.170.161","151.101.66.187","TCP","66","59747  >  443 [ACK] Seq=140202 Ack=67766 Win=4101 Len=0 SLE=67695 SRE=67766"
"266","47.638907700","100.84.170.161","151.101.66.187","TLSv1.2","2480","Application Data"
"267","47.647729600","151.101.66.187","100.84.170.161","TCP","56","443  >  59747 [ACK] Seq=67766 Ack=142628 Win=2636 Len=0"
"268","47.650588300","151.101.66.187","100.84.170.161","TLSv1.2","176","Application Data"
"269","47.696721200","151.101.66.187","100.84.170.161","TCP","176","[TCP Retransmission] 443  >  59747 [PSH, ACK] Seq=67766 Ack=142628 Win=2636 Len=122"
"270","47.696780600","100.84.170.161","151.101.66.187","TCP","66","59747  >  443 [ACK] Seq=142628 Ack=67888 Win=4100 Len=0 SLE=67766 SRE=67888"
"271","47.704536700","100.84.170.161","151.101.66.187","TLSv1.2","2490","Application Data"
"272","47.706680700","100.84.170.161","151.101.66.187","TLSv1.2","2492","Application Data"
"273","47.706888800","100.84.170.161","151.101.66.187","TLSv1.2","2486","Application Data"
"274","47.707034500","100.84.170.161","151.101.66.187","TLSv1.2","2482","Application Data"
"275","47.707224900","100.84.170.161","151.101.66.187","TLSv1.2","2474","Application Data"
"276","47.707452700","100.84.170.161","151.101.66.187","TLSv1.2","2470","Application Data"
"277","47.708086800","100.84.170.161","151.101.66.187","TLSv1.2","2484","Application Data"
"278","47.708419100","100.84.170.161","151.101.66.187","TLSv1.2","2473","Application Data"
"279","47.736285800","100.84.170.161","151.101.66.187","TCP","1514","[TCP Retransmission] 59747  >  443 [PSH, ACK] Seq=160587 Ack=67888 Win=4100 Len=1460"
"280","47.761812800","151.101.66.187","100.84.170.161","TCP","56","443  >  59747 [ACK] Seq=67888 Ack=162047 Win=2712 Len=0"
"281","47.761812800","151.101.66.187","100.84.170.161","TLSv1.2","208","Application Data"
"282","47.761812800","151.101.66.187","100.84.170.161","TLSv1.2","124","Application Data"
"283","47.761812800","151.101.66.187","100.84.170.161","TLSv1.2","125","Application Data"
"284","47.761812800","151.101.66.187","100.84.170.161","TLSv1.2","208","Application Data, Application Data"
"285","47.761812800","151.101.66.187","100.84.170.161","TLSv1.2","178","Application Data"
"286","47.761910900","100.84.170.161","151.101.66.187","TCP","54","59747  >  443 [ACK] Seq=162047 Ack=68461 Win=4106 Len=0"
"287","47.766931400","151.101.66.187","100.84.170.161","TLSv1.2","240","Application Data"
"288","47.766931400","151.101.66.187","100.84.170.161","TCP","240","[TCP Retransmission] 443  >  59747 [PSH, ACK] Seq=68461 Ack=162047 Win=2712 Len=186"
"289","47.766991800","100.84.170.161","151.101.66.187","TCP","66","59747  >  443 [ACK] Seq=162047 Ack=68647 Win=4105 Len=0 SLE=68461 SRE=68647"
"290","47.779037600","151.101.66.187","100.84.170.161","TCP","66","[TCP Dup ACK 280#1] 443  >  59747 [ACK] Seq=68647 Ack=162047 Win=2712 Len=0 SLE=160587 SRE=162047"
"291","56.300392500","100.84.170.161","151.101.66.187","TLSv1.2","2485","Application Data"
"292","56.310281200","151.101.66.187","100.84.170.161","TCP","56","443  >  59747 [ACK] Seq=68647 Ack=164478 Win=2721 Len=0"
"293","56.312795800","151.101.66.187","100.84.170.161","TLSv1.2","264","Application Data"
"294","56.324641000","100.84.170.161","151.101.66.187","TLSv1.2","2483","Application Data"
"295","56.333396700","151.101.66.187","100.84.170.161","TCP","56","443  >  59747 [ACK] Seq=68857 Ack=166907 Win=2731 Len=0"
"296","56.335948900","151.101.66.187","100.84.170.161","TLSv1.2","125","Application Data"
"297","56.379404200","100.84.170.161","151.101.66.187","TCP","54","59747  >  443 [ACK] Seq=166907 Ack=68928 Win=4104 Len=0"
"298","56.380257600","151.101.66.187","100.84.170.161","TCP","125","[TCP Spurious Retransmission] 443  >  59747 [PSH, ACK] Seq=68857 Ack=166907 Win=2731 Len=71"
"299","56.380298700","100.84.170.161","151.101.66.187","TCP","66","[TCP Dup ACK 297#1] 59747  >  443 [ACK] Seq=166907 Ack=68928 Win=4104 Len=0 SLE=68857 SRE=68928"
"300","56.591759200","100.84.170.161","151.101.66.187","TLSv1.2","2486","Application Data"
"301","56.601995100","151.101.66.187","100.84.170.161","TCP","56","443  >  59747 [ACK] Seq=68928 Ack=169339 Win=2740 Len=0"
"302","56.604821100","151.101.66.187","100.84.170.161","TLSv1.2","136","Application Data"
"303","56.648011700","151.101.66.187","100.84.170.161","TCP","136","[TCP Retransmission] 443  >  59747 [PSH, ACK] Seq=68928 Ack=169339 Win=2740 Len=82"
"304","56.648058100","100.84.170.161","151.101.66.187","TCP","66","59747  >  443 [ACK] Seq=169339 Ack=69010 Win=4104 Len=0 SLE=68928 SRE=69010"
"305","56.748206100","100.84.170.161","151.101.66.187","TLSv1.2","2488","Application Data"
"306","56.757011900","151.101.66.187","100.84.170.161","TCP","56","443  >  59747 [ACK] Seq=69010 Ack=171773 Win=2750 Len=0"
"307","56.760116400","151.101.66.187","100.84.170.161","TLSv1.2","163","Application Data"
"308","56.800278600","100.84.170.161","151.101.66.187","TCP","54","59747  >  443 [ACK] Seq=171773 Ack=69119 Win=4103 Len=0"
"309","56.803826500","151.101.66.187","100.84.170.161","TCP","163","[TCP Spurious Retransmission] 443  >  59747 [PSH, ACK] Seq=69010 Ack=171773 Win=2750 Len=109"
"310","56.803865700","100.84.170.161","151.101.66.187","TCP","66","[TCP Dup ACK 308#1] 59747  >  443 [ACK] Seq=171773 Ack=69119 Win=4103 Len=0 SLE=69010 SRE=69119"
"311","58.028109400","100.84.170.161","151.101.66.187","TLSv1.2","2485","Application Data"
"312","58.031915200","100.84.170.161","151.101.66.187","TLSv1.2","2483","Application Data"
"313","58.037246500","151.101.66.187","100.84.170.161","TCP","56","443  >  59747 [ACK] Seq=69119 Ack=174204 Win=2761 Len=0"
"314","58.040309800","151.101.66.187","100.84.170.161","TLSv1.2","286","Application Data"
"315","58.040581500","151.101.66.187","100.84.170.161","TCP","56","443  >  59747 [ACK] Seq=69351 Ack=176633 Win=2770 Len=0"
"316","58.043316900","151.101.66.187","100.84.170.161","TLSv1.2","176","Application Data"
"317","58.043388800","100.84.170.161","151.101.66.187","TCP","54","59747  >  443 [ACK] Seq=176633 Ack=69473 Win=4102 Len=0"
"318","58.093769300","100.84.170.161","151.101.66.187","TLSv1.2","2486","Application Data"
"319","58.103301500","151.101.66.187","100.84.170.161","TCP","56","443  >  59747 [ACK] Seq=69473 Ack=179065 Win=2780 Len=0"
"320","58.108196600","151.101.66.187","100.84.170.161","TLSv1.2","98","Application Data"
"321","58.147563900","100.84.170.161","151.101.66.187","TCP","54","59747  >  443 [ACK] Seq=179065 Ack=69517 Win=4102 Len=0"
"322","58.149932200","151.101.66.187","100.84.170.161","TCP","98","[TCP Spurious Retransmission] 443  >  59747 [PSH, ACK] Seq=69473 Ack=179065 Win=2780 Len=44"
"323","58.149992200","100.84.170.161","151.101.66.187","TCP","66","[TCP Dup ACK 321#1] 59747  >  443 [ACK] Seq=179065 Ack=69517 Win=4102 Len=0 SLE=69473 SRE=69517"
"324","58.295766700","100.84.170.161","151.101.66.187","TLSv1.2","2492","Application Data"
"325","58.305515300","151.101.66.187","100.84.170.161","TCP","56","443  >  59747 [ACK] Seq=69517 Ack=181503 Win=2789 Len=0"
"326","58.307935300","151.101.66.187","100.84.170.161","TLSv1.2","104","Application Data"
"327","58.351246600","151.101.66.187","100.84.170.161","TCP","104","[TCP Retransmission] 443  >  59747 [PSH, ACK] Seq=69517 Ack=181503 Win=2789 Len=50"
"328","58.351311100","100.84.170.161","151.101.66.187","TCP","66","59747  >  443 [ACK] Seq=181503 Ack=69567 Win=4101 Len=0 SLE=69517 SRE=69567"
"329","59.777456100","100.84.170.161","151.101.66.187","TLSv1.2","2485","Application Data"
"330","59.787080800","151.101.66.187","100.84.170.161","TCP","56","443  >  59747 [ACK] Seq=69567 Ack=183934 Win=2799 Len=0"
"331","59.789583200","151.101.66.187","100.84.170.161","TLSv1.2","214","Application Data"
"332","59.831234200","100.84.170.161","151.101.66.187","TCP","54","59747  >  443 [ACK] Seq=183934 Ack=69727 Win=4101 Len=0"
"333","59.832098800","151.101.66.187","100.84.170.161","TCP","214","[TCP Spurious Retransmission] 443  >  59747 [PSH, ACK] Seq=69567 Ack=183934 Win=2799 Len=160"
"334","59.832160800","100.84.170.161","151.101.66.187","TCP","66","[TCP Dup ACK 332#1] 59747  >  443 [ACK] Seq=183934 Ack=69727 Win=4101 Len=0 SLE=69567 SRE=69727"
"335","59.879391100","100.84.170.161","151.101.66.187","TLSv1.2","2486","Application Data"
"336","59.889760600","151.101.66.187","100.84.170.161","TCP","56","443  >  59747 [ACK] Seq=69727 Ack=186366 Win=2808 Len=0"
"337","59.891321100","151.101.66.187","100.84.170.161","TLSv1.2","98","Application Data"
"338","59.932597700","100.84.170.161","151.101.66.187","TCP","54","59747  >  443 [ACK] Seq=186366 Ack=69771 Win=4101 Len=0"
"339","59.932820400","151.101.66.187","100.84.170.161","TCP","98","[TCP Spurious Retransmission] 443  >  59747 [PSH, ACK] Seq=69727 Ack=186366 Win=2808 Len=44"
"340","59.932869400","100.84.170.161","151.101.66.187","TCP","66","[TCP Dup ACK 338#1] 59747  >  443 [ACK] Seq=186366 Ack=69771 Win=4101 Len=0 SLE=69727 SRE=69771"
"341","60.049987600","100.84.170.161","151.101.66.187","TLSv1.2","2488","Application Data"
"342","60.059553300","151.101.66.187","100.84.170.161","TCP","56","443  >  59747 [ACK] Seq=69771 Ack=188800 Win=2818 Len=0"
"343","60.061849600","151.101.66.187","100.84.170.161","TLSv1.2","214","Application Data"
"344","60.103757900","151.101.66.187","100.84.170.161","TCP","214","[TCP Retransmission] 443  >  59747 [PSH, ACK] Seq=69771 Ack=188800 Win=2818 Len=160"
"345","60.103797800","100.84.170.161","151.101.66.187","TCP","66","59747  >  443 [ACK] Seq=188800 Ack=69931 Win=4106 Len=0 SLE=69771 SRE=69931"
