No.,Time,Source,Destination,Protocol,Length,Info
1,0.0,100.84.170.161,151.101.2.187,TCP,66,64433  >  443 [SYN] Seq=0 Win=64240 Len=0 MSS=1460 WS=256 SACK_PERM
2,0.0008373,100.84.170.161,151.101.2.187,TCP,66,50097  >  443 [SYN] Seq=0 Win=64240 Len=0 MSS=1460 WS=256 SACK_PERM
3,0.0132803,151.101.2.187,100.84.170.161,TCP,66,"443  >  64433 [SYN, ACK] Seq=0 Ack=1 Win=65535 Len=0 MSS=1460 SACK_PERM WS=512"
4,0.0134753,100.84.170.161,151.101.2.187,TCP,54,64433  >  443 [ACK] Seq=1 Ack=1 Win=131328 Len=0
5,0.0149095,151.101.2.187,100.84.170.161,TCP,66,"443  >  50097 [SYN, ACK] Seq=0 Ack=1 Win=65535 Len=0 MSS=1460 SACK_PERM WS=512"
6,0.0152856,100.84.170.161,151.101.2.187,TCP,54,50097  >  443 [ACK] Seq=1 Ack=1 Win=131328 Len=0
7,0.0162427,100.84.170.161,151.101.2.187,TLSv1.3,1778,Client Hello (SNI=www.target.com)
8,0.017598,100.84.170.161,151.101.2.187,TLSv1.3,1778,Client Hello (SNI=www.target.com)
9,0.0261488,151.101.2.187,100.84.170.161,TCP,56,443  >  64433 [ACK] Seq=1 Ack=1725 Win=144896 Len=0
10,0.0264499,151.101.2.187,100.84.170.161,TCP,56,443  >  50097 [ACK] Seq=1 Ack=1461 Win=144896 Len=0
11,0.0268278,151.101.2.187,100.84.170.161,TCP,56,443  >  50097 [ACK] Seq=1 Ack=1725 Win=144896 Len=0
12,0.0281973,151.101.2.187,100.84.170.161,TLSv1.3,1510,"Server Hello, Change Cipher Spec, Application Data"
13,0.0285452,151.101.2.187,100.84.170.161,TCP,1510,443  >  64433 [ACK] Seq=1457 Ack=1725 Win=145920 Len=1456 [TCP PDU reassembled in 16]
14,0.0286,100.84.170.161,151.101.2.187,TCP,54,64433  >  443 [ACK] Seq=1725 Ack=2913 Win=131328 Len=0
15,0.0289969,151.101.2.187,100.84.170.161,TCP,4422,"443  >  64433 [PSH, ACK] Seq=2913 Ack=1725 Win=145920 Len=4368 [TCP PDU reassembled in 16]"
16,0.0289969,151.101.2.187,100.84.170.161,TLSv1.3,675,"Application Data, Application Data, Application Data, Application Data"
17,0.0290811,100.84.170.161,151.101.2.187,TCP,54,64433  >  443 [ACK] Seq=1725 Ack=7902 Win=131328 Len=0
18,0.029629,151.101.2.187,100.84.170.161,TLSv1.3,7334,"Server Hello, Change Cipher Spec, Application Data"
19,0.029629,151.101.2.187,100.84.170.161,TLSv1.3,675,"Application Data, Application Data, Application Data, Application Data"
20,0.0297332,100.84.170.161,151.101.2.187,TCP,54,50097  >  443 [ACK] Seq=1725 Ack=7902 Win=131328 Len=0
21,0.0363114,100.84.170.161,151.101.2.187,TLSv1.3,118,"Change Cipher Spec, Application Data"
22,0.0369481,100.84.170.161,151.101.2.187,TLSv1.3,118,"Change Cipher Spec, Application Data"
23,0.0377325,100.84.170.161,151.101.2.187,TCP,54,"50097  >  443 [FIN, ACK] Seq=1789 Ack=7902 Win=131328 Len=0"
24,0.0381284,100.84.170.161,151.101.2.187,TLSv1.3,146,Application Data
25,0.0389508,100.84.170.161,151.101.2.187,TLSv1.3,2331,Application Data
26,0.0393487,100.84.170.161,151.101.2.187,TLSv1.3,2330,Application Data
27,0.0454335,151.101.2.187,100.84.170.161,TCP,56,443  >  64433 [ACK] Seq=7902 Ack=1789 Win=145920 Len=0
28,0.0457538,151.101.2.187,100.84.170.161,TCP,56,443  >  50097 [ACK] Seq=7902 Ack=1789 Win=145920 Len=0
29,0.0475096,151.101.2.187,100.84.170.161,TLSv1.3,119,Application Data
30,0.0485868,151.101.2.187,100.84.170.161,TCP,56,443  >  64433 [ACK] Seq=7967 Ack=6434 Win=144384 Len=0
31,0.0486825,100.84.170.161,151.101.2.187,TLSv1.3,85,Application Data
32,0.0504499,151.101.2.187,100.84.170.161,TLSv1.3,78,Application Data
33,0.0505326,100.84.170.161,151.101.2.187,TCP,54,"50097  >  443 [RST, ACK] Seq=1790 Ack=7926 Win=0 Len=0"
34,0.0525002,151.101.2.187,100.84.170.161,TLSv1.3,451,Application Data
35,0.0525002,151.101.2.187,100.84.170.161,TLSv1.3,125,Application Data
36,0.052581,100.84.170.161,151.101.2.187,TCP,54,64433  >  443 [ACK] Seq=6465 Ack=8435 Win=130816 Len=0
37,0.057872,151.101.2.187,100.84.170.161,TCP,56,443  >  64433 [ACK] Seq=8435 Ack=6465 Win=145920 Len=0
38,0.4807543,100.84.170.161,151.101.2.187,TLSv1.3,2328,Application Data
39,0.4899846,151.101.2.187,100.84.170.161,TCP,56,443  >  64433 [ACK] Seq=8435 Ack=8739 Win=144384 Len=0
40,0.4923992,151.101.2.187,100.84.170.161,TLSv1.3,131,Application Data
41,0.5206066,151.101.2.187,100.84.170.161,TCP,131,"[TCP Retransmission] 443  >  64433 [PSH, ACK] Seq=8435 Ack=8739 Win=145920 Len=77"
42,0.5206543,100.84.170.161,151.101.2.187,TCP,66,64433  >  443 [ACK] Seq=8739 Ack=8512 Win=130560 Len=0 SLE=8435 SRE=8512
43,0.8132946,100.84.170.161,151.101.2.187,TLSv1.3,2329,Application Data
44,0.8159561,100.84.170.161,151.101.2.187,TLSv1.3,2330,Application Data
45,0.8244021,151.101.2.187,100.84.170.161,TCP,56,443  >  64433 [ACK] Seq=8512 Ack=11014 Win=144384 Len=0
46,0.8268963,151.101.2.187,100.84.170.161,TCP,56,443  >  64433 [ACK] Seq=8512 Ack=13290 Win=144384 Len=0
47,0.8272542,151.101.2.187,100.84.170.161,TLSv1.3,234,Application Data
48,0.8279779,151.101.2.187,100.84.170.161,TLSv1.3,130,Application Data
49,0.828048,100.84.170.161,151.101.2.187,TCP,54,64433  >  443 [ACK] Seq=13290 Ack=8768 Win=130304 Len=0
50,1.4606798,100.84.170.161,151.101.2.187,TLSv1.3,2330,Application Data
51,1.4630052,100.84.170.161,151.101.2.187,TLSv1.3,328,Application Data
52,1.4673661,100.84.170.161,151.101.2.187,TLSv1.3,142,Application Data
53,1.4719308,151.101.2.187,100.84.170.161,TCP,56,443  >  64433 [ACK] Seq=8768 Ack=15566 Win=144384 Len=0
54,1.4725521,151.101.2.187,100.84.170.161,TCP,56,443  >  64433 [ACK] Seq=8768 Ack=15840 Win=144384 Len=0
55,1.4734009,151.101.2.187,100.84.170.161,TLSv1.3,104,Application Data
56,1.4735134,100.84.170.161,151.101.2.187,TLSv1.3,2151,Application Data
57,1.47436,151.101.2.187,100.84.170.161,TLSv1.3,173,Application Data
58,1.4747331,151.101.2.187,100.84.170.161,TLSv1.3,447,Application Data
59,1.4747835,100.84.170.161,151.101.2.187,TCP,54,64433  >  443 [ACK] Seq=18025 Ack=9330 Win=129792 Len=0
60,1.4782051,151.101.2.187,100.84.170.161,TCP,56,443  >  64433 [ACK] Seq=9330 Ack=15928 Win=145920 Len=0
61,1.4814557,151.101.2.187,100.84.170.161,TLSv1.3,160,Application Data
62,1.4815431,100.84.170.161,151.101.2.187,TCP,54,64433  >  443 [ACK] Seq=18025 Ack=9436 Win=131328 Len=0
63,1.4817255,151.101.2.187,100.84.170.161,TLSv1.3,330,Application Data
64,1.4817682,100.84.170.161,151.101.2.187,TCP,54,64433  >  443 [ACK] Seq=18025 Ack=9712 Win=131072 Len=0
65,1.4839751,151.101.2.187,100.84.170.161,TCP,56,443  >  64433 [ACK] Seq=9712 Ack=18025 Win=144384 Len=0
66,1.4870121,151.101.2.187,100.84.170.161,TLSv1.3,98,Application Data
67,1.5187109,151.101.2.187,100.84.170.161,TCP,98,"[TCP Retransmission] 443  >  64433 [PSH, ACK] Seq=9712 Ack=18025 Win=145920 Len=44"
68,1.5187507,100.84.170.161,151.101.2.187,TCP,66,64433  >  443 [ACK] Seq=18025 Ack=9756 Win=131072 Len=0 SLE=9712 SRE=9756
69,1.6162103,100.84.170.161,151.101.2.187,TLSv1.3,344,Application Data
70,1.625757,151.101.2.187,100.84.170.161,TCP,56,443  >  64433 [ACK] Seq=9756 Ack=18315 Win=145920 Len=0
71,1.6290213,151.101.2.187,100.84.170.161,TLSv1.3,472,Application Data
72,1.6557954,151.101.2.187,100.84.170.161,TCP,472,"[TCP Retransmission] 443  >  64433 [PSH, ACK] Seq=9756 Ack=18315 Win=145920 Len=418"
73,1.65584,100.84.170.161,151.101.2.187,TCP,66,64433  >  443 [ACK] Seq=18315 Ack=10174 Win=130560 Len=0 SLE=9756 SRE=10174
74,1.6740799,100.84.170.161,151.101.2.187,TLSv1.3,159,Application Data
75,1.6742303,100.84.170.161,151.101.2.187,TLSv1.3,260,Application Data
76,1.6742668,100.84.170.161,151.101.2.187,TLSv1.3,149,Application Data
77,1.6744734,100.84.170.161,151.101.2.187,TLSv1.3,146,Application Data
78,1.683479,151.101.2.187,100.84.170.161,TCP,56,443  >  64433 [ACK] Seq=10174 Ack=18420 Win=145920 Len=0
79,1.6839353,151.101.2.187,100.84.170.161,TCP,56,443  >  64433 [ACK] Seq=10174 Ack=18813 Win=145920 Len=0
80,1.6867766,151.101.2.187,100.84.170.161,TLSv1.3,1037,Application Data
81,1.6874326,151.101.2.187,100.84.170.161,TLSv1.3,762,Application Data
82,1.6874326,151.101.2.187,100.84.170.161,TLSv1.3,737,Application Data
83,1.6875133,100.84.170.161,151.101.2.187,TCP,54,64433  >  443 [ACK] Seq=18813 Ack=12548 Win=131328 Len=0
84,1.6877488,151.101.2.187,100.84.170.161,TLSv1.3,138,Application Data
85,1.6877488,151.101.2.187,100.84.170.161,TLSv1.3,556,Application Data
86,1.6877952,100.84.170.161,151.101.2.187,TCP,54,64433  >  443 [ACK] Seq=18813 Ack=13134 Win=130560 Len=0
87,1.7463314,100.84.170.161,151.101.2.187,TLSv1.3,221,Application Data
88,1.7557265,151.101.2.187,100.84.170.161,TCP,56,443  >  64433 [ACK] Seq=13134 Ack=18980 Win=145920 Len=0
89,1.7583256,151.101.2.187,100.84.170.161,TLSv1.3,104,Application Data
90,1.7849635,151.101.2.187,100.84.170.161,TCP,104,"[TCP Retransmission] 443  >  64433 [PSH, ACK] Seq=13134 Ack=18980 Win=145920 Len=50"
91,1.7850079,100.84.170.161,151.101.2.187,TCP,66,64433  >  443 [ACK] Seq=18980 Ack=13184 Win=130560 Len=0 SLE=13134 SRE=13184
92,1.8140572,100.84.170.161,151.101.2.187,TLSv1.3,2035,Application Data
93,1.8154782,100.84.170.161,151.101.2.187,TLSv1.3,488,Application Data
94,1.8232384,151.101.2.187,100.84.170.161,TCP,56,443  >  64433 [ACK] Seq=13184 Ack=20961 Win=144384 Len=0
95,1.8247283,151.101.2.187,100.84.170.161,TCP,56,443  >  64433 [ACK] Seq=13184 Ack=21395 Win=144384 Len=0
96,1.8269946,151.101.2.187,100.84.170.161,TLSv1.3,125,Application Data
97,1.8275525,151.101.2.187,100.84.170.161,TLSv1.3,125,Application Data
98,1.8276017,100.84.170.161,151.101.2.187,TCP,54,64433  >  443 [ACK] Seq=21395 Ack=13326 Win=130560 Len=0
99,2.2522349,100.84.170.161,151.101.2.187,TLSv1.3,1968,Application Data
100,2.2627418,151.101.2.187,100.84.170.161,TCP,56,443  >  64433 [ACK] Seq=13326 Ack=23309 Win=144384 Len=0
101,2.2665276,151.101.2.187,100.84.170.161,TLSv1.3,104,Application Data
102,2.2782548,100.84.170.161,151.101.2.187,TLSv1.3,354,Application Data
103,2.2900239,151.101.2.187,100.84.170.161,TCP,56,443  >  64433 [ACK] Seq=13376 Ack=23609 Win=145920 Len=0
104,2.2937335,151.101.2.187,100.84.170.161,TLSv1.3,125,Application Data
105,2.3231548,151.101.2.187,100.84.170.161,TCP,125,"[TCP Retransmission] 443  >  64433 [PSH, ACK] Seq=13376 Ack=23609 Win=145920 Len=71"
106,2.3232069,100.84.170.161,151.101.2.187,TCP,66,64433  >  443 [ACK] Seq=23609 Ack=13447 Win=130304 Len=0 SLE=13376 SRE=13447
107,2.4223012,100.84.170.161,151.101.2.187,TLSv1.3,2260,Application Data
108,2.434271,151.101.2.187,100.84.170.161,TCP,56,443  >  64433 [ACK] Seq=13447 Ack=25815 Win=144384 Len=0
109,2.4371364,151.101.2.187,100.84.170.161,TLSv1.3,98,Application Data
110,2.4709824,151.101.2.187,100.84.170.161,TCP,98,"[TCP Retransmission] 443  >  64433 [PSH, ACK] Seq=13447 Ack=25815 Win=145920 Len=44"
111,2.4710297,100.84.170.161,151.101.2.187,TCP,66,64433  >  443 [ACK] Seq=25815 Ack=13491 Win=130304 Len=0 SLE=13447 SRE=13491
112,2.9795324,100.84.170.161,151.101.2.187,TLSv1.3,370,Application Data
113,2.9797445,100.84.170.161,151.101.2.187,TLSv1.3,2249,Application Data
114,2.9886153,151.101.2.187,100.84.170.161,TCP,56,443  >  64433 [ACK] Seq=13491 Ack=26131 Win=145920 Len=0
115,2.9894317,151.101.2.187,100.84.170.161,TCP,56,443  >  64433 [ACK] Seq=13491 Ack=28326 Win=144384 Len=0
116,2.9914691,151.101.2.187,100.84.170.161,TLSv1.3,208,Application Data
117,2.9917734,151.101.2.187,100.84.170.161,TLSv1.3,124,Application Data
118,2.9918114,100.84.170.161,151.101.2.187,TCP,54,64433  >  443 [ACK] Seq=28326 Ack=13715 Win=130048 Len=0
119,7.7813316,100.84.170.161,151.101.2.187,TLSv1.3,750,Application Data
120,7.7912017,151.101.2.187,100.84.170.161,TCP,56,443  >  64433 [ACK] Seq=13715 Ack=29022 Win=145408 Len=0
121,7.793866,151.101.2.187,100.84.170.161,TLSv1.3,214,Application Data
122,7.8226006,151.101.2.187,100.84.170.161,TCP,214,"[TCP Retransmission] 443  >  64433 [PSH, ACK] Seq=13715 Ack=29022 Win=145920 Len=160"
123,7.8226568,100.84.170.161,151.101.2.187,TCP,66,64433  >  443 [ACK] Seq=29022 Ack=13875 Win=130048 Len=0 SLE=13715 SRE=13875
124,7.9099235,100.84.170.161,151.101.2.187,TLSv1.3,1904,Application Data
125,7.9136307,100.84.170.161,151.101.2.187,TLSv1.3,695,Application Data
126,7.9171335,100.84.170.161,151.101.2.187,TLSv1.3,1897,Application Data
127,7.9203567,151.101.2.187,100.84.170.161,TCP,56,443  >  64433 [ACK] Seq=13875 Ack=30872 Win=144384 Len=0
128,7.9236896,151.101.2.187,100.84.170.161,TLSv1.3,421,Application Data
129,7.92377,100.84.170.161,151.101.2.187,TCP,54,64433  >  443 [ACK] Seq=33356 Ack=14242 Win=131328 Len=0
130,7.9255261,100.84.170.161,151.101.2.187,TLSv1.3,89,Application Data
131,7.9256752,151.101.2.187,100.84.170.161,TCP,56,443  >  64433 [ACK] Seq=14242 Ack=31513 Win=145408 Len=0
132,7.9264568,151.101.2.187,100.84.170.161,TLSv1.3,403,Application Data
133,7.9270386,151.101.2.187,100.84.170.161,TCP,56,443  >  64433 [ACK] Seq=14591 Ack=33356 Win=144384 Len=0
134,7.9300161,151.101.2.187,100.84.170.161,TLSv1.3,183,Application Data
135,7.930092,100.84.170.161,151.101.2.187,TCP,54,64433  >  443 [ACK] Seq=33391 Ack=14720 Win=130816 Len=0
136,7.9302149,151.101.2.187,100.84.170.161,TLSv1.3,569,Application Data
137,7.9348087,151.101.2.187,100.84.170.161,TCP,56,443  >  64433 [ACK] Seq=15235 Ack=33391 Win=145920 Len=0
138,7.9668054,151.101.2.187,100.84.170.161,TCP,569,"[TCP Retransmission] 443  >  64433 [PSH, ACK] Seq=14720 Ack=33391 Win=145920 Len=515"
139,7.9668493,100.84.170.161,151.101.2.187,TCP,66,64433  >  443 [ACK] Seq=33391 Ack=15235 Win=130304 Len=0 SLE=14720 SRE=15235
140,8.0682394,100.84.170.161,151.101.2.187,TLSv1.3,702,Application Data
141,8.0690219,100.84.170.161,151.101.2.187,TLSv1.3,2402,Application Data
142,8.0752412,100.84.170.161,151.101.2.187,TLSv1.3,2512,Application Data
143,8.0776056,151.101.2.187,100.84.170.161,TCP,56,443  >  64433 [ACK] Seq=15235 Ack=34039 Win=145408 Len=0
144,8.0784009,151.101.2.187,100.84.170.161,TCP,56,443  >  64433 [ACK] Seq=15235 Ack=36387 Win=144384 Len=0
145,8.0802955,151.101.2.187,100.84.170.161,TLSv1.3,162,Application Data
146,8.0802955,151.101.2.187,100.84.170.161,TLSv1.3,364,Application Data
147,8.0804119,100.84.170.161,151.101.2.187,TCP,54,64433  >  443 [ACK] Seq=38845 Ack=15653 Win=129792 Len=0
148,8.0806478,151.101.2.187,100.84.170.161,TLSv1.3,270,Application Data
149,8.080751,100.84.170.161,151.101.2.187,TCP,54,64433  >  443 [ACK] Seq=38845 Ack=15869 Win=131328 Len=0
150,8.0849437,151.101.2.187,100.84.170.161,TCP,56,443  >  64433 [ACK] Seq=15869 Ack=38845 Win=144384 Len=0
151,8.0872112,151.101.2.187,100.84.170.161,TLSv1.3,98,Application Data
152,8.0872735,100.84.170.161,151.101.2.187,TCP,54,64433  >  443 [ACK] Seq=38845 Ack=15913 Win=131328 Len=0
153,8.2731638,100.84.170.161,151.101.2.187,TLSv1.3,2442,Application Data
154,8.282915,151.101.2.187,100.84.170.161,TCP,56,443  >  64433 [ACK] Seq=15913 Ack=41233 Win=144384 Len=0
155,8.2852638,151.101.2.187,100.84.170.161,TLSv1.3,133,Application Data
156,8.2855271,151.101.2.187,100.84.170.161,TLSv1.3,364,Application Data
157,8.2855679,100.84.170.161,151.101.2.187,TCP,54,64433  >  443 [ACK] Seq=41233 Ack=16302 Win=130816 Len=0
158,8.2890949,100.84.170.161,151.101.2.187,TLSv1.3,2448,Application Data
159,8.2909386,100.84.170.161,151.101.2.187,TLSv1.3,2448,Application Data
160,8.2925865,100.84.170.161,151.101.2.187,TLSv1.3,2445,Application Data
161,8.2985635,151.101.2.187,100.84.170.161,TCP,56,443  >  64433 [ACK] Seq=16302 Ack=43627 Win=144384 Len=0
162,8.301112,151.101.2.187,100.84.170.161,TCP,56,443  >  64433 [ACK] Seq=16302 Ack=46021 Win=144384 Len=0
163,8.3014544,151.101.2.187,100.84.170.161,TLSv1.3,156,Application Data
164,8.3017841,151.101.2.187,100.84.170.161,TLSv1.3,323,Application Data
165,8.3018372,100.84.170.161,151.101.2.187,TCP,54,64433  >  443 [ACK] Seq=48412 Ack=16673 Win=130560 Len=0
166,8.3021465,151.101.2.187,100.84.170.161,TCP,56,443  >  64433 [ACK] Seq=16673 Ack=48412 Win=144384 Len=0
167,8.3028475,151.101.2.187,100.84.170.161,TLSv1.3,132,Application Data
168,8.3028475,151.101.2.187,100.84.170.161,TLSv1.3,694,Application Data
169,8.3029244,100.84.170.161,151.101.2.187,TCP,54,64433  >  443 [ACK] Seq=48412 Ack=17391 Win=131328 Len=0
170,8.3041933,151.101.2.187,100.84.170.161,TLSv1.3,155,Application Data
171,8.3045081,151.101.2.187,100.84.170.161,TLSv1.3,833,Application Data
172,8.3045463,100.84.170.161,151.101.2.187,TCP,54,64433  >  443 [ACK] Seq=48412 Ack=18271 Win=130304 Len=0
173,8.3593959,100.84.170.161,151.101.2.187,TLSv1.3,2511,Application Data
174,8.3687031,151.101.2.187,100.84.170.161,TCP,56,443  >  64433 [ACK] Seq=18271 Ack=50869 Win=144384 Len=0
175,8.3715273,151.101.2.187,100.84.170.161,TLSv1.3,130,Application Data
176,8.3948114,151.101.2.187,100.84.170.161,TCP,130,"[TCP Retransmission] 443  >  64433 [PSH, ACK] Seq=18271 Ack=50869 Win=145920 Len=76"
177,8.3948718,100.84.170.161,151.101.2.187,TCP,66,64433  >  443 [ACK] Seq=50869 Ack=18347 Win=130304 Len=0 SLE=18271 SRE=18347
178,8.5850402,100.84.170.161,151.101.2.187,TLSv1.3,2488,Application Data
179,8.5870688,100.84.170.161,151.101.2.187,TLSv1.3,2512,Application Data
180,8.5948042,151.101.2.187,100.84.170.161,TCP,56,443  >  64433 [ACK] Seq=18347 Ack=53303 Win=144384 Len=0
181,8.5967798,151.101.2.187,100.84.170.161,TCP,56,443  >  64433 [ACK] Seq=18347 Ack=55761 Win=144384 Len=0
182,8.5985102,151.101.2.187,100.84.170.161,TLSv1.3,125,Application Data
183,8.5999808,151.101.2.187,100.84.170.161,TLSv1.3,125,Application Data
184,8.600068,100.84.170.161,151.101.2.187,TCP,54,64433  >  443 [ACK] Seq=55761 Ack=18489 Win=130048 Len=0
185,8.6339622,100.84.170.161,151.101.2.187,TLSv1.3,2525,Application Data
186,8.6438958,151.101.2.187,100.84.170.161,TCP,56,443  >  64433 [ACK] Seq=18489 Ack=58232 Win=144384 Len=0
187,8.6458766,151.101.2.187,100.84.170.161,TLSv1.3,98,Application Data
188,8.6715914,151.101.2.187,100.84.170.161,TCP,98,"[TCP Retransmission] 443  >  64433 [PSH, ACK] Seq=18489 Ack=58232 Win=145920 Len=44"
189,8.6716304,100.84.170.161,151.101.2.187,TCP,66,64433  >  443 [ACK] Seq=58232 Ack=18533 Win=130048 Len=0 SLE=18489 SRE=18533
190,8.6964494,100.84.170.161,151.101.2.187,TLSv1.3,2524,Application Data
191,8.7067863,151.101.2.187,100.84.170.161,TCP,56,443  >  64433 [ACK] Seq=18533 Ack=60702 Win=144384 Len=0
192,8.7086657,151.101.2.187,100.84.170.161,TLSv1.3,208,Application Data
193,8.7337589,151.101.2.187,100.84.170.161,TCP,208,"[TCP Retransmission] 443  >  64433 [PSH, ACK] Seq=18533 Ack=60702 Win=145920 Len=154"
194,8.7338044,100.84.170.161,151.101.2.187,TCP,66,64433  >  443 [ACK] Seq=60702 Ack=18687 Win=130048 Len=0 SLE=18533 SRE=18687
195,8.7395721,100.84.170.161,151.101.2.187,TLSv1.3,2062,Application Data
196,8.7488606,151.101.2.187,100.84.170.161,TCP,56,443  >  64433 [ACK] Seq=18687 Ack=62710 Win=144384 Len=0
197,8.8455558,151.101.2.187,100.84.170.161,TLSv1.3,479,Application Data
198,8.8459356,151.101.2.187,100.84.170.161,TLSv1.3,797,Application Data
199,8.8460044,100.84.170.161,151.101.2.187,TCP,54,64433  >  443 [ACK] Seq=62710 Ack=19855 Win=131328 Len=0
200,8.9761306,100.84.170.161,151.101.2.187,TLSv1.3,854,Application Data
201,8.9852116,151.101.2.187,100.84.170.161,TCP,56,443  >  64433 [ACK] Seq=19855 Ack=63510 Win=145408 Len=0
202,8.9883695,151.101.2.187,100.84.170.161,TLSv1.3,314,Application Data
203,9.0129755,151.101.2.187,100.84.170.161,TCP,314,"[TCP Retransmission] 443  >  64433 [PSH, ACK] Seq=19855 Ack=63510 Win=145920 Len=260"
204,9.0131141,100.84.170.161,151.101.2.187,TCP,66,64433  >  443 [ACK] Seq=63510 Ack=20115 Win=131072 Len=0 SLE=19855 SRE=20115
205,9.3682171,100.84.170.161,151.101.2.187,TLSv1.3,1810,Application Data
206,9.3801623,151.101.2.187,100.84.170.161,TCP,56,443  >  64433 [ACK] Seq=20115 Ack=65266 Win=144384 Len=0
207,9.382602,151.101.2.187,100.84.170.161,TLSv1.3,104,Application Data
208,9.4057984,151.101.2.187,100.84.170.161,TCP,104,"[TCP Retransmission] 443  >  64433 [PSH, ACK] Seq=20115 Ack=65266 Win=145920 Len=50"
209,9.4058426,100.84.170.161,151.101.2.187,TCP,66,64433  >  443 [ACK] Seq=65266 Ack=20165 Win=131072 Len=0 SLE=20115 SRE=20165
210,9.5408894,100.84.170.161,151.101.2.187,TLSv1.3,825,Application Data
211,9.5506466,151.101.2.187,100.84.170.161,TCP,56,443  >  64433 [ACK] Seq=20165 Ack=66037 Win=145408 Len=0
212,9.5526422,151.101.2.187,100.84.170.161,TLSv1.3,173,Application Data
213,9.5529449,151.101.2.187,100.84.170.161,TLSv1.3,256,Application Data
214,9.5529824,100.84.170.161,151.101.2.187,TCP,54,64433  >  443 [ACK] Seq=66037 Ack=20486 Win=130560 Len=0
215,9.5705195,100.84.170.161,151.101.2.187,TLSv1.3,1842,Application Data
216,9.5804463,151.101.2.187,100.84.170.161,TCP,56,443  >  64433 [ACK] Seq=20486 Ack=67825 Win=144384 Len=0
217,9.583835,151.101.2.187,100.84.170.161,TLSv1.3,130,Application Data
218,9.6077079,151.101.2.187,100.84.170.161,TCP,130,"[TCP Retransmission] 443  >  64433 [PSH, ACK] Seq=20486 Ack=67825 Win=145920 Len=76"
219,9.6077517,100.84.170.161,151.101.2.187,TCP,66,64433  >  443 [ACK] Seq=67825 Ack=20562 Win=130560 Len=0 SLE=20486 SRE=20562
220,9.7071867,100.84.170.161,151.101.2.187,TLSv1.3,818,Application Data
221,9.7088408,100.84.170.161,151.101.2.187,TLSv1.3,1772,Application Data
222,9.7168835,151.101.2.187,100.84.170.161,TCP,56,443  >  64433 [ACK] Seq=20562 Ack=68589 Win=145408 Len=0
223,9.718995,151.101.2.187,100.84.170.161,TCP,56,443  >  64433 [ACK] Seq=20562 Ack=70307 Win=144384 Len=0
224,9.7198589,151.101.2.187,100.84.170.161,TLSv1.3,271,Application Data
225,9.7202344,151.101.2.187,100.84.170.161,TLSv1.3,379,Application Data
226,9.7202769,100.84.170.161,151.101.2.187,TCP,54,64433  >  443 [ACK] Seq=70307 Ack=21104 Win=130048 Len=0
227,9.7213269,151.101.2.187,100.84.170.161,TLSv1.3,442,Application Data
228,9.7547989,151.101.2.187,100.84.170.161,TCP,442,"[TCP Retransmission] 443  >  64433 [PSH, ACK] Seq=21104 Ack=70307 Win=145920 Len=388"
229,9.7548583,100.84.170.161,151.101.2.187,TCP,66,64433  >  443 [ACK] Seq=70307 Ack=21492 Win=131328 Len=0 SLE=21104 SRE=21492
230,9.9061595,100.84.170.161,151.101.2.187,TLSv1.3,839,Application Data
231,9.915661,151.101.2.187,100.84.170.161,TCP,56,443  >  64433 [ACK] Seq=21492 Ack=71092 Win=145408 Len=0
232,9.918455,151.101.2.187,100.84.170.161,TLSv1.3,162,Application Data
233,9.9187247,151.101.2.187,100.84.170.161,TLSv1.3,906,Application Data
234,9.9187896,100.84.170.161,151.101.2.187,TCP,54,64433  >  443 [ACK] Seq=71092 Ack=22452 Win=130304 Len=0
235,10.0261512,100.84.170.161,151.101.2.187,TLSv1.3,1783,Application Data
236,10.0294638,100.84.170.161,151.101.2.187,TLSv1.3,844,Application Data
237,10.0296609,100.84.170.161,151.101.2.187,TLSv1.3,1790,Application Data
238,10.0359148,151.101.2.187,100.84.170.161,TCP,56,443  >  64433 [ACK] Seq=22452 Ack=72821 Win=144384 Len=0
239,10.038542,151.101.2.187,100.84.170.161,TCP,56,443  >  64433 [ACK] Seq=22452 Ack=73611 Win=144384 Len=0
240,10.0391049,151.101.2.187,100.84.170.161,TCP,56,443  >  64433 [ACK] Seq=22452 Ack=75347 Win=144384 Len=0
241,10.0396279,151.101.2.187,100.84.170.161,TLSv1.3,783,Application Data
242,10.0415744,151.101.2.187,100.84.170.161,TLSv1.3,738,Application Data
243,10.041665,100.84.170.161,151.101.2.187,TCP,54,64433  >  443 [ACK] Seq=75347 Ack=23865 Win=131328 Len=0
244,10.0419704,151.101.2.187,100.84.170.161,TLSv1.3,139,Application Data
245,10.0426441,151.101.2.187,100.84.170.161,TLSv1.3,534,Application Data
246,10.0427159,100.84.170.161,151.101.2.187,TCP,54,64433  >  443 [ACK] Seq=75347 Ack=24430 Win=130816 Len=0
247,10.7228507,100.84.170.161,151.101.2.187,TLSv1.3,836,Application Data
248,10.7319957,151.101.2.187,100.84.170.161,TCP,56,443  >  64433 [ACK] Seq=24430 Ack=76129 Win=145408 Len=0
249,10.7349033,151.101.2.187,100.84.170.161,TLSv1.3,928,Application Data
250,10.7598277,151.101.2.187,100.84.170.161,TCP,928,"[TCP Retransmission] 443  >  64433 [PSH, ACK] Seq=24430 Ack=76129 Win=145920 Len=874"
251,10.7598796,100.84.170.161,151.101.2.187,TCP,66,64433  >  443 [ACK] Seq=76129 Ack=25304 Win=129792 Len=0 SLE=24430 SRE=25304
252,13.3912784,100.84.170.161,151.101.66.187,TCP,66,50935  >  443 [SYN] Seq=0 Win=64240 Len=0 MSS=1460 WS=256 SACK_PERM
253,13.4067484,151.101.66.187,100.84.170.161,TCP,66,"443  >  50935 [SYN, ACK] Seq=0 Ack=1 Win=65535 Len=0 MSS=1460 SACK_PERM WS=512"
254,13.4068638,100.84.170.161,151.101.66.187,TCP,54,50935  >  443 [ACK] Seq=1 Ack=1 Win=131328 Len=0
255,13.4077665,100.84.170.161,151.101.66.187,TLSv1.3,1843,Client Hello (SNI=r2d2.target.com)
256,13.41756,151.101.66.187,100.84.170.161,TCP,56,443  >  50935 [ACK] Seq=1 Ack=1790 Win=144384 Len=0
257,13.4192272,151.101.66.187,100.84.170.161,TLSv1.3,1510,"Server Hello, Change Cipher Spec, Application Data"
258,13.4196263,151.101.66.187,100.84.170.161,TCP,1510,443  >  50935 [ACK] Seq=1457 Ack=1790 Win=144384 Len=1456 [TCP PDU reassembled in 261]
259,13.4196798,100.84.170.161,151.101.66.187,TCP,54,50935  >  443 [ACK] Seq=1790 Ack=2913 Win=131328 Len=0
260,13.4201262,151.101.66.187,100.84.170.161,TCP,4422,"443  >  50935 [PSH, ACK] Seq=2913 Ack=1790 Win=144384 Len=4368 [TCP PDU reassembled in 261]"
261,13.4201262,151.101.66.187,100.84.170.161,TLSv1.3,675,"Application Data, Application Data, Application Data, Application Data"
262,13.4202445,100.84.170.161,151.101.66.187,TCP,54,50935  >  443 [ACK] Seq=1790 Ack=7902 Win=131328 Len=0
263,13.4242097,100.84.170.161,151.101.66.187,TLSv1.3,118,"Change Cipher Spec, Application Data"
264,13.4247869,100.84.170.161,151.101.66.187,TLSv1.3,146,Application Data
265,13.4250955,100.84.170.161,151.101.66.187,TLSv1.3,597,Application Data
266,13.4338518,151.101.66.187,100.84.170.161,TCP,56,443  >  50935 [ACK] Seq=7902 Ack=1854 Win=144384 Len=0
267,13.4340915,151.101.66.187,100.84.170.161,TLSv1.3,119,Application Data
268,13.4344166,100.84.170.161,151.101.66.187,TLSv1.3,85,Application Data
269,13.4346462,151.101.66.187,100.84.170.161,TCP,56,443  >  50935 [ACK] Seq=7967 Ack=2489 Win=143872 Len=0
270,13.4443671,151.101.66.187,100.84.170.161,TCP,56,443  >  50935 [ACK] Seq=7967 Ack=2520 Win=143872 Len=0
271,13.4858843,151.101.66.187,100.84.170.161,TLSv1.3,512,Application Data
272,13.4866248,151.101.66.187,100.84.170.161,TLSv1.3,761,Application Data
273,13.4867223,100.84.170.161,151.101.66.187,TCP,54,50935  >  443 [ACK] Seq=2520 Ack=9132 Win=130048 Len=0
274,22.6158614,100.84.170.161,151.101.2.187,TLSv1.3,1901,Application Data
275,22.615993,100.84.170.161,151.101.2.187,TLSv1.3,93,Application Data
276,22.6257113,151.101.2.187,100.84.170.161,TCP,56,443  >  64433 [ACK] Seq=25304 Ack=78015 Win=144384 Len=0
277,22.6259966,151.101.2.187,100.84.170.161,TLSv1.3,93,Application Data
278,22.6498495,151.101.2.187,100.84.170.161,TCP,93,"[TCP Retransmission] 443  >  64433 [PSH, ACK] Seq=25304 Ack=78015 Win=145920 Len=39"
279,22.6498937,100.84.170.161,151.101.2.187,TCP,66,64433  >  443 [ACK] Seq=78015 Ack=25343 Win=131328 Len=0 SLE=25304 SRE=25343
280,23.0792285,151.101.2.187,100.84.170.161,TLSv1.3,428,Application Data
281,23.0796141,151.101.2.187,100.84.170.161,TLSv1.3,1510,Application Data
282,23.0796799,100.84.170.161,151.101.2.187,TCP,54,64433  >  443 [ACK] Seq=78015 Ack=27173 Win=131328 Len=0
283,23.0800752,151.101.2.187,100.84.170.161,TLSv1.3,5878,"Application Data, Application Data, Application Data, Application Data"
284,23.0801606,100.84.170.161,151.101.2.187,TCP,54,64433  >  443 [ACK] Seq=78015 Ack=32997 Win=131328 Len=0
285,23.0806394,151.101.2.187,100.84.170.161,TLSv1.3,7334,"Application Data, Application Data, Application Data, Application Data, Application Data"
286,23.0807147,100.84.170.161,151.101.2.187,TCP,54,64433  >  443 [ACK] Seq=78015 Ack=40277 Win=131328 Len=0
287,23.0815389,151.101.2.187,100.84.170.161,TLSv1.3,7334,"Application Data, Application Data, Application Data, Application Data, Application Data"
288,23.0816237,100.84.170.161,151.101.2.187,TCP,54,64433  >  443 [ACK] Seq=78015 Ack=47557 Win=131328 Len=0
289,23.0823919,151.101.2.187,100.84.170.161,TLSv1.3,7334,"Application Data, Application Data, Application Data, Application Data, Application Data"
290,23.0824702,100.84.170.161,151.101.2.187,TCP,54,64433  >  443 [ACK] Seq=78015 Ack=54837 Win=131328 Len=0
291,23.0837102,151.101.2.187,100.84.170.161,TLSv1.3,7334,"Application Data, Application Data, Application Data, Application Data, Application Data, Application Data"
292,23.0837909,100.84.170.161,151.101.2.187,TCP,54,64433  >  443 [ACK] Seq=78015 Ack=62117 Win=131328 Len=0
293,23.0839812,100.84.170.161,151.101.2.187,TLSv1.3,89,Application Data
294,23.0841921,151.101.2.187,100.84.170.161,TLSv1.3,5878,"Application Data, Application Data, Application Data, Application Data"
295,23.0842443,100.84.170.161,151.101.2.187,TCP,54,64433  >  443 [ACK] Seq=78050 Ack=67941 Win=131328 Len=0
296,23.0897466,151.101.2.187,100.84.170.161,TLSv1.3,1510,Application Data
297,23.0900993,151.101.2.187,100.84.170.161,TLSv1.3,1510,Application Data
298,23.0901608,100.84.170.161,151.101.2.187,TCP,54,64433  >  443 [ACK] Seq=78050 Ack=70853 Win=131328 Len=0
299,23.090471,151.101.2.187,100.84.170.161,TLSv1.3,1510,"Application Data, Application Data"
300,23.090471,151.101.2.187,100.84.170.161,TLSv1.3,451,Application Data
301,23.090547,100.84.170.161,151.101.2.187,TCP,54,64433  >  443 [ACK] Seq=78050 Ack=72706 Win=131328 Len=0
302,23.0938269,151.101.2.187,100.84.170.161,TCP,56,443  >  64433 [ACK] Seq=72706 Ack=78050 Win=145920 Len=0
303,23.5406896,100.84.170.161,151.101.2.187,TLSv1.3,997,Application Data
304,23.5460898,100.84.170.161,151.101.2.187,TLSv1.3,1753,Application Data
305,23.5465251,100.84.170.161,151.101.2.187,TLSv1.3,1023,Application Data
306,23.550814,151.101.2.187,100.84.170.161,TCP,56,443  >  64433 [ACK] Seq=72706 Ack=78993 Win=145408 Len=0
307,23.5527744,151.101.2.187,100.84.170.161,TLSv1.3,130,Application Data
308,23.5560111,151.101.2.187,100.84.170.161,TCP,56,443  >  64433 [ACK] Seq=72782 Ack=81661 Win=144384 Len=0
309,23.558308,151.101.2.187,100.84.170.161,TLSv1.3,130,Application Data
310,23.5584625,100.84.170.161,151.101.2.187,TCP,54,64433  >  443 [ACK] Seq=81661 Ack=72858 Win=131072 Len=0
311,23.5587525,151.101.2.187,100.84.170.161,TLSv1.3,129,Application Data
312,23.5764783,100.84.170.161,151.101.2.187,TLSv1.3,1704,Application Data
313,23.5785925,100.84.170.161,151.101.2.187,TLSv1.3,997,Application Data
314,23.5788698,100.84.170.161,151.101.2.187,TLSv1.3,1776,Application Data
315,23.5858237,151.101.2.187,100.84.170.161,TCP,56,443  >  64433 [ACK] Seq=72933 Ack=83311 Win=144384 Len=0
316,23.5893694,151.101.2.187,100.84.170.161,TLSv1.3,174,Application Data
317,23.5897768,151.101.2.187,100.84.170.161,TLSv1.3,255,Application Data
318,23.5899295,100.84.170.161,151.101.2.187,TCP,54,64433  >  443 [ACK] Seq=85976 Ack=73254 Win=130816 Len=0
319,23.5901972,151.101.2.187,100.84.170.161,TCP,56,443  >  64433 [ACK] Seq=73254 Ack=85976 Win=144384 Len=0
320,23.5930305,151.101.2.187,100.84.170.161,TLSv1.3,131,Application Data
321,23.5933156,151.101.2.187,100.84.170.161,TLSv1.3,130,Application Data
322,23.5933531,100.84.170.161,151.101.2.187,TCP,54,64433  >  443 [ACK] Seq=85976 Ack=73407 Win=130560 Len=0
323,23.729807,100.84.170.161,151.101.2.187,TLSv1.3,1001,Application Data
324,23.7400518,151.101.2.187,100.84.170.161,TCP,56,443  >  64433 [ACK] Seq=73407 Ack=86923 Win=145408 Len=0
325,23.7422233,151.101.2.187,100.84.170.161,TLSv1.3,446,Application Data
326,23.7697364,151.101.2.187,100.84.170.161,TCP,446,"[TCP Retransmission] 443  >  64433 [PSH, ACK] Seq=73407 Ack=86923 Win=145920 Len=392"
327,23.7697826,100.84.170.161,151.101.2.187,TCP,66,64433  >  443 [ACK] Seq=86923 Ack=73799 Win=130304 Len=0 SLE=73407 SRE=73799
328,25.162799,100.84.170.161,151.101.66.187,TLSv1.3,248,Application Data
329,25.1629247,100.84.170.161,151.101.66.187,TLSv1.3,93,Application Data
330,25.1719029,151.101.66.187,100.84.170.161,TCP,56,443  >  50935 [ACK] Seq=9132 Ack=2714 Win=143872 Len=0
331,25.1726419,151.101.66.187,100.84.170.161,TCP,56,443  >  50935 [ACK] Seq=9132 Ack=2753 Win=143872 Len=0
332,25.1730282,151.101.66.187,100.84.170.161,TLSv1.3,93,Application Data
333,25.1751512,100.84.170.161,151.101.2.187,TLSv1.3,1836,Application Data
334,25.1843635,151.101.2.187,100.84.170.161,TCP,56,443  >  64433 [ACK] Seq=73799 Ack=88705 Win=144384 Len=0
335,25.1997111,151.101.66.187,100.84.170.161,TCP,93,"[TCP Retransmission] 443  >  50935 [PSH, ACK] Seq=9132 Ack=2753 Win=143872 Len=39"
336,25.1997588,100.84.170.161,151.101.66.187,TCP,66,50935  >  443 [ACK] Seq=2753 Ack=9171 Win=130048 Len=0 SLE=9132 SRE=9171
337,25.2277208,151.101.66.187,100.84.170.161,TLSv1.3,271,Application Data
338,25.2280391,151.101.66.187,100.84.170.161,TLSv1.3,744,Application Data
339,25.228137,100.84.170.161,151.101.66.187,TCP,54,50935  >  443 [ACK] Seq=2753 Ack=10078 Win=131328 Len=0
340,25.2290803,100.84.170.161,151.101.66.187,TLSv1.3,89,Application Data
341,25.2328162,151.101.2.187,100.84.170.161,TLSv1.3,450,Application Data
342,25.2332296,151.101.2.187,100.84.170.161,TLSv1.3,353,Application Data
343,25.2333285,100.84.170.161,151.101.2.187,TCP,54,64433  >  443 [ACK] Seq=88705 Ack=74494 Win=131328 Len=0
344,25.238494,151.101.66.187,100.84.170.161,TCP,56,443  >  50935 [ACK] Seq=10078 Ack=2788 Win=143872 Len=0
345,25.6050943,100.84.170.161,151.101.2.187,TLSv1.3,983,Application Data
346,25.6111972,100.84.170.161,151.101.2.187,TLSv1.3,1753,Application Data
347,25.6145379,151.101.2.187,100.84.170.161,TCP,56,443  >  64433 [ACK] Seq=74494 Ack=89634 Win=145408 Len=0
348,25.6182094,151.101.2.187,100.84.170.161,TLSv1.3,217,Application Data
349,25.6202751,151.101.2.187,100.84.170.161,TCP,56,443  >  64433 [ACK] Seq=74657 Ack=91333 Win=144384 Len=0
350,25.6235092,151.101.2.187,100.84.170.161,TLSv1.3,124,Application Data
351,25.623601,100.84.170.161,151.101.2.187,TCP,54,64433  >  443 [ACK] Seq=91333 Ack=74727 Win=131072 Len=0
352,27.6403814,100.84.170.161,151.101.2.187,TLSv1.3,679,Application Data
353,27.651142,151.101.2.187,100.84.170.161,TCP,56,443  >  64433 [ACK] Seq=74727 Ack=91958 Win=145408 Len=0
354,27.7013069,151.101.2.187,100.84.170.161,TLSv1.3,501,Application Data
355,27.7288852,151.101.2.187,100.84.170.161,TCP,501,"[TCP Retransmission] 443  >  64433 [PSH, ACK] Seq=74727 Ack=91958 Win=145920 Len=447"
356,27.7289327,100.84.170.161,151.101.2.187,TCP,66,64433  >  443 [ACK] Seq=91958 Ack=75174 Win=130560 Len=0 SLE=74727 SRE=75174
357,27.8822208,100.84.170.161,151.101.2.187,TLSv1.3,1992,Application Data
358,27.8828445,100.84.170.161,151.101.2.187,TLSv1.3,721,Application Data
359,27.885061,100.84.170.161,151.101.2.187,TLSv1.3,2016,Application Data
360,27.8857702,100.84.170.161,151.101.2.187,TLSv1.3,711,Application Data
361,27.885957,100.84.170.161,151.101.2.187,TLSv1.3,2029,Application Data
362,27.8884284,100.84.170.161,151.101.2.187,TLSv1.3,705,Application Data
363,27.8889446,100.84.170.161,151.101.2.187,TLSv1.3,2019,Application Data
364,27.8918786,151.101.2.187,100.84.170.161,TCP,56,443  >  64433 [ACK] Seq=75174 Ack=93896 Win=144384 Len=0
365,27.8927013,151.101.2.187,100.84.170.161,TCP,56,443  >  64433 [ACK] Seq=75174 Ack=94563 Win=144384 Len=0
366,27.8943429,151.101.2.187,100.84.170.161,TLSv1.3,261,Application Data
367,27.8948078,151.101.2.187,100.84.170.161,TLSv1.3,265,Application Data
368,27.8948593,100.84.170.161,151.101.2.187,TCP,54,64433  >  443 [ACK] Seq=101773 Ack=75592 Win=130048 Len=0
369,27.8955813,151.101.2.187,100.84.170.161,TCP,56,443  >  64433 [ACK] Seq=75592 Ack=97182 Win=144384 Len=0
370,27.8959301,151.101.2.187,100.84.170.161,TCP,56,443  >  64433 [ACK] Seq=75592 Ack=99157 Win=142848 Len=0
371,27.8980027,151.101.2.187,100.84.170.161,TCP,56,443  >  64433 [ACK] Seq=75592 Ack=99808 Win=144384 Len=0
372,27.8982877,151.101.2.187,100.84.170.161,TLSv1.3,190,Application Data
373,27.8987466,151.101.2.187,100.84.170.161,TLSv1.3,130,Application Data
374,27.8987958,100.84.170.161,151.101.2.187,TCP,54,64433  >  443 [ACK] Seq=101773 Ack=75804 Win=130048 Len=0
375,27.9001505,151.101.2.187,100.84.170.161,TLSv1.3,130,Application Data
376,27.9012176,151.101.2.187,100.84.170.161,TLSv1.3,131,Application Data
377,27.9012721,100.84.170.161,151.101.2.187,TCP,54,64433  >  443 [ACK] Seq=101773 Ack=75957 Win=131328 Len=0
378,27.9025239,100.84.170.161,151.101.2.187,TLSv1.3,709,Application Data
379,27.9116787,151.101.2.187,100.84.170.161,TCP,56,443  >  64433 [ACK] Seq=75957 Ack=102428 Win=145408 Len=0
380,27.9141904,151.101.2.187,100.84.170.161,TLSv1.3,131,Application Data
381,27.9325315,100.84.170.161,151.101.2.187,TLSv1.3,2026,Application Data
382,27.9408273,151.101.2.187,100.84.170.161,TCP,131,"[TCP Spurious Retransmission] 443  >  64433 [PSH, ACK] Seq=75957 Ack=102428 Win=145920 Len=77"
383,27.9408695,100.84.170.161,151.101.2.187,TCP,66,[TCP Dup ACK 381#1] 64433  >  443 [ACK] Seq=104400 Ack=76034 Win=131072 Len=0 SLE=75957 SRE=76034
384,27.9418245,151.101.2.187,100.84.170.161,TCP,56,443  >  64433 [ACK] Seq=76034 Ack=104400 Win=144384 Len=0
385,27.9444305,151.101.2.187,100.84.170.161,TLSv1.3,98,Application Data
386,27.9717865,151.101.2.187,100.84.170.161,TCP,98,"[TCP Retransmission] 443  >  64433 [PSH, ACK] Seq=76034 Ack=104400 Win=145920 Len=44"
387,27.9718294,100.84.170.161,151.101.2.187,TCP,66,64433  >  443 [ACK] Seq=104400 Ack=76078 Win=131072 Len=0 SLE=76034 SRE=76078
388,29.6259033,100.84.170.161,151.101.66.187,TLSv1.3,254,Application Data
389,29.6375114,151.101.66.187,100.84.170.161,TCP,56,443  >  50935 [ACK] Seq=10078 Ack=2988 Win=143872 Len=0
390,29.6876998,151.101.66.187,100.84.170.161,TLSv1.3,927,Application Data
391,29.7153693,151.101.66.187,100.84.170.161,TCP,927,"[TCP Retransmission] 443  >  50935 [PSH, ACK] Seq=10078 Ack=2988 Win=143872 Len=873"
392,29.715435,100.84.170.161,151.101.66.187,TCP,66,50935  >  443 [ACK] Seq=2988 Ack=10951 Win=130304 Len=0 SLE=10078 SRE=10951
393,31.8252978,100.84.170.161,151.101.66.187,TLSv1.3,250,Application Data
394,31.8351006,151.101.66.187,100.84.170.161,TCP,56,443  >  50935 [ACK] Seq=10951 Ack=3184 Win=143872 Len=0
395,31.8813324,151.101.66.187,100.84.170.161,TLSv1.3,244,Application Data
396,31.8816676,151.101.66.187,100.84.170.161,TLSv1.3,758,Application Data
397,31.8817171,100.84.170.161,151.101.66.187,TCP,54,50935  >  443 [ACK] Seq=3184 Ack=11845 Win=131328 Len=0
398,31.8829916,100.84.170.161,151.101.66.187,TLSv1.3,89,Application Data
399,31.8921832,151.101.66.187,100.84.170.161,TCP,56,443  >  50935 [ACK] Seq=11845 Ack=3219 Win=143872 Len=0
400,32.9015036,100.84.170.161,151.101.2.187,TLSv1.3,765,Application Data
401,32.9125552,151.101.2.187,100.84.170.161,TCP,56,443  >  64433 [ACK] Seq=76078 Ack=105111 Win=145408 Len=0
402,32.9658487,151.101.2.187,100.84.170.161,TLSv1.3,339,Application Data
403,32.9661619,151.101.2.187,100.84.170.161,TLSv1.3,357,Application Data
404,32.9662135,100.84.170.161,151.101.2.187,TCP,54,64433  >  443 [ACK] Seq=105111 Ack=76666 Win=130560 Len=0
405,32.9676167,100.84.170.161,151.101.2.187,TLSv1.3,89,Application Data
406,32.9769936,151.101.2.187,100.84.170.161,TCP,56,443  >  64433 [ACK] Seq=76666 Ack=105146 Win=145920 Len=0
407,34.9164422,100.84.170.161,151.101.66.187,TLSv1.3,247,Application Data
408,34.9276753,151.101.66.187,100.84.170.161,TCP,56,443  >  50935 [ACK] Seq=11845 Ack=3412 Win=143872 Len=0
409,34.9784882,151.101.66.187,100.84.170.161,TLSv1.3,480,Application Data
410,34.9787235,151.101.66.187,100.84.170.161,TLSv1.3,758,Application Data
411,34.9787778,100.84.170.161,151.101.66.187,TCP,54,50935  >  443 [ACK] Seq=3412 Ack=12975 Win=130048 Len=0
412,38.3871329,100.84.170.161,151.101.2.187,TLSv1.3,2082,Application Data
413,38.3892337,100.84.170.161,151.101.2.187,TLSv1.3,434,Application Data
414,38.3982463,151.101.2.187,100.84.170.161,TCP,56,443  >  64433 [ACK] Seq=76666 Ack=107554 Win=144384 Len=0
415,38.4179612,151.101.2.187,100.84.170.161,TLSv1.3,495,Application Data
416,38.4437586,151.101.2.187,100.84.170.161,TCP,495,"[TCP Retransmission] 443  >  64433 [PSH, ACK] Seq=76666 Ack=107554 Win=145920 Len=441"
417,38.4437971,100.84.170.161,151.101.2.187,TCP,66,64433  >  443 [ACK] Seq=107554 Ack=77107 Win=130048 Len=0 SLE=76666 SRE=77107
418,39.1856305,100.84.170.161,151.101.2.187,TLSv1.3,2092,Application Data
419,39.1966619,151.101.2.187,100.84.170.161,TCP,56,443  >  64433 [ACK] Seq=77107 Ack=109592 Win=144384 Len=0
420,39.2003631,151.101.2.187,100.84.170.161,TLSv1.3,240,Application Data
421,39.2266497,151.101.2.187,100.84.170.161,TCP,240,"[TCP Retransmission] 443  >  64433 [PSH, ACK] Seq=77107 Ack=109592 Win=145920 Len=186"
422,39.2266913,100.84.170.161,151.101.2.187,TCP,66,64433  >  443 [ACK] Seq=109592 Ack=77293 Win=130048 Len=0 SLE=77107 SRE=77293
423,39.2947924,100.84.170.161,151.101.2.187,TLSv1.3,464,Application Data
424,39.3039407,151.101.2.187,100.84.170.161,TCP,56,443  >  64433 [ACK] Seq=77293 Ack=110002 Win=145920 Len=0
425,39.3061822,151.101.2.187,100.84.170.161,TLSv1.3,136,Application Data
426,39.3314932,151.101.2.187,100.84.170.161,TCP,136,"[TCP Retransmission] 443  >  64433 [PSH, ACK] Seq=77293 Ack=110002 Win=145920 Len=82"
427,39.3315574,100.84.170.161,151.101.2.187,TCP,66,64433  >  443 [ACK] Seq=110002 Ack=77375 Win=129792 Len=0 SLE=77293 SRE=77375
428,39.7373818,100.84.170.161,151.101.2.187,TLSv1.3,2081,Application Data
429,39.7489176,151.101.2.187,100.84.170.161,TCP,56,443  >  64433 [ACK] Seq=77375 Ack=112029 Win=144384 Len=0
430,39.7515333,151.101.2.187,100.84.170.161,TLSv1.3,234,Application Data
431,39.7767129,151.101.2.187,100.84.170.161,TCP,234,"[TCP Retransmission] 443  >  64433 [PSH, ACK] Seq=77375 Ack=112029 Win=145920 Len=180"
432,39.776816,100.84.170.161,151.101.2.187,TCP,66,64433  >  443 [ACK] Seq=112029 Ack=77555 Win=131328 Len=0 SLE=77375 SRE=77555
433,40.0549796,100.84.170.161,151.101.2.187,TLSv1.3,464,Application Data
434,40.0641648,151.101.2.187,100.84.170.161,TCP,56,443  >  64433 [ACK] Seq=77555 Ack=112439 Win=145920 Len=0
435,40.0675061,151.101.2.187,100.84.170.161,TLSv1.3,98,Application Data
436,40.0926835,151.101.2.187,100.84.170.161,TCP,98,"[TCP Retransmission] 443  >  64433 [PSH, ACK] Seq=77555 Ack=112439 Win=145920 Len=44"
437,40.0927344,100.84.170.161,151.101.2.187,TCP,66,64433  >  443 [ACK] Seq=112439 Ack=77599 Win=131328 Len=0 SLE=77555 SRE=77599
438,40.398771,151.101.2.187,100.84.170.161,TCP,98,"[TCP Spurious Retransmission] 443  >  64433 [PSH, ACK] Seq=77555 Ack=112439 Win=145920 Len=44"
439,40.3988265,100.84.170.161,151.101.2.187,TCP,66,[TCP Dup ACK 437#1] 64433  >  443 [ACK] Seq=112439 Ack=77599 Win=131328 Len=0 SLE=77555 SRE=77599
440,40.508163,100.84.170.161,151.101.2.187,TLSv1.3,2033,Application Data
441,40.5191424,151.101.2.187,100.84.170.161,TCP,56,443  >  64433 [ACK] Seq=77599 Ack=114418 Win=144384 Len=0
442,40.5215286,151.101.2.187,100.84.170.161,TLSv1.3,174,Application Data
443,40.5217607,151.101.2.187,100.84.170.161,TLSv1.3,439,Application Data
444,40.5218031,100.84.170.161,151.101.2.187,TCP,54,64433  >  443 [ACK] Seq=114418 Ack=78104 Win=130816 Len=0
445,40.5234066,100.84.170.161,151.101.2.187,TLSv1.3,89,Application Data
446,40.5329842,151.101.2.187,100.84.170.161,TCP,56,443  >  64433 [ACK] Seq=78104 Ack=114453 Win=145920 Len=0
447,44.3930334,100.84.170.161,151.101.2.187,TLSv1.3,543,Application Data
448,44.4027022,151.101.2.187,100.84.170.161,TCP,56,443  >  64433 [ACK] Seq=78104 Ack=114942 Win=145920 Len=0
449,44.4051447,151.101.2.187,100.84.170.161,TLSv1.3,214,Application Data
450,44.4315714,151.101.2.187,100.84.170.161,TCP,214,"[TCP Retransmission] 443  >  64433 [PSH, ACK] Seq=78104 Ack=114942 Win=145920 Len=160"
451,44.4316376,100.84.170.161,151.101.2.187,TCP,66,64433  >  443 [ACK] Seq=114942 Ack=78264 Win=130560 Len=0 SLE=78104 SRE=78264
452,44.9781649,100.84.170.161,151.101.2.187,TLSv1.3,2010,Application Data
453,44.9806536,100.84.170.161,151.101.2.187,TLSv1.3,540,Application Data
454,44.9829535,100.84.170.161,151.101.2.187,TLSv1.3,2015,Application Data
455,44.9890238,151.101.2.187,100.84.170.161,TCP,56,443  >  64433 [ACK] Seq=78264 Ack=116898 Win=144384 Len=0
456,44.989467,100.84.170.161,151.101.2.187,TLSv1.3,553,Application Data
457,44.990344,151.101.2.187,100.84.170.161,TCP,56,443  >  64433 [ACK] Seq=78264 Ack=117384 Win=144384 Len=0
458,44.9921796,151.101.2.187,100.84.170.161,TCP,56,443  >  64433 [ACK] Seq=78264 Ack=119345 Win=144384 Len=0
459,44.9928001,100.84.170.161,151.101.2.187,TLSv1.3,1965,Application Data
460,44.9939032,151.101.2.187,100.84.170.161,TLSv1.3,262,Application Data
461,44.9946997,151.101.2.187,100.84.170.161,TLSv1.3,130,Application Data
462,44.9947646,100.84.170.161,151.101.2.187,TCP,54,64433  >  443 [ACK] Seq=121755 Ack=78548 Win=130304 Len=0
463,44.9988638,151.101.2.187,100.84.170.161,TCP,56,443  >  64433 [ACK] Seq=78548 Ack=119844 Win=145920 Len=0
464,45.0022257,151.101.2.187,100.84.170.161,TLSv1.3,98,Application Data
465,45.0047112,151.101.2.187,100.84.170.161,TLSv1.3,199,Application Data
466,45.0047684,100.84.170.161,151.101.2.187,TCP,54,64433  >  443 [ACK] Seq=121755 Ack=78737 Win=130048 Len=0
467,45.0051038,151.101.2.187,100.84.170.161,TLSv1.3,309,Application Data
468,45.0420266,151.101.2.187,100.84.170.161,TCP,309,"[TCP Retransmission] 443  >  64433 [PSH, ACK] Seq=78737 Ack=121755 Win=145920 Len=255"
469,45.0420635,100.84.170.161,151.101.2.187,TCP,66,64433  >  443 [ACK] Seq=121755 Ack=78992 Win=129792 Len=0 SLE=78737 SRE=78992
470,45.1395344,100.84.170.161,151.101.2.187,TLSv1.3,556,Application Data
471,45.1510561,151.101.2.187,100.84.170.161,TCP,56,443  >  64433 [ACK] Seq=78992 Ack=122257 Win=145920 Len=0
472,45.1520828,151.101.2.187,100.84.170.161,TLSv1.3,291,Application Data
473,45.1782265,151.101.2.187,100.84.170.161,TCP,291,"[TCP Retransmission] 443  >  64433 [PSH, ACK] Seq=78992 Ack=122257 Win=145920 Len=237"
474,45.1782807,100.84.170.161,151.101.2.187,TCP,66,64433  >  443 [ACK] Seq=122257 Ack=79229 Win=131328 Len=0 SLE=78992 SRE=79229
475,45.2778211,100.84.170.161,151.101.2.187,TLSv1.3,2029,Application Data
476,45.2793083,100.84.170.161,151.101.2.187,TLSv1.3,501,Application Data
477,45.2795531,100.84.170.161,151.101.2.187,TLSv1.3,2036,Application Data
478,45.2796817,100.84.170.161,151.101.2.187,TLSv1.3,504,Application Data
479,45.288194,151.101.2.187,100.84.170.161,TCP,56,443  >  64433 [ACK] Seq=79229 Ack=124232 Win=144384 Len=0
480,45.2888426,151.101.2.187,100.84.170.161,TCP,56,443  >  64433 [ACK] Seq=79229 Ack=124679 Win=144384 Len=0
481,45.2896449,151.101.2.187,100.84.170.161,TCP,56,443  >  64433 [ACK] Seq=79229 Ack=127111 Win=144384 Len=0
482,45.2908134,151.101.2.187,100.84.170.161,TLSv1.3,124,Application Data
483,45.2912745,151.101.2.187,100.84.170.161,TLSv1.3,130,Application Data
484,45.291315,100.84.170.161,151.101.2.187,TCP,54,64433  >  443 [ACK] Seq=127111 Ack=79375 Win=131072 Len=0
485,45.2926475,151.101.2.187,100.84.170.161,TLSv1.3,135,Application Data
486,45.2937443,151.101.2.187,100.84.170.161,TLSv1.3,124,Application Data
487,45.2938173,100.84.170.161,151.101.2.187,TCP,54,64433  >  443 [ACK] Seq=127111 Ack=79526 Win=131072 Len=0
488,45.5495807,100.84.170.161,151.101.2.187,TLSv1.3,2112,Application Data
489,45.5732394,100.84.170.161,151.101.2.187,TCP,1514,"[TCP Retransmission] 64433  >  443 [PSH, ACK] Seq=127709 Ack=79526 Win=131072 Len=1460"
490,45.6020959,151.101.2.187,100.84.170.161,TCP,56,443  >  64433 [ACK] Seq=79526 Ack=129169 Win=144384 Len=0
491,45.6023286,151.101.2.187,100.84.170.161,TLSv1.3,131,Application Data
492,45.6057458,151.101.2.187,100.84.170.161,TCP,66,[TCP Dup ACK 490#1] 443  >  64433 [ACK] Seq=79603 Ack=129169 Win=145920 Len=0 SLE=127709 SRE=129169
493,45.6136199,151.101.2.187,100.84.170.161,TCP,131,"[TCP Retransmission] 443  >  64433 [PSH, ACK] Seq=79526 Ack=129169 Win=145920 Len=77"
494,45.6136625,100.84.170.161,151.101.2.187,TCP,66,64433  >  443 [ACK] Seq=129169 Ack=79603 Win=130816 Len=0 SLE=79526 SRE=79603
495,45.7151095,100.84.170.161,151.101.2.187,TLSv1.3,542,Application Data
496,45.7244869,151.101.2.187,100.84.170.161,TCP,56,443  >  64433 [ACK] Seq=79603 Ack=129657 Win=145920 Len=0
497,45.7285788,151.101.2.187,100.84.170.161,TLSv1.3,240,Application Data
498,45.7555828,151.101.2.187,100.84.170.161,TCP,240,"[TCP Retransmission] 443  >  64433 [PSH, ACK] Seq=79603 Ack=129657 Win=145920 Len=186"
499,45.7556295,100.84.170.161,151.101.2.187,TCP,66,64433  >  443 [ACK] Seq=129657 Ack=79789 Win=130816 Len=0 SLE=79603 SRE=79789
500,46.1949083,100.84.170.161,151.101.2.187,TLSv1.3,2090,Application Data
501,46.2042138,151.101.2.187,100.84.170.161,TCP,56,443  >  64433 [ACK] Seq=79789 Ack=131693 Win=144384 Len=0
502,46.207414,151.101.2.187,100.84.170.161,TLSv1.3,131,Application Data
503,46.2329161,151.101.2.187,100.84.170.161,TCP,131,"[TCP Retransmission] 443  >  64433 [PSH, ACK] Seq=79789 Ack=131693 Win=145920 Len=77"
504,46.2329623,100.84.170.161,151.101.2.187,TCP,66,64433  >  443 [ACK] Seq=131693 Ack=79866 Win=130560 Len=0 SLE=79789 SRE=79866
505,49.6327021,100.84.170.161,151.101.2.187,TLSv1.3,821,Application Data
506,49.6421308,151.101.2.187,100.84.170.161,TCP,56,443  >  64433 [ACK] Seq=79866 Ack=132460 Win=145408 Len=0
507,49.6450768,151.101.2.187,100.84.170.161,TLSv1.3,241,Application Data
508,49.6717982,151.101.2.187,100.84.170.161,TCP,241,"[TCP Retransmission] 443  >  64433 [PSH, ACK] Seq=79866 Ack=132460 Win=145920 Len=187"
509,49.6718425,100.84.170.161,151.101.2.187,TCP,66,64433  >  443 [ACK] Seq=132460 Ack=80053 Win=130560 Len=0 SLE=79866 SRE=80053
510,49.7270106,100.84.170.161,151.101.2.187,TLSv1.3,1857,Application Data
511,49.7361494,151.101.2.187,100.84.170.161,TCP,56,443  >  64433 [ACK] Seq=80053 Ack=134263 Win=144384 Len=0
512,49.7388017,151.101.2.187,100.84.170.161,TLSv1.3,240,Application Data
513,49.7646016,151.101.2.187,100.84.170.161,TCP,240,"[TCP Retransmission] 443  >  64433 [PSH, ACK] Seq=80053 Ack=134263 Win=145920 Len=186"
514,49.7646412,100.84.170.161,151.101.2.187,TCP,66,64433  >  443 [ACK] Seq=134263 Ack=80239 Win=130304 Len=0 SLE=80053 SRE=80239
515,49.7931334,100.84.170.161,151.101.2.187,TLSv1.3,789,Application Data
516,49.8009382,100.84.170.161,151.101.2.187,TLSv1.3,1857,Application Data
517,49.8025804,151.101.2.187,100.84.170.161,TCP,56,443  >  64433 [ACK] Seq=80239 Ack=134998 Win=145408 Len=0
518,49.8048935,151.101.2.187,100.84.170.161,TLSv1.3,124,Application Data
519,49.8101688,151.101.2.187,100.84.170.161,TCP,56,443  >  64433 [ACK] Seq=80309 Ack=136801 Win=144384 Len=0
520,49.8126288,151.101.2.187,100.84.170.161,TLSv1.3,148,Application Data
521,49.8126944,100.84.170.161,151.101.2.187,TCP,54,64433  >  443 [ACK] Seq=136801 Ack=80403 Win=130048 Len=0
522,49.8148282,100.84.170.161,151.101.2.187,TLSv1.3,815,Application Data
523,49.8241071,151.101.2.187,100.84.170.161,TCP,56,443  >  64433 [ACK] Seq=80403 Ack=137562 Win=145408 Len=0
524,49.8266076,151.101.2.187,100.84.170.161,TLSv1.3,292,Application Data
525,49.8547796,151.101.2.187,100.84.170.161,TCP,292,"[TCP Retransmission] 443  >  64433 [PSH, ACK] Seq=80403 Ack=137562 Win=145920 Len=238"
526,49.8548284,100.84.170.161,151.101.2.187,TCP,66,64433  >  443 [ACK] Seq=137562 Ack=80641 Win=129792 Len=0 SLE=80403 SRE=80641
527,49.8895384,100.84.170.161,151.101.2.187,TLSv1.3,1848,Application Data
528,49.8923033,100.84.170.161,151.101.2.187,TLSv1.3,821,Application Data
529,49.8988083,151.101.2.187,100.84.170.161,TCP,56,443  >  64433 [ACK] Seq=80641 Ack=139356 Win=144384 Len=0
530,49.9010821,151.101.2.187,100.84.170.161,TLSv1.3,125,Application Data
531,49.9011475,100.84.170.161,151.101.2.187,TCP,54,64433  >  443 [ACK] Seq=140123 Ack=80712 Win=131328 Len=0
532,49.9020358,151.101.2.187,100.84.170.161,TCP,56,443  >  64433 [ACK] Seq=80712 Ack=140123 Win=145408 Len=0
533,49.9045241,151.101.2.187,100.84.170.161,TLSv1.3,98,Application Data
534,49.9046079,100.84.170.161,151.101.2.187,TCP,54,64433  >  443 [ACK] Seq=140123 Ack=80756 Win=131328 Len=0
535,50.0342428,100.84.170.161,151.101.2.187,TLSv1.3,1854,Application Data
536,50.0440152,151.101.2.187,100.84.170.161,TCP,56,443  >  64433 [ACK] Seq=80756 Ack=141923 Win=144384 Len=0
537,50.0464761,151.101.2.187,100.84.170.161,TLSv1.3,131,Application Data
538,50.0469216,100.84.170.161,151.101.2.187,TLSv1.3,819,Application Data
539,50.0486629,100.84.170.161,151.101.2.187,TLSv1.3,1819,Application Data
540,50.0487939,100.84.170.161,151.101.2.187,TLSv1.3,825,Application Data
541,50.080907,151.101.2.187,100.84.170.161,TCP,56,443  >  64433 [ACK] Seq=80833 Ack=142688 Win=145408 Len=0
542,50.0810942,151.101.2.187,100.84.170.161,TLSv1.3,130,Application Data
543,50.0817745,151.101.2.187,100.84.170.161,TLSv1.3,194,"Application Data, Application Data"
544,50.0818349,100.84.170.161,151.101.2.187,TCP,54,64433  >  443 [ACK] Seq=145224 Ack=81049 Win=130816 Len=0
545,50.087482,151.101.2.187,100.84.170.161,TCP,124,"[TCP Spurious Retransmission] 443  >  64433 [PSH, ACK] Seq=80979 Ack=145224 Win=145920 Len=70"
546,50.0875937,100.84.170.161,151.101.2.187,TCP,66,[TCP Dup ACK 544#1] 64433  >  443 [ACK] Seq=145224 Ack=81049 Win=130816 Len=0 SLE=80979 SRE=81049
547,50.1173371,100.84.170.161,151.101.2.187,TLSv1.3,1861,Application Data
548,50.1264565,151.101.2.187,100.84.170.161,TCP,56,443  >  64433 [ACK] Seq=81049 Ack=147031 Win=144384 Len=0
549,50.1291428,151.101.2.187,100.84.170.161,TLSv1.3,130,Application Data
550,50.1558917,151.101.2.187,100.84.170.161,TCP,130,"[TCP Retransmission] 443  >  64433 [PSH, ACK] Seq=81049 Ack=147031 Win=145920 Len=76"
551,50.1559338,100.84.170.161,151.101.2.187,TCP,66,64433  >  443 [ACK] Seq=147031 Ack=81125 Win=130816 Len=0 SLE=81049 SRE=81125
552,50.2601079,100.84.170.161,151.101.2.187,TLSv1.3,797,Application Data
553,50.2621962,100.84.170.161,151.101.2.187,TLSv1.3,1872,Application Data
554,50.2694326,151.101.2.187,100.84.170.161,TCP,56,443  >  64433 [ACK] Seq=81125 Ack=147774 Win=145408 Len=0
555,50.2714783,151.101.2.187,100.84.170.161,TCP,56,443  >  64433 [ACK] Seq=81125 Ack=149592 Win=151552 Len=0
556,50.2725911,151.101.2.187,100.84.170.161,TLSv1.3,98,Application Data
557,50.2754887,151.101.2.187,100.84.170.161,TLSv1.3,98,Application Data
558,50.2755429,100.84.170.161,151.101.2.187,TCP,54,64433  >  443 [ACK] Seq=149592 Ack=81213 Win=130816 Len=0
559,50.3463343,100.84.170.161,151.101.2.187,TLSv1.3,927,Application Data
560,50.3555842,151.101.2.187,100.84.170.161,TCP,56,443  >  64433 [ACK] Seq=81213 Ack=150465 Win=154624 Len=0
561,50.4135782,151.101.2.187,100.84.170.161,TLSv1.3,478,Application Data
562,50.4140144,151.101.2.187,100.84.170.161,TCP,1510,443  >  64433 [ACK] Seq=81637 Ack=150465 Win=154624 Len=1456 [TCP PDU reassembled in 565]
563,50.4141706,100.84.170.161,151.101.2.187,TCP,54,64433  >  443 [ACK] Seq=150465 Ack=83093 Win=131328 Len=0
564,50.4146023,151.101.2.187,100.84.170.161,TCP,1510,443  >  64433 [ACK] Seq=83093 Ack=150465 Win=154624 Len=1456 [TCP PDU reassembled in 565]
565,50.4146023,151.101.2.187,100.84.170.161,TLSv1.3,204,Application Data
566,50.4147147,100.84.170.161,151.101.2.187,TCP,54,64433  >  443 [ACK] Seq=150465 Ack=84699 Win=131328 Len=0
567,50.4158037,100.84.170.161,151.101.2.187,TLSv1.3,89,Application Data
568,50.4251219,151.101.2.187,100.84.170.161,TCP,56,443  >  64433 [ACK] Seq=84699 Ack=150500 Win=154624 Len=0
569,50.5270771,100.84.170.161,151.101.2.187,TLSv1.3,1928,Application Data
570,50.5363561,151.101.2.187,100.84.170.161,TCP,56,443  >  64433 [ACK] Seq=84699 Ack=152374 Win=160256 Len=0
571,50.5391028,151.101.2.187,100.84.170.161,TLSv1.3,252,Application Data
572,50.5647378,151.101.2.187,100.84.170.161,TCP,252,"[TCP Retransmission] 443  >  64433 [PSH, ACK] Seq=84699 Ack=152374 Win=160256 Len=198"
573,50.5647887,100.84.170.161,151.101.2.187,TCP,66,64433  >  443 [ACK] Seq=152374 Ack=84897 Win=131072 Len=0 SLE=84699 SRE=84897
574,50.6625488,100.84.170.161,151.101.2.187,TLSv1.3,705,Application Data
575,50.6720116,151.101.2.187,100.84.170.161,TCP,56,443  >  64433 [ACK] Seq=84897 Ack=153025 Win=163328 Len=0
576,50.6746334,151.101.2.187,100.84.170.161,TLSv1.3,396,Application Data
577,50.6995937,151.101.2.187,100.84.170.161,TCP,396,"[TCP Retransmission] 443  >  64433 [PSH, ACK] Seq=84897 Ack=153025 Win=163328 Len=342"
578,50.6996589,100.84.170.161,151.101.2.187,TCP,66,64433  >  443 [ACK] Seq=153025 Ack=85239 Win=130816 Len=0 SLE=84897 SRE=85239
579,50.771958,100.84.170.161,151.101.2.187,TLSv1.3,1950,Application Data
580,50.7813524,151.101.2.187,100.84.170.161,TCP,56,443  >  64433 [ACK] Seq=85239 Ack=154921 Win=168960 Len=0
581,50.7850147,151.101.2.187,100.84.170.161,TLSv1.3,135,Application Data
582,50.8104234,151.101.2.187,100.84.170.161,TCP,135,"[TCP Retransmission] 443  >  64433 [PSH, ACK] Seq=85239 Ack=154921 Win=168960 Len=81"
583,50.8104717,100.84.170.161,151.101.2.187,TCP,66,64433  >  443 [ACK] Seq=154921 Ack=85320 Win=130560 Len=0 SLE=85239 SRE=85320
584,50.856902,100.84.170.161,151.101.2.187,TLSv1.3,716,Application Data
585,50.8570584,100.84.170.161,151.101.2.187,TLSv1.3,1932,Application Data
586,50.8662069,151.101.2.187,100.84.170.161,TCP,56,443  >  64433 [ACK] Seq=85320 Ack=155583 Win=172032 Len=0
587,50.8668842,151.101.2.187,100.84.170.161,TCP,56,443  >  64433 [ACK] Seq=85320 Ack=157461 Win=177664 Len=0
588,50.8684514,151.101.2.187,100.84.170.161,TLSv1.3,130,Application Data
589,50.8691278,151.101.2.187,100.84.170.161,TLSv1.3,130,Application Data
590,50.8691942,100.84.170.161,151.101.2.187,TCP,54,64433  >  443 [ACK] Seq=157461 Ack=85472 Win=130560 Len=0
591,50.872263,100.84.170.161,151.101.2.187,TLSv1.3,762,Application Data
592,50.8816931,151.101.2.187,100.84.170.161,TCP,56,443  >  64433 [ACK] Seq=85472 Ack=158169 Win=180736 Len=0
593,50.8843154,151.101.2.187,100.84.170.161,TLSv1.3,130,Application Data
594,50.9097238,151.101.2.187,100.84.170.161,TCP,130,"[TCP Retransmission] 443  >  64433 [PSH, ACK] Seq=85472 Ack=158169 Win=180736 Len=76"
595,50.9097772,100.84.170.161,151.101.2.187,TCP,66,64433  >  443 [ACK] Seq=158169 Ack=85548 Win=130304 Len=0 SLE=85472 SRE=85548
596,50.9819217,100.84.170.161,151.101.2.187,TLSv1.3,1895,Application Data
597,50.9830394,100.84.170.161,151.101.2.187,TLSv1.3,752,Application Data
598,50.9831724,100.84.170.161,151.101.2.187,TLSv1.3,1948,Application Data
599,50.9917958,151.101.2.187,100.84.170.161,TCP,56,443  >  64433 [ACK] Seq=85548 Ack=160010 Win=186368 Len=0
600,50.9921579,151.101.2.187,100.84.170.161,TCP,56,443  >  64433 [ACK] Seq=85548 Ack=160708 Win=189440 Len=0
601,50.9932517,151.101.2.187,100.84.170.161,TCP,56,443  >  64433 [ACK] Seq=85548 Ack=162602 Win=195072 Len=0
602,50.9952915,151.101.2.187,100.84.170.161,TLSv1.3,173,Application Data
603,50.9956636,151.101.2.187,100.84.170.161,TLSv1.3,683,Application Data
604,50.9957085,100.84.170.161,151.101.2.187,TCP,54,64433  >  443 [ACK] Seq=162602 Ack=86296 Win=131328 Len=0
605,50.9958613,151.101.2.187,100.84.170.161,TLSv1.3,130,Application Data
606,50.9971489,151.101.2.187,100.84.170.161,TLSv1.3,125,Application Data
607,50.9972078,100.84.170.161,151.101.2.187,TCP,54,64433  >  443 [ACK] Seq=162602 Ack=86443 Win=131072 Len=0
608,51.0376684,100.84.170.161,151.101.2.187,TLSv1.3,733,Application Data
609,51.048013,151.101.2.187,100.84.170.161,TCP,56,443  >  64433 [ACK] Seq=86443 Ack=163281 Win=198144 Len=0
610,51.0517871,151.101.2.187,100.84.170.161,TLSv1.3,98,Application Data
611,51.0754726,151.101.2.187,100.84.170.161,TCP,98,"[TCP Retransmission] 443  >  64433 [PSH, ACK] Seq=86443 Ack=163281 Win=198144 Len=44"
612,51.0755368,100.84.170.161,151.101.2.187,TCP,66,64433  >  443 [ACK] Seq=163281 Ack=86487 Win=131072 Len=0 SLE=86443 SRE=86487
613,51.3456542,100.84.170.161,151.101.2.187,TLSv1.3,1955,Application Data
614,51.3552946,151.101.2.187,100.84.170.161,TCP,56,443  >  64433 [ACK] Seq=86487 Ack=165182 Win=204288 Len=0
615,51.3576232,151.101.2.187,100.84.170.161,TLSv1.3,131,Application Data
616,51.3720036,100.84.170.161,151.101.66.187,TLSv1.3,175,Application Data
617,51.3721127,100.84.170.161,151.101.66.187,TLSv1.3,93,Application Data
618,51.3811237,151.101.66.187,100.84.170.161,TCP,56,443  >  50935 [ACK] Seq=12975 Ack=3533 Win=143872 Len=0
619,51.381493,151.101.66.187,100.84.170.161,TLSv1.3,93,Application Data
620,51.3826164,151.101.2.187,100.84.170.161,TCP,131,"[TCP Retransmission] 443  >  64433 [PSH, ACK] Seq=86487 Ack=165182 Win=204288 Len=77"
621,51.3826601,100.84.170.161,151.101.2.187,TCP,66,64433  >  443 [ACK] Seq=165182 Ack=86564 Win=131072 Len=0 SLE=86487 SRE=86564
622,51.3829473,151.101.66.187,100.84.170.161,TLSv1.3,267,Application Data
623,51.38299,100.84.170.161,151.101.66.187,TCP,54,50935  >  443 [ACK] Seq=3572 Ack=13227 Win=129792 Len=0
624,51.5437488,100.84.170.161,151.101.2.187,TLSv1.3,737,Application Data
625,51.550422,100.84.170.161,151.101.2.187,TLSv1.3,1922,Application Data
626,51.5530042,151.101.2.187,100.84.170.161,TCP,56,443  >  64433 [ACK] Seq=86564 Ack=165865 Win=206848 Len=0
627,51.5554718,151.101.2.187,100.84.170.161,TLSv1.3,131,Application Data
628,51.5573738,100.84.170.161,151.101.2.187,TLSv1.3,686,Application Data
629,51.5607455,151.101.2.187,100.84.170.161,TCP,56,443  >  64433 [ACK] Seq=86641 Ack=167733 Win=212992 Len=0
630,51.5640683,151.101.2.187,100.84.170.161,TLSv1.3,98,Application Data
631,51.5668981,151.101.2.187,100.84.170.161,TCP,56,443  >  64433 [ACK] Seq=86685 Ack=168365 Win=215552 Len=0
632,51.5698931,151.101.2.187,100.84.170.161,TLSv1.3,530,Application Data
633,51.5699644,100.84.170.161,151.101.2.187,TCP,54,64433  >  443 [ACK] Seq=168365 Ack=87161 Win=130304 Len=0
634,51.5738728,100.84.170.161,151.101.2.187,TLSv1.3,1884,Application Data
635,51.5836567,151.101.2.187,100.84.170.161,TCP,56,443  >  64433 [ACK] Seq=87161 Ack=170195 Win=221696 Len=0
636,51.5868791,151.101.2.187,100.84.170.161,TLSv1.3,408,Application Data
637,51.5872746,151.101.2.187,100.84.170.161,TLSv1.3,420,Application Data
638,51.5873223,100.84.170.161,151.101.2.187,TCP,54,64433  >  443 [ACK] Seq=170195 Ack=87881 Win=131328 Len=0
639,51.6139322,100.84.170.161,151.101.2.187,TLSv1.3,680,Application Data
640,51.6198403,100.84.170.161,151.101.2.187,TLSv1.3,1880,Application Data
641,51.6236951,151.101.2.187,100.84.170.161,TCP,56,443  >  64433 [ACK] Seq=87881 Ack=170821 Win=224768 Len=0
642,51.6265311,151.101.2.187,100.84.170.161,TLSv1.3,166,Application Data
643,51.6269007,151.101.2.187,100.84.170.161,TLSv1.3,1072,Application Data
644,51.6269502,100.84.170.161,151.101.2.187,TCP,54,64433  >  443 [ACK] Seq=172647 Ack=89011 Win=130048 Len=0
645,51.6292189,151.101.2.187,100.84.170.161,TCP,56,443  >  64433 [ACK] Seq=89011 Ack=172647 Win=230400 Len=0
646,51.6336164,151.101.2.187,100.84.170.161,TLSv1.3,139,Application Data
647,51.6338634,151.101.2.187,100.84.170.161,TLSv1.3,623,Application Data
648,51.633906,100.84.170.161,151.101.2.187,TCP,54,64433  >  443 [ACK] Seq=172647 Ack=89665 Win=131328 Len=0
649,51.7684295,100.84.170.161,151.101.2.187,TLSv1.3,744,Application Data
650,51.779572,151.101.2.187,100.84.170.161,TCP,56,443  >  64433 [ACK] Seq=89665 Ack=173337 Win=233472 Len=0
651,51.7819936,151.101.2.187,100.84.170.161,TLSv1.3,240,Application Data
652,51.8066727,151.101.2.187,100.84.170.161,TCP,240,"[TCP Retransmission] 443  >  64433 [PSH, ACK] Seq=89665 Ack=173337 Win=233472 Len=186"
653,51.8067206,100.84.170.161,151.101.2.187,TCP,66,64433  >  443 [ACK] Seq=173337 Ack=89851 Win=131072 Len=0 SLE=89665 SRE=89851
654,59.0346744,100.84.170.161,151.101.2.187,TLSv1.3,1949,Application Data
655,59.0391668,100.84.170.161,151.101.2.187,TLSv1.3,704,Application Data
656,59.0441405,151.101.2.187,100.84.170.161,TCP,56,443  >  64433 [ACK] Seq=89851 Ack=175232 Win=239104 Len=0
657,59.0472244,151.101.2.187,100.84.170.161,TLSv1.3,241,Application Data
658,59.0480603,151.101.2.187,100.84.170.161,TCP,56,443  >  64433 [ACK] Seq=90038 Ack=175882 Win=242176 Len=0
659,59.0509379,151.101.2.187,100.84.170.161,TLSv1.3,98,Application Data
660,59.051004,100.84.170.161,151.101.2.187,TCP,54,64433  >  443 [ACK] Seq=175882 Ack=90082 Win=130816 Len=0
661,59.0576687,100.84.170.161,151.101.2.187,TLSv1.3,1965,Application Data
662,59.0669138,151.101.2.187,100.84.170.161,TCP,56,443  >  64433 [ACK] Seq=90082 Ack=177793 Win=247808 Len=0
663,59.0704257,151.101.2.187,100.84.170.161,TLSv1.3,125,Application Data
664,59.0966399,151.101.2.187,100.84.170.161,TCP,125,"[TCP Retransmission] 443  >  64433 [PSH, ACK] Seq=90082 Ack=177793 Win=247808 Len=71"
665,59.0966946,100.84.170.161,151.101.2.187,TCP,66,64433  >  443 [ACK] Seq=177793 Ack=90153 Win=130816 Len=0 SLE=90082 SRE=90153
666,59.2437586,100.84.170.161,151.101.2.187,TLSv1.3,663,Application Data
667,59.2530363,151.101.2.187,100.84.170.161,TCP,56,443  >  64433 [ACK] Seq=90153 Ack=178402 Win=250880 Len=0
668,59.2561415,151.101.2.187,100.84.170.161,TLSv1.3,545,Application Data
669,59.2591093,100.84.170.161,151.101.2.187,TLSv1.3,89,Application Data
670,59.2682913,151.101.2.187,100.84.170.161,TCP,56,443  >  64433 [ACK] Seq=90644 Ack=178437 Win=250880 Len=0
