No.,Time,Source,Destination,Protocol,Length,Info
1,0.0,100.84.170.161,151.101.2.187,TLSv1.2,1765,Application Data
2,7.23e-05,100.84.170.161,151.101.2.187,TLSv1.2,93,Application Data
3,0.0100723,151.101.2.187,100.84.170.161,TCP,56,443  >  62978 [ACK] Seq=1 Ack=1751 Win=2176 Len=0
4,0.0106095,151.101.2.187,100.84.170.161,TLSv1.2,93,Application Data
5,0.0135417,151.101.2.187,100.84.170.161,TLSv1.2,379,Application Data
6,0.0136672,100.84.170.161,151.101.2.187,TCP,54,62978  >  443 [ACK] Seq=1751 Ack=365 Win=508 Len=0
7,0.1515427,100.84.170.161,151.101.2.187,TLSv1.2,884,Application Data
8,0.1623547,151.101.2.187,100.84.170.161,TCP,56,443  >  62978 [ACK] Seq=365 Ack=2581 Win=2182 Len=0
9,0.1648202,151.101.2.187,100.84.170.161,TLSv1.2,103,Application Data
10,0.2107241,100.84.170.161,151.101.2.187,TCP,54,62978  >  443 [ACK] Seq=2581 Ack=414 Win=508 Len=0
11,2.7565586,100.84.170.161,151.101.2.187,TLSv1.2,1785,Application Data
12,2.7659916,151.101.2.187,100.84.170.161,TCP,56,443  >  62978 [ACK] Seq=414 Ack=4312 Win=2187 Len=0
13,2.7693812,151.101.2.187,100.84.170.161,TLSv1.2,215,Application Data
14,2.8195118,100.84.170.161,151.101.2.187,TCP,54,62978  >  443 [ACK] Seq=4312 Ack=575 Win=507 Len=0
15,5.9726526,100.84.170.161,151.101.2.187,TLSv1.2,914,Application Data
16,5.9819851,151.101.2.187,100.84.170.161,TCP,56,443  >  62978 [ACK] Seq=575 Ack=5172 Win=2193 Len=0
17,5.9845059,151.101.2.187,100.84.170.161,TLSv1.2,214,Application Data
18,6.0210298,100.84.170.161,151.101.2.187,TLSv1.2,1753,Application Data
19,6.0305412,151.101.2.187,100.84.170.161,TCP,56,443  >  62978 [ACK] Seq=735 Ack=6871 Win=2199 Len=0
20,6.0329386,151.101.2.187,100.84.170.161,TLSv1.2,131,Application Data
21,6.0811043,100.84.170.161,151.101.2.187,TCP,54,62978  >  443 [ACK] Seq=6871 Ack=812 Win=512 Len=0
22,6.092825,100.84.170.161,151.101.2.187,TLSv1.2,931,Application Data
23,6.1027513,151.101.2.187,100.84.170.161,TCP,56,443  >  62978 [ACK] Seq=812 Ack=7748 Win=2204 Len=0
24,6.1070082,151.101.2.187,100.84.170.161,TLSv1.2,103,Application Data
25,6.1543028,100.84.170.161,151.101.2.187,TCP,54,62978  >  443 [ACK] Seq=7748 Ack=861 Win=512 Len=0
26,7.8681101,100.84.170.161,151.101.2.187,TLSv1.2,1768,Application Data
27,7.8798257,151.101.2.187,100.84.170.161,TCP,56,443  >  62978 [ACK] Seq=861 Ack=9462 Win=2210 Len=0
28,7.8828376,151.101.2.187,100.84.170.161,TLSv1.2,214,Application Data
29,7.9238357,100.84.170.161,151.101.2.187,TCP,54,62978  >  443 [ACK] Seq=9462 Ack=1021 Win=512 Len=0
30,11.9741504,100.84.170.161,151.101.2.187,TLSv1.2,921,Application Data
31,11.9849316,151.101.2.187,100.84.170.161,TCP,56,443  >  62978 [ACK] Seq=1021 Ack=10329 Win=2216 Len=0
32,11.988237,151.101.2.187,100.84.170.161,TLSv1.2,241,Application Data
33,12.0314987,100.84.170.161,151.101.2.187,TCP,54,62978  >  443 [ACK] Seq=10329 Ack=1208 Win=511 Len=0
34,12.7663912,100.84.170.161,151.101.2.187,TLSv1.2,1732,Application Data
35,12.7682891,100.84.170.161,151.101.2.187,TLSv1.2,918,Application Data
36,12.7725883,100.84.170.161,151.101.2.187,TLSv1.2,1737,Application Data
37,12.7771926,151.101.2.187,100.84.170.161,TCP,56,443  >  62978 [ACK] Seq=1208 Ack=12007 Win=2221 Len=0
38,12.7776709,151.101.2.187,100.84.170.161,TCP,56,443  >  62978 [ACK] Seq=1208 Ack=12871 Win=2227 Len=0
39,12.779453,100.84.170.161,151.101.2.187,TLSv1.2,931,Application Data
40,12.7797326,151.101.2.187,100.84.170.161,TLSv1.2,285,Application Data
41,12.7800271,151.101.2.187,100.84.170.161,TLSv1.2,135,Application Data
42,12.7800661,100.84.170.161,151.101.2.187,TCP,54,62978  >  443 [ACK] Seq=15431 Ack=1520 Win=510 Len=0
43,12.7827296,151.101.2.187,100.84.170.161,TCP,56,443  >  62978 [ACK] Seq=1520 Ack=14554 Win=2233 Len=0
44,12.7848827,151.101.2.187,100.84.170.161,TLSv1.2,291,Application Data
45,12.7901887,151.101.2.187,100.84.170.161,TCP,56,443  >  62978 [ACK] Seq=1757 Ack=15431 Win=2239 Len=0
46,12.7923703,151.101.2.187,100.84.170.161,TLSv1.2,103,Application Data
47,12.7924215,100.84.170.161,151.101.2.187,TCP,54,62978  >  443 [ACK] Seq=15431 Ack=1806 Win=509 Len=0
48,12.9455866,100.84.170.161,151.101.2.187,TLSv1.2,1759,Application Data
49,12.9547515,151.101.2.187,100.84.170.161,TCP,56,443  >  62978 [ACK] Seq=1806 Ack=17136 Win=2244 Len=0
50,12.957739,151.101.2.187,100.84.170.161,TLSv1.2,129,Application Data
51,13.008563,100.84.170.161,151.101.2.187,TCP,54,62978  >  443 [ACK] Seq=17136 Ack=1881 Win=508 Len=0
52,13.0679242,100.84.170.161,151.101.2.187,TLSv1.2,922,Application Data
53,13.0681244,100.84.170.161,151.101.2.187,TLSv1.2,1718,Application Data
54,13.0683274,100.84.170.161,151.101.2.187,TLSv1.2,918,Application Data
55,13.0779546,151.101.2.187,100.84.170.161,TCP,56,443  >  62978 [ACK] Seq=1881 Ack=18004 Win=2250 Len=0
56,13.0782482,151.101.2.187,100.84.170.161,TCP,56,443  >  62978 [ACK] Seq=1881 Ack=20532 Win=2261 Len=0
57,13.0800328,151.101.2.187,100.84.170.161,TLSv1.2,130,Application Data
58,13.0804771,151.101.2.187,100.84.170.161,TLSv1.2,129,Application Data
59,13.0805249,100.84.170.161,151.101.2.187,TCP,54,62978  >  443 [ACK] Seq=20532 Ack=2032 Win=508 Len=0
60,13.080861,151.101.2.187,100.84.170.161,TLSv1.2,130,Application Data
61,13.1313581,100.84.170.161,151.101.2.187,TCP,54,62978  >  443 [ACK] Seq=20532 Ack=2108 Win=507 Len=0
62,13.1854616,100.84.170.161,151.101.2.187,TLSv1.2,1795,Application Data
63,13.186057,100.84.170.161,151.101.2.187,TLSv1.2,839,Application Data
64,13.1952292,151.101.2.187,100.84.170.161,TCP,56,443  >  62978 [ACK] Seq=2108 Ack=22273 Win=2267 Len=0
65,13.1955905,151.101.2.187,100.84.170.161,TCP,56,443  >  62978 [ACK] Seq=2108 Ack=23058 Win=2273 Len=0
66,13.1977683,151.101.2.187,100.84.170.161,TLSv1.2,130,Application Data
67,13.1981496,151.101.2.187,100.84.170.161,TLSv1.2,130,Application Data
68,13.1981829,100.84.170.161,151.101.2.187,TCP,54,62978  >  443 [ACK] Seq=23058 Ack=2260 Win=513 Len=0
69,13.3392369,100.84.170.161,151.101.2.187,TLSv1.2,2047,Application Data
70,13.3480222,100.84.170.161,151.101.2.187,TLSv1.2,643,Application Data
71,13.3485317,151.101.2.187,100.84.170.161,TCP,56,443  >  62978 [ACK] Seq=2260 Ack=25051 Win=2284 Len=0
72,13.3519701,151.101.2.187,100.84.170.161,TLSv1.2,131,Application Data
73,13.3573982,151.101.2.187,100.84.170.161,TCP,56,443  >  62978 [ACK] Seq=2337 Ack=25640 Win=2290 Len=0
74,13.3596398,151.101.2.187,100.84.170.161,TLSv1.2,131,Application Data
75,13.3596981,100.84.170.161,151.101.2.187,TCP,54,62978  >  443 [ACK] Seq=25640 Ack=2414 Win=512 Len=0
76,13.4648347,100.84.170.161,151.101.2.187,TLSv1.2,2071,Application Data
77,13.4655878,100.84.170.161,151.101.2.187,TLSv1.2,623,Application Data
78,13.4749648,151.101.2.187,100.84.170.161,TCP,56,443  >  62978 [ACK] Seq=2414 Ack=27657 Win=2301 Len=0
79,13.4753073,151.101.2.187,100.84.170.161,TCP,56,443  >  62978 [ACK] Seq=2414 Ack=28226 Win=2307 Len=0
80,13.4776384,151.101.2.187,100.84.170.161,TLSv1.2,285,Application Data
81,13.4780125,151.101.2.187,100.84.170.161,TLSv1.2,125,Application Data
82,13.478051,100.84.170.161,151.101.2.187,TCP,54,62978  >  443 [ACK] Seq=28226 Ack=2716 Win=511 Len=0
83,13.9906053,100.84.170.161,151.101.2.187,TLSv1.2,2071,Application Data
84,13.9928983,100.84.170.161,151.101.2.187,TLSv1.2,643,Application Data
85,13.9997551,151.101.2.187,100.84.170.161,TCP,56,443  >  62978 [ACK] Seq=2716 Ack=30243 Win=2318 Len=0
86,14.0019375,151.101.2.187,100.84.170.161,TLSv1.2,98,Application Data
87,14.00445,151.101.2.187,100.84.170.161,TLSv1.2,109,Application Data
88,14.004526,100.84.170.161,151.101.2.187,TCP,54,62978  >  443 [ACK] Seq=30832 Ack=2815 Win=511 Len=0
89,14.177256,100.84.170.161,151.101.2.187,TLSv1.2,2072,Application Data
90,14.186513,151.101.2.187,100.84.170.161,TCP,56,443  >  62978 [ACK] Seq=2815 Ack=32850 Win=2336 Len=0
91,14.1891517,151.101.2.187,100.84.170.161,TLSv1.2,103,Application Data
92,14.2304403,100.84.170.161,151.101.2.187,TCP,54,62978  >  443 [ACK] Seq=32850 Ack=2864 Win=510 Len=0
93,14.4499664,100.84.170.161,151.101.2.187,TLSv1.2,665,Application Data
94,14.4599791,151.101.2.187,100.84.170.161,TCP,56,443  >  62978 [ACK] Seq=2864 Ack=33461 Win=2341 Len=0
95,14.462728,151.101.2.187,100.84.170.161,TLSv1.2,403,Application Data
96,14.517622,100.84.170.161,151.101.2.187,TCP,54,62978  >  443 [ACK] Seq=33461 Ack=3213 Win=509 Len=0
97,17.4469629,100.84.170.161,151.101.2.187,TLSv1.2,2102,Application Data
98,17.4567216,151.101.2.187,100.84.170.161,TCP,56,443  >  62978 [ACK] Seq=3213 Ack=35509 Win=2353 Len=0
99,17.4591918,151.101.2.187,100.84.170.161,TLSv1.2,213,Application Data
100,17.5037092,100.84.170.161,151.101.2.187,TCP,54,62978  >  443 [ACK] Seq=35509 Ack=3372 Win=508 Len=0
101,18.1032717,100.84.170.161,151.101.2.187,TLSv1.2,611,Application Data
102,18.1038887,100.84.170.161,151.101.2.187,TLSv1.2,2099,Application Data
103,18.1144576,151.101.2.187,100.84.170.161,TCP,56,443  >  62978 [ACK] Seq=3372 Ack=38111 Win=2370 Len=0
104,18.1169855,151.101.2.187,100.84.170.161,TLSv1.2,130,Application Data
105,18.1172718,151.101.2.187,100.84.170.161,TLSv1.2,130,Application Data
106,18.1173049,100.84.170.161,151.101.2.187,TCP,54,62978  >  443 [ACK] Seq=38111 Ack=3524 Win=508 Len=0
107,18.1210474,100.84.170.161,151.101.2.187,TLSv1.2,606,Application Data
108,18.1299373,151.101.2.187,100.84.170.161,TCP,56,443  >  62978 [ACK] Seq=3524 Ack=38663 Win=2375 Len=0
109,18.1322044,151.101.2.187,100.84.170.161,TLSv1.2,130,Application Data
110,18.1842137,100.84.170.161,151.101.2.187,TCP,54,62978  >  443 [ACK] Seq=38663 Ack=3600 Win=508 Len=0
111,18.1991879,100.84.170.161,151.101.2.187,TLSv1.2,2121,Application Data
112,18.2086022,151.101.2.187,100.84.170.161,TCP,56,443  >  62978 [ACK] Seq=3600 Ack=40730 Win=2387 Len=0
113,18.2116565,151.101.2.187,100.84.170.161,TLSv1.2,129,Application Data
114,18.2527126,100.84.170.161,151.101.2.187,TCP,54,62978  >  443 [ACK] Seq=40730 Ack=3675 Win=507 Len=0
115,18.2599147,100.84.170.161,151.101.2.187,TLSv1.2,622,Application Data
116,18.2837416,151.101.2.187,100.84.170.161,TCP,56,443  >  62978 [ACK] Seq=3675 Ack=41298 Win=2393 Len=0
117,18.286011,151.101.2.187,100.84.170.161,TLSv1.2,130,Application Data
118,18.3289801,100.84.170.161,151.101.2.187,TLSv1.2,2068,Application Data
119,18.3388304,151.101.2.187,100.84.170.161,TCP,56,443  >  62978 [ACK] Seq=3751 Ack=43312 Win=2404 Len=0
120,18.341719,151.101.2.187,100.84.170.161,TLSv1.2,129,Application Data
121,18.3893192,100.84.170.161,151.101.2.187,TCP,54,62978  >  443 [ACK] Seq=43312 Ack=3826 Win=512 Len=0
122,18.4927683,100.84.170.161,151.101.2.187,TLSv1.2,979,Application Data
123,18.5015413,100.84.170.161,151.101.2.187,TLSv1.2,1763,Application Data
124,18.5020687,151.101.2.187,100.84.170.161,TCP,56,443  >  62978 [ACK] Seq=3826 Ack=44237 Win=2410 Len=0
125,18.5044137,151.101.2.187,100.84.170.161,TLSv1.2,285,Application Data
126,18.5113004,151.101.2.187,100.84.170.161,TCP,56,443  >  62978 [ACK] Seq=4057 Ack=45946 Win=2415 Len=0
127,18.5138335,151.101.2.187,100.84.170.161,TLSv1.2,135,Application Data
128,18.5139047,100.84.170.161,151.101.2.187,TCP,54,62978  >  443 [ACK] Seq=45946 Ack=4138 Win=511 Len=0
129,18.5885281,100.84.170.161,151.101.2.187,TLSv1.2,990,Application Data
130,18.5978039,151.101.2.187,100.84.170.161,TCP,56,443  >  62978 [ACK] Seq=4138 Ack=46882 Win=2421 Len=0
131,18.6006841,151.101.2.187,100.84.170.161,TLSv1.2,131,Application Data
132,18.6553445,100.84.170.161,151.101.2.187,TCP,54,62978  >  443 [ACK] Seq=46882 Ack=4215 Win=511 Len=0
133,18.8544386,100.84.170.161,151.101.2.187,TLSv1.2,1787,Application Data
134,18.8614071,100.84.170.161,151.101.2.187,TLSv1.2,965,Application Data
135,18.8646157,151.101.2.187,100.84.170.161,TCP,56,443  >  62978 [ACK] Seq=4215 Ack=48615 Win=2427 Len=0
136,18.8666959,151.101.2.187,100.84.170.161,TLSv1.2,291,Application Data
137,18.8714146,151.101.2.187,100.84.170.161,TCP,56,443  >  62978 [ACK] Seq=4452 Ack=49526 Win=2433 Len=0
138,18.8740734,151.101.2.187,100.84.170.161,TLSv1.2,98,Application Data
139,18.8741663,100.84.170.161,151.101.2.187,TCP,54,62978  >  443 [ACK] Seq=49526 Ack=4496 Win=510 Len=0
140,19.0439049,100.84.170.161,151.101.2.187,TLSv1.2,1798,Application Data
141,19.0544226,151.101.2.187,100.84.170.161,TCP,56,443  >  62978 [ACK] Seq=4496 Ack=51270 Win=2438 Len=0
142,19.0573386,151.101.2.187,100.84.170.161,TLSv1.2,130,Application Data
143,19.1058132,100.84.170.161,151.101.2.187,TCP,54,62978  >  443 [ACK] Seq=51270 Ack=4572 Win=510 Len=0
144,19.3337292,100.84.170.161,151.101.2.187,TLSv1.2,982,Application Data
145,19.3458767,100.84.170.161,151.101.2.187,TLSv1.2,1852,Application Data
146,19.4060464,151.101.2.187,100.84.170.161,TCP,56,443  >  62978 [ACK] Seq=4572 Ack=52198 Win=2444 Len=0
147,19.4067037,151.101.2.187,100.84.170.161,TLSv1.2,130,Application Data
148,19.4067037,151.101.2.187,100.84.170.161,TCP,56,443  >  62978 [ACK] Seq=4648 Ack=53996 Win=2450 Len=0
149,19.4070146,151.101.2.187,100.84.170.161,TLSv1.2,104,Application Data
150,19.4070496,100.84.170.161,151.101.2.187,TCP,54,62978  >  443 [ACK] Seq=53996 Ack=4698 Win=509 Len=0
151,21.5550599,100.84.170.161,151.101.2.187,TLSv1.2,913,Application Data
152,21.6177678,151.101.2.187,100.84.170.161,TCP,56,443  >  62978 [ACK] Seq=4698 Ack=54855 Win=2455 Len=0
153,21.6180077,151.101.2.187,100.84.170.161,TLSv1.2,242,Application Data
154,21.6391435,100.84.170.161,151.101.2.187,TLSv1.2,1831,Application Data
155,21.649504,151.101.2.187,100.84.170.161,TCP,56,443  >  62978 [ACK] Seq=4886 Ack=56632 Win=2461 Len=0
156,21.6519411,151.101.2.187,100.84.170.161,TLSv1.2,130,Application Data
157,21.6952485,100.84.170.161,151.101.2.187,TCP,54,62978  >  443 [ACK] Seq=56632 Ack=4962 Win=508 Len=0
158,25.2748505,100.84.170.161,151.101.2.187,TLSv1.2,1001,Application Data
159,25.2858826,151.101.2.187,100.84.170.161,TCP,56,443  >  62978 [ACK] Seq=4962 Ack=57579 Win=2467 Len=0
160,25.2908912,151.101.2.187,100.84.170.161,TLSv1.2,240,Application Data
161,25.3265304,100.84.170.161,151.101.2.187,TLSv1.2,1722,Application Data
162,25.3335407,100.84.170.161,151.101.2.187,TLSv1.2,1012,Application Data
163,25.3359569,151.101.2.187,100.84.170.161,TCP,56,443  >  62978 [ACK] Seq=5148 Ack=59247 Win=2472 Len=0
164,25.3390971,151.101.2.187,100.84.170.161,TLSv1.2,174,Application Data
165,25.3392882,100.84.170.161,151.101.2.187,TCP,54,62978  >  443 [ACK] Seq=60205 Ack=5268 Win=513 Len=0
166,25.3426413,151.101.2.187,100.84.170.161,TCP,56,443  >  62978 [ACK] Seq=5268 Ack=60205 Win=2478 Len=0
167,25.3460473,151.101.2.187,100.84.170.161,TLSv1.2,130,Application Data
168,25.3461029,100.84.170.161,151.101.2.187,TCP,54,62978  >  443 [ACK] Seq=60205 Ack=5344 Win=512 Len=0
169,25.4352858,100.84.170.161,151.101.2.187,TCP,55,56923  >  443 [ACK] Seq=1 Ack=1 Win=511 Len=1
170,25.4446157,151.101.2.187,100.84.170.161,TCP,66,443  >  56923 [ACK] Seq=1 Ack=2 Win=285 Len=0 SLE=1 SRE=2
171,25.5127069,100.84.170.161,151.101.2.187,TLSv1.2,1738,Application Data
172,25.521813,151.101.2.187,100.84.170.161,TCP,56,443  >  62978 [ACK] Seq=5344 Ack=61889 Win=2484 Len=0
173,25.5333602,151.101.2.187,100.84.170.161,TLSv1.2,245,Application Data
174,25.5828747,100.84.170.161,151.101.2.187,TCP,54,62978  >  443 [ACK] Seq=61889 Ack=5535 Win=512 Len=0
175,25.6122019,100.84.170.161,151.101.2.187,TLSv1.2,1005,Application Data
176,25.6221121,151.101.2.187,100.84.170.161,TCP,56,443  >  62978 [ACK] Seq=5535 Ack=62840 Win=2490 Len=0
177,25.6242108,151.101.2.187,100.84.170.161,TLSv1.2,291,Application Data
178,25.6708792,100.84.170.161,151.101.2.187,TCP,54,62978  >  443 [ACK] Seq=62840 Ack=5772 Win=511 Len=0
179,25.8091322,100.84.170.161,151.101.2.187,TLSv1.2,2015,Application Data
180,25.8203914,151.101.2.187,100.84.170.161,TCP,56,443  >  62978 [ACK] Seq=5772 Ack=64801 Win=2501 Len=0
181,25.8230526,151.101.2.187,100.84.170.161,TLSv1.2,131,Application Data
182,25.8638936,100.84.170.161,151.101.2.187,TCP,54,62978  >  443 [ACK] Seq=64801 Ack=5849 Win=511 Len=0
183,25.899203,100.84.170.161,151.101.2.187,TLSv1.2,744,Application Data
184,25.9089905,151.101.2.187,100.84.170.161,TCP,56,443  >  62978 [ACK] Seq=5849 Ack=65491 Win=2507 Len=0
185,25.9113771,151.101.2.187,100.84.170.161,TLSv1.2,130,Application Data
186,25.9584154,100.84.170.161,151.101.2.187,TCP,54,62978  >  443 [ACK] Seq=65491 Ack=5925 Win=510 Len=0
187,26.9662287,100.84.170.161,151.101.2.187,TLSv1.2,2025,Application Data
188,26.967032,100.84.170.161,151.101.2.187,TLSv1.2,732,Application Data
189,26.9763162,151.101.2.187,100.84.170.161,TCP,56,443  >  62978 [ACK] Seq=5925 Ack=67462 Win=2518 Len=0
190,26.9765593,151.101.2.187,100.84.170.161,TCP,56,443  >  62978 [ACK] Seq=5925 Ack=68140 Win=2524 Len=0
191,26.9782818,151.101.2.187,100.84.170.161,TLSv1.2,241,Application Data
192,26.9786895,151.101.2.187,100.84.170.161,TLSv1.2,131,Application Data
193,26.9787239,100.84.170.161,151.101.2.187,TCP,54,62978  >  443 [ACK] Seq=68140 Ack=6189 Win=509 Len=0
194,27.1346914,100.84.170.161,151.101.2.187,TLSv1.2,2036,Application Data
195,27.1441643,151.101.2.187,100.84.170.161,TCP,56,443  >  62978 [ACK] Seq=6189 Ack=70122 Win=2535 Len=0
196,27.1464943,151.101.2.187,100.84.170.161,TLSv1.2,130,Application Data
197,27.1944188,100.84.170.161,151.101.2.187,TCP,54,62978  >  443 [ACK] Seq=70122 Ack=6265 Win=509 Len=0
198,27.3366084,100.84.170.161,151.101.2.187,TLSv1.2,747,Application Data
199,27.3481301,151.101.2.187,100.84.170.161,TCP,56,443  >  62978 [ACK] Seq=6265 Ack=70815 Win=2541 Len=0
200,27.3498798,151.101.2.187,100.84.170.161,TLSv1.2,131,Application Data
201,27.4030728,100.84.170.161,151.101.2.187,TCP,54,62978  >  443 [ACK] Seq=70815 Ack=6342 Win=509 Len=0
202,27.507648,100.84.170.161,151.101.2.187,TLSv1.2,2026,Application Data
203,27.5207616,151.101.2.187,100.84.170.161,TCP,56,443  >  62978 [ACK] Seq=6342 Ack=72787 Win=2552 Len=0
204,27.5260705,151.101.2.187,100.84.170.161,TLSv1.2,208,Application Data
205,27.5668794,100.84.170.161,151.101.2.187,TLSv1.2,711,Application Data
206,27.5677346,100.84.170.161,151.101.2.187,TLSv1.2,2033,Application Data
207,27.5768388,151.101.2.187,100.84.170.161,TCP,56,443  >  62978 [ACK] Seq=6496 Ack=73444 Win=2558 Len=0
208,27.5776339,151.101.2.187,100.84.170.161,TCP,56,443  >  62978 [ACK] Seq=6496 Ack=75423 Win=2569 Len=0
209,27.5795504,151.101.2.187,100.84.170.161,TLSv1.2,147,Application Data
210,27.5797563,151.101.2.187,100.84.170.161,TLSv1.2,104,Application Data
211,27.5797828,100.84.170.161,151.101.2.187,TCP,54,62978  >  443 [ACK] Seq=75423 Ack=6639 Win=507 Len=0
212,27.9199892,100.84.170.161,151.101.2.187,TLSv1.2,754,Application Data
213,27.931577,151.101.2.187,100.84.170.161,TCP,56,443  >  62978 [ACK] Seq=6639 Ack=76123 Win=2575 Len=0
214,27.9334749,151.101.2.187,100.84.170.161,TLSv1.2,98,Application Data
215,27.9842678,100.84.170.161,151.101.2.187,TCP,54,62978  >  443 [ACK] Seq=76123 Ack=6683 Win=507 Len=0
216,32.839754,100.84.170.161,151.101.2.187,TLSv1.2,2119,Application Data
217,32.8514656,151.101.2.187,100.84.170.161,TCP,56,443  >  62978 [ACK] Seq=6683 Ack=78188 Win=2586 Len=0
218,32.8530561,100.84.170.161,151.101.2.187,TLSv1.2,657,Application Data
219,32.8533449,151.101.2.187,100.84.170.161,TLSv1.2,213,Application Data
220,32.8534155,100.84.170.161,151.101.2.187,TCP,54,62978  >  443 [ACK] Seq=78791 Ack=6842 Win=513 Len=0
221,32.8539444,100.84.170.161,151.101.2.187,TLSv1.2,2097,Application Data
222,32.8623998,151.101.2.187,100.84.170.161,TCP,56,443  >  62978 [ACK] Seq=6842 Ack=78791 Win=2592 Len=0
223,32.863203,151.101.2.187,100.84.170.161,TCP,56,443  >  62978 [ACK] Seq=6842 Ack=80834 Win=2604 Len=0
224,32.8664619,151.101.2.187,100.84.170.161,TLSv1.2,109,Application Data
225,32.8672221,151.101.2.187,100.84.170.161,TLSv1.2,130,Application Data
226,32.8672917,100.84.170.161,151.101.2.187,TCP,54,62978  >  443 [ACK] Seq=80834 Ack=6973 Win=512 Len=0
227,33.1009566,100.84.170.161,151.101.2.187,TLSv1.2,648,Application Data
228,33.1114274,151.101.2.187,100.84.170.161,TCP,56,443  >  62978 [ACK] Seq=6973 Ack=81428 Win=2609 Len=0
229,33.1142202,151.101.2.187,100.84.170.161,TLSv1.2,291,Application Data
230,33.1247496,100.84.170.161,151.101.2.187,TLSv1.2,2134,Application Data
231,33.1342306,151.101.2.187,100.84.170.161,TCP,56,443  >  62978 [ACK] Seq=7210 Ack=83508 Win=2621 Len=0
232,33.1370552,151.101.2.187,100.84.170.161,TLSv1.2,130,Application Data
233,33.1615703,100.84.170.161,151.101.2.187,TLSv1.2,642,Application Data
234,33.1714055,151.101.2.187,100.84.170.161,TCP,56,443  >  62978 [ACK] Seq=7286 Ack=84096 Win=2626 Len=0
235,33.1736331,151.101.2.187,100.84.170.161,TLSv1.2,103,Application Data
236,33.2209103,100.84.170.161,151.101.2.187,TCP,54,62978  >  443 [ACK] Seq=84096 Ack=7335 Win=511 Len=0
237,33.2851683,151.101.2.187,100.84.170.161,TCP,103,"[TCP Spurious Retransmission] 443  >  62978 [PSH, ACK] Seq=7286 Ack=84096 Win=2626 Len=49"
238,33.2852514,100.84.170.161,151.101.2.187,TCP,66,[TCP Dup ACK 236#1] 62978  >  443 [ACK] Seq=84096 Ack=7335 Win=511 Len=0 SLE=7286 SRE=7335
239,33.3309393,100.84.170.161,151.101.2.187,TLSv1.2,2129,Application Data
240,33.3506025,151.101.2.187,100.84.170.161,TCP,56,443  >  62978 [ACK] Seq=7335 Ack=86171 Win=2638 Len=0
241,33.3529074,151.101.2.187,100.84.170.161,TLSv1.2,130,Application Data
242,33.4017866,100.84.170.161,151.101.2.187,TCP,54,62978  >  443 [ACK] Seq=86171 Ack=7411 Win=511 Len=0
243,33.4306077,100.84.170.161,151.101.2.187,TLSv1.2,672,Application Data
244,33.4309914,100.84.170.161,151.101.2.187,TLSv1.2,2102,Application Data
245,33.4351552,100.84.170.161,151.101.2.187,TLSv1.2,684,Application Data
246,33.4353132,100.84.170.161,151.101.2.187,TLSv1.2,2105,Application Data
247,33.4354278,100.84.170.161,151.101.2.187,TLSv1.2,690,Application Data
248,33.4355546,100.84.170.161,151.101.2.187,TLSv1.2,2118,Application Data
249,33.4356476,100.84.170.161,151.101.2.187,TLSv1.2,663,Application Data
250,33.4357683,100.84.170.161,151.101.2.187,TLSv1.2,2106,Application Data
251,33.4403326,151.101.2.187,100.84.170.161,TCP,56,443  >  62978 [ACK] Seq=7411 Ack=86789 Win=2644 Len=0
252,33.4406087,151.101.2.187,100.84.170.161,TCP,56,443  >  62978 [ACK] Seq=7411 Ack=88837 Win=2655 Len=0
253,33.4426682,151.101.2.187,100.84.170.161,TLSv1.2,130,Application Data
254,33.4430334,151.101.2.187,100.84.170.161,TLSv1.2,129,Application Data
255,33.4430913,100.84.170.161,151.101.2.187,TCP,54,62978  >  443 [ACK] Seq=96879 Ack=7562 Win=510 Len=0
256,33.445423,151.101.2.187,100.84.170.161,TCP,56,443  >  62978 [ACK] Seq=7562 Ack=96879 Win=2706 Len=0
257,33.447786,151.101.2.187,100.84.170.161,TLSv1.2,240,Application Data
258,33.4481435,151.101.2.187,100.84.170.161,TLSv1.2,131,Application Data
259,33.448197,100.84.170.161,151.101.2.187,TCP,54,62978  >  443 [ACK] Seq=96879 Ack=7825 Win=509 Len=0
260,33.4485463,151.101.2.187,100.84.170.161,TLSv1.2,175,Application Data
261,33.4488485,151.101.2.187,100.84.170.161,TLSv1.2,130,Application Data
262,33.4488939,100.84.170.161,151.101.2.187,TCP,54,62978  >  443 [ACK] Seq=96879 Ack=8022 Win=508 Len=0
263,33.4495265,151.101.2.187,100.84.170.161,TLSv1.2,135,Application Data
264,33.4495265,151.101.2.187,100.84.170.161,TLSv1.2,130,Application Data
265,33.4496239,100.84.170.161,151.101.2.187,TCP,54,62978  >  443 [ACK] Seq=96879 Ack=8179 Win=508 Len=0
266,44.4937066,100.84.170.161,151.101.2.187,TLSv1.2,985,Application Data
267,44.4938368,100.84.170.161,151.101.2.187,TLSv1.2,93,Application Data
268,44.5047677,151.101.2.187,100.84.170.161,TCP,56,443  >  62978 [ACK] Seq=8179 Ack=97810 Win=2712 Len=0
269,44.5055241,151.101.2.187,100.84.170.161,TLSv1.2,93,Application Data
270,44.5074979,151.101.2.187,100.84.170.161,TLSv1.2,401,Application Data
271,44.5075724,100.84.170.161,151.101.2.187,TCP,54,62978  >  443 [ACK] Seq=97849 Ack=8565 Win=513 Len=0
272,44.5673535,100.84.170.161,151.101.2.187,TLSv1.2,1846,Application Data
273,44.5795786,151.101.2.187,100.84.170.161,TCP,56,443  >  62978 [ACK] Seq=8565 Ack=99641 Win=2718 Len=0
274,44.582212,151.101.2.187,100.84.170.161,TLSv1.2,131,Application Data
275,44.6317998,151.101.2.187,100.84.170.161,TCP,131,"[TCP Retransmission] 443  >  62978 [PSH, ACK] Seq=8565 Ack=99641 Win=2718 Len=77"
276,44.6318656,100.84.170.161,151.101.2.187,TCP,66,62978  >  443 [ACK] Seq=99641 Ack=8642 Win=512 Len=0 SLE=8565 SRE=8642
277,44.7306846,100.84.170.161,151.101.2.187,TLSv1.2,986,Application Data
278,44.7402277,151.101.2.187,100.84.170.161,TCP,56,443  >  62978 [ACK] Seq=8642 Ack=100573 Win=2723 Len=0
279,44.7426448,151.101.2.187,100.84.170.161,TLSv1.2,130,Application Data
280,44.7947421,151.101.2.187,100.84.170.161,TCP,130,"[TCP Retransmission] 443  >  62978 [PSH, ACK] Seq=8642 Ack=100573 Win=2723 Len=76"
281,44.7947869,100.84.170.161,151.101.2.187,TCP,66,62978  >  443 [ACK] Seq=100573 Ack=8718 Win=512 Len=0 SLE=8642 SRE=8718
282,45.6375228,100.84.170.161,151.101.2.187,TLSv1.2,1834,Application Data
283,45.6468562,151.101.2.187,100.84.170.161,TCP,56,443  >  62978 [ACK] Seq=8718 Ack=102353 Win=2729 Len=0
284,45.6494419,151.101.2.187,100.84.170.161,TLSv1.2,240,Application Data
285,45.6916946,100.84.170.161,151.101.2.187,TCP,54,62978  >  443 [ACK] Seq=102353 Ack=8904 Win=511 Len=0
286,45.8935415,100.84.170.161,151.101.2.187,TLSv1.2,974,Application Data
287,45.8937546,100.84.170.161,151.101.2.187,TLSv1.2,1816,Application Data
288,45.903251,151.101.2.187,100.84.170.161,TCP,56,443  >  62978 [ACK] Seq=8904 Ack=103273 Win=2735 Len=0
289,45.9053017,151.101.2.187,100.84.170.161,TCP,56,443  >  62978 [ACK] Seq=8904 Ack=105035 Win=2740 Len=0
290,45.9055774,151.101.2.187,100.84.170.161,TLSv1.2,130,Application Data
291,45.9068054,151.101.2.187,100.84.170.161,TLSv1.2,130,Application Data
292,45.9068551,100.84.170.161,151.101.2.187,TCP,54,62978  >  443 [ACK] Seq=105035 Ack=9056 Win=511 Len=0
293,48.6976982,100.84.170.161,151.101.2.187,TLSv1.2,1088,Application Data
294,48.7792275,151.101.2.187,100.84.170.161,TCP,56,443  >  62978 [ACK] Seq=9056 Ack=106069 Win=2746 Len=0
295,48.8102963,151.101.2.187,100.84.170.161,TLSv1.2,213,Application Data
296,48.8102963,151.101.2.187,100.84.170.161,TCP,213,"[TCP Retransmission] 443  >  62978 [PSH, ACK] Seq=9056 Ack=106069 Win=2746 Len=159"
297,48.8103688,100.84.170.161,151.101.2.187,TCP,66,62978  >  443 [ACK] Seq=106069 Ack=9215 Win=510 Len=0 SLE=9056 SRE=9215
298,48.8592194,100.84.170.161,151.101.2.187,TLSv1.2,1719,Application Data
299,48.8636583,100.84.170.161,151.101.2.187,TLSv1.2,1050,Application Data
300,48.8687014,151.101.2.187,100.84.170.161,TCP,56,443  >  62978 [ACK] Seq=9215 Ack=107734 Win=2752 Len=0
301,48.8707201,100.84.170.161,151.101.2.187,TLSv1.2,1713,Application Data
302,48.8716564,151.101.2.187,100.84.170.161,TLSv1.2,174,Application Data
303,48.8735767,151.101.2.187,100.84.170.161,TCP,56,443  >  62978 [ACK] Seq=9335 Ack=108730 Win=2758 Len=0
304,48.8760495,151.101.2.187,100.84.170.161,TLSv1.2,136,Application Data
305,48.8760989,100.84.170.161,151.101.2.187,TCP,54,62978  >  443 [ACK] Seq=110389 Ack=9417 Win=509 Len=0
306,48.8805956,151.101.2.187,100.84.170.161,TCP,56,443  >  62978 [ACK] Seq=9417 Ack=110389 Win=2763 Len=0
307,48.8837593,151.101.2.187,100.84.170.161,TLSv1.2,129,Application Data
308,48.9323319,100.84.170.161,151.101.2.187,TCP,54,62978  >  443 [ACK] Seq=110389 Ack=9492 Win=509 Len=0
309,48.9379764,151.101.2.187,100.84.170.161,TCP,129,"[TCP Spurious Retransmission] 443  >  62978 [PSH, ACK] Seq=9417 Ack=110389 Win=2763 Len=75"
310,48.9381657,100.84.170.161,151.101.2.187,TCP,66,[TCP Dup ACK 308#1] 62978  >  443 [ACK] Seq=110389 Ack=9492 Win=509 Len=0 SLE=9417 SRE=9492
311,48.9443626,100.84.170.161,151.101.2.187,TLSv1.2,1050,Application Data
312,48.9540827,151.101.2.187,100.84.170.161,TCP,56,443  >  62978 [ACK] Seq=9492 Ack=111385 Win=2769 Len=0
313,48.9591875,151.101.2.187,100.84.170.161,TLSv1.2,104,Application Data
314,49.0076288,100.84.170.161,151.101.2.187,TCP,54,62978  >  443 [ACK] Seq=111385 Ack=9542 Win=509 Len=0
315,49.0106858,151.101.2.187,100.84.170.161,TCP,104,"[TCP Spurious Retransmission] 443  >  62978 [PSH, ACK] Seq=9492 Ack=111385 Win=2769 Len=50"
316,49.0107358,100.84.170.161,151.101.2.187,TCP,66,[TCP Dup ACK 314#1] 62978  >  443 [ACK] Seq=111385 Ack=9542 Win=509 Len=0 SLE=9492 SRE=9542
317,49.0545688,100.84.170.161,151.101.2.187,TLSv1.2,1710,Application Data
318,49.0640378,151.101.2.187,100.84.170.161,TCP,56,443  >  62978 [ACK] Seq=9542 Ack=113041 Win=2775 Len=0
319,49.0664686,151.101.2.187,100.84.170.161,TLSv1.2,291,Application Data
320,49.0716385,100.84.170.161,151.101.2.187,TLSv1.2,1087,Application Data
321,49.0807037,151.101.2.187,100.84.170.161,TCP,56,443  >  62978 [ACK] Seq=9779 Ack=114074 Win=2780 Len=0
322,49.0829761,151.101.2.187,100.84.170.161,TLSv1.2,130,Application Data
323,49.1259137,100.84.170.161,151.101.2.187,TLSv1.2,1704,Application Data
324,49.131622,151.101.2.187,100.84.170.161,TCP,130,"[TCP Spurious Retransmission] 443  >  62978 [PSH, ACK] Seq=9779 Ack=114074 Win=2780 Len=76"
325,49.1316739,100.84.170.161,151.101.2.187,TCP,66,[TCP Dup ACK 323#1] 62978  >  443 [ACK] Seq=115724 Ack=9855 Win=508 Len=0 SLE=9779 SRE=9855
326,49.1352584,151.101.2.187,100.84.170.161,TCP,56,443  >  62978 [ACK] Seq=9855 Ack=115724 Win=2786 Len=0
327,49.1379313,151.101.2.187,100.84.170.161,TLSv1.2,130,Application Data
328,49.1849599,100.84.170.161,151.101.2.187,TCP,54,62978  >  443 [ACK] Seq=115724 Ack=9931 Win=507 Len=0
329,49.1865575,151.101.2.187,100.84.170.161,TCP,130,"[TCP Spurious Retransmission] 443  >  62978 [PSH, ACK] Seq=9855 Ack=115724 Win=2786 Len=76"
330,49.1866042,100.84.170.161,151.101.2.187,TCP,66,[TCP Dup ACK 328#1] 62978  >  443 [ACK] Seq=115724 Ack=9931 Win=507 Len=0 SLE=9855 SRE=9931
331,49.2507659,100.84.170.161,151.101.2.187,TLSv1.2,1082,Application Data
332,49.260523,151.101.2.187,100.84.170.161,TCP,56,443  >  62978 [ACK] Seq=9931 Ack=116752 Win=2792 Len=0
333,49.2630943,151.101.2.187,100.84.170.161,TLSv1.2,130,Application Data
334,49.3039431,100.84.170.161,151.101.2.187,TCP,54,62978  >  443 [ACK] Seq=116752 Ack=10007 Win=507 Len=0
335,49.3126701,151.101.2.187,100.84.170.161,TCP,130,"[TCP Spurious Retransmission] 443  >  62978 [PSH, ACK] Seq=9931 Ack=116752 Win=2792 Len=76"
336,49.3127254,100.84.170.161,151.101.2.187,TCP,66,[TCP Dup ACK 334#1] 62978  >  443 [ACK] Seq=116752 Ack=10007 Win=507 Len=0 SLE=9931 SRE=10007
337,49.4970836,100.84.170.161,151.101.2.187,TLSv1.2,2447,Application Data
338,49.4975388,100.84.170.161,151.101.2.187,TLSv1.2,2583,Application Data
339,49.5000717,100.84.170.161,151.101.2.187,TLSv1.2,2605,Application Data
340,49.5048461,100.84.170.161,151.101.2.187,TLSv1.2,2605,Application Data
341,49.5066476,100.84.170.161,151.101.2.187,TLSv1.2,2601,Application Data
342,49.5069681,151.101.2.187,100.84.170.161,TCP,56,443  >  62978 [ACK] Seq=10007 Ack=121674 Win=2815 Len=0
343,49.5095531,151.101.2.187,100.84.170.161,TCP,56,443  >  62978 [ACK] Seq=10007 Ack=124225 Win=2826 Len=0
344,49.5098997,151.101.2.187,100.84.170.161,TLSv1.2,294,Application Data
345,49.509947,100.84.170.161,151.101.2.187,TCP,54,62978  >  443 [ACK] Seq=129323 Ack=10247 Win=513 Len=0
346,49.5110732,100.84.170.161,151.101.2.187,TLSv1.2,2593,Application Data
347,49.5121695,151.101.2.187,100.84.170.161,TLSv1.2,130,Application Data
348,49.5132226,100.84.170.161,151.101.2.187,TLSv1.2,2592,Application Data
349,49.5134209,100.84.170.161,151.101.2.187,TLSv1.2,2589,Application Data
350,49.5145476,151.101.2.187,100.84.170.161,TCP,56,443  >  62978 [ACK] Seq=10323 Ack=126776 Win=2837 Len=0
351,49.5161019,151.101.2.187,100.84.170.161,TCP,56,443  >  62978 [ACK] Seq=10323 Ack=129323 Win=2849 Len=0
352,49.5169337,151.101.2.187,100.84.170.161,TLSv1.2,131,Application Data
353,49.5189028,151.101.2.187,100.84.170.161,TLSv1.2,174,Application Data
354,49.5189522,100.84.170.161,151.101.2.187,TCP,54,62978  >  443 [ACK] Seq=136935 Ack=10520 Win=512 Len=0
355,49.5206192,151.101.2.187,100.84.170.161,TCP,56,443  >  62978 [ACK] Seq=10520 Ack=131862 Win=2860 Len=0
356,49.522371,151.101.2.187,100.84.170.161,TCP,56,443  >  62978 [ACK] Seq=10520 Ack=134400 Win=2872 Len=0
357,49.5228813,151.101.2.187,100.84.170.161,TLSv1.2,136,Application Data
358,49.524679,151.101.2.187,100.84.170.161,TLSv1.2,130,Application Data
359,49.5247336,100.84.170.161,151.101.2.187,TCP,54,62978  >  443 [ACK] Seq=136935 Ack=10678 Win=511 Len=0
360,49.5254132,151.101.2.187,100.84.170.161,TLSv1.2,130,Application Data
361,49.5727685,151.101.2.187,100.84.170.161,TCP,130,"[TCP Retransmission] 443  >  62978 [PSH, ACK] Seq=10678 Ack=136935 Win=2883 Len=76"
362,49.5728104,100.84.170.161,151.101.2.187,TCP,66,62978  >  443 [ACK] Seq=136935 Ack=10754 Win=511 Len=0 SLE=10678 SRE=10754
363,54.0037207,100.84.170.161,151.101.2.187,TLSv1.2,2576,Application Data
364,54.0145588,151.101.2.187,100.84.170.161,TCP,56,443  >  62978 [ACK] Seq=10754 Ack=139457 Win=2894 Len=0
365,54.0175247,151.101.2.187,100.84.170.161,TLSv1.2,402,Application Data
366,54.0571585,151.101.2.187,100.84.170.161,TCP,402,"[TCP Retransmission] 443  >  62978 [PSH, ACK] Seq=10754 Ack=139457 Win=2894 Len=348"
367,54.0572234,100.84.170.161,151.101.2.187,TCP,66,62978  >  443 [ACK] Seq=139457 Ack=11102 Win=509 Len=0 SLE=10754 SRE=11102
