"No.","Time","Source","Destination","Protocol","Length","Info"
"1","0.000000000","100.84.170.161","151.101.2.187","TLSv1.2","2505","Application Data"
"2","0.000250500","100.84.170.161","151.101.2.187","TLSv1.2","93","Application Data"
"3","0.009646400","151.101.2.187","100.84.170.161","TCP","56","443  >  55283 [ACK] Seq=1 Ack=2491 Win=2134 Len=0"
"4","0.010439000","151.101.2.187","100.84.170.161","TLSv1.2","93","Application Data"
"5","0.035775600","151.101.2.187","100.84.170.161","TCP","93","[TCP Retransmission] 443  >  55283 [PSH, ACK] Seq=1 Ack=2491 Win=2134 Len=39"
"6","0.035864800","100.84.170.161","151.101.2.187","TCP","66","55283  >  443 [ACK] Seq=2491 Ack=40 Win=511 Len=0 SLE=1 SRE=40"
"7","0.548055100","151.101.2.187","100.84.170.161","TCP","14614","443  >  55283 [ACK] Seq=40 Ack=2491 Win=2134 Len=14560 [TCP PDU reassembled in 8]"
"8","0.548055100","151.101.2.187","100.84.170.161","TLSv1.2","1330","Application Data"
"9","0.548055100","151.101.2.187","100.84.170.161","TLSv1.2","43734","Application Data, Application Data"
"10","0.548055100","151.101.2.187","100.84.170.161","TLSv1.2","874","Application Data"
"11","0.548055100","151.101.2.187","100.84.170.161","TCP","874","[TCP Retransmission] 443  >  55283 [PSH, ACK] Seq=59556 Ack=2491 Win=2134 Len=820 [TCP PDU reassembled in 10]"
"12","0.548227700","100.84.170.161","151.101.2.187","TCP","66","55283  >  443 [ACK] Seq=2491 Ack=60376 Win=513 Len=0 SLE=59556 SRE=60376"
"13","0.551597500","100.84.170.161","151.101.2.187","TLSv1.2","89","Application Data"
"14","0.560292000","151.101.2.187","100.84.170.161","TCP","56","443  >  55283 [ACK] Seq=60376 Ack=2526 Win=2134 Len=0"
"15","0.914215000","100.84.170.161","151.101.2.187","TLSv1.2","2520","Application Data"
"16","0.914422400","100.84.170.161","151.101.2.187","TLSv1.2","2514","Application Data"
"17","0.925482200","100.84.170.161","151.101.2.187","TLSv1.2","2520","Application Data"
"18","0.945356600","100.84.170.161","151.101.2.187","TCP","1514","[TCP Retransmission] 55283  >  443 [PSH, ACK] Seq=8458 Ack=60376 Win=513 Len=1460"
"19","0.967054600","100.84.170.161","151.101.2.187","TLSv1.2","2514","Application Data"
"20","0.967490700","100.84.170.161","151.101.2.187","TLSv1.2","2517","Application Data"
"21","0.967825800","100.84.170.161","151.101.2.187","TLSv1.2","2520","Application Data"
"22","0.986276600","151.101.2.187","100.84.170.161","TCP","56","443  >  55283 [ACK] Seq=60376 Ack=9918 Win=2167 Len=0"
"23","0.986276600","151.101.2.187","100.84.170.161","TLSv1.2","420","Application Data"
"24","0.987162500","100.84.170.161","151.101.2.187","TLSv1.2","2521","Application Data"
"25","1.004423000","151.101.2.187","100.84.170.161","TLSv1.2","130","Application Data"
"26","1.004423000","151.101.2.187","100.84.170.161","TCP","130","[TCP Retransmission] 443  >  55283 [PSH, ACK] Seq=60742 Ack=9918 Win=2167 Len=76"
"27","1.004634300","100.84.170.161","151.101.2.187","TCP","66","55283  >  443 [ACK] Seq=19774 Ack=60818 Win=511 Len=0 SLE=60742 SRE=60818"
"28","1.008467400","151.101.2.187","100.84.170.161","TCP","56","443  >  55283 [ACK] Seq=60818 Ack=17307 Win=2201 Len=0"
"29","1.008467400","151.101.2.187","100.84.170.161","TLSv1.2","136","Application Data"
"30","1.008467400","151.101.2.187","100.84.170.161","TLSv1.2","129","Application Data"
"31","1.008554000","100.84.170.161","151.101.2.187","TCP","54","55283  >  443 [ACK] Seq=19774 Ack=60975 Win=510 Len=0"
"32","1.010039300","151.101.2.187","100.84.170.161","TLSv1.2","129","Application Data"
"33","1.010094800","100.84.170.161","151.101.2.187","TCP","54","55283  >  443 [ACK] Seq=19774 Ack=61050 Win=510 Len=0"
"34","1.012751900","151.101.2.187","100.84.170.161","TCP","56","443  >  55283 [ACK] Seq=61050 Ack=19774 Win=2212 Len=0"
"35","1.015340300","151.101.2.187","100.84.170.161","TLSv1.2","130","Application Data"
"36","1.060154500","100.84.170.161","151.101.2.187","TCP","54","55283  >  443 [ACK] Seq=19774 Ack=61126 Win=510 Len=0"
"37","1.069757600","151.101.2.187","100.84.170.161","TCP","130","[TCP Spurious Retransmission] 443  >  55283 [PSH, ACK] Seq=61050 Ack=19774 Win=2212 Len=76"
"38","1.069842200","100.84.170.161","151.101.2.187","TCP","66","[TCP Dup ACK 36#1] 55283  >  443 [ACK] Seq=19774 Ack=61126 Win=510 Len=0 SLE=61050 SRE=61126"
"39","1.314739800","100.84.170.161","151.101.2.187","TLSv1.2","2518","Application Data"
"40","1.323903700","151.101.2.187","100.84.170.161","TCP","56","443  >  55283 [ACK] Seq=61126 Ack=22238 Win=2224 Len=0"
"41","1.326552400","151.101.2.187","100.84.170.161","TLSv1.2","209","Application Data"
"42","1.366740500","151.101.2.187","100.84.170.161","TCP","209","[TCP Retransmission] 443  >  55283 [PSH, ACK] Seq=61126 Ack=22238 Win=2224 Len=155"
"43","1.366790200","100.84.170.161","151.101.2.187","TCP","66","55283  >  443 [ACK] Seq=22238 Ack=61281 Win=509 Len=0 SLE=61126 SRE=61281"
"44","1.733599800","100.84.170.161","151.101.2.187","TLSv1.2","2525","Application Data"
"45","1.734010700","100.84.170.161","151.101.2.187","TLSv1.2","2524","Application Data"
"46","1.744551000","151.101.2.187","100.84.170.161","TCP","56","443  >  55283 [ACK] Seq=61281 Ack=24709 Win=2235 Len=0"
"47","1.744640000","151.101.2.187","100.84.170.161","TCP","56","443  >  55283 [ACK] Seq=61281 Ack=27179 Win=2246 Len=0"
"48","1.747362200","151.101.2.187","100.84.170.161","TLSv1.2","213","Application Data"
"49","1.747766800","151.101.2.187","100.84.170.161","TLSv1.2","98","Application Data"
"50","1.747806300","100.84.170.161","151.101.2.187","TCP","54","55283  >  443 [ACK] Seq=27179 Ack=61484 Win=508 Len=0"
"51","3.225037100","100.84.170.161","151.101.2.187","TLSv1.2","2520","Application Data"
"52","3.231050200","100.84.170.161","151.101.2.187","TLSv1.2","2521","Application Data"
"53","3.256853600","100.84.170.161","151.101.2.187","TCP","1514","[TCP Retransmission] 55283  >  443 [PSH, ACK] Seq=30652 Ack=61484 Win=508 Len=1460"
"54","3.288029700","151.101.2.187","100.84.170.161","TCP","56","443  >  55283 [ACK] Seq=61484 Ack=29645 Win=2258 Len=0"
"55","3.288318200","151.101.2.187","100.84.170.161","TLSv1.2","213","Application Data"
"56","3.310703800","151.101.2.187","100.84.170.161","TCP","56","443  >  55283 [ACK] Seq=61643 Ack=32112 Win=2269 Len=0"
"57","3.311013000","151.101.2.187","100.84.170.161","TLSv1.2","103","Application Data"
"58","3.311044600","100.84.170.161","151.101.2.187","TCP","54","55283  >  443 [ACK] Seq=32112 Ack=61692 Win=508 Len=0"
"59","3.335060300","151.101.2.187","100.84.170.161","TCP","66","[TCP Dup ACK 56#1] 443  >  55283 [ACK] Seq=61692 Ack=32112 Win=2269 Len=0 SLE=30652 SRE=32112"
"60","3.335758500","151.101.2.187","100.84.170.161","TCP","103","[TCP Spurious Retransmission] 443  >  55283 [PSH, ACK] Seq=61643 Ack=32112 Win=2269 Len=49"
"61","3.335800200","100.84.170.161","151.101.2.187","TCP","66","[TCP Dup ACK 58#1] 55283  >  443 [ACK] Seq=32112 Ack=61692 Win=508 Len=0 SLE=61643 SRE=61692"
"62","3.473113100","100.84.170.161","151.101.2.187","TLSv1.2","2516","Application Data"
"63","3.474281200","100.84.170.161","151.101.2.187","TLSv1.2","2514","Application Data"
"64","3.482316800","151.101.2.187","100.84.170.161","TCP","56","443  >  55283 [ACK] Seq=61692 Ack=34574 Win=2281 Len=0"
"65","3.483427300","151.101.2.187","100.84.170.161","TCP","56","443  >  55283 [ACK] Seq=61692 Ack=37034 Win=2292 Len=0"
"66","3.484805400","151.101.2.187","100.84.170.161","TLSv1.2","174","Application Data"
"67","3.485395900","151.101.2.187","100.84.170.161","TLSv1.2","136","Application Data"
"68","3.485495500","100.84.170.161","151.101.2.187","TCP","54","55283  >  443 [ACK] Seq=37034 Ack=61894 Win=513 Len=0"
"69","4.612122000","100.84.170.161","151.101.2.187","TLSv1.2","2524","Application Data"
"70","4.612359500","100.84.170.161","151.101.2.187","TLSv1.2","2525","Application Data"
"71","4.620765800","151.101.2.187","100.84.170.161","TCP","56","443  >  55283 [ACK] Seq=61894 Ack=39504 Win=2303 Len=0"
"72","4.621395300","151.101.2.187","100.84.170.161","TCP","56","443  >  55283 [ACK] Seq=61894 Ack=41975 Win=2315 Len=0"
"73","4.624820000","151.101.2.187","100.84.170.161","TLSv1.2","317","Application Data"
"74","4.625140700","151.101.2.187","100.84.170.161","TLSv1.2","103","Application Data"
"75","4.625198500","100.84.170.161","151.101.2.187","TCP","54","55283  >  443 [ACK] Seq=41975 Ack=62206 Win=512 Len=0"
"76","5.120968800","100.84.170.161","151.101.2.187","TLSv1.2","2520","Application Data"
"77","5.123549600","100.84.170.161","151.101.2.187","TLSv1.2","2521","Application Data"
"78","5.129479900","151.101.2.187","100.84.170.161","TCP","56","443  >  55283 [ACK] Seq=62206 Ack=44441 Win=2326 Len=0"
"79","5.132542800","151.101.2.187","100.84.170.161","TCP","56","443  >  55283 [ACK] Seq=62206 Ack=46908 Win=2338 Len=0"
"80","5.132776500","151.101.2.187","100.84.170.161","TLSv1.2","218","Application Data"
"81","5.135305200","151.101.2.187","100.84.170.161","TLSv1.2","98","Application Data"
"82","5.135415000","100.84.170.161","151.101.2.187","TCP","54","55283  >  443 [ACK] Seq=46908 Ack=62414 Win=511 Len=0"
"83","5.983139600","100.84.170.161","151.101.2.187","TLSv1.2","2416","Application Data"
"84","5.983294900","100.84.170.161","151.101.2.187","TLSv1.2","2420","Application Data"
"85","5.983388700","100.84.170.161","151.101.2.187","TLSv1.2","2414","Application Data"
"86","5.983468100","100.84.170.161","151.101.2.187","TLSv1.2","2420","Application Data"
"87","5.983751400","100.84.170.161","151.101.2.187","TLSv1.2","2417","Application Data"
"88","5.986062200","100.84.170.161","151.101.2.187","TLSv1.2","2414","Application Data"
"89","5.993058000","100.84.170.161","151.101.2.187","TLSv1.2","2418","Application Data"
"90","5.993955800","151.101.2.187","100.84.170.161","TCP","56","443  >  55283 [ACK] Seq=62414 Ack=51636 Win=2360 Len=0"
"91","5.994430700","151.101.2.187","100.84.170.161","TCP","56","443  >  55283 [ACK] Seq=62414 Ack=58725 Win=2395 Len=0"
"92","5.994738400","151.101.2.187","100.84.170.161","TCP","56","443  >  55283 [ACK] Seq=62414 Ack=61085 Win=2406 Len=0"
"93","5.996482200","151.101.2.187","100.84.170.161","TLSv1.2","214","Application Data"
"94","5.996826300","151.101.2.187","100.84.170.161","TLSv1.2","129","Application Data"
"95","5.996868000","100.84.170.161","151.101.2.187","TCP","54","55283  >  443 [ACK] Seq=63449 Ack=62649 Win=510 Len=0"
"96","5.997185100","151.101.2.187","100.84.170.161","TLSv1.2","209","Application Data"
"97","5.997836400","151.101.2.187","100.84.170.161","TLSv1.2","206","Application Data, Application Data"
"98","5.997898400","100.84.170.161","151.101.2.187","TCP","54","55283  >  443 [ACK] Seq=63449 Ack=62956 Win=509 Len=0"
"99","5.998723500","151.101.2.187","100.84.170.161","TLSv1.2","129","Application Data"
"100","5.998783200","100.84.170.161","151.101.2.187","TCP","54","55283  >  443 [ACK] Seq=63449 Ack=63031 Win=508 Len=0"
"101","6.002664700","151.101.2.187","100.84.170.161","TCP","56","443  >  55283 [ACK] Seq=63031 Ack=63449 Win=2417 Len=0"
"102","6.006050900","151.101.2.187","100.84.170.161","TLSv1.2","174","Application Data"
"103","6.031743600","100.84.170.161","151.101.2.187","TLSv1.2","2414","Application Data"
"104","6.031894200","100.84.170.161","151.101.2.187","TLSv1.2","2420","Application Data"
"105","6.031985600","100.84.170.161","151.101.2.187","TLSv1.2","2421","Application Data"
"106","6.037878700","151.101.2.187","100.84.170.161","TCP","174","[TCP Spurious Retransmission] 443  >  55283 [PSH, ACK] Seq=63031 Ack=63449 Win=2417 Len=120"
"107","6.037962200","100.84.170.161","151.101.2.187","TCP","66","[TCP Dup ACK 103#1] 55283  >  443 [ACK] Seq=70542 Ack=63151 Win=508 Len=0 SLE=63031 SRE=63151"
"108","6.041003100","151.101.2.187","100.84.170.161","TCP","56","443  >  55283 [ACK] Seq=63151 Ack=65809 Win=2429 Len=0"
"109","6.041307900","151.101.2.187","100.84.170.161","TCP","56","443  >  55283 [ACK] Seq=63151 Ack=70542 Win=2452 Len=0"
"110","6.043734600","151.101.2.187","100.84.170.161","TLSv1.2","136","Application Data"
"111","6.044072600","151.101.2.187","100.84.170.161","TLSv1.2","130","Application Data"
"112","6.044121500","100.84.170.161","151.101.2.187","TCP","54","55283  >  443 [ACK] Seq=70542 Ack=63309 Win=507 Len=0"
"113","6.045893800","151.101.2.187","100.84.170.161","TLSv1.2","207","Application Data"
"114","6.081833800","151.101.2.187","100.84.170.161","TCP","207","[TCP Retransmission] 443  >  55283 [PSH, ACK] Seq=63309 Ack=70542 Win=2452 Len=153"
"115","6.081870600","100.84.170.161","151.101.2.187","TCP","66","55283  >  443 [ACK] Seq=70542 Ack=63462 Win=513 Len=0 SLE=63309 SRE=63462"
"116","6.746800500","100.84.170.161","151.101.2.187","TLSv1.2","2416","Application Data"
"117","6.749262200","100.84.170.161","151.101.2.187","TLSv1.2","2417","Application Data"
"118","6.756854600","151.101.2.187","100.84.170.161","TCP","56","443  >  55283 [ACK] Seq=63462 Ack=72904 Win=2463 Len=0"
"119","6.758227200","151.101.2.187","100.84.170.161","TCP","56","443  >  55283 [ACK] Seq=63462 Ack=75267 Win=2475 Len=0"
"120","6.759611100","151.101.2.187","100.84.170.161","TLSv1.2","208","Application Data"
"121","6.760175800","151.101.2.187","100.84.170.161","TLSv1.2","108","Application Data"
"122","6.760226100","100.84.170.161","151.101.2.187","TCP","54","55283  >  443 [ACK] Seq=75267 Ack=63670 Win=512 Len=0"
"123","7.833409600","100.84.170.161","151.101.2.187","TLSv1.2","2416","Application Data"
"124","7.844696000","151.101.2.187","100.84.170.161","TCP","56","443  >  55283 [ACK] Seq=63670 Ack=77629 Win=2486 Len=0"
"125","7.847573300","151.101.2.187","100.84.170.161","TLSv1.2","240","Application Data"
"126","7.874623800","151.101.2.187","100.84.170.161","TCP","240","[TCP Retransmission] 443  >  55283 [PSH, ACK] Seq=63670 Ack=77629 Win=2486 Len=186"
"127","7.874724000","100.84.170.161","151.101.2.187","TCP","66","55283  >  443 [ACK] Seq=77629 Ack=63856 Win=511 Len=0 SLE=63670 SRE=63856"
"128","8.052923800","100.84.170.161","151.101.2.187","TLSv1.2","2414","Application Data"
"129","8.063483600","151.101.2.187","100.84.170.161","TCP","56","443  >  55283 [ACK] Seq=63856 Ack=79989 Win=2497 Len=0"
"130","8.066643200","151.101.2.187","100.84.170.161","TLSv1.2","131","Application Data"
"131","8.094729900","151.101.2.187","100.84.170.161","TCP","131","[TCP Retransmission] 443  >  55283 [PSH, ACK] Seq=63856 Ack=79989 Win=2497 Len=77"
"132","8.094785600","100.84.170.161","151.101.2.187","TCP","66","55283  >  443 [ACK] Seq=79989 Ack=63933 Win=511 Len=0 SLE=63856 SRE=63933"
"133","8.475391000","100.84.170.161","151.101.2.187","TLSv1.2","2415","Application Data"
"134","8.485645900","151.101.2.187","100.84.170.161","TCP","56","443  >  55283 [ACK] Seq=63933 Ack=82350 Win=2509 Len=0"
"135","8.490463800","151.101.2.187","100.84.170.161","TLSv1.2","207","Application Data"
"136","8.517746800","151.101.2.187","100.84.170.161","TCP","207","[TCP Retransmission] 443  >  55283 [PSH, ACK] Seq=63933 Ack=82350 Win=2509 Len=153"
"137","8.517819000","100.84.170.161","151.101.2.187","TCP","66","55283  >  443 [ACK] Seq=82350 Ack=64086 Win=510 Len=0 SLE=63933 SRE=64086"
"138","9.967780500","100.84.170.161","151.101.2.187","TLSv1.2","2408","Application Data"
"139","9.967985000","100.84.170.161","151.101.2.187","TLSv1.2","2402","Application Data"
"140","9.968117100","100.84.170.161","151.101.2.187","TLSv1.2","2409","Application Data"
"141","9.968224200","100.84.170.161","151.101.2.187","TLSv1.2","2408","Application Data"
"142","9.968843000","100.84.170.161","151.101.2.187","TLSv1.2","2402","Application Data"
"143","9.968992200","100.84.170.161","151.101.2.187","TLSv1.2","2402","Application Data"
"144","9.969119200","100.84.170.161","151.101.2.187","TLSv1.2","2405","Application Data"
"145","9.969260400","100.84.170.161","151.101.2.187","TLSv1.2","2402","Application Data"
"146","9.969387400","100.84.170.161","151.101.2.187","TLSv1.2","2408","Application Data"
"147","9.969507200","100.84.170.161","151.101.2.187","TLSv1.2","2399","Application Data"
"148","9.978400000","151.101.2.187","100.84.170.161","TCP","56","443  >  55283 [ACK] Seq=64086 Ack=87052 Win=2532 Len=0"
"149","9.978651900","151.101.2.187","100.84.170.161","TCP","56","443  >  55283 [ACK] Seq=64086 Ack=103510 Win=2611 Len=0"
"150","9.978964700","151.101.2.187","100.84.170.161","TCP","56","443  >  55283 [ACK] Seq=64086 Ack=105855 Win=2623 Len=0"
"151","9.985331900","151.101.2.187","100.84.170.161","TLSv1.2","295","Application Data"
"152","9.990256000","151.101.2.187","100.84.170.161","TLSv1.2","234","Application Data"
"153","9.990319500","100.84.170.161","151.101.2.187","TCP","54","55283  >  443 [ACK] Seq=105855 Ack=64507 Win=509 Len=0"
"154","9.991106000","151.101.2.187","100.84.170.161","TLSv1.2","130","Application Data"
"155","9.992616800","151.101.2.187","100.84.170.161","TLSv1.2","322","Application Data"
"156","9.992616800","151.101.2.187","100.84.170.161","TLSv1.2","130","Application Data"
"157","9.992672600","100.84.170.161","151.101.2.187","TCP","54","55283  >  443 [ACK] Seq=105855 Ack=64927 Win=513 Len=0"
"158","9.992914000","151.101.2.187","100.84.170.161","TLSv1.2","130","Application Data"
"159","9.992940800","100.84.170.161","151.101.2.187","TCP","54","55283  >  443 [ACK] Seq=105855 Ack=65003 Win=512 Len=0"
"160","9.999457300","100.84.170.161","151.101.2.187","TLSv1.2","2419","Application Data"
"161","9.999662100","100.84.170.161","151.101.2.187","TLSv1.2","2414","Application Data"
"162","10.008971400","151.101.2.187","100.84.170.161","TCP","56","443  >  55283 [ACK] Seq=65003 Ack=110580 Win=2646 Len=0"
"163","10.012048100","151.101.2.187","100.84.170.161","TLSv1.2","131","Application Data"
"164","10.012594100","151.101.2.187","100.84.170.161","TLSv1.2","209","Application Data"
"165","10.012634800","100.84.170.161","151.101.2.187","TCP","54","55283  >  443 [ACK] Seq=110580 Ack=65235 Win=512 Len=0"
"166","11.298029400","100.84.170.161","151.101.2.187","TLSv1.2","2418","Application Data"
"167","11.308886000","151.101.2.187","100.84.170.161","TCP","56","443  >  55283 [ACK] Seq=65235 Ack=112944 Win=2657 Len=0"
"168","11.312363700","151.101.2.187","100.84.170.161","TLSv1.2","241","Application Data"
"169","11.340896000","151.101.2.187","100.84.170.161","TCP","241","[TCP Retransmission] 443  >  55283 [PSH, ACK] Seq=65235 Ack=112944 Win=2657 Len=187"
"170","11.340940000","100.84.170.161","151.101.2.187","TCP","66","55283  >  443 [ACK] Seq=112944 Ack=65422 Win=511 Len=0 SLE=65235 SRE=65422"
"171","11.455074700","100.84.170.161","151.101.2.187","TLSv1.2","2419","Application Data"
"172","11.465106200","151.101.2.187","100.84.170.161","TCP","56","443  >  55283 [ACK] Seq=65422 Ack=115309 Win=2668 Len=0"
"173","11.468175800","151.101.2.187","100.84.170.161","TLSv1.2","129","Application Data"
"174","11.496584400","151.101.2.187","100.84.170.161","TCP","129","[TCP Retransmission] 443  >  55283 [PSH, ACK] Seq=65422 Ack=115309 Win=2668 Len=75"
"175","11.496626200","100.84.170.161","151.101.2.187","TCP","66","55283  >  443 [ACK] Seq=115309 Ack=65497 Win=511 Len=0 SLE=65422 SRE=65497"
"176","15.179637800","100.84.170.161","151.101.2.187","TLSv1.2","1852","Application Data"
"177","15.188608700","151.101.2.187","100.84.170.161","TCP","56","443  >  55283 [ACK] Seq=65497 Ack=117107 Win=2674 Len=0"
"178","15.248513400","151.101.2.187","100.84.170.161","TLSv1.2","339","Application Data"
"179","15.248766200","151.101.2.187","100.84.170.161","TLSv1.2","357","Application Data"
"180","15.248854500","100.84.170.161","151.101.2.187","TCP","54","55283  >  443 [ACK] Seq=117107 Ack=66085 Win=508 Len=0"
"181","15.251427800","100.84.170.161","151.101.2.187","TLSv1.2","89","Application Data"
"182","15.259969800","151.101.2.187","100.84.170.161","TCP","56","443  >  55283 [ACK] Seq=66085 Ack=117142 Win=2674 Len=0"
"183","19.220583800","100.84.170.161","151.101.2.187","TCP","55","56939  >  443 [ACK] Seq=1 Ack=1 Win=508 Len=1"
"184","19.230726200","151.101.2.187","100.84.170.161","TCP","66","443  >  56939 [ACK] Seq=1 Ack=2 Win=285 Len=0 SLE=1 SRE=2"
"185","19.594337500","100.84.170.161","151.101.2.187","TLSv1.2","813","Application Data"
"186","19.595590500","100.84.170.161","151.101.2.187","TLSv1.2","1833","Application Data"
"187","19.603807900","151.101.2.187","100.84.170.161","TCP","56","443  >  55283 [ACK] Seq=66085 Ack=117901 Win=2680 Len=0"
"188","19.604951400","151.101.2.187","100.84.170.161","TCP","56","443  >  55283 [ACK] Seq=66085 Ack=119680 Win=2686 Len=0"
"189","19.607002700","151.101.2.187","100.84.170.161","TLSv1.2","367","Application Data"
"190","19.608896000","151.101.2.187","100.84.170.161","TLSv1.2","135","Application Data"
"191","19.609013500","100.84.170.161","151.101.2.187","TCP","54","55283  >  443 [ACK] Seq=119680 Ack=66479 Win=513 Len=0"
"192","20.518449900","100.84.170.161","151.101.2.187","TLSv1.2","832","Application Data"
"193","20.529640300","151.101.2.187","100.84.170.161","TCP","56","443  >  55283 [ACK] Seq=66479 Ack=120458 Win=2691 Len=0"
"194","20.531800100","151.101.2.187","100.84.170.161","TLSv1.2","213","Application Data"
"195","20.561037700","151.101.2.187","100.84.170.161","TCP","213","[TCP Retransmission] 443  >  55283 [PSH, ACK] Seq=66479 Ack=120458 Win=2691 Len=159"
"196","20.561126000","100.84.170.161","151.101.2.187","TCP","66","55283  >  443 [ACK] Seq=120458 Ack=66638 Win=512 Len=0 SLE=66479 SRE=66638"
"197","21.082658700","100.84.170.161","151.101.2.187","TLSv1.2","1845","Application Data"
"198","21.084292900","100.84.170.161","151.101.2.187","TLSv1.2","811","Application Data"
"199","21.086797100","100.84.170.161","151.101.2.187","TLSv1.2","1837","Application Data"
"200","21.091558200","151.101.2.187","100.84.170.161","TCP","56","443  >  55283 [ACK] Seq=66638 Ack=122249 Win=2697 Len=0"
"201","21.093024300","151.101.2.187","100.84.170.161","TCP","56","443  >  55283 [ACK] Seq=66638 Ack=123006 Win=2703 Len=0"
"202","21.094390300","100.84.170.161","151.101.2.187","TLSv1.2","824","Application Data"
"203","21.095527600","151.101.2.187","100.84.170.161","TCP","56","443  >  55283 [ACK] Seq=66638 Ack=124789 Win=2708 Len=0"
"204","21.099713000","151.101.2.187","100.84.170.161","TLSv1.2","291","Application Data"
"205","21.100242000","151.101.2.187","100.84.170.161","TLSv1.2","130","Application Data"
"206","21.100288100","100.84.170.161","151.101.2.187","TCP","54","55283  >  443 [ACK] Seq=125559 Ack=66951 Win=511 Len=0"
"207","21.100552900","151.101.2.187","100.84.170.161","TLSv1.2","130","Application Data"
"208","21.102923700","151.101.2.187","100.84.170.161","TCP","56","443  >  55283 [ACK] Seq=67027 Ack=125559 Win=2714 Len=0"
"209","21.105698200","151.101.2.187","100.84.170.161","TLSv1.2","103","Application Data"
"210","21.105757400","100.84.170.161","151.101.2.187","TCP","54","55283  >  443 [ACK] Seq=125559 Ack=67076 Win=510 Len=0"
"211","21.249163400","100.84.170.161","151.101.2.187","TLSv1.2","1859","Application Data"
"212","21.259595100","151.101.2.187","100.84.170.161","TCP","56","443  >  55283 [ACK] Seq=67076 Ack=127364 Win=2720 Len=0"
"213","21.264226200","151.101.2.187","100.84.170.161","TLSv1.2","130","Application Data"
"214","21.269848300","100.84.170.161","151.101.2.187","TLSv1.2","818","Application Data"
"215","21.278486200","151.101.2.187","100.84.170.161","TCP","56","443  >  55283 [ACK] Seq=67152 Ack=128128 Win=2725 Len=0"
"216","21.280760300","151.101.2.187","100.84.170.161","TLSv1.2","130","Application Data"
"217","21.309692300","151.101.2.187","100.84.170.161","TCP","130","[TCP Retransmission] 443  >  55283 [PSH, ACK] Seq=67152 Ack=128128 Win=2725 Len=76"
"218","21.309748400","100.84.170.161","151.101.2.187","TCP","66","55283  >  443 [ACK] Seq=128128 Ack=67228 Win=510 Len=0 SLE=67152 SRE=67228"
"219","21.344641600","100.84.170.161","151.101.2.187","TLSv1.2","1843","Application Data"
"220","21.353433400","151.101.2.187","100.84.170.161","TCP","56","443  >  55283 [ACK] Seq=67228 Ack=129917 Win=2731 Len=0"
"221","21.356226800","151.101.2.187","100.84.170.161","TLSv1.2","130","Application Data"
"222","21.383654700","151.101.2.187","100.84.170.161","TCP","130","[TCP Retransmission] 443  >  55283 [PSH, ACK] Seq=67228 Ack=129917 Win=2731 Len=76"
"223","21.383695400","100.84.170.161","151.101.2.187","TCP","66","55283  >  443 [ACK] Seq=129917 Ack=67304 Win=510 Len=0 SLE=67228 SRE=67304"
"224","21.438600300","100.84.170.161","151.101.2.187","TLSv1.2","811","Application Data"
"225","21.447776600","151.101.2.187","100.84.170.161","TCP","56","443  >  55283 [ACK] Seq=67304 Ack=130674 Win=2737 Len=0"
"226","21.451249100","151.101.2.187","100.84.170.161","TLSv1.2","130","Application Data"
"227","21.453656900","100.84.170.161","151.101.2.187","TLSv1.2","1868","Application Data"
"228","21.462975600","151.101.2.187","100.84.170.161","TCP","56","443  >  55283 [ACK] Seq=67380 Ack=132488 Win=2743 Len=0"
"229","21.465574500","151.101.2.187","100.84.170.161","TLSv1.2","173","Application Data"
"230","21.492655700","151.101.2.187","100.84.170.161","TCP","173","[TCP Retransmission] 443  >  55283 [PSH, ACK] Seq=67380 Ack=132488 Win=2743 Len=119"
"231","21.492704500","100.84.170.161","151.101.2.187","TCP","66","55283  >  443 [ACK] Seq=132488 Ack=67499 Win=509 Len=0 SLE=67380 SRE=67499"
"232","21.699332500","100.84.170.161","151.101.2.187","TLSv1.2","800","Application Data"
"233","21.699481300","100.84.170.161","151.101.2.187","TLSv1.2","1847","Application Data"
"234","21.699578400","100.84.170.161","151.101.2.187","TLSv1.2","797","Application Data"
"235","21.699967800","100.84.170.161","151.101.2.187","TLSv1.2","1838","Application Data"
"236","21.710342100","151.101.2.187","100.84.170.161","TCP","56","443  >  55283 [ACK] Seq=67499 Ack=135027 Win=2754 Len=0"
"237","21.710626900","151.101.2.187","100.84.170.161","TCP","56","443  >  55283 [ACK] Seq=67499 Ack=135770 Win=2760 Len=0"
"238","21.710906300","151.101.2.187","100.84.170.161","TCP","56","443  >  55283 [ACK] Seq=67499 Ack=137554 Win=2765 Len=0"
"239","21.711639400","151.101.2.187","100.84.170.161","TLSv1.2","213","Application Data"
"240","21.712008800","151.101.2.187","100.84.170.161","TLSv1.2","135","Application Data"
"241","21.712051900","100.84.170.161","151.101.2.187","TCP","54","55283  >  443 [ACK] Seq=137554 Ack=67739 Win=508 Len=0"
"242","21.712417200","151.101.2.187","100.84.170.161","TLSv1.2","130","Application Data"
"243","21.712704000","151.101.2.187","100.84.170.161","TLSv1.2","318","Application Data"
"244","21.712733500","100.84.170.161","151.101.2.187","TCP","54","55283  >  443 [ACK] Seq=137554 Ack=68079 Win=513 Len=0"
"245","22.085921500","100.84.170.161","151.101.2.187","TLSv1.2","828","Application Data"
"246","22.095974200","151.101.2.187","100.84.170.161","TCP","56","443  >  55283 [ACK] Seq=68079 Ack=138328 Win=2771 Len=0"
"247","22.098668400","151.101.2.187","100.84.170.161","TLSv1.2","240","Application Data"
"248","22.116632400","100.84.170.161","151.101.2.187","TLSv1.2","1833","Application Data"
"249","22.125731700","151.101.2.187","100.84.170.161","TCP","56","443  >  55283 [ACK] Seq=68265 Ack=140107 Win=2777 Len=0"
"250","22.128012800","151.101.2.187","100.84.170.161","TLSv1.2","131","Application Data"
"251","22.158717500","151.101.2.187","100.84.170.161","TCP","131","[TCP Retransmission] 443  >  55283 [PSH, ACK] Seq=68265 Ack=140107 Win=2777 Len=77"
"252","22.158760400","100.84.170.161","151.101.2.187","TCP","66","55283  >  443 [ACK] Seq=140107 Ack=68342 Win=512 Len=0 SLE=68265 SRE=68342"
"253","22.219785500","100.84.170.161","151.101.2.187","TLSv1.2","839","Application Data"
"254","22.228671300","151.101.2.187","100.84.170.161","TCP","56","443  >  55283 [ACK] Seq=68342 Ack=140892 Win=2782 Len=0"
"255","22.231296500","151.101.2.187","100.84.170.161","TLSv1.2","130","Application Data"
"256","22.262180600","100.84.170.161","151.101.2.187","TLSv1.2","1844","Application Data"
"257","22.262627400","151.101.2.187","100.84.170.161","TCP","130","[TCP Spurious Retransmission] 443  >  55283 [PSH, ACK] Seq=68342 Ack=140892 Win=2782 Len=76"
"258","22.262666500","100.84.170.161","151.101.2.187","TCP","66","[TCP Dup ACK 256#1] 55283  >  443 [ACK] Seq=142682 Ack=68418 Win=511 Len=0 SLE=68342 SRE=68418"
"259","22.271976700","151.101.2.187","100.84.170.161","TCP","56","443  >  55283 [ACK] Seq=68418 Ack=142682 Win=2788 Len=0"
"260","22.275721200","151.101.2.187","100.84.170.161","TLSv1.2","103","Application Data"
"261","22.306497200","151.101.2.187","100.84.170.161","TCP","103","[TCP Retransmission] 443  >  55283 [PSH, ACK] Seq=68418 Ack=142682 Win=2788 Len=49"
"262","22.306540400","100.84.170.161","151.101.2.187","TCP","66","55283  >  443 [ACK] Seq=142682 Ack=68467 Win=511 Len=0 SLE=68418 SRE=68467"
"263","31.809591400","100.84.170.161","151.101.2.187","TLSv1.2","825","Application Data"
"264","31.819317700","151.101.2.187","100.84.170.161","TCP","56","443  >  55283 [ACK] Seq=68467 Ack=143453 Win=2794 Len=0"
"265","31.822545700","100.84.170.161","151.101.2.187","TLSv1.2","1829","Application Data"
"266","31.823899700","151.101.2.187","100.84.170.161","TLSv1.2","240","Application Data"
"267","31.826317100","100.84.170.161","151.101.2.187","TLSv1.2","839","Application Data"
"268","31.826461600","100.84.170.161","151.101.2.187","TLSv1.2","1845","Application Data"
"269","31.832587600","151.101.2.187","100.84.170.161","TCP","56","443  >  55283 [ACK] Seq=68653 Ack=145228 Win=2800 Len=0"
"270","31.835668000","151.101.2.187","100.84.170.161","TCP","56","443  >  55283 [ACK] Seq=68653 Ack=146013 Win=2805 Len=0"
"271","31.836224400","151.101.2.187","100.84.170.161","TCP","56","443  >  55283 [ACK] Seq=68653 Ack=147804 Win=2811 Len=0"
"272","31.836718200","151.101.2.187","100.84.170.161","TLSv1.2","174","Application Data"
"273","31.838166400","151.101.2.187","100.84.170.161","TLSv1.2","213","Application Data"
"274","31.838225400","100.84.170.161","151.101.2.187","TCP","54","55283  >  443 [ACK] Seq=147804 Ack=68932 Win=509 Len=0"
"275","31.839273900","151.101.2.187","100.84.170.161","TLSv1.2","134","Application Data"
"276","31.843365300","100.84.170.161","151.101.2.187","TLSv1.2","826","Application Data"
"277","31.851815700","151.101.2.187","100.84.170.161","TCP","56","443  >  55283 [ACK] Seq=69012 Ack=148576 Win=2817 Len=0"
"278","31.854847400","151.101.2.187","100.84.170.161","TLSv1.2","131","Application Data"
"279","31.854862000","100.84.170.161","151.101.2.187","TLSv1.2","1829","Application Data"
"280","31.859784300","100.84.170.161","151.101.2.187","TCP","55","63540  >  443 [ACK] Seq=1 Ack=1 Win=507 Len=1 [TCP PDU reassembled in 595]"
"281","31.863468300","151.101.2.187","100.84.170.161","TCP","56","443  >  55283 [ACK] Seq=69089 Ack=150351 Win=2822 Len=0"
"282","31.866586000","151.101.2.187","100.84.170.161","TLSv1.2","130","Application Data"
"283","31.868220700","151.101.2.187","100.84.170.161","TCP","66","443  >  63540 [ACK] Seq=1 Ack=2 Win=285 Len=0 SLE=1 SRE=2"
"284","31.868682700","100.84.170.161","151.101.2.187","TCP","54","55283  >  443 [ACK] Seq=150351 Ack=69165 Win=509 Len=0"
"285","31.967545700","100.84.170.161","151.101.2.187","TLSv1.2","835","Application Data"
"286","31.973699400","100.84.170.161","151.101.2.187","TLSv1.2","1829","Application Data"
"287","31.975474700","100.84.170.161","151.101.2.187","TLSv1.2","839","Application Data"
"288","31.976277800","151.101.2.187","100.84.170.161","TCP","56","443  >  55283 [ACK] Seq=69165 Ack=151132 Win=2828 Len=0"
"289","31.977109700","100.84.170.161","151.101.2.187","TLSv1.2","1852","Application Data"
"290","31.978854200","151.101.2.187","100.84.170.161","TLSv1.2","98","Application Data"
"291","31.982384800","151.101.2.187","100.84.170.161","TCP","56","443  >  55283 [ACK] Seq=69209 Ack=152907 Win=2834 Len=0"
"292","31.982487700","100.84.170.161","151.101.2.187","TLSv1.2","820","Application Data"
"293","31.984074400","151.101.2.187","100.84.170.161","TCP","56","443  >  55283 [ACK] Seq=69209 Ack=153692 Win=2840 Len=0"
"294","31.984865100","151.101.2.187","100.84.170.161","TLSv1.2","182","Application Data"
"295","31.986058500","151.101.2.187","100.84.170.161","TCP","56","443  >  55283 [ACK] Seq=69337 Ack=155490 Win=2845 Len=0"
"296","31.986577800","151.101.2.187","100.84.170.161","TLSv1.2","98","Application Data"
"297","31.986625000","100.84.170.161","151.101.2.187","TCP","54","55283  >  443 [ACK] Seq=156256 Ack=69381 Win=508 Len=0"
"298","31.987670100","100.84.170.161","151.101.2.187","TLSv1.2","1829","Application Data"
"299","31.988498400","151.101.2.187","100.84.170.161","TLSv1.2","98","Application Data"
"300","31.991058800","151.101.2.187","100.84.170.161","TCP","56","443  >  55283 [ACK] Seq=69425 Ack=156256 Win=2851 Len=0"
"301","31.993813200","151.101.2.187","100.84.170.161","TLSv1.2","98","Application Data"
"302","31.993872800","100.84.170.161","151.101.2.187","TCP","54","55283  >  443 [ACK] Seq=158031 Ack=69469 Win=507 Len=0"
"303","31.996409500","151.101.2.187","100.84.170.161","TCP","56","443  >  55283 [ACK] Seq=69469 Ack=158031 Win=2857 Len=0"
"304","31.998963700","151.101.2.187","100.84.170.161","TLSv1.2","104","Application Data"
"305","32.026767900","100.84.170.161","151.101.2.187","TLSv1.2","837","Application Data"
"306","32.034592300","151.101.2.187","100.84.170.161","TCP","104","[TCP Spurious Retransmission] 443  >  55283 [PSH, ACK] Seq=69469 Ack=158031 Win=2857 Len=50"
"307","32.034630000","100.84.170.161","151.101.2.187","TCP","66","[TCP Dup ACK 305#1] 55283  >  443 [ACK] Seq=158814 Ack=69519 Win=507 Len=0 SLE=69469 SRE=69519"
"308","32.035447000","151.101.2.187","100.84.170.161","TCP","56","443  >  55283 [ACK] Seq=69519 Ack=158814 Win=2862 Len=0"
"309","32.038919400","151.101.2.187","100.84.170.161","TLSv1.2","131","Application Data"
"310","32.070680400","151.101.2.187","100.84.170.161","TCP","131","[TCP Retransmission] 443  >  55283 [PSH, ACK] Seq=69519 Ack=158814 Win=2862 Len=77"
"311","32.070722100","100.84.170.161","151.101.2.187","TCP","66","55283  >  443 [ACK] Seq=158814 Ack=69596 Win=513 Len=0 SLE=69519 SRE=69596"
"312","32.220198400","100.84.170.161","151.101.2.187","TLSv1.2","1829","Application Data"
"313","32.230269100","151.101.2.187","100.84.170.161","TCP","56","443  >  55283 [ACK] Seq=69596 Ack=160589 Win=2868 Len=0"
"314","32.236719500","151.101.2.187","100.84.170.161","TLSv1.2","130","Application Data"
"315","32.268609200","151.101.2.187","100.84.170.161","TCP","130","[TCP Retransmission] 443  >  55283 [PSH, ACK] Seq=69596 Ack=160589 Win=2868 Len=76"
"316","32.268651400","100.84.170.161","151.101.2.187","TCP","66","55283  >  443 [ACK] Seq=160589 Ack=69672 Win=512 Len=0 SLE=69596 SRE=69672"
"317","33.659135400","100.84.170.161","151.101.2.187","TLSv1.2","839","Application Data"
"318","33.660301400","100.84.170.161","151.101.2.187","TLSv1.2","1823","Application Data"
"319","33.660563500","100.84.170.161","151.101.2.187","TLSv1.2","821","Application Data"
"320","33.663933900","100.84.170.161","151.101.2.187","TLSv1.2","1836","Application Data"
"321","33.667824800","151.101.2.187","100.84.170.161","TCP","56","443  >  55283 [ACK] Seq=69672 Ack=161374 Win=2874 Len=0"
"322","33.668916400","151.101.2.187","100.84.170.161","TCP","56","443  >  55283 [ACK] Seq=69672 Ack=163143 Win=2879 Len=0"
"323","33.669134900","151.101.2.187","100.84.170.161","TCP","56","443  >  55283 [ACK] Seq=69672 Ack=163910 Win=2885 Len=0"
"324","33.672057600","151.101.2.187","100.84.170.161","TLSv1.2","240","Application Data"
"325","33.672500900","151.101.2.187","100.84.170.161","TLSv1.2","130","Application Data"
"326","33.672562300","100.84.170.161","151.101.2.187","TCP","54","55283  >  443 [ACK] Seq=165692 Ack=69934 Win=511 Len=0"
"327","33.673427000","151.101.2.187","100.84.170.161","TLSv1.2","130","Application Data"
"328","33.677633900","151.101.2.187","100.84.170.161","TLSv1.2","130","Application Data"
"329","33.677715400","100.84.170.161","151.101.2.187","TCP","54","55283  >  443 [ACK] Seq=165692 Ack=70086 Win=511 Len=0"
"330","33.824759600","100.84.170.161","151.101.2.187","TLSv1.2","843","Application Data"
"331","33.835055400","151.101.2.187","100.84.170.161","TCP","56","443  >  55283 [ACK] Seq=70086 Ack=166481 Win=2897 Len=0"
"332","33.837578700","151.101.2.187","100.84.170.161","TLSv1.2","367","Application Data"
"333","33.867488000","151.101.2.187","100.84.170.161","TCP","367","[TCP Retransmission] 443  >  55283 [PSH, ACK] Seq=70086 Ack=166481 Win=2897 Len=313"
"334","33.867528600","100.84.170.161","151.101.2.187","TCP","66","55283  >  443 [ACK] Seq=166481 Ack=70399 Win=510 Len=0 SLE=70086 SRE=70399"
"335","33.892290800","100.84.170.161","151.101.2.187","TLSv1.2","1834","Application Data"
"336","33.892493100","100.84.170.161","151.101.2.187","TLSv1.2","814","Application Data"
"337","33.892984400","100.84.170.161","151.101.2.187","TLSv1.2","1841","Application Data"
"338","33.893083500","100.84.170.161","151.101.2.187","TLSv1.2","805","Application Data"
"339","33.901222500","151.101.2.187","100.84.170.161","TCP","56","443  >  55283 [ACK] Seq=70399 Ack=168261 Win=2902 Len=0"
"340","33.901534400","151.101.2.187","100.84.170.161","TCP","56","443  >  55283 [ACK] Seq=70399 Ack=169021 Win=2908 Len=0"
"341","33.902339100","151.101.2.187","100.84.170.161","TCP","56","443  >  55283 [ACK] Seq=70399 Ack=170808 Win=2914 Len=0"
"342","33.902339100","151.101.2.187","100.84.170.161","TCP","56","443  >  55283 [ACK] Seq=70399 Ack=171559 Win=2919 Len=0"
"343","33.908103900","151.101.2.187","100.84.170.161","TLSv1.2","321","Application Data"
"344","33.911052300","151.101.2.187","100.84.170.161","TLSv1.2","130","Application Data"
"345","33.911101000","100.84.170.161","151.101.2.187","TCP","54","55283  >  443 [ACK] Seq=171559 Ack=70742 Win=508 Len=0"
"346","34.008814100","100.84.170.161","151.101.2.187","TLSv1.2","2056","Application Data"
"347","34.017539600","151.101.2.187","100.84.170.161","TCP","56","443  >  55283 [ACK] Seq=70742 Ack=173561 Win=2925 Len=0"
"348","34.021018200","151.101.2.187","100.84.170.161","TLSv1.2","131","Application Data"
"349","34.050525700","151.101.2.187","100.84.170.161","TCP","131","[TCP Retransmission] 443  >  55283 [PSH, ACK] Seq=70742 Ack=173561 Win=2925 Len=77"
"350","34.050564900","100.84.170.161","151.101.2.187","TCP","66","55283  >  443 [ACK] Seq=173561 Ack=70819 Win=508 Len=0 SLE=70742 SRE=70819"
"351","34.318117200","100.84.170.161","151.101.2.187","TLSv1.2","624","Application Data"
"352","34.326888200","151.101.2.187","100.84.170.161","TCP","56","443  >  55283 [ACK] Seq=70819 Ack=174131 Win=2925 Len=0"
"353","34.329755700","151.101.2.187","100.84.170.161","TLSv1.2","129","Application Data"
"354","34.359573500","151.101.2.187","100.84.170.161","TCP","129","[TCP Retransmission] 443  >  55283 [PSH, ACK] Seq=70819 Ack=174131 Win=2925 Len=75"
"355","34.359601500","100.84.170.161","151.101.2.187","TCP","66","55283  >  443 [ACK] Seq=174131 Ack=70894 Win=508 Len=0 SLE=70819 SRE=70894"
"356","35.012316700","100.84.170.161","151.101.2.187","TLSv1.2","2089","Application Data"
"357","35.021139100","151.101.2.187","100.84.170.161","TCP","56","443  >  55283 [ACK] Seq=70894 Ack=176166 Win=2931 Len=0"
"358","35.021560900","100.84.170.161","151.101.2.187","TLSv1.2","563","Application Data"
"359","35.025266000","151.101.2.187","100.84.170.161","TLSv1.2","240","Application Data"
"360","35.025325200","100.84.170.161","151.101.2.187","TCP","54","55283  >  443 [ACK] Seq=176675 Ack=71080 Win=513 Len=0"
"361","35.030020200","151.101.2.187","100.84.170.161","TCP","56","443  >  55283 [ACK] Seq=71080 Ack=176675 Win=2931 Len=0"
"362","35.032939900","151.101.2.187","100.84.170.161","TLSv1.2","104","Application Data"
"363","35.033003200","100.84.170.161","151.101.2.187","TCP","54","55283  >  443 [ACK] Seq=176675 Ack=71130 Win=513 Len=0"
"364","35.181253700","100.84.170.161","151.101.2.187","TLSv1.2","2106","Application Data"
"365","35.200654400","151.101.2.187","100.84.170.161","TCP","56","443  >  55283 [ACK] Seq=71130 Ack=178727 Win=2936 Len=0"
"366","35.205281900","151.101.2.187","100.84.170.161","TLSv1.2","103","Application Data"
"367","35.232740300","151.101.2.187","100.84.170.161","TCP","103","[TCP Retransmission] 443  >  55283 [PSH, ACK] Seq=71130 Ack=178727 Win=2936 Len=49"
"368","35.232782700","100.84.170.161","151.101.2.187","TCP","66","55283  >  443 [ACK] Seq=178727 Ack=71179 Win=512 Len=0 SLE=71130 SRE=71179"
"369","35.391036000","100.84.170.161","151.101.2.187","TLSv1.2","574","Application Data"
"370","35.400978000","151.101.2.187","100.84.170.161","TCP","56","443  >  55283 [ACK] Seq=71179 Ack=179247 Win=2936 Len=0"
"371","35.405897500","151.101.2.187","100.84.170.161","TLSv1.2","103","Application Data"
"372","35.433525300","151.101.2.187","100.84.170.161","TCP","103","[TCP Retransmission] 443  >  55283 [PSH, ACK] Seq=71179 Ack=179247 Win=2936 Len=49"
"373","35.433556900","100.84.170.161","151.101.2.187","TCP","66","55283  >  443 [ACK] Seq=179247 Ack=71228 Win=512 Len=0 SLE=71179 SRE=71228"
"374","35.446949500","100.84.170.161","151.101.2.187","TLSv1.2","2081","Application Data"
"375","35.455578400","151.101.2.187","100.84.170.161","TCP","56","443  >  55283 [ACK] Seq=71228 Ack=181274 Win=2942 Len=0"
"376","35.458959700","151.101.2.187","100.84.170.161","TLSv1.2","131","Application Data"
"377","35.487576200","151.101.2.187","100.84.170.161","TCP","131","[TCP Retransmission] 443  >  55283 [PSH, ACK] Seq=71228 Ack=181274 Win=2942 Len=77"
"378","35.487603000","100.84.170.161","151.101.2.187","TCP","66","55283  >  443 [ACK] Seq=181274 Ack=71305 Win=512 Len=0 SLE=71228 SRE=71305"
"379","36.339510500","100.84.170.161","151.101.2.187","TLSv1.2","631","Application Data"
"380","36.345206200","100.84.170.161","151.101.2.187","TLSv1.2","2061","Application Data"
"381","36.345566200","100.84.170.161","151.101.2.187","TLSv1.2","635","Application Data"
"382","36.347500500","100.84.170.161","151.101.2.187","TLSv1.2","2067","Application Data"
"383","36.349781000","151.101.2.187","100.84.170.161","TCP","56","443  >  55283 [ACK] Seq=71305 Ack=181851 Win=2942 Len=0"
"384","36.351385300","151.101.2.187","100.84.170.161","TLSv1.2","367","Application Data"
"385","36.356692400","100.84.170.161","151.101.2.187","TLSv1.2","642","Application Data"
"386","36.356736700","151.101.2.187","100.84.170.161","TCP","56","443  >  55283 [ACK] Seq=71618 Ack=186452 Win=2954 Len=0"
"387","36.359985600","151.101.2.187","100.84.170.161","TLSv1.2","134","Application Data"
"388","36.360240800","151.101.2.187","100.84.170.161","TLSv1.2","130","Application Data"
"389","36.360280500","100.84.170.161","151.101.2.187","TCP","54","55283  >  443 [ACK] Seq=187040 Ack=71774 Win=510 Len=0"
"390","36.362596100","151.101.2.187","100.84.170.161","TLSv1.2","208","Application Data"
"391","36.363671000","100.84.170.161","151.101.2.187","TLSv1.2","2041","Application Data"
"392","36.365231800","151.101.2.187","100.84.170.161","TCP","56","443  >  55283 [ACK] Seq=71928 Ack=187040 Win=2954 Len=0"
"393","36.368207800","151.101.2.187","100.84.170.161","TLSv1.2","131","Application Data"
"394","36.372421800","151.101.2.187","100.84.170.161","TCP","56","443  >  55283 [ACK] Seq=72005 Ack=189027 Win=2959 Len=0"
"395","36.375568700","151.101.2.187","100.84.170.161","TLSv1.2","130","Application Data"
"396","36.375617900","100.84.170.161","151.101.2.187","TCP","54","55283  >  443 [ACK] Seq=189027 Ack=72081 Win=509 Len=0"
"397","36.408819700","100.84.170.161","151.101.2.187","TLSv1.2","653","Application Data"
"398","36.417525100","151.101.2.187","100.84.170.161","TCP","56","443  >  55283 [ACK] Seq=72081 Ack=189626 Win=2959 Len=0"
"399","36.424000000","151.101.2.187","100.84.170.161","TLSv1.2","130","Application Data"
"400","36.457236300","151.101.2.187","100.84.170.161","TCP","130","[TCP Retransmission] 443  >  55283 [PSH, ACK] Seq=72081 Ack=189626 Win=2959 Len=76"
"401","36.457278800","100.84.170.161","151.101.2.187","TCP","66","55283  >  443 [ACK] Seq=189626 Ack=72157 Win=509 Len=0 SLE=72081 SRE=72157"
"402","36.580047700","100.84.170.161","151.101.2.187","TLSv1.2","2041","Application Data"
"403","36.591529900","151.101.2.187","100.84.170.161","TCP","56","443  >  55283 [ACK] Seq=72157 Ack=191613 Win=2965 Len=0"
"404","36.594003800","151.101.2.187","100.84.170.161","TLSv1.2","130","Application Data"
"405","36.622929200","151.101.2.187","100.84.170.161","TCP","130","[TCP Retransmission] 443  >  55283 [PSH, ACK] Seq=72157 Ack=191613 Win=2965 Len=76"
"406","36.623021900","100.84.170.161","151.101.2.187","TCP","66","55283  >  443 [ACK] Seq=191613 Ack=72233 Win=508 Len=0 SLE=72157 SRE=72233"
"407","37.562670200","100.84.170.161","151.101.2.187","TLSv1.2","656","Application Data"
"408","37.576480200","151.101.2.187","100.84.170.161","TCP","56","443  >  55283 [ACK] Seq=72233 Ack=192215 Win=2965 Len=0"
"409","37.579294100","151.101.2.187","100.84.170.161","TLSv1.2","240","Application Data"
"410","37.607501700","151.101.2.187","100.84.170.161","TCP","240","[TCP Retransmission] 443  >  55283 [PSH, ACK] Seq=72233 Ack=192215 Win=2965 Len=186"
"411","37.607538600","100.84.170.161","151.101.2.187","TCP","66","55283  >  443 [ACK] Seq=192215 Ack=72419 Win=508 Len=0 SLE=72233 SRE=72419"
"412","38.145804600","100.84.170.161","151.101.2.187","TLSv1.2","2024","Application Data"
"413","38.147313700","100.84.170.161","151.101.2.187","TLSv1.2","643","Application Data"
"414","38.147818100","100.84.170.161","151.101.2.187","TLSv1.2","2029","Application Data"
"415","38.153832900","100.84.170.161","151.101.2.187","TLSv1.2","656","Application Data"
"416","38.155921400","151.101.2.187","100.84.170.161","TCP","56","443  >  55283 [ACK] Seq=72419 Ack=194774 Win=2971 Len=0"
"417","38.156618500","151.101.2.187","100.84.170.161","TCP","56","443  >  55283 [ACK] Seq=72419 Ack=196749 Win=2976 Len=0"
"418","38.159037100","151.101.2.187","100.84.170.161","TLSv1.2","240","Application Data"
"419","38.159096900","100.84.170.161","151.101.2.187","TCP","54","55283  >  443 [ACK] Seq=197351 Ack=72605 Win=513 Len=0"
"420","38.159419700","151.101.2.187","100.84.170.161","TLSv1.2","257","Application Data"
"421","38.159447400","100.84.170.161","151.101.2.187","TCP","54","55283  >  443 [ACK] Seq=197351 Ack=72808 Win=512 Len=0"
"422","38.160028100","100.84.170.161","151.101.2.187","TLSv1.2","2030","Application Data"
"423","38.160244500","151.101.2.187","100.84.170.161","TLSv1.2","130","Application Data"
"424","38.162446900","151.101.2.187","100.84.170.161","TCP","56","443  >  55283 [ACK] Seq=72884 Ack=197351 Win=2976 Len=0"
"425","38.165228900","151.101.2.187","100.84.170.161","TLSv1.2","108","Application Data"
"426","38.165286100","100.84.170.161","151.101.2.187","TCP","54","55283  >  443 [ACK] Seq=199327 Ack=72938 Win=511 Len=0"
"427","38.169395300","151.101.2.187","100.84.170.161","TCP","56","443  >  55283 [ACK] Seq=72938 Ack=199327 Win=2982 Len=0"
"428","38.171597100","151.101.2.187","100.84.170.161","TLSv1.2","130","Application Data"
"429","38.201699400","151.101.2.187","100.84.170.161","TCP","130","[TCP Retransmission] 443  >  55283 [PSH, ACK] Seq=72938 Ack=199327 Win=2982 Len=76"
"430","38.201782900","100.84.170.161","151.101.2.187","TCP","66","55283  >  443 [ACK] Seq=199327 Ack=73014 Win=511 Len=0 SLE=72938 SRE=73014"
"431","38.207043600","100.84.170.161","151.101.2.187","TLSv1.2","650","Application Data"
"432","38.215724800","151.101.2.187","100.84.170.161","TCP","56","443  >  55283 [ACK] Seq=73014 Ack=199923 Win=2982 Len=0"
"433","38.218628400","151.101.2.187","100.84.170.161","TLSv1.2","208","Application Data"
"434","38.246265300","151.101.2.187","100.84.170.161","TCP","208","[TCP Retransmission] 443  >  55283 [PSH, ACK] Seq=73014 Ack=199923 Win=2982 Len=154"
"435","38.246299500","100.84.170.161","151.101.2.187","TCP","66","55283  >  443 [ACK] Seq=199923 Ack=73168 Win=511 Len=0 SLE=73014 SRE=73168"
"436","38.303560500","100.84.170.161","151.101.2.187","TLSv1.2","2088","Application Data"
"437","38.304609900","100.84.170.161","151.101.2.187","TLSv1.2","560","Application Data"
"438","38.304780900","100.84.170.161","151.101.2.187","TLSv1.2","2095","Application Data"
"439","38.304890700","100.84.170.161","151.101.2.187","TLSv1.2","551","Application Data"
"440","38.312499900","151.101.2.187","100.84.170.161","TCP","56","443  >  55283 [ACK] Seq=73168 Ack=201957 Win=2988 Len=0"
"441","38.313198300","151.101.2.187","100.84.170.161","TCP","56","443  >  55283 [ACK] Seq=73168 Ack=202463 Win=2988 Len=0"
"442","38.313708900","151.101.2.187","100.84.170.161","TCP","56","443  >  55283 [ACK] Seq=73168 Ack=205001 Win=2993 Len=0"
"443","38.314920800","151.101.2.187","100.84.170.161","TLSv1.2","130","Application Data"
"444","38.315718300","151.101.2.187","100.84.170.161","TLSv1.2","130","Application Data"
"445","38.315777200","100.84.170.161","151.101.2.187","TCP","54","55283  >  443 [ACK] Seq=205001 Ack=73320 Win=510 Len=0"
"446","38.316493900","151.101.2.187","100.84.170.161","TLSv1.2","130","Application Data"
"447","38.316861800","151.101.2.187","100.84.170.161","TLSv1.2","130","Application Data"
"448","38.316880800","100.84.170.161","151.101.2.187","TCP","54","55283  >  443 [ACK] Seq=205001 Ack=73472 Win=509 Len=0"
"449","38.395684800","100.84.170.161","151.101.2.187","TLSv1.2","2213","Application Data"
"450","38.416209500","100.84.170.161","151.101.2.187","TLSv1.2","551","Application Data"
"451","38.431248300","100.84.170.161","151.101.2.187","TCP","1514","[TCP Retransmission] 55283  >  443 [PSH, ACK] Seq=206197 Ack=73472 Win=509 Len=1460"
"452","38.461508700","151.101.2.187","100.84.170.161","TCP","56","443  >  55283 [ACK] Seq=73472 Ack=207657 Win=2999 Len=0"
"453","38.483400700","151.101.2.187","100.84.170.161","TLSv1.2","131","Application Data"
"454","38.483721700","151.101.2.187","100.84.170.161","TLSv1.2","131","Application Data"
"455","38.483755400","100.84.170.161","151.101.2.187","TCP","54","55283  >  443 [ACK] Seq=207657 Ack=73626 Win=509 Len=0"
"456","38.484115400","151.101.2.187","100.84.170.161","TCP","66","[TCP Dup ACK 452#1] 443  >  55283 [ACK] Seq=73626 Ack=207657 Win=2999 Len=0 SLE=206197 SRE=207657"
"457","38.485102700","151.101.2.187","100.84.170.161","TCP","131","[TCP Spurious Retransmission] 443  >  55283 [PSH, ACK] Seq=73549 Ack=207657 Win=2999 Len=77"
"458","38.485148400","100.84.170.161","151.101.2.187","TCP","66","[TCP Dup ACK 455#1] 55283  >  443 [ACK] Seq=207657 Ack=73626 Win=509 Len=0 SLE=73549 SRE=73626"
"459","38.554034400","100.84.170.161","151.101.2.187","TLSv1.2","2215","Application Data"
"460","38.563378000","151.101.2.187","100.84.170.161","TCP","56","443  >  55283 [ACK] Seq=73626 Ack=209818 Win=3005 Len=0"
"461","38.566593700","151.101.2.187","100.84.170.161","TLSv1.2","98","Application Data"
"462","38.580563000","100.84.170.161","151.101.2.187","TLSv1.2","543","Application Data"
"463","38.589834700","151.101.2.187","100.84.170.161","TCP","56","443  >  55283 [ACK] Seq=73670 Ack=210307 Win=3005 Len=0"
"464","38.592480700","151.101.2.187","100.84.170.161","TLSv1.2","240","Application Data"
"465","38.621992900","151.101.2.187","100.84.170.161","TCP","240","[TCP Retransmission] 443  >  55283 [PSH, ACK] Seq=73670 Ack=210307 Win=3005 Len=186"
"466","38.622037200","100.84.170.161","151.101.2.187","TCP","66","55283  >  443 [ACK] Seq=210307 Ack=73856 Win=508 Len=0 SLE=73670 SRE=73856"
"467","43.610141000","100.84.170.161","151.101.2.187","TLSv1.2","2192","Application Data"
"468","43.618932100","151.101.2.187","100.84.170.161","TCP","56","443  >  55283 [ACK] Seq=73856 Ack=212445 Win=3011 Len=0"
"469","43.622364300","151.101.2.187","100.84.170.161","TLSv1.2","340","Application Data"
"470","43.657920700","151.101.2.187","100.84.170.161","TCP","340","[TCP Retransmission] 443  >  55283 [PSH, ACK] Seq=73856 Ack=212445 Win=3011 Len=286"
"471","43.657956700","100.84.170.161","151.101.2.187","TCP","66","55283  >  443 [ACK] Seq=212445 Ack=74142 Win=513 Len=0 SLE=73856 SRE=74142"
"472","44.454758200","100.84.170.161","151.101.2.187","TLSv1.2","815","Application Data"
"473","44.457984600","100.84.170.161","151.101.2.187","TLSv1.2","1929","Application Data"
"474","44.458796900","100.84.170.161","151.101.2.187","TLSv1.2","800","Application Data"
"475","44.463497800","151.101.2.187","100.84.170.161","TCP","56","443  >  55283 [ACK] Seq=74142 Ack=213206 Win=3016 Len=0"
"476","44.466575600","151.101.2.187","100.84.170.161","TLSv1.2","208","Application Data"
"477","44.466828000","151.101.2.187","100.84.170.161","TCP","56","443  >  55283 [ACK] Seq=74296 Ack=215081 Win=3022 Len=0"
"478","44.467754200","151.101.2.187","100.84.170.161","TCP","56","443  >  55283 [ACK] Seq=74296 Ack=215827 Win=3028 Len=0"
"479","44.469736500","151.101.2.187","100.84.170.161","TLSv1.2","135","Application Data"
"480","44.469790400","100.84.170.161","151.101.2.187","TCP","54","55283  >  443 [ACK] Seq=215827 Ack=74377 Win=512 Len=0"
"481","44.471136400","151.101.2.187","100.84.170.161","TLSv1.2","104","Application Data"
"482","44.493172800","100.84.170.161","151.101.2.187","TLSv1.2","1923","Application Data"
"483","44.505174700","151.101.2.187","100.84.170.161","TCP","56","443  >  55283 [ACK] Seq=74427 Ack=217696 Win=3033 Len=0"
"484","44.506710500","151.101.2.187","100.84.170.161","TLSv1.2","207","Application Data"
"485","44.540560200","151.101.2.187","100.84.170.161","TCP","207","[TCP Retransmission] 443  >  55283 [PSH, ACK] Seq=74427 Ack=217696 Win=3033 Len=153"
"486","44.540589900","100.84.170.161","151.101.2.187","TCP","66","55283  >  443 [ACK] Seq=217696 Ack=74580 Win=511 Len=0 SLE=74427 SRE=74580"
"487","44.612279500","100.84.170.161","151.101.2.187","TLSv1.2","800","Application Data"
"488","44.620718800","151.101.2.187","100.84.170.161","TCP","56","443  >  55283 [ACK] Seq=74580 Ack=218442 Win=3039 Len=0"
"489","44.624498200","151.101.2.187","100.84.170.161","TLSv1.2","130","Application Data"
"490","44.655287200","100.84.170.161","151.101.2.187","TLSv1.2","1932","Application Data"
"491","44.659312800","151.101.2.187","100.84.170.161","TCP","130","[TCP Spurious Retransmission] 443  >  55283 [PSH, ACK] Seq=74580 Ack=218442 Win=3039 Len=76"
"492","44.659351900","100.84.170.161","151.101.2.187","TCP","66","[TCP Dup ACK 490#1] 55283  >  443 [ACK] Seq=220320 Ack=74656 Win=511 Len=0 SLE=74580 SRE=74656"
"493","44.664544800","151.101.2.187","100.84.170.161","TCP","56","443  >  55283 [ACK] Seq=74656 Ack=220320 Win=3045 Len=0"
"494","44.668201900","151.101.2.187","100.84.170.161","TLSv1.2","131","Application Data"
"495","44.702642200","151.101.2.187","100.84.170.161","TCP","131","[TCP Retransmission] 443  >  55283 [PSH, ACK] Seq=74656 Ack=220320 Win=3045 Len=77"
"496","44.702675600","100.84.170.161","151.101.2.187","TCP","66","55283  >  443 [ACK] Seq=220320 Ack=74733 Win=510 Len=0 SLE=74656 SRE=74733"
"497","44.786925200","100.84.170.161","151.101.2.187","TLSv1.2","820","Application Data"
"498","44.789378600","100.84.170.161","151.101.2.187","TLSv1.2","1926","Application Data"
"499","44.789536600","100.84.170.161","151.101.2.187","TLSv1.2","805","Application Data"
"500","44.791394800","100.84.170.161","151.101.2.187","TLSv1.2","1922","Application Data"
"501","44.796647400","151.101.2.187","100.84.170.161","TCP","56","443  >  55283 [ACK] Seq=74733 Ack=221086 Win=3051 Len=0"
"502","44.798726800","151.101.2.187","100.84.170.161","TLSv1.2","240","Application Data"
"503","44.799359200","151.101.2.187","100.84.170.161","TCP","56","443  >  55283 [ACK] Seq=74919 Ack=222958 Win=3056 Len=0"
"504","44.799575800","151.101.2.187","100.84.170.161","TCP","56","443  >  55283 [ACK] Seq=74919 Ack=223709 Win=3062 Len=0"
"505","44.801867700","151.101.2.187","100.84.170.161","TCP","56","443  >  55283 [ACK] Seq=74919 Ack=225577 Win=3068 Len=0"
"506","44.801867700","151.101.2.187","100.84.170.161","TLSv1.2","131","Application Data"
"507","44.801927200","100.84.170.161","151.101.2.187","TCP","54","55283  >  443 [ACK] Seq=225577 Ack=74996 Win=509 Len=0"
"508","44.803231300","151.101.2.187","100.84.170.161","TLSv1.2","206","Application Data, Application Data"
"509","44.803282600","100.84.170.161","151.101.2.187","TCP","54","55283  >  443 [ACK] Seq=225577 Ack=75148 Win=509 Len=0"
"510","44.820970400","100.84.170.161","151.101.2.187","TLSv1.2","847","Application Data"
"511","44.829952200","151.101.2.187","100.84.170.161","TCP","56","443  >  55283 [ACK] Seq=75148 Ack=226370 Win=3073 Len=0"
"512","44.832922400","151.101.2.187","100.84.170.161","TLSv1.2","130","Application Data"
"513","44.864611600","151.101.2.187","100.84.170.161","TCP","130","[TCP Retransmission] 443  >  55283 [PSH, ACK] Seq=75148 Ack=226370 Win=3073 Len=76"
"514","44.864649800","100.84.170.161","151.101.2.187","TCP","66","55283  >  443 [ACK] Seq=226370 Ack=75224 Win=509 Len=0 SLE=75148 SRE=75224"
"515","44.952434900","100.84.170.161","151.101.2.187","TLSv1.2","1894","Application Data"
"516","44.954163200","100.84.170.161","151.101.2.187","TLSv1.2","858","Application Data"
"517","44.961288900","151.101.2.187","100.84.170.161","TCP","56","443  >  55283 [ACK] Seq=75224 Ack=228210 Win=3079 Len=0"
"518","44.962564900","151.101.2.187","100.84.170.161","TCP","56","443  >  55283 [ACK] Seq=75224 Ack=229014 Win=3085 Len=0"
"519","44.964348600","151.101.2.187","100.84.170.161","TLSv1.2","257","Application Data"
"520","44.964850600","151.101.2.187","100.84.170.161","TLSv1.2","130","Application Data"
"521","44.964897600","100.84.170.161","151.101.2.187","TCP","54","55283  >  443 [ACK] Seq=229014 Ack=75503 Win=507 Len=0"
"522","45.080231100","100.84.170.161","151.101.2.187","TLSv1.2","1843","Application Data"
"523","45.089229600","151.101.2.187","100.84.170.161","TCP","56","443  >  55283 [ACK] Seq=75503 Ack=230803 Win=3090 Len=0"
"524","45.164996200","151.101.2.187","100.84.170.161","TCP","1510","443  >  55283 [ACK] Seq=75503 Ack=230803 Win=3090 Len=1456 [TCP PDU reassembled in 526]"
"525","45.165699800","151.101.2.187","100.84.170.161","TCP","4422","443  >  55283 [ACK] Seq=76959 Ack=230803 Win=3090 Len=4368 [TCP PDU reassembled in 526]"
"526","45.165699800","151.101.2.187","100.84.170.161","TLSv1.2","783","Application Data"
"527","45.165771100","100.84.170.161","151.101.2.187","TCP","54","55283  >  443 [ACK] Seq=230803 Ack=82056 Win=513 Len=0"
"528","45.166650600","100.84.170.161","151.101.2.187","TLSv1.2","89","Application Data"
"529","45.175226800","151.101.2.187","100.84.170.161","TCP","56","443  >  55283 [ACK] Seq=82056 Ack=230838 Win=3090 Len=0"
"530","45.352200200","100.84.170.161","151.101.2.187","TLSv1.2","1100","Application Data"
"531","45.362509400","100.84.170.161","151.101.2.187","TLSv1.2","1636","Application Data"
"532","45.461720800","151.101.2.187","100.84.170.161","TCP","56","443  >  55283 [ACK] Seq=82056 Ack=233466 Win=3102 Len=0"
"533","45.461720800","151.101.2.187","100.84.170.161","TLSv1.2","291","Application Data"
"534","45.461720800","151.101.2.187","100.84.170.161","TLSv1.2","131","Application Data"
"535","45.461789900","100.84.170.161","151.101.2.187","TCP","54","55283  >  443 [ACK] Seq=233466 Ack=82370 Win=512 Len=0"
"536","45.502108800","100.84.170.161","151.101.2.187","TLSv1.2","1137","Application Data"
"537","45.513025200","151.101.2.187","100.84.170.161","TCP","131","[TCP Spurious Retransmission] 443  >  55283 [PSH, ACK] Seq=82293 Ack=233466 Win=3102 Len=77"
"538","45.513070700","100.84.170.161","151.101.2.187","TCP","66","[TCP Dup ACK 535#1] 55283  >  443 [ACK] Seq=234549 Ack=82370 Win=512 Len=0 SLE=82293 SRE=82370"
"539","45.562862900","151.101.2.187","100.84.170.161","TCP","56","443  >  55283 [ACK] Seq=82370 Ack=234549 Win=3108 Len=0"
"540","45.562862900","151.101.2.187","100.84.170.161","TLSv1.2","98","Application Data"
"541","45.597808400","151.101.2.187","100.84.170.161","TCP","98","[TCP Retransmission] 443  >  55283 [PSH, ACK] Seq=82370 Ack=234549 Win=3108 Len=44"
"542","45.597856300","100.84.170.161","151.101.2.187","TCP","66","55283  >  443 [ACK] Seq=234549 Ack=82414 Win=511 Len=0 SLE=82370 SRE=82414"
"543","45.606630400","100.84.170.161","151.101.2.187","TLSv1.2","1624","Application Data"
"544","45.660690500","100.84.170.161","151.101.2.187","TCP","1514","[TCP Retransmission] 55283  >  443 [PSH, ACK] Seq=234659 Ack=82414 Win=511 Len=1460"
"545","45.666773500","151.101.2.187","100.84.170.161","TCP","56","443  >  55283 [ACK] Seq=82414 Ack=236119 Win=3113 Len=0"
"546","45.666773500","151.101.2.187","100.84.170.161","TLSv1.2","130","Application Data"
"547","45.669743900","151.101.2.187","100.84.170.161","TCP","130","[TCP Retransmission] 443  >  55283 [PSH, ACK] Seq=82414 Ack=236119 Win=3113 Len=76"
"548","45.669776500","100.84.170.161","151.101.2.187","TCP","66","55283  >  443 [ACK] Seq=236119 Ack=82490 Win=511 Len=0 SLE=82414 SRE=82490"
"549","45.674901400","151.101.2.187","100.84.170.161","TCP","66","[TCP Dup ACK 545#1] 443  >  55283 [ACK] Seq=82490 Ack=236119 Win=3113 Len=0 SLE=234659 SRE=236119"
"550","45.722292200","100.84.170.161","151.101.2.187","TLSv1.2","1125","Application Data"
"551","45.725531200","100.84.170.161","151.101.2.187","TLSv1.2","1606","Application Data"
"552","45.731336500","151.101.2.187","100.84.170.161","TCP","56","443  >  55283 [ACK] Seq=82490 Ack=237190 Win=3119 Len=0"
"553","45.734841600","151.101.2.187","100.84.170.161","TCP","56","443  >  55283 [ACK] Seq=82490 Ack=238742 Win=3125 Len=0"
"554","45.743262200","151.101.2.187","100.84.170.161","TLSv1.2","367","Application Data"
"555","45.744356600","151.101.2.187","100.84.170.161","TLSv1.2","130","Application Data"
"556","45.744402400","100.84.170.161","151.101.2.187","TCP","54","55283  >  443 [ACK] Seq=238742 Ack=82879 Win=510 Len=0"
"557","45.774859300","100.84.170.161","151.101.2.187","TLSv1.2","1137","Application Data"
"558","45.783854000","151.101.2.187","100.84.170.161","TCP","56","443  >  55283 [ACK] Seq=82879 Ack=239825 Win=3130 Len=0"
"559","45.787169200","151.101.2.187","100.84.170.161","TLSv1.2","131","Application Data"
"560","45.816524400","151.101.2.187","100.84.170.161","TCP","131","[TCP Retransmission] 443  >  55283 [PSH, ACK] Seq=82879 Ack=239825 Win=3130 Len=77"
"561","45.816653600","100.84.170.161","151.101.2.187","TCP","66","55283  >  443 [ACK] Seq=239825 Ack=82956 Win=509 Len=0 SLE=82879 SRE=82956"
"562","45.927616800","100.84.170.161","151.101.2.187","TLSv1.2","1646","Application Data"
"563","45.928037900","100.84.170.161","151.101.2.187","TLSv1.2","1137","Application Data"
"564","45.935801400","100.84.170.161","151.101.2.187","TLSv1.2","1640","Application Data"
"565","45.938881600","151.101.2.187","100.84.170.161","TCP","56","443  >  55283 [ACK] Seq=82956 Ack=242500 Win=3142 Len=0"
"566","45.942602800","151.101.2.187","100.84.170.161","TLSv1.2","130","Application Data"
"567","45.943064200","151.101.2.187","100.84.170.161","TLSv1.2","130","Application Data"
"568","45.943109400","100.84.170.161","151.101.2.187","TCP","54","55283  >  443 [ACK] Seq=244086 Ack=83108 Win=509 Len=0"
"569","45.944839900","151.101.2.187","100.84.170.161","TCP","56","443  >  55283 [ACK] Seq=83108 Ack=244086 Win=3147 Len=0"
"570","45.950179400","151.101.2.187","100.84.170.161","TLSv1.2","130","Application Data"
"571","45.981575500","151.101.2.187","100.84.170.161","TCP","130","[TCP Retransmission] 443  >  55283 [PSH, ACK] Seq=83108 Ack=244086 Win=3147 Len=76"
"572","45.981618000","100.84.170.161","151.101.2.187","TCP","66","55283  >  443 [ACK] Seq=244086 Ack=83184 Win=508 Len=0 SLE=83108 SRE=83184"
"573","45.994329500","100.84.170.161","151.101.2.187","TLSv1.2","1122","Application Data"
"574","46.003668900","151.101.2.187","100.84.170.161","TCP","56","443  >  55283 [ACK] Seq=83184 Ack=245154 Win=3153 Len=0"
"575","46.008848700","151.101.2.187","100.84.170.161","TLSv1.2","98","Application Data"
"576","46.036580800","151.101.2.187","100.84.170.161","TCP","98","[TCP Retransmission] 443  >  55283 [PSH, ACK] Seq=83184 Ack=245154 Win=3153 Len=44"
"577","46.036621100","100.84.170.161","151.101.2.187","TCP","66","55283  >  443 [ACK] Seq=245154 Ack=83228 Win=508 Len=0 SLE=83184 SRE=83228"
"578","46.238058300","100.84.170.161","151.101.2.187","TLSv1.2","1638","Application Data"
"579","46.243841800","100.84.170.161","151.101.2.187","TLSv1.2","1114","Application Data"
"580","46.246763500","151.101.2.187","100.84.170.161","TCP","56","443  >  55283 [ACK] Seq=83228 Ack=246738 Win=3159 Len=0"
"581","46.249725100","151.101.2.187","100.84.170.161","TLSv1.2","130","Application Data"
"582","46.252471300","151.101.2.187","100.84.170.161","TCP","56","443  >  55283 [ACK] Seq=83304 Ack=247798 Win=3165 Len=0"
"583","46.253811600","100.84.170.161","151.101.2.187","TLSv1.2","1629","Application Data"
"584","46.255263800","151.101.2.187","100.84.170.161","TLSv1.2","130","Application Data"
"585","46.262976500","151.101.2.187","100.84.170.161","TCP","56","443  >  55283 [ACK] Seq=83380 Ack=249373 Win=3170 Len=0"
"586","46.265516500","151.101.2.187","100.84.170.161","TLSv1.2","212","Application Data"
"587","46.265585500","100.84.170.161","151.101.2.187","TCP","54","55283  >  443 [ACK] Seq=249373 Ack=83538 Win=513 Len=0"
"588","46.287356100","100.84.170.161","151.101.2.187","TLSv1.2","1120","Application Data"
"589","46.287557600","100.84.170.161","151.101.2.187","TLSv1.2","1603","Application Data"
"590","46.296044500","151.101.2.187","100.84.170.161","TCP","56","443  >  55283 [ACK] Seq=83538 Ack=250439 Win=3176 Len=0"
"591","46.296565900","151.101.2.187","100.84.170.161","TCP","56","443  >  55283 [ACK] Seq=83538 Ack=251988 Win=3182 Len=0"
"592","46.299506900","151.101.2.187","100.84.170.161","TLSv1.2","130","Application Data"
"593","46.299943800","151.101.2.187","100.84.170.161","TLSv1.2","131","Application Data"
"594","46.299993900","100.84.170.161","151.101.2.187","TCP","54","55283  >  443 [ACK] Seq=251988 Ack=83691 Win=512 Len=0"
"595","46.328905700","100.84.170.161","151.101.2.187","TLSv1.2","175","Ignored Unknown Record"
"596","46.329076000","100.84.170.161","151.101.2.187","TLSv1.2","93","Application Data"
"597","46.337520300","151.101.2.187","100.84.170.161","TCP","56","443  >  63540 [ACK] Seq=1 Ack=123 Win=285 Len=0"
"598","46.337962700","151.101.2.187","100.84.170.161","TLSv1.2","93","Application Data"
"599","46.364390000","151.101.2.187","100.84.170.161","TCP","93","[TCP Retransmission] 443  >  63540 [PSH, ACK] Seq=1 Ack=162 Win=285 Len=39"
"600","46.364435200","100.84.170.161","151.101.2.187","TCP","66","63540  >  443 [ACK] Seq=162 Ack=40 Win=513 Len=0 SLE=1 SRE=40"
"601","46.392109300","151.101.2.187","100.84.170.161","TLSv1.2","256","Application Data"
"602","46.392163900","100.84.170.161","151.101.2.187","TCP","54","63540  >  443 [ACK] Seq=162 Ack=242 Win=512 Len=0"
"603","46.392440000","151.101.2.187","100.84.170.161","TLSv1.2","874","Application Data"
"604","46.392946100","100.84.170.161","151.101.2.187","TLSv1.2","89","Application Data"
"605","46.401397600","151.101.2.187","100.84.170.161","TCP","56","443  >  63540 [ACK] Seq=1062 Ack=197 Win=285 Len=0"
"606","46.525644100","100.84.170.161","151.101.2.187","TLSv1.2","1133","Application Data"
"607","46.536127800","151.101.2.187","100.84.170.161","TCP","56","443  >  55283 [ACK] Seq=83691 Ack=253067 Win=3187 Len=0"
"608","46.538695400","151.101.2.187","100.84.170.161","TLSv1.2","130","Application Data"
"609","46.567622800","151.101.2.187","100.84.170.161","TCP","130","[TCP Retransmission] 443  >  55283 [PSH, ACK] Seq=83691 Ack=253067 Win=3187 Len=76"
"610","46.567666400","100.84.170.161","151.101.2.187","TCP","66","55283  >  443 [ACK] Seq=253067 Ack=83767 Win=512 Len=0 SLE=83691 SRE=83767"
"611","49.729829100","100.84.170.161","151.101.2.187","TLSv1.2","1643","Application Data"
"612","49.741282700","151.101.2.187","100.84.170.161","TCP","56","443  >  55283 [ACK] Seq=83767 Ack=254656 Win=3193 Len=0"
"613","49.744326600","151.101.2.187","100.84.170.161","TLSv1.2","368","Application Data"
"614","49.773454100","151.101.2.187","100.84.170.161","TCP","368","[TCP Retransmission] 443  >  55283 [PSH, ACK] Seq=83767 Ack=254656 Win=3193 Len=314"
"615","49.773500400","100.84.170.161","151.101.2.187","TCP","66","55283  >  443 [ACK] Seq=254656 Ack=84081 Win=511 Len=0 SLE=83767 SRE=84081"
"616","49.864476800","100.84.170.161","151.101.2.187","TLSv1.2","1093","Application Data"
"617","49.873371100","100.84.170.161","151.101.2.187","TLSv1.2","1660","Application Data"
"618","49.873552600","151.101.2.187","100.84.170.161","TCP","56","443  >  55283 [ACK] Seq=84081 Ack=255695 Win=3199 Len=0"
"619","49.876701000","151.101.2.187","100.84.170.161","TLSv1.2","130","Application Data"
"620","49.881966800","151.101.2.187","100.84.170.161","TCP","56","443  >  55283 [ACK] Seq=84157 Ack=257301 Win=3205 Len=0"
"621","49.885218300","151.101.2.187","100.84.170.161","TLSv1.2","130","Application Data"
"622","49.885309800","100.84.170.161","151.101.2.187","TCP","54","55283  >  443 [ACK] Seq=257301 Ack=84233 Win=510 Len=0"
"623","50.001695100","100.84.170.161","151.101.2.187","TLSv1.2","1126","Application Data"
"624","50.063657900","151.101.2.187","100.84.170.161","TCP","56","443  >  55283 [ACK] Seq=84233 Ack=258373 Win=3210 Len=0"
"625","50.086412200","151.101.2.187","100.84.170.161","TLSv1.2","98","Application Data"
"626","50.111103200","151.101.2.187","100.84.170.161","TCP","98","[TCP Retransmission] 443  >  55283 [PSH, ACK] Seq=84233 Ack=258373 Win=3210 Len=44"
"627","50.111146500","100.84.170.161","151.101.2.187","TCP","66","55283  >  443 [ACK] Seq=258373 Ack=84277 Win=510 Len=0 SLE=84233 SRE=84277"
"628","60.251822500","100.84.170.161","151.101.2.187","TLSv1.2","1610","Application Data"
"629","60.251937500","100.84.170.161","151.101.2.187","TLSv1.2","93","Application Data"
"630","60.256790100","100.84.170.161","151.101.2.187","TLSv1.2","1136","Application Data"
"631","60.260841500","151.101.2.187","100.84.170.161","TCP","56","443  >  55283 [ACK] Seq=84277 Ack=259968 Win=3216 Len=0"
"632","60.261460800","151.101.2.187","100.84.170.161","TLSv1.2","93","Application Data"
"633","60.262852600","100.84.170.161","151.101.2.187","TLSv1.2","1616","Application Data"
"634","60.263678100","151.101.2.187","100.84.170.161","TLSv1.2","214","Application Data"
"635","60.265419700","151.101.2.187","100.84.170.161","TCP","56","443  >  55283 [ACK] Seq=84476 Ack=261050 Win=3222 Len=0"
"636","60.268792400","151.101.2.187","100.84.170.161","TLSv1.2","103","Application Data"
"637","60.268866300","100.84.170.161","151.101.2.187","TCP","54","55283  >  443 [ACK] Seq=262612 Ack=84525 Win=509 Len=0"
"638","60.272664200","151.101.2.187","100.84.170.161","TCP","56","443  >  55283 [ACK] Seq=84525 Ack=262612 Win=3227 Len=0"
"639","60.272812900","100.84.170.161","151.101.2.187","TLSv1.2","1122","Application Data"
"640","60.276010300","151.101.2.187","100.84.170.161","TLSv1.2","103","Application Data"
"641","60.281224900","151.101.2.187","100.84.170.161","TCP","56","443  >  55283 [ACK] Seq=84574 Ack=263680 Win=3233 Len=0"
"642","60.283810100","151.101.2.187","100.84.170.161","TLSv1.2","129","Application Data"
"643","60.283872800","100.84.170.161","151.101.2.187","TCP","54","55283  >  443 [ACK] Seq=263680 Ack=84649 Win=508 Len=0"
