No.,Time,Source,Destination,Protocol,Length,Info
1,0.0,172.20.40.110,151.101.130.187,TCP,55,57648  >  443 [ACK] Seq=1 Ack=1 Win=254 Len=1 [TCP PDU reassembled in 441]
2,0.0103427,151.101.130.187,172.20.40.110,TCP,66,443  >  57648 [ACK] Seq=1 Ack=2 Win=281 Len=0 SLE=1 SRE=2
3,3.2318128,172.20.40.110,151.101.194.187,TLSv1.2,2890,Application Data
4,3.2319861,172.20.40.110,151.101.194.187,TLSv1.2,93,Application Data
5,3.2422073,151.101.194.187,172.20.40.110,TCP,60,443  >  64055 [ACK] Seq=1 Ack=2837 Win=414 Len=0
6,3.2422073,151.101.194.187,172.20.40.110,TCP,60,443  >  64055 [ACK] Seq=1 Ack=2876 Win=414 Len=0
7,3.2422073,151.101.194.187,172.20.40.110,TLSv1.2,93,Application Data
8,3.2455549,151.101.194.187,172.20.40.110,TLSv1.2,379,Application Data
9,3.2456652,172.20.40.110,151.101.194.187,TCP,54,64055  >  443 [ACK] Seq=2876 Ack=365 Win=506 Len=0
10,3.3418057,172.20.40.110,151.101.194.187,TLSv1.2,2889,Application Data
11,3.3520488,151.101.194.187,172.20.40.110,TCP,60,443  >  64055 [ACK] Seq=365 Ack=5711 Win=425 Len=0
12,3.3540204,151.101.194.187,172.20.40.110,TLSv1.2,104,Application Data
13,3.3895691,151.101.194.187,172.20.40.110,TCP,104,"[TCP Retransmission] 443  >  64055 [PSH, ACK] Seq=365 Ack=5711 Win=425 Len=50"
14,3.3896408,172.20.40.110,151.101.194.187,TCP,66,64055  >  443 [ACK] Seq=5711 Ack=415 Win=512 Len=0 SLE=365 SRE=415
15,5.1055216,172.20.40.110,151.101.194.187,TLSv1.2,2889,Application Data
16,5.1137014,172.20.40.110,151.101.194.187,TLSv1.2,2875,Application Data
17,5.116485,151.101.194.187,172.20.40.110,TCP,60,443  >  64055 [ACK] Seq=415 Ack=8546 Win=436 Len=0
18,5.1175077,151.101.194.187,172.20.40.110,TLSv1.2,214,Application Data
19,5.1232606,151.101.194.187,172.20.40.110,TCP,60,443  >  64055 [ACK] Seq=575 Ack=11367 Win=447 Len=0
20,5.1256812,151.101.194.187,172.20.40.110,TLSv1.2,130,Application Data
21,5.1257892,172.20.40.110,151.101.194.187,TCP,54,64055  >  443 [ACK] Seq=11367 Ack=651 Win=511 Len=0
22,5.1332206,172.20.40.110,151.101.194.187,TLSv1.2,2890,Application Data
23,5.1420567,151.101.194.187,172.20.40.110,TCP,60,443  >  64055 [ACK] Seq=651 Ack=14203 Win=458 Len=0
24,5.1464499,151.101.194.187,172.20.40.110,TLSv1.2,213,Application Data
25,5.1812081,151.101.194.187,172.20.40.110,TCP,213,"[TCP Retransmission] 443  >  64055 [PSH, ACK] Seq=651 Ack=14203 Win=458 Len=159"
26,5.1812751,172.20.40.110,151.101.194.187,TCP,66,64055  >  443 [ACK] Seq=14203 Ack=810 Win=510 Len=0 SLE=651 SRE=810
27,5.5989561,172.20.40.110,151.101.194.187,TLSv1.2,2887,Application Data
28,5.6088736,151.101.194.187,172.20.40.110,TCP,60,443  >  64055 [ACK] Seq=810 Ack=17036 Win=469 Len=0
29,5.6118043,151.101.194.187,172.20.40.110,TLSv1.2,130,Application Data
30,5.6460478,151.101.194.187,172.20.40.110,TCP,130,"[TCP Retransmission] 443  >  64055 [PSH, ACK] Seq=810 Ack=17036 Win=469 Len=76"
31,5.6460998,172.20.40.110,151.101.194.187,TCP,66,64055  >  443 [ACK] Seq=17036 Ack=886 Win=510 Len=0 SLE=810 SRE=886
32,6.8968542,172.20.40.110,151.101.194.187,TLSv1.2,2889,Application Data
33,6.8975013,172.20.40.110,151.101.194.187,TLSv1.2,2890,Application Data
34,6.8995553,172.20.40.110,151.101.194.187,TLSv1.2,2877,Application Data
35,6.8997619,172.20.40.110,151.101.194.187,TLSv1.2,2871,Application Data
36,6.9198601,151.101.194.187,172.20.40.110,TCP,60,443  >  64055 [ACK] Seq=886 Ack=18416 Win=475 Len=0
37,6.9198601,151.101.194.187,172.20.40.110,TCP,60,443  >  64055 [ACK] Seq=886 Ack=19871 Win=480 Len=0
38,6.9198601,151.101.194.187,172.20.40.110,TCP,60,443  >  64055 [ACK] Seq=886 Ack=22707 Win=491 Len=0
39,6.9198601,151.101.194.187,172.20.40.110,TCP,60,443  >  64055 [ACK] Seq=886 Ack=25530 Win=502 Len=0
40,6.9198601,151.101.194.187,172.20.40.110,TCP,60,443  >  64055 [ACK] Seq=886 Ack=28347 Win=513 Len=0
41,6.9245226,151.101.194.187,172.20.40.110,TLSv1.2,376,Application Data
42,6.9601098,151.101.194.187,172.20.40.110,TCP,376,"[TCP Retransmission] 443  >  64055 [PSH, ACK] Seq=886 Ack=28347 Win=513 Len=322"
43,6.960169,172.20.40.110,151.101.194.187,TCP,66,64055  >  443 [ACK] Seq=28347 Ack=1208 Win=509 Len=0 SLE=886 SRE=1208
44,7.0140847,172.20.40.110,151.101.194.187,TLSv1.2,2893,Application Data
45,7.0240061,151.101.194.187,172.20.40.110,TCP,60,443  >  64055 [ACK] Seq=1208 Ack=31186 Win=524 Len=0
46,7.0271295,151.101.194.187,172.20.40.110,TLSv1.2,130,Application Data
47,7.0366981,172.20.40.110,151.101.194.187,TLSv1.2,2873,Application Data
48,7.0463164,151.101.194.187,172.20.40.110,TCP,60,443  >  64055 [ACK] Seq=1284 Ack=34005 Win=535 Len=0
49,7.0487699,151.101.194.187,172.20.40.110,TLSv1.2,341,Application Data
50,7.0841567,151.101.194.187,172.20.40.110,TCP,341,"[TCP Retransmission] 443  >  64055 [PSH, ACK] Seq=1284 Ack=34005 Win=535 Len=287"
51,7.084216,172.20.40.110,151.101.194.187,TCP,66,64055  >  443 [ACK] Seq=34005 Ack=1571 Win=507 Len=0 SLE=1284 SRE=1571
52,7.2629655,172.20.40.110,151.101.194.187,TLSv1.2,2830,Application Data
53,7.26502,172.20.40.110,151.101.194.187,TLSv1.2,2896,Application Data
54,7.2656176,172.20.40.110,151.101.194.187,TLSv1.2,2877,Application Data
55,7.2657786,172.20.40.110,151.101.194.187,TLSv1.2,2875,Application Data
56,7.2730233,172.20.40.110,151.101.194.187,TLSv1.2,2953,Application Data
57,7.275465,172.20.40.110,151.101.194.187,TLSv1.2,2924,Application Data
58,7.2781598,151.101.194.187,172.20.40.110,TCP,60,443  >  64055 [ACK] Seq=1571 Ack=36781 Win=546 Len=0
59,7.2840076,151.101.194.187,172.20.40.110,TCP,60,443  >  64055 [ACK] Seq=1571 Ack=39623 Win=557 Len=0
60,7.2840076,151.101.194.187,172.20.40.110,TCP,60,443  >  64055 [ACK] Seq=1571 Ack=42446 Win=568 Len=0
61,7.2902252,151.101.194.187,172.20.40.110,TLSv1.2,283,Application Data
62,7.2902252,151.101.194.187,172.20.40.110,TLSv1.2,517,Application Data
63,7.2902252,151.101.194.187,172.20.40.110,TLSv1.2,130,Application Data
64,7.2903378,172.20.40.110,151.101.194.187,TCP,54,64055  >  443 [ACK] Seq=51036 Ack=2339 Win=512 Len=0
65,7.2972146,172.20.40.110,151.101.194.187,TLSv1.2,89,Application Data
66,7.3025079,151.101.194.187,172.20.40.110,TCP,60,443  >  64055 [ACK] Seq=2339 Ack=45267 Win=580 Len=0
67,7.3025079,151.101.194.187,172.20.40.110,TCP,60,443  >  64055 [ACK] Seq=2339 Ack=48166 Win=591 Len=0
68,7.3025079,151.101.194.187,172.20.40.110,TCP,60,443  >  64055 [ACK] Seq=2339 Ack=51036 Win=602 Len=0
69,7.3075389,151.101.194.187,172.20.40.110,TCP,60,443  >  64055 [ACK] Seq=2339 Ack=51071 Win=602 Len=0
70,7.3075389,151.101.194.187,172.20.40.110,TLSv1.2,238,Application Data
71,7.343397,151.101.194.187,172.20.40.110,TCP,238,"[TCP Retransmission] 443  >  64055 [PSH, ACK] Seq=2339 Ack=51071 Win=602 Len=184"
72,7.3435895,172.20.40.110,151.101.194.187,TCP,66,64055  >  443 [ACK] Seq=51071 Ack=2523 Win=511 Len=0 SLE=2339 SRE=2523
73,7.8140007,172.20.40.110,151.101.194.187,TLSv1.2,2804,Application Data
74,7.8191705,172.20.40.110,151.101.194.187,TLSv1.2,2802,Application Data
75,7.8265475,151.101.194.187,172.20.40.110,TCP,60,443  >  64055 [ACK] Seq=2523 Ack=53821 Win=614 Len=0
76,7.8294453,151.101.194.187,172.20.40.110,TCP,60,443  >  64055 [ACK] Seq=2523 Ack=56569 Win=624 Len=0
77,7.8308268,151.101.194.187,172.20.40.110,TLSv1.2,104,Application Data
78,7.8319346,151.101.194.187,172.20.40.110,TLSv1.2,130,Application Data
79,7.8320139,172.20.40.110,151.101.194.187,TCP,54,64055  >  443 [ACK] Seq=56569 Ack=2649 Win=510 Len=0
80,7.9885381,151.101.194.187,172.20.40.110,TLSv1.2,250,Application Data
81,7.9885381,151.101.194.187,172.20.40.110,TCP,9714,"443  >  64055 [PSH, ACK] Seq=2845 Ack=56569 Win=624 Len=9660 [TCP PDU reassembled in 87]"
82,7.988664,172.20.40.110,151.101.194.187,TCP,54,64055  >  443 [ACK] Seq=56569 Ack=12505 Win=512 Len=0
83,7.9938461,151.101.194.187,172.20.40.110,TCP,1434,443  >  64055 [ACK] Seq=12505 Ack=56569 Win=624 Len=1380 [TCP PDU reassembled in 87]
84,7.9938461,151.101.194.187,172.20.40.110,TCP,1434,"443  >  64055 [PSH, ACK] Seq=13885 Ack=56569 Win=624 Len=1380 [TCP PDU reassembled in 87]"
85,7.9938461,151.101.194.187,172.20.40.110,TCP,1434,443  >  64055 [ACK] Seq=15265 Ack=56569 Win=624 Len=1380 [TCP PDU reassembled in 87]
86,7.9938461,151.101.194.187,172.20.40.110,TCP,1434,443  >  64055 [ACK] Seq=16645 Ack=56569 Win=624 Len=1380 [TCP PDU reassembled in 87]
87,7.9938461,151.101.194.187,172.20.40.110,TLSv1.2,4194,Application Data
88,7.9940179,172.20.40.110,151.101.194.187,TCP,54,64055  >  443 [ACK] Seq=56569 Ack=22165 Win=512 Len=0
89,7.9961847,151.101.194.187,172.20.40.110,TCP,9714,"443  >  64055 [PSH, ACK] Seq=22165 Ack=56569 Win=624 Len=9660 [TCP PDU reassembled in 91]"
90,7.9962982,172.20.40.110,151.101.194.187,TCP,54,64055  >  443 [ACK] Seq=56569 Ack=31825 Win=512 Len=0
91,7.9987738,151.101.194.187,172.20.40.110,TLSv1.2,9714,Application Data
92,7.9988802,172.20.40.110,151.101.194.187,TCP,54,64055  >  443 [ACK] Seq=56569 Ack=41485 Win=512 Len=0
93,8.0018086,151.101.194.187,172.20.40.110,TCP,9714,"443  >  64055 [PSH, ACK] Seq=41485 Ack=56569 Win=624 Len=9660 [TCP PDU reassembled in 95]"
94,8.0019118,172.20.40.110,151.101.194.187,TCP,54,64055  >  443 [ACK] Seq=56569 Ack=51145 Win=512 Len=0
95,8.0065822,151.101.194.187,172.20.40.110,TLSv1.2,1434,Application Data
96,8.0065822,151.101.194.187,172.20.40.110,TCP,1434,"443  >  64055 [PSH, ACK] Seq=52525 Ack=56569 Win=624 Len=1380 [TCP PDU reassembled in 101]"
97,8.0065822,151.101.194.187,172.20.40.110,TCP,1434,443  >  64055 [ACK] Seq=53905 Ack=56569 Win=624 Len=1380 [TCP PDU reassembled in 101]
98,8.0065822,151.101.194.187,172.20.40.110,TCP,1434,443  >  64055 [ACK] Seq=55285 Ack=56569 Win=624 Len=1380 [TCP PDU reassembled in 101]
99,8.0065822,151.101.194.187,172.20.40.110,TCP,4194,"443  >  64055 [PSH, ACK] Seq=56665 Ack=56569 Win=624 Len=4140 [TCP PDU reassembled in 101]"
100,8.0067287,172.20.40.110,151.101.194.187,TCP,54,64055  >  443 [ACK] Seq=56569 Ack=60805 Win=512 Len=0
101,8.0090384,151.101.194.187,172.20.40.110,TLSv1.2,9714,Application Data
102,8.0090384,151.101.194.187,172.20.40.110,TLSv1.2,242,Application Data
103,8.0091656,172.20.40.110,151.101.194.187,TCP,54,64055  >  443 [ACK] Seq=56569 Ack=70653 Win=512 Len=0
104,8.0537413,172.20.40.110,151.101.194.187,TLSv1.2,2805,Application Data
105,8.062806,151.101.194.187,172.20.40.110,TCP,60,443  >  64055 [ACK] Seq=70653 Ack=59320 Win=635 Len=0
106,8.0663433,151.101.194.187,172.20.40.110,TLSv1.2,340,Application Data
107,8.1096799,151.101.194.187,172.20.40.110,TCP,340,"[TCP Retransmission] 443  >  64055 [PSH, ACK] Seq=70653 Ack=59320 Win=635 Len=286"
108,8.1097408,172.20.40.110,151.101.194.187,TCP,66,64055  >  443 [ACK] Seq=59320 Ack=70939 Win=510 Len=0 SLE=70653 SRE=70939
109,8.7648833,172.20.40.110,151.101.194.187,TLSv1.2,2790,Application Data
110,8.7660733,172.20.40.110,151.101.194.187,TLSv1.2,2794,Application Data
111,8.7663012,172.20.40.110,151.101.194.187,TLSv1.2,2788,Application Data
112,8.7798117,151.101.194.187,172.20.40.110,TCP,60,443  >  64055 [ACK] Seq=70939 Ack=62056 Win=646 Len=0
113,8.7878432,151.101.194.187,172.20.40.110,TCP,60,443  >  64055 [ACK] Seq=70939 Ack=64796 Win=657 Len=0
114,8.7878432,151.101.194.187,172.20.40.110,TCP,60,443  >  64055 [ACK] Seq=70939 Ack=67530 Win=667 Len=0
115,8.7878432,151.101.194.187,172.20.40.110,TLSv1.2,241,Application Data
116,8.7878432,151.101.194.187,172.20.40.110,TLSv1.2,132,Application Data
117,8.7878432,151.101.194.187,172.20.40.110,TLSv1.2,130,Application Data
118,8.787965,172.20.40.110,151.101.194.187,TCP,54,64055  >  443 [ACK] Seq=67530 Ack=71280 Win=509 Len=0
119,8.7880052,172.20.40.110,151.101.194.187,TLSv1.2,2788,Application Data
120,8.7943426,172.20.40.110,151.101.194.187,TLSv1.2,2786,Application Data
121,8.7973597,151.101.194.187,172.20.40.110,TCP,60,443  >  64055 [ACK] Seq=71280 Ack=70264 Win=678 Len=0
122,8.801098,151.101.194.187,172.20.40.110,TLSv1.2,130,Application Data
123,8.8048659,151.101.194.187,172.20.40.110,TCP,60,443  >  64055 [ACK] Seq=71356 Ack=72996 Win=689 Len=0
124,8.8077759,151.101.194.187,172.20.40.110,TLSv1.2,130,Application Data
125,8.8078454,172.20.40.110,151.101.194.187,TCP,54,64055  >  443 [ACK] Seq=72996 Ack=71432 Win=509 Len=0
126,8.8462189,172.20.40.110,151.101.194.187,TLSv1.2,2805,Application Data
127,8.8505316,172.20.40.110,151.101.194.187,TLSv1.2,2804,Application Data
128,8.8563739,151.101.194.187,172.20.40.110,TCP,60,443  >  64055 [ACK] Seq=71432 Ack=75747 Win=700 Len=0
129,8.8616223,151.101.194.187,172.20.40.110,TLSv1.2,98,Application Data
130,8.8684129,151.101.194.187,172.20.40.110,TCP,60,443  >  64055 [ACK] Seq=71476 Ack=78497 Win=711 Len=0
131,8.8728911,151.101.194.187,172.20.40.110,TLSv1.2,131,Application Data
132,8.8730468,172.20.40.110,151.101.194.187,TCP,54,64055  >  443 [ACK] Seq=78497 Ack=71553 Win=508 Len=0
133,8.8815152,172.20.40.110,151.101.194.187,TLSv1.2,2788,Application Data
134,8.8910827,151.101.194.187,172.20.40.110,TCP,60,443  >  64055 [ACK] Seq=71553 Ack=81231 Win=721 Len=0
135,8.895341,151.101.194.187,172.20.40.110,TLSv1.2,124,Application Data
136,8.9331556,151.101.194.187,172.20.40.110,TCP,124,"[TCP Retransmission] 443  >  64055 [PSH, ACK] Seq=71553 Ack=81231 Win=721 Len=70"
137,8.933202,172.20.40.110,151.101.194.187,TCP,66,64055  >  443 [ACK] Seq=81231 Ack=71623 Win=508 Len=0 SLE=71553 SRE=71623
138,12.6811528,172.20.40.110,151.101.194.187,TLSv1.2,2792,Application Data
139,12.6815205,172.20.40.110,151.101.194.187,TLSv1.2,2788,Application Data
140,12.6995572,151.101.194.187,172.20.40.110,TCP,60,443  >  64055 [ACK] Seq=71623 Ack=83969 Win=732 Len=0
141,12.6995572,151.101.194.187,172.20.40.110,TCP,60,443  >  64055 [ACK] Seq=71623 Ack=86703 Win=743 Len=0
142,12.6995572,151.101.194.187,172.20.40.110,TLSv1.2,240,Application Data
143,12.6995572,151.101.194.187,172.20.40.110,TLSv1.2,130,Application Data
144,12.6997269,172.20.40.110,151.101.194.187,TCP,54,64055  >  443 [ACK] Seq=86703 Ack=71885 Win=507 Len=0
145,14.2763965,172.20.40.110,151.101.194.187,TLSv1.2,2811,Application Data
146,14.2899646,151.101.194.187,172.20.40.110,TCP,60,443  >  64055 [ACK] Seq=71885 Ack=89460 Win=754 Len=0
147,14.2944021,151.101.194.187,172.20.40.110,TLSv1.2,213,Application Data
148,14.3242088,172.20.40.110,151.101.194.187,TLSv1.2,2810,Application Data
149,14.3307243,151.101.194.187,172.20.40.110,TCP,213,"[TCP Spurious Retransmission] 443  >  64055 [PSH, ACK] Seq=71885 Ack=89460 Win=754 Len=159"
150,14.3307858,172.20.40.110,151.101.194.187,TCP,66,[TCP Dup ACK 148#1] 64055  >  443 [ACK] Seq=92216 Ack=72044 Win=512 Len=0 SLE=71885 SRE=72044
151,14.3362259,151.101.194.187,172.20.40.110,TCP,60,443  >  64055 [ACK] Seq=72044 Ack=92216 Win=764 Len=0
152,14.3423157,151.101.194.187,172.20.40.110,TLSv1.2,314,Application Data
153,14.3796132,151.101.194.187,172.20.40.110,TCP,314,"[TCP Retransmission] 443  >  64055 [PSH, ACK] Seq=72044 Ack=92216 Win=764 Len=260"
154,14.3797231,172.20.40.110,151.101.194.187,TCP,66,64055  >  443 [ACK] Seq=92216 Ack=72304 Win=511 Len=0 SLE=72044 SRE=72304
155,14.7463786,172.20.40.110,151.101.194.187,TLSv1.2,2796,Application Data
156,14.7608446,151.101.194.187,172.20.40.110,TCP,60,443  >  64055 [ACK] Seq=72304 Ack=94958 Win=775 Len=0
157,14.7631594,151.101.194.187,172.20.40.110,TLSv1.2,130,Application Data
158,14.8030826,151.101.194.187,172.20.40.110,TCP,130,"[TCP Retransmission] 443  >  64055 [PSH, ACK] Seq=72304 Ack=94958 Win=775 Len=76"
159,14.8031593,172.20.40.110,151.101.194.187,TCP,66,64055  >  443 [ACK] Seq=94958 Ack=72380 Win=510 Len=0 SLE=72304 SRE=72380
160,15.0244123,172.20.40.110,151.101.194.187,TLSv1.2,2798,Application Data
161,15.0310168,172.20.40.110,151.101.194.187,TLSv1.2,2794,Application Data
162,15.0333222,172.20.40.110,151.101.194.187,TLSv1.2,2796,Application Data
163,15.0401011,151.101.194.187,172.20.40.110,TCP,60,443  >  64055 [ACK] Seq=72380 Ack=97702 Win=786 Len=0
164,15.0421173,172.20.40.110,151.101.194.187,TLSv1.2,2794,Application Data
165,15.0432218,151.101.194.187,172.20.40.110,TLSv1.2,104,Application Data
166,15.0462305,172.20.40.110,151.101.194.187,TLSv1.2,2792,Application Data
167,15.055354,151.101.194.187,172.20.40.110,TCP,60,443  >  64055 [ACK] Seq=72430 Ack=100442 Win=796 Len=0
168,15.055354,151.101.194.187,172.20.40.110,TCP,60,443  >  64055 [ACK] Seq=72430 Ack=103184 Win=807 Len=0
169,15.055354,151.101.194.187,172.20.40.110,TCP,60,443  >  64055 [ACK] Seq=72430 Ack=105924 Win=818 Len=0
170,15.0585123,151.101.194.187,172.20.40.110,TLSv1.2,104,Application Data
171,15.0596002,151.101.194.187,172.20.40.110,TLSv1.2,104,Application Data
172,15.0596869,172.20.40.110,151.101.194.187,TCP,54,64055  >  443 [ACK] Seq=108662 Ack=72530 Win=510 Len=0
173,15.0600395,151.101.194.187,172.20.40.110,TLSv1.2,104,Application Data
174,15.0642026,151.101.194.187,172.20.40.110,TCP,60,443  >  64055 [ACK] Seq=72580 Ack=108662 Win=829 Len=0
175,15.0652775,151.101.194.187,172.20.40.110,TLSv1.2,104,Application Data
176,15.065339,172.20.40.110,151.101.194.187,TCP,54,64055  >  443 [ACK] Seq=108662 Ack=72630 Win=509 Len=0
177,15.2578332,172.20.40.110,151.101.194.187,TLSv1.2,2794,Application Data
178,15.2682708,151.101.194.187,172.20.40.110,TCP,60,443  >  64055 [ACK] Seq=72630 Ack=111402 Win=839 Len=0
179,15.273809,151.101.194.187,172.20.40.110,TLSv1.2,208,Application Data
180,15.309553,151.101.194.187,172.20.40.110,TCP,208,"[TCP Retransmission] 443  >  64055 [PSH, ACK] Seq=72630 Ack=111402 Win=839 Len=154"
181,15.3096331,172.20.40.110,151.101.194.187,TCP,66,64055  >  443 [ACK] Seq=111402 Ack=72784 Win=509 Len=0 SLE=72630 SRE=72784
182,15.3482706,172.20.40.110,151.101.194.187,TLSv1.2,2794,Application Data
183,15.3573072,151.101.194.187,172.20.40.110,TCP,60,443  >  64055 [ACK] Seq=72784 Ack=114142 Win=850 Len=0
184,15.3641037,151.101.194.187,172.20.40.110,TLSv1.2,103,Application Data
185,15.3980005,151.101.194.187,172.20.40.110,TCP,103,"[TCP Retransmission] 443  >  64055 [PSH, ACK] Seq=72784 Ack=114142 Win=850 Len=49"
186,15.3980547,172.20.40.110,151.101.194.187,TCP,66,64055  >  443 [ACK] Seq=114142 Ack=72833 Win=509 Len=0 SLE=72784 SRE=72833
187,16.0043143,172.20.40.110,151.101.194.187,TLSv1.2,2799,Application Data
188,16.0132592,151.101.194.187,172.20.40.110,TCP,60,443  >  64055 [ACK] Seq=72833 Ack=116887 Win=861 Len=0
189,16.0154756,151.101.194.187,172.20.40.110,TLSv1.2,131,Application Data
190,16.0506742,151.101.194.187,172.20.40.110,TCP,131,"[TCP Retransmission] 443  >  64055 [PSH, ACK] Seq=72833 Ack=116887 Win=861 Len=77"
191,16.0507396,172.20.40.110,151.101.194.187,TCP,66,64055  >  443 [ACK] Seq=116887 Ack=72910 Win=508 Len=0 SLE=72833 SRE=72910
192,17.551574,172.20.40.110,151.101.194.187,TLSv1.2,2811,Application Data
193,17.5629542,151.101.194.187,172.20.40.110,TCP,60,443  >  64055 [ACK] Seq=72910 Ack=119644 Win=871 Len=0
194,17.5663197,151.101.194.187,172.20.40.110,TLSv1.2,240,Application Data
195,17.5910688,172.20.40.110,151.101.194.187,TLSv1.2,2810,Application Data
196,17.6005129,151.101.194.187,172.20.40.110,TCP,60,443  >  64055 [ACK] Seq=73096 Ack=122400 Win=882 Len=0
197,17.6070517,151.101.194.187,172.20.40.110,TLSv1.2,131,Application Data
198,17.6511322,151.101.194.187,172.20.40.110,TCP,131,"[TCP Retransmission] 443  >  64055 [PSH, ACK] Seq=73096 Ack=122400 Win=882 Len=77"
199,17.6513406,172.20.40.110,151.101.194.187,TCP,66,64055  >  443 [ACK] Seq=122400 Ack=73173 Win=507 Len=0 SLE=73096 SRE=73173
200,17.7510895,172.20.40.110,151.101.194.187,TLSv1.2,2796,Application Data
201,17.7599367,151.101.194.187,172.20.40.110,TCP,60,443  >  64055 [ACK] Seq=73173 Ack=125142 Win=893 Len=0
202,17.7634436,151.101.194.187,172.20.40.110,TLSv1.2,104,Application Data
203,17.8033914,151.101.194.187,172.20.40.110,TCP,104,"[TCP Retransmission] 443  >  64055 [PSH, ACK] Seq=73173 Ack=125142 Win=893 Len=50"
204,17.8034469,172.20.40.110,151.101.194.187,TCP,66,64055  >  443 [ACK] Seq=125142 Ack=73223 Win=507 Len=0 SLE=73173 SRE=73223
205,19.2560707,172.20.40.110,151.101.194.187,TLSv1.2,2808,Application Data
206,19.2668017,151.101.194.187,172.20.40.110,TCP,60,443  >  64055 [ACK] Seq=73223 Ack=127896 Win=904 Len=0
207,19.2695257,151.101.194.187,172.20.40.110,TLSv1.2,240,Application Data
208,19.3088957,151.101.194.187,172.20.40.110,TCP,240,"[TCP Retransmission] 443  >  64055 [PSH, ACK] Seq=73223 Ack=127896 Win=904 Len=186"
209,19.30897,172.20.40.110,151.101.194.187,TCP,66,64055  >  443 [ACK] Seq=127896 Ack=73409 Win=506 Len=0 SLE=73223 SRE=73409
210,20.7750292,172.20.40.110,151.101.194.187,TLSv1.2,2802,Application Data
211,20.7874427,172.20.40.110,151.101.194.187,TLSv1.2,2796,Application Data
212,20.7878803,172.20.40.110,151.101.194.187,TLSv1.2,2796,Application Data
213,20.7879867,151.101.194.187,172.20.40.110,TCP,60,443  >  64055 [ACK] Seq=73409 Ack=130644 Win=914 Len=0
214,20.7910315,151.101.194.187,172.20.40.110,TLSv1.2,240,Application Data
215,20.7911272,172.20.40.110,151.101.194.187,TCP,54,64055  >  443 [ACK] Seq=136128 Ack=73595 Win=512 Len=0
216,20.8053879,151.101.194.187,172.20.40.110,TCP,60,443  >  64055 [ACK] Seq=73595 Ack=133386 Win=925 Len=0
217,20.8053879,151.101.194.187,172.20.40.110,TCP,60,443  >  64055 [ACK] Seq=73595 Ack=136128 Win=936 Len=0
218,20.8053879,151.101.194.187,172.20.40.110,TLSv1.2,340,Application Data
219,20.8053879,151.101.194.187,172.20.40.110,TLSv1.2,130,Application Data
220,20.8055132,172.20.40.110,151.101.194.187,TCP,54,64055  >  443 [ACK] Seq=136128 Ack=73957 Win=510 Len=0
221,20.8246241,172.20.40.110,151.101.194.187,TLSv1.2,2796,Application Data
222,20.8265554,172.20.40.110,151.101.194.187,TLSv1.2,2803,Application Data
223,20.826721,172.20.40.110,151.101.194.187,TLSv1.2,2802,Application Data
224,20.8268125,172.20.40.110,151.101.194.187,TLSv1.2,2799,Application Data
225,20.8270905,172.20.40.110,151.101.194.187,TLSv1.2,2796,Application Data
226,20.8272648,172.20.40.110,151.101.194.187,TLSv1.2,2793,Application Data
227,20.8278402,172.20.40.110,151.101.194.187,TLSv1.2,2802,Application Data
228,20.8283089,172.20.40.110,151.101.194.187,TLSv1.2,2795,Application Data
229,20.8470669,151.101.194.187,172.20.40.110,TCP,60,443  >  64055 [ACK] Seq=73957 Ack=138870 Win=947 Len=0
230,20.8470669,151.101.194.187,172.20.40.110,TLSv1.2,131,Application Data
231,20.8524044,151.101.194.187,172.20.40.110,TCP,60,443  >  64055 [ACK] Seq=74034 Ack=141619 Win=957 Len=0
232,20.8524044,151.101.194.187,172.20.40.110,TCP,60,443  >  64055 [ACK] Seq=74034 Ack=144367 Win=968 Len=0
233,20.8533138,151.101.194.187,172.20.40.110,TCP,60,443  >  64055 [ACK] Seq=74034 Ack=147112 Win=979 Len=0
234,20.8533138,151.101.194.187,172.20.40.110,TCP,60,443  >  64055 [ACK] Seq=74034 Ack=149854 Win=989 Len=0
235,20.8533138,151.101.194.187,172.20.40.110,TCP,60,443  >  64055 [ACK] Seq=74034 Ack=152593 Win=1000 Len=0
236,20.8533138,151.101.194.187,172.20.40.110,TCP,60,443  >  64055 [ACK] Seq=74034 Ack=155341 Win=1011 Len=0
237,20.8533138,151.101.194.187,172.20.40.110,TCP,60,443  >  64055 [ACK] Seq=74034 Ack=158082 Win=1022 Len=0
238,20.8553987,151.101.194.187,172.20.40.110,TLSv1.2,131,Application Data
239,20.8554784,172.20.40.110,151.101.194.187,TCP,54,64055  >  443 [ACK] Seq=158082 Ack=74111 Win=510 Len=0
240,20.85767,151.101.194.187,172.20.40.110,TLSv1.2,131,Application Data
241,20.85767,151.101.194.187,172.20.40.110,TLSv1.2,131,Application Data
242,20.85767,151.101.194.187,172.20.40.110,TLSv1.2,130,Application Data
243,20.85767,151.101.194.187,172.20.40.110,TLSv1.2,129,Application Data
244,20.8577523,172.20.40.110,151.101.194.187,TCP,54,64055  >  443 [ACK] Seq=158082 Ack=74416 Win=508 Len=0
245,20.8587055,151.101.194.187,172.20.40.110,TLSv1.2,131,Application Data
246,20.8587055,151.101.194.187,172.20.40.110,TLSv1.2,130,Application Data
247,20.8587741,172.20.40.110,151.101.194.187,TCP,54,64055  >  443 [ACK] Seq=158082 Ack=74569 Win=508 Len=0
248,21.4454778,172.20.40.110,151.101.194.187,TLSv1.2,2811,Application Data
249,21.4564961,151.101.194.187,172.20.40.110,TCP,60,443  >  64055 [ACK] Seq=74569 Ack=160839 Win=1032 Len=0
250,21.4594655,151.101.194.187,172.20.40.110,TLSv1.2,240,Application Data
251,21.4595835,172.20.40.110,151.101.194.187,TLSv1.2,2810,Application Data
252,21.4737662,151.101.194.187,172.20.40.110,TCP,60,443  >  64055 [ACK] Seq=74755 Ack=163595 Win=1044 Len=0
253,21.47579,151.101.194.187,172.20.40.110,TLSv1.2,131,Application Data
254,21.5079923,151.101.194.187,172.20.40.110,TCP,131,"[TCP Retransmission] 443  >  64055 [PSH, ACK] Seq=74755 Ack=163595 Win=1044 Len=77"
255,21.5080643,172.20.40.110,151.101.194.187,TCP,66,64055  >  443 [ACK] Seq=163595 Ack=74832 Win=507 Len=0 SLE=74755 SRE=74832
256,22.6810568,172.20.40.110,151.101.194.187,TLSv1.2,2810,Application Data
257,22.6867172,172.20.40.110,151.101.194.187,TLSv1.2,2811,Application Data
258,22.6882323,172.20.40.110,151.101.194.187,TLSv1.2,2798,Application Data
259,22.6884544,172.20.40.110,151.101.194.187,TLSv1.2,2792,Application Data
260,22.6938552,151.101.194.187,172.20.40.110,TCP,60,443  >  64055 [ACK] Seq=74832 Ack=166351 Win=1055 Len=0
261,22.6978712,151.101.194.187,172.20.40.110,TLSv1.2,424,Application Data
262,22.6978712,151.101.194.187,172.20.40.110,TCP,60,443  >  64055 [ACK] Seq=75202 Ack=169108 Win=1065 Len=0
263,22.6979798,172.20.40.110,151.101.194.187,TCP,54,64055  >  443 [ACK] Seq=174590 Ack=75202 Win=512 Len=0
264,22.6991203,151.101.194.187,172.20.40.110,TLSv1.2,103,Application Data
265,22.6991941,172.20.40.110,151.101.194.187,TCP,54,64055  >  443 [ACK] Seq=174590 Ack=75251 Win=511 Len=0
266,22.7016709,151.101.194.187,172.20.40.110,TCP,60,443  >  64055 [ACK] Seq=75251 Ack=171852 Win=1076 Len=0
267,22.7016709,151.101.194.187,172.20.40.110,TCP,60,443  >  64055 [ACK] Seq=75251 Ack=174590 Win=1087 Len=0
268,22.7044896,151.101.194.187,172.20.40.110,TLSv1.2,130,Application Data
269,22.7044896,151.101.194.187,172.20.40.110,TLSv1.2,130,Application Data
270,22.704618,172.20.40.110,151.101.194.187,TCP,54,64055  >  443 [ACK] Seq=174590 Ack=75403 Win=511 Len=0
271,22.8678089,172.20.40.110,151.101.194.187,TLSv1.2,2814,Application Data
272,22.880308,151.101.194.187,172.20.40.110,TCP,60,443  >  64055 [ACK] Seq=75403 Ack=177350 Win=1097 Len=0
273,22.8844976,151.101.194.187,172.20.40.110,TLSv1.2,130,Application Data
274,22.9119781,151.101.194.187,172.20.40.110,TCP,130,"[TCP Retransmission] 443  >  64055 [PSH, ACK] Seq=75403 Ack=177350 Win=1097 Len=76"
275,22.9120404,172.20.40.110,151.101.194.187,TCP,66,64055  >  443 [ACK] Seq=177350 Ack=75479 Win=511 Len=0 SLE=75403 SRE=75479
276,23.1089299,172.20.40.110,151.101.194.187,TLSv1.2,2803,Application Data
277,23.1109816,172.20.40.110,151.101.194.187,TLSv1.2,2806,Application Data
278,23.1115772,172.20.40.110,151.101.194.187,TLSv1.2,2800,Application Data
279,23.1145084,172.20.40.110,151.101.194.187,TLSv1.2,2797,Application Data
280,23.1185968,151.101.194.187,172.20.40.110,TCP,60,443  >  64055 [ACK] Seq=75479 Ack=180099 Win=1108 Len=0
281,23.1202432,151.101.194.187,172.20.40.110,TCP,60,443  >  64055 [ACK] Seq=75479 Ack=182851 Win=1119 Len=0
282,23.1202432,151.101.194.187,172.20.40.110,TLSv1.2,104,Application Data
283,23.1215378,151.101.194.187,172.20.40.110,TLSv1.2,130,Application Data
284,23.121613,172.20.40.110,151.101.194.187,TCP,54,64055  >  443 [ACK] Seq=188340 Ack=75605 Win=510 Len=0
285,23.1230266,151.101.194.187,172.20.40.110,TCP,60,443  >  64055 [ACK] Seq=75605 Ack=185597 Win=1130 Len=0
286,23.1242405,151.101.194.187,172.20.40.110,TCP,60,443  >  64055 [ACK] Seq=75605 Ack=188340 Win=1140 Len=0
287,23.1269902,151.101.194.187,172.20.40.110,TLSv1.2,130,Application Data
288,23.1281317,151.101.194.187,172.20.40.110,TLSv1.2,130,Application Data
289,23.1282315,172.20.40.110,151.101.194.187,TCP,54,64055  >  443 [ACK] Seq=188340 Ack=75757 Win=509 Len=0
290,23.1566766,172.20.40.110,151.101.194.187,TLSv1.2,2810,Application Data
291,23.1594977,172.20.40.110,151.101.194.187,TLSv1.2,2811,Application Data
292,23.1677837,151.101.194.187,172.20.40.110,TCP,60,443  >  64055 [ACK] Seq=75757 Ack=191096 Win=1151 Len=0
293,23.1711022,151.101.194.187,172.20.40.110,TCP,60,443  >  64055 [ACK] Seq=75757 Ack=193853 Win=1162 Len=0
294,23.1745172,151.101.194.187,172.20.40.110,TLSv1.2,208,Application Data
295,23.1745172,151.101.194.187,172.20.40.110,TLSv1.2,130,Application Data
296,23.1746202,172.20.40.110,151.101.194.187,TCP,54,64055  >  443 [ACK] Seq=193853 Ack=75987 Win=509 Len=0
297,24.0121819,172.20.40.110,151.101.194.187,TLSv1.2,2809,Application Data
298,24.0236726,151.101.194.187,172.20.40.110,TCP,60,443  >  64055 [ACK] Seq=75987 Ack=196608 Win=1173 Len=0
299,24.0275501,151.101.194.187,172.20.40.110,TLSv1.2,104,Application Data
300,24.0417746,172.20.40.110,151.101.194.187,TLSv1.2,2807,Application Data
301,24.0551407,151.101.194.187,172.20.40.110,TCP,104,"[TCP Spurious Retransmission] 443  >  64055 [PSH, ACK] Seq=75987 Ack=196608 Win=1173 Len=50"
302,24.0551407,151.101.194.187,172.20.40.110,TCP,60,443  >  64055 [ACK] Seq=76037 Ack=199361 Win=1183 Len=0
303,24.0554484,172.20.40.110,151.101.194.187,TCP,66,[TCP Dup ACK 300#1] 64055  >  443 [ACK] Seq=199361 Ack=76037 Win=508 Len=0 SLE=75987 SRE=76037
304,24.0593357,151.101.194.187,172.20.40.110,TLSv1.2,130,Application Data
305,24.0837653,151.101.194.187,172.20.40.110,TCP,130,"[TCP Retransmission] 443  >  64055 [PSH, ACK] Seq=76037 Ack=199361 Win=1183 Len=76"
306,24.0838397,172.20.40.110,151.101.194.187,TCP,66,64055  >  443 [ACK] Seq=199361 Ack=76113 Win=508 Len=0 SLE=76037 SRE=76113
307,24.1852831,172.20.40.110,151.101.194.187,TLSv1.2,2810,Application Data
308,24.197126,151.101.194.187,172.20.40.110,TCP,60,443  >  64055 [ACK] Seq=76113 Ack=202117 Win=1194 Len=0
309,24.2162193,151.101.194.187,172.20.40.110,TLSv1.2,213,Application Data
310,24.2422564,151.101.194.187,172.20.40.110,TCP,213,"[TCP Retransmission] 443  >  64055 [PSH, ACK] Seq=76113 Ack=202117 Win=1194 Len=159"
311,24.2423266,172.20.40.110,151.101.194.187,TCP,66,64055  >  443 [ACK] Seq=202117 Ack=76272 Win=507 Len=0 SLE=76113 SRE=76272
312,25.7417879,172.20.40.110,151.101.194.187,TLSv1.2,2795,Application Data
313,25.7562648,151.101.194.187,172.20.40.110,TCP,60,443  >  64055 [ACK] Seq=76272 Ack=204858 Win=1205 Len=0
314,25.7589829,151.101.194.187,172.20.40.110,TLSv1.2,451,Application Data
315,25.7837482,151.101.194.187,172.20.40.110,TCP,451,"[TCP Retransmission] 443  >  64055 [PSH, ACK] Seq=76272 Ack=204858 Win=1205 Len=397"
316,25.7838285,172.20.40.110,151.101.194.187,TCP,66,64055  >  443 [ACK] Seq=204858 Ack=76669 Win=512 Len=0 SLE=76272 SRE=76669
317,25.9281361,172.20.40.110,151.101.194.187,TLSv1.2,2795,Application Data
318,25.9433697,151.101.194.187,172.20.40.110,TCP,60,443  >  64055 [ACK] Seq=76669 Ack=207599 Win=1216 Len=0
319,25.9464237,151.101.194.187,172.20.40.110,TLSv1.2,131,Application Data
320,25.9723496,151.101.194.187,172.20.40.110,TCP,131,"[TCP Retransmission] 443  >  64055 [PSH, ACK] Seq=76669 Ack=207599 Win=1216 Len=77"
321,25.9723974,172.20.40.110,151.101.194.187,TCP,66,64055  >  443 [ACK] Seq=207599 Ack=76746 Win=511 Len=0 SLE=76669 SRE=76746
322,26.4840471,172.20.40.110,151.101.194.187,TLSv1.2,2807,Application Data
323,26.4922808,172.20.40.110,151.101.194.187,TLSv1.2,2795,Application Data
324,26.4955604,151.101.194.187,172.20.40.110,TCP,60,443  >  64055 [ACK] Seq=76746 Ack=210352 Win=1226 Len=0
325,26.501535,151.101.194.187,172.20.40.110,TLSv1.2,213,Application Data
326,26.501535,151.101.194.187,172.20.40.110,TCP,60,443  >  64055 [ACK] Seq=76905 Ack=213093 Win=1237 Len=0
327,26.5029553,172.20.40.110,151.101.194.187,TLSv1.2,2795,Application Data
328,26.5057002,151.101.194.187,172.20.40.110,TLSv1.2,104,Application Data
329,26.5126861,151.101.194.187,172.20.40.110,TCP,60,443  >  64055 [ACK] Seq=76955 Ack=215834 Win=1248 Len=0
330,26.5171612,151.101.194.187,172.20.40.110,TLSv1.2,98,Application Data
331,26.5172377,172.20.40.110,151.101.194.187,TCP,54,64055  >  443 [ACK] Seq=215834 Ack=76999 Win=510 Len=0
332,29.052296,172.20.40.110,151.101.194.187,TLSv1.2,2610,Application Data
333,29.0633261,151.101.194.187,172.20.40.110,TCP,60,443  >  64055 [ACK] Seq=76999 Ack=218390 Win=1258 Len=0
334,29.135798,151.101.194.187,172.20.40.110,TLSv1.2,339,Application Data
335,29.135798,151.101.194.187,172.20.40.110,TLSv1.2,357,Application Data
336,29.1358834,172.20.40.110,151.101.194.187,TCP,54,64055  >  443 [ACK] Seq=218390 Ack=77587 Win=508 Len=0
337,29.1376618,172.20.40.110,151.101.194.187,TLSv1.2,89,Application Data
338,29.1454331,151.101.194.187,172.20.40.110,TCP,60,443  >  64055 [ACK] Seq=77587 Ack=218425 Win=1258 Len=0
339,30.4542267,172.20.40.110,151.101.194.187,TLSv1.2,2893,Application Data
340,30.4647914,151.101.194.187,172.20.40.110,TCP,60,443  >  64055 [ACK] Seq=77587 Ack=221264 Win=1269 Len=0
341,30.4679908,151.101.194.187,172.20.40.110,TLSv1.2,240,Application Data
342,30.4790929,172.20.40.110,151.101.194.187,TLSv1.2,2884,Application Data
343,30.4836489,172.20.40.110,151.101.194.187,TLSv1.2,2879,Application Data
344,30.4841969,172.20.40.110,151.101.194.187,TLSv1.2,2878,Application Data
345,30.4899417,151.101.194.187,172.20.40.110,TCP,60,443  >  64055 [ACK] Seq=77773 Ack=224094 Win=1280 Len=0
346,30.4938144,151.101.194.187,172.20.40.110,TLSv1.2,130,Application Data
347,30.5014525,151.101.194.187,172.20.40.110,TCP,60,443  >  64055 [ACK] Seq=77849 Ack=226919 Win=1291 Len=0
348,30.5014525,151.101.194.187,172.20.40.110,TCP,60,443  >  64055 [ACK] Seq=77849 Ack=229743 Win=1302 Len=0
349,30.5014525,151.101.194.187,172.20.40.110,TLSv1.2,130,Application Data
350,30.5014525,151.101.194.187,172.20.40.110,TLSv1.2,153,Application Data
351,30.5015551,172.20.40.110,151.101.194.187,TCP,54,64055  >  443 [ACK] Seq=229743 Ack=78024 Win=506 Len=0
352,30.5175908,172.20.40.110,151.101.194.187,TLSv1.2,2879,Application Data
353,30.5278467,151.101.194.187,172.20.40.110,TCP,60,443  >  64055 [ACK] Seq=78024 Ack=232568 Win=1313 Len=0
354,30.5316885,151.101.194.187,172.20.40.110,TLSv1.2,291,Application Data
355,30.5731087,151.101.194.187,172.20.40.110,TCP,291,"[TCP Retransmission] 443  >  64055 [PSH, ACK] Seq=78024 Ack=232568 Win=1313 Len=237"
356,30.573194,172.20.40.110,151.101.194.187,TCP,66,64055  >  443 [ACK] Seq=232568 Ack=78261 Win=512 Len=0 SLE=78024 SRE=78261
357,30.6000547,172.20.40.110,151.101.194.187,TLSv1.2,2892,Application Data
358,30.6126905,151.101.194.187,172.20.40.110,TCP,60,443  >  64055 [ACK] Seq=78261 Ack=235406 Win=1324 Len=0
359,30.6126905,151.101.194.187,172.20.40.110,TLSv1.2,130,Application Data
360,30.6438678,151.101.194.187,172.20.40.110,TCP,130,"[TCP Retransmission] 443  >  64055 [PSH, ACK] Seq=78261 Ack=235406 Win=1324 Len=76"
361,30.643924,172.20.40.110,151.101.194.187,TCP,66,64055  >  443 [ACK] Seq=235406 Ack=78337 Win=511 Len=0 SLE=78261 SRE=78337
362,30.7102185,172.20.40.110,151.101.194.187,TLSv1.2,2878,Application Data
363,30.7223841,151.101.194.187,172.20.40.110,TCP,60,443  >  64055 [ACK] Seq=78337 Ack=238230 Win=1335 Len=0
364,30.7242777,151.101.194.187,172.20.40.110,TLSv1.2,130,Application Data
365,30.7495879,172.20.40.110,151.101.194.187,TLSv1.2,2875,Application Data
366,30.7561844,151.101.194.187,172.20.40.110,TCP,130,"[TCP Spurious Retransmission] 443  >  64055 [PSH, ACK] Seq=78337 Ack=238230 Win=1335 Len=76"
367,30.7562986,172.20.40.110,151.101.194.187,TCP,66,[TCP Dup ACK 365#1] 64055  >  443 [ACK] Seq=241051 Ack=78413 Win=511 Len=0 SLE=78337 SRE=78413
368,30.761603,151.101.194.187,172.20.40.110,TCP,60,443  >  64055 [ACK] Seq=78413 Ack=241051 Win=1346 Len=0
369,30.7637811,151.101.194.187,172.20.40.110,TLSv1.2,131,Application Data
370,30.7688232,172.20.40.110,151.101.194.187,TLSv1.2,2892,Application Data
371,30.7766156,172.20.40.110,151.101.194.187,TLSv1.2,2893,Application Data
372,30.7793479,151.101.194.187,172.20.40.110,TCP,60,443  >  64055 [ACK] Seq=78490 Ack=243889 Win=1357 Len=0
373,30.7847811,151.101.194.187,172.20.40.110,TLSv1.2,131,Application Data
374,30.7860697,151.101.194.187,172.20.40.110,TCP,60,443  >  64055 [ACK] Seq=78567 Ack=246728 Win=1368 Len=0
375,30.7893126,151.101.194.187,172.20.40.110,TLSv1.2,98,Application Data
376,30.7893958,172.20.40.110,151.101.194.187,TCP,54,64055  >  443 [ACK] Seq=246728 Ack=78611 Win=510 Len=0
377,30.9773297,172.20.40.110,151.101.194.187,TLSv1.2,2875,Application Data
378,30.9790667,172.20.40.110,151.101.194.187,TLSv1.2,2881,Application Data
379,30.9798789,172.20.40.110,151.101.194.187,TLSv1.2,2877,Application Data
380,30.9800772,172.20.40.110,151.101.194.187,TLSv1.2,2880,Application Data
381,30.9891492,151.101.194.187,172.20.40.110,TCP,60,443  >  64055 [ACK] Seq=78611 Ack=249549 Win=1379 Len=0
382,30.9925315,151.101.194.187,172.20.40.110,TLSv1.2,98,Application Data
383,30.9938264,151.101.194.187,172.20.40.110,TCP,60,443  >  64055 [ACK] Seq=78655 Ack=252376 Win=1390 Len=0
384,30.9938264,151.101.194.187,172.20.40.110,TCP,60,443  >  64055 [ACK] Seq=78655 Ack=255199 Win=1401 Len=0
385,30.9962737,151.101.194.187,172.20.40.110,TCP,60,443  >  64055 [ACK] Seq=78655 Ack=258025 Win=1413 Len=0
386,30.9973972,151.101.194.187,172.20.40.110,TLSv1.2,130,Application Data
387,30.9973972,151.101.194.187,172.20.40.110,TLSv1.2,130,Application Data
388,30.9974825,172.20.40.110,151.101.194.187,TCP,54,64055  >  443 [ACK] Seq=258025 Ack=78807 Win=509 Len=0
389,30.9995535,151.101.194.187,172.20.40.110,TLSv1.2,129,Application Data
390,30.9996613,172.20.40.110,151.101.194.187,TCP,54,64055  >  443 [ACK] Seq=258025 Ack=78882 Win=509 Len=0
391,31.103406,172.20.40.110,151.101.194.187,TLSv1.2,2892,Application Data
392,31.1146841,151.101.194.187,172.20.40.110,TCP,60,443  >  64055 [ACK] Seq=78882 Ack=260863 Win=1424 Len=0
393,31.1181684,151.101.194.187,172.20.40.110,TLSv1.2,240,Application Data
394,31.1472678,151.101.194.187,172.20.40.110,TCP,240,"[TCP Retransmission] 443  >  64055 [PSH, ACK] Seq=78882 Ack=260863 Win=1424 Len=186"
395,31.1473246,172.20.40.110,151.101.194.187,TCP,66,64055  >  443 [ACK] Seq=260863 Ack=79068 Win=508 Len=0 SLE=78882 SRE=79068
396,31.1968066,172.20.40.110,151.101.194.187,TLSv1.2,2892,Application Data
397,31.1986095,172.20.40.110,151.101.194.187,TLSv1.2,2893,Application Data
398,31.2072296,151.101.194.187,172.20.40.110,TCP,60,443  >  64055 [ACK] Seq=79068 Ack=263701 Win=1435 Len=0
399,31.2098456,151.101.194.187,172.20.40.110,TCP,60,443  >  64055 [ACK] Seq=79068 Ack=266540 Win=1446 Len=0
400,31.2112792,151.101.194.187,172.20.40.110,TLSv1.2,208,Application Data
401,31.2112792,151.101.194.187,172.20.40.110,TLSv1.2,130,Application Data
402,31.2113696,172.20.40.110,151.101.194.187,TCP,54,64055  >  443 [ACK] Seq=266540 Ack=79298 Win=508 Len=0
403,31.3831046,172.20.40.110,151.101.194.187,TLSv1.2,2884,Application Data
404,31.3989513,151.101.194.187,172.20.40.110,TCP,60,443  >  64055 [ACK] Seq=79298 Ack=269370 Win=1457 Len=0
405,31.4003286,151.101.194.187,172.20.40.110,TLSv1.2,180,Application Data
406,31.4165727,172.20.40.110,151.101.194.187,TLSv1.2,2886,Application Data
407,31.4171286,172.20.40.110,151.101.194.187,TLSv1.2,2875,Application Data
408,31.4260083,151.101.194.187,172.20.40.110,TCP,60,443  >  64055 [ACK] Seq=79424 Ack=272202 Win=1469 Len=0
409,31.4284064,151.101.194.187,172.20.40.110,TCP,60,443  >  64055 [ACK] Seq=79424 Ack=275023 Win=1480 Len=0
410,31.431264,151.101.194.187,172.20.40.110,TLSv1.2,291,Application Data
411,31.431264,151.101.194.187,172.20.40.110,TLSv1.2,130,Application Data
412,31.4313459,172.20.40.110,151.101.194.187,TCP,54,64055  >  443 [ACK] Seq=275023 Ack=79737 Win=512 Len=0
413,31.4956844,172.20.40.110,151.101.194.187,TLSv1.2,2878,Application Data
414,31.5070738,151.101.194.187,172.20.40.110,TCP,60,443  >  64055 [ACK] Seq=79737 Ack=277847 Win=1491 Len=0
415,31.5111872,151.101.194.187,172.20.40.110,TLSv1.2,130,Application Data
416,31.5410301,151.101.194.187,172.20.40.110,TCP,130,"[TCP Retransmission] 443  >  64055 [PSH, ACK] Seq=79737 Ack=277847 Win=1491 Len=76"
417,31.5410942,172.20.40.110,151.101.194.187,TCP,66,64055  >  443 [ACK] Seq=277847 Ack=79813 Win=511 Len=0 SLE=79737 SRE=79813
418,32.058494,172.20.40.110,151.101.194.187,TLSv1.2,2847,Application Data
419,32.0642507,172.20.40.110,151.101.194.187,TLSv1.2,2879,Application Data
420,32.0691346,151.101.194.187,172.20.40.110,TCP,60,443  >  64055 [ACK] Seq=79813 Ack=280640 Win=1501 Len=0
421,32.0724345,151.101.194.187,172.20.40.110,TLSv1.2,130,Application Data
422,32.0746558,151.101.194.187,172.20.40.110,TCP,60,443  >  64055 [ACK] Seq=79889 Ack=283465 Win=1512 Len=0
423,32.0791785,151.101.194.187,172.20.40.110,TLSv1.2,130,Application Data
424,32.0792429,172.20.40.110,151.101.194.187,TCP,54,64055  >  443 [ACK] Seq=283465 Ack=79965 Win=511 Len=0
425,32.1040836,172.20.40.110,151.101.194.187,TLSv1.2,2616,Application Data
426,32.1130979,151.101.194.187,172.20.40.110,TCP,60,443  >  64055 [ACK] Seq=79965 Ack=286027 Win=1523 Len=0
427,32.190205,151.101.194.187,172.20.40.110,TLSv1.2,522,Application Data
428,32.1918325,151.101.194.187,172.20.40.110,TLSv1.2,86,Application Data
429,32.1918325,151.101.194.187,172.20.40.110,TLSv1.2,878,Application Data
430,32.1918325,151.101.194.187,172.20.40.110,TLSv1.2,86,Application Data
431,32.1918325,151.101.194.187,172.20.40.110,TLSv1.2,86,Application Data
432,32.1918325,151.101.194.187,172.20.40.110,TLSv1.2,124,"Application Data, Application Data"
433,32.1918325,151.101.194.187,172.20.40.110,TLSv1.2,87,Application Data
434,32.1918325,151.101.194.187,172.20.40.110,TLSv1.2,86,Application Data
435,32.1918325,151.101.194.187,172.20.40.110,TLSv1.2,86,Application Data
436,32.1920538,172.20.40.110,151.101.194.187,TCP,54,64055  >  443 [ACK] Seq=286027 Ack=81520 Win=512 Len=0
437,32.1938144,151.101.194.187,172.20.40.110,TLSv1.2,87,Application Data
438,32.1938144,151.101.194.187,172.20.40.110,TLSv1.2,382,Application Data
439,32.1938144,151.101.194.187,172.20.40.110,TLSv1.2,85,Application Data
440,32.1939063,172.20.40.110,151.101.194.187,TCP,54,64055  >  443 [ACK] Seq=286027 Ack=81912 Win=510 Len=0
441,32.4186893,172.20.40.110,151.101.130.187,TLSv1.2,175,Ignored Unknown Record
442,32.4188211,172.20.40.110,151.101.130.187,TLSv1.2,93,Application Data
443,32.4277561,151.101.130.187,172.20.40.110,TCP,66,[TCP Dup ACK 2#1] 443  >  57648 [ACK] Seq=1 Ack=2 Win=281 Len=0 SLE=123 SRE=162
444,32.4277561,151.101.130.187,172.20.40.110,TCP,60,443  >  57648 [ACK] Seq=1 Ack=162 Win=281 Len=0
445,32.4277561,151.101.130.187,172.20.40.110,TLSv1.2,93,Application Data
446,32.4288188,151.101.130.187,172.20.40.110,TLSv1.2,266,Application Data
447,32.4288995,172.20.40.110,151.101.130.187,TCP,54,57648  >  443 [ACK] Seq=162 Ack=252 Win=253 Len=0
448,32.7647521,172.20.40.110,151.101.194.187,TLSv1.2,2892,Application Data
449,32.7767346,151.101.194.187,172.20.40.110,TCP,60,443  >  64055 [ACK] Seq=81912 Ack=288865 Win=1534 Len=0
450,32.7779797,151.101.194.187,172.20.40.110,TLSv1.2,428,Application Data
451,32.7949355,172.20.40.110,151.101.194.187,TLSv1.2,2893,Application Data
452,32.8058329,151.101.194.187,172.20.40.110,TCP,60,443  >  64055 [ACK] Seq=82286 Ack=291704 Win=1545 Len=0
453,32.808053,151.101.194.187,172.20.40.110,TLSv1.2,130,Application Data
454,32.8405181,151.101.194.187,172.20.40.110,TCP,130,"[TCP Retransmission] 443  >  64055 [PSH, ACK] Seq=82286 Ack=291704 Win=1545 Len=76"
455,32.8405727,172.20.40.110,151.101.194.187,TCP,66,64055  >  443 [ACK] Seq=291704 Ack=82362 Win=508 Len=0 SLE=82286 SRE=82362
456,32.9319369,172.20.40.110,151.101.194.187,TLSv1.2,2882,Application Data
457,32.9378809,172.20.40.110,151.101.194.187,TLSv1.2,2876,Application Data
458,32.9381395,172.20.40.110,151.101.194.187,TLSv1.2,2877,Application Data
459,32.9445997,151.101.194.187,172.20.40.110,TCP,60,443  >  64055 [ACK] Seq=82362 Ack=294532 Win=1556 Len=0
460,32.9457105,151.101.194.187,172.20.40.110,TLSv1.2,130,Application Data
461,32.9512183,151.101.194.187,172.20.40.110,TCP,60,443  >  64055 [ACK] Seq=82438 Ack=297354 Win=1567 Len=0
462,32.9512183,151.101.194.187,172.20.40.110,TCP,60,443  >  64055 [ACK] Seq=82438 Ack=300177 Win=1578 Len=0
463,32.9536856,151.101.194.187,172.20.40.110,TLSv1.2,130,Application Data
464,32.9536856,151.101.194.187,172.20.40.110,TLSv1.2,131,Application Data
465,32.9538117,172.20.40.110,151.101.194.187,TCP,54,64055  >  443 [ACK] Seq=300177 Ack=82591 Win=507 Len=0
466,37.0444244,172.20.40.110,151.101.194.187,TLSv1.2,2892,Application Data
467,37.0569469,151.101.194.187,172.20.40.110,TCP,60,443  >  64055 [ACK] Seq=82591 Ack=303015 Win=1589 Len=0
468,37.0661979,151.101.194.187,172.20.40.110,TLSv1.2,214,Application Data
469,37.091381,151.101.194.187,172.20.40.110,TCP,214,"[TCP Retransmission] 443  >  64055 [PSH, ACK] Seq=82591 Ack=303015 Win=1589 Len=160"
470,37.0914819,172.20.40.110,151.101.194.187,TCP,66,64055  >  443 [ACK] Seq=303015 Ack=82751 Win=507 Len=0 SLE=82591 SRE=82751
471,37.0975698,172.20.40.110,151.101.194.187,TLSv1.2,2893,Application Data
472,37.1075175,151.101.194.187,172.20.40.110,TCP,60,443  >  64055 [ACK] Seq=82751 Ack=305854 Win=1600 Len=0
473,37.1108188,151.101.194.187,172.20.40.110,TLSv1.2,103,Application Data
474,37.1421884,151.101.194.187,172.20.40.110,TCP,103,"[TCP Retransmission] 443  >  64055 [PSH, ACK] Seq=82751 Ack=305854 Win=1600 Len=49"
475,37.1423023,172.20.40.110,151.101.194.187,TCP,66,64055  >  443 [ACK] Seq=305854 Ack=82800 Win=507 Len=0 SLE=82751 SRE=82800
476,39.3084026,172.20.40.110,151.101.194.187,TLSv1.2,2892,Application Data
477,39.3206476,151.101.194.187,172.20.40.110,TCP,60,443  >  64055 [ACK] Seq=82800 Ack=308692 Win=1611 Len=0
478,39.3220602,151.101.194.187,172.20.40.110,TLSv1.2,214,Application Data
479,39.3545351,151.101.194.187,172.20.40.110,TCP,214,"[TCP Retransmission] 443  >  64055 [PSH, ACK] Seq=82800 Ack=308692 Win=1611 Len=160"
480,39.354604,172.20.40.110,151.101.194.187,TCP,66,64055  >  443 [ACK] Seq=308692 Ack=82960 Win=512 Len=0 SLE=82800 SRE=82960
481,39.3745112,172.20.40.110,151.101.194.187,TLSv1.2,2890,Application Data
482,39.3835057,151.101.194.187,172.20.40.110,TCP,60,443  >  64055 [ACK] Seq=82960 Ack=311528 Win=1622 Len=0
483,39.3877802,151.101.194.187,172.20.40.110,TLSv1.2,130,Application Data
484,39.4192093,151.101.194.187,172.20.40.110,TCP,130,"[TCP Retransmission] 443  >  64055 [PSH, ACK] Seq=82960 Ack=311528 Win=1622 Len=76"
485,39.4192604,172.20.40.110,151.101.194.187,TCP,66,64055  >  443 [ACK] Seq=311528 Ack=83036 Win=511 Len=0 SLE=82960 SRE=83036
486,40.3569456,172.20.40.110,151.101.194.187,TLSv1.2,2893,Application Data
487,40.3723381,151.101.194.187,172.20.40.110,TCP,60,443  >  64055 [ACK] Seq=83036 Ack=314367 Win=1633 Len=0
488,40.3723381,151.101.194.187,172.20.40.110,TLSv1.2,213,Application Data
489,40.4035092,151.101.194.187,172.20.40.110,TCP,213,"[TCP Retransmission] 443  >  64055 [PSH, ACK] Seq=83036 Ack=314367 Win=1633 Len=159"
490,40.4035608,172.20.40.110,151.101.194.187,TCP,66,64055  >  443 [ACK] Seq=314367 Ack=83195 Win=511 Len=0 SLE=83036 SRE=83195
491,40.4493707,172.20.40.110,151.101.194.187,TLSv1.2,2892,Application Data
492,40.4649831,151.101.194.187,172.20.40.110,TCP,60,443  >  64055 [ACK] Seq=83195 Ack=317205 Win=1644 Len=0
493,40.4663667,151.101.194.187,172.20.40.110,TLSv1.2,130,Application Data
494,40.5014366,151.101.194.187,172.20.40.110,TCP,130,"[TCP Retransmission] 443  >  64055 [PSH, ACK] Seq=83195 Ack=317205 Win=1644 Len=76"
495,40.5015065,172.20.40.110,151.101.194.187,TCP,66,64055  >  443 [ACK] Seq=317205 Ack=83271 Win=510 Len=0 SLE=83195 SRE=83271
496,47.0734961,172.20.40.110,151.101.194.187,TLSv1.2,2886,Application Data
497,47.085458,151.101.194.187,172.20.40.110,TCP,60,443  >  64055 [ACK] Seq=83271 Ack=320037 Win=1655 Len=0
498,47.0887333,151.101.194.187,172.20.40.110,TLSv1.2,451,Application Data
499,47.1187468,151.101.194.187,172.20.40.110,TCP,451,"[TCP Retransmission] 443  >  64055 [PSH, ACK] Seq=83271 Ack=320037 Win=1655 Len=397"
500,47.1188116,172.20.40.110,151.101.194.187,TCP,66,64055  >  443 [ACK] Seq=320037 Ack=83668 Win=509 Len=0 SLE=83271 SRE=83668
501,47.3363729,172.20.40.110,151.101.194.187,TLSv1.2,2905,Application Data
502,47.3494401,151.101.194.187,172.20.40.110,TCP,60,443  >  64055 [ACK] Seq=83668 Ack=322888 Win=1666 Len=0
503,47.3519914,151.101.194.187,172.20.40.110,TLSv1.2,240,Application Data
504,47.372065,172.20.40.110,151.101.194.187,TLSv1.2,2890,Application Data
505,47.3723357,172.20.40.110,151.101.194.187,TLSv1.2,2896,Application Data
506,47.3757023,172.20.40.110,151.101.194.187,TLSv1.2,2890,Application Data
507,47.3813221,151.101.194.187,172.20.40.110,TCP,60,443  >  64055 [ACK] Seq=83854 Ack=325724 Win=1678 Len=0
508,47.3837617,151.101.194.187,172.20.40.110,TCP,60,443  >  64055 [ACK] Seq=83854 Ack=328566 Win=1689 Len=0
509,47.3860505,151.101.194.187,172.20.40.110,TLSv1.2,131,Application Data
510,47.3860505,151.101.194.187,172.20.40.110,TCP,60,443  >  64055 [ACK] Seq=83931 Ack=331402 Win=1700 Len=0
511,47.387061,151.101.194.187,172.20.40.110,TLSv1.2,130,Application Data
512,47.3871602,172.20.40.110,151.101.194.187,TCP,54,64055  >  443 [ACK] Seq=331402 Ack=84007 Win=508 Len=0
513,47.3892275,151.101.194.187,172.20.40.110,TLSv1.2,130,Application Data
514,47.4242212,172.20.40.110,151.101.194.187,TLSv1.2,2890,Application Data
515,47.4301215,151.101.194.187,172.20.40.110,TCP,130,"[TCP Spurious Retransmission] 443  >  64055 [PSH, ACK] Seq=84007 Ack=331402 Win=1700 Len=76"
516,47.4302308,172.20.40.110,151.101.194.187,TCP,66,[TCP Dup ACK 514#1] 64055  >  443 [ACK] Seq=334238 Ack=84083 Win=507 Len=0 SLE=84007 SRE=84083
517,47.4349152,151.101.194.187,172.20.40.110,TCP,60,443  >  64055 [ACK] Seq=84083 Ack=334238 Win=1711 Len=0
518,47.4359872,151.101.194.187,172.20.40.110,TLSv1.2,130,Application Data
519,47.47216,151.101.194.187,172.20.40.110,TCP,130,"[TCP Retransmission] 443  >  64055 [PSH, ACK] Seq=84083 Ack=334238 Win=1711 Len=76"
520,47.4722137,172.20.40.110,151.101.194.187,TCP,66,64055  >  443 [ACK] Seq=334238 Ack=84159 Win=507 Len=0 SLE=84083 SRE=84159
521,47.4750606,172.20.40.110,151.101.194.187,TLSv1.2,2902,Application Data
522,47.4838045,151.101.194.187,172.20.40.110,TCP,60,443  >  64055 [ACK] Seq=84159 Ack=337086 Win=1722 Len=0
523,47.4870521,151.101.194.187,172.20.40.110,TLSv1.2,103,Application Data
524,47.4981904,172.20.40.110,151.101.194.187,TLSv1.2,2904,Application Data
525,47.5073065,151.101.194.187,172.20.40.110,TCP,60,443  >  64055 [ACK] Seq=84208 Ack=339936 Win=1733 Len=0
526,47.5104858,151.101.194.187,172.20.40.110,TLSv1.2,131,Application Data
527,47.5456932,151.101.194.187,172.20.40.110,TCP,131,"[TCP Retransmission] 443  >  64055 [PSH, ACK] Seq=84208 Ack=339936 Win=1733 Len=77"
528,47.5457593,172.20.40.110,151.101.194.187,TCP,66,64055  >  443 [ACK] Seq=339936 Ack=84285 Win=506 Len=0 SLE=84208 SRE=84285
529,47.5912979,172.20.40.110,151.101.194.187,TLSv1.2,2887,Application Data
530,47.5977356,172.20.40.110,151.101.194.187,TLSv1.2,2904,Application Data
531,47.6031874,151.101.194.187,172.20.40.110,TCP,60,443  >  64055 [ACK] Seq=84285 Ack=342769 Win=1744 Len=0
532,47.6031874,151.101.194.187,172.20.40.110,TLSv1.2,131,Application Data
533,47.6033085,172.20.40.110,151.101.194.187,TCP,54,64055  >  443 [ACK] Seq=345619 Ack=84362 Win=512 Len=0
534,47.6078119,151.101.194.187,172.20.40.110,TCP,60,443  >  64055 [ACK] Seq=84362 Ack=345619 Win=1755 Len=0
535,47.6100491,151.101.194.187,172.20.40.110,TLSv1.2,130,Application Data
536,47.6101399,172.20.40.110,151.101.194.187,TCP,54,64055  >  443 [ACK] Seq=345619 Ack=84438 Win=511 Len=0
537,47.9281312,172.20.40.110,151.101.194.187,TLSv1.2,2890,Application Data
538,47.9403964,151.101.194.187,172.20.40.110,TCP,60,443  >  64055 [ACK] Seq=84438 Ack=348455 Win=1766 Len=0
539,47.9561426,151.101.194.187,172.20.40.110,TLSv1.2,130,Application Data
540,47.9884504,151.101.194.187,172.20.40.110,TCP,130,"[TCP Retransmission] 443  >  64055 [PSH, ACK] Seq=84438 Ack=348455 Win=1766 Len=76"
541,47.9886036,172.20.40.110,151.101.194.187,TCP,66,64055  >  443 [ACK] Seq=348455 Ack=84514 Win=511 Len=0 SLE=84438 SRE=84514
542,48.1646312,172.20.40.110,151.101.194.187,TLSv1.2,2896,Application Data
543,48.1729653,172.20.40.110,151.101.194.187,TLSv1.2,2894,Application Data
544,48.1732346,172.20.40.110,151.101.194.187,TLSv1.2,2885,Application Data
545,48.1733863,172.20.40.110,151.101.194.187,TLSv1.2,2889,Application Data
546,48.1735549,172.20.40.110,151.101.194.187,TLSv1.2,2891,Application Data
547,48.1737014,172.20.40.110,151.101.194.187,TLSv1.2,2887,Application Data
548,48.1745808,172.20.40.110,151.101.194.187,TLSv1.2,2890,Application Data
549,48.1863739,151.101.194.187,172.20.40.110,TCP,60,443  >  64055 [ACK] Seq=84514 Ack=351297 Win=1777 Len=0
550,48.1871058,151.101.194.187,172.20.40.110,TLSv1.2,450,Application Data
551,48.1871058,151.101.194.187,172.20.40.110,TCP,60,443  >  64055 [ACK] Seq=84910 Ack=354137 Win=1789 Len=0
552,48.1883895,151.101.194.187,172.20.40.110,TCP,60,443  >  64055 [ACK] Seq=84910 Ack=356968 Win=1800 Len=0
553,48.1883895,151.101.194.187,172.20.40.110,TCP,60,443  >  64055 [ACK] Seq=84910 Ack=359803 Win=1811 Len=0
554,48.1897379,151.101.194.187,172.20.40.110,TLSv1.2,131,Application Data
555,48.1898709,172.20.40.110,151.101.194.187,TCP,54,64055  >  443 [ACK] Seq=368309 Ack=84987 Win=509 Len=0
556,48.193641,151.101.194.187,172.20.40.110,TCP,60,443  >  64055 [ACK] Seq=84987 Ack=362640 Win=1822 Len=0
557,48.193641,151.101.194.187,172.20.40.110,TCP,60,443  >  64055 [ACK] Seq=84987 Ack=365473 Win=1833 Len=0
558,48.193641,151.101.194.187,172.20.40.110,TCP,60,443  >  64055 [ACK] Seq=84987 Ack=368309 Win=1844 Len=0
559,48.1960485,151.101.194.187,172.20.40.110,TLSv1.2,130,Application Data
560,48.1971486,151.101.194.187,172.20.40.110,TLSv1.2,130,Application Data
561,48.197232,172.20.40.110,151.101.194.187,TCP,54,64055  >  443 [ACK] Seq=368309 Ack=85139 Win=509 Len=0
562,48.1996356,151.101.194.187,172.20.40.110,TLSv1.2,129,Application Data
563,48.1996356,151.101.194.187,172.20.40.110,TLSv1.2,130,Application Data
564,48.1997189,172.20.40.110,151.101.194.187,TCP,54,64055  >  443 [ACK] Seq=368309 Ack=85290 Win=508 Len=0
565,48.2027609,151.101.194.187,172.20.40.110,TLSv1.2,124,Application Data
566,48.2389147,151.101.194.187,172.20.40.110,TCP,124,"[TCP Retransmission] 443  >  64055 [PSH, ACK] Seq=85290 Ack=368309 Win=1844 Len=70"
567,48.2390102,172.20.40.110,151.101.194.187,TCP,66,64055  >  443 [ACK] Seq=368309 Ack=85360 Win=508 Len=0 SLE=85290 SRE=85360
568,48.469964,172.20.40.110,151.101.194.187,TLSv1.2,2904,Application Data
569,48.4804003,151.101.194.187,172.20.40.110,TCP,60,443  >  64055 [ACK] Seq=85360 Ack=371159 Win=1855 Len=0
570,48.4872626,172.20.40.110,151.101.194.187,TLSv1.2,2905,Application Data
571,48.490658,151.101.194.187,172.20.40.110,TLSv1.2,104,Application Data
572,48.4964001,151.101.194.187,172.20.40.110,TCP,60,443  >  64055 [ACK] Seq=85410 Ack=374010 Win=1867 Len=0
573,48.5040514,151.101.194.187,172.20.40.110,TLSv1.2,130,Application Data
574,48.5042667,172.20.40.110,151.101.194.187,TCP,54,64055  >  443 [ACK] Seq=374010 Ack=85486 Win=507 Len=0
575,56.8244977,172.20.40.110,151.101.194.187,TLSv1.2,2904,Application Data
576,56.8311772,172.20.40.110,151.101.194.187,TLSv1.2,2902,Application Data
577,56.8398896,151.101.194.187,172.20.40.110,TCP,60,443  >  64055 [ACK] Seq=85486 Ack=376860 Win=1878 Len=0
578,56.8445698,151.101.194.187,172.20.40.110,TLSv1.2,241,Application Data
579,56.8445698,151.101.194.187,172.20.40.110,TCP,60,443  >  64055 [ACK] Seq=85673 Ack=379708 Win=1889 Len=0
580,56.8487742,151.101.194.187,172.20.40.110,TLSv1.2,130,Application Data
581,56.8488661,172.20.40.110,151.101.194.187,TCP,54,64055  >  443 [ACK] Seq=379708 Ack=85749 Win=512 Len=0
582,56.9027225,172.20.40.110,151.101.194.187,TLSv1.2,2905,Application Data
583,56.9119947,151.101.194.187,172.20.40.110,TCP,60,443  >  64055 [ACK] Seq=85749 Ack=382559 Win=1900 Len=0
584,56.915476,151.101.194.187,172.20.40.110,TLSv1.2,103,Application Data
585,56.9489051,151.101.194.187,172.20.40.110,TCP,103,"[TCP Retransmission] 443  >  64055 [PSH, ACK] Seq=85749 Ack=382559 Win=1900 Len=49"
586,56.9489631,172.20.40.110,151.101.194.187,TCP,66,64055  >  443 [ACK] Seq=382559 Ack=85798 Win=511 Len=0 SLE=85749 SRE=85798
587,57.0260173,172.20.40.110,151.101.194.187,TLSv1.2,2902,Application Data
588,57.0350068,151.101.194.187,172.20.40.110,TCP,60,443  >  64055 [ACK] Seq=85798 Ack=385407 Win=1911 Len=0
589,57.0423868,151.101.194.187,172.20.40.110,TLSv1.2,179,Application Data
590,57.0761798,151.101.194.187,172.20.40.110,TCP,179,"[TCP Retransmission] 443  >  64055 [PSH, ACK] Seq=85798 Ack=385407 Win=1911 Len=125"
591,57.0762745,172.20.40.110,151.101.194.187,TCP,66,64055  >  443 [ACK] Seq=385407 Ack=85923 Win=511 Len=0 SLE=85798 SRE=85923
592,57.1131446,172.20.40.110,151.101.194.187,TLSv1.2,2904,Application Data
593,57.1165349,172.20.40.110,151.101.194.187,TLSv1.2,2902,Application Data
594,57.1258196,151.101.194.187,172.20.40.110,TCP,60,443  >  64055 [ACK] Seq=85923 Ack=388257 Win=1922 Len=0
595,57.1281861,151.101.194.187,172.20.40.110,TLSv1.2,98,Application Data
596,57.1334773,151.101.194.187,172.20.40.110,TCP,60,443  >  64055 [ACK] Seq=85967 Ack=391105 Win=1934 Len=0
597,57.1367156,151.101.194.187,172.20.40.110,TLSv1.2,98,Application Data
598,57.1367985,172.20.40.110,151.101.194.187,TCP,54,64055  >  443 [ACK] Seq=391105 Ack=86011 Win=511 Len=0
599,57.1632072,172.20.40.110,151.101.194.187,TLSv1.2,2905,Application Data
600,57.1800079,151.101.194.187,172.20.40.110,TCP,60,443  >  64055 [ACK] Seq=86011 Ack=393956 Win=1945 Len=0
601,57.1833571,151.101.194.187,172.20.40.110,TLSv1.2,369,Application Data
602,57.2176574,151.101.194.187,172.20.40.110,TCP,369,"[TCP Retransmission] 443  >  64055 [PSH, ACK] Seq=86011 Ack=393956 Win=1945 Len=315"
603,57.2177409,172.20.40.110,151.101.194.187,TCP,66,64055  >  443 [ACK] Seq=393956 Ack=86326 Win=509 Len=0 SLE=86011 SRE=86326
