"No.","Time","Source","Destination","Protocol","Length","Info"
"1","0.000000000","172.20.40.110","151.101.130.187","TLSv1.2","2796","Application Data"
"2","0.023414600","151.101.130.187","172.20.40.110","TCP","60","443  >  59702 [ACK] Seq=1 Ack=2743 Win=212 Len=0"
"3","0.023414600","151.101.130.187","172.20.40.110","TLSv1.2","374","Application Data"
"4","0.043502800","172.20.40.110","151.101.130.187","TLSv1.2","2795","Application Data"
"5","0.054702700","151.101.130.187","172.20.40.110","TCP","374","[TCP Spurious Retransmission] 443  >  59702 [PSH, ACK] Seq=1 Ack=2743 Win=212 Len=320"
"6","0.054787800","172.20.40.110","151.101.130.187","TCP","66","[TCP Dup ACK 4#1] 59702  >  443 [ACK] Seq=5484 Ack=321 Win=254 Len=0 SLE=1 SRE=321"
"7","0.057038500","151.101.130.187","172.20.40.110","TCP","60","443  >  59702 [ACK] Seq=321 Ack=5484 Win=207 Len=0"
"8","0.062774800","151.101.130.187","172.20.40.110","TLSv1.2","142","Application Data"
"9","0.092734500","151.101.130.187","172.20.40.110","TCP","142","[TCP Retransmission] 443  >  59702 [PSH, ACK] Seq=321 Ack=5484 Win=207 Len=88"
"10","0.092841500","172.20.40.110","151.101.130.187","TCP","66","59702  >  443 [ACK] Seq=5484 Ack=409 Win=254 Len=0 SLE=321 SRE=409"
"11","0.628346300","172.20.40.110","151.101.130.187","TCP","54","59702  >  443 [FIN, ACK] Seq=5484 Ack=409 Win=254 Len=0"
"12","0.641085700","151.101.130.187","172.20.40.110","TCP","60","443  >  59702 [ACK] Seq=409 Ack=5485 Win=207 Len=0"
"13","0.641085700","151.101.130.187","172.20.40.110","TLSv1.2","78","Application Data"
"14","0.641085700","151.101.130.187","172.20.40.110","TCP","60","443  >  59702 [FIN, ACK] Seq=433 Ack=5485 Win=207 Len=0"
"15","0.641213900","172.20.40.110","151.101.130.187","TCP","54","59702  >  443 [RST, ACK] Seq=5485 Ack=433 Win=0 Len=0"
"16","2.790714200","172.20.40.110","151.101.66.187","TCP","66","57118  >  443 [SYN] Seq=0 Win=64240 Len=0 MSS=1460 WS=256 SACK_PERM"
"17","2.801064100","151.101.66.187","172.20.40.110","TCP","66","443  >  57118 [SYN, ACK] Seq=0 Ack=1 Win=65535 Len=0 MSS=1380 SACK_PERM WS=512"
"18","2.801212700","172.20.40.110","151.101.66.187","TCP","54","57118  >  443 [ACK] Seq=1 Ack=1 Win=131072 Len=0"
"19","2.802461500","172.20.40.110","151.101.66.187","TLSv1.3","2001","Client Hello (SNI=www.target.com)"
"20","2.815126600","151.101.66.187","172.20.40.110","TCP","60","443  >  57118 [ACK] Seq=1 Ack=1381 Win=144896 Len=0"
"21","2.815126600","151.101.66.187","172.20.40.110","TCP","60","443  >  57118 [ACK] Seq=1 Ack=1948 Win=144384 Len=0"
"22","2.815126600","151.101.66.187","172.20.40.110","TLSv1.3","1434","Server Hello, Change Cipher Spec, Application Data, Application Data"
"23","2.815126600","151.101.66.187","172.20.40.110","TLSv1.3","215","Application Data"
"24","2.815232400","172.20.40.110","151.101.66.187","TCP","54","57118  >  443 [ACK] Seq=1948 Ack=1542 Win=131072 Len=0"
"25","2.816650400","172.20.40.110","151.101.66.187","TLSv1.3","118","Change Cipher Spec, Application Data"
"26","2.817122800","172.20.40.110","151.101.66.187","TLSv1.3","146","Application Data"
"27","2.818140900","172.20.40.110","151.101.66.187","TLSv1.3","2795","Application Data"
"28","2.818524200","172.20.40.110","151.101.66.187","TLSv1.3","2781","Application Data"
"29","2.838548800","151.101.66.187","172.20.40.110","TCP","60","443  >  57118 [ACK] Seq=1542 Ack=2012 Win=144384 Len=0"
"30","2.838548800","151.101.66.187","172.20.40.110","TCP","60","443  >  57118 [ACK] Seq=1542 Ack=2104 Win=144384 Len=0"
"31","2.838548800","151.101.66.187","172.20.40.110","TLSv1.3","119","Application Data"
"32","2.838960000","172.20.40.110","151.101.66.187","TLSv1.3","85","Application Data"
"33","2.842871900","151.101.66.187","172.20.40.110","TCP","60","443  >  57118 [ACK] Seq=1607 Ack=3484 Win=143360 Len=0"
"34","2.842871900","151.101.66.187","172.20.40.110","TCP","60","443  >  57118 [ACK] Seq=1607 Ack=4845 Win=142336 Len=0"
"35","2.849850700","151.101.66.187","172.20.40.110","TLSv1.3","451","Application Data"
"36","2.849850700","151.101.66.187","172.20.40.110","TCP","60","443  >  57118 [ACK] Seq=2004 Ack=7572 Win=139776 Len=0"
"37","2.849850700","151.101.66.187","172.20.40.110","TCP","60","443  >  57118 [ACK] Seq=2004 Ack=7603 Win=139776 Len=0"
"38","2.855018200","151.101.66.187","172.20.40.110","TLSv1.3","130","Application Data"
"39","2.855108700","172.20.40.110","151.101.66.187","TCP","54","57118  >  443 [ACK] Seq=7603 Ack=2080 Win=130560 Len=0"
"40","2.859182900","172.20.40.110","151.101.66.187","TLSv1.3","2796","Application Data"
"41","2.871971000","151.101.66.187","172.20.40.110","TCP","60","443  >  57118 [ACK] Seq=2080 Ack=10345 Win=137216 Len=0"
"42","2.876440000","151.101.66.187","172.20.40.110","TLSv1.3","125","Application Data"
"43","2.907541800","151.101.66.187","172.20.40.110","TCP","125","[TCP Retransmission] 443  >  57118 [PSH, ACK] Seq=2080 Ack=10345 Win=138752 Len=71"
"44","2.907602100","172.20.40.110","151.101.66.187","TCP","66","57118  >  443 [ACK] Seq=10345 Ack=2151 Win=130304 Len=0 SLE=2080 SRE=2151"
"45","3.001245800","172.20.40.110","151.101.66.187","TLSv1.3","2793","Application Data"
"46","3.040065600","172.20.40.110","151.101.66.187","TCP","1434","[TCP Retransmission] 57118  >  443 [PSH, ACK] Seq=11704 Ack=2151 Win=130304 Len=1380"
"47","3.046446300","151.101.66.187","172.20.40.110","TCP","60","443  >  57118 [ACK] Seq=2151 Ack=13084 Win=136192 Len=0"
"48","3.052349500","151.101.66.187","172.20.40.110","TLSv1.3","235","Application Data"
"49","3.073221900","151.101.66.187","172.20.40.110","TCP","66","[TCP Dup ACK 47#1] 443  >  57118 [ACK] Seq=2332 Ack=13084 Win=138752 Len=0 SLE=11704 SRE=13084"
"50","3.073221900","151.101.66.187","172.20.40.110","TCP","235","[TCP Retransmission] 443  >  57118 [PSH, ACK] Seq=2151 Ack=13084 Win=138752 Len=181"
"51","3.073446400","172.20.40.110","151.101.66.187","TCP","66","57118  >  443 [ACK] Seq=13084 Ack=2332 Win=130304 Len=0 SLE=2151 SRE=2332"
"52","3.751834900","172.20.40.110","151.101.66.187","TLSv1.3","2795","Application Data"
"53","3.756950200","172.20.40.110","151.101.66.187","TLSv1.3","2783","Application Data"
"54","3.757473800","172.20.40.110","151.101.66.187","TLSv1.3","2777","Application Data"
"55","3.769920800","172.20.40.110","151.101.66.187","TLSv1.3","2796","Application Data"
"56","3.772084300","151.101.66.187","172.20.40.110","TCP","60","443  >  57118 [ACK] Seq=2332 Ack=15825 Win=136192 Len=0"
"57","3.772084300","151.101.66.187","172.20.40.110","TLSv1.3","104","Application Data"
"58","3.779344600","151.101.66.187","172.20.40.110","TCP","60","443  >  57118 [ACK] Seq=2382 Ack=18554 Win=136192 Len=0"
"59","3.779344600","151.101.66.187","172.20.40.110","TCP","60","443  >  57118 [ACK] Seq=2382 Ack=21277 Win=136192 Len=0"
"60","3.783844000","151.101.66.187","172.20.40.110","TLSv1.3","206","Application Data, Application Data"
"61","3.783929400","172.20.40.110","151.101.66.187","TCP","54","57118  >  443 [ACK] Seq=24019 Ack=2534 Win=130048 Len=0"
"62","3.796238400","151.101.66.187","172.20.40.110","TCP","60","443  >  57118 [ACK] Seq=2534 Ack=24019 Win=136192 Len=0"
"63","3.798415700","151.101.66.187","172.20.40.110","TLSv1.3","98","Application Data"
"64","3.798468100","172.20.40.110","151.101.66.187","TCP","54","57118  >  443 [ACK] Seq=24019 Ack=2578 Win=130048 Len=0"
"65","3.954354100","172.20.40.110","151.101.66.187","TLSv1.3","2799","Application Data"
"66","3.966798900","151.101.66.187","172.20.40.110","TCP","60","443  >  57118 [ACK] Seq=2578 Ack=26764 Win=136192 Len=0"
"67","3.969075300","151.101.66.187","172.20.40.110","TLSv1.3","240","Application Data"
"68","3.974586900","172.20.40.110","151.101.66.187","TLSv1.3","2779","Application Data"
"69","3.983306300","151.101.66.187","172.20.40.110","TCP","60","443  >  57118 [ACK] Seq=2764 Ack=29489 Win=136192 Len=0"
"70","3.988803600","151.101.66.187","172.20.40.110","TLSv1.3","131","Application Data"
"71","4.022305500","151.101.66.187","172.20.40.110","TCP","131","[TCP Retransmission] 443  >  57118 [PSH, ACK] Seq=2764 Ack=29489 Win=138752 Len=77"
"72","4.022378600","172.20.40.110","151.101.66.187","TCP","66","57118  >  443 [ACK] Seq=29489 Ack=2841 Win=129792 Len=0 SLE=2764 SRE=2841"
"73","4.135279700","172.20.40.110","151.101.66.187","TLSv1.3","2787","Application Data"
"74","4.142969600","172.20.40.110","151.101.66.187","TLSv1.3","2783","Application Data"
"75","4.143195900","172.20.40.110","151.101.66.187","TLSv1.3","2787","Application Data"
"76","4.143360600","172.20.40.110","151.101.66.187","TLSv1.3","2778","Application Data"
"77","4.183352000","172.20.40.110","151.101.66.187","TCP","1434","[TCP Retransmission] 57118  >  443 [PSH, ACK] Seq=39028 Ack=2841 Win=129792 Len=1380"
"78","4.183667000","151.101.66.187","172.20.40.110","TCP","60","443  >  57118 [ACK] Seq=2841 Ack=32222 Win=136192 Len=0"
"79","4.193918800","151.101.66.187","172.20.40.110","TCP","60","443  >  57118 [ACK] Seq=2841 Ack=34951 Win=136192 Len=0"
"80","4.193918800","151.101.66.187","172.20.40.110","TCP","60","443  >  57118 [ACK] Seq=2841 Ack=37684 Win=136192 Len=0"
"81","4.193918800","151.101.66.187","172.20.40.110","TCP","60","443  >  57118 [ACK] Seq=2841 Ack=40408 Win=133632 Len=0"
"82","4.193918800","151.101.66.187","172.20.40.110","TLSv1.3","130","Application Data"
"83","4.193918800","151.101.66.187","172.20.40.110","TLSv1.3","129","Application Data"
"84","4.193918800","151.101.66.187","172.20.40.110","TLSv1.3","179","Application Data"
"85","4.194031200","172.20.40.110","151.101.66.187","TCP","54","57118  >  443 [ACK] Seq=40408 Ack=3117 Win=131072 Len=0"
"86","4.196263700","151.101.66.187","172.20.40.110","TCP","66","[TCP Dup ACK 81#1] 443  >  57118 [ACK] Seq=3117 Ack=40408 Win=138752 Len=0 SLE=39028 SRE=40408"
"87","4.212029300","172.20.40.110","151.101.66.187","TLSv1.3","2836","Application Data"
"88","4.212250600","172.20.40.110","151.101.66.187","TLSv1.3","2833","Application Data"
"89","4.227793900","151.101.66.187","172.20.40.110","TCP","60","443  >  57118 [ACK] Seq=3117 Ack=43190 Win=136192 Len=0"
"90","4.233349100","151.101.66.187","172.20.40.110","TLSv1.3","291","Application Data"
"91","4.233349100","151.101.66.187","172.20.40.110","TCP","60","443  >  57118 [ACK] Seq=3354 Ack=45969 Win=136192 Len=0"
"92","4.236530200","151.101.66.187","172.20.40.110","TLSv1.3","130","Application Data"
"93","4.236609100","172.20.40.110","151.101.66.187","TCP","54","57118  >  443 [ACK] Seq=45969 Ack=3430 Win=130560 Len=0"
"94","4.743595900","172.20.40.110","151.101.66.187","TLSv1.3","2803","Application Data"
"95","4.755815000","151.101.66.187","172.20.40.110","TCP","60","443  >  57118 [ACK] Seq=3430 Ack=48718 Win=136192 Len=0"
"96","4.761180200","172.20.40.110","151.101.66.187","TLSv1.3","2801","Application Data"
"97","4.763212700","151.101.66.187","172.20.40.110","TLSv1.3","125","Application Data"
"98","4.775029500","151.101.66.187","172.20.40.110","TCP","60","443  >  57118 [ACK] Seq=3501 Ack=51465 Win=136192 Len=0"
"99","4.776578100","151.101.66.187","172.20.40.110","TLSv1.3","125","Application Data"
"100","4.776642400","172.20.40.110","151.101.66.187","TCP","54","57118  >  443 [ACK] Seq=51465 Ack=3572 Win=130560 Len=0"
"101","5.120340100","172.20.40.110","151.101.66.187","TLSv1.3","2804","Application Data"
"102","5.131753600","151.101.66.187","172.20.40.110","TLSv1.3","360","Application Data"
"103","5.131753600","151.101.66.187","172.20.40.110","TLSv1.3","5574","Application Data, Application Data, Application Data"
"104","5.131753600","151.101.66.187","172.20.40.110","TLSv1.3","1223","Application Data, Application Data"
"105","5.131954100","172.20.40.110","151.101.66.187","TCP","54","57118  >  443 [ACK] Seq=54215 Ack=10567 Win=131072 Len=0"
"106","5.139111400","151.101.66.187","172.20.40.110","TCP","1434","443  >  57118 [ACK] Seq=10567 Ack=51465 Win=138752 Len=1380 [TCP PDU reassembled in 107]"
"107","5.139111400","151.101.66.187","172.20.40.110","TLSv1.3","1434","Application Data"
"108","5.139111400","151.101.66.187","172.20.40.110","TLSv1.3","1434","Application Data"
"109","5.139111400","151.101.66.187","172.20.40.110","TLSv1.3","1434","Application Data"
"110","5.139111400","151.101.66.187","172.20.40.110","TLSv1.3","2814","Application Data, Application Data"
"111","5.139111400","151.101.66.187","172.20.40.110","TLSv1.3","107","Application Data"
"112","5.139111400","151.101.66.187","172.20.40.110","TLSv1.3","4194","Application Data, Application Data"
"113","5.139224800","172.20.40.110","151.101.66.187","TCP","54","57118  >  443 [ACK] Seq=54215 Ack=23040 Win=131072 Len=0"
"114","5.141484800","151.101.66.187","172.20.40.110","TLSv1.3","4194","Application Data, Application Data, Application Data"
"115","5.141587600","172.20.40.110","151.101.66.187","TCP","54","57118  >  443 [ACK] Seq=54215 Ack=27180 Win=131072 Len=0"
"116","5.146873000","151.101.66.187","172.20.40.110","TLSv1.3","1434","Application Data"
"117","5.146873000","151.101.66.187","172.20.40.110","TLSv1.3","1434","Application Data"
"118","5.146873000","151.101.66.187","172.20.40.110","TLSv1.3","1434","Application Data"
"119","5.146873000","151.101.66.187","172.20.40.110","TLSv1.3","1434","Application Data"
"120","5.146873000","151.101.66.187","172.20.40.110","TLSv1.3","6954","Application Data, Application Data, Application Data, Application Data, Application Data, Application Data"
"121","5.146873000","151.101.66.187","172.20.40.110","TCP","60","443  >  57118 [ACK] Seq=39600 Ack=54215 Win=136192 Len=0"
"122","5.146873000","151.101.66.187","172.20.40.110","TLSv1.3","5574","Application Data, Application Data, Application Data, Application Data"
"123","5.147014300","172.20.40.110","151.101.66.187","TCP","54","57118  >  443 [ACK] Seq=54215 Ack=45120 Win=131072 Len=0"
"124","5.149262500","151.101.66.187","172.20.40.110","TLSv1.3","1434","Application Data"
"125","5.152953600","151.101.66.187","172.20.40.110","TLSv1.3","1434","Application Data"
"126","5.152953600","151.101.66.187","172.20.40.110","TLSv1.3","23514","Application Data, Application Data, Application Data, Application Data, Application Data, Application Data, Application Data, Application Data, Application Data, Application Data, Application Data"
"127","5.153059500","172.20.40.110","151.101.66.187","TCP","54","57118  >  443 [ACK] Seq=54215 Ack=71340 Win=131072 Len=0"
"128","5.153592800","151.101.66.187","172.20.40.110","TLSv1.3","1338","Application Data, Application Data, Application Data"
"129","5.153592800","151.101.66.187","172.20.40.110","TLSv1.3","131","Application Data"
"130","5.153648700","172.20.40.110","151.101.66.187","TCP","54","57118  >  443 [ACK] Seq=54215 Ack=72701 Win=129536 Len=0"
"131","5.920575900","172.20.40.110","151.101.66.187","TLSv1.3","2787","Application Data"
"132","5.920811200","172.20.40.110","151.101.66.187","TLSv1.3","2789","Application Data"
"133","5.926289300","172.20.40.110","151.101.66.187","TLSv1.3","2787","Application Data"
"134","5.926753900","172.20.40.110","151.101.66.187","TLSv1.3","2785","Application Data"
"135","5.928855800","172.20.40.110","151.101.66.187","TLSv1.3","2793","Application Data"
"136","5.932376800","151.101.66.187","172.20.40.110","TCP","60","443  >  57118 [ACK] Seq=72701 Ack=56948 Win=136192 Len=0"
"137","5.940152700","151.101.66.187","172.20.40.110","TCP","60","443  >  57118 [ACK] Seq=72701 Ack=59683 Win=136192 Len=0"
"138","5.940152700","151.101.66.187","172.20.40.110","TLSv1.3","132","Application Data"
"139","5.940152700","151.101.66.187","172.20.40.110","TLSv1.3","130","Application Data"
"140","5.940388100","172.20.40.110","151.101.66.187","TCP","54","57118  >  443 [ACK] Seq=67886 Ack=72855 Win=131072 Len=0"
"141","5.947770200","151.101.66.187","172.20.40.110","TCP","60","443  >  57118 [ACK] Seq=72855 Ack=62416 Win=136192 Len=0"
"142","5.947770200","151.101.66.187","172.20.40.110","TCP","60","443  >  57118 [ACK] Seq=72855 Ack=65147 Win=133632 Len=0"
"143","5.947770200","151.101.66.187","172.20.40.110","TCP","60","443  >  57118 [ACK] Seq=72855 Ack=67886 Win=137216 Len=0"
"144","5.949184600","151.101.66.187","172.20.40.110","TLSv1.3","206","Application Data, Application Data"
"145","5.949184600","151.101.66.187","172.20.40.110","TLSv1.3","180","Application Data"
"146","5.949259300","172.20.40.110","151.101.66.187","TCP","54","57118  >  443 [ACK] Seq=67886 Ack=73133 Win=130816 Len=0"
"147","5.949907600","172.20.40.110","151.101.66.187","TLSv1.3","2804","Application Data"
"148","5.957906900","172.20.40.110","151.101.66.187","TLSv1.3","2803","Application Data"
"149","5.963283300","151.101.66.187","172.20.40.110","TCP","60","443  >  57118 [ACK] Seq=73133 Ack=70636 Win=136192 Len=0"
"150","5.965731600","151.101.66.187","172.20.40.110","TLSv1.3","369","Application Data"
"151","5.968836900","151.101.66.187","172.20.40.110","TCP","60","443  >  57118 [ACK] Seq=73448 Ack=73385 Win=136192 Len=0"
"152","5.972865200","151.101.66.187","172.20.40.110","TLSv1.3","98","Application Data"
"153","5.972946100","172.20.40.110","151.101.66.187","TCP","54","57118  >  443 [ACK] Seq=73385 Ack=73492 Win=130304 Len=0"
"154","6.043425700","172.20.40.110","151.101.66.187","TLSv1.3","2787","Application Data"
"155","6.064699100","151.101.66.187","172.20.40.110","TCP","60","443  >  57118 [ACK] Seq=73492 Ack=76118 Win=136192 Len=0"
"156","6.068368800","151.101.66.187","172.20.40.110","TLSv1.3","124","Application Data"
"157","6.100834400","151.101.66.187","172.20.40.110","TCP","124","[TCP Retransmission] 443  >  57118 [PSH, ACK] Seq=73492 Ack=76118 Win=138752 Len=70"
"158","6.100932200","172.20.40.110","151.101.66.187","TCP","66","57118  >  443 [ACK] Seq=76118 Ack=73562 Win=130304 Len=0 SLE=73492 SRE=73562"
"159","9.572665600","172.20.40.110","151.101.66.187","TLSv1.3","2807","Application Data"
"160","9.573115500","172.20.40.110","151.101.66.187","TLSv1.3","2808","Application Data"
"161","9.623776100","172.20.40.110","151.101.66.187","TCP","1434","[TCP Retransmission] 57118  >  443 [PSH, ACK] Seq=80245 Ack=73562 Win=130304 Len=1380"
"162","9.931639100","172.20.40.110","151.101.66.187","TCP","1434","[TCP Retransmission] 57118  >  443 [ACK] Seq=76118 Ack=73562 Win=130304 Len=1380"
"163","10.534135300","172.20.40.110","151.101.66.187","TCP","1434","[TCP Retransmission] 57118  >  443 [ACK] Seq=76118 Ack=73562 Win=130304 Len=1380"
"164","11.691395100","151.101.66.187","172.20.40.110","TCP","66","[TCP Previous segment not captured] 443  >  57118 [ACK] Seq=73793 Ack=81625 Win=138752 Len=0 SLE=76118 SRE=77498"
"165","11.691395100","151.101.66.187","172.20.40.110","TLSv1.3","98","[TCP Retransmission] , Application Data"
"166","11.691395100","151.101.66.187","172.20.40.110","TCP","66","[TCP Dup ACK 164#1] 443  >  57118 [ACK] Seq=73793 Ack=81625 Win=138752 Len=0 SLE=76118 SRE=77498"
"167","11.812472700","151.101.66.187","172.20.40.110","TCP","285","[TCP Retransmission] 443  >  57118 [PSH, ACK] Seq=73562 Ack=81625 Win=138752 Len=231"
"168","12.120108400","172.20.40.110","151.101.66.187","TCP","1434","57118  >  443 [ACK] Seq=81625 Ack=73793 Win=130048 Len=1380 [TCP PDU reassembled in 170]"
"169","12.129765900","151.101.66.187","172.20.40.110","TCP","60","443  >  57118 [ACK] Seq=73793 Ack=83005 Win=137728 Len=0"
"170","12.129874600","172.20.40.110","151.101.66.187","TLSv1.3","1504","Application Data, Application Data, Application Data"
"171","12.140204400","151.101.66.187","172.20.40.110","TCP","60","443  >  57118 [ACK] Seq=73793 Ack=84455 Win=136704 Len=0"
"172","12.662408200","151.101.66.187","172.20.40.110","TLSv1.3","360","Application Data"
"173","12.662408200","151.101.66.187","172.20.40.110","TCP","1434","443  >  57118 [ACK] Seq=74099 Ack=84455 Win=138752 Len=1380 [TCP PDU reassembled in 183]"
"174","12.662734700","172.20.40.110","151.101.66.187","TCP","54","57118  >  443 [ACK] Seq=84455 Ack=75479 Win=131072 Len=0"
"175","12.670335300","151.101.66.187","172.20.40.110","TCP","2814","443  >  57118 [PSH, ACK] Seq=75479 Ack=84455 Win=138752 Len=2760 [TCP PDU reassembled in 183]"
"176","12.670455600","172.20.40.110","151.101.66.187","TCP","54","57118  >  443 [ACK] Seq=84455 Ack=78239 Win=131072 Len=0"
"177","12.672384500","151.101.66.187","172.20.40.110","TCP","2814","443  >  57118 [PSH, ACK] Seq=78239 Ack=84455 Win=138752 Len=2760 [TCP PDU reassembled in 183]"
"178","12.672501000","172.20.40.110","151.101.66.187","TCP","54","57118  >  443 [ACK] Seq=84455 Ack=80999 Win=131072 Len=0"
"179","12.677922700","151.101.66.187","172.20.40.110","TCP","2814","443  >  57118 [PSH, ACK] Seq=80999 Ack=84455 Win=138752 Len=2760 [TCP PDU reassembled in 183]"
"180","12.678079400","172.20.40.110","151.101.66.187","TCP","54","57118  >  443 [ACK] Seq=84455 Ack=83759 Win=131072 Len=0"
"181","12.679355500","151.101.66.187","172.20.40.110","TCP","2814","443  >  57118 [PSH, ACK] Seq=83759 Ack=84455 Win=138752 Len=2760 [TCP PDU reassembled in 183]"
"182","12.679457800","172.20.40.110","151.101.66.187","TCP","54","57118  >  443 [ACK] Seq=84455 Ack=86519 Win=131072 Len=0"
"183","12.683068900","151.101.66.187","172.20.40.110","TLSv1.3","5574","Application Data"
"184","12.683181000","172.20.40.110","151.101.66.187","TCP","54","57118  >  443 [ACK] Seq=84455 Ack=92039 Win=131072 Len=0"
"185","12.686536600","151.101.66.187","172.20.40.110","TCP","5574","443  >  57118 [PSH, ACK] Seq=92039 Ack=84455 Win=138752 Len=5520 [TCP PDU reassembled in 191]"
"186","12.686639100","172.20.40.110","151.101.66.187","TCP","54","57118  >  443 [ACK] Seq=84455 Ack=97559 Win=131072 Len=0"
"187","12.692348700","151.101.66.187","172.20.40.110","TCP","1434","443  >  57118 [ACK] Seq=97559 Ack=84455 Win=138752 Len=1380 [TCP PDU reassembled in 191]"
"188","12.692348700","151.101.66.187","172.20.40.110","TCP","1434","443  >  57118 [PSH, ACK] Seq=98939 Ack=84455 Win=138752 Len=1380 [TCP PDU reassembled in 191]"
"189","12.692348700","151.101.66.187","172.20.40.110","TCP","1434","443  >  57118 [ACK] Seq=100319 Ack=84455 Win=138752 Len=1380 [TCP PDU reassembled in 191]"
"190","12.692348700","151.101.66.187","172.20.40.110","TCP","1434","443  >  57118 [PSH, ACK] Seq=101699 Ack=84455 Win=138752 Len=1380 [TCP PDU reassembled in 191]"
"191","12.692348700","151.101.66.187","172.20.40.110","TLSv1.3","5574","Application Data"
"192","12.692491800","172.20.40.110","151.101.66.187","TCP","54","57118  >  443 [ACK] Seq=84455 Ack=108599 Win=131072 Len=0"
"193","12.696141000","151.101.66.187","172.20.40.110","TCP","11094","443  >  57118 [PSH, ACK] Seq=108599 Ack=84455 Win=138752 Len=11040 [TCP PDU reassembled in 197]"
"194","12.696252500","172.20.40.110","151.101.66.187","TCP","54","57118  >  443 [ACK] Seq=84455 Ack=119639 Win=131072 Len=0"
"195","12.697493300","151.101.66.187","172.20.40.110","TCP","2814","443  >  57118 [PSH, ACK] Seq=119639 Ack=84455 Win=138752 Len=2760 [TCP PDU reassembled in 197]"
"196","12.697590100","172.20.40.110","151.101.66.187","TCP","54","57118  >  443 [ACK] Seq=84455 Ack=122399 Win=131072 Len=0"
"197","12.703215600","151.101.66.187","172.20.40.110","TLSv1.3","1434","Application Data"
"198","12.703215600","151.101.66.187","172.20.40.110","TCP","1434","443  >  57118 [ACK] Seq=123779 Ack=84455 Win=138752 Len=1380 [TCP PDU reassembled in 199]"
"199","12.703215600","151.101.66.187","172.20.40.110","TLSv1.3","658","Application Data, Application Data"
"200","12.703339000","172.20.40.110","151.101.66.187","TCP","54","57118  >  443 [ACK] Seq=84455 Ack=125763 Win=131072 Len=0"
"201","12.715601800","172.20.40.110","151.101.66.187","TLSv1.3","89","Application Data"
"202","12.730848500","151.101.66.187","172.20.40.110","TCP","60","443  >  57118 [ACK] Seq=125763 Ack=84490 Win=138752 Len=0"
"203","14.245821100","172.20.40.110","151.101.66.187","TLSv1.3","2806","Application Data"
"204","14.264812900","151.101.66.187","172.20.40.110","TCP","60","443  >  57118 [ACK] Seq=125763 Ack=87242 Win=136192 Len=0"
"205","14.264951600","172.20.40.110","151.101.66.187","TLSv1.3","2800","Application Data"
"206","14.271456600","151.101.66.187","172.20.40.110","TLSv1.3","214","Application Data"
"207","14.294414800","151.101.66.187","172.20.40.110","TCP","60","443  >  57118 [ACK] Seq=125923 Ack=89988 Win=136192 Len=0"
"208","14.294414800","151.101.66.187","172.20.40.110","TCP","214","[TCP Retransmission] 443  >  57118 [PSH, ACK] Seq=125763 Ack=89988 Win=138752 Len=160"
"209","14.294505500","172.20.40.110","151.101.66.187","TCP","66","57118  >  443 [ACK] Seq=89988 Ack=125923 Win=130816 Len=0 SLE=125763 SRE=125923"
"210","14.294636600","172.20.40.110","151.101.66.187","TLSv1.3","2802","Application Data"
"211","14.295535100","151.101.66.187","172.20.40.110","TLSv1.3","132","Application Data"
"212","14.297927500","172.20.40.110","151.101.66.187","TCP","1434","57118  >  443 [ACK] Seq=92736 Ack=126001 Win=130816 Len=1380 [TCP PDU reassembled in 214]"
"213","14.313563700","151.101.66.187","172.20.40.110","TCP","60","443  >  57118 [ACK] Seq=126001 Ack=91368 Win=138752 Len=0"
"214","14.313686200","172.20.40.110","151.101.66.187","TLSv1.3","1434","Application Data"
"215","14.316813900","151.101.66.187","172.20.40.110","TCP","60","443  >  57118 [ACK] Seq=126001 Ack=92736 Win=137728 Len=0"
"216","14.316813900","151.101.66.187","172.20.40.110","TCP","60","443  >  57118 [ACK] Seq=126001 Ack=94116 Win=137216 Len=0"
"217","14.316913700","172.20.40.110","151.101.66.187","TLSv1.3","2784","Application Data"
"218","14.322721200","151.101.66.187","172.20.40.110","TLSv1.3","130","Application Data"
"219","14.325880200","151.101.66.187","172.20.40.110","TCP","60","443  >  57118 [ACK] Seq=126077 Ack=95496 Win=137728 Len=0"
"220","14.328146600","151.101.66.187","172.20.40.110","TCP","60","443  >  57118 [ACK] Seq=126077 Ack=98226 Win=136192 Len=0"
"221","14.329230800","151.101.66.187","172.20.40.110","TLSv1.3","130","Application Data"
"222","14.329379800","172.20.40.110","151.101.66.187","TCP","54","57118  >  443 [ACK] Seq=98226 Ack=126153 Win=130560 Len=0"
"223","14.330534500","151.101.66.187","172.20.40.110","TLSv1.3","340","Application Data"
"224","14.366986300","151.101.66.187","172.20.40.110","TCP","340","[TCP Retransmission] 443  >  57118 [PSH, ACK] Seq=126153 Ack=98226 Win=138752 Len=286"
"225","14.367045200","172.20.40.110","151.101.66.187","TCP","66","57118  >  443 [ACK] Seq=98226 Ack=126439 Win=130304 Len=0 SLE=126153 SRE=126439"
"226","14.369763500","172.20.40.110","151.101.66.187","TLSv1.3","2765","Application Data"
"227","14.370058000","172.20.40.110","151.101.66.187","TLSv1.3","2764","Application Data"
"228","14.378613300","151.101.66.187","172.20.40.110","TCP","60","443  >  57118 [ACK] Seq=126439 Ack=100937 Win=136192 Len=0"
"229","14.379238200","172.20.40.110","151.101.66.187","TLSv1.3","2800","Application Data"
"230","14.387977300","151.101.66.187","172.20.40.110","TCP","60","443  >  57118 [ACK] Seq=126439 Ack=103647 Win=136192 Len=0"
"231","14.387977300","151.101.66.187","172.20.40.110","TLSv1.3","353","Application Data"
"232","14.387977300","151.101.66.187","172.20.40.110","TLSv1.3","315","Application Data"
"233","14.388066300","172.20.40.110","151.101.66.187","TCP","54","57118  >  443 [ACK] Seq=106393 Ack=126999 Win=129792 Len=0"
"234","14.394767700","151.101.66.187","172.20.40.110","TCP","60","443  >  57118 [ACK] Seq=126999 Ack=106393 Win=136192 Len=0"
"235","14.402066500","151.101.66.187","172.20.40.110","TLSv1.3","124","Application Data"
"236","14.428449500","151.101.66.187","172.20.40.110","TCP","124","[TCP Retransmission] 443  >  57118 [PSH, ACK] Seq=126999 Ack=106393 Win=138752 Len=70"
"237","14.428541300","172.20.40.110","151.101.66.187","TCP","66","57118  >  443 [ACK] Seq=106393 Ack=127069 Win=129792 Len=0 SLE=126999 SRE=127069"
"238","14.620772100","172.20.40.110","151.101.66.187","TCP","54","57118  >  443 [FIN, ACK] Seq=106393 Ack=127069 Win=129792 Len=0"
"239","14.629027100","151.101.66.187","172.20.40.110","TCP","60","443  >  57118 [ACK] Seq=127069 Ack=106394 Win=138752 Len=0"
"240","14.629027100","151.101.66.187","172.20.40.110","TLSv1.3","78","Application Data"
"241","14.629216100","172.20.40.110","151.101.66.187","TCP","54","57118  >  443 [RST, ACK] Seq=106394 Ack=127093 Win=0 Len=0"
"242","14.630349700","151.101.66.187","172.20.40.110","TCP","60","443  >  57118 [FIN, ACK] Seq=127093 Ack=106394 Win=138752 Len=0"
"243","16.687553000","172.20.40.110","151.101.130.187","TCP","66","62911  >  443 [SYN] Seq=0 Win=64240 Len=0 MSS=1460 WS=256 SACK_PERM"
"244","16.705255600","151.101.130.187","172.20.40.110","TCP","66","443  >  62911 [SYN, ACK] Seq=0 Ack=1 Win=65535 Len=0 MSS=1380 SACK_PERM WS=512"
"245","16.705446400","172.20.40.110","151.101.130.187","TCP","54","62911  >  443 [ACK] Seq=1 Ack=1 Win=131072 Len=0"
"246","16.706826400","172.20.40.110","151.101.130.187","TLSv1.3","2001","Client Hello (SNI=www.target.com)"
"247","16.725494300","151.101.130.187","172.20.40.110","TCP","60","443  >  62911 [ACK] Seq=1 Ack=1948 Win=144384 Len=0"
"248","16.725494300","151.101.130.187","172.20.40.110","TLSv1.3","1434","Server Hello, Change Cipher Spec, Application Data, Application Data"
"249","16.725494300","151.101.130.187","172.20.40.110","TLSv1.3","215","Application Data"
"250","16.725587600","172.20.40.110","151.101.130.187","TCP","54","62911  >  443 [ACK] Seq=1948 Ack=1542 Win=131072 Len=0"
"251","16.729040300","172.20.40.110","151.101.130.187","TLSv1.3","118","Change Cipher Spec, Application Data"
"252","16.729316200","172.20.40.110","151.101.130.187","TLSv1.3","146","Application Data"
"253","16.729739000","172.20.40.110","151.101.130.187","TLSv1.3","2804","Application Data"
"254","16.729939600","172.20.40.110","151.101.130.187","TLSv1.3","2800","Application Data"
"255","16.748668100","151.101.130.187","172.20.40.110","TCP","60","443  >  62911 [ACK] Seq=1542 Ack=2012 Win=144384 Len=0"
"256","16.748668100","151.101.130.187","172.20.40.110","TCP","60","443  >  62911 [ACK] Seq=1542 Ack=2104 Win=144384 Len=0"
"257","16.748668100","151.101.130.187","172.20.40.110","TLSv1.3","119","Application Data"
"258","16.749697700","172.20.40.110","151.101.130.187","TLSv1.3","85","Application Data"
"259","16.751786900","151.101.130.187","172.20.40.110","TCP","60","443  >  62911 [ACK] Seq=1607 Ack=4854 Win=141824 Len=0"
"260","16.751786900","151.101.130.187","172.20.40.110","TCP","60","443  >  62911 [ACK] Seq=1607 Ack=7600 Win=139264 Len=0"
"261","16.757976100","151.101.130.187","172.20.40.110","TLSv1.3","450","Application Data"
"262","16.757976100","151.101.130.187","172.20.40.110","TLSv1.3","125","Application Data"
"263","16.757976100","151.101.130.187","172.20.40.110","TCP","60","443  >  62911 [ACK] Seq=2074 Ack=7631 Win=139264 Len=0"
"264","16.758083000","172.20.40.110","151.101.130.187","TCP","54","62911  >  443 [ACK] Seq=7631 Ack=2074 Win=130560 Len=0"
"265","19.742352600","172.20.40.110","151.101.130.187","TLSv1.3","2808","Application Data"
"266","19.742820200","172.20.40.110","151.101.130.187","TLSv1.3","2810","Application Data"
"267","19.749416100","172.20.40.110","151.101.130.187","TLSv1.3","2804","Application Data"
"268","19.750375600","172.20.40.110","151.101.130.187","TLSv1.3","2806","Application Data"
"269","19.750562500","172.20.40.110","151.101.130.187","TLSv1.3","2804","Application Data"
"270","19.752286600","172.20.40.110","151.101.130.187","TLSv1.3","2802","Application Data"
"271","19.769405600","151.101.130.187","172.20.40.110","TCP","60","443  >  62911 [ACK] Seq=2074 Ack=10385 Win=136704 Len=0"
"272","19.769405600","151.101.130.187","172.20.40.110","TCP","60","443  >  62911 [ACK] Seq=2074 Ack=13141 Win=134144 Len=0"
"273","19.769405600","151.101.130.187","172.20.40.110","TCP","60","443  >  62911 [ACK] Seq=2074 Ack=15891 Win=131584 Len=0"
"274","19.769405600","151.101.130.187","172.20.40.110","TLSv1.3","241","Application Data"
"275","19.769405600","151.101.130.187","172.20.40.110","TLSv1.3","104","Application Data"
"276","19.769405600","151.101.130.187","172.20.40.110","TLSv1.3","126","Application Data"
"277","19.769504100","172.20.40.110","151.101.130.187","TCP","54","62911  >  443 [ACK] Seq=24141 Ack=2383 Win=130048 Len=0"
"278","19.774540900","151.101.130.187","172.20.40.110","TCP","60","443  >  62911 [ACK] Seq=2383 Ack=18643 Win=129024 Len=0"
"279","19.776827500","151.101.130.187","172.20.40.110","TCP","60","443  >  62911 [ACK] Seq=2383 Ack=21393 Win=126464 Len=0"
"280","19.776827500","151.101.130.187","172.20.40.110","TCP","60","443  >  62911 [ACK] Seq=2383 Ack=24141 Win=123904 Len=0"
"281","19.779540400","151.101.130.187","172.20.40.110","TLSv1.3","194","Application Data, Application Data"
"282","19.779828700","172.20.40.110","151.101.130.187","TCP","54","62911  >  443 [ACK] Seq=24141 Ack=2523 Win=130048 Len=0"
"283","19.781524300","151.101.130.187","172.20.40.110","TLSv1.3","124","Application Data"
"284","19.781597500","172.20.40.110","151.101.130.187","TCP","54","62911  >  443 [ACK] Seq=24141 Ack=2593 Win=130048 Len=0"
"285","19.807220900","172.20.40.110","151.101.130.187","TLSv1.3","2804","Application Data"
"286","19.811878600","172.20.40.110","151.101.130.187","TLSv1.3","2804","Application Data"
"287","19.824851300","151.101.130.187","172.20.40.110","TCP","60","443  >  62911 [ACK] Seq=2593 Ack=26891 Win=121344 Len=0"
"288","19.824851300","151.101.130.187","172.20.40.110","TLSv1.3","124","Application Data"
"289","19.832105300","151.101.130.187","172.20.40.110","TCP","60","443  >  62911 [ACK] Seq=2663 Ack=28271 Win=120320 Len=0"
"290","19.832105300","151.101.130.187","172.20.40.110","TCP","60","443  >  62911 [ACK] Seq=2663 Ack=29641 Win=119296 Len=0"
"291","19.832105300","151.101.130.187","172.20.40.110","TLSv1.3","98","Application Data"
"292","19.832193900","172.20.40.110","151.101.130.187","TCP","54","62911  >  443 [ACK] Seq=29641 Ack=2707 Win=129792 Len=0"
"293","20.744593700","172.20.40.110","151.101.130.187","TLSv1.3","2817","Application Data"
"294","20.757972800","151.101.130.187","172.20.40.110","TCP","60","443  >  62911 [ACK] Seq=2707 Ack=32404 Win=116736 Len=0"
"295","20.757972800","151.101.130.187","172.20.40.110","TLSv1.3","241","Application Data"
"296","20.784951200","172.20.40.110","151.101.130.187","TLSv1.3","2816","Application Data"
"297","20.787492700","151.101.130.187","172.20.40.110","TCP","241","[TCP Spurious Retransmission] 443  >  62911 [PSH, ACK] Seq=2707 Ack=32404 Win=116736 Len=187"
"298","20.787562100","172.20.40.110","151.101.130.187","TCP","66","[TCP Dup ACK 296#1] 62911  >  443 [ACK] Seq=35166 Ack=2894 Win=129536 Len=0 SLE=2707 SRE=2894"
"299","20.796056400","151.101.130.187","172.20.40.110","TCP","60","443  >  62911 [ACK] Seq=2894 Ack=35166 Win=114176 Len=0"
"300","20.802072000","151.101.130.187","172.20.40.110","TLSv1.3","125","Application Data"
"301","20.831566400","151.101.130.187","172.20.40.110","TCP","125","[TCP Retransmission] 443  >  62911 [PSH, ACK] Seq=2894 Ack=35166 Win=114176 Len=71"
"302","20.831628700","172.20.40.110","151.101.130.187","TCP","66","62911  >  443 [ACK] Seq=35166 Ack=2965 Win=131072 Len=0 SLE=2894 SRE=2965"
"303","21.009348600","172.20.40.110","151.101.130.187","TLSv1.3","2814","Application Data"
"304","21.023158900","151.101.130.187","172.20.40.110","TCP","60","443  >  62911 [ACK] Seq=2965 Ack=37926 Win=111616 Len=0"
"305","21.023158900","151.101.130.187","172.20.40.110","TLSv1.3","235","Application Data"
"306","21.053223100","151.101.130.187","172.20.40.110","TCP","235","[TCP Retransmission] 443  >  62911 [PSH, ACK] Seq=2965 Ack=37926 Win=111616 Len=181"
"307","21.053282300","172.20.40.110","151.101.130.187","TCP","66","62911  >  443 [ACK] Seq=37926 Ack=3146 Win=130816 Len=0 SLE=2965 SRE=3146"
"308","23.528241700","172.20.40.110","151.101.130.187","TLSv1.3","2816","Application Data"
"309","23.530898500","172.20.40.110","151.101.130.187","TLSv1.3","2804","Application Data"
"310","23.532212100","172.20.40.110","151.101.130.187","TLSv1.3","2798","Application Data"
"311","23.538786100","172.20.40.110","151.101.130.187","TLSv1.3","2817","Application Data"
"312","23.554389400","151.101.130.187","172.20.40.110","TCP","60","443  >  62911 [ACK] Seq=3146 Ack=40688 Win=109056 Len=0"
"313","23.554389400","151.101.130.187","172.20.40.110","TCP","60","443  >  62911 [ACK] Seq=3146 Ack=43438 Win=106496 Len=0"
"314","23.554389400","151.101.130.187","172.20.40.110","TCP","60","443  >  62911 [ACK] Seq=3146 Ack=46182 Win=103936 Len=0"
"315","23.554389400","151.101.130.187","172.20.40.110","TLSv1.3","214","Application Data"
"316","23.554389400","151.101.130.187","172.20.40.110","TLSv1.3","340","Application Data"
"317","23.554389400","151.101.130.187","172.20.40.110","TLSv1.3","124","Application Data"
"318","23.554528100","172.20.40.110","151.101.130.187","TCP","54","62911  >  443 [ACK] Seq=48945 Ack=3662 Win=130304 Len=0"
"319","23.559822600","151.101.130.187","172.20.40.110","TCP","60","443  >  62911 [ACK] Seq=3662 Ack=48945 Win=101376 Len=0"
"320","23.565956600","151.101.130.187","172.20.40.110","TLSv1.3","98","Application Data"
"321","23.566078700","172.20.40.110","151.101.130.187","TCP","54","62911  >  443 [ACK] Seq=48945 Ack=3706 Win=130304 Len=0"
"322","23.567235800","172.20.40.110","151.101.130.187","TLSv1.3","2808","Application Data"
"323","23.572520400","172.20.40.110","151.101.130.187","TLSv1.3","2799","Application Data"
"324","23.577162900","151.101.130.187","172.20.40.110","TCP","60","443  >  62911 [ACK] Seq=3706 Ack=51699 Win=99328 Len=0"
"325","23.581393100","151.101.130.187","172.20.40.110","TLSv1.3","124","Application Data"
"326","23.585548400","151.101.130.187","172.20.40.110","TCP","60","443  >  62911 [ACK] Seq=3776 Ack=54444 Win=99328 Len=0"
"327","23.591086800","151.101.130.187","172.20.40.110","TLSv1.3","124","Application Data"
"328","23.591165900","172.20.40.110","151.101.130.187","TCP","54","62911  >  443 [ACK] Seq=54444 Ack=3846 Win=130048 Len=0"
"329","23.700669900","172.20.40.110","151.101.130.187","TLSv1.3","2820","Application Data"
"330","23.721935600","172.20.40.110","151.101.130.187","TLSv1.3","2800","Application Data"
"331","23.737522600","151.101.130.187","172.20.40.110","TCP","60","443  >  62911 [ACK] Seq=3846 Ack=55824 Win=101376 Len=0"
"332","23.764719700","151.101.130.187","172.20.40.110","TCP","60","443  >  62911 [ACK] Seq=3846 Ack=57210 Win=100352 Len=0"
"333","23.765781000","151.101.130.187","172.20.40.110","TLSv1.3","124","Application Data"
"334","23.770008200","151.101.130.187","172.20.40.110","TCP","60","443  >  62911 [ACK] Seq=3916 Ack=59956 Win=99328 Len=0"
"335","23.773225600","151.101.130.187","172.20.40.110","TLSv1.3","125","Application Data"
"336","23.773303700","172.20.40.110","151.101.130.187","TCP","54","62911  >  443 [ACK] Seq=59956 Ack=3987 Win=130048 Len=0"
"337","23.817224800","172.20.40.110","151.101.130.187","TLSv1.3","2802","Application Data"
"338","23.817443700","172.20.40.110","151.101.130.187","TLSv1.3","2805","Application Data"
"339","23.837055600","151.101.130.187","172.20.40.110","TCP","60","443  >  62911 [ACK] Seq=3987 Ack=62704 Win=100352 Len=0"
"340","23.838892600","151.101.130.187","172.20.40.110","TLSv1.3","124","Application Data"
"341","23.840802000","151.101.130.187","172.20.40.110","TCP","60","443  >  62911 [ACK] Seq=4057 Ack=65455 Win=100352 Len=0"
"342","23.858635300","151.101.130.187","172.20.40.110","TLSv1.3","124","Application Data"
"343","23.858717600","172.20.40.110","151.101.130.187","TCP","54","62911  >  443 [ACK] Seq=65455 Ack=4127 Win=129792 Len=0"
"344","24.356356000","172.20.40.110","151.101.130.187","TLSv1.3","2822","Application Data"
"345","24.376414400","151.101.130.187","172.20.40.110","TCP","60","443  >  62911 [ACK] Seq=4127 Ack=68223 Win=98816 Len=0"
"346","24.376414400","151.101.130.187","172.20.40.110","TLSv1.3","235","Application Data"
"347","24.413619600","151.101.130.187","172.20.40.110","TCP","235","[TCP Retransmission] 443  >  62911 [PSH, ACK] Seq=4127 Ack=68223 Win=101376 Len=181"
"348","24.413746500","172.20.40.110","151.101.130.187","TCP","66","62911  >  443 [ACK] Seq=68223 Ack=4308 Win=129536 Len=0 SLE=4127 SRE=4308"
"349","24.559758200","172.20.40.110","151.101.130.187","TLSv1.3","2836","Application Data"
"350","24.578895600","151.101.130.187","172.20.40.110","TCP","60","443  >  62911 [ACK] Seq=4308 Ack=71005 Win=98816 Len=0"
"351","24.579954500","151.101.130.187","172.20.40.110","TLSv1.3","130","Application Data"
"352","24.619076400","151.101.130.187","172.20.40.110","TCP","130","[TCP Retransmission] 443  >  62911 [PSH, ACK] Seq=4308 Ack=71005 Win=101376 Len=76"
"353","24.619139800","172.20.40.110","151.101.130.187","TCP","66","62911  >  443 [ACK] Seq=71005 Ack=4384 Win=131072 Len=0 SLE=4308 SRE=4384"
"354","24.825745700","172.20.40.110","151.101.130.187","TLSv1.3","2822","Application Data"
"355","24.840624200","151.101.130.187","172.20.40.110","TCP","60","443  >  62911 [ACK] Seq=4384 Ack=73773 Win=98816 Len=0"
"356","24.846447300","151.101.130.187","172.20.40.110","TLSv1.3","125","Application Data"
"357","24.890566600","172.20.40.110","151.101.130.187","TCP","54","62911  >  443 [ACK] Seq=73773 Ack=4455 Win=130816 Len=0"
"358","25.184567400","172.20.40.110","151.101.130.187","TLSv1.3","2836","Application Data"
"359","25.189598100","172.20.40.110","151.101.130.187","TLSv1.3","2834","Application Data"
"360","25.240382700","172.20.40.110","151.101.130.187","TCP","1434","[TCP Retransmission] 62911  >  443 [PSH, ACK] Seq=77955 Ack=4455 Win=130816 Len=1380"
"361","25.429434000","172.20.40.110","151.101.130.187","TLSv1.3","2837","Application Data"
"362","25.504091700","151.101.130.187","172.20.40.110","TCP","74","443  >  62911 [ACK] Seq=4455 Ack=75153 Win=101376 Len=0 SLE=77955 SRE=79335 SLE=76533 SRE=79335"
"363","25.504091700","151.101.130.187","172.20.40.110","TCP","66","[TCP Dup ACK 362#1] 443  >  62911 [ACK] Seq=4455 Ack=75153 Win=101376 Len=0 SLE=76533 SRE=82118"
"364","25.504173100","172.20.40.110","151.101.130.187","TCP","1434","[TCP Retransmission] 62911  >  443 [ACK] Seq=75153 Ack=4455 Win=130816 Len=1380"
"365","25.513714200","151.101.130.187","172.20.40.110","TCP","60","443  >  62911 [ACK] Seq=4455 Ack=82118 Win=96256 Len=0"
"366","25.518024200","151.101.130.187","172.20.40.110","TLSv1.3","208","Application Data"
"367","25.519072900","151.101.130.187","172.20.40.110","TLSv1.3","104","Application Data"
"368","25.519156800","172.20.40.110","151.101.130.187","TCP","54","62911  >  443 [ACK] Seq=82118 Ack=4659 Win=130816 Len=0"
"369","25.536274700","151.101.130.187","172.20.40.110","TLSv1.3","125","Application Data"
"370","25.570839200","151.101.130.187","172.20.40.110","TCP","125","[TCP Retransmission] 443  >  62911 [PSH, ACK] Seq=4659 Ack=82118 Win=101376 Len=71"
"371","25.570903800","172.20.40.110","151.101.130.187","TCP","66","62911  >  443 [ACK] Seq=82118 Ack=4730 Win=130560 Len=0 SLE=4659 SRE=4730"
"372","28.667781100","172.20.40.110","151.101.130.187","TLSv1.3","2629","Application Data"
"373","28.708845100","151.101.130.187","172.20.40.110","TCP","60","443  >  62911 [ACK] Seq=4730 Ack=84693 Win=99328 Len=0"
"374","28.969587100","151.101.130.187","172.20.40.110","TLSv1.3","339","Application Data"
"375","28.969587100","151.101.130.187","172.20.40.110","TLSv1.3","357","Application Data"
"376","28.969587100","151.101.130.187","172.20.40.110","TCP","357","[TCP Retransmission] 443  >  62911 [PSH, ACK] Seq=5015 Ack=84693 Win=101376 Len=303"
"377","28.969695500","172.20.40.110","151.101.130.187","TCP","66","62911  >  443 [ACK] Seq=84693 Ack=5318 Win=130048 Len=0 SLE=5015 SRE=5318"
"378","28.971647700","172.20.40.110","151.101.130.187","TLSv1.3","89","Application Data"
"379","28.997559600","151.101.130.187","172.20.40.110","TCP","60","443  >  62911 [ACK] Seq=5318 Ack=84728 Win=101376 Len=0"
"380","30.817064500","172.20.40.110","151.101.130.187","TLSv1.3","2822","Application Data"
"381","30.838207300","172.20.40.110","151.101.130.187","TLSv1.3","2822","Application Data"
"382","30.840898800","151.101.130.187","172.20.40.110","TCP","60","443  >  62911 [ACK] Seq=5318 Ack=87496 Win=98816 Len=0"
"383","30.850671400","151.101.130.187","172.20.40.110","TLSv1.3","424","Application Data"
"384","30.851786600","151.101.130.187","172.20.40.110","TCP","60","443  >  62911 [ACK] Seq=5688 Ack=90264 Win=98816 Len=0"
"385","30.855395800","151.101.130.187","172.20.40.110","TLSv1.3","98","Application Data"
"386","30.855639100","172.20.40.110","151.101.130.187","TCP","54","62911  >  443 [ACK] Seq=90264 Ack=5732 Win=129536 Len=0"
"387","30.885099700","172.20.40.110","151.101.130.187","TLSv1.3","2836","Application Data"
"388","30.904369500","151.101.130.187","172.20.40.110","TCP","60","443  >  62911 [ACK] Seq=5732 Ack=93046 Win=98816 Len=0"
"389","30.904369500","151.101.130.187","172.20.40.110","TLSv1.3","130","Application Data"
"390","30.940929100","172.20.40.110","151.101.130.187","TLSv1.3","2840","Application Data"
"391","30.953841900","151.101.130.187","172.20.40.110","TCP","130","[TCP Spurious Retransmission] 443  >  62911 [PSH, ACK] Seq=5732 Ack=93046 Win=101376 Len=76"
"392","30.953841900","151.101.130.187","172.20.40.110","TCP","60","443  >  62911 [ACK] Seq=5808 Ack=95832 Win=98816 Len=0"
"393","30.953907400","172.20.40.110","151.101.130.187","TCP","66","[TCP Dup ACK 390#1] 62911  >  443 [ACK] Seq=95832 Ack=5808 Win=131072 Len=0 SLE=5732 SRE=5808"
"394","30.955856100","151.101.130.187","172.20.40.110","TLSv1.3","98","Application Data"
"395","30.989467800","151.101.130.187","172.20.40.110","TCP","98","[TCP Retransmission] 443  >  62911 [PSH, ACK] Seq=5808 Ack=95832 Win=101376 Len=44"
"396","30.989535800","172.20.40.110","151.101.130.187","TCP","66","62911  >  443 [ACK] Seq=95832 Ack=5852 Win=130816 Len=0 SLE=5808 SRE=5852"
"397","36.632373800","172.20.40.110","151.101.130.187","TLSv1.3","2930","Application Data"
"398","36.645336100","151.101.130.187","172.20.40.110","TCP","60","443  >  62911 [ACK] Seq=5852 Ack=98708 Win=98816 Len=0"
"399","36.649691800","151.101.130.187","172.20.40.110","TLSv1.3","214","Application Data"
"400","36.652756800","172.20.40.110","151.101.130.187","TLSv1.3","2915","Application Data"
"401","36.660079700","172.20.40.110","151.101.130.187","TLSv1.3","2921","Application Data"
"402","36.661157700","172.20.40.110","151.101.130.187","TLSv1.3","2916","Application Data"
"403","36.665740300","151.101.130.187","172.20.40.110","TCP","60","443  >  62911 [ACK] Seq=6012 Ack=101569 Win=98816 Len=0"
"404","36.666906900","151.101.130.187","172.20.40.110","TLSv1.3","98","Application Data"
"405","36.672901100","151.101.130.187","172.20.40.110","TCP","60","443  >  62911 [ACK] Seq=6056 Ack=104436 Win=98816 Len=0"
"406","36.672901100","151.101.130.187","172.20.40.110","TCP","60","443  >  62911 [ACK] Seq=6056 Ack=107298 Win=98304 Len=0"
"407","36.672901100","151.101.130.187","172.20.40.110","TLSv1.3","124","Application Data"
"408","36.672993500","172.20.40.110","151.101.130.187","TCP","54","62911  >  443 [ACK] Seq=107298 Ack=6126 Win=130560 Len=0"
"409","36.674225900","151.101.130.187","172.20.40.110","TLSv1.3","130","Application Data"
"410","36.715742300","172.20.40.110","151.101.130.187","TCP","54","62911  >  443 [ACK] Seq=107298 Ack=6202 Win=130560 Len=0"
"411","36.731349700","151.101.130.187","172.20.40.110","TCP","130","[TCP Spurious Retransmission] 443  >  62911 [PSH, ACK] Seq=6126 Ack=107298 Win=101376 Len=76"
"412","36.731458200","172.20.40.110","151.101.130.187","TCP","66","[TCP Dup ACK 410#1] 62911  >  443 [ACK] Seq=107298 Ack=6202 Win=130560 Len=0 SLE=6126 SRE=6202"
"413","36.795769600","172.20.40.110","151.101.130.187","TLSv1.3","2915","Application Data"
"414","36.807566800","151.101.130.187","172.20.40.110","TCP","60","443  >  62911 [ACK] Seq=6202 Ack=110159 Win=99328 Len=0"
"415","36.811858300","151.101.130.187","172.20.40.110","TLSv1.3","124","Application Data"
"416","36.842152100","151.101.130.187","172.20.40.110","TCP","124","[TCP Retransmission] 443  >  62911 [PSH, ACK] Seq=6202 Ack=110159 Win=101376 Len=70"
"417","36.842313500","172.20.40.110","151.101.130.187","TCP","66","62911  >  443 [ACK] Seq=110159 Ack=6272 Win=130560 Len=0 SLE=6202 SRE=6272"
"418","36.843880800","172.20.40.110","151.101.130.187","TLSv1.3","2912","Application Data"
"419","36.852758100","151.101.130.187","172.20.40.110","TCP","60","443  >  62911 [ACK] Seq=6272 Ack=113017 Win=98816 Len=0"
"420","36.861478900","151.101.130.187","172.20.40.110","TLSv1.3","131","Application Data"
"421","36.870580400","172.20.40.110","151.101.130.187","TLSv1.3","2929","Application Data"
"422","36.872305400","172.20.40.110","151.101.130.187","TLSv1.3","2930","Application Data"
"423","36.879352500","151.101.130.187","172.20.40.110","TCP","60","443  >  62911 [ACK] Seq=6349 Ack=115892 Win=98816 Len=0"
"424","36.883689300","151.101.130.187","172.20.40.110","TCP","60","443  >  62911 [ACK] Seq=6349 Ack=118768 Win=98304 Len=0"
"425","36.883689300","151.101.130.187","172.20.40.110","TLSv1.3","125","Application Data"
"426","36.884759000","151.101.130.187","172.20.40.110","TLSv1.3","98","Application Data"
"427","36.884830100","172.20.40.110","151.101.130.187","TCP","54","62911  >  443 [ACK] Seq=118768 Ack=6464 Win=130304 Len=0"
"428","37.009439500","172.20.40.110","151.101.130.187","TLSv1.3","2912","Application Data"
"429","37.022892000","172.20.40.110","151.101.130.187","TLSv1.3","2918","Application Data"
"430","37.023526500","151.101.130.187","172.20.40.110","TCP","60","443  >  62911 [ACK] Seq=6464 Ack=121626 Win=98816 Len=0"
"431","37.023526500","151.101.130.187","172.20.40.110","TLSv1.3","208","Application Data"
"432","37.026262400","172.20.40.110","151.101.130.187","TLSv1.3","2914","Application Data"
"433","37.026464900","172.20.40.110","151.101.130.187","TLSv1.3","2917","Application Data"
"434","37.044739500","151.101.130.187","172.20.40.110","TCP","60","443  >  62911 [ACK] Seq=6618 Ack=124490 Win=98816 Len=0"
"435","37.044739500","151.101.130.187","172.20.40.110","TCP","60","443  >  62911 [ACK] Seq=6618 Ack=127350 Win=100352 Len=0"
"436","37.045955500","151.101.130.187","172.20.40.110","TCP","60","443  >  62911 [ACK] Seq=6618 Ack=130213 Win=98304 Len=0"
"437","37.047333900","151.101.130.187","172.20.40.110","TLSv1.3","125","Application Data"
"438","37.047333900","151.101.130.187","172.20.40.110","TLSv1.3","124","Application Data"
"439","37.047419000","172.20.40.110","151.101.130.187","TCP","54","62911  >  443 [ACK] Seq=130213 Ack=6759 Win=130048 Len=0"
"440","37.049702300","151.101.130.187","172.20.40.110","TLSv1.3","124","Application Data"
"441","37.078290200","172.20.40.110","151.101.130.187","TLSv1.3","2929","Application Data"
"442","37.090080800","151.101.130.187","172.20.40.110","TCP","124","[TCP Spurious Retransmission] 443  >  62911 [PSH, ACK] Seq=6759 Ack=130213 Win=101376 Len=70"
"443","37.090080800","151.101.130.187","172.20.40.110","TCP","60","443  >  62911 [ACK] Seq=6829 Ack=133088 Win=98816 Len=0"
"444","37.090138500","172.20.40.110","151.101.130.187","TCP","66","[TCP Dup ACK 441#1] 62911  >  443 [ACK] Seq=133088 Ack=6829 Win=130048 Len=0 SLE=6759 SRE=6829"
"445","37.093492000","151.101.130.187","172.20.40.110","TLSv1.3","124","Application Data"
"446","37.126998500","151.101.130.187","172.20.40.110","TCP","124","[TCP Retransmission] 443  >  62911 [PSH, ACK] Seq=6829 Ack=133088 Win=101376 Len=70"
"447","37.127116400","172.20.40.110","151.101.130.187","TCP","66","62911  >  443 [ACK] Seq=133088 Ack=6899 Win=129792 Len=0 SLE=6829 SRE=6899"
"448","37.206330100","172.20.40.110","151.101.130.187","TLSv1.3","2929","Application Data"
"449","37.206551400","172.20.40.110","151.101.130.187","TLSv1.3","2930","Application Data"
"450","37.217921900","151.101.130.187","172.20.40.110","TCP","60","443  >  62911 [ACK] Seq=6899 Ack=135963 Win=98816 Len=0"
"451","37.220325200","151.101.130.187","172.20.40.110","TLSv1.3","98","Application Data"
"452","37.221424200","151.101.130.187","172.20.40.110","TCP","60","443  >  62911 [ACK] Seq=6943 Ack=138839 Win=100352 Len=0"
"453","37.224806200","151.101.130.187","172.20.40.110","TLSv1.3","125","Application Data"
"454","37.224897400","172.20.40.110","151.101.130.187","TCP","54","62911  >  443 [ACK] Seq=138839 Ack=7014 Win=129792 Len=0"
"455","37.342637700","172.20.40.110","151.101.130.187","TLSv1.3","2923","Application Data"
"456","37.355733700","151.101.130.187","172.20.40.110","TCP","60","443  >  62911 [ACK] Seq=7014 Ack=141708 Win=98816 Len=0"
"457","37.357949600","151.101.130.187","172.20.40.110","TLSv1.3","124","Application Data"
"458","37.390988700","151.101.130.187","172.20.40.110","TCP","124","[TCP Retransmission] 443  >  62911 [PSH, ACK] Seq=7014 Ack=141708 Win=101376 Len=70"
"459","37.391049000","172.20.40.110","151.101.130.187","TCP","66","62911  >  443 [ACK] Seq=141708 Ack=7084 Win=129792 Len=0 SLE=7014 SRE=7084"
"460","37.406260000","172.20.40.110","151.101.130.187","TLSv1.3","2915","Application Data"
"461","37.417725700","151.101.130.187","172.20.40.110","TCP","60","443  >  62911 [ACK] Seq=7084 Ack=144569 Win=98816 Len=0"
"462","37.426277500","151.101.130.187","172.20.40.110","TLSv1.3","104","Application Data"
"463","37.456737600","151.101.130.187","172.20.40.110","TCP","104","[TCP Retransmission] 443  >  62911 [PSH, ACK] Seq=7084 Ack=144569 Win=101376 Len=50"
"464","37.456791800","172.20.40.110","151.101.130.187","TCP","66","62911  >  443 [ACK] Seq=144569 Ack=7134 Win=129536 Len=0 SLE=7084 SRE=7134"
"465","37.607328400","172.20.40.110","151.101.130.187","TLSv1.3","2915","Application Data"
"466","37.616098900","151.101.130.187","172.20.40.110","TCP","60","443  >  62911 [ACK] Seq=7134 Ack=147430 Win=98816 Len=0"
"467","37.623083300","151.101.130.187","172.20.40.110","TLSv1.3","124","Application Data"
"468","37.654937000","151.101.130.187","172.20.40.110","TCP","124","[TCP Retransmission] 443  >  62911 [PSH, ACK] Seq=7134 Ack=147430 Win=101376 Len=70"
"469","37.655072300","172.20.40.110","151.101.130.187","TCP","66","62911  >  443 [ACK] Seq=147430 Ack=7204 Win=131072 Len=0 SLE=7134 SRE=7204"
"470","37.741422400","172.20.40.110","151.101.130.187","TLSv1.3","2873","Application Data"
"471","37.741679500","172.20.40.110","151.101.130.187","TLSv1.3","2870","Application Data"
"472","37.759129500","151.101.130.187","172.20.40.110","TCP","60","443  >  62911 [ACK] Seq=7204 Ack=150249 Win=103936 Len=0"
"473","37.759129500","151.101.130.187","172.20.40.110","TCP","60","443  >  62911 [ACK] Seq=7204 Ack=153065 Win=109568 Len=0"
"474","37.759129500","151.101.130.187","172.20.40.110","TLSv1.3","173","Application Data"
"475","37.760448400","151.101.130.187","172.20.40.110","TLSv1.3","285","Application Data"
"476","37.760523200","172.20.40.110","151.101.130.187","TCP","54","62911  >  443 [ACK] Seq=153065 Ack=7554 Win=130560 Len=0"
"477","37.800868000","172.20.40.110","151.101.130.187","TLSv1.3","2916","Application Data"
"478","37.808471200","172.20.40.110","151.101.130.187","TLSv1.3","2634","Application Data"
"479","37.813476900","151.101.130.187","172.20.40.110","TCP","60","443  >  62911 [ACK] Seq=7554 Ack=155927 Win=115200 Len=0"
"480","37.819853600","151.101.130.187","172.20.40.110","TLSv1.3","124","Application Data"
"481","37.824044300","151.101.130.187","172.20.40.110","TCP","60","443  >  62911 [ACK] Seq=7624 Ack=158507 Win=120832 Len=0"
"482","37.851613800","151.101.130.187","172.20.40.110","TCP","124","[TCP Retransmission] 443  >  62911 [PSH, ACK] Seq=7554 Ack=158507 Win=120832 Len=70"
"483","37.851718700","172.20.40.110","151.101.130.187","TCP","66","62911  >  443 [ACK] Seq=158507 Ack=7624 Win=130560 Len=0 SLE=7554 SRE=7624"
"484","37.887725900","151.101.130.187","172.20.40.110","TLSv1.3","478","Application Data"
"485","37.887725900","151.101.130.187","172.20.40.110","TLSv1.3","2814","Application Data"
"486","37.887852300","172.20.40.110","151.101.130.187","TCP","54","62911  >  443 [ACK] Seq=158507 Ack=10808 Win=131072 Len=0"
"487","37.891014200","151.101.130.187","172.20.40.110","TLSv1.3","1371","Application Data, Application Data"
"488","37.891155800","172.20.40.110","151.101.130.187","TCP","54","62911  >  443 [ACK] Seq=158507 Ack=12125 Win=129536 Len=0"
"489","37.898641400","172.20.40.110","151.101.130.187","TLSv1.3","89","Application Data"
"490","37.906887900","151.101.130.187","172.20.40.110","TCP","60","443  >  62911 [ACK] Seq=12125 Ack=158542 Win=120832 Len=0"
"491","37.948407100","172.20.40.110","151.101.130.187","TCP","66","53357  >  443 [SYN] Seq=0 Win=64240 Len=0 MSS=1460 WS=256 SACK_PERM"
"492","37.962034700","151.101.130.187","172.20.40.110","TCP","66","443  >  53357 [SYN, ACK] Seq=0 Ack=1 Win=65535 Len=0 MSS=1380 SACK_PERM WS=512"
"493","37.962126600","172.20.40.110","151.101.130.187","TCP","54","53357  >  443 [ACK] Seq=1 Ack=1 Win=66048 Len=0"
"494","37.962830100","172.20.40.110","151.101.130.187","TLSv1.3","2002","Client Hello (SNI=r2d2.target.com)"
"495","37.980571200","151.101.130.187","172.20.40.110","TCP","60","443  >  53357 [ACK] Seq=1 Ack=1949 Win=144384 Len=0"
"496","37.980571200","151.101.130.187","172.20.40.110","TLSv1.3","1434","Server Hello, Change Cipher Spec, Application Data, Application Data"
"497","37.980571200","151.101.130.187","172.20.40.110","TLSv1.3","215","Application Data"
"498","37.980648700","172.20.40.110","151.101.130.187","TCP","54","53357  >  443 [ACK] Seq=1949 Ack=1542 Win=66048 Len=0"
"499","37.981244100","172.20.40.110","151.101.130.187","TLSv1.3","118","Change Cipher Spec, Application Data"
"500","37.981529900","172.20.40.110","151.101.130.187","TLSv1.3","146","Application Data"
"501","37.981787000","172.20.40.110","151.101.130.187","TLSv1.3","524","Application Data"
"502","37.994851300","151.101.130.187","172.20.40.110","TCP","60","443  >  53357 [ACK] Seq=1542 Ack=2013 Win=144384 Len=0"
"503","37.994851300","151.101.130.187","172.20.40.110","TCP","60","443  >  53357 [ACK] Seq=1542 Ack=2105 Win=144384 Len=0"
"504","37.994851300","151.101.130.187","172.20.40.110","TLSv1.3","119","Application Data"
"505","37.994851300","151.101.130.187","172.20.40.110","TCP","60","443  >  53357 [ACK] Seq=1607 Ack=2575 Win=144384 Len=0"
"506","37.995246000","172.20.40.110","151.101.130.187","TLSv1.3","85","Application Data"
"507","37.997046700","151.101.130.187","172.20.40.110","TLSv1.3","480","Application Data"
"508","38.003925500","151.101.130.187","172.20.40.110","TCP","60","443  >  53357 [ACK] Seq=2033 Ack=2606 Win=144384 Len=0"
"509","38.038473500","172.20.40.110","151.101.130.187","TCP","54","53357  >  443 [ACK] Seq=2606 Ack=2033 Win=65536 Len=0"
"510","38.056238700","151.101.130.187","172.20.40.110","TCP","480","[TCP Spurious Retransmission] 443  >  53357 [PSH, ACK] Seq=1607 Ack=2606 Win=144384 Len=426"
"511","38.056400800","172.20.40.110","151.101.130.187","TCP","66","[TCP Dup ACK 509#1] 53357  >  443 [ACK] Seq=2606 Ack=2033 Win=65536 Len=0 SLE=1607 SRE=2033"
"512","38.130845600","172.20.40.110","151.101.130.187","TLSv1.3","2929","Application Data"
"513","38.142431900","151.101.130.187","172.20.40.110","TCP","60","443  >  62911 [ACK] Seq=12125 Ack=161417 Win=126464 Len=0"
"514","38.152577000","151.101.130.187","172.20.40.110","TLSv1.3","235","Application Data"
"515","38.152658900","172.20.40.110","151.101.130.187","TLSv1.3","2930","Application Data"
"516","38.167098300","151.101.130.187","172.20.40.110","TCP","60","443  >  62911 [ACK] Seq=12306 Ack=164293 Win=132096 Len=0"
"517","38.173717600","151.101.130.187","172.20.40.110","TLSv1.3","125","Application Data"
"518","38.203955500","151.101.130.187","172.20.40.110","TCP","125","[TCP Retransmission] 443  >  62911 [PSH, ACK] Seq=12306 Ack=164293 Win=132096 Len=71"
"519","38.204011500","172.20.40.110","151.101.130.187","TCP","66","62911  >  443 [ACK] Seq=164293 Ack=12377 Win=130816 Len=0 SLE=12306 SRE=12377"
"520","38.290926400","172.20.40.110","151.101.130.187","TLSv1.3","2929","Application Data"
"521","38.296042900","172.20.40.110","151.101.130.187","TLSv1.3","2930","Application Data"
"522","38.301138200","172.20.40.110","151.101.130.187","TLSv1.3","2919","Application Data"
"523","38.301482200","151.101.130.187","172.20.40.110","TCP","60","443  >  62911 [ACK] Seq=12377 Ack=167168 Win=138240 Len=0"
"524","38.307279100","151.101.130.187","172.20.40.110","TLSv1.3","98","Application Data"
"525","38.307279100","151.101.130.187","172.20.40.110","TCP","60","443  >  62911 [ACK] Seq=12421 Ack=170044 Win=143872 Len=0"
"526","38.311628100","151.101.130.187","172.20.40.110","TLSv1.3","98","Application Data"
"527","38.311628100","151.101.130.187","172.20.40.110","TCP","60","443  >  62911 [ACK] Seq=12465 Ack=172909 Win=149504 Len=0"
"528","38.311703600","172.20.40.110","151.101.130.187","TCP","54","62911  >  443 [ACK] Seq=172909 Ack=12465 Win=130816 Len=0"
"529","38.315064600","151.101.130.187","172.20.40.110","TLSv1.3","130","Application Data"
"530","38.340658800","172.20.40.110","151.101.130.187","TLSv1.3","2913","Application Data"
"531","38.340982600","172.20.40.110","151.101.130.187","TLSv1.3","2914","Application Data"
"532","38.348810800","151.101.130.187","172.20.40.110","TCP","130","[TCP Spurious Retransmission] 443  >  62911 [PSH, ACK] Seq=12465 Ack=172909 Win=149504 Len=76"
"533","38.348879800","172.20.40.110","151.101.130.187","TCP","66","[TCP Dup ACK 530#1] 62911  >  443 [ACK] Seq=178628 Ack=12541 Win=130816 Len=0 SLE=12465 SRE=12541"
"534","38.355748000","151.101.130.187","172.20.40.110","TCP","60","443  >  62911 [ACK] Seq=12541 Ack=175768 Win=155136 Len=0"
"535","38.355748000","151.101.130.187","172.20.40.110","TCP","60","443  >  62911 [ACK] Seq=12541 Ack=178628 Win=160768 Len=0"
"536","38.358998900","151.101.130.187","172.20.40.110","TLSv1.3","130","Application Data"
"537","38.362345200","151.101.130.187","172.20.40.110","TLSv1.3","341","Application Data"
"538","38.362419000","172.20.40.110","151.101.130.187","TCP","54","62911  >  443 [ACK] Seq=178628 Ack=12904 Win=130304 Len=0"
"539","48.721547800","172.20.40.110","151.101.130.187","TLSv1.3","2885","Application Data"
"540","48.721733600","172.20.40.110","151.101.130.187","TLSv1.3","93","Application Data"
"541","48.742712300","172.20.40.110","151.101.130.187","TLSv1.3","2884","Application Data"
"542","48.751194200","172.20.40.110","151.101.130.187","TCP","1434","[TCP Retransmission] 62911  >  443 [PSH, ACK] Seq=182948 Ack=12904 Win=130304 Len=1380"
"543","48.871899500","172.20.40.110","151.101.130.187","TLSv1.3","2882","Application Data"
"544","49.057781100","172.20.40.110","151.101.130.187","TCP","1434","[TCP Retransmission] 62911  >  443 [ACK] Seq=178628 Ack=12904 Win=130304 Len=1380"
"545","49.663729700","172.20.40.110","151.101.130.187","TCP","1434","[TCP Retransmission] 62911  >  443 [ACK] Seq=178628 Ack=12904 Win=130304 Len=1380"
"546","50.876979600","172.20.40.110","151.101.130.187","TCP","1434","[TCP Retransmission] 62911  >  443 [ACK] Seq=178628 Ack=12904 Win=130304 Len=1380"
"547","53.283223000","172.20.40.110","151.101.130.187","TCP","1434","[TCP Retransmission] 62911  >  443 [ACK] Seq=178628 Ack=12904 Win=130304 Len=1380"
"548","58.098218800","172.20.40.110","151.101.130.187","TCP","1434","[TCP Retransmission] 62911  >  443 [ACK] Seq=178628 Ack=12904 Win=130304 Len=1380"
"549","58.110494800","151.101.130.187","172.20.40.110","TCP","66","443  >  62911 [ACK] Seq=12904 Ack=180008 Win=163840 Len=0 SLE=178628 SRE=180008"
"550","58.110591000","172.20.40.110","151.101.130.187","TCP","1434","62911  >  443 [ACK] Seq=187156 Ack=12904 Win=130304 Len=1380 [TCP PDU reassembled in 570]"
"551","58.110591000","172.20.40.110","151.101.130.187","TCP","1434","62911  >  443 [ACK] Seq=188536 Ack=12904 Win=130304 Len=1380 [TCP PDU reassembled in 570]"
"552","58.126210900","172.20.40.110","151.101.130.187","TCP","54","53357  >  443 [FIN, ACK] Seq=2606 Ack=2033 Win=65536 Len=0"
"553","58.180604400","151.101.130.187","172.20.40.110","TCP","60","[TCP Previous segment not captured] 443  >  53357 [FIN, ACK] Seq=2057 Ack=2607 Win=144384 Len=0"
"554","58.180670200","172.20.40.110","151.101.130.187","TCP","54","[TCP Dup ACK 509#2] 53357  >  443 [ACK] Seq=2607 Ack=2033 Win=65536 Len=0"
"555","58.403866000","151.101.130.187","172.20.40.110","TCP","78","[TCP Retransmission] 443  >  53357 [FIN, PSH, ACK] Seq=2033 Ack=2607 Win=144384 Len=24"
"556","58.404240000","172.20.40.110","151.101.130.187","TCP","54","53357  >  443 [RST, ACK] Seq=2607 Ack=2057 Win=0 Len=0"
"557","58.425498700","172.20.40.110","151.101.130.187","TCP","1434","[TCP Retransmission] 62911  >  443 [ACK] Seq=180008 Ack=12904 Win=130304 Len=1380"
"558","58.438506500","151.101.130.187","172.20.40.110","TCP","66","443  >  62911 [ACK] Seq=12904 Ack=181388 Win=172544 Len=0 SLE=187156 SRE=189916"
"559","58.438587700","172.20.40.110","151.101.130.187","TLSv1.3","1434","[TCP Out-Of-Order] , Continuation Data"
"560","58.438587700","172.20.40.110","151.101.130.187","TCP","1434","[TCP Retransmission] 62911  >  443 [ACK] Seq=182768 Ack=12904 Win=130304 Len=1380"
"561","58.452775500","151.101.130.187","172.20.40.110","TCP","66","443  >  62911 [ACK] Seq=12904 Ack=182768 Win=175616 Len=0 SLE=187156 SRE=189916"
"562","58.452775500","151.101.130.187","172.20.40.110","TLSv1.3","105","Application Data"
"563","58.452922900","172.20.40.110","151.101.130.187","TLSv1.3","1434","[TCP Out-Of-Order] , Continuation Data"
"564","58.452922900","172.20.40.110","151.101.130.187","TCP","1434","[TCP Retransmission] 62911  >  443 [ACK] Seq=185528 Ack=12943 Win=130304 Len=1380"
"565","58.764951200","172.20.40.110","151.101.130.187","TCP","1434","[TCP Retransmission] 62911  >  443 [ACK] Seq=182768 Ack=12943 Win=130304 Len=1380"
"566","59.169164200","151.101.130.187","172.20.40.110","TLSv1.3","270","Application Data, Application Data"
"567","59.169282500","172.20.40.110","151.101.130.187","TLSv1.3","1434","[TCP Out-Of-Order] , Continuation Data"
"568","59.305192400","151.101.130.187","172.20.40.110","TCP","66","443  >  62911 [ACK] Seq=13147 Ack=189916 Win=187392 Len=0 SLE=187156 SRE=188288"
"569","59.305192400","151.101.130.187","172.20.40.110","TLSv1.3","235","Application Data"
"570","59.305331800","172.20.40.110","151.101.130.187","TLSv1.3","4194","Application Data, Application Data"
"571","59.324694400","151.101.130.187","172.20.40.110","TCP","60","443  >  62911 [ACK] Seq=13328 Ack=192676 Win=193024 Len=0"
"572","59.324694400","151.101.130.187","172.20.40.110","TLSv1.3","125","Application Data"
"573","59.324810400","172.20.40.110","151.101.130.187","TLSv1.3","2814","Application Data"
"574","59.336886000","151.101.130.187","172.20.40.110","TLSv1.3","124","Application Data"
"575","59.337023200","172.20.40.110","151.101.130.187","TCP","1434","62911  >  443 [ACK] Seq=196816 Ack=13469 Win=129792 Len=1380 [TCP PDU reassembled in 579]"
"576","59.359883800","151.101.130.187","172.20.40.110","TCP","60","443  >  62911 [ACK] Seq=13469 Ack=196816 Win=201728 Len=0"
"577","59.359883800","151.101.130.187","172.20.40.110","TLSv1.3","124","Application Data"
"578","59.359883800","151.101.130.187","172.20.40.110","TCP","60","443  >  62911 [ACK] Seq=13539 Ack=198196 Win=204800 Len=0"
"579","59.360160600","172.20.40.110","151.101.130.187","TLSv1.3","5574","Application Data, Application Data"
"580","59.371913800","151.101.130.187","172.20.40.110","TCP","60","443  >  62911 [ACK] Seq=13539 Ack=199576 Win=207872 Len=0"
"581","59.372013000","172.20.40.110","151.101.130.187","TLSv1.3","1434","Application Data"
"582","59.382172600","151.101.130.187","172.20.40.110","TCP","60","443  >  62911 [ACK] Seq=13539 Ack=200956 Win=210432 Len=0"
"583","59.382172600","151.101.130.187","172.20.40.110","TLSv1.3","124","Application Data"
"584","59.382172600","151.101.130.187","172.20.40.110","TCP","60","443  >  62911 [ACK] Seq=13609 Ack=203716 Win=216576 Len=0"
"585","59.382172600","151.101.130.187","172.20.40.110","TLSv1.3","124","Application Data"
"586","59.382288900","172.20.40.110","151.101.130.187","TLSv1.3","5574","Application Data, Application Data"
"587","59.406976500","151.101.130.187","172.20.40.110","TCP","60","443  >  62911 [ACK] Seq=13679 Ack=205096 Win=219136 Len=0"
"588","59.406976500","151.101.130.187","172.20.40.110","TLSv1.3","124","Application Data"
"589","59.406976500","151.101.130.187","172.20.40.110","TCP","60","443  >  62911 [ACK] Seq=13749 Ack=206476 Win=222208 Len=0"
"590","59.407083900","172.20.40.110","151.101.130.187","TLSv1.3","2814","Application Data"
"591","59.473561400","151.101.130.187","172.20.40.110","TCP","124","[TCP Spurious Retransmission] 443  >  62911 [PSH, ACK] Seq=13679 Ack=206476 Win=222208 Len=70"
"592","59.473624500","172.20.40.110","151.101.130.187","TCP","66","[TCP Dup ACK 590#1] 62911  >  443 [ACK] Seq=213376 Ack=13749 Win=131072 Len=0 SLE=13679 SRE=13749"
"593","59.484831900","151.101.130.187","172.20.40.110","TCP","60","443  >  62911 [ACK] Seq=13749 Ack=207856 Win=225280 Len=0"
"594","59.484831900","151.101.130.187","172.20.40.110","TCP","60","443  >  62911 [ACK] Seq=13749 Ack=209236 Win=227840 Len=0"
"595","59.484831900","151.101.130.187","172.20.40.110","TLSv1.3","125","Application Data"
"596","59.484831900","151.101.130.187","172.20.40.110","TCP","60","443  >  62911 [ACK] Seq=13820 Ack=211996 Win=233984 Len=0"
"597","59.484831900","151.101.130.187","172.20.40.110","TLSv1.3","131","Application Data"
"598","59.484831900","151.101.130.187","172.20.40.110","TLSv1.3","124","Application Data"
"599","59.485040300","172.20.40.110","151.101.130.187","TLSv1.3","1998","Application Data, Application Data, Application Data"
"600","59.485654200","172.20.40.110","151.101.130.187","TCP","54","62911  >  443 [FIN, ACK] Seq=215320 Ack=13967 Win=130816 Len=0"
"601","59.499286200","151.101.130.187","172.20.40.110","TCP","60","443  >  62911 [ACK] Seq=13967 Ack=215320 Win=240640 Len=0"
"602","59.499286200","151.101.130.187","172.20.40.110","TCP","60","443  >  62911 [ACK] Seq=13967 Ack=215321 Win=240640 Len=0"
"603","59.499286200","151.101.130.187","172.20.40.110","TLSv1.3","78","Application Data"
"604","59.499286200","151.101.130.187","172.20.40.110","TCP","60","443  >  62911 [FIN, ACK] Seq=13991 Ack=215321 Win=240640 Len=0"
"605","59.499432200","172.20.40.110","151.101.130.187","TCP","54","62911  >  443 [RST, ACK] Seq=215321 Ack=13991 Win=0 Len=0"
