"No.","Time","Source","Destination","Protocol","Length","Info"
"1","0.000000000","172.20.40.110","151.101.194.187","TCP","54","60246  >  443 [FIN, ACK] Seq=1 Ack=1 Win=258 Len=0"
"2","0.009065000","151.101.194.187","172.20.40.110","TCP","60","443  >  60246 [ACK] Seq=1 Ack=2 Win=198 Len=0"
"3","0.009065000","151.101.194.187","172.20.40.110","TLSv1.2","78","Application Data"
"4","0.009065000","151.101.194.187","172.20.40.110","TCP","60","443  >  60246 [FIN, ACK] Seq=25 Ack=2 Win=198 Len=0"
"5","0.009291700","172.20.40.110","151.101.194.187","TCP","54","60246  >  443 [RST, ACK] Seq=2 Ack=25 Win=0 Len=0"
"6","5.819874900","172.20.40.110","151.101.66.187","TCP","66","57039  >  443 [SYN] Seq=0 Win=64240 Len=0 MSS=1460 WS=256 SACK_PERM"
"7","5.827797900","151.101.66.187","172.20.40.110","TCP","66","443  >  57039 [SYN, ACK] Seq=0 Ack=1 Win=65535 Len=0 MSS=1380 SACK_PERM WS=512"
"8","5.828262300","172.20.40.110","151.101.66.187","TCP","54","57039  >  443 [ACK] Seq=1 Ack=1 Win=66048 Len=0"
"9","5.830220300","172.20.40.110","151.101.66.187","TLSv1.3","2097","Client Hello (SNI=www.target.com)"
"10","5.839322400","151.101.66.187","172.20.40.110","TCP","60","443  >  57039 [ACK] Seq=1 Ack=2044 Win=144384 Len=0"
"11","5.842393600","151.101.66.187","172.20.40.110","TLSv1.3","1434","Server Hello, Change Cipher Spec, Application Data, Application Data"
"12","5.842393600","151.101.66.187","172.20.40.110","TLSv1.3","215","Application Data"
"13","5.842499800","172.20.40.110","151.101.66.187","TCP","54","57039  >  443 [ACK] Seq=2044 Ack=1542 Win=66048 Len=0"
"14","5.844906200","172.20.40.110","151.101.66.187","TLSv1.3","118","Change Cipher Spec, Application Data"
"15","5.846035700","172.20.40.110","151.101.66.187","TLSv1.3","146","Application Data"
"16","5.846647000","172.20.40.110","151.101.66.187","TLSv1.3","2789","Application Data"
"17","5.852696900","151.101.66.187","172.20.40.110","TCP","60","443  >  57039 [ACK] Seq=1542 Ack=2108 Win=144384 Len=0"
"18","5.855127000","151.101.66.187","172.20.40.110","TCP","60","443  >  57039 [ACK] Seq=1542 Ack=2200 Win=144384 Len=0"
"19","5.855127000","151.101.66.187","172.20.40.110","TLSv1.3","119","Application Data"
"20","5.855841400","172.20.40.110","151.101.66.187","TLSv1.3","85","Application Data"
"21","5.856397100","151.101.66.187","172.20.40.110","TCP","60","443  >  57039 [ACK] Seq=1607 Ack=4935 Win=141824 Len=0"
"22","5.859749500","151.101.66.187","172.20.40.110","TLSv1.3","451","Application Data"
"23","5.864074100","151.101.66.187","172.20.40.110","TCP","60","443  >  57039 [ACK] Seq=2004 Ack=4966 Win=141824 Len=0"
"24","5.889324600","151.101.66.187","172.20.40.110","TCP","451","[TCP Retransmission] 443  >  57039 [PSH, ACK] Seq=1607 Ack=4966 Win=141824 Len=397"
"25","5.889406500","172.20.40.110","151.101.66.187","TCP","66","57039  >  443 [ACK] Seq=4966 Ack=2004 Win=65536 Len=0 SLE=1607 SRE=2004"
"26","7.116436300","172.20.40.110","151.101.66.187","TLSv1.3","2788","Application Data"
"27","7.119264200","172.20.40.110","151.101.66.187","TLSv1.3","2776","Application Data"
"28","7.120491100","172.20.40.110","151.101.66.187","TLSv1.3","2770","Application Data"
"29","7.125032400","172.20.40.110","151.101.66.187","TLSv1.3","2789","Application Data"
"30","7.129578800","151.101.66.187","172.20.40.110","TCP","60","443  >  57039 [ACK] Seq=2004 Ack=7700 Win=139264 Len=0"
"31","7.129578800","151.101.66.187","172.20.40.110","TCP","60","443  >  57039 [ACK] Seq=2004 Ack=10422 Win=136704 Len=0"
"32","7.130371200","151.101.66.187","172.20.40.110","TLSv1.3","241","Application Data"
"33","7.130492600","172.20.40.110","151.101.66.187","TLSv1.3","2771","Application Data"
"34","7.132280500","151.101.66.187","172.20.40.110","TCP","60","443  >  57039 [ACK] Seq=2191 Ack=13138 Win=134144 Len=0"
"35","7.132280500","151.101.66.187","172.20.40.110","TLSv1.3","130","Application Data"
"36","7.134874200","151.101.66.187","172.20.40.110","TLSv1.3","130","Application Data"
"37","7.134966100","172.20.40.110","151.101.66.187","TCP","54","57039  >  443 [ACK] Seq=18590 Ack=2343 Win=65280 Len=0"
"38","7.136661000","151.101.66.187","172.20.40.110","TCP","60","443  >  57039 [ACK] Seq=2343 Ack=15873 Win=131584 Len=0"
"39","7.139706200","151.101.66.187","172.20.40.110","TLSv1.3","98","Application Data"
"40","7.141819000","151.101.66.187","172.20.40.110","TCP","60","443  >  57039 [ACK] Seq=2387 Ack=18590 Win=129024 Len=0"
"41","7.152539500","151.101.66.187","172.20.40.110","TLSv1.3","130","Application Data"
"42","7.152622400","172.20.40.110","151.101.66.187","TCP","54","57039  >  443 [ACK] Seq=18590 Ack=2463 Win=65280 Len=0"
"43","7.301774100","172.20.40.110","151.101.66.187","TLSv1.3","2792","Application Data"
"44","7.315120700","151.101.66.187","172.20.40.110","TCP","60","443  >  57039 [ACK] Seq=2463 Ack=21328 Win=126464 Len=0"
"45","7.320100200","151.101.66.187","172.20.40.110","TLSv1.3","130","Application Data"
"46","7.330786400","172.20.40.110","151.101.66.187","TLSv1.3","2772","Application Data"
"47","7.341079800","151.101.66.187","172.20.40.110","TCP","60","443  >  57039 [ACK] Seq=2539 Ack=24046 Win=123904 Len=0"
"48","7.348526000","151.101.66.187","172.20.40.110","TLSv1.3","241","Application Data"
"49","7.383428800","151.101.66.187","172.20.40.110","TCP","241","[TCP Retransmission] 443  >  57039 [PSH, ACK] Seq=2539 Ack=24046 Win=123904 Len=187"
"50","7.383554600","172.20.40.110","151.101.66.187","TCP","66","57039  >  443 [ACK] Seq=24046 Ack=2726 Win=65024 Len=0 SLE=2539 SRE=2726"
"51","7.412370700","172.20.40.110","151.101.66.187","TLSv1.3","2777","Application Data"
"52","7.412633400","172.20.40.110","151.101.66.187","TLSv1.3","2780","Application Data"
"53","7.412778000","172.20.40.110","151.101.66.187","TLSv1.3","2774","Application Data"
"54","7.412910900","172.20.40.110","151.101.66.187","TLSv1.3","2771","Application Data"
"55","7.422486700","151.101.66.187","172.20.40.110","TCP","60","443  >  57039 [ACK] Seq=2726 Ack=26769 Win=121344 Len=0"
"56","7.424101700","151.101.66.187","172.20.40.110","TLSv1.3","130","Application Data"
"57","7.429402400","151.101.66.187","172.20.40.110","TCP","60","443  >  57039 [ACK] Seq=2802 Ack=29495 Win=118784 Len=0"
"58","7.429402400","151.101.66.187","172.20.40.110","TCP","60","443  >  57039 [ACK] Seq=2802 Ack=32215 Win=116224 Len=0"
"59","7.429402400","151.101.66.187","172.20.40.110","TCP","60","443  >  57039 [ACK] Seq=2802 Ack=34932 Win=113664 Len=0"
"60","7.431696500","151.101.66.187","172.20.40.110","TLSv1.3","206","Application Data, Application Data"
"61","7.431767400","172.20.40.110","151.101.66.187","TCP","54","57039  >  443 [ACK] Seq=34932 Ack=2954 Win=66048 Len=0"
"62","7.432775400","151.101.66.187","172.20.40.110","TLSv1.3","173","Application Data"
"63","7.432837200","172.20.40.110","151.101.66.187","TCP","54","57039  >  443 [ACK] Seq=34932 Ack=3073 Win=66048 Len=0"
"64","7.790499300","172.20.40.110","151.101.66.187","TLSv1.3","2872","Application Data"
"65","7.800410900","151.101.66.187","172.20.40.110","TCP","60","443  >  57039 [ACK] Seq=3073 Ack=37750 Win=111104 Len=0"
"66","7.802904200","172.20.40.110","151.101.66.187","TLSv1.3","2872","Application Data"
"67","7.805522000","151.101.66.187","172.20.40.110","TLSv1.3","292","Application Data"
"68","7.812123500","151.101.66.187","172.20.40.110","TCP","60","443  >  57039 [ACK] Seq=3311 Ack=40568 Win=108544 Len=0"
"69","7.822691700","151.101.66.187","172.20.40.110","TLSv1.3","131","Application Data"
"70","7.822785800","172.20.40.110","151.101.66.187","TCP","54","57039  >  443 [ACK] Seq=40568 Ack=3388 Win=65792 Len=0"
"71","7.900617300","172.20.40.110","151.101.66.187","TLSv1.3","2886","Application Data"
"72","7.910799800","151.101.66.187","172.20.40.110","TCP","60","443  >  57039 [ACK] Seq=3388 Ack=43400 Win=105984 Len=0"
"73","7.917204400","151.101.66.187","172.20.40.110","TLSv1.3","130","Application Data"
"74","7.948364900","151.101.66.187","172.20.40.110","TCP","130","[TCP Retransmission] 443  >  57039 [PSH, ACK] Seq=3388 Ack=43400 Win=105984 Len=76"
"75","7.948426900","172.20.40.110","151.101.66.187","TCP","66","57039  >  443 [ACK] Seq=43400 Ack=3464 Win=65536 Len=0 SLE=3388 SRE=3464"
"76","12.798432800","172.20.40.110","151.101.66.187","TLSv1.3","2910","Application Data"
"77","12.800055100","172.20.40.110","151.101.66.187","TLSv1.3","2895","Application Data"
"78","12.802321300","172.20.40.110","151.101.66.187","TLSv1.3","2901","Application Data"
"79","12.802756900","172.20.40.110","151.101.66.187","TLSv1.3","2896","Application Data"
"80","12.807764700","151.101.66.187","172.20.40.110","TCP","60","443  >  57039 [ACK] Seq=3464 Ack=46256 Win=103424 Len=0"
"81","12.810157600","151.101.66.187","172.20.40.110","TCP","60","443  >  57039 [ACK] Seq=3464 Ack=49097 Win=101888 Len=0"
"82","12.814880600","151.101.66.187","172.20.40.110","TLSv1.3","241","Application Data"
"83","12.814880600","151.101.66.187","172.20.40.110","TLSv1.3","104","Application Data"
"84","12.814880600","151.101.66.187","172.20.40.110","TCP","60","443  >  57039 [ACK] Seq=3701 Ack=51944 Win=101888 Len=0"
"85","12.814880600","151.101.66.187","172.20.40.110","TCP","60","443  >  57039 [ACK] Seq=3701 Ack=54786 Win=99328 Len=0"
"86","12.815010200","172.20.40.110","151.101.66.187","TCP","54","57039  >  443 [ACK] Seq=54786 Ack=3701 Win=65280 Len=0"
"87","12.820235900","151.101.66.187","172.20.40.110","TLSv1.3","130","Application Data"
"88","12.820235900","151.101.66.187","172.20.40.110","TLSv1.3","130","Application Data"
"89","12.820364000","172.20.40.110","151.101.66.187","TCP","54","57039  >  443 [ACK] Seq=54786 Ack=3853 Win=65280 Len=0"
"90","12.885020000","172.20.40.110","151.101.66.187","TLSv1.3","2895","Application Data"
"91","12.896362900","151.101.66.187","172.20.40.110","TCP","60","443  >  57039 [ACK] Seq=3853 Ack=57627 Win=101888 Len=0"
"92","12.902486800","151.101.66.187","172.20.40.110","TLSv1.3","130","Application Data"
"93","12.934269200","151.101.66.187","172.20.40.110","TCP","130","[TCP Retransmission] 443  >  57039 [PSH, ACK] Seq=3853 Ack=57627 Win=104448 Len=76"
"94","12.934326800","172.20.40.110","151.101.66.187","TCP","66","57039  >  443 [ACK] Seq=57627 Ack=3929 Win=65024 Len=0 SLE=3853 SRE=3929"
"95","12.961765100","172.20.40.110","151.101.66.187","TLSv1.3","2909","Application Data"
"96","12.973805500","151.101.66.187","172.20.40.110","TCP","60","443  >  57039 [ACK] Seq=3929 Ack=60482 Win=101888 Len=0"
"97","12.975959400","151.101.66.187","172.20.40.110","TLSv1.3","125","Application Data"
"98","13.007875700","151.101.66.187","172.20.40.110","TCP","125","[TCP Retransmission] 443  >  57039 [PSH, ACK] Seq=3929 Ack=60482 Win=104448 Len=71"
"99","13.007927300","172.20.40.110","151.101.66.187","TCP","66","57039  >  443 [ACK] Seq=60482 Ack=4000 Win=65024 Len=0 SLE=3929 SRE=4000"
"100","13.028865400","172.20.40.110","151.101.66.187","TLSv1.3","2892","Application Data"
"101","13.045377900","172.20.40.110","151.101.66.187","TLSv1.3","2909","Application Data"
"102","13.053450200","151.101.66.187","172.20.40.110","TCP","60","443  >  57039 [ACK] Seq=4000 Ack=63320 Win=101888 Len=0"
"103","13.053450200","151.101.66.187","172.20.40.110","TLSv1.3","125","Application Data"
"104","13.055570100","151.101.66.187","172.20.40.110","TCP","60","443  >  57039 [ACK] Seq=4071 Ack=66175 Win=101888 Len=0"
"105","13.062180500","151.101.66.187","172.20.40.110","TLSv1.3","130","Application Data"
"106","13.062269200","172.20.40.110","151.101.66.187","TCP","54","57039  >  443 [ACK] Seq=66175 Ack=4147 Win=65024 Len=0"
"107","13.356146000","172.20.40.110","151.101.66.187","TLSv1.3","2903","Application Data"
"108","13.356415600","172.20.40.110","151.101.66.187","TLSv1.3","2898","Application Data"
"109","13.356598400","172.20.40.110","151.101.66.187","TLSv1.3","2895","Application Data"
"110","13.356768300","172.20.40.110","151.101.66.187","TLSv1.3","2898","Application Data"
"111","13.356958000","172.20.40.110","151.101.66.187","TLSv1.3","2896","Application Data"
"112","13.357153200","172.20.40.110","151.101.66.187","TLSv1.3","2897","Application Data"
"113","13.357359400","172.20.40.110","151.101.66.187","TLSv1.3","2894","Application Data"
"114","13.387538400","172.20.40.110","151.101.66.187","TCP","1434","[TCP Retransmission] 57039  >  443 [PSH, ACK] Seq=84698 Ack=4147 Win=65024 Len=1380"
"115","13.479868900","151.101.66.187","172.20.40.110","TCP","60","443  >  57039 [ACK] Seq=4147 Ack=69024 Win=101888 Len=0"
"116","13.479868900","151.101.66.187","172.20.40.110","TCP","60","443  >  57039 [ACK] Seq=4147 Ack=71868 Win=99328 Len=0"
"117","13.495790700","151.101.66.187","172.20.40.110","TLSv1.3","130","[TCP Previous segment not captured] , Application Data"
"118","13.495968300","172.20.40.110","151.101.66.187","TCP","66","[TCP Dup ACK 106#1] 57039  >  443 [ACK] Seq=86078 Ack=4147 Win=65024 Len=0 SLE=4814 SRE=4890"
"119","13.527594800","151.101.66.187","172.20.40.110","TCP","60","443  >  57039 [ACK] Seq=4890 Ack=86078 Win=102400 Len=0"
"120","13.527594800","151.101.66.187","172.20.40.110","TCP","66","[TCP Dup ACK 119#1] 443  >  57039 [ACK] Seq=4890 Ack=86078 Win=102400 Len=0 SLE=84698 SRE=86078"
"121","13.527594800","151.101.66.187","172.20.40.110","TLSv1.3","124","Application Data"
"122","13.527793700","172.20.40.110","151.101.66.187","TCP","66","[TCP Dup ACK 106#2] 57039  >  443 [ACK] Seq=86078 Ack=4147 Win=65024 Len=0 SLE=4814 SRE=4960"
"123","13.535073600","151.101.66.187","172.20.40.110","TCP","124","[TCP Fast Retransmission] 443  >  57039 [PSH, ACK] Seq=4890 Ack=86078 Win=104448 Len=70"
"124","13.535368700","172.20.40.110","151.101.66.187","TCP","74","[TCP Dup ACK 106#3] 57039  >  443 [ACK] Seq=86078 Ack=4147 Win=65024 Len=0 SLE=4890 SRE=4960 SLE=4814 SRE=4960"
"125","13.546491200","151.101.66.187","172.20.40.110","TCP","721","[TCP Fast Retransmission] 443  >  57039 [PSH, ACK] Seq=4147 Ack=86078 Win=104448 Len=667"
"126","13.546954800","172.20.40.110","151.101.66.187","TCP","54","57039  >  443 [ACK] Seq=86078 Ack=4960 Win=66048 Len=0"
"127","13.563374300","172.20.40.110","151.101.66.187","TLSv1.3","2896","Application Data"
"128","13.563929400","172.20.40.110","151.101.66.187","TLSv1.3","2882","Application Data"
"129","13.639973900","151.101.66.187","172.20.40.110","TCP","60","443  >  57039 [ACK] Seq=4960 Ack=88920 Win=101888 Len=0"
"130","13.639973900","151.101.66.187","172.20.40.110","TCP","60","443  >  57039 [ACK] Seq=4960 Ack=90300 Win=103424 Len=0"
"131","13.639973900","151.101.66.187","172.20.40.110","TLSv1.3","130","Application Data"
"132","13.642956800","151.101.66.187","172.20.40.110","TCP","60","443  >  57039 [ACK] Seq=5036 Ack=91748 Win=103424 Len=0"
"133","13.642956800","151.101.66.187","172.20.40.110","TLSv1.3","130","Application Data"
"134","13.643139400","172.20.40.110","151.101.66.187","TCP","54","57039  >  443 [ACK] Seq=91748 Ack=5112 Win=66048 Len=0"
"135","17.185599400","172.20.40.110","151.101.66.187","TLSv1.3","2902","Application Data"
"136","17.196617600","151.101.66.187","172.20.40.110","TCP","60","443  >  57039 [ACK] Seq=5112 Ack=94596 Win=102400 Len=0"
"137","17.200058500","151.101.66.187","172.20.40.110","TLSv1.3","240","Application Data"
"138","17.201163000","172.20.40.110","151.101.66.187","TLSv1.3","2897","Application Data"
"139","17.205181100","172.20.40.110","151.101.66.187","TLSv1.3","2896","Application Data"
"140","17.211659300","151.101.66.187","172.20.40.110","TCP","60","443  >  57039 [ACK] Seq=5298 Ack=97439 Win=102400 Len=0"
"141","17.216844400","151.101.66.187","172.20.40.110","TLSv1.3","130","Application Data"
"142","17.216844400","151.101.66.187","172.20.40.110","TCP","60","443  >  57039 [ACK] Seq=5374 Ack=100281 Win=103424 Len=0"
"143","17.219507400","151.101.66.187","172.20.40.110","TLSv1.3","131","Application Data"
"144","17.219571200","172.20.40.110","151.101.66.187","TCP","54","57039  >  443 [ACK] Seq=100281 Ack=5451 Win=65536 Len=0"
"145","17.378875400","172.20.40.110","151.101.66.187","TLSv1.3","2879","Application Data"
"146","17.391416100","151.101.66.187","172.20.40.110","TCP","60","443  >  57039 [ACK] Seq=5451 Ack=103106 Win=101888 Len=0"
"147","17.393600300","151.101.66.187","172.20.40.110","TLSv1.3","240","Application Data"
"148","17.435953000","172.20.40.110","151.101.66.187","TCP","54","57039  >  443 [ACK] Seq=103106 Ack=5637 Win=65536 Len=0"
"149","17.446499500","151.101.66.187","172.20.40.110","TCP","240","[TCP Spurious Retransmission] 443  >  57039 [PSH, ACK] Seq=5451 Ack=103106 Win=104448 Len=186"
"150","17.446562800","172.20.40.110","151.101.66.187","TCP","66","[TCP Dup ACK 148#1] 57039  >  443 [ACK] Seq=103106 Ack=5637 Win=65536 Len=0 SLE=5451 SRE=5637"
"151","19.405832800","172.20.40.110","151.101.66.187","TLSv1.3","2895","Application Data"
"152","19.409086800","172.20.40.110","151.101.66.187","TLSv1.3","2893","Application Data"
"153","19.410819800","172.20.40.110","151.101.66.187","TLSv1.3","2898","Application Data"
"154","19.419266700","151.101.66.187","172.20.40.110","TCP","60","443  >  57039 [ACK] Seq=5637 Ack=105947 Win=101888 Len=0"
"155","19.419266700","151.101.66.187","172.20.40.110","TCP","60","443  >  57039 [ACK] Seq=5637 Ack=108786 Win=101888 Len=0"
"156","19.421670100","151.101.66.187","172.20.40.110","TLSv1.3","451","Application Data"
"157","19.421670100","151.101.66.187","172.20.40.110","TCP","60","443  >  57039 [ACK] Seq=6034 Ack=111630 Win=101888 Len=0"
"158","19.421670100","151.101.66.187","172.20.40.110","TLSv1.3","129","Application Data"
"159","19.421780200","172.20.40.110","151.101.66.187","TCP","54","57039  >  443 [ACK] Seq=111630 Ack=6109 Win=65024 Len=0"
"160","19.424702800","151.101.66.187","172.20.40.110","TLSv1.3","131","Application Data"
"161","19.474419000","172.20.40.110","151.101.66.187","TCP","54","57039  >  443 [ACK] Seq=111630 Ack=6186 Win=64768 Len=0"
"162","19.475582600","151.101.66.187","172.20.40.110","TCP","131","[TCP Spurious Retransmission] 443  >  57039 [PSH, ACK] Seq=6109 Ack=111630 Win=104448 Len=77"
"163","19.475659700","172.20.40.110","151.101.66.187","TCP","66","[TCP Dup ACK 161#1] 57039  >  443 [ACK] Seq=111630 Ack=6186 Win=64768 Len=0 SLE=6109 SRE=6186"
"164","20.638499200","172.20.40.110","151.101.66.187","TLSv1.3","2910","Application Data"
"165","20.649464300","151.101.66.187","172.20.40.110","TCP","60","443  >  57039 [ACK] Seq=6186 Ack=114486 Win=101888 Len=0"
"166","20.652773100","151.101.66.187","172.20.40.110","TLSv1.3","241","Application Data"
"167","20.673372100","172.20.40.110","151.101.66.187","TLSv1.3","2911","Application Data"
"168","20.683757800","151.101.66.187","172.20.40.110","TCP","60","443  >  57039 [ACK] Seq=6373 Ack=117343 Win=101888 Len=0"
"169","20.688322200","151.101.66.187","172.20.40.110","TLSv1.3","131","Application Data"
"170","20.732272100","172.20.40.110","151.101.66.187","TLSv1.3","2910","Application Data"
"171","20.735994000","151.101.66.187","172.20.40.110","TCP","131","[TCP Spurious Retransmission] 443  >  57039 [PSH, ACK] Seq=6373 Ack=117343 Win=104448 Len=77"
"172","20.736048700","172.20.40.110","151.101.66.187","TCP","66","[TCP Dup ACK 170#1] 57039  >  443 [ACK] Seq=120199 Ack=6450 Win=66048 Len=0 SLE=6373 SRE=6450"
"173","20.747021800","151.101.66.187","172.20.40.110","TCP","60","443  >  57039 [ACK] Seq=6450 Ack=120199 Win=101888 Len=0"
"174","20.749546800","151.101.66.187","172.20.40.110","TLSv1.3","130","Application Data"
"175","20.791061700","172.20.40.110","151.101.66.187","TCP","54","57039  >  443 [ACK] Seq=120199 Ack=6526 Win=66048 Len=0"
"176","21.424346600","172.20.40.110","151.101.66.187","TLSv1.3","2896","Application Data"
"177","21.432892100","151.101.66.187","172.20.40.110","TCP","60","443  >  57039 [ACK] Seq=6526 Ack=123041 Win=101888 Len=0"
"178","21.438330800","151.101.66.187","172.20.40.110","TLSv1.3","240","Application Data"
"179","21.488743500","172.20.40.110","151.101.66.187","TCP","54","57039  >  443 [ACK] Seq=123041 Ack=6712 Win=65792 Len=0"
"180","21.492343600","151.101.66.187","172.20.40.110","TCP","240","[TCP Spurious Retransmission] 443  >  57039 [PSH, ACK] Seq=6526 Ack=123041 Win=104448 Len=186"
"181","21.492404700","172.20.40.110","151.101.66.187","TCP","66","[TCP Dup ACK 179#1] 57039  >  443 [ACK] Seq=123041 Ack=6712 Win=65792 Len=0 SLE=6526 SRE=6712"
"182","21.519035100","172.20.40.110","151.101.66.187","TLSv1.3","2899","Application Data"
"183","21.528734100","151.101.66.187","172.20.40.110","TCP","60","443  >  57039 [ACK] Seq=6712 Ack=125886 Win=101888 Len=0"
"184","21.531824900","151.101.66.187","172.20.40.110","TLSv1.3","130","Application Data"
"185","21.541318600","172.20.40.110","151.101.66.187","TLSv1.3","2901","Application Data"
"186","21.550850200","151.101.66.187","172.20.40.110","TCP","60","443  >  57039 [ACK] Seq=6788 Ack=128733 Win=101888 Len=0"
"187","21.554047100","151.101.66.187","172.20.40.110","TLSv1.3","130","Application Data"
"188","21.601255800","172.20.40.110","151.101.66.187","TCP","54","57039  >  443 [ACK] Seq=128733 Ack=6864 Win=65536 Len=0"
"189","21.609747700","151.101.66.187","172.20.40.110","TCP","130","[TCP Spurious Retransmission] 443  >  57039 [PSH, ACK] Seq=6788 Ack=128733 Win=104448 Len=76"
"190","21.609820400","172.20.40.110","151.101.66.187","TCP","66","[TCP Dup ACK 188#1] 57039  >  443 [ACK] Seq=128733 Ack=6864 Win=65536 Len=0 SLE=6788 SRE=6864"
"191","23.351134900","172.20.40.110","151.101.66.187","TCP","66","51833  >  443 [SYN] Seq=0 Win=64240 Len=0 MSS=1460 WS=256 SACK_PERM"
"192","23.362253900","151.101.66.187","172.20.40.110","TCP","66","443  >  51833 [SYN, ACK] Seq=0 Ack=1 Win=65535 Len=0 MSS=1380 SACK_PERM WS=512"
"193","23.362597600","172.20.40.110","151.101.66.187","TCP","54","51833  >  443 [ACK] Seq=1 Ack=1 Win=66048 Len=0"
"194","23.365210500","172.20.40.110","151.101.66.187","TLSv1.3","2034","Client Hello (SNI=r2d2.target.com)"
"195","23.375513800","151.101.66.187","172.20.40.110","TCP","60","443  >  51833 [ACK] Seq=1 Ack=1981 Win=144384 Len=0"
"196","23.376632100","151.101.66.187","172.20.40.110","TLSv1.3","1434","Server Hello, Change Cipher Spec, Application Data, Application Data"
"197","23.376632100","151.101.66.187","172.20.40.110","TLSv1.3","215","Application Data"
"198","23.376742700","172.20.40.110","151.101.66.187","TCP","54","51833  >  443 [ACK] Seq=1981 Ack=1542 Win=66048 Len=0"
"199","23.379657200","172.20.40.110","151.101.66.187","TLSv1.3","118","Change Cipher Spec, Application Data"
"200","23.380975000","172.20.40.110","151.101.66.187","TLSv1.3","146","Application Data"
"201","23.381760700","172.20.40.110","151.101.66.187","TLSv1.3","597","Application Data"
"202","23.388379300","151.101.66.187","172.20.40.110","TCP","60","443  >  51833 [ACK] Seq=1542 Ack=2045 Win=144384 Len=0"
"203","23.388379300","151.101.66.187","172.20.40.110","TCP","60","443  >  51833 [ACK] Seq=1542 Ack=2137 Win=144384 Len=0"
"204","23.388379300","151.101.66.187","172.20.40.110","TLSv1.3","119","Application Data"
"205","23.388745500","172.20.40.110","151.101.66.187","TLSv1.3","85","Application Data"
"206","23.389577700","151.101.66.187","172.20.40.110","TCP","60","443  >  51833 [ACK] Seq=1607 Ack=2680 Win=143872 Len=0"
"207","23.396896100","151.101.66.187","172.20.40.110","TCP","60","443  >  51833 [ACK] Seq=1607 Ack=2711 Win=143872 Len=0"
"208","23.449176700","151.101.66.187","172.20.40.110","TLSv1.3","522","Application Data"
"209","23.449176700","151.101.66.187","172.20.40.110","TLSv1.3","87","Application Data"
"210","23.449326400","172.20.40.110","151.101.66.187","TCP","54","51833  >  443 [ACK] Seq=2711 Ack=2108 Win=65536 Len=0"
"211","23.451966400","151.101.66.187","172.20.40.110","TLSv1.3","918","Application Data"
"212","23.451966400","151.101.66.187","172.20.40.110","TLSv1.3","87","Application Data"
"213","23.451966400","151.101.66.187","172.20.40.110","TLSv1.3","86","Application Data"
"214","23.451966400","151.101.66.187","172.20.40.110","TLSv1.3","271","Application Data"
"215","23.451966400","151.101.66.187","172.20.40.110","TLSv1.3","85","Application Data"
"216","23.452103100","172.20.40.110","151.101.66.187","TCP","54","51833  >  443 [ACK] Seq=2711 Ack=3285 Win=66048 Len=0"
"217","26.094347400","172.20.40.110","151.101.66.187","TLSv1.3","2975","Application Data"
"218","26.107511700","151.101.66.187","172.20.40.110","TCP","60","443  >  57039 [ACK] Seq=6864 Ack=131654 Win=101888 Len=0"
"219","26.948028800","151.101.66.187","172.20.40.110","TLSv1.3","366","Application Data"
"220","26.948028800","151.101.66.187","172.20.40.110","TLSv1.3","9714","Application Data, Application Data, Application Data, Application Data, Application Data, Application Data"
"221","26.948166600","172.20.40.110","151.101.66.187","TCP","54","57039  >  443 [ACK] Seq=131654 Ack=16836 Win=66048 Len=0"
"222","26.950321900","151.101.66.187","172.20.40.110","TLSv1.3","1434","Application Data"
"223","26.952900000","151.101.66.187","172.20.40.110","TLSv1.3","1434","Application Data"
"224","26.952900000","151.101.66.187","172.20.40.110","TLSv1.3","11094","Application Data, Application Data, Application Data, Application Data, Application Data, Application Data, Application Data, Application Data"
"225","26.953051000","172.20.40.110","151.101.66.187","TCP","54","57039  >  443 [ACK] Seq=131654 Ack=30636 Win=66048 Len=0"
"226","26.953216200","172.20.40.110","151.101.66.187","TLSv1.3","89","Application Data"
"227","26.954313300","151.101.66.187","172.20.40.110","TLSv1.3","5574","Application Data, Application Data, Application Data, Application Data"
"228","26.954419400","172.20.40.110","151.101.66.187","TCP","54","57039  >  443 [ACK] Seq=131689 Ack=36156 Win=66048 Len=0"
"229","26.958696600","151.101.66.187","172.20.40.110","TLSv1.3","8334","Application Data, Application Data, Application Data, Application Data, Application Data, Application Data"
"230","26.958843800","172.20.40.110","151.101.66.187","TCP","54","57039  >  443 [ACK] Seq=131689 Ack=44436 Win=66048 Len=0"
"231","26.960374800","151.101.66.187","172.20.40.110","TLSv1.3","5574","Application Data, Application Data, Application Data, Application Data"
"232","26.960545700","172.20.40.110","151.101.66.187","TCP","54","57039  >  443 [ACK] Seq=131689 Ack=49956 Win=66048 Len=0"
"233","26.964877700","151.101.66.187","172.20.40.110","TLSv1.3","1434","Application Data"
"234","26.964877700","151.101.66.187","172.20.40.110","TLSv1.3","1434","Application Data"
"235","26.964877700","151.101.66.187","172.20.40.110","TLSv1.3","1434","Application Data"
"236","26.964877700","151.101.66.187","172.20.40.110","TLSv1.3","1434","Application Data"
"237","26.964877700","151.101.66.187","172.20.40.110","TLSv1.3","1007","Application Data, Application Data"
"238","26.964877700","151.101.66.187","172.20.40.110","TCP","60","443  >  57039 [ACK] Seq=56429 Ack=131689 Win=104448 Len=0"
"239","26.965028700","172.20.40.110","151.101.66.187","TCP","54","57039  >  443 [ACK] Seq=131689 Ack=56429 Win=66048 Len=0"
"240","27.405295100","172.20.40.110","151.101.66.187","TLSv1.3","2910","Application Data"
"241","27.406551200","172.20.40.110","151.101.66.187","TLSv1.3","2912","Application Data"
"242","27.411559500","172.20.40.110","151.101.66.187","TLSv1.3","2910","Application Data"
"243","27.411904400","172.20.40.110","151.101.66.187","TLSv1.3","2908","Application Data"
"244","27.412803000","172.20.40.110","151.101.66.187","TLSv1.3","2916","Application Data"
"245","27.425272500","172.20.40.110","151.101.66.187","TLSv1.3","2861","Application Data"
"246","27.431925200","151.101.66.187","172.20.40.110","TCP","60","443  >  57039 [ACK] Seq=56429 Ack=134545 Win=101888 Len=0"
"247","27.431925200","151.101.66.187","172.20.40.110","TCP","60","443  >  57039 [ACK] Seq=56429 Ack=137403 Win=99328 Len=0"
"248","27.434327200","151.101.66.187","172.20.40.110","TLSv1.3","447","Application Data"
"249","27.434327200","151.101.66.187","172.20.40.110","TLSv1.3","104","Application Data"
"250","27.434635100","172.20.40.110","151.101.66.187","TCP","54","57039  >  443 [ACK] Seq=148782 Ack=56872 Win=65792 Len=0"
"251","27.437470500","151.101.66.187","172.20.40.110","TCP","60","443  >  57039 [ACK] Seq=56872 Ack=140259 Win=103424 Len=0"
"252","27.437470500","151.101.66.187","172.20.40.110","TCP","60","443  >  57039 [ACK] Seq=56872 Ack=145975 Win=102400 Len=0"
"253","27.437470500","151.101.66.187","172.20.40.110","TCP","60","443  >  57039 [ACK] Seq=56872 Ack=148782 Win=99840 Len=0"
"254","27.440596400","151.101.66.187","172.20.40.110","TLSv1.3","130","Application Data"
"255","27.441735000","151.101.66.187","172.20.40.110","TLSv1.3","174","Application Data"
"256","27.441735000","151.101.66.187","172.20.40.110","TLSv1.3","310","Application Data"
"257","27.441807800","172.20.40.110","151.101.66.187","TCP","54","57039  >  443 [ACK] Seq=148782 Ack=57324 Win=65280 Len=0"
"258","27.442744200","151.101.66.187","172.20.40.110","TLSv1.3","130","Application Data"
"259","27.442809800","172.20.40.110","151.101.66.187","TCP","54","57039  >  443 [ACK] Seq=148782 Ack=57400 Win=65024 Len=0"
"260","27.475057600","172.20.40.110","151.101.66.187","TLSv1.3","2910","Application Data"
"261","27.487319500","151.101.66.187","172.20.40.110","TCP","60","443  >  57039 [ACK] Seq=57400 Ack=151638 Win=110080 Len=0"
"262","27.492195800","151.101.66.187","172.20.40.110","TLSv1.3","124","Application Data"
"263","27.536044200","172.20.40.110","151.101.66.187","TCP","54","57039  >  443 [ACK] Seq=151638 Ack=57470 Win=65024 Len=0"
"264","27.542148000","151.101.66.187","172.20.40.110","TCP","124","[TCP Spurious Retransmission] 443  >  57039 [PSH, ACK] Seq=57400 Ack=151638 Win=110080 Len=70"
"265","27.542254300","172.20.40.110","151.101.66.187","TCP","66","[TCP Dup ACK 263#1] 57039  >  443 [ACK] Seq=151638 Ack=57470 Win=65024 Len=0 SLE=57400 SRE=57470"
"266","28.562221400","172.20.40.110","151.101.66.187","TLSv1.3","248","Application Data"
"267","28.569091300","151.101.66.187","172.20.40.110","TCP","60","443  >  51833 [ACK] Seq=3285 Ack=2905 Win=143872 Len=0"
"268","28.570971200","172.20.40.110","151.101.66.187","TLSv1.3","2489","Application Data"
"269","28.581041300","151.101.66.187","172.20.40.110","TCP","60","443  >  57039 [ACK] Seq=57470 Ack=154073 Win=115200 Len=0"
"270","28.656110400","151.101.66.187","172.20.40.110","TLSv1.3","451","Application Data"
"271","28.656110400","151.101.66.187","172.20.40.110","TLSv1.3","353","Application Data"
"272","28.656189300","172.20.40.110","151.101.66.187","TCP","54","57039  >  443 [ACK] Seq=154073 Ack=58166 Win=66048 Len=0"
"273","28.665818400","151.101.66.187","172.20.40.110","TLSv1.3","218","Application Data"
"274","28.672339800","151.101.66.187","172.20.40.110","TLSv1.3","86","Application Data"
"275","28.672432600","172.20.40.110","151.101.66.187","TCP","54","51833  >  443 [ACK] Seq=2905 Ack=3481 Win=65792 Len=0"
"276","28.684913400","172.20.40.110","151.101.66.187","TLSv1.3","89","Application Data"
"277","28.690041000","151.101.66.187","172.20.40.110","TLSv1.3","87","Application Data"
"278","28.693817500","151.101.66.187","172.20.40.110","TCP","60","443  >  51833 [ACK] Seq=3514 Ack=2940 Win=143872 Len=0"
"279","28.702337700","151.101.66.187","172.20.40.110","TLSv1.3","87","Application Data"
"280","28.702408100","172.20.40.110","151.101.66.187","TCP","54","51833  >  443 [ACK] Seq=2940 Ack=3547 Win=65792 Len=0"
"281","28.706358400","151.101.66.187","172.20.40.110","TLSv1.3","87","Application Data"
"282","28.710791800","151.101.66.187","172.20.40.110","TLSv1.3","86","Application Data"
"283","28.710893900","172.20.40.110","151.101.66.187","TCP","54","51833  >  443 [ACK] Seq=2940 Ack=3612 Win=65792 Len=0"
"284","28.722461800","151.101.66.187","172.20.40.110","TLSv1.3","86","Application Data"
"285","28.722461800","151.101.66.187","172.20.40.110","TLSv1.3","86","Application Data"
"286","28.722461800","151.101.66.187","172.20.40.110","TLSv1.3","86","Application Data"
"287","28.722461800","151.101.66.187","172.20.40.110","TLSv1.3","913","Application Data"
"288","28.722544700","172.20.40.110","151.101.66.187","TCP","54","51833  >  443 [ACK] Seq=2940 Ack=4567 Win=64768 Len=0"
"289","28.723321200","151.101.66.187","172.20.40.110","TLSv1.3","86","Application Data"
"290","28.724476900","151.101.66.187","172.20.40.110","TLSv1.3","100","Application Data"
"291","28.724476900","151.101.66.187","172.20.40.110","TLSv1.3","88","Application Data"
"292","28.724476900","151.101.66.187","172.20.40.110","TLSv1.3","251","Application Data"
"293","28.724547500","172.20.40.110","151.101.66.187","TCP","54","51833  >  443 [ACK] Seq=2940 Ack=4876 Win=66048 Len=0"
"294","28.725464300","151.101.66.187","172.20.40.110","TLSv1.3","85","Application Data"
"295","28.759930900","151.101.66.187","172.20.40.110","TCP","85","[TCP Retransmission] 443  >  51833 [PSH, ACK] Seq=4876 Ack=2940 Win=143872 Len=31"
"296","28.759992700","172.20.40.110","151.101.66.187","TCP","66","51833  >  443 [ACK] Seq=2940 Ack=4907 Win=66048 Len=0 SLE=4876 SRE=4907"
"297","29.012355500","172.20.40.110","151.101.66.187","TLSv1.3","2914","Application Data"
"298","29.014245900","172.20.40.110","151.101.66.187","TLSv1.3","2910","Application Data"
"299","29.021293500","151.101.66.187","172.20.40.110","TCP","60","443  >  57039 [ACK] Seq=58166 Ack=156933 Win=120832 Len=0"
"300","29.023683800","151.101.66.187","172.20.40.110","TCP","60","443  >  57039 [ACK] Seq=58166 Ack=159789 Win=126464 Len=0"
"301","29.025915400","151.101.66.187","172.20.40.110","TLSv1.3","422","Application Data"
"302","29.029161000","151.101.66.187","172.20.40.110","TLSv1.3","131","Application Data"
"303","29.029239100","172.20.40.110","151.101.66.187","TCP","54","57039  >  443 [ACK] Seq=159789 Ack=58611 Win=65792 Len=0"
"304","29.864970100","172.20.40.110","151.101.66.187","TLSv1.3","2489","Application Data"
"305","29.876372700","151.101.66.187","172.20.40.110","TCP","60","443  >  57039 [ACK] Seq=58611 Ack=162224 Win=131584 Len=0"
"306","29.961332300","151.101.66.187","172.20.40.110","TLSv1.3","227","Application Data"
"307","29.961332300","151.101.66.187","172.20.40.110","TLSv1.3","353","Application Data"
"308","29.961405900","172.20.40.110","151.101.66.187","TCP","54","57039  >  443 [ACK] Seq=162224 Ack=59083 Win=65280 Len=0"
"309","30.172526400","172.20.40.110","151.101.66.187","TLSv1.3","2918","Application Data"
"310","30.172739000","172.20.40.110","151.101.66.187","TLSv1.3","2920","Application Data"
"311","30.172871500","172.20.40.110","151.101.66.187","TLSv1.3","2914","Application Data"
"312","30.172990400","172.20.40.110","151.101.66.187","TLSv1.3","2916","Application Data"
"313","30.173608900","172.20.40.110","151.101.66.187","TLSv1.3","2914","Application Data"
"314","30.174131000","172.20.40.110","151.101.66.187","TLSv1.3","2912","Application Data"
"315","30.174337600","172.20.40.110","151.101.66.187","TLSv1.3","2917","Application Data"
"316","30.174524700","172.20.40.110","151.101.66.187","TLSv1.3","2914","Application Data"
"317","30.210681800","172.20.40.110","151.101.66.187","TCP","1434","[TCP Retransmission] 57039  >  443 [PSH, ACK] Seq=183737 Ack=59083 Win=65280 Len=1380"
"318","30.216867000","172.20.40.110","151.101.66.187","TLSv1.3","2914","Application Data"
"319","30.222207700","151.101.66.187","172.20.40.110","TCP","60","443  >  57039 [ACK] Seq=59083 Ack=165088 Win=137216 Len=0"
"320","30.222207700","151.101.66.187","172.20.40.110","TCP","60","443  >  57039 [ACK] Seq=59083 Ack=167954 Win=142848 Len=0"
"321","30.222207700","151.101.66.187","172.20.40.110","TCP","60","443  >  57039 [ACK] Seq=59083 Ack=170814 Win=148480 Len=0"
"322","30.222207700","151.101.66.187","172.20.40.110","TCP","60","443  >  57039 [ACK] Seq=59083 Ack=173676 Win=154624 Len=0"
"323","30.222207700","151.101.66.187","172.20.40.110","TCP","60","443  >  57039 [ACK] Seq=59083 Ack=176536 Win=160256 Len=0"
"324","30.223951100","151.101.66.187","172.20.40.110","TLSv1.3","217","Application Data"
"325","30.223951100","151.101.66.187","172.20.40.110","TLSv1.3","130","Application Data"
"326","30.223951100","151.101.66.187","172.20.40.110","TLSv1.3","104","Application Data"
"327","30.223951100","151.101.66.187","172.20.40.110","TCP","60","443  >  57039 [ACK] Seq=59372 Ack=179394 Win=165888 Len=0"
"328","30.223951100","151.101.66.187","172.20.40.110","TCP","60","443  >  57039 [ACK] Seq=59372 Ack=185117 Win=177664 Len=0"
"329","30.223951100","151.101.66.187","172.20.40.110","TCP","66","[TCP Dup ACK 328#1] 443  >  57039 [ACK] Seq=59372 Ack=185117 Win=177664 Len=0 SLE=183737 SRE=185117"
"330","30.224073200","172.20.40.110","151.101.66.187","TCP","54","57039  >  443 [ACK] Seq=187977 Ack=59372 Win=65024 Len=0"
"331","30.224930100","151.101.66.187","172.20.40.110","TLSv1.3","192","Application Data"
"332","30.225011600","172.20.40.110","151.101.66.187","TCP","54","57039  >  443 [ACK] Seq=187977 Ack=59510 Win=64768 Len=0"
"333","30.226285800","151.101.66.187","172.20.40.110","TCP","60","443  >  57039 [ACK] Seq=59510 Ack=187977 Win=183296 Len=0"
"334","30.226285800","151.101.66.187","172.20.40.110","TLSv1.3","130","Application Data"
"335","30.227411800","151.101.66.187","172.20.40.110","TLSv1.3","124","Application Data"
"336","30.227411800","151.101.66.187","172.20.40.110","TLSv1.3","131","Application Data"
"337","30.227506000","172.20.40.110","151.101.66.187","TCP","54","57039  >  443 [ACK] Seq=187977 Ack=59733 Win=66048 Len=0"
"338","30.229577100","151.101.66.187","172.20.40.110","TLSv1.3","148","Application Data"
"339","30.229648900","172.20.40.110","151.101.66.187","TCP","54","57039  >  443 [ACK] Seq=187977 Ack=59827 Win=66048 Len=0"
"340","33.203498700","172.20.40.110","151.101.66.187","TLSv1.3","254","Application Data"
"341","33.214684700","151.101.66.187","172.20.40.110","TCP","60","443  >  51833 [ACK] Seq=4907 Ack=3140 Win=143872 Len=0"
"342","33.267594600","151.101.66.187","172.20.40.110","TLSv1.3","1243","Application Data"
"343","33.267594600","151.101.66.187","172.20.40.110","TLSv1.3","85","Application Data"
"344","33.267723600","172.20.40.110","151.101.66.187","TCP","54","51833  >  443 [ACK] Seq=3140 Ack=6127 Win=64768 Len=0"
"345","35.846491800","172.20.40.110","151.101.66.187","TLSv1.3","250","Application Data"
"346","35.856673600","151.101.66.187","172.20.40.110","TCP","60","443  >  51833 [ACK] Seq=6127 Ack=3336 Win=143872 Len=0"
"347","35.916376500","151.101.66.187","172.20.40.110","TLSv1.3","205","Application Data"
"348","35.916376500","151.101.66.187","172.20.40.110","TLSv1.3","932","Application Data"
"349","35.916376500","151.101.66.187","172.20.40.110","TLSv1.3","120","Application Data, Application Data"
"350","35.916376500","151.101.66.187","172.20.40.110","TLSv1.3","124","Application Data, Application Data"
"351","35.916376500","151.101.66.187","172.20.40.110","TLSv1.3","86","Application Data"
"352","35.916376500","151.101.66.187","172.20.40.110","TLSv1.3","249","Application Data"
"353","35.916488400","172.20.40.110","151.101.66.187","TCP","54","51833  >  443 [ACK] Seq=3336 Ack=7519 Win=66048 Len=0"
"354","35.917747700","172.20.40.110","151.101.66.187","TLSv1.3","89","Application Data"
"355","35.924747300","151.101.66.187","172.20.40.110","TCP","60","443  >  51833 [ACK] Seq=7519 Ack=3371 Win=143872 Len=0"
"356","37.674299900","172.20.40.110","151.101.66.187","TLSv1.3","2681","Application Data"
"357","37.688495900","151.101.66.187","172.20.40.110","TCP","60","443  >  57039 [ACK] Seq=59827 Ack=190604 Win=188416 Len=0"
"358","37.743731100","151.101.66.187","172.20.40.110","TLSv1.3","494","Application Data"
"359","37.743731100","151.101.66.187","172.20.40.110","TLSv1.3","357","Application Data"
"360","37.743840700","172.20.40.110","151.101.66.187","TCP","54","57039  >  443 [ACK] Seq=190604 Ack=60570 Win=65280 Len=0"
"361","37.747961900","172.20.40.110","151.101.66.187","TLSv1.3","89","Application Data"
"362","37.748277600","172.20.40.110","151.101.66.187","TLSv1.3","247","Application Data"
"363","37.755395500","151.101.66.187","172.20.40.110","TCP","60","443  >  57039 [ACK] Seq=60570 Ack=190639 Win=188416 Len=0"
"364","37.757588400","151.101.66.187","172.20.40.110","TCP","60","443  >  51833 [ACK] Seq=7519 Ack=3564 Win=143872 Len=0"
"365","37.813991000","151.101.66.187","172.20.40.110","TLSv1.3","1238","Application Data"
"366","37.813991000","151.101.66.187","172.20.40.110","TLSv1.3","85","Application Data"
"367","37.814099800","172.20.40.110","151.101.66.187","TCP","54","51833  >  443 [ACK] Seq=3564 Ack=8734 Win=65024 Len=0"
"368","40.499731700","172.20.40.110","151.101.66.187","TLSv1.3","2934","Application Data"
"369","40.508358700","172.20.40.110","151.101.66.187","TLSv1.3","2928","Application Data"
"370","40.515743300","151.101.66.187","172.20.40.110","TCP","60","443  >  57039 [ACK] Seq=60570 Ack=193519 Win=194048 Len=0"
"371","40.517451200","151.101.66.187","172.20.40.110","TLSv1.3","246","Application Data"
"372","40.521925700","151.101.66.187","172.20.40.110","TCP","60","443  >  57039 [ACK] Seq=60762 Ack=196393 Win=199680 Len=0"
"373","40.522281400","172.20.40.110","151.101.66.187","TLSv1.3","2935","Application Data"
"374","40.522543400","172.20.40.110","151.101.66.187","TLSv1.3","2934","Application Data"
"375","40.522840400","172.20.40.110","151.101.66.187","TLSv1.3","2928","Application Data"
"376","40.524184900","151.101.66.187","172.20.40.110","TLSv1.3","131","Application Data"
"377","40.525566000","172.20.40.110","151.101.66.187","TLSv1.3","2931","Application Data"
"378","40.525870400","172.20.40.110","151.101.66.187","TLSv1.3","2928","Application Data"
"379","40.526082200","172.20.40.110","151.101.66.187","TLSv1.3","2934","Application Data"
"380","40.534770600","172.20.40.110","151.101.66.187","TLSv1.3","2927","Application Data"
"381","40.535034300","172.20.40.110","151.101.66.187","TLSv1.3","2928","Application Data"
"382","40.536268200","172.20.40.110","151.101.66.187","TLSv1.3","2925","Application Data"
"383","40.554044700","151.101.66.187","172.20.40.110","TCP","131","[TCP Spurious Retransmission] 443  >  57039 [PSH, ACK] Seq=60762 Ack=196393 Win=199680 Len=77"
"384","40.554116500","172.20.40.110","151.101.66.187","TCP","66","[TCP Dup ACK 377#1] 57039  >  443 [ACK] Seq=222277 Ack=60839 Win=65024 Len=0 SLE=60762 SRE=60839"
"385","40.555364900","151.101.66.187","172.20.40.110","TCP","60","443  >  57039 [ACK] Seq=60839 Ack=199274 Win=205824 Len=0"
"386","40.555364900","151.101.66.187","172.20.40.110","TCP","60","443  >  57039 [ACK] Seq=60839 Ack=202154 Win=211456 Len=0"
"387","40.555364900","151.101.66.187","172.20.40.110","TCP","60","443  >  57039 [ACK] Seq=60839 Ack=205028 Win=217088 Len=0"
"388","40.555364900","151.101.66.187","172.20.40.110","TCP","60","443  >  57039 [ACK] Seq=60839 Ack=207905 Win=222720 Len=0"
"389","40.555364900","151.101.66.187","172.20.40.110","TCP","60","443  >  57039 [ACK] Seq=60839 Ack=210779 Win=228864 Len=0"
"390","40.555364900","151.101.66.187","172.20.40.110","TCP","60","443  >  57039 [ACK] Seq=60839 Ack=213659 Win=234496 Len=0"
"391","40.555364900","151.101.66.187","172.20.40.110","TCP","60","443  >  57039 [ACK] Seq=60839 Ack=216532 Win=240128 Len=0"
"392","40.559258700","151.101.66.187","172.20.40.110","TCP","60","443  >  57039 [ACK] Seq=60839 Ack=219406 Win=245760 Len=0"
"393","40.559258700","151.101.66.187","172.20.40.110","TCP","60","443  >  57039 [ACK] Seq=60839 Ack=222277 Win=251904 Len=0"
"394","40.559258700","151.101.66.187","172.20.40.110","TLSv1.3","206","Application Data, Application Data"
"395","40.559352200","172.20.40.110","151.101.66.187","TCP","54","57039  >  443 [ACK] Seq=222277 Ack=60991 Win=64768 Len=0"
"396","40.560455300","151.101.66.187","172.20.40.110","TLSv1.3","131","Application Data"
"397","40.560455300","151.101.66.187","172.20.40.110","TLSv1.3","125","Application Data"
"398","40.560455300","151.101.66.187","172.20.40.110","TLSv1.3","130","Application Data"
"399","40.560614700","172.20.40.110","151.101.66.187","TCP","54","57039  >  443 [ACK] Seq=222277 Ack=61215 Win=66048 Len=0"
"400","40.561668100","151.101.66.187","172.20.40.110","TLSv1.3","229","Application Data"
"401","40.561668100","151.101.66.187","172.20.40.110","TLSv1.3","206","Application Data, Application Data"
"402","40.561758500","172.20.40.110","151.101.66.187","TCP","54","57039  >  443 [ACK] Seq=222277 Ack=61542 Win=65792 Len=0"
"403","43.883976600","172.20.40.110","151.101.66.187","TLSv1.3","2931","Application Data"
"404","43.893836000","151.101.66.187","172.20.40.110","TCP","60","443  >  57039 [ACK] Seq=61542 Ack=225154 Win=257536 Len=0"
"405","43.895004000","151.101.66.187","172.20.40.110","TLSv1.3","415","Application Data"
"406","43.922884200","172.20.40.110","151.101.66.187","TLSv1.3","2945","Application Data"
"407","43.926294800","151.101.66.187","172.20.40.110","TCP","415","[TCP Spurious Retransmission] 443  >  57039 [PSH, ACK] Seq=61542 Ack=225154 Win=257536 Len=361"
"408","43.926396300","172.20.40.110","151.101.66.187","TCP","66","[TCP Dup ACK 406#1] 57039  >  443 [ACK] Seq=228045 Ack=61903 Win=65536 Len=0 SLE=61542 SRE=61903"
"409","43.931705000","151.101.66.187","172.20.40.110","TCP","60","443  >  57039 [ACK] Seq=61903 Ack=228045 Win=263168 Len=0"
"410","44.154558500","151.101.66.187","172.20.40.110","TLSv1.3","251","Application Data"
"411","44.154558500","151.101.66.187","172.20.40.110","TCP","1434","443  >  57039 [ACK] Seq=62100 Ack=228045 Win=263168 Len=1380 [TCP PDU reassembled in 412]"
"412","44.154558500","151.101.66.187","172.20.40.110","TLSv1.3","1434","Application Data"
"413","44.154558500","151.101.66.187","172.20.40.110","TLSv1.3","1434","Application Data"
"414","44.154558500","151.101.66.187","172.20.40.110","TLSv1.3","1434","Application Data"
"415","44.154558500","151.101.66.187","172.20.40.110","TLSv1.3","1245","Application Data, Application Data"
"416","44.154558500","151.101.66.187","172.20.40.110","TCP","2814","443  >  57039 [ACK] Seq=68811 Ack=228045 Win=263168 Len=2760 [TCP PDU reassembled in 419]"
"417","44.154714000","172.20.40.110","151.101.66.187","TCP","54","57039  >  443 [ACK] Seq=228045 Ack=71571 Win=66048 Len=0"
"418","44.157472500","151.101.66.187","172.20.40.110","TCP","4194","443  >  57039 [ACK] Seq=71571 Ack=228045 Win=263168 Len=4140 [TCP PDU reassembled in 419]"
"419","44.157472500","151.101.66.187","172.20.40.110","TLSv1.3","1377","Application Data"
"420","44.157472500","151.101.66.187","172.20.40.110","TCP","4194","443  >  57039 [ACK] Seq=77034 Ack=228045 Win=263168 Len=4140 [TCP PDU reassembled in 432]"
"421","44.157633800","172.20.40.110","151.101.66.187","TCP","54","57039  >  443 [ACK] Seq=228045 Ack=81174 Win=66048 Len=0"
"422","44.158555900","172.20.40.110","151.101.66.187","TLSv1.3","89","Application Data"
"423","44.163221600","151.101.66.187","172.20.40.110","TCP","1434","443  >  57039 [ACK] Seq=81174 Ack=228045 Win=263168 Len=1380 [TCP PDU reassembled in 432]"
"424","44.163221600","151.101.66.187","172.20.40.110","TCP","1434","443  >  57039 [ACK] Seq=82554 Ack=228045 Win=263168 Len=1380 [TCP PDU reassembled in 432]"
"425","44.163221600","151.101.66.187","172.20.40.110","TCP","1434","443  >  57039 [ACK] Seq=83934 Ack=228045 Win=263168 Len=1380 [TCP PDU reassembled in 432]"
"426","44.163221600","151.101.66.187","172.20.40.110","TCP","1434","443  >  57039 [ACK] Seq=85314 Ack=228045 Win=263168 Len=1380 [TCP PDU reassembled in 432]"
"427","44.163221600","151.101.66.187","172.20.40.110","TCP","1434","443  >  57039 [PSH, ACK] Seq=86694 Ack=228045 Win=263168 Len=1380 [TCP PDU reassembled in 432]"
"428","44.163221600","151.101.66.187","172.20.40.110","TCP","1434","443  >  57039 [ACK] Seq=88074 Ack=228045 Win=263168 Len=1380 [TCP PDU reassembled in 432]"
"429","44.163221600","151.101.66.187","172.20.40.110","TCP","1434","443  >  57039 [ACK] Seq=89454 Ack=228045 Win=263168 Len=1380 [TCP PDU reassembled in 432]"
"430","44.163445300","172.20.40.110","151.101.66.187","TCP","54","57039  >  443 [ACK] Seq=228080 Ack=90834 Win=66048 Len=0"
"431","44.165958800","151.101.66.187","172.20.40.110","TCP","1434","443  >  57039 [ACK] Seq=90834 Ack=228045 Win=263168 Len=1380 [TCP PDU reassembled in 432]"
"432","44.165958800","151.101.66.187","172.20.40.110","TLSv1.3","1311","Application Data, Application Data"
"433","44.165958800","151.101.66.187","172.20.40.110","TCP","6954","443  >  57039 [ACK] Seq=93471 Ack=228045 Win=263168 Len=6900 [TCP PDU reassembled in 437]"
"434","44.166273800","172.20.40.110","151.101.66.187","TCP","54","57039  >  443 [ACK] Seq=228080 Ack=100371 Win=66048 Len=0"
"435","44.167977900","151.101.66.187","172.20.40.110","TCP","5574","443  >  57039 [PSH, ACK] Seq=100371 Ack=228045 Win=263168 Len=5520 [TCP PDU reassembled in 437]"
"436","44.168107400","172.20.40.110","151.101.66.187","TCP","54","57039  >  443 [ACK] Seq=228080 Ack=105891 Win=132352 Len=0"
"437","44.173894400","151.101.66.187","172.20.40.110","TLSv1.3","437","Application Data"
"438","44.173894400","151.101.66.187","172.20.40.110","TCP","437","[TCP Retransmission] 443  >  57039 [PSH, ACK] Seq=105891 Ack=228045 Win=263168 Len=383 [TCP PDU reassembled in 437]"
"439","44.173894400","151.101.66.187","172.20.40.110","TCP","60","443  >  57039 [ACK] Seq=106274 Ack=228080 Win=263168 Len=0"
"440","44.174019400","172.20.40.110","151.101.66.187","TCP","66","57039  >  443 [ACK] Seq=228080 Ack=106274 Win=132096 Len=0 SLE=105891 SRE=106274"
"441","44.420412900","172.20.40.110","151.101.66.187","TLSv1.3","2864","Application Data"
"442","44.421125800","172.20.40.110","151.101.66.187","TLSv1.3","2866","Application Data"
"443","44.426524500","172.20.40.110","151.101.66.187","TLSv1.3","2864","Application Data"
"444","44.428025000","172.20.40.110","151.101.66.187","TLSv1.3","2862","Application Data"
"445","44.428706900","172.20.40.110","151.101.66.187","TLSv1.3","2870","Application Data"
"446","44.465333100","172.20.40.110","151.101.66.187","TCP","1434","[TCP Retransmission] 57039  >  443 [PSH, ACK] Seq=240756 Ack=106274 Win=132096 Len=1380"
"447","44.480224800","172.20.40.110","151.101.66.187","TLSv1.3","2881","Application Data"
"448","44.487904400","172.20.40.110","151.101.66.187","TLSv1.3","2864","Application Data"
"449","44.488736400","172.20.40.110","151.101.66.187","TLSv1.3","2868","Application Data"
"450","44.567692600","151.101.66.187","172.20.40.110","TCP","60","443  >  57039 [ACK] Seq=106274 Ack=230890 Win=268800 Len=0"
"451","44.567692600","151.101.66.187","172.20.40.110","TCP","60","443  >  57039 [ACK] Seq=106274 Ack=233702 Win=274432 Len=0"
"452","44.580588900","151.101.66.187","172.20.40.110","TLSv1.3","251","Application Data"
"453","44.583255000","151.101.66.187","172.20.40.110","TLSv1.3","132","Application Data"
"454","44.583255000","151.101.66.187","172.20.40.110","TCP","60","443  >  57039 [ACK] Seq=106549 Ack=236512 Win=280064 Len=0"
"455","44.583255000","151.101.66.187","172.20.40.110","TCP","60","443  >  57039 [ACK] Seq=106549 Ack=239320 Win=285696 Len=0"
"456","44.583255000","151.101.66.187","172.20.40.110","TCP","60","443  >  57039 [ACK] Seq=106549 Ack=242136 Win=291328 Len=0"
"457","44.583255000","151.101.66.187","172.20.40.110","TLSv1.3","130","Application Data"
"458","44.583255000","151.101.66.187","172.20.40.110","TLSv1.3","175","Application Data"
"459","44.583694800","172.20.40.110","151.101.66.187","TCP","54","57039  >  443 [ACK] Seq=250587 Ack=106746 Win=131584 Len=0"
"460","44.585660300","151.101.66.187","172.20.40.110","TLSv1.3","130","Application Data"
"461","44.592338100","151.101.66.187","172.20.40.110","TCP","130","[TCP Retransmission] 443  >  57039 [PSH, ACK] Seq=106746 Ack=242136 Win=291328 Len=76"
"462","44.592338100","151.101.66.187","172.20.40.110","TCP","66","[TCP Dup ACK 456#1] 443  >  57039 [ACK] Seq=106822 Ack=242136 Win=291328 Len=0 SLE=240756 SRE=242136"
"463","44.592338100","151.101.66.187","172.20.40.110","TCP","60","443  >  57039 [ACK] Seq=106822 Ack=244963 Win=296960 Len=0"
"464","44.592338100","151.101.66.187","172.20.40.110","TCP","60","443  >  57039 [ACK] Seq=106822 Ack=247773 Win=302592 Len=0"
"465","44.592338100","151.101.66.187","172.20.40.110","TCP","60","443  >  57039 [ACK] Seq=106822 Ack=249153 Win=305664 Len=0"
"466","44.592338100","151.101.66.187","172.20.40.110","TCP","60","443  >  57039 [ACK] Seq=106822 Ack=250587 Win=308224 Len=0"
"467","44.592338100","151.101.66.187","172.20.40.110","TLSv1.3","124","Application Data"
"468","44.592682200","172.20.40.110","151.101.66.187","TCP","66","57039  >  443 [ACK] Seq=250587 Ack=106822 Win=131328 Len=0 SLE=106746 SRE=106822"
"469","44.592988100","172.20.40.110","151.101.66.187","TCP","54","57039  >  443 [ACK] Seq=250587 Ack=106892 Win=131328 Len=0"
"470","44.611258300","151.101.66.187","172.20.40.110","TLSv1.3","125","Application Data"
"471","44.611258300","151.101.66.187","172.20.40.110","TLSv1.3","131","Application Data"
"472","44.611462400","172.20.40.110","151.101.66.187","TCP","54","57039  >  443 [ACK] Seq=250587 Ack=107040 Win=131328 Len=0"
"473","45.946284800","172.20.40.110","151.101.66.187","TLSv1.3","2864","Application Data"
"474","45.947223800","172.20.40.110","151.101.66.187","TLSv1.3","2866","Application Data"
"475","45.958885700","172.20.40.110","151.101.66.187","TLSv1.3","2864","Application Data"
"476","45.959285900","172.20.40.110","151.101.66.187","TLSv1.3","2862","Application Data"
"477","45.966476800","151.101.66.187","172.20.40.110","TCP","60","443  >  57039 [ACK] Seq=107040 Ack=253397 Win=313856 Len=0"
"478","45.966476800","151.101.66.187","172.20.40.110","TCP","60","443  >  57039 [ACK] Seq=107040 Ack=256209 Win=319488 Len=0"
"479","45.966476800","151.101.66.187","172.20.40.110","TLSv1.3","369","Application Data"
"480","45.966476800","151.101.66.187","172.20.40.110","TLSv1.3","104","Application Data"
"481","45.966579800","172.20.40.110","151.101.66.187","TCP","54","57039  >  443 [ACK] Seq=261827 Ack=107405 Win=132352 Len=0"
"482","45.971605700","151.101.66.187","172.20.40.110","TCP","60","443  >  57039 [ACK] Seq=107405 Ack=259019 Win=325120 Len=0"
"483","45.971605700","151.101.66.187","172.20.40.110","TCP","60","443  >  57039 [ACK] Seq=107405 Ack=261827 Win=330752 Len=0"
"484","46.012468900","151.101.66.187","172.20.40.110","TLSv1.3","154","Application Data, Application Data"
"485","46.012537200","172.20.40.110","151.101.66.187","TCP","54","57039  >  443 [ACK] Seq=261827 Ack=107505 Win=132352 Len=0"
"486","46.161272600","172.20.40.110","151.101.66.187","TLSv1.3","2864","Application Data"
"487","46.218413300","151.101.66.187","172.20.40.110","TCP","60","443  >  57039 [ACK] Seq=107505 Ack=264637 Win=336384 Len=0"
"488","46.220320000","151.101.66.187","172.20.40.110","TLSv1.3","98","Application Data"
"489","46.261282300","172.20.40.110","151.101.66.187","TCP","54","57039  >  443 [ACK] Seq=264637 Ack=107549 Win=132096 Len=0"
"490","46.328693700","172.20.40.110","151.101.66.187","TLSv1.3","2874","Application Data"
"491","46.397872300","151.101.66.187","172.20.40.110","TCP","60","443  >  57039 [ACK] Seq=107549 Ack=267457 Win=342016 Len=0"
"492","46.398510100","151.101.66.187","172.20.40.110","TLSv1.3","214","Application Data"
"493","46.443717800","172.20.40.110","151.101.66.187","TCP","54","57039  >  443 [ACK] Seq=267457 Ack=107709 Win=132096 Len=0"
"494","46.625330000","172.20.40.110","151.101.66.187","TLSv1.3","2868","Application Data"
"495","46.628424300","172.20.40.110","151.101.66.187","TLSv1.3","2864","Application Data"
"496","46.635610000","151.101.66.187","172.20.40.110","TCP","60","443  >  57039 [ACK] Seq=107709 Ack=270271 Win=347648 Len=0"
"497","46.637686900","151.101.66.187","172.20.40.110","TCP","60","443  >  57039 [ACK] Seq=107709 Ack=273081 Win=353280 Len=0"
"498","46.639014100","151.101.66.187","172.20.40.110","TLSv1.3","135","Application Data"
"499","46.643290000","151.101.66.187","172.20.40.110","TLSv1.3","137","Application Data"
"500","46.643372500","172.20.40.110","151.101.66.187","TCP","54","57039  >  443 [ACK] Seq=273081 Ack=107873 Win=131840 Len=0"
"501","48.510945500","172.20.40.110","151.101.66.187","TLSv1.3","2882","Application Data"
"502","48.522423900","151.101.66.187","172.20.40.110","TCP","60","443  >  57039 [ACK] Seq=107873 Ack=275909 Win=358912 Len=0"
"503","48.525077600","151.101.66.187","172.20.40.110","TLSv1.3","214","Application Data"
"504","48.568660300","172.20.40.110","151.101.66.187","TCP","54","57039  >  443 [ACK] Seq=275909 Ack=108033 Win=131840 Len=0"
"505","48.964117800","172.20.40.110","151.101.66.187","TLSv1.3","2772","Application Data"
"506","48.972987100","151.101.66.187","172.20.40.110","TCP","60","443  >  57039 [ACK] Seq=108033 Ack=278627 Win=364544 Len=0"
"507","48.975169000","172.20.40.110","151.101.66.187","TLSv1.3","2768","Application Data"
"508","48.977020200","151.101.66.187","172.20.40.110","TLSv1.3","104","Application Data"
"509","48.979908300","172.20.40.110","151.101.66.187","TLSv1.3","2770","Application Data"
"510","48.985640600","151.101.66.187","172.20.40.110","TCP","60","443  >  57039 [ACK] Seq=108083 Ack=281341 Win=370176 Len=0"
"511","48.988108100","151.101.66.187","172.20.40.110","TLSv1.3","176","Application Data"
"512","48.989519100","151.101.66.187","172.20.40.110","TCP","60","443  >  57039 [ACK] Seq=108205 Ack=284057 Win=375296 Len=0"
"513","48.993122100","151.101.66.187","172.20.40.110","TLSv1.3","130","Application Data"
"514","48.993190500","172.20.40.110","151.101.66.187","TCP","54","57039  >  443 [ACK] Seq=284057 Ack=108281 Win=131584 Len=0"
"515","48.993397800","172.20.40.110","151.101.66.187","TLSv1.3","2768","Application Data"
"516","49.002416000","172.20.40.110","151.101.66.187","TLSv1.3","2766","Application Data"
"517","49.002887400","151.101.66.187","172.20.40.110","TCP","60","443  >  57039 [ACK] Seq=108281 Ack=286771 Win=381440 Len=0"
"518","49.007473400","151.101.66.187","172.20.40.110","TLSv1.3","130","Application Data"
"519","49.011957500","151.101.66.187","172.20.40.110","TCP","60","443  >  57039 [ACK] Seq=108357 Ack=289483 Win=386560 Len=0"
"520","49.015189400","151.101.66.187","172.20.40.110","TLSv1.3","130","Application Data"
"521","49.015272800","172.20.40.110","151.101.66.187","TCP","54","57039  >  443 [ACK] Seq=289483 Ack=108433 Win=131328 Len=0"
"522","49.020939900","172.20.40.110","151.101.66.187","TLSv1.3","2785","Application Data"
"523","49.031202300","151.101.66.187","172.20.40.110","TCP","60","443  >  57039 [ACK] Seq=108433 Ack=292214 Win=392192 Len=0"
"524","49.035800700","151.101.66.187","172.20.40.110","TLSv1.3","125","Application Data"
"525","49.079252200","172.20.40.110","151.101.66.187","TCP","54","57039  >  443 [ACK] Seq=292214 Ack=108504 Win=131328 Len=0"
"526","49.174615700","172.20.40.110","151.101.66.187","TLSv1.3","2768","Application Data"
"527","49.187842400","151.101.66.187","172.20.40.110","TCP","60","443  >  57039 [ACK] Seq=108504 Ack=294928 Win=397312 Len=0"
"528","49.190891900","151.101.66.187","172.20.40.110","TLSv1.3","279","Application Data"
"529","49.234237300","172.20.40.110","151.101.66.187","TCP","54","57039  >  443 [ACK] Seq=294928 Ack=108729 Win=131072 Len=0"
"530","49.563030500","172.20.40.110","151.101.66.187","TLSv1.3","2768","Application Data"
"531","49.575268700","151.101.66.187","172.20.40.110","TCP","60","443  >  57039 [ACK] Seq=108729 Ack=297642 Win=402944 Len=0"
"532","49.578105500","151.101.66.187","172.20.40.110","TLSv1.3","214","Application Data"
"533","49.619595200","172.20.40.110","151.101.66.187","TCP","54","57039  >  443 [ACK] Seq=297642 Ack=108889 Win=132352 Len=0"
"534","49.693763000","172.20.40.110","151.101.66.187","TLSv1.3","2774","Application Data"
"535","49.705311800","151.101.66.187","172.20.40.110","TCP","60","443  >  57039 [ACK] Seq=108889 Ack=300362 Win=408576 Len=0"
"536","49.709973300","151.101.66.187","172.20.40.110","TLSv1.3","131","Application Data"
"537","49.758906600","172.20.40.110","151.101.66.187","TCP","54","57039  >  443 [ACK] Seq=300362 Ack=108966 Win=132352 Len=0"
"538","52.360019100","172.20.40.110","151.101.66.187","TLSv1.3","2777","Application Data"
"539","52.370611400","151.101.66.187","172.20.40.110","TCP","60","443  >  57039 [ACK] Seq=108966 Ack=303085 Win=413696 Len=0"
"540","52.371534900","151.101.66.187","172.20.40.110","TLSv1.3","241","Application Data"
"541","52.419228700","172.20.40.110","151.101.66.187","TCP","54","57039  >  443 [ACK] Seq=303085 Ack=109153 Win=132096 Len=0"
"542","54.432994900","172.20.40.110","151.101.66.187","TLSv1.3","2590","Application Data"
"543","54.445239500","151.101.66.187","172.20.40.110","TCP","60","443  >  57039 [ACK] Seq=109153 Ack=305621 Win=418816 Len=0"
"544","54.505563500","151.101.66.187","172.20.40.110","TLSv1.3","344","Application Data"
"545","54.505563500","151.101.66.187","172.20.40.110","TLSv1.3","357","Application Data"
"546","54.505682400","172.20.40.110","151.101.66.187","TCP","54","57039  >  443 [ACK] Seq=305621 Ack=109746 Win=131584 Len=0"
"547","54.507680000","172.20.40.110","151.101.66.187","TLSv1.3","89","Application Data"
"548","54.516509200","151.101.66.187","172.20.40.110","TCP","60","443  >  57039 [ACK] Seq=109746 Ack=305656 Win=418816 Len=0"
"549","55.632136700","172.20.40.110","151.101.66.187","TLSv1.3","2781","Application Data"
"550","55.635852900","172.20.40.110","151.101.66.187","TLSv1.3","2775","Application Data"
"551","55.636163600","172.20.40.110","151.101.66.187","TLSv1.3","2782","Application Data"
"552","55.636402600","172.20.40.110","151.101.66.187","TLSv1.3","2781","Application Data"
"553","55.637118400","172.20.40.110","151.101.66.187","TLSv1.3","2775","Application Data"
"554","55.643112400","172.20.40.110","151.101.66.187","TLSv1.3","2775","Application Data"
"555","55.645718900","151.101.66.187","172.20.40.110","TCP","60","443  >  57039 [ACK] Seq=109746 Ack=308383 Win=424448 Len=0"
"556","55.645766800","172.20.40.110","151.101.66.187","TLSv1.3","2778","Application Data"
"557","55.646009200","172.20.40.110","151.101.66.187","TLSv1.3","2775","Application Data"
"558","55.647469300","172.20.40.110","151.101.66.187","TLSv1.3","2781","Application Data"
"559","55.648195400","172.20.40.110","151.101.66.187","TLSv1.3","2772","Application Data"
"560","55.651145100","172.20.40.110","151.101.66.187","TLSv1.3","2774","Application Data"
"561","55.662415200","151.101.66.187","172.20.40.110","TLSv1.3","290","Application Data"
"562","55.662415200","151.101.66.187","172.20.40.110","TCP","60","443  >  57039 [ACK] Seq=109982 Ack=311104 Win=429568 Len=0"
"563","55.662415200","151.101.66.187","172.20.40.110","TCP","60","443  >  57039 [ACK] Seq=109982 Ack=313832 Win=435200 Len=0"
"564","55.665234500","151.101.66.187","172.20.40.110","TLSv1.3","131","Application Data"
"565","55.665234500","151.101.66.187","172.20.40.110","TLSv1.3","286","Application Data"
"566","55.665314700","172.20.40.110","151.101.66.187","TCP","54","57039  >  443 [ACK] Seq=335611 Ack=110291 Win=132352 Len=0"
"567","55.668693900","151.101.66.187","172.20.40.110","TCP","60","443  >  57039 [ACK] Seq=110291 Ack=316559 Win=440832 Len=0"
"568","55.668693900","151.101.66.187","172.20.40.110","TCP","60","443  >  57039 [ACK] Seq=110291 Ack=322001 Win=451584 Len=0"
"569","55.668693900","151.101.66.187","172.20.40.110","TCP","60","443  >  57039 [ACK] Seq=110291 Ack=324725 Win=457216 Len=0"
"570","55.668693900","151.101.66.187","172.20.40.110","TLSv1.3","130","Application Data"
"571","55.668693900","151.101.66.187","172.20.40.110","TLSv1.3","130","Application Data"
"572","55.668693900","151.101.66.187","172.20.40.110","TLSv1.3","130","Application Data"
"573","55.668693900","151.101.66.187","172.20.40.110","TLSv1.3","131","Application Data"
"574","55.668693900","151.101.66.187","172.20.40.110","TCP","60","443  >  57039 [ACK] Seq=110596 Ack=327446 Win=462336 Len=0"
"575","55.668693900","151.101.66.187","172.20.40.110","TCP","60","443  >  57039 [ACK] Seq=110596 Ack=330173 Win=467968 Len=0"
"576","55.668693900","151.101.66.187","172.20.40.110","TCP","60","443  >  57039 [ACK] Seq=110596 Ack=332891 Win=473600 Len=0"
"577","55.668828000","172.20.40.110","151.101.66.187","TCP","54","57039  >  443 [ACK] Seq=335611 Ack=110596 Win=132096 Len=0"
"578","55.670987800","151.101.66.187","172.20.40.110","TCP","60","443  >  57039 [ACK] Seq=110596 Ack=335611 Win=478720 Len=0"
"579","55.670987800","151.101.66.187","172.20.40.110","TLSv1.3","130","Application Data"
"580","55.670987800","151.101.66.187","172.20.40.110","TLSv1.3","125","Application Data"
"581","55.671091800","172.20.40.110","151.101.66.187","TCP","54","57039  >  443 [ACK] Seq=335611 Ack=110743 Win=131840 Len=0"
"582","55.672153100","151.101.66.187","172.20.40.110","TLSv1.3","135","Application Data"
"583","55.672254400","172.20.40.110","151.101.66.187","TCP","54","57039  >  443 [ACK] Seq=335611 Ack=110824 Win=131840 Len=0"
"584","55.674450400","151.101.66.187","172.20.40.110","TLSv1.3","125","Application Data"
"585","55.717362800","172.20.40.110","151.101.66.187","TCP","54","57039  >  443 [ACK] Seq=335611 Ack=110895 Win=131840 Len=0"
"586","57.018619900","172.20.40.110","151.101.66.187","TLSv1.3","2781","Application Data"
"587","57.027434800","151.101.66.187","172.20.40.110","TCP","60","443  >  57039 [ACK] Seq=110895 Ack=338338 Win=484352 Len=0"
"588","57.362786100","151.101.66.187","172.20.40.110","TLSv1.3","365","Application Data"
"589","57.362786100","151.101.66.187","172.20.40.110","TCP","9714","443  >  57039 [PSH, ACK] Seq=111206 Ack=338338 Win=484352 Len=9660 [TCP PDU reassembled in 594]"
"590","57.362892500","172.20.40.110","151.101.66.187","TCP","54","57039  >  443 [ACK] Seq=338338 Ack=120866 Win=132352 Len=0"
"591","57.364669900","151.101.66.187","172.20.40.110","TCP","1434","443  >  57039 [PSH, ACK] Seq=120866 Ack=338338 Win=484352 Len=1380 [TCP PDU reassembled in 594]"
"592","57.367860500","151.101.66.187","172.20.40.110","TCP","1434","443  >  57039 [ACK] Seq=122246 Ack=338338 Win=484352 Len=1380 [TCP PDU reassembled in 594]"
"593","57.367860500","151.101.66.187","172.20.40.110","TCP","1434","443  >  57039 [ACK] Seq=123626 Ack=338338 Win=484352 Len=1380 [TCP PDU reassembled in 594]"
"594","57.367860500","151.101.66.187","172.20.40.110","TLSv1.3","8334","Application Data"
"595","57.367998800","172.20.40.110","151.101.66.187","TCP","54","57039  >  443 [ACK] Seq=338338 Ack=133286 Win=132352 Len=0"
"596","57.370230700","151.101.66.187","172.20.40.110","TCP","9714","443  >  57039 [PSH, ACK] Seq=133286 Ack=338338 Win=484352 Len=9660 [TCP PDU reassembled in 598]"
"597","57.370331200","172.20.40.110","151.101.66.187","TCP","54","57039  >  443 [ACK] Seq=338338 Ack=142946 Win=132352 Len=0"
"598","57.371565000","151.101.66.187","172.20.40.110","TLSv1.3","2814","Application Data"
"599","57.371565000","151.101.66.187","172.20.40.110","TLSv1.3","685","Application Data"
"600","57.371710000","172.20.40.110","151.101.66.187","TCP","54","57039  >  443 [ACK] Seq=338338 Ack=146337 Win=132352 Len=0"
"601","57.512031400","172.20.40.110","151.101.66.187","TLSv1.3","2768","Application Data"
"602","57.519575400","172.20.40.110","151.101.66.187","TLSv1.3","2762","Application Data"
"603","57.519765600","172.20.40.110","151.101.66.187","TLSv1.3","2764","Application Data"
"604","57.519926300","172.20.40.110","151.101.66.187","TLSv1.3","2762","Application Data"
"605","57.558447300","172.20.40.110","151.101.66.187","TCP","1434","[TCP Retransmission] 57039  >  443 [PSH, ACK] Seq=347798 Ack=146337 Win=132352 Len=1380"
"606","57.566410800","172.20.40.110","151.101.66.187","TLSv1.3","2760","Application Data"
"607","57.566663900","172.20.40.110","151.101.66.187","TLSv1.3","2762","Application Data"
"608","57.570085700","172.20.40.110","151.101.66.187","TLSv1.3","2711","Application Data"
"609","57.570609100","172.20.40.110","151.101.66.187","TLSv1.3","2718","Application Data"
"610","57.595757100","172.20.40.110","151.101.66.187","TLSv1.3","2717","Application Data"
"611","57.641589900","151.101.66.187","172.20.40.110","TCP","60","443  >  57039 [ACK] Seq=146337 Ack=341052 Win=489472 Len=0"
"612","57.641589900","151.101.66.187","172.20.40.110","TLSv1.3","446","Application Data"
"613","57.646487800","151.101.66.187","172.20.40.110","TCP","60","443  >  57039 [ACK] Seq=146729 Ack=343760 Win=495104 Len=0"
"614","57.646487800","151.101.66.187","172.20.40.110","TCP","60","443  >  57039 [ACK] Seq=146729 Ack=346470 Win=500736 Len=0"
"615","57.646487800","151.101.66.187","172.20.40.110","TCP","60","443  >  57039 [ACK] Seq=146729 Ack=349178 Win=505856 Len=0"
"616","57.646487800","151.101.66.187","172.20.40.110","TLSv1.3","130","Application Data"
"617","57.646487800","151.101.66.187","172.20.40.110","TLSv1.3","132","Application Data"
"618","57.646487800","151.101.66.187","172.20.40.110","TLSv1.3","130","Application Data"
"619","57.646678700","172.20.40.110","151.101.66.187","TCP","54","57039  >  443 [ACK] Seq=362576 Ack=146959 Win=131840 Len=0"
"620","57.676245600","151.101.66.187","172.20.40.110","TCP","66","[TCP Dup ACK 615#1] 443  >  57039 [ACK] Seq=146959 Ack=349178 Win=505856 Len=0 SLE=347798 SRE=349178"
"621","57.676245600","151.101.66.187","172.20.40.110","TCP","60","443  >  57039 [ACK] Seq=146959 Ack=351884 Win=511488 Len=0"
"622","57.676245600","151.101.66.187","172.20.40.110","TCP","60","443  >  57039 [ACK] Seq=146959 Ack=354592 Win=516608 Len=0"
"623","57.676245600","151.101.66.187","172.20.40.110","TLSv1.3","124","Application Data"
"624","57.676245600","151.101.66.187","172.20.40.110","TLSv1.3","130","Application Data"
"625","57.676245600","151.101.66.187","172.20.40.110","TCP","60","443  >  57039 [ACK] Seq=147105 Ack=357249 Win=522240 Len=0"
"626","57.676245600","151.101.66.187","172.20.40.110","TCP","60","443  >  57039 [ACK] Seq=147105 Ack=359913 Win=527360 Len=0"
"627","57.676245600","151.101.66.187","172.20.40.110","TLSv1.3","178","Application Data"
"628","57.676245600","151.101.66.187","172.20.40.110","TLSv1.3","297","Application Data"
"629","57.676245600","151.101.66.187","172.20.40.110","TLSv1.3","139","Application Data"
"630","57.676245600","151.101.66.187","172.20.40.110","TLSv1.3","224","Application Data"
"631","57.676245600","151.101.66.187","172.20.40.110","TCP","60","443  >  57039 [ACK] Seq=147727 Ack=362576 Win=532480 Len=0"
"632","57.676559400","172.20.40.110","151.101.66.187","TCP","54","57039  >  443 [ACK] Seq=362576 Ack=147727 Win=132352 Len=0"
"633","57.687855700","151.101.66.187","172.20.40.110","TLSv1.3","160","Application Data"
"634","57.687855700","151.101.66.187","172.20.40.110","TLSv1.3","590","Application Data"
"635","57.688109100","172.20.40.110","151.101.66.187","TCP","54","57039  >  443 [ACK] Seq=362576 Ack=148369 Win=131584 Len=0"
"636","57.802373600","172.20.40.110","151.101.66.187","TLSv1.3","2764","Application Data"
"637","57.802624700","172.20.40.110","151.101.66.187","TLSv1.3","2770","Application Data"
"638","57.804614500","172.20.40.110","151.101.66.187","TLSv1.3","2778","Application Data"
"639","57.807798000","172.20.40.110","151.101.66.187","TLSv1.3","2720","Application Data"
"640","57.819393900","151.101.66.187","172.20.40.110","TCP","60","443  >  57039 [ACK] Seq=148369 Ack=365286 Win=538112 Len=0"
"641","57.819393900","151.101.66.187","172.20.40.110","TCP","60","443  >  57039 [ACK] Seq=148369 Ack=368002 Win=543744 Len=0"
"642","57.819393900","151.101.66.187","172.20.40.110","TCP","60","443  >  57039 [ACK] Seq=148369 Ack=370726 Win=548864 Len=0"
"643","57.819393900","151.101.66.187","172.20.40.110","TCP","60","443  >  57039 [ACK] Seq=148369 Ack=373392 Win=554496 Len=0"
"644","57.819393900","151.101.66.187","172.20.40.110","TLSv1.3","125","Application Data"
"645","57.820439000","151.101.66.187","172.20.40.110","TLSv1.3","130","Application Data"
"646","57.820503500","172.20.40.110","151.101.66.187","TCP","54","57039  >  443 [ACK] Seq=373392 Ack=148516 Win=131584 Len=0"
"647","57.821611400","151.101.66.187","172.20.40.110","TLSv1.3","445","Application Data"
"648","57.828208200","151.101.66.187","172.20.40.110","TLSv1.3","137","Application Data"
"649","57.828208200","151.101.66.187","172.20.40.110","TLSv1.3","1365","Application Data"
"650","57.828287000","172.20.40.110","151.101.66.187","TCP","54","57039  >  443 [ACK] Seq=373392 Ack=150301 Win=132352 Len=0"
"651","57.940214700","172.20.40.110","151.101.66.187","TLSv1.3","2766","Application Data"
"652","57.953945700","151.101.66.187","172.20.40.110","TCP","60","443  >  57039 [ACK] Seq=150301 Ack=376104 Win=559616 Len=0"
"653","57.954720500","151.101.66.187","172.20.40.110","TLSv1.3","104","Application Data"
"654","58.007300200","172.20.40.110","151.101.66.187","TCP","54","57039  >  443 [ACK] Seq=376104 Ack=150351 Win=132352 Len=0"
"655","58.911763200","172.20.40.110","151.101.66.187","TLSv1.3","2784","Application Data"
"656","58.916283600","172.20.40.110","151.101.66.187","TLSv1.3","2780","Application Data"
"657","58.920220400","151.101.66.187","172.20.40.110","TCP","60","443  >  57039 [ACK] Seq=150351 Ack=378834 Win=565248 Len=0"
"658","58.924692600","151.101.66.187","172.20.40.110","TCP","60","443  >  57039 [ACK] Seq=150351 Ack=381560 Win=570880 Len=0"
"659","58.927956000","151.101.66.187","172.20.40.110","TLSv1.3","240","Application Data"
"660","58.929020800","151.101.66.187","172.20.40.110","TLSv1.3","131","Application Data"
"661","58.929097200","172.20.40.110","151.101.66.187","TCP","54","57039  >  443 [ACK] Seq=381560 Ack=150614 Win=132096 Len=0"
"662","58.952322000","172.20.40.110","151.101.66.187","TLSv1.3","2780","Application Data"
"663","58.961438500","151.101.66.187","172.20.40.110","TCP","60","443  >  57039 [ACK] Seq=150614 Ack=384286 Win=576000 Len=0"
"664","58.965799600","151.101.66.187","172.20.40.110","TLSv1.3","130","Application Data"
"665","59.010016300","172.20.40.110","151.101.66.187","TCP","54","57039  >  443 [ACK] Seq=384286 Ack=150690 Win=131840 Len=0"
"666","59.119334000","172.20.40.110","151.101.66.187","TLSv1.3","2786","Application Data"
"667","59.122107800","172.20.40.110","151.101.66.187","TLSv1.3","2800","Application Data"
"668","59.129361800","151.101.66.187","172.20.40.110","TCP","60","443  >  57039 [ACK] Seq=150690 Ack=387018 Win=581632 Len=0"
"669","59.133421900","151.101.66.187","172.20.40.110","TCP","60","443  >  57039 [ACK] Seq=150690 Ack=389764 Win=587264 Len=0"
"670","59.139619200","151.101.66.187","172.20.40.110","TLSv1.3","135","Application Data"
"671","59.139619200","151.101.66.187","172.20.40.110","TLSv1.3","104","Application Data"
"672","59.139718600","172.20.40.110","151.101.66.187","TCP","54","57039  >  443 [ACK] Seq=389764 Ack=150821 Win=131840 Len=0"
"673","59.279528700","172.20.40.110","151.101.66.187","TLSv1.3","2782","Application Data"
"674","59.288592900","151.101.66.187","172.20.40.110","TCP","60","443  >  57039 [ACK] Seq=150821 Ack=392492 Win=592384 Len=0"
"675","59.290961000","151.101.66.187","172.20.40.110","TLSv1.3","98","Application Data"
"676","59.312628100","172.20.40.110","151.101.66.187","TLSv1.3","2796","Application Data"
"677","59.321771200","151.101.66.187","172.20.40.110","TCP","60","443  >  57039 [ACK] Seq=150865 Ack=395234 Win=598016 Len=0"
"678","59.325022200","151.101.66.187","172.20.40.110","TLSv1.3","208","Application Data"
"679","59.372575000","172.20.40.110","151.101.66.187","TCP","54","57039  >  443 [ACK] Seq=395234 Ack=151019 Win=131584 Len=0"
"680","59.468750700","172.20.40.110","151.101.66.187","TLSv1.3","2788","Application Data"
"681","59.469446500","172.20.40.110","151.101.66.187","TLSv1.3","2790","Application Data"
"682","59.477622200","151.101.66.187","172.20.40.110","TCP","60","443  >  57039 [ACK] Seq=151019 Ack=397968 Win=603648 Len=0"
"683","59.481262100","151.101.66.187","172.20.40.110","TCP","60","443  >  57039 [ACK] Seq=151019 Ack=400704 Win=608768 Len=0"
"684","59.481262100","151.101.66.187","172.20.40.110","TLSv1.3","104","Application Data"
"685","59.482536800","172.20.40.110","151.101.66.187","TLSv1.3","2784","Application Data"
"686","59.484236900","172.20.40.110","151.101.66.187","TLSv1.3","2784","Application Data"
"687","59.484439100","151.101.66.187","172.20.40.110","TLSv1.3","131","Application Data"
"688","59.486691600","172.20.40.110","151.101.66.187","TLSv1.3","2782","Application Data"
"689","59.496116500","151.101.66.187","172.20.40.110","TCP","60","443  >  57039 [ACK] Seq=151146 Ack=403434 Win=614400 Len=0"
"690","59.496116500","151.101.66.187","172.20.40.110","TCP","60","443  >  57039 [ACK] Seq=151146 Ack=406164 Win=620032 Len=0"
"691","59.498429900","151.101.66.187","172.20.40.110","TLSv1.3","130","Application Data"
"692","59.498429900","151.101.66.187","172.20.40.110","TCP","60","443  >  57039 [ACK] Seq=151222 Ack=408892 Win=625152 Len=0"
"693","59.500528500","151.101.66.187","172.20.40.110","TLSv1.3","170","Application Data"
"694","59.500605800","172.20.40.110","151.101.66.187","TCP","54","57039  >  443 [ACK] Seq=408892 Ack=151338 Win=131328 Len=0"
"695","59.503401000","151.101.66.187","172.20.40.110","TLSv1.3","291","Application Data"
"696","59.505954500","172.20.40.110","151.101.66.187","TLSv1.3","2790","Application Data"
"697","59.519129100","151.101.66.187","172.20.40.110","TCP","60","443  >  57039 [ACK] Seq=151575 Ack=411628 Win=630784 Len=0"
"698","59.522343200","151.101.66.187","172.20.40.110","TLSv1.3","129","Application Data"
"699","59.535336500","172.20.40.110","151.101.66.187","TLSv1.3","2784","Application Data"
"700","59.535660700","172.20.40.110","151.101.66.187","TLSv1.3","2792","Application Data"
"701","59.547541100","151.101.66.187","172.20.40.110","TCP","60","443  >  57039 [ACK] Seq=151650 Ack=414358 Win=636416 Len=0"
"702","59.547541100","151.101.66.187","172.20.40.110","TCP","60","443  >  57039 [ACK] Seq=151650 Ack=417096 Win=641536 Len=0"
"703","59.550449900","172.20.40.110","151.101.66.187","TLSv1.3","2786","Application Data"
"704","59.550775000","172.20.40.110","151.101.66.187","TLSv1.3","2793","Application Data"
"705","59.550984600","151.101.66.187","172.20.40.110","TLSv1.3","131","Application Data"
"706","59.550984600","151.101.66.187","172.20.40.110","TLSv1.3","130","Application Data"
"707","59.551101700","172.20.40.110","151.101.66.187","TLSv1.3","2792","Application Data"
"708","59.552542200","172.20.40.110","151.101.66.187","TLSv1.3","2784","Application Data"
"709","59.561478300","151.101.66.187","172.20.40.110","TCP","60","443  >  57039 [ACK] Seq=151803 Ack=419828 Win=647168 Len=0"
"710","59.561478300","151.101.66.187","172.20.40.110","TCP","60","443  >  57039 [ACK] Seq=151803 Ack=422567 Win=652800 Len=0"
"711","59.564003700","151.101.66.187","172.20.40.110","TLSv1.3","182","Application Data"
"712","59.565302700","151.101.66.187","172.20.40.110","TCP","60","443  >  57039 [ACK] Seq=151931 Ack=425305 Win=658432 Len=0"
"713","59.565302700","151.101.66.187","172.20.40.110","TCP","60","443  >  57039 [ACK] Seq=151931 Ack=428035 Win=663552 Len=0"
"714","59.567461700","151.101.66.187","172.20.40.110","TLSv1.3","131","Application Data"
"715","59.567544400","172.20.40.110","151.101.66.187","TCP","54","57039  >  443 [ACK] Seq=428035 Ack=152008 Win=132096 Len=0"
"716","59.568854900","151.101.66.187","172.20.40.110","TLSv1.3","124","Application Data"
"717","59.596658700","172.20.40.110","151.101.66.187","TLSv1.3","2784","Application Data"
"718","59.605154500","151.101.66.187","172.20.40.110","TCP","60","443  >  57039 [ACK] Seq=152078 Ack=430765 Win=669184 Len=0"
"719","59.611310000","151.101.66.187","172.20.40.110","TLSv1.3","246","Application Data"
"720","59.659965800","172.20.40.110","151.101.66.187","TCP","54","57039  >  443 [ACK] Seq=430765 Ack=152270 Win=131840 Len=0"
"721","63.531716000","172.20.40.110","151.101.66.187","TLSv1.3","2590","Application Data"
"722","63.545726600","151.101.66.187","172.20.40.110","TCP","60","443  >  57039 [ACK] Seq=152270 Ack=433301 Win=674304 Len=0"
"723","63.619777200","151.101.66.187","172.20.40.110","TLSv1.3","620","Application Data"
"724","63.621712000","172.20.40.110","151.101.66.187","TLSv1.3","89","Application Data"
"725","63.630116500","151.101.66.187","172.20.40.110","TCP","60","443  >  57039 [ACK] Seq=152836 Ack=433336 Win=674304 Len=0"
