"No.","Time","Source","Destination","Protocol","Length","Info"
"1","0.000000000","172.20.40.110","151.101.194.187","TLSv1.2","2851","Application Data"
"2","0.000226400","172.20.40.110","151.101.194.187","TLSv1.2","93","Application Data"
"3","0.017632100","151.101.194.187","172.20.40.110","TCP","60","443  >  50060 [ACK] Seq=1 Ack=2798 Win=3367 Len=0"
"4","0.017632100","151.101.194.187","172.20.40.110","TCP","60","443  >  50060 [ACK] Seq=1 Ack=2837 Win=3367 Len=0"
"5","0.017632100","151.101.194.187","172.20.40.110","TLSv1.2","93","Application Data"
"6","0.019940400","151.101.194.187","172.20.40.110","TLSv1.2","368","Application Data"
"7","0.020046000","172.20.40.110","151.101.194.187","TCP","54","50060  >  443 [ACK] Seq=2837 Ack=354 Win=257 Len=0"
"8","0.430631900","172.20.40.110","151.101.194.187","TLSv1.2","2842","Application Data"
"9","0.448128200","151.101.194.187","172.20.40.110","TCP","60","443  >  50060 [ACK] Seq=354 Ack=5625 Win=3378 Len=0"
"10","0.451541000","151.101.194.187","172.20.40.110","TLSv1.2","153","Application Data"
"11","0.483882300","151.101.194.187","172.20.40.110","TCP","153","[TCP Retransmission] 443  >  50060 [PSH, ACK] Seq=354 Ack=5625 Win=3378 Len=99"
"12","0.483945100","172.20.40.110","151.101.194.187","TCP","66","50060  >  443 [ACK] Seq=5625 Ack=453 Win=256 Len=0 SLE=354 SRE=453"
"13","3.940830500","172.20.40.110","151.101.194.187","TLSv1.2","2873","Application Data"
"14","3.952141600","151.101.194.187","172.20.40.110","TCP","60","443  >  50060 [ACK] Seq=453 Ack=8444 Win=3389 Len=0"
"15","3.955476800","172.20.40.110","151.101.194.187","TLSv1.2","2864","Application Data"
"16","3.958000500","172.20.40.110","151.101.194.187","TLSv1.2","2858","Application Data"
"17","3.958248700","151.101.194.187","172.20.40.110","TLSv1.2","214","Application Data"
"18","3.964998700","151.101.194.187","172.20.40.110","TCP","60","443  >  50060 [ACK] Seq=613 Ack=11254 Win=3400 Len=0"
"19","3.967174100","151.101.194.187","172.20.40.110","TCP","60","443  >  50060 [ACK] Seq=613 Ack=14058 Win=3411 Len=0"
"20","3.969535400","151.101.194.187","172.20.40.110","TLSv1.2","185","Application Data"
"21","3.969617700","172.20.40.110","151.101.194.187","TCP","54","50060  >  443 [ACK] Seq=14058 Ack=744 Win=255 Len=0"
"22","3.971959900","151.101.194.187","172.20.40.110","TLSv1.2","103","Application Data"
"23","4.011402700","151.101.194.187","172.20.40.110","TCP","103","[TCP Retransmission] 443  >  50060 [PSH, ACK] Seq=744 Ack=14058 Win=3411 Len=49"
"24","4.011469600","172.20.40.110","151.101.194.187","TCP","66","50060  >  443 [ACK] Seq=14058 Ack=793 Win=255 Len=0 SLE=744 SRE=793"
"25","4.020678600","172.20.40.110","151.101.194.187","TLSv1.2","2858","Application Data"
"26","4.031825900","151.101.194.187","172.20.40.110","TCP","60","443  >  50060 [ACK] Seq=793 Ack=16862 Win=3422 Len=0"
"27","4.036310300","151.101.194.187","172.20.40.110","TLSv1.2","130","Application Data"
"28","4.070580000","151.101.194.187","172.20.40.110","TCP","130","[TCP Retransmission] 443  >  50060 [PSH, ACK] Seq=793 Ack=16862 Win=3422 Len=76"
"29","4.070662600","172.20.40.110","151.101.194.187","TCP","66","50060  >  443 [ACK] Seq=16862 Ack=869 Win=255 Len=0 SLE=793 SRE=869"
"30","4.150938300","172.20.40.110","151.101.194.187","TLSv1.2","2855","Application Data"
"31","4.162040700","151.101.194.187","172.20.40.110","TCP","60","443  >  50060 [ACK] Seq=869 Ack=19663 Win=3433 Len=0"
"32","4.166348600","151.101.194.187","172.20.40.110","TLSv1.2","125","Application Data"
"33","4.169077500","172.20.40.110","151.101.194.187","TLSv1.2","2872","Application Data"
"34","4.175913700","172.20.40.110","151.101.194.187","TLSv1.2","2872","Application Data"
"35","4.182544600","151.101.194.187","172.20.40.110","TCP","60","443  >  50060 [ACK] Seq=940 Ack=22481 Win=3444 Len=0"
"36","4.184786300","151.101.194.187","172.20.40.110","TCP","60","443  >  50060 [ACK] Seq=940 Ack=25299 Win=3455 Len=0"
"37","4.185808400","151.101.194.187","172.20.40.110","TLSv1.2","130","Application Data"
"38","4.187959000","151.101.194.187","172.20.40.110","TLSv1.2","125","Application Data"
"39","4.188033600","172.20.40.110","151.101.194.187","TCP","54","50060  >  443 [ACK] Seq=25299 Ack=1087 Win=254 Len=0"
"40","4.448019900","172.20.40.110","151.101.194.187","TLSv1.2","2866","Application Data"
"41","4.448299600","172.20.40.110","151.101.194.187","TLSv1.2","2864","Application Data"
"42","4.448527400","172.20.40.110","151.101.194.187","TLSv1.2","2861","Application Data"
"43","4.457504600","151.101.194.187","172.20.40.110","TCP","60","443  >  50060 [ACK] Seq=1087 Ack=28111 Win=3466 Len=0"
"44","4.460757600","151.101.194.187","172.20.40.110","TLSv1.2","130","Application Data"
"45","4.461853200","151.101.194.187","172.20.40.110","TCP","60","443  >  50060 [ACK] Seq=1163 Ack=30921 Win=3477 Len=0"
"46","4.461853200","151.101.194.187","172.20.40.110","TCP","60","443  >  50060 [ACK] Seq=1163 Ack=33728 Win=3487 Len=0"
"47","4.464097400","151.101.194.187","172.20.40.110","TLSv1.2","130","Application Data"
"48","4.464171800","172.20.40.110","151.101.194.187","TCP","54","50060  >  443 [ACK] Seq=33728 Ack=1239 Win=253 Len=0"
"49","4.466482500","151.101.194.187","172.20.40.110","TLSv1.2","131","Application Data"
"50","4.503886300","151.101.194.187","172.20.40.110","TCP","131","[TCP Retransmission] 443  >  50060 [PSH, ACK] Seq=1239 Ack=33728 Win=3487 Len=77"
"51","4.503932400","172.20.40.110","151.101.194.187","TCP","66","50060  >  443 [ACK] Seq=33728 Ack=1316 Win=253 Len=0 SLE=1239 SRE=1316"
"52","4.583782500","172.20.40.110","151.101.194.187","TLSv1.2","2914","Application Data"
"53","4.590572300","172.20.40.110","151.101.194.187","TLSv1.2","2915","Application Data"
"54","4.592777100","172.20.40.110","151.101.194.187","TLSv1.2","2917","Application Data"
"55","4.593822600","172.20.40.110","151.101.194.187","TLSv1.2","2916","Application Data"
"56","4.594096900","172.20.40.110","151.101.194.187","TLSv1.2","2913","Application Data"
"57","4.611894400","151.101.194.187","172.20.40.110","TCP","60","443  >  50060 [ACK] Seq=1316 Ack=36588 Win=3499 Len=0"
"58","4.611894400","151.101.194.187","172.20.40.110","TLSv1.2","240","Application Data"
"59","4.611986800","172.20.40.110","151.101.194.187","TCP","54","50060  >  443 [ACK] Seq=48033 Ack=1502 Win=258 Len=0"
"60","4.633674000","151.101.194.187","172.20.40.110","TCP","60","443  >  50060 [ACK] Seq=1502 Ack=39449 Win=3510 Len=0"
"61","4.633674000","151.101.194.187","172.20.40.110","TCP","60","443  >  50060 [ACK] Seq=1502 Ack=42312 Win=3521 Len=0"
"62","4.633674000","151.101.194.187","172.20.40.110","TCP","60","443  >  50060 [ACK] Seq=1502 Ack=45174 Win=3533 Len=0"
"63","4.633674000","151.101.194.187","172.20.40.110","TLSv1.2","251","Application Data"
"64","4.633674000","151.101.194.187","172.20.40.110","TLSv1.2","125","Application Data"
"65","4.633674000","151.101.194.187","172.20.40.110","TLSv1.2","124","Application Data"
"66","4.633674000","151.101.194.187","172.20.40.110","TCP","60","443  >  50060 [ACK] Seq=1840 Ack=46554 Win=3538 Len=0"
"67","4.633788200","172.20.40.110","151.101.194.187","TCP","54","50060  >  443 [ACK] Seq=48033 Ack=1840 Win=257 Len=0"
"68","4.641555500","151.101.194.187","172.20.40.110","TCP","60","443  >  50060 [ACK] Seq=1840 Ack=48033 Win=3544 Len=0"
"69","4.642777200","151.101.194.187","172.20.40.110","TLSv1.2","146","Application Data"
"70","4.683949800","151.101.194.187","172.20.40.110","TCP","146","[TCP Retransmission] 443  >  50060 [PSH, ACK] Seq=1840 Ack=48033 Win=3544 Len=92"
"71","4.684083600","172.20.40.110","151.101.194.187","TCP","66","50060  >  443 [ACK] Seq=48033 Ack=1932 Win=257 Len=0 SLE=1840 SRE=1932"
"72","5.264771500","172.20.40.110","151.101.194.187","TLSv1.2","2911","Application Data"
"73","5.265899900","172.20.40.110","151.101.194.187","TLSv1.2","2909","Application Data"
"74","5.273818700","151.101.194.187","172.20.40.110","TCP","60","443  >  50060 [ACK] Seq=1932 Ack=50890 Win=3555 Len=0"
"75","5.275104100","151.101.194.187","172.20.40.110","TCP","60","443  >  50060 [ACK] Seq=1932 Ack=53745 Win=3566 Len=0"
"76","5.276185600","151.101.194.187","172.20.40.110","TLSv1.2","98","Application Data"
"77","5.277343100","151.101.194.187","172.20.40.110","TLSv1.2","131","Application Data"
"78","5.277420100","172.20.40.110","151.101.194.187","TCP","54","50060  >  443 [ACK] Seq=53745 Ack=2053 Win=256 Len=0"
"79","5.326859300","172.20.40.110","151.101.194.187","TLSv1.2","2912","Application Data"
"80","5.342153500","151.101.194.187","172.20.40.110","TCP","60","443  >  50060 [ACK] Seq=2053 Ack=55125 Win=3572 Len=0"
"81","5.342153500","151.101.194.187","172.20.40.110","TCP","60","443  >  50060 [ACK] Seq=2053 Ack=56603 Win=3578 Len=0"
"82","5.345514200","151.101.194.187","172.20.40.110","TLSv1.2","125","Application Data"
"83","5.381912400","151.101.194.187","172.20.40.110","TCP","125","[TCP Retransmission] 443  >  50060 [PSH, ACK] Seq=2053 Ack=56603 Win=3578 Len=71"
"84","5.381970700","172.20.40.110","151.101.194.187","TCP","66","50060  >  443 [ACK] Seq=56603 Ack=2124 Win=256 Len=0 SLE=2053 SRE=2124"
"85","5.423975100","172.20.40.110","151.101.194.187","TLSv1.2","2911","Application Data"
"86","5.435949200","151.101.194.187","172.20.40.110","TCP","60","443  >  50060 [ACK] Seq=2124 Ack=59460 Win=3589 Len=0"
"87","5.438346600","151.101.194.187","172.20.40.110","TLSv1.2","191","Application Data"
"88","5.474131900","151.101.194.187","172.20.40.110","TCP","191","[TCP Retransmission] 443  >  50060 [PSH, ACK] Seq=2124 Ack=59460 Win=3589 Len=137"
"89","5.474262600","172.20.40.110","151.101.194.187","TCP","66","50060  >  443 [ACK] Seq=59460 Ack=2261 Win=255 Len=0 SLE=2124 SRE=2261"
"90","16.044920600","172.20.40.110","151.101.194.187","TLSv1.2","2933","Application Data"
"91","16.045045100","172.20.40.110","151.101.194.187","TLSv1.2","93","Application Data"
"92","16.051517100","172.20.40.110","151.101.194.187","TLSv1.2","2924","Application Data"
"93","16.051916500","172.20.40.110","151.101.194.187","TLSv1.2","2918","Application Data"
"94","16.064558700","151.101.194.187","172.20.40.110","TCP","60","443  >  50060 [ACK] Seq=2261 Ack=62339 Win=3600 Len=0"
"95","16.064558700","151.101.194.187","172.20.40.110","TCP","60","443  >  50060 [ACK] Seq=2261 Ack=62378 Win=3600 Len=0"
"96","16.064558700","151.101.194.187","172.20.40.110","TLSv1.2","93","Application Data"
"97","16.069750900","151.101.194.187","172.20.40.110","TLSv1.2","214","Application Data"
"98","16.069830500","172.20.40.110","151.101.194.187","TCP","54","50060  >  443 [ACK] Seq=68112 Ack=2460 Win=255 Len=0"
"99","16.070823400","151.101.194.187","172.20.40.110","TCP","60","443  >  50060 [ACK] Seq=2460 Ack=65248 Win=3611 Len=0"
"100","16.070823400","151.101.194.187","172.20.40.110","TCP","60","443  >  50060 [ACK] Seq=2460 Ack=68112 Win=3623 Len=0"
"101","16.076072100","151.101.194.187","172.20.40.110","TLSv1.2","124","Application Data"
"102","16.077398800","151.101.194.187","172.20.40.110","TLSv1.2","130","Application Data"
"103","16.077492500","172.20.40.110","151.101.194.187","TCP","54","50060  >  443 [ACK] Seq=68112 Ack=2606 Win=254 Len=0"
"104","16.097450200","172.20.40.110","151.101.194.187","TLSv1.2","2918","Application Data"
"105","16.106493300","151.101.194.187","172.20.40.110","TCP","60","443  >  50060 [ACK] Seq=2606 Ack=70976 Win=3634 Len=0"
"106","16.112005200","151.101.194.187","172.20.40.110","TLSv1.2","130","Application Data"
"107","16.132186700","172.20.40.110","151.101.194.187","TLSv1.2","2930","Application Data"
"108","16.141851500","151.101.194.187","172.20.40.110","TCP","60","443  >  50060 [ACK] Seq=2682 Ack=73852 Win=3645 Len=0"
"109","16.147317600","151.101.194.187","172.20.40.110","TLSv1.2","104","Application Data"
"110","16.186557700","151.101.194.187","172.20.40.110","TCP","104","[TCP Retransmission] 443  >  50060 [PSH, ACK] Seq=2682 Ack=73852 Win=3645 Len=50"
"111","16.186616600","172.20.40.110","151.101.194.187","TCP","66","50060  >  443 [ACK] Seq=73852 Ack=2732 Win=253 Len=0 SLE=2682 SRE=2732"
"112","16.235115700","172.20.40.110","151.101.194.187","TLSv1.2","2915","Application Data"
"113","16.246879000","172.20.40.110","151.101.194.187","TLSv1.2","2932","Application Data"
"114","16.247043500","151.101.194.187","172.20.40.110","TCP","60","443  >  50060 [ACK] Seq=2732 Ack=76713 Win=3656 Len=0"
"115","16.252632700","151.101.194.187","172.20.40.110","TLSv1.2","125","Application Data"
"116","16.255822500","151.101.194.187","172.20.40.110","TCP","60","443  >  50060 [ACK] Seq=2803 Ack=79591 Win=3667 Len=0"
"117","16.261077400","151.101.194.187","172.20.40.110","TLSv1.2","130","Application Data"
"118","16.261157800","172.20.40.110","151.101.194.187","TCP","54","50060  >  443 [ACK] Seq=79591 Ack=2879 Win=253 Len=0"
"119","16.277065700","172.20.40.110","151.101.194.187","TLSv1.2","2932","Application Data"
"120","16.285780800","151.101.194.187","172.20.40.110","TCP","60","443  >  50060 [ACK] Seq=2879 Ack=82469 Win=3679 Len=0"
"121","16.292425200","151.101.194.187","172.20.40.110","TLSv1.2","125","Application Data"
"122","16.335106900","172.20.40.110","151.101.194.187","TCP","54","50060  >  443 [ACK] Seq=82469 Ack=2950 Win=258 Len=0"
"123","16.338948800","151.101.194.187","172.20.40.110","TCP","125","[TCP Spurious Retransmission] 443  >  50060 [PSH, ACK] Seq=2879 Ack=82469 Win=3679 Len=71"
"124","16.339004800","172.20.40.110","151.101.194.187","TCP","66","[TCP Dup ACK 122#1] 50060  >  443 [ACK] Seq=82469 Ack=2950 Win=258 Len=0 SLE=2879 SRE=2950"
"125","16.356783500","172.20.40.110","151.101.194.187","TLSv1.2","2919","Application Data"
"126","16.366142500","151.101.194.187","172.20.40.110","TCP","60","443  >  50060 [ACK] Seq=2950 Ack=85334 Win=3690 Len=0"
"127","16.372685000","151.101.194.187","172.20.40.110","TLSv1.2","124","Application Data"
"128","16.419670600","172.20.40.110","151.101.194.187","TCP","54","50060  >  443 [ACK] Seq=85334 Ack=3020 Win=258 Len=0"
"129","16.423094700","151.101.194.187","172.20.40.110","TCP","124","[TCP Spurious Retransmission] 443  >  50060 [PSH, ACK] Seq=2950 Ack=85334 Win=3690 Len=70"
"130","16.423184400","172.20.40.110","151.101.194.187","TCP","66","[TCP Dup ACK 128#1] 50060  >  443 [ACK] Seq=85334 Ack=3020 Win=258 Len=0 SLE=2950 SRE=3020"
"131","16.432924600","172.20.40.110","151.101.194.187","TLSv1.2","2918","Application Data"
"132","16.438825200","172.20.40.110","151.101.194.187","TLSv1.2","2919","Application Data"
"133","16.439079900","172.20.40.110","151.101.194.187","TLSv1.2","2921","Application Data"
"134","16.439259300","172.20.40.110","151.101.194.187","TLSv1.2","2920","Application Data"
"135","16.439423400","172.20.40.110","151.101.194.187","TLSv1.2","2917","Application Data"
"136","16.442835200","172.20.40.110","151.101.194.187","TLSv1.2","2922","Application Data"
"137","16.452653700","151.101.194.187","172.20.40.110","TCP","60","443  >  50060 [ACK] Seq=3020 Ack=88198 Win=3701 Len=0"
"138","16.452653700","151.101.194.187","172.20.40.110","TLSv1.2","130","Application Data"
"139","16.459190800","151.101.194.187","172.20.40.110","TCP","60","443  >  50060 [ACK] Seq=3096 Ack=91063 Win=3712 Len=0"
"140","16.459190800","151.101.194.187","172.20.40.110","TCP","60","443  >  50060 [ACK] Seq=3096 Ack=93930 Win=3723 Len=0"
"141","16.459190800","151.101.194.187","172.20.40.110","TCP","60","443  >  50060 [ACK] Seq=3096 Ack=96796 Win=3735 Len=0"
"142","16.459190800","151.101.194.187","172.20.40.110","TCP","60","443  >  50060 [ACK] Seq=3096 Ack=99659 Win=3746 Len=0"
"143","16.461342100","151.101.194.187","172.20.40.110","TCP","60","443  >  50060 [ACK] Seq=3096 Ack=102527 Win=3757 Len=0"
"144","16.465331000","151.101.194.187","172.20.40.110","TLSv1.2","251","Application Data"
"145","16.465331000","151.101.194.187","172.20.40.110","TLSv1.2","125","Application Data"
"146","16.465331000","151.101.194.187","172.20.40.110","TLSv1.2","98","Application Data"
"147","16.465331000","151.101.194.187","172.20.40.110","TLSv1.2","124","Application Data"
"148","16.465769400","172.20.40.110","151.101.194.187","TCP","54","50060  >  443 [ACK] Seq=102527 Ack=3478 Win=256 Len=0"
"149","16.466271500","151.101.194.187","172.20.40.110","TLSv1.2","147","Application Data"
"150","16.466441500","172.20.40.110","151.101.194.187","TCP","54","50060  >  443 [ACK] Seq=102527 Ack=3571 Win=256 Len=0"
"151","16.608550600","172.20.40.110","151.101.194.187","TLSv1.2","2889","Application Data"
"152","16.608848700","172.20.40.110","151.101.194.187","TLSv1.2","2908","Application Data"
"153","16.609084600","172.20.40.110","151.101.194.187","TLSv1.2","2883","Application Data"
"154","16.623289000","151.101.194.187","172.20.40.110","TCP","60","443  >  50060 [ACK] Seq=3571 Ack=103907 Win=3763 Len=0"
"155","16.623289000","151.101.194.187","172.20.40.110","TCP","60","443  >  50060 [ACK] Seq=3571 Ack=105362 Win=3769 Len=0"
"156","16.623289000","151.101.194.187","172.20.40.110","TCP","60","443  >  50060 [ACK] Seq=3571 Ack=108216 Win=3780 Len=0"
"157","16.623289000","151.101.194.187","172.20.40.110","TCP","60","443  >  50060 [ACK] Seq=3571 Ack=111045 Win=3791 Len=0"
"158","16.627697300","151.101.194.187","172.20.40.110","TLSv1.2","241","Application Data"
"159","16.628701300","151.101.194.187","172.20.40.110","TLSv1.2","191","Application Data"
"160","16.628701300","151.101.194.187","172.20.40.110","TLSv1.2","130","Application Data"
"161","16.628811700","172.20.40.110","151.101.194.187","TCP","54","50060  >  443 [ACK] Seq=111045 Ack=3971 Win=254 Len=0"
"162","20.538829900","172.20.40.110","151.101.194.187","TLSv1.2","2953","Application Data"
"163","20.550238100","151.101.194.187","172.20.40.110","TCP","60","443  >  50060 [ACK] Seq=3971 Ack=113944 Win=3802 Len=0"
"164","20.551590200","151.101.194.187","172.20.40.110","TLSv1.2","214","Application Data"
"165","20.589477200","151.101.194.187","172.20.40.110","TCP","214","[TCP Retransmission] 443  >  50060 [PSH, ACK] Seq=3971 Ack=113944 Win=3802 Len=160"
"166","20.589536200","172.20.40.110","151.101.194.187","TCP","66","50060  >  443 [ACK] Seq=113944 Ack=4131 Win=254 Len=0 SLE=3971 SRE=4131"
"167","20.599776600","172.20.40.110","151.101.194.187","TLSv1.2","2954","Application Data"
"168","20.609901400","151.101.194.187","172.20.40.110","TCP","60","443  >  50060 [ACK] Seq=4131 Ack=116844 Win=3814 Len=0"
"169","20.612099200","151.101.194.187","172.20.40.110","TLSv1.2","241","Application Data"
"170","20.647556800","151.101.194.187","172.20.40.110","TCP","241","[TCP Retransmission] 443  >  50060 [PSH, ACK] Seq=4131 Ack=116844 Win=3814 Len=187"
"171","20.647703600","172.20.40.110","151.101.194.187","TCP","66","50060  >  443 [ACK] Seq=116844 Ack=4318 Win=253 Len=0 SLE=4131 SRE=4318"
"172","20.654325600","172.20.40.110","151.101.194.187","TLSv1.2","2953","Application Data"
"173","20.665704700","151.101.194.187","172.20.40.110","TCP","60","443  >  50060 [ACK] Seq=4318 Ack=119743 Win=3825 Len=0"
"174","20.668677000","151.101.194.187","172.20.40.110","TLSv1.2","130","Application Data"
"175","20.704433000","151.101.194.187","172.20.40.110","TCP","130","[TCP Retransmission] 443  >  50060 [PSH, ACK] Seq=4318 Ack=119743 Win=3825 Len=76"
"176","20.704533400","172.20.40.110","151.101.194.187","TCP","66","50060  >  443 [ACK] Seq=119743 Ack=4394 Win=258 Len=0 SLE=4318 SRE=4394"
"177","22.087379600","172.20.40.110","151.101.194.187","TLSv1.2","2939","Application Data"
"178","22.099734400","151.101.194.187","172.20.40.110","TCP","60","443  >  50060 [ACK] Seq=4394 Ack=122628 Win=3836 Len=0"
"179","22.101088300","151.101.194.187","172.20.40.110","TLSv1.2","240","Application Data"
"180","22.138100500","151.101.194.187","172.20.40.110","TCP","240","[TCP Retransmission] 443  >  50060 [PSH, ACK] Seq=4394 Ack=122628 Win=3836 Len=186"
"181","22.138162900","172.20.40.110","151.101.194.187","TCP","66","50060  >  443 [ACK] Seq=122628 Ack=4580 Win=258 Len=0 SLE=4394 SRE=4580"
"182","22.181224800","172.20.40.110","151.101.194.187","TLSv1.2","2942","Application Data"
"183","22.198244800","151.101.194.187","172.20.40.110","TCP","60","443  >  50060 [ACK] Seq=4580 Ack=125516 Win=3847 Len=0"
"184","22.200321000","151.101.194.187","172.20.40.110","TLSv1.2","257","Application Data"
"185","22.211602500","172.20.40.110","151.101.194.187","TLSv1.2","2944","Application Data"
"186","22.221168400","151.101.194.187","172.20.40.110","TCP","60","443  >  50060 [ACK] Seq=4783 Ack=128406 Win=3847 Len=0"
"187","22.229077700","151.101.194.187","172.20.40.110","TLSv1.2","152","Application Data"
"188","22.264591900","151.101.194.187","172.20.40.110","TCP","152","[TCP Retransmission] 443  >  50060 [PSH, ACK] Seq=4783 Ack=128406 Win=3847 Len=98"
"189","22.264654000","172.20.40.110","151.101.194.187","TCP","66","50060  >  443 [ACK] Seq=128406 Ack=4881 Win=256 Len=0 SLE=4783 SRE=4881"
"190","24.958672900","172.20.40.110","151.101.194.187","TLSv1.2","2959","Application Data"
"191","24.966066500","172.20.40.110","151.101.194.187","TLSv1.2","2950","Application Data"
"192","24.966287400","172.20.40.110","151.101.194.187","TLSv1.2","2944","Application Data"
"193","24.968228100","151.101.194.187","172.20.40.110","TCP","60","443  >  50060 [ACK] Seq=4881 Ack=131311 Win=3847 Len=0"
"194","24.973433000","151.101.194.187","172.20.40.110","TLSv1.2","214","Application Data"
"195","24.981364500","151.101.194.187","172.20.40.110","TCP","60","443  >  50060 [ACK] Seq=5041 Ack=134207 Win=3847 Len=0"
"196","24.981364500","151.101.194.187","172.20.40.110","TCP","60","443  >  50060 [ACK] Seq=5041 Ack=137097 Win=3847 Len=0"
"197","24.982512100","151.101.194.187","172.20.40.110","TLSv1.2","130","Application Data"
"198","24.982512100","151.101.194.187","172.20.40.110","TLSv1.2","185","Application Data"
"199","24.982560600","172.20.40.110","151.101.194.187","TCP","54","50060  >  443 [ACK] Seq=137097 Ack=5248 Win=255 Len=0"
"200","25.023127000","172.20.40.110","151.101.194.187","TLSv1.2","2944","Application Data"
"201","25.034681900","151.101.194.187","172.20.40.110","TCP","60","443  >  50060 [ACK] Seq=5248 Ack=139987 Win=3847 Len=0"
"202","25.037090800","151.101.194.187","172.20.40.110","TLSv1.2","104","Application Data"
"203","25.075739100","151.101.194.187","172.20.40.110","TCP","104","[TCP Retransmission] 443  >  50060 [PSH, ACK] Seq=5248 Ack=139987 Win=3847 Len=50"
"204","25.075810400","172.20.40.110","151.101.194.187","TCP","66","50060  >  443 [ACK] Seq=139987 Ack=5298 Win=255 Len=0 SLE=5248 SRE=5298"
"205","25.164086500","172.20.40.110","151.101.194.187","TLSv1.2","2941","Application Data"
"206","25.174989600","151.101.194.187","172.20.40.110","TCP","60","443  >  50060 [ACK] Seq=5298 Ack=142874 Win=3847 Len=0"
"207","25.176618800","172.20.40.110","151.101.194.187","TLSv1.2","2958","Application Data"
"208","25.179463300","151.101.194.187","172.20.40.110","TLSv1.2","125","Application Data"
"209","25.186072700","151.101.194.187","172.20.40.110","TCP","60","443  >  50060 [ACK] Seq=5369 Ack=145778 Win=3847 Len=0"
"210","25.189630100","151.101.194.187","172.20.40.110","TLSv1.2","130","Application Data"
"211","25.189711100","172.20.40.110","151.101.194.187","TCP","54","50060  >  443 [ACK] Seq=145778 Ack=5445 Win=254 Len=0"
"212","25.209076800","172.20.40.110","151.101.194.187","TLSv1.2","2958","Application Data"
"213","25.218368800","151.101.194.187","172.20.40.110","TCP","60","443  >  50060 [ACK] Seq=5445 Ack=148682 Win=3847 Len=0"
"214","25.223751400","151.101.194.187","172.20.40.110","TLSv1.2","125","Application Data"
"215","25.261734800","151.101.194.187","172.20.40.110","TCP","125","[TCP Retransmission] 443  >  50060 [PSH, ACK] Seq=5445 Ack=148682 Win=3847 Len=71"
"216","25.261794600","172.20.40.110","151.101.194.187","TCP","66","50060  >  443 [ACK] Seq=148682 Ack=5516 Win=254 Len=0 SLE=5445 SRE=5516"
"217","25.384820400","172.20.40.110","151.101.194.187","TLSv1.2","2952","Application Data"
"218","25.385453700","172.20.40.110","151.101.194.187","TLSv1.2","2950","Application Data"
"219","25.386297500","172.20.40.110","151.101.194.187","TLSv1.2","2941","Application Data"
"220","25.398828200","151.101.194.187","172.20.40.110","TCP","60","443  >  50060 [ACK] Seq=5516 Ack=151580 Win=3847 Len=0"
"221","25.398828200","151.101.194.187","172.20.40.110","TCP","60","443  >  50060 [ACK] Seq=5516 Ack=154476 Win=3847 Len=0"
"222","25.403865000","151.101.194.187","172.20.40.110","TCP","60","443  >  50060 [ACK] Seq=5516 Ack=157363 Win=3853 Len=0"
"223","25.403865000","151.101.194.187","172.20.40.110","TLSv1.2","130","Application Data"
"224","25.403865000","151.101.194.187","172.20.40.110","TLSv1.2","131","Application Data"
"225","25.403865000","151.101.194.187","172.20.40.110","TLSv1.2","130","Application Data"
"226","25.403966800","172.20.40.110","151.101.194.187","TCP","54","50060  >  443 [ACK] Seq=157363 Ack=5745 Win=253 Len=0"
"227","25.529251600","172.20.40.110","151.101.194.187","TLSv1.2","2947","Application Data"
"228","25.529513700","172.20.40.110","151.101.194.187","TLSv1.2","2943","Application Data"
"229","25.529690900","172.20.40.110","151.101.194.187","TLSv1.2","2944","Application Data"
"230","25.529869200","172.20.40.110","151.101.194.187","TLSv1.2","2946","Application Data"
"231","25.530298200","172.20.40.110","151.101.194.187","TLSv1.2","2945","Application Data"
"232","25.530491300","172.20.40.110","151.101.194.187","TLSv1.2","2942","Application Data"
"233","25.553801500","151.101.194.187","172.20.40.110","TCP","60","443  >  50060 [ACK] Seq=5745 Ack=160256 Win=3853 Len=0"
"234","25.553801500","151.101.194.187","172.20.40.110","TCP","60","443  >  50060 [ACK] Seq=5745 Ack=163145 Win=3853 Len=0"
"235","25.553801500","151.101.194.187","172.20.40.110","TCP","60","443  >  50060 [ACK] Seq=5745 Ack=166035 Win=3853 Len=0"
"236","25.553801500","151.101.194.187","172.20.40.110","TCP","60","443  >  50060 [ACK] Seq=5745 Ack=168927 Win=3853 Len=0"
"237","25.553801500","151.101.194.187","172.20.40.110","TCP","60","443  >  50060 [ACK] Seq=5745 Ack=171818 Win=3853 Len=0"
"238","25.557480200","151.101.194.187","172.20.40.110","TCP","60","443  >  50060 [ACK] Seq=5745 Ack=174706 Win=3853 Len=0"
"239","25.557480200","151.101.194.187","172.20.40.110","TLSv1.2","125","Application Data"
"240","25.557480200","151.101.194.187","172.20.40.110","TLSv1.2","194","Application Data, Application Data"
"241","25.557480200","151.101.194.187","172.20.40.110","TLSv1.2","125","Application Data"
"242","25.557480200","151.101.194.187","172.20.40.110","TLSv1.2","305","Application Data"
"243","25.557594800","172.20.40.110","151.101.194.187","TCP","54","50060  >  443 [ACK] Seq=174706 Ack=6278 Win=258 Len=0"
"244","32.748058400","172.20.40.110","151.101.194.187","TLSv1.2","2962","Application Data"
"245","32.758892600","151.101.194.187","172.20.40.110","TCP","60","443  >  50060 [ACK] Seq=6278 Ack=177614 Win=3853 Len=0"
"246","32.763325700","151.101.194.187","172.20.40.110","TLSv1.2","236","Application Data"
"247","32.783348400","172.20.40.110","151.101.194.187","TLSv1.2","2963","Application Data"
"248","32.795842100","151.101.194.187","172.20.40.110","TCP","60","443  >  50060 [ACK] Seq=6460 Ack=180523 Win=3853 Len=0"
"249","32.796955400","151.101.194.187","172.20.40.110","TLSv1.2","125","Application Data"
"250","32.834640400","151.101.194.187","172.20.40.110","TCP","125","[TCP Retransmission] 443  >  50060 [PSH, ACK] Seq=6460 Ack=180523 Win=3853 Len=71"
"251","32.834708100","172.20.40.110","151.101.194.187","TCP","66","50060  >  443 [ACK] Seq=180523 Ack=6531 Win=257 Len=0 SLE=6460 SRE=6531"
"252","39.377042900","172.20.40.110","151.101.194.187","TLSv1.2","2948","Application Data"
"253","39.387876600","151.101.194.187","172.20.40.110","TCP","60","443  >  50060 [ACK] Seq=6531 Ack=183417 Win=3853 Len=0"
"254","39.392012700","151.101.194.187","172.20.40.110","TLSv1.2","301","Application Data"
"255","39.430503000","151.101.194.187","172.20.40.110","TCP","301","[TCP Retransmission] 443  >  50060 [PSH, ACK] Seq=6531 Ack=183417 Win=3853 Len=247"
"256","39.430568200","172.20.40.110","151.101.194.187","TCP","66","50060  >  443 [ACK] Seq=183417 Ack=6778 Win=256 Len=0 SLE=6531 SRE=6778"
"257","39.478795800","172.20.40.110","151.101.194.187","TLSv1.2","2951","Application Data"
"258","39.487894400","151.101.194.187","172.20.40.110","TCP","60","443  >  50060 [ACK] Seq=6778 Ack=186314 Win=3853 Len=0"
"259","39.491101800","151.101.194.187","172.20.40.110","TLSv1.2","130","Application Data"
"260","39.516842600","172.20.40.110","151.101.194.187","TLSv1.2","2953","Application Data"
"261","39.527784200","151.101.194.187","172.20.40.110","TCP","60","443  >  50060 [ACK] Seq=6854 Ack=189213 Win=3853 Len=0"
"262","39.530376300","151.101.194.187","172.20.40.110","TLSv1.2","130","Application Data"
"263","39.573710100","151.101.194.187","172.20.40.110","TCP","130","[TCP Retransmission] 443  >  50060 [PSH, ACK] Seq=6854 Ack=189213 Win=3853 Len=76"
"264","39.573767900","172.20.40.110","151.101.194.187","TCP","66","50060  >  443 [ACK] Seq=189213 Ack=6930 Win=256 Len=0 SLE=6854 SRE=6930"
"265","43.670307800","172.20.40.110","151.101.194.187","TLSv1.2","3004","Application Data"
"266","43.678909900","151.101.194.187","172.20.40.110","TCP","60","443  >  50060 [ACK] Seq=6930 Ack=192163 Win=3865 Len=0"
"267","44.351274300","151.101.194.187","172.20.40.110","TLSv1.2","360","Application Data"
"268","44.351274300","151.101.194.187","172.20.40.110","TCP","5574","443  >  50060 [PSH, ACK] Seq=7236 Ack=192163 Win=3865 Len=5520 [TCP PDU reassembled in 270]"
"269","44.351716900","172.20.40.110","151.101.194.187","TCP","54","50060  >  443 [ACK] Seq=192163 Ack=12756 Win=258 Len=0"
"270","44.356006300","151.101.194.187","172.20.40.110","TLSv1.2","1135","Application Data"
"271","44.356006300","151.101.194.187","172.20.40.110","TCP","1434","443  >  50060 [ACK] Seq=13837 Ack=192163 Win=3865 Len=1380 [TCP PDU reassembled in 272]"
"272","44.356006300","151.101.194.187","172.20.40.110","TLSv1.2","327","Application Data"
"273","44.356006300","151.101.194.187","172.20.40.110","TCP","1434","443  >  50060 [ACK] Seq=15490 Ack=192163 Win=3865 Len=1380 [TCP PDU reassembled in 281]"
"274","44.356006300","151.101.194.187","172.20.40.110","TCP","1434","443  >  50060 [ACK] Seq=16870 Ack=192163 Win=3865 Len=1380 [TCP PDU reassembled in 281]"
"275","44.356123700","172.20.40.110","151.101.194.187","TCP","54","50060  >  443 [ACK] Seq=192163 Ack=18250 Win=258 Len=0"
"276","44.358205000","172.20.40.110","151.101.194.187","TLSv1.2","89","Application Data"
"277","44.358477400","151.101.194.187","172.20.40.110","TCP","5574","443  >  50060 [PSH, ACK] Seq=18250 Ack=192163 Win=3865 Len=5520 [TCP PDU reassembled in 281]"
"278","44.358588400","172.20.40.110","151.101.194.187","TCP","54","50060  >  443 [ACK] Seq=192198 Ack=23770 Win=258 Len=0"
"279","44.360845300","151.101.194.187","172.20.40.110","TCP","5574","443  >  50060 [PSH, ACK] Seq=23770 Ack=192163 Win=3865 Len=5520 [TCP PDU reassembled in 281]"
"280","44.360963000","172.20.40.110","151.101.194.187","TCP","54","50060  >  443 [ACK] Seq=192198 Ack=29290 Win=258 Len=0"
"281","44.363147900","151.101.194.187","172.20.40.110","TLSv1.2","5574","Application Data, Application Data"
"282","44.363268900","172.20.40.110","151.101.194.187","TCP","54","50060  >  443 [ACK] Seq=192198 Ack=34810 Win=258 Len=0"
"283","44.366847400","151.101.194.187","172.20.40.110","TCP","5574","443  >  50060 [PSH, ACK] Seq=34810 Ack=192163 Win=3865 Len=5520 [TCP PDU reassembled in 288]"
"284","44.366948800","172.20.40.110","151.101.194.187","TCP","54","50060  >  443 [ACK] Seq=192198 Ack=40330 Win=258 Len=0"
"285","44.370506300","151.101.194.187","172.20.40.110","TCP","5574","443  >  50060 [PSH, ACK] Seq=40330 Ack=192163 Win=3865 Len=5520 [TCP PDU reassembled in 288]"
"286","44.370590400","172.20.40.110","151.101.194.187","TCP","54","50060  >  443 [ACK] Seq=192198 Ack=45850 Win=258 Len=0"
"287","44.373622900","151.101.194.187","172.20.40.110","TCP","1434","443  >  50060 [ACK] Seq=45850 Ack=192163 Win=3865 Len=1380 [TCP PDU reassembled in 288]"
"288","44.373622900","151.101.194.187","172.20.40.110","TLSv1.2","954","Application Data"
"289","44.373622900","151.101.194.187","172.20.40.110","TCP","4194","443  >  50060 [ACK] Seq=48130 Ack=192163 Win=3865 Len=4140 [TCP PDU reassembled in 291]"
"290","44.373725000","172.20.40.110","151.101.194.187","TCP","54","50060  >  443 [ACK] Seq=192198 Ack=52270 Win=258 Len=0"
"291","44.376568000","151.101.194.187","172.20.40.110","TLSv1.2","558","Application Data"
"292","44.376568000","151.101.194.187","172.20.40.110","TCP","2814","443  >  50060 [ACK] Seq=52774 Ack=192163 Win=3865 Len=2760 [TCP PDU reassembled in 293]"
"293","44.376568000","151.101.194.187","172.20.40.110","TLSv1.2","1174","Application Data"
"294","44.376568000","151.101.194.187","172.20.40.110","TCP","1434","443  >  50060 [ACK] Seq=56654 Ack=192163 Win=3865 Len=1380 [TCP PDU reassembled in 297]"
"295","44.376669500","172.20.40.110","151.101.194.187","TCP","54","50060  >  443 [ACK] Seq=192198 Ack=58034 Win=258 Len=0"
"296","44.379386700","151.101.194.187","172.20.40.110","TCP","2814","443  >  50060 [ACK] Seq=58034 Ack=192163 Win=3865 Len=2760 [TCP PDU reassembled in 297]"
"297","44.379386700","151.101.194.187","172.20.40.110","TLSv1.2","266","Application Data"
"298","44.379386700","151.101.194.187","172.20.40.110","TCP","1434","443  >  50060 [ACK] Seq=61006 Ack=192163 Win=3865 Len=1380 [TCP PDU reassembled in 299]"
"299","44.379386700","151.101.194.187","172.20.40.110","TLSv1.2","830","Application Data"
"300","44.379386700","151.101.194.187","172.20.40.110","TLSv1.2","426","Application Data"
"301","44.379386700","151.101.194.187","172.20.40.110","TLSv1.2","85","Application Data"
"302","44.379386700","151.101.194.187","172.20.40.110","TCP","60","443  >  50060 [ACK] Seq=63565 Ack=192198 Win=3865 Len=0"
"303","44.379511000","172.20.40.110","151.101.194.187","TCP","54","50060  >  443 [ACK] Seq=192198 Ack=63565 Win=258 Len=0"
"304","44.662572800","172.20.40.110","151.101.194.187","TLSv1.2","2942","Application Data"
"305","44.670278300","172.20.40.110","151.101.194.187","TLSv1.2","2957","Application Data"
"306","44.674414400","151.101.194.187","172.20.40.110","TCP","60","443  >  50060 [ACK] Seq=63565 Ack=195086 Win=3865 Len=0"
"307","44.675069600","172.20.40.110","151.101.194.187","TLSv1.2","2946","Application Data"
"308","44.676876800","151.101.194.187","172.20.40.110","TLSv1.2","214","Application Data"
"309","44.680372300","151.101.194.187","172.20.40.110","TCP","60","443  >  50060 [ACK] Seq=63725 Ack=197989 Win=3865 Len=0"
"310","44.684713600","151.101.194.187","172.20.40.110","TLSv1.2","231","Application Data"
"311","44.684794100","172.20.40.110","151.101.194.187","TCP","54","50060  >  443 [ACK] Seq=200881 Ack=63902 Win=257 Len=0"
"312","44.686189100","151.101.194.187","172.20.40.110","TCP","60","443  >  50060 [ACK] Seq=63902 Ack=200881 Win=3865 Len=0"
"313","44.689198300","151.101.194.187","172.20.40.110","TLSv1.2","125","Application Data"
"314","44.707004600","172.20.40.110","151.101.194.187","TLSv1.2","2948","Application Data"
"315","44.707280400","172.20.40.110","151.101.194.187","TLSv1.2","2942","Application Data"
"316","44.707901500","172.20.40.110","151.101.194.187","TLSv1.2","2950","Application Data"
"317","44.712171700","172.20.40.110","151.101.194.187","TLSv1.2","2948","Application Data"
"318","44.712464100","172.20.40.110","151.101.194.187","TLSv1.2","2956","Application Data"
"319","44.713976800","172.20.40.110","151.101.194.187","TLSv1.2","2945","Application Data"
"320","44.714925300","172.20.40.110","151.101.194.187","TLSv1.2","2942","Application Data"
"321","44.735236900","151.101.194.187","172.20.40.110","TCP","60","443  >  50060 [ACK] Seq=63973 Ack=203775 Win=3870 Len=0"
"322","44.735236900","151.101.194.187","172.20.40.110","TCP","60","443  >  50060 [ACK] Seq=63973 Ack=206663 Win=3870 Len=0"
"323","44.735236900","151.101.194.187","172.20.40.110","TCP","60","443  >  50060 [ACK] Seq=63973 Ack=209559 Win=3870 Len=0"
"324","44.735236900","151.101.194.187","172.20.40.110","TCP","60","443  >  50060 [ACK] Seq=63973 Ack=212453 Win=3870 Len=0"
"325","44.735236900","151.101.194.187","172.20.40.110","TCP","60","443  >  50060 [ACK] Seq=63973 Ack=215355 Win=3870 Len=0"
"326","44.735236900","151.101.194.187","172.20.40.110","TCP","60","443  >  50060 [ACK] Seq=63973 Ack=218246 Win=3870 Len=0"
"327","44.739591700","151.101.194.187","172.20.40.110","TCP","60","443  >  50060 [ACK] Seq=63973 Ack=221134 Win=3870 Len=0"
"328","44.739591700","151.101.194.187","172.20.40.110","TLSv1.2","152","Application Data"
"329","44.743447600","172.20.40.110","151.101.194.187","TLSv1.2","2946","Application Data"
"330","44.747624600","151.101.194.187","172.20.40.110","TLSv1.2","130","Application Data"
"331","44.747624600","151.101.194.187","172.20.40.110","TLSv1.2","131","Application Data"
"332","44.747624600","151.101.194.187","172.20.40.110","TLSv1.2","185","Application Data"
"333","44.747624600","151.101.194.187","172.20.40.110","TLSv1.2","124","Application Data"
"334","44.747624600","151.101.194.187","172.20.40.110","TLSv1.2","130","Application Data"
"335","44.747624600","151.101.194.187","172.20.40.110","TLSv1.2","131","Application Data"
"336","44.747754300","172.20.40.110","151.101.194.187","TCP","54","50060  >  443 [ACK] Seq=224026 Ack=64578 Win=254 Len=0"
"337","44.752523400","151.101.194.187","172.20.40.110","TCP","60","443  >  50060 [ACK] Seq=64578 Ack=224026 Win=3870 Len=0"
"338","44.759118500","151.101.194.187","172.20.40.110","TLSv1.2","124","Application Data"
"339","44.799697800","172.20.40.110","151.101.194.187","TCP","54","50060  >  443 [ACK] Seq=224026 Ack=64648 Win=254 Len=0"
"340","44.805796300","172.20.40.110","151.101.194.187","TLSv1.2","2940","Application Data"
"341","44.816464800","151.101.194.187","172.20.40.110","TCP","60","443  >  50060 [ACK] Seq=64648 Ack=226912 Win=3870 Len=0"
"342","44.819881600","151.101.194.187","172.20.40.110","TLSv1.2","126","Application Data"
"343","44.860825300","172.20.40.110","151.101.194.187","TCP","54","50060  >  443 [ACK] Seq=226912 Ack=64720 Win=254 Len=0"
"344","44.875711400","172.20.40.110","151.101.194.187","TLSv1.2","2940","Application Data"
"345","44.880835400","172.20.40.110","151.101.194.187","TLSv1.2","2938","Application Data"
"346","44.890285800","151.101.194.187","172.20.40.110","TCP","60","443  >  50060 [ACK] Seq=64720 Ack=229798 Win=3870 Len=0"
"347","44.893692700","151.101.194.187","172.20.40.110","TCP","60","443  >  50060 [ACK] Seq=64720 Ack=232682 Win=3876 Len=0"
"348","44.897292900","151.101.194.187","172.20.40.110","TLSv1.2","130","Application Data"
"349","44.908510700","151.101.194.187","172.20.40.110","TLSv1.2","130","Application Data"
"350","44.908754500","172.20.40.110","151.101.194.187","TCP","54","50060  >  443 [ACK] Seq=232682 Ack=64872 Win=253 Len=0"
"351","44.918642900","172.20.40.110","151.101.194.187","TLSv1.2","2940","Application Data"
"352","44.928052300","151.101.194.187","172.20.40.110","TCP","60","443  >  50060 [ACK] Seq=64872 Ack=235568 Win=3876 Len=0"
"353","44.932421200","151.101.194.187","172.20.40.110","TLSv1.2","124","Application Data"
"354","44.980923100","172.20.40.110","151.101.194.187","TCP","54","50060  >  443 [ACK] Seq=235568 Ack=64942 Win=253 Len=0"
"355","46.950310000","172.20.40.110","151.101.194.187","TLSv1.2","2952","Application Data"
"356","46.950563500","172.20.40.110","151.101.194.187","TLSv1.2","2946","Application Data"
"357","46.962909400","151.101.194.187","172.20.40.110","TCP","60","443  >  50060 [ACK] Seq=64942 Ack=238466 Win=3876 Len=0"
"358","46.962909400","151.101.194.187","172.20.40.110","TCP","60","443  >  50060 [ACK] Seq=64942 Ack=241358 Win=3876 Len=0"
"359","46.967225600","151.101.194.187","172.20.40.110","TLSv1.2","214","Application Data"
"360","46.968301500","151.101.194.187","172.20.40.110","TLSv1.2","104","Application Data"
"361","46.968375800","172.20.40.110","151.101.194.187","TCP","54","50060  >  443 [ACK] Seq=241358 Ack=65152 Win=258 Len=0"
"362","47.269604800","172.20.40.110","151.101.194.187","TLSv1.2","2940","Application Data"
"363","47.276560800","172.20.40.110","151.101.194.187","TLSv1.2","2944","Application Data"
"364","47.290455400","151.101.194.187","172.20.40.110","TCP","60","443  >  50060 [ACK] Seq=65152 Ack=244244 Win=3876 Len=0"
"365","47.290455400","151.101.194.187","172.20.40.110","TLSv1.2","258","Application Data"
"366","47.290455400","151.101.194.187","172.20.40.110","TCP","60","443  >  50060 [ACK] Seq=65356 Ack=247134 Win=3876 Len=0"
"367","47.291711300","151.101.194.187","172.20.40.110","TLSv1.2","152","Application Data"
"368","47.291790200","172.20.40.110","151.101.194.187","TCP","54","50060  >  443 [ACK] Seq=247134 Ack=65454 Win=257 Len=0"
"369","48.453048700","172.20.40.110","151.101.194.187","TLSv1.2","2943","Application Data"
"370","48.463402300","151.101.194.187","172.20.40.110","TCP","60","443  >  50060 [ACK] Seq=65454 Ack=250023 Win=3876 Len=0"
"371","48.469359900","151.101.194.187","172.20.40.110","TLSv1.2","240","Application Data"
"372","48.535645000","151.101.194.187","172.20.40.110","TCP","240","[TCP Retransmission] 443  >  50060 [PSH, ACK] Seq=65454 Ack=250023 Win=3876 Len=186"
"373","48.535700700","172.20.40.110","151.101.194.187","TCP","66","50060  >  443 [ACK] Seq=250023 Ack=65640 Win=256 Len=0 SLE=65454 SRE=65640"
"374","49.738482500","172.20.40.110","151.101.194.187","TLSv1.2","2942","Application Data"
"375","49.751039900","151.101.194.187","172.20.40.110","TCP","60","443  >  50060 [ACK] Seq=65640 Ack=252911 Win=3876 Len=0"
"376","49.751928400","151.101.194.187","172.20.40.110","TLSv1.2","275","Application Data"
"377","49.823899000","151.101.194.187","172.20.40.110","TCP","275","[TCP Retransmission] 443  >  50060 [PSH, ACK] Seq=65640 Ack=252911 Win=3876 Len=221"
"378","49.823952200","172.20.40.110","151.101.194.187","TCP","66","50060  >  443 [ACK] Seq=252911 Ack=65861 Win=255 Len=0 SLE=65640 SRE=65861"
"379","50.747085800","172.20.40.110","151.101.194.187","TLSv1.2","2948","Application Data"
"380","50.750421800","172.20.40.110","151.101.194.187","TLSv1.2","2942","Application Data"
"381","50.752921400","172.20.40.110","151.101.194.187","TLSv1.2","2950","Application Data"
"382","50.755379100","172.20.40.110","151.101.194.187","TLSv1.2","2944","Application Data"
"383","50.757708000","172.20.40.110","151.101.194.187","TLSv1.2","2944","Application Data"
"384","50.757966200","172.20.40.110","151.101.194.187","TLSv1.2","2944","Application Data"
"385","50.767222200","151.101.194.187","172.20.40.110","TCP","60","443  >  50060 [ACK] Seq=65861 Ack=255805 Win=3876 Len=0"
"386","50.771388500","151.101.194.187","172.20.40.110","TCP","60","443  >  50060 [ACK] Seq=65861 Ack=258565 Win=3887 Len=0"
"387","50.776538700","172.20.40.110","151.101.194.187","TLSv1.2","2944","Application Data"
"388","50.779872100","151.101.194.187","172.20.40.110","TLSv1.2","214","Application Data"
"389","50.783862300","151.101.194.187","172.20.40.110","TCP","60","443  >  50060 [ACK] Seq=66021 Ack=258693 Win=3887 Len=0"
"390","50.783862300","151.101.194.187","172.20.40.110","TCP","60","443  >  50060 [ACK] Seq=66021 Ack=261589 Win=3887 Len=0"
"391","50.783862300","151.101.194.187","172.20.40.110","TCP","60","443  >  50060 [ACK] Seq=66021 Ack=264479 Win=3887 Len=0"
"392","50.783862300","151.101.194.187","172.20.40.110","TCP","60","443  >  50060 [ACK] Seq=66021 Ack=267369 Win=3887 Len=0"
"393","50.784915600","151.101.194.187","172.20.40.110","TCP","60","443  >  50060 [ACK] Seq=66021 Ack=270129 Win=3898 Len=0"
"394","50.786306700","151.101.194.187","172.20.40.110","TCP","60","443  >  50060 [ACK] Seq=66021 Ack=270259 Win=3898 Len=0"
"395","50.786306700","151.101.194.187","172.20.40.110","TCP","60","443  >  50060 [ACK] Seq=66021 Ack=273149 Win=3898 Len=0"
"396","50.787487600","151.101.194.187","172.20.40.110","TLSv1.2","104","Application Data"
"397","50.787487600","151.101.194.187","172.20.40.110","TLSv1.2","131","Application Data"
"398","50.787573900","172.20.40.110","151.101.194.187","TCP","54","50060  >  443 [ACK] Seq=273149 Ack=66148 Win=254 Len=0"
"399","50.788589800","151.101.194.187","172.20.40.110","TLSv1.2","126","Application Data"
"400","50.788589800","151.101.194.187","172.20.40.110","TLSv1.2","98","Application Data"
"401","50.788664500","172.20.40.110","151.101.194.187","TCP","54","50060  >  443 [ACK] Seq=273149 Ack=66264 Win=254 Len=0"
"402","50.791079600","151.101.194.187","172.20.40.110","TLSv1.2","104","Application Data"
"403","50.791079600","151.101.194.187","172.20.40.110","TLSv1.2","130","Application Data"
"404","50.791179000","172.20.40.110","151.101.194.187","TCP","54","50060  >  443 [ACK] Seq=273149 Ack=66390 Win=253 Len=0"
"405","52.689517000","172.20.40.110","151.101.194.187","TLSv1.2","2948","Application Data"
"406","52.701674600","151.101.194.187","172.20.40.110","TCP","60","443  >  50060 [ACK] Seq=66390 Ack=276043 Win=3898 Len=0"
"407","52.702987900","151.101.194.187","172.20.40.110","TLSv1.2","240","Application Data"
"408","52.758083500","151.101.194.187","172.20.40.110","TCP","240","[TCP Retransmission] 443  >  50060 [PSH, ACK] Seq=66390 Ack=276043 Win=3898 Len=186"
"409","52.758143400","172.20.40.110","151.101.194.187","TCP","66","50060  >  443 [ACK] Seq=276043 Ack=66576 Win=258 Len=0 SLE=66390 SRE=66576"
"410","52.884896200","172.20.40.110","151.101.194.187","TLSv1.2","2939","Application Data"
"411","52.887863400","172.20.40.110","151.101.194.187","TLSv1.2","2942","Application Data"
"412","52.888131200","172.20.40.110","151.101.194.187","TLSv1.2","2942","Application Data"
"413","52.888331300","172.20.40.110","151.101.194.187","TLSv1.2","2949","Application Data"
"414","52.888806800","172.20.40.110","151.101.194.187","TLSv1.2","2948","Application Data"
"415","52.889012800","172.20.40.110","151.101.194.187","TLSv1.2","2945","Application Data"
"416","52.902229300","151.101.194.187","172.20.40.110","TCP","60","443  >  50060 [ACK] Seq=66576 Ack=278928 Win=3898 Len=0"
"417","52.902229300","151.101.194.187","172.20.40.110","TLSv1.2","257","Application Data"
"418","52.909877600","151.101.194.187","172.20.40.110","TCP","60","443  >  50060 [ACK] Seq=66779 Ack=281816 Win=3898 Len=0"
"419","52.909877600","151.101.194.187","172.20.40.110","TCP","60","443  >  50060 [ACK] Seq=66779 Ack=284704 Win=3898 Len=0"
"420","52.911950100","151.101.194.187","172.20.40.110","TLSv1.2","124","Application Data"
"421","52.911950100","151.101.194.187","172.20.40.110","TLSv1.2","153","Application Data"
"422","52.912014000","172.20.40.110","151.101.194.187","TCP","54","50060  >  443 [ACK] Seq=293384 Ack=66948 Win=257 Len=0"
"423","52.912981100","151.101.194.187","172.20.40.110","TCP","60","443  >  50060 [ACK] Seq=66948 Ack=287599 Win=3903 Len=0"
"424","52.912981100","151.101.194.187","172.20.40.110","TCP","60","443  >  50060 [ACK] Seq=66948 Ack=290493 Win=3903 Len=0"
"425","52.912981100","151.101.194.187","172.20.40.110","TCP","60","443  >  50060 [ACK] Seq=66948 Ack=293384 Win=3903 Len=0"
"426","52.916467800","151.101.194.187","172.20.40.110","TLSv1.2","196","Application Data, Application Data"
"427","52.916577300","172.20.40.110","151.101.194.187","TCP","54","50060  >  443 [ACK] Seq=293384 Ack=67090 Win=256 Len=0"
"428","52.919634100","151.101.194.187","172.20.40.110","TLSv1.2","130","Application Data"
"429","52.919731500","172.20.40.110","151.101.194.187","TCP","54","50060  >  443 [ACK] Seq=293384 Ack=67166 Win=256 Len=0"
"430","52.967304700","172.20.40.110","151.101.194.187","TLSv1.2","2942","Application Data"
"431","52.967788100","172.20.40.110","151.101.194.187","TLSv1.2","2948","Application Data"
"432","52.968282700","172.20.40.110","151.101.194.187","TLSv1.2","2941","Application Data"
"433","52.976887900","151.101.194.187","172.20.40.110","TCP","60","443  >  50060 [ACK] Seq=67166 Ack=296272 Win=3903 Len=0"
"434","52.979843800","151.101.194.187","172.20.40.110","TLSv1.2","185","Application Data"
"435","52.984094400","151.101.194.187","172.20.40.110","TCP","60","443  >  50060 [ACK] Seq=67297 Ack=299166 Win=3903 Len=0"
"436","52.984094400","151.101.194.187","172.20.40.110","TCP","60","443  >  50060 [ACK] Seq=67297 Ack=302053 Win=3903 Len=0"
"437","52.986217700","151.101.194.187","172.20.40.110","TLSv1.2","125","Application Data"
"438","52.986293300","172.20.40.110","151.101.194.187","TCP","54","50060  >  443 [ACK] Seq=302053 Ack=67368 Win=255 Len=0"
"439","52.988403300","151.101.194.187","172.20.40.110","TLSv1.2","125","Application Data"
"440","53.036269900","151.101.194.187","172.20.40.110","TCP","125","[TCP Retransmission] 443  >  50060 [PSH, ACK] Seq=67368 Ack=302053 Win=3903 Len=71"
"441","53.036331100","172.20.40.110","151.101.194.187","TCP","66","50060  >  443 [ACK] Seq=302053 Ack=67439 Win=255 Len=0 SLE=67368 SRE=67439"
"442","53.652067200","172.20.40.110","151.101.194.187","TLSv1.2","2957","Application Data"
"443","53.665383400","151.101.194.187","172.20.40.110","TCP","60","443  >  50060 [ACK] Seq=67439 Ack=304956 Win=3903 Len=0"
"444","53.667617100","151.101.194.187","172.20.40.110","TLSv1.2","241","Application Data"
"445","53.709016200","172.20.40.110","151.101.194.187","TLSv1.2","2948","Application Data"
"446","53.709454000","172.20.40.110","151.101.194.187","TLSv1.2","2942","Application Data"
"447","53.711688500","151.101.194.187","172.20.40.110","TCP","241","[TCP Spurious Retransmission] 443  >  50060 [PSH, ACK] Seq=67439 Ack=304956 Win=3903 Len=187"
"448","53.711741900","172.20.40.110","151.101.194.187","TCP","66","[TCP Dup ACK 445#1] 50060  >  443 [ACK] Seq=310738 Ack=67626 Win=254 Len=0 SLE=67439 SRE=67626"
"449","53.718374100","151.101.194.187","172.20.40.110","TCP","60","443  >  50060 [ACK] Seq=67626 Ack=307850 Win=3903 Len=0"
"450","53.720163700","172.20.40.110","151.101.194.187","TLSv1.2","2942","Application Data"
"451","53.721053500","172.20.40.110","151.101.194.187","TLSv1.2","2955","Application Data"
"452","53.727483200","151.101.194.187","172.20.40.110","TCP","60","443  >  50060 [ACK] Seq=67626 Ack=310738 Win=3903 Len=0"
"453","53.727483200","151.101.194.187","172.20.40.110","TLSv1.2","124","Application Data"
"454","53.727483200","151.101.194.187","172.20.40.110","TLSv1.2","130","Application Data"
"455","53.727578500","172.20.40.110","151.101.194.187","TCP","54","50060  >  443 [ACK] Seq=316527 Ack=67772 Win=254 Len=0"
"456","53.732766800","151.101.194.187","172.20.40.110","TCP","60","443  >  50060 [ACK] Seq=67772 Ack=313626 Win=3903 Len=0"
"457","53.732766800","151.101.194.187","172.20.40.110","TCP","60","443  >  50060 [ACK] Seq=67772 Ack=316527 Win=3903 Len=0"
"458","53.737191100","151.101.194.187","172.20.40.110","TLSv1.2","131","Application Data"
"459","53.738225800","151.101.194.187","172.20.40.110","TLSv1.2","124","Application Data"
"460","53.738318200","172.20.40.110","151.101.194.187","TCP","54","50060  >  443 [ACK] Seq=316527 Ack=67919 Win=253 Len=0"
"461","53.863244500","172.20.40.110","151.101.194.187","TLSv1.2","2939","Application Data"
"462","53.874511200","151.101.194.187","172.20.40.110","TCP","60","443  >  50060 [ACK] Seq=67919 Ack=319412 Win=3903 Len=0"
"463","53.876628400","151.101.194.187","172.20.40.110","TLSv1.2","125","Application Data"
"464","53.882184500","172.20.40.110","151.101.194.187","TLSv1.2","2956","Application Data"
"465","53.891894900","151.101.194.187","172.20.40.110","TCP","60","443  >  50060 [ACK] Seq=67990 Ack=322314 Win=3903 Len=0"
"466","53.899290500","151.101.194.187","172.20.40.110","TLSv1.2","130","Application Data"
"467","53.935905000","151.101.194.187","172.20.40.110","TCP","130","[TCP Retransmission] 443  >  50060 [PSH, ACK] Seq=67990 Ack=322314 Win=3903 Len=76"
"468","53.935980200","172.20.40.110","151.101.194.187","TCP","66","50060  >  443 [ACK] Seq=322314 Ack=68066 Win=258 Len=0 SLE=67990 SRE=68066"
"469","53.998708200","172.20.40.110","151.101.194.187","TLSv1.2","2956","Application Data"
"470","54.007283800","151.101.194.187","172.20.40.110","TCP","60","443  >  50060 [ACK] Seq=68066 Ack=325216 Win=3903 Len=0"
"471","54.012530200","151.101.194.187","172.20.40.110","TLSv1.2","169","Application Data"
"472","54.050969500","151.101.194.187","172.20.40.110","TCP","169","[TCP Retransmission] 443  >  50060 [PSH, ACK] Seq=68066 Ack=325216 Win=3903 Len=115"
"473","54.051070000","172.20.40.110","151.101.194.187","TCP","66","50060  >  443 [ACK] Seq=325216 Ack=68181 Win=258 Len=0 SLE=68066 SRE=68181"
"474","54.187545500","172.20.40.110","151.101.194.187","TLSv1.2","2943","Application Data"
"475","54.199688400","151.101.194.187","172.20.40.110","TCP","60","443  >  50060 [ACK] Seq=68181 Ack=328105 Win=3903 Len=0"
"476","54.205789100","151.101.194.187","172.20.40.110","TLSv1.2","213","Application Data"
"477","54.238463200","151.101.194.187","172.20.40.110","TCP","213","[TCP Retransmission] 443  >  50060 [PSH, ACK] Seq=68181 Ack=328105 Win=3903 Len=159"
"478","54.238582500","172.20.40.110","151.101.194.187","TCP","66","50060  >  443 [ACK] Seq=328105 Ack=68340 Win=257 Len=0 SLE=68181 SRE=68340"
"479","54.353568800","172.20.40.110","151.101.194.187","TLSv1.2","2946","Application Data"
"480","54.358636100","172.20.40.110","151.101.194.187","TLSv1.2","2945","Application Data"
"481","54.365085300","151.101.194.187","172.20.40.110","TCP","60","443  >  50060 [ACK] Seq=68340 Ack=330997 Win=3903 Len=0"
"482","54.368917900","151.101.194.187","172.20.40.110","TCP","60","443  >  50060 [ACK] Seq=68340 Ack=333888 Win=3903 Len=0"
"483","54.370385000","151.101.194.187","172.20.40.110","TLSv1.2","125","Application Data"
"484","54.374586000","151.101.194.187","172.20.40.110","TLSv1.2","147","Application Data"
"485","54.374660900","172.20.40.110","151.101.194.187","TCP","54","50060  >  443 [ACK] Seq=333888 Ack=68504 Win=256 Len=0"
"486","54.393475800","172.20.40.110","151.101.194.187","TLSv1.2","2944","Application Data"
"487","54.397720600","172.20.40.110","151.101.194.187","TLSv1.2","2941","Application Data"
"488","54.403545600","151.101.194.187","172.20.40.110","TCP","60","443  >  50060 [ACK] Seq=68504 Ack=336778 Win=3903 Len=0"
"489","54.406818900","151.101.194.187","172.20.40.110","TCP","60","443  >  50060 [ACK] Seq=68504 Ack=339665 Win=3903 Len=0"
"490","54.406818900","151.101.194.187","172.20.40.110","TLSv1.2","124","Application Data"
"491","54.415613500","151.101.194.187","172.20.40.110","TLSv1.2","124","Application Data"
"492","54.415685000","172.20.40.110","151.101.194.187","TCP","54","50060  >  443 [ACK] Seq=339665 Ack=68644 Win=256 Len=0"
"493","54.875760000","172.20.40.110","151.101.194.187","TLSv1.2","2946","Application Data"
"494","54.889273400","151.101.194.187","172.20.40.110","TCP","60","443  >  50060 [ACK] Seq=68644 Ack=342557 Win=3903 Len=0"
"495","54.889273400","151.101.194.187","172.20.40.110","TLSv1.2","301","Application Data"
"496","54.931156400","151.101.194.187","172.20.40.110","TCP","301","[TCP Retransmission] 443  >  50060 [PSH, ACK] Seq=68644 Ack=342557 Win=3903 Len=247"
"497","54.931211500","172.20.40.110","151.101.194.187","TCP","66","50060  >  443 [ACK] Seq=342557 Ack=68891 Win=255 Len=0 SLE=68644 SRE=68891"
"498","55.048121800","172.20.40.110","151.101.194.187","TLSv1.2","2949","Application Data"
"499","55.048987700","172.20.40.110","151.101.194.187","TLSv1.2","2946","Application Data"
"500","55.049226200","172.20.40.110","151.101.194.187","TLSv1.2","2943","Application Data"
"501","55.068436000","151.101.194.187","172.20.40.110","TCP","60","443  >  50060 [ACK] Seq=68891 Ack=345452 Win=3903 Len=0"
"502","55.069853300","151.101.194.187","172.20.40.110","TCP","60","443  >  50060 [ACK] Seq=68891 Ack=348344 Win=3903 Len=0"
"503","55.069853300","151.101.194.187","172.20.40.110","TCP","60","443  >  50060 [ACK] Seq=68891 Ack=351233 Win=3903 Len=0"
"504","55.069853300","151.101.194.187","172.20.40.110","TLSv1.2","206","Application Data, Application Data"
"505","55.069937700","172.20.40.110","151.101.194.187","TCP","54","50060  >  443 [ACK] Seq=351233 Ack=69043 Win=254 Len=0"
"506","55.075533900","151.101.194.187","172.20.40.110","TLSv1.2","124","Application Data"
"507","55.088043200","172.20.40.110","151.101.194.187","TLSv1.2","2942","Application Data"
"508","55.097688700","151.101.194.187","172.20.40.110","TCP","60","443  >  50060 [ACK] Seq=69113 Ack=354121 Win=3903 Len=0"
"509","55.099986000","151.101.194.187","172.20.40.110","TLSv1.2","104","Application Data"
"510","55.138128900","151.101.194.187","172.20.40.110","TCP","104","[TCP Retransmission] 443  >  50060 [PSH, ACK] Seq=69113 Ack=354121 Win=3903 Len=50"
"511","55.138187800","172.20.40.110","151.101.194.187","TCP","66","50060  >  443 [ACK] Seq=354121 Ack=69163 Win=254 Len=0 SLE=69113 SRE=69163"
"512","55.341176000","172.20.40.110","151.101.194.187","TLSv1.2","2947","Application Data"
"513","55.350260700","151.101.194.187","172.20.40.110","TCP","60","443  >  50060 [ACK] Seq=69163 Ack=357014 Win=3903 Len=0"
"514","55.354896900","151.101.194.187","172.20.40.110","TLSv1.2","130","Application Data"
"515","55.391658700","151.101.194.187","172.20.40.110","TCP","130","[TCP Retransmission] 443  >  50060 [PSH, ACK] Seq=69163 Ack=357014 Win=3903 Len=76"
"516","55.391727200","172.20.40.110","151.101.194.187","TCP","66","50060  >  443 [ACK] Seq=357014 Ack=69239 Win=253 Len=0 SLE=69163 SRE=69239"
"517","56.215732000","172.20.40.110","151.101.194.187","TLSv1.2","2950","Application Data"
"518","56.227159800","151.101.194.187","172.20.40.110","TCP","60","443  >  50060 [ACK] Seq=69239 Ack=359910 Win=3903 Len=0"
"519","56.230059200","151.101.194.187","172.20.40.110","TLSv1.2","208","Application Data"
"520","56.267675800","151.101.194.187","172.20.40.110","TCP","208","[TCP Retransmission] 443  >  50060 [PSH, ACK] Seq=69239 Ack=359910 Win=3903 Len=154"
"521","56.267740300","172.20.40.110","151.101.194.187","TCP","66","50060  >  443 [ACK] Seq=359910 Ack=69393 Win=258 Len=0 SLE=69239 SRE=69393"
"522","59.875451100","172.20.40.110","151.101.194.187","TLSv1.2","2703","Application Data"
"523","59.887527200","151.101.194.187","172.20.40.110","TCP","60","443  >  50060 [ACK] Seq=69393 Ack=362559 Win=3914 Len=0"
"524","59.948084800","151.101.194.187","172.20.40.110","TLSv1.2","339","Application Data"
"525","59.948084800","151.101.194.187","172.20.40.110","TLSv1.2","357","Application Data"
"526","59.948172200","172.20.40.110","151.101.194.187","TCP","54","50060  >  443 [ACK] Seq=362559 Ack=69981 Win=256 Len=0"
"527","59.949644700","172.20.40.110","151.101.194.187","TLSv1.2","89","Application Data"
"528","59.958655000","151.101.194.187","172.20.40.110","TCP","60","443  >  50060 [ACK] Seq=69981 Ack=362594 Win=3914 Len=0"
